[I 2023-12-21 00:17:14,791] Trial 164 finished with value: inf and parameters: {'learning_rate': 0.9799585941059438, 'aft_loss_distribution': 'normal', 'aft_loss_distribution_scale': 1.5034839523019554, 'max_depth': 9, 'booster': 'gbtree', 'scale_pos_weight': 0.15740248656927183, 'alpha': 8.219290480124602, 'lambda': 9.691386988028166, 'eta': 0.0022891184386150077, 'sampling_method': 'gradient_based', 'subsample': 0.6557423193895021, 'gamma': 9.999337277573968}. Best is trial 158 with value: 1.916800969741346.
[I 2023-12-21 00:17:14,857] Trial 165 pruned. Trial was pruned at iteration 0.
[I 2023-12-21 00:17:14,921] Trial 166 pruned. Trial was pruned at iteration 0.
[I 2023-12-21 00:17:15,199] Trial 167 finished with value: 1.9199243086073432 and parameters: {'learning_rate': 0.9582953275486299, 'aft_loss_distribution': 'normal', 'aft_loss_distribution_scale': 1.3020742019520393, 'max_depth': 9, 'booster': 'gbtree', 'scale_pos_weight': 0.21469951463740522, 'alpha': 8.452372600195842, 'lambda': 9.649470444143384, 'eta': 0.0003147349845755141, 'sampling_method': 'gradient_based', 'subsample': 0.6602303512340187, 'gamma': 9.724625842419004}. Best is trial 158 with value: 1.916800969741346.
[I 2023-12-21 00:17:15,493] Trial 168 finished with value: 1.9218002539342887 and parameters: {'learning_rate': 0.9590787165793462, 'aft_loss_distribution': 'normal', 'aft_loss_distribution_scale': 1.2855028482436688, 'max_depth': 9, 'booster': 'gbtree', 'scale_pos_weight': 0.04381688449617438, 'alpha': 8.960045268488688, 'lambda': 9.281854558109261, 'eta': 0.030386354280881604, 'sampling_method': 'gradient_based', 'subsample': 0.6413298648433805, 'gamma': 9.63562787298312}. Best is trial 158 with value: 1.916800969741346.
[I 2023-12-21 00:17:16,210] Trial 169 finished with value: 1.9226902708890892 and parameters: {'learning_rate': 0.9979081027200345, 'aft_loss_distribution': 'normal', 'aft_loss_distribution_scale': 1.252928478261088, 'max_depth': 8, 'booster': 'gbtree', 'scale_pos_weight': 0.05048331315860011, 'alpha': 9.53910002695141, 'lambda': 9.057452849404006, 'eta': 0.05145433785602513, 'sampling_method': 'gradient_based', 'subsample': 0.6410927302008184, 'gamma': 9.747853257494791}. Best is trial 158 with value: 1.916800969741346.
[I 2023-12-21 00:17:16,848] Trial 170 finished with value: 1.922416467844051 and parameters: {'learning_rate': 0.9996588358173338, 'aft_loss_distribution': 'normal', 'aft_loss_distribution_scale': 1.2305019883986086, 'max_depth': 8, 'booster': 'gbtree', 'scale_pos_weight': 0.046858951506017404, 'alpha': 9.761291554741588, 'lambda': 9.318786055305475, 'eta': 0.00023225886635600337, 'sampling_method': 'gradient_based', 'subsample': 0.6403172655278353, 'gamma': 9.732409934002654}. Best is trial 158 with value: 1.916800969741346.
[I 2023-12-21 00:17:17,410] Trial 171 finished with value: 1.9244037488141885 and parameters: {'learning_rate': 0.99394959186701, 'aft_loss_distribution': 'normal', 'aft_loss_distribution_scale': 1.2016238728129158, 'max_depth': 8, 'booster': 'gbtree', 'scale_pos_weight': 0.05861976185285243, 'alpha': 9.581739560517795, 'lambda': 9.306797631578071, 'eta': 0.052451899332520494, 'sampling_method': 'gradient_based', 'subsample': 0.6107512252660977, 'gamma': 9.637797113021229}. Best is trial 158 with value: 1.916800969741346.
[I 2023-12-21 00:17:17,840] Trial 172 finished with value: 1.9163647503126569 and parameters: {'learning_rate': 0.9991831037095017, 'aft_loss_distribution': 'normal', 'aft_loss_distribution_scale': 1.3259346676658257, 'max_depth': 8, 'booster': 'gbtree', 'scale_pos_weight': 0.0446331503090898, 'alpha': 9.643551978302948, 'lambda': 9.289502625096743, 'eta': 0.005009564359600337, 'sampling_method': 'gradient_based', 'subsample': 0.6139201323960345, 'gamma': 9.748487623516132}. Best is trial 172 with value: 1.9163647503126569.
[I 2023-12-21 00:17:17,940] Trial 173 pruned. Trial was pruned at iteration 0.
[I 2023-12-21 00:17:18,367] Trial 174 finished with value: 1.9241533023615736 and parameters: {'learning_rate': 0.9993855684201598, 'aft_loss_distribution': 'normal', 'aft_loss_distribution_scale': 1.2256071996356048, 'max_depth': 8, 'booster': 'gbtree', 'scale_pos_weight': 0.11351859071015552, 'alpha': 9.454246279434233, 'lambda': 9.301207524639098, 'eta': 0.05576135042216146, 'sampling_method': 'gradient_based', 'subsample': 0.6378460801766004, 'gamma': 9.410127141847092}. Best is trial 172 with value: 1.9163647503126569.
[I 2023-12-21 00:17:18,762] Trial 175 finished with value: 1.9234982693885545 and parameters: {'learning_rate': 0.9740258739014187, 'aft_loss_distribution': 'normal', 'aft_loss_distribution_scale': 1.1990049947921153, 'max_depth': 8, 'booster': 'gbtree', 'scale_pos_weight': 0.0431531817036475, 'alpha': 9.873333952859706, 'lambda': 9.235416728282328, 'eta': 0.054751785491489735, 'sampling_method': 'gradient_based', 'subsample': 0.6399230627414237, 'gamma': 9.437130597013804}. Best is trial 172 with value: 1.9163647503126569.
[I 2023-12-21 00:17:19,228] Trial 176 finished with value: 1.9222336390558459 and parameters: {'learning_rate': 0.9731052347075088, 'aft_loss_distribution': 'normal', 'aft_loss_distribution_scale': 1.2067386939928768, 'max_depth': 8, 'booster': 'gbtree', 'scale_pos_weight': 0.13349039948047434, 'alpha': 9.919936460912066, 'lambda': 9.320081293112231, 'eta': 0.05735149508690737, 'sampling_method': 'gradient_based', 'subsample': 0.6384915342626262, 'gamma': 9.451101851677281}. Best is trial 172 with value: 1.9163647503126569.
[I 2023-12-21 00:17:19,647] Trial 177 finished with value: 1.9236745517585183 and parameters: {'learning_rate': 0.9755985936003804, 'aft_loss_distribution': 'normal', 'aft_loss_distribution_scale': 1.2189545216582531, 'max_depth': 8, 'booster': 'gbtree', 'scale_pos_weight': 0.2754670570334467, 'alpha': 9.853709759369615, 'lambda': 9.045319723620176, 'eta': 0.05812275523867586, 'sampling_method': 'gradient_based', 'subsample': 0.5799310322751827, 'gamma': 9.464432490040739}. Best is trial 172 with value: 1.9163647503126569.
[I 2023-12-21 00:17:20,047] Trial 178 finished with value: 1.9224086164442338 and parameters: {'learning_rate': 0.9991194536132422, 'aft_loss_distribution': 'normal', 'aft_loss_distribution_scale': 1.2116685067082567, 'max_depth': 8, 'booster': 'gbtree', 'scale_pos_weight': 0.2642308828985436, 'alpha': 9.858303127432318, 'lambda': 9.123914684895254, 'eta': 0.05173127343081052, 'sampling_method': 'gradient_based', 'subsample': 0.5809741379582829, 'gamma': 9.523904464595171}. Best is trial 172 with value: 1.9163647503126569.
[I 2023-12-21 00:17:20,413] Trial 179 finished with value: 1.9250241143938929 and parameters: {'learning_rate': 0.9955461194434818, 'aft_loss_distribution': 'normal', 'aft_loss_distribution_scale': 1.1623606011916021, 'max_depth': 8, 'booster': 'gbtree', 'scale_pos_weight': 0.2786148722424663, 'alpha': 9.785394785836699, 'lambda': 9.009495048093163, 'eta': 0.06046118307550881, 'sampling_method': 'gradient_based', 'subsample': 0.5856378838187488, 'gamma': 9.422626273705488}. Best is trial 172 with value: 1.9163647503126569.
[I 2023-12-21 00:17:20,483] Trial 180 pruned. Trial was pruned at iteration 0.
[I 2023-12-21 00:17:20,912] Trial 181 finished with value: 1.922128810951602 and parameters: {'learning_rate': 0.9984926727167321, 'aft_loss_distribution': 'normal', 'aft_loss_distribution_scale': 1.225302197461608, 'max_depth': 8, 'booster': 'gbtree', 'scale_pos_weight': 0.2771787292329677, 'alpha': 9.984478197214308, 'lambda': 9.06513057970476, 'eta': 0.051412294437772774, 'sampling_method': 'gradient_based', 'subsample': 0.5898835564678003, 'gamma': 9.491205533206518}. Best is trial 172 with value: 1.9163647503126569.
[I 2023-12-21 00:17:21,194] Trial 182 finished with value: 1.9183568347794746 and parameters: {'learning_rate': 0.9983923075918897, 'aft_loss_distribution': 'normal', 'aft_loss_distribution_scale': 1.326378872605779, 'max_depth': 8, 'booster': 'gbtree', 'scale_pos_weight': 0.2849877555801643, 'alpha': 9.951966172036167, 'lambda': 9.3151618665861, 'eta': 0.05201437737294445, 'sampling_method': 'gradient_based', 'subsample': 0.5738253982880802, 'gamma': 9.549554022148005}. Best is trial 172 with value: 1.9163647503126569.
[I 2023-12-21 00:17:21,421] Trial 183 finished with value: inf and parameters: {'learning_rate': 0.9733410864691325, 'aft_loss_distribution': 'normal', 'aft_loss_distribution_scale': 1.0757089063247818, 'max_depth': 8, 'booster': 'gbtree', 'scale_pos_weight': 0.25531198012950335, 'alpha': 9.959375228453142, 'lambda': 8.690346745716294, 'eta': 0.05904810794755488, 'sampling_method': 'gradient_based', 'subsample': 0.5790717087514438, 'gamma': 9.868125588665038}. Best is trial 172 with value: 1.9163647503126569.
[I 2023-12-21 00:17:21,708] Trial 184 finished with value: 1.9161904938134602 and parameters: {'learning_rate': 0.9995776051991911, 'aft_loss_distribution': 'normal', 'aft_loss_distribution_scale': 1.378687264999481, 'max_depth': 8, 'booster': 'gbtree', 'scale_pos_weight': 0.16401848801276864, 'alpha': 9.838879479075178, 'lambda': 9.09336938727981, 'eta': 0.044697515810949426, 'sampling_method': 'gradient_based', 'subsample': 0.5677698818683502, 'gamma': 9.405060149055881}. Best is trial 184 with value: 1.9161904938134602.
[I 2023-12-21 00:17:21,777] Trial 185 pruned. Trial was pruned at iteration 0.
[I 2023-12-21 00:17:22,000] Trial 186 finished with value: inf and parameters: {'learning_rate': 0.9630556036454542, 'aft_loss_distribution': 'normal', 'aft_loss_distribution_scale': 1.3505119477406842, 'max_depth': 8, 'booster': 'gbtree', 'scale_pos_weight': 0.1784785004323158, 'alpha': 9.961141431448006, 'lambda': 9.336807912052025, 'eta': 0.04278158638514258, 'sampling_method': 'gradient_based', 'subsample': 0.5695547873420814, 'gamma': 9.16925441288929}. Best is trial 184 with value: 1.9161904938134602.
[I 2023-12-21 00:17:22,072] Trial 187 pruned. Trial was pruned at iteration 0.
[I 2023-12-21 00:17:22,134] Trial 188 pruned. Trial was pruned at iteration 0.
[I 2023-12-21 00:17:22,198] Trial 189 pruned. Trial was pruned at iteration 0.
[I 2023-12-21 00:17:22,262] Trial 190 pruned. Trial was pruned at iteration 0.
[I 2023-12-21 00:17:22,452] Trial 191 finished with value: inf and parameters: {'learning_rate': 0.9981917926320848, 'aft_loss_distribution': 'normal', 'aft_loss_distribution_scale': 1.2616494777348133, 'max_depth': 8, 'booster': 'gbtree', 'scale_pos_weight': 0.04215701348118937, 'alpha': 9.39819281212048, 'lambda': 9.286924834610353, 'eta': 0.06284756510623409, 'sampling_method': 'gradient_based', 'subsample': 0.6344205019787859, 'gamma': 9.36072932529482}. Best is trial 184 with value: 1.9161904938134602.
[I 2023-12-21 00:17:22,516] Trial 192 pruned. Trial was pruned at iteration 0.
[I 2023-12-21 00:17:22,854] Trial 193 finished with value: 1.9167035963664238 and parameters: {'learning_rate': 0.982562144542579, 'aft_loss_distribution': 'normal', 'aft_loss_distribution_scale': 1.4128676820398223, 'max_depth': 8, 'booster': 'gbtree', 'scale_pos_weight': 0.21397700113265425, 'alpha': 9.807396871010194, 'lambda': 9.169091776919604, 'eta': 0.0745803598000252, 'sampling_method': 'gradient_based', 'subsample': 0.5979308047007619, 'gamma': 9.130612327245046}. Best is trial 184 with value: 1.9161904938134602.
[I 2023-12-21 00:17:23,193] Trial 194 finished with value: 1.9140885910379133 and parameters: {'learning_rate': 0.975667916895296, 'aft_loss_distribution': 'normal', 'aft_loss_distribution_scale': 1.5009997907848058, 'max_depth': 8, 'booster': 'gbtree', 'scale_pos_weight': 0.2340304115315542, 'alpha': 9.910137104337851, 'lambda': 9.134210166795324, 'eta': 0.0372173005058367, 'sampling_method': 'gradient_based', 'subsample': 0.5668044697303233, 'gamma': 9.216062771909606}. Best is trial 194 with value: 1.9140885910379133.
[I 2023-12-21 00:17:23,484] Trial 195 finished with value: 1.9172112847128269 and parameters: {'learning_rate': 0.9996313319632036, 'aft_loss_distribution': 'normal', 'aft_loss_distribution_scale': 1.4422974210389818, 'max_depth': 8, 'booster': 'gbtree', 'scale_pos_weight': 0.2213978752809711, 'alpha': 9.946124310447304, 'lambda': 9.183154388198012, 'eta': 0.034617443888635274, 'sampling_method': 'gradient_based', 'subsample': 0.6026013413297201, 'gamma': 9.13211572399947}. Best is trial 194 with value: 1.9140885910379133.
[I 2023-12-21 00:17:23,823] Trial 196 finished with value: 1.9175875093810562 and parameters: {'learning_rate': 0.9828443213309911, 'aft_loss_distribution': 'normal', 'aft_loss_distribution_scale': 1.3821191141378937, 'max_depth': 8, 'booster': 'gbtree', 'scale_pos_weight': 0.2012091547836416, 'alpha': 9.98778058731868, 'lambda': 9.583292106354289, 'eta': 0.029942451123448774, 'sampling_method': 'gradient_based', 'subsample': 0.5516063262440505, 'gamma': 9.210004620665808}. Best is trial 194 with value: 1.9140885910379133.
[I 2023-12-21 00:17:24,136] Trial 197 finished with value: 1.9184240232349803 and parameters: {'learning_rate': 0.9605746730116206, 'aft_loss_distribution': 'normal', 'aft_loss_distribution_scale': 1.5182914616166339, 'max_depth': 8, 'booster': 'gbtree', 'scale_pos_weight': 0.487431878136625, 'alpha': 9.994452357819698, 'lambda': 9.525459297677799, 'eta': 0.026763680652651625, 'sampling_method': 'gradient_based', 'subsample': 0.5404998052322835, 'gamma': 9.194263639827481}. Best is trial 194 with value: 1.9140885910379133.
[I 2023-12-21 00:17:24,451] Trial 198 finished with value: 1.9154920070606307 and parameters: {'learning_rate': 0.9578789854200442, 'aft_loss_distribution': 'normal', 'aft_loss_distribution_scale': 1.4841618989166367, 'max_depth': 8, 'booster': 'gbtree', 'scale_pos_weight': 0.22761582912173095, 'alpha': 9.92036979878562, 'lambda': 9.551183114588465, 'eta': 0.03274964000925419, 'sampling_method': 'gradient_based', 'subsample': 0.5393475465611021, 'gamma': 9.15488917095539}. Best is trial 194 with value: 1.9140885910379133.
[I 2023-12-21 00:17:24,528] Trial 199 pruned. Trial was pruned at iteration 0.
[I 2023-12-21 00:17:25,219] Trial 200 finished with value: 1.9128183590332688 and parameters: {'learning_rate': 0.9491457585300768, 'aft_loss_distribution': 'normal', 'aft_loss_distribution_scale': 1.474510723316629, 'max_depth': 8, 'booster': 'gbtree', 'scale_pos_weight': 0.2163781549533984, 'alpha': 9.985202736567999, 'lambda': 9.54039057188359, 'eta': 0.08308723289172484, 'sampling_method': 'gradient_based', 'subsample': 0.5339957048319417, 'gamma': 9.139079925574295}. Best is trial 200 with value: 1.9128183590332688.
[I 2023-12-21 00:17:25,680] Trial 201 finished with value: 1.917953525513288 and parameters: {'learning_rate': 0.958427552103605, 'aft_loss_distribution': 'normal', 'aft_loss_distribution_scale': 1.3771371574616451, 'max_depth': 8, 'booster': 'gbtree', 'scale_pos_weight': 0.20965282980323008, 'alpha': 9.964950545667875, 'lambda': 9.559809403316384, 'eta': 0.0809690200300828, 'sampling_method': 'gradient_based', 'subsample': 0.562738434714623, 'gamma': 8.70474626043034}. Best is trial 200 with value: 1.9128183590332688.
[I 2023-12-21 00:17:26,093] Trial 202 finished with value: 1.9138421688044118 and parameters: {'learning_rate': 0.9525817672642476, 'aft_loss_distribution': 'normal', 'aft_loss_distribution_scale': 1.469292265511344, 'max_depth': 8, 'booster': 'gbtree', 'scale_pos_weight': 0.20669332207687358, 'alpha': 9.96736079494577, 'lambda': 9.571298556467335, 'eta': 0.08276916513843091, 'sampling_method': 'gradient_based', 'subsample': 0.5341943491815789, 'gamma': 9.075043042991508}. Best is trial 200 with value: 1.9128183590332688.
[I 2023-12-21 00:17:26,544] Trial 203 finished with value: 1.917248712887124 and parameters: {'learning_rate': 0.9540869538305116, 'aft_loss_distribution': 'normal', 'aft_loss_distribution_scale': 1.495598851114193, 'max_depth': 8, 'booster': 'gbtree', 'scale_pos_weight': 0.18912623863259315, 'alpha': 9.632863139925961, 'lambda': 9.589961858215899, 'eta': 0.08178279084502242, 'sampling_method': 'gradient_based', 'subsample': 0.5518895971630222, 'gamma': 8.658195794217649}. Best is trial 200 with value: 1.9128183590332688.
[I 2023-12-21 00:17:27,034] Trial 204 finished with value: 1.9155837471693982 and parameters: {'learning_rate': 0.9201295165865974, 'aft_loss_distribution': 'normal', 'aft_loss_distribution_scale': 1.5675311034480934, 'max_depth': 8, 'booster': 'gbtree', 'scale_pos_weight': 0.21003198584172791, 'alpha': 9.65837678989908, 'lambda': 9.586950909418993, 'eta': 0.08475312370657836, 'sampling_method': 'gradient_based', 'subsample': 0.5249296112527958, 'gamma': 8.694895275422297}. Best is trial 200 with value: 1.9128183590332688.
[I 2023-12-21 00:17:27,282] Trial 205 finished with value: 1.9162997996804005 and parameters: {'learning_rate': 0.917675553382849, 'aft_loss_distribution': 'normal', 'aft_loss_distribution_scale': 1.4561981039588359, 'max_depth': 8, 'booster': 'gbtree', 'scale_pos_weight': 0.45864098142146137, 'alpha': 9.632015426352483, 'lambda': 9.560346784406418, 'eta': 0.08673840735739735, 'sampling_method': 'gradient_based', 'subsample': 0.5275735227954204, 'gamma': 8.713413888658964}. Best is trial 200 with value: 1.9128183590332688.
[I 2023-12-21 00:17:27,872] Trial 206 finished with value: 1.9137322570172441 and parameters: {'learning_rate': 0.9183332908680573, 'aft_loss_distribution': 'normal', 'aft_loss_distribution_scale': 1.4963795619230236, 'max_depth': 8, 'booster': 'gbtree', 'scale_pos_weight': 0.32912898299483306, 'alpha': 9.651586752646612, 'lambda': 9.544509416542237, 'eta': 0.08458969317379031, 'sampling_method': 'gradient_based', 'subsample': 0.5354349710397771, 'gamma': 8.647994731299466}. Best is trial 200 with value: 1.9128183590332688.
[I 2023-12-21 00:17:28,183] Trial 207 finished with value: 1.912177719928786 and parameters: {'learning_rate': 0.9145832855385654, 'aft_loss_distribution': 'normal', 'aft_loss_distribution_scale': 1.4569182751160143, 'max_depth': 8, 'booster': 'gbtree', 'scale_pos_weight': 0.3177058551397881, 'alpha': 9.64141194024936, 'lambda': 9.508491110700973, 'eta': 0.08751994941347287, 'sampling_method': 'gradient_based', 'subsample': 0.5311423016839758, 'gamma': 8.700019685246268}. Best is trial 207 with value: 1.912177719928786.
[I 2023-12-21 00:17:28,255] Trial 208 pruned. Trial was pruned at iteration 0.
[I 2023-12-21 00:17:28,322] Trial 209 pruned. Trial was pruned at iteration 0.
[I 2023-12-21 00:17:28,679] Trial 210 finished with value: 1.9138529522994974 and parameters: {'learning_rate': 0.9205683662752314, 'aft_loss_distribution': 'normal', 'aft_loss_distribution_scale': 1.5019978289544287, 'max_depth': 8, 'booster': 'gbtree', 'scale_pos_weight': 0.4565958477632656, 'alpha': 9.241477963317644, 'lambda': 9.531372096865375, 'eta': 0.08651743191632834, 'sampling_method': 'gradient_based', 'subsample': 0.5156391934737051, 'gamma': 8.411692650884353}. Best is trial 207 with value: 1.912177719928786.
[I 2023-12-21 00:17:28,895] Trial 211 finished with value: inf and parameters: {'learning_rate': 0.9204267654549987, 'aft_loss_distribution': 'normal', 'aft_loss_distribution_scale': 1.472669284845694, 'max_depth': 8, 'booster': 'gbtree', 'scale_pos_weight': 0.4271736819097973, 'alpha': 9.282281102533013, 'lambda': 9.482281565718502, 'eta': 0.0874868283524174, 'sampling_method': 'gradient_based', 'subsample': 0.515804465455867, 'gamma': 8.476152755516942}. Best is trial 207 with value: 1.912177719928786.
[I 2023-12-21 00:17:29,116] Trial 212 finished with value: inf and parameters: {'learning_rate': 0.9466997355107776, 'aft_loss_distribution': 'normal', 'aft_loss_distribution_scale': 1.4832813134045835, 'max_depth': 8, 'booster': 'gbtree', 'scale_pos_weight': 0.33433910840800446, 'alpha': 9.993090011779081, 'lambda': 9.508666516498403, 'eta': 0.08427893860574606, 'sampling_method': 'gradient_based', 'subsample': 0.5409594890472039, 'gamma': 8.767386293770405}. Best is trial 207 with value: 1.912177719928786.
[I 2023-12-21 00:17:29,186] Trial 213 pruned. Trial was pruned at iteration 0.
[I 2023-12-21 00:17:29,477] Trial 214 finished with value: 1.9177830529836537 and parameters: {'learning_rate': 0.9069269721613035, 'aft_loss_distribution': 'normal', 'aft_loss_distribution_scale': 1.5721471886436291, 'max_depth': 8, 'booster': 'gbtree', 'scale_pos_weight': 0.251130205184006, 'alpha': 9.200928196946622, 'lambda': 9.408507677021737, 'eta': 0.0824303832419137, 'sampling_method': 'gradient_based', 'subsample': 0.5053566637974723, 'gamma': 9.083951839718647}. Best is trial 207 with value: 1.912177719928786.
[I 2023-12-21 00:17:30,186] Trial 215 pruned. Trial was pruned at iteration 287.
[I 2023-12-21 00:17:30,597] Trial 216 finished with value: 1.9142646967584251 and parameters: {'learning_rate': 0.92640155872393, 'aft_loss_distribution': 'normal', 'aft_loss_distribution_scale': 1.4017510904386448, 'max_depth': 8, 'booster': 'gbtree', 'scale_pos_weight': 0.5635715356298705, 'alpha': 9.998795469476448, 'lambda': 9.502202205752628, 'eta': 0.08407027169998847, 'sampling_method': 'gradient_based', 'subsample': 0.52959812981945, 'gamma': 8.658460401001657}. Best is trial 207 with value: 1.912177719928786.
[I 2023-12-21 00:17:30,699] Trial 217 pruned. Trial was pruned at iteration 0.
[I 2023-12-21 00:17:30,803] Trial 218 pruned. Trial was pruned at iteration 0.
[I 2023-12-21 00:17:30,909] Trial 219 pruned. Trial was pruned at iteration 0.
[I 2023-12-21 00:17:31,447] Trial 220 finished with value: 1.9209153707495006 and parameters: {'learning_rate': 0.9182311121722071, 'aft_loss_distribution': 'normal', 'aft_loss_distribution_scale': 1.6251383946249305, 'max_depth': 8, 'booster': 'gbtree', 'scale_pos_weight': 0.22431338587735555, 'alpha': 9.333083880896647, 'lambda': 8.863784097535472, 'eta': 0.07847808537818719, 'sampling_method': 'gradient_based', 'subsample': 0.5386396946363596, 'gamma': 9.05634057797038}. Best is trial 207 with value: 1.912177719928786.
