[I 2023-12-21 00:13:09,958] Trial 200 pruned. Trial was pruned at iteration 0.
[I 2023-12-21 00:13:10,064] Trial 201 pruned. Trial was pruned at iteration 0.
[I 2023-12-21 00:13:15,480] Trial 202 finished with value: 1.9258937708517023 and parameters: {'learning_rate': 0.9414754403779879, 'aft_loss_distribution': 'normal', 'aft_loss_distribution_scale': 1.71245930605183, 'max_depth': 5, 'booster': 'dart', 'scale_pos_weight': 2.190936603745764, 'alpha': 3.8356047286337693, 'lambda': 8.689194462767585, 'eta': 0.8824746652183568, 'sampling_method': 'uniform', 'subsample': 0.46055478972309805, 'gamma': 8.04512007285845}. Best is trial 77 with value: 1.9163923221585393.
[I 2023-12-21 00:13:17,549] Trial 203 finished with value: inf and parameters: {'learning_rate': 0.943071275439956, 'aft_loss_distribution': 'normal', 'aft_loss_distribution_scale': 1.747998900726294, 'max_depth': 5, 'booster': 'dart', 'scale_pos_weight': 2.0883213573383315, 'alpha': 3.8433420621600254, 'lambda': 8.6621191596403, 'eta': 0.8811930646550565, 'sampling_method': 'uniform', 'subsample': 0.4557284216307841, 'gamma': 8.05009083126595}. Best is trial 77 with value: 1.9163923221585393.
[I 2023-12-21 00:13:19,359] Trial 204 finished with value: inf and parameters: {'learning_rate': 0.9800444432799107, 'aft_loss_distribution': 'normal', 'aft_loss_distribution_scale': 1.4665258668357426, 'max_depth': 5, 'booster': 'dart', 'scale_pos_weight': 2.188527093143619, 'alpha': 4.177463462843387, 'lambda': 9.771848976154871, 'eta': 0.9237198072571501, 'sampling_method': 'uniform', 'subsample': 0.3943609361957266, 'gamma': 7.888659828786574}. Best is trial 77 with value: 1.9163923221585393.
[I 2023-12-21 00:13:25,318] Trial 205 finished with value: 1.9262964378026026 and parameters: {'learning_rate': 0.9237762514111634, 'aft_loss_distribution': 'normal', 'aft_loss_distribution_scale': 1.7245695519911708, 'max_depth': 5, 'booster': 'dart', 'scale_pos_weight': 2.313741366778593, 'alpha': 4.351142178891018, 'lambda': 9.102445744505218, 'eta': 0.9030176032174914, 'sampling_method': 'uniform', 'subsample': 0.4808588799895131, 'gamma': 8.367762713670656}. Best is trial 77 with value: 1.9163923221585393.
[I 2023-12-21 00:13:25,433] Trial 206 pruned. Trial was pruned at iteration 0.
[I 2023-12-21 00:13:25,533] Trial 207 pruned. Trial was pruned at iteration 0.
[I 2023-12-21 00:13:37,553] Trial 208 finished with value: 1.923522986064042 and parameters: {'learning_rate': 0.9413609043079626, 'aft_loss_distribution': 'normal', 'aft_loss_distribution_scale': 1.6419354485103856, 'max_depth': 5, 'booster': 'dart', 'scale_pos_weight': 1.9450156934579377, 'alpha': 4.725817291755531, 'lambda': 8.884266389341116, 'eta': 0.8962726381385875, 'sampling_method': 'uniform', 'subsample': 0.5331975249637853, 'gamma': 8.035867538095443}. Best is trial 77 with value: 1.9163923221585393.
[I 2023-12-21 00:13:37,624] Trial 209 pruned. Trial was pruned at iteration 0.
[I 2023-12-21 00:13:37,722] Trial 210 pruned. Trial was pruned at iteration 0.
[I 2023-12-21 00:13:44,013] Trial 211 finished with value: 1.9292267051781904 and parameters: {'learning_rate': 0.9458933380686052, 'aft_loss_distribution': 'normal', 'aft_loss_distribution_scale': 1.692499580198843, 'max_depth': 5, 'booster': 'dart', 'scale_pos_weight': 2.186235051166932, 'alpha': 4.542751992010825, 'lambda': 8.757018989927786, 'eta': 0.8998007899906988, 'sampling_method': 'uniform', 'subsample': 0.4803231168378134, 'gamma': 7.75351818129445}. Best is trial 77 with value: 1.9163923221585393.
[I 2023-12-21 00:13:44,081] Trial 212 pruned. Trial was pruned at iteration 0.
[I 2023-12-21 00:13:47,760] Trial 213 finished with value: 1.9291862072603807 and parameters: {'learning_rate': 0.94571525005915, 'aft_loss_distribution': 'normal', 'aft_loss_distribution_scale': 1.7448657814611437, 'max_depth': 5, 'booster': 'dart', 'scale_pos_weight': 2.285810058014904, 'alpha': 4.837797887113924, 'lambda': 8.719286652514525, 'eta': 0.8659609554333872, 'sampling_method': 'uniform', 'subsample': 0.4553054283413004, 'gamma': 8.311736397344157}. Best is trial 77 with value: 1.9163923221585393.
[I 2023-12-21 00:13:49,383] Trial 214 finished with value: inf and parameters: {'learning_rate': 0.9470521360233403, 'aft_loss_distribution': 'normal', 'aft_loss_distribution_scale': 1.4369955940225871, 'max_depth': 5, 'booster': 'dart', 'scale_pos_weight': 2.302075953559887, 'alpha': 4.593406590372657, 'lambda': 8.522744737804707, 'eta': 0.9239857585781229, 'sampling_method': 'uniform', 'subsample': 0.4766181779106514, 'gamma': 8.326918325311985}. Best is trial 77 with value: 1.9163923221585393.
[I 2023-12-21 00:13:49,453] Trial 215 pruned. Trial was pruned at iteration 1.
[I 2023-12-21 00:13:50,908] Trial 216 finished with value: inf and parameters: {'learning_rate': 0.9553683862421811, 'aft_loss_distribution': 'normal', 'aft_loss_distribution_scale': 1.6682045474597944, 'max_depth': 5, 'booster': 'dart', 'scale_pos_weight': 2.262339473708579, 'alpha': 4.045099978202871, 'lambda': 9.1260859089076, 'eta': 0.8979564343411721, 'sampling_method': 'uniform', 'subsample': 0.44600202418561696, 'gamma': 8.146833550248987}. Best is trial 77 with value: 1.9163923221585393.
[I 2023-12-21 00:13:50,983] Trial 217 pruned. Trial was pruned at iteration 0.
[I 2023-12-21 00:13:51,046] Trial 218 pruned. Trial was pruned at iteration 0.
[I 2023-12-21 00:13:51,122] Trial 219 pruned. Trial was pruned at iteration 1.
[I 2023-12-21 00:13:51,185] Trial 220 pruned. Trial was pruned at iteration 0.
[I 2023-12-21 00:13:51,249] Trial 221 pruned. Trial was pruned at iteration 0.
[I 2023-12-21 00:13:55,130] Trial 222 finished with value: 1.9282247087741482 and parameters: {'learning_rate': 0.9692584796692808, 'aft_loss_distribution': 'normal', 'aft_loss_distribution_scale': 1.706375121341802, 'max_depth': 5, 'booster': 'dart', 'scale_pos_weight': 2.2396898612082605, 'alpha': 4.226183839886864, 'lambda': 8.778684691711428, 'eta': 0.874654466412524, 'sampling_method': 'uniform', 'subsample': 0.46222698689413505, 'gamma': 7.860602624244202}. Best is trial 77 with value: 1.9163923221585393.
[I 2023-12-21 00:13:57,113] Trial 223 finished with value: inf and parameters: {'learning_rate': 0.9797446609213217, 'aft_loss_distribution': 'normal', 'aft_loss_distribution_scale': 1.490631110729269, 'max_depth': 5, 'booster': 'dart', 'scale_pos_weight': 2.240518785888155, 'alpha': 4.197986298149457, 'lambda': 8.46232163444627, 'eta': 0.844927143980553, 'sampling_method': 'uniform', 'subsample': 0.45532250531764623, 'gamma': 7.906626886881292}. Best is trial 77 with value: 1.9163923221585393.
[I 2023-12-21 00:13:58,648] Trial 224 finished with value: inf and parameters: {'learning_rate': 0.9645385631697965, 'aft_loss_distribution': 'normal', 'aft_loss_distribution_scale': 1.706658155125008, 'max_depth': 5, 'booster': 'dart', 'scale_pos_weight': 2.164302856358087, 'alpha': 4.373141766898484, 'lambda': 8.740887018376116, 'eta': 0.8978961395463678, 'sampling_method': 'uniform', 'subsample': 0.505435972870538, 'gamma': 8.076112409382711}. Best is trial 77 with value: 1.9163923221585393.
[I 2023-12-21 00:13:58,721] Trial 225 pruned. Trial was pruned at iteration 1.
[I 2023-12-21 00:14:00,204] Trial 226 finished with value: inf and parameters: {'learning_rate': 0.9765780660276397, 'aft_loss_distribution': 'normal', 'aft_loss_distribution_scale': 1.337711533445594, 'max_depth': 5, 'booster': 'dart', 'scale_pos_weight': 2.279601807191535, 'alpha': 3.6768560662106875, 'lambda': 8.375984396643604, 'eta': 0.28952053669666283, 'sampling_method': 'uniform', 'subsample': 0.46053172654146535, 'gamma': 8.40579307579107}. Best is trial 77 with value: 1.9163923221585393.
[I 2023-12-21 00:14:01,664] Trial 227 finished with value: inf and parameters: {'learning_rate': 0.9374337740551846, 'aft_loss_distribution': 'normal', 'aft_loss_distribution_scale': 1.6157741753589534, 'max_depth': 5, 'booster': 'dart', 'scale_pos_weight': 2.0981006765848065, 'alpha': 4.070428042862511, 'lambda': 8.686694884907512, 'eta': 0.9179774892067806, 'sampling_method': 'uniform', 'subsample': 0.42981586258568216, 'gamma': 8.155288450205115}. Best is trial 77 with value: 1.9163923221585393.
[I 2023-12-21 00:14:01,745] Trial 228 pruned. Trial was pruned at iteration 2.
[I 2023-12-21 00:14:01,808] Trial 229 pruned. Trial was pruned at iteration 0.
[I 2023-12-21 00:14:01,871] Trial 230 pruned. Trial was pruned at iteration 0.
[I 2023-12-21 00:14:01,936] Trial 231 pruned. Trial was pruned at iteration 0.
[I 2023-12-21 00:14:09,954] Trial 232 finished with value: 1.9282029574255202 and parameters: {'learning_rate': 0.9386037464017463, 'aft_loss_distribution': 'normal', 'aft_loss_distribution_scale': 1.713988905885017, 'max_depth': 5, 'booster': 'dart', 'scale_pos_weight': 2.4116277433622844, 'alpha': 4.971135168311086, 'lambda': 8.61355016180828, 'eta': 0.8976172226810246, 'sampling_method': 'uniform', 'subsample': 0.4018246961839396, 'gamma': 7.750936795316976}. Best is trial 77 with value: 1.9163923221585393.
[I 2023-12-21 00:14:10,060] Trial 233 pruned. Trial was pruned at iteration 1.
[I 2023-12-21 00:14:12,129] Trial 234 finished with value: inf and parameters: {'learning_rate': 0.9700766531949128, 'aft_loss_distribution': 'normal', 'aft_loss_distribution_scale': 1.5372399195591608, 'max_depth': 5, 'booster': 'dart', 'scale_pos_weight': 2.4560120163629824, 'alpha': 5.059949381782352, 'lambda': 8.362282734733165, 'eta': 0.8965047696613755, 'sampling_method': 'uniform', 'subsample': 0.39626869052571356, 'gamma': 8.232863366035557}. Best is trial 77 with value: 1.9163923221585393.
[I 2023-12-21 00:14:12,207] Trial 235 pruned. Trial was pruned at iteration 0.
[I 2023-12-21 00:14:12,275] Trial 236 pruned. Trial was pruned at iteration 0.
[I 2023-12-21 00:14:13,810] Trial 237 finished with value: inf and parameters: {'learning_rate': 0.9885867882490936, 'aft_loss_distribution': 'normal', 'aft_loss_distribution_scale': 1.439206137394727, 'max_depth': 5, 'booster': 'dart', 'scale_pos_weight': 2.233194810150113, 'alpha': 4.445265366392617, 'lambda': 9.042409618969298, 'eta': 0.9393439986371203, 'sampling_method': 'uniform', 'subsample': 0.3826578312532414, 'gamma': 7.507503174241929}. Best is trial 77 with value: 1.9163923221585393.
[I 2023-12-21 00:14:13,881] Trial 238 pruned. Trial was pruned at iteration 0.
[I 2023-12-21 00:14:13,944] Trial 239 pruned. Trial was pruned at iteration 0.
[I 2023-12-21 00:14:14,008] Trial 240 pruned. Trial was pruned at iteration 0.
[I 2023-12-21 00:14:14,077] Trial 241 pruned. Trial was pruned at iteration 0.
[I 2023-12-21 00:14:14,145] Trial 242 pruned. Trial was pruned at iteration 0.
[I 2023-12-21 00:14:14,210] Trial 243 pruned. Trial was pruned at iteration 0.
[I 2023-12-21 00:14:14,280] Trial 244 pruned. Trial was pruned at iteration 0.
[I 2023-12-21 00:14:14,356] Trial 245 pruned. Trial was pruned at iteration 1.
[I 2023-12-21 00:14:14,421] Trial 246 pruned. Trial was pruned at iteration 0.
[I 2023-12-21 00:14:14,488] Trial 247 pruned. Trial was pruned at iteration 0.
[I 2023-12-21 00:14:14,563] Trial 248 pruned. Trial was pruned at iteration 1.
[I 2023-12-21 00:14:14,630] Trial 249 pruned. Trial was pruned at iteration 0.
Completed hyperparameter tuning with best aft-nloglik = 1.9163923221585393.
Re-running the best trial... params = {'verbosity': 0, 'objective': 'survival:aft', 'eval_metric': 'aft-nloglik', 'tree_method': 'gpu_hist', 'device': 'cuda', 'learning_rate': 0.906088706911985, 'aft_loss_distribution': 'normal', 'aft_loss_distribution_scale': 1.4592809214245896, 'max_depth': 5, 'booster': 'dart', 'scale_pos_weight': 2.380044029792167, 'alpha': 8.89525267952944, 'lambda': 8.594614645783658, 'eta': 0.9254203773956073, 'sampling_method': 'uniform', 'subsample': 0.4006149664553664, 'gamma': 8.549784039809758}
[W 2023-12-21 00:14:26,971] Trial 8 is omitted in visualization because its objective value is inf or nan.
[W 2023-12-21 00:14:26,978] Trial 24 is omitted in visualization because its objective value is inf or nan.
[W 2023-12-21 00:14:26,983] Trial 27 is omitted in visualization because its objective value is inf or nan.
[W 2023-12-21 00:14:26,984] Trial 29 is omitted in visualization because its objective value is inf or nan.
[W 2023-12-21 00:14:26,986] Trial 32 is omitted in visualization because its objective value is inf or nan.
[W 2023-12-21 00:14:26,991] Trial 41 is omitted in visualization because its objective value is inf or nan.
[W 2023-12-21 00:14:26,992] Trial 50 is omitted in visualization because its objective value is inf or nan.
[W 2023-12-21 00:14:26,996] Trial 53 is omitted in visualization because its objective value is inf or nan.
[W 2023-12-21 00:14:26,997] Trial 55 is omitted in visualization because its objective value is inf or nan.
[W 2023-12-21 00:14:26,999] Trial 62 is omitted in visualization because its objective value is inf or nan.
[W 2023-12-21 00:14:26,999] Trial 68 is omitted in visualization because its objective value is inf or nan.
[W 2023-12-21 00:14:27,004] Trial 83 is omitted in visualization because its objective value is inf or nan.
[W 2023-12-21 00:14:27,005] Trial 84 is omitted in visualization because its objective value is inf or nan.
[W 2023-12-21 00:14:27,006] Trial 90 is omitted in visualization because its objective value is inf or nan.
[W 2023-12-21 00:14:27,008] Trial 91 is omitted in visualization because its objective value is inf or nan.
[W 2023-12-21 00:14:27,014] Trial 93 is omitted in visualization because its objective value is inf or nan.
[W 2023-12-21 00:14:27,016] Trial 102 is omitted in visualization because its objective value is inf or nan.
[W 2023-12-21 00:14:27,017] Trial 112 is omitted in visualization because its objective value is inf or nan.
[W 2023-12-21 00:14:27,020] Trial 113 is omitted in visualization because its objective value is inf or nan.
[W 2023-12-21 00:14:27,021] Trial 116 is omitted in visualization because its objective value is inf or nan.
[W 2023-12-21 00:14:27,022] Trial 124 is omitted in visualization because its objective value is inf or nan.
[W 2023-12-21 00:14:27,023] Trial 131 is omitted in visualization because its objective value is inf or nan.
[W 2023-12-21 00:14:27,024] Trial 132 is omitted in visualization because its objective value is inf or nan.
[W 2023-12-21 00:14:27,025] Trial 135 is omitted in visualization because its objective value is inf or nan.
[W 2023-12-21 00:14:27,026] Trial 143 is omitted in visualization because its objective value is inf or nan.
[W 2023-12-21 00:14:27,027] Trial 164 is omitted in visualization because its objective value is inf or nan.
[W 2023-12-21 00:14:27,028] Trial 168 is omitted in visualization because its objective value is inf or nan.
[W 2023-12-21 00:14:27,029] Trial 169 is omitted in visualization because its objective value is inf or nan.
[W 2023-12-21 00:14:27,030] Trial 180 is omitted in visualization because its objective value is inf or nan.
[W 2023-12-21 00:14:27,031] Trial 195 is omitted in visualization because its objective value is inf or nan.
[W 2023-12-21 00:14:27,032] Trial 203 is omitted in visualization because its objective value is inf or nan.
[W 2023-12-21 00:14:27,033] Trial 204 is omitted in visualization because its objective value is inf or nan.
[W 2023-12-21 00:14:27,033] Trial 214 is omitted in visualization because its objective value is inf or nan.
[W 2023-12-21 00:14:27,034] Trial 216 is omitted in visualization because its objective value is inf or nan.
[W 2023-12-21 00:14:27,035] Trial 223 is omitted in visualization because its objective value is inf or nan.
[W 2023-12-21 00:14:27,036] Trial 224 is omitted in visualization because its objective value is inf or nan.
[W 2023-12-21 00:14:27,037] Trial 226 is omitted in visualization because its objective value is inf or nan.
[W 2023-12-21 00:14:27,038] Trial 227 is omitted in visualization because its objective value is inf or nan.
[W 2023-12-21 00:14:27,039] Trial 234 is omitted in visualization because its objective value is inf or nan.
[W 2023-12-21 00:14:27,040] Trial 237 is omitted in visualization because its objective value is inf or nan.
TRN1 | R2:0.348; p:0.0 | C:70.19 |3h:0.953 |6h:0.941 |9h:0.933 |12h:0.728 |15h:0.728 |18h:0.724 |24h:0.567 |48h:0.558 |72h:0.552 |1wk:0.374 |2wks:0.369 |1mon:0.310 |
TRN2 | R2:0.295; p:2.076e-64 | C:67.17 |3h:0.952 |6h:0.941 |9h:0.932 |12h:0.726 |15h:0.726 |18h:0.722 |24h:0.565 |48h:0.556 |72h:0.551 |1wk:0.363 |2wks:0.366 |1mon:0.312 |
VAL | R2:0.267; p:7.296e-53 | C:66.14 |3h:0.952 |6h:0.941 |9h:0.932 |12h:0.726 |15h:0.726 |18h:0.722 |24h:0.566 |48h:0.557 |72h:0.549 |1wk:0.371 |2wks:0.366 |1mon:0.299 |
[I 2023-12-21 00:14:30,778] A new study created in memory with name: no-name-2ea35cae-86d8-44fa-a1db-ba8adedfd462
TST | R2:0.224; p:1.923e-219 | C:62.18 |3h:0.947 |6h:0.932 |9h:0.921 |12h:0.719 |15h:0.719 |18h:0.703 |24h:0.434 |48h:0.431 |72h:0.429 |1wk:0.337 |2wks:0.348 |1mon:0.307 |
/content/drive/MyDrive/intermediates2/res//outcome2_xgb-aft_inp49_k9_all_rdims8.json
Dimensionality reduced word embedding 1 with ['location_numeric', 'race_numeric', 'sex_numeric', 'body_part_numeric', 'product_1_numeric', 'product_2_numeric', 'drug_numeric', 'alcohol_numeric', 'month']
Dimensionality reduced word embedding 1 with ['location_numeric', 'race_numeric', 'sex_numeric', 'body_part_numeric', 'product_1_numeric', 'product_2_numeric', 'drug_numeric', 'alcohol_numeric', 'month']
Dimensionality reduced word embedding 1 with ['location_numeric', 'race_numeric', 'sex_numeric', 'body_part_numeric', 'product_1_numeric', 'product_2_numeric', 'drug_numeric', 'alcohol_numeric', 'month']
Dimensionality reduced word embedding 1 with ['location_numeric', 'race_numeric', 'sex_numeric', 'body_part_numeric', 'product_1_numeric', 'product_2_numeric', 'drug_numeric', 'alcohol_numeric', 'month']
trn1
trn2
val
tst
[I 2023-12-21 00:14:31,084] Trial 0 finished with value: 2.065812879551862 and parameters: {'learning_rate': 0.4756872503546345, 'aft_loss_distribution': 'normal', 'aft_loss_distribution_scale': 3.2262591617131973, 'max_depth': 6, 'booster': 'gbtree', 'scale_pos_weight': 1.7343655564632388, 'alpha': 3.7673758353523485, 'lambda': 2.353513359231801, 'eta': 0.6337261484963579, 'sampling_method': 'uniform', 'subsample': 0.4486556821831479, 'gamma': 3.7587387961100935}. Best is trial 0 with value: 2.065812879551862.
[I 2023-12-21 00:14:31,255] Trial 1 finished with value: 2.385330810539817 and parameters: {'learning_rate': 0.6869797297322773, 'aft_loss_distribution': 'normal', 'aft_loss_distribution_scale': 8.488016691822653, 'max_depth': 9, 'booster': 'gbtree', 'scale_pos_weight': 1.903438154309463, 'alpha': 5.613615752895804, 'lambda': 5.938919243790939, 'eta': 0.7001635768889735, 'sampling_method': 'gradient_based', 'subsample': 0.7482224418403403, 'gamma': 2.314813584271255}. Best is trial 0 with value: 2.065812879551862.
[I 2023-12-21 00:14:33,406] Trial 2 finished with value: inf and parameters: {'learning_rate': 0.7643026007173495, 'aft_loss_distribution': 'normal', 'aft_loss_distribution_scale': 5.2381200653423665, 'max_depth': 7, 'booster': 'dart', 'scale_pos_weight': 1.92962994383859, 'alpha': 6.080580493128959, 'lambda': 6.2516219803676405, 'eta': 0.01327316589775418, 'sampling_method': 'gradient_based', 'subsample': 0.5944872562178304, 'gamma': 5.690787363746751}. Best is trial 0 with value: 2.065812879551862.
[I 2023-12-21 00:14:33,941] Trial 3 finished with value: 2.6278048538399346 and parameters: {'learning_rate': 0.23591500388973283, 'aft_loss_distribution': 'logistic', 'aft_loss_distribution_scale': 9.642770887423318, 'max_depth': 8, 'booster': 'gbtree', 'scale_pos_weight': 2.4262329931179907, 'alpha': 9.641707075363819, 'lambda': 3.989839660590678, 'eta': 0.9263716411504743, 'sampling_method': 'gradient_based', 'subsample': 0.8655870366765099, 'gamma': 6.188812592292212}. Best is trial 0 with value: 2.065812879551862.
[I 2023-12-21 00:14:35,508] Trial 4 finished with value: inf and parameters: {'learning_rate': 0.8952019553516055, 'aft_loss_distribution': 'normal', 'aft_loss_distribution_scale': 5.814115052822249, 'max_depth': 8, 'booster': 'dart', 'scale_pos_weight': 1.049524376124011, 'alpha': 0.36129542792422115, 'lambda': 4.446229704208953, 'eta': 0.06591706682078036, 'sampling_method': 'uniform', 'subsample': 0.6036221943875786, 'gamma': 7.168797652838365}. Best is trial 0 with value: 2.065812879551862.
[I 2023-12-21 00:14:35,519] Trial 5 pruned. Trial was pruned at iteration 0.
[I 2023-12-21 00:14:38,094] Trial 6 finished with value: inf and parameters: {'learning_rate': 0.997985898378926, 'aft_loss_distribution': 'normal', 'aft_loss_distribution_scale': 3.7716213615138594, 'max_depth': 6, 'booster': 'dart', 'scale_pos_weight': 2.934391641865032, 'alpha': 4.973201777166673, 'lambda': 4.911445552760992, 'eta': 0.39180807090322667, 'sampling_method': 'uniform', 'subsample': 0.09698541104669979, 'gamma': 7.3334894235574195}. Best is trial 0 with value: 2.065812879551862.
[I 2023-12-21 00:14:38,108] Trial 7 pruned. Trial was pruned at iteration 0.
[I 2023-12-21 00:14:38,122] Trial 8 pruned. Trial was pruned at iteration 0.
[I 2023-12-21 00:14:38,134] Trial 9 pruned. Trial was pruned at iteration 0.
[I 2023-12-21 00:14:38,210] Trial 10 pruned. Trial was pruned at iteration 0.
[I 2023-12-21 00:14:38,290] Trial 11 pruned. Trial was pruned at iteration 0.
[I 2023-12-21 00:14:38,366] Trial 12 pruned. Trial was pruned at iteration 0.
