[I 2023-12-18 23:46:05,715] Trial 467 pruned. Trial was pruned at iteration 0.
[I 2023-12-18 23:46:05,812] Trial 468 pruned. Trial was pruned at iteration 0.
[I 2023-12-18 23:46:05,902] Trial 469 pruned. Trial was pruned at iteration 0.
[I 2023-12-18 23:46:05,997] Trial 470 pruned. Trial was pruned at iteration 0.
[I 2023-12-18 23:46:06,091] Trial 471 pruned. Trial was pruned at iteration 0.
[I 2023-12-18 23:46:06,184] Trial 472 pruned. Trial was pruned at iteration 0.
[I 2023-12-18 23:46:06,297] Trial 473 pruned. Trial was pruned at iteration 0.
[I 2023-12-18 23:46:06,394] Trial 474 pruned. Trial was pruned at iteration 0.
[I 2023-12-18 23:46:06,486] Trial 475 pruned. Trial was pruned at iteration 0.
[I 2023-12-18 23:46:06,579] Trial 476 pruned. Trial was pruned at iteration 0.
[I 2023-12-18 23:46:06,671] Trial 477 pruned. Trial was pruned at iteration 0.
[I 2023-12-18 23:46:06,764] Trial 478 pruned. Trial was pruned at iteration 0.
[I 2023-12-18 23:46:06,859] Trial 479 pruned. Trial was pruned at iteration 0.
[I 2023-12-18 23:46:06,975] Trial 480 pruned. Trial was pruned at iteration 5.
[I 2023-12-18 23:46:07,070] Trial 481 pruned. Trial was pruned at iteration 0.
[I 2023-12-18 23:46:07,160] Trial 482 pruned. Trial was pruned at iteration 0.
[I 2023-12-18 23:46:07,258] Trial 483 pruned. Trial was pruned at iteration 0.
[I 2023-12-18 23:46:07,362] Trial 484 pruned. Trial was pruned at iteration 0.
[I 2023-12-18 23:46:07,457] Trial 485 pruned. Trial was pruned at iteration 0.
[I 2023-12-18 23:46:07,547] Trial 486 pruned. Trial was pruned at iteration 0.
[I 2023-12-18 23:46:07,646] Trial 487 pruned. Trial was pruned at iteration 0.
[I 2023-12-18 23:46:07,734] Trial 488 pruned. Trial was pruned at iteration 0.
[I 2023-12-18 23:46:07,829] Trial 489 pruned. Trial was pruned at iteration 0.
[I 2023-12-18 23:46:07,920] Trial 490 pruned. Trial was pruned at iteration 0.
[I 2023-12-18 23:46:08,009] Trial 491 pruned. Trial was pruned at iteration 0.
[I 2023-12-18 23:46:08,101] Trial 492 pruned. Trial was pruned at iteration 0.
[I 2023-12-18 23:46:08,200] Trial 493 pruned. Trial was pruned at iteration 0.
[I 2023-12-18 23:46:08,290] Trial 494 pruned. Trial was pruned at iteration 0.
[I 2023-12-18 23:46:08,392] Trial 495 pruned. Trial was pruned at iteration 0.
[I 2023-12-18 23:46:08,490] Trial 496 pruned. Trial was pruned at iteration 0.
[I 2023-12-18 23:46:08,581] Trial 497 pruned. Trial was pruned at iteration 0.
[I 2023-12-18 23:46:08,677] Trial 498 pruned. Trial was pruned at iteration 0.
[I 2023-12-18 23:46:08,769] Trial 499 pruned. Trial was pruned at iteration 0.
Completed hyperparameter tuning with best aft-nloglik = 4.183192035680075.
Re-running the best trial... params = {'verbosity': 0, 'objective': 'survival:aft', 'eval_metric': 'aft-nloglik', 'tree_method': 'gpu_hist', 'device': 'cuda', 'learning_rate': 0.07532975672558279, 'aft_loss_distribution': 'logistic', 'aft_loss_distribution_scale': 0.514690478552005, 'max_depth': 10, 'booster': 'dart', 'scale_pos_weight': 2.956201071666726, 'alpha': 7.807247316167578, 'lambda': 7.1764476444832885, 'eta': 0.9760553966141641, 'sampling_method': 'uniform', 'subsample': 0.5164819508913462, 'gamma': 8.939061473836933}
[W 2023-12-18 23:46:48,852] Trial 1 is omitted in visualization because its objective value is inf or nan.
[W 2023-12-18 23:46:48,854] Trial 3 is omitted in visualization because its objective value is inf or nan.
[W 2023-12-18 23:46:48,856] Trial 4 is omitted in visualization because its objective value is inf or nan.
[W 2023-12-18 23:46:48,857] Trial 40 is omitted in visualization because its objective value is inf or nan.
[W 2023-12-18 23:46:48,859] Trial 46 is omitted in visualization because its objective value is inf or nan.
[W 2023-12-18 23:46:48,860] Trial 56 is omitted in visualization because its objective value is inf or nan.
[W 2023-12-18 23:46:48,861] Trial 80 is omitted in visualization because its objective value is inf or nan.
TRN1 | R2:0.158; p:1.712e-36 | C:57.61 |3h:0.874 |6h:0.855 |9h:0.839 |12h:0.391 |15h:0.391 |18h:0.387 |24h:0.157 |48h:0.149 |72h:0.144 |1wk:0.020 |2wks:0.019 |1mon:0.013 |
TRN2 | R2:0.142; p:8.39e-30 | C:56.63 |3h:0.874 |6h:0.855 |9h:0.839 |12h:0.391 |15h:0.391 |18h:0.386 |24h:0.157 |48h:0.149 |72h:0.143 |1wk:0.020 |2wks:0.019 |1mon:0.013 |
VAL | R2:0.140; p:5.505e-29 | C:56.62 |3h:0.874 |6h:0.855 |9h:0.839 |12h:0.391 |15h:0.391 |18h:0.386 |24h:0.157 |48h:0.149 |72h:0.143 |1wk:0.020 |2wks:0.019 |1mon:0.013 |
[I 2023-12-18 23:46:54,017] A new study created in memory with name: no-name-e8d1fb5f-5204-4e24-9608-894531581eb8
TST | R2:0.118; p:6.348e-62 | C:55.61 |3h:0.869 |6h:0.847 |9h:0.830 |12h:0.388 |15h:0.388 |18h:0.378 |24h:0.122 |48h:0.117 |72h:0.113 |1wk:0.019 |2wks:0.018 |1mon:0.013 |
/content/drive/MyDrive/intermediates2/res//outcome1_xgb-aft_inp23_k3_emb3_rdims8.json
Dimensionality reduced word embedding 4 with ['location_numeric', 'race_numeric', 'sex_numeric']
Dimensionality reduced word embedding 4 with ['location_numeric', 'race_numeric', 'sex_numeric']
Dimensionality reduced word embedding 4 with ['location_numeric', 'race_numeric', 'sex_numeric']
Dimensionality reduced word embedding 4 with ['location_numeric', 'race_numeric', 'sex_numeric']
trn1
trn2
val
tst
[I 2023-12-18 23:47:11,804] Trial 0 finished with value: 6.017441565273729 and parameters: {'learning_rate': 0.39020197189690914, 'aft_loss_distribution': 'extreme', 'aft_loss_distribution_scale': 9.874012265708311, 'max_depth': 5, 'booster': 'dart', 'scale_pos_weight': 0.3889394221089791, 'alpha': 6.270428446474491, 'lambda': 3.0756097651211998, 'eta': 0.17697238184890285, 'sampling_method': 'gradient_based', 'subsample': 0.5921941331083143, 'gamma': 6.706653816758946}. Best is trial 0 with value: 6.017441565273729.
[I 2023-12-18 23:47:12,066] Trial 1 finished with value: 5.592736508948142 and parameters: {'learning_rate': 0.4184076566355175, 'aft_loss_distribution': 'logistic', 'aft_loss_distribution_scale': 4.32168662259391, 'max_depth': 8, 'booster': 'gbtree', 'scale_pos_weight': 5.223601698671234, 'alpha': 2.557249388807465, 'lambda': 9.830058836108337, 'eta': 0.09866645712162558, 'sampling_method': 'uniform', 'subsample': 0.7040134996142601, 'gamma': 1.9059668464493937}. Best is trial 1 with value: 5.592736508948142.
[I 2023-12-18 23:47:12,264] Trial 2 finished with value: inf and parameters: {'learning_rate': 0.8251212536263008, 'aft_loss_distribution': 'extreme', 'aft_loss_distribution_scale': 1.7011434281630053, 'max_depth': 6, 'booster': 'gbtree', 'scale_pos_weight': 6.0194198573069535, 'alpha': 3.7542015193876463, 'lambda': 8.845267980727504, 'eta': 0.8318705572701721, 'sampling_method': 'uniform', 'subsample': 0.4068899448439364, 'gamma': 3.5382197914390567}. Best is trial 1 with value: 5.592736508948142.
[I 2023-12-18 23:47:12,627] Trial 3 finished with value: 4.891129046577006 and parameters: {'learning_rate': 0.5713417545609979, 'aft_loss_distribution': 'logistic', 'aft_loss_distribution_scale': 1.9650277005192185, 'max_depth': 10, 'booster': 'gbtree', 'scale_pos_weight': 5.380152232543642, 'alpha': 3.697297344377179, 'lambda': 5.104196875773862, 'eta': 0.10940871838798072, 'sampling_method': 'gradient_based', 'subsample': 0.530279005855704, 'gamma': 9.221881050153112}. Best is trial 3 with value: 4.891129046577006.
[I 2023-12-18 23:47:12,822] Trial 4 finished with value: inf and parameters: {'learning_rate': 0.5510892426593372, 'aft_loss_distribution': 'logistic', 'aft_loss_distribution_scale': 2.3238544325455366, 'max_depth': 10, 'booster': 'gbtree', 'scale_pos_weight': 4.860579714085747, 'alpha': 3.102332072038327, 'lambda': 3.0314822783600843, 'eta': 0.353443835588546, 'sampling_method': 'gradient_based', 'subsample': 0.1859628649342278, 'gamma': 2.072561864863657}. Best is trial 3 with value: 4.891129046577006.
[I 2023-12-18 23:47:12,845] Trial 5 pruned. Trial was pruned at iteration 0.
[I 2023-12-18 23:47:12,864] Trial 6 pruned. Trial was pruned at iteration 0.
[I 2023-12-18 23:47:12,877] Trial 7 pruned. Trial was pruned at iteration 0.
[I 2023-12-18 23:47:12,895] Trial 8 pruned. Trial was pruned at iteration 2.
[I 2023-12-18 23:47:12,911] Trial 9 pruned. Trial was pruned at iteration 0.
[I 2023-12-18 23:47:12,990] Trial 10 pruned. Trial was pruned at iteration 0.
[I 2023-12-18 23:47:13,073] Trial 11 pruned. Trial was pruned at iteration 0.
[I 2023-12-18 23:47:13,681] Trial 12 finished with value: 4.637699696350856 and parameters: {'learning_rate': 0.6725144510975408, 'aft_loss_distribution': 'normal', 'aft_loss_distribution_scale': 2.318787534734414, 'max_depth': 8, 'booster': 'gbtree', 'scale_pos_weight': 3.4332876570763724, 'alpha': 6.829469336423779, 'lambda': 5.669615451173884, 'eta': 0.006208892466580074, 'sampling_method': 'gradient_based', 'subsample': 0.705705259838287, 'gamma': 9.559564651983724}. Best is trial 12 with value: 4.637699696350856.
[I 2023-12-18 23:47:14,056] Trial 13 finished with value: 4.462099010895147 and parameters: {'learning_rate': 0.757216600445382, 'aft_loss_distribution': 'normal', 'aft_loss_distribution_scale': 1.8030729363073064, 'max_depth': 8, 'booster': 'gbtree', 'scale_pos_weight': 3.2477445251279784, 'alpha': 6.887467889811315, 'lambda': 5.574011561088308, 'eta': 0.28668799893625513, 'sampling_method': 'gradient_based', 'subsample': 0.9692511924486488, 'gamma': 9.622955501861137}. Best is trial 13 with value: 4.462099010895147.
[I 2023-12-18 23:47:14,147] Trial 14 pruned. Trial was pruned at iteration 0.
[I 2023-12-18 23:47:14,524] Trial 15 finished with value: 4.837746052773305 and parameters: {'learning_rate': 0.9586502387109217, 'aft_loss_distribution': 'normal', 'aft_loss_distribution_scale': 2.97467470444631, 'max_depth': 6, 'booster': 'gbtree', 'scale_pos_weight': 3.328935646254378, 'alpha': 6.888871240290025, 'lambda': 6.109087239257802, 'eta': 0.2567078495052002, 'sampling_method': 'gradient_based', 'subsample': 0.9599158854275506, 'gamma': 7.344528559390723}. Best is trial 13 with value: 4.462099010895147.
[I 2023-12-18 23:47:14,878] Trial 16 finished with value: 4.272217260005588 and parameters: {'learning_rate': 0.7104078458947143, 'aft_loss_distribution': 'normal', 'aft_loss_distribution_scale': 1.2096070391111857, 'max_depth': 8, 'booster': 'gbtree', 'scale_pos_weight': 2.0291408786254657, 'alpha': 8.008956278128494, 'lambda': 3.5081262517872025, 'eta': 0.49410582633503264, 'sampling_method': 'gradient_based', 'subsample': 0.7408951870332123, 'gamma': 8.549653758598728}. Best is trial 16 with value: 4.272217260005588.
[I 2023-12-18 23:47:15,115] Trial 17 finished with value: inf and parameters: {'learning_rate': 0.8057115989008274, 'aft_loss_distribution': 'normal', 'aft_loss_distribution_scale': 1.034049763316788, 'max_depth': 9, 'booster': 'gbtree', 'scale_pos_weight': 1.686229651965809, 'alpha': 8.007489765644644, 'lambda': 3.394342390993104, 'eta': 0.4705732728323047, 'sampling_method': 'gradient_based', 'subsample': 0.8057645610033888, 'gamma': 8.401783762138098}. Best is trial 16 with value: 4.272217260005588.
[I 2023-12-18 23:47:15,210] Trial 18 pruned. Trial was pruned at iteration 0.
[I 2023-12-18 23:47:15,290] Trial 19 pruned. Trial was pruned at iteration 0.
[I 2023-12-18 23:47:15,524] Trial 20 finished with value: inf and parameters: {'learning_rate': 0.983007875611196, 'aft_loss_distribution': 'normal', 'aft_loss_distribution_scale': 0.9442105844293466, 'max_depth': 8, 'booster': 'gbtree', 'scale_pos_weight': 2.116132249341925, 'alpha': 8.280374974990059, 'lambda': 2.019742950417897, 'eta': 0.41314408817189213, 'sampling_method': 'gradient_based', 'subsample': 0.8875764000468664, 'gamma': 6.823166617888876}. Best is trial 16 with value: 4.272217260005588.
[I 2023-12-18 23:47:15,611] Trial 21 pruned. Trial was pruned at iteration 0.
[I 2023-12-18 23:47:15,700] Trial 22 pruned. Trial was pruned at iteration 0.
[I 2023-12-18 23:47:15,950] Trial 23 finished with value: inf and parameters: {'learning_rate': 0.7676333286941467, 'aft_loss_distribution': 'normal', 'aft_loss_distribution_scale': 2.2461424577307687, 'max_depth': 8, 'booster': 'gbtree', 'scale_pos_weight': 1.1927135771533761, 'alpha': 6.997424670232141, 'lambda': 4.033837493875253, 'eta': 0.5555021099153914, 'sampling_method': 'gradient_based', 'subsample': 0.7717689563505736, 'gamma': 8.911936288643862}. Best is trial 16 with value: 4.272217260005588.
[I 2023-12-18 23:47:16,014] Trial 24 pruned. Trial was pruned at iteration 0.
[I 2023-12-18 23:47:16,065] Trial 25 pruned. Trial was pruned at iteration 0.
[I 2023-12-18 23:47:16,135] Trial 26 pruned. Trial was pruned at iteration 3.
[I 2023-12-18 23:47:16,385] Trial 27 finished with value: 4.418072250196158 and parameters: {'learning_rate': 0.7486570180757869, 'aft_loss_distribution': 'normal', 'aft_loss_distribution_scale': 1.6830356949418583, 'max_depth': 8, 'booster': 'gbtree', 'scale_pos_weight': 4.219047508198426, 'alpha': 9.803842315504044, 'lambda': 6.783502319732127, 'eta': 0.5345277051119348, 'sampling_method': 'gradient_based', 'subsample': 0.924895192219392, 'gamma': 5.897174526078167}. Best is trial 16 with value: 4.272217260005588.
[I 2023-12-18 23:47:16,570] Trial 28 finished with value: inf and parameters: {'learning_rate': 0.7818626130636683, 'aft_loss_distribution': 'normal', 'aft_loss_distribution_scale': 1.610647578748046, 'max_depth': 7, 'booster': 'gbtree', 'scale_pos_weight': 4.330568424909155, 'alpha': 9.70733328795508, 'lambda': 6.761507871497567, 'eta': 0.5384181212130016, 'sampling_method': 'gradient_based', 'subsample': 0.9265687560942699, 'gamma': 4.805482106575215}. Best is trial 16 with value: 4.272217260005588.
[I 2023-12-18 23:47:16,624] Trial 29 pruned. Trial was pruned at iteration 0.
[I 2023-12-18 23:47:16,678] Trial 30 pruned. Trial was pruned at iteration 0.
[I 2023-12-18 23:47:16,733] Trial 31 pruned. Trial was pruned at iteration 0.
[I 2023-12-18 23:47:17,016] Trial 32 finished with value: 4.43266584149092 and parameters: {'learning_rate': 0.7120835338999382, 'aft_loss_distribution': 'normal', 'aft_loss_distribution_scale': 1.7277968153006034, 'max_depth': 8, 'booster': 'gbtree', 'scale_pos_weight': 4.629873374733901, 'alpha': 6.497461323661797, 'lambda': 6.782543413207597, 'eta': 0.9720031256903771, 'sampling_method': 'gradient_based', 'subsample': 0.7004064542532061, 'gamma': 4.143448663063853}. Best is trial 16 with value: 4.272217260005588.
[I 2023-12-18 23:47:17,199] Trial 33 finished with value: inf and parameters: {'learning_rate': 0.8288666800593356, 'aft_loss_distribution': 'normal', 'aft_loss_distribution_scale': 1.529060562891999, 'max_depth': 9, 'booster': 'gbtree', 'scale_pos_weight': 4.568280385710502, 'alpha': 8.489946036243706, 'lambda': 9.796125220117839, 'eta': 0.9824886701701794, 'sampling_method': 'gradient_based', 'subsample': 0.923674995473873, 'gamma': 3.914440137119058}. Best is trial 16 with value: 4.272217260005588.
[I 2023-12-18 23:47:17,256] Trial 34 pruned. Trial was pruned at iteration 0.
[I 2023-12-18 23:47:17,321] Trial 35 pruned. Trial was pruned at iteration 0.
[I 2023-12-18 23:47:17,523] Trial 36 finished with value: inf and parameters: {'learning_rate': 0.7240447588753373, 'aft_loss_distribution': 'normal', 'aft_loss_distribution_scale': 1.7766518795849033, 'max_depth': 10, 'booster': 'gbtree', 'scale_pos_weight': 4.970019795657126, 'alpha': 7.897212170617687, 'lambda': 7.996798519283315, 'eta': 0.09843464031301197, 'sampling_method': 'gradient_based', 'subsample': 0.3947024940120223, 'gamma': 3.041508070098841}. Best is trial 16 with value: 4.272217260005588.
[I 2023-12-18 23:47:17,582] Trial 37 pruned. Trial was pruned at iteration 0.
[I 2023-12-18 23:47:17,636] Trial 38 pruned. Trial was pruned at iteration 0.
[I 2023-12-18 23:47:17,689] Trial 39 pruned. Trial was pruned at iteration 0.
[I 2023-12-18 23:47:17,746] Trial 40 pruned. Trial was pruned at iteration 0.
[I 2023-12-18 23:47:17,801] Trial 41 pruned. Trial was pruned at iteration 0.
[I 2023-12-18 23:47:17,996] Trial 42 finished with value: inf and parameters: {'learning_rate': 0.8101358214920699, 'aft_loss_distribution': 'normal', 'aft_loss_distribution_scale': 1.4758474192943196, 'max_depth': 8, 'booster': 'gbtree', 'scale_pos_weight': 2.316945997563187, 'alpha': 7.184636793739977, 'lambda': 6.359826038253214, 'eta': 0.6100053390232896, 'sampling_method': 'gradient_based', 'subsample': 0.865757169581212, 'gamma': 7.770581780712668}. Best is trial 16 with value: 4.272217260005588.
[I 2023-12-18 23:47:18,062] Trial 43 pruned. Trial was pruned at iteration 0.
[I 2023-12-18 23:47:18,116] Trial 44 pruned. Trial was pruned at iteration 0.
[I 2023-12-18 23:47:18,180] Trial 45 pruned. Trial was pruned at iteration 0.
[I 2023-12-18 23:47:18,236] Trial 46 pruned. Trial was pruned at iteration 0.
[I 2023-12-18 23:47:18,289] Trial 47 pruned. Trial was pruned at iteration 0.
[I 2023-12-18 23:47:18,345] Trial 48 pruned. Trial was pruned at iteration 0.
[I 2023-12-18 23:47:18,402] Trial 49 pruned. Trial was pruned at iteration 0.
[I 2023-12-18 23:47:18,457] Trial 50 pruned. Trial was pruned at iteration 0.
[I 2023-12-18 23:47:18,515] Trial 51 pruned. Trial was pruned at iteration 1.
[I 2023-12-18 23:47:18,583] Trial 52 pruned. Trial was pruned at iteration 0.
[I 2023-12-18 23:47:18,637] Trial 53 pruned. Trial was pruned at iteration 0.
[I 2023-12-18 23:47:18,698] Trial 54 pruned. Trial was pruned at iteration 0.
[I 2023-12-18 23:47:18,752] Trial 55 pruned. Trial was pruned at iteration 0.
[I 2023-12-18 23:47:18,818] Trial 56 pruned. Trial was pruned at iteration 0.
[I 2023-12-18 23:47:18,876] Trial 57 pruned. Trial was pruned at iteration 0.
[I 2023-12-18 23:47:18,936] Trial 58 pruned. Trial was pruned at iteration 0.
[I 2023-12-18 23:47:18,994] Trial 59 pruned. Trial was pruned at iteration 0.
[I 2023-12-18 23:47:19,050] Trial 60 pruned. Trial was pruned at iteration 0.
[I 2023-12-18 23:47:19,115] Trial 61 pruned. Trial was pruned at iteration 0.
[I 2023-12-18 23:47:19,181] Trial 62 pruned. Trial was pruned at iteration 0.
[I 2023-12-18 23:47:19,240] Trial 63 pruned. Trial was pruned at iteration 0.
[I 2023-12-18 23:47:19,299] Trial 64 pruned. Trial was pruned at iteration 0.
[I 2023-12-18 23:47:19,359] Trial 65 pruned. Trial was pruned at iteration 0.
[I 2023-12-18 23:47:19,421] Trial 66 pruned. Trial was pruned at iteration 0.
[I 2023-12-18 23:47:19,480] Trial 67 pruned. Trial was pruned at iteration 0.
[I 2023-12-18 23:47:19,538] Trial 68 pruned. Trial was pruned at iteration 0.
[I 2023-12-18 23:47:19,613] Trial 69 pruned. Trial was pruned at iteration 0.
[I 2023-12-18 23:47:19,669] Trial 70 pruned. Trial was pruned at iteration 0.
[I 2023-12-18 23:47:19,727] Trial 71 pruned. Trial was pruned at iteration 0.
[I 2023-12-18 23:47:19,783] Trial 72 pruned. Trial was pruned at iteration 0.
[I 2023-12-18 23:47:19,843] Trial 73 pruned. Trial was pruned at iteration 0.
[I 2023-12-18 23:47:19,905] Trial 74 pruned. Trial was pruned at iteration 0.
[I 2023-12-18 23:47:19,971] Trial 75 pruned. Trial was pruned at iteration 0.
[I 2023-12-18 23:47:20,042] Trial 76 pruned. Trial was pruned at iteration 0.
[I 2023-12-18 23:47:20,110] Trial 77 pruned. Trial was pruned at iteration 0.
[I 2023-12-18 23:47:20,177] Trial 78 pruned. Trial was pruned at iteration 0.
[I 2023-12-18 23:47:20,244] Trial 79 pruned. Trial was pruned at iteration 0.
[I 2023-12-18 23:47:20,316] Trial 80 pruned. Trial was pruned at iteration 1.
[I 2023-12-18 23:47:20,383] Trial 81 pruned. Trial was pruned at iteration 0.
[I 2023-12-18 23:47:20,450] Trial 82 pruned. Trial was pruned at iteration 0.
[I 2023-12-18 23:47:20,508] Trial 83 pruned. Trial was pruned at iteration 0.
[I 2023-12-18 23:47:20,565] Trial 84 pruned. Trial was pruned at iteration 0.
[I 2023-12-18 23:47:20,637] Trial 85 pruned. Trial was pruned at iteration 0.
[I 2023-12-18 23:47:20,701] Trial 86 pruned. Trial was pruned at iteration 0.
[I 2023-12-18 23:47:20,762] Trial 87 pruned. Trial was pruned at iteration 0.
[I 2023-12-18 23:47:20,833] Trial 88 pruned. Trial was pruned at iteration 0.
[I 2023-12-18 23:47:20,899] Trial 89 pruned. Trial was pruned at iteration 0.
[I 2023-12-18 23:47:20,960] Trial 90 pruned. Trial was pruned at iteration 0.
[I 2023-12-18 23:47:21,027] Trial 91 pruned. Trial was pruned at iteration 0.
[I 2023-12-18 23:47:21,098] Trial 92 pruned. Trial was pruned at iteration 0.
[I 2023-12-18 23:47:21,159] Trial 93 pruned. Trial was pruned at iteration 0.
[I 2023-12-18 23:47:21,229] Trial 94 pruned. Trial was pruned at iteration 0.
[I 2023-12-18 23:47:21,480] Trial 95 finished with value: inf and parameters: {'learning_rate': 0.862256486249024, 'aft_loss_distribution': 'normal', 'aft_loss_distribution_scale': 1.1466265810310396, 'max_depth': 5, 'booster': 'gbtree', 'scale_pos_weight': 5.525815447286725, 'alpha': 5.152378723022583, 'lambda': 9.63075514203878, 'eta': 0.6587469478556724, 'sampling_method': 'uniform', 'subsample': 0.36344613504291234, 'gamma': 3.4911702042808224}. Best is trial 16 with value: 4.272217260005588.
[I 2023-12-18 23:47:21,572] Trial 96 pruned. Trial was pruned at iteration 0.
[I 2023-12-18 23:47:21,689] Trial 97 pruned. Trial was pruned at iteration 0.
[I 2023-12-18 23:47:21,785] Trial 98 pruned. Trial was pruned at iteration 0.
[I 2023-12-18 23:47:21,889] Trial 99 pruned. Trial was pruned at iteration 0.
[I 2023-12-18 23:47:21,975] Trial 100 pruned. Trial was pruned at iteration 0.
[I 2023-12-18 23:47:22,043] Trial 101 pruned. Trial was pruned at iteration 0.
[I 2023-12-18 23:47:22,110] Trial 102 pruned. Trial was pruned at iteration 0.
[I 2023-12-18 23:47:22,177] Trial 103 pruned. Trial was pruned at iteration 0.
[I 2023-12-18 23:47:22,240] Trial 104 pruned. Trial was pruned at iteration 0.
[I 2023-12-18 23:47:22,301] Trial 105 pruned. Trial was pruned at iteration 0.
[I 2023-12-18 23:47:22,363] Trial 106 pruned. Trial was pruned at iteration 0.
[I 2023-12-18 23:47:22,431] Trial 107 pruned. Trial was pruned at iteration 0.
