[I 2023-12-19 04:27:13,791] Trial 212 finished with value: 4.265155447766766 and parameters: {'learning_rate': 0.7331806865377212, 'aft_loss_distribution': 'normal', 'aft_loss_distribution_scale': 1.3020918763577363, 'max_depth': 7, 'booster': 'dart', 'scale_pos_weight': 7.067858335309335, 'alpha': 4.758381747082017, 'lambda': 9.167257257468224, 'eta': 0.5259143492642939, 'sampling_method': 'uniform', 'subsample': 0.5941383186590375, 'gamma': 5.443962802869691}. Best is trial 181 with value: 4.214751273954899.
[I 2023-12-19 04:27:17,912] Trial 213 finished with value: inf and parameters: {'learning_rate': 0.7578543877273408, 'aft_loss_distribution': 'normal', 'aft_loss_distribution_scale': 1.2672808778166331, 'max_depth': 7, 'booster': 'dart', 'scale_pos_weight': 6.916596935908708, 'alpha': 4.8226552417950135, 'lambda': 9.04092853647685, 'eta': 0.5214831803955422, 'sampling_method': 'uniform', 'subsample': 0.6069085622267137, 'gamma': 5.3222676329432534}. Best is trial 181 with value: 4.214751273954899.
[I 2023-12-19 04:27:18,003] Trial 214 pruned. Trial was pruned at iteration 0.
[I 2023-12-19 04:27:18,090] Trial 215 pruned. Trial was pruned at iteration 0.
[I 2023-12-19 04:27:28,241] Trial 216 finished with value: 4.252040097461795 and parameters: {'learning_rate': 0.7290647196447531, 'aft_loss_distribution': 'normal', 'aft_loss_distribution_scale': 1.2477471251233914, 'max_depth': 7, 'booster': 'dart', 'scale_pos_weight': 6.829364001112111, 'alpha': 4.4912249350972395, 'lambda': 8.606214689697874, 'eta': 0.5492513297487743, 'sampling_method': 'uniform', 'subsample': 0.573535983519773, 'gamma': 5.885364430128995}. Best is trial 181 with value: 4.214751273954899.
[I 2023-12-19 04:27:28,328] Trial 217 pruned. Trial was pruned at iteration 0.
[I 2023-12-19 04:27:28,416] Trial 218 pruned. Trial was pruned at iteration 0.
[I 2023-12-19 04:29:01,740] Trial 219 finished with value: 4.268677842540248 and parameters: {'learning_rate': 0.7498757762374939, 'aft_loss_distribution': 'normal', 'aft_loss_distribution_scale': 1.3074988253368518, 'max_depth': 7, 'booster': 'dart', 'scale_pos_weight': 7.111999575114206, 'alpha': 4.206378679873577, 'lambda': 9.164397349155664, 'eta': 0.5655256361483131, 'sampling_method': 'uniform', 'subsample': 0.5357545033224941, 'gamma': 6.112608000857531}. Best is trial 181 with value: 4.214751273954899.
[I 2023-12-19 04:29:10,013] Trial 220 finished with value: 4.2322225621071246 and parameters: {'learning_rate': 0.7958208844302092, 'aft_loss_distribution': 'normal', 'aft_loss_distribution_scale': 1.1747577594923788, 'max_depth': 7, 'booster': 'dart', 'scale_pos_weight': 6.4500525948134255, 'alpha': 4.2934700053126615, 'lambda': 8.496721327061827, 'eta': 0.5688669136408049, 'sampling_method': 'uniform', 'subsample': 0.5126072921869177, 'gamma': 6.099177011874326}. Best is trial 181 with value: 4.214751273954899.
[I 2023-12-19 04:29:18,359] Trial 221 finished with value: inf and parameters: {'learning_rate': 0.851279311676088, 'aft_loss_distribution': 'normal', 'aft_loss_distribution_scale': 1.243373199024821, 'max_depth': 7, 'booster': 'dart', 'scale_pos_weight': 6.54429638265254, 'alpha': 4.187831232833474, 'lambda': 9.023543492205246, 'eta': 0.5715060136016745, 'sampling_method': 'uniform', 'subsample': 0.5181172007870409, 'gamma': 6.062269673005548}. Best is trial 181 with value: 4.214751273954899.
[I 2023-12-19 04:29:31,453] Trial 222 finished with value: 4.239647846102344 and parameters: {'learning_rate': 0.792099475709879, 'aft_loss_distribution': 'normal', 'aft_loss_distribution_scale': 1.1697006770935665, 'max_depth': 7, 'booster': 'dart', 'scale_pos_weight': 7.120694681221233, 'alpha': 4.385326720006412, 'lambda': 8.462150903588988, 'eta': 0.5364266662601924, 'sampling_method': 'uniform', 'subsample': 0.5486036260618804, 'gamma': 6.417844498486409}. Best is trial 181 with value: 4.214751273954899.
[I 2023-12-19 04:29:36,464] Trial 223 finished with value: inf and parameters: {'learning_rate': 0.818560559742844, 'aft_loss_distribution': 'normal', 'aft_loss_distribution_scale': 1.1233001165181749, 'max_depth': 7, 'booster': 'dart', 'scale_pos_weight': 6.740359281100802, 'alpha': 4.415616050896204, 'lambda': 8.3057004024387, 'eta': 0.5717299309383977, 'sampling_method': 'uniform', 'subsample': 0.5367746194190006, 'gamma': 6.5533725644580425}. Best is trial 181 with value: 4.214751273954899.
[I 2023-12-19 04:29:36,563] Trial 224 pruned. Trial was pruned at iteration 0.
[I 2023-12-19 04:29:39,890] Trial 225 finished with value: inf and parameters: {'learning_rate': 0.8036807866111829, 'aft_loss_distribution': 'normal', 'aft_loss_distribution_scale': 1.0987011763742702, 'max_depth': 7, 'booster': 'dart', 'scale_pos_weight': 6.333663817175055, 'alpha': 3.8595528949943954, 'lambda': 8.659989719399416, 'eta': 0.5559468950571399, 'sampling_method': 'uniform', 'subsample': 0.5447382118930556, 'gamma': 5.917744797256146}. Best is trial 181 with value: 4.214751273954899.
[I 2023-12-19 04:29:48,605] Trial 226 finished with value: inf and parameters: {'learning_rate': 0.7617929435724988, 'aft_loss_distribution': 'normal', 'aft_loss_distribution_scale': 1.2500160610219004, 'max_depth': 7, 'booster': 'dart', 'scale_pos_weight': 7.069631042458029, 'alpha': 4.586178336758095, 'lambda': 9.579303757114339, 'eta': 0.5806777237886076, 'sampling_method': 'uniform', 'subsample': 0.5641144667265072, 'gamma': 5.750751368686776}. Best is trial 181 with value: 4.214751273954899.
[I 2023-12-19 04:29:48,702] Trial 227 pruned. Trial was pruned at iteration 0.
[I 2023-12-19 04:29:48,798] Trial 228 pruned. Trial was pruned at iteration 0.
[I 2023-12-19 04:29:52,395] Trial 229 finished with value: inf and parameters: {'learning_rate': 0.8349711879419712, 'aft_loss_distribution': 'normal', 'aft_loss_distribution_scale': 1.0614393691174513, 'max_depth': 7, 'booster': 'dart', 'scale_pos_weight': 7.172939707757496, 'alpha': 4.414933596393755, 'lambda': 8.782901763973904, 'eta': 0.5616835272831435, 'sampling_method': 'uniform', 'subsample': 0.4922785544530747, 'gamma': 6.3997391444467775}. Best is trial 181 with value: 4.214751273954899.
[I 2023-12-19 04:30:03,230] Trial 230 finished with value: 4.258712210998611 and parameters: {'learning_rate': 0.7737187154719619, 'aft_loss_distribution': 'normal', 'aft_loss_distribution_scale': 1.2577588011201977, 'max_depth': 7, 'booster': 'dart', 'scale_pos_weight': 7.012273568037809, 'alpha': 5.1691816912292765, 'lambda': 9.446231691254711, 'eta': 0.5868845555378037, 'sampling_method': 'uniform', 'subsample': 0.6146940075534681, 'gamma': 5.553911031271909}. Best is trial 181 with value: 4.214751273954899.
[I 2023-12-19 04:30:23,557] Trial 231 finished with value: 4.248011082071524 and parameters: {'learning_rate': 0.7756062718284876, 'aft_loss_distribution': 'normal', 'aft_loss_distribution_scale': 1.2424204618629306, 'max_depth': 7, 'booster': 'dart', 'scale_pos_weight': 6.928964395672269, 'alpha': 5.073323923391749, 'lambda': 9.464658147812665, 'eta': 0.5863751303790865, 'sampling_method': 'uniform', 'subsample': 0.6246350254975104, 'gamma': 5.581816720805619}. Best is trial 181 with value: 4.214751273954899.
[I 2023-12-19 04:30:23,675] Trial 232 pruned. Trial was pruned at iteration 2.
[I 2023-12-19 04:30:23,784] Trial 233 pruned. Trial was pruned at iteration 0.
[I 2023-12-19 04:30:36,168] Trial 234 finished with value: 4.241345655072584 and parameters: {'learning_rate': 0.7516582167177311, 'aft_loss_distribution': 'normal', 'aft_loss_distribution_scale': 1.19014007941339, 'max_depth': 7, 'booster': 'dart', 'scale_pos_weight': 7.133887696145432, 'alpha': 5.299313783385087, 'lambda': 9.078418284786505, 'eta': 0.5614632206418506, 'sampling_method': 'uniform', 'subsample': 0.6318245286420433, 'gamma': 5.202506405515455}. Best is trial 181 with value: 4.214751273954899.
[I 2023-12-19 04:30:45,311] Trial 235 finished with value: 4.233094745220997 and parameters: {'learning_rate': 0.7693505982319213, 'aft_loss_distribution': 'normal', 'aft_loss_distribution_scale': 1.1318997992006283, 'max_depth': 7, 'booster': 'dart', 'scale_pos_weight': 7.031320769990538, 'alpha': 5.280392626803869, 'lambda': 9.04808954092425, 'eta': 0.5575187960011869, 'sampling_method': 'uniform', 'subsample': 0.6341631134023277, 'gamma': 5.880979871653274}. Best is trial 181 with value: 4.214751273954899.
[I 2023-12-19 04:30:48,608] Trial 236 finished with value: inf and parameters: {'learning_rate': 0.7952499369614302, 'aft_loss_distribution': 'normal', 'aft_loss_distribution_scale': 0.9793319850198219, 'max_depth': 7, 'booster': 'dart', 'scale_pos_weight': 6.8295805952630735, 'alpha': 5.308293263255465, 'lambda': 8.936903522923554, 'eta': 0.5434185869427827, 'sampling_method': 'uniform', 'subsample': 0.6315984736646878, 'gamma': 5.169341209858408}. Best is trial 181 with value: 4.214751273954899.
[I 2023-12-19 04:30:48,710] Trial 237 pruned. Trial was pruned at iteration 0.
[I 2023-12-19 04:30:48,799] Trial 238 pruned. Trial was pruned at iteration 0.
[I 2023-12-19 04:30:51,979] Trial 239 finished with value: inf and parameters: {'learning_rate': 0.811304422984254, 'aft_loss_distribution': 'normal', 'aft_loss_distribution_scale': 0.9892568992289671, 'max_depth': 7, 'booster': 'dart', 'scale_pos_weight': 6.4583058742867765, 'alpha': 5.003233055444012, 'lambda': 9.279290248132698, 'eta': 0.5246758009027288, 'sampling_method': 'uniform', 'subsample': 0.6393390290926241, 'gamma': 5.478652338218135}. Best is trial 181 with value: 4.214751273954899.
[I 2023-12-19 04:31:03,904] Trial 240 finished with value: 4.250068946385241 and parameters: {'learning_rate': 0.7577808581281484, 'aft_loss_distribution': 'normal', 'aft_loss_distribution_scale': 1.2356671169927869, 'max_depth': 7, 'booster': 'dart', 'scale_pos_weight': 7.507758073134607, 'alpha': 5.317789290611459, 'lambda': 8.879025837537764, 'eta': 0.5976365751416268, 'sampling_method': 'uniform', 'subsample': 0.5882977897908734, 'gamma': 5.172167807747343}. Best is trial 181 with value: 4.214751273954899.
[I 2023-12-19 04:31:08,282] Trial 241 finished with value: inf and parameters: {'learning_rate': 0.7602443380719806, 'aft_loss_distribution': 'normal', 'aft_loss_distribution_scale': 1.1676200732967164, 'max_depth': 7, 'booster': 'dart', 'scale_pos_weight': 7.541043632581906, 'alpha': 5.282372832118852, 'lambda': 8.833159518378418, 'eta': 0.6017161998617474, 'sampling_method': 'uniform', 'subsample': 0.5882875618473119, 'gamma': 5.222242527733944}. Best is trial 181 with value: 4.214751273954899.
[I 2023-12-19 04:31:08,370] Trial 242 pruned. Trial was pruned at iteration 0.
[I 2023-12-19 04:31:08,460] Trial 243 pruned. Trial was pruned at iteration 0.
[I 2023-12-19 04:31:08,610] Trial 244 pruned. Trial was pruned at iteration 4.
[I 2023-12-19 04:31:08,708] Trial 245 pruned. Trial was pruned at iteration 0.
[I 2023-12-19 04:31:08,806] Trial 246 pruned. Trial was pruned at iteration 0.
[I 2023-12-19 04:31:08,893] Trial 247 pruned. Trial was pruned at iteration 0.
[I 2023-12-19 04:31:08,990] Trial 248 pruned. Trial was pruned at iteration 0.
[I 2023-12-19 04:31:09,094] Trial 249 pruned. Trial was pruned at iteration 0.
Completed hyperparameter tuning with best aft-nloglik = 4.214751273954899.
Re-running the best trial... params = {'verbosity': 0, 'objective': 'survival:aft', 'eval_metric': 'aft-nloglik', 'tree_method': 'hist', 'learning_rate': 0.738242158490905, 'aft_loss_distribution': 'normal', 'aft_loss_distribution_scale': 1.0948356286722245, 'max_depth': 7, 'booster': 'dart', 'scale_pos_weight': 7.2169421109668335, 'alpha': 5.742043067056761, 'lambda': 9.362148980010934, 'eta': 0.5998943306865643, 'sampling_method': 'uniform', 'subsample': 0.6095137818380654, 'gamma': 5.75268892238416}
[W 2023-12-19 04:31:30,135] Trial 7 is omitted in visualization because its objective value is inf or nan.
[W 2023-12-19 04:31:30,140] Trial 31 is omitted in visualization because its objective value is inf or nan.
[W 2023-12-19 04:31:30,141] Trial 54 is omitted in visualization because its objective value is inf or nan.
[W 2023-12-19 04:31:30,143] Trial 60 is omitted in visualization because its objective value is inf or nan.
[W 2023-12-19 04:31:30,144] Trial 68 is omitted in visualization because its objective value is inf or nan.
[W 2023-12-19 04:31:30,146] Trial 74 is omitted in visualization because its objective value is inf or nan.
[W 2023-12-19 04:31:30,148] Trial 84 is omitted in visualization because its objective value is inf or nan.
[W 2023-12-19 04:31:30,150] Trial 92 is omitted in visualization because its objective value is inf or nan.
[W 2023-12-19 04:31:30,152] Trial 100 is omitted in visualization because its objective value is inf or nan.
[W 2023-12-19 04:31:30,154] Trial 130 is omitted in visualization because its objective value is inf or nan.
[W 2023-12-19 04:31:30,156] Trial 161 is omitted in visualization because its objective value is inf or nan.
[W 2023-12-19 04:31:30,157] Trial 166 is omitted in visualization because its objective value is inf or nan.
[W 2023-12-19 04:31:30,160] Trial 171 is omitted in visualization because its objective value is inf or nan.
[W 2023-12-19 04:31:30,162] Trial 179 is omitted in visualization because its objective value is inf or nan.
[W 2023-12-19 04:31:30,164] Trial 184 is omitted in visualization because its objective value is inf or nan.
[W 2023-12-19 04:31:30,166] Trial 187 is omitted in visualization because its objective value is inf or nan.
[W 2023-12-19 04:31:30,169] Trial 188 is omitted in visualization because its objective value is inf or nan.
[W 2023-12-19 04:31:30,170] Trial 191 is omitted in visualization because its objective value is inf or nan.
[W 2023-12-19 04:31:30,172] Trial 197 is omitted in visualization because its objective value is inf or nan.
[W 2023-12-19 04:31:30,177] Trial 209 is omitted in visualization because its objective value is inf or nan.
[W 2023-12-19 04:31:30,178] Trial 213 is omitted in visualization because its objective value is inf or nan.
[W 2023-12-19 04:31:30,179] Trial 221 is omitted in visualization because its objective value is inf or nan.
[W 2023-12-19 04:31:30,180] Trial 223 is omitted in visualization because its objective value is inf or nan.
[W 2023-12-19 04:31:30,182] Trial 225 is omitted in visualization because its objective value is inf or nan.
[W 2023-12-19 04:31:30,183] Trial 226 is omitted in visualization because its objective value is inf or nan.
[W 2023-12-19 04:31:30,185] Trial 229 is omitted in visualization because its objective value is inf or nan.
[W 2023-12-19 04:31:30,186] Trial 236 is omitted in visualization because its objective value is inf or nan.
[W 2023-12-19 04:31:30,187] Trial 239 is omitted in visualization because its objective value is inf or nan.
[W 2023-12-19 04:31:30,188] Trial 241 is omitted in visualization because its objective value is inf or nan.
TRN1 | R2:0.385; p:0.0 | C:69.40 |3h:0.881 |6h:0.862 |9h:0.846 |12h:0.404 |15h:0.404 |18h:0.399 |24h:0.166 |48h:0.158 |72h:0.152 |1wk:0.021 |2wks:0.019 |1mon:0.014 |
TRN2 | R2:0.280; p:3.428e-58 | C:64.08 |3h:0.881 |6h:0.862 |9h:0.846 |12h:0.402 |15h:0.402 |18h:0.397 |24h:0.163 |48h:0.156 |72h:0.150 |1wk:0.020 |2wks:0.019 |1mon:0.014 |
VAL | R2:0.251; p:7.684e-47 | C:62.61 |3h:0.881 |6h:0.862 |9h:0.846 |12h:0.402 |15h:0.402 |18h:0.397 |24h:0.164 |48h:0.156 |72h:0.149 |1wk:0.021 |2wks:0.019 |1mon:0.013 |
TST | R2:0.102; p:3.685e-46 | C:54.97 |3h:0.879 |6h:0.856 |9h:0.838 |12h:0.396 |15h:0.396 |18h:0.386 |24h:0.125 |48h:0.120 |72h:0.116 |1wk:0.019 |2wks:0.018 |1mon:0.013 |
[I 2023-12-19 04:31:36,317] A new study created in memory with name: no-name-a200b380-8d1c-46c3-88da-672cd7cccce5
/content/drive/MyDrive/intermediates2/res//outcome1_xgb-aft_inp39_all_rdims8.json
All avail dimensionality reduced word embedding with ['location_numeric', 'race_numeric', 'sex_numeric', 'body_part_numeric', 'product_1_numeric', 'product_2_numeric', 'drug_numeric', 'alcohol_numeric', 'month']
All avail dimensionality reduced word embedding with ['location_numeric', 'race_numeric', 'sex_numeric', 'body_part_numeric', 'product_1_numeric', 'product_2_numeric', 'drug_numeric', 'alcohol_numeric', 'month']
All avail dimensionality reduced word embedding with ['location_numeric', 'race_numeric', 'sex_numeric', 'body_part_numeric', 'product_1_numeric', 'product_2_numeric', 'drug_numeric', 'alcohol_numeric', 'month']
All avail dimensionality reduced word embedding with ['location_numeric', 'race_numeric', 'sex_numeric', 'body_part_numeric', 'product_1_numeric', 'product_2_numeric', 'drug_numeric', 'alcohol_numeric', 'month']
trn1
trn2
val
tst
[I 2023-12-19 04:31:44,841] Trial 0 finished with value: inf and parameters: {'learning_rate': 0.8449409626154094, 'aft_loss_distribution': 'normal', 'aft_loss_distribution_scale': 6.419237994695951, 'max_depth': 5, 'booster': 'dart', 'scale_pos_weight': 0.9156364164044042, 'alpha': 2.627494538455917, 'lambda': 6.930883921134454, 'eta': 0.3871339472675096, 'sampling_method': 'uniform', 'subsample': 0.813770084524415, 'gamma': 7.244633697560186}. Best is trial 0 with value: inf.
[I 2023-12-19 04:32:09,349] Trial 1 finished with value: 6.322911682646918 and parameters: {'learning_rate': 0.5564304799314518, 'aft_loss_distribution': 'logistic', 'aft_loss_distribution_scale': 9.615685969605556, 'max_depth': 3, 'booster': 'dart', 'scale_pos_weight': 7.877576875512996, 'alpha': 6.369864667249796, 'lambda': 5.1575895637425395, 'eta': 0.3859894304537953, 'sampling_method': 'uniform', 'subsample': 0.8428205846749042, 'gamma': 1.6059307620190202}. Best is trial 1 with value: 6.322911682646918.
[I 2023-12-19 04:32:19,162] Trial 2 finished with value: 5.528933460759559 and parameters: {'learning_rate': 0.6258973143355403, 'aft_loss_distribution': 'extreme', 'aft_loss_distribution_scale': 5.9586800847214425, 'max_depth': 4, 'booster': 'dart', 'scale_pos_weight': 5.76403989605531, 'alpha': 5.9146053022448255, 'lambda': 6.05535019774567, 'eta': 0.9315110069380669, 'sampling_method': 'uniform', 'subsample': 0.6558823369971709, 'gamma': 3.1371316865921894}. Best is trial 2 with value: 5.528933460759559.
[I 2023-12-19 04:32:19,845] Trial 3 finished with value: 5.935661473419167 and parameters: {'learning_rate': 0.1352424968522989, 'aft_loss_distribution': 'logistic', 'aft_loss_distribution_scale': 6.371182520480615, 'max_depth': 9, 'booster': 'gbtree', 'scale_pos_weight': 0.3624652061183104, 'alpha': 0.43027955874746265, 'lambda': 5.061734129869681, 'eta': 0.4592808389440989, 'sampling_method': 'uniform', 'subsample': 0.2819660666123079, 'gamma': 9.790044748245814}. Best is trial 2 with value: 5.528933460759559.
[I 2023-12-19 04:32:48,079] Trial 4 finished with value: 4.981984466995365 and parameters: {'learning_rate': 0.842419122634199, 'aft_loss_distribution': 'extreme', 'aft_loss_distribution_scale': 3.209934620037013, 'max_depth': 6, 'booster': 'dart', 'scale_pos_weight': 4.771484971476577, 'alpha': 2.8175041940848056, 'lambda': 0.8138366154926195, 'eta': 0.5606034041467951, 'sampling_method': 'uniform', 'subsample': 0.8502380508282468, 'gamma': 5.722162246090479}. Best is trial 4 with value: 4.981984466995365.
[I 2023-12-19 04:32:48,097] Trial 5 pruned. Trial was pruned at iteration 0.
[I 2023-12-19 04:32:51,542] Trial 6 finished with value: inf and parameters: {'learning_rate': 0.8871243861668444, 'aft_loss_distribution': 'logistic', 'aft_loss_distribution_scale': 1.5573116684781914, 'max_depth': 5, 'booster': 'dart', 'scale_pos_weight': 4.510375286725857, 'alpha': 8.131686250191263, 'lambda': 7.52714926288502, 'eta': 0.29676337148731724, 'sampling_method': 'uniform', 'subsample': 0.32055448623611166, 'gamma': 3.5219760433060676}. Best is trial 4 with value: 4.981984466995365.
[I 2023-12-19 04:32:51,559] Trial 7 pruned. Trial was pruned at iteration 0.
[I 2023-12-19 04:32:51,575] Trial 8 pruned. Trial was pruned at iteration 0.
[I 2023-12-19 04:32:51,593] Trial 9 pruned. Trial was pruned at iteration 0.
[I 2023-12-19 04:32:51,663] Trial 10 pruned. Trial was pruned at iteration 0.
[I 2023-12-19 04:33:14,524] Trial 11 finished with value: 5.161706531682159 and parameters: {'learning_rate': 0.6798462556240843, 'aft_loss_distribution': 'extreme', 'aft_loss_distribution_scale': 3.958743322789955, 'max_depth': 6, 'booster': 'dart', 'scale_pos_weight': 6.656343113543527, 'alpha': 9.93734239749043, 'lambda': 1.6849076867197375, 'eta': 0.749797143268163, 'sampling_method': 'uniform', 'subsample': 0.6641137002515767, 'gamma': 5.653349553481774}. Best is trial 4 with value: 4.981984466995365.
[I 2023-12-19 04:33:20,553] Trial 12 finished with value: 5.048130163871516 and parameters: {'learning_rate': 0.713744855667947, 'aft_loss_distribution': 'extreme', 'aft_loss_distribution_scale': 3.472931792099237, 'max_depth': 6, 'booster': 'dart', 'scale_pos_weight': 9.473928235760106, 'alpha': 9.14573705645492, 'lambda': 1.0596642541958459, 'eta': 0.7149332415195965, 'sampling_method': 'uniform', 'subsample': 0.9708899173505073, 'gamma': 5.569724395190895}. Best is trial 4 with value: 4.981984466995365.
[I 2023-12-19 04:33:20,619] Trial 13 pruned. Trial was pruned at iteration 0.
[I 2023-12-19 04:33:20,683] Trial 14 pruned. Trial was pruned at iteration 0.
[I 2023-12-19 04:33:46,885] Trial 15 finished with value: 5.245089673328 and parameters: {'learning_rate': 0.7632294722861758, 'aft_loss_distribution': 'extreme', 'aft_loss_distribution_scale': 4.3533866757951625, 'max_depth': 8, 'booster': 'dart', 'scale_pos_weight': 9.463923550049639, 'alpha': 9.982747990206157, 'lambda': 3.1475142490907304, 'eta': 0.6112531695105374, 'sampling_method': 'uniform', 'subsample': 0.6828776108644155, 'gamma': 5.934003771203842}. Best is trial 4 with value: 4.981984466995365.
[I 2023-12-19 04:33:46,963] Trial 16 pruned. Trial was pruned at iteration 0.
[I 2023-12-19 04:33:47,034] Trial 17 pruned. Trial was pruned at iteration 0.
