[I 2023-12-18 22:55:05,324] Trial 493 pruned. Trial was pruned at iteration 0.
[I 2023-12-18 22:55:05,489] Trial 494 pruned. Trial was pruned at iteration 0.
[I 2023-12-18 22:55:05,648] Trial 495 pruned. Trial was pruned at iteration 0.
[I 2023-12-18 22:55:05,814] Trial 496 pruned. Trial was pruned at iteration 0.
[I 2023-12-18 22:55:05,979] Trial 497 pruned. Trial was pruned at iteration 0.
[I 2023-12-18 22:55:06,137] Trial 498 pruned. Trial was pruned at iteration 0.
[I 2023-12-18 22:55:06,296] Trial 499 pruned. Trial was pruned at iteration 0.
Completed hyperparameter tuning with best aft-nloglik = 4.252948890054525.
Re-running the best trial... params = {'verbosity': 0, 'objective': 'survival:aft', 'eval_metric': 'aft-nloglik', 'tree_method': 'gpu_hist', 'device': 'cuda', 'learning_rate': 0.14556897091562926, 'aft_loss_distribution': 'logistic', 'aft_loss_distribution_scale': 0.7458350238836285, 'max_depth': 5, 'booster': 'dart', 'scale_pos_weight': 9.210173166377784, 'alpha': 1.3538354180766223, 'lambda': 5.896130578706832, 'eta': 0.9466685121705658, 'sampling_method': 'uniform', 'subsample': 0.6640866650928995, 'gamma': 7.245633854233718}
[W 2023-12-18 22:55:39,710] Trial 3 is omitted in visualization because its objective value is inf or nan.
[W 2023-12-18 22:55:39,712] Trial 4 is omitted in visualization because its objective value is inf or nan.
[W 2023-12-18 22:55:39,718] Trial 10 is omitted in visualization because its objective value is inf or nan.
[W 2023-12-18 22:55:39,721] Trial 16 is omitted in visualization because its objective value is inf or nan.
TRN1 | R2:0.309; p:5.355e-140 | C:65.29 |3h:0.878 |6h:0.859 |9h:0.843 |12h:0.396 |15h:0.396 |18h:0.392 |24h:0.160 |48h:0.153 |72h:0.147 |1wk:0.021 |2wks:0.019 |1mon:0.013 |
TRN2 | R2:0.244; p:1.342e-86 | C:62.07 |3h:0.877 |6h:0.858 |9h:0.842 |12h:0.395 |15h:0.395 |18h:0.391 |24h:0.159 |48h:0.152 |72h:0.146 |1wk:0.021 |2wks:0.019 |1mon:0.014 |
VAL | R2:0.235; p:1.952e-80 | C:61.68 |3h:0.877 |6h:0.858 |9h:0.842 |12h:0.395 |15h:0.395 |18h:0.390 |24h:0.159 |48h:0.151 |72h:0.146 |1wk:0.021 |2wks:0.019 |1mon:0.013 |
[I 2023-12-18 22:55:45,058] A new study created in memory with name: no-name-e5a9d73b-8307-48bc-ad8f-bcd4e87e857a
TST | R2:0.157; p:2.08e-107 | C:57.64 |3h:0.868 |6h:0.847 |9h:0.829 |12h:0.391 |15h:0.391 |18h:0.380 |24h:0.124 |48h:0.119 |72h:0.115 |1wk:0.020 |2wks:0.019 |1mon:0.014 |
/content/drive/MyDrive/intermediates2/res//outcome1_xgb-aft_inp49_k3_all_rdims8.json
Dimensionality reduced word embedding 1 with ['location_numeric', 'race_numeric', 'sex_numeric']
Dimensionality reduced word embedding 1 with ['location_numeric', 'race_numeric', 'sex_numeric']
Dimensionality reduced word embedding 1 with ['location_numeric', 'race_numeric', 'sex_numeric']
Dimensionality reduced word embedding 1 with ['location_numeric', 'race_numeric', 'sex_numeric']
trn1
trn2
val
tst
[I 2023-12-18 22:55:46,651] Trial 0 finished with value: inf and parameters: {'learning_rate': 0.3013186410148245, 'aft_loss_distribution': 'normal', 'aft_loss_distribution_scale': 0.3903048085055709, 'max_depth': 3, 'booster': 'dart', 'scale_pos_weight': 0.6717265172983682, 'alpha': 1.6009463265429078, 'lambda': 8.82357061952969, 'eta': 0.6122832037359274, 'sampling_method': 'uniform', 'subsample': 0.012279183420786632, 'gamma': 9.423342144998196}. Best is trial 0 with value: inf.
[I 2023-12-18 22:55:46,914] Trial 1 finished with value: 6.006152613361274 and parameters: {'learning_rate': 0.2697267831150953, 'aft_loss_distribution': 'extreme', 'aft_loss_distribution_scale': 9.756697467136288, 'max_depth': 4, 'booster': 'gbtree', 'scale_pos_weight': 6.444983875993294, 'alpha': 2.656828903437113, 'lambda': 8.06430867673937, 'eta': 0.5705403243625645, 'sampling_method': 'uniform', 'subsample': 0.6132946707748187, 'gamma': 3.959825398359015}. Best is trial 1 with value: 6.006152613361274.
[I 2023-12-18 22:55:52,083] Trial 2 finished with value: 5.931270881778219 and parameters: {'learning_rate': 0.5415949185512554, 'aft_loss_distribution': 'normal', 'aft_loss_distribution_scale': 9.929852528383295, 'max_depth': 4, 'booster': 'dart', 'scale_pos_weight': 2.129519321083568, 'alpha': 4.269125060451842, 'lambda': 2.9802756266376265, 'eta': 0.103323382671057, 'sampling_method': 'uniform', 'subsample': 0.9996812956803399, 'gamma': 4.801917866306311}. Best is trial 2 with value: 5.931270881778219.
[I 2023-12-18 22:55:56,165] Trial 3 finished with value: 5.032017701957563 and parameters: {'learning_rate': 0.8279414696551292, 'aft_loss_distribution': 'normal', 'aft_loss_distribution_scale': 3.7305163138524207, 'max_depth': 9, 'booster': 'dart', 'scale_pos_weight': 7.850001195378588, 'alpha': 9.46842608263869, 'lambda': 5.264812808462377, 'eta': 0.24938577796332728, 'sampling_method': 'gradient_based', 'subsample': 0.909469025977524, 'gamma': 8.583643586918887}. Best is trial 3 with value: 5.032017701957563.
[I 2023-12-18 22:55:56,310] Trial 4 finished with value: inf and parameters: {'learning_rate': 0.9655274134787041, 'aft_loss_distribution': 'normal', 'aft_loss_distribution_scale': 6.158317479369868, 'max_depth': 7, 'booster': 'gbtree', 'scale_pos_weight': 0.3198629347813366, 'alpha': 2.38117590849461, 'lambda': 0.4739310081110738, 'eta': 0.31633793387896125, 'sampling_method': 'gradient_based', 'subsample': 0.7175755133341785, 'gamma': 8.629988856222054}. Best is trial 3 with value: 5.032017701957563.
[I 2023-12-18 22:55:56,324] Trial 5 pruned. Trial was pruned at iteration 0.
[I 2023-12-18 22:55:56,338] Trial 6 pruned. Trial was pruned at iteration 0.
[I 2023-12-18 22:55:56,697] Trial 7 finished with value: 5.441891557776094 and parameters: {'learning_rate': 0.35714244082847196, 'aft_loss_distribution': 'normal', 'aft_loss_distribution_scale': 5.877146311214493, 'max_depth': 3, 'booster': 'gbtree', 'scale_pos_weight': 6.3297046928356675, 'alpha': 9.041652158517682, 'lambda': 2.5102547134339943, 'eta': 0.11215982296520044, 'sampling_method': 'gradient_based', 'subsample': 0.32635961814867187, 'gamma': 4.362131953408335}. Best is trial 3 with value: 5.032017701957563.
[I 2023-12-18 22:55:56,709] Trial 8 pruned. Trial was pruned at iteration 0.
[I 2023-12-18 22:55:56,964] Trial 9 finished with value: 5.529706166133666 and parameters: {'learning_rate': 0.5424714071241963, 'aft_loss_distribution': 'normal', 'aft_loss_distribution_scale': 6.465036845460653, 'max_depth': 10, 'booster': 'gbtree', 'scale_pos_weight': 8.947821905120074, 'alpha': 3.0190549863276783, 'lambda': 4.200422599699826, 'eta': 0.8368704359484102, 'sampling_method': 'gradient_based', 'subsample': 0.8067319283218908, 'gamma': 0.20704113386136333}. Best is trial 3 with value: 5.032017701957563.
[I 2023-12-18 22:55:57,019] Trial 10 pruned. Trial was pruned at iteration 0.
[I 2023-12-18 22:56:03,002] Trial 11 finished with value: 4.98874372841384 and parameters: {'learning_rate': 0.7108445710458718, 'aft_loss_distribution': 'normal', 'aft_loss_distribution_scale': 3.5523426251913723, 'max_depth': 6, 'booster': 'dart', 'scale_pos_weight': 7.103874129429863, 'alpha': 9.258497190456197, 'lambda': 2.149701388576591, 'eta': 0.30915485746166693, 'sampling_method': 'gradient_based', 'subsample': 0.40086032696489293, 'gamma': 2.714795072167409}. Best is trial 11 with value: 4.98874372841384.
[I 2023-12-18 22:56:08,878] Trial 12 finished with value: 4.983875693241955 and parameters: {'learning_rate': 0.7644768319470301, 'aft_loss_distribution': 'normal', 'aft_loss_distribution_scale': 3.5325086202116087, 'max_depth': 6, 'booster': 'dart', 'scale_pos_weight': 7.66469130023893, 'alpha': 8.124861426205925, 'lambda': 0.2653193265285698, 'eta': 0.36630701050041026, 'sampling_method': 'gradient_based', 'subsample': 0.43058915822685434, 'gamma': 2.9449167950377415}. Best is trial 12 with value: 4.983875693241955.
[I 2023-12-18 22:56:13,490] Trial 13 finished with value: 4.818571568545651 and parameters: {'learning_rate': 0.745271330943138, 'aft_loss_distribution': 'normal', 'aft_loss_distribution_scale': 2.908001269795891, 'max_depth': 6, 'booster': 'dart', 'scale_pos_weight': 4.205460772566994, 'alpha': 7.638519236548354, 'lambda': 0.07680801288099914, 'eta': 0.44558182780787237, 'sampling_method': 'gradient_based', 'subsample': 0.4050284304357929, 'gamma': 2.4140642551751403}. Best is trial 13 with value: 4.818571568545651.
[I 2023-12-18 22:56:16,791] Trial 14 finished with value: 4.592799525562083 and parameters: {'learning_rate': 0.7141792258688371, 'aft_loss_distribution': 'normal', 'aft_loss_distribution_scale': 2.1803432263972016, 'max_depth': 6, 'booster': 'dart', 'scale_pos_weight': 3.8575351124741113, 'alpha': 6.714748979443696, 'lambda': 0.06221656096382441, 'eta': 0.6788396692974066, 'sampling_method': 'gradient_based', 'subsample': 0.482731262208312, 'gamma': 2.281988808041789}. Best is trial 14 with value: 4.592799525562083.
[I 2023-12-18 22:56:18,601] Trial 15 finished with value: inf and parameters: {'learning_rate': 0.6659865879189775, 'aft_loss_distribution': 'logistic', 'aft_loss_distribution_scale': 2.0679250739037514, 'max_depth': 5, 'booster': 'dart', 'scale_pos_weight': 3.4187572070215224, 'alpha': 6.176631933406375, 'lambda': 1.2173283462593407, 'eta': 0.7354859334060452, 'sampling_method': 'gradient_based', 'subsample': 0.22344997524478252, 'gamma': 1.8015806436168589}. Best is trial 14 with value: 4.592799525562083.
[I 2023-12-18 22:56:20,396] Trial 16 finished with value: inf and parameters: {'learning_rate': 0.9866022486014947, 'aft_loss_distribution': 'normal', 'aft_loss_distribution_scale': 1.8731049825009354, 'max_depth': 8, 'booster': 'dart', 'scale_pos_weight': 4.022461179066434, 'alpha': 0.08949425363692409, 'lambda': 4.002987581264681, 'eta': 0.6633919429496155, 'sampling_method': 'gradient_based', 'subsample': 0.5426242637032074, 'gamma': 6.759226510062673}. Best is trial 14 with value: 4.592799525562083.
[I 2023-12-18 22:56:20,483] Trial 17 pruned. Trial was pruned at iteration 0.
[I 2023-12-18 22:56:20,562] Trial 18 pruned. Trial was pruned at iteration 0.
[I 2023-12-18 22:56:20,622] Trial 19 pruned. Trial was pruned at iteration 0.
[I 2023-12-18 22:56:20,670] Trial 20 pruned. Trial was pruned at iteration 0.
[I 2023-12-18 22:56:26,405] Trial 21 finished with value: 4.788785989177222 and parameters: {'learning_rate': 0.7620257399157985, 'aft_loss_distribution': 'normal', 'aft_loss_distribution_scale': 2.803914744159775, 'max_depth': 6, 'booster': 'dart', 'scale_pos_weight': 4.378026380719769, 'alpha': 8.514790958763932, 'lambda': 0.06359485970289361, 'eta': 0.38955112410147086, 'sampling_method': 'gradient_based', 'subsample': 0.44626693258721317, 'gamma': 2.952256083051071}. Best is trial 14 with value: 4.592799525562083.
[I 2023-12-18 22:56:32,477] Trial 22 finished with value: 4.707277606654769 and parameters: {'learning_rate': 0.7763244377987116, 'aft_loss_distribution': 'normal', 'aft_loss_distribution_scale': 2.534097387180098, 'max_depth': 7, 'booster': 'dart', 'scale_pos_weight': 4.481284636440489, 'alpha': 8.433134269577767, 'lambda': 0.8999221186503312, 'eta': 0.5590273953337825, 'sampling_method': 'gradient_based', 'subsample': 0.3711426997641485, 'gamma': 3.615540168606207}. Best is trial 14 with value: 4.592799525562083.
[I 2023-12-18 22:56:34,146] Trial 23 finished with value: inf and parameters: {'learning_rate': 0.8134236401644183, 'aft_loss_distribution': 'normal', 'aft_loss_distribution_scale': 1.4574245360800777, 'max_depth': 7, 'booster': 'dart', 'scale_pos_weight': 5.479449963996048, 'alpha': 8.55089858775843, 'lambda': 3.299305016809544, 'eta': 0.5812207685430164, 'sampling_method': 'gradient_based', 'subsample': 0.31859462984257325, 'gamma': 5.785806665545035}. Best is trial 14 with value: 4.592799525562083.
[I 2023-12-18 22:56:40,134] Trial 24 finished with value: 4.7761705813884054 and parameters: {'learning_rate': 0.5984860140936007, 'aft_loss_distribution': 'normal', 'aft_loss_distribution_scale': 2.760642826164915, 'max_depth': 8, 'booster': 'dart', 'scale_pos_weight': 2.908634336299983, 'alpha': 6.8118002610366855, 'lambda': 1.859020707540379, 'eta': 0.002381542928847402, 'sampling_method': 'gradient_based', 'subsample': 0.47261398393214277, 'gamma': 3.8238124321026543}. Best is trial 14 with value: 4.592799525562083.
[I 2023-12-18 22:56:41,995] Trial 25 finished with value: inf and parameters: {'learning_rate': 0.6111809257306622, 'aft_loss_distribution': 'normal', 'aft_loss_distribution_scale': 2.27197099712001, 'max_depth': 8, 'booster': 'dart', 'scale_pos_weight': 2.550395729934185, 'alpha': 6.654849114737432, 'lambda': 1.8703138471449776, 'eta': 0.6848933031578374, 'sampling_method': 'gradient_based', 'subsample': 0.6190183432099706, 'gamma': 3.6659401825137747}. Best is trial 14 with value: 4.592799525562083.
[I 2023-12-18 22:56:42,056] Trial 26 pruned. Trial was pruned at iteration 0.
[I 2023-12-18 22:56:43,418] Trial 27 finished with value: inf and parameters: {'learning_rate': 0.6467738407692332, 'aft_loss_distribution': 'normal', 'aft_loss_distribution_scale': 1.1619136287762855, 'max_depth': 8, 'booster': 'dart', 'scale_pos_weight': 1.251955746132013, 'alpha': 3.97043740065308, 'lambda': 3.2925701753247254, 'eta': 0.5553350656463266, 'sampling_method': 'gradient_based', 'subsample': 0.5185828377103754, 'gamma': 4.803951202858869}. Best is trial 14 with value: 4.592799525562083.
[I 2023-12-18 22:56:43,477] Trial 28 pruned. Trial was pruned at iteration 0.
[I 2023-12-18 22:56:43,526] Trial 29 pruned. Trial was pruned at iteration 0.
[I 2023-12-18 22:56:43,579] Trial 30 pruned. Trial was pruned at iteration 0.
[I 2023-12-18 22:56:50,224] Trial 31 finished with value: 4.863323422381678 and parameters: {'learning_rate': 0.7529623713423566, 'aft_loss_distribution': 'normal', 'aft_loss_distribution_scale': 3.06764728817238, 'max_depth': 6, 'booster': 'dart', 'scale_pos_weight': 4.530397702873673, 'alpha': 8.708798559286649, 'lambda': 0.7581913853711778, 'eta': 0.016605359136540435, 'sampling_method': 'gradient_based', 'subsample': 0.47249357281892934, 'gamma': 2.3948572549568086}. Best is trial 14 with value: 4.592799525562083.
[I 2023-12-18 22:56:50,282] Trial 32 pruned. Trial was pruned at iteration 0.
[I 2023-12-18 22:56:52,297] Trial 33 finished with value: inf and parameters: {'learning_rate': 0.6004836199094797, 'aft_loss_distribution': 'normal', 'aft_loss_distribution_scale': 2.408295384716379, 'max_depth': 4, 'booster': 'dart', 'scale_pos_weight': 3.6679144530404377, 'alpha': 8.096882791241923, 'lambda': 1.871324018271053, 'eta': 0.5389013587444577, 'sampling_method': 'gradient_based', 'subsample': 0.35970030579202095, 'gamma': 4.089051779847594}. Best is trial 14 with value: 4.592799525562083.
[I 2023-12-18 22:56:55,267] Trial 34 finished with value: 4.418252807515928 and parameters: {'learning_rate': 0.7960932902683281, 'aft_loss_distribution': 'normal', 'aft_loss_distribution_scale': 1.67220523072732, 'max_depth': 7, 'booster': 'dart', 'scale_pos_weight': 4.799405803586067, 'alpha': 7.913858527966897, 'lambda': 0.8807851703969489, 'eta': 0.6187068855235105, 'sampling_method': 'uniform', 'subsample': 0.5614776941171395, 'gamma': 4.475308354776466}. Best is trial 34 with value: 4.418252807515928.
[I 2023-12-18 22:56:55,456] Trial 35 finished with value: inf and parameters: {'learning_rate': 0.846296362659476, 'aft_loss_distribution': 'normal', 'aft_loss_distribution_scale': 1.125080783033617, 'max_depth': 7, 'booster': 'gbtree', 'scale_pos_weight': 5.912838105883541, 'alpha': 7.827733749900192, 'lambda': 2.64008284333448, 'eta': 0.6257077565908772, 'sampling_method': 'uniform', 'subsample': 0.6773794235282129, 'gamma': 4.427905623335897}. Best is trial 34 with value: 4.418252807515928.
[I 2023-12-18 22:56:57,282] Trial 36 finished with value: inf and parameters: {'learning_rate': 0.9237470977020279, 'aft_loss_distribution': 'normal', 'aft_loss_distribution_scale': 1.7928459240632824, 'max_depth': 9, 'booster': 'dart', 'scale_pos_weight': 4.881372746095724, 'alpha': 6.1039035314121985, 'lambda': 0.7924202991165858, 'eta': 0.706451646658516, 'sampling_method': 'uniform', 'subsample': 0.5746921730993021, 'gamma': 5.136760495435907}. Best is trial 34 with value: 4.418252807515928.
[I 2023-12-18 22:56:57,350] Trial 37 pruned. Trial was pruned at iteration 0.
[I 2023-12-18 22:56:57,399] Trial 38 pruned. Trial was pruned at iteration 0.
[I 2023-12-18 22:56:57,454] Trial 39 pruned. Trial was pruned at iteration 0.
[I 2023-12-18 22:56:57,506] Trial 40 pruned. Trial was pruned at iteration 0.
[I 2023-12-18 22:57:04,123] Trial 41 finished with value: 4.767012831421341 and parameters: {'learning_rate': 0.7863186784539626, 'aft_loss_distribution': 'normal', 'aft_loss_distribution_scale': 2.729982523698868, 'max_depth': 6, 'booster': 'dart', 'scale_pos_weight': 4.2712868424451464, 'alpha': 8.355326446649913, 'lambda': 0.4814710963146256, 'eta': 0.388646802803093, 'sampling_method': 'gradient_based', 'subsample': 0.4535473998419803, 'gamma': 3.0214962569003343}. Best is trial 34 with value: 4.418252807515928.
[I 2023-12-18 22:57:05,502] Trial 42 finished with value: inf and parameters: {'learning_rate': 0.7986586255856248, 'aft_loss_distribution': 'normal', 'aft_loss_distribution_scale': 0.9096255710699286, 'max_depth': 6, 'booster': 'dart', 'scale_pos_weight': 4.835517436956952, 'alpha': 7.357986221377765, 'lambda': 1.0713515251071088, 'eta': 0.19248733022142475, 'sampling_method': 'gradient_based', 'subsample': 0.47160071684992466, 'gamma': 2.2909506177577637}. Best is trial 34 with value: 4.418252807515928.
[I 2023-12-18 22:57:07,336] Trial 43 finished with value: inf and parameters: {'learning_rate': 0.8640310907660914, 'aft_loss_distribution': 'normal', 'aft_loss_distribution_scale': 1.8045823108304697, 'max_depth': 5, 'booster': 'dart', 'scale_pos_weight': 3.3067754585085956, 'alpha': 9.409449857620041, 'lambda': 0.6463874028034897, 'eta': 0.321124603471913, 'sampling_method': 'gradient_based', 'subsample': 0.3427903501819467, 'gamma': 3.3192986579525288}. Best is trial 34 with value: 4.418252807515928.
[I 2023-12-18 22:57:07,394] Trial 44 pruned. Trial was pruned at iteration 0.
[I 2023-12-18 22:57:07,445] Trial 45 pruned. Trial was pruned at iteration 0.
[I 2023-12-18 22:57:07,500] Trial 46 pruned. Trial was pruned at iteration 0.
[I 2023-12-18 22:57:07,552] Trial 47 pruned. Trial was pruned at iteration 0.
[I 2023-12-18 22:57:09,392] Trial 48 finished with value: inf and parameters: {'learning_rate': 0.7819601256995805, 'aft_loss_distribution': 'normal', 'aft_loss_distribution_scale': 2.1146509124180923, 'max_depth': 7, 'booster': 'dart', 'scale_pos_weight': 4.708863468022783, 'alpha': 7.4953674097297815, 'lambda': 0.5418703266422211, 'eta': 0.7235676551464606, 'sampling_method': 'gradient_based', 'subsample': 0.69197670908228, 'gamma': 3.169782911657373}. Best is trial 34 with value: 4.418252807515928.
[I 2023-12-18 22:57:09,455] Trial 49 pruned. Trial was pruned at iteration 0.
[I 2023-12-18 22:57:09,504] Trial 50 pruned. Trial was pruned at iteration 0.
[I 2023-12-18 22:57:09,559] Trial 51 pruned. Trial was pruned at iteration 0.
[I 2023-12-18 22:57:15,719] Trial 52 finished with value: 4.7682949173137565 and parameters: {'learning_rate': 0.6817828949370754, 'aft_loss_distribution': 'normal', 'aft_loss_distribution_scale': 2.7339720068191644, 'max_depth': 6, 'booster': 'dart', 'scale_pos_weight': 3.5860126959402643, 'alpha': 7.923118845244641, 'lambda': 6.724978141306186, 'eta': 0.47240164653036054, 'sampling_method': 'gradient_based', 'subsample': 0.4898244325124761, 'gamma': 3.6129763942605813}. Best is trial 34 with value: 4.418252807515928.
[I 2023-12-18 22:57:15,804] Trial 53 pruned. Trial was pruned at iteration 0.
[I 2023-12-18 22:57:15,892] Trial 54 pruned. Trial was pruned at iteration 0.
[I 2023-12-18 22:57:15,980] Trial 55 pruned. Trial was pruned at iteration 0.
[I 2023-12-18 22:57:16,079] Trial 56 pruned. Trial was pruned at iteration 0.
[I 2023-12-18 22:57:16,157] Trial 57 pruned. Trial was pruned at iteration 0.
[I 2023-12-18 22:57:16,238] Trial 58 pruned. Trial was pruned at iteration 0.
[I 2023-12-18 22:57:16,336] Trial 59 pruned. Trial was pruned at iteration 0.
[I 2023-12-18 22:57:16,417] Trial 60 pruned. Trial was pruned at iteration 0.
[I 2023-12-18 22:57:22,624] Trial 61 finished with value: 4.757422657500009 and parameters: {'learning_rate': 0.7563719651096049, 'aft_loss_distribution': 'normal', 'aft_loss_distribution_scale': 2.6985261975584405, 'max_depth': 6, 'booster': 'dart', 'scale_pos_weight': 4.420297169229896, 'alpha': 8.375632629905214, 'lambda': 0.3623134303586608, 'eta': 0.4145798402662846, 'sampling_method': 'gradient_based', 'subsample': 0.45557594704376303, 'gamma': 2.5010504580731925}. Best is trial 34 with value: 4.418252807515928.
[I 2023-12-18 22:57:25,720] Trial 62 finished with value: 4.626836296991399 and parameters: {'learning_rate': 0.734095280616885, 'aft_loss_distribution': 'normal', 'aft_loss_distribution_scale': 2.282323213701737, 'max_depth': 6, 'booster': 'dart', 'scale_pos_weight': 4.262491325247241, 'alpha': 8.28701826231736, 'lambda': 0.39620330607358767, 'eta': 0.42653009895377086, 'sampling_method': 'gradient_based', 'subsample': 0.537177414907813, 'gamma': 2.6210961822761627}. Best is trial 34 with value: 4.418252807515928.
[I 2023-12-18 22:57:28,720] Trial 63 finished with value: 4.593721326250476 and parameters: {'learning_rate': 0.7369868653771089, 'aft_loss_distribution': 'normal', 'aft_loss_distribution_scale': 2.1826908971325, 'max_depth': 6, 'booster': 'dart', 'scale_pos_weight': 4.312831144621881, 'alpha': 8.329829693374672, 'lambda': 0.39384930384112254, 'eta': 0.41316497254328943, 'sampling_method': 'gradient_based', 'subsample': 0.5384668940482417, 'gamma': 2.7153860694164984}. Best is trial 34 with value: 4.418252807515928.
