[I 2023-12-21 04:20:35,355] Trial 151 finished with value: 2.0835377213685984 and parameters: {'learning_rate': 0.3873673073895123, 'aft_                                                                     loss_distribution': 'logistic', 'aft_loss_distribution_scale': 1.3568115618953067, 'max_depth': 4, 'booster': 'dart', 'scale_pos_weight':                                                                      0.6538934484630455, 'alpha': 7.045082739815966, 'lambda': 7.129221451497909, 'eta': 0.8984314975387601, 'sampling_method': 'uniform', 's                                                                     ubsample': 0.5380985531103912, 'gamma': 9.004421546113733}. Best is trial 129 with value: 2.0595465163443114.
[I 2023-12-21 04:20:46,694] Trial 152 finished with value: 2.0720924724215974 and parameters: {'learning_rate': 0.3170424618973066, 'aft_                                                                     loss_distribution': 'logistic', 'aft_loss_distribution_scale': 1.1995626682483864, 'max_depth': 4, 'booster': 'dart', 'scale_pos_weight':                                                                      0.6452189313480746, 'alpha': 7.067875460332941, 'lambda': 7.175445112473099, 'eta': 0.9620088189134919, 'sampling_method': 'uniform', 's                                                                     ubsample': 0.5536762912742135, 'gamma': 8.674354836980035}. Best is trial 129 with value: 2.0595465163443114.
[I 2023-12-21 04:21:09,801] Trial 153 finished with value: 2.0661961333688326 and parameters: {'learning_rate': 0.3137059722654134, 'aft_                                                                     loss_distribution': 'logistic', 'aft_loss_distribution_scale': 1.2111038023929386, 'max_depth': 4, 'booster': 'dart', 'scale_pos_weight':                                                                      0.64619404212198, 'alpha': 7.008822944653489, 'lambda': 7.521695343699184, 'eta': 0.9994499787672676, 'sampling_method': 'uniform', 'sub                                                                     sample': 0.5722783896667291, 'gamma': 8.40399493558048}. Best is trial 129 with value: 2.0595465163443114.
[I 2023-12-21 04:21:21,174] Trial 154 finished with value: 2.067953105108026 and parameters: {'learning_rate': 0.32027306630323643, 'aft_                                                                     loss_distribution': 'logistic', 'aft_loss_distribution_scale': 1.1594512124111864, 'max_depth': 4, 'booster': 'dart', 'scale_pos_weight':                                                                      0.6223162588739113, 'alpha': 7.008262138075218, 'lambda': 7.297097368858042, 'eta': 0.9797607509579596, 'sampling_method': 'uniform', 's                                                                     ubsample': 0.6009632772233595, 'gamma': 8.414789548128761}. Best is trial 129 with value: 2.0595465163443114.
[I 2023-12-21 04:21:39,186] Trial 155 finished with value: 2.063402178641729 and parameters: {'learning_rate': 0.31532795686987947, 'aft_                                                                     loss_distribution': 'logistic', 'aft_loss_distribution_scale': 1.0472522708922598, 'max_depth': 4, 'booster': 'dart', 'scale_pos_weight':                                                                      0.6570546025433, 'alpha': 6.996916595440635, 'lambda': 7.583236244021681, 'eta': 0.9972658992338038, 'sampling_method': 'uniform', 'subs                                                                     ample': 0.6063310912679095, 'gamma': 8.387147148683074}. Best is trial 129 with value: 2.0595465163443114.
[I 2023-12-21 04:21:39,227] Trial 156 pruned. Trial was pruned at iteration 0.
[I 2023-12-21 04:21:39,266] Trial 157 pruned. Trial was pruned at iteration 0.
[I 2023-12-21 04:21:39,304] Trial 158 pruned. Trial was pruned at iteration 0.
[I 2023-12-21 04:21:39,342] Trial 159 pruned. Trial was pruned at iteration 0.
[I 2023-12-21 04:21:39,379] Trial 160 pruned. Trial was pruned at iteration 0.
[I 2023-12-21 04:21:50,953] Trial 161 finished with value: 2.0674656650547476 and parameters: {'learning_rate': 0.3452064434110273, 'aft_                                                                     loss_distribution': 'logistic', 'aft_loss_distribution_scale': 1.2445037473919434, 'max_depth': 4, 'booster': 'dart', 'scale_pos_weight':                                                                      0.8649196340589561, 'alpha': 6.842490019238705, 'lambda': 7.474482043553221, 'eta': 0.9497172919359683, 'sampling_method': 'uniform', 's                                                                     ubsample': 0.5720261773530825, 'gamma': 8.374405214075145}. Best is trial 129 with value: 2.0595465163443114.
[I 2023-12-21 04:22:00,617] Trial 162 pruned. Trial was pruned at iteration 171.
[I 2023-12-21 04:22:00,657] Trial 163 pruned. Trial was pruned at iteration 0.
[I 2023-12-21 04:22:09,723] Trial 164 pruned. Trial was pruned at iteration 169.
[I 2023-12-21 04:22:09,763] Trial 165 pruned. Trial was pruned at iteration 0.
[I 2023-12-21 04:22:23,743] Trial 166 finished with value: 2.067686301433316 and parameters: {'learning_rate': 0.28916519130668944, 'aft_                                                                     loss_distribution': 'logistic', 'aft_loss_distribution_scale': 1.2393967935150132, 'max_depth': 4, 'booster': 'dart', 'scale_pos_weight':                                                                      0.4979646937064759, 'alpha': 7.527824334587891, 'lambda': 7.930832102270952, 'eta': 0.9207994112957856, 'sampling_method': 'uniform', 's                                                                     ubsample': 0.5659482867290786, 'gamma': 7.809095141932287}. Best is trial 129 with value: 2.0595465163443114.
[I 2023-12-21 04:22:23,783] Trial 167 pruned. Trial was pruned at iteration 0.
[I 2023-12-21 04:22:23,819] Trial 168 pruned. Trial was pruned at iteration 0.
[I 2023-12-21 04:22:31,698] Trial 169 finished with value: 2.077971185893031 and parameters: {'learning_rate': 0.3098839417369345, 'aft_l                                                                     oss_distribution': 'logistic', 'aft_loss_distribution_scale': 1.1821533448396877, 'max_depth': 4, 'booster': 'dart', 'scale_pos_weight':                                                                      0.8369302771067819, 'alpha': 6.508539632903695, 'lambda': 7.430497928456823, 'eta': 0.9659166204444071, 'sampling_method': 'uniform', 'su                                                                     bsample': 0.5639849686267351, 'gamma': 7.945515630889221}. Best is trial 129 with value: 2.0595465163443114.
[I 2023-12-21 04:22:31,737] Trial 170 pruned. Trial was pruned at iteration 0.
[I 2023-12-21 04:22:43,312] Trial 171 finished with value: 2.0729012646659566 and parameters: {'learning_rate': 0.3228808211808065, 'aft_                                                                     loss_distribution': 'logistic', 'aft_loss_distribution_scale': 1.134082134411725, 'max_depth': 4, 'booster': 'dart', 'scale_pos_weight':                                                                      0.7435142570625355, 'alpha': 6.498515045508737, 'lambda': 7.54666778378777, 'eta': 0.9628517594574351, 'sampling_method': 'uniform', 'sub                                                                     sample': 0.5555696474708939, 'gamma': 7.9401394795299005}. Best is trial 129 with value: 2.0595465163443114.
[I 2023-12-21 04:22:43,355] Trial 172 pruned. Trial was pruned at iteration 0.
[I 2023-12-21 04:22:54,651] Trial 173 finished with value: 2.070540323676766 and parameters: {'learning_rate': 0.32165038286018804, 'aft_                                                                     loss_distribution': 'logistic', 'aft_loss_distribution_scale': 1.2522659122609066, 'max_depth': 4, 'booster': 'dart', 'scale_pos_weight':                                                                      0.7882547162162599, 'alpha': 6.728628174648751, 'lambda': 6.970058161756018, 'eta': 0.9581023407905827, 'sampling_method': 'uniform', 's                                                                     ubsample': 0.5566569292928883, 'gamma': 8.362106673631313}. Best is trial 129 with value: 2.0595465163443114.
[I 2023-12-21 04:23:02,219] Trial 174 finished with value: 2.0762261392542047 and parameters: {'learning_rate': 0.32383005310756113, 'aft                                                                     _loss_distribution': 'logistic', 'aft_loss_distribution_scale': 1.104665063295002, 'max_depth': 4, 'booster': 'dart', 'scale_pos_weight':                                                                      0.992815487395607, 'alpha': 6.570157390058477, 'lambda': 7.451279181856012, 'eta': 0.9642156461779757, 'sampling_method': 'uniform', 'su                                                                     bsample': 0.563031259364413, 'gamma': 7.753759299338983}. Best is trial 129 with value: 2.0595465163443114.
[I 2023-12-21 04:23:02,259] Trial 175 pruned. Trial was pruned at iteration 0.
[I 2023-12-21 04:23:02,297] Trial 176 pruned. Trial was pruned at iteration 0.
[I 2023-12-21 04:23:02,336] Trial 177 pruned. Trial was pruned at iteration 0.
[I 2023-12-21 04:23:02,373] Trial 178 pruned. Trial was pruned at iteration 0.
[I 2023-12-21 04:23:13,576] Trial 179 finished with value: 2.0732597670785116 and parameters: {'learning_rate': 0.3487151882986526, 'aft_                                                                     loss_distribution': 'logistic', 'aft_loss_distribution_scale': 1.1669937443788316, 'max_depth': 4, 'booster': 'dart', 'scale_pos_weight':                                                                      1.1809438635377922, 'alpha': 7.174749947857482, 'lambda': 7.098007931463345, 'eta': 0.9836885431845948, 'sampling_method': 'uniform', 's                                                                     ubsample': 0.6025180849294157, 'gamma': 8.39406545509601}. Best is trial 129 with value: 2.0595465163443114.
[I 2023-12-21 04:23:13,614] Trial 180 pruned. Trial was pruned at iteration 0.
[I 2023-12-21 04:23:13,652] Trial 181 pruned. Trial was pruned at iteration 0.
[I 2023-12-21 04:23:13,690] Trial 182 pruned. Trial was pruned at iteration 0.
[I 2023-12-21 04:23:13,727] Trial 183 pruned. Trial was pruned at iteration 0.
[I 2023-12-21 04:23:31,687] Trial 184 finished with value: 2.0631396030722566 and parameters: {'learning_rate': 0.34918314164347186, 'aft                                                                     _loss_distribution': 'logistic', 'aft_loss_distribution_scale': 1.105609174482242, 'max_depth': 7, 'booster': 'dart', 'scale_pos_weight':                                                                      1.0168435309874164, 'alpha': 6.523089898459562, 'lambda': 7.2251011930752504, 'eta': 0.9682899668575394, 'sampling_method': 'uniform', '                                                                     subsample': 0.6475875350909, 'gamma': 8.318207280466627}. Best is trial 129 with value: 2.0595465163443114.
[I 2023-12-21 04:23:31,729] Trial 185 pruned. Trial was pruned at iteration 0.
[I 2023-12-21 04:23:31,767] Trial 186 pruned. Trial was pruned at iteration 0.
[I 2023-12-21 04:23:31,805] Trial 187 pruned. Trial was pruned at iteration 0.
[I 2023-12-21 04:23:31,848] Trial 188 pruned. Trial was pruned at iteration 0.
[I 2023-12-21 04:23:31,886] Trial 189 pruned. Trial was pruned at iteration 0.
[I 2023-12-21 04:23:31,928] Trial 190 pruned. Trial was pruned at iteration 0.
[I 2023-12-21 04:23:42,486] Trial 191 finished with value: 2.0719106049147884 and parameters: {'learning_rate': 0.30029860836657946, 'aft                                                                     _loss_distribution': 'logistic', 'aft_loss_distribution_scale': 1.1947580161912357, 'max_depth': 4, 'booster': 'dart', 'scale_pos_weight'                                                                     : 0.8391960392550468, 'alpha': 6.499282052183657, 'lambda': 7.4858340613025405, 'eta': 0.9706417424264906, 'sampling_method': 'uniform',                                                                      'subsample': 0.5321033856982479, 'gamma': 8.050958147740152}. Best is trial 129 with value: 2.0595465163443114.
[I 2023-12-21 04:23:42,527] Trial 192 pruned. Trial was pruned at iteration 0.
[I 2023-12-21 04:23:46,303] Trial 193 pruned. Trial was pruned at iteration 106.
[I 2023-12-21 04:23:46,344] Trial 194 pruned. Trial was pruned at iteration 0.
[I 2023-12-21 04:23:46,387] Trial 195 pruned. Trial was pruned at iteration 0.
[I 2023-12-21 04:24:03,033] Trial 196 pruned. Trial was pruned at iteration 228.
[I 2023-12-21 04:24:03,074] Trial 197 pruned. Trial was pruned at iteration 0.
[I 2023-12-21 04:24:03,114] Trial 198 pruned. Trial was pruned at iteration 0.
[I 2023-12-21 04:24:03,154] Trial 199 pruned. Trial was pruned at iteration 0.
[I 2023-12-21 04:24:03,196] Trial 200 pruned. Trial was pruned at iteration 0.
[I 2023-12-21 04:24:14,517] Trial 201 finished with value: 2.068668597393059 and parameters: {'learning_rate': 0.31332245773483414, 'aft_                                                                     loss_distribution': 'logistic', 'aft_loss_distribution_scale': 1.1976023298352436, 'max_depth': 4, 'booster': 'dart', 'scale_pos_weight':                                                                      0.8430288764195522, 'alpha': 6.494372546432265, 'lambda': 7.286614140282641, 'eta': 0.9665032870247815, 'sampling_method': 'uniform', 's                                                                     ubsample': 0.558474224002607, 'gamma': 7.942391252432595}. Best is trial 129 with value: 2.0595465163443114.
[I 2023-12-21 04:24:25,771] Trial 202 finished with value: 2.0712200796590925 and parameters: {'learning_rate': 0.3143798208043753, 'aft_                                                                     loss_distribution': 'logistic', 'aft_loss_distribution_scale': 1.232472724271525, 'max_depth': 4, 'booster': 'dart', 'scale_pos_weight':                                                                      0.8639387719110956, 'alpha': 6.554944878374449, 'lambda': 7.200621007095894, 'eta': 0.9501549206040116, 'sampling_method': 'uniform', 'su                                                                     bsample': 0.5433133145044022, 'gamma': 7.971812524695659}. Best is trial 129 with value: 2.0595465163443114.
[I 2023-12-21 04:24:25,811] Trial 203 pruned. Trial was pruned at iteration 0.
[I 2023-12-21 04:24:25,850] Trial 204 pruned. Trial was pruned at iteration 0.
[I 2023-12-21 04:24:25,890] Trial 205 pruned. Trial was pruned at iteration 0.
[I 2023-12-21 04:24:27,664] Trial 206 finished with value: inf and parameters: {'learning_rate': 0.36656851245642774, 'aft_loss_distribut                                                                     ion': 'logistic', 'aft_loss_distribution_scale': 1.248635164245113, 'max_depth': 4, 'booster': 'dart', 'scale_pos_weight': 0.663841957300                                                                     7002, 'alpha': 7.323571106561015, 'lambda': 7.230516145119062, 'eta': 0.9712395290412048, 'sampling_method': 'uniform', 'subsample': 0.50                                                                     64802194362497, 'gamma': 2.3817593936532857}. Best is trial 129 with value: 2.0595465163443114.
[I 2023-12-21 04:24:27,706] Trial 207 pruned. Trial was pruned at iteration 0.
[I 2023-12-21 04:24:28,318] Trial 208 finished with value: 2.068611710626161 and parameters: {'learning_rate': 0.2886757477573324, 'aft_l                                                                     oss_distribution': 'logistic', 'aft_loss_distribution_scale': 1.0369171600294131, 'max_depth': 4, 'booster': 'gbtree', 'scale_pos_weight'                                                                     : 0.6030317536638684, 'alpha': 7.695873722016751, 'lambda': 7.553853224759119, 'eta': 0.9814472010239342, 'sampling_method': 'uniform', '                                                                     subsample': 0.538187077257005, 'gamma': 8.72994092014471}. Best is trial 129 with value: 2.0595465163443114.
[I 2023-12-21 04:24:28,359] Trial 209 pruned. Trial was pruned at iteration 0.
[I 2023-12-21 04:24:28,396] Trial 210 pruned. Trial was pruned at iteration 0.
[I 2023-12-21 04:24:28,688] Trial 211 pruned. Trial was pruned at iteration 188.
[I 2023-12-21 04:24:28,858] Trial 212 pruned. Trial was pruned at iteration 94.
[I 2023-12-21 04:24:28,902] Trial 213 pruned. Trial was pruned at iteration 0.
[I 2023-12-21 04:24:28,947] Trial 214 pruned. Trial was pruned at iteration 0.
[I 2023-12-21 04:24:28,987] Trial 215 pruned. Trial was pruned at iteration 0.
[I 2023-12-21 04:24:40,161] Trial 216 finished with value: 2.0658621520263307 and parameters: {'learning_rate': 0.3143258665346136, 'aft_                                                                     loss_distribution': 'logistic', 'aft_loss_distribution_scale': 1.1566278145389015, 'max_depth': 4, 'booster': 'dart', 'scale_pos_weight':                                                                      1.570215769832087, 'alpha': 7.492989675194718, 'lambda': 7.886111571808799, 'eta': 0.9691329512642786, 'sampling_method': 'uniform', 'su                                                                     bsample': 0.5768314131777108, 'gamma': 8.489502186689606}. Best is trial 129 with value: 2.0595465163443114.
[I 2023-12-21 04:24:48,507] Trial 217 finished with value: 2.060205665834514 and parameters: {'learning_rate': 0.2641710967732584, 'aft_l                                                                     oss_distribution': 'logistic', 'aft_loss_distribution_scale': 1.021267515278581, 'max_depth': 4, 'booster': 'dart', 'scale_pos_weight': 1                                                                     .471142856697711, 'alpha': 7.504349644917141, 'lambda': 7.87037172517238, 'eta': 0.9271077931518715, 'sampling_method': 'uniform', 'subsa                                                                     mple': 0.6301715789552393, 'gamma': 8.481670575086257}. Best is trial 129 with value: 2.0595465163443114.
[I 2023-12-21 04:24:48,548] Trial 218 pruned. Trial was pruned at iteration 0.
[I 2023-12-21 04:25:29,589] Trial 219 finished with value: 2.058556373665101 and parameters: {'learning_rate': 0.2209532406097255, 'aft_l                                                                     oss_distribution': 'logistic', 'aft_loss_distribution_scale': 0.9957113266475561, 'max_depth': 5, 'booster': 'dart', 'scale_pos_weight':                                                                      1.6273683210973091, 'alpha': 8.215739921394626, 'lambda': 7.918783437915136, 'eta': 0.9576193166393695, 'sampling_method': 'uniform', 'su                                                                     bsample': 0.6154870209780443, 'gamma': 7.96939248167265}. Best is trial 219 with value: 2.058556373665101.
[I 2023-12-21 04:25:29,948] Trial 220 finished with value: 2.057997039873297 and parameters: {'learning_rate': 0.2135979254275833, 'aft_l                                                                     oss_distribution': 'logistic', 'aft_loss_distribution_scale': 0.973991979353018, 'max_depth': 5, 'booster': 'gbtree', 'scale_pos_weight':                                                                      1.4230518131295353, 'alpha': 8.156827845243741, 'lambda': 7.983964233160035, 'eta': 0.9117203746819987, 'sampling_method': 'uniform', 's                                                                     ubsample': 0.6180979226520968, 'gamma': 7.89733252762412}. Best is trial 220 with value: 2.057997039873297.
[I 2023-12-21 04:25:29,991] Trial 221 pruned. Trial was pruned at iteration 1.
[I 2023-12-21 04:25:30,031] Trial 222 pruned. Trial was pruned at iteration 0.
[I 2023-12-21 04:25:30,073] Trial 223 pruned. Trial was pruned at iteration 0.
[I 2023-12-21 04:25:38,353] Trial 224 finished with value: 2.032141281952214 and parameters: {'learning_rate': 0.16044500443645332, 'aft_                                                                     loss_distribution': 'logistic', 'aft_loss_distribution_scale': 0.8286269228141581, 'max_depth': 4, 'booster': 'dart', 'scale_pos_weight':                                                                      1.6242372280473325, 'alpha': 7.72806580514533, 'lambda': 8.29269652250888, 'eta': 0.8896975792486372, 'sampling_method': 'uniform', 'sub                                                                     sample': 0.5805746094733757, 'gamma': 8.101942224412493}. Best is trial 224 with value: 2.032141281952214.
[I 2023-12-21 04:25:38,397] Trial 225 pruned. Trial was pruned at iteration 0.
[I 2023-12-21 04:25:38,438] Trial 226 pruned. Trial was pruned at iteration 0.
[I 2023-12-21 04:25:38,480] Trial 227 pruned. Trial was pruned at iteration 0.
[I 2023-12-21 04:25:38,521] Trial 228 pruned. Trial was pruned at iteration 0.
[I 2023-12-21 04:25:38,565] Trial 229 pruned. Trial was pruned at iteration 0.
[I 2023-12-21 04:25:38,611] Trial 230 pruned. Trial was pruned at iteration 0.
[I 2023-12-21 04:25:38,653] Trial 231 pruned. Trial was pruned at iteration 0.
