[I 2023-12-18 23:51:37,193] Trial 14 pruned. Trial was pruned at iteration 0.
[I 2023-12-18 23:51:37,267] Trial 15 pruned. Trial was pruned at iteration 0.
[I 2023-12-18 23:51:37,350] Trial 16 pruned. Trial was pruned at iteration 0.
[I 2023-12-18 23:51:37,454] Trial 17 pruned. Trial was pruned at iteration 0.
[I 2023-12-18 23:51:37,524] Trial 18 pruned. Trial was pruned at iteration 0.
[I 2023-12-18 23:51:37,597] Trial 19 pruned. Trial was pruned at iteration 0.
[I 2023-12-18 23:51:38,084] Trial 20 finished with value: inf and parameters: {'learning_rate': 0.559139368899275, 'aft_loss_distribution': 'normal', 'aft_loss_distribution_scale': 2.0376836393167523, 'max_depth': 9, 'booster': 'gbtree', 'scale_pos_weight': 0.9037806254967804, 'alpha': 7.831223446967141, 'lambda': 9.558282783596447, 'eta': 0.3541687447226377, 'sampling_method': 'gradient_based', 'subsample': 0.7668785813008494, 'gamma': 7.368222410057793}. Best is trial 8 with value: 4.6721617503589785.
[I 2023-12-18 23:51:38,182] Trial 21 pruned. Trial was pruned at iteration 3.
[I 2023-12-18 23:51:38,265] Trial 22 pruned. Trial was pruned at iteration 0.
[I 2023-12-18 23:51:39,861] Trial 23 finished with value: 4.740452107920211 and parameters: {'learning_rate': 0.32142371585164986, 'aft_loss_distribution': 'normal', 'aft_loss_distribution_scale': 2.6576061386256318, 'max_depth': 7, 'booster': 'gbtree', 'scale_pos_weight': 1.4184768756057622, 'alpha': 9.992363807965251, 'lambda': 2.4977772881687064, 'eta': 0.13944327303082127, 'sampling_method': 'gradient_based', 'subsample': 0.8691163182204054, 'gamma': 7.259859563041886}. Best is trial 8 with value: 4.6721617503589785.
[I 2023-12-18 23:51:40,309] Trial 24 finished with value: 4.734868301330608 and parameters: {'learning_rate': 0.38001092166295775, 'aft_loss_distribution': 'normal', 'aft_loss_distribution_scale': 2.6453103656893955, 'max_depth': 7, 'booster': 'gbtree', 'scale_pos_weight': 2.9517341694393906, 'alpha': 5.473373253904576, 'lambda': 2.1885028583126176, 'eta': 0.004862683063794296, 'sampling_method': 'gradient_based', 'subsample': 0.5821121010827741, 'gamma': 7.7086015567173884}. Best is trial 8 with value: 4.6721617503589785.
[I 2023-12-18 23:51:40,397] Trial 25 pruned. Trial was pruned at iteration 0.
[I 2023-12-18 23:51:49,904] Trial 26 finished with value: 4.293549997410749 and parameters: {'learning_rate': 0.5575860755308856, 'aft_loss_distribution': 'normal', 'aft_loss_distribution_scale': 1.3216030721542025, 'max_depth': 8, 'booster': 'dart', 'scale_pos_weight': 1.2565201348432744, 'alpha': 8.14530296342414, 'lambda': 2.796120334672627, 'eta': 0.16972654016809768, 'sampling_method': 'uniform', 'subsample': 0.5618633779754969, 'gamma': 7.62729718189903}. Best is trial 26 with value: 4.293549997410749.
[I 2023-12-18 23:51:58,727] Trial 27 finished with value: 4.291541471809494 and parameters: {'learning_rate': 0.571949530245876, 'aft_loss_distribution': 'normal', 'aft_loss_distribution_scale': 1.3549948485052288, 'max_depth': 10, 'booster': 'dart', 'scale_pos_weight': 2.7066169912333398, 'alpha': 8.49300804299564, 'lambda': 2.16970010397678, 'eta': 0.12168882871836498, 'sampling_method': 'uniform', 'subsample': 0.5714412820271482, 'gamma': 9.066327080554117}. Best is trial 27 with value: 4.291541471809494.
[I 2023-12-18 23:51:58,788] Trial 28 pruned. Trial was pruned at iteration 0.
[I 2023-12-18 23:51:58,905] Trial 29 pruned. Trial was pruned at iteration 0.
[I 2023-12-18 23:52:00,915] Trial 30 finished with value: inf and parameters: {'learning_rate': 0.7908088622129821, 'aft_loss_distribution': 'normal', 'aft_loss_distribution_scale': 1.584073201987662, 'max_depth': 10, 'booster': 'dart', 'scale_pos_weight': 4.772184157927282, 'alpha': 6.769144284115396, 'lambda': 1.4643678964865607, 'eta': 0.27662406994280553, 'sampling_method': 'uniform', 'subsample': 0.4344191038199216, 'gamma': 8.914924374926178}. Best is trial 27 with value: 4.291541471809494.
[I 2023-12-18 23:52:01,008] Trial 31 pruned. Trial was pruned at iteration 0.
[I 2023-12-18 23:52:15,823] Trial 32 finished with value: 4.466513832303137 and parameters: {'learning_rate': 0.4789530707198013, 'aft_loss_distribution': 'normal', 'aft_loss_distribution_scale': 1.8617212473087776, 'max_depth': 9, 'booster': 'dart', 'scale_pos_weight': 2.591071740049254, 'alpha': 8.588891831995843, 'lambda': 2.024338125426974, 'eta': 0.016559032563483834, 'sampling_method': 'uniform', 'subsample': 0.6403819054372618, 'gamma': 8.107161821576636}. Best is trial 27 with value: 4.291541471809494.
[I 2023-12-18 23:52:21,630] Trial 33 finished with value: 4.556350358599925 and parameters: {'learning_rate': 0.49875229226712514, 'aft_loss_distribution': 'normal', 'aft_loss_distribution_scale': 2.1001226741848456, 'max_depth': 9, 'booster': 'dart', 'scale_pos_weight': 1.4706799098036945, 'alpha': 8.26583981309189, 'lambda': 3.4763008844621446, 'eta': 0.24199558623194467, 'sampling_method': 'uniform', 'subsample': 0.4756050095861211, 'gamma': 8.579470247229638}. Best is trial 27 with value: 4.291541471809494.
[I 2023-12-18 23:52:21,735] Trial 34 pruned. Trial was pruned at iteration 0.
[I 2023-12-18 23:52:32,692] Trial 35 finished with value: 4.519217668708032 and parameters: {'learning_rate': 0.5026799506475508, 'aft_loss_distribution': 'normal', 'aft_loss_distribution_scale': 1.9925869914648162, 'max_depth': 9, 'booster': 'dart', 'scale_pos_weight': 0.7564944150109715, 'alpha': 8.201534588357896, 'lambda': 4.1286876390869445, 'eta': 0.2217911160322547, 'sampling_method': 'uniform', 'subsample': 0.4759804898603423, 'gamma': 9.404861458566169}. Best is trial 27 with value: 4.291541471809494.
[I 2023-12-18 23:52:45,241] Trial 36 finished with value: 4.460660447817308 and parameters: {'learning_rate': 0.6418752919491622, 'aft_loss_distribution': 'normal', 'aft_loss_distribution_scale': 1.8412233485673117, 'max_depth': 8, 'booster': 'dart', 'scale_pos_weight': 0.6836868779329928, 'alpha': 7.370338809708445, 'lambda': 4.382706751387881, 'eta': 0.12203223889658465, 'sampling_method': 'uniform', 'subsample': 0.7195269361506853, 'gamma': 9.40923994396209}. Best is trial 27 with value: 4.291541471809494.
[I 2023-12-18 23:52:45,311] Trial 37 pruned. Trial was pruned at iteration 0.
[I 2023-12-18 23:52:45,419] Trial 38 pruned. Trial was pruned at iteration 0.
[I 2023-12-18 23:52:45,510] Trial 39 pruned. Trial was pruned at iteration 2.
[I 2023-12-18 23:52:45,570] Trial 40 pruned. Trial was pruned at iteration 0.
[I 2023-12-18 23:52:54,558] Trial 41 finished with value: 4.433612827357981 and parameters: {'learning_rate': 0.6291449322048738, 'aft_loss_distribution': 'normal', 'aft_loss_distribution_scale': 1.7708905250964808, 'max_depth': 9, 'booster': 'dart', 'scale_pos_weight': 0.748419787773897, 'alpha': 8.280083839674148, 'lambda': 4.408217872006709, 'eta': 0.19431217274939444, 'sampling_method': 'uniform', 'subsample': 0.5213004741524873, 'gamma': 9.272013787799764}. Best is trial 27 with value: 4.291541471809494.
[I 2023-12-18 23:52:56,695] Trial 42 finished with value: inf and parameters: {'learning_rate': 0.620533805208676, 'aft_loss_distribution': 'normal', 'aft_loss_distribution_scale': 1.5700280758346847, 'max_depth': 8, 'booster': 'dart', 'scale_pos_weight': 2.1262436093846904, 'alpha': 7.6272376201092875, 'lambda': 3.4696064595861085, 'eta': 0.17662476900526855, 'sampling_method': 'uniform', 'subsample': 0.5537226143234495, 'gamma': 9.1118543303369}. Best is trial 27 with value: 4.291541471809494.
[I 2023-12-18 23:52:56,771] Trial 43 pruned. Trial was pruned at iteration 0.
[I 2023-12-18 23:53:23,080] Trial 44 finished with value: 4.452941732097597 and parameters: {'learning_rate': 0.6143799372180777, 'aft_loss_distribution': 'normal', 'aft_loss_distribution_scale': 1.8150613044523412, 'max_depth': 9, 'booster': 'dart', 'scale_pos_weight': 0.5304229692596973, 'alpha': 9.321580459103615, 'lambda': 4.503299320192566, 'eta': 0.10733724976946017, 'sampling_method': 'uniform', 'subsample': 0.5086917006081063, 'gamma': 8.21610365116083}. Best is trial 27 with value: 4.291541471809494.
[I 2023-12-18 23:53:23,154] Trial 45 pruned. Trial was pruned at iteration 1.
[I 2023-12-18 23:53:23,217] Trial 46 pruned. Trial was pruned at iteration 0.
[I 2023-12-18 23:53:23,286] Trial 47 pruned. Trial was pruned at iteration 0.
[I 2023-12-18 23:53:23,367] Trial 48 pruned. Trial was pruned at iteration 2.
[I 2023-12-18 23:53:23,441] Trial 49 pruned. Trial was pruned at iteration 0.
[I 2023-12-18 23:53:23,504] Trial 50 pruned. Trial was pruned at iteration 0.
[I 2023-12-18 23:53:23,578] Trial 51 pruned. Trial was pruned at iteration 0.
[I 2023-12-18 23:53:23,638] Trial 52 pruned. Trial was pruned at iteration 0.
[I 2023-12-18 23:53:41,023] Trial 53 finished with value: 4.405293782106397 and parameters: {'learning_rate': 0.6527319903954968, 'aft_loss_distribution': 'normal', 'aft_loss_distribution_scale': 1.6924769570101417, 'max_depth': 8, 'booster': 'dart', 'scale_pos_weight': 0.5886367263622565, 'alpha': 8.680204663500469, 'lambda': 1.9618390497313696, 'eta': 0.040797706972081405, 'sampling_method': 'uniform', 'subsample': 0.6080920216785276, 'gamma': 9.447857115382245}. Best is trial 27 with value: 4.291541471809494.
[I 2023-12-18 23:53:41,098] Trial 54 pruned. Trial was pruned at iteration 0.
[I 2023-12-18 23:53:41,157] Trial 55 pruned. Trial was pruned at iteration 0.
[I 2023-12-18 23:53:43,736] Trial 56 finished with value: 4.334590055500392 and parameters: {'learning_rate': 0.8037264630232115, 'aft_loss_distribution': 'normal', 'aft_loss_distribution_scale': 1.461605707643551, 'max_depth': 8, 'booster': 'dart', 'scale_pos_weight': 0.4454165987223468, 'alpha': 9.784010007771112, 'lambda': 5.271987321440581, 'eta': 0.2553022925131295, 'sampling_method': 'uniform', 'subsample': 0.3249819316060773, 'gamma': 9.387968488805377}. Best is trial 27 with value: 4.291541471809494.
[I 2023-12-18 23:53:43,797] Trial 57 pruned. Trial was pruned at iteration 0.
[I 2023-12-18 23:53:43,851] Trial 58 pruned. Trial was pruned at iteration 0.
[I 2023-12-18 23:53:43,906] Trial 59 pruned. Trial was pruned at iteration 0.
[I 2023-12-18 23:53:44,002] Trial 60 pruned. Trial was pruned at iteration 1.
[I 2023-12-18 23:53:44,069] Trial 61 pruned. Trial was pruned at iteration 0.
[I 2023-12-18 23:53:44,137] Trial 62 pruned. Trial was pruned at iteration 0.
[I 2023-12-18 23:54:19,177] Trial 63 finished with value: 4.404270283184366 and parameters: {'learning_rate': 0.7277709801990646, 'aft_loss_distribution': 'normal', 'aft_loss_distribution_scale': 1.683416237039515, 'max_depth': 8, 'booster': 'dart', 'scale_pos_weight': 0.4555140864877513, 'alpha': 4.0955300693468955, 'lambda': 5.052787515148043, 'eta': 0.1625635782494188, 'sampling_method': 'uniform', 'subsample': 0.4908006417924013, 'gamma': 9.9532289022298}. Best is trial 27 with value: 4.291541471809494.
[I 2023-12-18 23:54:19,334] Trial 64 pruned. Trial was pruned at iteration 0.
[I 2023-12-18 23:54:19,423] Trial 65 pruned. Trial was pruned at iteration 2.
[I 2023-12-18 23:54:21,168] Trial 66 finished with value: inf and parameters: {'learning_rate': 0.8854629173491325, 'aft_loss_distribution': 'normal', 'aft_loss_distribution_scale': 1.3434030408707005, 'max_depth': 7, 'booster': 'dart', 'scale_pos_weight': 9.008976268748347, 'alpha': 4.083985140779606, 'lambda': 3.6866355005532254, 'eta': 0.1657814321240275, 'sampling_method': 'uniform', 'subsample': 0.4314823693480514, 'gamma': 8.339809976493271}. Best is trial 27 with value: 4.291541471809494.
[I 2023-12-18 23:54:31,481] Trial 67 finished with value: 4.43091169606974 and parameters: {'learning_rate': 0.766045395591319, 'aft_loss_distribution': 'normal', 'aft_loss_distribution_scale': 1.7564283633565674, 'max_depth': 8, 'booster': 'dart', 'scale_pos_weight': 0.278760560739695, 'alpha': 9.349369167375986, 'lambda': 5.97484953021418, 'eta': 0.038003416599909884, 'sampling_method': 'uniform', 'subsample': 0.5331529293991696, 'gamma': 7.64640461341884}. Best is trial 27 with value: 4.291541471809494.
[I 2023-12-18 23:54:34,487] Trial 68 finished with value: inf and parameters: {'learning_rate': 0.7582258198939186, 'aft_loss_distribution': 'normal', 'aft_loss_distribution_scale': 1.0278190807875527, 'max_depth': 8, 'booster': 'dart', 'scale_pos_weight': 0.9256200342567958, 'alpha': 4.703832690028385, 'lambda': 6.866450841917753, 'eta': 0.047521540442541116, 'sampling_method': 'uniform', 'subsample': 0.5405698874562326, 'gamma': 9.719167568907793}. Best is trial 27 with value: 4.291541471809494.
[I 2023-12-18 23:54:34,625] Trial 69 pruned. Trial was pruned at iteration 1.
[I 2023-12-18 23:54:34,729] Trial 70 pruned. Trial was pruned at iteration 0.
[I 2023-12-18 23:54:34,836] Trial 71 pruned. Trial was pruned at iteration 3.
[I 2023-12-18 23:54:34,972] Trial 72 pruned. Trial was pruned at iteration 1.
[I 2023-12-18 23:54:35,080] Trial 73 pruned. Trial was pruned at iteration 0.
[I 2023-12-18 23:54:47,305] Trial 74 finished with value: 4.429834219924852 and parameters: {'learning_rate': 0.6646321135969082, 'aft_loss_distribution': 'normal', 'aft_loss_distribution_scale': 1.7519920314056765, 'max_depth': 9, 'booster': 'dart', 'scale_pos_weight': 1.1882015165138213, 'alpha': 4.414154586465992, 'lambda': 1.2640922959124086, 'eta': 0.5681801943453703, 'sampling_method': 'uniform', 'subsample': 0.5319402694222038, 'gamma': 7.8972204597865945}. Best is trial 27 with value: 4.291541471809494.
[I 2023-12-18 23:54:49,119] Trial 75 finished with value: inf and parameters: {'learning_rate': 0.7171896763776224, 'aft_loss_distribution': 'normal', 'aft_loss_distribution_scale': 1.434123133962668, 'max_depth': 7, 'booster': 'dart', 'scale_pos_weight': 1.2703020972272805, 'alpha': 4.462848640267973, 'lambda': 1.084929047154591, 'eta': 0.5941950210715023, 'sampling_method': 'uniform', 'subsample': 0.5392572505872585, 'gamma': 7.860016186682057}. Best is trial 27 with value: 4.291541471809494.
[I 2023-12-18 23:54:49,216] Trial 76 pruned. Trial was pruned at iteration 1.
[I 2023-12-18 23:54:49,347] Trial 77 pruned. Trial was pruned at iteration 2.
[I 2023-12-18 23:54:49,434] Trial 78 pruned. Trial was pruned at iteration 0.
[I 2023-12-18 23:54:49,584] Trial 79 pruned. Trial was pruned at iteration 0.
[I 2023-12-18 23:54:51,985] Trial 80 finished with value: inf and parameters: {'learning_rate': 0.7699898259312871, 'aft_loss_distribution': 'normal', 'aft_loss_distribution_scale': 1.1129445259825455, 'max_depth': 8, 'booster': 'dart', 'scale_pos_weight': 1.470973416723013, 'alpha': 4.227205682289264, 'lambda': 1.2915693990780688, 'eta': 0.47487670040530916, 'sampling_method': 'uniform', 'subsample': 0.6849384715014892, 'gamma': 6.579827482619888}. Best is trial 27 with value: 4.291541471809494.
[I 2023-12-18 23:55:04,572] Trial 81 finished with value: 4.452856658311937 and parameters: {'learning_rate': 0.6092328576323832, 'aft_loss_distribution': 'normal', 'aft_loss_distribution_scale': 1.8242690265702026, 'max_depth': 9, 'booster': 'dart', 'scale_pos_weight': 0.32244813943090567, 'alpha': 9.060228304780338, 'lambda': 2.788270993490153, 'eta': 0.09760735671883655, 'sampling_method': 'uniform', 'subsample': 0.5158940732436109, 'gamma': 7.440963324449438}. Best is trial 27 with value: 4.291541471809494.
[I 2023-12-18 23:55:14,266] Trial 82 finished with value: 4.322058306084382 and parameters: {'learning_rate': 0.5944608068743684, 'aft_loss_distribution': 'normal', 'aft_loss_distribution_scale': 1.4574207187057922, 'max_depth': 10, 'booster': 'dart', 'scale_pos_weight': 0.2568500586208353, 'alpha': 8.938462602199081, 'lambda': 2.638955114126948, 'eta': 0.62604303239298, 'sampling_method': 'uniform', 'subsample': 0.5313242729880747, 'gamma': 9.283106095460877}. Best is trial 27 with value: 4.291541471809494.
[I 2023-12-18 23:55:17,371] Trial 83 finished with value: 4.3013482109959895 and parameters: {'learning_rate': 0.662351047030976, 'aft_loss_distribution': 'normal', 'aft_loss_distribution_scale': 1.367706737833759, 'max_depth': 10, 'booster': 'dart', 'scale_pos_weight': 0.6150281828299156, 'alpha': 7.729941874618329, 'lambda': 2.1579494288402477, 'eta': 0.6694655609355337, 'sampling_method': 'uniform', 'subsample': 0.5853249076030755, 'gamma': 9.293911668117646}. Best is trial 27 with value: 4.291541471809494.
[I 2023-12-18 23:55:17,453] Trial 84 pruned. Trial was pruned at iteration 0.
[I 2023-12-18 23:55:22,542] Trial 85 finished with value: 4.300916003895134 and parameters: {'learning_rate': 0.6574480138706607, 'aft_loss_distribution': 'normal', 'aft_loss_distribution_scale': 1.3452427194835335, 'max_depth': 10, 'booster': 'dart', 'scale_pos_weight': 1.2279071075126498, 'alpha': 6.831206514413846, 'lambda': 2.116327339967284, 'eta': 0.7490963902755977, 'sampling_method': 'uniform', 'subsample': 0.5568488487729536, 'gamma': 9.571872717761687}. Best is trial 27 with value: 4.291541471809494.
[I 2023-12-18 23:55:24,487] Trial 86 finished with value: inf and parameters: {'learning_rate': 0.6921161661232219, 'aft_loss_distribution': 'normal', 'aft_loss_distribution_scale': 1.4232568089010798, 'max_depth': 10, 'booster': 'dart', 'scale_pos_weight': 1.2914392890067994, 'alpha': 6.929768295766003, 'lambda': 2.693226619239257, 'eta': 0.8009657540589568, 'sampling_method': 'uniform', 'subsample': 0.6215165257715312, 'gamma': 9.597188176043915}. Best is trial 27 with value: 4.291541471809494.
[I 2023-12-18 23:55:24,561] Trial 87 pruned. Trial was pruned at iteration 0.
[I 2023-12-18 23:55:24,681] Trial 88 pruned. Trial was pruned at iteration 0.
[I 2023-12-18 23:55:24,754] Trial 89 pruned. Trial was pruned at iteration 0.
[I 2023-12-18 23:55:24,820] Trial 90 pruned. Trial was pruned at iteration 0.
[I 2023-12-18 23:55:24,897] Trial 91 pruned. Trial was pruned at iteration 1.
[I 2023-12-18 23:55:48,111] Trial 92 finished with value: 4.371137709276925 and parameters: {'learning_rate': 0.7458593007674997, 'aft_loss_distribution': 'normal', 'aft_loss_distribution_scale': 1.5935306723927953, 'max_depth': 10, 'booster': 'dart', 'scale_pos_weight': 0.09801320963494209, 'alpha': 9.51283608772375, 'lambda': 2.5960652467005945, 'eta': 0.8745488051384585, 'sampling_method': 'uniform', 'subsample': 0.5755476752133084, 'gamma': 9.936132171172606}. Best is trial 27 with value: 4.291541471809494.
[I 2023-12-18 23:55:53,556] Trial 93 finished with value: 4.296073700366742 and parameters: {'learning_rate': 0.7360950004566229, 'aft_loss_distribution': 'normal', 'aft_loss_distribution_scale': 1.346626167990825, 'max_depth': 10, 'booster': 'dart', 'scale_pos_weight': 0.6125881227400415, 'alpha': 7.465073165498955, 'lambda': 2.5755497317684903, 'eta': 0.8879305147605948, 'sampling_method': 'uniform', 'subsample': 0.5806282036836139, 'gamma': 9.957645421547323}. Best is trial 27 with value: 4.291541471809494.
[I 2023-12-18 23:55:56,627] Trial 94 finished with value: 4.309291612122006 and parameters: {'learning_rate': 0.7420300445644881, 'aft_loss_distribution': 'normal', 'aft_loss_distribution_scale': 1.37292297705097, 'max_depth': 10, 'booster': 'dart', 'scale_pos_weight': 0.582968930150267, 'alpha': 7.552417963633895, 'lambda': 2.539877103245078, 'eta': 0.8734232643432227, 'sampling_method': 'uniform', 'subsample': 0.5856677551153928, 'gamma': 9.80336361568131}. Best is trial 27 with value: 4.291541471809494.
[I 2023-12-18 23:55:58,485] Trial 95 finished with value: inf and parameters: {'learning_rate': 0.7367803481225291, 'aft_loss_distribution': 'normal', 'aft_loss_distribution_scale': 1.0650575835757583, 'max_depth': 10, 'booster': 'dart', 'scale_pos_weight': 0.1358247249218163, 'alpha': 6.801935210548202, 'lambda': 2.6445277846921695, 'eta': 0.9129529386682513, 'sampling_method': 'uniform', 'subsample': 0.58121506650353, 'gamma': 9.953578977110766}. Best is trial 27 with value: 4.291541471809494.
[I 2023-12-18 23:56:00,790] Trial 96 finished with value: inf and parameters: {'learning_rate': 0.6942851625651154, 'aft_loss_distribution': 'normal', 'aft_loss_distribution_scale': 1.3367724352499415, 'max_depth': 10, 'booster': 'dart', 'scale_pos_weight': 3.71135627086477, 'alpha': 7.444223065683773, 'lambda': 3.241955398792048, 'eta': 0.9894235292202963, 'sampling_method': 'uniform', 'subsample': 0.6411517123257728, 'gamma': 9.669043095300177}. Best is trial 27 with value: 4.291541471809494.
[I 2023-12-18 23:56:00,875] Trial 97 pruned. Trial was pruned at iteration 1.
[I 2023-12-18 23:56:00,960] Trial 98 pruned. Trial was pruned at iteration 0.
[I 2023-12-18 23:56:01,051] Trial 99 pruned. Trial was pruned at iteration 0.
[I 2023-12-18 23:56:01,827] Trial 100 finished with value: inf and parameters: {'learning_rate': 0.8513803074414982, 'aft_loss_distribution': 'normal', 'aft_loss_distribution_scale': 1.5097883892641122, 'max_depth': 10, 'booster': 'gbtree', 'scale_pos_weight': 0.6137890439201298, 'alpha': 7.621580999388779, 'lambda': 2.5337223152237702, 'eta': 0.8318735451914917, 'sampling_method': 'gradient_based', 'subsample': 0.576424023944516, 'gamma': 8.891770177283664}. Best is trial 27 with value: 4.291541471809494.
[I 2023-12-18 23:56:01,937] Trial 101 pruned. Trial was pruned at iteration 0.
[I 2023-12-18 23:56:02,032] Trial 102 pruned. Trial was pruned at iteration 0.
[I 2023-12-18 23:56:02,120] Trial 103 pruned. Trial was pruned at iteration 0.
[I 2023-12-18 23:56:02,225] Trial 104 pruned. Trial was pruned at iteration 1.
[I 2023-12-18 23:56:02,345] Trial 105 pruned. Trial was pruned at iteration 0.
[I 2023-12-18 23:56:02,441] Trial 106 pruned. Trial was pruned at iteration 0.
[I 2023-12-18 23:56:02,554] Trial 107 pruned. Trial was pruned at iteration 0.
[I 2023-12-18 23:56:02,652] Trial 108 pruned. Trial was pruned at iteration 0.
[I 2023-12-18 23:56:02,749] Trial 109 pruned. Trial was pruned at iteration 1.
[I 2023-12-18 23:56:02,834] Trial 110 pruned. Trial was pruned at iteration 0.
