[I 2023-12-19 00:28:57,583] Trial 202 pruned. Trial was pruned at iteration 0.
[I 2023-12-19 00:28:57,658] Trial 203 pruned. Trial was pruned at iteration 0.
[I 2023-12-19 00:28:57,774] Trial 204 pruned. Trial was pruned at iteration 0.
[I 2023-12-19 00:28:57,883] Trial 205 pruned. Trial was pruned at iteration 0.
[I 2023-12-19 00:28:57,989] Trial 206 pruned. Trial was pruned at iteration 0.
[I 2023-12-19 00:28:58,106] Trial 207 pruned. Trial was pruned at iteration 0.
[I 2023-12-19 00:28:58,226] Trial 208 pruned. Trial was pruned at iteration 0.
[I 2023-12-19 00:28:58,335] Trial 209 pruned. Trial was pruned at iteration 0.
[I 2023-12-19 00:28:58,449] Trial 210 pruned. Trial was pruned at iteration 0.
[I 2023-12-19 00:28:58,825] Trial 211 finished with value: inf and parameters: {'learning_rate': 0.996414088878544, 'aft_loss_distribution': 'normal', 'aft_loss_distribution_scale': 2.356709253300596, 'max_depth': 8, 'booster': 'gbtree', 'scale_pos_weight': 2.906806985951865, 'alpha': 2.849786943567463, 'lambda': 4.473325804435033, 'eta': 0.6475404053138705, 'sampling_method': 'gradient_based', 'subsample': 0.2759511717843341, 'gamma': 5.916064079449135}. Best is trial 4 with value: 2.032977880923993.
[I 2023-12-19 00:28:59,262] Trial 212 finished with value: inf and parameters: {'learning_rate': 0.9763123298816038, 'aft_loss_distribution': 'normal', 'aft_loss_distribution_scale': 2.09546337858362, 'max_depth': 8, 'booster': 'gbtree', 'scale_pos_weight': 2.8156674795701466, 'alpha': 2.6624419243130153, 'lambda': 8.659172008911487, 'eta': 0.7058644807957828, 'sampling_method': 'gradient_based', 'subsample': 0.24550230925273403, 'gamma': 2.7206434332701988}. Best is trial 4 with value: 2.032977880923993.
[I 2023-12-19 00:28:59,393] Trial 213 pruned. Trial was pruned at iteration 1.
[I 2023-12-19 00:28:59,675] Trial 214 finished with value: inf and parameters: {'learning_rate': 0.9710519143953795, 'aft_loss_distribution': 'normal', 'aft_loss_distribution_scale': 2.631654722122327, 'max_depth': 9, 'booster': 'gbtree', 'scale_pos_weight': 2.706910136746894, 'alpha': 2.3513238663125575, 'lambda': 4.228216273400826, 'eta': 0.6875336487036573, 'sampling_method': 'gradient_based', 'subsample': 0.43414767749620137, 'gamma': 4.711246427498885}. Best is trial 4 with value: 2.032977880923993.
[I 2023-12-19 00:29:00,014] Trial 215 finished with value: inf and parameters: {'learning_rate': 0.9309006671009978, 'aft_loss_distribution': 'normal', 'aft_loss_distribution_scale': 2.507879227250322, 'max_depth': 8, 'booster': 'gbtree', 'scale_pos_weight': 0.5863906580732734, 'alpha': 9.362624863832822, 'lambda': 5.312872042829867, 'eta': 0.73128021925204, 'sampling_method': 'gradient_based', 'subsample': 0.3300149226036344, 'gamma': 3.0097669837651746}. Best is trial 4 with value: 2.032977880923993.
[I 2023-12-19 00:29:00,143] Trial 216 pruned. Trial was pruned at iteration 0.
[I 2023-12-19 00:29:00,267] Trial 217 pruned. Trial was pruned at iteration 0.
[I 2023-12-19 00:29:00,537] Trial 218 finished with value: inf and parameters: {'learning_rate': 0.9836501169511792, 'aft_loss_distribution': 'normal', 'aft_loss_distribution_scale': 1.594052148450158, 'max_depth': 10, 'booster': 'gbtree', 'scale_pos_weight': 2.8614234269014243, 'alpha': 6.559029318991795, 'lambda': 4.5986871432829135, 'eta': 0.5786274159313136, 'sampling_method': 'uniform', 'subsample': 0.38958018904083846, 'gamma': 3.4168369118126805}. Best is trial 4 with value: 2.032977880923993.
[I 2023-12-19 00:29:00,664] Trial 219 pruned. Trial was pruned at iteration 0.
[I 2023-12-19 00:29:00,783] Trial 220 pruned. Trial was pruned at iteration 0.
[I 2023-12-19 00:29:00,903] Trial 221 pruned. Trial was pruned at iteration 0.
[I 2023-12-19 00:29:01,032] Trial 222 pruned. Trial was pruned at iteration 0.
[I 2023-12-19 00:29:01,153] Trial 223 pruned. Trial was pruned at iteration 0.
[I 2023-12-19 00:29:01,278] Trial 224 pruned. Trial was pruned at iteration 0.
[I 2023-12-19 00:29:01,391] Trial 225 pruned. Trial was pruned at iteration 1.
[I 2023-12-19 00:29:01,517] Trial 226 pruned. Trial was pruned at iteration 0.
[I 2023-12-19 00:29:01,636] Trial 227 pruned. Trial was pruned at iteration 0.
[I 2023-12-19 00:29:01,763] Trial 228 pruned. Trial was pruned at iteration 0.
[I 2023-12-19 00:29:01,878] Trial 229 pruned. Trial was pruned at iteration 0.
[I 2023-12-19 00:29:02,006] Trial 230 pruned. Trial was pruned at iteration 0.
[I 2023-12-19 00:29:03,638] Trial 231 finished with value: inf and parameters: {'learning_rate': 0.9654078030011526, 'aft_loss_distribution': 'normal', 'aft_loss_distribution_scale': 2.2270290295250827, 'max_depth': 6, 'booster': 'dart', 'scale_pos_weight': 2.343790368616878, 'alpha': 2.527145882737588, 'lambda': 4.406834498442763, 'eta': 0.08648356728100148, 'sampling_method': 'uniform', 'subsample': 0.2227966986928043, 'gamma': 3.6826497946815464}. Best is trial 4 with value: 2.032977880923993.
[I 2023-12-19 00:29:25,537] Trial 232 finished with value: 2.0948641059388238 and parameters: {'learning_rate': 0.9436024307782613, 'aft_loss_distribution': 'normal', 'aft_loss_distribution_scale': 2.478688206864385, 'max_depth': 6, 'booster': 'dart', 'scale_pos_weight': 2.4254373008602585, 'alpha': 2.1042529270584054, 'lambda': 4.178900659392315, 'eta': 0.07453648250995523, 'sampling_method': 'uniform', 'subsample': 0.6812643157061404, 'gamma': 3.483314260550263}. Best is trial 4 with value: 2.032977880923993.
[I 2023-12-19 00:29:25,627] Trial 233 pruned. Trial was pruned at iteration 1.
[I 2023-12-19 00:29:35,854] Trial 234 finished with value: 2.0882634399907545 and parameters: {'learning_rate': 0.9037126952053585, 'aft_loss_distribution': 'normal', 'aft_loss_distribution_scale': 2.426350348231182, 'max_depth': 6, 'booster': 'dart', 'scale_pos_weight': 2.422800097564522, 'alpha': 1.7985683322908015, 'lambda': 5.581587621384832, 'eta': 0.028786826885466445, 'sampling_method': 'uniform', 'subsample': 0.6702841021466827, 'gamma': 3.9229134500355807}. Best is trial 4 with value: 2.032977880923993.
[I 2023-12-19 00:29:37,264] Trial 235 finished with value: inf and parameters: {'learning_rate': 0.8917478668506562, 'aft_loss_distribution': 'normal', 'aft_loss_distribution_scale': 2.4215772953400294, 'max_depth': 6, 'booster': 'dart', 'scale_pos_weight': 2.223219636306352, 'alpha': 1.8465535998388893, 'lambda': 5.630445756146594, 'eta': 0.036865566383515284, 'sampling_method': 'uniform', 'subsample': 0.6860020670035143, 'gamma': 3.004299022340418}. Best is trial 4 with value: 2.032977880923993.
[I 2023-12-19 00:29:37,349] Trial 236 pruned. Trial was pruned at iteration 0.
[I 2023-12-19 00:29:37,796] Trial 237 finished with value: 2.0390260241008353 and parameters: {'learning_rate': 0.8966127047315366, 'aft_loss_distribution': 'normal', 'aft_loss_distribution_scale': 1.9274545854957792, 'max_depth': 6, 'booster': 'gbtree', 'scale_pos_weight': 2.618922479460853, 'alpha': 1.7660009990097805, 'lambda': 5.781948839448681, 'eta': 0.055534261997122844, 'sampling_method': 'uniform', 'subsample': 0.6164423262608575, 'gamma': 3.9607657805294467}. Best is trial 4 with value: 2.032977880923993.
[I 2023-12-19 00:29:37,897] Trial 238 pruned. Trial was pruned at iteration 0.
[I 2023-12-19 00:29:39,540] Trial 239 finished with value: inf and parameters: {'learning_rate': 0.911398464995347, 'aft_loss_distribution': 'normal', 'aft_loss_distribution_scale': 1.963126683864655, 'max_depth': 6, 'booster': 'dart', 'scale_pos_weight': 2.5981781970941222, 'alpha': 2.000471635987921, 'lambda': 6.1207582592671015, 'eta': 0.01811454620391195, 'sampling_method': 'uniform', 'subsample': 0.6601700010272461, 'gamma': 3.9194750489149506}. Best is trial 4 with value: 2.032977880923993.
[I 2023-12-19 00:29:39,631] Trial 240 pruned. Trial was pruned at iteration 0.
[I 2023-12-19 00:29:39,882] Trial 241 finished with value: inf and parameters: {'learning_rate': 0.9005891576360703, 'aft_loss_distribution': 'normal', 'aft_loss_distribution_scale': 2.097012484455626, 'max_depth': 6, 'booster': 'gbtree', 'scale_pos_weight': 2.640973993135299, 'alpha': 1.9563880451380409, 'lambda': 5.703619665742154, 'eta': 0.057337635601799136, 'sampling_method': 'uniform', 'subsample': 0.6150165056905, 'gamma': 3.5888033659429643}. Best is trial 4 with value: 2.032977880923993.
[I 2023-12-19 00:29:39,978] Trial 242 pruned. Trial was pruned at iteration 0.
[I 2023-12-19 00:29:40,235] Trial 243 finished with value: inf and parameters: {'learning_rate': 0.9256843251826333, 'aft_loss_distribution': 'normal', 'aft_loss_distribution_scale': 1.6080670393253311, 'max_depth': 6, 'booster': 'gbtree', 'scale_pos_weight': 2.455063132095754, 'alpha': 2.087459479031274, 'lambda': 5.242541334948039, 'eta': 0.04389235581456685, 'sampling_method': 'gradient_based', 'subsample': 0.5321827899996736, 'gamma': 3.923240690066198}. Best is trial 4 with value: 2.032977880923993.
[I 2023-12-19 00:29:40,319] Trial 244 pruned. Trial was pruned at iteration 0.
[I 2023-12-19 00:29:40,399] Trial 245 pruned. Trial was pruned at iteration 0.
[I 2023-12-19 00:29:40,483] Trial 246 pruned. Trial was pruned at iteration 0.
[I 2023-12-19 00:29:40,560] Trial 247 pruned. Trial was pruned at iteration 0.
[I 2023-12-19 00:29:40,649] Trial 248 pruned. Trial was pruned at iteration 0.
[I 2023-12-19 00:29:40,727] Trial 249 pruned. Trial was pruned at iteration 0.
[I 2023-12-19 00:29:40,807] Trial 250 pruned. Trial was pruned at iteration 0.
[I 2023-12-19 00:29:40,884] Trial 251 pruned. Trial was pruned at iteration 0.
[I 2023-12-19 00:29:40,976] Trial 252 pruned. Trial was pruned at iteration 0.
[I 2023-12-19 00:29:41,057] Trial 253 pruned. Trial was pruned at iteration 0.
[I 2023-12-19 00:29:41,153] Trial 254 pruned. Trial was pruned at iteration 0.
[I 2023-12-19 00:29:41,233] Trial 255 pruned. Trial was pruned at iteration 0.
[I 2023-12-19 00:29:41,318] Trial 256 pruned. Trial was pruned at iteration 0.
[I 2023-12-19 00:29:41,395] Trial 257 pruned. Trial was pruned at iteration 0.
[I 2023-12-19 00:29:41,480] Trial 258 pruned. Trial was pruned at iteration 0.
[I 2023-12-19 00:29:41,565] Trial 259 pruned. Trial was pruned at iteration 0.
[I 2023-12-19 00:29:41,643] Trial 260 pruned. Trial was pruned at iteration 0.
[I 2023-12-19 00:29:41,724] Trial 261 pruned. Trial was pruned at iteration 0.
[I 2023-12-19 00:29:41,817] Trial 262 pruned. Trial was pruned at iteration 0.
[I 2023-12-19 00:29:41,899] Trial 263 pruned. Trial was pruned at iteration 0.
[I 2023-12-19 00:29:41,997] Trial 264 pruned. Trial was pruned at iteration 0.
[I 2023-12-19 00:29:42,078] Trial 265 pruned. Trial was pruned at iteration 0.
[I 2023-12-19 00:29:42,554] Trial 266 finished with value: inf and parameters: {'learning_rate': 0.9120775802263769, 'aft_loss_distribution': 'normal', 'aft_loss_distribution_scale': 1.7539009973255322, 'max_depth': 9, 'booster': 'gbtree', 'scale_pos_weight': 0.7635902228340224, 'alpha': 4.9519957925882405, 'lambda': 9.875878060519893, 'eta': 0.9279435767008372, 'sampling_method': 'gradient_based', 'subsample': 0.1515000779903943, 'gamma': 4.067381862690582}. Best is trial 4 with value: 2.032977880923993.
[I 2023-12-19 00:29:42,684] Trial 267 pruned. Trial was pruned at iteration 0.
[I 2023-12-19 00:29:42,816] Trial 268 pruned. Trial was pruned at iteration 0.
[I 2023-12-19 00:29:42,944] Trial 269 pruned. Trial was pruned at iteration 0.
[I 2023-12-19 00:29:43,261] Trial 270 finished with value: inf and parameters: {'learning_rate': 0.953890851792051, 'aft_loss_distribution': 'normal', 'aft_loss_distribution_scale': 1.3739613041537413, 'max_depth': 8, 'booster': 'gbtree', 'scale_pos_weight': 3.081827479060376, 'alpha': 1.4958071523329375, 'lambda': 4.089929361166236, 'eta': 0.6764053439343259, 'sampling_method': 'uniform', 'subsample': 0.4053152454029782, 'gamma': 6.081205542989868}. Best is trial 4 with value: 2.032977880923993.
[I 2023-12-19 00:29:43,410] Trial 271 pruned. Trial was pruned at iteration 0.
[I 2023-12-19 00:29:43,523] Trial 272 pruned. Trial was pruned at iteration 0.
[I 2023-12-19 00:29:43,640] Trial 273 pruned. Trial was pruned at iteration 0.
[I 2023-12-19 00:29:43,755] Trial 274 pruned. Trial was pruned at iteration 0.
[I 2023-12-19 00:29:43,873] Trial 275 pruned. Trial was pruned at iteration 0.
[I 2023-12-19 00:29:43,997] Trial 276 pruned. Trial was pruned at iteration 0.
[I 2023-12-19 00:29:44,125] Trial 277 pruned. Trial was pruned at iteration 0.
[I 2023-12-19 00:29:44,400] Trial 278 pruned. Trial was pruned at iteration 52.
[I 2023-12-19 00:29:46,316] Trial 279 finished with value: inf and parameters: {'learning_rate': 0.9992794034485624, 'aft_loss_distribution': 'normal', 'aft_loss_distribution_scale': 2.1867573796851376, 'max_depth': 8, 'booster': 'dart', 'scale_pos_weight': 2.4360030748865933, 'alpha': 8.402190843700899, 'lambda': 7.621360898067959, 'eta': 0.5011803003104917, 'sampling_method': 'gradient_based', 'subsample': 0.34280776822004894, 'gamma': 3.9410127424520334}. Best is trial 4 with value: 2.032977880923993.
[I 2023-12-19 00:29:46,453] Trial 280 pruned. Trial was pruned at iteration 0.
[I 2023-12-19 00:29:46,585] Trial 281 pruned. Trial was pruned at iteration 0.
[I 2023-12-19 00:29:46,706] Trial 282 pruned. Trial was pruned at iteration 0.
[I 2023-12-19 00:29:46,834] Trial 283 pruned. Trial was pruned at iteration 0.
[I 2023-12-19 00:29:46,959] Trial 284 pruned. Trial was pruned at iteration 0.
[I 2023-12-19 00:29:47,080] Trial 285 pruned. Trial was pruned at iteration 0.
[I 2023-12-19 00:29:47,360] Trial 286 finished with value: inf and parameters: {'learning_rate': 0.9599963939751084, 'aft_loss_distribution': 'normal', 'aft_loss_distribution_scale': 1.7420659990902743, 'max_depth': 6, 'booster': 'gbtree', 'scale_pos_weight': 2.87212989131793, 'alpha': 1.644919166516553, 'lambda': 8.769922716993149, 'eta': 0.7445688534824144, 'sampling_method': 'uniform', 'subsample': 0.2036709661657238, 'gamma': 8.374351654431829}. Best is trial 4 with value: 2.032977880923993.
[I 2023-12-19 00:29:47,456] Trial 287 pruned. Trial was pruned at iteration 0.
[I 2023-12-19 00:29:47,535] Trial 288 pruned. Trial was pruned at iteration 0.
[I 2023-12-19 00:29:47,619] Trial 289 pruned. Trial was pruned at iteration 0.
[I 2023-12-19 00:29:47,704] Trial 290 pruned. Trial was pruned at iteration 0.
[I 2023-12-19 00:29:47,800] Trial 291 pruned. Trial was pruned at iteration 1.
[I 2023-12-19 00:29:47,884] Trial 292 pruned. Trial was pruned at iteration 0.
[I 2023-12-19 00:29:47,979] Trial 293 pruned. Trial was pruned at iteration 0.
[I 2023-12-19 00:29:48,072] Trial 294 pruned. Trial was pruned at iteration 0.
[I 2023-12-19 00:29:48,407] Trial 295 finished with value: inf and parameters: {'learning_rate': 0.9157039839178965, 'aft_loss_distribution': 'normal', 'aft_loss_distribution_scale': 2.289128552845561, 'max_depth': 6, 'booster': 'gbtree', 'scale_pos_weight': 3.029693645874839, 'alpha': 2.782517405521155, 'lambda': 4.3033957312109905, 'eta': 0.3756691566561363, 'sampling_method': 'gradient_based', 'subsample': 0.6449921431622874, 'gamma': 0.4535824111655459}. Best is trial 4 with value: 2.032977880923993.
[I 2023-12-19 00:29:48,501] Trial 296 pruned. Trial was pruned at iteration 0.
[I 2023-12-19 00:29:48,580] Trial 297 pruned. Trial was pruned at iteration 0.
[I 2023-12-19 00:29:48,675] Trial 298 pruned. Trial was pruned at iteration 0.
[I 2023-12-19 00:29:48,765] Trial 299 pruned. Trial was pruned at iteration 0.
[I 2023-12-19 00:29:48,853] Trial 300 pruned. Trial was pruned at iteration 0.
[I 2023-12-19 00:29:48,938] Trial 301 pruned. Trial was pruned at iteration 0.
[I 2023-12-19 00:29:49,022] Trial 302 pruned. Trial was pruned at iteration 0.
[I 2023-12-19 00:29:49,105] Trial 303 pruned. Trial was pruned at iteration 0.
[I 2023-12-19 00:29:51,239] Trial 304 finished with value: inf and parameters: {'learning_rate': 0.9706323727102176, 'aft_loss_distribution': 'normal', 'aft_loss_distribution_scale': 1.9196074301872326, 'max_depth': 8, 'booster': 'dart', 'scale_pos_weight': 3.2456243845731843, 'alpha': 4.705343619859308, 'lambda': 3.4855897836883964, 'eta': 0.08287932838250762, 'sampling_method': 'uniform', 'subsample': 0.3178059967445249, 'gamma': 4.099413098139583}. Best is trial 4 with value: 2.032977880923993.
[I 2023-12-19 00:29:51,332] Trial 305 pruned. Trial was pruned at iteration 0.
[I 2023-12-19 00:29:51,423] Trial 306 pruned. Trial was pruned at iteration 0.
[I 2023-12-19 00:29:51,508] Trial 307 pruned. Trial was pruned at iteration 0.
[I 2023-12-19 00:29:51,600] Trial 308 pruned. Trial was pruned at iteration 0.
[I 2023-12-19 00:29:51,696] Trial 309 pruned. Trial was pruned at iteration 0.
[I 2023-12-19 00:29:51,789] Trial 310 pruned. Trial was pruned at iteration 0.
[I 2023-12-19 00:29:51,885] Trial 311 pruned. Trial was pruned at iteration 0.
[I 2023-12-19 00:29:51,974] Trial 312 pruned. Trial was pruned at iteration 0.
[I 2023-12-19 00:29:52,062] Trial 313 pruned. Trial was pruned at iteration 0.
[I 2023-12-19 00:29:52,148] Trial 314 pruned. Trial was pruned at iteration 0.
[I 2023-12-19 00:29:52,237] Trial 315 pruned. Trial was pruned at iteration 0.
[I 2023-12-19 00:29:52,322] Trial 316 pruned. Trial was pruned at iteration 0.
[I 2023-12-19 00:29:52,424] Trial 317 pruned. Trial was pruned at iteration 0.
[I 2023-12-19 00:29:52,509] Trial 318 pruned. Trial was pruned at iteration 0.
[I 2023-12-19 00:29:52,595] Trial 319 pruned. Trial was pruned at iteration 0.
[I 2023-12-19 00:29:52,676] Trial 320 pruned. Trial was pruned at iteration 0.
[I 2023-12-19 00:29:52,762] Trial 321 pruned. Trial was pruned at iteration 0.
[I 2023-12-19 00:29:52,846] Trial 322 pruned. Trial was pruned at iteration 0.
[I 2023-12-19 00:29:52,935] Trial 323 pruned. Trial was pruned at iteration 0.
[I 2023-12-19 00:29:53,023] Trial 324 pruned. Trial was pruned at iteration 0.
[I 2023-12-19 00:29:53,112] Trial 325 pruned. Trial was pruned at iteration 0.
[I 2023-12-19 00:29:53,208] Trial 326 pruned. Trial was pruned at iteration 0.
[I 2023-12-19 00:29:53,299] Trial 327 pruned. Trial was pruned at iteration 0.
[I 2023-12-19 00:29:53,383] Trial 328 pruned. Trial was pruned at iteration 0.
[I 2023-12-19 00:29:53,482] Trial 329 pruned. Trial was pruned at iteration 0.
[I 2023-12-19 00:29:53,568] Trial 330 pruned. Trial was pruned at iteration 0.
[I 2023-12-19 00:29:54,890] Trial 331 pruned. Trial was pruned at iteration 52.
[I 2023-12-19 00:29:54,979] Trial 332 pruned. Trial was pruned at iteration 0.
[I 2023-12-19 00:29:55,066] Trial 333 pruned. Trial was pruned at iteration 0.
[I 2023-12-19 00:29:55,150] Trial 334 pruned. Trial was pruned at iteration 0.
[I 2023-12-19 00:29:55,242] Trial 335 pruned. Trial was pruned at iteration 0.
[I 2023-12-19 00:29:55,326] Trial 336 pruned. Trial was pruned at iteration 0.
[I 2023-12-19 00:29:55,427] Trial 337 pruned. Trial was pruned at iteration 0.
[I 2023-12-19 00:29:55,526] Trial 338 pruned. Trial was pruned at iteration 0.
[I 2023-12-19 00:29:55,616] Trial 339 pruned. Trial was pruned at iteration 0.
[I 2023-12-19 00:29:55,705] Trial 340 pruned. Trial was pruned at iteration 0.
[I 2023-12-19 00:29:55,791] Trial 341 pruned. Trial was pruned at iteration 0.
[I 2023-12-19 00:29:55,877] Trial 342 pruned. Trial was pruned at iteration 0.
[I 2023-12-19 00:29:55,963] Trial 343 pruned. Trial was pruned at iteration 0.
[I 2023-12-19 00:29:56,057] Trial 344 pruned. Trial was pruned at iteration 0.
[I 2023-12-19 00:29:56,139] Trial 345 pruned. Trial was pruned at iteration 0.
[I 2023-12-19 00:29:56,235] Trial 346 pruned. Trial was pruned at iteration 0.
[I 2023-12-19 00:29:56,319] Trial 347 pruned. Trial was pruned at iteration 0.
[I 2023-12-19 00:29:56,407] Trial 348 pruned. Trial was pruned at iteration 0.
[I 2023-12-19 00:29:56,503] Trial 349 pruned. Trial was pruned at iteration 0.
[I 2023-12-19 00:29:56,600] Trial 350 pruned. Trial was pruned at iteration 0.
[I 2023-12-19 00:29:56,688] Trial 351 pruned. Trial was pruned at iteration 0.
[I 2023-12-19 00:29:56,771] Trial 352 pruned. Trial was pruned at iteration 0.
[I 2023-12-19 00:29:56,863] Trial 353 pruned. Trial was pruned at iteration 0.
[I 2023-12-19 00:29:56,947] Trial 354 pruned. Trial was pruned at iteration 0.
[I 2023-12-19 00:29:57,040] Trial 355 pruned. Trial was pruned at iteration 0.
[I 2023-12-19 00:29:57,132] Trial 356 pruned. Trial was pruned at iteration 0.
[I 2023-12-19 00:29:57,236] Trial 357 pruned. Trial was pruned at iteration 0.
[I 2023-12-19 00:29:57,374] Trial 358 pruned. Trial was pruned at iteration 0.
[I 2023-12-19 00:29:57,509] Trial 359 pruned. Trial was pruned at iteration 0.
[I 2023-12-19 00:29:57,645] Trial 360 pruned. Trial was pruned at iteration 0.
[I 2023-12-19 00:29:57,776] Trial 361 pruned. Trial was pruned at iteration 0.
[I 2023-12-19 00:29:57,915] Trial 362 pruned. Trial was pruned at iteration 0.
[I 2023-12-19 00:29:58,061] Trial 363 pruned. Trial was pruned at iteration 0.
[I 2023-12-19 00:29:58,192] Trial 364 pruned. Trial was pruned at iteration 0.
[I 2023-12-19 00:29:58,322] Trial 365 pruned. Trial was pruned at iteration 0.
[I 2023-12-19 00:30:00,185] Trial 366 finished with value: inf and parameters: {'learning_rate': 0.9330804725615445, 'aft_loss_distribution': 'normal', 'aft_loss_distribution_scale': 1.8353613203644243, 'max_depth': 5, 'booster': 'dart', 'scale_pos_weight': 3.2190168482343537, 'alpha': 2.501475600425364, 'lambda': 7.228110592447235, 'eta': 0.9127507713913277, 'sampling_method': 'uniform', 'subsample': 0.5131704256845042, 'gamma': 4.118727256110301}. Best is trial 4 with value: 2.032977880923993.
[I 2023-12-19 00:30:00,339] Trial 367 pruned. Trial was pruned at iteration 0.
[I 2023-12-19 00:30:00,472] Trial 368 pruned. Trial was pruned at iteration 0.
[I 2023-12-19 00:30:00,601] Trial 369 pruned. Trial was pruned at iteration 0.
[I 2023-12-19 00:30:00,738] Trial 370 pruned. Trial was pruned at iteration 0.
