[I 2023-12-21 04:04:49,113] Trial 479 pruned. Trial was pruned at iteration 0.
[I 2023-12-21 04:04:49,170] Trial 480 pruned. Trial was pruned at iteration 1.
[I 2023-12-21 04:04:49,223] Trial 481 pruned. Trial was pruned at iteration 0.
[I 2023-12-21 04:04:49,276] Trial 482 pruned. Trial was pruned at iteration 0.
[I 2023-12-21 04:04:49,331] Trial 483 pruned. Trial was pruned at iteration 0.
[I 2023-12-21 04:04:49,386] Trial 484 pruned. Trial was pruned at iteration 0.
[I 2023-12-21 04:04:49,439] Trial 485 pruned. Trial was pruned at iteration 0.
[I 2023-12-21 04:04:49,494] Trial 486 pruned. Trial was pruned at iteration 0.
[I 2023-12-21 04:04:49,548] Trial 487 pruned. Trial was pruned at iteration 0.
[I 2023-12-21 04:04:49,601] Trial 488 pruned. Trial was pruned at iteration 0.
[I 2023-12-21 04:04:49,655] Trial 489 pruned. Trial was pruned at iteration 0.
[I 2023-12-21 04:04:49,709] Trial 490 pruned. Trial was pruned at iteration 0.
[I 2023-12-21 04:04:49,765] Trial 491 pruned. Trial was pruned at iteration 0.
[I 2023-12-21 04:04:49,820] Trial 492 pruned. Trial was pruned at iteration 0.
[I 2023-12-21 04:04:49,874] Trial 493 pruned. Trial was pruned at iteration 0.
[I 2023-12-21 04:04:49,928] Trial 494 pruned. Trial was pruned at iteration 0.
[I 2023-12-21 04:04:49,981] Trial 495 pruned. Trial was pruned at iteration 0.
[I 2023-12-21 04:04:50,035] Trial 496 pruned. Trial was pruned at iteration 0.
[I 2023-12-21 04:04:50,094] Trial 497 pruned. Trial was pruned at iteration 0.
[I 2023-12-21 04:04:50,149] Trial 498 pruned. Trial was pruned at iteration 0.
[I 2023-12-21 04:04:50,204] Trial 499 pruned. Trial was pruned at iteration 0.
[W 2023-12-21 04:04:50,298] Trial 1 is omitted in visualization because its objective value is inf or nan.
[W 2023-12-21 04:04:50,299] Trial 2 is omitted in visualization because its objective value is inf or nan.
[W 2023-12-21 04:04:50,299] Trial 41 is omitted in visualization because its objective value is inf or nan.
[W 2023-12-21 04:04:50,299] Trial 42 is omitted in visualization because its objective value is inf or nan.
[W 2023-12-21 04:04:50,299] Trial 54 is omitted in visualization because its objective value is inf or nan.
[W 2023-12-21 04:04:50,299] Trial 63 is omitted in visualization because its objective value is inf or nan.
[W 2023-12-21 04:04:50,299] Trial 104 is omitted in visualization because its objective value is inf or nan.
[W 2023-12-21 04:04:50,299] Trial 115 is omitted in visualization because its objective value is inf or nan.
[W 2023-12-21 04:04:50,299] Trial 141 is omitted in visualization because its objective value is inf or nan.
[W 2023-12-21 04:04:50,299] Trial 161 is omitted in visualization because its objective value is inf or nan.
[W 2023-12-21 04:04:50,299] Trial 171 is omitted in visualization because its objective value is inf or nan.
[W 2023-12-21 04:04:50,299] Trial 176 is omitted in visualization because its objective value is inf or nan.
[W 2023-12-21 04:04:50,299] Trial 182 is omitted in visualization because its objective value is inf or nan.
[W 2023-12-21 04:04:50,299] Trial 191 is omitted in visualization because its objective value is inf or nan.
[W 2023-12-21 04:04:50,299] Trial 193 is omitted in visualization because its objective value is inf or nan.
[W 2023-12-21 04:04:50,299] Trial 211 is omitted in visualization because its objective value is inf or nan.
[W 2023-12-21 04:04:50,299] Trial 216 is omitted in visualization because its objective value is inf or nan.
[W 2023-12-21 04:04:50,299] Trial 221 is omitted in visualization because its objective value is inf or nan.
[W 2023-12-21 04:04:50,299] Trial 243 is omitted in visualization because its objective value is inf or nan.
[W 2023-12-21 04:04:50,300] Trial 256 is omitted in visualization because its objective value is inf or nan.
[W 2023-12-21 04:04:50,300] Trial 296 is omitted in visualization because its objective value is inf or nan.
[W 2023-12-21 04:04:50,300] Trial 309 is omitted in visualization because its objective value is inf or nan.
[W 2023-12-21 04:04:50,300] Trial 333 is omitted in visualization because its objective value is inf or nan.
[W 2023-12-21 04:04:50,300] Trial 341 is omitted in visualization because its objective value is inf or nan.
[W 2023-12-21 04:04:50,300] Trial 347 is omitted in visualization because its objective value is inf or nan.
[W 2023-12-21 04:04:50,300] Trial 373 is omitted in visualization because its objective value is inf or nan.
[W 2023-12-21 04:04:50,300] Trial 389 is omitted in visualization because its objective value is inf or nan.
[W 2023-12-21 04:04:50,300] Trial 434 is omitted in visualization because its objective value is inf or nan.
[W 2023-12-21 04:04:50,300] Trial 446 is omitted in visualization because its objective value is inf or nan.
[W 2023-12-21 04:04:50,300] Trial 457 is omitted in visualization because its objective value is inf or nan.
[W 2023-12-21 04:04:50,300] Trial 461 is omitted in visualization because its objective value is inf or nan.
exo-open: Cannot open display: .
/cvmfs/soft.computecanada.ca/gentoo/2020/usr/bin/xdg-open: line 871: x-www-browser: command not found
/cvmfs/soft.computecanada.ca/gentoo/2020/usr/bin/xdg-open: line 871: firefox: command not found
/cvmfs/soft.computecanada.ca/gentoo/2020/usr/bin/xdg-open: line 871: iceweasel: command not found
/cvmfs/soft.computecanada.ca/gentoo/2020/usr/bin/xdg-open: line 871: seamonkey: command not found
/cvmfs/soft.computecanada.ca/gentoo/2020/usr/bin/xdg-open: line 871: mozilla: command not found
/cvmfs/soft.computecanada.ca/gentoo/2020/usr/bin/xdg-open: line 871: epiphany: command not found
/cvmfs/soft.computecanada.ca/gentoo/2020/usr/bin/xdg-open: line 871: konqueror: command not found
/cvmfs/soft.computecanada.ca/gentoo/2020/usr/bin/xdg-open: line 871: chromium: command not found
/cvmfs/soft.computecanada.ca/gentoo/2020/usr/bin/xdg-open: line 871: chromium-browser: command not found
/cvmfs/soft.computecanada.ca/gentoo/2020/usr/bin/xdg-open: line 871: google-chrome: command not found
/cvmfs/soft.computecanada.ca/gentoo/2020/usr/bin/xdg-open: line 871: www-browser: command not found
/cvmfs/soft.computecanada.ca/gentoo/2020/usr/bin/xdg-open: line 871: links2: command not found
/home/lisat/.local/lib/python3.10/site-packages/xgboost/data.py:440: FutureWarning:

is_sparse is deprecated and will be removed in a future version. Check `isinstance(dtype, pd.SparseDtype)` instead.

[I 2023-12-21 04:04:53,155] A new study created in memory with name: no-name-9e3d1c21-e3cf-4a50-be0a-7bb0600e2bdf
[I 2023-12-21 04:04:53,302] Trial 0 finished with value: inf and parameters: {'learning_rate': 0.9606740129452195, 'aft_loss_distribution                                                                     ': 'normal', 'aft_loss_distribution_scale': 2.666088447167152, 'max_depth': 6, 'booster': 'gbtree', 'scale_pos_weight': 1.963845513503324                                                                     1, 'alpha': 1.6878399017737777, 'lambda': 6.034324688209849, 'eta': 0.019466046487352173, 'sampling_method': 'gradient_based', 'subsample                                                                     ': 0.39993819199499964, 'gamma': 1.1240699613843208}. Best is trial 0 with value: inf.
[I 2023-12-21 04:04:53,725] Trial 1 finished with value: 2.0389176502386084 and parameters: {'learning_rate': 0.07373476748945167, 'aft_l                                                                     oss_distribution': 'logistic', 'aft_loss_distribution_scale': 0.5988798413225921, 'max_depth': 5, 'booster': 'gbtree', 'scale_pos_weight'                                                                     : 0.2668724333164764, 'alpha': 2.006359986070618, 'lambda': 6.521555690881716, 'eta': 0.6072302495258519, 'sampling_method': 'uniform', '                                                                     subsample': 0.7253646046843311, 'gamma': 3.883498139489931}. Best is trial 1 with value: 2.0389176502386084.
[I 2023-12-21 04:04:53,865] Trial 2 finished with value: 2.3590848891047913 and parameters: {'learning_rate': 0.9428730917208392, 'aft_lo                                                                     ss_distribution': 'logistic', 'aft_loss_distribution_scale': 3.4823217329964242, 'max_depth': 8, 'booster': 'gbtree', 'scale_pos_weight':                                                                      0.33087377965013737, 'alpha': 7.5549998075939495, 'lambda': 2.7067723014931593, 'eta': 0.7487486590388645, 'sampling_method': 'uniform',                                                                      'subsample': 0.25474320633934355, 'gamma': 6.208278474343395}. Best is trial 1 with value: 2.0389176502386084.
[I 2023-12-21 04:04:58,497] Trial 3 finished with value: 2.546663168407727 and parameters: {'learning_rate': 0.9646948656679329, 'aft_los                                                                     s_distribution': 'extreme', 'aft_loss_distribution_scale': 7.153127425632442, 'max_depth': 7, 'booster': 'dart', 'scale_pos_weight': 0.52                                                                     91488493808528, 'alpha': 6.322013526881292, 'lambda': 7.823129322637471, 'eta': 0.9913078290301841, 'sampling_method': 'uniform', 'subsam                                                                     ple': 0.6061825720969565, 'gamma': 3.1854816896214366}. Best is trial 1 with value: 2.0389176502386084.
[I 2023-12-21 04:04:59,859] Trial 4 finished with value: inf and parameters: {'learning_rate': 0.704901646119421, 'aft_loss_distribution'                                                                     : 'extreme', 'aft_loss_distribution_scale': 0.7142373677316337, 'max_depth': 4, 'booster': 'dart', 'scale_pos_weight': 3.6930899066780443                                                                     , 'alpha': 3.4259636918004412, 'lambda': 5.838479927817276, 'eta': 0.009392430957681275, 'sampling_method': 'gradient_based', 'subsample'                                                                     : 0.19426376254172883, 'gamma': 8.232329117046705}. Best is trial 1 with value: 2.0389176502386084.
[I 2023-12-21 04:04:59,871] Trial 5 pruned. Trial was pruned at iteration 5.
[I 2023-12-21 04:04:59,876] Trial 6 pruned. Trial was pruned at iteration 0.
[I 2023-12-21 04:04:59,880] Trial 7 pruned. Trial was pruned at iteration 0.
[I 2023-12-21 04:04:59,903] Trial 8 pruned. Trial was pruned at iteration 5.
[I 2023-12-21 04:04:59,908] Trial 9 pruned. Trial was pruned at iteration 0.
[I 2023-12-21 04:04:59,936] Trial 10 pruned. Trial was pruned at iteration 0.
[I 2023-12-21 04:05:00,041] Trial 11 finished with value: 2.0854509648964825 and parameters: {'learning_rate': 0.588719307145322, 'aft_lo                                                                     ss_distribution': 'logistic', 'aft_loss_distribution_scale': 1.371873748294278, 'max_depth': 8, 'booster': 'gbtree', 'scale_pos_weight':                                                                      0.8460992340846198, 'alpha': 9.33776255369713, 'lambda': 2.745391557669756, 'eta': 0.809830070948682, 'sampling_method': 'uniform', 'subs                                                                     ample': 0.03339618219990809, 'gamma': 3.9340217303220504}. Best is trial 1 with value: 2.0389176502386084.
[I 2023-12-21 04:05:00,123] Trial 12 finished with value: inf and parameters: {'learning_rate': 0.5639145388781487, 'aft_loss_distributio                                                                     n': 'logistic', 'aft_loss_distribution_scale': 1.4000945500054156, 'max_depth': 8, 'booster': 'gbtree', 'scale_pos_weight': 0.89365390534                                                                     30204, 'alpha': 9.767965597816572, 'lambda': 2.1863331470430563, 'eta': 0.9322472134307406, 'sampling_method': 'uniform', 'subsample': 0.                                                                     03174856648939858, 'gamma': 3.64040446486074}. Best is trial 1 with value: 2.0389176502386084.
[I 2023-12-21 04:05:00,230] Trial 13 finished with value: inf and parameters: {'learning_rate': 0.3478110722933786, 'aft_loss_distributio                                                                     n': 'logistic', 'aft_loss_distribution_scale': 1.5905800642970742, 'max_depth': 7, 'booster': 'gbtree', 'scale_pos_weight': 0.84277881929                                                                     82146, 'alpha': 4.073915513275351, 'lambda': 4.283724211900487, 'eta': 0.6024415087516142, 'sampling_method': 'uniform', 'subsample': 0.8                                                                     340920276997074, 'gamma': 4.395610423465668}. Best is trial 1 with value: 2.0389176502386084.
[I 2023-12-21 04:05:00,258] Trial 14 pruned. Trial was pruned at iteration 0.
[I 2023-12-21 04:05:00,286] Trial 15 pruned. Trial was pruned at iteration 0.
[I 2023-12-21 04:05:00,316] Trial 16 pruned. Trial was pruned at iteration 0.
[I 2023-12-21 04:05:00,346] Trial 17 pruned. Trial was pruned at iteration 0.
[I 2023-12-21 04:05:00,375] Trial 18 pruned. Trial was pruned at iteration 0.
[I 2023-12-21 04:05:00,403] Trial 19 pruned. Trial was pruned at iteration 0.
[I 2023-12-21 04:05:00,431] Trial 20 pruned. Trial was pruned at iteration 0.
[I 2023-12-21 04:05:00,460] Trial 21 pruned. Trial was pruned at iteration 0.
[I 2023-12-21 04:05:00,489] Trial 22 pruned. Trial was pruned at iteration 0.
[I 2023-12-21 04:05:00,520] Trial 23 pruned. Trial was pruned at iteration 0.
[I 2023-12-21 04:05:00,549] Trial 24 pruned. Trial was pruned at iteration 0.
[I 2023-12-21 04:05:00,579] Trial 25 pruned. Trial was pruned at iteration 0.
[I 2023-12-21 04:05:00,610] Trial 26 pruned. Trial was pruned at iteration 0.
[I 2023-12-21 04:05:00,639] Trial 27 pruned. Trial was pruned at iteration 0.
[I 2023-12-21 04:05:00,669] Trial 28 pruned. Trial was pruned at iteration 0.
[I 2023-12-21 04:05:00,790] Trial 29 finished with value: inf and parameters: {'learning_rate': 0.7674806519230996, 'aft_loss_distributio                                                                     n': 'normal', 'aft_loss_distribution_scale': 2.5679683881068844, 'max_depth': 6, 'booster': 'gbtree', 'scale_pos_weight': 1.9949331032795                                                                     99, 'alpha': 1.5989294785032717, 'lambda': 6.697971273415584, 'eta': 0.16723879567132494, 'sampling_method': 'gradient_based', 'subsample                                                                     ': 0.9054804458818837, 'gamma': 1.3877827502574704}. Best is trial 1 with value: 2.0389176502386084.
[I 2023-12-21 04:05:00,821] Trial 30 pruned. Trial was pruned at iteration 0.
[I 2023-12-21 04:05:00,852] Trial 31 pruned. Trial was pruned at iteration 0.
[I 2023-12-21 04:05:00,883] Trial 32 pruned. Trial was pruned at iteration 0.
[I 2023-12-21 04:05:00,915] Trial 33 pruned. Trial was pruned at iteration 0.
[I 2023-12-21 04:05:00,946] Trial 34 pruned. Trial was pruned at iteration 0.
[I 2023-12-21 04:05:00,978] Trial 35 pruned. Trial was pruned at iteration 0.
[I 2023-12-21 04:05:01,011] Trial 36 pruned. Trial was pruned at iteration 0.
[I 2023-12-21 04:05:01,045] Trial 37 pruned. Trial was pruned at iteration 0.
[I 2023-12-21 04:05:01,077] Trial 38 pruned. Trial was pruned at iteration 0.
[I 2023-12-21 04:05:01,113] Trial 39 pruned. Trial was pruned at iteration 0.
[I 2023-12-21 04:05:01,145] Trial 40 pruned. Trial was pruned at iteration 0.
[I 2023-12-21 04:05:01,310] Trial 41 finished with value: inf and parameters: {'learning_rate': 0.8897684571927339, 'aft_loss_distributio                                                                     n': 'normal', 'aft_loss_distribution_scale': 1.5918107055252195, 'max_depth': 6, 'booster': 'gbtree', 'scale_pos_weight': 1.4413092197624                                                                     29, 'alpha': 1.0971349388176685, 'lambda': 6.384500243276697, 'eta': 0.26618834619343623, 'sampling_method': 'gradient_based', 'subsample                                                                     ': 0.5703132021629841, 'gamma': 0.9603334191162407}. Best is trial 1 with value: 2.0389176502386084.
[I 2023-12-21 04:05:01,469] Trial 42 finished with value: inf and parameters: {'learning_rate': 0.9518107176818478, 'aft_loss_distributio                                                                     n': 'normal', 'aft_loss_distribution_scale': 0.981329890093048, 'max_depth': 5, 'booster': 'gbtree', 'scale_pos_weight': 2.12796165659485                                                                     45, 'alpha': 2.691146557446616, 'lambda': 6.9288200842714005, 'eta': 0.007758019882503242, 'sampling_method': 'gradient_based', 'subsampl                                                                     e': 0.3937516858892235, 'gamma': 0.4740054927439301}. Best is trial 1 with value: 2.0389176502386084.
[I 2023-12-21 04:05:01,504] Trial 43 pruned. Trial was pruned at iteration 1.
[I 2023-12-21 04:05:01,537] Trial 44 pruned. Trial was pruned at iteration 0.
[I 2023-12-21 04:05:01,569] Trial 45 pruned. Trial was pruned at iteration 0.
[I 2023-12-21 04:05:01,600] Trial 46 pruned. Trial was pruned at iteration 0.
[I 2023-12-21 04:05:01,632] Trial 47 pruned. Trial was pruned at iteration 0.
[I 2023-12-21 04:05:01,664] Trial 48 pruned. Trial was pruned at iteration 0.
[I 2023-12-21 04:05:01,696] Trial 49 pruned. Trial was pruned at iteration 0.
[I 2023-12-21 04:05:01,813] Trial 50 finished with value: inf and parameters: {'learning_rate': 0.9692446900387953, 'aft_loss_distributio                                                                     n': 'normal', 'aft_loss_distribution_scale': 1.442662648691519, 'max_depth': 3, 'booster': 'gbtree', 'scale_pos_weight': 1.69973216275857                                                                     8, 'alpha': 8.686401108218082, 'lambda': 3.3666412042982192, 'eta': 0.5278180562615913, 'sampling_method': 'gradient_based', 'subsample':                                                                      0.872739051664362, 'gamma': 4.087866401992023}. Best is trial 1 with value: 2.0389176502386084.
[I 2023-12-21 04:05:01,847] Trial 51 pruned. Trial was pruned at iteration 0.
[I 2023-12-21 04:05:01,880] Trial 52 pruned. Trial was pruned at iteration 0.
[I 2023-12-21 04:05:01,913] Trial 53 pruned. Trial was pruned at iteration 0.
[I 2023-12-21 04:05:01,946] Trial 54 pruned. Trial was pruned at iteration 0.
[I 2023-12-21 04:05:01,980] Trial 55 pruned. Trial was pruned at iteration 0.
[I 2023-12-21 04:05:02,012] Trial 56 pruned. Trial was pruned at iteration 0.
[I 2023-12-21 04:05:02,046] Trial 57 pruned. Trial was pruned at iteration 0.
[I 2023-12-21 04:05:02,080] Trial 58 pruned. Trial was pruned at iteration 0.
[I 2023-12-21 04:05:02,113] Trial 59 pruned. Trial was pruned at iteration 0.
[I 2023-12-21 04:05:02,145] Trial 60 pruned. Trial was pruned at iteration 0.
[I 2023-12-21 04:05:02,232] Trial 61 finished with value: inf and parameters: {'learning_rate': 0.6007586253084156, 'aft_loss_distributio                                                                     n': 'logistic', 'aft_loss_distribution_scale': 1.3198659668097275, 'max_depth': 8, 'booster': 'gbtree', 'scale_pos_weight': 0.90622348997                                                                     94177, 'alpha': 9.922043213819578, 'lambda': 1.5437945169007454, 'eta': 0.912161688295915, 'sampling_method': 'uniform', 'subsample': 0.0                                                                     10639602789338138, 'gamma': 3.710447712836636}. Best is trial 1 with value: 2.0389176502386084.
[I 2023-12-21 04:05:02,266] Trial 62 pruned. Trial was pruned at iteration 1.
[I 2023-12-21 04:05:02,299] Trial 63 pruned. Trial was pruned at iteration 0.
[I 2023-12-21 04:05:02,334] Trial 64 pruned. Trial was pruned at iteration 0.
[I 2023-12-21 04:05:02,368] Trial 65 pruned. Trial was pruned at iteration 0.
[I 2023-12-21 04:05:02,401] Trial 66 pruned. Trial was pruned at iteration 0.
[I 2023-12-21 04:05:02,435] Trial 67 pruned. Trial was pruned at iteration 0.
[I 2023-12-21 04:05:02,469] Trial 68 pruned. Trial was pruned at iteration 0.
[I 2023-12-21 04:05:02,502] Trial 69 pruned. Trial was pruned at iteration 0.
[I 2023-12-21 04:05:02,536] Trial 70 pruned. Trial was pruned at iteration 0.
[I 2023-12-21 04:05:02,579] Trial 71 pruned. Trial was pruned at iteration 0.
[I 2023-12-21 04:05:02,612] Trial 72 pruned. Trial was pruned at iteration 0.
[I 2023-12-21 04:05:02,646] Trial 73 pruned. Trial was pruned at iteration 0.
[I 2023-12-21 04:05:02,680] Trial 74 pruned. Trial was pruned at iteration 0.
[I 2023-12-21 04:05:02,713] Trial 75 pruned. Trial was pruned at iteration 0.
[I 2023-12-21 04:05:02,747] Trial 76 pruned. Trial was pruned at iteration 0.
[I 2023-12-21 04:05:02,782] Trial 77 pruned. Trial was pruned at iteration 0.
[I 2023-12-21 04:05:02,817] Trial 78 pruned. Trial was pruned at iteration 0.
[I 2023-12-21 04:05:02,851] Trial 79 pruned. Trial was pruned at iteration 0.
[I 2023-12-21 04:05:02,885] Trial 80 pruned. Trial was pruned at iteration 0.
[I 2023-12-21 04:05:02,920] Trial 81 pruned. Trial was pruned at iteration 0.
[I 2023-12-21 04:05:02,955] Trial 82 pruned. Trial was pruned at iteration 0.
[I 2023-12-21 04:05:02,990] Trial 83 pruned. Trial was pruned at iteration 0.
