[I 2023-12-18 23:44:32,394] Trial 97 finished with value: 4.32391191644306 and parameters: {'learning_rate': 0.1397481727465077, 'aft_loss_distribution': 'logistic', 'aft_loss_distribution_scale': 0.8669270006506197, 'max_depth': 3, 'booster': 'gbtree', 'scale_pos_weight': 3.0567886125579022, 'alpha': 8.743644996299185, 'lambda': 0.8863319669993266, 'eta': 0.8200153342203598, 'sampling_method': 'uniform', 'subsample': 0.3389802054221634, 'gamma': 4.285324826887492}. Best is trial 83 with value: 4.280027843395548.
[I 2023-12-18 23:44:33,263] Trial 98 pruned. Trial was pruned at iteration 304.
[I 2023-12-18 23:44:33,524] Trial 99 pruned. Trial was pruned at iteration 66.
[I 2023-12-18 23:44:34,117] Trial 100 finished with value: 4.194510122949977 and parameters: {'learning_rate': 0.1109102306620062, 'aft_loss_distribution': 'logistic', 'aft_loss_distribution_scale': 0.5826984003700583, 'max_depth': 4, 'booster': 'gbtree', 'scale_pos_weight': 3.153448328568536, 'alpha': 6.043772791015332, 'lambda': 7.426027530241631, 'eta': 0.8725445213923471, 'sampling_method': 'uniform', 'subsample': 0.4683095388253871, 'gamma': 5.115373150535485}. Best is trial 100 with value: 4.194510122949977.
[I 2023-12-18 23:44:34,216] Trial 101 pruned. Trial was pruned at iteration 0.
[I 2023-12-18 23:44:34,274] Trial 102 pruned. Trial was pruned at iteration 0.
[I 2023-12-18 23:44:34,334] Trial 103 pruned. Trial was pruned at iteration 0.
[I 2023-12-18 23:44:34,395] Trial 104 pruned. Trial was pruned at iteration 0.
[I 2023-12-18 23:44:34,456] Trial 105 pruned. Trial was pruned at iteration 0.
[I 2023-12-18 23:44:34,512] Trial 106 pruned. Trial was pruned at iteration 0.
[I 2023-12-18 23:44:34,571] Trial 107 pruned. Trial was pruned at iteration 0.
[I 2023-12-18 23:44:34,640] Trial 108 pruned. Trial was pruned at iteration 0.
[I 2023-12-18 23:44:34,697] Trial 109 pruned. Trial was pruned at iteration 0.
[I 2023-12-18 23:44:34,757] Trial 110 pruned. Trial was pruned at iteration 1.
[I 2023-12-18 23:44:35,257] Trial 111 finished with value: 4.280218844499476 and parameters: {'learning_rate': 0.1201736007901768, 'aft_loss_distribution': 'logistic', 'aft_loss_distribution_scale': 0.7870126224574346, 'max_depth': 3, 'booster': 'gbtree', 'scale_pos_weight': 2.0700576505721533, 'alpha': 8.960797452875331, 'lambda': 2.0294399484840695, 'eta': 0.780316529279786, 'sampling_method': 'uniform', 'subsample': 0.38449484089578884, 'gamma': 8.249914298792488}. Best is trial 100 with value: 4.194510122949977.
[I 2023-12-18 23:44:35,734] Trial 112 finished with value: 4.279728733164446 and parameters: {'learning_rate': 0.11619265459187761, 'aft_loss_distribution': 'logistic', 'aft_loss_distribution_scale': 0.7867448317626727, 'max_depth': 3, 'booster': 'gbtree', 'scale_pos_weight': 1.7757250178903394, 'alpha': 8.37709870303338, 'lambda': 1.9996548461596553, 'eta': 0.7808409167824908, 'sampling_method': 'uniform', 'subsample': 0.3837767536797735, 'gamma': 6.009936540960433}. Best is trial 100 with value: 4.194510122949977.
[I 2023-12-18 23:44:36,208] Trial 113 finished with value: 4.301173931622033 and parameters: {'learning_rate': 0.1181835381488827, 'aft_loss_distribution': 'logistic', 'aft_loss_distribution_scale': 0.8251795213375299, 'max_depth': 3, 'booster': 'gbtree', 'scale_pos_weight': 1.7660372245665115, 'alpha': 8.37958255640761, 'lambda': 2.2907961058097235, 'eta': 0.779272393700025, 'sampling_method': 'uniform', 'subsample': 0.3867191903490006, 'gamma': 8.146020953496746}. Best is trial 100 with value: 4.194510122949977.
[I 2023-12-18 23:44:36,283] Trial 114 pruned. Trial was pruned at iteration 0.
[I 2023-12-18 23:44:36,346] Trial 115 pruned. Trial was pruned at iteration 0.
[I 2023-12-18 23:44:36,403] Trial 116 pruned. Trial was pruned at iteration 0.
[I 2023-12-18 23:44:37,235] Trial 117 finished with value: 4.232699123014952 and parameters: {'learning_rate': 0.0883034450701804, 'aft_loss_distribution': 'logistic', 'aft_loss_distribution_scale': 0.6616228395653425, 'max_depth': 3, 'booster': 'gbtree', 'scale_pos_weight': 1.8385627254439019, 'alpha': 8.490698436129842, 'lambda': 1.2005798974094444, 'eta': 0.7842533508524816, 'sampling_method': 'uniform', 'subsample': 0.43291084872604485, 'gamma': 6.7762398879026415}. Best is trial 100 with value: 4.194510122949977.
[I 2023-12-18 23:44:37,309] Trial 118 pruned. Trial was pruned at iteration 0.
[I 2023-12-18 23:44:37,367] Trial 119 pruned. Trial was pruned at iteration 0.
[I 2023-12-18 23:44:37,425] Trial 120 pruned. Trial was pruned at iteration 0.
[I 2023-12-18 23:44:37,487] Trial 121 pruned. Trial was pruned at iteration 0.
[I 2023-12-18 23:44:37,544] Trial 122 pruned. Trial was pruned at iteration 0.
[I 2023-12-18 23:44:37,748] Trial 123 pruned. Trial was pruned at iteration 78.
[I 2023-12-18 23:44:37,806] Trial 124 pruned. Trial was pruned at iteration 0.
[I 2023-12-18 23:44:37,869] Trial 125 pruned. Trial was pruned at iteration 0.
[I 2023-12-18 23:44:38,192] Trial 126 pruned. Trial was pruned at iteration 138.
[I 2023-12-18 23:44:38,254] Trial 127 pruned. Trial was pruned at iteration 0.
[I 2023-12-18 23:44:38,416] Trial 128 pruned. Trial was pruned at iteration 51.
[I 2023-12-18 23:44:38,487] Trial 129 pruned. Trial was pruned at iteration 0.
[I 2023-12-18 23:44:38,546] Trial 130 pruned. Trial was pruned at iteration 0.
[I 2023-12-18 23:44:38,604] Trial 131 pruned. Trial was pruned at iteration 0.
[I 2023-12-18 23:44:38,926] Trial 132 pruned. Trial was pruned at iteration 123.
[I 2023-12-18 23:44:38,991] Trial 133 pruned. Trial was pruned at iteration 0.
[I 2023-12-18 23:44:39,062] Trial 134 pruned. Trial was pruned at iteration 0.
[I 2023-12-18 23:44:39,135] Trial 135 pruned. Trial was pruned at iteration 0.
[I 2023-12-18 23:44:39,206] Trial 136 pruned. Trial was pruned at iteration 0.
[I 2023-12-18 23:44:39,275] Trial 137 pruned. Trial was pruned at iteration 0.
[I 2023-12-18 23:44:39,360] Trial 138 pruned. Trial was pruned at iteration 0.
[I 2023-12-18 23:44:39,423] Trial 139 pruned. Trial was pruned at iteration 0.
[I 2023-12-18 23:44:39,492] Trial 140 pruned. Trial was pruned at iteration 0.
[I 2023-12-18 23:44:39,562] Trial 141 pruned. Trial was pruned at iteration 0.
[I 2023-12-18 23:44:39,624] Trial 142 pruned. Trial was pruned at iteration 0.
[I 2023-12-18 23:44:39,926] Trial 143 pruned. Trial was pruned at iteration 123.
[I 2023-12-18 23:44:39,990] Trial 144 pruned. Trial was pruned at iteration 0.
[I 2023-12-18 23:44:40,053] Trial 145 pruned. Trial was pruned at iteration 0.
[I 2023-12-18 23:44:40,115] Trial 146 pruned. Trial was pruned at iteration 0.
[I 2023-12-18 23:44:40,181] Trial 147 pruned. Trial was pruned at iteration 0.
[I 2023-12-18 23:44:40,513] Trial 148 finished with value: 4.254292408476035 and parameters: {'learning_rate': 0.1370133419665775, 'aft_loss_distribution': 'logistic', 'aft_loss_distribution_scale': 0.7288122810474174, 'max_depth': 7, 'booster': 'gbtree', 'scale_pos_weight': 3.253653326382842, 'alpha': 8.462468397999315, 'lambda': 2.108556519770505, 'eta': 0.8651260564538672, 'sampling_method': 'uniform', 'subsample': 0.42779955538487435, 'gamma': 8.867769980481878}. Best is trial 100 with value: 4.194510122949977.
[I 2023-12-18 23:44:40,754] Trial 149 finished with value: 4.264796157587123 and parameters: {'learning_rate': 0.15033850912550215, 'aft_loss_distribution': 'logistic', 'aft_loss_distribution_scale': 0.716327843122475, 'max_depth': 3, 'booster': 'gbtree', 'scale_pos_weight': 2.489994952297658, 'alpha': 8.406183788876067, 'lambda': 2.0420143621200983, 'eta': 0.8893279011771634, 'sampling_method': 'uniform', 'subsample': 0.4315065438613601, 'gamma': 9.20395757610924}. Best is trial 100 with value: 4.194510122949977.
[I 2023-12-18 23:44:40,823] Trial 150 pruned. Trial was pruned at iteration 0.
[I 2023-12-18 23:44:41,404] Trial 151 finished with value: 4.283095088168349 and parameters: {'learning_rate': 0.1443382728115823, 'aft_loss_distribution': 'logistic', 'aft_loss_distribution_scale': 0.7917812667944579, 'max_depth': 3, 'booster': 'gbtree', 'scale_pos_weight': 2.770247044421062, 'alpha': 8.292248226623563, 'lambda': 1.7962718106449143, 'eta': 0.8620851843191166, 'sampling_method': 'uniform', 'subsample': 0.46102939370522894, 'gamma': 9.475424334053168}. Best is trial 100 with value: 4.194510122949977.
[I 2023-12-18 23:44:42,008] Trial 152 finished with value: 4.254177508569636 and parameters: {'learning_rate': 0.13426667002125794, 'aft_loss_distribution': 'logistic', 'aft_loss_distribution_scale': 0.736482543664174, 'max_depth': 3, 'booster': 'gbtree', 'scale_pos_weight': 2.6157410197247346, 'alpha': 8.714808330201626, 'lambda': 2.707878089915019, 'eta': 0.867965217540556, 'sampling_method': 'uniform', 'subsample': 0.48439019103897635, 'gamma': 9.270429782559539}. Best is trial 100 with value: 4.194510122949977.
[I 2023-12-18 23:44:42,080] Trial 153 pruned. Trial was pruned at iteration 0.
[I 2023-12-18 23:44:42,687] Trial 154 finished with value: 4.279445335686798 and parameters: {'learning_rate': 0.12735953903494285, 'aft_loss_distribution': 'logistic', 'aft_loss_distribution_scale': 0.771434798183821, 'max_depth': 3, 'booster': 'gbtree', 'scale_pos_weight': 2.3322266363482425, 'alpha': 8.983702803144652, 'lambda': 1.9904039656016903, 'eta': 0.9032374113323721, 'sampling_method': 'uniform', 'subsample': 0.49284927261458966, 'gamma': 9.17285424892834}. Best is trial 100 with value: 4.194510122949977.
[I 2023-12-18 23:44:42,758] Trial 155 pruned. Trial was pruned at iteration 0.
[I 2023-12-18 23:44:43,056] Trial 156 finished with value: 4.251015611084496 and parameters: {'learning_rate': 0.12716617068757224, 'aft_loss_distribution': 'logistic', 'aft_loss_distribution_scale': 0.7299229766487348, 'max_depth': 3, 'booster': 'gbtree', 'scale_pos_weight': 2.5981277703189294, 'alpha': 9.237195661923513, 'lambda': 2.7700540253791432, 'eta': 0.9417119932264357, 'sampling_method': 'uniform', 'subsample': 0.4598014521009458, 'gamma': 9.499010446416648}. Best is trial 100 with value: 4.194510122949977.
[I 2023-12-18 23:44:43,126] Trial 157 pruned. Trial was pruned at iteration 0.
[I 2023-12-18 23:44:43,196] Trial 158 pruned. Trial was pruned at iteration 0.
[I 2023-12-18 23:44:43,263] Trial 159 pruned. Trial was pruned at iteration 0.
[I 2023-12-18 23:44:43,331] Trial 160 pruned. Trial was pruned at iteration 0.
[I 2023-12-18 23:44:43,541] Trial 161 pruned. Trial was pruned at iteration 73.
[I 2023-12-18 23:44:43,604] Trial 162 pruned. Trial was pruned at iteration 0.
[I 2023-12-18 23:44:43,667] Trial 163 pruned. Trial was pruned at iteration 0.
[I 2023-12-18 23:44:43,738] Trial 164 pruned. Trial was pruned at iteration 0.
[I 2023-12-18 23:44:43,815] Trial 165 pruned. Trial was pruned at iteration 7.
[I 2023-12-18 23:44:44,138] Trial 166 finished with value: 4.2851284219079675 and parameters: {'learning_rate': 0.16165136152791598, 'aft_loss_distribution': 'logistic', 'aft_loss_distribution_scale': 0.7937933116791667, 'max_depth': 3, 'booster': 'gbtree', 'scale_pos_weight': 2.682530371261468, 'alpha': 7.8103819045254195, 'lambda': 2.400688751973654, 'eta': 0.8213635224899822, 'sampling_method': 'uniform', 'subsample': 0.39352878121622753, 'gamma': 9.503538879188493}. Best is trial 100 with value: 4.194510122949977.
[I 2023-12-18 23:44:44,226] Trial 167 pruned. Trial was pruned at iteration 0.
[I 2023-12-18 23:44:44,334] Trial 168 pruned. Trial was pruned at iteration 0.
[I 2023-12-18 23:44:44,437] Trial 169 pruned. Trial was pruned at iteration 0.
[I 2023-12-18 23:44:44,544] Trial 170 pruned. Trial was pruned at iteration 0.
[I 2023-12-18 23:44:44,674] Trial 171 pruned. Trial was pruned at iteration 12.
[I 2023-12-18 23:44:44,784] Trial 172 pruned. Trial was pruned at iteration 0.
[I 2023-12-18 23:44:45,404] Trial 173 finished with value: 4.268252545018274 and parameters: {'learning_rate': 0.18244295283034212, 'aft_loss_distribution': 'logistic', 'aft_loss_distribution_scale': 0.7633319261396316, 'max_depth': 3, 'booster': 'gbtree', 'scale_pos_weight': 1.7205469473691135, 'alpha': 8.214548253972788, 'lambda': 2.3576523199339823, 'eta': 0.8471279323221532, 'sampling_method': 'uniform', 'subsample': 0.4546759336304667, 'gamma': 8.808720966733109}. Best is trial 100 with value: 4.194510122949977.
[I 2023-12-18 23:44:45,537] Trial 174 pruned. Trial was pruned at iteration 0.
[I 2023-12-18 23:44:45,640] Trial 175 pruned. Trial was pruned at iteration 0.
[I 2023-12-18 23:44:45,741] Trial 176 pruned. Trial was pruned at iteration 0.
[I 2023-12-18 23:44:45,838] Trial 177 pruned. Trial was pruned at iteration 0.
[I 2023-12-18 23:44:45,938] Trial 178 pruned. Trial was pruned at iteration 0.
[I 2023-12-18 23:44:46,052] Trial 179 pruned. Trial was pruned at iteration 0.
[I 2023-12-18 23:44:46,152] Trial 180 pruned. Trial was pruned at iteration 0.
[I 2023-12-18 23:44:46,258] Trial 181 pruned. Trial was pruned at iteration 0.
[I 2023-12-18 23:44:46,365] Trial 182 pruned. Trial was pruned at iteration 0.
[I 2023-12-18 23:44:46,465] Trial 183 pruned. Trial was pruned at iteration 0.
[I 2023-12-18 23:44:46,574] Trial 184 pruned. Trial was pruned at iteration 0.
[I 2023-12-18 23:44:46,700] Trial 185 pruned. Trial was pruned at iteration 0.
[I 2023-12-18 23:44:46,808] Trial 186 pruned. Trial was pruned at iteration 0.
[I 2023-12-18 23:44:46,913] Trial 187 pruned. Trial was pruned at iteration 0.
[I 2023-12-18 23:44:47,012] Trial 188 pruned. Trial was pruned at iteration 0.
[I 2023-12-18 23:44:47,114] Trial 189 pruned. Trial was pruned at iteration 0.
[I 2023-12-18 23:44:47,222] Trial 190 pruned. Trial was pruned at iteration 0.
[I 2023-12-18 23:44:47,332] Trial 191 pruned. Trial was pruned at iteration 0.
[I 2023-12-18 23:44:47,672] Trial 192 finished with value: 4.262556080995032 and parameters: {'learning_rate': 0.1848870881094388, 'aft_loss_distribution': 'logistic', 'aft_loss_distribution_scale': 0.7508070480374444, 'max_depth': 3, 'booster': 'gbtree', 'scale_pos_weight': 2.8574020153618336, 'alpha': 8.958404450521558, 'lambda': 1.6444251354835968, 'eta': 0.8919239384626841, 'sampling_method': 'uniform', 'subsample': 0.4173466972030715, 'gamma': 8.328552936449245}. Best is trial 100 with value: 4.194510122949977.
[I 2023-12-18 23:44:47,784] Trial 193 pruned. Trial was pruned at iteration 0.
[I 2023-12-18 23:44:48,068] Trial 194 pruned. Trial was pruned at iteration 74.
[I 2023-12-18 23:44:48,169] Trial 195 pruned. Trial was pruned at iteration 0.
[I 2023-12-18 23:44:48,266] Trial 196 pruned. Trial was pruned at iteration 0.
[I 2023-12-18 23:44:48,363] Trial 197 pruned. Trial was pruned at iteration 0.
[I 2023-12-18 23:44:48,473] Trial 198 pruned. Trial was pruned at iteration 0.
[I 2023-12-18 23:44:48,572] Trial 199 pruned. Trial was pruned at iteration 0.
[I 2023-12-18 23:44:48,681] Trial 200 pruned. Trial was pruned at iteration 0.
[I 2023-12-18 23:44:48,795] Trial 201 pruned. Trial was pruned at iteration 0.
[I 2023-12-18 23:44:48,900] Trial 202 pruned. Trial was pruned at iteration 0.
[I 2023-12-18 23:44:49,012] Trial 203 pruned. Trial was pruned at iteration 0.
[I 2023-12-18 23:44:49,124] Trial 204 pruned. Trial was pruned at iteration 0.
[I 2023-12-18 23:44:49,226] Trial 205 pruned. Trial was pruned at iteration 0.
[I 2023-12-18 23:44:49,331] Trial 206 pruned. Trial was pruned at iteration 0.
[I 2023-12-18 23:44:49,404] Trial 207 pruned. Trial was pruned at iteration 0.
[I 2023-12-18 23:44:49,473] Trial 208 pruned. Trial was pruned at iteration 0.
[I 2023-12-18 23:44:49,544] Trial 209 pruned. Trial was pruned at iteration 0.
[I 2023-12-18 23:44:49,616] Trial 210 pruned. Trial was pruned at iteration 0.
[I 2023-12-18 23:44:49,690] Trial 211 pruned. Trial was pruned at iteration 0.
[I 2023-12-18 23:44:49,763] Trial 212 pruned. Trial was pruned at iteration 0.
[I 2023-12-18 23:44:50,485] Trial 213 pruned. Trial was pruned at iteration 305.
[I 2023-12-18 23:44:50,555] Trial 214 pruned. Trial was pruned at iteration 0.
[I 2023-12-18 23:44:50,619] Trial 215 pruned. Trial was pruned at iteration 0.
[I 2023-12-18 23:44:50,691] Trial 216 pruned. Trial was pruned at iteration 0.
[I 2023-12-18 23:44:50,771] Trial 217 pruned. Trial was pruned at iteration 2.
[I 2023-12-18 23:44:50,849] Trial 218 pruned. Trial was pruned at iteration 0.
[I 2023-12-18 23:44:50,936] Trial 219 pruned. Trial was pruned at iteration 7.
[I 2023-12-18 23:44:51,004] Trial 220 pruned. Trial was pruned at iteration 0.
[I 2023-12-18 23:44:51,076] Trial 221 pruned. Trial was pruned at iteration 0.
[I 2023-12-18 23:44:51,152] Trial 222 pruned. Trial was pruned at iteration 1.
[I 2023-12-18 23:44:51,226] Trial 223 pruned. Trial was pruned at iteration 0.
[I 2023-12-18 23:44:51,299] Trial 224 pruned. Trial was pruned at iteration 0.
[I 2023-12-18 23:44:51,372] Trial 225 pruned. Trial was pruned at iteration 0.
[I 2023-12-18 23:44:51,583] Trial 226 pruned. Trial was pruned at iteration 68.
[I 2023-12-18 23:44:51,655] Trial 227 pruned. Trial was pruned at iteration 0.
[I 2023-12-18 23:44:51,725] Trial 228 pruned. Trial was pruned at iteration 0.
[I 2023-12-18 23:44:51,797] Trial 229 pruned. Trial was pruned at iteration 0.
[I 2023-12-18 23:44:51,888] Trial 230 pruned. Trial was pruned at iteration 0.
[I 2023-12-18 23:44:51,956] Trial 231 pruned. Trial was pruned at iteration 0.
[I 2023-12-18 23:44:52,029] Trial 232 pruned. Trial was pruned at iteration 0.
[I 2023-12-18 23:44:52,104] Trial 233 pruned. Trial was pruned at iteration 0.
[I 2023-12-18 23:44:52,175] Trial 234 pruned. Trial was pruned at iteration 0.
[I 2023-12-18 23:44:52,244] Trial 235 pruned. Trial was pruned at iteration 0.
[I 2023-12-18 23:44:52,324] Trial 236 pruned. Trial was pruned at iteration 0.
[I 2023-12-18 23:44:52,632] Trial 237 finished with value: 4.270791232576023 and parameters: {'learning_rate': 0.1266656571486953, 'aft_loss_distribution': 'logistic', 'aft_loss_distribution_scale': 0.7695480031123718, 'max_depth': 3, 'booster': 'gbtree', 'scale_pos_weight': 2.349182691965208, 'alpha': 8.086547486202704, 'lambda': 1.9686420594932108, 'eta': 0.3419931935812329, 'sampling_method': 'uniform', 'subsample': 0.4194084095822661, 'gamma': 4.689466440198501}. Best is trial 100 with value: 4.194510122949977.
[I 2023-12-18 23:44:52,954] Trial 238 finished with value: 4.257007412130788 and parameters: {'learning_rate': 0.12301827410904675, 'aft_loss_distribution': 'logistic', 'aft_loss_distribution_scale': 0.7423769571407277, 'max_depth': 3, 'booster': 'gbtree', 'scale_pos_weight': 2.3070447125098705, 'alpha': 8.065084963243045, 'lambda': 1.8911986957892606, 'eta': 0.8802508519094808, 'sampling_method': 'uniform', 'subsample': 0.41750234338054765, 'gamma': 4.739556934372643}. Best is trial 100 with value: 4.194510122949977.
[I 2023-12-18 23:44:53,033] Trial 239 pruned. Trial was pruned at iteration 0.
[I 2023-12-18 23:44:53,103] Trial 240 pruned. Trial was pruned at iteration 0.
[I 2023-12-18 23:44:53,179] Trial 241 pruned. Trial was pruned at iteration 1.
[I 2023-12-18 23:44:53,480] Trial 242 finished with value: 4.280563164056043 and parameters: {'learning_rate': 0.13016741446428703, 'aft_loss_distribution': 'logistic', 'aft_loss_distribution_scale': 0.7883265607335519, 'max_depth': 3, 'booster': 'gbtree', 'scale_pos_weight': 1.9325149764995249, 'alpha': 7.821447189400925, 'lambda': 1.5961885310591875, 'eta': 0.3460836059468767, 'sampling_method': 'uniform', 'subsample': 0.39575934234264876, 'gamma': 4.306505278660367}. Best is trial 100 with value: 4.194510122949977.
[I 2023-12-18 23:44:54,222] Trial 243 pruned. Trial was pruned at iteration 314.
[I 2023-12-18 23:44:54,306] Trial 244 pruned. Trial was pruned at iteration 0.
[I 2023-12-18 23:44:54,517] Trial 245 pruned. Trial was pruned at iteration 68.
[I 2023-12-18 23:44:54,587] Trial 246 pruned. Trial was pruned at iteration 0.
[I 2023-12-18 23:44:54,658] Trial 247 pruned. Trial was pruned at iteration 0.
[I 2023-12-18 23:44:54,729] Trial 248 pruned. Trial was pruned at iteration 0.
[I 2023-12-18 23:44:54,799] Trial 249 pruned. Trial was pruned at iteration 0.
[I 2023-12-18 23:44:54,870] Trial 250 pruned. Trial was pruned at iteration 0.
[I 2023-12-18 23:44:55,071] Trial 251 pruned. Trial was pruned at iteration 55.
[I 2023-12-18 23:44:55,153] Trial 252 pruned. Trial was pruned at iteration 0.
[I 2023-12-18 23:44:55,224] Trial 253 pruned. Trial was pruned at iteration 0.
[I 2023-12-18 23:44:55,292] Trial 254 pruned. Trial was pruned at iteration 0.
[I 2023-12-18 23:44:55,365] Trial 255 pruned. Trial was pruned at iteration 0.
[I 2023-12-18 23:44:55,433] Trial 256 pruned. Trial was pruned at iteration 0.
[I 2023-12-18 23:44:55,507] Trial 257 pruned. Trial was pruned at iteration 0.
[I 2023-12-18 23:44:55,589] Trial 258 pruned. Trial was pruned at iteration 0.
[I 2023-12-18 23:44:55,659] Trial 259 pruned. Trial was pruned at iteration 0.
[I 2023-12-18 23:44:55,743] Trial 260 pruned. Trial was pruned at iteration 6.
[I 2023-12-18 23:44:55,815] Trial 261 pruned. Trial was pruned at iteration 0.
[I 2023-12-18 23:44:55,886] Trial 262 pruned. Trial was pruned at iteration 0.
[I 2023-12-18 23:44:55,978] Trial 263 pruned. Trial was pruned at iteration 0.
[I 2023-12-18 23:44:56,054] Trial 264 pruned. Trial was pruned at iteration 0.
[I 2023-12-18 23:44:56,129] Trial 265 pruned. Trial was pruned at iteration 0.
[I 2023-12-18 23:44:56,207] Trial 266 pruned. Trial was pruned at iteration 0.
[I 2023-12-18 23:44:56,286] Trial 267 pruned. Trial was pruned at iteration 0.
[I 2023-12-18 23:44:56,358] Trial 268 pruned. Trial was pruned at iteration 0.
[I 2023-12-18 23:44:56,442] Trial 269 pruned. Trial was pruned at iteration 0.
[I 2023-12-18 23:44:56,515] Trial 270 pruned. Trial was pruned at iteration 0.
[I 2023-12-18 23:44:56,593] Trial 271 pruned. Trial was pruned at iteration 0.
[I 2023-12-18 23:44:56,663] Trial 272 pruned. Trial was pruned at iteration 0.
[I 2023-12-18 23:44:56,735] Trial 273 pruned. Trial was pruned at iteration 0.
