[I 2023-12-21 04:09:41,739] Trial 414 finished with value: inf and parameters: {'learning_rate': 0.9989173782952181, 'aft_loss_distributi                                                                     on': 'normal', 'aft_loss_distribution_scale': 1.6518258206912737, 'max_depth': 3, 'booster': 'dart', 'scale_pos_weight': 1.15171988954358                                                                     96, 'alpha': 9.79296889929794, 'lambda': 8.64509117071841, 'eta': 0.9830279677304925, 'sampling_method': 'uniform', 'subsample': 0.979310                                                                     1656641627, 'gamma': 5.704961535843061}. Best is trial 110 with value: 1.974679967445453.
[I 2023-12-21 04:09:41,788] Trial 415 pruned. Trial was pruned at iteration 0.
[I 2023-12-21 04:09:41,836] Trial 416 pruned. Trial was pruned at iteration 0.
[I 2023-12-21 04:09:41,889] Trial 417 pruned. Trial was pruned at iteration 1.
[I 2023-12-21 04:09:43,152] Trial 418 finished with value: inf and parameters: {'learning_rate': 0.970744923682225, 'aft_loss_distributio                                                                     n': 'normal', 'aft_loss_distribution_scale': 1.4917715577525854, 'max_depth': 4, 'booster': 'dart', 'scale_pos_weight': 1.588261978688202                                                                     2, 'alpha': 9.818203723012175, 'lambda': 9.272900063299822, 'eta': 0.9743046786965361, 'sampling_method': 'uniform', 'subsample': 0.95896                                                                     57846249133, 'gamma': 5.7986354542185365}. Best is trial 110 with value: 1.974679967445453.
[I 2023-12-21 04:09:43,201] Trial 419 pruned. Trial was pruned at iteration 0.
[I 2023-12-21 04:09:43,252] Trial 420 pruned. Trial was pruned at iteration 1.
[I 2023-12-21 04:09:43,301] Trial 421 pruned. Trial was pruned at iteration 0.
[I 2023-12-21 04:09:43,351] Trial 422 pruned. Trial was pruned at iteration 0.
[I 2023-12-21 04:09:43,400] Trial 423 pruned. Trial was pruned at iteration 0.
[I 2023-12-21 04:09:43,452] Trial 424 pruned. Trial was pruned at iteration 0.
[I 2023-12-21 04:09:43,504] Trial 425 pruned. Trial was pruned at iteration 1.
[I 2023-12-21 04:09:43,553] Trial 426 pruned. Trial was pruned at iteration 0.
[I 2023-12-21 04:09:43,603] Trial 427 pruned. Trial was pruned at iteration 0.
[I 2023-12-21 04:09:43,652] Trial 428 pruned. Trial was pruned at iteration 0.
[I 2023-12-21 04:09:44,864] Trial 429 finished with value: inf and parameters: {'learning_rate': 0.9803002602137514, 'aft_loss_distributi                                                                     on': 'normal', 'aft_loss_distribution_scale': 1.5370530578582953, 'max_depth': 3, 'booster': 'dart', 'scale_pos_weight': 1.45477292275396                                                                     4, 'alpha': 9.436030817195848, 'lambda': 7.96930062089989, 'eta': 0.9130023376356199, 'sampling_method': 'uniform', 'subsample': 0.979153                                                                     8224232251, 'gamma': 6.102375635629661}. Best is trial 110 with value: 1.974679967445453.
[I 2023-12-21 04:09:44,921] Trial 430 pruned. Trial was pruned at iteration 1.
[I 2023-12-21 04:09:44,974] Trial 431 pruned. Trial was pruned at iteration 1.
[I 2023-12-21 04:09:45,022] Trial 432 pruned. Trial was pruned at iteration 0.
[I 2023-12-21 04:09:45,071] Trial 433 pruned. Trial was pruned at iteration 0.
[I 2023-12-21 04:09:45,120] Trial 434 pruned. Trial was pruned at iteration 0.
[I 2023-12-21 04:09:45,169] Trial 435 pruned. Trial was pruned at iteration 0.
[I 2023-12-21 04:09:45,226] Trial 436 pruned. Trial was pruned at iteration 2.
[I 2023-12-21 04:09:45,277] Trial 437 pruned. Trial was pruned at iteration 0.
[I 2023-12-21 04:09:45,327] Trial 438 pruned. Trial was pruned at iteration 0.
[I 2023-12-21 04:09:45,376] Trial 439 pruned. Trial was pruned at iteration 0.
[I 2023-12-21 04:09:47,795] Trial 440 finished with value: 1.985941488690216 and parameters: {'learning_rate': 0.946994290685012, 'aft_lo                                                                     ss_distribution': 'normal', 'aft_loss_distribution_scale': 1.5645729909164863, 'max_depth': 4, 'booster': 'dart', 'scale_pos_weight': 1.1                                                                     806725948239998, 'alpha': 9.995976836128408, 'lambda': 9.115338876618818, 'eta': 0.9814050611684446, 'sampling_method': 'uniform', 'subsa                                                                     mple': 0.9272163537883665, 'gamma': 6.9030373165810754}. Best is trial 110 with value: 1.974679967445453.
[I 2023-12-21 04:09:47,847] Trial 441 pruned. Trial was pruned at iteration 0.
[I 2023-12-21 04:09:54,437] Trial 442 finished with value: 1.9854918365535104 and parameters: {'learning_rate': 0.9489876289391027, 'aft_                                                                     loss_distribution': 'normal', 'aft_loss_distribution_scale': 1.5181877232916745, 'max_depth': 4, 'booster': 'dart', 'scale_pos_weight': 1                                                                     .0355562426091272, 'alpha': 9.831509183027554, 'lambda': 8.851615467599217, 'eta': 0.8923350878981399, 'sampling_method': 'uniform', 'sub                                                                     sample': 0.9288933706084946, 'gamma': 6.824995995266004}. Best is trial 110 with value: 1.974679967445453.
[I 2023-12-21 04:09:56,430] Trial 443 finished with value: inf and parameters: {'learning_rate': 0.9472806481060972, 'aft_loss_distributi                                                                     on': 'normal', 'aft_loss_distribution_scale': 1.513581289056092, 'max_depth': 4, 'booster': 'dart', 'scale_pos_weight': 0.903482554315196                                                                     1, 'alpha': 9.851905058477367, 'lambda': 8.416155318344462, 'eta': 0.8659775846613277, 'sampling_method': 'uniform', 'subsample': 0.93443                                                                     65925259971, 'gamma': 6.955468616852809}. Best is trial 110 with value: 1.974679967445453.
[I 2023-12-21 04:09:56,481] Trial 444 pruned. Trial was pruned at iteration 0.
[I 2023-12-21 04:09:56,530] Trial 445 pruned. Trial was pruned at iteration 0.
[I 2023-12-21 04:09:56,580] Trial 446 pruned. Trial was pruned at iteration 0.
[I 2023-12-21 04:09:59,349] Trial 447 finished with value: 1.9930069757049662 and parameters: {'learning_rate': 0.9858282445106695, 'aft_                                                                     loss_distribution': 'normal', 'aft_loss_distribution_scale': 1.6375111971595258, 'max_depth': 4, 'booster': 'dart', 'scale_pos_weight': 1                                                                     .1543378958231942, 'alpha': 8.84588174018322, 'lambda': 8.914213876788688, 'eta': 0.8909278298227912, 'sampling_method': 'uniform', 'subs                                                                     ample': 0.9185448536738974, 'gamma': 6.779801613253274}. Best is trial 110 with value: 1.974679967445453.
[I 2023-12-21 04:09:59,412] Trial 448 pruned. Trial was pruned at iteration 3.
[I 2023-12-21 04:10:01,436] Trial 449 finished with value: 1.982442501554971 and parameters: {'learning_rate': 0.975847145257116, 'aft_lo                                                                     ss_distribution': 'normal', 'aft_loss_distribution_scale': 1.3750797791836207, 'max_depth': 4, 'booster': 'dart', 'scale_pos_weight': 0.9                                                                     813205878459109, 'alpha': 8.830541876426024, 'lambda': 9.40756136920875, 'eta': 0.8624837294588524, 'sampling_method': 'uniform', 'subsam                                                                     ple': 0.9806021100936166, 'gamma': 6.726178200423212}. Best is trial 110 with value: 1.974679967445453.
[I 2023-12-21 04:10:01,487] Trial 450 pruned. Trial was pruned at iteration 0.
[I 2023-12-21 04:10:01,538] Trial 451 pruned. Trial was pruned at iteration 0.
[I 2023-12-21 04:10:02,682] Trial 452 finished with value: inf and parameters: {'learning_rate': 0.9737358690449777, 'aft_loss_distributi                                                                     on': 'normal', 'aft_loss_distribution_scale': 1.3452787878464982, 'max_depth': 4, 'booster': 'dart', 'scale_pos_weight': 1.01337483835557                                                                     72, 'alpha': 8.57486263319053, 'lambda': 9.482082826248385, 'eta': 0.8309155406989956, 'sampling_method': 'uniform', 'subsample': 0.96911                                                                     73763614205, 'gamma': 6.569722720263542}. Best is trial 110 with value: 1.974679967445453.
[I 2023-12-21 04:10:02,733] Trial 453 pruned. Trial was pruned at iteration 0.
[I 2023-12-21 04:10:02,786] Trial 454 pruned. Trial was pruned at iteration 1.
[I 2023-12-21 04:10:04,134] Trial 455 finished with value: inf and parameters: {'learning_rate': 0.9675877697406468, 'aft_loss_distributi                                                                     on': 'normal', 'aft_loss_distribution_scale': 1.5812274881088946, 'max_depth': 4, 'booster': 'dart', 'scale_pos_weight': 1.05824026331499                                                                     54, 'alpha': 9.104518689044932, 'lambda': 9.263044408604422, 'eta': 0.8826332275635754, 'sampling_method': 'uniform', 'subsample': 0.9477                                                                     063955691726, 'gamma': 6.899811678270983}. Best is trial 110 with value: 1.974679967445453.
[I 2023-12-21 04:10:06,132] Trial 456 finished with value: inf and parameters: {'learning_rate': 0.9508448494079053, 'aft_loss_distributi                                                                     on': 'normal', 'aft_loss_distribution_scale': 1.5542046364660125, 'max_depth': 4, 'booster': 'dart', 'scale_pos_weight': 0.92157835054907                                                                     92, 'alpha': 8.843654054557714, 'lambda': 8.904460425131585, 'eta': 0.8191528356863778, 'sampling_method': 'uniform', 'subsample': 0.9387                                                                     184389623153, 'gamma': 6.773255222883996}. Best is trial 110 with value: 1.974679967445453.
[I 2023-12-21 04:10:07,298] Trial 457 finished with value: inf and parameters: {'learning_rate': 0.9797980476676043, 'aft_loss_distributi                                                                     on': 'normal', 'aft_loss_distribution_scale': 1.4127548839442063, 'max_depth': 4, 'booster': 'dart', 'scale_pos_weight': 0.98643224362616                                                                     44, 'alpha': 9.057991968034209, 'lambda': 9.185793853104851, 'eta': 0.8920587181671599, 'sampling_method': 'gradient_based', 'subsample':                                                                      0.96254391853752, 'gamma': 6.5219051812801}. Best is trial 110 with value: 1.974679967445453.
[I 2023-12-21 04:10:07,355] Trial 458 pruned. Trial was pruned at iteration 2.
[I 2023-12-21 04:10:07,406] Trial 459 pruned. Trial was pruned at iteration 0.
[I 2023-12-21 04:10:07,458] Trial 460 pruned. Trial was pruned at iteration 0.
[I 2023-12-21 04:10:07,508] Trial 461 pruned. Trial was pruned at iteration 0.
[I 2023-12-21 04:10:07,565] Trial 462 pruned. Trial was pruned at iteration 2.
[I 2023-12-21 04:10:07,618] Trial 463 pruned. Trial was pruned at iteration 1.
[I 2023-12-21 04:10:07,670] Trial 464 pruned. Trial was pruned at iteration 0.
[I 2023-12-21 04:10:07,721] Trial 465 pruned. Trial was pruned at iteration 0.
[I 2023-12-21 04:10:07,773] Trial 466 pruned. Trial was pruned at iteration 0.
[I 2023-12-21 04:10:07,826] Trial 467 pruned. Trial was pruned at iteration 1.
[I 2023-12-21 04:10:07,877] Trial 468 pruned. Trial was pruned at iteration 0.
[I 2023-12-21 04:10:07,931] Trial 469 pruned. Trial was pruned at iteration 1.
[I 2023-12-21 04:10:07,981] Trial 470 pruned. Trial was pruned at iteration 0.
[I 2023-12-21 04:10:08,034] Trial 471 pruned. Trial was pruned at iteration 0.
[I 2023-12-21 04:10:08,087] Trial 472 pruned. Trial was pruned at iteration 0.
[I 2023-12-21 04:10:08,138] Trial 473 pruned. Trial was pruned at iteration 0.
[I 2023-12-21 04:10:08,192] Trial 474 pruned. Trial was pruned at iteration 1.
[I 2023-12-21 04:10:08,243] Trial 475 pruned. Trial was pruned at iteration 0.
[I 2023-12-21 04:10:08,295] Trial 476 pruned. Trial was pruned at iteration 0.
[I 2023-12-21 04:10:09,461] Trial 477 finished with value: inf and parameters: {'learning_rate': 0.9572529019732678, 'aft_loss_distributi                                                                     on': 'normal', 'aft_loss_distribution_scale': 1.655650960857927, 'max_depth': 4, 'booster': 'dart', 'scale_pos_weight': 1.532344718220842                                                                     , 'alpha': 8.026327534043888, 'lambda': 9.176192643256472, 'eta': 0.9660050971631247, 'sampling_method': 'gradient_based', 'subsample': 0                                                                     .951164269888729, 'gamma': 7.575682729812467}. Best is trial 110 with value: 1.974679967445453.
[I 2023-12-21 04:10:09,513] Trial 478 pruned. Trial was pruned at iteration 0.
[I 2023-12-21 04:10:09,569] Trial 479 pruned. Trial was pruned at iteration 1.
[I 2023-12-21 04:10:10,723] Trial 480 finished with value: inf and parameters: {'learning_rate': 0.9675057016138014, 'aft_loss_distributi                                                                     on': 'normal', 'aft_loss_distribution_scale': 1.5813381661701618, 'max_depth': 4, 'booster': 'dart', 'scale_pos_weight': 1.39429531159049                                                                     26, 'alpha': 9.683183550797994, 'lambda': 8.903310214070476, 'eta': 0.981586500197181, 'sampling_method': 'uniform', 'subsample': 0.96842                                                                     81541090096, 'gamma': 6.199180820736924}. Best is trial 110 with value: 1.974679967445453.
[I 2023-12-21 04:10:10,775] Trial 481 pruned. Trial was pruned at iteration 0.
[I 2023-12-21 04:10:10,827] Trial 482 pruned. Trial was pruned at iteration 0.
[I 2023-12-21 04:10:10,879] Trial 483 pruned. Trial was pruned at iteration 0.
[I 2023-12-21 04:10:10,937] Trial 484 pruned. Trial was pruned at iteration 2.
[I 2023-12-21 04:10:10,989] Trial 485 pruned. Trial was pruned at iteration 0.
[I 2023-12-21 04:10:11,045] Trial 486 pruned. Trial was pruned at iteration 1.
[I 2023-12-21 04:10:11,097] Trial 487 pruned. Trial was pruned at iteration 0.
[I 2023-12-21 04:10:11,151] Trial 488 pruned. Trial was pruned at iteration 1.
[I 2023-12-21 04:10:11,203] Trial 489 pruned. Trial was pruned at iteration 0.
[I 2023-12-21 04:10:11,254] Trial 490 pruned. Trial was pruned at iteration 0.
[I 2023-12-21 04:10:11,309] Trial 491 pruned. Trial was pruned at iteration 0.
[I 2023-12-21 04:10:11,361] Trial 492 pruned. Trial was pruned at iteration 0.
[I 2023-12-21 04:10:11,413] Trial 493 pruned. Trial was pruned at iteration 0.
[I 2023-12-21 04:10:11,465] Trial 494 pruned. Trial was pruned at iteration 0.
[I 2023-12-21 04:10:11,517] Trial 495 pruned. Trial was pruned at iteration 0.
[I 2023-12-21 04:10:11,569] Trial 496 pruned. Trial was pruned at iteration 0.
[I 2023-12-21 04:10:11,621] Trial 497 pruned. Trial was pruned at iteration 0.
[I 2023-12-21 04:10:12,817] Trial 498 finished with value: inf and parameters: {'learning_rate': 0.9830246342620808, 'aft_loss_distributi                                                                     on': 'normal', 'aft_loss_distribution_scale': 1.5296441207492608, 'max_depth': 3, 'booster': 'dart', 'scale_pos_weight': 1.18629117802704                                                                     8, 'alpha': 9.417189125149036, 'lambda': 8.365712096004344, 'eta': 0.846760469093607, 'sampling_method': 'uniform', 'subsample': 0.999023                                                                     0740102942, 'gamma': 4.8809024499483336}. Best is trial 110 with value: 1.974679967445453.
