[I 2023-12-21 04:04:38,974] Trial 298 pruned. Trial was pruned at iteration 0.
[I 2023-12-21 04:04:39,021] Trial 299 pruned. Trial was pruned at iteration 0.
[I 2023-12-21 04:04:39,066] Trial 300 pruned. Trial was pruned at iteration 0.
[I 2023-12-21 04:04:39,113] Trial 301 pruned. Trial was pruned at iteration 0.
[I 2023-12-21 04:04:39,160] Trial 302 pruned. Trial was pruned at iteration 1.
[I 2023-12-21 04:04:39,205] Trial 303 pruned. Trial was pruned at iteration 0.
[I 2023-12-21 04:04:39,250] Trial 304 pruned. Trial was pruned at iteration 0.
[I 2023-12-21 04:04:39,295] Trial 305 pruned. Trial was pruned at iteration 0.
[I 2023-12-21 04:04:39,343] Trial 306 pruned. Trial was pruned at iteration 0.
[I 2023-12-21 04:04:39,396] Trial 307 pruned. Trial was pruned at iteration 0.
[I 2023-12-21 04:04:39,441] Trial 308 pruned. Trial was pruned at iteration 0.
[I 2023-12-21 04:04:39,563] Trial 309 finished with value: inf and parameters: {'learning_rate': 0.8896704983196068, 'aft_loss_distributi                                                                     on': 'normal', 'aft_loss_distribution_scale': 0.9972816960581103, 'max_depth': 3, 'booster': 'gbtree', 'scale_pos_weight': 2.951830207217                                                                     241, 'alpha': 0.3090237488693217, 'lambda': 1.0642345862769513, 'eta': 0.5901495171044839, 'sampling_method': 'gradient_based', 'subsampl                                                                     e': 0.7586963321559185, 'gamma': 4.136604771906849}. Best is trial 61 with value: 4.247532035211623.
[I 2023-12-21 04:04:39,608] Trial 310 pruned. Trial was pruned at iteration 0.
[I 2023-12-21 04:04:39,654] Trial 311 pruned. Trial was pruned at iteration 0.
[I 2023-12-21 04:04:39,700] Trial 312 pruned. Trial was pruned at iteration 0.
[I 2023-12-21 04:04:39,746] Trial 313 pruned. Trial was pruned at iteration 0.
[I 2023-12-21 04:04:39,795] Trial 314 pruned. Trial was pruned at iteration 0.
[I 2023-12-21 04:04:39,841] Trial 315 pruned. Trial was pruned at iteration 0.
[I 2023-12-21 04:04:39,891] Trial 316 pruned. Trial was pruned at iteration 1.
[I 2023-12-21 04:04:39,937] Trial 317 pruned. Trial was pruned at iteration 0.
[I 2023-12-21 04:04:39,982] Trial 318 pruned. Trial was pruned at iteration 0.
[I 2023-12-21 04:04:40,029] Trial 319 pruned. Trial was pruned at iteration 0.
[I 2023-12-21 04:04:40,075] Trial 320 pruned. Trial was pruned at iteration 0.
[I 2023-12-21 04:04:40,123] Trial 321 pruned. Trial was pruned at iteration 0.
[I 2023-12-21 04:04:40,170] Trial 322 pruned. Trial was pruned at iteration 0.
[I 2023-12-21 04:04:40,216] Trial 323 pruned. Trial was pruned at iteration 0.
[I 2023-12-21 04:04:40,263] Trial 324 pruned. Trial was pruned at iteration 0.
[I 2023-12-21 04:04:40,312] Trial 325 pruned. Trial was pruned at iteration 0.
[I 2023-12-21 04:04:40,358] Trial 326 pruned. Trial was pruned at iteration 0.
[I 2023-12-21 04:04:40,406] Trial 327 pruned. Trial was pruned at iteration 0.
[I 2023-12-21 04:04:40,453] Trial 328 pruned. Trial was pruned at iteration 0.
[I 2023-12-21 04:04:40,501] Trial 329 pruned. Trial was pruned at iteration 0.
[I 2023-12-21 04:04:40,549] Trial 330 pruned. Trial was pruned at iteration 1.
[I 2023-12-21 04:04:40,596] Trial 331 pruned. Trial was pruned at iteration 0.
[I 2023-12-21 04:04:40,643] Trial 332 pruned. Trial was pruned at iteration 0.
[I 2023-12-21 04:04:40,764] Trial 333 finished with value: inf and parameters: {'learning_rate': 0.9419211598775757, 'aft_loss_distributi                                                                     on': 'normal', 'aft_loss_distribution_scale': 1.0854905325415245, 'max_depth': 9, 'booster': 'gbtree', 'scale_pos_weight': 2.301532995162                                                                     1153, 'alpha': 9.659251479463409, 'lambda': 5.69222653335935, 'eta': 0.057278137896123626, 'sampling_method': 'gradient_based', 'subsampl                                                                     e': 0.6566976559619289, 'gamma': 8.526811470688147}. Best is trial 61 with value: 4.247532035211623.
[I 2023-12-21 04:04:40,812] Trial 334 pruned. Trial was pruned at iteration 0.
[I 2023-12-21 04:04:40,860] Trial 335 pruned. Trial was pruned at iteration 0.
[I 2023-12-21 04:04:40,906] Trial 336 pruned. Trial was pruned at iteration 0.
[I 2023-12-21 04:04:40,953] Trial 337 pruned. Trial was pruned at iteration 0.
[I 2023-12-21 04:04:41,000] Trial 338 pruned. Trial was pruned at iteration 0.
[I 2023-12-21 04:04:41,047] Trial 339 pruned. Trial was pruned at iteration 0.
[I 2023-12-21 04:04:41,096] Trial 340 pruned. Trial was pruned at iteration 0.
[I 2023-12-21 04:04:41,235] Trial 341 finished with value: inf and parameters: {'learning_rate': 0.8984714327856862, 'aft_loss_distributi                                                                     on': 'normal', 'aft_loss_distribution_scale': 1.00848205680764, 'max_depth': 3, 'booster': 'gbtree', 'scale_pos_weight': 5.73339093945736                                                                     2, 'alpha': 9.443533920286622, 'lambda': 7.477646118446107, 'eta': 0.4307132459641436, 'sampling_method': 'gradient_based', 'subsample':                                                                      0.6350872693773528, 'gamma': 1.3965561102838913}. Best is trial 61 with value: 4.247532035211623.
[I 2023-12-21 04:04:41,282] Trial 342 pruned. Trial was pruned at iteration 0.
[I 2023-12-21 04:04:41,331] Trial 343 pruned. Trial was pruned at iteration 0.
[I 2023-12-21 04:04:41,378] Trial 344 pruned. Trial was pruned at iteration 0.
[I 2023-12-21 04:04:41,427] Trial 345 pruned. Trial was pruned at iteration 1.
[I 2023-12-21 04:04:41,474] Trial 346 pruned. Trial was pruned at iteration 0.
[I 2023-12-21 04:04:41,604] Trial 347 finished with value: inf and parameters: {'learning_rate': 0.982520375460452, 'aft_loss_distributio                                                                     n': 'normal', 'aft_loss_distribution_scale': 1.0944689300547759, 'max_depth': 9, 'booster': 'gbtree', 'scale_pos_weight': 6.0277893985270                                                                     31, 'alpha': 9.850245713650224, 'lambda': 1.784667547896205, 'eta': 0.40979314571044734, 'sampling_method': 'gradient_based', 'subsample'                                                                     : 0.8425447368823439, 'gamma': 9.240093222832774}. Best is trial 61 with value: 4.247532035211623.
[I 2023-12-21 04:04:41,651] Trial 348 pruned. Trial was pruned at iteration 0.
[I 2023-12-21 04:04:41,698] Trial 349 pruned. Trial was pruned at iteration 0.
[I 2023-12-21 04:04:41,745] Trial 350 pruned. Trial was pruned at iteration 0.
[I 2023-12-21 04:04:41,793] Trial 351 pruned. Trial was pruned at iteration 0.
[I 2023-12-21 04:04:41,840] Trial 352 pruned. Trial was pruned at iteration 0.
[I 2023-12-21 04:04:41,887] Trial 353 pruned. Trial was pruned at iteration 0.
[I 2023-12-21 04:04:41,939] Trial 354 pruned. Trial was pruned at iteration 1.
[I 2023-12-21 04:04:41,988] Trial 355 pruned. Trial was pruned at iteration 0.
[I 2023-12-21 04:04:42,036] Trial 356 pruned. Trial was pruned at iteration 0.
[I 2023-12-21 04:04:42,089] Trial 357 pruned. Trial was pruned at iteration 1.
[I 2023-12-21 04:04:42,137] Trial 358 pruned. Trial was pruned at iteration 0.
[I 2023-12-21 04:04:42,184] Trial 359 pruned. Trial was pruned at iteration 0.
[I 2023-12-21 04:04:42,234] Trial 360 pruned. Trial was pruned at iteration 0.
[I 2023-12-21 04:04:42,282] Trial 361 pruned. Trial was pruned at iteration 0.
[I 2023-12-21 04:04:42,342] Trial 362 pruned. Trial was pruned at iteration 3.
[I 2023-12-21 04:04:42,391] Trial 363 pruned. Trial was pruned at iteration 0.
[I 2023-12-21 04:04:42,439] Trial 364 pruned. Trial was pruned at iteration 0.
[I 2023-12-21 04:04:42,489] Trial 365 pruned. Trial was pruned at iteration 1.
[I 2023-12-21 04:04:42,539] Trial 366 pruned. Trial was pruned at iteration 0.
[I 2023-12-21 04:04:42,587] Trial 367 pruned. Trial was pruned at iteration 0.
[I 2023-12-21 04:04:42,636] Trial 368 pruned. Trial was pruned at iteration 0.
[I 2023-12-21 04:04:42,685] Trial 369 pruned. Trial was pruned at iteration 0.
[I 2023-12-21 04:04:42,735] Trial 370 pruned. Trial was pruned at iteration 0.
[I 2023-12-21 04:04:42,783] Trial 371 pruned. Trial was pruned at iteration 0.
[I 2023-12-21 04:04:42,832] Trial 372 pruned. Trial was pruned at iteration 0.
[I 2023-12-21 04:04:42,951] Trial 373 finished with value: inf and parameters: {'learning_rate': 0.9642999847164104, 'aft_loss_distributi                                                                     on': 'normal', 'aft_loss_distribution_scale': 1.0525853459749421, 'max_depth': 3, 'booster': 'gbtree', 'scale_pos_weight': 3.265505278109                                                                     7558, 'alpha': 7.283894894281627, 'lambda': 0.6271991976038478, 'eta': 0.08092284211928343, 'sampling_method': 'gradient_based', 'subsamp                                                                     le': 0.6149818003073957, 'gamma': 7.871855052698325}. Best is trial 61 with value: 4.247532035211623.
[I 2023-12-21 04:04:43,000] Trial 374 pruned. Trial was pruned at iteration 0.
[I 2023-12-21 04:04:43,048] Trial 375 pruned. Trial was pruned at iteration 0.
[I 2023-12-21 04:04:43,099] Trial 376 pruned. Trial was pruned at iteration 0.
[I 2023-12-21 04:04:43,147] Trial 377 pruned. Trial was pruned at iteration 0.
[I 2023-12-21 04:04:43,196] Trial 378 pruned. Trial was pruned at iteration 0.
[I 2023-12-21 04:04:43,245] Trial 379 pruned. Trial was pruned at iteration 0.
[I 2023-12-21 04:04:43,295] Trial 380 pruned. Trial was pruned at iteration 0.
[I 2023-12-21 04:04:43,346] Trial 381 pruned. Trial was pruned at iteration 0.
[I 2023-12-21 04:04:43,397] Trial 382 pruned. Trial was pruned at iteration 0.
[I 2023-12-21 04:04:43,447] Trial 383 pruned. Trial was pruned at iteration 0.
[I 2023-12-21 04:04:43,497] Trial 384 pruned. Trial was pruned at iteration 0.
[I 2023-12-21 04:04:43,547] Trial 385 pruned. Trial was pruned at iteration 1.
[I 2023-12-21 04:04:43,598] Trial 386 pruned. Trial was pruned at iteration 0.
[I 2023-12-21 04:04:43,647] Trial 387 pruned. Trial was pruned at iteration 0.
[I 2023-12-21 04:04:43,696] Trial 388 pruned. Trial was pruned at iteration 0.
[I 2023-12-21 04:04:43,816] Trial 389 finished with value: inf and parameters: {'learning_rate': 0.9148948328076062, 'aft_loss_distributi                                                                     on': 'normal', 'aft_loss_distribution_scale': 1.0414498251089779, 'max_depth': 8, 'booster': 'gbtree', 'scale_pos_weight': 3.591115661769                                                                     537, 'alpha': 9.694549918585764, 'lambda': 0.47902515052329403, 'eta': 0.008820558731699867, 'sampling_method': 'gradient_based', 'subsam                                                                     ple': 0.9124941867053666, 'gamma': 9.216800856963102}. Best is trial 61 with value: 4.247532035211623.
[I 2023-12-21 04:04:43,866] Trial 390 pruned. Trial was pruned at iteration 0.
[I 2023-12-21 04:04:43,915] Trial 391 pruned. Trial was pruned at iteration 0.
[I 2023-12-21 04:04:43,964] Trial 392 pruned. Trial was pruned at iteration 0.
[I 2023-12-21 04:04:44,016] Trial 393 pruned. Trial was pruned at iteration 0.
[I 2023-12-21 04:04:44,065] Trial 394 pruned. Trial was pruned at iteration 0.
[I 2023-12-21 04:04:44,115] Trial 395 pruned. Trial was pruned at iteration 0.
[I 2023-12-21 04:04:44,168] Trial 396 pruned. Trial was pruned at iteration 0.
[I 2023-12-21 04:04:44,219] Trial 397 pruned. Trial was pruned at iteration 0.
[I 2023-12-21 04:04:44,269] Trial 398 pruned. Trial was pruned at iteration 0.
[I 2023-12-21 04:04:44,434] Trial 399 finished with value: 4.251959108709902 and parameters: {'learning_rate': 0.9601265565988772, 'aft_l                                                                     oss_distribution': 'normal', 'aft_loss_distribution_scale': 1.058214793491018, 'max_depth': 6, 'booster': 'gbtree', 'scale_pos_weight': 3                                                                     .3675598003572316, 'alpha': 9.624125884347325, 'lambda': 5.184974520124111, 'eta': 0.4220131352660377, 'sampling_method': 'gradient_based                                                                     ', 'subsample': 0.6055900782155655, 'gamma': 9.122280814687366}. Best is trial 61 with value: 4.247532035211623.
[I 2023-12-21 04:04:44,487] Trial 400 pruned. Trial was pruned at iteration 1.
[I 2023-12-21 04:04:44,540] Trial 401 pruned. Trial was pruned at iteration 1.
[I 2023-12-21 04:04:44,590] Trial 402 pruned. Trial was pruned at iteration 0.
[I 2023-12-21 04:04:44,640] Trial 403 pruned. Trial was pruned at iteration 0.
[I 2023-12-21 04:04:44,690] Trial 404 pruned. Trial was pruned at iteration 0.
[I 2023-12-21 04:04:44,740] Trial 405 pruned. Trial was pruned at iteration 0.
[I 2023-12-21 04:04:44,793] Trial 406 pruned. Trial was pruned at iteration 0.
[I 2023-12-21 04:04:44,843] Trial 407 pruned. Trial was pruned at iteration 0.
[I 2023-12-21 04:04:44,893] Trial 408 pruned. Trial was pruned at iteration 0.
[I 2023-12-21 04:04:44,944] Trial 409 pruned. Trial was pruned at iteration 0.
[I 2023-12-21 04:04:44,995] Trial 410 pruned. Trial was pruned at iteration 0.
[I 2023-12-21 04:04:45,045] Trial 411 pruned. Trial was pruned at iteration 0.
[I 2023-12-21 04:04:45,096] Trial 412 pruned. Trial was pruned at iteration 0.
[I 2023-12-21 04:04:45,149] Trial 413 pruned. Trial was pruned at iteration 1.
[I 2023-12-21 04:04:45,200] Trial 414 pruned. Trial was pruned at iteration 0.
[I 2023-12-21 04:04:45,250] Trial 415 pruned. Trial was pruned at iteration 0.
[I 2023-12-21 04:04:45,306] Trial 416 pruned. Trial was pruned at iteration 1.
[I 2023-12-21 04:04:45,356] Trial 417 pruned. Trial was pruned at iteration 0.
[I 2023-12-21 04:04:45,407] Trial 418 pruned. Trial was pruned at iteration 0.
[I 2023-12-21 04:04:45,459] Trial 419 pruned. Trial was pruned at iteration 0.
[I 2023-12-21 04:04:45,510] Trial 420 pruned. Trial was pruned at iteration 0.
[I 2023-12-21 04:04:45,561] Trial 421 pruned. Trial was pruned at iteration 0.
[I 2023-12-21 04:04:45,612] Trial 422 pruned. Trial was pruned at iteration 0.
[I 2023-12-21 04:04:45,664] Trial 423 pruned. Trial was pruned at iteration 0.
[I 2023-12-21 04:04:45,720] Trial 424 pruned. Trial was pruned at iteration 3.
[I 2023-12-21 04:04:45,773] Trial 425 pruned. Trial was pruned at iteration 0.
[I 2023-12-21 04:04:45,825] Trial 426 pruned. Trial was pruned at iteration 0.
[I 2023-12-21 04:04:45,876] Trial 427 pruned. Trial was pruned at iteration 0.
[I 2023-12-21 04:04:45,928] Trial 428 pruned. Trial was pruned at iteration 0.
[I 2023-12-21 04:04:45,980] Trial 429 pruned. Trial was pruned at iteration 0.
[I 2023-12-21 04:04:46,033] Trial 430 pruned. Trial was pruned at iteration 0.
[I 2023-12-21 04:04:46,084] Trial 431 pruned. Trial was pruned at iteration 0.
[I 2023-12-21 04:04:46,138] Trial 432 pruned. Trial was pruned at iteration 0.
[I 2023-12-21 04:04:46,190] Trial 433 pruned. Trial was pruned at iteration 0.
[I 2023-12-21 04:04:46,311] Trial 434 finished with value: inf and parameters: {'learning_rate': 0.9588877541268703, 'aft_loss_distributi                                                                     on': 'normal', 'aft_loss_distribution_scale': 1.065222129879809, 'max_depth': 3, 'booster': 'gbtree', 'scale_pos_weight': 2.2638708865413                                                                     71, 'alpha': 9.198725726494342, 'lambda': 0.9726687055204397, 'eta': 0.1731912662664086, 'sampling_method': 'uniform', 'subsample': 0.685                                                                     2036424598862, 'gamma': 4.145496618698908}. Best is trial 61 with value: 4.247532035211623.
[I 2023-12-21 04:04:46,365] Trial 435 pruned. Trial was pruned at iteration 0.
[I 2023-12-21 04:04:46,418] Trial 436 pruned. Trial was pruned at iteration 0.
[I 2023-12-21 04:04:46,469] Trial 437 pruned. Trial was pruned at iteration 0.
[I 2023-12-21 04:04:46,521] Trial 438 pruned. Trial was pruned at iteration 0.
[I 2023-12-21 04:04:46,575] Trial 439 pruned. Trial was pruned at iteration 0.
[I 2023-12-21 04:04:46,627] Trial 440 pruned. Trial was pruned at iteration 0.
[I 2023-12-21 04:04:46,678] Trial 441 pruned. Trial was pruned at iteration 0.
[I 2023-12-21 04:04:46,730] Trial 442 pruned. Trial was pruned at iteration 0.
[I 2023-12-21 04:04:46,782] Trial 443 pruned. Trial was pruned at iteration 0.
[I 2023-12-21 04:04:46,834] Trial 444 pruned. Trial was pruned at iteration 0.
[I 2023-12-21 04:04:46,887] Trial 445 pruned. Trial was pruned at iteration 0.
[I 2023-12-21 04:04:47,010] Trial 446 finished with value: inf and parameters: {'learning_rate': 0.9680329305071388, 'aft_loss_distributi                                                                     on': 'normal', 'aft_loss_distribution_scale': 1.0457140111255083, 'max_depth': 3, 'booster': 'gbtree', 'scale_pos_weight': 2.738100030770                                                                     683, 'alpha': 8.985837252565174, 'lambda': 4.937680825651564, 'eta': 0.4655575738141824, 'sampling_method': 'gradient_based', 'subsample'                                                                     : 0.9261139381156508, 'gamma': 8.93970935646737}. Best is trial 61 with value: 4.247532035211623.
[I 2023-12-21 04:04:47,062] Trial 447 pruned. Trial was pruned at iteration 0.
[I 2023-12-21 04:04:47,115] Trial 448 pruned. Trial was pruned at iteration 0.
[I 2023-12-21 04:04:47,168] Trial 449 pruned. Trial was pruned at iteration 0.
[I 2023-12-21 04:04:47,220] Trial 450 pruned. Trial was pruned at iteration 0.
[I 2023-12-21 04:04:47,272] Trial 451 pruned. Trial was pruned at iteration 0.
[I 2023-12-21 04:04:47,327] Trial 452 pruned. Trial was pruned at iteration 0.
[I 2023-12-21 04:04:47,379] Trial 453 pruned. Trial was pruned at iteration 0.
[I 2023-12-21 04:04:47,622] Trial 454 finished with value: 4.255878876155089 and parameters: {'learning_rate': 0.9773395498221973, 'aft_l                                                                     oss_distribution': 'normal', 'aft_loss_distribution_scale': 1.1075235567983386, 'max_depth': 3, 'booster': 'gbtree', 'scale_pos_weight':                                                                      3.3928446352210697, 'alpha': 9.48398548093221, 'lambda': 5.616520191436455, 'eta': 0.3208030242706353, 'sampling_method': 'gradient_based                                                                     ', 'subsample': 0.8465154827698455, 'gamma': 8.258169551649504}. Best is trial 61 with value: 4.247532035211623.
[I 2023-12-21 04:04:47,674] Trial 455 pruned. Trial was pruned at iteration 0.
[I 2023-12-21 04:04:47,729] Trial 456 pruned. Trial was pruned at iteration 1.
[I 2023-12-21 04:04:47,850] Trial 457 finished with value: inf and parameters: {'learning_rate': 0.9697076965840279, 'aft_loss_distributi                                                                     on': 'normal', 'aft_loss_distribution_scale': 1.02196272868047, 'max_depth': 6, 'booster': 'gbtree', 'scale_pos_weight': 3.46820562127203                                                                     62, 'alpha': 9.763786604232115, 'lambda': 5.218542539712042, 'eta': 0.3755931916930537, 'sampling_method': 'gradient_based', 'subsample':                                                                      0.8748346658026559, 'gamma': 7.864015909104036}. Best is trial 61 with value: 4.247532035211623.
[I 2023-12-21 04:04:47,903] Trial 458 pruned. Trial was pruned at iteration 0.
[I 2023-12-21 04:04:47,956] Trial 459 pruned. Trial was pruned at iteration 0.
[I 2023-12-21 04:04:48,011] Trial 460 pruned. Trial was pruned at iteration 1.
[I 2023-12-21 04:04:48,130] Trial 461 finished with value: inf and parameters: {'learning_rate': 0.9497692833204308, 'aft_loss_distributi                                                                     on': 'normal', 'aft_loss_distribution_scale': 1.1134580813051014, 'max_depth': 9, 'booster': 'gbtree', 'scale_pos_weight': 3.868701837628                                                                     855, 'alpha': 9.656028519157083, 'lambda': 5.413817494973078, 'eta': 0.3432953162564942, 'sampling_method': 'gradient_based', 'subsample'                                                                     : 0.9312331020798729, 'gamma': 9.329675852890585}. Best is trial 61 with value: 4.247532035211623.
[I 2023-12-21 04:04:48,184] Trial 462 pruned. Trial was pruned at iteration 0.
[I 2023-12-21 04:04:48,238] Trial 463 pruned. Trial was pruned at iteration 1.
[I 2023-12-21 04:04:48,292] Trial 464 pruned. Trial was pruned at iteration 0.
[I 2023-12-21 04:04:48,346] Trial 465 pruned. Trial was pruned at iteration 0.
[I 2023-12-21 04:04:48,399] Trial 466 pruned. Trial was pruned at iteration 0.
[I 2023-12-21 04:04:48,455] Trial 467 pruned. Trial was pruned at iteration 1.
[I 2023-12-21 04:04:48,507] Trial 468 pruned. Trial was pruned at iteration 0.
[I 2023-12-21 04:04:48,560] Trial 469 pruned. Trial was pruned at iteration 0.
[I 2023-12-21 04:04:48,613] Trial 470 pruned. Trial was pruned at iteration 0.
[I 2023-12-21 04:04:48,679] Trial 471 pruned. Trial was pruned at iteration 1.
[I 2023-12-21 04:04:48,735] Trial 472 pruned. Trial was pruned at iteration 0.
[I 2023-12-21 04:04:48,790] Trial 473 pruned. Trial was pruned at iteration 0.
[I 2023-12-21 04:04:48,843] Trial 474 pruned. Trial was pruned at iteration 0.
[I 2023-12-21 04:04:48,896] Trial 475 pruned. Trial was pruned at iteration 0.
[I 2023-12-21 04:04:48,951] Trial 476 pruned. Trial was pruned at iteration 1.
[I 2023-12-21 04:04:49,005] Trial 477 pruned. Trial was pruned at iteration 0.
[I 2023-12-21 04:04:49,058] Trial 478 pruned. Trial was pruned at iteration 0.
