[I 2023-12-21 00:11:10,999] Trial 97 finished with value: 1.9268994544649958 and parameters: {'learning_rate': 0.9392566889285814, 'aft_loss_distribution': 'normal', 'aft_loss_distribution_scale': 1.6448707456177571, 'max_depth': 6, 'booster': 'dart', 'scale_pos_weight': 1.075665656091555, 'alpha': 5.377313562107812, 'lambda': 9.98460357331677, 'eta': 0.8705122316645868, 'sampling_method': 'uniform', 'subsample': 0.336530626232042, 'gamma': 7.986353218015429}. Best is trial 77 with value: 1.9163923221585393.
[I 2023-12-21 00:11:11,060] Trial 98 pruned. Trial was pruned at iteration 0.
[I 2023-12-21 00:11:11,114] Trial 99 pruned. Trial was pruned at iteration 0.
[I 2023-12-21 00:11:11,174] Trial 100 pruned. Trial was pruned at iteration 0.
[I 2023-12-21 00:11:11,231] Trial 101 pruned. Trial was pruned at iteration 0.
[I 2023-12-21 00:11:12,768] Trial 102 finished with value: inf and parameters: {'learning_rate': 0.9789338575121879, 'aft_loss_distribution': 'normal', 'aft_loss_distribution_scale': 1.4476664751363408, 'max_depth': 7, 'booster': 'dart', 'scale_pos_weight': 0.7487270794792834, 'alpha': 6.480121341641444, 'lambda': 9.36044315479796, 'eta': 0.8603566317883325, 'sampling_method': 'uniform', 'subsample': 0.36426930489081244, 'gamma': 7.10531466193431}. Best is trial 77 with value: 1.9163923221585393.
[I 2023-12-21 00:11:12,855] Trial 103 pruned. Trial was pruned at iteration 0.
[I 2023-12-21 00:11:21,346] Trial 104 finished with value: 1.9279447760249424 and parameters: {'learning_rate': 0.9092986973137438, 'aft_loss_distribution': 'normal', 'aft_loss_distribution_scale': 1.7393817066786097, 'max_depth': 5, 'booster': 'dart', 'scale_pos_weight': 1.3782974945968642, 'alpha': 5.8078112914044215, 'lambda': 7.8376707063942535, 'eta': 0.7772832912424356, 'sampling_method': 'uniform', 'subsample': 0.4073097962826798, 'gamma': 7.939816821249675}. Best is trial 77 with value: 1.9163923221585393.
[I 2023-12-21 00:11:21,403] Trial 105 pruned. Trial was pruned at iteration 0.
[I 2023-12-21 00:11:21,463] Trial 106 pruned. Trial was pruned at iteration 1.
[I 2023-12-21 00:11:21,519] Trial 107 pruned. Trial was pruned at iteration 0.
[I 2023-12-21 00:11:21,584] Trial 108 pruned. Trial was pruned at iteration 0.
[I 2023-12-21 00:11:21,639] Trial 109 pruned. Trial was pruned at iteration 0.
[I 2023-12-21 00:11:21,700] Trial 110 pruned. Trial was pruned at iteration 1.
[I 2023-12-21 00:11:27,844] Trial 111 finished with value: 1.939909032129075 and parameters: {'learning_rate': 0.9598502056454294, 'aft_loss_distribution': 'normal', 'aft_loss_distribution_scale': 1.8139057238480003, 'max_depth': 5, 'booster': 'dart', 'scale_pos_weight': 1.5300135263420014, 'alpha': 5.4660444385726485, 'lambda': 7.415564712057013, 'eta': 0.7582304025152313, 'sampling_method': 'uniform', 'subsample': 0.2782603171743048, 'gamma': 6.721424430386117}. Best is trial 77 with value: 1.9163923221585393.
[I 2023-12-21 00:11:30,995] Trial 112 finished with value: inf and parameters: {'learning_rate': 0.9530350127153389, 'aft_loss_distribution': 'normal', 'aft_loss_distribution_scale': 1.8050406360094897, 'max_depth': 5, 'booster': 'dart', 'scale_pos_weight': 1.7974746496207579, 'alpha': 5.817522237920006, 'lambda': 7.506839761548538, 'eta': 0.8226933188179162, 'sampling_method': 'uniform', 'subsample': 0.2880509726251224, 'gamma': 7.222307523571017}. Best is trial 77 with value: 1.9163923221585393.
[I 2023-12-21 00:11:32,587] Trial 113 finished with value: inf and parameters: {'learning_rate': 0.9309002929117721, 'aft_loss_distribution': 'normal', 'aft_loss_distribution_scale': 1.4615539501671615, 'max_depth': 5, 'booster': 'dart', 'scale_pos_weight': 1.6573724574008684, 'alpha': 5.377053748411965, 'lambda': 7.832751596607035, 'eta': 0.7672102102752498, 'sampling_method': 'uniform', 'subsample': 0.30091404445819797, 'gamma': 6.681173526788866}. Best is trial 77 with value: 1.9163923221585393.
[I 2023-12-21 00:11:32,647] Trial 114 pruned. Trial was pruned at iteration 0.
[I 2023-12-21 00:11:32,706] Trial 115 pruned. Trial was pruned at iteration 1.
[I 2023-12-21 00:11:34,152] Trial 116 finished with value: inf and parameters: {'learning_rate': 0.9570994131947886, 'aft_loss_distribution': 'normal', 'aft_loss_distribution_scale': 1.8791824454742514, 'max_depth': 5, 'booster': 'dart', 'scale_pos_weight': 0.46012998513308845, 'alpha': 4.988475208806392, 'lambda': 7.366862464455863, 'eta': 0.7490250370326561, 'sampling_method': 'uniform', 'subsample': 0.40372613034749344, 'gamma': 6.105417679449955}. Best is trial 77 with value: 1.9163923221585393.
[I 2023-12-21 00:11:34,218] Trial 117 pruned. Trial was pruned at iteration 0.
[I 2023-12-21 00:11:34,280] Trial 118 pruned. Trial was pruned at iteration 1.
[I 2023-12-21 00:11:34,339] Trial 119 pruned. Trial was pruned at iteration 0.
[I 2023-12-21 00:11:34,400] Trial 120 pruned. Trial was pruned at iteration 0.
[I 2023-12-21 00:11:37,200] Trial 121 finished with value: 1.9446855243795858 and parameters: {'learning_rate': 0.9644624968742266, 'aft_loss_distribution': 'normal', 'aft_loss_distribution_scale': 1.8824000972839823, 'max_depth': 4, 'booster': 'dart', 'scale_pos_weight': 2.4436232842828383, 'alpha': 6.284701943974239, 'lambda': 7.9641722880358286, 'eta': 0.6988588589885816, 'sampling_method': 'uniform', 'subsample': 0.3637824960334247, 'gamma': 7.384531421244234}. Best is trial 77 with value: 1.9163923221585393.
[I 2023-12-21 00:11:40,149] Trial 122 finished with value: 1.9426152438355109 and parameters: {'learning_rate': 0.9620107634998384, 'aft_loss_distribution': 'normal', 'aft_loss_distribution_scale': 1.848550838059037, 'max_depth': 4, 'booster': 'dart', 'scale_pos_weight': 2.4243851823738267, 'alpha': 6.288986149181538, 'lambda': 7.964774369518501, 'eta': 0.783460819586482, 'sampling_method': 'uniform', 'subsample': 0.3622402071169955, 'gamma': 7.223295728870039}. Best is trial 77 with value: 1.9163923221585393.
[I 2023-12-21 00:11:40,217] Trial 123 pruned. Trial was pruned at iteration 0.
[I 2023-12-21 00:11:41,693] Trial 124 finished with value: inf and parameters: {'learning_rate': 0.9657544873196447, 'aft_loss_distribution': 'normal', 'aft_loss_distribution_scale': 1.6972968825887131, 'max_depth': 4, 'booster': 'dart', 'scale_pos_weight': 2.0677383450281446, 'alpha': 6.375276170563242, 'lambda': 7.955102296179073, 'eta': 0.7874659952938315, 'sampling_method': 'uniform', 'subsample': 0.3772096860209223, 'gamma': 6.764637531438514}. Best is trial 77 with value: 1.9163923221585393.
[I 2023-12-21 00:11:41,801] Trial 125 pruned. Trial was pruned at iteration 0.
[I 2023-12-21 00:11:41,892] Trial 126 pruned. Trial was pruned at iteration 1.
[I 2023-12-21 00:11:41,985] Trial 127 pruned. Trial was pruned at iteration 0.
[I 2023-12-21 00:11:42,075] Trial 128 pruned. Trial was pruned at iteration 0.
[I 2023-12-21 00:11:42,169] Trial 129 pruned. Trial was pruned at iteration 0.
[I 2023-12-21 00:11:42,269] Trial 130 pruned. Trial was pruned at iteration 0.
[I 2023-12-21 00:11:44,150] Trial 131 finished with value: inf and parameters: {'learning_rate': 0.9600766904820441, 'aft_loss_distribution': 'normal', 'aft_loss_distribution_scale': 1.5790663400587164, 'max_depth': 5, 'booster': 'dart', 'scale_pos_weight': 2.4096839099125957, 'alpha': 7.156528469839863, 'lambda': 7.327505478740565, 'eta': 0.7565634681573712, 'sampling_method': 'uniform', 'subsample': 0.3909085404049811, 'gamma': 7.622341182199917}. Best is trial 77 with value: 1.9163923221585393.
[I 2023-12-21 00:11:46,143] Trial 132 finished with value: inf and parameters: {'learning_rate': 0.9345096388996997, 'aft_loss_distribution': 'normal', 'aft_loss_distribution_scale': 1.8487321608024019, 'max_depth': 5, 'booster': 'dart', 'scale_pos_weight': 2.4828828478701808, 'alpha': 5.573511832204541, 'lambda': 7.759877188683832, 'eta': 0.7398444077135863, 'sampling_method': 'uniform', 'subsample': 0.4531968121311844, 'gamma': 1.0713837186393942}. Best is trial 77 with value: 1.9163923221585393.
[I 2023-12-21 00:11:46,205] Trial 133 pruned. Trial was pruned at iteration 0.
[I 2023-12-21 00:11:46,275] Trial 134 pruned. Trial was pruned at iteration 2.
[I 2023-12-21 00:11:47,923] Trial 135 finished with value: inf and parameters: {'learning_rate': 0.9206552110322356, 'aft_loss_distribution': 'normal', 'aft_loss_distribution_scale': 1.7110463181427327, 'max_depth': 5, 'booster': 'dart', 'scale_pos_weight': 1.0755126203512348, 'alpha': 6.157075274877101, 'lambda': 8.568726004675723, 'eta': 0.7817644341766035, 'sampling_method': 'uniform', 'subsample': 0.4271922302727497, 'gamma': 7.848074065168541}. Best is trial 77 with value: 1.9163923221585393.
[I 2023-12-21 00:11:47,998] Trial 136 pruned. Trial was pruned at iteration 0.
[I 2023-12-21 00:11:48,056] Trial 137 pruned. Trial was pruned at iteration 0.
[I 2023-12-21 00:11:48,118] Trial 138 pruned. Trial was pruned at iteration 1.
[I 2023-12-21 00:11:48,183] Trial 139 pruned. Trial was pruned at iteration 0.
[I 2023-12-21 00:11:48,248] Trial 140 pruned. Trial was pruned at iteration 0.
[I 2023-12-21 00:11:48,316] Trial 141 pruned. Trial was pruned at iteration 1.
[I 2023-12-21 00:11:54,326] Trial 142 finished with value: 1.934917645486313 and parameters: {'learning_rate': 0.9602874088246656, 'aft_loss_distribution': 'normal', 'aft_loss_distribution_scale': 1.787728415442609, 'max_depth': 4, 'booster': 'dart', 'scale_pos_weight': 2.874517814301443, 'alpha': 9.626779555629767, 'lambda': 8.831572845568923, 'eta': 0.7104184899414147, 'sampling_method': 'uniform', 'subsample': 0.40886555849073136, 'gamma': 6.20351895071318}. Best is trial 77 with value: 1.9163923221585393.
[I 2023-12-21 00:11:56,431] Trial 143 finished with value: inf and parameters: {'learning_rate': 0.93599564402485, 'aft_loss_distribution': 'normal', 'aft_loss_distribution_scale': 1.5896011067400644, 'max_depth': 4, 'booster': 'dart', 'scale_pos_weight': 2.7637836922019874, 'alpha': 9.181355141731293, 'lambda': 8.843575273670554, 'eta': 0.7178910886764645, 'sampling_method': 'uniform', 'subsample': 0.4078689385088912, 'gamma': 6.156983910036476}. Best is trial 77 with value: 1.9163923221585393.
[I 2023-12-21 00:12:00,274] Trial 144 finished with value: 1.9392123754338628 and parameters: {'learning_rate': 0.9187132084947095, 'aft_loss_distribution': 'normal', 'aft_loss_distribution_scale': 1.8333421694562229, 'max_depth': 5, 'booster': 'dart', 'scale_pos_weight': 2.6710806261409012, 'alpha': 5.609548773527155, 'lambda': 7.6778405763088236, 'eta': 0.9980351560225521, 'sampling_method': 'uniform', 'subsample': 0.4687468179343563, 'gamma': 7.247136176570713}. Best is trial 77 with value: 1.9163923221585393.
[I 2023-12-21 00:12:00,339] Trial 145 pruned. Trial was pruned at iteration 0.
[I 2023-12-21 00:12:00,408] Trial 146 pruned. Trial was pruned at iteration 0.
[I 2023-12-21 00:12:00,471] Trial 147 pruned. Trial was pruned at iteration 0.
[I 2023-12-21 00:12:00,536] Trial 148 pruned. Trial was pruned at iteration 1.
[I 2023-12-21 00:12:00,601] Trial 149 pruned. Trial was pruned at iteration 0.
[I 2023-12-21 00:12:00,664] Trial 150 pruned. Trial was pruned at iteration 0.
[I 2023-12-21 00:12:00,724] Trial 151 pruned. Trial was pruned at iteration 0.
[I 2023-12-21 00:12:00,789] Trial 152 pruned. Trial was pruned at iteration 1.
[I 2023-12-21 00:12:00,867] Trial 153 pruned. Trial was pruned at iteration 1.
[I 2023-12-21 00:12:00,927] Trial 154 pruned. Trial was pruned at iteration 0.
[I 2023-12-21 00:12:00,984] Trial 155 pruned. Trial was pruned at iteration 0.
[I 2023-12-21 00:12:01,046] Trial 156 pruned. Trial was pruned at iteration 0.
[I 2023-12-21 00:12:01,107] Trial 157 pruned. Trial was pruned at iteration 0.
[I 2023-12-21 00:12:01,171] Trial 158 pruned. Trial was pruned at iteration 0.
[I 2023-12-21 00:12:01,236] Trial 159 pruned. Trial was pruned at iteration 0.
[I 2023-12-21 00:12:01,309] Trial 160 pruned. Trial was pruned at iteration 1.
[I 2023-12-21 00:12:01,380] Trial 161 pruned. Trial was pruned at iteration 2.
[I 2023-12-21 00:12:01,454] Trial 162 pruned. Trial was pruned at iteration 0.
[I 2023-12-21 00:12:01,513] Trial 163 pruned. Trial was pruned at iteration 0.
[I 2023-12-21 00:12:03,708] Trial 164 finished with value: inf and parameters: {'learning_rate': 0.9711775034005024, 'aft_loss_distribution': 'normal', 'aft_loss_distribution_scale': 1.5940715997513855, 'max_depth': 5, 'booster': 'dart', 'scale_pos_weight': 2.9095960178795304, 'alpha': 9.31238689863288, 'lambda': 8.325321998138044, 'eta': 0.7990578454146016, 'sampling_method': 'uniform', 'subsample': 0.8541346678215178, 'gamma': 6.372527111385851}. Best is trial 77 with value: 1.9163923221585393.
[I 2023-12-21 00:12:03,773] Trial 165 pruned. Trial was pruned at iteration 0.
[I 2023-12-21 00:12:03,832] Trial 166 pruned. Trial was pruned at iteration 0.
[I 2023-12-21 00:12:03,903] Trial 167 pruned. Trial was pruned at iteration 1.
[I 2023-12-21 00:12:05,413] Trial 168 finished with value: inf and parameters: {'learning_rate': 0.9340123428435286, 'aft_loss_distribution': 'normal', 'aft_loss_distribution_scale': 1.764917139686216, 'max_depth': 5, 'booster': 'dart', 'scale_pos_weight': 1.4173488494526016, 'alpha': 5.032782726463477, 'lambda': 7.834850240505974, 'eta': 0.9820694276413927, 'sampling_method': 'gradient_based', 'subsample': 0.41579626313570084, 'gamma': 8.481773968665639}. Best is trial 77 with value: 1.9163923221585393.
[I 2023-12-21 00:12:06,878] Trial 169 finished with value: inf and parameters: {'learning_rate': 0.9989775337166411, 'aft_loss_distribution': 'normal', 'aft_loss_distribution_scale': 1.4824659584629356, 'max_depth': 4, 'booster': 'dart', 'scale_pos_weight': 3.1136799315978045, 'alpha': 8.85290999236002, 'lambda': 6.867917334186043, 'eta': 0.9603513898645898, 'sampling_method': 'uniform', 'subsample': 0.39352659334533496, 'gamma': 5.726019614521084}. Best is trial 77 with value: 1.9163923221585393.
[I 2023-12-21 00:12:06,947] Trial 170 pruned. Trial was pruned at iteration 1.
[I 2023-12-21 00:12:07,010] Trial 171 pruned. Trial was pruned at iteration 1.
[I 2023-12-21 00:12:07,080] Trial 172 pruned. Trial was pruned at iteration 2.
[I 2023-12-21 00:12:07,140] Trial 173 pruned. Trial was pruned at iteration 0.
[I 2023-12-21 00:12:13,051] Trial 174 finished with value: 1.9198120593080021 and parameters: {'learning_rate': 0.9476232167711625, 'aft_loss_distribution': 'normal', 'aft_loss_distribution_scale': 1.592720882816594, 'max_depth': 5, 'booster': 'dart', 'scale_pos_weight': 3.183081895098833, 'alpha': 9.039265827582387, 'lambda': 8.475630186468782, 'eta': 0.5362361333420727, 'sampling_method': 'uniform', 'subsample': 0.3020387522476582, 'gamma': 6.556447268926825}. Best is trial 77 with value: 1.9163923221585393.
[I 2023-12-21 00:12:13,158] Trial 175 pruned. Trial was pruned at iteration 0.
[I 2023-12-21 00:12:13,275] Trial 176 pruned. Trial was pruned at iteration 0.
[I 2023-12-21 00:12:13,373] Trial 177 pruned. Trial was pruned at iteration 0.
[I 2023-12-21 00:12:13,474] Trial 178 pruned. Trial was pruned at iteration 1.
[I 2023-12-21 00:12:17,135] Trial 179 finished with value: 1.9250084235750076 and parameters: {'learning_rate': 0.9873790395277856, 'aft_loss_distribution': 'normal', 'aft_loss_distribution_scale': 1.6663812660971062, 'max_depth': 5, 'booster': 'dart', 'scale_pos_weight': 2.4562162344994505, 'alpha': 5.351392718965654, 'lambda': 9.061438729052966, 'eta': 0.9999863024322361, 'sampling_method': 'uniform', 'subsample': 0.43600340707946283, 'gamma': 8.286452392637345}. Best is trial 77 with value: 1.9163923221585393.
[I 2023-12-21 00:12:19,167] Trial 180 finished with value: inf and parameters: {'learning_rate': 0.984003235855938, 'aft_loss_distribution': 'normal', 'aft_loss_distribution_scale': 1.615582828040072, 'max_depth': 5, 'booster': 'dart', 'scale_pos_weight': 2.3041744672481053, 'alpha': 5.331003536361001, 'lambda': 9.156572536577594, 'eta': 0.9992389834131169, 'sampling_method': 'uniform', 'subsample': 0.4363583411857698, 'gamma': 8.329817221174032}. Best is trial 77 with value: 1.9163923221585393.
[I 2023-12-21 00:12:19,236] Trial 181 pruned. Trial was pruned at iteration 0.
[I 2023-12-21 00:12:25,675] Trial 182 finished with value: 1.9289932617025023 and parameters: {'learning_rate': 0.9474035179507505, 'aft_loss_distribution': 'normal', 'aft_loss_distribution_scale': 1.7588512520566058, 'max_depth': 5, 'booster': 'dart', 'scale_pos_weight': 2.374735703349547, 'alpha': 5.211072846223798, 'lambda': 8.747222579988058, 'eta': 0.8817303471936268, 'sampling_method': 'uniform', 'subsample': 0.4116250690729842, 'gamma': 7.799876246222895}. Best is trial 77 with value: 1.9163923221585393.
[I 2023-12-21 00:12:31,573] Trial 183 finished with value: 1.9306530933320176 and parameters: {'learning_rate': 0.9186912050786884, 'aft_loss_distribution': 'normal', 'aft_loss_distribution_scale': 1.7393414854599796, 'max_depth': 5, 'booster': 'dart', 'scale_pos_weight': 2.3818872072982398, 'alpha': 5.387005796679806, 'lambda': 8.857455913426712, 'eta': 0.8765226123035615, 'sampling_method': 'uniform', 'subsample': 0.4143946216379911, 'gamma': 7.669608845982214}. Best is trial 77 with value: 1.9163923221585393.
[I 2023-12-21 00:12:38,144] Trial 184 finished with value: 1.9264130355818194 and parameters: {'learning_rate': 0.9154526288660472, 'aft_loss_distribution': 'normal', 'aft_loss_distribution_scale': 1.717623885435184, 'max_depth': 5, 'booster': 'dart', 'scale_pos_weight': 2.207190063183129, 'alpha': 5.356401242967039, 'lambda': 8.908747982420284, 'eta': 0.8816772759330852, 'sampling_method': 'uniform', 'subsample': 0.4049026404737111, 'gamma': 7.641916839147134}. Best is trial 77 with value: 1.9163923221585393.
[I 2023-12-21 00:12:42,629] Trial 185 finished with value: 1.926310114757471 and parameters: {'learning_rate': 0.9192533850338287, 'aft_loss_distribution': 'normal', 'aft_loss_distribution_scale': 1.6722427480441204, 'max_depth': 5, 'booster': 'dart', 'scale_pos_weight': 2.244073366341136, 'alpha': 4.929123487507844, 'lambda': 8.851586888421581, 'eta': 0.8871452473592397, 'sampling_method': 'uniform', 'subsample': 0.441628293019508, 'gamma': 7.773300397642573}. Best is trial 77 with value: 1.9163923221585393.
[I 2023-12-21 00:12:42,742] Trial 186 pruned. Trial was pruned at iteration 0.
[I 2023-12-21 00:12:42,844] Trial 187 pruned. Trial was pruned at iteration 0.
[I 2023-12-21 00:12:42,947] Trial 188 pruned. Trial was pruned at iteration 0.
[I 2023-12-21 00:12:48,626] Trial 189 finished with value: 1.9251010892783802 and parameters: {'learning_rate': 0.9375995956155889, 'aft_loss_distribution': 'normal', 'aft_loss_distribution_scale': 1.6703517734179578, 'max_depth': 5, 'booster': 'dart', 'scale_pos_weight': 2.2455709225841014, 'alpha': 4.273027311796371, 'lambda': 8.887134394271104, 'eta': 0.9101950934747667, 'sampling_method': 'uniform', 'subsample': 0.46661710651011074, 'gamma': 8.102231557836568}. Best is trial 77 with value: 1.9163923221585393.
[I 2023-12-21 00:12:48,696] Trial 190 pruned. Trial was pruned at iteration 0.
[I 2023-12-21 00:12:54,221] Trial 191 finished with value: 1.9231773293039025 and parameters: {'learning_rate': 0.9342775539967868, 'aft_loss_distribution': 'normal', 'aft_loss_distribution_scale': 1.6931679218556752, 'max_depth': 5, 'booster': 'dart', 'scale_pos_weight': 2.2637509572684795, 'alpha': 4.197273499770497, 'lambda': 8.89099522977098, 'eta': 0.8800666111767321, 'sampling_method': 'uniform', 'subsample': 0.44861230389427403, 'gamma': 8.061186945264991}. Best is trial 77 with value: 1.9163923221585393.
[I 2023-12-21 00:12:58,582] Trial 192 finished with value: 1.9260880296867087 and parameters: {'learning_rate': 0.9404993842532177, 'aft_loss_distribution': 'normal', 'aft_loss_distribution_scale': 1.6524887745695305, 'max_depth': 5, 'booster': 'dart', 'scale_pos_weight': 2.2861777286251805, 'alpha': 4.330540996316584, 'lambda': 9.004993542237763, 'eta': 0.8861370690542609, 'sampling_method': 'uniform', 'subsample': 0.45306109497088437, 'gamma': 8.373006755209175}. Best is trial 77 with value: 1.9163923221585393.
[I 2023-12-21 00:13:03,849] Trial 193 finished with value: 1.9212649362841232 and parameters: {'learning_rate': 0.9367831512459915, 'aft_loss_distribution': 'normal', 'aft_loss_distribution_scale': 1.6275741971440953, 'max_depth': 5, 'booster': 'dart', 'scale_pos_weight': 2.2789048727220793, 'alpha': 4.282831167396704, 'lambda': 9.03382452889041, 'eta': 0.8846809286784194, 'sampling_method': 'uniform', 'subsample': 0.44980061651554243, 'gamma': 8.376638677339754}. Best is trial 77 with value: 1.9163923221585393.
[I 2023-12-21 00:13:06,631] Trial 194 finished with value: 1.924024633592248 and parameters: {'learning_rate': 0.9395705633931564, 'aft_loss_distribution': 'normal', 'aft_loss_distribution_scale': 1.5165775796329368, 'max_depth': 5, 'booster': 'dart', 'scale_pos_weight': 2.2133857937279178, 'alpha': 4.259777336555919, 'lambda': 9.111119472851986, 'eta': 0.883231292622298, 'sampling_method': 'uniform', 'subsample': 0.4467385715279799, 'gamma': 8.433814999555995}. Best is trial 77 with value: 1.9163923221585393.
[I 2023-12-21 00:13:09,459] Trial 195 finished with value: inf and parameters: {'learning_rate': 0.9419432858126295, 'aft_loss_distribution': 'normal', 'aft_loss_distribution_scale': 1.5594894390799254, 'max_depth': 5, 'booster': 'dart', 'scale_pos_weight': 2.217231255379183, 'alpha': 4.263493527618014, 'lambda': 9.062801075268261, 'eta': 0.8648537806524212, 'sampling_method': 'uniform', 'subsample': 0.4438449605540054, 'gamma': 8.380946102347217}. Best is trial 77 with value: 1.9163923221585393.
[I 2023-12-21 00:13:09,577] Trial 196 pruned. Trial was pruned at iteration 0.
[I 2023-12-21 00:13:09,669] Trial 197 pruned. Trial was pruned at iteration 0.
[I 2023-12-21 00:13:09,763] Trial 198 pruned. Trial was pruned at iteration 0.
[I 2023-12-21 00:13:09,859] Trial 199 pruned. Trial was pruned at iteration 0.
