[I 2023-12-21 02:55:58,167] Trial 1 finished with value: 5.8517380569643755 and parameters: {'learning_rate': 0.27929313356237034, 'aft_l                                                                     oss_distribution': 'extreme', 'aft_loss_distribution_scale': 8.277243471795703, 'max_depth': 5, 'booster': 'dart', 'scale_pos_weight': 1.                                                                     7021135528450695, 'alpha': 1.6061438154004408, 'lambda': 6.981254366502421, 'eta': 0.9944704996980138, 'sampling_method': 'gradient_based                                                                     ', 'subsample': 0.9333642315235824, 'gamma': 2.56628927932252}. Best is trial 0 with value: 4.943250707728738.
[I 2023-12-21 02:58:31,061] Trial 2 finished with value: 5.501549222677611 and parameters: {'learning_rate': 0.06993260134766147, 'aft_lo                                                                     ss_distribution': 'logistic', 'aft_loss_distribution_scale': 3.9139119666716087, 'max_depth': 10, 'booster': 'dart', 'scale_pos_weight':                                                                      5.166204790852039, 'alpha': 6.446042872151854, 'lambda': 9.780362601032468, 'eta': 0.7521718218483281, 'sampling_method': 'gradient_based                                                                     ', 'subsample': 0.8746768643289651, 'gamma': 7.815576407254534}. Best is trial 0 with value: 4.943250707728738.
[I 2023-12-21 02:58:31,572] Trial 3 finished with value: 5.840378045001153 and parameters: {'learning_rate': 0.15676630065027525, 'aft_lo                                                                     ss_distribution': 'logistic', 'aft_loss_distribution_scale': 5.6350147405118545, 'max_depth': 8, 'booster': 'gbtree', 'scale_pos_weight':                                                                      1.2415139066466425, 'alpha': 6.617693898276622, 'lambda': 6.608284136097676, 'eta': 0.5346162252579132, 'sampling_method': 'uniform', 's                                                                     ubsample': 0.20101126146759785, 'gamma': 9.597598862684526}. Best is trial 0 with value: 4.943250707728738.
[I 2023-12-21 02:58:32,836] Trial 4 finished with value: 6.028211961892798 and parameters: {'learning_rate': 0.03341059473176386, 'aft_lo                                                                     ss_distribution': 'logistic', 'aft_loss_distribution_scale': 6.887244685024322, 'max_depth': 4, 'booster': 'gbtree', 'scale_pos_weight':                                                                      2.213584537382146, 'alpha': 6.710041053376406, 'lambda': 4.837947989952328, 'eta': 0.11756357633997483, 'sampling_method': 'gradient_base                                                                     d', 'subsample': 0.20120405100216818, 'gamma': 3.010780402913117}. Best is trial 0 with value: 4.943250707728738.
[I 2023-12-21 02:58:35,964] Trial 5 finished with value: 5.609491737814202 and parameters: {'learning_rate': 0.010069809042361808, 'aft_l                                                                     oss_distribution': 'extreme', 'aft_loss_distribution_scale': 6.379513988052096, 'max_depth': 7, 'booster': 'gbtree', 'scale_pos_weight':                                                                      9.313379938129383, 'alpha': 8.046627874882205, 'lambda': 8.362191784704164, 'eta': 0.34135528043879226, 'sampling_method': 'uniform', 'su                                                                     bsample': 0.9684627786157854, 'gamma': 5.478997156133668}. Best is trial 0 with value: 4.943250707728738.
[I 2023-12-21 02:58:35,970] Trial 6 pruned. Trial was pruned at iteration 0.
[I 2023-12-21 02:58:40,328] Trial 7 finished with value: 5.336023203542013 and parameters: {'learning_rate': 0.3493131232148822, 'aft_los                                                                     s_distribution': 'normal', 'aft_loss_distribution_scale': 5.236730766544588, 'max_depth': 3, 'booster': 'dart', 'scale_pos_weight': 0.633                                                                     3211306298385, 'alpha': 2.1800849255831523, 'lambda': 1.4023446105418507, 'eta': 0.2578859033494516, 'sampling_method': 'gradient_based',                                                                      'subsample': 0.24661472183146194, 'gamma': 9.688369737454398}. Best is trial 0 with value: 4.943250707728738.
[I 2023-12-21 02:58:40,529] Trial 8 finished with value: 5.175143701310608 and parameters: {'learning_rate': 0.41471736462258335, 'aft_lo                                                                     ss_distribution': 'extreme', 'aft_loss_distribution_scale': 3.9657299718538397, 'max_depth': 6, 'booster': 'gbtree', 'scale_pos_weight':                                                                      4.99901245959727, 'alpha': 6.038920592231119, 'lambda': 2.2274767299274925, 'eta': 0.008199045657583448, 'sampling_method': 'uniform', 's                                                                     ubsample': 0.46546226846114563, 'gamma': 0.6879969112071312}. Best is trial 0 with value: 4.943250707728738.
[I 2023-12-21 02:58:40,536] Trial 9 pruned. Trial was pruned at iteration 1.
[I 2023-12-21 02:58:40,566] Trial 10 pruned. Trial was pruned at iteration 0.
[I 2023-12-21 02:58:40,594] Trial 11 pruned. Trial was pruned at iteration 0.
[I 2023-12-21 02:58:40,623] Trial 12 pruned. Trial was pruned at iteration 0.
[I 2023-12-21 02:58:40,741] Trial 13 finished with value: inf and parameters: {'learning_rate': 0.9840665753842931, 'aft_loss_distributio                                                                     n': 'extreme', 'aft_loss_distribution_scale': 3.3464832034259144, 'max_depth': 7, 'booster': 'gbtree', 'scale_pos_weight': 3.735675279087                                                                     4728, 'alpha': 9.820270024479878, 'lambda': 3.0826366045537164, 'eta': 0.3668294186397212, 'sampling_method': 'uniform', 'subsample': 0.6                                                                     288073212655637, 'gamma': 0.24543787337547757}. Best is trial 0 with value: 4.943250707728738.
[I 2023-12-21 02:58:40,770] Trial 14 pruned. Trial was pruned at iteration 0.
[I 2023-12-21 02:58:40,918] Trial 15 finished with value: 5.218237849238353 and parameters: {'learning_rate': 0.6982269387259964, 'aft_lo                                                                     ss_distribution': 'extreme', 'aft_loss_distribution_scale': 4.146072805178116, 'max_depth': 5, 'booster': 'gbtree', 'scale_pos_weight': 8                                                                     .305474096998276, 'alpha': 5.441710790713828, 'lambda': 9.844603144974602, 'eta': 0.8471400935963369, 'sampling_method': 'uniform', 'subs                                                                     ample': 0.668321425893479, 'gamma': 6.483121644352749}. Best is trial 0 with value: 4.943250707728738.
[I 2023-12-21 02:58:42,372] Trial 16 finished with value: inf and parameters: {'learning_rate': 0.4592335845585617, 'aft_loss_distributio                                                                     n': 'normal', 'aft_loss_distribution_scale': 1.6329446773715437, 'max_depth': 5, 'booster': 'dart', 'scale_pos_weight': 5.541432415190801                                                                     , 'alpha': 5.006371629607922, 'lambda': 5.348394063170199, 'eta': 0.18115871000950504, 'sampling_method': 'uniform', 'subsample': 0.01534                                                                     803593955053, 'gamma': 1.4433223183434927}. Best is trial 0 with value: 4.943250707728738.
[I 2023-12-21 02:58:42,402] Trial 17 pruned. Trial was pruned at iteration 0.
[I 2023-12-21 02:58:42,511] Trial 18 finished with value: inf and parameters: {'learning_rate': 0.9381649818375033, 'aft_loss_distributio                                                                     n': 'extreme', 'aft_loss_distribution_scale': 4.269446454151632, 'max_depth': 7, 'booster': 'gbtree', 'scale_pos_weight': 6.3688980276894                                                                     46, 'alpha': 3.1098114858639505, 'lambda': 4.329173320239224, 'eta': 0.02412950696273637, 'sampling_method': 'uniform', 'subsample': 0.76                                                                     50780625597169, 'gamma': 8.500887819734643}. Best is trial 0 with value: 4.943250707728738.
[I 2023-12-21 02:58:42,540] Trial 19 pruned. Trial was pruned at iteration 0.
[I 2023-12-21 02:58:42,569] Trial 20 pruned. Trial was pruned at iteration 0.
[I 2023-12-21 02:58:42,718] Trial 21 finished with value: 5.261609145030234 and parameters: {'learning_rate': 0.759670960726808, 'aft_los                                                                     s_distribution': 'extreme', 'aft_loss_distribution_scale': 4.354317095853095, 'max_depth': 5, 'booster': 'gbtree', 'scale_pos_weight': 8.                                                                     760363717600729, 'alpha': 5.53359140398682, 'lambda': 9.99627854472492, 'eta': 0.8423741314254418, 'sampling_method': 'uniform', 'subsamp                                                                     le': 0.7138726901466161, 'gamma': 6.4189991204976735}. Best is trial 0 with value: 4.943250707728738.
[I 2023-12-21 02:58:42,977] Trial 22 finished with value: 4.935378999178155 and parameters: {'learning_rate': 0.8211254843034306, 'aft_lo                                                                     ss_distribution': 'extreme', 'aft_loss_distribution_scale': 2.9855728116452567, 'max_depth': 4, 'booster': 'gbtree', 'scale_pos_weight':                                                                      7.856867181267113, 'alpha': 4.425722505535038, 'lambda': 9.17888587564471, 'eta': 0.6199126839871448, 'sampling_method': 'uniform', 'subs                                                                     ample': 0.5734958846965028, 'gamma': 7.706081462010598}. Best is trial 22 with value: 4.935378999178155.
[I 2023-12-21 02:58:43,141] Trial 23 finished with value: 4.946307904763632 and parameters: {'learning_rate': 0.7991150561816758, 'aft_lo                                                                     ss_distribution': 'extreme', 'aft_loss_distribution_scale': 3.0224125764893985, 'max_depth': 3, 'booster': 'gbtree', 'scale_pos_weight':                                                                      7.80543736167622, 'alpha': 4.124710781190675, 'lambda': 7.766401565342956, 'eta': 0.6040989595161906, 'sampling_method': 'uniform', 'subs                                                                     ample': 0.5276112253575574, 'gamma': 8.746566930846253}. Best is trial 22 with value: 4.935378999178155.
[I 2023-12-21 02:58:43,236] Trial 24 finished with value: inf and parameters: {'learning_rate': 0.8523512461152711, 'aft_loss_distributio                                                                     n': 'extreme', 'aft_loss_distribution_scale': 2.9282112444428994, 'max_depth': 3, 'booster': 'gbtree', 'scale_pos_weight': 7.697568019829                                                                     836, 'alpha': 3.7487696674910005, 'lambda': 8.812861924538929, 'eta': 0.6060720162380101, 'sampling_method': 'uniform', 'subsample': 0.56                                                                     82587673533908, 'gamma': 8.923998473585684}. Best is trial 22 with value: 4.935378999178155.
[I 2023-12-21 02:58:43,404] Trial 25 finished with value: 4.879909416275867 and parameters: {'learning_rate': 0.8509055948105659, 'aft_lo                                                                     ss_distribution': 'extreme', 'aft_loss_distribution_scale': 2.7918037881726043, 'max_depth': 4, 'booster': 'gbtree', 'scale_pos_weight':                                                                      7.708960321271827, 'alpha': 2.689915077983182, 'lambda': 7.572155502592512, 'eta': 0.6302153270942629, 'sampling_method': 'uniform', 'sub                                                                     sample': 0.5687995795936884, 'gamma': 7.470486708372619}. Best is trial 25 with value: 4.879909416275867.
[I 2023-12-21 02:58:43,434] Trial 26 pruned. Trial was pruned at iteration 0.
[I 2023-12-21 02:58:43,465] Trial 27 pruned. Trial was pruned at iteration 0.
[I 2023-12-21 02:58:43,502] Trial 28 pruned. Trial was pruned at iteration 1.
[I 2023-12-21 02:58:44,688] Trial 29 finished with value: inf and parameters: {'learning_rate': 0.6843653446312572, 'aft_loss_distributio                                                                     n': 'normal', 'aft_loss_distribution_scale': 0.9961693697331349, 'max_depth': 4, 'booster': 'dart', 'scale_pos_weight': 7.131677336815318                                                                     , 'alpha': 2.4285375928083925, 'lambda': 6.797287576399212, 'eta': 0.5728105822764903, 'sampling_method': 'gradient_based', 'subsample':                                                                      0.5474633761289173, 'gamma': 7.171888933872744}. Best is trial 25 with value: 4.879909416275867.
[I 2023-12-21 02:58:44,853] Trial 30 finished with value: 4.7971048902889875 and parameters: {'learning_rate': 0.9036120620691854, 'aft_l                                                                     oss_distribution': 'extreme', 'aft_loss_distribution_scale': 2.511187563115797, 'max_depth': 3, 'booster': 'gbtree', 'scale_pos_weight':                                                                      8.356634962137955, 'alpha': 0.6437378299843872, 'lambda': 7.612770070466292, 'eta': 0.9764698642302021, 'sampling_method': 'uniform', 'su                                                                     bsample': 0.6017876233245116, 'gamma': 9.084064480035826}. Best is trial 30 with value: 4.7971048902889875.
[I 2023-12-21 02:58:44,884] Trial 31 pruned. Trial was pruned at iteration 0.
[I 2023-12-21 02:58:44,914] Trial 32 pruned. Trial was pruned at iteration 0.
[I 2023-12-21 02:58:45,080] Trial 33 finished with value: 5.0630729648725055 and parameters: {'learning_rate': 0.7831537014121358, 'aft_l                                                                     oss_distribution': 'extreme', 'aft_loss_distribution_scale': 3.46757929911949, 'max_depth': 4, 'booster': 'gbtree', 'scale_pos_weight': 7                                                                     .258560841395944, 'alpha': 3.4281604471417917, 'lambda': 6.075114659969539, 'eta': 0.7071340501573792, 'sampling_method': 'uniform', 'sub                                                                     sample': 0.4724018218290414, 'gamma': 9.228317186345013}. Best is trial 30 with value: 4.7971048902889875.
[I 2023-12-21 02:58:45,258] Trial 34 finished with value: 4.664163241135061 and parameters: {'learning_rate': 0.8229027845176125, 'aft_lo                                                                     ss_distribution': 'logistic', 'aft_loss_distribution_scale': 1.4740112173273772, 'max_depth': 5, 'booster': 'gbtree', 'scale_pos_weight':                                                                      8.934442983883836, 'alpha': 2.024511197045152, 'lambda': 7.2843628104213005, 'eta': 0.9979483807305307, 'sampling_method': 'gradient_bas                                                                     ed', 'subsample': 0.599893999102212, 'gamma': 7.791325457100726}. Best is trial 34 with value: 4.664163241135061.
[I 2023-12-21 02:58:45,397] Trial 35 finished with value: 4.744974865961056 and parameters: {'learning_rate': 0.8240014294945734, 'aft_lo                                                                     ss_distribution': 'logistic', 'aft_loss_distribution_scale': 1.6334077023292095, 'max_depth': 5, 'booster': 'gbtree', 'scale_pos_weight':                                                                      8.662381269799548, 'alpha': 2.2268256547407317, 'lambda': 7.359544356778244, 'eta': 0.9542733334138731, 'sampling_method': 'gradient_bas                                                                     ed', 'subsample': 0.599692430525136, 'gamma': 7.962255399530949}. Best is trial 34 with value: 4.664163241135061.
[I 2023-12-21 02:58:45,560] Trial 36 finished with value: 4.672785533235607 and parameters: {'learning_rate': 0.7430988990454814, 'aft_lo                                                                     ss_distribution': 'logistic', 'aft_loss_distribution_scale': 1.4888759345922367, 'max_depth': 5, 'booster': 'gbtree', 'scale_pos_weight':                                                                      9.041805586334254, 'alpha': 2.2673877322134803, 'lambda': 6.1147893539614975, 'eta': 0.9983428609796596, 'sampling_method': 'gradient_ba                                                                     sed', 'subsample': 0.8033514255435684, 'gamma': 5.636588628301053}. Best is trial 34 with value: 4.664163241135061.
[I 2023-12-21 02:58:45,673] Trial 37 finished with value: inf and parameters: {'learning_rate': 0.7277302228157179, 'aft_loss_distributio                                                                     n': 'logistic', 'aft_loss_distribution_scale': 1.5194801302815066, 'max_depth': 5, 'booster': 'gbtree', 'scale_pos_weight': 8.98376580573                                                                     4318, 'alpha': 1.9622432234860825, 'lambda': 7.17952103005427, 'eta': 0.9673177898522377, 'sampling_method': 'gradient_based', 'subsample                                                                     ': 0.9976892283247337, 'gamma': 6.013414470247931}. Best is trial 34 with value: 4.664163241135061.
[I 2023-12-21 02:58:45,710] Trial 38 pruned. Trial was pruned at iteration 0.
[I 2023-12-21 02:58:45,916] Trial 39 finished with value: 4.6996909953813875 and parameters: {'learning_rate': 0.6279175239981, 'aft_loss                                                                     _distribution': 'logistic', 'aft_loss_distribution_scale': 1.5555590206276175, 'max_depth': 6, 'booster': 'gbtree', 'scale_pos_weight': 8                                                                     .361468580903582, 'alpha': 0.6787225024336404, 'lambda': 5.289920452337269, 'eta': 0.9981619280550682, 'sampling_method': 'gradient_based                                                                     ', 'subsample': 0.801922483020432, 'gamma': 8.28705262209451}. Best is trial 34 with value: 4.664163241135061.
[I 2023-12-21 02:58:45,951] Trial 40 pruned. Trial was pruned at iteration 0.
[I 2023-12-21 02:58:46,058] Trial 41 finished with value: inf and parameters: {'learning_rate': 0.7621094978744708, 'aft_loss_distributio                                                                     n': 'logistic', 'aft_loss_distribution_scale': 1.6429138618257584, 'max_depth': 5, 'booster': 'gbtree', 'scale_pos_weight': 8.58449261328                                                                     0423, 'alpha': 0.5446489160511062, 'lambda': 6.205876360659991, 'eta': 0.9319390789427695, 'sampling_method': 'gradient_based', 'subsampl                                                                     e': 0.8778720513204648, 'gamma': 9.545607619934568}. Best is trial 34 with value: 4.664163241135061.
[I 2023-12-21 02:58:46,177] Trial 42 finished with value: inf and parameters: {'learning_rate': 0.5747268742587979, 'aft_loss_distributio                                                                     n': 'logistic', 'aft_loss_distribution_scale': 2.0503323763180115, 'max_depth': 6, 'booster': 'gbtree', 'scale_pos_weight': 8.27967550680                                                                     4372, 'alpha': 1.1485610323011, 'lambda': 4.645155364407766, 'eta': 0.9998203153308509, 'sampling_method': 'gradient_based', 'subsample':                                                                      0.7781595284108817, 'gamma': 6.972377279935816}. Best is trial 34 with value: 4.664163241135061.
[I 2023-12-21 02:58:46,406] Trial 43 finished with value: 4.617923070115583 and parameters: {'learning_rate': 0.6531016050162083, 'aft_lo                                                                     ss_distribution': 'logistic', 'aft_loss_distribution_scale': 1.3822801875359731, 'max_depth': 7, 'booster': 'gbtree', 'scale_pos_weight':                                                                      9.21368796409863, 'alpha': 1.4092005850555642, 'lambda': 6.57182719216033, 'eta': 0.8836304818581949, 'sampling_method': 'gradient_based                                                                     ', 'subsample': 0.6763878562634259, 'gamma': 8.245594197022964}. Best is trial 43 with value: 4.617923070115583.
[I 2023-12-21 02:58:46,595] Trial 44 finished with value: 4.675996151901022 and parameters: {'learning_rate': 0.6539768526166673, 'aft_lo                                                                     ss_distribution': 'logistic', 'aft_loss_distribution_scale': 1.5037884441445815, 'max_depth': 7, 'booster': 'gbtree', 'scale_pos_weight':                                                                      9.276581216918341, 'alpha': 2.3854987767823865, 'lambda': 6.583853740179569, 'eta': 0.8815471842792646, 'sampling_method': 'gradient_bas                                                                     ed', 'subsample': 0.6957231403869022, 'gamma': 5.804496266275236}. Best is trial 43 with value: 4.617923070115583.
[I 2023-12-21 02:58:46,629] Trial 45 pruned. Trial was pruned at iteration 0.
