[I 2023-12-21 00:05:56,493] Trial 162 finished with value: inf and parameters: {'learning_rate': 0.7987150917483549, 'aft_loss_distribution': 'normal', 'aft_loss_distribution_scale': 1.4181590410984057, 'max_depth': 5, 'booster': 'gbtree', 'scale_pos_weight': 1.3778116105681515, 'alpha': 6.364847936974584, 'lambda': 7.687834122564605, 'eta': 0.48700275020693357, 'sampling_method': 'uniform', 'subsample': 0.1883207777699491, 'gamma': 6.668153970775147}. Best is trial 4 with value: 1.937856811827349.
[I 2023-12-21 00:05:56,615] Trial 163 pruned. Trial was pruned at iteration 1.
[I 2023-12-21 00:05:56,720] Trial 164 pruned. Trial was pruned at iteration 0.
[I 2023-12-21 00:05:56,818] Trial 165 pruned. Trial was pruned at iteration 0.
[I 2023-12-21 00:05:56,918] Trial 166 pruned. Trial was pruned at iteration 3.
[I 2023-12-21 00:05:56,979] Trial 167 pruned. Trial was pruned at iteration 0.
[I 2023-12-21 00:05:57,043] Trial 168 pruned. Trial was pruned at iteration 1.
[I 2023-12-21 00:05:57,110] Trial 169 pruned. Trial was pruned at iteration 0.
[I 2023-12-21 00:05:57,179] Trial 170 pruned. Trial was pruned at iteration 1.
[I 2023-12-21 00:05:57,260] Trial 171 pruned. Trial was pruned at iteration 2.
[I 2023-12-21 00:05:57,324] Trial 172 pruned. Trial was pruned at iteration 1.
[I 2023-12-21 00:05:57,561] Trial 173 finished with value: inf and parameters: {'learning_rate': 0.8108975022908431, 'aft_loss_distribution': 'normal', 'aft_loss_distribution_scale': 1.4026536683733215, 'max_depth': 4, 'booster': 'gbtree', 'scale_pos_weight': 1.548291063219166, 'alpha': 6.2511612221188955, 'lambda': 7.906585287060329, 'eta': 0.5453644323933091, 'sampling_method': 'uniform', 'subsample': 0.29414871715446644, 'gamma': 6.208757807589427}. Best is trial 4 with value: 1.937856811827349.
[I 2023-12-21 00:05:57,641] Trial 174 pruned. Trial was pruned at iteration 3.
[I 2023-12-21 00:05:57,707] Trial 175 pruned. Trial was pruned at iteration 1.
[I 2023-12-21 00:05:57,775] Trial 176 pruned. Trial was pruned at iteration 0.
[I 2023-12-21 00:05:57,839] Trial 177 pruned. Trial was pruned at iteration 0.
[I 2023-12-21 00:05:57,907] Trial 178 pruned. Trial was pruned at iteration 2.
[I 2023-12-21 00:05:57,971] Trial 179 pruned. Trial was pruned at iteration 0.
[I 2023-12-21 00:05:58,036] Trial 180 pruned. Trial was pruned at iteration 0.
[I 2023-12-21 00:05:58,331] Trial 181 finished with value: inf and parameters: {'learning_rate': 0.7828158721439364, 'aft_loss_distribution': 'normal', 'aft_loss_distribution_scale': 1.5694859701102006, 'max_depth': 6, 'booster': 'gbtree', 'scale_pos_weight': 2.2202492770078543, 'alpha': 5.12679499205688, 'lambda': 7.96248152444536, 'eta': 0.536191197598787, 'sampling_method': 'uniform', 'subsample': 0.3729501116157715, 'gamma': 3.4956799683811672}. Best is trial 4 with value: 1.937856811827349.
[I 2023-12-21 00:05:58,576] Trial 182 finished with value: inf and parameters: {'learning_rate': 0.7873555334959087, 'aft_loss_distribution': 'normal', 'aft_loss_distribution_scale': 1.4940494218820264, 'max_depth': 6, 'booster': 'gbtree', 'scale_pos_weight': 2.302245135332067, 'alpha': 5.373563129058404, 'lambda': 8.015190541404966, 'eta': 0.4957263966638982, 'sampling_method': 'uniform', 'subsample': 0.37456921200180004, 'gamma': 3.713938719363365}. Best is trial 4 with value: 1.937856811827349.
[I 2023-12-21 00:05:58,650] Trial 183 pruned. Trial was pruned at iteration 2.
[I 2023-12-21 00:05:58,723] Trial 184 pruned. Trial was pruned at iteration 1.
[I 2023-12-21 00:05:58,791] Trial 185 pruned. Trial was pruned at iteration 1.
[I 2023-12-21 00:05:58,851] Trial 186 pruned. Trial was pruned at iteration 0.
[I 2023-12-21 00:05:58,914] Trial 187 pruned. Trial was pruned at iteration 0.
[I 2023-12-21 00:05:58,977] Trial 188 pruned. Trial was pruned at iteration 0.
[I 2023-12-21 00:05:59,047] Trial 189 pruned. Trial was pruned at iteration 1.
[I 2023-12-21 00:05:59,108] Trial 190 pruned. Trial was pruned at iteration 0.
[I 2023-12-21 00:05:59,189] Trial 191 pruned. Trial was pruned at iteration 4.
[I 2023-12-21 00:05:59,266] Trial 192 pruned. Trial was pruned at iteration 3.
[I 2023-12-21 00:05:59,338] Trial 193 pruned. Trial was pruned at iteration 0.
[I 2023-12-21 00:05:59,402] Trial 194 pruned. Trial was pruned at iteration 0.
[I 2023-12-21 00:05:59,464] Trial 195 pruned. Trial was pruned at iteration 1.
[I 2023-12-21 00:05:59,544] Trial 196 pruned. Trial was pruned at iteration 1.
[I 2023-12-21 00:05:59,612] Trial 197 pruned. Trial was pruned at iteration 1.
[I 2023-12-21 00:05:59,675] Trial 198 pruned. Trial was pruned at iteration 0.
[I 2023-12-21 00:05:59,741] Trial 199 pruned. Trial was pruned at iteration 0.
[I 2023-12-21 00:05:59,802] Trial 200 pruned. Trial was pruned at iteration 0.
[I 2023-12-21 00:05:59,864] Trial 201 pruned. Trial was pruned at iteration 0.
[I 2023-12-21 00:06:00,071] Trial 202 finished with value: inf and parameters: {'learning_rate': 0.8242832896594815, 'aft_loss_distribution': 'normal', 'aft_loss_distribution_scale': 1.3666802206829831, 'max_depth': 5, 'booster': 'gbtree', 'scale_pos_weight': 2.991637479806246, 'alpha': 6.79250173874859, 'lambda': 7.6670006993685185, 'eta': 0.49459255324773266, 'sampling_method': 'uniform', 'subsample': 0.23685739091686478, 'gamma': 6.645438244517483}. Best is trial 4 with value: 1.937856811827349.
[I 2023-12-21 00:06:00,148] Trial 203 pruned. Trial was pruned at iteration 2.
[I 2023-12-21 00:06:00,219] Trial 204 pruned. Trial was pruned at iteration 1.
[I 2023-12-21 00:06:00,301] Trial 205 pruned. Trial was pruned at iteration 0.
[I 2023-12-21 00:06:00,371] Trial 206 pruned. Trial was pruned at iteration 0.
[I 2023-12-21 00:06:00,434] Trial 207 pruned. Trial was pruned at iteration 0.
[I 2023-12-21 00:06:00,497] Trial 208 pruned. Trial was pruned at iteration 0.
[I 2023-12-21 00:06:00,567] Trial 209 pruned. Trial was pruned at iteration 0.
[I 2023-12-21 00:06:00,649] Trial 210 pruned. Trial was pruned at iteration 3.
[I 2023-12-21 00:06:00,876] Trial 211 finished with value: inf and parameters: {'learning_rate': 0.8229649188360212, 'aft_loss_distribution': 'normal', 'aft_loss_distribution_scale': 1.3850342860217506, 'max_depth': 4, 'booster': 'gbtree', 'scale_pos_weight': 1.676510472263588, 'alpha': 6.331995122603203, 'lambda': 7.885386663297611, 'eta': 0.5462581828141982, 'sampling_method': 'uniform', 'subsample': 0.2901115060204307, 'gamma': 6.255246797259084}. Best is trial 4 with value: 1.937856811827349.
[I 2023-12-21 00:06:00,950] Trial 212 pruned. Trial was pruned at iteration 1.
[I 2023-12-21 00:06:01,016] Trial 213 pruned. Trial was pruned at iteration 0.
[I 2023-12-21 00:06:01,085] Trial 214 pruned. Trial was pruned at iteration 0.
[I 2023-12-21 00:06:01,156] Trial 215 pruned. Trial was pruned at iteration 0.
[I 2023-12-21 00:06:01,220] Trial 216 pruned. Trial was pruned at iteration 0.
[I 2023-12-21 00:06:01,291] Trial 217 pruned. Trial was pruned at iteration 1.
[I 2023-12-21 00:06:01,549] Trial 218 finished with value: 1.9292931501153956 and parameters: {'learning_rate': 0.7803783449257331, 'aft_loss_distribution': 'normal', 'aft_loss_distribution_scale': 1.5231001533854776, 'max_depth': 3, 'booster': 'gbtree', 'scale_pos_weight': 1.6596078365637612, 'alpha': 5.316763693949215, 'lambda': 7.608048182962037, 'eta': 0.6050926903071034, 'sampling_method': 'uniform', 'subsample': 0.9556835806134136, 'gamma': 6.116085527540777}. Best is trial 218 with value: 1.9292931501153956.
[I 2023-12-21 00:06:01,620] Trial 219 pruned. Trial was pruned at iteration 1.
[I 2023-12-21 00:06:01,686] Trial 220 pruned. Trial was pruned at iteration 0.
[I 2023-12-21 00:06:01,748] Trial 221 pruned. Trial was pruned at iteration 0.
[I 2023-12-21 00:06:01,998] Trial 222 finished with value: 1.9278124990255225 and parameters: {'learning_rate': 0.8021952477636345, 'aft_loss_distribution': 'normal', 'aft_loss_distribution_scale': 1.4361349440063076, 'max_depth': 3, 'booster': 'gbtree', 'scale_pos_weight': 1.685057147020012, 'alpha': 5.370517253099019, 'lambda': 8.044392933825865, 'eta': 0.9266120122267492, 'sampling_method': 'uniform', 'subsample': 0.9555943897579214, 'gamma': 6.097969132371395}. Best is trial 222 with value: 1.9278124990255225.
[I 2023-12-21 00:06:02,075] Trial 223 pruned. Trial was pruned at iteration 0.
[I 2023-12-21 00:06:02,141] Trial 224 pruned. Trial was pruned at iteration 0.
[I 2023-12-21 00:06:02,209] Trial 225 pruned. Trial was pruned at iteration 1.
[I 2023-12-21 00:06:02,275] Trial 226 pruned. Trial was pruned at iteration 0.
[I 2023-12-21 00:06:02,358] Trial 227 pruned. Trial was pruned at iteration 0.
[I 2023-12-21 00:06:02,430] Trial 228 pruned. Trial was pruned at iteration 2.
[I 2023-12-21 00:06:02,498] Trial 229 pruned. Trial was pruned at iteration 0.
[I 2023-12-21 00:06:02,568] Trial 230 pruned. Trial was pruned at iteration 0.
[I 2023-12-21 00:06:02,810] Trial 231 finished with value: 1.9282460026139385 and parameters: {'learning_rate': 0.8212382408943025, 'aft_loss_distribution': 'normal', 'aft_loss_distribution_scale': 1.3315227488383468, 'max_depth': 6, 'booster': 'gbtree', 'scale_pos_weight': 1.5439124604511583, 'alpha': 6.011704841271032, 'lambda': 7.92431868236552, 'eta': 0.5384096813884609, 'sampling_method': 'uniform', 'subsample': 0.9942112443898382, 'gamma': 6.17148395724884}. Best is trial 222 with value: 1.9278124990255225.
[I 2023-12-21 00:06:02,882] Trial 232 pruned. Trial was pruned at iteration 0.
[I 2023-12-21 00:06:03,197] Trial 233 finished with value: 1.9326544333444022 and parameters: {'learning_rate': 0.7775585639232703, 'aft_loss_distribution': 'normal', 'aft_loss_distribution_scale': 1.5775301159756692, 'max_depth': 6, 'booster': 'gbtree', 'scale_pos_weight': 1.3939442310649892, 'alpha': 5.692306630195951, 'lambda': 8.224856988393125, 'eta': 0.5717412756208573, 'sampling_method': 'uniform', 'subsample': 0.9999290685199393, 'gamma': 5.883442144778099}. Best is trial 222 with value: 1.9278124990255225.
[I 2023-12-21 00:06:03,276] Trial 234 pruned. Trial was pruned at iteration 1.
[I 2023-12-21 00:06:03,342] Trial 235 pruned. Trial was pruned at iteration 0.
[I 2023-12-21 00:06:03,422] Trial 236 pruned. Trial was pruned at iteration 0.
[I 2023-12-21 00:06:03,491] Trial 237 pruned. Trial was pruned at iteration 0.
[I 2023-12-21 00:06:03,561] Trial 238 pruned. Trial was pruned at iteration 0.
[I 2023-12-21 00:06:03,632] Trial 239 pruned. Trial was pruned at iteration 0.
[I 2023-12-21 00:06:03,700] Trial 240 pruned. Trial was pruned at iteration 0.
[I 2023-12-21 00:06:03,772] Trial 241 pruned. Trial was pruned at iteration 0.
[I 2023-12-21 00:06:03,849] Trial 242 pruned. Trial was pruned at iteration 4.
[I 2023-12-21 00:06:03,915] Trial 243 pruned. Trial was pruned at iteration 0.
[I 2023-12-21 00:06:03,989] Trial 244 pruned. Trial was pruned at iteration 0.
[I 2023-12-21 00:06:04,061] Trial 245 pruned. Trial was pruned at iteration 1.
[I 2023-12-21 00:06:04,131] Trial 246 pruned. Trial was pruned at iteration 1.
[I 2023-12-21 00:06:04,206] Trial 247 pruned. Trial was pruned at iteration 0.
[I 2023-12-21 00:06:04,280] Trial 248 pruned. Trial was pruned at iteration 2.
[I 2023-12-21 00:06:04,356] Trial 249 pruned. Trial was pruned at iteration 1.
Completed hyperparameter tuning with best aft-nloglik = 1.9278124990255225.
Re-running the best trial... params = {'verbosity': 0, 'objective': 'survival:aft', 'eval_metric': 'aft-nloglik', 'tree_method': 'gpu_hist', 'device': 'cuda', 'learning_rate': 0.8021952477636345, 'aft_loss_distribution': 'normal', 'aft_loss_distribution_scale': 1.4361349440063076, 'max_depth': 3, 'booster': 'gbtree', 'scale_pos_weight': 1.685057147020012, 'alpha': 5.370517253099019, 'lambda': 8.044392933825865, 'eta': 0.9266120122267492, 'sampling_method': 'uniform', 'subsample': 0.9555943897579214, 'gamma': 6.097969132371395}
[W 2023-12-21 00:06:04,561] Trial 0 is omitted in visualization because its objective value is inf or nan.
[W 2023-12-21 00:06:04,565] Trial 3 is omitted in visualization because its objective value is inf or nan.
[W 2023-12-21 00:06:04,567] Trial 65 is omitted in visualization because its objective value is inf or nan.
[W 2023-12-21 00:06:04,571] Trial 73 is omitted in visualization because its objective value is inf or nan.
[W 2023-12-21 00:06:04,572] Trial 82 is omitted in visualization because its objective value is inf or nan.
[W 2023-12-21 00:06:04,575] Trial 83 is omitted in visualization because its objective value is inf or nan.
[W 2023-12-21 00:06:04,576] Trial 91 is omitted in visualization because its objective value is inf or nan.
[W 2023-12-21 00:06:04,579] Trial 93 is omitted in visualization because its objective value is inf or nan.
[W 2023-12-21 00:06:04,580] Trial 114 is omitted in visualization because its objective value is inf or nan.
[W 2023-12-21 00:06:04,581] Trial 121 is omitted in visualization because its objective value is inf or nan.
[W 2023-12-21 00:06:04,582] Trial 132 is omitted in visualization because its objective value is inf or nan.
[W 2023-12-21 00:06:04,583] Trial 133 is omitted in visualization because its objective value is inf or nan.
[W 2023-12-21 00:06:04,583] Trial 143 is omitted in visualization because its objective value is inf or nan.
[W 2023-12-21 00:06:04,584] Trial 155 is omitted in visualization because its objective value is inf or nan.
[W 2023-12-21 00:06:04,585] Trial 162 is omitted in visualization because its objective value is inf or nan.
[W 2023-12-21 00:06:04,586] Trial 173 is omitted in visualization because its objective value is inf or nan.
[W 2023-12-21 00:06:04,587] Trial 181 is omitted in visualization because its objective value is inf or nan.
[W 2023-12-21 00:06:04,588] Trial 182 is omitted in visualization because its objective value is inf or nan.
[W 2023-12-21 00:06:04,589] Trial 202 is omitted in visualization because its objective value is inf or nan.
[W 2023-12-21 00:06:04,590] Trial 211 is omitted in visualization because its objective value is inf or nan.
TRN1 | R2:0.336; p:0.0 | C:70.12 |3h:0.955 |6h:0.943 |9h:0.935 |12h:0.729 |15h:0.729 |18h:0.725 |24h:0.567 |48h:0.558 |72h:0.552 |1wk:0.373 |2wks:0.368 |1mon:0.308 |
TRN2 | R2:0.238; p:5.387e-42 | C:64.37 |3h:0.954 |6h:0.942 |9h:0.934 |12h:0.727 |15h:0.727 |18h:0.722 |24h:0.564 |48h:0.555 |72h:0.550 |1wk:0.364 |2wks:0.369 |1mon:0.315 |
VAL | R2:0.267; p:1.218e-52 | C:66.67 |3h:0.955 |6h:0.943 |9h:0.935 |12h:0.728 |15h:0.728 |18h:0.724 |24h:0.567 |48h:0.557 |72h:0.550 |1wk:0.373 |2wks:0.368 |1mon:0.302 |
TST | R2:0.185; p:4.033e-149 | C:60.57 |3h:0.951 |6h:0.936 |9h:0.925 |12h:0.722 |15h:0.722 |18h:0.707 |24h:0.435 |48h:0.432 |72h:0.430 |1wk:0.338 |2wks:0.348 |1mon:0.308 |
[I 2023-12-21 00:06:08,316] A new study created in memory with name: no-name-81ab30c4-834e-4a1f-a43b-ac849b9d611d
/content/drive/MyDrive/intermediates2/res//outcome2_xgb-aft_inp39_all_rdims8.json
All avail dimensionality reduced word embedding with ['location_numeric', 'race_numeric', 'sex_numeric', 'body_part_numeric', 'product_1_numeric', 'product_2_numeric', 'drug_numeric', 'alcohol_numeric', 'month']
All avail dimensionality reduced word embedding with ['location_numeric', 'race_numeric', 'sex_numeric', 'body_part_numeric', 'product_1_numeric', 'product_2_numeric', 'drug_numeric', 'alcohol_numeric', 'month']
All avail dimensionality reduced word embedding with ['location_numeric', 'race_numeric', 'sex_numeric', 'body_part_numeric', 'product_1_numeric', 'product_2_numeric', 'drug_numeric', 'alcohol_numeric', 'month']
All avail dimensionality reduced word embedding with ['location_numeric', 'race_numeric', 'sex_numeric', 'body_part_numeric', 'product_1_numeric', 'product_2_numeric', 'drug_numeric', 'alcohol_numeric', 'month']
trn1
trn2
val
tst
[I 2023-12-21 00:06:14,332] Trial 0 finished with value: 2.469007044934258 and parameters: {'learning_rate': 0.1523881105891345, 'aft_loss_distribution': 'extreme', 'aft_loss_distribution_scale': 7.490997877471728, 'max_depth': 10, 'booster': 'dart', 'scale_pos_weight': 1.5985950244702711, 'alpha': 9.150420470178556, 'lambda': 4.041240809305371, 'eta': 0.7183034828269885, 'sampling_method': 'gradient_based', 'subsample': 0.05490883305948865, 'gamma': 3.7319679033674014}. Best is trial 0 with value: 2.469007044934258.
[I 2023-12-21 00:06:14,887] Trial 1 finished with value: 2.3510604931350976 and parameters: {'learning_rate': 0.11865163728473424, 'aft_loss_distribution': 'normal', 'aft_loss_distribution_scale': 7.414570880465828, 'max_depth': 9, 'booster': 'gbtree', 'scale_pos_weight': 0.18855018719563046, 'alpha': 5.786339575272803, 'lambda': 9.969252054181112, 'eta': 0.24959724356378876, 'sampling_method': 'uniform', 'subsample': 0.10332885756706937, 'gamma': 1.2276735814257034}. Best is trial 1 with value: 2.3510604931350976.
[I 2023-12-21 00:06:15,110] Trial 2 finished with value: 2.5251357435635446 and parameters: {'learning_rate': 0.30945556094530746, 'aft_loss_distribution': 'logistic', 'aft_loss_distribution_scale': 7.471489894439851, 'max_depth': 5, 'booster': 'gbtree', 'scale_pos_weight': 1.2626639969073472, 'alpha': 2.3498061962829495, 'lambda': 2.8297638881985225, 'eta': 0.27053637606053205, 'sampling_method': 'gradient_based', 'subsample': 0.6671246475616629, 'gamma': 6.739935133606862}. Best is trial 1 with value: 2.3510604931350976.
[I 2023-12-21 00:06:41,141] Trial 3 finished with value: 2.5634308591777883 and parameters: {'learning_rate': 0.08865671711280305, 'aft_loss_distribution': 'logistic', 'aft_loss_distribution_scale': 8.339858794817346, 'max_depth': 7, 'booster': 'dart', 'scale_pos_weight': 3.1816853258948528, 'alpha': 0.03116239485860003, 'lambda': 3.0558533877277103, 'eta': 0.20284582815617758, 'sampling_method': 'gradient_based', 'subsample': 0.6191829740703311, 'gamma': 7.472654554163822}. Best is trial 1 with value: 2.3510604931350976.
[I 2023-12-21 00:07:14,502] Trial 4 finished with value: 2.3482233245120825 and parameters: {'learning_rate': 0.5527783523028631, 'aft_loss_distribution': 'logistic', 'aft_loss_distribution_scale': 4.47686992687895, 'max_depth': 9, 'booster': 'dart', 'scale_pos_weight': 1.9822740191392203, 'alpha': 7.123581453708131, 'lambda': 8.589116342762503, 'eta': 0.8210906448279179, 'sampling_method': 'gradient_based', 'subsample': 0.7966791665788335, 'gamma': 2.722067322916794}. Best is trial 4 with value: 2.3482233245120825.
[I 2023-12-21 00:07:14,514] Trial 5 pruned. Trial was pruned at iteration 0.
[I 2023-12-21 00:07:14,523] Trial 6 pruned. Trial was pruned at iteration 0.
[I 2023-12-21 00:07:14,534] Trial 7 pruned. Trial was pruned at iteration 0.
[I 2023-12-21 00:07:14,721] Trial 8 finished with value: inf and parameters: {'learning_rate': 0.9327926865472076, 'aft_loss_distribution': 'extreme', 'aft_loss_distribution_scale': 3.575375396105423, 'max_depth': 4, 'booster': 'gbtree', 'scale_pos_weight': 3.2314455016743957, 'alpha': 4.40140605755375, 'lambda': 7.653236984040779, 'eta': 0.962580794857014, 'sampling_method': 'gradient_based', 'subsample': 0.29261898534894637, 'gamma': 5.157926295811421}. Best is trial 4 with value: 2.3482233245120825.
[I 2023-12-21 00:07:14,731] Trial 9 pruned. Trial was pruned at iteration 0.
[I 2023-12-21 00:07:14,789] Trial 10 pruned. Trial was pruned at iteration 0.
[I 2023-12-21 00:07:15,339] Trial 11 finished with value: 2.2580793072538627 and parameters: {'learning_rate': 0.4255456766841118, 'aft_loss_distribution': 'normal', 'aft_loss_distribution_scale': 5.892493318573612, 'max_depth': 10, 'booster': 'gbtree', 'scale_pos_weight': 0.24900273643105897, 'alpha': 6.67301173498266, 'lambda': 9.776252207260985, 'eta': 0.31548364067340107, 'sampling_method': 'uniform', 'subsample': 0.3332927238438919, 'gamma': 0.18302035327544042}. Best is trial 11 with value: 2.2580793072538627.
[I 2023-12-21 00:07:29,129] Trial 12 finished with value: 2.2440877423336714 and parameters: {'learning_rate': 0.4129465625729988, 'aft_loss_distribution': 'normal', 'aft_loss_distribution_scale': 5.674725769068236, 'max_depth': 10, 'booster': 'dart', 'scale_pos_weight': 2.1385330240859735, 'alpha': 6.835898353508062, 'lambda': 9.91409884036239, 'eta': 0.39950570716416134, 'sampling_method': 'uniform', 'subsample': 0.35695415923649826, 'gamma': 0.4153062497917172}. Best is trial 12 with value: 2.2440877423336714.
[I 2023-12-21 00:07:29,582] Trial 13 finished with value: 2.2644629308224236 and parameters: {'learning_rate': 0.3746296472382116, 'aft_loss_distribution': 'normal', 'aft_loss_distribution_scale': 6.021982176314888, 'max_depth': 10, 'booster': 'gbtree', 'scale_pos_weight': 0.07429985958894414, 'alpha': 6.243299752519942, 'lambda': 9.533269710777388, 'eta': 0.37379819772912065, 'sampling_method': 'uniform', 'subsample': 0.33912072107980396, 'gamma': 0.1797649887753461}. Best is trial 12 with value: 2.2440877423336714.
[I 2023-12-21 00:07:43,662] Trial 14 finished with value: 2.250208674999585 and parameters: {'learning_rate': 0.4215623038270395, 'aft_loss_distribution': 'normal', 'aft_loss_distribution_scale': 5.815025873257176, 'max_depth': 6, 'booster': 'dart', 'scale_pos_weight': 3.732722732509095, 'alpha': 4.680932443376064, 'lambda': 7.410724195906728, 'eta': 0.4412193528183819, 'sampling_method': 'uniform', 'subsample': 0.3459708763138171, 'gamma': 0.45601492311132463}. Best is trial 12 with value: 2.2440877423336714.
[I 2023-12-21 00:07:43,715] Trial 15 pruned. Trial was pruned at iteration 1.
[I 2023-12-21 00:07:49,306] Trial 16 finished with value: 2.2470145226085383 and parameters: {'learning_rate': 0.49296111211919363, 'aft_loss_distribution': 'normal', 'aft_loss_distribution_scale': 5.6683027732440685, 'max_depth': 6, 'booster': 'dart', 'scale_pos_weight': 2.6632028055043016, 'alpha': 5.04306951816799, 'lambda': 7.2378039608534435, 'eta': 0.6041610877078556, 'sampling_method': 'uniform', 'subsample': 0.2691892604087196, 'gamma': 0.03868642673213568}. Best is trial 12 with value: 2.2440877423336714.
