
[I 2023-12-21 02:29:36,025] A new study created in memory with name: no-name-865d9925-39e7-43b6-bbb1-c79e162f4374
[I 2023-12-21 02:29:37,171] Trial 0 finished with value: 5.524125442807995 and parameters: {'learning_rate': 0.3424504021304119, 'aft_los                                                                     s_distribution': 'logistic', 'aft_loss_distribution_scale': 4.011306712952611, 'max_depth': 7, 'booster': 'gbtree', 'scale_pos_weight': 9                                                                     .009993754881943, 'alpha': 2.5459494876183024, 'lambda': 4.897278452917811, 'eta': 0.14670534691296622, 'sampling_method': 'uniform', 'su                                                                     bsample': 0.25698306184513586, 'gamma': 9.86349117693795}. Best is trial 0 with value: 5.524125442807995.
[I 2023-12-21 02:29:37,266] Trial 1 finished with value: inf and parameters: {'learning_rate': 0.5805709022959975, 'aft_loss_distribution                                                                     ': 'logistic', 'aft_loss_distribution_scale': 1.840567774217261, 'max_depth': 5, 'booster': 'gbtree', 'scale_pos_weight': 2.4898907839561                                                                     417, 'alpha': 2.5211728013576655, 'lambda': 0.12074024248646133, 'eta': 0.09745337641558971, 'sampling_method': 'gradient_based', 'subsam                                                                     ple': 0.47176215536560856, 'gamma': 1.5238292463453393}. Best is trial 0 with value: 5.524125442807995.
[I 2023-12-21 02:29:40,666] Trial 2 finished with value: 5.941150160725244 and parameters: {'learning_rate': 0.773058264782624, 'aft_loss                                                                     _distribution': 'logistic', 'aft_loss_distribution_scale': 6.272716430915176, 'max_depth': 7, 'booster': 'dart', 'scale_pos_weight': 8.68                                                                     138800502264, 'alpha': 8.623094500500402, 'lambda': 9.17846832332145, 'eta': 0.06044235171159229, 'sampling_method': 'uniform', 'subsampl                                                                     e': 0.25165213827082894, 'gamma': 7.737763299509628}. Best is trial 0 with value: 5.524125442807995.
[I 2023-12-21 02:29:40,767] Trial 3 finished with value: 4.918229522001241 and parameters: {'learning_rate': 0.1999308280706729, 'aft_los                                                                     s_distribution': 'extreme', 'aft_loss_distribution_scale': 2.9223247520626683, 'max_depth': 6, 'booster': 'gbtree', 'scale_pos_weight': 5                                                                     .91412649830393, 'alpha': 8.879873285686635, 'lambda': 2.8078145476127063, 'eta': 0.39425025281212067, 'sampling_method': 'uniform', 'sub                                                                     sample': 0.7353098735935166, 'gamma': 1.7319031082491037}. Best is trial 3 with value: 4.918229522001241.
[I 2023-12-21 02:29:41,073] Trial 4 finished with value: 4.246843583964676 and parameters: {'learning_rate': 0.2646408378045156, 'aft_los                                                                     s_distribution': 'normal', 'aft_loss_distribution_scale': 1.148244712747968, 'max_depth': 8, 'booster': 'gbtree', 'scale_pos_weight': 7.7                                                                     65136268972785, 'alpha': 7.572061736750844, 'lambda': 4.366289401929379, 'eta': 0.4662379814877673, 'sampling_method': 'gradient_based',                                                                      'subsample': 0.9831711223320495, 'gamma': 6.301045126456847}. Best is trial 4 with value: 4.246843583964676.
[I 2023-12-21 02:29:41,083] Trial 5 pruned. Trial was pruned at iteration 2.
[I 2023-12-21 02:29:45,153] Trial 6 finished with value: 4.860300627110005 and parameters: {'learning_rate': 0.6767813685176399, 'aft_los                                                                     s_distribution': 'normal', 'aft_loss_distribution_scale': 3.059812306685398, 'max_depth': 8, 'booster': 'dart', 'scale_pos_weight': 1.142                                                                     6546301126157, 'alpha': 0.569080687651895, 'lambda': 2.914403138801145, 'eta': 0.9534460799445594, 'sampling_method': 'uniform', 'subsamp                                                                     le': 0.4636146355749, 'gamma': 4.37875847612994}. Best is trial 4 with value: 4.246843583964676.
[I 2023-12-21 02:29:45,163] Trial 7 pruned. Trial was pruned at iteration 2.
[I 2023-12-21 02:29:45,170] Trial 8 pruned. Trial was pruned at iteration 2.
[I 2023-12-21 02:29:45,176] Trial 9 pruned. Trial was pruned at iteration 2.
[I 2023-12-21 02:29:45,209] Trial 10 pruned. Trial was pruned at iteration 0.
[I 2023-12-21 02:29:45,237] Trial 11 pruned. Trial was pruned at iteration 0.
[I 2023-12-21 02:29:45,267] Trial 12 pruned. Trial was pruned at iteration 0.
[I 2023-12-21 02:29:45,297] Trial 13 pruned. Trial was pruned at iteration 0.
[I 2023-12-21 02:29:45,328] Trial 14 pruned. Trial was pruned at iteration 3.
[I 2023-12-21 02:29:53,758] Trial 15 pruned. Trial was pruned at iteration 157.
[I 2023-12-21 02:29:53,797] Trial 16 pruned. Trial was pruned at iteration 3.
[I 2023-12-21 02:29:54,015] Trial 17 pruned. Trial was pruned at iteration 157.
[I 2023-12-21 02:29:54,044] Trial 18 pruned. Trial was pruned at iteration 0.
[I 2023-12-21 02:29:54,080] Trial 19 pruned. Trial was pruned at iteration 2.
[I 2023-12-21 02:29:54,111] Trial 20 pruned. Trial was pruned at iteration 0.
[I 2023-12-21 02:29:54,141] Trial 21 pruned. Trial was pruned at iteration 0.
[I 2023-12-21 02:29:54,172] Trial 22 pruned. Trial was pruned at iteration 0.
[I 2023-12-21 02:29:54,201] Trial 23 pruned. Trial was pruned at iteration 0.
[I 2023-12-21 02:29:54,235] Trial 24 pruned. Trial was pruned at iteration 3.
[I 2023-12-21 02:29:54,264] Trial 25 pruned. Trial was pruned at iteration 0.
[I 2023-12-21 02:29:54,295] Trial 26 pruned. Trial was pruned at iteration 0.
[I 2023-12-21 02:29:54,328] Trial 27 pruned. Trial was pruned at iteration 3.
[I 2023-12-21 02:29:54,358] Trial 28 pruned. Trial was pruned at iteration 0.
[I 2023-12-21 02:29:54,391] Trial 29 pruned. Trial was pruned at iteration 3.
[I 2023-12-21 02:29:54,422] Trial 30 pruned. Trial was pruned at iteration 0.
[I 2023-12-21 02:29:54,455] Trial 31 pruned. Trial was pruned at iteration 2.
[I 2023-12-21 02:29:54,487] Trial 32 pruned. Trial was pruned at iteration 0.
[I 2023-12-21 02:29:54,526] Trial 33 pruned. Trial was pruned at iteration 5.
[I 2023-12-21 02:29:54,559] Trial 34 pruned. Trial was pruned at iteration 2.
[I 2023-12-21 02:29:54,597] Trial 35 pruned. Trial was pruned at iteration 2.
[I 2023-12-21 02:29:54,634] Trial 36 pruned. Trial was pruned at iteration 5.
[I 2023-12-21 02:29:54,671] Trial 37 pruned. Trial was pruned at iteration 2.
[I 2023-12-21 02:29:54,704] Trial 38 pruned. Trial was pruned at iteration 2.
[I 2023-12-21 02:29:54,743] Trial 39 pruned. Trial was pruned at iteration 5.
[I 2023-12-21 02:29:54,775] Trial 40 pruned. Trial was pruned at iteration 0.
[I 2023-12-21 02:29:54,810] Trial 41 pruned. Trial was pruned at iteration 0.
[I 2023-12-21 02:29:54,844] Trial 42 pruned. Trial was pruned at iteration 0.
[I 2023-12-21 02:29:54,881] Trial 43 pruned. Trial was pruned at iteration 2.
[I 2023-12-21 02:29:54,914] Trial 44 pruned. Trial was pruned at iteration 0.
[I 2023-12-21 02:29:56,044] Trial 45 finished with value: inf and parameters: {'learning_rate': 0.7081690925395553, 'aft_loss_distributio                                                                     n': 'normal', 'aft_loss_distribution_scale': 0.7628793587848723, 'max_depth': 8, 'booster': 'dart', 'scale_pos_weight': 1.213160839485679                                                                     , 'alpha': 9.932967514852205, 'lambda': 8.647848167198722, 'eta': 0.6373731361542797, 'sampling_method': 'uniform', 'subsample': 0.239373                                                                     0887898586, 'gamma': 8.027749847261246}. Best is trial 4 with value: 4.246843583964676.
[I 2023-12-21 02:29:56,077] Trial 46 pruned. Trial was pruned at iteration 0.
[I 2023-12-21 02:29:56,114] Trial 47 pruned. Trial was pruned at iteration 2.
[I 2023-12-21 02:29:56,154] Trial 48 pruned. Trial was pruned at iteration 3.
[I 2023-12-21 02:29:56,189] Trial 49 pruned. Trial was pruned at iteration 2.
[I 2023-12-21 02:29:56,226] Trial 50 pruned. Trial was pruned at iteration 2.
[I 2023-12-21 02:29:56,264] Trial 51 pruned. Trial was pruned at iteration 3.
[I 2023-12-21 02:29:56,386] Trial 52 finished with value: inf and parameters: {'learning_rate': 0.7334769702067083, 'aft_loss_distributio                                                                     n': 'logistic', 'aft_loss_distribution_scale': 1.6243037647445107, 'max_depth': 5, 'booster': 'gbtree', 'scale_pos_weight': 2.72517433705                                                                     8133, 'alpha': 3.225047571511661, 'lambda': 1.2229317141432496, 'eta': 0.4587846823267847, 'sampling_method': 'gradient_based', 'subsampl                                                                     e': 0.5483855650828218, 'gamma': 0.9568722778850987}. Best is trial 4 with value: 4.246843583964676.
[I 2023-12-21 02:29:56,419] Trial 53 pruned. Trial was pruned at iteration 1.
[I 2023-12-21 02:29:56,451] Trial 54 pruned. Trial was pruned at iteration 0.
[I 2023-12-21 02:29:56,485] Trial 55 pruned. Trial was pruned at iteration 0.
[I 2023-12-21 02:29:56,671] Trial 56 pruned. Trial was pruned at iteration 157.
[I 2023-12-21 02:29:56,704] Trial 57 pruned. Trial was pruned at iteration 0.
[I 2023-12-21 02:29:56,743] Trial 58 pruned. Trial was pruned at iteration 2.
[I 2023-12-21 02:29:56,898] Trial 59 finished with value: 4.819239185574699 and parameters: {'learning_rate': 0.41689274712971064, 'aft_l                                                                     oss_distribution': 'normal', 'aft_loss_distribution_scale': 2.906591204363192, 'max_depth': 7, 'booster': 'gbtree', 'scale_pos_weight': 7                                                                     .485110283045569, 'alpha': 7.701913271703178, 'lambda': 9.864330419682954, 'eta': 0.14915668212945862, 'sampling_method': 'uniform', 'sub                                                                     sample': 0.20127438261841918, 'gamma': 6.314859305659977}. Best is trial 4 with value: 4.246843583964676.
[I 2023-12-21 02:29:56,931] Trial 60 pruned. Trial was pruned at iteration 1.
[I 2023-12-21 02:29:56,965] Trial 61 pruned. Trial was pruned at iteration 1.
[I 2023-12-21 02:29:57,000] Trial 62 pruned. Trial was pruned at iteration 1.
[I 2023-12-21 02:29:57,098] Trial 63 finished with value: inf and parameters: {'learning_rate': 0.5246878939625298, 'aft_loss_distributio                                                                     n': 'normal', 'aft_loss_distribution_scale': 1.3110941084689378, 'max_depth': 8, 'booster': 'gbtree', 'scale_pos_weight': 6.3011991874998                                                                     38, 'alpha': 8.004984776646094, 'lambda': 9.491098375015588, 'eta': 0.10860317405296323, 'sampling_method': 'uniform', 'subsample': 0.163                                                                     79570383910838, 'gamma': 7.721987655089217}. Best is trial 4 with value: 4.246843583964676.
[I 2023-12-21 02:29:57,131] Trial 64 pruned. Trial was pruned at iteration 0.
[I 2023-12-21 02:29:57,167] Trial 65 pruned. Trial was pruned at iteration 0.
[I 2023-12-21 02:29:57,201] Trial 66 pruned. Trial was pruned at iteration 1.
[I 2023-12-21 02:29:57,234] Trial 67 pruned. Trial was pruned at iteration 0.
[I 2023-12-21 02:29:57,268] Trial 68 pruned. Trial was pruned at iteration 0.
[I 2023-12-21 02:29:57,301] Trial 69 pruned. Trial was pruned at iteration 0.
[I 2023-12-21 02:29:57,336] Trial 70 pruned. Trial was pruned at iteration 0.
[I 2023-12-21 02:29:58,398] Trial 71 finished with value: inf and parameters: {'learning_rate': 0.703670897424805, 'aft_loss_distribution                                                                     ': 'normal', 'aft_loss_distribution_scale': 1.0347540442223733, 'max_depth': 8, 'booster': 'dart', 'scale_pos_weight': 1.2931751781560041                                                                     , 'alpha': 9.840573168762079, 'lambda': 8.68213406179308, 'eta': 0.6602241221831078, 'sampling_method': 'uniform', 'subsample': 0.2331663                                                                     496075247, 'gamma': 8.020184651996901}. Best is trial 4 with value: 4.246843583964676.
[I 2023-12-21 02:29:58,432] Trial 72 pruned. Trial was pruned at iteration 0.
[I 2023-12-21 02:29:59,766] Trial 73 finished with value: inf and parameters: {'learning_rate': 0.8277900739526077, 'aft_loss_distributio                                                                     n': 'normal', 'aft_loss_distribution_scale': 1.4916704797193496, 'max_depth': 8, 'booster': 'dart', 'scale_pos_weight': 0.969445871858934                                                                     3, 'alpha': 9.26551182168435, 'lambda': 9.961890570500564, 'eta': 0.933525357025815, 'sampling_method': 'uniform', 'subsample': 0.3247984                                                                     156719889, 'gamma': 9.004267492562692}. Best is trial 4 with value: 4.246843583964676.
[I 2023-12-21 02:30:00,874] Trial 74 finished with value: inf and parameters: {'learning_rate': 0.7279643772024802, 'aft_loss_distributio                                                                     n': 'normal', 'aft_loss_distribution_scale': 0.918479094225695, 'max_depth': 7, 'booster': 'dart', 'scale_pos_weight': 0.3995397257980905                                                                     , 'alpha': 1.023869496166559, 'lambda': 9.489131172266621, 'eta': 0.5310274967623528, 'sampling_method': 'uniform', 'subsample': 0.080983                                                                     01111358426, 'gamma': 7.016852924618034}. Best is trial 4 with value: 4.246843583964676.
[I 2023-12-21 02:30:00,910] Trial 75 pruned. Trial was pruned at iteration 1.
[I 2023-12-21 02:30:00,948] Trial 76 pruned. Trial was pruned at iteration 0.
[I 2023-12-21 02:30:00,983] Trial 77 pruned. Trial was pruned at iteration 0.
[I 2023-12-21 02:30:01,018] Trial 78 pruned. Trial was pruned at iteration 0.
[I 2023-12-21 02:30:01,055] Trial 79 pruned. Trial was pruned at iteration 0.
[I 2023-12-21 02:30:01,089] Trial 80 pruned. Trial was pruned at iteration 0.
[I 2023-12-21 02:30:01,130] Trial 81 pruned. Trial was pruned at iteration 3.
[I 2023-12-21 02:30:01,167] Trial 82 pruned. Trial was pruned at iteration 0.
[I 2023-12-21 02:30:01,206] Trial 83 pruned. Trial was pruned at iteration 1.
[I 2023-12-21 02:30:01,243] Trial 84 pruned. Trial was pruned at iteration 1.
[I 2023-12-21 02:30:01,279] Trial 85 pruned. Trial was pruned at iteration 0.
[I 2023-12-21 02:30:01,316] Trial 86 pruned. Trial was pruned at iteration 1.
[I 2023-12-21 02:30:01,500] Trial 87 finished with value: 4.6327829039054516 and parameters: {'learning_rate': 0.22103694652185488, 'aft_                                                                     loss_distribution': 'logistic', 'aft_loss_distribution_scale': 1.414330648048801, 'max_depth': 8, 'booster': 'gbtree', 'scale_pos_weight'                                                                     : 5.523308372890457, 'alpha': 8.185645002943176, 'lambda': 0.0748683932838822, 'eta': 0.5466800173813561, 'sampling_method': 'uniform', '                                                                     subsample': 0.27864666020769424, 'gamma': 9.644833182450004}. Best is trial 4 with value: 4.246843583964676.
[I 2023-12-21 02:30:01,535] Trial 88 pruned. Trial was pruned at iteration 0.
[I 2023-12-21 02:30:01,571] Trial 89 pruned. Trial was pruned at iteration 0.
[I 2023-12-21 02:30:01,606] Trial 90 pruned. Trial was pruned at iteration 0.
[I 2023-12-21 02:30:01,725] Trial 91 finished with value: 4.684863661325781 and parameters: {'learning_rate': 0.6764942571510018, 'aft_lo                                                                     ss_distribution': 'logistic', 'aft_loss_distribution_scale': 1.5137385921519375, 'max_depth': 8, 'booster': 'gbtree', 'scale_pos_weight':                                                                      6.600658197023422, 'alpha': 8.519674180176327, 'lambda': 0.04177324823929342, 'eta': 0.5326216957865157, 'sampling_method': 'uniform', '                                                                     subsample': 0.2620912740542923, 'gamma': 8.508154781801629}. Best is trial 4 with value: 4.246843583964676.
[I 2023-12-21 02:30:01,761] Trial 92 pruned. Trial was pruned at iteration 0.
[I 2023-12-21 02:30:01,795] Trial 93 pruned. Trial was pruned at iteration 0.
[I 2023-12-21 02:30:01,830] Trial 94 pruned. Trial was pruned at iteration 0.
[I 2023-12-21 02:30:01,868] Trial 95 pruned. Trial was pruned at iteration 0.
[I 2023-12-21 02:30:01,903] Trial 96 pruned. Trial was pruned at iteration 0.
[I 2023-12-21 02:30:01,937] Trial 97 pruned. Trial was pruned at iteration 0.
[I 2023-12-21 02:30:01,973] Trial 98 pruned. Trial was pruned at iteration 0.
[I 2023-12-21 02:30:02,159] Trial 99 pruned. Trial was pruned at iteration 157.
[I 2023-12-21 02:30:02,197] Trial 100 pruned. Trial was pruned at iteration 0.
[I 2023-12-21 02:30:02,234] Trial 101 pruned. Trial was pruned at iteration 0.
[I 2023-12-21 02:30:02,269] Trial 102 pruned. Trial was pruned at iteration 0.
[I 2023-12-21 02:30:02,306] Trial 103 pruned. Trial was pruned at iteration 0.
[I 2023-12-21 02:30:02,341] Trial 104 pruned. Trial was pruned at iteration 0.
[I 2023-12-21 02:30:02,377] Trial 105 pruned. Trial was pruned at iteration 0.
[I 2023-12-21 02:30:02,416] Trial 106 pruned. Trial was pruned at iteration 0.
[I 2023-12-21 02:30:02,452] Trial 107 pruned. Trial was pruned at iteration 0.
[I 2023-12-21 02:30:02,488] Trial 108 pruned. Trial was pruned at iteration 0.
[I 2023-12-21 02:30:02,525] Trial 109 pruned. Trial was pruned at iteration 0.
[I 2023-12-21 02:30:02,560] Trial 110 pruned. Trial was pruned at iteration 0.
[I 2023-12-21 02:30:02,597] Trial 111 pruned. Trial was pruned at iteration 0.
[I 2023-12-21 02:30:02,633] Trial 112 pruned. Trial was pruned at iteration 0.
[I 2023-12-21 02:30:02,669] Trial 113 pruned. Trial was pruned at iteration 0.
[I 2023-12-21 02:30:02,810] Trial 114 finished with value: 4.5493720292422415 and parameters: {'learning_rate': 0.5165986219816426, 'aft_                                                                     loss_distribution': 'normal', 'aft_loss_distribution_scale': 2.0518181603190957, 'max_depth': 9, 'booster': 'gbtree', 'scale_pos_weight':                                                                      1.2162100744988635, 'alpha': 8.703796215901335, 'lambda': 4.299116132656835, 'eta': 0.06685809810818065, 'sampling_method': 'uniform', '                                                                     subsample': 0.17444462960183876, 'gamma': 9.782790852905665}. Best is trial 4 with value: 4.246843583964676.
[I 2023-12-21 02:30:02,930] Trial 115 finished with value: 4.556052157704726 and parameters: {'learning_rate': 0.6501067366957041, 'aft_l                                                                     oss_distribution': 'normal', 'aft_loss_distribution_scale': 2.0653060133458228, 'max_depth': 10, 'booster': 'gbtree', 'scale_pos_weight':                                                                      1.6176328507152429, 'alpha': 9.075569153569196, 'lambda': 4.281713014295027, 'eta': 0.08385446180506423, 'sampling_method': 'uniform', '                                                                     subsample': 0.11113033866457728, 'gamma': 9.661613544492672}. Best is trial 4 with value: 4.246843583964676.
[I 2023-12-21 02:30:03,093] Trial 116 finished with value: 4.554425707704021 and parameters: {'learning_rate': 0.6532628522724161, 'aft_l                                                                     oss_distribution': 'normal', 'aft_loss_distribution_scale': 2.060515748512285, 'max_depth': 10, 'booster': 'gbtree', 'scale_pos_weight':                                                                      1.1901392684806698, 'alpha': 9.0875284819285, 'lambda': 4.926426891758184, 'eta': 0.07167200088009214, 'sampling_method': 'uniform', 'sub                                                                     sample': 0.10161947068739868, 'gamma': 9.839369009621663}. Best is trial 4 with value: 4.246843583964676.
[I 2023-12-21 02:30:03,294] Trial 117 pruned. Trial was pruned at iteration 157.
[I 2023-12-21 02:30:03,332] Trial 118 pruned. Trial was pruned at iteration 0.
[I 2023-12-21 02:30:03,431] Trial 119 finished with value: inf and parameters: {'learning_rate': 0.6527896075077644, 'aft_loss_distributi                                                                     on': 'normal', 'aft_loss_distribution_scale': 1.8355229648068294, 'max_depth': 10, 'booster': 'gbtree', 'scale_pos_weight': 2.28635850003                                                                     76316, 'alpha': 9.365981223582072, 'lambda': 4.753530325833734, 'eta': 0.00541466505669308, 'sampling_method': 'uniform', 'subsample': 0.                                                                     1058217573202555, 'gamma': 9.977465211323963}. Best is trial 4 with value: 4.246843583964676.
[I 2023-12-21 02:30:03,467] Trial 120 pruned. Trial was pruned at iteration 0.
[I 2023-12-21 02:30:03,509] Trial 121 pruned. Trial was pruned at iteration 4.
[I 2023-12-21 02:30:03,558] Trial 122 pruned. Trial was pruned at iteration 4.
[I 2023-12-21 02:30:03,600] Trial 123 pruned. Trial was pruned at iteration 1.
