[I 2023-12-21 03:10:10,902] Trial 375 finished with value: inf and parameters: {'learning_rate': 0.7059922288952123, 'aft_loss_distributi                                                                     on': 'normal', 'aft_loss_distribution_scale': 1.3687848450583273, 'max_depth': 6, 'booster': 'dart', 'scale_pos_weight': 2.42245707259404                                                                     7, 'alpha': 1.9264954747056307, 'lambda': 3.446014111822019, 'eta': 0.07731510436109823, 'sampling_method': 'uniform', 'subsample': 0.733                                                                     5308101427062, 'gamma': 4.372256707195903}. Best is trial 243 with value: 4.389970926437229.
[I 2023-12-21 03:10:10,952] Trial 376 pruned. Trial was pruned at iteration 0.
[I 2023-12-21 03:10:11,001] Trial 377 pruned. Trial was pruned at iteration 0.
[I 2023-12-21 03:10:11,049] Trial 378 pruned. Trial was pruned at iteration 0.
[I 2023-12-21 03:10:11,098] Trial 379 pruned. Trial was pruned at iteration 0.
[I 2023-12-21 03:10:11,148] Trial 380 pruned. Trial was pruned at iteration 0.
[I 2023-12-21 03:10:11,196] Trial 381 pruned. Trial was pruned at iteration 0.
[I 2023-12-21 03:10:11,247] Trial 382 pruned. Trial was pruned at iteration 0.
[I 2023-12-21 03:10:11,295] Trial 383 pruned. Trial was pruned at iteration 0.
[I 2023-12-21 03:10:11,349] Trial 384 pruned. Trial was pruned at iteration 0.
[I 2023-12-21 03:10:11,397] Trial 385 pruned. Trial was pruned at iteration 0.
[I 2023-12-21 03:10:11,452] Trial 386 pruned. Trial was pruned at iteration 1.
[I 2023-12-21 03:10:11,501] Trial 387 pruned. Trial was pruned at iteration 0.
[I 2023-12-21 03:10:11,549] Trial 388 pruned. Trial was pruned at iteration 0.
[I 2023-12-21 03:10:11,598] Trial 389 pruned. Trial was pruned at iteration 0.
[I 2023-12-21 03:10:11,664] Trial 390 pruned. Trial was pruned at iteration 2.
[I 2023-12-21 03:10:11,714] Trial 391 pruned. Trial was pruned at iteration 0.
[I 2023-12-21 03:10:11,765] Trial 392 pruned. Trial was pruned at iteration 0.
[I 2023-12-21 03:10:11,814] Trial 393 pruned. Trial was pruned at iteration 0.
[I 2023-12-21 03:10:11,867] Trial 394 pruned. Trial was pruned at iteration 0.
[I 2023-12-21 03:10:11,916] Trial 395 pruned. Trial was pruned at iteration 0.
[I 2023-12-21 03:10:11,965] Trial 396 pruned. Trial was pruned at iteration 0.
[I 2023-12-21 03:10:12,014] Trial 397 pruned. Trial was pruned at iteration 0.
[I 2023-12-21 03:10:12,065] Trial 398 pruned. Trial was pruned at iteration 0.
[I 2023-12-21 03:10:12,127] Trial 399 pruned. Trial was pruned at iteration 0.
[I 2023-12-21 03:10:13,134] Trial 400 finished with value: inf and parameters: {'learning_rate': 0.9984798520062141, 'aft_loss_distributi                                                                     on': 'normal', 'aft_loss_distribution_scale': 1.2591975015769292, 'max_depth': 8, 'booster': 'dart', 'scale_pos_weight': 1.62196295514996                                                                     44, 'alpha': 9.153113461773586, 'lambda': 3.3164454423878413, 'eta': 0.6286348536859223, 'sampling_method': 'uniform', 'subsample': 0.818                                                                     9790991369149, 'gamma': 3.2901061900711768}. Best is trial 243 with value: 4.389970926437229.
[I 2023-12-21 03:10:13,185] Trial 401 pruned. Trial was pruned at iteration 0.
[I 2023-12-21 03:10:13,236] Trial 402 pruned. Trial was pruned at iteration 0.
[I 2023-12-21 03:10:13,285] Trial 403 pruned. Trial was pruned at iteration 0.
[I 2023-12-21 03:10:13,335] Trial 404 pruned. Trial was pruned at iteration 0.
[I 2023-12-21 03:10:13,384] Trial 405 pruned. Trial was pruned at iteration 0.
[I 2023-12-21 03:10:13,435] Trial 406 pruned. Trial was pruned at iteration 0.
[I 2023-12-21 03:10:13,485] Trial 407 pruned. Trial was pruned at iteration 0.
[I 2023-12-21 03:10:13,536] Trial 408 pruned. Trial was pruned at iteration 0.
[I 2023-12-21 03:10:13,585] Trial 409 pruned. Trial was pruned at iteration 0.
[I 2023-12-21 03:10:13,647] Trial 410 pruned. Trial was pruned at iteration 1.
[I 2023-12-21 03:10:13,696] Trial 411 pruned. Trial was pruned at iteration 0.
[I 2023-12-21 03:10:13,748] Trial 412 pruned. Trial was pruned at iteration 0.
[I 2023-12-21 03:10:13,797] Trial 413 pruned. Trial was pruned at iteration 0.
[I 2023-12-21 03:10:13,847] Trial 414 pruned. Trial was pruned at iteration 0.
[I 2023-12-21 03:10:13,898] Trial 415 pruned. Trial was pruned at iteration 0.
[I 2023-12-21 03:10:13,947] Trial 416 pruned. Trial was pruned at iteration 0.
[I 2023-12-21 03:10:13,997] Trial 417 pruned. Trial was pruned at iteration 0.
[I 2023-12-21 03:10:14,049] Trial 418 pruned. Trial was pruned at iteration 0.
[I 2023-12-21 03:10:14,099] Trial 419 pruned. Trial was pruned at iteration 0.
[I 2023-12-21 03:10:14,148] Trial 420 pruned. Trial was pruned at iteration 0.
[I 2023-12-21 03:10:14,198] Trial 421 pruned. Trial was pruned at iteration 0.
[I 2023-12-21 03:10:14,250] Trial 422 pruned. Trial was pruned at iteration 0.
[I 2023-12-21 03:10:14,302] Trial 423 pruned. Trial was pruned at iteration 0.
[I 2023-12-21 03:10:14,352] Trial 424 pruned. Trial was pruned at iteration 0.
[I 2023-12-21 03:10:14,420] Trial 425 pruned. Trial was pruned at iteration 2.
[I 2023-12-21 03:10:14,476] Trial 426 pruned. Trial was pruned at iteration 1.
[I 2023-12-21 03:10:14,527] Trial 427 pruned. Trial was pruned at iteration 0.
[I 2023-12-21 03:10:14,577] Trial 428 pruned. Trial was pruned at iteration 0.
[I 2023-12-21 03:10:15,554] Trial 429 finished with value: inf and parameters: {'learning_rate': 0.9724306606294426, 'aft_loss_distributi                                                                     on': 'normal', 'aft_loss_distribution_scale': 1.523077226575332, 'max_depth': 8, 'booster': 'dart', 'scale_pos_weight': 4.154437108115573                                                                     , 'alpha': 0.853696600236019, 'lambda': 3.196559659364584, 'eta': 0.39740915096915025, 'sampling_method': 'uniform', 'subsample': 0.84819                                                                     79893255949, 'gamma': 3.795907494911001}. Best is trial 243 with value: 4.389970926437229.
[I 2023-12-21 03:10:15,606] Trial 430 pruned. Trial was pruned at iteration 0.
[I 2023-12-21 03:10:15,657] Trial 431 pruned. Trial was pruned at iteration 0.
[I 2023-12-21 03:10:15,710] Trial 432 pruned. Trial was pruned at iteration 0.
[I 2023-12-21 03:10:15,762] Trial 433 pruned. Trial was pruned at iteration 0.
[I 2023-12-21 03:10:15,813] Trial 434 pruned. Trial was pruned at iteration 0.
[I 2023-12-21 03:10:15,864] Trial 435 pruned. Trial was pruned at iteration 0.
[I 2023-12-21 03:10:15,917] Trial 436 pruned. Trial was pruned at iteration 1.
[I 2023-12-21 03:10:15,968] Trial 437 pruned. Trial was pruned at iteration 0.
[I 2023-12-21 03:10:16,021] Trial 438 pruned. Trial was pruned at iteration 0.
[I 2023-12-21 03:10:16,074] Trial 439 pruned. Trial was pruned at iteration 1.
[I 2023-12-21 03:10:16,141] Trial 440 pruned. Trial was pruned at iteration 1.
[I 2023-12-21 03:10:16,193] Trial 441 pruned. Trial was pruned at iteration 0.
[I 2023-12-21 03:10:16,246] Trial 442 pruned. Trial was pruned at iteration 0.
[I 2023-12-21 03:10:16,297] Trial 443 pruned. Trial was pruned at iteration 0.
[I 2023-12-21 03:10:16,350] Trial 444 pruned. Trial was pruned at iteration 0.
[I 2023-12-21 03:10:16,405] Trial 445 pruned. Trial was pruned at iteration 1.
[I 2023-12-21 03:10:16,456] Trial 446 pruned. Trial was pruned at iteration 0.
[I 2023-12-21 03:10:16,509] Trial 447 pruned. Trial was pruned at iteration 0.
[I 2023-12-21 03:10:16,560] Trial 448 pruned. Trial was pruned at iteration 0.
[I 2023-12-21 03:10:16,611] Trial 449 pruned. Trial was pruned at iteration 0.
[I 2023-12-21 03:10:17,640] Trial 450 finished with value: inf and parameters: {'learning_rate': 0.9166331266976132, 'aft_loss_distributi                                                                     on': 'normal', 'aft_loss_distribution_scale': 1.4262885111904062, 'max_depth': 4, 'booster': 'dart', 'scale_pos_weight': 4.45075069163553                                                                     1, 'alpha': 9.596006616159094, 'lambda': 3.5647955711484527, 'eta': 0.4138694757036378, 'sampling_method': 'uniform', 'subsample': 0.2729                                                                     5104253160135, 'gamma': 3.358855298312129}. Best is trial 243 with value: 4.389970926437229.
[I 2023-12-21 03:10:17,696] Trial 451 pruned. Trial was pruned at iteration 0.
[I 2023-12-21 03:10:17,748] Trial 452 pruned. Trial was pruned at iteration 0.
[I 2023-12-21 03:10:17,801] Trial 453 pruned. Trial was pruned at iteration 1.
[I 2023-12-21 03:10:17,852] Trial 454 pruned. Trial was pruned at iteration 0.
[I 2023-12-21 03:10:17,904] Trial 455 pruned. Trial was pruned at iteration 0.
[I 2023-12-21 03:10:17,956] Trial 456 pruned. Trial was pruned at iteration 0.
[I 2023-12-21 03:10:18,016] Trial 457 pruned. Trial was pruned at iteration 0.
[I 2023-12-21 03:10:18,068] Trial 458 pruned. Trial was pruned at iteration 0.
[I 2023-12-21 03:10:18,120] Trial 459 pruned. Trial was pruned at iteration 0.
[I 2023-12-21 03:10:18,173] Trial 460 pruned. Trial was pruned at iteration 0.
[I 2023-12-21 03:10:18,226] Trial 461 pruned. Trial was pruned at iteration 0.
[I 2023-12-21 03:10:18,278] Trial 462 pruned. Trial was pruned at iteration 0.
[I 2023-12-21 03:10:18,331] Trial 463 pruned. Trial was pruned at iteration 0.
[I 2023-12-21 03:10:18,385] Trial 464 pruned. Trial was pruned at iteration 0.
[I 2023-12-21 03:10:19,548] Trial 465 finished with value: inf and parameters: {'learning_rate': 0.7993540495533158, 'aft_loss_distributi                                                                     on': 'normal', 'aft_loss_distribution_scale': 1.2839307959295567, 'max_depth': 8, 'booster': 'dart', 'scale_pos_weight': 1.34212161296231                                                                     15, 'alpha': 6.5617644175490515, 'lambda': 3.7121892398585015, 'eta': 0.1094400028822611, 'sampling_method': 'uniform', 'subsample': 0.18                                                                     60728925326327, 'gamma': 3.8154981129143724}. Best is trial 243 with value: 4.389970926437229.
[I 2023-12-21 03:10:19,606] Trial 466 pruned. Trial was pruned at iteration 0.
[I 2023-12-21 03:10:19,659] Trial 467 pruned. Trial was pruned at iteration 0.
[I 2023-12-21 03:10:19,711] Trial 468 pruned. Trial was pruned at iteration 0.
[I 2023-12-21 03:10:19,762] Trial 469 pruned. Trial was pruned at iteration 0.
[I 2023-12-21 03:10:19,820] Trial 470 pruned. Trial was pruned at iteration 0.
[I 2023-12-21 03:10:19,872] Trial 471 pruned. Trial was pruned at iteration 0.
[I 2023-12-21 03:10:19,924] Trial 472 pruned. Trial was pruned at iteration 0.
[I 2023-12-21 03:10:19,979] Trial 473 pruned. Trial was pruned at iteration 0.
[I 2023-12-21 03:10:20,032] Trial 474 pruned. Trial was pruned at iteration 0.
[I 2023-12-21 03:10:20,084] Trial 475 pruned. Trial was pruned at iteration 0.
[I 2023-12-21 03:10:20,136] Trial 476 pruned. Trial was pruned at iteration 0.
[I 2023-12-21 03:10:20,191] Trial 477 pruned. Trial was pruned at iteration 0.
[I 2023-12-21 03:10:20,245] Trial 478 pruned. Trial was pruned at iteration 0.
[I 2023-12-21 03:10:20,297] Trial 479 pruned. Trial was pruned at iteration 0.
[I 2023-12-21 03:10:20,349] Trial 480 pruned. Trial was pruned at iteration 0.
[I 2023-12-21 03:10:20,401] Trial 481 pruned. Trial was pruned at iteration 0.
[I 2023-12-21 03:10:20,456] Trial 482 pruned. Trial was pruned at iteration 1.
[I 2023-12-21 03:10:20,513] Trial 483 pruned. Trial was pruned at iteration 1.
[I 2023-12-21 03:10:20,567] Trial 484 pruned. Trial was pruned at iteration 0.
[I 2023-12-21 03:10:20,619] Trial 485 pruned. Trial was pruned at iteration 0.
[I 2023-12-21 03:10:20,672] Trial 486 pruned. Trial was pruned at iteration 0.
[I 2023-12-21 03:10:21,621] Trial 487 finished with value: inf and parameters: {'learning_rate': 0.9028402562074758, 'aft_loss_distributi                                                                     on': 'normal', 'aft_loss_distribution_scale': 1.5806690879073841, 'max_depth': 10, 'booster': 'dart', 'scale_pos_weight': 1.3133211621158                                                                     756, 'alpha': 9.612951502654786, 'lambda': 3.328179498263084, 'eta': 0.39643715533817625, 'sampling_method': 'uniform', 'subsample': 0.27                                                                     45951526885501, 'gamma': 4.814603553771552}. Best is trial 243 with value: 4.389970926437229.
[I 2023-12-21 03:10:21,678] Trial 488 pruned. Trial was pruned at iteration 0.
[I 2023-12-21 03:10:21,731] Trial 489 pruned. Trial was pruned at iteration 0.
[I 2023-12-21 03:10:21,786] Trial 490 pruned. Trial was pruned at iteration 0.
[I 2023-12-21 03:10:21,840] Trial 491 pruned. Trial was pruned at iteration 0.
[I 2023-12-21 03:10:21,894] Trial 492 pruned. Trial was pruned at iteration 0.
[I 2023-12-21 03:10:21,947] Trial 493 pruned. Trial was pruned at iteration 0.
[I 2023-12-21 03:10:22,000] Trial 494 pruned. Trial was pruned at iteration 0.
[I 2023-12-21 03:10:22,055] Trial 495 pruned. Trial was pruned at iteration 0.
[I 2023-12-21 03:10:22,111] Trial 496 pruned. Trial was pruned at iteration 0.
[I 2023-12-21 03:10:22,165] Trial 497 pruned. Trial was pruned at iteration 0.
[I 2023-12-21 03:10:22,219] Trial 498 pruned. Trial was pruned at iteration 0.
[I 2023-12-21 03:10:22,275] Trial 499 pruned. Trial was pruned at iteration 0.
[W 2023-12-21 03:10:25,907] Trial 3 is omitted in visualization because its objective value is inf or nan.
[W 2023-12-21 03:10:25,908] Trial 4 is omitted in visualization because its objective value is inf or nan.
[W 2023-12-21 03:10:25,908] Trial 13 is omitted in visualization because its objective value is inf or nan.
[W 2023-12-21 03:10:25,908] Trial 15 is omitted in visualization because its objective value is inf or nan.
[W 2023-12-21 03:10:25,908] Trial 17 is omitted in visualization because its objective value is inf or nan.
[W 2023-12-21 03:10:25,908] Trial 46 is omitted in visualization because its objective value is inf or nan.
[W 2023-12-21 03:10:25,908] Trial 51 is omitted in visualization because its objective value is inf or nan.
[W 2023-12-21 03:10:25,908] Trial 61 is omitted in visualization because its objective value is inf or nan.
[W 2023-12-21 03:10:25,908] Trial 63 is omitted in visualization because its objective value is inf or nan.
[W 2023-12-21 03:10:25,908] Trial 91 is omitted in visualization because its objective value is inf or nan.
[W 2023-12-21 03:10:25,908] Trial 92 is omitted in visualization because its objective value is inf or nan.
[W 2023-12-21 03:10:25,908] Trial 96 is omitted in visualization because its objective value is inf or nan.
[W 2023-12-21 03:10:25,908] Trial 104 is omitted in visualization because its objective value is inf or nan.
[W 2023-12-21 03:10:25,908] Trial 114 is omitted in visualization because its objective value is inf or nan.
[W 2023-12-21 03:10:25,908] Trial 123 is omitted in visualization because its objective value is inf or nan.
[W 2023-12-21 03:10:25,908] Trial 124 is omitted in visualization because its objective value is inf or nan.
[W 2023-12-21 03:10:25,908] Trial 129 is omitted in visualization because its objective value is inf or nan.
[W 2023-12-21 03:10:25,908] Trial 131 is omitted in visualization because its objective value is inf or nan.
[W 2023-12-21 03:10:25,909] Trial 132 is omitted in visualization because its objective value is inf or nan.
[W 2023-12-21 03:10:25,909] Trial 135 is omitted in visualization because its objective value is inf or nan.
[W 2023-12-21 03:10:25,909] Trial 141 is omitted in visualization because its objective value is inf or nan.
[W 2023-12-21 03:10:25,909] Trial 142 is omitted in visualization because its objective value is inf or nan.
[W 2023-12-21 03:10:25,909] Trial 143 is omitted in visualization because its objective value is inf or nan.
[W 2023-12-21 03:10:25,909] Trial 144 is omitted in visualization because its objective value is inf or nan.
[W 2023-12-21 03:10:25,909] Trial 148 is omitted in visualization because its objective value is inf or nan.
[W 2023-12-21 03:10:25,909] Trial 159 is omitted in visualization because its objective value is inf or nan.
[W 2023-12-21 03:10:25,909] Trial 163 is omitted in visualization because its objective value is inf or nan.
[W 2023-12-21 03:10:25,909] Trial 170 is omitted in visualization because its objective value is inf or nan.
[W 2023-12-21 03:10:25,909] Trial 181 is omitted in visualization because its objective value is inf or nan.
[W 2023-12-21 03:10:25,909] Trial 183 is omitted in visualization because its objective value is inf or nan.
[W 2023-12-21 03:10:25,909] Trial 184 is omitted in visualization because its objective value is inf or nan.
[W 2023-12-21 03:10:25,909] Trial 190 is omitted in visualization because its objective value is inf or nan.
[W 2023-12-21 03:10:25,909] Trial 204 is omitted in visualization because its objective value is inf or nan.
[W 2023-12-21 03:10:25,909] Trial 212 is omitted in visualization because its objective value is inf or nan.
[W 2023-12-21 03:10:25,909] Trial 220 is omitted in visualization because its objective value is inf or nan.
[W 2023-12-21 03:10:25,909] Trial 222 is omitted in visualization because its objective value is inf or nan.
[W 2023-12-21 03:10:25,909] Trial 223 is omitted in visualization because its objective value is inf or nan.
[W 2023-12-21 03:10:25,909] Trial 232 is omitted in visualization because its objective value is inf or nan.
[W 2023-12-21 03:10:25,909] Trial 244 is omitted in visualization because its objective value is inf or nan.
[W 2023-12-21 03:10:25,909] Trial 251 is omitted in visualization because its objective value is inf or nan.
[W 2023-12-21 03:10:25,909] Trial 252 is omitted in visualization because its objective value is inf or nan.
[W 2023-12-21 03:10:25,910] Trial 263 is omitted in visualization because its objective value is inf or nan.
[W 2023-12-21 03:10:25,910] Trial 272 is omitted in visualization because its objective value is inf or nan.
[W 2023-12-21 03:10:25,910] Trial 273 is omitted in visualization because its objective value is inf or nan.
[W 2023-12-21 03:10:25,910] Trial 336 is omitted in visualization because its objective value is inf or nan.
[W 2023-12-21 03:10:25,910] Trial 339 is omitted in visualization because its objective value is inf or nan.
[W 2023-12-21 03:10:25,910] Trial 346 is omitted in visualization because its objective value is inf or nan.
[W 2023-12-21 03:10:25,910] Trial 356 is omitted in visualization because its objective value is inf or nan.
[W 2023-12-21 03:10:25,910] Trial 365 is omitted in visualization because its objective value is inf or nan.
[W 2023-12-21 03:10:25,910] Trial 375 is omitted in visualization because its objective value is inf or nan.
[W 2023-12-21 03:10:25,910] Trial 400 is omitted in visualization because its objective value is inf or nan.
[W 2023-12-21 03:10:25,910] Trial 429 is omitted in visualization because its objective value is inf or nan.
[W 2023-12-21 03:10:25,910] Trial 450 is omitted in visualization because its objective value is inf or nan.
[W 2023-12-21 03:10:25,910] Trial 465 is omitted in visualization because its objective value is inf or nan.
[W 2023-12-21 03:10:25,910] Trial 487 is omitted in visualization because its objective value is inf or nan.
exo-open: Cannot open display: .
/cvmfs/soft.computecanada.ca/gentoo/2020/usr/bin/xdg-open: line 871: x-www-browser: command not found
/cvmfs/soft.computecanada.ca/gentoo/2020/usr/bin/xdg-open: line 871: firefox: command not found
/cvmfs/soft.computecanada.ca/gentoo/2020/usr/bin/xdg-open: line 871: iceweasel: command not found
/cvmfs/soft.computecanada.ca/gentoo/2020/usr/bin/xdg-open: line 871: seamonkey: command not found
/cvmfs/soft.computecanada.ca/gentoo/2020/usr/bin/xdg-open: line 871: mozilla: command not found
/cvmfs/soft.computecanada.ca/gentoo/2020/usr/bin/xdg-open: line 871: epiphany: command not found
/cvmfs/soft.computecanada.ca/gentoo/2020/usr/bin/xdg-open: line 871: konqueror: command not found
/cvmfs/soft.computecanada.ca/gentoo/2020/usr/bin/xdg-open: line 871: chromium: command not found
/cvmfs/soft.computecanada.ca/gentoo/2020/usr/bin/xdg-open: line 871: chromium-browser: command not found
/cvmfs/soft.computecanada.ca/gentoo/2020/usr/bin/xdg-open: line 871: google-chrome: command not found
/cvmfs/soft.computecanada.ca/gentoo/2020/usr/bin/xdg-open: line 871: www-browser: command not found
/cvmfs/soft.computecanada.ca/gentoo/2020/usr/bin/xdg-open: line 871: links2: command not found
/home/lisat/.local/lib/python3.10/site-packages/xgboost/data.py:440: FutureWarning:

is_sparse is deprecated and will be removed in a future version. Check `isinstance(dtype, pd.SparseDtype)` instead.

[I 2023-12-21 03:10:31,584] A new study created in memory with name: no-name-8bfbeeef-a9f1-4d66-ad8b-e1272c92397c
[I 2023-12-21 03:10:33,877] Trial 0 finished with value: 6.142832159099428 and parameters: {'learning_rate': 0.6907241323739765, 'aft_los                                                                     s_distribution': 'logistic', 'aft_loss_distribution_scale': 7.7783086177554654, 'max_depth': 5, 'booster': 'dart', 'scale_pos_weight': 6.                                                                     194948532313095, 'alpha': 1.9470546678502423, 'lambda': 0.563603141211891, 'eta': 0.7686639144510851, 'sampling_method': 'gradient_based'                                                                     , 'subsample': 0.4976104789918783, 'gamma': 9.431701757554247}. Best is trial 0 with value: 6.142832159099428.
