[I 2023-12-19 04:48:15,473] Trial 107 pruned. Trial was pruned at iteration 0.
[I 2023-12-19 04:48:15,554] Trial 108 pruned. Trial was pruned at iteration 0.
[I 2023-12-19 04:48:15,642] Trial 109 pruned. Trial was pruned at iteration 0.
[I 2023-12-19 04:48:15,749] Trial 110 pruned. Trial was pruned at iteration 1.
[I 2023-12-19 04:48:15,833] Trial 111 pruned. Trial was pruned at iteration 0.
[I 2023-12-19 04:48:15,913] Trial 112 pruned. Trial was pruned at iteration 0.
[I 2023-12-19 04:48:18,586] Trial 113 finished with value: inf and parameters: {'learning_rate': 0.692001109651619, 'aft_loss_distribution': 'normal', 'aft_loss_distribution_scale': 1.2466827850828641, 'max_depth': 7, 'booster': 'dart', 'scale_pos_weight': 0.6114931854621992, 'alpha': 3.7455309273599244, 'lambda': 2.596339311912192, 'eta': 0.8776065409051033, 'sampling_method': 'uniform', 'subsample': 0.8838817266755027, 'gamma': 3.32254385335014}. Best is trial 104 with value: 4.2020851603229525.
[I 2023-12-19 04:48:18,674] Trial 114 pruned. Trial was pruned at iteration 1.
[I 2023-12-19 04:48:18,776] Trial 115 pruned. Trial was pruned at iteration 1.
[I 2023-12-19 04:48:18,875] Trial 116 pruned. Trial was pruned at iteration 0.
[I 2023-12-19 04:48:18,955] Trial 117 pruned. Trial was pruned at iteration 0.
[I 2023-12-19 04:48:19,042] Trial 118 pruned. Trial was pruned at iteration 0.
[I 2023-12-19 04:48:19,124] Trial 119 pruned. Trial was pruned at iteration 0.
[I 2023-12-19 04:48:19,212] Trial 120 pruned. Trial was pruned at iteration 0.
[I 2023-12-19 04:48:19,394] Trial 121 pruned. Trial was pruned at iteration 8.
[I 2023-12-19 04:48:19,483] Trial 122 pruned. Trial was pruned at iteration 1.
[I 2023-12-19 04:48:19,571] Trial 123 pruned. Trial was pruned at iteration 0.
[I 2023-12-19 04:48:29,731] Trial 124 finished with value: 4.208004410034603 and parameters: {'learning_rate': 0.7679851132939096, 'aft_loss_distribution': 'normal', 'aft_loss_distribution_scale': 1.035844854771007, 'max_depth': 6, 'booster': 'dart', 'scale_pos_weight': 4.067326012626644, 'alpha': 2.2845768889476656, 'lambda': 7.54679327454958, 'eta': 0.4213582084212342, 'sampling_method': 'uniform', 'subsample': 0.855560755680993, 'gamma': 3.848161054941481}. Best is trial 104 with value: 4.2020851603229525.
[I 2023-12-19 04:48:46,615] Trial 125 finished with value: 4.210901369607043 and parameters: {'learning_rate': 0.7695032457608347, 'aft_loss_distribution': 'normal', 'aft_loss_distribution_scale': 1.1140282918735593, 'max_depth': 5, 'booster': 'dart', 'scale_pos_weight': 4.000417618262376, 'alpha': 2.3360169415321748, 'lambda': 7.177819924201835, 'eta': 0.43575467381807026, 'sampling_method': 'uniform', 'subsample': 0.8314526429288065, 'gamma': 4.293477214489274}. Best is trial 104 with value: 4.2020851603229525.
[I 2023-12-19 04:48:46,709] Trial 126 pruned. Trial was pruned at iteration 1.
[I 2023-12-19 04:48:46,794] Trial 127 pruned. Trial was pruned at iteration 0.
[I 2023-12-19 04:48:58,173] Trial 128 finished with value: 4.219312393416835 and parameters: {'learning_rate': 0.764230981942869, 'aft_loss_distribution': 'normal', 'aft_loss_distribution_scale': 1.1432890548597539, 'max_depth': 5, 'booster': 'dart', 'scale_pos_weight': 4.389923860852278, 'alpha': 2.2433669868695474, 'lambda': 8.02559690399118, 'eta': 0.4677496883726464, 'sampling_method': 'uniform', 'subsample': 0.810444290525743, 'gamma': 4.597864821314893}. Best is trial 104 with value: 4.2020851603229525.
[I 2023-12-19 04:48:58,277] Trial 129 pruned. Trial was pruned at iteration 0.
[I 2023-12-19 04:48:58,359] Trial 130 pruned. Trial was pruned at iteration 0.
[I 2023-12-19 04:48:58,453] Trial 131 pruned. Trial was pruned at iteration 1.
[I 2023-12-19 04:48:58,540] Trial 132 pruned. Trial was pruned at iteration 0.
[I 2023-12-19 04:48:58,636] Trial 133 pruned. Trial was pruned at iteration 0.
[I 2023-12-19 04:49:11,758] Trial 134 finished with value: 4.242265931203513 and parameters: {'learning_rate': 0.7674515084169518, 'aft_loss_distribution': 'normal', 'aft_loss_distribution_scale': 1.25460789510131, 'max_depth': 6, 'booster': 'dart', 'scale_pos_weight': 3.6503754225537124, 'alpha': 1.4634940161584984, 'lambda': 6.665710578966674, 'eta': 0.434283315204432, 'sampling_method': 'uniform', 'subsample': 0.8548721540653473, 'gamma': 3.6444777636146455}. Best is trial 104 with value: 4.2020851603229525.
[I 2023-12-19 04:49:11,861] Trial 135 pruned. Trial was pruned at iteration 2.
[I 2023-12-19 04:49:11,948] Trial 136 pruned. Trial was pruned at iteration 0.
[I 2023-12-19 04:49:12,033] Trial 137 pruned. Trial was pruned at iteration 0.
[I 2023-12-19 04:49:18,433] Trial 138 finished with value: 4.215930659854754 and parameters: {'learning_rate': 0.8495650736782868, 'aft_loss_distribution': 'normal', 'aft_loss_distribution_scale': 0.964697865158017, 'max_depth': 6, 'booster': 'dart', 'scale_pos_weight': 5.314070133760666, 'alpha': 1.7530645598054226, 'lambda': 6.6694133799866755, 'eta': 0.40927600485167753, 'sampling_method': 'uniform', 'subsample': 0.8513111155702823, 'gamma': 5.401361231015953}. Best is trial 104 with value: 4.2020851603229525.
[I 2023-12-19 04:49:18,528] Trial 139 pruned. Trial was pruned at iteration 0.
[I 2023-12-19 04:49:18,635] Trial 140 pruned. Trial was pruned at iteration 2.
[I 2023-12-19 04:49:24,353] Trial 141 pruned. Trial was pruned at iteration 77.
[I 2023-12-19 04:49:28,695] Trial 142 finished with value: inf and parameters: {'learning_rate': 0.9196493815242858, 'aft_loss_distribution': 'normal', 'aft_loss_distribution_scale': 0.9416573201451122, 'max_depth': 6, 'booster': 'dart', 'scale_pos_weight': 4.855379965128347, 'alpha': 1.8383145050612844, 'lambda': 7.460133597389062, 'eta': 0.10788151812232911, 'sampling_method': 'uniform', 'subsample': 0.8922964712657869, 'gamma': 4.246489451155362}. Best is trial 104 with value: 4.2020851603229525.
[I 2023-12-19 04:49:28,779] Trial 143 pruned. Trial was pruned at iteration 0.
[I 2023-12-19 04:49:28,862] Trial 144 pruned. Trial was pruned at iteration 0.
[I 2023-12-19 04:49:28,953] Trial 145 pruned. Trial was pruned at iteration 0.
[I 2023-12-19 04:49:29,037] Trial 146 pruned. Trial was pruned at iteration 0.
[I 2023-12-19 04:49:29,127] Trial 147 pruned. Trial was pruned at iteration 0.
[I 2023-12-19 04:49:32,543] Trial 148 finished with value: inf and parameters: {'learning_rate': 0.7854587028983097, 'aft_loss_distribution': 'normal', 'aft_loss_distribution_scale': 1.1095081846779802, 'max_depth': 6, 'booster': 'dart', 'scale_pos_weight': 3.519179614048226, 'alpha': 8.846107849446927, 'lambda': 6.0600128796933035, 'eta': 0.09145431758833124, 'sampling_method': 'uniform', 'subsample': 0.38332616311675183, 'gamma': 1.9802912628951999}. Best is trial 104 with value: 4.2020851603229525.
[I 2023-12-19 04:49:32,646] Trial 149 pruned. Trial was pruned at iteration 2.
[I 2023-12-19 04:49:32,736] Trial 150 pruned. Trial was pruned at iteration 0.
[I 2023-12-19 04:49:32,831] Trial 151 pruned. Trial was pruned at iteration 1.
[I 2023-12-19 04:49:32,927] Trial 152 pruned. Trial was pruned at iteration 0.
[I 2023-12-19 04:49:33,021] Trial 153 pruned. Trial was pruned at iteration 0.
[I 2023-12-19 04:49:33,112] Trial 154 pruned. Trial was pruned at iteration 0.
[I 2023-12-19 04:49:33,205] Trial 155 pruned. Trial was pruned at iteration 0.
[I 2023-12-19 04:49:33,318] Trial 156 pruned. Trial was pruned at iteration 2.
[I 2023-12-19 04:49:33,415] Trial 157 pruned. Trial was pruned at iteration 0.
[I 2023-12-19 04:49:33,518] Trial 158 pruned. Trial was pruned at iteration 0.
[I 2023-12-19 04:49:33,636] Trial 159 pruned. Trial was pruned at iteration 1.
[I 2023-12-19 04:49:33,730] Trial 160 pruned. Trial was pruned at iteration 0.
[I 2023-12-19 04:49:33,822] Trial 161 pruned. Trial was pruned at iteration 0.
[I 2023-12-19 04:49:33,914] Trial 162 pruned. Trial was pruned at iteration 0.
[I 2023-12-19 04:49:34,007] Trial 163 pruned. Trial was pruned at iteration 0.
[I 2023-12-19 04:49:34,103] Trial 164 pruned. Trial was pruned at iteration 0.
[I 2023-12-19 04:49:34,201] Trial 165 pruned. Trial was pruned at iteration 1.
[I 2023-12-19 04:49:34,295] Trial 166 pruned. Trial was pruned at iteration 0.
[I 2023-12-19 04:49:34,387] Trial 167 pruned. Trial was pruned at iteration 0.
[I 2023-12-19 04:49:34,487] Trial 168 pruned. Trial was pruned at iteration 0.
[I 2023-12-19 04:49:34,587] Trial 169 pruned. Trial was pruned at iteration 0.
[I 2023-12-19 04:49:34,676] Trial 170 pruned. Trial was pruned at iteration 0.
[I 2023-12-19 04:49:34,772] Trial 171 pruned. Trial was pruned at iteration 0.
[I 2023-12-19 04:49:34,884] Trial 172 pruned. Trial was pruned at iteration 2.
[I 2023-12-19 04:49:34,987] Trial 173 pruned. Trial was pruned at iteration 0.
[I 2023-12-19 04:49:35,089] Trial 174 pruned. Trial was pruned at iteration 0.
[I 2023-12-19 04:49:40,817] Trial 175 finished with value: inf and parameters: {'learning_rate': 0.8173015412896956, 'aft_loss_distribution': 'normal', 'aft_loss_distribution_scale': 0.9852870026816359, 'max_depth': 5, 'booster': 'dart', 'scale_pos_weight': 2.44232400008345, 'alpha': 4.002479273964793, 'lambda': 0.8819865280334522, 'eta': 0.4929324482447296, 'sampling_method': 'uniform', 'subsample': 0.8399582384382337, 'gamma': 3.7458276503876666}. Best is trial 104 with value: 4.2020851603229525.
[I 2023-12-19 04:49:41,013] Trial 176 pruned. Trial was pruned at iteration 0.
[I 2023-12-19 04:49:41,180] Trial 177 pruned. Trial was pruned at iteration 0.
[I 2023-12-19 04:49:41,353] Trial 178 pruned. Trial was pruned at iteration 0.
[I 2023-12-19 04:49:41,451] Trial 179 pruned. Trial was pruned at iteration 0.
[I 2023-12-19 04:49:41,543] Trial 180 pruned. Trial was pruned at iteration 0.
[I 2023-12-19 04:49:41,653] Trial 181 pruned. Trial was pruned at iteration 2.
[I 2023-12-19 04:49:41,746] Trial 182 pruned. Trial was pruned at iteration 0.
[I 2023-12-19 04:49:41,845] Trial 183 pruned. Trial was pruned at iteration 1.
[I 2023-12-19 04:49:45,052] Trial 184 finished with value: inf and parameters: {'learning_rate': 0.8038378803862554, 'aft_loss_distribution': 'normal', 'aft_loss_distribution_scale': 1.1754439955770377, 'max_depth': 7, 'booster': 'dart', 'scale_pos_weight': 1.7283620508131965, 'alpha': 1.962300249087436, 'lambda': 0.37721732356766235, 'eta': 0.275138269063707, 'sampling_method': 'uniform', 'subsample': 0.7099932390272264, 'gamma': 7.786539307900834}. Best is trial 104 with value: 4.2020851603229525.
[I 2023-12-19 04:49:45,149] Trial 185 pruned. Trial was pruned at iteration 0.
[I 2023-12-19 04:49:45,249] Trial 186 pruned. Trial was pruned at iteration 1.
[I 2023-12-19 04:49:45,367] Trial 187 pruned. Trial was pruned at iteration 3.
[I 2023-12-19 04:49:45,468] Trial 188 pruned. Trial was pruned at iteration 1.
[I 2023-12-19 04:49:45,562] Trial 189 pruned. Trial was pruned at iteration 0.
[I 2023-12-19 04:49:45,661] Trial 190 pruned. Trial was pruned at iteration 0.
[I 2023-12-19 04:49:45,755] Trial 191 pruned. Trial was pruned at iteration 0.
[I 2023-12-19 04:49:45,849] Trial 192 pruned. Trial was pruned at iteration 0.
[I 2023-12-19 04:49:45,942] Trial 193 pruned. Trial was pruned at iteration 0.
[I 2023-12-19 04:49:46,053] Trial 194 pruned. Trial was pruned at iteration 0.
[I 2023-12-19 04:49:46,146] Trial 195 pruned. Trial was pruned at iteration 0.
[I 2023-12-19 04:49:46,246] Trial 196 pruned. Trial was pruned at iteration 0.
[I 2023-12-19 04:49:46,339] Trial 197 pruned. Trial was pruned at iteration 0.
[I 2023-12-19 04:50:11,302] Trial 198 finished with value: 4.222253446395776 and parameters: {'learning_rate': 0.771204768551333, 'aft_loss_distribution': 'normal', 'aft_loss_distribution_scale': 1.1284185197165613, 'max_depth': 8, 'booster': 'dart', 'scale_pos_weight': 0.4904811578488, 'alpha': 3.744593551375273, 'lambda': 7.462654665770014, 'eta': 0.30358819742966164, 'sampling_method': 'uniform', 'subsample': 0.6624984945484442, 'gamma': 6.94912938287232}. Best is trial 104 with value: 4.2020851603229525.
[I 2023-12-19 04:50:11,452] Trial 199 pruned. Trial was pruned at iteration 0.
[I 2023-12-19 04:50:11,583] Trial 200 pruned. Trial was pruned at iteration 0.
[I 2023-12-19 04:50:11,687] Trial 201 pruned. Trial was pruned at iteration 0.
[I 2023-12-19 04:50:11,789] Trial 202 pruned. Trial was pruned at iteration 1.
[I 2023-12-19 04:50:11,892] Trial 203 pruned. Trial was pruned at iteration 0.
[I 2023-12-19 04:50:12,009] Trial 204 pruned. Trial was pruned at iteration 0.
[I 2023-12-19 04:50:12,125] Trial 205 pruned. Trial was pruned at iteration 1.
[I 2023-12-19 04:50:12,228] Trial 206 pruned. Trial was pruned at iteration 0.
[I 2023-12-19 04:50:12,336] Trial 207 pruned. Trial was pruned at iteration 0.
[I 2023-12-19 04:50:12,432] Trial 208 pruned. Trial was pruned at iteration 0.
[I 2023-12-19 04:50:12,538] Trial 209 pruned. Trial was pruned at iteration 0.
[I 2023-12-19 04:50:12,641] Trial 210 pruned. Trial was pruned at iteration 0.
[I 2023-12-19 04:50:12,746] Trial 211 pruned. Trial was pruned at iteration 0.
[I 2023-12-19 04:50:12,843] Trial 212 pruned. Trial was pruned at iteration 0.
[I 2023-12-19 04:50:12,961] Trial 213 pruned. Trial was pruned at iteration 2.
[I 2023-12-19 04:50:13,073] Trial 214 pruned. Trial was pruned at iteration 0.
[I 2023-12-19 04:50:13,169] Trial 215 pruned. Trial was pruned at iteration 0.
[I 2023-12-19 04:50:13,268] Trial 216 pruned. Trial was pruned at iteration 0.
[I 2023-12-19 04:50:13,372] Trial 217 pruned. Trial was pruned at iteration 1.
[I 2023-12-19 04:50:13,475] Trial 218 pruned. Trial was pruned at iteration 0.
[I 2023-12-19 04:50:13,582] Trial 219 pruned. Trial was pruned at iteration 0.
[I 2023-12-19 04:50:13,687] Trial 220 pruned. Trial was pruned at iteration 0.
[I 2023-12-19 04:50:13,787] Trial 221 pruned. Trial was pruned at iteration 0.
[I 2023-12-19 04:50:13,888] Trial 222 pruned. Trial was pruned at iteration 0.
[I 2023-12-19 04:50:13,992] Trial 223 pruned. Trial was pruned at iteration 0.
[I 2023-12-19 04:50:14,115] Trial 224 pruned. Trial was pruned at iteration 1.
[I 2023-12-19 04:50:14,215] Trial 225 pruned. Trial was pruned at iteration 0.
[I 2023-12-19 04:50:14,319] Trial 226 pruned. Trial was pruned at iteration 0.
[I 2023-12-19 04:50:14,432] Trial 227 pruned. Trial was pruned at iteration 2.
[I 2023-12-19 04:50:14,528] Trial 228 pruned. Trial was pruned at iteration 0.
[I 2023-12-19 04:50:14,625] Trial 229 pruned. Trial was pruned at iteration 0.
[I 2023-12-19 04:50:14,738] Trial 230 pruned. Trial was pruned at iteration 1.
[I 2023-12-19 04:50:14,848] Trial 231 pruned. Trial was pruned at iteration 1.
[I 2023-12-19 04:50:19,832] Trial 232 finished with value: 4.215972981767694 and parameters: {'learning_rate': 0.850860842597712, 'aft_loss_distribution': 'normal', 'aft_loss_distribution_scale': 1.0306843172943068, 'max_depth': 6, 'booster': 'dart', 'scale_pos_weight': 5.11748120335321, 'alpha': 1.7394019935784717, 'lambda': 4.042971848667925, 'eta': 0.08227629170537507, 'sampling_method': 'uniform', 'subsample': 0.9281153671105973, 'gamma': 4.468139094185202}. Best is trial 104 with value: 4.2020851603229525.
[I 2023-12-19 04:50:19,941] Trial 233 pruned. Trial was pruned at iteration 0.
[I 2023-12-19 04:50:20,062] Trial 234 pruned. Trial was pruned at iteration 2.
[I 2023-12-19 04:50:24,375] Trial 235 finished with value: inf and parameters: {'learning_rate': 0.8037008888491483, 'aft_loss_distribution': 'normal', 'aft_loss_distribution_scale': 1.0271781895639658, 'max_depth': 6, 'booster': 'dart', 'scale_pos_weight': 4.310702166372024, 'alpha': 1.6890117009966714, 'lambda': 4.634981398443231, 'eta': 0.026204602671830245, 'sampling_method': 'uniform', 'subsample': 0.976888869165439, 'gamma': 8.657710911196213}. Best is trial 104 with value: 4.2020851603229525.
[I 2023-12-19 04:50:24,795] Trial 236 pruned. Trial was pruned at iteration 0.
[I 2023-12-19 04:50:24,946] Trial 237 pruned. Trial was pruned at iteration 0.
[I 2023-12-19 04:50:25,103] Trial 238 pruned. Trial was pruned at iteration 0.
[I 2023-12-19 04:50:25,315] Trial 239 pruned. Trial was pruned at iteration 2.
[I 2023-12-19 04:50:25,735] Trial 240 pruned. Trial was pruned at iteration 0.
[I 2023-12-19 04:50:26,488] Trial 241 pruned. Trial was pruned at iteration 11.
[I 2023-12-19 04:50:26,679] Trial 242 pruned. Trial was pruned at iteration 2.
[I 2023-12-19 04:50:29,471] Trial 243 pruned. Trial was pruned at iteration 65.
[I 2023-12-19 04:50:29,584] Trial 244 pruned. Trial was pruned at iteration 1.
[I 2023-12-19 04:50:29,716] Trial 245 pruned. Trial was pruned at iteration 2.
[I 2023-12-19 04:50:29,831] Trial 246 pruned. Trial was pruned at iteration 1.
[I 2023-12-19 04:50:30,088] Trial 247 pruned. Trial was pruned at iteration 10.
[I 2023-12-19 04:50:30,194] Trial 248 pruned. Trial was pruned at iteration 0.
[I 2023-12-19 04:50:30,297] Trial 249 pruned. Trial was pruned at iteration 0.
Completed hyperparameter tuning with best aft-nloglik = 4.2020851603229525.
Re-running the best trial... params = {'verbosity': 0, 'objective': 'survival:aft', 'eval_metric': 'aft-nloglik', 'tree_method': 'hist', 'learning_rate': 0.7629538714013749, 'aft_loss_distribution': 'normal', 'aft_loss_distribution_scale': 1.0111505784419628, 'max_depth': 6, 'booster': 'dart', 'scale_pos_weight': 0.23965751089021672, 'alpha': 3.573144006559367, 'lambda': 1.6713692886948424, 'eta': 0.1300606211666578, 'sampling_method': 'uniform', 'subsample': 0.9665902743551815, 'gamma': 4.520531383285241}
[W 2023-12-19 04:50:34,113] Trial 1 is omitted in visualization because its objective value is inf or nan.
[W 2023-12-19 04:50:34,122] Trial 26 is omitted in visualization because its objective value is inf or nan.
[W 2023-12-19 04:50:34,126] Trial 71 is omitted in visualization because its objective value is inf or nan.
[W 2023-12-19 04:50:34,137] Trial 72 is omitted in visualization because its objective value is inf or nan.
[W 2023-12-19 04:50:34,141] Trial 81 is omitted in visualization because its objective value is inf or nan.
[W 2023-12-19 04:50:34,143] Trial 85 is omitted in visualization because its objective value is inf or nan.
[W 2023-12-19 04:50:34,149] Trial 91 is omitted in visualization because its objective value is inf or nan.
[W 2023-12-19 04:50:34,151] Trial 95 is omitted in visualization because its objective value is inf or nan.
[W 2023-12-19 04:50:34,153] Trial 113 is omitted in visualization because its objective value is inf or nan.
[W 2023-12-19 04:50:34,154] Trial 142 is omitted in visualization because its objective value is inf or nan.
[W 2023-12-19 04:50:34,158] Trial 148 is omitted in visualization because its objective value is inf or nan.
[W 2023-12-19 04:50:34,160] Trial 175 is omitted in visualization because its objective value is inf or nan.
[W 2023-12-19 04:50:34,161] Trial 184 is omitted in visualization because its objective value is inf or nan.
[W 2023-12-19 04:50:34,166] Trial 235 is omitted in visualization because its objective value is inf or nan.
TRN1 | R2:0.402; p:0.0 | C:70.22 |3h:0.882 |6h:0.862 |9h:0.846 |12h:0.404 |15h:0.404 |18h:0.399 |24h:0.165 |48h:0.157 |72h:0.151 |1wk:0.021 |2wks:0.019 |1mon:0.013 |
TRN2 | R2:0.303; p:3.125e-68 | C:65.16 |3h:0.881 |6h:0.861 |9h:0.845 |12h:0.402 |15h:0.402 |18h:0.397 |24h:0.163 |48h:0.155 |72h:0.150 |1wk:0.020 |2wks:0.019 |1mon:0.013 |
VAL | R2:0.296; p:3.364e-65 | C:64.79 |3h:0.881 |6h:0.861 |9h:0.845 |12h:0.402 |15h:0.402 |18h:0.398 |24h:0.164 |48h:0.156 |72h:0.149 |1wk:0.021 |2wks:0.019 |1mon:0.013 |
TST | R2:0.123; p:2.437e-66 | C:55.96 |3h:0.879 |6h:0.857 |9h:0.839 |12h:0.396 |15h:0.396 |18h:0.386 |24h:0.124 |48h:0.120 |72h:0.116 |[I 2023-12-19 04:50:41,168] A new study created in memory with name: no-name-3bb36f8a-f442-4f28-9692-86cb3be6f1e9
1wk:0.019 |2wks:0.018 |1mon:0.013 |
/content/drive/MyDrive/intermediates2/res//outcome1_xgb-aft_inp22_k9_emb2_rdims8.json
Dimensionality reduced word embedding 3 with ['location_numeric', 'race_numeric', 'sex_numeric', 'body_part_numeric', 'product_1_numeric', 'product_2_numeric', 'drug_numeric', 'alcohol_numeric', 'month']
Dimensionality reduced word embedding 3 with ['location_numeric', 'race_numeric', 'sex_numeric', 'body_part_numeric', 'product_1_numeric', 'product_2_numeric', 'drug_numeric', 'alcohol_numeric', 'month']
Dimensionality reduced word embedding 3 with ['location_numeric', 'race_numeric', 'sex_numeric', 'body_part_numeric', 'product_1_numeric', 'product_2_numeric', 'drug_numeric', 'alcohol_numeric', 'month']
Dimensionality reduced word embedding 3 with ['location_numeric', 'race_numeric', 'sex_numeric', 'body_part_numeric', 'product_1_numeric', 'product_2_numeric', 'drug_numeric', 'alcohol_numeric', 'month']
trn1
trn2
val
tst
[I 2023-12-19 04:51:05,746] Trial 0 finished with value: 5.527101518315428 and parameters: {'learning_rate': 0.4754557128318718, 'aft_loss_distribution': 'normal', 'aft_loss_distribution_scale': 6.571679698590705, 'max_depth': 6, 'booster': 'dart', 'scale_pos_weight': 0.3595628004905299, 'alpha': 4.115486027089227, 'lambda': 3.9139683280987168, 'eta': 0.7595342064842984, 'sampling_method': 'uniform', 'subsample': 0.3530292293270757, 'gamma': 3.8550729155737526}. Best is trial 0 with value: 5.527101518315428.
[I 2023-12-19 04:51:07,277] Trial 1 finished with value: 5.685374095442586 and parameters: {'learning_rate': 0.16621025824641025, 'aft_loss_distribution': 'logistic', 'aft_loss_distribution_scale': 4.842186188637728, 'max_depth': 8, 'booster': 'gbtree', 'scale_pos_weight': 5.93820710545069, 'alpha': 4.428485148203065, 'lambda': 4.311658601320001, 'eta': 0.7340873295555317, 'sampling_method': 'uniform', 'subsample': 0.018683901800972496, 'gamma': 4.108174885002249}. Best is trial 0 with value: 5.527101518315428.
