[I 2023-12-21 02:31:55,767] Trial 53 finished with value: inf and parameters: {'learning_rate': 0.7294528675913976, 'aft_loss_distributio                                                                     n': 'normal', 'aft_loss_distribution_scale': 1.3379177517928613, 'max_depth': 9, 'booster': 'gbtree', 'scale_pos_weight': 5.7282792908775                                                                     98, 'alpha': 6.845052796139143, 'lambda': 3.6523010638420033, 'eta': 0.2776985177817565, 'sampling_method': 'gradient_based', 'subsample'                                                                     : 0.8046630311411879, 'gamma': 9.008019654449892}. Best is trial 43 with value: 4.2791945157099525.
[I 2023-12-21 02:31:55,802] Trial 54 pruned. Trial was pruned at iteration 1.
[I 2023-12-21 02:31:55,834] Trial 55 pruned. Trial was pruned at iteration 0.
[I 2023-12-21 02:31:55,867] Trial 56 pruned. Trial was pruned at iteration 1.
[I 2023-12-21 02:31:55,982] Trial 57 finished with value: inf and parameters: {'learning_rate': 0.8029390186230698, 'aft_loss_distributio                                                                     n': 'normal', 'aft_loss_distribution_scale': 0.8514159171640958, 'max_depth': 8, 'booster': 'gbtree', 'scale_pos_weight': 7.9555459751637                                                                     8, 'alpha': 7.011773950249655, 'lambda': 6.402693731508773, 'eta': 0.7041458702020689, 'sampling_method': 'gradient_based', 'subsample':                                                                      0.8439376748589588, 'gamma': 8.450697141230526}. Best is trial 43 with value: 4.2791945157099525.
[I 2023-12-21 02:31:56,013] Trial 58 pruned. Trial was pruned at iteration 0.
[I 2023-12-21 02:31:56,047] Trial 59 pruned. Trial was pruned at iteration 0.
[I 2023-12-21 02:31:56,079] Trial 60 pruned. Trial was pruned at iteration 0.
[I 2023-12-21 02:31:56,326] Trial 61 finished with value: 4.337892916848275 and parameters: {'learning_rate': 0.6435507024116137, 'aft_lo                                                                     ss_distribution': 'normal', 'aft_loss_distribution_scale': 1.4670172404223167, 'max_depth': 10, 'booster': 'gbtree', 'scale_pos_weight':                                                                      6.344301660099746, 'alpha': 8.662997560351755, 'lambda': 2.279781669149069, 'eta': 0.3024401712026573, 'sampling_method': 'gradient_based                                                                     ', 'subsample': 0.9376599473410295, 'gamma': 9.393696295387622}. Best is trial 43 with value: 4.2791945157099525.
[I 2023-12-21 02:31:56,359] Trial 62 pruned. Trial was pruned at iteration 0.
[I 2023-12-21 02:31:56,392] Trial 63 pruned. Trial was pruned at iteration 1.
[I 2023-12-21 02:31:56,426] Trial 64 pruned. Trial was pruned at iteration 0.
[I 2023-12-21 02:31:56,459] Trial 65 pruned. Trial was pruned at iteration 0.
[I 2023-12-21 02:31:56,493] Trial 66 pruned. Trial was pruned at iteration 0.
[I 2023-12-21 02:31:56,528] Trial 67 pruned. Trial was pruned at iteration 0.
[I 2023-12-21 02:31:56,562] Trial 68 pruned. Trial was pruned at iteration 0.
[I 2023-12-21 02:31:56,594] Trial 69 pruned. Trial was pruned at iteration 0.
[I 2023-12-21 02:31:56,629] Trial 70 pruned. Trial was pruned at iteration 1.
[I 2023-12-21 02:31:56,664] Trial 71 pruned. Trial was pruned at iteration 1.
[I 2023-12-21 02:31:56,704] Trial 72 pruned. Trial was pruned at iteration 2.
[I 2023-12-21 02:31:56,737] Trial 73 pruned. Trial was pruned at iteration 0.
[I 2023-12-21 02:31:56,770] Trial 74 pruned. Trial was pruned at iteration 0.
[I 2023-12-21 02:31:56,803] Trial 75 pruned. Trial was pruned at iteration 0.
[I 2023-12-21 02:31:56,836] Trial 76 pruned. Trial was pruned at iteration 0.
[I 2023-12-21 02:31:56,870] Trial 77 pruned. Trial was pruned at iteration 0.
[I 2023-12-21 02:31:56,910] Trial 78 pruned. Trial was pruned at iteration 0.
[I 2023-12-21 02:31:56,952] Trial 79 pruned. Trial was pruned at iteration 4.
[I 2023-12-21 02:31:56,986] Trial 80 pruned. Trial was pruned at iteration 0.
[I 2023-12-21 02:31:57,019] Trial 81 pruned. Trial was pruned at iteration 0.
[I 2023-12-21 02:31:57,053] Trial 82 pruned. Trial was pruned at iteration 0.
[I 2023-12-21 02:31:57,086] Trial 83 pruned. Trial was pruned at iteration 0.
[I 2023-12-21 02:31:57,233] Trial 84 finished with value: 4.295361527187051 and parameters: {'learning_rate': 0.6695330619335745, 'aft_lo                                                                     ss_distribution': 'normal', 'aft_loss_distribution_scale': 1.3191484280706063, 'max_depth': 7, 'booster': 'gbtree', 'scale_pos_weight': 8                                                                     .286673067483763, 'alpha': 9.432268155182049, 'lambda': 1.4240626298962005, 'eta': 0.9579306874051492, 'sampling_method': 'gradient_based                                                                     ', 'subsample': 0.8867399662111685, 'gamma': 9.61813554175204}. Best is trial 43 with value: 4.2791945157099525.
[I 2023-12-21 02:31:57,274] Trial 85 pruned. Trial was pruned at iteration 0.
[I 2023-12-21 02:31:57,308] Trial 86 pruned. Trial was pruned at iteration 1.
[I 2023-12-21 02:31:57,475] Trial 87 finished with value: 4.282752783945731 and parameters: {'learning_rate': 0.667706190177759, 'aft_los                                                                     s_distribution': 'normal', 'aft_loss_distribution_scale': 1.2697881778557136, 'max_depth': 9, 'booster': 'gbtree', 'scale_pos_weight': 8.                                                                     11576006460528, 'alpha': 7.8844474778658515, 'lambda': 1.4154893813394813, 'eta': 0.8338696494769117, 'sampling_method': 'gradient_based'                                                                     , 'subsample': 0.9672440404130415, 'gamma': 8.932392064313458}. Best is trial 43 with value: 4.2791945157099525.
[I 2023-12-21 02:31:57,510] Trial 88 pruned. Trial was pruned at iteration 0.
[I 2023-12-21 02:31:57,543] Trial 89 pruned. Trial was pruned at iteration 0.
[I 2023-12-21 02:31:57,580] Trial 90 pruned. Trial was pruned at iteration 0.
[I 2023-12-21 02:31:57,614] Trial 91 pruned. Trial was pruned at iteration 0.
[I 2023-12-21 02:31:57,650] Trial 92 pruned. Trial was pruned at iteration 0.
[I 2023-12-21 02:31:57,685] Trial 93 pruned. Trial was pruned at iteration 1.
[I 2023-12-21 02:31:57,721] Trial 94 pruned. Trial was pruned at iteration 1.
[I 2023-12-21 02:31:57,755] Trial 95 pruned. Trial was pruned at iteration 0.
[I 2023-12-21 02:31:57,953] Trial 96 finished with value: 4.281126127236536 and parameters: {'learning_rate': 0.7149187489710402, 'aft_lo                                                                     ss_distribution': 'normal', 'aft_loss_distribution_scale': 1.259878890164852, 'max_depth': 7, 'booster': 'gbtree', 'scale_pos_weight': 7.                                                                     7575763734489955, 'alpha': 9.009617468722752, 'lambda': 0.6455997345917434, 'eta': 0.6585162997448102, 'sampling_method': 'gradient_based                                                                     ', 'subsample': 0.9993370703090394, 'gamma': 9.375099921226546}. Best is trial 43 with value: 4.2791945157099525.
[I 2023-12-21 02:31:58,114] Trial 97 finished with value: 4.27955861581525 and parameters: {'learning_rate': 0.7782000801472079, 'aft_los                                                                     s_distribution': 'normal', 'aft_loss_distribution_scale': 1.2450225232050045, 'max_depth': 7, 'booster': 'gbtree', 'scale_pos_weight': 7.                                                                     8402598997495065, 'alpha': 8.996104954701476, 'lambda': 0.7059608554538883, 'eta': 0.6391049051331363, 'sampling_method': 'uniform', 'sub                                                                     sample': 0.9586639594524904, 'gamma': 9.365965740207086}. Best is trial 43 with value: 4.2791945157099525.
[I 2023-12-21 02:31:58,212] Trial 98 finished with value: inf and parameters: {'learning_rate': 0.8074104819474693, 'aft_loss_distributio                                                                     n': 'normal', 'aft_loss_distribution_scale': 1.1564913365578038, 'max_depth': 7, 'booster': 'gbtree', 'scale_pos_weight': 7.8572045717909                                                                     41, 'alpha': 9.009548535207644, 'lambda': 0.6925008864029525, 'eta': 0.6304441311863068, 'sampling_method': 'uniform', 'subsample': 0.997                                                                     7008038390516, 'gamma': 9.31382747723647}. Best is trial 43 with value: 4.2791945157099525.
[I 2023-12-21 02:31:58,249] Trial 99 pruned. Trial was pruned at iteration 0.
[I 2023-12-21 02:31:58,285] Trial 100 pruned. Trial was pruned at iteration 0.
[I 2023-12-21 02:31:58,321] Trial 101 pruned. Trial was pruned at iteration 0.
[I 2023-12-21 02:31:58,358] Trial 102 pruned. Trial was pruned at iteration 0.
[I 2023-12-21 02:31:58,394] Trial 103 pruned. Trial was pruned at iteration 1.
[I 2023-12-21 02:31:58,529] Trial 104 finished with value: 4.332071337939647 and parameters: {'learning_rate': 0.7095854101562352, 'aft_l                                                                     oss_distribution': 'normal', 'aft_loss_distribution_scale': 1.444654639793379, 'max_depth': 7, 'booster': 'gbtree', 'scale_pos_weight': 7                                                                     .984575675276844, 'alpha': 9.521455788986856, 'lambda': 1.6127367452157615, 'eta': 0.7740414359662775, 'sampling_method': 'uniform', 'sub                                                                     sample': 0.854640452918984, 'gamma': 8.934632131814336}. Best is trial 43 with value: 4.2791945157099525.
[I 2023-12-21 02:31:58,563] Trial 105 pruned. Trial was pruned at iteration 0.
[I 2023-12-21 02:31:58,779] Trial 106 finished with value: 4.290928580098687 and parameters: {'learning_rate': 0.7825260923203663, 'aft_l                                                                     oss_distribution': 'normal', 'aft_loss_distribution_scale': 1.2911047516153664, 'max_depth': 6, 'booster': 'gbtree', 'scale_pos_weight':                                                                      7.60795707887663, 'alpha': 9.52143744273355, 'lambda': 1.0337153333415403, 'eta': 0.8105196783802927, 'sampling_method': 'uniform', 'subs                                                                     ample': 0.9393371669392458, 'gamma': 8.509784577709624}. Best is trial 43 with value: 4.2791945157099525.
[I 2023-12-21 02:31:58,815] Trial 107 pruned. Trial was pruned at iteration 0.
[I 2023-12-21 02:31:58,918] Trial 108 finished with value: inf and parameters: {'learning_rate': 0.8222911587592635, 'aft_loss_distributi                                                                     on': 'normal', 'aft_loss_distribution_scale': 1.3443926969950861, 'max_depth': 5, 'booster': 'gbtree', 'scale_pos_weight': 7.828628947351                                                                     872, 'alpha': 6.282945560115772, 'lambda': 0.9375709374920889, 'eta': 0.796760529208285, 'sampling_method': 'uniform', 'subsample': 0.973                                                                     3829104299115, 'gamma': 2.6702967932031054}. Best is trial 43 with value: 4.2791945157099525.
[I 2023-12-21 02:31:58,952] Trial 109 pruned. Trial was pruned at iteration 0.
[I 2023-12-21 02:31:58,988] Trial 110 pruned. Trial was pruned at iteration 1.
[I 2023-12-21 02:31:59,023] Trial 111 pruned. Trial was pruned at iteration 0.
[I 2023-12-21 02:31:59,128] Trial 112 finished with value: inf and parameters: {'learning_rate': 0.8678789317305025, 'aft_loss_distributi                                                                     on': 'normal', 'aft_loss_distribution_scale': 1.0358538947391145, 'max_depth': 7, 'booster': 'gbtree', 'scale_pos_weight': 6.812737387648                                                                     892, 'alpha': 9.496121083257838, 'lambda': 5.950286876632525, 'eta': 0.647655295582844, 'sampling_method': 'uniform', 'subsample': 0.9137                                                                     75718298076, 'gamma': 9.181940728004143}. Best is trial 43 with value: 4.2791945157099525.
[I 2023-12-21 02:31:59,165] Trial 113 pruned. Trial was pruned at iteration 0.
[I 2023-12-21 02:31:59,208] Trial 114 pruned. Trial was pruned at iteration 4.
[I 2023-12-21 02:31:59,244] Trial 115 pruned. Trial was pruned at iteration 1.
[I 2023-12-21 02:31:59,279] Trial 116 pruned. Trial was pruned at iteration 0.
[I 2023-12-21 02:31:59,315] Trial 117 pruned. Trial was pruned at iteration 1.
[I 2023-12-21 02:31:59,350] Trial 118 pruned. Trial was pruned at iteration 0.
[I 2023-12-21 02:31:59,387] Trial 119 pruned. Trial was pruned at iteration 0.
[I 2023-12-21 02:31:59,423] Trial 120 pruned. Trial was pruned at iteration 0.
[I 2023-12-21 02:31:59,531] Trial 121 pruned. Trial was pruned at iteration 50.
[I 2023-12-21 02:31:59,568] Trial 122 pruned. Trial was pruned at iteration 1.
[I 2023-12-21 02:31:59,604] Trial 123 pruned. Trial was pruned at iteration 0.
[I 2023-12-21 02:31:59,639] Trial 124 pruned. Trial was pruned at iteration 0.
[I 2023-12-21 02:31:59,676] Trial 125 pruned. Trial was pruned at iteration 0.
[I 2023-12-21 02:31:59,713] Trial 126 pruned. Trial was pruned at iteration 0.
[I 2023-12-21 02:31:59,752] Trial 127 pruned. Trial was pruned at iteration 1.
[I 2023-12-21 02:31:59,790] Trial 128 pruned. Trial was pruned at iteration 1.
[I 2023-12-21 02:31:59,828] Trial 129 pruned. Trial was pruned at iteration 1.
[I 2023-12-21 02:31:59,864] Trial 130 pruned. Trial was pruned at iteration 0.
[I 2023-12-21 02:31:59,900] Trial 131 pruned. Trial was pruned at iteration 0.
[I 2023-12-21 02:31:59,936] Trial 132 pruned. Trial was pruned at iteration 0.
[I 2023-12-21 02:31:59,974] Trial 133 pruned. Trial was pruned at iteration 0.
[I 2023-12-21 02:32:00,011] Trial 134 pruned. Trial was pruned at iteration 1.
[I 2023-12-21 02:32:00,049] Trial 135 pruned. Trial was pruned at iteration 1.
[I 2023-12-21 02:32:00,085] Trial 136 pruned. Trial was pruned at iteration 0.
[I 2023-12-21 02:32:00,123] Trial 137 pruned. Trial was pruned at iteration 0.
[I 2023-12-21 02:32:00,249] Trial 138 finished with value: inf and parameters: {'learning_rate': 0.7145236988657087, 'aft_loss_distributi                                                                     on': 'normal', 'aft_loss_distribution_scale': 1.244175449302492, 'max_depth': 10, 'booster': 'gbtree', 'scale_pos_weight': 6.407297958029                                                                     66, 'alpha': 9.641131148221389, 'lambda': 1.378044085076418, 'eta': 0.4388601484438871, 'sampling_method': 'gradient_based', 'subsample':                                                                      0.9064945607207691, 'gamma': 9.988264476030233}. Best is trial 43 with value: 4.2791945157099525.
[I 2023-12-21 02:32:00,287] Trial 139 pruned. Trial was pruned at iteration 1.
[I 2023-12-21 02:32:00,324] Trial 140 pruned. Trial was pruned at iteration 0.
[I 2023-12-21 02:32:00,361] Trial 141 pruned. Trial was pruned at iteration 0.
[I 2023-12-21 02:32:00,397] Trial 142 pruned. Trial was pruned at iteration 0.
[I 2023-12-21 02:32:00,434] Trial 143 pruned. Trial was pruned at iteration 0.
[I 2023-12-21 02:32:00,470] Trial 144 pruned. Trial was pruned at iteration 0.
[I 2023-12-21 02:32:00,507] Trial 145 pruned. Trial was pruned at iteration 0.
[I 2023-12-21 02:32:00,552] Trial 146 pruned. Trial was pruned at iteration 0.
[I 2023-12-21 02:32:00,589] Trial 147 pruned. Trial was pruned at iteration 0.
[I 2023-12-21 02:32:00,627] Trial 148 pruned. Trial was pruned at iteration 1.
[I 2023-12-21 02:32:00,664] Trial 149 pruned. Trial was pruned at iteration 0.
[I 2023-12-21 02:32:00,813] Trial 150 finished with value: 4.307038716093272 and parameters: {'learning_rate': 0.6699985918856097, 'aft_l                                                                     oss_distribution': 'normal', 'aft_loss_distribution_scale': 1.36425907579004, 'max_depth': 9, 'booster': 'gbtree', 'scale_pos_weight': 8.                                                                     682164608983898, 'alpha': 8.47200260509513, 'lambda': 1.4678299230449798, 'eta': 0.1899416141811311, 'sampling_method': 'gradient_based',                                                                      'subsample': 0.8291143803796222, 'gamma': 9.993541734342559}. Best is trial 43 with value: 4.2791945157099525.
[I 2023-12-21 02:32:00,852] Trial 151 pruned. Trial was pruned at iteration 1.
[I 2023-12-21 02:32:00,893] Trial 152 pruned. Trial was pruned at iteration 1.
[I 2023-12-21 02:32:00,935] Trial 153 pruned. Trial was pruned at iteration 0.
[I 2023-12-21 02:32:00,974] Trial 154 pruned. Trial was pruned at iteration 1.
[I 2023-12-21 02:32:01,133] Trial 155 finished with value: 4.256536527504146 and parameters: {'learning_rate': 0.7525979317969076, 'aft_l                                                                     oss_distribution': 'normal', 'aft_loss_distribution_scale': 1.1586358978753069, 'max_depth': 9, 'booster': 'gbtree', 'scale_pos_weight':                                                                      6.51884248548486, 'alpha': 6.065257053223495, 'lambda': 0.8132242909249066, 'eta': 0.45222748456990136, 'sampling_method': 'gradient_base                                                                     d', 'subsample': 0.9430907297518446, 'gamma': 8.882986441030337}. Best is trial 155 with value: 4.256536527504146.
[I 2023-12-21 02:32:01,371] Trial 156 finished with value: 4.239607290306937 and parameters: {'learning_rate': 0.7508884985090807, 'aft_l                                                                     oss_distribution': 'normal', 'aft_loss_distribution_scale': 1.0622842801996044, 'max_depth': 9, 'booster': 'gbtree', 'scale_pos_weight':                                                                      6.6186991588263355, 'alpha': 5.996699462083391, 'lambda': 0.8820560766937017, 'eta': 0.22528663642871916, 'sampling_method': 'gradient_ba                                                                     sed', 'subsample': 0.9837464757740938, 'gamma': 8.560673480233534}. Best is trial 156 with value: 4.239607290306937.
[I 2023-12-21 02:32:01,490] Trial 157 finished with value: inf and parameters: {'learning_rate': 0.8048986638635249, 'aft_loss_distributi                                                                     on': 'normal', 'aft_loss_distribution_scale': 0.8915065058602258, 'max_depth': 9, 'booster': 'gbtree', 'scale_pos_weight': 6.313066805009                                                                     794, 'alpha': 6.08902179831777, 'lambda': 0.8919433604464426, 'eta': 0.182326050474493, 'sampling_method': 'gradient_based', 'subsample':                                                                      0.9714070201660218, 'gamma': 9.039833715610744}. Best is trial 156 with value: 4.239607290306937.
[I 2023-12-21 02:32:01,594] Trial 158 finished with value: inf and parameters: {'learning_rate': 0.7711002685894924, 'aft_loss_distributi                                                                     on': 'normal', 'aft_loss_distribution_scale': 1.1014303236997511, 'max_depth': 9, 'booster': 'gbtree', 'scale_pos_weight': 6.705969535827                                                                     7995, 'alpha': 6.422565660676297, 'lambda': 0.6257295489288274, 'eta': 0.15722685684533344, 'sampling_method': 'uniform', 'subsample': 0.                                                                     9852657525758286, 'gamma': 8.50322420930684}. Best is trial 156 with value: 4.239607290306937.
[I 2023-12-21 02:32:01,632] Trial 159 pruned. Trial was pruned at iteration 0.
[I 2023-12-21 02:32:01,672] Trial 160 pruned. Trial was pruned at iteration 0.
[I 2023-12-21 02:32:01,720] Trial 161 pruned. Trial was pruned at iteration 6.
[I 2023-12-21 02:32:01,874] Trial 162 finished with value: 4.262107637034223 and parameters: {'learning_rate': 0.723860824911731, 'aft_lo                                                                     ss_distribution': 'normal', 'aft_loss_distribution_scale': 1.1504420447505042, 'max_depth': 9, 'booster': 'gbtree', 'scale_pos_weight': 6                                                                     .843256442888691, 'alpha': 6.780266555648347, 'lambda': 0.7815523367049027, 'eta': 0.29251690848773526, 'sampling_method': 'gradient_base                                                                     d', 'subsample': 0.9394654841673175, 'gamma': 8.793393681853567}. Best is trial 156 with value: 4.239607290306937.
[I 2023-12-21 02:32:01,921] Trial 163 pruned. Trial was pruned at iteration 2.
[I 2023-12-21 02:32:01,960] Trial 164 pruned. Trial was pruned at iteration 0.
[I 2023-12-21 02:32:02,004] Trial 165 pruned. Trial was pruned at iteration 3.
[I 2023-12-21 02:32:02,131] Trial 166 finished with value: inf and parameters: {'learning_rate': 0.7197576961846571, 'aft_loss_distributi                                                                     on': 'normal', 'aft_loss_distribution_scale': 1.2148929735664633, 'max_depth': 9, 'booster': 'gbtree', 'scale_pos_weight': 7.358800806546                                                                     193, 'alpha': 6.277610107342441, 'lambda': 0.1222673758530195, 'eta': 0.8485227759515881, 'sampling_method': 'uniform', 'subsample': 0.99                                                                     74531092242237, 'gamma': 8.853055094579263}. Best is trial 156 with value: 4.239607290306937.
[I 2023-12-21 02:32:02,172] Trial 167 pruned. Trial was pruned at iteration 1.
[I 2023-12-21 02:32:02,213] Trial 168 pruned. Trial was pruned at iteration 0.
