[I 2023-12-21 02:30:03,638] Trial 124 pruned. Trial was pruned at iteration 0.
[I 2023-12-21 02:30:05,818] Trial 125 finished with value: 4.536164538483013 and parameters: {'learning_rate': 0.6828818883614718, 'aft_l                                                                     oss_distribution': 'normal', 'aft_loss_distribution_scale': 2.0069176118973107, 'max_depth': 9, 'booster': 'dart', 'scale_pos_weight': 0.                                                                     5513386356238293, 'alpha': 9.653663675925479, 'lambda': 4.352415096756509, 'eta': 0.07197411980908355, 'sampling_method': 'uniform', 'sub                                                                     sample': 0.10187703124793207, 'gamma': 9.70860592571997}. Best is trial 4 with value: 4.246843583964676.
[I 2023-12-21 02:30:05,932] Trial 126 finished with value: 4.53643065429621 and parameters: {'learning_rate': 0.613402080571479, 'aft_los                                                                     s_distribution': 'normal', 'aft_loss_distribution_scale': 2.007699729575508, 'max_depth': 9, 'booster': 'gbtree', 'scale_pos_weight': 0.5                                                                     17502799064779, 'alpha': 9.706597953159108, 'lambda': 4.041238567207637, 'eta': 0.07401765336757808, 'sampling_method': 'uniform', 'subsa                                                                     mple': 0.16706653083274842, 'gamma': 9.59167999813067}. Best is trial 4 with value: 4.246843583964676.
[I 2023-12-21 02:30:05,969] Trial 127 pruned. Trial was pruned at iteration 0.
[I 2023-12-21 02:30:06,007] Trial 128 pruned. Trial was pruned at iteration 1.
[I 2023-12-21 02:30:06,044] Trial 129 pruned. Trial was pruned at iteration 1.
[I 2023-12-21 02:30:06,154] Trial 130 finished with value: inf and parameters: {'learning_rate': 0.683822457516406, 'aft_loss_distributio                                                                     n': 'normal', 'aft_loss_distribution_scale': 1.8458499631209424, 'max_depth': 9, 'booster': 'gbtree', 'scale_pos_weight': 0.5335934599748                                                                     896, 'alpha': 8.462765060015572, 'lambda': 4.631175464616616, 'eta': 0.04306291367956995, 'sampling_method': 'uniform', 'subsample': 0.06                                                                     0781426034193856, 'gamma': 9.607967863085822}. Best is trial 4 with value: 4.246843583964676.
[I 2023-12-21 02:30:06,192] Trial 131 pruned. Trial was pruned at iteration 0.
[I 2023-12-21 02:30:06,228] Trial 132 pruned. Trial was pruned at iteration 0.
[I 2023-12-21 02:30:06,266] Trial 133 pruned. Trial was pruned at iteration 0.
[I 2023-12-21 02:30:06,303] Trial 134 pruned. Trial was pruned at iteration 0.
[I 2023-12-21 02:30:14,577] Trial 135 pruned. Trial was pruned at iteration 157.
[I 2023-12-21 02:30:14,619] Trial 136 pruned. Trial was pruned at iteration 1.
[I 2023-12-21 02:30:14,656] Trial 137 pruned. Trial was pruned at iteration 0.
[I 2023-12-21 02:30:14,693] Trial 138 pruned. Trial was pruned at iteration 0.
[I 2023-12-21 02:30:14,843] Trial 139 finished with value: 4.291165069478855 and parameters: {'learning_rate': 0.6851117606179955, 'aft_l                                                                     oss_distribution': 'normal', 'aft_loss_distribution_scale': 1.2287227971123833, 'max_depth': 10, 'booster': 'gbtree', 'scale_pos_weight':                                                                      7.9476860750313385, 'alpha': 8.200292160727471, 'lambda': 3.5292470162738, 'eta': 0.3027662290600489, 'sampling_method': 'uniform', 'sub                                                                     sample': 0.012452885946129741, 'gamma': 9.811962000643474}. Best is trial 4 with value: 4.246843583964676.
[I 2023-12-21 02:30:14,945] Trial 140 finished with value: inf and parameters: {'learning_rate': 0.6895251327186469, 'aft_loss_distributi                                                                     on': 'normal', 'aft_loss_distribution_scale': 1.0783979490265223, 'max_depth': 10, 'booster': 'gbtree', 'scale_pos_weight': 8.11573937202                                                                     498, 'alpha': 8.201646941926862, 'lambda': 2.818411617005173, 'eta': 0.3130828469784821, 'sampling_method': 'uniform', 'subsample': 0.252                                                                     14862626704904, 'gamma': 9.799676632318388}. Best is trial 4 with value: 4.246843583964676.
[I 2023-12-21 02:30:15,043] Trial 141 finished with value: inf and parameters: {'learning_rate': 0.7385343638795929, 'aft_loss_distributi                                                                     on': 'normal', 'aft_loss_distribution_scale': 1.2853384452220644, 'max_depth': 10, 'booster': 'gbtree', 'scale_pos_weight': 8.45765625060                                                                     9295, 'alpha': 8.658599392374713, 'lambda': 3.4383795256671115, 'eta': 0.2938736004552633, 'sampling_method': 'uniform', 'subsample': 0.0                                                                     2430839368068937, 'gamma': 9.786616851572575}. Best is trial 4 with value: 4.246843583964676.
[I 2023-12-21 02:30:15,080] Trial 142 pruned. Trial was pruned at iteration 0.
[I 2023-12-21 02:30:15,117] Trial 143 pruned. Trial was pruned at iteration 0.
[I 2023-12-21 02:30:15,218] Trial 144 finished with value: inf and parameters: {'learning_rate': 0.6806203578271455, 'aft_loss_distributi                                                                     on': 'normal', 'aft_loss_distribution_scale': 1.8213104777859732, 'max_depth': 9, 'booster': 'gbtree', 'scale_pos_weight': 7.793949718381                                                                     604, 'alpha': 4.0880676179040005, 'lambda': 4.441219509080447, 'eta': 0.12255023885928865, 'sampling_method': 'uniform', 'subsample': 0.1                                                                     8804059260336672, 'gamma': 9.606335973802869}. Best is trial 4 with value: 4.246843583964676.
[I 2023-12-21 02:30:15,397] Trial 145 finished with value: 4.356005872375326 and parameters: {'learning_rate': 0.24276778468826585, 'aft_                                                                     loss_distribution': 'logistic', 'aft_loss_distribution_scale': 0.9296343632756842, 'max_depth': 10, 'booster': 'gbtree', 'scale_pos_weigh                                                                     t': 8.864761350954902, 'alpha': 4.521458336059493, 'lambda': 4.294305709117554, 'eta': 0.07125449322795742, 'sampling_method': 'uniform',                                                                      'subsample': 0.22858420908394517, 'gamma': 9.09473586551419}. Best is trial 4 with value: 4.246843583964676.
[I 2023-12-21 02:30:15,435] Trial 146 pruned. Trial was pruned at iteration 0.
[I 2023-12-21 02:30:15,472] Trial 147 pruned. Trial was pruned at iteration 0.
[I 2023-12-21 02:30:15,510] Trial 148 pruned. Trial was pruned at iteration 0.
[I 2023-12-21 02:30:15,548] Trial 149 pruned. Trial was pruned at iteration 0.
[I 2023-12-21 02:30:15,587] Trial 150 pruned. Trial was pruned at iteration 1.
[I 2023-12-21 02:30:15,625] Trial 151 pruned. Trial was pruned at iteration 0.
[I 2023-12-21 02:30:15,663] Trial 152 pruned. Trial was pruned at iteration 0.
[I 2023-12-21 02:30:15,704] Trial 153 pruned. Trial was pruned at iteration 1.
[I 2023-12-21 02:30:15,742] Trial 154 pruned. Trial was pruned at iteration 0.
[I 2023-12-21 02:30:15,782] Trial 155 pruned. Trial was pruned at iteration 0.
[I 2023-12-21 02:30:15,821] Trial 156 pruned. Trial was pruned at iteration 0.
[I 2023-12-21 02:30:15,859] Trial 157 pruned. Trial was pruned at iteration 0.
[I 2023-12-21 02:30:15,897] Trial 158 pruned. Trial was pruned at iteration 0.
[I 2023-12-21 02:30:15,935] Trial 159 pruned. Trial was pruned at iteration 0.
[I 2023-12-21 02:30:15,974] Trial 160 pruned. Trial was pruned at iteration 0.
[I 2023-12-21 02:30:17,097] Trial 161 finished with value: inf and parameters: {'learning_rate': 0.7103778235392976, 'aft_loss_distributi                                                                     on': 'normal', 'aft_loss_distribution_scale': 1.1709936478083405, 'max_depth': 8, 'booster': 'dart', 'scale_pos_weight': 1.26354450110566                                                                     43, 'alpha': 9.713445567501228, 'lambda': 8.760205885708505, 'eta': 0.5359308805796024, 'sampling_method': 'uniform', 'subsample': 0.2425                                                                     9164060040492, 'gamma': 6.853024929724732}. Best is trial 4 with value: 4.246843583964676.
[I 2023-12-21 02:30:17,136] Trial 162 pruned. Trial was pruned at iteration 0.
[I 2023-12-21 02:30:19,335] Trial 163 finished with value: 4.458673853823196 and parameters: {'learning_rate': 0.699681614499551, 'aft_lo                                                                     ss_distribution': 'normal', 'aft_loss_distribution_scale': 1.8025652467219984, 'max_depth': 7, 'booster': 'dart', 'scale_pos_weight': 0.9                                                                     781368906862441, 'alpha': 0.6184107949102438, 'lambda': 9.987013775768549, 'eta': 0.8897631885821362, 'sampling_method': 'uniform', 'subs                                                                     ample': 0.42089515503905567, 'gamma': 7.93163664253837}. Best is trial 4 with value: 4.246843583964676.
[I 2023-12-21 02:30:20,461] Trial 164 finished with value: inf and parameters: {'learning_rate': 0.6921855554224075, 'aft_loss_distributi                                                                     on': 'normal', 'aft_loss_distribution_scale': 1.7870085828634856, 'max_depth': 7, 'booster': 'dart', 'scale_pos_weight': 0.89386670068357                                                                     5, 'alpha': 0.6585649221384092, 'lambda': 4.016666718723606, 'eta': 0.9591262155441764, 'sampling_method': 'uniform', 'subsample': 0.4680                                                                     913240363011, 'gamma': 1.8717464275963358}. Best is trial 4 with value: 4.246843583964676.
[I 2023-12-21 02:30:20,503] Trial 165 pruned. Trial was pruned at iteration 1.
[I 2023-12-21 02:30:20,541] Trial 166 pruned. Trial was pruned at iteration 0.
[I 2023-12-21 02:30:20,579] Trial 167 pruned. Trial was pruned at iteration 0.
[I 2023-12-21 02:30:20,618] Trial 168 pruned. Trial was pruned at iteration 0.
[I 2023-12-21 02:30:20,658] Trial 169 pruned. Trial was pruned at iteration 0.
[I 2023-12-21 02:30:20,696] Trial 170 pruned. Trial was pruned at iteration 0.
[I 2023-12-21 02:30:20,735] Trial 171 pruned. Trial was pruned at iteration 0.
[I 2023-12-21 02:30:21,827] Trial 172 finished with value: inf and parameters: {'learning_rate': 0.7702315236291272, 'aft_loss_distributi                                                                     on': 'normal', 'aft_loss_distribution_scale': 0.9874760067482795, 'max_depth': 8, 'booster': 'dart', 'scale_pos_weight': 1.19595104513579                                                                     04, 'alpha': 1.1870408507078616, 'lambda': 9.192639191747775, 'eta': 0.9181227254648905, 'sampling_method': 'uniform', 'subsample': 0.523                                                                     7163181326284, 'gamma': 8.213007345739035}. Best is trial 4 with value: 4.246843583964676.
[I 2023-12-21 02:30:21,867] Trial 173 pruned. Trial was pruned at iteration 0.
[I 2023-12-21 02:30:21,907] Trial 174 pruned. Trial was pruned at iteration 0.
[I 2023-12-21 02:30:23,093] Trial 175 finished with value: inf and parameters: {'learning_rate': 0.659504768316424, 'aft_loss_distributio                                                                     n': 'normal', 'aft_loss_distribution_scale': 1.3831727035504913, 'max_depth': 8, 'booster': 'dart', 'scale_pos_weight': 0.514374635126446                                                                     2, 'alpha': 2.413062132894574, 'lambda': 6.211478693638198, 'eta': 0.08097190241297066, 'sampling_method': 'gradient_based', 'subsample':                                                                      0.15483090838023028, 'gamma': 7.992408789966752}. Best is trial 4 with value: 4.246843583964676.
[I 2023-12-21 02:30:23,132] Trial 176 pruned. Trial was pruned at iteration 0.
[I 2023-12-21 02:30:23,175] Trial 177 pruned. Trial was pruned at iteration 0.
[I 2023-12-21 02:30:23,215] Trial 178 pruned. Trial was pruned at iteration 1.
[I 2023-12-21 02:30:23,407] Trial 179 pruned. Trial was pruned at iteration 157.
[I 2023-12-21 02:30:23,446] Trial 180 pruned. Trial was pruned at iteration 0.
[I 2023-12-21 02:30:23,485] Trial 181 pruned. Trial was pruned at iteration 0.
[I 2023-12-21 02:30:23,524] Trial 182 pruned. Trial was pruned at iteration 0.
[I 2023-12-21 02:30:23,567] Trial 183 pruned. Trial was pruned at iteration 0.
[I 2023-12-21 02:30:23,606] Trial 184 pruned. Trial was pruned at iteration 0.
[I 2023-12-21 02:30:23,645] Trial 185 pruned. Trial was pruned at iteration 0.
[I 2023-12-21 02:30:23,685] Trial 186 pruned. Trial was pruned at iteration 0.
[I 2023-12-21 02:30:23,724] Trial 187 pruned. Trial was pruned at iteration 0.
[I 2023-12-21 02:30:23,834] Trial 188 finished with value: inf and parameters: {'learning_rate': 0.6812813674533437, 'aft_loss_distributi                                                                     on': 'normal', 'aft_loss_distribution_scale': 1.1893929627609607, 'max_depth': 8, 'booster': 'gbtree', 'scale_pos_weight': 0.803035682994                                                                     0604, 'alpha': 8.565669775743793, 'lambda': 1.6853980559473547, 'eta': 0.06983816883101568, 'sampling_method': 'uniform', 'subsample': 0.                                                                     5159237310349639, 'gamma': 9.591885795304576}. Best is trial 4 with value: 4.246843583964676.
[I 2023-12-21 02:30:23,875] Trial 189 pruned. Trial was pruned at iteration 0.
[I 2023-12-21 02:30:23,915] Trial 190 pruned. Trial was pruned at iteration 0.
[I 2023-12-21 02:30:23,954] Trial 191 pruned. Trial was pruned at iteration 0.
[I 2023-12-21 02:30:23,994] Trial 192 pruned. Trial was pruned at iteration 0.
[I 2023-12-21 02:30:24,033] Trial 193 pruned. Trial was pruned at iteration 0.
[I 2023-12-21 02:30:24,073] Trial 194 pruned. Trial was pruned at iteration 0.
[I 2023-12-21 02:30:24,113] Trial 195 pruned. Trial was pruned at iteration 0.
[I 2023-12-21 02:30:24,161] Trial 196 pruned. Trial was pruned at iteration 1.
[I 2023-12-21 02:30:24,201] Trial 197 pruned. Trial was pruned at iteration 0.
[I 2023-12-21 02:30:24,241] Trial 198 pruned. Trial was pruned at iteration 0.
[I 2023-12-21 02:30:24,281] Trial 199 pruned. Trial was pruned at iteration 0.
[I 2023-12-21 02:30:24,321] Trial 200 pruned. Trial was pruned at iteration 0.
[I 2023-12-21 02:30:24,361] Trial 201 pruned. Trial was pruned at iteration 0.
[I 2023-12-21 02:30:24,404] Trial 202 pruned. Trial was pruned at iteration 0.
[I 2023-12-21 02:30:25,553] Trial 203 finished with value: inf and parameters: {'learning_rate': 0.6691075901795263, 'aft_loss_distributi                                                                     on': 'normal', 'aft_loss_distribution_scale': 1.3940581887023291, 'max_depth': 8, 'booster': 'dart', 'scale_pos_weight': 8.96050978226682                                                                     6, 'alpha': 9.998227517628676, 'lambda': 5.220749500954494, 'eta': 0.06263343744898175, 'sampling_method': 'uniform', 'subsample': 0.2312                                                                     0774520216655, 'gamma': 2.0332773416806416}. Best is trial 4 with value: 4.246843583964676.
[I 2023-12-21 02:30:25,595] Trial 204 pruned. Trial was pruned at iteration 0.
[I 2023-12-21 02:30:27,093] Trial 205 finished with value: inf and parameters: {'learning_rate': 0.6431693579326848, 'aft_loss_distributi                                                                     on': 'normal', 'aft_loss_distribution_scale': 1.5383739073000502, 'max_depth': 8, 'booster': 'dart', 'scale_pos_weight': 0.71836125500696                                                                     11, 'alpha': 2.9971451282121633, 'lambda': 9.997090870543119, 'eta': 0.9812076593103222, 'sampling_method': 'uniform', 'subsample': 0.309                                                                     11522166162125, 'gamma': 7.689546005493344}. Best is trial 4 with value: 4.246843583964676.
[I 2023-12-21 02:30:27,211] Trial 206 finished with value: inf and parameters: {'learning_rate': 0.7274353101958072, 'aft_loss_distributi                                                                     on': 'normal', 'aft_loss_distribution_scale': 1.7884912387394978, 'max_depth': 3, 'booster': 'gbtree', 'scale_pos_weight': 1.620074576269                                                                     6518, 'alpha': 0.5385111871552574, 'lambda': 8.760723086291343, 'eta': 0.5393676042427024, 'sampling_method': 'uniform', 'subsample': 0.2                                                                     5405258762303917, 'gamma': 1.007621850650058}. Best is trial 4 with value: 4.246843583964676.
[I 2023-12-21 02:30:27,254] Trial 207 pruned. Trial was pruned at iteration 0.
[I 2023-12-21 02:30:27,297] Trial 208 pruned. Trial was pruned at iteration 0.
[I 2023-12-21 02:30:27,339] Trial 209 pruned. Trial was pruned at iteration 0.
[I 2023-12-21 02:30:27,380] Trial 210 pruned. Trial was pruned at iteration 0.
[I 2023-12-21 02:30:31,515] Trial 211 finished with value: 4.394264171257997 and parameters: {'learning_rate': 0.8442306819461861, 'aft_l                                                                     oss_distribution': 'normal', 'aft_loss_distribution_scale': 1.6092879148031152, 'max_depth': 8, 'booster': 'dart', 'scale_pos_weight': 0.                                                                     9595955845242807, 'alpha': 9.25973004481881, 'lambda': 9.856091259288078, 'eta': 0.9278927392896336, 'sampling_method': 'uniform', 'subsa                                                                     mple': 0.2870443040370665, 'gamma': 8.87194798985172}. Best is trial 4 with value: 4.246843583964676.
[I 2023-12-21 02:30:36,887] Trial 212 finished with value: 4.3900076520400875 and parameters: {'learning_rate': 0.8953748120656625, 'aft_                                                                     loss_distribution': 'normal', 'aft_loss_distribution_scale': 1.602097555405294, 'max_depth': 8, 'booster': 'dart', 'scale_pos_weight': 1.                                                                     1237328709881997, 'alpha': 9.332809978876199, 'lambda': 7.848929079684316, 'eta': 0.9602228872284726, 'sampling_method': 'uniform', 'subs                                                                     ample': 0.2954405367769659, 'gamma': 4.524401853817858}. Best is trial 4 with value: 4.246843583964676.
[I 2023-12-21 02:30:36,931] Trial 213 pruned. Trial was pruned at iteration 1.
[I 2023-12-21 02:30:38,475] Trial 214 finished with value: inf and parameters: {'learning_rate': 0.8632423090921765, 'aft_loss_distributi                                                                     on': 'normal', 'aft_loss_distribution_scale': 1.6225416132582304, 'max_depth': 8, 'booster': 'dart', 'scale_pos_weight': 0.99796928226972                                                                     44, 'alpha': 8.790776320202419, 'lambda': 9.837184777028433, 'eta': 0.9716501418423908, 'sampling_method': 'uniform', 'subsample': 0.2992                                                                     0357672159054, 'gamma': 4.104894471430867}. Best is trial 4 with value: 4.246843583964676.
[I 2023-12-21 02:30:38,522] Trial 215 pruned. Trial was pruned at iteration 2.
[I 2023-12-21 02:30:46,958] Trial 216 pruned. Trial was pruned at iteration 157.
[I 2023-12-21 02:30:47,002] Trial 217 pruned. Trial was pruned at iteration 1.
[I 2023-12-21 02:30:47,043] Trial 218 pruned. Trial was pruned at iteration 0.
[I 2023-12-21 02:30:49,235] Trial 219 finished with value: 4.435758858720099 and parameters: {'learning_rate': 0.8172686019328123, 'aft_l                                                                     oss_distribution': 'normal', 'aft_loss_distribution_scale': 1.728115354270159, 'max_depth': 6, 'booster': 'dart', 'scale_pos_weight': 5.6                                                                     08930999898056, 'alpha': 9.005406094581222, 'lambda': 9.387273062291912, 'eta': 0.9558268695906229, 'sampling_method': 'uniform', 'subsam                                                                     ple': 0.2722158983858562, 'gamma': 8.900575179891918}. Best is trial 4 with value: 4.246843583964676.
[I 2023-12-21 02:30:49,283] Trial 220 pruned. Trial was pruned at iteration 1.
[I 2023-12-21 02:30:53,393] Trial 221 finished with value: 4.4256472123989745 and parameters: {'learning_rate': 0.8560895082907454, 'aft_                                                                     loss_distribution': 'normal', 'aft_loss_distribution_scale': 1.7004563762830025, 'max_depth': 6, 'booster': 'dart', 'scale_pos_weight': 5                                                                     .722897008193862, 'alpha': 8.969908376467354, 'lambda': 9.400448799490464, 'eta': 0.8801636374131164, 'sampling_method': 'uniform', 'subs                                                                     ample': 0.26526836929129216, 'gamma': 8.879480631461787}. Best is trial 4 with value: 4.246843583964676.
