[I 2023-12-21 03:13:30,859] Trial 238 pruned. Trial was pruned at iteration 0.
[I 2023-12-21 03:13:31,876] Trial 239 finished with value: inf and parameters: {'learning_rate': 0.9334881989433056, 'aft_loss_distributi                                                                     on': 'normal', 'aft_loss_distribution_scale': 1.1184205353863534, 'max_depth': 9, 'booster': 'dart', 'scale_pos_weight': 5.36742785872825                                                                     3, 'alpha': 9.461442079405652, 'lambda': 9.28528826434385, 'eta': 0.09067800269220169, 'sampling_method': 'uniform', 'subsample': 0.41723                                                                     2498557902, 'gamma': 7.669349947672521}. Best is trial 174 with value: 4.325161198972311.
[I 2023-12-21 03:13:31,918] Trial 240 pruned. Trial was pruned at iteration 0.
[I 2023-12-21 03:13:31,958] Trial 241 pruned. Trial was pruned at iteration 0.
[I 2023-12-21 03:13:31,999] Trial 242 pruned. Trial was pruned at iteration 0.
[I 2023-12-21 03:13:32,040] Trial 243 pruned. Trial was pruned at iteration 0.
[I 2023-12-21 03:13:32,082] Trial 244 pruned. Trial was pruned at iteration 0.
[I 2023-12-21 03:13:32,125] Trial 245 pruned. Trial was pruned at iteration 0.
[I 2023-12-21 03:13:32,169] Trial 246 pruned. Trial was pruned at iteration 0.
[I 2023-12-21 03:13:32,293] Trial 247 finished with value: inf and parameters: {'learning_rate': 0.9549666485478273, 'aft_loss_distributi                                                                     on': 'normal', 'aft_loss_distribution_scale': 1.231803402679469, 'max_depth': 6, 'booster': 'gbtree', 'scale_pos_weight': 6.4210779633486                                                                     74, 'alpha': 8.368027434746764, 'lambda': 8.831049402605966, 'eta': 0.724013524071945, 'sampling_method': 'uniform', 'subsample': 0.40169                                                                     59071947385, 'gamma': 9.237256576730513}. Best is trial 174 with value: 4.325161198972311.
[I 2023-12-21 03:13:32,337] Trial 248 pruned. Trial was pruned at iteration 0.
[I 2023-12-21 03:13:33,287] Trial 249 finished with value: inf and parameters: {'learning_rate': 0.9323346255026695, 'aft_loss_distributi                                                                     on': 'normal', 'aft_loss_distribution_scale': 1.4218365403726867, 'max_depth': 9, 'booster': 'dart', 'scale_pos_weight': 6.99070624273776                                                                     1, 'alpha': 8.086174897993695, 'lambda': 5.4379738413308445, 'eta': 0.925870565174361, 'sampling_method': 'uniform', 'subsample': 0.42966                                                                     970031520835, 'gamma': 8.688860328996338}. Best is trial 174 with value: 4.325161198972311.
[I 2023-12-21 03:13:33,333] Trial 250 pruned. Trial was pruned at iteration 0.
[I 2023-12-21 03:13:33,375] Trial 251 pruned. Trial was pruned at iteration 0.
[I 2023-12-21 03:13:33,417] Trial 252 pruned. Trial was pruned at iteration 0.
[I 2023-12-21 03:13:33,538] Trial 253 finished with value: inf and parameters: {'learning_rate': 0.9486725847916062, 'aft_loss_distributi                                                                     on': 'normal', 'aft_loss_distribution_scale': 1.2166424979221828, 'max_depth': 7, 'booster': 'gbtree', 'scale_pos_weight': 5.530889488631                                                                     38, 'alpha': 8.699114812326407, 'lambda': 9.63346013697982, 'eta': 0.7921741787085874, 'sampling_method': 'uniform', 'subsample': 0.77081                                                                     19615590399, 'gamma': 9.40010428992281}. Best is trial 174 with value: 4.325161198972311.
[I 2023-12-21 03:13:33,581] Trial 254 pruned. Trial was pruned at iteration 0.
[I 2023-12-21 03:13:33,624] Trial 255 pruned. Trial was pruned at iteration 0.
[I 2023-12-21 03:13:34,662] Trial 256 finished with value: inf and parameters: {'learning_rate': 0.9836013580794608, 'aft_loss_distributi                                                                     on': 'normal', 'aft_loss_distribution_scale': 1.0867525949171208, 'max_depth': 8, 'booster': 'dart', 'scale_pos_weight': 6.40080744785464                                                                     3, 'alpha': 6.893909160241995, 'lambda': 8.763270281832808, 'eta': 0.9636395702723864, 'sampling_method': 'uniform', 'subsample': 0.35121                                                                     12895724082, 'gamma': 9.270499029158495}. Best is trial 174 with value: 4.325161198972311.
[I 2023-12-21 03:13:34,705] Trial 257 pruned. Trial was pruned at iteration 0.
[I 2023-12-21 03:13:34,748] Trial 258 pruned. Trial was pruned at iteration 0.
[I 2023-12-21 03:13:34,790] Trial 259 pruned. Trial was pruned at iteration 0.
[I 2023-12-21 03:13:34,929] Trial 260 finished with value: inf and parameters: {'learning_rate': 0.8797874877020503, 'aft_loss_distributi                                                                     on': 'normal', 'aft_loss_distribution_scale': 1.3341689601590359, 'max_depth': 9, 'booster': 'gbtree', 'scale_pos_weight': 6.225662824795                                                                     252, 'alpha': 8.515252334557932, 'lambda': 6.877442893453199, 'eta': 0.656892470058631, 'sampling_method': 'gradient_based', 'subsample':                                                                      0.4532957693499496, 'gamma': 9.085469327415126}. Best is trial 174 with value: 4.325161198972311.
[I 2023-12-21 03:13:34,971] Trial 261 pruned. Trial was pruned at iteration 0.
[I 2023-12-21 03:13:35,014] Trial 262 pruned. Trial was pruned at iteration 0.
[I 2023-12-21 03:13:35,056] Trial 263 pruned. Trial was pruned at iteration 0.
[I 2023-12-21 03:13:35,099] Trial 264 pruned. Trial was pruned at iteration 0.
[I 2023-12-21 03:13:35,142] Trial 265 pruned. Trial was pruned at iteration 0.
[I 2023-12-21 03:13:35,187] Trial 266 pruned. Trial was pruned at iteration 1.
[I 2023-12-21 03:13:35,231] Trial 267 pruned. Trial was pruned at iteration 0.
[I 2023-12-21 03:13:36,208] Trial 268 finished with value: inf and parameters: {'learning_rate': 0.8922280498988587, 'aft_loss_distributi                                                                     on': 'normal', 'aft_loss_distribution_scale': 1.2900166967592823, 'max_depth': 9, 'booster': 'dart', 'scale_pos_weight': 5.83215000888315                                                                     95, 'alpha': 8.404176810221456, 'lambda': 7.748960075547669, 'eta': 0.7484650709178375, 'sampling_method': 'uniform', 'subsample': 0.5313                                                                     614066059644, 'gamma': 7.945675373002413}. Best is trial 174 with value: 4.325161198972311.
[I 2023-12-21 03:13:36,251] Trial 269 pruned. Trial was pruned at iteration 0.
[I 2023-12-21 03:13:37,326] Trial 270 finished with value: inf and parameters: {'learning_rate': 0.9059349258727828, 'aft_loss_distributi                                                                     on': 'normal', 'aft_loss_distribution_scale': 1.0643930296004314, 'max_depth': 4, 'booster': 'dart', 'scale_pos_weight': 6.13308155982566                                                                     6, 'alpha': 8.000059705294017, 'lambda': 1.872385622820139, 'eta': 0.09846111076137928, 'sampling_method': 'uniform', 'subsample': 0.4629                                                                     7592700141843, 'gamma': 9.113385732114951}. Best is trial 174 with value: 4.325161198972311.
[I 2023-12-21 03:13:37,374] Trial 271 pruned. Trial was pruned at iteration 1.
[I 2023-12-21 03:13:37,417] Trial 272 pruned. Trial was pruned at iteration 0.
[I 2023-12-21 03:13:37,459] Trial 273 pruned. Trial was pruned at iteration 0.
[I 2023-12-21 03:13:38,447] Trial 274 finished with value: inf and parameters: {'learning_rate': 0.9542638810087862, 'aft_loss_distributi                                                                     on': 'normal', 'aft_loss_distribution_scale': 1.204563914601154, 'max_depth': 9, 'booster': 'dart', 'scale_pos_weight': 5.990377933281588                                                                     , 'alpha': 9.329616736628473, 'lambda': 9.129198233584708, 'eta': 0.8198728064579626, 'sampling_method': 'uniform', 'subsample': 0.505564                                                                     2039204801, 'gamma': 9.627907830323192}. Best is trial 174 with value: 4.325161198972311.
[I 2023-12-21 03:13:38,491] Trial 275 pruned. Trial was pruned at iteration 0.
[I 2023-12-21 03:13:38,535] Trial 276 pruned. Trial was pruned at iteration 0.
[I 2023-12-21 03:13:38,579] Trial 277 pruned. Trial was pruned at iteration 0.
[I 2023-12-21 03:13:38,621] Trial 278 pruned. Trial was pruned at iteration 0.
[I 2023-12-21 03:13:38,664] Trial 279 pruned. Trial was pruned at iteration 0.
[I 2023-12-21 03:13:39,713] Trial 280 finished with value: inf and parameters: {'learning_rate': 0.9974783252856794, 'aft_loss_distributi                                                                     on': 'normal', 'aft_loss_distribution_scale': 1.232018922410278, 'max_depth': 8, 'booster': 'dart', 'scale_pos_weight': 6.678156051891174                                                                     4, 'alpha': 5.380842458444728, 'lambda': 8.311056810059101, 'eta': 0.7968802778371206, 'sampling_method': 'uniform', 'subsample': 0.47417                                                                     40710593984, 'gamma': 9.502663950841423}. Best is trial 174 with value: 4.325161198972311.
[I 2023-12-21 03:13:39,757] Trial 281 pruned. Trial was pruned at iteration 0.
[I 2023-12-21 03:13:39,800] Trial 282 pruned. Trial was pruned at iteration 0.
[I 2023-12-21 03:13:39,852] Trial 283 pruned. Trial was pruned at iteration 1.
[I 2023-12-21 03:13:39,897] Trial 284 pruned. Trial was pruned at iteration 0.
[I 2023-12-21 03:13:39,941] Trial 285 pruned. Trial was pruned at iteration 0.
[I 2023-12-21 03:13:39,985] Trial 286 pruned. Trial was pruned at iteration 0.
[I 2023-12-21 03:13:40,028] Trial 287 pruned. Trial was pruned at iteration 0.
[I 2023-12-21 03:13:40,071] Trial 288 pruned. Trial was pruned at iteration 0.
[I 2023-12-21 03:13:40,114] Trial 289 pruned. Trial was pruned at iteration 0.
[I 2023-12-21 03:13:40,159] Trial 290 pruned. Trial was pruned at iteration 0.
[I 2023-12-21 03:13:40,202] Trial 291 pruned. Trial was pruned at iteration 0.
[I 2023-12-21 03:13:40,247] Trial 292 pruned. Trial was pruned at iteration 0.
[I 2023-12-21 03:13:40,292] Trial 293 pruned. Trial was pruned at iteration 0.
[I 2023-12-21 03:13:40,336] Trial 294 pruned. Trial was pruned at iteration 0.
[I 2023-12-21 03:13:40,379] Trial 295 pruned. Trial was pruned at iteration 0.
[I 2023-12-21 03:13:40,424] Trial 296 pruned. Trial was pruned at iteration 0.
[I 2023-12-21 03:13:41,481] Trial 297 finished with value: inf and parameters: {'learning_rate': 0.8817544595436484, 'aft_loss_distributi                                                                     on': 'normal', 'aft_loss_distribution_scale': 1.2656813435798193, 'max_depth': 8, 'booster': 'dart', 'scale_pos_weight': 6.66800911675357                                                                     6, 'alpha': 7.931170013109909, 'lambda': 8.384845848379406, 'eta': 0.7777573872720727, 'sampling_method': 'uniform', 'subsample': 0.36713                                                                     831242925443, 'gamma': 9.43037692502046}. Best is trial 174 with value: 4.325161198972311.
[I 2023-12-21 03:13:41,525] Trial 298 pruned. Trial was pruned at iteration 0.
[I 2023-12-21 03:13:41,569] Trial 299 pruned. Trial was pruned at iteration 0.
[I 2023-12-21 03:13:42,565] Trial 300 finished with value: inf and parameters: {'learning_rate': 0.9071141580632176, 'aft_loss_distributi                                                                     on': 'normal', 'aft_loss_distribution_scale': 1.0509866482025636, 'max_depth': 9, 'booster': 'dart', 'scale_pos_weight': 4.89549001532813                                                                     6, 'alpha': 7.384988509910129, 'lambda': 8.564496103375756, 'eta': 0.7623455823535852, 'sampling_method': 'gradient_based', 'subsample':                                                                      0.5780510862443076, 'gamma': 9.696469491399018}. Best is trial 174 with value: 4.325161198972311.
[I 2023-12-21 03:13:42,610] Trial 301 pruned. Trial was pruned at iteration 0.
[I 2023-12-21 03:13:42,653] Trial 302 pruned. Trial was pruned at iteration 0.
[I 2023-12-21 03:13:42,698] Trial 303 pruned. Trial was pruned at iteration 0.
[I 2023-12-21 03:13:42,822] Trial 304 finished with value: inf and parameters: {'learning_rate': 0.8749039812156502, 'aft_loss_distributi                                                                     on': 'normal', 'aft_loss_distribution_scale': 1.3038819313115102, 'max_depth': 9, 'booster': 'gbtree', 'scale_pos_weight': 5.609143614523                                                                     6795, 'alpha': 5.165223647113233, 'lambda': 9.012992924111535, 'eta': 0.68651283043509, 'sampling_method': 'uniform', 'subsample': 0.8837                                                                     562986614136, 'gamma': 9.586230527161316}. Best is trial 174 with value: 4.325161198972311.
[I 2023-12-21 03:13:42,868] Trial 305 pruned. Trial was pruned at iteration 0.
[I 2023-12-21 03:13:42,912] Trial 306 pruned. Trial was pruned at iteration 0.
[I 2023-12-21 03:13:42,956] Trial 307 pruned. Trial was pruned at iteration 0.
[I 2023-12-21 03:13:43,005] Trial 308 pruned. Trial was pruned at iteration 0.
[I 2023-12-21 03:13:43,049] Trial 309 pruned. Trial was pruned at iteration 0.
[I 2023-12-21 03:13:43,093] Trial 310 pruned. Trial was pruned at iteration 0.
[I 2023-12-21 03:13:43,138] Trial 311 pruned. Trial was pruned at iteration 0.
[I 2023-12-21 03:13:43,183] Trial 312 pruned. Trial was pruned at iteration 0.
[I 2023-12-21 03:13:43,230] Trial 313 pruned. Trial was pruned at iteration 0.
[I 2023-12-21 03:13:43,276] Trial 314 pruned. Trial was pruned at iteration 0.
[I 2023-12-21 03:13:43,320] Trial 315 pruned. Trial was pruned at iteration 0.
[I 2023-12-21 03:13:43,366] Trial 316 pruned. Trial was pruned at iteration 0.
[I 2023-12-21 03:13:43,410] Trial 317 pruned. Trial was pruned at iteration 0.
[I 2023-12-21 03:13:44,371] Trial 318 finished with value: inf and parameters: {'learning_rate': 0.9138849425052953, 'aft_loss_distributi                                                                     on': 'normal', 'aft_loss_distribution_scale': 1.335560457812516, 'max_depth': 9, 'booster': 'dart', 'scale_pos_weight': 6.164991104451956                                                                     , 'alpha': 5.866946526173563, 'lambda': 8.299016399595729, 'eta': 0.8064432227871818, 'sampling_method': 'uniform', 'subsample': 0.488380                                                                     6088777897, 'gamma': 8.861657124608213}. Best is trial 174 with value: 4.325161198972311.
[I 2023-12-21 03:13:44,416] Trial 319 pruned. Trial was pruned at iteration 0.
[I 2023-12-21 03:13:44,460] Trial 320 pruned. Trial was pruned at iteration 0.
[I 2023-12-21 03:13:44,505] Trial 321 pruned. Trial was pruned at iteration 0.
[I 2023-12-21 03:13:44,550] Trial 322 pruned. Trial was pruned at iteration 0.
[I 2023-12-21 03:13:44,594] Trial 323 pruned. Trial was pruned at iteration 0.
[I 2023-12-21 03:13:44,639] Trial 324 pruned. Trial was pruned at iteration 0.
[I 2023-12-21 03:13:44,686] Trial 325 pruned. Trial was pruned at iteration 0.
[I 2023-12-21 03:13:44,731] Trial 326 pruned. Trial was pruned at iteration 0.
[I 2023-12-21 03:13:45,732] Trial 327 finished with value: inf and parameters: {'learning_rate': 0.9444475087415527, 'aft_loss_distributi                                                                     on': 'normal', 'aft_loss_distribution_scale': 1.1818863954071404, 'max_depth': 9, 'booster': 'dart', 'scale_pos_weight': 4.57650562810402                                                                     1, 'alpha': 8.751120984259945, 'lambda': 8.875321075417038, 'eta': 0.8475327458257086, 'sampling_method': 'uniform', 'subsample': 0.76683                                                                     22611566332, 'gamma': 9.452088765290465}. Best is trial 174 with value: 4.325161198972311.
[I 2023-12-21 03:13:45,778] Trial 328 pruned. Trial was pruned at iteration 0.
[I 2023-12-21 03:13:45,830] Trial 329 pruned. Trial was pruned at iteration 1.
[I 2023-12-21 03:13:45,875] Trial 330 pruned. Trial was pruned at iteration 0.
[I 2023-12-21 03:13:45,920] Trial 331 pruned. Trial was pruned at iteration 0.
[I 2023-12-21 03:13:45,969] Trial 332 pruned. Trial was pruned at iteration 0.
[I 2023-12-21 03:13:46,960] Trial 333 finished with value: inf and parameters: {'learning_rate': 0.9014705709054531, 'aft_loss_distributi                                                                     on': 'normal', 'aft_loss_distribution_scale': 1.1945490949404785, 'max_depth': 9, 'booster': 'dart', 'scale_pos_weight': 6.20132598296960                                                                     15, 'alpha': 7.862760071645597, 'lambda': 7.548750885511347, 'eta': 0.9218178389715712, 'sampling_method': 'uniform', 'subsample': 0.2477                                                                     3187378152506, 'gamma': 9.527614315313679}. Best is trial 174 with value: 4.325161198972311.
[I 2023-12-21 03:13:47,008] Trial 334 pruned. Trial was pruned at iteration 0.
[I 2023-12-21 03:13:47,055] Trial 335 pruned. Trial was pruned at iteration 1.
[I 2023-12-21 03:13:47,101] Trial 336 pruned. Trial was pruned at iteration 0.
[I 2023-12-21 03:13:47,146] Trial 337 pruned. Trial was pruned at iteration 0.
[I 2023-12-21 03:13:47,191] Trial 338 pruned. Trial was pruned at iteration 0.
[I 2023-12-21 03:13:47,240] Trial 339 pruned. Trial was pruned at iteration 0.
[I 2023-12-21 03:13:47,290] Trial 340 pruned. Trial was pruned at iteration 0.
[I 2023-12-21 03:13:47,337] Trial 341 pruned. Trial was pruned at iteration 0.
[I 2023-12-21 03:13:47,383] Trial 342 pruned. Trial was pruned at iteration 0.
[I 2023-12-21 03:13:47,428] Trial 343 pruned. Trial was pruned at iteration 0.
[I 2023-12-21 03:13:47,474] Trial 344 pruned. Trial was pruned at iteration 0.
[I 2023-12-21 03:13:47,520] Trial 345 pruned. Trial was pruned at iteration 0.
[I 2023-12-21 03:13:47,568] Trial 346 pruned. Trial was pruned at iteration 0.
[I 2023-12-21 03:13:47,614] Trial 347 pruned. Trial was pruned at iteration 0.
[I 2023-12-21 03:13:48,579] Trial 348 finished with value: inf and parameters: {'learning_rate': 0.9987601478576782, 'aft_loss_distributi                                                                     on': 'normal', 'aft_loss_distribution_scale': 1.1572309171727948, 'max_depth': 10, 'booster': 'dart', 'scale_pos_weight': 1.4578539767382                                                                     321, 'alpha': 9.14325751104824, 'lambda': 9.03873613649952, 'eta': 0.7966360108726215, 'sampling_method': 'gradient_based', 'subsample':                                                                      0.5438751051186588, 'gamma': 7.913862849644554}. Best is trial 174 with value: 4.325161198972311.
[I 2023-12-21 03:13:48,626] Trial 349 pruned. Trial was pruned at iteration 0.
[I 2023-12-21 03:13:48,686] Trial 350 pruned. Trial was pruned at iteration 0.
[I 2023-12-21 03:13:48,739] Trial 351 pruned. Trial was pruned at iteration 1.
[I 2023-12-21 03:13:48,786] Trial 352 pruned. Trial was pruned at iteration 0.
[I 2023-12-21 03:13:48,840] Trial 353 pruned. Trial was pruned at iteration 0.
[I 2023-12-21 03:13:48,887] Trial 354 pruned. Trial was pruned at iteration 0.
[I 2023-12-21 03:13:48,933] Trial 355 pruned. Trial was pruned at iteration 0.
[I 2023-12-21 03:13:48,988] Trial 356 pruned. Trial was pruned at iteration 1.
[I 2023-12-21 03:13:49,034] Trial 357 pruned. Trial was pruned at iteration 0.
[I 2023-12-21 03:13:49,080] Trial 358 pruned. Trial was pruned at iteration 0.
[I 2023-12-21 03:13:49,131] Trial 359 pruned. Trial was pruned at iteration 0.
[I 2023-12-21 03:13:49,179] Trial 360 pruned. Trial was pruned at iteration 0.
[I 2023-12-21 03:13:49,301] Trial 361 finished with value: inf and parameters: {'learning_rate': 0.9387358467014871, 'aft_loss_distributi                                                                     on': 'normal', 'aft_loss_distribution_scale': 1.2961782048621706, 'max_depth': 9, 'booster': 'gbtree', 'scale_pos_weight': 5.544346800809                                                                     322, 'alpha': 8.186504785391303, 'lambda': 8.338846515532447, 'eta': 0.8141650652417715, 'sampling_method': 'uniform', 'subsample': 0.504                                                                     0415849452463, 'gamma': 9.83502418366736}. Best is trial 174 with value: 4.325161198972311.
[I 2023-12-21 03:13:49,350] Trial 362 pruned. Trial was pruned at iteration 0.
[I 2023-12-21 03:13:49,397] Trial 363 pruned. Trial was pruned at iteration 0.
[I 2023-12-21 03:13:49,448] Trial 364 pruned. Trial was pruned at iteration 0.
[I 2023-12-21 03:13:49,495] Trial 365 pruned. Trial was pruned at iteration 0.
[I 2023-12-21 03:13:49,548] Trial 366 pruned. Trial was pruned at iteration 0.
[I 2023-12-21 03:13:49,595] Trial 367 pruned. Trial was pruned at iteration 0.
[I 2023-12-21 03:13:49,642] Trial 368 pruned. Trial was pruned at iteration 0.
[I 2023-12-21 03:13:49,689] Trial 369 pruned. Trial was pruned at iteration 0.
[I 2023-12-21 03:13:49,736] Trial 370 pruned. Trial was pruned at iteration 0.
[I 2023-12-21 03:13:49,783] Trial 371 pruned. Trial was pruned at iteration 0.
