[I 2023-12-18 23:39:58,845] Trial 472 pruned. Trial was pruned at iteration 0.
[I 2023-12-18 23:39:58,938] Trial 473 pruned. Trial was pruned at iteration 0.
[I 2023-12-18 23:39:59,027] Trial 474 pruned. Trial was pruned at iteration 0.
[I 2023-12-18 23:39:59,122] Trial 475 pruned. Trial was pruned at iteration 0.
[I 2023-12-18 23:39:59,217] Trial 476 pruned. Trial was pruned at iteration 0.
[I 2023-12-18 23:39:59,309] Trial 477 pruned. Trial was pruned at iteration 0.
[I 2023-12-18 23:39:59,401] Trial 478 pruned. Trial was pruned at iteration 0.
[I 2023-12-18 23:39:59,690] Trial 479 finished with value: 4.272389959342767 and parameters: {'learning_rate': 0.17441080483477567, 'aft_loss_distribution': 'logistic', 'aft_loss_distribution_scale': 0.7939786526872865, 'max_depth': 6, 'booster': 'gbtree', 'scale_pos_weight': 2.7572182659321403, 'alpha': 6.09548426310383, 'lambda': 3.2907383108569297, 'eta': 0.6116592739070714, 'sampling_method': 'uniform', 'subsample': 0.7630251119687836, 'gamma': 5.790824397215129}. Best is trial 204 with value: 4.197459375224944.
[I 2023-12-18 23:39:59,784] Trial 480 pruned. Trial was pruned at iteration 0.
[I 2023-12-18 23:39:59,873] Trial 481 pruned. Trial was pruned at iteration 0.
[I 2023-12-18 23:39:59,966] Trial 482 pruned. Trial was pruned at iteration 0.
[I 2023-12-18 23:40:00,064] Trial 483 pruned. Trial was pruned at iteration 0.
[I 2023-12-18 23:40:00,153] Trial 484 pruned. Trial was pruned at iteration 0.
[I 2023-12-18 23:40:00,483] Trial 485 finished with value: 4.2583536831762485 and parameters: {'learning_rate': 0.1427996373778734, 'aft_loss_distribution': 'logistic', 'aft_loss_distribution_scale': 0.7673262308456045, 'max_depth': 5, 'booster': 'gbtree', 'scale_pos_weight': 2.797624487639387, 'alpha': 6.091781192394043, 'lambda': 3.3334352751494127, 'eta': 0.8090951224158146, 'sampling_method': 'uniform', 'subsample': 0.7799027874882504, 'gamma': 6.351648504444699}. Best is trial 204 with value: 4.197459375224944.
[I 2023-12-18 23:40:00,579] Trial 486 pruned. Trial was pruned at iteration 0.
[I 2023-12-18 23:40:00,677] Trial 487 pruned. Trial was pruned at iteration 0.
[I 2023-12-18 23:40:00,763] Trial 488 pruned. Trial was pruned at iteration 0.
[I 2023-12-18 23:40:00,858] Trial 489 pruned. Trial was pruned at iteration 0.
[I 2023-12-18 23:40:00,948] Trial 490 pruned. Trial was pruned at iteration 0.
[I 2023-12-18 23:40:01,042] Trial 491 pruned. Trial was pruned at iteration 0.
[I 2023-12-18 23:40:01,131] Trial 492 pruned. Trial was pruned at iteration 0.
[I 2023-12-18 23:40:01,227] Trial 493 pruned. Trial was pruned at iteration 0.
[I 2023-12-18 23:40:01,321] Trial 494 pruned. Trial was pruned at iteration 0.
[I 2023-12-18 23:40:01,408] Trial 495 pruned. Trial was pruned at iteration 0.
[I 2023-12-18 23:40:01,507] Trial 496 pruned. Trial was pruned at iteration 1.
[I 2023-12-18 23:40:01,598] Trial 497 pruned. Trial was pruned at iteration 0.
[I 2023-12-18 23:40:01,696] Trial 498 pruned. Trial was pruned at iteration 0.
[I 2023-12-18 23:40:01,783] Trial 499 pruned. Trial was pruned at iteration 0.
Completed hyperparameter tuning with best aft-nloglik = 4.197459375224944.
Re-running the best trial... params = {'verbosity': 0, 'objective': 'survival:aft', 'eval_metric': 'aft-nloglik', 'tree_method': 'gpu_hist', 'device': 'cuda', 'learning_rate': 0.12057994717701176, 'aft_loss_distribution': 'logistic', 'aft_loss_distribution_scale': 0.6537852065917693, 'max_depth': 6, 'booster': 'dart', 'scale_pos_weight': 3.3310423646700134, 'alpha': 6.2699346604396995, 'lambda': 9.648298093112913, 'eta': 0.8361841927329997, 'sampling_method': 'uniform', 'subsample': 0.6975118568949835, 'gamma': 5.388160085412588}
[W 2023-12-18 23:43:24,887] Trial 32 is omitted in visualization because its objective value is inf or nan.
[W 2023-12-18 23:43:24,890] Trial 53 is omitted in visualization because its objective value is inf or nan.
[W 2023-12-18 23:43:24,896] Trial 111 is omitted in visualization because its objective value is inf or nan.
[W 2023-12-18 23:43:24,898] Trial 131 is omitted in visualization because its objective value is inf or nan.
[W 2023-12-18 23:43:24,899] Trial 200 is omitted in visualization because its objective value is inf or nan.
[W 2023-12-18 23:43:24,900] Trial 342 is omitted in visualization because its objective value is inf or nan.
TRN1 | R2:0.310; p:3.097e-141 | C:65.51 |3h:0.878 |6h:0.859 |9h:0.843 |12h:0.395 |15h:0.395 |18h:0.391 |24h:0.159 |48h:0.152 |72h:0.146 |1wk:0.020 |2wks:0.019 |1mon:0.013 |
TRN2 | R2:0.228; p:2.798e-75 | C:61.22 |3h:0.877 |6h:0.858 |9h:0.842 |12h:0.394 |15h:0.394 |18h:0.390 |24h:0.159 |48h:0.151 |72h:0.145 |1wk:0.020 |2wks:0.019 |1mon:0.013 |
VAL | R2:0.234; p:7.849e-80 | C:61.79 |3h:0.877 |6h:0.858 |9h:0.842 |12h:0.395 |15h:0.395 |18h:0.390 |24h:0.159 |48h:0.151 |72h:0.145 |1wk:0.020 |2wks:0.019 |1mon:0.013 |
TST | R2:0.102; p:7.362e-46 | C:54.92 |3h:0.871 |6h:0.849 |9h:0.832 |12h:0.390 |15h:0.390 |18h:0.379 |24h:0.122 |48h:0.117 |72h:0.114 |1wk:0.019 |2wks:0.018 |1mon:0.013 |
/content/drive/MyDrive/intermediates2/res//outcome1_xgb-aft_inp22_k3_emb2_rdims8.json
Dimensionality reduced word embedding 3 with ['location_numeric', 'race_numeric', 'sex_numeric']
Dimensionality reduced word embedding 3 with ['location_numeric', 'race_numeric', 'sex_numeric']
Dimensionality reduced word embedding 3 with ['location_numeric', 'race_numeric', 'sex_numeric']
Dimensionality reduced word embedding 3 with ['location_numeric', 'race_numeric', 'sex_numeric']
[I 2023-12-18 23:43:31,273] A new study created in memory with name: no-name-5daf5790-1717-4790-8e4f-67e6f526eda2
trn1
trn2
val
tst
[I 2023-12-18 23:43:34,530] Trial 0 finished with value: 4.597797254408575 and parameters: {'learning_rate': 0.39465974699535955, 'aft_loss_distribution': 'extreme', 'aft_loss_distribution_scale': 1.7985609190772451, 'max_depth': 7, 'booster': 'dart', 'scale_pos_weight': 3.4321510226352587, 'alpha': 0.7306398783521388, 'lambda': 2.6986064051379315, 'eta': 0.35988631353581546, 'sampling_method': 'uniform', 'subsample': 0.9639325649208275, 'gamma': 4.936859317058608}. Best is trial 0 with value: 4.597797254408575.
[I 2023-12-18 23:43:36,429] Trial 1 finished with value: inf and parameters: {'learning_rate': 0.298147605515855, 'aft_loss_distribution': 'normal', 'aft_loss_distribution_scale': 2.526050606845175, 'max_depth': 9, 'booster': 'dart', 'scale_pos_weight': 7.576694129809354, 'alpha': 0.5525330094371959, 'lambda': 2.5005373911715, 'eta': 0.5823535175214604, 'sampling_method': 'uniform', 'subsample': 0.4925139183849302, 'gamma': 0.9507011904237103}. Best is trial 0 with value: 4.597797254408575.
[I 2023-12-18 23:43:36,702] Trial 2 finished with value: 5.413667530860316 and parameters: {'learning_rate': 0.3484477357224442, 'aft_loss_distribution': 'extreme', 'aft_loss_distribution_scale': 5.154559293831723, 'max_depth': 7, 'booster': 'gbtree', 'scale_pos_weight': 4.621325260212542, 'alpha': 8.745834177704067, 'lambda': 0.7188264084348273, 'eta': 0.648620376352157, 'sampling_method': 'gradient_based', 'subsample': 0.06979574481839125, 'gamma': 9.982046726488678}. Best is trial 0 with value: 4.597797254408575.
[I 2023-12-18 23:43:36,833] Trial 3 finished with value: inf and parameters: {'learning_rate': 0.8130602936236173, 'aft_loss_distribution': 'extreme', 'aft_loss_distribution_scale': 7.388858919606192, 'max_depth': 3, 'booster': 'gbtree', 'scale_pos_weight': 5.762237550200671, 'alpha': 1.7233293160715812, 'lambda': 3.996651801892801, 'eta': 0.8297516134731259, 'sampling_method': 'uniform', 'subsample': 0.8540280383656623, 'gamma': 6.238843064131775}. Best is trial 0 with value: 4.597797254408575.
[I 2023-12-18 23:43:36,989] Trial 4 finished with value: inf and parameters: {'learning_rate': 0.29969152274881594, 'aft_loss_distribution': 'logistic', 'aft_loss_distribution_scale': 2.9069316298933856, 'max_depth': 9, 'booster': 'gbtree', 'scale_pos_weight': 8.624007302719752, 'alpha': 3.0235446688373737, 'lambda': 9.354224656136143, 'eta': 0.9798117375783573, 'sampling_method': 'gradient_based', 'subsample': 0.04927466232502835, 'gamma': 3.800356646648789}. Best is trial 0 with value: 4.597797254408575.
[I 2023-12-18 23:43:37,009] Trial 5 pruned. Trial was pruned at iteration 4.
[I 2023-12-18 23:43:37,021] Trial 6 pruned. Trial was pruned at iteration 0.
[I 2023-12-18 23:43:37,038] Trial 7 pruned. Trial was pruned at iteration 0.
[I 2023-12-18 23:43:37,047] Trial 8 pruned. Trial was pruned at iteration 0.
[I 2023-12-18 23:43:37,066] Trial 9 pruned. Trial was pruned at iteration 4.
[I 2023-12-18 23:43:37,123] Trial 10 pruned. Trial was pruned at iteration 0.
[I 2023-12-18 23:43:42,706] Trial 11 finished with value: 4.87996963926601 and parameters: {'learning_rate': 0.57337923503968, 'aft_loss_distribution': 'extreme', 'aft_loss_distribution_scale': 2.765936909387008, 'max_depth': 5, 'booster': 'dart', 'scale_pos_weight': 3.8729706879667343, 'alpha': 8.507682589954392, 'lambda': 0.3408663067097941, 'eta': 0.5898441723862551, 'sampling_method': 'uniform', 'subsample': 0.06493251975395553, 'gamma': 8.576145772551605}. Best is trial 0 with value: 4.597797254408575.
[I 2023-12-18 23:43:42,765] Trial 12 pruned. Trial was pruned at iteration 0.
[I 2023-12-18 23:43:42,841] Trial 13 pruned. Trial was pruned at iteration 5.
[I 2023-12-18 23:43:42,890] Trial 14 pruned. Trial was pruned at iteration 0.
[I 2023-12-18 23:43:42,958] Trial 15 pruned. Trial was pruned at iteration 4.
[I 2023-12-18 23:44:09,568] Trial 16 finished with value: 4.677261257093586 and parameters: {'learning_rate': 0.13009048833258363, 'aft_loss_distribution': 'logistic', 'aft_loss_distribution_scale': 1.5002184624391908, 'max_depth': 5, 'booster': 'dart', 'scale_pos_weight': 1.937679682003641, 'alpha': 8.998698681396583, 'lambda': 1.7615223690878152, 'eta': 0.36474086565554015, 'sampling_method': 'uniform', 'subsample': 0.9585923361553847, 'gamma': 8.341380330524787}. Best is trial 0 with value: 4.597797254408575.
[I 2023-12-18 23:44:09,685] Trial 17 pruned. Trial was pruned at iteration 0.
[I 2023-12-18 23:44:09,763] Trial 18 pruned. Trial was pruned at iteration 0.
[I 2023-12-18 23:44:09,845] Trial 19 pruned. Trial was pruned at iteration 0.
[I 2023-12-18 23:44:16,679] Trial 20 pruned. Trial was pruned at iteration 119.
[I 2023-12-18 23:44:16,795] Trial 21 pruned. Trial was pruned at iteration 5.
[I 2023-12-18 23:44:16,873] Trial 22 pruned. Trial was pruned at iteration 0.
[I 2023-12-18 23:44:16,951] Trial 23 pruned. Trial was pruned at iteration 1.
[I 2023-12-18 23:44:17,031] Trial 24 pruned. Trial was pruned at iteration 0.
[I 2023-12-18 23:44:17,105] Trial 25 pruned. Trial was pruned at iteration 0.
[I 2023-12-18 23:44:17,178] Trial 26 pruned. Trial was pruned at iteration 0.
[I 2023-12-18 23:44:17,257] Trial 27 pruned. Trial was pruned at iteration 0.
[I 2023-12-18 23:44:20,107] Trial 28 pruned. Trial was pruned at iteration 73.
[I 2023-12-18 23:44:20,177] Trial 29 pruned. Trial was pruned at iteration 4.
[I 2023-12-18 23:44:20,240] Trial 30 pruned. Trial was pruned at iteration 0.
[I 2023-12-18 23:44:20,293] Trial 31 pruned. Trial was pruned at iteration 0.
[I 2023-12-18 23:44:20,346] Trial 32 pruned. Trial was pruned at iteration 0.
[I 2023-12-18 23:44:20,409] Trial 33 pruned. Trial was pruned at iteration 4.
[I 2023-12-18 23:44:20,470] Trial 34 pruned. Trial was pruned at iteration 1.
[I 2023-12-18 23:44:20,524] Trial 35 pruned. Trial was pruned at iteration 0.
[I 2023-12-18 23:44:20,581] Trial 36 pruned. Trial was pruned at iteration 1.
[I 2023-12-18 23:44:20,898] Trial 37 finished with value: 4.706738890591063 and parameters: {'learning_rate': 0.16338049757400747, 'aft_loss_distribution': 'normal', 'aft_loss_distribution_scale': 2.5324523549861087, 'max_depth': 9, 'booster': 'gbtree', 'scale_pos_weight': 5.305044937299938, 'alpha': 3.0265626566388146, 'lambda': 4.184816095029186, 'eta': 0.524752670856764, 'sampling_method': 'gradient_based', 'subsample': 0.21328764181852894, 'gamma': 9.20058355743599}. Best is trial 0 with value: 4.597797254408575.
[I 2023-12-18 23:44:20,963] Trial 38 pruned. Trial was pruned at iteration 0.
[I 2023-12-18 23:44:21,015] Trial 39 pruned. Trial was pruned at iteration 0.
[I 2023-12-18 23:44:21,241] Trial 40 finished with value: inf and parameters: {'learning_rate': 0.793731649176105, 'aft_loss_distribution': 'normal', 'aft_loss_distribution_scale': 0.6698911758358266, 'max_depth': 10, 'booster': 'gbtree', 'scale_pos_weight': 7.921092494291061, 'alpha': 3.5758696873365596, 'lambda': 3.296319807129491, 'eta': 0.33786685976857106, 'sampling_method': 'uniform', 'subsample': 0.8813958902085048, 'gamma': 3.720436797799514}. Best is trial 0 with value: 4.597797254408575.
[I 2023-12-18 23:44:21,297] Trial 41 pruned. Trial was pruned at iteration 0.
[I 2023-12-18 23:44:21,356] Trial 42 pruned. Trial was pruned at iteration 1.
[I 2023-12-18 23:44:21,415] Trial 43 pruned. Trial was pruned at iteration 0.
[I 2023-12-18 23:44:21,478] Trial 44 pruned. Trial was pruned at iteration 0.
[I 2023-12-18 23:44:21,530] Trial 45 pruned. Trial was pruned at iteration 0.
[I 2023-12-18 23:44:21,746] Trial 46 finished with value: inf and parameters: {'learning_rate': 0.6165846274096197, 'aft_loss_distribution': 'normal', 'aft_loss_distribution_scale': 1.719494425223584, 'max_depth': 6, 'booster': 'gbtree', 'scale_pos_weight': 5.927395069468355, 'alpha': 8.724616321596166, 'lambda': 2.1473815298029546, 'eta': 0.42173798349017544, 'sampling_method': 'uniform', 'subsample': 0.9396745242603993, 'gamma': 6.408721580340292}. Best is trial 0 with value: 4.597797254408575.
[I 2023-12-18 23:44:21,804] Trial 47 pruned. Trial was pruned at iteration 0.
[I 2023-12-18 23:44:21,859] Trial 48 pruned. Trial was pruned at iteration 0.
[I 2023-12-18 23:44:21,914] Trial 49 pruned. Trial was pruned at iteration 0.
[I 2023-12-18 23:44:21,973] Trial 50 pruned. Trial was pruned at iteration 0.
[I 2023-12-18 23:44:22,038] Trial 51 pruned. Trial was pruned at iteration 0.
[I 2023-12-18 23:44:22,102] Trial 52 pruned. Trial was pruned at iteration 0.
[I 2023-12-18 23:44:22,162] Trial 53 pruned. Trial was pruned at iteration 1.
[I 2023-12-18 23:44:22,242] Trial 54 pruned. Trial was pruned at iteration 5.
[I 2023-12-18 23:44:22,302] Trial 55 pruned. Trial was pruned at iteration 0.
[I 2023-12-18 23:44:23,812] Trial 56 finished with value: inf and parameters: {'learning_rate': 0.5743250148852044, 'aft_loss_distribution': 'logistic', 'aft_loss_distribution_scale': 1.5191846307357797, 'max_depth': 4, 'booster': 'dart', 'scale_pos_weight': 6.692553447710296, 'alpha': 4.55541627548503, 'lambda': 0.4225238803729203, 'eta': 0.4620560823465469, 'sampling_method': 'uniform', 'subsample': 0.5454708680053677, 'gamma': 0.048072450681451606}. Best is trial 0 with value: 4.597797254408575.
[I 2023-12-18 23:44:23,876] Trial 57 pruned. Trial was pruned at iteration 0.
[I 2023-12-18 23:44:23,937] Trial 58 pruned. Trial was pruned at iteration 0.
[I 2023-12-18 23:44:23,996] Trial 59 pruned. Trial was pruned at iteration 1.
[I 2023-12-18 23:44:24,057] Trial 60 pruned. Trial was pruned at iteration 0.
[I 2023-12-18 23:44:24,115] Trial 61 pruned. Trial was pruned at iteration 0.
[I 2023-12-18 23:44:24,177] Trial 62 pruned. Trial was pruned at iteration 0.
[I 2023-12-18 23:44:24,252] Trial 63 pruned. Trial was pruned at iteration 5.
[I 2023-12-18 23:44:24,307] Trial 64 pruned. Trial was pruned at iteration 0.
[I 2023-12-18 23:44:24,361] Trial 65 pruned. Trial was pruned at iteration 0.
[I 2023-12-18 23:44:24,419] Trial 66 pruned. Trial was pruned at iteration 0.
[I 2023-12-18 23:44:24,776] Trial 67 finished with value: 4.495261433051529 and parameters: {'learning_rate': 0.15226821368734433, 'aft_loss_distribution': 'logistic', 'aft_loss_distribution_scale': 1.1618066988656666, 'max_depth': 3, 'booster': 'gbtree', 'scale_pos_weight': 4.944503049435329, 'alpha': 8.298650904220779, 'lambda': 1.7881148479693898, 'eta': 0.716560949320098, 'sampling_method': 'uniform', 'subsample': 0.4617381235565385, 'gamma': 8.637184341483572}. Best is trial 67 with value: 4.495261433051529.
[I 2023-12-18 23:44:25,109] Trial 68 finished with value: 4.41944283950727 and parameters: {'learning_rate': 0.1603282281035405, 'aft_loss_distribution': 'logistic', 'aft_loss_distribution_scale': 1.030650708128003, 'max_depth': 3, 'booster': 'gbtree', 'scale_pos_weight': 4.897802145097336, 'alpha': 8.857108286288195, 'lambda': 1.8616963670705446, 'eta': 0.7355282688709714, 'sampling_method': 'uniform', 'subsample': 0.6123113995209373, 'gamma': 8.595384387051752}. Best is trial 68 with value: 4.41944283950727.
[I 2023-12-18 23:44:25,176] Trial 69 pruned. Trial was pruned at iteration 0.
[I 2023-12-18 23:44:25,841] Trial 70 finished with value: 4.489617145803215 and parameters: {'learning_rate': 0.15954048524864858, 'aft_loss_distribution': 'logistic', 'aft_loss_distribution_scale': 1.1534179475715787, 'max_depth': 3, 'booster': 'gbtree', 'scale_pos_weight': 4.166331288660378, 'alpha': 8.151547379993444, 'lambda': 0.2557053592493652, 'eta': 0.7613710563405831, 'sampling_method': 'uniform', 'subsample': 0.43904347127128013, 'gamma': 4.61718199670315}. Best is trial 68 with value: 4.41944283950727.
[I 2023-12-18 23:44:26,480] Trial 71 finished with value: 4.397437187183542 and parameters: {'learning_rate': 0.15715756322447946, 'aft_loss_distribution': 'logistic', 'aft_loss_distribution_scale': 0.99145152715057, 'max_depth': 3, 'booster': 'gbtree', 'scale_pos_weight': 4.183443651383075, 'alpha': 8.228137525411976, 'lambda': 0.019605302615015918, 'eta': 0.7617681804208639, 'sampling_method': 'uniform', 'subsample': 0.4361620048241274, 'gamma': 4.618223395712071}. Best is trial 71 with value: 4.397437187183542.
[I 2023-12-18 23:44:26,541] Trial 72 pruned. Trial was pruned at iteration 0.
[I 2023-12-18 23:44:26,983] Trial 73 finished with value: 4.402227888991348 and parameters: {'learning_rate': 0.15305992914115488, 'aft_loss_distribution': 'logistic', 'aft_loss_distribution_scale': 0.9987403451162011, 'max_depth': 3, 'booster': 'gbtree', 'scale_pos_weight': 4.409891426205387, 'alpha': 8.1912226437591, 'lambda': 0.06481534568240316, 'eta': 0.7557265016557572, 'sampling_method': 'uniform', 'subsample': 0.4320343156328096, 'gamma': 4.343158852633494}. Best is trial 71 with value: 4.397437187183542.
[I 2023-12-18 23:44:27,620] Trial 74 finished with value: 4.327209065002558 and parameters: {'learning_rate': 0.1708848460231084, 'aft_loss_distribution': 'logistic', 'aft_loss_distribution_scale': 0.8700728226955207, 'max_depth': 3, 'booster': 'gbtree', 'scale_pos_weight': 4.564191058234525, 'alpha': 8.151056628089943, 'lambda': 0.9357196992677131, 'eta': 0.7663946026995851, 'sampling_method': 'uniform', 'subsample': 0.43151547722879097, 'gamma': 4.29516737290576}. Best is trial 74 with value: 4.327209065002558.
[I 2023-12-18 23:44:27,937] Trial 75 pruned. Trial was pruned at iteration 138.
[I 2023-12-18 23:44:27,993] Trial 76 pruned. Trial was pruned at iteration 0.
[I 2023-12-18 23:44:28,048] Trial 77 pruned. Trial was pruned at iteration 0.
[I 2023-12-18 23:44:28,113] Trial 78 pruned. Trial was pruned at iteration 0.
[I 2023-12-18 23:44:28,179] Trial 79 pruned. Trial was pruned at iteration 2.
[I 2023-12-18 23:44:28,359] Trial 80 finished with value: inf and parameters: {'learning_rate': 0.24349530384130472, 'aft_loss_distribution': 'logistic', 'aft_loss_distribution_scale': 0.8824173101723018, 'max_depth': 4, 'booster': 'gbtree', 'scale_pos_weight': 3.7963719981446387, 'alpha': 7.5965961862742, 'lambda': 0.8067264683387848, 'eta': 0.8289981412439676, 'sampling_method': 'uniform', 'subsample': 0.4205756333655639, 'gamma': 5.498239419381214}. Best is trial 74 with value: 4.327209065002558.
[I 2023-12-18 23:44:28,423] Trial 81 pruned. Trial was pruned at iteration 0.
[I 2023-12-18 23:44:28,480] Trial 82 pruned. Trial was pruned at iteration 0.
[I 2023-12-18 23:44:29,087] Trial 83 finished with value: 4.280027843395548 and parameters: {'learning_rate': 0.16113178044686013, 'aft_loss_distribution': 'logistic', 'aft_loss_distribution_scale': 0.7703020192741601, 'max_depth': 3, 'booster': 'gbtree', 'scale_pos_weight': 5.20739898949148, 'alpha': 8.938116316867136, 'lambda': 0.23233824158574284, 'eta': 0.7868464089948672, 'sampling_method': 'uniform', 'subsample': 0.47822734503755715, 'gamma': 4.442284575428701}. Best is trial 83 with value: 4.280027843395548.
[I 2023-12-18 23:44:29,149] Trial 84 pruned. Trial was pruned at iteration 0.
[I 2023-12-18 23:44:29,913] Trial 85 finished with value: 4.286349242913687 and parameters: {'learning_rate': 0.09635471375636388, 'aft_loss_distribution': 'logistic', 'aft_loss_distribution_scale': 0.780214856534132, 'max_depth': 3, 'booster': 'gbtree', 'scale_pos_weight': 4.701735438691865, 'alpha': 9.426384600733927, 'lambda': 0.012078229675378027, 'eta': 0.905041222965449, 'sampling_method': 'uniform', 'subsample': 0.5016176793960345, 'gamma': 5.033244491917212}. Best is trial 83 with value: 4.280027843395548.
[I 2023-12-18 23:44:30,008] Trial 86 pruned. Trial was pruned at iteration 0.
[I 2023-12-18 23:44:30,106] Trial 87 pruned. Trial was pruned at iteration 1.
[I 2023-12-18 23:44:30,197] Trial 88 pruned. Trial was pruned at iteration 0.
[I 2023-12-18 23:44:30,317] Trial 89 pruned. Trial was pruned at iteration 1.
[I 2023-12-18 23:44:30,885] Trial 90 pruned. Trial was pruned at iteration 204.
[I 2023-12-18 23:44:30,975] Trial 91 pruned. Trial was pruned at iteration 0.
[I 2023-12-18 23:44:31,070] Trial 92 pruned. Trial was pruned at iteration 1.
[I 2023-12-18 23:44:31,280] Trial 93 pruned. Trial was pruned at iteration 51.
[I 2023-12-18 23:44:31,367] Trial 94 pruned. Trial was pruned at iteration 0.
[I 2023-12-18 23:44:31,458] Trial 95 pruned. Trial was pruned at iteration 0.
[I 2023-12-18 23:44:31,548] Trial 96 pruned. Trial was pruned at iteration 0.
