[I 2023-12-21 04:10:12,878] Trial 499 pruned. Trial was pruned at iteration 2.
[W 2023-12-21 04:10:20,782] Trial 1 is omitted in visualization because its objective value is inf or nan.
[W 2023-12-21 04:10:20,782] Trial 4 is omitted in visualization because its objective value is inf or nan.
[W 2023-12-21 04:10:20,782] Trial 8 is omitted in visualization because its objective value is inf or nan.
[W 2023-12-21 04:10:20,782] Trial 11 is omitted in visualization because its objective value is inf or nan.
[W 2023-12-21 04:10:20,782] Trial 18 is omitted in visualization because its objective value is inf or nan.
[W 2023-12-21 04:10:20,782] Trial 52 is omitted in visualization because its objective value is inf or nan.
[W 2023-12-21 04:10:20,782] Trial 53 is omitted in visualization because its objective value is inf or nan.
[W 2023-12-21 04:10:20,782] Trial 58 is omitted in visualization because its objective value is inf or nan.
[W 2023-12-21 04:10:20,782] Trial 95 is omitted in visualization because its objective value is inf or nan.
[W 2023-12-21 04:10:20,783] Trial 104 is omitted in visualization because its objective value is inf or nan.
[W 2023-12-21 04:10:20,783] Trial 106 is omitted in visualization because its objective value is inf or nan.
[W 2023-12-21 04:10:20,783] Trial 109 is omitted in visualization because its objective value is inf or nan.
[W 2023-12-21 04:10:20,783] Trial 111 is omitted in visualization because its objective value is inf or nan.
[W 2023-12-21 04:10:20,783] Trial 113 is omitted in visualization because its objective value is inf or nan.
[W 2023-12-21 04:10:20,783] Trial 114 is omitted in visualization because its objective value is inf or nan.
[W 2023-12-21 04:10:20,783] Trial 115 is omitted in visualization because its objective value is inf or nan.
[W 2023-12-21 04:10:20,783] Trial 118 is omitted in visualization because its objective value is inf or nan.
[W 2023-12-21 04:10:20,783] Trial 120 is omitted in visualization because its objective value is inf or nan.
[W 2023-12-21 04:10:20,783] Trial 126 is omitted in visualization because its objective value is inf or nan.
[W 2023-12-21 04:10:20,783] Trial 128 is omitted in visualization because its objective value is inf or nan.
[W 2023-12-21 04:10:20,783] Trial 129 is omitted in visualization because its objective value is inf or nan.
[W 2023-12-21 04:10:20,783] Trial 132 is omitted in visualization because its objective value is inf or nan.
[W 2023-12-21 04:10:20,783] Trial 135 is omitted in visualization because its objective value is inf or nan.
[W 2023-12-21 04:10:20,783] Trial 139 is omitted in visualization because its objective value is inf or nan.
[W 2023-12-21 04:10:20,783] Trial 140 is omitted in visualization because its objective value is inf or nan.
[W 2023-12-21 04:10:20,783] Trial 145 is omitted in visualization because its objective value is inf or nan.
[W 2023-12-21 04:10:20,783] Trial 155 is omitted in visualization because its objective value is inf or nan.
[W 2023-12-21 04:10:20,784] Trial 158 is omitted in visualization because its objective value is inf or nan.
[W 2023-12-21 04:10:20,784] Trial 159 is omitted in visualization because its objective value is inf or nan.
[W 2023-12-21 04:10:20,784] Trial 162 is omitted in visualization because its objective value is inf or nan.
[W 2023-12-21 04:10:20,784] Trial 175 is omitted in visualization because its objective value is inf or nan.
[W 2023-12-21 04:10:20,784] Trial 181 is omitted in visualization because its objective value is inf or nan.
[W 2023-12-21 04:10:20,784] Trial 187 is omitted in visualization because its objective value is inf or nan.
[W 2023-12-21 04:10:20,784] Trial 192 is omitted in visualization because its objective value is inf or nan.
[W 2023-12-21 04:10:20,784] Trial 196 is omitted in visualization because its objective value is inf or nan.
[W 2023-12-21 04:10:20,784] Trial 198 is omitted in visualization because its objective value is inf or nan.
[W 2023-12-21 04:10:20,784] Trial 207 is omitted in visualization because its objective value is inf or nan.
[W 2023-12-21 04:10:20,784] Trial 269 is omitted in visualization because its objective value is inf or nan.
[W 2023-12-21 04:10:20,784] Trial 315 is omitted in visualization because its objective value is inf or nan.
[W 2023-12-21 04:10:20,784] Trial 328 is omitted in visualization because its objective value is inf or nan.
[W 2023-12-21 04:10:20,784] Trial 336 is omitted in visualization because its objective value is inf or nan.
[W 2023-12-21 04:10:20,784] Trial 342 is omitted in visualization because its objective value is inf or nan.
[W 2023-12-21 04:10:20,784] Trial 347 is omitted in visualization because its objective value is inf or nan.
[W 2023-12-21 04:10:20,784] Trial 350 is omitted in visualization because its objective value is inf or nan.
[W 2023-12-21 04:10:20,784] Trial 378 is omitted in visualization because its objective value is inf or nan.
[W 2023-12-21 04:10:20,784] Trial 380 is omitted in visualization because its objective value is inf or nan.
[W 2023-12-21 04:10:20,784] Trial 384 is omitted in visualization because its objective value is inf or nan.
[W 2023-12-21 04:10:20,784] Trial 385 is omitted in visualization because its objective value is inf or nan.
[W 2023-12-21 04:10:20,785] Trial 386 is omitted in visualization because its objective value is inf or nan.
[W 2023-12-21 04:10:20,785] Trial 388 is omitted in visualization because its objective value is inf or nan.
[W 2023-12-21 04:10:20,785] Trial 390 is omitted in visualization because its objective value is inf or nan.
[W 2023-12-21 04:10:20,785] Trial 393 is omitted in visualization because its objective value is inf or nan.
[W 2023-12-21 04:10:20,785] Trial 395 is omitted in visualization because its objective value is inf or nan.
[W 2023-12-21 04:10:20,785] Trial 396 is omitted in visualization because its objective value is inf or nan.
[W 2023-12-21 04:10:20,785] Trial 397 is omitted in visualization because its objective value is inf or nan.
[W 2023-12-21 04:10:20,785] Trial 402 is omitted in visualization because its objective value is inf or nan.
[W 2023-12-21 04:10:20,785] Trial 406 is omitted in visualization because its objective value is inf or nan.
[W 2023-12-21 04:10:20,785] Trial 414 is omitted in visualization because its objective value is inf or nan.
[W 2023-12-21 04:10:20,785] Trial 418 is omitted in visualization because its objective value is inf or nan.
[W 2023-12-21 04:10:20,785] Trial 429 is omitted in visualization because its objective value is inf or nan.
[W 2023-12-21 04:10:20,785] Trial 443 is omitted in visualization because its objective value is inf or nan.
[W 2023-12-21 04:10:20,785] Trial 452 is omitted in visualization because its objective value is inf or nan.
[W 2023-12-21 04:10:20,785] Trial 455 is omitted in visualization because its objective value is inf or nan.
[W 2023-12-21 04:10:20,785] Trial 456 is omitted in visualization because its objective value is inf or nan.
[W 2023-12-21 04:10:20,785] Trial 457 is omitted in visualization because its objective value is inf or nan.
[W 2023-12-21 04:10:20,785] Trial 477 is omitted in visualization because its objective value is inf or nan.
[W 2023-12-21 04:10:20,785] Trial 480 is omitted in visualization because its objective value is inf or nan.
[W 2023-12-21 04:10:20,785] Trial 498 is omitted in visualization because its objective value is inf or nan.
exo-open: Cannot open display: .
/cvmfs/soft.computecanada.ca/gentoo/2020/usr/bin/xdg-open: line 871: x-www-browser: command not found
/cvmfs/soft.computecanada.ca/gentoo/2020/usr/bin/xdg-open: line 871: firefox: command not found
/cvmfs/soft.computecanada.ca/gentoo/2020/usr/bin/xdg-open: line 871: iceweasel: command not found
/cvmfs/soft.computecanada.ca/gentoo/2020/usr/bin/xdg-open: line 871: seamonkey: command not found
/cvmfs/soft.computecanada.ca/gentoo/2020/usr/bin/xdg-open: line 871: mozilla: command not found
/cvmfs/soft.computecanada.ca/gentoo/2020/usr/bin/xdg-open: line 871: epiphany: command not found
/cvmfs/soft.computecanada.ca/gentoo/2020/usr/bin/xdg-open: line 871: konqueror: command not found
/cvmfs/soft.computecanada.ca/gentoo/2020/usr/bin/xdg-open: line 871: chromium: command not found
/cvmfs/soft.computecanada.ca/gentoo/2020/usr/bin/xdg-open: line 871: chromium-browser: command not found
/cvmfs/soft.computecanada.ca/gentoo/2020/usr/bin/xdg-open: line 871: google-chrome: command not found
/cvmfs/soft.computecanada.ca/gentoo/2020/usr/bin/xdg-open: line 871: www-browser: command not found
/cvmfs/soft.computecanada.ca/gentoo/2020/usr/bin/xdg-open: line 871: links2: command not found
/home/lisat/.local/lib/python3.10/site-packages/xgboost/data.py:440: FutureWarning:

is_sparse is deprecated and will be removed in a future version. Check `isinstance(dtype, pd.SparseDtype)` instead.

[I 2023-12-21 04:10:23,710] A new study created in memory with name: no-name-adaeabdb-c8fc-426e-a0bf-4e4600cf7d8f
[I 2023-12-21 04:10:23,867] Trial 0 finished with value: inf and parameters: {'learning_rate': 0.9822800524983142, 'aft_loss_distribution                                                                     ': 'normal', 'aft_loss_distribution_scale': 3.5383586615680516, 'max_depth': 4, 'booster': 'gbtree', 'scale_pos_weight': 0.55572914586351                                                                     01, 'alpha': 9.776298348612707, 'lambda': 2.477256959770783, 'eta': 0.30654223618788035, 'sampling_method': 'gradient_based', 'subsample'                                                                     : 0.06256930565973245, 'gamma': 6.5907826596213255}. Best is trial 0 with value: inf.
[I 2023-12-21 04:11:53,799] Trial 1 finished with value: 2.133716077399092 and parameters: {'learning_rate': 0.16475120647829497, 'aft_lo                                                                     ss_distribution': 'normal', 'aft_loss_distribution_scale': 2.929869182864289, 'max_depth': 9, 'booster': 'dart', 'scale_pos_weight': 2.26                                                                     12508670996596, 'alpha': 5.485592108819521, 'lambda': 2.6777612864712608, 'eta': 0.1667320698865813, 'sampling_method': 'uniform', 'subsa                                                                     mple': 0.564612636947932, 'gamma': 9.245719407770698}. Best is trial 1 with value: 2.133716077399092.
[I 2023-12-21 04:11:53,890] Trial 2 finished with value: inf and parameters: {'learning_rate': 0.6246164519391944, 'aft_loss_distribution                                                                     ': 'normal', 'aft_loss_distribution_scale': 8.614460476564256, 'max_depth': 5, 'booster': 'gbtree', 'scale_pos_weight': 2.459122182861993                                                                     , 'alpha': 2.6940126574041137, 'lambda': 1.275758439971284, 'eta': 0.939561725186497, 'sampling_method': 'gradient_based', 'subsample': 0                                                                     .933878854985673, 'gamma': 7.584187807603409}. Best is trial 1 with value: 2.133716077399092.
[I 2023-12-21 04:11:57,429] Trial 3 finished with value: 2.563324950770884 and parameters: {'learning_rate': 0.48305310514189886, 'aft_lo                                                                     ss_distribution': 'extreme', 'aft_loss_distribution_scale': 7.442988890094967, 'max_depth': 4, 'booster': 'dart', 'scale_pos_weight': 1.8                                                                     484266240357035, 'alpha': 5.4380428767908375, 'lambda': 5.600622741185841, 'eta': 0.8188954342756382, 'sampling_method': 'uniform', 'subs                                                                     ample': 0.6199618370513806, 'gamma': 0.10670423682554954}. Best is trial 1 with value: 2.133716077399092.
[I 2023-12-21 04:12:04,323] Trial 4 finished with value: 2.031779433856417 and parameters: {'learning_rate': 0.08761096748009423, 'aft_lo                                                                     ss_distribution': 'normal', 'aft_loss_distribution_scale': 1.8959820852150575, 'max_depth': 3, 'booster': 'dart', 'scale_pos_weight': 2.2                                                                     79260049246265, 'alpha': 1.9218721694198422, 'lambda': 2.2934298003661993, 'eta': 0.3340084816251673, 'sampling_method': 'gradient_based'                                                                     , 'subsample': 0.15922977049571876, 'gamma': 5.986119007898191}. Best is trial 4 with value: 2.031779433856417.
[I 2023-12-21 04:12:04,330] Trial 5 pruned. Trial was pruned at iteration 0.
[I 2023-12-21 04:12:04,335] Trial 6 pruned. Trial was pruned at iteration 0.
[I 2023-12-21 04:12:05,524] Trial 7 finished with value: inf and parameters: {'learning_rate': 0.34584083945716054, 'aft_loss_distributio                                                                     n': 'normal', 'aft_loss_distribution_scale': 3.0843465716308405, 'max_depth': 7, 'booster': 'dart', 'scale_pos_weight': 3.648665393263456                                                                     , 'alpha': 0.7827312941664772, 'lambda': 1.2385846710760864, 'eta': 0.025761223539098266, 'sampling_method': 'gradient_based', 'subsample                                                                     ': 0.6748305385062009, 'gamma': 7.278271715058953}. Best is trial 4 with value: 2.031779433856417.
[I 2023-12-21 04:12:05,541] Trial 8 pruned. Trial was pruned at iteration 3.
[I 2023-12-21 04:12:06,384] Trial 9 pruned. Trial was pruned at iteration 50.
[I 2023-12-21 04:12:06,422] Trial 10 pruned. Trial was pruned at iteration 0.
[I 2023-12-21 04:12:06,450] Trial 11 pruned. Trial was pruned at iteration 0.
[I 2023-12-21 04:12:06,478] Trial 12 pruned. Trial was pruned at iteration 0.
[I 2023-12-21 04:12:06,506] Trial 13 pruned. Trial was pruned at iteration 0.
[I 2023-12-21 04:12:06,640] Trial 14 pruned. Trial was pruned at iteration 50.
[I 2023-12-21 04:12:06,669] Trial 15 pruned. Trial was pruned at iteration 0.
[I 2023-12-21 04:12:07,535] Trial 16 pruned. Trial was pruned at iteration 50.
[I 2023-12-21 04:12:07,564] Trial 17 pruned. Trial was pruned at iteration 0.
[I 2023-12-21 04:12:07,594] Trial 18 pruned. Trial was pruned at iteration 1.
[I 2023-12-21 04:12:07,622] Trial 19 pruned. Trial was pruned at iteration 0.
[I 2023-12-21 04:12:07,653] Trial 20 pruned. Trial was pruned at iteration 1.
[I 2023-12-21 04:12:07,685] Trial 21 pruned. Trial was pruned at iteration 1.
[I 2023-12-21 04:12:07,721] Trial 22 pruned. Trial was pruned at iteration 0.
[I 2023-12-21 04:12:07,754] Trial 23 pruned. Trial was pruned at iteration 1.
[I 2023-12-21 04:12:07,784] Trial 24 pruned. Trial was pruned at iteration 0.
[I 2023-12-21 04:12:07,814] Trial 25 pruned. Trial was pruned at iteration 0.
[I 2023-12-21 04:12:07,851] Trial 26 pruned. Trial was pruned at iteration 3.
[I 2023-12-21 04:12:08,711] Trial 27 pruned. Trial was pruned at iteration 50.
[I 2023-12-21 04:12:08,743] Trial 28 pruned. Trial was pruned at iteration 0.
[I 2023-12-21 04:12:08,806] Trial 29 pruned. Trial was pruned at iteration 15.
[I 2023-12-21 04:12:09,717] Trial 30 pruned. Trial was pruned at iteration 50.
[I 2023-12-21 04:12:09,878] Trial 31 pruned. Trial was pruned at iteration 50.
[I 2023-12-21 04:12:10,083] Trial 32 finished with value: inf and parameters: {'learning_rate': 0.74098799090206, 'aft_loss_distribution'                                                                     : 'normal', 'aft_loss_distribution_scale': 2.3079782744392676, 'max_depth': 5, 'booster': 'gbtree', 'scale_pos_weight': 0.307301421953962                                                                     15, 'alpha': 9.56918654927316, 'lambda': 2.492813741311349, 'eta': 0.3064090065454948, 'sampling_method': 'gradient_based', 'subsample':                                                                      0.1139390975865728, 'gamma': 5.279566592888075}. Best is trial 4 with value: 2.031779433856417.
[I 2023-12-21 04:12:10,295] Trial 33 finished with value: inf and parameters: {'learning_rate': 0.9850469040293703, 'aft_loss_distributio                                                                     n': 'normal', 'aft_loss_distribution_scale': 2.8836878028211306, 'max_depth': 6, 'booster': 'gbtree', 'scale_pos_weight': 2.5495218795172                                                                     21, 'alpha': 9.97015943107553, 'lambda': 1.9680331069627113, 'eta': 0.48800583808883946, 'sampling_method': 'gradient_based', 'subsample'                                                                     : 0.07571466914305748, 'gamma': 4.132961685808777}. Best is trial 4 with value: 2.031779433856417.
[I 2023-12-21 04:12:10,328] Trial 34 pruned. Trial was pruned at iteration 0.
[I 2023-12-21 04:12:10,363] Trial 35 pruned. Trial was pruned at iteration 0.
[I 2023-12-21 04:12:10,397] Trial 36 pruned. Trial was pruned at iteration 1.
[I 2023-12-21 04:12:10,430] Trial 37 pruned. Trial was pruned at iteration 0.
[I 2023-12-21 04:12:10,462] Trial 38 pruned. Trial was pruned at iteration 0.
[I 2023-12-21 04:12:10,500] Trial 39 pruned. Trial was pruned at iteration 0.
[I 2023-12-21 04:12:11,381] Trial 40 pruned. Trial was pruned at iteration 51.
[I 2023-12-21 04:12:11,416] Trial 41 pruned. Trial was pruned at iteration 1.
[I 2023-12-21 04:12:11,454] Trial 42 pruned. Trial was pruned at iteration 2.
[I 2023-12-21 04:12:11,491] Trial 43 pruned. Trial was pruned at iteration 1.
[I 2023-12-21 04:12:11,523] Trial 44 pruned. Trial was pruned at iteration 0.
[I 2023-12-21 04:12:11,555] Trial 45 pruned. Trial was pruned at iteration 0.
[I 2023-12-21 04:12:11,589] Trial 46 pruned. Trial was pruned at iteration 1.
[I 2023-12-21 04:12:12,532] Trial 47 pruned. Trial was pruned at iteration 51.
[I 2023-12-21 04:12:12,565] Trial 48 pruned. Trial was pruned at iteration 0.
[I 2023-12-21 04:12:13,535] Trial 49 pruned. Trial was pruned at iteration 51.
[I 2023-12-21 04:12:13,571] Trial 50 pruned. Trial was pruned at iteration 0.
[I 2023-12-21 04:12:14,529] Trial 51 pruned. Trial was pruned at iteration 51.
[I 2023-12-21 04:12:15,482] Trial 52 pruned. Trial was pruned at iteration 51.
[I 2023-12-21 04:12:15,515] Trial 53 pruned. Trial was pruned at iteration 0.
[I 2023-12-21 04:12:15,551] Trial 54 pruned. Trial was pruned at iteration 0.
[I 2023-12-21 04:12:16,508] Trial 55 pruned. Trial was pruned at iteration 51.
[I 2023-12-21 04:12:16,549] Trial 56 pruned. Trial was pruned at iteration 0.
[I 2023-12-21 04:12:16,584] Trial 57 pruned. Trial was pruned at iteration 0.
[I 2023-12-21 04:12:16,692] Trial 58 finished with value: inf and parameters: {'learning_rate': 0.7311508278718786, 'aft_loss_distributio                                                                     n': 'normal', 'aft_loss_distribution_scale': 3.0134144472906983, 'max_depth': 7, 'booster': 'gbtree', 'scale_pos_weight': 2.6654916388926                                                                     09, 'alpha': 5.876970336489749, 'lambda': 2.1671490910244047, 'eta': 0.13949877088862994, 'sampling_method': 'uniform', 'subsample': 0.77                                                                     80688187202855, 'gamma': 9.501006064136352}. Best is trial 4 with value: 2.031779433856417.
[I 2023-12-21 04:12:16,726] Trial 59 pruned. Trial was pruned at iteration 0.
[I 2023-12-21 04:12:17,672] Trial 60 pruned. Trial was pruned at iteration 51.
[I 2023-12-21 04:12:17,874] Trial 61 finished with value: inf and parameters: {'learning_rate': 0.7487247580633578, 'aft_loss_distributio                                                                     n': 'normal', 'aft_loss_distribution_scale': 2.1512857513217134, 'max_depth': 5, 'booster': 'gbtree', 'scale_pos_weight': 0.4170542456031                                                                     471, 'alpha': 9.84420306490025, 'lambda': 2.447165427672381, 'eta': 0.3059975766836816, 'sampling_method': 'gradient_based', 'subsample':                                                                      0.1101828513766741, 'gamma': 4.910216231834006}. Best is trial 4 with value: 2.031779433856417.
[I 2023-12-21 04:12:17,909] Trial 62 pruned. Trial was pruned at iteration 0.
[I 2023-12-21 04:12:18,100] Trial 63 finished with value: inf and parameters: {'learning_rate': 0.7706826181870912, 'aft_loss_distributio                                                                     n': 'normal', 'aft_loss_distribution_scale': 2.3564808584582804, 'max_depth': 5, 'booster': 'gbtree', 'scale_pos_weight': 0.8139545721333                                                                     159, 'alpha': 9.00927564120597, 'lambda': 1.0616758138510358, 'eta': 0.26027612350500295, 'sampling_method': 'gradient_based', 'subsample                                                                     ': 0.15619103496547349, 'gamma': 3.7497868107220613}. Best is trial 4 with value: 2.031779433856417.
[I 2023-12-21 04:12:18,256] Trial 64 finished with value: inf and parameters: {'learning_rate': 0.8412216982892833, 'aft_loss_distributio                                                                     n': 'normal', 'aft_loss_distribution_scale': 2.5911559851845114, 'max_depth': 4, 'booster': 'gbtree', 'scale_pos_weight': 0.2939314384581                                                                     413, 'alpha': 5.153391308805645, 'lambda': 6.0885090581586985, 'eta': 0.004928309226584604, 'sampling_method': 'gradient_based', 'subsamp                                                                     le': 0.0459172808018784, 'gamma': 6.09473690977581}. Best is trial 4 with value: 2.031779433856417.
[I 2023-12-21 04:12:18,290] Trial 65 pruned. Trial was pruned at iteration 0.
[I 2023-12-21 04:12:18,325] Trial 66 pruned. Trial was pruned at iteration 0.
[I 2023-12-21 04:12:18,360] Trial 67 pruned. Trial was pruned at iteration 0.
