[I 2023-12-21 04:38:29,346] Trial 167 pruned. Trial was pruned at iteration 0.
[I 2023-12-21 04:38:29,386] Trial 168 pruned. Trial was pruned at iteration 0.
[I 2023-12-21 04:38:29,429] Trial 169 pruned. Trial was pruned at iteration 1.
[I 2023-12-21 04:38:29,472] Trial 170 pruned. Trial was pruned at iteration 0.
[I 2023-12-21 04:38:29,512] Trial 171 pruned. Trial was pruned at iteration 0.
[I 2023-12-21 04:38:29,555] Trial 172 pruned. Trial was pruned at iteration 1.
[I 2023-12-21 04:38:32,249] Trial 173 finished with value: 2.1107576668927304 and parameters: {'learning_rate': 0.5512362481396853, 'aft_                                                                     loss_distribution': 'logistic', 'aft_loss_distribution_scale': 1.6690258517147614, 'max_depth': 6, 'booster': 'dart', 'scale_pos_weight':                                                                      1.7011649141284275, 'alpha': 4.052796775183993, 'lambda': 3.4556367619614097, 'eta': 0.17243834817547196, 'sampling_method': 'uniform',                                                                      'subsample': 0.6073454772363788, 'gamma': 6.6447945798853505}. Best is trial 1 with value: 2.009838820527457.
[I 2023-12-21 04:38:32,290] Trial 174 pruned. Trial was pruned at iteration 0.
[I 2023-12-21 04:38:33,886] Trial 175 finished with value: inf and parameters: {'learning_rate': 0.5552268329619278, 'aft_loss_distributi                                                                     on': 'logistic', 'aft_loss_distribution_scale': 1.6613137826883768, 'max_depth': 6, 'booster': 'dart', 'scale_pos_weight': 1.767795981575                                                                     869, 'alpha': 4.035931336159976, 'lambda': 2.9772564608853163, 'eta': 0.13390103499976103, 'sampling_method': 'uniform', 'subsample': 0.6                                                                     337523351468842, 'gamma': 6.8703485773750215}. Best is trial 1 with value: 2.009838820527457.
[I 2023-12-21 04:38:33,926] Trial 176 pruned. Trial was pruned at iteration 0.
[I 2023-12-21 04:38:33,982] Trial 177 pruned. Trial was pruned at iteration 4.
[I 2023-12-21 04:38:34,022] Trial 178 pruned. Trial was pruned at iteration 0.
[I 2023-12-21 04:38:34,062] Trial 179 pruned. Trial was pruned at iteration 0.
[I 2023-12-21 04:38:34,102] Trial 180 pruned. Trial was pruned at iteration 0.
[I 2023-12-21 04:38:34,145] Trial 181 pruned. Trial was pruned at iteration 1.
[I 2023-12-21 04:38:34,187] Trial 182 pruned. Trial was pruned at iteration 1.
[I 2023-12-21 04:38:39,309] Trial 183 finished with value: 2.120824536465144 and parameters: {'learning_rate': 0.628880747655391, 'aft_lo                                                                     ss_distribution': 'logistic', 'aft_loss_distribution_scale': 1.6712194871891908, 'max_depth': 7, 'booster': 'dart', 'scale_pos_weight': 1                                                                     .2233343264194685, 'alpha': 5.5285277643932, 'lambda': 4.358895014471701, 'eta': 0.11890494157345613, 'sampling_method': 'uniform', 'subs                                                                     ample': 0.5583327758639258, 'gamma': 6.663628678105228}. Best is trial 1 with value: 2.009838820527457.
[I 2023-12-21 04:38:40,905] Trial 184 finished with value: inf and parameters: {'learning_rate': 0.6285556924900095, 'aft_loss_distributi                                                                     on': 'logistic', 'aft_loss_distribution_scale': 1.683606110592797, 'max_depth': 7, 'booster': 'dart', 'scale_pos_weight': 1.0878925607598                                                                     46, 'alpha': 5.603427680706572, 'lambda': 4.326195177107574, 'eta': 0.1261710788116009, 'sampling_method': 'uniform', 'subsample': 0.5629                                                                     802166935254, 'gamma': 6.6058575084568485}. Best is trial 1 with value: 2.009838820527457.
[I 2023-12-21 04:38:42,689] Trial 185 finished with value: inf and parameters: {'learning_rate': 0.5563811876183165, 'aft_loss_distributi                                                                     on': 'logistic', 'aft_loss_distribution_scale': 1.5269383093599338, 'max_depth': 7, 'booster': 'dart', 'scale_pos_weight': 1.263360069020                                                                     2142, 'alpha': 5.202058406438596, 'lambda': 2.5608536706180915, 'eta': 0.07268767231130562, 'sampling_method': 'uniform', 'subsample': 0.                                                                     5842381506431438, 'gamma': 6.850299522156026}. Best is trial 1 with value: 2.009838820527457.
[I 2023-12-21 04:38:42,729] Trial 186 pruned. Trial was pruned at iteration 0.
[I 2023-12-21 04:38:42,767] Trial 187 pruned. Trial was pruned at iteration 0.
[I 2023-12-21 04:38:42,825] Trial 188 pruned. Trial was pruned at iteration 4.
[I 2023-12-21 04:38:42,865] Trial 189 pruned. Trial was pruned at iteration 0.
[I 2023-12-21 04:38:42,908] Trial 190 pruned. Trial was pruned at iteration 1.
[I 2023-12-21 04:38:44,392] Trial 191 finished with value: inf and parameters: {'learning_rate': 0.5914741855622132, 'aft_loss_distributi                                                                     on': 'logistic', 'aft_loss_distribution_scale': 1.5885250411709897, 'max_depth': 7, 'booster': 'dart', 'scale_pos_weight': 1.209489842386                                                                     6927, 'alpha': 5.705320307393702, 'lambda': 3.9166509436654815, 'eta': 0.2365987998084777, 'sampling_method': 'uniform', 'subsample': 0.4                                                                     860939027141557, 'gamma': 6.691119842278111}. Best is trial 1 with value: 2.009838820527457.
[I 2023-12-21 04:38:44,438] Trial 192 pruned. Trial was pruned at iteration 1.
[I 2023-12-21 04:38:44,479] Trial 193 pruned. Trial was pruned at iteration 0.
[I 2023-12-21 04:38:44,518] Trial 194 pruned. Trial was pruned at iteration 0.
[I 2023-12-21 04:38:44,557] Trial 195 pruned. Trial was pruned at iteration 0.
[I 2023-12-21 04:38:44,597] Trial 196 pruned. Trial was pruned at iteration 0.
[I 2023-12-21 04:38:44,636] Trial 197 pruned. Trial was pruned at iteration 0.
[I 2023-12-21 04:38:44,677] Trial 198 pruned. Trial was pruned at iteration 0.
[I 2023-12-21 04:38:44,717] Trial 199 pruned. Trial was pruned at iteration 0.
[I 2023-12-21 04:38:44,759] Trial 200 pruned. Trial was pruned at iteration 1.
[I 2023-12-21 04:38:44,802] Trial 201 pruned. Trial was pruned at iteration 1.
[I 2023-12-21 04:38:47,994] Trial 202 finished with value: 2.0975843803518353 and parameters: {'learning_rate': 0.5069253729069964, 'aft_                                                                     loss_distribution': 'logistic', 'aft_loss_distribution_scale': 1.5958680940597736, 'max_depth': 7, 'booster': 'dart', 'scale_pos_weight':                                                                      1.626519882008079, 'alpha': 4.195702800735601, 'lambda': 3.403058798652565, 'eta': 0.18185880811123703, 'sampling_method': 'uniform', 's                                                                     ubsample': 0.4440563663672653, 'gamma': 7.732959490803871}. Best is trial 1 with value: 2.009838820527457.
[I 2023-12-21 04:38:50,181] Trial 203 finished with value: 2.095367938387705 and parameters: {'learning_rate': 0.4798116767366377, 'aft_l                                                                     oss_distribution': 'logistic', 'aft_loss_distribution_scale': 1.5217770587435007, 'max_depth': 7, 'booster': 'dart', 'scale_pos_weight':                                                                      1.469497423101861, 'alpha': 4.216770182152866, 'lambda': 3.1908118316405054, 'eta': 0.1804809624666781, 'sampling_method': 'uniform', 'su                                                                     bsample': 0.43225619366597867, 'gamma': 7.8285531771124015}. Best is trial 1 with value: 2.009838820527457.
[I 2023-12-21 04:38:55,456] Trial 204 finished with value: 2.0905655583025675 and parameters: {'learning_rate': 0.4951943452920612, 'aft_                                                                     loss_distribution': 'logistic', 'aft_loss_distribution_scale': 1.5035231744426647, 'max_depth': 7, 'booster': 'dart', 'scale_pos_weight':                                                                      1.6227508289913914, 'alpha': 4.111959887893898, 'lambda': 3.128589920712659, 'eta': 0.17922354951686223, 'sampling_method': 'uniform', '                                                                     subsample': 0.44085373639024694, 'gamma': 7.7271624118921585}. Best is trial 1 with value: 2.009838820527457.
[I 2023-12-21 04:38:57,024] Trial 205 finished with value: inf and parameters: {'learning_rate': 0.5175728478008305, 'aft_loss_distributi                                                                     on': 'logistic', 'aft_loss_distribution_scale': 1.501052687216958, 'max_depth': 7, 'booster': 'dart', 'scale_pos_weight': 1.6308992818618                                                                     68, 'alpha': 4.2547080317352055, 'lambda': 3.0430285656552893, 'eta': 0.1753981599743621, 'sampling_method': 'uniform', 'subsample': 0.47                                                                     40475407034981, 'gamma': 7.596028076851564}. Best is trial 1 with value: 2.009838820527457.
[I 2023-12-21 04:38:57,073] Trial 206 pruned. Trial was pruned at iteration 0.
[I 2023-12-21 04:38:57,114] Trial 207 pruned. Trial was pruned at iteration 0.
[I 2023-12-21 04:38:57,155] Trial 208 pruned. Trial was pruned at iteration 0.
[I 2023-12-21 04:39:00,304] Trial 209 finished with value: 2.1001167552576976 and parameters: {'learning_rate': 0.5295444540394775, 'aft_                                                                     loss_distribution': 'logistic', 'aft_loss_distribution_scale': 1.5872699438126776, 'max_depth': 7, 'booster': 'dart', 'scale_pos_weight':                                                                      1.4938025134735506, 'alpha': 4.827446708014809, 'lambda': 3.302953174232931, 'eta': 0.19268541397663208, 'sampling_method': 'uniform', '                                                                     subsample': 0.45404239906812544, 'gamma': 7.448901498697034}. Best is trial 1 with value: 2.009838820527457.
[I 2023-12-21 04:39:05,472] Trial 210 finished with value: 2.0990066671857943 and parameters: {'learning_rate': 0.4534056351362859, 'aft_                                                                     loss_distribution': 'logistic', 'aft_loss_distribution_scale': 1.6153036768972504, 'max_depth': 7, 'booster': 'dart', 'scale_pos_weight':                                                                      1.779796335068891, 'alpha': 4.90821663952204, 'lambda': 3.337158346536481, 'eta': 0.19600669548335814, 'sampling_method': 'uniform', 'su                                                                     bsample': 0.455779886405088, 'gamma': 7.436536617512709}. Best is trial 1 with value: 2.009838820527457.
[I 2023-12-21 04:39:08,719] Trial 211 finished with value: 2.10254195538238 and parameters: {'learning_rate': 0.5182499072291215, 'aft_lo                                                                     ss_distribution': 'logistic', 'aft_loss_distribution_scale': 1.570570836259881, 'max_depth': 7, 'booster': 'dart', 'scale_pos_weight': 1.                                                                     7861209812450363, 'alpha': 4.880713739339757, 'lambda': 3.2948774274786645, 'eta': 0.1967317344194679, 'sampling_method': 'uniform', 'sub                                                                     sample': 0.4532617059299376, 'gamma': 7.453885962943823}. Best is trial 1 with value: 2.009838820527457.
[I 2023-12-21 04:39:13,001] Trial 212 finished with value: 2.0935744324437078 and parameters: {'learning_rate': 0.46140542061467227, 'aft                                                                     _loss_distribution': 'logistic', 'aft_loss_distribution_scale': 1.5741646604028159, 'max_depth': 7, 'booster': 'dart', 'scale_pos_weight'                                                                     : 1.8544140586519, 'alpha': 4.815904166966332, 'lambda': 3.0389913878673944, 'eta': 0.204061166514924, 'sampling_method': 'uniform', 'sub                                                                     sample': 0.4319353706553067, 'gamma': 7.7773903823210055}. Best is trial 1 with value: 2.009838820527457.
[I 2023-12-21 04:39:18,210] Trial 213 finished with value: 2.0851804552854194 and parameters: {'learning_rate': 0.45214616007247066, 'aft                                                                     _loss_distribution': 'logistic', 'aft_loss_distribution_scale': 1.4829109107813965, 'max_depth': 7, 'booster': 'dart', 'scale_pos_weight'                                                                     : 1.854911480157677, 'alpha': 4.772178093105375, 'lambda': 3.267793363333173, 'eta': 0.19614098303948763, 'sampling_method': 'uniform', '                                                                     subsample': 0.39131555955888386, 'gamma': 7.758110667234864}. Best is trial 1 with value: 2.009838820527457.
[I 2023-12-21 04:39:20,906] Trial 214 finished with value: 2.076085617349676 and parameters: {'learning_rate': 0.4579565083501705, 'aft_l                                                                     oss_distribution': 'logistic', 'aft_loss_distribution_scale': 1.4203334947488746, 'max_depth': 7, 'booster': 'dart', 'scale_pos_weight':                                                                      1.8660575968928865, 'alpha': 4.866651273271983, 'lambda': 3.240524329359121, 'eta': 0.19947921337370747, 'sampling_method': 'uniform', 's                                                                     ubsample': 0.4393329341373457, 'gamma': 7.528464600929938}. Best is trial 1 with value: 2.009838820527457.
[I 2023-12-21 04:39:20,950] Trial 215 pruned. Trial was pruned at iteration 0.
[I 2023-12-21 04:39:22,939] Trial 216 finished with value: 2.0781266744406053 and parameters: {'learning_rate': 0.459898824472959, 'aft_l                                                                     oss_distribution': 'logistic', 'aft_loss_distribution_scale': 1.3872115212792266, 'max_depth': 7, 'booster': 'dart', 'scale_pos_weight':                                                                      2.0077956159032446, 'alpha': 4.580218548405968, 'lambda': 3.2198185346847166, 'eta': 0.20666887224374242, 'sampling_method': 'uniform', '                                                                     subsample': 0.45713970982781404, 'gamma': 7.533177949760139}. Best is trial 1 with value: 2.009838820527457.
[I 2023-12-21 04:39:24,440] Trial 217 finished with value: inf and parameters: {'learning_rate': 0.45884277558611986, 'aft_loss_distribut                                                                     ion': 'logistic', 'aft_loss_distribution_scale': 1.3337793937392628, 'max_depth': 7, 'booster': 'dart', 'scale_pos_weight': 1.97005422419                                                                     26358, 'alpha': 4.505719144516406, 'lambda': 3.2029605739823865, 'eta': 0.20417288286330412, 'sampling_method': 'uniform', 'subsample': 0                                                                     .43369437870962635, 'gamma': 7.80653991481919}. Best is trial 1 with value: 2.009838820527457.
[I 2023-12-21 04:39:27,551] Trial 218 finished with value: 2.084985019076933 and parameters: {'learning_rate': 0.45775691924866513, 'aft_                                                                     loss_distribution': 'logistic', 'aft_loss_distribution_scale': 1.4802778503410383, 'max_depth': 7, 'booster': 'dart', 'scale_pos_weight':                                                                      1.8182619518579275, 'alpha': 4.652321112021664, 'lambda': 2.5049567560835246, 'eta': 0.1890167660102866, 'sampling_method': 'uniform', '                                                                     subsample': 0.4486958759502336, 'gamma': 7.471513771374643}. Best is trial 1 with value: 2.009838820527457.
[I 2023-12-21 04:39:29,680] Trial 219 finished with value: 2.0818483616520935 and parameters: {'learning_rate': 0.41986948793562623, 'aft                                                                     _loss_distribution': 'logistic', 'aft_loss_distribution_scale': 1.4852803432662842, 'max_depth': 7, 'booster': 'dart', 'scale_pos_weight'                                                                     : 1.8144707569249103, 'alpha': 4.664723025544123, 'lambda': 2.3974766675190264, 'eta': 0.22226864864378498, 'sampling_method': 'uniform',                                                                      'subsample': 0.45702610624522344, 'gamma': 7.466944110839611}. Best is trial 1 with value: 2.009838820527457.
[I 2023-12-21 04:39:29,723] Trial 220 pruned. Trial was pruned at iteration 0.
[I 2023-12-21 04:39:32,624] Trial 221 finished with value: 2.0908847883086104 and parameters: {'learning_rate': 0.47474789671580697, 'aft                                                                     _loss_distribution': 'logistic', 'aft_loss_distribution_scale': 1.515240906904048, 'max_depth': 7, 'booster': 'dart', 'scale_pos_weight':                                                                      1.798864587983781, 'alpha': 4.885984318246135, 'lambda': 2.2113083178012136, 'eta': 0.22390399013789886, 'sampling_method': 'uniform', '                                                                     subsample': 0.46540791257058933, 'gamma': 7.478996093200241}. Best is trial 1 with value: 2.009838820527457.
[I 2023-12-21 04:39:34,572] Trial 222 finished with value: 2.084418286362422 and parameters: {'learning_rate': 0.4681569706931196, 'aft_l                                                                     oss_distribution': 'logistic', 'aft_loss_distribution_scale': 1.4847952535796909, 'max_depth': 7, 'booster': 'dart', 'scale_pos_weight':                                                                      2.0069812880476507, 'alpha': 4.894185855539285, 'lambda': 2.3306156475983295, 'eta': 0.2144594378231602, 'sampling_method': 'uniform', 's                                                                     ubsample': 0.4509716296565886, 'gamma': 7.407613605720135}. Best is trial 1 with value: 2.009838820527457.
[I 2023-12-21 04:39:34,614] Trial 223 pruned. Trial was pruned at iteration 0.
[I 2023-12-21 04:39:37,847] Trial 224 finished with value: 2.086309358032585 and parameters: {'learning_rate': 0.46669893276493746, 'aft_                                                                     loss_distribution': 'logistic', 'aft_loss_distribution_scale': 1.493454923871751, 'max_depth': 7, 'booster': 'dart', 'scale_pos_weight':                                                                      1.8805942297886926, 'alpha': 4.434374300141715, 'lambda': 2.3918774217415537, 'eta': 0.2018824331998461, 'sampling_method': 'uniform', 's                                                                     ubsample': 0.4571074378482016, 'gamma': 7.457868275605472}. Best is trial 1 with value: 2.009838820527457.
[I 2023-12-21 04:39:39,734] Trial 225 finished with value: 2.0834282158701174 and parameters: {'learning_rate': 0.46804828093894474, 'aft                                                                     _loss_distribution': 'logistic', 'aft_loss_distribution_scale': 1.44239082383644, 'max_depth': 7, 'booster': 'dart', 'scale_pos_weight':                                                                      1.9205336487228861, 'alpha': 4.406708532624652, 'lambda': 2.1490559148980863, 'eta': 0.22391235435635273, 'sampling_method': 'uniform', '                                                                     subsample': 0.46472943344553064, 'gamma': 7.751020278125611}. Best is trial 1 with value: 2.009838820527457.
[I 2023-12-21 04:39:41,148] Trial 226 finished with value: inf and parameters: {'learning_rate': 0.46734408977216113, 'aft_loss_distribut                                                                     ion': 'logistic', 'aft_loss_distribution_scale': 1.473050614255032, 'max_depth': 7, 'booster': 'dart', 'scale_pos_weight': 1.875885782233                                                                     1203, 'alpha': 4.39428583349924, 'lambda': 1.9310897399626525, 'eta': 0.2505715585494931, 'sampling_method': 'uniform', 'subsample': 0.46                                                                     48477369577694, 'gamma': 7.7483582190917835}. Best is trial 1 with value: 2.009838820527457.
[I 2023-12-21 04:39:41,191] Trial 227 pruned. Trial was pruned at iteration 0.
[I 2023-12-21 04:39:41,235] Trial 228 pruned. Trial was pruned at iteration 0.
[I 2023-12-21 04:39:41,275] Trial 229 pruned. Trial was pruned at iteration 0.
[I 2023-12-21 04:39:44,076] Trial 230 finished with value: 2.087519566732735 and parameters: {'learning_rate': 0.417609072760175, 'aft_lo                                                                     ss_distribution': 'logistic', 'aft_loss_distribution_scale': 1.4989854703850185, 'max_depth': 7, 'booster': 'dart', 'scale_pos_weight': 1                                                                     .9269134867100735, 'alpha': 4.965097484718057, 'lambda': 2.28967576126138, 'eta': 0.19045708725808919, 'sampling_method': 'uniform', 'sub                                                                     sample': 0.43477401593820597, 'gamma': 7.595785105791919}. Best is trial 1 with value: 2.009838820527457.
