[I 2023-12-21 03:59:58,328] Trial 43 finished with value: 4.702454345155782 and parameters: {'learning_rate': 0.6105934686356727, 'aft_lo                                                                     ss_distribution': 'normal', 'aft_loss_distribution_scale': 2.525090084240308, 'max_depth': 3, 'booster': 'gbtree', 'scale_pos_weight': 4.                                                                     007328662494649, 'alpha': 3.16212088117651, 'lambda': 3.313002750940294, 'eta': 0.9609458597802485, 'sampling_method': 'uniform', 'subsam                                                                     ple': 0.13249500610856732, 'gamma': 0.7108415279394742}. Best is trial 25 with value: 4.374254123678522.
[I 2023-12-21 03:59:58,781] Trial 44 finished with value: 4.723955332092586 and parameters: {'learning_rate': 0.6438298638245575, 'aft_lo                                                                     ss_distribution': 'normal', 'aft_loss_distribution_scale': 2.604971460586929, 'max_depth': 3, 'booster': 'gbtree', 'scale_pos_weight': 3.                                                                     5131721955851147, 'alpha': 3.1543866661039828, 'lambda': 3.1859646897026876, 'eta': 0.9638698545259662, 'sampling_method': 'uniform', 'su                                                                     bsample': 0.6953603564532953, 'gamma': 0.6966833041666862}. Best is trial 25 with value: 4.374254123678522.
[I 2023-12-21 03:59:58,812] Trial 45 pruned. Trial was pruned at iteration 0.
[I 2023-12-21 03:59:58,844] Trial 46 pruned. Trial was pruned at iteration 1.
[I 2023-12-21 03:59:58,877] Trial 47 pruned. Trial was pruned at iteration 0.
[I 2023-12-21 03:59:58,908] Trial 48 pruned. Trial was pruned at iteration 0.
[I 2023-12-21 03:59:58,939] Trial 49 pruned. Trial was pruned at iteration 0.
[I 2023-12-21 03:59:59,028] Trial 50 finished with value: inf and parameters: {'learning_rate': 0.6090179932502775, 'aft_loss_distributio                                                                     n': 'normal', 'aft_loss_distribution_scale': 2.014848040076128, 'max_depth': 4, 'booster': 'gbtree', 'scale_pos_weight': 2.8780158296095,                                                                      'alpha': 2.87703810243331, 'lambda': 3.8661435138492526, 'eta': 0.752441946779667, 'sampling_method': 'uniform', 'subsample': 0.45189275                                                                     555223946, 'gamma': 9.977879483343546}. Best is trial 25 with value: 4.374254123678522.
[I 2023-12-21 03:59:59,276] Trial 51 finished with value: 4.7467106044460845 and parameters: {'learning_rate': 0.6597875482907755, 'aft_l                                                                     oss_distribution': 'normal', 'aft_loss_distribution_scale': 2.6749879199890447, 'max_depth': 3, 'booster': 'gbtree', 'scale_pos_weight':                                                                      3.549716142055691, 'alpha': 3.611489658415838, 'lambda': 3.164815106959594, 'eta': 0.9458269097244432, 'sampling_method': 'uniform', 'sub                                                                     sample': 0.7726277174524123, 'gamma': 0.6759363891458035}. Best is trial 25 with value: 4.374254123678522.
[I 2023-12-21 03:59:59,310] Trial 52 pruned. Trial was pruned at iteration 1.
[I 2023-12-21 03:59:59,431] Trial 53 finished with value: inf and parameters: {'learning_rate': 0.7051266802894179, 'aft_loss_distributio                                                                     n': 'normal', 'aft_loss_distribution_scale': 1.4503010902324238, 'max_depth': 3, 'booster': 'gbtree', 'scale_pos_weight': 3.2873537414593                                                                     677, 'alpha': 3.0149573000200385, 'lambda': 4.993746477435704, 'eta': 0.9955208063262538, 'sampling_method': 'uniform', 'subsample': 0.60                                                                     53296876415378, 'gamma': 1.9928203942537817}. Best is trial 25 with value: 4.374254123678522.
[I 2023-12-21 03:59:59,463] Trial 54 pruned. Trial was pruned at iteration 1.
[I 2023-12-21 03:59:59,495] Trial 55 pruned. Trial was pruned at iteration 0.
[I 2023-12-21 03:59:59,639] Trial 56 finished with value: inf and parameters: {'learning_rate': 0.7496021296171649, 'aft_loss_distributio                                                                     n': 'normal', 'aft_loss_distribution_scale': 1.0137866264345536, 'max_depth': 5, 'booster': 'gbtree', 'scale_pos_weight': 3.8062495360766                                                                     83, 'alpha': 4.601910714183221, 'lambda': 2.8694928978714627, 'eta': 0.8962764400735613, 'sampling_method': 'uniform', 'subsample': 0.719                                                                     7202718942458, 'gamma': 0.8177363113490561}. Best is trial 25 with value: 4.374254123678522.
[I 2023-12-21 03:59:59,671] Trial 57 pruned. Trial was pruned at iteration 0.
[I 2023-12-21 03:59:59,702] Trial 58 pruned. Trial was pruned at iteration 0.
[I 2023-12-21 03:59:59,735] Trial 59 pruned. Trial was pruned at iteration 0.
[I 2023-12-21 03:59:59,770] Trial 60 pruned. Trial was pruned at iteration 1.
[I 2023-12-21 03:59:59,803] Trial 61 pruned. Trial was pruned at iteration 1.
[I 2023-12-21 04:00:00,039] Trial 62 finished with value: 4.659192420453324 and parameters: {'learning_rate': 0.6628259992508729, 'aft_lo                                                                     ss_distribution': 'normal', 'aft_loss_distribution_scale': 2.3911150863747586, 'max_depth': 3, 'booster': 'gbtree', 'scale_pos_weight': 2                                                                     .493675937820317, 'alpha': 3.955664348100715, 'lambda': 3.15255667626591, 'eta': 0.9480789734303824, 'sampling_method': 'uniform', 'subsa                                                                     mple': 0.7551511769651386, 'gamma': 1.6247611195715796}. Best is trial 25 with value: 4.374254123678522.
[I 2023-12-21 04:00:00,309] Trial 63 finished with value: 4.412030334635486 and parameters: {'learning_rate': 0.6914877730952312, 'aft_lo                                                                     ss_distribution': 'normal', 'aft_loss_distribution_scale': 1.6861818570267353, 'max_depth': 3, 'booster': 'gbtree', 'scale_pos_weight': 1                                                                     .07704311581141, 'alpha': 4.53695919726166, 'lambda': 2.0009095076042342, 'eta': 0.9976877514865494, 'sampling_method': 'uniform', 'subsa                                                                     mple': 0.9110759779434422, 'gamma': 1.5426016036431835}. Best is trial 25 with value: 4.374254123678522.
[I 2023-12-21 04:00:00,438] Trial 64 finished with value: 4.37978881481454 and parameters: {'learning_rate': 0.705877451147307, 'aft_loss                                                                     _distribution': 'normal', 'aft_loss_distribution_scale': 1.5948277181595765, 'max_depth': 3, 'booster': 'gbtree', 'scale_pos_weight': 0.8                                                                     917105973244064, 'alpha': 4.096605326605214, 'lambda': 1.521399502435666, 'eta': 0.01632654743993034, 'sampling_method': 'uniform', 'subs                                                                     ample': 0.8930657377643253, 'gamma': 1.6179598713049246}. Best is trial 25 with value: 4.374254123678522.
[I 2023-12-21 04:00:00,548] Trial 65 finished with value: inf and parameters: {'learning_rate': 0.7128487296104724, 'aft_loss_distributio                                                                     n': 'normal', 'aft_loss_distribution_scale': 1.2162611132986247, 'max_depth': 4, 'booster': 'gbtree', 'scale_pos_weight': 0.9557956049397                                                                     898, 'alpha': 4.25020076761213, 'lambda': 1.3053424251072965, 'eta': 0.07795149849318797, 'sampling_method': 'uniform', 'subsample': 0.94                                                                     21341946399033, 'gamma': 1.7209196549728054}. Best is trial 25 with value: 4.374254123678522.
[I 2023-12-21 04:00:00,679] Trial 66 finished with value: 4.496596182665051 and parameters: {'learning_rate': 0.6886971267543414, 'aft_lo                                                                     ss_distribution': 'normal', 'aft_loss_distribution_scale': 1.9192214875727474, 'max_depth': 3, 'booster': 'gbtree', 'scale_pos_weight': 0                                                                     .6598578317284775, 'alpha': 5.005087803126756, 'lambda': 1.975996635904834, 'eta': 0.3738018480908297, 'sampling_method': 'uniform', 'sub                                                                     sample': 0.8769342056427332, 'gamma': 2.099171838546739}. Best is trial 25 with value: 4.374254123678522.
[I 2023-12-21 04:00:00,712] Trial 67 pruned. Trial was pruned at iteration 0.
[I 2023-12-21 04:00:00,847] Trial 68 finished with value: inf and parameters: {'learning_rate': 0.8193969556611514, 'aft_loss_distributio                                                                     n': 'normal', 'aft_loss_distribution_scale': 0.7495418803525391, 'max_depth': 3, 'booster': 'gbtree', 'scale_pos_weight': 0.5233591965513                                                                     187, 'alpha': 5.66437222360623, 'lambda': 0.9369795341275347, 'eta': 0.17618764924867622, 'sampling_method': 'gradient_based', 'subsample                                                                     ': 0.9023664159515835, 'gamma': 1.4983282541524576}. Best is trial 25 with value: 4.374254123678522.
[I 2023-12-21 04:00:00,880] Trial 69 pruned. Trial was pruned at iteration 0.
[I 2023-12-21 04:00:00,993] Trial 70 finished with value: inf and parameters: {'learning_rate': 0.6908947171346235, 'aft_loss_distributio                                                                     n': 'normal', 'aft_loss_distribution_scale': 1.6060968511110496, 'max_depth': 3, 'booster': 'gbtree', 'scale_pos_weight': 1.2933828529289                                                                     29, 'alpha': 6.371590398748252, 'lambda': 1.7346935265295378, 'eta': 0.45570954105679184, 'sampling_method': 'uniform', 'subsample': 0.95                                                                     43482479772306, 'gamma': 1.8352780349135758}. Best is trial 25 with value: 4.374254123678522.
[I 2023-12-21 04:00:01,026] Trial 71 pruned. Trial was pruned at iteration 0.
[I 2023-12-21 04:00:01,157] Trial 72 finished with value: 4.284269350730189 and parameters: {'learning_rate': 0.6809154571874171, 'aft_lo                                                                     ss_distribution': 'normal', 'aft_loss_distribution_scale': 1.3037830286853986, 'max_depth': 3, 'booster': 'gbtree', 'scale_pos_weight': 1                                                                     .1432458996819312, 'alpha': 5.967660278936325, 'lambda': 0.5967955579706743, 'eta': 0.31835362927770605, 'sampling_method': 'uniform', 's                                                                     ubsample': 0.8030005551896107, 'gamma': 2.461036077402581}. Best is trial 72 with value: 4.284269350730189.
[I 2023-12-21 04:00:01,190] Trial 73 pruned. Trial was pruned at iteration 0.
[I 2023-12-21 04:00:01,223] Trial 74 pruned. Trial was pruned at iteration 0.
[I 2023-12-21 04:00:01,319] Trial 75 finished with value: inf and parameters: {'learning_rate': 0.7171024290120803, 'aft_loss_distributio                                                                     n': 'normal', 'aft_loss_distribution_scale': 1.9763089718039233, 'max_depth': 3, 'booster': 'gbtree', 'scale_pos_weight': 2.3015143405842                                                                     19, 'alpha': 5.866643292763318, 'lambda': 1.418120152086943, 'eta': 0.3119401706487848, 'sampling_method': 'uniform', 'subsample': 0.8611                                                                     007642894841, 'gamma': 2.4067081949626257}. Best is trial 72 with value: 4.284269350730189.
[I 2023-12-21 04:00:01,354] Trial 76 pruned. Trial was pruned at iteration 0.
[I 2023-12-21 04:00:01,387] Trial 77 pruned. Trial was pruned at iteration 0.
[I 2023-12-21 04:00:01,420] Trial 78 pruned. Trial was pruned at iteration 0.
[I 2023-12-21 04:00:01,564] Trial 79 finished with value: 4.238592942218661 and parameters: {'learning_rate': 0.7306141106296162, 'aft_lo                                                                     ss_distribution': 'normal', 'aft_loss_distribution_scale': 1.0834598707758532, 'max_depth': 5, 'booster': 'gbtree', 'scale_pos_weight': 2                                                                     .6939191026076186, 'alpha': 6.924261836710685, 'lambda': 1.686998490432024, 'eta': 0.4254033225655198, 'sampling_method': 'gradient_based                                                                     ', 'subsample': 0.7953470932384018, 'gamma': 2.981630921111412}. Best is trial 79 with value: 4.238592942218661.
[I 2023-12-21 04:00:01,597] Trial 80 pruned. Trial was pruned at iteration 0.
[I 2023-12-21 04:00:01,738] Trial 81 finished with value: 4.234078754776428 and parameters: {'learning_rate': 0.8087387626946215, 'aft_lo                                                                     ss_distribution': 'normal', 'aft_loss_distribution_scale': 1.0617460518337503, 'max_depth': 3, 'booster': 'gbtree', 'scale_pos_weight': 1                                                                     .4778261829309591, 'alpha': 6.835744131137609, 'lambda': 0.604471434933769, 'eta': 0.33608240777129245, 'sampling_method': 'gradient_base                                                                     d', 'subsample': 0.7998685575797144, 'gamma': 2.0659988424334053}. Best is trial 81 with value: 4.234078754776428.
[I 2023-12-21 04:00:01,911] Trial 82 finished with value: 4.2415418520513555 and parameters: {'learning_rate': 0.7262910677170888, 'aft_l                                                                     oss_distribution': 'normal', 'aft_loss_distribution_scale': 1.07154280560995, 'max_depth': 6, 'booster': 'gbtree', 'scale_pos_weight': 1.                                                                     6993187119228028, 'alpha': 7.046891592275722, 'lambda': 0.6257068067096301, 'eta': 0.35160831985396634, 'sampling_method': 'gradient_base                                                                     d', 'subsample': 0.8393206849026724, 'gamma': 1.9982551838851703}. Best is trial 81 with value: 4.234078754776428.
[I 2023-12-21 04:00:01,946] Trial 83 pruned. Trial was pruned at iteration 0.
[I 2023-12-21 04:00:02,090] Trial 84 finished with value: 4.253900854307188 and parameters: {'learning_rate': 0.728822925445187, 'aft_los                                                                     s_distribution': 'normal', 'aft_loss_distribution_scale': 1.0861380279207506, 'max_depth': 7, 'booster': 'gbtree', 'scale_pos_weight': 1.                                                                     1443442668219075, 'alpha': 6.956941845422402, 'lambda': 0.37456198888339154, 'eta': 0.32737097111062735, 'sampling_method': 'gradient_bas                                                                     ed', 'subsample': 0.8188695348841973, 'gamma': 2.094099807077477}. Best is trial 81 with value: 4.234078754776428.
[I 2023-12-21 04:00:02,202] Trial 85 finished with value: inf and parameters: {'learning_rate': 0.7359107944278961, 'aft_loss_distributio                                                                     n': 'normal', 'aft_loss_distribution_scale': 1.0610610779305114, 'max_depth': 7, 'booster': 'gbtree', 'scale_pos_weight': 1.2338203990326                                                                     948, 'alpha': 7.054942721963915, 'lambda': 0.026232083679135543, 'eta': 0.33970859810830806, 'sampling_method': 'gradient_based', 'subsam                                                                     ple': 0.8005791915294035, 'gamma': 3.169397286401437}. Best is trial 81 with value: 4.234078754776428.
[I 2023-12-21 04:00:02,321] Trial 86 finished with value: inf and parameters: {'learning_rate': 0.8260181499952158, 'aft_loss_distributio                                                                     n': 'normal', 'aft_loss_distribution_scale': 0.7704457372848301, 'max_depth': 7, 'booster': 'gbtree', 'scale_pos_weight': 1.0703578637979                                                                     037, 'alpha': 8.110373929918179, 'lambda': 0.3862017350655192, 'eta': 0.3821680021117955, 'sampling_method': 'gradient_based', 'subsample                                                                     ': 0.8483591286362032, 'gamma': 2.018779692084443}. Best is trial 81 with value: 4.234078754776428.
[I 2023-12-21 04:00:02,583] Trial 87 finished with value: 4.279814032888425 and parameters: {'learning_rate': 0.7628039244970792, 'aft_lo                                                                     ss_distribution': 'normal', 'aft_loss_distribution_scale': 1.2725123281692197, 'max_depth': 8, 'booster': 'gbtree', 'scale_pos_weight': 0                                                                     .7498409342655608, 'alpha': 7.557115070047244, 'lambda': 1.130782104710248, 'eta': 0.42863172632273283, 'sampling_method': 'gradient_base                                                                     d', 'subsample': 0.925590425159978, 'gamma': 3.5370104628015726}. Best is trial 81 with value: 4.234078754776428.
[I 2023-12-21 04:00:02,617] Trial 88 pruned. Trial was pruned at iteration 0.
[I 2023-12-21 04:00:02,724] Trial 89 finished with value: inf and parameters: {'learning_rate': 0.810297328487456, 'aft_loss_distribution                                                                     ': 'normal', 'aft_loss_distribution_scale': 1.2359065444733697, 'max_depth': 8, 'booster': 'gbtree', 'scale_pos_weight': 1.49946557442722                                                                     52, 'alpha': 6.771260886802904, 'lambda': 0.7285224309024245, 'eta': 0.4205896162875992, 'sampling_method': 'gradient_based', 'subsample'                                                                     : 0.9753216839163258, 'gamma': 3.857811329774796}. Best is trial 81 with value: 4.234078754776428.
[I 2023-12-21 04:00:02,758] Trial 90 pruned. Trial was pruned at iteration 0.
[I 2023-12-21 04:00:02,871] Trial 91 finished with value: inf and parameters: {'learning_rate': 0.7343171625520051, 'aft_loss_distributio                                                                     n': 'normal', 'aft_loss_distribution_scale': 1.3752417691044714, 'max_depth': 6, 'booster': 'gbtree', 'scale_pos_weight': 0.6455296058258                                                                     423, 'alpha': 6.87264256116446, 'lambda': 0.31331909506894773, 'eta': 0.41922437497684945, 'sampling_method': 'gradient_based', 'subsampl                                                                     e': 0.8788328043582977, 'gamma': 2.164777465009158}. Best is trial 81 with value: 4.234078754776428.
[I 2023-12-21 04:00:02,905] Trial 92 pruned. Trial was pruned at iteration 0.
[I 2023-12-21 04:00:03,025] Trial 93 finished with value: inf and parameters: {'learning_rate': 0.7213538393138081, 'aft_loss_distributio                                                                     n': 'normal', 'aft_loss_distribution_scale': 1.7649483156882846, 'max_depth': 6, 'booster': 'gbtree', 'scale_pos_weight': 1.0029016436793                                                                     636, 'alpha': 6.510802060482302, 'lambda': 0.79858491153358, 'eta': 0.23077658627919853, 'sampling_method': 'gradient_based', 'subsample'                                                                     : 0.8973568264238531, 'gamma': 1.9596041039457122}. Best is trial 81 with value: 4.234078754776428.
[I 2023-12-21 04:00:03,232] Trial 94 finished with value: 4.256153141852559 and parameters: {'learning_rate': 0.758031265674806, 'aft_los                                                                     s_distribution': 'normal', 'aft_loss_distribution_scale': 1.1307244362625775, 'max_depth': 7, 'booster': 'gbtree', 'scale_pos_weight': 0.                                                                     7025437729558731, 'alpha': 7.712196033241532, 'lambda': 1.786219468429451, 'eta': 0.4560852075353672, 'sampling_method': 'gradient_based'                                                                     , 'subsample': 0.9601653556586921, 'gamma': 2.4941718238865684}. Best is trial 81 with value: 4.234078754776428.
[I 2023-12-21 04:00:03,343] Trial 95 finished with value: inf and parameters: {'learning_rate': 0.7551359755606825, 'aft_loss_distributio                                                                     n': 'normal', 'aft_loss_distribution_scale': 1.0642308610891527, 'max_depth': 7, 'booster': 'gbtree', 'scale_pos_weight': 1.7177051400110                                                                     916, 'alpha': 7.708464783718182, 'lambda': 0.4657811042614435, 'eta': 0.4649385360065327, 'sampling_method': 'gradient_based', 'subsample                                                                     ': 0.9617436499276381, 'gamma': 2.5631183176124415}. Best is trial 81 with value: 4.234078754776428.
[I 2023-12-21 04:00:03,377] Trial 96 pruned. Trial was pruned at iteration 0.
