[I 2023-12-21 04:12:18,396] Trial 68 pruned. Trial was pruned at iteration 0.
[I 2023-12-21 04:12:18,432] Trial 69 pruned. Trial was pruned at iteration 0.
[I 2023-12-21 04:12:18,466] Trial 70 pruned. Trial was pruned at iteration 0.
[I 2023-12-21 04:12:18,502] Trial 71 pruned. Trial was pruned at iteration 0.
[I 2023-12-21 04:12:18,796] Trial 72 finished with value: inf and parameters: {'learning_rate': 0.9335266155551302, 'aft_loss_distributio                                                                     n': 'normal', 'aft_loss_distribution_scale': 2.874330443185078, 'max_depth': 7, 'booster': 'gbtree', 'scale_pos_weight': 2.52395866134411                                                                     14, 'alpha': 8.841190333106173, 'lambda': 1.4216554448794194, 'eta': 0.3502093806796967, 'sampling_method': 'gradient_based', 'subsample'                                                                     : 0.12504355490611005, 'gamma': 0.5721421927641174}. Best is trial 4 with value: 2.031779433856417.
[I 2023-12-21 04:12:19,025] Trial 73 finished with value: inf and parameters: {'learning_rate': 0.9306135628810408, 'aft_loss_distributio                                                                     n': 'normal', 'aft_loss_distribution_scale': 2.7666145372389845, 'max_depth': 6, 'booster': 'gbtree', 'scale_pos_weight': 1.1909448076126                                                                     112, 'alpha': 9.50624317132079, 'lambda': 2.1977274665335043, 'eta': 0.4767447589634191, 'sampling_method': 'gradient_based', 'subsample'                                                                     : 0.13929930064742546, 'gamma': 7.596378712129107}. Best is trial 4 with value: 2.031779433856417.
[I 2023-12-21 04:12:19,062] Trial 74 pruned. Trial was pruned at iteration 0.
[I 2023-12-21 04:12:19,204] Trial 75 finished with value: inf and parameters: {'learning_rate': 0.9715526307701471, 'aft_loss_distributio                                                                     n': 'normal', 'aft_loss_distribution_scale': 2.0972726058887203, 'max_depth': 5, 'booster': 'gbtree', 'scale_pos_weight': 2.8205587699518                                                                     36, 'alpha': 8.338819505022034, 'lambda': 1.0970040127427962, 'eta': 0.3147387013720359, 'sampling_method': 'gradient_based', 'subsample'                                                                     : 0.5695312333835888, 'gamma': 3.115662650278466}. Best is trial 4 with value: 2.031779433856417.
[I 2023-12-21 04:12:19,238] Trial 76 pruned. Trial was pruned at iteration 0.
[I 2023-12-21 04:12:19,276] Trial 77 pruned. Trial was pruned at iteration 1.
[I 2023-12-21 04:12:19,314] Trial 78 pruned. Trial was pruned at iteration 0.
[I 2023-12-21 04:12:19,348] Trial 79 pruned. Trial was pruned at iteration 0.
[I 2023-12-21 04:12:19,387] Trial 80 pruned. Trial was pruned at iteration 0.
[I 2023-12-21 04:12:19,422] Trial 81 pruned. Trial was pruned at iteration 0.
[I 2023-12-21 04:12:19,456] Trial 82 pruned. Trial was pruned at iteration 0.
[I 2023-12-21 04:12:19,491] Trial 83 pruned. Trial was pruned at iteration 0.
[I 2023-12-21 04:12:19,527] Trial 84 pruned. Trial was pruned at iteration 0.
[I 2023-12-21 04:12:19,563] Trial 85 pruned. Trial was pruned at iteration 1.
[I 2023-12-21 04:12:19,602] Trial 86 pruned. Trial was pruned at iteration 1.
[I 2023-12-21 04:12:20,612] Trial 87 finished with value: inf and parameters: {'learning_rate': 0.9135749016292918, 'aft_loss_distributio                                                                     n': 'normal', 'aft_loss_distribution_scale': 3.0220496876162133, 'max_depth': 3, 'booster': 'dart', 'scale_pos_weight': 2.119991415590162                                                                     , 'alpha': 7.25823286903827, 'lambda': 6.701906686675226, 'eta': 0.03692039304600908, 'sampling_method': 'gradient_based', 'subsample': 0                                                                     .9575760973117184, 'gamma': 8.817476462891635}. Best is trial 4 with value: 2.031779433856417.
[I 2023-12-21 04:12:20,647] Trial 88 pruned. Trial was pruned at iteration 0.
[I 2023-12-21 04:12:20,682] Trial 89 pruned. Trial was pruned at iteration 0.
[I 2023-12-21 04:12:20,717] Trial 90 pruned. Trial was pruned at iteration 0.
[I 2023-12-21 04:12:20,752] Trial 91 pruned. Trial was pruned at iteration 0.
[I 2023-12-21 04:12:20,789] Trial 92 pruned. Trial was pruned at iteration 0.
[I 2023-12-21 04:12:20,827] Trial 93 pruned. Trial was pruned at iteration 0.
[I 2023-12-21 04:12:20,963] Trial 94 finished with value: inf and parameters: {'learning_rate': 0.9916623904270775, 'aft_loss_distributio                                                                     n': 'normal', 'aft_loss_distribution_scale': 2.035030696339498, 'max_depth': 5, 'booster': 'gbtree', 'scale_pos_weight': 0.27509812205396                                                                     71, 'alpha': 5.730743852181207, 'lambda': 3.2509661646966155, 'eta': 0.38878725367389255, 'sampling_method': 'gradient_based', 'subsample                                                                     ': 0.5801427228437013, 'gamma': 4.022588909356244}. Best is trial 4 with value: 2.031779433856417.
[I 2023-12-21 04:12:21,000] Trial 95 pruned. Trial was pruned at iteration 0.
[I 2023-12-21 04:12:21,035] Trial 96 pruned. Trial was pruned at iteration 0.
[I 2023-12-21 04:12:21,081] Trial 97 pruned. Trial was pruned at iteration 1.
[I 2023-12-21 04:12:21,117] Trial 98 pruned. Trial was pruned at iteration 0.
[I 2023-12-21 04:12:21,153] Trial 99 pruned. Trial was pruned at iteration 0.
[I 2023-12-21 04:12:21,190] Trial 100 pruned. Trial was pruned at iteration 0.
[I 2023-12-21 04:12:21,226] Trial 101 pruned. Trial was pruned at iteration 0.
[I 2023-12-21 04:12:21,429] Trial 102 finished with value: inf and parameters: {'learning_rate': 0.776949235068091, 'aft_loss_distributio                                                                     n': 'normal', 'aft_loss_distribution_scale': 2.3068093584865745, 'max_depth': 5, 'booster': 'gbtree', 'scale_pos_weight': 0.3698820078922                                                                     4845, 'alpha': 9.518328113791075, 'lambda': 1.2123651681227254, 'eta': 0.3469663659857212, 'sampling_method': 'gradient_based', 'subsampl                                                                     e': 0.18340810998565701, 'gamma': 4.490235475397991}. Best is trial 4 with value: 2.031779433856417.
[I 2023-12-21 04:12:21,466] Trial 103 pruned. Trial was pruned at iteration 0.
[I 2023-12-21 04:12:21,502] Trial 104 pruned. Trial was pruned at iteration 0.
[I 2023-12-21 04:12:21,538] Trial 105 pruned. Trial was pruned at iteration 0.
[I 2023-12-21 04:12:21,576] Trial 106 pruned. Trial was pruned at iteration 0.
[I 2023-12-21 04:12:21,613] Trial 107 pruned. Trial was pruned at iteration 0.
[I 2023-12-21 04:12:21,649] Trial 108 pruned. Trial was pruned at iteration 0.
[I 2023-12-21 04:12:21,686] Trial 109 pruned. Trial was pruned at iteration 0.
[I 2023-12-21 04:12:21,723] Trial 110 pruned. Trial was pruned at iteration 0.
[I 2023-12-21 04:12:21,759] Trial 111 pruned. Trial was pruned at iteration 0.
[I 2023-12-21 04:12:21,795] Trial 112 pruned. Trial was pruned at iteration 0.
[I 2023-12-21 04:12:21,833] Trial 113 pruned. Trial was pruned at iteration 0.
[I 2023-12-21 04:12:21,995] Trial 114 finished with value: inf and parameters: {'learning_rate': 0.8419109099854503, 'aft_loss_distributi                                                                     on': 'normal', 'aft_loss_distribution_scale': 2.7348002795031645, 'max_depth': 4, 'booster': 'gbtree', 'scale_pos_weight': 0.553890482211                                                                     1392, 'alpha': 5.056970628774323, 'lambda': 5.9456719546711625, 'eta': 0.014816085077921405, 'sampling_method': 'gradient_based', 'subsam                                                                     ple': 0.09554350452614033, 'gamma': 5.932944679510683}. Best is trial 4 with value: 2.031779433856417.
[I 2023-12-21 04:12:22,040] Trial 115 pruned. Trial was pruned at iteration 1.
[I 2023-12-21 04:12:22,078] Trial 116 pruned. Trial was pruned at iteration 0.
[I 2023-12-21 04:12:22,114] Trial 117 pruned. Trial was pruned at iteration 0.
[I 2023-12-21 04:12:22,151] Trial 118 pruned. Trial was pruned at iteration 0.
[I 2023-12-21 04:12:22,189] Trial 119 pruned. Trial was pruned at iteration 0.
[I 2023-12-21 04:12:22,226] Trial 120 pruned. Trial was pruned at iteration 0.
[I 2023-12-21 04:12:22,501] Trial 121 finished with value: inf and parameters: {'learning_rate': 0.978951199816866, 'aft_loss_distributio                                                                     n': 'normal', 'aft_loss_distribution_scale': 2.7644579714228583, 'max_depth': 7, 'booster': 'gbtree', 'scale_pos_weight': 2.5282884158386                                                                     287, 'alpha': 8.823182850837966, 'lambda': 1.4283096695580828, 'eta': 0.3432870746924107, 'sampling_method': 'gradient_based', 'subsample                                                                     ': 0.11194269872664335, 'gamma': 1.1437000262937684}. Best is trial 4 with value: 2.031779433856417.
[I 2023-12-21 04:12:22,544] Trial 122 pruned. Trial was pruned at iteration 1.
[I 2023-12-21 04:12:22,813] Trial 123 finished with value: inf and parameters: {'learning_rate': 0.9393379764221079, 'aft_loss_distributi                                                                     on': 'normal', 'aft_loss_distribution_scale': 2.564132198964924, 'max_depth': 7, 'booster': 'gbtree', 'scale_pos_weight': 2.4799579719964                                                                     604, 'alpha': 8.471889106050844, 'lambda': 2.7792465404698707, 'eta': 0.3584644516574614, 'sampling_method': 'gradient_based', 'subsample                                                                     ': 0.19741107435935923, 'gamma': 0.5139493935879101}. Best is trial 4 with value: 2.031779433856417.
[I 2023-12-21 04:12:22,850] Trial 124 pruned. Trial was pruned at iteration 0.
[I 2023-12-21 04:12:22,974] Trial 125 finished with value: inf and parameters: {'learning_rate': 0.9518164830509387, 'aft_loss_distributi                                                                     on': 'normal', 'aft_loss_distribution_scale': 2.259123967900741, 'max_depth': 6, 'booster': 'gbtree', 'scale_pos_weight': 2.5834998958820                                                                     488, 'alpha': 8.885947554432896, 'lambda': 1.40540951708949, 'eta': 0.3097106910792802, 'sampling_method': 'gradient_based', 'subsample':                                                                      0.5641266801715311, 'gamma': 7.7392008542083826}. Best is trial 4 with value: 2.031779433856417.
[I 2023-12-21 04:12:23,016] Trial 126 pruned. Trial was pruned at iteration 0.
[I 2023-12-21 04:12:23,052] Trial 127 pruned. Trial was pruned at iteration 0.
[I 2023-12-21 04:12:24,168] Trial 128 finished with value: inf and parameters: {'learning_rate': 0.8718442808297677, 'aft_loss_distributi                                                                     on': 'normal', 'aft_loss_distribution_scale': 2.1084190699555134, 'max_depth': 7, 'booster': 'dart', 'scale_pos_weight': 2.73326361672714                                                                     14, 'alpha': 7.997857116969001, 'lambda': 1.9101773600974048, 'eta': 0.4891026078194871, 'sampling_method': 'gradient_based', 'subsample'                                                                     : 0.11547314866366538, 'gamma': 1.996770610298714}. Best is trial 4 with value: 2.031779433856417.
[I 2023-12-21 04:12:24,207] Trial 129 pruned. Trial was pruned at iteration 0.
[I 2023-12-21 04:12:24,317] Trial 130 finished with value: inf and parameters: {'learning_rate': 0.9858701972320261, 'aft_loss_distributi                                                                     on': 'normal', 'aft_loss_distribution_scale': 2.851829747592594, 'max_depth': 3, 'booster': 'gbtree', 'scale_pos_weight': 2.2604733919681                                                                     27, 'alpha': 7.501675352229828, 'lambda': 1.679216134827059, 'eta': 0.26443648278795884, 'sampling_method': 'uniform', 'subsample': 0.637                                                                     6661196902971, 'gamma': 9.289007622948539}. Best is trial 4 with value: 2.031779433856417.
[I 2023-12-21 04:12:24,553] Trial 131 finished with value: inf and parameters: {'learning_rate': 0.9320288854164069, 'aft_loss_distributi                                                                     on': 'normal', 'aft_loss_distribution_scale': 2.591223258947471, 'max_depth': 6, 'booster': 'gbtree', 'scale_pos_weight': 1.3368592232964                                                                     138, 'alpha': 9.422437138572079, 'lambda': 2.247471818148949, 'eta': 0.4685628552542113, 'sampling_method': 'gradient_based', 'subsample'                                                                     : 0.1344199059551135, 'gamma': 7.686121969551496}. Best is trial 4 with value: 2.031779433856417.
[I 2023-12-21 04:12:24,590] Trial 132 pruned. Trial was pruned at iteration 0.
[I 2023-12-21 04:12:24,633] Trial 133 pruned. Trial was pruned at iteration 1.
[I 2023-12-21 04:12:24,750] Trial 134 finished with value: inf and parameters: {'learning_rate': 0.9510558015065228, 'aft_loss_distributi                                                                     on': 'normal', 'aft_loss_distribution_scale': 2.695177039068025, 'max_depth': 5, 'booster': 'gbtree', 'scale_pos_weight': 0.6893193998612                                                                     124, 'alpha': 9.987006017961038, 'lambda': 6.108693868327546, 'eta': 0.5156689422057268, 'sampling_method': 'gradient_based', 'subsample'                                                                     : 0.8643120286317292, 'gamma': 8.487466584058817}. Best is trial 4 with value: 2.031779433856417.
[I 2023-12-21 04:12:24,787] Trial 135 pruned. Trial was pruned at iteration 0.
[I 2023-12-21 04:12:24,827] Trial 136 pruned. Trial was pruned at iteration 1.
[I 2023-12-21 04:12:24,869] Trial 137 pruned. Trial was pruned at iteration 0.
[I 2023-12-21 04:12:24,907] Trial 138 pruned. Trial was pruned at iteration 0.
[I 2023-12-21 04:12:25,125] Trial 139 finished with value: inf and parameters: {'learning_rate': 0.9130310293505618, 'aft_loss_distributi                                                                     on': 'normal', 'aft_loss_distribution_scale': 2.179876962873373, 'max_depth': 6, 'booster': 'gbtree', 'scale_pos_weight': 0.5836925273474                                                                     08, 'alpha': 0.8324110831103019, 'lambda': 2.750861000839327, 'eta': 0.67966754148053, 'sampling_method': 'gradient_based', 'subsample':                                                                      0.0901701935861621, 'gamma': 8.778765191475145}. Best is trial 4 with value: 2.031779433856417.
[I 2023-12-21 04:12:25,162] Trial 140 pruned. Trial was pruned at iteration 0.
[I 2023-12-21 04:12:25,310] Trial 141 finished with value: inf and parameters: {'learning_rate': 0.9798089892053462, 'aft_loss_distributi                                                                     on': 'normal', 'aft_loss_distribution_scale': 2.05934412975801, 'max_depth': 5, 'booster': 'gbtree', 'scale_pos_weight': 1.52389962405290                                                                     64, 'alpha': 8.499533474711546, 'lambda': 1.0920843255527108, 'eta': 0.31266982533487836, 'sampling_method': 'gradient_based', 'subsample                                                                     ': 0.5735936061978297, 'gamma': 2.8099819336548273}. Best is trial 4 with value: 2.031779433856417.
[I 2023-12-21 04:12:25,460] Trial 142 finished with value: inf and parameters: {'learning_rate': 0.9630366147028903, 'aft_loss_distributi                                                                     on': 'normal', 'aft_loss_distribution_scale': 1.5638393149976872, 'max_depth': 5, 'booster': 'gbtree', 'scale_pos_weight': 2.786006565191                                                                     0633, 'alpha': 9.137027595075942, 'lambda': 1.5793476989110717, 'eta': 0.29144468361878634, 'sampling_method': 'gradient_based', 'subsamp                                                                     le': 0.5347652440051903, 'gamma': 4.209722172510713}. Best is trial 4 with value: 2.031779433856417.
[I 2023-12-21 04:12:25,641] Trial 143 finished with value: inf and parameters: {'learning_rate': 0.959484149673139, 'aft_loss_distributio                                                                     n': 'normal', 'aft_loss_distribution_scale': 2.492057892446818, 'max_depth': 5, 'booster': 'gbtree', 'scale_pos_weight': 2.57490766209481                                                                     77, 'alpha': 8.294518775704558, 'lambda': 0.4978602142471288, 'eta': 0.3188845940788318, 'sampling_method': 'gradient_based', 'subsample'                                                                     : 0.06140344471663012, 'gamma': 2.9906563998914897}. Best is trial 4 with value: 2.031779433856417.
[I 2023-12-21 04:12:25,777] Trial 144 finished with value: inf and parameters: {'learning_rate': 0.9391551652346372, 'aft_loss_distributi                                                                     on': 'normal', 'aft_loss_distribution_scale': 1.844511024268423, 'max_depth': 4, 'booster': 'gbtree', 'scale_pos_weight': 2.3585636286985                                                                     414, 'alpha': 4.71217375649199, 'lambda': 2.3020741140439913, 'eta': 0.23174596896906316, 'sampling_method': 'gradient_based', 'subsample                                                                     ': 0.5577453629648402, 'gamma': 3.6397672055886514}. Best is trial 4 with value: 2.031779433856417.
[I 2023-12-21 04:12:25,814] Trial 145 pruned. Trial was pruned at iteration 0.
[I 2023-12-21 04:12:26,881] Trial 146 finished with value: inf and parameters: {'learning_rate': 0.9738182202840161, 'aft_loss_distributi                                                                     on': 'normal', 'aft_loss_distribution_scale': 2.752379845356522, 'max_depth': 7, 'booster': 'dart', 'scale_pos_weight': 3.167285757412838                                                                     , 'alpha': 2.0797897523206164, 'lambda': 1.7616245457133721, 'eta': 0.2668752251284383, 'sampling_method': 'uniform', 'subsample': 0.7271                                                                     653563877841, 'gamma': 0.30228497533219817}. Best is trial 4 with value: 2.031779433856417.
[I 2023-12-21 04:12:26,918] Trial 147 pruned. Trial was pruned at iteration 0.
[I 2023-12-21 04:12:26,956] Trial 148 pruned. Trial was pruned at iteration 0.
[I 2023-12-21 04:12:26,995] Trial 149 pruned. Trial was pruned at iteration 0.
[I 2023-12-21 04:12:27,033] Trial 150 pruned. Trial was pruned at iteration 0.
[I 2023-12-21 04:12:28,112] Trial 151 finished with value: inf and parameters: {'learning_rate': 0.9102613629877063, 'aft_loss_distributi                                                                     on': 'normal', 'aft_loss_distribution_scale': 2.5733035313620536, 'max_depth': 3, 'booster': 'dart', 'scale_pos_weight': 2.13936496888948                                                                     4, 'alpha': 6.915595655196322, 'lambda': 6.559283512154043, 'eta': 0.022483048199456037, 'sampling_method': 'gradient_based', 'subsample'                                                                     : 0.9875755851697603, 'gamma': 9.000117975000936}. Best is trial 4 with value: 2.031779433856417.
[I 2023-12-21 04:12:28,151] Trial 152 pruned. Trial was pruned at iteration 0.
[I 2023-12-21 04:12:28,189] Trial 153 pruned. Trial was pruned at iteration 0.
[I 2023-12-21 04:12:28,230] Trial 154 pruned. Trial was pruned at iteration 1.
[I 2023-12-21 04:12:29,243] Trial 155 finished with value: inf and parameters: {'learning_rate': 0.9029652329961163, 'aft_loss_distributi                                                                     on': 'normal', 'aft_loss_distribution_scale': 2.3967485156988366, 'max_depth': 4, 'booster': 'dart', 'scale_pos_weight': 2.65428259844558                                                                     62, 'alpha': 5.925072110666658, 'lambda': 7.725006340093004, 'eta': 0.09128423404604863, 'sampling_method': 'gradient_based', 'subsample'                                                                     : 0.951028997125512, 'gamma': 3.927007490854223}. Best is trial 4 with value: 2.031779433856417.
[I 2023-12-21 04:12:29,283] Trial 156 pruned. Trial was pruned at iteration 0.
[I 2023-12-21 04:12:29,324] Trial 157 pruned. Trial was pruned at iteration 0.
[I 2023-12-21 04:12:29,364] Trial 158 pruned. Trial was pruned at iteration 0.
[I 2023-12-21 04:12:29,405] Trial 159 pruned. Trial was pruned at iteration 0.
[I 2023-12-21 04:12:29,444] Trial 160 pruned. Trial was pruned at iteration 0.
[I 2023-12-21 04:12:29,482] Trial 161 pruned. Trial was pruned at iteration 0.
