[I 2023-12-18 23:06:53,240] Trial 465 finished with value: 4.26702434153482 and parameters: {'learning_rate': 0.8622843980123626, 'aft_loss_distribution': 'normal', 'aft_loss_distribution_scale': 1.096818601796631, 'max_depth': 6, 'booster': 'dart', 'scale_pos_weight': 3.05843084539759, 'alpha': 4.816908525330029, 'lambda': 0.8771599828267993, 'eta': 0.1317813897464708, 'sampling_method': 'uniform', 'subsample': 0.7324036299252523, 'gamma': 8.987280316141328}. Best is trial 333 with value: 4.264499999089825.
[I 2023-12-18 23:06:53,335] Trial 466 pruned. Trial was pruned at iteration 0.
[I 2023-12-18 23:06:53,427] Trial 467 pruned. Trial was pruned at iteration 0.
[I 2023-12-18 23:06:53,515] Trial 468 pruned. Trial was pruned at iteration 0.
[I 2023-12-18 23:06:53,604] Trial 469 pruned. Trial was pruned at iteration 1.
[I 2023-12-18 23:06:55,567] Trial 470 finished with value: inf and parameters: {'learning_rate': 0.8701587653596355, 'aft_loss_distribution': 'normal', 'aft_loss_distribution_scale': 1.029847971437847, 'max_depth': 7, 'booster': 'dart', 'scale_pos_weight': 2.9738224874436883, 'alpha': 6.3408484541476415, 'lambda': 1.1028553231825013, 'eta': 0.2762630445743914, 'sampling_method': 'uniform', 'subsample': 0.6900428251676346, 'gamma': 9.772275171505067}. Best is trial 333 with value: 4.264499999089825.
[I 2023-12-18 23:06:55,657] Trial 471 pruned. Trial was pruned at iteration 0.
[I 2023-12-18 23:06:58,693] Trial 472 finished with value: 4.266896356163569 and parameters: {'learning_rate': 0.826802363045921, 'aft_loss_distribution': 'normal', 'aft_loss_distribution_scale': 1.0992912247584106, 'max_depth': 6, 'booster': 'dart', 'scale_pos_weight': 2.7445638590767394, 'alpha': 6.182756793895528, 'lambda': 0.6052917807876175, 'eta': 0.01952933154976136, 'sampling_method': 'uniform', 'subsample': 0.7436995322871468, 'gamma': 9.376509106648832}. Best is trial 333 with value: 4.264499999089825.
[I 2023-12-18 23:06:58,785] Trial 473 pruned. Trial was pruned at iteration 1.
[I 2023-12-18 23:06:58,870] Trial 474 pruned. Trial was pruned at iteration 0.
[I 2023-12-18 23:06:58,956] Trial 475 pruned. Trial was pruned at iteration 0.
[I 2023-12-18 23:06:59,041] Trial 476 pruned. Trial was pruned at iteration 0.
[I 2023-12-18 23:07:01,720] Trial 477 finished with value: 4.285565573363116 and parameters: {'learning_rate': 0.9837208393047674, 'aft_loss_distribution': 'normal', 'aft_loss_distribution_scale': 1.226680000666009, 'max_depth': 6, 'booster': 'dart', 'scale_pos_weight': 2.574317373968953, 'alpha': 6.175173188477804, 'lambda': 0.76199048441947, 'eta': 0.19535741519137267, 'sampling_method': 'uniform', 'subsample': 0.7022293213229258, 'gamma': 8.721332667728587}. Best is trial 333 with value: 4.264499999089825.
[I 2023-12-18 23:07:01,820] Trial 478 pruned. Trial was pruned at iteration 0.
[I 2023-12-18 23:07:01,917] Trial 479 pruned. Trial was pruned at iteration 1.
[I 2023-12-18 23:07:02,008] Trial 480 pruned. Trial was pruned at iteration 1.
[I 2023-12-18 23:07:03,681] Trial 481 finished with value: inf and parameters: {'learning_rate': 0.9354604357424465, 'aft_loss_distribution': 'normal', 'aft_loss_distribution_scale': 1.0263905978104226, 'max_depth': 6, 'booster': 'dart', 'scale_pos_weight': 2.0013307241824814, 'alpha': 5.550271005045538, 'lambda': 1.0299405547379186, 'eta': 0.9886650817373555, 'sampling_method': 'uniform', 'subsample': 0.7400966996337908, 'gamma': 8.88534878896367}. Best is trial 333 with value: 4.264499999089825.
[I 2023-12-18 23:07:06,080] Trial 482 finished with value: inf and parameters: {'learning_rate': 0.8879841009079743, 'aft_loss_distribution': 'normal', 'aft_loss_distribution_scale': 1.2253072246785697, 'max_depth': 6, 'booster': 'dart', 'scale_pos_weight': 2.6217830980960475, 'alpha': 6.374483327395854, 'lambda': 0.7085779000976433, 'eta': 0.021846661835755534, 'sampling_method': 'uniform', 'subsample': 0.8196230884599254, 'gamma': 8.564070176909778}. Best is trial 333 with value: 4.264499999089825.
[I 2023-12-18 23:07:06,228] Trial 483 pruned. Trial was pruned at iteration 0.
[I 2023-12-18 23:07:06,362] Trial 484 pruned. Trial was pruned at iteration 0.
[I 2023-12-18 23:07:06,515] Trial 485 pruned. Trial was pruned at iteration 0.
[I 2023-12-18 23:07:06,651] Trial 486 pruned. Trial was pruned at iteration 1.
[I 2023-12-18 23:07:06,792] Trial 487 pruned. Trial was pruned at iteration 0.
[I 2023-12-18 23:07:06,928] Trial 488 pruned. Trial was pruned at iteration 0.
[I 2023-12-18 23:07:07,019] Trial 489 pruned. Trial was pruned at iteration 0.
[I 2023-12-18 23:07:07,111] Trial 490 pruned. Trial was pruned at iteration 1.
[I 2023-12-18 23:07:07,202] Trial 491 pruned. Trial was pruned at iteration 0.
[I 2023-12-18 23:07:07,297] Trial 492 pruned. Trial was pruned at iteration 1.
[I 2023-12-18 23:07:09,291] Trial 493 finished with value: inf and parameters: {'learning_rate': 0.9655689641451821, 'aft_loss_distribution': 'normal', 'aft_loss_distribution_scale': 1.1148476120918496, 'max_depth': 6, 'booster': 'dart', 'scale_pos_weight': 3.3261741281888186, 'alpha': 6.072449882409492, 'lambda': 0.6043804122923713, 'eta': 0.9523388567579096, 'sampling_method': 'uniform', 'subsample': 0.7563932993202457, 'gamma': 9.991128865404361}. Best is trial 333 with value: 4.264499999089825.
[I 2023-12-18 23:07:09,384] Trial 494 pruned. Trial was pruned at iteration 1.
[I 2023-12-18 23:07:09,472] Trial 495 pruned. Trial was pruned at iteration 0.
[I 2023-12-18 23:07:09,557] Trial 496 pruned. Trial was pruned at iteration 0.
[I 2023-12-18 23:07:09,643] Trial 497 pruned. Trial was pruned at iteration 0.
[I 2023-12-18 23:07:09,734] Trial 498 pruned. Trial was pruned at iteration 0.
[I 2023-12-18 23:07:09,827] Trial 499 pruned. Trial was pruned at iteration 1.
Completed hyperparameter tuning with best aft-nloglik = 4.264499999089825.
Re-running the best trial... params = {'verbosity': 0, 'objective': 'survival:aft', 'eval_metric': 'aft-nloglik', 'tree_method': 'gpu_hist', 'device': 'cuda', 'learning_rate': 0.9325999400968015, 'aft_loss_distribution': 'normal', 'aft_loss_distribution_scale': 1.0524509333673902, 'max_depth': 6, 'booster': 'dart', 'scale_pos_weight': 1.6923885250798387, 'alpha': 6.0479207381666855, 'lambda': 0.6509674267299707, 'eta': 0.9737752051522442, 'sampling_method': 'uniform', 'subsample': 0.7960345288907069, 'gamma': 9.442746248851158}
[W 2023-12-18 23:07:12,907] Trial 0 is omitted in visualization because its objective value is inf or nan.
[W 2023-12-18 23:07:12,914] Trial 4 is omitted in visualization because its objective value is inf or nan.
[W 2023-12-18 23:07:12,920] Trial 15 is omitted in visualization because its objective value is inf or nan.
[W 2023-12-18 23:07:12,921] Trial 16 is omitted in visualization because its objective value is inf or nan.
[W 2023-12-18 23:07:12,923] Trial 23 is omitted in visualization because its objective value is inf or nan.
[W 2023-12-18 23:07:12,925] Trial 25 is omitted in visualization because its objective value is inf or nan.
[W 2023-12-18 23:07:12,926] Trial 27 is omitted in visualization because its objective value is inf or nan.
[W 2023-12-18 23:07:12,927] Trial 33 is omitted in visualization because its objective value is inf or nan.
[W 2023-12-18 23:07:12,932] Trial 35 is omitted in visualization because its objective value is inf or nan.
[W 2023-12-18 23:07:12,933] Trial 36 is omitted in visualization because its objective value is inf or nan.
[W 2023-12-18 23:07:12,934] Trial 42 is omitted in visualization because its objective value is inf or nan.
[W 2023-12-18 23:07:12,935] Trial 43 is omitted in visualization because its objective value is inf or nan.
[W 2023-12-18 23:07:12,938] Trial 48 is omitted in visualization because its objective value is inf or nan.
[W 2023-12-18 23:07:12,939] Trial 64 is omitted in visualization because its objective value is inf or nan.
[W 2023-12-18 23:07:12,940] Trial 65 is omitted in visualization because its objective value is inf or nan.
[W 2023-12-18 23:07:12,941] Trial 67 is omitted in visualization because its objective value is inf or nan.
[W 2023-12-18 23:07:12,944] Trial 77 is omitted in visualization because its objective value is inf or nan.
[W 2023-12-18 23:07:12,945] Trial 81 is omitted in visualization because its objective value is inf or nan.
[W 2023-12-18 23:07:12,946] Trial 87 is omitted in visualization because its objective value is inf or nan.
[W 2023-12-18 23:07:12,947] Trial 93 is omitted in visualization because its objective value is inf or nan.
[W 2023-12-18 23:07:12,948] Trial 96 is omitted in visualization because its objective value is inf or nan.
[W 2023-12-18 23:07:12,949] Trial 99 is omitted in visualization because its objective value is inf or nan.
[W 2023-12-18 23:07:12,950] Trial 102 is omitted in visualization because its objective value is inf or nan.
[W 2023-12-18 23:07:12,951] Trial 106 is omitted in visualization because its objective value is inf or nan.
[W 2023-12-18 23:07:12,952] Trial 107 is omitted in visualization because its objective value is inf or nan.
[W 2023-12-18 23:07:12,953] Trial 111 is omitted in visualization because its objective value is inf or nan.
[W 2023-12-18 23:07:12,954] Trial 113 is omitted in visualization because its objective value is inf or nan.
[W 2023-12-18 23:07:12,954] Trial 115 is omitted in visualization because its objective value is inf or nan.
[W 2023-12-18 23:07:12,955] Trial 116 is omitted in visualization because its objective value is inf or nan.
[W 2023-12-18 23:07:12,956] Trial 119 is omitted in visualization because its objective value is inf or nan.
[W 2023-12-18 23:07:12,959] Trial 124 is omitted in visualization because its objective value is inf or nan.
[W 2023-12-18 23:07:12,960] Trial 131 is omitted in visualization because its objective value is inf or nan.
[W 2023-12-18 23:07:12,962] Trial 132 is omitted in visualization because its objective value is inf or nan.
[W 2023-12-18 23:07:12,963] Trial 135 is omitted in visualization because its objective value is inf or nan.
[W 2023-12-18 23:07:12,964] Trial 148 is omitted in visualization because its objective value is inf or nan.
[W 2023-12-18 23:07:12,965] Trial 151 is omitted in visualization because its objective value is inf or nan.
[W 2023-12-18 23:07:12,966] Trial 156 is omitted in visualization because its objective value is inf or nan.
[W 2023-12-18 23:07:12,967] Trial 157 is omitted in visualization because its objective value is inf or nan.
[W 2023-12-18 23:07:12,970] Trial 158 is omitted in visualization because its objective value is inf or nan.
[W 2023-12-18 23:07:12,971] Trial 160 is omitted in visualization because its objective value is inf or nan.
[W 2023-12-18 23:07:12,972] Trial 169 is omitted in visualization because its objective value is inf or nan.
[W 2023-12-18 23:07:12,972] Trial 176 is omitted in visualization because its objective value is inf or nan.
[W 2023-12-18 23:07:12,973] Trial 177 is omitted in visualization because its objective value is inf or nan.
[W 2023-12-18 23:07:12,974] Trial 179 is omitted in visualization because its objective value is inf or nan.
[W 2023-12-18 23:07:12,975] Trial 183 is omitted in visualization because its objective value is inf or nan.
[W 2023-12-18 23:07:12,976] Trial 187 is omitted in visualization because its objective value is inf or nan.
[W 2023-12-18 23:07:12,977] Trial 191 is omitted in visualization because its objective value is inf or nan.
[W 2023-12-18 23:07:12,978] Trial 199 is omitted in visualization because its objective value is inf or nan.
[W 2023-12-18 23:07:12,979] Trial 202 is omitted in visualization because its objective value is inf or nan.
[W 2023-12-18 23:07:12,980] Trial 204 is omitted in visualization because its objective value is inf or nan.
[W 2023-12-18 23:07:12,981] Trial 205 is omitted in visualization because its objective value is inf or nan.
[W 2023-12-18 23:07:12,982] Trial 207 is omitted in visualization because its objective value is inf or nan.
[W 2023-12-18 23:07:12,983] Trial 210 is omitted in visualization because its objective value is inf or nan.
[W 2023-12-18 23:07:12,984] Trial 213 is omitted in visualization because its objective value is inf or nan.
[W 2023-12-18 23:07:12,985] Trial 214 is omitted in visualization because its objective value is inf or nan.
[W 2023-12-18 23:07:12,986] Trial 215 is omitted in visualization because its objective value is inf or nan.
[W 2023-12-18 23:07:12,986] Trial 216 is omitted in visualization because its objective value is inf or nan.
[W 2023-12-18 23:07:12,987] Trial 218 is omitted in visualization because its objective value is inf or nan.
[W 2023-12-18 23:07:12,988] Trial 219 is omitted in visualization because its objective value is inf or nan.
[W 2023-12-18 23:07:12,989] Trial 220 is omitted in visualization because its objective value is inf or nan.
[W 2023-12-18 23:07:12,990] Trial 221 is omitted in visualization because its objective value is inf or nan.
[W 2023-12-18 23:07:12,991] Trial 222 is omitted in visualization because its objective value is inf or nan.
[W 2023-12-18 23:07:12,992] Trial 229 is omitted in visualization because its objective value is inf or nan.
[W 2023-12-18 23:07:12,993] Trial 231 is omitted in visualization because its objective value is inf or nan.
[W 2023-12-18 23:07:12,994] Trial 232 is omitted in visualization because its objective value is inf or nan.
[W 2023-12-18 23:07:12,995] Trial 233 is omitted in visualization because its objective value is inf or nan.
[W 2023-12-18 23:07:12,996] Trial 236 is omitted in visualization because its objective value is inf or nan.
[W 2023-12-18 23:07:12,997] Trial 242 is omitted in visualization because its objective value is inf or nan.
[W 2023-12-18 23:07:12,997] Trial 245 is omitted in visualization because its objective value is inf or nan.
[W 2023-12-18 23:07:12,998] Trial 246 is omitted in visualization because its objective value is inf or nan.
[W 2023-12-18 23:07:12,999] Trial 250 is omitted in visualization because its objective value is inf or nan.
[W 2023-12-18 23:07:13,000] Trial 252 is omitted in visualization because its objective value is inf or nan.
[W 2023-12-18 23:07:13,001] Trial 262 is omitted in visualization because its objective value is inf or nan.
[W 2023-12-18 23:07:13,002] Trial 265 is omitted in visualization because its objective value is inf or nan.
[W 2023-12-18 23:07:13,003] Trial 266 is omitted in visualization because its objective value is inf or nan.
[W 2023-12-18 23:07:13,004] Trial 269 is omitted in visualization because its objective value is inf or nan.
[W 2023-12-18 23:07:13,005] Trial 270 is omitted in visualization because its objective value is inf or nan.
[W 2023-12-18 23:07:13,006] Trial 274 is omitted in visualization because its objective value is inf or nan.
[W 2023-12-18 23:07:13,007] Trial 275 is omitted in visualization because its objective value is inf or nan.
[W 2023-12-18 23:07:13,008] Trial 279 is omitted in visualization because its objective value is inf or nan.
[W 2023-12-18 23:07:13,009] Trial 284 is omitted in visualization because its objective value is inf or nan.
[W 2023-12-18 23:07:13,010] Trial 287 is omitted in visualization because its objective value is inf or nan.
[W 2023-12-18 23:07:13,011] Trial 294 is omitted in visualization because its objective value is inf or nan.
[W 2023-12-18 23:07:13,012] Trial 299 is omitted in visualization because its objective value is inf or nan.
[W 2023-12-18 23:07:13,012] Trial 301 is omitted in visualization because its objective value is inf or nan.
[W 2023-12-18 23:07:13,013] Trial 306 is omitted in visualization because its objective value is inf or nan.
[W 2023-12-18 23:07:13,014] Trial 309 is omitted in visualization because its objective value is inf or nan.
[W 2023-12-18 23:07:13,015] Trial 312 is omitted in visualization because its objective value is inf or nan.
[W 2023-12-18 23:07:13,018] Trial 317 is omitted in visualization because its objective value is inf or nan.
[W 2023-12-18 23:07:13,019] Trial 319 is omitted in visualization because its objective value is inf or nan.
[W 2023-12-18 23:07:13,020] Trial 323 is omitted in visualization because its objective value is inf or nan.
[W 2023-12-18 23:07:13,021] Trial 325 is omitted in visualization because its objective value is inf or nan.
[W 2023-12-18 23:07:13,022] Trial 336 is omitted in visualization because its objective value is inf or nan.
[W 2023-12-18 23:07:13,023] Trial 343 is omitted in visualization because its objective value is inf or nan.
[W 2023-12-18 23:07:13,024] Trial 350 is omitted in visualization because its objective value is inf or nan.
[W 2023-12-18 23:07:13,025] Trial 356 is omitted in visualization because its objective value is inf or nan.
[W 2023-12-18 23:07:13,026] Trial 362 is omitted in visualization because its objective value is inf or nan.
[W 2023-12-18 23:07:13,027] Trial 365 is omitted in visualization because its objective value is inf or nan.
[W 2023-12-18 23:07:13,028] Trial 367 is omitted in visualization because its objective value is inf or nan.
[W 2023-12-18 23:07:13,029] Trial 372 is omitted in visualization because its objective value is inf or nan.
[W 2023-12-18 23:07:13,030] Trial 377 is omitted in visualization because its objective value is inf or nan.
[W 2023-12-18 23:07:13,030] Trial 389 is omitted in visualization because its objective value is inf or nan.
[W 2023-12-18 23:07:13,032] Trial 398 is omitted in visualization because its objective value is inf or nan.
[W 2023-12-18 23:07:13,033] Trial 401 is omitted in visualization because its objective value is inf or nan.
[W 2023-12-18 23:07:13,034] Trial 403 is omitted in visualization because its objective value is inf or nan.
[W 2023-12-18 23:07:13,035] Trial 408 is omitted in visualization because its objective value is inf or nan.
[W 2023-12-18 23:07:13,036] Trial 415 is omitted in visualization because its objective value is inf or nan.
[W 2023-12-18 23:07:13,036] Trial 416 is omitted in visualization because its objective value is inf or nan.
[W 2023-12-18 23:07:13,037] Trial 438 is omitted in visualization because its objective value is inf or nan.
[W 2023-12-18 23:07:13,039] Trial 440 is omitted in visualization because its objective value is inf or nan.
[W 2023-12-18 23:07:13,040] Trial 448 is omitted in visualization because its objective value is inf or nan.
[W 2023-12-18 23:07:13,041] Trial 450 is omitted in visualization because its objective value is inf or nan.
[W 2023-12-18 23:07:13,041] Trial 454 is omitted in visualization because its objective value is inf or nan.
[W 2023-12-18 23:07:13,042] Trial 457 is omitted in visualization because its objective value is inf or nan.
[W 2023-12-18 23:07:13,044] Trial 470 is omitted in visualization because its objective value is inf or nan.
[W 2023-12-18 23:07:13,045] Trial 481 is omitted in visualization because its objective value is inf or nan.
[W 2023-12-18 23:07:13,046] Trial 482 is omitted in visualization because its objective value is inf or nan.
[W 2023-12-18 23:07:13,047] Trial 493 is omitted in visualization because its objective value is inf or nan.
TRN1 | R2:0.167; p:5.334e-41 | C:58.12 |3h:0.886 |6h:0.867 |9h:0.851 |12h:0.396 |15h:0.396 |18h:0.392 |24h:0.159 |48h:0.151 |72h:0.145 |1wk:0.020 |2wks:0.018 |1mon:0.012 |
TRN2 | R2:0.128; p:1.083e-24 | C:55.99 |3h:0.887 |6h:0.867 |9h:0.851 |12h:0.396 |15h:0.396 |18h:0.392 |24h:0.158 |48h:0.151 |72h:0.145 |1wk:0.020 |2wks:0.018 |1mon:0.012 |
VAL | R2:0.118; p:3.848e-21 | C:55.69 |3h:0.887 |6h:0.867 |9h:0.851 |12h:0.396 |15h:0.396 |18h:0.392 |24h:0.158 |48h:0.151 |72h:0.145 |1wk:0.020 |2wks:0.018 |1mon:0.012 |
TST | R2:0.121; p:4.964e-64 | C:55.67 |3h:0.882 |6h:0.860 |9h:0.842 |12h:0.394 |15h:0.394 |18h:0.383 |24h:0.123 |48h:0.118 |72h:0.114 |1wk:0.018 |2wks:0.017 |1mon:0.012 |
/content/drive/MyDrive/intermediates2/res//outcome1_xgb-aft_inp21_k3_emb1_rdims8.json
Dimensionality reduced word embedding 2 with ['location_numeric', 'race_numeric', 'sex_numeric']
Dimensionality reduced word embedding 2 with ['location_numeric', 'race_numeric', 'sex_numeric']
Dimensionality reduced word embedding 2 with ['location_numeric', 'race_numeric', 'sex_numeric']
Dimensionality reduced word embedding 2 with ['location_numeric', 'race_numeric', 'sex_numeric']
trn1
[I 2023-12-18 23:07:21,352] A new study created in memory with name: no-name-8492321d-a69a-42d3-9863-fbfdd6a3278f
trn2
val
tst
[I 2023-12-18 23:07:27,106] Trial 0 finished with value: 4.864455091556191 and parameters: {'learning_rate': 0.4694135423698004, 'aft_loss_distribution': 'logistic', 'aft_loss_distribution_scale': 1.8984935846220006, 'max_depth': 6, 'booster': 'dart', 'scale_pos_weight': 0.7524252392736256, 'alpha': 8.686608511308048, 'lambda': 3.78661244253495, 'eta': 0.42208268508727875, 'sampling_method': 'uniform', 'subsample': 0.17486835920206834, 'gamma': 1.9628291796492956}. Best is trial 0 with value: 4.864455091556191.
[I 2023-12-18 23:07:27,369] Trial 1 finished with value: 5.999820389429457 and parameters: {'learning_rate': 0.32259981430832024, 'aft_loss_distribution': 'extreme', 'aft_loss_distribution_scale': 9.690708978219064, 'max_depth': 6, 'booster': 'gbtree', 'scale_pos_weight': 5.524179216590691, 'alpha': 7.240659137154145, 'lambda': 5.528142030497562, 'eta': 0.034031121486423066, 'sampling_method': 'gradient_based', 'subsample': 0.41583735177882986, 'gamma': 5.641659932331137}. Best is trial 0 with value: 4.864455091556191.
