[I 2023-12-21 02:32:22,033] Trial 499 pruned. Trial was pruned at iteration 0.
[W 2023-12-21 02:32:22,206] Trial 1 is omitted in visualization because its objective value is inf or nan.
[W 2023-12-21 02:32:22,206] Trial 29 is omitted in visualization because its objective value is inf or nan.
[W 2023-12-21 02:32:22,206] Trial 53 is omitted in visualization because its objective value is inf or nan.
[W 2023-12-21 02:32:22,206] Trial 57 is omitted in visualization because its objective value is inf or nan.
[W 2023-12-21 02:32:22,206] Trial 98 is omitted in visualization because its objective value is inf or nan.
[W 2023-12-21 02:32:22,206] Trial 108 is omitted in visualization because its objective value is inf or nan.
[W 2023-12-21 02:32:22,206] Trial 112 is omitted in visualization because its objective value is inf or nan.
[W 2023-12-21 02:32:22,206] Trial 138 is omitted in visualization because its objective value is inf or nan.
[W 2023-12-21 02:32:22,206] Trial 157 is omitted in visualization because its objective value is inf or nan.
[W 2023-12-21 02:32:22,206] Trial 158 is omitted in visualization because its objective value is inf or nan.
[W 2023-12-21 02:32:22,206] Trial 166 is omitted in visualization because its objective value is inf or nan.
[W 2023-12-21 02:32:22,207] Trial 177 is omitted in visualization because its objective value is inf or nan.
[W 2023-12-21 02:32:22,207] Trial 178 is omitted in visualization because its objective value is inf or nan.
[W 2023-12-21 02:32:22,207] Trial 183 is omitted in visualization because its objective value is inf or nan.
[W 2023-12-21 02:32:22,207] Trial 225 is omitted in visualization because its objective value is inf or nan.
[W 2023-12-21 02:32:22,207] Trial 250 is omitted in visualization because its objective value is inf or nan.
[W 2023-12-21 02:32:22,207] Trial 283 is omitted in visualization because its objective value is inf or nan.
[W 2023-12-21 02:32:22,207] Trial 286 is omitted in visualization because its objective value is inf or nan.
[W 2023-12-21 02:32:22,207] Trial 289 is omitted in visualization because its objective value is inf or nan.
[W 2023-12-21 02:32:22,207] Trial 340 is omitted in visualization because its objective value is inf or nan.
[W 2023-12-21 02:32:22,207] Trial 367 is omitted in visualization because its objective value is inf or nan.
[W 2023-12-21 02:32:22,207] Trial 370 is omitted in visualization because its objective value is inf or nan.
[W 2023-12-21 02:32:22,207] Trial 372 is omitted in visualization because its objective value is inf or nan.
[W 2023-12-21 02:32:22,207] Trial 383 is omitted in visualization because its objective value is inf or nan.
[W 2023-12-21 02:32:22,207] Trial 388 is omitted in visualization because its objective value is inf or nan.
[W 2023-12-21 02:32:22,207] Trial 392 is omitted in visualization because its objective value is inf or nan.
[W 2023-12-21 02:32:22,207] Trial 397 is omitted in visualization because its objective value is inf or nan.
[W 2023-12-21 02:32:22,207] Trial 404 is omitted in visualization because its objective value is inf or nan.
[W 2023-12-21 02:32:22,207] Trial 405 is omitted in visualization because its objective value is inf or nan.
[W 2023-12-21 02:32:22,207] Trial 408 is omitted in visualization because its objective value is inf or nan.
[W 2023-12-21 02:32:22,207] Trial 410 is omitted in visualization because its objective value is inf or nan.
[W 2023-12-21 02:32:22,208] Trial 414 is omitted in visualization because its objective value is inf or nan.
[W 2023-12-21 02:32:22,208] Trial 421 is omitted in visualization because its objective value is inf or nan.
[W 2023-12-21 02:32:22,208] Trial 438 is omitted in visualization because its objective value is inf or nan.
[W 2023-12-21 02:32:22,208] Trial 446 is omitted in visualization because its objective value is inf or nan.
[W 2023-12-21 02:32:22,208] Trial 450 is omitted in visualization because its objective value is inf or nan.
[W 2023-12-21 02:32:22,208] Trial 457 is omitted in visualization because its objective value is inf or nan.
[W 2023-12-21 02:32:22,208] Trial 479 is omitted in visualization because its objective value is inf or nan.
[W 2023-12-21 02:32:22,208] Trial 486 is omitted in visualization because its objective value is inf or nan.
[W 2023-12-21 02:32:22,208] Trial 491 is omitted in visualization because its objective value is inf or nan.
exo-open: Cannot open display: .
/cvmfs/soft.computecanada.ca/gentoo/2020/usr/bin/xdg-open: line 871: x-www-browser: command not found
/cvmfs/soft.computecanada.ca/gentoo/2020/usr/bin/xdg-open: line 871: firefox: command not found
/cvmfs/soft.computecanada.ca/gentoo/2020/usr/bin/xdg-open: line 871: iceweasel: command not found
/cvmfs/soft.computecanada.ca/gentoo/2020/usr/bin/xdg-open: line 871: seamonkey: command not found
/cvmfs/soft.computecanada.ca/gentoo/2020/usr/bin/xdg-open: line 871: mozilla: command not found
/cvmfs/soft.computecanada.ca/gentoo/2020/usr/bin/xdg-open: line 871: epiphany: command not found
/cvmfs/soft.computecanada.ca/gentoo/2020/usr/bin/xdg-open: line 871: konqueror: command not found
/cvmfs/soft.computecanada.ca/gentoo/2020/usr/bin/xdg-open: line 871: chromium: command not found
/cvmfs/soft.computecanada.ca/gentoo/2020/usr/bin/xdg-open: line 871: chromium-browser: command not found
/cvmfs/soft.computecanada.ca/gentoo/2020/usr/bin/xdg-open: line 871: google-chrome: command not found
/cvmfs/soft.computecanada.ca/gentoo/2020/usr/bin/xdg-open: line 871: www-browser: command not found
/cvmfs/soft.computecanada.ca/gentoo/2020/usr/bin/xdg-open: line 871: links2: command not found
/home/lisat/.local/lib/python3.10/site-packages/xgboost/data.py:440: FutureWarning:

is_sparse is deprecated and will be removed in a future version. Check `isinstance(dtype, pd.SparseDtype)` instead.

[I 2023-12-21 02:32:25,478] A new study created in memory with name: no-name-5a27cb6e-7f91-4ce3-990a-e6deba812fcb

(tf2.15) [lisat@ng31201 lisat]$
(tf2.15) [lisat@ng31201 lisat]$ cat inter/res/20231220.log
8
Loading cleaned and msked narratives from disk
5 minutes ago|5 min ago|5 min. ago 0.08333333333333333 (23, 37)
15 minutes ago|15 min ago|15 min. ago 0.25 (4, 37)
20 minutes ago|20 min ago|20 min. ago 0.3333333333333333 (13, 37)
30 minutes ago|30 min ago|30 min. ago 0.5 (82, 37)
40 minutes ago|40 min ago|40 min. ago 0.6666666666666666 (8, 37)
45 minutes ago|45 min ago|45 min. ago 0.75 (17, 37)
75 minutes ago|75 min ago|75 min. ago 1.25 (2, 37)
90 minutes ago|90 min ago|90 min. ago 1.5 (2, 37)
1 days ago|1 d ago|1 dy ago|1night|1 nights ago|1day 24 (72, 37)
2 days ago|2 d ago|2 dy ago|2night|2 nights ago|2day 48 (234, 37)
3 days ago|3 d ago|3 dy ago|3night|3 nights ago|3day 72 (154, 37)
4 days ago|4 d ago|4 dy ago|4night|4 nights ago|4day 96 (58, 37)
5 days ago|5 d ago|5 dy ago|5night|5 nights ago|5day 120 (48, 37)
6 days ago|6 d ago|6 dy ago|6night|6 nights ago|6day 144 (25, 37)
7 days ago|7 d ago|7 dy ago|7night|7 nights ago|7day 168 (1, 37)
8 days ago|8 d ago|8 dy ago|8night|8 nights ago|8day 192 (8, 37)
9 days ago|9 d ago|9 dy ago|9night|9 nights ago|9day 216 (3, 37)
10 days ago|10 d ago|10 dy ago|10night|10 nights ago|10day 240 (23, 37)
11 days ago|11 d ago|11 dy ago|11night|11 nights ago|11day 264 (1, 37)
an hour|1 hour|a hour 1 (679, 37)
couple h|coup. h 3 (19, 37)
few h 4 (131, 37)
sev h|sev. h|several h 5 (232, 37)
this even 6 (551, 37)
this afternoon 8 (392, 37)
around 1:|around 1 a|around 1 p 8 (26, 37)
around 2:|around 2 a|around 2 p 8 (29, 37)
around 3:|around 3 a|around 3 p 8 (59, 37)
around 4:|around 4 a|around 4 p 8 (37, 37)
around 5:|around 5 a|around 5 p 8 (30, 37)
around 6:|around 6 a|around 6 p 8 (36, 37)
around 7:|around 7 a|around 7 p 8 (28, 37)
around 8:|around 8 a|around 8 p 8 (21, 37)
around 9:|around 9 a|around 9 p 8 (30, 37)
around 10:|around 10 a|around 10 p 8 (32, 37)
around 11:|around 11 a|around 11 p 8 (27, 37)
around 12:|around 12 a|around 12 p 8 (6, 37)
around 16:|around 16 a|around 16 p 8 (2, 37)
around 18:|around 18 a|around 18 p 8 (1, 37)
around 20:|around 20 a|around 20 p 8 (2, 37)
today|tdy|morning|this am|this pm 12 (19833, 37)
around midnight|last ngiht|last ev|yesterday n 16 (301, 37)
previous day|last noc|last might|last nite|last even|last night|day before|yesterday 24 (10111, 37)
couple d|coup. d|3 nites ago|3 nights ago 72 (35, 37)
few d|few n 96 (862, 37)
sev d|sev. d|several d 120 (356, 37)
last week|last wk|week ago 168 (2807, 37)
couple w|coup. w 504 (19, 37)
few w 672 (132, 37)
sev w|sev. w|several w 840 (61, 37)
last mth|last month 720 (41, 37)
couple m|coup. m 2160 (18, 37)
few m 2880 (95, 37)
sev w|sev. m|several m|mos ago 3600 (54, 37)
0.07098729564888158 (sample size as a percentage of entire cohort)


 65YM SEEN YTD FOR A FALL&TDY AGAIN @ HIS ECF S'D&F ON SOME SOAP IN THE BR HITTING CHEEK>>LAC, SDH
   see ytd for a falland### again at his EXTENDED CARE FACILITY slip and fall on some soap in the br hit cheek
 12.0


 92 YOF C/O LEG PAIN AFTER FALLING ON THE FLOOR TODAY AT HOME. DX CLOSEDFX LEFT FEMUR
   complain of leg pain after fall on the floor ### at home .
 12.0


 70YOF-PATIENT FELL OUT OF BED AT 0300 THIS MORNING.  LANDED ON THE RIGHT SIDE AFTER HITTING A GARBAGE CAN @ HOME.  DX: CONTUSION OF RIB                                                                      ON RIGHT SIDE
 -patient fall out of bed at 0300 this ### . land on the right side after hit a garbage can at home .
 12.0


 68 YOF C/O DONATED BLOOD THIS MORNING. APPROX 1 HR LATER PASSED OUT AND FELL ON THE FLOOR OF THE HOSPITAL LOBBY. DX SYNCOPE AND COLLAPSE                                                                     . NO INJURY
   complain of donate blood this ### . approx 1 hr later pass out and fall on the floor of the hospital lobby .
 12.0


 ACUTE ON CHRONIC L HIP PAIN/68YOWM FELL OUT OF HIS BED THIS MORNING ATHOME AND C/O L HIP PAIN.
 acute on chronic l hip pain/68yowm fall out of his bed this ### athome and complain of l hip pain .
 12.0


 93 YOF REPORTS FALL IN BATHROOM, LAYED ON FLOOR ALL NIGHT, GOT UP THISMORNING AND WENT TO BED AND FELL AGAIN, C/O SHOULDER PAIN. DX FALL                                                                     
   report fall in bathroom   lay on floor all night   get up this### and go to bed and fall again   complain of shoulder pain .
 12.0


 74 YOF FELL DOWN 4 STEPS TODAY WHEN HER KNEE GAVE OUT WHILE LEAVING THE HOUSE.  PT REPORTS HEAD INJURY.  DX:  HYPERGLYCEMIA, HYPOKALEMIA                                                                     , GROUND LEVEL FALL.
   fall down 4 step ### when her knee give out while leave the house . patient report head injury .
 12.0


 65YOF PATIENT HAVING INCREASED GENERALIZED FATIGUE AND DIFFICULTY GETTING AROUND HER HOUSE, SHE SLIPPED OFF HER COUCH AND HAD NO STRENGT                                                                     H AND LAY ON THE FLOOR FOR A COUPLE HOURS, LATER SHE WAS ABLE TO GET UP, WAS TRYING TO GO TO THE BATHROOM, GOT FATIGUED AGAIN, FELL STRIK                                                                     ING HER HEAD AGAINST A DOOR, PAIN IN THE BACK OF THE HEAD DX: ACUTE HYPOXEMIC RESPIRATORY FAILURE DUE TO COVID-19
   patient having increase generalized fatigue and difficulty get around her house   she slip off her couch and have no strength and lie                                                                      on the floor for a ###our   later she be able to get up   be try to go to the bathroom   got fatigue again   fall strike her head against                                                                      a door   pain in the back of the head
 3.0


 89YOF HAD MECHANICAL FALL OUT OF BED EARLIER MORNING. DX: HEAD INJURY, FACIAL LACERATION, DEMENTIA, FALL
   have mechanical fall out of bed early ### .
 12.0


 84YOF S/P FALL PER GRANDSON PT FELL DOWN 2-3 STEPS YESTERDAY WAS ASSESSED BY EMS AT HOME WHO RECOMMENDED SHE STAY HOME BUT OVER LAST 24                                                                      HRS PT W/ POOR ORAL INTAKE IN PAIN VOMITED X2 BECAME ALTERED CONFUSED DX: FALL LT HIP LT SUPERIOR/INFERIOR PUBC RAMI LT SACRAL FXS
   after fall per grandson patient fall down 2 - 3 step ### be assess by em at home who recommend she stay home but over last 24 hour pat                                                                     ient with poor oral intake in pain vomit x2 became alter confused
 24.0


 96YOF WAS SWEEPING THE FLOOR AT HOME & LOST BALANCE & FELL ON RIGHT HIP 30 MINS AGO, FALL NOT WITNESSED , NO HEAD INJURY DX FALL AT HOME                                                                     , RIGHT HIP PAIN, FRACTURE OF RIGHT HIP, CLOSED
   be sweep the floor at home and lose balance and fall on right hip ###   fall not witness    no head injury
 0.5


 92YOF TO ER FOR POST FALL EVAL, PT IS W/ DAUGHTER SHE SAYS MOM WOKE FROM NAP 30 MINS AGO & GOT UP FROM BED & SLIPPED ON BEDSHEETS & FELL                                                                      TO FLOOR, PT HIT FACE ON FLOOR, NO LOC OR THINNERS DX HYPOMAGNESMIA, PERIORBITAL HEMATOMA OF LEFT EYE
   to emergency room for post fall evaluate   patient be with daughter she say mom wake from nap ### and get up from bed and slip on beds                                                                     heet and fall to floor   patient hit face on floor   no loss of consciousness or thinner
 0.5


 80YOM PRESENTS AFTER BEING FOUND UNRESPONSIVE BY WORKERS LYING ON CONCRETE FLOOR, FELL 10 STEPS 30 MINS AGO. PT WAS AT TOP OF STAIRS OF                                                                      HIS HOUSE AND WOKE UP AT THE BOTTOM + RT THIGH WOUND + HEADACHE + RT HIP/LEG PAINDX: SYNCOPE; FALL; HEAD INJURY; LEG PAIN; LEUKOCYTOSIS
   present after be find unresponsive by worker lie on concrete floor   fall 10 step ### . patient be at top of stair of his house and wa                                                                     ke up at the bottom    right thigh wound    headache    right hip / leg pain
 0.5


 74YOF HAS HAD MULTIPLE FALLS FALLING TO FLOOR STATING HER LEG GIVES OUT FELL 20 MIN AGO WITH ABRASIONS ON LOWER LEG DX ABRASIONS LOWER L                                                                     EG
   have have multiple fall fall to floor state her leg give out fall ### with abrasion on low leg
 0.3333333333333333


 71YOF PRESENTS AFTER TRIPPING AND FALLING OVER A BIKE OUTSIDE BUILDING 15 MIN AGO. C/O PAIN TO BACK AND L HIP DX: INFERIOR PUBIC RAMUS F                                                                     X, L, SEQUELA
   present after trip and fall over a bike outside build ### . complain of pain to back and l hip
 0.25


 99YOF TO ER FOR LEFT HIP & TAIL BONE PAIN, PT LOST BALANCE WHEN PICKING UP LAUNDRY AT HOME & FELL ON BUTTOCKS & RIGHT HIP 30 MIN AGO, NO                                                                     T WITNESSED, DAUGHTER HEARD FALL FROM OTHER ROOM DX FALL, RIGHT HIP PAIN, COCCYX PAIN
   to emergency room for left hip and tail b1 pain   patient lose balance when pick up laundry at home and fall on buttock and right hip                                                                      ###   not witness   daughter hear fall from other room
 0.5


 68 YOM C/O FELL DOWN ONE STEP TONIGHT 30 MIN AGO AT HOME. FELT A POP IN HIS KNEE. DX SPRAIN OF LEFT KNEE
   complain of fall down 1 step tonight ### at home . feel a pop in his knee .
 0.5


 88 YOF C/O 45 MIN AGO SHE FELL ON THE FLOOR AND HER ARM HIT THE CABINET IN HER KITCHEN. DX LACERATION LEFT UPPER ARM
   complain of 4### she fall on the floor and her arm hit the cabinet in her kitchen .
 0.08333333333333333


 69 YOF C/O WRIST PAIN AFTER FALLING AFTER MISSING THE STEP 30 MIN AGO. DX CLOSED FX DISTAL ENDS OF RIGHT RADIUS AND ULNA
   complain of wrist pain after fall after miss the step ### .
 0.5


 84YOF FELL 45 MINS AGO WHEN SHE LOST HER BALANCE WHILE WALKING DOWN THE STAIRS USING HER CANE. SHE INJURED HER LEFT SHOULDER. SHE DID BU                                                                     MP HER HEAD, DID NOT LOSE CONSCIOUSNESS. SHE FELL LAST WEEK, WAS SEEN HERE AND FOUND TO HAVE BROKEN HER RIGHT HUMERUS. SHE IS NOT ANTICOA                                                                     GULATED. ADMITTED. DX: CLOSED FRACTURE OF LEFT PROXIMAL HUMERUS
   fall ### when she lose her balance while walk down the stair use her cane . she injure her left shoulder . she do bump her head   do n                                                                     ot lose consciousness . she fall last week   be see here and find to have break her right humerus . she be not anticoagulate . admit .
 0.75
Reducing word embedding 1 via UMAP
finished in 0.42767634789148967 min
Reducing word embedding 2 via UMAP
finished in 0.1880677342414856 min
Reducing word embedding 3 via UMAP
finished in 0.2024627407391866 min
Reducing word embedding 4 via UMAP
finished in 0.19734697341918944 min
Reducing word embedding 6 via UMAP
finished in 0.1903553048769633 min
1 dict_keys([('trn1', 16)])
1 dict_keys([('trn1', 16), ('trn2', 16)])
1 dict_keys([('trn1', 16), ('trn2', 16), ('val', 16)])
1 dict_keys([('trn1', 16), ('trn2', 16), ('val', 16), ('tst', 16)])
finished in 3.0731228391329446 min
2 dict_keys([('trn1', 16)])
2 dict_keys([('trn1', 16), ('trn2', 16)])
2 dict_keys([('trn1', 16), ('trn2', 16), ('val', 16)])
2 dict_keys([('trn1', 16), ('trn2', 16), ('val', 16), ('tst', 16)])
finished in 2.987854329744975 min
3 dict_keys([('trn1', 16)])
3 dict_keys([('trn1', 16), ('trn2', 16)])
3 dict_keys([('trn1', 16), ('trn2', 16), ('val', 16)])
3 dict_keys([('trn1', 16), ('trn2', 16), ('val', 16), ('tst', 16)])
finished in 2.9767372568448383 min
4 dict_keys([('trn1', 16)])
4 dict_keys([('trn1', 16), ('trn2', 16)])
4 dict_keys([('trn1', 16), ('trn2', 16), ('val', 16)])
4 dict_keys([('trn1', 16), ('trn2', 16), ('val', 16), ('tst', 16)])
finished in 2.9483812848726907 min
6 dict_keys([('trn1', 16)])
6 dict_keys([('trn1', 16), ('trn2', 16)])
6 dict_keys([('trn1', 16), ('trn2', 16), ('val', 16)])
6 dict_keys([('trn1', 16), ('trn2', 16), ('val', 16), ('tst', 16)])
finished in 2.948526338736216 min
                                                                         0   ...                                                 10
                                                                     293469  ...                                               8920
index                                                                178341  ...                                               8920
cpsc_case_number                                                  171203073  ...                                          190550575
narrative                 86YOF PT WAS BOWLING TODAY & AFTER HER TURN, T...  ...  86YOF LIVES ALONE AND FELL OFF THE TOILET YEST...
treatment_date                                                   2017-11-28  ...                                         2019-05-14
age                                                                      86  ...                                                 86
sex                                                                  FEMALE  ...                                             FEMALE
race                                                                  WHITE  ...                                               N.S.
other_race                                                             None  ...                                               None
hispanic                                                               None  ...                                     Unk/Not stated
diagnosis                                               64 - STRAIN, SPRAIN  ...                               62 - INTERNAL INJURY
other_diagnosis                                                        None  ...                                               None
diagnosis_2                                                            None  ...                                         71 - OTHER
other_diagnosis_2                                                      None  ...                                     RHABDOMYOLYSIS
body_part                                                        34 - WRIST  ...                                          75 - HEAD
body_part_2                                                            None  ...                                85 - ALL PARTS BODY
disposition                                                               1  ...                                                  4
location                                                             SPORTS  ...                                               HOME
fire_involvement                                                       NO/?  ...                                               NO/?
alcohol                                                                None  ...                                             No/Unk
drug                                                                   None  ...                                             No/Unk
product_1                               1807 - FLOORS OR FLOORING MATERIALS  ...                1807 - FLOORS OR FLOORING MATERIALS
product_2                   1206 - BOWLING (ACTIVITY, APPAREL OR EQUIPMENT)  ...                                      649 - TOILETS
product_3                                                          0 - None  ...                                           0 - None
source                                                                    2  ...                                                  1
month                                                                    11  ...                                                  5
year                                                                   2017  ...                                               2019
race_recoded                                                              1  ...                    