[I 2023-12-19 00:58:42,442] Trial 194 finished with value: 2.1460733125207776 and parameters: {'learning_rate': 0.4512297467920207, 'aft_loss_distribution': 'logistic', 'aft_loss_distribution_scale': 1.8601010876746291, 'max_depth': 4, 'booster': 'dart', 'scale_pos_weight': 1.637570203438013, 'alpha': 7.806176245859724, 'lambda': 9.009006665221936, 'eta': 0.9846117106189904, 'sampling_method': 'uniform', 'subsample': 0.2691988230733796, 'gamma': 4.953195458489164}. Best is trial 194 with value: 2.1460733125207776.
[I 2023-12-19 00:58:42,531] Trial 195 pruned. Trial was pruned at iteration 0.
[I 2023-12-19 00:58:42,612] Trial 196 pruned. Trial was pruned at iteration 0.
[I 2023-12-19 00:58:42,731] Trial 197 pruned. Trial was pruned at iteration 0.
[I 2023-12-19 00:58:42,846] Trial 198 pruned. Trial was pruned at iteration 0.
[I 2023-12-19 00:58:42,963] Trial 199 pruned. Trial was pruned at iteration 0.
[I 2023-12-19 00:58:43,090] Trial 200 pruned. Trial was pruned at iteration 0.
[I 2023-12-19 00:58:53,205] Trial 201 finished with value: 2.179943059170755 and parameters: {'learning_rate': 0.5208440857834886, 'aft_loss_distribution': 'logistic', 'aft_loss_distribution_scale': 2.0823192021465795, 'max_depth': 9, 'booster': 'dart', 'scale_pos_weight': 1.640959344185291, 'alpha': 8.363470179573687, 'lambda': 8.683389297373756, 'eta': 0.9693580960205138, 'sampling_method': 'uniform', 'subsample': 0.4032401937389132, 'gamma': 5.011406751417471}. Best is trial 194 with value: 2.1460733125207776.
[I 2023-12-19 00:59:01,700] Trial 202 finished with value: 2.1400276593286556 and parameters: {'learning_rate': 0.5371602843439229, 'aft_loss_distribution': 'logistic', 'aft_loss_distribution_scale': 1.8371474467435258, 'max_depth': 9, 'booster': 'dart', 'scale_pos_weight': 1.8303416819570166, 'alpha': 8.120726060776027, 'lambda': 8.921226858499665, 'eta': 0.9635172022897497, 'sampling_method': 'uniform', 'subsample': 0.397225004157774, 'gamma': 4.98955193972605}. Best is trial 202 with value: 2.1400276593286556.
[I 2023-12-19 00:59:06,248] Trial 203 finished with value: 2.161865841296552 and parameters: {'learning_rate': 0.5084829172454274, 'aft_loss_distribution': 'logistic', 'aft_loss_distribution_scale': 1.9719567501251754, 'max_depth': 9, 'booster': 'dart', 'scale_pos_weight': 1.8289386088596022, 'alpha': 7.8529548538947616, 'lambda': 9.07581976222045, 'eta': 0.9673378330884133, 'sampling_method': 'uniform', 'subsample': 0.4064800379261386, 'gamma': 5.192095701509396}. Best is trial 202 with value: 2.1400276593286556.
[I 2023-12-19 00:59:10,304] Trial 204 finished with value: 2.136780326464587 and parameters: {'learning_rate': 0.5331498695950372, 'aft_loss_distribution': 'logistic', 'aft_loss_distribution_scale': 1.8100116729630047, 'max_depth': 9, 'booster': 'dart', 'scale_pos_weight': 1.9395552653280677, 'alpha': 7.6967139922169485, 'lambda': 8.79802291461138, 'eta': 0.9610234431613728, 'sampling_method': 'uniform', 'subsample': 0.4201655482355616, 'gamma': 4.849662852028157}. Best is trial 204 with value: 2.136780326464587.
[I 2023-12-19 00:59:12,569] Trial 205 finished with value: inf and parameters: {'learning_rate': 0.534019765628686, 'aft_loss_distribution': 'logistic', 'aft_loss_distribution_scale': 1.7078803016200963, 'max_depth': 9, 'booster': 'dart', 'scale_pos_weight': 1.862301625695622, 'alpha': 8.094788441441352, 'lambda': 8.772639228857742, 'eta': 0.9635420690463082, 'sampling_method': 'uniform', 'subsample': 0.41439980296503637, 'gamma': 4.916031879480292}. Best is trial 204 with value: 2.136780326464587.
[I 2023-12-19 00:59:17,635] Trial 206 finished with value: 2.153412841935199 and parameters: {'learning_rate': 0.519142413031941, 'aft_loss_distribution': 'logistic', 'aft_loss_distribution_scale': 1.9212223490231555, 'max_depth': 9, 'booster': 'dart', 'scale_pos_weight': 1.944529960296765, 'alpha': 7.682459669463523, 'lambda': 9.171816652392705, 'eta': 0.9731430913741143, 'sampling_method': 'uniform', 'subsample': 0.4048305604439709, 'gamma': 4.92118388600858}. Best is trial 204 with value: 2.136780326464587.
[I 2023-12-19 00:59:23,997] Trial 207 finished with value: 2.143007420704529 and parameters: {'learning_rate': 0.5224597488475438, 'aft_loss_distribution': 'logistic', 'aft_loss_distribution_scale': 1.8441390510707976, 'max_depth': 9, 'booster': 'dart', 'scale_pos_weight': 1.9556984013972007, 'alpha': 7.738630404159349, 'lambda': 9.20785427933416, 'eta': 0.978981162720648, 'sampling_method': 'uniform', 'subsample': 0.3982884524379464, 'gamma': 5.075055339702722}. Best is trial 204 with value: 2.136780326464587.
[I 2023-12-19 00:59:26,310] Trial 208 finished with value: inf and parameters: {'learning_rate': 0.5383011410231247, 'aft_loss_distribution': 'logistic', 'aft_loss_distribution_scale': 1.4001268823984594, 'max_depth': 9, 'booster': 'dart', 'scale_pos_weight': 1.9557424520993714, 'alpha': 7.744755062433925, 'lambda': 9.22850624053599, 'eta': 0.9730819371254927, 'sampling_method': 'uniform', 'subsample': 0.3903248972417932, 'gamma': 4.990578287623767}. Best is trial 204 with value: 2.136780326464587.
[I 2023-12-19 00:59:31,252] Trial 209 finished with value: 2.1366662022929446 and parameters: {'learning_rate': 0.5728979774743371, 'aft_loss_distribution': 'logistic', 'aft_loss_distribution_scale': 1.8175541511449866, 'max_depth': 9, 'booster': 'dart', 'scale_pos_weight': 2.023400264219344, 'alpha': 8.326537026077919, 'lambda': 9.05506765191758, 'eta': 0.9474703006608688, 'sampling_method': 'uniform', 'subsample': 0.40203739748216777, 'gamma': 5.147180516578322}. Best is trial 209 with value: 2.1366662022929446.
[I 2023-12-19 00:59:37,306] Trial 210 finished with value: 2.129945856341326 and parameters: {'learning_rate': 0.5182822883462594, 'aft_loss_distribution': 'logistic', 'aft_loss_distribution_scale': 1.7850228080242547, 'max_depth': 9, 'booster': 'dart', 'scale_pos_weight': 2.178227436184087, 'alpha': 7.849247926913435, 'lambda': 9.04854447713858, 'eta': 0.9496663098679943, 'sampling_method': 'uniform', 'subsample': 0.3963034513051984, 'gamma': 5.170884337388558}. Best is trial 210 with value: 2.129945856341326.
[I 2023-12-19 00:59:40,003] Trial 211 finished with value: 2.11052747360917 and parameters: {'learning_rate': 0.5809963807371504, 'aft_loss_distribution': 'logistic', 'aft_loss_distribution_scale': 1.6636042011340502, 'max_depth': 9, 'booster': 'dart', 'scale_pos_weight': 2.1718211818158792, 'alpha': 7.878577490695417, 'lambda': 9.071841652181602, 'eta': 0.9349447476407379, 'sampling_method': 'uniform', 'subsample': 0.40146297325795866, 'gamma': 5.157688355921842}. Best is trial 211 with value: 2.11052747360917.
[I 2023-12-19 00:59:49,128] Trial 212 finished with value: 2.1322165617289675 and parameters: {'learning_rate': 0.5826205914042837, 'aft_loss_distribution': 'logistic', 'aft_loss_distribution_scale': 1.7881007396869304, 'max_depth': 9, 'booster': 'dart', 'scale_pos_weight': 2.1783516624293697, 'alpha': 8.284943146570791, 'lambda': 9.047151500634252, 'eta': 0.9436437928167811, 'sampling_method': 'uniform', 'subsample': 0.3959222310690412, 'gamma': 5.118023382813948}. Best is trial 211 with value: 2.11052747360917.
[I 2023-12-19 00:59:52,571] Trial 213 finished with value: 2.1367394886553646 and parameters: {'learning_rate': 0.57584191247135, 'aft_loss_distribution': 'logistic', 'aft_loss_distribution_scale': 1.8053850076528513, 'max_depth': 9, 'booster': 'dart', 'scale_pos_weight': 2.1759044339363127, 'alpha': 8.367307443091539, 'lambda': 8.955615397190067, 'eta': 0.9588417678691924, 'sampling_method': 'uniform', 'subsample': 0.40806866161232946, 'gamma': 5.1360196574836685}. Best is trial 211 with value: 2.11052747360917.
[I 2023-12-19 01:00:02,542] Trial 214 finished with value: 2.1430610973496704 and parameters: {'learning_rate': 0.5860341479431259, 'aft_loss_distribution': 'logistic', 'aft_loss_distribution_scale': 1.8489135962405105, 'max_depth': 9, 'booster': 'dart', 'scale_pos_weight': 2.10064874914881, 'alpha': 8.228148336738561, 'lambda': 9.111517698610774, 'eta': 0.939545055415976, 'sampling_method': 'uniform', 'subsample': 0.4145609662115824, 'gamma': 5.150370521749536}. Best is trial 211 with value: 2.11052747360917.
[I 2023-12-19 01:00:04,434] Trial 215 finished with value: inf and parameters: {'learning_rate': 0.5899031942184825, 'aft_loss_distribution': 'logistic', 'aft_loss_distribution_scale': 1.5183836862639253, 'max_depth': 9, 'booster': 'dart', 'scale_pos_weight': 2.1947770658669024, 'alpha': 8.306795047671347, 'lambda': 9.098402770211278, 'eta': 0.9457304500484367, 'sampling_method': 'uniform', 'subsample': 0.40455597198962323, 'gamma': 5.1132570695501185}. Best is trial 211 with value: 2.11052747360917.
[I 2023-12-19 01:00:06,310] Trial 216 finished with value: inf and parameters: {'learning_rate': 0.6261049868155217, 'aft_loss_distribution': 'logistic', 'aft_loss_distribution_scale': 1.732209382279206, 'max_depth': 9, 'booster': 'dart', 'scale_pos_weight': 2.0505956504238756, 'alpha': 7.701255028561267, 'lambda': 8.83899757045948, 'eta': 0.9367204876922737, 'sampling_method': 'uniform', 'subsample': 0.3894477487780334, 'gamma': 5.451372620833055}. Best is trial 211 with value: 2.11052747360917.
[I 2023-12-19 01:00:12,489] Trial 217 finished with value: 2.1388977793400605 and parameters: {'learning_rate': 0.5773535603313358, 'aft_loss_distribution': 'logistic', 'aft_loss_distribution_scale': 1.8298312257290674, 'max_depth': 9, 'booster': 'dart', 'scale_pos_weight': 2.208956571205519, 'alpha': 7.857736055520074, 'lambda': 9.387668445359658, 'eta': 0.9765248207418885, 'sampling_method': 'uniform', 'subsample': 0.40655303119489233, 'gamma': 5.24245363856621}. Best is trial 211 with value: 2.11052747360917.
[I 2023-12-19 01:00:21,574] Trial 218 finished with value: 2.1330201486638716 and parameters: {'learning_rate': 0.5692514257303363, 'aft_loss_distribution': 'logistic', 'aft_loss_distribution_scale': 1.784163442266737, 'max_depth': 9, 'booster': 'dart', 'scale_pos_weight': 2.1657898909562334, 'alpha': 7.911284205201293, 'lambda': 9.479688646513889, 'eta': 0.9794460354211392, 'sampling_method': 'uniform', 'subsample': 0.4138869857961814, 'gamma': 5.282823922489355}. Best is trial 211 with value: 2.11052747360917.
[I 2023-12-19 01:00:34,889] Trial 219 finished with value: 2.137554535019781 and parameters: {'learning_rate': 0.5762671759146928, 'aft_loss_distribution': 'logistic', 'aft_loss_distribution_scale': 1.8224343127986378, 'max_depth': 9, 'booster': 'dart', 'scale_pos_weight': 2.150619257973468, 'alpha': 8.23959008183096, 'lambda': 9.388862870237611, 'eta': 0.9778813568525802, 'sampling_method': 'uniform', 'subsample': 0.41822682297735536, 'gamma': 5.165804596214148}. Best is trial 211 with value: 2.11052747360917.
[I 2023-12-19 01:00:36,963] Trial 220 pruned. Trial was pruned at iteration 66.
[I 2023-12-19 01:00:43,354] Trial 221 finished with value: 2.13887078765829 and parameters: {'learning_rate': 0.5591031104652996, 'aft_loss_distribution': 'logistic', 'aft_loss_distribution_scale': 1.8263256549497604, 'max_depth': 9, 'booster': 'dart', 'scale_pos_weight': 2.3502710820577994, 'alpha': 7.931994953189172, 'lambda': 9.116924341095697, 'eta': 0.9500786620610996, 'sampling_method': 'uniform', 'subsample': 0.38190257988325343, 'gamma': 5.085817727237601}. Best is trial 211 with value: 2.11052747360917.
[I 2023-12-19 01:00:47,687] Trial 222 finished with value: 2.138628366870799 and parameters: {'learning_rate': 0.5587480434849756, 'aft_loss_distribution': 'logistic', 'aft_loss_distribution_scale': 1.8252104316999027, 'max_depth': 9, 'booster': 'dart', 'scale_pos_weight': 2.160729103619499, 'alpha': 7.954808422035374, 'lambda': 9.109873735886254, 'eta': 0.999995071895898, 'sampling_method': 'uniform', 'subsample': 0.38286413790648566, 'gamma': 5.060553347626977}. Best is trial 211 with value: 2.11052747360917.
[I 2023-12-19 01:00:53,790] Trial 223 finished with value: 2.119938895493258 and parameters: {'learning_rate': 0.5567501117463484, 'aft_loss_distribution': 'logistic', 'aft_loss_distribution_scale': 1.7076066879202014, 'max_depth': 9, 'booster': 'dart', 'scale_pos_weight': 2.1324843979067314, 'alpha': 7.8832042856014235, 'lambda': 9.317413374553078, 'eta': 0.9569097662733933, 'sampling_method': 'uniform', 'subsample': 0.38277799211099034, 'gamma': 5.058244771725986}. Best is trial 211 with value: 2.11052747360917.
[I 2023-12-19 01:01:03,271] Trial 224 finished with value: 2.1286407535004988 and parameters: {'learning_rate': 0.557319685123449, 'aft_loss_distribution': 'logistic', 'aft_loss_distribution_scale': 1.7566779850016012, 'max_depth': 9, 'booster': 'dart', 'scale_pos_weight': 2.349234745250403, 'alpha': 7.899775530578857, 'lambda': 9.302722403146925, 'eta': 0.9584747413405299, 'sampling_method': 'uniform', 'subsample': 0.38930746809568617, 'gamma': 5.012129520980474}. Best is trial 211 with value: 2.11052747360917.
[I 2023-12-19 01:01:05,447] Trial 225 finished with value: inf and parameters: {'learning_rate': 0.5598070775213232, 'aft_loss_distribution': 'logistic', 'aft_loss_distribution_scale': 1.8016158337143442, 'max_depth': 9, 'booster': 'dart', 'scale_pos_weight': 2.3518200169040786, 'alpha': 7.865849512483314, 'lambda': 9.284568493753476, 'eta': 0.964129494724211, 'sampling_method': 'uniform', 'subsample': 0.37773679131207255, 'gamma': 5.021864218923646}. Best is trial 211 with value: 2.11052747360917.
[I 2023-12-19 01:01:08,023] Trial 226 finished with value: inf and parameters: {'learning_rate': 0.5925817106055106, 'aft_loss_distribution': 'logistic', 'aft_loss_distribution_scale': 1.5883700860238628, 'max_depth': 9, 'booster': 'dart', 'scale_pos_weight': 2.154150485482541, 'alpha': 7.984786014731233, 'lambda': 9.100676477193268, 'eta': 0.9456164482299336, 'sampling_method': 'uniform', 'subsample': 0.4033361103646035, 'gamma': 5.165022358257294}. Best is trial 211 with value: 2.11052747360917.
[I 2023-12-19 01:01:08,191] Trial 227 pruned. Trial was pruned at iteration 1.
[I 2023-12-19 01:01:12,991] Trial 228 finished with value: 2.1336969070268594 and parameters: {'learning_rate': 0.5666996293666005, 'aft_loss_distribution': 'logistic', 'aft_loss_distribution_scale': 1.778089413767444, 'max_depth': 9, 'booster': 'dart', 'scale_pos_weight': 2.113297872501643, 'alpha': 7.841046102240033, 'lambda': 9.456316741161512, 'eta': 0.9997841010409297, 'sampling_method': 'uniform', 'subsample': 0.43555453244366577, 'gamma': 5.421702947411586}. Best is trial 211 with value: 2.11052747360917.
[I 2023-12-19 01:01:14,924] Trial 229 finished with value: inf and parameters: {'learning_rate': 0.5765331547398503, 'aft_loss_distribution': 'logistic', 'aft_loss_distribution_scale': 1.7804895936987524, 'max_depth': 9, 'booster': 'dart', 'scale_pos_weight': 2.117811752778786, 'alpha': 7.915031960180616, 'lambda': 9.463748037136618, 'eta': 0.9993376109455694, 'sampling_method': 'uniform', 'subsample': 0.43502696576150346, 'gamma': 5.387055638045948}. Best is trial 211 with value: 2.11052747360917.
[I 2023-12-19 01:01:17,156] Trial 230 finished with value: inf and parameters: {'learning_rate': 0.5464699813127467, 'aft_loss_distribution': 'logistic', 'aft_loss_distribution_scale': 1.4971870937175547, 'max_depth': 9, 'booster': 'dart', 'scale_pos_weight': 2.041790228236306, 'alpha': 7.691289673384564, 'lambda': 9.00747735151955, 'eta': 0.9622116577488784, 'sampling_method': 'uniform', 'subsample': 0.38647623440992335, 'gamma': 4.921724682502707}. Best is trial 211 with value: 2.11052747360917.
[I 2023-12-19 01:01:17,249] Trial 231 pruned. Trial was pruned at iteration 0.
[I 2023-12-19 01:01:18,896] Trial 232 pruned. Trial was pruned at iteration 57.
[I 2023-12-19 01:01:29,082] Trial 233 finished with value: 2.0977569590378824 and parameters: {'learning_rate': 0.5216207618096731, 'aft_loss_distribution': 'logistic', 'aft_loss_distribution_scale': 1.5894442589564808, 'max_depth': 9, 'booster': 'dart', 'scale_pos_weight': 2.104605046606979, 'alpha': 8.069555739798618, 'lambda': 9.52579827935493, 'eta': 0.9248570692989663, 'sampling_method': 'uniform', 'subsample': 0.4528860179371917, 'gamma': 5.556083783983082}. Best is trial 233 with value: 2.0977569590378824.
[I 2023-12-19 01:01:31,502] Trial 234 finished with value: inf and parameters: {'learning_rate': 0.5215314153963989, 'aft_loss_distribution': 'logistic', 'aft_loss_distribution_scale': 1.6457703340385499, 'max_depth': 9, 'booster': 'dart', 'scale_pos_weight': 2.3625795429893173, 'alpha': 7.445693871493141, 'lambda': 9.594803675470134, 'eta': 0.9322039496165705, 'sampling_method': 'uniform', 'subsample': 0.45420171023416883, 'gamma': 5.5924423821249345}. Best is trial 233 with value: 2.0977569590378824.
[I 2023-12-19 01:01:31,619] Trial 235 pruned. Trial was pruned at iteration 1.
[I 2023-12-19 01:01:36,155] Trial 236 finished with value: 2.127532925972149 and parameters: {'learning_rate': 0.5840924273211789, 'aft_loss_distribution': 'logistic', 'aft_loss_distribution_scale': 1.7422383201151104, 'max_depth': 9, 'booster': 'dart', 'scale_pos_weight': 1.955636246611537, 'alpha': 7.827350444858528, 'lambda': 9.410644060099486, 'eta': 0.9989412456495371, 'sampling_method': 'uniform', 'subsample': 0.34229756285720236, 'gamma': 5.392065293777079}. Best is trial 233 with value: 2.0977569590378824.
[I 2023-12-19 01:01:47,304] Trial 237 finished with value: 2.124545848962486 and parameters: {'learning_rate': 0.5855731343791758, 'aft_loss_distribution': 'logistic', 'aft_loss_distribution_scale': 1.7309832602764623, 'max_depth': 9, 'booster': 'dart', 'scale_pos_weight': 2.2307706873444655, 'alpha': 7.811456915536934, 'lambda': 9.378951175821943, 'eta': 0.9983486590933225, 'sampling_method': 'uniform', 'subsample': 0.3460453298346776, 'gamma': 5.415743101856799}. Best is trial 233 with value: 2.0977569590378824.
[I 2023-12-19 01:01:49,420] Trial 238 finished with value: inf and parameters: {'learning_rate': 0.5762449082199304, 'aft_loss_distribution': 'logistic', 'aft_loss_distribution_scale': 1.5220992791294918, 'max_depth': 9, 'booster': 'dart', 'scale_pos_weight': 2.2324777430937672, 'alpha': 7.8077098088061225, 'lambda': 9.408287548680727, 'eta': 0.9866094663246984, 'sampling_method': 'uniform', 'subsample': 0.3506061469442597, 'gamma': 5.412511703785488}. Best is trial 233 with value: 2.0977569590378824.
[I 2023-12-19 01:01:53,496] Trial 239 finished with value: 2.1364822523843277 and parameters: {'learning_rate': 0.5911841149857114, 'aft_loss_distribution': 'logistic', 'aft_loss_distribution_scale': 1.7904526465570094, 'max_depth': 9, 'booster': 'dart', 'scale_pos_weight': 1.9107154679254528, 'alpha': 8.019240183463246, 'lambda': 9.332512106962467, 'eta': 0.9948569549317955, 'sampling_method': 'uniform', 'subsample': 0.378778900364547, 'gamma': 5.249299544176638}. Best is trial 233 with value: 2.0977569590378824.
[I 2023-12-19 01:01:56,201] Trial 240 finished with value: inf and parameters: {'learning_rate': 0.5951982702661249, 'aft_loss_distribution': 'logistic', 'aft_loss_distribution_scale': 1.750123270125269, 'max_depth': 9, 'booster': 'dart', 'scale_pos_weight': 1.9200486663094374, 'alpha': 8.011671936145616, 'lambda': 9.331757694621379, 'eta': 0.9944315979231138, 'sampling_method': 'uniform', 'subsample': 0.37284682279678266, 'gamma': 5.608463867909205}. Best is trial 233 with value: 2.0977569590378824.
[I 2023-12-19 01:02:19,545] Trial 241 finished with value: 2.1293569436169233 and parameters: {'learning_rate': 0.5338552262289091, 'aft_loss_distribution': 'logistic', 'aft_loss_distribution_scale': 1.7715231660656654, 'max_depth': 9, 'booster': 'dart', 'scale_pos_weight': 2.0970849439869843, 'alpha': 7.643826985279299, 'lambda': 9.552745566884074, 'eta': 0.9706665922476159, 'sampling_method': 'uniform', 'subsample': 0.38929082266492665, 'gamma': 5.203293548746823}. Best is trial 233 with value: 2.0977569590378824.
[I 2023-12-19 01:02:19,644] Trial 242 pruned. Trial was pruned at iteration 0.
[I 2023-12-19 01:02:19,778] Trial 243 pruned. Trial was pruned at iteration 1.
[I 2023-12-19 01:02:22,168] Trial 244 finished with value: inf and parameters: {'learning_rate': 0.5768929643354538, 'aft_loss_distribution': 'logistic', 'aft_loss_distribution_scale': 1.637990446378552, 'max_depth': 9, 'booster': 'dart', 'scale_pos_weight': 2.2904027225134316, 'alpha': 7.4047588474122445, 'lambda': 9.205374916807845, 'eta': 0.9561099880252925, 'sampling_method': 'uniform', 'subsample': 0.42203914012053656, 'gamma': 5.10026738204387}. Best is trial 233 with value: 2.0977569590378824.
[I 2023-12-19 01:02:24,322] Trial 245 pruned. Trial was pruned at iteration 57.
[I 2023-12-19 01:02:26,539] Trial 246 finished with value: inf and parameters: {'learning_rate': 0.5857752478721643, 'aft_loss_distribution': 'logistic', 'aft_loss_distribution_scale': 1.479209331110336, 'max_depth': 9, 'booster': 'dart', 'scale_pos_weight': 2.0139700960987734, 'alpha': 7.931675319184902, 'lambda': 9.000921457828063, 'eta': 0.97901041987819, 'sampling_method': 'uniform', 'subsample': 0.44778912658557485, 'gamma': 5.245121379505468}. Best is trial 233 with value: 2.0977569590378824.
[I 2023-12-19 01:02:32,713] Trial 247 finished with value: 2.110981968802564 and parameters: {'learning_rate': 0.5597577975837003, 'aft_loss_distribution': 'logistic', 'aft_loss_distribution_scale': 1.6562859080144405, 'max_depth': 9, 'booster': 'dart', 'scale_pos_weight': 2.1873221317253173, 'alpha': 8.213098015873872, 'lambda': 9.321645262396427, 'eta': 0.9609655290745442, 'sampling_method': 'uniform', 'subsample': 0.41580929257584387, 'gamma': 5.754665332603107}. Best is trial 233 with value: 2.0977569590378824.
