[I 2023-12-19 00:38:54,714] Trial 351 finished with value: inf and parameters: {'learning_rate': 0.9988755438650586, 'aft_loss_distribution': 'normal', 'aft_loss_distribution_scale': 1.5496287681911838, 'max_depth': 3, 'booster': 'dart', 'scale_pos_weight': 1.5834858969591639, 'alpha': 0.21209507476782075, 'lambda': 2.1520085939489375, 'eta': 0.8463746525824469, 'sampling_method': 'gradient_based', 'subsample': 0.8361187023240093, 'gamma': 8.992033208601299}. Best is trial 346 with value: 2.018361189186848.
[I 2023-12-19 00:38:54,800] Trial 352 pruned. Trial was pruned at iteration 0.
[I 2023-12-19 00:38:54,883] Trial 353 pruned. Trial was pruned at iteration 0.
[I 2023-12-19 00:38:54,966] Trial 354 pruned. Trial was pruned at iteration 0.
[I 2023-12-19 00:38:56,286] Trial 355 finished with value: inf and parameters: {'learning_rate': 0.9824591526677648, 'aft_loss_distribution': 'normal', 'aft_loss_distribution_scale': 1.6945879521881015, 'max_depth': 3, 'booster': 'dart', 'scale_pos_weight': 1.5260313819339002, 'alpha': 8.645640048646587, 'lambda': 2.0183345267808455, 'eta': 0.8708739433517854, 'sampling_method': 'gradient_based', 'subsample': 0.8094987096712049, 'gamma': 8.92928447296357}. Best is trial 346 with value: 2.018361189186848.
[I 2023-12-19 00:38:56,375] Trial 356 pruned. Trial was pruned at iteration 0.
[I 2023-12-19 00:38:56,458] Trial 357 pruned. Trial was pruned at iteration 0.
[I 2023-12-19 00:38:57,770] Trial 358 finished with value: inf and parameters: {'learning_rate': 0.9707244900067064, 'aft_loss_distribution': 'normal', 'aft_loss_distribution_scale': 1.5325859419364076, 'max_depth': 4, 'booster': 'dart', 'scale_pos_weight': 1.3991505622243836, 'alpha': 4.430560243150942, 'lambda': 1.2425725987980443, 'eta': 0.9090892415386453, 'sampling_method': 'gradient_based', 'subsample': 0.8487021423918908, 'gamma': 9.27930333624419}. Best is trial 346 with value: 2.018361189186848.
[I 2023-12-19 00:38:59,251] Trial 359 finished with value: inf and parameters: {'learning_rate': 0.9998193518310718, 'aft_loss_distribution': 'normal', 'aft_loss_distribution_scale': 1.6851970761914719, 'max_depth': 3, 'booster': 'dart', 'scale_pos_weight': 1.3110366838956322, 'alpha': 3.979537921303849, 'lambda': 2.1384967232459924, 'eta': 0.9637079022891345, 'sampling_method': 'gradient_based', 'subsample': 0.7682480051223557, 'gamma': 9.070465514831906}. Best is trial 346 with value: 2.018361189186848.
[I 2023-12-19 00:38:59,390] Trial 360 pruned. Trial was pruned at iteration 0.
[I 2023-12-19 00:39:03,018] Trial 361 finished with value: 2.0226184814602073 and parameters: {'learning_rate': 0.9693834851383164, 'aft_loss_distribution': 'normal', 'aft_loss_distribution_scale': 1.6140779079655065, 'max_depth': 3, 'booster': 'dart', 'scale_pos_weight': 1.5562969212229147, 'alpha': 4.254268386118076, 'lambda': 2.462256476532137, 'eta': 0.6221996331933373, 'sampling_method': 'gradient_based', 'subsample': 0.8004893209777475, 'gamma': 8.902660683783907}. Best is trial 346 with value: 2.018361189186848.
[I 2023-12-19 00:39:03,113] Trial 362 pruned. Trial was pruned at iteration 0.
[I 2023-12-19 00:39:03,197] Trial 363 pruned. Trial was pruned at iteration 0.
[I 2023-12-19 00:39:04,805] Trial 364 finished with value: inf and parameters: {'learning_rate': 0.9695628481775472, 'aft_loss_distribution': 'normal', 'aft_loss_distribution_scale': 1.6525092184540016, 'max_depth': 3, 'booster': 'dart', 'scale_pos_weight': 1.5874458860710112, 'alpha': 1.3378032337238732, 'lambda': 2.557309610164092, 'eta': 0.9762937804138374, 'sampling_method': 'gradient_based', 'subsample': 0.8429371182745319, 'gamma': 8.929820344626599}. Best is trial 346 with value: 2.018361189186848.
[I 2023-12-19 00:39:06,184] Trial 365 finished with value: inf and parameters: {'learning_rate': 0.9833056288049943, 'aft_loss_distribution': 'normal', 'aft_loss_distribution_scale': 1.380280829590883, 'max_depth': 3, 'booster': 'dart', 'scale_pos_weight': 1.6993056018532904, 'alpha': 0.683429133119158, 'lambda': 2.3206678717463998, 'eta': 0.9612462470752589, 'sampling_method': 'gradient_based', 'subsample': 0.6860873535927914, 'gamma': 8.242698135260579}. Best is trial 346 with value: 2.018361189186848.
[I 2023-12-19 00:39:07,932] Trial 366 finished with value: inf and parameters: {'learning_rate': 0.961352760335918, 'aft_loss_distribution': 'normal', 'aft_loss_distribution_scale': 1.7101296421698045, 'max_depth': 3, 'booster': 'dart', 'scale_pos_weight': 1.5761334484010694, 'alpha': 3.886234656529928, 'lambda': 2.7284277369146634, 'eta': 0.2676060854728281, 'sampling_method': 'gradient_based', 'subsample': 0.7780678980975381, 'gamma': 8.513462587313986}. Best is trial 346 with value: 2.018361189186848.
[I 2023-12-19 00:39:09,195] Trial 367 finished with value: inf and parameters: {'learning_rate': 0.998624957770089, 'aft_loss_distribution': 'normal', 'aft_loss_distribution_scale': 1.418700130972958, 'max_depth': 3, 'booster': 'dart', 'scale_pos_weight': 1.2517183259254048, 'alpha': 4.750216173711842, 'lambda': 2.9784570676727613, 'eta': 0.9999676161063242, 'sampling_method': 'gradient_based', 'subsample': 0.969487102765851, 'gamma': 9.091231764168379}. Best is trial 346 with value: 2.018361189186848.
[I 2023-12-19 00:39:09,290] Trial 368 pruned. Trial was pruned at iteration 0.
[I 2023-12-19 00:39:09,376] Trial 369 pruned. Trial was pruned at iteration 0.
[I 2023-12-19 00:39:09,461] Trial 370 pruned. Trial was pruned at iteration 0.
[I 2023-12-19 00:39:09,547] Trial 371 pruned. Trial was pruned at iteration 0.
[I 2023-12-19 00:39:10,827] Trial 372 finished with value: inf and parameters: {'learning_rate': 0.9840877276471968, 'aft_loss_distribution': 'normal', 'aft_loss_distribution_scale': 1.4850924475400717, 'max_depth': 3, 'booster': 'dart', 'scale_pos_weight': 1.2863030213701774, 'alpha': 4.508402425627383, 'lambda': 2.741198240822373, 'eta': 0.8003610612339437, 'sampling_method': 'gradient_based', 'subsample': 0.7787479794049735, 'gamma': 8.916534521573254}. Best is trial 346 with value: 2.018361189186848.
[I 2023-12-19 00:39:12,144] Trial 373 finished with value: inf and parameters: {'learning_rate': 0.9989439692448459, 'aft_loss_distribution': 'normal', 'aft_loss_distribution_scale': 1.8120077516055708, 'max_depth': 3, 'booster': 'dart', 'scale_pos_weight': 3.510273779128756, 'alpha': 3.7426242556412674, 'lambda': 0.3307798276064169, 'eta': 0.9773297923091703, 'sampling_method': 'gradient_based', 'subsample': 0.8317612322083635, 'gamma': 9.359986591769212}. Best is trial 346 with value: 2.018361189186848.
[I 2023-12-19 00:39:12,231] Trial 374 pruned. Trial was pruned at iteration 0.
[I 2023-12-19 00:39:12,312] Trial 375 pruned. Trial was pruned at iteration 0.
[I 2023-12-19 00:39:12,395] Trial 376 pruned. Trial was pruned at iteration 0.
[I 2023-12-19 00:39:12,480] Trial 377 pruned. Trial was pruned at iteration 0.
[I 2023-12-19 00:39:12,564] Trial 378 pruned. Trial was pruned at iteration 0.
[I 2023-12-19 00:39:12,648] Trial 379 pruned. Trial was pruned at iteration 1.
[I 2023-12-19 00:39:16,169] Trial 380 finished with value: 2.0240584297301396 and parameters: {'learning_rate': 0.9652185992363934, 'aft_loss_distribution': 'normal', 'aft_loss_distribution_scale': 1.6489987907916448, 'max_depth': 3, 'booster': 'dart', 'scale_pos_weight': 1.3186203501812104, 'alpha': 4.106069889653625, 'lambda': 2.5130599610607307, 'eta': 0.925963611264454, 'sampling_method': 'gradient_based', 'subsample': 0.8178670691896552, 'gamma': 7.484275337320743}. Best is trial 346 with value: 2.018361189186848.
[I 2023-12-19 00:39:16,310] Trial 381 pruned. Trial was pruned at iteration 0.
[I 2023-12-19 00:39:16,434] Trial 382 pruned. Trial was pruned at iteration 0.
[I 2023-12-19 00:39:16,563] Trial 383 pruned. Trial was pruned at iteration 0.
[I 2023-12-19 00:39:19,571] Trial 384 finished with value: 2.029056004774234 and parameters: {'learning_rate': 0.9704281587253597, 'aft_loss_distribution': 'normal', 'aft_loss_distribution_scale': 1.7352069379525565, 'max_depth': 3, 'booster': 'dart', 'scale_pos_weight': 1.7078405361998361, 'alpha': 4.544452911938656, 'lambda': 2.4999812694735772, 'eta': 0.8833668868620927, 'sampling_method': 'gradient_based', 'subsample': 0.8334982417665527, 'gamma': 7.448274569028532}. Best is trial 346 with value: 2.018361189186848.
[I 2023-12-19 00:39:19,659] Trial 385 pruned. Trial was pruned at iteration 0.
[I 2023-12-19 00:39:19,745] Trial 386 pruned. Trial was pruned at iteration 0.
[I 2023-12-19 00:39:19,828] Trial 387 pruned. Trial was pruned at iteration 0.
[I 2023-12-19 00:39:19,923] Trial 388 pruned. Trial was pruned at iteration 0.
[I 2023-12-19 00:39:20,014] Trial 389 pruned. Trial was pruned at iteration 0.
[I 2023-12-19 00:39:20,099] Trial 390 pruned. Trial was pruned at iteration 0.
[I 2023-12-19 00:39:22,858] Trial 391 finished with value: 2.020174081701393 and parameters: {'learning_rate': 0.976327853874503, 'aft_loss_distribution': 'normal', 'aft_loss_distribution_scale': 1.5516757372429457, 'max_depth': 3, 'booster': 'dart', 'scale_pos_weight': 1.8210946360460427, 'alpha': 4.465542948053051, 'lambda': 2.061033042403282, 'eta': 0.8950149366341499, 'sampling_method': 'gradient_based', 'subsample': 0.8099766459588806, 'gamma': 7.953487527495449}. Best is trial 346 with value: 2.018361189186848.
[I 2023-12-19 00:39:22,951] Trial 392 pruned. Trial was pruned at iteration 0.
[I 2023-12-19 00:39:23,038] Trial 393 pruned. Trial was pruned at iteration 0.
[I 2023-12-19 00:39:24,776] Trial 394 finished with value: inf and parameters: {'learning_rate': 0.980448636786659, 'aft_loss_distribution': 'normal', 'aft_loss_distribution_scale': 1.3988197461990883, 'max_depth': 9, 'booster': 'dart', 'scale_pos_weight': 0.9099589284363774, 'alpha': 4.523785134901856, 'lambda': 2.4375236921181105, 'eta': 0.868583054363495, 'sampling_method': 'gradient_based', 'subsample': 0.7969655316463506, 'gamma': 7.248233756443215}. Best is trial 346 with value: 2.018361189186848.
[I 2023-12-19 00:39:24,874] Trial 395 pruned. Trial was pruned at iteration 0.
[I 2023-12-19 00:39:24,960] Trial 396 pruned. Trial was pruned at iteration 0.
[I 2023-12-19 00:39:40,032] Trial 397 finished with value: 2.0214047491299594 and parameters: {'learning_rate': 0.969855116715369, 'aft_loss_distribution': 'normal', 'aft_loss_distribution_scale': 1.5891801616677808, 'max_depth': 3, 'booster': 'dart', 'scale_pos_weight': 1.7235962169466603, 'alpha': 4.2516133102387474, 'lambda': 1.8525039622014734, 'eta': 0.9056716577752157, 'sampling_method': 'gradient_based', 'subsample': 0.8271901605627489, 'gamma': 8.279509891641617}. Best is trial 346 with value: 2.018361189186848.
[I 2023-12-19 00:39:40,122] Trial 398 pruned. Trial was pruned at iteration 0.
[I 2023-12-19 00:39:40,205] Trial 399 pruned. Trial was pruned at iteration 0.
[I 2023-12-19 00:39:40,296] Trial 400 pruned. Trial was pruned at iteration 0.
[I 2023-12-19 00:39:40,389] Trial 401 pruned. Trial was pruned at iteration 0.
[I 2023-12-19 00:39:40,478] Trial 402 pruned. Trial was pruned at iteration 0.
[I 2023-12-19 00:39:41,758] Trial 403 finished with value: inf and parameters: {'learning_rate': 0.9994445861313574, 'aft_loss_distribution': 'normal', 'aft_loss_distribution_scale': 1.3381527659229895, 'max_depth': 3, 'booster': 'dart', 'scale_pos_weight': 2.121688984860667, 'alpha': 4.138372539891263, 'lambda': 2.6750607120702123, 'eta': 0.8875937242579306, 'sampling_method': 'gradient_based', 'subsample': 0.7003530414611754, 'gamma': 7.455521744502882}. Best is trial 346 with value: 2.018361189186848.
[I 2023-12-19 00:39:43,534] Trial 404 finished with value: inf and parameters: {'learning_rate': 0.9738860868392972, 'aft_loss_distribution': 'normal', 'aft_loss_distribution_scale': 1.6641750400632642, 'max_depth': 4, 'booster': 'dart', 'scale_pos_weight': 1.8220541417365015, 'alpha': 4.575340265285735, 'lambda': 1.5747173699158514, 'eta': 0.9232742447195703, 'sampling_method': 'gradient_based', 'subsample': 0.6529592964951904, 'gamma': 8.155600106430846}. Best is trial 346 with value: 2.018361189186848.
[I 2023-12-19 00:39:43,668] Trial 405 pruned. Trial was pruned at iteration 0.
[I 2023-12-19 00:39:43,814] Trial 406 pruned. Trial was pruned at iteration 0.
[I 2023-12-19 00:39:43,940] Trial 407 pruned. Trial was pruned at iteration 0.
[I 2023-12-19 00:39:45,624] Trial 408 finished with value: inf and parameters: {'learning_rate': 0.9693895007598992, 'aft_loss_distribution': 'normal', 'aft_loss_distribution_scale': 1.7484044963345675, 'max_depth': 3, 'booster': 'dart', 'scale_pos_weight': 1.5361269382224432, 'alpha': 4.069345744839825, 'lambda': 2.494015150958576, 'eta': 0.9391166061745331, 'sampling_method': 'gradient_based', 'subsample': 0.8442367211471435, 'gamma': 7.992693353731562}. Best is trial 346 with value: 2.018361189186848.
[I 2023-12-19 00:39:48,623] Trial 409 finished with value: 2.020125830354596 and parameters: {'learning_rate': 0.9991186844024499, 'aft_loss_distribution': 'normal', 'aft_loss_distribution_scale': 1.3589295603120104, 'max_depth': 3, 'booster': 'dart', 'scale_pos_weight': 1.7407160196159128, 'alpha': 4.438623321695953, 'lambda': 1.7252227965901747, 'eta': 0.9115898559313098, 'sampling_method': 'gradient_based', 'subsample': 0.8095262485690525, 'gamma': 8.13437367179815}. Best is trial 346 with value: 2.018361189186848.
[I 2023-12-19 00:39:48,721] Trial 410 pruned. Trial was pruned at iteration 0.
[I 2023-12-19 00:39:48,807] Trial 411 pruned. Trial was pruned at iteration 0.
[I 2023-12-19 00:39:51,286] Trial 412 finished with value: inf and parameters: {'learning_rate': 0.978822541700441, 'aft_loss_distribution': 'normal', 'aft_loss_distribution_scale': 1.4017386553116113, 'max_depth': 3, 'booster': 'dart', 'scale_pos_weight': 1.8433578277594884, 'alpha': 2.0708849552524278, 'lambda': 1.2749231984149523, 'eta': 0.924110260988128, 'sampling_method': 'gradient_based', 'subsample': 0.837185624812944, 'gamma': 8.309734983358918}. Best is trial 346 with value: 2.018361189186848.
[I 2023-12-19 00:39:52,576] Trial 413 finished with value: inf and parameters: {'learning_rate': 0.9997861677694796, 'aft_loss_distribution': 'normal', 'aft_loss_distribution_scale': 1.273756059932118, 'max_depth': 3, 'booster': 'dart', 'scale_pos_weight': 1.6447123117317095, 'alpha': 4.651553420927264, 'lambda': 2.796811577684663, 'eta': 0.8881330757053726, 'sampling_method': 'gradient_based', 'subsample': 0.8106518115743199, 'gamma': 8.116402351398639}. Best is trial 346 with value: 2.018361189186848.
[I 2023-12-19 00:39:53,852] Trial 414 finished with value: inf and parameters: {'learning_rate': 0.9820500040594307, 'aft_loss_distribution': 'normal', 'aft_loss_distribution_scale': 1.5227263989624562, 'max_depth': 3, 'booster': 'dart', 'scale_pos_weight': 1.737576926810987, 'alpha': 4.408642784034418, 'lambda': 1.5121653208942814, 'eta': 0.9366937985471679, 'sampling_method': 'gradient_based', 'subsample': 0.9178705377552451, 'gamma': 8.378267501747025}. Best is trial 346 with value: 2.018361189186848.
[I 2023-12-19 00:39:53,944] Trial 415 pruned. Trial was pruned at iteration 0.
[I 2023-12-19 00:39:54,030] Trial 416 pruned. Trial was pruned at iteration 0.
[I 2023-12-19 00:39:54,139] Trial 417 pruned. Trial was pruned at iteration 0.
[I 2023-12-19 00:39:54,230] Trial 418 pruned. Trial was pruned at iteration 0.
[I 2023-12-19 00:39:54,324] Trial 419 pruned. Trial was pruned at iteration 0.
[I 2023-12-19 00:39:55,742] Trial 420 finished with value: inf and parameters: {'learning_rate': 0.9805005250902832, 'aft_loss_distribution': 'normal', 'aft_loss_distribution_scale': 1.5826239792177341, 'max_depth': 3, 'booster': 'dart', 'scale_pos_weight': 1.5409412707491978, 'alpha': 1.6882868979695065, 'lambda': 1.3789467211470374, 'eta': 0.9452476725168747, 'sampling_method': 'gradient_based', 'subsample': 0.8071014584098843, 'gamma': 8.026701057823932}. Best is trial 346 with value: 2.018361189186848.
[I 2023-12-19 00:39:55,834] Trial 421 pruned. Trial was pruned at iteration 0.
[I 2023-12-19 00:39:59,198] Trial 422 finished with value: 2.032386061059164 and parameters: {'learning_rate': 0.999744200752719, 'aft_loss_distribution': 'normal', 'aft_loss_distribution_scale': 1.774472385704412, 'max_depth': 3, 'booster': 'dart', 'scale_pos_weight': 1.739719998679788, 'alpha': 4.725855235784267, 'lambda': 2.128582517663338, 'eta': 0.9633293804439977, 'sampling_method': 'gradient_based', 'subsample': 0.8286114723962028, 'gamma': 9.046369104385782}. Best is trial 346 with value: 2.018361189186848.
[I 2023-12-19 00:39:59,365] Trial 423 pruned. Trial was pruned at iteration 0.
[I 2023-12-19 00:39:59,505] Trial 424 pruned. Trial was pruned at iteration 0.
[I 2023-12-19 00:39:59,656] Trial 425 pruned. Trial was pruned at iteration 0.
[I 2023-12-19 00:40:01,357] Trial 426 finished with value: inf and parameters: {'learning_rate': 0.9649755545174512, 'aft_loss_distribution': 'normal', 'aft_loss_distribution_scale': 1.5848221285572974, 'max_depth': 3, 'booster': 'dart', 'scale_pos_weight': 1.7220999514160333, 'alpha': 4.557717292315845, 'lambda': 2.2226796059594682, 'eta': 0.8614423746288893, 'sampling_method': 'gradient_based', 'subsample': 0.7038137468728053, 'gamma': 7.632070746306326}. Best is trial 346 with value: 2.018361189186848.
[I 2023-12-19 00:40:01,467] Trial 427 pruned. Trial was pruned at iteration 0.
[I 2023-12-19 00:40:01,554] Trial 428 pruned. Trial was pruned at iteration 0.
[I 2023-12-19 00:40:01,640] Trial 429 pruned. Trial was pruned at iteration 0.
[I 2023-12-19 00:40:01,725] Trial 430 pruned. Trial was pruned at iteration 0.
[I 2023-12-19 00:40:04,573] Trial 431 finished with value: 2.0295262679960726 and parameters: {'learning_rate': 0.9999751544340009, 'aft_loss_distribution': 'normal', 'aft_loss_distribution_scale': 1.7404833654422427, 'max_depth': 4, 'booster': 'dart', 'scale_pos_weight': 1.7031747705788212, 'alpha': 4.360852789665448, 'lambda': 1.9610122163663029, 'eta': 0.874397443481697, 'sampling_method': 'gradient_based', 'subsample': 0.8437740337018793, 'gamma': 8.001852730810082}. Best is trial 346 with value: 2.018361189186848.
[I 2023-12-19 00:40:04,665] Trial 432 pruned. Trial was pruned at iteration 0.
[I 2023-12-19 00:40:06,820] Trial 433 finished with value: inf and parameters: {'learning_rate': 0.9995572354979904, 'aft_loss_distribution': 'normal', 'aft_loss_distribution_scale': 1.6541016646125677, 'max_depth': 4, 'booster': 'dart', 'scale_pos_weight': 1.7662333235047694, 'alpha': 4.221374975368508, 'lambda': 2.285069684783692, 'eta': 0.843189383313707, 'sampling_method': 'gradient_based', 'subsample': 0.8705822859804371, 'gamma': 7.715770311381149}. Best is trial 346 with value: 2.018361189186848.
[I 2023-12-19 00:40:06,917] Trial 434 pruned. Trial was pruned at iteration 0.
[I 2023-12-19 00:40:07,006] Trial 435 pruned. Trial was pruned at iteration 0.
[I 2023-12-19 00:40:08,360] Trial 436 finished with value: inf and parameters: {'learning_rate': 0.9826106543455044, 'aft_loss_distribution': 'normal', 'aft_loss_distribution_scale': 1.4324145651561533, 'max_depth': 3, 'booster': 'dart', 'scale_pos_weight': 1.8811331228422619, 'alpha': 4.0871166014761835, 'lambda': 2.417608023461854, 'eta': 0.962080740570359, 'sampling_method': 'gradient_based', 'subsample': 0.847748753945832, 'gamma': 7.875069336926475}. Best is trial 346 with value: 2.018361189186848.
[I 2023-12-19 00:40:08,460] Trial 437 pruned. Trial was pruned at iteration 1.
[I 2023-12-19 00:40:10,110] Trial 438 finished with value: inf and parameters: {'learning_rate': 0.9996412853588726, 'aft_loss_distribution': 'normal', 'aft_loss_distribution_scale': 1.5937630149337478, 'max_depth': 5, 'booster': 'dart', 'scale_pos_weight': 1.497627697047959, 'alpha': 4.541714774221076, 'lambda': 2.1806716018002077, 'eta': 0.9049306275855431, 'sampling_method': 'gradient_based', 'subsample': 0.8046317438110907, 'gamma': 7.047957777184198}. Best is trial 346 with value: 2.018361189186848.
[I 2023-12-19 00:40:10,203] Trial 439 pruned. Trial was pruned at iteration 0.
[I 2023-12-19 00:40:10,302] Trial 440 pruned. Trial was pruned at iteration 0.
[I 2023-12-19 00:40:10,387] Trial 441 pruned. Trial was pruned at iteration 0.
[I 2023-12-19 00:40:11,882] Trial 442 finished with value: inf and parameters: {'learning_rate': 0.9822921525154596, 'aft_loss_distribution': 'normal', 'aft_loss_distribution_scale': 1.7349043323192228, 'max_depth': 3, 'booster': 'dart', 'scale_pos_weight': 0.822901708042421, 'alpha': 4.7438702063680855, 'lambda': 1.9370467319655877, 'eta': 0.9978247830570355, 'sampling_method': 'gradient_based', 'subsample': 0.8419737775688256, 'gamma': 8.626793348200998}. Best is trial 346 with value: 2.018361189186848.
[I 2023-12-19 00:40:12,031] Trial 443 pruned. Trial was pruned at iteration 0.
[I 2023-12-19 00:40:12,183] Trial 444 pruned. Trial was pruned at iteration 0.
[I 2023-12-19 00:40:12,332] Trial 445 pruned. Trial was pruned at iteration 0.
[I 2023-12-19 00:40:14,064] Trial 446 finished with value: inf and parameters: {'learning_rate': 0.9657335214898346, 'aft_loss_distribution': 'normal', 'aft_loss_distribution_scale': 1.7252179782779278, 'max_depth': 3, 'booster': 'dart', 'scale_pos_weight': 1.7511777007721765, 'alpha': 4.507459180655245, 'lambda': 2.641892827586668, 'eta': 0.6757196230529998, 'sampling_method': 'gradient_based', 'subsample': 0.8360535117876465, 'gamma': 8.863886582204993}. Best is trial 346 with value: 2.018361189186848.
[I 2023-12-19 00:40:14,222] Trial 447 pruned. Trial was pruned at iteration 0.
[I 2023-12-19 00:40:14,383] Trial 448 pruned. Trial was pruned at iteration 1.
[I 2023-12-19 00:40:14,512] Trial 449 pruned. Trial was pruned at iteration 0.
[I 2023-12-19 00:40:14,635] Trial 450 pruned. Trial was pruned at iteration 0.
[I 2023-12-19 00:40:14,756] Trial 451 pruned. Trial was pruned at iteration 0.
[I 2023-12-19 00:40:14,891] Trial 452 pruned. Trial was pruned at iteration 0.
