[I 2023-12-19 01:05:35,799] Trial 315 finished with value: inf and parameters: {'learning_rate': 0.5863267000571392, 'aft_loss_distribution': 'logistic', 'aft_loss_distribution_scale': 1.639785563541335, 'max_depth': 9, 'booster': 'dart', 'scale_pos_weight': 2.5044349462272693, 'alpha': 7.047603303869942, 'lambda': 9.990745142140838, 'eta': 0.9324522483059917, 'sampling_method': 'uniform', 'subsample': 0.3136529019858703, 'gamma': 5.617449135225008}. Best is trial 268 with value: 2.092352351623428.
[I 2023-12-19 01:05:35,887] Trial 316 pruned. Trial was pruned at iteration 0.
[I 2023-12-19 01:05:35,996] Trial 317 pruned. Trial was pruned at iteration 0.
[I 2023-12-19 01:05:37,925] Trial 318 finished with value: inf and parameters: {'learning_rate': 0.5457961900025313, 'aft_loss_distribution': 'logistic', 'aft_loss_distribution_scale': 1.4399461982906339, 'max_depth': 9, 'booster': 'dart', 'scale_pos_weight': 2.368789311660609, 'alpha': 6.856533658120318, 'lambda': 9.723220817843542, 'eta': 0.9612628740272215, 'sampling_method': 'uniform', 'subsample': 0.36799216079591435, 'gamma': 5.77018437036645}. Best is trial 268 with value: 2.092352351623428.
[I 2023-12-19 01:05:38,016] Trial 319 pruned. Trial was pruned at iteration 0.
[I 2023-12-19 01:05:38,120] Trial 320 pruned. Trial was pruned at iteration 0.
[I 2023-12-19 01:05:44,508] Trial 321 finished with value: 2.1154803025133937 and parameters: {'learning_rate': 0.5099073200001893, 'aft_loss_distribution': 'logistic', 'aft_loss_distribution_scale': 1.6608906428503827, 'max_depth': 9, 'booster': 'dart', 'scale_pos_weight': 2.199742859114046, 'alpha': 7.216818703351088, 'lambda': 9.266124402986259, 'eta': 0.9783288481325302, 'sampling_method': 'uniform', 'subsample': 0.36650579087735324, 'gamma': 5.804028934710298}. Best is trial 268 with value: 2.092352351623428.
[I 2023-12-19 01:05:52,785] Trial 322 finished with value: 2.097880641042439 and parameters: {'learning_rate': 0.4798272071570632, 'aft_loss_distribution': 'logistic', 'aft_loss_distribution_scale': 1.5882973078576554, 'max_depth': 9, 'booster': 'dart', 'scale_pos_weight': 2.1887339458636585, 'alpha': 6.453079495179364, 'lambda': 9.794497027966374, 'eta': 0.979528966361871, 'sampling_method': 'uniform', 'subsample': 0.3661608942594099, 'gamma': 6.447751122746292}. Best is trial 268 with value: 2.092352351623428.
[I 2023-12-19 01:06:00,595] Trial 323 finished with value: 2.0855632580050734 and parameters: {'learning_rate': 0.47973228416064145, 'aft_loss_distribution': 'logistic', 'aft_loss_distribution_scale': 1.4288672970496998, 'max_depth': 9, 'booster': 'dart', 'scale_pos_weight': 2.1952621960640064, 'alpha': 6.892886453106135, 'lambda': 9.983121354746324, 'eta': 0.9748672643481282, 'sampling_method': 'uniform', 'subsample': 0.3586510433850597, 'gamma': 6.314138067020744}. Best is trial 323 with value: 2.0855632580050734.
[I 2023-12-19 01:06:00,752] Trial 324 pruned. Trial was pruned at iteration 0.
[I 2023-12-19 01:06:03,695] Trial 325 finished with value: inf and parameters: {'learning_rate': 0.4851967434822743, 'aft_loss_distribution': 'logistic', 'aft_loss_distribution_scale': 1.4022114307932079, 'max_depth': 9, 'booster': 'dart', 'scale_pos_weight': 2.2045531948177493, 'alpha': 6.680307249356792, 'lambda': 9.80689856799202, 'eta': 0.9170312281734759, 'sampling_method': 'uniform', 'subsample': 0.3698497246305117, 'gamma': 6.376052906933108}. Best is trial 323 with value: 2.0855632580050734.
[I 2023-12-19 01:06:18,968] Trial 326 finished with value: 2.091737544031594 and parameters: {'learning_rate': 0.4969230917772247, 'aft_loss_distribution': 'logistic', 'aft_loss_distribution_scale': 1.5333178374686707, 'max_depth': 9, 'booster': 'dart', 'scale_pos_weight': 2.1225467634938475, 'alpha': 6.853665112435509, 'lambda': 9.745412650910483, 'eta': 0.9706484115981704, 'sampling_method': 'uniform', 'subsample': 0.31647336109481006, 'gamma': 6.175206506542079}. Best is trial 323 with value: 2.0855632580050734.
[I 2023-12-19 01:06:19,065] Trial 327 pruned. Trial was pruned at iteration 0.
[I 2023-12-19 01:06:19,174] Trial 328 pruned. Trial was pruned at iteration 0.
[I 2023-12-19 01:06:30,409] Trial 329 finished with value: 2.0819512464725296 and parameters: {'learning_rate': 0.48372180635248085, 'aft_loss_distribution': 'logistic', 'aft_loss_distribution_scale': 1.4870771522790494, 'max_depth': 9, 'booster': 'dart', 'scale_pos_weight': 2.0724245724673596, 'alpha': 6.373823421725905, 'lambda': 9.664378870007925, 'eta': 0.9507993379703648, 'sampling_method': 'uniform', 'subsample': 0.3234022098555723, 'gamma': 6.488876479453499}. Best is trial 329 with value: 2.0819512464725296.
[I 2023-12-19 01:06:34,938] Trial 330 finished with value: 2.0846056395783217 and parameters: {'learning_rate': 0.5038998545586753, 'aft_loss_distribution': 'logistic', 'aft_loss_distribution_scale': 1.4972539083263108, 'max_depth': 9, 'booster': 'dart', 'scale_pos_weight': 2.049259035039253, 'alpha': 6.380510197268065, 'lambda': 9.773446129731195, 'eta': 0.9386332705959446, 'sampling_method': 'uniform', 'subsample': 0.28534907220429556, 'gamma': 6.615109140379428}. Best is trial 329 with value: 2.0819512464725296.
[I 2023-12-19 01:06:38,380] Trial 331 finished with value: 2.081620467847639 and parameters: {'learning_rate': 0.5051416597985567, 'aft_loss_distribution': 'logistic', 'aft_loss_distribution_scale': 1.4401395822662373, 'max_depth': 9, 'booster': 'dart', 'scale_pos_weight': 2.0730523564646135, 'alpha': 6.072178595647746, 'lambda': 9.994520689760492, 'eta': 0.9789519825792458, 'sampling_method': 'uniform', 'subsample': 0.27184259386922693, 'gamma': 6.464780815537191}. Best is trial 331 with value: 2.081620467847639.
[I 2023-12-19 01:06:38,504] Trial 332 pruned. Trial was pruned at iteration 0.
[I 2023-12-19 01:06:38,597] Trial 333 pruned. Trial was pruned at iteration 0.
[I 2023-12-19 01:06:40,856] Trial 334 finished with value: inf and parameters: {'learning_rate': 0.47285672352944974, 'aft_loss_distribution': 'logistic', 'aft_loss_distribution_scale': 1.4503970459969167, 'max_depth': 9, 'booster': 'dart', 'scale_pos_weight': 2.0547923664135928, 'alpha': 6.675339365407895, 'lambda': 9.793260625386878, 'eta': 0.9811452723202647, 'sampling_method': 'uniform', 'subsample': 0.2746372834058421, 'gamma': 6.524077525821989}. Best is trial 331 with value: 2.081620467847639.
[I 2023-12-19 01:06:40,945] Trial 335 pruned. Trial was pruned at iteration 0.
[I 2023-12-19 01:06:41,059] Trial 336 pruned. Trial was pruned at iteration 0.
[I 2023-12-19 01:06:43,226] Trial 337 finished with value: inf and parameters: {'learning_rate': 0.5202645614796291, 'aft_loss_distribution': 'logistic', 'aft_loss_distribution_scale': 1.4996526828271193, 'max_depth': 9, 'booster': 'dart', 'scale_pos_weight': 2.583678691424941, 'alpha': 6.215175272393495, 'lambda': 9.605965285958694, 'eta': 0.9783167396668349, 'sampling_method': 'uniform', 'subsample': 0.2754627172458473, 'gamma': 6.2146294370224355}. Best is trial 331 with value: 2.081620467847639.
[I 2023-12-19 01:06:45,697] Trial 338 finished with value: inf and parameters: {'learning_rate': 0.466636789951823, 'aft_loss_distribution': 'logistic', 'aft_loss_distribution_scale': 1.2805715851533312, 'max_depth': 9, 'booster': 'dart', 'scale_pos_weight': 2.2991421897766195, 'alpha': 5.950945352993653, 'lambda': 9.74075642226511, 'eta': 0.9276907135696003, 'sampling_method': 'uniform', 'subsample': 0.2890648191000604, 'gamma': 6.444047529417076}. Best is trial 331 with value: 2.081620467847639.
[I 2023-12-19 01:06:47,833] Trial 339 finished with value: inf and parameters: {'learning_rate': 0.5086552294892962, 'aft_loss_distribution': 'logistic', 'aft_loss_distribution_scale': 1.4617361507203575, 'max_depth': 9, 'booster': 'dart', 'scale_pos_weight': 2.1191372599441367, 'alpha': 6.745346381796417, 'lambda': 9.806810150861212, 'eta': 0.9485865163562687, 'sampling_method': 'uniform', 'subsample': 0.30971062056817183, 'gamma': 6.059871414916902}. Best is trial 331 with value: 2.081620467847639.
[I 2023-12-19 01:06:47,927] Trial 340 pruned. Trial was pruned at iteration 0.
[I 2023-12-19 01:06:48,022] Trial 341 pruned. Trial was pruned at iteration 0.
[I 2023-12-19 01:06:50,040] Trial 342 finished with value: inf and parameters: {'learning_rate': 0.5284886858156391, 'aft_loss_distribution': 'logistic', 'aft_loss_distribution_scale': 1.4773574999180774, 'max_depth': 9, 'booster': 'dart', 'scale_pos_weight': 2.2536039728272828, 'alpha': 6.098567955006594, 'lambda': 9.807372935833092, 'eta': 0.9196629271968326, 'sampling_method': 'uniform', 'subsample': 0.4573918609285919, 'gamma': 6.194910885521347}. Best is trial 331 with value: 2.081620467847639.
[I 2023-12-19 01:06:50,144] Trial 343 pruned. Trial was pruned at iteration 0.
[I 2023-12-19 01:07:02,421] Trial 344 finished with value: 2.0790636529136957 and parameters: {'learning_rate': 0.4567778389428452, 'aft_loss_distribution': 'logistic', 'aft_loss_distribution_scale': 1.4919502204303667, 'max_depth': 9, 'booster': 'dart', 'scale_pos_weight': 2.3355396117379503, 'alpha': 6.760790733842031, 'lambda': 9.993268006317464, 'eta': 0.9820914684517094, 'sampling_method': 'uniform', 'subsample': 0.32713837374492666, 'gamma': 6.2634043163582795}. Best is trial 344 with value: 2.0790636529136957.
[I 2023-12-19 01:07:05,957] Trial 345 finished with value: 2.067918514439947 and parameters: {'learning_rate': 0.45980672204162687, 'aft_loss_distribution': 'logistic', 'aft_loss_distribution_scale': 1.378381394036739, 'max_depth': 9, 'booster': 'dart', 'scale_pos_weight': 2.360217735434554, 'alpha': 6.770790207094013, 'lambda': 9.946104134452316, 'eta': 0.981544603557332, 'sampling_method': 'uniform', 'subsample': 0.26280112358229785, 'gamma': 6.35443671986556}. Best is trial 345 with value: 2.067918514439947.
[I 2023-12-19 01:07:08,158] Trial 346 finished with value: inf and parameters: {'learning_rate': 0.45121106665350874, 'aft_loss_distribution': 'logistic', 'aft_loss_distribution_scale': 1.286659512715279, 'max_depth': 9, 'booster': 'dart', 'scale_pos_weight': 2.4009755406634428, 'alpha': 6.483624919920218, 'lambda': 9.951047684815695, 'eta': 0.9790839650620806, 'sampling_method': 'uniform', 'subsample': 0.3122909668100428, 'gamma': 6.359464334799908}. Best is trial 345 with value: 2.067918514439947.
[I 2023-12-19 01:07:08,282] Trial 347 pruned. Trial was pruned at iteration 0.
[I 2023-12-19 01:07:10,471] Trial 348 finished with value: inf and parameters: {'learning_rate': 0.473168912421228, 'aft_loss_distribution': 'logistic', 'aft_loss_distribution_scale': 1.4244152346168724, 'max_depth': 9, 'booster': 'dart', 'scale_pos_weight': 2.3358400851057177, 'alpha': 6.715199274804734, 'lambda': 9.989204388200683, 'eta': 0.9415794126795655, 'sampling_method': 'uniform', 'subsample': 0.29403037051546677, 'gamma': 6.438400618879041}. Best is trial 345 with value: 2.067918514439947.
[I 2023-12-19 01:07:10,572] Trial 349 pruned. Trial was pruned at iteration 0.
[I 2023-12-19 01:07:14,982] Trial 350 finished with value: 2.07400239403139 and parameters: {'learning_rate': 0.4525876047620303, 'aft_loss_distribution': 'logistic', 'aft_loss_distribution_scale': 1.433730898927419, 'max_depth': 9, 'booster': 'dart', 'scale_pos_weight': 2.4152111509487355, 'alpha': 6.8243725575611025, 'lambda': 9.648564529814902, 'eta': 0.8771605376200838, 'sampling_method': 'uniform', 'subsample': 0.26149950473995154, 'gamma': 6.618371896615945}. Best is trial 345 with value: 2.067918514439947.
[I 2023-12-19 01:07:18,508] Trial 351 finished with value: 2.0627460773537005 and parameters: {'learning_rate': 0.4331811100343271, 'aft_loss_distribution': 'logistic', 'aft_loss_distribution_scale': 1.3468170881246062, 'max_depth': 9, 'booster': 'dart', 'scale_pos_weight': 2.5098224576462353, 'alpha': 6.59540810153195, 'lambda': 9.640399933223053, 'eta': 0.8740127722278567, 'sampling_method': 'uniform', 'subsample': 0.24902224645613913, 'gamma': 6.97585908778532}. Best is trial 351 with value: 2.0627460773537005.
[I 2023-12-19 01:07:18,626] Trial 352 pruned. Trial was pruned at iteration 0.
[I 2023-12-19 01:07:22,722] Trial 353 finished with value: 2.060149118866133 and parameters: {'learning_rate': 0.4495184365299049, 'aft_loss_distribution': 'logistic', 'aft_loss_distribution_scale': 1.2904834944351775, 'max_depth': 9, 'booster': 'dart', 'scale_pos_weight': 2.406396825780482, 'alpha': 6.437827343223911, 'lambda': 9.66159990553037, 'eta': 0.9822821286224517, 'sampling_method': 'uniform', 'subsample': 0.2279200103009948, 'gamma': 6.69206255571228}. Best is trial 353 with value: 2.060149118866133.
[I 2023-12-19 01:07:26,535] Trial 354 finished with value: 2.0577248519174205 and parameters: {'learning_rate': 0.4502493089515111, 'aft_loss_distribution': 'logistic', 'aft_loss_distribution_scale': 1.3172542479073677, 'max_depth': 9, 'booster': 'dart', 'scale_pos_weight': 2.5109744946798878, 'alpha': 6.453229693784204, 'lambda': 9.635199525215096, 'eta': 0.8663709356502911, 'sampling_method': 'uniform', 'subsample': 0.23572550644965182, 'gamma': 6.845413153173582}. Best is trial 354 with value: 2.0577248519174205.
[I 2023-12-19 01:07:26,697] Trial 355 pruned. Trial was pruned at iteration 0.
[I 2023-12-19 01:07:26,840] Trial 356 pruned. Trial was pruned at iteration 0.
[I 2023-12-19 01:07:30,724] Trial 357 finished with value: 2.06894059332648 and parameters: {'learning_rate': 0.4606598142184226, 'aft_loss_distribution': 'logistic', 'aft_loss_distribution_scale': 1.380509556830054, 'max_depth': 8, 'booster': 'dart', 'scale_pos_weight': 2.5755779301685893, 'alpha': 6.136579924019376, 'lambda': 9.986589705090374, 'eta': 0.8697534665255694, 'sampling_method': 'uniform', 'subsample': 0.21649057809487238, 'gamma': 6.615495446224814}. Best is trial 354 with value: 2.0577248519174205.
[I 2023-12-19 01:07:30,847] Trial 358 pruned. Trial was pruned at iteration 0.
[I 2023-12-19 01:07:33,294] Trial 359 finished with value: inf and parameters: {'learning_rate': 0.4203464870071201, 'aft_loss_distribution': 'logistic', 'aft_loss_distribution_scale': 1.2957641924488477, 'max_depth': 8, 'booster': 'dart', 'scale_pos_weight': 2.7333130639012775, 'alpha': 5.588627556164238, 'lambda': 9.972870838718395, 'eta': 0.8703513741960434, 'sampling_method': 'uniform', 'subsample': 0.266208463123321, 'gamma': 6.7970267353806}. Best is trial 354 with value: 2.0577248519174205.
[I 2023-12-19 01:07:33,395] Trial 360 pruned. Trial was pruned at iteration 0.
[I 2023-12-19 01:07:35,670] Trial 361 finished with value: inf and parameters: {'learning_rate': 0.4626175336285884, 'aft_loss_distribution': 'logistic', 'aft_loss_distribution_scale': 1.3867504128461778, 'max_depth': 9, 'booster': 'dart', 'scale_pos_weight': 2.638051225072415, 'alpha': 6.462147558263466, 'lambda': 9.987751027013559, 'eta': 0.8834194646424584, 'sampling_method': 'uniform', 'subsample': 0.24576416280326607, 'gamma': 6.528579703340349}. Best is trial 354 with value: 2.0577248519174205.
[I 2023-12-19 01:07:35,777] Trial 362 pruned. Trial was pruned at iteration 0.
[I 2023-12-19 01:07:38,795] Trial 363 finished with value: 2.0653668845487894 and parameters: {'learning_rate': 0.4738721576169503, 'aft_loss_distribution': 'logistic', 'aft_loss_distribution_scale': 1.3877644792259596, 'max_depth': 9, 'booster': 'dart', 'scale_pos_weight': 2.4722426561049677, 'alpha': 6.210610853323153, 'lambda': 9.784470664145212, 'eta': 0.8372520309078522, 'sampling_method': 'uniform', 'subsample': 0.21571985904275923, 'gamma': 6.885134938331775}. Best is trial 354 with value: 2.0577248519174205.
[I 2023-12-19 01:07:38,900] Trial 364 pruned. Trial was pruned at iteration 0.
[I 2023-12-19 01:07:42,625] Trial 365 finished with value: 2.087384068286686 and parameters: {'learning_rate': 0.4058316657043863, 'aft_loss_distribution': 'logistic', 'aft_loss_distribution_scale': 1.2459887146495692, 'max_depth': 9, 'booster': 'dart', 'scale_pos_weight': 2.515014733237682, 'alpha': 6.3125999301278375, 'lambda': 9.745818001823846, 'eta': 0.8329854192808953, 'sampling_method': 'uniform', 'subsample': 0.2157750481967488, 'gamma': 6.768740201896714}. Best is trial 354 with value: 2.0577248519174205.
[I 2023-12-19 01:07:42,816] Trial 366 pruned. Trial was pruned at iteration 0.
[I 2023-12-19 01:07:46,515] Trial 367 finished with value: 2.065103386633041 and parameters: {'learning_rate': 0.4118985848833559, 'aft_loss_distribution': 'logistic', 'aft_loss_distribution_scale': 1.2894280115351637, 'max_depth': 9, 'booster': 'dart', 'scale_pos_weight': 2.572860469459334, 'alpha': 6.213679086834755, 'lambda': 9.768290458393599, 'eta': 0.8451564397781669, 'sampling_method': 'uniform', 'subsample': 0.1964627362352077, 'gamma': 7.29319789799748}. Best is trial 354 with value: 2.0577248519174205.
[I 2023-12-19 01:07:46,618] Trial 368 pruned. Trial was pruned at iteration 0.
[I 2023-12-19 01:07:50,517] Trial 369 finished with value: 2.0674631175662332 and parameters: {'learning_rate': 0.4116101769567869, 'aft_loss_distribution': 'logistic', 'aft_loss_distribution_scale': 1.285697267947263, 'max_depth': 9, 'booster': 'dart', 'scale_pos_weight': 2.6572088123369904, 'alpha': 6.2400608928782315, 'lambda': 9.790420209435062, 'eta': 0.8377515404003145, 'sampling_method': 'uniform', 'subsample': 0.20488528334319536, 'gamma': 7.149924393510228}. Best is trial 354 with value: 2.0577248519174205.
[I 2023-12-19 01:07:50,649] Trial 370 pruned. Trial was pruned at iteration 0.
[I 2023-12-19 01:07:50,748] Trial 371 pruned. Trial was pruned at iteration 0.
[I 2023-12-19 01:07:50,862] Trial 372 pruned. Trial was pruned at iteration 0.
[I 2023-12-19 01:07:54,532] Trial 373 finished with value: 2.054088830435347 and parameters: {'learning_rate': 0.37334913251937557, 'aft_loss_distribution': 'logistic', 'aft_loss_distribution_scale': 1.3267215801736185, 'max_depth': 9, 'booster': 'dart', 'scale_pos_weight': 2.6349008576678106, 'alpha': 6.552074388837484, 'lambda': 9.63201563643752, 'eta': 0.8554598451324045, 'sampling_method': 'uniform', 'subsample': 0.2199464583737601, 'gamma': 7.322153933005751}. Best is trial 373 with value: 2.054088830435347.
[I 2023-12-19 01:07:54,734] Trial 374 pruned. Trial was pruned at iteration 0.
[I 2023-12-19 01:07:57,707] Trial 375 finished with value: inf and parameters: {'learning_rate': 0.4018282049699606, 'aft_loss_distribution': 'logistic', 'aft_loss_distribution_scale': 1.2616970995999257, 'max_depth': 9, 'booster': 'dart', 'scale_pos_weight': 2.715219265213711, 'alpha': 6.308132466462348, 'lambda': 9.65191012460409, 'eta': 0.8576073013857413, 'sampling_method': 'uniform', 'subsample': 0.22156512893146008, 'gamma': 7.541873875406759}. Best is trial 373 with value: 2.054088830435347.
[I 2023-12-19 01:08:01,643] Trial 376 finished with value: 2.074820192544854 and parameters: {'learning_rate': 0.43943886409136934, 'aft_loss_distribution': 'logistic', 'aft_loss_distribution_scale': 1.345591164536888, 'max_depth': 9, 'booster': 'dart', 'scale_pos_weight': 2.8031023057828905, 'alpha': 6.612962029166718, 'lambda': 9.808204803463237, 'eta': 0.8092182312112821, 'sampling_method': 'uniform', 'subsample': 0.20344945642597545, 'gamma': 7.242841840149156}. Best is trial 373 with value: 2.054088830435347.
[I 2023-12-19 01:08:01,753] Trial 377 pruned. Trial was pruned at iteration 0.
[I 2023-12-19 01:08:01,845] Trial 378 pruned. Trial was pruned at iteration 0.
[I 2023-12-19 01:08:01,965] Trial 379 pruned. Trial was pruned at iteration 0.
[I 2023-12-19 01:08:05,608] Trial 380 finished with value: 2.0596114289654524 and parameters: {'learning_rate': 0.42877897483379507, 'aft_loss_distribution': 'logistic', 'aft_loss_distribution_scale': 1.344569372921525, 'max_depth': 9, 'booster': 'dart', 'scale_pos_weight': 2.5134464605764477, 'alpha': 6.575932214843559, 'lambda': 9.807238839566194, 'eta': 0.8437142004710639, 'sampling_method': 'uniform', 'subsample': 0.25030170257669265, 'gamma': 6.78376555715814}. Best is trial 373 with value: 2.054088830435347.
[I 2023-12-19 01:08:05,709] Trial 381 pruned. Trial was pruned at iteration 0.
[I 2023-12-19 01:08:08,552] Trial 382 finished with value: 2.0778007234276545 and parameters: {'learning_rate': 0.4097732152754532, 'aft_loss_distribution': 'logistic', 'aft_loss_distribution_scale': 1.3486434115198063, 'max_depth': 8, 'booster': 'dart', 'scale_pos_weight': 2.5107885081005334, 'alpha': 5.883539430966416, 'lambda': 9.780996440998356, 'eta': 0.8378488995540723, 'sampling_method': 'uniform', 'subsample': 0.19127519046682917, 'gamma': 6.841579844579774}. Best is trial 373 with value: 2.054088830435347.
[I 2023-12-19 01:08:11,073] Trial 383 finished with value: inf and parameters: {'learning_rate': 0.40209042717981064, 'aft_loss_distribution': 'logistic', 'aft_loss_distribution_scale': 1.1267275987156795, 'max_depth': 8, 'booster': 'dart', 'scale_pos_weight': 2.894650965693878, 'alpha': 5.904515808312798, 'lambda': 9.821858783352017, 'eta': 0.8262738016073606, 'sampling_method': 'uniform', 'subsample': 0.14727141578164704, 'gamma': 6.8508546147067895}. Best is trial 373 with value: 2.054088830435347.
[I 2023-12-19 01:08:16,720] Trial 384 finished with value: 2.077472763467688 and parameters: {'learning_rate': 0.42328963685032894, 'aft_loss_distribution': 'logistic', 'aft_loss_distribution_scale': 1.3514242855176553, 'max_depth': 8, 'booster': 'dart', 'scale_pos_weight': 2.498020500580375, 'alpha': 6.207562969239539, 'lambda': 9.638192100178559, 'eta': 0.8186395747152988, 'sampling_method': 'uniform', 'subsample': 0.1832823768802894, 'gamma': 6.709387695205053}. Best is trial 373 with value: 2.054088830435347.
[I 2023-12-19 01:08:16,900] Trial 385 pruned. Trial was pruned at iteration 0.
