[I 2023-12-18 22:50:34,861] Trial 346 pruned. Trial was pruned at iteration 0.
[I 2023-12-18 22:50:34,943] Trial 347 pruned. Trial was pruned at iteration 0.
[I 2023-12-18 22:50:35,023] Trial 348 pruned. Trial was pruned at iteration 0.
[I 2023-12-18 22:50:35,109] Trial 349 pruned. Trial was pruned at iteration 0.
[I 2023-12-18 22:50:35,188] Trial 350 pruned. Trial was pruned at iteration 0.
[I 2023-12-18 22:50:35,444] Trial 351 finished with value: inf and parameters: {'learning_rate': 0.8372548918941687, 'aft_loss_distribution': 'normal', 'aft_loss_distribution_scale': 1.1960689104729307, 'max_depth': 9, 'booster': 'gbtree', 'scale_pos_weight': 0.5900654878760969, 'alpha': 2.668084377346924, 'lambda': 8.924630803255127, 'eta': 0.1792782430992572, 'sampling_method': 'uniform', 'subsample': 0.03056397184979642, 'gamma': 1.0324827264965588}. Best is trial 1 with value: 4.243578196768486.
[I 2023-12-18 22:50:35,548] Trial 352 pruned. Trial was pruned at iteration 0.
[I 2023-12-18 22:50:35,633] Trial 353 pruned. Trial was pruned at iteration 0.
[I 2023-12-18 22:50:35,712] Trial 354 pruned. Trial was pruned at iteration 0.
[I 2023-12-18 22:50:35,793] Trial 355 pruned. Trial was pruned at iteration 0.
[I 2023-12-18 22:50:35,873] Trial 356 pruned. Trial was pruned at iteration 0.
[I 2023-12-18 22:50:35,957] Trial 357 pruned. Trial was pruned at iteration 0.
[I 2023-12-18 22:50:36,039] Trial 358 pruned. Trial was pruned at iteration 0.
[I 2023-12-18 22:50:36,226] Trial 359 pruned. Trial was pruned at iteration 53.
[I 2023-12-18 22:50:36,314] Trial 360 pruned. Trial was pruned at iteration 0.
[I 2023-12-18 22:50:36,398] Trial 361 pruned. Trial was pruned at iteration 0.
[I 2023-12-18 22:50:36,489] Trial 362 pruned. Trial was pruned at iteration 0.
[I 2023-12-18 22:50:36,579] Trial 363 pruned. Trial was pruned at iteration 0.
[I 2023-12-18 22:50:36,659] Trial 364 pruned. Trial was pruned at iteration 0.
[I 2023-12-18 22:50:36,742] Trial 365 pruned. Trial was pruned at iteration 0.
[I 2023-12-18 22:50:36,830] Trial 366 pruned. Trial was pruned at iteration 0.
[I 2023-12-18 22:50:36,916] Trial 367 pruned. Trial was pruned at iteration 0.
[I 2023-12-18 22:50:36,998] Trial 368 pruned. Trial was pruned at iteration 0.
[I 2023-12-18 22:50:37,079] Trial 369 pruned. Trial was pruned at iteration 0.
[I 2023-12-18 22:50:37,161] Trial 370 pruned. Trial was pruned at iteration 0.
[I 2023-12-18 22:50:37,243] Trial 371 pruned. Trial was pruned at iteration 0.
[I 2023-12-18 22:50:37,341] Trial 372 pruned. Trial was pruned at iteration 0.
[I 2023-12-18 22:50:37,423] Trial 373 pruned. Trial was pruned at iteration 0.
[I 2023-12-18 22:50:37,510] Trial 374 pruned. Trial was pruned at iteration 0.
[I 2023-12-18 22:50:37,607] Trial 375 pruned. Trial was pruned at iteration 0.
[I 2023-12-18 22:50:37,687] Trial 376 pruned. Trial was pruned at iteration 0.
[I 2023-12-18 22:50:37,769] Trial 377 pruned. Trial was pruned at iteration 0.
[I 2023-12-18 22:50:37,847] Trial 378 pruned. Trial was pruned at iteration 0.
[I 2023-12-18 22:50:37,939] Trial 379 pruned. Trial was pruned at iteration 0.
[I 2023-12-18 22:50:38,023] Trial 380 pruned. Trial was pruned at iteration 0.
[I 2023-12-18 22:50:38,143] Trial 381 pruned. Trial was pruned at iteration 0.
[I 2023-12-18 22:50:38,281] Trial 382 pruned. Trial was pruned at iteration 0.
[I 2023-12-18 22:50:38,410] Trial 383 pruned. Trial was pruned at iteration 0.
[I 2023-12-18 22:50:38,551] Trial 384 pruned. Trial was pruned at iteration 0.
[I 2023-12-18 22:50:38,682] Trial 385 pruned. Trial was pruned at iteration 0.
[I 2023-12-18 22:50:38,824] Trial 386 pruned. Trial was pruned at iteration 0.
[I 2023-12-18 22:50:38,958] Trial 387 pruned. Trial was pruned at iteration 0.
[I 2023-12-18 22:50:39,097] Trial 388 pruned. Trial was pruned at iteration 0.
[I 2023-12-18 22:50:39,225] Trial 389 pruned. Trial was pruned at iteration 0.
[I 2023-12-18 22:50:39,358] Trial 390 pruned. Trial was pruned at iteration 0.
[I 2023-12-18 22:50:39,488] Trial 391 pruned. Trial was pruned at iteration 0.
[I 2023-12-18 22:50:39,636] Trial 392 pruned. Trial was pruned at iteration 0.
[I 2023-12-18 22:50:39,769] Trial 393 pruned. Trial was pruned at iteration 0.
[I 2023-12-18 22:50:39,907] Trial 394 pruned. Trial was pruned at iteration 0.
[I 2023-12-18 22:50:40,054] Trial 395 pruned. Trial was pruned at iteration 0.
[I 2023-12-18 22:50:40,192] Trial 396 pruned. Trial was pruned at iteration 0.
[I 2023-12-18 22:50:40,325] Trial 397 pruned. Trial was pruned at iteration 0.
[I 2023-12-18 22:50:40,469] Trial 398 pruned. Trial was pruned at iteration 0.
[I 2023-12-18 22:50:40,613] Trial 399 pruned. Trial was pruned at iteration 0.
[I 2023-12-18 22:50:40,753] Trial 400 pruned. Trial was pruned at iteration 0.
[I 2023-12-18 22:50:40,883] Trial 401 pruned. Trial was pruned at iteration 0.
[I 2023-12-18 22:50:41,016] Trial 402 pruned. Trial was pruned at iteration 0.
[I 2023-12-18 22:50:41,153] Trial 403 pruned. Trial was pruned at iteration 0.
[I 2023-12-18 22:50:41,283] Trial 404 pruned. Trial was pruned at iteration 0.
[I 2023-12-18 22:50:41,425] Trial 405 pruned. Trial was pruned at iteration 0.
[I 2023-12-18 22:50:41,558] Trial 406 pruned. Trial was pruned at iteration 0.
[I 2023-12-18 22:50:41,687] Trial 407 pruned. Trial was pruned at iteration 0.
[I 2023-12-18 22:50:41,822] Trial 408 pruned. Trial was pruned at iteration 0.
[I 2023-12-18 22:50:41,958] Trial 409 pruned. Trial was pruned at iteration 0.
[I 2023-12-18 22:50:42,105] Trial 410 pruned. Trial was pruned at iteration 0.
[I 2023-12-18 22:50:42,246] Trial 411 pruned. Trial was pruned at iteration 0.
[I 2023-12-18 22:50:42,385] Trial 412 pruned. Trial was pruned at iteration 0.
[I 2023-12-18 22:50:42,525] Trial 413 pruned. Trial was pruned at iteration 0.
[I 2023-12-18 22:50:42,664] Trial 414 pruned. Trial was pruned at iteration 0.
[I 2023-12-18 22:50:42,809] Trial 415 pruned. Trial was pruned at iteration 0.
[I 2023-12-18 22:50:42,951] Trial 416 pruned. Trial was pruned at iteration 0.
[I 2023-12-18 22:50:43,087] Trial 417 pruned. Trial was pruned at iteration 0.
[I 2023-12-18 22:50:43,215] Trial 418 pruned. Trial was pruned at iteration 0.
[I 2023-12-18 22:50:43,303] Trial 419 pruned. Trial was pruned at iteration 0.
[I 2023-12-18 22:50:43,386] Trial 420 pruned. Trial was pruned at iteration 0.
[I 2023-12-18 22:50:43,623] Trial 421 finished with value: inf and parameters: {'learning_rate': 0.3642127651017514, 'aft_loss_distribution': 'logistic', 'aft_loss_distribution_scale': 0.9788628595252875, 'max_depth': 6, 'booster': 'gbtree', 'scale_pos_weight': 1.8665552730011772, 'alpha': 2.732632601960432, 'lambda': 7.601564510597973, 'eta': 0.05139419768510328, 'sampling_method': 'uniform', 'subsample': 0.04929593389682183, 'gamma': 5.6532505831753515}. Best is trial 1 with value: 4.243578196768486.
[I 2023-12-18 22:50:43,713] Trial 422 pruned. Trial was pruned at iteration 0.
[I 2023-12-18 22:50:43,798] Trial 423 pruned. Trial was pruned at iteration 0.
[I 2023-12-18 22:50:43,895] Trial 424 pruned. Trial was pruned at iteration 0.
[I 2023-12-18 22:50:43,982] Trial 425 pruned. Trial was pruned at iteration 0.
[I 2023-12-18 22:50:44,073] Trial 426 pruned. Trial was pruned at iteration 0.
[I 2023-12-18 22:50:44,168] Trial 427 pruned. Trial was pruned at iteration 0.
[I 2023-12-18 22:50:44,254] Trial 428 pruned. Trial was pruned at iteration 0.
[I 2023-12-18 22:50:44,339] Trial 429 pruned. Trial was pruned at iteration 0.
[I 2023-12-18 22:50:44,427] Trial 430 pruned. Trial was pruned at iteration 0.
[I 2023-12-18 22:50:44,515] Trial 431 pruned. Trial was pruned at iteration 0.
[I 2023-12-18 22:50:44,609] Trial 432 pruned. Trial was pruned at iteration 0.
[I 2023-12-18 22:50:44,694] Trial 433 pruned. Trial was pruned at iteration 0.
[I 2023-12-18 22:50:44,782] Trial 434 pruned. Trial was pruned at iteration 0.
[I 2023-12-18 22:50:44,881] Trial 435 pruned. Trial was pruned at iteration 0.
[I 2023-12-18 22:50:44,980] Trial 436 pruned. Trial was pruned at iteration 0.
[I 2023-12-18 22:50:45,078] Trial 437 pruned. Trial was pruned at iteration 0.
[I 2023-12-18 22:50:45,169] Trial 438 pruned. Trial was pruned at iteration 0.
[I 2023-12-18 22:50:45,263] Trial 439 pruned. Trial was pruned at iteration 0.
[I 2023-12-18 22:50:45,358] Trial 440 pruned. Trial was pruned at iteration 0.
[I 2023-12-18 22:50:45,463] Trial 441 pruned. Trial was pruned at iteration 0.
[I 2023-12-18 22:50:45,547] Trial 442 pruned. Trial was pruned at iteration 0.
[I 2023-12-18 22:50:45,637] Trial 443 pruned. Trial was pruned at iteration 0.
[I 2023-12-18 22:50:45,723] Trial 444 pruned. Trial was pruned at iteration 0.
[I 2023-12-18 22:50:45,810] Trial 445 pruned. Trial was pruned at iteration 0.
[I 2023-12-18 22:50:45,924] Trial 446 pruned. Trial was pruned at iteration 0.
[I 2023-12-18 22:50:46,013] Trial 447 pruned. Trial was pruned at iteration 0.
[I 2023-12-18 22:50:46,104] Trial 448 pruned. Trial was pruned at iteration 0.
[I 2023-12-18 22:50:46,192] Trial 449 pruned. Trial was pruned at iteration 0.
[I 2023-12-18 22:50:46,287] Trial 450 pruned. Trial was pruned at iteration 0.
[I 2023-12-18 22:50:46,377] Trial 451 pruned. Trial was pruned at iteration 0.
[I 2023-12-18 22:50:46,489] Trial 452 pruned. Trial was pruned at iteration 0.
[I 2023-12-18 22:50:46,586] Trial 453 pruned. Trial was pruned at iteration 0.
[I 2023-12-18 22:50:46,673] Trial 454 pruned. Trial was pruned at iteration 0.
[I 2023-12-18 22:50:46,761] Trial 455 pruned. Trial was pruned at iteration 0.
[I 2023-12-18 22:50:46,851] Trial 456 pruned. Trial was pruned at iteration 0.
[I 2023-12-18 22:50:46,957] Trial 457 pruned. Trial was pruned at iteration 0.
[I 2023-12-18 22:50:47,048] Trial 458 pruned. Trial was pruned at iteration 0.
[I 2023-12-18 22:50:47,146] Trial 459 pruned. Trial was pruned at iteration 0.
[I 2023-12-18 22:50:47,238] Trial 460 pruned. Trial was pruned at iteration 0.
[I 2023-12-18 22:50:47,323] Trial 461 pruned. Trial was pruned at iteration 0.
[I 2023-12-18 22:50:47,415] Trial 462 pruned. Trial was pruned at iteration 0.
[I 2023-12-18 22:50:47,509] Trial 463 pruned. Trial was pruned at iteration 0.
[I 2023-12-18 22:50:47,594] Trial 464 pruned. Trial was pruned at iteration 0.
[I 2023-12-18 22:50:47,700] Trial 465 pruned. Trial was pruned at iteration 0.
[I 2023-12-18 22:50:47,785] Trial 466 pruned. Trial was pruned at iteration 0.
[I 2023-12-18 22:50:47,877] Trial 467 pruned. Trial was pruned at iteration 0.
[I 2023-12-18 22:50:47,983] Trial 468 pruned. Trial was pruned at iteration 0.
[I 2023-12-18 22:50:48,075] Trial 469 pruned. Trial was pruned at iteration 0.
[I 2023-12-18 22:50:48,165] Trial 470 pruned. Trial was pruned at iteration 0.
[I 2023-12-18 22:50:48,261] Trial 471 pruned. Trial was pruned at iteration 0.
[I 2023-12-18 22:50:48,354] Trial 472 pruned. Trial was pruned at iteration 0.
[I 2023-12-18 22:50:48,444] Trial 473 pruned. Trial was pruned at iteration 0.
[I 2023-12-18 22:50:48,535] Trial 474 pruned. Trial was pruned at iteration 0.
[I 2023-12-18 22:50:48,628] Trial 475 pruned. Trial was pruned at iteration 0.
[I 2023-12-18 22:50:48,718] Trial 476 pruned. Trial was pruned at iteration 0.
[I 2023-12-18 22:50:48,813] Trial 477 pruned. Trial was pruned at iteration 0.
[I 2023-12-18 22:50:48,916] Trial 478 pruned. Trial was pruned at iteration 0.
[I 2023-12-18 22:50:49,025] Trial 479 pruned. Trial was pruned at iteration 0.
[I 2023-12-18 22:50:49,114] Trial 480 pruned. Trial was pruned at iteration 0.
[I 2023-12-18 22:50:49,208] Trial 481 pruned. Trial was pruned at iteration 0.
[I 2023-12-18 22:50:49,426] Trial 482 pruned. Trial was pruned at iteration 53.
[I 2023-12-18 22:50:49,531] Trial 483 pruned. Trial was pruned at iteration 0.
[I 2023-12-18 22:50:49,622] Trial 484 pruned. Trial was pruned at iteration 0.
[I 2023-12-18 22:50:49,718] Trial 485 pruned. Trial was pruned at iteration 0.
[I 2023-12-18 22:50:49,808] Trial 486 pruned. Trial was pruned at iteration 0.
[I 2023-12-18 22:50:49,900] Trial 487 pruned. Trial was pruned at iteration 0.
[I 2023-12-18 22:50:50,003] Trial 488 pruned. Trial was pruned at iteration 0.
[I 2023-12-18 22:50:50,095] Trial 489 pruned. Trial was pruned at iteration 0.
[I 2023-12-18 22:50:50,192] Trial 490 pruned. Trial was pruned at iteration 0.
[I 2023-12-18 22:50:50,291] Trial 491 pruned. Trial was pruned at iteration 0.
[I 2023-12-18 22:50:50,393] Trial 492 pruned. Trial was pruned at iteration 1.
[I 2023-12-18 22:50:50,494] Trial 493 pruned. Trial was pruned at iteration 0.
[I 2023-12-18 22:50:50,584] Trial 494 pruned. Trial was pruned at iteration 0.
[I 2023-12-18 22:50:50,686] Trial 495 pruned. Trial was pruned at iteration 0.
[I 2023-12-18 22:50:50,777] Trial 496 pruned. Trial was pruned at iteration 0.
[I 2023-12-18 22:50:50,866] Trial 497 pruned. Trial was pruned at iteration 0.
[I 2023-12-18 22:50:50,969] Trial 498 pruned. Trial was pruned at iteration 0.
[I 2023-12-18 22:50:51,078] Trial 499 pruned. Trial was pruned at iteration 0.
Completed hyperparameter tuning with best aft-nloglik = 4.243578196768486.
Re-running the best trial... params = {'verbosity': 0, 'objective': 'survival:aft', 'eval_metric': 'aft-nloglik', 'tree_method': 'gpu_hist', 'device': 'cuda', 'learning_rate': 0.0065273299616546996, 'aft_loss_distribution': 'logistic', 'aft_loss_distribution_scale': 0.7130623030296811, 'max_depth': 8, 'booster': 'gbtree', 'scale_pos_weight': 0.10058540779632404, 'alpha': 2.727500027403961, 'lambda': 9.04356108306586, 'eta': 0.27776136464037793, 'sampling_method': 'uniform', 'subsample': 0.0607946425885058, 'gamma': 7.649974567195368}
[W 2023-12-18 22:50:53,223] Trial 0 is omitted in visualization because its objective value is inf or nan.
[W 2023-12-18 22:50:53,228] Trial 29 is omitted in visualization because its objective value is inf or nan.
[W 2023-12-18 22:50:53,234] Trial 44 is omitted in visualization because its objective value is inf or nan.
[W 2023-12-18 22:50:53,236] Trial 51 is omitted in visualization because its objective value is inf or nan.
[W 2023-12-18 22:50:53,241] Trial 52 is omitted in visualization because its objective value is inf or nan.
[W 2023-12-18 22:50:53,242] Trial 53 is omitted in visualization because its objective value is inf or nan.
[W 2023-12-18 22:50:53,243] Trial 56 is omitted in visualization because its objective value is inf or nan.
[W 2023-12-18 22:50:53,244] Trial 62 is omitted in visualization because its objective value is inf or nan.
[W 2023-12-18 22:50:53,250] Trial 74 is omitted in visualization because its objective value is inf or nan.
[W 2023-12-18 22:50:53,251] Trial 83 is omitted in visualization because its objective value is inf or nan.
[W 2023-12-18 22:50:53,252] Trial 116 is omitted in visualization because its objective value is inf or nan.
[W 2023-12-18 22:50:53,252] Trial 131 is omitted in visualization because its objective value is inf or nan.
[W 2023-12-18 22:50:53,253] Trial 132 is omitted in visualization because its objective value is inf or nan.
[W 2023-12-18 22:50:53,258] Trial 153 is omitted in visualization because its objective value is inf or nan.
[W 2023-12-18 22:50:53,259] Trial 158 is omitted in visualization because its objective value is inf or nan.
[W 2023-12-18 22:50:53,260] Trial 161 is omitted in visualization because its objective value is inf or nan.
[W 2023-12-18 22:50:53,261] Trial 197 is omitted in visualization because its objective value is inf or nan.
[W 2023-12-18 22:50:53,262] Trial 285 is omitted in visualization because its objective value is inf or nan.
[W 2023-12-18 22:50:53,267] Trial 335 is omitted in visualization because its objective value is inf or nan.
[W 2023-12-18 22:50:53,275] Trial 351 is omitted in visualization because its objective value is inf or nan.
[W 2023-12-18 22:50:53,280] Trial 421 is omitted in visualization because its objective value is inf or nan.
TRN1 | R2:0.171; p:9.345e-43 | C:58.50 |3h:0.879 |6h:0.860 |9h:0.844 |12h:0.393 |15h:0.393 |18h:0.388 |24h:0.157 |48h:0.150 |72h:0.144 |1wk:0.020 |2wks:0.018 |1mon:0.013 |
TRN2 | R2:0.153; p:1.475e-34 | C:57.65 |3h:0.878 |6h:0.859 |9h:0.843 |12h:0.392 |15h:0.392 |18h:0.388 |24h:0.157 |48h:0.150 |72h:0.144 |1wk:0.020 |2wks:0.018 |1mon:0.013 |
VAL | R2:0.149; p:5.692e-33 | C:57.68 |3h:0.878 |6h:0.859 |9h:0.843 |12h:0.393 |15h:0.393 |18h:0.388 |24h:0.157 |48h:0.150 |72h:0.144 |1wk:0.020 |2wks:0.018 |1mon:0.013 |
[I 2023-12-18 22:50:59,985] A new study created in memory with name: no-name-7eec4dd1-fa74-45cd-8945-307a6a0c5fe4
TST | R2:0.111; p:3.438e-54 | C:55.49 |3h:0.872 |6h:0.850 |9h:0.832 |12h:0.390 |15h:0.390 |18h:0.379 |24h:0.122 |48h:0.117 |72h:0.113 |1wk:0.019 |2wks:0.018 |1mon:0.013 |
/content/drive/MyDrive/intermediates2/res//outcome1_xgb-aft_inp39_all_rdims8.json
All avail dimensionality reduced word embedding with ['location_numeric', 'race_numeric', 'sex_numeric']
All avail dimensionality reduced word embedding with ['location_numeric', 'race_numeric', 'sex_numeric']
All avail dimensionality reduced word embedding with ['location_numeric', 'race_numeric', 'sex_numeric']
All avail dimensionality reduced word embedding with ['location_numeric', 'race_numeric', 'sex_numeric']
trn1
trn2
val
tst
[I 2023-12-18 22:51:26,868] Trial 0 finished with value: 5.635958401726021 and parameters: {'learning_rate': 0.2307097044353569, 'aft_loss_distribution': 'extreme', 'aft_loss_distribution_scale': 6.564623502237112, 'max_depth': 6, 'booster': 'dart', 'scale_pos_weight': 1.2009652872309957, 'alpha': 8.506010225401647, 'lambda': 4.75357841045703, 'eta': 0.9123364446059873, 'sampling_method': 'uniform', 'subsample': 0.8141822207052253, 'gamma': 9.324476884098752}. Best is trial 0 with value: 5.635958401726021.
[I 2023-12-18 22:51:27,466] Trial 1 finished with value: 6.0164633975664135 and parameters: {'learning_rate': 0.27263996030356324, 'aft_loss_distribution': 'extreme', 'aft_loss_distribution_scale': 9.861705825791477, 'max_depth': 4, 'booster': 'gbtree', 'scale_pos_weight': 8.5339106911747, 'alpha': 6.509522769934472, 'lambda': 5.5310830181678705, 'eta': 0.33997000462645643, 'sampling_method': 'uniform', 'subsample': 0.36539708139387056, 'gamma': 9.927737681877916}. Best is trial 0 with value: 5.635958401726021.
[I 2023-12-18 22:51:45,257] Trial 2 finished with value: 5.346064792072908 and parameters: {'learning_rate': 0.45142474052301956, 'aft_loss_distribution': 'extreme', 'aft_loss_distribution_scale': 4.789803481133818, 'max_depth': 10, 'booster': 'dart', 'scale_pos_weight': 2.889247143997247, 'alpha': 2.9979126357129053, 'lambda': 0.3005207442328941, 'eta': 0.5578347403718458, 'sampling_method': 'uniform', 'subsample': 0.6121650765186886, 'gamma': 1.3001933475819916}. Best is trial 2 with value: 5.346064792072908.
[I 2023-12-18 22:51:47,163] Trial 3 finished with value: inf and parameters: {'learning_rate': 0.8883440662325236, 'aft_loss_distribution': 'normal', 'aft_loss_distribution_scale': 6.509070569192084, 'max_depth': 7, 'booster': 'dart', 'scale_pos_weight': 4.819026634783756, 'alpha': 3.0356619930686755, 'lambda': 0.31289604205276883, 'eta': 0.1551200656780104, 'sampling_method': 'gradient_based', 'subsample': 0.2563777048819774, 'gamma': 6.099340094705968}. Best is trial 2 with value: 5.346064792072908.
[I 2023-12-18 22:51:49,022] Trial 4 finished with value: inf and parameters: {'learning_rate': 0.6497387352651234, 'aft_loss_distribution': 'normal', 'aft_loss_distribution_scale': 7.114309066461981, 'max_depth': 3, 'booster': 'dart', 'scale_pos_weight': 4.585846015917623, 'alpha': 5.348621063054146, 'lambda': 3.680935162568525, 'eta': 0.3028188709794547, 'sampling_method': 'gradient_based', 'subsample': 0.5628131533301866, 'gamma': 1.7415372626210355}. Best is trial 2 with value: 5.346064792072908.
[I 2023-12-18 22:51:49,033] Trial 5 pruned. Trial was pruned at iteration 0.
[I 2023-12-18 22:51:53,247] Trial 6 finished with value: 5.4507412991997715 and parameters: {'learning_rate': 0.9514719986746133, 'aft_loss_distribution': 'logistic', 'aft_loss_distribution_scale': 3.702951760330894, 'max_depth': 4, 'booster': 'dart', 'scale_pos_weight': 9.079419904211957, 'alpha': 9.609230080836424, 'lambda': 5.2457361368198585, 'eta': 0.9311337026885979, 'sampling_method': 'gradient_based', 'subsample': 0.8494819913088111, 'gamma': 6.934610386329459}. Best is trial 2 with value: 5.346064792072908.
[I 2023-12-18 22:51:53,268] Trial 7 pruned. Trial was pruned at iteration 0.
[I 2023-12-18 22:51:53,286] Trial 8 pruned. Trial was pruned at iteration 0.
[I 2023-12-18 22:51:53,303] Trial 9 pruned. Trial was pruned at iteration 0.
[I 2023-12-18 22:51:53,541] Trial 10 finished with value: inf and parameters: {'learning_rate': 0.6391417014069521, 'aft_loss_distribution': 'logistic', 'aft_loss_distribution_scale': 2.3192017302551897, 'max_depth': 10, 'booster': 'gbtree', 'scale_pos_weight': 2.2606605637956427, 'alpha': 0.47833930689987225, 'lambda': 0.40637480470904275, 'eta': 0.6747557565462723, 'sampling_method': 'uniform', 'subsample': 0.06549183494843286, 'gamma': 3.8771007163030484}. Best is trial 2 with value: 5.346064792072908.
[I 2023-12-18 22:51:57,864] Trial 11 finished with value: 5.419318713877568 and parameters: {'learning_rate': 0.9986360014929707, 'aft_loss_distribution': 'logistic', 'aft_loss_distribution_scale': 3.5785104091439575, 'max_depth': 10, 'booster': 'dart', 'scale_pos_weight': 9.478018826737841, 'alpha': 9.311544276575084, 'lambda': 6.414673213962389, 'eta': 0.9913937713661902, 'sampling_method': 'gradient_based', 'subsample': 0.6004989291606433, 'gamma': 3.9850177794878516}. Best is trial 2 with value: 5.346064792072908.
