[I 2023-12-21 04:04:20,056] Trial 1 finished with value: inf and parameters: {'learning_rate': 0.6534233404071788, 'aft_loss_distribution                                                                     ': 'extreme', 'aft_loss_distribution_scale': 9.066351098635685, 'max_depth': 4, 'booster': 'dart', 'scale_pos_weight': 2.497327587341852,                                                                      'alpha': 0.032518633308497115, 'lambda': 4.125845276940158, 'eta': 0.17848646855009997, 'sampling_method': 'gradient_based', 'subsample'                                                                     : 0.3992809326699322, 'gamma': 9.916329373844473}. Best is trial 0 with value: 5.119571388687321.
[I 2023-12-21 04:04:20,125] Trial 2 finished with value: inf and parameters: {'learning_rate': 0.6426204937253909, 'aft_loss_distribution                                                                     ': 'normal', 'aft_loss_distribution_scale': 0.7519515411001482, 'max_depth': 8, 'booster': 'gbtree', 'scale_pos_weight': 2.08340023860200                                                                     8, 'alpha': 9.422093064836927, 'lambda': 7.314079201905366, 'eta': 0.4214879034479335, 'sampling_method': 'gradient_based', 'subsample':                                                                      0.8269578011604926, 'gamma': 8.289366506142327}. Best is trial 0 with value: 5.119571388687321.
[I 2023-12-21 04:04:20,312] Trial 3 finished with value: 4.295173559739448 and parameters: {'learning_rate': 0.10801724455789538, 'aft_lo                                                                     ss_distribution': 'normal', 'aft_loss_distribution_scale': 0.8720212737791262, 'max_depth': 8, 'booster': 'gbtree', 'scale_pos_weight': 6                                                                     .604053863686685, 'alpha': 0.5152183093680839, 'lambda': 0.23949956129825448, 'eta': 0.07642719191049407, 'sampling_method': 'gradient_ba                                                                     sed', 'subsample': 0.726620540395735, 'gamma': 2.1587762886195074}. Best is trial 3 with value: 4.295173559739448.
[I 2023-12-21 04:04:22,822] Trial 4 finished with value: 4.350241493504662 and parameters: {'learning_rate': 0.14358120655815143, 'aft_lo                                                                     ss_distribution': 'normal', 'aft_loss_distribution_scale': 0.7511539881428632, 'max_depth': 10, 'booster': 'dart', 'scale_pos_weight': 9.                                                                     490480756476133, 'alpha': 4.29011755501623, 'lambda': 9.456861713250465, 'eta': 0.1920312448262721, 'sampling_method': 'uniform', 'subsam                                                                     ple': 0.7443989643238312, 'gamma': 4.133396090021115}. Best is trial 3 with value: 4.295173559739448.
[I 2023-12-21 04:04:22,856] Trial 5 pruned. Trial was pruned at iteration 7.
[I 2023-12-21 04:04:22,868] Trial 6 pruned. Trial was pruned at iteration 7.
[I 2023-12-21 04:04:22,874] Trial 7 pruned. Trial was pruned at iteration 0.
[I 2023-12-21 04:04:22,927] Trial 8 pruned. Trial was pruned at iteration 10.
[I 2023-12-21 04:04:22,936] Trial 9 pruned. Trial was pruned at iteration 6.
[I 2023-12-21 04:04:22,965] Trial 10 pruned. Trial was pruned at iteration 0.
[I 2023-12-21 04:04:22,992] Trial 11 pruned. Trial was pruned at iteration 0.
[I 2023-12-21 04:04:23,180] Trial 12 pruned. Trial was pruned at iteration 18.
[I 2023-12-21 04:04:23,209] Trial 13 pruned. Trial was pruned at iteration 0.
[I 2023-12-21 04:04:23,263] Trial 14 pruned. Trial was pruned at iteration 16.
[I 2023-12-21 04:04:23,324] Trial 15 pruned. Trial was pruned at iteration 8.
[I 2023-12-21 04:04:23,360] Trial 16 pruned. Trial was pruned at iteration 6.
[I 2023-12-21 04:04:23,389] Trial 17 pruned. Trial was pruned at iteration 0.
[I 2023-12-21 04:04:23,428] Trial 18 pruned. Trial was pruned at iteration 8.
[I 2023-12-21 04:04:23,492] Trial 19 pruned. Trial was pruned at iteration 8.
[I 2023-12-21 04:04:23,546] Trial 20 pruned. Trial was pruned at iteration 17.
[I 2023-12-21 04:04:23,605] Trial 21 pruned. Trial was pruned at iteration 10.
[I 2023-12-21 04:04:23,634] Trial 22 pruned. Trial was pruned at iteration 0.
[I 2023-12-21 04:04:23,674] Trial 23 pruned. Trial was pruned at iteration 7.
[I 2023-12-21 04:04:23,714] Trial 24 pruned. Trial was pruned at iteration 8.
[I 2023-12-21 04:04:23,744] Trial 25 pruned. Trial was pruned at iteration 0.
[I 2023-12-21 04:04:23,835] Trial 26 pruned. Trial was pruned at iteration 11.
[I 2023-12-21 04:04:23,884] Trial 27 pruned. Trial was pruned at iteration 11.
[I 2023-12-21 04:04:23,942] Trial 28 pruned. Trial was pruned at iteration 7.
[I 2023-12-21 04:04:24,009] Trial 29 pruned. Trial was pruned at iteration 7.
[I 2023-12-21 04:04:24,039] Trial 30 pruned. Trial was pruned at iteration 0.
[I 2023-12-21 04:04:24,070] Trial 31 pruned. Trial was pruned at iteration 0.
[I 2023-12-21 04:04:24,101] Trial 32 pruned. Trial was pruned at iteration 0.
[I 2023-12-21 04:04:24,156] Trial 33 pruned. Trial was pruned at iteration 6.
[I 2023-12-21 04:04:24,216] Trial 34 pruned. Trial was pruned at iteration 7.
[I 2023-12-21 04:04:24,285] Trial 35 pruned. Trial was pruned at iteration 8.
[I 2023-12-21 04:04:24,327] Trial 36 pruned. Trial was pruned at iteration 6.
[I 2023-12-21 04:04:24,366] Trial 37 pruned. Trial was pruned at iteration 7.
[I 2023-12-21 04:04:24,401] Trial 38 pruned. Trial was pruned at iteration 0.
[I 2023-12-21 04:04:24,439] Trial 39 pruned. Trial was pruned at iteration 7.
[I 2023-12-21 04:04:24,470] Trial 40 pruned. Trial was pruned at iteration 0.
[I 2023-12-21 04:04:24,578] Trial 41 finished with value: inf and parameters: {'learning_rate': 0.6375346811693461, 'aft_loss_distributio                                                                     n': 'normal', 'aft_loss_distribution_scale': 0.8621384680159636, 'max_depth': 9, 'booster': 'gbtree', 'scale_pos_weight': 2.2992737772905                                                                     807, 'alpha': 7.681540014456435, 'lambda': 6.550580577238523, 'eta': 0.562251775611393, 'sampling_method': 'gradient_based', 'subsample':                                                                      0.9038138721159682, 'gamma': 8.609322756708556}. Best is trial 3 with value: 4.295173559739448.
[I 2023-12-21 04:04:24,689] Trial 42 finished with value: inf and parameters: {'learning_rate': 0.7094941643759909, 'aft_loss_distributio                                                                     n': 'normal', 'aft_loss_distribution_scale': 1.3560326664190439, 'max_depth': 7, 'booster': 'gbtree', 'scale_pos_weight': 5.9991760230521                                                                     125, 'alpha': 6.812998225151576, 'lambda': 7.191205100571865, 'eta': 0.4516943349849602, 'sampling_method': 'gradient_based', 'subsample'                                                                     : 0.7744151394500032, 'gamma': 9.158267259744957}. Best is trial 3 with value: 4.295173559739448.
[I 2023-12-21 04:04:24,722] Trial 43 pruned. Trial was pruned at iteration 0.
[I 2023-12-21 04:04:24,768] Trial 44 pruned. Trial was pruned at iteration 14.
[I 2023-12-21 04:04:24,801] Trial 45 pruned. Trial was pruned at iteration 1.
[I 2023-12-21 04:04:24,836] Trial 46 pruned. Trial was pruned at iteration 1.
[I 2023-12-21 04:04:24,870] Trial 47 pruned. Trial was pruned at iteration 0.
[I 2023-12-21 04:04:24,951] Trial 48 pruned. Trial was pruned at iteration 10.
[I 2023-12-21 04:04:24,985] Trial 49 pruned. Trial was pruned at iteration 1.
[I 2023-12-21 04:04:25,018] Trial 50 pruned. Trial was pruned at iteration 1.
[I 2023-12-21 04:04:25,075] Trial 51 pruned. Trial was pruned at iteration 18.
[I 2023-12-21 04:04:25,108] Trial 52 pruned. Trial was pruned at iteration 0.
[I 2023-12-21 04:04:25,345] Trial 53 finished with value: 4.307265113816761 and parameters: {'learning_rate': 0.7245441476338832, 'aft_lo                                                                     ss_distribution': 'normal', 'aft_loss_distribution_scale': 1.3524137723041587, 'max_depth': 9, 'booster': 'gbtree', 'scale_pos_weight': 3                                                                     .331138771747193, 'alpha': 9.249897149622186, 'lambda': 7.026599533192909, 'eta': 0.5899841891798263, 'sampling_method': 'gradient_based'                                                                     , 'subsample': 0.8103801607377155, 'gamma': 9.267171570125093}. Best is trial 3 with value: 4.295173559739448.
[I 2023-12-21 04:04:25,459] Trial 54 finished with value: inf and parameters: {'learning_rate': 0.9060287698020362, 'aft_loss_distributio                                                                     n': 'normal', 'aft_loss_distribution_scale': 1.310092835333141, 'max_depth': 9, 'booster': 'gbtree', 'scale_pos_weight': 3.26183771236183                                                                     3, 'alpha': 9.346801430457672, 'lambda': 4.975068788467036, 'eta': 0.40453373679386584, 'sampling_method': 'gradient_based', 'subsample':                                                                      0.8224017753775168, 'gamma': 9.148971167705582}. Best is trial 3 with value: 4.295173559739448.
[I 2023-12-21 04:04:25,493] Trial 55 pruned. Trial was pruned at iteration 0.
[I 2023-12-21 04:04:25,527] Trial 56 pruned. Trial was pruned at iteration 1.
[I 2023-12-21 04:04:25,560] Trial 57 pruned. Trial was pruned at iteration 0.
[I 2023-12-21 04:04:25,596] Trial 58 pruned. Trial was pruned at iteration 2.
[I 2023-12-21 04:04:25,631] Trial 59 pruned. Trial was pruned at iteration 1.
[I 2023-12-21 04:04:25,664] Trial 60 pruned. Trial was pruned at iteration 0.
[I 2023-12-21 04:04:25,809] Trial 61 finished with value: 4.247532035211623 and parameters: {'learning_rate': 0.5972896589062244, 'aft_lo                                                                     ss_distribution': 'normal', 'aft_loss_distribution_scale': 1.0116823010173372, 'max_depth': 9, 'booster': 'gbtree', 'scale_pos_weight': 2                                                                     .133671255767221, 'alpha': 9.487425088787544, 'lambda': 6.671761504657603, 'eta': 0.6072604837983204, 'sampling_method': 'gradient_based'                                                                     , 'subsample': 0.9265974057944975, 'gamma': 8.790120627099261}. Best is trial 61 with value: 4.247532035211623.
[I 2023-12-21 04:04:25,843] Trial 62 pruned. Trial was pruned at iteration 0.
[I 2023-12-21 04:04:25,950] Trial 63 finished with value: inf and parameters: {'learning_rate': 0.6722087491409587, 'aft_loss_distributio                                                                     n': 'normal', 'aft_loss_distribution_scale': 0.95467987668954, 'max_depth': 8, 'booster': 'gbtree', 'scale_pos_weight': 2.021481651966706                                                                     , 'alpha': 8.810547896821008, 'lambda': 5.685404890118129, 'eta': 0.6758750267267163, 'sampling_method': 'gradient_based', 'subsample': 0                                                                     .8105871125822441, 'gamma': 8.197692685194342}. Best is trial 61 with value: 4.247532035211623.
[I 2023-12-21 04:04:25,984] Trial 64 pruned. Trial was pruned at iteration 1.
[I 2023-12-21 04:04:26,018] Trial 65 pruned. Trial was pruned at iteration 1.
[I 2023-12-21 04:04:26,054] Trial 66 pruned. Trial was pruned at iteration 1.
[I 2023-12-21 04:04:26,087] Trial 67 pruned. Trial was pruned at iteration 0.
[I 2023-12-21 04:04:26,123] Trial 68 pruned. Trial was pruned at iteration 0.
[I 2023-12-21 04:04:26,156] Trial 69 pruned. Trial was pruned at iteration 0.
[I 2023-12-21 04:04:26,384] Trial 70 finished with value: 4.2590405909254105 and parameters: {'learning_rate': 0.7288204495202874, 'aft_l                                                                     oss_distribution': 'normal', 'aft_loss_distribution_scale': 1.1691676759634941, 'max_depth': 10, 'booster': 'gbtree', 'scale_pos_weight':                                                                      7.7295225259736515, 'alpha': 4.370003734491899, 'lambda': 6.371921193310084, 'eta': 0.06026053735199011, 'sampling_method': 'gradient_ba                                                                     sed', 'subsample': 0.9653099792428147, 'gamma': 8.835494033550086}. Best is trial 61 with value: 4.247532035211623.
[I 2023-12-21 04:04:26,423] Trial 71 pruned. Trial was pruned at iteration 2.
[I 2023-12-21 04:04:26,456] Trial 72 pruned. Trial was pruned at iteration 0.
[I 2023-12-21 04:04:26,490] Trial 73 pruned. Trial was pruned at iteration 0.
[I 2023-12-21 04:04:26,523] Trial 74 pruned. Trial was pruned at iteration 0.
[I 2023-12-21 04:04:26,569] Trial 75 pruned. Trial was pruned at iteration 2.
[I 2023-12-21 04:04:26,603] Trial 76 pruned. Trial was pruned at iteration 0.
[I 2023-12-21 04:04:26,637] Trial 77 pruned. Trial was pruned at iteration 0.
[I 2023-12-21 04:04:26,671] Trial 78 pruned. Trial was pruned at iteration 0.
[I 2023-12-21 04:04:26,706] Trial 79 pruned. Trial was pruned at iteration 1.
[I 2023-12-21 04:04:26,739] Trial 80 pruned. Trial was pruned at iteration 0.
[I 2023-12-21 04:04:26,781] Trial 81 pruned. Trial was pruned at iteration 2.
[I 2023-12-21 04:04:26,818] Trial 82 pruned. Trial was pruned at iteration 2.
[I 2023-12-21 04:04:26,852] Trial 83 pruned. Trial was pruned at iteration 0.
[I 2023-12-21 04:04:26,888] Trial 84 pruned. Trial was pruned at iteration 1.
[I 2023-12-21 04:04:26,923] Trial 85 pruned. Trial was pruned at iteration 0.
[I 2023-12-21 04:04:26,960] Trial 86 pruned. Trial was pruned at iteration 0.
[I 2023-12-21 04:04:26,995] Trial 87 pruned. Trial was pruned at iteration 0.
[I 2023-12-21 04:04:27,030] Trial 88 pruned. Trial was pruned at iteration 0.
[I 2023-12-21 04:04:27,066] Trial 89 pruned. Trial was pruned at iteration 0.
[I 2023-12-21 04:04:27,100] Trial 90 pruned. Trial was pruned at iteration 0.
[I 2023-12-21 04:04:27,140] Trial 91 pruned. Trial was pruned at iteration 2.
[I 2023-12-21 04:04:27,175] Trial 92 pruned. Trial was pruned at iteration 0.
[I 2023-12-21 04:04:27,210] Trial 93 pruned. Trial was pruned at iteration 1.
[I 2023-12-21 04:04:27,247] Trial 94 pruned. Trial was pruned at iteration 0.
[I 2023-12-21 04:04:27,314] Trial 95 pruned. Trial was pruned at iteration 25.
[I 2023-12-21 04:04:27,349] Trial 96 pruned. Trial was pruned at iteration 0.
[I 2023-12-21 04:04:27,390] Trial 97 pruned. Trial was pruned at iteration 2.
[I 2023-12-21 04:04:27,425] Trial 98 pruned. Trial was pruned at iteration 0.
[I 2023-12-21 04:04:27,460] Trial 99 pruned. Trial was pruned at iteration 0.
[I 2023-12-21 04:04:27,498] Trial 100 pruned. Trial was pruned at iteration 0.
[I 2023-12-21 04:04:27,601] Trial 101 pruned. Trial was pruned at iteration 54.
[I 2023-12-21 04:04:27,741] Trial 102 finished with value: 4.2515503982291305 and parameters: {'learning_rate': 0.9446823909243256, 'aft_                                                                     loss_distribution': 'normal', 'aft_loss_distribution_scale': 1.0963267563372763, 'max_depth': 3, 'booster': 'gbtree', 'scale_pos_weight':                                                                      3.026066297889472, 'alpha': 9.409238481019873, 'lambda': 4.979081046744383, 'eta': 0.41177901856976373, 'sampling_method': 'gradient_bas                                                                     ed', 'subsample': 0.7434710534401725, 'gamma': 8.839634557415044}. Best is trial 61 with value: 4.247532035211623.
[I 2023-12-21 04:04:27,914] Trial 103 finished with value: 4.266365276891789 and parameters: {'learning_rate': 0.8821465536614919, 'aft_l                                                                     oss_distribution': 'normal', 'aft_loss_distribution_scale': 0.9593042151173932, 'max_depth': 3, 'booster': 'gbtree', 'scale_pos_weight':                                                                      3.0368253525941538, 'alpha': 9.767912923911295, 'lambda': 0.6474692406406999, 'eta': 0.4303001157749739, 'sampling_method': 'gradient_bas                                                                     ed', 'subsample': 0.6589158859558186, 'gamma': 8.838885491894604}. Best is trial 61 with value: 4.247532035211623.
[I 2023-12-21 04:04:28,026] Trial 104 finished with value: inf and parameters: {'learning_rate': 0.98143486819639, 'aft_loss_distribution                                                                     ': 'normal', 'aft_loss_distribution_scale': 1.1068591140225934, 'max_depth': 3, 'booster': 'gbtree', 'scale_pos_weight': 3.07911832796414                                                                     3, 'alpha': 9.741000961656482, 'lambda': 0.5984398316225223, 'eta': 0.3310067166659005, 'sampling_method': 'gradient_based', 'subsample':                                                                      0.6423560478358149, 'gamma': 7.770249803698661}. Best is trial 61 with value: 4.247532035211623.
[I 2023-12-21 04:04:28,350] Trial 105 finished with value: 4.259943916480559 and parameters: {'learning_rate': 0.9428417916818909, 'aft_l                                                                     oss_distribution': 'normal', 'aft_loss_distribution_scale': 0.9499605358664682, 'max_depth': 3, 'booster': 'gbtree', 'scale_pos_weight':                                                                      2.894973603661323, 'alpha': 8.903350368880943, 'lambda': 4.571766691127494, 'eta': 0.4263869080657838, 'sampling_method': 'gradient_based                                                                     ', 'subsample': 0.7375155318775469, 'gamma': 8.814549802661197}. Best is trial 61 with value: 4.247532035211623.
[I 2023-12-21 04:04:28,473] Trial 106 pruned. Trial was pruned at iteration 68.
[I 2023-12-21 04:04:28,509] Trial 107 pruned. Trial was pruned at iteration 0.
[I 2023-12-21 04:04:28,545] Trial 108 pruned. Trial was pruned at iteration 1.
[I 2023-12-21 04:04:28,584] Trial 109 pruned. Trial was pruned at iteration 1.
[I 2023-12-21 04:04:28,619] Trial 110 pruned. Trial was pruned at iteration 0.
[I 2023-12-21 04:04:28,807] Trial 111 finished with value: 4.253781707868112 and parameters: {'learning_rate': 0.8770637909363314, 'aft_l                                                                     oss_distribution': 'normal', 'aft_loss_distribution_scale': 0.9876847790300614, 'max_depth': 3, 'booster': 'gbtree', 'scale_pos_weight':                                                                      2.3316192141460177, 'alpha': 9.184576327129134, 'lambda': 4.754271485060285, 'eta': 0.14178695862911467, 'sampling_method': 'gradient_bas                                                                     ed', 'subsample': 0.9991315428111981, 'gamma': 9.778689837857254}. Best is trial 61 with value: 4.247532035211623.
[I 2023-12-21 04:04:28,843] Trial 112 pruned. Trial was pruned at iteration 0.
[I 2023-12-21 04:04:28,879] Trial 113 pruned. Trial was pruned at iteration 0.
[I 2023-12-21 04:04:28,916] Trial 114 pruned. Trial was pruned at iteration 1.
[I 2023-12-21 04:04:29,017] Trial 115 finished with value: inf and parameters: {'learning_rate': 0.8752472123118182, 'aft_loss_distributi                                                                     on': 'normal', 'aft_loss_distribution_scale': 1.0545540721077615, 'max_depth': 4, 'booster': 'gbtree', 'scale_pos_weight': 2.439676131423                                                                     9503, 'alpha': 0.2338053366619266, 'lambda': 4.836472981639938, 'eta': 0.4819212315877629, 'sampling_method': 'gradient_based', 'subsampl                                                                     e': 0.9858337703224059, 'gamma': 9.317928559897734}. Best is trial 61 with value: 4.247532035211623.
[I 2023-12-21 04:04:29,054] Trial 116 pruned. Trial was pruned at iteration 0.
[I 2023-12-21 04:04:29,170] Trial 117 pruned. Trial was pruned at iteration 63.
[I 2023-12-21 04:04:29,206] Trial 118 pruned. Trial was pruned at iteration 0.
[I 2023-12-21 04:04:29,245] Trial 119 pruned. Trial was pruned at iteration 1.
[I 2023-12-21 04:04:29,281] Trial 120 pruned. Trial was pruned at iteration 0.
[I 2023-12-21 04:04:29,319] Trial 121 pruned. Trial was pruned at iteration 0.
[I 2023-12-21 04:04:29,358] Trial 122 pruned. Trial was pruned at iteration 1.
[I 2023-12-21 04:04:29,395] Trial 123 pruned. Trial was pruned at iteration 0.
[I 2023-12-21 04:04:29,431] Trial 124 pruned. Trial was pruned at iteration 0.
[I 2023-12-21 04:04:29,469] Trial 125 pruned. Trial was pruned at iteration 0.
[I 2023-12-21 04:04:29,507] Trial 126 pruned. Trial was pruned at iteration 0.
[I 2023-12-21 04:04:29,544] Trial 127 pruned. Trial was pruned at iteration 0.
[I 2023-12-21 04:04:29,580] Trial 128 pruned. Trial was pruned at iteration 0.
[I 2023-12-21 04:04:29,619] Trial 129 pruned. Trial was pruned at iteration 0.
[I 2023-12-21 04:04:29,655] Trial 130 pruned. Trial was pruned at iteration 0.
[I 2023-12-21 04:04:29,691] Trial 131 pruned. Trial was pruned at iteration 0.
[I 2023-12-21 04:04:29,728] Trial 132 pruned. Trial was pruned at iteration 0.
[I 2023-12-21 04:04:29,765] Trial 133 pruned. Trial was pruned at iteration 0.
[I 2023-12-21 04:04:29,802] Trial 134 pruned. Trial was pruned at iteration 0.
[I 2023-12-21 04:04:29,845] Trial 135 pruned. Trial was pruned at iteration 0.
[I 2023-12-21 04:04:29,882] Trial 136 pruned. Trial was pruned at iteration 0.
[I 2023-12-21 04:04:29,919] Trial 137 pruned. Trial was pruned at iteration 0.
[I 2023-12-21 04:04:29,956] Trial 138 pruned. Trial was pruned at iteration 0.
[I 2023-12-21 04:04:29,993] Trial 139 pruned. Trial was pruned at iteration 0.
[I 2023-12-21 04:04:30,030] Trial 140 pruned. Trial was pruned at iteration 0.
