[I 2023-12-21 04:04:05,614] Trial 357 pruned. Trial was pruned at iteration 0.
[I 2023-12-21 04:04:05,662] Trial 358 pruned. Trial was pruned at iteration 0.
[I 2023-12-21 04:04:05,711] Trial 359 pruned. Trial was pruned at iteration 1.
[I 2023-12-21 04:04:05,760] Trial 360 pruned. Trial was pruned at iteration 0.
[I 2023-12-21 04:04:05,809] Trial 361 pruned. Trial was pruned at iteration 1.
[I 2023-12-21 04:04:05,864] Trial 362 pruned. Trial was pruned at iteration 1.
[I 2023-12-21 04:04:05,913] Trial 363 pruned. Trial was pruned at iteration 0.
[I 2023-12-21 04:04:05,961] Trial 364 pruned. Trial was pruned at iteration 0.
[I 2023-12-21 04:04:06,010] Trial 365 pruned. Trial was pruned at iteration 0.
[I 2023-12-21 04:04:06,058] Trial 366 pruned. Trial was pruned at iteration 0.
[I 2023-12-21 04:04:06,107] Trial 367 pruned. Trial was pruned at iteration 0.
[I 2023-12-21 04:04:06,158] Trial 368 pruned. Trial was pruned at iteration 0.
[I 2023-12-21 04:04:06,208] Trial 369 pruned. Trial was pruned at iteration 0.
[I 2023-12-21 04:04:07,262] Trial 370 finished with value: inf and parameters: {'learning_rate': 0.8223481763646555, 'aft_loss_distributi                                                                     on': 'normal', 'aft_loss_distribution_scale': 1.3732589183996209, 'max_depth': 3, 'booster': 'dart', 'scale_pos_weight': 5.35655155764814                                                                     2, 'alpha': 0.35878216324015993, 'lambda': 2.5352572278358174, 'eta': 0.19660187967797987, 'sampling_method': 'uniform', 'subsample': 0.6                                                                     737991422047149, 'gamma': 1.5880087765392177}. Best is trial 127 with value: 4.29954991379438.
[I 2023-12-21 04:04:07,314] Trial 371 pruned. Trial was pruned at iteration 0.
[I 2023-12-21 04:04:07,366] Trial 372 pruned. Trial was pruned at iteration 0.
[I 2023-12-21 04:04:07,415] Trial 373 pruned. Trial was pruned at iteration 0.
[I 2023-12-21 04:04:07,539] Trial 374 finished with value: inf and parameters: {'learning_rate': 0.9025875609576366, 'aft_loss_distributi                                                                     on': 'normal', 'aft_loss_distribution_scale': 1.2113180026046888, 'max_depth': 6, 'booster': 'gbtree', 'scale_pos_weight': 6.783567043314                                                                     588, 'alpha': 3.785191047679554, 'lambda': 6.356252664260892, 'eta': 0.11775367883348241, 'sampling_method': 'gradient_based', 'subsample                                                                     ': 0.5869981769454937, 'gamma': 4.739917386818386}. Best is trial 127 with value: 4.29954991379438.
[I 2023-12-21 04:04:07,590] Trial 375 pruned. Trial was pruned at iteration 1.
[I 2023-12-21 04:04:07,641] Trial 376 pruned. Trial was pruned at iteration 0.
[I 2023-12-21 04:04:07,690] Trial 377 pruned. Trial was pruned at iteration 0.
[I 2023-12-21 04:04:07,742] Trial 378 pruned. Trial was pruned at iteration 1.
[I 2023-12-21 04:04:07,791] Trial 379 pruned. Trial was pruned at iteration 0.
[I 2023-12-21 04:04:07,841] Trial 380 pruned. Trial was pruned at iteration 0.
[I 2023-12-21 04:04:07,965] Trial 381 finished with value: inf and parameters: {'learning_rate': 0.704904977608224, 'aft_loss_distributio                                                                     n': 'normal', 'aft_loss_distribution_scale': 1.2315099852899347, 'max_depth': 4, 'booster': 'gbtree', 'scale_pos_weight': 6.3640535874617                                                                     03, 'alpha': 5.903680328668729, 'lambda': 3.4218117224486404, 'eta': 0.7325804166790864, 'sampling_method': 'uniform', 'subsample': 0.546                                                                     5613745512214, 'gamma': 4.131871934781746}. Best is trial 127 with value: 4.29954991379438.
[I 2023-12-21 04:04:08,015] Trial 382 pruned. Trial was pruned at iteration 0.
[I 2023-12-21 04:04:08,071] Trial 383 pruned. Trial was pruned at iteration 0.
[I 2023-12-21 04:04:08,121] Trial 384 pruned. Trial was pruned at iteration 1.
[I 2023-12-21 04:04:08,171] Trial 385 pruned. Trial was pruned at iteration 0.
[I 2023-12-21 04:04:08,223] Trial 386 pruned. Trial was pruned at iteration 1.
[I 2023-12-21 04:04:08,275] Trial 387 pruned. Trial was pruned at iteration 1.
[I 2023-12-21 04:04:08,326] Trial 388 pruned. Trial was pruned at iteration 0.
[I 2023-12-21 04:04:08,378] Trial 389 pruned. Trial was pruned at iteration 1.
[I 2023-12-21 04:04:08,429] Trial 390 pruned. Trial was pruned at iteration 0.
[I 2023-12-21 04:04:08,481] Trial 391 pruned. Trial was pruned at iteration 0.
[I 2023-12-21 04:04:08,531] Trial 392 pruned. Trial was pruned at iteration 0.
[I 2023-12-21 04:04:08,581] Trial 393 pruned. Trial was pruned at iteration 0.
[I 2023-12-21 04:04:08,632] Trial 394 pruned. Trial was pruned at iteration 1.
[I 2023-12-21 04:04:08,682] Trial 395 pruned. Trial was pruned at iteration 0.
[I 2023-12-21 04:04:08,734] Trial 396 pruned. Trial was pruned at iteration 0.
[I 2023-12-21 04:04:08,784] Trial 397 pruned. Trial was pruned at iteration 0.
[I 2023-12-21 04:04:08,836] Trial 398 pruned. Trial was pruned at iteration 0.
[I 2023-12-21 04:04:08,886] Trial 399 pruned. Trial was pruned at iteration 0.
[I 2023-12-21 04:04:08,936] Trial 400 pruned. Trial was pruned at iteration 0.
[I 2023-12-21 04:04:08,987] Trial 401 pruned. Trial was pruned at iteration 0.
[I 2023-12-21 04:04:09,037] Trial 402 pruned. Trial was pruned at iteration 0.
[I 2023-12-21 04:04:09,089] Trial 403 pruned. Trial was pruned at iteration 0.
[I 2023-12-21 04:04:09,139] Trial 404 pruned. Trial was pruned at iteration 0.
[I 2023-12-21 04:04:09,267] Trial 405 finished with value: inf and parameters: {'learning_rate': 0.7946821314134337, 'aft_loss_distributi                                                                     on': 'normal', 'aft_loss_distribution_scale': 1.065390596938693, 'max_depth': 3, 'booster': 'gbtree', 'scale_pos_weight': 7.3186897179851                                                                     64, 'alpha': 5.806638773375969, 'lambda': 3.952277837131488, 'eta': 0.861398519486128, 'sampling_method': 'gradient_based', 'subsample':                                                                      0.5806798120881337, 'gamma': 4.18196534168296}. Best is trial 127 with value: 4.29954991379438.
[I 2023-12-21 04:04:09,322] Trial 406 pruned. Trial was pruned at iteration 1.
[I 2023-12-21 04:04:09,372] Trial 407 pruned. Trial was pruned at iteration 0.
[I 2023-12-21 04:04:09,423] Trial 408 pruned. Trial was pruned at iteration 0.
[I 2023-12-21 04:04:09,474] Trial 409 pruned. Trial was pruned at iteration 0.
[I 2023-12-21 04:04:09,525] Trial 410 pruned. Trial was pruned at iteration 0.
[I 2023-12-21 04:04:09,578] Trial 411 pruned. Trial was pruned at iteration 0.
[I 2023-12-21 04:04:09,629] Trial 412 pruned. Trial was pruned at iteration 0.
[I 2023-12-21 04:04:09,680] Trial 413 pruned. Trial was pruned at iteration 0.
[I 2023-12-21 04:04:09,731] Trial 414 pruned. Trial was pruned at iteration 0.
[I 2023-12-21 04:04:09,782] Trial 415 pruned. Trial was pruned at iteration 0.
[I 2023-12-21 04:04:09,834] Trial 416 pruned. Trial was pruned at iteration 0.
[I 2023-12-21 04:04:09,886] Trial 417 pruned. Trial was pruned at iteration 0.
[I 2023-12-21 04:04:09,940] Trial 418 pruned. Trial was pruned at iteration 1.
[I 2023-12-21 04:04:09,991] Trial 419 pruned. Trial was pruned at iteration 0.
[I 2023-12-21 04:04:10,042] Trial 420 pruned. Trial was pruned at iteration 0.
[I 2023-12-21 04:04:10,094] Trial 421 pruned. Trial was pruned at iteration 0.
[I 2023-12-21 04:04:10,145] Trial 422 pruned. Trial was pruned at iteration 0.
[I 2023-12-21 04:04:10,198] Trial 423 pruned. Trial was pruned at iteration 0.
[I 2023-12-21 04:04:10,250] Trial 424 pruned. Trial was pruned at iteration 0.
[I 2023-12-21 04:04:10,309] Trial 425 pruned. Trial was pruned at iteration 1.
[I 2023-12-21 04:04:10,361] Trial 426 pruned. Trial was pruned at iteration 0.
[I 2023-12-21 04:04:10,413] Trial 427 pruned. Trial was pruned at iteration 0.
[I 2023-12-21 04:04:10,466] Trial 428 pruned. Trial was pruned at iteration 2.
[I 2023-12-21 04:04:10,521] Trial 429 pruned. Trial was pruned at iteration 1.
[I 2023-12-21 04:04:10,574] Trial 430 pruned. Trial was pruned at iteration 1.
[I 2023-12-21 04:04:10,625] Trial 431 pruned. Trial was pruned at iteration 0.
[I 2023-12-21 04:04:10,679] Trial 432 pruned. Trial was pruned at iteration 0.
[I 2023-12-21 04:04:10,731] Trial 433 pruned. Trial was pruned at iteration 0.
[I 2023-12-21 04:04:10,783] Trial 434 pruned. Trial was pruned at iteration 0.
[I 2023-12-21 04:04:10,836] Trial 435 pruned. Trial was pruned at iteration 0.
[I 2023-12-21 04:04:10,888] Trial 436 pruned. Trial was pruned at iteration 0.
[I 2023-12-21 04:04:10,941] Trial 437 pruned. Trial was pruned at iteration 0.
[I 2023-12-21 04:04:10,994] Trial 438 pruned. Trial was pruned at iteration 1.
[I 2023-12-21 04:04:11,047] Trial 439 pruned. Trial was pruned at iteration 0.
[I 2023-12-21 04:04:11,178] Trial 440 finished with value: inf and parameters: {'learning_rate': 0.6725817349230608, 'aft_loss_distributi                                                                     on': 'normal', 'aft_loss_distribution_scale': 1.393439331070783, 'max_depth': 3, 'booster': 'gbtree', 'scale_pos_weight': 8.4500296805585                                                                     72, 'alpha': 8.103032277059807, 'lambda': 0.8107392049026234, 'eta': 0.2567211359182229, 'sampling_method': 'uniform', 'subsample': 0.682                                                                     1493268037285, 'gamma': 1.5711224410391542}. Best is trial 127 with value: 4.29954991379438.
[I 2023-12-21 04:04:11,232] Trial 441 pruned. Trial was pruned at iteration 1.
[I 2023-12-21 04:04:12,306] Trial 442 finished with value: inf and parameters: {'learning_rate': 0.7149356306108714, 'aft_loss_distributi                                                                     on': 'normal', 'aft_loss_distribution_scale': 1.1681835713064315, 'max_depth': 4, 'booster': 'dart', 'scale_pos_weight': 6.10849935101870                                                                     2, 'alpha': 6.019097718152228, 'lambda': 3.914110757513881, 'eta': 0.29622723401322804, 'sampling_method': 'uniform', 'subsample': 0.0839                                                                     836951252001, 'gamma': 4.091622584674434}. Best is trial 127 with value: 4.29954991379438.
[I 2023-12-21 04:04:12,362] Trial 443 pruned. Trial was pruned at iteration 0.
[I 2023-12-21 04:04:12,415] Trial 444 pruned. Trial was pruned at iteration 1.
[I 2023-12-21 04:04:12,469] Trial 445 pruned. Trial was pruned at iteration 0.
[I 2023-12-21 04:04:12,523] Trial 446 pruned. Trial was pruned at iteration 0.
[I 2023-12-21 04:04:12,576] Trial 447 pruned. Trial was pruned at iteration 0.
[I 2023-12-21 04:04:12,632] Trial 448 pruned. Trial was pruned at iteration 2.
[I 2023-12-21 04:04:12,688] Trial 449 pruned. Trial was pruned at iteration 0.
[I 2023-12-21 04:04:12,742] Trial 450 pruned. Trial was pruned at iteration 1.
[I 2023-12-21 04:04:12,795] Trial 451 pruned. Trial was pruned at iteration 0.
[I 2023-12-21 04:04:12,848] Trial 452 pruned. Trial was pruned at iteration 0.
[I 2023-12-21 04:04:12,902] Trial 453 pruned. Trial was pruned at iteration 0.
[I 2023-12-21 04:04:12,955] Trial 454 pruned. Trial was pruned at iteration 0.
[I 2023-12-21 04:04:13,009] Trial 455 pruned. Trial was pruned at iteration 0.
[I 2023-12-21 04:04:13,062] Trial 456 pruned. Trial was pruned at iteration 0.
[I 2023-12-21 04:04:13,116] Trial 457 pruned. Trial was pruned at iteration 0.
[I 2023-12-21 04:04:13,170] Trial 458 pruned. Trial was pruned at iteration 1.
[I 2023-12-21 04:04:13,223] Trial 459 pruned. Trial was pruned at iteration 0.
[I 2023-12-21 04:04:13,278] Trial 460 pruned. Trial was pruned at iteration 0.
[I 2023-12-21 04:04:13,333] Trial 461 pruned. Trial was pruned at iteration 0.
[I 2023-12-21 04:04:13,388] Trial 462 pruned. Trial was pruned at iteration 0.
[I 2023-12-21 04:04:13,441] Trial 463 pruned. Trial was pruned at iteration 0.
[I 2023-12-21 04:04:13,494] Trial 464 pruned. Trial was pruned at iteration 0.
[I 2023-12-21 04:04:13,548] Trial 465 pruned. Trial was pruned at iteration 0.
[I 2023-12-21 04:04:13,601] Trial 466 pruned. Trial was pruned at iteration 0.
[I 2023-12-21 04:04:13,656] Trial 467 pruned. Trial was pruned at iteration 0.
[I 2023-12-21 04:04:13,711] Trial 468 pruned. Trial was pruned at iteration 0.
[I 2023-12-21 04:04:13,765] Trial 469 pruned. Trial was pruned at iteration 0.
[I 2023-12-21 04:04:13,818] Trial 470 pruned. Trial was pruned at iteration 0.
[I 2023-12-21 04:04:13,872] Trial 471 pruned. Trial was pruned at iteration 0.
[I 2023-12-21 04:04:13,926] Trial 472 pruned. Trial was pruned at iteration 0.
[I 2023-12-21 04:04:13,980] Trial 473 pruned. Trial was pruned at iteration 0.
[I 2023-12-21 04:04:14,035] Trial 474 pruned. Trial was pruned at iteration 0.
[I 2023-12-21 04:04:14,090] Trial 475 pruned. Trial was pruned at iteration 0.
[I 2023-12-21 04:04:14,144] Trial 476 pruned. Trial was pruned at iteration 0.
[I 2023-12-21 04:04:14,198] Trial 477 pruned. Trial was pruned at iteration 0.
[I 2023-12-21 04:04:14,252] Trial 478 pruned. Trial was pruned at iteration 0.
[I 2023-12-21 04:04:14,309] Trial 479 pruned. Trial was pruned at iteration 0.
[I 2023-12-21 04:04:14,369] Trial 480 pruned. Trial was pruned at iteration 2.
[I 2023-12-21 04:04:14,425] Trial 481 pruned. Trial was pruned at iteration 0.
[I 2023-12-21 04:04:14,480] Trial 482 pruned. Trial was pruned at iteration 0.
[I 2023-12-21 04:04:14,538] Trial 483 pruned. Trial was pruned at iteration 1.
[I 2023-12-21 04:04:14,592] Trial 484 pruned. Trial was pruned at iteration 0.
[I 2023-12-21 04:04:14,647] Trial 485 pruned. Trial was pruned at iteration 1.
[I 2023-12-21 04:04:14,702] Trial 486 pruned. Trial was pruned at iteration 0.
[I 2023-12-21 04:04:14,758] Trial 487 pruned. Trial was pruned at iteration 0.
[I 2023-12-21 04:04:14,819] Trial 488 pruned. Trial was pruned at iteration 0.
[I 2023-12-21 04:04:14,875] Trial 489 pruned. Trial was pruned at iteration 1.
[I 2023-12-21 04:04:14,929] Trial 490 pruned. Trial was pruned at iteration 0.
[I 2023-12-21 04:04:14,984] Trial 491 pruned. Trial was pruned at iteration 0.
[I 2023-12-21 04:04:15,039] Trial 492 pruned. Trial was pruned at iteration 0.
[I 2023-12-21 04:04:15,095] Trial 493 pruned. Trial was pruned at iteration 0.
[I 2023-12-21 04:04:15,151] Trial 494 pruned. Trial was pruned at iteration 0.
[I 2023-12-21 04:04:15,208] Trial 495 pruned. Trial was pruned at iteration 1.
[I 2023-12-21 04:04:15,263] Trial 496 pruned. Trial was pruned at iteration 0.
[I 2023-12-21 04:04:15,320] Trial 497 pruned. Trial was pruned at iteration 0.
[I 2023-12-21 04:04:15,375] Trial 498 pruned. Trial was pruned at iteration 0.
[I 2023-12-21 04:04:15,430] Trial 499 pruned. Trial was pruned at iteration 0.
[W 2023-12-21 04:04:15,528] Trial 0 is omitted in visualization because its objective value is inf or nan.
[W 2023-12-21 04:04:15,528] Trial 1 is omitted in visualization because its objective value is inf or nan.
[W 2023-12-21 04:04:15,528] Trial 2 is omitted in visualization because its objective value is inf or nan.
[W 2023-12-21 04:04:15,528] Trial 4 is omitted in visualization because its objective value is inf or nan.
[W 2023-12-21 04:04:15,528] Trial 47 is omitted in visualization because its objective value is inf or nan.
[W 2023-12-21 04:04:15,528] Trial 51 is omitted in visualization because its objective value is inf or nan.
[W 2023-12-21 04:04:15,528] Trial 58 is omitted in visualization because its objective value is inf or nan.
[W 2023-12-21 04:04:15,529] Trial 63 is omitted in visualization because its objective value is inf or nan.
[W 2023-12-21 04:04:15,529] Trial 64 is omitted in visualization because its objective value is inf or nan.
[W 2023-12-21 04:04:15,529] Trial 94 is omitted in visualization because its objective value is inf or nan.
[W 2023-12-21 04:04:15,529] Trial 110 is omitted in visualization because its objective value is inf or nan.
[W 2023-12-21 04:04:15,529] Trial 123 is omitted in visualization because its objective value is inf or nan.
[W 2023-12-21 04:04:15,529] Trial 128 is omitted in visualization because its objective value is inf or nan.
[W 2023-12-21 04:04:15,529] Trial 141 is omitted in visualization because its objective value is inf or nan.
[W 2023-12-21 04:04:15,529] Trial 147 is omitted in visualization because its objective value is inf or nan.
[W 2023-12-21 04:04:15,529] Trial 149 is omitted in visualization because its objective value is inf or nan.
[W 2023-12-21 04:04:15,529] Trial 165 is omitted in visualization because its objective value is inf or nan.
[W 2023-12-21 04:04:15,529] Trial 171 is omitted in visualization because its objective value is inf or nan.
[W 2023-12-21 04:04:15,529] Trial 172 is omitted in visualization because its objective value is inf or nan.
[W 2023-12-21 04:04:15,529] Trial 183 is omitted in visualization because its objective value is inf or nan.
[W 2023-12-21 04:04:15,529] Trial 185 is omitted in visualization because its objective value is inf or nan.
[W 2023-12-21 04:04:15,529] Trial 191 is omitted in visualization because its objective value is inf or nan.
[W 2023-12-21 04:04:15,529] Trial 193 is omitted in visualization because its objective value is inf or nan.
[W 2023-12-21 04:04:15,529] Trial 194 is omitted in visualization because its objective value is inf or nan.
[W 2023-12-21 04:04:15,529] Trial 201 is omitted in visualization because its objective value is inf or nan.
[W 2023-12-21 04:04:15,529] Trial 209 is omitted in visualization because its objective value is inf or nan.
[W 2023-12-21 04:04:15,529] Trial 212 is omitted in visualization because its objective value is inf or nan.
[W 2023-12-21 04:04:15,530] Trial 215 is omitted in visualization because its objective value is inf or nan.
[W 2023-12-21 04:04:15,530] Trial 245 is omitted in visualization because its objective value is inf or nan.
[W 2023-12-21 04:04:15,530] Trial 259 is omitted in visualization because its objective value is inf or nan.
[W 2023-12-21 04:04:15,530] Trial 271 is omitted in visualization because its objective value is inf or nan.
[W 2023-12-21 04:04:15,530] Trial 287 is omitted in visualization because its objective value is inf or nan.
[W 2023-12-21 04:04:15,530] Trial 288 is omitted in visualization because its objective value is inf or nan.
[W 2023-12-21 04:04:15,530] Trial 295 is omitted in visualization because its objective value is inf or nan.
[W 2023-12-21 04:04:15,530] Trial 317 is omitted in visualization because its objective value is inf or nan.
[W 2023-12-21 04:04:15,530] Trial 370 is omitted in visualization because its objective value is inf or nan.
[W 2023-12-21 04:04:15,530] Trial 374 is omitted in visualization because its objective value is inf or nan.
[W 2023-12-21 04:04:15,530] Trial 381 is omitted in visualization because its objective value is inf or nan.
[W 2023-12-21 04:04:15,530] Trial 405 is omitted in visualization because its objective value is inf or nan.
[W 2023-12-21 04:04:15,530] Trial 440 is omitted in visualization because its objective value is inf or nan.
[W 2023-12-21 04:04:15,530] Trial 442 is omitted in visualization because its objective value is inf or nan.
exo-open: Cannot open display: .
/cvmfs/soft.computecanada.ca/gentoo/2020/usr/bin/xdg-open: line 871: x-www-browser: command not found
/cvmfs/soft.computecanada.ca/gentoo/2020/usr/bin/xdg-open: line 871: firefox: command not found
/cvmfs/soft.computecanada.ca/gentoo/2020/usr/bin/xdg-open: line 871: iceweasel: command not found
/cvmfs/soft.computecanada.ca/gentoo/2020/usr/bin/xdg-open: line 871: seamonkey: command not found
/cvmfs/soft.computecanada.ca/gentoo/2020/usr/bin/xdg-open: line 871: mozilla: command not found
/cvmfs/soft.computecanada.ca/gentoo/2020/usr/bin/xdg-open: line 871: epiphany: command not found
/cvmfs/soft.computecanada.ca/gentoo/2020/usr/bin/xdg-open: line 871: konqueror: command not found
/cvmfs/soft.computecanada.ca/gentoo/2020/usr/bin/xdg-open: line 871: chromium: command not found
/cvmfs/soft.computecanada.ca/gentoo/2020/usr/bin/xdg-open: line 871: chromium-browser: command not found
/cvmfs/soft.computecanada.ca/gentoo/2020/usr/bin/xdg-open: line 871: google-chrome: command not found
/cvmfs/soft.computecanada.ca/gentoo/2020/usr/bin/xdg-open: line 871: www-browser: command not found
/cvmfs/soft.computecanada.ca/gentoo/2020/usr/bin/xdg-open: line 871: links2: command not found
/home/lisat/.local/lib/python3.10/site-packages/xgboost/data.py:440: FutureWarning:

is_sparse is deprecated and will be removed in a future version. Check `isinstance(dtype, pd.SparseDtype)` instead.

[I 2023-12-21 04:04:18,311] A new study created in memory with name: no-name-4044e94f-fcac-4bb5-8cb2-8cfd66f2d36b
[I 2023-12-21 04:04:18,447] Trial 0 finished with value: 5.119571388687321 and parameters: {'learning_rate': 0.7054303625908036, 'aft_los                                                                     s_distribution': 'normal', 'aft_loss_distribution_scale': 4.123975962856669, 'max_depth': 8, 'booster': 'gbtree', 'scale_pos_weight': 0.3                                                                     810284396557039, 'alpha': 2.5921500894270895, 'lambda': 7.645205190507806, 'eta': 0.7310570480305234, 'sampling_method': 'gradient_based'                                                                     , 'subsample': 0.5711483683722937, 'gamma': 4.013050985137232}. Best is trial 0 with value: 5.119571388687321.
