[I 2023-12-21 04:30:32,230] Trial 323 finished with value: 2.0493052658712236 and parameters: {'learning_rate': 0.2907135954851947, 'aft_                                                                     loss_distribution': 'logistic', 'aft_loss_distribution_scale': 1.1303253353664742, 'max_depth': 8, 'booster': 'dart', 'scale_pos_weight':                                                                      1.918285146334923, 'alpha': 8.514882183485359, 'lambda': 8.335303582976366, 'eta': 0.35469714797565144, 'sampling_method': 'uniform', 's                                                                     ubsample': 0.810342599399374, 'gamma': 7.300272352582874}. Best is trial 224 with value: 2.032141281952214.
[I 2023-12-21 04:30:32,282] Trial 324 pruned. Trial was pruned at iteration 0.
[I 2023-12-21 04:30:32,327] Trial 325 pruned. Trial was pruned at iteration 0.
[I 2023-12-21 04:30:32,374] Trial 326 pruned. Trial was pruned at iteration 0.
[I 2023-12-21 04:30:32,423] Trial 327 pruned. Trial was pruned at iteration 0.
[I 2023-12-21 04:30:32,468] Trial 328 pruned. Trial was pruned at iteration 0.
[I 2023-12-21 04:30:32,518] Trial 329 pruned. Trial was pruned at iteration 0.
[I 2023-12-21 04:30:32,563] Trial 330 pruned. Trial was pruned at iteration 0.
[I 2023-12-21 04:30:32,615] Trial 331 pruned. Trial was pruned at iteration 0.
[I 2023-12-21 04:30:32,660] Trial 332 pruned. Trial was pruned at iteration 0.
[I 2023-12-21 04:30:32,707] Trial 333 pruned. Trial was pruned at iteration 0.
[I 2023-12-21 04:30:32,758] Trial 334 pruned. Trial was pruned at iteration 0.
[I 2023-12-21 04:30:47,697] Trial 335 finished with value: 2.0553332026203535 and parameters: {'learning_rate': 0.20573494073150536, 'aft                                                                     _loss_distribution': 'logistic', 'aft_loss_distribution_scale': 0.9541006854474723, 'max_depth': 8, 'booster': 'dart', 'scale_pos_weight'                                                                     : 1.8969372029802343, 'alpha': 8.098233680000721, 'lambda': 8.572166032526663, 'eta': 0.31146596382135416, 'sampling_method': 'uniform',                                                                      'subsample': 0.7677750020711256, 'gamma': 8.052349014056722}. Best is trial 224 with value: 2.032141281952214.
[I 2023-12-21 04:30:47,744] Trial 336 pruned. Trial was pruned at iteration 0.
[I 2023-12-21 04:30:47,797] Trial 337 pruned. Trial was pruned at iteration 0.
[I 2023-12-21 04:30:48,116] Trial 338 finished with value: 2.0510837223909695 and parameters: {'learning_rate': 0.17164427837784046, 'aft                                                                     _loss_distribution': 'logistic', 'aft_loss_distribution_scale': 0.9054025484040591, 'max_depth': 8, 'booster': 'gbtree', 'scale_pos_weigh                                                                     t': 2.008740765972346, 'alpha': 8.471250104277981, 'lambda': 8.433120678929516, 'eta': 0.3219406050130505, 'sampling_method': 'uniform',                                                                      'subsample': 0.848224687728874, 'gamma': 7.958456947582822}. Best is trial 224 with value: 2.032141281952214.
[I 2023-12-21 04:30:48,165] Trial 339 pruned. Trial was pruned at iteration 0.
[I 2023-12-21 04:30:48,214] Trial 340 pruned. Trial was pruned at iteration 0.
[I 2023-12-21 04:30:48,270] Trial 341 pruned. Trial was pruned at iteration 1.
[I 2023-12-21 04:30:48,316] Trial 342 pruned. Trial was pruned at iteration 0.
[I 2023-12-21 04:30:48,368] Trial 343 pruned. Trial was pruned at iteration 0.
[I 2023-12-21 04:30:48,789] Trial 344 finished with value: 2.029959700274326 and parameters: {'learning_rate': 0.20852855700354345, 'aft_                                                                     loss_distribution': 'logistic', 'aft_loss_distribution_scale': 0.944561102838914, 'max_depth': 8, 'booster': 'gbtree', 'scale_pos_weight'                                                                     : 1.8873238109722543, 'alpha': 8.23741628295481, 'lambda': 9.060343024661275, 'eta': 0.3280886567604197, 'sampling_method': 'uniform', 's                                                                     ubsample': 0.886171506896874, 'gamma': 6.76085251150018}. Best is trial 344 with value: 2.029959700274326.
[I 2023-12-21 04:30:48,845] Trial 345 pruned. Trial was pruned at iteration 0.
[I 2023-12-21 04:30:48,891] Trial 346 pruned. Trial was pruned at iteration 0.
[I 2023-12-21 04:30:48,936] Trial 347 pruned. Trial was pruned at iteration 0.
[I 2023-12-21 04:30:48,982] Trial 348 pruned. Trial was pruned at iteration 0.
[I 2023-12-21 04:30:49,027] Trial 349 pruned. Trial was pruned at iteration 0.
[I 2023-12-21 04:30:49,074] Trial 350 pruned. Trial was pruned at iteration 0.
[I 2023-12-21 04:30:51,085] Trial 351 finished with value: 2.036324151897935 and parameters: {'learning_rate': 0.18196854570580007, 'aft_                                                                     loss_distribution': 'logistic', 'aft_loss_distribution_scale': 0.9429086939305817, 'max_depth': 8, 'booster': 'dart', 'scale_pos_weight':                                                                      1.8533283697431424, 'alpha': 7.866479199818137, 'lambda': 8.66246997943007, 'eta': 0.2835414034600495, 'sampling_method': 'uniform', 'su                                                                     bsample': 0.912337934603607, 'gamma': 7.51408667444082}. Best is trial 344 with value: 2.029959700274326.
[I 2023-12-21 04:30:51,136] Trial 352 pruned. Trial was pruned at iteration 0.
[I 2023-12-21 04:30:51,182] Trial 353 pruned. Trial was pruned at iteration 0.
[I 2023-12-21 04:30:51,228] Trial 354 pruned. Trial was pruned at iteration 0.
[I 2023-12-21 04:30:51,286] Trial 355 pruned. Trial was pruned at iteration 0.
[I 2023-12-21 04:30:51,335] Trial 356 pruned. Trial was pruned at iteration 0.
[I 2023-12-21 04:30:51,383] Trial 357 pruned. Trial was pruned at iteration 0.
[I 2023-12-21 04:30:51,435] Trial 358 pruned. Trial was pruned at iteration 0.
[I 2023-12-21 04:30:51,481] Trial 359 pruned. Trial was pruned at iteration 0.
[I 2023-12-21 04:30:51,528] Trial 360 pruned. Trial was pruned at iteration 0.
[I 2023-12-21 04:30:51,576] Trial 361 pruned. Trial was pruned at iteration 0.
[I 2023-12-21 04:30:51,623] Trial 362 pruned. Trial was pruned at iteration 0.
[I 2023-12-21 04:30:51,675] Trial 363 pruned. Trial was pruned at iteration 0.
[I 2023-12-21 04:30:51,724] Trial 364 pruned. Trial was pruned at iteration 0.
[I 2023-12-21 04:30:51,773] Trial 365 pruned. Trial was pruned at iteration 0.
[I 2023-12-21 04:30:51,826] Trial 366 pruned. Trial was pruned at iteration 0.
[I 2023-12-21 04:30:51,873] Trial 367 pruned. Trial was pruned at iteration 0.
[I 2023-12-21 04:30:51,920] Trial 368 pruned. Trial was pruned at iteration 0.
[I 2023-12-21 04:30:51,967] Trial 369 pruned. Trial was pruned at iteration 0.
[I 2023-12-21 04:30:52,023] Trial 370 pruned. Trial was pruned at iteration 0.
[I 2023-12-21 04:30:52,076] Trial 371 pruned. Trial was pruned at iteration 0.
[I 2023-12-21 04:30:52,123] Trial 372 pruned. Trial was pruned at iteration 0.
[I 2023-12-21 04:30:52,170] Trial 373 pruned. Trial was pruned at iteration 0.
[I 2023-12-21 04:30:52,222] Trial 374 pruned. Trial was pruned at iteration 0.
[I 2023-12-21 04:30:52,269] Trial 375 pruned. Trial was pruned at iteration 0.
[I 2023-12-21 04:30:52,319] Trial 376 pruned. Trial was pruned at iteration 0.
[I 2023-12-21 04:30:52,376] Trial 377 pruned. Trial was pruned at iteration 0.
[I 2023-12-21 04:30:52,424] Trial 378 pruned. Trial was pruned at iteration 0.
[I 2023-12-21 04:30:52,471] Trial 379 pruned. Trial was pruned at iteration 0.
[I 2023-12-21 04:30:52,523] Trial 380 pruned. Trial was pruned at iteration 0.
[I 2023-12-21 04:30:52,571] Trial 381 pruned. Trial was pruned at iteration 0.
[I 2023-12-21 04:30:52,618] Trial 382 pruned. Trial was pruned at iteration 0.
[I 2023-12-21 04:30:52,670] Trial 383 pruned. Trial was pruned at iteration 0.
[I 2023-12-21 04:30:52,718] Trial 384 pruned. Trial was pruned at iteration 0.
[I 2023-12-21 04:30:52,766] Trial 385 pruned. Trial was pruned at iteration 0.
[I 2023-12-21 04:30:52,819] Trial 386 pruned. Trial was pruned at iteration 0.
[I 2023-12-21 04:31:01,208] Trial 387 finished with value: 2.0404488084313472 and parameters: {'learning_rate': 0.29700516443436903, 'aft                                                                     _loss_distribution': 'logistic', 'aft_loss_distribution_scale': 1.0532013028369307, 'max_depth': 7, 'booster': 'dart', 'scale_pos_weight'                                                                     : 2.0522071200563254, 'alpha': 8.083365386465442, 'lambda': 8.186719329720496, 'eta': 0.29669912106835095, 'sampling_method': 'uniform',                                                                      'subsample': 0.8502818794401008, 'gamma': 8.218105743599107}. Best is trial 344 with value: 2.029959700274326.
[I 2023-12-21 04:31:01,258] Trial 388 pruned. Trial was pruned at iteration 0.
[I 2023-12-21 04:31:03,390] Trial 389 finished with value: 2.0435466571215533 and parameters: {'learning_rate': 0.28885670084796766, 'aft                                                                     _loss_distribution': 'logistic', 'aft_loss_distribution_scale': 1.0896948202768462, 'max_depth': 9, 'booster': 'dart', 'scale_pos_weight'                                                                     : 2.326016813696529, 'alpha': 4.475631977190771, 'lambda': 8.426427403696417, 'eta': 0.28499006940824545, 'sampling_method': 'uniform', '                                                                     subsample': 0.8680848894618658, 'gamma': 8.541336748007632}. Best is trial 344 with value: 2.029959700274326.
[I 2023-12-21 04:31:03,442] Trial 390 pruned. Trial was pruned at iteration 0.
[I 2023-12-21 04:31:03,499] Trial 391 pruned. Trial was pruned at iteration 0.
[I 2023-12-21 04:31:03,547] Trial 392 pruned. Trial was pruned at iteration 0.
[I 2023-12-21 04:31:03,595] Trial 393 pruned. Trial was pruned at iteration 0.
[I 2023-12-21 04:31:03,647] Trial 394 pruned. Trial was pruned at iteration 0.
[I 2023-12-21 04:31:03,705] Trial 395 pruned. Trial was pruned at iteration 0.
[I 2023-12-21 04:31:05,942] Trial 396 finished with value: 2.0425231704885953 and parameters: {'learning_rate': 0.2752002223885404, 'aft_                                                                     loss_distribution': 'logistic', 'aft_loss_distribution_scale': 1.0952928533295565, 'max_depth': 6, 'booster': 'dart', 'scale_pos_weight':                                                                      1.8432746945397784, 'alpha': 8.467971081819279, 'lambda': 8.740846274654686, 'eta': 0.22397640748597242, 'sampling_method': 'uniform', '                                                                     subsample': 0.8679301030615213, 'gamma': 8.406138841637036}. Best is trial 344 with value: 2.029959700274326.
[I 2023-12-21 04:31:05,993] Trial 397 pruned. Trial was pruned at iteration 0.
[I 2023-12-21 04:31:06,051] Trial 398 pruned. Trial was pruned at iteration 0.
[I 2023-12-21 04:31:06,100] Trial 399 pruned. Trial was pruned at iteration 0.
[I 2023-12-21 04:31:06,152] Trial 400 pruned. Trial was pruned at iteration 0.
[I 2023-12-21 04:31:06,200] Trial 401 pruned. Trial was pruned at iteration 0.
[I 2023-12-21 04:31:06,250] Trial 402 pruned. Trial was pruned at iteration 0.
[I 2023-12-21 04:31:06,300] Trial 403 pruned. Trial was pruned at iteration 0.
[I 2023-12-21 04:31:06,351] Trial 404 pruned. Trial was pruned at iteration 0.
[I 2023-12-21 04:31:06,401] Trial 405 pruned. Trial was pruned at iteration 0.
[I 2023-12-21 04:31:06,452] Trial 406 pruned. Trial was pruned at iteration 0.
[I 2023-12-21 04:31:06,506] Trial 407 pruned. Trial was pruned at iteration 0.
[I 2023-12-21 04:31:10,241] Trial 408 finished with value: 2.0578803011714646 and parameters: {'learning_rate': 0.31829646852981053, 'aft                                                                     _loss_distribution': 'logistic', 'aft_loss_distribution_scale': 1.2209326693359404, 'max_depth': 3, 'booster': 'dart', 'scale_pos_weight'                                                                     : 2.003574098463778, 'alpha': 9.043758519726751, 'lambda': 2.5722903403943578, 'eta': 0.3344885148082896, 'sampling_method': 'uniform', '                                                                     subsample': 0.8080188680123478, 'gamma': 8.087043952064924}. Best is trial 344 with value: 2.029959700274326.
[I 2023-12-21 04:31:10,291] Trial 409 pruned. Trial was pruned at iteration 0.
[I 2023-12-21 04:31:10,342] Trial 410 pruned. Trial was pruned at iteration 0.
[I 2023-12-21 04:31:10,393] Trial 411 pruned. Trial was pruned at iteration 0.
[I 2023-12-21 04:31:10,443] Trial 412 pruned. Trial was pruned at iteration 0.
[I 2023-12-21 04:31:27,088] Trial 413 finished with value: 2.0313610848006403 and parameters: {'learning_rate': 0.14884080688707704, 'aft                                                                     _loss_distribution': 'logistic', 'aft_loss_distribution_scale': 0.8450029630372781, 'max_depth': 5, 'booster': 'dart', 'scale_pos_weight'                                                                     : 1.9644895799749797, 'alpha': 8.656720229211853, 'lambda': 2.8878894106191915, 'eta': 0.11962905191709516, 'sampling_method': 'uniform',                                                                      'subsample': 0.775054141557844, 'gamma': 7.255042588154649}. Best is trial 344 with value: 2.029959700274326.
[I 2023-12-21 04:31:27,144] Trial 414 pruned. Trial was pruned at iteration 0.
[I 2023-12-21 04:31:27,195] Trial 415 pruned. Trial was pruned at iteration 0.
[I 2023-12-21 04:31:27,245] Trial 416 pruned. Trial was pruned at iteration 0.
[I 2023-12-21 04:31:27,298] Trial 417 pruned. Trial was pruned at iteration 0.
[I 2023-12-21 04:31:27,352] Trial 418 pruned. Trial was pruned at iteration 0.
[I 2023-12-21 04:31:27,401] Trial 419 pruned. Trial was pruned at iteration 0.
[I 2023-12-21 04:31:27,451] Trial 420 pruned. Trial was pruned at iteration 0.
[I 2023-12-21 04:31:27,503] Trial 421 pruned. Trial was pruned at iteration 0.
[I 2023-12-21 04:31:27,555] Trial 422 pruned. Trial was pruned at iteration 0.
[I 2023-12-21 04:31:27,609] Trial 423 pruned. Trial was pruned at iteration 0.
[I 2023-12-21 04:31:27,658] Trial 424 pruned. Trial was pruned at iteration 0.
[I 2023-12-21 04:31:27,710] Trial 425 pruned. Trial was pruned at iteration 0.
[I 2023-12-21 04:31:27,760] Trial 426 pruned. Trial was pruned at iteration 0.
[I 2023-12-21 04:31:27,815] Trial 427 pruned. Trial was pruned at iteration 0.
[I 2023-12-21 04:31:27,866] Trial 428 pruned. Trial was pruned at iteration 0.
[I 2023-12-21 04:31:27,920] Trial 429 pruned. Trial was pruned at iteration 0.
[I 2023-12-21 04:31:27,970] Trial 430 pruned. Trial was pruned at iteration 0.
[I 2023-12-21 04:31:28,020] Trial 431 pruned. Trial was pruned at iteration 0.
[I 2023-12-21 04:31:28,075] Trial 432 pruned. Trial was pruned at iteration 0.
[I 2023-12-21 04:31:28,128] Trial 433 pruned. Trial was pruned at iteration 0.
[I 2023-12-21 04:31:28,178] Trial 434 pruned. Trial was pruned at iteration 0.
[I 2023-12-21 04:31:28,237] Trial 435 pruned. Trial was pruned at iteration 0.
[I 2023-12-21 04:31:28,304] Trial 436 pruned. Trial was pruned at iteration 2.
[I 2023-12-21 04:31:28,356] Trial 437 pruned. Trial was pruned at iteration 0.
[I 2023-12-21 04:31:28,411] Trial 438 pruned. Trial was pruned at iteration 0.
[I 2023-12-21 04:31:28,461] Trial 439 pruned. Trial was pruned at iteration 0.
[I 2023-12-21 04:31:28,512] Trial 440 pruned. Trial was pruned at iteration 0.
[I 2023-12-21 04:31:28,562] Trial 441 pruned. Trial was pruned at iteration 0.
[I 2023-12-21 04:31:28,619] Trial 442 pruned. Trial was pruned at iteration 0.
[I 2023-12-21 04:31:28,672] Trial 443 pruned. Trial was pruned at iteration 0.
[I 2023-12-21 04:31:28,722] Trial 444 pruned. Trial was pruned at iteration 0.
[I 2023-12-21 04:31:28,778] Trial 445 pruned. Trial was pruned at iteration 0.
[I 2023-12-21 04:31:28,829] Trial 446 pruned. Trial was pruned at iteration 0.
[I 2023-12-21 04:31:40,150] Trial 447 finished with value: 2.04781744114432 and parameters: {'learning_rate': 0.28383442464995995, 'aft_l                                                                     oss_distribution': 'logistic', 'aft_loss_distribution_scale': 1.092681523440302, 'max_depth': 6, 'booster': 'dart', 'scale_pos_weight': 1                                                                     .9043265761135784, 'alpha': 8.460756313393803, 'lambda': 2.436805574202599, 'eta': 0.32332384475314246, 'sampling_method': 'uniform', 'su                                                                     bsample': 0.7954688346936418, 'gamma': 7.976694692249662}. Best is trial 344 with value: 2.029959700274326.
[I 2023-12-21 04:31:40,204] Trial 448 pruned. Trial was pruned at iteration 0.
[I 2023-12-21 04:31:40,425] Trial 449 finished with value: 2.065319766668892 and parameters: {'learning_rate': 0.30541042949672115, 'aft_                                                                     loss_distribution': 'logistic', 'aft_loss_distribution_scale': 1.147509785871291, 'max_depth': 6, 'booster': 'gbtree', 'scale_pos_weight'                                                                     : 1.899328017092579, 'alpha': 9.904224272273536, 'lambda': 2.4722041618761117, 'eta': 0.33497497246213825, 'sampling_method': 'gradient_b                                                                     ased', 'subsample': 0.7654176674057372, 'gamma': 8.507366042001927}. Best is trial 344 with value: 2.029959700274326.
[I 2023-12-21 04:31:40,476] Trial 450 pruned. Trial was pruned at iteration 0.
[I 2023-12-21 04:31:40,529] Trial 451 pruned. Trial was pruned at iteration 0.
[I 2023-12-21 04:31:40,580] Trial 452 pruned. Trial was pruned at iteration 0.
[I 2023-12-21 04:31:40,635] Trial 453 pruned. Trial was pruned at iteration 0.
[I 2023-12-21 04:31:42,574] Trial 454 finished with value: 2.053888766636475 and parameters: {'learning_rate': 0.31243688623057453, 'aft_                                                                     loss_distribution': 'logistic', 'aft_loss_distribution_scale': 1.1637877806470696, 'max_depth': 6, 'booster': 'dart', 'scale_pos_weight':                                                                      1.9345797228370922, 'alpha': 7.996586123344231, 'lambda': 2.177066423921226, 'eta': 0.3717039666463154, 'sampling_method': 'uniform', 's                                                                     ubsample': 0.7595674191387631, 'gamma': 7.665046336633254}. Best is trial 344 with value: 2.029959700274326.
[I 2023-12-21 04:31:42,626] Trial 455 pruned. Trial was pruned at iteration 0.
[I 2023-12-21 04:31:42,682] Trial 456 pruned. Trial was pruned at iteration 0.
[I 2023-12-21 04:31:42,737] Trial 457 pruned. Trial was pruned at iteration 0.
[I 2023-12-21 04:31:42,791] Trial 458 pruned. Trial was pruned at iteration 0.
[I 2023-12-21 04:31:42,847] Trial 459 pruned. Trial was pruned at iteration 0.
[I 2023-12-21 04:31:42,900] Trial 460 pruned. Trial was pruned at iteration 0.
[I 2023-12-21 04:31:42,951] Trial 461 pruned. Trial was pruned at iteration 0.
[I 2023-12-21 04:31:43,006] Trial 462 pruned. Trial was pruned at iteration 0.
[I 2023-12-21 04:31:43,058] Trial 463 pruned. Trial was pruned at iteration 0.
[I 2023-12-21 04:31:45,273] Trial 464 finished with value: 2.057459854898119 and parameters: {'learning_rate': 0.3059383315557209, 'aft_l                                                                     oss_distribution': 'logistic', 'aft_loss_distribution_scale': 1.195687559760135, 'max_depth': 8, 'booster': 'dart', 'scale_pos_weight': 1                                                                     .8186033521941902, 'alpha': 3.3488343631277813, 'lambda': 2.227059913539854, 'eta': 0.24520710283226857, 'sampling_method': 'uniform', 's                                                                     ubsample': 0.8967913891793974, 'gamma': 7.662245188554301}. Best is trial 344 with value: 2.029959700274326.
[I 2023-12-21 04:31:45,329] Trial 465 pruned. Trial was pruned at iteration 0.
[I 2023-12-21 04:31:45,383] Trial 466 pruned. Trial was pruned at iteration 0.
[I 2023-12-21 04:31:47,567] Trial 467 finished with value: 2.0686728990999623 and parameters: {'learning_rate': 0.3393973912657599, 'aft_                                                                     loss_distribution': 'logistic', 'aft_loss_distribution_scale': 1.182580727782311, 'max_depth': 8, 'booster': 'dart', 'scale_pos_weight':                                                                      1.86213099836067, 'alpha': 0.9850363742387103, 'lambda': 1.965409531037988, 'eta': 0.22132055862751493, 'sampling_method': 'uniform', 'su                                                                     bsample': 0.8791287158637433, 'gamma': 7.468094209377046}. Best is trial 344 with value: 2.029959700274326.
[I 2023-12-21 04:31:47,621] Trial 468 pruned. Trial was pruned at iteration 0.
[I 2023-12-21 04:31:47,684] Trial 469 pruned. Trial was pruned at iteration 0.
