 trn1 0.3788692356285534 n= 12664
trn2 0.3602778654878434 n= 3167
val 0.37018319646241316 n= 3166
tst 0.3604716739297616 n= 19505
pos-neg-ratio: 0.37886923562855335 250 trials during Optuna search
All avail dimensionality reduced word embedding
All avail dimensionality reduced word embedding
All avail dimensionality reduced word embedding
All avail dimensionality reduced word embedding
trn1
trn2
val
[I 2023-12-21 00:04:47,597] A new study created in memory with name: no-name-ead3964d-99af-4088-92cc-d12f8d230f5e
tst
[I 2023-12-21 00:05:00,485] Trial 0 finished with value: inf and parameters: {'learning_rate': 0.8265936152940676, 'aft_loss_distribution': 'extreme', 'aft_loss_distribution_scale': 2.022161523025584, 'max_depth': 5, 'booster': 'dart', 'scale_pos_weight': 0.8869096852578038, 'alpha': 3.5486003214452677, 'lambda': 8.34237613358091, 'eta': 0.4018343643461396, 'sampling_method': 'uniform', 'subsample': 0.5301464446447995, 'gamma': 5.364835498094575}. Best is trial 0 with value: inf.
[I 2023-12-21 00:05:01,318] Trial 1 finished with value: 2.076273533371292 and parameters: {'learning_rate': 0.19842452180034062, 'aft_loss_distribution': 'extreme', 'aft_loss_distribution_scale': 2.161063207353834, 'max_depth': 8, 'booster': 'gbtree', 'scale_pos_weight': 1.4314154793436937, 'alpha': 8.199526423651337, 'lambda': 7.271353314640695, 'eta': 0.07590225905312631, 'sampling_method': 'gradient_based', 'subsample': 0.661181340539528, 'gamma': 2.3294215655985435}. Best is trial 1 with value: 2.076273533371292.
[I 2023-12-21 00:05:02,247] Trial 2 finished with value: 2.4234240141998216 and parameters: {'learning_rate': 0.4509145445520805, 'aft_loss_distribution': 'logistic', 'aft_loss_distribution_scale': 5.432821153461627, 'max_depth': 8, 'booster': 'gbtree', 'scale_pos_weight': 2.693063490424193, 'alpha': 2.8383272089683933, 'lambda': 5.225158965681417, 'eta': 0.28544978528079357, 'sampling_method': 'uniform', 'subsample': 0.9708750096318342, 'gamma': 4.229055418360242}. Best is trial 1 with value: 2.076273533371292.
[I 2023-12-21 00:05:12,051] Trial 3 finished with value: inf and parameters: {'learning_rate': 0.5757643717957456, 'aft_loss_distribution': 'normal', 'aft_loss_distribution_scale': 5.066590489402185, 'max_depth': 5, 'booster': 'dart', 'scale_pos_weight': 2.5772836225064455, 'alpha': 5.296695969529884, 'lambda': 8.157332181602563, 'eta': 0.5896444246262739, 'sampling_method': 'gradient_based', 'subsample': 0.9713633722540937, 'gamma': 5.898661068799882}. Best is trial 1 with value: 2.076273533371292.
[I 2023-12-21 00:05:13,189] Trial 4 finished with value: 1.937856811827349 and parameters: {'learning_rate': 0.24611397808928387, 'aft_loss_distribution': 'logistic', 'aft_loss_distribution_scale': 0.9872101805407743, 'max_depth': 6, 'booster': 'gbtree', 'scale_pos_weight': 0.8302370864820847, 'alpha': 6.899351773941585, 'lambda': 8.647761832646438, 'eta': 0.6741181858025146, 'sampling_method': 'uniform', 'subsample': 0.3883513756285272, 'gamma': 2.188114173222433}. Best is trial 4 with value: 1.937856811827349.
[I 2023-12-21 00:05:13,261] Trial 5 pruned. Trial was pruned at iteration 2.
[I 2023-12-21 00:05:13,327] Trial 6 pruned. Trial was pruned at iteration 1.
[I 2023-12-21 00:05:13,353] Trial 7 pruned. Trial was pruned at iteration 0.
[I 2023-12-21 00:05:13,389] Trial 8 pruned. Trial was pruned at iteration 0.
[I 2023-12-21 00:05:13,411] Trial 9 pruned. Trial was pruned at iteration 0.
[I 2023-12-21 00:05:13,540] Trial 10 pruned. Trial was pruned at iteration 0.
[I 2023-12-21 00:05:13,706] Trial 11 pruned. Trial was pruned at iteration 0.
[I 2023-12-21 00:05:13,866] Trial 12 pruned. Trial was pruned at iteration 0.
[I 2023-12-21 00:05:14,066] Trial 13 pruned. Trial was pruned at iteration 0.
[I 2023-12-21 00:05:14,225] Trial 14 pruned. Trial was pruned at iteration 0.
[I 2023-12-21 00:05:14,348] Trial 15 pruned. Trial was pruned at iteration 0.
[I 2023-12-21 00:05:14,461] Trial 16 pruned. Trial was pruned at iteration 0.
[I 2023-12-21 00:05:14,545] Trial 17 pruned. Trial was pruned at iteration 0.
[I 2023-12-21 00:05:14,662] Trial 18 pruned. Trial was pruned at iteration 0.
[I 2023-12-21 00:05:14,820] Trial 19 pruned. Trial was pruned at iteration 0.
[I 2023-12-21 00:05:14,964] Trial 20 pruned. Trial was pruned at iteration 0.
[I 2023-12-21 00:05:15,096] Trial 21 pruned. Trial was pruned at iteration 2.
[I 2023-12-21 00:05:15,189] Trial 22 pruned. Trial was pruned at iteration 0.
[I 2023-12-21 00:05:15,302] Trial 23 pruned. Trial was pruned at iteration 0.
[I 2023-12-21 00:05:15,440] Trial 24 pruned. Trial was pruned at iteration 3.
[I 2023-12-21 00:05:15,655] Trial 25 pruned. Trial was pruned at iteration 23.
[I 2023-12-21 00:05:15,813] Trial 26 pruned. Trial was pruned at iteration 2.
[I 2023-12-21 00:05:16,066] Trial 27 pruned. Trial was pruned at iteration 0.
[I 2023-12-21 00:05:16,418] Trial 28 pruned. Trial was pruned at iteration 0.
[I 2023-12-21 00:05:16,774] Trial 29 pruned. Trial was pruned at iteration 0.
[I 2023-12-21 00:05:16,954] Trial 30 pruned. Trial was pruned at iteration 0.
[I 2023-12-21 00:05:17,088] Trial 31 pruned. Trial was pruned at iteration 0.
[I 2023-12-21 00:05:17,277] Trial 32 pruned. Trial was pruned at iteration 0.
[I 2023-12-21 00:05:17,514] Trial 33 pruned. Trial was pruned at iteration 0.
[I 2023-12-21 00:05:17,750] Trial 34 pruned. Trial was pruned at iteration 1.
[I 2023-12-21 00:05:17,933] Trial 35 pruned. Trial was pruned at iteration 0.
[I 2023-12-21 00:05:18,807] Trial 36 pruned. Trial was pruned at iteration 19.
[I 2023-12-21 00:05:19,033] Trial 37 pruned. Trial was pruned at iteration 0.
[I 2023-12-21 00:05:19,205] Trial 38 pruned. Trial was pruned at iteration 0.
[I 2023-12-21 00:05:19,374] Trial 39 pruned. Trial was pruned at iteration 0.
[I 2023-12-21 00:05:19,539] Trial 40 pruned. Trial was pruned at iteration 0.
[I 2023-12-21 00:05:19,758] Trial 41 pruned. Trial was pruned at iteration 5.
[I 2023-12-21 00:05:19,900] Trial 42 pruned. Trial was pruned at iteration 2.
[I 2023-12-21 00:05:20,032] Trial 43 pruned. Trial was pruned at iteration 3.
[I 2023-12-21 00:05:20,251] Trial 44 pruned. Trial was pruned at iteration 0.
[I 2023-12-21 00:05:20,493] Trial 45 pruned. Trial was pruned at iteration 14.
[I 2023-12-21 00:05:20,732] Trial 46 pruned. Trial was pruned at iteration 0.
[I 2023-12-21 00:05:20,976] Trial 47 pruned. Trial was pruned at iteration 0.
[I 2023-12-21 00:05:21,209] Trial 48 pruned. Trial was pruned at iteration 0.
[I 2023-12-21 00:05:21,538] Trial 49 pruned. Trial was pruned at iteration 0.
[I 2023-12-21 00:05:21,823] Trial 50 pruned. Trial was pruned at iteration 0.
[I 2023-12-21 00:05:22,299] Trial 51 pruned. Trial was pruned at iteration 19.
[I 2023-12-21 00:05:22,597] Trial 52 pruned. Trial was pruned at iteration 0.
[I 2023-12-21 00:05:22,975] Trial 53 pruned. Trial was pruned at iteration 14.
[I 2023-12-21 00:05:23,181] Trial 54 pruned. Trial was pruned at iteration 0.
[I 2023-12-21 00:05:23,390] Trial 55 pruned. Trial was pruned at iteration 2.
[I 2023-12-21 00:05:23,868] Trial 56 pruned. Trial was pruned at iteration 18.
[I 2023-12-21 00:05:24,122] Trial 57 pruned. Trial was pruned at iteration 0.
[I 2023-12-21 00:05:24,598] Trial 58 pruned. Trial was pruned at iteration 2.
[I 2023-12-21 00:05:24,910] Trial 59 pruned. Trial was pruned at iteration 0.
[I 2023-12-21 00:05:25,227] Trial 60 pruned. Trial was pruned at iteration 2.
[I 2023-12-21 00:05:35,470] Trial 61 finished with value: 1.9403808768622375 and parameters: {'learning_rate': 0.6917227645169816, 'aft_loss_distribution': 'normal', 'aft_loss_distribution_scale': 1.6759468357622085, 'max_depth': 5, 'booster': 'dart', 'scale_pos_weight': 1.7989166850643628, 'alpha': 3.111112260639097, 'lambda': 4.407907801467049, 'eta': 0.299401847601019, 'sampling_method': 'uniform', 'subsample': 0.6853385359268355, 'gamma': 6.144740685036278}. Best is trial 4 with value: 1.937856811827349.
[I 2023-12-21 00:05:35,579] Trial 62 pruned. Trial was pruned at iteration 0.
[I 2023-12-21 00:05:35,682] Trial 63 pruned. Trial was pruned at iteration 0.
[I 2023-12-21 00:05:35,792] Trial 64 pruned. Trial was pruned at iteration 0.
[I 2023-12-21 00:05:41,377] Trial 65 finished with value: inf and parameters: {'learning_rate': 0.6156421434276775, 'aft_loss_distribution': 'normal', 'aft_loss_distribution_scale': 2.105813744493511, 'max_depth': 4, 'booster': 'dart', 'scale_pos_weight': 2.00673694347847, 'alpha': 3.898996899883089, 'lambda': 4.154196602134191, 'eta': 0.19516761540704344, 'sampling_method': 'uniform', 'subsample': 0.48271544267158906, 'gamma': 2.844987786526771}. Best is trial 4 with value: 1.937856811827349.
[I 2023-12-21 00:05:41,631] Trial 66 pruned. Trial was pruned at iteration 0.
[I 2023-12-21 00:05:41,849] Trial 67 pruned. Trial was pruned at iteration 0.
[I 2023-12-21 00:05:42,100] Trial 68 pruned. Trial was pruned at iteration 0.
[I 2023-12-21 00:05:42,296] Trial 69 pruned. Trial was pruned at iteration 0.
[I 2023-12-21 00:05:42,391] Trial 70 pruned. Trial was pruned at iteration 0.
[I 2023-12-21 00:05:42,481] Trial 71 pruned. Trial was pruned at iteration 0.
[I 2023-12-21 00:05:42,958] Trial 72 finished with value: 1.9688938125987234 and parameters: {'learning_rate': 0.7617105635222969, 'aft_loss_distribution': 'normal', 'aft_loss_distribution_scale': 2.0284834471973996, 'max_depth': 6, 'booster': 'gbtree', 'scale_pos_weight': 1.6979028167058845, 'alpha': 5.792263421219707, 'lambda': 8.191800807501664, 'eta': 0.3366754259653863, 'sampling_method': 'uniform', 'subsample': 0.3554980485939341, 'gamma': 4.4920093272283665}. Best is trial 4 with value: 1.937856811827349.
[I 2023-12-21 00:05:43,491] Trial 73 finished with value: inf and parameters: {'learning_rate': 0.7915482978125241, 'aft_loss_distribution': 'normal', 'aft_loss_distribution_scale': 1.371068083554672, 'max_depth': 6, 'booster': 'gbtree', 'scale_pos_weight': 2.077895948158315, 'alpha': 4.824840457408516, 'lambda': 8.126347194907721, 'eta': 0.30177448565700804, 'sampling_method': 'uniform', 'subsample': 0.3543745339065299, 'gamma': 4.554925895230702}. Best is trial 4 with value: 1.937856811827349.
[I 2023-12-21 00:05:43,641] Trial 74 pruned. Trial was pruned at iteration 3.
[I 2023-12-21 00:05:43,763] Trial 75 pruned. Trial was pruned at iteration 1.
[I 2023-12-21 00:05:43,910] Trial 76 pruned. Trial was pruned at iteration 0.
[I 2023-12-21 00:05:44,014] Trial 77 pruned. Trial was pruned at iteration 1.
[I 2023-12-21 00:05:44,175] Trial 78 pruned. Trial was pruned at iteration 0.
[I 2023-12-21 00:05:44,340] Trial 79 pruned. Trial was pruned at iteration 0.
[I 2023-12-21 00:05:44,502] Trial 80 pruned. Trial was pruned at iteration 0.
[I 2023-12-21 00:05:44,623] Trial 81 pruned. Trial was pruned at iteration 5.
[I 2023-12-21 00:05:45,080] Trial 82 finished with value: inf and parameters: {'learning_rate': 0.7980677656061621, 'aft_loss_distribution': 'normal', 'aft_loss_distribution_scale': 1.322526688567005, 'max_depth': 6, 'booster': 'gbtree', 'scale_pos_weight': 1.898237312624444, 'alpha': 5.752956081499216, 'lambda': 7.959045644899841, 'eta': 0.46449018206516196, 'sampling_method': 'uniform', 'subsample': 0.3580296352277132, 'gamma': 4.068805671736904}. Best is trial 4 with value: 1.937856811827349.
[I 2023-12-21 00:05:45,421] Trial 83 finished with value: inf and parameters: {'learning_rate': 0.7705036652051176, 'aft_loss_distribution': 'normal', 'aft_loss_distribution_scale': 1.4240696568623108, 'max_depth': 7, 'booster': 'gbtree', 'scale_pos_weight': 2.121877773457925, 'alpha': 4.95351118649555, 'lambda': 8.037589766287486, 'eta': 0.2753720173324234, 'sampling_method': 'uniform', 'subsample': 0.28794372751250247, 'gamma': 6.410130497527456}. Best is trial 4 with value: 1.937856811827349.
[I 2023-12-21 00:05:45,526] Trial 84 pruned. Trial was pruned at iteration 1.
[I 2023-12-21 00:05:45,627] Trial 85 pruned. Trial was pruned at iteration 1.
[I 2023-12-21 00:05:45,739] Trial 86 pruned. Trial was pruned at iteration 0.
[I 2023-12-21 00:05:45,930] Trial 87 pruned. Trial was pruned at iteration 0.
[I 2023-12-21 00:05:46,147] Trial 88 pruned. Trial was pruned at iteration 0.
[I 2023-12-21 00:05:46,313] Trial 89 pruned. Trial was pruned at iteration 0.
[I 2023-12-21 00:05:46,407] Trial 90 pruned. Trial was pruned at iteration 0.
[I 2023-12-21 00:05:46,877] Trial 91 finished with value: inf and parameters: {'learning_rate': 0.8015927486770037, 'aft_loss_distribution': 'normal', 'aft_loss_distribution_scale': 1.320027822736738, 'max_depth': 6, 'booster': 'gbtree', 'scale_pos_weight': 1.8579941298405467, 'alpha': 5.747123988566891, 'lambda': 7.879636639678142, 'eta': 0.46129962290026416, 'sampling_method': 'uniform', 'subsample': 0.38380657727301104, 'gamma': 4.036767673798653}. Best is trial 4 with value: 1.937856811827349.
[I 2023-12-21 00:05:46,995] Trial 92 pruned. Trial was pruned at iteration 0.
[I 2023-12-21 00:05:47,416] Trial 93 finished with value: inf and parameters: {'learning_rate': 0.7429352051590405, 'aft_loss_distribution': 'normal', 'aft_loss_distribution_scale': 1.5879503448194034, 'max_depth': 6, 'booster': 'gbtree', 'scale_pos_weight': 2.066051779026366, 'alpha': 5.729123077494756, 'lambda': 8.137876437107515, 'eta': 0.5081586172389061, 'sampling_method': 'uniform', 'subsample': 0.3650106990361561, 'gamma': 3.5896433052040635}. Best is trial 4 with value: 1.937856811827349.
[I 2023-12-21 00:05:47,587] Trial 94 pruned. Trial was pruned at iteration 6.
[I 2023-12-21 00:05:47,692] Trial 95 pruned. Trial was pruned at iteration 1.
[I 2023-12-21 00:05:47,791] Trial 96 pruned. Trial was pruned at iteration 0.
[I 2023-12-21 00:05:47,937] Trial 97 pruned. Trial was pruned at iteration 0.
[I 2023-12-21 00:05:48,143] Trial 98 pruned. Trial was pruned at iteration 2.
[I 2023-12-21 00:05:48,297] Trial 99 pruned. Trial was pruned at iteration 1.
[I 2023-12-21 00:05:48,428] Trial 100 pruned. Trial was pruned at iteration 0.
[I 2023-12-21 00:05:48,551] Trial 101 pruned. Trial was pruned at iteration 0.
[I 2023-12-21 00:05:48,650] Trial 102 pruned. Trial was pruned at iteration 0.
[I 2023-12-21 00:05:48,739] Trial 103 pruned. Trial was pruned at iteration 0.
[I 2023-12-21 00:05:48,878] Trial 104 pruned. Trial was pruned at iteration 2.
[I 2023-12-21 00:05:49,026] Trial 105 pruned. Trial was pruned at iteration 0.
[I 2023-12-21 00:05:49,213] Trial 106 pruned. Trial was pruned at iteration 0.
[I 2023-12-21 00:05:49,368] Trial 107 pruned. Trial was pruned at iteration 0.
[I 2023-12-21 00:05:49,470] Trial 108 pruned. Trial was pruned at iteration 1.
[I 2023-12-21 00:05:49,609] Trial 109 pruned. Trial was pruned at iteration 0.
[I 2023-12-21 00:05:49,716] Trial 110 pruned. Trial was pruned at iteration 0.
[I 2023-12-21 00:05:49,827] Trial 111 pruned. Trial was pruned at iteration 0.
[I 2023-12-21 00:05:49,965] Trial 112 pruned. Trial was pruned at iteration 4.
[I 2023-12-21 00:05:50,073] Trial 113 pruned. Trial was pruned at iteration 2.
[I 2023-12-21 00:05:50,491] Trial 114 finished with value: inf and parameters: {'learning_rate': 0.8447956808743774, 'aft_loss_distribution': 'normal', 'aft_loss_distribution_scale': 1.3801674686868814, 'max_depth': 5, 'booster': 'gbtree', 'scale_pos_weight': 1.6450333005402242, 'alpha': 5.789758980304068, 'lambda': 8.5348646548071, 'eta': 0.5546711126099837, 'sampling_method': 'uniform', 'subsample': 0.28247024443180696, 'gamma': 3.959096368329689}. Best is trial 4 with value: 1.937856811827349.
[I 2023-12-21 00:05:50,621] Trial 115 pruned. Trial was pruned at iteration 0.
[I 2023-12-21 00:05:50,719] Trial 116 pruned. Trial was pruned at iteration 0.
[I 2023-12-21 00:05:50,820] Trial 117 pruned. Trial was pruned at iteration 0.
[I 2023-12-21 00:05:50,942] Trial 118 pruned. Trial was pruned at iteration 0.
[I 2023-12-21 00:05:51,075] Trial 119 pruned. Trial was pruned at iteration 1.
[I 2023-12-21 00:05:51,198] Trial 120 pruned. Trial was pruned at iteration 0.
[I 2023-12-21 00:05:51,494] Trial 121 finished with value: inf and parameters: {'learning_rate': 0.751444738651004, 'aft_loss_distribution': 'normal', 'aft_loss_distribution_scale': 1.7009544488537436, 'max_depth': 6, 'booster': 'gbtree', 'scale_pos_weight': 2.1094155688610083, 'alpha': 5.793849950421048, 'lambda': 8.123119192502038, 'eta': 0.5090717346214347, 'sampling_method': 'uniform', 'subsample': 0.3654403457428211, 'gamma': 3.6205155362802843}. Best is trial 4 with value: 1.937856811827349.
[I 2023-12-21 00:05:51,554] Trial 122 pruned. Trial was pruned at iteration 0.
[I 2023-12-21 00:05:51,622] Trial 123 pruned. Trial was pruned at iteration 1.
[I 2023-12-21 00:05:51,684] Trial 124 pruned. Trial was pruned at iteration 1.
[I 2023-12-21 00:05:51,742] Trial 125 pruned. Trial was pruned at iteration 0.
[I 2023-12-21 00:05:51,803] Trial 126 pruned. Trial was pruned at iteration 0.
[I 2023-12-21 00:05:51,870] Trial 127 pruned. Trial was pruned at iteration 1.
[I 2023-12-21 00:05:51,927] Trial 128 pruned. Trial was pruned at iteration 0.
[I 2023-12-21 00:05:51,986] Trial 129 pruned. Trial was pruned at iteration 0.
[I 2023-12-21 00:05:52,056] Trial 130 pruned. Trial was pruned at iteration 0.
[I 2023-12-21 00:05:52,147] Trial 131 pruned. Trial was pruned at iteration 0.
[I 2023-12-21 00:05:52,476] Trial 132 finished with value: inf and parameters: {'learning_rate': 0.8434322317139475, 'aft_loss_distribution': 'normal', 'aft_loss_distribution_scale': 1.3749259286589008, 'max_depth': 5, 'booster': 'gbtree', 'scale_pos_weight': 1.8892112778010455, 'alpha': 5.575963467211785, 'lambda': 8.07799794845431, 'eta': 0.556929204279959, 'sampling_method': 'uniform', 'subsample': 0.3116454904992163, 'gamma': 3.736463966360498}. Best is trial 4 with value: 1.937856811827349.
[I 2023-12-21 00:05:52,771] Trial 133 finished with value: inf and parameters: {'learning_rate': 0.7960603043361043, 'aft_loss_distribution': 'normal', 'aft_loss_distribution_scale': 1.6120552263542498, 'max_depth': 5, 'booster': 'gbtree', 'scale_pos_weight': 1.6146838508061703, 'alpha': 6.300613184837336, 'lambda': 7.845133867502627, 'eta': 0.5191814291942028, 'sampling_method': 'uniform', 'subsample': 0.2651301241569217, 'gamma': 6.292624361401172}. Best is trial 4 with value: 1.937856811827349.
[I 2023-12-21 00:05:52,877] Trial 134 pruned. Trial was pruned at iteration 1.
[I 2023-12-21 00:05:52,976] Trial 135 pruned. Trial was pruned at iteration 0.
[I 2023-12-21 00:05:53,078] Trial 136 pruned. Trial was pruned at iteration 0.
[I 2023-12-21 00:05:53,171] Trial 137 pruned. Trial was pruned at iteration 0.
[I 2023-12-21 00:05:53,264] Trial 138 pruned. Trial was pruned at iteration 0.
[I 2023-12-21 00:05:53,364] Trial 139 pruned. Trial was pruned at iteration 1.
[I 2023-12-21 00:05:53,457] Trial 140 pruned. Trial was pruned at iteration 0.
[I 2023-12-21 00:05:53,557] Trial 141 pruned. Trial was pruned at iteration 1.
[I 2023-12-21 00:05:53,661] Trial 142 pruned. Trial was pruned at iteration 0.
[I 2023-12-21 00:05:53,993] Trial 143 finished with value: inf and parameters: {'learning_rate': 0.7820160360935858, 'aft_loss_distribution': 'normal', 'aft_loss_distribution_scale': 1.575323662937968, 'max_depth': 6, 'booster': 'gbtree', 'scale_pos_weight': 2.230749273461701, 'alpha': 5.109755195685431, 'lambda': 7.950392296404655, 'eta': 0.5029245982733748, 'sampling_method': 'uniform', 'subsample': 0.3713513194295922, 'gamma': 3.560336469782497}. Best is trial 4 with value: 1.937856811827349.
[I 2023-12-21 00:05:54,103] Trial 144 pruned. Trial was pruned at iteration 0.
[I 2023-12-21 00:05:54,198] Trial 145 pruned. Trial was pruned at iteration 0.
[I 2023-12-21 00:05:54,290] Trial 146 pruned. Trial was pruned at iteration 0.
[I 2023-12-21 00:05:54,386] Trial 147 pruned. Trial was pruned at iteration 1.
[I 2023-12-21 00:05:54,483] Trial 148 pruned. Trial was pruned at iteration 0.
[I 2023-12-21 00:05:54,579] Trial 149 pruned. Trial was pruned at iteration 1.
[I 2023-12-21 00:05:54,671] Trial 150 pruned. Trial was pruned at iteration 0.
[I 2023-12-21 00:05:54,768] Trial 151 pruned. Trial was pruned at iteration 2.
[I 2023-12-21 00:05:54,865] Trial 152 pruned. Trial was pruned at iteration 1.
[I 2023-12-21 00:05:54,955] Trial 153 pruned. Trial was pruned at iteration 0.
[I 2023-12-21 00:05:55,054] Trial 154 pruned. Trial was pruned at iteration 2.
[I 2023-12-21 00:05:55,387] Trial 155 finished with value: inf and parameters: {'learning_rate': 0.8274050199372539, 'aft_loss_distribution': 'normal', 'aft_loss_distribution_scale': 1.4570714721301519, 'max_depth': 5, 'booster': 'gbtree', 'scale_pos_weight': 1.7625215818705204, 'alpha': 2.9429930811887086, 'lambda': 7.99524770838888, 'eta': 0.5997688108575548, 'sampling_method': 'uniform', 'subsample': 0.33050211618559666, 'gamma': 4.493533175462189}. Best is trial 4 with value: 1.937856811827349.
[I 2023-12-21 00:05:55,498] Trial 156 pruned. Trial was pruned at iteration 1.
[I 2023-12-21 00:05:55,597] Trial 157 pruned. Trial was pruned at iteration 0.
[I 2023-12-21 00:05:55,687] Trial 158 pruned. Trial was pruned at iteration 0.
[I 2023-12-21 00:05:55,785] Trial 159 pruned. Trial was pruned at iteration 0.
[I 2023-12-21 00:05:55,881] Trial 160 pruned. Trial was pruned at iteration 0.
[I 2023-12-21 00:05:56,207] Trial 161 finished with value: 1.939342317985336 and parameters: {'learning_rate': 0.8034472828808901, 'aft_loss_distribution': 'normal', 'aft_loss_distribution_scale': 1.5902945987475, 'max_depth': 5, 'booster': 'gbtree', 'scale_pos_weight': 1.3958255182019883, 'alpha': 6.353542929892345, 'lambda': 7.751764228314561, 'eta': 0.5220495645585727, 'sampling_method': 'uniform', 'subsample': 0.2751171816147972, 'gamma': 6.2821251715822175}. Best is trial 4 with value: 1.937856811827349.
