[I 2023-12-18 22:52:39,992] Trial 124 finished with value: 4.341022016294704 and parameters: {'learning_rate': 0.2595525311887594, 'aft_loss_distribution': 'logistic', 'aft_loss_distribution_scale': 0.9086765395994189, 'max_depth': 7, 'booster': 'gbtree', 'scale_pos_weight': 8.194431141435112, 'alpha': 1.766808796076711, 'lambda': 2.881058677711364, 'eta': 0.7858102459483762, 'sampling_method': 'uniform', 'subsample': 0.5215481165359597, 'gamma': 7.087315927611289}. Best is trial 34 with value: 4.30679442519153.
[I 2023-12-18 22:52:40,058] Trial 125 pruned. Trial was pruned at iteration 0.
[I 2023-12-18 22:52:40,652] Trial 126 finished with value: 4.329397813232012 and parameters: {'learning_rate': 0.2394174321474113, 'aft_loss_distribution': 'logistic', 'aft_loss_distribution_scale': 0.8551668367672022, 'max_depth': 7, 'booster': 'gbtree', 'scale_pos_weight': 7.758891635947582, 'alpha': 1.2482058089139967, 'lambda': 2.859741164858493, 'eta': 0.8343503365261502, 'sampling_method': 'uniform', 'subsample': 0.6034134722726269, 'gamma': 7.629749073160086}. Best is trial 34 with value: 4.30679442519153.
[I 2023-12-18 22:52:40,735] Trial 127 pruned. Trial was pruned at iteration 0.
[I 2023-12-18 22:52:40,793] Trial 128 pruned. Trial was pruned at iteration 0.
[I 2023-12-18 22:52:40,854] Trial 129 pruned. Trial was pruned at iteration 0.
[I 2023-12-18 22:52:40,919] Trial 130 pruned. Trial was pruned at iteration 0.
[I 2023-12-18 22:52:41,206] Trial 131 finished with value: 4.359353314444052 and parameters: {'learning_rate': 0.25552409257352804, 'aft_loss_distribution': 'logistic', 'aft_loss_distribution_scale': 0.9395269875431116, 'max_depth': 7, 'booster': 'gbtree', 'scale_pos_weight': 7.542433587642613, 'alpha': 1.5939855338007392, 'lambda': 3.026697663128869, 'eta': 0.861353611088475, 'sampling_method': 'uniform', 'subsample': 0.6334502587695777, 'gamma': 7.546955168787868}. Best is trial 34 with value: 4.30679442519153.
[I 2023-12-18 22:52:41,500] Trial 132 finished with value: 4.3416102804012855 and parameters: {'learning_rate': 0.25437061145922796, 'aft_loss_distribution': 'logistic', 'aft_loss_distribution_scale': 0.9163534508901825, 'max_depth': 7, 'booster': 'gbtree', 'scale_pos_weight': 8.068302189841221, 'alpha': 2.3335565128140767, 'lambda': 2.5820189075569075, 'eta': 0.8515548637230566, 'sampling_method': 'uniform', 'subsample': 0.6177341723628438, 'gamma': 6.778519725091436}. Best is trial 34 with value: 4.30679442519153.
[I 2023-12-18 22:52:41,566] Trial 133 pruned. Trial was pruned at iteration 0.
[I 2023-12-18 22:52:41,623] Trial 134 pruned. Trial was pruned at iteration 0.
[I 2023-12-18 22:52:41,682] Trial 135 pruned. Trial was pruned at iteration 0.
[I 2023-12-18 22:52:41,749] Trial 136 pruned. Trial was pruned at iteration 0.
[I 2023-12-18 22:52:41,807] Trial 137 pruned. Trial was pruned at iteration 0.
[I 2023-12-18 22:52:41,877] Trial 138 pruned. Trial was pruned at iteration 0.
[I 2023-12-18 22:52:41,936] Trial 139 pruned. Trial was pruned at iteration 0.
[I 2023-12-18 22:52:42,006] Trial 140 pruned. Trial was pruned at iteration 2.
[I 2023-12-18 22:52:42,335] Trial 141 finished with value: 4.367195249396696 and parameters: {'learning_rate': 0.2890098100288386, 'aft_loss_distribution': 'logistic', 'aft_loss_distribution_scale': 0.9527579069811302, 'max_depth': 7, 'booster': 'gbtree', 'scale_pos_weight': 7.585308751956101, 'alpha': 1.5840106919999468, 'lambda': 2.856888980553881, 'eta': 0.8954581376631505, 'sampling_method': 'uniform', 'subsample': 0.6569478366180941, 'gamma': 7.254808369442052}. Best is trial 34 with value: 4.30679442519153.
[I 2023-12-18 22:52:42,576] Trial 142 finished with value: 4.366693687544363 and parameters: {'learning_rate': 0.2663784133865671, 'aft_loss_distribution': 'logistic', 'aft_loss_distribution_scale': 0.9589020099605534, 'max_depth': 7, 'booster': 'gbtree', 'scale_pos_weight': 7.632903788344562, 'alpha': 1.9268868537281654, 'lambda': 2.7112697617281585, 'eta': 0.885432835119302, 'sampling_method': 'uniform', 'subsample': 0.6630577978934995, 'gamma': 4.590473135979724}. Best is trial 34 with value: 4.30679442519153.
[I 2023-12-18 22:52:42,642] Trial 143 pruned. Trial was pruned at iteration 0.
[I 2023-12-18 22:52:43,217] Trial 144 finished with value: 4.35186111310742 and parameters: {'learning_rate': 0.18808603391610212, 'aft_loss_distribution': 'logistic', 'aft_loss_distribution_scale': 0.9370645973535698, 'max_depth': 7, 'booster': 'gbtree', 'scale_pos_weight': 7.891211348492798, 'alpha': 1.036627993919089, 'lambda': 3.0793077513857874, 'eta': 0.8822386588480612, 'sampling_method': 'uniform', 'subsample': 0.6337521082346391, 'gamma': 4.74948273833214}. Best is trial 34 with value: 4.30679442519153.
[I 2023-12-18 22:52:43,287] Trial 145 pruned. Trial was pruned at iteration 0.
[I 2023-12-18 22:52:43,356] Trial 146 pruned. Trial was pruned at iteration 0.
[I 2023-12-18 22:52:43,420] Trial 147 pruned. Trial was pruned at iteration 0.
[I 2023-12-18 22:52:43,481] Trial 148 pruned. Trial was pruned at iteration 0.
[I 2023-12-18 22:52:43,542] Trial 149 pruned. Trial was pruned at iteration 0.
[I 2023-12-18 22:52:43,605] Trial 150 pruned. Trial was pruned at iteration 0.
[I 2023-12-18 22:52:43,837] Trial 151 finished with value: 4.367354007860502 and parameters: {'learning_rate': 0.27593036078688093, 'aft_loss_distribution': 'logistic', 'aft_loss_distribution_scale': 0.9563798808078319, 'max_depth': 7, 'booster': 'gbtree', 'scale_pos_weight': 7.5645581528179155, 'alpha': 2.0728011280244187, 'lambda': 2.819914122845323, 'eta': 0.8610630102004033, 'sampling_method': 'uniform', 'subsample': 0.7390458240087876, 'gamma': 5.88124257660616}. Best is trial 34 with value: 4.30679442519153.
[I 2023-12-18 22:52:44,104] Trial 152 finished with value: 4.35801102849296 and parameters: {'learning_rate': 0.2522309062780131, 'aft_loss_distribution': 'logistic', 'aft_loss_distribution_scale': 0.9439919763594186, 'max_depth': 7, 'booster': 'gbtree', 'scale_pos_weight': 7.690956253352161, 'alpha': 2.1250900759125124, 'lambda': 2.667274572635517, 'eta': 0.9303224353668694, 'sampling_method': 'uniform', 'subsample': 0.6031443867346513, 'gamma': 5.955637436240451}. Best is trial 34 with value: 4.30679442519153.
[I 2023-12-18 22:52:44,540] Trial 153 pruned. Trial was pruned at iteration 183.
[I 2023-12-18 22:52:44,605] Trial 154 pruned. Trial was pruned at iteration 0.
[I 2023-12-18 22:52:44,667] Trial 155 pruned. Trial was pruned at iteration 0.
[I 2023-12-18 22:52:44,729] Trial 156 pruned. Trial was pruned at iteration 0.
[I 2023-12-18 22:52:44,799] Trial 157 pruned. Trial was pruned at iteration 0.
[I 2023-12-18 22:52:44,863] Trial 158 pruned. Trial was pruned at iteration 0.
[I 2023-12-18 22:52:44,925] Trial 159 pruned. Trial was pruned at iteration 0.
[I 2023-12-18 22:52:44,985] Trial 160 pruned. Trial was pruned at iteration 0.
[I 2023-12-18 22:52:45,062] Trial 161 pruned. Trial was pruned at iteration 0.
[I 2023-12-18 22:52:45,127] Trial 162 pruned. Trial was pruned at iteration 0.
[I 2023-12-18 22:52:45,552] Trial 163 pruned. Trial was pruned at iteration 183.
[I 2023-12-18 22:52:45,627] Trial 164 pruned. Trial was pruned at iteration 0.
[I 2023-12-18 22:52:45,699] Trial 165 pruned. Trial was pruned at iteration 0.
[I 2023-12-18 22:52:45,762] Trial 166 pruned. Trial was pruned at iteration 0.
[I 2023-12-18 22:52:45,833] Trial 167 pruned. Trial was pruned at iteration 0.
[I 2023-12-18 22:52:45,904] Trial 168 pruned. Trial was pruned at iteration 0.
[I 2023-12-18 22:52:45,968] Trial 169 pruned. Trial was pruned at iteration 0.
[I 2023-12-18 22:52:46,197] Trial 170 finished with value: 4.408530454898408 and parameters: {'learning_rate': 0.3026839530714953, 'aft_loss_distribution': 'logistic', 'aft_loss_distribution_scale': 1.02801680718783, 'max_depth': 7, 'booster': 'gbtree', 'scale_pos_weight': 7.259634387703443, 'alpha': 1.761015113014887, 'lambda': 3.1762794503835132, 'eta': 0.778462617195641, 'sampling_method': 'uniform', 'subsample': 0.6774016681265711, 'gamma': 4.828667635981594}. Best is trial 34 with value: 4.30679442519153.
[I 2023-12-18 22:52:46,265] Trial 171 pruned. Trial was pruned at iteration 0.
[I 2023-12-18 22:52:46,487] Trial 172 finished with value: 4.414936193914982 and parameters: {'learning_rate': 0.26949324549793013, 'aft_loss_distribution': 'logistic', 'aft_loss_distribution_scale': 1.0363170863864952, 'max_depth': 7, 'booster': 'gbtree', 'scale_pos_weight': 7.560409472494638, 'alpha': 1.8474648512459184, 'lambda': 2.6815784609282844, 'eta': 0.8515091321459158, 'sampling_method': 'uniform', 'subsample': 0.7125634869606907, 'gamma': 7.064264754067559}. Best is trial 34 with value: 4.30679442519153.
[I 2023-12-18 22:52:46,564] Trial 173 pruned. Trial was pruned at iteration 0.
[I 2023-12-18 22:52:46,635] Trial 174 pruned. Trial was pruned at iteration 0.
[I 2023-12-18 22:52:46,706] Trial 175 pruned. Trial was pruned at iteration 0.
[I 2023-12-18 22:52:46,785] Trial 176 pruned. Trial was pruned at iteration 0.
[I 2023-12-18 22:52:46,867] Trial 177 pruned. Trial was pruned at iteration 0.
[I 2023-12-18 22:52:46,934] Trial 178 pruned. Trial was pruned at iteration 0.
[I 2023-12-18 22:52:47,425] Trial 179 pruned. Trial was pruned at iteration 183.
[I 2023-12-18 22:52:47,492] Trial 180 pruned. Trial was pruned at iteration 0.
[I 2023-12-18 22:52:47,571] Trial 181 pruned. Trial was pruned at iteration 8.
[I 2023-12-18 22:52:47,635] Trial 182 pruned. Trial was pruned at iteration 0.
[I 2023-12-18 22:52:47,708] Trial 183 pruned. Trial was pruned at iteration 0.
[I 2023-12-18 22:52:47,772] Trial 184 pruned. Trial was pruned at iteration 0.
[I 2023-12-18 22:52:47,834] Trial 185 pruned. Trial was pruned at iteration 0.
[I 2023-12-18 22:52:47,915] Trial 186 pruned. Trial was pruned at iteration 0.
[I 2023-12-18 22:52:47,983] Trial 187 pruned. Trial was pruned at iteration 2.
[I 2023-12-18 22:52:48,049] Trial 188 pruned. Trial was pruned at iteration 0.
[I 2023-12-18 22:52:48,119] Trial 189 pruned. Trial was pruned at iteration 0.
[I 2023-12-18 22:52:48,184] Trial 190 pruned. Trial was pruned at iteration 0.
[I 2023-12-18 22:52:48,561] Trial 191 pruned. Trial was pruned at iteration 164.
[I 2023-12-18 22:52:48,629] Trial 192 pruned. Trial was pruned at iteration 0.
[I 2023-12-18 22:52:49,044] Trial 193 pruned. Trial was pruned at iteration 183.
[I 2023-12-18 22:52:49,116] Trial 194 pruned. Trial was pruned at iteration 0.
[I 2023-12-18 22:52:49,177] Trial 195 pruned. Trial was pruned at iteration 0.
[I 2023-12-18 22:52:49,250] Trial 196 pruned. Trial was pruned at iteration 0.
[I 2023-12-18 22:52:49,311] Trial 197 pruned. Trial was pruned at iteration 0.
[I 2023-12-18 22:52:49,377] Trial 198 pruned. Trial was pruned at iteration 0.
[I 2023-12-18 22:52:49,801] Trial 199 pruned. Trial was pruned at iteration 183.
[I 2023-12-18 22:52:49,869] Trial 200 pruned. Trial was pruned at iteration 0.
[I 2023-12-18 22:52:49,959] Trial 201 pruned. Trial was pruned at iteration 4.
[I 2023-12-18 22:52:50,075] Trial 202 pruned. Trial was pruned at iteration 0.
[I 2023-12-18 22:52:50,180] Trial 203 pruned. Trial was pruned at iteration 2.
[I 2023-12-18 22:52:50,289] Trial 204 pruned. Trial was pruned at iteration 0.
[I 2023-12-18 22:52:50,397] Trial 205 pruned. Trial was pruned at iteration 0.
[I 2023-12-18 22:52:50,496] Trial 206 pruned. Trial was pruned at iteration 0.
[I 2023-12-18 22:52:50,601] Trial 207 pruned. Trial was pruned at iteration 0.
[I 2023-12-18 22:52:50,706] Trial 208 pruned. Trial was pruned at iteration 0.
[I 2023-12-18 22:52:50,817] Trial 209 pruned. Trial was pruned at iteration 0.
[I 2023-12-18 22:52:50,933] Trial 210 pruned. Trial was pruned at iteration 0.
[I 2023-12-18 22:52:51,059] Trial 211 pruned. Trial was pruned at iteration 4.
[I 2023-12-18 22:52:51,159] Trial 212 pruned. Trial was pruned at iteration 0.
[I 2023-12-18 22:52:51,538] Trial 213 finished with value: 4.356342030304404 and parameters: {'learning_rate': 0.27241844611979804, 'aft_loss_distribution': 'logistic', 'aft_loss_distribution_scale': 0.941656744318363, 'max_depth': 8, 'booster': 'gbtree', 'scale_pos_weight': 7.523404658259468, 'alpha': 1.6404580767833272, 'lambda': 2.622666741285891, 'eta': 0.9069485745200807, 'sampling_method': 'uniform', 'subsample': 0.6427997007989856, 'gamma': 6.92646219979384}. Best is trial 34 with value: 4.30679442519153.
[I 2023-12-18 22:52:51,641] Trial 214 pruned. Trial was pruned at iteration 0.
[I 2023-12-18 22:52:52,040] Trial 215 finished with value: 4.3329571784418714 and parameters: {'learning_rate': 0.25110913012389685, 'aft_loss_distribution': 'logistic', 'aft_loss_distribution_scale': 0.8982571009196644, 'max_depth': 7, 'booster': 'gbtree', 'scale_pos_weight': 7.569530812471273, 'alpha': 1.6795347006129155, 'lambda': 4.60034119112614, 'eta': 0.8712314047804957, 'sampling_method': 'uniform', 'subsample': 0.6378526744409554, 'gamma': 6.97623233009512}. Best is trial 34 with value: 4.30679442519153.
[I 2023-12-18 22:52:52,466] Trial 216 finished with value: 4.315306815217304 and parameters: {'learning_rate': 0.22470220349015244, 'aft_loss_distribution': 'logistic', 'aft_loss_distribution_scale': 0.865099142440881, 'max_depth': 7, 'booster': 'gbtree', 'scale_pos_weight': 8.081095547064402, 'alpha': 1.212242607429471, 'lambda': 4.588262935267805, 'eta': 0.9053387378054722, 'sampling_method': 'uniform', 'subsample': 0.6337088930951255, 'gamma': 6.712674075432629}. Best is trial 34 with value: 4.30679442519153.
[I 2023-12-18 22:52:53,191] Trial 217 finished with value: 4.318619565771039 and parameters: {'learning_rate': 0.22066068977208433, 'aft_loss_distribution': 'logistic', 'aft_loss_distribution_scale': 0.8710145267817602, 'max_depth': 7, 'booster': 'gbtree', 'scale_pos_weight': 8.170489628420965, 'alpha': 1.1782183006505895, 'lambda': 4.703768617905165, 'eta': 0.9136092466125859, 'sampling_method': 'uniform', 'subsample': 0.6333913565889235, 'gamma': 6.647267422821688}. Best is trial 34 with value: 4.30679442519153.
[I 2023-12-18 22:52:53,307] Trial 218 pruned. Trial was pruned at iteration 0.
[I 2023-12-18 22:52:53,421] Trial 219 pruned. Trial was pruned at iteration 0.
[I 2023-12-18 22:52:53,528] Trial 220 pruned. Trial was pruned at iteration 0.
[I 2023-12-18 22:52:54,283] Trial 221 finished with value: 4.331261966209584 and parameters: {'learning_rate': 0.24159232006556136, 'aft_loss_distribution': 'logistic', 'aft_loss_distribution_scale': 0.8946529310690947, 'max_depth': 7, 'booster': 'gbtree', 'scale_pos_weight': 7.993129273313704, 'alpha': 1.073712267408847, 'lambda': 4.797326365996361, 'eta': 0.9036342645871259, 'sampling_method': 'uniform', 'subsample': 0.6329683591271507, 'gamma': 6.91165000630811}. Best is trial 34 with value: 4.30679442519153.
[I 2023-12-18 22:52:54,398] Trial 222 pruned. Trial was pruned at iteration 0.
[I 2023-12-18 22:52:54,509] Trial 223 pruned. Trial was pruned at iteration 0.
[I 2023-12-18 22:52:54,959] Trial 224 finished with value: 4.333267962045065 and parameters: {'learning_rate': 0.2449868227062201, 'aft_loss_distribution': 'logistic', 'aft_loss_distribution_scale': 0.8984135052802499, 'max_depth': 7, 'booster': 'gbtree', 'scale_pos_weight': 8.52667223228769, 'alpha': 1.1000294795261971, 'lambda': 4.267578043977876, 'eta': 0.8887896314296327, 'sampling_method': 'uniform', 'subsample': 0.6348042127360848, 'gamma': 6.388563794467055}. Best is trial 34 with value: 4.30679442519153.
[I 2023-12-18 22:52:55,637] Trial 225 pruned. Trial was pruned at iteration 294.
[I 2023-12-18 22:52:55,705] Trial 226 pruned. Trial was pruned at iteration 0.
[I 2023-12-18 22:52:55,777] Trial 227 pruned. Trial was pruned at iteration 0.
[I 2023-12-18 22:52:55,846] Trial 228 pruned. Trial was pruned at iteration 0.
[I 2023-12-18 22:52:55,920] Trial 229 pruned. Trial was pruned at iteration 0.
[I 2023-12-18 22:52:55,997] Trial 230 pruned. Trial was pruned at iteration 0.
[I 2023-12-18 22:52:56,072] Trial 231 pruned. Trial was pruned at iteration 0.
[I 2023-12-18 22:52:56,333] Trial 232 pruned. Trial was pruned at iteration 94.
[I 2023-12-18 22:52:56,406] Trial 233 pruned. Trial was pruned at iteration 0.
[I 2023-12-18 22:52:56,478] Trial 234 pruned. Trial was pruned at iteration 0.
[I 2023-12-18 22:52:56,547] Trial 235 pruned. Trial was pruned at iteration 0.
[I 2023-12-18 22:52:56,614] Trial 236 pruned. Trial was pruned at iteration 0.
[I 2023-12-18 22:52:56,684] Trial 237 pruned. Trial was pruned at iteration 0.
[I 2023-12-18 22:52:56,758] Trial 238 pruned. Trial was pruned at iteration 0.
[I 2023-12-18 22:52:56,823] Trial 239 pruned. Trial was pruned at iteration 0.
[I 2023-12-18 22:52:56,893] Trial 240 pruned. Trial was pruned at iteration 0.
[I 2023-12-18 22:52:57,117] Trial 241 pruned. Trial was pruned at iteration 79.
[I 2023-12-18 22:52:57,190] Trial 242 pruned. Trial was pruned at iteration 0.
[I 2023-12-18 22:52:57,272] Trial 243 pruned. Trial was pruned at iteration 0.
[I 2023-12-18 22:52:57,583] Trial 244 finished with value: 4.342742621200465 and parameters: {'learning_rate': 0.2666583234290836, 'aft_loss_distribution': 'logistic', 'aft_loss_distribution_scale': 0.9130968684285494, 'max_depth': 7, 'booster': 'gbtree', 'scale_pos_weight': 7.569372061926137, 'alpha': 5.803369360100231, 'lambda': 4.745871642718762, 'eta': 0.8899361571128469, 'sampling_method': 'uniform', 'subsample': 0.6343298800752426, 'gamma': 8.881000807429723}. Best is trial 34 with value: 4.30679442519153.
[I 2023-12-18 22:52:57,655] Trial 245 pruned. Trial was pruned at iteration 0.
[I 2023-12-18 22:52:57,736] Trial 246 pruned. Trial was pruned at iteration 0.
[I 2023-12-18 22:52:57,803] Trial 247 pruned. Trial was pruned at iteration 0.
[I 2023-12-18 22:52:57,872] Trial 248 pruned. Trial was pruned at iteration 0.
[I 2023-12-18 22:52:57,945] Trial 249 pruned. Trial was pruned at iteration 0.
[I 2023-12-18 22:52:58,014] Trial 250 pruned. Trial was pruned at iteration 0.
[I 2023-12-18 22:52:58,278] Trial 251 pruned. Trial was pruned at iteration 90.
[I 2023-12-18 22:52:58,350] Trial 252 pruned. Trial was pruned at iteration 0.
[I 2023-12-18 22:52:58,424] Trial 253 pruned. Trial was pruned at iteration 0.
[I 2023-12-18 22:52:58,495] Trial 254 pruned. Trial was pruned at iteration 0.
[I 2023-12-18 22:52:58,564] Trial 255 pruned. Trial was pruned at iteration 0.
[I 2023-12-18 22:52:58,635] Trial 256 pruned. Trial was pruned at iteration 0.
[I 2023-12-18 22:52:58,704] Trial 257 pruned. Trial was pruned at iteration 0.
[I 2023-12-18 22:52:58,774] Trial 258 pruned. Trial was pruned at iteration 0.
[I 2023-12-18 22:52:58,851] Trial 259 pruned. Trial was pruned at iteration 0.
[I 2023-12-18 22:52:58,928] Trial 260 pruned. Trial was pruned at iteration 0.
[I 2023-12-18 22:52:59,014] Trial 261 pruned. Trial was pruned at iteration 0.
[I 2023-12-18 22:52:59,212] Trial 262 pruned. Trial was pruned at iteration 59.
[I 2023-12-18 22:52:59,301] Trial 263 pruned. Trial was pruned at iteration 0.
[I 2023-12-18 22:52:59,377] Trial 264 pruned. Trial was pruned at iteration 0.
[I 2023-12-18 22:52:59,456] Trial 265 pruned. Trial was pruned at iteration 0.
[I 2023-12-18 22:52:59,524] Trial 266 pruned. Trial was pruned at iteration 0.
[I 2023-12-18 22:52:59,593] Trial 267 pruned. Trial was pruned at iteration 0.
[I 2023-12-18 22:52:59,666] Trial 268 pruned. Trial was pruned at iteration 0.
[I 2023-12-18 22:52:59,735] Trial 269 pruned. Trial was pruned at iteration 0.
[I 2023-12-18 22:52:59,810] Trial 270 pruned. Trial was pruned at iteration 0.
[I 2023-12-18 22:52:59,884] Trial 271 pruned. Trial was pruned at iteration 0.
[I 2023-12-18 22:53:00,153] Trial 272 finished with value: 4.391157756406066 and parameters: {'learning_rate': 0.2579304017333675, 'aft_loss_distribution': 'logistic', 'aft_loss_distribution_scale': 1.004979761479296, 'max_depth': 7, 'booster': 'gbtree', 'scale_pos_weight': 7.7502189708507, 'alpha': 1.0666004526735375, 'lambda': 2.407375171105909, 'eta': 0.8664682853070794, 'sampling_method': 'uniform', 'subsample': 0.6207367369614332, 'gamma': 6.473525515710045}. Best is trial 34 with value: 4.30679442519153.
[I 2023-12-18 22:53:00,228] Trial 273 pruned. Trial was pruned at iteration 0.
[I 2023-12-18 22:53:00,304] Trial 274 pruned. Trial was pruned at iteration 0.
[I 2023-12-18 22:53:00,379] Trial 275 pruned. Trial was pruned at iteration 0.
[I 2023-12-18 22:53:00,758] Trial 276 finished with value: 4.359540445030405 and parameters: {'learning_rate': 0.24868695458972961, 'aft_loss_distribution': 'logistic', 'aft_loss_distribution_scale': 0.9222881355206775, 'max_depth': 8, 'booster': 'gbtree', 'scale_pos_weight': 8.284327538414182, 'alpha': 9.281782062122568, 'lambda': 2.538009168812429, 'eta': 0.8833126048704346, 'sampling_method': 'uniform', 'subsample': 0.5609209387456435, 'gamma': 9.726512109967555}. Best is trial 34 with value: 4.30679442519153.
[I 2023-12-18 22:53:00,837] Trial 277 pruned. Trial was pruned at iteration 0.
[I 2023-12-18 22:53:00,909] Trial 278 pruned. Trial was pruned at iteration 0.
[I 2023-12-18 22:53:00,987] Trial 279 pruned. Trial was pruned at iteration 0.
[I 2023-12-18 22:53:01,327] Trial 280 finished with value: 4.33294555228727 and parameters: {'learning_rate': 0.19729241707152184, 'aft_loss_distribution': 'logistic', 'aft_loss_distribution_scale': 0.8715692987704152, 'max_depth': 8, 'booster': 'gbtree', 'scale_pos_weight': 8.5674028487556, 'alpha': 9.553754625722142, 'lambda': 2.3363084597871735, 'eta': 0.9156488297762144, 'sampling_method': 'uniform', 'subsample': 0.6061662129143803, 'gamma': 9.370650720327516}. Best is trial 34 with value: 4.30679442519153.
[I 2023-12-18 22:53:01,410] Trial 281 pruned. Trial was pruned at iteration 0.
