[I 2023-12-19 00:34:45,619] Trial 42 finished with value: inf and parameters: {'learning_rate': 0.6882580073190339, 'aft_loss_distribution': 'normal', 'aft_loss_distribution_scale': 1.9057052253362423, 'max_depth': 4, 'booster': 'gbtree', 'scale_pos_weight': 0.04098675175341709, 'alpha': 6.943527032674886, 'lambda': 5.924933585332636, 'eta': 0.7932860068095833, 'sampling_method': 'uniform', 'subsample': 0.6665729264744576, 'gamma': 9.419916622093218}. Best is trial 3 with value: 2.078958584481772.
[I 2023-12-19 00:34:45,799] Trial 43 finished with value: inf and parameters: {'learning_rate': 0.6102200084525535, 'aft_loss_distribution': 'normal', 'aft_loss_distribution_scale': 2.59786810444243, 'max_depth': 3, 'booster': 'gbtree', 'scale_pos_weight': 0.3287040766577727, 'alpha': 5.756532661707214, 'lambda': 6.598363573740828, 'eta': 0.734200217079278, 'sampling_method': 'uniform', 'subsample': 0.985288609957726, 'gamma': 8.205834679448401}. Best is trial 3 with value: 2.078958584481772.
[I 2023-12-19 00:34:45,865] Trial 44 pruned. Trial was pruned at iteration 0.
[I 2023-12-19 00:34:46,031] Trial 45 pruned. Trial was pruned at iteration 55.
[I 2023-12-19 00:34:46,245] Trial 46 finished with value: 2.1076413944397845 and parameters: {'learning_rate': 0.6397792577121095, 'aft_loss_distribution': 'logistic', 'aft_loss_distribution_scale': 1.4913311402929303, 'max_depth': 4, 'booster': 'gbtree', 'scale_pos_weight': 0.485626688736328, 'alpha': 5.451774010691816, 'lambda': 7.035285070293988, 'eta': 0.44847622918314056, 'sampling_method': 'uniform', 'subsample': 0.5308554321393598, 'gamma': 9.291841351610781}. Best is trial 3 with value: 2.078958584481772.
[I 2023-12-19 00:34:46,648] Trial 47 finished with value: 2.1163242161885782 and parameters: {'learning_rate': 0.6397659533435236, 'aft_loss_distribution': 'logistic', 'aft_loss_distribution_scale': 1.538946100461025, 'max_depth': 3, 'booster': 'gbtree', 'scale_pos_weight': 0.20547610218399973, 'alpha': 6.749558402025991, 'lambda': 3.5495997141486932, 'eta': 0.4298998250280877, 'sampling_method': 'uniform', 'subsample': 0.5419380284960518, 'gamma': 9.99652031197521}. Best is trial 3 with value: 2.078958584481772.
[I 2023-12-19 00:34:46,815] Trial 48 finished with value: inf and parameters: {'learning_rate': 0.6391265739167418, 'aft_loss_distribution': 'logistic', 'aft_loss_distribution_scale': 1.4348226720703572, 'max_depth': 3, 'booster': 'gbtree', 'scale_pos_weight': 0.26211635429693, 'alpha': 8.31812243545094, 'lambda': 3.460204015164088, 'eta': 0.44478778377170464, 'sampling_method': 'uniform', 'subsample': 0.5255585604855675, 'gamma': 9.9950495435245}. Best is trial 3 with value: 2.078958584481772.
[I 2023-12-19 00:34:46,887] Trial 49 pruned. Trial was pruned at iteration 0.
[I 2023-12-19 00:34:46,947] Trial 50 pruned. Trial was pruned at iteration 2.
[I 2023-12-19 00:34:47,004] Trial 51 pruned. Trial was pruned at iteration 1.
[I 2023-12-19 00:34:47,090] Trial 52 pruned. Trial was pruned at iteration 9.
[I 2023-12-19 00:34:47,145] Trial 53 pruned. Trial was pruned at iteration 0.
[I 2023-12-19 00:34:47,207] Trial 54 pruned. Trial was pruned at iteration 0.
[I 2023-12-19 00:34:47,274] Trial 55 pruned. Trial was pruned at iteration 2.
[I 2023-12-19 00:34:47,344] Trial 56 pruned. Trial was pruned at iteration 0.
[I 2023-12-19 00:34:47,413] Trial 57 pruned. Trial was pruned at iteration 1.
[I 2023-12-19 00:34:47,628] Trial 58 finished with value: 2.135483242301982 and parameters: {'learning_rate': 0.7992716396204982, 'aft_loss_distribution': 'logistic', 'aft_loss_distribution_scale': 1.6622964996306706, 'max_depth': 5, 'booster': 'gbtree', 'scale_pos_weight': 0.039265654467264974, 'alpha': 3.8772401120656514, 'lambda': 5.599167324615189, 'eta': 0.7500220956449455, 'sampling_method': 'uniform', 'subsample': 0.3804460953251013, 'gamma': 7.9148288556759}. Best is trial 3 with value: 2.078958584481772.
[I 2023-12-19 00:34:47,705] Trial 59 pruned. Trial was pruned at iteration 1.
[I 2023-12-19 00:34:47,765] Trial 60 pruned. Trial was pruned at iteration 1.
[I 2023-12-19 00:34:47,822] Trial 61 pruned. Trial was pruned at iteration 0.
[I 2023-12-19 00:34:47,883] Trial 62 pruned. Trial was pruned at iteration 1.
[I 2023-12-19 00:34:47,940] Trial 63 pruned. Trial was pruned at iteration 0.
[I 2023-12-19 00:34:47,998] Trial 64 pruned. Trial was pruned at iteration 0.
[I 2023-12-19 00:34:48,067] Trial 65 pruned. Trial was pruned at iteration 0.
[I 2023-12-19 00:34:48,129] Trial 66 pruned. Trial was pruned at iteration 0.
[I 2023-12-19 00:34:48,190] Trial 67 pruned. Trial was pruned at iteration 0.
[I 2023-12-19 00:34:48,253] Trial 68 pruned. Trial was pruned at iteration 0.
[I 2023-12-19 00:34:48,317] Trial 69 pruned. Trial was pruned at iteration 1.
[I 2023-12-19 00:34:48,630] Trial 70 finished with value: 2.1156586692999912 and parameters: {'learning_rate': 0.7572200381716052, 'aft_loss_distribution': 'normal', 'aft_loss_distribution_scale': 2.7082213770405, 'max_depth': 5, 'booster': 'gbtree', 'scale_pos_weight': 0.28021380800059764, 'alpha': 7.13508284270179, 'lambda': 6.8632512390247795, 'eta': 0.7709753659826958, 'sampling_method': 'gradient_based', 'subsample': 0.40753110044784135, 'gamma': 6.645077439682295}. Best is trial 3 with value: 2.078958584481772.
[I 2023-12-19 00:34:48,903] Trial 71 finished with value: inf and parameters: {'learning_rate': 0.7597342868232184, 'aft_loss_distribution': 'normal', 'aft_loss_distribution_scale': 2.7128099895167432, 'max_depth': 5, 'booster': 'gbtree', 'scale_pos_weight': 0.28691723977012806, 'alpha': 7.887442828439614, 'lambda': 7.507631362909792, 'eta': 0.7678119116435325, 'sampling_method': 'gradient_based', 'subsample': 0.31973001702308346, 'gamma': 4.951569786344577}. Best is trial 3 with value: 2.078958584481772.
[I 2023-12-19 00:34:49,021] Trial 72 pruned. Trial was pruned at iteration 2.
[I 2023-12-19 00:34:49,300] Trial 73 finished with value: inf and parameters: {'learning_rate': 0.712610957312857, 'aft_loss_distribution': 'normal', 'aft_loss_distribution_scale': 2.1634422443580634, 'max_depth': 4, 'booster': 'gbtree', 'scale_pos_weight': 0.6258542604983696, 'alpha': 4.917484664473615, 'lambda': 5.416375174875253, 'eta': 0.8298337960284888, 'sampling_method': 'gradient_based', 'subsample': 0.39382639389971363, 'gamma': 5.730199727642522}. Best is trial 3 with value: 2.078958584481772.
[I 2023-12-19 00:34:49,675] Trial 74 finished with value: 2.118545584901263 and parameters: {'learning_rate': 0.8741359133809339, 'aft_loss_distribution': 'normal', 'aft_loss_distribution_scale': 2.726208559493886, 'max_depth': 6, 'booster': 'gbtree', 'scale_pos_weight': 2.805704181785239, 'alpha': 7.10813289455194, 'lambda': 6.1006804117546976, 'eta': 0.8871247983592863, 'sampling_method': 'gradient_based', 'subsample': 0.5836511773367574, 'gamma': 4.311315660956966}. Best is trial 3 with value: 2.078958584481772.
[I 2023-12-19 00:34:49,935] Trial 75 finished with value: inf and parameters: {'learning_rate': 0.880796740474979, 'aft_loss_distribution': 'normal', 'aft_loss_distribution_scale': 2.4102543493737314, 'max_depth': 5, 'booster': 'gbtree', 'scale_pos_weight': 2.8470396230693273, 'alpha': 6.6436578328077465, 'lambda': 6.241548140477234, 'eta': 0.903377125170608, 'sampling_method': 'gradient_based', 'subsample': 0.5927269635296674, 'gamma': 3.8631130240779123}. Best is trial 3 with value: 2.078958584481772.
[I 2023-12-19 00:34:50,037] Trial 76 pruned. Trial was pruned at iteration 0.
[I 2023-12-19 00:34:50,148] Trial 77 pruned. Trial was pruned at iteration 0.
[I 2023-12-19 00:34:50,370] Trial 78 finished with value: inf and parameters: {'learning_rate': 0.9532991367126399, 'aft_loss_distribution': 'normal', 'aft_loss_distribution_scale': 1.9049814642516538, 'max_depth': 3, 'booster': 'gbtree', 'scale_pos_weight': 1.928587620808649, 'alpha': 7.644368302293812, 'lambda': 4.845133627888492, 'eta': 0.7842114990669479, 'sampling_method': 'uniform', 'subsample': 0.6305759694530382, 'gamma': 5.1304328138257205}. Best is trial 3 with value: 2.078958584481772.
[I 2023-12-19 00:34:50,493] Trial 79 pruned. Trial was pruned at iteration 1.
[I 2023-12-19 00:34:50,598] Trial 80 pruned. Trial was pruned at iteration 2.
[I 2023-12-19 00:34:50,713] Trial 81 pruned. Trial was pruned at iteration 4.
[I 2023-12-19 00:34:50,802] Trial 82 pruned. Trial was pruned at iteration 0.
[I 2023-12-19 00:34:50,904] Trial 83 pruned. Trial was pruned at iteration 0.
[I 2023-12-19 00:34:51,179] Trial 84 finished with value: inf and parameters: {'learning_rate': 0.7416728241375735, 'aft_loss_distribution': 'normal', 'aft_loss_distribution_scale': 2.404790324446372, 'max_depth': 6, 'booster': 'gbtree', 'scale_pos_weight': 0.09835608921721471, 'alpha': 5.521232610690957, 'lambda': 6.075052719216871, 'eta': 0.8363140209427047, 'sampling_method': 'gradient_based', 'subsample': 0.6008509916311648, 'gamma': 3.209622873788624}. Best is trial 3 with value: 2.078958584481772.
[I 2023-12-19 00:34:51,268] Trial 85 pruned. Trial was pruned at iteration 1.
[I 2023-12-19 00:34:51,365] Trial 86 pruned. Trial was pruned at iteration 1.
[I 2023-12-19 00:34:51,454] Trial 87 pruned. Trial was pruned at iteration 0.
[I 2023-12-19 00:34:51,558] Trial 88 pruned. Trial was pruned at iteration 0.
[I 2023-12-19 00:34:51,652] Trial 89 pruned. Trial was pruned at iteration 0.
[I 2023-12-19 00:34:51,750] Trial 90 pruned. Trial was pruned at iteration 1.
[I 2023-12-19 00:34:51,845] Trial 91 pruned. Trial was pruned at iteration 0.
[I 2023-12-19 00:34:51,946] Trial 92 pruned. Trial was pruned at iteration 2.
[I 2023-12-19 00:34:52,043] Trial 93 pruned. Trial was pruned at iteration 1.
[I 2023-12-19 00:34:52,167] Trial 94 pruned. Trial was pruned at iteration 3.
[I 2023-12-19 00:34:52,273] Trial 95 pruned. Trial was pruned at iteration 0.
[I 2023-12-19 00:34:52,360] Trial 96 pruned. Trial was pruned at iteration 1.
[I 2023-12-19 00:34:52,448] Trial 97 pruned. Trial was pruned at iteration 0.
[I 2023-12-19 00:34:52,762] Trial 98 finished with value: 2.1292529849503756 and parameters: {'learning_rate': 0.7560590534561992, 'aft_loss_distribution': 'logistic', 'aft_loss_distribution_scale': 1.6242917057043413, 'max_depth': 5, 'booster': 'gbtree', 'scale_pos_weight': 0.3507953843844057, 'alpha': 5.847252946279972, 'lambda': 7.7264437196407725, 'eta': 0.7747634029883516, 'sampling_method': 'uniform', 'subsample': 0.48216548601504466, 'gamma': 5.128563867719069}. Best is trial 3 with value: 2.078958584481772.
[I 2023-12-19 00:34:52,878] Trial 99 pruned. Trial was pruned at iteration 0.
[I 2023-12-19 00:34:52,971] Trial 100 pruned. Trial was pruned at iteration 0.
[I 2023-12-19 00:34:53,059] Trial 101 pruned. Trial was pruned at iteration 0.
[I 2023-12-19 00:34:53,157] Trial 102 pruned. Trial was pruned at iteration 1.
[I 2023-12-19 00:34:53,246] Trial 103 pruned. Trial was pruned at iteration 1.
[I 2023-12-19 00:34:53,353] Trial 104 pruned. Trial was pruned at iteration 4.
[I 2023-12-19 00:34:53,452] Trial 105 pruned. Trial was pruned at iteration 0.
[I 2023-12-19 00:34:53,549] Trial 106 pruned. Trial was pruned at iteration 1.
[I 2023-12-19 00:34:53,665] Trial 107 pruned. Trial was pruned at iteration 1.
[I 2023-12-19 00:34:53,763] Trial 108 pruned. Trial was pruned at iteration 1.
[I 2023-12-19 00:34:53,858] Trial 109 pruned. Trial was pruned at iteration 0.
[I 2023-12-19 00:34:53,950] Trial 110 pruned. Trial was pruned at iteration 0.
[I 2023-12-19 00:34:54,055] Trial 111 pruned. Trial was pruned at iteration 2.
[I 2023-12-19 00:34:54,395] Trial 112 finished with value: 2.1060975241947095 and parameters: {'learning_rate': 0.8003395490613687, 'aft_loss_distribution': 'normal', 'aft_loss_distribution_scale': 2.588936228765632, 'max_depth': 3, 'booster': 'gbtree', 'scale_pos_weight': 0.1066605754889611, 'alpha': 4.892829345194013, 'lambda': 5.372455520877641, 'eta': 0.7930806816533196, 'sampling_method': 'uniform', 'subsample': 0.697944712362037, 'gamma': 8.898475485757963}. Best is trial 3 with value: 2.078958584481772.
[I 2023-12-19 00:34:54,593] Trial 113 finished with value: inf and parameters: {'learning_rate': 0.7969501151802886, 'aft_loss_distribution': 'normal', 'aft_loss_distribution_scale': 1.3456044656979875, 'max_depth': 8, 'booster': 'gbtree', 'scale_pos_weight': 0.12850164952572374, 'alpha': 4.9228205602156905, 'lambda': 4.972909194428888, 'eta': 0.7941262739555333, 'sampling_method': 'uniform', 'subsample': 0.7240224063926577, 'gamma': 8.404619914095711}. Best is trial 3 with value: 2.078958584481772.
[I 2023-12-19 00:34:54,840] Trial 114 finished with value: 2.1048441413406604 and parameters: {'learning_rate': 0.9376439393111349, 'aft_loss_distribution': 'normal', 'aft_loss_distribution_scale': 2.573037435295841, 'max_depth': 3, 'booster': 'gbtree', 'scale_pos_weight': 0.2722398022829472, 'alpha': 4.263694893051626, 'lambda': 3.7559306130449546, 'eta': 0.8272964305953037, 'sampling_method': 'uniform', 'subsample': 0.6628361625105965, 'gamma': 8.127275332437925}. Best is trial 3 with value: 2.078958584481772.
[I 2023-12-19 00:34:54,919] Trial 115 pruned. Trial was pruned at iteration 3.
[I 2023-12-19 00:34:55,189] Trial 116 finished with value: 2.1014672418488627 and parameters: {'learning_rate': 0.97174735644593, 'aft_loss_distribution': 'normal', 'aft_loss_distribution_scale': 2.5406439386043274, 'max_depth': 3, 'booster': 'gbtree', 'scale_pos_weight': 0.5450470165407899, 'alpha': 4.694959902331458, 'lambda': 2.906182449835816, 'eta': 0.8550055927755745, 'sampling_method': 'gradient_based', 'subsample': 0.661234237855378, 'gamma': 9.288684302035989}. Best is trial 3 with value: 2.078958584481772.
[I 2023-12-19 00:34:55,489] Trial 117 finished with value: 2.079976644441384 and parameters: {'learning_rate': 0.9868677297010416, 'aft_loss_distribution': 'normal', 'aft_loss_distribution_scale': 2.321720309562456, 'max_depth': 3, 'booster': 'gbtree', 'scale_pos_weight': 0.577763737710056, 'alpha': 4.431005086653659, 'lambda': 3.0231332055310602, 'eta': 0.8751067512786418, 'sampling_method': 'gradient_based', 'subsample': 0.6979585292187104, 'gamma': 9.347396038643659}. Best is trial 3 with value: 2.078958584481772.
[I 2023-12-19 00:34:55,700] Trial 118 finished with value: inf and parameters: {'learning_rate': 0.9117367414909924, 'aft_loss_distribution': 'normal', 'aft_loss_distribution_scale': 2.5267024425097193, 'max_depth': 3, 'booster': 'gbtree', 'scale_pos_weight': 0.6011336513802813, 'alpha': 4.607612953080769, 'lambda': 2.8013749987451466, 'eta': 0.9213601827783979, 'sampling_method': 'gradient_based', 'subsample': 0.688927228912804, 'gamma': 9.280802187281157}. Best is trial 3 with value: 2.078958584481772.
[I 2023-12-19 00:34:55,972] Trial 119 finished with value: 2.059248339584963 and parameters: {'learning_rate': 0.986630018167794, 'aft_loss_distribution': 'normal', 'aft_loss_distribution_scale': 2.1024392550362583, 'max_depth': 3, 'booster': 'gbtree', 'scale_pos_weight': 0.4972847518836635, 'alpha': 4.7844327154240025, 'lambda': 3.102950323765314, 'eta': 0.8875358360386784, 'sampling_method': 'gradient_based', 'subsample': 0.7460553400972073, 'gamma': 9.713087453062608}. Best is trial 119 with value: 2.059248339584963.
[I 2023-12-19 00:34:56,267] Trial 120 finished with value: 2.0484624237262814 and parameters: {'learning_rate': 0.998801073654096, 'aft_loss_distribution': 'normal', 'aft_loss_distribution_scale': 1.9822650055193185, 'max_depth': 3, 'booster': 'gbtree', 'scale_pos_weight': 0.5374670377138945, 'alpha': 4.381815194812346, 'lambda': 3.1267661627389254, 'eta': 0.957479164535205, 'sampling_method': 'gradient_based', 'subsample': 0.761655014663433, 'gamma': 9.634119633802236}. Best is trial 120 with value: 2.0484624237262814.
[I 2023-12-19 00:34:56,556] Trial 121 finished with value: 2.0571133435036324 and parameters: {'learning_rate': 0.9837079294728034, 'aft_loss_distribution': 'normal', 'aft_loss_distribution_scale': 2.0784735233558727, 'max_depth': 3, 'booster': 'gbtree', 'scale_pos_weight': 0.5200663194110787, 'alpha': 4.365750788396203, 'lambda': 3.007111280371524, 'eta': 0.9662965461131308, 'sampling_method': 'gradient_based', 'subsample': 0.7580211492694986, 'gamma': 9.694050841697939}. Best is trial 120 with value: 2.0484624237262814.
[I 2023-12-19 00:34:56,846] Trial 122 finished with value: 2.077566507812725 and parameters: {'learning_rate': 0.983379987049778, 'aft_loss_distribution': 'normal', 'aft_loss_distribution_scale': 2.2961004317187648, 'max_depth': 3, 'booster': 'gbtree', 'scale_pos_weight': 0.5529955838867036, 'alpha': 4.349436067545578, 'lambda': 3.1473574944314047, 'eta': 0.9683770718635021, 'sampling_method': 'gradient_based', 'subsample': 0.8266688620193515, 'gamma': 9.522804514353448}. Best is trial 120 with value: 2.0484624237262814.
[I 2023-12-19 00:34:57,035] Trial 123 finished with value: inf and parameters: {'learning_rate': 0.9985178836423975, 'aft_loss_distribution': 'normal', 'aft_loss_distribution_scale': 1.974291802794201, 'max_depth': 3, 'booster': 'gbtree', 'scale_pos_weight': 0.799657575379837, 'alpha': 4.071822243967268, 'lambda': 3.035281191265523, 'eta': 0.9735650834926046, 'sampling_method': 'gradient_based', 'subsample': 0.8662204518992381, 'gamma': 9.633395902315007}. Best is trial 120 with value: 2.0484624237262814.
[I 2023-12-19 00:34:57,318] Trial 124 finished with value: 2.063398913902184 and parameters: {'learning_rate': 0.9743036059420473, 'aft_loss_distribution': 'normal', 'aft_loss_distribution_scale': 2.1456432555999725, 'max_depth': 3, 'booster': 'gbtree', 'scale_pos_weight': 0.6594581139234199, 'alpha': 4.43678591856002, 'lambda': 2.4994664749167037, 'eta': 0.9996749706089827, 'sampling_method': 'gradient_based', 'subsample': 0.7597319331348412, 'gamma': 9.792217983144802}. Best is trial 120 with value: 2.0484624237262814.
[I 2023-12-19 00:34:57,591] Trial 125 finished with value: 2.0775449197030604 and parameters: {'learning_rate': 0.9701245431936281, 'aft_loss_distribution': 'normal', 'aft_loss_distribution_scale': 2.294904844759996, 'max_depth': 3, 'booster': 'gbtree', 'scale_pos_weight': 0.6627443678930252, 'alpha': 3.6858006453246617, 'lambda': 2.482508446504799, 'eta': 0.9890632428039521, 'sampling_method': 'gradient_based', 'subsample': 0.7576107968949303, 'gamma': 9.79181820750667}. Best is trial 120 with value: 2.0484624237262814.
[I 2023-12-19 00:34:57,794] Trial 126 finished with value: inf and parameters: {'learning_rate': 0.9719041736062466, 'aft_loss_distribution': 'normal', 'aft_loss_distribution_scale': 2.330797424141584, 'max_depth': 3, 'booster': 'gbtree', 'scale_pos_weight': 0.8900361231535376, 'alpha': 4.394144041083791, 'lambda': 2.187227400584362, 'eta': 0.9989620307900391, 'sampling_method': 'gradient_based', 'subsample': 0.8405323561732012, 'gamma': 9.556594971276626}. Best is trial 120 with value: 2.0484624237262814.
[I 2023-12-19 00:34:58,078] Trial 127 finished with value: 2.0620233222964246 and parameters: {'learning_rate': 0.9968575750703963, 'aft_loss_distribution': 'normal', 'aft_loss_distribution_scale': 2.1335757963633926, 'max_depth': 3, 'booster': 'gbtree', 'scale_pos_weight': 0.6711426016127031, 'alpha': 3.6117419381241005, 'lambda': 3.3127959147398918, 'eta': 0.9659664548682039, 'sampling_method': 'gradient_based', 'subsample': 0.7831409577056924, 'gamma': 9.748849483066174}. Best is trial 120 with value: 2.0484624237262814.
[I 2023-12-19 00:34:58,359] Trial 128 finished with value: 2.062483907502379 and parameters: {'learning_rate': 0.9990918495013412, 'aft_loss_distribution': 'normal', 'aft_loss_distribution_scale': 2.139393541846787, 'max_depth': 3, 'booster': 'gbtree', 'scale_pos_weight': 0.7095194069875128, 'alpha': 3.6198360585904057, 'lambda': 3.200403753632744, 'eta': 0.9583156977424113, 'sampling_method': 'gradient_based', 'subsample': 0.7510169605835576, 'gamma': 9.74073317817557}. Best is trial 120 with value: 2.0484624237262814.
[I 2023-12-19 00:34:58,642] Trial 129 finished with value: 2.0577579763950755 and parameters: {'learning_rate': 0.9999583940681122, 'aft_loss_distribution': 'normal', 'aft_loss_distribution_scale': 2.0876848454107737, 'max_depth': 3, 'booster': 'gbtree', 'scale_pos_weight': 0.6848044306287188, 'alpha': 3.7236275576850604, 'lambda': 3.2204963933462314, 'eta': 0.9729924630024908, 'sampling_method': 'gradient_based', 'subsample': 0.7647571952034915, 'gamma': 9.814100492627604}. Best is trial 120 with value: 2.0484624237262814.
[I 2023-12-19 00:34:58,915] Trial 130 finished with value: 2.057433032099218 and parameters: {'learning_rate': 0.9940889417057758, 'aft_loss_distribution': 'normal', 'aft_loss_distribution_scale': 2.0830958885326876, 'max_depth': 3, 'booster': 'gbtree', 'scale_pos_weight': 0.7138469307118892, 'alpha': 3.663812318076838, 'lambda': 3.2523859504946264, 'eta': 0.9605525897862333, 'sampling_method': 'gradient_based', 'subsample': 0.7626904991553926, 'gamma': 9.765677934266286}. Best is trial 120 with value: 2.0484624237262814.
[I 2023-12-19 00:34:59,189] Trial 131 finished with value: 2.063889121471422 and parameters: {'learning_rate': 0.9995516834465258, 'aft_loss_distribution': 'normal', 'aft_loss_distribution_scale': 2.1543184159294757, 'max_depth': 3, 'booster': 'gbtree', 'scale_pos_weight': 0.6915363118500193, 'alpha': 3.576318530984455, 'lambda': 3.1481657506940675, 'eta': 0.9615828947322285, 'sampling_method': 'gradient_based', 'subsample': 0.7668170653963249, 'gamma': 9.835717457501783}. Best is trial 120 with value: 2.0484624237262814.
