[I 2023-12-19 00:22:58,332] Trial 418 finished with value: inf and parameters: {'learning_rate': 0.9825704266873769, 'aft_loss_distribution': 'normal', 'aft_loss_distribution_scale': 1.4724822730791869, 'max_depth': 10, 'booster': 'dart', 'scale_pos_weight': 0.4757906002131052, 'alpha': 9.52110277536333, 'lambda': 9.2667802407768, 'eta': 0.8508627926186154, 'sampling_method': 'uniform', 'subsample': 0.35931149001069657, 'gamma': 9.995370996893383}. Best is trial 396 with value: 2.0007935914945794.
[I 2023-12-19 00:22:58,428] Trial 419 pruned. Trial was pruned at iteration 0.
[I 2023-12-19 00:22:58,521] Trial 420 pruned. Trial was pruned at iteration 0.
[I 2023-12-19 00:22:58,615] Trial 421 pruned. Trial was pruned at iteration 0.
[I 2023-12-19 00:22:58,705] Trial 422 pruned. Trial was pruned at iteration 0.
[I 2023-12-19 00:22:58,800] Trial 423 pruned. Trial was pruned at iteration 0.
[I 2023-12-19 00:23:11,924] Trial 424 finished with value: 2.002027181973065 and parameters: {'learning_rate': 0.9685664638113022, 'aft_loss_distribution': 'normal', 'aft_loss_distribution_scale': 1.4919812952515068, 'max_depth': 10, 'booster': 'dart', 'scale_pos_weight': 3.09596304797559, 'alpha': 9.42791839309911, 'lambda': 9.789883656094055, 'eta': 0.8927000712533464, 'sampling_method': 'uniform', 'subsample': 0.25555805425643113, 'gamma': 9.540596555245937}. Best is trial 396 with value: 2.0007935914945794.
[I 2023-12-19 00:23:24,006] Trial 425 finished with value: 2.0047122003687585 and parameters: {'learning_rate': 0.9829243025910099, 'aft_loss_distribution': 'normal', 'aft_loss_distribution_scale': 1.4884369472871495, 'max_depth': 10, 'booster': 'dart', 'scale_pos_weight': 0.3694265149854836, 'alpha': 9.484722450392212, 'lambda': 9.303185473777305, 'eta': 0.8464143654831111, 'sampling_method': 'uniform', 'subsample': 0.25458764296091413, 'gamma': 9.300652648639446}. Best is trial 396 with value: 2.0007935914945794.
[I 2023-12-19 00:23:24,109] Trial 426 pruned. Trial was pruned at iteration 0.
[I 2023-12-19 00:23:24,194] Trial 427 pruned. Trial was pruned at iteration 0.
[I 2023-12-19 00:23:25,809] Trial 428 finished with value: inf and parameters: {'learning_rate': 0.9807580052295474, 'aft_loss_distribution': 'normal', 'aft_loss_distribution_scale': 1.2849869095765138, 'max_depth': 10, 'booster': 'dart', 'scale_pos_weight': 3.082230428600391, 'alpha': 9.611512801521954, 'lambda': 9.767088099858801, 'eta': 0.8161734574642883, 'sampling_method': 'uniform', 'subsample': 0.2885044047895977, 'gamma': 9.64498074409045}. Best is trial 396 with value: 2.0007935914945794.
[I 2023-12-19 00:23:28,140] Trial 429 finished with value: inf and parameters: {'learning_rate': 0.9678715160078915, 'aft_loss_distribution': 'normal', 'aft_loss_distribution_scale': 1.4784632729830514, 'max_depth': 10, 'booster': 'dart', 'scale_pos_weight': 3.3197138435623423, 'alpha': 9.242631525746253, 'lambda': 9.238341640804016, 'eta': 0.8593747850275284, 'sampling_method': 'uniform', 'subsample': 0.2726700435981266, 'gamma': 9.477120611829577}. Best is trial 396 with value: 2.0007935914945794.
[I 2023-12-19 00:23:28,235] Trial 430 pruned. Trial was pruned at iteration 0.
[I 2023-12-19 00:23:29,831] Trial 431 finished with value: inf and parameters: {'learning_rate': 0.9824226967435897, 'aft_loss_distribution': 'normal', 'aft_loss_distribution_scale': 1.4580181122711275, 'max_depth': 10, 'booster': 'dart', 'scale_pos_weight': 3.357427388884706, 'alpha': 9.024721363518415, 'lambda': 9.765538393014946, 'eta': 0.8850394143923843, 'sampling_method': 'uniform', 'subsample': 0.3039738994241844, 'gamma': 1.2806318616089887}. Best is trial 396 with value: 2.0007935914945794.
[I 2023-12-19 00:23:29,933] Trial 432 pruned. Trial was pruned at iteration 0.
[I 2023-12-19 00:23:30,087] Trial 433 pruned. Trial was pruned at iteration 0.
[I 2023-12-19 00:23:32,658] Trial 434 finished with value: inf and parameters: {'learning_rate': 0.9863823419194269, 'aft_loss_distribution': 'normal', 'aft_loss_distribution_scale': 1.5087920227799632, 'max_depth': 10, 'booster': 'dart', 'scale_pos_weight': 0.398058060839853, 'alpha': 9.583276550201063, 'lambda': 1.7736591369589556, 'eta': 0.8088241817529327, 'sampling_method': 'uniform', 'subsample': 0.24245844070133782, 'gamma': 9.294454974369762}. Best is trial 396 with value: 2.0007935914945794.
[I 2023-12-19 00:23:32,805] Trial 435 pruned. Trial was pruned at iteration 0.
[I 2023-12-19 00:23:32,956] Trial 436 pruned. Trial was pruned at iteration 0.
[I 2023-12-19 00:23:38,080] Trial 437 finished with value: 2.0054685471626628 and parameters: {'learning_rate': 0.9996447059935857, 'aft_loss_distribution': 'normal', 'aft_loss_distribution_scale': 1.4993448502862559, 'max_depth': 10, 'booster': 'dart', 'scale_pos_weight': 0.37110884724658205, 'alpha': 9.389209912150763, 'lambda': 9.383374891680965, 'eta': 0.7260264690425671, 'sampling_method': 'uniform', 'subsample': 0.28781952628578034, 'gamma': 9.99403792620683}. Best is trial 396 with value: 2.0007935914945794.
[I 2023-12-19 00:23:38,183] Trial 438 pruned. Trial was pruned at iteration 0.
[I 2023-12-19 00:23:43,629] Trial 439 finished with value: 1.9984721946203312 and parameters: {'learning_rate': 0.981934523862336, 'aft_loss_distribution': 'normal', 'aft_loss_distribution_scale': 1.502288205821525, 'max_depth': 10, 'booster': 'dart', 'scale_pos_weight': 0.41723716223891594, 'alpha': 9.013299856176824, 'lambda': 9.284882919560411, 'eta': 0.7700314115591187, 'sampling_method': 'uniform', 'subsample': 0.2954810339917999, 'gamma': 9.466431736930076}. Best is trial 439 with value: 1.9984721946203312.
[I 2023-12-19 00:23:45,709] Trial 440 finished with value: inf and parameters: {'learning_rate': 0.9997945743851642, 'aft_loss_distribution': 'normal', 'aft_loss_distribution_scale': 1.3340687315909319, 'max_depth': 10, 'booster': 'dart', 'scale_pos_weight': 0.5636041101239473, 'alpha': 9.045502365422335, 'lambda': 9.081554493828945, 'eta': 0.7370174116839627, 'sampling_method': 'uniform', 'subsample': 0.2838211249307145, 'gamma': 9.188771120248553}. Best is trial 439 with value: 1.9984721946203312.
[I 2023-12-19 00:23:47,654] Trial 441 finished with value: inf and parameters: {'learning_rate': 0.9459708456961053, 'aft_loss_distribution': 'normal', 'aft_loss_distribution_scale': 1.4599490382257583, 'max_depth': 10, 'booster': 'dart', 'scale_pos_weight': 0.6685267951080978, 'alpha': 9.662413954253635, 'lambda': 9.320373743460374, 'eta': 0.7639014292388508, 'sampling_method': 'gradient_based', 'subsample': 0.3234848843776315, 'gamma': 9.377791632857903}. Best is trial 439 with value: 1.9984721946203312.
[I 2023-12-19 00:23:47,821] Trial 442 pruned. Trial was pruned at iteration 0.
[I 2023-12-19 00:23:47,963] Trial 443 pruned. Trial was pruned at iteration 0.
[I 2023-12-19 00:23:59,718] Trial 444 finished with value: 1.9993828490835408 and parameters: {'learning_rate': 0.9815682772705064, 'aft_loss_distribution': 'normal', 'aft_loss_distribution_scale': 1.515239797835463, 'max_depth': 10, 'booster': 'dart', 'scale_pos_weight': 0.42398531378303356, 'alpha': 9.801296906229796, 'lambda': 8.846887651649926, 'eta': 0.8951022472388832, 'sampling_method': 'uniform', 'subsample': 0.6383349579309708, 'gamma': 9.627203998465253}. Best is trial 439 with value: 1.9984721946203312.
[I 2023-12-19 00:23:59,873] Trial 445 pruned. Trial was pruned at iteration 0.
[I 2023-12-19 00:24:06,429] Trial 446 finished with value: 2.00384570670843 and parameters: {'learning_rate': 0.972779916031521, 'aft_loss_distribution': 'normal', 'aft_loss_distribution_scale': 1.3628260630723343, 'max_depth': 10, 'booster': 'dart', 'scale_pos_weight': 0.4038680122011781, 'alpha': 9.663206324486628, 'lambda': 8.912732916816962, 'eta': 0.8867791813326767, 'sampling_method': 'uniform', 'subsample': 0.3660303939637926, 'gamma': 9.526829118278316}. Best is trial 439 with value: 1.9984721946203312.
[I 2023-12-19 00:24:06,543] Trial 447 pruned. Trial was pruned at iteration 0.
[I 2023-12-19 00:24:06,635] Trial 448 pruned. Trial was pruned at iteration 0.
[I 2023-12-19 00:24:06,729] Trial 449 pruned. Trial was pruned at iteration 0.
[I 2023-12-19 00:24:06,821] Trial 450 pruned. Trial was pruned at iteration 0.
[I 2023-12-19 00:24:12,406] Trial 451 finished with value: 2.001735417339028 and parameters: {'learning_rate': 0.9764635752881632, 'aft_loss_distribution': 'normal', 'aft_loss_distribution_scale': 1.4319503127798439, 'max_depth': 10, 'booster': 'dart', 'scale_pos_weight': 2.8754547018437147, 'alpha': 9.301790143133543, 'lambda': 8.715061061877897, 'eta': 0.8960330037912559, 'sampling_method': 'uniform', 'subsample': 0.35949266827310083, 'gamma': 9.137066865234848}. Best is trial 439 with value: 1.9984721946203312.
[I 2023-12-19 00:24:12,552] Trial 452 pruned. Trial was pruned at iteration 0.
[I 2023-12-19 00:24:17,549] Trial 453 finished with value: 2.0084546100025285 and parameters: {'learning_rate': 0.9784957592274125, 'aft_loss_distribution': 'normal', 'aft_loss_distribution_scale': 1.3103888076438197, 'max_depth': 10, 'booster': 'dart', 'scale_pos_weight': 2.8245062686566813, 'alpha': 9.409596556899649, 'lambda': 8.900046704879383, 'eta': 0.9208827642708276, 'sampling_method': 'uniform', 'subsample': 0.3497774393485288, 'gamma': 8.824550000317732}. Best is trial 439 with value: 1.9984721946203312.
[I 2023-12-19 00:24:17,717] Trial 454 pruned. Trial was pruned at iteration 0.
[I 2023-12-19 00:24:17,889] Trial 455 pruned. Trial was pruned at iteration 0.
[I 2023-12-19 00:24:18,071] Trial 456 pruned. Trial was pruned at iteration 0.
[I 2023-12-19 00:24:18,238] Trial 457 pruned. Trial was pruned at iteration 0.
[I 2023-12-19 00:24:24,484] Trial 458 finished with value: 2.0044492777054326 and parameters: {'learning_rate': 0.9582192956987297, 'aft_loss_distribution': 'normal', 'aft_loss_distribution_scale': 1.4159693570769176, 'max_depth': 10, 'booster': 'dart', 'scale_pos_weight': 0.4731982140915568, 'alpha': 9.551856898447884, 'lambda': 9.258082355396514, 'eta': 0.8671253051197593, 'sampling_method': 'uniform', 'subsample': 0.3166141407025626, 'gamma': 9.529105040739275}. Best is trial 439 with value: 1.9984721946203312.
[I 2023-12-19 00:24:26,220] Trial 459 finished with value: inf and parameters: {'learning_rate': 0.9995977492345314, 'aft_loss_distribution': 'normal', 'aft_loss_distribution_scale': 1.3232679635637288, 'max_depth': 10, 'booster': 'dart', 'scale_pos_weight': 2.9030574726382277, 'alpha': 9.842675582380682, 'lambda': 8.894756636526306, 'eta': 0.9107101948137193, 'sampling_method': 'uniform', 'subsample': 0.3243642723514042, 'gamma': 9.263908641582812}. Best is trial 439 with value: 1.9984721946203312.
[I 2023-12-19 00:24:26,322] Trial 460 pruned. Trial was pruned at iteration 1.
[I 2023-12-19 00:24:26,424] Trial 461 pruned. Trial was pruned at iteration 0.
[I 2023-12-19 00:24:26,521] Trial 462 pruned. Trial was pruned at iteration 0.
[I 2023-12-19 00:24:26,617] Trial 463 pruned. Trial was pruned at iteration 0.
[I 2023-12-19 00:24:26,703] Trial 464 pruned. Trial was pruned at iteration 0.
[I 2023-12-19 00:24:26,796] Trial 465 pruned. Trial was pruned at iteration 0.
[I 2023-12-19 00:24:40,555] Trial 466 finished with value: 2.0034617187090076 and parameters: {'learning_rate': 0.9464615031646602, 'aft_loss_distribution': 'normal', 'aft_loss_distribution_scale': 1.5396008157150607, 'max_depth': 10, 'booster': 'dart', 'scale_pos_weight': 0.3901085523381744, 'alpha': 9.129637446520407, 'lambda': 9.47341994569615, 'eta': 0.9305194926557849, 'sampling_method': 'uniform', 'subsample': 0.30429851623861826, 'gamma': 9.431005157890645}. Best is trial 439 with value: 1.9984721946203312.
[I 2023-12-19 00:24:40,662] Trial 467 pruned. Trial was pruned at iteration 0.
[I 2023-12-19 00:24:40,755] Trial 468 pruned. Trial was pruned at iteration 0.
[I 2023-12-19 00:24:40,858] Trial 469 pruned. Trial was pruned at iteration 0.
[I 2023-12-19 00:24:40,951] Trial 470 pruned. Trial was pruned at iteration 0.
[I 2023-12-19 00:24:41,040] Trial 471 pruned. Trial was pruned at iteration 0.
[I 2023-12-19 00:24:41,129] Trial 472 pruned. Trial was pruned at iteration 0.
[I 2023-12-19 00:24:41,227] Trial 473 pruned. Trial was pruned at iteration 0.
[I 2023-12-19 00:24:41,328] Trial 474 pruned. Trial was pruned at iteration 1.
[I 2023-12-19 00:24:41,426] Trial 475 pruned. Trial was pruned at iteration 0.
[I 2023-12-19 00:24:41,524] Trial 476 pruned. Trial was pruned at iteration 0.
[I 2023-12-19 00:24:41,618] Trial 477 pruned. Trial was pruned at iteration 1.
[I 2023-12-19 00:24:41,708] Trial 478 pruned. Trial was pruned at iteration 0.
[I 2023-12-19 00:24:43,193] Trial 479 finished with value: inf and parameters: {'learning_rate': 0.9999113559667687, 'aft_loss_distribution': 'normal', 'aft_loss_distribution_scale': 1.236324983261279, 'max_depth': 10, 'booster': 'dart', 'scale_pos_weight': 0.42686257726835075, 'alpha': 9.383576235971775, 'lambda': 9.588607837654612, 'eta': 0.8494292323308624, 'sampling_method': 'uniform', 'subsample': 0.3222809859900863, 'gamma': 9.280647423977289}. Best is trial 439 with value: 1.9984721946203312.
[I 2023-12-19 00:24:43,293] Trial 480 pruned. Trial was pruned at iteration 0.
[I 2023-12-19 00:24:47,386] Trial 481 pruned. Trial was pruned at iteration 88.
[I 2023-12-19 00:24:47,540] Trial 482 pruned. Trial was pruned at iteration 0.
[I 2023-12-19 00:24:56,769] Trial 483 finished with value: 2.000806163494692 and parameters: {'learning_rate': 0.9820087506343446, 'aft_loss_distribution': 'normal', 'aft_loss_distribution_scale': 1.4349539972078371, 'max_depth': 10, 'booster': 'dart', 'scale_pos_weight': 3.066673498755981, 'alpha': 9.157930990749975, 'lambda': 9.67118684802124, 'eta': 0.5631509853341861, 'sampling_method': 'uniform', 'subsample': 0.2728495251541356, 'gamma': 9.522878220934485}. Best is trial 439 with value: 1.9984721946203312.
[I 2023-12-19 00:24:59,334] Trial 484 finished with value: inf and parameters: {'learning_rate': 0.9750031446800504, 'aft_loss_distribution': 'normal', 'aft_loss_distribution_scale': 1.4627879463715305, 'max_depth': 10, 'booster': 'dart', 'scale_pos_weight': 3.0069766548670085, 'alpha': 9.184653056331692, 'lambda': 0.9496707833024729, 'eta': 0.8491411351555984, 'sampling_method': 'uniform', 'subsample': 0.27329181265458086, 'gamma': 9.085479279827245}. Best is trial 439 with value: 1.9984721946203312.
[I 2023-12-19 00:24:59,449] Trial 485 pruned. Trial was pruned at iteration 1.
[I 2023-12-19 00:25:11,317] Trial 486 finished with value: 2.0066165684079644 and parameters: {'learning_rate': 0.9862362513681838, 'aft_loss_distribution': 'normal', 'aft_loss_distribution_scale': 1.5747107665525648, 'max_depth': 10, 'booster': 'dart', 'scale_pos_weight': 3.229741202805056, 'alpha': 8.792279742916914, 'lambda': 9.630421448321409, 'eta': 0.8484839628802384, 'sampling_method': 'uniform', 'subsample': 0.26048281049694966, 'gamma': 9.22554535444521}. Best is trial 439 with value: 1.9984721946203312.
[I 2023-12-19 00:25:11,423] Trial 487 pruned. Trial was pruned at iteration 0.
[I 2023-12-19 00:25:11,517] Trial 488 pruned. Trial was pruned at iteration 0.
[I 2023-12-19 00:25:13,304] Trial 489 finished with value: inf and parameters: {'learning_rate': 0.999882798312827, 'aft_loss_distribution': 'normal', 'aft_loss_distribution_scale': 1.2542404000354164, 'max_depth': 8, 'booster': 'dart', 'scale_pos_weight': 3.111320703487049, 'alpha': 9.621128468070347, 'lambda': 8.722584976971698, 'eta': 0.6911661082509285, 'sampling_method': 'uniform', 'subsample': 0.24776374986202968, 'gamma': 9.403478012079479}. Best is trial 439 with value: 1.9984721946203312.
[I 2023-12-19 00:25:13,400] Trial 490 pruned. Trial was pruned at iteration 0.
[I 2023-12-19 00:25:18,395] Trial 491 finished with value: 2.006084738214523 and parameters: {'learning_rate': 0.9672454932249388, 'aft_loss_distribution': 'normal', 'aft_loss_distribution_scale': 1.5680728242514577, 'max_depth': 10, 'booster': 'dart', 'scale_pos_weight': 3.263638185652321, 'alpha': 9.099511622701419, 'lambda': 9.1174249054394, 'eta': 0.6370527112221763, 'sampling_method': 'uniform', 'subsample': 0.27542596070333936, 'gamma': 9.21026984117437}. Best is trial 439 with value: 1.9984721946203312.
[I 2023-12-19 00:25:18,568] Trial 492 pruned. Trial was pruned at iteration 0.
[I 2023-12-19 00:25:18,697] Trial 493 pruned. Trial was pruned at iteration 0.
[I 2023-12-19 00:25:18,798] Trial 494 pruned. Trial was pruned at iteration 0.
[I 2023-12-19 00:25:21,716] Trial 495 finished with value: 2.0004219320538157 and parameters: {'learning_rate': 0.9654302231350477, 'aft_loss_distribution': 'normal', 'aft_loss_distribution_scale': 1.6267573177527794, 'max_depth': 10, 'booster': 'dart', 'scale_pos_weight': 0.454248458372972, 'alpha': 8.755709156635097, 'lambda': 0.34730639268376606, 'eta': 0.5558633494104923, 'sampling_method': 'uniform', 'subsample': 0.5884205536164744, 'gamma': 9.334475785206436}. Best is trial 439 with value: 1.9984721946203312.
[I 2023-12-19 00:25:21,817] Trial 496 pruned. Trial was pruned at iteration 0.
[I 2023-12-19 00:25:23,549] Trial 497 finished with value: inf and parameters: {'learning_rate': 0.961715203295112, 'aft_loss_distribution': 'normal', 'aft_loss_distribution_scale': 1.654673776619409, 'max_depth': 10, 'booster': 'dart', 'scale_pos_weight': 0.4526134082773068, 'alpha': 9.138068033785597, 'lambda': 8.837925866000186, 'eta': 0.5435640038893574, 'sampling_method': 'uniform', 'subsample': 0.5856224800850939, 'gamma': 8.78459868219858}. Best is trial 439 with value: 1.9984721946203312.
[I 2023-12-19 00:25:23,648] Trial 498 pruned. Trial was pruned at iteration 0.
