[I 2023-12-18 23:44:56,820] Trial 274 pruned. Trial was pruned at iteration 0.
[I 2023-12-18 23:44:56,894] Trial 275 pruned. Trial was pruned at iteration 0.
[I 2023-12-18 23:44:56,983] Trial 276 pruned. Trial was pruned at iteration 0.
[I 2023-12-18 23:44:57,058] Trial 277 pruned. Trial was pruned at iteration 0.
[I 2023-12-18 23:44:57,554] Trial 278 finished with value: 4.248287973717455 and parameters: {'learning_rate': 0.1413740414751318, 'aft_loss_distribution': 'logistic', 'aft_loss_distribution_scale': 0.7184131719590789, 'max_depth': 3, 'booster': 'gbtree', 'scale_pos_weight': 1.2619794953556251, 'alpha': 8.638161353818731, 'lambda': 2.356404984427993, 'eta': 0.7812356895742296, 'sampling_method': 'uniform', 'subsample': 0.4298383054490306, 'gamma': 4.663508217080154}. Best is trial 100 with value: 4.194510122949977.
[I 2023-12-18 23:44:58,205] Trial 279 finished with value: 4.237581870094575 and parameters: {'learning_rate': 0.09721228478872837, 'aft_loss_distribution': 'logistic', 'aft_loss_distribution_scale': 0.6943842441465851, 'max_depth': 3, 'booster': 'gbtree', 'scale_pos_weight': 1.6255408448529713, 'alpha': 8.711648809466846, 'lambda': 2.841901387340689, 'eta': 0.8404569771142474, 'sampling_method': 'uniform', 'subsample': 0.42204720672177565, 'gamma': 8.496314377928169}. Best is trial 100 with value: 4.194510122949977.
[I 2023-12-18 23:44:58,293] Trial 280 pruned. Trial was pruned at iteration 0.
[I 2023-12-18 23:44:59,117] Trial 281 finished with value: 4.222313778368089 and parameters: {'learning_rate': 0.10501737431727794, 'aft_loss_distribution': 'logistic', 'aft_loss_distribution_scale': 0.6496119674669695, 'max_depth': 3, 'booster': 'gbtree', 'scale_pos_weight': 1.4487436957402675, 'alpha': 8.600467904239107, 'lambda': 3.136219979521574, 'eta': 0.8507540634798504, 'sampling_method': 'uniform', 'subsample': 0.38388864047337967, 'gamma': 4.393969040650198}. Best is trial 100 with value: 4.194510122949977.
[I 2023-12-18 23:44:59,198] Trial 282 pruned. Trial was pruned at iteration 0.
[I 2023-12-18 23:44:59,277] Trial 283 pruned. Trial was pruned at iteration 0.
[I 2023-12-18 23:44:59,387] Trial 284 pruned. Trial was pruned at iteration 0.
[I 2023-12-18 23:44:59,502] Trial 285 pruned. Trial was pruned at iteration 0.
[I 2023-12-18 23:44:59,613] Trial 286 pruned. Trial was pruned at iteration 0.
[I 2023-12-18 23:44:59,727] Trial 287 pruned. Trial was pruned at iteration 0.
[I 2023-12-18 23:45:00,618] Trial 288 finished with value: 4.229877706184257 and parameters: {'learning_rate': 0.09277686988623432, 'aft_loss_distribution': 'logistic', 'aft_loss_distribution_scale': 0.6381561042302655, 'max_depth': 3, 'booster': 'gbtree', 'scale_pos_weight': 1.5968060569074984, 'alpha': 8.485287674840569, 'lambda': 2.7816959230715264, 'eta': 0.8958439626577254, 'sampling_method': 'uniform', 'subsample': 0.4419665612480296, 'gamma': 9.2635558940083}. Best is trial 100 with value: 4.194510122949977.
[I 2023-12-18 23:45:00,743] Trial 289 pruned. Trial was pruned at iteration 0.
[I 2023-12-18 23:45:00,871] Trial 290 pruned. Trial was pruned at iteration 0.
[I 2023-12-18 23:45:00,992] Trial 291 pruned. Trial was pruned at iteration 0.
[I 2023-12-18 23:45:01,123] Trial 292 pruned. Trial was pruned at iteration 0.
[I 2023-12-18 23:45:01,255] Trial 293 pruned. Trial was pruned at iteration 0.
[I 2023-12-18 23:45:01,376] Trial 294 pruned. Trial was pruned at iteration 0.
[I 2023-12-18 23:45:01,501] Trial 295 pruned. Trial was pruned at iteration 1.
[I 2023-12-18 23:45:01,622] Trial 296 pruned. Trial was pruned at iteration 0.
[I 2023-12-18 23:45:01,739] Trial 297 pruned. Trial was pruned at iteration 0.
[I 2023-12-18 23:45:01,879] Trial 298 pruned. Trial was pruned at iteration 0.
[I 2023-12-18 23:45:02,850] Trial 299 pruned. Trial was pruned at iteration 302.
[I 2023-12-18 23:45:02,984] Trial 300 pruned. Trial was pruned at iteration 0.
[I 2023-12-18 23:45:03,113] Trial 301 pruned. Trial was pruned at iteration 0.
[I 2023-12-18 23:45:03,257] Trial 302 pruned. Trial was pruned at iteration 0.
[I 2023-12-18 23:45:03,393] Trial 303 pruned. Trial was pruned at iteration 1.
[I 2023-12-18 23:45:03,542] Trial 304 pruned. Trial was pruned at iteration 0.
[I 2023-12-18 23:45:03,704] Trial 305 pruned. Trial was pruned at iteration 0.
[I 2023-12-18 23:45:03,872] Trial 306 pruned. Trial was pruned at iteration 0.
[I 2023-12-18 23:45:04,030] Trial 307 pruned. Trial was pruned at iteration 0.
[I 2023-12-18 23:45:04,172] Trial 308 pruned. Trial was pruned at iteration 0.
[I 2023-12-18 23:45:04,310] Trial 309 pruned. Trial was pruned at iteration 0.
[I 2023-12-18 23:45:04,433] Trial 310 pruned. Trial was pruned at iteration 0.
[I 2023-12-18 23:45:04,551] Trial 311 pruned. Trial was pruned at iteration 0.
[I 2023-12-18 23:45:05,354] Trial 312 pruned. Trial was pruned at iteration 304.
[I 2023-12-18 23:45:05,435] Trial 313 pruned. Trial was pruned at iteration 0.
[I 2023-12-18 23:45:05,513] Trial 314 pruned. Trial was pruned at iteration 0.
[I 2023-12-18 23:45:05,592] Trial 315 pruned. Trial was pruned at iteration 0.
[I 2023-12-18 23:45:05,674] Trial 316 pruned. Trial was pruned at iteration 0.
[I 2023-12-18 23:45:05,758] Trial 317 pruned. Trial was pruned at iteration 4.
[I 2023-12-18 23:45:05,845] Trial 318 pruned. Trial was pruned at iteration 0.
[I 2023-12-18 23:45:05,921] Trial 319 pruned. Trial was pruned at iteration 0.
[I 2023-12-18 23:45:05,998] Trial 320 pruned. Trial was pruned at iteration 0.
[I 2023-12-18 23:45:06,085] Trial 321 pruned. Trial was pruned at iteration 5.
[I 2023-12-18 23:45:06,160] Trial 322 pruned. Trial was pruned at iteration 0.
[I 2023-12-18 23:45:06,254] Trial 323 pruned. Trial was pruned at iteration 0.
[I 2023-12-18 23:45:06,342] Trial 324 pruned. Trial was pruned at iteration 0.
[I 2023-12-18 23:45:07,023] Trial 325 pruned. Trial was pruned at iteration 302.
[I 2023-12-18 23:45:07,104] Trial 326 pruned. Trial was pruned at iteration 1.
[I 2023-12-18 23:45:07,470] Trial 327 finished with value: 4.275423457295746 and parameters: {'learning_rate': 0.12975474975181206, 'aft_loss_distribution': 'logistic', 'aft_loss_distribution_scale': 0.7680624968169301, 'max_depth': 10, 'booster': 'gbtree', 'scale_pos_weight': 1.5320760165538592, 'alpha': 8.076174356604637, 'lambda': 1.8047425729342035, 'eta': 0.3580492928491756, 'sampling_method': 'uniform', 'subsample': 0.40351262817918165, 'gamma': 9.21210405623871}. Best is trial 100 with value: 4.194510122949977.
[I 2023-12-18 23:45:07,552] Trial 328 pruned. Trial was pruned at iteration 0.
[I 2023-12-18 23:45:07,630] Trial 329 pruned. Trial was pruned at iteration 0.
[I 2023-12-18 23:45:07,717] Trial 330 pruned. Trial was pruned at iteration 0.
[I 2023-12-18 23:45:07,815] Trial 331 pruned. Trial was pruned at iteration 9.
[I 2023-12-18 23:45:07,903] Trial 332 pruned. Trial was pruned at iteration 0.
[I 2023-12-18 23:45:07,980] Trial 333 pruned. Trial was pruned at iteration 0.
[I 2023-12-18 23:45:08,061] Trial 334 pruned. Trial was pruned at iteration 0.
[I 2023-12-18 23:45:08,146] Trial 335 pruned. Trial was pruned at iteration 0.
[I 2023-12-18 23:45:08,226] Trial 336 pruned. Trial was pruned at iteration 0.
[I 2023-12-18 23:45:08,306] Trial 337 pruned. Trial was pruned at iteration 0.
[I 2023-12-18 23:45:08,404] Trial 338 pruned. Trial was pruned at iteration 0.
[I 2023-12-18 23:45:08,531] Trial 339 pruned. Trial was pruned at iteration 15.
[I 2023-12-18 23:45:08,614] Trial 340 pruned. Trial was pruned at iteration 0.
[I 2023-12-18 23:45:08,701] Trial 341 pruned. Trial was pruned at iteration 0.
[I 2023-12-18 23:45:08,793] Trial 342 pruned. Trial was pruned at iteration 0.
[I 2023-12-18 23:45:08,877] Trial 343 pruned. Trial was pruned at iteration 0.
[I 2023-12-18 23:45:09,411] Trial 344 finished with value: 4.26877506488382 and parameters: {'learning_rate': 0.13939737946315234, 'aft_loss_distribution': 'logistic', 'aft_loss_distribution_scale': 0.7592308387088456, 'max_depth': 3, 'booster': 'gbtree', 'scale_pos_weight': 3.075799624482447, 'alpha': 8.13036540753551, 'lambda': 2.4810929660523207, 'eta': 0.8069177943686802, 'sampling_method': 'gradient_based', 'subsample': 0.43031335882286614, 'gamma': 6.718797554396915}. Best is trial 100 with value: 4.194510122949977.
[I 2023-12-18 23:45:09,502] Trial 345 pruned. Trial was pruned at iteration 0.
[I 2023-12-18 23:45:09,587] Trial 346 pruned. Trial was pruned at iteration 0.
[I 2023-12-18 23:45:09,681] Trial 347 pruned. Trial was pruned at iteration 0.
[I 2023-12-18 23:45:09,766] Trial 348 pruned. Trial was pruned at iteration 0.
[I 2023-12-18 23:45:09,865] Trial 349 pruned. Trial was pruned at iteration 0.
[I 2023-12-18 23:45:09,945] Trial 350 pruned. Trial was pruned at iteration 0.
[I 2023-12-18 23:45:10,280] Trial 351 finished with value: 4.277571735976425 and parameters: {'learning_rate': 0.12690151443995515, 'aft_loss_distribution': 'logistic', 'aft_loss_distribution_scale': 0.7758481329084009, 'max_depth': 3, 'booster': 'gbtree', 'scale_pos_weight': 2.5414538647988016, 'alpha': 8.490406185115786, 'lambda': 2.49508351781182, 'eta': 0.8574973386711368, 'sampling_method': 'gradient_based', 'subsample': 0.48145291838612336, 'gamma': 8.516044298901447}. Best is trial 100 with value: 4.194510122949977.
[I 2023-12-18 23:45:10,364] Trial 352 pruned. Trial was pruned at iteration 0.
[I 2023-12-18 23:45:10,460] Trial 353 pruned. Trial was pruned at iteration 0.
[I 2023-12-18 23:45:10,554] Trial 354 pruned. Trial was pruned at iteration 0.
[I 2023-12-18 23:45:10,640] Trial 355 pruned. Trial was pruned at iteration 0.
[I 2023-12-18 23:45:10,735] Trial 356 pruned. Trial was pruned at iteration 0.
[I 2023-12-18 23:45:10,816] Trial 357 pruned. Trial was pruned at iteration 0.
[I 2023-12-18 23:45:10,907] Trial 358 pruned. Trial was pruned at iteration 0.
[I 2023-12-18 23:45:10,988] Trial 359 pruned. Trial was pruned at iteration 0.
[I 2023-12-18 23:45:11,074] Trial 360 pruned. Trial was pruned at iteration 0.
[I 2023-12-18 23:45:11,164] Trial 361 pruned. Trial was pruned at iteration 0.
[I 2023-12-18 23:45:11,250] Trial 362 pruned. Trial was pruned at iteration 0.
[I 2023-12-18 23:45:11,332] Trial 363 pruned. Trial was pruned at iteration 0.
[I 2023-12-18 23:45:11,417] Trial 364 pruned. Trial was pruned at iteration 0.
[I 2023-12-18 23:45:11,515] Trial 365 pruned. Trial was pruned at iteration 0.
[I 2023-12-18 23:45:11,599] Trial 366 pruned. Trial was pruned at iteration 0.
[I 2023-12-18 23:45:11,681] Trial 367 pruned. Trial was pruned at iteration 0.
[I 2023-12-18 23:45:11,792] Trial 368 pruned. Trial was pruned at iteration 11.
[I 2023-12-18 23:45:11,878] Trial 369 pruned. Trial was pruned at iteration 0.
[I 2023-12-18 23:45:11,970] Trial 370 pruned. Trial was pruned at iteration 0.
[I 2023-12-18 23:45:12,061] Trial 371 pruned. Trial was pruned at iteration 0.
[I 2023-12-18 23:45:12,144] Trial 372 pruned. Trial was pruned at iteration 0.
[I 2023-12-18 23:45:12,227] Trial 373 pruned. Trial was pruned at iteration 0.
[I 2023-12-18 23:45:12,303] Trial 374 pruned. Trial was pruned at iteration 0.
[I 2023-12-18 23:45:12,672] Trial 375 finished with value: 4.260237369841928 and parameters: {'learning_rate': 0.14645797434983981, 'aft_loss_distribution': 'logistic', 'aft_loss_distribution_scale': 0.7497459662370762, 'max_depth': 3, 'booster': 'gbtree', 'scale_pos_weight': 0.7556484897039383, 'alpha': 8.714474188975991, 'lambda': 2.5947862922713854, 'eta': 0.8649839429314461, 'sampling_method': 'uniform', 'subsample': 0.4883620521133547, 'gamma': 4.469529287254218}. Best is trial 100 with value: 4.194510122949977.
[I 2023-12-18 23:45:12,762] Trial 376 pruned. Trial was pruned at iteration 0.
[I 2023-12-18 23:45:12,844] Trial 377 pruned. Trial was pruned at iteration 0.
[I 2023-12-18 23:45:12,934] Trial 378 pruned. Trial was pruned at iteration 0.
[I 2023-12-18 23:45:13,036] Trial 379 pruned. Trial was pruned at iteration 7.
[I 2023-12-18 23:45:13,131] Trial 380 pruned. Trial was pruned at iteration 0.
[I 2023-12-18 23:45:13,228] Trial 381 pruned. Trial was pruned at iteration 0.
[I 2023-12-18 23:45:13,312] Trial 382 pruned. Trial was pruned at iteration 0.
[I 2023-12-18 23:45:13,401] Trial 383 pruned. Trial was pruned at iteration 3.
[I 2023-12-18 23:45:13,496] Trial 384 pruned. Trial was pruned at iteration 0.
[I 2023-12-18 23:45:13,581] Trial 385 pruned. Trial was pruned at iteration 0.
[I 2023-12-18 23:45:13,659] Trial 386 pruned. Trial was pruned at iteration 0.
[I 2023-12-18 23:45:13,749] Trial 387 pruned. Trial was pruned at iteration 0.
[I 2023-12-18 23:45:13,835] Trial 388 pruned. Trial was pruned at iteration 0.
[I 2023-12-18 23:45:14,196] Trial 389 finished with value: 4.255080456184197 and parameters: {'learning_rate': 0.14719109351138016, 'aft_loss_distribution': 'logistic', 'aft_loss_distribution_scale': 0.7387510655509851, 'max_depth': 4, 'booster': 'gbtree', 'scale_pos_weight': 2.351277130097989, 'alpha': 8.754926283277591, 'lambda': 2.72700047791401, 'eta': 0.2458825648833918, 'sampling_method': 'uniform', 'subsample': 0.46265536378164024, 'gamma': 4.3911719008923376}. Best is trial 100 with value: 4.194510122949977.
[I 2023-12-18 23:45:14,293] Trial 390 pruned. Trial was pruned at iteration 0.
[I 2023-12-18 23:45:14,721] Trial 391 finished with value: 4.256907985653317 and parameters: {'learning_rate': 0.14186353306500565, 'aft_loss_distribution': 'logistic', 'aft_loss_distribution_scale': 0.7431469852923919, 'max_depth': 5, 'booster': 'gbtree', 'scale_pos_weight': 2.0005015773672783, 'alpha': 8.913102547756749, 'lambda': 2.731210766115389, 'eta': 0.4431959605682193, 'sampling_method': 'uniform', 'subsample': 0.5043184165060006, 'gamma': 4.108677624345537}. Best is trial 100 with value: 4.194510122949977.
[I 2023-12-18 23:45:14,861] Trial 392 pruned. Trial was pruned at iteration 0.
[I 2023-12-18 23:45:14,997] Trial 393 pruned. Trial was pruned at iteration 0.
[I 2023-12-18 23:45:15,139] Trial 394 pruned. Trial was pruned at iteration 0.
[I 2023-12-18 23:45:15,268] Trial 395 pruned. Trial was pruned at iteration 0.
[I 2023-12-18 23:45:15,405] Trial 396 pruned. Trial was pruned at iteration 0.
[I 2023-12-18 23:45:15,545] Trial 397 pruned. Trial was pruned at iteration 0.
[I 2023-12-18 23:45:15,680] Trial 398 pruned. Trial was pruned at iteration 0.
[I 2023-12-18 23:45:15,812] Trial 399 pruned. Trial was pruned at iteration 0.
[I 2023-12-18 23:45:15,959] Trial 400 pruned. Trial was pruned at iteration 0.
[I 2023-12-18 23:45:16,102] Trial 401 pruned. Trial was pruned at iteration 0.
[I 2023-12-18 23:45:16,250] Trial 402 pruned. Trial was pruned at iteration 0.
[I 2023-12-18 23:45:16,384] Trial 403 pruned. Trial was pruned at iteration 0.
[I 2023-12-18 23:45:16,523] Trial 404 pruned. Trial was pruned at iteration 0.
[I 2023-12-18 23:45:16,660] Trial 405 pruned. Trial was pruned at iteration 0.
[I 2023-12-18 23:45:16,795] Trial 406 pruned. Trial was pruned at iteration 0.
[I 2023-12-18 23:45:16,936] Trial 407 pruned. Trial was pruned at iteration 0.
[I 2023-12-18 23:45:17,093] Trial 408 pruned. Trial was pruned at iteration 0.
[I 2023-12-18 23:45:17,241] Trial 409 pruned. Trial was pruned at iteration 0.
[I 2023-12-18 23:45:17,379] Trial 410 pruned. Trial was pruned at iteration 0.
[I 2023-12-18 23:45:17,512] Trial 411 pruned. Trial was pruned at iteration 0.
[I 2023-12-18 23:45:17,652] Trial 412 pruned. Trial was pruned at iteration 0.
[I 2023-12-18 23:45:18,391] Trial 413 finished with value: 4.249730744722718 and parameters: {'learning_rate': 0.11016956084378751, 'aft_loss_distribution': 'logistic', 'aft_loss_distribution_scale': 0.6906659606672054, 'max_depth': 3, 'booster': 'gbtree', 'scale_pos_weight': 2.021279203877111, 'alpha': 8.992273047538996, 'lambda': 1.6792347418384517, 'eta': 0.9649523273234022, 'sampling_method': 'uniform', 'subsample': 0.41767267163272037, 'gamma': 3.0884021583838344}. Best is trial 100 with value: 4.194510122949977.
[I 2023-12-18 23:45:18,533] Trial 414 pruned. Trial was pruned at iteration 0.
[I 2023-12-18 23:45:18,693] Trial 415 pruned. Trial was pruned at iteration 0.
[I 2023-12-18 23:45:18,841] Trial 416 pruned. Trial was pruned at iteration 0.
[I 2023-12-18 23:45:18,989] Trial 417 pruned. Trial was pruned at iteration 0.
[I 2023-12-18 23:45:19,125] Trial 418 pruned. Trial was pruned at iteration 0.
[I 2023-12-18 23:45:19,267] Trial 419 pruned. Trial was pruned at iteration 0.
[I 2023-12-18 23:45:19,405] Trial 420 pruned. Trial was pruned at iteration 1.
[I 2023-12-18 23:45:19,547] Trial 421 pruned. Trial was pruned at iteration 0.
[I 2023-12-18 23:45:19,682] Trial 422 pruned. Trial was pruned at iteration 0.
[I 2023-12-18 23:45:19,826] Trial 423 pruned. Trial was pruned at iteration 0.
[I 2023-12-18 23:45:19,926] Trial 424 pruned. Trial was pruned at iteration 0.
[I 2023-12-18 23:45:20,026] Trial 425 pruned. Trial was pruned at iteration 0.
[I 2023-12-18 23:45:20,119] Trial 426 pruned. Trial was pruned at iteration 0.
[I 2023-12-18 23:45:20,224] Trial 427 pruned. Trial was pruned at iteration 0.
[I 2023-12-18 23:45:20,307] Trial 428 pruned. Trial was pruned at iteration 0.
[I 2023-12-18 23:45:20,392] Trial 429 pruned. Trial was pruned at iteration 0.
[I 2023-12-18 23:45:20,480] Trial 430 pruned. Trial was pruned at iteration 0.
[I 2023-12-18 23:45:20,838] Trial 431 finished with value: 4.262071304855195 and parameters: {'learning_rate': 0.13683508117157261, 'aft_loss_distribution': 'logistic', 'aft_loss_distribution_scale': 0.7531080217349706, 'max_depth': 3, 'booster': 'gbtree', 'scale_pos_weight': 2.3089289382166838, 'alpha': 8.254180879744096, 'lambda': 3.172745945077625, 'eta': 0.8922021476066708, 'sampling_method': 'uniform', 'subsample': 0.46168765406960305, 'gamma': 2.0325665164979196}. Best is trial 100 with value: 4.194510122949977.
[I 2023-12-18 23:45:20,931] Trial 432 pruned. Trial was pruned at iteration 0.
[I 2023-12-18 23:45:21,014] Trial 433 pruned. Trial was pruned at iteration 0.
[I 2023-12-18 23:45:21,112] Trial 434 pruned. Trial was pruned at iteration 0.
[I 2023-12-18 23:45:21,556] Trial 435 finished with value: 4.268737475328619 and parameters: {'learning_rate': 0.1418148623692227, 'aft_loss_distribution': 'logistic', 'aft_loss_distribution_scale': 0.7538569661841608, 'max_depth': 3, 'booster': 'gbtree', 'scale_pos_weight': 2.46716942064912, 'alpha': 8.044908616959972, 'lambda': 3.5474471864376613, 'eta': 0.8747237030779187, 'sampling_method': 'gradient_based', 'subsample': 0.5152982825251616, 'gamma': 2.0395291177184296}. Best is trial 100 with value: 4.194510122949977.
[I 2023-12-18 23:45:21,653] Trial 436 pruned. Trial was pruned at iteration 0.
[I 2023-12-18 23:45:21,756] Trial 437 pruned. Trial was pruned at iteration 0.
[I 2023-12-18 23:45:21,859] Trial 438 pruned. Trial was pruned at iteration 0.
[I 2023-12-18 23:45:21,945] Trial 439 pruned. Trial was pruned at iteration 0.
[I 2023-12-18 23:45:22,046] Trial 440 pruned. Trial was pruned at iteration 0.
[I 2023-12-18 23:45:22,155] Trial 441 pruned. Trial was pruned at iteration 1.
[I 2023-12-18 23:45:22,246] Trial 442 pruned. Trial was pruned at iteration 0.
[I 2023-12-18 23:45:22,330] Trial 443 pruned. Trial was pruned at iteration 0.
[I 2023-12-18 23:45:22,420] Trial 444 pruned. Trial was pruned at iteration 0.
[I 2023-12-18 23:45:22,510] Trial 445 pruned. Trial was pruned at iteration 0.
[I 2023-12-18 23:45:22,599] Trial 446 pruned. Trial was pruned at iteration 0.
[I 2023-12-18 23:45:22,688] Trial 447 pruned. Trial was pruned at iteration 0.
[I 2023-12-18 23:45:22,779] Trial 448 pruned. Trial was pruned at iteration 0.
[I 2023-12-18 23:45:22,881] Trial 449 pruned. Trial was pruned at iteration 0.
[I 2023-12-18 23:45:22,969] Trial 450 pruned. Trial was pruned at iteration 0.
[I 2023-12-18 23:45:23,061] Trial 451 pruned. Trial was pruned at iteration 0.
[I 2023-12-18 23:45:23,145] Trial 452 pruned. Trial was pruned at iteration 0.
[I 2023-12-18 23:45:23,238] Trial 453 pruned. Trial was pruned at iteration 0.
[I 2023-12-18 23:45:23,336] Trial 454 pruned. Trial was pruned at iteration 0.
[I 2023-12-18 23:45:23,920] Trial 455 finished with value: 4.1973868941684795 and parameters: {'learning_rate': 0.10060763031218486, 'aft_loss_distribution': 'logistic', 'aft_loss_distribution_scale': 0.5949547225959747, 'max_depth': 8, 'booster': 'gbtree', 'scale_pos_weight': 1.8036021152492017, 'alpha': 8.033670663050778, 'lambda': 7.702987362443796, 'eta': 0.9217342049521808, 'sampling_method': 'uniform', 'subsample': 0.4834145209419818, 'gamma': 2.7327448943233055}. Best is trial 100 with value: 4.194510122949977.
[I 2023-12-18 23:45:24,030] Trial 456 pruned. Trial was pruned at iteration 0.
[I 2023-12-18 23:45:24,125] Trial 457 pruned. Trial was pruned at iteration 0.
[I 2023-12-18 23:45:24,216] Trial 458 pruned. Trial was pruned at iteration 0.
[I 2023-12-18 23:45:24,305] Trial 459 pruned. Trial was pruned at iteration 0.
[I 2023-12-18 23:45:24,401] Trial 460 pruned. Trial was pruned at iteration 0.
[I 2023-12-18 23:45:24,490] Trial 461 pruned. Trial was pruned at iteration 0.
[I 2023-12-18 23:45:24,579] Trial 462 pruned. Trial was pruned at iteration 0.
[I 2023-12-18 23:46:05,330] Trial 463 finished with value: 4.183192035680075 and parameters: {'learning_rate': 0.07532975672558279, 'aft_loss_distribution': 'logistic', 'aft_loss_distribution_scale': 0.514690478552005, 'max_depth': 10, 'booster': 'dart', 'scale_pos_weight': 2.956201071666726, 'alpha': 7.807247316167578, 'lambda': 7.1764476444832885, 'eta': 0.9760553966141641, 'sampling_method': 'uniform', 'subsample': 0.5164819508913462, 'gamma': 8.939061473836933}. Best is trial 463 with value: 4.183192035680075.
[I 2023-12-18 23:46:05,431] Trial 464 pruned. Trial was pruned at iteration 0.
[I 2023-12-18 23:46:05,528] Trial 465 pruned. Trial was pruned at iteration 0.
[I 2023-12-18 23:46:05,618] Trial 466 pruned. Trial was pruned at iteration 0.
