[I 2023-12-19 01:08:31,816] Trial 386 finished with value: 2.0735659237868767 and parameters: {'learning_rate': 0.37979950027216514, 'aft_loss_distribution': 'logistic', 'aft_loss_distribution_scale': 1.3206293101192197, 'max_depth': 8, 'booster': 'dart', 'scale_pos_weight': 2.6766211784424745, 'alpha': 5.609349048589885, 'lambda': 9.998659708053344, 'eta': 0.7902290112898822, 'sampling_method': 'uniform', 'subsample': 0.1871834344298312, 'gamma': 7.007382632256597}. Best is trial 373 with value: 2.054088830435347.
[I 2023-12-19 01:08:31,991] Trial 387 pruned. Trial was pruned at iteration 0.
[I 2023-12-19 01:08:32,136] Trial 388 pruned. Trial was pruned at iteration 0.
[I 2023-12-19 01:08:35,596] Trial 389 finished with value: 2.060045948477917 and parameters: {'learning_rate': 0.41121772935239254, 'aft_loss_distribution': 'logistic', 'aft_loss_distribution_scale': 1.3214608477734389, 'max_depth': 8, 'booster': 'dart', 'scale_pos_weight': 2.8035092604692737, 'alpha': 5.326824363421186, 'lambda': 9.817832337957984, 'eta': 0.8079838044704687, 'sampling_method': 'uniform', 'subsample': 0.25696844292254045, 'gamma': 6.858368235192041}. Best is trial 373 with value: 2.054088830435347.
[I 2023-12-19 01:08:35,713] Trial 390 pruned. Trial was pruned at iteration 0.
[I 2023-12-19 01:08:35,835] Trial 391 pruned. Trial was pruned at iteration 0.
[I 2023-12-19 01:08:36,005] Trial 392 pruned. Trial was pruned at iteration 3.
[I 2023-12-19 01:08:36,106] Trial 393 pruned. Trial was pruned at iteration 0.
[I 2023-12-19 01:08:38,662] Trial 394 finished with value: 2.0575013622781815 and parameters: {'learning_rate': 0.4409681266592048, 'aft_loss_distribution': 'logistic', 'aft_loss_distribution_scale': 1.346213060016991, 'max_depth': 8, 'booster': 'dart', 'scale_pos_weight': 2.500845275371641, 'alpha': 5.949911567613934, 'lambda': 9.991350941423164, 'eta': 0.819813117896612, 'sampling_method': 'uniform', 'subsample': 0.242767916076484, 'gamma': 7.181868131635706}. Best is trial 373 with value: 2.054088830435347.
[I 2023-12-19 01:08:42,266] Trial 395 finished with value: 2.0669644822084945 and parameters: {'learning_rate': 0.4463248760665198, 'aft_loss_distribution': 'logistic', 'aft_loss_distribution_scale': 1.367522204604583, 'max_depth': 8, 'booster': 'dart', 'scale_pos_weight': 2.7494669517207986, 'alpha': 5.90697996051255, 'lambda': 9.974804658772497, 'eta': 0.8171502068391142, 'sampling_method': 'uniform', 'subsample': 0.2339647461580363, 'gamma': 7.2722694992589725}. Best is trial 373 with value: 2.054088830435347.
[I 2023-12-19 01:08:42,384] Trial 396 pruned. Trial was pruned at iteration 0.
[I 2023-12-19 01:08:45,071] Trial 397 finished with value: inf and parameters: {'learning_rate': 0.3955855270508693, 'aft_loss_distribution': 'logistic', 'aft_loss_distribution_scale': 1.3016442459177717, 'max_depth': 8, 'booster': 'dart', 'scale_pos_weight': 2.4969165696694575, 'alpha': 5.66761754261894, 'lambda': 9.821920285814322, 'eta': 0.8173405391305849, 'sampling_method': 'uniform', 'subsample': 0.2666092843331109, 'gamma': 7.435170514310322}. Best is trial 373 with value: 2.054088830435347.
[I 2023-12-19 01:08:45,233] Trial 398 pruned. Trial was pruned at iteration 0.
[I 2023-12-19 01:08:51,621] Trial 399 finished with value: 2.075730894287323 and parameters: {'learning_rate': 0.43101570190769206, 'aft_loss_distribution': 'logistic', 'aft_loss_distribution_scale': 1.3284320516261883, 'max_depth': 8, 'booster': 'dart', 'scale_pos_weight': 2.6030896526613905, 'alpha': 6.13917173095007, 'lambda': 9.669000468373277, 'eta': 0.8097565870709601, 'sampling_method': 'uniform', 'subsample': 0.19085667140234144, 'gamma': 6.89815063311484}. Best is trial 373 with value: 2.054088830435347.
[I 2023-12-19 01:08:54,829] Trial 400 finished with value: 2.077317592538448 and parameters: {'learning_rate': 0.4255361865506272, 'aft_loss_distribution': 'logistic', 'aft_loss_distribution_scale': 1.3555115811657121, 'max_depth': 8, 'booster': 'dart', 'scale_pos_weight': 2.5872795502118935, 'alpha': 5.996413107731149, 'lambda': 9.644266157641011, 'eta': 0.8082770848232499, 'sampling_method': 'uniform', 'subsample': 0.1844549187955705, 'gamma': 7.282762007610806}. Best is trial 373 with value: 2.054088830435347.
[I 2023-12-19 01:09:01,108] Trial 401 finished with value: 2.0650711474690215 and parameters: {'learning_rate': 0.4331235580191891, 'aft_loss_distribution': 'logistic', 'aft_loss_distribution_scale': 1.3460171549525295, 'max_depth': 8, 'booster': 'dart', 'scale_pos_weight': 2.6698499991303586, 'alpha': 6.115507824527781, 'lambda': 9.59971607611147, 'eta': 0.7724230876150266, 'sampling_method': 'uniform', 'subsample': 0.14074398737960736, 'gamma': 7.703570645046269}. Best is trial 373 with value: 2.054088830435347.
[I 2023-12-19 01:09:01,280] Trial 402 pruned. Trial was pruned at iteration 0.
[I 2023-12-19 01:09:03,731] Trial 403 finished with value: inf and parameters: {'learning_rate': 0.3722165404022317, 'aft_loss_distribution': 'logistic', 'aft_loss_distribution_scale': 1.1107728637056729, 'max_depth': 8, 'booster': 'dart', 'scale_pos_weight': 2.6476740132615944, 'alpha': 5.7622621661428255, 'lambda': 9.62211705113887, 'eta': 0.7862915959257816, 'sampling_method': 'uniform', 'subsample': 0.13568199720631627, 'gamma': 7.341313667122896}. Best is trial 373 with value: 2.054088830435347.
[I 2023-12-19 01:09:45,736] Trial 404 finished with value: 2.0602457970478043 and parameters: {'learning_rate': 0.4479256681654212, 'aft_loss_distribution': 'logistic', 'aft_loss_distribution_scale': 1.338749113388011, 'max_depth': 8, 'booster': 'dart', 'scale_pos_weight': 2.5784722590454936, 'alpha': 6.099621423366097, 'lambda': 9.550864383649873, 'eta': 0.8037867298942617, 'sampling_method': 'uniform', 'subsample': 0.10627057492329624, 'gamma': 7.667400513382111}. Best is trial 373 with value: 2.054088830435347.
[I 2023-12-19 01:09:48,500] Trial 405 finished with value: 2.0593747573873458 and parameters: {'learning_rate': 0.43955232574352127, 'aft_loss_distribution': 'logistic', 'aft_loss_distribution_scale': 1.3039060677040641, 'max_depth': 8, 'booster': 'dart', 'scale_pos_weight': 2.5922394594781077, 'alpha': 6.0790455146647435, 'lambda': 9.527934844468136, 'eta': 0.8111585875280156, 'sampling_method': 'uniform', 'subsample': 0.1250119658887224, 'gamma': 7.673262148211247}. Best is trial 373 with value: 2.054088830435347.
[I 2023-12-19 01:09:48,600] Trial 406 pruned. Trial was pruned at iteration 0.
[I 2023-12-19 01:10:02,644] Trial 407 finished with value: 2.0715953123002286 and parameters: {'learning_rate': 0.41346253023017104, 'aft_loss_distribution': 'logistic', 'aft_loss_distribution_scale': 1.277621126530049, 'max_depth': 8, 'booster': 'dart', 'scale_pos_weight': 2.7306783971287274, 'alpha': 5.832030482201689, 'lambda': 9.997270166024398, 'eta': 0.761337262848695, 'sampling_method': 'uniform', 'subsample': 0.08531045940574071, 'gamma': 7.665917642880978}. Best is trial 373 with value: 2.054088830435347.
[I 2023-12-19 01:10:04,622] Trial 408 finished with value: inf and parameters: {'learning_rate': 0.41600817617730834, 'aft_loss_distribution': 'logistic', 'aft_loss_distribution_scale': 1.1090999825950008, 'max_depth': 8, 'booster': 'dart', 'scale_pos_weight': 2.7152623185622153, 'alpha': 5.819882598549897, 'lambda': 9.528198897571043, 'eta': 0.7728255394234742, 'sampling_method': 'uniform', 'subsample': 0.08975840504659024, 'gamma': 7.76673469524344}. Best is trial 373 with value: 2.054088830435347.
[I 2023-12-19 01:10:08,836] Trial 409 finished with value: 2.0546289329908354 and parameters: {'learning_rate': 0.44681994544444675, 'aft_loss_distribution': 'logistic', 'aft_loss_distribution_scale': 1.2805777500090216, 'max_depth': 8, 'booster': 'dart', 'scale_pos_weight': 2.8446859346474085, 'alpha': 5.511448691746667, 'lambda': 9.658485665707897, 'eta': 0.7480403394080478, 'sampling_method': 'uniform', 'subsample': 0.11796074912434788, 'gamma': 7.940324725376557}. Best is trial 373 with value: 2.054088830435347.
[I 2023-12-19 01:10:08,941] Trial 410 pruned. Trial was pruned at iteration 0.
[I 2023-12-19 01:10:14,169] Trial 411 finished with value: 2.0504398276749463 and parameters: {'learning_rate': 0.4417058909983389, 'aft_loss_distribution': 'logistic', 'aft_loss_distribution_scale': 1.2642570918781648, 'max_depth': 8, 'booster': 'dart', 'scale_pos_weight': 2.84543068535852, 'alpha': 5.502289362311264, 'lambda': 9.647254174289603, 'eta': 0.7668926188010303, 'sampling_method': 'uniform', 'subsample': 0.12161269523624604, 'gamma': 7.723296629475847}. Best is trial 411 with value: 2.0504398276749463.
[I 2023-12-19 01:10:14,326] Trial 412 pruned. Trial was pruned at iteration 0.
[I 2023-12-19 01:10:23,127] Trial 413 finished with value: 2.0520937265021613 and parameters: {'learning_rate': 0.42796437993526637, 'aft_loss_distribution': 'logistic', 'aft_loss_distribution_scale': 1.2617426937311984, 'max_depth': 8, 'booster': 'dart', 'scale_pos_weight': 2.7724681116891916, 'alpha': 5.434111995197736, 'lambda': 9.685117814123048, 'eta': 0.7572740075878516, 'sampling_method': 'uniform', 'subsample': 0.10839046530023391, 'gamma': 7.66502638950286}. Best is trial 411 with value: 2.0504398276749463.
[I 2023-12-19 01:10:23,253] Trial 414 pruned. Trial was pruned at iteration 0.
[I 2023-12-19 01:10:26,392] Trial 415 finished with value: 2.047233401347207 and parameters: {'learning_rate': 0.45581233253192244, 'aft_loss_distribution': 'logistic', 'aft_loss_distribution_scale': 1.1986527496265913, 'max_depth': 8, 'booster': 'dart', 'scale_pos_weight': 2.813701865699495, 'alpha': 5.294675233892674, 'lambda': 9.468691265341741, 'eta': 0.7363119558515674, 'sampling_method': 'uniform', 'subsample': 0.09422257567064855, 'gamma': 7.920302208896641}. Best is trial 415 with value: 2.047233401347207.
[I 2023-12-19 01:10:26,555] Trial 416 pruned. Trial was pruned at iteration 0.
[I 2023-12-19 01:10:26,689] Trial 417 pruned. Trial was pruned at iteration 0.
[I 2023-12-19 01:10:26,844] Trial 418 pruned. Trial was pruned at iteration 0.
[I 2023-12-19 01:10:26,986] Trial 419 pruned. Trial was pruned at iteration 0.
[I 2023-12-19 01:10:27,147] Trial 420 pruned. Trial was pruned at iteration 0.
[I 2023-12-19 01:10:27,284] Trial 421 pruned. Trial was pruned at iteration 0.
[I 2023-12-19 01:10:32,525] Trial 422 finished with value: 2.0533597742505894 and parameters: {'learning_rate': 0.4166402473191429, 'aft_loss_distribution': 'logistic', 'aft_loss_distribution_scale': 1.2560785044479719, 'max_depth': 8, 'booster': 'dart', 'scale_pos_weight': 2.8391372240359076, 'alpha': 4.808204395098699, 'lambda': 9.693968678815182, 'eta': 0.7847576987445999, 'sampling_method': 'uniform', 'subsample': 0.1129025650909184, 'gamma': 7.718621066172439}. Best is trial 415 with value: 2.047233401347207.
[I 2023-12-19 01:10:34,664] Trial 423 finished with value: inf and parameters: {'learning_rate': 0.40784708801928227, 'aft_loss_distribution': 'logistic', 'aft_loss_distribution_scale': 1.1666778995048783, 'max_depth': 8, 'booster': 'dart', 'scale_pos_weight': 3.020590499065891, 'alpha': 5.308368165105734, 'lambda': 9.821138809504221, 'eta': 0.7918598825122679, 'sampling_method': 'uniform', 'subsample': 0.10805812234508491, 'gamma': 7.735791337103583}. Best is trial 415 with value: 2.047233401347207.
[I 2023-12-19 01:10:34,758] Trial 424 pruned. Trial was pruned at iteration 0.
[I 2023-12-19 01:10:39,147] Trial 425 finished with value: 2.0514004161483057 and parameters: {'learning_rate': 0.41492212634825026, 'aft_loss_distribution': 'logistic', 'aft_loss_distribution_scale': 1.2524346602592926, 'max_depth': 8, 'booster': 'dart', 'scale_pos_weight': 2.809842145272179, 'alpha': 4.785042427904141, 'lambda': 9.465298297584182, 'eta': 0.7440888515041354, 'sampling_method': 'uniform', 'subsample': 0.11684053907026043, 'gamma': 7.403058082302625}. Best is trial 415 with value: 2.047233401347207.
[I 2023-12-19 01:10:42,127] Trial 426 finished with value: inf and parameters: {'learning_rate': 0.41432420063960596, 'aft_loss_distribution': 'logistic', 'aft_loss_distribution_scale': 1.1208575016779425, 'max_depth': 8, 'booster': 'dart', 'scale_pos_weight': 2.8419730059808725, 'alpha': 4.719976642399246, 'lambda': 9.457459722375205, 'eta': 0.7131732790488083, 'sampling_method': 'uniform', 'subsample': 0.11529009336748666, 'gamma': 8.096815654531738}. Best is trial 415 with value: 2.047233401347207.
[I 2023-12-19 01:10:42,299] Trial 427 pruned. Trial was pruned at iteration 0.
[I 2023-12-19 01:10:42,447] Trial 428 pruned. Trial was pruned at iteration 0.
[I 2023-12-19 01:10:42,610] Trial 429 pruned. Trial was pruned at iteration 0.
[I 2023-12-19 01:10:42,748] Trial 430 pruned. Trial was pruned at iteration 0.
[I 2023-12-19 01:10:42,881] Trial 431 pruned. Trial was pruned at iteration 0.
[I 2023-12-19 01:10:57,385] Trial 432 finished with value: 2.073038812875866 and parameters: {'learning_rate': 0.4448333347747446, 'aft_loss_distribution': 'logistic', 'aft_loss_distribution_scale': 1.2703872961597944, 'max_depth': 8, 'booster': 'dart', 'scale_pos_weight': 2.6729244086036017, 'alpha': 5.776702036080263, 'lambda': 9.998052888253792, 'eta': 0.742300254527293, 'sampling_method': 'uniform', 'subsample': 0.083693040284165, 'gamma': 7.9752978507063395}. Best is trial 415 with value: 2.047233401347207.
[I 2023-12-19 01:10:57,574] Trial 433 pruned. Trial was pruned at iteration 0.
[I 2023-12-19 01:10:57,715] Trial 434 pruned. Trial was pruned at iteration 0.
[I 2023-12-19 01:10:57,876] Trial 435 pruned. Trial was pruned at iteration 0.
[I 2023-12-19 01:10:58,043] Trial 436 pruned. Trial was pruned at iteration 0.
[I 2023-12-19 01:10:58,210] Trial 437 pruned. Trial was pruned at iteration 0.
[I 2023-12-19 01:11:01,301] Trial 438 finished with value: 2.0558476345647785 and parameters: {'learning_rate': 0.42279788419115294, 'aft_loss_distribution': 'logistic', 'aft_loss_distribution_scale': 1.2938554707794836, 'max_depth': 8, 'booster': 'dart', 'scale_pos_weight': 2.5863611535617683, 'alpha': 5.008341453763346, 'lambda': 9.990635117631586, 'eta': 0.7968250825897323, 'sampling_method': 'uniform', 'subsample': 0.12613765262574125, 'gamma': 7.954401693067538}. Best is trial 415 with value: 2.047233401347207.
[I 2023-12-19 01:11:03,564] Trial 439 finished with value: inf and parameters: {'learning_rate': 0.4200247713515831, 'aft_loss_distribution': 'logistic', 'aft_loss_distribution_scale': 1.1617115826922562, 'max_depth': 8, 'booster': 'dart', 'scale_pos_weight': 2.5657632502840046, 'alpha': 5.07755078950437, 'lambda': 9.641501393058501, 'eta': 0.7287303498211023, 'sampling_method': 'uniform', 'subsample': 0.13315305637852887, 'gamma': 7.988289367186639}. Best is trial 415 with value: 2.047233401347207.
[I 2023-12-19 01:11:45,371] Trial 440 finished with value: 2.067140508560766 and parameters: {'learning_rate': 0.4420857613155319, 'aft_loss_distribution': 'logistic', 'aft_loss_distribution_scale': 1.362931585157578, 'max_depth': 8, 'booster': 'dart', 'scale_pos_weight': 2.5860062669824173, 'alpha': 4.810821309013413, 'lambda': 9.834276243184858, 'eta': 0.8520234673816706, 'sampling_method': 'uniform', 'subsample': 0.10062744215317126, 'gamma': 8.347363280731367}. Best is trial 415 with value: 2.047233401347207.
[I 2023-12-19 01:11:45,480] Trial 441 pruned. Trial was pruned at iteration 0.
[I 2023-12-19 01:12:24,267] Trial 442 finished with value: 2.065576533152605 and parameters: {'learning_rate': 0.42339761861812264, 'aft_loss_distribution': 'logistic', 'aft_loss_distribution_scale': 1.3483911236685366, 'max_depth': 8, 'booster': 'dart', 'scale_pos_weight': 2.9758503299308785, 'alpha': 4.888212207911497, 'lambda': 9.804866517414712, 'eta': 0.8239068585977007, 'sampling_method': 'uniform', 'subsample': 0.11767160612808357, 'gamma': 8.409541559016596}. Best is trial 415 with value: 2.047233401347207.
[I 2023-12-19 01:12:29,758] Trial 443 finished with value: 2.0791981854652763 and parameters: {'learning_rate': 0.4367464755765438, 'aft_loss_distribution': 'logistic', 'aft_loss_distribution_scale': 1.4167389617517931, 'max_depth': 8, 'booster': 'dart', 'scale_pos_weight': 3.0030713557340376, 'alpha': 4.961570865683138, 'lambda': 9.559022237712185, 'eta': 0.8548630133029984, 'sampling_method': 'uniform', 'subsample': 0.12401609041166996, 'gamma': 8.549707493731672}. Best is trial 415 with value: 2.047233401347207.
[I 2023-12-19 01:12:29,894] Trial 444 pruned. Trial was pruned at iteration 0.
[I 2023-12-19 01:12:39,535] Trial 445 finished with value: 2.077512658836679 and parameters: {'learning_rate': 0.4269032983796746, 'aft_loss_distribution': 'logistic', 'aft_loss_distribution_scale': 1.4161512856330993, 'max_depth': 7, 'booster': 'dart', 'scale_pos_weight': 2.5605469918541535, 'alpha': 4.844415609718845, 'lambda': 9.671024761621723, 'eta': 0.8405405518153817, 'sampling_method': 'uniform', 'subsample': 0.14158885478549044, 'gamma': 8.395846090477102}. Best is trial 415 with value: 2.047233401347207.
[I 2023-12-19 01:12:39,670] Trial 446 pruned. Trial was pruned at iteration 0.
[I 2023-12-19 01:12:39,763] Trial 447 pruned. Trial was pruned at iteration 0.
[I 2023-12-19 01:12:39,865] Trial 448 pruned. Trial was pruned at iteration 0.
[I 2023-12-19 01:12:39,985] Trial 449 pruned. Trial was pruned at iteration 0.
[I 2023-12-19 01:12:40,081] Trial 450 pruned. Trial was pruned at iteration 0.
[I 2023-12-19 01:12:43,703] Trial 451 finished with value: 2.0756423278292133 and parameters: {'learning_rate': 0.43098533827629143, 'aft_loss_distribution': 'logistic', 'aft_loss_distribution_scale': 1.4277876192491836, 'max_depth': 8, 'booster': 'dart', 'scale_pos_weight': 2.8011793570743215, 'alpha': 5.341727974381104, 'lambda': 9.44607304968569, 'eta': 0.8600456967972969, 'sampling_method': 'uniform', 'subsample': 0.22854759491358206, 'gamma': 8.38537608650963}. Best is trial 415 with value: 2.047233401347207.
[I 2023-12-19 01:12:43,812] Trial 452 pruned. Trial was pruned at iteration 0.
[I 2023-12-19 01:12:43,906] Trial 453 pruned. Trial was pruned at iteration 0.
[I 2023-12-19 01:12:44,013] Trial 454 pruned. Trial was pruned at iteration 0.
[I 2023-12-19 01:12:44,117] Trial 455 pruned. Trial was pruned at iteration 0.
[I 2023-12-19 01:12:48,427] Trial 456 finished with value: 2.0610678018430098 and parameters: {'learning_rate': 0.4450244667297538, 'aft_loss_distribution': 'logistic', 'aft_loss_distribution_scale': 1.3149275081480944, 'max_depth': 8, 'booster': 'dart', 'scale_pos_weight': 2.761741133804467, 'alpha': 6.08127357547933, 'lambda': 9.841529777765132, 'eta': 0.827960427884931, 'sampling_method': 'uniform', 'subsample': 0.1181559880332328, 'gamma': 7.151519618712542}. Best is trial 415 with value: 2.047233401347207.
[I 2023-12-19 01:12:50,657] Trial 457 finished with value: inf and parameters: {'learning_rate': 0.43682938138651534, 'aft_loss_distribution': 'logistic', 'aft_loss_distribution_scale': 1.1583237953386958, 'max_depth': 8, 'booster': 'dart', 'scale_pos_weight': 2.7788729561845735, 'alpha': 4.376616365342859, 'lambda': 9.636677828253966, 'eta': 0.8336430838594393, 'sampling_method': 'uniform', 'subsample': 0.12825686602201333, 'gamma': 7.495126627246507}. Best is trial 415 with value: 2.047233401347207.
[I 2023-12-19 01:12:50,821] Trial 458 pruned. Trial was pruned at iteration 0.
[I 2023-12-19 01:12:55,980] Trial 459 finished with value: 2.0504936769915343 and parameters: {'learning_rate': 0.44625700166235255, 'aft_loss_distribution': 'logistic', 'aft_loss_distribution_scale': 1.266492822791306, 'max_depth': 8, 'booster': 'dart', 'scale_pos_weight': 2.828835798111256, 'alpha': 6.023900252367157, 'lambda': 9.784514949956312, 'eta': 0.7997506687869138, 'sampling_method': 'uniform', 'subsample': 0.13872595433556761, 'gamma': 7.882590079000856}. Best is trial 415 with value: 2.047233401347207.
[I 2023-12-19 01:12:56,081] Trial 460 pruned. Trial was pruned at iteration 0.
[I 2023-12-19 01:12:57,769] Trial 461 finished with value: inf and parameters: {'learning_rate': 0.38834414034033726, 'aft_loss_distribution': 'logistic', 'aft_loss_distribution_scale': 1.2177768809553702, 'max_depth': 8, 'booster': 'dart', 'scale_pos_weight': 2.80201566539051, 'alpha': 4.64905469495427, 'lambda': 3.5112890546233175, 'eta': 0.7706921343292118, 'sampling_method': 'uniform', 'subsample': 0.12018377355132503, 'gamma': 8.612663457502698}. Best is trial 415 with value: 2.047233401347207.
[I 2023-12-19 01:13:00,082] Trial 462 finished with value: inf and parameters: {'learning_rate': 0.44031937932908155, 'aft_loss_distribution': 'logistic', 'aft_loss_distribution_scale': 1.2769878604968745, 'max_depth': 8, 'booster': 'dart', 'scale_pos_weight': 3.064410505719361, 'alpha': 5.428146180970354, 'lambda': 9.157007714125799, 'eta': 0.80545223988429, 'sampling_method': 'uniform', 'subsample': 0.16406142363248427, 'gamma': 8.174454772678565}. Best is trial 415 with value: 2.047233401347207.
[I 2023-12-19 01:13:00,194] Trial 463 pruned. Trial was pruned at iteration 0.
[I 2023-12-19 01:13:08,940] Trial 464 finished with value: 2.0839614829369855 and parameters: {'learning_rate': 0.4470931220178461, 'aft_loss_distribution': 'logistic', 'aft_loss_distribution_scale': 1.4618158324005577, 'max_depth': 8, 'booster': 'dart', 'scale_pos_weight': 2.8433581328641995, 'alpha': 6.02483646095743, 'lambda': 9.379641903569249, 'eta': 0.7966849195514947, 'sampling_method': 'uniform', 'subsample': 0.1391660932827476, 'gamma': 7.966797244615379}. Best is trial 415 with value: 2.047233401347207.
[I 2023-12-19 01:13:09,057] Trial 465 pruned. Trial was pruned at iteration 0.
[I 2023-12-19 01:13:09,168] Trial 466 pruned. Trial was pruned at iteration 0.
[I 2023-12-19 01:13:09,280] Trial 467 pruned. Trial was pruned at iteration 0.
