[I 2023-12-18 23:47:22,494] Trial 108 pruned. Trial was pruned at iteration 0.
[I 2023-12-18 23:47:22,557] Trial 109 pruned. Trial was pruned at iteration 0.
[I 2023-12-18 23:47:22,617] Trial 110 pruned. Trial was pruned at iteration 0.
[I 2023-12-18 23:47:22,928] Trial 111 finished with value: 4.300263223994566 and parameters: {'learning_rate': 0.7672404414687455, 'aft_loss_distribution': 'normal', 'aft_loss_distribution_scale': 1.3209847780601942, 'max_depth': 10, 'booster': 'gbtree', 'scale_pos_weight': 1.6079466606761783, 'alpha': 9.248751522561626, 'lambda': 4.080936362085142, 'eta': 0.5256755338571474, 'sampling_method': 'gradient_based', 'subsample': 0.8142178541295828, 'gamma': 9.443628828644197}. Best is trial 16 with value: 4.272217260005588.
[I 2023-12-18 23:47:23,445] Trial 112 finished with value: 4.310410024727804 and parameters: {'learning_rate': 0.7963226330710546, 'aft_loss_distribution': 'normal', 'aft_loss_distribution_scale': 1.3569610024229466, 'max_depth': 10, 'booster': 'gbtree', 'scale_pos_weight': 0.8118191483401732, 'alpha': 9.289285646073154, 'lambda': 3.8932651265838256, 'eta': 0.5387996254519912, 'sampling_method': 'gradient_based', 'subsample': 0.8097274762868919, 'gamma': 9.500921750945771}. Best is trial 16 with value: 4.272217260005588.
[I 2023-12-18 23:47:23,647] Trial 113 finished with value: inf and parameters: {'learning_rate': 0.8115673635819216, 'aft_loss_distribution': 'normal', 'aft_loss_distribution_scale': 1.3088091983848078, 'max_depth': 10, 'booster': 'gbtree', 'scale_pos_weight': 0.37987276266851777, 'alpha': 9.434841618204684, 'lambda': 3.7749627451770706, 'eta': 0.5059833988277314, 'sampling_method': 'gradient_based', 'subsample': 0.8564045234451373, 'gamma': 9.426033985306296}. Best is trial 16 with value: 4.272217260005588.
[I 2023-12-18 23:47:23,736] Trial 114 pruned. Trial was pruned at iteration 0.
[I 2023-12-18 23:47:23,806] Trial 115 pruned. Trial was pruned at iteration 1.
[I 2023-12-18 23:47:23,877] Trial 116 pruned. Trial was pruned at iteration 0.
[I 2023-12-18 23:47:23,942] Trial 117 pruned. Trial was pruned at iteration 0.
[I 2023-12-18 23:47:24,189] Trial 118 finished with value: inf and parameters: {'learning_rate': 0.8014327206213123, 'aft_loss_distribution': 'normal', 'aft_loss_distribution_scale': 1.5463486178665662, 'max_depth': 4, 'booster': 'gbtree', 'scale_pos_weight': 2.0083406283334098, 'alpha': 8.515659791358, 'lambda': 6.279791214791681, 'eta': 0.632568971787671, 'sampling_method': 'gradient_based', 'subsample': 0.679704997333954, 'gamma': 5.769911058586967}. Best is trial 16 with value: 4.272217260005588.
[I 2023-12-18 23:47:24,271] Trial 119 pruned. Trial was pruned at iteration 0.
[I 2023-12-18 23:47:24,514] Trial 120 finished with value: 4.292945948594182 and parameters: {'learning_rate': 0.8927432355482705, 'aft_loss_distribution': 'normal', 'aft_loss_distribution_scale': 1.2901325254042155, 'max_depth': 8, 'booster': 'gbtree', 'scale_pos_weight': 0.6607888590348671, 'alpha': 6.039438773223665, 'lambda': 4.134578129789873, 'eta': 0.04994096896685169, 'sampling_method': 'gradient_based', 'subsample': 0.7579774710850066, 'gamma': 5.351895073915232}. Best is trial 16 with value: 4.272217260005588.
[I 2023-12-18 23:47:24,710] Trial 121 finished with value: inf and parameters: {'learning_rate': 0.9476664358534113, 'aft_loss_distribution': 'normal', 'aft_loss_distribution_scale': 1.3614435681853547, 'max_depth': 8, 'booster': 'gbtree', 'scale_pos_weight': 0.5003569741530072, 'alpha': 5.724271761759456, 'lambda': 3.545953737734725, 'eta': 0.054550559529274956, 'sampling_method': 'gradient_based', 'subsample': 0.7603210827534291, 'gamma': 5.378076684747974}. Best is trial 16 with value: 4.272217260005588.
[I 2023-12-18 23:47:24,792] Trial 122 pruned. Trial was pruned at iteration 1.
[I 2023-12-18 23:47:24,859] Trial 123 pruned. Trial was pruned at iteration 1.
[I 2023-12-18 23:47:24,929] Trial 124 pruned. Trial was pruned at iteration 0.
[I 2023-12-18 23:47:24,996] Trial 125 pruned. Trial was pruned at iteration 1.
[I 2023-12-18 23:47:25,182] Trial 126 finished with value: inf and parameters: {'learning_rate': 0.8827287549125182, 'aft_loss_distribution': 'normal', 'aft_loss_distribution_scale': 1.186873966598777, 'max_depth': 9, 'booster': 'gbtree', 'scale_pos_weight': 0.9521826215015268, 'alpha': 0.02517792698624799, 'lambda': 4.577435981432717, 'eta': 0.08302691329304798, 'sampling_method': 'gradient_based', 'subsample': 0.6599699590074971, 'gamma': 4.550819060877275}. Best is trial 16 with value: 4.272217260005588.
[I 2023-12-18 23:47:25,256] Trial 127 pruned. Trial was pruned at iteration 0.
[I 2023-12-18 23:47:25,501] Trial 128 finished with value: 4.345089882357254 and parameters: {'learning_rate': 0.8670458613992933, 'aft_loss_distribution': 'normal', 'aft_loss_distribution_scale': 1.4658223815742881, 'max_depth': 7, 'booster': 'gbtree', 'scale_pos_weight': 1.782268712654786, 'alpha': 6.530819186941858, 'lambda': 4.163176478362298, 'eta': 0.16230895723517946, 'sampling_method': 'uniform', 'subsample': 0.816617582964656, 'gamma': 6.01017618190842}. Best is trial 16 with value: 4.272217260005588.
[I 2023-12-18 23:47:25,568] Trial 129 pruned. Trial was pruned at iteration 0.
[I 2023-12-18 23:47:25,791] Trial 130 finished with value: inf and parameters: {'learning_rate': 0.8612514171165521, 'aft_loss_distribution': 'normal', 'aft_loss_distribution_scale': 1.5202015705001024, 'max_depth': 8, 'booster': 'gbtree', 'scale_pos_weight': 2.2307855250794124, 'alpha': 6.266844190672395, 'lambda': 4.477450278037277, 'eta': 0.11229337492750469, 'sampling_method': 'gradient_based', 'subsample': 0.916098940654696, 'gamma': 6.579972453816918}. Best is trial 16 with value: 4.272217260005588.
[I 2023-12-18 23:47:25,908] Trial 131 pruned. Trial was pruned at iteration 0.
[I 2023-12-18 23:47:26,191] Trial 132 finished with value: inf and parameters: {'learning_rate': 0.8010786479987089, 'aft_loss_distribution': 'normal', 'aft_loss_distribution_scale': 1.3615976399968819, 'max_depth': 7, 'booster': 'gbtree', 'scale_pos_weight': 1.2776987167073508, 'alpha': 6.89651805033549, 'lambda': 3.8096566349862915, 'eta': 0.1215322426455563, 'sampling_method': 'uniform', 'subsample': 0.7280841231052131, 'gamma': 5.79803764675582}. Best is trial 16 with value: 4.272217260005588.
[I 2023-12-18 23:47:26,302] Trial 133 pruned. Trial was pruned at iteration 0.
[I 2023-12-18 23:47:26,407] Trial 134 pruned. Trial was pruned at iteration 1.
[I 2023-12-18 23:47:26,507] Trial 135 pruned. Trial was pruned at iteration 0.
[I 2023-12-18 23:47:26,595] Trial 136 pruned. Trial was pruned at iteration 0.
[I 2023-12-18 23:47:26,691] Trial 137 pruned. Trial was pruned at iteration 0.
[I 2023-12-18 23:47:27,305] Trial 138 finished with value: 4.278189772588935 and parameters: {'learning_rate': 0.9724640308102721, 'aft_loss_distribution': 'normal', 'aft_loss_distribution_scale': 1.2111254020586446, 'max_depth': 6, 'booster': 'gbtree', 'scale_pos_weight': 1.959530445730969, 'alpha': 4.469135844735078, 'lambda': 4.224131115282372, 'eta': 0.1458690479603486, 'sampling_method': 'gradient_based', 'subsample': 0.9713247119237942, 'gamma': 6.338334838730479}. Best is trial 16 with value: 4.272217260005588.
[I 2023-12-18 23:47:27,581] Trial 139 finished with value: inf and parameters: {'learning_rate': 0.9691914163293913, 'aft_loss_distribution': 'normal', 'aft_loss_distribution_scale': 1.1764982244286604, 'max_depth': 7, 'booster': 'gbtree', 'scale_pos_weight': 2.006749447484795, 'alpha': 7.587573911645658, 'lambda': 3.09803137787998, 'eta': 0.16974940082018947, 'sampling_method': 'gradient_based', 'subsample': 0.9655529682097425, 'gamma': 6.355258135708873}. Best is trial 16 with value: 4.272217260005588.
[I 2023-12-18 23:47:27,700] Trial 140 pruned. Trial was pruned at iteration 0.
[I 2023-12-18 23:47:27,810] Trial 141 pruned. Trial was pruned at iteration 1.
[I 2023-12-18 23:47:27,915] Trial 142 pruned. Trial was pruned at iteration 0.
[I 2023-12-18 23:47:28,012] Trial 143 pruned. Trial was pruned at iteration 0.
[I 2023-12-18 23:47:28,110] Trial 144 pruned. Trial was pruned at iteration 0.
[I 2023-12-18 23:47:28,468] Trial 145 finished with value: 4.291624267217351 and parameters: {'learning_rate': 0.9510805254205398, 'aft_loss_distribution': 'normal', 'aft_loss_distribution_scale': 1.2796535064515226, 'max_depth': 5, 'booster': 'gbtree', 'scale_pos_weight': 1.7402216060643803, 'alpha': 5.629109146263843, 'lambda': 3.9236816846826508, 'eta': 0.04778862320897164, 'sampling_method': 'uniform', 'subsample': 0.3467420879606151, 'gamma': 9.575382273585102}. Best is trial 16 with value: 4.272217260005588.
[I 2023-12-18 23:47:28,802] Trial 146 finished with value: 4.289146386760351 and parameters: {'learning_rate': 0.9516489039418036, 'aft_loss_distribution': 'normal', 'aft_loss_distribution_scale': 1.2787434310680268, 'max_depth': 5, 'booster': 'gbtree', 'scale_pos_weight': 1.7197049210507065, 'alpha': 5.505106635068935, 'lambda': 3.9566590618197903, 'eta': 0.04696244952390979, 'sampling_method': 'uniform', 'subsample': 0.6293147177659638, 'gamma': 9.318305419876603}. Best is trial 16 with value: 4.272217260005588.
[I 2023-12-18 23:47:29,107] Trial 147 finished with value: inf and parameters: {'learning_rate': 0.9516700428269063, 'aft_loss_distribution': 'normal', 'aft_loss_distribution_scale': 1.0438033176138422, 'max_depth': 5, 'booster': 'gbtree', 'scale_pos_weight': 1.7663254216710187, 'alpha': 5.592555708574435, 'lambda': 4.258087743322512, 'eta': 0.04043772574297958, 'sampling_method': 'uniform', 'subsample': 0.6310262053771419, 'gamma': 9.998692667627749}. Best is trial 16 with value: 4.272217260005588.
[I 2023-12-18 23:47:29,610] Trial 148 finished with value: 4.302069628393204 and parameters: {'learning_rate': 0.9775175418013836, 'aft_loss_distribution': 'normal', 'aft_loss_distribution_scale': 1.3230080692762403, 'max_depth': 5, 'booster': 'gbtree', 'scale_pos_weight': 1.7257422642307487, 'alpha': 5.228637258367906, 'lambda': 3.8884155834088663, 'eta': 0.02681286357488972, 'sampling_method': 'uniform', 'subsample': 0.6916280730056062, 'gamma': 9.524110526193905}. Best is trial 16 with value: 4.272217260005588.
[I 2023-12-18 23:47:29,936] Trial 149 finished with value: 4.290686716746531 and parameters: {'learning_rate': 0.9781703904633816, 'aft_loss_distribution': 'normal', 'aft_loss_distribution_scale': 1.2808257274251518, 'max_depth': 5, 'booster': 'gbtree', 'scale_pos_weight': 1.646421764748726, 'alpha': 5.068853728660831, 'lambda': 3.922126510480146, 'eta': 0.016088870115395698, 'sampling_method': 'uniform', 'subsample': 0.687032694190728, 'gamma': 9.570812664017994}. Best is trial 16 with value: 4.272217260005588.
[I 2023-12-18 23:47:30,050] Trial 150 pruned. Trial was pruned at iteration 0.
[I 2023-12-18 23:47:30,357] Trial 151 finished with value: inf and parameters: {'learning_rate': 0.9736257725953077, 'aft_loss_distribution': 'normal', 'aft_loss_distribution_scale': 1.2964815094367836, 'max_depth': 5, 'booster': 'gbtree', 'scale_pos_weight': 2.100969823763849, 'alpha': 5.419569277958625, 'lambda': 3.954480621990052, 'eta': 0.051847422683290734, 'sampling_method': 'uniform', 'subsample': 0.6470814514129093, 'gamma': 9.249578699153128}. Best is trial 16 with value: 4.272217260005588.
[I 2023-12-18 23:47:30,607] Trial 152 finished with value: inf and parameters: {'learning_rate': 0.997194981118678, 'aft_loss_distribution': 'normal', 'aft_loss_distribution_scale': 0.9173492304974377, 'max_depth': 5, 'booster': 'gbtree', 'scale_pos_weight': 1.1234824795427358, 'alpha': 4.83492594969097, 'lambda': 3.359652286308008, 'eta': 0.016658257863436207, 'sampling_method': 'uniform', 'subsample': 0.6993940396238506, 'gamma': 9.063685071275568}. Best is trial 16 with value: 4.272217260005588.
[I 2023-12-18 23:47:31,038] Trial 153 finished with value: 4.289419056996522 and parameters: {'learning_rate': 0.9435195353223141, 'aft_loss_distribution': 'normal', 'aft_loss_distribution_scale': 1.2767193633083083, 'max_depth': 5, 'booster': 'gbtree', 'scale_pos_weight': 1.8770498911463052, 'alpha': 5.749012383959484, 'lambda': 4.001380852512618, 'eta': 0.03808247645521179, 'sampling_method': 'uniform', 'subsample': 0.7309532771650471, 'gamma': 9.567757767467596}. Best is trial 16 with value: 4.272217260005588.
[I 2023-12-18 23:47:31,114] Trial 154 pruned. Trial was pruned at iteration 1.
[I 2023-12-18 23:47:31,354] Trial 155 finished with value: 4.283647867654104 and parameters: {'learning_rate': 0.9216038024113402, 'aft_loss_distribution': 'normal', 'aft_loss_distribution_scale': 1.2419332529793818, 'max_depth': 5, 'booster': 'gbtree', 'scale_pos_weight': 2.301589066139135, 'alpha': 5.136883065748435, 'lambda': 4.1920834100508575, 'eta': 0.06877297763749028, 'sampling_method': 'uniform', 'subsample': 0.7507870164521276, 'gamma': 9.401221799962913}. Best is trial 16 with value: 4.272217260005588.
[I 2023-12-18 23:47:31,551] Trial 156 finished with value: inf and parameters: {'learning_rate': 0.9357268439480413, 'aft_loss_distribution': 'normal', 'aft_loss_distribution_scale': 1.297756513680656, 'max_depth': 5, 'booster': 'gbtree', 'scale_pos_weight': 2.330224373729409, 'alpha': 5.1222165520211815, 'lambda': 4.105751392025849, 'eta': 0.07075897791600141, 'sampling_method': 'uniform', 'subsample': 0.7581294707456965, 'gamma': 9.820541825408236}. Best is trial 16 with value: 4.272217260005588.
[I 2023-12-18 23:47:31,742] Trial 157 finished with value: inf and parameters: {'learning_rate': 0.9144084255305464, 'aft_loss_distribution': 'normal', 'aft_loss_distribution_scale': 1.0821553676137374, 'max_depth': 5, 'booster': 'gbtree', 'scale_pos_weight': 1.7407357808407704, 'alpha': 5.305175033091737, 'lambda': 3.8477981822360894, 'eta': 0.0002500093350541882, 'sampling_method': 'uniform', 'subsample': 0.7167423874806489, 'gamma': 9.335549204496438}. Best is trial 16 with value: 4.272217260005588.
[I 2023-12-18 23:47:31,818] Trial 158 pruned. Trial was pruned at iteration 1.
[I 2023-12-18 23:47:32,016] Trial 159 finished with value: inf and parameters: {'learning_rate': 0.9327816910350347, 'aft_loss_distribution': 'normal', 'aft_loss_distribution_scale': 1.193916468168755, 'max_depth': 5, 'booster': 'gbtree', 'scale_pos_weight': 2.4110545110434645, 'alpha': 5.4605950480289875, 'lambda': 4.101970954343729, 'eta': 0.025127717693650024, 'sampling_method': 'uniform', 'subsample': 0.7852194431075584, 'gamma': 9.985891867844671}. Best is trial 16 with value: 4.272217260005588.
[I 2023-12-18 23:47:32,109] Trial 160 pruned. Trial was pruned at iteration 1.
[I 2023-12-18 23:47:32,178] Trial 161 pruned. Trial was pruned at iteration 1.
[I 2023-12-18 23:47:32,249] Trial 162 pruned. Trial was pruned at iteration 1.
[I 2023-12-18 23:47:32,315] Trial 163 pruned. Trial was pruned at iteration 0.
[I 2023-12-18 23:47:32,513] Trial 164 finished with value: inf and parameters: {'learning_rate': 0.9190222547841691, 'aft_loss_distribution': 'normal', 'aft_loss_distribution_scale': 1.0127209460586464, 'max_depth': 4, 'booster': 'gbtree', 'scale_pos_weight': 2.7967476847576638, 'alpha': 4.508813696574596, 'lambda': 7.0688545273458, 'eta': 0.05509286439473208, 'sampling_method': 'uniform', 'subsample': 0.6772523508784993, 'gamma': 9.674598543492436}. Best is trial 16 with value: 4.272217260005588.
[I 2023-12-18 23:47:32,844] Trial 165 finished with value: 4.285054500397083 and parameters: {'learning_rate': 0.9729633697633205, 'aft_loss_distribution': 'normal', 'aft_loss_distribution_scale': 1.2500958985290558, 'max_depth': 5, 'booster': 'gbtree', 'scale_pos_weight': 2.1158573875872326, 'alpha': 5.600189456403085, 'lambda': 3.4534794893633753, 'eta': 0.020101626888327395, 'sampling_method': 'uniform', 'subsample': 0.744393606057591, 'gamma': 9.790774334182625}. Best is trial 16 with value: 4.272217260005588.
[I 2023-12-18 23:47:33,061] Trial 166 finished with value: inf and parameters: {'learning_rate': 0.9980288826086812, 'aft_loss_distribution': 'normal', 'aft_loss_distribution_scale': 1.2870410570801571, 'max_depth': 5, 'booster': 'gbtree', 'scale_pos_weight': 2.1944111475997605, 'alpha': 5.568607454623525, 'lambda': 3.471350547580697, 'eta': 0.06939534539615388, 'sampling_method': 'uniform', 'subsample': 0.7510390071948501, 'gamma': 9.794301980711026}. Best is trial 16 with value: 4.272217260005588.
[I 2023-12-18 23:47:33,151] Trial 167 pruned. Trial was pruned at iteration 0.
[I 2023-12-18 23:47:33,223] Trial 168 pruned. Trial was pruned at iteration 1.
[I 2023-12-18 23:47:33,545] Trial 169 finished with value: 4.270853757566854 and parameters: {'learning_rate': 0.8961558876743239, 'aft_loss_distribution': 'normal', 'aft_loss_distribution_scale': 1.1879937198911497, 'max_depth': 5, 'booster': 'gbtree', 'scale_pos_weight': 2.005542968488991, 'alpha': 9.585266770433254, 'lambda': 3.948161489200043, 'eta': 0.016766740859218005, 'sampling_method': 'uniform', 'subsample': 0.7346803157939441, 'gamma': 9.858261160576616}. Best is trial 169 with value: 4.270853757566854.
[I 2023-12-18 23:47:33,785] Trial 170 finished with value: 4.2630386505148214 and parameters: {'learning_rate': 0.9001667341509602, 'aft_loss_distribution': 'normal', 'aft_loss_distribution_scale': 1.1405006783319622, 'max_depth': 5, 'booster': 'gbtree', 'scale_pos_weight': 1.9411052878677626, 'alpha': 9.543833169356326, 'lambda': 3.9136154864478594, 'eta': 0.05585465002667619, 'sampling_method': 'uniform', 'subsample': 0.7435995889362239, 'gamma': 9.977921978217397}. Best is trial 170 with value: 4.2630386505148214.
[I 2023-12-18 23:47:34,033] Trial 171 finished with value: 4.261191388368933 and parameters: {'learning_rate': 0.8987340704616903, 'aft_loss_distribution': 'normal', 'aft_loss_distribution_scale': 1.1152145038002708, 'max_depth': 5, 'booster': 'gbtree', 'scale_pos_weight': 1.5560556765473672, 'alpha': 9.73651412447338, 'lambda': 3.9485663505859954, 'eta': 0.08710622128540553, 'sampling_method': 'uniform', 'subsample': 0.7384657387870546, 'gamma': 9.857944615269135}. Best is trial 171 with value: 4.261191388368933.
[I 2023-12-18 23:47:34,112] Trial 172 pruned. Trial was pruned at iteration 0.
[I 2023-12-18 23:47:34,299] Trial 173 finished with value: inf and parameters: {'learning_rate': 0.9059618241069396, 'aft_loss_distribution': 'normal', 'aft_loss_distribution_scale': 1.0782046940976597, 'max_depth': 5, 'booster': 'gbtree', 'scale_pos_weight': 1.6669750184472716, 'alpha': 9.833089746651947, 'lambda': 3.7536263917283517, 'eta': 0.05377662531147594, 'sampling_method': 'uniform', 'subsample': 0.7596724024563175, 'gamma': 9.837218088716149}. Best is trial 171 with value: 4.261191388368933.
[I 2023-12-18 23:47:34,371] Trial 174 pruned. Trial was pruned at iteration 0.
[I 2023-12-18 23:47:34,436] Trial 175 pruned. Trial was pruned at iteration 0.
[I 2023-12-18 23:47:34,509] Trial 176 pruned. Trial was pruned at iteration 1.
[I 2023-12-18 23:47:34,574] Trial 177 pruned. Trial was pruned at iteration 0.
[I 2023-12-18 23:47:34,804] Trial 178 finished with value: 4.271945578088174 and parameters: {'learning_rate': 0.925385843688866, 'aft_loss_distribution': 'normal', 'aft_loss_distribution_scale': 1.19096122175212, 'max_depth': 5, 'booster': 'gbtree', 'scale_pos_weight': 1.7327401744292619, 'alpha': 9.112553913726195, 'lambda': 3.659313166600772, 'eta': 0.06037499310707214, 'sampling_method': 'uniform', 'subsample': 0.7366099232308849, 'gamma': 9.987657679127807}. Best is trial 171 with value: 4.261191388368933.
[I 2023-12-18 23:47:34,881] Trial 179 pruned. Trial was pruned at iteration 0.
[I 2023-12-18 23:47:34,952] Trial 180 pruned. Trial was pruned at iteration 0.
[I 2023-12-18 23:47:35,171] Trial 181 finished with value: inf and parameters: {'learning_rate': 0.9665035827517382, 'aft_loss_distribution': 'normal', 'aft_loss_distribution_scale': 1.1997365337055101, 'max_depth': 5, 'booster': 'gbtree', 'scale_pos_weight': 1.5198044701441145, 'alpha': 9.045850772202696, 'lambda': 3.891061619412036, 'eta': 0.08526160637705622, 'sampling_method': 'uniform', 'subsample': 0.7063269481098735, 'gamma': 9.429757961623574}. Best is trial 171 with value: 4.261191388368933.
[I 2023-12-18 23:47:35,249] Trial 182 pruned. Trial was pruned at iteration 0.
[I 2023-12-18 23:47:35,477] Trial 183 finished with value: inf and parameters: {'learning_rate': 0.9461160040395895, 'aft_loss_distribution': 'normal', 'aft_loss_distribution_scale': 1.0966936485557992, 'max_depth': 5, 'booster': 'gbtree', 'scale_pos_weight': 1.7881983025697852, 'alpha': 9.833334007415228, 'lambda': 3.7348961137162346, 'eta': 0.034038408013292464, 'sampling_method': 'uniform', 'subsample': 0.6871542042735297, 'gamma': 9.582784298813687}. Best is trial 171 with value: 4.261191388368933.
[I 2023-12-18 23:47:35,552] Trial 184 pruned. Trial was pruned at iteration 0.
[I 2023-12-18 23:47:35,617] Trial 185 pruned. Trial was pruned at iteration 0.
[I 2023-12-18 23:47:35,816] Trial 186 finished with value: inf and parameters: {'learning_rate': 0.999171309323704, 'aft_loss_distribution': 'normal', 'aft_loss_distribution_scale': 0.9177096005789043, 'max_depth': 5, 'booster': 'gbtree', 'scale_pos_weight': 1.0519508934986583, 'alpha': 5.330971863112312, 'lambda': 3.2539098527809642, 'eta': 0.0006840381849221103, 'sampling_method': 'uniform', 'subsample': 0.737231912602399, 'gamma': 9.238039279469294}. Best is trial 171 with value: 4.261191388368933.
[I 2023-12-18 23:47:36,208] Trial 187 finished with value: 4.2649324624072 and parameters: {'learning_rate': 0.9756406548744462, 'aft_loss_distribution': 'normal', 'aft_loss_distribution_scale': 1.1490057007584604, 'max_depth': 4, 'booster': 'gbtree', 'scale_pos_weight': 1.5938347047710149, 'alpha': 9.105891771605531, 'lambda': 4.170032819847516, 'eta': 0.04287842096784197, 'sampling_method': 'uniform', 'subsample': 0.824995766913913, 'gamma': 9.395018656200653}. Best is trial 171 with value: 4.261191388368933.
