[I 2023-12-21 03:11:45,266] Trial 107 finished with value: 4.40267957115839 and parameters: {'learning_rate': 0.8850544622653027, 'aft_lo                                                                     ss_distribution': 'normal', 'aft_loss_distribution_scale': 1.6594155142488511, 'max_depth': 9, 'booster': 'dart', 'scale_pos_weight': 6.1                                                                     85547109147863, 'alpha': 7.824897654568147, 'lambda': 8.008610176315024, 'eta': 0.754116724494754, 'sampling_method': 'uniform', 'subsamp                                                                     le': 0.49882064794907494, 'gamma': 8.750351960416529}. Best is trial 93 with value: 4.339337192801806.
[I 2023-12-21 03:11:46,294] Trial 108 finished with value: inf and parameters: {'learning_rate': 0.8812482727753953, 'aft_loss_distributi                                                                     on': 'normal', 'aft_loss_distribution_scale': 1.1738623546748204, 'max_depth': 9, 'booster': 'dart', 'scale_pos_weight': 6.23848032877832                                                                     8, 'alpha': 7.875265459392457, 'lambda': 7.96862805083794, 'eta': 0.745364142627186, 'sampling_method': 'uniform', 'subsample': 0.5482392                                                                     875459837, 'gamma': 8.546567425406948}. Best is trial 93 with value: 4.339337192801806.
[I 2023-12-21 03:11:48,284] Trial 109 finished with value: 4.392690453481465 and parameters: {'learning_rate': 0.919353835617838, 'aft_lo                                                                     ss_distribution': 'normal', 'aft_loss_distribution_scale': 1.6208832298586178, 'max_depth': 9, 'booster': 'dart', 'scale_pos_weight': 7.0                                                                     85357133198622, 'alpha': 8.08868891561517, 'lambda': 8.59710887657882, 'eta': 0.8859498306213143, 'sampling_method': 'uniform', 'subsampl                                                                     e': 0.45823927167255357, 'gamma': 9.526721444691741}. Best is trial 93 with value: 4.339337192801806.
[I 2023-12-21 03:11:50,978] Trial 110 finished with value: 4.38518636062525 and parameters: {'learning_rate': 0.9561860190370595, 'aft_lo                                                                     ss_distribution': 'normal', 'aft_loss_distribution_scale': 1.607190691820969, 'max_depth': 10, 'booster': 'dart', 'scale_pos_weight': 7.0                                                                     38824942620667, 'alpha': 8.14040989088428, 'lambda': 8.578573555356584, 'eta': 0.898229045504772, 'sampling_method': 'uniform', 'subsampl                                                                     e': 0.45745301084292894, 'gamma': 9.630417155711482}. Best is trial 93 with value: 4.339337192801806.
[I 2023-12-21 03:11:52,535] Trial 111 finished with value: inf and parameters: {'learning_rate': 0.9563313854035437, 'aft_loss_distributi                                                                     on': 'normal', 'aft_loss_distribution_scale': 1.6690289329254626, 'max_depth': 10, 'booster': 'dart', 'scale_pos_weight': 6.9731454862192                                                                     86, 'alpha': 8.009804579055269, 'lambda': 8.524516575381599, 'eta': 0.904315868032515, 'sampling_method': 'uniform', 'subsample': 0.46035                                                                     93654078964, 'gamma': 9.616592049338118}. Best is trial 93 with value: 4.339337192801806.
[I 2023-12-21 03:11:52,571] Trial 112 pruned. Trial was pruned at iteration 0.
[I 2023-12-21 03:11:52,606] Trial 113 pruned. Trial was pruned at iteration 0.
[I 2023-12-21 03:11:52,644] Trial 114 pruned. Trial was pruned at iteration 1.
[I 2023-12-21 03:11:53,693] Trial 115 finished with value: inf and parameters: {'learning_rate': 0.959550254692133, 'aft_loss_distributio                                                                     n': 'normal', 'aft_loss_distribution_scale': 0.8789964753670918, 'max_depth': 9, 'booster': 'dart', 'scale_pos_weight': 5.678113424401753                                                                     5, 'alpha': 9.299162195491789, 'lambda': 8.777426514198678, 'eta': 0.7090042475156318, 'sampling_method': 'uniform', 'subsample': 0.48887                                                                     73338700184, 'gamma': 8.672506232245995}. Best is trial 93 with value: 4.339337192801806.
[I 2023-12-21 03:11:55,936] Trial 116 finished with value: 4.388103424909068 and parameters: {'learning_rate': 0.8413699235746732, 'aft_l                                                                     oss_distribution': 'normal', 'aft_loss_distribution_scale': 1.6227509555638322, 'max_depth': 9, 'booster': 'dart', 'scale_pos_weight': 6.                                                                     030013262678348, 'alpha': 7.537352961624226, 'lambda': 8.587276852775595, 'eta': 0.9590043143111108, 'sampling_method': 'uniform', 'subsa                                                                     mple': 0.4268063793938948, 'gamma': 9.493967658057574}. Best is trial 93 with value: 4.339337192801806.
[I 2023-12-21 03:12:04,786] Trial 117 finished with value: 4.365806430100421 and parameters: {'learning_rate': 0.8416846993886674, 'aft_l                                                                     oss_distribution': 'normal', 'aft_loss_distribution_scale': 1.5574552414151426, 'max_depth': 9, 'booster': 'dart', 'scale_pos_weight': 6.                                                                     0341502311365245, 'alpha': 7.416504813902766, 'lambda': 7.560536220823705, 'eta': 0.9649715167254164, 'sampling_method': 'uniform', 'subs                                                                     ample': 0.40175597283528225, 'gamma': 9.458030621987072}. Best is trial 93 with value: 4.339337192801806.
[I 2023-12-21 03:12:06,935] Trial 118 finished with value: 4.378371715906615 and parameters: {'learning_rate': 0.8954419064648842, 'aft_l                                                                     oss_distribution': 'normal', 'aft_loss_distribution_scale': 1.5875310231650386, 'max_depth': 10, 'booster': 'dart', 'scale_pos_weight': 6                                                                     .002623403069688, 'alpha': 7.336583780165767, 'lambda': 7.618506093199852, 'eta': 0.9681484005816982, 'sampling_method': 'uniform', 'subs                                                                     ample': 0.3998587996618549, 'gamma': 9.463547906235675}. Best is trial 93 with value: 4.339337192801806.
[I 2023-12-21 03:12:08,562] Trial 119 finished with value: inf and parameters: {'learning_rate': 0.904426197464891, 'aft_loss_distributio                                                                     n': 'normal', 'aft_loss_distribution_scale': 1.5246404701918506, 'max_depth': 10, 'booster': 'dart', 'scale_pos_weight': 5.97202462345282                                                                     65, 'alpha': 7.499477920505336, 'lambda': 8.092570350767627, 'eta': 0.9353532988776384, 'sampling_method': 'uniform', 'subsample': 0.4031                                                                     817647964114, 'gamma': 9.471107632552469}. Best is trial 93 with value: 4.339337192801806.
[I 2023-12-21 03:12:09,558] Trial 120 finished with value: inf and parameters: {'learning_rate': 0.8829949347965279, 'aft_loss_distributi                                                                     on': 'normal', 'aft_loss_distribution_scale': 1.2017050000412817, 'max_depth': 10, 'booster': 'dart', 'scale_pos_weight': 6.8245011181108                                                                     06, 'alpha': 7.176720988376254, 'lambda': 7.5579238242832805, 'eta': 0.9751088758323087, 'sampling_method': 'uniform', 'subsample': 0.422                                                                     82090192696853, 'gamma': 9.734429939065722}. Best is trial 93 with value: 4.339337192801806.
[I 2023-12-21 03:12:09,595] Trial 121 pruned. Trial was pruned at iteration 0.
[I 2023-12-21 03:12:11,220] Trial 122 finished with value: inf and parameters: {'learning_rate': 0.9950356331746081, 'aft_loss_distributi                                                                     on': 'normal', 'aft_loss_distribution_scale': 1.5327781085473797, 'max_depth': 10, 'booster': 'dart', 'scale_pos_weight': 5.4400689410473                                                                     815, 'alpha': 6.8900829942912525, 'lambda': 8.277898672800598, 'eta': 0.9443399100067424, 'sampling_method': 'uniform', 'subsample': 0.43                                                                     927357429486386, 'gamma': 9.994173661150926}. Best is trial 93 with value: 4.339337192801806.
[I 2023-12-21 03:12:11,258] Trial 123 pruned. Trial was pruned at iteration 0.
[I 2023-12-21 03:12:12,662] Trial 124 finished with value: inf and parameters: {'learning_rate': 0.8960284604026021, 'aft_loss_distributi                                                                     on': 'normal', 'aft_loss_distribution_scale': 1.7155854082252746, 'max_depth': 9, 'booster': 'dart', 'scale_pos_weight': 5.78119980038085                                                                     8, 'alpha': 8.74207157120386, 'lambda': 9.215359906017264, 'eta': 0.9149737241031952, 'sampling_method': 'uniform', 'subsample': 0.531666                                                                     008609497, 'gamma': 9.013285949672253}. Best is trial 93 with value: 4.339337192801806.
[I 2023-12-21 03:12:12,698] Trial 125 pruned. Trial was pruned at iteration 0.
[I 2023-12-21 03:12:13,676] Trial 126 finished with value: inf and parameters: {'learning_rate': 0.9685805683018996, 'aft_loss_distributi                                                                     on': 'normal', 'aft_loss_distribution_scale': 1.237875522368296, 'max_depth': 10, 'booster': 'dart', 'scale_pos_weight': 6.55656043345980                                                                     1, 'alpha': 7.360618945775815, 'lambda': 8.650856982572199, 'eta': 0.9877181737190579, 'sampling_method': 'uniform', 'subsample': 0.42348                                                                     529243711974, 'gamma': 8.230482336746649}. Best is trial 93 with value: 4.339337192801806.
[I 2023-12-21 03:12:16,628] Trial 127 finished with value: 4.389533779673824 and parameters: {'learning_rate': 0.9209907986827972, 'aft_l                                                                     oss_distribution': 'normal', 'aft_loss_distribution_scale': 1.624115767139551, 'max_depth': 9, 'booster': 'dart', 'scale_pos_weight': 5.5                                                                     78956653731768, 'alpha': 9.689564716065691, 'lambda': 8.012457500100885, 'eta': 0.6768623069772861, 'sampling_method': 'uniform', 'subsam                                                                     ple': 0.4036474784633024, 'gamma': 9.349908007913305}. Best is trial 93 with value: 4.339337192801806.
[I 2023-12-21 03:12:16,667] Trial 128 pruned. Trial was pruned at iteration 0.
[I 2023-12-21 03:12:18,672] Trial 129 finished with value: 4.374876779180953 and parameters: {'learning_rate': 0.9430759322907429, 'aft_l                                                                     oss_distribution': 'normal', 'aft_loss_distribution_scale': 1.5716741214807866, 'max_depth': 9, 'booster': 'dart', 'scale_pos_weight': 5.                                                                     207126253544588, 'alpha': 7.836864378319913, 'lambda': 9.438273358626128, 'eta': 0.8352561113980241, 'sampling_method': 'uniform', 'subsa                                                                     mple': 0.38861555171334083, 'gamma': 8.798614293718185}. Best is trial 93 with value: 4.339337192801806.
[I 2023-12-21 03:12:18,709] Trial 130 pruned. Trial was pruned at iteration 0.
[I 2023-12-21 03:12:20,156] Trial 131 finished with value: inf and parameters: {'learning_rate': 0.980235382235458, 'aft_loss_distributio                                                                     n': 'normal', 'aft_loss_distribution_scale': 1.5591103944812308, 'max_depth': 9, 'booster': 'dart', 'scale_pos_weight': 5.912672007159915                                                                     , 'alpha': 7.83888702466576, 'lambda': 8.061557107589705, 'eta': 0.834430465706291, 'sampling_method': 'uniform', 'subsample': 0.41006814                                                                     91015156, 'gamma': 8.826791824152355}. Best is trial 93 with value: 4.339337192801806.
[I 2023-12-21 03:12:20,192] Trial 132 pruned. Trial was pruned at iteration 0.
[I 2023-12-21 03:12:21,459] Trial 133 finished with value: inf and parameters: {'learning_rate': 0.9307039111388085, 'aft_loss_distributi                                                                     on': 'normal', 'aft_loss_distribution_scale': 1.349622951742778, 'max_depth': 9, 'booster': 'dart', 'scale_pos_weight': 6.066753221269815                                                                     , 'alpha': 8.941301528347166, 'lambda': 7.905881654606237, 'eta': 0.8724246875517905, 'sampling_method': 'uniform', 'subsample': 0.559640                                                                     6938255785, 'gamma': 9.351522774638797}. Best is trial 93 with value: 4.339337192801806.
[I 2023-12-21 03:12:22,474] Trial 134 finished with value: inf and parameters: {'learning_rate': 0.8669321701822207, 'aft_loss_distributi                                                                     on': 'normal', 'aft_loss_distribution_scale': 1.057818129648337, 'max_depth': 9, 'booster': 'dart', 'scale_pos_weight': 7.071501894796035                                                                     , 'alpha': 8.59326037228797, 'lambda': 8.919967755011191, 'eta': 0.8059568275911285, 'sampling_method': 'uniform', 'subsample': 0.3796259                                                                     9961652227, 'gamma': 9.537259309070997}. Best is trial 93 with value: 4.339337192801806.
[I 2023-12-21 03:12:22,510] Trial 135 pruned. Trial was pruned at iteration 0.
[I 2023-12-21 03:12:22,546] Trial 136 pruned. Trial was pruned at iteration 0.
[I 2023-12-21 03:12:22,582] Trial 137 pruned. Trial was pruned at iteration 0.
[I 2023-12-21 03:12:23,522] Trial 138 finished with value: inf and parameters: {'learning_rate': 0.999828073054653, 'aft_loss_distributio                                                                     n': 'normal', 'aft_loss_distribution_scale': 0.8969266215235387, 'max_depth': 9, 'booster': 'dart', 'scale_pos_weight': 5.740845192544514                                                                     , 'alpha': 8.19067309059197, 'lambda': 9.411404706340063, 'eta': 0.8391394354209453, 'sampling_method': 'uniform', 'subsample': 0.6462821                                                                     158482126, 'gamma': 9.368315771890375}. Best is trial 93 with value: 4.339337192801806.
[I 2023-12-21 03:12:23,558] Trial 139 pruned. Trial was pruned at iteration 0.
[I 2023-12-21 03:12:23,595] Trial 140 pruned. Trial was pruned at iteration 0.
[I 2023-12-21 03:12:23,630] Trial 141 pruned. Trial was pruned at iteration 0.
[I 2023-12-21 03:12:23,666] Trial 142 pruned. Trial was pruned at iteration 0.
[I 2023-12-21 03:12:39,478] Trial 143 finished with value: 4.372707144514694 and parameters: {'learning_rate': 0.9292892692792647, 'aft_l                                                                     oss_distribution': 'normal', 'aft_loss_distribution_scale': 1.560889836554726, 'max_depth': 9, 'booster': 'dart', 'scale_pos_weight': 4.7                                                                     56663959766961, 'alpha': 8.1491086948313, 'lambda': 8.641259248376116, 'eta': 0.735260284816826, 'sampling_method': 'uniform', 'subsample                                                                     ': 0.38667144823266175, 'gamma': 9.193832762340362}. Best is trial 93 with value: 4.339337192801806.
[I 2023-12-21 03:12:40,476] Trial 144 finished with value: inf and parameters: {'learning_rate': 0.9695395837337961, 'aft_loss_distributi                                                                     on': 'normal', 'aft_loss_distribution_scale': 1.149741594566473, 'max_depth': 9, 'booster': 'dart', 'scale_pos_weight': 4.683179345147751                                                                     , 'alpha': 7.411980235587228, 'lambda': 8.722062300943069, 'eta': 0.7375848486442774, 'sampling_method': 'uniform', 'subsample': 0.406132                                                                     7961416126, 'gamma': 8.898709841413455}. Best is trial 93 with value: 4.339337192801806.
[I 2023-12-21 03:12:42,767] Trial 145 finished with value: 4.375570767083515 and parameters: {'learning_rate': 0.9281319009119632, 'aft_l                                                                     oss_distribution': 'normal', 'aft_loss_distribution_scale': 1.579616026063234, 'max_depth': 8, 'booster': 'dart', 'scale_pos_weight': 4.7                                                                     43748711992439, 'alpha': 7.668716661720652, 'lambda': 8.443409877307973, 'eta': 0.6798527708487379, 'sampling_method': 'uniform', 'subsam                                                                     ple': 0.38282509065968107, 'gamma': 9.585121296335126}. Best is trial 93 with value: 4.339337192801806.
[I 2023-12-21 03:12:44,297] Trial 146 finished with value: inf and parameters: {'learning_rate': 0.9291547929144534, 'aft_loss_distributi                                                                     on': 'normal', 'aft_loss_distribution_scale': 1.5220503782508639, 'max_depth': 8, 'booster': 'dart', 'scale_pos_weight': 4.93797471658772                                                                     6, 'alpha': 7.71059733850266, 'lambda': 7.721976754231475, 'eta': 0.6807865905900495, 'sampling_method': 'uniform', 'subsample': 0.389477                                                                     63598028495, 'gamma': 9.643561336142422}. Best is trial 93 with value: 4.339337192801806.
[I 2023-12-21 03:12:45,257] Trial 147 finished with value: inf and parameters: {'learning_rate': 0.9472333129772992, 'aft_loss_distributi                                                                     on': 'normal', 'aft_loss_distribution_scale': 1.2359119905807214, 'max_depth': 8, 'booster': 'dart', 'scale_pos_weight': 5.05467283210070                                                                     3, 'alpha': 9.09717879596811, 'lambda': 8.843482093515416, 'eta': 0.6983524384160575, 'sampling_method': 'uniform', 'subsample': 0.340184                                                                     6558882085, 'gamma': 9.534370615263827}. Best is trial 93 with value: 4.339337192801806.
[I 2023-12-21 03:12:48,177] Trial 148 finished with value: 4.32565819859156 and parameters: {'learning_rate': 0.916239004808108, 'aft_los                                                                     s_distribution': 'normal', 'aft_loss_distribution_scale': 1.4104194170275623, 'max_depth': 9, 'booster': 'dart', 'scale_pos_weight': 5.25                                                                     4583193143679, 'alpha': 8.271103109021897, 'lambda': 9.852137408833551, 'eta': 0.6258709613670262, 'sampling_method': 'uniform', 'subsamp                                                                     le': 0.35710455004282693, 'gamma': 8.670343228557012}. Best is trial 148 with value: 4.32565819859156.
[I 2023-12-21 03:12:49,285] Trial 149 finished with value: inf and parameters: {'learning_rate': 0.9152647198616759, 'aft_loss_distributi                                                                     on': 'normal', 'aft_loss_distribution_scale': 0.8588708818220098, 'max_depth': 10, 'booster': 'dart', 'scale_pos_weight': 5.2545138208948                                                                     88, 'alpha': 8.198310654397499, 'lambda': 9.892650113275774, 'eta': 0.6364253988153472, 'sampling_method': 'uniform', 'subsample': 0.3587                                                                     406650466956, 'gamma': 8.623231057633584}. Best is trial 148 with value: 4.32565819859156.
[I 2023-12-21 03:12:52,779] Trial 150 finished with value: 4.326577681469552 and parameters: {'learning_rate': 0.871861540109006, 'aft_lo                                                                     ss_distribution': 'normal', 'aft_loss_distribution_scale': 1.4060121443102571, 'max_depth': 9, 'booster': 'dart', 'scale_pos_weight': 5.4                                                                     51122295184904, 'alpha': 9.765895170079322, 'lambda': 8.012105110662748, 'eta': 0.9607447054056594, 'sampling_method': 'uniform', 'subsam                                                                     ple': 0.32798200040782444, 'gamma': 9.787224897270729}. Best is trial 148 with value: 4.32565819859156.
[I 2023-12-21 03:12:53,777] Trial 151 finished with value: inf and parameters: {'learning_rate': 0.8575376335537878, 'aft_loss_distributi                                                                     on': 'normal', 'aft_loss_distribution_scale': 1.3927745234384912, 'max_depth': 9, 'booster': 'dart', 'scale_pos_weight': 5.44235253123445                                                                     , 'alpha': 9.685369506599256, 'lambda': 7.96627993972624, 'eta': 0.9552959623428833, 'sampling_method': 'uniform', 'subsample': 0.3190801                                                                     165314788, 'gamma': 9.782276325116657}. Best is trial 148 with value: 4.32565819859156.
