[I 2023-12-21 04:16:00,643] Trial 40 pruned. Trial was pruned at iteration 0.
[I 2023-12-21 04:16:00,948] Trial 41 pruned. Trial was pruned at iteration 65.
[I 2023-12-21 04:16:01,034] Trial 42 pruned. Trial was pruned at iteration 0.
[I 2023-12-21 04:16:01,121] Trial 43 pruned. Trial was pruned at iteration 1.
[I 2023-12-21 04:16:01,213] Trial 44 pruned. Trial was pruned at iteration 0.
[I 2023-12-21 04:16:01,297] Trial 45 pruned. Trial was pruned at iteration 0.
[I 2023-12-21 04:16:01,397] Trial 46 pruned. Trial was pruned at iteration 5.
[I 2023-12-21 04:16:01,455] Trial 47 pruned. Trial was pruned at iteration 0.
[I 2023-12-21 04:16:01,507] Trial 48 pruned. Trial was pruned at iteration 0.
[I 2023-12-21 04:16:01,559] Trial 49 pruned. Trial was pruned at iteration 0.
[I 2023-12-21 04:16:02,053] Trial 50 finished with value: 1.9231774599892102 and parameters: {'learning_rate': 0.2132589307894056, 'aft_loss_distribution': 'logistic', 'aft_loss_distribution_scale': 0.9207285016301396, 'max_depth': 8, 'booster': 'gbtree', 'scale_pos_weight': 2.8958432555009397, 'alpha': 3.0475271586034998, 'lambda': 2.2732299038840824, 'eta': 0.11686530781035809, 'sampling_method': 'uniform', 'subsample': 0.4556171919053221, 'gamma': 8.039940783680883}. Best is trial 50 with value: 1.9231774599892102.
[I 2023-12-21 04:16:02,117] Trial 51 pruned. Trial was pruned at iteration 0.
[I 2023-12-21 04:16:02,714] Trial 52 finished with value: 1.9457871434509446 and parameters: {'learning_rate': 0.23781301912986433, 'aft_loss_distribution': 'logistic', 'aft_loss_distribution_scale': 1.1128255317352016, 'max_depth': 8, 'booster': 'gbtree', 'scale_pos_weight': 3.1619931818668965, 'alpha': 2.406766898714472, 'lambda': 2.230830794479346, 'eta': 0.19275690355784914, 'sampling_method': 'uniform', 'subsample': 0.39479388246171526, 'gamma': 7.879097787138102}. Best is trial 50 with value: 1.9231774599892102.
[I 2023-12-21 04:16:03,562] Trial 53 finished with value: 1.9426811515619011 and parameters: {'learning_rate': 0.22495938120862816, 'aft_loss_distribution': 'logistic', 'aft_loss_distribution_scale': 1.0788928400525284, 'max_depth': 8, 'booster': 'gbtree', 'scale_pos_weight': 3.1730811808623356, 'alpha': 2.383351985058551, 'lambda': 2.2191805188337934, 'eta': 0.09880253304675835, 'sampling_method': 'uniform', 'subsample': 0.3695334097779465, 'gamma': 8.083228279010434}. Best is trial 50 with value: 1.9231774599892102.
[I 2023-12-21 04:16:04,399] Trial 54 finished with value: 1.9327129370630383 and parameters: {'learning_rate': 0.22601734612520086, 'aft_loss_distribution': 'logistic', 'aft_loss_distribution_scale': 1.0291345055549908, 'max_depth': 8, 'booster': 'gbtree', 'scale_pos_weight': 3.183973533583251, 'alpha': 2.359354861746693, 'lambda': 1.6150930008961755, 'eta': 0.11833151382588403, 'sampling_method': 'uniform', 'subsample': 0.3675195130783937, 'gamma': 7.98599205097963}. Best is trial 50 with value: 1.9231774599892102.
[I 2023-12-21 04:16:04,467] Trial 55 pruned. Trial was pruned at iteration 0.
[I 2023-12-21 04:16:04,762] Trial 56 finished with value: 1.935000567469562 and parameters: {'learning_rate': 0.2870262517575962, 'aft_loss_distribution': 'logistic', 'aft_loss_distribution_scale': 0.9755960423411525, 'max_depth': 8, 'booster': 'gbtree', 'scale_pos_weight': 1.614563714620401, 'alpha': 3.725399811650774, 'lambda': 2.1158281034242234, 'eta': 0.09046351985942264, 'sampling_method': 'uniform', 'subsample': 0.2957362212432919, 'gamma': 8.388337924182313}. Best is trial 50 with value: 1.9231774599892102.
[I 2023-12-21 04:16:04,827] Trial 57 pruned. Trial was pruned at iteration 0.
[I 2023-12-21 04:16:05,485] Trial 58 finished with value: 1.9320747946406518 and parameters: {'learning_rate': 0.2807823071152897, 'aft_loss_distribution': 'logistic', 'aft_loss_distribution_scale': 0.9681472059405898, 'max_depth': 9, 'booster': 'gbtree', 'scale_pos_weight': 1.5213587679598406, 'alpha': 4.461258376337619, 'lambda': 1.6978919087836508, 'eta': 0.1922896420866951, 'sampling_method': 'uniform', 'subsample': 0.2049975231329384, 'gamma': 8.242098043539679}. Best is trial 50 with value: 1.9231774599892102.
[I 2023-12-21 04:16:05,543] Trial 59 pruned. Trial was pruned at iteration 0.
[I 2023-12-21 04:16:05,598] Trial 60 pruned. Trial was pruned at iteration 0.
[I 2023-12-21 04:16:05,654] Trial 61 pruned. Trial was pruned at iteration 0.
[I 2023-12-21 04:16:05,710] Trial 62 pruned. Trial was pruned at iteration 0.
[I 2023-12-21 04:16:05,768] Trial 63 pruned. Trial was pruned at iteration 0.
[I 2023-12-21 04:16:05,826] Trial 64 pruned. Trial was pruned at iteration 0.
[I 2023-12-21 04:16:05,886] Trial 65 pruned. Trial was pruned at iteration 0.
[I 2023-12-21 04:16:05,941] Trial 66 pruned. Trial was pruned at iteration 0.
[I 2023-12-21 04:16:05,994] Trial 67 pruned. Trial was pruned at iteration 0.
[I 2023-12-21 04:16:06,049] Trial 68 pruned. Trial was pruned at iteration 0.
[I 2023-12-21 04:16:06,120] Trial 69 pruned. Trial was pruned at iteration 0.
[I 2023-12-21 04:16:06,174] Trial 70 pruned. Trial was pruned at iteration 0.
[I 2023-12-21 04:16:06,234] Trial 71 pruned. Trial was pruned at iteration 0.
[I 2023-12-21 04:16:06,294] Trial 72 pruned. Trial was pruned at iteration 0.
[I 2023-12-21 04:16:06,352] Trial 73 pruned. Trial was pruned at iteration 0.
[I 2023-12-21 04:16:06,406] Trial 74 pruned. Trial was pruned at iteration 0.
[I 2023-12-21 04:16:06,469] Trial 75 pruned. Trial was pruned at iteration 0.
[I 2023-12-21 04:16:07,031] Trial 76 finished with value: 1.928604682830667 and parameters: {'learning_rate': 0.2128772199084221, 'aft_loss_distribution': 'logistic', 'aft_loss_distribution_scale': 0.8721130634292009, 'max_depth': 6, 'booster': 'gbtree', 'scale_pos_weight': 3.0741975280203775, 'alpha': 3.181009876621275, 'lambda': 2.0398500270469255, 'eta': 0.2545942166642735, 'sampling_method': 'uniform', 'subsample': 0.2709174853621561, 'gamma': 6.251252768426233}. Best is trial 50 with value: 1.9231774599892102.
[I 2023-12-21 04:16:07,094] Trial 77 pruned. Trial was pruned at iteration 0.
[I 2023-12-21 04:16:07,165] Trial 78 pruned. Trial was pruned at iteration 0.
[I 2023-12-21 04:16:07,222] Trial 79 pruned. Trial was pruned at iteration 0.
[I 2023-12-21 04:16:07,284] Trial 80 pruned. Trial was pruned at iteration 0.
[I 2023-12-21 04:16:07,603] Trial 81 pruned. Trial was pruned at iteration 134.
[I 2023-12-21 04:16:07,663] Trial 82 pruned. Trial was pruned at iteration 0.
[I 2023-12-21 04:16:07,725] Trial 83 pruned. Trial was pruned at iteration 0.
[I 2023-12-21 04:16:07,783] Trial 84 pruned. Trial was pruned at iteration 0.
[I 2023-12-21 04:16:07,840] Trial 85 pruned. Trial was pruned at iteration 0.
[I 2023-12-21 04:16:07,903] Trial 86 pruned. Trial was pruned at iteration 0.
[I 2023-12-21 04:16:07,961] Trial 87 pruned. Trial was pruned at iteration 0.
[I 2023-12-21 04:16:08,224] Trial 88 finished with value: 1.9584314383228645 and parameters: {'learning_rate': 0.27925012632908497, 'aft_loss_distribution': 'logistic', 'aft_loss_distribution_scale': 1.1550665247489005, 'max_depth': 9, 'booster': 'gbtree', 'scale_pos_weight': 3.1566926103865347, 'alpha': 3.038942873784474, 'lambda': 1.390474412683345, 'eta': 0.4793402555822217, 'sampling_method': 'uniform', 'subsample': 0.13863191970417899, 'gamma': 9.357617619442644}. Best is trial 50 with value: 1.9231774599892102.
[I 2023-12-21 04:16:08,287] Trial 89 pruned. Trial was pruned at iteration 0.
[I 2023-12-21 04:16:08,358] Trial 90 pruned. Trial was pruned at iteration 0.
[I 2023-12-21 04:16:08,422] Trial 91 pruned. Trial was pruned at iteration 0.
[I 2023-12-21 04:16:08,482] Trial 92 pruned. Trial was pruned at iteration 0.
[I 2023-12-21 04:16:08,652] Trial 93 pruned. Trial was pruned at iteration 58.
[I 2023-12-21 04:16:08,715] Trial 94 pruned. Trial was pruned at iteration 0.
[I 2023-12-21 04:16:08,774] Trial 95 pruned. Trial was pruned at iteration 0.
[I 2023-12-21 04:16:08,837] Trial 96 pruned. Trial was pruned at iteration 0.
[I 2023-12-21 04:16:08,898] Trial 97 pruned. Trial was pruned at iteration 0.
[I 2023-12-21 04:16:08,957] Trial 98 pruned. Trial was pruned at iteration 0.
[I 2023-12-21 04:16:09,014] Trial 99 pruned. Trial was pruned at iteration 0.
[I 2023-12-21 04:16:09,075] Trial 100 pruned. Trial was pruned at iteration 0.
[I 2023-12-21 04:16:09,134] Trial 101 pruned. Trial was pruned at iteration 0.
[I 2023-12-21 04:16:09,202] Trial 102 pruned. Trial was pruned at iteration 0.
[I 2023-12-21 04:16:09,630] Trial 103 pruned. Trial was pruned at iteration 134.
[I 2023-12-21 04:16:09,689] Trial 104 pruned. Trial was pruned at iteration 0.
[I 2023-12-21 04:16:09,745] Trial 105 pruned. Trial was pruned at iteration 0.
[I 2023-12-21 04:16:09,806] Trial 106 pruned. Trial was pruned at iteration 0.
[I 2023-12-21 04:16:09,863] Trial 107 pruned. Trial was pruned at iteration 0.
[I 2023-12-21 04:16:09,941] Trial 108 pruned. Trial was pruned at iteration 3.
[I 2023-12-21 04:16:10,004] Trial 109 pruned. Trial was pruned at iteration 0.
[I 2023-12-21 04:16:10,065] Trial 110 pruned. Trial was pruned at iteration 0.
[I 2023-12-21 04:16:10,124] Trial 111 pruned. Trial was pruned at iteration 0.
[I 2023-12-21 04:16:10,190] Trial 112 pruned. Trial was pruned at iteration 0.
[I 2023-12-21 04:16:10,259] Trial 113 pruned. Trial was pruned at iteration 0.
[I 2023-12-21 04:16:10,320] Trial 114 pruned. Trial was pruned at iteration 0.
[I 2023-12-21 04:16:10,691] Trial 115 finished with value: 2.0175083635427056 and parameters: {'learning_rate': 0.47392146563641857, 'aft_loss_distribution': 'logistic', 'aft_loss_distribution_scale': 1.5039689189756331, 'max_depth': 3, 'booster': 'gbtree', 'scale_pos_weight': 3.3868558009891427, 'alpha': 6.043814986492135, 'lambda': 1.1663541651045004, 'eta': 0.13540416727205853, 'sampling_method': 'gradient_based', 'subsample': 0.17889481110302569, 'gamma': 0.5870317375887776}. Best is trial 50 with value: 1.9231774599892102.
[I 2023-12-21 04:16:10,761] Trial 116 pruned. Trial was pruned at iteration 0.
[I 2023-12-21 04:16:10,821] Trial 117 pruned. Trial was pruned at iteration 0.
[I 2023-12-21 04:16:10,883] Trial 118 pruned. Trial was pruned at iteration 0.
[I 2023-12-21 04:16:10,946] Trial 119 pruned. Trial was pruned at iteration 0.
[I 2023-12-21 04:16:11,010] Trial 120 pruned. Trial was pruned at iteration 0.
[I 2023-12-21 04:16:11,069] Trial 121 pruned. Trial was pruned at iteration 0.
[I 2023-12-21 04:16:11,139] Trial 122 pruned. Trial was pruned at iteration 0.
[I 2023-12-21 04:16:11,402] Trial 123 pruned. Trial was pruned at iteration 58.
[I 2023-12-21 04:16:11,496] Trial 124 pruned. Trial was pruned at iteration 0.
[I 2023-12-21 04:16:11,922] Trial 125 finished with value: 1.946740086500513 and parameters: {'learning_rate': 0.28486474920623145, 'aft_loss_distribution': 'logistic', 'aft_loss_distribution_scale': 1.099738320186081, 'max_depth': 6, 'booster': 'gbtree', 'scale_pos_weight': 3.364119890808559, 'alpha': 5.5772412148108215, 'lambda': 1.619611063043037, 'eta': 0.8719998410593062, 'sampling_method': 'uniform', 'subsample': 0.396633490253242, 'gamma': 8.052458714760238}. Best is trial 50 with value: 1.9231774599892102.
[I 2023-12-21 04:16:12,029] Trial 126 pruned. Trial was pruned at iteration 0.
[I 2023-12-21 04:16:12,130] Trial 127 pruned. Trial was pruned at iteration 0.
[I 2023-12-21 04:16:12,582] Trial 128 pruned. Trial was pruned at iteration 127.
[I 2023-12-21 04:16:12,678] Trial 129 pruned. Trial was pruned at iteration 0.
[I 2023-12-21 04:16:12,781] Trial 130 pruned. Trial was pruned at iteration 0.
[I 2023-12-21 04:16:12,877] Trial 131 pruned. Trial was pruned at iteration 0.
[I 2023-12-21 04:16:12,977] Trial 132 pruned. Trial was pruned at iteration 0.
[I 2023-12-21 04:16:13,068] Trial 133 pruned. Trial was pruned at iteration 0.
[I 2023-12-21 04:16:13,156] Trial 134 pruned. Trial was pruned at iteration 0.
[I 2023-12-21 04:16:13,250] Trial 135 pruned. Trial was pruned at iteration 0.
[I 2023-12-21 04:16:13,370] Trial 136 pruned. Trial was pruned at iteration 0.
[I 2023-12-21 04:16:13,476] Trial 137 pruned. Trial was pruned at iteration 1.
[I 2023-12-21 04:16:13,581] Trial 138 pruned. Trial was pruned at iteration 0.
[I 2023-12-21 04:16:13,678] Trial 139 pruned. Trial was pruned at iteration 0.
[I 2023-12-21 04:16:14,116] Trial 140 pruned. Trial was pruned at iteration 127.
[I 2023-12-21 04:16:14,217] Trial 141 pruned. Trial was pruned at iteration 1.
[I 2023-12-21 04:16:14,324] Trial 142 pruned. Trial was pruned at iteration 0.
[I 2023-12-21 04:16:14,430] Trial 143 pruned. Trial was pruned at iteration 0.
[I 2023-12-21 04:16:14,524] Trial 144 pruned. Trial was pruned at iteration 0.
[I 2023-12-21 04:16:14,633] Trial 145 pruned. Trial was pruned at iteration 1.
[I 2023-12-21 04:16:14,730] Trial 146 pruned. Trial was pruned at iteration 0.
[I 2023-12-21 04:16:14,823] Trial 147 pruned. Trial was pruned at iteration 0.
[I 2023-12-21 04:16:14,924] Trial 148 pruned. Trial was pruned at iteration 1.
[I 2023-12-21 04:16:15,029] Trial 149 pruned. Trial was pruned at iteration 0.
[I 2023-12-21 04:16:15,128] Trial 150 pruned. Trial was pruned at iteration 0.
[I 2023-12-21 04:16:15,225] Trial 151 pruned. Trial was pruned at iteration 0.
[I 2023-12-21 04:16:15,324] Trial 152 pruned. Trial was pruned at iteration 0.
[I 2023-12-21 04:16:15,434] Trial 153 pruned. Trial was pruned at iteration 0.
[I 2023-12-21 04:16:15,536] Trial 154 pruned. Trial was pruned at iteration 1.
[I 2023-12-21 04:16:15,639] Trial 155 pruned. Trial was pruned at iteration 0.
[I 2023-12-21 04:16:15,750] Trial 156 pruned. Trial was pruned at iteration 0.
[I 2023-12-21 04:16:15,846] Trial 157 pruned. Trial was pruned at iteration 0.
[I 2023-12-21 04:16:15,951] Trial 158 pruned. Trial was pruned at iteration 0.
[I 2023-12-21 04:16:16,059] Trial 159 pruned. Trial was pruned at iteration 0.
[I 2023-12-21 04:16:16,164] Trial 160 pruned. Trial was pruned at iteration 0.
[I 2023-12-21 04:16:16,274] Trial 161 pruned. Trial was pruned at iteration 0.
[I 2023-12-21 04:16:16,384] Trial 162 pruned. Trial was pruned at iteration 0.
[I 2023-12-21 04:16:16,465] Trial 163 pruned. Trial was pruned at iteration 0.
[I 2023-12-21 04:16:16,532] Trial 164 pruned. Trial was pruned at iteration 0.
[I 2023-12-21 04:16:16,605] Trial 165 pruned. Trial was pruned at iteration 0.
[I 2023-12-21 04:16:16,670] Trial 166 pruned. Trial was pruned at iteration 0.
[I 2023-12-21 04:16:17,434] Trial 167 finished with value: 1.9332574143965136 and parameters: {'learning_rate': 0.2734978690835227, 'aft_loss_distribution': 'logistic', 'aft_loss_distribution_scale': 0.9652543864500283, 'max_depth': 7, 'booster': 'gbtree', 'scale_pos_weight': 3.3215571843640688, 'alpha': 2.717841368696539, 'lambda': 2.117409413205634, 'eta': 0.9234476552899487, 'sampling_method': 'uniform', 'subsample': 0.7440785057151691, 'gamma': 7.983655158088882}. Best is trial 50 with value: 1.9231774599892102.
[I 2023-12-21 04:16:17,519] Trial 168 pruned. Trial was pruned at iteration 0.
[I 2023-12-21 04:16:17,589] Trial 169 pruned. Trial was pruned at iteration 0.
[I 2023-12-21 04:16:18,179] Trial 170 pruned. Trial was pruned at iteration 264.
[I 2023-12-21 04:16:18,247] Trial 171 pruned. Trial was pruned at iteration 0.
[I 2023-12-21 04:16:18,572] Trial 172 pruned. Trial was pruned at iteration 127.
[I 2023-12-21 04:16:18,640] Trial 173 pruned. Trial was pruned at iteration 0.
[I 2023-12-21 04:16:18,710] Trial 174 pruned. Trial was pruned at iteration 0.
[I 2023-12-21 04:16:18,785] Trial 175 pruned. Trial was pruned at iteration 0.
[I 2023-12-21 04:16:18,858] Trial 176 pruned. Trial was pruned at iteration 0.
[I 2023-12-21 04:16:18,926] Trial 177 pruned. Trial was pruned at iteration 0.
[I 2023-12-21 04:16:18,994] Trial 178 pruned. Trial was pruned at iteration 0.
[I 2023-12-21 04:16:19,066] Trial 179 pruned. Trial was pruned at iteration 0.
[I 2023-12-21 04:16:19,131] Trial 180 pruned. Trial was pruned at iteration 0.
[I 2023-12-21 04:16:19,203] Trial 181 pruned. Trial was pruned at iteration 0.
[I 2023-12-21 04:16:19,272] Trial 182 pruned. Trial was pruned at iteration 0.
[I 2023-12-21 04:16:19,348] Trial 183 pruned. Trial was pruned at iteration 0.
[I 2023-12-21 04:16:19,414] Trial 184 pruned. Trial was pruned at iteration 0.
[I 2023-12-21 04:16:19,482] Trial 185 pruned. Trial was pruned at iteration 0.
[I 2023-12-21 04:16:19,560] Trial 186 pruned. Trial was pruned at iteration 0.
[I 2023-12-21 04:16:19,637] Trial 187 pruned. Trial was pruned at iteration 0.
[I 2023-12-21 04:16:19,702] Trial 188 pruned. Trial was pruned at iteration 0.
[I 2023-12-21 04:16:19,772] Trial 189 pruned. Trial was pruned at iteration 0.
[I 2023-12-21 04:16:19,843] Trial 190 pruned. Trial was pruned at iteration 0.
[I 2023-12-21 04:16:19,913] Trial 191 pruned. Trial was pruned at iteration 0.
[I 2023-12-21 04:16:19,977] Trial 192 pruned. Trial was pruned at iteration 0.
[I 2023-12-21 04:16:20,054] Trial 193 pruned. Trial was pruned at iteration 0.
[I 2023-12-21 04:16:20,121] Trial 194 pruned. Trial was pruned at iteration 0.
[I 2023-12-21 04:16:20,190] Trial 195 pruned. Trial was pruned at iteration 0.
[I 2023-12-21 04:16:20,258] Trial 196 pruned. Trial was pruned at iteration 0.
[I 2023-12-21 04:16:20,340] Trial 197 pruned. Trial was pruned at iteration 1.
[I 2023-12-21 04:16:20,406] Trial 198 pruned. Trial was pruned at iteration 0.
[I 2023-12-21 04:16:20,480] Trial 199 pruned. Trial was pruned at iteration 0.
[I 2023-12-21 04:16:20,561] Trial 200 pruned. Trial was pruned at iteration 0.
[I 2023-12-21 04:16:20,637] Trial 201 pruned. Trial was pruned at iteration 0.
[I 2023-12-21 04:16:20,705] Trial 202 pruned. Trial was pruned at iteration 0.
[I 2023-12-21 04:16:20,777] Trial 203 pruned. Trial was pruned at iteration 0.
[I 2023-12-21 04:16:20,847] Trial 204 pruned. Trial was pruned at iteration 0.
[I 2023-12-21 04:16:20,931] Trial 205 pruned. Trial was pruned at iteration 1.
[I 2023-12-21 04:16:21,010] Trial 206 pruned. Trial was pruned at iteration 0.
[I 2023-12-21 04:16:21,085] Trial 207 pruned. Trial was pruned at iteration 0.
[I 2023-12-21 04:16:21,158] Trial 208 pruned. Trial was pruned at iteration 0.
[I 2023-12-21 04:16:21,225] Trial 209 pruned. Trial was pruned at iteration 0.
[I 2023-12-21 04:16:23,942] Trial 210 pruned. Trial was pruned at iteration 75.
[I 2023-12-21 04:16:24,012] Trial 211 pruned. Trial was pruned at iteration 0.
[I 2023-12-21 04:16:24,085] Trial 212 pruned. Trial was pruned at iteration 0.
[I 2023-12-21 04:16:24,159] Trial 213 pruned. Trial was pruned at iteration 0.
[I 2023-12-21 04:16:24,231] Trial 214 pruned. Trial was pruned at iteration 0.
[I 2023-12-21 04:16:24,305] Trial 215 pruned. Trial was pruned at iteration 0.
[I 2023-12-21 04:16:24,380] Trial 216 pruned. Trial was pruned at iteration 1.
[I 2023-12-21 04:16:24,455] Trial 217 pruned. Trial was pruned at iteration 0.
[I 2023-12-21 04:16:24,530] Trial 218 pruned. Trial was pruned at iteration 0.
[I 2023-12-21 04:16:24,607] Trial 219 pruned. Trial was pruned at iteration 0.
[I 2023-12-21 04:16:24,704] Trial 220 pruned. Trial was pruned at iteration 0.
[I 2023-12-21 04:16:24,778] Trial 221 pruned. Trial was pruned at iteration 0.
[I 2023-12-21 04:16:24,860] Trial 222 pruned. Trial was pruned at iteration 0.
[I 2023-12-21 04:16:24,935] Trial 223 pruned. Trial was pruned at iteration 0.
[I 2023-12-21 04:16:25,341] Trial 224 finished with value: 1.9460651167156797 and parameters: {'learning_rate': 0.3030162494627617, 'aft_loss_distribution': 'logistic', 'aft_loss_distribution_scale': 1.1282914672698692, 'max_depth': 3, 'booster': 'gbtree', 'scale_pos_weight': 2.8373796003015626, 'alpha': 2.911094841886901, 'lambda': 2.9439044374665078, 'eta': 0.39435374638005427, 'sampling_method': 'gradient_based', 'subsample': 0.304597621785642, 'gamma': 6.445025886729577}. Best is trial 50 with value: 1.9231774599892102.
[I 2023-12-21 04:16:25,420] Trial 225 pruned. Trial was pruned at iteration 0.
[I 2023-12-21 04:16:25,652] Trial 226 finished with value: inf and parameters: {'learning_rate': 0.3002352776309577, 'aft_loss_distribution': 'logistic', 'aft_loss_distribution_scale': 1.0802709373801442, 'max_depth': 8, 'booster': 'gbtree', 'scale_pos_weight': 2.8577512954745408, 'alpha': 2.6366012450463954, 'lambda': 2.814189387230012, 'eta': 0.3605738036871953, 'sampling_method': 'gradient_based', 'subsample': 0.9976227150669668, 'gamma': 6.471590137876405}. Best is trial 50 with value: 1.9231774599892102.
[I 2023-12-21 04:16:25,744] Trial 227 pruned. Trial was pruned at iteration 0.
[I 2023-12-21 04:16:25,817] Trial 228 pruned. Trial was pruned at iteration 0.
[I 2023-12-21 04:16:25,890] Trial 229 pruned. Trial was pruned at iteration 0.
[I 2023-12-21 04:16:25,966] Trial 230 pruned. Trial was pruned at iteration 0.
[I 2023-12-21 04:16:26,040] Trial 231 pruned. Trial was pruned at iteration 0.
[I 2023-12-21 04:16:26,116] Trial 232 pruned. Trial was pruned at iteration 0.
[I 2023-12-21 04:16:26,189] Trial 233 pruned. Trial was pruned at iteration 0.
[I 2023-12-21 04:16:26,276] Trial 234 pruned. Trial was pruned at iteration 0.
[I 2023-12-21 04:16:26,349] Trial 235 pruned. Trial was pruned at iteration 0.
[I 2023-12-21 04:16:26,444] Trial 236 pruned. Trial was pruned at iteration 0.
[I 2023-12-21 04:16:26,562] Trial 237 pruned. Trial was pruned at iteration 0.
[I 2023-12-21 04:16:26,676] Trial 238 pruned. Trial was pruned at iteration 0.
[I 2023-12-21 04:16:26,796] Trial 239 pruned. Trial was pruned at iteration 0.
[I 2023-12-21 04:16:26,914] Trial 240 pruned. Trial was pruned at iteration 0.
