[I 2023-12-21 03:57:34,602] Trial 131 finished with value: 1.9030881649288622 and parameters: {'learning_rate': 0.9454745653120901, 'aft_loss_distribution': 'normal', 'aft_loss_distribution_scale': 1.463586859501436, 'max_depth': 4, 'booster': 'gbtree', 'scale_pos_weight': 1.2848575134863078, 'alpha': 4.2874569708238015, 'lambda': 7.345947609624651, 'eta': 0.11704740585955895, 'sampling_method': 'gradient_based', 'subsample': 0.5788370175888613, 'gamma': 8.148090403655418}. Best is trial 63 with value: 1.895409823674203.
[I 2023-12-21 03:57:34,933] Trial 132 finished with value: 1.9044198294219818 and parameters: {'learning_rate': 0.9656472796321985, 'aft_loss_distribution': 'normal', 'aft_loss_distribution_scale': 1.5007953034610342, 'max_depth': 4, 'booster': 'gbtree', 'scale_pos_weight': 1.250401202917892, 'alpha': 4.0917944335121925, 'lambda': 7.347125842413331, 'eta': 0.11846898313146528, 'sampling_method': 'gradient_based', 'subsample': 0.5674559327992885, 'gamma': 2.8609217615208875}. Best is trial 63 with value: 1.895409823674203.
[I 2023-12-21 03:57:34,996] Trial 133 pruned. Trial was pruned at iteration 0.
[I 2023-12-21 03:57:35,063] Trial 134 pruned. Trial was pruned at iteration 1.
[I 2023-12-21 03:57:35,121] Trial 135 pruned. Trial was pruned at iteration 0.
[I 2023-12-21 03:57:35,176] Trial 136 pruned. Trial was pruned at iteration 0.
[I 2023-12-21 03:57:35,240] Trial 137 pruned. Trial was pruned at iteration 1.
[I 2023-12-21 03:57:35,308] Trial 138 pruned. Trial was pruned at iteration 0.
[I 2023-12-21 03:57:35,364] Trial 139 pruned. Trial was pruned at iteration 0.
[I 2023-12-21 03:57:35,423] Trial 140 pruned. Trial was pruned at iteration 0.
[I 2023-12-21 03:57:35,886] Trial 141 finished with value: 1.900447181637834 and parameters: {'learning_rate': 0.9986261720291602, 'aft_loss_distribution': 'normal', 'aft_loss_distribution_scale': 1.429522007584358, 'max_depth': 4, 'booster': 'gbtree', 'scale_pos_weight': 1.2477559261529785, 'alpha': 4.451200682336787, 'lambda': 7.351370881620845, 'eta': 0.1516511330519421, 'sampling_method': 'gradient_based', 'subsample': 0.6420601035142808, 'gamma': 7.8181328999273285}. Best is trial 63 with value: 1.895409823674203.
[I 2023-12-21 03:57:36,154] Trial 142 finished with value: inf and parameters: {'learning_rate': 0.9818919817166415, 'aft_loss_distribution': 'normal', 'aft_loss_distribution_scale': 1.2916240363846372, 'max_depth': 4, 'booster': 'gbtree', 'scale_pos_weight': 1.3380467179279856, 'alpha': 4.393404440694103, 'lambda': 7.265090854233428, 'eta': 0.10916254132177913, 'sampling_method': 'gradient_based', 'subsample': 0.6017691385752832, 'gamma': 7.811499274254726}. Best is trial 63 with value: 1.895409823674203.
[I 2023-12-21 03:57:36,259] Trial 143 pruned. Trial was pruned at iteration 1.
[I 2023-12-21 03:57:37,111] Trial 144 finished with value: 1.9076148304716365 and parameters: {'learning_rate': 0.9536479119088327, 'aft_loss_distribution': 'normal', 'aft_loss_distribution_scale': 1.4937789039905427, 'max_depth': 4, 'booster': 'gbtree', 'scale_pos_weight': 1.0839273072774478, 'alpha': 3.9436547947661342, 'lambda': 7.703103409497731, 'eta': 0.07448779150436682, 'sampling_method': 'gradient_based', 'subsample': 0.6430305750540039, 'gamma': 7.496735109566533}. Best is trial 63 with value: 1.895409823674203.
[I 2023-12-21 03:57:37,220] Trial 145 pruned. Trial was pruned at iteration 1.
[I 2023-12-21 03:57:37,315] Trial 146 pruned. Trial was pruned at iteration 0.
[I 2023-12-21 03:57:37,415] Trial 147 pruned. Trial was pruned at iteration 0.
[I 2023-12-21 03:57:37,511] Trial 148 pruned. Trial was pruned at iteration 0.
[I 2023-12-21 03:57:37,609] Trial 149 pruned. Trial was pruned at iteration 0.
[I 2023-12-21 03:57:38,094] Trial 150 finished with value: 1.902293083308695 and parameters: {'learning_rate': 0.9532685872900453, 'aft_loss_distribution': 'normal', 'aft_loss_distribution_scale': 1.4146185992007791, 'max_depth': 5, 'booster': 'gbtree', 'scale_pos_weight': 1.2719912096242647, 'alpha': 4.363079511789346, 'lambda': 7.1300939137515496, 'eta': 0.1253849862768347, 'sampling_method': 'gradient_based', 'subsample': 0.44852710549913466, 'gamma': 7.150908755021634}. Best is trial 63 with value: 1.895409823674203.
[I 2023-12-21 03:57:38,531] Trial 151 finished with value: 1.907677423276833 and parameters: {'learning_rate': 0.9793579966676653, 'aft_loss_distribution': 'normal', 'aft_loss_distribution_scale': 1.4552641277741538, 'max_depth': 5, 'booster': 'gbtree', 'scale_pos_weight': 1.2659406224913472, 'alpha': 4.32607331286286, 'lambda': 7.138357076808947, 'eta': 0.12370049290346657, 'sampling_method': 'gradient_based', 'subsample': 0.43823059126530156, 'gamma': 6.919911878276915}. Best is trial 63 with value: 1.895409823674203.
[I 2023-12-21 03:57:38,631] Trial 152 pruned. Trial was pruned at iteration 0.
[I 2023-12-21 03:57:38,740] Trial 153 pruned. Trial was pruned at iteration 2.
[I 2023-12-21 03:57:38,833] Trial 154 pruned. Trial was pruned at iteration 0.
[I 2023-12-21 03:57:38,935] Trial 155 pruned. Trial was pruned at iteration 1.
[I 2023-12-21 03:57:39,038] Trial 156 pruned. Trial was pruned at iteration 0.
[I 2023-12-21 03:57:39,133] Trial 157 pruned. Trial was pruned at iteration 0.
[I 2023-12-21 03:57:39,469] Trial 158 finished with value: 1.9031151831065058 and parameters: {'learning_rate': 0.9800419718792359, 'aft_loss_distribution': 'normal', 'aft_loss_distribution_scale': 1.4286996304023152, 'max_depth': 6, 'booster': 'gbtree', 'scale_pos_weight': 0.8540058099407033, 'alpha': 4.574071161614082, 'lambda': 7.525943597742295, 'eta': 0.07808507679544963, 'sampling_method': 'gradient_based', 'subsample': 0.5294717769775976, 'gamma': 7.302231850949745}. Best is trial 63 with value: 1.895409823674203.
[I 2023-12-21 03:57:39,558] Trial 159 pruned. Trial was pruned at iteration 0.
[I 2023-12-21 03:57:39,654] Trial 160 pruned. Trial was pruned at iteration 0.
[I 2023-12-21 03:57:39,763] Trial 161 pruned. Trial was pruned at iteration 5.
[I 2023-12-21 03:57:39,858] Trial 162 pruned. Trial was pruned at iteration 0.
[I 2023-12-21 03:57:40,202] Trial 163 finished with value: 1.9021053410336841 and parameters: {'learning_rate': 0.981704428237385, 'aft_loss_distribution': 'normal', 'aft_loss_distribution_scale': 1.3813509096520988, 'max_depth': 4, 'booster': 'gbtree', 'scale_pos_weight': 1.3200330880334676, 'alpha': 4.91488125148468, 'lambda': 7.357142428447557, 'eta': 0.07714703071350151, 'sampling_method': 'gradient_based', 'subsample': 0.5953598675042061, 'gamma': 7.245390060183018}. Best is trial 63 with value: 1.895409823674203.
[I 2023-12-21 03:57:40,595] Trial 164 finished with value: 1.8970043829854557 and parameters: {'learning_rate': 0.9989169008801545, 'aft_loss_distribution': 'normal', 'aft_loss_distribution_scale': 1.3689050794630044, 'max_depth': 4, 'booster': 'gbtree', 'scale_pos_weight': 1.3230918841085297, 'alpha': 4.9493508467998915, 'lambda': 7.374725349836242, 'eta': 0.012417286854493448, 'sampling_method': 'gradient_based', 'subsample': 0.5277306218224027, 'gamma': 7.23023881944406}. Best is trial 63 with value: 1.895409823674203.
[I 2023-12-21 03:57:41,145] Trial 165 finished with value: 1.8963044700206335 and parameters: {'learning_rate': 0.9949544980783666, 'aft_loss_distribution': 'normal', 'aft_loss_distribution_scale': 1.3248854340623382, 'max_depth': 4, 'booster': 'gbtree', 'scale_pos_weight': 1.3675692773654429, 'alpha': 4.931839636422465, 'lambda': 7.41857580400899, 'eta': 0.009701324578105755, 'sampling_method': 'gradient_based', 'subsample': 0.530121677036746, 'gamma': 7.304689105709668}. Best is trial 63 with value: 1.895409823674203.
[I 2023-12-21 03:57:41,221] Trial 166 pruned. Trial was pruned at iteration 0.
[I 2023-12-21 03:57:41,284] Trial 167 pruned. Trial was pruned at iteration 1.
[I 2023-12-21 03:57:41,570] Trial 168 finished with value: 1.9003734855922767 and parameters: {'learning_rate': 0.9987464656753406, 'aft_loss_distribution': 'normal', 'aft_loss_distribution_scale': 1.2787062884361533, 'max_depth': 4, 'booster': 'gbtree', 'scale_pos_weight': 1.5150601378607016, 'alpha': 4.8864356126105175, 'lambda': 7.375747758730713, 'eta': 0.020562940468042135, 'sampling_method': 'gradient_based', 'subsample': 0.4937773852325535, 'gamma': 7.362411224696061}. Best is trial 63 with value: 1.895409823674203.
[I 2023-12-21 03:57:41,813] Trial 169 finished with value: 1.906071854655165 and parameters: {'learning_rate': 0.9979529795759042, 'aft_loss_distribution': 'normal', 'aft_loss_distribution_scale': 1.2857753874405382, 'max_depth': 4, 'booster': 'gbtree', 'scale_pos_weight': 1.4230817947069438, 'alpha': 5.029219192742889, 'lambda': 6.897087229180585, 'eta': 0.016791071469443954, 'sampling_method': 'gradient_based', 'subsample': 0.4932253881999525, 'gamma': 7.2372204434786065}. Best is trial 63 with value: 1.895409823674203.
[I 2023-12-21 03:57:41,878] Trial 170 pruned. Trial was pruned at iteration 0.
[I 2023-12-21 03:57:41,941] Trial 171 pruned. Trial was pruned at iteration 1.
[I 2023-12-21 03:57:42,196] Trial 172 finished with value: 1.904493866665612 and parameters: {'learning_rate': 0.9999696315000874, 'aft_loss_distribution': 'normal', 'aft_loss_distribution_scale': 1.3507027286684916, 'max_depth': 4, 'booster': 'gbtree', 'scale_pos_weight': 1.7029582466610496, 'alpha': 5.368674205143447, 'lambda': 7.451572229423839, 'eta': 0.0016120615572766672, 'sampling_method': 'gradient_based', 'subsample': 0.5061010589553596, 'gamma': 7.787128574868464}. Best is trial 63 with value: 1.895409823674203.
[I 2023-12-21 03:57:42,267] Trial 173 pruned. Trial was pruned at iteration 0.
[I 2023-12-21 03:57:42,331] Trial 174 pruned. Trial was pruned at iteration 0.
[I 2023-12-21 03:57:42,390] Trial 175 pruned. Trial was pruned at iteration 0.
[I 2023-12-21 03:57:42,618] Trial 176 finished with value: inf and parameters: {'learning_rate': 0.9691686392724516, 'aft_loss_distribution': 'normal', 'aft_loss_distribution_scale': 1.3168472720634055, 'max_depth': 4, 'booster': 'gbtree', 'scale_pos_weight': 1.6875654207574817, 'alpha': 5.658393605281773, 'lambda': 7.505327703689922, 'eta': 0.0038120082974566205, 'sampling_method': 'gradient_based', 'subsample': 0.46084933154897795, 'gamma': 7.637010107880913}. Best is trial 63 with value: 1.895409823674203.
[I 2023-12-21 03:57:42,686] Trial 177 pruned. Trial was pruned at iteration 0.
[I 2023-12-21 03:57:42,745] Trial 178 pruned. Trial was pruned at iteration 0.
[I 2023-12-21 03:57:42,802] Trial 179 pruned. Trial was pruned at iteration 0.
[I 2023-12-21 03:57:42,862] Trial 180 pruned. Trial was pruned at iteration 0.
[I 2023-12-21 03:57:42,930] Trial 181 pruned. Trial was pruned at iteration 1.
[I 2023-12-21 03:57:43,181] Trial 182 finished with value: 1.9046550827226574 and parameters: {'learning_rate': 0.9997533914873169, 'aft_loss_distribution': 'normal', 'aft_loss_distribution_scale': 1.3854504521991586, 'max_depth': 4, 'booster': 'gbtree', 'scale_pos_weight': 1.3053469169395817, 'alpha': 4.641897948636655, 'lambda': 7.362403200059092, 'eta': 0.023779046037770656, 'sampling_method': 'gradient_based', 'subsample': 0.5745994778183734, 'gamma': 7.135396347591392}. Best is trial 63 with value: 1.895409823674203.
[I 2023-12-21 03:57:43,571] Trial 183 finished with value: 1.9005869463081335 and parameters: {'learning_rate': 0.9989269492832323, 'aft_loss_distribution': 'normal', 'aft_loss_distribution_scale': 1.354750221299604, 'max_depth': 4, 'booster': 'gbtree', 'scale_pos_weight': 1.3051612560058952, 'alpha': 4.663532402425872, 'lambda': 7.688489160077202, 'eta': 0.004332833191998427, 'sampling_method': 'gradient_based', 'subsample': 0.5518742713995937, 'gamma': 6.772754425643806}. Best is trial 63 with value: 1.895409823674203.
[I 2023-12-21 03:57:43,637] Trial 184 pruned. Trial was pruned at iteration 0.
[I 2023-12-21 03:57:43,910] Trial 185 finished with value: 1.9061024603208827 and parameters: {'learning_rate': 0.9823597859838111, 'aft_loss_distribution': 'normal', 'aft_loss_distribution_scale': 1.32969628854859, 'max_depth': 4, 'booster': 'gbtree', 'scale_pos_weight': 1.3546332574863555, 'alpha': 4.78955543287415, 'lambda': 7.59822880219106, 'eta': 0.030581875091525122, 'sampling_method': 'gradient_based', 'subsample': 0.5861010527769269, 'gamma': 6.7518752321737665}. Best is trial 63 with value: 1.895409823674203.
[I 2023-12-21 03:57:43,975] Trial 186 pruned. Trial was pruned at iteration 0.
[I 2023-12-21 03:57:44,053] Trial 187 pruned. Trial was pruned at iteration 4.
[I 2023-12-21 03:57:44,113] Trial 188 pruned. Trial was pruned at iteration 0.
[I 2023-12-21 03:57:44,182] Trial 189 pruned. Trial was pruned at iteration 0.
[I 2023-12-21 03:57:44,248] Trial 190 pruned. Trial was pruned at iteration 0.
[I 2023-12-21 03:57:44,883] Trial 191 finished with value: 1.9030900891872604 and parameters: {'learning_rate': 0.9819835015840219, 'aft_loss_distribution': 'normal', 'aft_loss_distribution_scale': 1.4014796693974172, 'max_depth': 4, 'booster': 'gbtree', 'scale_pos_weight': 1.3700053753317012, 'alpha': 4.806145757508617, 'lambda': 7.623065719688614, 'eta': 0.04340652280653432, 'sampling_method': 'gradient_based', 'subsample': 0.5843727539527566, 'gamma': 6.740722548462797}. Best is trial 63 with value: 1.895409823674203.
[I 2023-12-21 03:57:45,147] Trial 192 finished with value: 1.905630569479212 and parameters: {'learning_rate': 0.9783688334431746, 'aft_loss_distribution': 'normal', 'aft_loss_distribution_scale': 1.4397886643122568, 'max_depth': 4, 'booster': 'gbtree', 'scale_pos_weight': 1.3589432167803646, 'alpha': 4.423447619408287, 'lambda': 7.436751945289656, 'eta': 0.00036250377861682045, 'sampling_method': 'gradient_based', 'subsample': 0.5686983321876632, 'gamma': 6.827769774944809}. Best is trial 63 with value: 1.895409823674203.
[I 2023-12-21 03:57:45,425] Trial 193 finished with value: 1.9017250980215006 and parameters: {'learning_rate': 0.9770047815628948, 'aft_loss_distribution': 'normal', 'aft_loss_distribution_scale': 1.5100820901530676, 'max_depth': 4, 'booster': 'gbtree', 'scale_pos_weight': 1.3279251495371973, 'alpha': 4.390683813433258, 'lambda': 7.387418699365773, 'eta': 0.057807149236829766, 'sampling_method': 'gradient_based', 'subsample': 0.5664744947127456, 'gamma': 6.563091007211524}. Best is trial 63 with value: 1.895409823674203.
[I 2023-12-21 03:57:45,490] Trial 194 pruned. Trial was pruned at iteration 0.
[I 2023-12-21 03:57:45,552] Trial 195 pruned. Trial was pruned at iteration 1.
[I 2023-12-21 03:57:45,834] Trial 196 finished with value: 1.9007954725750897 and parameters: {'learning_rate': 0.9811045297004585, 'aft_loss_distribution': 'normal', 'aft_loss_distribution_scale': 1.4707863782290218, 'max_depth': 4, 'booster': 'gbtree', 'scale_pos_weight': 1.3248926509644907, 'alpha': 4.14836315703755, 'lambda': 7.978635245697014, 'eta': 0.05171583844615012, 'sampling_method': 'gradient_based', 'subsample': 0.5584905942283606, 'gamma': 6.088399916167233}. Best is trial 63 with value: 1.895409823674203.
[I 2023-12-21 03:57:45,901] Trial 197 pruned. Trial was pruned at iteration 0.
[I 2023-12-21 03:57:45,964] Trial 198 pruned. Trial was pruned at iteration 1.
[I 2023-12-21 03:57:46,036] Trial 199 pruned. Trial was pruned at iteration 0.
[I 2023-12-21 03:57:46,378] Trial 200 finished with value: 1.9041342289912233 and parameters: {'learning_rate': 0.9784727053275843, 'aft_loss_distribution': 'normal', 'aft_loss_distribution_scale': 1.397687819369122, 'max_depth': 4, 'booster': 'gbtree', 'scale_pos_weight': 1.2831241823366868, 'alpha': 4.597063879590237, 'lambda': 7.987904686747533, 'eta': 0.04277903441412995, 'sampling_method': 'gradient_based', 'subsample': 0.5189533389500015, 'gamma': 6.3889817393233725}. Best is trial 63 with value: 1.895409823674203.
[I 2023-12-21 03:57:46,718] Trial 201 finished with value: 1.9051895380598671 and parameters: {'learning_rate': 0.9776510279946435, 'aft_loss_distribution': 'normal', 'aft_loss_distribution_scale': 1.450161907145743, 'max_depth': 4, 'booster': 'gbtree', 'scale_pos_weight': 1.289509777928896, 'alpha': 4.846521443451929, 'lambda': 7.961774601750155, 'eta': 0.057400255616649715, 'sampling_method': 'gradient_based', 'subsample': 0.5154781422897635, 'gamma': 5.930172488491802}. Best is trial 63 with value: 1.895409823674203.
[I 2023-12-21 03:57:46,786] Trial 202 pruned. Trial was pruned at iteration 1.
[I 2023-12-21 03:57:47,017] Trial 203 finished with value: 1.8998781900878088 and parameters: {'learning_rate': 0.9813512090411495, 'aft_loss_distribution': 'normal', 'aft_loss_distribution_scale': 1.3842500929855504, 'max_depth': 4, 'booster': 'gbtree', 'scale_pos_weight': 1.2244009624123882, 'alpha': 4.344660177185801, 'lambda': 8.244572952191787, 'eta': 0.024643257804095577, 'sampling_method': 'gradient_based', 'subsample': 0.5291353822087294, 'gamma': 6.256422839809111}. Best is trial 63 with value: 1.895409823674203.
[I 2023-12-21 03:57:47,093] Trial 204 pruned. Trial was pruned at iteration 0.
[I 2023-12-21 03:57:47,163] Trial 205 pruned. Trial was pruned at iteration 1.
[I 2023-12-21 03:57:47,229] Trial 206 pruned. Trial was pruned at iteration 0.
[I 2023-12-21 03:57:47,301] Trial 207 pruned. Trial was pruned at iteration 0.
[I 2023-12-21 03:57:47,385] Trial 208 pruned. Trial was pruned at iteration 0.
[I 2023-12-21 03:57:47,459] Trial 209 pruned. Trial was pruned at iteration 0.
[I 2023-12-21 03:57:47,525] Trial 210 pruned. Trial was pruned at iteration 0.
[I 2023-12-21 03:57:47,935] Trial 211 finished with value: 1.900670500509269 and parameters: {'learning_rate': 0.9836668881265707, 'aft_loss_distribution': 'normal', 'aft_loss_distribution_scale': 1.3754186534539836, 'max_depth': 4, 'booster': 'gbtree', 'scale_pos_weight': 1.3223364040433168, 'alpha': 4.71667671162112, 'lambda': 7.444704653115358, 'eta': 0.021544965588974396, 'sampling_method': 'gradient_based', 'subsample': 0.5716676752111209, 'gamma': 7.101564439570334}. Best is trial 63 with value: 1.895409823674203.
[I 2023-12-21 03:57:48,007] Trial 212 pruned. Trial was pruned at iteration 0.
[I 2023-12-21 03:57:48,253] Trial 213 finished with value: 1.901562835039814 and parameters: {'learning_rate': 0.9545899302633509, 'aft_loss_distribution': 'normal', 'aft_loss_distribution_scale': 1.4996646918891396, 'max_depth': 4, 'booster': 'gbtree', 'scale_pos_weight': 1.3575432889949626, 'alpha': 4.371573455239631, 'lambda': 7.145401757675587, 'eta': 0.6181107459734474, 'sampling_method': 'gradient_based', 'subsample': 0.5900759425074839, 'gamma': 5.404160832460241}. Best is trial 63 with value: 1.895409823674203.
[I 2023-12-21 03:57:48,345] Trial 214 pruned. Trial was pruned at iteration 3.
[I 2023-12-21 03:57:48,420] Trial 215 pruned. Trial was pruned at iteration 1.
[I 2023-12-21 03:57:48,489] Trial 216 pruned. Trial was pruned at iteration 0.
[I 2023-12-21 03:57:48,688] Trial 217 finished with value: inf and parameters: {'learning_rate': 0.9687873792869387, 'aft_loss_distribution': 'normal', 'aft_loss_distribution_scale': 1.4870435907331356, 'max_depth': 4, 'booster': 'gbtree', 'scale_pos_weight': 1.1701872602906795, 'alpha': 4.26362754763202, 'lambda': 7.3730805791766505, 'eta': 0.5982530497488423, 'sampling_method': 'gradient_based', 'subsample': 0.6353958619872995, 'gamma': 5.39852899016749}. Best is trial 63 with value: 1.895409823674203.
[I 2023-12-21 03:57:48,763] Trial 218 pruned. Trial was pruned at iteration 1.
[I 2023-12-21 03:57:48,833] Trial 219 pruned. Trial was pruned at iteration 0.
[I 2023-12-21 03:57:48,902] Trial 220 pruned. Trial was pruned at iteration 0.
[I 2023-12-21 03:57:49,183] Trial 221 finished with value: inf and parameters: {'learning_rate': 0.9841247648826346, 'aft_loss_distribution': 'normal', 'aft_loss_distribution_scale': 1.34168715470053, 'max_depth': 4, 'booster': 'gbtree', 'scale_pos_weight': 1.5474830602036145, 'alpha': 4.745298188166565, 'lambda': 7.466502450414563, 'eta': 0.0004012886988890552, 'sampling_method': 'gradient_based', 'subsample': 0.5347048789239819, 'gamma': 7.279778169378493}. Best is trial 63 with value: 1.895409823674203.
[I 2023-12-21 03:57:49,319] Trial 222 pruned. Trial was pruned at iteration 1.
[I 2023-12-21 03:57:49,443] Trial 223 pruned. Trial was pruned at iteration 0.
[I 2023-12-21 03:57:49,513] Trial 224 pruned. Trial was pruned at iteration 1.
[I 2023-12-21 03:57:49,579] Trial 225 pruned. Trial was pruned at iteration 0.
[I 2023-12-21 03:57:50,038] Trial 226 finished with value: 1.8964713312044679 and parameters: {'learning_rate': 0.9601537708430756, 'aft_loss_distribution': 'normal', 'aft_loss_distribution_scale': 1.454595454585719, 'max_depth': 4, 'booster': 'gbtree', 'scale_pos_weight': 1.4699801428076313, 'alpha': 4.347495178679668, 'lambda': 7.627884722387517, 'eta': 0.03920316186132499, 'sampling_method': 'gradient_based', 'subsample': 0.5237432473909168, 'gamma': 7.017920910898793}. Best is trial 63 with value: 1.895409823674203.
[I 2023-12-21 03:57:50,121] Trial 227 pruned. Trial was pruned at iteration 1.
[I 2023-12-21 03:57:50,199] Trial 228 pruned. Trial was pruned at iteration 0.
[I 2023-12-21 03:57:50,281] Trial 229 pruned. Trial was pruned at iteration 0.
[I 2023-12-21 03:57:50,351] Trial 230 pruned. Trial was pruned at iteration 0.
[I 2023-12-21 03:57:50,584] Trial 231 finished with value: inf and parameters: {'learning_rate': 0.9770301350813371, 'aft_loss_distribution': 'normal', 'aft_loss_distribution_scale': 1.370352652990362, 'max_depth': 4, 'booster': 'gbtree', 'scale_pos_weight': 1.6310969770582315, 'alpha': 4.562004437859621, 'lambda': 7.461279670070207, 'eta': 0.01885317716773787, 'sampling_method': 'gradient_based', 'subsample': 0.4976370379994979, 'gamma': 5.215482947553225}. Best is trial 63 with value: 1.895409823674203.
[I 2023-12-21 03:57:50,689] Trial 232 pruned. Trial was pruned at iteration 0.
[I 2023-12-21 03:57:50,794] Trial 233 pruned. Trial was pruned at iteration 0.
