[I 2023-12-18 23:00:52,056] Trial 215 finished with value: inf and parameters: {'learning_rate': 0.9168760592802828, 'aft_loss_distribution': 'normal', 'aft_loss_distribution_scale': 1.3484580453976784, 'max_depth': 6, 'booster': 'dart', 'scale_pos_weight': 2.786467922558107, 'alpha': 6.641490278948229, 'lambda': 0.006700116722461402, 'eta': 0.8006609648493167, 'sampling_method': 'uniform', 'subsample': 0.600049530716661, 'gamma': 8.710104042948704}. Best is trial 195 with value: 4.267796894268609.
[I 2023-12-18 23:00:53,667] Trial 216 finished with value: inf and parameters: {'learning_rate': 0.8856696694590547, 'aft_loss_distribution': 'normal', 'aft_loss_distribution_scale': 1.0637890526800076, 'max_depth': 6, 'booster': 'dart', 'scale_pos_weight': 2.3333495825109196, 'alpha': 6.818149314186452, 'lambda': 0.3633173843913269, 'eta': 0.767467102261517, 'sampling_method': 'uniform', 'subsample': 0.6225955264712426, 'gamma': 9.518030313239677}. Best is trial 195 with value: 4.267796894268609.
[I 2023-12-18 23:01:07,103] Trial 217 pruned. Trial was pruned at iteration 178.
[I 2023-12-18 23:01:08,551] Trial 218 finished with value: inf and parameters: {'learning_rate': 0.8384314192451, 'aft_loss_distribution': 'normal', 'aft_loss_distribution_scale': 0.9125476327137563, 'max_depth': 6, 'booster': 'dart', 'scale_pos_weight': 2.182734985926553, 'alpha': 7.1479201086051445, 'lambda': 0.17985592460426836, 'eta': 0.8044218680030688, 'sampling_method': 'uniform', 'subsample': 0.5921732231251705, 'gamma': 9.209534913749385}. Best is trial 195 with value: 4.267796894268609.
[I 2023-12-18 23:01:10,236] Trial 219 finished with value: inf and parameters: {'learning_rate': 0.8375253878712176, 'aft_loss_distribution': 'normal', 'aft_loss_distribution_scale': 1.1967642671368155, 'max_depth': 6, 'booster': 'dart', 'scale_pos_weight': 2.9038517386813685, 'alpha': 6.8785816596364455, 'lambda': 0.5067952914643734, 'eta': 0.7826741455730497, 'sampling_method': 'uniform', 'subsample': 0.633568937180174, 'gamma': 8.059354948566064}. Best is trial 195 with value: 4.267796894268609.
[I 2023-12-18 23:01:12,620] Trial 220 finished with value: inf and parameters: {'learning_rate': 0.9211231682537617, 'aft_loss_distribution': 'normal', 'aft_loss_distribution_scale': 1.4838006341751087, 'max_depth': 6, 'booster': 'dart', 'scale_pos_weight': 2.7392493554125332, 'alpha': 6.546201682933169, 'lambda': 0.3304050085299071, 'eta': 0.9037389113455279, 'sampling_method': 'uniform', 'subsample': 0.5759888694841718, 'gamma': 9.133892692135747}. Best is trial 195 with value: 4.267796894268609.
[I 2023-12-18 23:01:15,028] Trial 221 finished with value: inf and parameters: {'learning_rate': 0.8666916538549286, 'aft_loss_distribution': 'normal', 'aft_loss_distribution_scale': 1.4337695497398155, 'max_depth': 6, 'booster': 'dart', 'scale_pos_weight': 3.0634631634232887, 'alpha': 7.413330159140302, 'lambda': 0.5983226691659246, 'eta': 0.7627813234264538, 'sampling_method': 'uniform', 'subsample': 0.5671343393826294, 'gamma': 9.818588483518509}. Best is trial 195 with value: 4.267796894268609.
[I 2023-12-18 23:01:17,100] Trial 222 finished with value: inf and parameters: {'learning_rate': 0.8245540482668409, 'aft_loss_distribution': 'normal', 'aft_loss_distribution_scale': 1.094517292966157, 'max_depth': 6, 'booster': 'dart', 'scale_pos_weight': 3.1598055575949093, 'alpha': 7.747341550297673, 'lambda': 0.8175843075453211, 'eta': 0.8141242551898105, 'sampling_method': 'uniform', 'subsample': 0.6066541532460095, 'gamma': 7.0456506635717}. Best is trial 195 with value: 4.267796894268609.
[I 2023-12-18 23:01:23,726] Trial 223 finished with value: 4.30462199228235 and parameters: {'learning_rate': 0.8060163065274376, 'aft_loss_distribution': 'normal', 'aft_loss_distribution_scale': 1.3086842280716868, 'max_depth': 6, 'booster': 'dart', 'scale_pos_weight': 2.8793064013086633, 'alpha': 7.280880685615029, 'lambda': 0.15575717434213845, 'eta': 0.7406701805082447, 'sampling_method': 'uniform', 'subsample': 0.5946260845904779, 'gamma': 8.217502635654514}. Best is trial 195 with value: 4.267796894268609.
[I 2023-12-18 23:01:23,797] Trial 224 pruned. Trial was pruned at iteration 0.
[I 2023-12-18 23:01:29,502] Trial 225 finished with value: 4.297519734854594 and parameters: {'learning_rate': 0.8347026547393005, 'aft_loss_distribution': 'normal', 'aft_loss_distribution_scale': 1.2785148516126885, 'max_depth': 6, 'booster': 'dart', 'scale_pos_weight': 2.641989862677288, 'alpha': 7.03454727543739, 'lambda': 0.16279620109812226, 'eta': 0.7833883393979828, 'sampling_method': 'uniform', 'subsample': 0.5936285277755189, 'gamma': 8.135414253641098}. Best is trial 195 with value: 4.267796894268609.
[I 2023-12-18 23:01:29,573] Trial 226 pruned. Trial was pruned at iteration 0.
[I 2023-12-18 23:01:36,434] Trial 227 finished with value: 4.289363463098895 and parameters: {'learning_rate': 0.8327650454375792, 'aft_loss_distribution': 'normal', 'aft_loss_distribution_scale': 1.2441603631205456, 'max_depth': 6, 'booster': 'dart', 'scale_pos_weight': 2.745286066361958, 'alpha': 7.011013333293372, 'lambda': 0.47296597003631324, 'eta': 0.7827569236355466, 'sampling_method': 'uniform', 'subsample': 0.6279113972602687, 'gamma': 7.716592793883037}. Best is trial 195 with value: 4.267796894268609.
[I 2023-12-18 23:01:36,506] Trial 228 pruned. Trial was pruned at iteration 0.
[I 2023-12-18 23:01:37,965] Trial 229 finished with value: inf and parameters: {'learning_rate': 0.8667297241058302, 'aft_loss_distribution': 'normal', 'aft_loss_distribution_scale': 1.0290884027036773, 'max_depth': 6, 'booster': 'dart', 'scale_pos_weight': 2.9725684936769925, 'alpha': 7.106629238896712, 'lambda': 0.4693752084159468, 'eta': 0.8178509068830362, 'sampling_method': 'uniform', 'subsample': 0.6732594084071437, 'gamma': 7.85207187370375}. Best is trial 195 with value: 4.267796894268609.
[I 2023-12-18 23:01:44,532] Trial 230 finished with value: 4.282828415064044 and parameters: {'learning_rate': 0.8260968917164028, 'aft_loss_distribution': 'normal', 'aft_loss_distribution_scale': 1.2123793609469795, 'max_depth': 6, 'booster': 'dart', 'scale_pos_weight': 2.385834737120693, 'alpha': 6.713494057398671, 'lambda': 0.0006672349487770804, 'eta': 0.8341737926275855, 'sampling_method': 'uniform', 'subsample': 0.624889544210869, 'gamma': 7.412312734515319}. Best is trial 195 with value: 4.267796894268609.
[I 2023-12-18 23:01:45,972] Trial 231 finished with value: inf and parameters: {'learning_rate': 0.8087054761009109, 'aft_loss_distribution': 'normal', 'aft_loss_distribution_scale': 1.1716895372872087, 'max_depth': 6, 'booster': 'dart', 'scale_pos_weight': 2.0635344825197564, 'alpha': 6.6418476226606, 'lambda': 0.14561528616462052, 'eta': 0.8318230034547435, 'sampling_method': 'uniform', 'subsample': 0.6241477453009209, 'gamma': 7.375311105329969}. Best is trial 195 with value: 4.267796894268609.
[I 2023-12-18 23:01:47,880] Trial 232 finished with value: inf and parameters: {'learning_rate': 0.847650793648657, 'aft_loss_distribution': 'normal', 'aft_loss_distribution_scale': 1.2850600079684853, 'max_depth': 6, 'booster': 'dart', 'scale_pos_weight': 2.334183890009696, 'alpha': 6.341998285283041, 'lambda': 0.2910216500874157, 'eta': 0.7928943292543839, 'sampling_method': 'uniform', 'subsample': 0.6094947449787167, 'gamma': 7.579211978983697}. Best is trial 195 with value: 4.267796894268609.
[I 2023-12-18 23:01:49,314] Trial 233 finished with value: inf and parameters: {'learning_rate': 0.8212064004739252, 'aft_loss_distribution': 'normal', 'aft_loss_distribution_scale': 0.9048552613250737, 'max_depth': 6, 'booster': 'dart', 'scale_pos_weight': 2.7409710887858103, 'alpha': 6.766519908545232, 'lambda': 0.12309050985782315, 'eta': 0.7806477703420596, 'sampling_method': 'uniform', 'subsample': 0.6555619402572056, 'gamma': 7.00717203595736}. Best is trial 195 with value: 4.267796894268609.
[I 2023-12-18 23:01:55,489] Trial 234 pruned. Trial was pruned at iteration 118.
[I 2023-12-18 23:02:01,138] Trial 235 finished with value: 4.27182361148563 and parameters: {'learning_rate': 0.8752565431429336, 'aft_loss_distribution': 'normal', 'aft_loss_distribution_scale': 1.1414624153758746, 'max_depth': 6, 'booster': 'dart', 'scale_pos_weight': 2.8798086414527915, 'alpha': 6.9844982112454534, 'lambda': 0.6190259105913257, 'eta': 0.8552665985690704, 'sampling_method': 'uniform', 'subsample': 0.6321250090192174, 'gamma': 7.904336725400408}. Best is trial 195 with value: 4.267796894268609.
[I 2023-12-18 23:02:02,543] Trial 236 finished with value: inf and parameters: {'learning_rate': 0.948235308213419, 'aft_loss_distribution': 'normal', 'aft_loss_distribution_scale': 1.0497739215561208, 'max_depth': 6, 'booster': 'dart', 'scale_pos_weight': 2.8410665187219686, 'alpha': 7.138630575830839, 'lambda': 0.5810149550340566, 'eta': 0.8868206297542773, 'sampling_method': 'uniform', 'subsample': 0.6356354426195537, 'gamma': 7.694588769365506}. Best is trial 195 with value: 4.267796894268609.
[I 2023-12-18 23:02:02,624] Trial 237 pruned. Trial was pruned at iteration 1.
[I 2023-12-18 23:02:02,704] Trial 238 pruned. Trial was pruned at iteration 0.
[I 2023-12-18 23:02:02,770] Trial 239 pruned. Trial was pruned at iteration 0.
[I 2023-12-18 23:02:06,165] Trial 240 finished with value: 4.272611929568434 and parameters: {'learning_rate': 0.8563589985722564, 'aft_loss_distribution': 'normal', 'aft_loss_distribution_scale': 0.9730679469865033, 'max_depth': 6, 'booster': 'dart', 'scale_pos_weight': 3.215030878553186, 'alpha': 7.282217482271303, 'lambda': 0.7050951522107383, 'eta': 0.8014853104457914, 'sampling_method': 'uniform', 'subsample': 0.6274476862112818, 'gamma': 8.768741875057282}. Best is trial 195 with value: 4.267796894268609.
[I 2023-12-18 23:02:10,200] Trial 241 finished with value: 4.266747720783898 and parameters: {'learning_rate': 0.8567891679453669, 'aft_loss_distribution': 'normal', 'aft_loss_distribution_scale': 1.0673677668522656, 'max_depth': 6, 'booster': 'dart', 'scale_pos_weight': 3.1577811513609424, 'alpha': 7.258548139651879, 'lambda': 0.7475602932401344, 'eta': 0.8007347969599837, 'sampling_method': 'uniform', 'subsample': 0.6316955734294196, 'gamma': 8.483017766425009}. Best is trial 241 with value: 4.266747720783898.
[I 2023-12-18 23:02:12,837] Trial 242 finished with value: inf and parameters: {'learning_rate': 0.8981379801762068, 'aft_loss_distribution': 'normal', 'aft_loss_distribution_scale': 0.8983311569583592, 'max_depth': 6, 'booster': 'dart', 'scale_pos_weight': 3.075777083156769, 'alpha': 7.249665496094106, 'lambda': 0.748692335142956, 'eta': 0.8049456049629299, 'sampling_method': 'uniform', 'subsample': 0.6715959687299523, 'gamma': 9.088986691681058}. Best is trial 241 with value: 4.266747720783898.
[I 2023-12-18 23:02:12,914] Trial 243 pruned. Trial was pruned at iteration 0.
[I 2023-12-18 23:02:21,335] Trial 244 finished with value: 4.26714601010786 and parameters: {'learning_rate': 0.8327568881087433, 'aft_loss_distribution': 'normal', 'aft_loss_distribution_scale': 1.0702639816432866, 'max_depth': 6, 'booster': 'dart', 'scale_pos_weight': 2.8902305296637962, 'alpha': 7.010746039672953, 'lambda': 0.6049010130080901, 'eta': 0.835755741992552, 'sampling_method': 'uniform', 'subsample': 0.6321646140689057, 'gamma': 8.585259560148572}. Best is trial 241 with value: 4.266747720783898.
[I 2023-12-18 23:02:23,694] Trial 245 finished with value: inf and parameters: {'learning_rate': 0.8653195365164582, 'aft_loss_distribution': 'normal', 'aft_loss_distribution_scale': 1.064292201787601, 'max_depth': 6, 'booster': 'dart', 'scale_pos_weight': 2.2644328560061235, 'alpha': 7.127324060909279, 'lambda': 0.7457655352824402, 'eta': 0.83040915884819, 'sampling_method': 'uniform', 'subsample': 0.6387008401981378, 'gamma': 8.56741255700161}. Best is trial 241 with value: 4.266747720783898.
[I 2023-12-18 23:02:25,426] Trial 246 finished with value: inf and parameters: {'learning_rate': 0.8447528978285097, 'aft_loss_distribution': 'normal', 'aft_loss_distribution_scale': 1.172901597383655, 'max_depth': 6, 'booster': 'dart', 'scale_pos_weight': 2.884300553386872, 'alpha': 6.827597996148737, 'lambda': 0.5460440901634814, 'eta': 0.8083997096994863, 'sampling_method': 'uniform', 'subsample': 0.600933680926019, 'gamma': 8.832686830283698}. Best is trial 241 with value: 4.266747720783898.
[I 2023-12-18 23:02:30,325] Trial 247 finished with value: 4.287587260495236 and parameters: {'learning_rate': 0.8256383519407339, 'aft_loss_distribution': 'normal', 'aft_loss_distribution_scale': 0.913367025832622, 'max_depth': 6, 'booster': 'dart', 'scale_pos_weight': 2.6587172778657746, 'alpha': 7.38073722548288, 'lambda': 1.0104455117370676, 'eta': 0.8465069727872921, 'sampling_method': 'uniform', 'subsample': 0.6899836488995665, 'gamma': 8.570211406549458}. Best is trial 241 with value: 4.266747720783898.
[I 2023-12-18 23:02:30,400] Trial 248 pruned. Trial was pruned at iteration 0.
[I 2023-12-18 23:02:30,472] Trial 249 pruned. Trial was pruned at iteration 0.
[I 2023-12-18 23:02:31,937] Trial 250 finished with value: inf and parameters: {'learning_rate': 0.8746569990778129, 'aft_loss_distribution': 'normal', 'aft_loss_distribution_scale': 0.9552828777839777, 'max_depth': 6, 'booster': 'dart', 'scale_pos_weight': 2.4042133483253263, 'alpha': 7.047261467896826, 'lambda': 0.44131781266030495, 'eta': 0.8399569363434628, 'sampling_method': 'uniform', 'subsample': 0.6227875787837583, 'gamma': 8.091258656371547}. Best is trial 241 with value: 4.266747720783898.
[I 2023-12-18 23:02:32,013] Trial 251 pruned. Trial was pruned at iteration 0.
[I 2023-12-18 23:02:33,851] Trial 252 finished with value: inf and parameters: {'learning_rate': 0.8319789548487542, 'aft_loss_distribution': 'normal', 'aft_loss_distribution_scale': 1.1975951386298032, 'max_depth': 6, 'booster': 'dart', 'scale_pos_weight': 3.0622826328054273, 'alpha': 7.527429028601113, 'lambda': 0.7217619985496837, 'eta': 0.7857670696709596, 'sampling_method': 'uniform', 'subsample': 0.5765727467584146, 'gamma': 9.430811598789795}. Best is trial 241 with value: 4.266747720783898.
[I 2023-12-18 23:02:36,384] Trial 253 finished with value: 4.268556972091108 and parameters: {'learning_rate': 0.8030160353002493, 'aft_loss_distribution': 'normal', 'aft_loss_distribution_scale': 1.0005166952553086, 'max_depth': 6, 'booster': 'dart', 'scale_pos_weight': 2.5543623776990128, 'alpha': 6.896730099976806, 'lambda': 0.34090188334187005, 'eta': 0.9146446044907943, 'sampling_method': 'uniform', 'subsample': 0.6916801585200684, 'gamma': 7.852968138204436}. Best is trial 241 with value: 4.266747720783898.
[I 2023-12-18 23:02:36,463] Trial 254 pruned. Trial was pruned at iteration 0.
[I 2023-12-18 23:02:36,531] Trial 255 pruned. Trial was pruned at iteration 0.
[I 2023-12-18 23:02:36,600] Trial 256 pruned. Trial was pruned at iteration 0.
[I 2023-12-18 23:02:40,249] Trial 257 finished with value: 4.267006089324619 and parameters: {'learning_rate': 0.9032050228819964, 'aft_loss_distribution': 'normal', 'aft_loss_distribution_scale': 1.0446740899318827, 'max_depth': 6, 'booster': 'dart', 'scale_pos_weight': 2.9402507623908574, 'alpha': 7.167024852677248, 'lambda': 2.897606906626097, 'eta': 0.9575523201216046, 'sampling_method': 'uniform', 'subsample': 0.7501387759990606, 'gamma': 6.716909434695441}. Best is trial 241 with value: 4.266747720783898.
[I 2023-12-18 23:02:44,667] Trial 258 finished with value: 4.268917745468856 and parameters: {'learning_rate': 0.879538738673236, 'aft_loss_distribution': 'normal', 'aft_loss_distribution_scale': 1.015896680572307, 'max_depth': 6, 'booster': 'dart', 'scale_pos_weight': 2.6809199723610506, 'alpha': 7.178905841502889, 'lambda': 0.2880768596964346, 'eta': 0.9825397286875494, 'sampling_method': 'uniform', 'subsample': 0.7310153431828686, 'gamma': 8.413139642652055}. Best is trial 241 with value: 4.266747720783898.
[I 2023-12-18 23:02:44,738] Trial 259 pruned. Trial was pruned at iteration 0.
[I 2023-12-18 23:02:44,805] Trial 260 pruned. Trial was pruned at iteration 0.
[I 2023-12-18 23:02:44,885] Trial 261 pruned. Trial was pruned at iteration 1.
[I 2023-12-18 23:02:46,163] Trial 262 finished with value: inf and parameters: {'learning_rate': 0.8669603283603984, 'aft_loss_distribution': 'normal', 'aft_loss_distribution_scale': 1.0516276604754808, 'max_depth': 6, 'booster': 'dart', 'scale_pos_weight': 2.7069149656738727, 'alpha': 6.910543837660749, 'lambda': 0.2568898318946562, 'eta': 0.9563506878947667, 'sampling_method': 'uniform', 'subsample': 0.6813253360837856, 'gamma': 8.694738819307592}. Best is trial 241 with value: 4.266747720783898.
[I 2023-12-18 23:02:46,235] Trial 263 pruned. Trial was pruned at iteration 0.
[I 2023-12-18 23:02:49,439] Trial 264 finished with value: 4.273097478403042 and parameters: {'learning_rate': 0.9021029401655312, 'aft_loss_distribution': 'normal', 'aft_loss_distribution_scale': 1.1529124539940916, 'max_depth': 6, 'booster': 'dart', 'scale_pos_weight': 2.937365021457564, 'alpha': 7.059393856394598, 'lambda': 0.4950398090979117, 'eta': 0.9171317348555178, 'sampling_method': 'uniform', 'subsample': 0.7157943207153297, 'gamma': 7.958312005099872}. Best is trial 241 with value: 4.266747720783898.
[I 2023-12-18 23:02:50,760] Trial 265 finished with value: inf and parameters: {'learning_rate': 0.8934011454931458, 'aft_loss_distribution': 'normal', 'aft_loss_distribution_scale': 0.8842943577424529, 'max_depth': 6, 'booster': 'dart', 'scale_pos_weight': 2.953596559249992, 'alpha': 6.803658251051991, 'lambda': 7.581465080008131, 'eta': 0.9147306224411439, 'sampling_method': 'uniform', 'subsample': 0.7495542983205605, 'gamma': 7.891829626562591}. Best is trial 241 with value: 4.266747720783898.
[I 2023-12-18 23:02:53,033] Trial 266 finished with value: inf and parameters: {'learning_rate': 0.9248272374822935, 'aft_loss_distribution': 'normal', 'aft_loss_distribution_scale': 1.098467084484097, 'max_depth': 6, 'booster': 'dart', 'scale_pos_weight': 2.5122243566936757, 'alpha': 6.5017022173431025, 'lambda': 0.46493133044512824, 'eta': 0.9525120904476898, 'sampling_method': 'uniform', 'subsample': 0.8059137946548625, 'gamma': 8.087593135345335}. Best is trial 241 with value: 4.266747720783898.
[I 2023-12-18 23:02:53,164] Trial 267 pruned. Trial was pruned at iteration 0.
[I 2023-12-18 23:02:53,277] Trial 268 pruned. Trial was pruned at iteration 0.
[I 2023-12-18 23:02:55,134] Trial 269 finished with value: inf and parameters: {'learning_rate': 0.8567261850455724, 'aft_loss_distribution': 'normal', 'aft_loss_distribution_scale': 0.953197228796283, 'max_depth': 6, 'booster': 'dart', 'scale_pos_weight': 2.7456122821972087, 'alpha': 7.111751228627197, 'lambda': 2.177175168915915, 'eta': 0.8113770645384382, 'sampling_method': 'uniform', 'subsample': 0.7168055407819856, 'gamma': 6.610906297241316}. Best is trial 241 with value: 4.266747720783898.
[I 2023-12-18 23:02:56,678] Trial 270 finished with value: inf and parameters: {'learning_rate': 0.9001465333347628, 'aft_loss_distribution': 'normal', 'aft_loss_distribution_scale': 1.2012101525930423, 'max_depth': 6, 'booster': 'dart', 'scale_pos_weight': 3.2207578297669985, 'alpha': 6.762487606868889, 'lambda': 0.000836785181872135, 'eta': 0.9829310069825619, 'sampling_method': 'uniform', 'subsample': 0.6720644817437562, 'gamma': 7.099710493834632}. Best is trial 241 with value: 4.266747720783898.
[I 2023-12-18 23:02:56,759] Trial 271 pruned. Trial was pruned at iteration 0.
[I 2023-12-18 23:02:56,836] Trial 272 pruned. Trial was pruned at iteration 0.
[I 2023-12-18 23:02:56,916] Trial 273 pruned. Trial was pruned at iteration 1.
[I 2023-12-18 23:02:58,931] Trial 274 finished with value: inf and parameters: {'learning_rate': 0.9100233154675794, 'aft_loss_distribution': 'normal', 'aft_loss_distribution_scale': 1.195695687051457, 'max_depth': 6, 'booster': 'dart', 'scale_pos_weight': 2.4240135325417675, 'alpha': 4.732503893173909, 'lambda': 0.6401547716745826, 'eta': 0.7373435394398016, 'sampling_method': 'uniform', 'subsample': 0.722154706851876, 'gamma': 7.508059112560142}. Best is trial 241 with value: 4.266747720783898.
[I 2023-12-18 23:03:00,365] Trial 275 finished with value: inf and parameters: {'learning_rate': 0.8279843492333318, 'aft_loss_distribution': 'normal', 'aft_loss_distribution_scale': 1.0534474158357587, 'max_depth': 6, 'booster': 'dart', 'scale_pos_weight': 3.355727794362484, 'alpha': 6.357391477843313, 'lambda': 4.539265743798465, 'eta': 0.8511930060457055, 'sampling_method': 'uniform', 'subsample': 0.6216272899437848, 'gamma': 8.348773129598182}. Best is trial 241 with value: 4.266747720783898.
[I 2023-12-18 23:03:00,439] Trial 276 pruned. Trial was pruned at iteration 0.
[I 2023-12-18 23:03:03,036] Trial 277 finished with value: 4.295637326692203 and parameters: {'learning_rate': 0.8058647583166916, 'aft_loss_distribution': 'normal', 'aft_loss_distribution_scale': 1.2720744635277454, 'max_depth': 6, 'booster': 'dart', 'scale_pos_weight': 2.2384170054903154, 'alpha': 6.7047593217617445, 'lambda': 2.8867496861406994, 'eta': 0.8007408929168779, 'sampling_method': 'uniform', 'subsample': 0.7430737790539672, 'gamma': 8.797977687745306}. Best is trial 241 with value: 4.266747720783898.
[I 2023-12-18 23:03:03,116] Trial 278 pruned. Trial was pruned at iteration 0.
[I 2023-12-18 23:03:05,068] Trial 279 finished with value: inf and parameters: {'learning_rate': 0.8312673080748958, 'aft_loss_distribution': 'normal', 'aft_loss_distribution_scale': 1.2227338176592037, 'max_depth': 6, 'booster': 'dart', 'scale_pos_weight': 2.2177707973860814, 'alpha': 6.841079040923544, 'lambda': 2.8196733042074023, 'eta': 0.8348959038468711, 'sampling_method': 'uniform', 'subsample': 0.7457470231285555, 'gamma': 8.835771450204211}. Best is trial 241 with value: 4.266747720783898.
