[I 2023-12-21 04:13:59,824] Trial 223 pruned. Trial was pruned at iteration 0.
[I 2023-12-21 04:14:00,066] Trial 224 finished with value: 2.0647466716688454 and parameters: {'learning_rate': 0.9565669665445635, 'aft_                                                                     loss_distribution': 'normal', 'aft_loss_distribution_scale': 2.1473352654667504, 'max_depth': 7, 'booster': 'gbtree', 'scale_pos_weight':                                                                      1.4687432033347463, 'alpha': 9.595539111069103, 'lambda': 4.180824608372051, 'eta': 0.868850419571604, 'sampling_method': 'uniform', 'su                                                                     bsample': 0.11360810487488057, 'gamma': 7.502679073748235}. Best is trial 218 with value: 2.0413137946315465.
[I 2023-12-21 04:14:00,179] Trial 225 finished with value: inf and parameters: {'learning_rate': 0.9515214367315713, 'aft_loss_distributi                                                                     on': 'normal', 'aft_loss_distribution_scale': 2.078565738680811, 'max_depth': 7, 'booster': 'gbtree', 'scale_pos_weight': 1.3723876512516                                                                     415, 'alpha': 9.998083655616279, 'lambda': 4.202077767865388, 'eta': 0.8595144422238532, 'sampling_method': 'uniform', 'subsample': 0.136                                                                     5610569103181, 'gamma': 7.545515452795994}. Best is trial 218 with value: 2.0413137946315465.
[I 2023-12-21 04:14:00,291] Trial 226 finished with value: inf and parameters: {'learning_rate': 0.9290220237493532, 'aft_loss_distributi                                                                     on': 'normal', 'aft_loss_distribution_scale': 1.8853068066032717, 'max_depth': 7, 'booster': 'gbtree', 'scale_pos_weight': 1.455348603044                                                                     7533, 'alpha': 9.700237472834324, 'lambda': 3.820172878459279, 'eta': 0.8208475086854022, 'sampling_method': 'uniform', 'subsample': 0.11                                                                     224493159559526, 'gamma': 7.661354862453417}. Best is trial 218 with value: 2.0413137946315465.
[I 2023-12-21 04:14:00,333] Trial 227 pruned. Trial was pruned at iteration 0.
[I 2023-12-21 04:14:00,480] Trial 228 finished with value: inf and parameters: {'learning_rate': 0.9806174015289847, 'aft_loss_distributi                                                                     on': 'normal', 'aft_loss_distribution_scale': 1.6037115088412675, 'max_depth': 6, 'booster': 'gbtree', 'scale_pos_weight': 1.189702127587                                                                     9354, 'alpha': 9.817660395130318, 'lambda': 4.765843465741476, 'eta': 0.8475470345768243, 'sampling_method': 'uniform', 'subsample': 0.14                                                                     34143461599767, 'gamma': 6.964299961948732}. Best is trial 218 with value: 2.0413137946315465.
[I 2023-12-21 04:14:00,591] Trial 229 finished with value: inf and parameters: {'learning_rate': 0.9366150751673926, 'aft_loss_distributi                                                                     on': 'normal', 'aft_loss_distribution_scale': 1.9781213407896898, 'max_depth': 6, 'booster': 'gbtree', 'scale_pos_weight': 1.638124270193                                                                     3922, 'alpha': 9.605548437251638, 'lambda': 4.298918170529865, 'eta': 0.8024742526569206, 'sampling_method': 'uniform', 'subsample': 0.10                                                                     466973526422803, 'gamma': 7.205193957478837}. Best is trial 218 with value: 2.0413137946315465.
[I 2023-12-21 04:14:00,631] Trial 230 pruned. Trial was pruned at iteration 0.
[I 2023-12-21 04:14:00,671] Trial 231 pruned. Trial was pruned at iteration 1.
[I 2023-12-21 04:14:00,712] Trial 232 pruned. Trial was pruned at iteration 0.
[I 2023-12-21 04:14:00,997] Trial 233 finished with value: 2.066501733539457 and parameters: {'learning_rate': 0.9838723497289538, 'aft_l                                                                     oss_distribution': 'normal', 'aft_loss_distribution_scale': 2.1517790044193434, 'max_depth': 6, 'booster': 'gbtree', 'scale_pos_weight':                                                                      1.4922416189772962, 'alpha': 9.67954234326391, 'lambda': 4.248403769988408, 'eta': 0.8898664148472253, 'sampling_method': 'uniform', 'sub                                                                     sample': 0.10253676151496642, 'gamma': 6.680979042947706}. Best is trial 218 with value: 2.0413137946315465.
[I 2023-12-21 04:14:01,109] Trial 234 finished with value: inf and parameters: {'learning_rate': 0.9768953284900236, 'aft_loss_distributi                                                                     on': 'normal', 'aft_loss_distribution_scale': 1.7489516434426617, 'max_depth': 5, 'booster': 'gbtree', 'scale_pos_weight': 1.436684839094                                                                     3787, 'alpha': 9.730446670860383, 'lambda': 4.189172450171576, 'eta': 0.8824153205064745, 'sampling_method': 'uniform', 'subsample': 0.12                                                                     152436185237195, 'gamma': 7.0161763037579625}. Best is trial 218 with value: 2.0413137946315465.
[I 2023-12-21 04:14:01,394] Trial 235 finished with value: 2.0624994307173523 and parameters: {'learning_rate': 0.9528171320128367, 'aft_                                                                     loss_distribution': 'normal', 'aft_loss_distribution_scale': 2.1066206220155363, 'max_depth': 6, 'booster': 'gbtree', 'scale_pos_weight':                                                                      1.5777425431337153, 'alpha': 9.466484936079155, 'lambda': 3.8916967864165755, 'eta': 0.8441912292609364, 'sampling_method': 'uniform', '                                                                     subsample': 0.102611622545485, 'gamma': 7.451401371800766}. Best is trial 218 with value: 2.0413137946315465.
[I 2023-12-21 04:14:01,436] Trial 236 pruned. Trial was pruned at iteration 0.
[I 2023-12-21 04:14:01,476] Trial 237 pruned. Trial was pruned at iteration 0.
[I 2023-12-21 04:14:01,518] Trial 238 pruned. Trial was pruned at iteration 0.
[I 2023-12-21 04:14:01,624] Trial 239 finished with value: inf and parameters: {'learning_rate': 0.9997822877392888, 'aft_loss_distributi                                                                     on': 'normal', 'aft_loss_distribution_scale': 2.1437696109453785, 'max_depth': 6, 'booster': 'gbtree', 'scale_pos_weight': 1.581728322123                                                                     3103, 'alpha': 9.425812261772716, 'lambda': 4.759241167119199, 'eta': 0.7933129705696175, 'sampling_method': 'uniform', 'subsample': 0.06                                                                     2454800723821216, 'gamma': 6.711617026204872}. Best is trial 218 with value: 2.0413137946315465.
[I 2023-12-21 04:14:01,670] Trial 240 pruned. Trial was pruned at iteration 1.
[I 2023-12-21 04:14:01,770] Trial 241 finished with value: inf and parameters: {'learning_rate': 0.9672341374911847, 'aft_loss_distributi                                                                     on': 'normal', 'aft_loss_distribution_scale': 2.188800070447275, 'max_depth': 6, 'booster': 'gbtree', 'scale_pos_weight': 1.4546318102474                                                                     17, 'alpha': 9.658558370792587, 'lambda': 4.0620978435872095, 'eta': 0.8470198293499789, 'sampling_method': 'uniform', 'subsample': 0.127                                                                     3945797026812, 'gamma': 6.886616451531622}. Best is trial 218 with value: 2.0413137946315465.
[I 2023-12-21 04:14:01,810] Trial 242 pruned. Trial was pruned at iteration 0.
[I 2023-12-21 04:14:01,983] Trial 243 finished with value: 2.0515105986394873 and parameters: {'learning_rate': 0.9811019000898883, 'aft_                                                                     loss_distribution': 'normal', 'aft_loss_distribution_scale': 2.0124944584642463, 'max_depth': 6, 'booster': 'gbtree', 'scale_pos_weight':                                                                      1.725238196934446, 'alpha': 9.41864082222615, 'lambda': 4.299284687231911, 'eta': 0.8931281841454551, 'sampling_method': 'uniform', 'sub                                                                     sample': 0.140097650144319, 'gamma': 7.278590504146003}. Best is trial 218 with value: 2.0413137946315465.
[I 2023-12-21 04:14:02,098] Trial 244 finished with value: inf and parameters: {'learning_rate': 0.9821089944156098, 'aft_loss_distributi                                                                     on': 'normal', 'aft_loss_distribution_scale': 1.8891809793573515, 'max_depth': 6, 'booster': 'gbtree', 'scale_pos_weight': 1.660429811862                                                                     1532, 'alpha': 9.334619034012407, 'lambda': 4.57609080703069, 'eta': 0.911689869850891, 'sampling_method': 'uniform', 'subsample': 0.1497                                                                     2954245524475, 'gamma': 7.545821636771691}. Best is trial 218 with value: 2.0413137946315465.
[I 2023-12-21 04:14:02,266] Trial 245 finished with value: 2.0604456513720293 and parameters: {'learning_rate': 0.9800552658649765, 'aft_                                                                     loss_distribution': 'normal', 'aft_loss_distribution_scale': 2.0421378059510986, 'max_depth': 6, 'booster': 'gbtree', 'scale_pos_weight':                                                                      1.7405747952475095, 'alpha': 9.530549721398202, 'lambda': 4.259835831204087, 'eta': 0.8987423832598109, 'sampling_method': 'uniform', 's                                                                     ubsample': 0.08444293077593285, 'gamma': 7.817887243690328}. Best is trial 218 with value: 2.0413137946315465.
[I 2023-12-21 04:14:02,449] Trial 246 finished with value: inf and parameters: {'learning_rate': 0.9981471198449643, 'aft_loss_distributi                                                                     on': 'normal', 'aft_loss_distribution_scale': 1.3653599360863784, 'max_depth': 6, 'booster': 'gbtree', 'scale_pos_weight': 1.737577572395                                                                     6004, 'alpha': 9.480443740918352, 'lambda': 4.239890994247796, 'eta': 0.8935858997563865, 'sampling_method': 'uniform', 'subsample': 0.07                                                                     187831132810792, 'gamma': 7.82793493358158}. Best is trial 218 with value: 2.0413137946315465.
[I 2023-12-21 04:14:02,549] Trial 247 finished with value: inf and parameters: {'learning_rate': 0.9799514653197327, 'aft_loss_distributi                                                                     on': 'normal', 'aft_loss_distribution_scale': 2.0645190317882958, 'max_depth': 6, 'booster': 'gbtree', 'scale_pos_weight': 1.846737760841                                                                     9298, 'alpha': 9.589965184938183, 'lambda': 4.1682069359303, 'eta': 0.9291936840560764, 'sampling_method': 'uniform', 'subsample': 0.0936                                                                     585725722732, 'gamma': 8.034739840117176}. Best is trial 218 with value: 2.0413137946315465.
[I 2023-12-21 04:14:02,662] Trial 248 finished with value: inf and parameters: {'learning_rate': 0.9312610607748528, 'aft_loss_distributi                                                                     on': 'normal', 'aft_loss_distribution_scale': 1.9123565308381367, 'max_depth': 5, 'booster': 'gbtree', 'scale_pos_weight': 1.524700109564                                                                     4017, 'alpha': 9.305073051950037, 'lambda': 4.6311990467115525, 'eta': 0.8957643907947469, 'sampling_method': 'uniform', 'subsample': 0.5                                                                     130684798940564, 'gamma': 7.332411823586664}. Best is trial 218 with value: 2.0413137946315465.
[I 2023-12-21 04:14:02,763] Trial 249 finished with value: inf and parameters: {'learning_rate': 0.9795969285278098, 'aft_loss_distributi                                                                     on': 'normal', 'aft_loss_distribution_scale': 1.6811310899778624, 'max_depth': 6, 'booster': 'gbtree', 'scale_pos_weight': 1.693952439873                                                                     9363, 'alpha': 9.081645247098935, 'lambda': 4.90901045785931, 'eta': 0.9174704136144112, 'sampling_method': 'uniform', 'subsample': 0.055                                                                     372768784389986, 'gamma': 7.5994068249287}. Best is trial 218 with value: 2.0413137946315465.
[I 2023-12-21 04:14:02,803] Trial 250 pruned. Trial was pruned at iteration 0.
[I 2023-12-21 04:14:02,942] Trial 251 finished with value: 2.0574781895400123 and parameters: {'learning_rate': 0.9828763334994073, 'aft_                                                                     loss_distribution': 'normal', 'aft_loss_distribution_scale': 2.0570037587073844, 'max_depth': 7, 'booster': 'gbtree', 'scale_pos_weight':                                                                      1.9563708249793283, 'alpha': 9.472727284881444, 'lambda': 4.450668308234356, 'eta': 0.8478641974515737, 'sampling_method': 'uniform', 's                                                                     ubsample': 0.11002040485395106, 'gamma': 7.283545665541918}. Best is trial 218 with value: 2.0413137946315465.
[I 2023-12-21 04:14:03,066] Trial 252 finished with value: 2.060032033126456 and parameters: {'learning_rate': 0.9983558233795279, 'aft_l                                                                     oss_distribution': 'normal', 'aft_loss_distribution_scale': 2.0751663865364263, 'max_depth': 7, 'booster': 'gbtree', 'scale_pos_weight':                                                                      1.3238941831714737, 'alpha': 9.29234028590644, 'lambda': 4.30599896577628, 'eta': 0.8166665343168227, 'sampling_method': 'uniform', 'subs                                                                     ample': 0.11471834023966428, 'gamma': 7.349286809993957}. Best is trial 218 with value: 2.0413137946315465.
[I 2023-12-21 04:14:03,106] Trial 253 pruned. Trial was pruned at iteration 0.
[I 2023-12-21 04:14:03,146] Trial 254 pruned. Trial was pruned at iteration 0.
[I 2023-12-21 04:14:03,311] Trial 255 finished with value: 2.0370667337922805 and parameters: {'learning_rate': 0.9449789545687032, 'aft_                                                                     loss_distribution': 'normal', 'aft_loss_distribution_scale': 1.7762673319050406, 'max_depth': 7, 'booster': 'gbtree', 'scale_pos_weight':                                                                      1.8977900752049948, 'alpha': 9.410189150011849, 'lambda': 4.783482615727456, 'eta': 0.8116231797259267, 'sampling_method': 'uniform', 's                                                                     ubsample': 0.11351679887404417, 'gamma': 7.71716954398771}. Best is trial 255 with value: 2.0370667337922805.
[I 2023-12-21 04:14:03,419] Trial 256 finished with value: inf and parameters: {'learning_rate': 0.9366674265762867, 'aft_loss_distributi                                                                     on': 'normal', 'aft_loss_distribution_scale': 1.7964316556994677, 'max_depth': 7, 'booster': 'gbtree', 'scale_pos_weight': 2.195269327160                                                                     451, 'alpha': 9.388536835792584, 'lambda': 5.029043835591833, 'eta': 0.8011847436503202, 'sampling_method': 'uniform', 'subsample': 0.122                                                                     43364579428018, 'gamma': 7.937362410334762}. Best is trial 255 with value: 2.0370667337922805.
[I 2023-12-21 04:14:03,556] Trial 257 finished with value: inf and parameters: {'learning_rate': 0.9983557836420266, 'aft_loss_distributi                                                                     on': 'normal', 'aft_loss_distribution_scale': 1.5726372752713798, 'max_depth': 7, 'booster': 'gbtree', 'scale_pos_weight': 1.988790990176                                                                     1078, 'alpha': 9.41703780434918, 'lambda': 4.825241632892113, 'eta': 0.830391114941381, 'sampling_method': 'uniform', 'subsample': 0.1547                                                                     37488088243, 'gamma': 7.625801972984468}. Best is trial 255 with value: 2.0370667337922805.
[I 2023-12-21 04:14:03,682] Trial 258 finished with value: inf and parameters: {'learning_rate': 0.9825979742473133, 'aft_loss_distributi                                                                     on': 'normal', 'aft_loss_distribution_scale': 1.8759316096236764, 'max_depth': 7, 'booster': 'gbtree', 'scale_pos_weight': 1.908241262052                                                                     5753, 'alpha': 9.545317064599, 'lambda': 3.702879291381693, 'eta': 0.8095647648299272, 'sampling_method': 'uniform', 'subsample': 0.10652                                                                     562460260989, 'gamma': 8.105082485356158}. Best is trial 255 with value: 2.0370667337922805.
[I 2023-12-21 04:14:03,725] Trial 259 pruned. Trial was pruned at iteration 0.
[I 2023-12-21 04:14:03,766] Trial 260 pruned. Trial was pruned at iteration 0.
[I 2023-12-21 04:14:03,808] Trial 261 pruned. Trial was pruned at iteration 0.
[I 2023-12-21 04:14:04,801] Trial 262 finished with value: inf and parameters: {'learning_rate': 0.9825395088740476, 'aft_loss_distributi                                                                     on': 'normal', 'aft_loss_distribution_scale': 1.6723804318499471, 'max_depth': 7, 'booster': 'dart', 'scale_pos_weight': 2.10115889628752                                                                     76, 'alpha': 9.970927883173385, 'lambda': 3.962948664533175, 'eta': 0.8478714983539888, 'sampling_method': 'uniform', 'subsample': 0.0925                                                                     1863088141356, 'gamma': 7.705777194001776}. Best is trial 255 with value: 2.0370667337922805.
[I 2023-12-21 04:14:04,842] Trial 263 pruned. Trial was pruned at iteration 0.
[I 2023-12-21 04:14:04,885] Trial 264 pruned. Trial was pruned at iteration 0.
[I 2023-12-21 04:14:04,927] Trial 265 pruned. Trial was pruned at iteration 0.
[I 2023-12-21 04:14:04,969] Trial 266 pruned. Trial was pruned at iteration 0.
[I 2023-12-21 04:14:05,011] Trial 267 pruned. Trial was pruned at iteration 0.
[I 2023-12-21 04:14:05,121] Trial 268 finished with value: inf and parameters: {'learning_rate': 0.9800210292674821, 'aft_loss_distributi                                                                     on': 'normal', 'aft_loss_distribution_scale': 1.7641332944297083, 'max_depth': 6, 'booster': 'gbtree', 'scale_pos_weight': 1.706458995539                                                                     7325, 'alpha': 9.780364990448698, 'lambda': 4.033817143145451, 'eta': 0.8480550901764075, 'sampling_method': 'uniform', 'subsample': 0.13                                                                     536469812933236, 'gamma': 7.4430992553272315}. Best is trial 255 with value: 2.0370667337922805.
[I 2023-12-21 04:14:05,162] Trial 269 pruned. Trial was pruned at iteration 0.
[I 2023-12-21 04:14:05,264] Trial 270 finished with value: inf and parameters: {'learning_rate': 0.9671250870729113, 'aft_loss_distributi                                                                     on': 'normal', 'aft_loss_distribution_scale': 1.9180216524432956, 'max_depth': 6, 'booster': 'gbtree', 'scale_pos_weight': 1.629072252693                                                                     7549, 'alpha': 9.748384923542277, 'lambda': 4.293835966414271, 'eta': 0.8129143274602653, 'sampling_method': 'uniform', 'subsample': 0.07                                                                     458118419138099, 'gamma': 7.2512232200658575}. Best is trial 255 with value: 2.0370667337922805.
[I 2023-12-21 04:14:05,305] Trial 271 pruned. Trial was pruned at iteration 0.
[I 2023-12-21 04:14:05,348] Trial 272 pruned. Trial was pruned at iteration 0.
[I 2023-12-21 04:14:05,523] Trial 273 finished with value: inf and parameters: {'learning_rate': 0.9508552472546979, 'aft_loss_distributi                                                                     on': 'normal', 'aft_loss_distribution_scale': 1.5032854191402123, 'max_depth': 6, 'booster': 'gbtree', 'scale_pos_weight': 1.326068508639                                                                     7719, 'alpha': 9.809252737805014, 'lambda': 5.105174747115379, 'eta': 0.8534157610243512, 'sampling_method': 'uniform', 'subsample': 0.10                                                                     253744147751115, 'gamma': 6.562303881824399}. Best is trial 255 with value: 2.0370667337922805.
[I 2023-12-21 04:14:05,565] Trial 274 pruned. Trial was pruned at iteration 0.
[I 2023-12-21 04:14:05,607] Trial 275 pruned. Trial was pruned at iteration 0.
