[I 2023-12-21 04:04:30,138] Trial 141 finished with value: inf and parameters: {'learning_rate': 0.918662280124631, 'aft_loss_distributio                                                                     n': 'normal', 'aft_loss_distribution_scale': 1.154871039857731, 'max_depth': 9, 'booster': 'gbtree', 'scale_pos_weight': 3.16497143606644                                                                     1, 'alpha': 9.276701755276756, 'lambda': 4.987888963959643, 'eta': 0.4078980301854217, 'sampling_method': 'gradient_based', 'subsample':                                                                      0.8253940547116273, 'gamma': 9.115154421017992}. Best is trial 61 with value: 4.247532035211623.
[I 2023-12-21 04:04:30,183] Trial 142 pruned. Trial was pruned at iteration 2.
[I 2023-12-21 04:04:30,226] Trial 143 pruned. Trial was pruned at iteration 2.
[I 2023-12-21 04:04:30,264] Trial 144 pruned. Trial was pruned at iteration 0.
[I 2023-12-21 04:04:30,303] Trial 145 pruned. Trial was pruned at iteration 0.
[I 2023-12-21 04:04:30,340] Trial 146 pruned. Trial was pruned at iteration 0.
[I 2023-12-21 04:04:30,377] Trial 147 pruned. Trial was pruned at iteration 0.
[I 2023-12-21 04:04:30,416] Trial 148 pruned. Trial was pruned at iteration 0.
[I 2023-12-21 04:04:30,454] Trial 149 pruned. Trial was pruned at iteration 0.
[I 2023-12-21 04:04:30,494] Trial 150 pruned. Trial was pruned at iteration 0.
[I 2023-12-21 04:04:30,532] Trial 151 pruned. Trial was pruned at iteration 0.
[I 2023-12-21 04:04:30,570] Trial 152 pruned. Trial was pruned at iteration 0.
[I 2023-12-21 04:04:30,608] Trial 153 pruned. Trial was pruned at iteration 0.
[I 2023-12-21 04:04:30,651] Trial 154 pruned. Trial was pruned at iteration 1.
[I 2023-12-21 04:04:30,690] Trial 155 pruned. Trial was pruned at iteration 0.
[I 2023-12-21 04:04:30,727] Trial 156 pruned. Trial was pruned at iteration 0.
[I 2023-12-21 04:04:30,765] Trial 157 pruned. Trial was pruned at iteration 0.
[I 2023-12-21 04:04:30,803] Trial 158 pruned. Trial was pruned at iteration 0.
[I 2023-12-21 04:04:30,843] Trial 159 pruned. Trial was pruned at iteration 0.
[I 2023-12-21 04:04:30,887] Trial 160 pruned. Trial was pruned at iteration 0.
[I 2023-12-21 04:04:31,001] Trial 161 finished with value: inf and parameters: {'learning_rate': 0.9830577563846825, 'aft_loss_distributi                                                                     on': 'normal', 'aft_loss_distribution_scale': 1.1322665016518403, 'max_depth': 3, 'booster': 'gbtree', 'scale_pos_weight': 3.100430707494                                                                     3704, 'alpha': 9.729475266519685, 'lambda': 0.3372104224072875, 'eta': 0.32021608576256577, 'sampling_method': 'gradient_based', 'subsamp                                                                     le': 0.6403764402661105, 'gamma': 8.196188404102807}. Best is trial 61 with value: 4.247532035211623.
[I 2023-12-21 04:04:31,040] Trial 162 pruned. Trial was pruned at iteration 0.
[I 2023-12-21 04:04:31,081] Trial 163 pruned. Trial was pruned at iteration 2.
[I 2023-12-21 04:04:31,125] Trial 164 pruned. Trial was pruned at iteration 3.
[I 2023-12-21 04:04:31,163] Trial 165 pruned. Trial was pruned at iteration 0.
[I 2023-12-21 04:04:31,202] Trial 166 pruned. Trial was pruned at iteration 0.
[I 2023-12-21 04:04:31,248] Trial 167 pruned. Trial was pruned at iteration 0.
[I 2023-12-21 04:04:31,287] Trial 168 pruned. Trial was pruned at iteration 0.
[I 2023-12-21 04:04:31,327] Trial 169 pruned. Trial was pruned at iteration 0.
[I 2023-12-21 04:04:31,366] Trial 170 pruned. Trial was pruned at iteration 0.
[I 2023-12-21 04:04:31,472] Trial 171 finished with value: inf and parameters: {'learning_rate': 0.86986917011878, 'aft_loss_distribution                                                                     ': 'normal', 'aft_loss_distribution_scale': 1.0138363333340852, 'max_depth': 4, 'booster': 'gbtree', 'scale_pos_weight': 2.35879167034467                                                                     6, 'alpha': 0.1492934948258356, 'lambda': 4.761918340372797, 'eta': 0.5210492936310815, 'sampling_method': 'gradient_based', 'subsample':                                                                      0.9838084444400187, 'gamma': 9.302173345318225}. Best is trial 61 with value: 4.247532035211623.
[I 2023-12-21 04:04:31,513] Trial 172 pruned. Trial was pruned at iteration 1.
[I 2023-12-21 04:04:31,555] Trial 173 pruned. Trial was pruned at iteration 2.
[I 2023-12-21 04:04:31,601] Trial 174 pruned. Trial was pruned at iteration 0.
[I 2023-12-21 04:04:31,640] Trial 175 pruned. Trial was pruned at iteration 0.
[I 2023-12-21 04:04:32,695] Trial 176 finished with value: inf and parameters: {'learning_rate': 0.8133324630801386, 'aft_loss_distributi                                                                     on': 'normal', 'aft_loss_distribution_scale': 0.9480227454442831, 'max_depth': 3, 'booster': 'dart', 'scale_pos_weight': 2.88228607122594                                                                     04, 'alpha': 0.43722230596030187, 'lambda': 2.714058456204515, 'eta': 0.47448373571559077, 'sampling_method': 'uniform', 'subsample': 0.7                                                                     805179903091212, 'gamma': 8.824619067780159}. Best is trial 61 with value: 4.247532035211623.
[I 2023-12-21 04:04:32,737] Trial 177 pruned. Trial was pruned at iteration 0.
[I 2023-12-21 04:04:32,777] Trial 178 pruned. Trial was pruned at iteration 0.
[I 2023-12-21 04:04:32,818] Trial 179 pruned. Trial was pruned at iteration 1.
[I 2023-12-21 04:04:32,857] Trial 180 pruned. Trial was pruned at iteration 0.
[I 2023-12-21 04:04:33,003] Trial 181 finished with value: 4.26359366429384 and parameters: {'learning_rate': 0.9144107104193784, 'aft_lo                                                                     ss_distribution': 'normal', 'aft_loss_distribution_scale': 1.171265556215873, 'max_depth': 9, 'booster': 'gbtree', 'scale_pos_weight': 3.                                                                     170953013838993, 'alpha': 9.346058432431171, 'lambda': 4.94332236959842, 'eta': 0.400301060063457, 'sampling_method': 'gradient_based', '                                                                     subsample': 0.83238430849568, 'gamma': 9.214519274416528}. Best is trial 61 with value: 4.247532035211623.
[I 2023-12-21 04:04:33,118] Trial 182 finished with value: inf and parameters: {'learning_rate': 0.9057803359721281, 'aft_loss_distributi                                                                     on': 'normal', 'aft_loss_distribution_scale': 1.1279158902897584, 'max_depth': 9, 'booster': 'gbtree', 'scale_pos_weight': 2.935180054090                                                                     8193, 'alpha': 9.44851938298143, 'lambda': 4.297742062811084, 'eta': 0.4131082300920226, 'sampling_method': 'gradient_based', 'subsample'                                                                     : 0.8748597867683982, 'gamma': 9.189720773315047}. Best is trial 61 with value: 4.247532035211623.
[I 2023-12-21 04:04:33,160] Trial 183 pruned. Trial was pruned at iteration 1.
[I 2023-12-21 04:04:33,203] Trial 184 pruned. Trial was pruned at iteration 1.
[I 2023-12-21 04:04:33,242] Trial 185 pruned. Trial was pruned at iteration 0.
[I 2023-12-21 04:04:33,282] Trial 186 pruned. Trial was pruned at iteration 0.
[I 2023-12-21 04:04:33,325] Trial 187 pruned. Trial was pruned at iteration 0.
[I 2023-12-21 04:04:33,366] Trial 188 pruned. Trial was pruned at iteration 0.
[I 2023-12-21 04:04:33,406] Trial 189 pruned. Trial was pruned at iteration 0.
[I 2023-12-21 04:04:33,450] Trial 190 pruned. Trial was pruned at iteration 1.
[I 2023-12-21 04:04:33,557] Trial 191 finished with value: inf and parameters: {'learning_rate': 0.9131826527479829, 'aft_loss_distributi                                                                     on': 'normal', 'aft_loss_distribution_scale': 1.1182793386063363, 'max_depth': 9, 'booster': 'gbtree', 'scale_pos_weight': 3.174026285710                                                                     525, 'alpha': 9.257493995728186, 'lambda': 5.412436846687976, 'eta': 0.41200600884508615, 'sampling_method': 'gradient_based', 'subsample                                                                     ': 0.8235344512648133, 'gamma': 9.107973044753972}. Best is trial 61 with value: 4.247532035211623.
[I 2023-12-21 04:04:33,599] Trial 192 pruned. Trial was pruned at iteration 1.
[I 2023-12-21 04:04:33,722] Trial 193 finished with value: inf and parameters: {'learning_rate': 0.9196836878888265, 'aft_loss_distributi                                                                     on': 'normal', 'aft_loss_distribution_scale': 1.047741990272254, 'max_depth': 9, 'booster': 'gbtree', 'scale_pos_weight': 3.4786640304721                                                                     685, 'alpha': 9.532577785883943, 'lambda': 5.173622356712259, 'eta': 0.03307134259766493, 'sampling_method': 'gradient_based', 'subsample                                                                     ': 0.7853887005148834, 'gamma': 9.336331547533431}. Best is trial 61 with value: 4.247532035211623.
[I 2023-12-21 04:04:33,764] Trial 194 pruned. Trial was pruned at iteration 0.
[I 2023-12-21 04:04:33,805] Trial 195 pruned. Trial was pruned at iteration 0.
[I 2023-12-21 04:04:33,854] Trial 196 pruned. Trial was pruned at iteration 1.
[I 2023-12-21 04:04:33,894] Trial 197 pruned. Trial was pruned at iteration 0.
[I 2023-12-21 04:04:33,934] Trial 198 pruned. Trial was pruned at iteration 0.
[I 2023-12-21 04:04:33,981] Trial 199 pruned. Trial was pruned at iteration 3.
[I 2023-12-21 04:04:34,021] Trial 200 pruned. Trial was pruned at iteration 0.
[I 2023-12-21 04:04:34,200] Trial 201 finished with value: 4.256453384680944 and parameters: {'learning_rate': 0.949948589529381, 'aft_lo                                                                     ss_distribution': 'normal', 'aft_loss_distribution_scale': 1.1001532390551279, 'max_depth': 3, 'booster': 'gbtree', 'scale_pos_weight': 3                                                                     .01833710074796, 'alpha': 9.725060415918326, 'lambda': 0.34287956479845016, 'eta': 0.4319777868317172, 'sampling_method': 'gradient_based                                                                     ', 'subsample': 0.6062766549828188, 'gamma': 8.184517389034937}. Best is trial 61 with value: 4.247532035211623.
[I 2023-12-21 04:04:34,292] Trial 202 pruned. Trial was pruned at iteration 37.
[I 2023-12-21 04:04:34,337] Trial 203 pruned. Trial was pruned at iteration 1.
[I 2023-12-21 04:04:34,377] Trial 204 pruned. Trial was pruned at iteration 0.
[I 2023-12-21 04:04:34,417] Trial 205 pruned. Trial was pruned at iteration 0.
[I 2023-12-21 04:04:34,457] Trial 206 pruned. Trial was pruned at iteration 0.
[I 2023-12-21 04:04:34,498] Trial 207 pruned. Trial was pruned at iteration 0.
[I 2023-12-21 04:04:34,538] Trial 208 pruned. Trial was pruned at iteration 0.
[I 2023-12-21 04:04:34,585] Trial 209 pruned. Trial was pruned at iteration 0.
[I 2023-12-21 04:04:34,626] Trial 210 pruned. Trial was pruned at iteration 0.
[I 2023-12-21 04:04:34,740] Trial 211 finished with value: inf and parameters: {'learning_rate': 0.9733915747088546, 'aft_loss_distributi                                                                     on': 'normal', 'aft_loss_distribution_scale': 1.1490839503730785, 'max_depth': 3, 'booster': 'gbtree', 'scale_pos_weight': 3.110051232589                                                                     107, 'alpha': 9.772004362253412, 'lambda': 0.24767716727339634, 'eta': 0.31352907194242013, 'sampling_method': 'gradient_based', 'subsamp                                                                     le': 0.6387066431716987, 'gamma': 8.186848801938165}. Best is trial 61 with value: 4.247532035211623.
[I 2023-12-21 04:04:34,834] Trial 212 pruned. Trial was pruned at iteration 37.
[I 2023-12-21 04:04:34,877] Trial 213 pruned. Trial was pruned at iteration 1.
[I 2023-12-21 04:04:34,919] Trial 214 pruned. Trial was pruned at iteration 0.
[I 2023-12-21 04:04:34,961] Trial 215 pruned. Trial was pruned at iteration 0.
[I 2023-12-21 04:04:35,075] Trial 216 finished with value: inf and parameters: {'learning_rate': 0.9297997151049473, 'aft_loss_distributi                                                                     on': 'normal', 'aft_loss_distribution_scale': 1.0017024753840025, 'max_depth': 3, 'booster': 'gbtree', 'scale_pos_weight': 0.146971807309                                                                     63644, 'alpha': 0.32257728701258476, 'lambda': 0.047023937978857955, 'eta': 0.41965905291418176, 'sampling_method': 'gradient_based', 'su                                                                     bsample': 0.8096290140334816, 'gamma': 8.986872836349065}. Best is trial 61 with value: 4.247532035211623.
[I 2023-12-21 04:04:35,116] Trial 217 pruned. Trial was pruned at iteration 0.
[I 2023-12-21 04:04:35,157] Trial 218 pruned. Trial was pruned at iteration 0.
[I 2023-12-21 04:04:35,199] Trial 219 pruned. Trial was pruned at iteration 0.
[I 2023-12-21 04:04:35,240] Trial 220 pruned. Trial was pruned at iteration 0.
[I 2023-12-21 04:04:35,349] Trial 221 finished with value: inf and parameters: {'learning_rate': 0.8794509636822141, 'aft_loss_distributi                                                                     on': 'normal', 'aft_loss_distribution_scale': 1.0272550303529635, 'max_depth': 4, 'booster': 'gbtree', 'scale_pos_weight': 2.364654102623                                                                     0077, 'alpha': 0.1275646723591951, 'lambda': 4.890058064308311, 'eta': 0.5121803694611918, 'sampling_method': 'gradient_based', 'subsampl                                                                     e': 0.9787110283773021, 'gamma': 9.382534205518075}. Best is trial 61 with value: 4.247532035211623.
[I 2023-12-21 04:04:35,391] Trial 222 pruned. Trial was pruned at iteration 0.
[I 2023-12-21 04:04:35,434] Trial 223 pruned. Trial was pruned at iteration 0.
[I 2023-12-21 04:04:35,477] Trial 224 pruned. Trial was pruned at iteration 1.
[I 2023-12-21 04:04:35,524] Trial 225 pruned. Trial was pruned at iteration 1.
[I 2023-12-21 04:04:35,566] Trial 226 pruned. Trial was pruned at iteration 0.
[I 2023-12-21 04:04:35,608] Trial 227 pruned. Trial was pruned at iteration 0.
[I 2023-12-21 04:04:35,649] Trial 228 pruned. Trial was pruned at iteration 0.
[I 2023-12-21 04:04:35,692] Trial 229 pruned. Trial was pruned at iteration 0.
[I 2023-12-21 04:04:35,740] Trial 230 pruned. Trial was pruned at iteration 0.
[I 2023-12-21 04:04:35,782] Trial 231 pruned. Trial was pruned at iteration 0.
[I 2023-12-21 04:04:35,824] Trial 232 pruned. Trial was pruned at iteration 0.
[I 2023-12-21 04:04:35,866] Trial 233 pruned. Trial was pruned at iteration 0.
[I 2023-12-21 04:04:35,908] Trial 234 pruned. Trial was pruned at iteration 0.
[I 2023-12-21 04:04:35,950] Trial 235 pruned. Trial was pruned at iteration 0.
[I 2023-12-21 04:04:35,995] Trial 236 pruned. Trial was pruned at iteration 0.
[I 2023-12-21 04:04:36,041] Trial 237 pruned. Trial was pruned at iteration 1.
[I 2023-12-21 04:04:36,083] Trial 238 pruned. Trial was pruned at iteration 0.
[I 2023-12-21 04:04:36,125] Trial 239 pruned. Trial was pruned at iteration 0.
[I 2023-12-21 04:04:36,167] Trial 240 pruned. Trial was pruned at iteration 0.
[I 2023-12-21 04:04:36,211] Trial 241 pruned. Trial was pruned at iteration 1.
[I 2023-12-21 04:04:36,255] Trial 242 pruned. Trial was pruned at iteration 0.
[I 2023-12-21 04:04:36,379] Trial 243 finished with value: inf and parameters: {'learning_rate': 0.9443718017462845, 'aft_loss_distributi                                                                     on': 'normal', 'aft_loss_distribution_scale': 1.044503119196943, 'max_depth': 9, 'booster': 'gbtree', 'scale_pos_weight': 2.5070119770385                                                                     16, 'alpha': 9.449703370854554, 'lambda': 3.147109416372444, 'eta': 0.410259163597589, 'sampling_method': 'gradient_based', 'subsample':                                                                      0.8350024352761438, 'gamma': 9.01861247295671}. Best is trial 61 with value: 4.247532035211623.
[I 2023-12-21 04:04:36,423] Trial 244 pruned. Trial was pruned at iteration 0.
[I 2023-12-21 04:04:36,467] Trial 245 pruned. Trial was pruned at iteration 1.
[I 2023-12-21 04:04:36,510] Trial 246 pruned. Trial was pruned at iteration 0.
[I 2023-12-21 04:04:36,552] Trial 247 pruned. Trial was pruned at iteration 0.
[I 2023-12-21 04:04:36,595] Trial 248 pruned. Trial was pruned at iteration 0.
[I 2023-12-21 04:04:36,640] Trial 249 pruned. Trial was pruned at iteration 0.
[I 2023-12-21 04:04:36,683] Trial 250 pruned. Trial was pruned at iteration 0.
[I 2023-12-21 04:04:36,725] Trial 251 pruned. Trial was pruned at iteration 0.
[I 2023-12-21 04:04:36,770] Trial 252 pruned. Trial was pruned at iteration 0.
[I 2023-12-21 04:04:36,815] Trial 253 pruned. Trial was pruned at iteration 0.
[I 2023-12-21 04:04:36,858] Trial 254 pruned. Trial was pruned at iteration 0.
[I 2023-12-21 04:04:36,901] Trial 255 pruned. Trial was pruned at iteration 0.
[I 2023-12-21 04:04:37,005] Trial 256 finished with value: inf and parameters: {'learning_rate': 0.9534166997872735, 'aft_loss_distributi                                                                     on': 'normal', 'aft_loss_distribution_scale': 0.9649570053017269, 'max_depth': 10, 'booster': 'gbtree', 'scale_pos_weight': 8.14711168522                                                                     23, 'alpha': 9.247893642327364, 'lambda': 6.362711787598115, 'eta': 0.7942094572781369, 'sampling_method': 'uniform', 'subsample': 0.6961                                                                     38402375205, 'gamma': 9.351427239868698}. Best is trial 61 with value: 4.247532035211623.
[I 2023-12-21 04:04:37,049] Trial 257 pruned. Trial was pruned at iteration 0.
[I 2023-12-21 04:04:37,092] Trial 258 pruned. Trial was pruned at iteration 0.
[I 2023-12-21 04:04:37,137] Trial 259 pruned. Trial was pruned at iteration 0.
[I 2023-12-21 04:04:37,182] Trial 260 pruned. Trial was pruned at iteration 0.
[I 2023-12-21 04:04:37,227] Trial 261 pruned. Trial was pruned at iteration 1.
[I 2023-12-21 04:04:37,270] Trial 262 pruned. Trial was pruned at iteration 0.
[I 2023-12-21 04:04:37,318] Trial 263 pruned. Trial was pruned at iteration 0.
[I 2023-12-21 04:04:37,361] Trial 264 pruned. Trial was pruned at iteration 0.
[I 2023-12-21 04:04:37,405] Trial 265 pruned. Trial was pruned at iteration 0.
[I 2023-12-21 04:04:37,449] Trial 266 pruned. Trial was pruned at iteration 0.
[I 2023-12-21 04:04:37,492] Trial 267 pruned. Trial was pruned at iteration 0.
[I 2023-12-21 04:04:37,538] Trial 268 pruned. Trial was pruned at iteration 0.
[I 2023-12-21 04:04:37,584] Trial 269 pruned. Trial was pruned at iteration 0.
[I 2023-12-21 04:04:37,629] Trial 270 pruned. Trial was pruned at iteration 0.
[I 2023-12-21 04:04:37,673] Trial 271 pruned. Trial was pruned at iteration 0.
[I 2023-12-21 04:04:37,716] Trial 272 pruned. Trial was pruned at iteration 0.
[I 2023-12-21 04:04:37,760] Trial 273 pruned. Trial was pruned at iteration 0.
[I 2023-12-21 04:04:37,803] Trial 274 pruned. Trial was pruned at iteration 0.
[I 2023-12-21 04:04:37,849] Trial 275 pruned. Trial was pruned at iteration 0.
[I 2023-12-21 04:04:37,895] Trial 276 pruned. Trial was pruned at iteration 0.
[I 2023-12-21 04:04:37,939] Trial 277 pruned. Trial was pruned at iteration 0.
[I 2023-12-21 04:04:37,983] Trial 278 pruned. Trial was pruned at iteration 0.
[I 2023-12-21 04:04:38,027] Trial 279 pruned. Trial was pruned at iteration 0.
[I 2023-12-21 04:04:38,070] Trial 280 pruned. Trial was pruned at iteration 0.
[I 2023-12-21 04:04:38,114] Trial 281 pruned. Trial was pruned at iteration 0.
[I 2023-12-21 04:04:38,161] Trial 282 pruned. Trial was pruned at iteration 0.
[I 2023-12-21 04:04:38,205] Trial 283 pruned. Trial was pruned at iteration 0.
[I 2023-12-21 04:04:38,251] Trial 284 pruned. Trial was pruned at iteration 0.
[I 2023-12-21 04:04:38,297] Trial 285 pruned. Trial was pruned at iteration 0.
[I 2023-12-21 04:04:38,343] Trial 286 pruned. Trial was pruned at iteration 0.
[I 2023-12-21 04:04:38,388] Trial 287 pruned. Trial was pruned at iteration 0.
[I 2023-12-21 04:04:38,445] Trial 288 pruned. Trial was pruned at iteration 2.
[I 2023-12-21 04:04:38,489] Trial 289 pruned. Trial was pruned at iteration 0.
[I 2023-12-21 04:04:38,535] Trial 290 pruned. Trial was pruned at iteration 0.
[I 2023-12-21 04:04:38,579] Trial 291 pruned. Trial was pruned at iteration 0.
[I 2023-12-21 04:04:38,627] Trial 292 pruned. Trial was pruned at iteration 1.
[I 2023-12-21 04:04:38,673] Trial 293 pruned. Trial was pruned at iteration 0.
[I 2023-12-21 04:04:38,719] Trial 294 pruned. Trial was pruned at iteration 0.
[I 2023-12-21 04:04:38,764] Trial 295 pruned. Trial was pruned at iteration 0.
[I 2023-12-21 04:04:38,884] Trial 296 finished with value: inf and parameters: {'learning_rate': 0.9335539449114306, 'aft_loss_distributi                                                                     on': 'normal', 'aft_loss_distribution_scale': 1.1101623120268282, 'max_depth': 4, 'booster': 'gbtree', 'scale_pos_weight': 7.432623217285                                                                     265, 'alpha': 9.05399741058494, 'lambda': 8.272815866909443, 'eta': 0.11225031959701381, 'sampling_method': 'uniform', 'subsample': 0.748                                                                     2815629759643, 'gamma': 8.62742722887733}. Best is trial 61 with value: 4.247532035211623.
[I 2023-12-21 04:04:38,929] Trial 297 pruned. Trial was pruned at iteration 0.
