[I 2023-12-21 04:14:29,355] Trial 499 finished with value: inf and parameters: {'learning_rate': 0.9990858324786615, 'aft_loss_distributi                                                                     on': 'normal', 'aft_loss_distribution_scale': 1.8852587494412893, 'max_depth': 6, 'booster': 'dart', 'scale_pos_weight': 1.06508392117906                                                                     3, 'alpha': 5.553544248553221, 'lambda': 3.8726268554027836, 'eta': 0.8903510446570665, 'sampling_method': 'uniform', 'subsample': 0.0943                                                                     962801911748, 'gamma': 7.2013781976276325}. Best is trial 255 with value: 2.0370667337922805.
[W 2023-12-21 04:14:29,468] Trial 1 is omitted in visualization because its objective value is inf or nan.
[W 2023-12-21 04:14:29,468] Trial 3 is omitted in visualization because its objective value is inf or nan.
[W 2023-12-21 04:14:29,468] Trial 6 is omitted in visualization because its objective value is inf or nan.
[W 2023-12-21 04:14:29,469] Trial 9 is omitted in visualization because its objective value is inf or nan.
[W 2023-12-21 04:14:29,469] Trial 27 is omitted in visualization because its objective value is inf or nan.
[W 2023-12-21 04:14:29,469] Trial 28 is omitted in visualization because its objective value is inf or nan.
[W 2023-12-21 04:14:29,469] Trial 54 is omitted in visualization because its objective value is inf or nan.
[W 2023-12-21 04:14:29,469] Trial 57 is omitted in visualization because its objective value is inf or nan.
[W 2023-12-21 04:14:29,469] Trial 64 is omitted in visualization because its objective value is inf or nan.
[W 2023-12-21 04:14:29,469] Trial 69 is omitted in visualization because its objective value is inf or nan.
[W 2023-12-21 04:14:29,469] Trial 73 is omitted in visualization because its objective value is inf or nan.
[W 2023-12-21 04:14:29,469] Trial 74 is omitted in visualization because its objective value is inf or nan.
[W 2023-12-21 04:14:29,469] Trial 79 is omitted in visualization because its objective value is inf or nan.
[W 2023-12-21 04:14:29,469] Trial 80 is omitted in visualization because its objective value is inf or nan.
[W 2023-12-21 04:14:29,469] Trial 81 is omitted in visualization because its objective value is inf or nan.
[W 2023-12-21 04:14:29,469] Trial 82 is omitted in visualization because its objective value is inf or nan.
[W 2023-12-21 04:14:29,469] Trial 89 is omitted in visualization because its objective value is inf or nan.
[W 2023-12-21 04:14:29,469] Trial 93 is omitted in visualization because its objective value is inf or nan.
[W 2023-12-21 04:14:29,469] Trial 101 is omitted in visualization because its objective value is inf or nan.
[W 2023-12-21 04:14:29,469] Trial 102 is omitted in visualization because its objective value is inf or nan.
[W 2023-12-21 04:14:29,469] Trial 103 is omitted in visualization because its objective value is inf or nan.
[W 2023-12-21 04:14:29,469] Trial 104 is omitted in visualization because its objective value is inf or nan.
[W 2023-12-21 04:14:29,469] Trial 106 is omitted in visualization because its objective value is inf or nan.
[W 2023-12-21 04:14:29,470] Trial 113 is omitted in visualization because its objective value is inf or nan.
[W 2023-12-21 04:14:29,470] Trial 114 is omitted in visualization because its objective value is inf or nan.
[W 2023-12-21 04:14:29,470] Trial 118 is omitted in visualization because its objective value is inf or nan.
[W 2023-12-21 04:14:29,470] Trial 131 is omitted in visualization because its objective value is inf or nan.
[W 2023-12-21 04:14:29,470] Trial 138 is omitted in visualization because its objective value is inf or nan.
[W 2023-12-21 04:14:29,470] Trial 142 is omitted in visualization because its objective value is inf or nan.
[W 2023-12-21 04:14:29,470] Trial 143 is omitted in visualization because its objective value is inf or nan.
[W 2023-12-21 04:14:29,470] Trial 145 is omitted in visualization because its objective value is inf or nan.
[W 2023-12-21 04:14:29,470] Trial 146 is omitted in visualization because its objective value is inf or nan.
[W 2023-12-21 04:14:29,470] Trial 180 is omitted in visualization because its objective value is inf or nan.
[W 2023-12-21 04:14:29,470] Trial 184 is omitted in visualization because its objective value is inf or nan.
[W 2023-12-21 04:14:29,470] Trial 187 is omitted in visualization because its objective value is inf or nan.
[W 2023-12-21 04:14:29,470] Trial 188 is omitted in visualization because its objective value is inf or nan.
[W 2023-12-21 04:14:29,470] Trial 195 is omitted in visualization because its objective value is inf or nan.
[W 2023-12-21 04:14:29,470] Trial 196 is omitted in visualization because its objective value is inf or nan.
[W 2023-12-21 04:14:29,470] Trial 199 is omitted in visualization because its objective value is inf or nan.
[W 2023-12-21 04:14:29,470] Trial 200 is omitted in visualization because its objective value is inf or nan.
[W 2023-12-21 04:14:29,470] Trial 205 is omitted in visualization because its objective value is inf or nan.
[W 2023-12-21 04:14:29,470] Trial 208 is omitted in visualization because its objective value is inf or nan.
[W 2023-12-21 04:14:29,470] Trial 212 is omitted in visualization because its objective value is inf or nan.
[W 2023-12-21 04:14:29,470] Trial 215 is omitted in visualization because its objective value is inf or nan.
[W 2023-12-21 04:14:29,470] Trial 219 is omitted in visualization because its objective value is inf or nan.
[W 2023-12-21 04:14:29,471] Trial 222 is omitted in visualization because its objective value is inf or nan.
[W 2023-12-21 04:14:29,471] Trial 225 is omitted in visualization because its objective value is inf or nan.
[W 2023-12-21 04:14:29,471] Trial 226 is omitted in visualization because its objective value is inf or nan.
[W 2023-12-21 04:14:29,471] Trial 228 is omitted in visualization because its objective value is inf or nan.
[W 2023-12-21 04:14:29,471] Trial 229 is omitted in visualization because its objective value is inf or nan.
[W 2023-12-21 04:14:29,471] Trial 234 is omitted in visualization because its objective value is inf or nan.
[W 2023-12-21 04:14:29,471] Trial 239 is omitted in visualization because its objective value is inf or nan.
[W 2023-12-21 04:14:29,471] Trial 241 is omitted in visualization because its objective value is inf or nan.
[W 2023-12-21 04:14:29,471] Trial 244 is omitted in visualization because its objective value is inf or nan.
[W 2023-12-21 04:14:29,471] Trial 246 is omitted in visualization because its objective value is inf or nan.
[W 2023-12-21 04:14:29,471] Trial 247 is omitted in visualization because its objective value is inf or nan.
[W 2023-12-21 04:14:29,471] Trial 248 is omitted in visualization because its objective value is inf or nan.
[W 2023-12-21 04:14:29,471] Trial 249 is omitted in visualization because its objective value is inf or nan.
[W 2023-12-21 04:14:29,471] Trial 256 is omitted in visualization because its objective value is inf or nan.
[W 2023-12-21 04:14:29,471] Trial 257 is omitted in visualization because its objective value is inf or nan.
[W 2023-12-21 04:14:29,471] Trial 258 is omitted in visualization because its objective value is inf or nan.
[W 2023-12-21 04:14:29,471] Trial 262 is omitted in visualization because its objective value is inf or nan.
[W 2023-12-21 04:14:29,471] Trial 268 is omitted in visualization because its objective value is inf or nan.
[W 2023-12-21 04:14:29,471] Trial 270 is omitted in visualization because its objective value is inf or nan.
[W 2023-12-21 04:14:29,471] Trial 273 is omitted in visualization because its objective value is inf or nan.
[W 2023-12-21 04:14:29,471] Trial 276 is omitted in visualization because its objective value is inf or nan.
[W 2023-12-21 04:14:29,471] Trial 278 is omitted in visualization because its objective value is inf or nan.
[W 2023-12-21 04:14:29,472] Trial 284 is omitted in visualization because its objective value is inf or nan.
[W 2023-12-21 04:14:29,472] Trial 287 is omitted in visualization because its objective value is inf or nan.
[W 2023-12-21 04:14:29,472] Trial 288 is omitted in visualization because its objective value is inf or nan.
[W 2023-12-21 04:14:29,472] Trial 290 is omitted in visualization because its objective value is inf or nan.
[W 2023-12-21 04:14:29,472] Trial 292 is omitted in visualization because its objective value is inf or nan.
[W 2023-12-21 04:14:29,472] Trial 298 is omitted in visualization because its objective value is inf or nan.
[W 2023-12-21 04:14:29,472] Trial 301 is omitted in visualization because its objective value is inf or nan.
[W 2023-12-21 04:14:29,472] Trial 303 is omitted in visualization because its objective value is inf or nan.
[W 2023-12-21 04:14:29,472] Trial 306 is omitted in visualization because its objective value is inf or nan.
[W 2023-12-21 04:14:29,472] Trial 314 is omitted in visualization because its objective value is inf or nan.
[W 2023-12-21 04:14:29,472] Trial 322 is omitted in visualization because its objective value is inf or nan.
[W 2023-12-21 04:14:29,472] Trial 330 is omitted in visualization because its objective value is inf or nan.
[W 2023-12-21 04:14:29,472] Trial 334 is omitted in visualization because its objective value is inf or nan.
[W 2023-12-21 04:14:29,472] Trial 336 is omitted in visualization because its objective value is inf or nan.
[W 2023-12-21 04:14:29,472] Trial 346 is omitted in visualization because its objective value is inf or nan.
[W 2023-12-21 04:14:29,472] Trial 347 is omitted in visualization because its objective value is inf or nan.
[W 2023-12-21 04:14:29,472] Trial 350 is omitted in visualization because its objective value is inf or nan.
[W 2023-12-21 04:14:29,472] Trial 352 is omitted in visualization because its objective value is inf or nan.
[W 2023-12-21 04:14:29,472] Trial 358 is omitted in visualization because its objective value is inf or nan.
[W 2023-12-21 04:14:29,472] Trial 359 is omitted in visualization because its objective value is inf or nan.
[W 2023-12-21 04:14:29,472] Trial 360 is omitted in visualization because its objective value is inf or nan.
[W 2023-12-21 04:14:29,472] Trial 362 is omitted in visualization because its objective value is inf or nan.
[W 2023-12-21 04:14:29,472] Trial 364 is omitted in visualization because its objective value is inf or nan.
[W 2023-12-21 04:14:29,473] Trial 368 is omitted in visualization because its objective value is inf or nan.
[W 2023-12-21 04:14:29,473] Trial 369 is omitted in visualization because its objective value is inf or nan.
[W 2023-12-21 04:14:29,473] Trial 370 is omitted in visualization because its objective value is inf or nan.
[W 2023-12-21 04:14:29,473] Trial 372 is omitted in visualization because its objective value is inf or nan.
[W 2023-12-21 04:14:29,473] Trial 375 is omitted in visualization because its objective value is inf or nan.
[W 2023-12-21 04:14:29,473] Trial 384 is omitted in visualization because its objective value is inf or nan.
[W 2023-12-21 04:14:29,473] Trial 391 is omitted in visualization because its objective value is inf or nan.
[W 2023-12-21 04:14:29,473] Trial 398 is omitted in visualization because its objective value is inf or nan.
[W 2023-12-21 04:14:29,473] Trial 400 is omitted in visualization because its objective value is inf or nan.
[W 2023-12-21 04:14:29,473] Trial 402 is omitted in visualization because its objective value is inf or nan.
[W 2023-12-21 04:14:29,473] Trial 404 is omitted in visualization because its objective value is inf or nan.
[W 2023-12-21 04:14:29,473] Trial 405 is omitted in visualization because its objective value is inf or nan.
[W 2023-12-21 04:14:29,473] Trial 406 is omitted in visualization because its objective value is inf or nan.
[W 2023-12-21 04:14:29,473] Trial 412 is omitted in visualization because its objective value is inf or nan.
[W 2023-12-21 04:14:29,473] Trial 416 is omitted in visualization because its objective value is inf or nan.
[W 2023-12-21 04:14:29,473] Trial 421 is omitted in visualization because its objective value is inf or nan.
[W 2023-12-21 04:14:29,473] Trial 429 is omitted in visualization because its objective value is inf or nan.
[W 2023-12-21 04:14:29,473] Trial 430 is omitted in visualization because its objective value is inf or nan.
[W 2023-12-21 04:14:29,473] Trial 437 is omitted in visualization because its objective value is inf or nan.
[W 2023-12-21 04:14:29,473] Trial 447 is omitted in visualization because its objective value is inf or nan.
[W 2023-12-21 04:14:29,473] Trial 449 is omitted in visualization because its objective value is inf or nan.
[W 2023-12-21 04:14:29,473] Trial 450 is omitted in visualization because its objective value is inf or nan.
[W 2023-12-21 04:14:29,474] Trial 453 is omitted in visualization because its objective value is inf or nan.
[W 2023-12-21 04:14:29,474] Trial 458 is omitted in visualization because its objective value is inf or nan.
[W 2023-12-21 04:14:29,474] Trial 463 is omitted in visualization because its objective value is inf or nan.
[W 2023-12-21 04:14:29,474] Trial 469 is omitted in visualization because its objective value is inf or nan.
[W 2023-12-21 04:14:29,474] Trial 477 is omitted in visualization because its objective value is inf or nan.
[W 2023-12-21 04:14:29,474] Trial 492 is omitted in visualization because its objective value is inf or nan.
[W 2023-12-21 04:14:29,474] Trial 499 is omitted in visualization because its objective value is inf or nan.
exo-open: Cannot open display: .
/cvmfs/soft.computecanada.ca/gentoo/2020/usr/bin/xdg-open: line 871: x-www-browser: command not found
/cvmfs/soft.computecanada.ca/gentoo/2020/usr/bin/xdg-open: line 871: firefox: command not found
/cvmfs/soft.computecanada.ca/gentoo/2020/usr/bin/xdg-open: line 871: iceweasel: command not found
/cvmfs/soft.computecanada.ca/gentoo/2020/usr/bin/xdg-open: line 871: seamonkey: command not found
/cvmfs/soft.computecanada.ca/gentoo/2020/usr/bin/xdg-open: line 871: mozilla: command not found
/cvmfs/soft.computecanada.ca/gentoo/2020/usr/bin/xdg-open: line 871: epiphany: command not found
/cvmfs/soft.computecanada.ca/gentoo/2020/usr/bin/xdg-open: line 871: konqueror: command not found
/cvmfs/soft.computecanada.ca/gentoo/2020/usr/bin/xdg-open: line 871: chromium: command not found
/cvmfs/soft.computecanada.ca/gentoo/2020/usr/bin/xdg-open: line 871: chromium-browser: command not found
/cvmfs/soft.computecanada.ca/gentoo/2020/usr/bin/xdg-open: line 871: google-chrome: command not found
/cvmfs/soft.computecanada.ca/gentoo/2020/usr/bin/xdg-open: line 871: www-browser: command not found
/cvmfs/soft.computecanada.ca/gentoo/2020/usr/bin/xdg-open: line 871: links2: command not found
/home/lisat/.local/lib/python3.10/site-packages/xgboost/data.py:440: FutureWarning:

is_sparse is deprecated and will be removed in a future version. Check `isinstance(dtype, pd.SparseDtype)` instead.

[I 2023-12-21 04:14:32,246] A new study created in memory with name: no-name-9cbd4ab9-f024-42a9-8ee0-5a0ae444d222
[I 2023-12-21 04:14:32,532] Trial 0 finished with value: inf and parameters: {'learning_rate': 0.7542695710715281, 'aft_loss_distribution                                                                     ': 'normal', 'aft_loss_distribution_scale': 1.842204973343754, 'max_depth': 10, 'booster': 'gbtree', 'scale_pos_weight': 1.99533223652955                                                                     25, 'alpha': 0.9593411181054585, 'lambda': 3.649557329698725, 'eta': 0.3872419375528645, 'sampling_method': 'uniform', 'subsample': 0.616                                                                     5266910366836, 'gamma': 1.6201347717358654}. Best is trial 0 with value: inf.
[I 2023-12-21 04:14:33,732] Trial 1 finished with value: inf and parameters: {'learning_rate': 0.7864046893125843, 'aft_loss_distribution                                                                     ': 'extreme', 'aft_loss_distribution_scale': 0.7067659246800111, 'max_depth': 4, 'booster': 'dart', 'scale_pos_weight': 1.860160734543318                                                                     , 'alpha': 3.28500053078111, 'lambda': 9.08072964283493, 'eta': 0.9837108181741508, 'sampling_method': 'uniform', 'subsample': 0.94692724                                                                     62763803, 'gamma': 0.9875621366409219}. Best is trial 0 with value: inf.
[I 2023-12-21 04:14:34,068] Trial 2 finished with value: 2.609763318259828 and parameters: {'learning_rate': 0.1677378423058224, 'aft_los                                                                     s_distribution': 'extreme', 'aft_loss_distribution_scale': 8.467147795976791, 'max_depth': 7, 'booster': 'gbtree', 'scale_pos_weight': 3.                                                                     175649050645263, 'alpha': 0.750324718652031, 'lambda': 4.272608254584051, 'eta': 0.6023904201290478, 'sampling_method': 'gradient_based',                                                                      'subsample': 0.33293774000902615, 'gamma': 5.4957336361152045}. Best is trial 2 with value: 2.609763318259828.
[I 2023-12-21 04:14:42,725] Trial 3 finished with value: 2.5693479271010746 and parameters: {'learning_rate': 0.8382404891964427, 'aft_lo                                                                     ss_distribution': 'extreme', 'aft_loss_distribution_scale': 7.407777983403449, 'max_depth': 8, 'booster': 'dart', 'scale_pos_weight': 1.6                                                                     68695614756936, 'alpha': 1.2644637122411744, 'lambda': 7.262865405192181, 'eta': 0.7930578112480978, 'sampling_method': 'uniform', 'subsa                                                                     mple': 0.4706009813661198, 'gamma': 8.980219625522663}. Best is trial 3 with value: 2.5693479271010746.
[I 2023-12-21 04:14:43,843] Trial 4 finished with value: inf and parameters: {'learning_rate': 0.5680655843624779, 'aft_loss_distribution                                                                     ': 'extreme', 'aft_loss_distribution_scale': 4.723692401119556, 'max_depth': 4, 'booster': 'dart', 'scale_pos_weight': 3.5022592103954944                                                                     , 'alpha': 1.1073531318774388, 'lambda': 1.3837314981990463, 'eta': 0.03341986300232236, 'sampling_method': 'gradient_based', 'subsample'                                                                     : 0.6766016907040374, 'gamma': 9.3269652552098}. Best is trial 3 with value: 2.5693479271010746.
[I 2023-12-21 04:14:44,098] Trial 5 finished with value: inf and parameters: {'learning_rate': 0.4392369427914148, 'aft_loss_distribution                                                                     ': 'normal', 'aft_loss_distribution_scale': 4.249856834699019, 'max_depth': 8, 'booster': 'gbtree', 'scale_pos_weight': 3.309570711240544                                                                     , 'alpha': 1.1103082026912519, 'lambda': 3.4196409202432556, 'eta': 0.5100205943833951, 'sampling_method': 'gradient_based', 'subsample':                                                                      0.9031093678677318, 'gamma': 0.5483011660783393}. Best is trial 3 with value: 2.5693479271010746.
[I 2023-12-21 04:14:44,103] Trial 6 pruned. Trial was pruned at iteration 0.
[I 2023-12-21 04:14:44,108] Trial 7 pruned. Trial was pruned at iteration 0.
[I 2023-12-21 04:14:44,113] Trial 8 pruned. Trial was pruned at iteration 0.
[I 2023-12-21 04:14:45,221] Trial 9 finished with value: inf and parameters: {'learning_rate': 0.7383708631146984, 'aft_loss_distribution                                                                     ': 'normal', 'aft_loss_distribution_scale': 1.9747957647987902, 'max_depth': 8, 'booster': 'dart', 'scale_pos_weight': 1.4421971889408256                                                                     , 'alpha': 9.786342425112398, 'lambda': 9.704722638967379, 'eta': 0.3527559362715268, 'sampling_method': 'gradient_based', 'subsample': 0                                                                     .0932639631386199, 'gamma': 9.624504883267702}. Best is trial 3 with value: 2.5693479271010746.
[I 2023-12-21 04:14:45,252] Trial 10 pruned. Trial was pruned at iteration 1.
[I 2023-12-21 04:14:45,281] Trial 11 pruned. Trial was pruned at iteration 0.
[I 2023-12-21 04:14:45,309] Trial 12 pruned. Trial was pruned at iteration 0.
[I 2023-12-21 04:14:45,339] Trial 13 pruned. Trial was pruned at iteration 0.
[I 2023-12-21 04:14:45,375] Trial 14 pruned. Trial was pruned at iteration 0.
[I 2023-12-21 04:14:45,403] Trial 15 pruned. Trial was pruned at iteration 0.
[I 2023-12-21 04:14:45,441] Trial 16 pruned. Trial was pruned at iteration 2.
[I 2023-12-21 04:14:45,469] Trial 17 pruned. Trial was pruned at iteration 0.
[I 2023-12-21 04:14:45,500] Trial 18 pruned. Trial was pruned at iteration 0.
[I 2023-12-21 04:14:45,815] Trial 19 finished with value: 2.3722125334392925 and parameters: {'learning_rate': 0.3595354740858436, 'aft_l                                                                     oss_distribution': 'logistic', 'aft_loss_distribution_scale': 3.5943450783162803, 'max_depth': 9, 'booster': 'gbtree', 'scale_pos_weight'                                                                     : 1.086853654098157, 'alpha': 2.1165567402541297, 'lambda': 4.7135628155951474, 'eta': 0.8531254410956498, 'sampling_method': 'uniform',                                                                      'subsample': 0.17743500254242778, 'gamma': 5.093746022175123}. Best is trial 19 with value: 2.3722125334392925.
