[I 2023-12-21 04:14:16,542] Trial 357 finished with value: 2.045447980038205 and parameters: {'learning_rate': 0.9993905812917592, 'aft_l                                                                     oss_distribution': 'normal', 'aft_loss_distribution_scale': 1.8740535273896923, 'max_depth': 7, 'booster': 'gbtree', 'scale_pos_weight':                                                                      1.819442930834285, 'alpha': 9.104545430515882, 'lambda': 4.902641698418385, 'eta': 0.9369109572973291, 'sampling_method': 'uniform', 'sub                                                                     sample': 0.08281667702875689, 'gamma': 8.11303260064584}. Best is trial 255 with value: 2.0370667337922805.
[I 2023-12-21 04:14:16,716] Trial 358 finished with value: inf and parameters: {'learning_rate': 0.9969666890951369, 'aft_loss_distributi                                                                     on': 'normal', 'aft_loss_distribution_scale': 1.4771931749044998, 'max_depth': 7, 'booster': 'gbtree', 'scale_pos_weight': 1.853702741988                                                                     393, 'alpha': 8.913285221452274, 'lambda': 4.889231963510308, 'eta': 0.5167679998520416, 'sampling_method': 'uniform', 'subsample': 0.354                                                                     4255224848852, 'gamma': 8.04022360494155}. Best is trial 255 with value: 2.0370667337922805.
[I 2023-12-21 04:14:16,824] Trial 359 finished with value: inf and parameters: {'learning_rate': 0.9764886482252149, 'aft_loss_distributi                                                                     on': 'normal', 'aft_loss_distribution_scale': 1.6355537034466612, 'max_depth': 7, 'booster': 'gbtree', 'scale_pos_weight': 1.804142598251                                                                     8045, 'alpha': 8.613377233782641, 'lambda': 5.127024593392619, 'eta': 0.9367187699985106, 'sampling_method': 'uniform', 'subsample': 0.07                                                                     686330418593387, 'gamma': 8.17315592559506}. Best is trial 255 with value: 2.0370667337922805.
[I 2023-12-21 04:14:16,944] Trial 360 finished with value: inf and parameters: {'learning_rate': 0.999775527805361, 'aft_loss_distributio                                                                     n': 'normal', 'aft_loss_distribution_scale': 1.891047326362063, 'max_depth': 7, 'booster': 'gbtree', 'scale_pos_weight': 1.91285184891126                                                                     91, 'alpha': 9.070306594559185, 'lambda': 4.7232776640617065, 'eta': 0.915722339133587, 'sampling_method': 'uniform', 'subsample': 0.4036                                                                     9652816489926, 'gamma': 7.868830107039344}. Best is trial 255 with value: 2.0370667337922805.
[I 2023-12-21 04:14:16,989] Trial 361 pruned. Trial was pruned at iteration 0.
[I 2023-12-21 04:14:17,099] Trial 362 finished with value: inf and parameters: {'learning_rate': 0.983847664192695, 'aft_loss_distributio                                                                     n': 'normal', 'aft_loss_distribution_scale': 1.7361412330801405, 'max_depth': 7, 'booster': 'gbtree', 'scale_pos_weight': 1.8092019880192                                                                     096, 'alpha': 9.330807003523438, 'lambda': 4.6355097152002, 'eta': 0.8769519517804191, 'sampling_method': 'uniform', 'subsample': 0.08778                                                                     873625857672, 'gamma': 8.035571250681938}. Best is trial 255 with value: 2.0370667337922805.
[I 2023-12-21 04:14:17,144] Trial 363 pruned. Trial was pruned at iteration 0.
[I 2023-12-21 04:14:17,274] Trial 364 finished with value: inf and parameters: {'learning_rate': 0.9618824635283613, 'aft_loss_distributi                                                                     on': 'normal', 'aft_loss_distribution_scale': 1.9642632676636917, 'max_depth': 7, 'booster': 'gbtree', 'scale_pos_weight': 1.741356878537                                                                     188, 'alpha': 8.756759634745842, 'lambda': 4.843644375788412, 'eta': 0.9111861768728415, 'sampling_method': 'uniform', 'subsample': 0.144                                                                     15429248753495, 'gamma': 6.294363378410091}. Best is trial 255 with value: 2.0370667337922805.
[I 2023-12-21 04:14:17,322] Trial 365 pruned. Trial was pruned at iteration 0.
[I 2023-12-21 04:14:17,367] Trial 366 pruned. Trial was pruned at iteration 0.
[I 2023-12-21 04:14:17,579] Trial 367 finished with value: 2.0483619790268373 and parameters: {'learning_rate': 0.9784032076501261, 'aft_                                                                     loss_distribution': 'normal', 'aft_loss_distribution_scale': 1.9400334446746532, 'max_depth': 7, 'booster': 'gbtree', 'scale_pos_weight':                                                                      1.594529747212837, 'alpha': 9.394870109976479, 'lambda': 4.244373255249686, 'eta': 0.831822002659478, 'sampling_method': 'uniform', 'sub                                                                     sample': 0.09912625041061518, 'gamma': 7.79470639991403}. Best is trial 255 with value: 2.0370667337922805.
[I 2023-12-21 04:14:17,695] Trial 368 finished with value: inf and parameters: {'learning_rate': 0.9713244879678291, 'aft_loss_distributi                                                                     on': 'normal', 'aft_loss_distribution_scale': 1.5530005635822066, 'max_depth': 7, 'booster': 'gbtree', 'scale_pos_weight': 1.564616023569                                                                     4326, 'alpha': 8.989014341280045, 'lambda': 5.1089156765488495, 'eta': 0.8368867488668829, 'sampling_method': 'uniform', 'subsample': 0.0                                                                     8860850430825855, 'gamma': 8.418441235213592}. Best is trial 255 with value: 2.0370667337922805.
[I 2023-12-21 04:14:17,804] Trial 369 finished with value: inf and parameters: {'learning_rate': 0.9387468959146759, 'aft_loss_distributi                                                                     on': 'normal', 'aft_loss_distribution_scale': 1.888580413234916, 'max_depth': 7, 'booster': 'gbtree', 'scale_pos_weight': 1.6654045675921                                                                     818, 'alpha': 9.398433379096005, 'lambda': 4.3254993046784325, 'eta': 0.8556493616156174, 'sampling_method': 'uniform', 'subsample': 0.17                                                                     726952485082997, 'gamma': 8.572666308953792}. Best is trial 255 with value: 2.0370667337922805.
[I 2023-12-21 04:14:18,020] Trial 370 finished with value: inf and parameters: {'learning_rate': 0.9997540206147159, 'aft_loss_distributi                                                                     on': 'normal', 'aft_loss_distribution_scale': 1.3911836513864984, 'max_depth': 7, 'booster': 'gbtree', 'scale_pos_weight': 2.185653106939                                                                     1627, 'alpha': 6.347214424948733, 'lambda': 7.486108479377519, 'eta': 0.8233039776005153, 'sampling_method': 'uniform', 'subsample': 0.13                                                                     21938431058214, 'gamma': 7.823765301276791}. Best is trial 255 with value: 2.0370667337922805.
[I 2023-12-21 04:14:18,069] Trial 371 pruned. Trial was pruned at iteration 1.
[I 2023-12-21 04:14:18,173] Trial 372 finished with value: inf and parameters: {'learning_rate': 0.9794352014471458, 'aft_loss_distributi                                                                     on': 'normal', 'aft_loss_distribution_scale': 1.7687985581294416, 'max_depth': 7, 'booster': 'gbtree', 'scale_pos_weight': 1.768582827796                                                                     1164, 'alpha': 9.421102350896515, 'lambda': 4.932768173871005, 'eta': 0.936223845328205, 'sampling_method': 'uniform', 'subsample': 0.073                                                                     66252273346846, 'gamma': 7.997802043051698}. Best is trial 255 with value: 2.0370667337922805.
[I 2023-12-21 04:14:18,219] Trial 373 pruned. Trial was pruned at iteration 0.
[I 2023-12-21 04:14:18,264] Trial 374 pruned. Trial was pruned at iteration 0.
[I 2023-12-21 04:14:18,388] Trial 375 finished with value: inf and parameters: {'learning_rate': 0.9812684049949685, 'aft_loss_distributi                                                                     on': 'normal', 'aft_loss_distribution_scale': 1.6238949541145888, 'max_depth': 7, 'booster': 'gbtree', 'scale_pos_weight': 1.500214745654                                                                     2163, 'alpha': 8.440777547156946, 'lambda': 4.072874424510567, 'eta': 0.8115802858388703, 'sampling_method': 'uniform', 'subsample': 0.14                                                                     0544166262062, 'gamma': 8.229265920461295}. Best is trial 255 with value: 2.0370667337922805.
[I 2023-12-21 04:14:18,435] Trial 376 pruned. Trial was pruned at iteration 0.
[I 2023-12-21 04:14:18,481] Trial 377 pruned. Trial was pruned at iteration 0.
[I 2023-12-21 04:14:18,528] Trial 378 pruned. Trial was pruned at iteration 1.
[I 2023-12-21 04:14:18,575] Trial 379 pruned. Trial was pruned at iteration 0.
[I 2023-12-21 04:14:18,620] Trial 380 pruned. Trial was pruned at iteration 0.
[I 2023-12-21 04:14:18,676] Trial 381 pruned. Trial was pruned at iteration 0.
[I 2023-12-21 04:14:18,725] Trial 382 pruned. Trial was pruned at iteration 0.
[I 2023-12-21 04:14:18,771] Trial 383 pruned. Trial was pruned at iteration 0.
[I 2023-12-21 04:14:19,745] Trial 384 finished with value: inf and parameters: {'learning_rate': 0.9801242412119303, 'aft_loss_distributi                                                                     on': 'normal', 'aft_loss_distribution_scale': 1.5268247221404159, 'max_depth': 6, 'booster': 'dart', 'scale_pos_weight': 1.18854039286568                                                                     2, 'alpha': 9.773684333655703, 'lambda': 4.05344004915027, 'eta': 0.780007997209488, 'sampling_method': 'uniform', 'subsample': 0.1258952                                                                     809382917, 'gamma': 7.713530413955471}. Best is trial 255 with value: 2.0370667337922805.
[I 2023-12-21 04:14:19,874] Trial 385 finished with value: 2.0530196357900103 and parameters: {'learning_rate': 0.9630919880591824, 'aft_                                                                     loss_distribution': 'normal', 'aft_loss_distribution_scale': 1.9716576387969214, 'max_depth': 7, 'booster': 'gbtree', 'scale_pos_weight':                                                                      1.300702886031065, 'alpha': 9.454118903048045, 'lambda': 4.635819197876347, 'eta': 0.8036437472377336, 'sampling_method': 'uniform', 'su                                                                     bsample': 0.09567899078031658, 'gamma': 6.940388658983924}. Best is trial 255 with value: 2.0370667337922805.
[I 2023-12-21 04:14:19,920] Trial 386 pruned. Trial was pruned at iteration 0.
[I 2023-12-21 04:14:19,966] Trial 387 pruned. Trial was pruned at iteration 0.
[I 2023-12-21 04:14:20,015] Trial 388 pruned. Trial was pruned at iteration 0.
[I 2023-12-21 04:14:20,061] Trial 389 pruned. Trial was pruned at iteration 0.
[I 2023-12-21 04:14:20,109] Trial 390 pruned. Trial was pruned at iteration 1.
[I 2023-12-21 04:14:20,237] Trial 391 finished with value: inf and parameters: {'learning_rate': 0.949269702046289, 'aft_loss_distributio                                                                     n': 'normal', 'aft_loss_distribution_scale': 1.7860558240139723, 'max_depth': 7, 'booster': 'gbtree', 'scale_pos_weight': 1.3780282146946                                                                     157, 'alpha': 9.596561974430273, 'lambda': 4.561394333759424, 'eta': 0.8729345613148418, 'sampling_method': 'uniform', 'subsample': 0.808                                                                     5641357839566, 'gamma': 7.235377901060665}. Best is trial 255 with value: 2.0370667337922805.
[I 2023-12-21 04:14:20,283] Trial 392 pruned. Trial was pruned at iteration 0.
[I 2023-12-21 04:14:20,331] Trial 393 pruned. Trial was pruned at iteration 0.
[I 2023-12-21 04:14:20,379] Trial 394 pruned. Trial was pruned at iteration 0.
[I 2023-12-21 04:14:20,426] Trial 395 pruned. Trial was pruned at iteration 0.
[I 2023-12-21 04:14:20,473] Trial 396 pruned. Trial was pruned at iteration 0.
[I 2023-12-21 04:14:20,520] Trial 397 pruned. Trial was pruned at iteration 0.
[I 2023-12-21 04:14:20,632] Trial 398 finished with value: inf and parameters: {'learning_rate': 0.9622016139699661, 'aft_loss_distributi                                                                     on': 'normal', 'aft_loss_distribution_scale': 1.6292060395562857, 'max_depth': 6, 'booster': 'gbtree', 'scale_pos_weight': 1.342360068917                                                                     3207, 'alpha': 9.184023811535432, 'lambda': 4.685577842311023, 'eta': 0.9133040936923601, 'sampling_method': 'uniform', 'subsample': 0.06                                                                     399320343561796, 'gamma': 7.455627065777586}. Best is trial 255 with value: 2.0370667337922805.
[I 2023-12-21 04:14:20,679] Trial 399 pruned. Trial was pruned at iteration 0.
[I 2023-12-21 04:14:20,893] Trial 400 finished with value: inf and parameters: {'learning_rate': 0.9809980627063866, 'aft_loss_distributi                                                                     on': 'normal', 'aft_loss_distribution_scale': 1.9640964918694908, 'max_depth': 7, 'booster': 'gbtree', 'scale_pos_weight': 1.791506588431                                                                     9143, 'alpha': 1.1486770621433813, 'lambda': 4.846342551047078, 'eta': 0.7737791432691197, 'sampling_method': 'uniform', 'subsample': 0.1                                                                     2237126768554309, 'gamma': 6.719694059260636}. Best is trial 255 with value: 2.0370667337922805.
[I 2023-12-21 04:14:20,939] Trial 401 pruned. Trial was pruned at iteration 0.
[I 2023-12-21 04:14:21,069] Trial 402 finished with value: inf and parameters: {'learning_rate': 0.9625699275489501, 'aft_loss_distributi                                                                     on': 'normal', 'aft_loss_distribution_scale': 1.4693629099524295, 'max_depth': 7, 'booster': 'gbtree', 'scale_pos_weight': 1.507322443147                                                                     5623, 'alpha': 9.101652973652593, 'lambda': 4.537775264863238, 'eta': 0.881018381152233, 'sampling_method': 'gradient_based', 'subsample'                                                                     : 0.649787995513677, 'gamma': 8.57112950472626}. Best is trial 255 with value: 2.0370667337922805.
[I 2023-12-21 04:14:21,207] Trial 403 finished with value: 2.0463189761594704 and parameters: {'learning_rate': 0.9838728690569388, 'aft_                                                                     loss_distribution': 'normal', 'aft_loss_distribution_scale': 1.8857431924370454, 'max_depth': 6, 'booster': 'gbtree', 'scale_pos_weight':                                                                      1.887629540170061, 'alpha': 9.643094120644681, 'lambda': 4.054563304731759, 'eta': 0.8355611469370755, 'sampling_method': 'uniform', 'su                                                                     bsample': 0.0813199353151587, 'gamma': 6.878255122676567}. Best is trial 255 with value: 2.0370667337922805.
[I 2023-12-21 04:14:21,314] Trial 404 finished with value: inf and parameters: {'learning_rate': 0.967421775850837, 'aft_loss_distributio                                                                     n': 'normal', 'aft_loss_distribution_scale': 1.7023276521760167, 'max_depth': 6, 'booster': 'gbtree', 'scale_pos_weight': 1.9728174280893                                                                     587, 'alpha': 9.352265326355514, 'lambda': 3.7616599798166197, 'eta': 0.8152700822879577, 'sampling_method': 'uniform', 'subsample': 0.07                                                                     756167653469814, 'gamma': 7.158343933152008}. Best is trial 255 with value: 2.0370667337922805.
[I 2023-12-21 04:14:21,431] Trial 405 finished with value: inf and parameters: {'learning_rate': 0.9385415725792665, 'aft_loss_distributi                                                                     on': 'normal', 'aft_loss_distribution_scale': 1.871841521454175, 'max_depth': 5, 'booster': 'gbtree', 'scale_pos_weight': 1.8696610510724                                                                     199, 'alpha': 9.56428186053688, 'lambda': 4.011676466173899, 'eta': 0.8339868875838183, 'sampling_method': 'uniform', 'subsample': 0.1882                                                                     269625078908, 'gamma': 6.963179766685496}. Best is trial 255 with value: 2.0370667337922805.
[I 2023-12-21 04:14:21,610] Trial 406 finished with value: inf and parameters: {'learning_rate': 0.9980557431447991, 'aft_loss_distributi                                                                     on': 'normal', 'aft_loss_distribution_scale': 1.4882934360363675, 'max_depth': 7, 'booster': 'gbtree', 'scale_pos_weight': 1.874939905740                                                                     2032, 'alpha': 9.198884006188768, 'lambda': 4.1276739059817515, 'eta': 0.7886153896482013, 'sampling_method': 'uniform', 'subsample': 0.1                                                                     3464439047320007, 'gamma': 7.570366290963288}. Best is trial 255 with value: 2.0370667337922805.
[I 2023-12-21 04:14:21,774] Trial 407 finished with value: 2.0438381351851787 and parameters: {'learning_rate': 0.9837148980201664, 'aft_                                                                     loss_distribution': 'normal', 'aft_loss_distribution_scale': 1.8419642258258708, 'max_depth': 6, 'booster': 'gbtree', 'scale_pos_weight':                                                                      1.930830266531245, 'alpha': 8.925390410727605, 'lambda': 3.7054009093531284, 'eta': 0.9007097836380566, 'sampling_method': 'uniform', 's                                                                     ubsample': 0.0478558451207813, 'gamma': 7.319015616490298}. Best is trial 255 with value: 2.0370667337922805.
[I 2023-12-21 04:14:21,825] Trial 408 pruned. Trial was pruned at iteration 1.
[I 2023-12-21 04:14:21,873] Trial 409 pruned. Trial was pruned at iteration 0.
[I 2023-12-21 04:14:21,920] Trial 410 pruned. Trial was pruned at iteration 0.
[I 2023-12-21 04:14:21,966] Trial 411 pruned. Trial was pruned at iteration 0.
[I 2023-12-21 04:14:22,069] Trial 412 finished with value: inf and parameters: {'learning_rate': 0.9769994006658987, 'aft_loss_distributi                                                                     on': 'normal', 'aft_loss_distribution_scale': 1.8592138406503187, 'max_depth': 6, 'booster': 'gbtree', 'scale_pos_weight': 1.799840610798                                                                     0733, 'alpha': 9.696858924384115, 'lambda': 3.3369515177578766, 'eta': 0.8835776834083474, 'sampling_method': 'uniform', 'subsample': 0.0                                                                     725062231857192, 'gamma': 7.333431217133654}. Best is trial 255 with value: 2.0370667337922805.
[I 2023-12-21 04:14:22,116] Trial 413 pruned. Trial was pruned at iteration 0.
[I 2023-12-21 04:14:22,162] Trial 414 pruned. Trial was pruned at iteration 0.
[I 2023-12-21 04:14:22,210] Trial 415 pruned. Trial was pruned at iteration 0.
[I 2023-12-21 04:14:22,321] Trial 416 finished with value: inf and parameters: {'learning_rate': 0.9843661239643653, 'aft_loss_distributi                                                                     on': 'normal', 'aft_loss_distribution_scale': 1.8221061367291622, 'max_depth': 6, 'booster': 'gbtree', 'scale_pos_weight': 1.695221668431                                                                     5111, 'alpha': 8.68763120496143, 'lambda': 3.8094759179522666, 'eta': 0.8993583259677245, 'sampling_method': 'uniform', 'subsample': 0.10                                                                     715747449835054, 'gamma': 7.4237832672773365}. Best is trial 255 with value: 2.0370667337922805.
[I 2023-12-21 04:14:22,371] Trial 417 pruned. Trial was pruned at iteration 1.
[I 2023-12-21 04:14:22,418] Trial 418 pruned. Trial was pruned at iteration 0.
[I 2023-12-21 04:14:22,465] Trial 419 pruned. Trial was pruned at iteration 0.
[I 2023-12-21 04:14:22,512] Trial 420 pruned. Trial was pruned at iteration 0.
[I 2023-12-21 04:14:22,627] Trial 421 finished with value: inf and parameters: {'learning_rate': 0.9685833429415682, 'aft_loss_distributi                                                                     on': 'normal', 'aft_loss_distribution_scale': 1.9290811160612706, 'max_depth': 7, 'booster': 'gbtree', 'scale_pos_weight': 1.634726183350                                                                     1696, 'alpha': 9.817435968844729, 'lambda': 4.353722151490683, 'eta': 0.8503736625356532, 'sampling_method': 'uniform', 'subsample': 0.15                                                                     06004576399125, 'gamma': 6.535737532872655}. Best is trial 255 with value: 2.0370667337922805.
[I 2023-12-21 04:14:22,678] Trial 422 pruned. Trial was pruned at iteration 1.
[I 2023-12-21 04:14:22,726] Trial 423 pruned. Trial was pruned at iteration 0.
[I 2023-12-21 04:14:22,774] Trial 424 pruned. Trial was pruned at iteration 0.
