[I 2023-12-19 00:37:30,820] Trial 262 pruned. Trial was pruned at iteration 0.
[I 2023-12-19 00:37:37,721] Trial 263 finished with value: 2.019240691048607 and parameters: {'learning_rate': 0.9772507820853299, 'aft_loss_distribution': 'normal', 'aft_loss_distribution_scale': 1.4602448198406106, 'max_depth': 3, 'booster': 'dart', 'scale_pos_weight': 1.1952475908648184, 'alpha': 4.273131131816679, 'lambda': 2.318465152175375, 'eta': 0.877108215138531, 'sampling_method': 'gradient_based', 'subsample': 0.7265826452774785, 'gamma': 9.462241221874843}. Best is trial 259 with value: 2.019020864720799.
[I 2023-12-19 00:37:37,802] Trial 264 pruned. Trial was pruned at iteration 0.
[I 2023-12-19 00:37:43,677] Trial 265 finished with value: 2.0192664761913957 and parameters: {'learning_rate': 0.966333389987864, 'aft_loss_distribution': 'normal', 'aft_loss_distribution_scale': 1.4860654093488797, 'max_depth': 3, 'booster': 'dart', 'scale_pos_weight': 1.510837497802859, 'alpha': 4.2014034727987895, 'lambda': 2.0855340054443756, 'eta': 0.8997572435606151, 'sampling_method': 'gradient_based', 'subsample': 0.7262503416343108, 'gamma': 9.423832989906003}. Best is trial 259 with value: 2.019020864720799.
[I 2023-12-19 00:37:43,767] Trial 266 pruned. Trial was pruned at iteration 0.
[I 2023-12-19 00:37:45,020] Trial 267 finished with value: inf and parameters: {'learning_rate': 0.9776434353186031, 'aft_loss_distribution': 'normal', 'aft_loss_distribution_scale': 1.4727076311177727, 'max_depth': 3, 'booster': 'dart', 'scale_pos_weight': 1.3632494919355778, 'alpha': 1.0387730653180862, 'lambda': 2.3646201741411357, 'eta': 0.3376250370992953, 'sampling_method': 'gradient_based', 'subsample': 0.6785365786504828, 'gamma': 9.373771877523843}. Best is trial 259 with value: 2.019020864720799.
[I 2023-12-19 00:37:45,101] Trial 268 pruned. Trial was pruned at iteration 0.
[I 2023-12-19 00:37:48,550] Trial 269 finished with value: 2.0214993661269682 and parameters: {'learning_rate': 0.9663812253466862, 'aft_loss_distribution': 'normal', 'aft_loss_distribution_scale': 1.5878951852248442, 'max_depth': 3, 'booster': 'dart', 'scale_pos_weight': 1.5779942279921957, 'alpha': 4.142642535570006, 'lambda': 2.5923362851055365, 'eta': 0.895415422590532, 'sampling_method': 'gradient_based', 'subsample': 0.7963049606773294, 'gamma': 9.427912932408077}. Best is trial 259 with value: 2.019020864720799.
[I 2023-12-19 00:37:48,682] Trial 270 pruned. Trial was pruned at iteration 0.
[I 2023-12-19 00:37:48,793] Trial 271 pruned. Trial was pruned at iteration 0.
[I 2023-12-19 00:37:48,898] Trial 272 pruned. Trial was pruned at iteration 0.
[I 2023-12-19 00:37:50,441] Trial 273 finished with value: inf and parameters: {'learning_rate': 0.9817470961614925, 'aft_loss_distribution': 'normal', 'aft_loss_distribution_scale': 1.3880767938607845, 'max_depth': 3, 'booster': 'dart', 'scale_pos_weight': 1.6302796426916544, 'alpha': 4.289650166843116, 'lambda': 2.332222188528772, 'eta': 0.8956725352762367, 'sampling_method': 'gradient_based', 'subsample': 0.8300899987156686, 'gamma': 9.431099769249753}. Best is trial 259 with value: 2.019020864720799.
[I 2023-12-19 00:37:50,524] Trial 274 pruned. Trial was pruned at iteration 0.
[I 2023-12-19 00:37:53,274] Trial 275 finished with value: 2.0203519840968545 and parameters: {'learning_rate': 0.9996585141059535, 'aft_loss_distribution': 'normal', 'aft_loss_distribution_scale': 1.5330651380942721, 'max_depth': 3, 'booster': 'dart', 'scale_pos_weight': 1.3344733160937097, 'alpha': 4.164460825958643, 'lambda': 2.576932980232663, 'eta': 0.9207327337922118, 'sampling_method': 'gradient_based', 'subsample': 0.8088791536908949, 'gamma': 9.552586045360993}. Best is trial 259 with value: 2.019020864720799.
[I 2023-12-19 00:37:53,356] Trial 276 pruned. Trial was pruned at iteration 0.
[I 2023-12-19 00:37:53,429] Trial 277 pruned. Trial was pruned at iteration 0.
[I 2023-12-19 00:37:53,511] Trial 278 pruned. Trial was pruned at iteration 0.
[I 2023-12-19 00:37:53,586] Trial 279 pruned. Trial was pruned at iteration 0.
[I 2023-12-19 00:37:55,151] Trial 280 finished with value: inf and parameters: {'learning_rate': 0.980906843561601, 'aft_loss_distribution': 'normal', 'aft_loss_distribution_scale': 1.3056931175610174, 'max_depth': 3, 'booster': 'dart', 'scale_pos_weight': 1.3811261646058899, 'alpha': 1.5225310704569983, 'lambda': 2.2131952407419284, 'eta': 0.20892609155890382, 'sampling_method': 'gradient_based', 'subsample': 0.7180513961294682, 'gamma': 9.518073247565715}. Best is trial 259 with value: 2.019020864720799.
[I 2023-12-19 00:37:57,924] Trial 281 finished with value: 2.028570872264251 and parameters: {'learning_rate': 0.9999384299039658, 'aft_loss_distribution': 'normal', 'aft_loss_distribution_scale': 1.7153653574965666, 'max_depth': 3, 'booster': 'dart', 'scale_pos_weight': 1.7637670691850689, 'alpha': 4.204101360774252, 'lambda': 2.4655101652498375, 'eta': 0.9210727581442921, 'sampling_method': 'gradient_based', 'subsample': 0.8048920373660543, 'gamma': 9.23536873614695}. Best is trial 259 with value: 2.019020864720799.
[I 2023-12-19 00:37:58,010] Trial 282 pruned. Trial was pruned at iteration 0.
[I 2023-12-19 00:37:58,097] Trial 283 pruned. Trial was pruned at iteration 0.
[I 2023-12-19 00:37:59,398] Trial 284 finished with value: inf and parameters: {'learning_rate': 0.9996520921623363, 'aft_loss_distribution': 'normal', 'aft_loss_distribution_scale': 1.7632654463657669, 'max_depth': 8, 'booster': 'dart', 'scale_pos_weight': 1.6430323988761166, 'alpha': 3.8922386709864414, 'lambda': 2.800141471029401, 'eta': 0.8504950911829215, 'sampling_method': 'gradient_based', 'subsample': 0.8004992541082904, 'gamma': 9.292286091520687}. Best is trial 259 with value: 2.019020864720799.
[I 2023-12-19 00:38:00,972] Trial 285 finished with value: inf and parameters: {'learning_rate': 0.9664250834750105, 'aft_loss_distribution': 'normal', 'aft_loss_distribution_scale': 1.4574091477831363, 'max_depth': 3, 'booster': 'dart', 'scale_pos_weight': 1.7779547780667844, 'alpha': 4.242779548025728, 'lambda': 1.4518511178223261, 'eta': 0.9296764288878396, 'sampling_method': 'gradient_based', 'subsample': 0.8277887266452187, 'gamma': 9.097309963308225}. Best is trial 259 with value: 2.019020864720799.
[I 2023-12-19 00:38:03,945] Trial 286 finished with value: inf and parameters: {'learning_rate': 0.9992583777929921, 'aft_loss_distribution': 'normal', 'aft_loss_distribution_scale': 1.6653649849062182, 'max_depth': 3, 'booster': 'dart', 'scale_pos_weight': 1.2435349218789646, 'alpha': 4.549305894946575, 'lambda': 2.618668625481017, 'eta': 0.8810973338489126, 'sampling_method': 'gradient_based', 'subsample': 0.8622983934313997, 'gamma': 9.399107839180783}. Best is trial 259 with value: 2.019020864720799.
[I 2023-12-19 00:38:04,069] Trial 287 pruned. Trial was pruned at iteration 0.
[I 2023-12-19 00:38:04,199] Trial 288 pruned. Trial was pruned at iteration 0.
[I 2023-12-19 00:38:05,600] Trial 289 finished with value: inf and parameters: {'learning_rate': 0.977948067074608, 'aft_loss_distribution': 'normal', 'aft_loss_distribution_scale': 1.5849544139200458, 'max_depth': 3, 'booster': 'dart', 'scale_pos_weight': 1.2897843178959896, 'alpha': 4.811681197622601, 'lambda': 1.7082585060299404, 'eta': 0.8331995805714028, 'sampling_method': 'gradient_based', 'subsample': 0.7694879290867108, 'gamma': 9.255932830429249}. Best is trial 259 with value: 2.019020864720799.
[I 2023-12-19 00:38:06,922] Trial 290 finished with value: inf and parameters: {'learning_rate': 0.9601083347300181, 'aft_loss_distribution': 'normal', 'aft_loss_distribution_scale': 1.832654570683315, 'max_depth': 3, 'booster': 'dart', 'scale_pos_weight': 2.0187034378283513, 'alpha': 3.877524693298829, 'lambda': 2.0246815314788305, 'eta': 0.39205410860852635, 'sampling_method': 'gradient_based', 'subsample': 0.9945037058854831, 'gamma': 1.7974481891966736}. Best is trial 259 with value: 2.019020864720799.
[I 2023-12-19 00:38:07,008] Trial 291 pruned. Trial was pruned at iteration 0.
[I 2023-12-19 00:38:07,085] Trial 292 pruned. Trial was pruned at iteration 0.
[I 2023-12-19 00:38:09,864] Trial 293 finished with value: 2.022351654101979 and parameters: {'learning_rate': 0.9855280868761261, 'aft_loss_distribution': 'normal', 'aft_loss_distribution_scale': 1.6091699977858478, 'max_depth': 3, 'booster': 'dart', 'scale_pos_weight': 1.6011625427455702, 'alpha': 3.7850610696995677, 'lambda': 2.200321868470509, 'eta': 0.9975937029860652, 'sampling_method': 'gradient_based', 'subsample': 0.8149202597554046, 'gamma': 9.196757541168878}. Best is trial 259 with value: 2.019020864720799.
[I 2023-12-19 00:38:09,952] Trial 294 pruned. Trial was pruned at iteration 0.
[I 2023-12-19 00:38:10,033] Trial 295 pruned. Trial was pruned at iteration 0.
[I 2023-12-19 00:38:11,341] Trial 296 finished with value: inf and parameters: {'learning_rate': 0.9578268982419029, 'aft_loss_distribution': 'normal', 'aft_loss_distribution_scale': 1.6609672305523242, 'max_depth': 3, 'booster': 'dart', 'scale_pos_weight': 1.5772156266468138, 'alpha': 4.422543101481572, 'lambda': 1.3453070377707197, 'eta': 0.5242649167007566, 'sampling_method': 'gradient_based', 'subsample': 0.7915835964040447, 'gamma': 8.890836337008038}. Best is trial 259 with value: 2.019020864720799.
[I 2023-12-19 00:38:11,432] Trial 297 pruned. Trial was pruned at iteration 0.
[I 2023-12-19 00:38:11,513] Trial 298 pruned. Trial was pruned at iteration 0.
[I 2023-12-19 00:38:14,322] Trial 299 finished with value: 2.022445756455261 and parameters: {'learning_rate': 0.999370126950637, 'aft_loss_distribution': 'normal', 'aft_loss_distribution_scale': 1.6063303388169883, 'max_depth': 3, 'booster': 'dart', 'scale_pos_weight': 1.5406815375011071, 'alpha': 4.08309088916426, 'lambda': 2.5543341869859915, 'eta': 0.9567630692262776, 'sampling_method': 'gradient_based', 'subsample': 0.7984119803840564, 'gamma': 9.070914000001618}. Best is trial 259 with value: 2.019020864720799.
[I 2023-12-19 00:38:14,407] Trial 300 pruned. Trial was pruned at iteration 0.
[I 2023-12-19 00:38:14,489] Trial 301 pruned. Trial was pruned at iteration 0.
[I 2023-12-19 00:38:14,599] Trial 302 pruned. Trial was pruned at iteration 0.
[I 2023-12-19 00:38:14,715] Trial 303 pruned. Trial was pruned at iteration 0.
[I 2023-12-19 00:38:14,838] Trial 304 pruned. Trial was pruned at iteration 0.
[I 2023-12-19 00:38:14,949] Trial 305 pruned. Trial was pruned at iteration 0.
[I 2023-12-19 00:38:16,667] Trial 306 finished with value: inf and parameters: {'learning_rate': 0.9791785775062082, 'aft_loss_distribution': 'normal', 'aft_loss_distribution_scale': 1.6250729398517767, 'max_depth': 3, 'booster': 'dart', 'scale_pos_weight': 1.4583993123607206, 'alpha': 5.010420616598732, 'lambda': 2.513001281860539, 'eta': 0.08233871243298874, 'sampling_method': 'gradient_based', 'subsample': 0.8378532835030906, 'gamma': 9.669892211218642}. Best is trial 259 with value: 2.019020864720799.
[I 2023-12-19 00:38:16,803] Trial 307 pruned. Trial was pruned at iteration 0.
[I 2023-12-19 00:38:16,927] Trial 308 pruned. Trial was pruned at iteration 0.
[I 2023-12-19 00:38:17,036] Trial 309 pruned. Trial was pruned at iteration 0.
[I 2023-12-19 00:38:17,153] Trial 310 pruned. Trial was pruned at iteration 0.
[I 2023-12-19 00:38:20,426] Trial 311 finished with value: 2.0366641620354593 and parameters: {'learning_rate': 0.999903331205919, 'aft_loss_distribution': 'normal', 'aft_loss_distribution_scale': 1.8381158385612613, 'max_depth': 4, 'booster': 'dart', 'scale_pos_weight': 1.6769910338926248, 'alpha': 1.290687975992912, 'lambda': 2.8277883510306547, 'eta': 0.9977878923380697, 'sampling_method': 'gradient_based', 'subsample': 0.8251958516013917, 'gamma': 9.55883162970142}. Best is trial 259 with value: 2.019020864720799.
[I 2023-12-19 00:38:20,514] Trial 312 pruned. Trial was pruned at iteration 0.
[I 2023-12-19 00:38:20,594] Trial 313 pruned. Trial was pruned at iteration 0.
[I 2023-12-19 00:38:21,911] Trial 314 finished with value: inf and parameters: {'learning_rate': 0.9752633966433583, 'aft_loss_distribution': 'normal', 'aft_loss_distribution_scale': 1.3943407504854537, 'max_depth': 4, 'booster': 'dart', 'scale_pos_weight': 1.759890635099889, 'alpha': 0.9874363908326065, 'lambda': 2.7195065715379227, 'eta': 0.9609411699433525, 'sampling_method': 'gradient_based', 'subsample': 0.8487066684564609, 'gamma': 8.806648493320301}. Best is trial 259 with value: 2.019020864720799.
[I 2023-12-19 00:38:23,199] Trial 315 finished with value: inf and parameters: {'learning_rate': 0.9994112230469885, 'aft_loss_distribution': 'normal', 'aft_loss_distribution_scale': 1.8254238464856927, 'max_depth': 7, 'booster': 'dart', 'scale_pos_weight': 1.6139519557453583, 'alpha': 1.229094586293827, 'lambda': 2.549097692910272, 'eta': 0.9998356488753708, 'sampling_method': 'gradient_based', 'subsample': 0.9192323190313292, 'gamma': 9.444431754702748}. Best is trial 259 with value: 2.019020864720799.
[I 2023-12-19 00:38:24,616] Trial 316 finished with value: inf and parameters: {'learning_rate': 0.9534591210463893, 'aft_loss_distribution': 'normal', 'aft_loss_distribution_scale': 1.6194577700982926, 'max_depth': 3, 'booster': 'dart', 'scale_pos_weight': 1.7262610191944336, 'alpha': 0.5196778983829573, 'lambda': 2.3863314415851127, 'eta': 0.970016016461763, 'sampling_method': 'gradient_based', 'subsample': 0.7583621870444439, 'gamma': 9.156489851042002}. Best is trial 259 with value: 2.019020864720799.
[I 2023-12-19 00:38:27,092] Trial 317 finished with value: inf and parameters: {'learning_rate': 0.9783473037223849, 'aft_loss_distribution': 'normal', 'aft_loss_distribution_scale': 1.8304042720794078, 'max_depth': 3, 'booster': 'dart', 'scale_pos_weight': 1.1324160709266888, 'alpha': 3.824941985554642, 'lambda': 4.055457547984075, 'eta': 0.9537447727971486, 'sampling_method': 'gradient_based', 'subsample': 0.7935149736207419, 'gamma': 9.573189718586448}. Best is trial 259 with value: 2.019020864720799.
[I 2023-12-19 00:38:27,179] Trial 318 pruned. Trial was pruned at iteration 0.
[I 2023-12-19 00:38:27,276] Trial 319 pruned. Trial was pruned at iteration 0.
[I 2023-12-19 00:38:28,549] Trial 320 finished with value: inf and parameters: {'learning_rate': 0.9999774499359537, 'aft_loss_distribution': 'normal', 'aft_loss_distribution_scale': 1.7172850493218408, 'max_depth': 3, 'booster': 'dart', 'scale_pos_weight': 1.674455144527731, 'alpha': 1.7998603595324647, 'lambda': 3.1210416435401505, 'eta': 0.9982072779496339, 'sampling_method': 'gradient_based', 'subsample': 0.87023503573937, 'gamma': 9.788646555950322}. Best is trial 259 with value: 2.019020864720799.
[I 2023-12-19 00:38:28,632] Trial 321 pruned. Trial was pruned at iteration 0.
[I 2023-12-19 00:38:32,097] Trial 322 finished with value: 2.0190032243791824 and parameters: {'learning_rate': 0.9822863401483961, 'aft_loss_distribution': 'normal', 'aft_loss_distribution_scale': 1.493058394068275, 'max_depth': 3, 'booster': 'dart', 'scale_pos_weight': 1.1483593608658023, 'alpha': 4.020883281399691, 'lambda': 1.9979055503079164, 'eta': 0.9430637680340272, 'sampling_method': 'gradient_based', 'subsample': 0.823543510472674, 'gamma': 9.473649884043873}. Best is trial 322 with value: 2.0190032243791824.
[I 2023-12-19 00:38:32,262] Trial 323 pruned. Trial was pruned at iteration 0.
[I 2023-12-19 00:38:32,384] Trial 324 pruned. Trial was pruned at iteration 0.
[I 2023-12-19 00:38:34,134] Trial 325 finished with value: inf and parameters: {'learning_rate': 0.9784550203524902, 'aft_loss_distribution': 'normal', 'aft_loss_distribution_scale': 1.5116153938649612, 'max_depth': 3, 'booster': 'dart', 'scale_pos_weight': 1.2411171342341638, 'alpha': 9.332579133752926, 'lambda': 2.223115280751767, 'eta': 0.5763752780835469, 'sampling_method': 'gradient_based', 'subsample': 0.8487979465256842, 'gamma': 9.094368446947508}. Best is trial 322 with value: 2.0190032243791824.
[I 2023-12-19 00:38:34,284] Trial 326 pruned. Trial was pruned at iteration 0.
[I 2023-12-19 00:38:34,422] Trial 327 pruned. Trial was pruned at iteration 0.
[I 2023-12-19 00:38:34,549] Trial 328 pruned. Trial was pruned at iteration 0.
[I 2023-12-19 00:38:34,628] Trial 329 pruned. Trial was pruned at iteration 0.
[I 2023-12-19 00:38:34,711] Trial 330 pruned. Trial was pruned at iteration 0.
[I 2023-12-19 00:38:34,800] Trial 331 pruned. Trial was pruned at iteration 0.
[I 2023-12-19 00:38:34,889] Trial 332 pruned. Trial was pruned at iteration 0.
[I 2023-12-19 00:38:36,218] Trial 333 finished with value: inf and parameters: {'learning_rate': 0.9681813944453385, 'aft_loss_distribution': 'normal', 'aft_loss_distribution_scale': 1.417782825144028, 'max_depth': 3, 'booster': 'dart', 'scale_pos_weight': 1.327409369303605, 'alpha': 0.9583842805382347, 'lambda': 2.711001569518066, 'eta': 0.9170885710151723, 'sampling_method': 'gradient_based', 'subsample': 0.8423888200242059, 'gamma': 9.525531232634135}. Best is trial 322 with value: 2.0190032243791824.
[I 2023-12-19 00:38:36,307] Trial 334 pruned. Trial was pruned at iteration 0.
[I 2023-12-19 00:38:36,386] Trial 335 pruned. Trial was pruned at iteration 0.
[I 2023-12-19 00:38:36,468] Trial 336 pruned. Trial was pruned at iteration 0.
[I 2023-12-19 00:38:36,543] Trial 337 pruned. Trial was pruned at iteration 0.
[I 2023-12-19 00:38:39,333] Trial 338 finished with value: 2.0403018704925215 and parameters: {'learning_rate': 0.9999010225798933, 'aft_loss_distribution': 'normal', 'aft_loss_distribution_scale': 1.8822744503873035, 'max_depth': 3, 'booster': 'dart', 'scale_pos_weight': 1.183131492639443, 'alpha': 3.87864778342718, 'lambda': 2.533115609232114, 'eta': 0.9838081532446022, 'sampling_method': 'gradient_based', 'subsample': 0.8019339421797784, 'gamma': 9.238720495735075}. Best is trial 322 with value: 2.0190032243791824.
[I 2023-12-19 00:38:40,644] Trial 339 finished with value: inf and parameters: {'learning_rate': 0.9852795105339966, 'aft_loss_distribution': 'normal', 'aft_loss_distribution_scale': 1.8472827087499777, 'max_depth': 3, 'booster': 'dart', 'scale_pos_weight': 1.3166720407113373, 'alpha': 4.2124872245598795, 'lambda': 2.778388756999224, 'eta': 0.8866896146508111, 'sampling_method': 'gradient_based', 'subsample': 0.8548412532811086, 'gamma': 8.73014045662876}. Best is trial 322 with value: 2.0190032243791824.
[I 2023-12-19 00:38:41,919] Trial 340 finished with value: inf and parameters: {'learning_rate': 0.9993944027852213, 'aft_loss_distribution': 'normal', 'aft_loss_distribution_scale': 1.5383113648324116, 'max_depth': 3, 'booster': 'dart', 'scale_pos_weight': 0.954713890179324, 'alpha': 4.81813689384499, 'lambda': 2.5201351587447407, 'eta': 0.9267355134230182, 'sampling_method': 'gradient_based', 'subsample': 0.8907067594643374, 'gamma': 8.46688886469936}. Best is trial 322 with value: 2.0190032243791824.
[I 2023-12-19 00:38:42,006] Trial 341 pruned. Trial was pruned at iteration 0.
[I 2023-12-19 00:38:42,092] Trial 342 pruned. Trial was pruned at iteration 0.
[I 2023-12-19 00:38:43,371] Trial 343 finished with value: inf and parameters: {'learning_rate': 0.9998541926082709, 'aft_loss_distribution': 'normal', 'aft_loss_distribution_scale': 1.255243296181157, 'max_depth': 4, 'booster': 'dart', 'scale_pos_weight': 1.5049042278312563, 'alpha': 4.208312475876309, 'lambda': 2.870396022958088, 'eta': 0.1871241354785121, 'sampling_method': 'gradient_based', 'subsample': 0.7560179586818896, 'gamma': 9.281681964679827}. Best is trial 322 with value: 2.0190032243791824.
[I 2023-12-19 00:38:44,968] Trial 344 finished with value: inf and parameters: {'learning_rate': 0.9645411655199919, 'aft_loss_distribution': 'normal', 'aft_loss_distribution_scale': 1.7245068347782326, 'max_depth': 3, 'booster': 'dart', 'scale_pos_weight': 1.6229102511859883, 'alpha': 4.568652460632234, 'lambda': 2.5199912998647163, 'eta': 0.36120026029412233, 'sampling_method': 'gradient_based', 'subsample': 0.841869889744767, 'gamma': 8.90612383116811}. Best is trial 322 with value: 2.0190032243791824.
[I 2023-12-19 00:38:45,088] Trial 345 pruned. Trial was pruned at iteration 0.
[I 2023-12-19 00:38:48,575] Trial 346 finished with value: 2.018361189186848 and parameters: {'learning_rate': 0.999362464264445, 'aft_loss_distribution': 'normal', 'aft_loss_distribution_scale': 1.4673542889804378, 'max_depth': 3, 'booster': 'dart', 'scale_pos_weight': 1.3997840212889723, 'alpha': 0.39191489639088484, 'lambda': 2.2187571832506237, 'eta': 0.9090210425516442, 'sampling_method': 'gradient_based', 'subsample': 0.8058699248568889, 'gamma': 9.095989803598941}. Best is trial 346 with value: 2.018361189186848.
[I 2023-12-19 00:38:48,663] Trial 347 pruned. Trial was pruned at iteration 0.
[I 2023-12-19 00:38:50,419] Trial 348 finished with value: inf and parameters: {'learning_rate': 0.999970144773521, 'aft_loss_distribution': 'normal', 'aft_loss_distribution_scale': 1.3808607928603829, 'max_depth': 3, 'booster': 'dart', 'scale_pos_weight': 1.4997507518402127, 'alpha': 0.6063595147298325, 'lambda': 1.8049283568602987, 'eta': 0.8949324504978239, 'sampling_method': 'gradient_based', 'subsample': 0.7047560418459275, 'gamma': 9.080994937434276}. Best is trial 346 with value: 2.018361189186848.
[I 2023-12-19 00:38:53,221] Trial 349 finished with value: 2.0189663721623314 and parameters: {'learning_rate': 0.9792087019146061, 'aft_loss_distribution': 'normal', 'aft_loss_distribution_scale': 1.4951345881057065, 'max_depth': 3, 'booster': 'dart', 'scale_pos_weight': 1.3810385301010721, 'alpha': 4.377705245602475, 'lambda': 2.0995492919636614, 'eta': 0.8576239298121012, 'sampling_method': 'gradient_based', 'subsample': 0.8349467753846015, 'gamma': 8.83231507046011}. Best is trial 346 with value: 2.018361189186848.
[I 2023-12-19 00:38:53,311] Trial 350 pruned. Trial was pruned at iteration 0.
