[I 2023-12-21 04:12:52,070] Trial 447 finished with value: inf and parameters: {'learning_rate': 0.9494368877431955, 'aft_loss_distributi                                                                     on': 'normal', 'aft_loss_distribution_scale': 2.261459797890843, 'max_depth': 4, 'booster': 'gbtree', 'scale_pos_weight': 0.4802564611053                                                                     0085, 'alpha': 9.63129480785139, 'lambda': 2.208949803356825, 'eta': 0.05898814227818463, 'sampling_method': 'gradient_based', 'subsample                                                                     ': 0.12468440977677935, 'gamma': 0.7307068413564402}. Best is trial 4 with value: 2.031779433856417.
[I 2023-12-21 04:12:52,122] Trial 448 pruned. Trial was pruned at iteration 0.
[I 2023-12-21 04:12:52,258] Trial 449 finished with value: inf and parameters: {'learning_rate': 0.9776290006244289, 'aft_loss_distributi                                                                     on': 'normal', 'aft_loss_distribution_scale': 2.0098641654831764, 'max_depth': 5, 'booster': 'gbtree', 'scale_pos_weight': 2.343720579824                                                                     6143, 'alpha': 9.001633424887997, 'lambda': 1.667114396408218, 'eta': 0.3116779002794754, 'sampling_method': 'gradient_based', 'subsample                                                                     ': 0.7505135543500724, 'gamma': 6.259229220711545}. Best is trial 4 with value: 2.031779433856417.
[I 2023-12-21 04:12:52,311] Trial 450 pruned. Trial was pruned at iteration 0.
[I 2023-12-21 04:12:52,365] Trial 451 pruned. Trial was pruned at iteration 0.
[I 2023-12-21 04:12:52,418] Trial 452 pruned. Trial was pruned at iteration 0.
[I 2023-12-21 04:12:52,470] Trial 453 pruned. Trial was pruned at iteration 0.
[I 2023-12-21 04:12:52,522] Trial 454 pruned. Trial was pruned at iteration 0.
[I 2023-12-21 04:12:52,574] Trial 455 pruned. Trial was pruned at iteration 0.
[I 2023-12-21 04:12:52,627] Trial 456 pruned. Trial was pruned at iteration 0.
[I 2023-12-21 04:12:52,680] Trial 457 pruned. Trial was pruned at iteration 0.
[I 2023-12-21 04:12:52,733] Trial 458 pruned. Trial was pruned at iteration 0.
[I 2023-12-21 04:12:52,787] Trial 459 pruned. Trial was pruned at iteration 0.
[I 2023-12-21 04:12:52,840] Trial 460 pruned. Trial was pruned at iteration 0.
[I 2023-12-21 04:12:52,895] Trial 461 pruned. Trial was pruned at iteration 0.
[I 2023-12-21 04:12:52,948] Trial 462 pruned. Trial was pruned at iteration 0.
[I 2023-12-21 04:12:53,926] Trial 463 finished with value: inf and parameters: {'learning_rate': 0.9997329019269708, 'aft_loss_distributi                                                                     on': 'normal', 'aft_loss_distribution_scale': 2.4618411530752726, 'max_depth': 3, 'booster': 'dart', 'scale_pos_weight': 2.85881092260778                                                                     36, 'alpha': 9.379879280746184, 'lambda': 4.860031038784712, 'eta': 0.17513243137962525, 'sampling_method': 'uniform', 'subsample': 0.582                                                                     8876798413098, 'gamma': 5.840004735243749}. Best is trial 4 with value: 2.031779433856417.
[I 2023-12-21 04:12:53,980] Trial 464 pruned. Trial was pruned at iteration 0.
[I 2023-12-21 04:12:54,033] Trial 465 pruned. Trial was pruned at iteration 0.
[I 2023-12-21 04:12:54,087] Trial 466 pruned. Trial was pruned at iteration 0.
[I 2023-12-21 04:12:54,140] Trial 467 pruned. Trial was pruned at iteration 0.
[I 2023-12-21 04:12:54,193] Trial 468 pruned. Trial was pruned at iteration 0.
[I 2023-12-21 04:12:54,247] Trial 469 pruned. Trial was pruned at iteration 0.
[I 2023-12-21 04:12:54,309] Trial 470 pruned. Trial was pruned at iteration 0.
[I 2023-12-21 04:12:54,364] Trial 471 pruned. Trial was pruned at iteration 0.
[I 2023-12-21 04:12:54,418] Trial 472 pruned. Trial was pruned at iteration 0.
[I 2023-12-21 04:12:54,471] Trial 473 pruned. Trial was pruned at iteration 0.
[I 2023-12-21 04:12:54,525] Trial 474 pruned. Trial was pruned at iteration 0.
[I 2023-12-21 04:12:54,578] Trial 475 pruned. Trial was pruned at iteration 0.
[I 2023-12-21 04:12:54,635] Trial 476 pruned. Trial was pruned at iteration 0.
[I 2023-12-21 04:12:54,691] Trial 477 pruned. Trial was pruned at iteration 0.
[I 2023-12-21 04:12:54,744] Trial 478 pruned. Trial was pruned at iteration 0.
[I 2023-12-21 04:12:54,798] Trial 479 pruned. Trial was pruned at iteration 0.
[I 2023-12-21 04:12:54,855] Trial 480 pruned. Trial was pruned at iteration 0.
[I 2023-12-21 04:12:54,909] Trial 481 pruned. Trial was pruned at iteration 0.
[I 2023-12-21 04:12:54,963] Trial 482 pruned. Trial was pruned at iteration 0.
[I 2023-12-21 04:12:55,019] Trial 483 pruned. Trial was pruned at iteration 0.
[I 2023-12-21 04:12:55,073] Trial 484 pruned. Trial was pruned at iteration 0.
[I 2023-12-21 04:12:55,128] Trial 485 pruned. Trial was pruned at iteration 0.
[I 2023-12-21 04:12:55,182] Trial 486 pruned. Trial was pruned at iteration 0.
[I 2023-12-21 04:12:55,237] Trial 487 pruned. Trial was pruned at iteration 0.
[I 2023-12-21 04:12:55,291] Trial 488 pruned. Trial was pruned at iteration 0.
[I 2023-12-21 04:12:55,349] Trial 489 pruned. Trial was pruned at iteration 0.
[I 2023-12-21 04:12:55,405] Trial 490 pruned. Trial was pruned at iteration 0.
[I 2023-12-21 04:12:55,460] Trial 491 pruned. Trial was pruned at iteration 0.
[I 2023-12-21 04:12:55,515] Trial 492 pruned. Trial was pruned at iteration 0.
[I 2023-12-21 04:12:55,570] Trial 493 pruned. Trial was pruned at iteration 0.
[I 2023-12-21 04:12:55,624] Trial 494 pruned. Trial was pruned at iteration 0.
[I 2023-12-21 04:12:55,679] Trial 495 pruned. Trial was pruned at iteration 0.
[I 2023-12-21 04:12:55,735] Trial 496 pruned. Trial was pruned at iteration 0.
[I 2023-12-21 04:12:55,792] Trial 497 pruned. Trial was pruned at iteration 0.
[I 2023-12-21 04:12:55,847] Trial 498 pruned. Trial was pruned at iteration 0.
[I 2023-12-21 04:12:55,901] Trial 499 pruned. Trial was pruned at iteration 0.
[W 2023-12-21 04:13:02,858] Trial 0 is omitted in visualization because its objective value is inf or nan.
[W 2023-12-21 04:13:02,858] Trial 2 is omitted in visualization because its objective value is inf or nan.
[W 2023-12-21 04:13:02,858] Trial 7 is omitted in visualization because its objective value is inf or nan.
[W 2023-12-21 04:13:02,858] Trial 32 is omitted in visualization because its objective value is inf or nan.
[W 2023-12-21 04:13:02,858] Trial 33 is omitted in visualization because its objective value is inf or nan.
[W 2023-12-21 04:13:02,858] Trial 58 is omitted in visualization because its objective value is inf or nan.
[W 2023-12-21 04:13:02,858] Trial 61 is omitted in visualization because its objective value is inf or nan.
[W 2023-12-21 04:13:02,858] Trial 63 is omitted in visualization because its objective value is inf or nan.
[W 2023-12-21 04:13:02,858] Trial 64 is omitted in visualization because its objective value is inf or nan.
[W 2023-12-21 04:13:02,858] Trial 72 is omitted in visualization because its objective value is inf or nan.
[W 2023-12-21 04:13:02,858] Trial 73 is omitted in visualization because its objective value is inf or nan.
[W 2023-12-21 04:13:02,859] Trial 75 is omitted in visualization because its objective value is inf or nan.
[W 2023-12-21 04:13:02,859] Trial 87 is omitted in visualization because its objective value is inf or nan.
[W 2023-12-21 04:13:02,859] Trial 94 is omitted in visualization because its objective value is inf or nan.
[W 2023-12-21 04:13:02,859] Trial 102 is omitted in visualization because its objective value is inf or nan.
[W 2023-12-21 04:13:02,859] Trial 114 is omitted in visualization because its objective value is inf or nan.
[W 2023-12-21 04:13:02,859] Trial 121 is omitted in visualization because its objective value is inf or nan.
[W 2023-12-21 04:13:02,859] Trial 123 is omitted in visualization because its objective value is inf or nan.
[W 2023-12-21 04:13:02,859] Trial 125 is omitted in visualization because its objective value is inf or nan.
[W 2023-12-21 04:13:02,859] Trial 128 is omitted in visualization because its objective value is inf or nan.
[W 2023-12-21 04:13:02,859] Trial 130 is omitted in visualization because its objective value is inf or nan.
[W 2023-12-21 04:13:02,859] Trial 131 is omitted in visualization because its objective value is inf or nan.
[W 2023-12-21 04:13:02,859] Trial 134 is omitted in visualization because its objective value is inf or nan.
[W 2023-12-21 04:13:02,859] Trial 139 is omitted in visualization because its objective value is inf or nan.
[W 2023-12-21 04:13:02,859] Trial 141 is omitted in visualization because its objective value is inf or nan.
[W 2023-12-21 04:13:02,859] Trial 142 is omitted in visualization because its objective value is inf or nan.
[W 2023-12-21 04:13:02,859] Trial 143 is omitted in visualization because its objective value is inf or nan.
[W 2023-12-21 04:13:02,859] Trial 144 is omitted in visualization because its objective value is inf or nan.
[W 2023-12-21 04:13:02,859] Trial 146 is omitted in visualization because its objective value is inf or nan.
[W 2023-12-21 04:13:02,860] Trial 151 is omitted in visualization because its objective value is inf or nan.
[W 2023-12-21 04:13:02,860] Trial 155 is omitted in visualization because its objective value is inf or nan.
[W 2023-12-21 04:13:02,860] Trial 162 is omitted in visualization because its objective value is inf or nan.
[W 2023-12-21 04:13:02,860] Trial 164 is omitted in visualization because its objective value is inf or nan.
[W 2023-12-21 04:13:02,860] Trial 197 is omitted in visualization because its objective value is inf or nan.
[W 2023-12-21 04:13:02,860] Trial 201 is omitted in visualization because its objective value is inf or nan.
[W 2023-12-21 04:13:02,860] Trial 204 is omitted in visualization because its objective value is inf or nan.
[W 2023-12-21 04:13:02,860] Trial 206 is omitted in visualization because its objective value is inf or nan.
[W 2023-12-21 04:13:02,860] Trial 211 is omitted in visualization because its objective value is inf or nan.
[W 2023-12-21 04:13:02,860] Trial 212 is omitted in visualization because its objective value is inf or nan.
[W 2023-12-21 04:13:02,860] Trial 214 is omitted in visualization because its objective value is inf or nan.
[W 2023-12-21 04:13:02,860] Trial 215 is omitted in visualization because its objective value is inf or nan.
[W 2023-12-21 04:13:02,860] Trial 217 is omitted in visualization because its objective value is inf or nan.
[W 2023-12-21 04:13:02,860] Trial 231 is omitted in visualization because its objective value is inf or nan.
[W 2023-12-21 04:13:02,860] Trial 233 is omitted in visualization because its objective value is inf or nan.
[W 2023-12-21 04:13:02,860] Trial 235 is omitted in visualization because its objective value is inf or nan.
[W 2023-12-21 04:13:02,860] Trial 243 is omitted in visualization because its objective value is inf or nan.
[W 2023-12-21 04:13:02,860] Trial 250 is omitted in visualization because its objective value is inf or nan.
[W 2023-12-21 04:13:02,860] Trial 252 is omitted in visualization because its objective value is inf or nan.
[W 2023-12-21 04:13:02,860] Trial 259 is omitted in visualization because its objective value is inf or nan.
[W 2023-12-21 04:13:02,860] Trial 268 is omitted in visualization because its objective value is inf or nan.
[W 2023-12-21 04:13:02,860] Trial 291 is omitted in visualization because its objective value is inf or nan.
[W 2023-12-21 04:13:02,861] Trial 294 is omitted in visualization because its objective value is inf or nan.
[W 2023-12-21 04:13:02,861] Trial 300 is omitted in visualization because its objective value is inf or nan.
[W 2023-12-21 04:13:02,861] Trial 327 is omitted in visualization because its objective value is inf or nan.
[W 2023-12-21 04:13:02,861] Trial 333 is omitted in visualization because its objective value is inf or nan.
[W 2023-12-21 04:13:02,861] Trial 335 is omitted in visualization because its objective value is inf or nan.
[W 2023-12-21 04:13:02,861] Trial 345 is omitted in visualization because its objective value is inf or nan.
[W 2023-12-21 04:13:02,861] Trial 356 is omitted in visualization because its objective value is inf or nan.
[W 2023-12-21 04:13:02,861] Trial 358 is omitted in visualization because its objective value is inf or nan.
[W 2023-12-21 04:13:02,861] Trial 363 is omitted in visualization because its objective value is inf or nan.
[W 2023-12-21 04:13:02,861] Trial 404 is omitted in visualization because its objective value is inf or nan.
[W 2023-12-21 04:13:02,861] Trial 416 is omitted in visualization because its objective value is inf or nan.
[W 2023-12-21 04:13:02,861] Trial 423 is omitted in visualization because its objective value is inf or nan.
[W 2023-12-21 04:13:02,861] Trial 429 is omitted in visualization because its objective value is inf or nan.
[W 2023-12-21 04:13:02,861] Trial 447 is omitted in visualization because its objective value is inf or nan.
[W 2023-12-21 04:13:02,861] Trial 449 is omitted in visualization because its objective value is inf or nan.
[W 2023-12-21 04:13:02,861] Trial 463 is omitted in visualization because its objective value is inf or nan.
exo-open: Cannot open display: .
/cvmfs/soft.computecanada.ca/gentoo/2020/usr/bin/xdg-open: line 871: x-www-browser: command not found
/cvmfs/soft.computecanada.ca/gentoo/2020/usr/bin/xdg-open: line 871: firefox: command not found
/cvmfs/soft.computecanada.ca/gentoo/2020/usr/bin/xdg-open: line 871: iceweasel: command not found
/cvmfs/soft.computecanada.ca/gentoo/2020/usr/bin/xdg-open: line 871: seamonkey: command not found
/cvmfs/soft.computecanada.ca/gentoo/2020/usr/bin/xdg-open: line 871: mozilla: command not found
/cvmfs/soft.computecanada.ca/gentoo/2020/usr/bin/xdg-open: line 871: epiphany: command not found
/cvmfs/soft.computecanada.ca/gentoo/2020/usr/bin/xdg-open: line 871: konqueror: command not found
/cvmfs/soft.computecanada.ca/gentoo/2020/usr/bin/xdg-open: line 871: chromium: command not found
/cvmfs/soft.computecanada.ca/gentoo/2020/usr/bin/xdg-open: line 871: chromium-browser: command not found
/cvmfs/soft.computecanada.ca/gentoo/2020/usr/bin/xdg-open: line 871: google-chrome: command not found
/cvmfs/soft.computecanada.ca/gentoo/2020/usr/bin/xdg-open: line 871: www-browser: command not found
/cvmfs/soft.computecanada.ca/gentoo/2020/usr/bin/xdg-open: line 871: links2: command not found
/home/lisat/.local/lib/python3.10/site-packages/xgboost/data.py:440: FutureWarning:

is_sparse is deprecated and will be removed in a future version. Check `isinstance(dtype, pd.SparseDtype)` instead.

[I 2023-12-21 04:13:08,310] A new study created in memory with name: no-name-fef83fee-8d3e-4e13-a6c0-a9437911f68a
[I 2023-12-21 04:13:08,444] Trial 0 finished with value: 2.652461963144609 and parameters: {'learning_rate': 0.945258445927365, 'aft_loss                                                                     _distribution': 'extreme', 'aft_loss_distribution_scale': 9.233757426459587, 'max_depth': 7, 'booster': 'gbtree', 'scale_pos_weight': 1.9                                                                     190657080085607, 'alpha': 9.03554123508706, 'lambda': 4.894461280871255, 'eta': 0.5536558114335882, 'sampling_method': 'gradient_based',                                                                      'subsample': 0.5245528409203293, 'gamma': 8.887456550158687}. Best is trial 0 with value: 2.652461963144609.
[I 2023-12-21 04:13:09,961] Trial 1 finished with value: inf and parameters: {'learning_rate': 0.321304924438057, 'aft_loss_distribution'                                                                     : 'normal', 'aft_loss_distribution_scale': 3.0131981587823464, 'max_depth': 5, 'booster': 'dart', 'scale_pos_weight': 0.10132316899619866                                                                     , 'alpha': 2.073744285164783, 'lambda': 6.086238697779985, 'eta': 0.871505758967176, 'sampling_method': 'gradient_based', 'subsample': 0.                                                                     6838471419768681, 'gamma': 2.3174400553447114}. Best is trial 0 with value: 2.652461963144609.
[I 2023-12-21 04:13:10,292] Trial 2 finished with value: 2.512526849083474 and parameters: {'learning_rate': 0.09124214652644903, 'aft_lo                                                                     ss_distribution': 'logistic', 'aft_loss_distribution_scale': 5.257630418131408, 'max_depth': 8, 'booster': 'gbtree', 'scale_pos_weight':                                                                      3.163575337008672, 'alpha': 4.720647229131206, 'lambda': 8.228564105174161, 'eta': 0.6609869757702754, 'sampling_method': 'uniform', 'sub                                                                     sample': 0.24199468250995693, 'gamma': 4.215585819063974}. Best is trial 2 with value: 2.512526849083474.
[I 2023-12-21 04:13:11,905] Trial 3 finished with value: inf and parameters: {'learning_rate': 0.23583916604538402, 'aft_loss_distributio                                                                     n': 'logistic', 'aft_loss_distribution_scale': 7.796409684855817, 'max_depth': 7, 'booster': 'dart', 'scale_pos_weight': 0.21466978251005                                                                     336, 'alpha': 1.8918025164903982, 'lambda': 5.459935944127457, 'eta': 0.016389428013778518, 'sampling_method': 'gradient_based', 'subsamp                                                                     le': 0.0791898513852761, 'gamma': 7.384476507563492}. Best is trial 2 with value: 2.512526849083474.
[I 2023-12-21 04:13:40,586] Trial 4 finished with value: 3.008671263408784 and parameters: {'learning_rate': 0.051702427755543255, 'aft_l                                                                     oss_distribution': 'logistic', 'aft_loss_distribution_scale': 0.48354887079363496, 'max_depth': 9, 'booster': 'dart', 'scale_pos_weight':                                                                      2.7954228956107112, 'alpha': 3.431420315629275, 'lambda': 9.353796284134756, 'eta': 0.6515419774405656, 'sampling_method': 'gradient_bas                                                                     ed', 'subsample': 0.428433252790756, 'gamma': 3.8044381855623297}. Best is trial 2 with value: 2.512526849083474.
[I 2023-12-21 04:13:40,592] Trial 5 pruned. Trial was pruned at iteration 0.
[I 2023-12-21 04:13:40,676] Trial 6 finished with value: inf and parameters: {'learning_rate': 0.5755740524451631, 'aft_loss_distribution                                                                     ': 'normal', 'aft_loss_distribution_scale': 2.9473801660946735, 'max_depth': 3, 'booster': 'gbtree', 'scale_pos_weight': 0.07524748713113                                                                     118, 'alpha': 6.564671963594192, 'lambda': 6.154991821263075, 'eta': 0.8906388616380687, 'sampling_method': 'uniform', 'subsample': 0.126                                                                     14592699091323, 'gamma': 7.2114637574340055}. Best is trial 2 with value: 2.512526849083474.
[I 2023-12-21 04:13:40,680] Trial 7 pruned. Trial was pruned at iteration 0.
[I 2023-12-21 04:13:40,685] Trial 8 pruned. Trial was pruned at iteration 0.
[I 2023-12-21 04:13:41,659] Trial 9 finished with value: inf and parameters: {'learning_rate': 0.931346849565769, 'aft_loss_distribution'                                                                     : 'normal', 'aft_loss_distribution_scale': 4.560058097250427, 'max_depth': 6, 'booster': 'dart', 'scale_pos_weight': 1.4081578004287467,                                                                      'alpha': 0.5423358433488397, 'lambda': 8.524055188419238, 'eta': 0.22663276525803555, 'sampling_method': 'gradient_based', 'subsample': 0                                                                     .7757661005952818, 'gamma': 0.11898395721488433}. Best is trial 2 with value: 2.512526849083474.
[I 2023-12-21 04:13:41,688] Trial 10 pruned. Trial was pruned at iteration 0.
[I 2023-12-21 04:13:41,717] Trial 11 pruned. Trial was pruned at iteration 1.
[I 2023-12-21 04:13:41,769] Trial 12 pruned. Trial was pruned at iteration 24.
[I 2023-12-21 04:13:41,829] Trial 13 pruned. Trial was pruned at iteration 13.
[I 2023-12-21 04:13:41,858] Trial 14 pruned. Trial was pruned at iteration 0.
[I 2023-12-21 04:13:41,890] Trial 15 pruned. Trial was pruned at iteration 1.
[I 2023-12-21 04:13:41,920] Trial 16 pruned. Trial was pruned at iteration 0.
[I 2023-12-21 04:13:41,950] Trial 17 pruned. Trial was pruned at iteration 1.
[I 2023-12-21 04:13:41,996] Trial 18 pruned. Trial was pruned at iteration 15.
[I 2023-12-21 04:13:42,025] Trial 19 pruned. Trial was pruned at iteration 0.
[I 2023-12-21 04:13:42,054] Trial 20 pruned. Trial was pruned at iteration 0.
[I 2023-12-21 04:13:42,088] Trial 21 pruned. Trial was pruned at iteration 0.
[I 2023-12-21 04:13:42,119] Trial 22 pruned. Trial was pruned at iteration 0.
[I 2023-12-21 04:13:42,149] Trial 23 pruned. Trial was pruned at iteration 0.
[I 2023-12-21 04:13:42,185] Trial 24 pruned. Trial was pruned at iteration 0.
[I 2023-12-21 04:13:42,214] Trial 25 pruned. Trial was pruned at iteration 0.
[I 2023-12-21 04:13:42,244] Trial 26 pruned. Trial was pruned at iteration 0.
