[I 2023-12-21 04:03:17,960] Trial 437 finished with value: 4.273716938241373 and parameters: {'learning_rate': 0.900662232581484, 'aft_lo                                                                     ss_distribution': 'normal', 'aft_loss_distribution_scale': 1.1688684395490478, 'max_depth': 7, 'booster': 'gbtree', 'scale_pos_weight': 4                                                                     .736929556808777, 'alpha': 3.0774563109150765, 'lambda': 8.471920319050424, 'eta': 0.9081042346105227, 'sampling_method': 'gradient_based                                                                     ', 'subsample': 0.778055431993733, 'gamma': 5.224101213493589}. Best is trial 84 with value: 4.259518710902867.
[I 2023-12-21 04:03:18,079] Trial 438 finished with value: inf and parameters: {'learning_rate': 0.9170822125947388, 'aft_loss_distributi                                                                     on': 'normal', 'aft_loss_distribution_scale': 1.1031752346175618, 'max_depth': 7, 'booster': 'gbtree', 'scale_pos_weight': 5.214866962043                                                                     639, 'alpha': 3.21944312985164, 'lambda': 3.551149397001336, 'eta': 0.905905816819756, 'sampling_method': 'gradient_based', 'subsample':                                                                      0.9418427180291912, 'gamma': 5.242811676219601}. Best is trial 84 with value: 4.259518710902867.
[I 2023-12-21 04:03:18,129] Trial 439 pruned. Trial was pruned at iteration 0.
[I 2023-12-21 04:03:18,178] Trial 440 pruned. Trial was pruned at iteration 0.
[I 2023-12-21 04:03:18,231] Trial 441 pruned. Trial was pruned at iteration 1.
[I 2023-12-21 04:03:18,286] Trial 442 pruned. Trial was pruned at iteration 0.
[I 2023-12-21 04:03:18,336] Trial 443 pruned. Trial was pruned at iteration 0.
[I 2023-12-21 04:03:18,387] Trial 444 pruned. Trial was pruned at iteration 1.
[I 2023-12-21 04:03:18,436] Trial 445 pruned. Trial was pruned at iteration 0.
[I 2023-12-21 04:03:18,556] Trial 446 finished with value: inf and parameters: {'learning_rate': 0.9782287784145768, 'aft_loss_distributi                                                                     on': 'normal', 'aft_loss_distribution_scale': 0.9704313709941446, 'max_depth': 7, 'booster': 'gbtree', 'scale_pos_weight': 4.231332540024                                                                     2014, 'alpha': 1.9275746861973866, 'lambda': 8.323985191598776, 'eta': 0.9605057361043944, 'sampling_method': 'gradient_based', 'subsampl                                                                     e': 0.959363377012673, 'gamma': 5.150341008375184}. Best is trial 84 with value: 4.259518710902867.
[I 2023-12-21 04:03:18,606] Trial 447 pruned. Trial was pruned at iteration 0.
[I 2023-12-21 04:03:18,655] Trial 448 pruned. Trial was pruned at iteration 0.
[I 2023-12-21 04:03:18,717] Trial 449 pruned. Trial was pruned at iteration 0.
[I 2023-12-21 04:03:18,767] Trial 450 pruned. Trial was pruned at iteration 0.
[I 2023-12-21 04:03:18,821] Trial 451 pruned. Trial was pruned at iteration 1.
[I 2023-12-21 04:03:18,871] Trial 452 pruned. Trial was pruned at iteration 0.
[I 2023-12-21 04:03:18,922] Trial 453 pruned. Trial was pruned at iteration 1.
[I 2023-12-21 04:03:19,146] Trial 454 finished with value: 4.261713912764322 and parameters: {'learning_rate': 0.8890733732727497, 'aft_l                                                                     oss_distribution': 'normal', 'aft_loss_distribution_scale': 1.0742245292365002, 'max_depth': 6, 'booster': 'gbtree', 'scale_pos_weight':                                                                      4.541931676775964, 'alpha': 5.14586775224562, 'lambda': 7.486440681807334, 'eta': 0.8679527379951583, 'sampling_method': 'gradient_based'                                                                     , 'subsample': 0.8721359485948201, 'gamma': 7.99465946666819}. Best is trial 84 with value: 4.259518710902867.
[I 2023-12-21 04:03:19,196] Trial 455 pruned. Trial was pruned at iteration 0.
[I 2023-12-21 04:03:19,349] Trial 456 finished with value: 4.264581086051086 and parameters: {'learning_rate': 0.8840514698819542, 'aft_l                                                                     oss_distribution': 'normal', 'aft_loss_distribution_scale': 1.0372208131062215, 'max_depth': 6, 'booster': 'gbtree', 'scale_pos_weight':                                                                      4.573195032763661, 'alpha': 5.091574675732192, 'lambda': 7.477520886066381, 'eta': 0.32553917611621597, 'sampling_method': 'gradient_base                                                                     d', 'subsample': 0.8216488405596047, 'gamma': 8.128918291547398}. Best is trial 84 with value: 4.259518710902867.
[I 2023-12-21 04:03:19,401] Trial 457 pruned. Trial was pruned at iteration 0.
[I 2023-12-21 04:03:19,450] Trial 458 pruned. Trial was pruned at iteration 0.
[I 2023-12-21 04:03:19,500] Trial 459 pruned. Trial was pruned at iteration 0.
[I 2023-12-21 04:03:19,550] Trial 460 pruned. Trial was pruned at iteration 0.
[I 2023-12-21 04:03:20,567] Trial 461 finished with value: inf and parameters: {'learning_rate': 0.8699641055666433, 'aft_loss_distributi                                                                     on': 'normal', 'aft_loss_distribution_scale': 1.0726203507013903, 'max_depth': 6, 'booster': 'dart', 'scale_pos_weight': 4.92421049427857                                                                     05, 'alpha': 5.092162228968872, 'lambda': 7.575920008149566, 'eta': 0.18351335019788914, 'sampling_method': 'gradient_based', 'subsample'                                                                     : 0.8723465048019287, 'gamma': 1.236723794611434}. Best is trial 84 with value: 4.259518710902867.
[I 2023-12-21 04:03:20,686] Trial 462 finished with value: inf and parameters: {'learning_rate': 0.9453251777650566, 'aft_loss_distributi                                                                     on': 'normal', 'aft_loss_distribution_scale': 0.9591122795441027, 'max_depth': 6, 'booster': 'gbtree', 'scale_pos_weight': 5.287132234418                                                                     6185, 'alpha': 3.3721136779391436, 'lambda': 2.235160929077551, 'eta': 0.903159110437615, 'sampling_method': 'gradient_based', 'subsample                                                                     ': 0.7675976488420357, 'gamma': 8.139529621112018}. Best is trial 84 with value: 4.259518710902867.
[I 2023-12-21 04:03:20,736] Trial 463 pruned. Trial was pruned at iteration 0.
[I 2023-12-21 04:03:20,788] Trial 464 pruned. Trial was pruned at iteration 0.
[I 2023-12-21 04:03:20,838] Trial 465 pruned. Trial was pruned at iteration 0.
[I 2023-12-21 04:03:20,972] Trial 466 finished with value: inf and parameters: {'learning_rate': 0.8987422456859352, 'aft_loss_distributi                                                                     on': 'normal', 'aft_loss_distribution_scale': 1.132060024929961, 'max_depth': 6, 'booster': 'gbtree', 'scale_pos_weight': 4.8619300385852                                                                     58, 'alpha': 5.078999607042245, 'lambda': 0.6539711020367717, 'eta': 0.8677466510519384, 'sampling_method': 'gradient_based', 'subsample'                                                                     : 0.4844789027554568, 'gamma': 8.615749885765988}. Best is trial 84 with value: 4.259518710902867.
[I 2023-12-21 04:03:21,023] Trial 467 pruned. Trial was pruned at iteration 0.
[I 2023-12-21 04:03:21,074] Trial 468 pruned. Trial was pruned at iteration 1.
[I 2023-12-21 04:03:21,125] Trial 469 pruned. Trial was pruned at iteration 0.
[I 2023-12-21 04:03:21,175] Trial 470 pruned. Trial was pruned at iteration 0.
[I 2023-12-21 04:03:21,231] Trial 471 pruned. Trial was pruned at iteration 0.
[I 2023-12-21 04:03:21,282] Trial 472 pruned. Trial was pruned at iteration 0.
[I 2023-12-21 04:03:21,334] Trial 473 pruned. Trial was pruned at iteration 0.
[I 2023-12-21 04:03:21,384] Trial 474 pruned. Trial was pruned at iteration 0.
[I 2023-12-21 04:03:21,435] Trial 475 pruned. Trial was pruned at iteration 0.
[I 2023-12-21 04:03:21,485] Trial 476 pruned. Trial was pruned at iteration 0.
[I 2023-12-21 04:03:21,536] Trial 477 pruned. Trial was pruned at iteration 0.
[I 2023-12-21 04:03:21,589] Trial 478 pruned. Trial was pruned at iteration 0.
[I 2023-12-21 04:03:21,644] Trial 479 pruned. Trial was pruned at iteration 1.
[I 2023-12-21 04:03:21,695] Trial 480 pruned. Trial was pruned at iteration 0.
[I 2023-12-21 04:03:21,746] Trial 481 pruned. Trial was pruned at iteration 0.
[I 2023-12-21 04:03:21,797] Trial 482 pruned. Trial was pruned at iteration 0.
[I 2023-12-21 04:03:22,001] Trial 483 finished with value: 4.271154743257258 and parameters: {'learning_rate': 0.8600877328084386, 'aft_l                                                                     oss_distribution': 'normal', 'aft_loss_distribution_scale': 1.1784538137456082, 'max_depth': 5, 'booster': 'gbtree', 'scale_pos_weight':                                                                      4.300569078007045, 'alpha': 5.680188773161098, 'lambda': 8.474357776575971, 'eta': 0.9985537429847828, 'sampling_method': 'gradient_based                                                                     ', 'subsample': 0.8988830939669267, 'gamma': 8.034477581267703}. Best is trial 84 with value: 4.259518710902867.
[I 2023-12-21 04:03:22,054] Trial 484 pruned. Trial was pruned at iteration 0.
[I 2023-12-21 04:03:22,105] Trial 485 pruned. Trial was pruned at iteration 0.
[I 2023-12-21 04:03:22,157] Trial 486 pruned. Trial was pruned at iteration 0.
[I 2023-12-21 04:03:22,372] Trial 487 finished with value: 4.26788649393197 and parameters: {'learning_rate': 0.862385028123393, 'aft_los                                                                     s_distribution': 'normal', 'aft_loss_distribution_scale': 1.1579856076321324, 'max_depth': 5, 'booster': 'gbtree', 'scale_pos_weight': 4.                                                                     305971283980246, 'alpha': 5.501474842607877, 'lambda': 9.183782238970979, 'eta': 0.995552464991758, 'sampling_method': 'gradient_based',                                                                      'subsample': 0.8964705055722582, 'gamma': 7.711188794583407}. Best is trial 84 with value: 4.259518710902867.
[I 2023-12-21 04:03:22,423] Trial 488 pruned. Trial was pruned at iteration 0.
[I 2023-12-21 04:03:22,475] Trial 489 pruned. Trial was pruned at iteration 0.
[I 2023-12-21 04:03:22,608] Trial 490 finished with value: inf and parameters: {'learning_rate': 0.8892433059533106, 'aft_loss_distributi                                                                     on': 'normal', 'aft_loss_distribution_scale': 1.1313703744918686, 'max_depth': 5, 'booster': 'gbtree', 'scale_pos_weight': 4.091331828881                                                                     6924, 'alpha': 5.410606086965054, 'lambda': 9.176269507272803, 'eta': 0.9953440830115063, 'sampling_method': 'gradient_based', 'subsample                                                                     ': 0.8514763506465649, 'gamma': 7.8036234029254965}. Best is trial 84 with value: 4.259518710902867.
[I 2023-12-21 04:03:22,659] Trial 491 pruned. Trial was pruned at iteration 0.
[I 2023-12-21 04:03:22,715] Trial 492 pruned. Trial was pruned at iteration 2.
[I 2023-12-21 04:03:22,918] Trial 493 finished with value: 4.262515128185691 and parameters: {'learning_rate': 0.9066072004865148, 'aft_l                                                                     oss_distribution': 'normal', 'aft_loss_distribution_scale': 1.032661653933252, 'max_depth': 5, 'booster': 'gbtree', 'scale_pos_weight': 4                                                                     .416095829263878, 'alpha': 6.072092799158612, 'lambda': 9.071287363605324, 'eta': 0.9632686500557783, 'sampling_method': 'gradient_based'                                                                     , 'subsample': 0.866349945412282, 'gamma': 7.749317844606191}. Best is trial 84 with value: 4.259518710902867.
[I 2023-12-21 04:03:22,970] Trial 494 pruned. Trial was pruned at iteration 0.
[I 2023-12-21 04:03:23,230] Trial 495 finished with value: 4.2724428766683875 and parameters: {'learning_rate': 0.9076367675982733, 'aft_                                                                     loss_distribution': 'normal', 'aft_loss_distribution_scale': 0.9586340409254013, 'max_depth': 5, 'booster': 'gbtree', 'scale_pos_weight':                                                                      6.118002795632243, 'alpha': 6.293963038828858, 'lambda': 9.023406048121775, 'eta': 0.9722781517933772, 'sampling_method': 'gradient_base                                                                     d', 'subsample': 0.8532055335527396, 'gamma': 7.561879318963766}. Best is trial 84 with value: 4.259518710902867.
[I 2023-12-21 04:03:23,281] Trial 496 pruned. Trial was pruned at iteration 0.
[I 2023-12-21 04:03:23,335] Trial 497 pruned. Trial was pruned at iteration 0.
[I 2023-12-21 04:03:23,387] Trial 498 pruned. Trial was pruned at iteration 0.
