[I 2023-12-19 04:51:13,711] Trial 2 finished with value: inf and parameters: {'learning_rate': 0.7160247307144988, 'aft_loss_distribution': 'logistic', 'aft_loss_distribution_scale': 9.578007872732833, 'max_depth': 7, 'booster': 'dart', 'scale_pos_weight': 6.566060779178284, 'alpha': 8.429686627366108, 'lambda': 0.09499157869766567, 'eta': 0.16959147247469475, 'sampling_method': 'uniform', 'subsample': 0.38995555344738875, 'gamma': 9.146505852525829}. Best is trial 0 with value: 5.527101518315428.
[I 2023-12-19 04:51:19,045] Trial 3 finished with value: 5.414266633403915 and parameters: {'learning_rate': 0.7626270255984863, 'aft_loss_distribution': 'logistic', 'aft_loss_distribution_scale': 3.6277565107226337, 'max_depth': 5, 'booster': 'dart', 'scale_pos_weight': 5.786239208548537, 'alpha': 7.445266922293643, 'lambda': 3.571536191525315, 'eta': 0.30564071699763495, 'sampling_method': 'uniform', 'subsample': 0.9393128892242584, 'gamma': 5.537532052151883}. Best is trial 3 with value: 5.414266633403915.
[I 2023-12-19 04:52:06,289] Trial 4 finished with value: 5.862966266535721 and parameters: {'learning_rate': 0.33711133091192585, 'aft_loss_distribution': 'extreme', 'aft_loss_distribution_scale': 8.52400051661104, 'max_depth': 8, 'booster': 'dart', 'scale_pos_weight': 2.633027418789853, 'alpha': 3.461086453594025, 'lambda': 2.4854794020443296, 'eta': 0.6141608178363773, 'sampling_method': 'uniform', 'subsample': 0.02731487606366511, 'gamma': 4.55859730188105}. Best is trial 3 with value: 5.414266633403915.
[I 2023-12-19 04:52:06,308] Trial 5 pruned. Trial was pruned at iteration 0.
[I 2023-12-19 04:52:06,525] Trial 6 finished with value: inf and parameters: {'learning_rate': 0.9582430201149124, 'aft_loss_distribution': 'normal', 'aft_loss_distribution_scale': 3.7030148101965192, 'max_depth': 8, 'booster': 'gbtree', 'scale_pos_weight': 6.903115487600515, 'alpha': 7.05203129977784, 'lambda': 9.626827051815251, 'eta': 0.4593341017227288, 'sampling_method': 'uniform', 'subsample': 0.9093996350400074, 'gamma': 1.441208553607177}. Best is trial 3 with value: 5.414266633403915.
[I 2023-12-19 04:52:06,545] Trial 7 pruned. Trial was pruned at iteration 0.
[I 2023-12-19 04:52:07,192] Trial 8 finished with value: 4.794777898234363 and parameters: {'learning_rate': 0.3734072725353951, 'aft_loss_distribution': 'logistic', 'aft_loss_distribution_scale': 1.7827049779004516, 'max_depth': 4, 'booster': 'gbtree', 'scale_pos_weight': 8.552070078074593, 'alpha': 2.4458207512557757, 'lambda': 5.833620995031893, 'eta': 0.6954229971166432, 'sampling_method': 'uniform', 'subsample': 0.30104547197472026, 'gamma': 2.5561791637107185}. Best is trial 8 with value: 4.794777898234363.
[I 2023-12-19 04:52:07,211] Trial 9 pruned. Trial was pruned at iteration 0.
[I 2023-12-19 04:52:07,333] Trial 10 pruned. Trial was pruned at iteration 0.
[I 2023-12-19 04:52:09,524] Trial 11 finished with value: 4.7847613622913014 and parameters: {'learning_rate': 0.6828974112338844, 'aft_loss_distribution': 'logistic', 'aft_loss_distribution_scale': 1.7619883075567357, 'max_depth': 3, 'booster': 'gbtree', 'scale_pos_weight': 4.010360926570084, 'alpha': 1.025345827503094, 'lambda': 7.320024123889739, 'eta': 0.01816303307057343, 'sampling_method': 'uniform', 'subsample': 0.6015463783876084, 'gamma': 2.8860919968078043}. Best is trial 11 with value: 4.7847613622913014.
[I 2023-12-19 04:52:10,850] Trial 12 finished with value: inf and parameters: {'learning_rate': 0.5624553957632431, 'aft_loss_distribution': 'logistic', 'aft_loss_distribution_scale': 1.2561408217010892, 'max_depth': 3, 'booster': 'gbtree', 'scale_pos_weight': 3.7328861743593444, 'alpha': 0.5273606846187868, 'lambda': 8.000407432700882, 'eta': 0.008231124366507678, 'sampling_method': 'uniform', 'subsample': 0.542250654085431, 'gamma': 2.4857963670751726}. Best is trial 11 with value: 4.7847613622913014.
[I 2023-12-19 04:52:12,523] Trial 13 finished with value: 4.945927589792087 and parameters: {'learning_rate': 0.5210186986997466, 'aft_loss_distribution': 'logistic', 'aft_loss_distribution_scale': 2.138491750384933, 'max_depth': 4, 'booster': 'gbtree', 'scale_pos_weight': 4.4099482788041104, 'alpha': 2.198987807583573, 'lambda': 5.830430024912314, 'eta': 0.9382891867041981, 'sampling_method': 'uniform', 'subsample': 0.6981365235544295, 'gamma': 2.791958878315225}. Best is trial 11 with value: 4.7847613622913014.
[I 2023-12-19 04:52:14,245] Trial 14 finished with value: 4.8721316074366925 and parameters: {'learning_rate': 0.9311700925705847, 'aft_loss_distribution': 'logistic', 'aft_loss_distribution_scale': 1.9585362602872975, 'max_depth': 4, 'booster': 'gbtree', 'scale_pos_weight': 9.36787662479629, 'alpha': 2.020081442164401, 'lambda': 8.195672586798304, 'eta': 0.000728789131375987, 'sampling_method': 'uniform', 'subsample': 0.25385309169070175, 'gamma': 2.4687119111170652}. Best is trial 11 with value: 4.7847613622913014.
[I 2023-12-19 04:52:14,391] Trial 15 pruned. Trial was pruned at iteration 0.
[I 2023-12-19 04:52:14,491] Trial 16 pruned. Trial was pruned at iteration 0.
[I 2023-12-19 04:52:14,586] Trial 17 pruned. Trial was pruned at iteration 0.
[I 2023-12-19 04:52:14,709] Trial 18 pruned. Trial was pruned at iteration 0.
[I 2023-12-19 04:52:14,812] Trial 19 pruned. Trial was pruned at iteration 0.
[I 2023-12-19 04:52:16,926] Trial 20 finished with value: 4.588181021165332 and parameters: {'learning_rate': 0.634498112058679, 'aft_loss_distribution': 'logistic', 'aft_loss_distribution_scale': 1.3615368844476885, 'max_depth': 4, 'booster': 'gbtree', 'scale_pos_weight': 7.7858464320555765, 'alpha': 5.771264026923468, 'lambda': 4.816291150361367, 'eta': 0.8102664704317805, 'sampling_method': 'uniform', 'subsample': 0.819934496389457, 'gamma': 5.759065499816893}. Best is trial 20 with value: 4.588181021165332.
[I 2023-12-19 04:52:17,054] Trial 21 pruned. Trial was pruned at iteration 0.
[I 2023-12-19 04:52:17,804] Trial 22 finished with value: 4.747604823047126 and parameters: {'learning_rate': 0.45030695559735034, 'aft_loss_distribution': 'logistic', 'aft_loss_distribution_scale': 1.6793590613973093, 'max_depth': 3, 'booster': 'gbtree', 'scale_pos_weight': 9.453856190016245, 'alpha': 5.865900244263156, 'lambda': 6.312904082856368, 'eta': 0.6762441586487038, 'sampling_method': 'uniform', 'subsample': 0.5866584716131424, 'gamma': 3.763624880921612}. Best is trial 20 with value: 4.588181021165332.
[I 2023-12-19 04:52:17,887] Trial 23 pruned. Trial was pruned at iteration 0.
[I 2023-12-19 04:52:17,961] Trial 24 pruned. Trial was pruned at iteration 0.
[I 2023-12-19 04:52:18,030] Trial 25 pruned. Trial was pruned at iteration 0.
[I 2023-12-19 04:52:18,098] Trial 26 pruned. Trial was pruned at iteration 0.
[I 2023-12-19 04:52:18,167] Trial 27 pruned. Trial was pruned at iteration 0.
[I 2023-12-19 04:52:18,491] Trial 28 finished with value: inf and parameters: {'learning_rate': 0.6811211400042345, 'aft_loss_distribution': 'normal', 'aft_loss_distribution_scale': 3.0129905342353305, 'max_depth': 6, 'booster': 'gbtree', 'scale_pos_weight': 1.7904699307893113, 'alpha': 4.863776957484339, 'lambda': 7.454305992171055, 'eta': 0.09340471969043472, 'sampling_method': 'uniform', 'subsample': 0.5734028991890688, 'gamma': 7.003431110568306}. Best is trial 20 with value: 4.588181021165332.
[I 2023-12-19 04:52:18,563] Trial 29 pruned. Trial was pruned at iteration 0.
[I 2023-12-19 04:52:18,630] Trial 30 pruned. Trial was pruned at iteration 0.
[I 2023-12-19 04:52:19,116] Trial 31 finished with value: 4.859148017240946 and parameters: {'learning_rate': 0.3883755632213817, 'aft_loss_distribution': 'logistic', 'aft_loss_distribution_scale': 1.9291535643678044, 'max_depth': 4, 'booster': 'gbtree', 'scale_pos_weight': 8.402007663715064, 'alpha': 2.9185079731085644, 'lambda': 5.810857418044853, 'eta': 0.6771614136159677, 'sampling_method': 'uniform', 'subsample': 0.6340629452178724, 'gamma': 2.1033412480936433}. Best is trial 20 with value: 4.588181021165332.
[I 2023-12-19 04:52:19,187] Trial 32 pruned. Trial was pruned at iteration 0.
[I 2023-12-19 04:52:19,254] Trial 33 pruned. Trial was pruned at iteration 0.
[I 2023-12-19 04:52:19,325] Trial 34 pruned. Trial was pruned at iteration 0.
[I 2023-12-19 04:52:19,396] Trial 35 pruned. Trial was pruned at iteration 0.
[I 2023-12-19 04:52:19,461] Trial 36 pruned. Trial was pruned at iteration 0.
[I 2023-12-19 04:52:19,537] Trial 37 pruned. Trial was pruned at iteration 0.
[I 2023-12-19 04:52:20,513] Trial 38 finished with value: 4.653943888506111 and parameters: {'learning_rate': 0.26380791083082833, 'aft_loss_distribution': 'logistic', 'aft_loss_distribution_scale': 1.492987283248142, 'max_depth': 3, 'booster': 'gbtree', 'scale_pos_weight': 8.826599904753635, 'alpha': 1.3414757765857594, 'lambda': 7.515251364036884, 'eta': 0.39651747339779947, 'sampling_method': 'uniform', 'subsample': 0.7308278691211013, 'gamma': 0.8710238334198337}. Best is trial 20 with value: 4.588181021165332.
[I 2023-12-19 04:52:20,593] Trial 39 pruned. Trial was pruned at iteration 0.
[I 2023-12-19 04:52:20,670] Trial 40 pruned. Trial was pruned at iteration 0.
[I 2023-12-19 04:52:21,259] Trial 41 finished with value: 4.747412825122037 and parameters: {'learning_rate': 0.33680502408477914, 'aft_loss_distribution': 'logistic', 'aft_loss_distribution_scale': 1.6817980435163897, 'max_depth': 4, 'booster': 'gbtree', 'scale_pos_weight': 8.699705314915546, 'alpha': 0.4301567131794295, 'lambda': 6.288892255097373, 'eta': 0.23453969770444072, 'sampling_method': 'uniform', 'subsample': 0.6249643602908341, 'gamma': 2.161031635216055}. Best is trial 20 with value: 4.588181021165332.
[I 2023-12-19 04:52:21,839] Trial 42 finished with value: 4.650484062991732 and parameters: {'learning_rate': 0.2776610976614359, 'aft_loss_distribution': 'logistic', 'aft_loss_distribution_scale': 1.48568623980597, 'max_depth': 4, 'booster': 'gbtree', 'scale_pos_weight': 9.485415537115882, 'alpha': 0.05983838470384406, 'lambda': 6.2742548778325755, 'eta': 0.1949715073762949, 'sampling_method': 'uniform', 'subsample': 0.7102936797602462, 'gamma': 1.9708139043240522}. Best is trial 20 with value: 4.588181021165332.
[I 2023-12-19 04:52:22,359] Trial 43 finished with value: inf and parameters: {'learning_rate': 0.2743696225660359, 'aft_loss_distribution': 'logistic', 'aft_loss_distribution_scale': 1.2776392659031743, 'max_depth': 5, 'booster': 'gbtree', 'scale_pos_weight': 9.432411771564318, 'alpha': 0.0944429474059797, 'lambda': 6.384522507550459, 'eta': 0.23477658208521987, 'sampling_method': 'uniform', 'subsample': 0.7189006246028427, 'gamma': 0.01864151930226421}. Best is trial 20 with value: 4.588181021165332.
[I 2023-12-19 04:52:22,436] Trial 44 pruned. Trial was pruned at iteration 0.
[I 2023-12-19 04:52:22,521] Trial 45 pruned. Trial was pruned at iteration 0.
[I 2023-12-19 04:52:22,910] Trial 46 finished with value: inf and parameters: {'learning_rate': 0.43447895153126304, 'aft_loss_distribution': 'logistic', 'aft_loss_distribution_scale': 1.337311409445239, 'max_depth': 8, 'booster': 'gbtree', 'scale_pos_weight': 8.540835318612697, 'alpha': 1.4823399446777987, 'lambda': 3.417622391573047, 'eta': 0.14531883380468325, 'sampling_method': 'uniform', 'subsample': 0.7107331834932752, 'gamma': 0.9525563469784414}. Best is trial 20 with value: 4.588181021165332.
[I 2023-12-19 04:52:22,987] Trial 47 pruned. Trial was pruned at iteration 0.
[I 2023-12-19 04:52:23,072] Trial 48 pruned. Trial was pruned at iteration 0.
[I 2023-12-19 04:52:23,151] Trial 49 pruned. Trial was pruned at iteration 0.
[I 2023-12-19 04:52:23,225] Trial 50 pruned. Trial was pruned at iteration 0.
[I 2023-12-19 04:52:23,298] Trial 51 pruned. Trial was pruned at iteration 0.
[I 2023-12-19 04:52:24,081] Trial 52 finished with value: 4.418209490419408 and parameters: {'learning_rate': 0.27160687478877305, 'aft_loss_distribution': 'logistic', 'aft_loss_distribution_scale': 1.0626439031765127, 'max_depth': 9, 'booster': 'gbtree', 'scale_pos_weight': 3.5094799416842086, 'alpha': 0.07825123321991556, 'lambda': 7.79928970355482, 'eta': 0.12736479474841994, 'sampling_method': 'uniform', 'subsample': 0.568843534899863, 'gamma': 4.129255130897969}. Best is trial 52 with value: 4.418209490419408.
[I 2023-12-19 04:52:28,878] Trial 53 finished with value: 4.5547082138082695 and parameters: {'learning_rate': 0.2891451686549704, 'aft_loss_distribution': 'logistic', 'aft_loss_distribution_scale': 1.3007392427419875, 'max_depth': 9, 'booster': 'gbtree', 'scale_pos_weight': 3.391381097914209, 'alpha': 0.007889050385873564, 'lambda': 7.869555787810947, 'eta': 0.11858440188693942, 'sampling_method': 'uniform', 'subsample': 0.5258457371676962, 'gamma': 5.458715352080382}. Best is trial 52 with value: 4.418209490419408.
[I 2023-12-19 04:52:29,792] Trial 54 finished with value: 4.422183013325548 and parameters: {'learning_rate': 0.281987053237597, 'aft_loss_distribution': 'logistic', 'aft_loss_distribution_scale': 1.0674010432980583, 'max_depth': 9, 'booster': 'gbtree', 'scale_pos_weight': 3.3323854029008686, 'alpha': 0.02865500579023684, 'lambda': 7.693829625573056, 'eta': 0.11931103935167803, 'sampling_method': 'uniform', 'subsample': 0.506703021291847, 'gamma': 5.518000324804454}. Best is trial 52 with value: 4.418209490419408.
[I 2023-12-19 04:52:29,868] Trial 55 pruned. Trial was pruned at iteration 0.
[I 2023-12-19 04:52:29,952] Trial 56 pruned. Trial was pruned at iteration 0.
[I 2023-12-19 04:52:30,038] Trial 57 pruned. Trial was pruned at iteration 0.
[I 2023-12-19 04:52:30,129] Trial 58 pruned. Trial was pruned at iteration 0.
[I 2023-12-19 04:52:30,217] Trial 59 pruned. Trial was pruned at iteration 0.
[I 2023-12-19 04:52:30,293] Trial 60 pruned. Trial was pruned at iteration 0.
[I 2023-12-19 04:52:30,778] Trial 61 finished with value: 4.644123049345732 and parameters: {'learning_rate': 0.3445124810562258, 'aft_loss_distribution': 'logistic', 'aft_loss_distribution_scale': 1.4701187220502554, 'max_depth': 9, 'booster': 'gbtree', 'scale_pos_weight': 4.100087737204354, 'alpha': 0.7359362852369321, 'lambda': 7.036802874584442, 'eta': 0.22090945974490417, 'sampling_method': 'uniform', 'subsample': 0.5651040645932967, 'gamma': 4.7502537070873005}. Best is trial 52 with value: 4.418209490419408.
[I 2023-12-19 04:52:32,477] Trial 62 finished with value: 4.586094633201262 and parameters: {'learning_rate': 0.24922525075295318, 'aft_loss_distribution': 'logistic', 'aft_loss_distribution_scale': 1.3598861397428386, 'max_depth': 9, 'booster': 'gbtree', 'scale_pos_weight': 3.5281167466233585, 'alpha': 0.6774537202971505, 'lambda': 7.064078311302406, 'eta': 0.25245554626904937, 'sampling_method': 'uniform', 'subsample': 0.5654924441382622, 'gamma': 4.7870277164456025}. Best is trial 52 with value: 4.418209490419408.
[I 2023-12-19 04:52:32,557] Trial 63 pruned. Trial was pruned at iteration 0.
[I 2023-12-19 04:52:33,695] Trial 64 finished with value: 4.445622311740567 and parameters: {'learning_rate': 0.21930947022168223, 'aft_loss_distribution': 'logistic', 'aft_loss_distribution_scale': 1.108080881030516, 'max_depth': 8, 'booster': 'gbtree', 'scale_pos_weight': 3.2930399542563653, 'alpha': 0.4980631784382798, 'lambda': 7.130491690775316, 'eta': 0.12392464173789886, 'sampling_method': 'uniform', 'subsample': 0.47337977694192435, 'gamma': 5.302168292817237}. Best is trial 52 with value: 4.418209490419408.
[I 2023-12-19 04:52:33,782] Trial 65 pruned. Trial was pruned at iteration 0.
[I 2023-12-19 04:52:34,465] Trial 66 finished with value: 4.4233809940022 and parameters: {'learning_rate': 0.2116462383295028, 'aft_loss_distribution': 'logistic', 'aft_loss_distribution_scale': 1.0681349893072751, 'max_depth': 8, 'booster': 'gbtree', 'scale_pos_weight': 3.975715737049339, 'alpha': 0.4016947696023857, 'lambda': 7.952713016352751, 'eta': 0.03764103020288534, 'sampling_method': 'uniform', 'subsample': 0.5794038436001325, 'gamma': 5.361432206724577}. Best is trial 52 with value: 4.418209490419408.
[I 2023-12-19 04:52:43,785] Trial 67 finished with value: 4.400280146159324 and parameters: {'learning_rate': 0.235034836385851, 'aft_loss_distribution': 'logistic', 'aft_loss_distribution_scale': 1.0273153181422578, 'max_depth': 8, 'booster': 'dart', 'scale_pos_weight': 5.231606752052153, 'alpha': 0.4678753536830574, 'lambda': 8.739586085268543, 'eta': 0.022973941670728873, 'sampling_method': 'uniform', 'subsample': 0.467533981233296, 'gamma': 6.992988963902436}. Best is trial 67 with value: 4.400280146159324.
[I 2023-12-19 04:53:11,444] Trial 68 finished with value: 4.436825066744208 and parameters: {'learning_rate': 0.23179433871410177, 'aft_loss_distribution': 'logistic', 'aft_loss_distribution_scale': 1.090874345908577, 'max_depth': 8, 'booster': 'dart', 'scale_pos_weight': 5.344320215205308, 'alpha': 0.40627228289775486, 'lambda': 8.621756533390702, 'eta': 0.07523773069374635, 'sampling_method': 'uniform', 'subsample': 0.37459538122699854, 'gamma': 6.840679602250937}. Best is trial 67 with value: 4.400280146159324.
[I 2023-12-19 04:53:11,884] Trial 69 pruned. Trial was pruned at iteration 0.
[I 2023-12-19 04:53:39,637] Trial 70 finished with value: 4.435655687478696 and parameters: {'learning_rate': 0.21197982398841747, 'aft_loss_distribution': 'logistic', 'aft_loss_distribution_scale': 1.0890446016520554, 'max_depth': 7, 'booster': 'dart', 'scale_pos_weight': 5.352342074537569, 'alpha': 1.083764192395508, 'lambda': 9.33615287018768, 'eta': 0.022591247645562345, 'sampling_method': 'uniform', 'subsample': 0.4275030643871871, 'gamma': 7.492459859347019}. Best is trial 67 with value: 4.400280146159324.
[I 2023-12-19 04:54:24,519] Trial 71 finished with value: 4.398112156006731 and parameters: {'learning_rate': 0.20635925993551163, 'aft_loss_distribution': 'logistic', 'aft_loss_distribution_scale': 1.0234476363087794, 'max_depth': 7, 'booster': 'dart', 'scale_pos_weight': 5.305756097065308, 'alpha': 1.0501645362335317, 'lambda': 9.538160440390184, 'eta': 0.03143776802749376, 'sampling_method': 'uniform', 'subsample': 0.42195836558038713, 'gamma': 8.13663061526466}. Best is trial 71 with value: 4.398112156006731.
[I 2023-12-19 04:55:04,818] Trial 72 finished with value: 4.371439625406804 and parameters: {'learning_rate': 0.20410175692269625, 'aft_loss_distribution': 'logistic', 'aft_loss_distribution_scale': 0.9781127572739994, 'max_depth': 7, 'booster': 'dart', 'scale_pos_weight': 5.338056729667613, 'alpha': 1.0497458565545834, 'lambda': 9.369064865109982, 'eta': 0.01879358965441752, 'sampling_method': 'uniform', 'subsample': 0.42139607954786473, 'gamma': 8.020395574056502}. Best is trial 72 with value: 4.371439625406804.
[I 2023-12-19 04:55:43,893] Trial 73 finished with value: 4.220116152119062 and parameters: {'learning_rate': 0.1478734912599717, 'aft_loss_distribution': 'logistic', 'aft_loss_distribution_scale': 0.7056369066499557, 'max_depth': 7, 'booster': 'dart', 'scale_pos_weight': 5.3130317355769545, 'alpha': 1.0938232861663486, 'lambda': 9.966910628237073, 'eta': 0.021978584488452007, 'sampling_method': 'uniform', 'subsample': 0.41471285885926434, 'gamma': 8.156238911675997}. Best is trial 73 with value: 4.220116152119062.
[I 2023-12-19 04:55:44,039] Trial 74 pruned. Trial was pruned at iteration 0.
[I 2023-12-19 04:56:26,716] Trial 75 finished with value: 4.282021911424076 and parameters: {'learning_rate': 0.16763134962756335, 'aft_loss_distribution': 'logistic', 'aft_loss_distribution_scale': 0.8237903697502259, 'max_depth': 7, 'booster': 'dart', 'scale_pos_weight': 4.72370582874979, 'alpha': 1.0136952006063178, 'lambda': 9.92975829022001, 'eta': 0.014247215760662554, 'sampling_method': 'uniform', 'subsample': 0.2943475647123987, 'gamma': 8.782696470477454}. Best is trial 73 with value: 4.220116152119062.
[I 2023-12-19 04:56:26,837] Trial 76 pruned. Trial was pruned at iteration 0.
[I 2023-12-19 04:56:26,967] Trial 77 pruned. Trial was pruned at iteration 0.
[I 2023-12-19 04:56:27,091] Trial 78 pruned. Trial was pruned at iteration 0.
[I 2023-12-19 04:56:27,208] Trial 79 pruned. Trial was pruned at iteration 0.
[I 2023-12-19 04:56:27,354] Trial 80 pruned. Trial was pruned at iteration 0.
[I 2023-12-19 04:57:22,439] Trial 81 finished with value: 4.367750642810804 and parameters: {'learning_rate': 0.20393195384661278, 'aft_loss_distribution': 'logistic', 'aft_loss_distribution_scale': 0.9727301585773174, 'max_depth': 7, 'booster': 'dart', 'scale_pos_weight': 5.370030238860563, 'alpha': 1.1241799434062631, 'lambda': 9.448563478425816, 'eta': 0.02725303499689824, 'sampling_method': 'uniform', 'subsample': 0.4153858147811034, 'gamma': 7.3134708801270545}. Best is trial 73 with value: 4.220116152119062.
[I 2023-12-19 04:57:38,041] Trial 82 finished with value: 4.29982374724382 and parameters: {'learning_rate': 0.19866978308304678, 'aft_loss_distribution': 'logistic', 'aft_loss_distribution_scale': 0.845790388502022, 'max_depth': 7, 'booster': 'dart', 'scale_pos_weight': 5.462525626160152, 'alpha': 1.0044120631901148, 'lambda': 9.976802355875062, 'eta': 0.03398286707763098, 'sampling_method': 'uniform', 'subsample': 0.04786777162787034, 'gamma': 7.974784983780936}. Best is trial 73 with value: 4.220116152119062.
[I 2023-12-19 04:57:38,128] Trial 83 pruned. Trial was pruned at iteration 0.
[I 2023-12-19 04:57:38,214] Trial 84 pruned. Trial was pruned at iteration 0.
[I 2023-12-19 04:57:38,308] Trial 85 pruned. Trial was pruned at iteration 0.
[I 2023-12-19 04:57:38,395] Trial 86 pruned. Trial was pruned at iteration 0.
[I 2023-12-19 04:57:38,485] Trial 87 pruned. Trial was pruned at iteration 0.
[I 2023-12-19 04:57:38,571] Trial 88 pruned. Trial was pruned at iteration 0.
