[I 2023-12-21 02:32:18,854] Trial 447 finished with value: 4.274795310959465 and parameters: {'learning_rate': 0.8093734023143093, 'aft_l                                                                     oss_distribution': 'normal', 'aft_loss_distribution_scale': 1.166230423605488, 'max_depth': 5, 'booster': 'gbtree', 'scale_pos_weight': 6                                                                     .379636758118746, 'alpha': 7.912448972264253, 'lambda': 1.8404805652326677, 'eta': 0.8138467553695744, 'sampling_method': 'gradient_based                                                                     ', 'subsample': 0.9331362328106538, 'gamma': 9.561103935569282}. Best is trial 156 with value: 4.239607290306937.
[I 2023-12-21 02:32:18,909] Trial 448 pruned. Trial was pruned at iteration 0.
[I 2023-12-21 02:32:18,961] Trial 449 pruned. Trial was pruned at iteration 0.
[I 2023-12-21 02:32:19,090] Trial 450 finished with value: inf and parameters: {'learning_rate': 0.8511261547318825, 'aft_loss_distributi                                                                     on': 'normal', 'aft_loss_distribution_scale': 1.2073054533048948, 'max_depth': 7, 'booster': 'gbtree', 'scale_pos_weight': 6.355773195711                                                                     974, 'alpha': 7.654505946464492, 'lambda': 1.4577113016195815, 'eta': 0.8357573622989717, 'sampling_method': 'gradient_based', 'subsample                                                                     ': 0.9571635179822775, 'gamma': 8.767975200823553}. Best is trial 156 with value: 4.239607290306937.
[I 2023-12-21 02:32:19,143] Trial 451 pruned. Trial was pruned at iteration 0.
[I 2023-12-21 02:32:19,194] Trial 452 pruned. Trial was pruned at iteration 0.
[I 2023-12-21 02:32:19,248] Trial 453 pruned. Trial was pruned at iteration 1.
[I 2023-12-21 02:32:19,302] Trial 454 pruned. Trial was pruned at iteration 0.
[I 2023-12-21 02:32:19,353] Trial 455 pruned. Trial was pruned at iteration 0.
[I 2023-12-21 02:32:19,404] Trial 456 pruned. Trial was pruned at iteration 0.
[I 2023-12-21 02:32:19,523] Trial 457 finished with value: inf and parameters: {'learning_rate': 0.7749771921786063, 'aft_loss_distributi                                                                     on': 'normal', 'aft_loss_distribution_scale': 1.1991457313223317, 'max_depth': 5, 'booster': 'gbtree', 'scale_pos_weight': 8.025372752825                                                                     353, 'alpha': 5.378715748020979, 'lambda': 0.8156579991486184, 'eta': 0.8091716419944844, 'sampling_method': 'uniform', 'subsample': 0.98                                                                     41045621993696, 'gamma': 8.740575414877707}. Best is trial 156 with value: 4.239607290306937.
[I 2023-12-21 02:32:19,575] Trial 458 pruned. Trial was pruned at iteration 0.
[I 2023-12-21 02:32:19,632] Trial 459 pruned. Trial was pruned at iteration 1.
[I 2023-12-21 02:32:19,686] Trial 460 pruned. Trial was pruned at iteration 0.
[I 2023-12-21 02:32:19,739] Trial 461 pruned. Trial was pruned at iteration 0.
[I 2023-12-21 02:32:19,794] Trial 462 pruned. Trial was pruned at iteration 1.
[I 2023-12-21 02:32:19,847] Trial 463 pruned. Trial was pruned at iteration 0.
[I 2023-12-21 02:32:19,903] Trial 464 pruned. Trial was pruned at iteration 2.
[I 2023-12-21 02:32:19,955] Trial 465 pruned. Trial was pruned at iteration 0.
[I 2023-12-21 02:32:20,007] Trial 466 pruned. Trial was pruned at iteration 0.
[I 2023-12-21 02:32:20,060] Trial 467 pruned. Trial was pruned at iteration 0.
[I 2023-12-21 02:32:20,113] Trial 468 pruned. Trial was pruned at iteration 0.
[I 2023-12-21 02:32:20,169] Trial 469 pruned. Trial was pruned at iteration 0.
[I 2023-12-21 02:32:20,223] Trial 470 pruned. Trial was pruned at iteration 1.
[I 2023-12-21 02:32:20,275] Trial 471 pruned. Trial was pruned at iteration 0.
[I 2023-12-21 02:32:20,327] Trial 472 pruned. Trial was pruned at iteration 0.
[I 2023-12-21 02:32:20,383] Trial 473 pruned. Trial was pruned at iteration 1.
[I 2023-12-21 02:32:20,436] Trial 474 pruned. Trial was pruned at iteration 0.
[I 2023-12-21 02:32:20,490] Trial 475 pruned. Trial was pruned at iteration 1.
[I 2023-12-21 02:32:20,545] Trial 476 pruned. Trial was pruned at iteration 0.
[I 2023-12-21 02:32:20,598] Trial 477 pruned. Trial was pruned at iteration 0.
[I 2023-12-21 02:32:20,652] Trial 478 pruned. Trial was pruned at iteration 1.
[I 2023-12-21 02:32:20,783] Trial 479 finished with value: inf and parameters: {'learning_rate': 0.82887054934162, 'aft_loss_distribution                                                                     ': 'normal', 'aft_loss_distribution_scale': 1.0152877753270515, 'max_depth': 9, 'booster': 'gbtree', 'scale_pos_weight': 6.53928954666936                                                                     9, 'alpha': 9.540072227765219, 'lambda': 0.2777621741003375, 'eta': 0.8076079890486592, 'sampling_method': 'uniform', 'subsample': 0.9508                                                                     290889470152, 'gamma': 9.070528295011227}. Best is trial 156 with value: 4.239607290306937.
[I 2023-12-21 02:32:20,836] Trial 480 pruned. Trial was pruned at iteration 0.
[I 2023-12-21 02:32:20,890] Trial 481 pruned. Trial was pruned at iteration 0.
[I 2023-12-21 02:32:20,944] Trial 482 pruned. Trial was pruned at iteration 0.
[I 2023-12-21 02:32:20,999] Trial 483 pruned. Trial was pruned at iteration 1.
[I 2023-12-21 02:32:21,052] Trial 484 pruned. Trial was pruned at iteration 0.
[I 2023-12-21 02:32:21,108] Trial 485 pruned. Trial was pruned at iteration 1.
[I 2023-12-21 02:32:21,241] Trial 486 finished with value: inf and parameters: {'learning_rate': 0.9875118927534348, 'aft_loss_distributi                                                                     on': 'normal', 'aft_loss_distribution_scale': 1.0731091459392068, 'max_depth': 7, 'booster': 'gbtree', 'scale_pos_weight': 6.488355792202                                                                     588, 'alpha': 7.8962955898624685, 'lambda': 1.314274057417519, 'eta': 0.27136354078689645, 'sampling_method': 'gradient_based', 'subsampl                                                                     e': 0.8948142194211371, 'gamma': 9.096286160392312}. Best is trial 156 with value: 4.239607290306937.
[I 2023-12-21 02:32:21,297] Trial 487 pruned. Trial was pruned at iteration 1.
[I 2023-12-21 02:32:21,350] Trial 488 pruned. Trial was pruned at iteration 0.
[I 2023-12-21 02:32:21,405] Trial 489 pruned. Trial was pruned at iteration 0.
[I 2023-12-21 02:32:21,458] Trial 490 pruned. Trial was pruned at iteration 0.
[I 2023-12-21 02:32:21,590] Trial 491 finished with value: inf and parameters: {'learning_rate': 0.8777235462490947, 'aft_loss_distributi                                                                     on': 'normal', 'aft_loss_distribution_scale': 1.1822553425368134, 'max_depth': 6, 'booster': 'gbtree', 'scale_pos_weight': 5.351037858446                                                                     025, 'alpha': 9.004421904238493, 'lambda': 0.6964110984120018, 'eta': 0.9235130363614709, 'sampling_method': 'gradient_based', 'subsample                                                                     ': 0.9524313343022626, 'gamma': 9.481783376201657}. Best is trial 156 with value: 4.239607290306937.
[I 2023-12-21 02:32:21,648] Trial 492 pruned. Trial was pruned at iteration 1.
[I 2023-12-21 02:32:21,702] Trial 493 pruned. Trial was pruned at iteration 0.
[I 2023-12-21 02:32:21,756] Trial 494 pruned. Trial was pruned at iteration 0.
[I 2023-12-21 02:32:21,811] Trial 495 pruned. Trial was pruned at iteration 1.
[I 2023-12-21 02:32:21,864] Trial 496 pruned. Trial was pruned at iteration 0.
[I 2023-12-21 02:32:21,918] Trial 497 pruned. Trial was pruned at iteration 0.
[I 2023-12-21 02:32:21,973] Trial 498 pruned. Trial was pruned at iteration 1.
