[I 2023-12-19 04:33:47,102] Trial 18 pruned. Trial was pruned at iteration 0.
[I 2023-12-19 04:33:47,169] Trial 19 pruned. Trial was pruned at iteration 0.
[I 2023-12-19 04:34:06,668] Trial 20 finished with value: 5.060706451462913 and parameters: {'learning_rate': 0.8532653324973067, 'aft_loss_distribution': 'extreme', 'aft_loss_distribution_scale': 3.5294270680700057, 'max_depth': 4, 'booster': 'dart', 'scale_pos_weight': 5.5937268988894235, 'alpha': 6.852984415168032, 'lambda': 3.855280764350985, 'eta': 0.5512660243821353, 'sampling_method': 'uniform', 'subsample': 0.40707439922643285, 'gamma': 1.6565117017192867}. Best is trial 4 with value: 4.981984466995365.
[I 2023-12-19 04:34:51,942] Trial 21 finished with value: 5.036387508634909 and parameters: {'learning_rate': 0.8661717083746685, 'aft_loss_distribution': 'extreme', 'aft_loss_distribution_scale': 3.4286182743759506, 'max_depth': 4, 'booster': 'dart', 'scale_pos_weight': 5.518581591766692, 'alpha': 7.017320235673157, 'lambda': 3.703348334778116, 'eta': 0.5346380729258785, 'sampling_method': 'uniform', 'subsample': 0.40882471319429403, 'gamma': 1.782274662189031}. Best is trial 4 with value: 4.981984466995365.
[I 2023-12-19 04:34:52,010] Trial 22 pruned. Trial was pruned at iteration 0.
[I 2023-12-19 04:34:52,075] Trial 23 pruned. Trial was pruned at iteration 0.
[I 2023-12-19 04:34:52,141] Trial 24 pruned. Trial was pruned at iteration 0.
[I 2023-12-19 04:35:01,958] Trial 25 finished with value: 4.804595556809472 and parameters: {'learning_rate': 0.7984494575389476, 'aft_loss_distribution': 'normal', 'aft_loss_distribution_scale': 2.9167309252460507, 'max_depth': 3, 'booster': 'dart', 'scale_pos_weight': 5.776637189375497, 'alpha': 9.281708204268094, 'lambda': 4.126000962132765, 'eta': 0.25834581129390793, 'sampling_method': 'uniform', 'subsample': 0.7657170435456802, 'gamma': 6.0358859571040115}. Best is trial 25 with value: 4.804595556809472.
[I 2023-12-19 04:35:02,933] Trial 26 finished with value: 4.7266593505305226 and parameters: {'learning_rate': 0.9296824506814241, 'aft_loss_distribution': 'normal', 'aft_loss_distribution_scale': 2.6585783811306793, 'max_depth': 3, 'booster': 'gbtree', 'scale_pos_weight': 5.533026967287939, 'alpha': 4.8400567602978875, 'lambda': 3.8368847823207304, 'eta': 0.2155615469569559, 'sampling_method': 'uniform', 'subsample': 0.7502587512657152, 'gamma': 2.0000558691873693}. Best is trial 26 with value: 4.7266593505305226.
[I 2023-12-19 04:35:03,447] Trial 27 finished with value: 4.661195519591405 and parameters: {'learning_rate': 0.93803688940872, 'aft_loss_distribution': 'normal', 'aft_loss_distribution_scale': 2.4381121772019703, 'max_depth': 3, 'booster': 'gbtree', 'scale_pos_weight': 6.207247348316711, 'alpha': 1.525094280062332, 'lambda': 4.184427631055041, 'eta': 0.13064461416733908, 'sampling_method': 'uniform', 'subsample': 0.7391734482133299, 'gamma': 6.391353991424727}. Best is trial 27 with value: 4.661195519591405.
[I 2023-12-19 04:35:03,961] Trial 28 finished with value: 4.512313527891111 and parameters: {'learning_rate': 0.9347598945886879, 'aft_loss_distribution': 'normal', 'aft_loss_distribution_scale': 1.9932970138199808, 'max_depth': 3, 'booster': 'gbtree', 'scale_pos_weight': 6.1918315277656975, 'alpha': 1.5502314446408807, 'lambda': 4.377476487076077, 'eta': 0.019628333551981347, 'sampling_method': 'uniform', 'subsample': 0.601968395601692, 'gamma': 6.4710921910705785}. Best is trial 28 with value: 4.512313527891111.
[I 2023-12-19 04:35:04,330] Trial 29 finished with value: inf and parameters: {'learning_rate': 0.9211740414815569, 'aft_loss_distribution': 'normal', 'aft_loss_distribution_scale': 1.621539269856651, 'max_depth': 3, 'booster': 'gbtree', 'scale_pos_weight': 7.415326829688287, 'alpha': 1.7293403901820543, 'lambda': 6.06749451326262, 'eta': 0.0017865572351346837, 'sampling_method': 'uniform', 'subsample': 0.5948041631518081, 'gamma': 7.782255591778181}. Best is trial 28 with value: 4.512313527891111.
[I 2023-12-19 04:35:04,398] Trial 30 pruned. Trial was pruned at iteration 0.
[I 2023-12-19 04:35:04,854] Trial 31 finished with value: 4.649046859292669 and parameters: {'learning_rate': 0.8059220927371882, 'aft_loss_distribution': 'normal', 'aft_loss_distribution_scale': 2.402821034144111, 'max_depth': 3, 'booster': 'gbtree', 'scale_pos_weight': 5.775191214359426, 'alpha': 1.992270652944116, 'lambda': 4.395309322313743, 'eta': 0.2121184188303597, 'sampling_method': 'uniform', 'subsample': 0.7598997489598929, 'gamma': 6.308198615349309}. Best is trial 28 with value: 4.512313527891111.
[I 2023-12-19 04:35:05,165] Trial 32 finished with value: inf and parameters: {'learning_rate': 0.9353847805375439, 'aft_loss_distribution': 'normal', 'aft_loss_distribution_scale': 2.0138176936841816, 'max_depth': 3, 'booster': 'gbtree', 'scale_pos_weight': 6.227624225056924, 'alpha': 1.9782674215178857, 'lambda': 4.509389099747453, 'eta': 0.1653849797935987, 'sampling_method': 'uniform', 'subsample': 0.7505833788187043, 'gamma': 6.459215095123699}. Best is trial 28 with value: 4.512313527891111.
[I 2023-12-19 04:35:05,809] Trial 33 finished with value: inf and parameters: {'learning_rate': 0.8203531987308076, 'aft_loss_distribution': 'normal', 'aft_loss_distribution_scale': 0.9764059147063107, 'max_depth': 4, 'booster': 'gbtree', 'scale_pos_weight': 6.228412352218949, 'alpha': 0.8649376927161704, 'lambda': 4.517687259268727, 'eta': 0.06978706766022913, 'sampling_method': 'uniform', 'subsample': 0.6175221161134432, 'gamma': 4.9320151412399005}. Best is trial 28 with value: 4.512313527891111.
[I 2023-12-19 04:35:06,759] Trial 34 finished with value: 4.660793899897331 and parameters: {'learning_rate': 0.5860940014561395, 'aft_loss_distribution': 'normal', 'aft_loss_distribution_scale': 2.442175710008545, 'max_depth': 3, 'booster': 'gbtree', 'scale_pos_weight': 5.188746725264929, 'alpha': 2.1336012765544003, 'lambda': 5.720916364843627, 'eta': 0.003807270557251108, 'sampling_method': 'uniform', 'subsample': 0.7111059255991375, 'gamma': 3.76068105069798}. Best is trial 28 with value: 4.512313527891111.
[I 2023-12-19 04:35:06,838] Trial 35 pruned. Trial was pruned at iteration 1.
[I 2023-12-19 04:35:07,689] Trial 36 finished with value: 4.4271866139550475 and parameters: {'learning_rate': 0.5786874158350053, 'aft_loss_distribution': 'normal', 'aft_loss_distribution_scale': 1.7525582584233843, 'max_depth': 4, 'booster': 'gbtree', 'scale_pos_weight': 5.168573121658071, 'alpha': 0.6155383800201344, 'lambda': 5.496762989343469, 'eta': 0.08768285569078117, 'sampling_method': 'uniform', 'subsample': 0.6743995853843815, 'gamma': 7.5255327050629095}. Best is trial 36 with value: 4.4271866139550475.
[I 2023-12-19 04:35:07,764] Trial 37 pruned. Trial was pruned at iteration 0.
[I 2023-12-19 04:35:08,944] Trial 38 finished with value: 4.390350231109074 and parameters: {'learning_rate': 0.5086308321885735, 'aft_loss_distribution': 'normal', 'aft_loss_distribution_scale': 1.6497647749081108, 'max_depth': 5, 'booster': 'gbtree', 'scale_pos_weight': 5.150334016449626, 'alpha': 2.1865643093607607, 'lambda': 5.50888271815139, 'eta': 0.30609137275642534, 'sampling_method': 'uniform', 'subsample': 0.6380935387389958, 'gamma': 9.87858389566467}. Best is trial 38 with value: 4.390350231109074.
[I 2023-12-19 04:35:09,012] Trial 39 pruned. Trial was pruned at iteration 0.
[I 2023-12-19 04:35:11,710] Trial 40 pruned. Trial was pruned at iteration 191.
[I 2023-12-19 04:35:14,286] Trial 41 finished with value: 4.305878825276531 and parameters: {'learning_rate': 0.6130139296476336, 'aft_loss_distribution': 'normal', 'aft_loss_distribution_scale': 1.4283174465548385, 'max_depth': 4, 'booster': 'gbtree', 'scale_pos_weight': 5.252870321128012, 'alpha': 2.186438158012205, 'lambda': 5.512229161906125, 'eta': 0.10648135490744845, 'sampling_method': 'uniform', 'subsample': 0.5633042226856381, 'gamma': 7.4543907589265626}. Best is trial 41 with value: 4.305878825276531.
[I 2023-12-19 04:35:14,380] Trial 42 pruned. Trial was pruned at iteration 0.
[I 2023-12-19 04:35:14,457] Trial 43 pruned. Trial was pruned at iteration 0.
[I 2023-12-19 04:35:14,529] Trial 44 pruned. Trial was pruned at iteration 0.
[I 2023-12-19 04:35:14,599] Trial 45 pruned. Trial was pruned at iteration 0.
[I 2023-12-19 04:35:14,689] Trial 46 pruned. Trial was pruned at iteration 0.
[I 2023-12-19 04:35:15,130] Trial 47 finished with value: inf and parameters: {'learning_rate': 0.6650368843965773, 'aft_loss_distribution': 'normal', 'aft_loss_distribution_scale': 1.4221458728151477, 'max_depth': 5, 'booster': 'gbtree', 'scale_pos_weight': 4.6717597491246785, 'alpha': 4.550985865357709, 'lambda': 8.522940875953921, 'eta': 0.045587292043847955, 'sampling_method': 'uniform', 'subsample': 0.5663512070856518, 'gamma': 5.251479465314858}. Best is trial 41 with value: 4.305878825276531.
[I 2023-12-19 04:35:15,202] Trial 48 pruned. Trial was pruned at iteration 0.
[I 2023-12-19 04:35:15,272] Trial 49 pruned. Trial was pruned at iteration 0.
[I 2023-12-19 04:35:15,346] Trial 50 pruned. Trial was pruned at iteration 0.
[I 2023-12-19 04:35:16,337] Trial 51 pruned. Trial was pruned at iteration 191.
[I 2023-12-19 04:35:16,413] Trial 52 pruned. Trial was pruned at iteration 0.
[I 2023-12-19 04:35:16,496] Trial 53 pruned. Trial was pruned at iteration 0.
[I 2023-12-19 04:35:16,574] Trial 54 pruned. Trial was pruned at iteration 0.
[I 2023-12-19 04:35:17,114] Trial 55 finished with value: 4.606732462955193 and parameters: {'learning_rate': 0.5300639157362734, 'aft_loss_distribution': 'normal', 'aft_loss_distribution_scale': 2.2723054785767225, 'max_depth': 3, 'booster': 'gbtree', 'scale_pos_weight': 4.8942824940376095, 'alpha': 3.3794803518764285, 'lambda': 7.115107377744981, 'eta': 0.08304512674485034, 'sampling_method': 'uniform', 'subsample': 0.7142648389480545, 'gamma': 7.579467441767804}. Best is trial 41 with value: 4.305878825276531.
[I 2023-12-19 04:35:17,196] Trial 56 pruned. Trial was pruned at iteration 0.
[I 2023-12-19 04:35:17,268] Trial 57 pruned. Trial was pruned at iteration 0.
[I 2023-12-19 04:35:17,809] Trial 58 finished with value: 4.415332691462133 and parameters: {'learning_rate': 0.6516003702727655, 'aft_loss_distribution': 'normal', 'aft_loss_distribution_scale': 1.731139469202763, 'max_depth': 9, 'booster': 'gbtree', 'scale_pos_weight': 6.972975045050874, 'alpha': 3.6739613639058715, 'lambda': 2.7481125510971776, 'eta': 0.09556962391011004, 'sampling_method': 'uniform', 'subsample': 0.9013473348027237, 'gamma': 6.841786110475389}. Best is trial 41 with value: 4.305878825276531.
[I 2023-12-19 04:35:18,229] Trial 59 finished with value: inf and parameters: {'learning_rate': 0.6505525329814722, 'aft_loss_distribution': 'normal', 'aft_loss_distribution_scale': 1.6429639776757181, 'max_depth': 9, 'booster': 'gbtree', 'scale_pos_weight': 7.346209949286136, 'alpha': 3.782617396587291, 'lambda': 2.3892720343940286, 'eta': 0.08905932501433234, 'sampling_method': 'uniform', 'subsample': 0.9057868526485335, 'gamma': 6.8137445987288086}. Best is trial 41 with value: 4.305878825276531.
[I 2023-12-19 04:35:18,305] Trial 60 pruned. Trial was pruned at iteration 0.
[I 2023-12-19 04:35:18,976] Trial 61 finished with value: 4.5940222330039715 and parameters: {'learning_rate': 0.6844177557539833, 'aft_loss_distribution': 'normal', 'aft_loss_distribution_scale': 2.2339676527660672, 'max_depth': 9, 'booster': 'gbtree', 'scale_pos_weight': 6.885908232374933, 'alpha': 3.5759520082341836, 'lambda': 2.767190685109399, 'eta': 0.10223105250028891, 'sampling_method': 'uniform', 'subsample': 0.9516298894452309, 'gamma': 8.021291102657212}. Best is trial 41 with value: 4.305878825276531.
[I 2023-12-19 04:35:19,432] Trial 62 finished with value: 4.524435165851645 and parameters: {'learning_rate': 0.6089429181235113, 'aft_loss_distribution': 'normal', 'aft_loss_distribution_scale': 2.0279566322413394, 'max_depth': 9, 'booster': 'gbtree', 'scale_pos_weight': 6.906728748268517, 'alpha': 3.521854561120194, 'lambda': 3.312017868714121, 'eta': 0.04558110110107909, 'sampling_method': 'uniform', 'subsample': 0.9499259765956917, 'gamma': 8.018361669120464}. Best is trial 41 with value: 4.305878825276531.
[I 2023-12-19 04:35:19,510] Trial 63 pruned. Trial was pruned at iteration 0.
[I 2023-12-19 04:35:20,024] Trial 64 finished with value: 4.497018263257237 and parameters: {'learning_rate': 0.5967071757651023, 'aft_loss_distribution': 'normal', 'aft_loss_distribution_scale': 1.9505144362718292, 'max_depth': 9, 'booster': 'gbtree', 'scale_pos_weight': 8.326893421580015, 'alpha': 2.7019978543546816, 'lambda': 3.239828731844753, 'eta': 0.11077659527202503, 'sampling_method': 'uniform', 'subsample': 0.9732897199486029, 'gamma': 7.970448869446606}. Best is trial 41 with value: 4.305878825276531.
[I 2023-12-19 04:35:20,366] Trial 65 finished with value: inf and parameters: {'learning_rate': 0.6011271602990087, 'aft_loss_distribution': 'normal', 'aft_loss_distribution_scale': 1.7292202010162163, 'max_depth': 10, 'booster': 'gbtree', 'scale_pos_weight': 8.7867060128225, 'alpha': 2.7428057074498997, 'lambda': 3.4173571432168006, 'eta': 0.17902592550865448, 'sampling_method': 'uniform', 'subsample': 0.995589205612238, 'gamma': 9.447868067227171}. Best is trial 41 with value: 4.305878825276531.
[I 2023-12-19 04:35:20,443] Trial 66 pruned. Trial was pruned at iteration 0.
[I 2023-12-19 04:35:20,520] Trial 67 pruned. Trial was pruned at iteration 0.
[I 2023-12-19 04:35:20,595] Trial 68 pruned. Trial was pruned at iteration 0.
[I 2023-12-19 04:35:20,670] Trial 69 pruned. Trial was pruned at iteration 0.
[I 2023-12-19 04:35:20,751] Trial 70 pruned. Trial was pruned at iteration 0.
[I 2023-12-19 04:35:21,117] Trial 71 finished with value: inf and parameters: {'learning_rate': 0.6817532210412999, 'aft_loss_distribution': 'normal', 'aft_loss_distribution_scale': 2.05610756040483, 'max_depth': 9, 'booster': 'gbtree', 'scale_pos_weight': 7.040057109420624, 'alpha': 3.525818795168582, 'lambda': 2.673281725579776, 'eta': 0.11074734912881792, 'sampling_method': 'uniform', 'subsample': 0.9620426799528676, 'gamma': 7.131909826345002}. Best is trial 41 with value: 4.305878825276531.
[I 2023-12-19 04:35:21,195] Trial 72 pruned. Trial was pruned at iteration 0.
[I 2023-12-19 04:35:21,566] Trial 73 finished with value: inf and parameters: {'learning_rate': 0.6058951713270743, 'aft_loss_distribution': 'normal', 'aft_loss_distribution_scale': 1.9120785412463526, 'max_depth': 8, 'booster': 'gbtree', 'scale_pos_weight': 6.333864974646925, 'alpha': 3.5835782808361216, 'lambda': 1.6319069533519923, 'eta': 0.06631521689957451, 'sampling_method': 'uniform', 'subsample': 0.9008799084695936, 'gamma': 9.166326833621811}. Best is trial 41 with value: 4.305878825276531.
[I 2023-12-19 04:35:22,211] Trial 74 finished with value: 4.544380350988608 and parameters: {'learning_rate': 0.7013377254317699, 'aft_loss_distribution': 'normal', 'aft_loss_distribution_scale': 2.0802218001319392, 'max_depth': 9, 'booster': 'gbtree', 'scale_pos_weight': 5.469271988360062, 'alpha': 2.588301969771686, 'lambda': 3.6375372007314177, 'eta': 0.18473863331874474, 'sampling_method': 'uniform', 'subsample': 0.09288794838042674, 'gamma': 7.923838512146673}. Best is trial 41 with value: 4.305878825276531.
[I 2023-12-19 04:35:22,643] Trial 75 finished with value: inf and parameters: {'learning_rate': 0.7813158966181823, 'aft_loss_distribution': 'normal', 'aft_loss_distribution_scale': 1.5071849412808302, 'max_depth': 10, 'booster': 'gbtree', 'scale_pos_weight': 5.599021902875441, 'alpha': 2.5208873449987945, 'lambda': 3.12416867542972, 'eta': 0.176086697063272, 'sampling_method': 'uniform', 'subsample': 0.12961302608882797, 'gamma': 7.3984493853222295}. Best is trial 41 with value: 4.305878825276531.
[I 2023-12-19 04:35:22,721] Trial 76 pruned. Trial was pruned at iteration 0.
[I 2023-12-19 04:35:22,799] Trial 77 pruned. Trial was pruned at iteration 0.
[I 2023-12-19 04:35:23,784] Trial 78 pruned. Trial was pruned at iteration 191.
[I 2023-12-19 04:35:23,872] Trial 79 pruned. Trial was pruned at iteration 1.
[I 2023-12-19 04:35:24,292] Trial 80 finished with value: inf and parameters: {'learning_rate': 0.46867538479828796, 'aft_loss_distribution': 'logistic', 'aft_loss_distribution_scale': 1.1732857308563798, 'max_depth': 7, 'booster': 'gbtree', 'scale_pos_weight': 4.451297714924376, 'alpha': 2.5616839318952542, 'lambda': 4.219457550117885, 'eta': 0.9457278656586305, 'sampling_method': 'uniform', 'subsample': 0.795957036629046, 'gamma': 9.564971657968165}. Best is trial 41 with value: 4.305878825276531.
[I 2023-12-19 04:35:24,395] Trial 81 pruned. Trial was pruned at iteration 1.
[I 2023-12-19 04:35:24,524] Trial 82 pruned. Trial was pruned at iteration 0.
[I 2023-12-19 04:35:24,690] Trial 83 pruned. Trial was pruned at iteration 0.
[I 2023-12-19 04:35:25,079] Trial 84 pruned. Trial was pruned at iteration 1.
[I 2023-12-19 04:35:25,201] Trial 85 pruned. Trial was pruned at iteration 0.
[I 2023-12-19 04:35:26,615] Trial 86 finished with value: inf and parameters: {'learning_rate': 0.6137532786240197, 'aft_loss_distribution': 'normal', 'aft_loss_distribution_scale': 1.5349761129691455, 'max_depth': 10, 'booster': 'gbtree', 'scale_pos_weight': 4.983788329576012, 'alpha': 1.0668390595546287, 'lambda': 2.9025783930184548, 'eta': 0.16516607670992717, 'sampling_method': 'uniform', 'subsample': 0.935381765679048, 'gamma': 7.933937914007143}. Best is trial 41 with value: 4.305878825276531.
[I 2023-12-19 04:35:26,744] Trial 87 pruned. Trial was pruned at iteration 0.
[I 2023-12-19 04:35:26,880] Trial 88 pruned. Trial was pruned at iteration 0.
[I 2023-12-19 04:35:27,124] Trial 89 pruned. Trial was pruned at iteration 0.
[I 2023-12-19 04:35:27,273] Trial 90 pruned. Trial was pruned at iteration 0.
[I 2023-12-19 04:35:27,404] Trial 91 pruned. Trial was pruned at iteration 0.
[I 2023-12-19 04:35:27,537] Trial 92 pruned. Trial was pruned at iteration 0.
[I 2023-12-19 04:35:27,682] Trial 93 pruned. Trial was pruned at iteration 0.
[I 2023-12-19 04:35:27,940] Trial 94 pruned. Trial was pruned at iteration 0.
[I 2023-12-19 04:35:28,109] Trial 95 pruned. Trial was pruned at iteration 0.
[I 2023-12-19 04:35:28,262] Trial 96 pruned. Trial was pruned at iteration 0.
[I 2023-12-19 04:35:29,710] Trial 97 finished with value: 4.380837820805779 and parameters: {'learning_rate': 0.7292575726243593, 'aft_loss_distribution': 'normal', 'aft_loss_distribution_scale': 1.6431897093854964, 'max_depth': 9, 'booster': 'gbtree', 'scale_pos_weight': 6.173844682041319, 'alpha': 2.0920931091087116, 'lambda': 4.018940606874334, 'eta': 0.19325573345487324, 'sampling_method': 'uniform', 'subsample': 0.6961930998758074, 'gamma': 6.299142860031294}. Best is trial 41 with value: 4.305878825276531.
[I 2023-12-19 04:35:30,603] Trial 98 finished with value: 4.3871233011809005 and parameters: {'learning_rate': 0.7174029314643999, 'aft_loss_distribution': 'normal', 'aft_loss_distribution_scale': 1.6569940781491268, 'max_depth': 9, 'booster': 'gbtree', 'scale_pos_weight': 6.207647673708229, 'alpha': 1.535990091850942, 'lambda': 4.982442118099246, 'eta': 0.22039230032353951, 'sampling_method': 'uniform', 'subsample': 0.5347559567455261, 'gamma': 6.174224300282534}. Best is trial 41 with value: 4.305878825276531.
[I 2023-12-19 04:35:30,688] Trial 99 pruned. Trial was pruned at iteration 0.
[I 2023-12-19 04:35:31,255] Trial 100 finished with value: 4.304128959359402 and parameters: {'learning_rate': 0.751336227354055, 'aft_loss_distribution': 'normal', 'aft_loss_distribution_scale': 1.404540379095151, 'max_depth': 10, 'booster': 'gbtree', 'scale_pos_weight': 5.836776485049573, 'alpha': 2.0584080651194165, 'lambda': 4.016086758592109, 'eta': 0.19076440532075997, 'sampling_method': 'uniform', 'subsample': 0.3441112050646507, 'gamma': 6.055233456041435}. Best is trial 100 with value: 4.304128959359402.
[I 2023-12-19 04:35:31,721] Trial 101 finished with value: inf and parameters: {'learning_rate': 0.7589785395032626, 'aft_loss_distribution': 'normal', 'aft_loss_distribution_scale': 1.3284295310836336, 'max_depth': 10, 'booster': 'gbtree', 'scale_pos_weight': 5.673299364715324, 'alpha': 1.436048800350503, 'lambda': 4.558660674971228, 'eta': 0.19264426447792024, 'sampling_method': 'uniform', 'subsample': 0.3275101380666008, 'gamma': 5.769877857572613}. Best is trial 100 with value: 4.304128959359402.
[I 2023-12-19 04:35:31,803] Trial 102 pruned. Trial was pruned at iteration 0.
[I 2023-12-19 04:35:32,870] Trial 103 pruned. Trial was pruned at iteration 191.
[I 2023-12-19 04:35:33,599] Trial 104 finished with value: 4.335126767019122 and parameters: {'learning_rate': 0.8025356931329225, 'aft_loss_distribution': 'normal', 'aft_loss_distribution_scale': 1.5062007714027286, 'max_depth': 8, 'booster': 'gbtree', 'scale_pos_weight': 6.104206964408234, 'alpha': 1.7644466391978302, 'lambda': 4.615136791586946, 'eta': 0.16370559854008224, 'sampling_method': 'uniform', 'subsample': 0.47393562406531, 'gamma': 4.873370042118615}. Best is trial 100 with value: 4.304128959359402.
[I 2023-12-19 04:35:33,686] Trial 105 pruned. Trial was pruned at iteration 0.
[I 2023-12-19 04:35:34,155] Trial 106 finished with value: inf and parameters: {'learning_rate': 0.8062100451179015, 'aft_loss_distribution': 'normal', 'aft_loss_distribution_scale': 1.4095964553091995, 'max_depth': 8, 'booster': 'gbtree', 'scale_pos_weight': 6.718480063756361, 'alpha': 0.7986571467750115, 'lambda': 4.9338473205799644, 'eta': 0.13373707310674182, 'sampling_method': 'uniform', 'subsample': 0.4548098994346851, 'gamma': 5.692194048499501}. Best is trial 100 with value: 4.304128959359402.
[I 2023-12-19 04:35:34,238] Trial 107 pruned. Trial was pruned at iteration 0.
[I 2023-12-19 04:35:34,316] Trial 108 pruned. Trial was pruned at iteration 0.
