[I 2023-12-21 02:58:52,656] Trial 107 finished with value: 4.570011212032798 and parameters: {'learning_rate': 0.5727536927203367, 'aft_l                                                                     oss_distribution': 'normal', 'aft_loss_distribution_scale': 2.135973133216082, 'max_depth': 7, 'booster': 'gbtree', 'scale_pos_weight': 8                                                                     .241929557630288, 'alpha': 3.2434132909572857, 'lambda': 8.453760135333395, 'eta': 0.9169488900095308, 'sampling_method': 'gradient_based                                                                     ', 'subsample': 0.8617666337697194, 'gamma': 8.771054674597313}. Best is trial 105 with value: 4.46801687355329.
[I 2023-12-21 02:58:52,691] Trial 108 pruned. Trial was pruned at iteration 1.
[I 2023-12-21 02:58:52,726] Trial 109 pruned. Trial was pruned at iteration 0.
[I 2023-12-21 02:58:52,888] Trial 110 finished with value: 4.575482520281276 and parameters: {'learning_rate': 0.5249338520441236, 'aft_l                                                                     oss_distribution': 'normal', 'aft_loss_distribution_scale': 2.146777096459468, 'max_depth': 7, 'booster': 'gbtree', 'scale_pos_weight': 7                                                                     .949102499188656, 'alpha': 4.554469818972394, 'lambda': 8.72385883582105, 'eta': 0.9208039283299813, 'sampling_method': 'gradient_based',                                                                      'subsample': 0.8938509559790134, 'gamma': 9.718114072278086}. Best is trial 105 with value: 4.46801687355329.
[I 2023-12-21 02:58:53,037] Trial 111 finished with value: 4.560861263786238 and parameters: {'learning_rate': 0.5249625391886773, 'aft_l                                                                     oss_distribution': 'normal', 'aft_loss_distribution_scale': 2.105674761550733, 'max_depth': 7, 'booster': 'gbtree', 'scale_pos_weight': 7                                                                     .109197733785475, 'alpha': 4.7844854819654135, 'lambda': 7.865675805791371, 'eta': 0.9202417294206616, 'sampling_method': 'gradient_based                                                                     ', 'subsample': 0.8357920182225302, 'gamma': 9.289106855639313}. Best is trial 105 with value: 4.46801687355329.
[I 2023-12-21 02:58:53,291] Trial 112 finished with value: 4.575272714646442 and parameters: {'learning_rate': 0.559372037066122, 'aft_lo                                                                     ss_distribution': 'normal', 'aft_loss_distribution_scale': 2.1442359775486675, 'max_depth': 7, 'booster': 'gbtree', 'scale_pos_weight': 8                                                                     .030862928904114, 'alpha': 4.591733838520405, 'lambda': 8.742224378061978, 'eta': 0.9233116416763153, 'sampling_method': 'gradient_based'                                                                     , 'subsample': 0.8673015154282321, 'gamma': 9.352521712580394}. Best is trial 105 with value: 4.46801687355329.
[I 2023-12-21 02:58:53,327] Trial 113 pruned. Trial was pruned at iteration 0.
[I 2023-12-21 02:58:53,532] Trial 114 finished with value: 4.5715815403955125 and parameters: {'learning_rate': 0.5271524028316485, 'aft_                                                                     loss_distribution': 'normal', 'aft_loss_distribution_scale': 2.1328607459378492, 'max_depth': 7, 'booster': 'gbtree', 'scale_pos_weight':                                                                      7.010545584591484, 'alpha': 4.852973289243516, 'lambda': 9.359349882639279, 'eta': 0.9077872926558367, 'sampling_method': 'gradient_base                                                                     d', 'subsample': 0.8389477495600113, 'gamma': 9.778034308172012}. Best is trial 105 with value: 4.46801687355329.
[I 2023-12-21 02:58:53,566] Trial 115 pruned. Trial was pruned at iteration 0.
[I 2023-12-21 02:58:53,725] Trial 116 finished with value: 4.477676927404847 and parameters: {'learning_rate': 0.5540722078991518, 'aft_l                                                                     oss_distribution': 'normal', 'aft_loss_distribution_scale': 1.878180304611333, 'max_depth': 7, 'booster': 'gbtree', 'scale_pos_weight': 6                                                                     .953500161015669, 'alpha': 4.78786906092108, 'lambda': 8.682818553547103, 'eta': 0.9316844468434047, 'sampling_method': 'gradient_based',                                                                      'subsample': 0.9020281585385507, 'gamma': 9.33613798483778}. Best is trial 105 with value: 4.46801687355329.
[I 2023-12-21 02:58:53,760] Trial 117 pruned. Trial was pruned at iteration 0.
[I 2023-12-21 02:58:53,913] Trial 118 finished with value: 4.559451762096985 and parameters: {'learning_rate': 0.5579467802891432, 'aft_l                                                                     oss_distribution': 'normal', 'aft_loss_distribution_scale': 2.1014049052403263, 'max_depth': 8, 'booster': 'gbtree', 'scale_pos_weight':                                                                      5.835979756585244, 'alpha': 4.1616458817645, 'lambda': 8.56741001581803, 'eta': 0.938867538804195, 'sampling_method': 'gradient_based', '                                                                     subsample': 0.927159173360191, 'gamma': 9.289672699275803}. Best is trial 105 with value: 4.46801687355329.
[I 2023-12-21 02:58:53,949] Trial 119 pruned. Trial was pruned at iteration 1.
[I 2023-12-21 02:58:53,985] Trial 120 pruned. Trial was pruned at iteration 0.
[I 2023-12-21 02:58:54,145] Trial 121 finished with value: 4.5219597299069605 and parameters: {'learning_rate': 0.5324651127206922, 'aft_                                                                     loss_distribution': 'normal', 'aft_loss_distribution_scale': 1.994051318409353, 'max_depth': 7, 'booster': 'gbtree', 'scale_pos_weight':                                                                      6.869561353389368, 'alpha': 4.926018618471324, 'lambda': 8.731244143929692, 'eta': 0.9264468831597965, 'sampling_method': 'gradient_based                                                                     ', 'subsample': 0.8989129821325423, 'gamma': 9.888429850740087}. Best is trial 105 with value: 4.46801687355329.
[I 2023-12-21 02:58:54,181] Trial 122 pruned. Trial was pruned at iteration 0.
[I 2023-12-21 02:58:54,217] Trial 123 pruned. Trial was pruned at iteration 0.
[I 2023-12-21 02:58:54,349] Trial 124 finished with value: inf and parameters: {'learning_rate': 0.5594185863581065, 'aft_loss_distributi                                                                     on': 'normal', 'aft_loss_distribution_scale': 1.8955347431816987, 'max_depth': 7, 'booster': 'gbtree', 'scale_pos_weight': 6.547110680297                                                                     42, 'alpha': 5.667035939877789, 'lambda': 9.3257783707243, 'eta': 0.9149764293068048, 'sampling_method': 'gradient_based', 'subsample': 0                                                                     .8742359625596556, 'gamma': 9.990875836232842}. Best is trial 105 with value: 4.46801687355329.
[I 2023-12-21 02:58:54,384] Trial 125 pruned. Trial was pruned at iteration 0.
[I 2023-12-21 02:58:54,419] Trial 126 pruned. Trial was pruned at iteration 0.
[I 2023-12-21 02:58:54,454] Trial 127 pruned. Trial was pruned at iteration 0.
[I 2023-12-21 02:58:54,491] Trial 128 pruned. Trial was pruned at iteration 0.
[I 2023-12-21 02:58:54,526] Trial 129 pruned. Trial was pruned at iteration 0.
[I 2023-12-21 02:58:54,562] Trial 130 pruned. Trial was pruned at iteration 0.
[I 2023-12-21 02:58:54,597] Trial 131 pruned. Trial was pruned at iteration 0.
[I 2023-12-21 02:58:54,719] Trial 132 finished with value: inf and parameters: {'learning_rate': 0.5959831645551454, 'aft_loss_distributi                                                                     on': 'normal', 'aft_loss_distribution_scale': 1.9654414237131395, 'max_depth': 7, 'booster': 'gbtree', 'scale_pos_weight': 7.025349156430                                                                     794, 'alpha': 5.549114081066523, 'lambda': 8.816393502486521, 'eta': 0.9067771609899026, 'sampling_method': 'gradient_based', 'subsample'                                                                     : 0.8819388180792644, 'gamma': 9.25538020177525}. Best is trial 105 with value: 4.46801687355329.
[I 2023-12-21 02:58:54,929] Trial 133 finished with value: 4.595010260711599 and parameters: {'learning_rate': 0.5786305621150031, 'aft_l                                                                     oss_distribution': 'normal', 'aft_loss_distribution_scale': 2.202688579820842, 'max_depth': 7, 'booster': 'gbtree', 'scale_pos_weight': 6                                                                     .5073858369166, 'alpha': 3.861391358355304, 'lambda': 9.25529267265116, 'eta': 0.8637117127084932, 'sampling_method': 'gradient_based', '                                                                     subsample': 0.8161950050594494, 'gamma': 8.977635691078826}. Best is trial 105 with value: 4.46801687355329.
[I 2023-12-21 02:58:55,141] Trial 134 finished with value: 4.609257604661102 and parameters: {'learning_rate': 0.5779154523265111, 'aft_l                                                                     oss_distribution': 'normal', 'aft_loss_distribution_scale': 2.243393481846507, 'max_depth': 7, 'booster': 'gbtree', 'scale_pos_weight': 6                                                                     .628934466129056, 'alpha': 3.725949840244618, 'lambda': 9.291433665087872, 'eta': 0.8702610893333378, 'sampling_method': 'gradient_based'                                                                     , 'subsample': 0.8167151855003065, 'gamma': 9.040582599489605}. Best is trial 105 with value: 4.46801687355329.
[I 2023-12-21 02:58:55,177] Trial 135 pruned. Trial was pruned at iteration 0.
[I 2023-12-21 02:58:55,215] Trial 136 pruned. Trial was pruned at iteration 0.
[I 2023-12-21 02:58:55,251] Trial 137 pruned. Trial was pruned at iteration 0.
[I 2023-12-21 02:58:55,288] Trial 138 pruned. Trial was pruned at iteration 0.
[I 2023-12-21 02:58:55,502] Trial 139 finished with value: 4.579251014384725 and parameters: {'learning_rate': 0.5868845403155323, 'aft_l                                                                     oss_distribution': 'normal', 'aft_loss_distribution_scale': 2.1527456110467456, 'max_depth': 7, 'booster': 'gbtree', 'scale_pos_weight':                                                                      7.621130683381676, 'alpha': 5.308097025435194, 'lambda': 8.141701754550843, 'eta': 0.9169070828707786, 'sampling_method': 'gradient_based                                                                     ', 'subsample': 0.8668304331987445, 'gamma': 9.482233840768858}. Best is trial 105 with value: 4.46801687355329.
[I 2023-12-21 02:58:55,537] Trial 140 pruned. Trial was pruned at iteration 0.
[I 2023-12-21 02:58:55,701] Trial 141 finished with value: 4.581479039079881 and parameters: {'learning_rate': 0.5571015177079256, 'aft_l                                                                     oss_distribution': 'normal', 'aft_loss_distribution_scale': 2.1627318503523525, 'max_depth': 7, 'booster': 'gbtree', 'scale_pos_weight':                                                                      7.632746139080919, 'alpha': 5.144440539830692, 'lambda': 8.661046971086357, 'eta': 0.9532053230409221, 'sampling_method': 'gradient_based                                                                     ', 'subsample': 0.8642193538230625, 'gamma': 9.543113378445643}. Best is trial 105 with value: 4.46801687355329.
[I 2023-12-21 02:58:55,968] Trial 142 finished with value: 4.5678138930541765 and parameters: {'learning_rate': 0.5611780100043083, 'aft_                                                                     loss_distribution': 'normal', 'aft_loss_distribution_scale': 2.122446631520735, 'max_depth': 7, 'booster': 'gbtree', 'scale_pos_weight':                                                                      7.748077629358173, 'alpha': 5.190788938785338, 'lambda': 8.499361549321605, 'eta': 0.9477601053360166, 'sampling_method': 'gradient_based                                                                     ', 'subsample': 0.8722549179928053, 'gamma': 9.956498968454383}. Best is trial 105 with value: 4.46801687355329.
[I 2023-12-21 02:58:56,004] Trial 143 pruned. Trial was pruned at iteration 0.
[I 2023-12-21 02:58:56,213] Trial 144 finished with value: 4.582316610842138 and parameters: {'learning_rate': 0.5608504435384338, 'aft_l                                                                     oss_distribution': 'normal', 'aft_loss_distribution_scale': 2.164551622465108, 'max_depth': 8, 'booster': 'gbtree', 'scale_pos_weight': 7                                                                     .846534768444271, 'alpha': 5.251648185937978, 'lambda': 8.240240925254502, 'eta': 0.9687601882641932, 'sampling_method': 'gradient_based'                                                                     , 'subsample': 0.8907273977134645, 'gamma': 9.563573811618156}. Best is trial 105 with value: 4.46801687355329.
[I 2023-12-21 02:58:56,252] Trial 145 pruned. Trial was pruned at iteration 0.
[I 2023-12-21 02:58:56,287] Trial 146 pruned. Trial was pruned at iteration 0.
[I 2023-12-21 02:58:56,325] Trial 147 pruned. Trial was pruned at iteration 1.
[I 2023-12-21 02:58:57,729] Trial 148 finished with value: inf and parameters: {'learning_rate': 0.5524599905185897, 'aft_loss_distributi                                                                     on': 'normal', 'aft_loss_distribution_scale': 1.7183076397255468, 'max_depth': 7, 'booster': 'dart', 'scale_pos_weight': 8.27223478079122                                                                     1, 'alpha': 5.889913316991926, 'lambda': 8.749149493261704, 'eta': 0.9016098465587171, 'sampling_method': 'gradient_based', 'subsample':                                                                      0.7626743457103639, 'gamma': 9.967949213987152}. Best is trial 105 with value: 4.46801687355329.
[I 2023-12-21 02:58:57,768] Trial 149 pruned. Trial was pruned at iteration 0.
[I 2023-12-21 02:58:57,805] Trial 150 pruned. Trial was pruned at iteration 0.
[I 2023-12-21 02:58:58,018] Trial 151 finished with value: 4.583827401123078 and parameters: {'learning_rate': 0.562587463641618, 'aft_lo                                                                     ss_distribution': 'normal', 'aft_loss_distribution_scale': 2.169000964932484, 'max_depth': 8, 'booster': 'gbtree', 'scale_pos_weight': 7.                                                                     8677312638757595, 'alpha': 5.309455430560946, 'lambda': 8.286588642609049, 'eta': 0.9632056468335923, 'sampling_method': 'gradient_based'                                                                     , 'subsample': 0.8813432699097126, 'gamma': 9.58845255157172}. Best is trial 105 with value: 4.46801687355329.
[I 2023-12-21 02:58:58,149] Trial 152 finished with value: inf and parameters: {'learning_rate': 0.570079829276849, 'aft_loss_distributio                                                                     n': 'normal', 'aft_loss_distribution_scale': 1.9774384265734382, 'max_depth': 9, 'booster': 'gbtree', 'scale_pos_weight': 8.0208403147299                                                                     4, 'alpha': 5.4884025489021, 'lambda': 8.942719041496497, 'eta': 0.9766020925142982, 'sampling_method': 'gradient_based', 'subsample': 0.                                                                     868111818165931, 'gamma': 9.49471581699785}. Best is trial 105 with value: 4.46801687355329.
[I 2023-12-21 02:58:58,358] Trial 153 finished with value: 4.601134004595401 and parameters: {'learning_rate': 0.6065662555786349, 'aft_l                                                                     oss_distribution': 'normal', 'aft_loss_distribution_scale': 2.217390553045488, 'max_depth': 8, 'booster': 'gbtree', 'scale_pos_weight': 7                                                                     .758796389874061, 'alpha': 6.262258197082508, 'lambda': 8.397897820103758, 'eta': 0.9613527072100253, 'sampling_method': 'gradient_based'                                                                     , 'subsample': 0.8998676033197798, 'gamma': 8.747320443877074}. Best is trial 105 with value: 4.46801687355329.
[I 2023-12-21 02:58:58,397] Trial 154 pruned. Trial was pruned at iteration 0.
[I 2023-12-21 02:58:58,433] Trial 155 pruned. Trial was pruned at iteration 0.
[I 2023-12-21 02:58:58,612] Trial 156 finished with value: 4.505188686141433 and parameters: {'learning_rate': 0.5852163381868053, 'aft_l                                                                     oss_distribution': 'normal', 'aft_loss_distribution_scale': 1.9485915238476637, 'max_depth': 7, 'booster': 'gbtree', 'scale_pos_weight':                                                                      7.786618887764863, 'alpha': 4.761988498545033, 'lambda': 7.357484971647371, 'eta': 0.9833792130212892, 'sampling_method': 'gradient_based                                                                     ', 'subsample': 0.894482579209716, 'gamma': 9.455566817177685}. Best is trial 105 with value: 4.46801687355329.
[I 2023-12-21 02:58:58,890] Trial 157 finished with value: 4.404813710256019 and parameters: {'learning_rate': 0.6213987795572345, 'aft_l                                                                     oss_distribution': 'normal', 'aft_loss_distribution_scale': 1.6769181508292323, 'max_depth': 7, 'booster': 'gbtree', 'scale_pos_weight':                                                                      7.127337055684097, 'alpha': 4.312116714615656, 'lambda': 8.767942789947329, 'eta': 0.9944216335439418, 'sampling_method': 'gradient_based                                                                     ', 'subsample': 0.8039715301261521, 'gamma': 4.311267527892957}. Best is trial 157 with value: 4.404813710256019.
[I 2023-12-21 02:58:59,096] Trial 158 finished with value: 4.371896944977992 and parameters: {'learning_rate': 0.6222813614158414, 'aft_l                                                                     oss_distribution': 'normal', 'aft_loss_distribution_scale': 1.5808790558624775, 'max_depth': 7, 'booster': 'gbtree', 'scale_pos_weight':                                                                      6.803050001222083, 'alpha': 4.796600686289379, 'lambda': 7.5830650886065465, 'eta': 0.9921052667927768, 'sampling_method': 'gradient_base                                                                     d', 'subsample': 0.7678746101221653, 'gamma': 4.604416655303456}. Best is trial 158 with value: 4.371896944977992.
[I 2023-12-21 02:58:59,404] Trial 159 finished with value: 4.374764165931589 and parameters: {'learning_rate': 0.6199692043779579, 'aft_l                                                                     oss_distribution': 'normal', 'aft_loss_distribution_scale': 1.5874921392180756, 'max_depth': 7, 'booster': 'gbtree', 'scale_pos_weight':                                                                      7.237937917289877, 'alpha': 4.200101548341809, 'lambda': 7.602394256657495, 'eta': 0.9830025720051317, 'sampling_method': 'gradient_based                                                                     ', 'subsample': 0.765974515373436, 'gamma': 4.224135320142259}. Best is trial 158 with value: 4.371896944977992.
[I 2023-12-21 02:58:59,542] Trial 160 finished with value: inf and parameters: {'learning_rate': 0.6258614565924825, 'aft_loss_distributi                                                                     on': 'normal', 'aft_loss_distribution_scale': 1.5565215043764458, 'max_depth': 7, 'booster': 'gbtree', 'scale_pos_weight': 6.772989523546                                                                     693, 'alpha': 4.178573182195381, 'lambda': 7.3274663538216664, 'eta': 0.9989020202144278, 'sampling_method': 'gradient_based', 'subsample                                                                     ': 0.7685375153968318, 'gamma': 4.356318252264247}. Best is trial 158 with value: 4.371896944977992.
[I 2023-12-21 02:58:59,578] Trial 161 pruned. Trial was pruned at iteration 0.
[I 2023-12-21 02:58:59,615] Trial 162 pruned. Trial was pruned at iteration 0.
[I 2023-12-21 02:58:59,884] Trial 163 finished with value: 4.476536542996471 and parameters: {'learning_rate': 0.579135755029081, 'aft_lo                                                                     ss_distribution': 'normal', 'aft_loss_distribution_scale': 1.878454323993456, 'max_depth': 7, 'booster': 'gbtree', 'scale_pos_weight': 6.                                                                     906985841395801, 'alpha': 4.295273024822653, 'lambda': 7.202478970205071, 'eta': 0.9437408659241538, 'sampling_method': 'gradient_based',                                                                      'subsample': 0.7636937585192661, 'gamma': 4.687747612916227}. Best is trial 158 with value: 4.371896944977992.
