[I 2023-12-19 00:08:37,771] Trial 125 pruned. Trial was pruned at iteration 1.
[I 2023-12-19 00:08:37,965] Trial 126 finished with value: inf and parameters: {'learning_rate': 0.998744286560571, 'aft_loss_distribution': 'normal', 'aft_loss_distribution_scale': 2.013108518844823, 'max_depth': 5, 'booster': 'gbtree', 'scale_pos_weight': 0.6370615716805957, 'alpha': 0.8357096903841942, 'lambda': 7.352109353160136, 'eta': 0.050868620107199954, 'sampling_method': 'uniform', 'subsample': 0.5502149412258555, 'gamma': 6.575619987756339}. Best is trial 2 with value: 2.015475326357095.
[I 2023-12-19 00:08:38,035] Trial 127 pruned. Trial was pruned at iteration 1.
[I 2023-12-19 00:08:38,508] Trial 128 finished with value: 2.0791630575411393 and parameters: {'learning_rate': 0.9571624377151621, 'aft_loss_distribution': 'normal', 'aft_loss_distribution_scale': 2.4805843689996268, 'max_depth': 5, 'booster': 'gbtree', 'scale_pos_weight': 1.0422924127939173, 'alpha': 2.8565392308218156, 'lambda': 5.20783146343682, 'eta': 0.2157986695660943, 'sampling_method': 'uniform', 'subsample': 0.40683086374930544, 'gamma': 8.239383394893842}. Best is trial 2 with value: 2.015475326357095.
[I 2023-12-19 00:08:38,708] Trial 129 finished with value: inf and parameters: {'learning_rate': 0.9558667214209892, 'aft_loss_distribution': 'normal', 'aft_loss_distribution_scale': 1.8771745092600647, 'max_depth': 5, 'booster': 'gbtree', 'scale_pos_weight': 1.0940568029650608, 'alpha': 2.866447349009445, 'lambda': 5.167472559106873, 'eta': 0.2110945574048929, 'sampling_method': 'uniform', 'subsample': 0.3170206314775864, 'gamma': 8.450784774523152}. Best is trial 2 with value: 2.015475326357095.
[I 2023-12-19 00:08:38,898] Trial 130 finished with value: inf and parameters: {'learning_rate': 0.9724563533514122, 'aft_loss_distribution': 'normal', 'aft_loss_distribution_scale': 2.411565423838265, 'max_depth': 6, 'booster': 'gbtree', 'scale_pos_weight': 1.3727754178328175, 'alpha': 1.0738098689583073, 'lambda': 4.063089540090234, 'eta': 0.22699411526227042, 'sampling_method': 'uniform', 'subsample': 0.4118694998113213, 'gamma': 8.228421373403892}. Best is trial 2 with value: 2.015475326357095.
[I 2023-12-19 00:08:38,967] Trial 131 pruned. Trial was pruned at iteration 0.
[I 2023-12-19 00:08:39,032] Trial 132 pruned. Trial was pruned at iteration 0.
[I 2023-12-19 00:08:39,098] Trial 133 pruned. Trial was pruned at iteration 1.
[I 2023-12-19 00:08:39,201] Trial 134 pruned. Trial was pruned at iteration 0.
[I 2023-12-19 00:08:39,306] Trial 135 pruned. Trial was pruned at iteration 0.
[I 2023-12-19 00:08:39,406] Trial 136 pruned. Trial was pruned at iteration 0.
[I 2023-12-19 00:08:39,688] Trial 137 finished with value: inf and parameters: {'learning_rate': 0.9780613376471098, 'aft_loss_distribution': 'normal', 'aft_loss_distribution_scale': 2.2795634046034055, 'max_depth': 5, 'booster': 'gbtree', 'scale_pos_weight': 0.7412169578251231, 'alpha': 2.7531233895509226, 'lambda': 5.631524270812813, 'eta': 0.1601611865857044, 'sampling_method': 'uniform', 'subsample': 0.2979769333896493, 'gamma': 7.126548240697941}. Best is trial 2 with value: 2.015475326357095.
[I 2023-12-19 00:08:39,779] Trial 138 pruned. Trial was pruned at iteration 0.
[I 2023-12-19 00:08:40,096] Trial 139 finished with value: inf and parameters: {'learning_rate': 0.8961770568270262, 'aft_loss_distribution': 'normal', 'aft_loss_distribution_scale': 1.9584916581488065, 'max_depth': 6, 'booster': 'gbtree', 'scale_pos_weight': 0.1987895065057453, 'alpha': 3.017537622559391, 'lambda': 6.094764630942822, 'eta': 0.07381931124380153, 'sampling_method': 'uniform', 'subsample': 0.5283776462439498, 'gamma': 8.277783625942345}. Best is trial 2 with value: 2.015475326357095.
[I 2023-12-19 00:08:40,195] Trial 140 pruned. Trial was pruned at iteration 0.
[I 2023-12-19 00:08:40,300] Trial 141 pruned. Trial was pruned at iteration 0.
[I 2023-12-19 00:08:40,399] Trial 142 pruned. Trial was pruned at iteration 0.
[I 2023-12-19 00:08:40,505] Trial 143 pruned. Trial was pruned at iteration 1.
[I 2023-12-19 00:08:40,627] Trial 144 pruned. Trial was pruned at iteration 0.
[I 2023-12-19 00:08:40,737] Trial 145 pruned. Trial was pruned at iteration 0.
[I 2023-12-19 00:08:40,847] Trial 146 pruned. Trial was pruned at iteration 0.
[I 2023-12-19 00:08:40,948] Trial 147 pruned. Trial was pruned at iteration 0.
[I 2023-12-19 00:08:41,266] Trial 148 finished with value: inf and parameters: {'learning_rate': 0.8545797894956002, 'aft_loss_distribution': 'normal', 'aft_loss_distribution_scale': 2.311878936393432, 'max_depth': 5, 'booster': 'gbtree', 'scale_pos_weight': 0.6959445344229174, 'alpha': 1.333256432127202, 'lambda': 6.20842338075346, 'eta': 0.18235943996064316, 'sampling_method': 'uniform', 'subsample': 0.607700265603157, 'gamma': 7.923355138694756}. Best is trial 2 with value: 2.015475326357095.
[I 2023-12-19 00:08:41,378] Trial 149 pruned. Trial was pruned at iteration 0.
[I 2023-12-19 00:08:41,481] Trial 150 pruned. Trial was pruned at iteration 1.
[I 2023-12-19 00:08:41,592] Trial 151 pruned. Trial was pruned at iteration 0.
[I 2023-12-19 00:08:41,709] Trial 152 pruned. Trial was pruned at iteration 0.
[I 2023-12-19 00:08:41,803] Trial 153 pruned. Trial was pruned at iteration 0.
[I 2023-12-19 00:08:42,108] Trial 154 finished with value: 2.0484094603370897 and parameters: {'learning_rate': 0.9654193215999664, 'aft_loss_distribution': 'normal', 'aft_loss_distribution_scale': 2.146120913108085, 'max_depth': 5, 'booster': 'gbtree', 'scale_pos_weight': 0.7935784908207998, 'alpha': 2.2144068914076525, 'lambda': 6.91995212681844, 'eta': 0.07991256397872401, 'sampling_method': 'uniform', 'subsample': 0.33284587561519136, 'gamma': 8.302423809067127}. Best is trial 2 with value: 2.015475326357095.
[I 2023-12-19 00:08:42,436] Trial 155 finished with value: inf and parameters: {'learning_rate': 0.9822656568577324, 'aft_loss_distribution': 'normal', 'aft_loss_distribution_scale': 2.065213672386086, 'max_depth': 5, 'booster': 'gbtree', 'scale_pos_weight': 1.0205463549053961, 'alpha': 2.200559050124468, 'lambda': 6.80148624008788, 'eta': 0.07926460128708704, 'sampling_method': 'uniform', 'subsample': 0.3280405406957557, 'gamma': 8.29910846000285}. Best is trial 2 with value: 2.015475326357095.
[I 2023-12-19 00:08:42,551] Trial 156 pruned. Trial was pruned at iteration 1.
[I 2023-12-19 00:08:42,658] Trial 157 pruned. Trial was pruned at iteration 1.
[I 2023-12-19 00:08:42,773] Trial 158 pruned. Trial was pruned at iteration 1.
[I 2023-12-19 00:08:42,889] Trial 159 pruned. Trial was pruned at iteration 0.
[I 2023-12-19 00:08:42,986] Trial 160 pruned. Trial was pruned at iteration 1.
[I 2023-12-19 00:08:43,079] Trial 161 pruned. Trial was pruned at iteration 0.
[I 2023-12-19 00:08:43,187] Trial 162 pruned. Trial was pruned at iteration 0.
[I 2023-12-19 00:08:43,289] Trial 163 pruned. Trial was pruned at iteration 0.
[I 2023-12-19 00:08:43,391] Trial 164 pruned. Trial was pruned at iteration 0.
[I 2023-12-19 00:08:43,495] Trial 165 pruned. Trial was pruned at iteration 0.
[I 2023-12-19 00:08:43,610] Trial 166 pruned. Trial was pruned at iteration 0.
[I 2023-12-19 00:08:43,723] Trial 167 pruned. Trial was pruned at iteration 0.
[I 2023-12-19 00:08:43,830] Trial 168 pruned. Trial was pruned at iteration 0.
[I 2023-12-19 00:08:43,931] Trial 169 pruned. Trial was pruned at iteration 0.
[I 2023-12-19 00:08:44,252] Trial 170 finished with value: inf and parameters: {'learning_rate': 0.9175081004954664, 'aft_loss_distribution': 'normal', 'aft_loss_distribution_scale': 2.056803540022842, 'max_depth': 5, 'booster': 'gbtree', 'scale_pos_weight': 0.16469307189161836, 'alpha': 1.615484810867512, 'lambda': 3.090775759265623, 'eta': 0.04701816626275423, 'sampling_method': 'uniform', 'subsample': 0.5011428345399902, 'gamma': 7.787525037976368}. Best is trial 2 with value: 2.015475326357095.
[I 2023-12-19 00:08:44,361] Trial 171 pruned. Trial was pruned at iteration 0.
[I 2023-12-19 00:08:44,475] Trial 172 pruned. Trial was pruned at iteration 0.
[I 2023-12-19 00:08:44,561] Trial 173 pruned. Trial was pruned at iteration 0.
[I 2023-12-19 00:08:44,629] Trial 174 pruned. Trial was pruned at iteration 0.
[I 2023-12-19 00:08:44,699] Trial 175 pruned. Trial was pruned at iteration 0.
[I 2023-12-19 00:08:44,766] Trial 176 pruned. Trial was pruned at iteration 0.
[I 2023-12-19 00:08:44,832] Trial 177 pruned. Trial was pruned at iteration 0.
[I 2023-12-19 00:08:44,904] Trial 178 pruned. Trial was pruned at iteration 0.
[I 2023-12-19 00:08:44,977] Trial 179 pruned. Trial was pruned at iteration 0.
[I 2023-12-19 00:08:45,238] Trial 180 finished with value: 2.0738398818643864 and parameters: {'learning_rate': 0.9357226187806588, 'aft_loss_distribution': 'normal', 'aft_loss_distribution_scale': 2.408521472722184, 'max_depth': 4, 'booster': 'gbtree', 'scale_pos_weight': 0.1881724494098187, 'alpha': 3.2399904301058946, 'lambda': 6.304995910924096, 'eta': 0.07498637106183477, 'sampling_method': 'uniform', 'subsample': 0.38664018444643067, 'gamma': 7.66871953738416}. Best is trial 2 with value: 2.015475326357095.
[I 2023-12-19 00:08:45,553] Trial 181 finished with value: 2.0583804039151268 and parameters: {'learning_rate': 0.937298605539996, 'aft_loss_distribution': 'normal', 'aft_loss_distribution_scale': 2.3009036658419277, 'max_depth': 4, 'booster': 'gbtree', 'scale_pos_weight': 0.04235623934369798, 'alpha': 3.3000581235229838, 'lambda': 6.307180435415685, 'eta': 0.1337473200005531, 'sampling_method': 'uniform', 'subsample': 0.3793285934140581, 'gamma': 7.6788147434228}. Best is trial 2 with value: 2.015475326357095.
[I 2023-12-19 00:08:45,656] Trial 182 pruned. Trial was pruned at iteration 11.
[I 2023-12-19 00:08:45,728] Trial 183 pruned. Trial was pruned at iteration 1.
[I 2023-12-19 00:08:45,934] Trial 184 finished with value: inf and parameters: {'learning_rate': 0.9468274247682087, 'aft_loss_distribution': 'normal', 'aft_loss_distribution_scale': 2.2720982752270986, 'max_depth': 4, 'booster': 'gbtree', 'scale_pos_weight': 0.15084071040729474, 'alpha': 3.170288556896895, 'lambda': 5.933697856445357, 'eta': 0.0894831661837154, 'sampling_method': 'uniform', 'subsample': 0.40082913047196395, 'gamma': 7.625330631977971}. Best is trial 2 with value: 2.015475326357095.
[I 2023-12-19 00:08:46,011] Trial 185 pruned. Trial was pruned at iteration 1.
[I 2023-12-19 00:08:46,082] Trial 186 pruned. Trial was pruned at iteration 1.
[I 2023-12-19 00:08:50,315] Trial 187 finished with value: 2.059529141025038 and parameters: {'learning_rate': 0.9078780510604701, 'aft_loss_distribution': 'normal', 'aft_loss_distribution_scale': 2.2237783964123663, 'max_depth': 4, 'booster': 'dart', 'scale_pos_weight': 0.039697484813871975, 'alpha': 5.47022449532427, 'lambda': 6.858400344654867, 'eta': 0.8446348843296848, 'sampling_method': 'uniform', 'subsample': 0.34492701573366547, 'gamma': 7.917998330049699}. Best is trial 2 with value: 2.015475326357095.
[I 2023-12-19 00:08:58,800] Trial 188 finished with value: 2.072367325319573 and parameters: {'learning_rate': 0.9141894065300156, 'aft_loss_distribution': 'normal', 'aft_loss_distribution_scale': 2.359908699009988, 'max_depth': 4, 'booster': 'dart', 'scale_pos_weight': 0.06181637302714822, 'alpha': 5.776531537363924, 'lambda': 6.571567628799724, 'eta': 0.9083094916758149, 'sampling_method': 'uniform', 'subsample': 0.31628222581614485, 'gamma': 7.998846265050094}. Best is trial 2 with value: 2.015475326357095.
[I 2023-12-19 00:09:03,201] Trial 189 finished with value: 2.06157811856096 and parameters: {'learning_rate': 0.9162635260592197, 'aft_loss_distribution': 'normal', 'aft_loss_distribution_scale': 2.2438352927525016, 'max_depth': 4, 'booster': 'dart', 'scale_pos_weight': 0.05325260874581465, 'alpha': 5.871921686994671, 'lambda': 6.664030373202084, 'eta': 0.8842631431479746, 'sampling_method': 'uniform', 'subsample': 0.3390678292697059, 'gamma': 7.95893792948047}. Best is trial 2 with value: 2.015475326357095.
[I 2023-12-19 00:09:11,025] Trial 190 finished with value: 2.0551365314640027 and parameters: {'learning_rate': 0.914670894603692, 'aft_loss_distribution': 'normal', 'aft_loss_distribution_scale': 2.199619077289532, 'max_depth': 4, 'booster': 'dart', 'scale_pos_weight': 0.03890280364180228, 'alpha': 5.969318978271024, 'lambda': 6.625374520075632, 'eta': 0.8869789151024806, 'sampling_method': 'uniform', 'subsample': 0.32026369984951875, 'gamma': 8.178827736198356}. Best is trial 2 with value: 2.015475326357095.
[I 2023-12-19 00:09:15,795] Trial 191 finished with value: 2.0542540759184758 and parameters: {'learning_rate': 0.8906234405678062, 'aft_loss_distribution': 'normal', 'aft_loss_distribution_scale': 2.187963970863989, 'max_depth': 4, 'booster': 'dart', 'scale_pos_weight': 0.053682429161664935, 'alpha': 6.010423717444931, 'lambda': 6.910751971848436, 'eta': 0.8742558117953462, 'sampling_method': 'uniform', 'subsample': 0.2774591363263887, 'gamma': 8.124101644961275}. Best is trial 2 with value: 2.015475326357095.
[I 2023-12-19 00:09:22,356] Trial 192 finished with value: 2.0507969278006373 and parameters: {'learning_rate': 0.9147415888643995, 'aft_loss_distribution': 'normal', 'aft_loss_distribution_scale': 2.110817684400571, 'max_depth': 4, 'booster': 'dart', 'scale_pos_weight': 0.10088952470770612, 'alpha': 6.153766043019613, 'lambda': 6.765197089504273, 'eta': 0.8963016336555608, 'sampling_method': 'uniform', 'subsample': 0.26368013196499296, 'gamma': 8.46908664826358}. Best is trial 2 with value: 2.015475326357095.
[I 2023-12-19 00:09:30,816] Trial 193 finished with value: 2.0523020499415363 and parameters: {'learning_rate': 0.9147947740768239, 'aft_loss_distribution': 'normal', 'aft_loss_distribution_scale': 2.129181159557948, 'max_depth': 4, 'booster': 'dart', 'scale_pos_weight': 0.04032067421340832, 'alpha': 5.7144961457347305, 'lambda': 6.571570099721482, 'eta': 0.8733220450494926, 'sampling_method': 'uniform', 'subsample': 0.274038740065741, 'gamma': 8.539421955846347}. Best is trial 2 with value: 2.015475326357095.
[I 2023-12-19 00:09:33,843] Trial 194 finished with value: 2.043601273107689 and parameters: {'learning_rate': 0.9163270834499906, 'aft_loss_distribution': 'normal', 'aft_loss_distribution_scale': 2.0394338448161617, 'max_depth': 4, 'booster': 'dart', 'scale_pos_weight': 0.043327470226388345, 'alpha': 6.030973917780615, 'lambda': 6.862364029604327, 'eta': 0.872785844753754, 'sampling_method': 'uniform', 'subsample': 0.2093097370445382, 'gamma': 8.600343261699859}. Best is trial 2 with value: 2.015475326357095.
[I 2023-12-19 00:09:36,651] Trial 195 finished with value: 2.0477844779086047 and parameters: {'learning_rate': 0.9029242921649516, 'aft_loss_distribution': 'normal', 'aft_loss_distribution_scale': 2.1051494705924982, 'max_depth': 4, 'booster': 'dart', 'scale_pos_weight': 0.04146004734313215, 'alpha': 5.884247187081094, 'lambda': 6.8901895289925115, 'eta': 0.8964928200342029, 'sampling_method': 'uniform', 'subsample': 0.19251751282721735, 'gamma': 8.658347632136522}. Best is trial 2 with value: 2.015475326357095.
[I 2023-12-19 00:09:43,664] Trial 196 finished with value: 2.0301100749991927 and parameters: {'learning_rate': 0.9085468757633026, 'aft_loss_distribution': 'normal', 'aft_loss_distribution_scale': 1.8554535761881794, 'max_depth': 4, 'booster': 'dart', 'scale_pos_weight': 0.044171422878510336, 'alpha': 5.960648907383309, 'lambda': 6.890287076797276, 'eta': 0.8863104609970734, 'sampling_method': 'uniform', 'subsample': 0.1776573379897979, 'gamma': 9.061854294052823}. Best is trial 2 with value: 2.015475326357095.
[I 2023-12-19 00:09:43,743] Trial 197 pruned. Trial was pruned at iteration 0.
[I 2023-12-19 00:09:53,342] Trial 198 finished with value: 2.028468283895526 and parameters: {'learning_rate': 0.909743209643255, 'aft_loss_distribution': 'normal', 'aft_loss_distribution_scale': 1.9054560497073931, 'max_depth': 4, 'booster': 'dart', 'scale_pos_weight': 0.06386268449323575, 'alpha': 6.121922855793532, 'lambda': 7.0905217726010195, 'eta': 0.8917210485045947, 'sampling_method': 'uniform', 'subsample': 0.17612751198921933, 'gamma': 9.131029606659055}. Best is trial 2 with value: 2.015475326357095.
[I 2023-12-19 00:09:58,889] Trial 199 finished with value: 2.0280616100459667 and parameters: {'learning_rate': 0.9110401690990545, 'aft_loss_distribution': 'normal', 'aft_loss_distribution_scale': 1.8691670076118205, 'max_depth': 4, 'booster': 'dart', 'scale_pos_weight': 0.047323698102631116, 'alpha': 6.1883123208480155, 'lambda': 7.0435641571469, 'eta': 0.886055393322957, 'sampling_method': 'uniform', 'subsample': 0.16430730497535362, 'gamma': 8.998292497000064}. Best is trial 2 with value: 2.015475326357095.
[I 2023-12-19 00:10:05,029] Trial 200 finished with value: 2.030515432790179 and parameters: {'learning_rate': 0.9017145986946439, 'aft_loss_distribution': 'normal', 'aft_loss_distribution_scale': 1.8540937510554656, 'max_depth': 4, 'booster': 'dart', 'scale_pos_weight': 0.04745462374612833, 'alpha': 6.22113526179424, 'lambda': 7.1156071426562235, 'eta': 0.8886919525513702, 'sampling_method': 'uniform', 'subsample': 0.1582318378107781, 'gamma': 9.204827567003043}. Best is trial 2 with value: 2.015475326357095.
[I 2023-12-19 00:10:33,247] Trial 201 finished with value: 2.0312646778552637 and parameters: {'learning_rate': 0.9127756030261103, 'aft_loss_distribution': 'normal', 'aft_loss_distribution_scale': 1.8999795155686852, 'max_depth': 4, 'booster': 'dart', 'scale_pos_weight': 0.05542547880300033, 'alpha': 6.183149465784092, 'lambda': 6.8241958994684415, 'eta': 0.8874164024178787, 'sampling_method': 'uniform', 'subsample': 0.15122293189003694, 'gamma': 9.199518323832239}. Best is trial 2 with value: 2.015475326357095.
[I 2023-12-19 00:10:40,348] Trial 202 finished with value: 2.0367729567662844 and parameters: {'learning_rate': 0.9141298641143742, 'aft_loss_distribution': 'normal', 'aft_loss_distribution_scale': 1.8645420233330532, 'max_depth': 4, 'booster': 'dart', 'scale_pos_weight': 0.03938664458681226, 'alpha': 6.1326341305959104, 'lambda': 7.0661380577085176, 'eta': 0.8848841787337547, 'sampling_method': 'uniform', 'subsample': 0.14893706126071277, 'gamma': 9.172924066457774}. Best is trial 2 with value: 2.015475326357095.
[I 2023-12-19 00:10:40,467] Trial 203 pruned. Trial was pruned at iteration 0.
[I 2023-12-19 00:10:40,537] Trial 204 pruned. Trial was pruned at iteration 0.
[I 2023-12-19 00:10:46,348] Trial 205 finished with value: 2.0209975436004197 and parameters: {'learning_rate': 0.9109580674373524, 'aft_loss_distribution': 'normal', 'aft_loss_distribution_scale': 1.7989971324720835, 'max_depth': 4, 'booster': 'dart', 'scale_pos_weight': 0.04392523287965961, 'alpha': 5.609557463698332, 'lambda': 7.042827786579197, 'eta': 0.8775133885777767, 'sampling_method': 'uniform', 'subsample': 0.18175810560444083, 'gamma': 9.750183245288971}. Best is trial 2 with value: 2.015475326357095.
[I 2023-12-19 00:10:46,423] Trial 206 pruned. Trial was pruned at iteration 0.
[I 2023-12-19 00:10:46,497] Trial 207 pruned. Trial was pruned at iteration 0.
[I 2023-12-19 00:10:46,568] Trial 208 pruned. Trial was pruned at iteration 0.
[I 2023-12-19 00:10:46,651] Trial 209 pruned. Trial was pruned at iteration 0.
[I 2023-12-19 00:10:46,726] Trial 210 pruned. Trial was pruned at iteration 0.
[I 2023-12-19 00:11:34,519] Trial 211 finished with value: 2.0274342560700136 and parameters: {'learning_rate': 0.9269393106401909, 'aft_loss_distribution': 'normal', 'aft_loss_distribution_scale': 1.850395795110293, 'max_depth': 4, 'booster': 'dart', 'scale_pos_weight': 0.039659072286132635, 'alpha': 5.58744536555916, 'lambda': 6.806460436804751, 'eta': 0.8976940431798661, 'sampling_method': 'uniform', 'subsample': 0.12936736202393923, 'gamma': 9.164304939072618}. Best is trial 2 with value: 2.015475326357095.
[I 2023-12-19 00:11:36,423] Trial 212 finished with value: inf and parameters: {'learning_rate': 0.9212626167600209, 'aft_loss_distribution': 'normal', 'aft_loss_distribution_scale': 1.7786818215984295, 'max_depth': 4, 'booster': 'dart', 'scale_pos_weight': 0.04168877184091283, 'alpha': 5.618719792723234, 'lambda': 6.835832916432557, 'eta': 0.9001762922343853, 'sampling_method': 'uniform', 'subsample': 0.12010166809519326, 'gamma': 9.267648460393797}. Best is trial 2 with value: 2.015475326357095.
[I 2023-12-19 00:11:41,491] Trial 213 finished with value: 2.057191628800305 and parameters: {'learning_rate': 0.9307887848935402, 'aft_loss_distribution': 'normal', 'aft_loss_distribution_scale': 2.0546916647630553, 'max_depth': 4, 'booster': 'dart', 'scale_pos_weight': 0.15633818355060314, 'alpha': 6.0386780703043055, 'lambda': 6.989592496202176, 'eta': 0.8228491629502722, 'sampling_method': 'uniform', 'subsample': 0.1411640694028994, 'gamma': 9.428120615704087}. Best is trial 2 with value: 2.015475326357095.
[I 2023-12-19 00:11:44,230] Trial 214 finished with value: 2.0488925382114362 and parameters: {'learning_rate': 0.9320837076592826, 'aft_loss_distribution': 'normal', 'aft_loss_distribution_scale': 2.0389369567379187, 'max_depth': 4, 'booster': 'dart', 'scale_pos_weight': 0.16647295449374097, 'alpha': 6.705428262625434, 'lambda': 7.063696035297632, 'eta': 0.8188146641579486, 'sampling_method': 'uniform', 'subsample': 0.14227588468734767, 'gamma': 9.834052111066567}. Best is trial 2 with value: 2.015475326357095.
[I 2023-12-19 00:11:50,010] Trial 215 finished with value: 2.0433170217945857 and parameters: {'learning_rate': 0.9335235024863062, 'aft_loss_distribution': 'normal', 'aft_loss_distribution_scale': 1.9394591529286365, 'max_depth': 4, 'booster': 'dart', 'scale_pos_weight': 0.16782545650805117, 'alpha': 6.778631835702034, 'lambda': 7.089767303603646, 'eta': 0.8109100845052414, 'sampling_method': 'uniform', 'subsample': 0.13896129730331733, 'gamma': 9.48881195599007}. Best is trial 2 with value: 2.015475326357095.
