[I 2023-12-21 02:32:02,252] Trial 169 pruned. Trial was pruned at iteration 0.
[I 2023-12-21 02:32:02,296] Trial 170 pruned. Trial was pruned at iteration 3.
[I 2023-12-21 02:32:02,335] Trial 171 pruned. Trial was pruned at iteration 1.
[I 2023-12-21 02:32:02,374] Trial 172 pruned. Trial was pruned at iteration 0.
[I 2023-12-21 02:32:02,412] Trial 173 pruned. Trial was pruned at iteration 0.
[I 2023-12-21 02:32:02,619] Trial 174 finished with value: 4.281493305432733 and parameters: {'learning_rate': 0.7151595152814563, 'aft_l                                                                     oss_distribution': 'normal', 'aft_loss_distribution_scale': 1.2294900769197228, 'max_depth': 9, 'booster': 'gbtree', 'scale_pos_weight':                                                                      6.561701526662972, 'alpha': 9.40811730303955, 'lambda': 0.584349880069122, 'eta': 0.2696704236619289, 'sampling_method': 'gradient_based'                                                                     , 'subsample': 0.8599194050657633, 'gamma': 9.32791676014045}. Best is trial 156 with value: 4.239607290306937.
[I 2023-12-21 02:32:02,817] Trial 175 finished with value: 4.284330394542614 and parameters: {'learning_rate': 0.7549771453661775, 'aft_l                                                                     oss_distribution': 'normal', 'aft_loss_distribution_scale': 1.2441322870334965, 'max_depth': 9, 'booster': 'gbtree', 'scale_pos_weight':                                                                      8.011183269756755, 'alpha': 9.426476426141754, 'lambda': 0.5914343418449604, 'eta': 0.202160055491283, 'sampling_method': 'gradient_based                                                                     ', 'subsample': 0.8552455295337213, 'gamma': 9.298233447010631}. Best is trial 156 with value: 4.239607290306937.
[I 2023-12-21 02:32:02,857] Trial 176 pruned. Trial was pruned at iteration 0.
[I 2023-12-21 02:32:02,972] Trial 177 finished with value: inf and parameters: {'learning_rate': 0.7442222153309472, 'aft_loss_distributi                                                                     on': 'normal', 'aft_loss_distribution_scale': 1.20662139357811, 'max_depth': 9, 'booster': 'gbtree', 'scale_pos_weight': 8.17830371253080                                                                     7, 'alpha': 9.514107203129038, 'lambda': 0.8430956860125303, 'eta': 0.24392402150845435, 'sampling_method': 'gradient_based', 'subsample'                                                                     : 0.8006106529282347, 'gamma': 9.016274681433657}. Best is trial 156 with value: 4.239607290306937.
[I 2023-12-21 02:32:03,082] Trial 178 finished with value: inf and parameters: {'learning_rate': 0.8015805747097833, 'aft_loss_distributi                                                                     on': 'normal', 'aft_loss_distribution_scale': 1.0022950023089447, 'max_depth': 9, 'booster': 'gbtree', 'scale_pos_weight': 9.075560109232                                                                     285, 'alpha': 9.333093279258195, 'lambda': 0.5282947453719798, 'eta': 0.16396346211289275, 'sampling_method': 'uniform', 'subsample': 0.8                                                                     331679097613968, 'gamma': 8.685831485596287}. Best is trial 156 with value: 4.239607290306937.
[I 2023-12-21 02:32:03,122] Trial 179 pruned. Trial was pruned at iteration 0.
[I 2023-12-21 02:32:03,164] Trial 180 pruned. Trial was pruned at iteration 0.
[I 2023-12-21 02:32:03,203] Trial 181 pruned. Trial was pruned at iteration 1.
[I 2023-12-21 02:32:03,242] Trial 182 pruned. Trial was pruned at iteration 0.
[I 2023-12-21 02:32:03,358] Trial 183 finished with value: inf and parameters: {'learning_rate': 0.7550092270404647, 'aft_loss_distributi                                                                     on': 'normal', 'aft_loss_distribution_scale': 1.3279764459012489, 'max_depth': 9, 'booster': 'gbtree', 'scale_pos_weight': 7.279188312215                                                                     435, 'alpha': 7.433799829311643, 'lambda': 0.49915073033042623, 'eta': 0.23014523916459234, 'sampling_method': 'gradient_based', 'subsamp                                                                     le': 0.4842251270533319, 'gamma': 9.501116279160811}. Best is trial 156 with value: 4.239607290306937.
[I 2023-12-21 02:32:03,400] Trial 184 pruned. Trial was pruned at iteration 1.
[I 2023-12-21 02:32:03,439] Trial 185 pruned. Trial was pruned at iteration 0.
[I 2023-12-21 02:32:03,481] Trial 186 pruned. Trial was pruned at iteration 1.
[I 2023-12-21 02:32:03,521] Trial 187 pruned. Trial was pruned at iteration 0.
[I 2023-12-21 02:32:03,561] Trial 188 pruned. Trial was pruned at iteration 1.
[I 2023-12-21 02:32:03,600] Trial 189 pruned. Trial was pruned at iteration 0.
[I 2023-12-21 02:32:03,641] Trial 190 pruned. Trial was pruned at iteration 0.
[I 2023-12-21 02:32:03,699] Trial 191 pruned. Trial was pruned at iteration 0.
[I 2023-12-21 02:32:03,740] Trial 192 pruned. Trial was pruned at iteration 1.
[I 2023-12-21 02:32:03,779] Trial 193 pruned. Trial was pruned at iteration 0.
[I 2023-12-21 02:32:03,818] Trial 194 pruned. Trial was pruned at iteration 0.
[I 2023-12-21 02:32:03,867] Trial 195 pruned. Trial was pruned at iteration 2.
[I 2023-12-21 02:32:03,915] Trial 196 pruned. Trial was pruned at iteration 0.
[I 2023-12-21 02:32:03,955] Trial 197 pruned. Trial was pruned at iteration 1.
[I 2023-12-21 02:32:03,994] Trial 198 pruned. Trial was pruned at iteration 0.
[I 2023-12-21 02:32:04,034] Trial 199 pruned. Trial was pruned at iteration 0.
[I 2023-12-21 02:32:04,075] Trial 200 pruned. Trial was pruned at iteration 1.
[I 2023-12-21 02:32:04,113] Trial 201 pruned. Trial was pruned at iteration 0.
[I 2023-12-21 02:32:04,154] Trial 202 pruned. Trial was pruned at iteration 0.
[I 2023-12-21 02:32:04,195] Trial 203 pruned. Trial was pruned at iteration 0.
[I 2023-12-21 02:32:04,237] Trial 204 pruned. Trial was pruned at iteration 1.
[I 2023-12-21 02:32:04,278] Trial 205 pruned. Trial was pruned at iteration 0.
[I 2023-12-21 02:32:04,321] Trial 206 pruned. Trial was pruned at iteration 2.
[I 2023-12-21 02:32:04,360] Trial 207 pruned. Trial was pruned at iteration 0.
[I 2023-12-21 02:32:04,400] Trial 208 pruned. Trial was pruned at iteration 0.
[I 2023-12-21 02:32:04,441] Trial 209 pruned. Trial was pruned at iteration 0.
[I 2023-12-21 02:32:04,480] Trial 210 pruned. Trial was pruned at iteration 0.
[I 2023-12-21 02:32:04,520] Trial 211 pruned. Trial was pruned at iteration 0.
[I 2023-12-21 02:32:04,559] Trial 212 pruned. Trial was pruned at iteration 0.
[I 2023-12-21 02:32:04,598] Trial 213 pruned. Trial was pruned at iteration 0.
[I 2023-12-21 02:32:04,639] Trial 214 pruned. Trial was pruned at iteration 0.
[I 2023-12-21 02:32:04,681] Trial 215 pruned. Trial was pruned at iteration 1.
[I 2023-12-21 02:32:04,721] Trial 216 pruned. Trial was pruned at iteration 0.
[I 2023-12-21 02:32:04,761] Trial 217 pruned. Trial was pruned at iteration 0.
[I 2023-12-21 02:32:04,801] Trial 218 pruned. Trial was pruned at iteration 0.
[I 2023-12-21 02:32:04,842] Trial 219 pruned. Trial was pruned at iteration 0.
[I 2023-12-21 02:32:04,883] Trial 220 pruned. Trial was pruned at iteration 1.
[I 2023-12-21 02:32:04,924] Trial 221 pruned. Trial was pruned at iteration 0.
[I 2023-12-21 02:32:04,964] Trial 222 pruned. Trial was pruned at iteration 0.
[I 2023-12-21 02:32:05,006] Trial 223 pruned. Trial was pruned at iteration 0.
[I 2023-12-21 02:32:05,046] Trial 224 pruned. Trial was pruned at iteration 0.
[I 2023-12-21 02:32:05,163] Trial 225 finished with value: inf and parameters: {'learning_rate': 0.791999829010127, 'aft_loss_distributio                                                                     n': 'normal', 'aft_loss_distribution_scale': 1.1338296200687512, 'max_depth': 9, 'booster': 'gbtree', 'scale_pos_weight': 6.8493328031199                                                                     17, 'alpha': 6.937277679785718, 'lambda': 2.495577222093921, 'eta': 0.8959489515133549, 'sampling_method': 'gradient_based', 'subsample':                                                                      0.6957608101859929, 'gamma': 9.333722882892689}. Best is trial 156 with value: 4.239607290306937.
[I 2023-12-21 02:32:05,205] Trial 226 pruned. Trial was pruned at iteration 0.
[I 2023-12-21 02:32:05,248] Trial 227 pruned. Trial was pruned at iteration 1.
[I 2023-12-21 02:32:05,289] Trial 228 pruned. Trial was pruned at iteration 0.
[I 2023-12-21 02:32:05,330] Trial 229 pruned. Trial was pruned at iteration 0.
[I 2023-12-21 02:32:05,372] Trial 230 pruned. Trial was pruned at iteration 0.
[I 2023-12-21 02:32:05,412] Trial 231 pruned. Trial was pruned at iteration 0.
[I 2023-12-21 02:32:05,456] Trial 232 pruned. Trial was pruned at iteration 1.
[I 2023-12-21 02:32:05,496] Trial 233 pruned. Trial was pruned at iteration 0.
[I 2023-12-21 02:32:05,537] Trial 234 pruned. Trial was pruned at iteration 0.
[I 2023-12-21 02:32:05,580] Trial 235 pruned. Trial was pruned at iteration 0.
[I 2023-12-21 02:32:05,621] Trial 236 pruned. Trial was pruned at iteration 0.
[I 2023-12-21 02:32:05,665] Trial 237 pruned. Trial was pruned at iteration 1.
[I 2023-12-21 02:32:05,706] Trial 238 pruned. Trial was pruned at iteration 0.
[I 2023-12-21 02:32:05,748] Trial 239 pruned. Trial was pruned at iteration 0.
[I 2023-12-21 02:32:05,790] Trial 240 pruned. Trial was pruned at iteration 0.
[I 2023-12-21 02:32:05,833] Trial 241 pruned. Trial was pruned at iteration 0.
[I 2023-12-21 02:32:05,875] Trial 242 pruned. Trial was pruned at iteration 0.
[I 2023-12-21 02:32:05,916] Trial 243 pruned. Trial was pruned at iteration 0.
[I 2023-12-21 02:32:05,958] Trial 244 pruned. Trial was pruned at iteration 0.
[I 2023-12-21 02:32:05,999] Trial 245 pruned. Trial was pruned at iteration 0.
[I 2023-12-21 02:32:06,041] Trial 246 pruned. Trial was pruned at iteration 0.
[I 2023-12-21 02:32:06,089] Trial 247 pruned. Trial was pruned at iteration 0.
[I 2023-12-21 02:32:06,133] Trial 248 pruned. Trial was pruned at iteration 0.
[I 2023-12-21 02:32:06,179] Trial 249 pruned. Trial was pruned at iteration 1.
[I 2023-12-21 02:32:06,297] Trial 250 finished with value: inf and parameters: {'learning_rate': 0.7706284220221261, 'aft_loss_distributi                                                                     on': 'normal', 'aft_loss_distribution_scale': 1.2802512181739432, 'max_depth': 7, 'booster': 'gbtree', 'scale_pos_weight': 7.149126822506                                                                     2985, 'alpha': 8.771214839042253, 'lambda': 0.422324430604734, 'eta': 0.39713675460314407, 'sampling_method': 'gradient_based', 'subsampl                                                                     e': 0.5292337130249747, 'gamma': 8.815019168798411}. Best is trial 156 with value: 4.239607290306937.
[I 2023-12-21 02:32:06,340] Trial 251 pruned. Trial was pruned at iteration 0.
[I 2023-12-21 02:32:06,382] Trial 252 pruned. Trial was pruned at iteration 0.
[I 2023-12-21 02:32:06,424] Trial 253 pruned. Trial was pruned at iteration 0.
[I 2023-12-21 02:32:06,475] Trial 254 pruned. Trial was pruned at iteration 1.
[I 2023-12-21 02:32:06,518] Trial 255 pruned. Trial was pruned at iteration 0.
[I 2023-12-21 02:32:06,560] Trial 256 pruned. Trial was pruned at iteration 0.
[I 2023-12-21 02:32:06,603] Trial 257 pruned. Trial was pruned at iteration 0.
[I 2023-12-21 02:32:06,646] Trial 258 pruned. Trial was pruned at iteration 0.
[I 2023-12-21 02:32:06,690] Trial 259 pruned. Trial was pruned at iteration 0.
[I 2023-12-21 02:32:06,734] Trial 260 pruned. Trial was pruned at iteration 0.
[I 2023-12-21 02:32:06,778] Trial 261 pruned. Trial was pruned at iteration 1.
[I 2023-12-21 02:32:06,821] Trial 262 pruned. Trial was pruned at iteration 0.
[I 2023-12-21 02:32:06,867] Trial 263 pruned. Trial was pruned at iteration 1.
[I 2023-12-21 02:32:06,910] Trial 264 pruned. Trial was pruned at iteration 0.
[I 2023-12-21 02:32:06,953] Trial 265 pruned. Trial was pruned at iteration 0.
[I 2023-12-21 02:32:06,996] Trial 266 pruned. Trial was pruned at iteration 0.
[I 2023-12-21 02:32:07,041] Trial 267 pruned. Trial was pruned at iteration 0.
[I 2023-12-21 02:32:07,084] Trial 268 pruned. Trial was pruned at iteration 0.
[I 2023-12-21 02:32:07,127] Trial 269 pruned. Trial was pruned at iteration 0.
[I 2023-12-21 02:32:07,173] Trial 270 pruned. Trial was pruned at iteration 0.
[I 2023-12-21 02:32:07,216] Trial 271 pruned. Trial was pruned at iteration 0.
[I 2023-12-21 02:32:07,260] Trial 272 pruned. Trial was pruned at iteration 0.
[I 2023-12-21 02:32:07,306] Trial 273 pruned. Trial was pruned at iteration 0.
[I 2023-12-21 02:32:07,349] Trial 274 pruned. Trial was pruned at iteration 0.
[I 2023-12-21 02:32:07,394] Trial 275 pruned. Trial was pruned at iteration 1.
[I 2023-12-21 02:32:07,437] Trial 276 pruned. Trial was pruned at iteration 0.
[I 2023-12-21 02:32:07,482] Trial 277 pruned. Trial was pruned at iteration 0.
[I 2023-12-21 02:32:07,526] Trial 278 pruned. Trial was pruned at iteration 0.
[I 2023-12-21 02:32:07,576] Trial 279 pruned. Trial was pruned at iteration 0.
[I 2023-12-21 02:32:07,620] Trial 280 pruned. Trial was pruned at iteration 0.
[I 2023-12-21 02:32:07,664] Trial 281 pruned. Trial was pruned at iteration 1.
[I 2023-12-21 02:32:07,925] Trial 282 finished with value: 4.281694256662138 and parameters: {'learning_rate': 0.7655464501383649, 'aft_l                                                                     oss_distribution': 'normal', 'aft_loss_distribution_scale': 1.249598863211681, 'max_depth': 7, 'booster': 'gbtree', 'scale_pos_weight': 5                                                                     .500467984745853, 'alpha': 8.390906694539241, 'lambda': 2.469301022614717, 'eta': 0.29899195964453074, 'sampling_method': 'gradient_based                                                                     ', 'subsample': 0.8948140209081863, 'gamma': 9.031382598965315}. Best is trial 156 with value: 4.239607290306937.
[I 2023-12-21 02:32:08,045] Trial 283 finished with value: inf and parameters: {'learning_rate': 0.7749179450716155, 'aft_loss_distributi                                                                     on': 'normal', 'aft_loss_distribution_scale': 1.2232568519223244, 'max_depth': 7, 'booster': 'gbtree', 'scale_pos_weight': 5.896282109223                                                                     122, 'alpha': 8.381842367273823, 'lambda': 2.06493802052764, 'eta': 0.3165666779193663, 'sampling_method': 'gradient_based', 'subsample':                                                                      0.8973595969915517, 'gamma': 9.005277290486152}. Best is trial 156 with value: 4.239607290306937.
[I 2023-12-21 02:32:08,088] Trial 284 pruned. Trial was pruned at iteration 0.
[I 2023-12-21 02:32:08,134] Trial 285 pruned. Trial was pruned at iteration 1.
[I 2023-12-21 02:32:08,255] Trial 286 finished with value: inf and parameters: {'learning_rate': 0.7568174869283016, 'aft_loss_distributi                                                                     on': 'normal', 'aft_loss_distribution_scale': 1.1723580180696338, 'max_depth': 7, 'booster': 'gbtree', 'scale_pos_weight': 8.889164611244                                                                     933, 'alpha': 8.60981860342083, 'lambda': 2.754002840149062, 'eta': 0.3196502522965666, 'sampling_method': 'gradient_based', 'subsample':                                                                      0.8894320071336779, 'gamma': 9.443982175088777}. Best is trial 156 with value: 4.239607290306937.
[I 2023-12-21 02:32:08,300] Trial 287 pruned. Trial was pruned at iteration 0.
[I 2023-12-21 02:32:08,345] Trial 288 pruned. Trial was pruned at iteration 0.
[I 2023-12-21 02:32:08,467] Trial 289 finished with value: inf and parameters: {'learning_rate': 0.789770467217449, 'aft_loss_distributio                                                                     n': 'normal', 'aft_loss_distribution_scale': 1.0297665306406556, 'max_depth': 7, 'booster': 'gbtree', 'scale_pos_weight': 6.0644260583533                                                                     77, 'alpha': 8.46504273719451, 'lambda': 1.438527130975591, 'eta': 0.26627967810958386, 'sampling_method': 'gradient_based', 'subsample':                                                                      0.906282202507497, 'gamma': 9.744948856833032}. Best is trial 156 with value: 4.239607290306937.
[I 2023-12-21 02:32:08,512] Trial 290 pruned. Trial was pruned at iteration 0.
[I 2023-12-21 02:32:08,557] Trial 291 pruned. Trial was pruned at iteration 0.
[I 2023-12-21 02:32:08,600] Trial 292 pruned. Trial was pruned at iteration 0.
[I 2023-12-21 02:32:08,645] Trial 293 pruned. Trial was pruned at iteration 0.
[I 2023-12-21 02:32:08,695] Trial 294 pruned. Trial was pruned at iteration 0.
[I 2023-12-21 02:32:08,739] Trial 295 pruned. Trial was pruned at iteration 0.
[I 2023-12-21 02:32:08,785] Trial 296 pruned. Trial was pruned at iteration 1.
[I 2023-12-21 02:32:08,829] Trial 297 pruned. Trial was pruned at iteration 0.
[I 2023-12-21 02:32:08,875] Trial 298 pruned. Trial was pruned at iteration 1.
[I 2023-12-21 02:32:08,920] Trial 299 pruned. Trial was pruned at iteration 0.
[I 2023-12-21 02:32:08,964] Trial 300 pruned. Trial was pruned at iteration 0.
[I 2023-12-21 02:32:09,013] Trial 301 pruned. Trial was pruned at iteration 1.
[I 2023-12-21 02:32:09,059] Trial 302 pruned. Trial was pruned at iteration 0.
[I 2023-12-21 02:32:09,105] Trial 303 pruned. Trial was pruned at iteration 0.
[I 2023-12-21 02:32:09,150] Trial 304 pruned. Trial was pruned at iteration 0.
[I 2023-12-21 02:32:09,196] Trial 305 pruned. Trial was pruned at iteration 0.
[I 2023-12-21 02:32:09,240] Trial 306 pruned. Trial was pruned at iteration 0.
[I 2023-12-21 02:32:09,286] Trial 307 pruned. Trial was pruned at iteration 0.
[I 2023-12-21 02:32:09,332] Trial 308 pruned. Trial was pruned at iteration 1.
[I 2023-12-21 02:32:09,378] Trial 309 pruned. Trial was pruned at iteration 0.
[I 2023-12-21 02:32:09,424] Trial 310 pruned. Trial was pruned at iteration 0.
[I 2023-12-21 02:32:09,469] Trial 311 pruned. Trial was pruned at iteration 0.
[I 2023-12-21 02:32:09,514] Trial 312 pruned. Trial was pruned at iteration 0.
[I 2023-12-21 02:32:09,564] Trial 313 pruned. Trial was pruned at iteration 1.
[I 2023-12-21 02:32:09,608] Trial 314 pruned. Trial was pruned at iteration 0.
[I 2023-12-21 02:32:09,653] Trial 315 pruned. Trial was pruned at iteration 0.
[I 2023-12-21 02:32:09,699] Trial 316 pruned. Trial was pruned at iteration 1.
[I 2023-12-21 02:32:09,745] Trial 317 pruned. Trial was pruned at iteration 0.
[I 2023-12-21 02:32:09,791] Trial 318 pruned. Trial was pruned at iteration 0.
[I 2023-12-21 02:32:09,838] Trial 319 pruned. Trial was pruned at iteration 1.
[I 2023-12-21 02:32:09,886] Trial 320 pruned. Trial was pruned at iteration 0.
[I 2023-12-21 02:32:09,931] Trial 321 pruned. Trial was pruned at iteration 0.
[I 2023-12-21 02:32:09,977] Trial 322 pruned. Trial was pruned at iteration 0.
[I 2023-12-21 02:32:10,022] Trial 323 pruned. Trial was pruned at iteration 0.
[I 2023-12-21 02:32:10,068] Trial 324 pruned. Trial was pruned at iteration 0.
[I 2023-12-21 02:32:10,114] Trial 325 pruned. Trial was pruned at iteration 0.
[I 2023-12-21 02:32:10,172] Trial 326 pruned. Trial was pruned at iteration 1.
[I 2023-12-21 02:32:10,219] Trial 327 pruned. Trial was pruned at iteration 0.
[I 2023-12-21 02:32:10,265] Trial 328 pruned. Trial was pruned at iteration 0.
[I 2023-12-21 02:32:10,312] Trial 329 pruned. Trial was pruned at iteration 1.
[I 2023-12-21 02:32:10,360] Trial 330 pruned. Trial was pruned at iteration 1.
[I 2023-12-21 02:32:10,406] Trial 331 pruned. Trial was pruned at iteration 0.
[I 2023-12-21 02:32:10,453] Trial 332 pruned. Trial was pruned at iteration 0.
[I 2023-12-21 02:32:10,501] Trial 333 pruned. Trial was pruned at iteration 0.
[I 2023-12-21 02:32:10,548] Trial 334 pruned. Trial was pruned at iteration 0.
[I 2023-12-21 02:32:10,594] Trial 335 pruned. Trial was pruned at iteration 0.
[I 2023-12-21 02:32:10,640] Trial 336 pruned. Trial was pruned at iteration 0.
[I 2023-12-21 02:32:10,687] Trial 337 pruned. Trial was pruned at iteration 0.
[I 2023-12-21 02:32:10,734] Trial 338 pruned. Trial was pruned at iteration 0.
[I 2023-12-21 02:32:10,786] Trial 339 pruned. Trial was pruned at iteration 2.
[I 2023-12-21 02:32:10,912] Trial 340 finished with value: inf and parameters: {'learning_rate': 0.8290415798333722, 'aft_loss_distributi                                                                     on': 'normal', 'aft_loss_distribution_scale': 1.0774115158118287, 'max_depth': 7, 'booster': 'gbtree', 'scale_pos_weight': 8.686328121202                                                                     132, 'alpha': 8.645637365482447, 'lambda': 1.008219566558032, 'eta': 0.643917261334824, 'sampling_method': 'uniform', 'subsample': 0.8768                                                                     917414714442, 'gamma': 8.907626371970398}. Best is trial 156 with value: 4.239607290306937.
[I 2023-12-21 02:32:10,959] Trial 341 pruned. Trial was pruned at iteration 1.
[I 2023-12-21 02:32:11,005] Trial 342 pruned. Trial was pruned at iteration 0.
[I 2023-12-21 02:32:11,053] Trial 343 pruned. Trial was pruned at iteration 1.
[I 2023-12-21 02:32:11,099] Trial 344 pruned. Trial was pruned at iteration 0.
[I 2023-12-21 02:32:11,148] Trial 345 pruned. Trial was pruned at iteration 1.
[I 2023-12-21 02:32:11,198] Trial 346 pruned. Trial was pruned at iteration 0.
[I 2023-12-21 02:32:11,244] Trial 347 pruned. Trial was pruned at iteration 0.
[I 2023-12-21 02:32:11,297] Trial 348 pruned. Trial was pruned at iteration 0.
[I 2023-12-21 02:32:11,347] Trial 349 pruned. Trial was pruned at iteration 2.
