[I 2023-12-18 23:16:24,507] Trial 2 finished with value: 5.612400706162463 and parameters: {'learning_rate': 0.021558517092191674, 'aft_loss_distribution': 'logistic', 'aft_loss_distribution_scale': 4.413285710712253, 'max_depth': 3, 'booster': 'dart', 'scale_pos_weight': 8.783073883024876, 'alpha': 9.795488639081832, 'lambda': 0.2652064316653219, 'eta': 0.5134927722934, 'sampling_method': 'uniform', 'subsample': 0.5550550763879417, 'gamma': 6.448403589525296}. Best is trial 0 with value: 4.864455091556191.
[I 2023-12-18 23:16:30,313] Trial 3 finished with value: 5.864407587570844 and parameters: {'learning_rate': 0.8647132576334651, 'aft_loss_distribution': 'logistic', 'aft_loss_distribution_scale': 5.784653809704844, 'max_depth': 3, 'booster': 'dart', 'scale_pos_weight': 7.294240525692986, 'alpha': 5.555518759662935, 'lambda': 3.226027514465518, 'eta': 0.33789820504990375, 'sampling_method': 'uniform', 'subsample': 0.5193578960955205, 'gamma': 4.672609218587383}. Best is trial 0 with value: 4.864455091556191.
[I 2023-12-18 23:16:30,583] Trial 4 finished with value: 5.6502422115941116 and parameters: {'learning_rate': 0.35889544219000796, 'aft_loss_distribution': 'normal', 'aft_loss_distribution_scale': 7.35746171251161, 'max_depth': 9, 'booster': 'gbtree', 'scale_pos_weight': 0.7144917213232631, 'alpha': 4.748395704231697, 'lambda': 3.0968672416383036, 'eta': 0.20364640443690274, 'sampling_method': 'uniform', 'subsample': 0.386231498763695, 'gamma': 5.553127012509054}. Best is trial 0 with value: 4.864455091556191.
[I 2023-12-18 23:16:40,006] Trial 5 finished with value: 5.493268505671882 and parameters: {'learning_rate': 0.3495571898830435, 'aft_loss_distribution': 'normal', 'aft_loss_distribution_scale': 6.213603118358487, 'max_depth': 5, 'booster': 'dart', 'scale_pos_weight': 3.013764328650525, 'alpha': 4.877032468953998, 'lambda': 3.9219433920925852, 'eta': 0.5072911704180828, 'sampling_method': 'gradient_based', 'subsample': 0.7815176291366475, 'gamma': 7.087741257987824}. Best is trial 0 with value: 4.864455091556191.
[I 2023-12-18 23:16:40,015] Trial 6 pruned. Trial was pruned at iteration 0.
[I 2023-12-18 23:16:40,248] Trial 7 finished with value: 5.091104219115402 and parameters: {'learning_rate': 0.5042299084215243, 'aft_loss_distribution': 'logistic', 'aft_loss_distribution_scale': 2.480695025837038, 'max_depth': 3, 'booster': 'gbtree', 'scale_pos_weight': 3.010041042446686, 'alpha': 6.61930304653764, 'lambda': 7.446317465431548, 'eta': 0.4651770054410159, 'sampling_method': 'uniform', 'subsample': 0.7365712583367726, 'gamma': 1.8272810916254996}. Best is trial 0 with value: 4.864455091556191.
[I 2023-12-18 23:16:46,707] Trial 8 finished with value: 4.328249189025956 and parameters: {'learning_rate': 0.15937978119469995, 'aft_loss_distribution': 'logistic', 'aft_loss_distribution_scale': 0.8845296623261549, 'max_depth': 5, 'booster': 'dart', 'scale_pos_weight': 1.4377657856300858, 'alpha': 2.3185876020131144, 'lambda': 8.191768650956126, 'eta': 0.10101570678838101, 'sampling_method': 'gradient_based', 'subsample': 0.3743527277783479, 'gamma': 6.230136929624401}. Best is trial 8 with value: 4.328249189025956.
[I 2023-12-18 23:16:46,726] Trial 9 pruned. Trial was pruned at iteration 0.
[I 2023-12-18 23:16:46,807] Trial 10 pruned. Trial was pruned at iteration 0.
[I 2023-12-18 23:16:50,130] Trial 11 finished with value: 5.284831206612761 and parameters: {'learning_rate': 0.6554348055991803, 'aft_loss_distribution': 'logistic', 'aft_loss_distribution_scale': 3.086179560296431, 'max_depth': 8, 'booster': 'dart', 'scale_pos_weight': 0.44633320075477256, 'alpha': 2.905263083911105, 'lambda': 6.788366901708469, 'eta': 0.7509755886695867, 'sampling_method': 'gradient_based', 'subsample': 0.13063154198561122, 'gamma': 3.3364745644588396}. Best is trial 8 with value: 4.328249189025956.
[I 2023-12-18 23:17:01,659] Trial 12 finished with value: 4.819244821029516 and parameters: {'learning_rate': 0.18498444418520682, 'aft_loss_distribution': 'logistic', 'aft_loss_distribution_scale': 1.7998699715533197, 'max_depth': 7, 'booster': 'dart', 'scale_pos_weight': 1.6582117911361212, 'alpha': 9.867831539119042, 'lambda': 9.683352336137563, 'eta': 0.022541446905543383, 'sampling_method': 'uniform', 'subsample': 0.2558533987612077, 'gamma': 0.5995350326499604}. Best is trial 8 with value: 4.328249189025956.
[I 2023-12-18 23:17:01,742] Trial 13 pruned. Trial was pruned at iteration 0.
[I 2023-12-18 23:17:01,809] Trial 14 pruned. Trial was pruned at iteration 0.
[I 2023-12-18 23:17:09,048] Trial 15 finished with value: 5.110270436776285 and parameters: {'learning_rate': 0.21664257218542135, 'aft_loss_distribution': 'normal', 'aft_loss_distribution_scale': 4.078185078726614, 'max_depth': 8, 'booster': 'dart', 'scale_pos_weight': 1.7685741364634917, 'alpha': 0.00915402558927969, 'lambda': 8.713097242300424, 'eta': 0.10003615333290905, 'sampling_method': 'gradient_based', 'subsample': 0.9682021991414868, 'gamma': 3.643347541694263}. Best is trial 8 with value: 4.328249189025956.
[I 2023-12-18 23:17:23,765] Trial 16 finished with value: 4.560086013193224 and parameters: {'learning_rate': 0.2135873517633342, 'aft_loss_distribution': 'logistic', 'aft_loss_distribution_scale': 1.2704993662425568, 'max_depth': 4, 'booster': 'dart', 'scale_pos_weight': 3.946735868790525, 'alpha': 8.091787140479179, 'lambda': 7.077181734432, 'eta': 0.33095006466527765, 'sampling_method': 'gradient_based', 'subsample': 0.4236879165673516, 'gamma': 4.123709065189026}. Best is trial 8 with value: 4.328249189025956.
[I 2023-12-18 23:17:38,501] Trial 17 finished with value: 4.403292366609148 and parameters: {'learning_rate': 0.24862964719214453, 'aft_loss_distribution': 'logistic', 'aft_loss_distribution_scale': 0.9957272303611491, 'max_depth': 4, 'booster': 'dart', 'scale_pos_weight': 4.286223131186504, 'alpha': 7.932509416203587, 'lambda': 6.046242453554337, 'eta': 0.3423148217750643, 'sampling_method': 'gradient_based', 'subsample': 0.6132195843284631, 'gamma': 7.961851529977735}. Best is trial 8 with value: 4.328249189025956.
[I 2023-12-18 23:17:38,556] Trial 18 pruned. Trial was pruned at iteration 0.
[I 2023-12-18 23:17:38,603] Trial 19 pruned. Trial was pruned at iteration 0.
[I 2023-12-18 23:17:38,663] Trial 20 pruned. Trial was pruned at iteration 0.
[I 2023-12-18 23:18:05,373] Trial 21 finished with value: 4.4627222928361325 and parameters: {'learning_rate': 0.2581486741049261, 'aft_loss_distribution': 'logistic', 'aft_loss_distribution_scale': 1.1005419720962415, 'max_depth': 4, 'booster': 'dart', 'scale_pos_weight': 4.174504960467783, 'alpha': 8.010731489547416, 'lambda': 7.057594525757845, 'eta': 0.36435793255672444, 'sampling_method': 'gradient_based', 'subsample': 0.41924534306866346, 'gamma': 4.358928600994208}. Best is trial 8 with value: 4.328249189025956.
[I 2023-12-18 23:18:11,185] Trial 22 finished with value: 4.522362056195783 and parameters: {'learning_rate': 0.4147982255869831, 'aft_loss_distribution': 'logistic', 'aft_loss_distribution_scale': 1.2035792335899478, 'max_depth': 4, 'booster': 'dart', 'scale_pos_weight': 4.002120542265956, 'alpha': 8.311425062923421, 'lambda': 7.77281741587185, 'eta': 0.36836536643625895, 'sampling_method': 'gradient_based', 'subsample': 0.35361384330922624, 'gamma': 7.617987949370933}. Best is trial 8 with value: 4.328249189025956.
[I 2023-12-18 23:18:16,507] Trial 23 pruned. Trial was pruned at iteration 102.
[I 2023-12-18 23:18:16,560] Trial 24 pruned. Trial was pruned at iteration 0.
[I 2023-12-18 23:18:16,610] Trial 25 pruned. Trial was pruned at iteration 0.
[I 2023-12-18 23:18:16,665] Trial 26 pruned. Trial was pruned at iteration 0.
[I 2023-12-18 23:18:16,716] Trial 27 pruned. Trial was pruned at iteration 0.
[I 2023-12-18 23:18:16,772] Trial 28 pruned. Trial was pruned at iteration 0.
[I 2023-12-18 23:18:43,570] Trial 29 finished with value: 4.43194296864672 and parameters: {'learning_rate': 0.4068147799582718, 'aft_loss_distribution': 'normal', 'aft_loss_distribution_scale': 1.7245534933606241, 'max_depth': 5, 'booster': 'dart', 'scale_pos_weight': 2.6163690848495307, 'alpha': 6.057450844170681, 'lambda': 8.006827975098936, 'eta': 0.4469479983933977, 'sampling_method': 'gradient_based', 'subsample': 0.5727228895172783, 'gamma': 4.215197954249775}. Best is trial 8 with value: 4.328249189025956.
[I 2023-12-18 23:18:47,114] Trial 30 finished with value: 4.461163925919667 and parameters: {'learning_rate': 0.40101331160900683, 'aft_loss_distribution': 'normal', 'aft_loss_distribution_scale': 1.803361194320113, 'max_depth': 6, 'booster': 'dart', 'scale_pos_weight': 2.5159405225873237, 'alpha': 6.197570800185866, 'lambda': 7.912439127471739, 'eta': 0.43507602160953734, 'sampling_method': 'gradient_based', 'subsample': 0.5714145502868142, 'gamma': 5.236213172703581}. Best is trial 8 with value: 4.328249189025956.
[I 2023-12-18 23:18:50,677] Trial 31 finished with value: 4.5017181559322195 and parameters: {'learning_rate': 0.4060624108528684, 'aft_loss_distribution': 'normal', 'aft_loss_distribution_scale': 1.91691021454664, 'max_depth': 6, 'booster': 'dart', 'scale_pos_weight': 1.1741981301985542, 'alpha': 5.772935991020433, 'lambda': 7.748050895308888, 'eta': 0.4348125363117039, 'sampling_method': 'gradient_based', 'subsample': 0.5951229836914492, 'gamma': 5.253338994382384}. Best is trial 8 with value: 4.328249189025956.
[I 2023-12-18 23:18:53,339] Trial 32 finished with value: inf and parameters: {'learning_rate': 0.571385380153139, 'aft_loss_distribution': 'normal', 'aft_loss_distribution_scale': 2.6762204366218842, 'max_depth': 5, 'booster': 'dart', 'scale_pos_weight': 2.5393467974451074, 'alpha': 7.269604172088046, 'lambda': 8.935577084405123, 'eta': 0.59978155061481, 'sampling_method': 'gradient_based', 'subsample': 0.6716013734469493, 'gamma': 2.751313875036496}. Best is trial 8 with value: 4.328249189025956.
[I 2023-12-18 23:18:53,393] Trial 33 pruned. Trial was pruned at iteration 0.
[I 2023-12-18 23:18:53,448] Trial 34 pruned. Trial was pruned at iteration 0.
[I 2023-12-18 23:18:53,502] Trial 35 pruned. Trial was pruned at iteration 1.
[I 2023-12-18 23:18:53,553] Trial 36 pruned. Trial was pruned at iteration 0.
[I 2023-12-18 23:18:57,206] Trial 37 finished with value: 4.657163050186339 and parameters: {'learning_rate': 0.3672584208264983, 'aft_loss_distribution': 'normal', 'aft_loss_distribution_scale': 2.37341288081725, 'max_depth': 5, 'booster': 'dart', 'scale_pos_weight': 3.4434329254979086, 'alpha': 5.157277014484691, 'lambda': 5.516054942070555, 'eta': 0.4860580509748826, 'sampling_method': 'uniform', 'subsample': 0.5506548467668915, 'gamma': 7.725393346296288}. Best is trial 8 with value: 4.328249189025956.
[I 2023-12-18 23:18:57,262] Trial 38 pruned. Trial was pruned at iteration 0.
[I 2023-12-18 23:18:57,316] Trial 39 pruned. Trial was pruned at iteration 0.
[I 2023-12-18 23:18:57,370] Trial 40 pruned. Trial was pruned at iteration 0.
[I 2023-12-18 23:19:24,384] Trial 41 finished with value: 4.439933394497658 and parameters: {'learning_rate': 0.23462973156019237, 'aft_loss_distribution': 'logistic', 'aft_loss_distribution_scale': 1.0696207211262632, 'max_depth': 4, 'booster': 'dart', 'scale_pos_weight': 4.48447457091774, 'alpha': 7.526331139987932, 'lambda': 6.966189679595441, 'eta': 0.351471644893224, 'sampling_method': 'gradient_based', 'subsample': 0.6250306692504074, 'gamma': 5.595342856559594}. Best is trial 8 with value: 4.328249189025956.
[I 2023-12-18 23:19:24,445] Trial 42 pruned. Trial was pruned at iteration 0.
[I 2023-12-18 23:19:24,506] Trial 43 pruned. Trial was pruned at iteration 2.
[I 2023-12-18 23:19:24,564] Trial 44 pruned. Trial was pruned at iteration 0.
[I 2023-12-18 23:19:24,632] Trial 45 pruned. Trial was pruned at iteration 0.
[I 2023-12-18 23:19:24,683] Trial 46 pruned. Trial was pruned at iteration 0.
[I 2023-12-18 23:19:24,738] Trial 47 pruned. Trial was pruned at iteration 0.
[I 2023-12-18 23:19:24,794] Trial 48 pruned. Trial was pruned at iteration 0.
[I 2023-12-18 23:19:24,847] Trial 49 pruned. Trial was pruned at iteration 0.
[I 2023-12-18 23:19:24,906] Trial 50 pruned. Trial was pruned at iteration 0.
[I 2023-12-18 23:19:34,770] Trial 51 pruned. Trial was pruned at iteration 147.
[I 2023-12-18 23:19:41,287] Trial 52 finished with value: 4.415227815042398 and parameters: {'learning_rate': 0.2669279750489477, 'aft_loss_distribution': 'logistic', 'aft_loss_distribution_scale': 1.0308434605508494, 'max_depth': 4, 'booster': 'dart', 'scale_pos_weight': 4.215697295257402, 'alpha': 5.9866411154085615, 'lambda': 7.383205302930078, 'eta': 0.4518590271351647, 'sampling_method': 'gradient_based', 'subsample': 0.4044522109330343, 'gamma': 3.6840220338394793}. Best is trial 8 with value: 4.328249189025956.
[I 2023-12-18 23:19:42,785] Trial 53 finished with value: inf and parameters: {'learning_rate': 0.4534399488369081, 'aft_loss_distribution': 'logistic', 'aft_loss_distribution_scale': 1.3981784037044216, 'max_depth': 5, 'booster': 'dart', 'scale_pos_weight': 4.394045253960498, 'alpha': 5.914551350764754, 'lambda': 7.560846469263177, 'eta': 0.4660651999287121, 'sampling_method': 'gradient_based', 'subsample': 0.5153527870348455, 'gamma': 3.6408107567561356}. Best is trial 8 with value: 4.328249189025956.
[I 2023-12-18 23:19:42,844] Trial 54 pruned. Trial was pruned at iteration 0.
[I 2023-12-18 23:19:42,899] Trial 55 pruned. Trial was pruned at iteration 0.
[I 2023-12-18 23:19:42,959] Trial 56 pruned. Trial was pruned at iteration 0.
[I 2023-12-18 23:19:43,016] Trial 57 pruned. Trial was pruned at iteration 0.
[I 2023-12-18 23:19:43,075] Trial 58 pruned. Trial was pruned at iteration 0.
[I 2023-12-18 23:19:43,147] Trial 59 pruned. Trial was pruned at iteration 0.
[I 2023-12-18 23:19:43,219] Trial 60 pruned. Trial was pruned at iteration 0.
[I 2023-12-18 23:19:43,283] Trial 61 pruned. Trial was pruned at iteration 0.
[I 2023-12-18 23:19:50,501] Trial 62 finished with value: 4.469942797446189 and parameters: {'learning_rate': 0.23172644762562958, 'aft_loss_distribution': 'logistic', 'aft_loss_distribution_scale': 1.11647726919661, 'max_depth': 3, 'booster': 'dart', 'scale_pos_weight': 4.862159573567324, 'alpha': 9.519801638419708, 'lambda': 7.184105711145532, 'eta': 0.3786611775477046, 'sampling_method': 'gradient_based', 'subsample': 0.3414626506107685, 'gamma': 4.9750799041335885}. Best is trial 8 with value: 4.328249189025956.
[I 2023-12-18 23:19:50,562] Trial 63 pruned. Trial was pruned at iteration 0.
[I 2023-12-18 23:19:50,617] Trial 64 pruned. Trial was pruned at iteration 0.
[I 2023-12-18 23:19:50,671] Trial 65 pruned. Trial was pruned at iteration 0.
[I 2023-12-18 23:19:50,732] Trial 66 pruned. Trial was pruned at iteration 0.
[I 2023-12-18 23:19:50,789] Trial 67 pruned. Trial was pruned at iteration 1.
[I 2023-12-18 23:19:50,847] Trial 68 pruned. Trial was pruned at iteration 0.
[I 2023-12-18 23:19:50,904] Trial 69 pruned. Trial was pruned at iteration 1.
[I 2023-12-18 23:19:50,961] Trial 70 pruned. Trial was pruned at iteration 0.
[I 2023-12-18 23:20:03,457] Trial 71 pruned. Trial was pruned at iteration 167.
[I 2023-12-18 23:20:03,519] Trial 72 pruned. Trial was pruned at iteration 1.
[I 2023-12-18 23:20:41,724] Trial 73 finished with value: 4.338667944444238 and parameters: {'learning_rate': 0.1609249640119869, 'aft_loss_distribution': 'logistic', 'aft_loss_distribution_scale': 0.8817890403757815, 'max_depth': 3, 'booster': 'dart', 'scale_pos_weight': 3.401762498590461, 'alpha': 9.46952069203718, 'lambda': 7.96271896357222, 'eta': 0.2446017862887223, 'sampling_method': 'gradient_based', 'subsample': 0.4937018264350953, 'gamma': 5.387144294738796}. Best is trial 8 with value: 4.328249189025956.
[I 2023-12-18 23:21:09,325] Trial 74 finished with value: 4.300945982185268 and parameters: {'learning_rate': 0.16080775643343898, 'aft_loss_distribution': 'logistic', 'aft_loss_distribution_scale': 0.8234281959086455, 'max_depth': 4, 'booster': 'dart', 'scale_pos_weight': 3.4898735846912956, 'alpha': 5.872072186014997, 'lambda': 8.666318741761597, 'eta': 0.14889516622710253, 'sampling_method': 'gradient_based', 'subsample': 0.5328899846127713, 'gamma': 5.342303088274696}. Best is trial 74 with value: 4.300945982185268.
[I 2023-12-18 23:21:09,390] Trial 75 pruned. Trial was pruned at iteration 0.
[I 2023-12-18 23:21:09,443] Trial 76 pruned. Trial was pruned at iteration 0.
[I 2023-12-18 23:21:09,504] Trial 77 pruned. Trial was pruned at iteration 0.
[I 2023-12-18 23:21:09,562] Trial 78 pruned. Trial was pruned at iteration 0.
[I 2023-12-18 23:21:09,615] Trial 79 pruned. Trial was pruned at iteration 0.
[I 2023-12-18 23:21:09,671] Trial 80 pruned. Trial was pruned at iteration 0.
[I 2023-12-18 23:21:09,730] Trial 81 pruned. Trial was pruned at iteration 0.
[I 2023-12-18 23:21:09,791] Trial 82 pruned. Trial was pruned at iteration 0.
[I 2023-12-18 23:21:09,846] Trial 83 pruned. Trial was pruned at iteration 0.
[I 2023-12-18 23:21:09,901] Trial 84 pruned. Trial was pruned at iteration 0.
[I 2023-12-18 23:21:09,959] Trial 85 pruned. Trial was pruned at iteration 0.
[I 2023-12-18 23:21:10,024] Trial 86 pruned. Trial was pruned at iteration 0.
[I 2023-12-18 23:21:37,114] Trial 87 pruned. Trial was pruned at iteration 253.
[I 2023-12-18 23:21:37,171] Trial 88 pruned. Trial was pruned at iteration 0.
[I 2023-12-18 23:21:37,227] Trial 89 pruned. Trial was pruned at iteration 0.
[I 2023-12-18 23:21:37,290] Trial 90 pruned. Trial was pruned at iteration 0.
[I 2023-12-18 23:21:39,731] Trial 91 pruned. Trial was pruned at iteration 75.
[I 2023-12-18 23:21:49,611] Trial 92 pruned. Trial was pruned at iteration 147.
[I 2023-12-18 23:21:49,674] Trial 93 pruned. Trial was pruned at iteration 0.
[I 2023-12-18 23:21:49,738] Trial 94 pruned. Trial was pruned at iteration 0.
[I 2023-12-18 23:21:49,796] Trial 95 pruned. Trial was pruned at iteration 0.
[I 2023-12-18 23:21:56,458] Trial 96 finished with value: 4.382639020978124 and parameters: {'learning_rate': 0.3069719422128339, 'aft_loss_distribution': 'logistic', 'aft_loss_distribution_scale': 0.9689061792864536, 'max_depth': 4, 'booster': 'dart', 'scale_pos_weight': 4.968557282857398, 'alpha': 9.314807783548119, 'lambda': 7.738443546593869, 'eta': 0.44080512208976447, 'sampling_method': 'gradient_based', 'subsample': 0.39515186842143984, 'gamma': 6.018495086989565}. Best is trial 74 with value: 4.300945982185268.
[I 2023-12-18 23:21:56,577] Trial 97 pruned. Trial was pruned at iteration 0.
[I 2023-12-18 23:21:56,667] Trial 98 pruned. Trial was pruned at iteration 0.
[I 2023-12-18 23:21:56,758] Trial 99 pruned. Trial was pruned at iteration 0.
[I 2023-12-18 23:21:56,849] Trial 100 pruned. Trial was pruned at iteration 0.
[I 2023-12-18 23:22:01,506] Trial 101 pruned. Trial was pruned at iteration 102.
[I 2023-12-18 23:22:29,089] Trial 102 pruned. Trial was pruned at iteration 253.
[I 2023-12-18 23:22:29,149] Trial 103 pruned. Trial was pruned at iteration 0.
[I 2023-12-18 23:22:29,205] Trial 104 pruned. Trial was pruned at iteration 0.
[I 2023-12-18 23:22:29,268] Trial 105 pruned. Trial was pruned at iteration 0.
[I 2023-12-18 23:22:29,326] Trial 106 pruned. Trial was pruned at iteration 0.
[I 2023-12-18 23:22:29,394] Trial 107 pruned. Trial was pruned at iteration 1.
[I 2023-12-18 23:22:29,459] Trial 108 pruned. Trial was pruned at iteration 0.
[I 2023-12-18 23:22:29,516] Trial 109 pruned. Trial was pruned at iteration 0.
[I 2023-12-18 23:22:29,810] Trial 110 finished with value: 4.517846607054736 and parameters: {'learning_rate': 0.4019560373106613, 'aft_loss_distribution': 'logistic', 'aft_loss_distribution_scale': 1.2079800628825783, 'max_depth': 4, 'booster': 'gbtree', 'scale_pos_weight': 4.075024366773624, 'alpha': 7.776529888853991, 'lambda': 6.556382574443445, 'eta': 0.1557796327749559, 'sampling_method': 'gradient_based', 'subsample': 0.32935585725009686, 'gamma': 4.2311729621490795}. Best is trial 74 with value: 4.300945982185268.
[I 2023-12-18 23:22:31,613] Trial 111 finished with value: inf and parameters: {'learning_rate': 0.5337474978391441, 'aft_loss_distribution': 'normal', 'aft_loss_distribution_scale': 1.8685105042324495, 'max_depth': 6, 'booster': 'dart', 'scale_pos_weight': 0.8981743088398038, 'alpha': 4.968440191067021, 'lambda': 7.833097892440087, 'eta': 0.4547095343598731, 'sampling_method': 'gradient_based', 'subsample': 0.6199131731875218, 'gamma': 5.287698956187573}. Best is trial 74 with value: 4.300945982185268.
[I 2023-12-18 23:22:31,678] Trial 112 pruned. Trial was pruned at iteration 0.
[I 2023-12-18 23:22:31,748] Trial 113 pruned. Trial was pruned at iteration 0.
[I 2023-12-18 23:22:31,810] Trial 114 pruned. Trial was pruned at iteration 0.
[I 2023-12-18 23:22:31,872] Trial 115 pruned. Trial was pruned at iteration 0.
[I 2023-12-18 23:22:31,939] Trial 116 pruned. Trial was pruned at iteration 0.
[I 2023-12-18 23:22:32,005] Trial 117 pruned. Trial was pruned at iteration 0.
[I 2023-12-18 23:22:32,075] Trial 118 pruned. Trial was pruned at iteration 0.
[I 2023-12-18 23:22:32,140] Trial 119 pruned. Trial was pruned at iteration 0.
[I 2023-12-18 23:22:32,202] Trial 120 pruned. Trial was pruned at iteration 0.
[I 2023-12-18 23:22:32,535] Trial 121 pruned. Trial was pruned at iteration 102.
[I 2023-12-18 23:22:32,616] Trial 122 pruned. Trial was pruned at iteration 2.
[I 2023-12-18 23:22:33,298] Trial 123 pruned. Trial was pruned at iteration 253.
[I 2023-12-18 23:22:33,359] Trial 124 pruned. Trial was pruned at iteration 0.
[I 2023-12-18 23:22:33,420] Trial 125 pruned. Trial was pruned at iteration 0.
[I 2023-12-18 23:22:33,488] Trial 126 pruned. Trial was pruned at iteration 0.
[I 2023-12-18 23:22:33,550] Trial 127 pruned. Trial was pruned at iteration 0.
[I 2023-12-18 23:22:33,621] Trial 128 pruned. Trial was pruned at iteration 0.
[I 2023-12-18 23:22:33,680] Trial 129 pruned. Trial was pruned at iteration 0.
