[I 2023-12-21 00:07:55,720] Trial 17 finished with value: 1.9761286020812818 and parameters: {'learning_rate': 0.8180648156673546, 'aft_loss_distribution': 'normal', 'aft_loss_distribution_scale': 2.211270423863411, 'max_depth': 5, 'booster': 'dart', 'scale_pos_weight': 2.567455503592868, 'alpha': 9.93119828951348, 'lambda': 5.673602995288837, 'eta': 0.6397469956471333, 'sampling_method': 'uniform', 'subsample': 0.27989779621956795, 'gamma': 3.0358568704357727}. Best is trial 17 with value: 1.9761286020812818.
[I 2023-12-21 00:08:06,281] Trial 18 finished with value: 2.038438811628631 and parameters: {'learning_rate': 0.951242577524653, 'aft_loss_distribution': 'normal', 'aft_loss_distribution_scale': 2.909773061945894, 'max_depth': 4, 'booster': 'dart', 'scale_pos_weight': 2.0906131816814693, 'alpha': 9.760523880071956, 'lambda': 4.665166044947691, 'eta': 0.6874547018424968, 'sampling_method': 'uniform', 'subsample': 0.4360421106035177, 'gamma': 4.882910067832611}. Best is trial 17 with value: 1.9761286020812818.
[I 2023-12-21 00:08:16,234] Trial 19 finished with value: 1.9596179424587552 and parameters: {'learning_rate': 0.9490310941087458, 'aft_loss_distribution': 'normal', 'aft_loss_distribution_scale': 2.0492997236028643, 'max_depth': 4, 'booster': 'dart', 'scale_pos_weight': 2.933168672110026, 'alpha': 9.567816704442562, 'lambda': 4.580601463719413, 'eta': 0.6676749825819455, 'sampling_method': 'uniform', 'subsample': 0.19731880695420512, 'gamma': 5.463715742334092}. Best is trial 19 with value: 1.9596179424587552.
[I 2023-12-21 00:08:30,597] Trial 20 finished with value: 1.9579447032612625 and parameters: {'learning_rate': 0.8194909869273249, 'aft_loss_distribution': 'normal', 'aft_loss_distribution_scale': 2.072409147462351, 'max_depth': 3, 'booster': 'dart', 'scale_pos_weight': 2.961797737250265, 'alpha': 8.43327527485001, 'lambda': 5.649721825968066, 'eta': 0.5951121215280802, 'sampling_method': 'uniform', 'subsample': 0.1896002054575394, 'gamma': 5.732945415450913}. Best is trial 20 with value: 1.9579447032612625.
[I 2023-12-21 00:08:44,169] Trial 21 finished with value: 1.9565038191761477 and parameters: {'learning_rate': 0.8239319265550409, 'aft_loss_distribution': 'normal', 'aft_loss_distribution_scale': 2.0221636764327515, 'max_depth': 3, 'booster': 'dart', 'scale_pos_weight': 2.9437739049596274, 'alpha': 9.263970046692945, 'lambda': 5.871730310439667, 'eta': 0.6265835207436407, 'sampling_method': 'uniform', 'subsample': 0.17680260917594592, 'gamma': 5.38842958705694}. Best is trial 21 with value: 1.9565038191761477.
[I 2023-12-21 00:08:47,034] Trial 22 finished with value: 1.9540238268832313 and parameters: {'learning_rate': 0.8726733478855081, 'aft_loss_distribution': 'normal', 'aft_loss_distribution_scale': 1.9284391025239647, 'max_depth': 3, 'booster': 'dart', 'scale_pos_weight': 3.073617001043238, 'alpha': 8.462325966921279, 'lambda': 4.054234345247862, 'eta': 0.5896829297723519, 'sampling_method': 'uniform', 'subsample': 0.21776072221881068, 'gamma': 5.6656710351224815}. Best is trial 22 with value: 1.9540238268832313.
[I 2023-12-21 00:08:47,086] Trial 23 pruned. Trial was pruned at iteration 0.
[I 2023-12-21 00:08:49,224] Trial 24 finished with value: inf and parameters: {'learning_rate': 0.8621679409462746, 'aft_loss_distribution': 'normal', 'aft_loss_distribution_scale': 1.6780659516280871, 'max_depth': 3, 'booster': 'dart', 'scale_pos_weight': 2.9498798339004497, 'alpha': 8.010435483690078, 'lambda': 2.2994055476820168, 'eta': 0.902590863373179, 'sampling_method': 'uniform', 'subsample': 0.194212863156418, 'gamma': 6.2854746748650525}. Best is trial 22 with value: 1.9540238268832313.
[I 2023-12-21 00:08:58,244] Trial 25 finished with value: 2.0018993749738216 and parameters: {'learning_rate': 0.6699905493568756, 'aft_loss_distribution': 'normal', 'aft_loss_distribution_scale': 2.5052003474281257, 'max_depth': 3, 'booster': 'dart', 'scale_pos_weight': 3.4394699324627473, 'alpha': 8.810561622338836, 'lambda': 6.485993992786296, 'eta': 0.5914881281571528, 'sampling_method': 'uniform', 'subsample': 0.19512376650085328, 'gamma': 4.417952143192649}. Best is trial 22 with value: 1.9540238268832313.
[I 2023-12-21 00:08:58,297] Trial 26 pruned. Trial was pruned at iteration 0.
[I 2023-12-21 00:08:59,737] Trial 27 finished with value: inf and parameters: {'learning_rate': 0.9919788364627025, 'aft_loss_distribution': 'normal', 'aft_loss_distribution_scale': 1.5264771236462, 'max_depth': 5, 'booster': 'dart', 'scale_pos_weight': 1.7327940949415575, 'alpha': 8.801766279118675, 'lambda': 3.8021463158346704, 'eta': 0.48290364006959124, 'sampling_method': 'uniform', 'subsample': 0.5964472585240859, 'gamma': 6.667394892875167}. Best is trial 22 with value: 1.9540238268832313.
[I 2023-12-21 00:08:59,794] Trial 28 pruned. Trial was pruned at iteration 1.
[I 2023-12-21 00:09:02,158] Trial 29 finished with value: inf and parameters: {'learning_rate': 0.7183118841231483, 'aft_loss_distribution': 'normal', 'aft_loss_distribution_scale': 3.9076242808839066, 'max_depth': 4, 'booster': 'dart', 'scale_pos_weight': 3.466414812145996, 'alpha': 9.140436112214621, 'lambda': 4.207532600415898, 'eta': 0.7232332296747875, 'sampling_method': 'uniform', 'subsample': 0.01856794261533498, 'gamma': 5.949222129259684}. Best is trial 22 with value: 1.9540238268832313.
[I 2023-12-21 00:09:02,231] Trial 30 pruned. Trial was pruned at iteration 0.
[I 2023-12-21 00:09:07,923] Trial 31 finished with value: 1.9611962358455197 and parameters: {'learning_rate': 0.7986322418906896, 'aft_loss_distribution': 'normal', 'aft_loss_distribution_scale': 2.0502562134869864, 'max_depth': 4, 'booster': 'dart', 'scale_pos_weight': 3.0096344143640903, 'alpha': 9.659223622225554, 'lambda': 0.18026589169719331, 'eta': 0.6740274320494308, 'sampling_method': 'uniform', 'subsample': 0.13600229329923338, 'gamma': 5.519211841094749}. Best is trial 22 with value: 1.9540238268832313.
[I 2023-12-21 00:09:09,703] Trial 32 finished with value: inf and parameters: {'learning_rate': 0.9154929668096399, 'aft_loss_distribution': 'normal', 'aft_loss_distribution_scale': 1.32980646774916, 'max_depth': 3, 'booster': 'dart', 'scale_pos_weight': 2.424167852255552, 'alpha': 8.450643123897622, 'lambda': 4.533538624014871, 'eta': 0.7272433622365134, 'sampling_method': 'uniform', 'subsample': 0.08097969852336129, 'gamma': 4.794274294710199}. Best is trial 22 with value: 1.9540238268832313.
[I 2023-12-21 00:09:17,780] Trial 33 finished with value: 1.9534302815207956 and parameters: {'learning_rate': 0.9805230753245768, 'aft_loss_distribution': 'normal', 'aft_loss_distribution_scale': 1.9728908119765902, 'max_depth': 4, 'booster': 'dart', 'scale_pos_weight': 2.829294019137359, 'alpha': 9.196233685659227, 'lambda': 6.626507059266494, 'eta': 0.48252684936497453, 'sampling_method': 'uniform', 'subsample': 0.22157069237763147, 'gamma': 6.963394935561619}. Best is trial 33 with value: 1.9534302815207956.
[I 2023-12-21 00:09:17,868] Trial 34 pruned. Trial was pruned at iteration 0.
[I 2023-12-21 00:09:17,953] Trial 35 pruned. Trial was pruned at iteration 1.
[I 2023-12-21 00:09:27,209] Trial 36 finished with value: 1.9365724176961163 and parameters: {'learning_rate': 0.8920847139972493, 'aft_loss_distribution': 'normal', 'aft_loss_distribution_scale': 1.820401197457828, 'max_depth': 5, 'booster': 'dart', 'scale_pos_weight': 3.047975991188416, 'alpha': 9.001423834027829, 'lambda': 7.949727950696637, 'eta': 0.5722809258395101, 'sampling_method': 'uniform', 'subsample': 0.40953604075862327, 'gamma': 8.34380545439247}. Best is trial 36 with value: 1.9365724176961163.
[I 2023-12-21 00:09:27,265] Trial 37 pruned. Trial was pruned at iteration 0.
[I 2023-12-21 00:09:27,346] Trial 38 pruned. Trial was pruned at iteration 1.
[I 2023-12-21 00:09:27,398] Trial 39 pruned. Trial was pruned at iteration 0.
[I 2023-12-21 00:09:27,450] Trial 40 pruned. Trial was pruned at iteration 0.
[I 2023-12-21 00:09:29,914] Trial 41 finished with value: inf and parameters: {'learning_rate': 0.7662638902072036, 'aft_loss_distribution': 'normal', 'aft_loss_distribution_scale': 2.2014699517237704, 'max_depth': 3, 'booster': 'dart', 'scale_pos_weight': 3.325911038218159, 'alpha': 8.371447402046122, 'lambda': 5.970288671849669, 'eta': 0.565404012656715, 'sampling_method': 'uniform', 'subsample': 0.16575939820418306, 'gamma': 7.126453883536719}. Best is trial 36 with value: 1.9365724176961163.
[I 2023-12-21 00:09:29,967] Trial 42 pruned. Trial was pruned at iteration 0.
[I 2023-12-21 00:09:30,017] Trial 43 pruned. Trial was pruned at iteration 0.
[I 2023-12-21 00:09:30,072] Trial 44 pruned. Trial was pruned at iteration 1.
[I 2023-12-21 00:09:30,126] Trial 45 pruned. Trial was pruned at iteration 0.
[I 2023-12-21 00:09:30,185] Trial 46 pruned. Trial was pruned at iteration 0.
[I 2023-12-21 00:09:30,235] Trial 47 pruned. Trial was pruned at iteration 0.
[I 2023-12-21 00:09:30,286] Trial 48 pruned. Trial was pruned at iteration 0.
[I 2023-12-21 00:09:30,348] Trial 49 pruned. Trial was pruned at iteration 1.
[I 2023-12-21 00:09:30,565] Trial 50 finished with value: inf and parameters: {'learning_rate': 0.8316913344523917, 'aft_loss_distribution': 'normal', 'aft_loss_distribution_scale': 1.3058698308678918, 'max_depth': 3, 'booster': 'gbtree', 'scale_pos_weight': 2.546673384526316, 'alpha': 1.3436000727374537, 'lambda': 7.759088458554192, 'eta': 0.4551172668113128, 'sampling_method': 'gradient_based', 'subsample': 0.23689506456147252, 'gamma': 7.906416737188569}. Best is trial 36 with value: 1.9365724176961163.
[I 2023-12-21 00:09:37,214] Trial 51 finished with value: 1.957710750917377 and parameters: {'learning_rate': 0.9346716054557356, 'aft_loss_distribution': 'normal', 'aft_loss_distribution_scale': 1.958589151055634, 'max_depth': 4, 'booster': 'dart', 'scale_pos_weight': 2.9242926768376774, 'alpha': 9.417793684740952, 'lambda': 4.293218922447357, 'eta': 0.6478872938568205, 'sampling_method': 'uniform', 'subsample': 0.20284767021854536, 'gamma': 5.485605616030583}. Best is trial 36 with value: 1.9365724176961163.
[I 2023-12-21 00:09:37,304] Trial 52 pruned. Trial was pruned at iteration 1.
[I 2023-12-21 00:09:39,764] Trial 53 finished with value: inf and parameters: {'learning_rate': 0.9428872077514697, 'aft_loss_distribution': 'normal', 'aft_loss_distribution_scale': 1.9309178657415877, 'max_depth': 5, 'booster': 'dart', 'scale_pos_weight': 3.0568574847565477, 'alpha': 9.525923172175919, 'lambda': 2.4511782952928294, 'eta': 0.7373760291268054, 'sampling_method': 'uniform', 'subsample': 0.11256423589066467, 'gamma': 5.25928257564811}. Best is trial 36 with value: 1.9365724176961163.
[I 2023-12-21 00:09:39,822] Trial 54 pruned. Trial was pruned at iteration 0.
[I 2023-12-21 00:09:41,242] Trial 55 finished with value: inf and parameters: {'learning_rate': 0.9683617657768901, 'aft_loss_distribution': 'normal', 'aft_loss_distribution_scale': 1.352917868996931, 'max_depth': 3, 'booster': 'dart', 'scale_pos_weight': 0.6870567796688534, 'alpha': 8.044482456900584, 'lambda': 5.479663816346042, 'eta': 0.5882205720333944, 'sampling_method': 'uniform', 'subsample': 0.8673339043073216, 'gamma': 6.29608283330959}. Best is trial 36 with value: 1.9365724176961163.
[I 2023-12-21 00:09:41,298] Trial 56 pruned. Trial was pruned at iteration 0.
[I 2023-12-21 00:09:41,350] Trial 57 pruned. Trial was pruned at iteration 0.
[I 2023-12-21 00:09:41,400] Trial 58 pruned. Trial was pruned at iteration 0.
[I 2023-12-21 00:09:41,450] Trial 59 pruned. Trial was pruned at iteration 0.
[I 2023-12-21 00:09:41,508] Trial 60 pruned. Trial was pruned at iteration 0.
[I 2023-12-21 00:09:44,336] Trial 61 finished with value: 1.9530782390276271 and parameters: {'learning_rate': 0.968127449835604, 'aft_loss_distribution': 'normal', 'aft_loss_distribution_scale': 1.9837080335472213, 'max_depth': 4, 'booster': 'dart', 'scale_pos_weight': 2.9221557058691228, 'alpha': 9.693092652782509, 'lambda': 4.7168893619513765, 'eta': 0.6998252590981244, 'sampling_method': 'uniform', 'subsample': 0.19600558208622915, 'gamma': 5.576248219707436}. Best is trial 36 with value: 1.9365724176961163.
[I 2023-12-21 00:09:45,905] Trial 62 finished with value: inf and parameters: {'learning_rate': 0.9681873779716962, 'aft_loss_distribution': 'normal', 'aft_loss_distribution_scale': 1.1508949749030668, 'max_depth': 5, 'booster': 'dart', 'scale_pos_weight': 2.6868846829315616, 'alpha': 9.684526766269137, 'lambda': 3.488308200644404, 'eta': 0.6080105415554762, 'sampling_method': 'uniform', 'subsample': 0.18625151602677809, 'gamma': 5.799245399810687}. Best is trial 36 with value: 1.9365724176961163.
[I 2023-12-21 00:09:46,008] Trial 63 pruned. Trial was pruned at iteration 1.
[I 2023-12-21 00:09:46,095] Trial 64 pruned. Trial was pruned at iteration 0.
[I 2023-12-21 00:09:46,181] Trial 65 pruned. Trial was pruned at iteration 0.
[I 2023-12-21 00:09:46,265] Trial 66 pruned. Trial was pruned at iteration 0.
[I 2023-12-21 00:09:46,351] Trial 67 pruned. Trial was pruned at iteration 0.
[I 2023-12-21 00:09:48,898] Trial 68 finished with value: inf and parameters: {'learning_rate': 0.8792723581385471, 'aft_loss_distribution': 'normal', 'aft_loss_distribution_scale': 1.6109396706805064, 'max_depth': 3, 'booster': 'dart', 'scale_pos_weight': 2.679266366163875, 'alpha': 9.191168836018935, 'lambda': 4.455740276543431, 'eta': 0.6821551552820846, 'sampling_method': 'uniform', 'subsample': 0.16114914764019517, 'gamma': 4.196633177654935}. Best is trial 36 with value: 1.9365724176961163.
[I 2023-12-21 00:09:48,984] Trial 69 pruned. Trial was pruned at iteration 0.
[I 2023-12-21 00:09:49,084] Trial 70 pruned. Trial was pruned at iteration 0.
[I 2023-12-21 00:09:52,065] Trial 71 finished with value: 1.9577454846545292 and parameters: {'learning_rate': 0.9457471289517263, 'aft_loss_distribution': 'normal', 'aft_loss_distribution_scale': 2.019912644098415, 'max_depth': 5, 'booster': 'dart', 'scale_pos_weight': 2.9326057927707527, 'alpha': 9.983854172808067, 'lambda': 4.740366612896395, 'eta': 0.7477608026524476, 'sampling_method': 'uniform', 'subsample': 0.217996855956896, 'gamma': 5.5152316416196845}. Best is trial 36 with value: 1.9365724176961163.
[I 2023-12-21 00:09:52,138] Trial 72 pruned. Trial was pruned at iteration 1.
[I 2023-12-21 00:09:55,568] Trial 73 finished with value: 1.9510121313567623 and parameters: {'learning_rate': 0.9528872440256082, 'aft_loss_distribution': 'normal', 'aft_loss_distribution_scale': 1.8767258164011966, 'max_depth': 5, 'booster': 'dart', 'scale_pos_weight': 2.7532596742357316, 'alpha': 9.36937619841463, 'lambda': 5.635489196841412, 'eta': 0.7509726353253456, 'sampling_method': 'uniform', 'subsample': 0.13234369309570218, 'gamma': 5.700799537819938}. Best is trial 36 with value: 1.9365724176961163.
[I 2023-12-21 00:09:55,631] Trial 74 pruned. Trial was pruned at iteration 1.
[I 2023-12-21 00:09:59,476] Trial 75 finished with value: 1.9443938354570083 and parameters: {'learning_rate': 0.9083122658584553, 'aft_loss_distribution': 'normal', 'aft_loss_distribution_scale': 1.9000472903153827, 'max_depth': 5, 'booster': 'dart', 'scale_pos_weight': 2.6029359016103926, 'alpha': 9.007450592792114, 'lambda': 6.724793561259613, 'eta': 0.7455341796203906, 'sampling_method': 'uniform', 'subsample': 0.29527584326196205, 'gamma': 6.993173205826904}. Best is trial 36 with value: 1.9365724176961163.
[I 2023-12-21 00:10:05,181] Trial 76 finished with value: 1.9187330024659304 and parameters: {'learning_rate': 0.9115352194818542, 'aft_loss_distribution': 'normal', 'aft_loss_distribution_scale': 1.3778533422601154, 'max_depth': 5, 'booster': 'dart', 'scale_pos_weight': 2.5772204700168637, 'alpha': 9.00604582313196, 'lambda': 8.532222836052203, 'eta': 0.8041543509957824, 'sampling_method': 'uniform', 'subsample': 0.35147095179459825, 'gamma': 7.602246555118786}. Best is trial 76 with value: 1.9187330024659304.
[I 2023-12-21 00:10:16,886] Trial 77 finished with value: 1.9163923221585393 and parameters: {'learning_rate': 0.906088706911985, 'aft_loss_distribution': 'normal', 'aft_loss_distribution_scale': 1.4592809214245896, 'max_depth': 5, 'booster': 'dart', 'scale_pos_weight': 2.380044029792167, 'alpha': 8.89525267952944, 'lambda': 8.594614645783658, 'eta': 0.9254203773956073, 'sampling_method': 'uniform', 'subsample': 0.4006149664553664, 'gamma': 8.549784039809758}. Best is trial 77 with value: 1.9163923221585393.
[I 2023-12-21 00:10:16,976] Trial 78 pruned. Trial was pruned at iteration 0.
[I 2023-12-21 00:10:17,062] Trial 79 pruned. Trial was pruned at iteration 0.
[I 2023-12-21 00:10:17,149] Trial 80 pruned. Trial was pruned at iteration 0.
[I 2023-12-21 00:10:21,401] Trial 81 finished with value: 1.9236240351320844 and parameters: {'learning_rate': 0.9109644111428173, 'aft_loss_distribution': 'normal', 'aft_loss_distribution_scale': 1.556183832026011, 'max_depth': 5, 'booster': 'dart', 'scale_pos_weight': 2.4332507321218135, 'alpha': 5.364739668480333, 'lambda': 7.684637258901109, 'eta': 0.9307532510837729, 'sampling_method': 'uniform', 'subsample': 0.3625316851899334, 'gamma': 7.9351216954515715}. Best is trial 77 with value: 1.9163923221585393.
[I 2023-12-21 00:10:21,460] Trial 82 pruned. Trial was pruned at iteration 0.
[I 2023-12-21 00:10:23,767] Trial 83 finished with value: inf and parameters: {'learning_rate': 0.9761222262852192, 'aft_loss_distribution': 'normal', 'aft_loss_distribution_scale': 1.5224909071004193, 'max_depth': 5, 'booster': 'dart', 'scale_pos_weight': 2.4082264515698144, 'alpha': 3.386549327191939, 'lambda': 7.776334660645451, 'eta': 0.8107569036654685, 'sampling_method': 'uniform', 'subsample': 0.41418644437259283, 'gamma': 8.474138066981272}. Best is trial 77 with value: 1.9163923221585393.
[I 2023-12-21 00:10:25,238] Trial 84 finished with value: inf and parameters: {'learning_rate': 0.9271916637355655, 'aft_loss_distribution': 'normal', 'aft_loss_distribution_scale': 1.7784633536347338, 'max_depth': 6, 'booster': 'dart', 'scale_pos_weight': 2.6024868034406032, 'alpha': 0.9212965270224203, 'lambda': 7.559551974628352, 'eta': 0.9488953805512346, 'sampling_method': 'uniform', 'subsample': 0.370375787717822, 'gamma': 8.091212814535485}. Best is trial 77 with value: 1.9163923221585393.
[I 2023-12-21 00:10:25,296] Trial 85 pruned. Trial was pruned at iteration 0.
[I 2023-12-21 00:10:25,352] Trial 86 pruned. Trial was pruned at iteration 0.
[I 2023-12-21 00:10:25,412] Trial 87 pruned. Trial was pruned at iteration 1.
[I 2023-12-21 00:10:25,464] Trial 88 pruned. Trial was pruned at iteration 0.
[I 2023-12-21 00:10:37,672] Trial 89 finished with value: 1.9281123952948516 and parameters: {'learning_rate': 0.9090944421573919, 'aft_loss_distribution': 'normal', 'aft_loss_distribution_scale': 1.6851423831572734, 'max_depth': 5, 'booster': 'dart', 'scale_pos_weight': 2.4817521897034087, 'alpha': 8.263866248283682, 'lambda': 8.643725548223944, 'eta': 0.7982263035982932, 'sampling_method': 'uniform', 'subsample': 0.4965724558444611, 'gamma': 7.944564396336208}. Best is trial 77 with value: 1.9163923221585393.
[I 2023-12-21 00:10:39,744] Trial 90 finished with value: inf and parameters: {'learning_rate': 0.9222222882009543, 'aft_loss_distribution': 'normal', 'aft_loss_distribution_scale': 1.4626687857588367, 'max_depth': 5, 'booster': 'dart', 'scale_pos_weight': 2.48936671894248, 'alpha': 8.184036342648437, 'lambda': 7.206475160149888, 'eta': 0.978676702597152, 'sampling_method': 'uniform', 'subsample': 0.46847123864944207, 'gamma': 7.83737122566174}. Best is trial 77 with value: 1.9163923221585393.
[I 2023-12-21 00:10:42,070] Trial 91 finished with value: inf and parameters: {'learning_rate': 0.9052132032301514, 'aft_loss_distribution': 'normal', 'aft_loss_distribution_scale': 1.8522513321139669, 'max_depth': 6, 'booster': 'dart', 'scale_pos_weight': 2.6351130820820767, 'alpha': 2.210670357111073, 'lambda': 7.962088259650521, 'eta': 0.7987760038376481, 'sampling_method': 'uniform', 'subsample': 0.5143892578163665, 'gamma': 8.315315557983373}. Best is trial 77 with value: 1.9163923221585393.
[I 2023-12-21 00:10:42,138] Trial 92 pruned. Trial was pruned at iteration 1.
[I 2023-12-21 00:10:44,174] Trial 93 finished with value: inf and parameters: {'learning_rate': 0.9553910406733799, 'aft_loss_distribution': 'normal', 'aft_loss_distribution_scale': 1.2835877441253574, 'max_depth': 5, 'booster': 'dart', 'scale_pos_weight': 2.3358527077066364, 'alpha': 8.961914259939348, 'lambda': 9.504224523207629, 'eta': 0.8228499970247526, 'sampling_method': 'uniform', 'subsample': 0.5841366201061181, 'gamma': 6.832548570551454}. Best is trial 77 with value: 1.9163923221585393.
[I 2023-12-21 00:10:49,792] Trial 94 finished with value: 1.9346162149442145 and parameters: {'learning_rate': 0.9978582375708354, 'aft_loss_distribution': 'normal', 'aft_loss_distribution_scale': 1.7386879958960506, 'max_depth': 5, 'booster': 'dart', 'scale_pos_weight': 1.78813081576442, 'alpha': 6.509117726049219, 'lambda': 8.72103270850426, 'eta': 0.913995627605164, 'sampling_method': 'uniform', 'subsample': 0.328083660273669, 'gamma': 7.22305155131533}. Best is trial 77 with value: 1.9163923221585393.
[I 2023-12-21 00:10:55,071] Trial 95 finished with value: 1.9288186448456304 and parameters: {'learning_rate': 0.9937808927357497, 'aft_loss_distribution': 'normal', 'aft_loss_distribution_scale': 1.6968207874701968, 'max_depth': 5, 'booster': 'dart', 'scale_pos_weight': 1.3188424946876953, 'alpha': 6.496924766977365, 'lambda': 8.765246756290551, 'eta': 0.9211203161427833, 'sampling_method': 'uniform', 'subsample': 0.33415056720711733, 'gamma': 7.227952038870305}. Best is trial 77 with value: 1.9163923221585393.
[I 2023-12-21 00:10:55,133] Trial 96 pruned. Trial was pruned at iteration 0.
