[I 2023-12-19 00:30:00,895] Trial 371 pruned. Trial was pruned at iteration 0.
[I 2023-12-19 00:30:01,030] Trial 372 pruned. Trial was pruned at iteration 0.
[I 2023-12-19 00:30:01,174] Trial 373 pruned. Trial was pruned at iteration 0.
[I 2023-12-19 00:30:01,328] Trial 374 pruned. Trial was pruned at iteration 0.
[I 2023-12-19 00:30:01,472] Trial 375 pruned. Trial was pruned at iteration 0.
[I 2023-12-19 00:30:01,626] Trial 376 pruned. Trial was pruned at iteration 0.
[I 2023-12-19 00:30:03,879] Trial 377 finished with value: inf and parameters: {'learning_rate': 0.9404968567963895, 'aft_loss_distribution': 'normal', 'aft_loss_distribution_scale': 1.6055291998944492, 'max_depth': 6, 'booster': 'dart', 'scale_pos_weight': 1.4196380736075056, 'alpha': 5.241590181581198, 'lambda': 3.9563355485621727, 'eta': 0.03250010956865184, 'sampling_method': 'uniform', 'subsample': 0.3377351350867663, 'gamma': 6.637938229815414}. Best is trial 4 with value: 2.032977880923993.
[I 2023-12-19 00:30:03,985] Trial 378 pruned. Trial was pruned at iteration 0.
[I 2023-12-19 00:30:04,086] Trial 379 pruned. Trial was pruned at iteration 0.
[I 2023-12-19 00:30:04,177] Trial 380 pruned. Trial was pruned at iteration 0.
[I 2023-12-19 00:30:04,278] Trial 381 pruned. Trial was pruned at iteration 0.
[I 2023-12-19 00:30:04,375] Trial 382 pruned. Trial was pruned at iteration 0.
[I 2023-12-19 00:30:04,466] Trial 383 pruned. Trial was pruned at iteration 0.
[I 2023-12-19 00:30:04,563] Trial 384 pruned. Trial was pruned at iteration 0.
[I 2023-12-19 00:30:04,656] Trial 385 pruned. Trial was pruned at iteration 0.
[I 2023-12-19 00:30:04,748] Trial 386 pruned. Trial was pruned at iteration 0.
[I 2023-12-19 00:30:04,846] Trial 387 pruned. Trial was pruned at iteration 0.
[I 2023-12-19 00:30:05,193] Trial 388 finished with value: 2.078147915630748 and parameters: {'learning_rate': 0.9056267686779732, 'aft_loss_distribution': 'normal', 'aft_loss_distribution_scale': 2.3050566031623565, 'max_depth': 6, 'booster': 'gbtree', 'scale_pos_weight': 2.5722653226005256, 'alpha': 8.449196257562178, 'lambda': 3.879857154266775, 'eta': 0.7819544636809367, 'sampling_method': 'gradient_based', 'subsample': 0.6686018381853848, 'gamma': 5.513475242134432}. Best is trial 4 with value: 2.032977880923993.
[I 2023-12-19 00:30:05,290] Trial 389 pruned. Trial was pruned at iteration 0.
[I 2023-12-19 00:30:05,382] Trial 390 pruned. Trial was pruned at iteration 0.
[I 2023-12-19 00:30:05,477] Trial 391 pruned. Trial was pruned at iteration 0.
[I 2023-12-19 00:30:05,567] Trial 392 pruned. Trial was pruned at iteration 0.
[I 2023-12-19 00:30:05,658] Trial 393 pruned. Trial was pruned at iteration 0.
[I 2023-12-19 00:30:05,748] Trial 394 pruned. Trial was pruned at iteration 0.
[I 2023-12-19 00:30:05,837] Trial 395 pruned. Trial was pruned at iteration 0.
[I 2023-12-19 00:30:05,944] Trial 396 pruned. Trial was pruned at iteration 0.
[I 2023-12-19 00:30:06,033] Trial 397 pruned. Trial was pruned at iteration 0.
[I 2023-12-19 00:30:06,134] Trial 398 pruned. Trial was pruned at iteration 0.
[I 2023-12-19 00:30:06,432] Trial 399 finished with value: inf and parameters: {'learning_rate': 0.9209302261097457, 'aft_loss_distribution': 'normal', 'aft_loss_distribution_scale': 1.5367823628813406, 'max_depth': 5, 'booster': 'gbtree', 'scale_pos_weight': 3.4346042814725917, 'alpha': 4.663701812307487, 'lambda': 3.493423974979004, 'eta': 0.8437431807317228, 'sampling_method': 'gradient_based', 'subsample': 0.04811812628059402, 'gamma': 1.3933137921099013}. Best is trial 4 with value: 2.032977880923993.
[I 2023-12-19 00:30:06,536] Trial 400 pruned. Trial was pruned at iteration 0.
[I 2023-12-19 00:30:06,633] Trial 401 pruned. Trial was pruned at iteration 0.
[I 2023-12-19 00:30:06,724] Trial 402 pruned. Trial was pruned at iteration 0.
[I 2023-12-19 00:30:06,818] Trial 403 pruned. Trial was pruned at iteration 0.
[I 2023-12-19 00:30:06,924] Trial 404 pruned. Trial was pruned at iteration 0.
[I 2023-12-19 00:30:07,021] Trial 405 pruned. Trial was pruned at iteration 0.
[I 2023-12-19 00:30:07,114] Trial 406 pruned. Trial was pruned at iteration 0.
[I 2023-12-19 00:30:07,211] Trial 407 pruned. Trial was pruned at iteration 0.
[I 2023-12-19 00:30:07,304] Trial 408 pruned. Trial was pruned at iteration 0.
[I 2023-12-19 00:30:07,408] Trial 409 pruned. Trial was pruned at iteration 1.
[I 2023-12-19 00:30:07,504] Trial 410 pruned. Trial was pruned at iteration 0.
[I 2023-12-19 00:30:07,600] Trial 411 pruned. Trial was pruned at iteration 0.
[I 2023-12-19 00:30:07,694] Trial 412 pruned. Trial was pruned at iteration 0.
[I 2023-12-19 00:30:07,784] Trial 413 pruned. Trial was pruned at iteration 0.
[I 2023-12-19 00:30:07,878] Trial 414 pruned. Trial was pruned at iteration 0.
[I 2023-12-19 00:30:07,979] Trial 415 pruned. Trial was pruned at iteration 0.
[I 2023-12-19 00:30:08,077] Trial 416 pruned. Trial was pruned at iteration 0.
[I 2023-12-19 00:30:08,181] Trial 417 pruned. Trial was pruned at iteration 0.
[I 2023-12-19 00:30:08,281] Trial 418 pruned. Trial was pruned at iteration 0.
[I 2023-12-19 00:30:16,991] Trial 419 finished with value: 2.0459372816575714 and parameters: {'learning_rate': 0.9778617079085061, 'aft_loss_distribution': 'normal', 'aft_loss_distribution_scale': 1.9579118525105559, 'max_depth': 4, 'booster': 'dart', 'scale_pos_weight': 2.766400971759664, 'alpha': 0.9729275834825699, 'lambda': 4.149475516893689, 'eta': 0.5351491846098142, 'sampling_method': 'gradient_based', 'subsample': 0.7666664763432959, 'gamma': 6.8013314361794155}. Best is trial 4 with value: 2.032977880923993.
[I 2023-12-19 00:30:21,567] Trial 420 finished with value: 2.0393220061058495 and parameters: {'learning_rate': 0.9829521700710422, 'aft_loss_distribution': 'normal', 'aft_loss_distribution_scale': 1.9171622140385298, 'max_depth': 4, 'booster': 'dart', 'scale_pos_weight': 2.7168847887887613, 'alpha': 0.9296603485152082, 'lambda': 6.137748776353272, 'eta': 0.5474931563360854, 'sampling_method': 'uniform', 'subsample': 0.7636276477518964, 'gamma': 6.935175484045087}. Best is trial 4 with value: 2.032977880923993.
[I 2023-12-19 00:30:32,274] Trial 421 finished with value: 2.0435615442021615 and parameters: {'learning_rate': 0.9760346830076978, 'aft_loss_distribution': 'normal', 'aft_loss_distribution_scale': 1.9546743154699955, 'max_depth': 4, 'booster': 'dart', 'scale_pos_weight': 2.76253333321598, 'alpha': 0.9486568645968295, 'lambda': 6.188619943175239, 'eta': 0.5679639773327553, 'sampling_method': 'gradient_based', 'subsample': 0.7936026125687409, 'gamma': 6.800898502544013}. Best is trial 4 with value: 2.032977880923993.
[I 2023-12-19 00:30:34,493] Trial 422 finished with value: inf and parameters: {'learning_rate': 0.9979911655471742, 'aft_loss_distribution': 'normal', 'aft_loss_distribution_scale': 1.9487111889286637, 'max_depth': 4, 'booster': 'dart', 'scale_pos_weight': 2.743791493146671, 'alpha': 1.288174687891301, 'lambda': 6.127545858809191, 'eta': 0.5686417940231321, 'sampling_method': 'gradient_based', 'subsample': 0.6990306499983827, 'gamma': 6.679102462420448}. Best is trial 4 with value: 2.032977880923993.
[I 2023-12-19 00:30:41,478] Trial 423 pruned. Trial was pruned at iteration 129.
[I 2023-12-19 00:30:44,614] Trial 424 finished with value: inf and parameters: {'learning_rate': 0.9654927184943973, 'aft_loss_distribution': 'normal', 'aft_loss_distribution_scale': 2.0467394972519872, 'max_depth': 4, 'booster': 'dart', 'scale_pos_weight': 2.810123611017029, 'alpha': 1.0574031521984146, 'lambda': 6.2920540987847655, 'eta': 0.5920105774746326, 'sampling_method': 'gradient_based', 'subsample': 0.7590704766230207, 'gamma': 6.835653047323312}. Best is trial 4 with value: 2.032977880923993.
[I 2023-12-19 00:30:47,648] Trial 425 finished with value: 2.0367796692946007 and parameters: {'learning_rate': 0.9829121297918538, 'aft_loss_distribution': 'normal', 'aft_loss_distribution_scale': 1.8492361189233206, 'max_depth': 4, 'booster': 'dart', 'scale_pos_weight': 2.743291801968929, 'alpha': 0.955024425213216, 'lambda': 5.911180933182875, 'eta': 0.8583586538552933, 'sampling_method': 'gradient_based', 'subsample': 0.8035079059435597, 'gamma': 7.047161605524912}. Best is trial 4 with value: 2.032977880923993.
[I 2023-12-19 00:30:50,429] Trial 426 finished with value: 2.032313572033844 and parameters: {'learning_rate': 0.9796872513068811, 'aft_loss_distribution': 'normal', 'aft_loss_distribution_scale': 1.7888536632508871, 'max_depth': 4, 'booster': 'dart', 'scale_pos_weight': 2.751322437924866, 'alpha': 0.9337926527075925, 'lambda': 5.894530179388127, 'eta': 0.544953851077427, 'sampling_method': 'gradient_based', 'subsample': 0.7808338289979603, 'gamma': 7.108777007823504}. Best is trial 426 with value: 2.032313572033844.
[I 2023-12-19 00:30:52,044] Trial 427 finished with value: inf and parameters: {'learning_rate': 0.9848965559759383, 'aft_loss_distribution': 'normal', 'aft_loss_distribution_scale': 1.764813559483633, 'max_depth': 4, 'booster': 'dart', 'scale_pos_weight': 2.7927817755296482, 'alpha': 0.568186917339963, 'lambda': 5.904190290701705, 'eta': 0.5539397280768362, 'sampling_method': 'gradient_based', 'subsample': 0.7830763933443238, 'gamma': 7.059889647693239}. Best is trial 426 with value: 2.032313572033844.
[I 2023-12-19 00:30:54,856] Trial 428 finished with value: 2.0410134585734734 and parameters: {'learning_rate': 0.9851261561773249, 'aft_loss_distribution': 'normal', 'aft_loss_distribution_scale': 1.9023153031954692, 'max_depth': 4, 'booster': 'dart', 'scale_pos_weight': 2.7100229899830683, 'alpha': 0.9046423213704419, 'lambda': 6.046654456337116, 'eta': 0.5664068764052721, 'sampling_method': 'gradient_based', 'subsample': 0.8151124198714326, 'gamma': 7.093628759668768}. Best is trial 426 with value: 2.032313572033844.
[I 2023-12-19 00:31:01,600] Trial 429 finished with value: 2.0358500923013056 and parameters: {'learning_rate': 0.9900437366421009, 'aft_loss_distribution': 'normal', 'aft_loss_distribution_scale': 1.8356447445505486, 'max_depth': 4, 'booster': 'dart', 'scale_pos_weight': 2.7302538482426377, 'alpha': 0.9065027030588727, 'lambda': 6.091429888084441, 'eta': 0.5650388477420412, 'sampling_method': 'gradient_based', 'subsample': 0.8190085654553432, 'gamma': 7.197458201738637}. Best is trial 426 with value: 2.032313572033844.
[I 2023-12-19 00:31:04,456] Trial 430 finished with value: 2.0221643146664494 and parameters: {'learning_rate': 0.9896305808449086, 'aft_loss_distribution': 'normal', 'aft_loss_distribution_scale': 1.5917908662941416, 'max_depth': 4, 'booster': 'dart', 'scale_pos_weight': 2.719043081837697, 'alpha': 0.9889824321541967, 'lambda': 6.140098788434609, 'eta': 0.57618246422998, 'sampling_method': 'gradient_based', 'subsample': 0.8123014179799982, 'gamma': 7.14724319498373}. Best is trial 430 with value: 2.0221643146664494.
[I 2023-12-19 00:31:07,889] Trial 431 finished with value: 2.028606274798098 and parameters: {'learning_rate': 0.9888778750551691, 'aft_loss_distribution': 'normal', 'aft_loss_distribution_scale': 1.7382506202648138, 'max_depth': 4, 'booster': 'dart', 'scale_pos_weight': 2.7576457430328363, 'alpha': 1.0590500730477275, 'lambda': 6.26212912744313, 'eta': 0.580438941959794, 'sampling_method': 'gradient_based', 'subsample': 0.824731222062864, 'gamma': 7.190835861666018}. Best is trial 430 with value: 2.0221643146664494.
[I 2023-12-19 00:31:10,285] Trial 432 finished with value: inf and parameters: {'learning_rate': 0.9870926039465987, 'aft_loss_distribution': 'normal', 'aft_loss_distribution_scale': 1.745706794197433, 'max_depth': 4, 'booster': 'dart', 'scale_pos_weight': 2.7412148687674263, 'alpha': 0.9317618843344919, 'lambda': 6.131940302397001, 'eta': 0.5813694441919393, 'sampling_method': 'gradient_based', 'subsample': 0.822427826219683, 'gamma': 7.198883622847641}. Best is trial 430 with value: 2.0221643146664494.
[I 2023-12-19 00:31:12,063] Trial 433 finished with value: inf and parameters: {'learning_rate': 0.9993003835009673, 'aft_loss_distribution': 'normal', 'aft_loss_distribution_scale': 1.64851920662373, 'max_depth': 4, 'booster': 'dart', 'scale_pos_weight': 2.7249850969102996, 'alpha': 0.9383539422055874, 'lambda': 6.262901823772534, 'eta': 0.5701149293843895, 'sampling_method': 'gradient_based', 'subsample': 0.8030021324344165, 'gamma': 6.981255947464335}. Best is trial 430 with value: 2.0221643146664494.
[I 2023-12-19 00:31:14,188] Trial 434 finished with value: inf and parameters: {'learning_rate': 0.9733517474777633, 'aft_loss_distribution': 'normal', 'aft_loss_distribution_scale': 1.8382834608212952, 'max_depth': 4, 'booster': 'dart', 'scale_pos_weight': 2.6753994839207254, 'alpha': 0.7023190693223484, 'lambda': 6.053013853111371, 'eta': 0.5748645214488568, 'sampling_method': 'gradient_based', 'subsample': 0.8352872105063849, 'gamma': 7.3021232512355985}. Best is trial 430 with value: 2.0221643146664494.
[I 2023-12-19 00:31:16,867] Trial 435 finished with value: inf and parameters: {'learning_rate': 0.9815874474934673, 'aft_loss_distribution': 'normal', 'aft_loss_distribution_scale': 1.9395497602056686, 'max_depth': 4, 'booster': 'dart', 'scale_pos_weight': 2.7738300071665023, 'alpha': 0.9987277305633626, 'lambda': 6.2995490410925346, 'eta': 0.5616488371649863, 'sampling_method': 'gradient_based', 'subsample': 0.8058633165144815, 'gamma': 7.152908917205631}. Best is trial 430 with value: 2.0221643146664494.
[I 2023-12-19 00:31:22,840] Trial 436 finished with value: 2.021888837240977 and parameters: {'learning_rate': 0.998358355287758, 'aft_loss_distribution': 'normal', 'aft_loss_distribution_scale': 1.6062629464014884, 'max_depth': 4, 'booster': 'dart', 'scale_pos_weight': 2.658447213891088, 'alpha': 0.7943474513825303, 'lambda': 6.511490611993848, 'eta': 0.5480803884237797, 'sampling_method': 'gradient_based', 'subsample': 0.7744276824503349, 'gamma': 7.276084437060968}. Best is trial 436 with value: 2.021888837240977.
[I 2023-12-19 00:31:24,623] Trial 437 finished with value: inf and parameters: {'learning_rate': 0.9878871017591234, 'aft_loss_distribution': 'normal', 'aft_loss_distribution_scale': 1.5695323626093078, 'max_depth': 4, 'booster': 'dart', 'scale_pos_weight': 2.6377349436469752, 'alpha': 0.7710111059983463, 'lambda': 5.911800610785785, 'eta': 0.53085934012183, 'sampling_method': 'gradient_based', 'subsample': 0.7716181794573636, 'gamma': 7.245253778214989}. Best is trial 436 with value: 2.021888837240977.
[I 2023-12-19 00:31:29,046] Trial 438 finished with value: 2.03934925155611 and parameters: {'learning_rate': 0.9960319752565477, 'aft_loss_distribution': 'normal', 'aft_loss_distribution_scale': 1.878199921738116, 'max_depth': 4, 'booster': 'dart', 'scale_pos_weight': 2.7355714102861213, 'alpha': 1.078741422741277, 'lambda': 6.506674863167317, 'eta': 0.5967785450398808, 'sampling_method': 'gradient_based', 'subsample': 0.8176162847955488, 'gamma': 7.036344688181047}. Best is trial 436 with value: 2.021888837240977.
[I 2023-12-19 00:31:31,494] Trial 439 finished with value: inf and parameters: {'learning_rate': 0.9991511994613272, 'aft_loss_distribution': 'normal', 'aft_loss_distribution_scale': 1.7608577272901287, 'max_depth': 4, 'booster': 'dart', 'scale_pos_weight': 2.752745688073042, 'alpha': 1.1088904122118877, 'lambda': 6.479676276627969, 'eta': 0.5995880556244384, 'sampling_method': 'gradient_based', 'subsample': 0.8195313227067897, 'gamma': 7.011660238077724}. Best is trial 436 with value: 2.021888837240977.
[I 2023-12-19 00:31:32,993] Trial 440 pruned. Trial was pruned at iteration 55.
[I 2023-12-19 00:31:34,343] Trial 441 finished with value: inf and parameters: {'learning_rate': 0.9970070980817513, 'aft_loss_distribution': 'normal', 'aft_loss_distribution_scale': 1.6140067273679013, 'max_depth': 4, 'booster': 'dart', 'scale_pos_weight': 2.80822455191044, 'alpha': 0.6648069061012198, 'lambda': 6.165926909542509, 'eta': 0.5564064903072666, 'sampling_method': 'gradient_based', 'subsample': 0.8358679764713094, 'gamma': 7.370884046041433}. Best is trial 436 with value: 2.021888837240977.
[I 2023-12-19 00:31:36,419] Trial 442 finished with value: inf and parameters: {'learning_rate': 0.962615824797931, 'aft_loss_distribution': 'normal', 'aft_loss_distribution_scale': 1.8079348488389961, 'max_depth': 4, 'booster': 'dart', 'scale_pos_weight': 2.6327475170404298, 'alpha': 1.0415876554802959, 'lambda': 6.539088387318293, 'eta': 0.5421091434119408, 'sampling_method': 'gradient_based', 'subsample': 0.8563264195561815, 'gamma': 6.954967505893095}. Best is trial 436 with value: 2.021888837240977.
[I 2023-12-19 00:31:37,784] Trial 443 finished with value: inf and parameters: {'learning_rate': 0.9798007230919965, 'aft_loss_distribution': 'normal', 'aft_loss_distribution_scale': 2.008263621130317, 'max_depth': 4, 'booster': 'dart', 'scale_pos_weight': 2.7292003573796424, 'alpha': 0.891572999177615, 'lambda': 6.200108241021579, 'eta': 0.5898155561984475, 'sampling_method': 'gradient_based', 'subsample': 0.8149904859645888, 'gamma': 7.501001763833647}. Best is trial 436 with value: 2.021888837240977.
[I 2023-12-19 00:31:40,450] Trial 444 finished with value: inf and parameters: {'learning_rate': 0.9985647022571136, 'aft_loss_distribution': 'normal', 'aft_loss_distribution_scale': 1.4697964199934195, 'max_depth': 4, 'booster': 'dart', 'scale_pos_weight': 2.828177471783824, 'alpha': 1.2143213424292145, 'lambda': 6.012043380319454, 'eta': 0.5555095412945331, 'sampling_method': 'gradient_based', 'subsample': 0.7836825948822791, 'gamma': 7.333279593313825}. Best is trial 436 with value: 2.021888837240977.
[I 2023-12-19 00:31:42,543] Trial 445 finished with value: inf and parameters: {'learning_rate': 0.9646786569823356, 'aft_loss_distribution': 'normal', 'aft_loss_distribution_scale': 1.7057075199739848, 'max_depth': 4, 'booster': 'dart', 'scale_pos_weight': 2.6725113878094655, 'alpha': 0.4555433066199125, 'lambda': 5.863652391959855, 'eta': 0.6036442567379829, 'sampling_method': 'gradient_based', 'subsample': 0.7640367978490936, 'gamma': 6.794909946004476}. Best is trial 436 with value: 2.021888837240977.
[I 2023-12-19 00:31:46,335] Trial 446 finished with value: 2.040904036519792 and parameters: {'learning_rate': 0.980303961912466, 'aft_loss_distribution': 'normal', 'aft_loss_distribution_scale': 1.9003933669871316, 'max_depth': 4, 'booster': 'dart', 'scale_pos_weight': 2.7589530994920892, 'alpha': 0.6992657219869614, 'lambda': 6.665213354605776, 'eta': 0.5422302100145489, 'sampling_method': 'gradient_based', 'subsample': 0.8057846367451222, 'gamma': 7.06622700639959}. Best is trial 436 with value: 2.021888837240977.
[I 2023-12-19 00:31:56,506] Trial 447 finished with value: 2.040494833339204 and parameters: {'learning_rate': 0.9776150090500297, 'aft_loss_distribution': 'normal', 'aft_loss_distribution_scale': 1.895535030949654, 'max_depth': 4, 'booster': 'dart', 'scale_pos_weight': 2.7597901403444447, 'alpha': 0.7613524081263697, 'lambda': 6.310838411112478, 'eta': 0.5380120411367693, 'sampling_method': 'gradient_based', 'subsample': 0.8156897036588292, 'gamma': 7.273483400550753}. Best is trial 436 with value: 2.021888837240977.
[I 2023-12-19 00:32:00,420] Trial 448 finished with value: 2.0407825717866928 and parameters: {'learning_rate': 0.9816427615035095, 'aft_loss_distribution': 'normal', 'aft_loss_distribution_scale': 1.8992795961655706, 'max_depth': 4, 'booster': 'dart', 'scale_pos_weight': 2.771155279928553, 'alpha': 0.7144937902693869, 'lambda': 6.434376225142414, 'eta': 0.543980343228019, 'sampling_method': 'gradient_based', 'subsample': 0.8050108649087377, 'gamma': 7.196307417677456}. Best is trial 436 with value: 2.021888837240977.
[I 2023-12-19 00:32:03,929] Trial 449 finished with value: 2.0421001743890352 and parameters: {'learning_rate': 0.9758656750203174, 'aft_loss_distribution': 'normal', 'aft_loss_distribution_scale': 1.912962207870952, 'max_depth': 4, 'booster': 'dart', 'scale_pos_weight': 2.8071355810241156, 'alpha': 0.6211548621706244, 'lambda': 6.563870562381685, 'eta': 0.5393793351226098, 'sampling_method': 'gradient_based', 'subsample': 0.8066412587208693, 'gamma': 7.305284263757971}. Best is trial 436 with value: 2.021888837240977.
[I 2023-12-19 00:32:06,204] Trial 450 pruned. Trial was pruned at iteration 70.
[I 2023-12-19 00:32:07,981] Trial 451 finished with value: inf and parameters: {'learning_rate': 0.9567146188526401, 'aft_loss_distribution': 'normal', 'aft_loss_distribution_scale': 1.5769331837034055, 'max_depth': 4, 'booster': 'dart', 'scale_pos_weight': 2.845673776006542, 'alpha': 0.8477875991035544, 'lambda': 6.35901646995729, 'eta': 0.5350073596114002, 'sampling_method': 'gradient_based', 'subsample': 0.8444999563619048, 'gamma': 7.032774503475387}. Best is trial 436 with value: 2.021888837240977.
[I 2023-12-19 00:32:08,095] Trial 452 pruned. Trial was pruned at iteration 1.
[I 2023-12-19 00:32:11,642] Trial 453 finished with value: 2.0370715270449407 and parameters: {'learning_rate': 0.9826306528311979, 'aft_loss_distribution': 'normal', 'aft_loss_distribution_scale': 1.8575915956039057, 'max_depth': 4, 'booster': 'dart', 'scale_pos_weight': 2.7142960111268977, 'alpha': 1.0650945372571696, 'lambda': 6.459858614554757, 'eta': 0.5721777136814152, 'sampling_method': 'gradient_based', 'subsample': 0.8218471780954584, 'gamma': 6.884775193795}. Best is trial 436 with value: 2.021888837240977.
[I 2023-12-19 00:32:26,523] Trial 454 finished with value: 2.0324180313700646 and parameters: {'learning_rate': 0.9998812740402674, 'aft_loss_distribution': 'normal', 'aft_loss_distribution_scale': 1.7894059639450681, 'max_depth': 4, 'booster': 'dart', 'scale_pos_weight': 2.6909378621876088, 'alpha': 1.0637306980313763, 'lambda': 6.3805484839746915, 'eta': 0.5792565411592895, 'sampling_method': 'gradient_based', 'subsample': 0.8209444591069789, 'gamma': 6.866753383255827}. Best is trial 436 with value: 2.021888837240977.
