[I 2023-12-19 04:36:26,691] Trial 174 pruned. Trial was pruned at iteration 0.
[I 2023-12-19 04:36:27,011] Trial 175 pruned. Trial was pruned at iteration 1.
[I 2023-12-19 04:36:28,987] Trial 176 finished with value: inf and parameters: {'learning_rate': 0.8021409681454184, 'aft_loss_distribution': 'normal', 'aft_loss_distribution_scale': 1.1764449211363015, 'max_depth': 7, 'booster': 'gbtree', 'scale_pos_weight': 5.720059727123578, 'alpha': 2.045777650851538, 'lambda': 4.390025846819712, 'eta': 0.1347087374123902, 'sampling_method': 'uniform', 'subsample': 0.46544700870155065, 'gamma': 5.650431481239078}. Best is trial 121 with value: 4.295222755430402.
[I 2023-12-19 04:36:29,171] Trial 177 pruned. Trial was pruned at iteration 1.
[I 2023-12-19 04:36:30,409] Trial 178 finished with value: inf and parameters: {'learning_rate': 0.9568594592095094, 'aft_loss_distribution': 'normal', 'aft_loss_distribution_scale': 1.4166043849232415, 'max_depth': 6, 'booster': 'gbtree', 'scale_pos_weight': 6.407930697187889, 'alpha': 1.5066006789011785, 'lambda': 5.643719812836409, 'eta': 0.07004240056219384, 'sampling_method': 'uniform', 'subsample': 0.5097262325319035, 'gamma': 5.9695778968948}. Best is trial 121 with value: 4.295222755430402.
[I 2023-12-19 04:36:30,575] Trial 179 pruned. Trial was pruned at iteration 0.
[I 2023-12-19 04:36:30,666] Trial 180 pruned. Trial was pruned at iteration 0.
[I 2023-12-19 04:36:30,787] Trial 181 pruned. Trial was pruned at iteration 2.
[I 2023-12-19 04:36:30,879] Trial 182 pruned. Trial was pruned at iteration 0.
[I 2023-12-19 04:36:30,970] Trial 183 pruned. Trial was pruned at iteration 0.
[I 2023-12-19 04:36:31,462] Trial 184 finished with value: inf and parameters: {'learning_rate': 0.8647773718830759, 'aft_loss_distribution': 'normal', 'aft_loss_distribution_scale': 1.3195432008267436, 'max_depth': 4, 'booster': 'gbtree', 'scale_pos_weight': 5.261171635948974, 'alpha': 2.4278895135505403, 'lambda': 6.357434503854727, 'eta': 0.261419389481052, 'sampling_method': 'uniform', 'subsample': 0.43844988686239694, 'gamma': 4.672596687626801}. Best is trial 121 with value: 4.295222755430402.
[I 2023-12-19 04:36:31,549] Trial 185 pruned. Trial was pruned at iteration 0.
[I 2023-12-19 04:36:31,640] Trial 186 pruned. Trial was pruned at iteration 0.
[I 2023-12-19 04:36:31,761] Trial 187 pruned. Trial was pruned at iteration 1.
[I 2023-12-19 04:36:31,856] Trial 188 pruned. Trial was pruned at iteration 0.
[I 2023-12-19 04:36:32,365] Trial 189 finished with value: inf and parameters: {'learning_rate': 0.8924420219262842, 'aft_loss_distribution': 'normal', 'aft_loss_distribution_scale': 1.2822144425498259, 'max_depth': 5, 'booster': 'gbtree', 'scale_pos_weight': 5.971536206081593, 'alpha': 2.6982077507838587, 'lambda': 4.011870115169066, 'eta': 0.18304637854134748, 'sampling_method': 'uniform', 'subsample': 0.3636338363214949, 'gamma': 6.998020977482093}. Best is trial 121 with value: 4.295222755430402.
[I 2023-12-19 04:36:32,457] Trial 190 pruned. Trial was pruned at iteration 0.
[I 2023-12-19 04:36:32,547] Trial 191 pruned. Trial was pruned at iteration 0.
[I 2023-12-19 04:36:32,650] Trial 192 pruned. Trial was pruned at iteration 0.
[I 2023-12-19 04:36:32,742] Trial 193 pruned. Trial was pruned at iteration 0.
[I 2023-12-19 04:36:32,847] Trial 194 pruned. Trial was pruned at iteration 0.
[I 2023-12-19 04:36:32,957] Trial 195 pruned. Trial was pruned at iteration 0.
[I 2023-12-19 04:36:33,049] Trial 196 pruned. Trial was pruned at iteration 0.
[I 2023-12-19 04:36:33,134] Trial 197 pruned. Trial was pruned at iteration 0.
[I 2023-12-19 04:36:33,230] Trial 198 pruned. Trial was pruned at iteration 1.
[I 2023-12-19 04:36:33,700] Trial 199 finished with value: inf and parameters: {'learning_rate': 0.781938105079902, 'aft_loss_distribution': 'normal', 'aft_loss_distribution_scale': 1.2286278475293555, 'max_depth': 4, 'booster': 'gbtree', 'scale_pos_weight': 5.073966871860048, 'alpha': 0.8288953096680575, 'lambda': 4.230715302599047, 'eta': 0.16401310842889613, 'sampling_method': 'uniform', 'subsample': 0.32823491653715753, 'gamma': 5.87247828462055}. Best is trial 121 with value: 4.295222755430402.
[I 2023-12-19 04:36:34,590] Trial 200 finished with value: 4.342576782558768 and parameters: {'learning_rate': 0.9138535546576319, 'aft_loss_distribution': 'normal', 'aft_loss_distribution_scale': 1.5304715085857736, 'max_depth': 7, 'booster': 'gbtree', 'scale_pos_weight': 6.167705523218013, 'alpha': 1.4030404809126313, 'lambda': 5.15090800667961, 'eta': 0.3591952331519701, 'sampling_method': 'uniform', 'subsample': 0.3774463744014799, 'gamma': 6.966592768397914}. Best is trial 121 with value: 4.295222755430402.
[I 2023-12-19 04:36:34,693] Trial 201 pruned. Trial was pruned at iteration 2.
[I 2023-12-19 04:36:34,782] Trial 202 pruned. Trial was pruned at iteration 0.
[I 2023-12-19 04:36:34,898] Trial 203 pruned. Trial was pruned at iteration 1.
[I 2023-12-19 04:36:35,316] Trial 204 finished with value: inf and parameters: {'learning_rate': 0.8827634758197789, 'aft_loss_distribution': 'normal', 'aft_loss_distribution_scale': 1.4414586846460173, 'max_depth': 7, 'booster': 'gbtree', 'scale_pos_weight': 5.869257005282207, 'alpha': 1.7049080761403956, 'lambda': 4.475863430830108, 'eta': 0.3347204814862256, 'sampling_method': 'uniform', 'subsample': 0.43241531397917654, 'gamma': 6.859760424683118}. Best is trial 121 with value: 4.295222755430402.
[I 2023-12-19 04:36:35,412] Trial 205 pruned. Trial was pruned at iteration 1.
[I 2023-12-19 04:36:35,961] Trial 206 finished with value: inf and parameters: {'learning_rate': 0.974935186496907, 'aft_loss_distribution': 'normal', 'aft_loss_distribution_scale': 1.0051967939430633, 'max_depth': 6, 'booster': 'gbtree', 'scale_pos_weight': 6.197068708092984, 'alpha': 2.3195071967042162, 'lambda': 4.692928098979914, 'eta': 0.17872631825668323, 'sampling_method': 'uniform', 'subsample': 0.6093956467572769, 'gamma': 6.188653061059414}. Best is trial 121 with value: 4.295222755430402.
[I 2023-12-19 04:36:36,052] Trial 207 pruned. Trial was pruned at iteration 0.
[I 2023-12-19 04:36:36,138] Trial 208 pruned. Trial was pruned at iteration 0.
[I 2023-12-19 04:36:36,230] Trial 209 pruned. Trial was pruned at iteration 0.
[I 2023-12-19 04:36:36,321] Trial 210 pruned. Trial was pruned at iteration 0.
[I 2023-12-19 04:36:36,414] Trial 211 pruned. Trial was pruned at iteration 0.
[I 2023-12-19 04:36:36,510] Trial 212 pruned. Trial was pruned at iteration 1.
[I 2023-12-19 04:36:36,611] Trial 213 pruned. Trial was pruned at iteration 0.
[I 2023-12-19 04:36:36,709] Trial 214 pruned. Trial was pruned at iteration 0.
[I 2023-12-19 04:36:37,286] Trial 215 finished with value: 4.307083470330694 and parameters: {'learning_rate': 0.8191526251310439, 'aft_loss_distribution': 'normal', 'aft_loss_distribution_scale': 1.412030043129592, 'max_depth': 4, 'booster': 'gbtree', 'scale_pos_weight': 6.346373203127407, 'alpha': 0.9395517301176461, 'lambda': 4.095020770247201, 'eta': 0.14374699135551522, 'sampling_method': 'uniform', 'subsample': 0.5654608204405089, 'gamma': 6.050868589221039}. Best is trial 121 with value: 4.295222755430402.
[I 2023-12-19 04:36:37,755] Trial 216 finished with value: inf and parameters: {'learning_rate': 0.8208350334120149, 'aft_loss_distribution': 'normal', 'aft_loss_distribution_scale': 1.3718657575623827, 'max_depth': 4, 'booster': 'gbtree', 'scale_pos_weight': 6.412544998699029, 'alpha': 1.0503568075722014, 'lambda': 4.180475815239244, 'eta': 0.15019914708306323, 'sampling_method': 'uniform', 'subsample': 0.5758913233459767, 'gamma': 9.66278543380232}. Best is trial 121 with value: 4.295222755430402.
[I 2023-12-19 04:36:37,846] Trial 217 pruned. Trial was pruned at iteration 0.
[I 2023-12-19 04:36:38,316] Trial 218 finished with value: inf and parameters: {'learning_rate': 0.8699001685104135, 'aft_loss_distribution': 'normal', 'aft_loss_distribution_scale': 1.2393220078734153, 'max_depth': 6, 'booster': 'gbtree', 'scale_pos_weight': 5.938882353446747, 'alpha': 0.7049132464171087, 'lambda': 3.8843539588019573, 'eta': 0.1386540591029678, 'sampling_method': 'uniform', 'subsample': 0.5271355223088058, 'gamma': 6.330142373157299}. Best is trial 121 with value: 4.295222755430402.
[I 2023-12-19 04:36:38,423] Trial 219 pruned. Trial was pruned at iteration 2.
[I 2023-12-19 04:36:38,514] Trial 220 pruned. Trial was pruned at iteration 0.
[I 2023-12-19 04:36:38,609] Trial 221 pruned. Trial was pruned at iteration 0.
[I 2023-12-19 04:36:38,701] Trial 222 pruned. Trial was pruned at iteration 0.
[I 2023-12-19 04:36:38,792] Trial 223 pruned. Trial was pruned at iteration 0.
[I 2023-12-19 04:36:38,880] Trial 224 pruned. Trial was pruned at iteration 0.
[I 2023-12-19 04:36:39,694] Trial 225 finished with value: 4.267449843322546 and parameters: {'learning_rate': 0.7897732187593821, 'aft_loss_distribution': 'normal', 'aft_loss_distribution_scale': 1.2928462723155536, 'max_depth': 6, 'booster': 'gbtree', 'scale_pos_weight': 6.304756542366681, 'alpha': 1.8604863717654196, 'lambda': 5.560101323133988, 'eta': 0.1543920862523023, 'sampling_method': 'uniform', 'subsample': 0.5871181318687129, 'gamma': 4.495732682585467}. Best is trial 225 with value: 4.267449843322546.
[I 2023-12-19 04:36:40,275] Trial 226 finished with value: inf and parameters: {'learning_rate': 0.7866095321096618, 'aft_loss_distribution': 'normal', 'aft_loss_distribution_scale': 1.1559267670142064, 'max_depth': 6, 'booster': 'gbtree', 'scale_pos_weight': 6.323808289451187, 'alpha': 1.790718133053502, 'lambda': 5.897115234344154, 'eta': 0.15296041770551133, 'sampling_method': 'uniform', 'subsample': 0.5963050392733052, 'gamma': 4.488297280417394}. Best is trial 225 with value: 4.267449843322546.
[I 2023-12-19 04:36:41,150] Trial 227 finished with value: inf and parameters: {'learning_rate': 0.7678564001381817, 'aft_loss_distribution': 'normal', 'aft_loss_distribution_scale': 1.40328388435062, 'max_depth': 6, 'booster': 'gbtree', 'scale_pos_weight': 6.711943694629485, 'alpha': 2.154346786378029, 'lambda': 4.106772690927695, 'eta': 0.1861355092301528, 'sampling_method': 'uniform', 'subsample': 0.5637795526840139, 'gamma': 4.6395127512511465}. Best is trial 225 with value: 4.267449843322546.
[I 2023-12-19 04:36:42,917] Trial 228 finished with value: inf and parameters: {'learning_rate': 0.7943010816148968, 'aft_loss_distribution': 'normal', 'aft_loss_distribution_scale': 1.270288644816558, 'max_depth': 6, 'booster': 'gbtree', 'scale_pos_weight': 6.485215466490599, 'alpha': 1.6073208413240083, 'lambda': 5.611174415448603, 'eta': 0.1413466627624404, 'sampling_method': 'uniform', 'subsample': 0.5376881172246749, 'gamma': 4.845526150030963}. Best is trial 225 with value: 4.267449843322546.
[I 2023-12-19 04:36:43,421] Trial 229 pruned. Trial was pruned at iteration 1.
[I 2023-12-19 04:36:43,570] Trial 230 pruned. Trial was pruned at iteration 0.
[I 2023-12-19 04:36:43,736] Trial 231 pruned. Trial was pruned at iteration 1.
[I 2023-12-19 04:36:45,204] Trial 232 finished with value: inf and parameters: {'learning_rate': 0.876428827869252, 'aft_loss_distribution': 'normal', 'aft_loss_distribution_scale': 1.4004239110123513, 'max_depth': 4, 'booster': 'gbtree', 'scale_pos_weight': 6.020504118480211, 'alpha': 2.1784299290219353, 'lambda': 5.439026813178684, 'eta': 0.0909165680585807, 'sampling_method': 'uniform', 'subsample': 0.6369644049389594, 'gamma': 9.332597938128353}. Best is trial 225 with value: 4.267449843322546.
[I 2023-12-19 04:36:45,358] Trial 233 pruned. Trial was pruned at iteration 0.
[I 2023-12-19 04:36:45,529] Trial 234 pruned. Trial was pruned at iteration 0.
[I 2023-12-19 04:37:31,204] Trial 235 finished with value: 4.336350069340144 and parameters: {'learning_rate': 0.8996402395513995, 'aft_loss_distribution': 'normal', 'aft_loss_distribution_scale': 1.4972341321103713, 'max_depth': 6, 'booster': 'dart', 'scale_pos_weight': 5.400938247168747, 'alpha': 1.4987373573352307, 'lambda': 4.791006897402552, 'eta': 0.1053342208791465, 'sampling_method': 'uniform', 'subsample': 0.5614066790624374, 'gamma': 5.580036252527534}. Best is trial 225 with value: 4.267449843322546.
[I 2023-12-19 04:37:31,317] Trial 236 pruned. Trial was pruned at iteration 1.
[I 2023-12-19 04:37:38,322] Trial 237 finished with value: 4.2778012618999 and parameters: {'learning_rate': 0.9194448649978724, 'aft_loss_distribution': 'normal', 'aft_loss_distribution_scale': 1.3104892314518801, 'max_depth': 6, 'booster': 'dart', 'scale_pos_weight': 5.66787338120531, 'alpha': 1.493180714500391, 'lambda': 4.801738719484148, 'eta': 0.6052451226642858, 'sampling_method': 'uniform', 'subsample': 0.551535012243233, 'gamma': 6.040748392341696}. Best is trial 225 with value: 4.267449843322546.
[I 2023-12-19 04:37:47,014] Trial 238 finished with value: inf and parameters: {'learning_rate': 0.922616228793544, 'aft_loss_distribution': 'normal', 'aft_loss_distribution_scale': 1.331153360607767, 'max_depth': 6, 'booster': 'dart', 'scale_pos_weight': 5.631591750012369, 'alpha': 1.4734386640691202, 'lambda': 4.84306146204269, 'eta': 0.5612283725289147, 'sampling_method': 'uniform', 'subsample': 0.5894405909444836, 'gamma': 5.6814450170341475}. Best is trial 225 with value: 4.267449843322546.
[I 2023-12-19 04:37:51,253] Trial 239 finished with value: inf and parameters: {'learning_rate': 0.9532431181394954, 'aft_loss_distribution': 'normal', 'aft_loss_distribution_scale': 1.0211574540994643, 'max_depth': 6, 'booster': 'dart', 'scale_pos_weight': 5.350450439268396, 'alpha': 1.6371090025957737, 'lambda': 4.260050231324342, 'eta': 0.6241518159758119, 'sampling_method': 'uniform', 'subsample': 0.5569297328787229, 'gamma': 6.045895430820651}. Best is trial 225 with value: 4.267449843322546.
[I 2023-12-19 04:37:54,704] Trial 240 finished with value: inf and parameters: {'learning_rate': 0.909473585844071, 'aft_loss_distribution': 'normal', 'aft_loss_distribution_scale': 1.1917866589037058, 'max_depth': 6, 'booster': 'dart', 'scale_pos_weight': 6.08820417977266, 'alpha': 1.2583713568580652, 'lambda': 4.7398555091745935, 'eta': 0.6038721972589035, 'sampling_method': 'uniform', 'subsample': 0.5090866116336819, 'gamma': 5.803801545873939}. Best is trial 225 with value: 4.267449843322546.
[I 2023-12-19 04:38:22,234] Trial 241 finished with value: 4.3261004101664 and parameters: {'learning_rate': 0.8773966386301227, 'aft_loss_distribution': 'normal', 'aft_loss_distribution_scale': 1.4864233257620443, 'max_depth': 6, 'booster': 'dart', 'scale_pos_weight': 5.830414460152019, 'alpha': 2.0229938827470297, 'lambda': 5.07219500560533, 'eta': 0.634690234100753, 'sampling_method': 'uniform', 'subsample': 0.5397890195877972, 'gamma': 6.175160205856192}. Best is trial 225 with value: 4.267449843322546.
[I 2023-12-19 04:38:31,775] Trial 242 finished with value: inf and parameters: {'learning_rate': 0.8799295371633452, 'aft_loss_distribution': 'normal', 'aft_loss_distribution_scale': 1.4506995307669865, 'max_depth': 6, 'booster': 'dart', 'scale_pos_weight': 5.755582312578516, 'alpha': 2.0205448403453357, 'lambda': 4.948073623358207, 'eta': 0.6573847942485634, 'sampling_method': 'uniform', 'subsample': 0.5480406305819081, 'gamma': 6.195409002653902}. Best is trial 225 with value: 4.267449843322546.
[I 2023-12-19 04:38:31,878] Trial 243 pruned. Trial was pruned at iteration 1.
[I 2023-12-19 04:38:53,742] Trial 244 finished with value: 4.2845991234397385 and parameters: {'learning_rate': 0.8611124400475945, 'aft_loss_distribution': 'normal', 'aft_loss_distribution_scale': 1.341817711215764, 'max_depth': 6, 'booster': 'dart', 'scale_pos_weight': 5.650426102214693, 'alpha': 2.303247963827895, 'lambda': 4.556561444792181, 'eta': 0.5995040505260587, 'sampling_method': 'uniform', 'subsample': 0.5784342404353546, 'gamma': 6.149346820888333}. Best is trial 225 with value: 4.267449843322546.
[I 2023-12-19 04:39:01,170] Trial 245 finished with value: inf and parameters: {'learning_rate': 0.9308369267583937, 'aft_loss_distribution': 'normal', 'aft_loss_distribution_scale': 1.256505704214322, 'max_depth': 6, 'booster': 'dart', 'scale_pos_weight': 5.684323741891429, 'alpha': 1.5334668889367746, 'lambda': 4.501367685427162, 'eta': 0.6120205955303546, 'sampling_method': 'uniform', 'subsample': 0.5746049663982846, 'gamma': 6.164970933769693}. Best is trial 225 with value: 4.267449843322546.
[I 2023-12-19 04:39:24,131] Trial 246 finished with value: 4.299352469782052 and parameters: {'learning_rate': 0.85459558139916, 'aft_loss_distribution': 'normal', 'aft_loss_distribution_scale': 1.4129084335978679, 'max_depth': 6, 'booster': 'dart', 'scale_pos_weight': 5.901199337226499, 'alpha': 2.344878542828511, 'lambda': 4.705147905097977, 'eta': 0.5848423822177609, 'sampling_method': 'uniform', 'subsample': 0.5556266571844171, 'gamma': 6.323170199298245}. Best is trial 225 with value: 4.267449843322546.
[I 2023-12-19 04:39:31,300] Trial 247 finished with value: inf and parameters: {'learning_rate': 0.8541173694726962, 'aft_loss_distribution': 'normal', 'aft_loss_distribution_scale': 0.959822633799146, 'max_depth': 6, 'booster': 'dart', 'scale_pos_weight': 5.583204530022667, 'alpha': 2.3690547551495182, 'lambda': 4.646672148869906, 'eta': 0.57497885322604, 'sampling_method': 'uniform', 'subsample': 0.5600971785047316, 'gamma': 6.404411749130226}. Best is trial 225 with value: 4.267449843322546.
[I 2023-12-19 04:40:16,723] Trial 248 finished with value: 4.285711685332678 and parameters: {'learning_rate': 0.881388363747637, 'aft_loss_distribution': 'normal', 'aft_loss_distribution_scale': 1.370031568520004, 'max_depth': 6, 'booster': 'dart', 'scale_pos_weight': 5.841541397343466, 'alpha': 2.240498311897809, 'lambda': 4.373743374899615, 'eta': 0.5961045254519974, 'sampling_method': 'uniform', 'subsample': 0.5953514989217707, 'gamma': 5.982972778837827}. Best is trial 225 with value: 4.267449843322546.
