[I 2023-12-19 00:34:59,469] Trial 132 finished with value: 2.058735779802229 and parameters: {'learning_rate': 0.9986714783612424, 'aft_loss_distribution': 'normal', 'aft_loss_distribution_scale': 2.0980475342974625, 'max_depth': 3, 'booster': 'gbtree', 'scale_pos_weight': 0.660649198124221, 'alpha': 3.193065617639803, 'lambda': 3.2892908031074883, 'eta': 0.9627396698532577, 'sampling_method': 'gradient_based', 'subsample': 0.7686442905490853, 'gamma': 9.79513070531244}. Best is trial 120 with value: 2.0484624237262814.
[I 2023-12-19 00:34:59,742] Trial 133 finished with value: 2.0602535986015207 and parameters: {'learning_rate': 0.9992910877371539, 'aft_loss_distribution': 'normal', 'aft_loss_distribution_scale': 2.114754731462464, 'max_depth': 3, 'booster': 'gbtree', 'scale_pos_weight': 0.6485834663035122, 'alpha': 3.119364182406993, 'lambda': 3.2841797696057804, 'eta': 0.963528671667958, 'sampling_method': 'gradient_based', 'subsample': 0.766935764495565, 'gamma': 9.78607366394616}. Best is trial 120 with value: 2.0484624237262814.
[I 2023-12-19 00:34:59,940] Trial 134 finished with value: inf and parameters: {'learning_rate': 0.9546076511300399, 'aft_loss_distribution': 'normal', 'aft_loss_distribution_scale': 1.8018593763320938, 'max_depth': 3, 'booster': 'gbtree', 'scale_pos_weight': 0.6625803395287637, 'alpha': 2.9784267213604103, 'lambda': 3.2323493917632242, 'eta': 0.9657169652998718, 'sampling_method': 'gradient_based', 'subsample': 0.7697306613749472, 'gamma': 9.809611121368876}. Best is trial 120 with value: 2.0484624237262814.
[I 2023-12-19 00:35:00,202] Trial 135 finished with value: 2.0635852267012016 and parameters: {'learning_rate': 0.9969969629458163, 'aft_loss_distribution': 'normal', 'aft_loss_distribution_scale': 2.1510370664683247, 'max_depth': 3, 'booster': 'gbtree', 'scale_pos_weight': 0.708974551156052, 'alpha': 3.526251983913754, 'lambda': 2.4791461723710646, 'eta': 0.9478627275499556, 'sampling_method': 'gradient_based', 'subsample': 0.7475430642182344, 'gamma': 9.752104656433785}. Best is trial 120 with value: 2.0484624237262814.
[I 2023-12-19 00:35:00,460] Trial 136 finished with value: 2.0586224902138954 and parameters: {'learning_rate': 0.9931868092810644, 'aft_loss_distribution': 'normal', 'aft_loss_distribution_scale': 2.0963284297355966, 'max_depth': 3, 'booster': 'gbtree', 'scale_pos_weight': 1.0572237869574472, 'alpha': 3.6008371648004935, 'lambda': 2.4986340202714374, 'eta': 0.9455618719773347, 'sampling_method': 'gradient_based', 'subsample': 0.748582061239549, 'gamma': 9.777444919491346}. Best is trial 120 with value: 2.0484624237262814.
[I 2023-12-19 00:35:03,249] Trial 137 finished with value: 2.060005437596962 and parameters: {'learning_rate': 0.9982843735637875, 'aft_loss_distribution': 'normal', 'aft_loss_distribution_scale': 2.110353627645107, 'max_depth': 3, 'booster': 'dart', 'scale_pos_weight': 1.0474528618226766, 'alpha': 3.5407988938281485, 'lambda': 2.4749037990658542, 'eta': 0.9486022176992376, 'sampling_method': 'gradient_based', 'subsample': 0.7508971061573363, 'gamma': 9.717752358508056}. Best is trial 120 with value: 2.0484624237262814.
[I 2023-12-19 00:35:06,575] Trial 138 finished with value: 2.0536329560100217 and parameters: {'learning_rate': 0.9986853711094207, 'aft_loss_distribution': 'normal', 'aft_loss_distribution_scale': 2.039728047411199, 'max_depth': 3, 'booster': 'dart', 'scale_pos_weight': 1.1297384434438684, 'alpha': 3.3656818864190914, 'lambda': 2.497804926246657, 'eta': 0.94832949837809, 'sampling_method': 'gradient_based', 'subsample': 0.7851967933834054, 'gamma': 9.775828815049318}. Best is trial 120 with value: 2.0484624237262814.
[I 2023-12-19 00:35:08,230] Trial 139 finished with value: inf and parameters: {'learning_rate': 0.9217514054856859, 'aft_loss_distribution': 'normal', 'aft_loss_distribution_scale': 1.9463921443644283, 'max_depth': 3, 'booster': 'dart', 'scale_pos_weight': 1.0738912344561165, 'alpha': 3.249272004642697, 'lambda': 2.500867684223392, 'eta': 0.9488286529976472, 'sampling_method': 'gradient_based', 'subsample': 0.7846104771697705, 'gamma': 9.721120864008103}. Best is trial 120 with value: 2.0484624237262814.
[I 2023-12-19 00:35:11,086] Trial 140 finished with value: 2.0531566285363634 and parameters: {'learning_rate': 0.9517722809647917, 'aft_loss_distribution': 'normal', 'aft_loss_distribution_scale': 2.033456685035461, 'max_depth': 3, 'booster': 'dart', 'scale_pos_weight': 1.033415829462606, 'alpha': 2.2944655722053477, 'lambda': 2.173631872649315, 'eta': 0.9161991832471569, 'sampling_method': 'gradient_based', 'subsample': 0.7448506990187491, 'gamma': 9.99484262614634}. Best is trial 120 with value: 2.0484624237262814.
[I 2023-12-19 00:35:13,860] Trial 141 finished with value: 2.056947016298849 and parameters: {'learning_rate': 0.9581502777876519, 'aft_loss_distribution': 'normal', 'aft_loss_distribution_scale': 2.074873066696232, 'max_depth': 3, 'booster': 'dart', 'scale_pos_weight': 1.0835931815914988, 'alpha': 2.2004053532359196, 'lambda': 2.1463972945509817, 'eta': 0.912114408588367, 'sampling_method': 'gradient_based', 'subsample': 0.7444833833122217, 'gamma': 9.99865044406682}. Best is trial 120 with value: 2.0484624237262814.
[I 2023-12-19 00:35:15,144] Trial 142 finished with value: inf and parameters: {'learning_rate': 0.9542617410217104, 'aft_loss_distribution': 'normal', 'aft_loss_distribution_scale': 1.8195661876022593, 'max_depth': 3, 'booster': 'dart', 'scale_pos_weight': 1.0947809336013763, 'alpha': 2.389570201011517, 'lambda': 2.1635673176751054, 'eta': 0.9188312637626621, 'sampling_method': 'gradient_based', 'subsample': 0.8040045596697917, 'gamma': 9.99782616472321}. Best is trial 120 with value: 2.0484624237262814.
[I 2023-12-19 00:35:17,613] Trial 143 finished with value: inf and parameters: {'learning_rate': 0.9540156161573558, 'aft_loss_distribution': 'normal', 'aft_loss_distribution_scale': 2.06788580622387, 'max_depth': 3, 'booster': 'dart', 'scale_pos_weight': 0.9848239310809317, 'alpha': 1.333036202052974, 'lambda': 3.3840394961323716, 'eta': 0.9338831262723727, 'sampling_method': 'gradient_based', 'subsample': 0.7828391632503647, 'gamma': 9.64365637604131}. Best is trial 120 with value: 2.0484624237262814.
[I 2023-12-19 00:35:20,837] Trial 144 finished with value: 2.0337577360681336 and parameters: {'learning_rate': 0.9378631612058538, 'aft_loss_distribution': 'normal', 'aft_loss_distribution_scale': 1.7990709983954314, 'max_depth': 3, 'booster': 'dart', 'scale_pos_weight': 0.8572221058438917, 'alpha': 1.9720161869777597, 'lambda': 1.892577371509589, 'eta': 0.9821920511395674, 'sampling_method': 'gradient_based', 'subsample': 0.7347550276641803, 'gamma': 9.489429676458055}. Best is trial 144 with value: 2.0337577360681336.
[I 2023-12-19 00:35:24,030] Trial 145 finished with value: 2.037350722833387 and parameters: {'learning_rate': 0.93849765735411, 'aft_loss_distribution': 'normal', 'aft_loss_distribution_scale': 1.8474030230864424, 'max_depth': 3, 'booster': 'dart', 'scale_pos_weight': 1.144934837666338, 'alpha': 2.121354688407799, 'lambda': 1.5058225331612238, 'eta': 0.9075036955381346, 'sampling_method': 'gradient_based', 'subsample': 0.7273688404345546, 'gamma': 9.5220640761443}. Best is trial 144 with value: 2.0337577360681336.
[I 2023-12-19 00:35:25,334] Trial 146 finished with value: inf and parameters: {'learning_rate': 0.8982845822707167, 'aft_loss_distribution': 'normal', 'aft_loss_distribution_scale': 1.8763439560170412, 'max_depth': 3, 'booster': 'dart', 'scale_pos_weight': 1.2978446071629337, 'alpha': 1.9201331581536383, 'lambda': 1.3291299967295653, 'eta': 0.9124681040001386, 'sampling_method': 'gradient_based', 'subsample': 0.7300627185075949, 'gamma': 9.476205955281822}. Best is trial 144 with value: 2.0337577360681336.
[I 2023-12-19 00:35:26,621] Trial 147 finished with value: inf and parameters: {'learning_rate': 0.9363862043614459, 'aft_loss_distribution': 'normal', 'aft_loss_distribution_scale': 1.765830005297788, 'max_depth': 3, 'booster': 'dart', 'scale_pos_weight': 1.1173048405682433, 'alpha': 1.9126959011103606, 'lambda': 1.8474465605858794, 'eta': 0.9830869975091943, 'sampling_method': 'gradient_based', 'subsample': 0.825853153428461, 'gamma': 9.169319889957434}. Best is trial 144 with value: 2.0337577360681336.
[I 2023-12-19 00:35:27,956] Trial 148 finished with value: inf and parameters: {'learning_rate': 0.957832687481152, 'aft_loss_distribution': 'normal', 'aft_loss_distribution_scale': 1.2822013583532055, 'max_depth': 3, 'booster': 'dart', 'scale_pos_weight': 0.8690428705381017, 'alpha': 2.523176089075062, 'lambda': 1.5485723913874678, 'eta': 0.8987007403866505, 'sampling_method': 'gradient_based', 'subsample': 0.8496393128429606, 'gamma': 9.493079916975844}. Best is trial 144 with value: 2.0337577360681336.
[I 2023-12-19 00:35:29,265] Trial 149 finished with value: inf and parameters: {'learning_rate': 0.9262856955749302, 'aft_loss_distribution': 'normal', 'aft_loss_distribution_scale': 1.460928264490278, 'max_depth': 3, 'booster': 'dart', 'scale_pos_weight': 0.9328884369004846, 'alpha': 2.821964715139065, 'lambda': 2.081035667812801, 'eta': 0.9362718298374718, 'sampling_method': 'gradient_based', 'subsample': 0.8074602970995679, 'gamma': 9.91505138587571}. Best is trial 144 with value: 2.0337577360681336.
[I 2023-12-19 00:35:30,558] Trial 150 finished with value: inf and parameters: {'learning_rate': 0.9766130849025172, 'aft_loss_distribution': 'normal', 'aft_loss_distribution_scale': 1.9356564120004325, 'max_depth': 3, 'booster': 'dart', 'scale_pos_weight': 1.389078795682968, 'alpha': 2.1899187450506377, 'lambda': 2.6756361919975493, 'eta': 0.977124384804423, 'sampling_method': 'gradient_based', 'subsample': 0.9080001500645016, 'gamma': 9.587656652730765}. Best is trial 144 with value: 2.0337577360681336.
[I 2023-12-19 00:35:31,845] Trial 151 finished with value: inf and parameters: {'learning_rate': 0.9927074539283076, 'aft_loss_distribution': 'normal', 'aft_loss_distribution_scale': 1.680505695275537, 'max_depth': 3, 'booster': 'dart', 'scale_pos_weight': 1.1786347356808924, 'alpha': 3.244074537657377, 'lambda': 3.3088220601114164, 'eta': 0.9565501460004622, 'sampling_method': 'gradient_based', 'subsample': 0.7406266885360709, 'gamma': 9.332013666674824}. Best is trial 144 with value: 2.0337577360681336.
[I 2023-12-19 00:35:33,546] Trial 152 finished with value: inf and parameters: {'learning_rate': 0.9418866342353991, 'aft_loss_distribution': 'normal', 'aft_loss_distribution_scale': 2.0732090368892955, 'max_depth': 3, 'booster': 'dart', 'scale_pos_weight': 0.7760243356134993, 'alpha': 2.844474559907519, 'lambda': 1.9768181520680337, 'eta': 0.916427662814611, 'sampling_method': 'gradient_based', 'subsample': 0.7167833461683344, 'gamma': 9.065772063753444}. Best is trial 144 with value: 2.0337577360681336.
[I 2023-12-19 00:35:33,655] Trial 153 pruned. Trial was pruned at iteration 1.
[I 2023-12-19 00:35:35,280] Trial 154 finished with value: inf and parameters: {'learning_rate': 0.9987471912380228, 'aft_loss_distribution': 'normal', 'aft_loss_distribution_scale': 1.8530421197377864, 'max_depth': 3, 'booster': 'dart', 'scale_pos_weight': 1.4774751862586875, 'alpha': 1.5863067958899295, 'lambda': 0.9551382248613138, 'eta': 0.8977121820954014, 'sampling_method': 'gradient_based', 'subsample': 0.7172581703695144, 'gamma': 9.638730625809558}. Best is trial 144 with value: 2.0337577360681336.
[I 2023-12-19 00:35:35,374] Trial 155 pruned. Trial was pruned at iteration 0.
[I 2023-12-19 00:35:37,078] Trial 156 finished with value: inf and parameters: {'learning_rate': 0.9576874117255573, 'aft_loss_distribution': 'normal', 'aft_loss_distribution_scale': 1.5883933457217614, 'max_depth': 3, 'booster': 'dart', 'scale_pos_weight': 1.1743111702415832, 'alpha': 3.0749360359744125, 'lambda': 3.746622048458031, 'eta': 0.933251802360664, 'sampling_method': 'gradient_based', 'subsample': 0.7753484680489242, 'gamma': 9.383367945152626}. Best is trial 144 with value: 2.0337577360681336.
[I 2023-12-19 00:35:37,186] Trial 157 pruned. Trial was pruned at iteration 0.
[I 2023-12-19 00:35:38,932] Trial 158 finished with value: inf and parameters: {'learning_rate': 0.9775874690455433, 'aft_loss_distribution': 'normal', 'aft_loss_distribution_scale': 1.9400634305821916, 'max_depth': 3, 'booster': 'dart', 'scale_pos_weight': 0.8843231591331467, 'alpha': 1.7122697314766793, 'lambda': 3.49876062394017, 'eta': 0.9076982491430893, 'sampling_method': 'gradient_based', 'subsample': 0.7986255097131628, 'gamma': 9.110113867160301}. Best is trial 144 with value: 2.0337577360681336.
[I 2023-12-19 00:35:39,009] Trial 159 pruned. Trial was pruned at iteration 0.
[I 2023-12-19 00:35:41,801] Trial 160 finished with value: 2.0259220680983883 and parameters: {'learning_rate': 0.9976105470841159, 'aft_loss_distribution': 'normal', 'aft_loss_distribution_scale': 1.6780605419528756, 'max_depth': 3, 'booster': 'dart', 'scale_pos_weight': 0.9529071912120933, 'alpha': 3.718912257828867, 'lambda': 2.349717179217553, 'eta': 0.999069590190146, 'sampling_method': 'gradient_based', 'subsample': 0.8159360083255985, 'gamma': 9.398244428445311}. Best is trial 160 with value: 2.0259220680983883.
[I 2023-12-19 00:35:44,591] Trial 161 finished with value: 2.0283406081776985 and parameters: {'learning_rate': 0.9993629728945804, 'aft_loss_distribution': 'normal', 'aft_loss_distribution_scale': 1.711691437529112, 'max_depth': 3, 'booster': 'dart', 'scale_pos_weight': 0.9394181052275863, 'alpha': 3.742568343105037, 'lambda': 2.3303937951056484, 'eta': 0.9847593979565668, 'sampling_method': 'gradient_based', 'subsample': 0.8202709143950262, 'gamma': 9.429065261665505}. Best is trial 160 with value: 2.0259220680983883.
[I 2023-12-19 00:35:47,369] Trial 162 finished with value: 2.0240364545826837 and parameters: {'learning_rate': 0.9623571113824625, 'aft_loss_distribution': 'normal', 'aft_loss_distribution_scale': 1.6459869974212802, 'max_depth': 3, 'booster': 'dart', 'scale_pos_weight': 1.2750514186479136, 'alpha': 3.8035155273160193, 'lambda': 2.354269089604302, 'eta': 0.9893856120796469, 'sampling_method': 'gradient_based', 'subsample': 0.8189739383517125, 'gamma': 9.445186465848812}. Best is trial 162 with value: 2.0240364545826837.
[I 2023-12-19 00:35:48,941] Trial 163 finished with value: inf and parameters: {'learning_rate': 0.9622312176633306, 'aft_loss_distribution': 'normal', 'aft_loss_distribution_scale': 1.3979615425613048, 'max_depth': 3, 'booster': 'dart', 'scale_pos_weight': 0.9390245360436598, 'alpha': 3.8246176518946284, 'lambda': 2.286052909924758, 'eta': 0.9986593080713151, 'sampling_method': 'gradient_based', 'subsample': 0.8171099710873398, 'gamma': 9.372692981587031}. Best is trial 162 with value: 2.0240364545826837.
[I 2023-12-19 00:35:50,617] Trial 164 finished with value: inf and parameters: {'learning_rate': 0.9427266565162022, 'aft_loss_distribution': 'normal', 'aft_loss_distribution_scale': 1.6864103060669473, 'max_depth': 3, 'booster': 'dart', 'scale_pos_weight': 1.2793605772551386, 'alpha': 4.037121090137174, 'lambda': 1.991146522117468, 'eta': 0.9801907343876325, 'sampling_method': 'gradient_based', 'subsample': 0.8881422409963468, 'gamma': 9.182864671989506}. Best is trial 162 with value: 2.0240364545826837.
[I 2023-12-19 00:35:52,284] Trial 165 finished with value: inf and parameters: {'learning_rate': 0.9759995212949532, 'aft_loss_distribution': 'normal', 'aft_loss_distribution_scale': 1.7403498356129081, 'max_depth': 3, 'booster': 'dart', 'scale_pos_weight': 1.0646425855191135, 'alpha': 3.4026835993899343, 'lambda': 1.7217329495795846, 'eta': 0.8870457886843988, 'sampling_method': 'gradient_based', 'subsample': 0.8440822593907709, 'gamma': 9.480622908139265}. Best is trial 162 with value: 2.0240364545826837.
[I 2023-12-19 00:35:52,372] Trial 166 pruned. Trial was pruned at iteration 0.
[I 2023-12-19 00:35:52,438] Trial 167 pruned. Trial was pruned at iteration 0.
[I 2023-12-19 00:35:53,763] Trial 168 finished with value: inf and parameters: {'learning_rate': 0.9560080870093144, 'aft_loss_distribution': 'normal', 'aft_loss_distribution_scale': 1.828335462046344, 'max_depth': 3, 'booster': 'dart', 'scale_pos_weight': 1.211156466707827, 'alpha': 3.7868915149781914, 'lambda': 2.9129802193770855, 'eta': 0.9988454560080756, 'sampling_method': 'gradient_based', 'subsample': 0.8010463081382138, 'gamma': 8.993806353839544}. Best is trial 162 with value: 2.0240364545826837.
[I 2023-12-19 00:35:55,073] Trial 169 finished with value: inf and parameters: {'learning_rate': 0.979395364178391, 'aft_loss_distribution': 'normal', 'aft_loss_distribution_scale': 1.547903106969991, 'max_depth': 3, 'booster': 'dart', 'scale_pos_weight': 1.0093609384344107, 'alpha': 2.3300353005221313, 'lambda': 1.1341943728610975, 'eta': 0.9301208733595427, 'sampling_method': 'gradient_based', 'subsample': 0.7101834829626168, 'gamma': 9.294462030605859}. Best is trial 162 with value: 2.0240364545826837.
[I 2023-12-19 00:35:55,150] Trial 170 pruned. Trial was pruned at iteration 0.
[I 2023-12-19 00:35:56,819] Trial 171 finished with value: inf and parameters: {'learning_rate': 0.9955150201251586, 'aft_loss_distribution': 'normal', 'aft_loss_distribution_scale': 2.0212056591308545, 'max_depth': 3, 'booster': 'dart', 'scale_pos_weight': 0.7937004979779014, 'alpha': 3.465661363089176, 'lambda': 2.2945127348253562, 'eta': 0.9688127048820971, 'sampling_method': 'gradient_based', 'subsample': 0.7726637130220806, 'gamma': 9.704005458254473}. Best is trial 162 with value: 2.0240364545826837.
[I 2023-12-19 00:35:56,899] Trial 172 pruned. Trial was pruned at iteration 1.
[I 2023-12-19 00:35:59,627] Trial 173 finished with value: 2.0468628379509552 and parameters: {'learning_rate': 0.9600085847413579, 'aft_loss_distribution': 'normal', 'aft_loss_distribution_scale': 1.9610573872116313, 'max_depth': 3, 'booster': 'dart', 'scale_pos_weight': 1.0420954495778665, 'alpha': 3.7013158828928656, 'lambda': 2.713963045459707, 'eta': 0.9767351399528748, 'sampling_method': 'gradient_based', 'subsample': 0.7934866126369332, 'gamma': 9.550601424764949}. Best is trial 162 with value: 2.0240364545826837.
[I 2023-12-19 00:36:00,916] Trial 174 finished with value: inf and parameters: {'learning_rate': 0.9598650511174955, 'aft_loss_distribution': 'normal', 'aft_loss_distribution_scale': 1.366245576935354, 'max_depth': 3, 'booster': 'dart', 'scale_pos_weight': 1.0670437358367866, 'alpha': 3.750579266675836, 'lambda': 2.751094888409669, 'eta': 0.9448627765158528, 'sampling_method': 'gradient_based', 'subsample': 0.7391827388234353, 'gamma': 9.489413666084973}. Best is trial 162 with value: 2.0240364545826837.
[I 2023-12-19 00:36:00,986] Trial 175 pruned. Trial was pruned at iteration 0.
[I 2023-12-19 00:36:04,185] Trial 176 finished with value: 2.0455540193336783 and parameters: {'learning_rate': 0.9635717501774514, 'aft_loss_distribution': 'normal', 'aft_loss_distribution_scale': 1.9459286395521362, 'max_depth': 3, 'booster': 'dart', 'scale_pos_weight': 1.2262135610067124, 'alpha': 4.137011192812739, 'lambda': 2.1754538458456776, 'eta': 0.8839224525625751, 'sampling_method': 'gradient_based', 'subsample': 0.7927082866338891, 'gamma': 9.611933676723984}. Best is trial 162 with value: 2.0240364545826837.
[I 2023-12-19 00:36:07,558] Trial 177 finished with value: 2.0431005755638223 and parameters: {'learning_rate': 0.9673832063947971, 'aft_loss_distribution': 'normal', 'aft_loss_distribution_scale': 1.9166100313738161, 'max_depth': 3, 'booster': 'dart', 'scale_pos_weight': 1.2539284006636973, 'alpha': 4.161556209040128, 'lambda': 2.1188107178282913, 'eta': 0.114374678940111, 'sampling_method': 'gradient_based', 'subsample': 0.7935847889725266, 'gamma': 9.568412379918891}. Best is trial 162 with value: 2.0240364545826837.
[I 2023-12-19 00:36:10,341] Trial 178 finished with value: 2.045418042301092 and parameters: {'learning_rate': 0.9488351153255214, 'aft_loss_distribution': 'normal', 'aft_loss_distribution_scale': 1.939498555907826, 'max_depth': 3, 'booster': 'dart', 'scale_pos_weight': 1.4234749786815688, 'alpha': 4.163793229496084, 'lambda': 1.9405551420804121, 'eta': 0.8697786713947054, 'sampling_method': 'gradient_based', 'subsample': 0.7968526361230495, 'gamma': 9.349964498947527}. Best is trial 162 with value: 2.0240364545826837.
[I 2023-12-19 00:36:10,411] Trial 179 pruned. Trial was pruned at iteration 0.
[I 2023-12-19 00:36:10,487] Trial 180 pruned. Trial was pruned at iteration 0.
[I 2023-12-19 00:36:13,253] Trial 181 finished with value: 2.0492238711134285 and parameters: {'learning_rate': 0.9628137425507151, 'aft_loss_distribution': 'normal', 'aft_loss_distribution_scale': 1.989835550981347, 'max_depth': 3, 'booster': 'dart', 'scale_pos_weight': 1.3617024615383386, 'alpha': 4.217373649406298, 'lambda': 1.6585806292399319, 'eta': 0.8911621116093102, 'sampling_method': 'gradient_based', 'subsample': 0.8100607033552706, 'gamma': 9.479764688308425}. Best is trial 162 with value: 2.0240364545826837.
[I 2023-12-19 00:36:16,169] Trial 182 finished with value: 2.0433914396182957 and parameters: {'learning_rate': 0.9496248351280444, 'aft_loss_distribution': 'normal', 'aft_loss_distribution_scale': 1.9184867321559924, 'max_depth': 3, 'booster': 'dart', 'scale_pos_weight': 1.4587465282243621, 'alpha': 3.8868482755910305, 'lambda': 1.6061835069804582, 'eta': 0.9284558205279838, 'sampling_method': 'gradient_based', 'subsample': 0.8155862490976717, 'gamma': 9.554722046404393}. Best is trial 162 with value: 2.0240364545826837.
