[I 2023-12-19 00:41:51,471] Trial 26 finished with value: inf and parameters: {'learning_rate': 0.6030859616763857, 'aft_loss_distribution': 'normal', 'aft_loss_distribution_scale': 4.489249996776879, 'max_depth': 9, 'booster': 'gbtree', 'scale_pos_weight': 1.6025393297458566, 'alpha': 9.976682398279596, 'lambda': 0.07723446980972071, 'eta': 0.8178950458440045, 'sampling_method': 'gradient_based', 'subsample': 0.7545724199631177, 'gamma': 5.280410291703319}. Best is trial 24 with value: 2.2400618577588425.
[I 2023-12-19 00:41:51,664] Trial 27 finished with value: inf and parameters: {'learning_rate': 0.5630520702432836, 'aft_loss_distribution': 'normal', 'aft_loss_distribution_scale': 2.0498032440735137, 'max_depth': 9, 'booster': 'gbtree', 'scale_pos_weight': 1.2128201889971535, 'alpha': 9.182995940264846, 'lambda': 1.244902968408169, 'eta': 0.9775355228756085, 'sampling_method': 'gradient_based', 'subsample': 0.34789768417602585, 'gamma': 6.984656430174953}. Best is trial 24 with value: 2.2400618577588425.
[I 2023-12-19 00:41:51,912] Trial 28 finished with value: 2.1686975721802044 and parameters: {'learning_rate': 0.7087884250640282, 'aft_loss_distribution': 'normal', 'aft_loss_distribution_scale': 3.396142258597135, 'max_depth': 10, 'booster': 'gbtree', 'scale_pos_weight': 1.9485640281855605, 'alpha': 7.978858388891292, 'lambda': 1.7087641784431737, 'eta': 0.8065462860455074, 'sampling_method': 'gradient_based', 'subsample': 0.5163078896323698, 'gamma': 8.983689315805504}. Best is trial 28 with value: 2.1686975721802044.
[I 2023-12-19 00:41:52,397] Trial 29 finished with value: 2.170011109416924 and parameters: {'learning_rate': 0.6967743148120749, 'aft_loss_distribution': 'normal', 'aft_loss_distribution_scale': 3.437955228094557, 'max_depth': 10, 'booster': 'gbtree', 'scale_pos_weight': 1.5239912324046665, 'alpha': 8.763038872879786, 'lambda': 2.032848296519626, 'eta': 0.6193325166559767, 'sampling_method': 'gradient_based', 'subsample': 0.38500044520357946, 'gamma': 8.951481026849214}. Best is trial 28 with value: 2.1686975721802044.
[I 2023-12-19 00:41:53,267] Trial 30 finished with value: 2.1852671390287717 and parameters: {'learning_rate': 0.6969828385034689, 'aft_loss_distribution': 'normal', 'aft_loss_distribution_scale': 3.624605108023463, 'max_depth': 10, 'booster': 'gbtree', 'scale_pos_weight': 0.9853128156238451, 'alpha': 7.995844252586841, 'lambda': 1.803467070917725, 'eta': 0.6222160057404066, 'sampling_method': 'gradient_based', 'subsample': 0.3802216812648601, 'gamma': 8.58686359113362}. Best is trial 28 with value: 2.1686975721802044.
[I 2023-12-19 00:41:53,520] Trial 31 finished with value: 2.1776857773515186 and parameters: {'learning_rate': 0.7027437535428396, 'aft_loss_distribution': 'normal', 'aft_loss_distribution_scale': 3.5367913747618087, 'max_depth': 10, 'booster': 'gbtree', 'scale_pos_weight': 1.6506284471883084, 'alpha': 7.8576814057555895, 'lambda': 2.0026325477012055, 'eta': 0.6421415098942469, 'sampling_method': 'gradient_based', 'subsample': 0.3816590335552571, 'gamma': 8.528655030211553}. Best is trial 28 with value: 2.1686975721802044.
[I 2023-12-19 00:41:53,753] Trial 32 finished with value: 2.1515261601262186 and parameters: {'learning_rate': 0.6982069100036697, 'aft_loss_distribution': 'normal', 'aft_loss_distribution_scale': 3.2395272710668586, 'max_depth': 10, 'booster': 'gbtree', 'scale_pos_weight': 1.034425961905391, 'alpha': 7.844705681590753, 'lambda': 2.662542016894432, 'eta': 0.6242682616203715, 'sampling_method': 'gradient_based', 'subsample': 0.38543871386111744, 'gamma': 9.008508838800376}. Best is trial 32 with value: 2.1515261601262186.
[I 2023-12-19 00:41:53,983] Trial 33 finished with value: inf and parameters: {'learning_rate': 0.7014403691188923, 'aft_loss_distribution': 'normal', 'aft_loss_distribution_scale': 3.122758397450368, 'max_depth': 10, 'booster': 'gbtree', 'scale_pos_weight': 1.6767448453320615, 'alpha': 7.652153018849604, 'lambda': 2.730409331978163, 'eta': 0.6841933656661573, 'sampling_method': 'gradient_based', 'subsample': 0.18021712987402455, 'gamma': 9.042428886196411}. Best is trial 32 with value: 2.1515261601262186.
[I 2023-12-19 00:41:54,209] Trial 34 finished with value: 2.0090655781406137 and parameters: {'learning_rate': 0.8222352707284943, 'aft_loss_distribution': 'normal', 'aft_loss_distribution_scale': 1.7698219762429626, 'max_depth': 10, 'booster': 'gbtree', 'scale_pos_weight': 1.4508926601274712, 'alpha': 6.8386315341872015, 'lambda': 1.9308595418906511, 'eta': 0.5747644280095237, 'sampling_method': 'gradient_based', 'subsample': 0.405946251574297, 'gamma': 9.812136628324495}. Best is trial 34 with value: 2.0090655781406137.
[I 2023-12-19 00:41:54,415] Trial 35 finished with value: inf and parameters: {'learning_rate': 0.806535361035262, 'aft_loss_distribution': 'normal', 'aft_loss_distribution_scale': 1.6733224096802186, 'max_depth': 10, 'booster': 'gbtree', 'scale_pos_weight': 0.5705611462500568, 'alpha': 6.397187598430155, 'lambda': 2.613395291800328, 'eta': 0.5567023972029616, 'sampling_method': 'gradient_based', 'subsample': 0.4923700712821417, 'gamma': 9.970657224354014}. Best is trial 34 with value: 2.0090655781406137.
[I 2023-12-19 00:41:54,616] Trial 36 finished with value: inf and parameters: {'learning_rate': 0.9119961126920328, 'aft_loss_distribution': 'normal', 'aft_loss_distribution_scale': 1.2968901916088493, 'max_depth': 8, 'booster': 'gbtree', 'scale_pos_weight': 1.0479614796345758, 'alpha': 6.783066883750079, 'lambda': 1.6707672467552728, 'eta': 0.39109749008717865, 'sampling_method': 'gradient_based', 'subsample': 0.4186704934844123, 'gamma': 9.51974343792684}. Best is trial 34 with value: 2.0090655781406137.
[I 2023-12-19 00:41:54,687] Trial 37 pruned. Trial was pruned at iteration 2.
[I 2023-12-19 00:41:54,743] Trial 38 pruned. Trial was pruned at iteration 0.
[I 2023-12-19 00:41:54,992] Trial 39 finished with value: inf and parameters: {'learning_rate': 0.9777452680033214, 'aft_loss_distribution': 'normal', 'aft_loss_distribution_scale': 1.911679064462694, 'max_depth': 8, 'booster': 'gbtree', 'scale_pos_weight': 0.5526664928243312, 'alpha': 6.840297914079642, 'lambda': 2.995481356449316, 'eta': 0.5502287683178035, 'sampling_method': 'gradient_based', 'subsample': 0.17914303402764314, 'gamma': 9.949918660380758}. Best is trial 34 with value: 2.0090655781406137.
[I 2023-12-19 00:41:55,260] Trial 40 finished with value: 2.1498185430539962 and parameters: {'learning_rate': 0.6657413103620087, 'aft_loss_distribution': 'normal', 'aft_loss_distribution_scale': 3.2143299350999177, 'max_depth': 9, 'booster': 'gbtree', 'scale_pos_weight': 0.9139178931248171, 'alpha': 5.985430312455662, 'lambda': 0.37358521854864324, 'eta': 0.7256795003627697, 'sampling_method': 'gradient_based', 'subsample': 0.3224351305470189, 'gamma': 7.332167666138787}. Best is trial 34 with value: 2.0090655781406137.
[I 2023-12-19 00:41:55,575] Trial 41 finished with value: 2.1277993025196937 and parameters: {'learning_rate': 0.6632328807932931, 'aft_loss_distribution': 'normal', 'aft_loss_distribution_scale': 2.992408999314402, 'max_depth': 9, 'booster': 'gbtree', 'scale_pos_weight': 0.8860246184675827, 'alpha': 5.039013129351165, 'lambda': 0.5432654976633333, 'eta': 0.7309565030672145, 'sampling_method': 'gradient_based', 'subsample': 0.31744435762708983, 'gamma': 7.307945975540058}. Best is trial 34 with value: 2.0090655781406137.
[I 2023-12-19 00:41:55,640] Trial 42 pruned. Trial was pruned at iteration 0.
[I 2023-12-19 00:41:55,703] Trial 43 pruned. Trial was pruned at iteration 0.
[I 2023-12-19 00:41:55,771] Trial 44 pruned. Trial was pruned at iteration 0.
[I 2023-12-19 00:41:55,828] Trial 45 pruned. Trial was pruned at iteration 0.
[I 2023-12-19 00:41:56,074] Trial 46 finished with value: inf and parameters: {'learning_rate': 0.7460682986438487, 'aft_loss_distribution': 'normal', 'aft_loss_distribution_scale': 2.8720774103178104, 'max_depth': 10, 'booster': 'gbtree', 'scale_pos_weight': 0.7136501206286365, 'alpha': 3.318100969863636, 'lambda': 0.513653091000144, 'eta': 0.6592561992440261, 'sampling_method': 'gradient_based', 'subsample': 0.21631818619596122, 'gamma': 9.519331274662857}. Best is trial 34 with value: 2.0090655781406137.
[I 2023-12-19 00:41:56,141] Trial 47 pruned. Trial was pruned at iteration 0.
[I 2023-12-19 00:41:56,219] Trial 48 pruned. Trial was pruned at iteration 0.
[I 2023-12-19 00:41:56,309] Trial 49 pruned. Trial was pruned at iteration 0.
[I 2023-12-19 00:41:56,847] Trial 50 finished with value: 2.1488835351032427 and parameters: {'learning_rate': 0.8009169821892621, 'aft_loss_distribution': 'normal', 'aft_loss_distribution_scale': 3.1991284857345827, 'max_depth': 10, 'booster': 'gbtree', 'scale_pos_weight': 1.9085269921745422, 'alpha': 6.409931334212256, 'lambda': 0.3825642075829776, 'eta': 0.49442112351797346, 'sampling_method': 'gradient_based', 'subsample': 0.4880185138476876, 'gamma': 7.761110621182844}. Best is trial 34 with value: 2.0090655781406137.
[I 2023-12-19 00:41:57,516] Trial 51 finished with value: 2.1468619705813223 and parameters: {'learning_rate': 0.7991593381192388, 'aft_loss_distribution': 'normal', 'aft_loss_distribution_scale': 3.191527830136675, 'max_depth': 10, 'booster': 'gbtree', 'scale_pos_weight': 2.3137038140032895, 'alpha': 6.414365029843337, 'lambda': 0.5171115791996286, 'eta': 0.4919857631369797, 'sampling_method': 'gradient_based', 'subsample': 0.5113990837769897, 'gamma': 7.6889350759065795}. Best is trial 34 with value: 2.0090655781406137.
[I 2023-12-19 00:41:58,245] Trial 52 finished with value: 2.098747222414184 and parameters: {'learning_rate': 0.8197558790479478, 'aft_loss_distribution': 'normal', 'aft_loss_distribution_scale': 2.6952429242935616, 'max_depth': 10, 'booster': 'gbtree', 'scale_pos_weight': 2.304742844440939, 'alpha': 6.295007513590729, 'lambda': 0.38632561506282537, 'eta': 0.5186166014997408, 'sampling_method': 'gradient_based', 'subsample': 0.4596426113388409, 'gamma': 7.786826290289353}. Best is trial 34 with value: 2.0090655781406137.
[I 2023-12-19 00:41:59,425] Trial 53 finished with value: 2.0917127414482772 and parameters: {'learning_rate': 0.8119140414288737, 'aft_loss_distribution': 'normal', 'aft_loss_distribution_scale': 2.645179011025041, 'max_depth': 10, 'booster': 'gbtree', 'scale_pos_weight': 2.7916490216517893, 'alpha': 4.428343359904936, 'lambda': 0.28620676975747217, 'eta': 0.5179352538507761, 'sampling_method': 'gradient_based', 'subsample': 0.4505888863407961, 'gamma': 7.384840847748023}. Best is trial 34 with value: 2.0090655781406137.
[I 2023-12-19 00:42:24,001] Trial 54 finished with value: 2.0910063085992276 and parameters: {'learning_rate': 0.9377329067540163, 'aft_loss_distribution': 'normal', 'aft_loss_distribution_scale': 2.6310087532382678, 'max_depth': 10, 'booster': 'dart', 'scale_pos_weight': 2.768145108179511, 'alpha': 6.465056142572289, 'lambda': 0.3013002851115504, 'eta': 0.5196716758717408, 'sampling_method': 'gradient_based', 'subsample': 0.45306700892893875, 'gamma': 7.930753972283378}. Best is trial 34 with value: 2.0090655781406137.
[I 2023-12-19 00:42:24,070] Trial 55 pruned. Trial was pruned at iteration 0.
[I 2023-12-19 00:42:44,654] Trial 56 pruned. Trial was pruned at iteration 209.
[I 2023-12-19 00:42:47,799] Trial 57 finished with value: 2.03302179337407 and parameters: {'learning_rate': 0.9459047969942542, 'aft_loss_distribution': 'normal', 'aft_loss_distribution_scale': 2.0444966173766765, 'max_depth': 10, 'booster': 'dart', 'scale_pos_weight': 2.49669483644246, 'alpha': 4.655332298516528, 'lambda': 1.2167152410539233, 'eta': 0.5219967378760952, 'sampling_method': 'gradient_based', 'subsample': 0.6216073411872182, 'gamma': 7.86817957581474}. Best is trial 34 with value: 2.0090655781406137.
[I 2023-12-19 00:42:49,095] Trial 58 finished with value: inf and parameters: {'learning_rate': 0.9977225814242777, 'aft_loss_distribution': 'normal', 'aft_loss_distribution_scale': 1.0244894624418848, 'max_depth': 9, 'booster': 'dart', 'scale_pos_weight': 2.533361528187357, 'alpha': 2.6831170202256125, 'lambda': 1.3571959350039102, 'eta': 0.4556375360677943, 'sampling_method': 'gradient_based', 'subsample': 0.4706040705556732, 'gamma': 8.33809886955852}. Best is trial 34 with value: 2.0090655781406137.
[I 2023-12-19 00:42:52,497] Trial 59 finished with value: 2.034576952393036 and parameters: {'learning_rate': 0.9617068994442208, 'aft_loss_distribution': 'normal', 'aft_loss_distribution_scale': 2.090507489202796, 'max_depth': 10, 'booster': 'dart', 'scale_pos_weight': 2.856409640301802, 'alpha': 5.320084670080693, 'lambda': 9.996842361673295, 'eta': 0.5358451985760991, 'sampling_method': 'gradient_based', 'subsample': 0.6235834832853047, 'gamma': 7.1581564238094035}. Best is trial 34 with value: 2.0090655781406137.
[I 2023-12-19 00:42:52,564] Trial 60 pruned. Trial was pruned at iteration 0.
[I 2023-12-19 00:42:55,295] Trial 61 finished with value: 2.084175597353174 and parameters: {'learning_rate': 0.9299143942247174, 'aft_loss_distribution': 'normal', 'aft_loss_distribution_scale': 2.562482708878182, 'max_depth': 10, 'booster': 'dart', 'scale_pos_weight': 3.1136554383740283, 'alpha': 5.273449556833339, 'lambda': 6.8776388033768585, 'eta': 0.5690728656028523, 'sampling_method': 'gradient_based', 'subsample': 0.6016827158969895, 'gamma': 7.156209774061914}. Best is trial 34 with value: 2.0090655781406137.
[I 2023-12-19 00:42:58,573] Trial 62 finished with value: 2.0799183153470153 and parameters: {'learning_rate': 0.9327565746191548, 'aft_loss_distribution': 'normal', 'aft_loss_distribution_scale': 2.477633184585638, 'max_depth': 10, 'booster': 'dart', 'scale_pos_weight': 3.1737142050815295, 'alpha': 5.44569234070117, 'lambda': 7.041262778045581, 'eta': 0.580439092344632, 'sampling_method': 'gradient_based', 'subsample': 0.6080505621791035, 'gamma': 7.795631353564583}. Best is trial 34 with value: 2.0090655781406137.
[I 2023-12-19 00:43:09,303] Trial 63 finished with value: 2.076546266701662 and parameters: {'learning_rate': 0.9366597582106413, 'aft_loss_distribution': 'normal', 'aft_loss_distribution_scale': 2.500622854319733, 'max_depth': 10, 'booster': 'dart', 'scale_pos_weight': 3.3049977485547224, 'alpha': 5.545146937178878, 'lambda': 7.993907473649879, 'eta': 0.5777748644772075, 'sampling_method': 'gradient_based', 'subsample': 0.6024421434176465, 'gamma': 6.672918467346086}. Best is trial 34 with value: 2.0090655781406137.
[I 2023-12-19 00:43:09,372] Trial 64 pruned. Trial was pruned at iteration 0.
[I 2023-12-19 00:43:24,885] Trial 65 finished with value: 1.988448559156196 and parameters: {'learning_rate': 0.8847865403038703, 'aft_loss_distribution': 'normal', 'aft_loss_distribution_scale': 1.3823924103763243, 'max_depth': 9, 'booster': 'dart', 'scale_pos_weight': 3.599895989602455, 'alpha': 5.78448705425798, 'lambda': 6.658305286676956, 'eta': 0.4450163218375143, 'sampling_method': 'gradient_based', 'subsample': 0.6089799933006985, 'gamma': 6.639218116436313}. Best is trial 65 with value: 1.988448559156196.
[I 2023-12-19 00:43:24,950] Trial 66 pruned. Trial was pruned at iteration 0.
[I 2023-12-19 00:43:28,000] Trial 67 finished with value: inf and parameters: {'learning_rate': 0.9834784892328837, 'aft_loss_distribution': 'normal', 'aft_loss_distribution_scale': 1.9648071656321846, 'max_depth': 7, 'booster': 'dart', 'scale_pos_weight': 2.997247123473038, 'alpha': 3.994107709070141, 'lambda': 7.093021054776558, 'eta': 0.5919838335368846, 'sampling_method': 'gradient_based', 'subsample': 0.6749659747720056, 'gamma': 6.996647661394789}. Best is trial 65 with value: 1.988448559156196.
[I 2023-12-19 00:43:28,116] Trial 68 pruned. Trial was pruned at iteration 0.
[I 2023-12-19 00:43:28,217] Trial 69 pruned. Trial was pruned at iteration 0.
[I 2023-12-19 00:43:28,305] Trial 70 pruned. Trial was pruned at iteration 0.
[I 2023-12-19 00:43:29,996] Trial 71 finished with value: inf and parameters: {'learning_rate': 0.9425654429883501, 'aft_loss_distribution': 'normal', 'aft_loss_distribution_scale': 1.2109566257303372, 'max_depth': 10, 'booster': 'dart', 'scale_pos_weight': 3.122958844283855, 'alpha': 6.633387666755485, 'lambda': 7.445817520969157, 'eta': 0.5601027221951992, 'sampling_method': 'gradient_based', 'subsample': 0.6701149458032184, 'gamma': 7.985615562174327}. Best is trial 65 with value: 1.988448559156196.
[I 2023-12-19 00:43:32,106] Trial 72 finished with value: inf and parameters: {'learning_rate': 0.9192751724423055, 'aft_loss_distribution': 'normal', 'aft_loss_distribution_scale': 1.8339475053877397, 'max_depth': 10, 'booster': 'dart', 'scale_pos_weight': 3.4828357384221826, 'alpha': 6.96639198077826, 'lambda': 5.869210825865937, 'eta': 0.5312987168233331, 'sampling_method': 'gradient_based', 'subsample': 0.5940516213658856, 'gamma': 5.942070359277675}. Best is trial 65 with value: 1.988448559156196.
[I 2023-12-19 00:43:34,946] Trial 73 finished with value: 2.0686707830016875 and parameters: {'learning_rate': 0.9512708446807364, 'aft_loss_distribution': 'normal', 'aft_loss_distribution_scale': 2.390586980959547, 'max_depth': 10, 'booster': 'dart', 'scale_pos_weight': 3.3779599798268123, 'alpha': 5.489251138295374, 'lambda': 6.870754730511263, 'eta': 0.649952107299299, 'sampling_method': 'gradient_based', 'subsample': 0.567054582523025, 'gamma': 8.38349960490207}. Best is trial 65 with value: 1.988448559156196.
[I 2023-12-19 00:43:37,004] Trial 74 finished with value: inf and parameters: {'learning_rate': 0.9640315206186747, 'aft_loss_distribution': 'normal', 'aft_loss_distribution_scale': 2.253887924210375, 'max_depth': 9, 'booster': 'dart', 'scale_pos_weight': 3.369159023020867, 'alpha': 5.421151828945069, 'lambda': 6.960903729845121, 'eta': 0.6710808962674419, 'sampling_method': 'gradient_based', 'subsample': 0.5448706310960667, 'gamma': 8.727521558926124}. Best is trial 65 with value: 1.988448559156196.
[I 2023-12-19 00:43:38,369] Trial 75 finished with value: inf and parameters: {'learning_rate': 0.9979821489051264, 'aft_loss_distribution': 'normal', 'aft_loss_distribution_scale': 2.3551896274923654, 'max_depth': 10, 'booster': 'dart', 'scale_pos_weight': 2.9193552009134778, 'alpha': 4.647040681785283, 'lambda': 5.480619787666443, 'eta': 0.6038188634721672, 'sampling_method': 'gradient_based', 'subsample': 0.6542938443934442, 'gamma': 7.07504274487808}. Best is trial 65 with value: 1.988448559156196.
[I 2023-12-19 00:43:40,677] Trial 76 finished with value: inf and parameters: {'learning_rate': 0.9073508337745193, 'aft_loss_distribution': 'normal', 'aft_loss_distribution_scale': 1.3999286089667673, 'max_depth': 10, 'booster': 'dart', 'scale_pos_weight': 3.593578547872999, 'alpha': 5.110567116018836, 'lambda': 9.993373002043313, 'eta': 0.6456696650491653, 'sampling_method': 'uniform', 'subsample': 0.583172411125772, 'gamma': 8.316129682099634}. Best is trial 65 with value: 1.988448559156196.
[I 2023-12-19 00:43:44,186] Trial 77 finished with value: 2.013754884144295 and parameters: {'learning_rate': 0.8632115739381561, 'aft_loss_distribution': 'normal', 'aft_loss_distribution_scale': 1.8450102999235254, 'max_depth': 9, 'booster': 'dart', 'scale_pos_weight': 3.0947168272288503, 'alpha': 3.934399992693903, 'lambda': 7.5962090898355195, 'eta': 0.5588785833921894, 'sampling_method': 'gradient_based', 'subsample': 0.7085883644400983, 'gamma': 7.593619280365218}. Best is trial 65 with value: 1.988448559156196.
[I 2023-12-19 00:43:45,621] Trial 78 finished with value: inf and parameters: {'learning_rate': 0.8707451911048149, 'aft_loss_distribution': 'normal', 'aft_loss_distribution_scale': 1.7578467366772195, 'max_depth': 8, 'booster': 'dart', 'scale_pos_weight': 2.624371842940463, 'alpha': 3.760649461580414, 'lambda': 7.696710201174573, 'eta': 0.477741263923945, 'sampling_method': 'gradient_based', 'subsample': 0.8127764687747884, 'gamma': 8.334016885033343}. Best is trial 65 with value: 1.988448559156196.
[I 2023-12-19 00:43:45,691] Trial 79 pruned. Trial was pruned at iteration 0.
[I 2023-12-19 00:43:45,754] Trial 80 pruned. Trial was pruned at iteration 0.
[I 2023-12-19 00:43:48,544] Trial 81 finished with value: 2.0771796532359637 and parameters: {'learning_rate': 0.892608221367909, 'aft_loss_distribution': 'normal', 'aft_loss_distribution_scale': 2.457107219642135, 'max_depth': 10, 'booster': 'dart', 'scale_pos_weight': 3.1060624110383714, 'alpha': 5.757250269857337, 'lambda': 6.633387689948828, 'eta': 0.5744837874171915, 'sampling_method': 'gradient_based', 'subsample': 0.625357198759953, 'gamma': 6.704474846720469}. Best is trial 65 with value: 1.988448559156196.
[I 2023-12-19 00:44:03,999] Trial 82 finished with value: 2.008479918011722 and parameters: {'learning_rate': 0.9572466542686098, 'aft_loss_distribution': 'normal', 'aft_loss_distribution_scale': 1.769637924018575, 'max_depth': 10, 'booster': 'dart', 'scale_pos_weight': 3.0308032039099837, 'alpha': 5.648430005944485, 'lambda': 6.713951420759903, 'eta': 0.6313154858560266, 'sampling_method': 'gradient_based', 'subsample': 0.6352703376858949, 'gamma': 6.609146626246649}. Best is trial 65 with value: 1.988448559156196.
[I 2023-12-19 00:44:06,795] Trial 83 finished with value: 1.9961447838368345 and parameters: {'learning_rate': 0.8894864393873699, 'aft_loss_distribution': 'normal', 'aft_loss_distribution_scale': 1.254235954608734, 'max_depth': 10, 'booster': 'dart', 'scale_pos_weight': 3.0583817522550625, 'alpha': 5.689572974617512, 'lambda': 6.677765910148918, 'eta': 0.638662041347365, 'sampling_method': 'gradient_based', 'subsample': 0.6373246962831693, 'gamma': 6.5824434900044375}. Best is trial 65 with value: 1.988448559156196.
[I 2023-12-19 00:44:06,880] Trial 84 pruned. Trial was pruned at iteration 0.
