[I 2023-12-18 23:03:08,629] Trial 280 finished with value: 4.266312059125936 and parameters: {'learning_rate': 0.8622607402534281, 'aft_loss_distribution': 'normal', 'aft_loss_distribution_scale': 1.0796787027339811, 'max_depth': 6, 'booster': 'dart', 'scale_pos_weight': 2.2086551301009347, 'alpha': 6.575529642101959, 'lambda': 0.8412012571351308, 'eta': 0.7914662538081528, 'sampling_method': 'uniform', 'subsample': 0.7818567929588696, 'gamma': 9.73075799432919}. Best is trial 280 with value: 4.266312059125936.
[I 2023-12-18 23:03:15,515] Trial 281 finished with value: 4.266305817846128 and parameters: {'learning_rate': 0.8728716956934596, 'aft_loss_distribution': 'normal', 'aft_loss_distribution_scale': 1.0459060015073025, 'max_depth': 6, 'booster': 'dart', 'scale_pos_weight': 2.0878677737206472, 'alpha': 6.289982645542635, 'lambda': 0.8936060892734415, 'eta': 0.8172064228014287, 'sampling_method': 'uniform', 'subsample': 0.76243438163471, 'gamma': 9.741286257926294}. Best is trial 281 with value: 4.266305817846128.
[I 2023-12-18 23:03:15,610] Trial 282 pruned. Trial was pruned at iteration 0.
[I 2023-12-18 23:03:15,684] Trial 283 pruned. Trial was pruned at iteration 0.
[I 2023-12-18 23:03:17,667] Trial 284 finished with value: inf and parameters: {'learning_rate': 0.8521163841721832, 'aft_loss_distribution': 'normal', 'aft_loss_distribution_scale': 1.0132947974170088, 'max_depth': 6, 'booster': 'dart', 'scale_pos_weight': 2.1008260714294473, 'alpha': 6.609851049120234, 'lambda': 1.1266043539658948, 'eta': 0.8136428100816229, 'sampling_method': 'uniform', 'subsample': 0.7997046546854351, 'gamma': 9.64081174353431}. Best is trial 281 with value: 4.266305817846128.
[I 2023-12-18 23:03:20,503] Trial 285 finished with value: 4.265179430481361 and parameters: {'learning_rate': 0.9342224068307663, 'aft_loss_distribution': 'normal', 'aft_loss_distribution_scale': 1.0511636638012265, 'max_depth': 6, 'booster': 'dart', 'scale_pos_weight': 1.9535884678508664, 'alpha': 6.377737481923425, 'lambda': 0.5765519435267135, 'eta': 0.8547470359488355, 'sampling_method': 'uniform', 'subsample': 0.8246385293316265, 'gamma': 9.547170396063859}. Best is trial 285 with value: 4.265179430481361.
[I 2023-12-18 23:03:20,636] Trial 286 pruned. Trial was pruned at iteration 1.
[I 2023-12-18 23:03:22,584] Trial 287 finished with value: inf and parameters: {'learning_rate': 0.9164358057724744, 'aft_loss_distribution': 'normal', 'aft_loss_distribution_scale': 1.05200353438599, 'max_depth': 6, 'booster': 'dart', 'scale_pos_weight': 1.9812688404839132, 'alpha': 6.606000552456356, 'lambda': 0.6179340962064588, 'eta': 0.8380862861339445, 'sampling_method': 'uniform', 'subsample': 0.764363981920976, 'gamma': 8.992970764640054}. Best is trial 285 with value: 4.265179430481361.
[I 2023-12-18 23:03:22,694] Trial 288 pruned. Trial was pruned at iteration 0.
[I 2023-12-18 23:03:22,807] Trial 289 pruned. Trial was pruned at iteration 0.
[I 2023-12-18 23:03:22,928] Trial 290 pruned. Trial was pruned at iteration 0.
[I 2023-12-18 23:03:23,047] Trial 291 pruned. Trial was pruned at iteration 0.
[I 2023-12-18 23:03:26,502] Trial 292 finished with value: 4.26812526414314 and parameters: {'learning_rate': 0.9532883095569429, 'aft_loss_distribution': 'normal', 'aft_loss_distribution_scale': 1.1037889624783697, 'max_depth': 6, 'booster': 'dart', 'scale_pos_weight': 1.322830743559344, 'alpha': 6.703154183686008, 'lambda': 0.7200623274088315, 'eta': 0.8781804012190246, 'sampling_method': 'uniform', 'subsample': 0.8335258211177632, 'gamma': 9.081201381897316}. Best is trial 285 with value: 4.265179430481361.
[I 2023-12-18 23:03:30,477] Trial 293 finished with value: 4.308706484538333 and parameters: {'learning_rate': 0.9483306560181438, 'aft_loss_distribution': 'normal', 'aft_loss_distribution_scale': 0.8756954502017085, 'max_depth': 6, 'booster': 'dart', 'scale_pos_weight': 1.5954046413050642, 'alpha': 5.91178448447245, 'lambda': 1.1053657044036704, 'eta': 0.872125502500682, 'sampling_method': 'uniform', 'subsample': 0.8209341052876046, 'gamma': 9.00631123652977}. Best is trial 285 with value: 4.265179430481361.
[I 2023-12-18 23:03:31,721] Trial 294 finished with value: inf and parameters: {'learning_rate': 0.961350136830307, 'aft_loss_distribution': 'normal', 'aft_loss_distribution_scale': 1.062731216366922, 'max_depth': 6, 'booster': 'dart', 'scale_pos_weight': 0.8568573176368868, 'alpha': 6.701523503161675, 'lambda': 0.8853014760324592, 'eta': 0.8997657653929761, 'sampling_method': 'uniform', 'subsample': 0.8352024495097622, 'gamma': 9.144806983509119}. Best is trial 285 with value: 4.265179430481361.
[I 2023-12-18 23:03:31,795] Trial 295 pruned. Trial was pruned at iteration 0.
[I 2023-12-18 23:03:31,877] Trial 296 pruned. Trial was pruned at iteration 1.
[I 2023-12-18 23:03:31,949] Trial 297 pruned. Trial was pruned at iteration 0.
[I 2023-12-18 23:03:35,281] Trial 298 finished with value: 4.28108339303732 and parameters: {'learning_rate': 0.8629858147845133, 'aft_loss_distribution': 'normal', 'aft_loss_distribution_scale': 0.9321717863331056, 'max_depth': 6, 'booster': 'dart', 'scale_pos_weight': 2.4200359114764693, 'alpha': 7.442690261021562, 'lambda': 1.1669368366759914, 'eta': 0.9481789068864783, 'sampling_method': 'uniform', 'subsample': 0.7930953228148974, 'gamma': 9.796275786295826}. Best is trial 285 with value: 4.265179430481361.
[I 2023-12-18 23:03:37,982] Trial 299 finished with value: inf and parameters: {'learning_rate': 0.868694355982052, 'aft_loss_distribution': 'normal', 'aft_loss_distribution_scale': 0.916819393357053, 'max_depth': 6, 'booster': 'dart', 'scale_pos_weight': 1.4136009323409877, 'alpha': 7.410276666390665, 'lambda': 1.1302787679568147, 'eta': 0.9281938862154467, 'sampling_method': 'uniform', 'subsample': 0.8798864724867207, 'gamma': 9.869912001434017}. Best is trial 285 with value: 4.265179430481361.
[I 2023-12-18 23:03:38,111] Trial 300 pruned. Trial was pruned at iteration 0.
[I 2023-12-18 23:03:39,727] Trial 301 finished with value: inf and parameters: {'learning_rate': 0.9159744171739608, 'aft_loss_distribution': 'normal', 'aft_loss_distribution_scale': 1.1269744604132186, 'max_depth': 6, 'booster': 'dart', 'scale_pos_weight': 1.2600192071904455, 'alpha': 7.2380395060098275, 'lambda': 5.5328892180353, 'eta': 0.9473988359087662, 'sampling_method': 'uniform', 'subsample': 0.7950873061446663, 'gamma': 9.747391382573161}. Best is trial 285 with value: 4.265179430481361.
[I 2023-12-18 23:03:43,617] Trial 302 finished with value: 4.284637421031075 and parameters: {'learning_rate': 0.8583282294218871, 'aft_loss_distribution': 'normal', 'aft_loss_distribution_scale': 0.9272851570788809, 'max_depth': 6, 'booster': 'dart', 'scale_pos_weight': 1.9307423605997647, 'alpha': 7.441323508307551, 'lambda': 0.8404814375093839, 'eta': 0.9649634175105816, 'sampling_method': 'uniform', 'subsample': 0.7811065798295197, 'gamma': 9.370294522666663}. Best is trial 285 with value: 4.265179430481361.
[I 2023-12-18 23:03:43,692] Trial 303 pruned. Trial was pruned at iteration 0.
[I 2023-12-18 23:03:43,767] Trial 304 pruned. Trial was pruned at iteration 0.
[I 2023-12-18 23:03:50,774] Trial 305 finished with value: 4.2797609392263904 and parameters: {'learning_rate': 0.8690344474092009, 'aft_loss_distribution': 'normal', 'aft_loss_distribution_scale': 0.9456529616132877, 'max_depth': 6, 'booster': 'dart', 'scale_pos_weight': 1.0333674782841142, 'alpha': 7.199039280432942, 'lambda': 0.8582298255216986, 'eta': 0.963435684126191, 'sampling_method': 'uniform', 'subsample': 0.792501381670437, 'gamma': 9.669811965233356}. Best is trial 285 with value: 4.265179430481361.
[I 2023-12-18 23:03:52,601] Trial 306 finished with value: inf and parameters: {'learning_rate': 0.8698533524228556, 'aft_loss_distribution': 'normal', 'aft_loss_distribution_scale': 0.9257615352266344, 'max_depth': 6, 'booster': 'dart', 'scale_pos_weight': 0.42138387851424475, 'alpha': 7.138918997811893, 'lambda': 0.8751657484329569, 'eta': 0.9665091309951865, 'sampling_method': 'uniform', 'subsample': 0.8034900594574951, 'gamma': 9.596497935995206}. Best is trial 285 with value: 4.265179430481361.
[I 2023-12-18 23:03:52,725] Trial 307 pruned. Trial was pruned at iteration 0.
[I 2023-12-18 23:03:52,838] Trial 308 pruned. Trial was pruned at iteration 0.
[I 2023-12-18 23:03:54,548] Trial 309 finished with value: inf and parameters: {'learning_rate': 0.8731595467363756, 'aft_loss_distribution': 'normal', 'aft_loss_distribution_scale': 0.9591914520672088, 'max_depth': 6, 'booster': 'dart', 'scale_pos_weight': 2.470836475055633, 'alpha': 7.209445865538128, 'lambda': 0.7576993024017405, 'eta': 0.9788399714378531, 'sampling_method': 'uniform', 'subsample': 0.891913892651068, 'gamma': 9.196096812913312}. Best is trial 285 with value: 4.265179430481361.
[I 2023-12-18 23:03:54,624] Trial 310 pruned. Trial was pruned at iteration 0.
[I 2023-12-18 23:03:54,702] Trial 311 pruned. Trial was pruned at iteration 1.
[I 2023-12-18 23:03:56,651] Trial 312 finished with value: inf and parameters: {'learning_rate': 0.8921347184578547, 'aft_loss_distribution': 'normal', 'aft_loss_distribution_scale': 1.0821830440580953, 'max_depth': 6, 'booster': 'dart', 'scale_pos_weight': 1.2245808780053502, 'alpha': 7.599248581029991, 'lambda': 0.6293104606726028, 'eta': 0.9405136972055943, 'sampling_method': 'uniform', 'subsample': 0.7990793881979272, 'gamma': 7.340888399855526}. Best is trial 285 with value: 4.265179430481361.
[I 2023-12-18 23:03:56,731] Trial 313 pruned. Trial was pruned at iteration 0.
[I 2023-12-18 23:03:59,839] Trial 314 finished with value: 4.266741328072729 and parameters: {'learning_rate': 0.8784870743127835, 'aft_loss_distribution': 'normal', 'aft_loss_distribution_scale': 1.081120674091772, 'max_depth': 6, 'booster': 'dart', 'scale_pos_weight': 2.366524865650509, 'alpha': 6.892943018543394, 'lambda': 1.0533370937115925, 'eta': 0.9813051707894304, 'sampling_method': 'uniform', 'subsample': 0.6919711812807219, 'gamma': 9.042295056577174}. Best is trial 285 with value: 4.265179430481361.
[I 2023-12-18 23:03:59,922] Trial 315 pruned. Trial was pruned at iteration 0.
[I 2023-12-18 23:04:00,000] Trial 316 pruned. Trial was pruned at iteration 0.
[I 2023-12-18 23:04:01,686] Trial 317 finished with value: inf and parameters: {'learning_rate': 0.9621479993855934, 'aft_loss_distribution': 'normal', 'aft_loss_distribution_scale': 1.0661554979149361, 'max_depth': 6, 'booster': 'dart', 'scale_pos_weight': 1.9432956754556088, 'alpha': 5.455650408947661, 'lambda': 1.0566146769470148, 'eta': 0.9760338191027541, 'sampling_method': 'uniform', 'subsample': 0.7542398029792509, 'gamma': 8.975553724407396}. Best is trial 285 with value: 4.265179430481361.
[I 2023-12-18 23:04:01,776] Trial 318 pruned. Trial was pruned at iteration 2.
[I 2023-12-18 23:04:04,043] Trial 319 finished with value: inf and parameters: {'learning_rate': 0.8807647268950648, 'aft_loss_distribution': 'normal', 'aft_loss_distribution_scale': 1.1312083504327743, 'max_depth': 6, 'booster': 'dart', 'scale_pos_weight': 1.8047301512032117, 'alpha': 7.365750362133835, 'lambda': 0.7840691811959355, 'eta': 0.9456227870265519, 'sampling_method': 'uniform', 'subsample': 0.7173685983819921, 'gamma': 9.740538503573053}. Best is trial 285 with value: 4.265179430481361.
[I 2023-12-18 23:04:04,181] Trial 320 pruned. Trial was pruned at iteration 0.
[I 2023-12-18 23:04:04,306] Trial 321 pruned. Trial was pruned at iteration 1.
[I 2023-12-18 23:04:07,531] Trial 322 finished with value: 4.294274706338345 and parameters: {'learning_rate': 0.8998269111814129, 'aft_loss_distribution': 'normal', 'aft_loss_distribution_scale': 0.8978385098100246, 'max_depth': 6, 'booster': 'dart', 'scale_pos_weight': 2.405544766879008, 'alpha': 7.646535587352281, 'lambda': 8.22385780073818, 'eta': 0.9744067953538803, 'sampling_method': 'uniform', 'subsample': 0.7408049427485618, 'gamma': 9.145767452918307}. Best is trial 285 with value: 4.265179430481361.
[I 2023-12-18 23:04:09,802] Trial 323 finished with value: inf and parameters: {'learning_rate': 0.8708188948000524, 'aft_loss_distribution': 'normal', 'aft_loss_distribution_scale': 1.1717706852559207, 'max_depth': 6, 'booster': 'dart', 'scale_pos_weight': 2.5611813530982808, 'alpha': 6.886348178513638, 'lambda': 1.6902752323734713, 'eta': 0.8315830423049021, 'sampling_method': 'uniform', 'subsample': 0.70238502633246, 'gamma': 8.532658868991799}. Best is trial 285 with value: 4.265179430481361.
[I 2023-12-18 23:04:09,884] Trial 324 pruned. Trial was pruned at iteration 0.
[I 2023-12-18 23:04:11,323] Trial 325 finished with value: inf and parameters: {'learning_rate': 0.8584156381458738, 'aft_loss_distribution': 'normal', 'aft_loss_distribution_scale': 0.9967871910899984, 'max_depth': 6, 'booster': 'dart', 'scale_pos_weight': 2.0794717917498877, 'alpha': 7.024201505487459, 'lambda': 0.49888756371592063, 'eta': 0.9227780496732584, 'sampling_method': 'uniform', 'subsample': 0.683487919763148, 'gamma': 8.826002256101525}. Best is trial 285 with value: 4.265179430481361.
[I 2023-12-18 23:04:11,406] Trial 326 pruned. Trial was pruned at iteration 1.
[I 2023-12-18 23:04:11,486] Trial 327 pruned. Trial was pruned at iteration 0.
[I 2023-12-18 23:04:11,559] Trial 328 pruned. Trial was pruned at iteration 0.
[I 2023-12-18 23:04:11,637] Trial 329 pruned. Trial was pruned at iteration 0.
[I 2023-12-18 23:04:21,150] Trial 330 finished with value: 4.27139595596254 and parameters: {'learning_rate': 0.8609349871128471, 'aft_loss_distribution': 'normal', 'aft_loss_distribution_scale': 0.9800417351318329, 'max_depth': 6, 'booster': 'dart', 'scale_pos_weight': 1.6751638856888045, 'alpha': 6.2084207695172156, 'lambda': 0.6253213602648137, 'eta': 0.998065525090683, 'sampling_method': 'uniform', 'subsample': 0.7991158084195806, 'gamma': 8.387387516892279}. Best is trial 285 with value: 4.265179430481361.
[I 2023-12-18 23:04:21,294] Trial 331 pruned. Trial was pruned at iteration 2.
[I 2023-12-18 23:04:28,573] Trial 332 finished with value: 4.264630215183969 and parameters: {'learning_rate': 0.9261384794524896, 'aft_loss_distribution': 'normal', 'aft_loss_distribution_scale': 1.0815156570407234, 'max_depth': 6, 'booster': 'dart', 'scale_pos_weight': 1.742151020354126, 'alpha': 6.264488475226071, 'lambda': 0.6088499634158528, 'eta': 0.9681159028623321, 'sampling_method': 'uniform', 'subsample': 0.7898661860508063, 'gamma': 9.536173842031666}. Best is trial 332 with value: 4.264630215183969.
[I 2023-12-18 23:04:31,764] Trial 333 finished with value: 4.264499999089825 and parameters: {'learning_rate': 0.9325999400968015, 'aft_loss_distribution': 'normal', 'aft_loss_distribution_scale': 1.0524509333673902, 'max_depth': 6, 'booster': 'dart', 'scale_pos_weight': 1.6923885250798387, 'alpha': 6.0479207381666855, 'lambda': 0.6509674267299707, 'eta': 0.9737752051522442, 'sampling_method': 'uniform', 'subsample': 0.7960345288907069, 'gamma': 9.442746248851158}. Best is trial 333 with value: 4.264499999089825.
[I 2023-12-18 23:04:31,849] Trial 334 pruned. Trial was pruned at iteration 1.
[I 2023-12-18 23:04:31,926] Trial 335 pruned. Trial was pruned at iteration 0.
[I 2023-12-18 23:04:34,311] Trial 336 finished with value: inf and parameters: {'learning_rate': 0.9252948487172943, 'aft_loss_distribution': 'normal', 'aft_loss_distribution_scale': 1.0055115910387518, 'max_depth': 6, 'booster': 'dart', 'scale_pos_weight': 1.4181745575885412, 'alpha': 6.305656469394894, 'lambda': 0.7163014296019534, 'eta': 0.9744944200794892, 'sampling_method': 'uniform', 'subsample': 0.829224996093689, 'gamma': 9.450138280969247}. Best is trial 333 with value: 4.264499999089825.
[I 2023-12-18 23:04:37,667] Trial 337 finished with value: 4.267661728123517 and parameters: {'learning_rate': 0.9516577123886895, 'aft_loss_distribution': 'normal', 'aft_loss_distribution_scale': 1.0155885866719179, 'max_depth': 6, 'booster': 'dart', 'scale_pos_weight': 1.5904894451931086, 'alpha': 6.345287715354885, 'lambda': 0.8179055317928455, 'eta': 0.9439243094367955, 'sampling_method': 'uniform', 'subsample': 0.7884564401328095, 'gamma': 8.840686093132422}. Best is trial 333 with value: 4.264499999089825.
[I 2023-12-18 23:04:37,747] Trial 338 pruned. Trial was pruned at iteration 0.
[I 2023-12-18 23:04:37,828] Trial 339 pruned. Trial was pruned at iteration 0.
[I 2023-12-18 23:04:37,910] Trial 340 pruned. Trial was pruned at iteration 1.
[I 2023-12-18 23:04:37,987] Trial 341 pruned. Trial was pruned at iteration 0.
[I 2023-12-18 23:04:44,462] Trial 342 finished with value: 4.267262586729022 and parameters: {'learning_rate': 0.9966731180256467, 'aft_loss_distribution': 'normal', 'aft_loss_distribution_scale': 1.0677472651936126, 'max_depth': 6, 'booster': 'dart', 'scale_pos_weight': 1.7435515357133757, 'alpha': 5.7042889433931165, 'lambda': 0.5359531848421714, 'eta': 0.979935714959746, 'sampling_method': 'uniform', 'subsample': 0.7934701981815138, 'gamma': 8.713427070893154}. Best is trial 333 with value: 4.264499999089825.
[I 2023-12-18 23:04:45,818] Trial 343 finished with value: inf and parameters: {'learning_rate': 0.9979733274971022, 'aft_loss_distribution': 'normal', 'aft_loss_distribution_scale': 0.9806991749934816, 'max_depth': 6, 'booster': 'dart', 'scale_pos_weight': 1.6341864324712705, 'alpha': 5.938966121544333, 'lambda': 0.5409202501652042, 'eta': 0.9851412267088802, 'sampling_method': 'uniform', 'subsample': 0.7802343314865181, 'gamma': 8.785975359841741}. Best is trial 333 with value: 4.264499999089825.
[I 2023-12-18 23:04:45,896] Trial 344 pruned. Trial was pruned at iteration 0.
[I 2023-12-18 23:04:45,972] Trial 345 pruned. Trial was pruned at iteration 1.
[I 2023-12-18 23:04:49,215] Trial 346 finished with value: 4.269039841051059 and parameters: {'learning_rate': 0.9418372710515467, 'aft_loss_distribution': 'normal', 'aft_loss_distribution_scale': 1.123852576369938, 'max_depth': 6, 'booster': 'dart', 'scale_pos_weight': 1.0859129519382442, 'alpha': 5.530820676584321, 'lambda': 0.7416331141648421, 'eta': 0.9518235648184555, 'sampling_method': 'uniform', 'subsample': 0.7702996568991713, 'gamma': 8.397062216167235}. Best is trial 333 with value: 4.264499999089825.
[I 2023-12-18 23:04:55,596] Trial 347 finished with value: 4.271660959669315 and parameters: {'learning_rate': 0.9334371780918774, 'aft_loss_distribution': 'normal', 'aft_loss_distribution_scale': 1.1485454938865698, 'max_depth': 6, 'booster': 'dart', 'scale_pos_weight': 1.0162579878535638, 'alpha': 4.9837163912391755, 'lambda': 0.7243306602310339, 'eta': 0.9227297710727174, 'sampling_method': 'uniform', 'subsample': 0.7666343368375297, 'gamma': 8.470412628095989}. Best is trial 333 with value: 4.264499999089825.
[I 2023-12-18 23:04:55,676] Trial 348 pruned. Trial was pruned at iteration 1.
[I 2023-12-18 23:04:55,752] Trial 349 pruned. Trial was pruned at iteration 0.
[I 2023-12-18 23:04:57,040] Trial 350 finished with value: inf and parameters: {'learning_rate': 0.9381071742557953, 'aft_loss_distribution': 'normal', 'aft_loss_distribution_scale': 1.1895375001388073, 'max_depth': 6, 'booster': 'dart', 'scale_pos_weight': 0.9151706620721789, 'alpha': 5.402340690128547, 'lambda': 0.4475438390086899, 'eta': 0.9349555157966155, 'sampling_method': 'uniform', 'subsample': 0.7445283042339917, 'gamma': 8.354002211759408}. Best is trial 333 with value: 4.264499999089825.
[I 2023-12-18 23:04:57,126] Trial 351 pruned. Trial was pruned at iteration 2.
[I 2023-12-18 23:04:57,215] Trial 352 pruned. Trial was pruned at iteration 1.
[I 2023-12-18 23:04:57,286] Trial 353 pruned. Trial was pruned at iteration 0.
[I 2023-12-18 23:04:59,791] Trial 354 finished with value: 4.27059211429337 and parameters: {'learning_rate': 0.9082782307190951, 'aft_loss_distribution': 'normal', 'aft_loss_distribution_scale': 1.1335718505083645, 'max_depth': 6, 'booster': 'dart', 'scale_pos_weight': 0.738286570420332, 'alpha': 4.967252255807914, 'lambda': 0.3525311900773155, 'eta': 0.922087009281513, 'sampling_method': 'uniform', 'subsample': 0.7686900706721321, 'gamma': 8.421316670550302}. Best is trial 333 with value: 4.264499999089825.
[I 2023-12-18 23:04:59,880] Trial 355 pruned. Trial was pruned at iteration 1.
[I 2023-12-18 23:05:01,198] Trial 356 finished with value: inf and parameters: {'learning_rate': 0.9433328531854395, 'aft_loss_distribution': 'normal', 'aft_loss_distribution_scale': 1.0795292753692243, 'max_depth': 6, 'booster': 'dart', 'scale_pos_weight': 0.7461851428159648, 'alpha': 4.605967955505283, 'lambda': 0.3425497102081727, 'eta': 0.8896086383048585, 'sampling_method': 'uniform', 'subsample': 0.7712387604308885, 'gamma': 8.71133096787482}. Best is trial 333 with value: 4.264499999089825.
[I 2023-12-18 23:05:01,296] Trial 357 pruned. Trial was pruned at iteration 1.
[I 2023-12-18 23:05:01,377] Trial 358 pruned. Trial was pruned at iteration 2.
[I 2023-12-18 23:05:01,469] Trial 359 pruned. Trial was pruned at iteration 2.
[I 2023-12-18 23:05:04,753] Trial 360 finished with value: 4.265725593606085 and parameters: {'learning_rate': 0.8997802530033737, 'aft_loss_distribution': 'normal', 'aft_loss_distribution_scale': 1.0769166737456193, 'max_depth': 6, 'booster': 'dart', 'scale_pos_weight': 0.9212360214832096, 'alpha': 4.600538975000238, 'lambda': 9.911819202617348, 'eta': 0.9305698068252117, 'sampling_method': 'uniform', 'subsample': 0.7499902359824886, 'gamma': 8.450423002150636}. Best is trial 333 with value: 4.264499999089825.
[I 2023-12-18 23:05:04,878] Trial 361 pruned. Trial was pruned at iteration 0.
