[I 2023-12-21 03:24:02,019] Trial 175 finished with value: 4.377862013229535 and parameters: {'learning_rate': 0.24105338368526474, 'aft_                                                                     loss_distribution': 'logistic', 'aft_loss_distribution_scale': 0.9761718148790312, 'max_depth': 5, 'booster': 'dart', 'scale_pos_weight':                                                                      2.3837989384272853, 'alpha': 5.473239320722596, 'lambda': 8.479537814653183, 'eta': 0.5580527497995158, 'sampling_method': 'gradient_bas                                                                     ed', 'subsample': 0.4142340930169636, 'gamma': 0.4099834673050475}. Best is trial 34 with value: 4.15687381580361.
[I 2023-12-21 03:24:02,060] Trial 176 pruned. Trial was pruned at iteration 0.
[I 2023-12-21 03:24:02,099] Trial 177 pruned. Trial was pruned at iteration 0.
[I 2023-12-21 03:24:02,141] Trial 178 pruned. Trial was pruned at iteration 0.
[I 2023-12-21 03:24:02,179] Trial 179 pruned. Trial was pruned at iteration 0.
[I 2023-12-21 03:24:02,219] Trial 180 pruned. Trial was pruned at iteration 0.
[I 2023-12-21 03:24:05,201] Trial 181 pruned. Trial was pruned at iteration 92.
[I 2023-12-21 03:24:05,244] Trial 182 pruned. Trial was pruned at iteration 0.
[I 2023-12-21 03:24:05,295] Trial 183 pruned. Trial was pruned at iteration 3.
[I 2023-12-21 03:24:05,396] Trial 184 pruned. Trial was pruned at iteration 9.
[I 2023-12-21 03:24:05,435] Trial 185 pruned. Trial was pruned at iteration 0.
[I 2023-12-21 03:24:05,476] Trial 186 pruned. Trial was pruned at iteration 0.
[I 2023-12-21 03:24:05,519] Trial 187 pruned. Trial was pruned at iteration 0.
[I 2023-12-21 03:24:05,570] Trial 188 pruned. Trial was pruned at iteration 4.
[I 2023-12-21 03:24:05,609] Trial 189 pruned. Trial was pruned at iteration 0.
[I 2023-12-21 03:24:05,648] Trial 190 pruned. Trial was pruned at iteration 0.
[I 2023-12-21 03:24:05,688] Trial 191 pruned. Trial was pruned at iteration 0.
[I 2023-12-21 03:24:05,729] Trial 192 pruned. Trial was pruned at iteration 1.
[I 2023-12-21 03:24:05,769] Trial 193 pruned. Trial was pruned at iteration 0.
[I 2023-12-21 03:24:05,841] Trial 194 pruned. Trial was pruned at iteration 17.
[I 2023-12-21 03:24:05,880] Trial 195 pruned. Trial was pruned at iteration 0.
[I 2023-12-21 03:24:05,919] Trial 196 pruned. Trial was pruned at iteration 0.
[I 2023-12-21 03:24:05,959] Trial 197 pruned. Trial was pruned at iteration 0.
[I 2023-12-21 03:24:05,998] Trial 198 pruned. Trial was pruned at iteration 0.
[I 2023-12-21 03:24:06,039] Trial 199 pruned. Trial was pruned at iteration 0.
[I 2023-12-21 03:24:06,080] Trial 200 pruned. Trial was pruned at iteration 0.
[I 2023-12-21 03:24:06,119] Trial 201 pruned. Trial was pruned at iteration 0.
[I 2023-12-21 03:24:06,158] Trial 202 pruned. Trial was pruned at iteration 0.
[I 2023-12-21 03:24:06,199] Trial 203 pruned. Trial was pruned at iteration 0.
[I 2023-12-21 03:24:06,239] Trial 204 pruned. Trial was pruned at iteration 0.
[I 2023-12-21 03:24:06,280] Trial 205 pruned. Trial was pruned at iteration 0.
[I 2023-12-21 03:24:09,340] Trial 206 pruned. Trial was pruned at iteration 92.
[I 2023-12-21 03:24:09,384] Trial 207 pruned. Trial was pruned at iteration 0.
[I 2023-12-21 03:24:09,424] Trial 208 pruned. Trial was pruned at iteration 0.
[I 2023-12-21 03:24:09,465] Trial 209 pruned. Trial was pruned at iteration 0.
[I 2023-12-21 03:24:09,507] Trial 210 pruned. Trial was pruned at iteration 0.
[I 2023-12-21 03:24:09,549] Trial 211 pruned. Trial was pruned at iteration 0.
[I 2023-12-21 03:24:09,591] Trial 212 pruned. Trial was pruned at iteration 0.
[I 2023-12-21 03:24:09,632] Trial 213 pruned. Trial was pruned at iteration 0.
[I 2023-12-21 03:24:09,672] Trial 214 pruned. Trial was pruned at iteration 0.
[I 2023-12-21 03:24:12,185] Trial 215 pruned. Trial was pruned at iteration 86.
[I 2023-12-21 03:24:12,228] Trial 216 pruned. Trial was pruned at iteration 0.
[I 2023-12-21 03:24:12,271] Trial 217 pruned. Trial was pruned at iteration 0.
[I 2023-12-21 03:24:12,314] Trial 218 pruned. Trial was pruned at iteration 0.
[I 2023-12-21 03:24:12,357] Trial 219 pruned. Trial was pruned at iteration 0.
[I 2023-12-21 03:24:12,398] Trial 220 pruned. Trial was pruned at iteration 0.
[I 2023-12-21 03:24:12,439] Trial 221 pruned. Trial was pruned at iteration 0.
[I 2023-12-21 03:24:12,481] Trial 222 pruned. Trial was pruned at iteration 0.
[I 2023-12-21 03:24:12,522] Trial 223 pruned. Trial was pruned at iteration 0.
[I 2023-12-21 03:24:12,563] Trial 224 pruned. Trial was pruned at iteration 0.
[I 2023-12-21 03:24:12,606] Trial 225 pruned. Trial was pruned at iteration 0.
[I 2023-12-21 03:24:12,648] Trial 226 pruned. Trial was pruned at iteration 0.
[I 2023-12-21 03:24:12,693] Trial 227 pruned. Trial was pruned at iteration 0.
[I 2023-12-21 03:24:15,542] Trial 228 pruned. Trial was pruned at iteration 91.
[I 2023-12-21 03:24:15,587] Trial 229 pruned. Trial was pruned at iteration 0.
[I 2023-12-21 03:24:15,629] Trial 230 pruned. Trial was pruned at iteration 0.
[I 2023-12-21 03:24:15,670] Trial 231 pruned. Trial was pruned at iteration 0.
[I 2023-12-21 03:24:15,713] Trial 232 pruned. Trial was pruned at iteration 0.
[I 2023-12-21 03:24:15,756] Trial 233 pruned. Trial was pruned at iteration 0.
[I 2023-12-21 03:24:15,798] Trial 234 pruned. Trial was pruned at iteration 0.
[I 2023-12-21 03:24:15,840] Trial 235 pruned. Trial was pruned at iteration 0.
[I 2023-12-21 03:24:15,881] Trial 236 pruned. Trial was pruned at iteration 0.
[I 2023-12-21 03:24:15,923] Trial 237 pruned. Trial was pruned at iteration 0.
[I 2023-12-21 03:24:15,966] Trial 238 pruned. Trial was pruned at iteration 0.
[I 2023-12-21 03:24:16,009] Trial 239 pruned. Trial was pruned at iteration 0.
[I 2023-12-21 03:24:16,052] Trial 240 pruned. Trial was pruned at iteration 0.
[I 2023-12-21 03:24:16,094] Trial 241 pruned. Trial was pruned at iteration 0.
[I 2023-12-21 03:24:16,141] Trial 242 pruned. Trial was pruned at iteration 2.
[I 2023-12-21 03:24:16,185] Trial 243 pruned. Trial was pruned at iteration 0.
[I 2023-12-21 03:24:16,229] Trial 244 pruned. Trial was pruned at iteration 0.
[I 2023-12-21 03:24:16,274] Trial 245 pruned. Trial was pruned at iteration 0.
[I 2023-12-21 03:24:16,318] Trial 246 pruned. Trial was pruned at iteration 0.
[I 2023-12-21 03:24:16,361] Trial 247 pruned. Trial was pruned at iteration 0.
[I 2023-12-21 03:25:53,711] Trial 248 finished with value: 4.173234980993045 and parameters: {'learning_rate': 0.04712305481696266, 'aft_                                                                     loss_distribution': 'logistic', 'aft_loss_distribution_scale': 0.5903276520078782, 'max_depth': 5, 'booster': 'dart', 'scale_pos_weight':                                                                      1.569900976474353, 'alpha': 7.946742690751209, 'lambda': 1.3804123253074052, 'eta': 0.6851762659822379, 'sampling_method': 'gradient_bas                                                                     ed', 'subsample': 0.7157400943943218, 'gamma': 5.293511661660603}. Best is trial 34 with value: 4.15687381580361.
[I 2023-12-21 03:25:53,760] Trial 249 pruned. Trial was pruned at iteration 0.
[I 2023-12-21 03:25:53,804] Trial 250 pruned. Trial was pruned at iteration 0.
[I 2023-12-21 03:25:53,850] Trial 251 pruned. Trial was pruned at iteration 0.
[I 2023-12-21 03:25:53,894] Trial 252 pruned. Trial was pruned at iteration 0.
[I 2023-12-21 03:25:53,938] Trial 253 pruned. Trial was pruned at iteration 0.
[I 2023-12-21 03:25:53,983] Trial 254 pruned. Trial was pruned at iteration 0.
[I 2023-12-21 03:25:54,027] Trial 255 pruned. Trial was pruned at iteration 0.
[I 2023-12-21 03:25:54,070] Trial 256 pruned. Trial was pruned at iteration 0.
[I 2023-12-21 03:25:54,115] Trial 257 pruned. Trial was pruned at iteration 0.
[I 2023-12-21 03:25:54,166] Trial 258 pruned. Trial was pruned at iteration 0.
[I 2023-12-21 03:25:54,210] Trial 259 pruned. Trial was pruned at iteration 0.
[I 2023-12-21 03:25:54,256] Trial 260 pruned. Trial was pruned at iteration 0.
[I 2023-12-21 03:25:54,301] Trial 261 pruned. Trial was pruned at iteration 0.
[I 2023-12-21 03:25:54,345] Trial 262 pruned. Trial was pruned at iteration 0.
[I 2023-12-21 03:25:54,388] Trial 263 pruned. Trial was pruned at iteration 0.
[I 2023-12-21 03:25:54,434] Trial 264 pruned. Trial was pruned at iteration 0.
[I 2023-12-21 03:25:54,479] Trial 265 pruned. Trial was pruned at iteration 0.
[I 2023-12-21 03:25:54,524] Trial 266 pruned. Trial was pruned at iteration 0.
[I 2023-12-21 03:25:54,568] Trial 267 pruned. Trial was pruned at iteration 0.
[I 2023-12-21 03:25:54,618] Trial 268 pruned. Trial was pruned at iteration 2.
[I 2023-12-21 03:25:54,662] Trial 269 pruned. Trial was pruned at iteration 0.
[I 2023-12-21 03:25:54,706] Trial 270 pruned. Trial was pruned at iteration 0.
[I 2023-12-21 03:25:54,753] Trial 271 pruned. Trial was pruned at iteration 0.
[I 2023-12-21 03:25:54,797] Trial 272 pruned. Trial was pruned at iteration 0.
[I 2023-12-21 03:25:54,842] Trial 273 pruned. Trial was pruned at iteration 0.
[I 2023-12-21 03:25:54,887] Trial 274 pruned. Trial was pruned at iteration 0.
[I 2023-12-21 03:25:54,933] Trial 275 pruned. Trial was pruned at iteration 0.
[I 2023-12-21 03:25:54,977] Trial 276 pruned. Trial was pruned at iteration 0.
[I 2023-12-21 03:25:55,024] Trial 277 pruned. Trial was pruned at iteration 0.
[I 2023-12-21 03:25:55,069] Trial 278 pruned. Trial was pruned at iteration 0.
[I 2023-12-21 03:25:55,114] Trial 279 pruned. Trial was pruned at iteration 0.
[I 2023-12-21 03:25:55,159] Trial 280 pruned. Trial was pruned at iteration 0.
[I 2023-12-21 03:25:55,204] Trial 281 pruned. Trial was pruned at iteration 0.
[I 2023-12-21 03:25:55,253] Trial 282 pruned. Trial was pruned at iteration 0.
[I 2023-12-21 03:25:55,314] Trial 283 pruned. Trial was pruned at iteration 6.
[I 2023-12-21 03:25:55,360] Trial 284 pruned. Trial was pruned at iteration 0.
[I 2023-12-21 03:25:55,405] Trial 285 pruned. Trial was pruned at iteration 0.
[I 2023-12-21 03:25:55,450] Trial 286 pruned. Trial was pruned at iteration 0.
[I 2023-12-21 03:25:55,495] Trial 287 pruned. Trial was pruned at iteration 0.
[I 2023-12-21 03:25:55,544] Trial 288 pruned. Trial was pruned at iteration 0.
[I 2023-12-21 03:25:55,589] Trial 289 pruned. Trial was pruned at iteration 0.
[I 2023-12-21 03:25:55,638] Trial 290 pruned. Trial was pruned at iteration 0.
[I 2023-12-21 03:25:55,683] Trial 291 pruned. Trial was pruned at iteration 0.
[I 2023-12-21 03:25:55,728] Trial 292 pruned. Trial was pruned at iteration 0.
[I 2023-12-21 03:25:55,774] Trial 293 pruned. Trial was pruned at iteration 0.
[I 2023-12-21 03:25:55,819] Trial 294 pruned. Trial was pruned at iteration 0.
[I 2023-12-21 03:25:56,180] Trial 295 pruned. Trial was pruned at iteration 159.
[I 2023-12-21 03:25:56,228] Trial 296 pruned. Trial was pruned at iteration 0.
[I 2023-12-21 03:25:56,274] Trial 297 pruned. Trial was pruned at iteration 0.
[I 2023-12-21 03:25:56,318] Trial 298 pruned. Trial was pruned at iteration 0.
[I 2023-12-21 03:25:56,370] Trial 299 pruned. Trial was pruned at iteration 2.
[I 2023-12-21 03:25:56,415] Trial 300 pruned. Trial was pruned at iteration 0.
[I 2023-12-21 03:25:56,461] Trial 301 pruned. Trial was pruned at iteration 0.
[I 2023-12-21 03:25:56,507] Trial 302 pruned. Trial was pruned at iteration 0.
[I 2023-12-21 03:25:56,553] Trial 303 pruned. Trial was pruned at iteration 0.
[I 2023-12-21 03:25:56,598] Trial 304 pruned. Trial was pruned at iteration 0.
[I 2023-12-21 03:25:56,645] Trial 305 pruned. Trial was pruned at iteration 0.
[I 2023-12-21 03:25:56,690] Trial 306 pruned. Trial was pruned at iteration 0.
[I 2023-12-21 03:25:56,737] Trial 307 pruned. Trial was pruned at iteration 0.
[I 2023-12-21 03:25:56,783] Trial 308 pruned. Trial was pruned at iteration 0.
[I 2023-12-21 03:25:56,830] Trial 309 pruned. Trial was pruned at iteration 0.
[I 2023-12-21 03:25:56,875] Trial 310 pruned. Trial was pruned at iteration 0.
[I 2023-12-21 03:25:56,929] Trial 311 pruned. Trial was pruned at iteration 3.
[I 2023-12-21 03:25:57,193] Trial 312 pruned. Trial was pruned at iteration 121.
[I 2023-12-21 03:25:57,240] Trial 313 pruned. Trial was pruned at iteration 0.
[I 2023-12-21 03:25:57,287] Trial 314 pruned. Trial was pruned at iteration 0.
[I 2023-12-21 03:25:57,335] Trial 315 pruned. Trial was pruned at iteration 0.
[I 2023-12-21 03:25:57,391] Trial 316 pruned. Trial was pruned at iteration 3.
[I 2023-12-21 03:25:57,438] Trial 317 pruned. Trial was pruned at iteration 0.
[I 2023-12-21 03:25:57,486] Trial 318 pruned. Trial was pruned at iteration 0.
[I 2023-12-21 03:25:57,533] Trial 319 pruned. Trial was pruned at iteration 0.
[I 2023-12-21 03:25:57,586] Trial 320 pruned. Trial was pruned at iteration 3.
[I 2023-12-21 03:25:57,633] Trial 321 pruned. Trial was pruned at iteration 0.
[I 2023-12-21 03:25:57,680] Trial 322 pruned. Trial was pruned at iteration 0.
[I 2023-12-21 03:25:57,727] Trial 323 pruned. Trial was pruned at iteration 0.
[I 2023-12-21 03:25:57,773] Trial 324 pruned. Trial was pruned at iteration 0.
[I 2023-12-21 03:25:57,834] Trial 325 pruned. Trial was pruned at iteration 4.
[I 2023-12-21 03:25:57,881] Trial 326 pruned. Trial was pruned at iteration 0.
[I 2023-12-21 03:25:57,929] Trial 327 pruned. Trial was pruned at iteration 0.
[I 2023-12-21 03:25:57,977] Trial 328 pruned. Trial was pruned at iteration 0.
[I 2023-12-21 03:25:58,024] Trial 329 pruned. Trial was pruned at iteration 0.
[I 2023-12-21 03:25:58,071] Trial 330 pruned. Trial was pruned at iteration 0.
[I 2023-12-21 03:25:58,117] Trial 331 pruned. Trial was pruned at iteration 0.
[I 2023-12-21 03:25:58,165] Trial 332 pruned. Trial was pruned at iteration 0.
[I 2023-12-21 03:25:58,214] Trial 333 pruned. Trial was pruned at iteration 0.
[I 2023-12-21 03:25:58,263] Trial 334 pruned. Trial was pruned at iteration 0.
[I 2023-12-21 03:25:58,310] Trial 335 pruned. Trial was pruned at iteration 0.
[I 2023-12-21 03:25:58,356] Trial 336 pruned. Trial was pruned at iteration 0.
[I 2023-12-21 03:25:58,402] Trial 337 pruned. Trial was pruned at iteration 0.
[I 2023-12-21 03:25:58,449] Trial 338 pruned. Trial was pruned at iteration 0.
[I 2023-12-21 03:25:58,497] Trial 339 pruned. Trial was pruned at iteration 0.
[I 2023-12-21 03:25:58,545] Trial 340 pruned. Trial was pruned at iteration 0.
[I 2023-12-21 03:25:58,592] Trial 341 pruned. Trial was pruned at iteration 0.
[I 2023-12-21 03:25:58,640] Trial 342 pruned. Trial was pruned at iteration 0.
[I 2023-12-21 03:25:58,687] Trial 343 pruned. Trial was pruned at iteration 0.
[I 2023-12-21 03:25:58,734] Trial 344 pruned. Trial was pruned at iteration 0.
[I 2023-12-21 03:25:58,782] Trial 345 pruned. Trial was pruned at iteration 0.
[I 2023-12-21 03:25:58,830] Trial 346 pruned. Trial was pruned at iteration 0.
[I 2023-12-21 03:25:58,882] Trial 347 pruned. Trial was pruned at iteration 0.
[I 2023-12-21 03:25:58,929] Trial 348 pruned. Trial was pruned at iteration 0.
[I 2023-12-21 03:25:58,977] Trial 349 pruned. Trial was pruned at iteration 0.
[I 2023-12-21 03:25:59,045] Trial 350 pruned. Trial was pruned at iteration 4.
[I 2023-12-21 03:25:59,092] Trial 351 pruned. Trial was pruned at iteration 0.
[I 2023-12-21 03:25:59,141] Trial 352 pruned. Trial was pruned at iteration 0.
[I 2023-12-21 03:25:59,191] Trial 353 pruned. Trial was pruned at iteration 0.
[I 2023-12-21 03:25:59,241] Trial 354 pruned. Trial was pruned at iteration 0.
[I 2023-12-21 03:25:59,291] Trial 355 pruned. Trial was pruned at iteration 0.
[I 2023-12-21 03:25:59,339] Trial 356 pruned. Trial was pruned at iteration 0.
[I 2023-12-21 03:25:59,386] Trial 357 pruned. Trial was pruned at iteration 0.
[I 2023-12-21 03:25:59,435] Trial 358 pruned. Trial was pruned at iteration 0.
[I 2023-12-21 03:25:59,488] Trial 359 pruned. Trial was pruned at iteration 1.
[I 2023-12-21 03:25:59,536] Trial 360 pruned. Trial was pruned at iteration 0.
[I 2023-12-21 03:25:59,585] Trial 361 pruned. Trial was pruned at iteration 0.
[I 2023-12-21 03:25:59,634] Trial 362 pruned. Trial was pruned at iteration 0.
[I 2023-12-21 03:26:00,762] Trial 363 pruned. Trial was pruned at iteration 54.
[I 2023-12-21 03:26:00,812] Trial 364 pruned. Trial was pruned at iteration 0.
[I 2023-12-21 03:26:00,861] Trial 365 pruned. Trial was pruned at iteration 0.
[I 2023-12-21 03:26:00,913] Trial 366 pruned. Trial was pruned at iteration 0.
[I 2023-12-21 03:26:00,961] Trial 367 pruned. Trial was pruned at iteration 0.
[I 2023-12-21 03:26:01,011] Trial 368 pruned. Trial was pruned at iteration 0.
[I 2023-12-21 03:26:01,062] Trial 369 pruned. Trial was pruned at iteration 0.
[I 2023-12-21 03:26:01,471] Trial 370 pruned. Trial was pruned at iteration 265.
[I 2023-12-21 03:26:01,521] Trial 371 pruned. Trial was pruned at iteration 0.
[I 2023-12-21 03:26:01,573] Trial 372 pruned. Trial was pruned at iteration 0.
[I 2023-12-21 03:26:01,634] Trial 373 pruned. Trial was pruned at iteration 3.
[I 2023-12-21 03:26:01,683] Trial 374 pruned. Trial was pruned at iteration 0.
[I 2023-12-21 03:26:01,733] Trial 375 pruned. Trial was pruned at iteration 0.
[I 2023-12-21 03:26:01,781] Trial 376 pruned. Trial was pruned at iteration 0.
[I 2023-12-21 03:26:01,832] Trial 377 pruned. Trial was pruned at iteration 0.
[I 2023-12-21 03:26:01,883] Trial 378 pruned. Trial was pruned at iteration 0.
[I 2023-12-21 03:26:01,932] Trial 379 pruned. Trial was pruned at iteration 0.
[I 2023-12-21 03:26:01,980] Trial 380 pruned. Trial was pruned at iteration 0.
[I 2023-12-21 03:26:02,030] Trial 381 pruned. Trial was pruned at iteration 0.
[I 2023-12-21 03:26:02,080] Trial 382 pruned. Trial was pruned at iteration 0.
[I 2023-12-21 03:26:02,144] Trial 383 pruned. Trial was pruned at iteration 4.
[I 2023-12-21 03:26:02,195] Trial 384 pruned. Trial was pruned at iteration 0.
[I 2023-12-21 03:26:02,251] Trial 385 pruned. Trial was pruned at iteration 0.
[I 2023-12-21 03:26:02,302] Trial 386 pruned. Trial was pruned at iteration 0.
[I 2023-12-21 03:26:02,350] Trial 387 pruned. Trial was pruned at iteration 0.
[I 2023-12-21 03:26:02,400] Trial 388 pruned. Trial was pruned at iteration 0.
[I 2023-12-21 03:26:02,450] Trial 389 pruned. Trial was pruned at iteration 0.
[I 2023-12-21 03:26:02,499] Trial 390 pruned. Trial was pruned at iteration 0.
[I 2023-12-21 03:26:02,705] Trial 391 pruned. Trial was pruned at iteration 92.
[I 2023-12-21 03:26:02,756] Trial 392 pruned. Trial was pruned at iteration 0.
[I 2023-12-21 03:26:02,807] Trial 393 pruned. Trial was pruned at iteration 0.
[I 2023-12-21 03:26:05,603] Trial 394 pruned. Trial was pruned at iteration 91.
[I 2023-12-21 03:26:06,014] Trial 395 pruned. Trial was pruned at iteration 121.
[I 2023-12-21 03:26:06,064] Trial 396 pruned. Trial was pruned at iteration 0.
[I 2023-12-21 03:26:06,124] Trial 397 pruned. Trial was pruned at iteration 4.
[I 2023-12-21 03:26:06,175] Trial 398 pruned. Trial was pruned at iteration 0.
[I 2023-12-21 03:26:06,226] Trial 399 pruned. Trial was pruned at iteration 0.
[I 2023-12-21 03:26:06,276] Trial 400 pruned. Trial was pruned at iteration 0.
[I 2023-12-21 03:26:06,326] Trial 401 pruned. Trial was pruned at iteration 0.
[I 2023-12-21 03:26:06,376] Trial 402 pruned. Trial was pruned at iteration 0.
[I 2023-12-21 03:26:06,427] Trial 403 pruned. Trial was pruned at iteration 0.
[I 2023-12-21 03:26:06,479] Trial 404 pruned. Trial was pruned at iteration 0.
[I 2023-12-21 03:26:06,529] Trial 405 pruned. Trial was pruned at iteration 0.
[I 2023-12-21 03:26:11,433] Trial 406 finished with value: 4.231267101993949 and parameters: {'learning_rate': 0.09053464850080516, 'aft_                                                                     loss_distribution': 'logistic', 'aft_loss_distribution_scale': 0.6882507090634782, 'max_depth': 7, 'booster': 'dart', 'scale_pos_weight':                                                                      0.9136488621408775, 'alpha': 7.087479482239571, 'lambda': 8.755450249248177, 'eta': 0.34673282252943294, 'sampling_method': 'gradient_ba                                                                     sed', 'subsample': 0.2268445992815899, 'gamma': 2.0736354209301644}. Best is trial 34 with value: 4.15687381580361.
[I 2023-12-21 03:26:11,487] Trial 407 pruned. Trial was pruned at iteration 0.
[I 2023-12-21 03:26:11,539] Trial 408 pruned. Trial was pruned at iteration 0.
[I 2023-12-21 03:26:11,591] Trial 409 pruned. Trial was pruned at iteration 0.
[I 2023-12-21 03:26:14,363] Trial 410 finished with value: 4.270537646134723 and parameters: {'learning_rate': 0.12838725596677675, 'aft_                                                                     loss_distribution': 'logistic', 'aft_loss_distribution_scale': 0.7327702409678964, 'max_depth': 7, 'booster': 'dart', 'scale_pos_weight':                                                                      0.7597827964988171, 'alpha': 7.3771447176994815, 'lambda': 8.572271605105264, 'eta': 0.35296304589350713, 'sampling_method': 'gradient_b                                                                     ased', 'subsample': 0.20725236634496086, 'gamma': 2.261944686515462}. Best is trial 34 with value: 4.15687381580361.
