[I 2023-12-21 03:57:50,899] Trial 234 pruned. Trial was pruned at iteration 0.
[I 2023-12-21 03:57:51,019] Trial 235 pruned. Trial was pruned at iteration 3.
[I 2023-12-21 03:57:51,128] Trial 236 pruned. Trial was pruned at iteration 0.
[I 2023-12-21 03:57:51,241] Trial 237 pruned. Trial was pruned at iteration 1.
[I 2023-12-21 03:57:51,352] Trial 238 pruned. Trial was pruned at iteration 0.
[I 2023-12-21 03:57:52,276] Trial 239 finished with value: 1.9019994392813557 and parameters: {'learning_rate': 0.9686142315679367, 'aft_loss_distribution': 'normal', 'aft_loss_distribution_scale': 1.4352958309291783, 'max_depth': 4, 'booster': 'gbtree', 'scale_pos_weight': 1.227004035427651, 'alpha': 4.326106260709598, 'lambda': 7.5450374851796465, 'eta': 0.6710107212497518, 'sampling_method': 'gradient_based', 'subsample': 0.489817881693855, 'gamma': 8.03856812971349}. Best is trial 63 with value: 1.895409823674203.
[I 2023-12-21 03:57:52,396] Trial 240 pruned. Trial was pruned at iteration 0.
[I 2023-12-21 03:57:52,501] Trial 241 pruned. Trial was pruned at iteration 0.
[I 2023-12-21 03:57:52,865] Trial 242 finished with value: 1.9080531546163424 and parameters: {'learning_rate': 0.9808068498994756, 'aft_loss_distribution': 'normal', 'aft_loss_distribution_scale': 1.4627844318195755, 'max_depth': 4, 'booster': 'gbtree', 'scale_pos_weight': 1.2652361064463518, 'alpha': 4.532100869695793, 'lambda': 7.411749677745972, 'eta': 0.8166172776719298, 'sampling_method': 'gradient_based', 'subsample': 0.5242579139359007, 'gamma': 7.302509546452662}. Best is trial 63 with value: 1.895409823674203.
[I 2023-12-21 03:57:52,976] Trial 243 pruned. Trial was pruned at iteration 0.
[I 2023-12-21 03:57:53,089] Trial 244 pruned. Trial was pruned at iteration 1.
[I 2023-12-21 03:57:53,199] Trial 245 pruned. Trial was pruned at iteration 0.
[I 2023-12-21 03:57:53,307] Trial 246 pruned. Trial was pruned at iteration 0.
[I 2023-12-21 03:57:53,416] Trial 247 pruned. Trial was pruned at iteration 0.
[I 2023-12-21 03:57:53,529] Trial 248 pruned. Trial was pruned at iteration 1.
[I 2023-12-21 03:57:53,648] Trial 249 pruned. Trial was pruned at iteration 0.
Completed hyperparameter tuning with best aft-nloglik = 1.895409823674203.
Re-running the best trial... params = {'verbosity': 0, 'objective': 'survival:aft', 'eval_metric': 'aft-nloglik', 'tree_method': 'gpu_hist', 'device': 'cuda', 'learning_rate': 0.9218198595816247, 'aft_loss_distribution': 'normal', 'aft_loss_distribution_scale': 1.3639974279330234, 'max_depth': 3, 'booster': 'gbtree', 'scale_pos_weight': 2.0944532127699946, 'alpha': 4.4254780324081455, 'lambda': 7.805532930010817, 'eta': 0.695500926631871, 'sampling_method': 'gradient_based', 'subsample': 0.4613805321303713, 'gamma': 7.736122227426323}
[W 2023-12-21 03:57:54,068] Trial 1 is omitted in visualization because its objective value is inf or nan.
[W 2023-12-21 03:57:54,077] Trial 10 is omitted in visualization because its objective value is inf or nan.
[W 2023-12-21 03:57:54,080] Trial 13 is omitted in visualization because its objective value is inf or nan.
[W 2023-12-21 03:57:54,082] Trial 15 is omitted in visualization because its objective value is inf or nan.
[W 2023-12-21 03:57:54,086] Trial 22 is omitted in visualization because its objective value is inf or nan.
[W 2023-12-21 03:57:54,089] Trial 95 is omitted in visualization because its objective value is inf or nan.
[W 2023-12-21 03:57:54,090] Trial 105 is omitted in visualization because its objective value is inf or nan.
[W 2023-12-21 03:57:54,091] Trial 120 is omitted in visualization because its objective value is inf or nan.
[W 2023-12-21 03:57:54,096] Trial 127 is omitted in visualization because its objective value is inf or nan.
[W 2023-12-21 03:57:54,097] Trial 142 is omitted in visualization because its objective value is inf or nan.
[W 2023-12-21 03:57:54,098] Trial 176 is omitted in visualization because its objective value is inf or nan.
[W 2023-12-21 03:57:54,105] Trial 217 is omitted in visualization because its objective value is inf or nan.
[W 2023-12-21 03:57:54,106] Trial 221 is omitted in visualization because its objective value is inf or nan.
[W 2023-12-21 03:57:54,106] Trial 231 is omitted in visualization because its objective value is inf or nan.
TRN1 | R2:0.356; p:0.0 | C:71.25 |3h:0.952 |6h:0.940 |9h:0.931 |12h:0.728 |15h:0.728 |18h:0.724 |24h:0.568 |48h:0.559 |72h:0.553 |1wk:0.373 |2wks:0.368 |1mon:0.308 |
TRN2 | R2:0.317; p:6.596e-75 | C:69.29 |3h:0.951 |6h:0.940 |9h:0.931 |12h:0.727 |15h:0.727 |18h:0.722 |24h:0.566 |48h:0.556 |72h:0.551 |1wk:0.361 |2wks:0.365 |1mon:0.312 |
VAL | R2:0.271; p:3.217e-54 | C:66.41 |3h:0.950 |6h:0.939 |9h:0.930 |12h:0.726 |15h:0.726 |18h:0.722 |24h:0.566 |48h:0.557 |72h:0.550 |1wk:0.372 |2wks:0.367 |1mon:0.300 |
[I 2023-12-21 03:57:58,148] A new study created in memory with name: no-name-9d55dfa6-6a89-4ee5-abab-add9846f8e80
TST | R2:0.230; p:9.69e-232 | C:62.77 |3h:0.948 |6h:0.933 |9h:0.922 |12h:0.720 |15h:0.720 |18h:0.705 |24h:0.434 |48h:0.431 |72h:0.429 |1wk:0.339 |2wks:0.350 |1mon:0.308 |
/content/drive/MyDrive/intermediates2/res//outcome2_xgb-aft_inp22_k9_emb2_rdims8.json
Dimensionality reduced word embedding 3 with ['location_numeric', 'race_numeric', 'sex_numeric', 'body_part_numeric', 'product_1_numeric', 'product_2_numeric', 'drug_numeric', 'alcohol_numeric', 'month']
Dimensionality reduced word embedding 3 with ['location_numeric', 'race_numeric', 'sex_numeric', 'body_part_numeric', 'product_1_numeric', 'product_2_numeric', 'drug_numeric', 'alcohol_numeric', 'month']
Dimensionality reduced word embedding 3 with ['location_numeric', 'race_numeric', 'sex_numeric', 'body_part_numeric', 'product_1_numeric', 'product_2_numeric', 'drug_numeric', 'alcohol_numeric', 'month']
Dimensionality reduced word embedding 3 with ['location_numeric', 'race_numeric', 'sex_numeric', 'body_part_numeric', 'product_1_numeric', 'product_2_numeric', 'drug_numeric', 'alcohol_numeric', 'month']
trn1
trn2
val
tst
[I 2023-12-21 04:01:47,702] Trial 0 finished with value: 2.5513014627137705 and parameters: {'learning_rate': 0.035198767983339034, 'aft_loss_distribution': 'logistic', 'aft_loss_distribution_scale': 7.913432716375872, 'max_depth': 3, 'booster': 'dart', 'scale_pos_weight': 0.7732713716405286, 'alpha': 6.40976239501173, 'lambda': 6.374315584235637, 'eta': 0.12404566289674257, 'sampling_method': 'gradient_based', 'subsample': 0.863407255193294, 'gamma': 1.8665945381912965}. Best is trial 0 with value: 2.5513014627137705.
[I 2023-12-21 04:01:48,200] Trial 1 finished with value: 2.249445958687449 and parameters: {'learning_rate': 0.6323541867519854, 'aft_loss_distribution': 'normal', 'aft_loss_distribution_scale': 5.75836105551945, 'max_depth': 9, 'booster': 'gbtree', 'scale_pos_weight': 0.4452127434509539, 'alpha': 4.245240506070589, 'lambda': 7.342426220828673, 'eta': 0.3850282600588901, 'sampling_method': 'gradient_based', 'subsample': 0.6948038827769908, 'gamma': 1.957586887865624}. Best is trial 1 with value: 2.249445958687449.
[I 2023-12-21 04:01:48,446] Trial 2 finished with value: 2.0568863769875936 and parameters: {'learning_rate': 0.33539177533557407, 'aft_loss_distribution': 'logistic', 'aft_loss_distribution_scale': 1.808297147418617, 'max_depth': 9, 'booster': 'gbtree', 'scale_pos_weight': 1.406132249820757, 'alpha': 6.77933035631549, 'lambda': 9.532825028360426, 'eta': 0.7838469787319937, 'sampling_method': 'gradient_based', 'subsample': 0.8475021628067964, 'gamma': 2.780645208141101}. Best is trial 2 with value: 2.0568863769875936.
[I 2023-12-21 04:03:20,848] Trial 3 finished with value: 2.5958495712044822 and parameters: {'learning_rate': 0.6023312648216644, 'aft_loss_distribution': 'extreme', 'aft_loss_distribution_scale': 9.711771709780786, 'max_depth': 6, 'booster': 'dart', 'scale_pos_weight': 0.7419754156748224, 'alpha': 3.7901854584722465, 'lambda': 6.535862039381436, 'eta': 0.17488547840787105, 'sampling_method': 'uniform', 'subsample': 0.02366933184529807, 'gamma': 6.939723582779231}. Best is trial 2 with value: 2.0568863769875936.
[I 2023-12-21 04:03:21,494] Trial 4 finished with value: 2.3164680772791666 and parameters: {'learning_rate': 0.3381160587671144, 'aft_loss_distribution': 'extreme', 'aft_loss_distribution_scale': 4.894493321028004, 'max_depth': 5, 'booster': 'gbtree', 'scale_pos_weight': 0.8451889032344366, 'alpha': 9.458860421224545, 'lambda': 3.241791938704716, 'eta': 0.7835564564954095, 'sampling_method': 'uniform', 'subsample': 0.6542480868001024, 'gamma': 1.4497890828785278}. Best is trial 2 with value: 2.0568863769875936.
[I 2023-12-21 04:03:21,518] Trial 5 pruned. Trial was pruned at iteration 3.
[I 2023-12-21 04:03:21,657] Trial 6 finished with value: inf and parameters: {'learning_rate': 0.4827411853218359, 'aft_loss_distribution': 'normal', 'aft_loss_distribution_scale': 4.559157407657932, 'max_depth': 8, 'booster': 'gbtree', 'scale_pos_weight': 3.1181835484429348, 'alpha': 8.656816239718273, 'lambda': 1.936203797589394, 'eta': 0.02789408204361077, 'sampling_method': 'uniform', 'subsample': 0.13849474770615464, 'gamma': 9.101844980796413}. Best is trial 2 with value: 2.0568863769875936.
[I 2023-12-21 04:03:21,670] Trial 7 pruned. Trial was pruned at iteration 0.
[I 2023-12-21 04:03:21,694] Trial 8 pruned. Trial was pruned at iteration 5.
[I 2023-12-21 04:03:21,886] Trial 9 finished with value: inf and parameters: {'learning_rate': 0.9614475188798843, 'aft_loss_distribution': 'normal', 'aft_loss_distribution_scale': 1.4134814754885001, 'max_depth': 10, 'booster': 'gbtree', 'scale_pos_weight': 0.6119486178835185, 'alpha': 2.790963693699953, 'lambda': 8.775538850273591, 'eta': 0.6299745084116145, 'sampling_method': 'gradient_based', 'subsample': 0.5379646387401148, 'gamma': 1.802014397875482}. Best is trial 2 with value: 2.0568863769875936.
[I 2023-12-21 04:03:21,944] Trial 10 pruned. Trial was pruned at iteration 0.
[I 2023-12-21 04:03:22,257] Trial 11 finished with value: 2.1559946639526317 and parameters: {'learning_rate': 0.6298745633124898, 'aft_loss_distribution': 'logistic', 'aft_loss_distribution_scale': 2.5168761433360554, 'max_depth': 10, 'booster': 'gbtree', 'scale_pos_weight': 0.056924439199807775, 'alpha': 5.5650626661032625, 'lambda': 9.987493690611663, 'eta': 0.4621593849248481, 'sampling_method': 'gradient_based', 'subsample': 0.7432656522935921, 'gamma': 4.155714553955445}. Best is trial 2 with value: 2.0568863769875936.
[I 2023-12-21 04:03:22,560] Trial 12 finished with value: 2.142377097274819 and parameters: {'learning_rate': 0.4527487101451028, 'aft_loss_distribution': 'logistic', 'aft_loss_distribution_scale': 2.409981704850841, 'max_depth': 10, 'booster': 'gbtree', 'scale_pos_weight': 0.040963420495078395, 'alpha': 6.201699581674006, 'lambda': 9.53796996888038, 'eta': 0.622646404341702, 'sampling_method': 'gradient_based', 'subsample': 0.7646870088941604, 'gamma': 4.2143421329214386}. Best is trial 2 with value: 2.0568863769875936.
[I 2023-12-21 04:03:22,917] Trial 13 finished with value: 2.1881202237144324 and parameters: {'learning_rate': 0.43081792083529225, 'aft_loss_distribution': 'logistic', 'aft_loss_distribution_scale': 2.7790260019253017, 'max_depth': 8, 'booster': 'gbtree', 'scale_pos_weight': 3.678768849589395, 'alpha': 7.250218602396081, 'lambda': 4.959646980699483, 'eta': 0.6587858092049478, 'sampling_method': 'gradient_based', 'subsample': 0.8089509874948829, 'gamma': 5.742027807523}. Best is trial 2 with value: 2.0568863769875936.
[I 2023-12-21 04:03:22,966] Trial 14 pruned. Trial was pruned at iteration 0.
[I 2023-12-21 04:03:23,025] Trial 15 pruned. Trial was pruned at iteration 0.
[I 2023-12-21 04:03:23,073] Trial 16 pruned. Trial was pruned at iteration 0.
[I 2023-12-21 04:03:23,120] Trial 17 pruned. Trial was pruned at iteration 0.
[I 2023-12-21 04:03:23,182] Trial 18 pruned. Trial was pruned at iteration 0.
[I 2023-12-21 04:03:23,254] Trial 19 pruned. Trial was pruned at iteration 0.
[I 2023-12-21 04:03:23,332] Trial 20 pruned. Trial was pruned at iteration 0.
[I 2023-12-21 04:03:23,726] Trial 21 finished with value: 2.122700394602226 and parameters: {'learning_rate': 0.6609587768065854, 'aft_loss_distribution': 'logistic', 'aft_loss_distribution_scale': 2.25332023352708, 'max_depth': 10, 'booster': 'gbtree', 'scale_pos_weight': 0.062192025595277776, 'alpha': 5.4632881906699104, 'lambda': 9.720461339260984, 'eta': 0.4341576521431884, 'sampling_method': 'gradient_based', 'subsample': 0.7129585809750765, 'gamma': 4.49312543249658}. Best is trial 2 with value: 2.0568863769875936.
[I 2023-12-21 04:03:24,327] Trial 22 finished with value: 2.0854949127461553 and parameters: {'learning_rate': 0.3624113128751851, 'aft_loss_distribution': 'logistic', 'aft_loss_distribution_scale': 1.994243824329745, 'max_depth': 10, 'booster': 'gbtree', 'scale_pos_weight': 0.33518929053540114, 'alpha': 5.30918029354077, 'lambda': 9.977683664417729, 'eta': 0.30256757829598524, 'sampling_method': 'gradient_based', 'subsample': 0.6438045516287826, 'gamma': 4.768190538493999}. Best is trial 2 with value: 2.0568863769875936.
[I 2023-12-21 04:03:24,778] Trial 23 finished with value: 1.945173535493124 and parameters: {'learning_rate': 0.35394142314807836, 'aft_loss_distribution': 'logistic', 'aft_loss_distribution_scale': 1.0835625711033972, 'max_depth': 10, 'booster': 'gbtree', 'scale_pos_weight': 0.39862907374815065, 'alpha': 4.927850667964412, 'lambda': 8.373732899251046, 'eta': 0.2768900388706088, 'sampling_method': 'gradient_based', 'subsample': 0.567118078139447, 'gamma': 5.681750195553128}. Best is trial 23 with value: 1.945173535493124.
[I 2023-12-21 04:03:24,853] Trial 24 pruned. Trial was pruned at iteration 0.
[I 2023-12-21 04:03:24,930] Trial 25 pruned. Trial was pruned at iteration 0.
[I 2023-12-21 04:03:25,003] Trial 26 pruned. Trial was pruned at iteration 0.
[I 2023-12-21 04:03:25,401] Trial 27 finished with value: inf and parameters: {'learning_rate': 0.5391265873778237, 'aft_loss_distribution': 'logistic', 'aft_loss_distribution_scale': 2.0417825533470793, 'max_depth': 9, 'booster': 'gbtree', 'scale_pos_weight': 0.4827448179840442, 'alpha': 7.312263937516716, 'lambda': 6.794078139323548, 'eta': 0.13850841180273765, 'sampling_method': 'gradient_based', 'subsample': 0.2918675577072054, 'gamma': 3.0409894978875722}. Best is trial 23 with value: 1.945173535493124.
[I 2023-12-21 04:03:25,475] Trial 28 pruned. Trial was pruned at iteration 0.
[I 2023-12-21 04:03:25,560] Trial 29 pruned. Trial was pruned at iteration 0.
[I 2023-12-21 04:03:25,645] Trial 30 pruned. Trial was pruned at iteration 0.
[I 2023-12-21 04:03:26,045] Trial 31 finished with value: 2.0913948160668037 and parameters: {'learning_rate': 0.3747768403666325, 'aft_loss_distribution': 'logistic', 'aft_loss_distribution_scale': 2.042973229564607, 'max_depth': 10, 'booster': 'gbtree', 'scale_pos_weight': 0.2762145600925264, 'alpha': 5.68324644170842, 'lambda': 9.622552964852616, 'eta': 0.3897197414123573, 'sampling_method': 'gradient_based', 'subsample': 0.6958257144978806, 'gamma': 4.9970811217413065}. Best is trial 23 with value: 1.945173535493124.
[I 2023-12-21 04:03:26,139] Trial 32 pruned. Trial was pruned at iteration 0.
[I 2023-12-21 04:03:26,518] Trial 33 finished with value: 1.9262084836928193 and parameters: {'learning_rate': 0.2698460768658498, 'aft_loss_distribution': 'logistic', 'aft_loss_distribution_scale': 0.9348772595504804, 'max_depth': 10, 'booster': 'gbtree', 'scale_pos_weight': 0.37808919013959164, 'alpha': 4.838703365709726, 'lambda': 8.052740263666706, 'eta': 0.4146709789609123, 'sampling_method': 'gradient_based', 'subsample': 0.5480248965278236, 'gamma': 3.7342369176997536}. Best is trial 33 with value: 1.9262084836928193.
[I 2023-12-21 04:03:26,977] Trial 34 finished with value: 1.9294404534012823 and parameters: {'learning_rate': 0.26664026078413133, 'aft_loss_distribution': 'logistic', 'aft_loss_distribution_scale': 0.9750853222004575, 'max_depth': 9, 'booster': 'gbtree', 'scale_pos_weight': 0.8113186947587394, 'alpha': 4.433238632091141, 'lambda': 6.996882728838938, 'eta': 0.22596870703800287, 'sampling_method': 'gradient_based', 'subsample': 0.5361477346465937, 'gamma': 3.7762538085122346}. Best is trial 33 with value: 1.9262084836928193.
[I 2023-12-21 04:03:27,075] Trial 35 pruned. Trial was pruned at iteration 0.
[I 2023-12-21 04:03:27,167] Trial 36 pruned. Trial was pruned at iteration 0.
[I 2023-12-21 04:03:27,263] Trial 37 pruned. Trial was pruned at iteration 0.
[I 2023-12-21 04:03:27,363] Trial 38 pruned. Trial was pruned at iteration 0.
[I 2023-12-21 04:03:27,442] Trial 39 pruned. Trial was pruned at iteration 0.
[I 2023-12-21 04:03:27,519] Trial 40 pruned. Trial was pruned at iteration 0.
[I 2023-12-21 04:03:28,021] Trial 41 finished with value: 2.03134914055586 and parameters: {'learning_rate': 0.4743278917789161, 'aft_loss_distribution': 'logistic', 'aft_loss_distribution_scale': 1.6594466459782238, 'max_depth': 10, 'booster': 'gbtree', 'scale_pos_weight': 0.4302830847130828, 'alpha': 3.9140081959005113, 'lambda': 8.746133347373926, 'eta': 0.33691585497630294, 'sampling_method': 'gradient_based', 'subsample': 0.6362399854989189, 'gamma': 5.1815684946238}. Best is trial 33 with value: 1.9262084836928193.
[I 2023-12-21 04:03:28,392] Trial 42 finished with value: 1.9974013824046823 and parameters: {'learning_rate': 0.4961224299393275, 'aft_loss_distribution': 'logistic', 'aft_loss_distribution_scale': 1.4366900831365057, 'max_depth': 10, 'booster': 'gbtree', 'scale_pos_weight': 0.4815078372359124, 'alpha': 3.9166498397379037, 'lambda': 7.915228512024993, 'eta': 0.34882803952241037, 'sampling_method': 'gradient_based', 'subsample': 0.5758679424243212, 'gamma': 6.648125376237214}. Best is trial 33 with value: 1.9262084836928193.
[I 2023-12-21 04:03:28,706] Trial 43 finished with value: 1.9971688658460403 and parameters: {'learning_rate': 0.5692015943840243, 'aft_loss_distribution': 'logistic', 'aft_loss_distribution_scale': 1.4249972856353121, 'max_depth': 10, 'booster': 'gbtree', 'scale_pos_weight': 0.42588408400989863, 'alpha': 3.8444213849680917, 'lambda': 7.827212479663129, 'eta': 0.3504768211547882, 'sampling_method': 'gradient_based', 'subsample': 0.567597441919865, 'gamma': 7.8840204590612775}. Best is trial 33 with value: 1.9262084836928193.
[I 2023-12-21 04:03:28,762] Trial 44 pruned. Trial was pruned at iteration 0.
[I 2023-12-21 04:03:28,819] Trial 45 pruned. Trial was pruned at iteration 0.
[I 2023-12-21 04:03:28,878] Trial 46 pruned. Trial was pruned at iteration 0.
[I 2023-12-21 04:03:28,927] Trial 47 pruned. Trial was pruned at iteration 0.
[I 2023-12-21 04:03:28,978] Trial 48 pruned. Trial was pruned at iteration 0.
[I 2023-12-21 04:03:29,032] Trial 49 pruned. Trial was pruned at iteration 0.
[I 2023-12-21 04:03:29,379] Trial 50 finished with value: 2.008061787039754 and parameters: {'learning_rate': 0.4439118752641264, 'aft_loss_distribution': 'logistic', 'aft_loss_distribution_scale': 1.5049579969062106, 'max_depth': 10, 'booster': 'gbtree', 'scale_pos_weight': 0.17055082405612731, 'alpha': 1.4939192056511676, 'lambda': 5.621630281420307, 'eta': 0.0808670057977986, 'sampling_method': 'gradient_based', 'subsample': 0.6027391062697458, 'gamma': 7.8081116606613}. Best is trial 33 with value: 1.9262084836928193.
[I 2023-12-21 04:03:29,716] Trial 51 finished with value: 2.0102582354748293 and parameters: {'learning_rate': 0.4359905669956601, 'aft_loss_distribution': 'logistic', 'aft_loss_distribution_scale': 1.533962418398875, 'max_depth': 10, 'booster': 'gbtree', 'scale_pos_weight': 0.19589337552369857, 'alpha': 0.856637550460887, 'lambda': 4.371726411687455, 'eta': 0.04326376912325796, 'sampling_method': 'gradient_based', 'subsample': 0.6140317426259968, 'gamma': 7.7535010248315706}. Best is trial 33 with value: 1.9262084836928193.
[I 2023-12-21 04:03:29,774] Trial 52 pruned. Trial was pruned at iteration 0.
[I 2023-12-21 04:03:29,832] Trial 53 pruned. Trial was pruned at iteration 0.
[I 2023-12-21 04:03:29,894] Trial 54 pruned. Trial was pruned at iteration 1.
[I 2023-12-21 04:03:30,194] Trial 55 finished with value: 2.034175101721725 and parameters: {'learning_rate': 0.4596125045928378, 'aft_loss_distribution': 'logistic', 'aft_loss_distribution_scale': 1.666551884442422, 'max_depth': 10, 'booster': 'gbtree', 'scale_pos_weight': 0.5509953261494975, 'alpha': 4.355543355591511, 'lambda': 7.872521221641132, 'eta': 0.2347929905793485, 'sampling_method': 'gradient_based', 'subsample': 0.45355171956907425, 'gamma': 8.110580790331333}. Best is trial 33 with value: 1.9262084836928193.
[I 2023-12-21 04:03:30,254] Trial 56 pruned. Trial was pruned at iteration 0.
[I 2023-12-21 04:03:30,320] Trial 57 pruned. Trial was pruned at iteration 0.
[I 2023-12-21 04:03:30,375] Trial 58 pruned. Trial was pruned at iteration 0.
[I 2023-12-21 04:03:30,427] Trial 59 pruned. Trial was pruned at iteration 0.
[I 2023-12-21 04:03:30,492] Trial 60 pruned. Trial was pruned at iteration 0.
[I 2023-12-21 04:03:30,781] Trial 61 finished with value: 2.014729462227102 and parameters: {'learning_rate': 0.4389581749992705, 'aft_loss_distribution': 'logistic', 'aft_loss_distribution_scale': 1.559210075740765, 'max_depth': 10, 'booster': 'gbtree', 'scale_pos_weight': 0.2000369090227917, 'alpha': 0.5823446851090108, 'lambda': 3.9758770776194616, 'eta': 0.08174667733481875, 'sampling_method': 'gradient_based', 'subsample': 0.6077728333464542, 'gamma': 7.785668637561864}. Best is trial 33 with value: 1.9262084836928193.
[I 2023-12-21 04:03:30,837] Trial 62 pruned. Trial was pruned at iteration 0.
