[I 2023-12-21 04:05:50,803] Trial 3 finished with value: 2.295074857205388 and parameters: {'learning_rate': 0.9591838448423883, 'aft_los                                                                     s_distribution': 'extreme', 'aft_loss_distribution_scale': 3.6444542011343803, 'max_depth': 8, 'booster': 'dart', 'scale_pos_weight': 2.0                                                                     56647079815823, 'alpha': 9.125969875166588, 'lambda': 1.012594817510488, 'eta': 0.25709174569556936, 'sampling_method': 'uniform', 'subsa                                                                     mple': 0.8901048867102702, 'gamma': 6.643306612886738}. Best is trial 3 with value: 2.295074857205388.
[I 2023-12-21 04:05:51,006] Trial 4 finished with value: inf and parameters: {'learning_rate': 0.8757676256639647, 'aft_loss_distribution                                                                     ': 'extreme', 'aft_loss_distribution_scale': 0.4023365678129439, 'max_depth': 10, 'booster': 'gbtree', 'scale_pos_weight': 2.146317732453                                                                     8187, 'alpha': 8.165264784458433, 'lambda': 5.380439779905331, 'eta': 0.6632106351520073, 'sampling_method': 'uniform', 'subsample': 0.37                                                                     1927508453384, 'gamma': 1.816927616078168}. Best is trial 3 with value: 2.295074857205388.
[I 2023-12-21 04:05:51,012] Trial 5 pruned. Trial was pruned at iteration 0.
[I 2023-12-21 04:05:51,017] Trial 6 pruned. Trial was pruned at iteration 0.
[I 2023-12-21 04:05:51,022] Trial 7 pruned. Trial was pruned at iteration 0.
[I 2023-12-21 04:05:52,210] Trial 8 finished with value: inf and parameters: {'learning_rate': 0.8664682252595403, 'aft_loss_distribution                                                                     ': 'normal', 'aft_loss_distribution_scale': 1.4196855324092401, 'max_depth': 3, 'booster': 'dart', 'scale_pos_weight': 1.4730534092066658                                                                     , 'alpha': 8.818885294682643, 'lambda': 2.005752577664762, 'eta': 0.4327126848525802, 'sampling_method': 'uniform', 'subsample': 0.895067                                                                     8771568223, 'gamma': 5.2333894882600545}. Best is trial 3 with value: 2.295074857205388.
[I 2023-12-21 04:05:52,327] Trial 9 finished with value: 2.1987964565327016 and parameters: {'learning_rate': 0.35437275249372757, 'aft_l                                                                     oss_distribution': 'normal', 'aft_loss_distribution_scale': 3.5287033255452225, 'max_depth': 4, 'booster': 'gbtree', 'scale_pos_weight':                                                                      2.107528984238355, 'alpha': 8.847093175058665, 'lambda': 3.830624456446845, 'eta': 0.5165263707313987, 'sampling_method': 'uniform', 'sub                                                                     sample': 0.05507524849621543, 'gamma': 8.617780343828452}. Best is trial 9 with value: 2.1987964565327016.
[I 2023-12-21 04:05:52,357] Trial 10 pruned. Trial was pruned at iteration 1.
[I 2023-12-21 04:05:53,954] Trial 11 finished with value: inf and parameters: {'learning_rate': 0.997690956739429, 'aft_loss_distribution                                                                     ': 'normal', 'aft_loss_distribution_scale': 3.5809057116911682, 'max_depth': 5, 'booster': 'dart', 'scale_pos_weight': 2.613500253670746,                                                                      'alpha': 5.883059069047199, 'lambda': 0.03758040649276506, 'eta': 0.24696690329040766, 'sampling_method': 'uniform', 'subsample': 0.9163                                                                     260159678822, 'gamma': 8.537684375924066}. Best is trial 9 with value: 2.1987964565327016.
[I 2023-12-21 04:05:53,983] Trial 12 pruned. Trial was pruned at iteration 0.
[I 2023-12-21 04:05:54,012] Trial 13 pruned. Trial was pruned at iteration 0.
[I 2023-12-21 04:05:54,041] Trial 14 pruned. Trial was pruned at iteration 1.
[I 2023-12-21 04:05:54,069] Trial 15 pruned. Trial was pruned at iteration 0.
[I 2023-12-21 04:05:54,097] Trial 16 pruned. Trial was pruned at iteration 0.
[I 2023-12-21 04:05:54,128] Trial 17 pruned. Trial was pruned at iteration 2.
[I 2023-12-21 04:05:54,256] Trial 18 finished with value: inf and parameters: {'learning_rate': 0.6624333046126232, 'aft_loss_distributio                                                                     n': 'normal', 'aft_loss_distribution_scale': 2.7673916189835794, 'max_depth': 4, 'booster': 'gbtree', 'scale_pos_weight': 1.6706952299300                                                                     524, 'alpha': 9.49366468611372, 'lambda': 4.1805609188191015, 'eta': 0.17257863402931672, 'sampling_method': 'gradient_based', 'subsample                                                                     ': 0.1752859669297257, 'gamma': 8.951779741269561}. Best is trial 9 with value: 2.1987964565327016.
[I 2023-12-21 04:05:54,284] Trial 19 pruned. Trial was pruned at iteration 0.
[I 2023-12-21 04:05:54,314] Trial 20 pruned. Trial was pruned at iteration 0.
[I 2023-12-21 04:05:54,345] Trial 21 pruned. Trial was pruned at iteration 0.
[I 2023-12-21 04:05:54,374] Trial 22 pruned. Trial was pruned at iteration 0.
[I 2023-12-21 04:05:54,404] Trial 23 pruned. Trial was pruned at iteration 0.
[I 2023-12-21 04:05:54,434] Trial 24 pruned. Trial was pruned at iteration 1.
[I 2023-12-21 04:05:54,465] Trial 25 pruned. Trial was pruned at iteration 0.
[I 2023-12-21 04:05:54,496] Trial 26 pruned. Trial was pruned at iteration 0.
[I 2023-12-21 04:05:54,525] Trial 27 pruned. Trial was pruned at iteration 0.
[I 2023-12-21 04:05:54,556] Trial 28 pruned. Trial was pruned at iteration 0.
[I 2023-12-21 04:05:54,588] Trial 29 pruned. Trial was pruned at iteration 1.
[I 2023-12-21 04:05:54,619] Trial 30 pruned. Trial was pruned at iteration 0.
[I 2023-12-21 04:05:54,651] Trial 31 pruned. Trial was pruned at iteration 0.
[I 2023-12-21 04:05:54,683] Trial 32 pruned. Trial was pruned at iteration 0.
[I 2023-12-21 04:05:54,715] Trial 33 pruned. Trial was pruned at iteration 0.
[I 2023-12-21 04:05:54,746] Trial 34 pruned. Trial was pruned at iteration 0.
[I 2023-12-21 04:05:54,777] Trial 35 pruned. Trial was pruned at iteration 0.
[I 2023-12-21 04:05:54,810] Trial 36 pruned. Trial was pruned at iteration 1.
[I 2023-12-21 04:05:54,842] Trial 37 pruned. Trial was pruned at iteration 0.
[I 2023-12-21 04:05:54,877] Trial 38 pruned. Trial was pruned at iteration 2.
[I 2023-12-21 04:05:54,908] Trial 39 pruned. Trial was pruned at iteration 0.
[I 2023-12-21 04:05:54,939] Trial 40 pruned. Trial was pruned at iteration 0.
[I 2023-12-21 04:05:54,971] Trial 41 pruned. Trial was pruned at iteration 0.
[I 2023-12-21 04:05:55,003] Trial 42 pruned. Trial was pruned at iteration 0.
[I 2023-12-21 04:05:55,036] Trial 43 pruned. Trial was pruned at iteration 0.
[I 2023-12-21 04:05:55,073] Trial 44 pruned. Trial was pruned at iteration 0.
[I 2023-12-21 04:05:55,108] Trial 45 pruned. Trial was pruned at iteration 1.
[I 2023-12-21 04:05:55,140] Trial 46 pruned. Trial was pruned at iteration 0.
[I 2023-12-21 04:05:55,173] Trial 47 pruned. Trial was pruned at iteration 0.
[I 2023-12-21 04:06:01,578] Trial 48 finished with value: 2.0492560613644684 and parameters: {'learning_rate': 0.5262392283960621, 'aft_l                                                                     oss_distribution': 'normal', 'aft_loss_distribution_scale': 2.320573663405127, 'max_depth': 6, 'booster': 'dart', 'scale_pos_weight': 2.7                                                                     488865607799124, 'alpha': 7.2412676208192455, 'lambda': 0.3083665926791521, 'eta': 0.16822605495215248, 'sampling_method': 'uniform', 'su                                                                     bsample': 0.829400526639153, 'gamma': 3.372885107569528}. Best is trial 48 with value: 2.0492560613644684.
[I 2023-12-21 04:06:01,615] Trial 49 pruned. Trial was pruned at iteration 1.
[I 2023-12-21 04:06:01,649] Trial 50 pruned. Trial was pruned at iteration 0.
[I 2023-12-21 04:06:03,912] Trial 51 finished with value: 2.048305402870044 and parameters: {'learning_rate': 0.7381849612505453, 'aft_lo                                                                     ss_distribution': 'normal', 'aft_loss_distribution_scale': 2.254462356724967, 'max_depth': 5, 'booster': 'dart', 'scale_pos_weight': 2.77                                                                     0220842560718, 'alpha': 9.477902287515402, 'lambda': 0.4207013804930762, 'eta': 0.1358981487095247, 'sampling_method': 'uniform', 'subsam                                                                     ple': 0.8675278023545948, 'gamma': 2.0103420267991288}. Best is trial 51 with value: 2.048305402870044.
[I 2023-12-21 04:06:05,080] Trial 52 finished with value: inf and parameters: {'learning_rate': 0.7916229833991031, 'aft_loss_distributio                                                                     n': 'normal', 'aft_loss_distribution_scale': 2.025127854431992, 'max_depth': 5, 'booster': 'dart', 'scale_pos_weight': 3.079719227082653,                                                                      'alpha': 9.468129448200925, 'lambda': 1.084567693412414, 'eta': 0.14346605424624684, 'sampling_method': 'uniform', 'subsample': 0.829300                                                                     8484680436, 'gamma': 1.7986530346479106}. Best is trial 51 with value: 2.048305402870044.
[I 2023-12-21 04:06:06,313] Trial 53 finished with value: inf and parameters: {'learning_rate': 0.7469355393380624, 'aft_loss_distributio                                                                     n': 'normal', 'aft_loss_distribution_scale': 2.405134942267487, 'max_depth': 5, 'booster': 'dart', 'scale_pos_weight': 2.768391039484747,                                                                      'alpha': 8.589202007097557, 'lambda': 0.5169212804210953, 'eta': 0.19299734131686555, 'sampling_method': 'uniform', 'subsample': 0.92574                                                                     57134365024, 'gamma': 1.0728370607728657}. Best is trial 51 with value: 2.048305402870044.
[I 2023-12-21 04:06:06,354] Trial 54 pruned. Trial was pruned at iteration 2.
[I 2023-12-21 04:06:06,389] Trial 55 pruned. Trial was pruned at iteration 1.
[I 2023-12-21 04:06:06,423] Trial 56 pruned. Trial was pruned at iteration 0.
[I 2023-12-21 04:06:06,456] Trial 57 pruned. Trial was pruned at iteration 0.
[I 2023-12-21 04:06:07,598] Trial 58 finished with value: inf and parameters: {'learning_rate': 0.8363122914153908, 'aft_loss_distributio                                                                     n': 'normal', 'aft_loss_distribution_scale': 2.6311522409669617, 'max_depth': 6, 'booster': 'dart', 'scale_pos_weight': 2.018420301479063                                                                     4, 'alpha': 8.429236477893893, 'lambda': 1.9092852180406337, 'eta': 0.23110556024337606, 'sampling_method': 'uniform', 'subsample': 0.955                                                                     0800987742414, 'gamma': 4.025890061740632}. Best is trial 51 with value: 2.048305402870044.
[I 2023-12-21 04:06:07,633] Trial 59 pruned. Trial was pruned at iteration 0.
[I 2023-12-21 04:06:07,669] Trial 60 pruned. Trial was pruned at iteration 1.
[I 2023-12-21 04:06:07,702] Trial 61 pruned. Trial was pruned at iteration 0.
[I 2023-12-21 04:06:07,823] Trial 62 finished with value: 2.1179122771376475 and parameters: {'learning_rate': 0.5983381837105213, 'aft_l                                                                     oss_distribution': 'normal', 'aft_loss_distribution_scale': 2.9865127923636328, 'max_depth': 9, 'booster': 'gbtree', 'scale_pos_weight':                                                                      2.9580736954011764, 'alpha': 0.34756668061318163, 'lambda': 0.7654533085343325, 'eta': 0.1601581036213846, 'sampling_method': 'uniform',                                                                      'subsample': 0.9057448445004838, 'gamma': 6.809132755469663}. Best is trial 51 with value: 2.048305402870044.
[I 2023-12-21 04:06:07,887] Trial 63 pruned. Trial was pruned at iteration 3.
[I 2023-12-21 04:06:07,920] Trial 64 pruned. Trial was pruned at iteration 0.
[I 2023-12-21 04:06:07,953] Trial 65 pruned. Trial was pruned at iteration 0.
[I 2023-12-21 04:06:07,988] Trial 66 pruned. Trial was pruned at iteration 0.
[I 2023-12-21 04:06:08,023] Trial 67 pruned. Trial was pruned at iteration 1.
[I 2023-12-21 04:06:08,056] Trial 68 pruned. Trial was pruned at iteration 0.
[I 2023-12-21 04:06:08,089] Trial 69 pruned. Trial was pruned at iteration 0.
[I 2023-12-21 04:06:08,122] Trial 70 pruned. Trial was pruned at iteration 0.
[I 2023-12-21 04:06:08,155] Trial 71 pruned. Trial was pruned at iteration 0.
[I 2023-12-21 04:06:08,199] Trial 72 pruned. Trial was pruned at iteration 2.
[I 2023-12-21 04:06:08,234] Trial 73 pruned. Trial was pruned at iteration 0.
[I 2023-12-21 04:06:08,269] Trial 74 pruned. Trial was pruned at iteration 0.
[I 2023-12-21 04:06:08,305] Trial 75 pruned. Trial was pruned at iteration 0.
[I 2023-12-21 04:06:08,338] Trial 76 pruned. Trial was pruned at iteration 0.
[I 2023-12-21 04:06:08,372] Trial 77 pruned. Trial was pruned at iteration 0.
[I 2023-12-21 04:06:08,407] Trial 78 pruned. Trial was pruned at iteration 0.
[I 2023-12-21 04:06:08,442] Trial 79 pruned. Trial was pruned at iteration 1.
[I 2023-12-21 04:06:08,475] Trial 80 pruned. Trial was pruned at iteration 0.
[I 2023-12-21 04:06:08,509] Trial 81 pruned. Trial was pruned at iteration 0.
[I 2023-12-21 04:06:08,543] Trial 82 pruned. Trial was pruned at iteration 0.
[I 2023-12-21 04:06:08,577] Trial 83 pruned. Trial was pruned at iteration 0.
[I 2023-12-21 04:06:08,612] Trial 84 pruned. Trial was pruned at iteration 0.
[I 2023-12-21 04:06:08,651] Trial 85 pruned. Trial was pruned at iteration 0.
[I 2023-12-21 04:06:08,686] Trial 86 pruned. Trial was pruned at iteration 0.
[I 2023-12-21 04:06:08,726] Trial 87 pruned. Trial was pruned at iteration 2.
[I 2023-12-21 04:06:08,760] Trial 88 pruned. Trial was pruned at iteration 0.
[I 2023-12-21 04:06:08,794] Trial 89 pruned. Trial was pruned at iteration 0.
[I 2023-12-21 04:06:08,829] Trial 90 pruned. Trial was pruned at iteration 0.
[I 2023-12-21 04:06:11,247] Trial 91 finished with value: 1.9797987126443772 and parameters: {'learning_rate': 0.8439195432401831, 'aft_l                                                                     oss_distribution': 'normal', 'aft_loss_distribution_scale': 1.4265458617848117, 'max_depth': 3, 'booster': 'dart', 'scale_pos_weight': 1.                                                                     4582325519089334, 'alpha': 9.424095489152906, 'lambda': 8.529910832398654, 'eta': 0.2759226559323351, 'sampling_method': 'uniform', 'subs                                                                     ample': 0.9568892452647084, 'gamma': 5.820984290567696}. Best is trial 91 with value: 1.9797987126443772.
[I 2023-12-21 04:06:22,908] Trial 92 finished with value: 1.9817770886298083 and parameters: {'learning_rate': 0.8494300274477186, 'aft_l                                                                     oss_distribution': 'normal', 'aft_loss_distribution_scale': 1.331114622375232, 'max_depth': 3, 'booster': 'dart', 'scale_pos_weight': 1.4                                                                     17594107532581, 'alpha': 9.39262033369368, 'lambda': 8.153487420912242, 'eta': 0.7406002155178901, 'sampling_method': 'uniform', 'subsamp                                                                     le': 0.9394979736580478, 'gamma': 5.7951314486397845}. Best is trial 91 with value: 1.9797987126443772.
[I 2023-12-21 04:06:22,945] Trial 93 pruned. Trial was pruned at iteration 0.
[I 2023-12-21 04:06:24,945] Trial 94 finished with value: 2.0429801490176427 and parameters: {'learning_rate': 0.8522085129865014, 'aft_l                                                                     oss_distribution': 'normal', 'aft_loss_distribution_scale': 2.2325901870310547, 'max_depth': 3, 'booster': 'dart', 'scale_pos_weight': 1.                                                                     3407618725140642, 'alpha': 9.091508246988758, 'lambda': 8.665913322889757, 'eta': 0.9121653589520313, 'sampling_method': 'uniform', 'subs                                                                     ample': 0.9314268106685066, 'gamma': 5.681384380092255}. Best is trial 91 with value: 1.9797987126443772.
[I 2023-12-21 04:06:26,934] Trial 95 finished with value: inf and parameters: {'learning_rate': 0.8564641818988485, 'aft_loss_distributio                                                                     n': 'normal', 'aft_loss_distribution_scale': 1.8810761961248033, 'max_depth': 3, 'booster': 'dart', 'scale_pos_weight': 1.331697234814597                                                                     2, 'alpha': 9.092087874757533, 'lambda': 8.505913755877915, 'eta': 0.9010809956042624, 'sampling_method': 'uniform', 'subsample': 0.93747                                                                     31523812119, 'gamma': 4.555109209032484}. Best is trial 91 with value: 1.9797987126443772.
[I 2023-12-21 04:06:29,146] Trial 96 finished with value: 2.045112990378003 and parameters: {'learning_rate': 0.8255416023774457, 'aft_lo                                                                     ss_distribution': 'normal', 'aft_loss_distribution_scale': 2.2435823315173207, 'max_depth': 3, 'booster': 'dart', 'scale_pos_weight': 1.3                                                                     664396533151169, 'alpha': 9.741189968413911, 'lambda': 9.113862101190604, 'eta': 0.9823473987647887, 'sampling_method': 'uniform', 'subsa                                                                     mple': 0.8856706355118912, 'gamma': 5.831089096013874}. Best is trial 91 with value: 1.9797987126443772.
[I 2023-12-21 04:06:32,729] Trial 97 finished with value: 2.0399698705512344 and parameters: {'learning_rate': 0.9146991825219948, 'aft_l                                                                     oss_distribution': 'normal', 'aft_loss_distribution_scale': 2.1732649371433164, 'max_depth': 3, 'booster': 'dart', 'scale_pos_weight': 1.                                                                     5138896781253548, 'alpha': 9.76474125940656, 'lambda': 9.05186025387918, 'eta': 0.9876738414543306, 'sampling_method': 'uniform', 'subsam                                                                     ple': 0.8782631914128758, 'gamma': 5.774928582355427}. Best is trial 91 with value: 1.9797987126443772.
[I 2023-12-21 04:06:36,272] Trial 98 finished with value: 2.0440911032280566 and parameters: {'learning_rate': 0.912265378505986, 'aft_lo                                                                     ss_distribution': 'normal', 'aft_loss_distribution_scale': 2.2278744819595744, 'max_depth': 3, 'booster': 'dart', 'scale_pos_weight': 1.2                                                                     645432682795195, 'alpha': 9.714443106798349, 'lambda': 9.127718619145362, 'eta': 0.999027844564337, 'sampling_method': 'uniform', 'subsam                                                                     ple': 0.8791110216098134, 'gamma': 5.727674494041851}. Best is trial 91 with value: 1.9797987126443772.
[I 2023-12-21 04:06:39,883] Trial 99 finished with value: 2.0413226150548356 and parameters: {'learning_rate': 0.9223826172596491, 'aft_l                                                                     oss_distribution': 'normal', 'aft_loss_distribution_scale': 2.1959992376623183, 'max_depth': 3, 'booster': 'dart', 'scale_pos_weight': 1.                                                                     4645702164342795, 'alpha': 9.996575629965067, 'lambda': 9.250863547466343, 'eta': 0.9947999629720133, 'sampling_method': 'uniform', 'subs                                                                     ample': 0.8809932170877425, 'gamma': 5.5953801184355125}. Best is trial 91 with value: 1.9797987126443772.
[I 2023-12-21 04:06:50,500] Trial 100 finished with value: 2.039053563164677 and parameters: {'learning_rate': 0.911051494299433, 'aft_lo                                                                     ss_distribution': 'normal', 'aft_loss_distribution_scale': 2.192563670095366, 'max_depth': 3, 'booster': 'dart', 'scale_pos_weight': 1.45                                                                     55299946889235, 'alpha': 9.768234506809598, 'lambda': 9.169328843042935, 'eta': 0.9925741605398681, 'sampling_method': 'uniform', 'subsam                                                                     ple': 0.8862472209882704, 'gamma': 5.647436968886813}. Best is trial 91 with value: 1.9797987126443772.
[I 2023-12-21 04:06:54,109] Trial 101 finished with value: 2.0420396446846354 and parameters: {'learning_rate': 0.9144882791462657, 'aft_                                                                     loss_distribution': 'normal', 'aft_loss_distribution_scale': 2.2032418601518655, 'max_depth': 3, 'booster': 'dart', 'scale_pos_weight': 1                                                                     .452582688451319, 'alpha': 9.778516611986248, 'lambda': 9.118798399781651, 'eta': 0.9818868517465863, 'sampling_method': 'uniform', 'subs                                                                     ample': 0.884529053854265, 'gamma': 5.6710519655759315}. Best is trial 91 with value: 1.9797987126443772.
[I 2023-12-21 04:06:55,237] Trial 102 pruned. Trial was pruned at iteration 55.
[I 2023-12-21 04:06:55,271] Trial 103 pruned. Trial was pruned at iteration 0.
