[I 2023-12-19 00:33:45,351] Trial 499 pruned. Trial was pruned at iteration 0.
Completed hyperparameter tuning with best aft-nloglik = 2.011360552718656.
Re-running the best trial... params = {'verbosity': 0, 'objective': 'survival:aft', 'eval_metric': 'aft-nloglik', 'tree_method': 'gpu_hist', 'device': 'cuda', 'learning_rate': 0.9788072325122262, 'aft_loss_distribution': 'normal', 'aft_loss_distribution_scale': 1.4866282139726859, 'max_depth': 4, 'booster': 'dart', 'scale_pos_weight': 2.5953692877936376, 'alpha': 1.0838402052810734, 'lambda': 6.706594271079635, 'eta': 0.5621400219463027, 'sampling_method': 'gradient_based', 'subsample': 0.8346844234191396, 'gamma': 6.672464019481194}
[W 2023-12-19 00:33:48,017] Trial 2 is omitted in visualization because its objective value is inf or nan.
[W 2023-12-19 00:33:48,020] Trial 3 is omitted in visualization because its objective value is inf or nan.
[W 2023-12-19 00:33:48,024] Trial 15 is omitted in visualization because its objective value is inf or nan.
[W 2023-12-19 00:33:48,028] Trial 16 is omitted in visualization because its objective value is inf or nan.
[W 2023-12-19 00:33:48,031] Trial 18 is omitted in visualization because its objective value is inf or nan.
[W 2023-12-19 00:33:48,034] Trial 22 is omitted in visualization because its objective value is inf or nan.
[W 2023-12-19 00:33:48,036] Trial 65 is omitted in visualization because its objective value is inf or nan.
[W 2023-12-19 00:33:48,037] Trial 75 is omitted in visualization because its objective value is inf or nan.
[W 2023-12-19 00:33:48,040] Trial 77 is omitted in visualization because its objective value is inf or nan.
[W 2023-12-19 00:33:48,040] Trial 82 is omitted in visualization because its objective value is inf or nan.
[W 2023-12-19 00:33:48,044] Trial 101 is omitted in visualization because its objective value is inf or nan.
[W 2023-12-19 00:33:48,045] Trial 113 is omitted in visualization because its objective value is inf or nan.
[W 2023-12-19 00:33:48,046] Trial 114 is omitted in visualization because its objective value is inf or nan.
[W 2023-12-19 00:33:48,047] Trial 135 is omitted in visualization because its objective value is inf or nan.
[W 2023-12-19 00:33:48,051] Trial 141 is omitted in visualization because its objective value is inf or nan.
[W 2023-12-19 00:33:48,052] Trial 142 is omitted in visualization because its objective value is inf or nan.
[W 2023-12-19 00:33:48,053] Trial 143 is omitted in visualization because its objective value is inf or nan.
[W 2023-12-19 00:33:48,054] Trial 145 is omitted in visualization because its objective value is inf or nan.
[W 2023-12-19 00:33:48,055] Trial 151 is omitted in visualization because its objective value is inf or nan.
[W 2023-12-19 00:33:48,056] Trial 152 is omitted in visualization because its objective value is inf or nan.
[W 2023-12-19 00:33:48,057] Trial 170 is omitted in visualization because its objective value is inf or nan.
[W 2023-12-19 00:33:48,061] Trial 173 is omitted in visualization because its objective value is inf or nan.
[W 2023-12-19 00:33:48,062] Trial 184 is omitted in visualization because its objective value is inf or nan.
[W 2023-12-19 00:33:48,063] Trial 191 is omitted in visualization because its objective value is inf or nan.
[W 2023-12-19 00:33:48,064] Trial 197 is omitted in visualization because its objective value is inf or nan.
[W 2023-12-19 00:33:48,064] Trial 211 is omitted in visualization because its objective value is inf or nan.
[W 2023-12-19 00:33:48,068] Trial 212 is omitted in visualization because its objective value is inf or nan.
[W 2023-12-19 00:33:48,069] Trial 214 is omitted in visualization because its objective value is inf or nan.
[W 2023-12-19 00:33:48,070] Trial 215 is omitted in visualization because its objective value is inf or nan.
[W 2023-12-19 00:33:48,071] Trial 218 is omitted in visualization because its objective value is inf or nan.
[W 2023-12-19 00:33:48,072] Trial 231 is omitted in visualization because its objective value is inf or nan.
[W 2023-12-19 00:33:48,073] Trial 235 is omitted in visualization because its objective value is inf or nan.
[W 2023-12-19 00:33:48,075] Trial 239 is omitted in visualization because its objective value is inf or nan.
[W 2023-12-19 00:33:48,076] Trial 241 is omitted in visualization because its objective value is inf or nan.
[W 2023-12-19 00:33:48,077] Trial 243 is omitted in visualization because its objective value is inf or nan.
[W 2023-12-19 00:33:48,078] Trial 266 is omitted in visualization because its objective value is inf or nan.
[W 2023-12-19 00:33:48,079] Trial 270 is omitted in visualization because its objective value is inf or nan.
[W 2023-12-19 00:33:48,080] Trial 279 is omitted in visualization because its objective value is inf or nan.
[W 2023-12-19 00:33:48,081] Trial 286 is omitted in visualization because its objective value is inf or nan.
[W 2023-12-19 00:33:48,082] Trial 295 is omitted in visualization because its objective value is inf or nan.
[W 2023-12-19 00:33:48,083] Trial 304 is omitted in visualization because its objective value is inf or nan.
[W 2023-12-19 00:33:48,084] Trial 366 is omitted in visualization because its objective value is inf or nan.
[W 2023-12-19 00:33:48,085] Trial 377 is omitted in visualization because its objective value is inf or nan.
[W 2023-12-19 00:33:48,086] Trial 399 is omitted in visualization because its objective value is inf or nan.
[W 2023-12-19 00:33:48,087] Trial 422 is omitted in visualization because its objective value is inf or nan.
[W 2023-12-19 00:33:48,088] Trial 424 is omitted in visualization because its objective value is inf or nan.
[W 2023-12-19 00:33:48,095] Trial 427 is omitted in visualization because its objective value is inf or nan.
[W 2023-12-19 00:33:48,096] Trial 432 is omitted in visualization because its objective value is inf or nan.
[W 2023-12-19 00:33:48,097] Trial 433 is omitted in visualization because its objective value is inf or nan.
[W 2023-12-19 00:33:48,098] Trial 434 is omitted in visualization because its objective value is inf or nan.
[W 2023-12-19 00:33:48,099] Trial 435 is omitted in visualization because its objective value is inf or nan.
[W 2023-12-19 00:33:48,100] Trial 437 is omitted in visualization because its objective value is inf or nan.
[W 2023-12-19 00:33:48,101] Trial 439 is omitted in visualization because its objective value is inf or nan.
[W 2023-12-19 00:33:48,102] Trial 441 is omitted in visualization because its objective value is inf or nan.
[W 2023-12-19 00:33:48,103] Trial 442 is omitted in visualization because its objective value is inf or nan.
[W 2023-12-19 00:33:48,104] Trial 443 is omitted in visualization because its objective value is inf or nan.
[W 2023-12-19 00:33:48,105] Trial 444 is omitted in visualization because its objective value is inf or nan.
[W 2023-12-19 00:33:48,106] Trial 445 is omitted in visualization because its objective value is inf or nan.
[W 2023-12-19 00:33:48,107] Trial 451 is omitted in visualization because its objective value is inf or nan.
[W 2023-12-19 00:33:48,108] Trial 456 is omitted in visualization because its objective value is inf or nan.
[W 2023-12-19 00:33:48,109] Trial 457 is omitted in visualization because its objective value is inf or nan.
[W 2023-12-19 00:33:48,110] Trial 458 is omitted in visualization because its objective value is inf or nan.
[W 2023-12-19 00:33:48,111] Trial 460 is omitted in visualization because its objective value is inf or nan.
[W 2023-12-19 00:33:48,112] Trial 462 is omitted in visualization because its objective value is inf or nan.
[W 2023-12-19 00:33:48,113] Trial 463 is omitted in visualization because its objective value is inf or nan.
[W 2023-12-19 00:33:48,114] Trial 465 is omitted in visualization because its objective value is inf or nan.
[W 2023-12-19 00:33:48,115] Trial 466 is omitted in visualization because its objective value is inf or nan.
[W 2023-12-19 00:33:48,116] Trial 468 is omitted in visualization because its objective value is inf or nan.
[W 2023-12-19 00:33:48,117] Trial 470 is omitted in visualization because its objective value is inf or nan.
[W 2023-12-19 00:33:48,118] Trial 472 is omitted in visualization because its objective value is inf or nan.
[W 2023-12-19 00:33:48,119] Trial 474 is omitted in visualization because its objective value is inf or nan.
[W 2023-12-19 00:33:48,120] Trial 475 is omitted in visualization because its objective value is inf or nan.
[W 2023-12-19 00:33:48,121] Trial 480 is omitted in visualization because its objective value is inf or nan.
[W 2023-12-19 00:33:48,122] Trial 482 is omitted in visualization because its objective value is inf or nan.
[W 2023-12-19 00:33:48,123] Trial 483 is omitted in visualization because its objective value is inf or nan.
[W 2023-12-19 00:33:48,124] Trial 485 is omitted in visualization because its objective value is inf or nan.
[W 2023-12-19 00:33:48,125] Trial 486 is omitted in visualization because its objective value is inf or nan.
[W 2023-12-19 00:33:48,126] Trial 487 is omitted in visualization because its objective value is inf or nan.
[W 2023-12-19 00:33:48,127] Trial 490 is omitted in visualization because its objective value is inf or nan.
[W 2023-12-19 00:33:48,128] Trial 495 is omitted in visualization because its objective value is inf or nan.
TRN1 | R2:0.225; p:1.267e-73 | C:63.92 |3h:0.960 |6h:0.948 |9h:0.941 |12h:0.733 |15h:0.733 |18h:0.730 |24h:0.576 |48h:0.568 |72h:0.560 |1wk:0.380 |2wks:0.375 |1mon:0.328 |
TRN2 | R2:0.147; p:1.01e-31 | C:59.46 |3h:0.959 |6h:0.948 |9h:0.940 |12h:0.733 |15h:0.733 |18h:0.729 |24h:0.575 |48h:0.568 |72h:0.559 |1wk:0.383 |2wks:0.374 |1mon:0.326 |
VAL | R2:0.173; p:1.062e-43 | C:60.78 |3h:0.960 |6h:0.948 |9h:0.940 |12h:0.733 |15h:0.733 |18h:0.730 |24h:0.575 |48h:0.568 |72h:0.559 |1wk:0.384 |2wks:0.374 |1mon:0.326 |
TST | R2:0.092; p:7.891e-38 | C:55.47 |3h:0.954 |6h:0.939 |9h:0.929 |12h:0.727 |15h:0.727 |18h:0.711 |24h:0.442 |48h:0.441 |72h:0.437 |1wk:0.349 |2wks:0.356 |1mon:0.327 |
/content/drive/MyDrive/intermediates2/res//outcome2_xgb-aft_inp22_k3_emb2_rdims8.json
Dimensionality reduced word embedding 3 with ['location_numeric', 'race_numeric', 'sex_numeric']
Dimensionality reduced word embedding 3 with ['location_numeric', 'race_numeric', 'sex_numeric']
Dimensionality reduced word embedding 3 with ['location_numeric', 'race_numeric', 'sex_numeric']
Dimensionality reduced word embedding 3 with ['location_numeric', 'race_numeric', 'sex_numeric']
trn1
trn2
val
[I 2023-12-19 00:33:54,214] A new study created in memory with name: no-name-6f744e50-bf9f-48d2-9534-33759a04c369
tst
[I 2023-12-19 00:33:54,426] Trial 0 finished with value: inf and parameters: {'learning_rate': 0.3750783558222364, 'aft_loss_distribution': 'normal', 'aft_loss_distribution_scale': 1.2434109571466998, 'max_depth': 4, 'booster': 'gbtree', 'scale_pos_weight': 1.245066828702417, 'alpha': 5.19685237832946, 'lambda': 9.040173505776362, 'eta': 0.8673121569649863, 'sampling_method': 'gradient_based', 'subsample': 0.6798626872378931, 'gamma': 7.360581269215445}. Best is trial 0 with value: inf.
[I 2023-12-19 00:33:54,810] Trial 1 finished with value: 2.543243797147736 and parameters: {'learning_rate': 0.40673132205821644, 'aft_loss_distribution': 'normal', 'aft_loss_distribution_scale': 9.828007635407419, 'max_depth': 10, 'booster': 'gbtree', 'scale_pos_weight': 1.18780819987053, 'alpha': 2.6717190976262755, 'lambda': 9.777430515942534, 'eta': 0.03753021786915456, 'sampling_method': 'gradient_based', 'subsample': 0.2848609918825944, 'gamma': 1.473861948072859}. Best is trial 1 with value: 2.543243797147736.
[I 2023-12-19 00:33:55,009] Trial 2 finished with value: inf and parameters: {'learning_rate': 0.710813829715641, 'aft_loss_distribution': 'logistic', 'aft_loss_distribution_scale': 7.287900869122626, 'max_depth': 9, 'booster': 'gbtree', 'scale_pos_weight': 1.8266294332810176, 'alpha': 8.17730519360715, 'lambda': 1.2908703991795027, 'eta': 0.423592999126041, 'sampling_method': 'gradient_based', 'subsample': 0.6318358074858873, 'gamma': 8.511789485373647}. Best is trial 1 with value: 2.543243797147736.
[I 2023-12-19 00:33:55,844] Trial 3 finished with value: 2.078958584481772 and parameters: {'learning_rate': 0.016387014352356778, 'aft_loss_distribution': 'logistic', 'aft_loss_distribution_scale': 1.3102656075476695, 'max_depth': 3, 'booster': 'gbtree', 'scale_pos_weight': 2.358133266079609, 'alpha': 4.883199127866903, 'lambda': 5.346698364524596, 'eta': 0.7582613491388842, 'sampling_method': 'gradient_based', 'subsample': 0.45241065308127454, 'gamma': 4.628584405703903}. Best is trial 3 with value: 2.078958584481772.
[I 2023-12-19 00:34:33,502] Trial 4 finished with value: 2.541819693074717 and parameters: {'learning_rate': 0.2626513414434464, 'aft_loss_distribution': 'extreme', 'aft_loss_distribution_scale': 6.8580490160438226, 'max_depth': 9, 'booster': 'dart', 'scale_pos_weight': 2.749492290284237, 'alpha': 8.360925835535541, 'lambda': 9.844781841347425, 'eta': 0.8740193150102429, 'sampling_method': 'gradient_based', 'subsample': 0.31975613732096125, 'gamma': 1.4241151790487818}. Best is trial 3 with value: 2.078958584481772.
[I 2023-12-19 00:34:35,507] Trial 5 finished with value: inf and parameters: {'learning_rate': 0.6173792730625114, 'aft_loss_distribution': 'normal', 'aft_loss_distribution_scale': 6.973679351680421, 'max_depth': 10, 'booster': 'dart', 'scale_pos_weight': 1.4284808008046117, 'alpha': 1.0759460234784504, 'lambda': 0.8717263447772738, 'eta': 0.5418225483284878, 'sampling_method': 'uniform', 'subsample': 0.25548625691685234, 'gamma': 1.701747060035987}. Best is trial 3 with value: 2.078958584481772.
[I 2023-12-19 00:34:35,538] Trial 6 pruned. Trial was pruned at iteration 2.
[I 2023-12-19 00:34:35,568] Trial 7 pruned. Trial was pruned at iteration 2.
[I 2023-12-19 00:34:35,667] Trial 8 pruned. Trial was pruned at iteration 9.
[I 2023-12-19 00:34:40,238] Trial 9 pruned. Trial was pruned at iteration 97.
[I 2023-12-19 00:34:40,301] Trial 10 pruned. Trial was pruned at iteration 0.
[I 2023-12-19 00:34:40,353] Trial 11 pruned. Trial was pruned at iteration 0.
[I 2023-12-19 00:34:40,407] Trial 12 pruned. Trial was pruned at iteration 0.
[I 2023-12-19 00:34:40,665] Trial 13 finished with value: inf and parameters: {'learning_rate': 0.9316292526871935, 'aft_loss_distribution': 'extreme', 'aft_loss_distribution_scale': 5.38081609360493, 'max_depth': 5, 'booster': 'gbtree', 'scale_pos_weight': 2.3040019081968, 'alpha': 4.7525736388916995, 'lambda': 5.138245875414645, 'eta': 0.9884681791350496, 'sampling_method': 'gradient_based', 'subsample': 0.14734614750830294, 'gamma': 6.362919500924278}. Best is trial 3 with value: 2.078958584481772.
[I 2023-12-19 00:34:40,722] Trial 14 pruned. Trial was pruned at iteration 0.
[I 2023-12-19 00:34:40,776] Trial 15 pruned. Trial was pruned at iteration 0.
[I 2023-12-19 00:34:40,828] Trial 16 pruned. Trial was pruned at iteration 0.
[I 2023-12-19 00:34:40,888] Trial 17 pruned. Trial was pruned at iteration 0.
[I 2023-12-19 00:34:40,945] Trial 18 pruned. Trial was pruned at iteration 0.
[I 2023-12-19 00:34:41,002] Trial 19 pruned. Trial was pruned at iteration 0.
[I 2023-12-19 00:34:41,060] Trial 20 pruned. Trial was pruned at iteration 0.
[I 2023-12-19 00:34:41,244] Trial 21 pruned. Trial was pruned at iteration 33.
[I 2023-12-19 00:34:41,303] Trial 22 pruned. Trial was pruned at iteration 0.
[I 2023-12-19 00:34:41,467] Trial 23 pruned. Trial was pruned at iteration 35.
[I 2023-12-19 00:34:41,530] Trial 24 pruned. Trial was pruned at iteration 0.
[I 2023-12-19 00:34:41,890] Trial 25 finished with value: inf and parameters: {'learning_rate': 0.5460301274785664, 'aft_loss_distribution': 'normal', 'aft_loss_distribution_scale': 3.1637096312005424, 'max_depth': 8, 'booster': 'gbtree', 'scale_pos_weight': 1.5784233894969875, 'alpha': 4.266297922286196, 'lambda': 6.274176972250114, 'eta': 0.8155151844016106, 'sampling_method': 'gradient_based', 'subsample': 0.12484156622904993, 'gamma': 0.9119977401932113}. Best is trial 3 with value: 2.078958584481772.
[I 2023-12-19 00:34:41,949] Trial 26 pruned. Trial was pruned at iteration 0.
[I 2023-12-19 00:34:42,003] Trial 27 pruned. Trial was pruned at iteration 0.
[I 2023-12-19 00:34:42,066] Trial 28 pruned. Trial was pruned at iteration 0.
[I 2023-12-19 00:34:42,122] Trial 29 pruned. Trial was pruned at iteration 0.
[I 2023-12-19 00:34:42,781] Trial 30 finished with value: 2.2572347705992137 and parameters: {'learning_rate': 0.3954960967386456, 'aft_loss_distribution': 'normal', 'aft_loss_distribution_scale': 4.338275286613335, 'max_depth': 6, 'booster': 'gbtree', 'scale_pos_weight': 0.6972893789772021, 'alpha': 4.692618960114597, 'lambda': 8.865437503044259, 'eta': 0.6094981422341614, 'sampling_method': 'gradient_based', 'subsample': 0.4054636460368294, 'gamma': 7.022085269013007}. Best is trial 3 with value: 2.078958584481772.
[I 2023-12-19 00:34:43,151] Trial 31 finished with value: 2.238661881901326 and parameters: {'learning_rate': 0.34855533913346815, 'aft_loss_distribution': 'normal', 'aft_loss_distribution_scale': 4.086890877313582, 'max_depth': 6, 'booster': 'gbtree', 'scale_pos_weight': 0.7066576920237666, 'alpha': 4.726804689812869, 'lambda': 9.097067540254484, 'eta': 0.638192319058947, 'sampling_method': 'gradient_based', 'subsample': 0.4908230714853621, 'gamma': 7.321132023759047}. Best is trial 3 with value: 2.078958584481772.
[I 2023-12-19 00:34:43,398] Trial 32 finished with value: 2.23032505586402 and parameters: {'learning_rate': 0.35276274883645414, 'aft_loss_distribution': 'normal', 'aft_loss_distribution_scale': 3.9712004058846455, 'max_depth': 6, 'booster': 'gbtree', 'scale_pos_weight': 0.7653944723511742, 'alpha': 4.890998531781977, 'lambda': 8.5186670158482, 'eta': 0.6505866380205091, 'sampling_method': 'gradient_based', 'subsample': 0.4780041689053291, 'gamma': 7.5146526259407125}. Best is trial 3 with value: 2.078958584481772.
[I 2023-12-19 00:34:43,647] Trial 33 finished with value: 2.2417039568483883 and parameters: {'learning_rate': 0.3786785459472109, 'aft_loss_distribution': 'normal', 'aft_loss_distribution_scale': 4.115124956781609, 'max_depth': 6, 'booster': 'gbtree', 'scale_pos_weight': 0.6539126290761108, 'alpha': 4.603590654095852, 'lambda': 7.879595474867362, 'eta': 0.6278998164904882, 'sampling_method': 'gradient_based', 'subsample': 0.6731587270108708, 'gamma': 7.216746994070264}. Best is trial 3 with value: 2.078958584481772.
[I 2023-12-19 00:34:43,715] Trial 34 pruned. Trial was pruned at iteration 0.
[I 2023-12-19 00:34:43,962] Trial 35 finished with value: 2.1353193903415275 and parameters: {'learning_rate': 0.5244631064612052, 'aft_loss_distribution': 'normal', 'aft_loss_distribution_scale': 2.8910124747554526, 'max_depth': 6, 'booster': 'gbtree', 'scale_pos_weight': 0.7453788532817489, 'alpha': 4.918080485583906, 'lambda': 6.796949334740287, 'eta': 0.6877510596479494, 'sampling_method': 'gradient_based', 'subsample': 0.65377585023706, 'gamma': 8.826877051714003}. Best is trial 3 with value: 2.078958584481772.
[I 2023-12-19 00:34:44,359] Trial 36 finished with value: 2.1302714540823118 and parameters: {'learning_rate': 0.5775121869239955, 'aft_loss_distribution': 'normal', 'aft_loss_distribution_scale': 2.8529630758252402, 'max_depth': 4, 'booster': 'gbtree', 'scale_pos_weight': 0.03731634304730602, 'alpha': 5.424457501396555, 'lambda': 5.320060827147826, 'eta': 0.6981775977753252, 'sampling_method': 'gradient_based', 'subsample': 0.4848281867666641, 'gamma': 8.67114483793235}. Best is trial 3 with value: 2.078958584481772.
[I 2023-12-19 00:34:44,634] Trial 37 finished with value: 2.1364418833138 and parameters: {'learning_rate': 0.7496551416177598, 'aft_loss_distribution': 'normal', 'aft_loss_distribution_scale': 2.9070607560106834, 'max_depth': 3, 'booster': 'gbtree', 'scale_pos_weight': 0.09483008278311167, 'alpha': 5.289293172842845, 'lambda': 5.3747065143100885, 'eta': 0.6991609556506346, 'sampling_method': 'uniform', 'subsample': 0.6254166791091575, 'gamma': 8.950294421063594}. Best is trial 3 with value: 2.078958584481772.
[I 2023-12-19 00:34:44,815] Trial 38 finished with value: inf and parameters: {'learning_rate': 0.7730021577515505, 'aft_loss_distribution': 'normal', 'aft_loss_distribution_scale': 1.2406354503816626, 'max_depth': 3, 'booster': 'gbtree', 'scale_pos_weight': 0.17718826258525977, 'alpha': 7.455043733097449, 'lambda': 4.703830523799241, 'eta': 0.696312736856884, 'sampling_method': 'uniform', 'subsample': 0.797583759226772, 'gamma': 8.575320574722847}. Best is trial 3 with value: 2.078958584481772.
[I 2023-12-19 00:34:45,095] Trial 39 finished with value: 2.125581200230482 and parameters: {'learning_rate': 0.5791552953788427, 'aft_loss_distribution': 'normal', 'aft_loss_distribution_scale': 2.7910515210670566, 'max_depth': 4, 'booster': 'gbtree', 'scale_pos_weight': 0.09828131900836423, 'alpha': 6.371591445963243, 'lambda': 5.503575185026553, 'eta': 0.5546559334128547, 'sampling_method': 'uniform', 'subsample': 0.6251520621802495, 'gamma': 9.938575572436765}. Best is trial 3 with value: 2.078958584481772.
[I 2023-12-19 00:34:45,157] Trial 40 pruned. Trial was pruned at iteration 0.
[I 2023-12-19 00:34:45,444] Trial 41 finished with value: 2.1303475526720344 and parameters: {'learning_rate': 0.7425583922196752, 'aft_loss_distribution': 'normal', 'aft_loss_distribution_scale': 2.843331061804726, 'max_depth': 4, 'booster': 'gbtree', 'scale_pos_weight': 0.0649432132293226, 'alpha': 5.892801584881152, 'lambda': 5.449019069687629, 'eta': 0.7854893338601278, 'sampling_method': 'uniform', 'subsample': 0.627083259669117, 'gamma': 8.92873580216343}. Best is trial 3 with value: 2.078958584481772.
