[I 2023-12-18 23:05:07,227] Trial 362 finished with value: inf and parameters: {'learning_rate': 0.9507970762335625, 'aft_loss_distribution': 'normal', 'aft_loss_distribution_scale': 1.1105386545875644, 'max_depth': 6, 'booster': 'dart', 'scale_pos_weight': 0.9130937509575917, 'alpha': 4.604636545177446, 'lambda': 6.0622667508080035, 'eta': 0.9377864011984415, 'sampling_method': 'uniform', 'subsample': 0.7669242151376027, 'gamma': 8.721845879965619}. Best is trial 333 with value: 4.264499999089825.
[I 2023-12-18 23:05:07,312] Trial 363 pruned. Trial was pruned at iteration 1.
[I 2023-12-18 23:05:07,390] Trial 364 pruned. Trial was pruned at iteration 1.
[I 2023-12-18 23:05:08,821] Trial 365 finished with value: inf and parameters: {'learning_rate': 0.8934412412200008, 'aft_loss_distribution': 'normal', 'aft_loss_distribution_scale': 0.9698928121456816, 'max_depth': 6, 'booster': 'dart', 'scale_pos_weight': 0.732314216505984, 'alpha': 4.542684110427296, 'lambda': 0.9732505403130025, 'eta': 0.9549912634490162, 'sampling_method': 'uniform', 'subsample': 0.7400957311451659, 'gamma': 8.870627884856235}. Best is trial 333 with value: 4.264499999089825.
[I 2023-12-18 23:05:08,903] Trial 366 pruned. Trial was pruned at iteration 0.
[I 2023-12-18 23:05:10,187] Trial 367 finished with value: inf and parameters: {'learning_rate': 0.9265420712786296, 'aft_loss_distribution': 'normal', 'aft_loss_distribution_scale': 1.0515655572585643, 'max_depth': 5, 'booster': 'dart', 'scale_pos_weight': 1.3646638237728892, 'alpha': 5.383160555598095, 'lambda': 9.263231874380333, 'eta': 0.9602999258244154, 'sampling_method': 'uniform', 'subsample': 0.7775861953037718, 'gamma': 8.221265683818732}. Best is trial 333 with value: 4.264499999089825.
[I 2023-12-18 23:05:10,273] Trial 368 pruned. Trial was pruned at iteration 1.
[I 2023-12-18 23:05:10,356] Trial 369 pruned. Trial was pruned at iteration 2.
[I 2023-12-18 23:05:10,435] Trial 370 pruned. Trial was pruned at iteration 1.
[I 2023-12-18 23:05:10,531] Trial 371 pruned. Trial was pruned at iteration 3.
[I 2023-12-18 23:05:12,401] Trial 372 finished with value: inf and parameters: {'learning_rate': 0.9732960727285622, 'aft_loss_distribution': 'normal', 'aft_loss_distribution_scale': 1.1528816569738813, 'max_depth': 6, 'booster': 'dart', 'scale_pos_weight': 0.6330386878712141, 'alpha': 6.095119724307215, 'lambda': 0.4573950960413359, 'eta': 0.8735388404418494, 'sampling_method': 'uniform', 'subsample': 0.829424143435971, 'gamma': 8.870299623795624}. Best is trial 333 with value: 4.264499999089825.
[I 2023-12-18 23:05:12,488] Trial 373 pruned. Trial was pruned at iteration 1.
[I 2023-12-18 23:05:12,564] Trial 374 pruned. Trial was pruned at iteration 0.
[I 2023-12-18 23:05:12,650] Trial 375 pruned. Trial was pruned at iteration 0.
[I 2023-12-18 23:05:12,727] Trial 376 pruned. Trial was pruned at iteration 0.
[I 2023-12-18 23:05:14,547] Trial 377 finished with value: inf and parameters: {'learning_rate': 0.9323200124777261, 'aft_loss_distribution': 'normal', 'aft_loss_distribution_scale': 1.2691322842889523, 'max_depth': 6, 'booster': 'dart', 'scale_pos_weight': 1.6759040871738924, 'alpha': 4.765792021093813, 'lambda': 0.5580190155617646, 'eta': 0.9076204497352626, 'sampling_method': 'uniform', 'subsample': 0.8179880900069, 'gamma': 9.249583067639252}. Best is trial 333 with value: 4.264499999089825.
[I 2023-12-18 23:05:14,632] Trial 378 pruned. Trial was pruned at iteration 0.
[I 2023-12-18 23:05:14,713] Trial 379 pruned. Trial was pruned at iteration 0.
[I 2023-12-18 23:05:18,623] Trial 380 finished with value: 4.2647946438264945 and parameters: {'learning_rate': 0.9214889063141031, 'aft_loss_distribution': 'normal', 'aft_loss_distribution_scale': 1.0726403629354035, 'max_depth': 6, 'booster': 'dart', 'scale_pos_weight': 1.9056912552280671, 'alpha': 6.340658227998393, 'lambda': 0.18892474869103543, 'eta': 0.8606888552637799, 'sampling_method': 'uniform', 'subsample': 0.7895616495356677, 'gamma': 9.46456881555089}. Best is trial 333 with value: 4.264499999089825.
[I 2023-12-18 23:05:18,770] Trial 381 pruned. Trial was pruned at iteration 1.
[I 2023-12-18 23:05:21,838] Trial 382 finished with value: 4.271680681794091 and parameters: {'learning_rate': 0.9580076162098209, 'aft_loss_distribution': 'normal', 'aft_loss_distribution_scale': 1.140923998281454, 'max_depth': 5, 'booster': 'dart', 'scale_pos_weight': 1.828941395925215, 'alpha': 6.492912046235726, 'lambda': 3.2746873331064106, 'eta': 0.8572411043773812, 'sampling_method': 'uniform', 'subsample': 0.7815224036229955, 'gamma': 9.269519148921844}. Best is trial 333 with value: 4.264499999089825.
[I 2023-12-18 23:05:21,924] Trial 383 pruned. Trial was pruned at iteration 0.
[I 2023-12-18 23:05:26,880] Trial 384 finished with value: 4.278460713321212 and parameters: {'learning_rate': 0.9511100649195314, 'aft_loss_distribution': 'normal', 'aft_loss_distribution_scale': 1.1855430746460172, 'max_depth': 5, 'booster': 'dart', 'scale_pos_weight': 1.6987974332920197, 'alpha': 6.240854719604105, 'lambda': 3.435557996646521, 'eta': 0.8547323645768815, 'sampling_method': 'uniform', 'subsample': 0.7870006733692676, 'gamma': 9.282527509985478}. Best is trial 333 with value: 4.264499999089825.
[I 2023-12-18 23:05:26,966] Trial 385 pruned. Trial was pruned at iteration 0.
[I 2023-12-18 23:05:30,044] Trial 386 finished with value: 4.27112527676559 and parameters: {'learning_rate': 0.9298541329319977, 'aft_loss_distribution': 'normal', 'aft_loss_distribution_scale': 1.1360906178376617, 'max_depth': 5, 'booster': 'dart', 'scale_pos_weight': 1.486147748483762, 'alpha': 6.022112030327986, 'lambda': 3.8319773427242536, 'eta': 0.8913656914228557, 'sampling_method': 'uniform', 'subsample': 0.7515239334883014, 'gamma': 9.297783169107047}. Best is trial 333 with value: 4.264499999089825.
[I 2023-12-18 23:05:30,130] Trial 387 pruned. Trial was pruned at iteration 1.
[I 2023-12-18 23:05:34,151] Trial 388 finished with value: 4.266729240050941 and parameters: {'learning_rate': 0.937728777804113, 'aft_loss_distribution': 'normal', 'aft_loss_distribution_scale': 1.0826084588879576, 'max_depth': 5, 'booster': 'dart', 'scale_pos_weight': 1.8232569631588456, 'alpha': 5.77718477721595, 'lambda': 3.9454541571305937, 'eta': 0.8979474595187903, 'sampling_method': 'uniform', 'subsample': 0.726237140968595, 'gamma': 9.544848396368078}. Best is trial 333 with value: 4.264499999089825.
[I 2023-12-18 23:05:35,727] Trial 389 finished with value: inf and parameters: {'learning_rate': 0.9325801920910262, 'aft_loss_distribution': 'normal', 'aft_loss_distribution_scale': 0.9022552876044818, 'max_depth': 5, 'booster': 'dart', 'scale_pos_weight': 1.608096328948193, 'alpha': 5.680967859479518, 'lambda': 3.623837465758405, 'eta': 0.9021712401703522, 'sampling_method': 'uniform', 'subsample': 0.7267893707683457, 'gamma': 9.627450625270475}. Best is trial 333 with value: 4.264499999089825.
[I 2023-12-18 23:05:35,815] Trial 390 pruned. Trial was pruned at iteration 1.
[I 2023-12-18 23:05:35,901] Trial 391 pruned. Trial was pruned at iteration 0.
[I 2023-12-18 23:05:35,985] Trial 392 pruned. Trial was pruned at iteration 0.
[I 2023-12-18 23:05:36,075] Trial 393 pruned. Trial was pruned at iteration 1.
[I 2023-12-18 23:05:36,161] Trial 394 pruned. Trial was pruned at iteration 0.
[I 2023-12-18 23:05:43,976] Trial 395 finished with value: 4.2874817967935765 and parameters: {'learning_rate': 0.9801465938930561, 'aft_loss_distribution': 'normal', 'aft_loss_distribution_scale': 1.233846126481814, 'max_depth': 5, 'booster': 'dart', 'scale_pos_weight': 1.9340855745346472, 'alpha': 5.81850690474543, 'lambda': 4.361579732001073, 'eta': 0.9682789804332144, 'sampling_method': 'uniform', 'subsample': 0.7306490449728718, 'gamma': 9.413639795204057}. Best is trial 333 with value: 4.264499999089825.
[I 2023-12-18 23:05:44,077] Trial 396 pruned. Trial was pruned at iteration 1.
[I 2023-12-18 23:05:44,163] Trial 397 pruned. Trial was pruned at iteration 1.
[I 2023-12-18 23:05:46,603] Trial 398 finished with value: inf and parameters: {'learning_rate': 0.9352951454385762, 'aft_loss_distribution': 'normal', 'aft_loss_distribution_scale': 1.0580162940269433, 'max_depth': 5, 'booster': 'dart', 'scale_pos_weight': 2.172785930030436, 'alpha': 6.191722989662012, 'lambda': 0.19527611001085002, 'eta': 0.9508967617583279, 'sampling_method': 'uniform', 'subsample': 0.8716885516947358, 'gamma': 9.758511851205476}. Best is trial 333 with value: 4.264499999089825.
[I 2023-12-18 23:05:46,754] Trial 399 pruned. Trial was pruned at iteration 1.
[I 2023-12-18 23:05:46,890] Trial 400 pruned. Trial was pruned at iteration 0.
[I 2023-12-18 23:05:49,604] Trial 401 finished with value: inf and parameters: {'learning_rate': 0.9159447827849158, 'aft_loss_distribution': 'normal', 'aft_loss_distribution_scale': 1.245131116883264, 'max_depth': 6, 'booster': 'dart', 'scale_pos_weight': 1.965434857777546, 'alpha': 5.000585782999196, 'lambda': 0.36062653586829274, 'eta': 0.9667220148627794, 'sampling_method': 'uniform', 'subsample': 0.8139754594408009, 'gamma': 9.003076943489553}. Best is trial 333 with value: 4.264499999089825.
[I 2023-12-18 23:05:49,700] Trial 402 pruned. Trial was pruned at iteration 1.
[I 2023-12-18 23:05:51,655] Trial 403 finished with value: inf and parameters: {'learning_rate': 0.9027865975755165, 'aft_loss_distribution': 'normal', 'aft_loss_distribution_scale': 1.0611645237748004, 'max_depth': 6, 'booster': 'dart', 'scale_pos_weight': 0.9737154254244542, 'alpha': 5.826504854945323, 'lambda': 9.5861570764273, 'eta': 0.9988665841794071, 'sampling_method': 'uniform', 'subsample': 0.80060108797777, 'gamma': 8.344870010920795}. Best is trial 333 with value: 4.264499999089825.
[I 2023-12-18 23:05:55,487] Trial 404 finished with value: 4.275081243339114 and parameters: {'learning_rate': 0.9455572765296142, 'aft_loss_distribution': 'normal', 'aft_loss_distribution_scale': 0.9622070744518811, 'max_depth': 6, 'booster': 'dart', 'scale_pos_weight': 2.158764136205419, 'alpha': 6.301696059144705, 'lambda': 5.938293729809605, 'eta': 0.875886517829117, 'sampling_method': 'uniform', 'subsample': 0.6977142859690335, 'gamma': 9.175325882416894}. Best is trial 333 with value: 4.264499999089825.
[I 2023-12-18 23:05:55,574] Trial 405 pruned. Trial was pruned at iteration 1.
[I 2023-12-18 23:05:55,656] Trial 406 pruned. Trial was pruned at iteration 0.
[I 2023-12-18 23:05:55,733] Trial 407 pruned. Trial was pruned at iteration 0.
[I 2023-12-18 23:05:57,046] Trial 408 finished with value: inf and parameters: {'learning_rate': 0.8944768820660625, 'aft_loss_distribution': 'normal', 'aft_loss_distribution_scale': 0.9972536814063113, 'max_depth': 6, 'booster': 'dart', 'scale_pos_weight': 1.7343302555962319, 'alpha': 6.497425483720022, 'lambda': 2.6237559453679564, 'eta': 0.9797685788605092, 'sampling_method': 'uniform', 'subsample': 0.7695293966299424, 'gamma': 9.767014960226833}. Best is trial 333 with value: 4.264499999089825.
[I 2023-12-18 23:05:57,144] Trial 409 pruned. Trial was pruned at iteration 0.
[I 2023-12-18 23:06:00,265] Trial 410 finished with value: 4.289324555481191 and parameters: {'learning_rate': 0.9243897134594007, 'aft_loss_distribution': 'normal', 'aft_loss_distribution_scale': 1.2425915507299932, 'max_depth': 6, 'booster': 'dart', 'scale_pos_weight': 1.0639558261432023, 'alpha': 6.2739456188832134, 'lambda': 5.4012458617334715, 'eta': 0.9401044117665529, 'sampling_method': 'uniform', 'subsample': 0.793350304890921, 'gamma': 9.553141694268234}. Best is trial 333 with value: 4.264499999089825.
[I 2023-12-18 23:06:00,411] Trial 411 pruned. Trial was pruned at iteration 1.
[I 2023-12-18 23:06:00,546] Trial 412 pruned. Trial was pruned at iteration 1.
[I 2023-12-18 23:06:09,349] Trial 413 finished with value: 4.264574036668551 and parameters: {'learning_rate': 0.911602075633332, 'aft_loss_distribution': 'normal', 'aft_loss_distribution_scale': 1.0663946323288602, 'max_depth': 6, 'booster': 'dart', 'scale_pos_weight': 0.8192036332790594, 'alpha': 5.943772569946087, 'lambda': 0.7252036950424252, 'eta': 0.9814926862299288, 'sampling_method': 'uniform', 'subsample': 0.810438309121768, 'gamma': 8.591453369334245}. Best is trial 333 with value: 4.264499999089825.
[I 2023-12-18 23:06:09,433] Trial 414 pruned. Trial was pruned at iteration 0.
[I 2023-12-18 23:06:11,256] Trial 415 finished with value: inf and parameters: {'learning_rate': 0.8783836864775413, 'aft_loss_distribution': 'normal', 'aft_loss_distribution_scale': 0.9217786873487955, 'max_depth': 6, 'booster': 'dart', 'scale_pos_weight': 2.0121560313995976, 'alpha': 6.084099400850261, 'lambda': 8.04485975274855, 'eta': 0.9990137901613237, 'sampling_method': 'uniform', 'subsample': 0.8252964695838824, 'gamma': 8.863384300294218}. Best is trial 333 with value: 4.264499999089825.
[I 2023-12-18 23:06:12,858] Trial 416 finished with value: inf and parameters: {'learning_rate': 0.9058173687290481, 'aft_loss_distribution': 'normal', 'aft_loss_distribution_scale': 1.0549604757409314, 'max_depth': 6, 'booster': 'dart', 'scale_pos_weight': 6.513414090997025, 'alpha': 6.306712945124622, 'lambda': 7.325218720362214, 'eta': 0.9641962201436791, 'sampling_method': 'uniform', 'subsample': 0.8087532288761887, 'gamma': 8.665245408996908}. Best is trial 333 with value: 4.264499999089825.
[I 2023-12-18 23:06:12,945] Trial 417 pruned. Trial was pruned at iteration 0.
[I 2023-12-18 23:06:13,046] Trial 418 pruned. Trial was pruned at iteration 1.
[I 2023-12-18 23:06:13,133] Trial 419 pruned. Trial was pruned at iteration 1.
[I 2023-12-18 23:06:17,206] Trial 420 finished with value: 4.264720153994554 and parameters: {'learning_rate': 0.9515740180999422, 'aft_loss_distribution': 'normal', 'aft_loss_distribution_scale': 1.0518925822987724, 'max_depth': 6, 'booster': 'dart', 'scale_pos_weight': 1.6886365575003048, 'alpha': 5.514838476792756, 'lambda': 0.6398874221367838, 'eta': 0.9748034966411524, 'sampling_method': 'uniform', 'subsample': 0.8150859476238632, 'gamma': 9.974840116807608}. Best is trial 333 with value: 4.264499999089825.
[I 2023-12-18 23:06:22,186] Trial 421 finished with value: 4.271747223714814 and parameters: {'learning_rate': 0.9539942547029487, 'aft_loss_distribution': 'normal', 'aft_loss_distribution_scale': 1.1325890167314117, 'max_depth': 6, 'booster': 'dart', 'scale_pos_weight': 1.8809105901938372, 'alpha': 5.3404425011988605, 'lambda': 0.3088957674383482, 'eta': 0.9450588412321658, 'sampling_method': 'uniform', 'subsample': 0.8423133396918303, 'gamma': 9.92837931892624}. Best is trial 333 with value: 4.264499999089825.
[I 2023-12-18 23:06:22,364] Trial 422 pruned. Trial was pruned at iteration 1.
[I 2023-12-18 23:06:22,526] Trial 423 pruned. Trial was pruned at iteration 1.
[I 2023-12-18 23:06:22,663] Trial 424 pruned. Trial was pruned at iteration 0.
[I 2023-12-18 23:06:22,813] Trial 425 pruned. Trial was pruned at iteration 0.
[I 2023-12-18 23:06:22,966] Trial 426 pruned. Trial was pruned at iteration 0.
[I 2023-12-18 23:06:23,122] Trial 427 pruned. Trial was pruned at iteration 0.
[I 2023-12-18 23:06:23,286] Trial 428 pruned. Trial was pruned at iteration 1.
[I 2023-12-18 23:06:23,427] Trial 429 pruned. Trial was pruned at iteration 1.
[I 2023-12-18 23:06:23,556] Trial 430 pruned. Trial was pruned at iteration 0.
[I 2023-12-18 23:06:23,694] Trial 431 pruned. Trial was pruned at iteration 0.
[I 2023-12-18 23:06:23,835] Trial 432 pruned. Trial was pruned at iteration 2.
[I 2023-12-18 23:06:27,865] Trial 433 finished with value: 4.278186485390019 and parameters: {'learning_rate': 0.959210800213082, 'aft_loss_distribution': 'normal', 'aft_loss_distribution_scale': 0.9740244703120229, 'max_depth': 6, 'booster': 'dart', 'scale_pos_weight': 1.6529830274936783, 'alpha': 6.7648173373263845, 'lambda': 6.1926680532275356, 'eta': 0.9581335399904604, 'sampling_method': 'uniform', 'subsample': 0.8558205717529104, 'gamma': 9.211202560193467}. Best is trial 333 with value: 4.264499999089825.
[I 2023-12-18 23:06:27,955] Trial 434 pruned. Trial was pruned at iteration 1.
[I 2023-12-18 23:06:28,047] Trial 435 pruned. Trial was pruned at iteration 1.
[I 2023-12-18 23:06:28,136] Trial 436 pruned. Trial was pruned at iteration 0.
[I 2023-12-18 23:06:28,230] Trial 437 pruned. Trial was pruned at iteration 0.
[I 2023-12-18 23:06:29,513] Trial 438 finished with value: inf and parameters: {'learning_rate': 0.892799225272335, 'aft_loss_distribution': 'normal', 'aft_loss_distribution_scale': 0.959748403663737, 'max_depth': 6, 'booster': 'dart', 'scale_pos_weight': 8.228614402677362, 'alpha': 6.12732857024775, 'lambda': 0.5477590927886173, 'eta': 0.9608575947041502, 'sampling_method': 'uniform', 'subsample': 0.08887852954251318, 'gamma': 9.734719655534871}. Best is trial 333 with value: 4.264499999089825.
[I 2023-12-18 23:06:29,611] Trial 439 pruned. Trial was pruned at iteration 0.
[I 2023-12-18 23:06:31,688] Trial 440 finished with value: inf and parameters: {'learning_rate': 0.9247304737258701, 'aft_loss_distribution': 'normal', 'aft_loss_distribution_scale': 1.195495613265046, 'max_depth': 6, 'booster': 'dart', 'scale_pos_weight': 1.1411164161748657, 'alpha': 6.718006121800183, 'lambda': 4.210047568161994, 'eta': 0.9423824013323951, 'sampling_method': 'uniform', 'subsample': 0.834406549926575, 'gamma': 8.63815721353779}. Best is trial 333 with value: 4.264499999089825.
[I 2023-12-18 23:06:31,779] Trial 441 pruned. Trial was pruned at iteration 0.
[I 2023-12-18 23:06:31,873] Trial 442 pruned. Trial was pruned at iteration 1.
[I 2023-12-18 23:06:31,954] Trial 443 pruned. Trial was pruned at iteration 0.
[I 2023-12-18 23:06:32,042] Trial 444 pruned. Trial was pruned at iteration 0.
[I 2023-12-18 23:06:32,126] Trial 445 pruned. Trial was pruned at iteration 0.
[I 2023-12-18 23:06:32,213] Trial 446 pruned. Trial was pruned at iteration 0.
[I 2023-12-18 23:06:32,297] Trial 447 pruned. Trial was pruned at iteration 1.
[I 2023-12-18 23:06:33,888] Trial 448 finished with value: inf and parameters: {'learning_rate': 0.9028665713809856, 'aft_loss_distribution': 'normal', 'aft_loss_distribution_scale': 0.9859231607125972, 'max_depth': 6, 'booster': 'dart', 'scale_pos_weight': 0.1422955656695093, 'alpha': 3.2089354919453474, 'lambda': 0.7023452639934501, 'eta': 0.9605877272498251, 'sampling_method': 'uniform', 'subsample': 0.6736620637453317, 'gamma': 9.430062781800402}. Best is trial 333 with value: 4.264499999089825.
[I 2023-12-18 23:06:34,020] Trial 449 pruned. Trial was pruned at iteration 0.
[I 2023-12-18 23:06:35,944] Trial 450 finished with value: inf and parameters: {'learning_rate': 0.9159145034663387, 'aft_loss_distribution': 'normal', 'aft_loss_distribution_scale': 1.232518158337265, 'max_depth': 6, 'booster': 'dart', 'scale_pos_weight': 1.7725844670702202, 'alpha': 5.592005359688979, 'lambda': 0.4293568405319316, 'eta': 0.999940177201525, 'sampling_method': 'uniform', 'subsample': 0.7866245621506249, 'gamma': 9.991790781619699}. Best is trial 333 with value: 4.264499999089825.
[I 2023-12-18 23:06:36,081] Trial 451 pruned. Trial was pruned at iteration 0.
[I 2023-12-18 23:06:36,223] Trial 452 pruned. Trial was pruned at iteration 1.
[I 2023-12-18 23:06:36,359] Trial 453 pruned. Trial was pruned at iteration 0.
[I 2023-12-18 23:06:38,049] Trial 454 finished with value: inf and parameters: {'learning_rate': 0.8881773317159025, 'aft_loss_distribution': 'normal', 'aft_loss_distribution_scale': 1.0426001315292308, 'max_depth': 6, 'booster': 'dart', 'scale_pos_weight': 2.432998056316559, 'alpha': 6.586644971459293, 'lambda': 1.091952504356861, 'eta': 0.9048985596681405, 'sampling_method': 'uniform', 'subsample': 0.693756692195474, 'gamma': 9.552622344070095}. Best is trial 333 with value: 4.264499999089825.
[I 2023-12-18 23:06:38,143] Trial 455 pruned. Trial was pruned at iteration 1.
[I 2023-12-18 23:06:38,228] Trial 456 pruned. Trial was pruned at iteration 0.
[I 2023-12-18 23:06:39,579] Trial 457 finished with value: inf and parameters: {'learning_rate': 0.9582004960859463, 'aft_loss_distribution': 'normal', 'aft_loss_distribution_scale': 1.2354698829983688, 'max_depth': 6, 'booster': 'dart', 'scale_pos_weight': 1.3435060827697405, 'alpha': 6.954097554123124, 'lambda': 1.3331764068041139, 'eta': 0.9529422884340515, 'sampling_method': 'uniform', 'subsample': 0.8596638159819051, 'gamma': 8.028314304076185}. Best is trial 333 with value: 4.264499999089825.
[I 2023-12-18 23:06:45,270] Trial 458 finished with value: 4.266919397416365 and parameters: {'learning_rate': 0.908887559871137, 'aft_loss_distribution': 'normal', 'aft_loss_distribution_scale': 1.0037334537575162, 'max_depth': 6, 'booster': 'dart', 'scale_pos_weight': 0.9215237452828335, 'alpha': 5.762765371925102, 'lambda': 0.9313605707306845, 'eta': 0.850694621978137, 'sampling_method': 'uniform', 'subsample': 0.7240907430266693, 'gamma': 9.298690610706087}. Best is trial 333 with value: 4.264499999089825.
[I 2023-12-18 23:06:45,370] Trial 459 pruned. Trial was pruned at iteration 0.
[I 2023-12-18 23:06:45,459] Trial 460 pruned. Trial was pruned at iteration 0.
[I 2023-12-18 23:06:45,537] Trial 461 pruned. Trial was pruned at iteration 0.
[I 2023-12-18 23:06:49,953] Trial 462 finished with value: 4.272525609303635 and parameters: {'learning_rate': 0.8974503390141404, 'aft_loss_distribution': 'normal', 'aft_loss_distribution_scale': 0.9786835940428654, 'max_depth': 6, 'booster': 'dart', 'scale_pos_weight': 1.0351253283343498, 'alpha': 5.753732412015048, 'lambda': 8.692488031824542, 'eta': 0.8243050792842691, 'sampling_method': 'uniform', 'subsample': 0.7176871137944905, 'gamma': 8.253850725497855}. Best is trial 333 with value: 4.264499999089825.
[I 2023-12-18 23:06:50,099] Trial 463 pruned. Trial was pruned at iteration 0.
[I 2023-12-18 23:06:50,247] Trial 464 pruned. Trial was pruned at iteration 1.
