[I 2023-12-18 23:48:43,858] Trial 269 pruned. Trial was pruned at iteration 1.
[I 2023-12-18 23:48:43,973] Trial 270 pruned. Trial was pruned at iteration 0.
[I 2023-12-18 23:48:47,186] Trial 271 finished with value: 4.256991444967124 and parameters: {'learning_rate': 0.9687867189204693, 'aft_loss_distribution': 'normal', 'aft_loss_distribution_scale': 1.0426907520734043, 'max_depth': 4, 'booster': 'dart', 'scale_pos_weight': 8.264231064349895, 'alpha': 9.242337863250652, 'lambda': 4.457669746421473, 'eta': 0.12766566286268746, 'sampling_method': 'uniform', 'subsample': 0.7827711902985919, 'gamma': 8.383021688929961}. Best is trial 203 with value: 4.25376160322098.
[I 2023-12-18 23:48:48,970] Trial 272 finished with value: inf and parameters: {'learning_rate': 0.9794104846984498, 'aft_loss_distribution': 'normal', 'aft_loss_distribution_scale': 1.0275142004359747, 'max_depth': 4, 'booster': 'dart', 'scale_pos_weight': 8.442316930163273, 'alpha': 9.141605294136788, 'lambda': 4.520912443468432, 'eta': 0.13650719598184136, 'sampling_method': 'uniform', 'subsample': 0.7811646164778363, 'gamma': 8.493667882644058}. Best is trial 203 with value: 4.25376160322098.
[I 2023-12-18 23:48:49,051] Trial 273 pruned. Trial was pruned at iteration 0.
[I 2023-12-18 23:48:49,134] Trial 274 pruned. Trial was pruned at iteration 0.
[I 2023-12-18 23:48:49,217] Trial 275 pruned. Trial was pruned at iteration 0.
[I 2023-12-18 23:48:49,298] Trial 276 pruned. Trial was pruned at iteration 0.
[I 2023-12-18 23:48:49,373] Trial 277 pruned. Trial was pruned at iteration 0.
[I 2023-12-18 23:48:49,445] Trial 278 pruned. Trial was pruned at iteration 0.
[I 2023-12-18 23:48:49,522] Trial 279 pruned. Trial was pruned at iteration 0.
[I 2023-12-18 23:48:51,521] Trial 280 finished with value: inf and parameters: {'learning_rate': 0.9290202665125823, 'aft_loss_distribution': 'normal', 'aft_loss_distribution_scale': 1.0465234469016302, 'max_depth': 4, 'booster': 'dart', 'scale_pos_weight': 7.717260863095557, 'alpha': 9.451190553945768, 'lambda': 4.664414812241575, 'eta': 0.09301106929745666, 'sampling_method': 'uniform', 'subsample': 0.795911273456978, 'gamma': 7.891396604630467}. Best is trial 203 with value: 4.25376160322098.
[I 2023-12-18 23:48:51,599] Trial 281 pruned. Trial was pruned at iteration 0.
[I 2023-12-18 23:48:57,497] Trial 282 finished with value: 4.264395927097279 and parameters: {'learning_rate': 0.9830282589229329, 'aft_loss_distribution': 'normal', 'aft_loss_distribution_scale': 1.139696016472871, 'max_depth': 3, 'booster': 'dart', 'scale_pos_weight': 8.53239283406085, 'alpha': 9.705698870608108, 'lambda': 4.509633006071759, 'eta': 0.1608396355507026, 'sampling_method': 'uniform', 'subsample': 0.836517976177356, 'gamma': 9.550576728145705}. Best is trial 203 with value: 4.25376160322098.
[I 2023-12-18 23:49:01,510] Trial 283 finished with value: 4.258933227281831 and parameters: {'learning_rate': 0.980419662341403, 'aft_loss_distribution': 'normal', 'aft_loss_distribution_scale': 1.1226321398167274, 'max_depth': 3, 'booster': 'dart', 'scale_pos_weight': 8.354228792594082, 'alpha': 9.695164330911556, 'lambda': 4.550577288366026, 'eta': 0.19361786790960178, 'sampling_method': 'uniform', 'subsample': 0.841693173397568, 'gamma': 9.60134439850963}. Best is trial 203 with value: 4.25376160322098.
[I 2023-12-18 23:49:03,241] Trial 284 pruned. Trial was pruned at iteration 61.
[I 2023-12-18 23:49:03,320] Trial 285 pruned. Trial was pruned at iteration 0.
[I 2023-12-18 23:49:04,799] Trial 286 pruned. Trial was pruned at iteration 56.
[I 2023-12-18 23:49:04,876] Trial 287 pruned. Trial was pruned at iteration 0.
[I 2023-12-18 23:49:04,948] Trial 288 pruned. Trial was pruned at iteration 0.
[I 2023-12-18 23:49:05,027] Trial 289 pruned. Trial was pruned at iteration 0.
[I 2023-12-18 23:49:05,122] Trial 290 pruned. Trial was pruned at iteration 0.
[I 2023-12-18 23:49:18,170] Trial 291 finished with value: 4.261401384350643 and parameters: {'learning_rate': 0.9672736935109895, 'aft_loss_distribution': 'normal', 'aft_loss_distribution_scale': 1.1377180800887012, 'max_depth': 3, 'booster': 'dart', 'scale_pos_weight': 9.213850893261931, 'alpha': 9.32362926464983, 'lambda': 4.8834125346368165, 'eta': 0.10702645193607387, 'sampling_method': 'uniform', 'subsample': 0.8055756397779629, 'gamma': 9.380969727100924}. Best is trial 203 with value: 4.25376160322098.
[I 2023-12-18 23:49:23,535] Trial 292 finished with value: 4.254266823839076 and parameters: {'learning_rate': 0.9692801221412304, 'aft_loss_distribution': 'normal', 'aft_loss_distribution_scale': 1.0585693201683206, 'max_depth': 3, 'booster': 'dart', 'scale_pos_weight': 9.233206838588222, 'alpha': 9.325931697312411, 'lambda': 5.046345331675008, 'eta': 0.11446116365625303, 'sampling_method': 'uniform', 'subsample': 0.8089589208882281, 'gamma': 9.208985986692856}. Best is trial 203 with value: 4.25376160322098.
[I 2023-12-18 23:49:23,665] Trial 293 pruned. Trial was pruned at iteration 0.
[I 2023-12-18 23:49:23,798] Trial 294 pruned. Trial was pruned at iteration 0.
[I 2023-12-18 23:49:29,126] Trial 295 finished with value: 4.253004184417932 and parameters: {'learning_rate': 0.943425114665429, 'aft_loss_distribution': 'normal', 'aft_loss_distribution_scale': 1.009787400098893, 'max_depth': 3, 'booster': 'dart', 'scale_pos_weight': 9.139570425066324, 'alpha': 9.796386708245164, 'lambda': 5.143808489998575, 'eta': 0.1029592332311503, 'sampling_method': 'uniform', 'subsample': 0.8025492791803619, 'gamma': 9.33506777832049}. Best is trial 295 with value: 4.253004184417932.
[I 2023-12-18 23:49:30,662] Trial 296 finished with value: inf and parameters: {'learning_rate': 0.9422241934193547, 'aft_loss_distribution': 'normal', 'aft_loss_distribution_scale': 0.9924901300490591, 'max_depth': 3, 'booster': 'dart', 'scale_pos_weight': 9.152869340737384, 'alpha': 9.766168064872877, 'lambda': 4.7780883063502735, 'eta': 0.17747379384299994, 'sampling_method': 'uniform', 'subsample': 0.8163846495947035, 'gamma': 9.299020355697825}. Best is trial 295 with value: 4.253004184417932.
[I 2023-12-18 23:49:30,742] Trial 297 pruned. Trial was pruned at iteration 0.
[I 2023-12-18 23:49:30,822] Trial 298 pruned. Trial was pruned at iteration 2.
[I 2023-12-18 23:49:30,905] Trial 299 pruned. Trial was pruned at iteration 0.
[I 2023-12-18 23:49:30,976] Trial 300 pruned. Trial was pruned at iteration 0.
[I 2023-12-18 23:49:31,056] Trial 301 pruned. Trial was pruned at iteration 0.
[I 2023-12-18 23:49:32,363] Trial 302 finished with value: inf and parameters: {'learning_rate': 0.9511892330334187, 'aft_loss_distribution': 'normal', 'aft_loss_distribution_scale': 1.062734179494922, 'max_depth': 3, 'booster': 'dart', 'scale_pos_weight': 9.33727444944291, 'alpha': 9.542269921822085, 'lambda': 5.389165537048091, 'eta': 0.13609740589036395, 'sampling_method': 'uniform', 'subsample': 0.8156905286193159, 'gamma': 9.032169072216776}. Best is trial 295 with value: 4.253004184417932.
[I 2023-12-18 23:49:32,440] Trial 303 pruned. Trial was pruned at iteration 0.
[I 2023-12-18 23:49:32,514] Trial 304 pruned. Trial was pruned at iteration 0.
[I 2023-12-18 23:49:32,595] Trial 305 pruned. Trial was pruned at iteration 0.
[I 2023-12-18 23:49:32,670] Trial 306 pruned. Trial was pruned at iteration 0.
[I 2023-12-18 23:49:32,755] Trial 307 pruned. Trial was pruned at iteration 0.
[I 2023-12-18 23:49:32,836] Trial 308 pruned. Trial was pruned at iteration 0.
[I 2023-12-18 23:49:32,924] Trial 309 pruned. Trial was pruned at iteration 1.
[I 2023-12-18 23:49:33,008] Trial 310 pruned. Trial was pruned at iteration 0.
[I 2023-12-18 23:49:33,103] Trial 311 pruned. Trial was pruned at iteration 0.
[I 2023-12-18 23:49:33,192] Trial 312 pruned. Trial was pruned at iteration 0.
[I 2023-12-18 23:49:33,270] Trial 313 pruned. Trial was pruned at iteration 0.
[I 2023-12-18 23:49:33,352] Trial 314 pruned. Trial was pruned at iteration 0.
[I 2023-12-18 23:49:33,428] Trial 315 pruned. Trial was pruned at iteration 0.
[I 2023-12-18 23:49:33,508] Trial 316 pruned. Trial was pruned at iteration 0.
[I 2023-12-18 23:49:33,584] Trial 317 pruned. Trial was pruned at iteration 0.
[I 2023-12-18 23:49:33,661] Trial 318 pruned. Trial was pruned at iteration 0.
[I 2023-12-18 23:49:33,741] Trial 319 pruned. Trial was pruned at iteration 1.
[I 2023-12-18 23:49:33,823] Trial 320 pruned. Trial was pruned at iteration 0.
[I 2023-12-18 23:49:33,901] Trial 321 pruned. Trial was pruned at iteration 0.
[I 2023-12-18 23:49:35,653] Trial 322 pruned. Trial was pruned at iteration 61.
[I 2023-12-18 23:49:35,730] Trial 323 pruned. Trial was pruned at iteration 0.
[I 2023-12-18 23:49:35,804] Trial 324 pruned. Trial was pruned at iteration 0.
[I 2023-12-18 23:49:35,881] Trial 325 pruned. Trial was pruned at iteration 0.
[I 2023-12-18 23:49:35,962] Trial 326 pruned. Trial was pruned at iteration 0.
[I 2023-12-18 23:49:36,040] Trial 327 pruned. Trial was pruned at iteration 0.
[I 2023-12-18 23:49:37,851] Trial 328 finished with value: inf and parameters: {'learning_rate': 0.9799903722365513, 'aft_loss_distribution': 'normal', 'aft_loss_distribution_scale': 0.9923965277924792, 'max_depth': 4, 'booster': 'dart', 'scale_pos_weight': 1.4794282129913292, 'alpha': 8.869688990913227, 'lambda': 4.287973885221785, 'eta': 0.05697256683140543, 'sampling_method': 'uniform', 'subsample': 0.7772816300195193, 'gamma': 9.809262254147427}. Best is trial 295 with value: 4.253004184417932.
[I 2023-12-18 23:49:37,986] Trial 329 pruned. Trial was pruned at iteration 0.
[I 2023-12-18 23:49:38,110] Trial 330 pruned. Trial was pruned at iteration 0.
[I 2023-12-18 23:49:38,456] Trial 331 finished with value: 4.256817634001919 and parameters: {'learning_rate': 0.9597081901007298, 'aft_loss_distribution': 'normal', 'aft_loss_distribution_scale': 1.0950009871586883, 'max_depth': 3, 'booster': 'gbtree', 'scale_pos_weight': 8.979618235008832, 'alpha': 9.569277731960469, 'lambda': 3.8528030064504053, 'eta': 0.07985140021916946, 'sampling_method': 'uniform', 'subsample': 0.779334175446989, 'gamma': 8.444291049699569}. Best is trial 295 with value: 4.253004184417932.
[I 2023-12-18 23:49:38,584] Trial 332 pruned. Trial was pruned at iteration 0.
[I 2023-12-18 23:49:38,715] Trial 333 pruned. Trial was pruned at iteration 0.
[I 2023-12-18 23:49:38,844] Trial 334 pruned. Trial was pruned at iteration 0.
[I 2023-12-18 23:49:44,227] Trial 335 finished with value: 4.2520985922967816 and parameters: {'learning_rate': 0.9633740579405133, 'aft_loss_distribution': 'normal', 'aft_loss_distribution_scale': 1.0714140357484339, 'max_depth': 3, 'booster': 'dart', 'scale_pos_weight': 8.519877876286252, 'alpha': 9.29199057435318, 'lambda': 4.163192788185089, 'eta': 0.07776013102674748, 'sampling_method': 'uniform', 'subsample': 0.7735083331041563, 'gamma': 8.739516432528195}. Best is trial 335 with value: 4.2520985922967816.
[I 2023-12-18 23:49:44,318] Trial 336 pruned. Trial was pruned at iteration 0.
[I 2023-12-18 23:49:44,397] Trial 337 pruned. Trial was pruned at iteration 0.
[I 2023-12-18 23:49:44,474] Trial 338 pruned. Trial was pruned at iteration 0.
[I 2023-12-18 23:49:44,564] Trial 339 pruned. Trial was pruned at iteration 0.
[I 2023-12-18 23:50:19,450] Trial 340 finished with value: 4.258170089266318 and parameters: {'learning_rate': 0.9437007733981696, 'aft_loss_distribution': 'normal', 'aft_loss_distribution_scale': 1.074786011650022, 'max_depth': 3, 'booster': 'dart', 'scale_pos_weight': 9.513935946131543, 'alpha': 9.064028848580833, 'lambda': 4.483828793498398, 'eta': 0.0691313375904266, 'sampling_method': 'uniform', 'subsample': 0.7594176455033742, 'gamma': 8.885682495052535}. Best is trial 335 with value: 4.2520985922967816.
[I 2023-12-18 23:50:19,536] Trial 341 pruned. Trial was pruned at iteration 0.
[I 2023-12-18 23:50:19,631] Trial 342 pruned. Trial was pruned at iteration 0.
[I 2023-12-18 23:50:19,711] Trial 343 pruned. Trial was pruned at iteration 0.
[I 2023-12-18 23:50:23,762] Trial 344 finished with value: 4.25334397215603 and parameters: {'learning_rate': 0.9401110063400082, 'aft_loss_distribution': 'normal', 'aft_loss_distribution_scale': 1.0631872639734081, 'max_depth': 3, 'booster': 'dart', 'scale_pos_weight': 9.196918480328618, 'alpha': 9.217741770672962, 'lambda': 3.9743383313007232, 'eta': 0.0950353574078523, 'sampling_method': 'uniform', 'subsample': 0.7825842517890603, 'gamma': 8.950868249217978}. Best is trial 335 with value: 4.2520985922967816.
[I 2023-12-18 23:50:23,911] Trial 345 pruned. Trial was pruned at iteration 0.
[I 2023-12-18 23:50:25,715] Trial 346 finished with value: inf and parameters: {'learning_rate': 0.9471261205218018, 'aft_loss_distribution': 'normal', 'aft_loss_distribution_scale': 1.0260892984577394, 'max_depth': 3, 'booster': 'dart', 'scale_pos_weight': 8.960598082721809, 'alpha': 9.17880465665987, 'lambda': 4.441816278525498, 'eta': 0.10744026648870778, 'sampling_method': 'uniform', 'subsample': 0.7924626140752765, 'gamma': 8.685971495591797}. Best is trial 335 with value: 4.2520985922967816.
[I 2023-12-18 23:50:25,795] Trial 347 pruned. Trial was pruned at iteration 0.
[I 2023-12-18 23:50:25,878] Trial 348 pruned. Trial was pruned at iteration 0.
[I 2023-12-18 23:50:25,966] Trial 349 pruned. Trial was pruned at iteration 0.
[I 2023-12-18 23:50:26,041] Trial 350 pruned. Trial was pruned at iteration 0.
[I 2023-12-18 23:50:26,117] Trial 351 pruned. Trial was pruned at iteration 0.
[I 2023-12-18 23:50:26,197] Trial 352 pruned. Trial was pruned at iteration 0.
[I 2023-12-18 23:50:26,279] Trial 353 pruned. Trial was pruned at iteration 0.
[I 2023-12-18 23:50:26,373] Trial 354 pruned. Trial was pruned at iteration 0.
[I 2023-12-18 23:50:26,453] Trial 355 pruned. Trial was pruned at iteration 0.
[I 2023-12-18 23:50:26,532] Trial 356 pruned. Trial was pruned at iteration 0.
[I 2023-12-18 23:50:26,610] Trial 357 pruned. Trial was pruned at iteration 0.
[I 2023-12-18 23:50:28,872] Trial 358 finished with value: inf and parameters: {'learning_rate': 0.9383100485484944, 'aft_loss_distribution': 'normal', 'aft_loss_distribution_scale': 1.0984467941302731, 'max_depth': 4, 'booster': 'dart', 'scale_pos_weight': 9.17677895574929, 'alpha': 9.487532285745127, 'lambda': 4.460861429932591, 'eta': 0.050076962525002634, 'sampling_method': 'uniform', 'subsample': 0.8422542919430824, 'gamma': 8.979228867467572}. Best is trial 335 with value: 4.2520985922967816.
[I 2023-12-18 23:50:28,957] Trial 359 pruned. Trial was pruned at iteration 0.
[I 2023-12-18 23:50:29,044] Trial 360 pruned. Trial was pruned at iteration 0.
[I 2023-12-18 23:50:29,130] Trial 361 pruned. Trial was pruned at iteration 0.
[I 2023-12-18 23:50:29,207] Trial 362 pruned. Trial was pruned at iteration 0.
[I 2023-12-18 23:50:29,286] Trial 363 pruned. Trial was pruned at iteration 0.
[I 2023-12-18 23:50:29,499] Trial 364 finished with value: inf and parameters: {'learning_rate': 0.9634986565609079, 'aft_loss_distribution': 'normal', 'aft_loss_distribution_scale': 0.950962448834681, 'max_depth': 3, 'booster': 'gbtree', 'scale_pos_weight': 8.085730000400527, 'alpha': 9.394357636020239, 'lambda': 3.836703919621346, 'eta': 0.08266550484345045, 'sampling_method': 'uniform', 'subsample': 0.747912873695555, 'gamma': 7.691284201466722}. Best is trial 335 with value: 4.2520985922967816.
[I 2023-12-18 23:50:29,579] Trial 365 pruned. Trial was pruned at iteration 0.
[I 2023-12-18 23:50:29,655] Trial 366 pruned. Trial was pruned at iteration 0.
[I 2023-12-18 23:50:29,736] Trial 367 pruned. Trial was pruned at iteration 1.
[I 2023-12-18 23:50:29,826] Trial 368 pruned. Trial was pruned at iteration 0.
[I 2023-12-18 23:50:29,913] Trial 369 pruned. Trial was pruned at iteration 0.
[I 2023-12-18 23:50:32,851] Trial 370 finished with value: 4.250995514781027 and parameters: {'learning_rate': 0.9546355536059413, 'aft_loss_distribution': 'normal', 'aft_loss_distribution_scale': 1.071686347224199, 'max_depth': 3, 'booster': 'dart', 'scale_pos_weight': 9.263485623374544, 'alpha': 9.011335289155987, 'lambda': 4.250694411828176, 'eta': 0.13362478130981073, 'sampling_method': 'uniform', 'subsample': 0.7998509049292822, 'gamma': 8.950746472329072}. Best is trial 370 with value: 4.250995514781027.
[I 2023-12-18 23:50:32,941] Trial 371 pruned. Trial was pruned at iteration 0.
[I 2023-12-18 23:50:33,021] Trial 372 pruned. Trial was pruned at iteration 0.
[I 2023-12-18 23:50:33,115] Trial 373 pruned. Trial was pruned at iteration 0.
[I 2023-12-18 23:50:33,194] Trial 374 pruned. Trial was pruned at iteration 0.
[I 2023-12-18 23:50:34,627] Trial 375 finished with value: inf and parameters: {'learning_rate': 0.956058192106897, 'aft_loss_distribution': 'normal', 'aft_loss_distribution_scale': 1.0356727076770433, 'max_depth': 3, 'booster': 'dart', 'scale_pos_weight': 1.7044183916497053, 'alpha': 9.18550304582082, 'lambda': 4.361965257879035, 'eta': 0.17235946747798703, 'sampling_method': 'uniform', 'subsample': 0.7010139502645526, 'gamma': 8.26393045188417}. Best is trial 370 with value: 4.250995514781027.
[I 2023-12-18 23:50:34,708] Trial 376 pruned. Trial was pruned at iteration 0.
[I 2023-12-18 23:50:34,789] Trial 377 pruned. Trial was pruned at iteration 0.
[I 2023-12-18 23:50:34,874] Trial 378 pruned. Trial was pruned at iteration 1.
[I 2023-12-18 23:50:34,954] Trial 379 pruned. Trial was pruned at iteration 0.
[I 2023-12-18 23:50:35,037] Trial 380 pruned. Trial was pruned at iteration 0.
[I 2023-12-18 23:50:35,113] Trial 381 pruned. Trial was pruned at iteration 0.
[I 2023-12-18 23:50:35,210] Trial 382 pruned. Trial was pruned at iteration 0.
[I 2023-12-18 23:50:35,293] Trial 383 pruned. Trial was pruned at iteration 1.
[I 2023-12-18 23:50:35,376] Trial 384 pruned. Trial was pruned at iteration 0.
[I 2023-12-18 23:50:35,458] Trial 385 pruned. Trial was pruned at iteration 0.
[I 2023-12-18 23:50:35,539] Trial 386 pruned. Trial was pruned at iteration 0.
[I 2023-12-18 23:50:35,617] Trial 387 pruned. Trial was pruned at iteration 0.
[I 2023-12-18 23:50:35,697] Trial 388 pruned. Trial was pruned at iteration 0.
[I 2023-12-18 23:50:35,835] Trial 389 pruned. Trial was pruned at iteration 0.
[I 2023-12-18 23:50:35,962] Trial 390 pruned. Trial was pruned at iteration 0.
[I 2023-12-18 23:50:41,609] Trial 391 finished with value: 4.259096744227789 and parameters: {'learning_rate': 0.9560571368854311, 'aft_loss_distribution': 'normal', 'aft_loss_distribution_scale': 1.011744497620772, 'max_depth': 4, 'booster': 'dart', 'scale_pos_weight': 8.454076100489416, 'alpha': 8.884758161066463, 'lambda': 4.174064013474587, 'eta': 0.08718892393741623, 'sampling_method': 'uniform', 'subsample': 0.6868676795581408, 'gamma': 9.597628263131705}. Best is trial 370 with value: 4.250995514781027.
[I 2023-12-18 23:50:41,695] Trial 392 pruned. Trial was pruned at iteration 0.
[I 2023-12-18 23:50:41,775] Trial 393 pruned. Trial was pruned at iteration 0.
[I 2023-12-18 23:50:41,857] Trial 394 pruned. Trial was pruned at iteration 0.
[I 2023-12-18 23:50:41,940] Trial 395 pruned. Trial was pruned at iteration 0.
[I 2023-12-18 23:50:42,029] Trial 396 pruned. Trial was pruned at iteration 0.
[I 2023-12-18 23:50:42,114] Trial 397 pruned. Trial was pruned at iteration 0.
[I 2023-12-18 23:50:42,199] Trial 398 pruned. Trial was pruned at iteration 1.
[I 2023-12-18 23:50:42,278] Trial 399 pruned. Trial was pruned at iteration 0.
[I 2023-12-18 23:50:42,365] Trial 400 pruned. Trial was pruned at iteration 0.
[I 2023-12-18 23:50:42,465] Trial 401 pruned. Trial was pruned at iteration 0.
[I 2023-12-18 23:50:42,547] Trial 402 pruned. Trial was pruned at iteration 0.
[I 2023-12-18 23:50:42,629] Trial 403 pruned. Trial was pruned at iteration 0.
[I 2023-12-18 23:50:42,717] Trial 404 pruned. Trial was pruned at iteration 0.
[I 2023-12-18 23:50:42,803] Trial 405 pruned. Trial was pruned at iteration 0.
[I 2023-12-18 23:50:42,890] Trial 406 pruned. Trial was pruned at iteration 0.
[I 2023-12-18 23:50:42,981] Trial 407 pruned. Trial was pruned at iteration 0.
[I 2023-12-18 23:50:43,578] Trial 408 finished with value: 4.256807523063285 and parameters: {'learning_rate': 0.9407358944180635, 'aft_loss_distribution': 'normal', 'aft_loss_distribution_scale': 1.037865307226607, 'max_depth': 3, 'booster': 'gbtree', 'scale_pos_weight': 8.936719227667414, 'alpha': 8.629664150048935, 'lambda': 4.4188019957573115, 'eta': 0.4156796706212941, 'sampling_method': 'uniform', 'subsample': 0.7801070491043117, 'gamma': 8.386304639483141}. Best is trial 370 with value: 4.250995514781027.
[I 2023-12-18 23:50:43,680] Trial 409 pruned. Trial was pruned at iteration 2.
[I 2023-12-18 23:50:43,765] Trial 410 pruned. Trial was pruned at iteration 0.
[I 2023-12-18 23:50:43,857] Trial 411 pruned. Trial was pruned at iteration 1.
[I 2023-12-18 23:50:43,942] Trial 412 pruned. Trial was pruned at iteration 0.
[I 2023-12-18 23:50:44,032] Trial 413 pruned. Trial was pruned at iteration 0.
[I 2023-12-18 23:50:44,113] Trial 414 pruned. Trial was pruned at iteration 0.
[I 2023-12-18 23:50:44,198] Trial 415 pruned. Trial was pruned at iteration 0.
[I 2023-12-18 23:50:49,615] Trial 416 finished with value: 4.258320876948043 and parameters: {'learning_rate': 0.9644179671514121, 'aft_loss_distribution': 'normal', 'aft_loss_distribution_scale': 1.1072989998368574, 'max_depth': 4, 'booster': 'dart', 'scale_pos_weight': 9.075037427327018, 'alpha': 9.0191174285905, 'lambda': 4.204614842987947, 'eta': 0.3171459177425198, 'sampling_method': 'uniform', 'subsample': 0.7865751843478594, 'gamma': 8.924121395105463}. Best is trial 370 with value: 4.250995514781027.
[I 2023-12-18 23:50:49,702] Trial 417 pruned. Trial was pruned at iteration 0.
[I 2023-12-18 23:50:49,783] Trial 418 pruned. Trial was pruned at iteration 0.
