[I 2023-12-19 00:00:53,998] Trial 499 pruned. Trial was pruned at iteration 2.
Completed hyperparameter tuning with best aft-nloglik = 4.291290072824398.
Re-running the best trial... params = {'verbosity': 0, 'objective': 'survival:aft', 'eval_metric': 'aft-nloglik', 'tree_method': 'gpu_hist', 'device': 'cuda', 'learning_rate': 0.7163979538331531, 'aft_loss_distribution': 'normal', 'aft_loss_distribution_scale': 1.3551496196019368, 'max_depth': 10, 'booster': 'dart', 'scale_pos_weight': 0.5875943204668269, 'alpha': 7.253035497704076, 'lambda': 2.5894783775068118, 'eta': 0.63849874125559, 'sampling_method': 'uniform', 'subsample': 0.4457481865034521, 'gamma': 9.811078525634366}
[W 2023-12-19 00:00:57,513] Trial 3 is omitted in visualization because its objective value is inf or nan.
[W 2023-12-19 00:00:57,514] Trial 12 is omitted in visualization because its objective value is inf or nan.
[W 2023-12-19 00:00:57,516] Trial 13 is omitted in visualization because its objective value is inf or nan.
[W 2023-12-19 00:00:57,518] Trial 20 is omitted in visualization because its objective value is inf or nan.
[W 2023-12-19 00:00:57,520] Trial 30 is omitted in visualization because its objective value is inf or nan.
[W 2023-12-19 00:00:57,522] Trial 42 is omitted in visualization because its objective value is inf or nan.
[W 2023-12-19 00:00:57,523] Trial 66 is omitted in visualization because its objective value is inf or nan.
[W 2023-12-19 00:00:57,523] Trial 68 is omitted in visualization because its objective value is inf or nan.
[W 2023-12-19 00:00:57,524] Trial 75 is omitted in visualization because its objective value is inf or nan.
[W 2023-12-19 00:00:57,525] Trial 80 is omitted in visualization because its objective value is inf or nan.
[W 2023-12-19 00:00:57,526] Trial 86 is omitted in visualization because its objective value is inf or nan.
[W 2023-12-19 00:00:57,527] Trial 95 is omitted in visualization because its objective value is inf or nan.
[W 2023-12-19 00:00:57,528] Trial 96 is omitted in visualization because its objective value is inf or nan.
[W 2023-12-19 00:00:57,528] Trial 100 is omitted in visualization because its objective value is inf or nan.
[W 2023-12-19 00:00:57,529] Trial 114 is omitted in visualization because its objective value is inf or nan.
[W 2023-12-19 00:00:57,530] Trial 131 is omitted in visualization because its objective value is inf or nan.
[W 2023-12-19 00:00:57,531] Trial 133 is omitted in visualization because its objective value is inf or nan.
[W 2023-12-19 00:00:57,532] Trial 147 is omitted in visualization because its objective value is inf or nan.
[W 2023-12-19 00:00:57,533] Trial 149 is omitted in visualization because its objective value is inf or nan.
[W 2023-12-19 00:00:57,533] Trial 153 is omitted in visualization because its objective value is inf or nan.
[W 2023-12-19 00:00:57,534] Trial 158 is omitted in visualization because its objective value is inf or nan.
[W 2023-12-19 00:00:57,535] Trial 162 is omitted in visualization because its objective value is inf or nan.
[W 2023-12-19 00:00:57,536] Trial 164 is omitted in visualization because its objective value is inf or nan.
[W 2023-12-19 00:00:57,537] Trial 171 is omitted in visualization because its objective value is inf or nan.
[W 2023-12-19 00:00:57,538] Trial 175 is omitted in visualization because its objective value is inf or nan.
[W 2023-12-19 00:00:57,539] Trial 177 is omitted in visualization because its objective value is inf or nan.
[W 2023-12-19 00:00:57,539] Trial 179 is omitted in visualization because its objective value is inf or nan.
[W 2023-12-19 00:00:57,540] Trial 185 is omitted in visualization because its objective value is inf or nan.
[W 2023-12-19 00:00:57,541] Trial 197 is omitted in visualization because its objective value is inf or nan.
[W 2023-12-19 00:00:57,542] Trial 198 is omitted in visualization because its objective value is inf or nan.
[W 2023-12-19 00:00:57,543] Trial 203 is omitted in visualization because its objective value is inf or nan.
[W 2023-12-19 00:00:57,544] Trial 206 is omitted in visualization because its objective value is inf or nan.
[W 2023-12-19 00:00:57,545] Trial 213 is omitted in visualization because its objective value is inf or nan.
[W 2023-12-19 00:00:57,546] Trial 215 is omitted in visualization because its objective value is inf or nan.
[W 2023-12-19 00:00:57,546] Trial 216 is omitted in visualization because its objective value is inf or nan.
[W 2023-12-19 00:00:57,547] Trial 220 is omitted in visualization because its objective value is inf or nan.
[W 2023-12-19 00:00:57,548] Trial 222 is omitted in visualization because its objective value is inf or nan.
[W 2023-12-19 00:00:57,549] Trial 226 is omitted in visualization because its objective value is inf or nan.
[W 2023-12-19 00:00:57,550] Trial 233 is omitted in visualization because its objective value is inf or nan.
[W 2023-12-19 00:00:57,551] Trial 240 is omitted in visualization because its objective value is inf or nan.
[W 2023-12-19 00:00:57,552] Trial 256 is omitted in visualization because its objective value is inf or nan.
[W 2023-12-19 00:00:57,553] Trial 272 is omitted in visualization because its objective value is inf or nan.
[W 2023-12-19 00:00:57,553] Trial 277 is omitted in visualization because its objective value is inf or nan.
[W 2023-12-19 00:00:57,554] Trial 278 is omitted in visualization because its objective value is inf or nan.
[W 2023-12-19 00:00:57,555] Trial 289 is omitted in visualization because its objective value is inf or nan.
[W 2023-12-19 00:00:57,556] Trial 314 is omitted in visualization because its objective value is inf or nan.
[W 2023-12-19 00:00:57,557] Trial 321 is omitted in visualization because its objective value is inf or nan.
[W 2023-12-19 00:00:57,558] Trial 325 is omitted in visualization because its objective value is inf or nan.
[W 2023-12-19 00:00:57,559] Trial 345 is omitted in visualization because its objective value is inf or nan.
[W 2023-12-19 00:00:57,560] Trial 354 is omitted in visualization because its objective value is inf or nan.
[W 2023-12-19 00:00:57,561] Trial 355 is omitted in visualization because its objective value is inf or nan.
[W 2023-12-19 00:00:57,567] Trial 362 is omitted in visualization because its objective value is inf or nan.
[W 2023-12-19 00:00:57,568] Trial 367 is omitted in visualization because its objective value is inf or nan.
[W 2023-12-19 00:00:57,569] Trial 377 is omitted in visualization because its objective value is inf or nan.
[W 2023-12-19 00:00:57,570] Trial 386 is omitted in visualization because its objective value is inf or nan.
[W 2023-12-19 00:00:57,571] Trial 389 is omitted in visualization because its objective value is inf or nan.
[W 2023-12-19 00:00:57,572] Trial 390 is omitted in visualization because its objective value is inf or nan.
[W 2023-12-19 00:00:57,573] Trial 396 is omitted in visualization because its objective value is inf or nan.
[W 2023-12-19 00:00:57,574] Trial 408 is omitted in visualization because its objective value is inf or nan.
[W 2023-12-19 00:00:57,575] Trial 413 is omitted in visualization because its objective value is inf or nan.
[W 2023-12-19 00:00:57,576] Trial 431 is omitted in visualization because its objective value is inf or nan.
[W 2023-12-19 00:00:57,577] Trial 436 is omitted in visualization because its objective value is inf or nan.
[W 2023-12-19 00:00:57,578] Trial 447 is omitted in visualization because its objective value is inf or nan.
[W 2023-12-19 00:00:57,579] Trial 466 is omitted in visualization because its objective value is inf or nan.
[W 2023-12-19 00:00:57,580] Trial 477 is omitted in visualization because its objective value is inf or nan.
[W 2023-12-19 00:00:57,581] Trial 494 is omitted in visualization because its objective value is inf or nan.
TRN1 | R2:0.404; p:5.181e-247 | C:70.26 |3h:0.874 |6h:0.855 |9h:0.840 |12h:0.401 |15h:0.401 |18h:0.397 |24h:0.167 |48h:0.159 |72h:0.153 |1wk:0.022 |2wks:0.021 |1mon:0.014 |
TRN2 | R2:0.294; p:4.413e-126 | C:64.58 |3h:0.873 |6h:0.854 |9h:0.838 |12h:0.398 |15h:0.398 |18h:0.394 |24h:0.165 |48h:0.157 |72h:0.151 |1wk:0.022 |2wks:0.020 |1mon:0.014 |
VAL | R2:0.273; p:1.588e-108 | C:63.75 |3h:0.873 |6h:0.854 |9h:0.839 |12h:0.399 |15h:0.399 |18h:0.394 |24h:0.164 |48h:0.157 |72h:0.151 |1wk:0.022 |2wks:0.020 |1mon:0.014 |
[I 2023-12-19 00:01:02,744] A new study created in memory with name: no-name-34106076-8160-4a0e-952d-20abb16d1947
TST | R2:0.174; p:9.384e-132 | C:58.50 |3h:0.863 |6h:0.841 |9h:0.824 |12h:0.391 |15h:0.391 |18h:0.381 |24h:0.126 |48h:0.121 |72h:0.118 |1wk:0.020 |2wks:0.020 |1mon:0.014 |
/content/drive/MyDrive/intermediates2/res//outcome1_xgb-aft_inp19_all.json
trn1 0.3696510342649613 n= 6333
trn2 0.3742893240682249 n= 6332
val 0.3790271636133923 n= 6332
tst 0.3604716739297616 n= 19505
pos-neg-ratio: 0.36965103426496126 500 trials during Optuna search
All avail dimensionality reduced word embedding
All avail dimensionality reduced word embedding
All avail dimensionality reduced word embedding
All avail dimensionality reduced word embedding
trn1
trn2
val
tst
[I 2023-12-19 00:01:03,054] Trial 0 finished with value: 2.149880572827331 and parameters: {'learning_rate': 0.67875938523699, 'aft_loss_distribution': 'normal', 'aft_loss_distribution_scale': 3.2110987082692697, 'max_depth': 10, 'booster': 'gbtree', 'scale_pos_weight': 0.611877942080252, 'alpha': 0.9013297571207419, 'lambda': 4.857048661795002, 'eta': 0.5201140454832891, 'sampling_method': 'gradient_based', 'subsample': 0.6171987300218704, 'gamma': 9.687101706202828}. Best is trial 0 with value: 2.149880572827331.
[I 2023-12-19 00:01:10,018] Trial 1 finished with value: 2.406500312728542 and parameters: {'learning_rate': 0.6745905504169682, 'aft_loss_distribution': 'logistic', 'aft_loss_distribution_scale': 4.015437471461083, 'max_depth': 9, 'booster': 'dart', 'scale_pos_weight': 1.0686936642255807, 'alpha': 8.05725364620356, 'lambda': 5.283420328505716, 'eta': 0.258283504178213, 'sampling_method': 'uniform', 'subsample': 0.6068074745202505, 'gamma': 3.361715344767565}. Best is trial 0 with value: 2.149880572827331.
[I 2023-12-19 00:01:10,217] Trial 2 finished with value: inf and parameters: {'learning_rate': 0.5100258564341393, 'aft_loss_distribution': 'logistic', 'aft_loss_distribution_scale': 3.222419693051746, 'max_depth': 8, 'booster': 'gbtree', 'scale_pos_weight': 3.2051985954186755, 'alpha': 3.9538985486488984, 'lambda': 8.007090363920131, 'eta': 0.014922454944159225, 'sampling_method': 'uniform', 'subsample': 0.5571007940850297, 'gamma': 4.630032305857189}. Best is trial 0 with value: 2.149880572827331.
[I 2023-12-19 00:01:13,384] Trial 3 finished with value: 2.1124702259657284 and parameters: {'learning_rate': 0.00871373541078204, 'aft_loss_distribution': 'logistic', 'aft_loss_distribution_scale': 1.6750432522980516, 'max_depth': 5, 'booster': 'gbtree', 'scale_pos_weight': 2.5653079450519396, 'alpha': 6.099620330183615, 'lambda': 4.0756587781319045, 'eta': 0.33409252607462325, 'sampling_method': 'gradient_based', 'subsample': 0.4204227792069614, 'gamma': 3.444189349119063}. Best is trial 3 with value: 2.1124702259657284.
[I 2023-12-19 00:01:22,107] Trial 4 finished with value: 2.2550352711273383 and parameters: {'learning_rate': 0.09321375189410354, 'aft_loss_distribution': 'extreme', 'aft_loss_distribution_scale': 3.17609262685718, 'max_depth': 9, 'booster': 'dart', 'scale_pos_weight': 1.1393224398855117, 'alpha': 1.0443107902680444, 'lambda': 4.598395735401887, 'eta': 0.8825028605929641, 'sampling_method': 'gradient_based', 'subsample': 0.835748610460161, 'gamma': 0.7175766152143078}. Best is trial 3 with value: 2.1124702259657284.
[I 2023-12-19 00:01:22,119] Trial 5 pruned. Trial was pruned at iteration 0.
[I 2023-12-19 00:01:22,134] Trial 6 pruned. Trial was pruned at iteration 0.
[I 2023-12-19 00:01:22,148] Trial 7 pruned. Trial was pruned at iteration 0.
[I 2023-12-19 00:01:22,165] Trial 8 pruned. Trial was pruned at iteration 0.
[I 2023-12-19 00:01:22,176] Trial 9 pruned. Trial was pruned at iteration 0.
[I 2023-12-19 00:01:22,253] Trial 10 pruned. Trial was pruned at iteration 0.
[I 2023-12-19 00:01:22,323] Trial 11 pruned. Trial was pruned at iteration 0.
[I 2023-12-19 00:01:22,394] Trial 12 pruned. Trial was pruned at iteration 0.
[I 2023-12-19 00:01:22,466] Trial 13 pruned. Trial was pruned at iteration 0.
[I 2023-12-19 00:01:22,834] Trial 14 pruned. Trial was pruned at iteration 101.
[I 2023-12-19 00:01:23,371] Trial 15 finished with value: 2.1192092005291285 and parameters: {'learning_rate': 0.5405406546303517, 'aft_loss_distribution': 'logistic', 'aft_loss_distribution_scale': 1.6667732542918965, 'max_depth': 4, 'booster': 'gbtree', 'scale_pos_weight': 2.7587937756956142, 'alpha': 6.814219408627974, 'lambda': 6.287697931304477, 'eta': 0.6553871509609303, 'sampling_method': 'gradient_based', 'subsample': 0.4570350932456358, 'gamma': 8.256470180833709}. Best is trial 3 with value: 2.1124702259657284.
[I 2023-12-19 00:01:23,790] Trial 16 finished with value: 2.1219523754271274 and parameters: {'learning_rate': 0.3074950674622999, 'aft_loss_distribution': 'logistic', 'aft_loss_distribution_scale': 1.66510041121489, 'max_depth': 4, 'booster': 'gbtree', 'scale_pos_weight': 2.761351632362885, 'alpha': 7.5211155627574335, 'lambda': 6.906662963448322, 'eta': 0.7149899253830653, 'sampling_method': 'gradient_based', 'subsample': 0.2433456399197811, 'gamma': 0.4170944453966863}. Best is trial 3 with value: 2.1124702259657284.
[I 2023-12-19 00:01:23,881] Trial 17 pruned. Trial was pruned at iteration 0.
[I 2023-12-19 00:01:24,174] Trial 18 finished with value: 2.075689818320105 and parameters: {'learning_rate': 0.5360901476065713, 'aft_loss_distribution': 'logistic', 'aft_loss_distribution_scale': 1.3231017737093453, 'max_depth': 6, 'booster': 'gbtree', 'scale_pos_weight': 2.566072312282769, 'alpha': 5.2275899618583, 'lambda': 3.5832017412548547, 'eta': 0.24745765604963924, 'sampling_method': 'uniform', 'subsample': 0.15741962952630412, 'gamma': 8.315824480481496}. Best is trial 18 with value: 2.075689818320105.
[I 2023-12-19 00:01:24,265] Trial 19 pruned. Trial was pruned at iteration 0.
[I 2023-12-19 00:01:24,346] Trial 20 pruned. Trial was pruned at iteration 0.
[I 2023-12-19 00:01:24,577] Trial 21 finished with value: inf and parameters: {'learning_rate': 0.5604191970811512, 'aft_loss_distribution': 'logistic', 'aft_loss_distribution_scale': 1.4214154882180892, 'max_depth': 4, 'booster': 'gbtree', 'scale_pos_weight': 2.7743006571996007, 'alpha': 5.935534730202197, 'lambda': 3.9937363365403025, 'eta': 0.18315338169169365, 'sampling_method': 'uniform', 'subsample': 0.17950725087615133, 'gamma': 7.7322006783136406}. Best is trial 18 with value: 2.075689818320105.
[I 2023-12-19 00:01:24,653] Trial 22 pruned. Trial was pruned at iteration 2.
[I 2023-12-19 00:01:24,725] Trial 23 pruned. Trial was pruned at iteration 0.
[I 2023-12-19 00:01:24,808] Trial 24 pruned. Trial was pruned at iteration 2.
[I 2023-12-19 00:01:24,895] Trial 25 pruned. Trial was pruned at iteration 0.
[I 2023-12-19 00:01:24,970] Trial 26 pruned. Trial was pruned at iteration 0.
[I 2023-12-19 00:01:25,047] Trial 27 pruned. Trial was pruned at iteration 0.
[I 2023-12-19 00:01:25,128] Trial 28 pruned. Trial was pruned at iteration 0.
[I 2023-12-19 00:01:25,200] Trial 29 pruned. Trial was pruned at iteration 0.
[I 2023-12-19 00:01:25,282] Trial 30 pruned. Trial was pruned at iteration 0.
[I 2023-12-19 00:01:25,359] Trial 31 pruned. Trial was pruned at iteration 0.
[I 2023-12-19 00:01:25,441] Trial 32 pruned. Trial was pruned at iteration 0.
[I 2023-12-19 00:01:25,541] Trial 33 pruned. Trial was pruned at iteration 4.
[I 2023-12-19 00:01:25,621] Trial 34 pruned. Trial was pruned at iteration 0.
[I 2023-12-19 00:01:25,695] Trial 35 pruned. Trial was pruned at iteration 0.
[I 2023-12-19 00:01:25,778] Trial 36 pruned. Trial was pruned at iteration 0.
[I 2023-12-19 00:01:25,870] Trial 37 pruned. Trial was pruned at iteration 0.
[I 2023-12-19 00:01:25,948] Trial 38 pruned. Trial was pruned at iteration 0.
[I 2023-12-19 00:01:26,041] Trial 39 pruned. Trial was pruned at iteration 0.
[I 2023-12-19 00:01:26,105] Trial 40 pruned. Trial was pruned at iteration 0.
[I 2023-12-19 00:01:26,641] Trial 41 finished with value: 2.052005110833035 and parameters: {'learning_rate': 0.6872398410712127, 'aft_loss_distribution': 'normal', 'aft_loss_distribution_scale': 2.211037319643933, 'max_depth': 10, 'booster': 'gbtree', 'scale_pos_weight': 0.6892210811290759, 'alpha': 1.8590776375813687, 'lambda': 2.964891484644423, 'eta': 0.5429537728818343, 'sampling_method': 'gradient_based', 'subsample': 0.5736833872775016, 'gamma': 9.42557378061232}. Best is trial 41 with value: 2.052005110833035.
[I 2023-12-19 00:01:26,915] Trial 42 finished with value: 2.1112932753053717 and parameters: {'learning_rate': 0.7749248576833325, 'aft_loss_distribution': 'normal', 'aft_loss_distribution_scale': 2.7900118815960275, 'max_depth': 10, 'booster': 'gbtree', 'scale_pos_weight': 0.9392245435379644, 'alpha': 1.5031498668973329, 'lambda': 3.923815308421953, 'eta': 0.6449751118884823, 'sampling_method': 'gradient_based', 'subsample': 0.5764461424049556, 'gamma': 9.533959357935409}. Best is trial 41 with value: 2.052005110833035.
[I 2023-12-19 00:01:27,182] Trial 43 finished with value: 2.107691592347275 and parameters: {'learning_rate': 0.7905484808890495, 'aft_loss_distribution': 'normal', 'aft_loss_distribution_scale': 2.791204905499961, 'max_depth': 10, 'booster': 'gbtree', 'scale_pos_weight': 0.5384066488793036, 'alpha': 1.7802045362132048, 'lambda': 2.9240844316118486, 'eta': 0.5405524425247059, 'sampling_method': 'gradient_based', 'subsample': 0.6993559122556992, 'gamma': 9.536717657948154}. Best is trial 41 with value: 2.052005110833035.
[I 2023-12-19 00:01:27,245] Trial 44 pruned. Trial was pruned at iteration 1.
[I 2023-12-19 00:01:27,475] Trial 45 finished with value: inf and parameters: {'learning_rate': 0.9181854352874372, 'aft_loss_distribution': 'normal', 'aft_loss_distribution_scale': 2.7868003601960556, 'max_depth': 10, 'booster': 'gbtree', 'scale_pos_weight': 1.004416932000976, 'alpha': 1.7667889406058666, 'lambda': 3.8406452322725935, 'eta': 0.5025990267680375, 'sampling_method': 'gradient_based', 'subsample': 0.8712634254715842, 'gamma': 9.911592708659674}. Best is trial 41 with value: 2.052005110833035.
[I 2023-12-19 00:01:27,902] Trial 46 finished with value: 2.0605707151163317 and parameters: {'learning_rate': 0.7417267066249396, 'aft_loss_distribution': 'normal', 'aft_loss_distribution_scale': 2.282454083447721, 'max_depth': 9, 'booster': 'gbtree', 'scale_pos_weight': 0.5328209680090819, 'alpha': 0.11377849890129421, 'lambda': 1.618196949742909, 'eta': 0.3180176846044299, 'sampling_method': 'gradient_based', 'subsample': 0.5976206922922396, 'gamma': 9.288872306896236}. Best is trial 41 with value: 2.052005110833035.
[I 2023-12-19 00:01:27,982] Trial 47 pruned. Trial was pruned at iteration 1.
[I 2023-12-19 00:01:28,041] Trial 48 pruned. Trial was pruned at iteration 0.
[I 2023-12-19 00:01:28,100] Trial 49 pruned. Trial was pruned at iteration 0.
[I 2023-12-19 00:01:28,166] Trial 50 pruned. Trial was pruned at iteration 1.
[I 2023-12-19 00:01:28,220] Trial 51 pruned. Trial was pruned at iteration 0.
[I 2023-12-19 00:01:28,515] Trial 52 finished with value: 2.0438922576063643 and parameters: {'learning_rate': 0.7565985977415067, 'aft_loss_distribution': 'normal', 'aft_loss_distribution_scale': 2.177949296461371, 'max_depth': 10, 'booster': 'gbtree', 'scale_pos_weight': 0.3854200868030529, 'alpha': 2.776204294523547, 'lambda': 2.792274317634662, 'eta': 0.21232168074638139, 'sampling_method': 'gradient_based', 'subsample': 0.6686377820225494, 'gamma': 9.915196724746462}. Best is trial 52 with value: 2.0438922576063643.
[I 2023-12-19 00:01:28,870] Trial 53 finished with value: 2.0378640576660616 and parameters: {'learning_rate': 0.7646859339909667, 'aft_loss_distribution': 'normal', 'aft_loss_distribution_scale': 2.095466941730386, 'max_depth': 10, 'booster': 'gbtree', 'scale_pos_weight': 0.3911949564869822, 'alpha': 2.642186732949351, 'lambda': 2.0402497279294005, 'eta': 0.24159085646579084, 'sampling_method': 'gradient_based', 'subsample': 0.6531145922147926, 'gamma': 9.975680076088526}. Best is trial 53 with value: 2.0378640576660616.
[I 2023-12-19 00:01:29,099] Trial 54 finished with value: 2.0360232892164376 and parameters: {'learning_rate': 0.8522435948749854, 'aft_loss_distribution': 'normal', 'aft_loss_distribution_scale': 2.0582810922179036, 'max_depth': 10, 'booster': 'gbtree', 'scale_pos_weight': 0.42731688719757394, 'alpha': 2.8075434180270507, 'lambda': 1.8200494779540792, 'eta': 0.2222798671215733, 'sampling_method': 'gradient_based', 'subsample': 0.6741404858261271, 'gamma': 9.872336977771033}. Best is trial 54 with value: 2.0360232892164376.
[I 2023-12-19 00:01:29,289] Trial 55 finished with value: inf and parameters: {'learning_rate': 0.8663034578861316, 'aft_loss_distribution': 'normal', 'aft_loss_distribution_scale': 2.1025345637200266, 'max_depth': 9, 'booster': 'gbtree', 'scale_pos_weight': 0.3350847311811223, 'alpha': 3.4718304301838243, 'lambda': 1.9394691008146245, 'eta': 0.2219575650035105, 'sampling_method': 'gradient_based', 'subsample': 0.6522375655314112, 'gamma': 9.924953653188815}. Best is trial 54 with value: 2.0360232892164376.
