[I 2023-12-19 00:26:36,639] Trial 143 finished with value: 2.071388431976171 and parameters: {'learning_rate': 0.7599950434286505, 'aft_loss_distribution': 'normal', 'aft_loss_distribution_scale': 2.243679428526194, 'max_depth': 7, 'booster': 'gbtree', 'scale_pos_weight': 0.03933945673793489, 'alpha': 5.15324168517126, 'lambda': 1.8420442115312494, 'eta': 0.38307367176024476, 'sampling_method': 'uniform', 'subsample': 0.5850909856297498, 'gamma': 8.83498907149655}. Best is trial 143 with value: 2.071388431976171.
[I 2023-12-19 00:26:36,902] Trial 144 finished with value: 2.0644505989626354 and parameters: {'learning_rate': 0.779512303960279, 'aft_loss_distribution': 'normal', 'aft_loss_distribution_scale': 2.1778043933628184, 'max_depth': 7, 'booster': 'gbtree', 'scale_pos_weight': 0.21008556852925234, 'alpha': 5.334914939803882, 'lambda': 2.233044490144331, 'eta': 0.3789435744539646, 'sampling_method': 'uniform', 'subsample': 0.5832698849527578, 'gamma': 8.839716071065768}. Best is trial 144 with value: 2.0644505989626354.
[I 2023-12-19 00:26:37,208] Trial 145 finished with value: 2.066639700506456 and parameters: {'learning_rate': 0.7681486039388011, 'aft_loss_distribution': 'normal', 'aft_loss_distribution_scale': 2.187947141854881, 'max_depth': 7, 'booster': 'gbtree', 'scale_pos_weight': 0.19309504008560885, 'alpha': 5.222113407449493, 'lambda': 2.327660163001552, 'eta': 0.3759769666210371, 'sampling_method': 'uniform', 'subsample': 0.5683296216401802, 'gamma': 8.847248601699334}. Best is trial 144 with value: 2.0644505989626354.
[I 2023-12-19 00:26:37,463] Trial 146 finished with value: 2.0653931258430163 and parameters: {'learning_rate': 0.7609918966365898, 'aft_loss_distribution': 'normal', 'aft_loss_distribution_scale': 2.185405385859234, 'max_depth': 7, 'booster': 'gbtree', 'scale_pos_weight': 0.20669967456565355, 'alpha': 5.205868117229541, 'lambda': 2.315734363815892, 'eta': 0.3763656348715164, 'sampling_method': 'uniform', 'subsample': 0.6040793840669836, 'gamma': 8.839190128152834}. Best is trial 144 with value: 2.0644505989626354.
[I 2023-12-19 00:26:37,683] Trial 147 finished with value: 2.0677567855339913 and parameters: {'learning_rate': 0.760864175603572, 'aft_loss_distribution': 'normal', 'aft_loss_distribution_scale': 2.2054066817703735, 'max_depth': 7, 'booster': 'gbtree', 'scale_pos_weight': 0.19397388018548628, 'alpha': 5.509356813445638, 'lambda': 2.3083257797367884, 'eta': 0.37975556646214226, 'sampling_method': 'uniform', 'subsample': 0.5863852612323059, 'gamma': 8.070271058016335}. Best is trial 144 with value: 2.0644505989626354.
[I 2023-12-19 00:26:37,917] Trial 148 finished with value: 2.066071485409258 and parameters: {'learning_rate': 0.8078565030926529, 'aft_loss_distribution': 'normal', 'aft_loss_distribution_scale': 2.188214628164811, 'max_depth': 7, 'booster': 'gbtree', 'scale_pos_weight': 0.19932296683105202, 'alpha': 5.434764233638881, 'lambda': 2.3020034638493927, 'eta': 0.3802202766904919, 'sampling_method': 'uniform', 'subsample': 0.5872788607852842, 'gamma': 8.798831038218557}. Best is trial 144 with value: 2.0644505989626354.
[I 2023-12-19 00:26:38,209] Trial 149 finished with value: 2.0355823423517214 and parameters: {'learning_rate': 0.8122985257748622, 'aft_loss_distribution': 'normal', 'aft_loss_distribution_scale': 1.8175127224540275, 'max_depth': 7, 'booster': 'gbtree', 'scale_pos_weight': 0.20009953575848047, 'alpha': 5.551629419603212, 'lambda': 2.3348817448526074, 'eta': 0.37690702593946174, 'sampling_method': 'uniform', 'subsample': 0.5873212045332495, 'gamma': 8.44246119635807}. Best is trial 149 with value: 2.0355823423517214.
[I 2023-12-19 00:26:38,281] Trial 150 pruned. Trial was pruned at iteration 0.
[I 2023-12-19 00:26:38,491] Trial 151 finished with value: inf and parameters: {'learning_rate': 0.7652045370822645, 'aft_loss_distribution': 'normal', 'aft_loss_distribution_scale': 2.124637144608249, 'max_depth': 7, 'booster': 'gbtree', 'scale_pos_weight': 0.19095746330218977, 'alpha': 5.1475110668241655, 'lambda': 2.618469962690536, 'eta': 0.38979805323971334, 'sampling_method': 'uniform', 'subsample': 0.6082326151619124, 'gamma': 8.515813016096944}. Best is trial 149 with value: 2.0355823423517214.
[I 2023-12-19 00:26:38,754] Trial 152 finished with value: 2.0401958885026 and parameters: {'learning_rate': 0.7828547153285078, 'aft_loss_distribution': 'normal', 'aft_loss_distribution_scale': 1.8943309273752706, 'max_depth': 7, 'booster': 'gbtree', 'scale_pos_weight': 0.17534379804175115, 'alpha': 5.361669202568919, 'lambda': 2.222800922186182, 'eta': 0.3595664226063836, 'sampling_method': 'uniform', 'subsample': 0.571794098532177, 'gamma': 8.679733413814851}. Best is trial 149 with value: 2.0355823423517214.
[I 2023-12-19 00:26:39,044] Trial 153 finished with value: 2.034884059982263 and parameters: {'learning_rate': 0.7923970415599646, 'aft_loss_distribution': 'normal', 'aft_loss_distribution_scale': 1.8277624255570752, 'max_depth': 7, 'booster': 'gbtree', 'scale_pos_weight': 0.18565240619288292, 'alpha': 5.3567734655738946, 'lambda': 2.3193332065776437, 'eta': 0.3591177036292122, 'sampling_method': 'uniform', 'subsample': 0.5735827372780189, 'gamma': 8.824410825680422}. Best is trial 153 with value: 2.034884059982263.
[I 2023-12-19 00:26:39,298] Trial 154 finished with value: 2.0341886212581657 and parameters: {'learning_rate': 0.7901075465321797, 'aft_loss_distribution': 'normal', 'aft_loss_distribution_scale': 1.8169217814162306, 'max_depth': 7, 'booster': 'gbtree', 'scale_pos_weight': 0.16945614090585395, 'alpha': 5.3976441042544065, 'lambda': 2.2707282635281056, 'eta': 0.357407204341241, 'sampling_method': 'uniform', 'subsample': 0.5789992954500144, 'gamma': 8.894541050099718}. Best is trial 154 with value: 2.0341886212581657.
[I 2023-12-19 00:26:39,528] Trial 155 finished with value: 2.0233546769587814 and parameters: {'learning_rate': 0.7969447043047054, 'aft_loss_distribution': 'normal', 'aft_loss_distribution_scale': 1.6737202954022163, 'max_depth': 7, 'booster': 'gbtree', 'scale_pos_weight': 0.18156858523249936, 'alpha': 5.383434843587049, 'lambda': 2.1822696687219016, 'eta': 0.3533727294694815, 'sampling_method': 'uniform', 'subsample': 0.6265394483156769, 'gamma': 8.759470816731747}. Best is trial 155 with value: 2.0233546769587814.
[I 2023-12-19 00:26:39,737] Trial 156 finished with value: inf and parameters: {'learning_rate': 0.8287351658265332, 'aft_loss_distribution': 'normal', 'aft_loss_distribution_scale': 1.6121132077097304, 'max_depth': 7, 'booster': 'gbtree', 'scale_pos_weight': 0.3539815498672833, 'alpha': 5.389967822653333, 'lambda': 2.1915921713893574, 'eta': 0.3248226148367265, 'sampling_method': 'uniform', 'subsample': 0.6282300016501166, 'gamma': 8.687992459430063}. Best is trial 155 with value: 2.0233546769587814.
[I 2023-12-19 00:26:39,820] Trial 157 pruned. Trial was pruned at iteration 0.
[I 2023-12-19 00:26:39,993] Trial 158 finished with value: inf and parameters: {'learning_rate': 0.8625160139531195, 'aft_loss_distribution': 'normal', 'aft_loss_distribution_scale': 1.886785534605196, 'max_depth': 7, 'booster': 'gbtree', 'scale_pos_weight': 0.18510095982419597, 'alpha': 5.269671557402416, 'lambda': 2.4323323587708083, 'eta': 0.3561237495124551, 'sampling_method': 'uniform', 'subsample': 0.5728012200084884, 'gamma': 7.807510899123379}. Best is trial 155 with value: 2.0233546769587814.
[I 2023-12-19 00:26:40,065] Trial 159 pruned. Trial was pruned at iteration 0.
[I 2023-12-19 00:26:40,341] Trial 160 finished with value: 2.0310753439588676 and parameters: {'learning_rate': 0.7891917851323442, 'aft_loss_distribution': 'normal', 'aft_loss_distribution_scale': 1.756203628933103, 'max_depth': 7, 'booster': 'gbtree', 'scale_pos_weight': 0.1774939029287217, 'alpha': 6.060473290882241, 'lambda': 2.747405815479585, 'eta': 0.4057615375112811, 'sampling_method': 'uniform', 'subsample': 0.5905165399444057, 'gamma': 8.4359495993773}. Best is trial 155 with value: 2.0233546769587814.
[I 2023-12-19 00:26:40,632] Trial 161 finished with value: 2.029119882660554 and parameters: {'learning_rate': 0.7928365514819649, 'aft_loss_distribution': 'normal', 'aft_loss_distribution_scale': 1.7239968203513518, 'max_depth': 7, 'booster': 'gbtree', 'scale_pos_weight': 0.17102449977770984, 'alpha': 5.638644416780128, 'lambda': 2.2058372847694603, 'eta': 0.4058831727556824, 'sampling_method': 'uniform', 'subsample': 0.5908026609672615, 'gamma': 8.424108627232108}. Best is trial 155 with value: 2.0233546769587814.
[I 2023-12-19 00:26:40,889] Trial 162 finished with value: 2.031499731209473 and parameters: {'learning_rate': 0.8334180930951862, 'aft_loss_distribution': 'normal', 'aft_loss_distribution_scale': 1.8076100057911466, 'max_depth': 7, 'booster': 'gbtree', 'scale_pos_weight': 0.17383119642520375, 'alpha': 6.125541403505429, 'lambda': 2.3255983265233406, 'eta': 0.3705568609852276, 'sampling_method': 'uniform', 'subsample': 0.6370087687756224, 'gamma': 8.471606027858252}. Best is trial 155 with value: 2.0233546769587814.
[I 2023-12-19 00:26:40,959] Trial 163 pruned. Trial was pruned at iteration 0.
[I 2023-12-19 00:26:41,167] Trial 164 finished with value: inf and parameters: {'learning_rate': 0.8422649704704877, 'aft_loss_distribution': 'normal', 'aft_loss_distribution_scale': 1.9697878275460603, 'max_depth': 7, 'booster': 'gbtree', 'scale_pos_weight': 0.16290254056919, 'alpha': 5.660880505100563, 'lambda': 2.3929038386478787, 'eta': 0.40690611372141783, 'sampling_method': 'uniform', 'subsample': 0.5916588401485404, 'gamma': 8.70396753344844}. Best is trial 155 with value: 2.0233546769587814.
[I 2023-12-19 00:26:41,418] Trial 165 finished with value: 2.026730047025084 and parameters: {'learning_rate': 0.8243475299895648, 'aft_loss_distribution': 'normal', 'aft_loss_distribution_scale': 1.741046022621543, 'max_depth': 7, 'booster': 'gbtree', 'scale_pos_weight': 0.24505562844943865, 'alpha': 6.165846918524596, 'lambda': 2.201193379923136, 'eta': 0.3397114198880463, 'sampling_method': 'uniform', 'subsample': 0.6226000135045057, 'gamma': 8.383778545517682}. Best is trial 155 with value: 2.0233546769587814.
[I 2023-12-19 00:26:41,628] Trial 166 finished with value: inf and parameters: {'learning_rate': 0.9031097117937025, 'aft_loss_distribution': 'normal', 'aft_loss_distribution_scale': 1.689599606073617, 'max_depth': 7, 'booster': 'gbtree', 'scale_pos_weight': 0.3357672146098737, 'alpha': 6.165562546113519, 'lambda': 3.085906941270773, 'eta': 0.34088909021014646, 'sampling_method': 'uniform', 'subsample': 0.6218460763867244, 'gamma': 8.420062101106142}. Best is trial 155 with value: 2.0233546769587814.
[I 2023-12-19 00:26:41,866] Trial 167 finished with value: 2.028915843561735 and parameters: {'learning_rate': 0.8251846044618445, 'aft_loss_distribution': 'normal', 'aft_loss_distribution_scale': 1.7867503329285381, 'max_depth': 7, 'booster': 'gbtree', 'scale_pos_weight': 0.24938835388615996, 'alpha': 5.373193585926347, 'lambda': 2.1988297764501645, 'eta': 0.36807923314928576, 'sampling_method': 'uniform', 'subsample': 0.658786332437804, 'gamma': 8.116097285066115}. Best is trial 155 with value: 2.0233546769587814.
[I 2023-12-19 00:26:42,060] Trial 168 finished with value: inf and parameters: {'learning_rate': 0.8318198594543157, 'aft_loss_distribution': 'normal', 'aft_loss_distribution_scale': 1.8380415553840825, 'max_depth': 7, 'booster': 'gbtree', 'scale_pos_weight': 0.2540427598656897, 'alpha': 5.33777832848257, 'lambda': 2.218381360570326, 'eta': 0.3114083560793108, 'sampling_method': 'uniform', 'subsample': 0.6610096310750384, 'gamma': 7.951485897572654}. Best is trial 155 with value: 2.0233546769587814.
[I 2023-12-19 00:26:42,130] Trial 169 pruned. Trial was pruned at iteration 0.
[I 2023-12-19 00:26:42,350] Trial 170 finished with value: 2.061061864430076 and parameters: {'learning_rate': 0.8181861114962872, 'aft_loss_distribution': 'normal', 'aft_loss_distribution_scale': 2.144130214265777, 'max_depth': 6, 'booster': 'gbtree', 'scale_pos_weight': 0.17079204899496542, 'alpha': 5.818208157913615, 'lambda': 2.073033231467006, 'eta': 0.33631154008058295, 'sampling_method': 'uniform', 'subsample': 0.6391762759719369, 'gamma': 8.708120343712583}. Best is trial 155 with value: 2.0233546769587814.
[I 2023-12-19 00:26:42,585] Trial 171 finished with value: 2.053793731218481 and parameters: {'learning_rate': 0.8169686721399843, 'aft_loss_distribution': 'normal', 'aft_loss_distribution_scale': 2.0653443888355825, 'max_depth': 6, 'booster': 'gbtree', 'scale_pos_weight': 0.16939744310854488, 'alpha': 5.910602145020466, 'lambda': 2.0730356508391847, 'eta': 0.3389731959791067, 'sampling_method': 'uniform', 'subsample': 0.6514203294337412, 'gamma': 8.731126315645344}. Best is trial 155 with value: 2.0233546769587814.
[I 2023-12-19 00:26:42,827] Trial 172 finished with value: 2.0570247262598023 and parameters: {'learning_rate': 0.8221350017907622, 'aft_loss_distribution': 'normal', 'aft_loss_distribution_scale': 2.1006063225378, 'max_depth': 6, 'booster': 'gbtree', 'scale_pos_weight': 0.2078304233446197, 'alpha': 5.932936295813969, 'lambda': 2.060678962370834, 'eta': 0.3408205830786912, 'sampling_method': 'uniform', 'subsample': 0.6472921914636763, 'gamma': 8.619688237593419}. Best is trial 155 with value: 2.0233546769587814.
[I 2023-12-19 00:26:43,081] Trial 173 finished with value: 2.0572775173841653 and parameters: {'learning_rate': 0.821159351938443, 'aft_loss_distribution': 'normal', 'aft_loss_distribution_scale': 2.1034035142669225, 'max_depth': 6, 'booster': 'gbtree', 'scale_pos_weight': 0.308664552888673, 'alpha': 5.983178206125415, 'lambda': 2.0616888230481987, 'eta': 0.33823010492094974, 'sampling_method': 'uniform', 'subsample': 0.6556892625704506, 'gamma': 8.571829774400532}. Best is trial 155 with value: 2.0233546769587814.
[I 2023-12-19 00:26:43,157] Trial 174 pruned. Trial was pruned at iteration 0.
[I 2023-12-19 00:26:43,371] Trial 175 finished with value: inf and parameters: {'learning_rate': 0.7904681818297321, 'aft_loss_distribution': 'normal', 'aft_loss_distribution_scale': 1.7897084981902216, 'max_depth': 6, 'booster': 'gbtree', 'scale_pos_weight': 0.41175909684399364, 'alpha': 6.006442070230081, 'lambda': 2.4979026907492434, 'eta': 0.32918278060373357, 'sampling_method': 'uniform', 'subsample': 0.6782513865094396, 'gamma': 8.389673510105322}. Best is trial 155 with value: 2.0233546769587814.
[I 2023-12-19 00:26:43,605] Trial 176 finished with value: inf and parameters: {'learning_rate': 0.8679769560402341, 'aft_loss_distribution': 'normal', 'aft_loss_distribution_scale': 1.6120404887094966, 'max_depth': 6, 'booster': 'gbtree', 'scale_pos_weight': 0.2280828287227762, 'alpha': 5.808198493380428, 'lambda': 2.657279106219945, 'eta': 0.36087638754199225, 'sampling_method': 'uniform', 'subsample': 0.6333940973395167, 'gamma': 8.665708334167201}. Best is trial 155 with value: 2.0233546769587814.
[I 2023-12-19 00:26:43,865] Trial 177 finished with value: 2.0438988919565153 and parameters: {'learning_rate': 0.8277453899592205, 'aft_loss_distribution': 'normal', 'aft_loss_distribution_scale': 1.9613481904531307, 'max_depth': 6, 'booster': 'gbtree', 'scale_pos_weight': 0.15114377948927274, 'alpha': 6.5799003184166, 'lambda': 2.0804465827646363, 'eta': 0.30696311580519187, 'sampling_method': 'uniform', 'subsample': 0.6646080057207663, 'gamma': 7.594771565875897}. Best is trial 155 with value: 2.0233546769587814.
[I 2023-12-19 00:26:44,194] Trial 178 finished with value: 2.0474067719502287 and parameters: {'learning_rate': 0.8325455872688615, 'aft_loss_distribution': 'normal', 'aft_loss_distribution_scale': 2.0019518919356414, 'max_depth': 6, 'booster': 'gbtree', 'scale_pos_weight': 0.2896318917138393, 'alpha': 6.49585083316997, 'lambda': 2.0306607372334384, 'eta': 0.3084788612139252, 'sampling_method': 'uniform', 'subsample': 0.6646423029157293, 'gamma': 7.4374598787453685}. Best is trial 155 with value: 2.0233546769587814.
[I 2023-12-19 00:26:44,536] Trial 179 finished with value: 2.0446897789808216 and parameters: {'learning_rate': 0.8358285324556148, 'aft_loss_distribution': 'normal', 'aft_loss_distribution_scale': 1.9707076406746156, 'max_depth': 6, 'booster': 'gbtree', 'scale_pos_weight': 0.3492400049609188, 'alpha': 6.222375460381322, 'lambda': 2.034838196065691, 'eta': 0.3067823044796522, 'sampling_method': 'uniform', 'subsample': 0.6649252010706096, 'gamma': 7.2628816430667875}. Best is trial 155 with value: 2.0233546769587814.
[I 2023-12-19 00:26:44,874] Trial 180 finished with value: 2.042993912867114 and parameters: {'learning_rate': 0.8339190553479051, 'aft_loss_distribution': 'normal', 'aft_loss_distribution_scale': 1.950935379466503, 'max_depth': 6, 'booster': 'gbtree', 'scale_pos_weight': 0.30003807583823944, 'alpha': 6.63566511302682, 'lambda': 2.0709214792486894, 'eta': 0.2835538662138066, 'sampling_method': 'uniform', 'subsample': 0.6668953064217151, 'gamma': 7.467524929050265}. Best is trial 155 with value: 2.0233546769587814.
[I 2023-12-19 00:26:45,202] Trial 181 finished with value: 2.044324863006882 and parameters: {'learning_rate': 0.840784608625854, 'aft_loss_distribution': 'normal', 'aft_loss_distribution_scale': 1.9791825945621278, 'max_depth': 6, 'booster': 'gbtree', 'scale_pos_weight': 0.336634002560111, 'alpha': 6.700354514116916, 'lambda': 1.995443202083454, 'eta': 0.2769647998947592, 'sampling_method': 'uniform', 'subsample': 0.6779128381883067, 'gamma': 7.118907195981369}. Best is trial 155 with value: 2.0233546769587814.
[I 2023-12-19 00:26:45,535] Trial 182 finished with value: 2.041087707220321 and parameters: {'learning_rate': 0.8398514997521066, 'aft_loss_distribution': 'normal', 'aft_loss_distribution_scale': 1.9283211055282394, 'max_depth': 6, 'booster': 'gbtree', 'scale_pos_weight': 0.37487743061034773, 'alpha': 6.613942339716914, 'lambda': 2.0240257245936344, 'eta': 0.2659726695210205, 'sampling_method': 'uniform', 'subsample': 0.6690691376149367, 'gamma': 7.397060438006859}. Best is trial 155 with value: 2.0233546769587814.
[I 2023-12-19 00:26:45,871] Trial 183 finished with value: 2.0413815279591527 and parameters: {'learning_rate': 0.9039261630399278, 'aft_loss_distribution': 'normal', 'aft_loss_distribution_scale': 1.9357424513594372, 'max_depth': 6, 'booster': 'gbtree', 'scale_pos_weight': 0.36322155331556827, 'alpha': 6.607267604746927, 'lambda': 1.6245874769151785, 'eta': 0.27253407683041414, 'sampling_method': 'uniform', 'subsample': 0.6677408214517517, 'gamma': 7.69161253312754}. Best is trial 155 with value: 2.0233546769587814.
[I 2023-12-19 00:26:46,133] Trial 184 finished with value: inf and parameters: {'learning_rate': 0.9176966212053592, 'aft_loss_distribution': 'normal', 'aft_loss_distribution_scale': 1.4901346546874235, 'max_depth': 6, 'booster': 'gbtree', 'scale_pos_weight': 0.5511688409613317, 'alpha': 6.607505542758492, 'lambda': 1.6657548938180995, 'eta': 0.2730617354606244, 'sampling_method': 'uniform', 'subsample': 0.678795649838795, 'gamma': 7.410573672671192}. Best is trial 155 with value: 2.0233546769587814.
[I 2023-12-19 00:26:46,503] Trial 185 finished with value: 2.0274499574654685 and parameters: {'learning_rate': 0.8431891286104172, 'aft_loss_distribution': 'normal', 'aft_loss_distribution_scale': 1.7489182812236737, 'max_depth': 6, 'booster': 'gbtree', 'scale_pos_weight': 0.37726687345561094, 'alpha': 6.673046525784724, 'lambda': 1.9921611569995772, 'eta': 0.2900218144125201, 'sampling_method': 'uniform', 'subsample': 0.6947962350096969, 'gamma': 7.617495043221499}. Best is trial 155 with value: 2.0233546769587814.
[I 2023-12-19 00:26:46,922] Trial 186 finished with value: 2.0312925017563708 and parameters: {'learning_rate': 0.8754327920902478, 'aft_loss_distribution': 'normal', 'aft_loss_distribution_scale': 1.7871102144469873, 'max_depth': 6, 'booster': 'gbtree', 'scale_pos_weight': 0.4147387694094071, 'alpha': 6.739656644889789, 'lambda': 2.5267541302032015, 'eta': 0.24315592913344164, 'sampling_method': 'uniform', 'subsample': 0.699673316470416, 'gamma': 7.20706381885507}. Best is trial 155 with value: 2.0233546769587814.
[I 2023-12-19 00:26:47,048] Trial 187 pruned. Trial was pruned at iteration 0.
[I 2023-12-19 00:26:47,161] Trial 188 pruned. Trial was pruned at iteration 0.
[I 2023-12-19 00:26:47,256] Trial 189 pruned. Trial was pruned at iteration 0.
[I 2023-12-19 00:26:47,655] Trial 190 finished with value: 2.0355877889466014 and parameters: {'learning_rate': 0.8708923399143185, 'aft_loss_distribution': 'normal', 'aft_loss_distribution_scale': 1.8467344416042861, 'max_depth': 6, 'booster': 'gbtree', 'scale_pos_weight': 0.5037067659915577, 'alpha': 6.257516610671333, 'lambda': 2.765364091168012, 'eta': 0.309505268580334, 'sampling_method': 'uniform', 'subsample': 0.7127785332320954, 'gamma': 7.069156548080141}. Best is trial 155 with value: 2.0233546769587814.
[I 2023-12-19 00:26:48,090] Trial 191 finished with value: 2.0349642148058242 and parameters: {'learning_rate': 0.8758292901548129, 'aft_loss_distribution': 'normal', 'aft_loss_distribution_scale': 1.8382557525837102, 'max_depth': 6, 'booster': 'gbtree', 'scale_pos_weight': 0.5016870076642352, 'alpha': 6.266949945980055, 'lambda': 2.8417712037247433, 'eta': 0.3120233276820035, 'sampling_method': 'uniform', 'subsample': 0.7114925521872943, 'gamma': 7.117501303037286}. Best is trial 155 with value: 2.0233546769587814.
[I 2023-12-19 00:26:48,448] Trial 192 finished with value: 2.025669445156354 and parameters: {'learning_rate': 0.862797993366079, 'aft_loss_distribution': 'normal', 'aft_loss_distribution_scale': 1.7355306248817548, 'max_depth': 6, 'booster': 'gbtree', 'scale_pos_weight': 0.6050498829276397, 'alpha': 6.223535581099072, 'lambda': 2.765737029416411, 'eta': 0.25366284341604217, 'sampling_method': 'uniform', 'subsample': 0.7129300581499421, 'gamma': 7.091648200296341}. Best is trial 155 with value: 2.0233546769587814.
