[I 2023-12-19 05:26:54,482] Trial 106 finished with value: 4.269878845837158 and parameters: {'learning_rate': 0.8050193952508407, 'aft_loss_distribution': 'normal', 'aft_loss_distribution_scale': 1.2545816275673196, 'max_depth': 9, 'booster': 'gbtree', 'scale_pos_weight': 5.905900067406405, 'alpha': 8.143604310987053, 'lambda': 0.0639755022488177, 'eta': 0.15640346957301174, 'sampling_method': 'uniform', 'subsample': 0.8576238838370879, 'gamma': 9.901236361437938}. Best is trial 105 with value: 4.2632662205386405.
[I 2023-12-19 05:26:55,520] Trial 107 finished with value: inf and parameters: {'learning_rate': 0.8098960812041425, 'aft_loss_distribution': 'normal', 'aft_loss_distribution_scale': 0.9032205728302742, 'max_depth': 9, 'booster': 'gbtree', 'scale_pos_weight': 5.897728273721543, 'alpha': 7.885639208356571, 'lambda': 0.023460320284197853, 'eta': 0.14447256536484315, 'sampling_method': 'uniform', 'subsample': 0.8498947443693231, 'gamma': 9.832768399651137}. Best is trial 105 with value: 4.2632662205386405.
[I 2023-12-19 05:26:55,644] Trial 108 pruned. Trial was pruned at iteration 0.
[I 2023-12-19 05:26:55,775] Trial 109 pruned. Trial was pruned at iteration 0.
[I 2023-12-19 05:26:56,198] Trial 110 pruned. Trial was pruned at iteration 2.
[I 2023-12-19 05:26:57,421] Trial 111 finished with value: inf and parameters: {'learning_rate': 0.8518382230256285, 'aft_loss_distribution': 'normal', 'aft_loss_distribution_scale': 1.1438793190544085, 'max_depth': 9, 'booster': 'gbtree', 'scale_pos_weight': 6.618491089908555, 'alpha': 7.270043779651688, 'lambda': 0.01123996049776839, 'eta': 0.23211621131372476, 'sampling_method': 'uniform', 'subsample': 0.9109162685548129, 'gamma': 9.998534729502964}. Best is trial 105 with value: 4.2632662205386405.
[I 2023-12-19 05:26:58,161] Trial 112 finished with value: inf and parameters: {'learning_rate': 0.717629704962092, 'aft_loss_distribution': 'normal', 'aft_loss_distribution_scale': 1.4814465109679922, 'max_depth': 9, 'booster': 'gbtree', 'scale_pos_weight': 5.766446574658602, 'alpha': 8.417775688822099, 'lambda': 0.7874646440330938, 'eta': 0.2034578825388904, 'sampling_method': 'uniform', 'subsample': 0.8840975204042002, 'gamma': 9.526922583720244}. Best is trial 105 with value: 4.2632662205386405.
[I 2023-12-19 05:26:58,528] Trial 113 finished with value: inf and parameters: {'learning_rate': 0.8173741847486271, 'aft_loss_distribution': 'normal', 'aft_loss_distribution_scale': 1.0674311607818372, 'max_depth': 9, 'booster': 'gbtree', 'scale_pos_weight': 6.197506312081572, 'alpha': 7.777260200096299, 'lambda': 1.1470384541758305, 'eta': 0.060216076473441404, 'sampling_method': 'uniform', 'subsample': 0.8286737247681055, 'gamma': 9.08060837857526}. Best is trial 105 with value: 4.2632662205386405.
[I 2023-12-19 05:26:58,612] Trial 114 pruned. Trial was pruned at iteration 0.
[I 2023-12-19 05:26:59,557] Trial 115 finished with value: 4.319985139781596 and parameters: {'learning_rate': 0.7974273749387931, 'aft_loss_distribution': 'normal', 'aft_loss_distribution_scale': 1.4329535684111425, 'max_depth': 9, 'booster': 'gbtree', 'scale_pos_weight': 6.4356637321465175, 'alpha': 7.57676158470932, 'lambda': 0.8113288760947512, 'eta': 0.12901851190472188, 'sampling_method': 'uniform', 'subsample': 0.9721441244675642, 'gamma': 9.723124511003304}. Best is trial 105 with value: 4.2632662205386405.
[I 2023-12-19 05:26:59,861] Trial 116 finished with value: inf and parameters: {'learning_rate': 0.9143380427765684, 'aft_loss_distribution': 'normal', 'aft_loss_distribution_scale': 1.2572377057383528, 'max_depth': 9, 'booster': 'gbtree', 'scale_pos_weight': 6.455132843840065, 'alpha': 7.109413316693346, 'lambda': 0.7755220351290701, 'eta': 0.11881592091900467, 'sampling_method': 'uniform', 'subsample': 0.9716114467950377, 'gamma': 9.67942175780719}. Best is trial 105 with value: 4.2632662205386405.
[I 2023-12-19 05:26:59,959] Trial 117 pruned. Trial was pruned at iteration 0.
[I 2023-12-19 05:27:00,040] Trial 118 pruned. Trial was pruned at iteration 0.
[I 2023-12-19 05:27:00,678] Trial 119 finished with value: 4.327655532079259 and parameters: {'learning_rate': 0.8278869898619, 'aft_loss_distribution': 'normal', 'aft_loss_distribution_scale': 1.4542523160904717, 'max_depth': 9, 'booster': 'gbtree', 'scale_pos_weight': 6.265077867646795, 'alpha': 8.063831864246344, 'lambda': 0.9708878969405158, 'eta': 0.14187819554456016, 'sampling_method': 'uniform', 'subsample': 0.9242377900928553, 'gamma': 9.764751659681664}. Best is trial 105 with value: 4.2632662205386405.
[I 2023-12-19 05:27:00,760] Trial 120 pruned. Trial was pruned at iteration 0.
[I 2023-12-19 05:27:01,081] Trial 121 finished with value: inf and parameters: {'learning_rate': 0.848237814653305, 'aft_loss_distribution': 'normal', 'aft_loss_distribution_scale': 1.4178781441684563, 'max_depth': 9, 'booster': 'gbtree', 'scale_pos_weight': 6.293718074086559, 'alpha': 8.052364621637409, 'lambda': 0.793665138654791, 'eta': 0.27373108566296434, 'sampling_method': 'uniform', 'subsample': 0.9998222175892894, 'gamma': 9.550849107196067}. Best is trial 105 with value: 4.2632662205386405.
[I 2023-12-19 05:27:01,487] Trial 122 finished with value: 4.327264111383811 and parameters: {'learning_rate': 0.7347569997264952, 'aft_loss_distribution': 'normal', 'aft_loss_distribution_scale': 1.450710919786724, 'max_depth': 9, 'booster': 'gbtree', 'scale_pos_weight': 6.616666231198713, 'alpha': 8.558456862769443, 'lambda': 1.4126772063070734, 'eta': 0.13463843451806895, 'sampling_method': 'uniform', 'subsample': 0.9225790789337225, 'gamma': 9.343689157361768}. Best is trial 105 with value: 4.2632662205386405.
[I 2023-12-19 05:27:02,179] Trial 123 finished with value: 4.270014181272483 and parameters: {'learning_rate': 0.7859017200270411, 'aft_loss_distribution': 'normal', 'aft_loss_distribution_scale': 1.261387017608369, 'max_depth': 9, 'booster': 'gbtree', 'scale_pos_weight': 6.08461474632842, 'alpha': 7.926169888070648, 'lambda': 1.4649044911228648, 'eta': 0.07766740687390368, 'sampling_method': 'uniform', 'subsample': 0.9254831961705126, 'gamma': 9.254619608813831}. Best is trial 105 with value: 4.2632662205386405.
[I 2023-12-19 05:27:02,269] Trial 124 pruned. Trial was pruned at iteration 0.
[I 2023-12-19 05:27:02,356] Trial 125 pruned. Trial was pruned at iteration 0.
[I 2023-12-19 05:27:02,441] Trial 126 pruned. Trial was pruned at iteration 0.
[I 2023-12-19 05:27:02,524] Trial 127 pruned. Trial was pruned at iteration 0.
[I 2023-12-19 05:27:02,612] Trial 128 pruned. Trial was pruned at iteration 0.
[I 2023-12-19 05:27:02,704] Trial 129 pruned. Trial was pruned at iteration 0.
[I 2023-12-19 05:27:03,605] Trial 130 finished with value: 4.312585269136211 and parameters: {'learning_rate': 0.9423797800048341, 'aft_loss_distribution': 'normal', 'aft_loss_distribution_scale': 1.4000003891619763, 'max_depth': 9, 'booster': 'gbtree', 'scale_pos_weight': 6.966311751720165, 'alpha': 8.058119558814592, 'lambda': 0.010480500846041511, 'eta': 0.12464195269539342, 'sampling_method': 'uniform', 'subsample': 0.7888413553491966, 'gamma': 9.223168605432646}. Best is trial 105 with value: 4.2632662205386405.
[I 2023-12-19 05:27:04,351] Trial 131 finished with value: 4.318253569810706 and parameters: {'learning_rate': 0.8243576383987113, 'aft_loss_distribution': 'normal', 'aft_loss_distribution_scale': 1.4291608825876054, 'max_depth': 9, 'booster': 'gbtree', 'scale_pos_weight': 6.949862829963972, 'alpha': 7.9794030042457695, 'lambda': 0.017163181330478866, 'eta': 0.12672667998525694, 'sampling_method': 'uniform', 'subsample': 0.7777333421197468, 'gamma': 9.206823488286181}. Best is trial 105 with value: 4.2632662205386405.
[I 2023-12-19 05:27:05,278] Trial 132 finished with value: 4.294178576234095 and parameters: {'learning_rate': 0.9857560990042461, 'aft_loss_distribution': 'normal', 'aft_loss_distribution_scale': 1.344631276201392, 'max_depth': 9, 'booster': 'gbtree', 'scale_pos_weight': 6.8891848064442325, 'alpha': 7.585593074653413, 'lambda': 0.3615636496161552, 'eta': 0.12923824549240082, 'sampling_method': 'uniform', 'subsample': 0.762394293821273, 'gamma': 8.593844413414192}. Best is trial 105 with value: 4.2632662205386405.
[I 2023-12-19 05:27:05,566] Trial 133 finished with value: inf and parameters: {'learning_rate': 0.9940976174828516, 'aft_loss_distribution': 'normal', 'aft_loss_distribution_scale': 1.098838808901937, 'max_depth': 9, 'booster': 'gbtree', 'scale_pos_weight': 6.7069654690234906, 'alpha': 8.385991462369612, 'lambda': 0.006765532833474331, 'eta': 0.1278785570814069, 'sampling_method': 'uniform', 'subsample': 0.7953837141788931, 'gamma': 8.523533428267168}. Best is trial 105 with value: 4.2632662205386405.
[I 2023-12-19 05:27:06,241] Trial 134 finished with value: 4.281225108423708 and parameters: {'learning_rate': 0.9503005549267949, 'aft_loss_distribution': 'normal', 'aft_loss_distribution_scale': 1.2980576243081887, 'max_depth': 9, 'booster': 'gbtree', 'scale_pos_weight': 6.917001075201069, 'alpha': 7.655781735881594, 'lambda': 0.3468054946507184, 'eta': 0.0426960381681258, 'sampling_method': 'uniform', 'subsample': 0.726479405748663, 'gamma': 9.553395382019081}. Best is trial 105 with value: 4.2632662205386405.
[I 2023-12-19 05:27:06,604] Trial 135 finished with value: inf and parameters: {'learning_rate': 0.9551363566693823, 'aft_loss_distribution': 'normal', 'aft_loss_distribution_scale': 1.2883852566300684, 'max_depth': 9, 'booster': 'gbtree', 'scale_pos_weight': 6.87953057039828, 'alpha': 7.602111216003886, 'lambda': 0.6026009513181524, 'eta': 0.08426025446312718, 'sampling_method': 'uniform', 'subsample': 0.7331847951862311, 'gamma': 8.916213300764507}. Best is trial 105 with value: 4.2632662205386405.
[I 2023-12-19 05:27:06,694] Trial 136 pruned. Trial was pruned at iteration 1.
[I 2023-12-19 05:27:07,223] Trial 137 finished with value: 4.26749163165167 and parameters: {'learning_rate': 0.9510061709669669, 'aft_loss_distribution': 'normal', 'aft_loss_distribution_scale': 0.9210824347521599, 'max_depth': 9, 'booster': 'gbtree', 'scale_pos_weight': 6.982420862316693, 'alpha': 6.400466999998397, 'lambda': 0.47374608388259803, 'eta': 0.06512781714092006, 'sampling_method': 'uniform', 'subsample': 0.7261983215422292, 'gamma': 9.411579107934633}. Best is trial 105 with value: 4.2632662205386405.
[I 2023-12-19 05:27:07,778] Trial 138 finished with value: 4.253673002127036 and parameters: {'learning_rate': 0.9679758124315418, 'aft_loss_distribution': 'normal', 'aft_loss_distribution_scale': 0.971359315530508, 'max_depth': 9, 'booster': 'gbtree', 'scale_pos_weight': 6.499999051184097, 'alpha': 6.5119854633502605, 'lambda': 0.4395348091160146, 'eta': 0.010840876740819655, 'sampling_method': 'uniform', 'subsample': 0.7810866990793136, 'gamma': 8.710894343979954}. Best is trial 138 with value: 4.253673002127036.
[I 2023-12-19 05:27:07,861] Trial 139 pruned. Trial was pruned at iteration 0.
[I 2023-12-19 05:27:08,176] Trial 140 finished with value: inf and parameters: {'learning_rate': 0.9808394441249036, 'aft_loss_distribution': 'normal', 'aft_loss_distribution_scale': 0.7986861783085027, 'max_depth': 9, 'booster': 'gbtree', 'scale_pos_weight': 7.281930047259433, 'alpha': 6.959552861800388, 'lambda': 0.6151591568151966, 'eta': 0.030446075171120163, 'sampling_method': 'uniform', 'subsample': 0.7583214138519704, 'gamma': 8.90795015769994}. Best is trial 138 with value: 4.253673002127036.
[I 2023-12-19 05:27:09,221] Trial 141 finished with value: 4.2441363715771745 and parameters: {'learning_rate': 0.9549320052859362, 'aft_loss_distribution': 'normal', 'aft_loss_distribution_scale': 1.0680480819083942, 'max_depth': 9, 'booster': 'gbtree', 'scale_pos_weight': 6.531365021346541, 'alpha': 7.295121979957043, 'lambda': 0.28716098844573124, 'eta': 0.0069324097367323145, 'sampling_method': 'uniform', 'subsample': 0.7135637190466599, 'gamma': 9.420267596618366}. Best is trial 141 with value: 4.2441363715771745.
[I 2023-12-19 05:27:10,506] Trial 142 finished with value: inf and parameters: {'learning_rate': 0.9469969351918424, 'aft_loss_distribution': 'normal', 'aft_loss_distribution_scale': 1.0165803679867795, 'max_depth': 9, 'booster': 'gbtree', 'scale_pos_weight': 6.598507959361204, 'alpha': 6.070096357347094, 'lambda': 0.2663606521315294, 'eta': 0.011378410669104, 'sampling_method': 'uniform', 'subsample': 0.7038515100790722, 'gamma': 9.406437884535391}. Best is trial 141 with value: 4.2441363715771745.
[I 2023-12-19 05:27:10,706] Trial 143 pruned. Trial was pruned at iteration 1.
[I 2023-12-19 05:27:12,643] Trial 144 finished with value: 4.251633422452036 and parameters: {'learning_rate': 0.9305240546474192, 'aft_loss_distribution': 'normal', 'aft_loss_distribution_scale': 1.1497296584569572, 'max_depth': 9, 'booster': 'gbtree', 'scale_pos_weight': 6.49183316553966, 'alpha': 6.342060074428305, 'lambda': 0.5953454293371783, 'eta': 0.004956616535664336, 'sampling_method': 'uniform', 'subsample': 0.7309367007466371, 'gamma': 8.352899596923312}. Best is trial 141 with value: 4.2441363715771745.
[I 2023-12-19 05:27:13,014] Trial 145 finished with value: 4.253517606724323 and parameters: {'learning_rate': 0.9384820695742495, 'aft_loss_distribution': 'normal', 'aft_loss_distribution_scale': 1.1412495775074565, 'max_depth': 9, 'booster': 'gbtree', 'scale_pos_weight': 6.409404695368079, 'alpha': 6.059644262293153, 'lambda': 0.008534998559946938, 'eta': 0.0024339230140153854, 'sampling_method': 'uniform', 'subsample': 0.7389734146255565, 'gamma': 8.374085599669831}. Best is trial 141 with value: 4.2441363715771745.
[I 2023-12-19 05:27:13,537] Trial 146 finished with value: 4.249534293860306 and parameters: {'learning_rate': 0.9325038246948006, 'aft_loss_distribution': 'normal', 'aft_loss_distribution_scale': 1.1317000685117626, 'max_depth': 9, 'booster': 'gbtree', 'scale_pos_weight': 7.243462316864074, 'alpha': 6.257861898588595, 'lambda': 0.028957404085166838, 'eta': 0.017203696305861556, 'sampling_method': 'uniform', 'subsample': 0.7326961418000952, 'gamma': 8.469039696183419}. Best is trial 141 with value: 4.2441363715771745.
[I 2023-12-19 05:27:13,838] Trial 147 finished with value: inf and parameters: {'learning_rate': 0.9293270942058085, 'aft_loss_distribution': 'normal', 'aft_loss_distribution_scale': 1.0212751242042992, 'max_depth': 9, 'booster': 'gbtree', 'scale_pos_weight': 6.77600624880208, 'alpha': 6.272897714509457, 'lambda': 0.4741467399846075, 'eta': 0.005702149625516574, 'sampling_method': 'uniform', 'subsample': 0.7372011952583909, 'gamma': 8.30392606809856}. Best is trial 141 with value: 4.2441363715771745.
[I 2023-12-19 05:27:13,920] Trial 148 pruned. Trial was pruned at iteration 0.
[I 2023-12-19 05:27:14,228] Trial 149 finished with value: inf and parameters: {'learning_rate': 0.9720489415376494, 'aft_loss_distribution': 'normal', 'aft_loss_distribution_scale': 0.8690418236880741, 'max_depth': 9, 'booster': 'gbtree', 'scale_pos_weight': 7.44579453826661, 'alpha': 6.154244460735085, 'lambda': 0.04443015104855952, 'eta': 0.026933853765448282, 'sampling_method': 'uniform', 'subsample': 0.7020133781117543, 'gamma': 8.399046920227793}. Best is trial 141 with value: 4.2441363715771745.
[I 2023-12-19 05:27:14,703] Trial 150 finished with value: 4.254028321973412 and parameters: {'learning_rate': 0.9965727255702124, 'aft_loss_distribution': 'normal', 'aft_loss_distribution_scale': 1.1711998476290042, 'max_depth': 9, 'booster': 'gbtree', 'scale_pos_weight': 7.026742934596864, 'alpha': 6.911648105016997, 'lambda': 0.5478419753113027, 'eta': 0.051548264391954424, 'sampling_method': 'uniform', 'subsample': 0.6535607039096262, 'gamma': 8.209523579003923}. Best is trial 141 with value: 4.2441363715771745.
[I 2023-12-19 05:27:15,013] Trial 151 finished with value: inf and parameters: {'learning_rate': 0.9996813171443064, 'aft_loss_distribution': 'normal', 'aft_loss_distribution_scale': 1.245494038812704, 'max_depth': 9, 'booster': 'gbtree', 'scale_pos_weight': 7.201875499446117, 'alpha': 6.911873824972985, 'lambda': 0.5896512883596114, 'eta': 0.06929925612038718, 'sampling_method': 'uniform', 'subsample': 0.7542955732784338, 'gamma': 8.82110785483878}. Best is trial 141 with value: 4.2441363715771745.
[I 2023-12-19 05:27:15,103] Trial 152 pruned. Trial was pruned at iteration 0.
[I 2023-12-19 05:27:15,419] Trial 153 finished with value: inf and parameters: {'learning_rate': 0.9594790164118564, 'aft_loss_distribution': 'normal', 'aft_loss_distribution_scale': 1.1288293424798408, 'max_depth': 9, 'booster': 'gbtree', 'scale_pos_weight': 6.804217875784673, 'alpha': 7.0035908315171875, 'lambda': 0.3908549923863487, 'eta': 0.0026138252443465154, 'sampling_method': 'uniform', 'subsample': 0.7254787927295433, 'gamma': 8.510324476678012}. Best is trial 141 with value: 4.2441363715771745.
[I 2023-12-19 05:27:15,527] Trial 154 pruned. Trial was pruned at iteration 1.
[I 2023-12-19 05:27:15,870] Trial 155 finished with value: inf and parameters: {'learning_rate': 0.9791159061071316, 'aft_loss_distribution': 'normal', 'aft_loss_distribution_scale': 0.9939430184537272, 'max_depth': 9, 'booster': 'gbtree', 'scale_pos_weight': 7.509914643537641, 'alpha': 7.3009319902661405, 'lambda': 0.551974740338354, 'eta': 0.022693591910823596, 'sampling_method': 'uniform', 'subsample': 0.6859792912373152, 'gamma': 8.638340462961311}. Best is trial 141 with value: 4.2441363715771745.
[I 2023-12-19 05:27:15,955] Trial 156 pruned. Trial was pruned at iteration 0.
[I 2023-12-19 05:27:16,505] Trial 157 finished with value: 4.2614853880490795 and parameters: {'learning_rate': 0.9750459947256951, 'aft_loss_distribution': 'normal', 'aft_loss_distribution_scale': 1.2016591669161423, 'max_depth': 8, 'booster': 'gbtree', 'scale_pos_weight': 0.9167386377028861, 'alpha': 6.775262639020691, 'lambda': 0.6457509990652, 'eta': 0.05331359808056503, 'sampling_method': 'uniform', 'subsample': 0.7725644080650977, 'gamma': 8.261809463546884}. Best is trial 141 with value: 4.2441363715771745.
[I 2023-12-19 05:27:16,829] Trial 158 finished with value: inf and parameters: {'learning_rate': 0.9710186702717725, 'aft_loss_distribution': 'normal', 'aft_loss_distribution_scale': 1.2083374685825583, 'max_depth': 8, 'booster': 'gbtree', 'scale_pos_weight': 6.588524779700041, 'alpha': 5.938192489628858, 'lambda': 1.1230467212250863, 'eta': 0.05159170980869163, 'sampling_method': 'uniform', 'subsample': 0.7490238881970663, 'gamma': 8.30644343833796}. Best is trial 141 with value: 4.2441363715771745.
[I 2023-12-19 05:27:16,908] Trial 159 pruned. Trial was pruned at iteration 0.
[I 2023-12-19 05:27:17,220] Trial 160 finished with value: inf and parameters: {'learning_rate': 0.92096351722393, 'aft_loss_distribution': 'normal', 'aft_loss_distribution_scale': 0.8336831777654099, 'max_depth': 8, 'booster': 'gbtree', 'scale_pos_weight': 1.4168488240948052, 'alpha': 7.168641189353252, 'lambda': 0.4070883212873749, 'eta': 0.030228625346007995, 'sampling_method': 'uniform', 'subsample': 0.7255535318966524, 'gamma': 8.188126738309034}. Best is trial 141 with value: 4.2441363715771745.
[I 2023-12-19 05:27:18,142] Trial 161 finished with value: 4.27038943270626 and parameters: {'learning_rate': 0.9515527176911938, 'aft_loss_distribution': 'normal', 'aft_loss_distribution_scale': 1.264038759798753, 'max_depth': 9, 'booster': 'gbtree', 'scale_pos_weight': 0.5072377686883227, 'alpha': 7.738065362937503, 'lambda': 0.22266235345705, 'eta': 0.05708561458336309, 'sampling_method': 'uniform', 'subsample': 0.7701198900925064, 'gamma': 8.88719865714153}. Best is trial 141 with value: 4.2441363715771745.
[I 2023-12-19 05:27:18,803] Trial 162 finished with value: 4.261188756273043 and parameters: {'learning_rate': 0.9500231372412522, 'aft_loss_distribution': 'normal', 'aft_loss_distribution_scale': 1.183488834857203, 'max_depth': 9, 'booster': 'gbtree', 'scale_pos_weight': 0.3459888873995277, 'alpha': 7.31895433685042, 'lambda': 0.2205275277292223, 'eta': 0.05929026106620872, 'sampling_method': 'uniform', 'subsample': 0.6858195282239232, 'gamma': 8.895250111167115}. Best is trial 141 with value: 4.2441363715771745.
[I 2023-12-19 05:27:19,138] Trial 163 finished with value: inf and parameters: {'learning_rate': 0.9760472495193326, 'aft_loss_distribution': 'normal', 'aft_loss_distribution_scale': 1.082048722017196, 'max_depth': 9, 'booster': 'gbtree', 'scale_pos_weight': 0.22533722112578322, 'alpha': 7.374072998360145, 'lambda': 0.26227160015497986, 'eta': 0.05869036868462847, 'sampling_method': 'uniform', 'subsample': 0.6879550939817948, 'gamma': 8.855556215637433}. Best is trial 141 with value: 4.2441363715771745.
[I 2023-12-19 05:27:19,453] Trial 164 finished with value: inf and parameters: {'learning_rate': 0.9543466011577323, 'aft_loss_distribution': 'normal', 'aft_loss_distribution_scale': 1.1856787477262631, 'max_depth': 9, 'booster': 'gbtree', 'scale_pos_weight': 0.4186204131519483, 'alpha': 6.792160933586357, 'lambda': 0.6495683589100498, 'eta': 0.03886159229984529, 'sampling_method': 'uniform', 'subsample': 0.6341963429240499, 'gamma': 8.430758938572007}. Best is trial 141 with value: 4.2441363715771745.
[I 2023-12-19 05:27:19,539] Trial 165 pruned. Trial was pruned at iteration 0.
[I 2023-12-19 05:27:19,845] Trial 166 finished with value: inf and parameters: {'learning_rate': 0.9568624906616148, 'aft_loss_distribution': 'normal', 'aft_loss_distribution_scale': 0.9268930890039493, 'max_depth': 9, 'booster': 'gbtree', 'scale_pos_weight': 6.718687974604026, 'alpha': 6.969931382444337, 'lambda': 0.7354614588055197, 'eta': 0.0992798145842107, 'sampling_method': 'uniform', 'subsample': 0.7194801807136627, 'gamma': 9.540794111323356}. Best is trial 141 with value: 4.2441363715771745.
[I 2023-12-19 05:27:19,935] Trial 167 pruned. Trial was pruned at iteration 1.
