[I 2023-12-21 04:13:49,106] Trial 98 finished with value: 2.069459979876538 and parameters: {'learning_rate': 0.9155598111054035, 'aft_lo                                                                     ss_distribution': 'normal', 'aft_loss_distribution_scale': 2.2292770224495393, 'max_depth': 3, 'booster': 'gbtree', 'scale_pos_weight': 0                                                                     .32597832022083256, 'alpha': 8.912748610385268, 'lambda': 4.424241931968761, 'eta': 0.711569914078319, 'sampling_method': 'uniform', 'sub                                                                     sample': 0.12623101381560564, 'gamma': 6.473628853595033}. Best is trial 76 with value: 2.0632968020001163.
[I 2023-12-21 04:13:49,265] Trial 99 finished with value: 2.075565196477505 and parameters: {'learning_rate': 0.944867353538287, 'aft_los                                                                     s_distribution': 'normal', 'aft_loss_distribution_scale': 2.280347022489967, 'max_depth': 3, 'booster': 'gbtree', 'scale_pos_weight': 0.1                                                                     2808581364571633, 'alpha': 7.4458362963414455, 'lambda': 3.9631082527308257, 'eta': 0.7059636381510108, 'sampling_method': 'uniform', 'su                                                                     bsample': 0.12148775151193277, 'gamma': 7.035050045824323}. Best is trial 76 with value: 2.0632968020001163.
[I 2023-12-21 04:13:49,477] Trial 100 finished with value: 2.08210344492779 and parameters: {'learning_rate': 0.9767245114582658, 'aft_lo                                                                     ss_distribution': 'normal', 'aft_loss_distribution_scale': 2.2975059180515696, 'max_depth': 3, 'booster': 'gbtree', 'scale_pos_weight': 0                                                                     .11697339820806406, 'alpha': 9.902660503814115, 'lambda': 4.353401654255919, 'eta': 0.6506565471178838, 'sampling_method': 'uniform', 'su                                                                     bsample': 0.12577471086399244, 'gamma': 6.388700304041111}. Best is trial 76 with value: 2.0632968020001163.
[I 2023-12-21 04:13:49,585] Trial 101 finished with value: inf and parameters: {'learning_rate': 0.9778527484820461, 'aft_loss_distributi                                                                     on': 'normal', 'aft_loss_distribution_scale': 2.243767608517946, 'max_depth': 3, 'booster': 'gbtree', 'scale_pos_weight': 0.1047154141625                                                                     8806, 'alpha': 9.90434992493934, 'lambda': 4.368899970475728, 'eta': 0.700632745634886, 'sampling_method': 'uniform', 'subsample': 0.1942                                                                     6634817911442, 'gamma': 7.042800493037566}. Best is trial 76 with value: 2.0632968020001163.
[I 2023-12-21 04:13:49,696] Trial 102 finished with value: inf and parameters: {'learning_rate': 0.9458442838865513, 'aft_loss_distributi                                                                     on': 'normal', 'aft_loss_distribution_scale': 2.416880829296884, 'max_depth': 3, 'booster': 'gbtree', 'scale_pos_weight': 0.1576137766137                                                                     1978, 'alpha': 9.510909276723101, 'lambda': 4.076574300375306, 'eta': 0.6589923596370653, 'sampling_method': 'uniform', 'subsample': 0.12                                                                     385965185419234, 'gamma': 8.049729250422603}. Best is trial 76 with value: 2.0632968020001163.
[I 2023-12-21 04:13:49,811] Trial 103 finished with value: inf and parameters: {'learning_rate': 0.9981808660418316, 'aft_loss_distributi                                                                     on': 'normal', 'aft_loss_distribution_scale': 1.6073005246051348, 'max_depth': 3, 'booster': 'gbtree', 'scale_pos_weight': 0.049195523584                                                                     04994, 'alpha': 8.805221255752485, 'lambda': 4.569461201025172, 'eta': 0.6104794099397458, 'sampling_method': 'uniform', 'subsample': 0.1                                                                     3441002128159146, 'gamma': 7.561889527033768}. Best is trial 76 with value: 2.0632968020001163.
[I 2023-12-21 04:13:49,904] Trial 104 finished with value: inf and parameters: {'learning_rate': 0.9398550122613477, 'aft_loss_distributi                                                                     on': 'normal', 'aft_loss_distribution_scale': 1.8285922171656925, 'max_depth': 4, 'booster': 'gbtree', 'scale_pos_weight': 0.314321763581                                                                     4136, 'alpha': 9.215425137383473, 'lambda': 5.5204347388076584, 'eta': 0.7534769354973938, 'sampling_method': 'uniform', 'subsample': 0.0                                                                     7379304510822678, 'gamma': 6.519539755556467}. Best is trial 76 with value: 2.0632968020001163.
[I 2023-12-21 04:13:49,938] Trial 105 pruned. Trial was pruned at iteration 0.
[I 2023-12-21 04:13:50,049] Trial 106 finished with value: inf and parameters: {'learning_rate': 0.9787268805904749, 'aft_loss_distributi                                                                     on': 'normal', 'aft_loss_distribution_scale': 2.2631571943916082, 'max_depth': 3, 'booster': 'gbtree', 'scale_pos_weight': 0.387307890843                                                                     85386, 'alpha': 9.964942847711379, 'lambda': 3.1020501197461017, 'eta': 0.6836085033501571, 'sampling_method': 'uniform', 'subsample': 0.                                                                     23576146001121673, 'gamma': 7.36851684258976}. Best is trial 76 with value: 2.0632968020001163.
[I 2023-12-21 04:13:50,083] Trial 107 pruned. Trial was pruned at iteration 0.
[I 2023-12-21 04:13:50,205] Trial 108 finished with value: 2.1085926899869456 and parameters: {'learning_rate': 0.9136636750204327, 'aft_                                                                     loss_distribution': 'normal', 'aft_loss_distribution_scale': 2.60222259520402, 'max_depth': 3, 'booster': 'gbtree', 'scale_pos_weight': 0                                                                     .5655646291500513, 'alpha': 7.484706423654414, 'lambda': 3.9575066014024656, 'eta': 0.7092673018183128, 'sampling_method': 'uniform', 'su                                                                     bsample': 0.14979070055879762, 'gamma': 6.996920993049165}. Best is trial 76 with value: 2.0632968020001163.
[I 2023-12-21 04:13:50,240] Trial 109 pruned. Trial was pruned at iteration 1.
[I 2023-12-21 04:13:50,273] Trial 110 pruned. Trial was pruned at iteration 0.
[I 2023-12-21 04:13:50,590] Trial 111 finished with value: 2.100352290640919 and parameters: {'learning_rate': 0.9506074205109817, 'aft_l                                                                     oss_distribution': 'normal', 'aft_loss_distribution_scale': 2.5497163483207026, 'max_depth': 3, 'booster': 'gbtree', 'scale_pos_weight':                                                                      0.33521608298683314, 'alpha': 7.0966780256136355, 'lambda': 3.6481299554421893, 'eta': 0.7146744494931913, 'sampling_method': 'uniform',                                                                      'subsample': 0.16980649237635173, 'gamma': 7.890101754928876}. Best is trial 76 with value: 2.0632968020001163.
[I 2023-12-21 04:13:50,627] Trial 112 pruned. Trial was pruned at iteration 2.
[I 2023-12-21 04:13:50,727] Trial 113 finished with value: inf and parameters: {'learning_rate': 0.9488843893463994, 'aft_loss_distributi                                                                     on': 'normal', 'aft_loss_distribution_scale': 2.168958944996555, 'max_depth': 3, 'booster': 'gbtree', 'scale_pos_weight': 1.2952026381489                                                                     397, 'alpha': 6.556001071582295, 'lambda': 3.6056936204054315, 'eta': 0.6731030428627275, 'sampling_method': 'uniform', 'subsample': 0.16                                                                     574675793103105, 'gamma': 7.4841502009401415}. Best is trial 76 with value: 2.0632968020001163.
[I 2023-12-21 04:13:50,847] Trial 114 finished with value: inf and parameters: {'learning_rate': 0.9190694807118026, 'aft_loss_distributi                                                                     on': 'normal', 'aft_loss_distribution_scale': 1.7068514112334028, 'max_depth': 3, 'booster': 'gbtree', 'scale_pos_weight': 0.200277942952                                                                     2878, 'alpha': 6.099159773206439, 'lambda': 3.392527055945063, 'eta': 0.7445664133247487, 'sampling_method': 'uniform', 'subsample': 0.25                                                                     55548258818278, 'gamma': 7.904902708093509}. Best is trial 76 with value: 2.0632968020001163.
[I 2023-12-21 04:13:50,883] Trial 115 pruned. Trial was pruned at iteration 0.
[I 2023-12-21 04:13:50,920] Trial 116 pruned. Trial was pruned at iteration 1.
[I 2023-12-21 04:13:50,956] Trial 117 pruned. Trial was pruned at iteration 0.
[I 2023-12-21 04:13:51,092] Trial 118 finished with value: inf and parameters: {'learning_rate': 0.8847659333861874, 'aft_loss_distributi                                                                     on': 'normal', 'aft_loss_distribution_scale': 1.8984980635148492, 'max_depth': 5, 'booster': 'gbtree', 'scale_pos_weight': 0.255963965552                                                                     78483, 'alpha': 6.849797673321455, 'lambda': 3.9760429848326306, 'eta': 0.768370668772448, 'sampling_method': 'uniform', 'subsample': 0.3                                                                     131769893694339, 'gamma': 6.172243116852443}. Best is trial 76 with value: 2.0632968020001163.
[I 2023-12-21 04:13:51,126] Trial 119 pruned. Trial was pruned at iteration 0.
[I 2023-12-21 04:13:51,160] Trial 120 pruned. Trial was pruned at iteration 0.
[I 2023-12-21 04:13:51,195] Trial 121 pruned. Trial was pruned at iteration 0.
[I 2023-12-21 04:13:51,229] Trial 122 pruned. Trial was pruned at iteration 0.
[I 2023-12-21 04:13:51,265] Trial 123 pruned. Trial was pruned at iteration 0.
[I 2023-12-21 04:13:51,308] Trial 124 pruned. Trial was pruned at iteration 0.
[I 2023-12-21 04:13:51,345] Trial 125 pruned. Trial was pruned at iteration 0.
[I 2023-12-21 04:13:51,380] Trial 126 pruned. Trial was pruned at iteration 1.
[I 2023-12-21 04:13:51,415] Trial 127 pruned. Trial was pruned at iteration 0.
[I 2023-12-21 04:13:51,607] Trial 128 finished with value: 2.0751923297282464 and parameters: {'learning_rate': 0.8685910816533237, 'aft_                                                                     loss_distribution': 'normal', 'aft_loss_distribution_scale': 2.32286896386503, 'max_depth': 3, 'booster': 'gbtree', 'scale_pos_weight': 0                                                                     .319580978811788, 'alpha': 9.549459446641768, 'lambda': 4.423077997319699, 'eta': 0.9056885292221959, 'sampling_method': 'uniform', 'subs                                                                     ample': 0.2934736057661211, 'gamma': 6.97578143492178}. Best is trial 76 with value: 2.0632968020001163.
[I 2023-12-21 04:13:51,643] Trial 129 pruned. Trial was pruned at iteration 0.
[I 2023-12-21 04:13:51,677] Trial 130 pruned. Trial was pruned at iteration 0.
[I 2023-12-21 04:13:51,787] Trial 131 finished with value: inf and parameters: {'learning_rate': 0.8989131613022813, 'aft_loss_distributi                                                                     on': 'normal', 'aft_loss_distribution_scale': 2.014470576738937, 'max_depth': 3, 'booster': 'gbtree', 'scale_pos_weight': 0.3431590657245                                                                     032, 'alpha': 9.315388768845224, 'lambda': 4.262098141143836, 'eta': 0.9023176287760766, 'sampling_method': 'uniform', 'subsample': 0.290                                                                     9062996730608, 'gamma': 6.824454209641269}. Best is trial 76 with value: 2.0632968020001163.
[I 2023-12-21 04:13:51,822] Trial 132 pruned. Trial was pruned at iteration 0.
[I 2023-12-21 04:13:51,857] Trial 133 pruned. Trial was pruned at iteration 0.
[I 2023-12-21 04:13:51,894] Trial 134 pruned. Trial was pruned at iteration 1.
[I 2023-12-21 04:13:51,929] Trial 135 pruned. Trial was pruned at iteration 0.
[I 2023-12-21 04:13:52,110] Trial 136 finished with value: 2.0696516641093967 and parameters: {'learning_rate': 0.9262481130291763, 'aft_                                                                     loss_distribution': 'normal', 'aft_loss_distribution_scale': 2.2263925819514325, 'max_depth': 4, 'booster': 'gbtree', 'scale_pos_weight':                                                                      0.3232544476817375, 'alpha': 9.571839739750638, 'lambda': 3.4774031922282336, 'eta': 0.9598789868289399, 'sampling_method': 'uniform', '                                                                     subsample': 0.2620411200877629, 'gamma': 7.699889200340017}. Best is trial 76 with value: 2.0632968020001163.
[I 2023-12-21 04:13:52,290] Trial 137 finished with value: 2.0627482357798548 and parameters: {'learning_rate': 0.9088670965275394, 'aft_                                                                     loss_distribution': 'normal', 'aft_loss_distribution_scale': 2.1631252246443307, 'max_depth': 4, 'booster': 'gbtree', 'scale_pos_weight':                                                                      0.2064729226786065, 'alpha': 9.642084666106962, 'lambda': 4.54509794283936, 'eta': 0.965498625932931, 'sampling_method': 'uniform', 'sub                                                                     sample': 0.28141318670875387, 'gamma': 7.725351792100942}. Best is trial 137 with value: 2.0627482357798548.
[I 2023-12-21 04:13:52,413] Trial 138 finished with value: inf and parameters: {'learning_rate': 0.9258993948234602, 'aft_loss_distributi                                                                     on': 'normal', 'aft_loss_distribution_scale': 2.1423098082070324, 'max_depth': 4, 'booster': 'gbtree', 'scale_pos_weight': 0.042846457882                                                                     694255, 'alpha': 9.660747540236157, 'lambda': 4.4338656286352585, 'eta': 0.983384516074579, 'sampling_method': 'uniform', 'subsample': 0.                                                                     32496669984676296, 'gamma': 8.211395106332173}. Best is trial 137 with value: 2.0627482357798548.
[I 2023-12-21 04:13:52,448] Trial 139 pruned. Trial was pruned at iteration 0.
[I 2023-12-21 04:13:52,485] Trial 140 pruned. Trial was pruned at iteration 0.
[I 2023-12-21 04:13:52,522] Trial 141 pruned. Trial was pruned at iteration 1.
[I 2023-12-21 04:13:52,638] Trial 142 finished with value: inf and parameters: {'learning_rate': 0.9151690625202594, 'aft_loss_distributi                                                                     on': 'normal', 'aft_loss_distribution_scale': 1.9717783006074308, 'max_depth': 4, 'booster': 'gbtree', 'scale_pos_weight': 0.388187075854                                                                     25927, 'alpha': 9.389660709558354, 'lambda': 4.641182822062812, 'eta': 0.9205055736775795, 'sampling_method': 'uniform', 'subsample': 0.2                                                                     6332886808233036, 'gamma': 7.112303146555118}. Best is trial 137 with value: 2.0627482357798548.
[I 2023-12-21 04:13:52,782] Trial 143 finished with value: inf and parameters: {'learning_rate': 0.9738427153511515, 'aft_loss_distributi                                                                     on': 'normal', 'aft_loss_distribution_scale': 1.609389696291021, 'max_depth': 4, 'booster': 'gbtree', 'scale_pos_weight': 0.2166038054002                                                                     326, 'alpha': 8.70235453805974, 'lambda': 3.835803153569648, 'eta': 0.9542463020411591, 'sampling_method': 'uniform', 'subsample': 0.2077                                                                     7697141196524, 'gamma': 7.3662295891085225}. Best is trial 137 with value: 2.0627482357798548.
[I 2023-12-21 04:13:52,818] Trial 144 pruned. Trial was pruned at iteration 0.
[I 2023-12-21 04:13:52,934] Trial 145 finished with value: inf and parameters: {'learning_rate': 0.959837392236672, 'aft_loss_distributio                                                                     n': 'normal', 'aft_loss_distribution_scale': 2.368359073176331, 'max_depth': 4, 'booster': 'gbtree', 'scale_pos_weight': 0.30831170535680                                                                     297, 'alpha': 6.761122985038938, 'lambda': 5.301792736350157, 'eta': 0.6892512003925119, 'sampling_method': 'uniform', 'subsample': 0.252                                                                     7159443072981, 'gamma': 8.741403585593222}. Best is trial 137 with value: 2.0627482357798548.
[I 2023-12-21 04:13:53,039] Trial 146 finished with value: inf and parameters: {'learning_rate': 0.9340808467468571, 'aft_loss_distributi                                                                     on': 'normal', 'aft_loss_distribution_scale': 2.0297668874549006, 'max_depth': 3, 'booster': 'gbtree', 'scale_pos_weight': 0.438956597300                                                                     03034, 'alpha': 9.178251039151275, 'lambda': 4.817273910345507, 'eta': 0.7640188193517379, 'sampling_method': 'uniform', 'subsample': 0.2                                                                     3128088661271617, 'gamma': 6.77403913687732}. Best is trial 137 with value: 2.0627482357798548.
[I 2023-12-21 04:13:53,075] Trial 147 pruned. Trial was pruned at iteration 0.
[I 2023-12-21 04:13:53,112] Trial 148 pruned. Trial was pruned at iteration 0.
[I 2023-12-21 04:13:53,154] Trial 149 pruned. Trial was pruned at iteration 0.
[I 2023-12-21 04:13:53,192] Trial 150 pruned. Trial was pruned at iteration 1.
[I 2023-12-21 04:13:53,228] Trial 151 pruned. Trial was pruned at iteration 0.
[I 2023-12-21 04:13:53,264] Trial 152 pruned. Trial was pruned at iteration 0.
[I 2023-12-21 04:13:53,301] Trial 153 pruned. Trial was pruned at iteration 1.
[I 2023-12-21 04:13:53,339] Trial 154 pruned. Trial was pruned at iteration 0.
[I 2023-12-21 04:13:53,377] Trial 155 pruned. Trial was pruned at iteration 0.
[I 2023-12-21 04:13:53,413] Trial 156 pruned. Trial was pruned at iteration 0.
[I 2023-12-21 04:13:53,450] Trial 157 pruned. Trial was pruned at iteration 0.
[I 2023-12-21 04:13:53,488] Trial 158 pruned. Trial was pruned at iteration 0.
[I 2023-12-21 04:13:53,525] Trial 159 pruned. Trial was pruned at iteration 0.
[I 2023-12-21 04:13:53,561] Trial 160 pruned. Trial was pruned at iteration 0.
[I 2023-12-21 04:13:53,598] Trial 161 pruned. Trial was pruned at iteration 0.
[I 2023-12-21 04:13:53,636] Trial 162 pruned. Trial was pruned at iteration 0.
[I 2023-12-21 04:13:53,673] Trial 163 pruned. Trial was pruned at iteration 1.
[I 2023-12-21 04:13:53,710] Trial 164 pruned. Trial was pruned at iteration 0.
[I 2023-12-21 04:13:53,746] Trial 165 pruned. Trial was pruned at iteration 0.
[I 2023-12-21 04:13:53,782] Trial 166 pruned. Trial was pruned at iteration 0.
[I 2023-12-21 04:13:53,819] Trial 167 pruned. Trial was pruned at iteration 0.
[I 2023-12-21 04:13:53,862] Trial 168 pruned. Trial was pruned at iteration 1.
[I 2023-12-21 04:13:53,901] Trial 169 pruned. Trial was pruned at iteration 0.
[I 2023-12-21 04:13:53,937] Trial 170 pruned. Trial was pruned at iteration 0.
[I 2023-12-21 04:13:53,974] Trial 171 pruned. Trial was pruned at iteration 0.
[I 2023-12-21 04:13:54,010] Trial 172 pruned. Trial was pruned at iteration 0.
[I 2023-12-21 04:13:54,047] Trial 173 pruned. Trial was pruned at iteration 0.
[I 2023-12-21 04:13:54,084] Trial 174 pruned. Trial was pruned at iteration 0.
[I 2023-12-21 04:13:54,124] Trial 175 pruned. Trial was pruned at iteration 1.
[I 2023-12-21 04:13:54,161] Trial 176 pruned. Trial was pruned at iteration 0.
[I 2023-12-21 04:13:54,198] Trial 177 pruned. Trial was pruned at iteration 0.
[I 2023-12-21 04:13:54,237] Trial 178 pruned. Trial was pruned at iteration 1.
[I 2023-12-21 04:13:54,403] Trial 179 finished with value: 2.073417992458315 and parameters: {'learning_rate': 0.9656068736271798, 'aft_l                                                                     oss_distribution': 'normal', 'aft_loss_distribution_scale': 2.201517690425783, 'max_depth': 3, 'booster': 'gbtree', 'scale_pos_weight': 0                                                                     .6625538054201325, 'alpha': 9.059056282023242, 'lambda': 4.672119310101113, 'eta': 0.9038430082756522, 'sampling_method': 'uniform', 'sub                                                                     sample': 0.08189560800372726, 'gamma': 6.794589042774182}. Best is trial 137 with value: 2.0627482357798548.
[I 2023-12-21 04:13:54,501] Trial 180 finished with value: inf and parameters: {'learning_rate': 0.9735850267486441, 'aft_loss_distributi                                                                     on': 'normal', 'aft_loss_distribution_scale': 2.078440435655254, 'max_depth': 3, 'booster': 'gbtree', 'scale_pos_weight': 0.6433927588898                                                                     79, 'alpha': 7.155005327574529, 'lambda': 4.749046676586061, 'eta': 0.9113317958162432, 'sampling_method': 'uniform', 'subsample': 0.0726                                                                     6461388435631, 'gamma': 7.018074853251842}. Best is trial 137 with value: 2.0627482357798548.
