[I 2023-12-19 04:42:19,576] Trial 63 finished with value: 4.247381737633948 and parameters: {'learning_rate': 0.9171664527424832, 'aft_loss_distribution': 'normal', 'aft_loss_distribution_scale': 1.0758229836179887, 'max_depth': 4, 'booster': 'dart', 'scale_pos_weight': 8.323461079489967, 'alpha': 4.501336675513567, 'lambda': 5.954385006743415, 'eta': 0.3233377229464324, 'sampling_method': 'uniform', 'subsample': 0.681312393204462, 'gamma': 6.074278695331126}. Best is trial 62 with value: 4.241560449564326.
[I 2023-12-19 04:42:26,152] Trial 64 finished with value: 4.254339163603315 and parameters: {'learning_rate': 0.9192117553702711, 'aft_loss_distribution': 'normal', 'aft_loss_distribution_scale': 1.1641983305410049, 'max_depth': 4, 'booster': 'dart', 'scale_pos_weight': 8.345177948603277, 'alpha': 4.492244498945357, 'lambda': 6.972506803195761, 'eta': 0.32639556714235596, 'sampling_method': 'uniform', 'subsample': 0.8175989998503344, 'gamma': 6.167373176328009}. Best is trial 62 with value: 4.241560449564326.
[I 2023-12-19 04:42:47,919] Trial 65 finished with value: 4.240690033343243 and parameters: {'learning_rate': 0.7942908217964759, 'aft_loss_distribution': 'normal', 'aft_loss_distribution_scale': 1.0979382104938575, 'max_depth': 3, 'booster': 'dart', 'scale_pos_weight': 8.373831710812226, 'alpha': 4.508911656819323, 'lambda': 7.01792973471364, 'eta': 0.2491103346788247, 'sampling_method': 'uniform', 'subsample': 0.8024918524074405, 'gamma': 6.21621292846977}. Best is trial 65 with value: 4.240690033343243.
[I 2023-12-19 04:42:54,499] Trial 66 finished with value: 4.239326351908404 and parameters: {'learning_rate': 0.7879861999550501, 'aft_loss_distribution': 'normal', 'aft_loss_distribution_scale': 1.0735715203050238, 'max_depth': 3, 'booster': 'dart', 'scale_pos_weight': 8.339630013147412, 'alpha': 4.492389530204733, 'lambda': 8.118787221040852, 'eta': 0.2480957169558115, 'sampling_method': 'uniform', 'subsample': 0.8135537752450547, 'gamma': 5.961754575152967}. Best is trial 66 with value: 4.239326351908404.
[I 2023-12-19 04:43:03,703] Trial 67 finished with value: 4.242721519239362 and parameters: {'learning_rate': 0.7993402030749386, 'aft_loss_distribution': 'normal', 'aft_loss_distribution_scale': 1.1236491388008887, 'max_depth': 3, 'booster': 'dart', 'scale_pos_weight': 7.458701374178071, 'alpha': 3.956632247721764, 'lambda': 8.126606436733617, 'eta': 0.23873451649025657, 'sampling_method': 'uniform', 'subsample': 0.7006830558188698, 'gamma': 4.788127320707286}. Best is trial 66 with value: 4.239326351908404.
[I 2023-12-19 04:43:03,778] Trial 68 pruned. Trial was pruned at iteration 0.
[I 2023-12-19 04:43:03,852] Trial 69 pruned. Trial was pruned at iteration 0.
[I 2023-12-19 04:43:03,943] Trial 70 pruned. Trial was pruned at iteration 0.
[I 2023-12-19 04:43:08,754] Trial 71 pruned. Trial was pruned at iteration 91.
[I 2023-12-19 04:43:08,828] Trial 72 pruned. Trial was pruned at iteration 0.
[I 2023-12-19 04:43:18,457] Trial 73 finished with value: 4.257947381962864 and parameters: {'learning_rate': 0.9176284190330446, 'aft_loss_distribution': 'normal', 'aft_loss_distribution_scale': 1.1942430557694033, 'max_depth': 3, 'booster': 'dart', 'scale_pos_weight': 7.409978110721916, 'alpha': 3.963508421890214, 'lambda': 7.281940742810304, 'eta': 0.2933389098072869, 'sampling_method': 'uniform', 'subsample': 0.8682884040861264, 'gamma': 4.404364458075294}. Best is trial 66 with value: 4.239326351908404.
[I 2023-12-19 04:43:23,044] Trial 74 finished with value: 4.258907199655513 and parameters: {'learning_rate': 0.7931324947346531, 'aft_loss_distribution': 'normal', 'aft_loss_distribution_scale': 1.1995511757591217, 'max_depth': 3, 'booster': 'dart', 'scale_pos_weight': 7.430433293040103, 'alpha': 2.8077048305522823, 'lambda': 7.126396506174175, 'eta': 0.2882572719810429, 'sampling_method': 'uniform', 'subsample': 0.8690348289094607, 'gamma': 4.715148206215682}. Best is trial 66 with value: 4.239326351908404.
[I 2023-12-19 04:43:23,125] Trial 75 pruned. Trial was pruned at iteration 0.
[I 2023-12-19 04:43:23,203] Trial 76 pruned. Trial was pruned at iteration 0.
[I 2023-12-19 04:43:26,560] Trial 77 finished with value: inf and parameters: {'learning_rate': 0.8445659615553098, 'aft_loss_distribution': 'normal', 'aft_loss_distribution_scale': 0.8608724214534601, 'max_depth': 3, 'booster': 'dart', 'scale_pos_weight': 7.142840098016113, 'alpha': 2.9474356137277815, 'lambda': 7.918911290973015, 'eta': 0.2078058884719075, 'sampling_method': 'uniform', 'subsample': 0.6817006370801043, 'gamma': 4.352344370699172}. Best is trial 66 with value: 4.239326351908404.
[I 2023-12-19 04:43:26,635] Trial 78 pruned. Trial was pruned at iteration 0.
[I 2023-12-19 04:43:26,716] Trial 79 pruned. Trial was pruned at iteration 1.
[I 2023-12-19 04:43:26,793] Trial 80 pruned. Trial was pruned at iteration 0.
[I 2023-12-19 04:43:33,487] Trial 81 finished with value: inf and parameters: {'learning_rate': 0.8865894689698869, 'aft_loss_distribution': 'normal', 'aft_loss_distribution_scale': 1.1991566467642991, 'max_depth': 3, 'booster': 'dart', 'scale_pos_weight': 7.953988506187443, 'alpha': 3.492854516376073, 'lambda': 8.994537152811287, 'eta': 0.341814195212495, 'sampling_method': 'uniform', 'subsample': 0.7958983879576301, 'gamma': 2.7373160794638536}. Best is trial 66 with value: 4.239326351908404.
[I 2023-12-19 04:43:33,569] Trial 82 pruned. Trial was pruned at iteration 0.
[I 2023-12-19 04:43:33,653] Trial 83 pruned. Trial was pruned at iteration 0.
[I 2023-12-19 04:43:33,738] Trial 84 pruned. Trial was pruned at iteration 0.
[I 2023-12-19 04:43:33,823] Trial 85 pruned. Trial was pruned at iteration 1.
[I 2023-12-19 04:43:33,907] Trial 86 pruned. Trial was pruned at iteration 0.
[I 2023-12-19 04:43:34,004] Trial 87 pruned. Trial was pruned at iteration 0.
[I 2023-12-19 04:43:34,100] Trial 88 pruned. Trial was pruned at iteration 1.
[I 2023-12-19 04:43:34,183] Trial 89 pruned. Trial was pruned at iteration 0.
[I 2023-12-19 04:43:34,265] Trial 90 pruned. Trial was pruned at iteration 0.
[I 2023-12-19 04:43:34,355] Trial 91 pruned. Trial was pruned at iteration 0.
[I 2023-12-19 04:43:38,180] Trial 92 finished with value: 4.260182276399596 and parameters: {'learning_rate': 0.9313123632992807, 'aft_loss_distribution': 'normal', 'aft_loss_distribution_scale': 1.2013780168420602, 'max_depth': 3, 'booster': 'dart', 'scale_pos_weight': 6.408539759690753, 'alpha': 4.386435076057012, 'lambda': 7.4701029320782, 'eta': 0.2924800277790733, 'sampling_method': 'uniform', 'subsample': 0.8864440238114124, 'gamma': 6.34008523276539}. Best is trial 66 with value: 4.239326351908404.
[I 2023-12-19 04:43:44,268] Trial 93 pruned. Trial was pruned at iteration 87.
[I 2023-12-19 04:43:44,399] Trial 94 pruned. Trial was pruned at iteration 1.
[I 2023-12-19 04:43:48,613] Trial 95 finished with value: inf and parameters: {'learning_rate': 0.9149379559111562, 'aft_loss_distribution': 'normal', 'aft_loss_distribution_scale': 0.87850696258287, 'max_depth': 3, 'booster': 'dart', 'scale_pos_weight': 6.328604662151019, 'alpha': 3.281620898898761, 'lambda': 7.203791497268941, 'eta': 0.26591327238460305, 'sampling_method': 'uniform', 'subsample': 0.8583295194521361, 'gamma': 6.63616159786001}. Best is trial 66 with value: 4.239326351908404.
[I 2023-12-19 04:43:48,689] Trial 96 pruned. Trial was pruned at iteration 0.
[I 2023-12-19 04:43:48,763] Trial 97 pruned. Trial was pruned at iteration 0.
[I 2023-12-19 04:43:48,837] Trial 98 pruned. Trial was pruned at iteration 0.
[I 2023-12-19 04:43:48,921] Trial 99 pruned. Trial was pruned at iteration 1.
[I 2023-12-19 04:43:49,012] Trial 100 pruned. Trial was pruned at iteration 0.
[I 2023-12-19 04:43:50,973] Trial 101 finished with value: inf and parameters: {'learning_rate': 0.9195597648341373, 'aft_loss_distribution': 'normal', 'aft_loss_distribution_scale': 1.1478739816924455, 'max_depth': 6, 'booster': 'dart', 'scale_pos_weight': 8.780066988193429, 'alpha': 9.7966678377893, 'lambda': 7.593802612355775, 'eta': 0.32088299619029226, 'sampling_method': 'uniform', 'subsample': 0.2709281762820336, 'gamma': 6.615309374423469}. Best is trial 66 with value: 4.239326351908404.
[I 2023-12-19 04:43:51,066] Trial 102 pruned. Trial was pruned at iteration 0.
[I 2023-12-19 04:43:51,142] Trial 103 pruned. Trial was pruned at iteration 0.
[I 2023-12-19 04:43:51,225] Trial 104 pruned. Trial was pruned at iteration 1.
[I 2023-12-19 04:43:51,314] Trial 105 pruned. Trial was pruned at iteration 0.
[I 2023-12-19 04:43:51,405] Trial 106 pruned. Trial was pruned at iteration 1.
[I 2023-12-19 04:43:51,483] Trial 107 pruned. Trial was pruned at iteration 0.
[I 2023-12-19 04:43:51,564] Trial 108 pruned. Trial was pruned at iteration 0.
[I 2023-12-19 04:43:51,656] Trial 109 pruned. Trial was pruned at iteration 1.
[I 2023-12-19 04:43:51,741] Trial 110 pruned. Trial was pruned at iteration 0.
[I 2023-12-19 04:43:51,819] Trial 111 pruned. Trial was pruned at iteration 0.
[I 2023-12-19 04:43:51,904] Trial 112 pruned. Trial was pruned at iteration 0.
[I 2023-12-19 04:43:51,991] Trial 113 pruned. Trial was pruned at iteration 1.
[I 2023-12-19 04:43:52,091] Trial 114 pruned. Trial was pruned at iteration 1.
[I 2023-12-19 04:43:52,173] Trial 115 pruned. Trial was pruned at iteration 0.
[I 2023-12-19 04:43:55,268] Trial 116 finished with value: inf and parameters: {'learning_rate': 0.9294993988470167, 'aft_loss_distribution': 'normal', 'aft_loss_distribution_scale': 0.9153151866169398, 'max_depth': 4, 'booster': 'dart', 'scale_pos_weight': 8.370197000137356, 'alpha': 5.004374135119587, 'lambda': 4.361184076131467, 'eta': 0.327574410899075, 'sampling_method': 'uniform', 'subsample': 0.9060854967899693, 'gamma': 5.5521159612504825}. Best is trial 66 with value: 4.239326351908404.
[I 2023-12-19 04:43:55,349] Trial 117 pruned. Trial was pruned at iteration 0.
[I 2023-12-19 04:43:55,429] Trial 118 pruned. Trial was pruned at iteration 0.
[I 2023-12-19 04:43:55,534] Trial 119 pruned. Trial was pruned at iteration 2.
[I 2023-12-19 04:43:58,811] Trial 120 finished with value: inf and parameters: {'learning_rate': 0.9638689669482696, 'aft_loss_distribution': 'normal', 'aft_loss_distribution_scale': 0.9815017261136036, 'max_depth': 9, 'booster': 'dart', 'scale_pos_weight': 8.962179526166581, 'alpha': 3.682380250107184, 'lambda': 3.9104024170829854, 'eta': 0.3559966816783693, 'sampling_method': 'uniform', 'subsample': 0.7762703843237739, 'gamma': 6.520976360290836}. Best is trial 66 with value: 4.239326351908404.
[I 2023-12-19 04:43:59,000] Trial 121 pruned. Trial was pruned at iteration 0.
[I 2023-12-19 04:43:59,173] Trial 122 pruned. Trial was pruned at iteration 0.
[I 2023-12-19 04:44:00,116] Trial 123 pruned. Trial was pruned at iteration 1.
[I 2023-12-19 04:44:00,392] Trial 124 pruned. Trial was pruned at iteration 0.
[I 2023-12-19 04:44:00,565] Trial 125 pruned. Trial was pruned at iteration 0.
[I 2023-12-19 04:44:00,730] Trial 126 pruned. Trial was pruned at iteration 0.
[I 2023-12-19 04:44:00,902] Trial 127 pruned. Trial was pruned at iteration 1.
[I 2023-12-19 04:44:01,071] Trial 128 pruned. Trial was pruned at iteration 0.
[I 2023-12-19 04:44:01,550] Trial 129 pruned. Trial was pruned at iteration 0.
[I 2023-12-19 04:44:01,873] Trial 130 pruned. Trial was pruned at iteration 0.
[I 2023-12-19 04:44:02,194] Trial 131 pruned. Trial was pruned at iteration 0.
[I 2023-12-19 04:44:02,994] Trial 132 pruned. Trial was pruned at iteration 1.
[I 2023-12-19 04:44:09,610] Trial 133 pruned. Trial was pruned at iteration 87.
[I 2023-12-19 04:44:09,696] Trial 134 pruned. Trial was pruned at iteration 0.
[I 2023-12-19 04:44:09,778] Trial 135 pruned. Trial was pruned at iteration 0.
[I 2023-12-19 04:44:09,873] Trial 136 pruned. Trial was pruned at iteration 1.
[I 2023-12-19 04:44:14,302] Trial 137 finished with value: 4.238477147639884 and parameters: {'learning_rate': 0.8655262836233876, 'aft_loss_distribution': 'normal', 'aft_loss_distribution_scale': 0.998115794183331, 'max_depth': 3, 'booster': 'dart', 'scale_pos_weight': 0.6703776207600405, 'alpha': 8.541849275943353, 'lambda': 7.647220359669481, 'eta': 0.2654550978216056, 'sampling_method': 'uniform', 'subsample': 0.7957107257005807, 'gamma': 8.337071940933475}. Best is trial 137 with value: 4.238477147639884.
[I 2023-12-19 04:44:14,389] Trial 138 pruned. Trial was pruned at iteration 0.
[I 2023-12-19 04:44:14,478] Trial 139 pruned. Trial was pruned at iteration 0.
[I 2023-12-19 04:44:14,577] Trial 140 pruned. Trial was pruned at iteration 0.
[I 2023-12-19 04:44:14,665] Trial 141 pruned. Trial was pruned at iteration 0.
[I 2023-12-19 04:44:21,874] Trial 142 finished with value: 4.248878148581023 and parameters: {'learning_rate': 0.8700860325624957, 'aft_loss_distribution': 'normal', 'aft_loss_distribution_scale': 1.103104580831847, 'max_depth': 3, 'booster': 'dart', 'scale_pos_weight': 0.34306638637892756, 'alpha': 0.09245723577276177, 'lambda': 7.397966300098076, 'eta': 0.3276782012054996, 'sampling_method': 'uniform', 'subsample': 0.5343900814138989, 'gamma': 9.638733459399575}. Best is trial 137 with value: 4.238477147639884.
[I 2023-12-19 04:44:25,046] Trial 143 finished with value: inf and parameters: {'learning_rate': 0.8737768108103477, 'aft_loss_distribution': 'normal', 'aft_loss_distribution_scale': 1.070157498943663, 'max_depth': 3, 'booster': 'dart', 'scale_pos_weight': 0.4004039625344461, 'alpha': 0.13133909870726068, 'lambda': 8.69318331787368, 'eta': 0.350682572491303, 'sampling_method': 'uniform', 'subsample': 0.5415137658133233, 'gamma': 9.85033152224144}. Best is trial 137 with value: 4.238477147639884.
[I 2023-12-19 04:44:25,133] Trial 144 pruned. Trial was pruned at iteration 0.
[I 2023-12-19 04:44:25,229] Trial 145 pruned. Trial was pruned at iteration 1.
[I 2023-12-19 04:44:25,323] Trial 146 pruned. Trial was pruned at iteration 1.
[I 2023-12-19 04:44:25,414] Trial 147 pruned. Trial was pruned at iteration 0.
[I 2023-12-19 04:44:25,508] Trial 148 pruned. Trial was pruned at iteration 0.
[I 2023-12-19 04:44:25,611] Trial 149 pruned. Trial was pruned at iteration 0.
[I 2023-12-19 04:44:25,712] Trial 150 pruned. Trial was pruned at iteration 0.
[I 2023-12-19 04:44:25,805] Trial 151 pruned. Trial was pruned at iteration 0.
[I 2023-12-19 04:44:25,894] Trial 152 pruned. Trial was pruned at iteration 0.
[I 2023-12-19 04:44:25,997] Trial 153 pruned. Trial was pruned at iteration 1.
[I 2023-12-19 04:44:30,352] Trial 154 finished with value: 4.25123390766813 and parameters: {'learning_rate': 0.8915122781994982, 'aft_loss_distribution': 'normal', 'aft_loss_distribution_scale': 1.1171769201371826, 'max_depth': 4, 'booster': 'dart', 'scale_pos_weight': 8.334995020627911, 'alpha': 8.293173206495878, 'lambda': 6.617994709480393, 'eta': 0.3099156979587593, 'sampling_method': 'uniform', 'subsample': 0.8111856410831505, 'gamma': 9.961761086694372}. Best is trial 137 with value: 4.238477147639884.
[I 2023-12-19 04:45:09,419] Trial 155 finished with value: 4.2470676090944455 and parameters: {'learning_rate': 0.8426763353753458, 'aft_loss_distribution': 'normal', 'aft_loss_distribution_scale': 1.1084221353064085, 'max_depth': 4, 'booster': 'dart', 'scale_pos_weight': 8.260642568357456, 'alpha': 9.290545026950042, 'lambda': 6.210411427524965, 'eta': 0.33853074732318766, 'sampling_method': 'uniform', 'subsample': 0.7708219678373387, 'gamma': 9.376433390706326}. Best is trial 137 with value: 4.238477147639884.
[I 2023-12-19 04:45:09,504] Trial 156 pruned. Trial was pruned at iteration 0.
[I 2023-12-19 04:45:09,599] Trial 157 pruned. Trial was pruned at iteration 0.
[I 2023-12-19 04:45:09,689] Trial 158 pruned. Trial was pruned at iteration 0.
[I 2023-12-19 04:45:09,783] Trial 159 pruned. Trial was pruned at iteration 0.
[I 2023-12-19 04:45:09,879] Trial 160 pruned. Trial was pruned at iteration 1.
[I 2023-12-19 04:45:10,011] Trial 161 pruned. Trial was pruned at iteration 4.
[I 2023-12-19 04:45:10,098] Trial 162 pruned. Trial was pruned at iteration 0.
[I 2023-12-19 04:45:10,219] Trial 163 pruned. Trial was pruned at iteration 4.
[I 2023-12-19 04:45:10,325] Trial 164 pruned. Trial was pruned at iteration 0.
[I 2023-12-19 04:45:12,670] Trial 165 finished with value: inf and parameters: {'learning_rate': 0.9089383532233409, 'aft_loss_distribution': 'normal', 'aft_loss_distribution_scale': 1.008831056190678, 'max_depth': 5, 'booster': 'dart', 'scale_pos_weight': 6.966335376980685, 'alpha': 8.819128725788113, 'lambda': 6.877046660379025, 'eta': 0.36055468600711743, 'sampling_method': 'uniform', 'subsample': 0.8583771940138838, 'gamma': 5.9583332580991915}. Best is trial 137 with value: 4.238477147639884.
[I 2023-12-19 04:45:12,767] Trial 166 pruned. Trial was pruned at iteration 0.
[I 2023-12-19 04:45:12,858] Trial 167 pruned. Trial was pruned at iteration 0.
[I 2023-12-19 04:45:12,952] Trial 168 pruned. Trial was pruned at iteration 0.
[I 2023-12-19 04:45:13,042] Trial 169 pruned. Trial was pruned at iteration 0.
[I 2023-12-19 04:45:15,493] Trial 170 finished with value: inf and parameters: {'learning_rate': 0.8452626454466285, 'aft_loss_distribution': 'normal', 'aft_loss_distribution_scale': 1.1211361246815632, 'max_depth': 3, 'booster': 'dart', 'scale_pos_weight': 7.2178540700047185, 'alpha': 4.532330290234507, 'lambda': 7.9533268053157755, 'eta': 0.29532354380635595, 'sampling_method': 'uniform', 'subsample': 0.8712024795037522, 'gamma': 0.7517072899850321}. Best is trial 137 with value: 4.238477147639884.
[I 2023-12-19 04:45:15,585] Trial 171 pruned. Trial was pruned at iteration 0.
[I 2023-12-19 04:45:15,736] Trial 172 pruned. Trial was pruned at iteration 1.
[I 2023-12-19 04:45:15,932] Trial 173 pruned. Trial was pruned at iteration 1.
[I 2023-12-19 04:45:16,092] Trial 174 pruned. Trial was pruned at iteration 1.
[I 2023-12-19 04:45:16,244] Trial 175 pruned. Trial was pruned at iteration 0.
[I 2023-12-19 04:45:16,479] Trial 176 pruned. Trial was pruned at iteration 2.
[I 2023-12-19 04:45:16,624] Trial 177 pruned. Trial was pruned at iteration 0.
[I 2023-12-19 04:45:16,762] Trial 178 pruned. Trial was pruned at iteration 0.
[I 2023-12-19 04:45:16,893] Trial 179 pruned. Trial was pruned at iteration 0.
[I 2023-12-19 04:45:17,039] Trial 180 pruned. Trial was pruned at iteration 0.
[I 2023-12-19 04:45:17,174] Trial 181 pruned. Trial was pruned at iteration 0.
[I 2023-12-19 04:45:17,311] Trial 182 pruned. Trial was pruned at iteration 0.
[I 2023-12-19 04:45:17,450] Trial 183 pruned. Trial was pruned at iteration 0.
[I 2023-12-19 04:45:17,741] Trial 184 pruned. Trial was pruned at iteration 0.
[I 2023-12-19 04:45:17,938] Trial 185 pruned. Trial was pruned at iteration 0.
[I 2023-12-19 04:45:22,995] Trial 186 finished with value: inf and parameters: {'learning_rate': 0.8855313109506422, 'aft_loss_distribution': 'normal', 'aft_loss_distribution_scale': 1.0423725999613038, 'max_depth': 3, 'booster': 'dart', 'scale_pos_weight': 5.2536568497845515, 'alpha': 4.852611993739001, 'lambda': 4.096874172152116, 'eta': 0.2838052566824839, 'sampling_method': 'uniform', 'subsample': 0.837974446785346, 'gamma': 6.293665413992171}. Best is trial 137 with value: 4.238477147639884.
[I 2023-12-19 04:45:23,092] Trial 187 pruned. Trial was pruned at iteration 0.
[I 2023-12-19 04:45:23,185] Trial 188 pruned. Trial was pruned at iteration 0.
[I 2023-12-19 04:45:23,282] Trial 189 pruned. Trial was pruned at iteration 0.
[I 2023-12-19 04:45:23,378] Trial 190 pruned. Trial was pruned at iteration 0.
[I 2023-12-19 04:45:23,471] Trial 191 pruned. Trial was pruned at iteration 0.
[I 2023-12-19 04:45:23,564] Trial 192 pruned. Trial was pruned at iteration 0.
[I 2023-12-19 04:45:23,670] Trial 193 pruned. Trial was pruned at iteration 0.
[I 2023-12-19 04:45:23,778] Trial 194 pruned. Trial was pruned at iteration 0.
[I 2023-12-19 04:45:23,874] Trial 195 pruned. Trial was pruned at iteration 1.
[I 2023-12-19 04:45:23,973] Trial 196 pruned. Trial was pruned at iteration 0.
[I 2023-12-19 04:45:24,067] Trial 197 pruned. Trial was pruned at iteration 0.
[I 2023-12-19 04:45:24,169] Trial 198 pruned. Trial was pruned at iteration 1.
[I 2023-12-19 04:45:24,270] Trial 199 pruned. Trial was pruned at iteration 0.
[I 2023-12-19 04:45:24,366] Trial 200 pruned. Trial was pruned at iteration 0.
[I 2023-12-19 04:45:24,459] Trial 201 pruned. Trial was pruned at iteration 0.
[I 2023-12-19 04:45:24,562] Trial 202 pruned. Trial was pruned at iteration 1.
[I 2023-12-19 04:45:24,657] Trial 203 pruned. Trial was pruned at iteration 0.
[I 2023-12-19 04:45:24,749] Trial 204 pruned. Trial was pruned at iteration 0.
[I 2023-12-19 04:45:24,853] Trial 205 pruned. Trial was pruned at iteration 0.
[I 2023-12-19 04:45:24,953] Trial 206 pruned. Trial was pruned at iteration 0.
[I 2023-12-19 04:45:25,067] Trial 207 pruned. Trial was pruned at iteration 0.
[I 2023-12-19 04:45:25,459] Trial 208 finished with value: inf and parameters: {'learning_rate': 0.8894344463198294, 'aft_loss_distribution': 'normal', 'aft_loss_distribution_scale': 1.100576981706524, 'max_depth': 3, 'booster': 'gbtree', 'scale_pos_weight': 9.110107583922971, 'alpha': 8.69114506538174, 'lambda': 6.845284899891738, 'eta': 0.3063959523442031, 'sampling_method': 'uniform', 'subsample': 0.24625613795117943, 'gamma': 6.218493893272332}. Best is trial 137 with value: 4.238477147639884.
[I 2023-12-19 04:45:25,554] Trial 209 pruned. Trial was pruned at iteration 0.
[I 2023-12-19 04:45:25,655] Trial 210 pruned. Trial was pruned at iteration 0.
[I 2023-12-19 04:45:25,750] Trial 211 pruned. Trial was pruned at iteration 0.
[I 2023-12-19 04:45:25,858] Trial 212 pruned. Trial was pruned at iteration 0.
[I 2023-12-19 04:45:25,952] Trial 213 pruned. Trial was pruned at iteration 0.
[I 2023-12-19 04:45:26,051] Trial 214 pruned. Trial was pruned at iteration 0.
[I 2023-12-19 04:45:26,149] Trial 215 pruned. Trial was pruned at iteration 0.
