[I 2023-12-19 00:53:11,959] Trial 265 finished with value: 1.992448901752905 and parameters: {'learning_rate': 0.9516590025565805, 'aft_loss_distribution': 'normal', 'aft_loss_distribution_scale': 1.4670645938104971, 'max_depth': 9, 'booster': 'dart', 'scale_pos_weight': 2.964519992786795, 'alpha': 4.744972734466353, 'lambda': 9.268486154510647, 'eta': 0.9418466057286712, 'sampling_method': 'uniform', 'subsample': 0.6758261199459135, 'gamma': 9.52530488049654}. Best is trial 116 with value: 1.9878633343995167.
[I 2023-12-19 00:53:12,041] Trial 266 pruned. Trial was pruned at iteration 0.
[I 2023-12-19 00:53:13,460] Trial 267 finished with value: inf and parameters: {'learning_rate': 0.971415973905547, 'aft_loss_distribution': 'normal', 'aft_loss_distribution_scale': 1.2859601884738634, 'max_depth': 9, 'booster': 'dart', 'scale_pos_weight': 2.5399476721349505, 'alpha': 4.469139719686573, 'lambda': 9.63565693200133, 'eta': 0.8755607611398504, 'sampling_method': 'uniform', 'subsample': 0.7030551793101408, 'gamma': 3.8177519357832237}. Best is trial 116 with value: 1.9878633343995167.
[I 2023-12-19 00:53:13,557] Trial 268 pruned. Trial was pruned at iteration 1.
[I 2023-12-19 00:53:13,631] Trial 269 pruned. Trial was pruned at iteration 0.
[I 2023-12-19 00:53:13,719] Trial 270 pruned. Trial was pruned at iteration 0.
[I 2023-12-19 00:53:13,797] Trial 271 pruned. Trial was pruned at iteration 0.
[I 2023-12-19 00:53:16,917] Trial 272 pruned. Trial was pruned at iteration 84.
[I 2023-12-19 00:53:17,010] Trial 273 pruned. Trial was pruned at iteration 1.
[I 2023-12-19 00:53:17,095] Trial 274 pruned. Trial was pruned at iteration 0.
[I 2023-12-19 00:53:17,177] Trial 275 pruned. Trial was pruned at iteration 0.
[I 2023-12-19 00:53:19,458] Trial 276 finished with value: inf and parameters: {'learning_rate': 0.9817755636625423, 'aft_loss_distribution': 'normal', 'aft_loss_distribution_scale': 1.494385796116235, 'max_depth': 9, 'booster': 'dart', 'scale_pos_weight': 2.4919849486053725, 'alpha': 4.875195103858233, 'lambda': 9.371819317151463, 'eta': 0.6547292091231927, 'sampling_method': 'uniform', 'subsample': 0.7556877343360501, 'gamma': 9.816590964565648}. Best is trial 116 with value: 1.9878633343995167.
[I 2023-12-19 00:53:19,557] Trial 277 pruned. Trial was pruned at iteration 0.
[I 2023-12-19 00:53:19,639] Trial 278 pruned. Trial was pruned at iteration 0.
[I 2023-12-19 00:53:19,724] Trial 279 pruned. Trial was pruned at iteration 0.
[I 2023-12-19 00:53:19,813] Trial 280 pruned. Trial was pruned at iteration 2.
[I 2023-12-19 00:53:19,908] Trial 281 pruned. Trial was pruned at iteration 0.
[I 2023-12-19 00:53:19,986] Trial 282 pruned. Trial was pruned at iteration 0.
[I 2023-12-19 00:53:20,096] Trial 283 pruned. Trial was pruned at iteration 0.
[I 2023-12-19 00:53:20,215] Trial 284 pruned. Trial was pruned at iteration 0.
[I 2023-12-19 00:53:20,330] Trial 285 pruned. Trial was pruned at iteration 0.
[I 2023-12-19 00:53:20,457] Trial 286 pruned. Trial was pruned at iteration 1.
[I 2023-12-19 00:53:20,575] Trial 287 pruned. Trial was pruned at iteration 0.
[I 2023-12-19 00:53:20,695] Trial 288 pruned. Trial was pruned at iteration 1.
[I 2023-12-19 00:53:20,803] Trial 289 pruned. Trial was pruned at iteration 0.
[I 2023-12-19 00:53:20,935] Trial 290 pruned. Trial was pruned at iteration 0.
[I 2023-12-19 00:53:21,050] Trial 291 pruned. Trial was pruned at iteration 0.
[I 2023-12-19 00:53:21,176] Trial 292 pruned. Trial was pruned at iteration 2.
[I 2023-12-19 00:53:21,299] Trial 293 pruned. Trial was pruned at iteration 1.
[I 2023-12-19 00:53:21,421] Trial 294 pruned. Trial was pruned at iteration 0.
[I 2023-12-19 00:53:21,547] Trial 295 pruned. Trial was pruned at iteration 0.
[I 2023-12-19 00:53:21,669] Trial 296 pruned. Trial was pruned at iteration 0.
[I 2023-12-19 00:53:21,792] Trial 297 pruned. Trial was pruned at iteration 0.
[I 2023-12-19 00:53:21,934] Trial 298 pruned. Trial was pruned at iteration 0.
[I 2023-12-19 00:53:22,069] Trial 299 pruned. Trial was pruned at iteration 1.
[I 2023-12-19 00:53:22,214] Trial 300 pruned. Trial was pruned at iteration 0.
[I 2023-12-19 00:53:22,338] Trial 301 pruned. Trial was pruned at iteration 0.
[I 2023-12-19 00:53:22,476] Trial 302 pruned. Trial was pruned at iteration 0.
[I 2023-12-19 00:53:22,601] Trial 303 pruned. Trial was pruned at iteration 0.
[I 2023-12-19 00:53:22,716] Trial 304 pruned. Trial was pruned at iteration 0.
[I 2023-12-19 00:53:24,895] Trial 305 finished with value: inf and parameters: {'learning_rate': 0.9840174019937737, 'aft_loss_distribution': 'normal', 'aft_loss_distribution_scale': 1.4396577476945172, 'max_depth': 7, 'booster': 'dart', 'scale_pos_weight': 3.0434451103648343, 'alpha': 4.511441795843759, 'lambda': 9.850369928507575, 'eta': 0.8027841886760128, 'sampling_method': 'uniform', 'subsample': 0.6484918744542089, 'gamma': 5.7247589912238155}. Best is trial 116 with value: 1.9878633343995167.
[I 2023-12-19 00:53:25,021] Trial 306 pruned. Trial was pruned at iteration 0.
[I 2023-12-19 00:53:25,136] Trial 307 pruned. Trial was pruned at iteration 0.
[I 2023-12-19 00:53:25,227] Trial 308 pruned. Trial was pruned at iteration 1.
[I 2023-12-19 00:53:25,386] Trial 309 pruned. Trial was pruned at iteration 10.
[I 2023-12-19 00:53:25,474] Trial 310 pruned. Trial was pruned at iteration 0.
[I 2023-12-19 00:53:25,554] Trial 311 pruned. Trial was pruned at iteration 0.
[I 2023-12-19 00:53:25,639] Trial 312 pruned. Trial was pruned at iteration 0.
[I 2023-12-19 00:53:25,718] Trial 313 pruned. Trial was pruned at iteration 0.
[I 2023-12-19 00:53:25,798] Trial 314 pruned. Trial was pruned at iteration 0.
[I 2023-12-19 00:53:25,881] Trial 315 pruned. Trial was pruned at iteration 1.
[I 2023-12-19 00:53:25,975] Trial 316 pruned. Trial was pruned at iteration 1.
[I 2023-12-19 00:53:26,060] Trial 317 pruned. Trial was pruned at iteration 1.
[I 2023-12-19 00:53:28,259] Trial 318 finished with value: inf and parameters: {'learning_rate': 0.9798102334861134, 'aft_loss_distribution': 'normal', 'aft_loss_distribution_scale': 1.3960550793229716, 'max_depth': 9, 'booster': 'dart', 'scale_pos_weight': 1.6706496415656955, 'alpha': 4.902555538032846, 'lambda': 9.272696191136793, 'eta': 0.7912771623312758, 'sampling_method': 'gradient_based', 'subsample': 0.639448154644933, 'gamma': 9.224494286006816}. Best is trial 116 with value: 1.9878633343995167.
[I 2023-12-19 00:53:31,771] Trial 319 finished with value: 1.989176553481162 and parameters: {'learning_rate': 0.9991299088220738, 'aft_loss_distribution': 'normal', 'aft_loss_distribution_scale': 1.4760079260351084, 'max_depth': 8, 'booster': 'dart', 'scale_pos_weight': 2.6389368220631426, 'alpha': 3.73200099901612, 'lambda': 9.662519930916316, 'eta': 0.8619666032971508, 'sampling_method': 'uniform', 'subsample': 0.7128821794220753, 'gamma': 9.771250776112574}. Best is trial 116 with value: 1.9878633343995167.
[I 2023-12-19 00:53:31,862] Trial 320 pruned. Trial was pruned at iteration 1.
[I 2023-12-19 00:53:34,142] Trial 321 finished with value: inf and parameters: {'learning_rate': 0.9984309694388425, 'aft_loss_distribution': 'normal', 'aft_loss_distribution_scale': 1.5797792280449543, 'max_depth': 8, 'booster': 'dart', 'scale_pos_weight': 2.6560132971847334, 'alpha': 5.751804205748051, 'lambda': 9.44966205605079, 'eta': 0.6949921526062119, 'sampling_method': 'uniform', 'subsample': 0.7621967742210877, 'gamma': 9.99894094921148}. Best is trial 116 with value: 1.9878633343995167.
[I 2023-12-19 00:53:34,245] Trial 322 pruned. Trial was pruned at iteration 0.
[I 2023-12-19 00:53:34,361] Trial 323 pruned. Trial was pruned at iteration 0.
[I 2023-12-19 00:53:34,443] Trial 324 pruned. Trial was pruned at iteration 0.
[I 2023-12-19 00:53:34,528] Trial 325 pruned. Trial was pruned at iteration 0.
[I 2023-12-19 00:53:34,610] Trial 326 pruned. Trial was pruned at iteration 0.
[I 2023-12-19 00:53:34,694] Trial 327 pruned. Trial was pruned at iteration 0.
[I 2023-12-19 00:53:40,338] Trial 328 finished with value: 1.9885374491806642 and parameters: {'learning_rate': 0.9724861101383052, 'aft_loss_distribution': 'normal', 'aft_loss_distribution_scale': 1.4547981328522683, 'max_depth': 8, 'booster': 'dart', 'scale_pos_weight': 2.6829663029267428, 'alpha': 3.204095733892783, 'lambda': 9.509107373958313, 'eta': 0.8819771520836274, 'sampling_method': 'uniform', 'subsample': 0.7799841108370852, 'gamma': 9.580331389891812}. Best is trial 116 with value: 1.9878633343995167.
[I 2023-12-19 00:53:40,424] Trial 329 pruned. Trial was pruned at iteration 0.
[I 2023-12-19 00:53:40,514] Trial 330 pruned. Trial was pruned at iteration 0.
[I 2023-12-19 00:53:40,604] Trial 331 pruned. Trial was pruned at iteration 0.
[I 2023-12-19 00:53:40,694] Trial 332 pruned. Trial was pruned at iteration 1.
[I 2023-12-19 00:53:40,774] Trial 333 pruned. Trial was pruned at iteration 0.
[I 2023-12-19 00:53:40,861] Trial 334 pruned. Trial was pruned at iteration 0.
[I 2023-12-19 00:53:40,952] Trial 335 pruned. Trial was pruned at iteration 1.
[I 2023-12-19 00:53:41,040] Trial 336 pruned. Trial was pruned at iteration 1.
[I 2023-12-19 00:53:41,130] Trial 337 pruned. Trial was pruned at iteration 1.
[I 2023-12-19 00:53:41,214] Trial 338 pruned. Trial was pruned at iteration 0.
[I 2023-12-19 00:53:44,709] Trial 339 finished with value: 1.9872850090132683 and parameters: {'learning_rate': 0.9999313016592013, 'aft_loss_distribution': 'normal', 'aft_loss_distribution_scale': 1.383615569120385, 'max_depth': 9, 'booster': 'dart', 'scale_pos_weight': 3.338555496809064, 'alpha': 3.5031388612552976, 'lambda': 9.833956308194123, 'eta': 0.6728944457096281, 'sampling_method': 'uniform', 'subsample': 0.6822289985685857, 'gamma': 9.272388669154061}. Best is trial 339 with value: 1.9872850090132683.
[I 2023-12-19 00:54:15,328] Trial 340 finished with value: 1.9891255670927441 and parameters: {'learning_rate': 0.9848937063533884, 'aft_loss_distribution': 'normal', 'aft_loss_distribution_scale': 1.2779412209604217, 'max_depth': 9, 'booster': 'dart', 'scale_pos_weight': 3.3201199820120193, 'alpha': 3.514016045117722, 'lambda': 9.819299997497883, 'eta': 0.6376871023523559, 'sampling_method': 'uniform', 'subsample': 0.6750286378969403, 'gamma': 9.450002125933857}. Best is trial 339 with value: 1.9872850090132683.
[I 2023-12-19 00:54:15,417] Trial 341 pruned. Trial was pruned at iteration 0.
[I 2023-12-19 00:54:17,827] Trial 342 pruned. Trial was pruned at iteration 73.
[I 2023-12-19 00:54:17,913] Trial 343 pruned. Trial was pruned at iteration 0.
[I 2023-12-19 00:54:17,991] Trial 344 pruned. Trial was pruned at iteration 0.
[I 2023-12-19 00:54:18,078] Trial 345 pruned. Trial was pruned at iteration 0.
[I 2023-12-19 00:54:20,099] Trial 346 finished with value: inf and parameters: {'learning_rate': 0.9822641218146526, 'aft_loss_distribution': 'normal', 'aft_loss_distribution_scale': 1.3404633465660045, 'max_depth': 9, 'booster': 'dart', 'scale_pos_weight': 3.305796247770954, 'alpha': 3.400393249306928, 'lambda': 9.673000311443358, 'eta': 0.6819335670264646, 'sampling_method': 'uniform', 'subsample': 0.6827524530631832, 'gamma': 9.470690338581282}. Best is trial 339 with value: 1.9872850090132683.
[I 2023-12-19 00:54:20,250] Trial 347 pruned. Trial was pruned at iteration 0.
[I 2023-12-19 00:54:20,410] Trial 348 pruned. Trial was pruned at iteration 1.
[I 2023-12-19 00:54:20,546] Trial 349 pruned. Trial was pruned at iteration 0.
[I 2023-12-19 00:54:20,689] Trial 350 pruned. Trial was pruned at iteration 0.
[I 2023-12-19 00:54:20,824] Trial 351 pruned. Trial was pruned at iteration 0.
[I 2023-12-19 00:54:22,875] Trial 352 finished with value: inf and parameters: {'learning_rate': 0.966868064207983, 'aft_loss_distribution': 'normal', 'aft_loss_distribution_scale': 1.3242776161935539, 'max_depth': 9, 'booster': 'dart', 'scale_pos_weight': 3.196629062923034, 'alpha': 3.7068793817781445, 'lambda': 9.801410879911735, 'eta': 0.7206982561499846, 'sampling_method': 'uniform', 'subsample': 0.6571903672538372, 'gamma': 9.665639567635028}. Best is trial 339 with value: 1.9872850090132683.
[I 2023-12-19 00:54:23,010] Trial 353 pruned. Trial was pruned at iteration 1.
[I 2023-12-19 00:54:23,153] Trial 354 pruned. Trial was pruned at iteration 0.
[I 2023-12-19 00:54:23,287] Trial 355 pruned. Trial was pruned at iteration 0.
[I 2023-12-19 00:54:23,374] Trial 356 pruned. Trial was pruned at iteration 1.
[I 2023-12-19 00:54:23,458] Trial 357 pruned. Trial was pruned at iteration 0.
[I 2023-12-19 00:54:24,881] Trial 358 finished with value: inf and parameters: {'learning_rate': 0.9851207684546553, 'aft_loss_distribution': 'normal', 'aft_loss_distribution_scale': 1.3370099792733974, 'max_depth': 9, 'booster': 'dart', 'scale_pos_weight': 2.8822080585661887, 'alpha': 4.173092949479349, 'lambda': 9.187454549702073, 'eta': 0.6692019790049065, 'sampling_method': 'uniform', 'subsample': 0.7220454155626531, 'gamma': 5.492078748048272}. Best is trial 339 with value: 1.9872850090132683.
[I 2023-12-19 00:54:24,990] Trial 359 pruned. Trial was pruned at iteration 1.
[I 2023-12-19 00:54:25,075] Trial 360 pruned. Trial was pruned at iteration 0.
[I 2023-12-19 00:54:25,174] Trial 361 pruned. Trial was pruned at iteration 0.
[I 2023-12-19 00:54:25,260] Trial 362 pruned. Trial was pruned at iteration 0.
[I 2023-12-19 00:54:25,354] Trial 363 pruned. Trial was pruned at iteration 1.
[I 2023-12-19 00:54:25,446] Trial 364 pruned. Trial was pruned at iteration 0.
[I 2023-12-19 00:54:25,536] Trial 365 pruned. Trial was pruned at iteration 0.
[I 2023-12-19 00:54:25,621] Trial 366 pruned. Trial was pruned at iteration 0.
[I 2023-12-19 00:54:25,715] Trial 367 pruned. Trial was pruned at iteration 1.
[I 2023-12-19 00:54:25,798] Trial 368 pruned. Trial was pruned at iteration 0.
[I 2023-12-19 00:54:33,562] Trial 369 finished with value: 1.9907118992851287 and parameters: {'learning_rate': 0.9467202202903904, 'aft_loss_distribution': 'normal', 'aft_loss_distribution_scale': 1.4797918060038742, 'max_depth': 7, 'booster': 'dart', 'scale_pos_weight': 2.7302629861761933, 'alpha': 5.42553351132727, 'lambda': 9.286568446826543, 'eta': 0.8689213927214948, 'sampling_method': 'uniform', 'subsample': 0.730170552006021, 'gamma': 9.632785839444233}. Best is trial 339 with value: 1.9872850090132683.
[I 2023-12-19 00:54:33,706] Trial 370 pruned. Trial was pruned at iteration 0.
[I 2023-12-19 00:54:33,830] Trial 371 pruned. Trial was pruned at iteration 0.
[I 2023-12-19 00:54:33,965] Trial 372 pruned. Trial was pruned at iteration 0.
[I 2023-12-19 00:54:34,090] Trial 373 pruned. Trial was pruned at iteration 0.
[I 2023-12-19 00:54:34,237] Trial 374 pruned. Trial was pruned at iteration 1.
[I 2023-12-19 00:54:34,364] Trial 375 pruned. Trial was pruned at iteration 0.
[I 2023-12-19 00:54:34,513] Trial 376 pruned. Trial was pruned at iteration 0.
[I 2023-12-19 00:54:34,636] Trial 377 pruned. Trial was pruned at iteration 1.
[I 2023-12-19 00:54:34,756] Trial 378 pruned. Trial was pruned at iteration 0.
[I 2023-12-19 00:54:34,885] Trial 379 pruned. Trial was pruned at iteration 0.
[I 2023-12-19 00:54:35,003] Trial 380 pruned. Trial was pruned at iteration 0.
[I 2023-12-19 00:54:35,137] Trial 381 pruned. Trial was pruned at iteration 1.
[I 2023-12-19 00:54:35,261] Trial 382 pruned. Trial was pruned at iteration 0.
[I 2023-12-19 00:54:38,747] Trial 383 finished with value: 1.9916388224834332 and parameters: {'learning_rate': 0.9996391693404394, 'aft_loss_distribution': 'normal', 'aft_loss_distribution_scale': 1.325266130187422, 'max_depth': 7, 'booster': 'dart', 'scale_pos_weight': 2.766630193958624, 'alpha': 4.280743215460885, 'lambda': 9.45435028048996, 'eta': 0.4610853592081862, 'sampling_method': 'uniform', 'subsample': 0.6556448000973211, 'gamma': 6.833569063185}. Best is trial 339 with value: 1.9872850090132683.
[I 2023-12-19 00:54:38,841] Trial 384 pruned. Trial was pruned at iteration 1.
[I 2023-12-19 00:54:38,925] Trial 385 pruned. Trial was pruned at iteration 0.
[I 2023-12-19 00:54:39,024] Trial 386 pruned. Trial was pruned at iteration 0.
[I 2023-12-19 00:54:39,112] Trial 387 pruned. Trial was pruned at iteration 0.
[I 2023-12-19 00:54:39,199] Trial 388 pruned. Trial was pruned at iteration 0.
[I 2023-12-19 00:54:39,298] Trial 389 pruned. Trial was pruned at iteration 1.
[I 2023-12-19 00:54:42,083] Trial 390 finished with value: 1.9917256974027095 and parameters: {'learning_rate': 0.9809149904689914, 'aft_loss_distribution': 'normal', 'aft_loss_distribution_scale': 1.3927126776437226, 'max_depth': 8, 'booster': 'dart', 'scale_pos_weight': 2.8108639167412988, 'alpha': 4.547579547518101, 'lambda': 9.382911245171748, 'eta': 0.8053203206825089, 'sampling_method': 'uniform', 'subsample': 0.7712709898430249, 'gamma': 9.518175968600271}. Best is trial 339 with value: 1.9872850090132683.
[I 2023-12-19 00:54:42,172] Trial 391 pruned. Trial was pruned at iteration 0.
[I 2023-12-19 00:54:42,261] Trial 392 pruned. Trial was pruned at iteration 0.
[I 2023-12-19 00:54:42,354] Trial 393 pruned. Trial was pruned at iteration 0.
[I 2023-12-19 00:54:42,453] Trial 394 pruned. Trial was pruned at iteration 1.
[I 2023-12-19 00:54:42,540] Trial 395 pruned. Trial was pruned at iteration 0.
[I 2023-12-19 00:54:42,629] Trial 396 pruned. Trial was pruned at iteration 0.
[I 2023-12-19 00:54:42,730] Trial 397 pruned. Trial was pruned at iteration 0.
[I 2023-12-19 00:54:42,821] Trial 398 pruned. Trial was pruned at iteration 0.
[I 2023-12-19 00:54:49,482] Trial 399 finished with value: 1.9913721512874925 and parameters: {'learning_rate': 0.9678117649431371, 'aft_loss_distribution': 'normal', 'aft_loss_distribution_scale': 1.4441245844661872, 'max_depth': 9, 'booster': 'dart', 'scale_pos_weight': 3.075401313655599, 'alpha': 3.753676114339873, 'lambda': 9.98898546312137, 'eta': 0.9096705709087596, 'sampling_method': 'uniform', 'subsample': 0.6753025271332126, 'gamma': 9.529435102525918}. Best is trial 339 with value: 1.9872850090132683.
[I 2023-12-19 00:54:49,637] Trial 400 pruned. Trial was pruned at iteration 0.
[I 2023-12-19 00:54:49,771] Trial 401 pruned. Trial was pruned at iteration 1.
[I 2023-12-19 00:54:49,909] Trial 402 pruned. Trial was pruned at iteration 1.
[I 2023-12-19 00:54:53,339] Trial 403 finished with value: 1.990552987198123 and parameters: {'learning_rate': 0.9789486166427052, 'aft_loss_distribution': 'normal', 'aft_loss_distribution_scale': 1.459527753233457, 'max_depth': 9, 'booster': 'dart', 'scale_pos_weight': 3.64262703423461, 'alpha': 5.092983251374778, 'lambda': 9.53252040730942, 'eta': 0.9702286800172891, 'sampling_method': 'uniform', 'subsample': 0.7335109486400944, 'gamma': 9.825544656985437}. Best is trial 339 with value: 1.9872850090132683.
[I 2023-12-19 00:54:55,738] Trial 404 pruned. Trial was pruned at iteration 73.
[I 2023-12-19 00:54:55,826] Trial 405 pruned. Trial was pruned at iteration 0.
[I 2023-12-19 00:54:57,612] Trial 406 finished with value: inf and parameters: {'learning_rate': 0.9991162344501815, 'aft_loss_distribution': 'normal', 'aft_loss_distribution_scale': 1.286351206484781, 'max_depth': 9, 'booster': 'dart', 'scale_pos_weight': 3.4042881934141502, 'alpha': 5.2884572326661665, 'lambda': 9.206425289182643, 'eta': 0.9446556902775644, 'sampling_method': 'uniform', 'subsample': 0.7259940617074884, 'gamma': 9.984374803069068}. Best is trial 339 with value: 1.9872850090132683.
[I 2023-12-19 00:54:57,712] Trial 407 pruned. Trial was pruned at iteration 1.
[I 2023-12-19 00:54:57,803] Trial 408 pruned. Trial was pruned at iteration 0.
[I 2023-12-19 00:54:57,890] Trial 409 pruned. Trial was pruned at iteration 0.
[I 2023-12-19 00:54:57,981] Trial 410 pruned. Trial was pruned at iteration 0.
[I 2023-12-19 00:54:58,084] Trial 411 pruned. Trial was pruned at iteration 2.
[I 2023-12-19 00:54:58,187] Trial 412 pruned. Trial was pruned at iteration 1.
[I 2023-12-19 00:54:58,285] Trial 413 pruned. Trial was pruned at iteration 0.
[I 2023-12-19 00:54:58,379] Trial 414 pruned. Trial was pruned at iteration 0.
[I 2023-12-19 00:54:58,474] Trial 415 pruned. Trial was pruned at iteration 1.
[I 2023-12-19 00:54:58,568] Trial 416 pruned. Trial was pruned at iteration 0.
[I 2023-12-19 00:54:58,654] Trial 417 pruned. Trial was pruned at iteration 0.
[I 2023-12-19 00:55:13,397] Trial 418 finished with value: 1.9899125409594418 and parameters: {'learning_rate': 0.9681079270862011, 'aft_loss_distribution': 'normal', 'aft_loss_distribution_scale': 1.4491628792654905, 'max_depth': 8, 'booster': 'dart', 'scale_pos_weight': 3.6429322322212645, 'alpha': 5.548618569447229, 'lambda': 9.408981897533119, 'eta': 0.8182400272647626, 'sampling_method': 'uniform', 'subsample': 0.6846039264498848, 'gamma': 9.27990528402957}. Best is trial 339 with value: 1.9872850090132683.
[I 2023-12-19 00:55:13,551] Trial 419 pruned. Trial was pruned at iteration 0.
[I 2023-12-19 00:55:13,694] Trial 420 pruned. Trial was pruned at iteration 0.
[I 2023-12-19 00:55:13,839] Trial 421 pruned. Trial was pruned at iteration 1.
[I 2023-12-19 00:55:13,998] Trial 422 pruned. Trial was pruned at iteration 1.
[I 2023-12-19 00:55:14,134] Trial 423 pruned. Trial was pruned at iteration 0.
[I 2023-12-19 00:55:14,277] Trial 424 pruned. Trial was pruned at iteration 0.
[I 2023-12-19 00:55:14,426] Trial 425 pruned. Trial was pruned at iteration 0.
[I 2023-12-19 00:55:14,579] Trial 426 pruned. Trial was pruned at iteration 0.
[I 2023-12-19 00:55:14,729] Trial 427 pruned. Trial was pruned at iteration 1.
[I 2023-12-19 00:55:14,874] Trial 428 pruned. Trial was pruned at iteration 0.
[I 2023-12-19 00:55:15,014] Trial 429 pruned. Trial was pruned at iteration 2.
[I 2023-12-19 00:55:15,163] Trial 430 pruned. Trial was pruned at iteration 0.
[I 2023-12-19 00:55:15,327] Trial 431 pruned. Trial was pruned at iteration 0.
[I 2023-12-19 00:55:15,478] Trial 432 pruned. Trial was pruned at iteration 1.
[I 2023-12-19 00:55:15,613] Trial 433 pruned. Trial was pruned at iteration 0.
