[I 2023-12-21 04:03:31,145] Trial 63 finished with value: 2.0036749875651547 and parameters: {'learning_rate': 0.551030042180896, 'aft_loss_distribution': 'logistic', 'aft_loss_distribution_scale': 1.4903601281854486, 'max_depth': 10, 'booster': 'gbtree', 'scale_pos_weight': 0.3247629146820202, 'alpha': 0.624770089898111, 'lambda': 5.5464971407288335, 'eta': 0.03547339251762199, 'sampling_method': 'gradient_based', 'subsample': 0.7327379002464993, 'gamma': 7.073113641712691}. Best is trial 33 with value: 1.9262084836928193.
[I 2023-12-21 04:03:31,212] Trial 64 pruned. Trial was pruned at iteration 0.
[I 2023-12-21 04:03:31,268] Trial 65 pruned. Trial was pruned at iteration 0.
[I 2023-12-21 04:03:31,370] Trial 66 pruned. Trial was pruned at iteration 10.
[I 2023-12-21 04:03:31,422] Trial 67 pruned. Trial was pruned at iteration 0.
[I 2023-12-21 04:03:31,480] Trial 68 pruned. Trial was pruned at iteration 0.
[I 2023-12-21 04:03:31,535] Trial 69 pruned. Trial was pruned at iteration 0.
[I 2023-12-21 04:03:31,590] Trial 70 pruned. Trial was pruned at iteration 0.
[I 2023-12-21 04:03:31,911] Trial 71 finished with value: 2.01317202306156 and parameters: {'learning_rate': 0.45254747956540103, 'aft_loss_distribution': 'logistic', 'aft_loss_distribution_scale': 1.5331932939308428, 'max_depth': 10, 'booster': 'gbtree', 'scale_pos_weight': 0.2181140482512515, 'alpha': 0.5671717529835643, 'lambda': 4.800286815186304, 'eta': 0.0001563350095589791, 'sampling_method': 'gradient_based', 'subsample': 0.5841110435933683, 'gamma': 8.047393493140984}. Best is trial 33 with value: 1.9262084836928193.
[I 2023-12-21 04:03:31,969] Trial 72 pruned. Trial was pruned at iteration 0.
[I 2023-12-21 04:03:32,588] Trial 73 finished with value: 1.9890686558532367 and parameters: {'learning_rate': 0.4310432129636963, 'aft_loss_distribution': 'logistic', 'aft_loss_distribution_scale': 1.3900038083978237, 'max_depth': 10, 'booster': 'gbtree', 'scale_pos_weight': 0.1323803574936331, 'alpha': 0.05978488722840769, 'lambda': 4.367304561931273, 'eta': 0.05011221872044393, 'sampling_method': 'gradient_based', 'subsample': 0.5455235972349253, 'gamma': 6.959880241870948}. Best is trial 33 with value: 1.9262084836928193.
[I 2023-12-21 04:03:32,660] Trial 74 pruned. Trial was pruned at iteration 0.
[I 2023-12-21 04:03:32,720] Trial 75 pruned. Trial was pruned at iteration 0.
[I 2023-12-21 04:03:32,779] Trial 76 pruned. Trial was pruned at iteration 0.
[I 2023-12-21 04:03:32,838] Trial 77 pruned. Trial was pruned at iteration 0.
[I 2023-12-21 04:03:32,894] Trial 78 pruned. Trial was pruned at iteration 0.
[I 2023-12-21 04:03:32,945] Trial 79 pruned. Trial was pruned at iteration 0.
[I 2023-12-21 04:03:32,997] Trial 80 pruned. Trial was pruned at iteration 0.
[I 2023-12-21 04:03:33,213] Trial 81 finished with value: inf and parameters: {'learning_rate': 0.4312611322585555, 'aft_loss_distribution': 'logistic', 'aft_loss_distribution_scale': 1.4446835863141247, 'max_depth': 10, 'booster': 'gbtree', 'scale_pos_weight': 0.24211531610092282, 'alpha': 1.0679729932611428, 'lambda': 4.308645224306245, 'eta': 0.028927732614238408, 'sampling_method': 'gradient_based', 'subsample': 0.6255303143021846, 'gamma': 8.501123804658132}. Best is trial 33 with value: 1.9262084836928193.
[I 2023-12-21 04:03:33,274] Trial 82 pruned. Trial was pruned at iteration 0.
[I 2023-12-21 04:03:33,335] Trial 83 pruned. Trial was pruned at iteration 0.
[I 2023-12-21 04:03:33,408] Trial 84 pruned. Trial was pruned at iteration 0.
[I 2023-12-21 04:03:33,461] Trial 85 pruned. Trial was pruned at iteration 0.
[I 2023-12-21 04:03:33,817] Trial 86 finished with value: 2.0176394373695965 and parameters: {'learning_rate': 0.6016003184324336, 'aft_loss_distribution': 'logistic', 'aft_loss_distribution_scale': 1.5799388656628017, 'max_depth': 10, 'booster': 'gbtree', 'scale_pos_weight': 0.7795155591828764, 'alpha': 1.26949546866096, 'lambda': 2.4915001828957655, 'eta': 0.8982490295497937, 'sampling_method': 'uniform', 'subsample': 0.8330170803720536, 'gamma': 3.492259809889194}. Best is trial 33 with value: 1.9262084836928193.
[I 2023-12-21 04:03:33,879] Trial 87 pruned. Trial was pruned at iteration 0.
[I 2023-12-21 04:03:33,933] Trial 88 pruned. Trial was pruned at iteration 0.
[I 2023-12-21 04:03:34,000] Trial 89 pruned. Trial was pruned at iteration 0.
[I 2023-12-21 04:03:34,056] Trial 90 pruned. Trial was pruned at iteration 0.
[I 2023-12-21 04:03:34,642] Trial 91 finished with value: 2.0001114168186405 and parameters: {'learning_rate': 0.4512958819533778, 'aft_loss_distribution': 'logistic', 'aft_loss_distribution_scale': 1.4371207056933866, 'max_depth': 10, 'booster': 'gbtree', 'scale_pos_weight': 0.23805546376828177, 'alpha': 0.41873850157217923, 'lambda': 3.6067700248160737, 'eta': 0.007394582662868854, 'sampling_method': 'gradient_based', 'subsample': 0.5761819507859169, 'gamma': 7.925298716629835}. Best is trial 33 with value: 1.9262084836928193.
[I 2023-12-21 04:03:34,937] Trial 92 finished with value: 1.9881965694493244 and parameters: {'learning_rate': 0.4405500246771781, 'aft_loss_distribution': 'logistic', 'aft_loss_distribution_scale': 1.3888575744584086, 'max_depth': 10, 'booster': 'gbtree', 'scale_pos_weight': 0.1234330972535527, 'alpha': 0.8126210529273545, 'lambda': 3.683147971666805, 'eta': 0.04934803118732493, 'sampling_method': 'gradient_based', 'subsample': 0.5384790378798258, 'gamma': 7.468006374637361}. Best is trial 33 with value: 1.9262084836928193.
[I 2023-12-21 04:03:34,994] Trial 93 pruned. Trial was pruned at iteration 0.
[I 2023-12-21 04:03:35,049] Trial 94 pruned. Trial was pruned at iteration 0.
[I 2023-12-21 04:03:35,108] Trial 95 pruned. Trial was pruned at iteration 0.
[I 2023-12-21 04:03:35,169] Trial 96 pruned. Trial was pruned at iteration 1.
[I 2023-12-21 04:03:35,489] Trial 97 finished with value: 1.9885391054185901 and parameters: {'learning_rate': 0.38113668255803673, 'aft_loss_distribution': 'logistic', 'aft_loss_distribution_scale': 1.372698151206801, 'max_depth': 8, 'booster': 'gbtree', 'scale_pos_weight': 0.7279975806552285, 'alpha': 5.698732702250662, 'lambda': 3.6284287622633453, 'eta': 0.2505421071323969, 'sampling_method': 'gradient_based', 'subsample': 0.5911224877373965, 'gamma': 5.947890705782198}. Best is trial 33 with value: 1.9262084836928193.
[I 2023-12-21 04:03:35,553] Trial 98 pruned. Trial was pruned at iteration 1.
[I 2023-12-21 04:03:35,611] Trial 99 pruned. Trial was pruned at iteration 0.
[I 2023-12-21 04:03:35,670] Trial 100 pruned. Trial was pruned at iteration 0.
[I 2023-12-21 04:03:35,723] Trial 101 pruned. Trial was pruned at iteration 0.
[I 2023-12-21 04:03:35,782] Trial 102 pruned. Trial was pruned at iteration 0.
[I 2023-12-21 04:03:35,837] Trial 103 pruned. Trial was pruned at iteration 0.
[I 2023-12-21 04:03:35,895] Trial 104 pruned. Trial was pruned at iteration 0.
[I 2023-12-21 04:03:35,952] Trial 105 pruned. Trial was pruned at iteration 0.
[I 2023-12-21 04:03:36,009] Trial 106 pruned. Trial was pruned at iteration 0.
[I 2023-12-21 04:03:36,067] Trial 107 pruned. Trial was pruned at iteration 0.
[I 2023-12-21 04:03:36,121] Trial 108 pruned. Trial was pruned at iteration 0.
[I 2023-12-21 04:03:36,722] Trial 109 finished with value: 1.9370672437526304 and parameters: {'learning_rate': 0.2897349245966019, 'aft_loss_distribution': 'logistic', 'aft_loss_distribution_scale': 1.030852230406618, 'max_depth': 10, 'booster': 'gbtree', 'scale_pos_weight': 0.4266600507549968, 'alpha': 1.452625109912804, 'lambda': 3.254108617013332, 'eta': 0.3645390584160355, 'sampling_method': 'gradient_based', 'subsample': 0.6029945520362671, 'gamma': 6.635551062739166}. Best is trial 33 with value: 1.9262084836928193.
[I 2023-12-21 04:03:46,238] Trial 110 finished with value: 1.9410477803682298 and parameters: {'learning_rate': 0.28582487749592816, 'aft_loss_distribution': 'logistic', 'aft_loss_distribution_scale': 1.0759568065442946, 'max_depth': 9, 'booster': 'dart', 'scale_pos_weight': 0.4493936674328815, 'alpha': 3.805900582893883, 'lambda': 2.9081771755879346, 'eta': 0.3698866720609527, 'sampling_method': 'gradient_based', 'subsample': 0.5849705448572373, 'gamma': 6.523033944133804}. Best is trial 33 with value: 1.9262084836928193.
[I 2023-12-21 04:04:09,749] Trial 111 finished with value: 1.93961081301126 and parameters: {'learning_rate': 0.27182410100899956, 'aft_loss_distribution': 'logistic', 'aft_loss_distribution_scale': 1.0623180298722434, 'max_depth': 9, 'booster': 'dart', 'scale_pos_weight': 0.6667084541738517, 'alpha': 3.515416696992632, 'lambda': 2.7374776511900762, 'eta': 0.37569359014558457, 'sampling_method': 'gradient_based', 'subsample': 0.6659748327791835, 'gamma': 6.709424907138977}. Best is trial 33 with value: 1.9262084836928193.
[I 2023-12-21 04:04:34,358] Trial 112 finished with value: 1.9395452271938258 and parameters: {'learning_rate': 0.2518262129881307, 'aft_loss_distribution': 'logistic', 'aft_loss_distribution_scale': 1.0787140072960841, 'max_depth': 8, 'booster': 'dart', 'scale_pos_weight': 0.7103302188798237, 'alpha': 3.681483798848539, 'lambda': 2.535860691472475, 'eta': 0.3665066194679709, 'sampling_method': 'gradient_based', 'subsample': 0.576823193908528, 'gamma': 6.543184387390956}. Best is trial 33 with value: 1.9262084836928193.
[I 2023-12-21 04:04:34,423] Trial 113 pruned. Trial was pruned at iteration 0.
[I 2023-12-21 04:04:38,866] Trial 114 finished with value: 1.9377261891662056 and parameters: {'learning_rate': 0.2657977969470498, 'aft_loss_distribution': 'logistic', 'aft_loss_distribution_scale': 1.0500804109915478, 'max_depth': 7, 'booster': 'dart', 'scale_pos_weight': 0.8708589363725838, 'alpha': 3.3065633733877204, 'lambda': 2.6851200103181263, 'eta': 0.3927592392793435, 'sampling_method': 'gradient_based', 'subsample': 0.6009116820207148, 'gamma': 6.09872147701379}. Best is trial 33 with value: 1.9262084836928193.
[I 2023-12-21 04:04:38,974] Trial 115 pruned. Trial was pruned at iteration 0.
[I 2023-12-21 04:04:44,876] Trial 116 finished with value: 1.9367318746266864 and parameters: {'learning_rate': 0.21902992595096074, 'aft_loss_distribution': 'logistic', 'aft_loss_distribution_scale': 1.0676502485337305, 'max_depth': 8, 'booster': 'dart', 'scale_pos_weight': 0.7121708464863702, 'alpha': 3.6848523768937755, 'lambda': 1.871684224084344, 'eta': 0.38391789064417353, 'sampling_method': 'gradient_based', 'subsample': 0.6774709994630944, 'gamma': 5.576559617707046}. Best is trial 33 with value: 1.9262084836928193.
[I 2023-12-21 04:04:48,134] Trial 117 finished with value: 1.9427923385409047 and parameters: {'learning_rate': 0.2264936554302121, 'aft_loss_distribution': 'logistic', 'aft_loss_distribution_scale': 1.0738890148971878, 'max_depth': 8, 'booster': 'dart', 'scale_pos_weight': 1.2102218951873092, 'alpha': 3.0962517895643087, 'lambda': 1.7937317001817483, 'eta': 0.39078860868515686, 'sampling_method': 'gradient_based', 'subsample': 0.6044356525309706, 'gamma': 5.267640832836933}. Best is trial 33 with value: 1.9262084836928193.
[I 2023-12-21 04:04:48,205] Trial 118 pruned. Trial was pruned at iteration 0.
[I 2023-12-21 04:05:20,756] Trial 119 finished with value: 1.9549598771907069 and parameters: {'learning_rate': 0.22782378653759944, 'aft_loss_distribution': 'logistic', 'aft_loss_distribution_scale': 1.0577777320037554, 'max_depth': 8, 'booster': 'dart', 'scale_pos_weight': 1.056814166205246, 'alpha': 2.659136101984623, 'lambda': 0.7106842186444622, 'eta': 0.4997025197381273, 'sampling_method': 'gradient_based', 'subsample': 0.7069945010189587, 'gamma': 5.731563520796319}. Best is trial 33 with value: 1.9262084836928193.
[I 2023-12-21 04:05:20,854] Trial 120 pruned. Trial was pruned at iteration 0.
[I 2023-12-21 04:05:41,729] Trial 121 finished with value: 1.938496128176367 and parameters: {'learning_rate': 0.22552960264708635, 'aft_loss_distribution': 'logistic', 'aft_loss_distribution_scale': 1.0759765035090687, 'max_depth': 8, 'booster': 'dart', 'scale_pos_weight': 0.9514946540988631, 'alpha': 2.8809671771719825, 'lambda': 1.837106637741333, 'eta': 0.3848158079026866, 'sampling_method': 'gradient_based', 'subsample': 0.6358664021598207, 'gamma': 5.580044201803581}. Best is trial 33 with value: 1.9262084836928193.
[I 2023-12-21 04:05:41,800] Trial 122 pruned. Trial was pruned at iteration 0.
[I 2023-12-21 04:05:41,866] Trial 123 pruned. Trial was pruned at iteration 0.
[I 2023-12-21 04:05:41,932] Trial 124 pruned. Trial was pruned at iteration 0.
[I 2023-12-21 04:05:41,995] Trial 125 pruned. Trial was pruned at iteration 0.
[I 2023-12-21 04:05:42,065] Trial 126 pruned. Trial was pruned at iteration 0.
[I 2023-12-21 04:05:42,130] Trial 127 pruned. Trial was pruned at iteration 0.
[I 2023-12-21 04:05:42,202] Trial 128 pruned. Trial was pruned at iteration 0.
[I 2023-12-21 04:05:42,260] Trial 129 pruned. Trial was pruned at iteration 0.
[I 2023-12-21 04:05:42,323] Trial 130 pruned. Trial was pruned at iteration 0.
[I 2023-12-21 04:05:42,384] Trial 131 pruned. Trial was pruned at iteration 0.
[I 2023-12-21 04:05:42,448] Trial 132 pruned. Trial was pruned at iteration 0.
[I 2023-12-21 04:05:42,517] Trial 133 pruned. Trial was pruned at iteration 0.
[I 2023-12-21 04:05:42,591] Trial 134 pruned. Trial was pruned at iteration 0.
[I 2023-12-21 04:05:42,655] Trial 135 pruned. Trial was pruned at iteration 0.
[I 2023-12-21 04:05:42,717] Trial 136 pruned. Trial was pruned at iteration 0.
[I 2023-12-21 04:05:42,779] Trial 137 pruned. Trial was pruned at iteration 0.
[I 2023-12-21 04:05:42,840] Trial 138 pruned. Trial was pruned at iteration 0.
[I 2023-12-21 04:05:42,906] Trial 139 pruned. Trial was pruned at iteration 0.
[I 2023-12-21 04:06:06,696] Trial 140 finished with value: 1.9391347920592306 and parameters: {'learning_rate': 0.25557718324256307, 'aft_loss_distribution': 'logistic', 'aft_loss_distribution_scale': 1.0729051471522633, 'max_depth': 8, 'booster': 'dart', 'scale_pos_weight': 1.4619155232720094, 'alpha': 4.900830190499881, 'lambda': 2.349869945926999, 'eta': 0.2995769065679351, 'sampling_method': 'gradient_based', 'subsample': 0.5696707748296778, 'gamma': 6.521283711818843}. Best is trial 33 with value: 1.9262084836928193.
[I 2023-12-21 04:06:22,870] Trial 141 finished with value: 1.9373286329662363 and parameters: {'learning_rate': 0.2455947782788619, 'aft_loss_distribution': 'logistic', 'aft_loss_distribution_scale': 1.0448804149775373, 'max_depth': 8, 'booster': 'dart', 'scale_pos_weight': 1.4367628004714692, 'alpha': 4.947251709865404, 'lambda': 2.3891790613629875, 'eta': 0.3098054394493729, 'sampling_method': 'gradient_based', 'subsample': 0.564965700336186, 'gamma': 6.586330958749855}. Best is trial 33 with value: 1.9262084836928193.
[I 2023-12-21 04:06:55,542] Trial 142 finished with value: 1.9392335118107713 and parameters: {'learning_rate': 0.255955920633016, 'aft_loss_distribution': 'logistic', 'aft_loss_distribution_scale': 1.0653127951940338, 'max_depth': 8, 'booster': 'dart', 'scale_pos_weight': 1.4571359605474032, 'alpha': 4.969898745995021, 'lambda': 2.439804143688549, 'eta': 0.29287872152355854, 'sampling_method': 'gradient_based', 'subsample': 0.567598048604995, 'gamma': 6.593980562420263}. Best is trial 33 with value: 1.9262084836928193.
[I 2023-12-21 04:07:05,322] Trial 143 finished with value: 1.9392360848877301 and parameters: {'learning_rate': 0.24989149000200456, 'aft_loss_distribution': 'logistic', 'aft_loss_distribution_scale': 1.0748414422016241, 'max_depth': 8, 'booster': 'dart', 'scale_pos_weight': 1.499572316410573, 'alpha': 4.959953001602501, 'lambda': 2.2783923783236966, 'eta': 0.301962626407829, 'sampling_method': 'gradient_based', 'subsample': 0.572921926666237, 'gamma': 6.660653755043767}. Best is trial 33 with value: 1.9262084836928193.
[I 2023-12-21 04:07:05,398] Trial 144 pruned. Trial was pruned at iteration 0.
[I 2023-12-21 04:07:05,459] Trial 145 pruned. Trial was pruned at iteration 0.
[I 2023-12-21 04:07:05,525] Trial 146 pruned. Trial was pruned at iteration 0.
[I 2023-12-21 04:07:05,592] Trial 147 pruned. Trial was pruned at iteration 0.
[I 2023-12-21 04:07:05,671] Trial 148 pruned. Trial was pruned at iteration 0.
[I 2023-12-21 04:07:05,771] Trial 149 pruned. Trial was pruned at iteration 0.
[I 2023-12-21 04:07:05,872] Trial 150 pruned. Trial was pruned at iteration 0.
[I 2023-12-21 04:07:21,089] Trial 151 finished with value: 1.9405528765815165 and parameters: {'learning_rate': 0.2271089917994175, 'aft_loss_distribution': 'logistic', 'aft_loss_distribution_scale': 1.0621950493287406, 'max_depth': 8, 'booster': 'dart', 'scale_pos_weight': 1.2530471134769823, 'alpha': 5.332272915624631, 'lambda': 2.278820315476694, 'eta': 0.3359909559658357, 'sampling_method': 'gradient_based', 'subsample': 0.5700968824907428, 'gamma': 6.927038811751151}. Best is trial 33 with value: 1.9262084836928193.
[I 2023-12-21 04:07:21,160] Trial 152 pruned. Trial was pruned at iteration 0.
[I 2023-12-21 04:07:21,225] Trial 153 pruned. Trial was pruned at iteration 0.
[I 2023-12-21 04:07:21,291] Trial 154 pruned. Trial was pruned at iteration 0.
[I 2023-12-21 04:07:21,360] Trial 155 pruned. Trial was pruned at iteration 0.
[I 2023-12-21 04:07:21,421] Trial 156 pruned. Trial was pruned at iteration 0.
[I 2023-12-21 04:07:21,486] Trial 157 pruned. Trial was pruned at iteration 0.
[I 2023-12-21 04:07:21,548] Trial 158 pruned. Trial was pruned at iteration 0.
[I 2023-12-21 04:07:21,615] Trial 159 pruned. Trial was pruned at iteration 0.
[I 2023-12-21 04:07:21,679] Trial 160 pruned. Trial was pruned at iteration 0.
[I 2023-12-21 04:07:45,170] Trial 161 finished with value: 1.937978107578188 and parameters: {'learning_rate': 0.22532649719859318, 'aft_loss_distribution': 'logistic', 'aft_loss_distribution_scale': 1.0677748234036673, 'max_depth': 8, 'booster': 'dart', 'scale_pos_weight': 1.0754690895981467, 'alpha': 3.317239411623888, 'lambda': 2.706070242605634, 'eta': 0.37482452458614607, 'sampling_method': 'gradient_based', 'subsample': 0.6444013658643517, 'gamma': 5.615376039751106}. Best is trial 33 with value: 1.9262084836928193.
[I 2023-12-21 04:07:45,288] Trial 162 pruned. Trial was pruned at iteration 0.
[I 2023-12-21 04:07:45,392] Trial 163 pruned. Trial was pruned at iteration 0.
[I 2023-12-21 04:07:45,498] Trial 164 pruned. Trial was pruned at iteration 0.
[I 2023-12-21 04:07:45,598] Trial 165 pruned. Trial was pruned at iteration 0.
[I 2023-12-21 04:07:45,698] Trial 166 pruned. Trial was pruned at iteration 0.
[I 2023-12-21 04:07:45,799] Trial 167 pruned. Trial was pruned at iteration 0.
[I 2023-12-21 04:07:45,901] Trial 168 pruned. Trial was pruned at iteration 0.
[I 2023-12-21 04:07:45,998] Trial 169 pruned. Trial was pruned at iteration 0.
[I 2023-12-21 04:07:46,096] Trial 170 pruned. Trial was pruned at iteration 0.
[I 2023-12-21 04:07:50,530] Trial 171 finished with value: 1.937851796352139 and parameters: {'learning_rate': 0.23563479829068656, 'aft_loss_distribution': 'logistic', 'aft_loss_distribution_scale': 1.0460660491399265, 'max_depth': 8, 'booster': 'dart', 'scale_pos_weight': 0.9881432187352407, 'alpha': 2.6302440208558755, 'lambda': 1.2513912906230305, 'eta': 0.386964681775867, 'sampling_method': 'gradient_based', 'subsample': 0.6886545204023231, 'gamma': 3.7463024611832156}. Best is trial 33 with value: 1.9262084836928193.
[I 2023-12-21 04:07:50,602] Trial 172 pruned. Trial was pruned at iteration 0.
[I 2023-12-21 04:07:50,670] Trial 173 pruned. Trial was pruned at iteration 0.
[I 2023-12-21 04:07:50,736] Trial 174 pruned. Trial was pruned at iteration 0.
[I 2023-12-21 04:07:52,871] Trial 175 finished with value: inf and parameters: {'learning_rate': 0.23060033124970752, 'aft_loss_distribution': 'logistic', 'aft_loss_distribution_scale': 0.9382540511142629, 'max_depth': 8, 'booster': 'dart', 'scale_pos_weight': 3.3860196439998758, 'alpha': 2.9556171955831068, 'lambda': 8.576058832839228, 'eta': 0.3590711160267942, 'sampling_method': 'gradient_based', 'subsample': 0.20992376688977576, 'gamma': 3.2858980228939663}. Best is trial 33 with value: 1.9262084836928193.
[I 2023-12-21 04:07:52,941] Trial 176 pruned. Trial was pruned at iteration 0.
[I 2023-12-21 04:07:53,017] Trial 177 pruned. Trial was pruned at iteration 0.
[I 2023-12-21 04:07:53,082] Trial 178 pruned. Trial was pruned at iteration 0.
[I 2023-12-21 04:07:53,144] Trial 179 pruned. Trial was pruned at iteration 0.
[I 2023-12-21 04:07:53,221] Trial 180 pruned. Trial was pruned at iteration 0.
[I 2023-12-21 04:08:00,971] Trial 181 pruned. Trial was pruned at iteration 128.
[I 2023-12-21 04:08:01,084] Trial 182 pruned. Trial was pruned at iteration 0.
[I 2023-12-21 04:08:01,182] Trial 183 pruned. Trial was pruned at iteration 0.
[I 2023-12-21 04:08:01,288] Trial 184 pruned. Trial was pruned at iteration 0.
[I 2023-12-21 04:08:01,386] Trial 185 pruned. Trial was pruned at iteration 0.
[I 2023-12-21 04:08:15,397] Trial 186 pruned. Trial was pruned at iteration 175.
[I 2023-12-21 04:08:15,501] Trial 187 pruned. Trial was pruned at iteration 0.
[I 2023-12-21 04:08:15,615] Trial 188 pruned. Trial was pruned at iteration 0.
[I 2023-12-21 04:08:15,713] Trial 189 pruned. Trial was pruned at iteration 0.
[I 2023-12-21 04:08:15,813] Trial 190 pruned. Trial was pruned at iteration 0.
[I 2023-12-21 04:08:15,910] Trial 191 pruned. Trial was pruned at iteration 0.
[I 2023-12-21 04:08:16,009] Trial 192 pruned. Trial was pruned at iteration 0.
[I 2023-12-21 04:08:57,659] Trial 193 finished with value: 1.923643950131964 and parameters: {'learning_rate': 0.2060887737507783, 'aft_loss_distribution': 'logistic', 'aft_loss_distribution_scale': 0.9199102309669367, 'max_depth': 8, 'booster': 'dart', 'scale_pos_weight': 1.7338524815812195, 'alpha': 4.546258070984767, 'lambda': 2.5384164437922, 'eta': 0.34265894322927876, 'sampling_method': 'gradient_based', 'subsample': 0.537478218466766, 'gamma': 6.187915068749944}. Best is trial 193 with value: 1.923643950131964.
