[I 2023-12-19 05:27:20,299] Trial 168 finished with value: inf and parameters: {'learning_rate': 0.9847070104710381, 'aft_loss_distribution': 'normal', 'aft_loss_distribution_scale': 1.2158071355285225, 'max_depth': 9, 'booster': 'gbtree', 'scale_pos_weight': 1.2703640199884594, 'alpha': 7.508279260165039, 'lambda': 0.4597989274478116, 'eta': 0.04955101082613528, 'sampling_method': 'uniform', 'subsample': 0.6969542542210714, 'gamma': 8.559738605043519}. Best is trial 141 with value: 4.2441363715771745.
[I 2023-12-19 05:27:20,385] Trial 169 pruned. Trial was pruned at iteration 0.
[I 2023-12-19 05:27:20,695] Trial 170 finished with value: inf and parameters: {'learning_rate': 0.9689791142097697, 'aft_loss_distribution': 'normal', 'aft_loss_distribution_scale': 0.9650135465552859, 'max_depth': 8, 'booster': 'gbtree', 'scale_pos_weight': 0.7629606148989019, 'alpha': 6.565634698482023, 'lambda': 0.49782145505430264, 'eta': 0.06799944173012876, 'sampling_method': 'uniform', 'subsample': 0.818267579206175, 'gamma': 8.153098121102886}. Best is trial 141 with value: 4.2441363715771745.
[I 2023-12-19 05:27:21,125] Trial 171 finished with value: 4.25058750244425 and parameters: {'learning_rate': 0.9352299631392523, 'aft_loss_distribution': 'normal', 'aft_loss_distribution_scale': 1.1501022814045985, 'max_depth': 9, 'booster': 'gbtree', 'scale_pos_weight': 0.9851805518578748, 'alpha': 7.737739380587834, 'lambda': 0.23566154731879313, 'eta': 0.10930615233570495, 'sampling_method': 'uniform', 'subsample': 0.7939236100395602, 'gamma': 9.209340969680493}. Best is trial 141 with value: 4.2441363715771745.
[I 2023-12-19 05:27:21,787] Trial 172 finished with value: 4.248094291488791 and parameters: {'learning_rate': 0.9132398508267929, 'aft_loss_distribution': 'normal', 'aft_loss_distribution_scale': 1.117360790913526, 'max_depth': 9, 'booster': 'gbtree', 'scale_pos_weight': 1.0185232932591983, 'alpha': 7.7221313740699395, 'lambda': 0.2830030639666978, 'eta': 0.023972977398569482, 'sampling_method': 'uniform', 'subsample': 0.8071954953888316, 'gamma': 9.36591205262504}. Best is trial 141 with value: 4.2441363715771745.
[I 2023-12-19 05:27:22,098] Trial 173 finished with value: inf and parameters: {'learning_rate': 0.9141721609084799, 'aft_loss_distribution': 'normal', 'aft_loss_distribution_scale': 0.9883651812430962, 'max_depth': 9, 'booster': 'gbtree', 'scale_pos_weight': 1.0379997153712965, 'alpha': 7.651605471324278, 'lambda': 0.22213257803843783, 'eta': 0.10965080552548215, 'sampling_method': 'uniform', 'subsample': 0.804894328098983, 'gamma': 9.505666451088093}. Best is trial 141 with value: 4.2441363715771745.
[I 2023-12-19 05:27:22,986] Trial 174 finished with value: 4.252543609160013 and parameters: {'learning_rate': 0.9435374011911242, 'aft_loss_distribution': 'normal', 'aft_loss_distribution_scale': 1.1620771261772513, 'max_depth': 9, 'booster': 'gbtree', 'scale_pos_weight': 1.7900127914897859, 'alpha': 7.453853095098588, 'lambda': 0.76903313605642, 'eta': 0.02562797626008424, 'sampling_method': 'uniform', 'subsample': 0.7359225357889746, 'gamma': 9.324006265380733}. Best is trial 141 with value: 4.2441363715771745.
[I 2023-12-19 05:27:23,119] Trial 175 pruned. Trial was pruned at iteration 0.
[I 2023-12-19 05:27:24,554] Trial 176 finished with value: inf and parameters: {'learning_rate': 0.9434039501588685, 'aft_loss_distribution': 'normal', 'aft_loss_distribution_scale': 1.1935304469332217, 'max_depth': 9, 'booster': 'gbtree', 'scale_pos_weight': 1.73802023045857, 'alpha': 7.074720370166533, 'lambda': 0.7573940890790096, 'eta': 0.03687940488611628, 'sampling_method': 'uniform', 'subsample': 0.6578361753685438, 'gamma': 9.964608066491595}. Best is trial 141 with value: 4.2441363715771745.
[I 2023-12-19 05:27:24,686] Trial 177 pruned. Trial was pruned at iteration 0.
[I 2023-12-19 05:27:26,170] Trial 178 finished with value: 4.248513128911759 and parameters: {'learning_rate': 0.9559483518136443, 'aft_loss_distribution': 'normal', 'aft_loss_distribution_scale': 1.0806840562734983, 'max_depth': 9, 'booster': 'gbtree', 'scale_pos_weight': 0.41104331467579514, 'alpha': 6.836956157976944, 'lambda': 0.7907549004516523, 'eta': 0.0471370190478155, 'sampling_method': 'uniform', 'subsample': 0.8379824330901284, 'gamma': 9.286206998528518}. Best is trial 141 with value: 4.2441363715771745.
[I 2023-12-19 05:27:26,300] Trial 179 pruned. Trial was pruned at iteration 0.
[I 2023-12-19 05:27:26,435] Trial 180 pruned. Trial was pruned at iteration 0.
[I 2023-12-19 05:27:27,338] Trial 181 finished with value: 4.244175479363268 and parameters: {'learning_rate': 0.9069101861191144, 'aft_loss_distribution': 'normal', 'aft_loss_distribution_scale': 1.0459949392604182, 'max_depth': 9, 'booster': 'gbtree', 'scale_pos_weight': 0.6623254252153262, 'alpha': 7.817781247079509, 'lambda': 0.5095224283736268, 'eta': 0.04483337654128381, 'sampling_method': 'uniform', 'subsample': 0.8147041358326584, 'gamma': 8.964191905335271}. Best is trial 141 with value: 4.2441363715771745.
[I 2023-12-19 05:27:28,260] Trial 182 finished with value: 4.242644487966042 and parameters: {'learning_rate': 0.9090229432274859, 'aft_loss_distribution': 'normal', 'aft_loss_distribution_scale': 1.0441182356251217, 'max_depth': 9, 'booster': 'gbtree', 'scale_pos_weight': 0.6194665890609953, 'alpha': 7.7924121239504265, 'lambda': 0.5208676433875558, 'eta': 0.9241796337707087, 'sampling_method': 'uniform', 'subsample': 0.8123701758476025, 'gamma': 8.986214107988387}. Best is trial 182 with value: 4.242644487966042.
[I 2023-12-19 05:27:28,560] Trial 183 finished with value: inf and parameters: {'learning_rate': 0.9047227081302076, 'aft_loss_distribution': 'normal', 'aft_loss_distribution_scale': 0.9141681025634477, 'max_depth': 9, 'booster': 'gbtree', 'scale_pos_weight': 2.358644477413523, 'alpha': 7.187101175932351, 'lambda': 0.5555279544289006, 'eta': 0.9057313604297764, 'sampling_method': 'uniform', 'subsample': 0.7949988264053419, 'gamma': 8.943707180158228}. Best is trial 182 with value: 4.242644487966042.
[I 2023-12-19 05:27:29,153] Trial 184 finished with value: 4.240979247107404 and parameters: {'learning_rate': 0.8745308591560346, 'aft_loss_distribution': 'normal', 'aft_loss_distribution_scale': 1.0570294611325441, 'max_depth': 9, 'booster': 'gbtree', 'scale_pos_weight': 0.6473969326335403, 'alpha': 7.408197314354675, 'lambda': 0.744248405126906, 'eta': 0.08447476181249998, 'sampling_method': 'uniform', 'subsample': 0.8127266416134724, 'gamma': 9.139870283004099}. Best is trial 184 with value: 4.240979247107404.
[I 2023-12-19 05:27:29,243] Trial 185 pruned. Trial was pruned at iteration 0.
[I 2023-12-19 05:27:29,610] Trial 186 finished with value: 4.24676242224352 and parameters: {'learning_rate': 0.9158124249738989, 'aft_loss_distribution': 'normal', 'aft_loss_distribution_scale': 0.9938905214113984, 'max_depth': 9, 'booster': 'gbtree', 'scale_pos_weight': 0.9183941871900103, 'alpha': 7.384790273774744, 'lambda': 0.839639218913888, 'eta': 0.08878425599877857, 'sampling_method': 'uniform', 'subsample': 0.8120378390376674, 'gamma': 9.338809828076908}. Best is trial 184 with value: 4.240979247107404.
[I 2023-12-19 05:27:30,216] Trial 187 finished with value: 4.241855689821816 and parameters: {'learning_rate': 0.915823987738432, 'aft_loss_distribution': 'normal', 'aft_loss_distribution_scale': 1.031970914773277, 'max_depth': 9, 'booster': 'gbtree', 'scale_pos_weight': 0.9414771134408847, 'alpha': 7.420203591197567, 'lambda': 0.9050545579488457, 'eta': 0.09839008705380545, 'sampling_method': 'uniform', 'subsample': 0.8254329091404418, 'gamma': 9.484508741115917}. Best is trial 184 with value: 4.240979247107404.
[I 2023-12-19 05:27:30,308] Trial 188 pruned. Trial was pruned at iteration 0.
[I 2023-12-19 05:27:30,610] Trial 189 finished with value: inf and parameters: {'learning_rate': 0.8899064004534457, 'aft_loss_distribution': 'normal', 'aft_loss_distribution_scale': 0.991974551180793, 'max_depth': 9, 'booster': 'gbtree', 'scale_pos_weight': 0.7063940401012261, 'alpha': 7.334717105018866, 'lambda': 0.7706791695389509, 'eta': 0.0003877026600078541, 'sampling_method': 'uniform', 'subsample': 0.8240147655348005, 'gamma': 9.094916430433013}. Best is trial 184 with value: 4.240979247107404.
[I 2023-12-19 05:27:30,696] Trial 190 pruned. Trial was pruned at iteration 0.
[I 2023-12-19 05:27:31,707] Trial 191 finished with value: 4.242646190446567 and parameters: {'learning_rate': 0.9027442419814984, 'aft_loss_distribution': 'normal', 'aft_loss_distribution_scale': 1.0300581230270267, 'max_depth': 9, 'booster': 'gbtree', 'scale_pos_weight': 0.31695624626762553, 'alpha': 7.025344343807685, 'lambda': 0.6828226859098606, 'eta': 0.08923055705212687, 'sampling_method': 'uniform', 'subsample': 0.8442632622040448, 'gamma': 9.640271891288254}. Best is trial 184 with value: 4.240979247107404.
[I 2023-12-19 05:27:32,141] Trial 192 finished with value: 4.240362229487405 and parameters: {'learning_rate': 0.8600089719760977, 'aft_loss_distribution': 'normal', 'aft_loss_distribution_scale': 1.06011937009507, 'max_depth': 9, 'booster': 'gbtree', 'scale_pos_weight': 0.39730185615152136, 'alpha': 7.0659653339319055, 'lambda': 0.7749267352422188, 'eta': 0.08314134303483714, 'sampling_method': 'uniform', 'subsample': 0.8065228002725969, 'gamma': 9.641822533162395}. Best is trial 192 with value: 4.240362229487405.
[I 2023-12-19 05:27:32,841] Trial 193 finished with value: 4.241799365040585 and parameters: {'learning_rate': 0.8630859188481326, 'aft_loss_distribution': 'normal', 'aft_loss_distribution_scale': 1.1005756495914096, 'max_depth': 9, 'booster': 'gbtree', 'scale_pos_weight': 0.13880670855757477, 'alpha': 7.075248838920636, 'lambda': 0.9620365204104795, 'eta': 0.08397433289106256, 'sampling_method': 'uniform', 'subsample': 0.8412999563296347, 'gamma': 9.698398560428515}. Best is trial 192 with value: 4.240362229487405.
[I 2023-12-19 05:27:33,178] Trial 194 finished with value: inf and parameters: {'learning_rate': 0.8657141183529249, 'aft_loss_distribution': 'normal', 'aft_loss_distribution_scale': 1.0203756126742791, 'max_depth': 9, 'booster': 'gbtree', 'scale_pos_weight': 0.3360282925744082, 'alpha': 7.115149582951028, 'lambda': 0.9429550307092727, 'eta': 0.08775865615975727, 'sampling_method': 'uniform', 'subsample': 0.8028706753300221, 'gamma': 9.636215996879912}. Best is trial 192 with value: 4.240362229487405.
[I 2023-12-19 05:27:33,617] Trial 195 finished with value: 4.251029591351718 and parameters: {'learning_rate': 0.8979976904232639, 'aft_loss_distribution': 'normal', 'aft_loss_distribution_scale': 1.1569040219971503, 'max_depth': 9, 'booster': 'gbtree', 'scale_pos_weight': 0.1366983497651359, 'alpha': 6.929099365507959, 'lambda': 7.856547853663883, 'eta': 0.040745751990493184, 'sampling_method': 'uniform', 'subsample': 0.8362387446154879, 'gamma': 9.317018618909996}. Best is trial 192 with value: 4.240362229487405.
[I 2023-12-19 05:27:34,230] Trial 196 finished with value: 4.241340077566835 and parameters: {'learning_rate': 0.8950302621293081, 'aft_loss_distribution': 'normal', 'aft_loss_distribution_scale': 1.0738040538513078, 'max_depth': 9, 'booster': 'gbtree', 'scale_pos_weight': 0.11688968231912891, 'alpha': 6.985976301048872, 'lambda': 1.1252121719757897, 'eta': 0.03386618440346224, 'sampling_method': 'uniform', 'subsample': 0.8379693057670211, 'gamma': 9.29214772048075}. Best is trial 192 with value: 4.240362229487405.
[I 2023-12-19 05:27:34,323] Trial 197 pruned. Trial was pruned at iteration 0.
[I 2023-12-19 05:27:34,417] Trial 198 pruned. Trial was pruned at iteration 1.
[I 2023-12-19 05:27:35,261] Trial 199 finished with value: 4.244438925790958 and parameters: {'learning_rate': 0.9021211288817756, 'aft_loss_distribution': 'normal', 'aft_loss_distribution_scale': 1.0683366782235744, 'max_depth': 9, 'booster': 'gbtree', 'scale_pos_weight': 0.11828705570764544, 'alpha': 7.128020912048958, 'lambda': 9.436522851936736, 'eta': 0.042261017561430365, 'sampling_method': 'uniform', 'subsample': 0.8153501478942068, 'gamma': 9.378262647446823}. Best is trial 192 with value: 4.240362229487405.
[I 2023-12-19 05:27:35,359] Trial 200 pruned. Trial was pruned at iteration 1.
[I 2023-12-19 05:27:36,089] Trial 201 finished with value: 4.239524750030925 and parameters: {'learning_rate': 0.8975812428666635, 'aft_loss_distribution': 'normal', 'aft_loss_distribution_scale': 1.0365069874378474, 'max_depth': 9, 'booster': 'gbtree', 'scale_pos_weight': 0.5698846052170587, 'alpha': 6.887340250446506, 'lambda': 8.994267379994845, 'eta': 0.03906781249372871, 'sampling_method': 'uniform', 'subsample': 0.8084713208132901, 'gamma': 9.31863969089624}. Best is trial 201 with value: 4.239524750030925.
[I 2023-12-19 05:27:36,871] Trial 202 finished with value: 4.241552854006608 and parameters: {'learning_rate': 0.8787001296306138, 'aft_loss_distribution': 'normal', 'aft_loss_distribution_scale': 1.031536073078689, 'max_depth': 9, 'booster': 'gbtree', 'scale_pos_weight': 0.5470095087004087, 'alpha': 7.45173486045549, 'lambda': 9.113545385432934, 'eta': 0.001254990362923633, 'sampling_method': 'uniform', 'subsample': 0.8113032385427298, 'gamma': 9.366439025450031}. Best is trial 201 with value: 4.239524750030925.
[I 2023-12-19 05:27:39,383] Trial 203 finished with value: 4.239418470092741 and parameters: {'learning_rate': 0.879022889244938, 'aft_loss_distribution': 'normal', 'aft_loss_distribution_scale': 1.0424440141914113, 'max_depth': 9, 'booster': 'gbtree', 'scale_pos_weight': 0.3887150868236408, 'alpha': 7.400317471232932, 'lambda': 9.405307351386998, 'eta': 0.0335123707982024, 'sampling_method': 'uniform', 'subsample': 0.8606540402214417, 'gamma': 9.391500340471996}. Best is trial 203 with value: 4.239418470092741.
[I 2023-12-19 05:27:39,526] Trial 204 pruned. Trial was pruned at iteration 0.
[I 2023-12-19 05:27:39,783] Trial 205 pruned. Trial was pruned at iteration 0.
[I 2023-12-19 05:27:40,591] Trial 206 finished with value: inf and parameters: {'learning_rate': 0.8967986209897862, 'aft_loss_distribution': 'normal', 'aft_loss_distribution_scale': 1.0742821043002457, 'max_depth': 9, 'booster': 'gbtree', 'scale_pos_weight': 0.40019751783035135, 'alpha': 7.152788287703095, 'lambda': 8.881855673984065, 'eta': 0.07339586059838732, 'sampling_method': 'uniform', 'subsample': 0.8534389219013024, 'gamma': 9.230091000876266}. Best is trial 203 with value: 4.239418470092741.
[I 2023-12-19 05:27:40,719] Trial 207 pruned. Trial was pruned at iteration 0.
[I 2023-12-19 05:27:40,821] Trial 208 pruned. Trial was pruned at iteration 1.
[I 2023-12-19 05:27:40,914] Trial 209 pruned. Trial was pruned at iteration 0.
[I 2023-12-19 05:27:41,010] Trial 210 pruned. Trial was pruned at iteration 1.
[I 2023-12-19 05:27:41,392] Trial 211 finished with value: inf and parameters: {'learning_rate': 0.9248781693402314, 'aft_loss_distribution': 'normal', 'aft_loss_distribution_scale': 1.1127656598481726, 'max_depth': 9, 'booster': 'gbtree', 'scale_pos_weight': 0.46465621450242856, 'alpha': 6.864454865426932, 'lambda': 9.040652009050387, 'eta': 0.002847712626772415, 'sampling_method': 'uniform', 'subsample': 0.8283267673710447, 'gamma': 9.336854737964172}. Best is trial 203 with value: 4.239418470092741.
[I 2023-12-19 05:27:42,013] Trial 212 finished with value: inf and parameters: {'learning_rate': 0.8909893470068457, 'aft_loss_distribution': 'normal', 'aft_loss_distribution_scale': 1.034376581853396, 'max_depth': 9, 'booster': 'gbtree', 'scale_pos_weight': 0.18832749539247834, 'alpha': 7.492433420762179, 'lambda': 8.2550981425514, 'eta': 0.001361438614965519, 'sampling_method': 'uniform', 'subsample': 0.8510759712124119, 'gamma': 0.6753748627667004}. Best is trial 203 with value: 4.239418470092741.
[I 2023-12-19 05:27:42,112] Trial 213 pruned. Trial was pruned at iteration 1.
[I 2023-12-19 05:27:42,214] Trial 214 pruned. Trial was pruned at iteration 1.
[I 2023-12-19 05:27:42,950] Trial 215 finished with value: 4.242346862123688 and parameters: {'learning_rate': 0.8647446411279616, 'aft_loss_distribution': 'normal', 'aft_loss_distribution_scale': 1.0779618795151755, 'max_depth': 9, 'booster': 'gbtree', 'scale_pos_weight': 1.1457058388168475, 'alpha': 7.229082327920756, 'lambda': 8.681540192457458, 'eta': 0.06760965872164632, 'sampling_method': 'uniform', 'subsample': 0.8926125881950744, 'gamma': 9.30893234846575}. Best is trial 203 with value: 4.239418470092741.
[I 2023-12-19 05:27:43,036] Trial 216 pruned. Trial was pruned at iteration 0.
[I 2023-12-19 05:27:43,128] Trial 217 pruned. Trial was pruned at iteration 1.
[I 2023-12-19 05:27:43,221] Trial 218 pruned. Trial was pruned at iteration 0.
[I 2023-12-19 05:27:43,308] Trial 219 pruned. Trial was pruned at iteration 0.
[I 2023-12-19 05:27:43,393] Trial 220 pruned. Trial was pruned at iteration 0.
[I 2023-12-19 05:27:44,071] Trial 221 finished with value: 4.24701625515181 and parameters: {'learning_rate': 0.9282566265877488, 'aft_loss_distribution': 'normal', 'aft_loss_distribution_scale': 1.1468016465566582, 'max_depth': 9, 'booster': 'gbtree', 'scale_pos_weight': 0.6443249691627224, 'alpha': 7.797067500017903, 'lambda': 9.524029264077281, 'eta': 0.013400544659285077, 'sampling_method': 'uniform', 'subsample': 0.7917439825087751, 'gamma': 9.22279055033591}. Best is trial 203 with value: 4.239418470092741.
[I 2023-12-19 05:27:44,732] Trial 222 finished with value: 4.251294704634127 and parameters: {'learning_rate': 0.9229572872351908, 'aft_loss_distribution': 'normal', 'aft_loss_distribution_scale': 1.128226605981298, 'max_depth': 9, 'booster': 'gbtree', 'scale_pos_weight': 0.6628934322679152, 'alpha': 7.801175042209926, 'lambda': 9.646634293768729, 'eta': 0.0622166077103825, 'sampling_method': 'uniform', 'subsample': 0.7914273479555582, 'gamma': 9.213891311207075}. Best is trial 203 with value: 4.239418470092741.
[I 2023-12-19 05:27:44,828] Trial 223 pruned. Trial was pruned at iteration 1.
[I 2023-12-19 05:27:45,145] Trial 224 finished with value: inf and parameters: {'learning_rate': 0.9280099538378304, 'aft_loss_distribution': 'normal', 'aft_loss_distribution_scale': 1.0680428716862262, 'max_depth': 9, 'booster': 'gbtree', 'scale_pos_weight': 0.8834705010474575, 'alpha': 7.776455241156006, 'lambda': 9.927880035104206, 'eta': 0.10878172975656047, 'sampling_method': 'uniform', 'subsample': 0.819372961284932, 'gamma': 9.606593652691014}. Best is trial 203 with value: 4.239418470092741.
[I 2023-12-19 05:27:45,236] Trial 225 pruned. Trial was pruned at iteration 0.
[I 2023-12-19 05:27:45,525] Trial 226 pruned. Trial was pruned at iteration 53.
[I 2023-12-19 05:27:45,625] Trial 227 pruned. Trial was pruned at iteration 0.
[I 2023-12-19 05:27:45,719] Trial 228 pruned. Trial was pruned at iteration 0.
[I 2023-12-19 05:27:46,313] Trial 229 finished with value: 4.252759912304414 and parameters: {'learning_rate': 0.9272062201215631, 'aft_loss_distribution': 'normal', 'aft_loss_distribution_scale': 1.1407459454820303, 'max_depth': 9, 'booster': 'gbtree', 'scale_pos_weight': 0.28965444503458115, 'alpha': 7.850673255093306, 'lambda': 9.741367797901452, 'eta': 0.03895181826383323, 'sampling_method': 'uniform', 'subsample': 0.8649762529345647, 'gamma': 9.593454288803839}. Best is trial 203 with value: 4.239418470092741.
[I 2023-12-19 05:27:46,404] Trial 230 pruned. Trial was pruned at iteration 0.
[I 2023-12-19 05:27:46,822] Trial 231 finished with value: 4.246216980104631 and parameters: {'learning_rate': 0.9362007396023048, 'aft_loss_distribution': 'normal', 'aft_loss_distribution_scale': 1.129779304719087, 'max_depth': 9, 'booster': 'gbtree', 'scale_pos_weight': 0.6807935062129128, 'alpha': 7.425571084109954, 'lambda': 9.497553881181073, 'eta': 0.023134693598414365, 'sampling_method': 'uniform', 'subsample': 0.8322540914738713, 'gamma': 9.407136275623706}. Best is trial 203 with value: 4.239418470092741.
[I 2023-12-19 05:27:47,165] Trial 232 finished with value: inf and parameters: {'learning_rate': 0.9287580781042575, 'aft_loss_distribution': 'normal', 'aft_loss_distribution_scale': 0.9547328131908331, 'max_depth': 9, 'booster': 'gbtree', 'scale_pos_weight': 0.672838266462238, 'alpha': 7.244598247865209, 'lambda': 9.483689757865521, 'eta': 0.04639139799559016, 'sampling_method': 'uniform', 'subsample': 0.8381807986006423, 'gamma': 9.485076766453725}. Best is trial 203 with value: 4.239418470092741.
[I 2023-12-19 05:27:47,258] Trial 233 pruned. Trial was pruned at iteration 1.
[I 2023-12-19 05:27:47,606] Trial 234 finished with value: inf and parameters: {'learning_rate': 0.8714492717132355, 'aft_loss_distribution': 'normal', 'aft_loss_distribution_scale': 1.1241400449283283, 'max_depth': 9, 'booster': 'gbtree', 'scale_pos_weight': 0.1343790415840786, 'alpha': 6.9315369956982495, 'lambda': 9.582170655834156, 'eta': 0.08688974410358005, 'sampling_method': 'uniform', 'subsample': 0.8066076673787674, 'gamma': 3.9987665588410453}. Best is trial 203 with value: 4.239418470092741.
[I 2023-12-19 05:27:48,033] Trial 235 finished with value: 4.252720706938989 and parameters: {'learning_rate': 0.9335778710315418, 'aft_loss_distribution': 'normal', 'aft_loss_distribution_scale': 0.9614316923042905, 'max_depth': 9, 'booster': 'gbtree', 'scale_pos_weight': 0.8080689282276072, 'alpha': 7.335337351060092, 'lambda': 9.851099692876367, 'eta': 0.7553224330097593, 'sampling_method': 'uniform', 'subsample': 0.8572276481775644, 'gamma': 9.43684113920398}. Best is trial 203 with value: 4.239418470092741.
[I 2023-12-19 05:27:48,126] Trial 236 pruned. Trial was pruned at iteration 0.
[I 2023-12-19 05:27:48,228] Trial 237 pruned. Trial was pruned at iteration 1.
