[I 2023-12-21 04:14:46,089] Trial 20 finished with value: 2.361122833103315 and parameters: {'learning_rate': 0.38305534946429615, 'aft_l                                                                     oss_distribution': 'logistic', 'aft_loss_distribution_scale': 3.464486533608345, 'max_depth': 9, 'booster': 'gbtree', 'scale_pos_weight':                                                                      1.1685997558772019, 'alpha': 2.1674888674068082, 'lambda': 2.7031765415511027, 'eta': 0.8662714124738804, 'sampling_method': 'uniform',                                                                      'subsample': 0.12760401873876118, 'gamma': 4.706216048251553}. Best is trial 20 with value: 2.361122833103315.
[I 2023-12-21 04:14:46,328] Trial 21 finished with value: 2.363595358659602 and parameters: {'learning_rate': 0.3574425859354885, 'aft_lo                                                                     ss_distribution': 'logistic', 'aft_loss_distribution_scale': 3.5172282119522524, 'max_depth': 9, 'booster': 'gbtree', 'scale_pos_weight':                                                                      1.0982723729904864, 'alpha': 2.0677847540422656, 'lambda': 2.3159851248896106, 'eta': 0.8419664497930917, 'sampling_method': 'uniform',                                                                      'subsample': 0.163862475138664, 'gamma': 4.475920319891758}. Best is trial 20 with value: 2.361122833103315.
[I 2023-12-21 04:14:46,364] Trial 22 pruned. Trial was pruned at iteration 5.
[I 2023-12-21 04:14:46,490] Trial 23 finished with value: 2.352332585327406 and parameters: {'learning_rate': 0.3734889880864276, 'aft_lo                                                                     ss_distribution': 'logistic', 'aft_loss_distribution_scale': 3.315614035147505, 'max_depth': 10, 'booster': 'gbtree', 'scale_pos_weight':                                                                      0.8375204399035404, 'alpha': 4.199464023930822, 'lambda': 2.742447650365875, 'eta': 0.884924332469446, 'sampling_method': 'uniform', 'su                                                                     bsample': 0.10176596046501817, 'gamma': 3.2622645759683118}. Best is trial 23 with value: 2.352332585327406.
[I 2023-12-21 04:14:46,518] Trial 24 pruned. Trial was pruned at iteration 0.
[I 2023-12-21 04:14:46,547] Trial 25 pruned. Trial was pruned at iteration 0.
[I 2023-12-21 04:14:46,576] Trial 26 pruned. Trial was pruned at iteration 0.
[I 2023-12-21 04:14:46,614] Trial 27 pruned. Trial was pruned at iteration 3.
[I 2023-12-21 04:14:46,643] Trial 28 pruned. Trial was pruned at iteration 0.
[I 2023-12-21 04:14:46,789] Trial 29 finished with value: inf and parameters: {'learning_rate': 0.3029491512131629, 'aft_loss_distributio                                                                     n': 'logistic', 'aft_loss_distribution_scale': 1.6319000949883857, 'max_depth': 10, 'booster': 'gbtree', 'scale_pos_weight': 0.3763728950                                                                     882099, 'alpha': 3.8959130431221993, 'lambda': 1.721246920958534, 'eta': 0.8731809863056487, 'sampling_method': 'uniform', 'subsample': 0                                                                     .20137710106376155, 'gamma': 4.592379347191087}. Best is trial 23 with value: 2.352332585327406.
[I 2023-12-21 04:14:46,820] Trial 30 pruned. Trial was pruned at iteration 0.
[I 2023-12-21 04:14:46,851] Trial 31 pruned. Trial was pruned at iteration 0.
[I 2023-12-21 04:14:46,881] Trial 32 pruned. Trial was pruned at iteration 0.
[I 2023-12-21 04:14:46,911] Trial 33 pruned. Trial was pruned at iteration 0.
[I 2023-12-21 04:14:46,944] Trial 34 pruned. Trial was pruned at iteration 0.
[I 2023-12-21 04:14:46,976] Trial 35 pruned. Trial was pruned at iteration 2.
[I 2023-12-21 04:14:47,006] Trial 36 pruned. Trial was pruned at iteration 0.
[I 2023-12-21 04:14:47,036] Trial 37 pruned. Trial was pruned at iteration 0.
[I 2023-12-21 04:14:47,067] Trial 38 pruned. Trial was pruned at iteration 0.
[I 2023-12-21 04:14:47,097] Trial 39 pruned. Trial was pruned at iteration 0.
[I 2023-12-21 04:14:47,128] Trial 40 pruned. Trial was pruned at iteration 0.
[I 2023-12-21 04:14:47,159] Trial 41 pruned. Trial was pruned at iteration 0.
[I 2023-12-21 04:14:47,192] Trial 42 pruned. Trial was pruned at iteration 0.
[I 2023-12-21 04:14:49,806] Trial 43 finished with value: 2.2378712263959195 and parameters: {'learning_rate': 0.6047706098113501, 'aft_l                                                                     oss_distribution': 'logistic', 'aft_loss_distribution_scale': 2.404040378629334, 'max_depth': 9, 'booster': 'dart', 'scale_pos_weight': 0                                                                     .9828125730543869, 'alpha': 1.9884980139735409, 'lambda': 9.581770240700012, 'eta': 0.7252212790185175, 'sampling_method': 'uniform', 'su                                                                     bsample': 0.7067525578103974, 'gamma': 8.118660272269038}. Best is trial 43 with value: 2.2378712263959195.
[I 2023-12-21 04:14:52,523] Trial 44 finished with value: 2.2413699747529736 and parameters: {'learning_rate': 0.5980332523972859, 'aft_l                                                                     oss_distribution': 'logistic', 'aft_loss_distribution_scale': 2.4240369068309446, 'max_depth': 10, 'booster': 'dart', 'scale_pos_weight':                                                                      0.9351485924645159, 'alpha': 2.0886780521735613, 'lambda': 8.865624081348175, 'eta': 0.713735318568788, 'sampling_method': 'uniform', 's                                                                     ubsample': 0.592161241995323, 'gamma': 8.693204952191868}. Best is trial 43 with value: 2.2378712263959195.
[I 2023-12-21 04:14:54,038] Trial 45 finished with value: inf and parameters: {'learning_rate': 0.6953141639724548, 'aft_loss_distributio                                                                     n': 'logistic', 'aft_loss_distribution_scale': 2.328332739706867, 'max_depth': 10, 'booster': 'dart', 'scale_pos_weight': 0.9074887052247                                                                     709, 'alpha': 3.011442604652161, 'lambda': 9.788328933131872, 'eta': 0.5175631329842981, 'sampling_method': 'uniform', 'subsample': 0.597                                                                     9705350727151, 'gamma': 9.05463306790364}. Best is trial 43 with value: 2.2378712263959195.
[I 2023-12-21 04:14:56,950] Trial 46 finished with value: 2.1178207719474402 and parameters: {'learning_rate': 0.5744034002331171, 'aft_l                                                                     oss_distribution': 'logistic', 'aft_loss_distribution_scale': 1.5431927603715485, 'max_depth': 10, 'booster': 'dart', 'scale_pos_weight':                                                                      0.7118567371717881, 'alpha': 3.510526533983833, 'lambda': 9.267609009625613, 'eta': 0.7104328279764891, 'sampling_method': 'uniform', 's                                                                     ubsample': 0.7457824910786441, 'gamma': 8.55605414809778}. Best is trial 46 with value: 2.1178207719474402.
[I 2023-12-21 04:14:58,714] Trial 47 finished with value: inf and parameters: {'learning_rate': 0.5815874874996976, 'aft_loss_distributio                                                                     n': 'logistic', 'aft_loss_distribution_scale': 1.53327037658556, 'max_depth': 10, 'booster': 'dart', 'scale_pos_weight': 0.55165636155270                                                                     23, 'alpha': 3.52125687552355, 'lambda': 8.872006280829453, 'eta': 0.4370695918658714, 'sampling_method': 'uniform', 'subsample': 0.71837                                                                     44069088805, 'gamma': 8.263862247316158}. Best is trial 46 with value: 2.1178207719474402.
[I 2023-12-21 04:14:58,768] Trial 48 pruned. Trial was pruned at iteration 0.
[I 2023-12-21 04:14:58,804] Trial 49 pruned. Trial was pruned at iteration 0.
[I 2023-12-21 04:15:01,985] Trial 50 finished with value: 2.217685630211383 and parameters: {'learning_rate': 0.7900559308278771, 'aft_lo                                                                     ss_distribution': 'logistic', 'aft_loss_distribution_scale': 2.220066926404316, 'max_depth': 10, 'booster': 'dart', 'scale_pos_weight': 0                                                                     .36923606793237584, 'alpha': 4.97272351985386, 'lambda': 9.406377116396282, 'eta': 0.57765686806062, 'sampling_method': 'uniform', 'subsa                                                                     mple': 0.8582287924921278, 'gamma': 7.234103439492625}. Best is trial 46 with value: 2.1178207719474402.
[I 2023-12-21 04:15:03,154] Trial 51 finished with value: inf and parameters: {'learning_rate': 0.7876911470141472, 'aft_loss_distributio                                                                     n': 'logistic', 'aft_loss_distribution_scale': 2.34667211153233, 'max_depth': 10, 'booster': 'dart', 'scale_pos_weight': 0.04058125365931                                                                     52, 'alpha': 4.871820930719509, 'lambda': 9.4909402663658, 'eta': 0.5644138052674379, 'sampling_method': 'uniform', 'subsample': 0.827732                                                                     8169284023, 'gamma': 8.828083588859084}. Best is trial 46 with value: 2.1178207719474402.
[I 2023-12-21 04:15:05,067] Trial 52 finished with value: 2.181012340260183 and parameters: {'learning_rate': 0.5077336997000699, 'aft_lo                                                                     ss_distribution': 'logistic', 'aft_loss_distribution_scale': 2.0026233395002877, 'max_depth': 10, 'booster': 'dart', 'scale_pos_weight':                                                                      0.4147779528249567, 'alpha': 5.663113107345875, 'lambda': 9.213351748357608, 'eta': 0.7305552162089645, 'sampling_method': 'uniform', 'su                                                                     bsample': 0.9277832570469099, 'gamma': 7.174997485317736}. Best is trial 46 with value: 2.1178207719474402.
[I 2023-12-21 04:15:07,403] Trial 53 finished with value: 2.1593757617864138 and parameters: {'learning_rate': 0.5142143958564462, 'aft_l                                                                     oss_distribution': 'logistic', 'aft_loss_distribution_scale': 1.859048580959123, 'max_depth': 10, 'booster': 'dart', 'scale_pos_weight':                                                                      0.3948920188982001, 'alpha': 6.200982945337961, 'lambda': 9.290931368131172, 'eta': 0.7223231329004812, 'sampling_method': 'uniform', 'su                                                                     bsample': 0.9645315737397109, 'gamma': 7.13571343972618}. Best is trial 46 with value: 2.1178207719474402.
[I 2023-12-21 04:15:07,439] Trial 54 pruned. Trial was pruned at iteration 0.
[I 2023-12-21 04:15:08,919] Trial 55 finished with value: inf and parameters: {'learning_rate': 0.6866665273442887, 'aft_loss_distributio                                                                     n': 'logistic', 'aft_loss_distribution_scale': 2.078053071609369, 'max_depth': 10, 'booster': 'dart', 'scale_pos_weight': 0.3487551232945                                                                     47, 'alpha': 6.588451521889271, 'lambda': 9.99486462115293, 'eta': 0.6549802869344994, 'sampling_method': 'gradient_based', 'subsample':                                                                      0.901941833328328, 'gamma': 7.767209795384323}. Best is trial 46 with value: 2.1178207719474402.
[I 2023-12-21 04:15:08,953] Trial 56 pruned. Trial was pruned at iteration 0.
[I 2023-12-21 04:15:08,990] Trial 57 pruned. Trial was pruned at iteration 0.
[I 2023-12-21 04:15:09,022] Trial 58 pruned. Trial was pruned at iteration 0.
[I 2023-12-21 04:15:09,055] Trial 59 pruned. Trial was pruned at iteration 0.
[I 2023-12-21 04:15:09,087] Trial 60 pruned. Trial was pruned at iteration 0.
[I 2023-12-21 04:15:11,017] Trial 61 finished with value: 2.226060150945021 and parameters: {'learning_rate': 0.5362322354487579, 'aft_lo                                                                     ss_distribution': 'logistic', 'aft_loss_distribution_scale': 2.31224459087323, 'max_depth': 10, 'booster': 'dart', 'scale_pos_weight': 0.                                                                     6419436937145702, 'alpha': 4.692517909281308, 'lambda': 9.231778112255395, 'eta': 0.6801963111744169, 'sampling_method': 'uniform', 'subs                                                                     ample': 0.7769262017725396, 'gamma': 8.330717570741022}. Best is trial 46 with value: 2.1178207719474402.
[I 2023-12-21 04:15:11,053] Trial 62 pruned. Trial was pruned at iteration 1.
[I 2023-12-21 04:15:11,089] Trial 63 pruned. Trial was pruned at iteration 1.
[I 2023-12-21 04:15:14,988] Trial 64 finished with value: 2.1933094836131124 and parameters: {'learning_rate': 0.4805779434436818, 'aft_l                                                                     oss_distribution': 'logistic', 'aft_loss_distribution_scale': 2.074159176174847, 'max_depth': 9, 'booster': 'dart', 'scale_pos_weight': 0                                                                     .47720082366450184, 'alpha': 6.361778171901877, 'lambda': 8.504340501724187, 'eta': 0.7393195570890739, 'sampling_method': 'uniform', 'su                                                                     bsample': 0.6788322430905351, 'gamma': 8.306955264491258}. Best is trial 46 with value: 2.1178207719474402.
[I 2023-12-21 04:15:17,297] Trial 65 finished with value: 2.1483830408400872 and parameters: {'learning_rate': 0.4776295434235923, 'aft_l                                                                     oss_distribution': 'logistic', 'aft_loss_distribution_scale': 1.7777920628871224, 'max_depth': 9, 'booster': 'dart', 'scale_pos_weight':                                                                      0.2363594199272755, 'alpha': 6.426917079406787, 'lambda': 8.383040564735419, 'eta': 0.7433714657500543, 'sampling_method': 'uniform', 'su                                                                     bsample': 0.9308562607555069, 'gamma': 8.14654618745277}. Best is trial 46 with value: 2.1178207719474402.
[I 2023-12-21 04:15:18,514] Trial 66 finished with value: inf and parameters: {'learning_rate': 0.47689479980269933, 'aft_loss_distributi                                                                     on': 'logistic', 'aft_loss_distribution_scale': 1.7320643013199044, 'max_depth': 6, 'booster': 'dart', 'scale_pos_weight': 0.248206501570                                                                     0594, 'alpha': 6.593707543514109, 'lambda': 8.429921128839617, 'eta': 0.7526874768769027, 'sampling_method': 'uniform', 'subsample': 0.93                                                                     64206917331215, 'gamma': 7.733670528483319}. Best is trial 46 with value: 2.1178207719474402.
[I 2023-12-21 04:15:18,549] Trial 67 pruned. Trial was pruned at iteration 0.
[I 2023-12-21 04:15:18,588] Trial 68 pruned. Trial was pruned at iteration 0.
[I 2023-12-21 04:15:18,623] Trial 69 pruned. Trial was pruned at iteration 0.
[I 2023-12-21 04:15:18,673] Trial 70 pruned. Trial was pruned at iteration 0.
[I 2023-12-21 04:15:29,075] Trial 71 finished with value: 2.2030697576019223 and parameters: {'learning_rate': 0.5011494173543941, 'aft_l                                                                     oss_distribution': 'logistic', 'aft_loss_distribution_scale': 2.143709580346247, 'max_depth': 9, 'booster': 'dart', 'scale_pos_weight': 0                                                                     .7465129180799326, 'alpha': 5.371062099582704, 'lambda': 9.141208495107435, 'eta': 0.7341568298738166, 'sampling_method': 'uniform', 'sub                                                                     sample': 0.687462158961509, 'gamma': 8.042331281485257}. Best is trial 46 with value: 2.1178207719474402.
[I 2023-12-21 04:15:32,771] Trial 72 finished with value: 2.1943662374725914 and parameters: {'learning_rate': 0.557560449746458, 'aft_lo                                                                     ss_distribution': 'logistic', 'aft_loss_distribution_scale': 2.095895189006506, 'max_depth': 10, 'booster': 'dart', 'scale_pos_weight': 0                                                                     .7438805579864445, 'alpha': 5.439825199399511, 'lambda': 8.990028913601531, 'eta': 0.7396492272273599, 'sampling_method': 'uniform', 'sub                                                                     sample': 0.7871451536666472, 'gamma': 7.905528163026464}. Best is trial 46 with value: 2.1178207719474402.
[I 2023-12-21 04:15:55,931] Trial 73 finished with value: 2.1911647414281465 and parameters: {'learning_rate': 0.49083005493409076, 'aft_                                                                     loss_distribution': 'logistic', 'aft_loss_distribution_scale': 2.073919544988863, 'max_depth': 9, 'booster': 'dart', 'scale_pos_weight':                                                                      0.7521837596617228, 'alpha': 5.414526257082621, 'lambda': 8.603823626841844, 'eta': 0.8246065519914967, 'sampling_method': 'uniform', 'su                                                                     bsample': 0.6673685786600227, 'gamma': 7.926618167194004}. Best is trial 46 with value: 2.1178207719474402.
[I 2023-12-21 04:15:55,966] Trial 74 pruned. Trial was pruned at iteration 0.
[I 2023-12-21 04:15:59,845] Trial 75 finished with value: 2.1758819808572736 and parameters: {'learning_rate': 0.5053651382253281, 'aft_l                                                                     oss_distribution': 'logistic', 'aft_loss_distribution_scale': 1.962949295942467, 'max_depth': 9, 'booster': 'dart', 'scale_pos_weight': 0                                                                     .7334224899366116, 'alpha': 5.731664570253732, 'lambda': 7.061358919951234, 'eta': 0.751379668706401, 'sampling_method': 'uniform', 'subs                                                                     ample': 0.634345977572883, 'gamma': 7.516201515981985}. Best is trial 46 with value: 2.1178207719474402.
[I 2023-12-21 04:16:02,528] Trial 76 finished with value: 2.129647735213581 and parameters: {'learning_rate': 0.5641449264102554, 'aft_lo                                                                     ss_distribution': 'logistic', 'aft_loss_distribution_scale': 1.6522076069259402, 'max_depth': 9, 'booster': 'dart', 'scale_pos_weight': 1                                                                     .2658352643183126, 'alpha': 6.002690788130419, 'lambda': 6.928704877337122, 'eta': 0.8043814231652393, 'sampling_method': 'uniform', 'sub                                                                     sample': 0.6409130792024997, 'gamma': 9.410496187420447}. Best is trial 46 with value: 2.1178207719474402.
[I 2023-12-21 04:16:02,562] Trial 77 pruned. Trial was pruned at iteration 0.
[I 2023-12-21 04:16:02,595] Trial 78 pruned. Trial was pruned at iteration 0.
[I 2023-12-21 04:16:06,295] Trial 79 finished with value: 2.1463666197160367 and parameters: {'learning_rate': 0.4746942504833354, 'aft_l                                                                     oss_distribution': 'logistic', 'aft_loss_distribution_scale': 1.773519251317129, 'max_depth': 9, 'booster': 'dart', 'scale_pos_weight': 0                                                                     .4668196612825727, 'alpha': 6.394590647280365, 'lambda': 6.3737379455261625, 'eta': 0.777886833923628, 'sampling_method': 'uniform', 'sub                                                                     sample': 0.6165525387512267, 'gamma': 7.545674115598269}. Best is trial 46 with value: 2.1178207719474402.
[I 2023-12-21 04:16:06,331] Trial 80 pruned. Trial was pruned at iteration 0.
[I 2023-12-21 04:16:06,366] Trial 81 pruned. Trial was pruned at iteration 0.
[I 2023-12-21 04:16:06,399] Trial 82 pruned. Trial was pruned at iteration 0.
[I 2023-12-21 04:16:09,135] Trial 83 finished with value: 2.170333374020021 and parameters: {'learning_rate': 0.461934530547186, 'aft_los                                                                     s_distribution': 'logistic', 'aft_loss_distribution_scale': 1.908444470404315, 'max_depth': 9, 'booster': 'dart', 'scale_pos_weight': 0.4                                                                     3843759339145805, 'alpha': 6.294437589539293, 'lambda': 5.378984058721729, 'eta': 0.8342621000589937, 'sampling_method': 'uniform', 'subs                                                                     ample': 0.6203310632696499, 'gamma': 9.662433823356375}. Best is trial 46 with value: 2.1178207719474402.
[I 2023-12-21 04:16:28,512] Trial 84 finished with value: 2.1060790235471667 and parameters: {'learning_rate': 0.4538629586521252, 'aft_l                                                                     oss_distribution': 'logistic', 'aft_loss_distribution_scale': 1.5301120866090328, 'max_depth': 7, 'booster': 'dart', 'scale_pos_weight':                                                                      1.037328855544932, 'alpha': 7.34710626127169, 'lambda': 5.639879408465844, 'eta': 0.9077843690893346, 'sampling_method': 'uniform', 'subs                                                                     ample': 0.48850941459545255, 'gamma': 9.662735688307166}. Best is trial 84 with value: 2.1060790235471667.
