[I 2023-12-19 01:13:16,113] Trial 468 finished with value: 2.0551126752367646 and parameters: {'learning_rate': 0.44743015191794916, 'aft_loss_distribution': 'logistic', 'aft_loss_distribution_scale': 1.2623929774515514, 'max_depth': 8, 'booster': 'dart', 'scale_pos_weight': 2.8777719113648055, 'alpha': 4.774524621196357, 'lambda': 9.78360344832597, 'eta': 0.8057644664524499, 'sampling_method': 'uniform', 'subsample': 0.09985423934601101, 'gamma': 7.500035478995254}. Best is trial 415 with value: 2.047233401347207.
[I 2023-12-19 01:13:16,216] Trial 469 pruned. Trial was pruned at iteration 0.
[I 2023-12-19 01:13:16,324] Trial 470 pruned. Trial was pruned at iteration 0.
[I 2023-12-19 01:13:16,431] Trial 471 pruned. Trial was pruned at iteration 0.
[I 2023-12-19 01:13:18,528] Trial 472 finished with value: inf and parameters: {'learning_rate': 0.43022982516627317, 'aft_loss_distribution': 'logistic', 'aft_loss_distribution_scale': 1.2166747028008662, 'max_depth': 8, 'booster': 'dart', 'scale_pos_weight': 2.874587927241813, 'alpha': 4.98856453551884, 'lambda': 9.487375167912072, 'eta': 0.7799269665534733, 'sampling_method': 'uniform', 'subsample': 0.1062487218441568, 'gamma': 7.468600501524684}. Best is trial 415 with value: 2.047233401347207.
[I 2023-12-19 01:13:23,429] Trial 473 finished with value: 2.026772938961336 and parameters: {'learning_rate': 0.4719972110474213, 'aft_loss_distribution': 'logistic', 'aft_loss_distribution_scale': 0.9772536663519922, 'max_depth': 8, 'booster': 'dart', 'scale_pos_weight': 2.7758170450568347, 'alpha': 5.674186075727167, 'lambda': 9.842197642829504, 'eta': 0.8229349592918254, 'sampling_method': 'uniform', 'subsample': 0.03492023889199504, 'gamma': 7.295101675740009}. Best is trial 473 with value: 2.026772938961336.
[I 2023-12-19 01:13:23,542] Trial 474 pruned. Trial was pruned at iteration 0.
[I 2023-12-19 01:13:23,655] Trial 475 pruned. Trial was pruned at iteration 0.
[I 2023-12-19 01:13:25,096] Trial 476 finished with value: inf and parameters: {'learning_rate': 0.42035700380755103, 'aft_loss_distribution': 'logistic', 'aft_loss_distribution_scale': 0.6540599566997339, 'max_depth': 8, 'booster': 'dart', 'scale_pos_weight': 3.032657443232709, 'alpha': 5.402069729822339, 'lambda': 9.816911533442715, 'eta': 0.7585021742741936, 'sampling_method': 'uniform', 'subsample': 0.013839083973538224, 'gamma': 7.313920507649392}. Best is trial 473 with value: 2.026772938961336.
[I 2023-12-19 01:13:25,203] Trial 477 pruned. Trial was pruned at iteration 0.
[I 2023-12-19 01:13:25,310] Trial 478 pruned. Trial was pruned at iteration 0.
[I 2023-12-19 01:13:25,403] Trial 479 pruned. Trial was pruned at iteration 0.
[I 2023-12-19 01:13:29,768] Trial 480 finished with value: 2.047652499402449 and parameters: {'learning_rate': 0.4304748822128219, 'aft_loss_distribution': 'logistic', 'aft_loss_distribution_scale': 1.2198274949163799, 'max_depth': 8, 'booster': 'dart', 'scale_pos_weight': 2.7301750529740807, 'alpha': 5.916556949616436, 'lambda': 9.105407617082015, 'eta': 0.7174633972904858, 'sampling_method': 'uniform', 'subsample': 0.11912966664712625, 'gamma': 7.851798153268787}. Best is trial 473 with value: 2.026772938961336.
[I 2023-12-19 01:13:29,895] Trial 481 pruned. Trial was pruned at iteration 0.
[I 2023-12-19 01:13:30,008] Trial 482 pruned. Trial was pruned at iteration 0.
[I 2023-12-19 01:13:30,107] Trial 483 pruned. Trial was pruned at iteration 0.
[I 2023-12-19 01:13:34,796] Trial 484 finished with value: 2.049640907424636 and parameters: {'learning_rate': 0.39332807989085605, 'aft_loss_distribution': 'logistic', 'aft_loss_distribution_scale': 1.2330451431280207, 'max_depth': 8, 'booster': 'dart', 'scale_pos_weight': 2.728866321685073, 'alpha': 5.690786077384092, 'lambda': 9.436381527831783, 'eta': 0.7384008474584091, 'sampling_method': 'uniform', 'subsample': 0.11910151396741178, 'gamma': 7.849229493457845}. Best is trial 473 with value: 2.026772938961336.
[I 2023-12-19 01:13:34,993] Trial 485 pruned. Trial was pruned at iteration 0.
[I 2023-12-19 01:13:35,160] Trial 486 pruned. Trial was pruned at iteration 0.
[I 2023-12-19 01:13:35,301] Trial 487 pruned. Trial was pruned at iteration 0.
[I 2023-12-19 01:13:35,441] Trial 488 pruned. Trial was pruned at iteration 0.
[I 2023-12-19 01:13:35,581] Trial 489 pruned. Trial was pruned at iteration 0.
[I 2023-12-19 01:13:35,717] Trial 490 pruned. Trial was pruned at iteration 0.
[I 2023-12-19 01:13:49,880] Trial 491 finished with value: 2.051204272770057 and parameters: {'learning_rate': 0.45166588648313744, 'aft_loss_distribution': 'logistic', 'aft_loss_distribution_scale': 1.2497767499895687, 'max_depth': 8, 'booster': 'dart', 'scale_pos_weight': 2.6202801456164786, 'alpha': 6.008827471170933, 'lambda': 9.56715156963485, 'eta': 0.759699425256268, 'sampling_method': 'uniform', 'subsample': 0.09510863278377948, 'gamma': 7.694707716546243}. Best is trial 473 with value: 2.026772938961336.
[I 2023-12-19 01:13:59,131] Trial 492 finished with value: 2.0464720742189706 and parameters: {'learning_rate': 0.40674504740320233, 'aft_loss_distribution': 'logistic', 'aft_loss_distribution_scale': 1.209588307750272, 'max_depth': 8, 'booster': 'dart', 'scale_pos_weight': 2.618363252703947, 'alpha': 5.645040166838861, 'lambda': 9.36940848157809, 'eta': 0.7546431118766032, 'sampling_method': 'uniform', 'subsample': 0.09930695176351582, 'gamma': 7.703150567645706}. Best is trial 473 with value: 2.026772938961336.
[I 2023-12-19 01:13:59,256] Trial 493 pruned. Trial was pruned at iteration 0.
[I 2023-12-19 01:14:02,377] Trial 494 finished with value: 2.058933354683676 and parameters: {'learning_rate': 0.39970071145248975, 'aft_loss_distribution': 'logistic', 'aft_loss_distribution_scale': 1.146421298124853, 'max_depth': 8, 'booster': 'dart', 'scale_pos_weight': 2.634338385878594, 'alpha': 5.460767885413988, 'lambda': 9.148763761356074, 'eta': 0.7672211220503495, 'sampling_method': 'uniform', 'subsample': 0.08735362494730942, 'gamma': 7.828493472392591}. Best is trial 473 with value: 2.026772938961336.
[I 2023-12-19 01:14:02,548] Trial 495 pruned. Trial was pruned at iteration 0.
[I 2023-12-19 01:14:02,712] Trial 496 pruned. Trial was pruned at iteration 0.
[I 2023-12-19 01:14:03,631] Trial 497 finished with value: 2.0309447165594814 and parameters: {'learning_rate': 0.36838653783503744, 'aft_loss_distribution': 'logistic', 'aft_loss_distribution_scale': 1.0620012347851522, 'max_depth': 8, 'booster': 'gbtree', 'scale_pos_weight': 2.7232777302901128, 'alpha': 5.479958863148353, 'lambda': 8.703089806741483, 'eta': 0.7537394327767669, 'sampling_method': 'uniform', 'subsample': 0.04636171265865545, 'gamma': 7.6521810553134655}. Best is trial 473 with value: 2.026772938961336.
[I 2023-12-19 01:14:04,169] Trial 498 finished with value: inf and parameters: {'learning_rate': 0.36715534037793046, 'aft_loss_distribution': 'logistic', 'aft_loss_distribution_scale': 0.8108891960052103, 'max_depth': 8, 'booster': 'gbtree', 'scale_pos_weight': 2.803384715135941, 'alpha': 5.514495617139115, 'lambda': 8.849126316136296, 'eta': 0.7588335020677625, 'sampling_method': 'uniform', 'subsample': 0.02420544414566113, 'gamma': 7.653295922614543}. Best is trial 473 with value: 2.026772938961336.
[I 2023-12-19 01:14:04,343] Trial 499 pruned. Trial was pruned at iteration 0.
Completed hyperparameter tuning with best aft-nloglik = 2.026772938961336.
Re-running the best trial... params = {'verbosity': 0, 'objective': 'survival:aft', 'eval_metric': 'aft-nloglik', 'tree_method': 'gpu_hist', 'device': 'cuda', 'learning_rate': 0.4719972110474213, 'aft_loss_distribution': 'logistic', 'aft_loss_distribution_scale': 0.9772536663519922, 'max_depth': 8, 'booster': 'dart', 'scale_pos_weight': 2.7758170450568347, 'alpha': 5.674186075727167, 'lambda': 9.842197642829504, 'eta': 0.8229349592918254, 'sampling_method': 'uniform', 'subsample': 0.03492023889199504, 'gamma': 7.295101675740009}
[W 2023-12-19 01:14:08,442] Trial 0 is omitted in visualization because its objective value is inf or nan.
[W 2023-12-19 01:14:08,452] Trial 2 is omitted in visualization because its objective value is inf or nan.
[W 2023-12-19 01:14:08,455] Trial 7 is omitted in visualization because its objective value is inf or nan.
[W 2023-12-19 01:14:08,458] Trial 27 is omitted in visualization because its objective value is inf or nan.
[W 2023-12-19 01:14:08,466] Trial 29 is omitted in visualization because its objective value is inf or nan.
[W 2023-12-19 01:14:08,467] Trial 30 is omitted in visualization because its objective value is inf or nan.
[W 2023-12-19 01:14:08,468] Trial 42 is omitted in visualization because its objective value is inf or nan.
[W 2023-12-19 01:14:08,469] Trial 43 is omitted in visualization because its objective value is inf or nan.
[W 2023-12-19 01:14:08,470] Trial 82 is omitted in visualization because its objective value is inf or nan.
[W 2023-12-19 01:14:08,471] Trial 83 is omitted in visualization because its objective value is inf or nan.
[W 2023-12-19 01:14:08,472] Trial 84 is omitted in visualization because its objective value is inf or nan.
[W 2023-12-19 01:14:08,473] Trial 91 is omitted in visualization because its objective value is inf or nan.
[W 2023-12-19 01:14:08,474] Trial 92 is omitted in visualization because its objective value is inf or nan.
[W 2023-12-19 01:14:08,475] Trial 97 is omitted in visualization because its objective value is inf or nan.
[W 2023-12-19 01:14:08,479] Trial 112 is omitted in visualization because its objective value is inf or nan.
[W 2023-12-19 01:14:08,480] Trial 114 is omitted in visualization because its objective value is inf or nan.
[W 2023-12-19 01:14:08,481] Trial 116 is omitted in visualization because its objective value is inf or nan.
[W 2023-12-19 01:14:08,482] Trial 120 is omitted in visualization because its objective value is inf or nan.
[W 2023-12-19 01:14:08,483] Trial 123 is omitted in visualization because its objective value is inf or nan.
[W 2023-12-19 01:14:08,484] Trial 134 is omitted in visualization because its objective value is inf or nan.
[W 2023-12-19 01:14:08,485] Trial 162 is omitted in visualization because its objective value is inf or nan.
[W 2023-12-19 01:14:08,487] Trial 164 is omitted in visualization because its objective value is inf or nan.
[W 2023-12-19 01:14:08,489] Trial 171 is omitted in visualization because its objective value is inf or nan.
[W 2023-12-19 01:14:08,490] Trial 174 is omitted in visualization because its objective value is inf or nan.
[W 2023-12-19 01:14:08,491] Trial 180 is omitted in visualization because its objective value is inf or nan.
[W 2023-12-19 01:14:08,492] Trial 181 is omitted in visualization because its objective value is inf or nan.
[W 2023-12-19 01:14:08,493] Trial 182 is omitted in visualization because its objective value is inf or nan.
[W 2023-12-19 01:14:08,494] Trial 183 is omitted in visualization because its objective value is inf or nan.
[W 2023-12-19 01:14:08,495] Trial 184 is omitted in visualization because its objective value is inf or nan.
[W 2023-12-19 01:14:08,496] Trial 186 is omitted in visualization because its objective value is inf or nan.
[W 2023-12-19 01:14:08,497] Trial 193 is omitted in visualization because its objective value is inf or nan.
[W 2023-12-19 01:14:08,498] Trial 205 is omitted in visualization because its objective value is inf or nan.
[W 2023-12-19 01:14:08,499] Trial 208 is omitted in visualization because its objective value is inf or nan.
[W 2023-12-19 01:14:08,500] Trial 215 is omitted in visualization because its objective value is inf or nan.
[W 2023-12-19 01:14:08,501] Trial 216 is omitted in visualization because its objective value is inf or nan.
[W 2023-12-19 01:14:08,502] Trial 225 is omitted in visualization because its objective value is inf or nan.
[W 2023-12-19 01:14:08,503] Trial 226 is omitted in visualization because its objective value is inf or nan.
[W 2023-12-19 01:14:08,504] Trial 229 is omitted in visualization because its objective value is inf or nan.
[W 2023-12-19 01:14:08,505] Trial 230 is omitted in visualization because its objective value is inf or nan.
[W 2023-12-19 01:14:08,506] Trial 234 is omitted in visualization because its objective value is inf or nan.
[W 2023-12-19 01:14:08,508] Trial 238 is omitted in visualization because its objective value is inf or nan.
[W 2023-12-19 01:14:08,509] Trial 240 is omitted in visualization because its objective value is inf or nan.
[W 2023-12-19 01:14:08,510] Trial 244 is omitted in visualization because its objective value is inf or nan.
[W 2023-12-19 01:14:08,510] Trial 246 is omitted in visualization because its objective value is inf or nan.
[W 2023-12-19 01:14:08,511] Trial 251 is omitted in visualization because its objective value is inf or nan.
[W 2023-12-19 01:14:08,513] Trial 253 is omitted in visualization because its objective value is inf or nan.
[W 2023-12-19 01:14:08,513] Trial 254 is omitted in visualization because its objective value is inf or nan.
[W 2023-12-19 01:14:08,515] Trial 261 is omitted in visualization because its objective value is inf or nan.
[W 2023-12-19 01:14:08,516] Trial 263 is omitted in visualization because its objective value is inf or nan.
[W 2023-12-19 01:14:08,516] Trial 266 is omitted in visualization because its objective value is inf or nan.
[W 2023-12-19 01:14:08,517] Trial 270 is omitted in visualization because its objective value is inf or nan.
[W 2023-12-19 01:14:08,518] Trial 271 is omitted in visualization because its objective value is inf or nan.
[W 2023-12-19 01:14:08,519] Trial 275 is omitted in visualization because its objective value is inf or nan.
[W 2023-12-19 01:14:08,520] Trial 278 is omitted in visualization because its objective value is inf or nan.
[W 2023-12-19 01:14:08,521] Trial 279 is omitted in visualization because its objective value is inf or nan.
[W 2023-12-19 01:14:08,522] Trial 284 is omitted in visualization because its objective value is inf or nan.
[W 2023-12-19 01:14:08,523] Trial 292 is omitted in visualization because its objective value is inf or nan.
[W 2023-12-19 01:14:08,524] Trial 296 is omitted in visualization because its objective value is inf or nan.
[W 2023-12-19 01:14:08,525] Trial 298 is omitted in visualization because its objective value is inf or nan.
[W 2023-12-19 01:14:08,526] Trial 299 is omitted in visualization because its objective value is inf or nan.
[W 2023-12-19 01:14:08,527] Trial 302 is omitted in visualization because its objective value is inf or nan.
[W 2023-12-19 01:14:08,528] Trial 303 is omitted in visualization because its objective value is inf or nan.
[W 2023-12-19 01:14:08,529] Trial 311 is omitted in visualization because its objective value is inf or nan.
[W 2023-12-19 01:14:08,529] Trial 313 is omitted in visualization because its objective value is inf or nan.
[W 2023-12-19 01:14:08,530] Trial 315 is omitted in visualization because its objective value is inf or nan.
[W 2023-12-19 01:14:08,531] Trial 318 is omitted in visualization because its objective value is inf or nan.
[W 2023-12-19 01:14:08,532] Trial 325 is omitted in visualization because its objective value is inf or nan.
[W 2023-12-19 01:14:08,533] Trial 334 is omitted in visualization because its objective value is inf or nan.
[W 2023-12-19 01:14:08,534] Trial 337 is omitted in visualization because its objective value is inf or nan.
[W 2023-12-19 01:14:08,535] Trial 338 is omitted in visualization because its objective value is inf or nan.
[W 2023-12-19 01:14:08,536] Trial 339 is omitted in visualization because its objective value is inf or nan.
[W 2023-12-19 01:14:08,537] Trial 342 is omitted in visualization because its objective value is inf or nan.
[W 2023-12-19 01:14:08,538] Trial 346 is omitted in visualization because its objective value is inf or nan.
[W 2023-12-19 01:14:08,539] Trial 348 is omitted in visualization because its objective value is inf or nan.
[W 2023-12-19 01:14:08,539] Trial 359 is omitted in visualization because its objective value is inf or nan.
[W 2023-12-19 01:14:08,540] Trial 361 is omitted in visualization because its objective value is inf or nan.
[W 2023-12-19 01:14:08,541] Trial 375 is omitted in visualization because its objective value is inf or nan.
[W 2023-12-19 01:14:08,542] Trial 383 is omitted in visualization because its objective value is inf or nan.
[W 2023-12-19 01:14:08,543] Trial 397 is omitted in visualization because its objective value is inf or nan.
[W 2023-12-19 01:14:08,544] Trial 403 is omitted in visualization because its objective value is inf or nan.
[W 2023-12-19 01:14:08,545] Trial 408 is omitted in visualization because its objective value is inf or nan.
[W 2023-12-19 01:14:08,545] Trial 423 is omitted in visualization because its objective value is inf or nan.
[W 2023-12-19 01:14:08,546] Trial 426 is omitted in visualization because its objective value is inf or nan.
[W 2023-12-19 01:14:08,547] Trial 439 is omitted in visualization because its objective value is inf or nan.
[W 2023-12-19 01:14:08,548] Trial 457 is omitted in visualization because its objective value is inf or nan.
[W 2023-12-19 01:14:08,549] Trial 461 is omitted in visualization because its objective value is inf or nan.
[W 2023-12-19 01:14:08,550] Trial 462 is omitted in visualization because its objective value is inf or nan.
[W 2023-12-19 01:14:08,551] Trial 472 is omitted in visualization because its objective value is inf or nan.
[W 2023-12-19 01:14:08,552] Trial 476 is omitted in visualization because its objective value is inf or nan.
[W 2023-12-19 01:14:08,553] Trial 498 is omitted in visualization because its objective value is inf or nan.
TRN1 | R2:0.164; p:2.838e-39 | C:61.10 |3h:0.958 |6h:0.947 |9h:0.939 |12h:0.733 |15h:0.733 |18h:0.729 |24h:0.576 |48h:0.569 |72h:0.561 |1wk:0.381 |2wks:0.375 |1mon:0.327 |
TRN2 | R2:0.134; p:9.655e-27 | C:59.68 |3h:0.958 |6h:0.946 |9h:0.939 |12h:0.732 |15h:0.732 |18h:0.729 |24h:0.576 |48h:0.569 |72h:0.560 |1wk:0.383 |2wks:0.373 |1mon:0.325 |
VAL | R2:0.145; p:6.688e-31 | C:59.81 |3h:0.958 |6h:0.947 |9h:0.939 |12h:0.733 |15h:0.733 |18h:0.729 |24h:0.576 |48h:0.569 |72h:0.560 |1wk:0.383 |2wks:0.373 |1mon:0.326 |
TST | R2:0.112; p:1.729e-55 | C:58.16 |3h:0.951 |6h:0.936 |9h:0.927 |12h:0.727 |15h:0.727 |18h:0.712 |24h:0.444 |48h:0.442 |72h:0.438 |1wk:0.348 |2wks:0.355 |1mon:0.326 |
/content/drive/MyDrive/intermediates2/res//outcome2_xgb-aft_inp19_all.json
