[I 2023-12-19 00:27:34,793] Trial 428 finished with value: inf and parameters: {'learning_rate': 0.9182130081054685, 'aft_loss_distribution': 'normal', 'aft_loss_distribution_scale': 1.6553463723033466, 'max_depth': 4, 'booster': 'gbtree', 'scale_pos_weight': 2.675276647002646, 'alpha': 6.7741775380879945, 'lambda': 2.7278443628476317, 'eta': 0.26790846366571736, 'sampling_method': 'uniform', 'subsample': 0.7201594476543907, 'gamma': 7.557543019650657}. Best is trial 302 with value: 2.014644627836659.
[I 2023-12-19 00:27:34,889] Trial 429 pruned. Trial was pruned at iteration 0.
[I 2023-12-19 00:27:34,984] Trial 430 pruned. Trial was pruned at iteration 2.
[I 2023-12-19 00:27:35,077] Trial 431 pruned. Trial was pruned at iteration 0.
[I 2023-12-19 00:27:35,169] Trial 432 pruned. Trial was pruned at iteration 1.
[I 2023-12-19 00:27:35,259] Trial 433 pruned. Trial was pruned at iteration 0.
[I 2023-12-19 00:27:35,360] Trial 434 pruned. Trial was pruned at iteration 1.
[I 2023-12-19 00:27:35,447] Trial 435 pruned. Trial was pruned at iteration 0.
[I 2023-12-19 00:27:35,540] Trial 436 pruned. Trial was pruned at iteration 1.
[I 2023-12-19 00:27:35,848] Trial 437 finished with value: 2.0181511057624175 and parameters: {'learning_rate': 0.8988629222428779, 'aft_loss_distribution': 'normal', 'aft_loss_distribution_scale': 1.3933144871604897, 'max_depth': 6, 'booster': 'gbtree', 'scale_pos_weight': 0.7561998147732516, 'alpha': 5.971011492854036, 'lambda': 2.853170624319877, 'eta': 0.1893470163783482, 'sampling_method': 'uniform', 'subsample': 0.7351043719763215, 'gamma': 7.823473732170893}. Best is trial 302 with value: 2.014644627836659.
[I 2023-12-19 00:27:35,947] Trial 438 pruned. Trial was pruned at iteration 0.
[I 2023-12-19 00:27:36,040] Trial 439 pruned. Trial was pruned at iteration 1.
[I 2023-12-19 00:27:36,256] Trial 440 finished with value: inf and parameters: {'learning_rate': 0.9390522108388722, 'aft_loss_distribution': 'normal', 'aft_loss_distribution_scale': 1.349660450119274, 'max_depth': 5, 'booster': 'gbtree', 'scale_pos_weight': 2.2525309346139064, 'alpha': 5.537657343949476, 'lambda': 2.891425328304373, 'eta': 0.25604852568068015, 'sampling_method': 'uniform', 'subsample': 0.6707200975038268, 'gamma': 7.373575605973464}. Best is trial 302 with value: 2.014644627836659.
[I 2023-12-19 00:27:36,352] Trial 441 pruned. Trial was pruned at iteration 0.
[I 2023-12-19 00:27:36,443] Trial 442 pruned. Trial was pruned at iteration 0.
[I 2023-12-19 00:27:36,717] Trial 443 finished with value: 2.0190926915731113 and parameters: {'learning_rate': 0.8927465713610058, 'aft_loss_distribution': 'normal', 'aft_loss_distribution_scale': 1.5545304809403855, 'max_depth': 6, 'booster': 'gbtree', 'scale_pos_weight': 0.4756787672159172, 'alpha': 5.739250473354207, 'lambda': 3.0403563026161793, 'eta': 0.19695019347439416, 'sampling_method': 'uniform', 'subsample': 0.7422313379643287, 'gamma': 6.177304908261433}. Best is trial 302 with value: 2.014644627836659.
[I 2023-12-19 00:27:36,826] Trial 444 pruned. Trial was pruned at iteration 0.
[I 2023-12-19 00:27:36,923] Trial 445 pruned. Trial was pruned at iteration 0.
[I 2023-12-19 00:27:37,008] Trial 446 pruned. Trial was pruned at iteration 0.
[I 2023-12-19 00:27:37,101] Trial 447 pruned. Trial was pruned at iteration 0.
[I 2023-12-19 00:27:37,194] Trial 448 pruned. Trial was pruned at iteration 1.
[I 2023-12-19 00:27:37,286] Trial 449 pruned. Trial was pruned at iteration 0.
[I 2023-12-19 00:27:37,373] Trial 450 pruned. Trial was pruned at iteration 0.
[I 2023-12-19 00:27:37,467] Trial 451 pruned. Trial was pruned at iteration 1.
[I 2023-12-19 00:27:37,564] Trial 452 pruned. Trial was pruned at iteration 1.
[I 2023-12-19 00:27:37,653] Trial 453 pruned. Trial was pruned at iteration 0.
[I 2023-12-19 00:27:37,750] Trial 454 pruned. Trial was pruned at iteration 2.
[I 2023-12-19 00:27:37,850] Trial 455 pruned. Trial was pruned at iteration 0.
[I 2023-12-19 00:27:39,593] Trial 456 finished with value: inf and parameters: {'learning_rate': 0.8828489995986935, 'aft_loss_distribution': 'normal', 'aft_loss_distribution_scale': 1.5854256505882942, 'max_depth': 6, 'booster': 'dart', 'scale_pos_weight': 0.6425962597769819, 'alpha': 7.318303543947495, 'lambda': 3.6784670298122917, 'eta': 0.2359116747789257, 'sampling_method': 'uniform', 'subsample': 0.7602445270208289, 'gamma': 6.070614713066997}. Best is trial 302 with value: 2.014644627836659.
[I 2023-12-19 00:27:39,694] Trial 457 pruned. Trial was pruned at iteration 1.
[I 2023-12-19 00:27:39,785] Trial 458 pruned. Trial was pruned at iteration 0.
[I 2023-12-19 00:27:39,882] Trial 459 pruned. Trial was pruned at iteration 1.
[I 2023-12-19 00:27:40,176] Trial 460 finished with value: 2.0164497632017944 and parameters: {'learning_rate': 0.9286694654299951, 'aft_loss_distribution': 'normal', 'aft_loss_distribution_scale': 1.4708210314840278, 'max_depth': 6, 'booster': 'gbtree', 'scale_pos_weight': 0.32256812884860897, 'alpha': 6.5510600745245595, 'lambda': 2.616012400521029, 'eta': 0.269926134756481, 'sampling_method': 'uniform', 'subsample': 0.7642141658629279, 'gamma': 7.29224269103937}. Best is trial 302 with value: 2.014644627836659.
[I 2023-12-19 00:27:40,275] Trial 461 pruned. Trial was pruned at iteration 0.
[I 2023-12-19 00:27:40,372] Trial 462 pruned. Trial was pruned at iteration 1.
[I 2023-12-19 00:27:40,665] Trial 463 finished with value: 2.0195867840477857 and parameters: {'learning_rate': 0.9349751457222003, 'aft_loss_distribution': 'normal', 'aft_loss_distribution_scale': 1.4176702445555465, 'max_depth': 6, 'booster': 'gbtree', 'scale_pos_weight': 0.3064906288365328, 'alpha': 6.734255706466594, 'lambda': 3.4404058823566586, 'eta': 0.2586725279019108, 'sampling_method': 'uniform', 'subsample': 0.7658730674587911, 'gamma': 7.640324551028544}. Best is trial 302 with value: 2.014644627836659.
[I 2023-12-19 00:27:40,766] Trial 464 pruned. Trial was pruned at iteration 0.
[I 2023-12-19 00:27:40,858] Trial 465 pruned. Trial was pruned at iteration 0.
[I 2023-12-19 00:27:40,965] Trial 466 pruned. Trial was pruned at iteration 2.
[I 2023-12-19 00:27:41,196] Trial 467 finished with value: inf and parameters: {'learning_rate': 0.9310584885017078, 'aft_loss_distribution': 'normal', 'aft_loss_distribution_scale': 1.4642660909480745, 'max_depth': 6, 'booster': 'gbtree', 'scale_pos_weight': 0.22841813410656397, 'alpha': 7.140228244041163, 'lambda': 3.1057918305434358, 'eta': 0.2577269435128006, 'sampling_method': 'uniform', 'subsample': 0.8296237894628459, 'gamma': 7.775459603266257}. Best is trial 302 with value: 2.014644627836659.
[I 2023-12-19 00:27:41,303] Trial 468 pruned. Trial was pruned at iteration 1.
[I 2023-12-19 00:27:41,519] Trial 469 finished with value: inf and parameters: {'learning_rate': 0.916224136832709, 'aft_loss_distribution': 'normal', 'aft_loss_distribution_scale': 1.4795471363294728, 'max_depth': 5, 'booster': 'gbtree', 'scale_pos_weight': 0.40872369504853406, 'alpha': 6.526144641952039, 'lambda': 3.465329899104674, 'eta': 0.2497504262636174, 'sampling_method': 'uniform', 'subsample': 0.7958065991015638, 'gamma': 7.637931792673968}. Best is trial 302 with value: 2.014644627836659.
[I 2023-12-19 00:27:41,619] Trial 470 pruned. Trial was pruned at iteration 0.
[I 2023-12-19 00:27:41,707] Trial 471 pruned. Trial was pruned at iteration 1.
[I 2023-12-19 00:27:41,798] Trial 472 pruned. Trial was pruned at iteration 0.
[I 2023-12-19 00:27:42,051] Trial 473 finished with value: inf and parameters: {'learning_rate': 0.9160527273001238, 'aft_loss_distribution': 'normal', 'aft_loss_distribution_scale': 1.4108396476277647, 'max_depth': 6, 'booster': 'gbtree', 'scale_pos_weight': 0.9399127481154186, 'alpha': 6.477132733075519, 'lambda': 2.7070065196141386, 'eta': 0.28211888252791917, 'sampling_method': 'uniform', 'subsample': 0.7465858615973211, 'gamma': 7.903807190335966}. Best is trial 302 with value: 2.014644627836659.
[I 2023-12-19 00:27:42,151] Trial 474 pruned. Trial was pruned at iteration 1.
[I 2023-12-19 00:27:43,478] Trial 475 finished with value: inf and parameters: {'learning_rate': 0.8820044825214337, 'aft_loss_distribution': 'normal', 'aft_loss_distribution_scale': 1.618997918091988, 'max_depth': 6, 'booster': 'dart', 'scale_pos_weight': 0.5459054340309454, 'alpha': 6.667914631924396, 'lambda': 3.3136005285593617, 'eta': 0.22968159166118207, 'sampling_method': 'uniform', 'subsample': 0.8774810376473294, 'gamma': 7.3498080003133515}. Best is trial 302 with value: 2.014644627836659.
[I 2023-12-19 00:27:43,574] Trial 476 pruned. Trial was pruned at iteration 0.
[I 2023-12-19 00:27:43,662] Trial 477 pruned. Trial was pruned at iteration 0.
[I 2023-12-19 00:27:43,755] Trial 478 pruned. Trial was pruned at iteration 0.
[I 2023-12-19 00:27:43,851] Trial 479 pruned. Trial was pruned at iteration 1.
[I 2023-12-19 00:27:43,953] Trial 480 pruned. Trial was pruned at iteration 0.
[I 2023-12-19 00:27:44,108] Trial 481 pruned. Trial was pruned at iteration 0.
[I 2023-12-19 00:27:44,250] Trial 482 pruned. Trial was pruned at iteration 0.
[I 2023-12-19 00:27:44,380] Trial 483 pruned. Trial was pruned at iteration 0.
[I 2023-12-19 00:27:44,706] Trial 484 finished with value: inf and parameters: {'learning_rate': 0.9174044936278797, 'aft_loss_distribution': 'normal', 'aft_loss_distribution_scale': 1.6565038876614941, 'max_depth': 5, 'booster': 'gbtree', 'scale_pos_weight': 0.6666482959075107, 'alpha': 6.240174837479769, 'lambda': 3.3458665041855333, 'eta': 0.21126239609815858, 'sampling_method': 'uniform', 'subsample': 0.7822666335092018, 'gamma': 5.657167385220948}. Best is trial 302 with value: 2.014644627836659.
[I 2023-12-19 00:27:44,859] Trial 485 pruned. Trial was pruned at iteration 0.
[I 2023-12-19 00:27:44,996] Trial 486 pruned. Trial was pruned at iteration 0.
[I 2023-12-19 00:27:45,140] Trial 487 pruned. Trial was pruned at iteration 0.
[I 2023-12-19 00:27:45,279] Trial 488 pruned. Trial was pruned at iteration 0.
[I 2023-12-19 00:27:45,423] Trial 489 pruned. Trial was pruned at iteration 1.
[I 2023-12-19 00:27:45,571] Trial 490 pruned. Trial was pruned at iteration 0.
[I 2023-12-19 00:27:45,714] Trial 491 pruned. Trial was pruned at iteration 1.
[I 2023-12-19 00:27:45,855] Trial 492 pruned. Trial was pruned at iteration 0.
[I 2023-12-19 00:27:45,987] Trial 493 pruned. Trial was pruned at iteration 0.
[I 2023-12-19 00:27:47,750] Trial 494 finished with value: inf and parameters: {'learning_rate': 0.9251625714778503, 'aft_loss_distribution': 'normal', 'aft_loss_distribution_scale': 1.5472629751073563, 'max_depth': 5, 'booster': 'dart', 'scale_pos_weight': 0.482427190409895, 'alpha': 6.597933803390696, 'lambda': 3.2898186553948836, 'eta': 0.2826813892222352, 'sampling_method': 'uniform', 'subsample': 0.7420457753250995, 'gamma': 3.6011491541860465}. Best is trial 302 with value: 2.014644627836659.
[I 2023-12-19 00:27:47,911] Trial 495 pruned. Trial was pruned at iteration 0.
[I 2023-12-19 00:27:48,085] Trial 496 pruned. Trial was pruned at iteration 0.
[I 2023-12-19 00:27:48,244] Trial 497 pruned. Trial was pruned at iteration 0.
[I 2023-12-19 00:27:48,554] Trial 498 finished with value: inf and parameters: {'learning_rate': 0.9011996546101403, 'aft_loss_distribution': 'normal', 'aft_loss_distribution_scale': 1.6382820257847714, 'max_depth': 6, 'booster': 'gbtree', 'scale_pos_weight': 0.42843320917011685, 'alpha': 0.8425757909967873, 'lambda': 3.466545066293861, 'eta': 0.2702838455239192, 'sampling_method': 'uniform', 'subsample': 0.8190635850887877, 'gamma': 6.332297675299882}. Best is trial 302 with value: 2.014644627836659.
