[I 2023-12-19 00:04:08,893] Trial 253 finished with value: inf and parameters: {'learning_rate': 0.9751328464221636, 'aft_loss_distribution': 'normal', 'aft_loss_distribution_scale': 1.8447507923052162, 'max_depth': 8, 'booster': 'dart', 'scale_pos_weight': 0.09072329603616629, 'alpha': 2.584825558950176, 'lambda': 1.8939328701533151, 'eta': 0.17248068135288414, 'sampling_method': 'gradient_based', 'subsample': 0.6853169821262968, 'gamma': 9.163133246860701}. Best is trial 236 with value: 2.000108025662045.
[I 2023-12-19 00:04:10,434] Trial 254 finished with value: inf and parameters: {'learning_rate': 0.9654154569961816, 'aft_loss_distribution': 'normal', 'aft_loss_distribution_scale': 1.327615724484268, 'max_depth': 8, 'booster': 'dart', 'scale_pos_weight': 0.18690587424135754, 'alpha': 2.182439755856745, 'lambda': 1.8223323777915472, 'eta': 0.2943414456113347, 'sampling_method': 'gradient_based', 'subsample': 0.6985473085814606, 'gamma': 9.25996090783759}. Best is trial 236 with value: 2.000108025662045.
[I 2023-12-19 00:04:11,916] Trial 255 finished with value: inf and parameters: {'learning_rate': 0.9987307400651452, 'aft_loss_distribution': 'normal', 'aft_loss_distribution_scale': 1.5527092608498179, 'max_depth': 8, 'booster': 'dart', 'scale_pos_weight': 0.37958546944226795, 'alpha': 2.5645822275293413, 'lambda': 2.037637650566712, 'eta': 0.09275558667966818, 'sampling_method': 'gradient_based', 'subsample': 0.6487548419866309, 'gamma': 9.618551848045401}. Best is trial 236 with value: 2.000108025662045.
[I 2023-12-19 00:04:13,815] Trial 256 finished with value: inf and parameters: {'learning_rate': 0.9283312321128531, 'aft_loss_distribution': 'normal', 'aft_loss_distribution_scale': 1.8018151228446986, 'max_depth': 8, 'booster': 'dart', 'scale_pos_weight': 0.3175972095409376, 'alpha': 3.504015501013273, 'lambda': 2.0565201186873527, 'eta': 0.2044826912357945, 'sampling_method': 'gradient_based', 'subsample': 0.6761337063046313, 'gamma': 9.384214512412564}. Best is trial 236 with value: 2.000108025662045.
[I 2023-12-19 00:04:13,899] Trial 257 pruned. Trial was pruned at iteration 1.
[I 2023-12-19 00:04:13,974] Trial 258 pruned. Trial was pruned at iteration 1.
[I 2023-12-19 00:04:15,413] Trial 259 finished with value: inf and parameters: {'learning_rate': 0.9786213978006628, 'aft_loss_distribution': 'normal', 'aft_loss_distribution_scale': 1.4711152370818688, 'max_depth': 8, 'booster': 'dart', 'scale_pos_weight': 0.39856826583692995, 'alpha': 3.052914391949397, 'lambda': 2.1869568100909524, 'eta': 0.1496266902385669, 'sampling_method': 'gradient_based', 'subsample': 0.6652697769978034, 'gamma': 9.449106123422728}. Best is trial 236 with value: 2.000108025662045.
[I 2023-12-19 00:04:15,493] Trial 260 pruned. Trial was pruned at iteration 0.
[I 2023-12-19 00:04:18,257] Trial 261 finished with value: inf and parameters: {'learning_rate': 0.946672188500631, 'aft_loss_distribution': 'normal', 'aft_loss_distribution_scale': 1.7145658752880022, 'max_depth': 8, 'booster': 'dart', 'scale_pos_weight': 0.42089386961006564, 'alpha': 2.6059070263684103, 'lambda': 2.278307545810594, 'eta': 0.12004015889381904, 'sampling_method': 'gradient_based', 'subsample': 0.6483101941416648, 'gamma': 9.575383976847565}. Best is trial 236 with value: 2.000108025662045.
[I 2023-12-19 00:04:18,385] Trial 262 pruned. Trial was pruned at iteration 1.
[I 2023-12-19 00:04:18,502] Trial 263 pruned. Trial was pruned at iteration 0.
[I 2023-12-19 00:04:18,631] Trial 264 pruned. Trial was pruned at iteration 0.
[I 2023-12-19 00:04:18,748] Trial 265 pruned. Trial was pruned at iteration 0.
[I 2023-12-19 00:04:18,860] Trial 266 pruned. Trial was pruned at iteration 0.
[I 2023-12-19 00:04:18,992] Trial 267 pruned. Trial was pruned at iteration 1.
[I 2023-12-19 00:04:19,110] Trial 268 pruned. Trial was pruned at iteration 1.
[I 2023-12-19 00:04:19,225] Trial 269 pruned. Trial was pruned at iteration 0.
[I 2023-12-19 00:04:21,205] Trial 270 finished with value: inf and parameters: {'learning_rate': 0.976487696746827, 'aft_loss_distribution': 'normal', 'aft_loss_distribution_scale': 1.4827153225118237, 'max_depth': 8, 'booster': 'dart', 'scale_pos_weight': 0.2936269736351657, 'alpha': 2.789898781037594, 'lambda': 3.1187013805246346, 'eta': 0.19812315361723085, 'sampling_method': 'gradient_based', 'subsample': 0.6978972608393946, 'gamma': 9.601284535375}. Best is trial 236 with value: 2.000108025662045.
[I 2023-12-19 00:04:21,283] Trial 271 pruned. Trial was pruned at iteration 0.
[I 2023-12-19 00:04:21,364] Trial 272 pruned. Trial was pruned at iteration 1.
[I 2023-12-19 00:04:21,437] Trial 273 pruned. Trial was pruned at iteration 0.
[I 2023-12-19 00:04:21,520] Trial 274 pruned. Trial was pruned at iteration 0.
[I 2023-12-19 00:04:23,878] Trial 275 finished with value: inf and parameters: {'learning_rate': 0.9620731582664647, 'aft_loss_distribution': 'normal', 'aft_loss_distribution_scale': 1.6321030689572873, 'max_depth': 8, 'booster': 'dart', 'scale_pos_weight': 0.08206675569724195, 'alpha': 2.047736890152833, 'lambda': 1.3499294965440343, 'eta': 0.13982791828949667, 'sampling_method': 'gradient_based', 'subsample': 0.6644381223068346, 'gamma': 9.968244491343057}. Best is trial 236 with value: 2.000108025662045.
[I 2023-12-19 00:04:23,966] Trial 276 pruned. Trial was pruned at iteration 1.
[I 2023-12-19 00:04:24,045] Trial 277 pruned. Trial was pruned at iteration 0.
[I 2023-12-19 00:04:25,964] Trial 278 finished with value: inf and parameters: {'learning_rate': 0.9427171876808221, 'aft_loss_distribution': 'normal', 'aft_loss_distribution_scale': 1.8310133117372316, 'max_depth': 8, 'booster': 'dart', 'scale_pos_weight': 0.6290572246710168, 'alpha': 2.4248268124252474, 'lambda': 1.8049207589005225, 'eta': 0.24286813538454738, 'sampling_method': 'gradient_based', 'subsample': 0.79061631688378, 'gamma': 9.452249650975917}. Best is trial 236 with value: 2.000108025662045.
[I 2023-12-19 00:04:26,053] Trial 279 pruned. Trial was pruned at iteration 0.
[I 2023-12-19 00:04:26,139] Trial 280 pruned. Trial was pruned at iteration 1.
[I 2023-12-19 00:04:26,212] Trial 281 pruned. Trial was pruned at iteration 0.
[I 2023-12-19 00:04:26,290] Trial 282 pruned. Trial was pruned at iteration 0.
[I 2023-12-19 00:04:26,364] Trial 283 pruned. Trial was pruned at iteration 0.
[I 2023-12-19 00:04:26,455] Trial 284 pruned. Trial was pruned at iteration 1.
[I 2023-12-19 00:04:28,054] Trial 285 finished with value: inf and parameters: {'learning_rate': 0.9417162950563202, 'aft_loss_distribution': 'normal', 'aft_loss_distribution_scale': 1.8477785777586548, 'max_depth': 8, 'booster': 'dart', 'scale_pos_weight': 0.1453895971380775, 'alpha': 2.726049788130907, 'lambda': 2.6051491327722025, 'eta': 0.13903719998755715, 'sampling_method': 'gradient_based', 'subsample': 0.7085941588179534, 'gamma': 9.745520228292994}. Best is trial 236 with value: 2.000108025662045.
[I 2023-12-19 00:04:28,145] Trial 286 pruned. Trial was pruned at iteration 0.
[I 2023-12-19 00:04:28,227] Trial 287 pruned. Trial was pruned at iteration 0.
[I 2023-12-19 00:04:28,308] Trial 288 pruned. Trial was pruned at iteration 1.
[I 2023-12-19 00:04:30,108] Trial 289 finished with value: inf and parameters: {'learning_rate': 0.9982974025461047, 'aft_loss_distribution': 'normal', 'aft_loss_distribution_scale': 1.5499397883304957, 'max_depth': 10, 'booster': 'dart', 'scale_pos_weight': 0.22793791413807685, 'alpha': 3.4294329922997657, 'lambda': 1.9383658357090359, 'eta': 0.22858323677340103, 'sampling_method': 'gradient_based', 'subsample': 0.6789135535638372, 'gamma': 9.794054409344144}. Best is trial 236 with value: 2.000108025662045.
[I 2023-12-19 00:04:30,190] Trial 290 pruned. Trial was pruned at iteration 0.
[I 2023-12-19 00:04:30,267] Trial 291 pruned. Trial was pruned at iteration 0.
[I 2023-12-19 00:04:30,352] Trial 292 pruned. Trial was pruned at iteration 0.
[I 2023-12-19 00:04:30,429] Trial 293 pruned. Trial was pruned at iteration 0.
[I 2023-12-19 00:04:33,675] Trial 294 finished with value: inf and parameters: {'learning_rate': 0.9399072773593887, 'aft_loss_distribution': 'normal', 'aft_loss_distribution_scale': 1.6623916128950973, 'max_depth': 10, 'booster': 'dart', 'scale_pos_weight': 0.5332967352828318, 'alpha': 2.1244940374982852, 'lambda': 2.709731672695332, 'eta': 0.2502654853439121, 'sampling_method': 'gradient_based', 'subsample': 0.6413372016520686, 'gamma': 8.841788949273866}. Best is trial 236 with value: 2.000108025662045.
[I 2023-12-19 00:04:33,801] Trial 295 pruned. Trial was pruned at iteration 0.
[I 2023-12-19 00:04:35,677] Trial 296 finished with value: inf and parameters: {'learning_rate': 0.9755848770105524, 'aft_loss_distribution': 'normal', 'aft_loss_distribution_scale': 1.2884772568575702, 'max_depth': 10, 'booster': 'dart', 'scale_pos_weight': 0.17233293733219274, 'alpha': 3.1413743341964415, 'lambda': 0.5109243299643151, 'eta': 0.27821949854304506, 'sampling_method': 'gradient_based', 'subsample': 0.7103799486976708, 'gamma': 9.806035649655145}. Best is trial 236 with value: 2.000108025662045.
[I 2023-12-19 00:04:35,759] Trial 297 pruned. Trial was pruned at iteration 0.
[I 2023-12-19 00:04:35,832] Trial 298 pruned. Trial was pruned at iteration 0.
[I 2023-12-19 00:04:35,914] Trial 299 pruned. Trial was pruned at iteration 0.
[I 2023-12-19 00:04:36,009] Trial 300 pruned. Trial was pruned at iteration 1.
[I 2023-12-19 00:04:36,093] Trial 301 pruned. Trial was pruned at iteration 0.
[I 2023-12-19 00:04:36,191] Trial 302 pruned. Trial was pruned at iteration 1.
[I 2023-12-19 00:04:36,269] Trial 303 pruned. Trial was pruned at iteration 0.
[I 2023-12-19 00:04:36,348] Trial 304 pruned. Trial was pruned at iteration 0.
[I 2023-12-19 00:04:37,813] Trial 305 finished with value: inf and parameters: {'learning_rate': 0.998010754689502, 'aft_loss_distribution': 'normal', 'aft_loss_distribution_scale': 1.8106207235913145, 'max_depth': 8, 'booster': 'dart', 'scale_pos_weight': 0.3326005718088508, 'alpha': 2.407182792185642, 'lambda': 1.6135948474578932, 'eta': 0.3320173446406829, 'sampling_method': 'gradient_based', 'subsample': 0.6595181838286042, 'gamma': 9.811579075488682}. Best is trial 236 with value: 2.000108025662045.
[I 2023-12-19 00:04:37,899] Trial 306 pruned. Trial was pruned at iteration 0.
[I 2023-12-19 00:04:39,373] Trial 307 finished with value: inf and parameters: {'learning_rate': 0.9808534246349726, 'aft_loss_distribution': 'normal', 'aft_loss_distribution_scale': 1.4531042373214307, 'max_depth': 9, 'booster': 'dart', 'scale_pos_weight': 0.4273673058278091, 'alpha': 2.265727286415656, 'lambda': 0.9252556690641942, 'eta': 0.35609713209246674, 'sampling_method': 'gradient_based', 'subsample': 0.6844704433849338, 'gamma': 9.641508398709034}. Best is trial 236 with value: 2.000108025662045.
[I 2023-12-19 00:04:39,461] Trial 308 pruned. Trial was pruned at iteration 0.
[I 2023-12-19 00:04:39,536] Trial 309 pruned. Trial was pruned at iteration 0.
[I 2023-12-19 00:04:39,612] Trial 310 pruned. Trial was pruned at iteration 0.
[I 2023-12-19 00:04:39,691] Trial 311 pruned. Trial was pruned at iteration 1.
[I 2023-12-19 00:04:39,766] Trial 312 pruned. Trial was pruned at iteration 0.
[I 2023-12-19 00:04:39,856] Trial 313 pruned. Trial was pruned at iteration 0.
[I 2023-12-19 00:04:39,937] Trial 314 pruned. Trial was pruned at iteration 0.
[I 2023-12-19 00:04:40,019] Trial 315 pruned. Trial was pruned at iteration 1.
[I 2023-12-19 00:04:40,103] Trial 316 pruned. Trial was pruned at iteration 1.
[I 2023-12-19 00:04:41,593] Trial 317 finished with value: inf and parameters: {'learning_rate': 0.9729879640748569, 'aft_loss_distribution': 'normal', 'aft_loss_distribution_scale': 1.5277592891991507, 'max_depth': 8, 'booster': 'dart', 'scale_pos_weight': 0.3999904281475722, 'alpha': 2.6723298246884366, 'lambda': 0.4187188204524802, 'eta': 0.1091455177104882, 'sampling_method': 'gradient_based', 'subsample': 0.5409370150017141, 'gamma': 9.460734584484117}. Best is trial 236 with value: 2.000108025662045.
[I 2023-12-19 00:04:41,678] Trial 318 pruned. Trial was pruned at iteration 0.
[I 2023-12-19 00:04:41,755] Trial 319 pruned. Trial was pruned at iteration 0.
[I 2023-12-19 00:04:41,839] Trial 320 pruned. Trial was pruned at iteration 0.
[I 2023-12-19 00:04:41,919] Trial 321 pruned. Trial was pruned at iteration 0.
[I 2023-12-19 00:04:42,004] Trial 322 pruned. Trial was pruned at iteration 1.
[I 2023-12-19 00:04:43,595] Trial 323 finished with value: inf and parameters: {'learning_rate': 0.9398302112665946, 'aft_loss_distribution': 'normal', 'aft_loss_distribution_scale': 1.696216596345148, 'max_depth': 10, 'booster': 'dart', 'scale_pos_weight': 0.8279812403818703, 'alpha': 2.571453101844019, 'lambda': 2.4678042509162497, 'eta': 0.31359191068071535, 'sampling_method': 'gradient_based', 'subsample': 0.6853378798249696, 'gamma': 8.900441176993134}. Best is trial 236 with value: 2.000108025662045.
[I 2023-12-19 00:04:43,678] Trial 324 pruned. Trial was pruned at iteration 0.
[I 2023-12-19 00:04:43,755] Trial 325 pruned. Trial was pruned at iteration 0.
[I 2023-12-19 00:04:45,307] Trial 326 finished with value: inf and parameters: {'learning_rate': 0.9814911220210916, 'aft_loss_distribution': 'normal', 'aft_loss_distribution_scale': 1.2524898684606807, 'max_depth': 10, 'booster': 'dart', 'scale_pos_weight': 2.3960432590360687, 'alpha': 2.3734152625219695, 'lambda': 1.3328567634902606, 'eta': 0.1368690905527391, 'sampling_method': 'gradient_based', 'subsample': 0.7041186790708648, 'gamma': 9.651229848091889}. Best is trial 236 with value: 2.000108025662045.
[I 2023-12-19 00:04:45,460] Trial 327 pruned. Trial was pruned at iteration 0.
[I 2023-12-19 00:04:45,583] Trial 328 pruned. Trial was pruned at iteration 0.
[I 2023-12-19 00:04:45,874] Trial 329 finished with value: inf and parameters: {'learning_rate': 0.9997997665143086, 'aft_loss_distribution': 'normal', 'aft_loss_distribution_scale': 1.6719797170897142, 'max_depth': 10, 'booster': 'gbtree', 'scale_pos_weight': 0.3739049262556498, 'alpha': 2.5701229926340607, 'lambda': 1.8771871609548478, 'eta': 0.2362556212186564, 'sampling_method': 'gradient_based', 'subsample': 0.6800447865152308, 'gamma': 6.459250711255107}. Best is trial 236 with value: 2.000108025662045.
[I 2023-12-19 00:04:46,006] Trial 330 pruned. Trial was pruned at iteration 0.
[I 2023-12-19 00:04:46,125] Trial 331 pruned. Trial was pruned at iteration 0.
[I 2023-12-19 00:04:46,247] Trial 332 pruned. Trial was pruned at iteration 0.
[I 2023-12-19 00:04:46,371] Trial 333 pruned. Trial was pruned at iteration 1.
[I 2023-12-19 00:04:46,511] Trial 334 pruned. Trial was pruned at iteration 0.
[I 2023-12-19 00:04:46,634] Trial 335 pruned. Trial was pruned at iteration 1.
[I 2023-12-19 00:04:46,753] Trial 336 pruned. Trial was pruned at iteration 0.
[I 2023-12-19 00:04:46,879] Trial 337 pruned. Trial was pruned at iteration 0.
[I 2023-12-19 00:04:46,998] Trial 338 pruned. Trial was pruned at iteration 0.
[I 2023-12-19 00:04:47,114] Trial 339 pruned. Trial was pruned at iteration 0.
[I 2023-12-19 00:04:47,246] Trial 340 pruned. Trial was pruned at iteration 0.
[I 2023-12-19 00:04:47,377] Trial 341 pruned. Trial was pruned at iteration 1.
[I 2023-12-19 00:04:47,508] Trial 342 pruned. Trial was pruned at iteration 0.
[I 2023-12-19 00:04:47,622] Trial 343 pruned. Trial was pruned at iteration 0.
[I 2023-12-19 00:04:47,955] Trial 344 finished with value: inf and parameters: {'learning_rate': 0.9593220775775587, 'aft_loss_distribution': 'normal', 'aft_loss_distribution_scale': 1.717889420420603, 'max_depth': 10, 'booster': 'gbtree', 'scale_pos_weight': 0.6289555891721608, 'alpha': 2.118367706803465, 'lambda': 3.167949304432896, 'eta': 0.2956175946245453, 'sampling_method': 'gradient_based', 'subsample': 0.5513537983592766, 'gamma': 8.97572016464233}. Best is trial 236 with value: 2.000108025662045.
[I 2023-12-19 00:04:48,101] Trial 345 pruned. Trial was pruned at iteration 0.
[I 2023-12-19 00:04:48,236] Trial 346 pruned. Trial was pruned at iteration 1.
[I 2023-12-19 00:04:48,368] Trial 347 pruned. Trial was pruned at iteration 0.
[I 2023-12-19 00:04:48,501] Trial 348 pruned. Trial was pruned at iteration 0.
[I 2023-12-19 00:04:48,633] Trial 349 pruned. Trial was pruned at iteration 1.
[I 2023-12-19 00:04:48,751] Trial 350 pruned. Trial was pruned at iteration 0.
[I 2023-12-19 00:04:48,873] Trial 351 pruned. Trial was pruned at iteration 1.
[I 2023-12-19 00:04:48,997] Trial 352 pruned. Trial was pruned at iteration 0.
[I 2023-12-19 00:04:49,429] Trial 353 finished with value: 2.0058041513749947 and parameters: {'learning_rate': 0.9833351962722149, 'aft_loss_distribution': 'normal', 'aft_loss_distribution_scale': 1.5777289151110987, 'max_depth': 8, 'booster': 'gbtree', 'scale_pos_weight': 0.10250611646100638, 'alpha': 3.246572104172766, 'lambda': 1.2091877860615652, 'eta': 0.25805620959385395, 'sampling_method': 'gradient_based', 'subsample': 0.6846576297728119, 'gamma': 9.573933282242502}. Best is trial 236 with value: 2.000108025662045.
[I 2023-12-19 00:04:51,206] Trial 354 finished with value: inf and parameters: {'learning_rate': 0.9818857203197093, 'aft_loss_distribution': 'normal', 'aft_loss_distribution_scale': 1.4577416290593366, 'max_depth': 8, 'booster': 'dart', 'scale_pos_weight': 0.1591465900780438, 'alpha': 3.8793088886391267, 'lambda': 1.248045458636971, 'eta': 0.257667699302359, 'sampling_method': 'gradient_based', 'subsample': 0.6847090050871847, 'gamma': 9.201771455469384}. Best is trial 236 with value: 2.000108025662045.
[I 2023-12-19 00:04:51,291] Trial 355 pruned. Trial was pruned at iteration 0.
[I 2023-12-19 00:04:52,779] Trial 356 finished with value: inf and parameters: {'learning_rate': 0.9972665013921493, 'aft_loss_distribution': 'normal', 'aft_loss_distribution_scale': 1.5939308420142688, 'max_depth': 8, 'booster': 'dart', 'scale_pos_weight': 0.11575325475441467, 'alpha': 3.4287129103762335, 'lambda': 1.1290658979182409, 'eta': 0.28342894248168765, 'sampling_method': 'gradient_based', 'subsample': 0.7004686302696579, 'gamma': 9.044526556319704}. Best is trial 236 with value: 2.000108025662045.
[I 2023-12-19 00:04:52,866] Trial 357 pruned. Trial was pruned at iteration 0.
[I 2023-12-19 00:04:54,457] Trial 358 finished with value: inf and parameters: {'learning_rate': 0.9788710709828855, 'aft_loss_distribution': 'normal', 'aft_loss_distribution_scale': 1.6321674798701304, 'max_depth': 8, 'booster': 'dart', 'scale_pos_weight': 0.07410487301471891, 'alpha': 3.1991485478377797, 'lambda': 1.560569886599658, 'eta': 0.23973916856437436, 'sampling_method': 'gradient_based', 'subsample': 0.7119627551064087, 'gamma': 9.340629257105194}. Best is trial 236 with value: 2.000108025662045.
[I 2023-12-19 00:04:54,545] Trial 359 pruned. Trial was pruned at iteration 0.
[I 2023-12-19 00:04:54,631] Trial 360 pruned. Trial was pruned at iteration 1.
[I 2023-12-19 00:04:54,720] Trial 361 pruned. Trial was pruned at iteration 1.
[I 2023-12-19 00:04:54,820] Trial 362 pruned. Trial was pruned at iteration 1.
[I 2023-12-19 00:04:56,713] Trial 363 finished with value: inf and parameters: {'learning_rate': 0.9383071585804077, 'aft_loss_distribution': 'normal', 'aft_loss_distribution_scale': 1.5617502776515924, 'max_depth': 8, 'booster': 'dart', 'scale_pos_weight': 2.602836523962524, 'alpha': 2.714222834069162, 'lambda': 0.9723962553469991, 'eta': 0.2190542898493195, 'sampling_method': 'gradient_based', 'subsample': 0.6265514708390604, 'gamma': 7.862590331470168}. Best is trial 236 with value: 2.000108025662045.
[I 2023-12-19 00:04:59,079] Trial 364 finished with value: inf and parameters: {'learning_rate': 0.9593142007765014, 'aft_loss_distribution': 'normal', 'aft_loss_distribution_scale': 1.7209386904744695, 'max_depth': 8, 'booster': 'dart', 'scale_pos_weight': 2.1814240534393985, 'alpha': 2.2571938828562828, 'lambda': 1.4112773351094596, 'eta': 0.19509211630551046, 'sampling_method': 'gradient_based', 'subsample': 0.6763326261767603, 'gamma': 9.362145020864089}. Best is trial 236 with value: 2.000108025662045.
[I 2023-12-19 00:04:59,178] Trial 365 pruned. Trial was pruned at iteration 0.
[I 2023-12-19 00:04:59,275] Trial 366 pruned. Trial was pruned at iteration 0.
[I 2023-12-19 00:04:59,361] Trial 367 pruned. Trial was pruned at iteration 0.
[I 2023-12-19 00:05:17,014] Trial 368 finished with value: 2.0114128634831663 and parameters: {'learning_rate': 0.9432372422551676, 'aft_loss_distribution': 'normal', 'aft_loss_distribution_scale': 1.7791988991299585, 'max_depth': 8, 'booster': 'dart', 'scale_pos_weight': 0.8019101344167555, 'alpha': 3.5964733751857185, 'lambda': 3.022060636567318, 'eta': 0.1508797169650377, 'sampling_method': 'gradient_based', 'subsample': 0.6428635817149373, 'gamma': 9.445179354385136}. Best is trial 236 with value: 2.000108025662045.
[I 2023-12-19 00:05:17,155] Trial 369 pruned. Trial was pruned at iteration 0.
[I 2023-12-19 00:05:19,266] Trial 370 finished with value: inf and parameters: {'learning_rate': 0.9539019343704769, 'aft_loss_distribution': 'normal', 'aft_loss_distribution_scale': 1.6200490392731381, 'max_depth': 8, 'booster': 'dart', 'scale_pos_weight': 0.8401380242206835, 'alpha': 3.718761818275248, 'lambda': 3.0384892806027906, 'eta': 0.145618173254547, 'sampling_method': 'gradient_based', 'subsample': 0.6422124000198595, 'gamma': 9.31169851068971}. Best is trial 236 with value: 2.000108025662045.
[I 2023-12-19 00:05:19,353] Trial 371 pruned. Trial was pruned at iteration 0.
[I 2023-12-19 00:05:19,434] Trial 372 pruned. Trial was pruned at iteration 0.
[I 2023-12-19 00:05:19,523] Trial 373 pruned. Trial was pruned at iteration 0.
[I 2023-12-19 00:05:19,614] Trial 374 pruned. Trial was pruned at iteration 0.
[I 2023-12-19 00:05:19,704] Trial 375 pruned. Trial was pruned at iteration 1.
[I 2023-12-19 00:05:19,789] Trial 376 pruned. Trial was pruned at iteration 0.
