[I 2023-12-19 00:40:15,037] Trial 453 pruned. Trial was pruned at iteration 0.
[I 2023-12-19 00:40:15,165] Trial 454 pruned. Trial was pruned at iteration 0.
[I 2023-12-19 00:40:16,731] Trial 455 finished with value: inf and parameters: {'learning_rate': 0.9772467957992267, 'aft_loss_distribution': 'normal', 'aft_loss_distribution_scale': 1.450557875406444, 'max_depth': 3, 'booster': 'dart', 'scale_pos_weight': 1.5971958842490623, 'alpha': 3.9886910613596775, 'lambda': 2.145174187016453, 'eta': 0.9994189950711072, 'sampling_method': 'gradient_based', 'subsample': 0.8568252736849373, 'gamma': 8.781420552401064}. Best is trial 346 with value: 2.018361189186848.
[I 2023-12-19 00:40:16,827] Trial 456 pruned. Trial was pruned at iteration 0.
[I 2023-12-19 00:40:16,921] Trial 457 pruned. Trial was pruned at iteration 0.
[I 2023-12-19 00:40:17,021] Trial 458 pruned. Trial was pruned at iteration 1.
[I 2023-12-19 00:40:17,119] Trial 459 pruned. Trial was pruned at iteration 0.
[I 2023-12-19 00:40:17,207] Trial 460 pruned. Trial was pruned at iteration 0.
[I 2023-12-19 00:40:17,309] Trial 461 pruned. Trial was pruned at iteration 0.
[I 2023-12-19 00:40:20,119] Trial 462 finished with value: 2.020770857954372 and parameters: {'learning_rate': 0.9812401365215243, 'aft_loss_distribution': 'normal', 'aft_loss_distribution_scale': 1.5554924326045145, 'max_depth': 3, 'booster': 'dart', 'scale_pos_weight': 0.8461915977547896, 'alpha': 4.750197935982168, 'lambda': 2.6755389892753048, 'eta': 0.9565749592134121, 'sampling_method': 'gradient_based', 'subsample': 0.8192616896148548, 'gamma': 9.340081929848692}. Best is trial 346 with value: 2.018361189186848.
[I 2023-12-19 00:40:20,212] Trial 463 pruned. Trial was pruned at iteration 0.
[I 2023-12-19 00:40:20,308] Trial 464 pruned. Trial was pruned at iteration 0.
[I 2023-12-19 00:40:20,398] Trial 465 pruned. Trial was pruned at iteration 0.
[I 2023-12-19 00:40:20,495] Trial 466 pruned. Trial was pruned at iteration 0.
[I 2023-12-19 00:40:21,817] Trial 467 finished with value: inf and parameters: {'learning_rate': 0.9753390116112353, 'aft_loss_distribution': 'normal', 'aft_loss_distribution_scale': 1.6817901188336002, 'max_depth': 3, 'booster': 'dart', 'scale_pos_weight': 0.9274873594354505, 'alpha': 4.631436316053569, 'lambda': 2.216558353791206, 'eta': 0.9533810567855787, 'sampling_method': 'gradient_based', 'subsample': 0.806093746786857, 'gamma': 9.338238605311268}. Best is trial 346 with value: 2.018361189186848.
[I 2023-12-19 00:40:21,927] Trial 468 pruned. Trial was pruned at iteration 0.
[I 2023-12-19 00:40:22,029] Trial 469 pruned. Trial was pruned at iteration 0.
[I 2023-12-19 00:40:22,128] Trial 470 pruned. Trial was pruned at iteration 0.
[I 2023-12-19 00:40:23,465] Trial 471 finished with value: inf and parameters: {'learning_rate': 0.9812888247817798, 'aft_loss_distribution': 'normal', 'aft_loss_distribution_scale': 1.7382880535981173, 'max_depth': 3, 'booster': 'dart', 'scale_pos_weight': 1.3095841099263195, 'alpha': 3.730029517808092, 'lambda': 1.5832035949115573, 'eta': 0.8955133340243723, 'sampling_method': 'gradient_based', 'subsample': 0.8204482862404645, 'gamma': 0.4467860686190184}. Best is trial 346 with value: 2.018361189186848.
[I 2023-12-19 00:40:23,558] Trial 472 pruned. Trial was pruned at iteration 0.
[I 2023-12-19 00:40:23,648] Trial 473 pruned. Trial was pruned at iteration 0.
[I 2023-12-19 00:40:23,739] Trial 474 pruned. Trial was pruned at iteration 0.
[I 2023-12-19 00:40:23,827] Trial 475 pruned. Trial was pruned at iteration 0.
[I 2023-12-19 00:40:23,930] Trial 476 pruned. Trial was pruned at iteration 0.
[I 2023-12-19 00:40:24,035] Trial 477 pruned. Trial was pruned at iteration 2.
[I 2023-12-19 00:40:27,035] Trial 478 finished with value: 2.0185704961799464 and parameters: {'learning_rate': 0.9998481274969364, 'aft_loss_distribution': 'normal', 'aft_loss_distribution_scale': 1.421589608425937, 'max_depth': 3, 'booster': 'dart', 'scale_pos_weight': 1.2589457709113439, 'alpha': 4.460424030318199, 'lambda': 1.9010212421167934, 'eta': 0.8927322423559146, 'sampling_method': 'gradient_based', 'subsample': 0.8126725571190225, 'gamma': 9.409514422038518}. Best is trial 346 with value: 2.018361189186848.
[I 2023-12-19 00:40:27,184] Trial 479 pruned. Trial was pruned at iteration 0.
[I 2023-12-19 00:40:27,330] Trial 480 pruned. Trial was pruned at iteration 0.
[I 2023-12-19 00:40:29,033] Trial 481 finished with value: inf and parameters: {'learning_rate': 0.9831075424893974, 'aft_loss_distribution': 'normal', 'aft_loss_distribution_scale': 1.407961032727688, 'max_depth': 3, 'booster': 'dart', 'scale_pos_weight': 1.359684050647181, 'alpha': 4.784452409378375, 'lambda': 2.647041078799547, 'eta': 0.873725118977608, 'sampling_method': 'gradient_based', 'subsample': 0.8155034694826391, 'gamma': 9.445948507441974}. Best is trial 346 with value: 2.018361189186848.
[I 2023-12-19 00:40:29,195] Trial 482 pruned. Trial was pruned at iteration 0.
[I 2023-12-19 00:40:29,342] Trial 483 pruned. Trial was pruned at iteration 0.
[I 2023-12-19 00:40:29,481] Trial 484 pruned. Trial was pruned at iteration 0.
[I 2023-12-19 00:40:29,621] Trial 485 pruned. Trial was pruned at iteration 0.
[I 2023-12-19 00:40:32,804] Trial 486 finished with value: 2.020567064287785 and parameters: {'learning_rate': 0.9997690408254635, 'aft_loss_distribution': 'normal', 'aft_loss_distribution_scale': 1.5644667790732896, 'max_depth': 8, 'booster': 'dart', 'scale_pos_weight': 2.614451654616864, 'alpha': 3.97384195983193, 'lambda': 2.4680410912580673, 'eta': 0.9131288702660891, 'sampling_method': 'gradient_based', 'subsample': 0.8025911126108215, 'gamma': 7.913538676931678}. Best is trial 346 with value: 2.018361189186848.
[I 2023-12-19 00:40:32,912] Trial 487 pruned. Trial was pruned at iteration 0.
[I 2023-12-19 00:40:33,007] Trial 488 pruned. Trial was pruned at iteration 0.
[I 2023-12-19 00:40:33,107] Trial 489 pruned. Trial was pruned at iteration 0.
[I 2023-12-19 00:40:33,202] Trial 490 pruned. Trial was pruned at iteration 0.
[I 2023-12-19 00:40:36,028] Trial 491 finished with value: 2.0227415369899395 and parameters: {'learning_rate': 0.9819650941835303, 'aft_loss_distribution': 'normal', 'aft_loss_distribution_scale': 1.6292461499205106, 'max_depth': 7, 'booster': 'dart', 'scale_pos_weight': 1.3157434885133252, 'alpha': 3.536647484582181, 'lambda': 2.8294557908618208, 'eta': 0.9246464790665809, 'sampling_method': 'gradient_based', 'subsample': 0.8112608788604093, 'gamma': 7.288982418331171}. Best is trial 346 with value: 2.018361189186848.
[I 2023-12-19 00:40:36,139] Trial 492 pruned. Trial was pruned at iteration 0.
[I 2023-12-19 00:40:36,233] Trial 493 pruned. Trial was pruned at iteration 0.
[I 2023-12-19 00:40:36,324] Trial 494 pruned. Trial was pruned at iteration 0.
[I 2023-12-19 00:40:36,421] Trial 495 pruned. Trial was pruned at iteration 0.
[I 2023-12-19 00:40:36,512] Trial 496 pruned. Trial was pruned at iteration 0.
[I 2023-12-19 00:40:36,619] Trial 497 pruned. Trial was pruned at iteration 0.
[I 2023-12-19 00:40:36,705] Trial 498 pruned. Trial was pruned at iteration 0.
