[I 2023-12-18 22:50:10,277] Trial 151 pruned. Trial was pruned at iteration 0.
[I 2023-12-18 22:50:10,377] Trial 152 pruned. Trial was pruned at iteration 1.
[I 2023-12-18 22:50:10,707] Trial 153 finished with value: inf and parameters: {'learning_rate': 0.9761921595125855, 'aft_loss_distribution': 'normal', 'aft_loss_distribution_scale': 0.8183757285619009, 'max_depth': 4, 'booster': 'gbtree', 'scale_pos_weight': 3.9559466099923433, 'alpha': 2.9540919234308958, 'lambda': 8.39747893790474, 'eta': 0.3195103479864759, 'sampling_method': 'gradient_based', 'subsample': 0.1198508125885277, 'gamma': 8.244792100294749}. Best is trial 1 with value: 4.243578196768486.
[I 2023-12-18 22:50:10,812] Trial 154 pruned. Trial was pruned at iteration 0.
[I 2023-12-18 22:50:10,911] Trial 155 pruned. Trial was pruned at iteration 0.
[I 2023-12-18 22:50:11,005] Trial 156 pruned. Trial was pruned at iteration 0.
[I 2023-12-18 22:50:11,105] Trial 157 pruned. Trial was pruned at iteration 0.
[I 2023-12-18 22:50:12,959] Trial 158 finished with value: inf and parameters: {'learning_rate': 0.890528664075843, 'aft_loss_distribution': 'normal', 'aft_loss_distribution_scale': 2.185898877933451, 'max_depth': 5, 'booster': 'dart', 'scale_pos_weight': 8.652615812994316, 'alpha': 2.013436965156651, 'lambda': 7.919382558182211, 'eta': 0.43730631076921334, 'sampling_method': 'gradient_based', 'subsample': 0.16834814378318627, 'gamma': 7.164523935295514}. Best is trial 1 with value: 4.243578196768486.
[I 2023-12-18 22:50:13,048] Trial 159 pruned. Trial was pruned at iteration 0.
[I 2023-12-18 22:50:13,116] Trial 160 pruned. Trial was pruned at iteration 0.
[I 2023-12-18 22:50:13,296] Trial 161 finished with value: inf and parameters: {'learning_rate': 0.48428709502653716, 'aft_loss_distribution': 'logistic', 'aft_loss_distribution_scale': 1.4049966907988871, 'max_depth': 6, 'booster': 'gbtree', 'scale_pos_weight': 2.5985908602135046, 'alpha': 3.696193076277877, 'lambda': 9.44101412494374, 'eta': 0.3508562008406923, 'sampling_method': 'uniform', 'subsample': 0.23962538860993185, 'gamma': 9.491740517757943}. Best is trial 1 with value: 4.243578196768486.
[I 2023-12-18 22:50:13,366] Trial 162 pruned. Trial was pruned at iteration 0.
[I 2023-12-18 22:50:13,436] Trial 163 pruned. Trial was pruned at iteration 1.
[I 2023-12-18 22:50:13,501] Trial 164 pruned. Trial was pruned at iteration 0.
[I 2023-12-18 22:50:13,562] Trial 165 pruned. Trial was pruned at iteration 0.
[I 2023-12-18 22:50:13,633] Trial 166 pruned. Trial was pruned at iteration 0.
[I 2023-12-18 22:50:13,698] Trial 167 pruned. Trial was pruned at iteration 0.
[I 2023-12-18 22:50:13,775] Trial 168 pruned. Trial was pruned at iteration 0.
[I 2023-12-18 22:50:13,841] Trial 169 pruned. Trial was pruned at iteration 0.
[I 2023-12-18 22:50:13,909] Trial 170 pruned. Trial was pruned at iteration 0.
[I 2023-12-18 22:50:13,973] Trial 171 pruned. Trial was pruned at iteration 0.
[I 2023-12-18 22:50:14,234] Trial 172 finished with value: 4.422633625649462 and parameters: {'learning_rate': 0.40037656861492055, 'aft_loss_distribution': 'logistic', 'aft_loss_distribution_scale': 1.031242495209864, 'max_depth': 6, 'booster': 'gbtree', 'scale_pos_weight': 8.421753836882125, 'alpha': 4.3724925424302095, 'lambda': 7.661994012898353, 'eta': 0.03962019190022787, 'sampling_method': 'uniform', 'subsample': 0.038741725397815716, 'gamma': 6.319771870273331}. Best is trial 1 with value: 4.243578196768486.
[I 2023-12-18 22:50:14,636] Trial 173 finished with value: 4.46119421353529 and parameters: {'learning_rate': 0.32537959442670794, 'aft_loss_distribution': 'logistic', 'aft_loss_distribution_scale': 1.109427852093145, 'max_depth': 6, 'booster': 'gbtree', 'scale_pos_weight': 8.741957326358515, 'alpha': 4.068719263257756, 'lambda': 7.620153576735395, 'eta': 0.034333335927682805, 'sampling_method': 'uniform', 'subsample': 0.4386836066140086, 'gamma': 6.880957314946106}. Best is trial 1 with value: 4.243578196768486.
[I 2023-12-18 22:50:14,707] Trial 174 pruned. Trial was pruned at iteration 0.
[I 2023-12-18 22:50:15,234] Trial 175 pruned. Trial was pruned at iteration 205.
[I 2023-12-18 22:50:15,316] Trial 176 pruned. Trial was pruned at iteration 0.
[I 2023-12-18 22:50:15,510] Trial 177 pruned. Trial was pruned at iteration 53.
[I 2023-12-18 22:50:15,579] Trial 178 pruned. Trial was pruned at iteration 0.
[I 2023-12-18 22:50:15,643] Trial 179 pruned. Trial was pruned at iteration 0.
[I 2023-12-18 22:50:15,719] Trial 180 pruned. Trial was pruned at iteration 0.
[I 2023-12-18 22:50:15,785] Trial 181 pruned. Trial was pruned at iteration 0.
[I 2023-12-18 22:50:15,969] Trial 182 pruned. Trial was pruned at iteration 53.
[I 2023-12-18 22:50:16,458] Trial 183 pruned. Trial was pruned at iteration 208.
[I 2023-12-18 22:50:16,531] Trial 184 pruned. Trial was pruned at iteration 0.
[I 2023-12-18 22:50:16,597] Trial 185 pruned. Trial was pruned at iteration 0.
[I 2023-12-18 22:50:16,662] Trial 186 pruned. Trial was pruned at iteration 0.
[I 2023-12-18 22:50:16,736] Trial 187 pruned. Trial was pruned at iteration 0.
[I 2023-12-18 22:50:16,807] Trial 188 pruned. Trial was pruned at iteration 0.
[I 2023-12-18 22:50:16,891] Trial 189 pruned. Trial was pruned at iteration 0.
[I 2023-12-18 22:50:16,962] Trial 190 pruned. Trial was pruned at iteration 0.
[I 2023-12-18 22:50:17,194] Trial 191 finished with value: 4.421007407209734 and parameters: {'learning_rate': 0.4000349373303568, 'aft_loss_distribution': 'logistic', 'aft_loss_distribution_scale': 1.0284105283583018, 'max_depth': 6, 'booster': 'gbtree', 'scale_pos_weight': 8.452100309965148, 'alpha': 4.472057318932805, 'lambda': 7.8201196260271395, 'eta': 0.055405114503053646, 'sampling_method': 'uniform', 'subsample': 0.040897963772800645, 'gamma': 5.755216626403559}. Best is trial 1 with value: 4.243578196768486.
[I 2023-12-18 22:50:17,421] Trial 192 finished with value: 4.405255213042396 and parameters: {'learning_rate': 0.40368245849460643, 'aft_loss_distribution': 'logistic', 'aft_loss_distribution_scale': 1.0009951501787633, 'max_depth': 6, 'booster': 'gbtree', 'scale_pos_weight': 8.053014779711528, 'alpha': 4.484274043068141, 'lambda': 8.102138853982867, 'eta': 0.040033781436111776, 'sampling_method': 'uniform', 'subsample': 0.04548939285721043, 'gamma': 5.839070653600095}. Best is trial 1 with value: 4.243578196768486.
[I 2023-12-18 22:50:17,684] Trial 193 finished with value: 4.388294825112271 and parameters: {'learning_rate': 0.4073332859428374, 'aft_loss_distribution': 'logistic', 'aft_loss_distribution_scale': 0.974014463961833, 'max_depth': 6, 'booster': 'gbtree', 'scale_pos_weight': 7.937718015647726, 'alpha': 4.563367764655741, 'lambda': 7.8615550249479496, 'eta': 0.051960450772977285, 'sampling_method': 'uniform', 'subsample': 0.04851631839930041, 'gamma': 5.718301537989954}. Best is trial 1 with value: 4.243578196768486.
[I 2023-12-18 22:50:18,045] Trial 194 pruned. Trial was pruned at iteration 0.
[I 2023-12-18 22:50:18,930] Trial 195 finished with value: 4.4247935095187945 and parameters: {'learning_rate': 0.38997731690081905, 'aft_loss_distribution': 'logistic', 'aft_loss_distribution_scale': 1.0350038030548523, 'max_depth': 6, 'booster': 'gbtree', 'scale_pos_weight': 8.091520764211417, 'alpha': 4.561345826162774, 'lambda': 8.07258518625556, 'eta': 3.884594483969522e-05, 'sampling_method': 'uniform', 'subsample': 0.04788119126495513, 'gamma': 5.909370975989874}. Best is trial 1 with value: 4.243578196768486.
[I 2023-12-18 22:50:19,201] Trial 196 finished with value: 4.4334781944831745 and parameters: {'learning_rate': 0.3854959127792463, 'aft_loss_distribution': 'logistic', 'aft_loss_distribution_scale': 1.0501404500004512, 'max_depth': 6, 'booster': 'gbtree', 'scale_pos_weight': 7.924782494326822, 'alpha': 4.665076687210609, 'lambda': 8.106432671287623, 'eta': 0.03212484804322753, 'sampling_method': 'uniform', 'subsample': 0.051010089337782866, 'gamma': 5.893274276243885}. Best is trial 1 with value: 4.243578196768486.
[I 2023-12-18 22:50:19,430] Trial 197 finished with value: inf and parameters: {'learning_rate': 0.3802675920908132, 'aft_loss_distribution': 'logistic', 'aft_loss_distribution_scale': 0.9978396874768828, 'max_depth': 6, 'booster': 'gbtree', 'scale_pos_weight': 7.853105534497514, 'alpha': 4.960642696660793, 'lambda': 7.696005595081674, 'eta': 0.005149981893183057, 'sampling_method': 'uniform', 'subsample': 0.046780655010011274, 'gamma': 5.451700058357427}. Best is trial 1 with value: 4.243578196768486.
[I 2023-12-18 22:50:19,511] Trial 198 pruned. Trial was pruned at iteration 0.
[I 2023-12-18 22:50:19,582] Trial 199 pruned. Trial was pruned at iteration 0.
[I 2023-12-18 22:50:19,649] Trial 200 pruned. Trial was pruned at iteration 0.
[I 2023-12-18 22:50:19,834] Trial 201 pruned. Trial was pruned at iteration 53.
[I 2023-12-18 22:50:19,908] Trial 202 pruned. Trial was pruned at iteration 0.
[I 2023-12-18 22:50:19,987] Trial 203 pruned. Trial was pruned at iteration 0.
[I 2023-12-18 22:50:20,056] Trial 204 pruned. Trial was pruned at iteration 0.
[I 2023-12-18 22:50:20,131] Trial 205 pruned. Trial was pruned at iteration 0.
[I 2023-12-18 22:50:20,202] Trial 206 pruned. Trial was pruned at iteration 0.
[I 2023-12-18 22:50:20,270] Trial 207 pruned. Trial was pruned at iteration 1.
[I 2023-12-18 22:50:20,342] Trial 208 pruned. Trial was pruned at iteration 0.
[I 2023-12-18 22:50:20,413] Trial 209 pruned. Trial was pruned at iteration 0.
[I 2023-12-18 22:50:20,486] Trial 210 pruned. Trial was pruned at iteration 0.
[I 2023-12-18 22:50:20,572] Trial 211 pruned. Trial was pruned at iteration 0.
[I 2023-12-18 22:50:20,641] Trial 212 pruned. Trial was pruned at iteration 0.
[I 2023-12-18 22:50:20,712] Trial 213 pruned. Trial was pruned at iteration 0.
[I 2023-12-18 22:50:20,779] Trial 214 pruned. Trial was pruned at iteration 0.
[I 2023-12-18 22:50:20,849] Trial 215 pruned. Trial was pruned at iteration 0.
[I 2023-12-18 22:50:20,920] Trial 216 pruned. Trial was pruned at iteration 0.
[I 2023-12-18 22:50:21,001] Trial 217 pruned. Trial was pruned at iteration 0.
[I 2023-12-18 22:50:21,082] Trial 218 pruned. Trial was pruned at iteration 0.
[I 2023-12-18 22:50:21,152] Trial 219 pruned. Trial was pruned at iteration 0.
[I 2023-12-18 22:50:21,224] Trial 220 pruned. Trial was pruned at iteration 0.
[I 2023-12-18 22:50:21,290] Trial 221 pruned. Trial was pruned at iteration 0.
[I 2023-12-18 22:50:21,365] Trial 222 pruned. Trial was pruned at iteration 0.
[I 2023-12-18 22:50:21,439] Trial 223 pruned. Trial was pruned at iteration 0.
[I 2023-12-18 22:50:21,527] Trial 224 pruned. Trial was pruned at iteration 0.
[I 2023-12-18 22:50:21,601] Trial 225 pruned. Trial was pruned at iteration 0.
[I 2023-12-18 22:50:21,676] Trial 226 pruned. Trial was pruned at iteration 0.
[I 2023-12-18 22:50:21,746] Trial 227 pruned. Trial was pruned at iteration 0.
[I 2023-12-18 22:50:21,817] Trial 228 pruned. Trial was pruned at iteration 0.
[I 2023-12-18 22:50:21,900] Trial 229 pruned. Trial was pruned at iteration 0.
[I 2023-12-18 22:50:21,985] Trial 230 pruned. Trial was pruned at iteration 0.
[I 2023-12-18 22:50:22,059] Trial 231 pruned. Trial was pruned at iteration 0.
[I 2023-12-18 22:50:22,128] Trial 232 pruned. Trial was pruned at iteration 0.
[I 2023-12-18 22:50:22,200] Trial 233 pruned. Trial was pruned at iteration 0.
[I 2023-12-18 22:50:22,278] Trial 234 pruned. Trial was pruned at iteration 0.
[I 2023-12-18 22:50:22,352] Trial 235 pruned. Trial was pruned at iteration 0.
[I 2023-12-18 22:50:22,429] Trial 236 pruned. Trial was pruned at iteration 0.
[I 2023-12-18 22:50:22,513] Trial 237 pruned. Trial was pruned at iteration 0.
[I 2023-12-18 22:50:22,584] Trial 238 pruned. Trial was pruned at iteration 0.
[I 2023-12-18 22:50:22,661] Trial 239 pruned. Trial was pruned at iteration 0.
[I 2023-12-18 22:50:22,736] Trial 240 pruned. Trial was pruned at iteration 0.
[I 2023-12-18 22:50:22,925] Trial 241 pruned. Trial was pruned at iteration 53.
[I 2023-12-18 22:50:23,006] Trial 242 pruned. Trial was pruned at iteration 0.
[I 2023-12-18 22:50:23,123] Trial 243 pruned. Trial was pruned at iteration 0.
[I 2023-12-18 22:50:23,563] Trial 244 finished with value: 4.3840328062223985 and parameters: {'learning_rate': 0.34131028640689487, 'aft_loss_distribution': 'logistic', 'aft_loss_distribution_scale': 0.9560712732348398, 'max_depth': 6, 'booster': 'gbtree', 'scale_pos_weight': 8.55560119430461, 'alpha': 2.4328792622823583, 'lambda': 8.086290220053723, 'eta': 0.06841128875891381, 'sampling_method': 'uniform', 'subsample': 0.05734716692298539, 'gamma': 5.892872597703608}. Best is trial 1 with value: 4.243578196768486.
[I 2023-12-18 22:50:24,209] Trial 245 pruned. Trial was pruned at iteration 205.
[I 2023-12-18 22:50:24,320] Trial 246 pruned. Trial was pruned at iteration 0.
[I 2023-12-18 22:50:24,436] Trial 247 pruned. Trial was pruned at iteration 0.
[I 2023-12-18 22:50:24,556] Trial 248 pruned. Trial was pruned at iteration 0.
[I 2023-12-18 22:50:24,670] Trial 249 pruned. Trial was pruned at iteration 0.
[I 2023-12-18 22:50:24,791] Trial 250 pruned. Trial was pruned at iteration 0.
[I 2023-12-18 22:50:24,908] Trial 251 pruned. Trial was pruned at iteration 0.
[I 2023-12-18 22:50:25,159] Trial 252 pruned. Trial was pruned at iteration 52.
[I 2023-12-18 22:50:25,272] Trial 253 pruned. Trial was pruned at iteration 0.
[I 2023-12-18 22:50:25,381] Trial 254 pruned. Trial was pruned at iteration 0.
[I 2023-12-18 22:50:25,500] Trial 255 pruned. Trial was pruned at iteration 0.
[I 2023-12-18 22:50:25,615] Trial 256 pruned. Trial was pruned at iteration 0.
[I 2023-12-18 22:50:25,738] Trial 257 pruned. Trial was pruned at iteration 0.
[I 2023-12-18 22:50:25,853] Trial 258 pruned. Trial was pruned at iteration 0.
[I 2023-12-18 22:50:25,974] Trial 259 pruned. Trial was pruned at iteration 0.
[I 2023-12-18 22:50:26,086] Trial 260 pruned. Trial was pruned at iteration 0.
[I 2023-12-18 22:50:26,221] Trial 261 pruned. Trial was pruned at iteration 0.
[I 2023-12-18 22:50:26,336] Trial 262 pruned. Trial was pruned at iteration 0.
[I 2023-12-18 22:50:26,463] Trial 263 pruned. Trial was pruned at iteration 0.
[I 2023-12-18 22:50:26,586] Trial 264 pruned. Trial was pruned at iteration 0.
[I 2023-12-18 22:50:26,699] Trial 265 pruned. Trial was pruned at iteration 0.
[I 2023-12-18 22:50:26,817] Trial 266 pruned. Trial was pruned at iteration 0.
[I 2023-12-18 22:50:26,938] Trial 267 pruned. Trial was pruned at iteration 0.
[I 2023-12-18 22:50:27,055] Trial 268 pruned. Trial was pruned at iteration 0.
[I 2023-12-18 22:50:27,180] Trial 269 pruned. Trial was pruned at iteration 0.
[I 2023-12-18 22:50:27,303] Trial 270 pruned. Trial was pruned at iteration 0.
[I 2023-12-18 22:50:27,420] Trial 271 pruned. Trial was pruned at iteration 0.
[I 2023-12-18 22:50:27,540] Trial 272 pruned. Trial was pruned at iteration 0.
[I 2023-12-18 22:50:27,655] Trial 273 pruned. Trial was pruned at iteration 0.
[I 2023-12-18 22:50:27,769] Trial 274 pruned. Trial was pruned at iteration 0.
[I 2023-12-18 22:50:27,892] Trial 275 pruned. Trial was pruned at iteration 0.
[I 2023-12-18 22:50:28,016] Trial 276 pruned. Trial was pruned at iteration 0.
[I 2023-12-18 22:50:28,122] Trial 277 pruned. Trial was pruned at iteration 0.
[I 2023-12-18 22:50:28,198] Trial 278 pruned. Trial was pruned at iteration 0.
[I 2023-12-18 22:50:28,286] Trial 279 pruned. Trial was pruned at iteration 0.
[I 2023-12-18 22:50:28,368] Trial 280 pruned. Trial was pruned at iteration 0.
[I 2023-12-18 22:50:28,443] Trial 281 pruned. Trial was pruned at iteration 0.
[I 2023-12-18 22:50:28,525] Trial 282 pruned. Trial was pruned at iteration 0.
[I 2023-12-18 22:50:28,728] Trial 283 pruned. Trial was pruned at iteration 53.
[I 2023-12-18 22:50:28,804] Trial 284 pruned. Trial was pruned at iteration 0.
[I 2023-12-18 22:50:29,311] Trial 285 finished with value: inf and parameters: {'learning_rate': 0.7795036941497581, 'aft_loss_distribution': 'normal', 'aft_loss_distribution_scale': 1.0641640501847047, 'max_depth': 9, 'booster': 'gbtree', 'scale_pos_weight': 3.101167805085884, 'alpha': 4.524389027265761, 'lambda': 4.15578173581856, 'eta': 0.31964220472944616, 'sampling_method': 'gradient_based', 'subsample': 0.07928159966050989, 'gamma': 8.382254352898}. Best is trial 1 with value: 4.243578196768486.
[I 2023-12-18 22:50:29,391] Trial 286 pruned. Trial was pruned at iteration 0.
[I 2023-12-18 22:50:29,470] Trial 287 pruned. Trial was pruned at iteration 0.
[I 2023-12-18 22:50:29,546] Trial 288 pruned. Trial was pruned at iteration 0.
[I 2023-12-18 22:50:29,619] Trial 289 pruned. Trial was pruned at iteration 0.
[I 2023-12-18 22:50:29,699] Trial 290 pruned. Trial was pruned at iteration 0.
[I 2023-12-18 22:50:29,769] Trial 291 pruned. Trial was pruned at iteration 0.
[I 2023-12-18 22:50:29,846] Trial 292 pruned. Trial was pruned at iteration 0.
[I 2023-12-18 22:50:29,925] Trial 293 pruned. Trial was pruned at iteration 0.
[I 2023-12-18 22:50:30,002] Trial 294 pruned. Trial was pruned at iteration 0.
[I 2023-12-18 22:50:30,079] Trial 295 pruned. Trial was pruned at iteration 1.
[I 2023-12-18 22:50:30,160] Trial 296 pruned. Trial was pruned at iteration 0.
[I 2023-12-18 22:50:30,236] Trial 297 pruned. Trial was pruned at iteration 0.
[I 2023-12-18 22:50:30,316] Trial 298 pruned. Trial was pruned at iteration 0.
[I 2023-12-18 22:50:30,393] Trial 299 pruned. Trial was pruned at iteration 0.
[I 2023-12-18 22:50:30,476] Trial 300 pruned. Trial was pruned at iteration 0.
[I 2023-12-18 22:50:30,554] Trial 301 pruned. Trial was pruned at iteration 0.
[I 2023-12-18 22:50:30,629] Trial 302 pruned. Trial was pruned at iteration 0.
[I 2023-12-18 22:50:30,702] Trial 303 pruned. Trial was pruned at iteration 0.
[I 2023-12-18 22:50:30,786] Trial 304 pruned. Trial was pruned at iteration 0.
[I 2023-12-18 22:50:30,859] Trial 305 pruned. Trial was pruned at iteration 0.
[I 2023-12-18 22:50:30,939] Trial 306 pruned. Trial was pruned at iteration 0.
[I 2023-12-18 22:50:31,013] Trial 307 pruned. Trial was pruned at iteration 0.
[I 2023-12-18 22:50:31,093] Trial 308 pruned. Trial was pruned at iteration 0.
[I 2023-12-18 22:50:31,178] Trial 309 pruned. Trial was pruned at iteration 0.
[I 2023-12-18 22:50:31,253] Trial 310 pruned. Trial was pruned at iteration 0.
[I 2023-12-18 22:50:31,331] Trial 311 pruned. Trial was pruned at iteration 0.
[I 2023-12-18 22:50:31,420] Trial 312 pruned. Trial was pruned at iteration 0.
[I 2023-12-18 22:50:31,500] Trial 313 pruned. Trial was pruned at iteration 0.
[I 2023-12-18 22:50:31,580] Trial 314 pruned. Trial was pruned at iteration 0.
[I 2023-12-18 22:50:31,657] Trial 315 pruned. Trial was pruned at iteration 0.
[I 2023-12-18 22:50:31,731] Trial 316 pruned. Trial was pruned at iteration 0.
[I 2023-12-18 22:50:31,818] Trial 317 pruned. Trial was pruned at iteration 0.
[I 2023-12-18 22:50:31,898] Trial 318 pruned. Trial was pruned at iteration 0.
[I 2023-12-18 22:50:31,981] Trial 319 pruned. Trial was pruned at iteration 0.
[I 2023-12-18 22:50:32,063] Trial 320 pruned. Trial was pruned at iteration 0.
[I 2023-12-18 22:50:32,433] Trial 321 finished with value: 4.281501552612952 and parameters: {'learning_rate': 0.20955165654651675, 'aft_loss_distribution': 'logistic', 'aft_loss_distribution_scale': 0.7927729572728994, 'max_depth': 7, 'booster': 'gbtree', 'scale_pos_weight': 1.3601515557061015, 'alpha': 5.606278948701727, 'lambda': 7.487525612335013, 'eta': 0.691818372417063, 'sampling_method': 'uniform', 'subsample': 0.19745247593328363, 'gamma': 9.33905335193909}. Best is trial 1 with value: 4.243578196768486.
[I 2023-12-18 22:50:32,522] Trial 322 pruned. Trial was pruned at iteration 0.
[I 2023-12-18 22:50:32,600] Trial 323 pruned. Trial was pruned at iteration 0.
[I 2023-12-18 22:50:32,683] Trial 324 pruned. Trial was pruned at iteration 0.
[I 2023-12-18 22:50:32,762] Trial 325 pruned. Trial was pruned at iteration 0.
[I 2023-12-18 22:50:32,839] Trial 326 pruned. Trial was pruned at iteration 0.
[I 2023-12-18 22:50:32,928] Trial 327 pruned. Trial was pruned at iteration 0.
[I 2023-12-18 22:50:33,011] Trial 328 pruned. Trial was pruned at iteration 0.
[I 2023-12-18 22:50:33,089] Trial 329 pruned. Trial was pruned at iteration 0.
[I 2023-12-18 22:50:33,166] Trial 330 pruned. Trial was pruned at iteration 0.
[I 2023-12-18 22:50:33,262] Trial 331 pruned. Trial was pruned at iteration 0.
[I 2023-12-18 22:50:33,339] Trial 332 pruned. Trial was pruned at iteration 0.
[I 2023-12-18 22:50:33,435] Trial 333 pruned. Trial was pruned at iteration 0.
[I 2023-12-18 22:50:33,518] Trial 334 pruned. Trial was pruned at iteration 0.
[I 2023-12-18 22:50:33,946] Trial 335 finished with value: inf and parameters: {'learning_rate': 0.7838269431388112, 'aft_loss_distribution': 'normal', 'aft_loss_distribution_scale': 1.4645459753656656, 'max_depth': 10, 'booster': 'gbtree', 'scale_pos_weight': 1.9897281267422482, 'alpha': 4.566934752524939, 'lambda': 3.8758711508456076, 'eta': 0.7154864511410635, 'sampling_method': 'uniform', 'subsample': 0.1316622758235284, 'gamma': 0.3235197023131874}. Best is trial 1 with value: 4.243578196768486.
[I 2023-12-18 22:50:34,030] Trial 336 pruned. Trial was pruned at iteration 0.
[I 2023-12-18 22:50:34,113] Trial 337 pruned. Trial was pruned at iteration 0.
[I 2023-12-18 22:50:34,197] Trial 338 pruned. Trial was pruned at iteration 0.
[I 2023-12-18 22:50:34,274] Trial 339 pruned. Trial was pruned at iteration 0.
[I 2023-12-18 22:50:34,355] Trial 340 pruned. Trial was pruned at iteration 0.
[I 2023-12-18 22:50:34,455] Trial 341 pruned. Trial was pruned at iteration 0.
[I 2023-12-18 22:50:34,536] Trial 342 pruned. Trial was pruned at iteration 0.
[I 2023-12-18 22:50:34,617] Trial 343 pruned. Trial was pruned at iteration 0.
[I 2023-12-18 22:50:34,695] Trial 344 pruned. Trial was pruned at iteration 0.
[I 2023-12-18 22:50:34,777] Trial 345 pruned. Trial was pruned at iteration 0.
