[I 2023-12-19 00:26:59,455] Trial 242 finished with value: 2.0198180588189767 and parameters: {'learning_rate': 0.8896548077226059, 'aft_loss_distribution': 'normal', 'aft_loss_distribution_scale': 1.3775486966954664, 'max_depth': 6, 'booster': 'gbtree', 'scale_pos_weight': 0.388416468333172, 'alpha': 5.97832265915902, 'lambda': 2.733737851817661, 'eta': 0.24120244395470505, 'sampling_method': 'uniform', 'subsample': 0.6922918002359503, 'gamma': 6.26559414209136}. Best is trial 214 with value: 2.0180848775033677.
[I 2023-12-19 00:26:59,767] Trial 243 finished with value: inf and parameters: {'learning_rate': 0.8900638931944582, 'aft_loss_distribution': 'normal', 'aft_loss_distribution_scale': 1.3926900305256882, 'max_depth': 6, 'booster': 'gbtree', 'scale_pos_weight': 0.7149539832788283, 'alpha': 5.8834869298068995, 'lambda': 2.93787400099093, 'eta': 0.24917097936118407, 'sampling_method': 'uniform', 'subsample': 0.6863733620496837, 'gamma': 6.275545615927771}. Best is trial 214 with value: 2.0180848775033677.
[I 2023-12-19 00:27:00,049] Trial 244 finished with value: inf and parameters: {'learning_rate': 0.9194986077137859, 'aft_loss_distribution': 'normal', 'aft_loss_distribution_scale': 1.3290521236524822, 'max_depth': 6, 'booster': 'gbtree', 'scale_pos_weight': 0.3956449308527771, 'alpha': 6.208739338934656, 'lambda': 2.663920662387945, 'eta': 0.27533637026205704, 'sampling_method': 'uniform', 'subsample': 0.720345821768429, 'gamma': 6.111092772294386}. Best is trial 214 with value: 2.0180848775033677.
[I 2023-12-19 00:27:00,400] Trial 245 finished with value: 2.0194772078230825 and parameters: {'learning_rate': 0.8752397286206952, 'aft_loss_distribution': 'normal', 'aft_loss_distribution_scale': 1.5832993782840856, 'max_depth': 6, 'booster': 'gbtree', 'scale_pos_weight': 0.5039749686487883, 'alpha': 6.507380528761004, 'lambda': 3.1817437596548936, 'eta': 0.19055530593344602, 'sampling_method': 'uniform', 'subsample': 0.692108467290836, 'gamma': 6.544035908319615}. Best is trial 214 with value: 2.0180848775033677.
[I 2023-12-19 00:27:00,538] Trial 246 pruned. Trial was pruned at iteration 0.
[I 2023-12-19 00:27:00,665] Trial 247 pruned. Trial was pruned at iteration 1.
[I 2023-12-19 00:27:00,796] Trial 248 pruned. Trial was pruned at iteration 0.
[I 2023-12-19 00:27:01,154] Trial 249 finished with value: 2.0205913116036363 and parameters: {'learning_rate': 0.9206827641554651, 'aft_loss_distribution': 'normal', 'aft_loss_distribution_scale': 1.606853208399133, 'max_depth': 5, 'booster': 'gbtree', 'scale_pos_weight': 0.5137142707166875, 'alpha': 6.560346488044567, 'lambda': 3.01371239817833, 'eta': 0.23082367736353243, 'sampling_method': 'uniform', 'subsample': 0.7635694502885947, 'gamma': 6.90396791018469}. Best is trial 214 with value: 2.0180848775033677.
[I 2023-12-19 00:27:01,525] Trial 250 finished with value: 2.0148979947861165 and parameters: {'learning_rate': 0.9248741327297677, 'aft_loss_distribution': 'normal', 'aft_loss_distribution_scale': 1.5381066459746833, 'max_depth': 5, 'booster': 'gbtree', 'scale_pos_weight': 0.5028271646346882, 'alpha': 6.619976404288587, 'lambda': 2.982847221019106, 'eta': 0.23376865268816216, 'sampling_method': 'uniform', 'subsample': 0.7748164223224163, 'gamma': 7.000984570734844}. Best is trial 250 with value: 2.0148979947861165.
[I 2023-12-19 00:27:01,842] Trial 251 finished with value: inf and parameters: {'learning_rate': 0.9280405006182191, 'aft_loss_distribution': 'normal', 'aft_loss_distribution_scale': 1.4750981795510636, 'max_depth': 5, 'booster': 'gbtree', 'scale_pos_weight': 0.514067951819043, 'alpha': 6.799015309064732, 'lambda': 2.960510646046148, 'eta': 0.22505164740127095, 'sampling_method': 'uniform', 'subsample': 0.7830718385029009, 'gamma': 7.08682943324325}. Best is trial 250 with value: 2.0148979947861165.
[I 2023-12-19 00:27:02,124] Trial 252 finished with value: inf and parameters: {'learning_rate': 0.9475929544219751, 'aft_loss_distribution': 'normal', 'aft_loss_distribution_scale': 1.192678824477912, 'max_depth': 5, 'booster': 'gbtree', 'scale_pos_weight': 0.6278541357226323, 'alpha': 6.536991647446156, 'lambda': 3.257419832888157, 'eta': 0.23150015437098315, 'sampling_method': 'uniform', 'subsample': 0.765021917453774, 'gamma': 6.92792487976767}. Best is trial 250 with value: 2.0148979947861165.
[I 2023-12-19 00:27:02,484] Trial 253 finished with value: 2.0208999154167095 and parameters: {'learning_rate': 0.9044372680018745, 'aft_loss_distribution': 'normal', 'aft_loss_distribution_scale': 1.5558948103482144, 'max_depth': 5, 'booster': 'gbtree', 'scale_pos_weight': 0.5012127764611469, 'alpha': 6.398887385472024, 'lambda': 3.7176527103878656, 'eta': 0.17089532009649686, 'sampling_method': 'uniform', 'subsample': 0.7387684341509826, 'gamma': 5.827257697838302}. Best is trial 250 with value: 2.0148979947861165.
[I 2023-12-19 00:27:02,771] Trial 254 finished with value: inf and parameters: {'learning_rate': 0.909968074850971, 'aft_loss_distribution': 'normal', 'aft_loss_distribution_scale': 1.5105943425798045, 'max_depth': 5, 'booster': 'gbtree', 'scale_pos_weight': 0.51765322855909, 'alpha': 6.343621544548129, 'lambda': 3.9407621763845078, 'eta': 0.1697161584902939, 'sampling_method': 'uniform', 'subsample': 0.7397752577662798, 'gamma': 5.363595188308291}. Best is trial 250 with value: 2.0148979947861165.
[I 2023-12-19 00:27:02,896] Trial 255 pruned. Trial was pruned at iteration 0.
[I 2023-12-19 00:27:03,191] Trial 256 finished with value: inf and parameters: {'learning_rate': 0.9382490451510578, 'aft_loss_distribution': 'normal', 'aft_loss_distribution_scale': 1.3042750482288352, 'max_depth': 5, 'booster': 'gbtree', 'scale_pos_weight': 0.45785627868351975, 'alpha': 6.594828120260207, 'lambda': 3.3906148174290536, 'eta': 0.20998427842514264, 'sampling_method': 'uniform', 'subsample': 0.753953092720722, 'gamma': 5.963970616405269}. Best is trial 250 with value: 2.0148979947861165.
[I 2023-12-19 00:27:03,315] Trial 257 pruned. Trial was pruned at iteration 0.
[I 2023-12-19 00:27:03,660] Trial 258 finished with value: 2.0209979835947354 and parameters: {'learning_rate': 0.8796844556304769, 'aft_loss_distribution': 'normal', 'aft_loss_distribution_scale': 1.6364235330957893, 'max_depth': 5, 'booster': 'gbtree', 'scale_pos_weight': 0.41682197835579, 'alpha': 6.246904648979823, 'lambda': 2.842569529169501, 'eta': 0.23936188117328655, 'sampling_method': 'uniform', 'subsample': 0.7288240466844917, 'gamma': 6.191933999091432}. Best is trial 250 with value: 2.0148979947861165.
[I 2023-12-19 00:27:03,753] Trial 259 pruned. Trial was pruned at iteration 0.
[I 2023-12-19 00:27:04,011] Trial 260 finished with value: 2.019103860889023 and parameters: {'learning_rate': 0.8955493476675769, 'aft_loss_distribution': 'normal', 'aft_loss_distribution_scale': 1.5469301908219515, 'max_depth': 5, 'booster': 'gbtree', 'scale_pos_weight': 0.41204715197794856, 'alpha': 7.055948257525014, 'lambda': 2.855286044593714, 'eta': 0.17205961377298395, 'sampling_method': 'uniform', 'subsample': 0.7197688444168585, 'gamma': 6.1677845276853756}. Best is trial 250 with value: 2.0148979947861165.
[I 2023-12-19 00:27:04,100] Trial 261 pruned. Trial was pruned at iteration 0.
[I 2023-12-19 00:27:04,175] Trial 262 pruned. Trial was pruned at iteration 0.
[I 2023-12-19 00:27:04,551] Trial 263 finished with value: 2.0176823529751897 and parameters: {'learning_rate': 0.8844023356735541, 'aft_loss_distribution': 'normal', 'aft_loss_distribution_scale': 1.5384048859558157, 'max_depth': 5, 'booster': 'gbtree', 'scale_pos_weight': 0.6272654838871807, 'alpha': 6.783549105116976, 'lambda': 3.5504963573895956, 'eta': 0.17700751786282265, 'sampling_method': 'uniform', 'subsample': 0.7342069103598154, 'gamma': 6.054727692047248}. Best is trial 250 with value: 2.0148979947861165.
[I 2023-12-19 00:27:04,765] Trial 264 finished with value: inf and parameters: {'learning_rate': 0.8824676424694753, 'aft_loss_distribution': 'normal', 'aft_loss_distribution_scale': 1.4199454138784866, 'max_depth': 5, 'booster': 'gbtree', 'scale_pos_weight': 0.6235448740080621, 'alpha': 6.865377434238605, 'lambda': 3.4974821540419647, 'eta': 0.136782678346668, 'sampling_method': 'uniform', 'subsample': 0.7372895242521103, 'gamma': 6.072882536092958}. Best is trial 250 with value: 2.0148979947861165.
[I 2023-12-19 00:27:04,978] Trial 265 finished with value: inf and parameters: {'learning_rate': 0.9039406119709777, 'aft_loss_distribution': 'normal', 'aft_loss_distribution_scale': 1.5597582942137298, 'max_depth': 5, 'booster': 'gbtree', 'scale_pos_weight': 0.5731175746133276, 'alpha': 7.576985223061186, 'lambda': 3.7040989235234196, 'eta': 0.172595122424476, 'sampling_method': 'uniform', 'subsample': 0.7243802273313245, 'gamma': 5.851632835124882}. Best is trial 250 with value: 2.0148979947861165.
[I 2023-12-19 00:27:05,061] Trial 266 pruned. Trial was pruned at iteration 0.
[I 2023-12-19 00:27:05,399] Trial 267 finished with value: 2.021623660493112 and parameters: {'learning_rate': 0.8858165658846101, 'aft_loss_distribution': 'normal', 'aft_loss_distribution_scale': 1.5802486667098516, 'max_depth': 5, 'booster': 'gbtree', 'scale_pos_weight': 0.3895414496621046, 'alpha': 6.69280768430267, 'lambda': 2.836267480707533, 'eta': 0.21813860157747547, 'sampling_method': 'uniform', 'subsample': 0.7329276175968904, 'gamma': 5.932919118683074}. Best is trial 250 with value: 2.0148979947861165.
[I 2023-12-19 00:27:05,607] Trial 268 finished with value: inf and parameters: {'learning_rate': 0.8916819632865106, 'aft_loss_distribution': 'normal', 'aft_loss_distribution_scale': 1.4807420224102428, 'max_depth': 5, 'booster': 'gbtree', 'scale_pos_weight': 0.40145063094275396, 'alpha': 6.724678205508736, 'lambda': 3.220471188139488, 'eta': 0.15722093092771228, 'sampling_method': 'uniform', 'subsample': 0.73825460662209, 'gamma': 5.051219996028428}. Best is trial 250 with value: 2.0148979947861165.
[I 2023-12-19 00:27:05,685] Trial 269 pruned. Trial was pruned at iteration 0.
[I 2023-12-19 00:27:05,763] Trial 270 pruned. Trial was pruned at iteration 0.
[I 2023-12-19 00:27:06,028] Trial 271 finished with value: 2.016398925788648 and parameters: {'learning_rate': 0.9250376371538136, 'aft_loss_distribution': 'normal', 'aft_loss_distribution_scale': 1.5819106816660837, 'max_depth': 5, 'booster': 'gbtree', 'scale_pos_weight': 0.423973951465344, 'alpha': 6.5771335339616375, 'lambda': 3.5508977424948687, 'eta': 0.21758951365424534, 'sampling_method': 'uniform', 'subsample': 0.7971136545232148, 'gamma': 6.084139523241883}. Best is trial 250 with value: 2.0148979947861165.
[I 2023-12-19 00:27:06,232] Trial 272 finished with value: inf and parameters: {'learning_rate': 0.9262955597593259, 'aft_loss_distribution': 'normal', 'aft_loss_distribution_scale': 1.4662974358129195, 'max_depth': 5, 'booster': 'gbtree', 'scale_pos_weight': 0.4154578757036909, 'alpha': 6.5135798462612176, 'lambda': 3.4913032273535163, 'eta': 0.1856726854309302, 'sampling_method': 'uniform', 'subsample': 0.7985822738971964, 'gamma': 6.036723134404427}. Best is trial 250 with value: 2.0148979947861165.
[I 2023-12-19 00:27:06,464] Trial 273 finished with value: inf and parameters: {'learning_rate': 0.9378250791178536, 'aft_loss_distribution': 'normal', 'aft_loss_distribution_scale': 1.3385375028283908, 'max_depth': 5, 'booster': 'gbtree', 'scale_pos_weight': 0.36289666520916003, 'alpha': 6.719640803673355, 'lambda': 3.5224702702150514, 'eta': 0.2298907246019854, 'sampling_method': 'uniform', 'subsample': 0.8337844377750564, 'gamma': 5.512755787236961}. Best is trial 250 with value: 2.0148979947861165.
[I 2023-12-19 00:27:06,553] Trial 274 pruned. Trial was pruned at iteration 1.
[I 2023-12-19 00:27:06,761] Trial 275 finished with value: inf and parameters: {'learning_rate': 0.8757495952242609, 'aft_loss_distribution': 'normal', 'aft_loss_distribution_scale': 1.6036257768538469, 'max_depth': 5, 'booster': 'gbtree', 'scale_pos_weight': 0.429689967457865, 'alpha': 6.541505091283682, 'lambda': 3.2444819574482096, 'eta': 0.15464943239055362, 'sampling_method': 'uniform', 'subsample': 0.7851389921205753, 'gamma': 5.927065396777279}. Best is trial 250 with value: 2.0148979947861165.
[I 2023-12-19 00:27:06,854] Trial 276 pruned. Trial was pruned at iteration 0.
[I 2023-12-19 00:27:07,053] Trial 277 finished with value: inf and parameters: {'learning_rate': 0.9242606305409434, 'aft_loss_distribution': 'normal', 'aft_loss_distribution_scale': 1.5949170545558282, 'max_depth': 5, 'booster': 'gbtree', 'scale_pos_weight': 0.8915622474797856, 'alpha': 6.451835982297158, 'lambda': 3.6839809472607667, 'eta': 0.11992089384038951, 'sampling_method': 'uniform', 'subsample': 0.7480022704618102, 'gamma': 6.483767415424723}. Best is trial 250 with value: 2.0148979947861165.
[I 2023-12-19 00:27:07,137] Trial 278 pruned. Trial was pruned at iteration 0.
[I 2023-12-19 00:27:07,349] Trial 279 finished with value: inf and parameters: {'learning_rate': 0.9484162268008217, 'aft_loss_distribution': 'normal', 'aft_loss_distribution_scale': 1.3477422398608159, 'max_depth': 5, 'booster': 'gbtree', 'scale_pos_weight': 0.5192042620063934, 'alpha': 6.2122696954300825, 'lambda': 3.031756769954588, 'eta': 0.20469965018243833, 'sampling_method': 'uniform', 'subsample': 0.75723411025642, 'gamma': 6.294793660137334}. Best is trial 250 with value: 2.0148979947861165.
[I 2023-12-19 00:27:07,431] Trial 280 pruned. Trial was pruned at iteration 0.
[I 2023-12-19 00:27:07,509] Trial 281 pruned. Trial was pruned at iteration 0.
[I 2023-12-19 00:27:07,720] Trial 282 finished with value: inf and parameters: {'learning_rate': 0.9200707705796514, 'aft_loss_distribution': 'normal', 'aft_loss_distribution_scale': 1.4015109483760986, 'max_depth': 5, 'booster': 'gbtree', 'scale_pos_weight': 0.35954207194629706, 'alpha': 6.342098072326698, 'lambda': 2.8278259023470795, 'eta': 0.20360247474456353, 'sampling_method': 'uniform', 'subsample': 0.7253713932615687, 'gamma': 6.029323285915186}. Best is trial 250 with value: 2.0148979947861165.
[I 2023-12-19 00:27:07,801] Trial 283 pruned. Trial was pruned at iteration 0.
[I 2023-12-19 00:27:07,896] Trial 284 pruned. Trial was pruned at iteration 2.
[I 2023-12-19 00:27:08,101] Trial 285 finished with value: inf and parameters: {'learning_rate': 0.9369812856235419, 'aft_loss_distribution': 'normal', 'aft_loss_distribution_scale': 1.6295185110189627, 'max_depth': 5, 'booster': 'gbtree', 'scale_pos_weight': 0.3090402997769709, 'alpha': 5.818284161111933, 'lambda': 2.700616089557378, 'eta': 0.18427415063648325, 'sampling_method': 'uniform', 'subsample': 0.7428056227049624, 'gamma': 6.743490535219492}. Best is trial 250 with value: 2.0148979947861165.
[I 2023-12-19 00:27:08,189] Trial 286 pruned. Trial was pruned at iteration 0.
[I 2023-12-19 00:27:08,394] Trial 287 finished with value: inf and parameters: {'learning_rate': 0.8897580737928703, 'aft_loss_distribution': 'normal', 'aft_loss_distribution_scale': 1.4464237899375683, 'max_depth': 5, 'booster': 'gbtree', 'scale_pos_weight': 0.6232663403367389, 'alpha': 6.3977559248093225, 'lambda': 2.9340724001095295, 'eta': 0.24077358963208595, 'sampling_method': 'uniform', 'subsample': 0.7755152117427165, 'gamma': 6.428456473067238}. Best is trial 250 with value: 2.0148979947861165.
[I 2023-12-19 00:27:08,491] Trial 288 pruned. Trial was pruned at iteration 2.
[I 2023-12-19 00:27:08,704] Trial 289 finished with value: inf and parameters: {'learning_rate': 0.8763623767102946, 'aft_loss_distribution': 'normal', 'aft_loss_distribution_scale': 1.5616593216602903, 'max_depth': 6, 'booster': 'gbtree', 'scale_pos_weight': 0.43389251490179603, 'alpha': 6.662688066312491, 'lambda': 2.654741028723471, 'eta': 0.22082977219556907, 'sampling_method': 'uniform', 'subsample': 0.7951109420380094, 'gamma': 7.258741468227873}. Best is trial 250 with value: 2.0148979947861165.
[I 2023-12-19 00:27:08,925] Trial 290 finished with value: inf and parameters: {'learning_rate': 0.951693692376959, 'aft_loss_distribution': 'normal', 'aft_loss_distribution_scale': 1.6927212457147323, 'max_depth': 6, 'booster': 'gbtree', 'scale_pos_weight': 0.5424668151240737, 'alpha': 6.041004974135906, 'lambda': 3.168705465952174, 'eta': 0.18677094087307936, 'sampling_method': 'uniform', 'subsample': 0.7379261283200894, 'gamma': 6.136625557556845}. Best is trial 250 with value: 2.0148979947861165.
[I 2023-12-19 00:27:09,149] Trial 291 finished with value: inf and parameters: {'learning_rate': 0.9279322283664176, 'aft_loss_distribution': 'normal', 'aft_loss_distribution_scale': 1.3230645667164258, 'max_depth': 5, 'booster': 'gbtree', 'scale_pos_weight': 0.31875154515992216, 'alpha': 6.495039365466495, 'lambda': 3.785243980785179, 'eta': 0.20784622239368614, 'sampling_method': 'uniform', 'subsample': 0.7157180969370648, 'gamma': 6.650406407777971}. Best is trial 250 with value: 2.0148979947861165.
[I 2023-12-19 00:27:09,245] Trial 292 pruned. Trial was pruned at iteration 1.
[I 2023-12-19 00:27:09,328] Trial 293 pruned. Trial was pruned at iteration 0.
[I 2023-12-19 00:27:09,536] Trial 294 finished with value: inf and parameters: {'learning_rate': 0.8919337223853798, 'aft_loss_distribution': 'normal', 'aft_loss_distribution_scale': 1.6210356226563147, 'max_depth': 6, 'booster': 'gbtree', 'scale_pos_weight': 0.3858620126475634, 'alpha': 5.966626022413799, 'lambda': 2.5516634799408324, 'eta': 0.16754550868271545, 'sampling_method': 'uniform', 'subsample': 0.706308042673932, 'gamma': 6.508456794407212}. Best is trial 250 with value: 2.0148979947861165.
[I 2023-12-19 00:27:09,619] Trial 295 pruned. Trial was pruned at iteration 0.
[I 2023-12-19 00:27:09,705] Trial 296 pruned. Trial was pruned at iteration 2.
[I 2023-12-19 00:27:09,923] Trial 297 finished with value: inf and parameters: {'learning_rate': 0.9162673484877026, 'aft_loss_distribution': 'normal', 'aft_loss_distribution_scale': 1.4169828546879906, 'max_depth': 6, 'booster': 'gbtree', 'scale_pos_weight': 0.6956013583400058, 'alpha': 7.080771575149434, 'lambda': 2.816513617635712, 'eta': 0.19507957399700201, 'sampling_method': 'uniform', 'subsample': 0.7285111667037064, 'gamma': 6.711566819998498}. Best is trial 250 with value: 2.0148979947861165.
[I 2023-12-19 00:27:10,176] Trial 298 finished with value: inf and parameters: {'learning_rate': 0.9396402703437841, 'aft_loss_distribution': 'normal', 'aft_loss_distribution_scale': 1.6815454297185588, 'max_depth': 6, 'booster': 'gbtree', 'scale_pos_weight': 0.3964475921698262, 'alpha': 6.55663874016297, 'lambda': 3.872358268377497, 'eta': 0.21804621190328735, 'sampling_method': 'uniform', 'subsample': 0.7582818434024211, 'gamma': 7.181797051279644}. Best is trial 250 with value: 2.0148979947861165.
[I 2023-12-19 00:27:10,262] Trial 299 pruned. Trial was pruned at iteration 0.
[I 2023-12-19 00:27:10,343] Trial 300 pruned. Trial was pruned at iteration 0.
[I 2023-12-19 00:27:10,419] Trial 301 pruned. Trial was pruned at iteration 0.
[I 2023-12-19 00:27:10,704] Trial 302 finished with value: 2.014644627836659 and parameters: {'learning_rate': 0.8958241920656538, 'aft_loss_distribution': 'normal', 'aft_loss_distribution_scale': 1.523618358739584, 'max_depth': 5, 'booster': 'gbtree', 'scale_pos_weight': 0.4401723670024271, 'alpha': 6.4485911250932135, 'lambda': 3.213055025295731, 'eta': 0.20215984410076443, 'sampling_method': 'uniform', 'subsample': 0.7971321524776521, 'gamma': 6.60192841268395}. Best is trial 302 with value: 2.014644627836659.
[I 2023-12-19 00:27:10,799] Trial 303 pruned. Trial was pruned at iteration 0.
[I 2023-12-19 00:27:10,876] Trial 304 pruned. Trial was pruned at iteration 0.
[I 2023-12-19 00:27:10,963] Trial 305 pruned. Trial was pruned at iteration 0.
[I 2023-12-19 00:27:11,259] Trial 306 finished with value: 2.0165005113918504 and parameters: {'learning_rate': 0.8790672885727959, 'aft_loss_distribution': 'normal', 'aft_loss_distribution_scale': 1.5088992314307597, 'max_depth': 5, 'booster': 'gbtree', 'scale_pos_weight': 0.5635036957110268, 'alpha': 6.533942421401144, 'lambda': 3.1303921835193522, 'eta': 0.18428124743385574, 'sampling_method': 'uniform', 'subsample': 0.7291298624426306, 'gamma': 6.46294158366357}. Best is trial 302 with value: 2.014644627836659.
[I 2023-12-19 00:27:11,550] Trial 307 finished with value: 2.018344994258143 and parameters: {'learning_rate': 0.8980556880728129, 'aft_loss_distribution': 'normal', 'aft_loss_distribution_scale': 1.5103203542710983, 'max_depth': 5, 'booster': 'gbtree', 'scale_pos_weight': 0.6006559542587784, 'alpha': 6.235720088008784, 'lambda': 3.447298587885427, 'eta': 0.17932209589647347, 'sampling_method': 'uniform', 'subsample': 0.7294749323482842, 'gamma': 6.455698853870319}. Best is trial 302 with value: 2.014644627836659.
[I 2023-12-19 00:27:11,756] Trial 308 finished with value: inf and parameters: {'learning_rate': 0.9007553518416253, 'aft_loss_distribution': 'normal', 'aft_loss_distribution_scale': 1.4446605563678334, 'max_depth': 5, 'booster': 'gbtree', 'scale_pos_weight': 0.7650189077651464, 'alpha': 6.275161635318483, 'lambda': 3.4352654732722296, 'eta': 0.164530792656856, 'sampling_method': 'uniform', 'subsample': 0.7324361170355874, 'gamma': 6.479368722831993}. Best is trial 302 with value: 2.014644627836659.
[I 2023-12-19 00:27:11,836] Trial 309 pruned. Trial was pruned at iteration 0.
[I 2023-12-19 00:27:12,034] Trial 310 finished with value: inf and parameters: {'learning_rate': 0.8783356756925562, 'aft_loss_distribution': 'normal', 'aft_loss_distribution_scale': 1.492162912698408, 'max_depth': 5, 'booster': 'gbtree', 'scale_pos_weight': 0.6973827938524062, 'alpha': 6.538311271839135, 'lambda': 3.5764276022356984, 'eta': 0.14321703725596158, 'sampling_method': 'uniform', 'subsample': 0.8442475127758406, 'gamma': 6.74498553742114}. Best is trial 302 with value: 2.014644627836659.
[I 2023-12-19 00:27:12,123] Trial 311 pruned. Trial was pruned at iteration 1.
