[I 2023-12-21 03:57:16,240] Trial 31 finished with value: 1.9830016608603946 and parameters: {'learning_rate': 0.8582482186164232, 'aft_loss_distribution': 'normal', 'aft_loss_distribution_scale': 2.416617179510803, 'max_depth': 4, 'booster': 'gbtree', 'scale_pos_weight': 2.220835072590778, 'alpha': 5.022580686359363, 'lambda': 6.382767871292094, 'eta': 0.9414112321412307, 'sampling_method': 'gradient_based', 'subsample': 0.4264623458126828, 'gamma': 7.269884655580265}. Best is trial 18 with value: 1.8979708364917565.
[I 2023-12-21 03:57:16,681] Trial 32 finished with value: 1.945442161855158 and parameters: {'learning_rate': 0.9201362111544189, 'aft_loss_distribution': 'normal', 'aft_loss_distribution_scale': 2.042851614038283, 'max_depth': 3, 'booster': 'gbtree', 'scale_pos_weight': 2.645926553841321, 'alpha': 5.651112324237684, 'lambda': 6.639865515662245, 'eta': 0.8225829734005153, 'sampling_method': 'gradient_based', 'subsample': 0.4394137311128443, 'gamma': 5.96453951620791}. Best is trial 18 with value: 1.8979708364917565.
[I 2023-12-21 03:57:16,976] Trial 33 finished with value: 1.9027073753181223 and parameters: {'learning_rate': 0.9567591311759599, 'aft_loss_distribution': 'normal', 'aft_loss_distribution_scale': 1.221540246940663, 'max_depth': 3, 'booster': 'gbtree', 'scale_pos_weight': 2.6888453904168816, 'alpha': 5.955884715792248, 'lambda': 7.641344878732609, 'eta': 0.8211764614173311, 'sampling_method': 'gradient_based', 'subsample': 0.6721292726185912, 'gamma': 7.57680008535827}. Best is trial 18 with value: 1.8979708364917565.
[I 2023-12-21 03:57:17,231] Trial 34 finished with value: 1.9114423683568278 and parameters: {'learning_rate': 0.9319642261123323, 'aft_loss_distribution': 'normal', 'aft_loss_distribution_scale': 1.1635195284852515, 'max_depth': 3, 'booster': 'gbtree', 'scale_pos_weight': 2.729818110922521, 'alpha': 5.799022194706711, 'lambda': 7.594229587164646, 'eta': 0.8364498269448924, 'sampling_method': 'gradient_based', 'subsample': 0.6020086644438154, 'gamma': 7.5733151814603605}. Best is trial 18 with value: 1.8979708364917565.
[I 2023-12-21 03:57:17,290] Trial 35 pruned. Trial was pruned at iteration 0.
[I 2023-12-21 03:57:17,355] Trial 36 pruned. Trial was pruned at iteration 0.
[I 2023-12-21 03:57:17,405] Trial 37 pruned. Trial was pruned at iteration 0.
[I 2023-12-21 03:57:17,452] Trial 38 pruned. Trial was pruned at iteration 0.
[I 2023-12-21 03:57:17,501] Trial 39 pruned. Trial was pruned at iteration 1.
[I 2023-12-21 03:57:17,554] Trial 40 pruned. Trial was pruned at iteration 0.
[I 2023-12-21 03:57:18,079] Trial 41 finished with value: 1.9295077114260213 and parameters: {'learning_rate': 0.834228602390508, 'aft_loss_distribution': 'normal', 'aft_loss_distribution_scale': 1.8503956338483345, 'max_depth': 3, 'booster': 'gbtree', 'scale_pos_weight': 2.6731633249973408, 'alpha': 5.941986100192718, 'lambda': 6.9336774891078665, 'eta': 0.8306215436159974, 'sampling_method': 'gradient_based', 'subsample': 0.4929733695963567, 'gamma': 6.048672920335502}. Best is trial 18 with value: 1.8979708364917565.
[I 2023-12-21 03:57:18,698] Trial 42 finished with value: 1.9122511096864703 and parameters: {'learning_rate': 0.831183130034605, 'aft_loss_distribution': 'normal', 'aft_loss_distribution_scale': 1.612094932952348, 'max_depth': 3, 'booster': 'gbtree', 'scale_pos_weight': 2.7114148241667153, 'alpha': 6.873598832096154, 'lambda': 7.294933776701894, 'eta': 0.7821223371505679, 'sampling_method': 'gradient_based', 'subsample': 0.5409792081588587, 'gamma': 7.0598246892346035}. Best is trial 18 with value: 1.8979708364917565.
[I 2023-12-21 03:57:18,753] Trial 43 pruned. Trial was pruned at iteration 0.
[I 2023-12-21 03:57:18,803] Trial 44 pruned. Trial was pruned at iteration 0.
[I 2023-12-21 03:57:18,855] Trial 45 pruned. Trial was pruned at iteration 0.
[I 2023-12-21 03:57:18,908] Trial 46 pruned. Trial was pruned at iteration 0.
[I 2023-12-21 03:57:18,958] Trial 47 pruned. Trial was pruned at iteration 0.
[I 2023-12-21 03:57:19,007] Trial 48 pruned. Trial was pruned at iteration 0.
[I 2023-12-21 03:57:19,066] Trial 49 pruned. Trial was pruned at iteration 0.
[I 2023-12-21 03:57:19,116] Trial 50 pruned. Trial was pruned at iteration 0.
[I 2023-12-21 03:57:19,487] Trial 51 finished with value: 1.9264313942971862 and parameters: {'learning_rate': 0.8743160930225669, 'aft_loss_distribution': 'normal', 'aft_loss_distribution_scale': 1.7949785625667012, 'max_depth': 4, 'booster': 'gbtree', 'scale_pos_weight': 2.1259520395740856, 'alpha': 5.264960671122644, 'lambda': 6.744292155721369, 'eta': 0.9040583217226502, 'sampling_method': 'gradient_based', 'subsample': 0.4797049375832608, 'gamma': 6.438603443834294}. Best is trial 18 with value: 1.8979708364917565.
[I 2023-12-21 03:57:19,538] Trial 52 pruned. Trial was pruned at iteration 0.
[I 2023-12-21 03:57:20,063] Trial 53 finished with value: 1.9138216636585033 and parameters: {'learning_rate': 0.9351657732292822, 'aft_loss_distribution': 'normal', 'aft_loss_distribution_scale': 1.6853243333454957, 'max_depth': 3, 'booster': 'gbtree', 'scale_pos_weight': 2.7345534859621554, 'alpha': 5.247305618797356, 'lambda': 6.6751592335453624, 'eta': 0.8895828975494009, 'sampling_method': 'gradient_based', 'subsample': 0.5210828090477124, 'gamma': 5.6918744095293}. Best is trial 18 with value: 1.8979708364917565.
[I 2023-12-21 03:57:20,124] Trial 54 pruned. Trial was pruned at iteration 0.
[I 2023-12-21 03:57:20,178] Trial 55 pruned. Trial was pruned at iteration 1.
[I 2023-12-21 03:57:20,233] Trial 56 pruned. Trial was pruned at iteration 1.
[I 2023-12-21 03:57:20,292] Trial 57 pruned. Trial was pruned at iteration 0.
[I 2023-12-21 03:57:20,346] Trial 58 pruned. Trial was pruned at iteration 0.
[I 2023-12-21 03:57:20,665] Trial 59 finished with value: 1.9184437032434696 and parameters: {'learning_rate': 0.9447753945993761, 'aft_loss_distribution': 'normal', 'aft_loss_distribution_scale': 1.1338491580078103, 'max_depth': 4, 'booster': 'gbtree', 'scale_pos_weight': 1.921341123840494, 'alpha': 5.357708043372058, 'lambda': 6.093299992373916, 'eta': 0.751760549172903, 'sampling_method': 'gradient_based', 'subsample': 0.6643344591775014, 'gamma': 8.228236183875586}. Best is trial 18 with value: 1.8979708364917565.
[I 2023-12-21 03:57:20,720] Trial 60 pruned. Trial was pruned at iteration 0.
[I 2023-12-21 03:57:20,775] Trial 61 pruned. Trial was pruned at iteration 1.
[I 2023-12-21 03:57:21,091] Trial 62 finished with value: 1.926599204462876 and parameters: {'learning_rate': 0.8667383837213573, 'aft_loss_distribution': 'normal', 'aft_loss_distribution_scale': 1.7297895495577658, 'max_depth': 4, 'booster': 'gbtree', 'scale_pos_weight': 1.4862459116498892, 'alpha': 6.144160881558237, 'lambda': 6.602884564208361, 'eta': 0.8447335333065303, 'sampling_method': 'gradient_based', 'subsample': 0.7589993287968261, 'gamma': 8.611709445767456}. Best is trial 18 with value: 1.8979708364917565.
[I 2023-12-21 03:57:21,578] Trial 63 finished with value: 1.895409823674203 and parameters: {'learning_rate': 0.9218198595816247, 'aft_loss_distribution': 'normal', 'aft_loss_distribution_scale': 1.3639974279330234, 'max_depth': 3, 'booster': 'gbtree', 'scale_pos_weight': 2.0944532127699946, 'alpha': 4.4254780324081455, 'lambda': 7.805532930010817, 'eta': 0.695500926631871, 'sampling_method': 'gradient_based', 'subsample': 0.4613805321303713, 'gamma': 7.736122227426323}. Best is trial 63 with value: 1.895409823674203.
[I 2023-12-21 03:57:22,000] Trial 64 finished with value: 1.900953354101887 and parameters: {'learning_rate': 0.9302725286593068, 'aft_loss_distribution': 'normal', 'aft_loss_distribution_scale': 1.3017677153566414, 'max_depth': 3, 'booster': 'gbtree', 'scale_pos_weight': 1.1849343819425489, 'alpha': 4.551350809029324, 'lambda': 7.689762302148754, 'eta': 0.7530665174713366, 'sampling_method': 'gradient_based', 'subsample': 0.6600576582487577, 'gamma': 7.768410217557846}. Best is trial 63 with value: 1.895409823674203.
[I 2023-12-21 03:57:22,085] Trial 65 pruned. Trial was pruned at iteration 0.
[I 2023-12-21 03:57:22,170] Trial 66 pruned. Trial was pruned at iteration 0.
[I 2023-12-21 03:57:22,263] Trial 67 pruned. Trial was pruned at iteration 0.
[I 2023-12-21 03:57:22,349] Trial 68 pruned. Trial was pruned at iteration 0.
[I 2023-12-21 03:57:22,427] Trial 69 pruned. Trial was pruned at iteration 0.
[I 2023-12-21 03:57:22,511] Trial 70 pruned. Trial was pruned at iteration 0.
[I 2023-12-21 03:57:22,840] Trial 71 finished with value: 1.9147142948097875 and parameters: {'learning_rate': 0.9414242412766602, 'aft_loss_distribution': 'normal', 'aft_loss_distribution_scale': 1.1554012842686896, 'max_depth': 4, 'booster': 'gbtree', 'scale_pos_weight': 1.773109027213608, 'alpha': 6.354420554992609, 'lambda': 7.226961074624452, 'eta': 0.05976239568133279, 'sampling_method': 'gradient_based', 'subsample': 0.6471868394320988, 'gamma': 8.275455701940874}. Best is trial 63 with value: 1.895409823674203.
[I 2023-12-21 03:57:23,882] Trial 72 finished with value: 1.9069476753919423 and parameters: {'learning_rate': 0.9692683127739923, 'aft_loss_distribution': 'normal', 'aft_loss_distribution_scale': 1.387485138657935, 'max_depth': 3, 'booster': 'gbtree', 'scale_pos_weight': 1.7398055947871138, 'alpha': 6.3821132328982895, 'lambda': 7.394644598418833, 'eta': 0.08139348312895829, 'sampling_method': 'gradient_based', 'subsample': 0.5203819959000028, 'gamma': 8.733802122377291}. Best is trial 63 with value: 1.895409823674203.
[I 2023-12-21 03:57:23,982] Trial 73 pruned. Trial was pruned at iteration 1.
[I 2023-12-21 03:57:24,068] Trial 74 pruned. Trial was pruned at iteration 0.
[I 2023-12-21 03:57:24,161] Trial 75 pruned. Trial was pruned at iteration 0.
[I 2023-12-21 03:57:24,251] Trial 76 pruned. Trial was pruned at iteration 1.
[I 2023-12-21 03:57:24,853] Trial 77 finished with value: 1.9104299615350773 and parameters: {'learning_rate': 0.9655925365684641, 'aft_loss_distribution': 'normal', 'aft_loss_distribution_scale': 1.284344326728255, 'max_depth': 3, 'booster': 'gbtree', 'scale_pos_weight': 2.59634773525131, 'alpha': 4.924271919509293, 'lambda': 7.5930557898008, 'eta': 0.39784606435556996, 'sampling_method': 'uniform', 'subsample': 0.3040758712272618, 'gamma': 9.393307366715794}. Best is trial 63 with value: 1.895409823674203.
[I 2023-12-21 03:57:24,939] Trial 78 pruned. Trial was pruned at iteration 0.
[I 2023-12-21 03:57:25,026] Trial 79 pruned. Trial was pruned at iteration 0.
[I 2023-12-21 03:57:25,115] Trial 80 pruned. Trial was pruned at iteration 1.
[I 2023-12-21 03:57:25,208] Trial 81 pruned. Trial was pruned at iteration 2.
[I 2023-12-21 03:57:25,742] Trial 82 finished with value: 1.921997000561814 and parameters: {'learning_rate': 0.8912035352736732, 'aft_loss_distribution': 'normal', 'aft_loss_distribution_scale': 1.6854453824207243, 'max_depth': 3, 'booster': 'gbtree', 'scale_pos_weight': 2.459545933150566, 'alpha': 4.187501645967408, 'lambda': 7.882672313157958, 'eta': 0.5371322430075305, 'sampling_method': 'uniform', 'subsample': 0.33442992770672975, 'gamma': 9.02048775840649}. Best is trial 63 with value: 1.895409823674203.
[I 2023-12-21 03:57:25,826] Trial 83 pruned. Trial was pruned at iteration 0.
[I 2023-12-21 03:57:25,912] Trial 84 pruned. Trial was pruned at iteration 0.
[I 2023-12-21 03:57:25,973] Trial 85 pruned. Trial was pruned at iteration 0.
[I 2023-12-21 03:57:26,027] Trial 86 pruned. Trial was pruned at iteration 0.
[I 2023-12-21 03:57:26,081] Trial 87 pruned. Trial was pruned at iteration 0.
[I 2023-12-21 03:57:26,137] Trial 88 pruned. Trial was pruned at iteration 0.
[I 2023-12-21 03:57:26,199] Trial 89 pruned. Trial was pruned at iteration 1.
[I 2023-12-21 03:57:26,558] Trial 90 finished with value: 1.9103127547481242 and parameters: {'learning_rate': 0.9998509976436127, 'aft_loss_distribution': 'normal', 'aft_loss_distribution_scale': 1.5216455521535937, 'max_depth': 3, 'booster': 'gbtree', 'scale_pos_weight': 2.148895876145612, 'alpha': 9.989806227869192, 'lambda': 1.8377124113787633, 'eta': 0.8027510795267753, 'sampling_method': 'gradient_based', 'subsample': 0.6171691903736551, 'gamma': 8.830984853911103}. Best is trial 63 with value: 1.895409823674203.
[I 2023-12-21 03:57:27,000] Trial 91 finished with value: 1.9180726475078465 and parameters: {'learning_rate': 0.953540705065907, 'aft_loss_distribution': 'normal', 'aft_loss_distribution_scale': 1.6234846940188388, 'max_depth': 3, 'booster': 'gbtree', 'scale_pos_weight': 2.4366463327553087, 'alpha': 9.633592302016888, 'lambda': 1.9014995531017735, 'eta': 0.38674940740575425, 'sampling_method': 'gradient_based', 'subsample': 0.6118527806418697, 'gamma': 8.961592279346}. Best is trial 63 with value: 1.895409823674203.
[I 2023-12-21 03:57:27,079] Trial 92 pruned. Trial was pruned at iteration 2.
[I 2023-12-21 03:57:27,150] Trial 93 pruned. Trial was pruned at iteration 0.
[I 2023-12-21 03:57:27,209] Trial 94 pruned. Trial was pruned at iteration 0.
[I 2023-12-21 03:57:27,431] Trial 95 finished with value: inf and parameters: {'learning_rate': 0.9702103584111639, 'aft_loss_distribution': 'normal', 'aft_loss_distribution_scale': 1.5490634539043415, 'max_depth': 4, 'booster': 'gbtree', 'scale_pos_weight': 1.8536650531176084, 'alpha': 0.6388577098635189, 'lambda': 3.7189650535389136, 'eta': 0.8842941475298743, 'sampling_method': 'gradient_based', 'subsample': 0.49915939507545615, 'gamma': 8.521915215587457}. Best is trial 63 with value: 1.895409823674203.
[I 2023-12-21 03:57:27,491] Trial 96 pruned. Trial was pruned at iteration 0.
[I 2023-12-21 03:57:27,548] Trial 97 pruned. Trial was pruned at iteration 1.
[I 2023-12-21 03:57:27,620] Trial 98 pruned. Trial was pruned at iteration 0.
[I 2023-12-21 03:57:27,684] Trial 99 pruned. Trial was pruned at iteration 0.
[I 2023-12-21 03:57:27,739] Trial 100 pruned. Trial was pruned at iteration 0.
[I 2023-12-21 03:57:27,797] Trial 101 pruned. Trial was pruned at iteration 0.
[I 2023-12-21 03:57:28,096] Trial 102 finished with value: 1.9085379135482632 and parameters: {'learning_rate': 0.9752963282296443, 'aft_loss_distribution': 'normal', 'aft_loss_distribution_scale': 1.487840470751341, 'max_depth': 4, 'booster': 'gbtree', 'scale_pos_weight': 1.225769568828622, 'alpha': 6.3959602359688965, 'lambda': 7.259189719886786, 'eta': 0.10458208341273234, 'sampling_method': 'gradient_based', 'subsample': 0.6009861314224406, 'gamma': 8.3863146509026}. Best is trial 63 with value: 1.895409823674203.
[I 2023-12-21 03:57:28,434] Trial 103 finished with value: 1.9087115539457866 and parameters: {'learning_rate': 0.976364628471021, 'aft_loss_distribution': 'normal', 'aft_loss_distribution_scale': 1.4974185598914673, 'max_depth': 3, 'booster': 'gbtree', 'scale_pos_weight': 0.8453156541984095, 'alpha': 4.516394043334818, 'lambda': 7.8563280917180585, 'eta': 0.1755814760375249, 'sampling_method': 'gradient_based', 'subsample': 0.6088239528187467, 'gamma': 9.190099298697014}. Best is trial 63 with value: 1.895409823674203.
[I 2023-12-21 03:57:28,763] Trial 104 finished with value: 1.9051416039896372 and parameters: {'learning_rate': 0.9781722226386035, 'aft_loss_distribution': 'normal', 'aft_loss_distribution_scale': 1.5137735469215556, 'max_depth': 4, 'booster': 'gbtree', 'scale_pos_weight': 0.8007590883578584, 'alpha': 4.527841113946365, 'lambda': 7.8212608308832525, 'eta': 0.10859633184001705, 'sampling_method': 'gradient_based', 'subsample': 0.5995136270438184, 'gamma': 9.204947212139828}. Best is trial 63 with value: 1.895409823674203.
[I 2023-12-21 03:57:28,966] Trial 105 finished with value: inf and parameters: {'learning_rate': 0.9609261924577998, 'aft_loss_distribution': 'normal', 'aft_loss_distribution_scale': 1.4008978301930637, 'max_depth': 5, 'booster': 'gbtree', 'scale_pos_weight': 0.8118894254265032, 'alpha': 4.406158157379062, 'lambda': 8.28856577402854, 'eta': 0.1166341291630897, 'sampling_method': 'gradient_based', 'subsample': 0.6130991460000881, 'gamma': 9.223929509637125}. Best is trial 63 with value: 1.895409823674203.
[I 2023-12-21 03:57:29,034] Trial 106 pruned. Trial was pruned at iteration 0.
[I 2023-12-21 03:57:29,093] Trial 107 pruned. Trial was pruned at iteration 0.
[I 2023-12-21 03:57:29,155] Trial 108 pruned. Trial was pruned at iteration 2.
[I 2023-12-21 03:57:29,216] Trial 109 pruned. Trial was pruned at iteration 0.
[I 2023-12-21 03:57:29,510] Trial 110 finished with value: 1.9114918490708133 and parameters: {'learning_rate': 0.9984069282004266, 'aft_loss_distribution': 'normal', 'aft_loss_distribution_scale': 1.422902056021648, 'max_depth': 4, 'booster': 'gbtree', 'scale_pos_weight': 1.262942015032498, 'alpha': 4.488435460240171, 'lambda': 0.6103522717165555, 'eta': 0.19470658925863987, 'sampling_method': 'gradient_based', 'subsample': 0.758152107437174, 'gamma': 9.861485007522164}. Best is trial 63 with value: 1.895409823674203.
[I 2023-12-21 03:57:29,850] Trial 111 finished with value: 1.9112162297531075 and parameters: {'learning_rate': 0.9987497087531996, 'aft_loss_distribution': 'normal', 'aft_loss_distribution_scale': 1.494796487336652, 'max_depth': 4, 'booster': 'gbtree', 'scale_pos_weight': 1.256719588918147, 'alpha': 4.519546903533055, 'lambda': 0.5911205742375858, 'eta': 0.2205207444837955, 'sampling_method': 'gradient_based', 'subsample': 0.7363979991438196, 'gamma': 9.669339568049509}. Best is trial 63 with value: 1.895409823674203.
[I 2023-12-21 03:57:29,919] Trial 112 pruned. Trial was pruned at iteration 0.
[I 2023-12-21 03:57:29,980] Trial 113 pruned. Trial was pruned at iteration 1.
[I 2023-12-21 03:57:30,311] Trial 114 finished with value: 1.9136293395349426 and parameters: {'learning_rate': 0.9317220959618872, 'aft_loss_distribution': 'normal', 'aft_loss_distribution_scale': 1.5345012132978082, 'max_depth': 5, 'booster': 'gbtree', 'scale_pos_weight': 1.2149790916908216, 'alpha': 4.522470216109771, 'lambda': 1.4174045788173943, 'eta': 0.15104122866465425, 'sampling_method': 'gradient_based', 'subsample': 0.6957782966968279, 'gamma': 8.579952232422324}. Best is trial 63 with value: 1.895409823674203.
[I 2023-12-21 03:57:30,374] Trial 115 pruned. Trial was pruned at iteration 1.
[I 2023-12-21 03:57:30,434] Trial 116 pruned. Trial was pruned at iteration 0.
[I 2023-12-21 03:57:30,489] Trial 117 pruned. Trial was pruned at iteration 0.
[I 2023-12-21 03:57:30,560] Trial 118 pruned. Trial was pruned at iteration 3.
[I 2023-12-21 03:57:30,980] Trial 119 finished with value: 1.901193483959676 and parameters: {'learning_rate': 0.956757080886843, 'aft_loss_distribution': 'normal', 'aft_loss_distribution_scale': 1.3323647931764722, 'max_depth': 4, 'booster': 'gbtree', 'scale_pos_weight': 1.1678013116514052, 'alpha': 3.7534757319429275, 'lambda': 7.529866394160033, 'eta': 0.12381911807648655, 'sampling_method': 'gradient_based', 'subsample': 0.5755480477051889, 'gamma': 8.768808465322806}. Best is trial 63 with value: 1.895409823674203.
[I 2023-12-21 03:57:31,165] Trial 120 finished with value: inf and parameters: {'learning_rate': 0.9606502081771575, 'aft_loss_distribution': 'normal', 'aft_loss_distribution_scale': 1.3899209637510803, 'max_depth': 4, 'booster': 'gbtree', 'scale_pos_weight': 1.175132594735092, 'alpha': 3.2508039032093596, 'lambda': 0.02646143860234007, 'eta': 0.12497152030340603, 'sampling_method': 'gradient_based', 'subsample': 0.5591035911856029, 'gamma': 8.817046277633272}. Best is trial 63 with value: 1.895409823674203.
[I 2023-12-21 03:57:31,458] Trial 121 finished with value: 1.9113713379875024 and parameters: {'learning_rate': 0.942722443764416, 'aft_loss_distribution': 'normal', 'aft_loss_distribution_scale': 1.5886946009416094, 'max_depth': 4, 'booster': 'gbtree', 'scale_pos_weight': 1.306224586226067, 'alpha': 4.298667227725847, 'lambda': 7.2025410956710445, 'eta': 0.06258873985048397, 'sampling_method': 'gradient_based', 'subsample': 0.5849318916820084, 'gamma': 8.408229021463539}. Best is trial 63 with value: 1.895409823674203.
[I 2023-12-21 03:57:31,637] Trial 122 pruned. Trial was pruned at iteration 53.
[I 2023-12-21 03:57:31,696] Trial 123 pruned. Trial was pruned at iteration 1.
[I 2023-12-21 03:57:31,757] Trial 124 pruned. Trial was pruned at iteration 0.
[I 2023-12-21 03:57:31,828] Trial 125 pruned. Trial was pruned at iteration 0.
[I 2023-12-21 03:57:32,089] Trial 126 finished with value: 1.9070211797428565 and parameters: {'learning_rate': 0.9678267554179361, 'aft_loss_distribution': 'normal', 'aft_loss_distribution_scale': 1.5283029812674482, 'max_depth': 4, 'booster': 'gbtree', 'scale_pos_weight': 0.8717304752825534, 'alpha': 3.586904789183405, 'lambda': 7.311495674416063, 'eta': 0.13515991276166486, 'sampling_method': 'gradient_based', 'subsample': 0.571359448228894, 'gamma': 3.4690900595692593}. Best is trial 63 with value: 1.895409823674203.
[I 2023-12-21 03:57:33,926] Trial 127 finished with value: inf and parameters: {'learning_rate': 0.9674771675907862, 'aft_loss_distribution': 'normal', 'aft_loss_distribution_scale': 1.299481991399147, 'max_depth': 4, 'booster': 'dart', 'scale_pos_weight': 0.7321155736718741, 'alpha': 2.7097732852401255, 'lambda': 8.54426402674623, 'eta': 0.257017066266864, 'sampling_method': 'gradient_based', 'subsample': 0.5077032595782441, 'gamma': 3.3749504525801926}. Best is trial 63 with value: 1.895409823674203.
[I 2023-12-21 03:57:33,992] Trial 128 pruned. Trial was pruned at iteration 0.
[I 2023-12-21 03:57:34,051] Trial 129 pruned. Trial was pruned at iteration 0.
[I 2023-12-21 03:57:34,111] Trial 130 pruned. Trial was pruned at iteration 0.
