[I 2023-12-19 00:44:10,771] Trial 85 finished with value: 1.9889937559955262 and parameters: {'learning_rate': 0.9605129980419962, 'aft_loss_distribution': 'normal', 'aft_loss_distribution_scale': 1.3153137866292544, 'max_depth': 7, 'booster': 'dart', 'scale_pos_weight': 3.00821712622346, 'alpha': 4.673995114874667, 'lambda': 7.441981231855376, 'eta': 0.6694906844876297, 'sampling_method': 'gradient_based', 'subsample': 0.7413193265839891, 'gamma': 5.536429307070374}. Best is trial 65 with value: 1.988448559156196.
[I 2023-12-19 00:44:10,871] Trial 86 pruned. Trial was pruned at iteration 0.
[I 2023-12-19 00:44:10,989] Trial 87 pruned. Trial was pruned at iteration 0.
[I 2023-12-19 00:44:12,752] Trial 88 finished with value: inf and parameters: {'learning_rate': 0.8266821317116356, 'aft_loss_distribution': 'normal', 'aft_loss_distribution_scale': 1.7345482068598461, 'max_depth': 8, 'booster': 'dart', 'scale_pos_weight': 2.5344101071995064, 'alpha': 4.641788226229929, 'lambda': 4.57668640967406, 'eta': 0.6150788513624015, 'sampling_method': 'gradient_based', 'subsample': 0.8845947228164911, 'gamma': 6.108346625214838}. Best is trial 65 with value: 1.988448559156196.
[I 2023-12-19 00:44:12,870] Trial 89 pruned. Trial was pruned at iteration 0.
[I 2023-12-19 00:44:43,564] Trial 90 finished with value: 1.9926259416409795 and parameters: {'learning_rate': 0.9586708568896309, 'aft_loss_distribution': 'normal', 'aft_loss_distribution_scale': 1.5291471937186458, 'max_depth': 9, 'booster': 'dart', 'scale_pos_weight': 2.631356601543527, 'alpha': 4.915503018138397, 'lambda': 4.925686705230885, 'eta': 0.7676816587542832, 'sampling_method': 'uniform', 'subsample': 0.6671231427301568, 'gamma': 9.732860274788608}. Best is trial 65 with value: 1.988448559156196.
[I 2023-12-19 00:45:14,704] Trial 91 finished with value: 1.9895693129875278 and parameters: {'learning_rate': 0.9669888553565811, 'aft_loss_distribution': 'normal', 'aft_loss_distribution_scale': 1.4280660327476267, 'max_depth': 9, 'booster': 'dart', 'scale_pos_weight': 2.853661529572444, 'alpha': 4.823803085619149, 'lambda': 9.63426458733092, 'eta': 0.6796200570983977, 'sampling_method': 'uniform', 'subsample': 0.7012214526272298, 'gamma': 9.815454492541225}. Best is trial 65 with value: 1.988448559156196.
[I 2023-12-19 00:45:29,018] Trial 92 finished with value: 1.9922956043672553 and parameters: {'learning_rate': 0.9945327916465098, 'aft_loss_distribution': 'normal', 'aft_loss_distribution_scale': 1.5232871836675306, 'max_depth': 9, 'booster': 'dart', 'scale_pos_weight': 2.7032976808971036, 'alpha': 4.815019053363816, 'lambda': 9.65595911460683, 'eta': 0.7617311758207831, 'sampling_method': 'uniform', 'subsample': 0.7023182495498702, 'gamma': 9.33035122838555}. Best is trial 65 with value: 1.988448559156196.
[I 2023-12-19 00:45:35,262] Trial 93 finished with value: 1.9918602948050834 and parameters: {'learning_rate': 0.9997174851227358, 'aft_loss_distribution': 'normal', 'aft_loss_distribution_scale': 1.5064785641155283, 'max_depth': 9, 'booster': 'dart', 'scale_pos_weight': 2.667735372934576, 'alpha': 4.42030581158187, 'lambda': 9.571090393005164, 'eta': 0.7563868549891782, 'sampling_method': 'uniform', 'subsample': 0.6920127620061277, 'gamma': 9.73569935873095}. Best is trial 65 with value: 1.988448559156196.
[I 2023-12-19 00:45:36,865] Trial 94 finished with value: inf and parameters: {'learning_rate': 0.98460665889657, 'aft_loss_distribution': 'normal', 'aft_loss_distribution_scale': 1.2119049476596016, 'max_depth': 9, 'booster': 'dart', 'scale_pos_weight': 2.6729948235326844, 'alpha': 4.192997248293621, 'lambda': 9.158154495765435, 'eta': 0.7670256884399034, 'sampling_method': 'uniform', 'subsample': 0.706892608490065, 'gamma': 9.68377189495173}. Best is trial 65 with value: 1.988448559156196.
[I 2023-12-19 00:45:42,354] Trial 95 finished with value: 1.9934761671066419 and parameters: {'learning_rate': 0.9938980150490665, 'aft_loss_distribution': 'normal', 'aft_loss_distribution_scale': 1.5004665192033804, 'max_depth': 8, 'booster': 'dart', 'scale_pos_weight': 2.1904962498815177, 'alpha': 4.892236754099944, 'lambda': 9.637350711508711, 'eta': 0.8406696384423176, 'sampling_method': 'uniform', 'subsample': 0.7600480971708485, 'gamma': 9.733782177908292}. Best is trial 65 with value: 1.988448559156196.
[I 2023-12-19 00:45:47,045] Trial 96 finished with value: 1.9936415015658226 and parameters: {'learning_rate': 0.9996993393343622, 'aft_loss_distribution': 'normal', 'aft_loss_distribution_scale': 1.518151592545066, 'max_depth': 8, 'booster': 'dart', 'scale_pos_weight': 2.682522695581496, 'alpha': 4.908578991494451, 'lambda': 9.588503126792345, 'eta': 0.8317704052255835, 'sampling_method': 'uniform', 'subsample': 0.7628843698179346, 'gamma': 9.801004043712355}. Best is trial 65 with value: 1.988448559156196.
[I 2023-12-19 00:45:50,568] Trial 97 finished with value: 1.9907580680796466 and parameters: {'learning_rate': 0.9987502595960815, 'aft_loss_distribution': 'normal', 'aft_loss_distribution_scale': 1.5073428706566585, 'max_depth': 8, 'booster': 'dart', 'scale_pos_weight': 2.6211416135332324, 'alpha': 5.0245638719324655, 'lambda': 9.689494982146273, 'eta': 0.83718161559662, 'sampling_method': 'uniform', 'subsample': 0.75494227210872, 'gamma': 9.326694371249825}. Best is trial 65 with value: 1.988448559156196.
[I 2023-12-19 00:45:50,665] Trial 98 pruned. Trial was pruned at iteration 0.
[I 2023-12-19 00:45:50,774] Trial 99 pruned. Trial was pruned at iteration 0.
[I 2023-12-19 00:45:50,857] Trial 100 pruned. Trial was pruned at iteration 0.
[I 2023-12-19 00:45:55,648] Trial 101 finished with value: 2.015576973966274 and parameters: {'learning_rate': 0.9640571576371239, 'aft_loss_distribution': 'normal', 'aft_loss_distribution_scale': 1.1134614585029219, 'max_depth': 8, 'booster': 'dart', 'scale_pos_weight': 2.6045369458656245, 'alpha': 5.17800817179658, 'lambda': 9.611582681227294, 'eta': 0.8145247366211288, 'sampling_method': 'uniform', 'subsample': 0.662148536084289, 'gamma': 9.505134667642952}. Best is trial 65 with value: 1.988448559156196.
[I 2023-12-19 00:45:57,201] Trial 102 finished with value: inf and parameters: {'learning_rate': 0.9672022997261646, 'aft_loss_distribution': 'normal', 'aft_loss_distribution_scale': 1.532128980945097, 'max_depth': 7, 'booster': 'dart', 'scale_pos_weight': 2.2483460533784747, 'alpha': 5.053232501982585, 'lambda': 9.78285353386409, 'eta': 0.7595520678342689, 'sampling_method': 'uniform', 'subsample': 0.8395000477920171, 'gamma': 9.995089789216419}. Best is trial 65 with value: 1.988448559156196.
[I 2023-12-19 00:45:57,271] Trial 103 pruned. Trial was pruned at iteration 0.
[I 2023-12-19 00:46:11,224] Trial 104 finished with value: 1.9911088125860619 and parameters: {'learning_rate': 0.9488269014149087, 'aft_loss_distribution': 'normal', 'aft_loss_distribution_scale': 1.5310452575829363, 'max_depth': 9, 'booster': 'dart', 'scale_pos_weight': 2.797456822091579, 'alpha': 5.912798035742404, 'lambda': 8.926339654372594, 'eta': 0.7153192833344347, 'sampling_method': 'uniform', 'subsample': 0.6835872787273579, 'gamma': 9.751248812157407}. Best is trial 65 with value: 1.988448559156196.
[I 2023-12-19 00:46:11,295] Trial 105 pruned. Trial was pruned at iteration 0.
[I 2023-12-19 00:46:11,361] Trial 106 pruned. Trial was pruned at iteration 0.
[I 2023-12-19 00:46:14,121] Trial 107 finished with value: 1.9939529033128995 and parameters: {'learning_rate': 0.9975526716983337, 'aft_loss_distribution': 'normal', 'aft_loss_distribution_scale': 1.2334449562299388, 'max_depth': 9, 'booster': 'dart', 'scale_pos_weight': 2.4633944184637437, 'alpha': 4.798967277542137, 'lambda': 8.759376295794578, 'eta': 0.7209654344198294, 'sampling_method': 'uniform', 'subsample': 0.6824801439700003, 'gamma': 9.454715563922631}. Best is trial 65 with value: 1.988448559156196.
[I 2023-12-19 00:46:16,859] Trial 108 finished with value: 2.0059607179814254 and parameters: {'learning_rate': 0.9867545726489588, 'aft_loss_distribution': 'normal', 'aft_loss_distribution_scale': 1.1223856336678102, 'max_depth': 9, 'booster': 'dart', 'scale_pos_weight': 2.2316103585859906, 'alpha': 4.8347615140648035, 'lambda': 9.014620086440743, 'eta': 0.7105544324915737, 'sampling_method': 'uniform', 'subsample': 0.6873984972966491, 'gamma': 9.379267406288045}. Best is trial 65 with value: 1.988448559156196.
[I 2023-12-19 00:46:16,928] Trial 109 pruned. Trial was pruned at iteration 0.
[I 2023-12-19 00:46:23,461] Trial 110 finished with value: 1.994973450317791 and parameters: {'learning_rate': 0.9760183337214168, 'aft_loss_distribution': 'normal', 'aft_loss_distribution_scale': 1.5966947557539672, 'max_depth': 8, 'booster': 'dart', 'scale_pos_weight': 2.4600731885780824, 'alpha': 4.174967159987357, 'lambda': 8.775166160587961, 'eta': 0.8002114504203178, 'sampling_method': 'uniform', 'subsample': 0.7680725453024472, 'gamma': 9.522461252105394}. Best is trial 65 with value: 1.988448559156196.
[I 2023-12-19 00:46:28,213] Trial 111 finished with value: 1.9959982221799506 and parameters: {'learning_rate': 0.9997457375991051, 'aft_loss_distribution': 'normal', 'aft_loss_distribution_scale': 1.585698628609615, 'max_depth': 8, 'booster': 'dart', 'scale_pos_weight': 2.7042628190771736, 'alpha': 4.223159856124708, 'lambda': 8.740277122185732, 'eta': 0.8482705476101446, 'sampling_method': 'uniform', 'subsample': 0.7609823241396275, 'gamma': 9.453631707529375}. Best is trial 65 with value: 1.988448559156196.
[I 2023-12-19 00:46:31,623] Trial 112 finished with value: 1.991437537359607 and parameters: {'learning_rate': 0.9792266666919057, 'aft_loss_distribution': 'normal', 'aft_loss_distribution_scale': 1.3745701368608623, 'max_depth': 8, 'booster': 'dart', 'scale_pos_weight': 2.496819621405799, 'alpha': 5.0221549452404375, 'lambda': 8.307887135830963, 'eta': 0.792633446895364, 'sampling_method': 'uniform', 'subsample': 0.7181197642267608, 'gamma': 8.767779377088598}. Best is trial 65 with value: 1.988448559156196.
[I 2023-12-19 00:46:31,689] Trial 113 pruned. Trial was pruned at iteration 0.
[I 2023-12-19 00:46:35,532] Trial 114 finished with value: 1.98945709502467 and parameters: {'learning_rate': 0.9997954878245235, 'aft_loss_distribution': 'normal', 'aft_loss_distribution_scale': 1.3224823203815286, 'max_depth': 9, 'booster': 'dart', 'scale_pos_weight': 2.356497048441739, 'alpha': 4.721400745241637, 'lambda': 9.803386193046965, 'eta': 0.9099515201018662, 'sampling_method': 'uniform', 'subsample': 0.6980596928714854, 'gamma': 8.710041026624356}. Best is trial 65 with value: 1.988448559156196.
[I 2023-12-19 00:47:06,037] Trial 115 finished with value: 2.030090590533953 and parameters: {'learning_rate': 0.9681272408720852, 'aft_loss_distribution': 'normal', 'aft_loss_distribution_scale': 1.9899725536000337, 'max_depth': 7, 'booster': 'dart', 'scale_pos_weight': 2.173633801820362, 'alpha': 5.106641071736847, 'lambda': 9.782190053849718, 'eta': 0.9298732546009836, 'sampling_method': 'uniform', 'subsample': 0.6574008863698334, 'gamma': 9.155245843716681}. Best is trial 65 with value: 1.988448559156196.
[I 2023-12-19 00:47:14,036] Trial 116 finished with value: 1.9878633343995167 and parameters: {'learning_rate': 0.9224410101837051, 'aft_loss_distribution': 'normal', 'aft_loss_distribution_scale': 1.4000411175618654, 'max_depth': 8, 'booster': 'dart', 'scale_pos_weight': 2.8058390036225798, 'alpha': 4.53079759546158, 'lambda': 9.288673020035482, 'eta': 0.9469186954896156, 'sampling_method': 'uniform', 'subsample': 0.6967240906234552, 'gamma': 8.82185457112023}. Best is trial 116 with value: 1.9878633343995167.
[I 2023-12-19 00:47:14,114] Trial 117 pruned. Trial was pruned at iteration 0.
[I 2023-12-19 00:47:14,187] Trial 118 pruned. Trial was pruned at iteration 0.
[I 2023-12-19 00:47:14,257] Trial 119 pruned. Trial was pruned at iteration 0.
[I 2023-12-19 00:47:14,326] Trial 120 pruned. Trial was pruned at iteration 0.
[I 2023-12-19 00:47:17,137] Trial 121 finished with value: 1.9900610199822577 and parameters: {'learning_rate': 0.9607413294800672, 'aft_loss_distribution': 'normal', 'aft_loss_distribution_scale': 1.4224557777716234, 'max_depth': 8, 'booster': 'dart', 'scale_pos_weight': 2.597765910303606, 'alpha': 5.244023386452961, 'lambda': 9.78177632248763, 'eta': 0.8239737620612311, 'sampling_method': 'uniform', 'subsample': 0.7397599716144926, 'gamma': 9.977330255003023}. Best is trial 116 with value: 1.9878633343995167.
[I 2023-12-19 00:47:22,832] Trial 122 finished with value: 2.0200361166868968 and parameters: {'learning_rate': 0.9567626637270463, 'aft_loss_distribution': 'normal', 'aft_loss_distribution_scale': 1.8822306705158471, 'max_depth': 7, 'booster': 'dart', 'scale_pos_weight': 2.5557400764450464, 'alpha': 5.073867171968705, 'lambda': 9.818283869433827, 'eta': 0.9564382677511695, 'sampling_method': 'uniform', 'subsample': 0.8014647105233715, 'gamma': 9.212627644463435}. Best is trial 116 with value: 1.9878633343995167.
[I 2023-12-19 00:47:22,904] Trial 123 pruned. Trial was pruned at iteration 0.
[I 2023-12-19 00:47:22,972] Trial 124 pruned. Trial was pruned at iteration 1.
[I 2023-12-19 00:47:23,037] Trial 125 pruned. Trial was pruned at iteration 0.
[I 2023-12-19 00:47:23,107] Trial 126 pruned. Trial was pruned at iteration 0.
[I 2023-12-19 00:47:23,193] Trial 127 pruned. Trial was pruned at iteration 0.
[I 2023-12-19 00:47:23,263] Trial 128 pruned. Trial was pruned at iteration 0.
[I 2023-12-19 00:47:23,328] Trial 129 pruned. Trial was pruned at iteration 0.
[I 2023-12-19 00:47:26,821] Trial 130 finished with value: 1.9910852589651926 and parameters: {'learning_rate': 0.9637588130043728, 'aft_loss_distribution': 'normal', 'aft_loss_distribution_scale': 1.3884733131315254, 'max_depth': 8, 'booster': 'dart', 'scale_pos_weight': 2.573001635276353, 'alpha': 4.031050637750173, 'lambda': 9.252774044790366, 'eta': 0.7636207680627065, 'sampling_method': 'uniform', 'subsample': 0.7013458196424139, 'gamma': 9.955171120301564}. Best is trial 116 with value: 1.9878633343995167.
[I 2023-12-19 00:47:41,223] Trial 131 finished with value: 1.9899129687185089 and parameters: {'learning_rate': 0.9592020246435298, 'aft_loss_distribution': 'normal', 'aft_loss_distribution_scale': 1.397173584585217, 'max_depth': 8, 'booster': 'dart', 'scale_pos_weight': 2.612443941546331, 'alpha': 4.0696350468096805, 'lambda': 9.74673531480313, 'eta': 0.7688723434259725, 'sampling_method': 'uniform', 'subsample': 0.7026757104418382, 'gamma': 9.994915837116832}. Best is trial 116 with value: 1.9878633343995167.
[I 2023-12-19 00:47:44,645] Trial 132 finished with value: 1.9912246458368847 and parameters: {'learning_rate': 0.9569594603635456, 'aft_loss_distribution': 'normal', 'aft_loss_distribution_scale': 1.3675388548595815, 'max_depth': 8, 'booster': 'dart', 'scale_pos_weight': 2.8466032049497154, 'alpha': 3.60522188807871, 'lambda': 9.223644239437219, 'eta': 0.7339735991360398, 'sampling_method': 'uniform', 'subsample': 0.6997103146006555, 'gamma': 9.90817074869867}. Best is trial 116 with value: 1.9878633343995167.
[I 2023-12-19 00:47:44,717] Trial 133 pruned. Trial was pruned at iteration 0.
[I 2023-12-19 00:47:58,939] Trial 134 finished with value: 2.004389089287847 and parameters: {'learning_rate': 0.9325434350974484, 'aft_loss_distribution': 'normal', 'aft_loss_distribution_scale': 1.7082354432456677, 'max_depth': 8, 'booster': 'dart', 'scale_pos_weight': 2.5528756786844404, 'alpha': 3.5722867720773315, 'lambda': 9.095854642261227, 'eta': 0.7299286998708562, 'sampling_method': 'uniform', 'subsample': 0.6919204668511735, 'gamma': 9.969500472272449}. Best is trial 116 with value: 1.9878633343995167.
[I 2023-12-19 00:47:59,014] Trial 135 pruned. Trial was pruned at iteration 0.
[I 2023-12-19 00:47:59,082] Trial 136 pruned. Trial was pruned at iteration 0.
[I 2023-12-19 00:47:59,151] Trial 137 pruned. Trial was pruned at iteration 0.
[I 2023-12-19 00:48:00,665] Trial 138 finished with value: inf and parameters: {'learning_rate': 0.95268453679372, 'aft_loss_distribution': 'normal', 'aft_loss_distribution_scale': 1.2272217806691328, 'max_depth': 7, 'booster': 'dart', 'scale_pos_weight': 2.662428787926857, 'alpha': 3.052340630385246, 'lambda': 8.973863072881256, 'eta': 0.7853701384591084, 'sampling_method': 'uniform', 'subsample': 0.7171808344863528, 'gamma': 2.613216333433936}. Best is trial 116 with value: 1.9878633343995167.
[I 2023-12-19 00:48:00,766] Trial 139 pruned. Trial was pruned at iteration 0.
[I 2023-12-19 00:48:00,881] Trial 140 pruned. Trial was pruned at iteration 0.
[I 2023-12-19 00:48:31,434] Trial 141 finished with value: 1.9906115953050334 and parameters: {'learning_rate': 0.9582534486628201, 'aft_loss_distribution': 'normal', 'aft_loss_distribution_scale': 1.4472853152151837, 'max_depth': 9, 'booster': 'dart', 'scale_pos_weight': 2.603658562372063, 'alpha': 4.357512443041346, 'lambda': 9.543532168213437, 'eta': 0.04849961921933521, 'sampling_method': 'uniform', 'subsample': 0.665924202578865, 'gamma': 9.740255320970649}. Best is trial 116 with value: 1.9878633343995167.
[I 2023-12-19 00:48:33,490] Trial 142 finished with value: inf and parameters: {'learning_rate': 0.9730994952980014, 'aft_loss_distribution': 'normal', 'aft_loss_distribution_scale': 1.375460377677609, 'max_depth': 9, 'booster': 'dart', 'scale_pos_weight': 2.5847467127531516, 'alpha': 4.460562581914942, 'lambda': 9.503407224902936, 'eta': 0.13341792985800338, 'sampling_method': 'uniform', 'subsample': 0.6708291799309869, 'gamma': 9.417770785492454}. Best is trial 116 with value: 1.9878633343995167.
[I 2023-12-19 00:48:39,832] Trial 143 finished with value: 2.00479069236836 and parameters: {'learning_rate': 0.9390741090087671, 'aft_loss_distribution': 'normal', 'aft_loss_distribution_scale': 1.7124100397822577, 'max_depth': 9, 'booster': 'dart', 'scale_pos_weight': 2.7018518566557668, 'alpha': 4.3092281801479, 'lambda': 9.728882076136525, 'eta': 0.678303882793741, 'sampling_method': 'uniform', 'subsample': 0.7072370748471387, 'gamma': 9.711675253802012}. Best is trial 116 with value: 1.9878633343995167.
[I 2023-12-19 00:48:39,916] Trial 144 pruned. Trial was pruned at iteration 1.
[I 2023-12-19 00:48:41,568] Trial 145 finished with value: inf and parameters: {'learning_rate': 0.980473556917709, 'aft_loss_distribution': 'normal', 'aft_loss_distribution_scale': 1.1488975830036696, 'max_depth': 9, 'booster': 'dart', 'scale_pos_weight': 2.595333121196858, 'alpha': 4.267996184774652, 'lambda': 9.54292283535754, 'eta': 0.2450198191167927, 'sampling_method': 'uniform', 'subsample': 0.6761989300554571, 'gamma': 8.831109012957597}. Best is trial 116 with value: 1.9878633343995167.
[I 2023-12-19 00:48:51,391] Trial 146 finished with value: 1.9901132601861484 and parameters: {'learning_rate': 0.9299942107785095, 'aft_loss_distribution': 'normal', 'aft_loss_distribution_scale': 1.4436097127789158, 'max_depth': 9, 'booster': 'dart', 'scale_pos_weight': 2.7712386111643728, 'alpha': 4.563815309323719, 'lambda': 9.193127438238443, 'eta': 0.9542819744098643, 'sampling_method': 'uniform', 'subsample': 0.7290119481124783, 'gamma': 9.534276646545674}. Best is trial 116 with value: 1.9878633343995167.
[I 2023-12-19 00:48:51,480] Trial 147 pruned. Trial was pruned at iteration 1.
[I 2023-12-19 00:48:51,544] Trial 148 pruned. Trial was pruned at iteration 0.
[I 2023-12-19 00:48:51,617] Trial 149 pruned. Trial was pruned at iteration 0.
[I 2023-12-19 00:48:51,722] Trial 150 pruned. Trial was pruned at iteration 0.
[I 2023-12-19 00:49:00,565] Trial 151 finished with value: 1.991795170928549 and parameters: {'learning_rate': 0.9786812697151323, 'aft_loss_distribution': 'normal', 'aft_loss_distribution_scale': 1.4750528493920445, 'max_depth': 9, 'booster': 'dart', 'scale_pos_weight': 2.7032634890957437, 'alpha': 4.774002502744486, 'lambda': 9.657053018388446, 'eta': 0.7458111243105771, 'sampling_method': 'uniform', 'subsample': 0.6984270927023993, 'gamma': 9.334476779642431}. Best is trial 116 with value: 1.9878633343995167.
[I 2023-12-19 00:49:04,622] Trial 152 finished with value: 1.9986263192691391 and parameters: {'learning_rate': 0.9675752555051084, 'aft_loss_distribution': 'normal', 'aft_loss_distribution_scale': 1.2349571741967607, 'max_depth': 9, 'booster': 'dart', 'scale_pos_weight': 2.640616138836011, 'alpha': 4.640289834133209, 'lambda': 9.985385521312214, 'eta': 0.7307965904715616, 'sampling_method': 'uniform', 'subsample': 0.6868579904131985, 'gamma': 9.37796711951535}. Best is trial 116 with value: 1.9878633343995167.
[I 2023-12-19 00:49:04,696] Trial 153 pruned. Trial was pruned at iteration 0.
[I 2023-12-19 00:49:09,491] Trial 154 finished with value: 1.9907565253346506 and parameters: {'learning_rate': 0.9798034375851179, 'aft_loss_distribution': 'normal', 'aft_loss_distribution_scale': 1.521232853455791, 'max_depth': 8, 'booster': 'dart', 'scale_pos_weight': 2.2780732489147546, 'alpha': 5.527101442821852, 'lambda': 9.309336010936327, 'eta': 0.821726518113123, 'sampling_method': 'uniform', 'subsample': 0.8009811166642463, 'gamma': 9.163806919793954}. Best is trial 116 with value: 1.9878633343995167.
[I 2023-12-19 00:49:09,565] Trial 155 pruned. Trial was pruned at iteration 0.
[I 2023-12-19 00:49:14,945] Trial 156 finished with value: 2.003430151051348 and parameters: {'learning_rate': 0.977603602795282, 'aft_loss_distribution': 'normal', 'aft_loss_distribution_scale': 1.7090126202966816, 'max_depth': 8, 'booster': 'dart', 'scale_pos_weight': 2.3928751124792442, 'alpha': 5.423692407622225, 'lambda': 8.041068513809737, 'eta': 0.8872084122903845, 'sampling_method': 'uniform', 'subsample': 0.8074313387481529, 'gamma': 9.197619703979404}. Best is trial 116 with value: 1.9878633343995167.
[I 2023-12-19 00:49:15,051] Trial 157 pruned. Trial was pruned at iteration 0.
