[I 2023-12-21 00:17:32,075] Trial 221 finished with value: 1.9120609065817238 and parameters: {'learning_rate': 0.9434244968230481, 'aft_loss_distribution': 'normal', 'aft_loss_distribution_scale': 1.4148964262457076, 'max_depth': 8, 'booster': 'gbtree', 'scale_pos_weight': 0.23468262927655376, 'alpha': 9.727175001115492, 'lambda': 9.58314630993774, 'eta': 0.09526805813675791, 'sampling_method': 'gradient_based', 'subsample': 0.5194961617535403, 'gamma': 8.84108478949865}. Best is trial 221 with value: 1.9120609065817238.
[I 2023-12-21 00:17:32,359] Trial 222 finished with value: inf and parameters: {'learning_rate': 0.9357348283872257, 'aft_loss_distribution': 'normal', 'aft_loss_distribution_scale': 1.3842140068354738, 'max_depth': 8, 'booster': 'gbtree', 'scale_pos_weight': 0.2919437600754838, 'alpha': 9.713782768866285, 'lambda': 9.543158356801289, 'eta': 0.09871017909854016, 'sampling_method': 'gradient_based', 'subsample': 0.5199198040858134, 'gamma': 8.875320331843728}. Best is trial 221 with value: 1.9120609065817238.
[I 2023-12-21 00:17:32,782] Trial 223 finished with value: 1.9145307763429775 and parameters: {'learning_rate': 0.9485723260897221, 'aft_loss_distribution': 'normal', 'aft_loss_distribution_scale': 1.379592239445919, 'max_depth': 8, 'booster': 'gbtree', 'scale_pos_weight': 0.23172167534035787, 'alpha': 9.779879667724597, 'lambda': 9.375593285439516, 'eta': 0.12183328982392239, 'sampling_method': 'gradient_based', 'subsample': 0.5449239916508618, 'gamma': 8.252397913755336}. Best is trial 221 with value: 1.9120609065817238.
[I 2023-12-21 00:17:32,898] Trial 224 pruned. Trial was pruned at iteration 0.
[I 2023-12-21 00:17:33,008] Trial 225 pruned. Trial was pruned at iteration 0.
[I 2023-12-21 00:17:33,434] Trial 226 finished with value: 1.9222373244212343 and parameters: {'learning_rate': 0.945960817861057, 'aft_loss_distribution': 'normal', 'aft_loss_distribution_scale': 1.649712172004882, 'max_depth': 8, 'booster': 'gbtree', 'scale_pos_weight': 0.3702270786800008, 'alpha': 9.452938133222895, 'lambda': 9.37133558287877, 'eta': 0.13640654428733273, 'sampling_method': 'gradient_based', 'subsample': 0.5582393685471162, 'gamma': 8.566782048129442}. Best is trial 221 with value: 1.9120609065817238.
[I 2023-12-21 00:17:33,548] Trial 227 pruned. Trial was pruned at iteration 0.
[I 2023-12-21 00:17:33,658] Trial 228 pruned. Trial was pruned at iteration 0.
[I 2023-12-21 00:17:33,768] Trial 229 pruned. Trial was pruned at iteration 0.
[I 2023-12-21 00:17:34,224] Trial 230 finished with value: 1.9228464344798968 and parameters: {'learning_rate': 0.9469126994193676, 'aft_loss_distribution': 'normal', 'aft_loss_distribution_scale': 1.6314235243138486, 'max_depth': 8, 'booster': 'gbtree', 'scale_pos_weight': 0.17426516778653117, 'alpha': 9.602898449745366, 'lambda': 8.87974655678954, 'eta': 0.07150797220048977, 'sampling_method': 'gradient_based', 'subsample': 0.5707585172818517, 'gamma': 9.035985431071351}. Best is trial 221 with value: 1.9120609065817238.
[I 2023-12-21 00:17:34,774] Trial 231 finished with value: 1.9122782566982026 and parameters: {'learning_rate': 0.9524546371103295, 'aft_loss_distribution': 'normal', 'aft_loss_distribution_scale': 1.4551865474142545, 'max_depth': 8, 'booster': 'gbtree', 'scale_pos_weight': 0.609556892487546, 'alpha': 9.993526803878398, 'lambda': 9.592747846845672, 'eta': 0.07134552201378572, 'sampling_method': 'gradient_based', 'subsample': 0.5410854363830744, 'gamma': 9.237131086835449}. Best is trial 221 with value: 1.9120609065817238.
[I 2023-12-21 00:17:34,886] Trial 232 pruned. Trial was pruned at iteration 0.
[I 2023-12-21 00:17:34,973] Trial 233 pruned. Trial was pruned at iteration 0.
[I 2023-12-21 00:17:35,452] Trial 234 finished with value: 1.9210349019361446 and parameters: {'learning_rate': 0.9292580742741042, 'aft_loss_distribution': 'normal', 'aft_loss_distribution_scale': 1.657922953332102, 'max_depth': 8, 'booster': 'gbtree', 'scale_pos_weight': 0.39620525034183196, 'alpha': 9.803190178424781, 'lambda': 9.179028735584442, 'eta': 0.9045446052859571, 'sampling_method': 'gradient_based', 'subsample': 0.4954136827364755, 'gamma': 9.013104934231553}. Best is trial 221 with value: 1.9120609065817238.
[I 2023-12-21 00:17:35,816] Trial 235 finished with value: 1.914960937267682 and parameters: {'learning_rate': 0.9542175241407503, 'aft_loss_distribution': 'normal', 'aft_loss_distribution_scale': 1.4375443983230263, 'max_depth': 8, 'booster': 'gbtree', 'scale_pos_weight': 0.22788940502776975, 'alpha': 9.594143018237625, 'lambda': 9.603257367515752, 'eta': 0.09023828588437954, 'sampling_method': 'gradient_based', 'subsample': 0.5656030279249697, 'gamma': 8.794915717910667}. Best is trial 221 with value: 1.9120609065817238.
[I 2023-12-21 00:17:36,259] Trial 236 finished with value: 1.9203157140527523 and parameters: {'learning_rate': 0.9455155085844591, 'aft_loss_distribution': 'normal', 'aft_loss_distribution_scale': 1.6221800159855855, 'max_depth': 8, 'booster': 'gbtree', 'scale_pos_weight': 0.1797874932580586, 'alpha': 9.552507339155275, 'lambda': 9.982451734483812, 'eta': 0.09798373558509241, 'sampling_method': 'gradient_based', 'subsample': 0.5510628269205067, 'gamma': 8.788950011678178}. Best is trial 221 with value: 1.9120609065817238.
[I 2023-12-21 00:17:36,342] Trial 237 pruned. Trial was pruned at iteration 0.
[I 2023-12-21 00:17:36,419] Trial 238 pruned. Trial was pruned at iteration 0.
[I 2023-12-21 00:17:36,487] Trial 239 pruned. Trial was pruned at iteration 0.
[I 2023-12-21 00:17:36,781] Trial 240 finished with value: 1.9178892565038321 and parameters: {'learning_rate': 0.9634567332849824, 'aft_loss_distribution': 'normal', 'aft_loss_distribution_scale': 1.6045805765578, 'max_depth': 7, 'booster': 'gbtree', 'scale_pos_weight': 0.23714532088545104, 'alpha': 9.829150015157488, 'lambda': 9.847152526860285, 'eta': 0.06906700869954303, 'sampling_method': 'gradient_based', 'subsample': 0.5355860338243216, 'gamma': 8.275730698353756}. Best is trial 221 with value: 1.9120609065817238.
[I 2023-12-21 00:17:37,358] Trial 241 finished with value: 1.9167816042095607 and parameters: {'learning_rate': 0.9563625183750497, 'aft_loss_distribution': 'normal', 'aft_loss_distribution_scale': 1.5528735016134134, 'max_depth': 7, 'booster': 'gbtree', 'scale_pos_weight': 0.2519056724550363, 'alpha': 9.76944070905241, 'lambda': 9.844164041730638, 'eta': 0.07946944274113289, 'sampling_method': 'gradient_based', 'subsample': 0.5295870536265532, 'gamma': 8.231402592075268}. Best is trial 221 with value: 1.9120609065817238.
[I 2023-12-21 00:17:37,605] Trial 242 pruned. Trial was pruned at iteration 73.
[I 2023-12-21 00:17:37,894] Trial 243 finished with value: 1.9190799085300998 and parameters: {'learning_rate': 0.9365478299943413, 'aft_loss_distribution': 'normal', 'aft_loss_distribution_scale': 1.5521682406145358, 'max_depth': 7, 'booster': 'gbtree', 'scale_pos_weight': 0.39316933219449085, 'alpha': 9.643932013967524, 'lambda': 9.893648119224055, 'eta': 0.0680816373521826, 'sampling_method': 'gradient_based', 'subsample': 0.5350063857548716, 'gamma': 8.922492292990839}. Best is trial 221 with value: 1.9120609065817238.
[I 2023-12-21 00:17:37,970] Trial 244 pruned. Trial was pruned at iteration 0.
[I 2023-12-21 00:17:38,043] Trial 245 pruned. Trial was pruned at iteration 0.
[I 2023-12-21 00:17:38,118] Trial 246 pruned. Trial was pruned at iteration 0.
[I 2023-12-21 00:17:38,196] Trial 247 pruned. Trial was pruned at iteration 4.
[I 2023-12-21 00:17:38,267] Trial 248 pruned. Trial was pruned at iteration 0.
[I 2023-12-21 00:17:39,088] Trial 249 pruned. Trial was pruned at iteration 287.
Completed hyperparameter tuning with best aft-nloglik = 1.9120609065817238.
Re-running the best trial... params = {'verbosity': 0, 'objective': 'survival:aft', 'eval_metric': 'aft-nloglik', 'tree_method': 'gpu_hist', 'device': 'cuda', 'learning_rate': 0.9434244968230481, 'aft_loss_distribution': 'normal', 'aft_loss_distribution_scale': 1.4148964262457076, 'max_depth': 8, 'booster': 'gbtree', 'scale_pos_weight': 0.23468262927655376, 'alpha': 9.727175001115492, 'lambda': 9.58314630993774, 'eta': 0.09526805813675791, 'sampling_method': 'gradient_based', 'subsample': 0.5194961617535403, 'gamma': 8.84108478949865}
[W 2023-12-21 00:17:39,441] Trial 2 is omitted in visualization because its objective value is inf or nan.
[W 2023-12-21 00:17:39,443] Trial 4 is omitted in visualization because its objective value is inf or nan.
[W 2023-12-21 00:17:39,445] Trial 6 is omitted in visualization because its objective value is inf or nan.
[W 2023-12-21 00:17:39,447] Trial 13 is omitted in visualization because its objective value is inf or nan.
[W 2023-12-21 00:17:39,449] Trial 35 is omitted in visualization because its objective value is inf or nan.
[W 2023-12-21 00:17:39,455] Trial 37 is omitted in visualization because its objective value is inf or nan.
[W 2023-12-21 00:17:39,457] Trial 45 is omitted in visualization because its objective value is inf or nan.
[W 2023-12-21 00:17:39,459] Trial 53 is omitted in visualization because its objective value is inf or nan.
[W 2023-12-21 00:17:39,461] Trial 54 is omitted in visualization because its objective value is inf or nan.
[W 2023-12-21 00:17:39,464] Trial 65 is omitted in visualization because its objective value is inf or nan.
[W 2023-12-21 00:17:39,465] Trial 68 is omitted in visualization because its objective value is inf or nan.
[W 2023-12-21 00:17:39,465] Trial 71 is omitted in visualization because its objective value is inf or nan.
[W 2023-12-21 00:17:39,466] Trial 72 is omitted in visualization because its objective value is inf or nan.
[W 2023-12-21 00:17:39,470] Trial 78 is omitted in visualization because its objective value is inf or nan.
[W 2023-12-21 00:17:39,471] Trial 81 is omitted in visualization because its objective value is inf or nan.
[W 2023-12-21 00:17:39,472] Trial 84 is omitted in visualization because its objective value is inf or nan.
[W 2023-12-21 00:17:39,473] Trial 93 is omitted in visualization because its objective value is inf or nan.
[W 2023-12-21 00:17:39,474] Trial 98 is omitted in visualization because its objective value is inf or nan.
[W 2023-12-21 00:17:39,475] Trial 100 is omitted in visualization because its objective value is inf or nan.
[W 2023-12-21 00:17:39,476] Trial 118 is omitted in visualization because its objective value is inf or nan.
[W 2023-12-21 00:17:39,477] Trial 124 is omitted in visualization because its objective value is inf or nan.
[W 2023-12-21 00:17:39,478] Trial 129 is omitted in visualization because its objective value is inf or nan.
[W 2023-12-21 00:17:39,479] Trial 154 is omitted in visualization because its objective value is inf or nan.
[W 2023-12-21 00:17:39,480] Trial 159 is omitted in visualization because its objective value is inf or nan.
[W 2023-12-21 00:17:39,481] Trial 164 is omitted in visualization because its objective value is inf or nan.
[W 2023-12-21 00:17:39,482] Trial 183 is omitted in visualization because its objective value is inf or nan.
[W 2023-12-21 00:17:39,483] Trial 186 is omitted in visualization because its objective value is inf or nan.
[W 2023-12-21 00:17:39,484] Trial 191 is omitted in visualization because its objective value is inf or nan.
[W 2023-12-21 00:17:39,485] Trial 211 is omitted in visualization because its objective value is inf or nan.
[W 2023-12-21 00:17:39,489] Trial 212 is omitted in visualization because its objective value is inf or nan.
[W 2023-12-21 00:17:39,490] Trial 222 is omitted in visualization because its objective value is inf or nan.
TRN1 | R2:0.338; p:0.0 | C:68.79 |3h:0.955 |6h:0.944 |9h:0.935 |12h:0.727 |15h:0.727 |18h:0.723 |24h:0.565 |48h:0.556 |72h:0.550 |1wk:0.372 |2wks:0.367 |1mon:0.308 |
TRN2 | R2:0.325; p:1.374e-78 | C:67.71 |3h:0.955 |6h:0.944 |9h:0.935 |12h:0.726 |15h:0.726 |18h:0.722 |24h:0.564 |48h:0.554 |72h:0.549 |1wk:0.362 |2wks:0.365 |1mon:0.313 |
VAL | R2:0.289; p:6.156e-62 | C:66.41 |3h:0.955 |6h:0.943 |9h:0.935 |12h:0.727 |15h:0.727 |18h:0.722 |24h:0.565 |48h:0.556 |72h:0.548 |1wk:0.372 |2wks:0.367 |1mon:0.301 |
[I 2023-12-21 00:17:44,051] A new study created in memory with name: no-name-e3cfba3a-5f5c-4933-88b8-39c94081223c
TST | R2:0.248; p:3.576e-271 | C:64.09 |3h:0.952 |6h:0.937 |9h:0.926 |12h:0.723 |15h:0.723 |18h:0.707 |24h:0.435 |48h:0.432 |72h:0.430 |1wk:0.339 |2wks:0.350 |1mon:0.309 |
/content/drive/MyDrive/intermediates2/res//outcome2_xgb-aft_inp21_k9_emb1_rdims8.json
Dimensionality reduced word embedding 2 with ['location_numeric', 'race_numeric', 'sex_numeric', 'body_part_numeric', 'product_1_numeric', 'product_2_numeric', 'drug_numeric', 'alcohol_numeric', 'month']
Dimensionality reduced word embedding 2 with ['location_numeric', 'race_numeric', 'sex_numeric', 'body_part_numeric', 'product_1_numeric', 'product_2_numeric', 'drug_numeric', 'alcohol_numeric', 'month']
Dimensionality reduced word embedding 2 with ['location_numeric', 'race_numeric', 'sex_numeric', 'body_part_numeric', 'product_1_numeric', 'product_2_numeric', 'drug_numeric', 'alcohol_numeric', 'month']
Dimensionality reduced word embedding 2 with ['location_numeric', 'race_numeric', 'sex_numeric', 'body_part_numeric', 'product_1_numeric', 'product_2_numeric', 'drug_numeric', 'alcohol_numeric', 'month']
trn1
trn2
val
tst
[I 2023-12-21 00:17:45,111] Trial 0 finished with value: 2.6127778324175814 and parameters: {'learning_rate': 0.06460444370257686, 'aft_loss_distribution': 'logistic', 'aft_loss_distribution_scale': 9.377491778594662, 'max_depth': 8, 'booster': 'gbtree', 'scale_pos_weight': 1.7050577074483402, 'alpha': 7.275334739241477, 'lambda': 3.086529438728012, 'eta': 0.02443934139481596, 'sampling_method': 'gradient_based', 'subsample': 0.3798010237897189, 'gamma': 7.794644812623551}. Best is trial 0 with value: 2.6127778324175814.
[I 2023-12-21 00:17:45,263] Trial 1 finished with value: inf and parameters: {'learning_rate': 0.6971749503062364, 'aft_loss_distribution': 'extreme', 'aft_loss_distribution_scale': 5.03820928911644, 'max_depth': 9, 'booster': 'gbtree', 'scale_pos_weight': 1.9707362246314417, 'alpha': 5.470277198678558, 'lambda': 7.357785113315178, 'eta': 0.335712514145191, 'sampling_method': 'uniform', 'subsample': 0.6713823253665204, 'gamma': 7.150177276606333}. Best is trial 0 with value: 2.6127778324175814.
[I 2023-12-21 03:56:58,927] Trial 2 finished with value: 2.32309079692119 and parameters: {'learning_rate': 0.003890643180148232, 'aft_loss_distribution': 'logistic', 'aft_loss_distribution_scale': 4.164438546016776, 'max_depth': 5, 'booster': 'dart', 'scale_pos_weight': 3.6801902887398104, 'alpha': 7.4139574909989285, 'lambda': 3.809818193759251, 'eta': 0.776145462392769, 'sampling_method': 'uniform', 'subsample': 0.6283063201265369, 'gamma': 1.329243489168379}. Best is trial 2 with value: 2.32309079692119.
[I 2023-12-21 03:56:59,725] Trial 3 finished with value: 2.3348295043646217 and parameters: {'learning_rate': 0.13975407868526535, 'aft_loss_distribution': 'extreme', 'aft_loss_distribution_scale': 5.134417225291521, 'max_depth': 6, 'booster': 'gbtree', 'scale_pos_weight': 1.4907341308723556, 'alpha': 2.097479743740423, 'lambda': 8.702909719567636, 'eta': 0.5252579916758774, 'sampling_method': 'uniform', 'subsample': 0.7106235372797159, 'gamma': 9.124473003630314}. Best is trial 2 with value: 2.32309079692119.
[I 2023-12-21 03:57:00,199] Trial 4 finished with value: 1.9725030669319883 and parameters: {'learning_rate': 0.3826476700103235, 'aft_loss_distribution': 'normal', 'aft_loss_distribution_scale': 2.2158662238466476, 'max_depth': 3, 'booster': 'gbtree', 'scale_pos_weight': 2.324834631368839, 'alpha': 7.234578617056923, 'lambda': 5.062782822780782, 'eta': 0.43604141073499814, 'sampling_method': 'uniform', 'subsample': 0.07607608042087496, 'gamma': 0.32031410168688484}. Best is trial 4 with value: 1.9725030669319883.
[I 2023-12-21 03:57:00,210] Trial 5 pruned. Trial was pruned at iteration 0.
[I 2023-12-21 03:57:00,220] Trial 6 pruned. Trial was pruned at iteration 0.
[I 2023-12-21 03:57:00,285] Trial 7 pruned. Trial was pruned at iteration 9.
[I 2023-12-21 03:57:00,327] Trial 8 pruned. Trial was pruned at iteration 7.
[I 2023-12-21 03:57:00,687] Trial 9 pruned. Trial was pruned at iteration 30.
[I 2023-12-21 03:57:00,854] Trial 10 finished with value: inf and parameters: {'learning_rate': 0.9964732723832044, 'aft_loss_distribution': 'normal', 'aft_loss_distribution_scale': 0.7777427238024242, 'max_depth': 3, 'booster': 'gbtree', 'scale_pos_weight': 0.1948828487276082, 'alpha': 9.898288037493682, 'lambda': 6.411472451372836, 'eta': 0.9930046163560429, 'sampling_method': 'gradient_based', 'subsample': 0.02310401345847351, 'gamma': 0.36085123099459315}. Best is trial 4 with value: 1.9725030669319883.
[I 2023-12-21 03:57:05,761] Trial 11 finished with value: 2.0346044305666684 and parameters: {'learning_rate': 0.6916225762607394, 'aft_loss_distribution': 'normal', 'aft_loss_distribution_scale': 2.9324226576539063, 'max_depth': 4, 'booster': 'dart', 'scale_pos_weight': 2.515640568382592, 'alpha': 5.501106304844225, 'lambda': 4.76965649735763, 'eta': 0.7613129975142772, 'sampling_method': 'uniform', 'subsample': 0.5800822403394887, 'gamma': 0.7438592358775544}. Best is trial 4 with value: 1.9725030669319883.
[I 2023-12-21 03:57:11,866] Trial 12 finished with value: 2.008648919511452 and parameters: {'learning_rate': 0.7387815291936868, 'aft_loss_distribution': 'normal', 'aft_loss_distribution_scale': 2.631085009183007, 'max_depth': 4, 'booster': 'dart', 'scale_pos_weight': 2.494772973557616, 'alpha': 5.107438634674422, 'lambda': 5.7696136554357285, 'eta': 0.7439737666249628, 'sampling_method': 'uniform', 'subsample': 0.48254304329123654, 'gamma': 2.0207082033862083}. Best is trial 4 with value: 1.9725030669319883.
[I 2023-12-21 03:57:13,640] Trial 13 finished with value: inf and parameters: {'learning_rate': 0.772087549616365, 'aft_loss_distribution': 'normal', 'aft_loss_distribution_scale': 2.1027563573148034, 'max_depth': 4, 'booster': 'dart', 'scale_pos_weight': 2.403768028441763, 'alpha': 0.038929513338982424, 'lambda': 6.3254826541957865, 'eta': 0.2156128820215436, 'sampling_method': 'uniform', 'subsample': 0.9903311468197173, 'gamma': 2.43430216878824}. Best is trial 4 with value: 1.9725030669319883.
[I 2023-12-21 03:57:13,958] Trial 14 finished with value: 1.9725132193143882 and parameters: {'learning_rate': 0.8697275307084511, 'aft_loss_distribution': 'normal', 'aft_loss_distribution_scale': 2.2710274065558926, 'max_depth': 4, 'booster': 'gbtree', 'scale_pos_weight': 2.2214790978730745, 'alpha': 4.69994491460606, 'lambda': 6.245894179210099, 'eta': 0.9277819404280876, 'sampling_method': 'gradient_based', 'subsample': 0.44002360523926004, 'gamma': 5.916886341698728}. Best is trial 4 with value: 1.9725030669319883.
[I 2023-12-21 03:57:14,204] Trial 15 finished with value: inf and parameters: {'learning_rate': 0.9626678705601784, 'aft_loss_distribution': 'normal', 'aft_loss_distribution_scale': 1.6321549954950678, 'max_depth': 5, 'booster': 'gbtree', 'scale_pos_weight': 0.99584570976538, 'alpha': 3.575758393861464, 'lambda': 7.810321147985917, 'eta': 0.9643233472366513, 'sampling_method': 'gradient_based', 'subsample': 0.22044909316784694, 'gamma': 5.909056693089995}. Best is trial 4 with value: 1.9725030669319883.
[I 2023-12-21 03:57:14,264] Trial 16 pruned. Trial was pruned at iteration 0.
[I 2023-12-21 03:57:14,316] Trial 17 pruned. Trial was pruned at iteration 0.
[I 2023-12-21 03:57:14,725] Trial 18 finished with value: 1.8979708364917565 and parameters: {'learning_rate': 0.8649288986611656, 'aft_loss_distribution': 'normal', 'aft_loss_distribution_scale': 1.4037608823157859, 'max_depth': 4, 'booster': 'gbtree', 'scale_pos_weight': 0.7233324107735448, 'alpha': 6.370471209107136, 'lambda': 7.473549889802964, 'eta': 0.8848841274347736, 'sampling_method': 'gradient_based', 'subsample': 0.5090749860779702, 'gamma': 6.545775974978939}. Best is trial 18 with value: 1.8979708364917565.
[I 2023-12-21 03:57:14,782] Trial 19 pruned. Trial was pruned at iteration 0.
[I 2023-12-21 03:57:14,829] Trial 20 pruned. Trial was pruned at iteration 0.
[I 2023-12-21 03:57:15,075] Trial 21 finished with value: 1.9317459151874703 and parameters: {'learning_rate': 0.8762062060289595, 'aft_loss_distribution': 'normal', 'aft_loss_distribution_scale': 1.8437859581591143, 'max_depth': 4, 'booster': 'gbtree', 'scale_pos_weight': 2.1482498373607832, 'alpha': 4.131754921826415, 'lambda': 6.900926562786136, 'eta': 0.9165705512905596, 'sampling_method': 'gradient_based', 'subsample': 0.463705693202649, 'gamma': 6.545645428901179}. Best is trial 18 with value: 1.8979708364917565.
[I 2023-12-21 03:57:15,311] Trial 22 finished with value: inf and parameters: {'learning_rate': 0.8782285676288012, 'aft_loss_distribution': 'normal', 'aft_loss_distribution_scale': 1.2783765488764494, 'max_depth': 5, 'booster': 'gbtree', 'scale_pos_weight': 1.7877095200708832, 'alpha': 6.41366443489914, 'lambda': 8.328128434365277, 'eta': 0.8546636760678639, 'sampling_method': 'gradient_based', 'subsample': 0.2793083517550462, 'gamma': 6.786921826405566}. Best is trial 18 with value: 1.8979708364917565.
[I 2023-12-21 03:57:15,369] Trial 23 pruned. Trial was pruned at iteration 1.
[I 2023-12-21 03:57:15,416] Trial 24 pruned. Trial was pruned at iteration 0.
[I 2023-12-21 03:57:15,462] Trial 25 pruned. Trial was pruned at iteration 0.
[I 2023-12-21 03:57:15,515] Trial 26 pruned. Trial was pruned at iteration 0.
[I 2023-12-21 03:57:15,564] Trial 27 pruned. Trial was pruned at iteration 1.
[I 2023-12-21 03:57:15,613] Trial 28 pruned. Trial was pruned at iteration 0.
[I 2023-12-21 03:57:15,659] Trial 29 pruned. Trial was pruned at iteration 0.
[I 2023-12-21 03:57:15,717] Trial 30 pruned. Trial was pruned at iteration 2.
