[I 2023-12-21 02:31:20,173] Trial 364 pruned. Trial was pruned at iteration 0.
[I 2023-12-21 02:31:20,222] Trial 365 pruned. Trial was pruned at iteration 0.
[I 2023-12-21 02:31:20,385] Trial 366 finished with value: inf and parameters: {'learning_rate': 0.8563021054169131, 'aft_loss_distributi                                                                     on': 'normal', 'aft_loss_distribution_scale': 1.2589192085811556, 'max_depth': 7, 'booster': 'gbtree', 'scale_pos_weight': 3.744001707680                                                                     9493, 'alpha': 8.944024747796146, 'lambda': 3.977655489268695, 'eta': 0.3934688446772351, 'sampling_method': 'gradient_based', 'subsample                                                                     ': 0.23970698265240398, 'gamma': 9.829774831598758}. Best is trial 4 with value: 4.246843583964676.
[I 2023-12-21 02:31:20,434] Trial 367 pruned. Trial was pruned at iteration 0.
[I 2023-12-21 02:31:20,483] Trial 368 pruned. Trial was pruned at iteration 0.
[I 2023-12-21 02:31:20,533] Trial 369 pruned. Trial was pruned at iteration 0.
[I 2023-12-21 02:31:20,584] Trial 370 pruned. Trial was pruned at iteration 1.
[I 2023-12-21 02:31:20,634] Trial 371 pruned. Trial was pruned at iteration 0.
[I 2023-12-21 02:31:20,683] Trial 372 pruned. Trial was pruned at iteration 0.
[I 2023-12-21 02:31:20,733] Trial 373 pruned. Trial was pruned at iteration 1.
[I 2023-12-21 02:31:20,782] Trial 374 pruned. Trial was pruned at iteration 0.
[I 2023-12-21 02:31:20,831] Trial 375 pruned. Trial was pruned at iteration 0.
[I 2023-12-21 02:31:20,880] Trial 376 pruned. Trial was pruned at iteration 0.
[I 2023-12-21 02:31:20,933] Trial 377 pruned. Trial was pruned at iteration 1.
[I 2023-12-21 02:31:20,984] Trial 378 pruned. Trial was pruned at iteration 0.
[I 2023-12-21 02:31:21,035] Trial 379 pruned. Trial was pruned at iteration 0.
[I 2023-12-21 02:31:21,084] Trial 380 pruned. Trial was pruned at iteration 0.
[I 2023-12-21 02:31:21,134] Trial 381 pruned. Trial was pruned at iteration 1.
[I 2023-12-21 02:31:21,185] Trial 382 pruned. Trial was pruned at iteration 0.
[I 2023-12-21 02:31:21,237] Trial 383 pruned. Trial was pruned at iteration 0.
[I 2023-12-21 02:31:21,286] Trial 384 pruned. Trial was pruned at iteration 0.
[I 2023-12-21 02:31:21,337] Trial 385 pruned. Trial was pruned at iteration 0.
[I 2023-12-21 02:31:21,389] Trial 386 pruned. Trial was pruned at iteration 1.
[I 2023-12-21 02:31:21,438] Trial 387 pruned. Trial was pruned at iteration 0.
[I 2023-12-21 02:31:21,488] Trial 388 pruned. Trial was pruned at iteration 0.
[I 2023-12-21 02:31:21,538] Trial 389 pruned. Trial was pruned at iteration 1.
[I 2023-12-21 02:31:21,590] Trial 390 pruned. Trial was pruned at iteration 0.
[I 2023-12-21 02:31:21,640] Trial 391 pruned. Trial was pruned at iteration 0.
[I 2023-12-21 02:31:21,766] Trial 392 finished with value: inf and parameters: {'learning_rate': 0.6896762015989613, 'aft_loss_distributi                                                                     on': 'logistic', 'aft_loss_distribution_scale': 0.902321004317693, 'max_depth': 10, 'booster': 'gbtree', 'scale_pos_weight': 0.5595713567                                                                     969501, 'alpha': 8.973733549302114, 'lambda': 9.886236761962687, 'eta': 0.14696119191526946, 'sampling_method': 'uniform', 'subsample': 0                                                                     .011057825794739573, 'gamma': 8.87387095558967}. Best is trial 4 with value: 4.246843583964676.
[I 2023-12-21 02:31:21,819] Trial 393 pruned. Trial was pruned at iteration 1.
[I 2023-12-21 02:31:21,869] Trial 394 pruned. Trial was pruned at iteration 0.
[I 2023-12-21 02:31:21,918] Trial 395 pruned. Trial was pruned at iteration 0.
[I 2023-12-21 02:31:21,969] Trial 396 pruned. Trial was pruned at iteration 0.
[I 2023-12-21 02:31:22,020] Trial 397 pruned. Trial was pruned at iteration 0.
[I 2023-12-21 02:31:22,139] Trial 398 finished with value: inf and parameters: {'learning_rate': 0.8291582060513087, 'aft_loss_distributi                                                                     on': 'normal', 'aft_loss_distribution_scale': 1.2715673979247446, 'max_depth': 8, 'booster': 'gbtree', 'scale_pos_weight': 0.986522184972                                                                     2698, 'alpha': 1.194090773588504, 'lambda': 4.311568822584147, 'eta': 0.07721967587314452, 'sampling_method': 'uniform', 'subsample': 0.1                                                                     5238853007844444, 'gamma': 9.627971977516582}. Best is trial 4 with value: 4.246843583964676.
[I 2023-12-21 02:31:22,191] Trial 399 pruned. Trial was pruned at iteration 0.
[I 2023-12-21 02:31:22,241] Trial 400 pruned. Trial was pruned at iteration 0.
[I 2023-12-21 02:31:22,291] Trial 401 pruned. Trial was pruned at iteration 0.
[I 2023-12-21 02:31:22,343] Trial 402 pruned. Trial was pruned at iteration 1.
[I 2023-12-21 02:31:22,393] Trial 403 pruned. Trial was pruned at iteration 0.
[I 2023-12-21 02:31:22,446] Trial 404 pruned. Trial was pruned at iteration 0.
[I 2023-12-21 02:31:22,497] Trial 405 pruned. Trial was pruned at iteration 0.
[I 2023-12-21 02:31:22,547] Trial 406 pruned. Trial was pruned at iteration 0.
[I 2023-12-21 02:31:22,598] Trial 407 pruned. Trial was pruned at iteration 0.
[I 2023-12-21 02:31:22,649] Trial 408 pruned. Trial was pruned at iteration 0.
[I 2023-12-21 02:31:22,700] Trial 409 pruned. Trial was pruned at iteration 0.
[I 2023-12-21 02:31:22,752] Trial 410 pruned. Trial was pruned at iteration 0.
[I 2023-12-21 02:31:22,803] Trial 411 pruned. Trial was pruned at iteration 0.
[I 2023-12-21 02:31:22,855] Trial 412 pruned. Trial was pruned at iteration 0.
[I 2023-12-21 02:31:22,907] Trial 413 pruned. Trial was pruned at iteration 1.
[I 2023-12-21 02:31:22,958] Trial 414 pruned. Trial was pruned at iteration 0.
[I 2023-12-21 02:31:23,009] Trial 415 pruned. Trial was pruned at iteration 0.
[I 2023-12-21 02:31:23,060] Trial 416 pruned. Trial was pruned at iteration 0.
[I 2023-12-21 02:31:23,113] Trial 417 pruned. Trial was pruned at iteration 0.
[I 2023-12-21 02:31:23,166] Trial 418 pruned. Trial was pruned at iteration 0.
[I 2023-12-21 02:31:23,218] Trial 419 pruned. Trial was pruned at iteration 0.
[I 2023-12-21 02:31:23,269] Trial 420 pruned. Trial was pruned at iteration 0.
[I 2023-12-21 02:31:23,320] Trial 421 pruned. Trial was pruned at iteration 0.
[I 2023-12-21 02:31:23,371] Trial 422 pruned. Trial was pruned at iteration 0.
[I 2023-12-21 02:31:23,424] Trial 423 pruned. Trial was pruned at iteration 0.
[I 2023-12-21 02:31:23,475] Trial 424 pruned. Trial was pruned at iteration 0.
[I 2023-12-21 02:31:23,527] Trial 425 pruned. Trial was pruned at iteration 0.
[I 2023-12-21 02:31:23,578] Trial 426 pruned. Trial was pruned at iteration 0.
[I 2023-12-21 02:31:23,635] Trial 427 pruned. Trial was pruned at iteration 1.
[I 2023-12-21 02:31:23,687] Trial 428 pruned. Trial was pruned at iteration 0.
[I 2023-12-21 02:31:23,740] Trial 429 pruned. Trial was pruned at iteration 0.
[I 2023-12-21 02:31:23,793] Trial 430 pruned. Trial was pruned at iteration 0.
[I 2023-12-21 02:31:23,846] Trial 431 pruned. Trial was pruned at iteration 0.
[I 2023-12-21 02:31:23,897] Trial 432 pruned. Trial was pruned at iteration 0.
[I 2023-12-21 02:31:23,952] Trial 433 pruned. Trial was pruned at iteration 1.
[I 2023-12-21 02:31:24,005] Trial 434 pruned. Trial was pruned at iteration 0.
[I 2023-12-21 02:31:24,058] Trial 435 pruned. Trial was pruned at iteration 1.
[I 2023-12-21 02:31:24,112] Trial 436 pruned. Trial was pruned at iteration 0.
[I 2023-12-21 02:31:24,166] Trial 437 pruned. Trial was pruned at iteration 0.
[I 2023-12-21 02:31:24,217] Trial 438 pruned. Trial was pruned at iteration 0.
[I 2023-12-21 02:31:24,269] Trial 439 pruned. Trial was pruned at iteration 0.
[I 2023-12-21 02:31:24,321] Trial 440 pruned. Trial was pruned at iteration 0.
[I 2023-12-21 02:31:24,375] Trial 441 pruned. Trial was pruned at iteration 0.
[I 2023-12-21 02:31:24,428] Trial 442 pruned. Trial was pruned at iteration 0.
[I 2023-12-21 02:31:24,483] Trial 443 pruned. Trial was pruned at iteration 1.
[I 2023-12-21 02:31:24,535] Trial 444 pruned. Trial was pruned at iteration 0.
[I 2023-12-21 02:31:24,587] Trial 445 pruned. Trial was pruned at iteration 0.
[I 2023-12-21 02:31:24,639] Trial 446 pruned. Trial was pruned at iteration 0.
[I 2023-12-21 02:31:24,694] Trial 447 pruned. Trial was pruned at iteration 0.
[I 2023-12-21 02:31:24,747] Trial 448 pruned. Trial was pruned at iteration 0.
[I 2023-12-21 02:31:24,802] Trial 449 pruned. Trial was pruned at iteration 0.
[I 2023-12-21 02:31:24,855] Trial 450 pruned. Trial was pruned at iteration 0.
[I 2023-12-21 02:31:25,042] Trial 451 finished with value: inf and parameters: {'learning_rate': 0.8471068172083587, 'aft_loss_distributi                                                                     on': 'normal', 'aft_loss_distribution_scale': 1.41840363399819, 'max_depth': 7, 'booster': 'gbtree', 'scale_pos_weight': 2.27816800680096                                                                     86, 'alpha': 9.695041148453154, 'lambda': 4.5736298479219935, 'eta': 0.8990926149353907, 'sampling_method': 'uniform', 'subsample': 0.263                                                                     754018325339, 'gamma': 0.9158729551338389}. Best is trial 4 with value: 4.246843583964676.
[I 2023-12-21 02:31:25,095] Trial 452 pruned. Trial was pruned at iteration 0.
[I 2023-12-21 02:31:25,148] Trial 453 pruned. Trial was pruned at iteration 0.
[I 2023-12-21 02:31:25,205] Trial 454 pruned. Trial was pruned at iteration 1.
[I 2023-12-21 02:31:25,258] Trial 455 pruned. Trial was pruned at iteration 0.
[I 2023-12-21 02:31:25,315] Trial 456 pruned. Trial was pruned at iteration 1.
[I 2023-12-21 02:31:25,368] Trial 457 pruned. Trial was pruned at iteration 0.
[I 2023-12-21 02:31:25,421] Trial 458 pruned. Trial was pruned at iteration 0.
[I 2023-12-21 02:31:25,548] Trial 459 finished with value: inf and parameters: {'learning_rate': 0.8605646311386251, 'aft_loss_distributi                                                                     on': 'normal', 'aft_loss_distribution_scale': 0.960918738121205, 'max_depth': 10, 'booster': 'gbtree', 'scale_pos_weight': 6.009867617297                                                                     333, 'alpha': 8.881731842487435, 'lambda': 9.727065143510695, 'eta': 0.08444767638530401, 'sampling_method': 'uniform', 'subsample': 0.96                                                                     18329593684546, 'gamma': 7.221470686415566}. Best is trial 4 with value: 4.246843583964676.
[I 2023-12-21 02:31:25,601] Trial 460 pruned. Trial was pruned at iteration 0.
[I 2023-12-21 02:31:25,654] Trial 461 pruned. Trial was pruned at iteration 0.
[I 2023-12-21 02:31:25,707] Trial 462 pruned. Trial was pruned at iteration 0.
[I 2023-12-21 02:31:25,764] Trial 463 pruned. Trial was pruned at iteration 0.
[I 2023-12-21 02:31:25,912] Trial 464 finished with value: inf and parameters: {'learning_rate': 0.9212362598518986, 'aft_loss_distributi                                                                     on': 'normal', 'aft_loss_distribution_scale': 1.1769016778740231, 'max_depth': 6, 'booster': 'gbtree', 'scale_pos_weight': 9.077586270312                                                                     516, 'alpha': 9.227756866744276, 'lambda': 1.9842446810378747, 'eta': 0.05165955489227165, 'sampling_method': 'uniform', 'subsample': 0.0                                                                     8991762514450802, 'gamma': 5.147330282903174}. Best is trial 4 with value: 4.246843583964676.
[I 2023-12-21 02:31:25,965] Trial 465 pruned. Trial was pruned at iteration 0.
[I 2023-12-21 02:31:26,018] Trial 466 pruned. Trial was pruned at iteration 0.
[I 2023-12-21 02:31:26,195] Trial 467 finished with value: 4.354478056965994 and parameters: {'learning_rate': 0.7694175487859247, 'aft_l                                                                     oss_distribution': 'normal', 'aft_loss_distribution_scale': 1.491080819506277, 'max_depth': 10, 'booster': 'gbtree', 'scale_pos_weight':                                                                      1.814828222885448, 'alpha': 8.40187647122053, 'lambda': 9.795664500064646, 'eta': 0.9622041202012677, 'sampling_method': 'uniform', 'subs                                                                     ample': 0.26292397845358073, 'gamma': 8.742910684954}. Best is trial 4 with value: 4.246843583964676.
[I 2023-12-21 02:31:26,251] Trial 468 pruned. Trial was pruned at iteration 1.
[I 2023-12-21 02:31:34,632] Trial 469 pruned. Trial was pruned at iteration 157.
[I 2023-12-21 02:31:34,757] Trial 470 finished with value: inf and parameters: {'learning_rate': 0.8405275171840176, 'aft_loss_distributi                                                                     on': 'normal', 'aft_loss_distribution_scale': 1.0396299454996305, 'max_depth': 10, 'booster': 'gbtree', 'scale_pos_weight': 1.44680090839                                                                     47218, 'alpha': 8.55316691296222, 'lambda': 9.50654145603012, 'eta': 0.9431890941218214, 'sampling_method': 'uniform', 'subsample': 0.240                                                                     13711342508837, 'gamma': 8.56151258294417}. Best is trial 4 with value: 4.246843583964676.
[I 2023-12-21 02:31:34,811] Trial 471 pruned. Trial was pruned at iteration 0.
[I 2023-12-21 02:31:34,864] Trial 472 pruned. Trial was pruned at iteration 0.
[I 2023-12-21 02:31:34,977] Trial 473 finished with value: inf and parameters: {'learning_rate': 0.8209291286647621, 'aft_loss_distributi                                                                     on': 'normal', 'aft_loss_distribution_scale': 1.2715724059775089, 'max_depth': 10, 'booster': 'gbtree', 'scale_pos_weight': 1.22634161285                                                                     62015, 'alpha': 7.74998988078729, 'lambda': 9.298601026231063, 'eta': 0.9598181158692242, 'sampling_method': 'uniform', 'subsample': 0.25                                                                     86527340536251, 'gamma': 8.778586358877002}. Best is trial 4 with value: 4.246843583964676.
[I 2023-12-21 02:31:35,030] Trial 474 pruned. Trial was pruned at iteration 0.
[I 2023-12-21 02:31:35,084] Trial 475 pruned. Trial was pruned at iteration 0.
[I 2023-12-21 02:31:35,137] Trial 476 pruned. Trial was pruned at iteration 0.
[I 2023-12-21 02:31:35,192] Trial 477 pruned. Trial was pruned at iteration 0.
[I 2023-12-21 02:31:35,250] Trial 478 pruned. Trial was pruned at iteration 0.
[I 2023-12-21 02:31:35,304] Trial 479 pruned. Trial was pruned at iteration 0.
[I 2023-12-21 02:31:35,358] Trial 480 pruned. Trial was pruned at iteration 0.
[I 2023-12-21 02:31:35,412] Trial 481 pruned. Trial was pruned at iteration 0.
[I 2023-12-21 02:31:35,466] Trial 482 pruned. Trial was pruned at iteration 0.
[I 2023-12-21 02:31:35,520] Trial 483 pruned. Trial was pruned at iteration 0.
[I 2023-12-21 02:31:35,581] Trial 484 pruned. Trial was pruned at iteration 0.
[I 2023-12-21 02:31:35,635] Trial 485 pruned. Trial was pruned at iteration 0.
[I 2023-12-21 02:31:35,860] Trial 486 pruned. Trial was pruned at iteration 157.
[I 2023-12-21 02:31:35,916] Trial 487 pruned. Trial was pruned at iteration 1.
[I 2023-12-21 02:31:35,972] Trial 488 pruned. Trial was pruned at iteration 0.
[I 2023-12-21 02:31:36,026] Trial 489 pruned. Trial was pruned at iteration 0.
[I 2023-12-21 02:31:36,083] Trial 490 pruned. Trial was pruned at iteration 0.
[I 2023-12-21 02:31:36,138] Trial 491 pruned. Trial was pruned at iteration 0.
[I 2023-12-21 02:31:36,194] Trial 492 pruned. Trial was pruned at iteration 0.
[I 2023-12-21 02:31:36,249] Trial 493 pruned. Trial was pruned at iteration 0.
[I 2023-12-21 02:31:36,306] Trial 494 pruned. Trial was pruned at iteration 0.
[I 2023-12-21 02:31:36,361] Trial 495 pruned. Trial was pruned at iteration 0.
[I 2023-12-21 02:31:36,418] Trial 496 pruned. Trial was pruned at iteration 1.
[I 2023-12-21 02:31:36,474] Trial 497 pruned. Trial was pruned at iteration 0.
[I 2023-12-21 02:31:36,529] Trial 498 pruned. Trial was pruned at iteration 0.
