[I 2023-12-21 04:03:23,440] Trial 499 pruned. Trial was pruned at iteration 0.
[W 2023-12-21 04:03:23,553] Trial 3 is omitted in visualization because its objective value is inf or nan.
[W 2023-12-21 04:03:23,553] Trial 5 is omitted in visualization because its objective value is inf or nan.
[W 2023-12-21 04:03:23,553] Trial 10 is omitted in visualization because its objective value is inf or nan.
[W 2023-12-21 04:03:23,553] Trial 19 is omitted in visualization because its objective value is inf or nan.
[W 2023-12-21 04:03:23,553] Trial 22 is omitted in visualization because its objective value is inf or nan.
[W 2023-12-21 04:03:23,553] Trial 24 is omitted in visualization because its objective value is inf or nan.
[W 2023-12-21 04:03:23,553] Trial 26 is omitted in visualization because its objective value is inf or nan.
[W 2023-12-21 04:03:23,553] Trial 31 is omitted in visualization because its objective value is inf or nan.
[W 2023-12-21 04:03:23,553] Trial 43 is omitted in visualization because its objective value is inf or nan.
[W 2023-12-21 04:03:23,553] Trial 50 is omitted in visualization because its objective value is inf or nan.
[W 2023-12-21 04:03:23,553] Trial 64 is omitted in visualization because its objective value is inf or nan.
[W 2023-12-21 04:03:23,553] Trial 66 is omitted in visualization because its objective value is inf or nan.
[W 2023-12-21 04:03:23,553] Trial 74 is omitted in visualization because its objective value is inf or nan.
[W 2023-12-21 04:03:23,553] Trial 75 is omitted in visualization because its objective value is inf or nan.
[W 2023-12-21 04:03:23,553] Trial 82 is omitted in visualization because its objective value is inf or nan.
[W 2023-12-21 04:03:23,554] Trial 86 is omitted in visualization because its objective value is inf or nan.
[W 2023-12-21 04:03:23,554] Trial 88 is omitted in visualization because its objective value is inf or nan.
[W 2023-12-21 04:03:23,554] Trial 91 is omitted in visualization because its objective value is inf or nan.
[W 2023-12-21 04:03:23,554] Trial 93 is omitted in visualization because its objective value is inf or nan.
[W 2023-12-21 04:03:23,554] Trial 96 is omitted in visualization because its objective value is inf or nan.
[W 2023-12-21 04:03:23,554] Trial 97 is omitted in visualization because its objective value is inf or nan.
[W 2023-12-21 04:03:23,554] Trial 102 is omitted in visualization because its objective value is inf or nan.
[W 2023-12-21 04:03:23,554] Trial 104 is omitted in visualization because its objective value is inf or nan.
[W 2023-12-21 04:03:23,554] Trial 105 is omitted in visualization because its objective value is inf or nan.
[W 2023-12-21 04:03:23,554] Trial 111 is omitted in visualization because its objective value is inf or nan.
[W 2023-12-21 04:03:23,554] Trial 112 is omitted in visualization because its objective value is inf or nan.
[W 2023-12-21 04:03:23,554] Trial 121 is omitted in visualization because its objective value is inf or nan.
[W 2023-12-21 04:03:23,554] Trial 127 is omitted in visualization because its objective value is inf or nan.
[W 2023-12-21 04:03:23,554] Trial 138 is omitted in visualization because its objective value is inf or nan.
[W 2023-12-21 04:03:23,554] Trial 160 is omitted in visualization because its objective value is inf or nan.
[W 2023-12-21 04:03:23,554] Trial 162 is omitted in visualization because its objective value is inf or nan.
[W 2023-12-21 04:03:23,554] Trial 174 is omitted in visualization because its objective value is inf or nan.
[W 2023-12-21 04:03:23,554] Trial 175 is omitted in visualization because its objective value is inf or nan.
[W 2023-12-21 04:03:23,554] Trial 177 is omitted in visualization because its objective value is inf or nan.
[W 2023-12-21 04:03:23,554] Trial 183 is omitted in visualization because its objective value is inf or nan.
[W 2023-12-21 04:03:23,554] Trial 191 is omitted in visualization because its objective value is inf or nan.
[W 2023-12-21 04:03:23,555] Trial 193 is omitted in visualization because its objective value is inf or nan.
[W 2023-12-21 04:03:23,555] Trial 197 is omitted in visualization because its objective value is inf or nan.
[W 2023-12-21 04:03:23,555] Trial 208 is omitted in visualization because its objective value is inf or nan.
[W 2023-12-21 04:03:23,555] Trial 230 is omitted in visualization because its objective value is inf or nan.
[W 2023-12-21 04:03:23,555] Trial 239 is omitted in visualization because its objective value is inf or nan.
[W 2023-12-21 04:03:23,555] Trial 240 is omitted in visualization because its objective value is inf or nan.
[W 2023-12-21 04:03:23,555] Trial 249 is omitted in visualization because its objective value is inf or nan.
[W 2023-12-21 04:03:23,555] Trial 253 is omitted in visualization because its objective value is inf or nan.
[W 2023-12-21 04:03:23,555] Trial 256 is omitted in visualization because its objective value is inf or nan.
[W 2023-12-21 04:03:23,555] Trial 262 is omitted in visualization because its objective value is inf or nan.
[W 2023-12-21 04:03:23,555] Trial 263 is omitted in visualization because its objective value is inf or nan.
[W 2023-12-21 04:03:23,555] Trial 269 is omitted in visualization because its objective value is inf or nan.
[W 2023-12-21 04:03:23,555] Trial 302 is omitted in visualization because its objective value is inf or nan.
[W 2023-12-21 04:03:23,555] Trial 303 is omitted in visualization because its objective value is inf or nan.
[W 2023-12-21 04:03:23,555] Trial 321 is omitted in visualization because its objective value is inf or nan.
[W 2023-12-21 04:03:23,555] Trial 322 is omitted in visualization because its objective value is inf or nan.
[W 2023-12-21 04:03:23,555] Trial 332 is omitted in visualization because its objective value is inf or nan.
[W 2023-12-21 04:03:23,555] Trial 336 is omitted in visualization because its objective value is inf or nan.
[W 2023-12-21 04:03:23,555] Trial 339 is omitted in visualization because its objective value is inf or nan.
[W 2023-12-21 04:03:23,555] Trial 341 is omitted in visualization because its objective value is inf or nan.
[W 2023-12-21 04:03:23,555] Trial 374 is omitted in visualization because its objective value is inf or nan.
[W 2023-12-21 04:03:23,555] Trial 375 is omitted in visualization because its objective value is inf or nan.
[W 2023-12-21 04:03:23,556] Trial 388 is omitted in visualization because its objective value is inf or nan.
[W 2023-12-21 04:03:23,556] Trial 398 is omitted in visualization because its objective value is inf or nan.
[W 2023-12-21 04:03:23,556] Trial 413 is omitted in visualization because its objective value is inf or nan.
[W 2023-12-21 04:03:23,556] Trial 422 is omitted in visualization because its objective value is inf or nan.
[W 2023-12-21 04:03:23,556] Trial 438 is omitted in visualization because its objective value is inf or nan.
[W 2023-12-21 04:03:23,556] Trial 446 is omitted in visualization because its objective value is inf or nan.
[W 2023-12-21 04:03:23,556] Trial 461 is omitted in visualization because its objective value is inf or nan.
[W 2023-12-21 04:03:23,556] Trial 462 is omitted in visualization because its objective value is inf or nan.
[W 2023-12-21 04:03:23,556] Trial 466 is omitted in visualization because its objective value is inf or nan.
[W 2023-12-21 04:03:23,556] Trial 490 is omitted in visualization because its objective value is inf or nan.
exo-open: Cannot open display: .
/cvmfs/soft.computecanada.ca/gentoo/2020/usr/bin/xdg-open: line 871: x-www-browser: command not found
/cvmfs/soft.computecanada.ca/gentoo/2020/usr/bin/xdg-open: line 871: firefox: command not found
/cvmfs/soft.computecanada.ca/gentoo/2020/usr/bin/xdg-open: line 871: iceweasel: command not found
/cvmfs/soft.computecanada.ca/gentoo/2020/usr/bin/xdg-open: line 871: seamonkey: command not found
/cvmfs/soft.computecanada.ca/gentoo/2020/usr/bin/xdg-open: line 871: mozilla: command not found
/cvmfs/soft.computecanada.ca/gentoo/2020/usr/bin/xdg-open: line 871: epiphany: command not found
/cvmfs/soft.computecanada.ca/gentoo/2020/usr/bin/xdg-open: line 871: konqueror: command not found
/cvmfs/soft.computecanada.ca/gentoo/2020/usr/bin/xdg-open: line 871: chromium: command not found
/cvmfs/soft.computecanada.ca/gentoo/2020/usr/bin/xdg-open: line 871: chromium-browser: command not found
/cvmfs/soft.computecanada.ca/gentoo/2020/usr/bin/xdg-open: line 871: google-chrome: command not found
/cvmfs/soft.computecanada.ca/gentoo/2020/usr/bin/xdg-open: line 871: www-browser: command not found
/cvmfs/soft.computecanada.ca/gentoo/2020/usr/bin/xdg-open: line 871: links2: command not found
/home/lisat/.local/lib/python3.10/site-packages/xgboost/data.py:440: FutureWarning:

is_sparse is deprecated and will be removed in a future version. Check `isinstance(dtype, pd.SparseDtype)` instead.

[I 2023-12-21 04:03:27,111] A new study created in memory with name: no-name-c519abd4-1881-4297-926b-533e097d3d04
[I 2023-12-21 04:03:28,906] Trial 0 finished with value: inf and parameters: {'learning_rate': 0.8310263087263999, 'aft_loss_distribution                                                                     ': 'logistic', 'aft_loss_distribution_scale': 6.299366857891207, 'max_depth': 3, 'booster': 'dart', 'scale_pos_weight': 6.567480731097588                                                                     5, 'alpha': 4.321078736966211, 'lambda': 4.352815344900192, 'eta': 0.7061206756722243, 'sampling_method': 'gradient_based', 'subsample':                                                                      0.0455080952978478, 'gamma': 1.8972752347682436}. Best is trial 0 with value: inf.
[I 2023-12-21 04:03:29,026] Trial 1 finished with value: inf and parameters: {'learning_rate': 0.1603551882471167, 'aft_loss_distribution                                                                     ': 'extreme', 'aft_loss_distribution_scale': 5.665630409133323, 'max_depth': 4, 'booster': 'gbtree', 'scale_pos_weight': 8.41369542411126                                                                     , 'alpha': 1.5805018832275337, 'lambda': 0.26117774130146737, 'eta': 0.8297196791979047, 'sampling_method': 'gradient_based', 'subsample'                                                                     : 0.02765296079997174, 'gamma': 1.1718171904146235}. Best is trial 0 with value: inf.
[I 2023-12-21 04:03:30,057] Trial 2 finished with value: inf and parameters: {'learning_rate': 0.9549786879646748, 'aft_loss_distribution                                                                     ': 'normal', 'aft_loss_distribution_scale': 9.7071257435456, 'max_depth': 3, 'booster': 'dart', 'scale_pos_weight': 4.457147156902926, 'a                                                                     lpha': 2.0932613899656625, 'lambda': 7.945098008674709, 'eta': 0.788777850884982, 'sampling_method': 'gradient_based', 'subsample': 0.015                                                                     111031828797139, 'gamma': 6.902872075043478}. Best is trial 0 with value: inf.
[I 2023-12-21 04:03:30,137] Trial 3 finished with value: 5.823016260713325 and parameters: {'learning_rate': 0.5822029345299742, 'aft_los                                                                     s_distribution': 'extreme', 'aft_loss_distribution_scale': 8.026307611199414, 'max_depth': 6, 'booster': 'gbtree', 'scale_pos_weight': 5.                                                                     589384853596271, 'alpha': 2.147108401195049, 'lambda': 3.4132096531162603, 'eta': 0.9787721269165965, 'sampling_method': 'gradient_based'                                                                     , 'subsample': 0.5135453868730518, 'gamma': 5.49304883316829}. Best is trial 3 with value: 5.823016260713325.
[I 2023-12-21 04:03:30,274] Trial 4 finished with value: inf and parameters: {'learning_rate': 0.9451413665204049, 'aft_loss_distribution                                                                     ': 'extreme', 'aft_loss_distribution_scale': 1.1793272916348934, 'max_depth': 7, 'booster': 'gbtree', 'scale_pos_weight': 7.0415097040514                                                                     99, 'alpha': 0.351845707740158, 'lambda': 6.282639936180803, 'eta': 0.7171179741218421, 'sampling_method': 'uniform', 'subsample': 0.5038                                                                     18898167894, 'gamma': 1.008218068171376}. Best is trial 3 with value: 5.823016260713325.
[I 2023-12-21 04:03:30,374] Trial 5 finished with value: 4.832863111832803 and parameters: {'learning_rate': 0.4912164234485407, 'aft_los                                                                     s_distribution': 'extreme', 'aft_loss_distribution_scale': 2.6141069058768953, 'max_depth': 5, 'booster': 'gbtree', 'scale_pos_weight': 5                                                                     .648539265559047, 'alpha': 5.26408168796941, 'lambda': 3.832069301996318, 'eta': 0.09244693073671528, 'sampling_method': 'gradient_based'                                                                     , 'subsample': 0.37600556001363195, 'gamma': 9.064981087025918}. Best is trial 5 with value: 4.832863111832803.
[I 2023-12-21 04:03:30,458] Trial 6 pruned. Trial was pruned at iteration 72.
[I 2023-12-21 04:03:30,526] Trial 7 pruned. Trial was pruned at iteration 72.
[I 2023-12-21 04:03:30,530] Trial 8 pruned. Trial was pruned at iteration 0.
[I 2023-12-21 04:03:32,289] Trial 9 pruned. Trial was pruned at iteration 75.
[I 2023-12-21 04:03:32,319] Trial 10 pruned. Trial was pruned at iteration 0.
[I 2023-12-21 04:03:32,347] Trial 11 pruned. Trial was pruned at iteration 0.
[I 2023-12-21 04:03:32,465] Trial 12 pruned. Trial was pruned at iteration 75.
[I 2023-12-21 04:03:32,584] Trial 13 finished with value: 5.126622290404485 and parameters: {'learning_rate': 0.6829464800361527, 'aft_lo                                                                     ss_distribution': 'extreme', 'aft_loss_distribution_scale': 3.7382276970014474, 'max_depth': 5, 'booster': 'gbtree', 'scale_pos_weight':                                                                      6.512456627124421, 'alpha': 6.248951854799014, 'lambda': 2.0924668560195823, 'eta': 0.2197327301690117, 'sampling_method': 'gradient_base                                                                     d', 'subsample': 0.539854041062067, 'gamma': 4.024123458286575}. Best is trial 5 with value: 4.832863111832803.
[I 2023-12-21 04:03:32,704] Trial 14 pruned. Trial was pruned at iteration 75.
[I 2023-12-21 04:03:32,734] Trial 15 pruned. Trial was pruned at iteration 0.
[I 2023-12-21 04:03:32,851] Trial 16 pruned. Trial was pruned at iteration 72.
[I 2023-12-21 04:03:32,880] Trial 17 pruned. Trial was pruned at iteration 0.
[I 2023-12-21 04:03:34,820] Trial 18 pruned. Trial was pruned at iteration 75.
[I 2023-12-21 04:03:34,936] Trial 19 pruned. Trial was pruned at iteration 72.
[I 2023-12-21 04:03:35,055] Trial 20 pruned. Trial was pruned at iteration 75.
[I 2023-12-21 04:03:35,084] Trial 21 pruned. Trial was pruned at iteration 0.
[I 2023-12-21 04:03:35,116] Trial 22 pruned. Trial was pruned at iteration 0.
[I 2023-12-21 04:03:35,236] Trial 23 pruned. Trial was pruned at iteration 75.
[I 2023-12-21 04:03:35,266] Trial 24 pruned. Trial was pruned at iteration 0.
[I 2023-12-21 04:03:35,297] Trial 25 pruned. Trial was pruned at iteration 1.
[I 2023-12-21 04:03:35,329] Trial 26 pruned. Trial was pruned at iteration 0.
[I 2023-12-21 04:03:35,359] Trial 27 pruned. Trial was pruned at iteration 0.
[I 2023-12-21 04:03:35,393] Trial 28 pruned. Trial was pruned at iteration 3.
[I 2023-12-21 04:03:35,437] Trial 29 pruned. Trial was pruned at iteration 4.
[I 2023-12-21 04:03:35,468] Trial 30 pruned. Trial was pruned at iteration 0.
[I 2023-12-21 04:03:35,500] Trial 31 pruned. Trial was pruned at iteration 0.
[I 2023-12-21 04:03:35,531] Trial 32 pruned. Trial was pruned at iteration 0.
[I 2023-12-21 04:03:35,563] Trial 33 pruned. Trial was pruned at iteration 0.
[I 2023-12-21 04:03:35,612] Trial 34 pruned. Trial was pruned at iteration 5.
[I 2023-12-21 04:03:35,668] Trial 35 pruned. Trial was pruned at iteration 6.
[I 2023-12-21 04:03:35,699] Trial 36 pruned. Trial was pruned at iteration 0.
[I 2023-12-21 04:03:35,731] Trial 37 pruned. Trial was pruned at iteration 0.
[I 2023-12-21 04:03:35,767] Trial 38 pruned. Trial was pruned at iteration 2.
[I 2023-12-21 04:03:35,808] Trial 39 pruned. Trial was pruned at iteration 6.
[I 2023-12-21 04:03:37,331] Trial 40 pruned. Trial was pruned at iteration 66.
[I 2023-12-21 04:03:37,369] Trial 41 pruned. Trial was pruned at iteration 2.
[I 2023-12-21 04:03:37,411] Trial 42 pruned. Trial was pruned at iteration 6.
[I 2023-12-21 04:03:37,547] Trial 43 pruned. Trial was pruned at iteration 72.
[I 2023-12-21 04:03:37,579] Trial 44 pruned. Trial was pruned at iteration 0.
[I 2023-12-21 04:03:37,612] Trial 45 pruned. Trial was pruned at iteration 0.
[I 2023-12-21 04:03:37,647] Trial 46 pruned. Trial was pruned at iteration 2.
[I 2023-12-21 04:03:37,763] Trial 47 finished with value: inf and parameters: {'learning_rate': 0.37190379443097593, 'aft_loss_distributi                                                                     on': 'extreme', 'aft_loss_distribution_scale': 4.975086108698082, 'max_depth': 4, 'booster': 'gbtree', 'scale_pos_weight': 5.603795710326                                                                     922, 'alpha': 4.219210239103626, 'lambda': 3.4608698471701462, 'eta': 0.17164749658125958, 'sampling_method': 'gradient_based', 'subsampl                                                                     e': 0.044546165600735946, 'gamma': 7.112942141784983}. Best is trial 5 with value: 4.832863111832803.
[I 2023-12-21 04:03:37,889] Trial 48 finished with value: 5.11046750933626 and parameters: {'learning_rate': 0.6418519200445914, 'aft_los                                                                     s_distribution': 'normal', 'aft_loss_distribution_scale': 4.082121750310846, 'max_depth': 3, 'booster': 'gbtree', 'scale_pos_weight': 6.9                                                                     77683512684904, 'alpha': 5.748136829101419, 'lambda': 0.6654320336437252, 'eta': 0.9580190787525631, 'sampling_method': 'gradient_based',                                                                      'subsample': 0.6030003693301634, 'gamma': 3.4447493134320335}. Best is trial 5 with value: 4.832863111832803.
[I 2023-12-21 04:03:38,013] Trial 49 pruned. Trial was pruned at iteration 75.
[I 2023-12-21 04:03:38,130] Trial 50 finished with value: 4.517956468574207 and parameters: {'learning_rate': 0.5697705828417278, 'aft_lo                                                                     ss_distribution': 'normal', 'aft_loss_distribution_scale': 1.9697256499663105, 'max_depth': 10, 'booster': 'gbtree', 'scale_pos_weight':                                                                      6.36241842239803, 'alpha': 7.595871937945337, 'lambda': 2.598773826550202, 'eta': 0.46120595488560373, 'sampling_method': 'uniform', 'sub                                                                     sample': 0.6894702615970499, 'gamma': 4.150995606242474}. Best is trial 50 with value: 4.517956468574207.
[I 2023-12-21 04:03:38,239] Trial 51 finished with value: inf and parameters: {'learning_rate': 0.5769329803986549, 'aft_loss_distributio                                                                     n': 'normal', 'aft_loss_distribution_scale': 1.7284186794771363, 'max_depth': 10, 'booster': 'gbtree', 'scale_pos_weight': 6.414887855784                                                                     748, 'alpha': 8.126095018013983, 'lambda': 2.6330258047742827, 'eta': 0.4567773827451461, 'sampling_method': 'uniform', 'subsample': 0.68                                                                     91009775479154, 'gamma': 4.280446128819892}. Best is trial 50 with value: 4.517956468574207.
[I 2023-12-21 04:03:38,345] Trial 52 pruned. Trial was pruned at iteration 75.
[I 2023-12-21 04:03:38,467] Trial 53 finished with value: 4.664930376520555 and parameters: {'learning_rate': 0.646064838173784, 'aft_los                                                                     s_distribution': 'normal', 'aft_loss_distribution_scale': 2.404286327397704, 'max_depth': 9, 'booster': 'gbtree', 'scale_pos_weight': 7.2                                                                     17848499619428, 'alpha': 6.671887315328524, 'lambda': 1.1176406543642168, 'eta': 0.32560529969850593, 'sampling_method': 'uniform', 'subs                                                                     ample': 0.5130126192774529, 'gamma': 4.8102971907236505}. Best is trial 50 with value: 4.517956468574207.
[I 2023-12-21 04:03:38,574] Trial 54 pruned. Trial was pruned at iteration 75.
[I 2023-12-21 04:03:38,607] Trial 55 pruned. Trial was pruned at iteration 0.
[I 2023-12-21 04:03:38,799] Trial 56 finished with value: 4.467337257601949 and parameters: {'learning_rate': 0.6257450680678559, 'aft_lo                                                                     ss_distribution': 'normal', 'aft_loss_distribution_scale': 1.8250063779676813, 'max_depth': 10, 'booster': 'gbtree', 'scale_pos_weight':                                                                      7.714289764940275, 'alpha': 9.232163891254295, 'lambda': 1.1905943921267659, 'eta': 0.22027263069741548, 'sampling_method': 'uniform', 's                                                                     ubsample': 0.5964764992684568, 'gamma': 3.9785706452658647}. Best is trial 56 with value: 4.467337257601949.
[I 2023-12-21 04:03:38,919] Trial 57 pruned. Trial was pruned at iteration 88.
