[I 2023-12-18 23:59:14,495] Trial 215 finished with value: inf and parameters: {'learning_rate': 0.8433322451461733, 'aft_loss_distribution': 'normal', 'aft_loss_distribution_scale': 1.198353921019427, 'max_depth': 10, 'booster': 'dart', 'scale_pos_weight': 1.21352388263182, 'alpha': 9.093059629398105, 'lambda': 5.261361556807841, 'eta': 0.5589047904254756, 'sampling_method': 'uniform', 'subsample': 0.5706654020072209, 'gamma': 9.498167934571518}. Best is trial 27 with value: 4.291541471809494.
[I 2023-12-18 23:59:17,415] Trial 216 finished with value: inf and parameters: {'learning_rate': 0.7782381266786277, 'aft_loss_distribution': 'normal', 'aft_loss_distribution_scale': 1.3506557065227227, 'max_depth': 10, 'booster': 'dart', 'scale_pos_weight': 0.2839314827114524, 'alpha': 8.61442119814293, 'lambda': 5.680944555777266, 'eta': 0.6823771348567709, 'sampling_method': 'uniform', 'subsample': 0.5535804893394888, 'gamma': 2.609183895357186}. Best is trial 27 with value: 4.291541471809494.
[I 2023-12-18 23:59:17,548] Trial 217 pruned. Trial was pruned at iteration 0.
[I 2023-12-18 23:59:17,622] Trial 218 pruned. Trial was pruned at iteration 0.
[I 2023-12-18 23:59:17,688] Trial 219 pruned. Trial was pruned at iteration 0.
[I 2023-12-18 23:59:20,047] Trial 220 finished with value: inf and parameters: {'learning_rate': 0.7523612786277227, 'aft_loss_distribution': 'normal', 'aft_loss_distribution_scale': 1.0492960008045555, 'max_depth': 10, 'booster': 'dart', 'scale_pos_weight': 0.3199661245340555, 'alpha': 7.6817822432395415, 'lambda': 1.360976578008537, 'eta': 0.48466997770713105, 'sampling_method': 'uniform', 'subsample': 0.58716439208837, 'gamma': 6.839849593088877}. Best is trial 27 with value: 4.291541471809494.
[I 2023-12-18 23:59:20,131] Trial 221 pruned. Trial was pruned at iteration 1.
[I 2023-12-18 23:59:22,171] Trial 222 finished with value: inf and parameters: {'learning_rate': 0.7160197013175701, 'aft_loss_distribution': 'normal', 'aft_loss_distribution_scale': 1.412511418113229, 'max_depth': 10, 'booster': 'dart', 'scale_pos_weight': 0.44430362642910537, 'alpha': 7.978859057377192, 'lambda': 5.391805380537243, 'eta': 0.16396753681478804, 'sampling_method': 'uniform', 'subsample': 0.48560501514228843, 'gamma': 9.796524419130765}. Best is trial 27 with value: 4.291541471809494.
[I 2023-12-18 23:59:22,249] Trial 223 pruned. Trial was pruned at iteration 0.
[I 2023-12-18 23:59:22,323] Trial 224 pruned. Trial was pruned at iteration 1.
[I 2023-12-18 23:59:22,406] Trial 225 pruned. Trial was pruned at iteration 1.
[I 2023-12-18 23:59:24,159] Trial 226 finished with value: inf and parameters: {'learning_rate': 0.7987768134154534, 'aft_loss_distribution': 'normal', 'aft_loss_distribution_scale': 1.2904614661448002, 'max_depth': 9, 'booster': 'dart', 'scale_pos_weight': 0.2720117570448104, 'alpha': 7.359598285275293, 'lambda': 4.637464025375879, 'eta': 0.887213239984804, 'sampling_method': 'uniform', 'subsample': 0.4749612495271828, 'gamma': 9.379909791702163}. Best is trial 27 with value: 4.291541471809494.
[I 2023-12-18 23:59:24,282] Trial 227 pruned. Trial was pruned at iteration 0.
[I 2023-12-18 23:59:24,398] Trial 228 pruned. Trial was pruned at iteration 1.
[I 2023-12-18 23:59:24,506] Trial 229 pruned. Trial was pruned at iteration 0.
[I 2023-12-18 23:59:24,654] Trial 230 pruned. Trial was pruned at iteration 0.
[I 2023-12-18 23:59:24,761] Trial 231 pruned. Trial was pruned at iteration 0.
[I 2023-12-18 23:59:24,876] Trial 232 pruned. Trial was pruned at iteration 0.
[I 2023-12-18 23:59:27,883] Trial 233 finished with value: inf and parameters: {'learning_rate': 0.6978643198252327, 'aft_loss_distribution': 'normal', 'aft_loss_distribution_scale': 1.3747897958461266, 'max_depth': 8, 'booster': 'dart', 'scale_pos_weight': 0.8271183418701606, 'alpha': 8.946079449701909, 'lambda': 2.458855975914586, 'eta': 0.022425687713974896, 'sampling_method': 'uniform', 'subsample': 0.6386161258264972, 'gamma': 9.290599397864675}. Best is trial 27 with value: 4.291541471809494.
[I 2023-12-18 23:59:28,010] Trial 234 pruned. Trial was pruned at iteration 0.
[I 2023-12-18 23:59:28,121] Trial 235 pruned. Trial was pruned at iteration 0.
[I 2023-12-18 23:59:28,242] Trial 236 pruned. Trial was pruned at iteration 0.
[I 2023-12-18 23:59:28,342] Trial 237 pruned. Trial was pruned at iteration 0.
[I 2023-12-18 23:59:28,415] Trial 238 pruned. Trial was pruned at iteration 0.
[I 2023-12-18 23:59:28,499] Trial 239 pruned. Trial was pruned at iteration 1.
[I 2023-12-18 23:59:29,995] Trial 240 finished with value: inf and parameters: {'learning_rate': 0.7735563073537004, 'aft_loss_distribution': 'normal', 'aft_loss_distribution_scale': 1.3779743144737993, 'max_depth': 9, 'booster': 'dart', 'scale_pos_weight': 0.9166500695457349, 'alpha': 8.692726618599513, 'lambda': 1.8792045193486826, 'eta': 0.8641981207371774, 'sampling_method': 'uniform', 'subsample': 0.5358659382096392, 'gamma': 9.288405987136796}. Best is trial 27 with value: 4.291541471809494.
[I 2023-12-18 23:59:30,076] Trial 241 pruned. Trial was pruned at iteration 0.
[I 2023-12-18 23:59:30,173] Trial 242 pruned. Trial was pruned at iteration 1.
[I 2023-12-18 23:59:30,245] Trial 243 pruned. Trial was pruned at iteration 0.
[I 2023-12-18 23:59:30,315] Trial 244 pruned. Trial was pruned at iteration 0.
[I 2023-12-18 23:59:30,395] Trial 245 pruned. Trial was pruned at iteration 0.
[I 2023-12-18 23:59:30,468] Trial 246 pruned. Trial was pruned at iteration 0.
[I 2023-12-18 23:59:30,537] Trial 247 pruned. Trial was pruned at iteration 0.
[I 2023-12-18 23:59:30,619] Trial 248 pruned. Trial was pruned at iteration 0.
[I 2023-12-18 23:59:30,694] Trial 249 pruned. Trial was pruned at iteration 1.
[I 2023-12-18 23:59:30,771] Trial 250 pruned. Trial was pruned at iteration 1.
[I 2023-12-18 23:59:30,852] Trial 251 pruned. Trial was pruned at iteration 0.
[I 2023-12-18 23:59:30,922] Trial 252 pruned. Trial was pruned at iteration 0.
[I 2023-12-18 23:59:30,998] Trial 253 pruned. Trial was pruned at iteration 0.
[I 2023-12-18 23:59:31,094] Trial 254 pruned. Trial was pruned at iteration 1.
[I 2023-12-18 23:59:31,172] Trial 255 pruned. Trial was pruned at iteration 0.
[I 2023-12-18 23:59:32,926] Trial 256 finished with value: inf and parameters: {'learning_rate': 0.7894128777236409, 'aft_loss_distribution': 'normal', 'aft_loss_distribution_scale': 1.1513744402158268, 'max_depth': 10, 'booster': 'dart', 'scale_pos_weight': 0.2619344249073696, 'alpha': 7.482227943050548, 'lambda': 0.9931169817079036, 'eta': 0.5871806258538279, 'sampling_method': 'uniform', 'subsample': 0.5562236995076353, 'gamma': 9.84859726087342}. Best is trial 27 with value: 4.291541471809494.
[I 2023-12-18 23:59:33,015] Trial 257 pruned. Trial was pruned at iteration 0.
[I 2023-12-18 23:59:33,087] Trial 258 pruned. Trial was pruned at iteration 0.
[I 2023-12-18 23:59:33,166] Trial 259 pruned. Trial was pruned at iteration 0.
[I 2023-12-18 23:59:33,244] Trial 260 pruned. Trial was pruned at iteration 0.
[I 2023-12-18 23:59:33,318] Trial 261 pruned. Trial was pruned at iteration 0.
[I 2023-12-18 23:59:33,407] Trial 262 pruned. Trial was pruned at iteration 1.
[I 2023-12-18 23:59:33,504] Trial 263 pruned. Trial was pruned at iteration 0.
[I 2023-12-18 23:59:33,588] Trial 264 pruned. Trial was pruned at iteration 1.
[I 2023-12-18 23:59:33,671] Trial 265 pruned. Trial was pruned at iteration 0.
[I 2023-12-18 23:59:33,752] Trial 266 pruned. Trial was pruned at iteration 0.
[I 2023-12-18 23:59:33,829] Trial 267 pruned. Trial was pruned at iteration 0.
[I 2023-12-18 23:59:33,927] Trial 268 pruned. Trial was pruned at iteration 0.
[I 2023-12-18 23:59:34,010] Trial 269 pruned. Trial was pruned at iteration 0.
[I 2023-12-18 23:59:34,092] Trial 270 pruned. Trial was pruned at iteration 0.
[I 2023-12-18 23:59:34,179] Trial 271 pruned. Trial was pruned at iteration 1.
[I 2023-12-18 23:59:35,879] Trial 272 finished with value: inf and parameters: {'learning_rate': 0.7405759258763681, 'aft_loss_distribution': 'normal', 'aft_loss_distribution_scale': 1.2372895923995424, 'max_depth': 10, 'booster': 'dart', 'scale_pos_weight': 2.820906551552039, 'alpha': 9.413035359494236, 'lambda': 5.611508820226825, 'eta': 0.25492127521811203, 'sampling_method': 'uniform', 'subsample': 0.6010725943392718, 'gamma': 9.381254114920276}. Best is trial 27 with value: 4.291541471809494.
[I 2023-12-18 23:59:35,976] Trial 273 pruned. Trial was pruned at iteration 1.
[I 2023-12-18 23:59:36,058] Trial 274 pruned. Trial was pruned at iteration 1.
[I 2023-12-18 23:59:36,182] Trial 275 pruned. Trial was pruned at iteration 0.
[I 2023-12-18 23:59:36,260] Trial 276 pruned. Trial was pruned at iteration 0.
[I 2023-12-18 23:59:36,900] Trial 277 finished with value: inf and parameters: {'learning_rate': 0.8626742157180941, 'aft_loss_distribution': 'normal', 'aft_loss_distribution_scale': 1.3341078249521756, 'max_depth': 10, 'booster': 'gbtree', 'scale_pos_weight': 1.309699249636434, 'alpha': 9.14852991997707, 'lambda': 1.663643254986414, 'eta': 0.6158007101031816, 'sampling_method': 'uniform', 'subsample': 0.6546483089774894, 'gamma': 8.477356792383661}. Best is trial 27 with value: 4.291541471809494.
[I 2023-12-18 23:59:39,003] Trial 278 finished with value: inf and parameters: {'learning_rate': 0.7928541462103591, 'aft_loss_distribution': 'normal', 'aft_loss_distribution_scale': 1.0403016249881887, 'max_depth': 10, 'booster': 'dart', 'scale_pos_weight': 0.2487209269129401, 'alpha': 8.087938995134923, 'lambda': 1.4417475986326784, 'eta': 0.8835416632886958, 'sampling_method': 'uniform', 'subsample': 0.5571615994961835, 'gamma': 9.63811001120245}. Best is trial 27 with value: 4.291541471809494.
[I 2023-12-18 23:59:39,169] Trial 279 pruned. Trial was pruned at iteration 1.
[I 2023-12-18 23:59:39,300] Trial 280 pruned. Trial was pruned at iteration 1.
[I 2023-12-18 23:59:39,410] Trial 281 pruned. Trial was pruned at iteration 0.
[I 2023-12-18 23:59:39,526] Trial 282 pruned. Trial was pruned at iteration 0.
[I 2023-12-18 23:59:39,644] Trial 283 pruned. Trial was pruned at iteration 0.
[I 2023-12-18 23:59:39,769] Trial 284 pruned. Trial was pruned at iteration 0.
[I 2023-12-18 23:59:39,896] Trial 285 pruned. Trial was pruned at iteration 1.
[I 2023-12-18 23:59:40,008] Trial 286 pruned. Trial was pruned at iteration 0.
[I 2023-12-18 23:59:40,144] Trial 287 pruned. Trial was pruned at iteration 0.
[I 2023-12-18 23:59:40,258] Trial 288 pruned. Trial was pruned at iteration 0.
[I 2023-12-18 23:59:42,655] Trial 289 finished with value: inf and parameters: {'learning_rate': 0.7394985957891653, 'aft_loss_distribution': 'normal', 'aft_loss_distribution_scale': 1.1134497714221037, 'max_depth': 10, 'booster': 'dart', 'scale_pos_weight': 0.10065643715081114, 'alpha': 9.011705443160443, 'lambda': 2.1164861827197683, 'eta': 0.6110502016928474, 'sampling_method': 'uniform', 'subsample': 0.4899557140722068, 'gamma': 8.836322457491756}. Best is trial 27 with value: 4.291541471809494.
[I 2023-12-18 23:59:42,833] Trial 290 pruned. Trial was pruned at iteration 0.
[I 2023-12-18 23:59:42,972] Trial 291 pruned. Trial was pruned at iteration 0.
[I 2023-12-18 23:59:43,069] Trial 292 pruned. Trial was pruned at iteration 0.
[I 2023-12-18 23:59:43,152] Trial 293 pruned. Trial was pruned at iteration 0.
[I 2023-12-18 23:59:43,234] Trial 294 pruned. Trial was pruned at iteration 0.
[I 2023-12-18 23:59:43,318] Trial 295 pruned. Trial was pruned at iteration 0.
[I 2023-12-18 23:59:43,400] Trial 296 pruned. Trial was pruned at iteration 0.
[I 2023-12-18 23:59:43,530] Trial 297 pruned. Trial was pruned at iteration 0.
[I 2023-12-18 23:59:43,610] Trial 298 pruned. Trial was pruned at iteration 0.
[I 2023-12-18 23:59:43,688] Trial 299 pruned. Trial was pruned at iteration 0.
[I 2023-12-18 23:59:43,769] Trial 300 pruned. Trial was pruned at iteration 0.
[I 2023-12-18 23:59:44,005] Trial 301 pruned. Trial was pruned at iteration 2.
[I 2023-12-18 23:59:44,103] Trial 302 pruned. Trial was pruned at iteration 1.
[I 2023-12-18 23:59:44,189] Trial 303 pruned. Trial was pruned at iteration 0.
[I 2023-12-18 23:59:44,280] Trial 304 pruned. Trial was pruned at iteration 0.
[I 2023-12-18 23:59:44,362] Trial 305 pruned. Trial was pruned at iteration 0.
[I 2023-12-18 23:59:44,438] Trial 306 pruned. Trial was pruned at iteration 0.
[I 2023-12-18 23:59:44,525] Trial 307 pruned. Trial was pruned at iteration 0.
[I 2023-12-18 23:59:44,646] Trial 308 pruned. Trial was pruned at iteration 2.
[I 2023-12-18 23:59:44,730] Trial 309 pruned. Trial was pruned at iteration 1.
[I 2023-12-18 23:59:44,821] Trial 310 pruned. Trial was pruned at iteration 0.
[I 2023-12-18 23:59:44,906] Trial 311 pruned. Trial was pruned at iteration 0.
[I 2023-12-18 23:59:44,993] Trial 312 pruned. Trial was pruned at iteration 1.
[I 2023-12-18 23:59:45,072] Trial 313 pruned. Trial was pruned at iteration 0.
[I 2023-12-18 23:59:46,940] Trial 314 finished with value: inf and parameters: {'learning_rate': 0.7428019748009093, 'aft_loss_distribution': 'normal', 'aft_loss_distribution_scale': 1.2029371259372734, 'max_depth': 10, 'booster': 'dart', 'scale_pos_weight': 0.2546220510695949, 'alpha': 7.380058154583062, 'lambda': 2.332981364686834, 'eta': 0.8272596934952579, 'sampling_method': 'uniform', 'subsample': 0.26867134387802594, 'gamma': 9.641720864574157}. Best is trial 27 with value: 4.291541471809494.
[I 2023-12-18 23:59:47,025] Trial 315 pruned. Trial was pruned at iteration 0.
[I 2023-12-18 23:59:47,134] Trial 316 pruned. Trial was pruned at iteration 0.
[I 2023-12-18 23:59:47,223] Trial 317 pruned. Trial was pruned at iteration 1.
[I 2023-12-18 23:59:47,305] Trial 318 pruned. Trial was pruned at iteration 0.
[I 2023-12-18 23:59:47,400] Trial 319 pruned. Trial was pruned at iteration 0.
[I 2023-12-18 23:59:47,488] Trial 320 pruned. Trial was pruned at iteration 1.
[I 2023-12-18 23:59:52,864] Trial 321 finished with value: inf and parameters: {'learning_rate': 0.7272066775995767, 'aft_loss_distribution': 'normal', 'aft_loss_distribution_scale': 1.1446432134978468, 'max_depth': 8, 'booster': 'dart', 'scale_pos_weight': 1.6001298009989176, 'alpha': 3.7299481141161297, 'lambda': 2.152404654674193, 'eta': 0.20984708943742741, 'sampling_method': 'uniform', 'subsample': 0.18649389068917904, 'gamma': 9.998311758633323}. Best is trial 27 with value: 4.291541471809494.
[I 2023-12-18 23:59:52,964] Trial 322 pruned. Trial was pruned at iteration 0.
[I 2023-12-18 23:59:53,070] Trial 323 pruned. Trial was pruned at iteration 1.
[I 2023-12-18 23:59:53,219] Trial 324 pruned. Trial was pruned at iteration 0.
[I 2023-12-18 23:59:55,127] Trial 325 finished with value: inf and parameters: {'learning_rate': 0.75152968648133, 'aft_loss_distribution': 'normal', 'aft_loss_distribution_scale': 1.3608770773648429, 'max_depth': 10, 'booster': 'dart', 'scale_pos_weight': 0.4185967643397641, 'alpha': 8.003041089809408, 'lambda': 2.7381853455186755, 'eta': 0.5809783327362926, 'sampling_method': 'uniform', 'subsample': 0.5889730218442683, 'gamma': 8.691782536171115}. Best is trial 27 with value: 4.291541471809494.
[I 2023-12-18 23:59:55,263] Trial 326 pruned. Trial was pruned at iteration 0.
[I 2023-12-18 23:59:55,389] Trial 327 pruned. Trial was pruned at iteration 0.
[I 2023-12-18 23:59:55,513] Trial 328 pruned. Trial was pruned at iteration 0.
[I 2023-12-18 23:59:55,632] Trial 329 pruned. Trial was pruned at iteration 0.
[I 2023-12-18 23:59:55,748] Trial 330 pruned. Trial was pruned at iteration 0.
[I 2023-12-18 23:59:55,873] Trial 331 pruned. Trial was pruned at iteration 0.
[I 2023-12-18 23:59:55,990] Trial 332 pruned. Trial was pruned at iteration 0.
[I 2023-12-18 23:59:56,129] Trial 333 pruned. Trial was pruned at iteration 0.
[I 2023-12-18 23:59:56,305] Trial 334 pruned. Trial was pruned at iteration 0.
[I 2023-12-18 23:59:56,480] Trial 335 pruned. Trial was pruned at iteration 0.
[I 2023-12-18 23:59:56,637] Trial 336 pruned. Trial was pruned at iteration 0.
[I 2023-12-18 23:59:56,778] Trial 337 pruned. Trial was pruned at iteration 0.
[I 2023-12-18 23:59:56,938] Trial 338 pruned. Trial was pruned at iteration 1.
[I 2023-12-18 23:59:57,073] Trial 339 pruned. Trial was pruned at iteration 0.
[I 2023-12-18 23:59:57,192] Trial 340 pruned. Trial was pruned at iteration 0.
[I 2023-12-18 23:59:57,313] Trial 341 pruned. Trial was pruned at iteration 0.
[I 2023-12-18 23:59:57,449] Trial 342 pruned. Trial was pruned at iteration 0.
[I 2023-12-18 23:59:57,576] Trial 343 pruned. Trial was pruned at iteration 0.
[I 2023-12-18 23:59:57,727] Trial 344 pruned. Trial was pruned at iteration 0.
[I 2023-12-18 23:59:59,538] Trial 345 finished with value: inf and parameters: {'learning_rate': 0.7024181745240757, 'aft_loss_distribution': 'normal', 'aft_loss_distribution_scale': 1.2982079036279273, 'max_depth': 10, 'booster': 'dart', 'scale_pos_weight': 0.2565602259258101, 'alpha': 5.801820808259131, 'lambda': 2.5635734119610536, 'eta': 0.6547886531703313, 'sampling_method': 'uniform', 'subsample': 0.32735278700536635, 'gamma': 9.651903258280017}. Best is trial 27 with value: 4.291541471809494.
[I 2023-12-18 23:59:59,634] Trial 346 pruned. Trial was pruned at iteration 1.
[I 2023-12-18 23:59:59,708] Trial 347 pruned. Trial was pruned at iteration 0.
[I 2023-12-18 23:59:59,804] Trial 348 pruned. Trial was pruned at iteration 0.
[I 2023-12-18 23:59:59,880] Trial 349 pruned. Trial was pruned at iteration 0.
[I 2023-12-18 23:59:59,965] Trial 350 pruned. Trial was pruned at iteration 1.
[I 2023-12-19 00:00:00,052] Trial 351 pruned. Trial was pruned at iteration 0.
[I 2023-12-19 00:00:00,133] Trial 352 pruned. Trial was pruned at iteration 0.
[I 2023-12-19 00:00:00,210] Trial 353 pruned. Trial was pruned at iteration 0.
[I 2023-12-19 00:00:01,027] Trial 354 finished with value: inf and parameters: {'learning_rate': 0.7467292206742207, 'aft_loss_distribution': 'normal', 'aft_loss_distribution_scale': 1.2369059972066643, 'max_depth': 6, 'booster': 'gbtree', 'scale_pos_weight': 1.763549807140763, 'alpha': 8.520432154478303, 'lambda': 3.057212355361091, 'eta': 0.627478709613513, 'sampling_method': 'gradient_based', 'subsample': 0.4968910834259441, 'gamma': 8.45585557283034}. Best is trial 27 with value: 4.291541471809494.
[I 2023-12-19 00:00:03,192] Trial 355 finished with value: inf and parameters: {'learning_rate': 0.703508532439489, 'aft_loss_distribution': 'normal', 'aft_loss_distribution_scale': 1.425448586538426, 'max_depth': 10, 'booster': 'dart', 'scale_pos_weight': 0.2965203122943053, 'alpha': 6.9793180836780815, 'lambda': 2.0346239986388945, 'eta': 0.16660191431934124, 'sampling_method': 'uniform', 'subsample': 0.6074591016773028, 'gamma': 9.453645833882515}. Best is trial 27 with value: 4.291541471809494.
[I 2023-12-19 00:00:03,293] Trial 356 pruned. Trial was pruned at iteration 0.
[I 2023-12-19 00:00:03,375] Trial 357 pruned. Trial was pruned at iteration 0.
[I 2023-12-19 00:00:03,460] Trial 358 pruned. Trial was pruned at iteration 0.
[I 2023-12-19 00:00:03,549] Trial 359 pruned. Trial was pruned at iteration 0.
[I 2023-12-19 00:00:03,633] Trial 360 pruned. Trial was pruned at iteration 0.
[I 2023-12-19 00:00:03,714] Trial 361 pruned. Trial was pruned at iteration 0.
[I 2023-12-19 00:00:05,273] Trial 362 finished with value: inf and parameters: {'learning_rate': 0.8404066672736186, 'aft_loss_distribution': 'normal', 'aft_loss_distribution_scale': 1.3587402687393961, 'max_depth': 10, 'booster': 'dart', 'scale_pos_weight': 0.9599997771671583, 'alpha': 8.206712265252742, 'lambda': 2.447504410782851, 'eta': 0.6535470438458296, 'sampling_method': 'uniform', 'subsample': 0.6156777316697435, 'gamma': 9.374847881889547}. Best is trial 27 with value: 4.291541471809494.
[I 2023-12-19 00:00:05,388] Trial 363 pruned. Trial was pruned at iteration 1.
[I 2023-12-19 00:00:05,474] Trial 364 pruned. Trial was pruned at iteration 0.
[I 2023-12-19 00:00:05,554] Trial 365 pruned. Trial was pruned at iteration 0.
[I 2023-12-19 00:00:05,645] Trial 366 pruned. Trial was pruned at iteration 1.
[I 2023-12-19 00:00:07,426] Trial 367 finished with value: inf and parameters: {'learning_rate': 0.7608900135527422, 'aft_loss_distribution': 'normal', 'aft_loss_distribution_scale': 1.1574924924917174, 'max_depth': 10, 'booster': 'dart', 'scale_pos_weight': 1.4040126996680418, 'alpha': 7.521364082269934, 'lambda': 1.9433616694260758, 'eta': 0.1579421680860391, 'sampling_method': 'uniform', 'subsample': 0.5707992063080968, 'gamma': 9.768994994742004}. Best is trial 27 with value: 4.291541471809494.
[I 2023-12-19 00:00:07,520] Trial 368 pruned. Trial was pruned at iteration 0.
[I 2023-12-19 00:00:07,600] Trial 369 pruned. Trial was pruned at iteration 0.
[I 2023-12-19 00:00:11,569] Trial 370 finished with value: 4.291290072824398 and parameters: {'learning_rate': 0.7163979538331531, 'aft_loss_distribution': 'normal', 'aft_loss_distribution_scale': 1.3551496196019368, 'max_depth': 10, 'booster': 'dart', 'scale_pos_weight': 0.5875943204668269, 'alpha': 7.253035497704076, 'lambda': 2.5894783775068118, 'eta': 0.63849874125559, 'sampling_method': 'uniform', 'subsample': 0.4457481865034521, 'gamma': 9.811078525634366}. Best is trial 370 with value: 4.291290072824398.
[I 2023-12-19 00:00:11,707] Trial 371 pruned. Trial was pruned at iteration 0.
[I 2023-12-19 00:00:11,845] Trial 372 pruned. Trial was pruned at iteration 0.
[I 2023-12-19 00:00:11,984] Trial 373 pruned. Trial was pruned at iteration 0.
[I 2023-12-19 00:00:12,410] Trial 374 pruned. Trial was pruned at iteration 2.
[I 2023-12-19 00:00:12,536] Trial 375 pruned. Trial was pruned at iteration 0.
[I 2023-12-19 00:00:12,621] Trial 376 pruned. Trial was pruned at iteration 0.
