[I 2023-12-19 00:26:22,769] Trial 61 finished with value: inf and parameters: {'learning_rate': 0.6940638022332788, 'aft_loss_distribution': 'normal', 'aft_loss_distribution_scale': 4.44723692108584, 'max_depth': 9, 'booster': 'dart', 'scale_pos_weight': 0.5293924715060958, 'alpha': 1.9630021558745852, 'lambda': 9.83776246097004, 'eta': 0.7745676257417752, 'sampling_method': 'gradient_based', 'subsample': 0.5501481694727647, 'gamma': 9.162988588151338}. Best is trial 58 with value: 2.3070786366770957.
[I 2023-12-19 00:26:22,835] Trial 62 pruned. Trial was pruned at iteration 0.
[I 2023-12-19 00:26:22,899] Trial 63 pruned. Trial was pruned at iteration 1.
[I 2023-12-19 00:26:22,963] Trial 64 pruned. Trial was pruned at iteration 1.
[I 2023-12-19 00:26:23,025] Trial 65 pruned. Trial was pruned at iteration 0.
[I 2023-12-19 00:26:23,094] Trial 66 pruned. Trial was pruned at iteration 0.
[I 2023-12-19 00:26:23,158] Trial 67 pruned. Trial was pruned at iteration 1.
[I 2023-12-19 00:26:23,231] Trial 68 pruned. Trial was pruned at iteration 0.
[I 2023-12-19 00:26:23,294] Trial 69 pruned. Trial was pruned at iteration 0.
[I 2023-12-19 00:26:23,354] Trial 70 pruned. Trial was pruned at iteration 0.
[I 2023-12-19 00:26:23,414] Trial 71 pruned. Trial was pruned at iteration 0.
[I 2023-12-19 00:26:23,484] Trial 72 pruned. Trial was pruned at iteration 0.
[I 2023-12-19 00:26:23,684] Trial 73 finished with value: inf and parameters: {'learning_rate': 0.6337132911330691, 'aft_loss_distribution': 'normal', 'aft_loss_distribution_scale': 3.366157073155142, 'max_depth': 6, 'booster': 'gbtree', 'scale_pos_weight': 3.41573742067112, 'alpha': 3.507376764308467, 'lambda': 8.23663794074967, 'eta': 0.7399936684909312, 'sampling_method': 'gradient_based', 'subsample': 0.9556693618074921, 'gamma': 3.5555570460966672}. Best is trial 58 with value: 2.3070786366770957.
[I 2023-12-19 00:26:23,755] Trial 74 pruned. Trial was pruned at iteration 0.
[I 2023-12-19 00:26:23,813] Trial 75 pruned. Trial was pruned at iteration 0.
[I 2023-12-19 00:26:24,031] Trial 76 finished with value: inf and parameters: {'learning_rate': 0.6869073140803891, 'aft_loss_distribution': 'normal', 'aft_loss_distribution_scale': 2.523196022184321, 'max_depth': 4, 'booster': 'gbtree', 'scale_pos_weight': 3.4947791146475438, 'alpha': 2.2779527818395766, 'lambda': 9.406072426627704, 'eta': 0.6842981171693793, 'sampling_method': 'gradient_based', 'subsample': 0.9206773127562179, 'gamma': 2.4458346436641825}. Best is trial 58 with value: 2.3070786366770957.
[I 2023-12-19 00:26:24,101] Trial 77 pruned. Trial was pruned at iteration 0.
[I 2023-12-19 00:26:24,171] Trial 78 pruned. Trial was pruned at iteration 0.
[I 2023-12-19 00:26:24,275] Trial 79 pruned. Trial was pruned at iteration 1.
[I 2023-12-19 00:26:24,343] Trial 80 pruned. Trial was pruned at iteration 0.
[I 2023-12-19 00:26:24,543] Trial 81 finished with value: inf and parameters: {'learning_rate': 0.599894754411018, 'aft_loss_distribution': 'normal', 'aft_loss_distribution_scale': 4.140631345313189, 'max_depth': 9, 'booster': 'gbtree', 'scale_pos_weight': 0.4349107396979288, 'alpha': 7.357682544406622, 'lambda': 8.802262956185103, 'eta': 0.6310889185783717, 'sampling_method': 'uniform', 'subsample': 0.8531042930088829, 'gamma': 1.8019040161322561}. Best is trial 58 with value: 2.3070786366770957.
[I 2023-12-19 00:26:24,743] Trial 82 finished with value: inf and parameters: {'learning_rate': 0.8792632623640171, 'aft_loss_distribution': 'normal', 'aft_loss_distribution_scale': 3.9521392540945977, 'max_depth': 9, 'booster': 'gbtree', 'scale_pos_weight': 0.22963893356842335, 'alpha': 7.51193856031222, 'lambda': 9.031970888807987, 'eta': 0.6628174844383128, 'sampling_method': 'uniform', 'subsample': 0.7990562366795629, 'gamma': 2.1611971234329537}. Best is trial 58 with value: 2.3070786366770957.
[I 2023-12-19 00:26:24,820] Trial 83 pruned. Trial was pruned at iteration 3.
[I 2023-12-19 00:26:24,882] Trial 84 pruned. Trial was pruned at iteration 0.
[I 2023-12-19 00:26:24,947] Trial 85 pruned. Trial was pruned at iteration 0.
[I 2023-12-19 00:26:25,270] Trial 86 finished with value: 2.215524024339581 and parameters: {'learning_rate': 0.8006053367629857, 'aft_loss_distribution': 'normal', 'aft_loss_distribution_scale': 3.8082378068831884, 'max_depth': 9, 'booster': 'gbtree', 'scale_pos_weight': 0.6739533401460471, 'alpha': 9.297912390409369, 'lambda': 8.56167204135592, 'eta': 0.15532256157119814, 'sampling_method': 'uniform', 'subsample': 0.6857131339714307, 'gamma': 1.3659304334788172}. Best is trial 86 with value: 2.215524024339581.
[I 2023-12-19 00:26:25,340] Trial 87 pruned. Trial was pruned at iteration 0.
[I 2023-12-19 00:26:25,567] Trial 88 finished with value: inf and parameters: {'learning_rate': 0.7903377464888574, 'aft_loss_distribution': 'normal', 'aft_loss_distribution_scale': 2.3749404442663544, 'max_depth': 9, 'booster': 'gbtree', 'scale_pos_weight': 3.2291323421195157, 'alpha': 9.01776233871029, 'lambda': 5.318273109074199, 'eta': 0.2858990489473997, 'sampling_method': 'gradient_based', 'subsample': 0.691834166621017, 'gamma': 1.2030649397353468}. Best is trial 86 with value: 2.215524024339581.
[I 2023-12-19 00:26:25,639] Trial 89 pruned. Trial was pruned at iteration 0.
[I 2023-12-19 00:26:25,702] Trial 90 pruned. Trial was pruned at iteration 0.
[I 2023-12-19 00:26:25,769] Trial 91 pruned. Trial was pruned at iteration 1.
[I 2023-12-19 00:26:25,838] Trial 92 pruned. Trial was pruned at iteration 1.
[I 2023-12-19 00:26:26,041] Trial 93 finished with value: inf and parameters: {'learning_rate': 0.8836521335455333, 'aft_loss_distribution': 'normal', 'aft_loss_distribution_scale': 2.7586389968232083, 'max_depth': 10, 'booster': 'gbtree', 'scale_pos_weight': 0.497065113230858, 'alpha': 8.603880909270671, 'lambda': 9.633396207439722, 'eta': 0.761725454268775, 'sampling_method': 'uniform', 'subsample': 0.8493897613062947, 'gamma': 3.2711682993716247}. Best is trial 86 with value: 2.215524024339581.
[I 2023-12-19 00:26:26,298] Trial 94 finished with value: 2.2138024189160848 and parameters: {'learning_rate': 0.6675477389211265, 'aft_loss_distribution': 'normal', 'aft_loss_distribution_scale': 3.7872027783840245, 'max_depth': 8, 'booster': 'gbtree', 'scale_pos_weight': 3.5994053302533238, 'alpha': 5.7580476648562735, 'lambda': 8.817445340842582, 'eta': 0.09763800834468728, 'sampling_method': 'uniform', 'subsample': 0.7463667725090415, 'gamma': 1.721122246630368}. Best is trial 94 with value: 2.2138024189160848.
[I 2023-12-19 00:26:26,505] Trial 95 finished with value: inf and parameters: {'learning_rate': 0.655113550321658, 'aft_loss_distribution': 'normal', 'aft_loss_distribution_scale': 3.3856971760599346, 'max_depth': 7, 'booster': 'gbtree', 'scale_pos_weight': 3.6197243972986044, 'alpha': 5.701627201823388, 'lambda': 0.49522196277794683, 'eta': 0.047531702846347355, 'sampling_method': 'uniform', 'subsample': 0.7351017795678794, 'gamma': 1.7595800862233029}. Best is trial 94 with value: 2.2138024189160848.
[I 2023-12-19 00:26:26,746] Trial 96 finished with value: inf and parameters: {'learning_rate': 0.6828736717839996, 'aft_loss_distribution': 'normal', 'aft_loss_distribution_scale': 3.6779936977368397, 'max_depth': 8, 'booster': 'gbtree', 'scale_pos_weight': 3.1427869088031186, 'alpha': 4.809835108290979, 'lambda': 8.277032086979963, 'eta': 0.10562888555754536, 'sampling_method': 'gradient_based', 'subsample': 0.6673534815946105, 'gamma': 0.8031340306288266}. Best is trial 94 with value: 2.2138024189160848.
[I 2023-12-19 00:26:26,811] Trial 97 pruned. Trial was pruned at iteration 0.
[I 2023-12-19 00:26:26,880] Trial 98 pruned. Trial was pruned at iteration 0.
[I 2023-12-19 00:26:26,945] Trial 99 pruned. Trial was pruned at iteration 0.
[I 2023-12-19 00:26:27,006] Trial 100 pruned. Trial was pruned at iteration 0.
[I 2023-12-19 00:26:27,076] Trial 101 pruned. Trial was pruned at iteration 1.
[I 2023-12-19 00:26:27,140] Trial 102 pruned. Trial was pruned at iteration 0.
[I 2023-12-19 00:26:27,205] Trial 103 pruned. Trial was pruned at iteration 0.
[I 2023-12-19 00:26:27,279] Trial 104 pruned. Trial was pruned at iteration 0.
[I 2023-12-19 00:26:27,354] Trial 105 pruned. Trial was pruned at iteration 0.
[I 2023-12-19 00:26:27,419] Trial 106 pruned. Trial was pruned at iteration 0.
[I 2023-12-19 00:26:27,487] Trial 107 pruned. Trial was pruned at iteration 0.
[I 2023-12-19 00:26:27,549] Trial 108 pruned. Trial was pruned at iteration 0.
[I 2023-12-19 00:26:27,620] Trial 109 pruned. Trial was pruned at iteration 0.
[I 2023-12-19 00:26:27,685] Trial 110 pruned. Trial was pruned at iteration 0.
[I 2023-12-19 00:26:27,755] Trial 111 pruned. Trial was pruned at iteration 0.
[I 2023-12-19 00:26:27,820] Trial 112 pruned. Trial was pruned at iteration 0.
[I 2023-12-19 00:26:27,885] Trial 113 pruned. Trial was pruned at iteration 0.
[I 2023-12-19 00:26:28,174] Trial 114 finished with value: 2.1366451015017494 and parameters: {'learning_rate': 0.6624915659357935, 'aft_loss_distribution': 'normal', 'aft_loss_distribution_scale': 2.925940969183108, 'max_depth': 7, 'booster': 'gbtree', 'scale_pos_weight': 0.2719998496908269, 'alpha': 4.5026392970404165, 'lambda': 1.1643097060919696, 'eta': 0.5817377919813924, 'sampling_method': 'uniform', 'subsample': 0.4792133561536892, 'gamma': 9.798482404131743}. Best is trial 114 with value: 2.1366451015017494.
[I 2023-12-19 00:26:28,408] Trial 115 finished with value: 2.1247194775349802 and parameters: {'learning_rate': 0.661127678167116, 'aft_loss_distribution': 'normal', 'aft_loss_distribution_scale': 2.802321948242227, 'max_depth': 7, 'booster': 'gbtree', 'scale_pos_weight': 0.2621385542953926, 'alpha': 3.596188691987125, 'lambda': 1.0659546456571325, 'eta': 0.5502056913534263, 'sampling_method': 'uniform', 'subsample': 0.4837017946947622, 'gamma': 9.835850522064053}. Best is trial 115 with value: 2.1247194775349802.
[I 2023-12-19 00:26:28,482] Trial 116 pruned. Trial was pruned at iteration 0.
[I 2023-12-19 00:26:28,760] Trial 117 finished with value: 2.124036627914797 and parameters: {'learning_rate': 0.7361435298998437, 'aft_loss_distribution': 'normal', 'aft_loss_distribution_scale': 2.7905173970731907, 'max_depth': 7, 'booster': 'gbtree', 'scale_pos_weight': 0.2931168193084906, 'alpha': 4.573028585985812, 'lambda': 0.2611243303177986, 'eta': 0.5423334580846668, 'sampling_method': 'uniform', 'subsample': 0.4817764302257433, 'gamma': 9.471190125052743}. Best is trial 117 with value: 2.124036627914797.
[I 2023-12-19 00:26:28,957] Trial 118 finished with value: inf and parameters: {'learning_rate': 0.7324360242802936, 'aft_loss_distribution': 'normal', 'aft_loss_distribution_scale': 2.701160452376109, 'max_depth': 7, 'booster': 'gbtree', 'scale_pos_weight': 0.2223835186057025, 'alpha': 0.0244528219973299, 'lambda': 0.1589925449962671, 'eta': 0.5525950622406214, 'sampling_method': 'uniform', 'subsample': 0.47764621514793293, 'gamma': 8.778460488404926}. Best is trial 117 with value: 2.124036627914797.
[I 2023-12-19 00:26:29,080] Trial 119 pruned. Trial was pruned at iteration 0.
[I 2023-12-19 00:26:29,175] Trial 120 pruned. Trial was pruned at iteration 0.
[I 2023-12-19 00:26:29,288] Trial 121 pruned. Trial was pruned at iteration 0.
[I 2023-12-19 00:26:29,653] Trial 122 finished with value: 2.120781186759947 and parameters: {'learning_rate': 0.7045330981485001, 'aft_loss_distribution': 'normal', 'aft_loss_distribution_scale': 2.759303966874996, 'max_depth': 7, 'booster': 'gbtree', 'scale_pos_weight': 0.10929669977340487, 'alpha': 4.084189797252409, 'lambda': 1.6748293899517364, 'eta': 0.45596541698861115, 'sampling_method': 'uniform', 'subsample': 0.5380069339673914, 'gamma': 9.097468161016224}. Best is trial 122 with value: 2.120781186759947.
[I 2023-12-19 00:26:30,020] Trial 123 finished with value: 2.1029394964418064 and parameters: {'learning_rate': 0.7076621262809494, 'aft_loss_distribution': 'normal', 'aft_loss_distribution_scale': 2.5778205445068645, 'max_depth': 7, 'booster': 'gbtree', 'scale_pos_weight': 0.12367479851832353, 'alpha': 3.8609786613579145, 'lambda': 1.29667642699886, 'eta': 0.4457817886963724, 'sampling_method': 'uniform', 'subsample': 0.4720689827647566, 'gamma': 9.104882249597875}. Best is trial 123 with value: 2.1029394964418064.
[I 2023-12-19 00:26:30,281] Trial 124 finished with value: inf and parameters: {'learning_rate': 0.6788654080289112, 'aft_loss_distribution': 'normal', 'aft_loss_distribution_scale': 2.259999534230303, 'max_depth': 7, 'booster': 'gbtree', 'scale_pos_weight': 0.13105196098638452, 'alpha': 4.1041682615660475, 'lambda': 1.7843791945044694, 'eta': 0.4260817091260274, 'sampling_method': 'uniform', 'subsample': 0.46597696750561357, 'gamma': 9.101305000743134}. Best is trial 123 with value: 2.1029394964418064.
[I 2023-12-19 00:26:30,718] Trial 125 finished with value: 2.098038286973131 and parameters: {'learning_rate': 0.6977779508243626, 'aft_loss_distribution': 'normal', 'aft_loss_distribution_scale': 2.5135176100636896, 'max_depth': 7, 'booster': 'gbtree', 'scale_pos_weight': 0.05105350852235202, 'alpha': 4.63060321031471, 'lambda': 1.3348044417258438, 'eta': 0.45971877409365414, 'sampling_method': 'uniform', 'subsample': 0.4131798013189597, 'gamma': 9.421671790609896}. Best is trial 125 with value: 2.098038286973131.
[I 2023-12-19 00:26:31,128] Trial 126 finished with value: 2.1005090804858413 and parameters: {'learning_rate': 0.713201449695331, 'aft_loss_distribution': 'normal', 'aft_loss_distribution_scale': 2.5315077318025567, 'max_depth': 7, 'booster': 'gbtree', 'scale_pos_weight': 0.05242045978424875, 'alpha': 4.616849578584643, 'lambda': 1.3423374245314055, 'eta': 0.43849924902423837, 'sampling_method': 'uniform', 'subsample': 0.5343296011460469, 'gamma': 9.442703592748465}. Best is trial 125 with value: 2.098038286973131.
[I 2023-12-19 00:26:31,477] Trial 127 finished with value: 2.088187195679236 and parameters: {'learning_rate': 0.7118609198389666, 'aft_loss_distribution': 'normal', 'aft_loss_distribution_scale': 2.4249784719566403, 'max_depth': 7, 'booster': 'gbtree', 'scale_pos_weight': 0.038157489197662736, 'alpha': 4.698574764038262, 'lambda': 0.7408760333830597, 'eta': 0.4755312024134283, 'sampling_method': 'uniform', 'subsample': 0.40612315096750895, 'gamma': 9.492087352301255}. Best is trial 127 with value: 2.088187195679236.
[I 2023-12-19 00:26:31,790] Trial 128 finished with value: 2.100338368158899 and parameters: {'learning_rate': 0.7058379654494612, 'aft_loss_distribution': 'normal', 'aft_loss_distribution_scale': 2.5507694027920835, 'max_depth': 7, 'booster': 'gbtree', 'scale_pos_weight': 0.04854684558663144, 'alpha': 4.694354215937064, 'lambda': 1.3565849623811608, 'eta': 0.48916917755594747, 'sampling_method': 'uniform', 'subsample': 0.5298381609251603, 'gamma': 9.40506403134259}. Best is trial 127 with value: 2.088187195679236.
[I 2023-12-19 00:26:32,316] Trial 129 finished with value: 2.1040318754915845 and parameters: {'learning_rate': 0.7084400091335626, 'aft_loss_distribution': 'normal', 'aft_loss_distribution_scale': 2.5891734518872744, 'max_depth': 7, 'booster': 'gbtree', 'scale_pos_weight': 0.12621156311999826, 'alpha': 4.641420200086607, 'lambda': 1.4204382732630434, 'eta': 0.4430195340573535, 'sampling_method': 'uniform', 'subsample': 0.5236737611330198, 'gamma': 9.524389436756294}. Best is trial 127 with value: 2.088187195679236.
[I 2023-12-19 00:26:32,822] Trial 130 finished with value: 2.1005745346080387 and parameters: {'learning_rate': 0.7182067624343469, 'aft_loss_distribution': 'normal', 'aft_loss_distribution_scale': 2.5452892533599494, 'max_depth': 7, 'booster': 'gbtree', 'scale_pos_weight': 0.047734352410767684, 'alpha': 4.625402969529506, 'lambda': 1.4245556905658119, 'eta': 0.45368269798108674, 'sampling_method': 'uniform', 'subsample': 0.5320961700406507, 'gamma': 9.492643003605819}. Best is trial 127 with value: 2.088187195679236.
[I 2023-12-19 00:26:33,335] Trial 131 finished with value: 2.089594432031054 and parameters: {'learning_rate': 0.7041822321221576, 'aft_loss_distribution': 'normal', 'aft_loss_distribution_scale': 2.4418676158967663, 'max_depth': 7, 'booster': 'gbtree', 'scale_pos_weight': 0.0386862591802189, 'alpha': 4.939686979582636, 'lambda': 1.3104322586676829, 'eta': 0.44517190203432977, 'sampling_method': 'uniform', 'subsample': 0.525264947118927, 'gamma': 9.441676552400661}. Best is trial 127 with value: 2.088187195679236.
[I 2023-12-19 00:26:33,655] Trial 132 finished with value: 2.08887552166952 and parameters: {'learning_rate': 0.7095356907782934, 'aft_loss_distribution': 'normal', 'aft_loss_distribution_scale': 2.4248952427169534, 'max_depth': 7, 'booster': 'gbtree', 'scale_pos_weight': 0.040457508959899524, 'alpha': 4.667290348871506, 'lambda': 1.3050303331240998, 'eta': 0.45550376455274016, 'sampling_method': 'uniform', 'subsample': 0.544013822542692, 'gamma': 9.704207093867604}. Best is trial 127 with value: 2.088187195679236.
[I 2023-12-19 00:26:34,112] Trial 133 finished with value: 2.0965834481106933 and parameters: {'learning_rate': 0.7141090133304907, 'aft_loss_distribution': 'normal', 'aft_loss_distribution_scale': 2.5130919134864436, 'max_depth': 7, 'booster': 'gbtree', 'scale_pos_weight': 0.0380787184794932, 'alpha': 4.630046601715114, 'lambda': 1.3998046297407443, 'eta': 0.455376888666748, 'sampling_method': 'uniform', 'subsample': 0.5198924375924292, 'gamma': 9.732832110981828}. Best is trial 127 with value: 2.088187195679236.
[I 2023-12-19 00:26:34,356] Trial 134 finished with value: 2.099779218760756 and parameters: {'learning_rate': 0.7070300153806751, 'aft_loss_distribution': 'normal', 'aft_loss_distribution_scale': 2.5366700378756577, 'max_depth': 7, 'booster': 'gbtree', 'scale_pos_weight': 0.04029267884476625, 'alpha': 4.642720898588932, 'lambda': 1.3594265971091253, 'eta': 0.4808586614375282, 'sampling_method': 'uniform', 'subsample': 0.5472184818437563, 'gamma': 9.551886347616554}. Best is trial 127 with value: 2.088187195679236.
[I 2023-12-19 00:26:34,579] Trial 135 finished with value: 2.096948151693818 and parameters: {'learning_rate': 0.7108870909056759, 'aft_loss_distribution': 'normal', 'aft_loss_distribution_scale': 2.5162488151798224, 'max_depth': 7, 'booster': 'gbtree', 'scale_pos_weight': 0.07765549955107964, 'alpha': 4.72850707001428, 'lambda': 1.8013050480985224, 'eta': 0.4516905154347845, 'sampling_method': 'uniform', 'subsample': 0.5304457633905119, 'gamma': 9.570701016029266}. Best is trial 127 with value: 2.088187195679236.
[I 2023-12-19 00:26:34,876] Trial 136 finished with value: 2.0965177420991066 and parameters: {'learning_rate': 0.715609069164994, 'aft_loss_distribution': 'normal', 'aft_loss_distribution_scale': 2.492125288568471, 'max_depth': 7, 'booster': 'gbtree', 'scale_pos_weight': 0.04124773857825401, 'alpha': 4.706450526177674, 'lambda': 1.378911970670404, 'eta': 0.4532377259176581, 'sampling_method': 'uniform', 'subsample': 0.5420374181195596, 'gamma': 9.5291204428853}. Best is trial 127 with value: 2.088187195679236.
[I 2023-12-19 00:26:34,946] Trial 137 pruned. Trial was pruned at iteration 0.
[I 2023-12-19 00:26:35,233] Trial 138 finished with value: 2.093339675459635 and parameters: {'learning_rate': 0.7699710914882549, 'aft_loss_distribution': 'normal', 'aft_loss_distribution_scale': 2.464462186558541, 'max_depth': 7, 'booster': 'gbtree', 'scale_pos_weight': 0.04585962537462093, 'alpha': 4.713016725433476, 'lambda': 1.816183841091421, 'eta': 0.43556104948091495, 'sampling_method': 'uniform', 'subsample': 0.5476596323401995, 'gamma': 8.94020855079174}. Best is trial 127 with value: 2.088187195679236.
[I 2023-12-19 00:26:35,655] Trial 139 finished with value: 2.09996541152954 and parameters: {'learning_rate': 0.7710008110106517, 'aft_loss_distribution': 'normal', 'aft_loss_distribution_scale': 2.5325947408693126, 'max_depth': 7, 'booster': 'gbtree', 'scale_pos_weight': 0.08879767814405826, 'alpha': 4.725430124049833, 'lambda': 1.8756769003169158, 'eta': 0.4287979604775103, 'sampling_method': 'uniform', 'subsample': 0.5591543652802541, 'gamma': 9.595615398022955}. Best is trial 127 with value: 2.088187195679236.
[I 2023-12-19 00:26:35,905] Trial 140 finished with value: 2.092447619910383 and parameters: {'learning_rate': 0.7687534812656027, 'aft_loss_distribution': 'normal', 'aft_loss_distribution_scale': 2.462903806165761, 'max_depth': 7, 'booster': 'gbtree', 'scale_pos_weight': 0.04599735346979035, 'alpha': 5.109712898601163, 'lambda': 1.8552940565297862, 'eta': 0.39572605648072734, 'sampling_method': 'uniform', 'subsample': 0.5766005701656797, 'gamma': 8.867057150825778}. Best is trial 127 with value: 2.088187195679236.
[I 2023-12-19 00:26:36,152] Trial 141 finished with value: 2.0950150639146434 and parameters: {'learning_rate': 0.7713113202030628, 'aft_loss_distribution': 'normal', 'aft_loss_distribution_scale': 2.4913775715726247, 'max_depth': 7, 'booster': 'gbtree', 'scale_pos_weight': 0.04000269875000175, 'alpha': 5.047797628746711, 'lambda': 1.8083801681489653, 'eta': 0.3900048088744917, 'sampling_method': 'uniform', 'subsample': 0.578165800917446, 'gamma': 8.955857731998643}. Best is trial 127 with value: 2.088187195679236.
[I 2023-12-19 00:26:36,410] Trial 142 finished with value: 2.0850504923485196 and parameters: {'learning_rate': 0.765809569122245, 'aft_loss_distribution': 'normal', 'aft_loss_distribution_scale': 2.386849637426765, 'max_depth': 7, 'booster': 'gbtree', 'scale_pos_weight': 0.0370789271356757, 'alpha': 5.153898929977322, 'lambda': 2.2244768102498975, 'eta': 0.38922424226173763, 'sampling_method': 'uniform', 'subsample': 0.57811098754119, 'gamma': 8.884193930323438}. Best is trial 142 with value: 2.0850504923485196.
