[I 2023-12-18 23:36:16,610] Trial 267 finished with value: 4.235735122588176 and parameters: {'learning_rate': 0.1481318731144032, 'aft_loss_distribution': 'logistic', 'aft_loss_distribution_scale': 0.7094547164576327, 'max_depth': 5, 'booster': 'dart', 'scale_pos_weight': 3.7159228470690775, 'alpha': 6.591485435937764, 'lambda': 9.108418115965627, 'eta': 0.5467765471410503, 'sampling_method': 'uniform', 'subsample': 0.8301695063234035, 'gamma': 6.287138577603757}. Best is trial 204 with value: 4.197459375224944.
[I 2023-12-18 23:36:16,690] Trial 268 pruned. Trial was pruned at iteration 0.
[I 2023-12-18 23:36:16,764] Trial 269 pruned. Trial was pruned at iteration 0.
[I 2023-12-18 23:36:16,840] Trial 270 pruned. Trial was pruned at iteration 0.
[I 2023-12-18 23:36:16,915] Trial 271 pruned. Trial was pruned at iteration 0.
[I 2023-12-18 23:36:17,001] Trial 272 pruned. Trial was pruned at iteration 0.
[I 2023-12-18 23:36:17,085] Trial 273 pruned. Trial was pruned at iteration 0.
[I 2023-12-18 23:36:21,495] Trial 274 pruned. Trial was pruned at iteration 102.
[I 2023-12-18 23:36:21,581] Trial 275 pruned. Trial was pruned at iteration 0.
[I 2023-12-18 23:36:44,968] Trial 276 finished with value: 4.263928660652226 and parameters: {'learning_rate': 0.13643417086315718, 'aft_loss_distribution': 'logistic', 'aft_loss_distribution_scale': 0.7652229730844775, 'max_depth': 6, 'booster': 'dart', 'scale_pos_weight': 3.3041914403904906, 'alpha': 6.630233069930236, 'lambda': 9.994733631544685, 'eta': 0.5774264824526271, 'sampling_method': 'uniform', 'subsample': 0.770879276947587, 'gamma': 6.394313071139553}. Best is trial 204 with value: 4.197459375224944.
[I 2023-12-18 23:36:45,056] Trial 277 pruned. Trial was pruned at iteration 0.
[I 2023-12-18 23:36:45,139] Trial 278 pruned. Trial was pruned at iteration 0.
[I 2023-12-18 23:36:45,224] Trial 279 pruned. Trial was pruned at iteration 0.
[I 2023-12-18 23:36:45,297] Trial 280 pruned. Trial was pruned at iteration 0.
[I 2023-12-18 23:36:45,384] Trial 281 pruned. Trial was pruned at iteration 0.
[I 2023-12-18 23:36:45,459] Trial 282 pruned. Trial was pruned at iteration 0.
[I 2023-12-18 23:36:45,536] Trial 283 pruned. Trial was pruned at iteration 0.
[I 2023-12-18 23:36:45,613] Trial 284 pruned. Trial was pruned at iteration 0.
[I 2023-12-18 23:36:45,685] Trial 285 pruned. Trial was pruned at iteration 0.
[I 2023-12-18 23:36:45,758] Trial 286 pruned. Trial was pruned at iteration 0.
[I 2023-12-18 23:36:45,841] Trial 287 pruned. Trial was pruned at iteration 0.
[I 2023-12-18 23:36:45,922] Trial 288 pruned. Trial was pruned at iteration 0.
[I 2023-12-18 23:36:46,002] Trial 289 pruned. Trial was pruned at iteration 0.
[I 2023-12-18 23:36:46,080] Trial 290 pruned. Trial was pruned at iteration 0.
[I 2023-12-18 23:36:46,156] Trial 291 pruned. Trial was pruned at iteration 0.
[I 2023-12-18 23:36:46,230] Trial 292 pruned. Trial was pruned at iteration 0.
[I 2023-12-18 23:37:14,929] Trial 293 pruned. Trial was pruned at iteration 254.
[I 2023-12-18 23:37:15,010] Trial 294 pruned. Trial was pruned at iteration 0.
[I 2023-12-18 23:37:15,086] Trial 295 pruned. Trial was pruned at iteration 0.
[I 2023-12-18 23:37:15,164] Trial 296 pruned. Trial was pruned at iteration 0.
[I 2023-12-18 23:37:15,246] Trial 297 pruned. Trial was pruned at iteration 0.
[I 2023-12-18 23:37:15,321] Trial 298 pruned. Trial was pruned at iteration 0.
[I 2023-12-18 23:37:15,407] Trial 299 pruned. Trial was pruned at iteration 0.
[I 2023-12-18 23:37:15,497] Trial 300 pruned. Trial was pruned at iteration 0.
[I 2023-12-18 23:37:15,576] Trial 301 pruned. Trial was pruned at iteration 0.
[I 2023-12-18 23:37:15,650] Trial 302 pruned. Trial was pruned at iteration 0.
[I 2023-12-18 23:37:15,730] Trial 303 pruned. Trial was pruned at iteration 0.
[I 2023-12-18 23:37:15,811] Trial 304 pruned. Trial was pruned at iteration 0.
[I 2023-12-18 23:37:15,892] Trial 305 pruned. Trial was pruned at iteration 0.
[I 2023-12-18 23:37:15,980] Trial 306 pruned. Trial was pruned at iteration 0.
[I 2023-12-18 23:37:16,062] Trial 307 pruned. Trial was pruned at iteration 0.
[I 2023-12-18 23:37:16,147] Trial 308 pruned. Trial was pruned at iteration 0.
[I 2023-12-18 23:37:16,227] Trial 309 pruned. Trial was pruned at iteration 0.
[I 2023-12-18 23:37:16,303] Trial 310 pruned. Trial was pruned at iteration 0.
[I 2023-12-18 23:37:16,384] Trial 311 pruned. Trial was pruned at iteration 0.
[I 2023-12-18 23:37:16,470] Trial 312 pruned. Trial was pruned at iteration 0.
[I 2023-12-18 23:37:16,565] Trial 313 pruned. Trial was pruned at iteration 0.
[I 2023-12-18 23:37:16,640] Trial 314 pruned. Trial was pruned at iteration 0.
[I 2023-12-18 23:37:16,720] Trial 315 pruned. Trial was pruned at iteration 0.
[I 2023-12-18 23:37:16,801] Trial 316 pruned. Trial was pruned at iteration 0.
[I 2023-12-18 23:37:16,879] Trial 317 pruned. Trial was pruned at iteration 0.
[I 2023-12-18 23:37:31,519] Trial 318 pruned. Trial was pruned at iteration 183.
[I 2023-12-18 23:37:31,613] Trial 319 pruned. Trial was pruned at iteration 0.
[I 2023-12-18 23:37:31,701] Trial 320 pruned. Trial was pruned at iteration 0.
[I 2023-12-18 23:37:31,794] Trial 321 pruned. Trial was pruned at iteration 0.
[I 2023-12-18 23:37:31,883] Trial 322 pruned. Trial was pruned at iteration 0.
[I 2023-12-18 23:37:31,974] Trial 323 pruned. Trial was pruned at iteration 0.
[I 2023-12-18 23:37:32,080] Trial 324 pruned. Trial was pruned at iteration 0.
[I 2023-12-18 23:37:32,176] Trial 325 pruned. Trial was pruned at iteration 0.
[I 2023-12-18 23:37:32,257] Trial 326 pruned. Trial was pruned at iteration 0.
[I 2023-12-18 23:37:38,951] Trial 327 finished with value: 4.283001437995269 and parameters: {'learning_rate': 0.14177499401224633, 'aft_loss_distribution': 'logistic', 'aft_loss_distribution_scale': 0.798162696266122, 'max_depth': 6, 'booster': 'dart', 'scale_pos_weight': 3.705578053198375, 'alpha': 6.168600292154503, 'lambda': 9.803620059895186, 'eta': 0.7825324335620278, 'sampling_method': 'uniform', 'subsample': 0.7538011831075494, 'gamma': 5.54625017403527}. Best is trial 204 with value: 4.197459375224944.
[I 2023-12-18 23:37:39,110] Trial 328 pruned. Trial was pruned at iteration 0.
[I 2023-12-18 23:37:39,267] Trial 329 pruned. Trial was pruned at iteration 0.
[I 2023-12-18 23:37:39,399] Trial 330 pruned. Trial was pruned at iteration 0.
[I 2023-12-18 23:38:02,311] Trial 331 finished with value: 4.295709496340984 and parameters: {'learning_rate': 0.14883512664504867, 'aft_loss_distribution': 'logistic', 'aft_loss_distribution_scale': 0.8156767570238284, 'max_depth': 6, 'booster': 'dart', 'scale_pos_weight': 2.765154011466552, 'alpha': 6.355832910471072, 'lambda': 9.773031171045965, 'eta': 0.7848893043863086, 'sampling_method': 'uniform', 'subsample': 0.7742449614441337, 'gamma': 5.953999485367932}. Best is trial 204 with value: 4.197459375224944.
[I 2023-12-18 23:38:02,410] Trial 332 pruned. Trial was pruned at iteration 0.
[I 2023-12-18 23:38:25,950] Trial 333 finished with value: 4.253598717729932 and parameters: {'learning_rate': 0.16626309805422013, 'aft_loss_distribution': 'logistic', 'aft_loss_distribution_scale': 0.7589258019222851, 'max_depth': 6, 'booster': 'dart', 'scale_pos_weight': 2.5380637590550355, 'alpha': 6.26865785839993, 'lambda': 2.7721889623907394, 'eta': 0.7435149945686029, 'sampling_method': 'uniform', 'subsample': 0.7498233438237911, 'gamma': 5.88068141317769}. Best is trial 204 with value: 4.197459375224944.
[I 2023-12-18 23:38:26,469] Trial 334 finished with value: 4.227710033730073 and parameters: {'learning_rate': 0.1316703621808591, 'aft_loss_distribution': 'logistic', 'aft_loss_distribution_scale': 0.708990275491215, 'max_depth': 5, 'booster': 'gbtree', 'scale_pos_weight': 2.4972845188599204, 'alpha': 5.985598389865996, 'lambda': 3.229180274800009, 'eta': 0.732514200374336, 'sampling_method': 'uniform', 'subsample': 0.8066368595087701, 'gamma': 6.294630051035792}. Best is trial 204 with value: 4.197459375224944.
[I 2023-12-18 23:38:26,555] Trial 335 pruned. Trial was pruned at iteration 0.
[I 2023-12-18 23:38:26,635] Trial 336 pruned. Trial was pruned at iteration 0.
[I 2023-12-18 23:38:26,717] Trial 337 pruned. Trial was pruned at iteration 0.
[I 2023-12-18 23:38:27,318] Trial 338 pruned. Trial was pruned at iteration 254.
[I 2023-12-18 23:38:27,401] Trial 339 pruned. Trial was pruned at iteration 0.
[I 2023-12-18 23:38:27,484] Trial 340 pruned. Trial was pruned at iteration 0.
[I 2023-12-18 23:38:27,886] Trial 341 finished with value: 4.285498757284751 and parameters: {'learning_rate': 0.16977590898031455, 'aft_loss_distribution': 'logistic', 'aft_loss_distribution_scale': 0.8073857234010603, 'max_depth': 6, 'booster': 'gbtree', 'scale_pos_weight': 2.3892110771871926, 'alpha': 6.393931432251311, 'lambda': 3.8984701356366616, 'eta': 0.7949863480719482, 'sampling_method': 'uniform', 'subsample': 0.7364071888904866, 'gamma': 5.905270484039462}. Best is trial 204 with value: 4.197459375224944.
[I 2023-12-18 23:38:28,134] Trial 342 finished with value: inf and parameters: {'learning_rate': 0.14642486571042007, 'aft_loss_distribution': 'logistic', 'aft_loss_distribution_scale': 0.7592795652782852, 'max_depth': 6, 'booster': 'gbtree', 'scale_pos_weight': 2.353511661583222, 'alpha': 6.348727579245979, 'lambda': 3.2782170747644988, 'eta': 0.7647732500675166, 'sampling_method': 'uniform', 'subsample': 0.7474388857894781, 'gamma': 6.047579100377023}. Best is trial 204 with value: 4.197459375224944.
[I 2023-12-18 23:38:28,213] Trial 343 pruned. Trial was pruned at iteration 0.
[I 2023-12-18 23:38:28,290] Trial 344 pruned. Trial was pruned at iteration 0.
[I 2023-12-18 23:38:28,372] Trial 345 pruned. Trial was pruned at iteration 0.
[I 2023-12-18 23:38:28,866] Trial 346 finished with value: 4.251214030713438 and parameters: {'learning_rate': 0.11779098729695008, 'aft_loss_distribution': 'logistic', 'aft_loss_distribution_scale': 0.7554627757504008, 'max_depth': 6, 'booster': 'gbtree', 'scale_pos_weight': 2.6695366399515272, 'alpha': 6.218514125672787, 'lambda': 3.097990975979215, 'eta': 0.7329969728768039, 'sampling_method': 'uniform', 'subsample': 0.8292268061276049, 'gamma': 6.186780398708198}. Best is trial 204 with value: 4.197459375224944.
[I 2023-12-18 23:38:28,954] Trial 347 pruned. Trial was pruned at iteration 0.
[I 2023-12-18 23:38:29,035] Trial 348 pruned. Trial was pruned at iteration 0.
[I 2023-12-18 23:38:29,117] Trial 349 pruned. Trial was pruned at iteration 0.
[I 2023-12-18 23:38:29,194] Trial 350 pruned. Trial was pruned at iteration 0.
[I 2023-12-18 23:38:29,600] Trial 351 finished with value: 4.286176434536016 and parameters: {'learning_rate': 0.15357190336649235, 'aft_loss_distribution': 'logistic', 'aft_loss_distribution_scale': 0.8085374020589343, 'max_depth': 6, 'booster': 'gbtree', 'scale_pos_weight': 2.825929750478646, 'alpha': 5.785181388730098, 'lambda': 3.3898819792334467, 'eta': 0.7009962593420479, 'sampling_method': 'uniform', 'subsample': 0.7311877185016182, 'gamma': 6.178346001916287}. Best is trial 204 with value: 4.197459375224944.
[I 2023-12-18 23:38:30,009] Trial 352 finished with value: 4.287538966402518 and parameters: {'learning_rate': 0.15425321033013872, 'aft_loss_distribution': 'logistic', 'aft_loss_distribution_scale': 0.8157391257601497, 'max_depth': 7, 'booster': 'gbtree', 'scale_pos_weight': 2.7227624970416913, 'alpha': 5.45370199739733, 'lambda': 2.7565243495237, 'eta': 0.7220099588470971, 'sampling_method': 'uniform', 'subsample': 0.7379791328575316, 'gamma': 6.375667799728031}. Best is trial 204 with value: 4.197459375224944.
[I 2023-12-18 23:38:30,096] Trial 353 pruned. Trial was pruned at iteration 0.
[I 2023-12-18 23:38:30,176] Trial 354 pruned. Trial was pruned at iteration 0.
[I 2023-12-18 23:38:30,256] Trial 355 pruned. Trial was pruned at iteration 0.
[I 2023-12-18 23:38:30,345] Trial 356 pruned. Trial was pruned at iteration 0.
[I 2023-12-18 23:38:30,426] Trial 357 pruned. Trial was pruned at iteration 0.
[I 2023-12-18 23:38:30,518] Trial 358 pruned. Trial was pruned at iteration 0.
[I 2023-12-18 23:38:30,596] Trial 359 pruned. Trial was pruned at iteration 0.
[I 2023-12-18 23:38:30,682] Trial 360 pruned. Trial was pruned at iteration 0.
[I 2023-12-18 23:38:30,761] Trial 361 pruned. Trial was pruned at iteration 0.
[I 2023-12-18 23:38:30,839] Trial 362 pruned. Trial was pruned at iteration 0.
[I 2023-12-18 23:38:30,943] Trial 363 pruned. Trial was pruned at iteration 0.
[I 2023-12-18 23:38:31,376] Trial 364 finished with value: 4.3004178892925315 and parameters: {'learning_rate': 0.14185882766897545, 'aft_loss_distribution': 'logistic', 'aft_loss_distribution_scale': 0.8323781692157517, 'max_depth': 6, 'booster': 'gbtree', 'scale_pos_weight': 2.9038046495376406, 'alpha': 6.105211086614397, 'lambda': 3.2632906435011955, 'eta': 0.5186144690558548, 'sampling_method': 'uniform', 'subsample': 0.7041730554801924, 'gamma': 5.801996897107205}. Best is trial 204 with value: 4.197459375224944.
[I 2023-12-18 23:38:31,466] Trial 365 pruned. Trial was pruned at iteration 0.
[I 2023-12-18 23:38:31,546] Trial 366 pruned. Trial was pruned at iteration 0.
[I 2023-12-18 23:38:31,631] Trial 367 pruned. Trial was pruned at iteration 0.
[I 2023-12-18 23:38:31,715] Trial 368 pruned. Trial was pruned at iteration 0.
[I 2023-12-18 23:38:31,802] Trial 369 pruned. Trial was pruned at iteration 0.
[I 2023-12-18 23:38:31,888] Trial 370 pruned. Trial was pruned at iteration 0.
[I 2023-12-18 23:38:31,981] Trial 371 pruned. Trial was pruned at iteration 0.
[I 2023-12-18 23:38:32,072] Trial 372 pruned. Trial was pruned at iteration 0.
[I 2023-12-18 23:38:32,162] Trial 373 pruned. Trial was pruned at iteration 1.
[I 2023-12-18 23:38:32,261] Trial 374 pruned. Trial was pruned at iteration 0.
[I 2023-12-18 23:38:32,354] Trial 375 pruned. Trial was pruned at iteration 0.
[I 2023-12-18 23:38:32,450] Trial 376 pruned. Trial was pruned at iteration 0.
[I 2023-12-18 23:38:32,544] Trial 377 pruned. Trial was pruned at iteration 0.
[I 2023-12-18 23:38:32,632] Trial 378 pruned. Trial was pruned at iteration 0.
[I 2023-12-18 23:38:32,716] Trial 379 pruned. Trial was pruned at iteration 0.
[I 2023-12-18 23:38:32,795] Trial 380 pruned. Trial was pruned at iteration 0.
[I 2023-12-18 23:38:32,884] Trial 381 pruned. Trial was pruned at iteration 0.
[I 2023-12-18 23:38:32,982] Trial 382 pruned. Trial was pruned at iteration 0.
[I 2023-12-18 23:38:33,073] Trial 383 pruned. Trial was pruned at iteration 0.
[I 2023-12-18 23:38:33,156] Trial 384 pruned. Trial was pruned at iteration 0.
[I 2023-12-18 23:38:33,246] Trial 385 pruned. Trial was pruned at iteration 0.
[I 2023-12-18 23:38:33,334] Trial 386 pruned. Trial was pruned at iteration 0.
[I 2023-12-18 23:38:33,414] Trial 387 pruned. Trial was pruned at iteration 0.
[I 2023-12-18 23:38:33,504] Trial 388 pruned. Trial was pruned at iteration 0.
[I 2023-12-18 23:38:33,589] Trial 389 pruned. Trial was pruned at iteration 0.
[I 2023-12-18 23:38:33,679] Trial 390 pruned. Trial was pruned at iteration 0.
[I 2023-12-18 23:38:33,768] Trial 391 pruned. Trial was pruned at iteration 0.
[I 2023-12-18 23:38:33,848] Trial 392 pruned. Trial was pruned at iteration 0.
[I 2023-12-18 23:38:33,932] Trial 393 pruned. Trial was pruned at iteration 0.
[I 2023-12-18 23:38:34,025] Trial 394 pruned. Trial was pruned at iteration 0.
[I 2023-12-18 23:38:34,114] Trial 395 pruned. Trial was pruned at iteration 0.
[I 2023-12-18 23:38:34,211] Trial 396 pruned. Trial was pruned at iteration 0.
[I 2023-12-18 23:38:34,295] Trial 397 pruned. Trial was pruned at iteration 0.
[I 2023-12-18 23:38:34,381] Trial 398 pruned. Trial was pruned at iteration 0.
[I 2023-12-18 23:38:34,471] Trial 399 pruned. Trial was pruned at iteration 0.
[I 2023-12-18 23:38:34,559] Trial 400 pruned. Trial was pruned at iteration 0.
[I 2023-12-18 23:38:34,643] Trial 401 pruned. Trial was pruned at iteration 0.
[I 2023-12-18 23:38:34,723] Trial 402 pruned. Trial was pruned at iteration 0.
[I 2023-12-18 23:38:34,812] Trial 403 pruned. Trial was pruned at iteration 0.
[I 2023-12-18 23:38:34,898] Trial 404 pruned. Trial was pruned at iteration 0.
[I 2023-12-18 23:39:14,695] Trial 405 pruned. Trial was pruned at iteration 305.
[I 2023-12-18 23:39:14,785] Trial 406 pruned. Trial was pruned at iteration 0.
[I 2023-12-18 23:39:14,865] Trial 407 pruned. Trial was pruned at iteration 0.
[I 2023-12-18 23:39:14,957] Trial 408 pruned. Trial was pruned at iteration 0.
[I 2023-12-18 23:39:15,041] Trial 409 pruned. Trial was pruned at iteration 0.
[I 2023-12-18 23:39:15,134] Trial 410 pruned. Trial was pruned at iteration 0.
[I 2023-12-18 23:39:15,218] Trial 411 pruned. Trial was pruned at iteration 0.
[I 2023-12-18 23:39:15,309] Trial 412 pruned. Trial was pruned at iteration 0.
[I 2023-12-18 23:39:15,395] Trial 413 pruned. Trial was pruned at iteration 0.
[I 2023-12-18 23:39:15,481] Trial 414 pruned. Trial was pruned at iteration 0.
[I 2023-12-18 23:39:15,565] Trial 415 pruned. Trial was pruned at iteration 0.
[I 2023-12-18 23:39:15,651] Trial 416 pruned. Trial was pruned at iteration 0.
[I 2023-12-18 23:39:15,739] Trial 417 pruned. Trial was pruned at iteration 0.
[I 2023-12-18 23:39:15,820] Trial 418 pruned. Trial was pruned at iteration 0.
[I 2023-12-18 23:39:15,906] Trial 419 pruned. Trial was pruned at iteration 0.
[I 2023-12-18 23:39:15,987] Trial 420 pruned. Trial was pruned at iteration 0.
[I 2023-12-18 23:39:16,078] Trial 421 pruned. Trial was pruned at iteration 0.
[I 2023-12-18 23:39:16,165] Trial 422 pruned. Trial was pruned at iteration 0.
[I 2023-12-18 23:39:16,253] Trial 423 pruned. Trial was pruned at iteration 0.
[I 2023-12-18 23:39:16,349] Trial 424 pruned. Trial was pruned at iteration 0.
[I 2023-12-18 23:39:16,433] Trial 425 pruned. Trial was pruned at iteration 0.
[I 2023-12-18 23:39:16,523] Trial 426 pruned. Trial was pruned at iteration 0.
[I 2023-12-18 23:39:16,607] Trial 427 pruned. Trial was pruned at iteration 0.
[I 2023-12-18 23:39:16,692] Trial 428 pruned. Trial was pruned at iteration 0.
[I 2023-12-18 23:39:16,778] Trial 429 pruned. Trial was pruned at iteration 0.
[I 2023-12-18 23:39:16,868] Trial 430 pruned. Trial was pruned at iteration 0.
[I 2023-12-18 23:39:16,957] Trial 431 pruned. Trial was pruned at iteration 0.
[I 2023-12-18 23:39:17,042] Trial 432 pruned. Trial was pruned at iteration 0.
[I 2023-12-18 23:39:17,684] Trial 433 pruned. Trial was pruned at iteration 253.
[I 2023-12-18 23:39:17,773] Trial 434 pruned. Trial was pruned at iteration 0.
[I 2023-12-18 23:39:17,857] Trial 435 pruned. Trial was pruned at iteration 0.
[I 2023-12-18 23:39:17,956] Trial 436 pruned. Trial was pruned at iteration 0.
[I 2023-12-18 23:39:18,042] Trial 437 pruned. Trial was pruned at iteration 0.
[I 2023-12-18 23:39:18,138] Trial 438 pruned. Trial was pruned at iteration 0.
[I 2023-12-18 23:39:18,234] Trial 439 pruned. Trial was pruned at iteration 0.
[I 2023-12-18 23:39:18,380] Trial 440 pruned. Trial was pruned at iteration 0.
[I 2023-12-18 23:39:18,521] Trial 441 pruned. Trial was pruned at iteration 0.
[I 2023-12-18 23:39:18,657] Trial 442 pruned. Trial was pruned at iteration 0.
[I 2023-12-18 23:39:18,796] Trial 443 pruned. Trial was pruned at iteration 0.
[I 2023-12-18 23:39:18,939] Trial 444 pruned. Trial was pruned at iteration 0.
[I 2023-12-18 23:39:19,094] Trial 445 pruned. Trial was pruned at iteration 0.
[I 2023-12-18 23:39:19,231] Trial 446 pruned. Trial was pruned at iteration 0.
[I 2023-12-18 23:39:21,627] Trial 447 pruned. Trial was pruned at iteration 64.
[I 2023-12-18 23:39:21,761] Trial 448 pruned. Trial was pruned at iteration 0.
[I 2023-12-18 23:39:21,898] Trial 449 pruned. Trial was pruned at iteration 0.
[I 2023-12-18 23:39:22,041] Trial 450 pruned. Trial was pruned at iteration 0.
[I 2023-12-18 23:39:22,190] Trial 451 pruned. Trial was pruned at iteration 0.
[I 2023-12-18 23:39:22,325] Trial 452 pruned. Trial was pruned at iteration 0.
[I 2023-12-18 23:39:29,572] Trial 453 finished with value: 4.290317003309776 and parameters: {'learning_rate': 0.14591379076009472, 'aft_loss_distribution': 'logistic', 'aft_loss_distribution_scale': 0.8228413478638926, 'max_depth': 5, 'booster': 'dart', 'scale_pos_weight': 3.4922581424823402, 'alpha': 5.9295213082108225, 'lambda': 3.0921516342726307, 'eta': 0.5611530064691845, 'sampling_method': 'uniform', 'subsample': 0.719656835738035, 'gamma': 5.531129893128097}. Best is trial 204 with value: 4.197459375224944.
[I 2023-12-18 23:39:29,667] Trial 454 pruned. Trial was pruned at iteration 0.
[I 2023-12-18 23:39:29,758] Trial 455 pruned. Trial was pruned at iteration 0.
[I 2023-12-18 23:39:29,847] Trial 456 pruned. Trial was pruned at iteration 0.
[I 2023-12-18 23:39:29,939] Trial 457 pruned. Trial was pruned at iteration 0.
[I 2023-12-18 23:39:30,030] Trial 458 pruned. Trial was pruned at iteration 0.
[I 2023-12-18 23:39:30,117] Trial 459 pruned. Trial was pruned at iteration 0.
[I 2023-12-18 23:39:30,207] Trial 460 pruned. Trial was pruned at iteration 0.
[I 2023-12-18 23:39:57,802] Trial 461 pruned. Trial was pruned at iteration 254.
[I 2023-12-18 23:39:57,897] Trial 462 pruned. Trial was pruned at iteration 0.
[I 2023-12-18 23:39:57,992] Trial 463 pruned. Trial was pruned at iteration 0.
[I 2023-12-18 23:39:58,085] Trial 464 pruned. Trial was pruned at iteration 0.
[I 2023-12-18 23:39:58,180] Trial 465 pruned. Trial was pruned at iteration 0.
[I 2023-12-18 23:39:58,274] Trial 466 pruned. Trial was pruned at iteration 0.
[I 2023-12-18 23:39:58,362] Trial 467 pruned. Trial was pruned at iteration 0.
[I 2023-12-18 23:39:58,480] Trial 468 pruned. Trial was pruned at iteration 9.
[I 2023-12-18 23:39:58,566] Trial 469 pruned. Trial was pruned at iteration 0.
[I 2023-12-18 23:39:58,672] Trial 470 pruned. Trial was pruned at iteration 0.
[I 2023-12-18 23:39:58,759] Trial 471 pruned. Trial was pruned at iteration 0.
