[I 2023-12-19 00:57:17,160] Trial 52 pruned. Trial was pruned at iteration 1.
[I 2023-12-19 00:57:17,239] Trial 53 pruned. Trial was pruned at iteration 0.
[I 2023-12-19 00:57:17,322] Trial 54 pruned. Trial was pruned at iteration 0.
[I 2023-12-19 00:57:17,458] Trial 55 pruned. Trial was pruned at iteration 1.
[I 2023-12-19 00:57:17,547] Trial 56 pruned. Trial was pruned at iteration 0.
[I 2023-12-19 00:57:17,667] Trial 57 pruned. Trial was pruned at iteration 1.
[I 2023-12-19 00:57:17,767] Trial 58 pruned. Trial was pruned at iteration 0.
[I 2023-12-19 00:57:17,862] Trial 59 pruned. Trial was pruned at iteration 0.
[I 2023-12-19 00:57:17,967] Trial 60 pruned. Trial was pruned at iteration 0.
[I 2023-12-19 00:57:18,067] Trial 61 pruned. Trial was pruned at iteration 0.
[I 2023-12-19 00:57:18,163] Trial 62 pruned. Trial was pruned at iteration 0.
[I 2023-12-19 00:57:18,263] Trial 63 pruned. Trial was pruned at iteration 0.
[I 2023-12-19 00:57:18,377] Trial 64 pruned. Trial was pruned at iteration 0.
[I 2023-12-19 00:57:18,477] Trial 65 pruned. Trial was pruned at iteration 0.
[I 2023-12-19 00:57:18,575] Trial 66 pruned. Trial was pruned at iteration 0.
[I 2023-12-19 00:57:18,668] Trial 67 pruned. Trial was pruned at iteration 0.
[I 2023-12-19 00:57:18,762] Trial 68 pruned. Trial was pruned at iteration 0.
[I 2023-12-19 00:57:18,861] Trial 69 pruned. Trial was pruned at iteration 0.
[I 2023-12-19 00:57:18,965] Trial 70 pruned. Trial was pruned at iteration 0.
[I 2023-12-19 00:57:19,324] Trial 71 pruned. Trial was pruned at iteration 15.
[I 2023-12-19 00:57:19,899] Trial 72 pruned. Trial was pruned at iteration 24.
[I 2023-12-19 00:57:20,017] Trial 73 pruned. Trial was pruned at iteration 2.
[I 2023-12-19 00:57:20,098] Trial 74 pruned. Trial was pruned at iteration 0.
[I 2023-12-19 00:57:20,164] Trial 75 pruned. Trial was pruned at iteration 0.
[I 2023-12-19 00:57:20,265] Trial 76 pruned. Trial was pruned at iteration 1.
[I 2023-12-19 00:57:20,343] Trial 77 pruned. Trial was pruned at iteration 0.
[I 2023-12-19 00:57:20,772] Trial 78 pruned. Trial was pruned at iteration 14.
[I 2023-12-19 00:57:20,851] Trial 79 pruned. Trial was pruned at iteration 0.
[I 2023-12-19 00:57:20,920] Trial 80 pruned. Trial was pruned at iteration 0.
[I 2023-12-19 00:57:20,989] Trial 81 pruned. Trial was pruned at iteration 0.
[I 2023-12-19 00:57:25,874] Trial 82 finished with value: inf and parameters: {'learning_rate': 0.3353432950439331, 'aft_loss_distribution': 'logistic', 'aft_loss_distribution_scale': 2.58867657653068, 'max_depth': 10, 'booster': 'dart', 'scale_pos_weight': 3.595117264213507, 'alpha': 3.4710858142072265, 'lambda': 9.537376179081374, 'eta': 0.8063952573981108, 'sampling_method': 'uniform', 'subsample': 0.7946681486589255, 'gamma': 1.3565636649718162}. Best is trial 39 with value: 2.303166958409313.
[I 2023-12-19 00:57:29,059] Trial 83 finished with value: inf and parameters: {'learning_rate': 0.43916609841179227, 'aft_loss_distribution': 'logistic', 'aft_loss_distribution_scale': 3.40342479399451, 'max_depth': 10, 'booster': 'dart', 'scale_pos_weight': 3.4257964924531286, 'alpha': 3.0767348275632314, 'lambda': 9.022636776702752, 'eta': 0.9956192468509347, 'sampling_method': 'uniform', 'subsample': 0.7128075174475169, 'gamma': 1.8966354023541605}. Best is trial 39 with value: 2.303166958409313.
[I 2023-12-19 00:57:35,056] Trial 84 finished with value: inf and parameters: {'learning_rate': 0.482153947620322, 'aft_loss_distribution': 'logistic', 'aft_loss_distribution_scale': 1.9322485823106947, 'max_depth': 9, 'booster': 'dart', 'scale_pos_weight': 3.295396485562398, 'alpha': 4.2438215235053, 'lambda': 7.462490657108768, 'eta': 0.909955501414645, 'sampling_method': 'uniform', 'subsample': 0.5699426641186985, 'gamma': 0.28235304647270565}. Best is trial 39 with value: 2.303166958409313.
[I 2023-12-19 00:57:35,125] Trial 85 pruned. Trial was pruned at iteration 0.
[I 2023-12-19 00:57:35,196] Trial 86 pruned. Trial was pruned at iteration 0.
[I 2023-12-19 00:57:35,273] Trial 87 pruned. Trial was pruned at iteration 0.
[I 2023-12-19 00:57:35,337] Trial 88 pruned. Trial was pruned at iteration 0.
[I 2023-12-19 00:57:35,437] Trial 89 pruned. Trial was pruned at iteration 2.
[I 2023-12-19 00:57:35,516] Trial 90 pruned. Trial was pruned at iteration 0.
[I 2023-12-19 00:57:36,882] Trial 91 finished with value: inf and parameters: {'learning_rate': 0.8622388151249148, 'aft_loss_distribution': 'normal', 'aft_loss_distribution_scale': 3.4732108781990134, 'max_depth': 8, 'booster': 'gbtree', 'scale_pos_weight': 3.4907547562983106, 'alpha': 9.627092657047761, 'lambda': 1.7844090546163491, 'eta': 0.7243373464567402, 'sampling_method': 'gradient_based', 'subsample': 0.43881537862643116, 'gamma': 2.8453094893245483}. Best is trial 39 with value: 2.303166958409313.
[I 2023-12-19 00:57:38,757] Trial 92 finished with value: inf and parameters: {'learning_rate': 0.8046357849706836, 'aft_loss_distribution': 'normal', 'aft_loss_distribution_scale': 2.96726844564272, 'max_depth': 9, 'booster': 'gbtree', 'scale_pos_weight': 1.5246874041332912, 'alpha': 9.812361432532843, 'lambda': 2.0147267088970553, 'eta': 0.8185216199196724, 'sampling_method': 'gradient_based', 'subsample': 0.3299714928866341, 'gamma': 3.586970680302562}. Best is trial 39 with value: 2.303166958409313.
[I 2023-12-19 00:57:38,830] Trial 93 pruned. Trial was pruned at iteration 0.
[I 2023-12-19 00:57:38,904] Trial 94 pruned. Trial was pruned at iteration 0.
[I 2023-12-19 00:57:38,972] Trial 95 pruned. Trial was pruned at iteration 0.
[I 2023-12-19 00:57:39,062] Trial 96 pruned. Trial was pruned at iteration 0.
[I 2023-12-19 00:57:40,910] Trial 97 finished with value: inf and parameters: {'learning_rate': 0.7779653462338619, 'aft_loss_distribution': 'logistic', 'aft_loss_distribution_scale': 2.0829225623081125, 'max_depth': 9, 'booster': 'dart', 'scale_pos_weight': 1.649155669059357, 'alpha': 7.7292330629601, 'lambda': 8.443161395141734, 'eta': 0.9591383722736524, 'sampling_method': 'uniform', 'subsample': 0.36986930557617687, 'gamma': 4.385854990027535}. Best is trial 39 with value: 2.303166958409313.
[I 2023-12-19 00:57:40,983] Trial 98 pruned. Trial was pruned at iteration 0.
[I 2023-12-19 00:57:41,048] Trial 99 pruned. Trial was pruned at iteration 0.
[I 2023-12-19 00:57:41,115] Trial 100 pruned. Trial was pruned at iteration 0.
[I 2023-12-19 00:57:41,209] Trial 101 pruned. Trial was pruned at iteration 1.
[I 2023-12-19 00:57:41,376] Trial 102 pruned. Trial was pruned at iteration 3.
[I 2023-12-19 00:57:41,448] Trial 103 pruned. Trial was pruned at iteration 0.
[I 2023-12-19 00:57:41,514] Trial 104 pruned. Trial was pruned at iteration 0.
[I 2023-12-19 00:57:41,582] Trial 105 pruned. Trial was pruned at iteration 0.
[I 2023-12-19 00:57:41,980] Trial 106 pruned. Trial was pruned at iteration 9.
[I 2023-12-19 00:57:42,057] Trial 107 pruned. Trial was pruned at iteration 0.
[I 2023-12-19 00:57:42,156] Trial 108 pruned. Trial was pruned at iteration 0.
[I 2023-12-19 00:57:42,229] Trial 109 pruned. Trial was pruned at iteration 0.
[I 2023-12-19 00:57:42,296] Trial 110 pruned. Trial was pruned at iteration 0.
[I 2023-12-19 00:57:42,498] Trial 111 pruned. Trial was pruned at iteration 6.
[I 2023-12-19 00:57:44,638] Trial 112 finished with value: inf and parameters: {'learning_rate': 0.5253738613668322, 'aft_loss_distribution': 'logistic', 'aft_loss_distribution_scale': 2.156679127455788, 'max_depth': 3, 'booster': 'dart', 'scale_pos_weight': 1.1311116134296424, 'alpha': 3.465630758826636, 'lambda': 9.183792736040452, 'eta': 0.18155500633131935, 'sampling_method': 'gradient_based', 'subsample': 0.6893045849891699, 'gamma': 8.372280937129942}. Best is trial 39 with value: 2.303166958409313.
[I 2023-12-19 00:57:44,757] Trial 113 pruned. Trial was pruned at iteration 0.
[I 2023-12-19 00:57:46,976] Trial 114 finished with value: inf and parameters: {'learning_rate': 0.39043403192281884, 'aft_loss_distribution': 'logistic', 'aft_loss_distribution_scale': 2.6052596172000038, 'max_depth': 3, 'booster': 'dart', 'scale_pos_weight': 1.2451825279609705, 'alpha': 3.0463679949031865, 'lambda': 1.5650793974650115, 'eta': 0.5420494466829778, 'sampling_method': 'gradient_based', 'subsample': 0.13195827748587932, 'gamma': 3.247137783731193}. Best is trial 39 with value: 2.303166958409313.
[I 2023-12-19 00:57:47,106] Trial 115 pruned. Trial was pruned at iteration 0.
[I 2023-12-19 00:57:47,893] Trial 116 finished with value: inf and parameters: {'learning_rate': 0.8226016584080583, 'aft_loss_distribution': 'logistic', 'aft_loss_distribution_scale': 1.6994883782228518, 'max_depth': 9, 'booster': 'gbtree', 'scale_pos_weight': 1.5714315486393042, 'alpha': 1.2764573759798026, 'lambda': 5.261611797125122, 'eta': 0.2208495359772396, 'sampling_method': 'uniform', 'subsample': 0.5666785902846231, 'gamma': 8.311911296995175}. Best is trial 39 with value: 2.303166958409313.
[I 2023-12-19 00:57:48,064] Trial 117 pruned. Trial was pruned at iteration 0.
[I 2023-12-19 00:57:48,178] Trial 118 pruned. Trial was pruned at iteration 0.
[I 2023-12-19 00:57:48,287] Trial 119 pruned. Trial was pruned at iteration 0.
[I 2023-12-19 00:57:49,967] Trial 120 finished with value: inf and parameters: {'learning_rate': 0.6925682373788502, 'aft_loss_distribution': 'normal', 'aft_loss_distribution_scale': 3.4645817600357756, 'max_depth': 5, 'booster': 'gbtree', 'scale_pos_weight': 3.629259738408361, 'alpha': 2.2933988418585614, 'lambda': 3.2187177153701496, 'eta': 0.13099639279159409, 'sampling_method': 'uniform', 'subsample': 0.70746241289782, 'gamma': 1.3787154047187937}. Best is trial 39 with value: 2.303166958409313.
[I 2023-12-19 00:57:50,102] Trial 121 pruned. Trial was pruned at iteration 4.
[I 2023-12-19 00:57:50,175] Trial 122 pruned. Trial was pruned at iteration 0.
[I 2023-12-19 00:57:52,022] Trial 123 finished with value: inf and parameters: {'learning_rate': 0.5774533131824058, 'aft_loss_distribution': 'logistic', 'aft_loss_distribution_scale': 2.271763646081266, 'max_depth': 3, 'booster': 'dart', 'scale_pos_weight': 0.6637688752568222, 'alpha': 0.7427933580523778, 'lambda': 6.722823460229558, 'eta': 0.1772258413527955, 'sampling_method': 'gradient_based', 'subsample': 0.5874557531593962, 'gamma': 4.421231608049844}. Best is trial 39 with value: 2.303166958409313.
[I 2023-12-19 00:57:52,129] Trial 124 pruned. Trial was pruned at iteration 0.
[I 2023-12-19 00:57:52,206] Trial 125 pruned. Trial was pruned at iteration 0.
[I 2023-12-19 00:57:52,278] Trial 126 pruned. Trial was pruned at iteration 0.
[I 2023-12-19 00:57:52,446] Trial 127 pruned. Trial was pruned at iteration 3.
[I 2023-12-19 00:57:52,520] Trial 128 pruned. Trial was pruned at iteration 0.
[I 2023-12-19 00:57:52,692] Trial 129 pruned. Trial was pruned at iteration 2.
[I 2023-12-19 00:57:52,767] Trial 130 pruned. Trial was pruned at iteration 0.
[I 2023-12-19 00:57:52,845] Trial 131 pruned. Trial was pruned at iteration 0.
[I 2023-12-19 00:57:52,919] Trial 132 pruned. Trial was pruned at iteration 0.
[I 2023-12-19 00:57:53,088] Trial 133 pruned. Trial was pruned at iteration 2.
[I 2023-12-19 00:57:57,427] Trial 134 finished with value: inf and parameters: {'learning_rate': 0.3383950094202254, 'aft_loss_distribution': 'logistic', 'aft_loss_distribution_scale': 1.8378026092314237, 'max_depth': 10, 'booster': 'dart', 'scale_pos_weight': 1.1798661149169918, 'alpha': 4.275015263398245, 'lambda': 9.616103398971962, 'eta': 0.8337547693397875, 'sampling_method': 'uniform', 'subsample': 0.7756862910032887, 'gamma': 1.6739954186693597}. Best is trial 39 with value: 2.303166958409313.
[I 2023-12-19 00:57:57,505] Trial 135 pruned. Trial was pruned at iteration 0.
[I 2023-12-19 00:57:57,574] Trial 136 pruned. Trial was pruned at iteration 0.
[I 2023-12-19 00:57:57,646] Trial 137 pruned. Trial was pruned at iteration 0.
[I 2023-12-19 00:57:57,726] Trial 138 pruned. Trial was pruned at iteration 0.
[I 2023-12-19 00:57:57,803] Trial 139 pruned. Trial was pruned at iteration 0.
[I 2023-12-19 00:57:57,881] Trial 140 pruned. Trial was pruned at iteration 0.
[I 2023-12-19 00:57:57,953] Trial 141 pruned. Trial was pruned at iteration 0.
[I 2023-12-19 00:57:58,028] Trial 142 pruned. Trial was pruned at iteration 0.
[I 2023-12-19 00:57:58,098] Trial 143 pruned. Trial was pruned at iteration 0.
[I 2023-12-19 00:58:02,287] Trial 144 finished with value: 2.217114888804277 and parameters: {'learning_rate': 0.42462859368149486, 'aft_loss_distribution': 'logistic', 'aft_loss_distribution_scale': 2.393151738647861, 'max_depth': 9, 'booster': 'dart', 'scale_pos_weight': 1.0965175899365254, 'alpha': 3.5669892264132272, 'lambda': 8.825026530127232, 'eta': 0.9196005352283472, 'sampling_method': 'uniform', 'subsample': 0.6520459252752795, 'gamma': 6.578137553937715}. Best is trial 144 with value: 2.217114888804277.
[I 2023-12-19 00:58:02,427] Trial 145 pruned. Trial was pruned at iteration 0.
[I 2023-12-19 00:58:02,537] Trial 146 pruned. Trial was pruned at iteration 0.
[I 2023-12-19 00:58:02,641] Trial 147 pruned. Trial was pruned at iteration 0.
[I 2023-12-19 00:58:02,758] Trial 148 pruned. Trial was pruned at iteration 0.
[I 2023-12-19 00:58:02,872] Trial 149 pruned. Trial was pruned at iteration 0.
[I 2023-12-19 00:58:03,004] Trial 150 pruned. Trial was pruned at iteration 0.
[I 2023-12-19 00:58:03,118] Trial 151 pruned. Trial was pruned at iteration 0.
[I 2023-12-19 00:58:03,238] Trial 152 pruned. Trial was pruned at iteration 0.
[I 2023-12-19 00:58:03,716] Trial 153 pruned. Trial was pruned at iteration 7.
[I 2023-12-19 00:58:03,838] Trial 154 pruned. Trial was pruned at iteration 1.
[I 2023-12-19 00:58:03,924] Trial 155 pruned. Trial was pruned at iteration 0.
[I 2023-12-19 00:58:03,996] Trial 156 pruned. Trial was pruned at iteration 0.
[I 2023-12-19 00:58:04,076] Trial 157 pruned. Trial was pruned at iteration 0.
[I 2023-12-19 00:58:04,163] Trial 158 pruned. Trial was pruned at iteration 0.
[I 2023-12-19 00:58:04,246] Trial 159 pruned. Trial was pruned at iteration 0.
[I 2023-12-19 00:58:04,321] Trial 160 pruned. Trial was pruned at iteration 0.
[I 2023-12-19 00:58:04,415] Trial 161 pruned. Trial was pruned at iteration 0.
[I 2023-12-19 00:58:12,394] Trial 162 finished with value: inf and parameters: {'learning_rate': 0.43927298424477157, 'aft_loss_distribution': 'logistic', 'aft_loss_distribution_scale': 1.7605103290488051, 'max_depth': 9, 'booster': 'dart', 'scale_pos_weight': 3.286758900151945, 'alpha': 4.101285958209946, 'lambda': 7.624596525605942, 'eta': 0.8758392800751388, 'sampling_method': 'uniform', 'subsample': 0.6264692962502028, 'gamma': 0.02758204235857914}. Best is trial 144 with value: 2.217114888804277.
[I 2023-12-19 00:58:12,477] Trial 163 pruned. Trial was pruned at iteration 0.
[I 2023-12-19 00:58:16,484] Trial 164 finished with value: inf and parameters: {'learning_rate': 0.4599625226580071, 'aft_loss_distribution': 'logistic', 'aft_loss_distribution_scale': 2.1713352339863383, 'max_depth': 9, 'booster': 'dart', 'scale_pos_weight': 2.054754646062046, 'alpha': 6.229723835338731, 'lambda': 1.4864279577064006, 'eta': 0.824268152245792, 'sampling_method': 'uniform', 'subsample': 0.5202359534075879, 'gamma': 0.9989258088769807}. Best is trial 144 with value: 2.217114888804277.
[I 2023-12-19 00:58:16,619] Trial 165 pruned. Trial was pruned at iteration 0.
[I 2023-12-19 00:58:16,848] Trial 166 pruned. Trial was pruned at iteration 2.
[I 2023-12-19 00:58:16,988] Trial 167 pruned. Trial was pruned at iteration 0.
[I 2023-12-19 00:58:17,095] Trial 168 pruned. Trial was pruned at iteration 0.
[I 2023-12-19 00:58:17,255] Trial 169 pruned. Trial was pruned at iteration 0.
[I 2023-12-19 00:58:17,360] Trial 170 pruned. Trial was pruned at iteration 0.
[I 2023-12-19 00:58:18,614] Trial 171 finished with value: inf and parameters: {'learning_rate': 0.8682399567669938, 'aft_loss_distribution': 'normal', 'aft_loss_distribution_scale': 3.4010468756638392, 'max_depth': 8, 'booster': 'gbtree', 'scale_pos_weight': 3.466573712897532, 'alpha': 9.765711702122058, 'lambda': 1.6481338653435103, 'eta': 0.7146413133731606, 'sampling_method': 'gradient_based', 'subsample': 0.4238271052089113, 'gamma': 3.0682460479736005}. Best is trial 144 with value: 2.217114888804277.
[I 2023-12-19 00:58:18,718] Trial 172 pruned. Trial was pruned at iteration 0.
[I 2023-12-19 00:58:18,803] Trial 173 pruned. Trial was pruned at iteration 0.
[I 2023-12-19 00:58:19,401] Trial 174 finished with value: inf and parameters: {'learning_rate': 0.8633324141735365, 'aft_loss_distribution': 'normal', 'aft_loss_distribution_scale': 3.716883066308105, 'max_depth': 7, 'booster': 'gbtree', 'scale_pos_weight': 3.4857770985188594, 'alpha': 9.167055041022131, 'lambda': 7.077238689180565, 'eta': 0.6238778614384028, 'sampling_method': 'gradient_based', 'subsample': 0.5437552775035903, 'gamma': 6.919029742337342}. Best is trial 144 with value: 2.217114888804277.
[I 2023-12-19 00:58:19,660] Trial 175 pruned. Trial was pruned at iteration 2.
[I 2023-12-19 00:58:19,737] Trial 176 pruned. Trial was pruned at iteration 0.
[I 2023-12-19 00:58:19,811] Trial 177 pruned. Trial was pruned at iteration 0.
[I 2023-12-19 00:58:19,906] Trial 178 pruned. Trial was pruned at iteration 0.
[I 2023-12-19 00:58:19,995] Trial 179 pruned. Trial was pruned at iteration 0.
[I 2023-12-19 00:58:21,771] Trial 180 finished with value: inf and parameters: {'learning_rate': 0.7142157174406288, 'aft_loss_distribution': 'normal', 'aft_loss_distribution_scale': 3.2800795681413493, 'max_depth': 3, 'booster': 'dart', 'scale_pos_weight': 2.822264902291796, 'alpha': 3.139137290287263, 'lambda': 8.776635714886906, 'eta': 0.881954778005762, 'sampling_method': 'gradient_based', 'subsample': 0.474245095860711, 'gamma': 3.8295383819614544}. Best is trial 144 with value: 2.217114888804277.
[I 2023-12-19 00:58:24,277] Trial 181 finished with value: inf and parameters: {'learning_rate': 0.7813274460801877, 'aft_loss_distribution': 'normal', 'aft_loss_distribution_scale': 2.9912596218681076, 'max_depth': 9, 'booster': 'gbtree', 'scale_pos_weight': 1.514022524359918, 'alpha': 9.972724378923061, 'lambda': 1.8719572806884937, 'eta': 0.8152793893185118, 'sampling_method': 'gradient_based', 'subsample': 0.25470605708211425, 'gamma': 3.5511947805215716}. Best is trial 144 with value: 2.217114888804277.
[I 2023-12-19 00:58:25,596] Trial 182 finished with value: inf and parameters: {'learning_rate': 0.8491349469810225, 'aft_loss_distribution': 'normal', 'aft_loss_distribution_scale': 3.5581777126449894, 'max_depth': 9, 'booster': 'gbtree', 'scale_pos_weight': 1.1851790436235765, 'alpha': 9.692020423724879, 'lambda': 4.564485813800692, 'eta': 0.8432265693692378, 'sampling_method': 'gradient_based', 'subsample': 0.3984832487103569, 'gamma': 3.1226851130641715}. Best is trial 144 with value: 2.217114888804277.
[I 2023-12-19 00:58:28,143] Trial 183 finished with value: inf and parameters: {'learning_rate': 0.8802745695606978, 'aft_loss_distribution': 'normal', 'aft_loss_distribution_scale': 2.6928240731952964, 'max_depth': 9, 'booster': 'gbtree', 'scale_pos_weight': 1.439963506292722, 'alpha': 9.59329809087047, 'lambda': 2.0891108922605053, 'eta': 0.7845910623869479, 'sampling_method': 'gradient_based', 'subsample': 0.2087443058023249, 'gamma': 7.988569824411635}. Best is trial 144 with value: 2.217114888804277.
[I 2023-12-19 00:58:30,199] Trial 184 finished with value: inf and parameters: {'learning_rate': 0.826978398032686, 'aft_loss_distribution': 'normal', 'aft_loss_distribution_scale': 2.397399951014579, 'max_depth': 9, 'booster': 'gbtree', 'scale_pos_weight': 1.591436747184172, 'alpha': 9.775499019619636, 'lambda': 5.021178492473614, 'eta': 0.7490573770809987, 'sampling_method': 'gradient_based', 'subsample': 0.34210823743296287, 'gamma': 3.3487672360276117}. Best is trial 144 with value: 2.217114888804277.
[I 2023-12-19 00:58:30,437] Trial 185 pruned. Trial was pruned at iteration 1.
[I 2023-12-19 00:58:32,497] Trial 186 finished with value: inf and parameters: {'learning_rate': 0.7903027422043387, 'aft_loss_distribution': 'normal', 'aft_loss_distribution_scale': 3.3439712315416297, 'max_depth': 10, 'booster': 'dart', 'scale_pos_weight': 0.3831717045231889, 'alpha': 3.9073671265334147, 'lambda': 7.989993338156756, 'eta': 0.8252614940247909, 'sampling_method': 'uniform', 'subsample': 0.30490964072595916, 'gamma': 5.533154729297129}. Best is trial 144 with value: 2.217114888804277.
[I 2023-12-19 00:58:32,619] Trial 187 pruned. Trial was pruned at iteration 0.
[I 2023-12-19 00:58:32,737] Trial 188 pruned. Trial was pruned at iteration 0.
[I 2023-12-19 00:58:32,811] Trial 189 pruned. Trial was pruned at iteration 0.
[I 2023-12-19 00:58:32,900] Trial 190 pruned. Trial was pruned at iteration 0.
[I 2023-12-19 00:58:32,986] Trial 191 pruned. Trial was pruned at iteration 0.
[I 2023-12-19 00:58:33,068] Trial 192 pruned. Trial was pruned at iteration 0.
[I 2023-12-19 00:58:35,190] Trial 193 finished with value: inf and parameters: {'learning_rate': 0.8110136265897904, 'aft_loss_distribution': 'logistic', 'aft_loss_distribution_scale': 2.0290045750065318, 'max_depth': 9, 'booster': 'dart', 'scale_pos_weight': 1.7492036614507054, 'alpha': 2.2597428377333983, 'lambda': 8.140664794339543, 'eta': 0.9676029655084711, 'sampling_method': 'uniform', 'subsample': 0.31546809971681855, 'gamma': 4.403597248001288}. Best is trial 144 with value: 2.217114888804277.
