[I 2023-12-21 04:01:34,843] Trial 379 finished with value: inf and parameters: {'learning_rate': 0.8392500462501232, 'aft_loss_distributi                                                                     on': 'normal', 'aft_loss_distribution_scale': 1.0431061033659113, 'max_depth': 6, 'booster': 'gbtree', 'scale_pos_weight': 1.940116824176                                                                     9327, 'alpha': 6.611515401164655, 'lambda': 1.6651610389218405, 'eta': 0.383721364359712, 'sampling_method': 'gradient_based', 'subsample                                                                     ': 0.8224685899738247, 'gamma': 1.4864116566322103}. Best is trial 81 with value: 4.234078754776428.
[I 2023-12-21 04:01:34,891] Trial 380 pruned. Trial was pruned at iteration 1.
[I 2023-12-21 04:01:34,937] Trial 381 pruned. Trial was pruned at iteration 0.
[I 2023-12-21 04:01:34,988] Trial 382 pruned. Trial was pruned at iteration 3.
[I 2023-12-21 04:01:35,036] Trial 383 pruned. Trial was pruned at iteration 0.
[I 2023-12-21 04:01:35,090] Trial 384 pruned. Trial was pruned at iteration 1.
[I 2023-12-21 04:01:35,137] Trial 385 pruned. Trial was pruned at iteration 0.
[I 2023-12-21 04:01:35,265] Trial 386 finished with value: inf and parameters: {'learning_rate': 0.8398604777926981, 'aft_loss_distributi                                                                     on': 'normal', 'aft_loss_distribution_scale': 1.132938933858436, 'max_depth': 6, 'booster': 'gbtree', 'scale_pos_weight': 1.8831173775191                                                                     754, 'alpha': 6.8893284758816185, 'lambda': 1.6390443662280951, 'eta': 0.4176279719994099, 'sampling_method': 'gradient_based', 'subsampl                                                                     e': 0.9285001326839859, 'gamma': 8.4338980447562}. Best is trial 81 with value: 4.234078754776428.
[I 2023-12-21 04:01:35,315] Trial 387 pruned. Trial was pruned at iteration 1.
[I 2023-12-21 04:01:35,361] Trial 388 pruned. Trial was pruned at iteration 0.
[I 2023-12-21 04:01:35,551] Trial 389 finished with value: 4.24843265144567 and parameters: {'learning_rate': 0.8313517826074918, 'aft_lo                                                                     ss_distribution': 'normal', 'aft_loss_distribution_scale': 1.0062786532979986, 'max_depth': 4, 'booster': 'gbtree', 'scale_pos_weight': 1                                                                     .5377279781282436, 'alpha': 6.549974187613787, 'lambda': 1.4741307965075305, 'eta': 0.29196764132045083, 'sampling_method': 'gradient_bas                                                                     ed', 'subsample': 0.8213966537499389, 'gamma': 7.806326323430494}. Best is trial 81 with value: 4.234078754776428.
[I 2023-12-21 04:01:35,597] Trial 390 pruned. Trial was pruned at iteration 0.
[I 2023-12-21 04:01:35,645] Trial 391 pruned. Trial was pruned at iteration 0.
[I 2023-12-21 04:01:35,804] Trial 392 finished with value: 4.253617181935523 and parameters: {'learning_rate': 0.9685774190835125, 'aft_l                                                                     oss_distribution': 'normal', 'aft_loss_distribution_scale': 1.0460364209648048, 'max_depth': 5, 'booster': 'gbtree', 'scale_pos_weight':                                                                      1.119479284608369, 'alpha': 6.1323732558116815, 'lambda': 5.13961912449109, 'eta': 0.2791497620495252, 'sampling_method': 'gradient_based                                                                     ', 'subsample': 0.8600693600184833, 'gamma': 7.248117746348323}. Best is trial 81 with value: 4.234078754776428.
[I 2023-12-21 04:01:35,935] Trial 393 finished with value: inf and parameters: {'learning_rate': 0.9874666549652056, 'aft_loss_distributi                                                                     on': 'normal', 'aft_loss_distribution_scale': 0.9901623238711421, 'max_depth': 5, 'booster': 'gbtree', 'scale_pos_weight': 1.306741014773                                                                     0347, 'alpha': 6.104747348215256, 'lambda': 5.884410909896895, 'eta': 0.291587358781973, 'sampling_method': 'gradient_based', 'subsample'                                                                     : 0.8629890515980294, 'gamma': 2.3415647329625595}. Best is trial 81 with value: 4.234078754776428.
[I 2023-12-21 04:01:35,982] Trial 394 pruned. Trial was pruned at iteration 0.
[I 2023-12-21 04:01:36,031] Trial 395 pruned. Trial was pruned at iteration 1.
[I 2023-12-21 04:01:36,080] Trial 396 pruned. Trial was pruned at iteration 1.
[I 2023-12-21 04:01:36,247] Trial 397 finished with value: 4.244575002752829 and parameters: {'learning_rate': 0.9291125667715633, 'aft_l                                                                     oss_distribution': 'normal', 'aft_loss_distribution_scale': 0.993110478693756, 'max_depth': 5, 'booster': 'gbtree', 'scale_pos_weight': 1                                                                     .0892037115783924, 'alpha': 6.5986800144404505, 'lambda': 1.1786699193130041, 'eta': 0.2867229272940643, 'sampling_method': 'gradient_bas                                                                     ed', 'subsample': 0.8084776189488447, 'gamma': 7.771114269605345}. Best is trial 81 with value: 4.234078754776428.
[I 2023-12-21 04:01:36,294] Trial 398 pruned. Trial was pruned at iteration 0.
[I 2023-12-21 04:01:36,521] Trial 399 finished with value: 4.258709098897322 and parameters: {'learning_rate': 0.9239553848387803, 'aft_l                                                                     oss_distribution': 'normal', 'aft_loss_distribution_scale': 0.955342594204833, 'max_depth': 5, 'booster': 'gbtree', 'scale_pos_weight': 1                                                                     .0088380830015864, 'alpha': 6.554935175676297, 'lambda': 6.268744353731693, 'eta': 0.28112488590953305, 'sampling_method': 'gradient_base                                                                     d', 'subsample': 0.8047788016065284, 'gamma': 7.476796268817428}. Best is trial 81 with value: 4.234078754776428.
[I 2023-12-21 04:01:36,569] Trial 400 pruned. Trial was pruned at iteration 0.
[I 2023-12-21 04:01:36,688] Trial 401 finished with value: inf and parameters: {'learning_rate': 0.9119754989439783, 'aft_loss_distributi                                                                     on': 'normal', 'aft_loss_distribution_scale': 1.0326186192564917, 'max_depth': 5, 'booster': 'gbtree', 'scale_pos_weight': 1.456713952519                                                                     8316, 'alpha': 6.440712666671548, 'lambda': 1.2247776839412305, 'eta': 0.24248938706171738, 'sampling_method': 'gradient_based', 'subsamp                                                                     le': 0.9498386736028567, 'gamma': 7.770604431386759}. Best is trial 81 with value: 4.234078754776428.
[I 2023-12-21 04:01:36,735] Trial 402 pruned. Trial was pruned at iteration 0.
[I 2023-12-21 04:01:36,782] Trial 403 pruned. Trial was pruned at iteration 0.
[I 2023-12-21 04:01:36,832] Trial 404 pruned. Trial was pruned at iteration 1.
[I 2023-12-21 04:01:36,880] Trial 405 pruned. Trial was pruned at iteration 0.
[I 2023-12-21 04:01:36,931] Trial 406 pruned. Trial was pruned at iteration 1.
[I 2023-12-21 04:01:37,059] Trial 407 finished with value: inf and parameters: {'learning_rate': 0.9363205229986461, 'aft_loss_distributi                                                                     on': 'normal', 'aft_loss_distribution_scale': 1.0482701080009542, 'max_depth': 4, 'booster': 'gbtree', 'scale_pos_weight': 1.122487194394                                                                     12, 'alpha': 6.9159298412222165, 'lambda': 1.7346354769737815, 'eta': 0.2756124692636392, 'sampling_method': 'uniform', 'subsample': 0.92                                                                     22245336627042, 'gamma': 7.7822478256252605}. Best is trial 81 with value: 4.234078754776428.
[I 2023-12-21 04:01:37,107] Trial 408 pruned. Trial was pruned at iteration 0.
[I 2023-12-21 04:01:37,159] Trial 409 pruned. Trial was pruned at iteration 2.
[I 2023-12-21 04:01:37,207] Trial 410 pruned. Trial was pruned at iteration 0.
[I 2023-12-21 04:01:37,261] Trial 411 pruned. Trial was pruned at iteration 2.
[I 2023-12-21 04:01:37,313] Trial 412 pruned. Trial was pruned at iteration 1.
[I 2023-12-21 04:01:37,362] Trial 413 pruned. Trial was pruned at iteration 0.
[I 2023-12-21 04:01:37,410] Trial 414 pruned. Trial was pruned at iteration 0.
[I 2023-12-21 04:01:37,458] Trial 415 pruned. Trial was pruned at iteration 0.
[I 2023-12-21 04:01:37,507] Trial 416 pruned. Trial was pruned at iteration 0.
[I 2023-12-21 04:01:37,555] Trial 417 pruned. Trial was pruned at iteration 0.
[I 2023-12-21 04:01:37,604] Trial 418 pruned. Trial was pruned at iteration 0.
[I 2023-12-21 04:01:37,657] Trial 419 pruned. Trial was pruned at iteration 2.
[I 2023-12-21 04:01:37,706] Trial 420 pruned. Trial was pruned at iteration 0.
[I 2023-12-21 04:01:37,754] Trial 421 pruned. Trial was pruned at iteration 0.
[I 2023-12-21 04:01:37,803] Trial 422 pruned. Trial was pruned at iteration 0.
[I 2023-12-21 04:01:37,852] Trial 423 pruned. Trial was pruned at iteration 0.
[I 2023-12-21 04:01:37,902] Trial 424 pruned. Trial was pruned at iteration 1.
[I 2023-12-21 04:01:37,952] Trial 425 pruned. Trial was pruned at iteration 1.
[I 2023-12-21 04:01:38,004] Trial 426 pruned. Trial was pruned at iteration 0.
[I 2023-12-21 04:01:38,053] Trial 427 pruned. Trial was pruned at iteration 0.
[I 2023-12-21 04:01:38,101] Trial 428 pruned. Trial was pruned at iteration 0.
[I 2023-12-21 04:01:38,150] Trial 429 pruned. Trial was pruned at iteration 0.
[I 2023-12-21 04:01:38,201] Trial 430 pruned. Trial was pruned at iteration 1.
[I 2023-12-21 04:01:38,254] Trial 431 pruned. Trial was pruned at iteration 2.
[I 2023-12-21 04:01:38,307] Trial 432 pruned. Trial was pruned at iteration 0.
[I 2023-12-21 04:01:38,357] Trial 433 pruned. Trial was pruned at iteration 0.
[I 2023-12-21 04:01:38,545] Trial 434 finished with value: 4.247174386546663 and parameters: {'learning_rate': 0.8397081662555781, 'aft_l                                                                     oss_distribution': 'normal', 'aft_loss_distribution_scale': 1.0474609745515278, 'max_depth': 6, 'booster': 'gbtree', 'scale_pos_weight':                                                                      2.0897700423653762, 'alpha': 9.394619045901806, 'lambda': 0.8376631633622297, 'eta': 0.7109748701108871, 'sampling_method': 'gradient_bas                                                                     ed', 'subsample': 0.9821828347908441, 'gamma': 7.108588100285358}. Best is trial 81 with value: 4.234078754776428.
[I 2023-12-21 04:01:38,594] Trial 435 pruned. Trial was pruned at iteration 0.
[I 2023-12-21 04:01:38,724] Trial 436 finished with value: inf and parameters: {'learning_rate': 0.8367105610087384, 'aft_loss_distributi                                                                     on': 'normal', 'aft_loss_distribution_scale': 0.9606396195771097, 'max_depth': 6, 'booster': 'gbtree', 'scale_pos_weight': 2.174778722193                                                                     499, 'alpha': 9.449354269779887, 'lambda': 0.8028807373763716, 'eta': 0.3424765996550173, 'sampling_method': 'gradient_based', 'subsample                                                                     ': 0.9830664511383006, 'gamma': 7.291858653231413}. Best is trial 81 with value: 4.234078754776428.
[I 2023-12-21 04:01:38,773] Trial 437 pruned. Trial was pruned at iteration 0.
[I 2023-12-21 04:01:38,825] Trial 438 pruned. Trial was pruned at iteration 1.
[I 2023-12-21 04:01:38,875] Trial 439 pruned. Trial was pruned at iteration 0.
[I 2023-12-21 04:01:38,925] Trial 440 pruned. Trial was pruned at iteration 0.
[I 2023-12-21 04:01:38,974] Trial 441 pruned. Trial was pruned at iteration 0.
[I 2023-12-21 04:01:39,023] Trial 442 pruned. Trial was pruned at iteration 0.
[I 2023-12-21 04:01:39,073] Trial 443 pruned. Trial was pruned at iteration 0.
[I 2023-12-21 04:01:39,126] Trial 444 pruned. Trial was pruned at iteration 1.
[I 2023-12-21 04:01:39,176] Trial 445 pruned. Trial was pruned at iteration 0.
[I 2023-12-21 04:01:39,227] Trial 446 pruned. Trial was pruned at iteration 0.
[I 2023-12-21 04:01:39,278] Trial 447 pruned. Trial was pruned at iteration 1.
[I 2023-12-21 04:01:39,406] Trial 448 finished with value: inf and parameters: {'learning_rate': 0.8684505875000552, 'aft_loss_distributi                                                                     on': 'normal', 'aft_loss_distribution_scale': 0.9952913261597227, 'max_depth': 6, 'booster': 'gbtree', 'scale_pos_weight': 1.581445512571                                                                     268, 'alpha': 9.978830611726002, 'lambda': 9.241905547308154, 'eta': 0.32963341319564754, 'sampling_method': 'gradient_based', 'subsample                                                                     ': 0.9503844975783303, 'gamma': 7.658117893882611}. Best is trial 81 with value: 4.234078754776428.
[I 2023-12-21 04:01:39,457] Trial 449 pruned. Trial was pruned at iteration 0.
[I 2023-12-21 04:01:39,507] Trial 450 pruned. Trial was pruned at iteration 0.
[I 2023-12-21 04:01:39,559] Trial 451 pruned. Trial was pruned at iteration 1.
[I 2023-12-21 04:01:39,612] Trial 452 pruned. Trial was pruned at iteration 0.
[I 2023-12-21 04:01:39,662] Trial 453 pruned. Trial was pruned at iteration 0.
[I 2023-12-21 04:01:39,712] Trial 454 pruned. Trial was pruned at iteration 0.
[I 2023-12-21 04:01:39,764] Trial 455 pruned. Trial was pruned at iteration 1.
[I 2023-12-21 04:01:39,814] Trial 456 pruned. Trial was pruned at iteration 0.
[I 2023-12-21 04:01:39,867] Trial 457 pruned. Trial was pruned at iteration 1.
[I 2023-12-21 04:01:39,919] Trial 458 pruned. Trial was pruned at iteration 0.
[I 2023-12-21 04:01:39,971] Trial 459 pruned. Trial was pruned at iteration 1.
[I 2023-12-21 04:01:40,100] Trial 460 finished with value: inf and parameters: {'learning_rate': 0.836275958491228, 'aft_loss_distributio                                                                     n': 'normal', 'aft_loss_distribution_scale': 0.9425030072647607, 'max_depth': 6, 'booster': 'gbtree', 'scale_pos_weight': 1.8537035186991                                                                     568, 'alpha': 9.0953549408197, 'lambda': 1.5920722034724606, 'eta': 0.26649687618901075, 'sampling_method': 'gradient_based', 'subsample'                                                                     : 0.9212907165602152, 'gamma': 4.741386258320996}. Best is trial 81 with value: 4.234078754776428.
[I 2023-12-21 04:01:40,151] Trial 461 pruned. Trial was pruned at iteration 0.
[I 2023-12-21 04:01:40,203] Trial 462 pruned. Trial was pruned at iteration 0.
[I 2023-12-21 04:01:40,253] Trial 463 pruned. Trial was pruned at iteration 0.
[I 2023-12-21 04:01:40,494] Trial 464 finished with value: 4.250280556655248 and parameters: {'learning_rate': 0.9489566647778095, 'aft_l                                                                     oss_distribution': 'normal', 'aft_loss_distribution_scale': 1.0400634639434525, 'max_depth': 4, 'booster': 'gbtree', 'scale_pos_weight':                                                                      2.138749700864574, 'alpha': 7.4912112066858105, 'lambda': 7.636961504215835, 'eta': 0.40815632987405615, 'sampling_method': 'uniform', 's                                                                     ubsample': 0.8644074923909415, 'gamma': 9.139737270774347}. Best is trial 81 with value: 4.234078754776428.
[I 2023-12-21 04:01:40,626] Trial 465 finished with value: inf and parameters: {'learning_rate': 0.925698167122632, 'aft_loss_distributio                                                                     n': 'normal', 'aft_loss_distribution_scale': 0.9651182564413187, 'max_depth': 4, 'booster': 'gbtree', 'scale_pos_weight': 1.8482248807889                                                                     13, 'alpha': 7.625498052513483, 'lambda': 5.081561371503963, 'eta': 0.4159191526538109, 'sampling_method': 'gradient_based', 'subsample':                                                                      0.8773681462647444, 'gamma': 9.059512012696612}. Best is trial 81 with value: 4.234078754776428.
[I 2023-12-21 04:01:40,678] Trial 466 pruned. Trial was pruned at iteration 1.
[I 2023-12-21 04:01:40,729] Trial 467 pruned. Trial was pruned at iteration 0.
[I 2023-12-21 04:01:40,779] Trial 468 pruned. Trial was pruned at iteration 0.
[I 2023-12-21 04:01:40,831] Trial 469 pruned. Trial was pruned at iteration 1.
[I 2023-12-21 04:01:40,882] Trial 470 pruned. Trial was pruned at iteration 1.
[I 2023-12-21 04:01:40,934] Trial 471 pruned. Trial was pruned at iteration 0.
[I 2023-12-21 04:01:40,988] Trial 472 pruned. Trial was pruned at iteration 1.
[I 2023-12-21 04:01:41,188] Trial 473 finished with value: 4.254826547414911 and parameters: {'learning_rate': 0.9551530057191671, 'aft_l                                                                     oss_distribution': 'normal', 'aft_loss_distribution_scale': 1.1211507472051156, 'max_depth': 6, 'booster': 'gbtree', 'scale_pos_weight':                                                                      1.6172116161550498, 'alpha': 7.466788813905726, 'lambda': 7.414468033754978, 'eta': 0.42987924633200825, 'sampling_method': 'uniform', 's                                                                     ubsample': 0.8597735146170739, 'gamma': 9.712300160554536}. Best is trial 81 with value: 4.234078754776428.
[I 2023-12-21 04:01:41,364] Trial 474 finished with value: 4.247810725029122 and parameters: {'learning_rate': 0.9550682950765258, 'aft_l                                                                     oss_distribution': 'normal', 'aft_loss_distribution_scale': 1.044438064371106, 'max_depth': 6, 'booster': 'gbtree', 'scale_pos_weight': 1                                                                     .6341633834154017, 'alpha': 6.621383216832965, 'lambda': 7.216324081863947, 'eta': 0.4271206009519046, 'sampling_method': 'uniform', 'sub                                                                     sample': 0.8503124526246068, 'gamma': 9.750751460517373}. Best is trial 81 with value: 4.234078754776428.
[I 2023-12-21 04:01:41,415] Trial 475 pruned. Trial was pruned at iteration 0.
[I 2023-12-21 04:01:41,468] Trial 476 pruned. Trial was pruned at iteration 2.
[I 2023-12-21 04:01:41,519] Trial 477 pruned. Trial was pruned at iteration 0.
[I 2023-12-21 04:01:41,570] Trial 478 pruned. Trial was pruned at iteration 0.
[I 2023-12-21 04:01:41,622] Trial 479 pruned. Trial was pruned at iteration 1.
[I 2023-12-21 04:01:41,920] Trial 480 finished with value: 4.256070559955647 and parameters: {'learning_rate': 0.9496089382378428, 'aft_l                                                                     oss_distribution': 'normal', 'aft_loss_distribution_scale': 1.0861307636628255, 'max_depth': 6, 'booster': 'gbtree', 'scale_pos_weight':                                                                      1.6899623332007168, 'alpha': 6.7865688952544705, 'lambda': 7.7252124520600844, 'eta': 0.44617174206105853, 'sampling_method': 'uniform',                                                                      'subsample': 0.7988558304551081, 'gamma': 8.73949606183227}. Best is trial 81 with value: 4.234078754776428.
[I 2023-12-21 04:01:41,973] Trial 481 pruned. Trial was pruned at iteration 1.
[I 2023-12-21 04:01:42,023] Trial 482 pruned. Trial was pruned at iteration 0.
[I 2023-12-21 04:01:42,076] Trial 483 pruned. Trial was pruned at iteration 0.
[I 2023-12-21 04:01:42,129] Trial 484 pruned. Trial was pruned at iteration 1.
[I 2023-12-21 04:01:42,392] Trial 485 finished with value: 4.2471403699607535 and parameters: {'learning_rate': 0.9694139375270523, 'aft_                                                                     loss_distribution': 'normal', 'aft_loss_distribution_scale': 0.9954935154586888, 'max_depth': 6, 'booster': 'gbtree', 'scale_pos_weight':                                                                      1.8017163642122322, 'alpha': 6.899760394445683, 'lambda': 5.780226833610486, 'eta': 0.40389273675143156, 'sampling_method': 'uniform', '                                                                     subsample': 0.873222413722505, 'gamma': 7.853720112271779}. Best is trial 81 with value: 4.234078754776428.
[I 2023-12-21 04:01:42,454] Trial 486 pruned. Trial was pruned at iteration 4.
[I 2023-12-21 04:01:42,509] Trial 487 pruned. Trial was pruned at iteration 1.
[I 2023-12-21 04:01:42,560] Trial 488 pruned. Trial was pruned at iteration 0.
[I 2023-12-21 04:01:42,686] Trial 489 finished with value: inf and parameters: {'learning_rate': 0.9860102782999035, 'aft_loss_distributi                                                                     on': 'normal', 'aft_loss_distribution_scale': 1.094125143513607, 'max_depth': 6, 'booster': 'gbtree', 'scale_pos_weight': 2.2021043160655                                                                     77, 'alpha': 8.531957695135956, 'lambda': 5.238600173294018, 'eta': 0.39447089511027167, 'sampling_method': 'uniform', 'subsample': 0.886                                                                     4937604372803, 'gamma': 7.8588704323319325}. Best is trial 81 with value: 4.234078754776428.
[I 2023-12-21 04:01:42,738] Trial 490 pruned. Trial was pruned at iteration 0.
[I 2023-12-21 04:01:42,793] Trial 491 pruned. Trial was pruned at iteration 1.
[I 2023-12-21 04:01:42,847] Trial 492 pruned. Trial was pruned at iteration 1.
[I 2023-12-21 04:01:42,903] Trial 493 pruned. Trial was pruned at iteration 2.
