[I 2023-12-21 04:36:59,111] Trial 51 pruned. Trial was pruned at iteration 0.
[I 2023-12-21 04:36:59,143] Trial 52 pruned. Trial was pruned at iteration 0.
[I 2023-12-21 04:36:59,178] Trial 53 pruned. Trial was pruned at iteration 0.
[I 2023-12-21 04:36:59,218] Trial 54 pruned. Trial was pruned at iteration 0.
[I 2023-12-21 04:36:59,252] Trial 55 pruned. Trial was pruned at iteration 0.
[I 2023-12-21 04:36:59,305] Trial 56 pruned. Trial was pruned at iteration 4.
[I 2023-12-21 04:36:59,338] Trial 57 pruned. Trial was pruned at iteration 0.
[I 2023-12-21 04:36:59,373] Trial 58 pruned. Trial was pruned at iteration 0.
[I 2023-12-21 04:36:59,418] Trial 59 pruned. Trial was pruned at iteration 2.
[I 2023-12-21 04:36:59,451] Trial 60 pruned. Trial was pruned at iteration 0.
[I 2023-12-21 04:36:59,484] Trial 61 pruned. Trial was pruned at iteration 0.
[I 2023-12-21 04:36:59,518] Trial 62 pruned. Trial was pruned at iteration 0.
[I 2023-12-21 04:36:59,551] Trial 63 pruned. Trial was pruned at iteration 0.
[I 2023-12-21 04:36:59,586] Trial 64 pruned. Trial was pruned at iteration 0.
[I 2023-12-21 04:36:59,624] Trial 65 pruned. Trial was pruned at iteration 0.
[I 2023-12-21 04:36:59,658] Trial 66 pruned. Trial was pruned at iteration 0.
[I 2023-12-21 04:36:59,692] Trial 67 pruned. Trial was pruned at iteration 0.
[I 2023-12-21 04:36:59,729] Trial 68 pruned. Trial was pruned at iteration 0.
[I 2023-12-21 04:36:59,762] Trial 69 pruned. Trial was pruned at iteration 0.
[I 2023-12-21 04:36:59,796] Trial 70 pruned. Trial was pruned at iteration 0.
[I 2023-12-21 04:36:59,830] Trial 71 pruned. Trial was pruned at iteration 0.
[I 2023-12-21 04:36:59,866] Trial 72 pruned. Trial was pruned at iteration 0.
[I 2023-12-21 04:36:59,901] Trial 73 pruned. Trial was pruned at iteration 0.
[I 2023-12-21 04:36:59,937] Trial 74 pruned. Trial was pruned at iteration 0.
[I 2023-12-21 04:36:59,973] Trial 75 pruned. Trial was pruned at iteration 1.
[I 2023-12-21 04:37:02,187] Trial 76 finished with value: 2.1897943008585936 and parameters: {'learning_rate': 0.9174446384623424, 'aft_l                                                                     oss_distribution': 'normal', 'aft_loss_distribution_scale': 3.558118122898807, 'max_depth': 9, 'booster': 'dart', 'scale_pos_weight': 2.9                                                                     425925645321542, 'alpha': 3.841883180333345, 'lambda': 3.4926280892762516, 'eta': 0.08247368473950814, 'sampling_method': 'uniform', 'sub                                                                     sample': 0.24428274476814132, 'gamma': 8.310048526339214}. Best is trial 1 with value: 2.009838820527457.
[I 2023-12-21 04:37:03,249] Trial 77 finished with value: inf and parameters: {'learning_rate': 0.9164713692012675, 'aft_loss_distributio                                                                     n': 'normal', 'aft_loss_distribution_scale': 2.7286409096263804, 'max_depth': 9, 'booster': 'dart', 'scale_pos_weight': 2.964774373609116                                                                     , 'alpha': 3.9282233663461232, 'lambda': 3.47011083022087, 'eta': 0.0846037267235934, 'sampling_method': 'uniform', 'subsample': 0.515907                                                                     1345052509, 'gamma': 8.285982331267524}. Best is trial 1 with value: 2.009838820527457.
[I 2023-12-21 04:37:03,289] Trial 78 pruned. Trial was pruned at iteration 4.
[I 2023-12-21 04:37:04,330] Trial 79 finished with value: inf and parameters: {'learning_rate': 0.9558513907174611, 'aft_loss_distributio                                                                     n': 'normal', 'aft_loss_distribution_scale': 1.8392977161835697, 'max_depth': 7, 'booster': 'dart', 'scale_pos_weight': 1.969886612215801                                                                     9, 'alpha': 3.6239336420168327, 'lambda': 4.2687477299427705, 'eta': 0.5636154720170935, 'sampling_method': 'uniform', 'subsample': 0.404                                                                     4028131647171, 'gamma': 3.068130853246901}. Best is trial 1 with value: 2.009838820527457.
[I 2023-12-21 04:37:04,368] Trial 80 pruned. Trial was pruned at iteration 1.
[I 2023-12-21 04:37:04,402] Trial 81 pruned. Trial was pruned at iteration 0.
[I 2023-12-21 04:37:04,436] Trial 82 pruned. Trial was pruned at iteration 0.
[I 2023-12-21 04:37:04,470] Trial 83 pruned. Trial was pruned at iteration 0.
[I 2023-12-21 04:37:08,563] Trial 84 pruned. Trial was pruned at iteration 113.
[I 2023-12-21 04:37:08,599] Trial 85 pruned. Trial was pruned at iteration 1.
[I 2023-12-21 04:37:08,636] Trial 86 pruned. Trial was pruned at iteration 0.
[I 2023-12-21 04:37:08,670] Trial 87 pruned. Trial was pruned at iteration 0.
[I 2023-12-21 04:37:08,706] Trial 88 pruned. Trial was pruned at iteration 0.
[I 2023-12-21 04:37:08,749] Trial 89 pruned. Trial was pruned at iteration 0.
[I 2023-12-21 04:37:08,783] Trial 90 pruned. Trial was pruned at iteration 0.
[I 2023-12-21 04:37:08,818] Trial 91 pruned. Trial was pruned at iteration 0.
[I 2023-12-21 04:37:08,856] Trial 92 pruned. Trial was pruned at iteration 1.
[I 2023-12-21 04:37:08,892] Trial 93 pruned. Trial was pruned at iteration 0.
[I 2023-12-21 04:37:08,929] Trial 94 pruned. Trial was pruned at iteration 1.
[I 2023-12-21 04:37:08,964] Trial 95 pruned. Trial was pruned at iteration 0.
[I 2023-12-21 04:37:09,002] Trial 96 pruned. Trial was pruned at iteration 1.
[I 2023-12-21 04:37:09,037] Trial 97 pruned. Trial was pruned at iteration 0.
[I 2023-12-21 04:37:10,411] Trial 98 finished with value: inf and parameters: {'learning_rate': 0.7524726467021561, 'aft_loss_distributio                                                                     n': 'normal', 'aft_loss_distribution_scale': 2.097112228263982, 'max_depth': 9, 'booster': 'dart', 'scale_pos_weight': 2.5857882232732274                                                                     , 'alpha': 8.086560766438444, 'lambda': 4.763041374402785, 'eta': 0.19958278016748232, 'sampling_method': 'uniform', 'subsample': 0.25841                                                                     86815349728, 'gamma': 7.472764129473441}. Best is trial 1 with value: 2.009838820527457.
[I 2023-12-21 04:37:10,450] Trial 99 pruned. Trial was pruned at iteration 0.
[I 2023-12-21 04:37:10,491] Trial 100 pruned. Trial was pruned at iteration 0.
[I 2023-12-21 04:37:10,527] Trial 101 pruned. Trial was pruned at iteration 0.
[I 2023-12-21 04:37:10,564] Trial 102 pruned. Trial was pruned at iteration 0.
[I 2023-12-21 04:37:10,602] Trial 103 pruned. Trial was pruned at iteration 0.
[I 2023-12-21 04:37:10,638] Trial 104 pruned. Trial was pruned at iteration 0.
[I 2023-12-21 04:37:10,676] Trial 105 pruned. Trial was pruned at iteration 0.
[I 2023-12-21 04:37:10,712] Trial 106 pruned. Trial was pruned at iteration 0.
[I 2023-12-21 04:37:10,749] Trial 107 pruned. Trial was pruned at iteration 0.
[I 2023-12-21 04:37:10,792] Trial 108 pruned. Trial was pruned at iteration 2.
[I 2023-12-21 04:37:10,828] Trial 109 pruned. Trial was pruned at iteration 0.
[I 2023-12-21 04:37:10,864] Trial 110 pruned. Trial was pruned at iteration 0.
[I 2023-12-21 04:37:10,907] Trial 111 pruned. Trial was pruned at iteration 1.
[I 2023-12-21 04:37:10,945] Trial 112 pruned. Trial was pruned at iteration 0.
[I 2023-12-21 04:37:15,634] Trial 113 pruned. Trial was pruned at iteration 120.
[I 2023-12-21 04:37:15,672] Trial 114 pruned. Trial was pruned at iteration 0.
[I 2023-12-21 04:37:15,709] Trial 115 pruned. Trial was pruned at iteration 0.
[I 2023-12-21 04:37:15,747] Trial 116 pruned. Trial was pruned at iteration 0.
[I 2023-12-21 04:37:15,784] Trial 117 pruned. Trial was pruned at iteration 0.
[I 2023-12-21 04:37:15,827] Trial 118 pruned. Trial was pruned at iteration 0.
[I 2023-12-21 04:37:15,864] Trial 119 pruned. Trial was pruned at iteration 0.
[I 2023-12-21 04:37:15,901] Trial 120 pruned. Trial was pruned at iteration 0.
[I 2023-12-21 04:37:15,948] Trial 121 pruned. Trial was pruned at iteration 1.
[I 2023-12-21 04:37:16,003] Trial 122 pruned. Trial was pruned at iteration 2.
[I 2023-12-21 04:37:16,041] Trial 123 pruned. Trial was pruned at iteration 0.
[I 2023-12-21 04:37:16,083] Trial 124 pruned. Trial was pruned at iteration 0.
[I 2023-12-21 04:37:16,121] Trial 125 pruned. Trial was pruned at iteration 0.
[I 2023-12-21 04:37:16,161] Trial 126 pruned. Trial was pruned at iteration 1.
[I 2023-12-21 04:37:16,199] Trial 127 pruned. Trial was pruned at iteration 0.
[I 2023-12-21 04:37:19,146] Trial 128 finished with value: 2.070348672167002 and parameters: {'learning_rate': 0.5140976983775896, 'aft_l                                                                     oss_distribution': 'logistic', 'aft_loss_distribution_scale': 1.3537114366572496, 'max_depth': 9, 'booster': 'dart', 'scale_pos_weight':                                                                      1.0885491636672133, 'alpha': 9.827270776439969, 'lambda': 4.036051779866401, 'eta': 0.13005273990673677, 'sampling_method': 'uniform', 's                                                                     ubsample': 0.6453886037157905, 'gamma': 7.018258422958622}. Best is trial 1 with value: 2.009838820527457.
[I 2023-12-21 04:37:19,184] Trial 129 pruned. Trial was pruned at iteration 0.
[I 2023-12-21 04:37:19,226] Trial 130 pruned. Trial was pruned at iteration 0.
[I 2023-12-21 04:37:19,265] Trial 131 pruned. Trial was pruned at iteration 0.
[I 2023-12-21 04:37:19,308] Trial 132 pruned. Trial was pruned at iteration 1.
[I 2023-12-21 04:37:30,266] Trial 133 finished with value: 2.1410707395607016 and parameters: {'learning_rate': 0.7183858026161964, 'aft_                                                                     loss_distribution': 'logistic', 'aft_loss_distribution_scale': 1.7025221233219956, 'max_depth': 8, 'booster': 'dart', 'scale_pos_weight':                                                                      1.5384165042750866, 'alpha': 8.906853344131672, 'lambda': 4.037538787495448, 'eta': 0.2204071990281614, 'sampling_method': 'uniform', 's                                                                     ubsample': 0.6252932344439799, 'gamma': 7.827895273696533}. Best is trial 1 with value: 2.009838820527457.
[I 2023-12-21 04:37:32,374] Trial 134 finished with value: 2.136739708748441 and parameters: {'learning_rate': 0.6819792348399075, 'aft_l                                                                     oss_distribution': 'logistic', 'aft_loss_distribution_scale': 1.7389287270275253, 'max_depth': 8, 'booster': 'dart', 'scale_pos_weight':                                                                      1.2462028354686265, 'alpha': 9.675732472397495, 'lambda': 4.057298531080901, 'eta': 0.16994388419241818, 'sampling_method': 'uniform', 's                                                                     ubsample': 0.6197074767591912, 'gamma': 7.537371303808537}. Best is trial 1 with value: 2.009838820527457.
[I 2023-12-21 04:37:32,413] Trial 135 pruned. Trial was pruned at iteration 0.
[I 2023-12-21 04:37:32,451] Trial 136 pruned. Trial was pruned at iteration 0.
[I 2023-12-21 04:37:32,488] Trial 137 pruned. Trial was pruned at iteration 0.
[I 2023-12-21 04:37:32,531] Trial 138 pruned. Trial was pruned at iteration 0.
[I 2023-12-21 04:37:32,568] Trial 139 pruned. Trial was pruned at iteration 0.
[I 2023-12-21 04:37:32,607] Trial 140 pruned. Trial was pruned at iteration 0.
[I 2023-12-21 04:37:35,505] Trial 141 finished with value: 2.1324586737275157 and parameters: {'learning_rate': 0.47308856617593176, 'aft                                                                     _loss_distribution': 'logistic', 'aft_loss_distribution_scale': 1.8114389889187226, 'max_depth': 7, 'booster': 'dart', 'scale_pos_weight'                                                                     : 1.3924452087264179, 'alpha': 5.454331762473359, 'lambda': 4.090773039095498, 'eta': 0.15349996405368357, 'sampling_method': 'uniform',                                                                      'subsample': 0.5462535909354627, 'gamma': 7.336731468112317}. Best is trial 1 with value: 2.009838820527457.
[I 2023-12-21 04:37:40,514] Trial 142 finished with value: 2.13755583314926 and parameters: {'learning_rate': 0.6379112522873421, 'aft_lo                                                                     ss_distribution': 'logistic', 'aft_loss_distribution_scale': 1.8132655485130313, 'max_depth': 7, 'booster': 'dart', 'scale_pos_weight': 1                                                                     .4814899972125393, 'alpha': 5.328165587827609, 'lambda': 4.617549152120402, 'eta': 0.14303304067487063, 'sampling_method': 'uniform', 'su                                                                     bsample': 0.5219913914245703, 'gamma': 7.206782980363075}. Best is trial 1 with value: 2.009838820527457.
[I 2023-12-21 04:37:42,644] Trial 143 finished with value: 2.1638632059609204 and parameters: {'learning_rate': 0.7970135136813, 'aft_los                                                                     s_distribution': 'logistic', 'aft_loss_distribution_scale': 1.839365944301972, 'max_depth': 7, 'booster': 'dart', 'scale_pos_weight': 1.4                                                                     848473110478626, 'alpha': 5.657025981246339, 'lambda': 4.059461202788462, 'eta': 0.1414764438919912, 'sampling_method': 'uniform', 'subsa                                                                     mple': 0.5556456347136566, 'gamma': 7.276132974952334}. Best is trial 1 with value: 2.009838820527457.
[I 2023-12-21 04:37:44,051] Trial 144 finished with value: inf and parameters: {'learning_rate': 0.7232186230515225, 'aft_loss_distributi                                                                     on': 'logistic', 'aft_loss_distribution_scale': 1.6970447304772094, 'max_depth': 7, 'booster': 'dart', 'scale_pos_weight': 1.544308046121                                                                     2804, 'alpha': 5.540160880577444, 'lambda': 4.64845986429893, 'eta': 0.14461240647678297, 'sampling_method': 'uniform', 'subsample': 0.54                                                                     20785113387655, 'gamma': 6.695248097666441}. Best is trial 1 with value: 2.009838820527457.
[I 2023-12-21 04:37:46,173] Trial 145 finished with value: 2.155087493199619 and parameters: {'learning_rate': 0.6895132697582719, 'aft_l                                                                     oss_distribution': 'logistic', 'aft_loss_distribution_scale': 1.913024626150148, 'max_depth': 7, 'booster': 'dart', 'scale_pos_weight': 1                                                                     .5114299658758452, 'alpha': 5.890248468859087, 'lambda': 4.091349446114828, 'eta': 0.17243657984031213, 'sampling_method': 'uniform', 'su                                                                     bsample': 0.5545180476939247, 'gamma': 7.325885096096791}. Best is trial 1 with value: 2.009838820527457.
[I 2023-12-21 04:37:46,215] Trial 146 pruned. Trial was pruned at iteration 1.
[I 2023-12-21 04:37:46,253] Trial 147 pruned. Trial was pruned at iteration 0.
[I 2023-12-21 04:37:46,310] Trial 148 pruned. Trial was pruned at iteration 3.
[I 2023-12-21 04:37:46,350] Trial 149 pruned. Trial was pruned at iteration 1.
[I 2023-12-21 04:37:46,390] Trial 150 pruned. Trial was pruned at iteration 0.
[I 2023-12-21 04:37:46,432] Trial 151 pruned. Trial was pruned at iteration 1.
[I 2023-12-21 04:37:46,469] Trial 152 pruned. Trial was pruned at iteration 0.
[I 2023-12-21 04:38:05,951] Trial 153 finished with value: 2.11150771145929 and parameters: {'learning_rate': 0.6073172140110209, 'aft_lo                                                                     ss_distribution': 'logistic', 'aft_loss_distribution_scale': 1.6253374950993003, 'max_depth': 7, 'booster': 'dart', 'scale_pos_weight': 1                                                                     .7033922806009454, 'alpha': 5.377297746038372, 'lambda': 3.072861816500435, 'eta': 0.18044484754009427, 'sampling_method': 'uniform', 'su                                                                     bsample': 0.5952689566096152, 'gamma': 6.857154500754752}. Best is trial 1 with value: 2.009838820527457.
[I 2023-12-21 04:38:11,563] Trial 154 finished with value: 2.1069470408200557 and parameters: {'learning_rate': 0.6059504475488271, 'aft_                                                                     loss_distribution': 'logistic', 'aft_loss_distribution_scale': 1.562698390360495, 'max_depth': 7, 'booster': 'dart', 'scale_pos_weight':                                                                      1.4433334342803414, 'alpha': 5.418941732920527, 'lambda': 4.318523403854694, 'eta': 0.2047026745516562, 'sampling_method': 'uniform', 'su                                                                     bsample': 0.5963632808580286, 'gamma': 6.527860783109186}. Best is trial 1 with value: 2.009838820527457.
[I 2023-12-21 04:38:12,913] Trial 155 finished with value: inf and parameters: {'learning_rate': 0.6426209330009557, 'aft_loss_distributi                                                                     on': 'logistic', 'aft_loss_distribution_scale': 1.6032883352902865, 'max_depth': 7, 'booster': 'dart', 'scale_pos_weight': 1.417805558598                                                                     432, 'alpha': 5.461047492354999, 'lambda': 4.2627788752784035, 'eta': 0.2062504024687124, 'sampling_method': 'uniform', 'subsample': 0.59                                                                     34661485634293, 'gamma': 7.236164624436481}. Best is trial 1 with value: 2.009838820527457.
[I 2023-12-21 04:38:14,801] Trial 156 finished with value: 2.1348481209370567 and parameters: {'learning_rate': 0.6156579189699042, 'aft_                                                                     loss_distribution': 'logistic', 'aft_loss_distribution_scale': 1.8082075600705478, 'max_depth': 7, 'booster': 'dart', 'scale_pos_weight':                                                                      1.6887645460257803, 'alpha': 5.797299803989809, 'lambda': 3.0805903443447655, 'eta': 0.2324304860649472, 'sampling_method': 'uniform', '                                                                     subsample': 0.6382915727207913, 'gamma': 6.885016092333114}. Best is trial 1 with value: 2.009838820527457.
[I 2023-12-21 04:38:17,839] Trial 157 finished with value: 2.1400377806547226 and parameters: {'learning_rate': 0.5940316629096146, 'aft_                                                                     loss_distribution': 'logistic', 'aft_loss_distribution_scale': 1.8510539481857273, 'max_depth': 7, 'booster': 'dart', 'scale_pos_weight':                                                                      1.665031388580728, 'alpha': 4.758073180393606, 'lambda': 3.4030429792097188, 'eta': 0.2445292725294665, 'sampling_method': 'uniform', 's                                                                     ubsample': 0.6367223293107905, 'gamma': 6.865078853895437}. Best is trial 1 with value: 2.009838820527457.
[I 2023-12-21 04:38:18,149] Trial 158 pruned. Trial was pruned at iteration 26.
[I 2023-12-21 04:38:18,191] Trial 159 pruned. Trial was pruned at iteration 1.
[I 2023-12-21 04:38:18,230] Trial 160 pruned. Trial was pruned at iteration 0.
[I 2023-12-21 04:38:18,268] Trial 161 pruned. Trial was pruned at iteration 0.
[I 2023-12-21 04:38:20,441] Trial 162 finished with value: 2.1264005132962014 and parameters: {'learning_rate': 0.5721111781955303, 'aft_                                                                     loss_distribution': 'logistic', 'aft_loss_distribution_scale': 1.7515253341254455, 'max_depth': 7, 'booster': 'dart', 'scale_pos_weight':                                                                      1.5371146117849634, 'alpha': 3.8329876960017066, 'lambda': 2.9936976574015626, 'eta': 0.16491243783633075, 'sampling_method': 'uniform',                                                                      'subsample': 0.5368089679610402, 'gamma': 6.46259391628189}. Best is trial 1 with value: 2.009838820527457.
[I 2023-12-21 04:38:22,958] Trial 163 finished with value: 2.126832748675956 and parameters: {'learning_rate': 0.568934243244278, 'aft_lo                                                                     ss_distribution': 'logistic', 'aft_loss_distribution_scale': 1.7496576341443835, 'max_depth': 7, 'booster': 'dart', 'scale_pos_weight': 1                                                                     .4535033598795897, 'alpha': 5.6844580568919385, 'lambda': 3.4409482724141256, 'eta': 0.15509281470498257, 'sampling_method': 'uniform', '                                                                     subsample': 0.5186001460951705, 'gamma': 6.403254858162715}. Best is trial 1 with value: 2.009838820527457.
[I 2023-12-21 04:38:27,923] Trial 164 pruned. Trial was pruned at iteration 124.
[I 2023-12-21 04:38:27,969] Trial 165 pruned. Trial was pruned at iteration 1.
[I 2023-12-21 04:38:29,305] Trial 166 finished with value: inf and parameters: {'learning_rate': 0.6123538207159398, 'aft_loss_distributi                                                                     on': 'logistic', 'aft_loss_distribution_scale': 1.611513221519307, 'max_depth': 7, 'booster': 'dart', 'scale_pos_weight': 1.7295154715930                                                                     9, 'alpha': 5.209331491833532, 'lambda': 2.8449675432130217, 'eta': 0.14697482408060303, 'sampling_method': 'uniform', 'subsample': 0.502                                                                     1754641381276, 'gamma': 6.065819413544859}. Best is trial 1 with value: 2.009838820527457.
