[I 2023-12-19 00:49:22,024] Trial 158 finished with value: 1.9910184205457668 and parameters: {'learning_rate': 0.9390931197506335, 'aft_loss_distribution': 'normal', 'aft_loss_distribution_scale': 1.4626663372164945, 'max_depth': 7, 'booster': 'dart', 'scale_pos_weight': 2.576563608115069, 'alpha': 5.868730724597675, 'lambda': 9.77955384346639, 'eta': 0.8301554908966299, 'sampling_method': 'uniform', 'subsample': 0.7272619964343527, 'gamma': 9.430547447386825}. Best is trial 116 with value: 1.9878633343995167.
[I 2023-12-19 00:49:22,112] Trial 159 pruned. Trial was pruned at iteration 0.
[I 2023-12-19 00:49:22,199] Trial 160 pruned. Trial was pruned at iteration 0.
[I 2023-12-19 00:49:25,772] Trial 161 finished with value: 1.9882364401618116 and parameters: {'learning_rate': 0.9621273005873767, 'aft_loss_distribution': 'normal', 'aft_loss_distribution_scale': 1.4338522294558271, 'max_depth': 7, 'booster': 'dart', 'scale_pos_weight': 2.742845195881053, 'alpha': 5.514866689717076, 'lambda': 9.448596176724745, 'eta': 0.7132687245390764, 'sampling_method': 'uniform', 'subsample': 0.7262572776935204, 'gamma': 9.480120723318523}. Best is trial 116 with value: 1.9878633343995167.
[I 2023-12-19 00:49:29,847] Trial 162 finished with value: 1.9909432617743252 and parameters: {'learning_rate': 0.9593242145175966, 'aft_loss_distribution': 'normal', 'aft_loss_distribution_scale': 1.319279351437844, 'max_depth': 7, 'booster': 'dart', 'scale_pos_weight': 2.3403609750787844, 'alpha': 5.900872214007171, 'lambda': 9.334969568215401, 'eta': 0.9259716655382149, 'sampling_method': 'uniform', 'subsample': 0.7260418047989954, 'gamma': 9.51331033489736}. Best is trial 116 with value: 1.9878633343995167.
[I 2023-12-19 00:49:29,971] Trial 163 pruned. Trial was pruned at iteration 2.
[I 2023-12-19 00:49:30,064] Trial 164 pruned. Trial was pruned at iteration 0.
[I 2023-12-19 00:49:30,184] Trial 165 pruned. Trial was pruned at iteration 1.
[I 2023-12-19 00:49:44,701] Trial 166 finished with value: 1.994838943298193 and parameters: {'learning_rate': 0.9355003246705392, 'aft_loss_distribution': 'normal', 'aft_loss_distribution_scale': 1.5928869815292306, 'max_depth': 7, 'booster': 'dart', 'scale_pos_weight': 2.8875481074023357, 'alpha': 6.266210280373136, 'lambda': 9.574004205935054, 'eta': 0.9586237074710913, 'sampling_method': 'uniform', 'subsample': 0.6672870913378853, 'gamma': 9.478660596322703}. Best is trial 116 with value: 1.9878633343995167.
[I 2023-12-19 00:49:44,812] Trial 167 pruned. Trial was pruned at iteration 0.
[I 2023-12-19 00:49:48,855] Trial 168 finished with value: 1.9905288412511781 and parameters: {'learning_rate': 0.9990900500138663, 'aft_loss_distribution': 'normal', 'aft_loss_distribution_scale': 1.3590329424996612, 'max_depth': 7, 'booster': 'dart', 'scale_pos_weight': 2.595347788120644, 'alpha': 5.350787740843631, 'lambda': 9.281414351977487, 'eta': 0.9794743995433242, 'sampling_method': 'uniform', 'subsample': 0.7190358284035863, 'gamma': 9.222005644730023}. Best is trial 116 with value: 1.9878633343995167.
[I 2023-12-19 00:49:50,594] Trial 169 finished with value: inf and parameters: {'learning_rate': 0.9856748880623842, 'aft_loss_distribution': 'normal', 'aft_loss_distribution_scale': 1.2162686995106395, 'max_depth': 7, 'booster': 'dart', 'scale_pos_weight': 2.571369269469291, 'alpha': 5.286369972030735, 'lambda': 9.816924815666756, 'eta': 0.9825104061594201, 'sampling_method': 'uniform', 'subsample': 0.7222985664222424, 'gamma': 9.06654807566053}. Best is trial 116 with value: 1.9878633343995167.
[I 2023-12-19 00:49:50,673] Trial 170 pruned. Trial was pruned at iteration 0.
[I 2023-12-19 00:49:54,311] Trial 171 finished with value: 1.9899470089560436 and parameters: {'learning_rate': 0.9412966984556506, 'aft_loss_distribution': 'normal', 'aft_loss_distribution_scale': 1.42177874299572, 'max_depth': 7, 'booster': 'dart', 'scale_pos_weight': 2.654636021505434, 'alpha': 5.466138679844304, 'lambda': 8.87898304847613, 'eta': 0.9126898964114321, 'sampling_method': 'uniform', 'subsample': 0.711071647076599, 'gamma': 9.461455593125951}. Best is trial 116 with value: 1.9878633343995167.
[I 2023-12-19 00:49:57,059] Trial 172 finished with value: 1.992106330365165 and parameters: {'learning_rate': 0.9364499855664897, 'aft_loss_distribution': 'normal', 'aft_loss_distribution_scale': 1.4915374817945164, 'max_depth': 7, 'booster': 'dart', 'scale_pos_weight': 2.6146215760744953, 'alpha': 5.4759593178285515, 'lambda': 8.856894643190435, 'eta': 0.8967322660602421, 'sampling_method': 'uniform', 'subsample': 0.7420515744024933, 'gamma': 9.273965796702173}. Best is trial 116 with value: 1.9878633343995167.
[I 2023-12-19 00:50:00,589] Trial 173 finished with value: 1.991823213323669 and parameters: {'learning_rate': 0.9982605790107957, 'aft_loss_distribution': 'normal', 'aft_loss_distribution_scale': 1.2934989951218754, 'max_depth': 7, 'booster': 'dart', 'scale_pos_weight': 2.654560435571328, 'alpha': 5.865704686541772, 'lambda': 9.346159014409768, 'eta': 0.9160211120257514, 'sampling_method': 'uniform', 'subsample': 0.7138723972699484, 'gamma': 9.500045624980443}. Best is trial 116 with value: 1.9878633343995167.
[I 2023-12-19 00:50:00,733] Trial 174 pruned. Trial was pruned at iteration 1.
[I 2023-12-19 00:50:00,856] Trial 175 pruned. Trial was pruned at iteration 0.
[I 2023-12-19 00:50:00,978] Trial 176 pruned. Trial was pruned at iteration 0.
[I 2023-12-19 00:50:03,241] Trial 177 finished with value: inf and parameters: {'learning_rate': 0.9998882149777508, 'aft_loss_distribution': 'normal', 'aft_loss_distribution_scale': 1.157396739985819, 'max_depth': 7, 'booster': 'dart', 'scale_pos_weight': 2.5710602798476483, 'alpha': 5.6682141661484, 'lambda': 8.63107409907076, 'eta': 0.9966589679037293, 'sampling_method': 'uniform', 'subsample': 0.6518126586128479, 'gamma': 8.851620394141635}. Best is trial 116 with value: 1.9878633343995167.
[I 2023-12-19 00:50:05,954] Trial 178 pruned. Trial was pruned at iteration 79.
[I 2023-12-19 00:50:06,028] Trial 179 pruned. Trial was pruned at iteration 1.
[I 2023-12-19 00:50:06,103] Trial 180 pruned. Trial was pruned at iteration 0.
[I 2023-12-19 00:50:20,167] Trial 181 finished with value: 1.9897426862116843 and parameters: {'learning_rate': 0.9569174662008415, 'aft_loss_distribution': 'normal', 'aft_loss_distribution_scale': 1.3909434543670927, 'max_depth': 8, 'booster': 'dart', 'scale_pos_weight': 2.797924371129232, 'alpha': 5.179252870167792, 'lambda': 9.165470220832002, 'eta': 0.7187678506148241, 'sampling_method': 'uniform', 'subsample': 0.7011523994176407, 'gamma': 9.96657517823983}. Best is trial 116 with value: 1.9878633343995167.
[I 2023-12-19 00:50:29,573] Trial 182 finished with value: 1.9917137645389387 and parameters: {'learning_rate': 0.9629815747284343, 'aft_loss_distribution': 'normal', 'aft_loss_distribution_scale': 1.5061527914435335, 'max_depth': 7, 'booster': 'dart', 'scale_pos_weight': 2.8131228493461142, 'alpha': 5.118372385824124, 'lambda': 9.121948500601306, 'eta': 0.7139746672639995, 'sampling_method': 'uniform', 'subsample': 0.6883705384107469, 'gamma': 9.991534486203772}. Best is trial 116 with value: 1.9878633343995167.
[I 2023-12-19 00:50:29,708] Trial 183 pruned. Trial was pruned at iteration 0.
[I 2023-12-19 00:50:29,834] Trial 184 pruned. Trial was pruned at iteration 1.
[I 2023-12-19 00:50:29,934] Trial 185 pruned. Trial was pruned at iteration 0.
[I 2023-12-19 00:50:30,028] Trial 186 pruned. Trial was pruned at iteration 0.
[I 2023-12-19 00:50:30,123] Trial 187 pruned. Trial was pruned at iteration 0.
[I 2023-12-19 00:50:30,225] Trial 188 pruned. Trial was pruned at iteration 0.
[I 2023-12-19 00:50:30,323] Trial 189 pruned. Trial was pruned at iteration 1.
[I 2023-12-19 00:50:32,828] Trial 190 finished with value: inf and parameters: {'learning_rate': 0.9410003438742182, 'aft_loss_distribution': 'normal', 'aft_loss_distribution_scale': 1.4316250353661113, 'max_depth': 5, 'booster': 'dart', 'scale_pos_weight': 2.749588840391272, 'alpha': 6.147729957869128, 'lambda': 9.413557450009781, 'eta': 0.3831528404129181, 'sampling_method': 'uniform', 'subsample': 0.7602595048239057, 'gamma': 9.631140754451016}. Best is trial 116 with value: 1.9878633343995167.
[I 2023-12-19 00:50:35,678] Trial 191 finished with value: 1.9930750670767494 and parameters: {'learning_rate': 0.9577939282010647, 'aft_loss_distribution': 'normal', 'aft_loss_distribution_scale': 1.3109144145086937, 'max_depth': 8, 'booster': 'dart', 'scale_pos_weight': 2.8608744996752766, 'alpha': 4.0802425679244205, 'lambda': 9.180858802978907, 'eta': 0.3199708619560823, 'sampling_method': 'uniform', 'subsample': 0.7040792799255369, 'gamma': 9.98879017803126}. Best is trial 116 with value: 1.9878633343995167.
[I 2023-12-19 00:50:38,769] Trial 192 pruned. Trial was pruned at iteration 84.
[I 2023-12-19 00:50:38,843] Trial 193 pruned. Trial was pruned at iteration 0.
[I 2023-12-19 00:50:38,911] Trial 194 pruned. Trial was pruned at iteration 0.
[I 2023-12-19 00:50:38,985] Trial 195 pruned. Trial was pruned at iteration 1.
[I 2023-12-19 00:50:40,377] Trial 196 finished with value: inf and parameters: {'learning_rate': 0.9800373909679946, 'aft_loss_distribution': 'normal', 'aft_loss_distribution_scale': 1.2024169316567919, 'max_depth': 7, 'booster': 'dart', 'scale_pos_weight': 2.7082507691815088, 'alpha': 3.9174575551226853, 'lambda': 9.29018331378017, 'eta': 0.6623216481227243, 'sampling_method': 'uniform', 'subsample': 0.7183446890478382, 'gamma': 4.9842132308032845}. Best is trial 116 with value: 1.9878633343995167.
[I 2023-12-19 00:50:40,459] Trial 197 pruned. Trial was pruned at iteration 0.
[I 2023-12-19 00:50:40,549] Trial 198 pruned. Trial was pruned at iteration 1.
[I 2023-12-19 00:50:44,901] Trial 199 finished with value: 1.990564521252109 and parameters: {'learning_rate': 0.9998375835562346, 'aft_loss_distribution': 'normal', 'aft_loss_distribution_scale': 1.357124563822841, 'max_depth': 9, 'booster': 'dart', 'scale_pos_weight': 2.651683972794716, 'alpha': 4.949560854649042, 'lambda': 9.445093528967046, 'eta': 0.8736948461658776, 'sampling_method': 'uniform', 'subsample': 0.704246008425764, 'gamma': 9.626299356523118}. Best is trial 116 with value: 1.9878633343995167.
[I 2023-12-19 00:50:45,028] Trial 200 pruned. Trial was pruned at iteration 0.
[I 2023-12-19 00:50:48,603] Trial 201 finished with value: 1.991421878009638 and parameters: {'learning_rate': 0.9809104416656383, 'aft_loss_distribution': 'normal', 'aft_loss_distribution_scale': 1.3533986702312493, 'max_depth': 9, 'booster': 'dart', 'scale_pos_weight': 2.6970101104787294, 'alpha': 4.943227177207853, 'lambda': 9.427861295820433, 'eta': 0.8374370983017616, 'sampling_method': 'uniform', 'subsample': 0.7011940984486646, 'gamma': 9.745158436721148}. Best is trial 116 with value: 1.9878633343995167.
[I 2023-12-19 00:50:52,094] Trial 202 finished with value: 1.9901003453368367 and parameters: {'learning_rate': 0.9450808759624163, 'aft_loss_distribution': 'normal', 'aft_loss_distribution_scale': 1.4321328467761707, 'max_depth': 9, 'booster': 'dart', 'scale_pos_weight': 2.853084518860943, 'alpha': 5.207398329914494, 'lambda': 9.595489419272257, 'eta': 0.8918671111909459, 'sampling_method': 'uniform', 'subsample': 0.7105795893747529, 'gamma': 9.483274657111593}. Best is trial 116 with value: 1.9878633343995167.
[I 2023-12-19 00:50:52,189] Trial 203 pruned. Trial was pruned at iteration 0.
[I 2023-12-19 00:50:52,262] Trial 204 pruned. Trial was pruned at iteration 0.
[I 2023-12-19 00:50:52,343] Trial 205 pruned. Trial was pruned at iteration 2.
[I 2023-12-19 00:51:07,492] Trial 206 finished with value: 1.9889440910484728 and parameters: {'learning_rate': 0.9995647455520601, 'aft_loss_distribution': 'normal', 'aft_loss_distribution_scale': 1.460653820433797, 'max_depth': 9, 'booster': 'dart', 'scale_pos_weight': 1.8800690240575033, 'alpha': 5.036609846756478, 'lambda': 6.022631136890154, 'eta': 0.871839722778422, 'sampling_method': 'uniform', 'subsample': 0.6821498024927835, 'gamma': 9.431597330644129}. Best is trial 116 with value: 1.9878633343995167.
[I 2023-12-19 00:51:07,575] Trial 207 pruned. Trial was pruned at iteration 0.
[I 2023-12-19 00:51:07,658] Trial 208 pruned. Trial was pruned at iteration 0.
[I 2023-12-19 00:51:07,738] Trial 209 pruned. Trial was pruned at iteration 2.
[I 2023-12-19 00:51:07,814] Trial 210 pruned. Trial was pruned at iteration 0.
[I 2023-12-19 00:51:21,748] Trial 211 finished with value: 1.990850894202412 and parameters: {'learning_rate': 0.9382283921489929, 'aft_loss_distribution': 'normal', 'aft_loss_distribution_scale': 1.535244730596447, 'max_depth': 9, 'booster': 'dart', 'scale_pos_weight': 2.684237575901832, 'alpha': 5.498244827196413, 'lambda': 7.277127268720889, 'eta': 0.8628166125128502, 'sampling_method': 'uniform', 'subsample': 0.6874171981732372, 'gamma': 9.757956673235086}. Best is trial 116 with value: 1.9878633343995167.
[I 2023-12-19 00:51:21,825] Trial 212 pruned. Trial was pruned at iteration 0.
[I 2023-12-19 00:51:21,908] Trial 213 pruned. Trial was pruned at iteration 2.
[I 2023-12-19 00:51:21,987] Trial 214 pruned. Trial was pruned at iteration 0.
[I 2023-12-19 00:51:22,072] Trial 215 pruned. Trial was pruned at iteration 0.
[I 2023-12-19 00:51:22,155] Trial 216 pruned. Trial was pruned at iteration 1.
[I 2023-12-19 00:51:22,226] Trial 217 pruned. Trial was pruned at iteration 0.
[I 2023-12-19 00:51:24,367] Trial 218 pruned. Trial was pruned at iteration 68.
[I 2023-12-19 00:51:26,463] Trial 219 finished with value: inf and parameters: {'learning_rate': 0.9674171812858686, 'aft_loss_distribution': 'normal', 'aft_loss_distribution_scale': 1.2783516789737406, 'max_depth': 9, 'booster': 'dart', 'scale_pos_weight': 2.070029226408443, 'alpha': 4.622579015912217, 'lambda': 9.420813176090396, 'eta': 0.857859440084342, 'sampling_method': 'uniform', 'subsample': 0.7528654627053011, 'gamma': 9.976991921552596}. Best is trial 116 with value: 1.9878633343995167.
[I 2023-12-19 00:51:26,591] Trial 220 pruned. Trial was pruned at iteration 0.
[I 2023-12-19 00:52:16,386] Trial 221 finished with value: 1.990193172454538 and parameters: {'learning_rate': 0.948084487220634, 'aft_loss_distribution': 'normal', 'aft_loss_distribution_scale': 1.5143858947382183, 'max_depth': 9, 'booster': 'dart', 'scale_pos_weight': 2.8439003396083296, 'alpha': 5.799680076949349, 'lambda': 9.232430484285082, 'eta': 0.970520139428588, 'sampling_method': 'uniform', 'subsample': 0.6670922253570126, 'gamma': 9.785413748564649}. Best is trial 116 with value: 1.9878633343995167.
[I 2023-12-19 00:52:16,471] Trial 222 pruned. Trial was pruned at iteration 0.
[I 2023-12-19 00:52:16,542] Trial 223 pruned. Trial was pruned at iteration 0.
[I 2023-12-19 00:52:16,620] Trial 224 pruned. Trial was pruned at iteration 1.
[I 2023-12-19 00:52:19,037] Trial 225 pruned. Trial was pruned at iteration 74.
[I 2023-12-19 00:52:19,116] Trial 226 pruned. Trial was pruned at iteration 0.
[I 2023-12-19 00:52:28,928] Trial 227 finished with value: 1.990038870675951 and parameters: {'learning_rate': 0.9610197485622031, 'aft_loss_distribution': 'normal', 'aft_loss_distribution_scale': 1.4157266516056233, 'max_depth': 9, 'booster': 'dart', 'scale_pos_weight': 2.841074314971824, 'alpha': 5.781896342745426, 'lambda': 7.289933392078948, 'eta': 0.891213394166492, 'sampling_method': 'uniform', 'subsample': 0.6526294273944037, 'gamma': 9.984546204491945}. Best is trial 116 with value: 1.9878633343995167.
[I 2023-12-19 00:52:29,006] Trial 228 pruned. Trial was pruned at iteration 0.
[I 2023-12-19 00:52:29,086] Trial 229 pruned. Trial was pruned at iteration 0.
[I 2023-12-19 00:52:30,505] Trial 230 pruned. Trial was pruned at iteration 54.
[I 2023-12-19 00:52:32,267] Trial 231 finished with value: inf and parameters: {'learning_rate': 0.9671724689356003, 'aft_loss_distribution': 'normal', 'aft_loss_distribution_scale': 1.3754236263374469, 'max_depth': 9, 'booster': 'dart', 'scale_pos_weight': 1.5637706959877482, 'alpha': 5.3854034382879785, 'lambda': 7.423185742410486, 'eta': 0.9512015304963695, 'sampling_method': 'uniform', 'subsample': 0.678075354314071, 'gamma': 9.8242230284944}. Best is trial 116 with value: 1.9878633343995167.
[I 2023-12-19 00:52:32,360] Trial 232 pruned. Trial was pruned at iteration 0.
[I 2023-12-19 00:52:32,433] Trial 233 pruned. Trial was pruned at iteration 0.
[I 2023-12-19 00:52:33,864] Trial 234 pruned. Trial was pruned at iteration 55.
[I 2023-12-19 00:52:37,590] Trial 235 finished with value: 1.9907435764401558 and parameters: {'learning_rate': 0.9678770293098901, 'aft_loss_distribution': 'normal', 'aft_loss_distribution_scale': 1.440473691106971, 'max_depth': 8, 'booster': 'dart', 'scale_pos_weight': 2.558261204983133, 'alpha': 4.384901660685467, 'lambda': 9.496033320049746, 'eta': 0.8990635547536562, 'sampling_method': 'uniform', 'subsample': 0.7329470484270698, 'gamma': 9.41456188091879}. Best is trial 116 with value: 1.9878633343995167.
[I 2023-12-19 00:52:37,734] Trial 236 pruned. Trial was pruned at iteration 0.
[I 2023-12-19 00:52:40,725] Trial 237 finished with value: inf and parameters: {'learning_rate': 0.9418492602259467, 'aft_loss_distribution': 'normal', 'aft_loss_distribution_scale': 1.4920432245889885, 'max_depth': 7, 'booster': 'dart', 'scale_pos_weight': 3.5076217028787986, 'alpha': 4.714297473544107, 'lambda': 9.816261147162274, 'eta': 0.9955332222723161, 'sampling_method': 'uniform', 'subsample': 0.7570824250749791, 'gamma': 8.942370973166941}. Best is trial 116 with value: 1.9878633343995167.
[I 2023-12-19 00:52:40,860] Trial 238 pruned. Trial was pruned at iteration 1.
[I 2023-12-19 00:52:40,957] Trial 239 pruned. Trial was pruned at iteration 1.
[I 2023-12-19 00:52:42,617] Trial 240 pruned. Trial was pruned at iteration 59.
[I 2023-12-19 00:52:45,976] Trial 241 finished with value: 1.9905065093180454 and parameters: {'learning_rate': 0.9638967205652959, 'aft_loss_distribution': 'normal', 'aft_loss_distribution_scale': 1.4016294951863364, 'max_depth': 8, 'booster': 'dart', 'scale_pos_weight': 2.532011233050904, 'alpha': 4.2215798002014235, 'lambda': 9.247364128580767, 'eta': 0.8562693335786574, 'sampling_method': 'uniform', 'subsample': 0.7111086043031696, 'gamma': 9.674207235303175}. Best is trial 116 with value: 1.9878633343995167.
[I 2023-12-19 00:52:50,603] Trial 242 finished with value: 1.9908508415095942 and parameters: {'learning_rate': 0.952267208898456, 'aft_loss_distribution': 'normal', 'aft_loss_distribution_scale': 1.4175536701753588, 'max_depth': 8, 'booster': 'dart', 'scale_pos_weight': 2.506711178915925, 'alpha': 9.579704927909303, 'lambda': 9.630988883228815, 'eta': 0.8510164736885962, 'sampling_method': 'uniform', 'subsample': 0.7141578290391783, 'gamma': 9.62060936291324}. Best is trial 116 with value: 1.9878633343995167.
[I 2023-12-19 00:52:50,695] Trial 243 pruned. Trial was pruned at iteration 2.
[I 2023-12-19 00:52:50,769] Trial 244 pruned. Trial was pruned at iteration 0.
[I 2023-12-19 00:52:50,845] Trial 245 pruned. Trial was pruned at iteration 0.
[I 2023-12-19 00:52:55,289] Trial 246 finished with value: 1.989959426186354 and parameters: {'learning_rate': 0.9584171668379099, 'aft_loss_distribution': 'normal', 'aft_loss_distribution_scale': 1.4531871728266785, 'max_depth': 8, 'booster': 'dart', 'scale_pos_weight': 2.695340610614182, 'alpha': 5.023013626286704, 'lambda': 9.646305294577237, 'eta': 0.8475641899321356, 'sampling_method': 'uniform', 'subsample': 0.6924721612604687, 'gamma': 9.470124468556786}. Best is trial 116 with value: 1.9878633343995167.
[I 2023-12-19 00:52:55,389] Trial 247 pruned. Trial was pruned at iteration 0.
[I 2023-12-19 00:52:55,471] Trial 248 pruned. Trial was pruned at iteration 1.
[I 2023-12-19 00:53:00,081] Trial 249 finished with value: 1.9883446085574874 and parameters: {'learning_rate': 0.9552733398797121, 'aft_loss_distribution': 'normal', 'aft_loss_distribution_scale': 1.4272349619683296, 'max_depth': 8, 'booster': 'dart', 'scale_pos_weight': 2.544471160650755, 'alpha': 4.861480626062183, 'lambda': 9.605657307119678, 'eta': 0.8255278187940034, 'sampling_method': 'uniform', 'subsample': 0.706387048676658, 'gamma': 9.597670915886967}. Best is trial 116 with value: 1.9878633343995167.
[I 2023-12-19 00:53:00,165] Trial 250 pruned. Trial was pruned at iteration 0.
[I 2023-12-19 00:53:00,247] Trial 251 pruned. Trial was pruned at iteration 1.
[I 2023-12-19 00:53:05,017] Trial 252 finished with value: 1.9917263922422368 and parameters: {'learning_rate': 0.9679041003116873, 'aft_loss_distribution': 'normal', 'aft_loss_distribution_scale': 1.3920936163145117, 'max_depth': 8, 'booster': 'dart', 'scale_pos_weight': 2.5948610631362983, 'alpha': 0.3204445123585602, 'lambda': 9.63796429653253, 'eta': 0.7941628648706027, 'sampling_method': 'uniform', 'subsample': 0.7515346222957984, 'gamma': 9.509324006187297}. Best is trial 116 with value: 1.9878633343995167.
[I 2023-12-19 00:53:05,097] Trial 253 pruned. Trial was pruned at iteration 0.
[I 2023-12-19 00:53:05,174] Trial 254 pruned. Trial was pruned at iteration 0.
[I 2023-12-19 00:53:05,262] Trial 255 pruned. Trial was pruned at iteration 1.
[I 2023-12-19 00:53:05,345] Trial 256 pruned. Trial was pruned at iteration 0.
[I 2023-12-19 00:53:05,469] Trial 257 pruned. Trial was pruned at iteration 0.
[I 2023-12-19 00:53:05,586] Trial 258 pruned. Trial was pruned at iteration 0.
[I 2023-12-19 00:53:05,716] Trial 259 pruned. Trial was pruned at iteration 2.
[I 2023-12-19 00:53:05,833] Trial 260 pruned. Trial was pruned at iteration 0.
[I 2023-12-19 00:53:05,956] Trial 261 pruned. Trial was pruned at iteration 0.
[I 2023-12-19 00:53:06,082] Trial 262 pruned. Trial was pruned at iteration 0.
[I 2023-12-19 00:53:06,210] Trial 263 pruned. Trial was pruned at iteration 1.
[I 2023-12-19 00:53:06,333] Trial 264 pruned. Trial was pruned at iteration 0.
