[I 2023-12-21 03:10:33,974] Trial 1 finished with value: inf and parameters: {'learning_rate': 0.6556110567198219, 'aft_loss_distribution                                                                     ': 'extreme', 'aft_loss_distribution_scale': 3.09286029089577, 'max_depth': 7, 'booster': 'gbtree', 'scale_pos_weight': 3.351195761788297                                                                     , 'alpha': 0.08962176693142825, 'lambda': 8.119910800175164, 'eta': 0.053290787524757466, 'sampling_method': 'uniform', 'subsample': 0.49                                                                     62168531982852, 'gamma': 1.734941160465373}. Best is trial 0 with value: 6.142832159099428.
[I 2023-12-21 03:10:34,156] Trial 2 finished with value: 5.364385225235342 and parameters: {'learning_rate': 0.39365666256678855, 'aft_lo                                                                     ss_distribution': 'logistic', 'aft_loss_distribution_scale': 3.3726089473148635, 'max_depth': 8, 'booster': 'gbtree', 'scale_pos_weight':                                                                      7.240140243570924, 'alpha': 3.1682929628513192, 'lambda': 1.1436253451565825, 'eta': 0.3812108518258286, 'sampling_method': 'gradient_ba                                                                     sed', 'subsample': 0.20227616487082709, 'gamma': 6.753942600438175}. Best is trial 2 with value: 5.364385225235342.
[I 2023-12-21 03:10:34,224] Trial 3 finished with value: inf and parameters: {'learning_rate': 0.9732119103756119, 'aft_loss_distribution                                                                     ': 'logistic', 'aft_loss_distribution_scale': 0.13957975786972737, 'max_depth': 10, 'booster': 'gbtree', 'scale_pos_weight': 3.5695293970                                                                     991777, 'alpha': 2.6251075604335186, 'lambda': 9.877166539805847, 'eta': 0.2680004167204578, 'sampling_method': 'gradient_based', 'subsam                                                                     ple': 0.2591152392600324, 'gamma': 4.63993579535096}. Best is trial 2 with value: 5.364385225235342.
[I 2023-12-21 03:10:34,402] Trial 4 finished with value: 4.596643442040061 and parameters: {'learning_rate': 0.44583405589132963, 'aft_lo                                                                     ss_distribution': 'logistic', 'aft_loss_distribution_scale': 1.3689591440214448, 'max_depth': 8, 'booster': 'gbtree', 'scale_pos_weight':                                                                      2.7619933264074343, 'alpha': 1.0940302997494857, 'lambda': 6.0338044401752144, 'eta': 0.8053503441796692, 'sampling_method': 'uniform',                                                                      'subsample': 0.9645388678933802, 'gamma': 4.357036584403823}. Best is trial 4 with value: 4.596643442040061.
[I 2023-12-21 03:10:34,407] Trial 5 pruned. Trial was pruned at iteration 0.
[I 2023-12-21 03:10:34,411] Trial 6 pruned. Trial was pruned at iteration 0.
[I 2023-12-21 03:10:34,415] Trial 7 pruned. Trial was pruned at iteration 0.
[I 2023-12-21 03:10:34,420] Trial 8 pruned. Trial was pruned at iteration 0.
[I 2023-12-21 03:10:34,424] Trial 9 pruned. Trial was pruned at iteration 0.
[I 2023-12-21 03:10:34,464] Trial 10 pruned. Trial was pruned at iteration 0.
[I 2023-12-21 03:10:34,682] Trial 11 finished with value: inf and parameters: {'learning_rate': 0.3435070483681834, 'aft_loss_distributio                                                                     n': 'logistic', 'aft_loss_distribution_scale': 1.9215034403719047, 'max_depth': 8, 'booster': 'gbtree', 'scale_pos_weight': 8.57255843413                                                                     5818, 'alpha': 2.3875149619881535, 'lambda': 3.2128560336530074, 'eta': 0.470097280533059, 'sampling_method': 'gradient_based', 'subsampl                                                                     e': 0.040402772897169564, 'gamma': 6.308072907464287}. Best is trial 4 with value: 4.596643442040061.
[I 2023-12-21 03:10:34,710] Trial 12 pruned. Trial was pruned at iteration 0.
[I 2023-12-21 03:10:34,903] Trial 13 pruned. Trial was pruned at iteration 158.
[I 2023-12-21 03:10:34,932] Trial 14 pruned. Trial was pruned at iteration 0.
[I 2023-12-21 03:10:34,964] Trial 15 pruned. Trial was pruned at iteration 0.
[I 2023-12-21 03:10:34,992] Trial 16 pruned. Trial was pruned at iteration 0.
[I 2023-12-21 03:10:35,151] Trial 17 finished with value: 4.652509859189493 and parameters: {'learning_rate': 0.5824743184563116, 'aft_lo                                                                     ss_distribution': 'logistic', 'aft_loss_distribution_scale': 1.3891268845796527, 'max_depth': 9, 'booster': 'gbtree', 'scale_pos_weight':                                                                      6.082723208578567, 'alpha': 5.113351324787959, 'lambda': 1.843633764708649, 'eta': 0.3852339591054831, 'sampling_method': 'gradient_base                                                                     d', 'subsample': 0.37010578449613113, 'gamma': 7.75667194609513}. Best is trial 4 with value: 4.596643442040061.
[I 2023-12-21 03:10:36,096] Trial 18 finished with value: inf and parameters: {'learning_rate': 0.7970476678231501, 'aft_loss_distributio                                                                     n': 'normal', 'aft_loss_distribution_scale': 1.1422338633873605, 'max_depth': 9, 'booster': 'dart', 'scale_pos_weight': 5.490801131127625                                                                     , 'alpha': 5.311206369063936, 'lambda': 2.200895243196684, 'eta': 0.15207327976993623, 'sampling_method': 'uniform', 'subsample': 0.32903                                                                     14940660641, 'gamma': 9.944884246729751}. Best is trial 4 with value: 4.596643442040061.
[I 2023-12-21 03:10:36,125] Trial 19 pruned. Trial was pruned at iteration 0.
[I 2023-12-21 03:10:36,154] Trial 20 pruned. Trial was pruned at iteration 0.
[I 2023-12-21 03:10:36,184] Trial 21 pruned. Trial was pruned at iteration 0.
[I 2023-12-21 03:10:36,473] Trial 22 finished with value: inf and parameters: {'learning_rate': 0.4450594854170498, 'aft_loss_distributio                                                                     n': 'logistic', 'aft_loss_distribution_scale': 1.2577670947863133, 'max_depth': 9, 'booster': 'gbtree', 'scale_pos_weight': 7.58130210865                                                                     2608, 'alpha': 3.0305181963564523, 'lambda': 1.3666962164976313, 'eta': 0.15628372601783397, 'sampling_method': 'gradient_based', 'subsam                                                                     ple': 0.18852025942971104, 'gamma': 7.829607377398599}. Best is trial 4 with value: 4.596643442040061.
[I 2023-12-21 03:10:36,504] Trial 23 pruned. Trial was pruned at iteration 0.
[I 2023-12-21 03:10:36,534] Trial 24 pruned. Trial was pruned at iteration 0.
[I 2023-12-21 03:10:36,563] Trial 25 pruned. Trial was pruned at iteration 0.
[I 2023-12-21 03:10:36,598] Trial 26 pruned. Trial was pruned at iteration 0.
[I 2023-12-21 03:10:36,902] Trial 27 finished with value: inf and parameters: {'learning_rate': 0.5871021960821088, 'aft_loss_distributio                                                                     n': 'logistic', 'aft_loss_distribution_scale': 1.8720266089844118, 'max_depth': 10, 'booster': 'gbtree', 'scale_pos_weight': 9.3064204248                                                                     67506, 'alpha': 3.7123181799180576, 'lambda': 6.12033365955144, 'eta': 0.18331711223355693, 'sampling_method': 'gradient_based', 'subsamp                                                                     le': 0.10372676040071631, 'gamma': 6.929477975607512}. Best is trial 4 with value: 4.596643442040061.
[I 2023-12-21 03:10:36,932] Trial 28 pruned. Trial was pruned at iteration 0.
[I 2023-12-21 03:10:36,962] Trial 29 pruned. Trial was pruned at iteration 0.
[I 2023-12-21 03:10:36,994] Trial 30 pruned. Trial was pruned at iteration 0.
[I 2023-12-21 03:10:37,026] Trial 31 pruned. Trial was pruned at iteration 0.
[I 2023-12-21 03:10:37,058] Trial 32 pruned. Trial was pruned at iteration 0.
[I 2023-12-21 03:10:37,089] Trial 33 pruned. Trial was pruned at iteration 0.
[I 2023-12-21 03:10:37,120] Trial 34 pruned. Trial was pruned at iteration 0.
[I 2023-12-21 03:10:37,151] Trial 35 pruned. Trial was pruned at iteration 0.
[I 2023-12-21 03:10:37,183] Trial 36 pruned. Trial was pruned at iteration 0.
[I 2023-12-21 03:10:37,215] Trial 37 pruned. Trial was pruned at iteration 0.
[I 2023-12-21 03:10:37,248] Trial 38 pruned. Trial was pruned at iteration 0.
[I 2023-12-21 03:10:37,279] Trial 39 pruned. Trial was pruned at iteration 0.
[I 2023-12-21 03:10:37,310] Trial 40 pruned. Trial was pruned at iteration 0.
[I 2023-12-21 03:10:37,342] Trial 41 pruned. Trial was pruned at iteration 0.
[I 2023-12-21 03:10:37,373] Trial 42 pruned. Trial was pruned at iteration 0.
[I 2023-12-21 03:10:37,411] Trial 43 pruned. Trial was pruned at iteration 0.
[I 2023-12-21 03:10:37,443] Trial 44 pruned. Trial was pruned at iteration 0.
[I 2023-12-21 03:10:37,475] Trial 45 pruned. Trial was pruned at iteration 0.
[I 2023-12-21 03:10:37,506] Trial 46 pruned. Trial was pruned at iteration 0.
[I 2023-12-21 03:10:37,539] Trial 47 pruned. Trial was pruned at iteration 0.
[I 2023-12-21 03:10:37,571] Trial 48 pruned. Trial was pruned at iteration 0.
[I 2023-12-21 03:10:37,605] Trial 49 pruned. Trial was pruned at iteration 0.
[I 2023-12-21 03:10:37,641] Trial 50 pruned. Trial was pruned at iteration 0.
[I 2023-12-21 03:10:37,676] Trial 51 pruned. Trial was pruned at iteration 0.
[I 2023-12-21 03:10:37,711] Trial 52 pruned. Trial was pruned at iteration 0.
[I 2023-12-21 03:10:37,956] Trial 53 finished with value: 4.6691187564563235 and parameters: {'learning_rate': 0.41164467447035075, 'aft_                                                                     loss_distribution': 'logistic', 'aft_loss_distribution_scale': 1.4603259912114275, 'max_depth': 9, 'booster': 'gbtree', 'scale_pos_weight                                                                     ': 4.546693189443185, 'alpha': 3.4241422878566294, 'lambda': 9.321562090616968, 'eta': 0.37739794915309816, 'sampling_method': 'gradient_                                                                     based', 'subsample': 0.34723921528463886, 'gamma': 5.402843063002541}. Best is trial 4 with value: 4.596643442040061.
[I 2023-12-21 03:10:38,080] Trial 54 pruned. Trial was pruned at iteration 57.
[I 2023-12-21 03:10:38,112] Trial 55 pruned. Trial was pruned at iteration 0.
[I 2023-12-21 03:10:38,146] Trial 56 pruned. Trial was pruned at iteration 0.
[I 2023-12-21 03:10:38,185] Trial 57 pruned. Trial was pruned at iteration 0.
[I 2023-12-21 03:10:38,218] Trial 58 pruned. Trial was pruned at iteration 0.
[I 2023-12-21 03:10:38,252] Trial 59 pruned. Trial was pruned at iteration 0.
[I 2023-12-21 03:10:38,285] Trial 60 pruned. Trial was pruned at iteration 0.
[I 2023-12-21 03:10:38,321] Trial 61 pruned. Trial was pruned at iteration 0.
[I 2023-12-21 03:10:38,356] Trial 62 pruned. Trial was pruned at iteration 0.
[I 2023-12-21 03:10:38,392] Trial 63 pruned. Trial was pruned at iteration 0.
[I 2023-12-21 03:10:38,431] Trial 64 pruned. Trial was pruned at iteration 0.
[I 2023-12-21 03:10:38,464] Trial 65 pruned. Trial was pruned at iteration 0.
[I 2023-12-21 03:10:38,501] Trial 66 pruned. Trial was pruned at iteration 0.
[I 2023-12-21 03:10:38,536] Trial 67 pruned. Trial was pruned at iteration 0.
[I 2023-12-21 03:10:38,569] Trial 68 pruned. Trial was pruned at iteration 0.
[I 2023-12-21 03:10:38,605] Trial 69 pruned. Trial was pruned at iteration 0.
[I 2023-12-21 03:10:38,640] Trial 70 pruned. Trial was pruned at iteration 0.
[I 2023-12-21 03:10:38,673] Trial 71 pruned. Trial was pruned at iteration 0.
[I 2023-12-21 03:10:38,707] Trial 72 pruned. Trial was pruned at iteration 0.
[I 2023-12-21 03:10:38,741] Trial 73 pruned. Trial was pruned at iteration 0.
[I 2023-12-21 03:10:38,909] Trial 74 finished with value: 4.640336356394007 and parameters: {'learning_rate': 0.4515929718952664, 'aft_lo                                                                     ss_distribution': 'logistic', 'aft_loss_distribution_scale': 1.3941304914375263, 'max_depth': 9, 'booster': 'gbtree', 'scale_pos_weight':                                                                      7.646101138876093, 'alpha': 5.474563801573282, 'lambda': 2.79804484749778, 'eta': 0.28300155852752573, 'sampling_method': 'gradient_base                                                                     d', 'subsample': 0.5119825294771677, 'gamma': 6.692336993775443}. Best is trial 4 with value: 4.596643442040061.
[I 2023-12-21 03:10:38,943] Trial 75 pruned. Trial was pruned at iteration 0.
[I 2023-12-21 03:10:38,980] Trial 76 pruned. Trial was pruned at iteration 0.
[I 2023-12-21 03:10:39,015] Trial 77 pruned. Trial was pruned at iteration 0.
[I 2023-12-21 03:10:39,049] Trial 78 pruned. Trial was pruned at iteration 0.
[I 2023-12-21 03:10:39,084] Trial 79 pruned. Trial was pruned at iteration 0.
[I 2023-12-21 03:10:39,119] Trial 80 pruned. Trial was pruned at iteration 0.
[I 2023-12-21 03:10:39,153] Trial 81 pruned. Trial was pruned at iteration 0.
[I 2023-12-21 03:10:39,188] Trial 82 pruned. Trial was pruned at iteration 0.
[I 2023-12-21 03:10:39,226] Trial 83 pruned. Trial was pruned at iteration 0.
[I 2023-12-21 03:10:39,262] Trial 84 pruned. Trial was pruned at iteration 0.
[I 2023-12-21 03:10:39,296] Trial 85 pruned. Trial was pruned at iteration 0.
[I 2023-12-21 03:10:39,330] Trial 86 pruned. Trial was pruned at iteration 0.
[I 2023-12-21 03:10:39,368] Trial 87 pruned. Trial was pruned at iteration 0.
[I 2023-12-21 03:10:39,402] Trial 88 pruned. Trial was pruned at iteration 0.
[I 2023-12-21 03:10:39,436] Trial 89 pruned. Trial was pruned at iteration 0.
[I 2023-12-21 03:10:39,472] Trial 90 pruned. Trial was pruned at iteration 0.
[I 2023-12-21 03:10:39,506] Trial 91 pruned. Trial was pruned at iteration 0.
[I 2023-12-21 03:10:39,540] Trial 92 pruned. Trial was pruned at iteration 0.
[I 2023-12-21 03:10:43,082] Trial 93 finished with value: 4.339337192801806 and parameters: {'learning_rate': 0.7148531440214814, 'aft_lo                                                                     ss_distribution': 'normal', 'aft_loss_distribution_scale': 1.4760369448685207, 'max_depth': 9, 'booster': 'dart', 'scale_pos_weight': 6.1                                                                     36221908888219, 'alpha': 4.882258209091786, 'lambda': 8.887420676203202, 'eta': 0.1512269646360564, 'sampling_method': 'uniform', 'subsam                                                                     ple': 0.4645267490972506, 'gamma': 9.255130431809565}. Best is trial 93 with value: 4.339337192801806.
[I 2023-12-21 03:10:51,968] Trial 94 finished with value: 4.455480472347109 and parameters: {'learning_rate': 0.8339916382718782, 'aft_lo                                                                     ss_distribution': 'normal', 'aft_loss_distribution_scale': 1.812463377296624, 'max_depth': 9, 'booster': 'dart', 'scale_pos_weight': 6.28                                                                     1197295465638, 'alpha': 6.395984482117118, 'lambda': 8.479553669388556, 'eta': 0.04934558057301833, 'sampling_method': 'uniform', 'subsam                                                                     ple': 0.5059629591680963, 'gamma': 8.553809812045618}. Best is trial 93 with value: 4.339337192801806.
[I 2023-12-21 03:10:54,622] Trial 95 finished with value: 4.450691979406698 and parameters: {'learning_rate': 0.8917013311723082, 'aft_lo                                                                     ss_distribution': 'normal', 'aft_loss_distribution_scale': 1.7932808853504147, 'max_depth': 9, 'booster': 'dart', 'scale_pos_weight': 6.2                                                                     76626216793153, 'alpha': 6.496342262611825, 'lambda': 8.433247040499676, 'eta': 0.7981625886961812, 'sampling_method': 'uniform', 'subsam                                                                     ple': 0.4778154445878106, 'gamma': 9.124260245330339}. Best is trial 93 with value: 4.339337192801806.
[I 2023-12-21 03:10:58,456] Trial 96 finished with value: 4.453370589678318 and parameters: {'learning_rate': 0.8399847375110032, 'aft_lo                                                                     ss_distribution': 'normal', 'aft_loss_distribution_scale': 1.8039478944988043, 'max_depth': 9, 'booster': 'dart', 'scale_pos_weight': 6.1                                                                     97446576499326, 'alpha': 8.044853095167623, 'lambda': 8.566499060777172, 'eta': 0.7763910443228552, 'sampling_method': 'uniform', 'subsam                                                                     ple': 0.4779333347777587, 'gamma': 9.274311720177316}. Best is trial 93 with value: 4.339337192801806.
[I 2023-12-21 03:11:06,805] Trial 97 pruned. Trial was pruned at iteration 163.
[I 2023-12-21 03:11:07,803] Trial 98 finished with value: inf and parameters: {'learning_rate': 0.9920699323030187, 'aft_loss_distributio                                                                     n': 'normal', 'aft_loss_distribution_scale': 1.5157963669350782, 'max_depth': 9, 'booster': 'dart', 'scale_pos_weight': 6.088646820115803                                                                     , 'alpha': 6.684530364695825, 'lambda': 8.860671420734535, 'eta': 0.7963047249476997, 'sampling_method': 'uniform', 'subsample': 0.470474                                                                     3599493313, 'gamma': 8.493141083448856}. Best is trial 93 with value: 4.339337192801806.
[I 2023-12-21 03:11:08,782] Trial 99 finished with value: inf and parameters: {'learning_rate': 0.8245121787774609, 'aft_loss_distributio                                                                     n': 'normal', 'aft_loss_distribution_scale': 1.3296960264980746, 'max_depth': 9, 'booster': 'dart', 'scale_pos_weight': 0.154745714841547                                                                     42, 'alpha': 7.2841006820622685, 'lambda': 8.307142620455194, 'eta': 0.8580523942549525, 'sampling_method': 'uniform', 'subsample': 0.540                                                                     5732227954373, 'gamma': 8.916464499916177}. Best is trial 93 with value: 4.339337192801806.
[I 2023-12-21 03:11:16,835] Trial 100 finished with value: 4.449252235307108 and parameters: {'learning_rate': 0.9371127976899495, 'aft_l                                                                     oss_distribution': 'normal', 'aft_loss_distribution_scale': 1.785997373017624, 'max_depth': 9, 'booster': 'dart', 'scale_pos_weight': 6.7                                                                     69464043315628, 'alpha': 8.928475930342962, 'lambda': 8.703456451027233, 'eta': 0.7348400789095456, 'sampling_method': 'uniform', 'subsam                                                                     ple': 0.5105605965023559, 'gamma': 9.329725599722144}. Best is trial 93 with value: 4.339337192801806.
[I 2023-12-21 03:11:22,856] Trial 101 finished with value: 4.4447726206893075 and parameters: {'learning_rate': 0.8956226964660094, 'aft_                                                                     loss_distribution': 'normal', 'aft_loss_distribution_scale': 1.775581907163056, 'max_depth': 9, 'booster': 'dart', 'scale_pos_weight': 6.                                                                     693083077913011, 'alpha': 8.818393744491683, 'lambda': 8.6848965692565, 'eta': 0.7233291706960358, 'sampling_method': 'uniform', 'subsamp                                                                     le': 0.5292371966131681, 'gamma': 9.675187748639235}. Best is trial 93 with value: 4.339337192801806.
[I 2023-12-21 03:11:23,731] Trial 102 pruned. Trial was pruned at iteration 50.
[I 2023-12-21 03:11:31,855] Trial 103 finished with value: 4.4360576482151055 and parameters: {'learning_rate': 0.9162117368347311, 'aft_                                                                     loss_distribution': 'normal', 'aft_loss_distribution_scale': 1.7493822964031256, 'max_depth': 9, 'booster': 'dart', 'scale_pos_weight': 6                                                                     .445993446496108, 'alpha': 8.695038774584585, 'lambda': 9.051400119309404, 'eta': 0.7974374593800019, 'sampling_method': 'uniform', 'subs                                                                     ample': 0.5193427690118214, 'gamma': 9.283310495881796}. Best is trial 93 with value: 4.339337192801806.
[I 2023-12-21 03:11:40,470] Trial 104 finished with value: 4.449769061454599 and parameters: {'learning_rate': 0.9366488685603088, 'aft_l                                                                     oss_distribution': 'normal', 'aft_loss_distribution_scale': 1.7890812859749743, 'max_depth': 9, 'booster': 'dart', 'scale_pos_weight': 5.                                                                     888881978485347, 'alpha': 8.548760237897913, 'lambda': 9.019455531335524, 'eta': 0.7521622036491915, 'sampling_method': 'uniform', 'subsa                                                                     mple': 0.5911452774602133, 'gamma': 9.231880991652636}. Best is trial 93 with value: 4.339337192801806.
[I 2023-12-21 03:11:41,357] Trial 105 pruned. Trial was pruned at iteration 50.
[I 2023-12-21 03:11:41,395] Trial 106 pruned. Trial was pruned at iteration 1.
