[I 2023-12-21 04:31:57,348] Trial 470 finished with value: 2.0522662597436008 and parameters: {'learning_rate': 0.2837017717240934, 'aft_                                                                     loss_distribution': 'logistic', 'aft_loss_distribution_scale': 1.1610050268778573, 'max_depth': 8, 'booster': 'dart', 'scale_pos_weight':                                                                      1.7641151841570428, 'alpha': 7.7072087504968625, 'lambda': 2.2743851218308193, 'eta': 0.20615939406094386, 'sampling_method': 'uniform',                                                                      'subsample': 0.9188424383652711, 'gamma': 7.439739752156439}. Best is trial 344 with value: 2.029959700274326.
[I 2023-12-21 04:31:57,411] Trial 471 pruned. Trial was pruned at iteration 0.
[I 2023-12-21 04:32:13,713] Trial 472 finished with value: 2.0474983530655178 and parameters: {'learning_rate': 0.2859499352373253, 'aft_                                                                     loss_distribution': 'logistic', 'aft_loss_distribution_scale': 1.0634610323799916, 'max_depth': 8, 'booster': 'dart', 'scale_pos_weight':                                                                      1.803243557903386, 'alpha': 5.249835166021061, 'lambda': 1.615700948198415, 'eta': 0.20668665531787353, 'sampling_method': 'uniform', 's                                                                     ubsample': 0.9363718945230378, 'gamma': 7.098330238796133}. Best is trial 344 with value: 2.029959700274326.
[I 2023-12-21 04:32:13,768] Trial 473 pruned. Trial was pruned at iteration 0.
[I 2023-12-21 04:32:13,826] Trial 474 pruned. Trial was pruned at iteration 0.
[I 2023-12-21 04:32:13,887] Trial 475 pruned. Trial was pruned at iteration 0.
[I 2023-12-21 04:32:13,939] Trial 476 pruned. Trial was pruned at iteration 0.
[I 2023-12-21 04:32:21,939] Trial 477 finished with value: 2.035472616047428 and parameters: {'learning_rate': 0.2583615113580052, 'aft_l                                                                     oss_distribution': 'logistic', 'aft_loss_distribution_scale': 1.0546851523895155, 'max_depth': 8, 'booster': 'dart', 'scale_pos_weight':                                                                      1.8701305266415145, 'alpha': 4.579672681040482, 'lambda': 8.459076020651626, 'eta': 0.2003731094959454, 'sampling_method': 'uniform', 'su                                                                     bsample': 0.9595738144234052, 'gamma': 6.6431688151560095}. Best is trial 344 with value: 2.029959700274326.
[I 2023-12-21 04:32:21,995] Trial 478 pruned. Trial was pruned at iteration 0.
[I 2023-12-21 04:32:22,058] Trial 479 pruned. Trial was pruned at iteration 0.
[I 2023-12-21 04:32:22,114] Trial 480 pruned. Trial was pruned at iteration 0.
[I 2023-12-21 04:32:30,274] Trial 481 finished with value: 2.052046794959298 and parameters: {'learning_rate': 0.27762562429510823, 'aft_                                                                     loss_distribution': 'logistic', 'aft_loss_distribution_scale': 1.0598109690138344, 'max_depth': 8, 'booster': 'dart', 'scale_pos_weight':                                                                      2.683726349462357, 'alpha': 5.585622946257713, 'lambda': 1.7475996130155078, 'eta': 0.12127024300234367, 'sampling_method': 'uniform', '                                                                     subsample': 0.9602362622973311, 'gamma': 6.6681515875537265}. Best is trial 344 with value: 2.029959700274326.
[I 2023-12-21 04:32:30,332] Trial 482 pruned. Trial was pruned at iteration 0.
[I 2023-12-21 04:32:30,387] Trial 483 pruned. Trial was pruned at iteration 0.
[I 2023-12-21 04:32:30,451] Trial 484 pruned. Trial was pruned at iteration 0.
[I 2023-12-21 04:32:30,506] Trial 485 pruned. Trial was pruned at iteration 0.
[I 2023-12-21 04:32:30,565] Trial 486 pruned. Trial was pruned at iteration 0.
[I 2023-12-21 04:32:30,624] Trial 487 pruned. Trial was pruned at iteration 0.
[I 2023-12-21 04:32:30,677] Trial 488 pruned. Trial was pruned at iteration 0.
[I 2023-12-21 04:32:30,737] Trial 489 pruned. Trial was pruned at iteration 0.
[I 2023-12-21 04:32:30,791] Trial 490 pruned. Trial was pruned at iteration 0.
[I 2023-12-21 04:32:36,417] Trial 491 finished with value: 2.0487564365434783 and parameters: {'learning_rate': 0.28438119764478986, 'aft                                                                     _loss_distribution': 'logistic', 'aft_loss_distribution_scale': 1.122589284464993, 'max_depth': 8, 'booster': 'dart', 'scale_pos_weight':                                                                      2.659076306039811, 'alpha': 5.106290859937046, 'lambda': 1.2920914123241396, 'eta': 0.12349444081050026, 'sampling_method': 'uniform', '                                                                     subsample': 0.9235713742098454, 'gamma': 7.108310614974724}. Best is trial 344 with value: 2.029959700274326.
[I 2023-12-21 04:32:36,474] Trial 492 pruned. Trial was pruned at iteration 0.
[I 2023-12-21 04:32:36,533] Trial 493 pruned. Trial was pruned at iteration 0.
[I 2023-12-21 04:32:36,586] Trial 494 pruned. Trial was pruned at iteration 0.
[I 2023-12-21 04:32:36,651] Trial 495 pruned. Trial was pruned at iteration 0.
[I 2023-12-21 04:32:36,704] Trial 496 pruned. Trial was pruned at iteration 0.
[I 2023-12-21 04:32:36,757] Trial 497 pruned. Trial was pruned at iteration 0.
[I 2023-12-21 04:32:36,813] Trial 498 pruned. Trial was pruned at iteration 0.
[I 2023-12-21 04:32:36,872] Trial 499 pruned. Trial was pruned at iteration 0.
[W 2023-12-21 04:32:37,221] Trial 0 is omitted in visualization because its objective value is inf or nan.
[W 2023-12-21 04:32:37,221] Trial 1 is omitted in visualization because its objective value is inf or nan.
[W 2023-12-21 04:32:37,221] Trial 4 is omitted in visualization because its objective value is inf or nan.
[W 2023-12-21 04:32:37,221] Trial 5 is omitted in visualization because its objective value is inf or nan.
[W 2023-12-21 04:32:37,221] Trial 9 is omitted in visualization because its objective value is inf or nan.
[W 2023-12-21 04:32:37,221] Trial 29 is omitted in visualization because its objective value is inf or nan.
[W 2023-12-21 04:32:37,221] Trial 45 is omitted in visualization because its objective value is inf or nan.
[W 2023-12-21 04:32:37,222] Trial 47 is omitted in visualization because its objective value is inf or nan.
[W 2023-12-21 04:32:37,222] Trial 51 is omitted in visualization because its objective value is inf or nan.
[W 2023-12-21 04:32:37,222] Trial 55 is omitted in visualization because its objective value is inf or nan.
[W 2023-12-21 04:32:37,222] Trial 66 is omitted in visualization because its objective value is inf or nan.
[W 2023-12-21 04:32:37,222] Trial 92 is omitted in visualization because its objective value is inf or nan.
[W 2023-12-21 04:32:37,222] Trial 100 is omitted in visualization because its objective value is inf or nan.
[W 2023-12-21 04:32:37,222] Trial 104 is omitted in visualization because its objective value is inf or nan.
[W 2023-12-21 04:32:37,222] Trial 107 is omitted in visualization because its objective value is inf or nan.
[W 2023-12-21 04:32:37,222] Trial 115 is omitted in visualization because its objective value is inf or nan.
[W 2023-12-21 04:32:37,222] Trial 206 is omitted in visualization because its objective value is inf or nan.
exo-open: Cannot open display: .
/cvmfs/soft.computecanada.ca/gentoo/2020/usr/bin/xdg-open: line 871: x-www-browser: command not found
/cvmfs/soft.computecanada.ca/gentoo/2020/usr/bin/xdg-open: line 871: firefox: command not found
/cvmfs/soft.computecanada.ca/gentoo/2020/usr/bin/xdg-open: line 871: iceweasel: command not found
/cvmfs/soft.computecanada.ca/gentoo/2020/usr/bin/xdg-open: line 871: seamonkey: command not found
/cvmfs/soft.computecanada.ca/gentoo/2020/usr/bin/xdg-open: line 871: mozilla: command not found
/cvmfs/soft.computecanada.ca/gentoo/2020/usr/bin/xdg-open: line 871: epiphany: command not found
/cvmfs/soft.computecanada.ca/gentoo/2020/usr/bin/xdg-open: line 871: konqueror: command not found
/cvmfs/soft.computecanada.ca/gentoo/2020/usr/bin/xdg-open: line 871: chromium: command not found
/cvmfs/soft.computecanada.ca/gentoo/2020/usr/bin/xdg-open: line 871: chromium-browser: command not found
/cvmfs/soft.computecanada.ca/gentoo/2020/usr/bin/xdg-open: line 871: google-chrome: command not found
/cvmfs/soft.computecanada.ca/gentoo/2020/usr/bin/xdg-open: line 871: www-browser: command not found
/cvmfs/soft.computecanada.ca/gentoo/2020/usr/bin/xdg-open: line 871: links2: command not found
/home/lisat/.local/lib/python3.10/site-packages/xgboost/data.py:440: FutureWarning:

is_sparse is deprecated and will be removed in a future version. Check `isinstance(dtype, pd.SparseDtype)` instead.

[I 2023-12-21 04:32:40,299] A new study created in memory with name: no-name-7d937c97-128b-4c96-aef6-bece8fe43d8e
[I 2023-12-21 04:32:44,952] Trial 0 finished with value: 3.596362164249566 and parameters: {'learning_rate': 0.5603396580039565, 'aft_los                                                                     s_distribution': 'extreme', 'aft_loss_distribution_scale': 0.4363683739351888, 'max_depth': 8, 'booster': 'dart', 'scale_pos_weight': 3.6                                                                     238674861079243, 'alpha': 2.6888635502637928, 'lambda': 1.0165003123628624, 'eta': 0.12030229769624279, 'sampling_method': 'gradient_base                                                                     d', 'subsample': 0.8099690087514145, 'gamma': 2.504713122394581}. Best is trial 0 with value: 3.596362164249566.
[I 2023-12-21 04:36:20,894] Trial 1 finished with value: 2.009838820527457 and parameters: {'learning_rate': 0.08779273936559882, 'aft_lo                                                                     ss_distribution': 'logistic', 'aft_loss_distribution_scale': 1.1608728809420203, 'max_depth': 8, 'booster': 'dart', 'scale_pos_weight': 1                                                                     .9410251322924439, 'alpha': 5.81300329329733, 'lambda': 7.36455110528148, 'eta': 0.06505236481009924, 'sampling_method': 'uniform', 'subs                                                                     ample': 0.44483871738977887, 'gamma': 8.855609443250632}. Best is trial 1 with value: 2.009838820527457.
[I 2023-12-21 04:36:21,258] Trial 2 finished with value: 2.42390686323075 and parameters: {'learning_rate': 0.055100030496648494, 'aft_lo                                                                     ss_distribution': 'normal', 'aft_loss_distribution_scale': 7.318799224438318, 'max_depth': 6, 'booster': 'gbtree', 'scale_pos_weight': 3.                                                                     5143727095093342, 'alpha': 9.264590913957651, 'lambda': 5.807360036799581, 'eta': 0.47351732424639215, 'sampling_method': 'gradient_based                                                                     ', 'subsample': 0.7043966030520511, 'gamma': 5.885019418511071}. Best is trial 1 with value: 2.009838820527457.
[I 2023-12-21 04:36:23,467] Trial 3 finished with value: 2.425329859548677 and parameters: {'learning_rate': 0.4722249786243142, 'aft_los                                                                     s_distribution': 'extreme', 'aft_loss_distribution_scale': 5.003253946578671, 'max_depth': 9, 'booster': 'dart', 'scale_pos_weight': 3.07                                                                     9982022375188, 'alpha': 7.42432821409157, 'lambda': 3.5745689838011914, 'eta': 0.11862342263499415, 'sampling_method': 'uniform', 'subsam                                                                     ple': 0.2761969650549841, 'gamma': 6.7896295152534}. Best is trial 1 with value: 2.009838820527457.
[I 2023-12-21 04:36:23,561] Trial 4 finished with value: 2.4533248795462437 and parameters: {'learning_rate': 0.9493505421621105, 'aft_lo                                                                     ss_distribution': 'normal', 'aft_loss_distribution_scale': 7.703280116328604, 'max_depth': 5, 'booster': 'gbtree', 'scale_pos_weight': 1.                                                                     2913200203407964, 'alpha': 2.258070976778441, 'lambda': 9.930663429080552, 'eta': 0.7476616769707524, 'sampling_method': 'uniform', 'subs                                                                     ample': 0.3375173124532764, 'gamma': 9.795131543991356}. Best is trial 1 with value: 2.009838820527457.
[I 2023-12-21 04:36:23,572] Trial 5 pruned. Trial was pruned at iteration 3.
[I 2023-12-21 04:36:23,576] Trial 6 pruned. Trial was pruned at iteration 0.
[I 2023-12-21 04:36:23,595] Trial 7 pruned. Trial was pruned at iteration 6.
[I 2023-12-21 04:36:23,599] Trial 8 pruned. Trial was pruned at iteration 0.
[I 2023-12-21 04:36:23,604] Trial 9 pruned. Trial was pruned at iteration 0.
[I 2023-12-21 04:36:25,116] Trial 10 finished with value: inf and parameters: {'learning_rate': 0.34129424909697975, 'aft_loss_distributi                                                                     on': 'logistic', 'aft_loss_distribution_scale': 2.4960015323109097, 'max_depth': 10, 'booster': 'dart', 'scale_pos_weight': 1.95688372338                                                                     37773, 'alpha': 5.362218566774911, 'lambda': 7.05431740234657, 'eta': 0.38772545731039654, 'sampling_method': 'uniform', 'subsample': 0.9                                                                     995989742905569, 'gamma': 4.036717703162911}. Best is trial 1 with value: 2.009838820527457.
[I 2023-12-21 04:36:25,146] Trial 11 pruned. Trial was pruned at iteration 0.
[I 2023-12-21 04:36:25,174] Trial 12 pruned. Trial was pruned at iteration 0.
[I 2023-12-21 04:36:25,212] Trial 13 pruned. Trial was pruned at iteration 4.
[I 2023-12-21 04:36:25,243] Trial 14 pruned. Trial was pruned at iteration 2.
[I 2023-12-21 04:36:26,552] Trial 15 finished with value: inf and parameters: {'learning_rate': 0.3318197452776638, 'aft_loss_distributio                                                                     n': 'logistic', 'aft_loss_distribution_scale': 1.8944003331459625, 'max_depth': 10, 'booster': 'dart', 'scale_pos_weight': 1.913144534875                                                                     6755, 'alpha': 9.077232181011004, 'lambda': 5.094644526490288, 'eta': 0.2490030436175024, 'sampling_method': 'gradient_based', 'subsample                                                                     ': 0.13133993633052432, 'gamma': 3.496879025349367}. Best is trial 1 with value: 2.009838820527457.
[I 2023-12-21 04:36:26,707] Trial 16 finished with value: 2.207985326336831 and parameters: {'learning_rate': 0.4724478415437888, 'aft_lo                                                                     ss_distribution': 'normal', 'aft_loss_distribution_scale': 3.932734220513348, 'max_depth': 9, 'booster': 'gbtree', 'scale_pos_weight': 3.                                                                     0993036022780323, 'alpha': 6.279063678277199, 'lambda': 3.8729867849998563, 'eta': 0.42201605257161146, 'sampling_method': 'uniform', 'su                                                                     bsample': 0.720851568154269, 'gamma': 8.153599135339041}. Best is trial 1 with value: 2.009838820527457.
[I 2023-12-21 04:36:36,285] Trial 17 finished with value: 2.1991046602500983 and parameters: {'learning_rate': 0.5031771345749603, 'aft_l                                                                     oss_distribution': 'normal', 'aft_loss_distribution_scale': 3.759582008438332, 'max_depth': 9, 'booster': 'dart', 'scale_pos_weight': 2.5                                                                     097955543504136, 'alpha': 4.46353124232399, 'lambda': 3.684553479243335, 'eta': 0.20899914293600597, 'sampling_method': 'uniform', 'subsa                                                                     mple': 0.4257344973381568, 'gamma': 8.171427429188197}. Best is trial 1 with value: 2.009838820527457.
[I 2023-12-21 04:36:47,771] Trial 18 finished with value: 2.1461670178656376 and parameters: {'learning_rate': 0.6304811561156038, 'aft_l                                                                     oss_distribution': 'logistic', 'aft_loss_distribution_scale': 1.8485199950235878, 'max_depth': 9, 'booster': 'dart', 'scale_pos_weight':                                                                      2.3434528792614975, 'alpha': 4.087318729198705, 'lambda': 8.338806850312437, 'eta': 0.18930863263912154, 'sampling_method': 'uniform', 's                                                                     ubsample': 0.2167945998604621, 'gamma': 7.993300161269964}. Best is trial 1 with value: 2.009838820527457.
[I 2023-12-21 04:36:47,803] Trial 19 pruned. Trial was pruned at iteration 0.
[I 2023-12-21 04:36:47,832] Trial 20 pruned. Trial was pruned at iteration 0.
[I 2023-12-21 04:36:47,892] Trial 21 pruned. Trial was pruned at iteration 7.
[I 2023-12-21 04:36:50,954] Trial 22 finished with value: 2.197559896450952 and parameters: {'learning_rate': 0.8089595013529685, 'aft_lo                                                                     ss_distribution': 'logistic', 'aft_loss_distribution_scale': 2.1732845734938433, 'max_depth': 9, 'booster': 'dart', 'scale_pos_weight': 2                                                                     .6730340352071913, 'alpha': 5.811289401423071, 'lambda': 8.938611570259042, 'eta': 0.31158571579780525, 'sampling_method': 'uniform', 'su                                                                     bsample': 0.4034915226933641, 'gamma': 8.810604900356509}. Best is trial 1 with value: 2.009838820527457.
[I 2023-12-21 04:36:55,605] Trial 23 pruned. Trial was pruned at iteration 120.
[I 2023-12-21 04:36:55,636] Trial 24 pruned. Trial was pruned at iteration 0.
[I 2023-12-21 04:36:55,669] Trial 25 pruned. Trial was pruned at iteration 0.
[I 2023-12-21 04:36:57,027] Trial 26 finished with value: inf and parameters: {'learning_rate': 0.8235723263158548, 'aft_loss_distributio                                                                     n': 'logistic', 'aft_loss_distribution_scale': 1.996914308744267, 'max_depth': 10, 'booster': 'dart', 'scale_pos_weight': 1.0737134569781                                                                     952, 'alpha': 2.7674510707589053, 'lambda': 9.141436035339847, 'eta': 0.16670947696363458, 'sampling_method': 'uniform', 'subsample': 0.2                                                                     33190390629039, 'gamma': 7.307862848222404}. Best is trial 1 with value: 2.009838820527457.
[I 2023-12-21 04:36:57,058] Trial 27 pruned. Trial was pruned at iteration 0.
[I 2023-12-21 04:36:57,088] Trial 28 pruned. Trial was pruned at iteration 0.
[I 2023-12-21 04:36:57,118] Trial 29 pruned. Trial was pruned at iteration 0.
[I 2023-12-21 04:36:57,152] Trial 30 pruned. Trial was pruned at iteration 1.
[I 2023-12-21 04:36:57,182] Trial 31 pruned. Trial was pruned at iteration 0.
[I 2023-12-21 04:36:57,223] Trial 32 pruned. Trial was pruned at iteration 3.
[I 2023-12-21 04:36:57,256] Trial 33 pruned. Trial was pruned at iteration 0.
[I 2023-12-21 04:36:57,286] Trial 34 pruned. Trial was pruned at iteration 0.
[I 2023-12-21 04:36:58,406] Trial 35 finished with value: inf and parameters: {'learning_rate': 0.6908373879199046, 'aft_loss_distributio                                                                     n': 'normal', 'aft_loss_distribution_scale': 1.6539060879517375, 'max_depth': 8, 'booster': 'dart', 'scale_pos_weight': 3.039712385426602                                                                     , 'alpha': 2.0999672159610454, 'lambda': 9.544839706915557, 'eta': 0.29137362427189345, 'sampling_method': 'uniform', 'subsample': 0.5608                                                                     22203499907, 'gamma': 6.759234040949041}. Best is trial 1 with value: 2.009838820527457.
[I 2023-12-21 04:36:58,445] Trial 36 pruned. Trial was pruned at iteration 0.
[I 2023-12-21 04:36:58,477] Trial 37 pruned. Trial was pruned at iteration 0.
[I 2023-12-21 04:36:58,514] Trial 38 pruned. Trial was pruned at iteration 1.
[I 2023-12-21 04:36:58,552] Trial 39 pruned. Trial was pruned at iteration 2.
[I 2023-12-21 04:36:58,585] Trial 40 pruned. Trial was pruned at iteration 0.
[I 2023-12-21 04:36:58,616] Trial 41 pruned. Trial was pruned at iteration 0.
[I 2023-12-21 04:36:58,648] Trial 42 pruned. Trial was pruned at iteration 0.
[I 2023-12-21 04:36:58,679] Trial 43 pruned. Trial was pruned at iteration 0.
[I 2023-12-21 04:36:58,711] Trial 44 pruned. Trial was pruned at iteration 0.
[I 2023-12-21 04:36:58,744] Trial 45 pruned. Trial was pruned at iteration 1.
[I 2023-12-21 04:36:58,778] Trial 46 pruned. Trial was pruned at iteration 0.
[I 2023-12-21 04:36:58,810] Trial 47 pruned. Trial was pruned at iteration 0.
[I 2023-12-21 04:36:58,843] Trial 48 pruned. Trial was pruned at iteration 0.
[I 2023-12-21 04:36:59,043] Trial 49 finished with value: 2.0328416187485323 and parameters: {'learning_rate': 0.20134590331530278, 'aft_                                                                     loss_distribution': 'logistic', 'aft_loss_distribution_scale': 1.0389098627447713, 'max_depth': 8, 'booster': 'gbtree', 'scale_pos_weight                                                                     ': 2.979898594516452, 'alpha': 7.068618934428857, 'lambda': 2.0442834941875985, 'eta': 0.22764488104958347, 'sampling_method': 'uniform',                                                                      'subsample': 0.030574236956950218, 'gamma': 7.264010052984959}. Best is trial 1 with value: 2.009838820527457.
[I 2023-12-21 04:36:59,076] Trial 50 pruned. Trial was pruned at iteration 0.
