[I 2023-12-19 00:28:19,967] Trial 37 pruned. Trial was pruned at iteration 0.
[I 2023-12-19 00:28:20,030] Trial 38 pruned. Trial was pruned at iteration 0.
[I 2023-12-19 00:28:20,093] Trial 39 pruned. Trial was pruned at iteration 0.
[I 2023-12-19 00:28:20,151] Trial 40 pruned. Trial was pruned at iteration 0.
[I 2023-12-19 00:28:20,214] Trial 41 pruned. Trial was pruned at iteration 0.
[I 2023-12-19 00:28:20,279] Trial 42 pruned. Trial was pruned at iteration 0.
[I 2023-12-19 00:28:20,344] Trial 43 pruned. Trial was pruned at iteration 0.
[I 2023-12-19 00:28:20,406] Trial 44 pruned. Trial was pruned at iteration 0.
[I 2023-12-19 00:28:20,473] Trial 45 pruned. Trial was pruned at iteration 0.
[I 2023-12-19 00:28:20,534] Trial 46 pruned. Trial was pruned at iteration 0.
[I 2023-12-19 00:28:20,614] Trial 47 pruned. Trial was pruned at iteration 2.
[I 2023-12-19 00:28:20,680] Trial 48 pruned. Trial was pruned at iteration 0.
[I 2023-12-19 00:28:20,745] Trial 49 pruned. Trial was pruned at iteration 0.
[I 2023-12-19 00:28:20,812] Trial 50 pruned. Trial was pruned at iteration 0.
[I 2023-12-19 00:28:20,882] Trial 51 pruned. Trial was pruned at iteration 0.
[I 2023-12-19 00:28:20,941] Trial 52 pruned. Trial was pruned at iteration 0.
[I 2023-12-19 00:28:21,005] Trial 53 pruned. Trial was pruned at iteration 0.
[I 2023-12-19 00:28:21,065] Trial 54 pruned. Trial was pruned at iteration 0.
[I 2023-12-19 00:28:21,131] Trial 55 pruned. Trial was pruned at iteration 0.
[I 2023-12-19 00:28:21,194] Trial 56 pruned. Trial was pruned at iteration 0.
[I 2023-12-19 00:28:21,262] Trial 57 pruned. Trial was pruned at iteration 0.
[I 2023-12-19 00:28:21,331] Trial 58 pruned. Trial was pruned at iteration 0.
[I 2023-12-19 00:28:21,394] Trial 59 pruned. Trial was pruned at iteration 0.
[I 2023-12-19 00:28:21,459] Trial 60 pruned. Trial was pruned at iteration 0.
[I 2023-12-19 00:28:21,519] Trial 61 pruned. Trial was pruned at iteration 0.
[I 2023-12-19 00:28:21,577] Trial 62 pruned. Trial was pruned at iteration 0.
[I 2023-12-19 00:28:21,637] Trial 63 pruned. Trial was pruned at iteration 0.
[I 2023-12-19 00:28:21,701] Trial 64 pruned. Trial was pruned at iteration 0.
[I 2023-12-19 00:28:23,854] Trial 65 finished with value: inf and parameters: {'learning_rate': 0.8872623942471689, 'aft_loss_distribution': 'normal', 'aft_loss_distribution_scale': 2.323799611559351, 'max_depth': 9, 'booster': 'dart', 'scale_pos_weight': 1.9617990225231459, 'alpha': 3.823202696595592, 'lambda': 8.024827698663861, 'eta': 0.725047107470141, 'sampling_method': 'uniform', 'subsample': 0.29552537834623593, 'gamma': 2.5278865916539743}. Best is trial 4 with value: 2.032977880923993.
[I 2023-12-19 00:28:23,921] Trial 66 pruned. Trial was pruned at iteration 0.
[I 2023-12-19 00:28:23,981] Trial 67 pruned. Trial was pruned at iteration 0.
[I 2023-12-19 00:28:24,044] Trial 68 pruned. Trial was pruned at iteration 0.
[I 2023-12-19 00:28:24,109] Trial 69 pruned. Trial was pruned at iteration 0.
[I 2023-12-19 00:28:24,178] Trial 70 pruned. Trial was pruned at iteration 0.
[I 2023-12-19 00:28:24,248] Trial 71 pruned. Trial was pruned at iteration 0.
[I 2023-12-19 00:28:24,311] Trial 72 pruned. Trial was pruned at iteration 0.
[I 2023-12-19 00:28:24,382] Trial 73 pruned. Trial was pruned at iteration 0.
[I 2023-12-19 00:28:24,468] Trial 74 pruned. Trial was pruned at iteration 0.
[I 2023-12-19 00:28:25,917] Trial 75 finished with value: inf and parameters: {'learning_rate': 0.9333539044880456, 'aft_loss_distribution': 'normal', 'aft_loss_distribution_scale': 3.27583657501951, 'max_depth': 6, 'booster': 'dart', 'scale_pos_weight': 2.616001212443185, 'alpha': 4.658736546468912, 'lambda': 3.14248170046456, 'eta': 0.5288722019809079, 'sampling_method': 'uniform', 'subsample': 0.5742371165755844, 'gamma': 1.0964251735382202}. Best is trial 4 with value: 2.032977880923993.
[I 2023-12-19 00:28:25,993] Trial 76 pruned. Trial was pruned at iteration 1.
[I 2023-12-19 00:28:26,257] Trial 77 finished with value: inf and parameters: {'learning_rate': 0.9721455928584045, 'aft_loss_distribution': 'normal', 'aft_loss_distribution_scale': 0.9135916244476388, 'max_depth': 5, 'booster': 'gbtree', 'scale_pos_weight': 3.259510142108065, 'alpha': 3.830956031028687, 'lambda': 3.9232224297549454, 'eta': 0.9134728147130207, 'sampling_method': 'uniform', 'subsample': 0.39447337188520515, 'gamma': 3.917977663176235}. Best is trial 4 with value: 2.032977880923993.
[I 2023-12-19 00:28:26,342] Trial 78 pruned. Trial was pruned at iteration 0.
[I 2023-12-19 00:28:26,404] Trial 79 pruned. Trial was pruned at iteration 0.
[I 2023-12-19 00:28:26,708] Trial 80 finished with value: 2.0756296126275955 and parameters: {'learning_rate': 0.8436992282482783, 'aft_loss_distribution': 'normal', 'aft_loss_distribution_scale': 2.2657862564142635, 'max_depth': 8, 'booster': 'gbtree', 'scale_pos_weight': 2.801019737586142, 'alpha': 1.2299717637874323, 'lambda': 5.098266694598731, 'eta': 0.07075154549403945, 'sampling_method': 'uniform', 'subsample': 0.05638292248368175, 'gamma': 8.227131356647982}. Best is trial 4 with value: 2.032977880923993.
[I 2023-12-19 00:28:26,774] Trial 81 pruned. Trial was pruned at iteration 0.
[I 2023-12-19 00:28:26,964] Trial 82 finished with value: inf and parameters: {'learning_rate': 0.8619548324619051, 'aft_loss_distribution': 'normal', 'aft_loss_distribution_scale': 1.8267766036870698, 'max_depth': 8, 'booster': 'gbtree', 'scale_pos_weight': 2.9776247407764833, 'alpha': 2.0233228885080634, 'lambda': 4.783576824724426, 'eta': 0.07516111622126227, 'sampling_method': 'uniform', 'subsample': 0.06854251684767293, 'gamma': 7.900684121016315}. Best is trial 4 with value: 2.032977880923993.
[I 2023-12-19 00:28:27,028] Trial 83 pruned. Trial was pruned at iteration 0.
[I 2023-12-19 00:28:27,095] Trial 84 pruned. Trial was pruned at iteration 0.
[I 2023-12-19 00:28:27,158] Trial 85 pruned. Trial was pruned at iteration 0.
[I 2023-12-19 00:28:27,239] Trial 86 pruned. Trial was pruned at iteration 1.
[I 2023-12-19 00:28:27,303] Trial 87 pruned. Trial was pruned at iteration 0.
[I 2023-12-19 00:28:27,365] Trial 88 pruned. Trial was pruned at iteration 0.
[I 2023-12-19 00:28:27,434] Trial 89 pruned. Trial was pruned at iteration 0.
[I 2023-12-19 00:28:27,510] Trial 90 pruned. Trial was pruned at iteration 0.
[I 2023-12-19 00:28:27,581] Trial 91 pruned. Trial was pruned at iteration 0.
[I 2023-12-19 00:28:27,642] Trial 92 pruned. Trial was pruned at iteration 0.
[I 2023-12-19 00:28:27,712] Trial 93 pruned. Trial was pruned at iteration 0.
[I 2023-12-19 00:28:27,774] Trial 94 pruned. Trial was pruned at iteration 0.
[I 2023-12-19 00:28:27,836] Trial 95 pruned. Trial was pruned at iteration 0.
[I 2023-12-19 00:28:27,903] Trial 96 pruned. Trial was pruned at iteration 0.
[I 2023-12-19 00:28:27,967] Trial 97 pruned. Trial was pruned at iteration 0.
[I 2023-12-19 00:28:28,032] Trial 98 pruned. Trial was pruned at iteration 0.
[I 2023-12-19 00:28:28,134] Trial 99 pruned. Trial was pruned at iteration 0.
[I 2023-12-19 00:28:28,241] Trial 100 pruned. Trial was pruned at iteration 0.
[I 2023-12-19 00:28:30,637] Trial 101 finished with value: inf and parameters: {'learning_rate': 0.5349617701281634, 'aft_loss_distribution': 'logistic', 'aft_loss_distribution_scale': 1.4169050917420436, 'max_depth': 10, 'booster': 'dart', 'scale_pos_weight': 1.5351461045290664, 'alpha': 0.812298330029404, 'lambda': 7.027076932439716, 'eta': 0.5378074445096137, 'sampling_method': 'uniform', 'subsample': 0.09808193186397822, 'gamma': 4.229424642806163}. Best is trial 4 with value: 2.032977880923993.
[I 2023-12-19 00:28:30,752] Trial 102 pruned. Trial was pruned at iteration 0.
[I 2023-12-19 00:28:30,851] Trial 103 pruned. Trial was pruned at iteration 0.
[I 2023-12-19 00:28:30,955] Trial 104 pruned. Trial was pruned at iteration 1.
[I 2023-12-19 00:28:31,056] Trial 105 pruned. Trial was pruned at iteration 0.
[I 2023-12-19 00:28:31,154] Trial 106 pruned. Trial was pruned at iteration 0.
[I 2023-12-19 00:28:31,264] Trial 107 pruned. Trial was pruned at iteration 0.
[I 2023-12-19 00:28:31,376] Trial 108 pruned. Trial was pruned at iteration 0.
[I 2023-12-19 00:28:31,487] Trial 109 pruned. Trial was pruned at iteration 0.
[I 2023-12-19 00:28:31,589] Trial 110 pruned. Trial was pruned at iteration 0.
[I 2023-12-19 00:28:31,680] Trial 111 pruned. Trial was pruned at iteration 0.
[I 2023-12-19 00:28:31,779] Trial 112 pruned. Trial was pruned at iteration 0.
[I 2023-12-19 00:28:32,076] Trial 113 finished with value: inf and parameters: {'learning_rate': 0.8492263411121042, 'aft_loss_distribution': 'normal', 'aft_loss_distribution_scale': 3.0374265407566536, 'max_depth': 6, 'booster': 'gbtree', 'scale_pos_weight': 3.069989457790582, 'alpha': 5.081820782461993, 'lambda': 4.111144780941368, 'eta': 0.4713008458775925, 'sampling_method': 'gradient_based', 'subsample': 0.3134937547730469, 'gamma': 5.580476277222049}. Best is trial 4 with value: 2.032977880923993.
[I 2023-12-19 00:28:32,489] Trial 114 finished with value: inf and parameters: {'learning_rate': 0.9773409492138901, 'aft_loss_distribution': 'normal', 'aft_loss_distribution_scale': 2.5089676892561776, 'max_depth': 8, 'booster': 'gbtree', 'scale_pos_weight': 2.878444989841704, 'alpha': 2.742646121779385, 'lambda': 4.505557431812356, 'eta': 0.687059752642817, 'sampling_method': 'gradient_based', 'subsample': 0.2835886247599458, 'gamma': 3.008920636203171}. Best is trial 4 with value: 2.032977880923993.
[I 2023-12-19 00:28:32,602] Trial 115 pruned. Trial was pruned at iteration 0.
[I 2023-12-19 00:28:32,710] Trial 116 pruned. Trial was pruned at iteration 1.
[I 2023-12-19 00:28:32,817] Trial 117 pruned. Trial was pruned at iteration 0.
[I 2023-12-19 00:28:32,924] Trial 118 pruned. Trial was pruned at iteration 0.
[I 2023-12-19 00:28:33,012] Trial 119 pruned. Trial was pruned at iteration 0.
[I 2023-12-19 00:28:33,080] Trial 120 pruned. Trial was pruned at iteration 0.
[I 2023-12-19 00:28:33,151] Trial 121 pruned. Trial was pruned at iteration 0.
[I 2023-12-19 00:28:33,226] Trial 122 pruned. Trial was pruned at iteration 0.
[I 2023-12-19 00:28:33,295] Trial 123 pruned. Trial was pruned at iteration 0.
[I 2023-12-19 00:28:33,362] Trial 124 pruned. Trial was pruned at iteration 0.
[I 2023-12-19 00:28:33,427] Trial 125 pruned. Trial was pruned at iteration 0.
[I 2023-12-19 00:28:33,493] Trial 126 pruned. Trial was pruned at iteration 0.
[I 2023-12-19 00:28:33,561] Trial 127 pruned. Trial was pruned at iteration 0.
[I 2023-12-19 00:28:33,631] Trial 128 pruned. Trial was pruned at iteration 0.
[I 2023-12-19 00:28:33,699] Trial 129 pruned. Trial was pruned at iteration 0.
[I 2023-12-19 00:28:33,766] Trial 130 pruned. Trial was pruned at iteration 0.
[I 2023-12-19 00:28:33,842] Trial 131 pruned. Trial was pruned at iteration 0.
[I 2023-12-19 00:28:33,913] Trial 132 pruned. Trial was pruned at iteration 0.
[I 2023-12-19 00:28:37,253] Trial 133 finished with value: 2.1559418758368802 and parameters: {'learning_rate': 0.9803190613794717, 'aft_loss_distribution': 'normal', 'aft_loss_distribution_scale': 3.1230828072018295, 'max_depth': 6, 'booster': 'dart', 'scale_pos_weight': 3.398155137624088, 'alpha': 9.760900331499158, 'lambda': 4.063152924753282, 'eta': 0.3437623928378317, 'sampling_method': 'uniform', 'subsample': 0.689803306586894, 'gamma': 7.484610943266008}. Best is trial 4 with value: 2.032977880923993.
[I 2023-12-19 00:28:37,326] Trial 134 pruned. Trial was pruned at iteration 0.
[I 2023-12-19 00:28:39,035] Trial 135 finished with value: inf and parameters: {'learning_rate': 0.9658678124537278, 'aft_loss_distribution': 'normal', 'aft_loss_distribution_scale': 3.175329890696002, 'max_depth': 7, 'booster': 'dart', 'scale_pos_weight': 3.5304724095866353, 'alpha': 9.14858715730861, 'lambda': 4.2569450364007775, 'eta': 0.3100025539307901, 'sampling_method': 'uniform', 'subsample': 0.6874100599305708, 'gamma': 7.054551018600151}. Best is trial 4 with value: 2.032977880923993.
[I 2023-12-19 00:28:39,106] Trial 136 pruned. Trial was pruned at iteration 0.
[I 2023-12-19 00:28:39,173] Trial 137 pruned. Trial was pruned at iteration 0.
[I 2023-12-19 00:28:39,245] Trial 138 pruned. Trial was pruned at iteration 0.
[I 2023-12-19 00:28:39,312] Trial 139 pruned. Trial was pruned at iteration 0.
[I 2023-12-19 00:28:39,381] Trial 140 pruned. Trial was pruned at iteration 0.
[I 2023-12-19 00:28:40,778] Trial 141 finished with value: inf and parameters: {'learning_rate': 0.9666533792133132, 'aft_loss_distribution': 'normal', 'aft_loss_distribution_scale': 2.300950127038714, 'max_depth': 6, 'booster': 'dart', 'scale_pos_weight': 2.475593863027877, 'alpha': 2.140054508659297, 'lambda': 4.4206236430982315, 'eta': 0.08804856657144955, 'sampling_method': 'uniform', 'subsample': 0.22374822137017933, 'gamma': 3.61953411743389}. Best is trial 4 with value: 2.032977880923993.
[I 2023-12-19 00:28:42,056] Trial 142 finished with value: inf and parameters: {'learning_rate': 0.9928785257420693, 'aft_loss_distribution': 'normal', 'aft_loss_distribution_scale': 2.528014233014501, 'max_depth': 6, 'booster': 'dart', 'scale_pos_weight': 1.2342802215004907, 'alpha': 1.7617474270867917, 'lambda': 1.296995471182854, 'eta': 0.344329337856696, 'sampling_method': 'uniform', 'subsample': 0.7404544217017365, 'gamma': 4.797635045045478}. Best is trial 4 with value: 2.032977880923993.
[I 2023-12-19 00:28:43,824] Trial 143 finished with value: inf and parameters: {'learning_rate': 0.9287877151279084, 'aft_loss_distribution': 'normal', 'aft_loss_distribution_scale': 2.8257758886841473, 'max_depth': 6, 'booster': 'dart', 'scale_pos_weight': 3.3740151021662177, 'alpha': 8.598065073377539, 'lambda': 3.905239542793266, 'eta': 0.3878894390063972, 'sampling_method': 'uniform', 'subsample': 0.2910768995736173, 'gamma': 8.488842212606098}. Best is trial 4 with value: 2.032977880923993.
[I 2023-12-19 00:28:43,948] Trial 144 pruned. Trial was pruned at iteration 0.
[I 2023-12-19 00:28:44,282] Trial 145 finished with value: inf and parameters: {'learning_rate': 0.9100140472065769, 'aft_loss_distribution': 'normal', 'aft_loss_distribution_scale': 2.571533184402103, 'max_depth': 5, 'booster': 'gbtree', 'scale_pos_weight': 2.5824881370012878, 'alpha': 4.116147989580477, 'lambda': 9.768175363557921, 'eta': 0.32634108431824893, 'sampling_method': 'gradient_based', 'subsample': 0.275775846253366, 'gamma': 6.4050306979613945}. Best is trial 4 with value: 2.032977880923993.
[I 2023-12-19 00:28:44,395] Trial 146 pruned. Trial was pruned at iteration 0.
[I 2023-12-19 00:28:44,493] Trial 147 pruned. Trial was pruned at iteration 0.
[I 2023-12-19 00:28:44,590] Trial 148 pruned. Trial was pruned at iteration 0.
[I 2023-12-19 00:28:44,689] Trial 149 pruned. Trial was pruned at iteration 0.
[I 2023-12-19 00:28:44,787] Trial 150 pruned. Trial was pruned at iteration 0.
[I 2023-12-19 00:28:46,638] Trial 151 finished with value: inf and parameters: {'learning_rate': 0.8837072662852573, 'aft_loss_distribution': 'normal', 'aft_loss_distribution_scale': 2.328549791818063, 'max_depth': 9, 'booster': 'dart', 'scale_pos_weight': 2.415451839485391, 'alpha': 3.977510553156273, 'lambda': 7.829830258083635, 'eta': 0.5912956098005975, 'sampling_method': 'uniform', 'subsample': 0.2989379225272504, 'gamma': 2.2832662392668293}. Best is trial 4 with value: 2.032977880923993.
[I 2023-12-19 00:28:48,742] Trial 152 finished with value: inf and parameters: {'learning_rate': 0.8543573788360711, 'aft_loss_distribution': 'normal', 'aft_loss_distribution_scale': 2.1112659372545854, 'max_depth': 8, 'booster': 'dart', 'scale_pos_weight': 1.7850583355719356, 'alpha': 4.355563402045101, 'lambda': 4.0071141966532995, 'eta': 0.7380209833737437, 'sampling_method': 'uniform', 'subsample': 0.21558317047309677, 'gamma': 1.941782178307631}. Best is trial 4 with value: 2.032977880923993.
[I 2023-12-19 00:28:48,820] Trial 153 pruned. Trial was pruned at iteration 0.
[I 2023-12-19 00:28:48,893] Trial 154 pruned. Trial was pruned at iteration 0.
[I 2023-12-19 00:28:48,963] Trial 155 pruned. Trial was pruned at iteration 0.
[I 2023-12-19 00:28:49,033] Trial 156 pruned. Trial was pruned at iteration 0.
[I 2023-12-19 00:28:49,104] Trial 157 pruned. Trial was pruned at iteration 0.
[I 2023-12-19 00:28:49,172] Trial 158 pruned. Trial was pruned at iteration 0.
[I 2023-12-19 00:28:49,249] Trial 159 pruned. Trial was pruned at iteration 0.
[I 2023-12-19 00:28:49,336] Trial 160 pruned. Trial was pruned at iteration 0.
[I 2023-12-19 00:28:49,406] Trial 161 pruned. Trial was pruned at iteration 0.
[I 2023-12-19 00:28:49,478] Trial 162 pruned. Trial was pruned at iteration 0.
[I 2023-12-19 00:28:49,549] Trial 163 pruned. Trial was pruned at iteration 0.
[I 2023-12-19 00:28:49,619] Trial 164 pruned. Trial was pruned at iteration 0.
[I 2023-12-19 00:28:49,688] Trial 165 pruned. Trial was pruned at iteration 0.
[I 2023-12-19 00:28:49,770] Trial 166 pruned. Trial was pruned at iteration 0.
[I 2023-12-19 00:28:49,840] Trial 167 pruned. Trial was pruned at iteration 0.
[I 2023-12-19 00:28:49,912] Trial 168 pruned. Trial was pruned at iteration 0.
[I 2023-12-19 00:28:49,979] Trial 169 pruned. Trial was pruned at iteration 0.
[I 2023-12-19 00:28:51,383] Trial 170 finished with value: inf and parameters: {'learning_rate': 0.9999139428125943, 'aft_loss_distribution': 'normal', 'aft_loss_distribution_scale': 2.6231318873513043, 'max_depth': 5, 'booster': 'dart', 'scale_pos_weight': 3.010388327847485, 'alpha': 6.116344472052075, 'lambda': 8.346862804222948, 'eta': 0.3410953492864074, 'sampling_method': 'gradient_based', 'subsample': 0.16289872945144296, 'gamma': 3.6976322038627534}. Best is trial 4 with value: 2.032977880923993.
[I 2023-12-19 00:28:51,467] Trial 171 pruned. Trial was pruned at iteration 0.
[I 2023-12-19 00:28:51,537] Trial 172 pruned. Trial was pruned at iteration 0.
[I 2023-12-19 00:28:51,774] Trial 173 finished with value: inf and parameters: {'learning_rate': 0.9722849533288027, 'aft_loss_distribution': 'normal', 'aft_loss_distribution_scale': 1.3436237862533982, 'max_depth': 3, 'booster': 'gbtree', 'scale_pos_weight': 3.1491122543009644, 'alpha': 3.46298334359817, 'lambda': 4.257736063950793, 'eta': 0.9091436183435211, 'sampling_method': 'uniform', 'subsample': 0.3973267531795315, 'gamma': 4.1570137304374395}. Best is trial 4 with value: 2.032977880923993.
[I 2023-12-19 00:28:51,852] Trial 174 pruned. Trial was pruned at iteration 0.
[I 2023-12-19 00:28:51,924] Trial 175 pruned. Trial was pruned at iteration 0.
[I 2023-12-19 00:28:51,993] Trial 176 pruned. Trial was pruned at iteration 0.
[I 2023-12-19 00:28:52,065] Trial 177 pruned. Trial was pruned at iteration 0.
[I 2023-12-19 00:28:52,138] Trial 178 pruned. Trial was pruned at iteration 0.
[I 2023-12-19 00:28:52,206] Trial 179 pruned. Trial was pruned at iteration 0.
[I 2023-12-19 00:28:52,294] Trial 180 pruned. Trial was pruned at iteration 0.
[I 2023-12-19 00:28:52,374] Trial 181 pruned. Trial was pruned at iteration 0.
[I 2023-12-19 00:28:52,461] Trial 182 pruned. Trial was pruned at iteration 0.
[I 2023-12-19 00:28:52,532] Trial 183 pruned. Trial was pruned at iteration 0.
[I 2023-12-19 00:28:52,731] Trial 184 finished with value: inf and parameters: {'learning_rate': 0.9400360891381816, 'aft_loss_distribution': 'normal', 'aft_loss_distribution_scale': 2.001566116922798, 'max_depth': 8, 'booster': 'gbtree', 'scale_pos_weight': 0.9742597035664484, 'alpha': 1.3018821493554, 'lambda': 4.257365627743523, 'eta': 0.05525803918819058, 'sampling_method': 'uniform', 'subsample': 0.10646390946850018, 'gamma': 8.12718947418017}. Best is trial 4 with value: 2.032977880923993.
[I 2023-12-19 00:28:52,814] Trial 185 pruned. Trial was pruned at iteration 0.
[I 2023-12-19 00:28:52,886] Trial 186 pruned. Trial was pruned at iteration 0.
[I 2023-12-19 00:28:52,964] Trial 187 pruned. Trial was pruned at iteration 0.
[I 2023-12-19 00:28:53,035] Trial 188 pruned. Trial was pruned at iteration 0.
[I 2023-12-19 00:28:53,110] Trial 189 pruned. Trial was pruned at iteration 0.
[I 2023-12-19 00:28:53,185] Trial 190 pruned. Trial was pruned at iteration 0.
[I 2023-12-19 00:28:55,231] Trial 191 finished with value: inf and parameters: {'learning_rate': 0.5059500592428264, 'aft_loss_distribution': 'logistic', 'aft_loss_distribution_scale': 1.226669151795622, 'max_depth': 10, 'booster': 'dart', 'scale_pos_weight': 1.3132051193863632, 'alpha': 0.9526919486378498, 'lambda': 4.062103548820565, 'eta': 0.5216607967496218, 'sampling_method': 'uniform', 'subsample': 0.051604916337175746, 'gamma': 4.195905705649958}. Best is trial 4 with value: 2.032977880923993.
[I 2023-12-19 00:28:55,310] Trial 192 pruned. Trial was pruned at iteration 0.
[I 2023-12-19 00:28:55,383] Trial 193 pruned. Trial was pruned at iteration 0.
[I 2023-12-19 00:28:55,470] Trial 194 pruned. Trial was pruned at iteration 0.
[I 2023-12-19 00:28:55,543] Trial 195 pruned. Trial was pruned at iteration 0.
[I 2023-12-19 00:28:55,618] Trial 196 pruned. Trial was pruned at iteration 0.
[I 2023-12-19 00:28:57,179] Trial 197 finished with value: inf and parameters: {'learning_rate': 0.9839221554310396, 'aft_loss_distribution': 'normal', 'aft_loss_distribution_scale': 1.1446458003178628, 'max_depth': 10, 'booster': 'dart', 'scale_pos_weight': 2.655667925353916, 'alpha': 0.36581157510008017, 'lambda': 6.306323118777165, 'eta': 0.8994263529704286, 'sampling_method': 'gradient_based', 'subsample': 0.14094501368012885, 'gamma': 4.523364161013278}. Best is trial 4 with value: 2.032977880923993.
[I 2023-12-19 00:28:57,265] Trial 198 pruned. Trial was pruned at iteration 0.
[I 2023-12-19 00:28:57,338] Trial 199 pruned. Trial was pruned at iteration 0.
[I 2023-12-19 00:28:57,417] Trial 200 pruned. Trial was pruned at iteration 0.
[I 2023-12-19 00:28:57,503] Trial 201 pruned. Trial was pruned at iteration 0.
