[I 2023-12-21 04:02:59,466] Trial 175 finished with value: inf and parameters: {'learning_rate': 0.9568957645117356, 'aft_loss_distributi                                                                     on': 'normal', 'aft_loss_distribution_scale': 1.1396585355037074, 'max_depth': 9, 'booster': 'gbtree', 'scale_pos_weight': 4.413473300717                                                                     0315, 'alpha': 4.81577604859433, 'lambda': 4.090356843572081, 'eta': 0.8381470153987431, 'sampling_method': 'gradient_based', 'subsample'                                                                     : 0.9541993483244662, 'gamma': 7.0394415185079335}. Best is trial 84 with value: 4.259518710902867.
[I 2023-12-21 04:02:59,505] Trial 176 pruned. Trial was pruned at iteration 1.
[I 2023-12-21 04:02:59,624] Trial 177 finished with value: inf and parameters: {'learning_rate': 0.9170716443547836, 'aft_loss_distributi                                                                     on': 'normal', 'aft_loss_distribution_scale': 0.9827097014172513, 'max_depth': 10, 'booster': 'gbtree', 'scale_pos_weight': 4.06980177285                                                                     8253, 'alpha': 4.639954361515799, 'lambda': 2.4941511214606327, 'eta': 0.1449506231457087, 'sampling_method': 'gradient_based', 'subsampl                                                                     e': 0.47393136399155195, 'gamma': 6.339986273175546}. Best is trial 84 with value: 4.259518710902867.
[I 2023-12-21 04:02:59,661] Trial 178 pruned. Trial was pruned at iteration 0.
[I 2023-12-21 04:02:59,698] Trial 179 pruned. Trial was pruned at iteration 0.
[I 2023-12-21 04:02:59,736] Trial 180 pruned. Trial was pruned at iteration 1.
[I 2023-12-21 04:02:59,776] Trial 181 pruned. Trial was pruned at iteration 1.
[I 2023-12-21 04:02:59,924] Trial 182 finished with value: 4.280114133070928 and parameters: {'learning_rate': 0.8178842500108534, 'aft_l                                                                     oss_distribution': 'normal', 'aft_loss_distribution_scale': 1.2330175906445355, 'max_depth': 7, 'booster': 'gbtree', 'scale_pos_weight':                                                                      4.230844375245527, 'alpha': 4.9013225925475545, 'lambda': 0.11391619997229441, 'eta': 0.9737902837912567, 'sampling_method': 'gradient_ba                                                                     sed', 'subsample': 0.9240552977962615, 'gamma': 5.4763609173207675}. Best is trial 84 with value: 4.259518710902867.
[I 2023-12-21 04:03:00,030] Trial 183 finished with value: inf and parameters: {'learning_rate': 0.8298802397395589, 'aft_loss_distributi                                                                     on': 'normal', 'aft_loss_distribution_scale': 1.1557632387420211, 'max_depth': 7, 'booster': 'gbtree', 'scale_pos_weight': 4.132681401889                                                                     8075, 'alpha': 4.911392329233856, 'lambda': 2.2837918454461077, 'eta': 0.9684355888311988, 'sampling_method': 'gradient_based', 'subsampl                                                                     e': 0.940776367419189, 'gamma': 8.383890107938681}. Best is trial 84 with value: 4.259518710902867.
[I 2023-12-21 04:03:00,069] Trial 184 pruned. Trial was pruned at iteration 1.
[I 2023-12-21 04:03:00,107] Trial 185 pruned. Trial was pruned at iteration 0.
[I 2023-12-21 04:03:00,146] Trial 186 pruned. Trial was pruned at iteration 0.
[I 2023-12-21 04:03:00,186] Trial 187 pruned. Trial was pruned at iteration 1.
[I 2023-12-21 04:03:00,224] Trial 188 pruned. Trial was pruned at iteration 0.
[I 2023-12-21 04:03:00,262] Trial 189 pruned. Trial was pruned at iteration 0.
[I 2023-12-21 04:03:00,469] Trial 190 finished with value: 4.276895862895694 and parameters: {'learning_rate': 0.8842929817069434, 'aft_l                                                                     oss_distribution': 'normal', 'aft_loss_distribution_scale': 1.2012130318969567, 'max_depth': 6, 'booster': 'gbtree', 'scale_pos_weight':                                                                      3.98669318825325, 'alpha': 4.546524070517395, 'lambda': 1.2071175519611774, 'eta': 0.9214596835230208, 'sampling_method': 'gradient_based                                                                     ', 'subsample': 0.9463213588868811, 'gamma': 6.786660912642632}. Best is trial 84 with value: 4.259518710902867.
[I 2023-12-21 04:03:00,574] Trial 191 finished with value: inf and parameters: {'learning_rate': 0.9256987445562219, 'aft_loss_distributi                                                                     on': 'normal', 'aft_loss_distribution_scale': 1.20941614973704, 'max_depth': 6, 'booster': 'gbtree', 'scale_pos_weight': 3.96935394830587                                                                     46, 'alpha': 4.561968316291503, 'lambda': 1.6525354728893635, 'eta': 0.9257219353864747, 'sampling_method': 'gradient_based', 'subsample'                                                                     : 0.9432209195809007, 'gamma': 7.221635425641602}. Best is trial 84 with value: 4.259518710902867.
[I 2023-12-21 04:03:00,614] Trial 192 pruned. Trial was pruned at iteration 1.
[I 2023-12-21 04:03:00,722] Trial 193 finished with value: inf and parameters: {'learning_rate': 0.8669474238700737, 'aft_loss_distributi                                                                     on': 'normal', 'aft_loss_distribution_scale': 1.033724432429886, 'max_depth': 6, 'booster': 'gbtree', 'scale_pos_weight': 4.2871004873922                                                                     , 'alpha': 4.496576084243435, 'lambda': 1.2624292399442583, 'eta': 0.97534027398601, 'sampling_method': 'gradient_based', 'subsample': 0.                                                                     6107056137428954, 'gamma': 6.502314701281307}. Best is trial 84 with value: 4.259518710902867.
[I 2023-12-21 04:03:00,761] Trial 194 pruned. Trial was pruned at iteration 0.
[I 2023-12-21 04:03:00,800] Trial 195 pruned. Trial was pruned at iteration 0.
[I 2023-12-21 04:03:00,840] Trial 196 pruned. Trial was pruned at iteration 1.
[I 2023-12-21 04:03:01,932] Trial 197 finished with value: inf and parameters: {'learning_rate': 0.9069848620921724, 'aft_loss_distributi                                                                     on': 'normal', 'aft_loss_distribution_scale': 1.211535455796138, 'max_depth': 7, 'booster': 'dart', 'scale_pos_weight': 3.66709076852376,                                                                      'alpha': 5.287665671544505, 'lambda': 2.7762024107365164, 'eta': 0.9243187910708902, 'sampling_method': 'gradient_based', 'subsample': 0                                                                     .92860572750092, 'gamma': 5.89084211436684}. Best is trial 84 with value: 4.259518710902867.
[I 2023-12-21 04:03:01,971] Trial 198 pruned. Trial was pruned at iteration 0.
[I 2023-12-21 04:03:02,010] Trial 199 pruned. Trial was pruned at iteration 0.
[I 2023-12-21 04:03:02,047] Trial 200 pruned. Trial was pruned at iteration 0.
[I 2023-12-21 04:03:02,085] Trial 201 pruned. Trial was pruned at iteration 0.
[I 2023-12-21 04:03:02,123] Trial 202 pruned. Trial was pruned at iteration 0.
[I 2023-12-21 04:03:02,161] Trial 203 pruned. Trial was pruned at iteration 0.
[I 2023-12-21 04:03:02,200] Trial 204 pruned. Trial was pruned at iteration 0.
[I 2023-12-21 04:03:02,240] Trial 205 pruned. Trial was pruned at iteration 1.
[I 2023-12-21 04:03:02,278] Trial 206 pruned. Trial was pruned at iteration 0.
[I 2023-12-21 04:03:02,319] Trial 207 pruned. Trial was pruned at iteration 0.
[I 2023-12-21 04:03:03,294] Trial 208 finished with value: inf and parameters: {'learning_rate': 0.9196908239176252, 'aft_loss_distributi                                                                     on': 'normal', 'aft_loss_distribution_scale': 1.091103380103626, 'max_depth': 6, 'booster': 'dart', 'scale_pos_weight': 4.875087828296076                                                                     , 'alpha': 4.746656666509275, 'lambda': 7.77089526323632, 'eta': 0.674752079052955, 'sampling_method': 'gradient_based', 'subsample': 0.9                                                                     151588169803436, 'gamma': 5.050781210114214}. Best is trial 84 with value: 4.259518710902867.
[I 2023-12-21 04:03:03,335] Trial 209 pruned. Trial was pruned at iteration 0.
[I 2023-12-21 04:03:03,374] Trial 210 pruned. Trial was pruned at iteration 0.
[I 2023-12-21 04:03:03,414] Trial 211 pruned. Trial was pruned at iteration 0.
[I 2023-12-21 04:03:03,453] Trial 212 pruned. Trial was pruned at iteration 0.
[I 2023-12-21 04:03:03,493] Trial 213 pruned. Trial was pruned at iteration 0.
[I 2023-12-21 04:03:03,532] Trial 214 pruned. Trial was pruned at iteration 0.
[I 2023-12-21 04:03:03,571] Trial 215 pruned. Trial was pruned at iteration 0.
[I 2023-12-21 04:03:03,609] Trial 216 pruned. Trial was pruned at iteration 0.
[I 2023-12-21 04:03:03,650] Trial 217 pruned. Trial was pruned at iteration 0.
[I 2023-12-21 04:03:03,698] Trial 218 pruned. Trial was pruned at iteration 0.
[I 2023-12-21 04:03:03,738] Trial 219 pruned. Trial was pruned at iteration 0.
[I 2023-12-21 04:03:03,779] Trial 220 pruned. Trial was pruned at iteration 1.
[I 2023-12-21 04:03:03,818] Trial 221 pruned. Trial was pruned at iteration 0.
[I 2023-12-21 04:03:03,858] Trial 222 pruned. Trial was pruned at iteration 0.
[I 2023-12-21 04:03:03,897] Trial 223 pruned. Trial was pruned at iteration 0.
[I 2023-12-21 04:03:03,938] Trial 224 pruned. Trial was pruned at iteration 0.
[I 2023-12-21 04:03:03,977] Trial 225 pruned. Trial was pruned at iteration 0.
[I 2023-12-21 04:03:04,016] Trial 226 pruned. Trial was pruned at iteration 0.
[I 2023-12-21 04:03:04,055] Trial 227 pruned. Trial was pruned at iteration 0.
[I 2023-12-21 04:03:04,095] Trial 228 pruned. Trial was pruned at iteration 0.
[I 2023-12-21 04:03:04,134] Trial 229 pruned. Trial was pruned at iteration 0.
[I 2023-12-21 04:03:04,254] Trial 230 finished with value: inf and parameters: {'learning_rate': 0.8953375071454551, 'aft_loss_distributi                                                                     on': 'normal', 'aft_loss_distribution_scale': 1.1023238594014322, 'max_depth': 7, 'booster': 'gbtree', 'scale_pos_weight': 3.335631403885                                                                     091, 'alpha': 1.7724858248691413, 'lambda': 8.433057465810244, 'eta': 0.9599976992287607, 'sampling_method': 'gradient_based', 'subsample                                                                     ': 0.9382125962133305, 'gamma': 7.343086360666912}. Best is trial 84 with value: 4.259518710902867.
[I 2023-12-21 04:03:04,296] Trial 231 pruned. Trial was pruned at iteration 1.
[I 2023-12-21 04:03:04,338] Trial 232 pruned. Trial was pruned at iteration 0.
[I 2023-12-21 04:03:04,384] Trial 233 pruned. Trial was pruned at iteration 2.
[I 2023-12-21 04:03:04,424] Trial 234 pruned. Trial was pruned at iteration 0.
[I 2023-12-21 04:03:04,464] Trial 235 pruned. Trial was pruned at iteration 0.
[I 2023-12-21 04:03:04,504] Trial 236 pruned. Trial was pruned at iteration 0.
[I 2023-12-21 04:03:04,545] Trial 237 pruned. Trial was pruned at iteration 0.
[I 2023-12-21 04:03:04,586] Trial 238 pruned. Trial was pruned at iteration 0.
[I 2023-12-21 04:03:04,696] Trial 239 finished with value: inf and parameters: {'learning_rate': 0.8805576848878279, 'aft_loss_distributi                                                                     on': 'normal', 'aft_loss_distribution_scale': 1.197296994661491, 'max_depth': 5, 'booster': 'gbtree', 'scale_pos_weight': 4.0371297454910                                                                     15, 'alpha': 7.717353543039366, 'lambda': 9.266002616559424, 'eta': 0.8847382144412309, 'sampling_method': 'gradient_based', 'subsample':                                                                      0.9736814193485721, 'gamma': 3.9730364838482757}. Best is trial 84 with value: 4.259518710902867.
[I 2023-12-21 04:03:04,805] Trial 240 finished with value: inf and parameters: {'learning_rate': 0.9381541374492466, 'aft_loss_distributi                                                                     on': 'normal', 'aft_loss_distribution_scale': 0.909201926466094, 'max_depth': 7, 'booster': 'gbtree', 'scale_pos_weight': 4.6543931952329                                                                     69, 'alpha': 5.048859469736098, 'lambda': 8.644653693088303, 'eta': 0.9407322586279417, 'sampling_method': 'gradient_based', 'subsample':                                                                      0.926191281838733, 'gamma': 6.090462645516776}. Best is trial 84 with value: 4.259518710902867.
[I 2023-12-21 04:03:04,847] Trial 241 pruned. Trial was pruned at iteration 1.
[I 2023-12-21 04:03:04,887] Trial 242 pruned. Trial was pruned at iteration 0.
[I 2023-12-21 04:03:04,927] Trial 243 pruned. Trial was pruned at iteration 0.
[I 2023-12-21 04:03:04,977] Trial 244 pruned. Trial was pruned at iteration 1.
[I 2023-12-21 04:03:05,018] Trial 245 pruned. Trial was pruned at iteration 0.
[I 2023-12-21 04:03:05,060] Trial 246 pruned. Trial was pruned at iteration 1.
[I 2023-12-21 04:03:05,101] Trial 247 pruned. Trial was pruned at iteration 0.
[I 2023-12-21 04:03:05,141] Trial 248 pruned. Trial was pruned at iteration 0.
[I 2023-12-21 04:03:05,264] Trial 249 finished with value: inf and parameters: {'learning_rate': 0.872001520068091, 'aft_loss_distributio                                                                     n': 'normal', 'aft_loss_distribution_scale': 1.2748472044498445, 'max_depth': 9, 'booster': 'gbtree', 'scale_pos_weight': 3.7481218969608                                                                     01, 'alpha': 4.346719010702, 'lambda': 5.794766939885302, 'eta': 0.6483173451732095, 'sampling_method': 'gradient_based', 'subsample': 0.                                                                     9070631838951333, 'gamma': 7.103326669623009}. Best is trial 84 with value: 4.259518710902867.
[I 2023-12-21 04:03:05,308] Trial 250 pruned. Trial was pruned at iteration 0.
[I 2023-12-21 04:03:05,355] Trial 251 pruned. Trial was pruned at iteration 0.
[I 2023-12-21 04:03:05,396] Trial 252 pruned. Trial was pruned at iteration 0.
[I 2023-12-21 04:03:05,518] Trial 253 finished with value: inf and parameters: {'learning_rate': 0.8837112138607691, 'aft_loss_distributi                                                                     on': 'normal', 'aft_loss_distribution_scale': 1.0333948030363747, 'max_depth': 5, 'booster': 'gbtree', 'scale_pos_weight': 4.812108607403                                                                     879, 'alpha': 4.604772617240319, 'lambda': 7.908850072952421, 'eta': 0.9610972209908828, 'sampling_method': 'gradient_based', 'subsample'                                                                     : 0.7749430687395507, 'gamma': 3.2105545104504194}. Best is trial 84 with value: 4.259518710902867.
[I 2023-12-21 04:03:05,559] Trial 254 pruned. Trial was pruned at iteration 0.
[I 2023-12-21 04:03:05,600] Trial 255 pruned. Trial was pruned at iteration 0.
[I 2023-12-21 04:03:05,712] Trial 256 finished with value: inf and parameters: {'learning_rate': 0.9190756329727233, 'aft_loss_distributi                                                                     on': 'normal', 'aft_loss_distribution_scale': 1.223572577830571, 'max_depth': 7, 'booster': 'gbtree', 'scale_pos_weight': 3.9894774978679                                                                     26, 'alpha': 0.921409626598781, 'lambda': 8.544670983977802, 'eta': 0.8252065705136268, 'sampling_method': 'gradient_based', 'subsample':                                                                      0.9216191263138889, 'gamma': 5.691208029871124}. Best is trial 84 with value: 4.259518710902867.
[I 2023-12-21 04:03:05,754] Trial 257 pruned. Trial was pruned at iteration 0.
[I 2023-12-21 04:03:05,796] Trial 258 pruned. Trial was pruned at iteration 0.
[I 2023-12-21 04:03:05,841] Trial 259 pruned. Trial was pruned at iteration 1.
[I 2023-12-21 04:03:05,881] Trial 260 pruned. Trial was pruned at iteration 0.
[I 2023-12-21 04:03:05,923] Trial 261 pruned. Trial was pruned at iteration 0.
[I 2023-12-21 04:03:06,034] Trial 262 finished with value: inf and parameters: {'learning_rate': 0.8651549086181718, 'aft_loss_distributi                                                                     on': 'normal', 'aft_loss_distribution_scale': 0.9852732101170963, 'max_depth': 10, 'booster': 'gbtree', 'scale_pos_weight': 4.65248119098                                                                     4053, 'alpha': 5.700864897120538, 'lambda': 7.096462598018855, 'eta': 0.9103401338227888, 'sampling_method': 'gradient_based', 'subsample                                                                     ': 0.8644072026049123, 'gamma': 6.007007866459281}. Best is trial 84 with value: 4.259518710902867.
[I 2023-12-21 04:03:07,086] Trial 263 finished with value: inf and parameters: {'learning_rate': 0.93558880275063, 'aft_loss_distribution                                                                     ': 'normal', 'aft_loss_distribution_scale': 1.2593085522599274, 'max_depth': 5, 'booster': 'dart', 'scale_pos_weight': 8.555650587190957,                                                                      'alpha': 5.077879767813449, 'lambda': 8.037682606684877, 'eta': 0.21199150716188603, 'sampling_method': 'gradient_based', 'subsample': 0                                                                     .9428811567176295, 'gamma': 3.5078182132174174}. Best is trial 84 with value: 4.259518710902867.
[I 2023-12-21 04:03:07,128] Trial 264 pruned. Trial was pruned at iteration 0.
[I 2023-12-21 04:03:07,171] Trial 265 pruned. Trial was pruned at iteration 0.
[I 2023-12-21 04:03:07,214] Trial 266 pruned. Trial was pruned at iteration 0.
[I 2023-12-21 04:03:07,256] Trial 267 pruned. Trial was pruned at iteration 0.
[I 2023-12-21 04:03:07,299] Trial 268 pruned. Trial was pruned at iteration 0.
[I 2023-12-21 04:03:08,667] Trial 269 finished with value: inf and parameters: {'learning_rate': 0.8770394812889505, 'aft_loss_distributi                                                                     on': 'normal', 'aft_loss_distribution_scale': 1.231129596358375, 'max_depth': 7, 'booster': 'dart', 'scale_pos_weight': 4.052096841199703                                                                     , 'alpha': 6.597642477119644, 'lambda': 7.801429057705685, 'eta': 0.7685658511462338, 'sampling_method': 'gradient_based', 'subsample': 0                                                                     .9252254681986606, 'gamma': 7.273150559204339}. Best is trial 84 with value: 4.259518710902867.
[I 2023-12-21 04:03:08,709] Trial 270 pruned. Trial was pruned at iteration 0.
[I 2023-12-21 04:03:08,751] Trial 271 pruned. Trial was pruned at iteration 0.
[I 2023-12-21 04:03:08,794] Trial 272 pruned. Trial was pruned at iteration 1.
[I 2023-12-21 04:03:08,837] Trial 273 pruned. Trial was pruned at iteration 0.
[I 2023-12-21 04:03:08,879] Trial 274 pruned. Trial was pruned at iteration 0.
[I 2023-12-21 04:03:08,921] Trial 275 pruned. Trial was pruned at iteration 0.
[I 2023-12-21 04:03:08,962] Trial 276 pruned. Trial was pruned at iteration 0.
[I 2023-12-21 04:03:09,007] Trial 277 pruned. Trial was pruned at iteration 1.
[I 2023-12-21 04:03:09,050] Trial 278 pruned. Trial was pruned at iteration 0.
[I 2023-12-21 04:03:09,093] Trial 279 pruned. Trial was pruned at iteration 0.
[I 2023-12-21 04:03:09,140] Trial 280 pruned. Trial was pruned at iteration 2.
[I 2023-12-21 04:03:09,288] Trial 281 finished with value: 4.286080317608848 and parameters: {'learning_rate': 0.841526954200918, 'aft_lo                                                                     ss_distribution': 'normal', 'aft_loss_distribution_scale': 1.2472959354683915, 'max_depth': 7, 'booster': 'gbtree', 'scale_pos_weight': 6                                                                     .188437690437864, 'alpha': 7.53769397762985, 'lambda': 8.408903863062772, 'eta': 0.9287548757417617, 'sampling_method': 'gradient_based',                                                                      'subsample': 0.901690540380821, 'gamma': 5.14308537181426}. Best is trial 84 with value: 4.259518710902867.
[I 2023-12-21 04:03:09,333] Trial 282 pruned. Trial was pruned at iteration 0.
[I 2023-12-21 04:03:09,376] Trial 283 pruned. Trial was pruned at iteration 0.
[I 2023-12-21 04:03:09,420] Trial 284 pruned. Trial was pruned at iteration 0.
[I 2023-12-21 04:03:09,462] Trial 285 pruned. Trial was pruned at iteration 0.
[I 2023-12-21 04:03:09,663] Trial 286 finished with value: 4.276319228689626 and parameters: {'learning_rate': 0.8517737352962466, 'aft_l                                                                     oss_distribution': 'normal', 'aft_loss_distribution_scale': 1.2074702678019806, 'max_depth': 7, 'booster': 'gbtree', 'scale_pos_weight':                                                                      4.228284321332716, 'alpha': 7.661412148032724, 'lambda': 8.090544126755965, 'eta': 0.2517207790537147, 'sampling_method': 'uniform', 'sub                                                                     sample': 0.9678289748425292, 'gamma': 5.80092735245835}. Best is trial 84 with value: 4.259518710902867.
[I 2023-12-21 04:03:09,705] Trial 287 pruned. Trial was pruned at iteration 0.
[I 2023-12-21 04:03:09,748] Trial 288 pruned. Trial was pruned at iteration 0.
[I 2023-12-21 04:03:09,792] Trial 289 pruned. Trial was pruned at iteration 0.
[I 2023-12-21 04:03:09,835] Trial 290 pruned. Trial was pruned at iteration 0.
