[I 2023-12-21 04:01:22,393] Trial 217 pruned. Trial was pruned at iteration 0.
[I 2023-12-21 04:01:22,504] Trial 218 finished with value: inf and parameters: {'learning_rate': 0.8819897315923705, 'aft_loss_distributi                                                                     on': 'normal', 'aft_loss_distribution_scale': 1.1493445847327048, 'max_depth': 10, 'booster': 'gbtree', 'scale_pos_weight': 2.18308672646                                                                     35345, 'alpha': 6.497536784025321, 'lambda': 0.8106430645404736, 'eta': 0.31808270800242866, 'sampling_method': 'gradient_based', 'subsam                                                                     ple': 0.9316295401018344, 'gamma': 4.226833661712076}. Best is trial 81 with value: 4.234078754776428.
[I 2023-12-21 04:01:22,547] Trial 219 pruned. Trial was pruned at iteration 1.
[I 2023-12-21 04:01:22,589] Trial 220 pruned. Trial was pruned at iteration 1.
[I 2023-12-21 04:01:22,707] Trial 221 finished with value: inf and parameters: {'learning_rate': 0.8663360051022886, 'aft_loss_distributi                                                                     on': 'normal', 'aft_loss_distribution_scale': 1.1751030027240132, 'max_depth': 10, 'booster': 'gbtree', 'scale_pos_weight': 2.57316549926                                                                     50945, 'alpha': 6.649973343790256, 'lambda': 0.12867184303286905, 'eta': 0.4638327278826824, 'sampling_method': 'gradient_based', 'subsam                                                                     ple': 0.9602760380873556, 'gamma': 3.943076606320044}. Best is trial 81 with value: 4.234078754776428.
[I 2023-12-21 04:01:22,830] Trial 222 finished with value: inf and parameters: {'learning_rate': 0.814579890694677, 'aft_loss_distributio                                                                     n': 'normal', 'aft_loss_distribution_scale': 1.1798963381307506, 'max_depth': 10, 'booster': 'gbtree', 'scale_pos_weight': 2.364084208780                                                                     5445, 'alpha': 7.262959793220437, 'lambda': 0.2682797636364829, 'eta': 0.43391556064433634, 'sampling_method': 'gradient_based', 'subsamp                                                                     le': 0.9396498623019708, 'gamma': 4.978841892124652}. Best is trial 81 with value: 4.234078754776428.
[I 2023-12-21 04:01:22,871] Trial 223 pruned. Trial was pruned at iteration 1.
[I 2023-12-21 04:01:22,910] Trial 224 pruned. Trial was pruned at iteration 0.
[I 2023-12-21 04:01:23,030] Trial 225 finished with value: inf and parameters: {'learning_rate': 0.9326003814221123, 'aft_loss_distributi                                                                     on': 'normal', 'aft_loss_distribution_scale': 1.2227342613486911, 'max_depth': 10, 'booster': 'gbtree', 'scale_pos_weight': 1.95804634201                                                                     6615, 'alpha': 7.480899658217215, 'lambda': 0.4369361577639112, 'eta': 0.35703091084996813, 'sampling_method': 'gradient_based', 'subsamp                                                                     le': 0.8904308995972083, 'gamma': 2.3362702149308845}. Best is trial 81 with value: 4.234078754776428.
[I 2023-12-21 04:01:23,071] Trial 226 pruned. Trial was pruned at iteration 1.
[I 2023-12-21 04:01:23,110] Trial 227 pruned. Trial was pruned at iteration 0.
[I 2023-12-21 04:01:23,151] Trial 228 pruned. Trial was pruned at iteration 1.
[I 2023-12-21 04:01:23,192] Trial 229 pruned. Trial was pruned at iteration 0.
[I 2023-12-21 04:01:23,232] Trial 230 pruned. Trial was pruned at iteration 0.
[I 2023-12-21 04:01:23,273] Trial 231 pruned. Trial was pruned at iteration 1.
[I 2023-12-21 04:01:23,314] Trial 232 pruned. Trial was pruned at iteration 0.
[I 2023-12-21 04:01:23,357] Trial 233 pruned. Trial was pruned at iteration 0.
[I 2023-12-21 04:01:23,473] Trial 234 finished with value: inf and parameters: {'learning_rate': 0.8568795043402389, 'aft_loss_distributi                                                                     on': 'normal', 'aft_loss_distribution_scale': 1.0007405403113818, 'max_depth': 9, 'booster': 'gbtree', 'scale_pos_weight': 2.012856736509                                                                     07, 'alpha': 6.544096752283278, 'lambda': 0.2835513617169542, 'eta': 0.4554576111292471, 'sampling_method': 'gradient_based', 'subsample'                                                                     : 0.9318169297044167, 'gamma': 3.5450517480526598}. Best is trial 81 with value: 4.234078754776428.
[I 2023-12-21 04:01:23,736] Trial 235 finished with value: 4.26538939854958 and parameters: {'learning_rate': 0.7695160023999418, 'aft_lo                                                                     ss_distribution': 'normal', 'aft_loss_distribution_scale': 1.2157566950400458, 'max_depth': 8, 'booster': 'gbtree', 'scale_pos_weight': 7                                                                     .976596685574871, 'alpha': 7.37565904805017, 'lambda': 0.6519485428731044, 'eta': 0.3159571269202465, 'sampling_method': 'gradient_based'                                                                     , 'subsample': 0.8385343361855156, 'gamma': 3.936508414414285}. Best is trial 81 with value: 4.234078754776428.
[I 2023-12-21 04:01:23,776] Trial 236 pruned. Trial was pruned at iteration 0.
[I 2023-12-21 04:01:23,889] Trial 237 finished with value: inf and parameters: {'learning_rate': 0.820118411806635, 'aft_loss_distributio                                                                     n': 'normal', 'aft_loss_distribution_scale': 1.1212154141614459, 'max_depth': 8, 'booster': 'gbtree', 'scale_pos_weight': 4.7050675575275                                                                     18, 'alpha': 7.93341958336628, 'lambda': 1.4990565856698008, 'eta': 0.3343831622606388, 'sampling_method': 'gradient_based', 'subsample':                                                                      0.8864996339724887, 'gamma': 3.9010371782383615}. Best is trial 81 with value: 4.234078754776428.
[I 2023-12-21 04:01:23,930] Trial 238 pruned. Trial was pruned at iteration 1.
[I 2023-12-21 04:01:23,969] Trial 239 pruned. Trial was pruned at iteration 0.
[I 2023-12-21 04:01:24,086] Trial 240 finished with value: inf and parameters: {'learning_rate': 0.9765590177465516, 'aft_loss_distributi                                                                     on': 'normal', 'aft_loss_distribution_scale': 0.9676031017154084, 'max_depth': 10, 'booster': 'gbtree', 'scale_pos_weight': 7.71370765282                                                                     0642, 'alpha': 7.8011492185880655, 'lambda': 8.978359230206225, 'eta': 0.3740351746383056, 'sampling_method': 'gradient_based', 'subsampl                                                                     e': 0.9126010304672036, 'gamma': 3.933710771415214}. Best is trial 81 with value: 4.234078754776428.
[I 2023-12-21 04:01:24,127] Trial 241 pruned. Trial was pruned at iteration 1.
[I 2023-12-21 04:01:24,169] Trial 242 pruned. Trial was pruned at iteration 1.
[I 2023-12-21 04:01:24,210] Trial 243 pruned. Trial was pruned at iteration 0.
[I 2023-12-21 04:01:24,250] Trial 244 pruned. Trial was pruned at iteration 0.
[I 2023-12-21 04:01:24,291] Trial 245 pruned. Trial was pruned at iteration 0.
[I 2023-12-21 04:01:24,333] Trial 246 pruned. Trial was pruned at iteration 0.
[I 2023-12-21 04:01:24,376] Trial 247 pruned. Trial was pruned at iteration 1.
[I 2023-12-21 04:01:24,416] Trial 248 pruned. Trial was pruned at iteration 0.
[I 2023-12-21 04:01:24,537] Trial 249 finished with value: inf and parameters: {'learning_rate': 0.8438038971242781, 'aft_loss_distributi                                                                     on': 'normal', 'aft_loss_distribution_scale': 1.1730291972891493, 'max_depth': 9, 'booster': 'gbtree', 'scale_pos_weight': 1.661595367889                                                                     5496, 'alpha': 6.919572641258634, 'lambda': 0.19127070002786842, 'eta': 0.3941273885355503, 'sampling_method': 'gradient_based', 'subsamp                                                                     le': 0.9868171375583789, 'gamma': 3.2362490382218363}. Best is trial 81 with value: 4.234078754776428.
[I 2023-12-21 04:01:24,584] Trial 250 pruned. Trial was pruned at iteration 1.
[I 2023-12-21 04:01:24,625] Trial 251 pruned. Trial was pruned at iteration 0.
[I 2023-12-21 04:01:24,666] Trial 252 pruned. Trial was pruned at iteration 0.
[I 2023-12-21 04:01:24,706] Trial 253 pruned. Trial was pruned at iteration 0.
[I 2023-12-21 04:01:24,746] Trial 254 pruned. Trial was pruned at iteration 0.
[I 2023-12-21 04:01:24,788] Trial 255 pruned. Trial was pruned at iteration 0.
[I 2023-12-21 04:01:24,976] Trial 256 finished with value: 4.256082782130864 and parameters: {'learning_rate': 0.780295637546708, 'aft_lo                                                                     ss_distribution': 'normal', 'aft_loss_distribution_scale': 1.1830093352541342, 'max_depth': 10, 'booster': 'gbtree', 'scale_pos_weight':                                                                      2.312498641142554, 'alpha': 7.230966114236267, 'lambda': 9.296231669683786, 'eta': 0.36562157811865414, 'sampling_method': 'gradient_base                                                                     d', 'subsample': 0.8268774786032602, 'gamma': 3.7310052087338965}. Best is trial 81 with value: 4.234078754776428.
[I 2023-12-21 04:01:25,135] Trial 257 finished with value: 4.250279252183585 and parameters: {'learning_rate': 0.8309610711145353, 'aft_l                                                                     oss_distribution': 'normal', 'aft_loss_distribution_scale': 1.1179919553947624, 'max_depth': 10, 'booster': 'gbtree', 'scale_pos_weight':                                                                      2.363214054468556, 'alpha': 7.259647935082784, 'lambda': 9.511639177222197, 'eta': 0.3680402891569913, 'sampling_method': 'gradient_base                                                                     d', 'subsample': 0.8746267939219371, 'gamma': 3.5027686704022267}. Best is trial 81 with value: 4.234078754776428.
[I 2023-12-21 04:01:25,257] Trial 258 finished with value: inf and parameters: {'learning_rate': 0.8646776816050571, 'aft_loss_distributi                                                                     on': 'normal', 'aft_loss_distribution_scale': 1.0693971173553725, 'max_depth': 10, 'booster': 'gbtree', 'scale_pos_weight': 2.51600921703                                                                     6804, 'alpha': 7.207733712654493, 'lambda': 9.162300129612438, 'eta': 0.3589700868112986, 'sampling_method': 'gradient_based', 'subsample                                                                     ': 0.8800916905643177, 'gamma': 3.110076752652529}. Best is trial 81 with value: 4.234078754776428.
[I 2023-12-21 04:01:25,300] Trial 259 pruned. Trial was pruned at iteration 0.
[I 2023-12-21 04:01:25,421] Trial 260 finished with value: inf and parameters: {'learning_rate': 0.8117625622896879, 'aft_loss_distributi                                                                     on': 'normal', 'aft_loss_distribution_scale': 1.159395233390209, 'max_depth': 10, 'booster': 'gbtree', 'scale_pos_weight': 2.167991927432                                                                     461, 'alpha': 7.399318692997998, 'lambda': 9.366714476313376, 'eta': 0.3694264081265942, 'sampling_method': 'gradient_based', 'subsample'                                                                     : 0.8661373056629581, 'gamma': 1.837194264335575}. Best is trial 81 with value: 4.234078754776428.
[I 2023-12-21 04:01:25,463] Trial 261 pruned. Trial was pruned at iteration 0.
[I 2023-12-21 04:01:25,581] Trial 262 finished with value: inf and parameters: {'learning_rate': 0.846558050866361, 'aft_loss_distributio                                                                     n': 'normal', 'aft_loss_distribution_scale': 0.9720658989020018, 'max_depth': 10, 'booster': 'gbtree', 'scale_pos_weight': 2.426367818917                                                                     212, 'alpha': 0.12220740506165129, 'lambda': 9.69579409245475, 'eta': 0.3393728270244444, 'sampling_method': 'gradient_based', 'subsample                                                                     ': 0.9223522834584577, 'gamma': 4.181219682846465}. Best is trial 81 with value: 4.234078754776428.
[I 2023-12-21 04:01:25,624] Trial 263 pruned. Trial was pruned at iteration 1.
[I 2023-12-21 04:01:25,831] Trial 264 finished with value: 4.273496854527885 and parameters: {'learning_rate': 0.8048655631507831, 'aft_l                                                                     oss_distribution': 'normal', 'aft_loss_distribution_scale': 1.244078753635637, 'max_depth': 10, 'booster': 'gbtree', 'scale_pos_weight':                                                                      2.2919446154646472, 'alpha': 6.6029870887005515, 'lambda': 8.828399684015256, 'eta': 0.38843947011125, 'sampling_method': 'gradient_based                                                                     ', 'subsample': 0.8988130811269521, 'gamma': 3.9566922043197015}. Best is trial 81 with value: 4.234078754776428.
[I 2023-12-21 04:01:25,872] Trial 265 pruned. Trial was pruned at iteration 0.
[I 2023-12-21 04:01:25,993] Trial 266 finished with value: inf and parameters: {'learning_rate': 0.7943648600601966, 'aft_loss_distributi                                                                     on': 'normal', 'aft_loss_distribution_scale': 1.1657972971373052, 'max_depth': 4, 'booster': 'gbtree', 'scale_pos_weight': 2.353609345630                                                                     0953, 'alpha': 6.560015537744196, 'lambda': 9.517734463788717, 'eta': 0.4131571171937247, 'sampling_method': 'gradient_based', 'subsample                                                                     ': 0.8892323858248464, 'gamma': 2.2913773972267886}. Best is trial 81 with value: 4.234078754776428.
[I 2023-12-21 04:01:26,033] Trial 267 pruned. Trial was pruned at iteration 0.
[I 2023-12-21 04:01:26,074] Trial 268 pruned. Trial was pruned at iteration 0.
[I 2023-12-21 04:01:26,117] Trial 269 pruned. Trial was pruned at iteration 1.
[I 2023-12-21 04:01:26,356] Trial 270 finished with value: 4.2653277430375836 and parameters: {'learning_rate': 0.7799332904657018, 'aft_                                                                     loss_distribution': 'normal', 'aft_loss_distribution_scale': 1.2097065839539891, 'max_depth': 8, 'booster': 'gbtree', 'scale_pos_weight':                                                                      2.306175718744387, 'alpha': 6.995578010624902, 'lambda': 8.508689536156314, 'eta': 0.2794347401121103, 'sampling_method': 'gradient_base                                                                     d', 'subsample': 0.8591352391894523, 'gamma': 2.0418784782991244}. Best is trial 81 with value: 4.234078754776428.
[I 2023-12-21 04:01:26,481] Trial 271 finished with value: inf and parameters: {'learning_rate': 0.7802531891789346, 'aft_loss_distributi                                                                     on': 'normal', 'aft_loss_distribution_scale': 1.1909029005868084, 'max_depth': 8, 'booster': 'gbtree', 'scale_pos_weight': 2.288513167959                                                                     9695, 'alpha': 7.016457027873538, 'lambda': 8.476797725640996, 'eta': 0.40385441348193374, 'sampling_method': 'gradient_based', 'subsampl                                                                     e': 0.8642910472580045, 'gamma': 1.6077282963804387}. Best is trial 81 with value: 4.234078754776428.
[I 2023-12-21 04:01:26,526] Trial 272 pruned. Trial was pruned at iteration 1.
[I 2023-12-21 04:01:26,568] Trial 273 pruned. Trial was pruned at iteration 1.
[I 2023-12-21 04:01:26,693] Trial 274 finished with value: inf and parameters: {'learning_rate': 0.8301691563300295, 'aft_loss_distributi                                                                     on': 'normal', 'aft_loss_distribution_scale': 1.0710221224561751, 'max_depth': 8, 'booster': 'gbtree', 'scale_pos_weight': 2.242578224493                                                                     1947, 'alpha': 8.483845234938467, 'lambda': 8.25669125427201, 'eta': 0.25795868953368245, 'sampling_method': 'gradient_based', 'subsample                                                                     ': 0.9068969400077462, 'gamma': 1.90376285042734}. Best is trial 81 with value: 4.234078754776428.
[I 2023-12-21 04:01:26,734] Trial 275 pruned. Trial was pruned at iteration 0.
[I 2023-12-21 04:01:26,775] Trial 276 pruned. Trial was pruned at iteration 0.
[I 2023-12-21 04:01:26,816] Trial 277 pruned. Trial was pruned at iteration 0.
[I 2023-12-21 04:01:26,969] Trial 278 finished with value: 4.259008536721184 and parameters: {'learning_rate': 0.8037038690499319, 'aft_l                                                                     oss_distribution': 'normal', 'aft_loss_distribution_scale': 1.011873626046359, 'max_depth': 10, 'booster': 'gbtree', 'scale_pos_weight':                                                                      1.8653965802665937, 'alpha': 7.3695267030279465, 'lambda': 9.458858518824718, 'eta': 0.3938315102208864, 'sampling_method': 'gradient_bas                                                                     ed', 'subsample': 0.9277689660666714, 'gamma': 4.033840511120557}. Best is trial 81 with value: 4.234078754776428.
[I 2023-12-21 04:01:27,011] Trial 279 pruned. Trial was pruned at iteration 0.
[I 2023-12-21 04:01:27,054] Trial 280 pruned. Trial was pruned at iteration 0.
[I 2023-12-21 04:01:27,107] Trial 281 pruned. Trial was pruned at iteration 3.
[I 2023-12-21 04:01:27,272] Trial 282 finished with value: 4.243199920528326 and parameters: {'learning_rate': 0.8278138205942647, 'aft_l                                                                     oss_distribution': 'normal', 'aft_loss_distribution_scale': 1.0868507716455793, 'max_depth': 6, 'booster': 'gbtree', 'scale_pos_weight':                                                                      2.0599717578997407, 'alpha': 7.587927737805915, 'lambda': 9.144448096260835, 'eta': 0.4339531813642613, 'sampling_method': 'gradient_base                                                                     d', 'subsample': 0.9168412841199393, 'gamma': 4.483062394238382}. Best is trial 81 with value: 4.234078754776428.
[I 2023-12-21 04:01:27,315] Trial 283 pruned. Trial was pruned at iteration 0.
[I 2023-12-21 04:01:27,356] Trial 284 pruned. Trial was pruned at iteration 0.
[I 2023-12-21 04:01:27,537] Trial 285 finished with value: 4.246351713175066 and parameters: {'learning_rate': 0.9052596513884823, 'aft_l                                                                     oss_distribution': 'normal', 'aft_loss_distribution_scale': 1.0687896049572576, 'max_depth': 6, 'booster': 'gbtree', 'scale_pos_weight':                                                                      2.0834262129388286, 'alpha': 7.653092401245266, 'lambda': 8.93780404253697, 'eta': 0.36065581182018414, 'sampling_method': 'gradient_base                                                                     d', 'subsample': 0.8803989196413692, 'gamma': 4.483461318946507}. Best is trial 81 with value: 4.234078754776428.
[I 2023-12-21 04:01:27,579] Trial 286 pruned. Trial was pruned at iteration 0.
[I 2023-12-21 04:01:27,697] Trial 287 finished with value: inf and parameters: {'learning_rate': 0.9148515903306953, 'aft_loss_distributi                                                                     on': 'normal', 'aft_loss_distribution_scale': 1.0365592394312155, 'max_depth': 6, 'booster': 'gbtree', 'scale_pos_weight': 2.043992949852                                                                     7283, 'alpha': 7.405054793710867, 'lambda': 8.860426774798524, 'eta': 0.35273093603309097, 'sampling_method': 'gradient_based', 'subsampl                                                                     e': 0.8849866746892311, 'gamma': 4.493333313123923}. Best is trial 81 with value: 4.234078754776428.
[I 2023-12-21 04:01:27,742] Trial 288 pruned. Trial was pruned at iteration 1.
[I 2023-12-21 04:01:27,886] Trial 289 finished with value: inf and parameters: {'learning_rate': 0.92862242265277, 'aft_loss_distribution                                                                     ': 'normal', 'aft_loss_distribution_scale': 1.0801710427531308, 'max_depth': 6, 'booster': 'gbtree', 'scale_pos_weight': 2.17709125086150                                                                     92, 'alpha': 6.721567510817776, 'lambda': 9.49020029355102, 'eta': 0.40304610811866814, 'sampling_method': 'gradient_based', 'subsample':                                                                      0.9179251720695659, 'gamma': 4.649063737393147}. Best is trial 81 with value: 4.234078754776428.
[I 2023-12-21 04:01:27,929] Trial 290 pruned. Trial was pruned at iteration 0.
[I 2023-12-21 04:01:27,970] Trial 291 pruned. Trial was pruned at iteration 0.
[I 2023-12-21 04:01:28,014] Trial 292 pruned. Trial was pruned at iteration 1.
[I 2023-12-21 04:01:28,056] Trial 293 pruned. Trial was pruned at iteration 0.
