[I 2023-12-19 00:01:29,472] Trial 56 finished with value: inf and parameters: {'learning_rate': 0.993590476500658, 'aft_loss_distribution': 'normal', 'aft_loss_distribution_scale': 1.4737062964477778, 'max_depth': 8, 'booster': 'gbtree', 'scale_pos_weight': 0.1616560906211706, 'alpha': 2.815683541034156, 'lambda': 0.7522431877559668, 'eta': 0.05584065984409661, 'sampling_method': 'gradient_based', 'subsample': 0.7741965273082022, 'gamma': 8.968935487566089}. Best is trial 54 with value: 2.0360232892164376.
[I 2023-12-19 00:01:29,548] Trial 57 pruned. Trial was pruned at iteration 0.
[I 2023-12-19 00:01:29,809] Trial 58 finished with value: 2.0400655368327762 and parameters: {'learning_rate': 0.837900171928087, 'aft_loss_distribution': 'normal', 'aft_loss_distribution_scale': 2.045369007374841, 'max_depth': 10, 'booster': 'gbtree', 'scale_pos_weight': 0.4529134889847266, 'alpha': 2.4330032004807807, 'lambda': 2.589654815811347, 'eta': 0.18697940585781908, 'sampling_method': 'gradient_based', 'subsample': 0.5374844339828347, 'gamma': 8.543978525929015}. Best is trial 54 with value: 2.0360232892164376.
[I 2023-12-19 00:01:30,061] Trial 59 finished with value: 2.0334314730379504 and parameters: {'learning_rate': 0.8345083305155825, 'aft_loss_distribution': 'normal', 'aft_loss_distribution_scale': 1.9860727003327454, 'max_depth': 10, 'booster': 'gbtree', 'scale_pos_weight': 0.4592804936977425, 'alpha': 2.377932202963838, 'lambda': 0.10654653443975626, 'eta': 0.14743738849446547, 'sampling_method': 'gradient_based', 'subsample': 0.5351107384413462, 'gamma': 9.957327832282571}. Best is trial 59 with value: 2.0334314730379504.
[I 2023-12-19 00:01:30,250] Trial 60 finished with value: inf and parameters: {'learning_rate': 0.9354684808062846, 'aft_loss_distribution': 'normal', 'aft_loss_distribution_scale': 2.0307670238201503, 'max_depth': 10, 'booster': 'gbtree', 'scale_pos_weight': 0.4083567189052314, 'alpha': 2.427698406080726, 'lambda': 0.2707532352420986, 'eta': 0.10061568738327246, 'sampling_method': 'gradient_based', 'subsample': 0.5363190277874289, 'gamma': 9.86954714640056}. Best is trial 59 with value: 2.0334314730379504.
[I 2023-12-19 00:01:30,448] Trial 61 finished with value: inf and parameters: {'learning_rate': 0.8488397133093528, 'aft_loss_distribution': 'normal', 'aft_loss_distribution_scale': 2.46014059216379, 'max_depth': 10, 'booster': 'gbtree', 'scale_pos_weight': 0.6647498763019329, 'alpha': 3.8071883560564532, 'lambda': 1.1641008063362093, 'eta': 0.1819301562320179, 'sampling_method': 'gradient_based', 'subsample': 0.4832495120207232, 'gamma': 9.277387711404293}. Best is trial 59 with value: 2.0334314730379504.
[I 2023-12-19 00:01:30,510] Trial 62 pruned. Trial was pruned at iteration 0.
[I 2023-12-19 00:01:30,781] Trial 63 finished with value: 2.0331242676755235 and parameters: {'learning_rate': 0.8164392229417973, 'aft_loss_distribution': 'normal', 'aft_loss_distribution_scale': 2.027098568050765, 'max_depth': 10, 'booster': 'gbtree', 'scale_pos_weight': 0.41234864803218274, 'alpha': 2.525288338151471, 'lambda': 0.5084453294496853, 'eta': 0.20798559572365444, 'sampling_method': 'gradient_based', 'subsample': 0.6799494157209122, 'gamma': 9.988841698440869}. Best is trial 63 with value: 2.0331242676755235.
[I 2023-12-19 00:01:30,846] Trial 64 pruned. Trial was pruned at iteration 0.
[I 2023-12-19 00:01:30,904] Trial 65 pruned. Trial was pruned at iteration 1.
[I 2023-12-19 00:01:31,282] Trial 66 finished with value: 2.0359726795256807 and parameters: {'learning_rate': 0.9460099415666053, 'aft_loss_distribution': 'normal', 'aft_loss_distribution_scale': 1.9993592981139514, 'max_depth': 10, 'booster': 'gbtree', 'scale_pos_weight': 0.252644267404572, 'alpha': 2.218857387462047, 'lambda': 0.6315348134430969, 'eta': 0.2669605670144942, 'sampling_method': 'gradient_based', 'subsample': 0.5390247295613017, 'gamma': 9.676282977786522}. Best is trial 63 with value: 2.0331242676755235.
[I 2023-12-19 00:01:31,385] Trial 67 pruned. Trial was pruned at iteration 11.
[I 2023-12-19 00:01:32,755] Trial 68 finished with value: inf and parameters: {'learning_rate': 0.9677503361883235, 'aft_loss_distribution': 'normal', 'aft_loss_distribution_scale': 1.9217837324651508, 'max_depth': 9, 'booster': 'dart', 'scale_pos_weight': 0.2615914297243704, 'alpha': 2.2402077847894657, 'lambda': 0.9371223941097553, 'eta': 0.0841903689198328, 'sampling_method': 'gradient_based', 'subsample': 0.6811481638692582, 'gamma': 8.057062800974212}. Best is trial 63 with value: 2.0331242676755235.
[I 2023-12-19 00:01:32,817] Trial 69 pruned. Trial was pruned at iteration 0.
[I 2023-12-19 00:01:32,881] Trial 70 pruned. Trial was pruned at iteration 1.
[I 2023-12-19 00:01:32,948] Trial 71 pruned. Trial was pruned at iteration 2.
[I 2023-12-19 00:01:33,011] Trial 72 pruned. Trial was pruned at iteration 0.
[I 2023-12-19 00:01:33,196] Trial 73 finished with value: inf and parameters: {'learning_rate': 0.8077137034315224, 'aft_loss_distribution': 'normal', 'aft_loss_distribution_scale': 2.0448365873672247, 'max_depth': 10, 'booster': 'gbtree', 'scale_pos_weight': 0.1583762262216622, 'alpha': 2.0913545477432485, 'lambda': 0.6535167292597996, 'eta': 0.28617774466726653, 'sampling_method': 'gradient_based', 'subsample': 0.7415622695527875, 'gamma': 9.963307547491763}. Best is trial 63 with value: 2.0331242676755235.
[I 2023-12-19 00:01:33,446] Trial 74 finished with value: 2.0055561730008655 and parameters: {'learning_rate': 0.951895876217557, 'aft_loss_distribution': 'normal', 'aft_loss_distribution_scale': 1.6616336913591887, 'max_depth': 9, 'booster': 'gbtree', 'scale_pos_weight': 0.2774109806862906, 'alpha': 3.2885572395798355, 'lambda': 2.1759449460253366, 'eta': 0.2502713427294005, 'sampling_method': 'gradient_based', 'subsample': 0.6702251002123185, 'gamma': 9.4291471474244}. Best is trial 74 with value: 2.0055561730008655.
[I 2023-12-19 00:01:33,633] Trial 75 finished with value: inf and parameters: {'learning_rate': 0.9606742503286704, 'aft_loss_distribution': 'normal', 'aft_loss_distribution_scale': 1.1998639596598737, 'max_depth': 9, 'booster': 'gbtree', 'scale_pos_weight': 0.30221114923390213, 'alpha': 3.249435260951543, 'lambda': 1.3883326764147288, 'eta': 0.23056553004376246, 'sampling_method': 'gradient_based', 'subsample': 0.6713062702662751, 'gamma': 9.716637539341086}. Best is trial 74 with value: 2.0055561730008655.
[I 2023-12-19 00:01:33,820] Trial 76 finished with value: inf and parameters: {'learning_rate': 0.9108395306065924, 'aft_loss_distribution': 'normal', 'aft_loss_distribution_scale': 1.675924954434881, 'max_depth': 9, 'booster': 'gbtree', 'scale_pos_weight': 0.4454384073229444, 'alpha': 3.563324762213841, 'lambda': 2.1039734251099182, 'eta': 0.25278203201035954, 'sampling_method': 'gradient_based', 'subsample': 0.7107426082520398, 'gamma': 9.032224588166883}. Best is trial 74 with value: 2.0055561730008655.
[I 2023-12-19 00:01:33,882] Trial 77 pruned. Trial was pruned at iteration 0.
[I 2023-12-19 00:01:33,936] Trial 78 pruned. Trial was pruned at iteration 0.
[I 2023-12-19 00:01:33,998] Trial 79 pruned. Trial was pruned at iteration 0.
[I 2023-12-19 00:01:34,069] Trial 80 pruned. Trial was pruned at iteration 0.
[I 2023-12-19 00:01:34,139] Trial 81 pruned. Trial was pruned at iteration 0.
[I 2023-12-19 00:01:34,194] Trial 82 pruned. Trial was pruned at iteration 0.
[I 2023-12-19 00:01:34,267] Trial 83 pruned. Trial was pruned at iteration 3.
[I 2023-12-19 00:01:34,324] Trial 84 pruned. Trial was pruned at iteration 0.
[I 2023-12-19 00:01:34,383] Trial 85 pruned. Trial was pruned at iteration 0.
[I 2023-12-19 00:01:34,454] Trial 86 pruned. Trial was pruned at iteration 0.
[I 2023-12-19 00:01:34,704] Trial 87 finished with value: inf and parameters: {'learning_rate': 0.8431888857511118, 'aft_loss_distribution': 'normal', 'aft_loss_distribution_scale': 1.844312201874698, 'max_depth': 10, 'booster': 'gbtree', 'scale_pos_weight': 0.37164609581266767, 'alpha': 2.52932506671511, 'lambda': 2.7685363106049183, 'eta': 0.13780783434801525, 'sampling_method': 'gradient_based', 'subsample': 0.682648840581578, 'gamma': 8.52658249466298}. Best is trial 74 with value: 2.0055561730008655.
[I 2023-12-19 00:01:34,765] Trial 88 pruned. Trial was pruned at iteration 0.
[I 2023-12-19 00:01:34,822] Trial 89 pruned. Trial was pruned at iteration 0.
[I 2023-12-19 00:01:34,889] Trial 90 pruned. Trial was pruned at iteration 0.
[I 2023-12-19 00:01:34,946] Trial 91 pruned. Trial was pruned at iteration 0.
[I 2023-12-19 00:01:35,003] Trial 92 pruned. Trial was pruned at iteration 0.
[I 2023-12-19 00:01:35,210] Trial 93 finished with value: inf and parameters: {'learning_rate': 0.8779350384841114, 'aft_loss_distribution': 'normal', 'aft_loss_distribution_scale': 1.9899499726146437, 'max_depth': 9, 'booster': 'gbtree', 'scale_pos_weight': 0.636506849473411, 'alpha': 3.6040680779513283, 'lambda': 2.203167304183943, 'eta': 0.2370020614448582, 'sampling_method': 'gradient_based', 'subsample': 0.5158017067544601, 'gamma': 9.785612433031579}. Best is trial 74 with value: 2.0055561730008655.
[I 2023-12-19 00:01:35,277] Trial 94 pruned. Trial was pruned at iteration 0.
[I 2023-12-19 00:01:35,337] Trial 95 pruned. Trial was pruned at iteration 1.
[I 2023-12-19 00:01:35,546] Trial 96 finished with value: inf and parameters: {'learning_rate': 0.9125087732243028, 'aft_loss_distribution': 'normal', 'aft_loss_distribution_scale': 1.692668871517871, 'max_depth': 10, 'booster': 'gbtree', 'scale_pos_weight': 0.03784149419632393, 'alpha': 0.03856304229873886, 'lambda': 1.6738678182243598, 'eta': 0.17334667152111605, 'sampling_method': 'gradient_based', 'subsample': 0.6498704368003323, 'gamma': 8.853831046496165}. Best is trial 74 with value: 2.0055561730008655.
[I 2023-12-19 00:01:35,608] Trial 97 pruned. Trial was pruned at iteration 0.
[I 2023-12-19 00:01:35,668] Trial 98 pruned. Trial was pruned at iteration 0.
[I 2023-12-19 00:01:35,731] Trial 99 pruned. Trial was pruned at iteration 0.
[I 2023-12-19 00:01:36,015] Trial 100 finished with value: 2.0323838837403634 and parameters: {'learning_rate': 0.8485762461468923, 'aft_loss_distribution': 'normal', 'aft_loss_distribution_scale': 1.870817266643749, 'max_depth': 9, 'booster': 'gbtree', 'scale_pos_weight': 0.7196159117514023, 'alpha': 2.2389285233904133, 'lambda': 0.26675812379284825, 'eta': 0.1520981901715489, 'sampling_method': 'gradient_based', 'subsample': 0.5358484703652534, 'gamma': 8.000345141250403}. Best is trial 74 with value: 2.0055561730008655.
[I 2023-12-19 00:01:36,300] Trial 101 finished with value: inf and parameters: {'learning_rate': 0.8402188804338981, 'aft_loss_distribution': 'normal', 'aft_loss_distribution_scale': 1.910659462006984, 'max_depth': 9, 'booster': 'gbtree', 'scale_pos_weight': 0.7045452761494609, 'alpha': 2.214296410259703, 'lambda': 0.009445992122456448, 'eta': 0.15157187153882443, 'sampling_method': 'gradient_based', 'subsample': 0.5218379486187121, 'gamma': 9.483137872491188}. Best is trial 74 with value: 2.0055561730008655.
[I 2023-12-19 00:01:36,403] Trial 102 pruned. Trial was pruned at iteration 0.
[I 2023-12-19 00:01:36,492] Trial 103 pruned. Trial was pruned at iteration 0.
[I 2023-12-19 00:01:36,585] Trial 104 pruned. Trial was pruned at iteration 2.
[I 2023-12-19 00:01:36,673] Trial 105 pruned. Trial was pruned at iteration 0.
[I 2023-12-19 00:01:36,758] Trial 106 pruned. Trial was pruned at iteration 0.
[I 2023-12-19 00:01:36,856] Trial 107 pruned. Trial was pruned at iteration 0.
[I 2023-12-19 00:01:36,960] Trial 108 pruned. Trial was pruned at iteration 0.
[I 2023-12-19 00:01:37,246] Trial 109 finished with value: inf and parameters: {'learning_rate': 0.8736794556564274, 'aft_loss_distribution': 'normal', 'aft_loss_distribution_scale': 1.595541931096979, 'max_depth': 10, 'booster': 'gbtree', 'scale_pos_weight': 0.13619968861526102, 'alpha': 2.2009259631896296, 'lambda': 1.4223544187855908, 'eta': 0.18241478017798246, 'sampling_method': 'gradient_based', 'subsample': 0.5005457247409344, 'gamma': 9.842977455724649}. Best is trial 74 with value: 2.0055561730008655.
[I 2023-12-19 00:01:37,347] Trial 110 pruned. Trial was pruned at iteration 0.
[I 2023-12-19 00:01:37,449] Trial 111 pruned. Trial was pruned at iteration 0.
[I 2023-12-19 00:01:37,539] Trial 112 pruned. Trial was pruned at iteration 0.
[I 2023-12-19 00:01:37,628] Trial 113 pruned. Trial was pruned at iteration 0.
[I 2023-12-19 00:01:37,717] Trial 114 pruned. Trial was pruned at iteration 0.
[I 2023-12-19 00:01:37,809] Trial 115 pruned. Trial was pruned at iteration 0.
[I 2023-12-19 00:01:37,898] Trial 116 pruned. Trial was pruned at iteration 0.
[I 2023-12-19 00:01:37,985] Trial 117 pruned. Trial was pruned at iteration 0.
[I 2023-12-19 00:01:38,078] Trial 118 pruned. Trial was pruned at iteration 0.
[I 2023-12-19 00:01:38,171] Trial 119 pruned. Trial was pruned at iteration 0.
[I 2023-12-19 00:01:38,269] Trial 120 pruned. Trial was pruned at iteration 0.
[I 2023-12-19 00:01:38,370] Trial 121 pruned. Trial was pruned at iteration 0.
[I 2023-12-19 00:01:38,473] Trial 122 pruned. Trial was pruned at iteration 0.
[I 2023-12-19 00:01:38,571] Trial 123 pruned. Trial was pruned at iteration 0.
[I 2023-12-19 00:01:38,664] Trial 124 pruned. Trial was pruned at iteration 0.
[I 2023-12-19 00:01:38,758] Trial 125 pruned. Trial was pruned at iteration 0.
[I 2023-12-19 00:01:38,858] Trial 126 pruned. Trial was pruned at iteration 0.
[I 2023-12-19 00:01:38,964] Trial 127 pruned. Trial was pruned at iteration 0.
[I 2023-12-19 00:01:39,883] Trial 128 finished with value: 2.0114196162232156 and parameters: {'learning_rate': 0.8957675867676593, 'aft_loss_distribution': 'normal', 'aft_loss_distribution_scale': 1.651561692933093, 'max_depth': 10, 'booster': 'gbtree', 'scale_pos_weight': 0.8332162662254505, 'alpha': 2.1512076186308677, 'lambda': 1.1008097196455062, 'eta': 0.21645535748485134, 'sampling_method': 'gradient_based', 'subsample': 0.6166133917272848, 'gamma': 8.47143575415038}. Best is trial 74 with value: 2.0055561730008655.
[I 2023-12-19 00:01:39,986] Trial 129 pruned. Trial was pruned at iteration 0.
[I 2023-12-19 00:01:40,275] Trial 130 finished with value: inf and parameters: {'learning_rate': 0.8799407692912437, 'aft_loss_distribution': 'normal', 'aft_loss_distribution_scale': 1.7085076682470326, 'max_depth': 9, 'booster': 'gbtree', 'scale_pos_weight': 1.352863947692476, 'alpha': 2.5667170626404547, 'lambda': 1.4945524647331516, 'eta': 0.1846229315971798, 'sampling_method': 'gradient_based', 'subsample': 0.5573495781263009, 'gamma': 8.504613855924704}. Best is trial 74 with value: 2.0055561730008655.
[I 2023-12-19 00:01:40,701] Trial 131 finished with value: 2.0281058412184096 and parameters: {'learning_rate': 0.8379680639430841, 'aft_loss_distribution': 'normal', 'aft_loss_distribution_scale': 1.9820783321606181, 'max_depth': 10, 'booster': 'gbtree', 'scale_pos_weight': 0.7567453365915212, 'alpha': 2.264806492318743, 'lambda': 0.2153094556107425, 'eta': 0.20380579364860618, 'sampling_method': 'gradient_based', 'subsample': 0.6457046779315104, 'gamma': 9.112908963074421}. Best is trial 74 with value: 2.0055561730008655.
[I 2023-12-19 00:01:40,956] Trial 132 finished with value: inf and parameters: {'learning_rate': 0.9425231913319767, 'aft_loss_distribution': 'normal', 'aft_loss_distribution_scale': 1.8867470925617507, 'max_depth': 10, 'booster': 'gbtree', 'scale_pos_weight': 1.0904395947783545, 'alpha': 2.174127906728636, 'lambda': 0.2204940368299783, 'eta': 0.2042945718490686, 'sampling_method': 'gradient_based', 'subsample': 0.6388844001825538, 'gamma': 8.1734603693524}. Best is trial 74 with value: 2.0055561730008655.
[I 2023-12-19 00:01:41,065] Trial 133 pruned. Trial was pruned at iteration 0.
[I 2023-12-19 00:01:41,146] Trial 134 pruned. Trial was pruned at iteration 1.
[I 2023-12-19 00:01:41,214] Trial 135 pruned. Trial was pruned at iteration 1.
[I 2023-12-19 00:01:41,423] Trial 136 finished with value: inf and parameters: {'learning_rate': 0.8943870645249776, 'aft_loss_distribution': 'normal', 'aft_loss_distribution_scale': 2.0040969959912522, 'max_depth': 10, 'booster': 'gbtree', 'scale_pos_weight': 0.6836440216423691, 'alpha': 2.707067460846332, 'lambda': 1.232247691845809, 'eta': 0.2810221772975544, 'sampling_method': 'gradient_based', 'subsample': 0.6718999133212458, 'gamma': 9.239691944728134}. Best is trial 74 with value: 2.0055561730008655.
[I 2023-12-19 00:01:41,496] Trial 137 pruned. Trial was pruned at iteration 0.
[I 2023-12-19 00:01:41,568] Trial 138 pruned. Trial was pruned at iteration 0.
[I 2023-12-19 00:01:41,634] Trial 139 pruned. Trial was pruned at iteration 0.
[I 2023-12-19 00:01:41,697] Trial 140 pruned. Trial was pruned at iteration 0.
[I 2023-12-19 00:01:41,763] Trial 141 pruned. Trial was pruned at iteration 0.
[I 2023-12-19 00:01:42,080] Trial 142 finished with value: 2.020907848616374 and parameters: {'learning_rate': 0.8687211033294446, 'aft_loss_distribution': 'normal', 'aft_loss_distribution_scale': 1.8789338811273322, 'max_depth': 10, 'booster': 'gbtree', 'scale_pos_weight': 0.3474243514771099, 'alpha': 2.4008863178600146, 'lambda': 1.9188430511050485, 'eta': 0.24576285916702761, 'sampling_method': 'gradient_based', 'subsample': 0.6382146086354121, 'gamma': 9.665213943492565}. Best is trial 74 with value: 2.0055561730008655.
[I 2023-12-19 00:01:42,153] Trial 143 pruned. Trial was pruned at iteration 0.
[I 2023-12-19 00:01:42,230] Trial 144 pruned. Trial was pruned at iteration 1.
[I 2023-12-19 00:01:42,306] Trial 145 pruned. Trial was pruned at iteration 1.
[I 2023-12-19 00:01:42,375] Trial 146 pruned. Trial was pruned at iteration 0.
[I 2023-12-19 00:01:42,446] Trial 147 pruned. Trial was pruned at iteration 0.
[I 2023-12-19 00:01:42,517] Trial 148 pruned. Trial was pruned at iteration 0.
[I 2023-12-19 00:01:42,582] Trial 149 pruned. Trial was pruned at iteration 0.
[I 2023-12-19 00:01:42,654] Trial 150 pruned. Trial was pruned at iteration 1.
[I 2023-12-19 00:01:42,719] Trial 151 pruned. Trial was pruned at iteration 0.
[I 2023-12-19 00:01:42,781] Trial 152 pruned. Trial was pruned at iteration 0.
[I 2023-12-19 00:01:42,846] Trial 153 pruned. Trial was pruned at iteration 0.
[I 2023-12-19 00:01:42,924] Trial 154 pruned. Trial was pruned at iteration 2.
[I 2023-12-19 00:01:43,144] Trial 155 finished with value: inf and parameters: {'learning_rate': 0.9454483978625299, 'aft_loss_distribution': 'normal', 'aft_loss_distribution_scale': 1.7974687749015492, 'max_depth': 10, 'booster': 'gbtree', 'scale_pos_weight': 0.4911612211736098, 'alpha': 1.87776457921722, 'lambda': 2.0615824748889358, 'eta': 0.1535363273037926, 'sampling_method': 'gradient_based', 'subsample': 0.6411269783738676, 'gamma': 8.763668804609129}. Best is trial 74 with value: 2.0055561730008655.
[I 2023-12-19 00:01:43,226] Trial 156 pruned. Trial was pruned at iteration 0.
[I 2023-12-19 00:01:43,292] Trial 157 pruned. Trial was pruned at iteration 1.
[I 2023-12-19 00:01:43,363] Trial 158 pruned. Trial was pruned at iteration 0.
[I 2023-12-19 00:01:43,432] Trial 159 pruned. Trial was pruned at iteration 0.
[I 2023-12-19 00:01:43,511] Trial 160 pruned. Trial was pruned at iteration 0.
[I 2023-12-19 00:01:43,579] Trial 161 pruned. Trial was pruned at iteration 0.
[I 2023-12-19 00:01:43,647] Trial 162 pruned. Trial was pruned at iteration 0.
[I 2023-12-19 00:01:43,720] Trial 163 pruned. Trial was pruned at iteration 0.
[I 2023-12-19 00:01:43,783] Trial 164 pruned. Trial was pruned at iteration 0.
[I 2023-12-19 00:01:43,851] Trial 165 pruned. Trial was pruned at iteration 0.
[I 2023-12-19 00:01:43,916] Trial 166 pruned. Trial was pruned at iteration 0.
[I 2023-12-19 00:01:43,982] Trial 167 pruned. Trial was pruned at iteration 0.
[I 2023-12-19 00:01:44,056] Trial 168 pruned. Trial was pruned at iteration 0.
[I 2023-12-19 00:01:44,136] Trial 169 pruned. Trial was pruned at iteration 0.
[I 2023-12-19 00:01:44,203] Trial 170 pruned. Trial was pruned at iteration 0.
[I 2023-12-19 00:01:44,272] Trial 171 pruned. Trial was pruned at iteration 0.
[I 2023-12-19 00:01:44,341] Trial 172 pruned. Trial was pruned at iteration 0.
[I 2023-12-19 00:01:44,413] Trial 173 pruned. Trial was pruned at iteration 0.
[I 2023-12-19 00:01:44,503] Trial 174 pruned. Trial was pruned at iteration 0.
[I 2023-12-19 00:01:44,574] Trial 175 pruned. Trial was pruned at iteration 0.
[I 2023-12-19 00:01:44,653] Trial 176 pruned. Trial was pruned at iteration 0.
[I 2023-12-19 00:01:44,724] Trial 177 pruned. Trial was pruned at iteration 0.
[I 2023-12-19 00:01:44,797] Trial 178 pruned. Trial was pruned at iteration 0.
[I 2023-12-19 00:01:44,867] Trial 179 pruned. Trial was pruned at iteration 0.
[I 2023-12-19 00:01:44,935] Trial 180 pruned. Trial was pruned at iteration 0.
[I 2023-12-19 00:01:45,008] Trial 181 pruned. Trial was pruned at iteration 1.
[I 2023-12-19 00:01:45,083] Trial 182 pruned. Trial was pruned at iteration 1.
[I 2023-12-19 00:01:45,158] Trial 183 pruned. Trial was pruned at iteration 0.
[I 2023-12-19 00:01:45,232] Trial 184 pruned. Trial was pruned at iteration 0.
[I 2023-12-19 00:01:45,304] Trial 185 pruned. Trial was pruned at iteration 0.
[I 2023-12-19 00:01:45,372] Trial 186 pruned. Trial was pruned at iteration 0.
[I 2023-12-19 00:01:45,441] Trial 187 pruned. Trial was pruned at iteration 0.
[I 2023-12-19 00:01:45,510] Trial 188 pruned. Trial was pruned at iteration 0.
[I 2023-12-19 00:01:45,598] Trial 189 pruned. Trial was pruned at iteration 0.
[I 2023-12-19 00:01:45,665] Trial 190 pruned. Trial was pruned at iteration 0.
[I 2023-12-19 00:01:45,737] Trial 191 pruned. Trial was pruned at iteration 0.
[I 2023-12-19 00:01:45,810] Trial 192 pruned. Trial was pruned at iteration 0.
[I 2023-12-19 00:01:45,883] Trial 193 pruned. Trial was pruned at iteration 0.
[I 2023-12-19 00:01:45,956] Trial 194 pruned. Trial was pruned at iteration 0.
