[I 2023-12-21 04:03:39,030] Trial 58 finished with value: inf and parameters: {'learning_rate': 0.6353539806851015, 'aft_loss_distributio                                                                     n': 'normal', 'aft_loss_distribution_scale': 0.9728988680378179, 'max_depth': 9, 'booster': 'gbtree', 'scale_pos_weight': 7.7133094004267                                                                     56, 'alpha': 9.452111473271444, 'lambda': 1.0801515031073827, 'eta': 0.25188937151265856, 'sampling_method': 'uniform', 'subsample': 0.61                                                                     23004945144973, 'gamma': 4.808374120046975}. Best is trial 56 with value: 4.467337257601949.
[I 2023-12-21 04:03:39,128] Trial 59 pruned. Trial was pruned at iteration 66.
[I 2023-12-21 04:03:39,232] Trial 60 pruned. Trial was pruned at iteration 72.
[I 2023-12-21 04:03:39,269] Trial 61 pruned. Trial was pruned at iteration 3.
[I 2023-12-21 04:03:39,379] Trial 62 pruned. Trial was pruned at iteration 75.
[I 2023-12-21 04:03:39,476] Trial 63 finished with value: inf and parameters: {'learning_rate': 0.7634473285559131, 'aft_loss_distributio                                                                     n': 'normal', 'aft_loss_distribution_scale': 2.1125924864882086, 'max_depth': 8, 'booster': 'gbtree', 'scale_pos_weight': 5.9103683284788                                                                     73, 'alpha': 5.377247103322792, 'lambda': 2.4744960793229502, 'eta': 0.04544708243746154, 'sampling_method': 'uniform', 'subsample': 0.44                                                                     694041704575616, 'gamma': 4.075036690231762}. Best is trial 56 with value: 4.467337257601949.
[I 2023-12-21 04:03:39,579] Trial 64 finished with value: inf and parameters: {'learning_rate': 0.7091530685157263, 'aft_loss_distributio                                                                     n': 'normal', 'aft_loss_distribution_scale': 1.224194585203662, 'max_depth': 10, 'booster': 'gbtree', 'scale_pos_weight': 8.1320913753973                                                                     5, 'alpha': 6.33814115978287, 'lambda': 3.278042847775431, 'eta': 0.380403280590074, 'sampling_method': 'uniform', 'subsample': 0.5431164                                                                     420587029, 'gamma': 4.4419838985716}. Best is trial 56 with value: 4.467337257601949.
[I 2023-12-21 04:03:39,616] Trial 65 pruned. Trial was pruned at iteration 3.
[I 2023-12-21 04:03:39,655] Trial 66 pruned. Trial was pruned at iteration 0.
[I 2023-12-21 04:03:39,777] Trial 67 pruned. Trial was pruned at iteration 88.
[I 2023-12-21 04:03:39,901] Trial 68 pruned. Trial was pruned at iteration 75.
[I 2023-12-21 04:03:39,939] Trial 69 pruned. Trial was pruned at iteration 3.
[I 2023-12-21 04:03:39,974] Trial 70 pruned. Trial was pruned at iteration 0.
[I 2023-12-21 04:03:40,010] Trial 71 pruned. Trial was pruned at iteration 0.
[I 2023-12-21 04:03:40,044] Trial 72 pruned. Trial was pruned at iteration 0.
[I 2023-12-21 04:03:41,989] Trial 73 pruned. Trial was pruned at iteration 75.
[I 2023-12-21 04:03:42,024] Trial 74 pruned. Trial was pruned at iteration 0.
[I 2023-12-21 04:03:42,058] Trial 75 pruned. Trial was pruned at iteration 0.
[I 2023-12-21 04:03:42,092] Trial 76 pruned. Trial was pruned at iteration 0.
[I 2023-12-21 04:03:42,127] Trial 77 pruned. Trial was pruned at iteration 0.
[I 2023-12-21 04:03:42,161] Trial 78 pruned. Trial was pruned at iteration 0.
[I 2023-12-21 04:03:42,201] Trial 79 pruned. Trial was pruned at iteration 0.
[I 2023-12-21 04:03:42,237] Trial 80 pruned. Trial was pruned at iteration 0.
[I 2023-12-21 04:03:42,272] Trial 81 pruned. Trial was pruned at iteration 0.
[I 2023-12-21 04:03:42,309] Trial 82 pruned. Trial was pruned at iteration 0.
[I 2023-12-21 04:03:42,343] Trial 83 pruned. Trial was pruned at iteration 0.
[I 2023-12-21 04:03:42,378] Trial 84 pruned. Trial was pruned at iteration 0.
[I 2023-12-21 04:03:42,413] Trial 85 pruned. Trial was pruned at iteration 0.
[I 2023-12-21 04:03:42,455] Trial 86 pruned. Trial was pruned at iteration 3.
[I 2023-12-21 04:03:42,490] Trial 87 pruned. Trial was pruned at iteration 0.
[I 2023-12-21 04:03:42,524] Trial 88 pruned. Trial was pruned at iteration 0.
[I 2023-12-21 04:03:42,560] Trial 89 pruned. Trial was pruned at iteration 0.
[I 2023-12-21 04:03:42,596] Trial 90 pruned. Trial was pruned at iteration 0.
[I 2023-12-21 04:03:42,632] Trial 91 pruned. Trial was pruned at iteration 0.
[I 2023-12-21 04:03:42,669] Trial 92 pruned. Trial was pruned at iteration 0.
[I 2023-12-21 04:03:42,704] Trial 93 pruned. Trial was pruned at iteration 0.
[I 2023-12-21 04:03:43,750] Trial 94 finished with value: inf and parameters: {'learning_rate': 0.6892420112294946, 'aft_loss_distributio                                                                     n': 'normal', 'aft_loss_distribution_scale': 1.9923838854930487, 'max_depth': 4, 'booster': 'dart', 'scale_pos_weight': 6.934862122046802                                                                     , 'alpha': 9.538819233832118, 'lambda': 7.429352826872911, 'eta': 0.6645958633092413, 'sampling_method': 'gradient_based', 'subsample': 0                                                                     .05001108677301255, 'gamma': 6.398759645779085}. Best is trial 56 with value: 4.467337257601949.
[I 2023-12-21 04:03:43,786] Trial 95 pruned. Trial was pruned at iteration 0.
[I 2023-12-21 04:03:43,829] Trial 96 pruned. Trial was pruned at iteration 3.
[I 2023-12-21 04:03:43,865] Trial 97 pruned. Trial was pruned at iteration 0.
[I 2023-12-21 04:03:43,901] Trial 98 pruned. Trial was pruned at iteration 0.
[I 2023-12-21 04:03:43,936] Trial 99 pruned. Trial was pruned at iteration 0.
[I 2023-12-21 04:03:43,973] Trial 100 pruned. Trial was pruned at iteration 0.
[I 2023-12-21 04:03:44,009] Trial 101 pruned. Trial was pruned at iteration 0.
[I 2023-12-21 04:03:44,047] Trial 102 pruned. Trial was pruned at iteration 0.
[I 2023-12-21 04:03:44,084] Trial 103 pruned. Trial was pruned at iteration 0.
[I 2023-12-21 04:03:44,120] Trial 104 pruned. Trial was pruned at iteration 0.
[I 2023-12-21 04:03:44,158] Trial 105 pruned. Trial was pruned at iteration 2.
[I 2023-12-21 04:03:44,201] Trial 106 pruned. Trial was pruned at iteration 2.
[I 2023-12-21 04:03:44,238] Trial 107 pruned. Trial was pruned at iteration 0.
[I 2023-12-21 04:03:44,274] Trial 108 pruned. Trial was pruned at iteration 0.
[I 2023-12-21 04:03:44,313] Trial 109 pruned. Trial was pruned at iteration 0.
[I 2023-12-21 04:03:45,454] Trial 110 finished with value: inf and parameters: {'learning_rate': 0.6184734649270578, 'aft_loss_distributi                                                                     on': 'normal', 'aft_loss_distribution_scale': 1.4722718671026933, 'max_depth': 3, 'booster': 'dart', 'scale_pos_weight': 8.00594477907992                                                                     5, 'alpha': 4.158988976359847, 'lambda': 3.8746746288681515, 'eta': 0.9995162083628556, 'sampling_method': 'gradient_based', 'subsample':                                                                      0.3869860819158926, 'gamma': 2.0359347939660113}. Best is trial 56 with value: 4.467337257601949.
[I 2023-12-21 04:03:45,493] Trial 111 pruned. Trial was pruned at iteration 0.
[I 2023-12-21 04:03:45,530] Trial 112 pruned. Trial was pruned at iteration 0.
[I 2023-12-21 04:03:45,573] Trial 113 pruned. Trial was pruned at iteration 0.
[I 2023-12-21 04:03:45,610] Trial 114 pruned. Trial was pruned at iteration 0.
[I 2023-12-21 04:03:45,647] Trial 115 pruned. Trial was pruned at iteration 0.
[I 2023-12-21 04:03:45,684] Trial 116 pruned. Trial was pruned at iteration 0.
[I 2023-12-21 04:03:45,721] Trial 117 pruned. Trial was pruned at iteration 0.
[I 2023-12-21 04:03:45,757] Trial 118 pruned. Trial was pruned at iteration 0.
[I 2023-12-21 04:03:45,794] Trial 119 pruned. Trial was pruned at iteration 0.
[I 2023-12-21 04:03:45,839] Trial 120 pruned. Trial was pruned at iteration 2.
[I 2023-12-21 04:03:45,966] Trial 121 pruned. Trial was pruned at iteration 88.
[I 2023-12-21 04:03:46,008] Trial 122 pruned. Trial was pruned at iteration 4.
[I 2023-12-21 04:03:46,167] Trial 123 finished with value: inf and parameters: {'learning_rate': 0.6277847973583539, 'aft_loss_distributi                                                                     on': 'normal', 'aft_loss_distribution_scale': 1.0914240430669926, 'max_depth': 10, 'booster': 'gbtree', 'scale_pos_weight': 5.66094981146                                                                     963, 'alpha': 8.263711365015071, 'lambda': 1.5215066560242452, 'eta': 0.4061209482608392, 'sampling_method': 'uniform', 'subsample': 0.74                                                                     0797864187936, 'gamma': 1.253699060840987}. Best is trial 56 with value: 4.467337257601949.
[I 2023-12-21 04:03:46,294] Trial 124 finished with value: 4.304133954552307 and parameters: {'learning_rate': 0.7899639944809105, 'aft_l                                                                     oss_distribution': 'normal', 'aft_loss_distribution_scale': 1.3171211039643627, 'max_depth': 10, 'booster': 'gbtree', 'scale_pos_weight':                                                                      7.096406395395757, 'alpha': 8.12391421331021, 'lambda': 0.9076243189376358, 'eta': 0.866500617889685, 'sampling_method': 'uniform', 'sub                                                                     sample': 0.5698437714944273, 'gamma': 4.610997706303267}. Best is trial 124 with value: 4.304133954552307.
[I 2023-12-21 04:03:46,331] Trial 125 pruned. Trial was pruned at iteration 0.
[I 2023-12-21 04:03:46,369] Trial 126 pruned. Trial was pruned at iteration 0.
[I 2023-12-21 04:03:46,524] Trial 127 finished with value: 4.29954991379438 and parameters: {'learning_rate': 0.6134828404821225, 'aft_lo                                                                     ss_distribution': 'normal', 'aft_loss_distribution_scale': 1.325983850648268, 'max_depth': 3, 'booster': 'gbtree', 'scale_pos_weight': 7.                                                                     122795626489326, 'alpha': 7.265211652759321, 'lambda': 0.37404525331254934, 'eta': 0.9119965168170503, 'sampling_method': 'uniform', 'sub                                                                     sample': 0.6039903119642629, 'gamma': 6.905635756381383}. Best is trial 127 with value: 4.29954991379438.
[I 2023-12-21 04:03:46,636] Trial 128 finished with value: inf and parameters: {'learning_rate': 0.6026020234150068, 'aft_loss_distributi                                                                     on': 'normal', 'aft_loss_distribution_scale': 1.3478497706409007, 'max_depth': 3, 'booster': 'gbtree', 'scale_pos_weight': 7.347901134192                                                                     5675, 'alpha': 7.208088327298888, 'lambda': 0.589353811710692, 'eta': 0.8925047121623251, 'sampling_method': 'uniform', 'subsample': 0.60                                                                     234616248343, 'gamma': 2.446790036514697}. Best is trial 127 with value: 4.29954991379438.
[I 2023-12-21 04:03:46,675] Trial 129 pruned. Trial was pruned at iteration 0.
[I 2023-12-21 04:03:46,712] Trial 130 pruned. Trial was pruned at iteration 0.
[I 2023-12-21 04:03:46,837] Trial 131 pruned. Trial was pruned at iteration 87.
[I 2023-12-21 04:03:46,875] Trial 132 pruned. Trial was pruned at iteration 0.
[I 2023-12-21 04:03:46,912] Trial 133 pruned. Trial was pruned at iteration 0.
[I 2023-12-21 04:03:46,950] Trial 134 pruned. Trial was pruned at iteration 0.
[I 2023-12-21 04:03:46,989] Trial 135 pruned. Trial was pruned at iteration 0.
[I 2023-12-21 04:03:47,028] Trial 136 pruned. Trial was pruned at iteration 0.
[I 2023-12-21 04:03:47,065] Trial 137 pruned. Trial was pruned at iteration 0.
[I 2023-12-21 04:03:47,104] Trial 138 pruned. Trial was pruned at iteration 0.
[I 2023-12-21 04:03:47,141] Trial 139 pruned. Trial was pruned at iteration 0.
[I 2023-12-21 04:03:47,179] Trial 140 pruned. Trial was pruned at iteration 0.
[I 2023-12-21 04:03:47,295] Trial 141 finished with value: inf and parameters: {'learning_rate': 0.571048735123747, 'aft_loss_distributio                                                                     n': 'normal', 'aft_loss_distribution_scale': 1.7085619188979637, 'max_depth': 10, 'booster': 'gbtree', 'scale_pos_weight': 6.809156759566                                                                     181, 'alpha': 8.132616456894928, 'lambda': 3.5345687223581765, 'eta': 0.5545909433631462, 'sampling_method': 'uniform', 'subsample': 0.68                                                                     022062243716, 'gamma': 4.490237895114046}. Best is trial 127 with value: 4.29954991379438.
[I 2023-12-21 04:03:47,335] Trial 142 pruned. Trial was pruned at iteration 0.
[I 2023-12-21 04:03:47,375] Trial 143 pruned. Trial was pruned at iteration 1.
[I 2023-12-21 04:03:47,415] Trial 144 pruned. Trial was pruned at iteration 0.
[I 2023-12-21 04:03:47,453] Trial 145 pruned. Trial was pruned at iteration 0.
[I 2023-12-21 04:03:47,491] Trial 146 pruned. Trial was pruned at iteration 0.
[I 2023-12-21 04:03:47,592] Trial 147 finished with value: inf and parameters: {'learning_rate': 0.5980833765583962, 'aft_loss_distributi                                                                     on': 'normal', 'aft_loss_distribution_scale': 1.5001566598642087, 'max_depth': 6, 'booster': 'gbtree', 'scale_pos_weight': 4.889321305610                                                                     764, 'alpha': 0.02862128126222352, 'lambda': 0.10164170077316559, 'eta': 0.4610761623835523, 'sampling_method': 'uniform', 'subsample': 0                                                                     .35271039382018005, 'gamma': 6.524120324186363}. Best is trial 127 with value: 4.29954991379438.
[I 2023-12-21 04:03:47,631] Trial 148 pruned. Trial was pruned at iteration 0.
[I 2023-12-21 04:03:47,739] Trial 149 finished with value: inf and parameters: {'learning_rate': 0.8580541346115459, 'aft_loss_distributi                                                                     on': 'normal', 'aft_loss_distribution_scale': 1.1802896691499347, 'max_depth': 7, 'booster': 'gbtree', 'scale_pos_weight': 6.729984254699                                                                     897, 'alpha': 8.384993233463293, 'lambda': 3.911728950605962, 'eta': 0.1766518717402758, 'sampling_method': 'uniform', 'subsample': 0.700                                                                     61154653727, 'gamma': 3.789377339950365}. Best is trial 127 with value: 4.29954991379438.
[I 2023-12-21 04:03:47,779] Trial 150 pruned. Trial was pruned at iteration 0.
[I 2023-12-21 04:03:47,818] Trial 151 pruned. Trial was pruned at iteration 0.
[I 2023-12-21 04:03:47,856] Trial 152 pruned. Trial was pruned at iteration 0.
[I 2023-12-21 04:03:47,984] Trial 153 pruned. Trial was pruned at iteration 88.
[I 2023-12-21 04:03:48,023] Trial 154 pruned. Trial was pruned at iteration 0.
[I 2023-12-21 04:03:48,063] Trial 155 pruned. Trial was pruned at iteration 1.
[I 2023-12-21 04:03:48,103] Trial 156 pruned. Trial was pruned at iteration 0.
[I 2023-12-21 04:03:48,143] Trial 157 pruned. Trial was pruned at iteration 0.
[I 2023-12-21 04:03:48,183] Trial 158 pruned. Trial was pruned at iteration 0.
[I 2023-12-21 04:03:48,222] Trial 159 pruned. Trial was pruned at iteration 0.
[I 2023-12-21 04:03:48,261] Trial 160 pruned. Trial was pruned at iteration 0.
[I 2023-12-21 04:03:48,305] Trial 161 pruned. Trial was pruned at iteration 3.
[I 2023-12-21 04:03:48,346] Trial 162 pruned. Trial was pruned at iteration 1.
[I 2023-12-21 04:03:48,386] Trial 163 pruned. Trial was pruned at iteration 1.
[I 2023-12-21 04:03:48,425] Trial 164 pruned. Trial was pruned at iteration 0.
[I 2023-12-21 04:03:48,530] Trial 165 finished with value: inf and parameters: {'learning_rate': 0.7186252028909117, 'aft_loss_distributi                                                                     on': 'normal', 'aft_loss_distribution_scale': 1.2717839459212505, 'max_depth': 10, 'booster': 'gbtree', 'scale_pos_weight': 5.96420943751                                                                     5202, 'alpha': 4.783369664760654, 'lambda': 0.9839613589361784, 'eta': 0.16073324982541143, 'sampling_method': 'uniform', 'subsample': 0.                                                                     559413385895409, 'gamma': 4.758907299699513}. Best is trial 127 with value: 4.29954991379438.
[I 2023-12-21 04:03:48,570] Trial 166 pruned. Trial was pruned at iteration 0.
[I 2023-12-21 04:03:48,609] Trial 167 pruned. Trial was pruned at iteration 0.
[I 2023-12-21 04:03:48,650] Trial 168 pruned. Trial was pruned at iteration 1.
[I 2023-12-21 04:03:48,702] Trial 169 pruned. Trial was pruned at iteration 0.
[I 2023-12-21 04:03:48,742] Trial 170 pruned. Trial was pruned at iteration 0.
[I 2023-12-21 04:03:48,850] Trial 171 finished with value: inf and parameters: {'learning_rate': 0.7091315930475282, 'aft_loss_distributi                                                                     on': 'normal', 'aft_loss_distribution_scale': 1.3218672560471338, 'max_depth': 10, 'booster': 'gbtree', 'scale_pos_weight': 8.30891479041                                                                     9987, 'alpha': 7.065546918573463, 'lambda': 3.5106161143434447, 'eta': 0.3280478587104881, 'sampling_method': 'uniform', 'subsample': 0.5                                                                     124150874508464, 'gamma': 4.204114663573004}. Best is trial 127 with value: 4.29954991379438.
[I 2023-12-21 04:03:48,970] Trial 172 finished with value: inf and parameters: {'learning_rate': 0.6782379210059128, 'aft_loss_distributi                                                                     on': 'normal', 'aft_loss_distribution_scale': 1.1125571332822075, 'max_depth': 10, 'booster': 'gbtree', 'scale_pos_weight': 8.58542255753                                                                     8175, 'alpha': 6.238364115898632, 'lambda': 3.2527635295257613, 'eta': 0.4006757592565601, 'sampling_method': 'uniform', 'subsample': 0.5                                                                     442048141411631, 'gamma': 4.445405616592229}. Best is trial 127 with value: 4.29954991379438.
[I 2023-12-21 04:03:49,010] Trial 173 pruned. Trial was pruned at iteration 1.
[I 2023-12-21 04:03:49,050] Trial 174 pruned. Trial was pruned at iteration 0.
[I 2023-12-21 04:03:49,090] Trial 175 pruned. Trial was pruned at iteration 1.
[I 2023-12-21 04:03:49,130] Trial 176 pruned. Trial was pruned at iteration 0.
[I 2023-12-21 04:03:49,172] Trial 177 pruned. Trial was pruned at iteration 0.
[I 2023-12-21 04:03:49,212] Trial 178 pruned. Trial was pruned at iteration 0.
[I 2023-12-21 04:03:49,253] Trial 179 pruned. Trial was pruned at iteration 0.
[I 2023-12-21 04:03:49,292] Trial 180 pruned. Trial was pruned at iteration 0.
[I 2023-12-21 04:03:49,337] Trial 181 pruned. Trial was pruned at iteration 1.
[I 2023-12-21 04:03:49,381] Trial 182 pruned. Trial was pruned at iteration 1.
[I 2023-12-21 04:03:50,442] Trial 183 finished with value: inf and parameters: {'learning_rate': 0.6975083475845298, 'aft_loss_distributi                                                                     on': 'normal', 'aft_loss_distribution_scale': 1.6059943118190805, 'max_depth': 4, 'booster': 'dart', 'scale_pos_weight': 4.69217237308215                                                                     , 'alpha': 5.932206058980945, 'lambda': 8.525978984857396, 'eta': 0.653487663274906, 'sampling_method': 'gradient_based', 'subsample': 0.                                                                     048993663404654914, 'gamma': 6.30325717242031}. Best is trial 127 with value: 4.29954991379438.
[I 2023-12-21 04:03:50,484] Trial 184 pruned. Trial was pruned at iteration 0.
[I 2023-12-21 04:03:51,595] Trial 185 finished with value: inf and parameters: {'learning_rate': 0.6841750709785808, 'aft_loss_distributi                                                                     on': 'normal', 'aft_loss_distribution_scale': 1.3452415923963403, 'max_depth': 10, 'booster': 'dart', 'scale_pos_weight': 6.2271651777567                                                                     78, 'alpha': 9.448298129941922, 'lambda': 7.374637648350556, 'eta': 0.707979522407907, 'sampling_method': 'gradient_based', 'subsample':                                                                      0.31769521350321994, 'gamma': 4.200378338910996}. Best is trial 127 with value: 4.29954991379438.
[I 2023-12-21 04:03:51,635] Trial 186 pruned. Trial was pruned at iteration 0.
[I 2023-12-21 04:03:51,675] Trial 187 pruned. Trial was pruned at iteration 0.
[I 2023-12-21 04:03:51,715] Trial 188 pruned. Trial was pruned at iteration 0.
[I 2023-12-21 04:03:51,755] Trial 189 pruned. Trial was pruned at iteration 0.
[I 2023-12-21 04:03:51,795] Trial 190 pruned. Trial was pruned at iteration 0.
[I 2023-12-21 04:03:52,967] Trial 191 finished with value: inf and parameters: {'learning_rate': 0.6162956737435584, 'aft_loss_distributi                                                                     on': 'normal', 'aft_loss_distribution_scale': 1.6468314439971115, 'max_depth': 3, 'booster': 'dart', 'scale_pos_weight': 7.22730268034320                                                                     66, 'alpha': 4.1557166991845405, 'lambda': 4.042439390300764, 'eta': 0.9943699763476641, 'sampling_method': 'gradient_based', 'subsample'                                                                     : 0.3771429846229867, 'gamma': 1.9299890306532195}. Best is trial 127 with value: 4.29954991379438.
