[I 2023-12-19 00:25:23,743] Trial 499 pruned. Trial was pruned at iteration 0.
Completed hyperparameter tuning with best aft-nloglik = 1.9984721946203312.
Re-running the best trial... params = {'verbosity': 0, 'objective': 'survival:aft', 'eval_metric': 'aft-nloglik', 'tree_method': 'gpu_hist', 'device': 'cuda', 'learning_rate': 0.981934523862336, 'aft_loss_distribution': 'normal', 'aft_loss_distribution_scale': 1.502288205821525, 'max_depth': 10, 'booster': 'dart', 'scale_pos_weight': 0.41723716223891594, 'alpha': 9.013299856176824, 'lambda': 9.284882919560411, 'eta': 0.7700314115591187, 'sampling_method': 'uniform', 'subsample': 0.2954810339917999, 'gamma': 9.466431736930076}
[W 2023-12-19 00:25:29,129] Trial 3 is omitted in visualization because its objective value is inf or nan.
[W 2023-12-19 00:25:29,135] Trial 8 is omitted in visualization because its objective value is inf or nan.
[W 2023-12-19 00:25:29,136] Trial 12 is omitted in visualization because its objective value is inf or nan.
[W 2023-12-19 00:25:29,138] Trial 14 is omitted in visualization because its objective value is inf or nan.
[W 2023-12-19 00:25:29,139] Trial 35 is omitted in visualization because its objective value is inf or nan.
[W 2023-12-19 00:25:29,144] Trial 36 is omitted in visualization because its objective value is inf or nan.
[W 2023-12-19 00:25:29,149] Trial 61 is omitted in visualization because its objective value is inf or nan.
[W 2023-12-19 00:25:29,150] Trial 68 is omitted in visualization because its objective value is inf or nan.
[W 2023-12-19 00:25:29,154] Trial 74 is omitted in visualization because its objective value is inf or nan.
[W 2023-12-19 00:25:29,155] Trial 78 is omitted in visualization because its objective value is inf or nan.
[W 2023-12-19 00:25:29,160] Trial 87 is omitted in visualization because its objective value is inf or nan.
[W 2023-12-19 00:25:29,166] Trial 95 is omitted in visualization because its objective value is inf or nan.
[W 2023-12-19 00:25:29,167] Trial 100 is omitted in visualization because its objective value is inf or nan.
[W 2023-12-19 00:25:29,172] Trial 104 is omitted in visualization because its objective value is inf or nan.
[W 2023-12-19 00:25:29,176] Trial 105 is omitted in visualization because its objective value is inf or nan.
[W 2023-12-19 00:25:29,180] Trial 106 is omitted in visualization because its objective value is inf or nan.
[W 2023-12-19 00:25:29,181] Trial 107 is omitted in visualization because its objective value is inf or nan.
[W 2023-12-19 00:25:29,183] Trial 109 is omitted in visualization because its objective value is inf or nan.
[W 2023-12-19 00:25:29,186] Trial 111 is omitted in visualization because its objective value is inf or nan.
[W 2023-12-19 00:25:29,188] Trial 114 is omitted in visualization because its objective value is inf or nan.
[W 2023-12-19 00:25:29,191] Trial 115 is omitted in visualization because its objective value is inf or nan.
[W 2023-12-19 00:25:29,192] Trial 116 is omitted in visualization because its objective value is inf or nan.
[W 2023-12-19 00:25:29,195] Trial 126 is omitted in visualization because its objective value is inf or nan.
[W 2023-12-19 00:25:29,196] Trial 129 is omitted in visualization because its objective value is inf or nan.
[W 2023-12-19 00:25:29,198] Trial 130 is omitted in visualization because its objective value is inf or nan.
[W 2023-12-19 00:25:29,203] Trial 137 is omitted in visualization because its objective value is inf or nan.
[W 2023-12-19 00:25:29,205] Trial 139 is omitted in visualization because its objective value is inf or nan.
[W 2023-12-19 00:25:29,208] Trial 148 is omitted in visualization because its objective value is inf or nan.
[W 2023-12-19 00:25:29,211] Trial 155 is omitted in visualization because its objective value is inf or nan.
[W 2023-12-19 00:25:29,212] Trial 170 is omitted in visualization because its objective value is inf or nan.
[W 2023-12-19 00:25:29,214] Trial 184 is omitted in visualization because its objective value is inf or nan.
[W 2023-12-19 00:25:29,216] Trial 212 is omitted in visualization because its objective value is inf or nan.
[W 2023-12-19 00:25:29,219] Trial 220 is omitted in visualization because its objective value is inf or nan.
[W 2023-12-19 00:25:29,221] Trial 225 is omitted in visualization because its objective value is inf or nan.
[W 2023-12-19 00:25:29,222] Trial 227 is omitted in visualization because its objective value is inf or nan.
[W 2023-12-19 00:25:29,222] Trial 230 is omitted in visualization because its objective value is inf or nan.
[W 2023-12-19 00:25:29,223] Trial 243 is omitted in visualization because its objective value is inf or nan.
[W 2023-12-19 00:25:29,224] Trial 246 is omitted in visualization because its objective value is inf or nan.
[W 2023-12-19 00:25:29,225] Trial 250 is omitted in visualization because its objective value is inf or nan.
[W 2023-12-19 00:25:29,226] Trial 251 is omitted in visualization because its objective value is inf or nan.
[W 2023-12-19 00:25:29,227] Trial 254 is omitted in visualization because its objective value is inf or nan.
[W 2023-12-19 00:25:29,228] Trial 255 is omitted in visualization because its objective value is inf or nan.
[W 2023-12-19 00:25:29,229] Trial 256 is omitted in visualization because its objective value is inf or nan.
[W 2023-12-19 00:25:29,230] Trial 257 is omitted in visualization because its objective value is inf or nan.
[W 2023-12-19 00:25:29,231] Trial 264 is omitted in visualization because its objective value is inf or nan.
[W 2023-12-19 00:25:29,232] Trial 265 is omitted in visualization because its objective value is inf or nan.
[W 2023-12-19 00:25:29,233] Trial 267 is omitted in visualization because its objective value is inf or nan.
[W 2023-12-19 00:25:29,237] Trial 269 is omitted in visualization because its objective value is inf or nan.
[W 2023-12-19 00:25:29,238] Trial 282 is omitted in visualization because its objective value is inf or nan.
[W 2023-12-19 00:25:29,239] Trial 288 is omitted in visualization because its objective value is inf or nan.
[W 2023-12-19 00:25:29,246] Trial 289 is omitted in visualization because its objective value is inf or nan.
[W 2023-12-19 00:25:29,247] Trial 291 is omitted in visualization because its objective value is inf or nan.
[W 2023-12-19 00:25:29,249] Trial 295 is omitted in visualization because its objective value is inf or nan.
[W 2023-12-19 00:25:29,250] Trial 299 is omitted in visualization because its objective value is inf or nan.
[W 2023-12-19 00:25:29,251] Trial 300 is omitted in visualization because its objective value is inf or nan.
[W 2023-12-19 00:25:29,252] Trial 307 is omitted in visualization because its objective value is inf or nan.
[W 2023-12-19 00:25:29,253] Trial 315 is omitted in visualization because its objective value is inf or nan.
[W 2023-12-19 00:25:29,254] Trial 316 is omitted in visualization because its objective value is inf or nan.
[W 2023-12-19 00:25:29,255] Trial 321 is omitted in visualization because its objective value is inf or nan.
[W 2023-12-19 00:25:29,256] Trial 324 is omitted in visualization because its objective value is inf or nan.
[W 2023-12-19 00:25:29,257] Trial 328 is omitted in visualization because its objective value is inf or nan.
[W 2023-12-19 00:25:29,261] Trial 330 is omitted in visualization because its objective value is inf or nan.
[W 2023-12-19 00:25:29,262] Trial 333 is omitted in visualization because its objective value is inf or nan.
[W 2023-12-19 00:25:29,263] Trial 339 is omitted in visualization because its objective value is inf or nan.
[W 2023-12-19 00:25:29,264] Trial 340 is omitted in visualization because its objective value is inf or nan.
[W 2023-12-19 00:25:29,265] Trial 343 is omitted in visualization because its objective value is inf or nan.
[W 2023-12-19 00:25:29,265] Trial 346 is omitted in visualization because its objective value is inf or nan.
[W 2023-12-19 00:25:29,267] Trial 356 is omitted in visualization because its objective value is inf or nan.
[W 2023-12-19 00:25:29,267] Trial 361 is omitted in visualization because its objective value is inf or nan.
[W 2023-12-19 00:25:29,269] Trial 363 is omitted in visualization because its objective value is inf or nan.
[W 2023-12-19 00:25:29,270] Trial 365 is omitted in visualization because its objective value is inf or nan.
[W 2023-12-19 00:25:29,274] Trial 366 is omitted in visualization because its objective value is inf or nan.
[W 2023-12-19 00:25:29,275] Trial 370 is omitted in visualization because its objective value is inf or nan.
[W 2023-12-19 00:25:29,276] Trial 376 is omitted in visualization because its objective value is inf or nan.
[W 2023-12-19 00:25:29,277] Trial 381 is omitted in visualization because its objective value is inf or nan.
[W 2023-12-19 00:25:29,278] Trial 386 is omitted in visualization because its objective value is inf or nan.
[W 2023-12-19 00:25:29,279] Trial 394 is omitted in visualization because its objective value is inf or nan.
[W 2023-12-19 00:25:29,280] Trial 397 is omitted in visualization because its objective value is inf or nan.
[W 2023-12-19 00:25:29,284] Trial 400 is omitted in visualization because its objective value is inf or nan.
[W 2023-12-19 00:25:29,285] Trial 402 is omitted in visualization because its objective value is inf or nan.
[W 2023-12-19 00:25:29,286] Trial 405 is omitted in visualization because its objective value is inf or nan.
[W 2023-12-19 00:25:29,287] Trial 414 is omitted in visualization because its objective value is inf or nan.
[W 2023-12-19 00:25:29,289] Trial 416 is omitted in visualization because its objective value is inf or nan.
[W 2023-12-19 00:25:29,290] Trial 418 is omitted in visualization because its objective value is inf or nan.
[W 2023-12-19 00:25:29,292] Trial 428 is omitted in visualization because its objective value is inf or nan.
[W 2023-12-19 00:25:29,293] Trial 429 is omitted in visualization because its objective value is inf or nan.
[W 2023-12-19 00:25:29,294] Trial 431 is omitted in visualization because its objective value is inf or nan.
[W 2023-12-19 00:25:29,296] Trial 434 is omitted in visualization because its objective value is inf or nan.
[W 2023-12-19 00:25:29,297] Trial 440 is omitted in visualization because its objective value is inf or nan.
[W 2023-12-19 00:25:29,299] Trial 441 is omitted in visualization because its objective value is inf or nan.
[W 2023-12-19 00:25:29,300] Trial 459 is omitted in visualization because its objective value is inf or nan.
[W 2023-12-19 00:25:29,302] Trial 479 is omitted in visualization because its objective value is inf or nan.
[W 2023-12-19 00:25:29,304] Trial 484 is omitted in visualization because its objective value is inf or nan.
[W 2023-12-19 00:25:29,305] Trial 489 is omitted in visualization because its objective value is inf or nan.
[W 2023-12-19 00:25:29,307] Trial 497 is omitted in visualization because its objective value is inf or nan.
TRN1 | R2:0.261; p:7.386e-99 | C:66.12 |3h:0.958 |6h:0.947 |9h:0.939 |12h:0.733 |15h:0.733 |18h:0.730 |24h:0.577 |48h:0.569 |72h:0.561 |1wk:0.380 |2wks:0.375 |1mon:0.327 |
TRN2 | R2:0.212; p:1.851e-65 | C:63.32 |3h:0.958 |6h:0.946 |9h:0.939 |12h:0.733 |15h:0.733 |18h:0.729 |24h:0.576 |48h:0.569 |72h:0.560 |1wk:0.383 |2wks:0.372 |1mon:0.323 |
VAL | R2:0.212; p:1.6e-65 | C:63.24 |3h:0.958 |6h:0.946 |9h:0.939 |12h:0.733 |15h:0.733 |18h:0.729 |24h:0.576 |48h:0.569 |72h:0.560 |1wk:0.383 |2wks:0.373 |1mon:0.325 |
[I 2023-12-19 00:25:36,686] A new study created in memory with name: no-name-bf309699-3d30-4dfa-a9ba-bbb1e5ccdfe6
TST | R2:0.144; p:3.673e-91 | C:59.21 |3h:0.952 |6h:0.937 |9h:0.928 |12h:0.726 |15h:0.726 |18h:0.711 |24h:0.443 |48h:0.442 |72h:0.438 |1wk:0.349 |2wks:0.356 |1mon:0.327 |
/content/drive/MyDrive/intermediates2/res//outcome2_xgb-aft_inp49_k3_all_rdims8.json
Dimensionality reduced word embedding 1 with ['location_numeric', 'race_numeric', 'sex_numeric']
Dimensionality reduced word embedding 1 with ['location_numeric', 'race_numeric', 'sex_numeric']
Dimensionality reduced word embedding 1 with ['location_numeric', 'race_numeric', 'sex_numeric']
Dimensionality reduced word embedding 1 with ['location_numeric', 'race_numeric', 'sex_numeric']
trn1
trn2
val
tst
[I 2023-12-19 00:25:36,983] Trial 0 finished with value: 2.476239259672044 and parameters: {'learning_rate': 0.7122334218224615, 'aft_loss_distribution': 'normal', 'aft_loss_distribution_scale': 8.096370940088509, 'max_depth': 8, 'booster': 'gbtree', 'scale_pos_weight': 0.9693641851947535, 'alpha': 9.193673295165574, 'lambda': 7.28653399203972, 'eta': 0.2373206111831655, 'sampling_method': 'uniform', 'subsample': 0.6707802428484018, 'gamma': 2.3737132436158883}. Best is trial 0 with value: 2.476239259672044.
[I 2023-12-19 00:25:39,196] Trial 1 finished with value: inf and parameters: {'learning_rate': 0.33068047790559174, 'aft_loss_distribution': 'extreme', 'aft_loss_distribution_scale': 4.174218096421704, 'max_depth': 6, 'booster': 'dart', 'scale_pos_weight': 0.27436343339430946, 'alpha': 8.043489641123227, 'lambda': 5.103794162219631, 'eta': 0.18742379572745216, 'sampling_method': 'gradient_based', 'subsample': 0.38740667009320423, 'gamma': 0.2776648793851632}. Best is trial 0 with value: 2.476239259672044.
[I 2023-12-19 00:25:39,386] Trial 2 finished with value: inf and parameters: {'learning_rate': 0.6038107861599188, 'aft_loss_distribution': 'normal', 'aft_loss_distribution_scale': 2.225538602896864, 'max_depth': 9, 'booster': 'gbtree', 'scale_pos_weight': 1.6329040831853163, 'alpha': 2.1369354402579983, 'lambda': 2.165804523538416, 'eta': 0.10272522314998644, 'sampling_method': 'uniform', 'subsample': 0.10161934124180268, 'gamma': 1.2924974117271848}. Best is trial 0 with value: 2.476239259672044.
[I 2023-12-19 00:26:12,087] Trial 3 finished with value: 2.470619641936788 and parameters: {'learning_rate': 0.4158942552527737, 'aft_loss_distribution': 'extreme', 'aft_loss_distribution_scale': 5.630177180446382, 'max_depth': 10, 'booster': 'dart', 'scale_pos_weight': 1.9510117996230327, 'alpha': 6.94111941788034, 'lambda': 9.804334450718276, 'eta': 0.7162346128514083, 'sampling_method': 'gradient_based', 'subsample': 0.40097375211261566, 'gamma': 9.050932301208425}. Best is trial 3 with value: 2.470619641936788.
[I 2023-12-19 00:26:12,740] Trial 4 finished with value: 2.318477899313503 and parameters: {'learning_rate': 0.032763771031963304, 'aft_loss_distribution': 'extreme', 'aft_loss_distribution_scale': 3.598319502482888, 'max_depth': 4, 'booster': 'gbtree', 'scale_pos_weight': 3.002799011359688, 'alpha': 3.844203852471427, 'lambda': 5.057170773069286, 'eta': 0.8034169439015556, 'sampling_method': 'gradient_based', 'subsample': 0.9207160083318839, 'gamma': 8.395610401845028}. Best is trial 4 with value: 2.318477899313503.
[I 2023-12-19 00:26:12,937] Trial 5 finished with value: 2.345936257135031 and parameters: {'learning_rate': 0.5820874214224341, 'aft_loss_distribution': 'normal', 'aft_loss_distribution_scale': 5.654263202164479, 'max_depth': 3, 'booster': 'gbtree', 'scale_pos_weight': 3.4033427213116494, 'alpha': 3.8514597517289166, 'lambda': 0.26962734293516755, 'eta': 0.6579300684450925, 'sampling_method': 'gradient_based', 'subsample': 0.5523512621963746, 'gamma': 5.366240280630649}. Best is trial 4 with value: 2.318477899313503.
[I 2023-12-19 00:26:12,951] Trial 6 pruned. Trial was pruned at iteration 0.
[I 2023-12-19 00:26:12,963] Trial 7 pruned. Trial was pruned at iteration 0.
[I 2023-12-19 00:26:12,976] Trial 8 pruned. Trial was pruned at iteration 0.
[I 2023-12-19 00:26:12,994] Trial 9 pruned. Trial was pruned at iteration 5.
[I 2023-12-19 00:26:13,054] Trial 10 pruned. Trial was pruned at iteration 0.
[I 2023-12-19 00:26:13,104] Trial 11 pruned. Trial was pruned at iteration 0.
[I 2023-12-19 00:26:13,162] Trial 12 pruned. Trial was pruned at iteration 0.
[I 2023-12-19 00:26:13,319] Trial 13 pruned. Trial was pruned at iteration 54.
[I 2023-12-19 00:26:13,376] Trial 14 pruned. Trial was pruned at iteration 2.
[I 2023-12-19 00:26:13,459] Trial 15 pruned. Trial was pruned at iteration 0.
[I 2023-12-19 00:26:13,540] Trial 16 pruned. Trial was pruned at iteration 0.
[I 2023-12-19 00:26:13,776] Trial 17 finished with value: inf and parameters: {'learning_rate': 0.47521932707434333, 'aft_loss_distribution': 'normal', 'aft_loss_distribution_scale': 2.842169289644117, 'max_depth': 5, 'booster': 'gbtree', 'scale_pos_weight': 3.686151553654021, 'alpha': 2.62849796865989, 'lambda': 8.344559068441633, 'eta': 0.8536252443190495, 'sampling_method': 'gradient_based', 'subsample': 0.8890651329903317, 'gamma': 3.878511866735839}. Best is trial 4 with value: 2.318477899313503.
[I 2023-12-19 00:26:13,880] Trial 18 pruned. Trial was pruned at iteration 0.
[I 2023-12-19 00:26:13,955] Trial 19 pruned. Trial was pruned at iteration 1.
[I 2023-12-19 00:26:14,025] Trial 20 pruned. Trial was pruned at iteration 0.
[I 2023-12-19 00:26:14,102] Trial 21 pruned. Trial was pruned at iteration 0.
[I 2023-12-19 00:26:14,178] Trial 22 pruned. Trial was pruned at iteration 0.
[I 2023-12-19 00:26:14,262] Trial 23 pruned. Trial was pruned at iteration 0.
[I 2023-12-19 00:26:14,336] Trial 24 pruned. Trial was pruned at iteration 0.
[I 2023-12-19 00:26:14,408] Trial 25 pruned. Trial was pruned at iteration 0.
[I 2023-12-19 00:26:14,484] Trial 26 pruned. Trial was pruned at iteration 0.
[I 2023-12-19 00:26:14,560] Trial 27 pruned. Trial was pruned at iteration 0.
[I 2023-12-19 00:26:14,635] Trial 28 pruned. Trial was pruned at iteration 0.
[I 2023-12-19 00:26:14,712] Trial 29 pruned. Trial was pruned at iteration 1.
[I 2023-12-19 00:26:14,795] Trial 30 pruned. Trial was pruned at iteration 0.
[I 2023-12-19 00:26:14,891] Trial 31 pruned. Trial was pruned at iteration 5.
[I 2023-12-19 00:26:14,977] Trial 32 pruned. Trial was pruned at iteration 0.
[I 2023-12-19 00:26:15,231] Trial 33 finished with value: inf and parameters: {'learning_rate': 0.8792306437029733, 'aft_loss_distribution': 'normal', 'aft_loss_distribution_scale': 4.224758714521913, 'max_depth': 9, 'booster': 'gbtree', 'scale_pos_weight': 0.44669505116217834, 'alpha': 7.401507694255251, 'lambda': 9.097776712827823, 'eta': 0.6589760472755675, 'sampling_method': 'uniform', 'subsample': 0.8369671937967345, 'gamma': 1.9937242218485363}. Best is trial 4 with value: 2.318477899313503.
[I 2023-12-19 00:26:15,542] Trial 34 finished with value: inf and parameters: {'learning_rate': 0.6033654131967792, 'aft_loss_distribution': 'normal', 'aft_loss_distribution_scale': 3.0148225664276374, 'max_depth': 6, 'booster': 'gbtree', 'scale_pos_weight': 1.7962182960765636, 'alpha': 8.87103727968813, 'lambda': 7.338509140677754, 'eta': 0.40144043246402916, 'sampling_method': 'uniform', 'subsample': 0.36440598566348287, 'gamma': 0.07903591071373484}. Best is trial 4 with value: 2.318477899313503.
[I 2023-12-19 00:26:15,639] Trial 35 pruned. Trial was pruned at iteration 0.
[I 2023-12-19 00:26:15,731] Trial 36 pruned. Trial was pruned at iteration 0.
[I 2023-12-19 00:26:15,822] Trial 37 pruned. Trial was pruned at iteration 0.
[I 2023-12-19 00:26:15,925] Trial 38 pruned. Trial was pruned at iteration 0.
[I 2023-12-19 00:26:16,015] Trial 39 pruned. Trial was pruned at iteration 0.
[I 2023-12-19 00:26:16,099] Trial 40 pruned. Trial was pruned at iteration 0.
[I 2023-12-19 00:26:16,183] Trial 41 pruned. Trial was pruned at iteration 0.
[I 2023-12-19 00:26:16,266] Trial 42 pruned. Trial was pruned at iteration 0.
[I 2023-12-19 00:26:16,346] Trial 43 pruned. Trial was pruned at iteration 0.
[I 2023-12-19 00:26:16,434] Trial 44 pruned. Trial was pruned at iteration 0.
[I 2023-12-19 00:26:16,524] Trial 45 pruned. Trial was pruned at iteration 0.
[I 2023-12-19 00:26:16,611] Trial 46 pruned. Trial was pruned at iteration 0.
[I 2023-12-19 00:26:16,692] Trial 47 pruned. Trial was pruned at iteration 0.
[I 2023-12-19 00:26:16,775] Trial 48 pruned. Trial was pruned at iteration 0.
[I 2023-12-19 00:26:16,853] Trial 49 pruned. Trial was pruned at iteration 0.
[I 2023-12-19 00:26:16,932] Trial 50 pruned. Trial was pruned at iteration 0.
[I 2023-12-19 00:26:17,042] Trial 51 pruned. Trial was pruned at iteration 0.
[I 2023-12-19 00:26:17,133] Trial 52 pruned. Trial was pruned at iteration 0.
[I 2023-12-19 00:26:17,421] Trial 53 finished with value: inf and parameters: {'learning_rate': 0.6569607863156954, 'aft_loss_distribution': 'normal', 'aft_loss_distribution_scale': 4.497062176044223, 'max_depth': 10, 'booster': 'gbtree', 'scale_pos_weight': 0.9390604923841327, 'alpha': 3.062646582476802, 'lambda': 1.6434289520098329, 'eta': 0.22078482584713235, 'sampling_method': 'uniform', 'subsample': 0.38751413129479506, 'gamma': 1.158771158157825}. Best is trial 4 with value: 2.318477899313503.
[I 2023-12-19 00:26:17,508] Trial 54 pruned. Trial was pruned at iteration 0.
[I 2023-12-19 00:26:17,598] Trial 55 pruned. Trial was pruned at iteration 0.
[I 2023-12-19 00:26:17,702] Trial 56 pruned. Trial was pruned at iteration 1.
[I 2023-12-19 00:26:17,788] Trial 57 pruned. Trial was pruned at iteration 0.
[I 2023-12-19 00:26:20,844] Trial 58 finished with value: 2.3070786366770957 and parameters: {'learning_rate': 0.6920696382336929, 'aft_loss_distribution': 'normal', 'aft_loss_distribution_scale': 5.023021703491748, 'max_depth': 9, 'booster': 'dart', 'scale_pos_weight': 0.507441255399395, 'alpha': 1.6500544384761637, 'lambda': 8.462777845105686, 'eta': 0.8002223199964785, 'sampling_method': 'gradient_based', 'subsample': 0.736292750790233, 'gamma': 9.41102924132446}. Best is trial 58 with value: 2.3070786366770957.
[I 2023-12-19 00:26:20,921] Trial 59 pruned. Trial was pruned at iteration 2.
[I 2023-12-19 00:26:20,981] Trial 60 pruned. Trial was pruned at iteration 0.
