[I 2023-12-21 04:05:36,141] Trial 364 pruned. Trial was pruned at iteration 0.
[I 2023-12-21 04:05:36,191] Trial 365 pruned. Trial was pruned at iteration 0.
[I 2023-12-21 04:05:36,239] Trial 366 pruned. Trial was pruned at iteration 0.
[I 2023-12-21 04:05:36,290] Trial 367 pruned. Trial was pruned at iteration 0.
[I 2023-12-21 04:05:36,341] Trial 368 pruned. Trial was pruned at iteration 0.
[I 2023-12-21 04:05:36,391] Trial 369 pruned. Trial was pruned at iteration 0.
[I 2023-12-21 04:05:36,441] Trial 370 pruned. Trial was pruned at iteration 0.
[I 2023-12-21 04:05:36,489] Trial 371 pruned. Trial was pruned at iteration 0.
[I 2023-12-21 04:05:36,540] Trial 372 pruned. Trial was pruned at iteration 0.
[I 2023-12-21 04:05:36,591] Trial 373 pruned. Trial was pruned at iteration 1.
[I 2023-12-21 04:05:36,641] Trial 374 pruned. Trial was pruned at iteration 0.
[I 2023-12-21 04:05:36,691] Trial 375 pruned. Trial was pruned at iteration 0.
[I 2023-12-21 04:05:36,740] Trial 376 pruned. Trial was pruned at iteration 0.
[I 2023-12-21 04:05:36,789] Trial 377 pruned. Trial was pruned at iteration 0.
[I 2023-12-21 04:05:36,839] Trial 378 pruned. Trial was pruned at iteration 0.
[I 2023-12-21 04:05:36,888] Trial 379 pruned. Trial was pruned at iteration 0.
[I 2023-12-21 04:05:36,937] Trial 380 pruned. Trial was pruned at iteration 0.
[I 2023-12-21 04:05:36,991] Trial 381 pruned. Trial was pruned at iteration 0.
[I 2023-12-21 04:05:37,042] Trial 382 pruned. Trial was pruned at iteration 0.
[I 2023-12-21 04:05:37,093] Trial 383 pruned. Trial was pruned at iteration 0.
[I 2023-12-21 04:05:37,142] Trial 384 pruned. Trial was pruned at iteration 0.
[I 2023-12-21 04:05:37,192] Trial 385 pruned. Trial was pruned at iteration 0.
[I 2023-12-21 04:05:37,243] Trial 386 pruned. Trial was pruned at iteration 0.
[I 2023-12-21 04:05:37,402] Trial 387 finished with value: inf and parameters: {'learning_rate': 0.9998254380688135, 'aft_loss_distributi                                                                     on': 'normal', 'aft_loss_distribution_scale': 1.6204318749643127, 'max_depth': 8, 'booster': 'gbtree', 'scale_pos_weight': 1.448205785086                                                                     1176, 'alpha': 3.2881100035414264, 'lambda': 9.079934370658508, 'eta': 0.2648853331302392, 'sampling_method': 'uniform', 'subsample': 0.4                                                                     9914734178052583, 'gamma': 4.1053576751538605}. Best is trial 109 with value: 2.0061473443077613.
[I 2023-12-21 04:05:37,453] Trial 388 pruned. Trial was pruned at iteration 0.
[I 2023-12-21 04:05:37,503] Trial 389 pruned. Trial was pruned at iteration 0.
[I 2023-12-21 04:05:37,553] Trial 390 pruned. Trial was pruned at iteration 0.
[I 2023-12-21 04:05:37,603] Trial 391 pruned. Trial was pruned at iteration 0.
[I 2023-12-21 04:05:37,654] Trial 392 pruned. Trial was pruned at iteration 0.
[I 2023-12-21 04:05:37,704] Trial 393 pruned. Trial was pruned at iteration 0.
[I 2023-12-21 04:05:37,755] Trial 394 pruned. Trial was pruned at iteration 0.
[I 2023-12-21 04:05:37,805] Trial 395 pruned. Trial was pruned at iteration 0.
[I 2023-12-21 04:05:37,858] Trial 396 pruned. Trial was pruned at iteration 0.
[I 2023-12-21 04:05:37,908] Trial 397 pruned. Trial was pruned at iteration 0.
[I 2023-12-21 04:05:38,967] Trial 398 finished with value: inf and parameters: {'learning_rate': 0.9787256063071033, 'aft_loss_distributi                                                                     on': 'normal', 'aft_loss_distribution_scale': 1.3901889077379515, 'max_depth': 3, 'booster': 'dart', 'scale_pos_weight': 1.93864554233545                                                                     85, 'alpha': 3.8341673755804426, 'lambda': 3.0040796197821438, 'eta': 0.9521092179425823, 'sampling_method': 'uniform', 'subsample': 0.30                                                                     356693630135234, 'gamma': 3.1476335920305067}. Best is trial 109 with value: 2.0061473443077613.
[I 2023-12-21 04:05:39,017] Trial 399 pruned. Trial was pruned at iteration 0.
[I 2023-12-21 04:05:39,068] Trial 400 pruned. Trial was pruned at iteration 0.
[I 2023-12-21 04:05:39,118] Trial 401 pruned. Trial was pruned at iteration 0.
[I 2023-12-21 04:05:39,168] Trial 402 pruned. Trial was pruned at iteration 0.
[I 2023-12-21 04:05:39,219] Trial 403 pruned. Trial was pruned at iteration 0.
[I 2023-12-21 04:05:39,276] Trial 404 pruned. Trial was pruned at iteration 1.
[I 2023-12-21 04:05:39,328] Trial 405 pruned. Trial was pruned at iteration 0.
[I 2023-12-21 04:05:39,379] Trial 406 pruned. Trial was pruned at iteration 0.
[I 2023-12-21 04:05:39,430] Trial 407 pruned. Trial was pruned at iteration 0.
[I 2023-12-21 04:05:39,480] Trial 408 pruned. Trial was pruned at iteration 0.
[I 2023-12-21 04:05:39,531] Trial 409 pruned. Trial was pruned at iteration 0.
[I 2023-12-21 04:05:39,583] Trial 410 pruned. Trial was pruned at iteration 0.
[I 2023-12-21 04:05:39,633] Trial 411 pruned. Trial was pruned at iteration 0.
[I 2023-12-21 04:05:39,684] Trial 412 pruned. Trial was pruned at iteration 0.
[I 2023-12-21 04:05:39,734] Trial 413 pruned. Trial was pruned at iteration 0.
[I 2023-12-21 04:05:39,784] Trial 414 pruned. Trial was pruned at iteration 0.
[I 2023-12-21 04:05:39,839] Trial 415 pruned. Trial was pruned at iteration 0.
[I 2023-12-21 04:05:39,889] Trial 416 pruned. Trial was pruned at iteration 0.
[I 2023-12-21 04:05:39,941] Trial 417 pruned. Trial was pruned at iteration 0.
[I 2023-12-21 04:05:39,993] Trial 418 pruned. Trial was pruned at iteration 0.
[I 2023-12-21 04:05:40,043] Trial 419 pruned. Trial was pruned at iteration 0.
[I 2023-12-21 04:05:40,094] Trial 420 pruned. Trial was pruned at iteration 0.
[I 2023-12-21 04:05:40,147] Trial 421 pruned. Trial was pruned at iteration 0.
[I 2023-12-21 04:05:40,198] Trial 422 pruned. Trial was pruned at iteration 0.
[I 2023-12-21 04:05:40,248] Trial 423 pruned. Trial was pruned at iteration 0.
[I 2023-12-21 04:05:40,299] Trial 424 pruned. Trial was pruned at iteration 0.
[I 2023-12-21 04:05:40,352] Trial 425 pruned. Trial was pruned at iteration 0.
[I 2023-12-21 04:05:40,404] Trial 426 pruned. Trial was pruned at iteration 0.
[I 2023-12-21 04:05:40,455] Trial 427 pruned. Trial was pruned at iteration 0.
[I 2023-12-21 04:05:40,507] Trial 428 pruned. Trial was pruned at iteration 0.
[I 2023-12-21 04:05:40,559] Trial 429 pruned. Trial was pruned at iteration 0.
[I 2023-12-21 04:05:40,612] Trial 430 pruned. Trial was pruned at iteration 1.
[I 2023-12-21 04:05:40,664] Trial 431 pruned. Trial was pruned at iteration 0.
[I 2023-12-21 04:05:40,721] Trial 432 pruned. Trial was pruned at iteration 0.
[I 2023-12-21 04:05:40,860] Trial 433 finished with value: inf and parameters: {'learning_rate': 0.9848984923846495, 'aft_loss_distributi                                                                     on': 'normal', 'aft_loss_distribution_scale': 1.7353143370463542, 'max_depth': 5, 'booster': 'gbtree', 'scale_pos_weight': 1.399855891794                                                                     2947, 'alpha': 1.501297574514826, 'lambda': 7.801866619835511, 'eta': 0.5851748519417268, 'sampling_method': 'gradient_based', 'subsample                                                                     ': 0.6686571126572206, 'gamma': 3.1971457305664046}. Best is trial 109 with value: 2.0061473443077613.
[I 2023-12-21 04:05:40,913] Trial 434 pruned. Trial was pruned at iteration 0.
[I 2023-12-21 04:05:40,965] Trial 435 pruned. Trial was pruned at iteration 0.
[I 2023-12-21 04:05:41,017] Trial 436 pruned. Trial was pruned at iteration 0.
[I 2023-12-21 04:05:41,070] Trial 437 pruned. Trial was pruned at iteration 0.
[I 2023-12-21 04:05:41,129] Trial 438 pruned. Trial was pruned at iteration 0.
[I 2023-12-21 04:05:41,181] Trial 439 pruned. Trial was pruned at iteration 0.
[I 2023-12-21 04:05:41,233] Trial 440 pruned. Trial was pruned at iteration 0.
[I 2023-12-21 04:05:41,285] Trial 441 pruned. Trial was pruned at iteration 0.
[I 2023-12-21 04:05:41,341] Trial 442 pruned. Trial was pruned at iteration 0.
[I 2023-12-21 04:05:41,394] Trial 443 pruned. Trial was pruned at iteration 0.
[I 2023-12-21 04:05:41,448] Trial 444 pruned. Trial was pruned at iteration 0.
[I 2023-12-21 04:05:41,501] Trial 445 pruned. Trial was pruned at iteration 0.
[I 2023-12-21 04:05:41,553] Trial 446 pruned. Trial was pruned at iteration 0.
[I 2023-12-21 04:05:41,608] Trial 447 pruned. Trial was pruned at iteration 1.
[I 2023-12-21 04:05:41,660] Trial 448 pruned. Trial was pruned at iteration 0.
[I 2023-12-21 04:05:41,714] Trial 449 pruned. Trial was pruned at iteration 0.
[I 2023-12-21 04:05:41,767] Trial 450 pruned. Trial was pruned at iteration 0.
[I 2023-12-21 04:05:41,821] Trial 451 pruned. Trial was pruned at iteration 0.
[I 2023-12-21 04:05:41,876] Trial 452 pruned. Trial was pruned at iteration 0.
[I 2023-12-21 04:05:41,929] Trial 453 pruned. Trial was pruned at iteration 0.
[I 2023-12-21 04:05:41,984] Trial 454 pruned. Trial was pruned at iteration 0.
[I 2023-12-21 04:05:42,037] Trial 455 pruned. Trial was pruned at iteration 0.
[I 2023-12-21 04:05:42,090] Trial 456 pruned. Trial was pruned at iteration 0.
[I 2023-12-21 04:05:42,143] Trial 457 pruned. Trial was pruned at iteration 0.
[I 2023-12-21 04:05:43,236] Trial 458 finished with value: inf and parameters: {'learning_rate': 0.9997213764216342, 'aft_loss_distributi                                                                     on': 'normal', 'aft_loss_distribution_scale': 1.672135289522406, 'max_depth': 6, 'booster': 'dart', 'scale_pos_weight': 2.399451355268098                                                                     5, 'alpha': 3.597173779597715, 'lambda': 3.162107873672453, 'eta': 0.11626931430158464, 'sampling_method': 'gradient_based', 'subsample':                                                                      0.8962229782020289, 'gamma': 1.3162297978989164}. Best is trial 109 with value: 2.0061473443077613.
[I 2023-12-21 04:05:43,290] Trial 459 pruned. Trial was pruned at iteration 0.
[I 2023-12-21 04:05:43,344] Trial 460 pruned. Trial was pruned at iteration 0.
[I 2023-12-21 04:05:43,398] Trial 461 pruned. Trial was pruned at iteration 0.
[I 2023-12-21 04:05:43,450] Trial 462 pruned. Trial was pruned at iteration 0.
[I 2023-12-21 04:05:43,503] Trial 463 pruned. Trial was pruned at iteration 0.
[I 2023-12-21 04:05:43,556] Trial 464 pruned. Trial was pruned at iteration 0.
[I 2023-12-21 04:05:43,609] Trial 465 pruned. Trial was pruned at iteration 0.
[I 2023-12-21 04:05:43,664] Trial 466 pruned. Trial was pruned at iteration 0.
[I 2023-12-21 04:05:43,717] Trial 467 pruned. Trial was pruned at iteration 0.
[I 2023-12-21 04:05:43,770] Trial 468 pruned. Trial was pruned at iteration 0.
[I 2023-12-21 04:05:43,825] Trial 469 pruned. Trial was pruned at iteration 0.
[I 2023-12-21 04:05:43,878] Trial 470 pruned. Trial was pruned at iteration 0.
[I 2023-12-21 04:05:43,933] Trial 471 pruned. Trial was pruned at iteration 0.
[I 2023-12-21 04:05:43,986] Trial 472 pruned. Trial was pruned at iteration 0.
[I 2023-12-21 04:05:44,042] Trial 473 pruned. Trial was pruned at iteration 0.
[I 2023-12-21 04:05:44,095] Trial 474 pruned. Trial was pruned at iteration 0.
[I 2023-12-21 04:05:44,148] Trial 475 pruned. Trial was pruned at iteration 0.
[I 2023-12-21 04:05:44,202] Trial 476 pruned. Trial was pruned at iteration 0.
[I 2023-12-21 04:05:44,257] Trial 477 pruned. Trial was pruned at iteration 0.
[I 2023-12-21 04:05:44,312] Trial 478 pruned. Trial was pruned at iteration 0.
[I 2023-12-21 04:05:44,366] Trial 479 pruned. Trial was pruned at iteration 0.
[I 2023-12-21 04:05:44,420] Trial 480 pruned. Trial was pruned at iteration 0.
[I 2023-12-21 04:05:44,474] Trial 481 pruned. Trial was pruned at iteration 0.
[I 2023-12-21 04:05:44,528] Trial 482 pruned. Trial was pruned at iteration 0.
[I 2023-12-21 04:05:44,581] Trial 483 pruned. Trial was pruned at iteration 0.
[I 2023-12-21 04:05:44,639] Trial 484 pruned. Trial was pruned at iteration 0.
[I 2023-12-21 04:05:44,693] Trial 485 pruned. Trial was pruned at iteration 0.
[I 2023-12-21 04:05:44,748] Trial 486 pruned. Trial was pruned at iteration 0.
[I 2023-12-21 04:05:44,802] Trial 487 pruned. Trial was pruned at iteration 0.
[I 2023-12-21 04:05:44,857] Trial 488 pruned. Trial was pruned at iteration 0.
[I 2023-12-21 04:05:44,911] Trial 489 pruned. Trial was pruned at iteration 0.
[I 2023-12-21 04:05:44,967] Trial 490 pruned. Trial was pruned at iteration 0.
[I 2023-12-21 04:05:45,022] Trial 491 pruned. Trial was pruned at iteration 0.
[I 2023-12-21 04:05:45,077] Trial 492 pruned. Trial was pruned at iteration 0.
[I 2023-12-21 04:05:45,133] Trial 493 pruned. Trial was pruned at iteration 0.
[I 2023-12-21 04:05:45,188] Trial 494 pruned. Trial was pruned at iteration 0.
[I 2023-12-21 04:05:45,243] Trial 495 pruned. Trial was pruned at iteration 0.
[I 2023-12-21 04:05:45,297] Trial 496 pruned. Trial was pruned at iteration 0.
[I 2023-12-21 04:05:45,356] Trial 497 pruned. Trial was pruned at iteration 0.
[I 2023-12-21 04:05:45,411] Trial 498 pruned. Trial was pruned at iteration 0.
[I 2023-12-21 04:05:45,466] Trial 499 pruned. Trial was pruned at iteration 0.
[W 2023-12-21 04:05:45,663] Trial 0 is omitted in visualization because its objective value is inf or nan.
[W 2023-12-21 04:05:45,664] Trial 4 is omitted in visualization because its objective value is inf or nan.
[W 2023-12-21 04:05:45,664] Trial 12 is omitted in visualization because its objective value is inf or nan.
[W 2023-12-21 04:05:45,664] Trial 13 is omitted in visualization because its objective value is inf or nan.
[W 2023-12-21 04:05:45,664] Trial 29 is omitted in visualization because its objective value is inf or nan.
[W 2023-12-21 04:05:45,664] Trial 41 is omitted in visualization because its objective value is inf or nan.
[W 2023-12-21 04:05:45,664] Trial 42 is omitted in visualization because its objective value is inf or nan.
[W 2023-12-21 04:05:45,664] Trial 50 is omitted in visualization because its objective value is inf or nan.
[W 2023-12-21 04:05:45,664] Trial 61 is omitted in visualization because its objective value is inf or nan.
[W 2023-12-21 04:05:45,664] Trial 84 is omitted in visualization because its objective value is inf or nan.
[W 2023-12-21 04:05:45,664] Trial 85 is omitted in visualization because its objective value is inf or nan.
[W 2023-12-21 04:05:45,664] Trial 92 is omitted in visualization because its objective value is inf or nan.
[W 2023-12-21 04:05:45,664] Trial 103 is omitted in visualization because its objective value is inf or nan.
[W 2023-12-21 04:05:45,664] Trial 106 is omitted in visualization because its objective value is inf or nan.
[W 2023-12-21 04:05:45,664] Trial 121 is omitted in visualization because its objective value is inf or nan.
[W 2023-12-21 04:05:45,664] Trial 123 is omitted in visualization because its objective value is inf or nan.
[W 2023-12-21 04:05:45,664] Trial 151 is omitted in visualization because its objective value is inf or nan.
[W 2023-12-21 04:05:45,664] Trial 153 is omitted in visualization because its objective value is inf or nan.
[W 2023-12-21 04:05:45,664] Trial 155 is omitted in visualization because its objective value is inf or nan.
[W 2023-12-21 04:05:45,664] Trial 157 is omitted in visualization because its objective value is inf or nan.
[W 2023-12-21 04:05:45,664] Trial 161 is omitted in visualization because its objective value is inf or nan.
[W 2023-12-21 04:05:45,665] Trial 163 is omitted in visualization because its objective value is inf or nan.
[W 2023-12-21 04:05:45,665] Trial 171 is omitted in visualization because its objective value is inf or nan.
[W 2023-12-21 04:05:45,665] Trial 173 is omitted in visualization because its objective value is inf or nan.
[W 2023-12-21 04:05:45,665] Trial 181 is omitted in visualization because its objective value is inf or nan.
[W 2023-12-21 04:05:45,665] Trial 191 is omitted in visualization because its objective value is inf or nan.
[W 2023-12-21 04:05:45,665] Trial 192 is omitted in visualization because its objective value is inf or nan.
[W 2023-12-21 04:05:45,665] Trial 215 is omitted in visualization because its objective value is inf or nan.
[W 2023-12-21 04:05:45,665] Trial 221 is omitted in visualization because its objective value is inf or nan.
[W 2023-12-21 04:05:45,665] Trial 223 is omitted in visualization because its objective value is inf or nan.
[W 2023-12-21 04:05:45,665] Trial 231 is omitted in visualization because its objective value is inf or nan.
[W 2023-12-21 04:05:45,665] Trial 232 is omitted in visualization because its objective value is inf or nan.
[W 2023-12-21 04:05:45,665] Trial 235 is omitted in visualization because its objective value is inf or nan.
[W 2023-12-21 04:05:45,665] Trial 241 is omitted in visualization because its objective value is inf or nan.
[W 2023-12-21 04:05:45,665] Trial 242 is omitted in visualization because its objective value is inf or nan.
[W 2023-12-21 04:05:45,665] Trial 243 is omitted in visualization because its objective value is inf or nan.
[W 2023-12-21 04:05:45,665] Trial 244 is omitted in visualization because its objective value is inf or nan.
[W 2023-12-21 04:05:45,665] Trial 252 is omitted in visualization because its objective value is inf or nan.
[W 2023-12-21 04:05:45,665] Trial 268 is omitted in visualization because its objective value is inf or nan.
[W 2023-12-21 04:05:45,665] Trial 290 is omitted in visualization because its objective value is inf or nan.
[W 2023-12-21 04:05:45,665] Trial 303 is omitted in visualization because its objective value is inf or nan.
[W 2023-12-21 04:05:45,665] Trial 313 is omitted in visualization because its objective value is inf or nan.
[W 2023-12-21 04:05:45,665] Trial 387 is omitted in visualization because its objective value is inf or nan.
[W 2023-12-21 04:05:45,665] Trial 398 is omitted in visualization because its objective value is inf or nan.
[W 2023-12-21 04:05:45,666] Trial 433 is omitted in visualization because its objective value is inf or nan.
[W 2023-12-21 04:05:45,666] Trial 458 is omitted in visualization because its objective value is inf or nan.
exo-open: Cannot open display: .
/cvmfs/soft.computecanada.ca/gentoo/2020/usr/bin/xdg-open: line 871: x-www-browser: command not found
/cvmfs/soft.computecanada.ca/gentoo/2020/usr/bin/xdg-open: line 871: firefox: command not found
/cvmfs/soft.computecanada.ca/gentoo/2020/usr/bin/xdg-open: line 871: iceweasel: command not found
/cvmfs/soft.computecanada.ca/gentoo/2020/usr/bin/xdg-open: line 871: seamonkey: command not found
/cvmfs/soft.computecanada.ca/gentoo/2020/usr/bin/xdg-open: line 871: mozilla: command not found
/cvmfs/soft.computecanada.ca/gentoo/2020/usr/bin/xdg-open: line 871: epiphany: command not found
/cvmfs/soft.computecanada.ca/gentoo/2020/usr/bin/xdg-open: line 871: konqueror: command not found
/cvmfs/soft.computecanada.ca/gentoo/2020/usr/bin/xdg-open: line 871: chromium: command not found
/cvmfs/soft.computecanada.ca/gentoo/2020/usr/bin/xdg-open: line 871: chromium-browser: command not found
/cvmfs/soft.computecanada.ca/gentoo/2020/usr/bin/xdg-open: line 871: google-chrome: command not found
/cvmfs/soft.computecanada.ca/gentoo/2020/usr/bin/xdg-open: line 871: www-browser: command not found
/cvmfs/soft.computecanada.ca/gentoo/2020/usr/bin/xdg-open: line 871: links2: command not found
/home/lisat/.local/lib/python3.10/site-packages/xgboost/data.py:440: FutureWarning:

is_sparse is deprecated and will be removed in a future version. Check `isinstance(dtype, pd.SparseDtype)` instead.

[I 2023-12-21 04:05:47,628] A new study created in memory with name: no-name-b2e1cdad-153f-4254-842b-22d717b7bf41
[I 2023-12-21 04:05:48,037] Trial 0 finished with value: 2.482938818129206 and parameters: {'learning_rate': 0.07880312725161279, 'aft_lo                                                                     ss_distribution': 'normal', 'aft_loss_distribution_scale': 8.872492273572266, 'max_depth': 7, 'booster': 'gbtree', 'scale_pos_weight': 2.                                                                     474254886311228, 'alpha': 1.126966725925028, 'lambda': 1.6280782142683776, 'eta': 0.31124897575512256, 'sampling_method': 'uniform', 'sub                                                                     sample': 0.6043992269784448, 'gamma': 0.991868884753109}. Best is trial 0 with value: 2.482938818129206.
[I 2023-12-21 04:05:48,190] Trial 1 finished with value: inf and parameters: {'learning_rate': 0.718834333861287, 'aft_loss_distribution'                                                                     : 'extreme', 'aft_loss_distribution_scale': 2.69722283910806, 'max_depth': 8, 'booster': 'gbtree', 'scale_pos_weight': 0.9483038994598907                                                                     , 'alpha': 4.774215529735152, 'lambda': 8.30664621722492, 'eta': 0.015177647755889034, 'sampling_method': 'gradient_based', 'subsample':                                                                      0.05295922233118842, 'gamma': 6.250571958058969}. Best is trial 0 with value: 2.482938818129206.
[I 2023-12-21 04:05:48,464] Trial 2 finished with value: 2.6767663206238863 and parameters: {'learning_rate': 0.2704403956514123, 'aft_lo                                                                     ss_distribution': 'logistic', 'aft_loss_distribution_scale': 8.61199712172247, 'max_depth': 7, 'booster': 'gbtree', 'scale_pos_weight': 0                                                                     .540309563028482, 'alpha': 8.145661014215179, 'lambda': 9.479524871496832, 'eta': 0.8484838860897536, 'sampling_method': 'gradient_based'                                                                     , 'subsample': 0.4335472549788961, 'gamma': 9.793518621933856}. Best is trial 0 with value: 2.482938818129206.
