[I 2023-12-19 04:58:19,928] Trial 89 finished with value: 4.309856182985415 and parameters: {'learning_rate': 0.19362519222927738, 'aft_loss_distribution': 'logistic', 'aft_loss_distribution_scale': 0.8739157820257485, 'max_depth': 6, 'booster': 'dart', 'scale_pos_weight': 5.788913202516496, 'alpha': 2.589589859477068, 'lambda': 9.521757198679184, 'eta': 0.036048385186768374, 'sampling_method': 'uniform', 'subsample': 0.39589804461542344, 'gamma': 7.181395995850513}. Best is trial 73 with value: 4.220116152119062.
[I 2023-12-19 04:58:20,009] Trial 90 pruned. Trial was pruned at iteration 0.
[I 2023-12-19 04:58:49,744] Trial 91 finished with value: 4.354169587016511 and parameters: {'learning_rate': 0.18710304090932267, 'aft_loss_distribution': 'logistic', 'aft_loss_distribution_scale': 0.9488342733151084, 'max_depth': 6, 'booster': 'dart', 'scale_pos_weight': 5.460550188733997, 'alpha': 0.6318551252373474, 'lambda': 9.928737045324935, 'eta': 0.1423098433254077, 'sampling_method': 'uniform', 'subsample': 0.45240024774456683, 'gamma': 7.682644884048093}. Best is trial 73 with value: 4.220116152119062.
[I 2023-12-19 04:59:50,098] Trial 92 finished with value: 4.297150504375975 and parameters: {'learning_rate': 0.16689787904469608, 'aft_loss_distribution': 'logistic', 'aft_loss_distribution_scale': 0.851300622950589, 'max_depth': 6, 'booster': 'dart', 'scale_pos_weight': 5.188539257190806, 'alpha': 2.172746567671969, 'lambda': 9.999122624317758, 'eta': 0.07766325051234682, 'sampling_method': 'uniform', 'subsample': 0.4468305028172065, 'gamma': 7.72650392748022}. Best is trial 73 with value: 4.220116152119062.
[I 2023-12-19 04:59:50,185] Trial 93 pruned. Trial was pruned at iteration 0.
[I 2023-12-19 05:00:59,371] Trial 94 finished with value: 4.271280787866777 and parameters: {'learning_rate': 0.15636747567836198, 'aft_loss_distribution': 'logistic', 'aft_loss_distribution_scale': 0.8035478290088093, 'max_depth': 6, 'booster': 'dart', 'scale_pos_weight': 4.897298279171413, 'alpha': 2.143262230789105, 'lambda': 9.952152315995889, 'eta': 0.022362700946276702, 'sampling_method': 'uniform', 'subsample': 0.4288982499380738, 'gamma': 8.628362316692789}. Best is trial 73 with value: 4.220116152119062.
[I 2023-12-19 05:00:59,450] Trial 95 pruned. Trial was pruned at iteration 0.
[I 2023-12-19 05:00:59,542] Trial 96 pruned. Trial was pruned at iteration 0.
[I 2023-12-19 05:00:59,626] Trial 97 pruned. Trial was pruned at iteration 0.
[I 2023-12-19 05:00:59,706] Trial 98 pruned. Trial was pruned at iteration 0.
[I 2023-12-19 05:00:59,787] Trial 99 pruned. Trial was pruned at iteration 0.
[I 2023-12-19 05:00:59,865] Trial 100 pruned. Trial was pruned at iteration 0.
[I 2023-12-19 05:01:32,664] Trial 101 finished with value: 4.321859179452439 and parameters: {'learning_rate': 0.24636013565908813, 'aft_loss_distribution': 'logistic', 'aft_loss_distribution_scale': 0.894079846468056, 'max_depth': 7, 'booster': 'dart', 'scale_pos_weight': 5.307986556255096, 'alpha': 2.0033375509490012, 'lambda': 9.3516678125466, 'eta': 0.031229950112928576, 'sampling_method': 'uniform', 'subsample': 0.4383298232842516, 'gamma': 8.766284528956351}. Best is trial 73 with value: 4.220116152119062.
[I 2023-12-19 05:01:43,464] Trial 102 finished with value: 4.304116690382603 and parameters: {'learning_rate': 0.16762144853059077, 'aft_loss_distribution': 'logistic', 'aft_loss_distribution_scale': 0.8599600515390993, 'max_depth': 7, 'booster': 'dart', 'scale_pos_weight': 5.425924671144534, 'alpha': 1.7510472231455194, 'lambda': 9.386970895399042, 'eta': 0.07676539793439463, 'sampling_method': 'uniform', 'subsample': 0.44073777903669337, 'gamma': 8.725080563220533}. Best is trial 73 with value: 4.220116152119062.
[I 2023-12-19 05:01:43,555] Trial 103 pruned. Trial was pruned at iteration 0.
[I 2023-12-19 05:01:43,639] Trial 104 pruned. Trial was pruned at iteration 0.
[I 2023-12-19 05:01:43,719] Trial 105 pruned. Trial was pruned at iteration 0.
[I 2023-12-19 05:01:43,801] Trial 106 pruned. Trial was pruned at iteration 0.
[I 2023-12-19 05:01:43,882] Trial 107 pruned. Trial was pruned at iteration 0.
[I 2023-12-19 05:01:43,966] Trial 108 pruned. Trial was pruned at iteration 0.
[I 2023-12-19 05:01:44,047] Trial 109 pruned. Trial was pruned at iteration 0.
[I 2023-12-19 05:01:44,148] Trial 110 pruned. Trial was pruned at iteration 0.
[I 2023-12-19 05:02:21,035] Trial 111 pruned. Trial was pruned at iteration 239.
[I 2023-12-19 05:02:21,122] Trial 112 pruned. Trial was pruned at iteration 0.
[I 2023-12-19 05:02:21,200] Trial 113 pruned. Trial was pruned at iteration 0.
[I 2023-12-19 05:02:21,283] Trial 114 pruned. Trial was pruned at iteration 0.
[I 2023-12-19 05:02:21,369] Trial 115 pruned. Trial was pruned at iteration 0.
[I 2023-12-19 05:02:21,465] Trial 116 pruned. Trial was pruned at iteration 0.
[I 2023-12-19 05:02:21,554] Trial 117 pruned. Trial was pruned at iteration 0.
[I 2023-12-19 05:02:21,641] Trial 118 pruned. Trial was pruned at iteration 0.
[I 2023-12-19 05:02:21,725] Trial 119 pruned. Trial was pruned at iteration 0.
[I 2023-12-19 05:02:21,806] Trial 120 pruned. Trial was pruned at iteration 0.
[I 2023-12-19 05:02:31,170] Trial 121 finished with value: 4.390177116188456 and parameters: {'learning_rate': 0.21040759559088001, 'aft_loss_distribution': 'logistic', 'aft_loss_distribution_scale': 1.0092609307893021, 'max_depth': 8, 'booster': 'dart', 'scale_pos_weight': 5.264024168368009, 'alpha': 0.26027838877707676, 'lambda': 8.681992266950262, 'eta': 0.02396900100497611, 'sampling_method': 'uniform', 'subsample': 0.47582742328033817, 'gamma': 6.946562157435007}. Best is trial 73 with value: 4.220116152119062.
[I 2023-12-19 05:02:31,254] Trial 122 pruned. Trial was pruned at iteration 0.
[I 2023-12-19 05:03:04,584] Trial 123 finished with value: 4.361579311756851 and parameters: {'learning_rate': 0.17386933856603257, 'aft_loss_distribution': 'logistic', 'aft_loss_distribution_scale': 0.9615243536652038, 'max_depth': 6, 'booster': 'dart', 'scale_pos_weight': 5.334454841271866, 'alpha': 0.212050415443509, 'lambda': 9.248628524516784, 'eta': 0.019716392177705495, 'sampling_method': 'uniform', 'subsample': 0.48621721614748015, 'gamma': 6.940935041835372}. Best is trial 73 with value: 4.220116152119062.
[I 2023-12-19 05:03:04,680] Trial 124 pruned. Trial was pruned at iteration 0.
[I 2023-12-19 05:03:04,767] Trial 125 pruned. Trial was pruned at iteration 0.
[I 2023-12-19 05:03:07,355] Trial 126 pruned. Trial was pruned at iteration 65.
[I 2023-12-19 05:03:07,436] Trial 127 pruned. Trial was pruned at iteration 0.
[I 2023-12-19 05:03:07,517] Trial 128 pruned. Trial was pruned at iteration 0.
[I 2023-12-19 05:03:07,598] Trial 129 pruned. Trial was pruned at iteration 0.
[I 2023-12-19 05:03:07,679] Trial 130 pruned. Trial was pruned at iteration 0.
[I 2023-12-19 05:03:36,496] Trial 131 finished with value: 4.36673896219707 and parameters: {'learning_rate': 0.18504752141951675, 'aft_loss_distribution': 'logistic', 'aft_loss_distribution_scale': 0.9688797887548963, 'max_depth': 7, 'booster': 'dart', 'scale_pos_weight': 5.309223925943089, 'alpha': 0.9408136243506088, 'lambda': 9.506582871978406, 'eta': 0.025799580794046997, 'sampling_method': 'uniform', 'subsample': 0.4184039105622287, 'gamma': 8.076987541916175}. Best is trial 73 with value: 4.220116152119062.
[I 2023-12-19 05:03:36,581] Trial 132 pruned. Trial was pruned at iteration 0.
[I 2023-12-19 05:04:01,903] Trial 133 finished with value: 4.349402087011754 and parameters: {'learning_rate': 0.22862026664841062, 'aft_loss_distribution': 'logistic', 'aft_loss_distribution_scale': 0.9400965832729709, 'max_depth': 7, 'booster': 'dart', 'scale_pos_weight': 5.42556190644874, 'alpha': 0.33856032894143895, 'lambda': 9.868297531367741, 'eta': 0.0695094141635588, 'sampling_method': 'uniform', 'subsample': 0.3234498192388521, 'gamma': 7.865095408191942}. Best is trial 73 with value: 4.220116152119062.
[I 2023-12-19 05:04:01,992] Trial 134 pruned. Trial was pruned at iteration 0.
[I 2023-12-19 05:04:02,084] Trial 135 pruned. Trial was pruned at iteration 0.
[I 2023-12-19 05:04:02,170] Trial 136 pruned. Trial was pruned at iteration 0.
[I 2023-12-19 05:04:02,270] Trial 137 pruned. Trial was pruned at iteration 0.
[I 2023-12-19 05:04:02,361] Trial 138 pruned. Trial was pruned at iteration 0.
[I 2023-12-19 05:04:02,452] Trial 139 pruned. Trial was pruned at iteration 0.
[I 2023-12-19 05:04:02,542] Trial 140 pruned. Trial was pruned at iteration 0.
[I 2023-12-19 05:04:19,703] Trial 141 pruned. Trial was pruned at iteration 159.
[I 2023-12-19 05:04:30,780] Trial 142 finished with value: 4.314271084322359 and parameters: {'learning_rate': 0.20652365368848796, 'aft_loss_distribution': 'logistic', 'aft_loss_distribution_scale': 0.8795319580811677, 'max_depth': 7, 'booster': 'dart', 'scale_pos_weight': 5.644905895557931, 'alpha': 0.3964653658772461, 'lambda': 9.786804613945524, 'eta': 0.002030301595061533, 'sampling_method': 'uniform', 'subsample': 0.48542273799369906, 'gamma': 7.8761907205549155}. Best is trial 73 with value: 4.220116152119062.
[I 2023-12-19 05:04:39,080] Trial 143 finished with value: 4.277638341017542 and parameters: {'learning_rate': 0.17009578301742462, 'aft_loss_distribution': 'logistic', 'aft_loss_distribution_scale': 0.8156653014246689, 'max_depth': 7, 'booster': 'dart', 'scale_pos_weight': 5.627200218670901, 'alpha': 0.2961597553861992, 'lambda': 9.70417236762117, 'eta': 0.0016555100858215864, 'sampling_method': 'uniform', 'subsample': 0.45395406022771484, 'gamma': 7.947112482521346}. Best is trial 73 with value: 4.220116152119062.
[I 2023-12-19 05:04:39,255] Trial 144 pruned. Trial was pruned at iteration 0.
[I 2023-12-19 05:04:39,422] Trial 145 pruned. Trial was pruned at iteration 0.
[I 2023-12-19 05:04:39,552] Trial 146 pruned. Trial was pruned at iteration 0.
[I 2023-12-19 05:04:39,728] Trial 147 pruned. Trial was pruned at iteration 0.
[I 2023-12-19 05:04:39,903] Trial 148 pruned. Trial was pruned at iteration 0.
[I 2023-12-19 05:04:40,096] Trial 149 pruned. Trial was pruned at iteration 0.
[I 2023-12-19 05:04:40,478] Trial 150 pruned. Trial was pruned at iteration 0.
[I 2023-12-19 05:05:17,728] Trial 151 finished with value: 4.320579523344042 and parameters: {'learning_rate': 0.19859610617701615, 'aft_loss_distribution': 'logistic', 'aft_loss_distribution_scale': 0.8910868206489589, 'max_depth': 7, 'booster': 'dart', 'scale_pos_weight': 5.436544037890682, 'alpha': 0.9927328095414087, 'lambda': 9.637316559710337, 'eta': 0.01887393419907381, 'sampling_method': 'uniform', 'subsample': 0.42545601013190504, 'gamma': 8.011784219972142}. Best is trial 73 with value: 4.220116152119062.
[I 2023-12-19 05:05:54,364] Trial 152 finished with value: 4.296385955870622 and parameters: {'learning_rate': 0.19710214123741832, 'aft_loss_distribution': 'logistic', 'aft_loss_distribution_scale': 0.8502034969155844, 'max_depth': 7, 'booster': 'dart', 'scale_pos_weight': 5.483378921147217, 'alpha': 0.960153830586623, 'lambda': 9.968847072676875, 'eta': 0.016334693112339198, 'sampling_method': 'uniform', 'subsample': 0.4146003839780047, 'gamma': 7.682227535467978}. Best is trial 73 with value: 4.220116152119062.
[I 2023-12-19 05:06:33,897] Trial 153 finished with value: 4.267429674098426 and parameters: {'learning_rate': 0.14611940285705616, 'aft_loss_distribution': 'logistic', 'aft_loss_distribution_scale': 0.7978858022901761, 'max_depth': 7, 'booster': 'dart', 'scale_pos_weight': 5.490551291742719, 'alpha': 0.8862673506830621, 'lambda': 9.983584732558274, 'eta': 0.016945816227530986, 'sampling_method': 'uniform', 'subsample': 0.3931118334200693, 'gamma': 8.023323664641708}. Best is trial 73 with value: 4.220116152119062.
[I 2023-12-19 05:07:07,513] Trial 154 finished with value: 4.248546194476494 and parameters: {'learning_rate': 0.14873395947908027, 'aft_loss_distribution': 'logistic', 'aft_loss_distribution_scale': 0.7625014694877039, 'max_depth': 7, 'booster': 'dart', 'scale_pos_weight': 5.548646933443334, 'alpha': 0.5183563952211159, 'lambda': 9.896252293857188, 'eta': 0.06432212444814549, 'sampling_method': 'uniform', 'subsample': 0.3894574981444488, 'gamma': 8.389012438350978}. Best is trial 73 with value: 4.220116152119062.
[I 2023-12-19 05:07:41,317] Trial 155 finished with value: 4.223377391466518 and parameters: {'learning_rate': 0.1231783866260356, 'aft_loss_distribution': 'logistic', 'aft_loss_distribution_scale': 0.7129457196354174, 'max_depth': 7, 'booster': 'dart', 'scale_pos_weight': 6.012952690341893, 'alpha': 0.7663436363854845, 'lambda': 9.96579591841951, 'eta': 0.06971756842750024, 'sampling_method': 'uniform', 'subsample': 0.3306189117205742, 'gamma': 8.440539453207824}. Best is trial 73 with value: 4.220116152119062.
[I 2023-12-19 05:07:51,841] Trial 156 finished with value: 4.203138772341309 and parameters: {'learning_rate': 0.12007358201917115, 'aft_loss_distribution': 'logistic', 'aft_loss_distribution_scale': 0.6629641204763608, 'max_depth': 7, 'booster': 'dart', 'scale_pos_weight': 6.04478161096961, 'alpha': 1.5439567506596021, 'lambda': 9.71340899357069, 'eta': 0.07316559484677702, 'sampling_method': 'uniform', 'subsample': 0.32618944739542877, 'gamma': 8.505783693152122}. Best is trial 156 with value: 4.203138772341309.
[I 2023-12-19 05:08:29,877] Trial 157 finished with value: 4.190664877103371 and parameters: {'learning_rate': 0.09409777606766888, 'aft_loss_distribution': 'logistic', 'aft_loss_distribution_scale': 0.6312209749385173, 'max_depth': 7, 'booster': 'dart', 'scale_pos_weight': 6.333099496027769, 'alpha': 1.6543076537342016, 'lambda': 9.978146347199889, 'eta': 0.08952065588870656, 'sampling_method': 'uniform', 'subsample': 0.34276930085884705, 'gamma': 8.526800703737479}. Best is trial 157 with value: 4.190664877103371.
[I 2023-12-19 05:08:29,967] Trial 158 pruned. Trial was pruned at iteration 0.
[I 2023-12-19 05:08:30,054] Trial 159 pruned. Trial was pruned at iteration 0.
[I 2023-12-19 05:08:30,140] Trial 160 pruned. Trial was pruned at iteration 0.
[I 2023-12-19 05:08:30,225] Trial 161 pruned. Trial was pruned at iteration 0.
[I 2023-12-19 05:08:30,309] Trial 162 pruned. Trial was pruned at iteration 0.
[I 2023-12-19 05:08:30,411] Trial 163 pruned. Trial was pruned at iteration 0.
[I 2023-12-19 05:08:30,495] Trial 164 pruned. Trial was pruned at iteration 0.
[I 2023-12-19 05:08:30,582] Trial 165 pruned. Trial was pruned at iteration 0.
[I 2023-12-19 05:08:30,672] Trial 166 pruned. Trial was pruned at iteration 0.
[I 2023-12-19 05:08:30,753] Trial 167 pruned. Trial was pruned at iteration 0.
[I 2023-12-19 05:09:04,983] Trial 168 finished with value: 4.247815311467136 and parameters: {'learning_rate': 0.11617386156394598, 'aft_loss_distribution': 'logistic', 'aft_loss_distribution_scale': 0.7596185675345071, 'max_depth': 7, 'booster': 'dart', 'scale_pos_weight': 6.070912103795251, 'alpha': 2.554707871080927, 'lambda': 9.584848064327428, 'eta': 0.12434962730751523, 'sampling_method': 'uniform', 'subsample': 0.35698739018179343, 'gamma': 8.317240783307977}. Best is trial 157 with value: 4.190664877103371.
[I 2023-12-19 05:09:05,065] Trial 169 pruned. Trial was pruned at iteration 0.
[I 2023-12-19 05:09:05,155] Trial 170 pruned. Trial was pruned at iteration 0.
[I 2023-12-19 05:10:42,827] Trial 171 finished with value: 4.254511177208995 and parameters: {'learning_rate': 0.11899278380550432, 'aft_loss_distribution': 'logistic', 'aft_loss_distribution_scale': 0.7724654648505684, 'max_depth': 7, 'booster': 'dart', 'scale_pos_weight': 5.552811319958062, 'alpha': 1.983413576313136, 'lambda': 9.47129564331079, 'eta': 0.019384686383087116, 'sampling_method': 'uniform', 'subsample': 0.43817665734995187, 'gamma': 8.749620048184665}. Best is trial 157 with value: 4.190664877103371.
[I 2023-12-19 05:10:42,928] Trial 172 pruned. Trial was pruned at iteration 0.
[I 2023-12-19 05:10:43,016] Trial 173 pruned. Trial was pruned at iteration 0.
[I 2023-12-19 05:10:43,103] Trial 174 pruned. Trial was pruned at iteration 0.
[I 2023-12-19 05:10:43,191] Trial 175 pruned. Trial was pruned at iteration 0.
[I 2023-12-19 05:10:43,280] Trial 176 pruned. Trial was pruned at iteration 0.
[I 2023-12-19 05:10:43,365] Trial 177 pruned. Trial was pruned at iteration 0.
[I 2023-12-19 05:10:43,451] Trial 178 pruned. Trial was pruned at iteration 0.
[I 2023-12-19 05:10:43,537] Trial 179 pruned. Trial was pruned at iteration 0.
[I 2023-12-19 05:10:51,964] Trial 180 finished with value: 4.263113956053104 and parameters: {'learning_rate': 0.16688173858891833, 'aft_loss_distribution': 'logistic', 'aft_loss_distribution_scale': 0.7854463968044436, 'max_depth': 7, 'booster': 'dart', 'scale_pos_weight': 6.792288705642309, 'alpha': 1.101398044085863, 'lambda': 9.057939545881863, 'eta': 0.04223375523687286, 'sampling_method': 'uniform', 'subsample': 0.43401011378216603, 'gamma': 9.470977406735734}. Best is trial 157 with value: 4.190664877103371.
[I 2023-12-19 05:11:32,594] Trial 181 finished with value: 4.28412122515342 and parameters: {'learning_rate': 0.16605915706595886, 'aft_loss_distribution': 'logistic', 'aft_loss_distribution_scale': 0.8249349065055241, 'max_depth': 7, 'booster': 'dart', 'scale_pos_weight': 6.458235504139321, 'alpha': 1.1462265681650008, 'lambda': 9.637058825989138, 'eta': 0.03857327966027538, 'sampling_method': 'uniform', 'subsample': 0.4241807101865554, 'gamma': 9.237268028276594}. Best is trial 157 with value: 4.190664877103371.
[I 2023-12-19 05:12:06,880] Trial 182 finished with value: 4.2316013753752655 and parameters: {'learning_rate': 0.16486625158715423, 'aft_loss_distribution': 'logistic', 'aft_loss_distribution_scale': 0.7254633887304862, 'max_depth': 7, 'booster': 'dart', 'scale_pos_weight': 6.733254676226869, 'alpha': 1.2214513650370222, 'lambda': 9.082504326767175, 'eta': 0.044570402429929816, 'sampling_method': 'uniform', 'subsample': 0.4484206195106113, 'gamma': 9.300360434304292}. Best is trial 157 with value: 4.190664877103371.
[I 2023-12-19 05:12:06,969] Trial 183 pruned. Trial was pruned at iteration 0.
[I 2023-12-19 05:12:43,938] Trial 184 finished with value: 4.2187221450325065 and parameters: {'learning_rate': 0.13077245829815373, 'aft_loss_distribution': 'logistic', 'aft_loss_distribution_scale': 0.7015897326088131, 'max_depth': 7, 'booster': 'dart', 'scale_pos_weight': 6.9255126508685, 'alpha': 1.5068004173573377, 'lambda': 9.293132207258228, 'eta': 0.4762582167620845, 'sampling_method': 'uniform', 'subsample': 0.41107716283077, 'gamma': 9.272853766932718}. Best is trial 157 with value: 4.190664877103371.
[I 2023-12-19 05:13:48,787] Trial 185 finished with value: 4.186890107779168 and parameters: {'learning_rate': 0.09421525704648705, 'aft_loss_distribution': 'logistic', 'aft_loss_distribution_scale': 0.6260516948949496, 'max_depth': 7, 'booster': 'dart', 'scale_pos_weight': 7.016260005308683, 'alpha': 1.5153042771748662, 'lambda': 9.273217098351303, 'eta': 0.4377286396798746, 'sampling_method': 'uniform', 'subsample': 0.41183846401788654, 'gamma': 9.287568315318072}. Best is trial 185 with value: 4.186890107779168.
[I 2023-12-19 05:13:48,946] Trial 186 pruned. Trial was pruned at iteration 0.
[I 2023-12-19 05:13:49,084] Trial 187 pruned. Trial was pruned at iteration 0.
[I 2023-12-19 05:13:49,365] Trial 188 pruned. Trial was pruned at iteration 0.
[I 2023-12-19 05:13:49,504] Trial 189 pruned. Trial was pruned at iteration 0.
[I 2023-12-19 05:13:49,673] Trial 190 pruned. Trial was pruned at iteration 0.
[I 2023-12-19 05:14:15,775] Trial 191 finished with value: 4.249268545263576 and parameters: {'learning_rate': 0.17070004679937878, 'aft_loss_distribution': 'logistic', 'aft_loss_distribution_scale': 0.7618167303726686, 'max_depth': 7, 'booster': 'dart', 'scale_pos_weight': 6.506376838826844, 'alpha': 1.803336539216875, 'lambda': 9.399393507533222, 'eta': 0.508079004240159, 'sampling_method': 'uniform', 'subsample': 0.43758657449113847, 'gamma': 9.404306727701584}. Best is trial 185 with value: 4.186890107779168.
[I 2023-12-19 05:14:15,866] Trial 192 pruned. Trial was pruned at iteration 0.
[I 2023-12-19 05:14:53,218] Trial 193 finished with value: 4.2308095450201915 and parameters: {'learning_rate': 0.1596723743780032, 'aft_loss_distribution': 'logistic', 'aft_loss_distribution_scale': 0.7234318762523265, 'max_depth': 7, 'booster': 'dart', 'scale_pos_weight': 7.392712261659243, 'alpha': 1.7704051689181326, 'lambda': 9.323347600570793, 'eta': 0.4511208441752041, 'sampling_method': 'uniform', 'subsample': 0.4267582578787191, 'gamma': 9.094630549577856}. Best is trial 185 with value: 4.186890107779168.
[I 2023-12-19 05:14:53,306] Trial 194 pruned. Trial was pruned at iteration 0.
[I 2023-12-19 05:14:53,400] Trial 195 pruned. Trial was pruned at iteration 0.
[I 2023-12-19 05:15:01,622] Trial 196 finished with value: 4.266776580839222 and parameters: {'learning_rate': 0.14645892666804705, 'aft_loss_distribution': 'logistic', 'aft_loss_distribution_scale': 0.792477569836524, 'max_depth': 7, 'booster': 'dart', 'scale_pos_weight': 7.286901876843048, 'alpha': 1.4589253224838816, 'lambda': 3.7175964257041394, 'eta': 0.4954490967025602, 'sampling_method': 'uniform', 'subsample': 0.45223967707066426, 'gamma': 9.035276587798904}. Best is trial 185 with value: 4.186890107779168.
[I 2023-12-19 05:15:34,320] Trial 197 finished with value: 4.226168005411346 and parameters: {'learning_rate': 0.10386726574813171, 'aft_loss_distribution': 'logistic', 'aft_loss_distribution_scale': 0.7073633661713215, 'max_depth': 7, 'booster': 'dart', 'scale_pos_weight': 7.295774728611431, 'alpha': 1.5447752485437507, 'lambda': 1.7307792654116834, 'eta': 0.4403528157676354, 'sampling_method': 'uniform', 'subsample': 0.32779788406611454, 'gamma': 9.264430404675878}. Best is trial 185 with value: 4.186890107779168.
[I 2023-12-19 05:15:34,416] Trial 198 pruned. Trial was pruned at iteration 0.
