[I 2023-12-21 03:09:47,930] Trial 222 finished with value: inf and parameters: {'learning_rate': 0.6942770418897184, 'aft_loss_distributi                                                                     on': 'normal', 'aft_loss_distribution_scale': 1.6273206293074907, 'max_depth': 8, 'booster': 'dart', 'scale_pos_weight': 2.51492240682141                                                                     4, 'alpha': 2.005318634245294, 'lambda': 3.2105807905707366, 'eta': 0.3965346200231066, 'sampling_method': 'uniform', 'subsample': 0.2100                                                                     8332583748557, 'gamma': 8.984992885314725}. Best is trial 211 with value: 4.417812892191642.
[I 2023-12-21 03:09:48,960] Trial 223 finished with value: inf and parameters: {'learning_rate': 0.7264298708164006, 'aft_loss_distributi                                                                     on': 'normal', 'aft_loss_distribution_scale': 1.4617471967903362, 'max_depth': 4, 'booster': 'dart', 'scale_pos_weight': 2.20184353354696                                                                     33, 'alpha': 9.81220045744229, 'lambda': 3.670463559562593, 'eta': 0.45880822192514115, 'sampling_method': 'uniform', 'subsample': 0.2633                                                                     4839363129425, 'gamma': 7.221206384123063}. Best is trial 211 with value: 4.417812892191642.
[I 2023-12-21 03:09:49,002] Trial 224 pruned. Trial was pruned at iteration 0.
[I 2023-12-21 03:09:49,043] Trial 225 pruned. Trial was pruned at iteration 0.
[I 2023-12-21 03:09:49,083] Trial 226 pruned. Trial was pruned at iteration 0.
[I 2023-12-21 03:09:49,126] Trial 227 pruned. Trial was pruned at iteration 0.
[I 2023-12-21 03:09:49,168] Trial 228 pruned. Trial was pruned at iteration 0.
[I 2023-12-21 03:09:49,210] Trial 229 pruned. Trial was pruned at iteration 0.
[I 2023-12-21 03:09:49,253] Trial 230 pruned. Trial was pruned at iteration 0.
[I 2023-12-21 03:09:49,296] Trial 231 pruned. Trial was pruned at iteration 1.
[I 2023-12-21 03:09:50,394] Trial 232 finished with value: inf and parameters: {'learning_rate': 0.6933318623939789, 'aft_loss_distributi                                                                     on': 'normal', 'aft_loss_distribution_scale': 1.4636807679738981, 'max_depth': 8, 'booster': 'dart', 'scale_pos_weight': 1.35991023362009                                                                     66, 'alpha': 9.284347620197074, 'lambda': 3.048705563940289, 'eta': 0.3510269368771123, 'sampling_method': 'uniform', 'subsample': 0.2583                                                                     1107946325016, 'gamma': 3.456606117576836}. Best is trial 211 with value: 4.417812892191642.
[I 2023-12-21 03:09:50,439] Trial 233 pruned. Trial was pruned at iteration 1.
[I 2023-12-21 03:09:50,481] Trial 234 pruned. Trial was pruned at iteration 0.
[I 2023-12-21 03:09:50,524] Trial 235 pruned. Trial was pruned at iteration 1.
[I 2023-12-21 03:09:50,566] Trial 236 pruned. Trial was pruned at iteration 0.
[I 2023-12-21 03:09:50,617] Trial 237 pruned. Trial was pruned at iteration 1.
[I 2023-12-21 03:09:50,659] Trial 238 pruned. Trial was pruned at iteration 0.
[I 2023-12-21 03:09:50,701] Trial 239 pruned. Trial was pruned at iteration 0.
[I 2023-12-21 03:09:50,744] Trial 240 pruned. Trial was pruned at iteration 0.
[I 2023-12-21 03:09:50,791] Trial 241 pruned. Trial was pruned at iteration 2.
[I 2023-12-21 03:09:50,835] Trial 242 pruned. Trial was pruned at iteration 1.
[I 2023-12-21 03:09:54,446] Trial 243 finished with value: 4.389970926437229 and parameters: {'learning_rate': 0.7284157381123005, 'aft_l                                                                     oss_distribution': 'normal', 'aft_loss_distribution_scale': 1.5863301489400214, 'max_depth': 8, 'booster': 'dart', 'scale_pos_weight': 2.                                                                     2219390859612522, 'alpha': 9.632500954565227, 'lambda': 2.6673018329850984, 'eta': 0.3181791462121644, 'sampling_method': 'uniform', 'sub                                                                     sample': 0.2566207361320286, 'gamma': 8.594384552367288}. Best is trial 243 with value: 4.389970926437229.
[I 2023-12-21 03:09:55,501] Trial 244 finished with value: inf and parameters: {'learning_rate': 0.7224725110908078, 'aft_loss_distributi                                                                     on': 'normal', 'aft_loss_distribution_scale': 1.4945492327190986, 'max_depth': 8, 'booster': 'dart', 'scale_pos_weight': 2.20561096345443                                                                     1, 'alpha': 4.076285569595721, 'lambda': 2.716210753468821, 'eta': 0.2584119295294552, 'sampling_method': 'uniform', 'subsample': 0.25623                                                                     984817595724, 'gamma': 8.34575504874357}. Best is trial 243 with value: 4.389970926437229.
[I 2023-12-21 03:09:55,544] Trial 245 pruned. Trial was pruned at iteration 0.
[I 2023-12-21 03:09:55,586] Trial 246 pruned. Trial was pruned at iteration 0.
[I 2023-12-21 03:09:55,633] Trial 247 pruned. Trial was pruned at iteration 1.
[I 2023-12-21 03:09:55,675] Trial 248 pruned. Trial was pruned at iteration 0.
[I 2023-12-21 03:09:55,718] Trial 249 pruned. Trial was pruned at iteration 0.
[I 2023-12-21 03:09:55,760] Trial 250 pruned. Trial was pruned at iteration 0.
[I 2023-12-21 03:09:56,056] Trial 251 finished with value: inf and parameters: {'learning_rate': 0.9509599587154306, 'aft_loss_distributi                                                                     on': 'normal', 'aft_loss_distribution_scale': 0.9690750726268003, 'max_depth': 10, 'booster': 'gbtree', 'scale_pos_weight': 0.94477863007                                                                     91725, 'alpha': 9.62381229721781, 'lambda': 6.612030314764494, 'eta': 0.3586068379587363, 'sampling_method': 'gradient_based', 'subsample                                                                     ': 0.6695947238648328, 'gamma': 1.77831349176177}. Best is trial 243 with value: 4.389970926437229.
[I 2023-12-21 03:09:57,173] Trial 252 finished with value: inf and parameters: {'learning_rate': 0.7081662353557049, 'aft_loss_distributi                                                                     on': 'normal', 'aft_loss_distribution_scale': 1.490757433362423, 'max_depth': 7, 'booster': 'dart', 'scale_pos_weight': 5.076564268845173                                                                     , 'alpha': 0.21869889153434952, 'lambda': 3.3133664071055393, 'eta': 0.29286917580656313, 'sampling_method': 'uniform', 'subsample': 0.24                                                                     61189376812874, 'gamma': 3.5776281681020072}. Best is trial 243 with value: 4.389970926437229.
[I 2023-12-21 03:09:57,216] Trial 253 pruned. Trial was pruned at iteration 0.
[I 2023-12-21 03:09:57,260] Trial 254 pruned. Trial was pruned at iteration 0.
[I 2023-12-21 03:09:57,305] Trial 255 pruned. Trial was pruned at iteration 0.
[I 2023-12-21 03:09:57,347] Trial 256 pruned. Trial was pruned at iteration 0.
[I 2023-12-21 03:09:57,389] Trial 257 pruned. Trial was pruned at iteration 0.
[I 2023-12-21 03:09:57,431] Trial 258 pruned. Trial was pruned at iteration 0.
[I 2023-12-21 03:09:57,473] Trial 259 pruned. Trial was pruned at iteration 0.
[I 2023-12-21 03:09:57,515] Trial 260 pruned. Trial was pruned at iteration 0.
[I 2023-12-21 03:09:57,561] Trial 261 pruned. Trial was pruned at iteration 0.
[I 2023-12-21 03:09:57,603] Trial 262 pruned. Trial was pruned at iteration 0.
[I 2023-12-21 03:09:58,597] Trial 263 finished with value: inf and parameters: {'learning_rate': 0.7109608752089215, 'aft_loss_distributi                                                                     on': 'normal', 'aft_loss_distribution_scale': 1.5790171303861609, 'max_depth': 10, 'booster': 'dart', 'scale_pos_weight': 1.6888806870954                                                                     66, 'alpha': 5.308131568197851, 'lambda': 4.17536515268219, 'eta': 0.4588045408610701, 'sampling_method': 'uniform', 'subsample': 0.27721                                                                     18061049651, 'gamma': 5.494190397912795}. Best is trial 243 with value: 4.389970926437229.
[I 2023-12-21 03:09:58,641] Trial 264 pruned. Trial was pruned at iteration 0.
[I 2023-12-21 03:09:58,684] Trial 265 pruned. Trial was pruned at iteration 0.
[I 2023-12-21 03:09:58,727] Trial 266 pruned. Trial was pruned at iteration 0.
[I 2023-12-21 03:09:58,771] Trial 267 pruned. Trial was pruned at iteration 0.
[I 2023-12-21 03:09:58,816] Trial 268 pruned. Trial was pruned at iteration 0.
[I 2023-12-21 03:09:58,859] Trial 269 pruned. Trial was pruned at iteration 0.
[I 2023-12-21 03:09:58,902] Trial 270 pruned. Trial was pruned at iteration 0.
[I 2023-12-21 03:09:58,945] Trial 271 pruned. Trial was pruned at iteration 0.
[I 2023-12-21 03:09:59,891] Trial 272 finished with value: inf and parameters: {'learning_rate': 0.9701057614770305, 'aft_loss_distributi                                                                     on': 'normal', 'aft_loss_distribution_scale': 1.6766316771331444, 'max_depth': 8, 'booster': 'dart', 'scale_pos_weight': 4.85356216691676                                                                     94, 'alpha': 1.2129460118061366, 'lambda': 3.153442105387179, 'eta': 0.02937317999509348, 'sampling_method': 'gradient_based', 'subsample                                                                     ': 0.74147254010528, 'gamma': 5.8835050581114245}. Best is trial 243 with value: 4.389970926437229.
[I 2023-12-21 03:10:00,930] Trial 273 finished with value: inf and parameters: {'learning_rate': 0.9094610066180432, 'aft_loss_distributi                                                                     on': 'normal', 'aft_loss_distribution_scale': 1.151009819458674, 'max_depth': 5, 'booster': 'dart', 'scale_pos_weight': 3.155331893313970                                                                     2, 'alpha': 7.497301733729835, 'lambda': 4.314954944780472, 'eta': 0.37180270487046546, 'sampling_method': 'uniform', 'subsample': 0.1138                                                                     103538798361, 'gamma': 3.1834051499090785}. Best is trial 243 with value: 4.389970926437229.
[I 2023-12-21 03:10:00,979] Trial 274 pruned. Trial was pruned at iteration 0.
[I 2023-12-21 03:10:01,028] Trial 275 pruned. Trial was pruned at iteration 0.
[I 2023-12-21 03:10:01,072] Trial 276 pruned. Trial was pruned at iteration 0.
[I 2023-12-21 03:10:01,116] Trial 277 pruned. Trial was pruned at iteration 0.
[I 2023-12-21 03:10:01,161] Trial 278 pruned. Trial was pruned at iteration 1.
[I 2023-12-21 03:10:01,204] Trial 279 pruned. Trial was pruned at iteration 0.
[I 2023-12-21 03:10:01,249] Trial 280 pruned. Trial was pruned at iteration 0.
[I 2023-12-21 03:10:01,295] Trial 281 pruned. Trial was pruned at iteration 1.
[I 2023-12-21 03:10:01,340] Trial 282 pruned. Trial was pruned at iteration 0.
[I 2023-12-21 03:10:01,393] Trial 283 pruned. Trial was pruned at iteration 0.
[I 2023-12-21 03:10:01,439] Trial 284 pruned. Trial was pruned at iteration 1.
[I 2023-12-21 03:10:01,483] Trial 285 pruned. Trial was pruned at iteration 0.
[I 2023-12-21 03:10:01,527] Trial 286 pruned. Trial was pruned at iteration 0.
[I 2023-12-21 03:10:01,571] Trial 287 pruned. Trial was pruned at iteration 0.
[I 2023-12-21 03:10:01,617] Trial 288 pruned. Trial was pruned at iteration 0.
[I 2023-12-21 03:10:01,660] Trial 289 pruned. Trial was pruned at iteration 0.
[I 2023-12-21 03:10:01,704] Trial 290 pruned. Trial was pruned at iteration 0.
[I 2023-12-21 03:10:01,748] Trial 291 pruned. Trial was pruned at iteration 0.
[I 2023-12-21 03:10:01,794] Trial 292 pruned. Trial was pruned at iteration 0.
[I 2023-12-21 03:10:01,838] Trial 293 pruned. Trial was pruned at iteration 0.
[I 2023-12-21 03:10:01,883] Trial 294 pruned. Trial was pruned at iteration 0.
[I 2023-12-21 03:10:01,927] Trial 295 pruned. Trial was pruned at iteration 0.
[I 2023-12-21 03:10:01,971] Trial 296 pruned. Trial was pruned at iteration 0.
[I 2023-12-21 03:10:02,016] Trial 297 pruned. Trial was pruned at iteration 0.
[I 2023-12-21 03:10:02,060] Trial 298 pruned. Trial was pruned at iteration 0.
[I 2023-12-21 03:10:02,105] Trial 299 pruned. Trial was pruned at iteration 0.
[I 2023-12-21 03:10:02,152] Trial 300 pruned. Trial was pruned at iteration 0.
[I 2023-12-21 03:10:02,197] Trial 301 pruned. Trial was pruned at iteration 0.
[I 2023-12-21 03:10:02,244] Trial 302 pruned. Trial was pruned at iteration 0.
[I 2023-12-21 03:10:02,289] Trial 303 pruned. Trial was pruned at iteration 0.
[I 2023-12-21 03:10:02,334] Trial 304 pruned. Trial was pruned at iteration 0.
[I 2023-12-21 03:10:02,378] Trial 305 pruned. Trial was pruned at iteration 0.
[I 2023-12-21 03:10:02,423] Trial 306 pruned. Trial was pruned at iteration 0.
[I 2023-12-21 03:10:02,471] Trial 307 pruned. Trial was pruned at iteration 0.
[I 2023-12-21 03:10:02,516] Trial 308 pruned. Trial was pruned at iteration 0.
[I 2023-12-21 03:10:02,561] Trial 309 pruned. Trial was pruned at iteration 0.
[I 2023-12-21 03:10:02,607] Trial 310 pruned. Trial was pruned at iteration 0.
[I 2023-12-21 03:10:02,652] Trial 311 pruned. Trial was pruned at iteration 0.
[I 2023-12-21 03:10:02,697] Trial 312 pruned. Trial was pruned at iteration 0.
[I 2023-12-21 03:10:02,745] Trial 313 pruned. Trial was pruned at iteration 0.
[I 2023-12-21 03:10:02,790] Trial 314 pruned. Trial was pruned at iteration 0.
[I 2023-12-21 03:10:02,837] Trial 315 pruned. Trial was pruned at iteration 0.
[I 2023-12-21 03:10:02,882] Trial 316 pruned. Trial was pruned at iteration 0.
[I 2023-12-21 03:10:02,928] Trial 317 pruned. Trial was pruned at iteration 0.
[I 2023-12-21 03:10:02,975] Trial 318 pruned. Trial was pruned at iteration 0.
[I 2023-12-21 03:10:03,022] Trial 319 pruned. Trial was pruned at iteration 0.
[I 2023-12-21 03:10:03,068] Trial 320 pruned. Trial was pruned at iteration 0.
[I 2023-12-21 03:10:03,113] Trial 321 pruned. Trial was pruned at iteration 0.
[I 2023-12-21 03:10:03,159] Trial 322 pruned. Trial was pruned at iteration 0.
[I 2023-12-21 03:10:03,206] Trial 323 pruned. Trial was pruned at iteration 0.
[I 2023-12-21 03:10:03,252] Trial 324 pruned. Trial was pruned at iteration 0.
[I 2023-12-21 03:10:03,298] Trial 325 pruned. Trial was pruned at iteration 0.
[I 2023-12-21 03:10:03,345] Trial 326 pruned. Trial was pruned at iteration 0.
[I 2023-12-21 03:10:03,391] Trial 327 pruned. Trial was pruned at iteration 0.
[I 2023-12-21 03:10:03,441] Trial 328 pruned. Trial was pruned at iteration 0.
[I 2023-12-21 03:10:03,488] Trial 329 pruned. Trial was pruned at iteration 0.
[I 2023-12-21 03:10:03,536] Trial 330 pruned. Trial was pruned at iteration 1.
[I 2023-12-21 03:10:03,583] Trial 331 pruned. Trial was pruned at iteration 0.
[I 2023-12-21 03:10:03,635] Trial 332 pruned. Trial was pruned at iteration 0.
[I 2023-12-21 03:10:03,695] Trial 333 pruned. Trial was pruned at iteration 0.
[I 2023-12-21 03:10:03,742] Trial 334 pruned. Trial was pruned at iteration 0.
[I 2023-12-21 03:10:03,789] Trial 335 pruned. Trial was pruned at iteration 0.
[I 2023-12-21 03:10:04,949] Trial 336 finished with value: inf and parameters: {'learning_rate': 0.7903220001575704, 'aft_loss_distributi                                                                     on': 'normal', 'aft_loss_distribution_scale': 1.121422315431439, 'max_depth': 8, 'booster': 'dart', 'scale_pos_weight': 1.922277351155010                                                                     6, 'alpha': 9.184154412043181, 'lambda': 5.219717356114572, 'eta': 0.4109117762626428, 'sampling_method': 'uniform', 'subsample': 0.27485                                                                     57586308869, 'gamma': 1.8760913057034827}. Best is trial 243 with value: 4.389970926437229.
[I 2023-12-21 03:10:04,995] Trial 337 pruned. Trial was pruned at iteration 0.
[I 2023-12-21 03:10:05,056] Trial 338 pruned. Trial was pruned at iteration 1.
[I 2023-12-21 03:10:06,022] Trial 339 finished with value: inf and parameters: {'learning_rate': 0.9294335863471901, 'aft_loss_distributi                                                                     on': 'normal', 'aft_loss_distribution_scale': 1.3319830546091578, 'max_depth': 9, 'booster': 'dart', 'scale_pos_weight': 1.02782661116022                                                                     46, 'alpha': 5.353631177050837, 'lambda': 3.623628855935796, 'eta': 0.2525202948865051, 'sampling_method': 'uniform', 'subsample': 0.9498                                                                     847806414803, 'gamma': 1.5021249534527894}. Best is trial 243 with value: 4.389970926437229.
[I 2023-12-21 03:10:06,068] Trial 340 pruned. Trial was pruned at iteration 0.
[I 2023-12-21 03:10:06,115] Trial 341 pruned. Trial was pruned at iteration 0.
[I 2023-12-21 03:10:06,162] Trial 342 pruned. Trial was pruned at iteration 0.
[I 2023-12-21 03:10:06,208] Trial 343 pruned. Trial was pruned at iteration 0.
[I 2023-12-21 03:10:06,256] Trial 344 pruned. Trial was pruned at iteration 0.
[I 2023-12-21 03:10:06,306] Trial 345 pruned. Trial was pruned at iteration 0.
[I 2023-12-21 03:10:07,300] Trial 346 finished with value: inf and parameters: {'learning_rate': 0.7208870571806809, 'aft_loss_distributi                                                                     on': 'normal', 'aft_loss_distribution_scale': 1.417606168722482, 'max_depth': 4, 'booster': 'dart', 'scale_pos_weight': 7.312093234684363                                                                     5, 'alpha': 2.3912048697206907, 'lambda': 4.027471378998123, 'eta': 0.47115533137360704, 'sampling_method': 'uniform', 'subsample': 0.202                                                                     01018174295865, 'gamma': 0.32082414074647847}. Best is trial 243 with value: 4.389970926437229.
[I 2023-12-21 03:10:07,347] Trial 347 pruned. Trial was pruned at iteration 0.
[I 2023-12-21 03:10:07,397] Trial 348 pruned. Trial was pruned at iteration 1.
[I 2023-12-21 03:10:07,443] Trial 349 pruned. Trial was pruned at iteration 0.
[I 2023-12-21 03:10:07,490] Trial 350 pruned. Trial was pruned at iteration 0.
[I 2023-12-21 03:10:07,537] Trial 351 pruned. Trial was pruned at iteration 0.
[I 2023-12-21 03:10:07,584] Trial 352 pruned. Trial was pruned at iteration 0.
[I 2023-12-21 03:10:07,637] Trial 353 pruned. Trial was pruned at iteration 0.
[I 2023-12-21 03:10:07,685] Trial 354 pruned. Trial was pruned at iteration 0.
[I 2023-12-21 03:10:07,732] Trial 355 pruned. Trial was pruned at iteration 0.
[I 2023-12-21 03:10:08,034] Trial 356 finished with value: inf and parameters: {'learning_rate': 0.9862559544285542, 'aft_loss_distributi                                                                     on': 'normal', 'aft_loss_distribution_scale': 1.2717638122540729, 'max_depth': 9, 'booster': 'gbtree', 'scale_pos_weight': 5.547450845127                                                                     066, 'alpha': 6.72758478482756, 'lambda': 2.5629412515371763, 'eta': 0.5233046259078811, 'sampling_method': 'uniform', 'subsample': 0.549                                                                     0767989934583, 'gamma': 1.7569932749517063}. Best is trial 243 with value: 4.389970926437229.
[I 2023-12-21 03:10:08,081] Trial 357 pruned. Trial was pruned at iteration 0.
[I 2023-12-21 03:10:08,128] Trial 358 pruned. Trial was pruned at iteration 0.
[I 2023-12-21 03:10:08,175] Trial 359 pruned. Trial was pruned at iteration 0.
[I 2023-12-21 03:10:08,225] Trial 360 pruned. Trial was pruned at iteration 0.
[I 2023-12-21 03:10:08,272] Trial 361 pruned. Trial was pruned at iteration 0.
[I 2023-12-21 03:10:08,319] Trial 362 pruned. Trial was pruned at iteration 0.
[I 2023-12-21 03:10:08,370] Trial 363 pruned. Trial was pruned at iteration 0.
[I 2023-12-21 03:10:08,417] Trial 364 pruned. Trial was pruned at iteration 0.
[I 2023-12-21 03:10:09,403] Trial 365 finished with value: inf and parameters: {'learning_rate': 0.6951650814489928, 'aft_loss_distributi                                                                     on': 'normal', 'aft_loss_distribution_scale': 1.6068326041705725, 'max_depth': 3, 'booster': 'dart', 'scale_pos_weight': 1.97012254874734                                                                     42, 'alpha': 3.513826015499645, 'lambda': 1.991954372294131, 'eta': 0.9175817516623337, 'sampling_method': 'uniform', 'subsample': 0.6985                                                                     770656636584, 'gamma': 3.7220517149781163}. Best is trial 243 with value: 4.389970926437229.
[I 2023-12-21 03:10:09,459] Trial 366 pruned. Trial was pruned at iteration 0.
[I 2023-12-21 03:10:09,506] Trial 367 pruned. Trial was pruned at iteration 0.
[I 2023-12-21 03:10:09,553] Trial 368 pruned. Trial was pruned at iteration 0.
[I 2023-12-21 03:10:09,600] Trial 369 pruned. Trial was pruned at iteration 0.
[I 2023-12-21 03:10:09,648] Trial 370 pruned. Trial was pruned at iteration 0.
[I 2023-12-21 03:10:09,695] Trial 371 pruned. Trial was pruned at iteration 0.
[I 2023-12-21 03:10:09,742] Trial 372 pruned. Trial was pruned at iteration 0.
[I 2023-12-21 03:10:09,791] Trial 373 pruned. Trial was pruned at iteration 0.
[I 2023-12-21 03:10:09,841] Trial 374 pruned. Trial was pruned at iteration 0.
