[I 2023-12-21 04:01:42,957] Trial 494 pruned. Trial was pruned at iteration 1.
[I 2023-12-21 04:01:43,091] Trial 495 finished with value: inf and parameters: {'learning_rate': 0.8827914782658723, 'aft_loss_distributi                                                                     on': 'normal', 'aft_loss_distribution_scale': 1.0230200403724141, 'max_depth': 6, 'booster': 'gbtree', 'scale_pos_weight': 3.347255025890                                                                     533, 'alpha': 6.819691292541894, 'lambda': 5.1096915126616125, 'eta': 0.39086101283592467, 'sampling_method': 'uniform', 'subsample': 0.9                                                                     397617074499802, 'gamma': 7.659056162300494}. Best is trial 81 with value: 4.234078754776428.
[I 2023-12-21 04:01:43,143] Trial 496 pruned. Trial was pruned at iteration 0.
[I 2023-12-21 04:01:43,305] Trial 497 finished with value: 4.255882952532556 and parameters: {'learning_rate': 0.9224081688085403, 'aft_l                                                                     oss_distribution': 'normal', 'aft_loss_distribution_scale': 1.1412451478845815, 'max_depth': 3, 'booster': 'gbtree', 'scale_pos_weight':                                                                      1.8869040699069437, 'alpha': 0.7199144182043424, 'lambda': 1.329089521161606, 'eta': 0.4106007435864991, 'sampling_method': 'uniform', 's                                                                     ubsample': 0.9090315604567996, 'gamma': 9.517321247759678}. Best is trial 81 with value: 4.234078754776428.
[I 2023-12-21 04:01:43,361] Trial 498 pruned. Trial was pruned at iteration 1.
[I 2023-12-21 04:01:43,415] Trial 499 pruned. Trial was pruned at iteration 1.
[W 2023-12-21 04:01:43,510] Trial 4 is omitted in visualization because its objective value is inf or nan.
[W 2023-12-21 04:01:43,510] Trial 21 is omitted in visualization because its objective value is inf or nan.
[W 2023-12-21 04:01:43,510] Trial 24 is omitted in visualization because its objective value is inf or nan.
[W 2023-12-21 04:01:43,510] Trial 30 is omitted in visualization because its objective value is inf or nan.
[W 2023-12-21 04:01:43,511] Trial 31 is omitted in visualization because its objective value is inf or nan.
[W 2023-12-21 04:01:43,511] Trial 40 is omitted in visualization because its objective value is inf or nan.
[W 2023-12-21 04:01:43,511] Trial 50 is omitted in visualization because its objective value is inf or nan.
[W 2023-12-21 04:01:43,511] Trial 53 is omitted in visualization because its objective value is inf or nan.
[W 2023-12-21 04:01:43,511] Trial 56 is omitted in visualization because its objective value is inf or nan.
[W 2023-12-21 04:01:43,511] Trial 65 is omitted in visualization because its objective value is inf or nan.
[W 2023-12-21 04:01:43,511] Trial 68 is omitted in visualization because its objective value is inf or nan.
[W 2023-12-21 04:01:43,511] Trial 70 is omitted in visualization because its objective value is inf or nan.
[W 2023-12-21 04:01:43,511] Trial 75 is omitted in visualization because its objective value is inf or nan.
[W 2023-12-21 04:01:43,511] Trial 85 is omitted in visualization because its objective value is inf or nan.
[W 2023-12-21 04:01:43,511] Trial 86 is omitted in visualization because its objective value is inf or nan.
[W 2023-12-21 04:01:43,511] Trial 89 is omitted in visualization because its objective value is inf or nan.
[W 2023-12-21 04:01:43,511] Trial 91 is omitted in visualization because its objective value is inf or nan.
[W 2023-12-21 04:01:43,511] Trial 93 is omitted in visualization because its objective value is inf or nan.
[W 2023-12-21 04:01:43,511] Trial 95 is omitted in visualization because its objective value is inf or nan.
[W 2023-12-21 04:01:43,511] Trial 97 is omitted in visualization because its objective value is inf or nan.
[W 2023-12-21 04:01:43,511] Trial 98 is omitted in visualization because its objective value is inf or nan.
[W 2023-12-21 04:01:43,511] Trial 112 is omitted in visualization because its objective value is inf or nan.
[W 2023-12-21 04:01:43,511] Trial 113 is omitted in visualization because its objective value is inf or nan.
[W 2023-12-21 04:01:43,511] Trial 116 is omitted in visualization because its objective value is inf or nan.
[W 2023-12-21 04:01:43,512] Trial 117 is omitted in visualization because its objective value is inf or nan.
[W 2023-12-21 04:01:43,512] Trial 118 is omitted in visualization because its objective value is inf or nan.
[W 2023-12-21 04:01:43,512] Trial 126 is omitted in visualization because its objective value is inf or nan.
[W 2023-12-21 04:01:43,512] Trial 131 is omitted in visualization because its objective value is inf or nan.
[W 2023-12-21 04:01:43,512] Trial 132 is omitted in visualization because its objective value is inf or nan.
[W 2023-12-21 04:01:43,512] Trial 141 is omitted in visualization because its objective value is inf or nan.
[W 2023-12-21 04:01:43,512] Trial 144 is omitted in visualization because its objective value is inf or nan.
[W 2023-12-21 04:01:43,512] Trial 154 is omitted in visualization because its objective value is inf or nan.
[W 2023-12-21 04:01:43,512] Trial 159 is omitted in visualization because its objective value is inf or nan.
[W 2023-12-21 04:01:43,512] Trial 161 is omitted in visualization because its objective value is inf or nan.
[W 2023-12-21 04:01:43,512] Trial 162 is omitted in visualization because its objective value is inf or nan.
[W 2023-12-21 04:01:43,512] Trial 168 is omitted in visualization because its objective value is inf or nan.
[W 2023-12-21 04:01:43,512] Trial 170 is omitted in visualization because its objective value is inf or nan.
[W 2023-12-21 04:01:43,512] Trial 171 is omitted in visualization because its objective value is inf or nan.
[W 2023-12-21 04:01:43,512] Trial 173 is omitted in visualization because its objective value is inf or nan.
[W 2023-12-21 04:01:43,512] Trial 178 is omitted in visualization because its objective value is inf or nan.
[W 2023-12-21 04:01:43,512] Trial 187 is omitted in visualization because its objective value is inf or nan.
[W 2023-12-21 04:01:43,512] Trial 192 is omitted in visualization because its objective value is inf or nan.
[W 2023-12-21 04:01:43,512] Trial 193 is omitted in visualization because its objective value is inf or nan.
[W 2023-12-21 04:01:43,512] Trial 196 is omitted in visualization because its objective value is inf or nan.
[W 2023-12-21 04:01:43,512] Trial 215 is omitted in visualization because its objective value is inf or nan.
[W 2023-12-21 04:01:43,512] Trial 216 is omitted in visualization because its objective value is inf or nan.
[W 2023-12-21 04:01:43,512] Trial 218 is omitted in visualization because its objective value is inf or nan.
[W 2023-12-21 04:01:43,513] Trial 221 is omitted in visualization because its objective value is inf or nan.
[W 2023-12-21 04:01:43,513] Trial 222 is omitted in visualization because its objective value is inf or nan.
[W 2023-12-21 04:01:43,513] Trial 225 is omitted in visualization because its objective value is inf or nan.
[W 2023-12-21 04:01:43,513] Trial 234 is omitted in visualization because its objective value is inf or nan.
[W 2023-12-21 04:01:43,513] Trial 237 is omitted in visualization because its objective value is inf or nan.
[W 2023-12-21 04:01:43,513] Trial 240 is omitted in visualization because its objective value is inf or nan.
[W 2023-12-21 04:01:43,513] Trial 249 is omitted in visualization because its objective value is inf or nan.
[W 2023-12-21 04:01:43,513] Trial 258 is omitted in visualization because its objective value is inf or nan.
[W 2023-12-21 04:01:43,513] Trial 260 is omitted in visualization because its objective value is inf or nan.
[W 2023-12-21 04:01:43,513] Trial 262 is omitted in visualization because its objective value is inf or nan.
[W 2023-12-21 04:01:43,513] Trial 266 is omitted in visualization because its objective value is inf or nan.
[W 2023-12-21 04:01:43,513] Trial 271 is omitted in visualization because its objective value is inf or nan.
[W 2023-12-21 04:01:43,513] Trial 274 is omitted in visualization because its objective value is inf or nan.
[W 2023-12-21 04:01:43,513] Trial 287 is omitted in visualization because its objective value is inf or nan.
[W 2023-12-21 04:01:43,513] Trial 289 is omitted in visualization because its objective value is inf or nan.
[W 2023-12-21 04:01:43,513] Trial 295 is omitted in visualization because its objective value is inf or nan.
[W 2023-12-21 04:01:43,513] Trial 299 is omitted in visualization because its objective value is inf or nan.
[W 2023-12-21 04:01:43,513] Trial 304 is omitted in visualization because its objective value is inf or nan.
[W 2023-12-21 04:01:43,513] Trial 316 is omitted in visualization because its objective value is inf or nan.
[W 2023-12-21 04:01:43,513] Trial 317 is omitted in visualization because its objective value is inf or nan.
[W 2023-12-21 04:01:43,513] Trial 337 is omitted in visualization because its objective value is inf or nan.
[W 2023-12-21 04:01:43,513] Trial 340 is omitted in visualization because its objective value is inf or nan.
[W 2023-12-21 04:01:43,514] Trial 350 is omitted in visualization because its objective value is inf or nan.
[W 2023-12-21 04:01:43,514] Trial 379 is omitted in visualization because its objective value is inf or nan.
[W 2023-12-21 04:01:43,514] Trial 386 is omitted in visualization because its objective value is inf or nan.
[W 2023-12-21 04:01:43,514] Trial 393 is omitted in visualization because its objective value is inf or nan.
[W 2023-12-21 04:01:43,514] Trial 401 is omitted in visualization because its objective value is inf or nan.
[W 2023-12-21 04:01:43,514] Trial 407 is omitted in visualization because its objective value is inf or nan.
[W 2023-12-21 04:01:43,514] Trial 436 is omitted in visualization because its objective value is inf or nan.
[W 2023-12-21 04:01:43,514] Trial 448 is omitted in visualization because its objective value is inf or nan.
[W 2023-12-21 04:01:43,514] Trial 460 is omitted in visualization because its objective value is inf or nan.
[W 2023-12-21 04:01:43,514] Trial 465 is omitted in visualization because its objective value is inf or nan.
[W 2023-12-21 04:01:43,514] Trial 489 is omitted in visualization because its objective value is inf or nan.
[W 2023-12-21 04:01:43,514] Trial 495 is omitted in visualization because its objective value is inf or nan.
exo-open: Cannot open display: .
/cvmfs/soft.computecanada.ca/gentoo/2020/usr/bin/xdg-open: line 871: x-www-browser: command not found
/cvmfs/soft.computecanada.ca/gentoo/2020/usr/bin/xdg-open: line 871: firefox: command not found
/cvmfs/soft.computecanada.ca/gentoo/2020/usr/bin/xdg-open: line 871: iceweasel: command not found
/cvmfs/soft.computecanada.ca/gentoo/2020/usr/bin/xdg-open: line 871: seamonkey: command not found
/cvmfs/soft.computecanada.ca/gentoo/2020/usr/bin/xdg-open: line 871: mozilla: command not found
/cvmfs/soft.computecanada.ca/gentoo/2020/usr/bin/xdg-open: line 871: epiphany: command not found
/cvmfs/soft.computecanada.ca/gentoo/2020/usr/bin/xdg-open: line 871: konqueror: command not found
/cvmfs/soft.computecanada.ca/gentoo/2020/usr/bin/xdg-open: line 871: chromium: command not found
/cvmfs/soft.computecanada.ca/gentoo/2020/usr/bin/xdg-open: line 871: chromium-browser: command not found
/cvmfs/soft.computecanada.ca/gentoo/2020/usr/bin/xdg-open: line 871: google-chrome: command not found
/cvmfs/soft.computecanada.ca/gentoo/2020/usr/bin/xdg-open: line 871: www-browser: command not found
/cvmfs/soft.computecanada.ca/gentoo/2020/usr/bin/xdg-open: line 871: links2: command not found
/home/lisat/.local/lib/python3.10/site-packages/xgboost/data.py:440: FutureWarning:

is_sparse is deprecated and will be removed in a future version. Check `isinstance(dtype, pd.SparseDtype)` instead.

[I 2023-12-21 04:01:46,884] A new study created in memory with name: no-name-b6ad3e4d-47b9-4c50-9c39-8fd535f11a4e
[I 2023-12-21 04:01:46,974] Trial 0 finished with value: 6.058726912379001 and parameters: {'learning_rate': 0.7446442915129349, 'aft_los                                                                     s_distribution': 'logistic', 'aft_loss_distribution_scale': 7.114292984162691, 'max_depth': 7, 'booster': 'gbtree', 'scale_pos_weight': 0                                                                     .7451838269246898, 'alpha': 3.189847366240842, 'lambda': 2.151793292233717, 'eta': 0.3160702237354508, 'sampling_method': 'gradient_based                                                                     ', 'subsample': 0.6692646974888812, 'gamma': 6.69034313765579}. Best is trial 0 with value: 6.058726912379001.
[I 2023-12-21 04:01:50,256] Trial 1 finished with value: 4.871443572286355 and parameters: {'learning_rate': 0.9032633787017174, 'aft_los                                                                     s_distribution': 'normal', 'aft_loss_distribution_scale': 3.094497400854317, 'max_depth': 3, 'booster': 'dart', 'scale_pos_weight': 7.862                                                                     774688477946, 'alpha': 8.930352421706685, 'lambda': 0.5843978679046719, 'eta': 0.6183971481864857, 'sampling_method': 'gradient_based', '                                                                     subsample': 0.8630938434537219, 'gamma': 7.835513429232404}. Best is trial 1 with value: 4.871443572286355.
[I 2023-12-21 04:01:55,087] Trial 2 finished with value: 5.377872742825948 and parameters: {'learning_rate': 0.2677627283801697, 'aft_los                                                                     s_distribution': 'normal', 'aft_loss_distribution_scale': 5.4816993285997375, 'max_depth': 6, 'booster': 'dart', 'scale_pos_weight': 7.68                                                                     2811093040449, 'alpha': 6.197185586627265, 'lambda': 8.359413688064754, 'eta': 0.9013693703902734, 'sampling_method': 'uniform', 'subsamp                                                                     le': 0.7780625969297637, 'gamma': 4.51214130965909}. Best is trial 1 with value: 4.871443572286355.
[I 2023-12-21 04:01:56,224] Trial 3 finished with value: inf and parameters: {'learning_rate': 0.5588190845573444, 'aft_loss_distribution                                                                     ': 'normal', 'aft_loss_distribution_scale': 0.3335537008444962, 'max_depth': 7, 'booster': 'dart', 'scale_pos_weight': 2.118384258874918,                                                                      'alpha': 9.810363420789951, 'lambda': 0.9404971199914544, 'eta': 0.6216905747152005, 'sampling_method': 'gradient_based', 'subsample': 0                                                                     .11236241476858823, 'gamma': 3.513547746914765}. Best is trial 1 with value: 4.871443572286355.
[I 2023-12-21 04:02:05,404] Trial 4 finished with value: 5.416913382506591 and parameters: {'learning_rate': 0.46453876176348946, 'aft_lo                                                                     ss_distribution': 'normal', 'aft_loss_distribution_scale': 5.7198419689371045, 'max_depth': 3, 'booster': 'dart', 'scale_pos_weight': 2.2                                                                     429293835397957, 'alpha': 6.203051805930522, 'lambda': 6.802185022880579, 'eta': 0.3628389491914682, 'sampling_method': 'gradient_based',                                                                      'subsample': 0.5223192291989114, 'gamma': 1.78186360083884}. Best is trial 1 with value: 4.871443572286355.
[I 2023-12-21 04:02:06,411] Trial 5 finished with value: inf and parameters: {'learning_rate': 0.7948992670670606, 'aft_loss_distribution                                                                     ': 'logistic', 'aft_loss_distribution_scale': 1.6712401206165217, 'max_depth': 10, 'booster': 'dart', 'scale_pos_weight': 2.0028744184046                                                                     46, 'alpha': 6.706968960837102, 'lambda': 2.2404017723320417, 'eta': 0.23530079670276416, 'sampling_method': 'gradient_based', 'subsample                                                                     ': 0.10601724353672992, 'gamma': 8.132505926487257}. Best is trial 1 with value: 4.871443572286355.
[I 2023-12-21 04:02:06,417] Trial 6 pruned. Trial was pruned at iteration 0.
[I 2023-12-21 04:02:06,421] Trial 7 pruned. Trial was pruned at iteration 0.
[I 2023-12-21 04:02:06,426] Trial 8 pruned. Trial was pruned at iteration 0.
[I 2023-12-21 04:02:06,430] Trial 9 pruned. Trial was pruned at iteration 0.
[I 2023-12-21 04:02:07,553] Trial 10 finished with value: inf and parameters: {'learning_rate': 0.9806049608095584, 'aft_loss_distributio                                                                     n': 'extreme', 'aft_loss_distribution_scale': 3.421537464044495, 'max_depth': 9, 'booster': 'dart', 'scale_pos_weight': 9.396216480464748                                                                     , 'alpha': 9.657720706287533, 'lambda': 4.36734183504553, 'eta': 0.05942566700860141, 'sampling_method': 'gradient_based', 'subsample': 0                                                                     .9753784854641918, 'gamma': 0.09019452059141031}. Best is trial 1 with value: 4.871443572286355.
[I 2023-12-21 04:02:20,725] Trial 11 finished with value: 5.1185088659592335 and parameters: {'learning_rate': 0.18086046298922262, 'aft_                                                                     loss_distribution': 'normal', 'aft_loss_distribution_scale': 4.114734901388876, 'max_depth': 4, 'booster': 'dart', 'scale_pos_weight': 8.                                                                     381021086290485, 'alpha': 7.5644433773887325, 'lambda': 8.966321196525417, 'eta': 0.9633291255170633, 'sampling_method': 'uniform', 'subs                                                                     ample': 0.8928204626105205, 'gamma': 9.763722812959106}. Best is trial 1 with value: 4.871443572286355.
[I 2023-12-21 04:02:20,754] Trial 12 pruned. Trial was pruned at iteration 0.
[I 2023-12-21 04:02:20,782] Trial 13 pruned. Trial was pruned at iteration 0.
[I 2023-12-21 04:02:28,373] Trial 14 finished with value: 5.212262368893042 and parameters: {'learning_rate': 0.31995635764200825, 'aft_l                                                                     oss_distribution': 'normal', 'aft_loss_distribution_scale': 4.5689538781078305, 'max_depth': 4, 'booster': 'dart', 'scale_pos_weight': 5.                                                                     672665568651038, 'alpha': 8.159274063024936, 'lambda': 6.07353936645905, 'eta': 0.48507743454317703, 'sampling_method': 'gradient_based',                                                                      'subsample': 0.8065934391907659, 'gamma': 9.644868569307965}. Best is trial 1 with value: 4.871443572286355.
[I 2023-12-21 04:02:28,404] Trial 15 pruned. Trial was pruned at iteration 0.
[I 2023-12-21 04:02:33,639] Trial 16 finished with value: 4.525528210284529 and parameters: {'learning_rate': 0.8703915925111263, 'aft_lo                                                                     ss_distribution': 'normal', 'aft_loss_distribution_scale': 1.9831416756088243, 'max_depth': 5, 'booster': 'dart', 'scale_pos_weight': 4.3                                                                     06618048366027, 'alpha': 7.357607041110147, 'lambda': 9.773902189214192, 'eta': 0.8261866020766433, 'sampling_method': 'uniform', 'subsam                                                                     ple': 0.8725488977258147, 'gamma': 9.955748873852517}. Best is trial 16 with value: 4.525528210284529.
[I 2023-12-21 04:02:33,677] Trial 17 pruned. Trial was pruned at iteration 0.
[I 2023-12-21 04:02:33,819] Trial 18 finished with value: 4.285825145203746 and parameters: {'learning_rate': 0.8818767526981471, 'aft_lo                                                                     ss_distribution': 'normal', 'aft_loss_distribution_scale': 1.2512781727717277, 'max_depth': 8, 'booster': 'gbtree', 'scale_pos_weight': 4                                                                     .994194752128841, 'alpha': 4.554137777782045, 'lambda': 7.728989167603448, 'eta': 0.8280876827612442, 'sampling_method': 'gradient_based'                                                                     , 'subsample': 0.549014373003867, 'gamma': 6.213852795519156}. Best is trial 18 with value: 4.285825145203746.
[I 2023-12-21 04:02:33,932] Trial 19 finished with value: inf and parameters: {'learning_rate': 0.6546675660242863, 'aft_loss_distributio                                                                     n': 'normal', 'aft_loss_distribution_scale': 1.1269772196586794, 'max_depth': 8, 'booster': 'gbtree', 'scale_pos_weight': 4.8006944532824                                                                     88, 'alpha': 4.51570292241284, 'lambda': 7.992561932305969, 'eta': 0.8582422188699557, 'sampling_method': 'uniform', 'subsample': 0.47181                                                                     472863067064, 'gamma': 5.82474041576045}. Best is trial 18 with value: 4.285825145203746.
[I 2023-12-21 04:02:33,962] Trial 20 pruned. Trial was pruned at iteration 0.
