[I 2023-12-21 03:00:21,127] Trial 234 finished with value: 4.417206397399238 and parameters: {'learning_rate': 0.6729462059146538, 'aft_l                                                                     oss_distribution': 'normal', 'aft_loss_distribution_scale': 1.707674785986471, 'max_depth': 7, 'booster': 'dart', 'scale_pos_weight': 6.7                                                                     80131983109679, 'alpha': 7.563065756907236, 'lambda': 7.787265515773356, 'eta': 0.9390320953262113, 'sampling_method': 'uniform', 'subsam                                                                     ple': 0.765307233377241, 'gamma': 4.755011571050672}. Best is trial 188 with value: 4.348943369104032.
[I 2023-12-21 03:00:24,150] Trial 235 finished with value: 4.328400894349117 and parameters: {'learning_rate': 0.6778587765524974, 'aft_l                                                                     oss_distribution': 'normal', 'aft_loss_distribution_scale': 1.4337130420336208, 'max_depth': 7, 'booster': 'dart', 'scale_pos_weight': 6.                                                                     74309115206679, 'alpha': 7.444959782077488, 'lambda': 7.852370215969866, 'eta': 0.9365975189578089, 'sampling_method': 'uniform', 'subsam                                                                     ple': 0.7726688428433096, 'gamma': 4.797494369313022}. Best is trial 235 with value: 4.328400894349117.
[I 2023-12-21 03:00:25,501] Trial 236 finished with value: inf and parameters: {'learning_rate': 0.6984978699015241, 'aft_loss_distributi                                                                     on': 'normal', 'aft_loss_distribution_scale': 1.362621470016561, 'max_depth': 7, 'booster': 'dart', 'scale_pos_weight': 6.440400511012307                                                                     , 'alpha': 7.457945961016761, 'lambda': 7.847195965409326, 'eta': 0.9314014786571243, 'sampling_method': 'uniform', 'subsample': 0.787309                                                                     5695929078, 'gamma': 4.922780696571148}. Best is trial 235 with value: 4.328400894349117.
[I 2023-12-21 03:00:26,534] Trial 237 finished with value: inf and parameters: {'learning_rate': 0.6785525528032962, 'aft_loss_distributi                                                                     on': 'normal', 'aft_loss_distribution_scale': 1.4330178343356554, 'max_depth': 7, 'booster': 'dart', 'scale_pos_weight': 6.76376227735636                                                                     9, 'alpha': 7.83299012236353, 'lambda': 7.977759297771511, 'eta': 0.9395020713012714, 'sampling_method': 'uniform', 'subsample': 0.150271                                                                     91097621512, 'gamma': 4.750241862104232}. Best is trial 235 with value: 4.328400894349117.
[I 2023-12-21 03:00:27,607] Trial 238 finished with value: inf and parameters: {'learning_rate': 0.732503421022258, 'aft_loss_distributio                                                                     n': 'normal', 'aft_loss_distribution_scale': 1.2232061498116757, 'max_depth': 7, 'booster': 'dart', 'scale_pos_weight': 6.85894671625045,                                                                      'alpha': 7.526120798702846, 'lambda': 7.781854415250033, 'eta': 0.9833977499685276, 'sampling_method': 'uniform', 'subsample': 0.6875345                                                                     423552195, 'gamma': 5.306610504198736}. Best is trial 235 with value: 4.328400894349117.
[I 2023-12-21 03:00:56,827] Trial 239 finished with value: 4.334573070236084 and parameters: {'learning_rate': 0.6565166596637292, 'aft_l                                                                     oss_distribution': 'normal', 'aft_loss_distribution_scale': 1.4626054110860776, 'max_depth': 7, 'booster': 'dart', 'scale_pos_weight': 6.                                                                     567634118117473, 'alpha': 7.250918797888777, 'lambda': 8.020234344135044, 'eta': 0.9846742544756035, 'sampling_method': 'uniform', 'subsa                                                                     mple': 0.7719353872223714, 'gamma': 5.042607827642172}. Best is trial 235 with value: 4.328400894349117.
[I 2023-12-21 03:01:13,763] Trial 240 finished with value: 4.329042592151154 and parameters: {'learning_rate': 0.6560217602364768, 'aft_l                                                                     oss_distribution': 'normal', 'aft_loss_distribution_scale': 1.4624150328158234, 'max_depth': 7, 'booster': 'dart', 'scale_pos_weight': 6.                                                                     411939283043529, 'alpha': 7.207261054747245, 'lambda': 8.171832992313709, 'eta': 0.9823967524063166, 'sampling_method': 'uniform', 'subsa                                                                     mple': 0.7988518804850784, 'gamma': 5.703997404476436}. Best is trial 235 with value: 4.328400894349117.
[I 2023-12-21 03:01:18,455] Trial 241 finished with value: 4.339716320054544 and parameters: {'learning_rate': 0.6528236419653459, 'aft_l                                                                     oss_distribution': 'normal', 'aft_loss_distribution_scale': 1.4737060278102119, 'max_depth': 7, 'booster': 'dart', 'scale_pos_weight': 6.                                                                     544897087009775, 'alpha': 6.51491866479055, 'lambda': 8.151383651651045, 'eta': 0.9807505061775058, 'sampling_method': 'uniform', 'subsam                                                                     ple': 0.8035604759502445, 'gamma': 5.70806943803541}. Best is trial 235 with value: 4.328400894349117.
[I 2023-12-21 03:01:23,636] Trial 242 finished with value: 4.312056158960162 and parameters: {'learning_rate': 0.6527528287123314, 'aft_l                                                                     oss_distribution': 'normal', 'aft_loss_distribution_scale': 1.4184882838799093, 'max_depth': 7, 'booster': 'dart', 'scale_pos_weight': 6.                                                                     359692057894334, 'alpha': 6.540514528345975, 'lambda': 8.029771639066581, 'eta': 0.9807899139142641, 'sampling_method': 'uniform', 'subsa                                                                     mple': 0.8194761138416525, 'gamma': 6.033749993852072}. Best is trial 242 with value: 4.312056158960162.
[I 2023-12-21 03:01:25,936] Trial 243 finished with value: 4.30561973785298 and parameters: {'learning_rate': 0.6505089966635458, 'aft_lo                                                                     ss_distribution': 'normal', 'aft_loss_distribution_scale': 1.382288039181044, 'max_depth': 7, 'booster': 'dart', 'scale_pos_weight': 6.39                                                                     1015700593925, 'alpha': 6.406182633248946, 'lambda': 8.130289819600517, 'eta': 0.9994813408314106, 'sampling_method': 'uniform', 'subsamp                                                                     le': 0.8121196962781395, 'gamma': 5.910301591566577}. Best is trial 243 with value: 4.30561973785298.
[I 2023-12-21 03:01:25,980] Trial 244 pruned. Trial was pruned at iteration 0.
[I 2023-12-21 03:01:26,020] Trial 245 pruned. Trial was pruned at iteration 0.
[I 2023-12-21 03:01:26,059] Trial 246 pruned. Trial was pruned at iteration 0.
[I 2023-12-21 03:01:32,734] Trial 247 finished with value: 4.326953215793416 and parameters: {'learning_rate': 0.6473834069963437, 'aft_l                                                                     oss_distribution': 'normal', 'aft_loss_distribution_scale': 1.4520080056217304, 'max_depth': 7, 'booster': 'dart', 'scale_pos_weight': 6.                                                                     305799467620869, 'alpha': 6.845142716639674, 'lambda': 8.041350805785468, 'eta': 0.480936332310881, 'sampling_method': 'uniform', 'subsam                                                                     ple': 0.7946293645232211, 'gamma': 6.346161082008225}. Best is trial 243 with value: 4.30561973785298.
[I 2023-12-21 03:01:34,644] Trial 248 finished with value: inf and parameters: {'learning_rate': 0.6623748183987205, 'aft_loss_distributi                                                                     on': 'normal', 'aft_loss_distribution_scale': 1.4255206028411125, 'max_depth': 7, 'booster': 'dart', 'scale_pos_weight': 6.39266511782990                                                                     9, 'alpha': 6.8257734149673714, 'lambda': 8.028247431406133, 'eta': 0.5014245738188285, 'sampling_method': 'uniform', 'subsample': 0.7915                                                                     509065361308, 'gamma': 6.609070282203122}. Best is trial 243 with value: 4.30561973785298.
[I 2023-12-21 03:01:34,684] Trial 249 pruned. Trial was pruned at iteration 0.
[I 2023-12-21 03:01:38,183] Trial 250 finished with value: 4.330077116902619 and parameters: {'learning_rate': 0.6708731470390753, 'aft_l                                                                     oss_distribution': 'normal', 'aft_loss_distribution_scale': 1.4715914308412206, 'max_depth': 7, 'booster': 'dart', 'scale_pos_weight': 6.                                                                     5279523717754735, 'alpha': 6.919637452676128, 'lambda': 8.018504162348805, 'eta': 0.9597072406668512, 'sampling_method': 'uniform', 'subs                                                                     ample': 0.8198550051534659, 'gamma': 6.858601812748298}. Best is trial 243 with value: 4.30561973785298.
[I 2023-12-21 03:01:39,592] Trial 251 finished with value: inf and parameters: {'learning_rate': 0.6723196545460224, 'aft_loss_distributi                                                                     on': 'normal', 'aft_loss_distribution_scale': 1.25166548013766, 'max_depth': 7, 'booster': 'dart', 'scale_pos_weight': 6.030687706976184,                                                                      'alpha': 7.350894566580494, 'lambda': 8.147280097915674, 'eta': 0.9597449311543138, 'sampling_method': 'uniform', 'subsample': 0.8240001                                                                     886459795, 'gamma': 5.875418932172771}. Best is trial 243 with value: 4.30561973785298.
[I 2023-12-21 03:01:41,112] Trial 252 finished with value: inf and parameters: {'learning_rate': 0.6472742251759558, 'aft_loss_distributi                                                                     on': 'normal', 'aft_loss_distribution_scale': 1.4394671597834112, 'max_depth': 7, 'booster': 'dart', 'scale_pos_weight': 6.55293457970165                                                                     9, 'alpha': 7.055032222240797, 'lambda': 7.956071108970833, 'eta': 0.4462725542533017, 'sampling_method': 'uniform', 'subsample': 0.79707                                                                     11833840559, 'gamma': 6.115060126831315}. Best is trial 243 with value: 4.30561973785298.
[I 2023-12-21 03:01:47,666] Trial 253 finished with value: 4.325057259281162 and parameters: {'learning_rate': 0.7058302079725313, 'aft_l                                                                     oss_distribution': 'normal', 'aft_loss_distribution_scale': 1.4474228537292293, 'max_depth': 7, 'booster': 'dart', 'scale_pos_weight': 6.                                                                     230232627719503, 'alpha': 7.734981081851183, 'lambda': 8.341227963683522, 'eta': 0.9999407589608457, 'sampling_method': 'uniform', 'subsa                                                                     mple': 0.7762265442475843, 'gamma': 6.903652900831787}. Best is trial 243 with value: 4.30561973785298.
[I 2023-12-21 03:01:47,707] Trial 254 pruned. Trial was pruned at iteration 0.
[I 2023-12-21 03:01:54,917] Trial 255 finished with value: 4.320295310776978 and parameters: {'learning_rate': 0.7133833427135521, 'aft_l                                                                     oss_distribution': 'normal', 'aft_loss_distribution_scale': 1.4255706294429802, 'max_depth': 7, 'booster': 'dart', 'scale_pos_weight': 6.                                                                     232608571327269, 'alpha': 7.628702330031619, 'lambda': 7.872931049137321, 'eta': 0.45915230357208103, 'sampling_method': 'uniform', 'subs                                                                     ample': 0.803808909169964, 'gamma': 6.711853327633354}. Best is trial 243 with value: 4.30561973785298.
[I 2023-12-21 03:01:56,064] Trial 256 finished with value: inf and parameters: {'learning_rate': 0.7232651197047774, 'aft_loss_distributi                                                                     on': 'normal', 'aft_loss_distribution_scale': 1.2240683786943396, 'max_depth': 7, 'booster': 'dart', 'scale_pos_weight': 6.29947261205270                                                                     5, 'alpha': 7.681740223460416, 'lambda': 8.109106351343952, 'eta': 0.9606008037689471, 'sampling_method': 'uniform', 'subsample': 0.82916                                                                     07153168947, 'gamma': 6.399611824871279}. Best is trial 243 with value: 4.30561973785298.
[I 2023-12-21 03:01:57,890] Trial 257 finished with value: inf and parameters: {'learning_rate': 0.7043212623907841, 'aft_loss_distributi                                                                     on': 'normal', 'aft_loss_distribution_scale': 1.4235366984287952, 'max_depth': 7, 'booster': 'dart', 'scale_pos_weight': 5.93133372950370                                                                     2, 'alpha': 7.796354778285933, 'lambda': 7.773698552472555, 'eta': 0.9591404937340613, 'sampling_method': 'uniform', 'subsample': 0.80380                                                                     355374623, 'gamma': 6.993916963850004}. Best is trial 243 with value: 4.30561973785298.
[I 2023-12-21 03:01:57,931] Trial 258 pruned. Trial was pruned at iteration 0.
[I 2023-12-21 03:02:05,003] Trial 259 finished with value: 4.317895326124363 and parameters: {'learning_rate': 0.7116510612229292, 'aft_l                                                                     oss_distribution': 'normal', 'aft_loss_distribution_scale': 1.4149966936042095, 'max_depth': 7, 'booster': 'dart', 'scale_pos_weight': 6.                                                                     226404029776297, 'alpha': 6.552574771936148, 'lambda': 8.322187851220269, 'eta': 0.4833619006633205, 'sampling_method': 'uniform', 'subsa                                                                     mple': 0.7677201204631294, 'gamma': 6.896519382109662}. Best is trial 243 with value: 4.30561973785298.
[I 2023-12-21 03:02:05,044] Trial 260 pruned. Trial was pruned at iteration 0.
[I 2023-12-21 03:02:09,859] Trial 261 finished with value: 4.315206389264294 and parameters: {'learning_rate': 0.6871094361440709, 'aft_l                                                                     oss_distribution': 'normal', 'aft_loss_distribution_scale': 1.4088890648927466, 'max_depth': 7, 'booster': 'dart', 'scale_pos_weight': 6.                                                                     226162549437099, 'alpha': 7.6260563348906985, 'lambda': 8.39330702272733, 'eta': 0.5294430320448429, 'sampling_method': 'uniform', 'subsa                                                                     mple': 0.7726753191872959, 'gamma': 6.464390390722684}. Best is trial 243 with value: 4.30561973785298.
[I 2023-12-21 03:02:11,819] Trial 262 finished with value: 4.298540598862548 and parameters: {'learning_rate': 0.7308978237425857, 'aft_l                                                                     oss_distribution': 'normal', 'aft_loss_distribution_scale': 1.3420813016897828, 'max_depth': 7, 'booster': 'dart', 'scale_pos_weight': 6.                                                                     176476897692302, 'alpha': 8.20334145733717, 'lambda': 8.410999791716304, 'eta': 0.4677719629998008, 'sampling_method': 'uniform', 'subsam                                                                     ple': 0.7728601701018787, 'gamma': 6.549002913791872}. Best is trial 262 with value: 4.298540598862548.
[I 2023-12-21 03:02:12,874] Trial 263 finished with value: inf and parameters: {'learning_rate': 0.7352555470060661, 'aft_loss_distributi                                                                     on': 'normal', 'aft_loss_distribution_scale': 1.244275937576138, 'max_depth': 7, 'booster': 'dart', 'scale_pos_weight': 6.083118961698756                                                                     , 'alpha': 8.08780009112409, 'lambda': 8.428143739047922, 'eta': 0.44459393721522067, 'sampling_method': 'uniform', 'subsample': 0.764514                                                                     954968989, 'gamma': 6.770846405204528}. Best is trial 262 with value: 4.298540598862548.
[I 2023-12-21 03:02:15,840] Trial 264 finished with value: 4.312960510244471 and parameters: {'learning_rate': 0.7609642885283509, 'aft_l                                                                     oss_distribution': 'normal', 'aft_loss_distribution_scale': 1.3915082008513937, 'max_depth': 7, 'booster': 'dart', 'scale_pos_weight': 6.                                                                     251133736952488, 'alpha': 8.199768782475969, 'lambda': 8.271800009664226, 'eta': 0.46034681150555323, 'sampling_method': 'uniform', 'subs                                                                     ample': 0.7523678383856169, 'gamma': 6.573461441026892}. Best is trial 262 with value: 4.298540598862548.
[I 2023-12-21 03:02:16,873] Trial 265 finished with value: inf and parameters: {'learning_rate': 0.8023493097319045, 'aft_loss_distributi                                                                     on': 'normal', 'aft_loss_distribution_scale': 1.0437569693136617, 'max_depth': 7, 'booster': 'dart', 'scale_pos_weight': 6.27281129357774                                                                     , 'alpha': 8.176030180868457, 'lambda': 8.434903835532527, 'eta': 0.4762909869939113, 'sampling_method': 'uniform', 'subsample': 0.754353                                                                     860018089, 'gamma': 6.835303017224384}. Best is trial 262 with value: 4.298540598862548.
[I 2023-12-21 03:02:21,686] Trial 266 finished with value: 4.312809218447084 and parameters: {'learning_rate': 0.7694589281750465, 'aft_l                                                                     oss_distribution': 'normal', 'aft_loss_distribution_scale': 1.398880384339999, 'max_depth': 7, 'booster': 'dart', 'scale_pos_weight': 6.1                                                                     0491389128968, 'alpha': 7.755152617467856, 'lambda': 8.223291600178998, 'eta': 0.46292592674243704, 'sampling_method': 'uniform', 'subsam                                                                     ple': 0.8256210805647928, 'gamma': 6.610542935426096}. Best is trial 262 with value: 4.298540598862548.
[I 2023-12-21 03:02:22,872] Trial 267 finished with value: inf and parameters: {'learning_rate': 0.7688127254457682, 'aft_loss_distributi                                                                     on': 'normal', 'aft_loss_distribution_scale': 1.3464707230074828, 'max_depth': 7, 'booster': 'dart', 'scale_pos_weight': 6.01769332136086                                                                     3, 'alpha': 7.796112545393692, 'lambda': 8.201362275664671, 'eta': 0.4636161290206793, 'sampling_method': 'uniform', 'subsample': 0.82770                                                                     82129166026, 'gamma': 6.559703346313284}. Best is trial 262 with value: 4.298540598862548.
[I 2023-12-21 03:02:23,934] Trial 268 finished with value: inf and parameters: {'learning_rate': 0.7595830455221466, 'aft_loss_distributi                                                                     on': 'normal', 'aft_loss_distribution_scale': 1.0987837982338529, 'max_depth': 7, 'booster': 'dart', 'scale_pos_weight': 5.7216976729313,                                                                      'alpha': 8.723293058197754, 'lambda': 8.383265275362465, 'eta': 0.5219607000313834, 'sampling_method': 'uniform', 'subsample': 0.8096738                                                                     604977363, 'gamma': 6.314072668206996}. Best is trial 262 with value: 4.298540598862548.
[I 2023-12-21 03:02:23,975] Trial 269 pruned. Trial was pruned at iteration 0.
[I 2023-12-21 03:02:24,014] Trial 270 pruned. Trial was pruned at iteration 0.
[I 2023-12-21 03:02:24,054] Trial 271 pruned. Trial was pruned at iteration 0.
[I 2023-12-21 03:02:36,673] Trial 272 finished with value: 4.318752407027494 and parameters: {'learning_rate': 0.7359843886387344, 'aft_l                                                                     oss_distribution': 'normal', 'aft_loss_distribution_scale': 1.4198130349792961, 'max_depth': 7, 'booster': 'dart', 'scale_pos_weight': 6.                                                                     188776995194065, 'alpha': 7.9061321558405755, 'lambda': 8.556298448846938, 'eta': 0.4837773274011955, 'sampling_method': 'uniform', 'subs                                                                     ample': 0.7673157647851309, 'gamma': 6.910135479043679}. Best is trial 262 with value: 4.298540598862548.
