[I 2023-12-21 04:08:45,835] Trial 316 pruned. Trial was pruned at iteration 0.
[I 2023-12-21 04:08:45,880] Trial 317 pruned. Trial was pruned at iteration 0.
[I 2023-12-21 04:08:45,971] Trial 318 pruned. Trial was pruned at iteration 9.
[I 2023-12-21 04:08:46,020] Trial 319 pruned. Trial was pruned at iteration 1.
[I 2023-12-21 04:08:46,065] Trial 320 pruned. Trial was pruned at iteration 0.
[I 2023-12-21 04:08:46,109] Trial 321 pruned. Trial was pruned at iteration 0.
[I 2023-12-21 04:08:46,156] Trial 322 pruned. Trial was pruned at iteration 0.
[I 2023-12-21 04:08:46,203] Trial 323 pruned. Trial was pruned at iteration 1.
[I 2023-12-21 04:08:46,248] Trial 324 pruned. Trial was pruned at iteration 0.
[I 2023-12-21 04:08:46,293] Trial 325 pruned. Trial was pruned at iteration 0.
[I 2023-12-21 04:08:46,340] Trial 326 pruned. Trial was pruned at iteration 0.
[I 2023-12-21 04:08:46,389] Trial 327 pruned. Trial was pruned at iteration 1.
[I 2023-12-21 04:08:47,510] Trial 328 finished with value: inf and parameters: {'learning_rate': 0.9391366082381114, 'aft_loss_distributi                                                                     on': 'normal', 'aft_loss_distribution_scale': 1.588207483642843, 'max_depth': 5, 'booster': 'dart', 'scale_pos_weight': 1.337046108745821                                                                     6, 'alpha': 4.430503237201934, 'lambda': 9.01873597743843, 'eta': 0.9996521921926113, 'sampling_method': 'uniform', 'subsample': 0.999442                                                                     6392583501, 'gamma': 4.235860671578272}. Best is trial 110 with value: 1.974679967445453.
[I 2023-12-21 04:08:47,557] Trial 329 pruned. Trial was pruned at iteration 0.
[I 2023-12-21 04:08:47,603] Trial 330 pruned. Trial was pruned at iteration 0.
[I 2023-12-21 04:08:47,648] Trial 331 pruned. Trial was pruned at iteration 0.
[I 2023-12-21 04:08:47,693] Trial 332 pruned. Trial was pruned at iteration 0.
[I 2023-12-21 04:08:47,738] Trial 333 pruned. Trial was pruned at iteration 0.
[I 2023-12-21 04:08:47,784] Trial 334 pruned. Trial was pruned at iteration 0.
[I 2023-12-21 04:08:47,832] Trial 335 pruned. Trial was pruned at iteration 0.
[I 2023-12-21 04:08:48,988] Trial 336 finished with value: inf and parameters: {'learning_rate': 0.9851925602607238, 'aft_loss_distributi                                                                     on': 'normal', 'aft_loss_distribution_scale': 1.4610423405218596, 'max_depth': 10, 'booster': 'dart', 'scale_pos_weight': 1.3804199743927                                                                     597, 'alpha': 9.705015482260476, 'lambda': 5.71901743915587, 'eta': 0.9515706456722935, 'sampling_method': 'uniform', 'subsample': 0.9485                                                                     100942044093, 'gamma': 6.050392516573688}. Best is trial 110 with value: 1.974679967445453.
[I 2023-12-21 04:08:49,035] Trial 337 pruned. Trial was pruned at iteration 0.
[I 2023-12-21 04:08:49,081] Trial 338 pruned. Trial was pruned at iteration 0.
[I 2023-12-21 04:08:49,126] Trial 339 pruned. Trial was pruned at iteration 0.
[I 2023-12-21 04:08:49,175] Trial 340 pruned. Trial was pruned at iteration 1.
[I 2023-12-21 04:08:49,221] Trial 341 pruned. Trial was pruned at iteration 0.
[I 2023-12-21 04:08:50,613] Trial 342 finished with value: inf and parameters: {'learning_rate': 0.9370766077797377, 'aft_loss_distributi                                                                     on': 'normal', 'aft_loss_distribution_scale': 1.6443716423792243, 'max_depth': 3, 'booster': 'dart', 'scale_pos_weight': 1.63853356978103                                                                     97, 'alpha': 9.83628995482713, 'lambda': 8.256080542039264, 'eta': 0.1106555358369904, 'sampling_method': 'uniform', 'subsample': 0.83823                                                                     96295289638, 'gamma': 5.378224547737185}. Best is trial 110 with value: 1.974679967445453.
[I 2023-12-21 04:08:50,660] Trial 343 pruned. Trial was pruned at iteration 0.
[I 2023-12-21 04:08:50,706] Trial 344 pruned. Trial was pruned at iteration 0.
[I 2023-12-21 04:08:50,752] Trial 345 pruned. Trial was pruned at iteration 0.
[I 2023-12-21 04:08:50,799] Trial 346 pruned. Trial was pruned at iteration 0.
[I 2023-12-21 04:08:51,904] Trial 347 finished with value: inf and parameters: {'learning_rate': 0.9985751541556733, 'aft_loss_distributi                                                                     on': 'normal', 'aft_loss_distribution_scale': 1.1994151763469973, 'max_depth': 3, 'booster': 'dart', 'scale_pos_weight': 1.35329998875613                                                                     77, 'alpha': 9.426405375172822, 'lambda': 6.324572057761938, 'eta': 0.9050435217532826, 'sampling_method': 'uniform', 'subsample': 0.9223                                                                     752103844224, 'gamma': 5.95235664889214}. Best is trial 110 with value: 1.974679967445453.
[I 2023-12-21 04:08:51,951] Trial 348 pruned. Trial was pruned at iteration 0.
[I 2023-12-21 04:08:52,001] Trial 349 pruned. Trial was pruned at iteration 1.
[I 2023-12-21 04:08:53,667] Trial 350 finished with value: inf and parameters: {'learning_rate': 0.9441333769231196, 'aft_loss_distributi                                                                     on': 'normal', 'aft_loss_distribution_scale': 1.6353320679681145, 'max_depth': 3, 'booster': 'dart', 'scale_pos_weight': 1.02097808097511                                                                     63, 'alpha': 9.182093763273603, 'lambda': 9.619620506766521, 'eta': 0.9820344619781171, 'sampling_method': 'uniform', 'subsample': 0.8954                                                                     012074222656, 'gamma': 8.94631867476416}. Best is trial 110 with value: 1.974679967445453.
[I 2023-12-21 04:08:53,716] Trial 351 pruned. Trial was pruned at iteration 1.
[I 2023-12-21 04:08:53,764] Trial 352 pruned. Trial was pruned at iteration 0.
[I 2023-12-21 04:08:53,811] Trial 353 pruned. Trial was pruned at iteration 0.
[I 2023-12-21 04:08:53,858] Trial 354 pruned. Trial was pruned at iteration 0.
[I 2023-12-21 04:08:53,905] Trial 355 pruned. Trial was pruned at iteration 0.
[I 2023-12-21 04:08:53,953] Trial 356 pruned. Trial was pruned at iteration 0.
[I 2023-12-21 04:08:54,002] Trial 357 pruned. Trial was pruned at iteration 1.
[I 2023-12-21 04:08:54,049] Trial 358 pruned. Trial was pruned at iteration 0.
[I 2023-12-21 04:08:54,097] Trial 359 pruned. Trial was pruned at iteration 0.
[I 2023-12-21 04:08:54,144] Trial 360 pruned. Trial was pruned at iteration 0.
[I 2023-12-21 04:08:54,190] Trial 361 pruned. Trial was pruned at iteration 0.
[I 2023-12-21 04:08:54,237] Trial 362 pruned. Trial was pruned at iteration 0.
[I 2023-12-21 04:08:54,289] Trial 363 pruned. Trial was pruned at iteration 1.
[I 2023-12-21 04:08:54,337] Trial 364 pruned. Trial was pruned at iteration 0.
[I 2023-12-21 04:08:54,384] Trial 365 pruned. Trial was pruned at iteration 0.
[I 2023-12-21 04:08:54,431] Trial 366 pruned. Trial was pruned at iteration 0.
[I 2023-12-21 04:08:54,479] Trial 367 pruned. Trial was pruned at iteration 0.
[I 2023-12-21 04:08:54,526] Trial 368 pruned. Trial was pruned at iteration 0.
[I 2023-12-21 04:08:54,575] Trial 369 pruned. Trial was pruned at iteration 0.
[I 2023-12-21 04:08:54,622] Trial 370 pruned. Trial was pruned at iteration 0.
[I 2023-12-21 04:08:54,669] Trial 371 pruned. Trial was pruned at iteration 0.
[I 2023-12-21 04:08:54,716] Trial 372 pruned. Trial was pruned at iteration 0.
[I 2023-12-21 04:08:54,769] Trial 373 pruned. Trial was pruned at iteration 2.
[I 2023-12-21 04:08:54,816] Trial 374 pruned. Trial was pruned at iteration 0.
[I 2023-12-21 04:08:54,871] Trial 375 pruned. Trial was pruned at iteration 0.
[I 2023-12-21 04:08:54,919] Trial 376 pruned. Trial was pruned at iteration 0.
[I 2023-12-21 04:08:57,180] Trial 377 finished with value: 1.979513775170102 and parameters: {'learning_rate': 0.974802726102961, 'aft_lo                                                                     ss_distribution': 'normal', 'aft_loss_distribution_scale': 1.358142466396493, 'max_depth': 4, 'booster': 'dart', 'scale_pos_weight': 1.32                                                                     53624065359326, 'alpha': 8.638281482886027, 'lambda': 9.306665021280011, 'eta': 0.9491984137769628, 'sampling_method': 'uniform', 'subsam                                                                     ple': 0.905435527077423, 'gamma': 8.082789792975836}. Best is trial 110 with value: 1.974679967445453.
[I 2023-12-21 04:08:59,069] Trial 378 finished with value: inf and parameters: {'learning_rate': 0.9827446231635218, 'aft_loss_distributi                                                                     on': 'normal', 'aft_loss_distribution_scale': 1.3254582018994543, 'max_depth': 9, 'booster': 'dart', 'scale_pos_weight': 1.31931482618732                                                                     47, 'alpha': 7.763072464022281, 'lambda': 9.438077198009275, 'eta': 0.9432372924174292, 'sampling_method': 'uniform', 'subsample': 0.9012                                                                     998995950072, 'gamma': 7.956207588663988}. Best is trial 110 with value: 1.974679967445453.
[I 2023-12-21 04:08:59,117] Trial 379 pruned. Trial was pruned at iteration 0.
[I 2023-12-21 04:09:00,236] Trial 380 finished with value: inf and parameters: {'learning_rate': 0.9996309775822855, 'aft_loss_distributi                                                                     on': 'normal', 'aft_loss_distribution_scale': 1.4425296636570677, 'max_depth': 4, 'booster': 'dart', 'scale_pos_weight': 1.11140088931486                                                                     8, 'alpha': 9.199127854978903, 'lambda': 9.590373662232714, 'eta': 0.9193794602882985, 'sampling_method': 'uniform', 'subsample': 0.91294                                                                     99453714575, 'gamma': 7.401040695199762}. Best is trial 110 with value: 1.974679967445453.
[I 2023-12-21 04:09:00,286] Trial 381 pruned. Trial was pruned at iteration 0.
[I 2023-12-21 04:09:10,415] Trial 382 finished with value: 1.992018232278601 and parameters: {'learning_rate': 0.9482763506376847, 'aft_l                                                                     oss_distribution': 'normal', 'aft_loss_distribution_scale': 1.6633930905029322, 'max_depth': 3, 'booster': 'dart', 'scale_pos_weight': 1.                                                                     2354170288689723, 'alpha': 8.56298656068143, 'lambda': 8.997007046977066, 'eta': 0.9387990183602679, 'sampling_method': 'uniform', 'subsa                                                                     mple': 0.9176725102284415, 'gamma': 6.214201868058891}. Best is trial 110 with value: 1.974679967445453.
[I 2023-12-21 04:09:10,466] Trial 383 pruned. Trial was pruned at iteration 0.
[I 2023-12-21 04:09:11,825] Trial 384 finished with value: inf and parameters: {'learning_rate': 0.9757900275073516, 'aft_loss_distributi                                                                     on': 'normal', 'aft_loss_distribution_scale': 1.6465722538022338, 'max_depth': 3, 'booster': 'dart', 'scale_pos_weight': 1.24066119106952                                                                     84, 'alpha': 8.46729188946303, 'lambda': 8.983259820087028, 'eta': 0.9062978498320984, 'sampling_method': 'uniform', 'subsample': 0.92156                                                                     06668644772, 'gamma': 6.162370326549495}. Best is trial 110 with value: 1.974679967445453.
[I 2023-12-21 04:09:13,312] Trial 385 finished with value: inf and parameters: {'learning_rate': 0.9414711340737528, 'aft_loss_distributi                                                                     on': 'normal', 'aft_loss_distribution_scale': 1.4300493799219556, 'max_depth': 3, 'booster': 'dart', 'scale_pos_weight': 1.12759270218666                                                                     65, 'alpha': 8.649209865011558, 'lambda': 8.792836356071353, 'eta': 0.9511701592141805, 'sampling_method': 'uniform', 'subsample': 0.8827                                                                     153551924484, 'gamma': 6.162575591963573}. Best is trial 110 with value: 1.974679967445453.
[I 2023-12-21 04:09:14,426] Trial 386 finished with value: inf and parameters: {'learning_rate': 0.9629397160262396, 'aft_loss_distributi                                                                     on': 'normal', 'aft_loss_distribution_scale': 1.6908910524604215, 'max_depth': 3, 'booster': 'dart', 'scale_pos_weight': 1.31115138711858                                                                     , 'alpha': 8.922307672547293, 'lambda': 8.621069503903932, 'eta': 0.9354545278291285, 'sampling_method': 'uniform', 'subsample': 0.983126                                                                     0195229272, 'gamma': 5.550334588990814}. Best is trial 110 with value: 1.974679967445453.
[I 2023-12-21 04:09:14,479] Trial 387 pruned. Trial was pruned at iteration 1.
[I 2023-12-21 04:09:15,728] Trial 388 finished with value: inf and parameters: {'learning_rate': 0.9851650420482018, 'aft_loss_distributi                                                                     on': 'normal', 'aft_loss_distribution_scale': 1.2529135896171195, 'max_depth': 3, 'booster': 'dart', 'scale_pos_weight': 1.26165582678172                                                                     , 'alpha': 8.091705883711013, 'lambda': 9.013684283482547, 'eta': 0.9836742476892135, 'sampling_method': 'uniform', 'subsample': 0.905369                                                                     6336757974, 'gamma': 6.345764573668176}. Best is trial 110 with value: 1.974679967445453.
[I 2023-12-21 04:09:23,717] Trial 389 finished with value: 1.9895906558213996 and parameters: {'learning_rate': 0.9467178193306499, 'aft_                                                                     loss_distribution': 'normal', 'aft_loss_distribution_scale': 1.5624976726934594, 'max_depth': 4, 'booster': 'dart', 'scale_pos_weight': 1                                                                     .4864203107778473, 'alpha': 9.173771113071533, 'lambda': 9.437794043323509, 'eta': 0.9156156985793333, 'sampling_method': 'uniform', 'sub                                                                     sample': 0.966347274571534, 'gamma': 5.686844491310735}. Best is trial 110 with value: 1.974679967445453.
[I 2023-12-21 04:09:24,875] Trial 390 finished with value: inf and parameters: {'learning_rate': 0.947560737783308, 'aft_loss_distributio                                                                     n': 'normal', 'aft_loss_distribution_scale': 1.5434995738736834, 'max_depth': 4, 'booster': 'dart', 'scale_pos_weight': 1.500535051761165                                                                     3, 'alpha': 8.845520106130987, 'lambda': 9.755951639494842, 'eta': 0.8773427492558361, 'sampling_method': 'uniform', 'subsample': 0.99723                                                                     14714296532, 'gamma': 8.122950034386312}. Best is trial 110 with value: 1.974679967445453.
[I 2023-12-21 04:09:24,924] Trial 391 pruned. Trial was pruned at iteration 0.
[I 2023-12-21 04:09:24,971] Trial 392 pruned. Trial was pruned at iteration 0.
[I 2023-12-21 04:09:26,140] Trial 393 finished with value: inf and parameters: {'learning_rate': 0.9622593441976672, 'aft_loss_distributi                                                                     on': 'normal', 'aft_loss_distribution_scale': 1.4283399548090514, 'max_depth': 4, 'booster': 'dart', 'scale_pos_weight': 1.37674707251458                                                                     54, 'alpha': 9.353162155699264, 'lambda': 9.251424480498194, 'eta': 0.9278057346952517, 'sampling_method': 'uniform', 'subsample': 0.9312                                                                     009854391016, 'gamma': 5.907838018398695}. Best is trial 110 with value: 1.974679967445453.
[I 2023-12-21 04:09:34,149] Trial 394 finished with value: 1.9926196988263154 and parameters: {'learning_rate': 0.9862583182522054, 'aft_                                                                     loss_distribution': 'normal', 'aft_loss_distribution_scale': 1.6690638209504098, 'max_depth': 4, 'booster': 'dart', 'scale_pos_weight': 1                                                                     .5568116537066277, 'alpha': 9.550515350174686, 'lambda': 9.911259526302374, 'eta': 0.9471477403950921, 'sampling_method': 'uniform', 'sub                                                                     sample': 0.9639903825822898, 'gamma': 6.036297758843265}. Best is trial 110 with value: 1.974679967445453.
[I 2023-12-21 04:09:35,300] Trial 395 finished with value: inf and parameters: {'learning_rate': 0.9739184563305292, 'aft_loss_distributi                                                                     on': 'normal', 'aft_loss_distribution_scale': 1.6586621994599227, 'max_depth': 4, 'booster': 'dart', 'scale_pos_weight': 1.55642691190501                                                                     85, 'alpha': 9.669712779148055, 'lambda': 9.851706109193637, 'eta': 0.9141190498653813, 'sampling_method': 'uniform', 'subsample': 0.9672                                                                     0649323652, 'gamma': 6.0716340084693075}. Best is trial 110 with value: 1.974679967445453.
[I 2023-12-21 04:09:36,427] Trial 396 finished with value: inf and parameters: {'learning_rate': 0.979897049629157, 'aft_loss_distributio                                                                     n': 'normal', 'aft_loss_distribution_scale': 1.3215700374777561, 'max_depth': 4, 'booster': 'dart', 'scale_pos_weight': 1.668200278629085                                                                     3, 'alpha': 9.402139350128138, 'lambda': 9.932890157863659, 'eta': 0.9406950258373299, 'sampling_method': 'uniform', 'subsample': 0.95602                                                                     59533911558, 'gamma': 5.3316189565046805}. Best is trial 110 with value: 1.974679967445453.
[I 2023-12-21 04:09:37,595] Trial 397 finished with value: inf and parameters: {'learning_rate': 0.9503991724082314, 'aft_loss_distributi                                                                     on': 'normal', 'aft_loss_distribution_scale': 1.5712570834308583, 'max_depth': 4, 'booster': 'dart', 'scale_pos_weight': 1.49733622193270                                                                     53, 'alpha': 8.594579519364112, 'lambda': 9.68030759174223, 'eta': 0.9604892241476399, 'sampling_method': 'uniform', 'subsample': 0.98299                                                                     77232244314, 'gamma': 5.729932989000183}. Best is trial 110 with value: 1.974679967445453.
[I 2023-12-21 04:09:37,651] Trial 398 pruned. Trial was pruned at iteration 2.
[I 2023-12-21 04:09:37,698] Trial 399 pruned. Trial was pruned at iteration 0.
[I 2023-12-21 04:09:37,746] Trial 400 pruned. Trial was pruned at iteration 0.
[I 2023-12-21 04:09:37,797] Trial 401 pruned. Trial was pruned at iteration 1.
[I 2023-12-21 04:09:39,003] Trial 402 finished with value: inf and parameters: {'learning_rate': 0.9440236645402285, 'aft_loss_distributi                                                                     on': 'normal', 'aft_loss_distribution_scale': 1.4085755986317292, 'max_depth': 3, 'booster': 'dart', 'scale_pos_weight': 1.41128088736472                                                                     , 'alpha': 9.33477744291708, 'lambda': 9.079016804899442, 'eta': 0.9736205782893649, 'sampling_method': 'uniform', 'subsample': 0.9244897                                                                     248519376, 'gamma': 4.588586994349512}. Best is trial 110 with value: 1.974679967445453.
[I 2023-12-21 04:09:39,059] Trial 403 pruned. Trial was pruned at iteration 0.
[I 2023-12-21 04:09:39,110] Trial 404 pruned. Trial was pruned at iteration 1.
[I 2023-12-21 04:09:39,158] Trial 405 pruned. Trial was pruned at iteration 0.
[I 2023-12-21 04:09:40,236] Trial 406 finished with value: inf and parameters: {'learning_rate': 0.9689307610556013, 'aft_loss_distributi                                                                     on': 'normal', 'aft_loss_distribution_scale': 1.294850739723111, 'max_depth': 4, 'booster': 'dart', 'scale_pos_weight': 1.281636307295860                                                                     3, 'alpha': 9.678806189835925, 'lambda': 9.501563585661046, 'eta': 0.8474729391674777, 'sampling_method': 'uniform', 'subsample': 0.94400                                                                     89952449843, 'gamma': 5.491245559742079}. Best is trial 110 with value: 1.974679967445453.
[I 2023-12-21 04:09:40,291] Trial 407 pruned. Trial was pruned at iteration 2.
[I 2023-12-21 04:09:40,343] Trial 408 pruned. Trial was pruned at iteration 1.
[I 2023-12-21 04:09:40,391] Trial 409 pruned. Trial was pruned at iteration 0.
[I 2023-12-21 04:09:40,441] Trial 410 pruned. Trial was pruned at iteration 0.
[I 2023-12-21 04:09:40,492] Trial 411 pruned. Trial was pruned at iteration 1.
[I 2023-12-21 04:09:40,540] Trial 412 pruned. Trial was pruned at iteration 0.
[I 2023-12-21 04:09:40,591] Trial 413 pruned. Trial was pruned at iteration 1.
