[I 2023-12-21 02:42:12,590] Trial 206 pruned. Trial was pruned at iteration 0.
[I 2023-12-21 02:42:24,287] Trial 207 finished with value: 4.344242250468289 and parameters: {'learning_rate': 0.18895182484346348, 'aft_                                                                     loss_distribution': 'logistic', 'aft_loss_distribution_scale': 0.8216124145990547, 'max_depth': 10, 'booster': 'dart', 'scale_pos_weight'                                                                     : 7.374776908948896, 'alpha': 9.167795693986697, 'lambda': 7.027422581419319, 'eta': 0.9795336552332127, 'sampling_method': 'uniform', 's                                                                     ubsample': 0.8427209306405165, 'gamma': 6.52380459008469}. Best is trial 179 with value: 4.33636637744083.
[I 2023-12-21 02:42:24,341] Trial 208 pruned. Trial was pruned at iteration 0.
[I 2023-12-21 02:42:24,382] Trial 209 pruned. Trial was pruned at iteration 0.
[I 2023-12-21 02:42:24,428] Trial 210 pruned. Trial was pruned at iteration 0.
[I 2023-12-21 02:42:32,393] Trial 211 finished with value: 4.352413630124582 and parameters: {'learning_rate': 0.19607291582530775, 'aft_                                                                     loss_distribution': 'logistic', 'aft_loss_distribution_scale': 0.8498330906836529, 'max_depth': 10, 'booster': 'dart', 'scale_pos_weight'                                                                     : 7.613784082399503, 'alpha': 8.683663782905725, 'lambda': 6.976396656596897, 'eta': 0.9290319091684948, 'sampling_method': 'uniform', 's                                                                     ubsample': 0.8770390035485587, 'gamma': 6.609358414535985}. Best is trial 179 with value: 4.33636637744083.
[I 2023-12-21 02:43:49,543] Trial 212 finished with value: 4.340031179418684 and parameters: {'learning_rate': 0.19172231794496222, 'aft_                                                                     loss_distribution': 'logistic', 'aft_loss_distribution_scale': 0.8329947540442005, 'max_depth': 10, 'booster': 'dart', 'scale_pos_weight'                                                                     : 6.88385719911607, 'alpha': 8.693711223640385, 'lambda': 6.706950575447456, 'eta': 0.9375385041855505, 'sampling_method': 'uniform', 'su                                                                     bsample': 0.8843305889132274, 'gamma': 6.5128030091345614}. Best is trial 179 with value: 4.33636637744083.
[I 2023-12-21 02:43:49,593] Trial 213 pruned. Trial was pruned at iteration 0.
[I 2023-12-21 02:44:02,213] Trial 214 finished with value: 4.326271627581236 and parameters: {'learning_rate': 0.141252468454312, 'aft_lo                                                                     ss_distribution': 'logistic', 'aft_loss_distribution_scale': 0.7943983629981703, 'max_depth': 10, 'booster': 'dart', 'scale_pos_weight':                                                                      6.831011440089025, 'alpha': 8.673226391491328, 'lambda': 6.448443639498741, 'eta': 0.9784093604244497, 'sampling_method': 'uniform', 'sub                                                                     sample': 0.8249461882251156, 'gamma': 6.933292151383119}. Best is trial 214 with value: 4.326271627581236.
[I 2023-12-21 02:44:02,281] Trial 215 pruned. Trial was pruned at iteration 0.
[I 2023-12-21 02:44:02,322] Trial 216 pruned. Trial was pruned at iteration 0.
[I 2023-12-21 02:44:48,105] Trial 217 finished with value: 4.333274926850958 and parameters: {'learning_rate': 0.16488220304389692, 'aft_                                                                     loss_distribution': 'logistic', 'aft_loss_distribution_scale': 0.7846636631774675, 'max_depth': 10, 'booster': 'dart', 'scale_pos_weight'                                                                     : 8.842900377056202, 'alpha': 8.93227197920204, 'lambda': 6.417534122511474, 'eta': 0.9821184647869708, 'sampling_method': 'uniform', 'su                                                                     bsample': 0.8847583267099168, 'gamma': 6.457404922260826}. Best is trial 214 with value: 4.326271627581236.
[I 2023-12-21 02:44:48,156] Trial 218 pruned. Trial was pruned at iteration 0.
[I 2023-12-21 02:44:48,198] Trial 219 pruned. Trial was pruned at iteration 0.
[I 2023-12-21 02:44:48,246] Trial 220 pruned. Trial was pruned at iteration 0.
[I 2023-12-21 02:45:11,786] Trial 221 finished with value: 4.337478334105733 and parameters: {'learning_rate': 0.19462708369854148, 'aft_                                                                     loss_distribution': 'logistic', 'aft_loss_distribution_scale': 0.8294447013441959, 'max_depth': 10, 'booster': 'dart', 'scale_pos_weight'                                                                     : 7.015090538163829, 'alpha': 8.615995601561934, 'lambda': 6.701800566369835, 'eta': 0.9801978032903368, 'sampling_method': 'uniform', 's                                                                     ubsample': 0.8821538871416005, 'gamma': 6.440471896300808}. Best is trial 214 with value: 4.326271627581236.
[I 2023-12-21 02:45:11,838] Trial 222 pruned. Trial was pruned at iteration 0.
[I 2023-12-21 02:45:11,893] Trial 223 pruned. Trial was pruned at iteration 0.
[I 2023-12-21 02:45:11,941] Trial 224 pruned. Trial was pruned at iteration 0.
[I 2023-12-21 02:45:11,981] Trial 225 pruned. Trial was pruned at iteration 0.
[I 2023-12-21 02:45:12,026] Trial 226 pruned. Trial was pruned at iteration 0.
[I 2023-12-21 02:45:12,074] Trial 227 pruned. Trial was pruned at iteration 0.
[I 2023-12-21 02:45:12,113] Trial 228 pruned. Trial was pruned at iteration 0.
[I 2023-12-21 02:45:12,164] Trial 229 pruned. Trial was pruned at iteration 0.
[I 2023-12-21 02:45:12,214] Trial 230 pruned. Trial was pruned at iteration 0.
[I 2023-12-21 02:45:20,210] Trial 231 pruned. Trial was pruned at iteration 157.
[I 2023-12-21 02:45:28,381] Trial 232 pruned. Trial was pruned at iteration 157.
[I 2023-12-21 02:45:28,431] Trial 233 pruned. Trial was pruned at iteration 0.
[I 2023-12-21 02:45:28,472] Trial 234 pruned. Trial was pruned at iteration 0.
[I 2023-12-21 02:45:42,441] Trial 235 finished with value: 4.348603511270707 and parameters: {'learning_rate': 0.1474877596155958, 'aft_l                                                                     oss_distribution': 'logistic', 'aft_loss_distribution_scale': 0.8448084617582459, 'max_depth': 10, 'booster': 'dart', 'scale_pos_weight':                                                                      8.048630378910065, 'alpha': 8.849199109582349, 'lambda': 6.272300830443589, 'eta': 0.9272057548238679, 'sampling_method': 'uniform', 'su                                                                     bsample': 0.8321862344989491, 'gamma': 6.937441268571143}. Best is trial 214 with value: 4.326271627581236.
[I 2023-12-21 02:45:42,492] Trial 236 pruned. Trial was pruned at iteration 0.
[I 2023-12-21 02:45:42,541] Trial 237 pruned. Trial was pruned at iteration 0.
[I 2023-12-21 02:45:42,582] Trial 238 pruned. Trial was pruned at iteration 0.
[I 2023-12-21 02:45:42,628] Trial 239 pruned. Trial was pruned at iteration 0.
[I 2023-12-21 02:45:42,668] Trial 240 pruned. Trial was pruned at iteration 0.
[I 2023-12-21 02:45:50,621] Trial 241 pruned. Trial was pruned at iteration 155.
[I 2023-12-21 02:45:50,675] Trial 242 pruned. Trial was pruned at iteration 0.
[I 2023-12-21 02:45:50,717] Trial 243 pruned. Trial was pruned at iteration 0.
[I 2023-12-21 02:45:50,758] Trial 244 pruned. Trial was pruned at iteration 0.
[I 2023-12-21 02:45:58,835] Trial 245 pruned. Trial was pruned at iteration 156.
[I 2023-12-21 02:45:58,894] Trial 246 pruned. Trial was pruned at iteration 0.
[I 2023-12-21 02:45:58,939] Trial 247 pruned. Trial was pruned at iteration 0.
[I 2023-12-21 02:45:58,980] Trial 248 pruned. Trial was pruned at iteration 0.
[I 2023-12-21 02:45:59,028] Trial 249 pruned. Trial was pruned at iteration 0.
[I 2023-12-21 02:45:59,077] Trial 250 pruned. Trial was pruned at iteration 0.
[I 2023-12-21 02:45:59,119] Trial 251 pruned. Trial was pruned at iteration 0.
[I 2023-12-21 02:45:59,160] Trial 252 pruned. Trial was pruned at iteration 0.
[I 2023-12-21 02:45:59,203] Trial 253 pruned. Trial was pruned at iteration 0.
[I 2023-12-21 02:45:59,247] Trial 254 pruned. Trial was pruned at iteration 0.
[I 2023-12-21 02:46:08,158] Trial 255 pruned. Trial was pruned at iteration 164.
[I 2023-12-21 02:46:08,212] Trial 256 pruned. Trial was pruned at iteration 0.
[I 2023-12-21 02:46:08,254] Trial 257 pruned. Trial was pruned at iteration 0.
[I 2023-12-21 02:46:08,303] Trial 258 pruned. Trial was pruned at iteration 0.
[I 2023-12-21 02:46:41,840] Trial 259 finished with value: 4.357488179440073 and parameters: {'learning_rate': 0.2222569080898739, 'aft_l                                                                     oss_distribution': 'logistic', 'aft_loss_distribution_scale': 0.8740979368698165, 'max_depth': 10, 'booster': 'dart', 'scale_pos_weight':                                                                      7.139667075167108, 'alpha': 8.656138333356852, 'lambda': 6.759918355440291, 'eta': 0.9429532710779699, 'sampling_method': 'uniform', 'su                                                                     bsample': 0.8550185695729139, 'gamma': 5.993898294645878}. Best is trial 214 with value: 4.326271627581236.
[I 2023-12-21 02:46:41,893] Trial 260 pruned. Trial was pruned at iteration 0.
[I 2023-12-21 02:46:41,935] Trial 261 pruned. Trial was pruned at iteration 0.
[I 2023-12-21 02:46:41,992] Trial 262 pruned. Trial was pruned at iteration 0.
[I 2023-12-21 02:46:42,045] Trial 263 pruned. Trial was pruned at iteration 0.
[I 2023-12-21 02:46:42,087] Trial 264 pruned. Trial was pruned at iteration 0.
[I 2023-12-21 02:46:42,130] Trial 265 pruned. Trial was pruned at iteration 0.
[I 2023-12-21 02:46:42,172] Trial 266 pruned. Trial was pruned at iteration 0.
[I 2023-12-21 02:46:42,221] Trial 267 pruned. Trial was pruned at iteration 0.
[I 2023-12-21 02:46:42,275] Trial 268 pruned. Trial was pruned at iteration 0.
[I 2023-12-21 02:46:42,323] Trial 269 pruned. Trial was pruned at iteration 0.
[I 2023-12-21 02:46:42,377] Trial 270 pruned. Trial was pruned at iteration 0.
[I 2023-12-21 02:46:42,420] Trial 271 pruned. Trial was pruned at iteration 0.
[I 2023-12-21 02:46:51,099] Trial 272 finished with value: 4.3358701836546505 and parameters: {'learning_rate': 0.14711646997082473, 'aft                                                                     _loss_distribution': 'logistic', 'aft_loss_distribution_scale': 0.8183760991214255, 'max_depth': 10, 'booster': 'dart', 'scale_pos_weight                                                                     ': 7.827060182499058, 'alpha': 8.753996026001836, 'lambda': 6.883125795923941, 'eta': 0.8992139130744089, 'sampling_method': 'uniform', '                                                                     subsample': 0.8761470244523065, 'gamma': 6.532094953816112}. Best is trial 214 with value: 4.326271627581236.
[I 2023-12-21 02:46:51,153] Trial 273 pruned. Trial was pruned at iteration 0.
[I 2023-12-21 02:46:51,206] Trial 274 pruned. Trial was pruned at iteration 0.
[I 2023-12-21 02:46:51,253] Trial 275 pruned. Trial was pruned at iteration 0.
[I 2023-12-21 02:46:51,303] Trial 276 pruned. Trial was pruned at iteration 0.
[I 2023-12-21 02:46:51,346] Trial 277 pruned. Trial was pruned at iteration 0.
[I 2023-12-21 02:46:51,396] Trial 278 pruned. Trial was pruned at iteration 0.
[I 2023-12-21 02:46:51,443] Trial 279 pruned. Trial was pruned at iteration 0.
[I 2023-12-21 02:46:51,494] Trial 280 pruned. Trial was pruned at iteration 0.
[I 2023-12-21 02:46:51,539] Trial 281 pruned. Trial was pruned at iteration 0.
[I 2023-12-21 02:46:51,591] Trial 282 pruned. Trial was pruned at iteration 0.
[I 2023-12-21 02:46:51,639] Trial 283 pruned. Trial was pruned at iteration 0.
[I 2023-12-21 02:46:51,681] Trial 284 pruned. Trial was pruned at iteration 0.
[I 2023-12-21 02:46:58,776] Trial 285 finished with value: 4.35890862935421 and parameters: {'learning_rate': 0.16292624985632265, 'aft_l                                                                     oss_distribution': 'logistic', 'aft_loss_distribution_scale': 0.8677643496316052, 'max_depth': 10, 'booster': 'dart', 'scale_pos_weight':                                                                      7.784509606604539, 'alpha': 9.231828437056576, 'lambda': 7.089163115314248, 'eta': 0.9357631753356785, 'sampling_method': 'uniform', 'su                                                                     bsample': 0.8193138789835541, 'gamma': 6.2016875287158095}. Best is trial 214 with value: 4.326271627581236.
[I 2023-12-21 02:46:58,831] Trial 286 pruned. Trial was pruned at iteration 0.
[I 2023-12-21 02:46:58,876] Trial 287 pruned. Trial was pruned at iteration 0.
[I 2023-12-21 02:46:58,926] Trial 288 pruned. Trial was pruned at iteration 0.
[I 2023-12-21 02:46:58,976] Trial 289 pruned. Trial was pruned at iteration 0.
[I 2023-12-21 02:46:59,022] Trial 290 pruned. Trial was pruned at iteration 0.
[I 2023-12-21 02:46:59,065] Trial 291 pruned. Trial was pruned at iteration 0.
[I 2023-12-21 02:46:59,108] Trial 292 pruned. Trial was pruned at iteration 0.
[I 2023-12-21 02:46:59,158] Trial 293 pruned. Trial was pruned at iteration 0.
(tf2.15) [lisat@ng31201 lisat]$ [I 2023-12-21 02:47:17,453] Trial 294 finished with value: 4.358686185270296 and parameters: {'learning_r                                                                     ate': 0.15924495160549218, 'aft_loss_distribution': 'logistic', 'aft_loss_distribution_scale': 0.8453837620649899, 'max_depth': 10, 'boos                                                                     ter': 'dart', 'scale_pos_weight': 8.091421136090402, 'alpha': 9.231867735183974, 'lambda': 6.87426062604878, 'eta': 0.9994959319204925, '                                                                     sampling_method': 'uniform', 'subsample': 0.792328788660328, 'gamma': 7.06260404547815}. Best is trial 214 with value: 4.326271627581236.
[I 2023-12-21 02:47:17,510] Trial 295 pruned. Trial was pruned at iteration 0.
[I 2023-12-21 02:47:17,553] Trial 296 pruned. Trial was pruned at iteration 0.
[I 2023-12-21 02:47:17,596] Trial 297 pruned. Trial was pruned at iteration 0.
[I 2023-12-21 02:47:17,648] Trial 298 pruned. Trial was pruned at iteration 0.
[I 2023-12-21 02:47:51,767] Trial 299 finished with value: 4.331642633276522 and parameters: {'learning_rate': 0.1486549243973586, 'aft_l                                                                     oss_distribution': 'logistic', 'aft_loss_distribution_scale': 0.8070499068798889, 'max_depth': 10, 'booster': 'dart', 'scale_pos_weight':                                                                      8.193743477623752, 'alpha': 8.718323387019472, 'lambda': 7.40607128467159, 'eta': 0.9996535196149943, 'sampling_method': 'uniform', 'sub                                                                     sample': 0.8313405883761024, 'gamma': 6.601846583904212}. Best is trial 214 with value: 4.326271627581236.
[I 2023-12-21 02:47:51,822] Trial 300 pruned. Trial was pruned at iteration 0.
[I 2023-12-21 02:47:51,876] Trial 301 pruned. Trial was pruned at iteration 0.
[I 2023-12-21 02:47:51,923] Trial 302 pruned. Trial was pruned at iteration 0.
[I 2023-12-21 02:47:51,968] Trial 303 pruned. Trial was pruned at iteration 0.
[I 2023-12-21 02:47:52,019] Trial 304 pruned. Trial was pruned at iteration 0.
[I 2023-12-21 02:47:52,072] Trial 305 pruned. Trial was pruned at iteration 0.
[I 2023-12-21 02:48:16,281] Trial 306 finished with value: 4.354061173213158 and parameters: {'learning_rate': 0.18779365656505584, 'aft_                                                                     loss_distribution': 'logistic', 'aft_loss_distribution_scale': 0.8473307835365932, 'max_depth': 10, 'booster': 'dart', 'scale_pos_weight'                                                                     : 8.582757344870142, 'alpha': 9.065920938789537, 'lambda': 7.256979173781113, 'eta': 0.9318924042173168, 'sampling_method': 'uniform', 's                                                                     ubsample': 0.8358051563190083, 'gamma': 6.6019709791329895}. Best is trial 214 with value: 4.326271627581236.
[I 2023-12-21 02:48:16,328] Trial 307 pruned. Trial was pruned at iteration 0.
[I 2023-12-21 02:48:16,372] Trial 308 pruned. Trial was pruned at iteration 0.
[I 2023-12-21 02:48:16,426] Trial 309 pruned. Trial was pruned at iteration 0.
[I 2023-12-21 02:48:16,478] Trial 310 pruned. Trial was pruned at iteration 0.
[I 2023-12-21 02:48:16,523] Trial 311 pruned. Trial was pruned at iteration 0.
[I 2023-12-21 02:48:50,545] Trial 312 finished with value: 4.317049894457708 and parameters: {'learning_rate': 0.13453259203905743, 'aft_                                                                     loss_distribution': 'logistic', 'aft_loss_distribution_scale': 0.7805527189501746, 'max_depth': 10, 'booster': 'dart', 'scale_pos_weight'                                                                     : 8.58009798582657, 'alpha': 8.664749606893299, 'lambda': 7.354001919553726, 'eta': 0.920474877119536, 'sampling_method': 'uniform', 'sub                                                                     sample': 0.838764506228877, 'gamma': 6.852177935438743}. Best is trial 312 with value: 4.317049894457708.
[I 2023-12-21 02:48:50,602] Trial 313 pruned. Trial was pruned at iteration 0.
[I 2023-12-21 02:48:50,654] Trial 314 pruned. Trial was pruned at iteration 0.
[I 2023-12-21 02:48:50,698] Trial 315 pruned. Trial was pruned at iteration 0.
[I 2023-12-21 02:48:50,752] Trial 316 pruned. Trial was pruned at iteration 0.
[I 2023-12-21 02:48:50,797] Trial 317 pruned. Trial was pruned at iteration 0.
[I 2023-12-21 02:48:50,841] Trial 318 pruned. Trial was pruned at iteration 0.
[I 2023-12-21 02:48:50,893] Trial 319 pruned. Trial was pruned at iteration 0.
[I 2023-12-21 02:48:50,937] Trial 320 pruned. Trial was pruned at iteration 0.
[I 2023-12-21 02:48:50,989] Trial 321 pruned. Trial was pruned at iteration 0.
[I 2023-12-21 02:48:51,035] Trial 322 pruned. Trial was pruned at iteration 0.
[I 2023-12-21 02:48:51,089] Trial 323 pruned. Trial was pruned at iteration 0.
[I 2023-12-21 02:48:51,146] Trial 324 pruned. Trial was pruned at iteration 0.
[I 2023-12-21 02:48:55,210] Trial 325 pruned. Trial was pruned at iteration 110.
[I 2023-12-21 02:48:55,257] Trial 326 pruned. Trial was pruned at iteration 0.
[I 2023-12-21 02:48:55,310] Trial 327 pruned. Trial was pruned at iteration 0.
[I 2023-12-21 02:48:55,363] Trial 328 pruned. Trial was pruned at iteration 0.
[I 2023-12-21 02:48:55,414] Trial 329 pruned. Trial was pruned at iteration 0.
[I 2023-12-21 02:48:55,459] Trial 330 pruned. Trial was pruned at iteration 0.
[I 2023-12-21 02:48:55,509] Trial 331 pruned. Trial was pruned at iteration 0.
[I 2023-12-21 02:48:55,562] Trial 332 pruned. Trial was pruned at iteration 0.
[I 2023-12-21 02:48:55,609] Trial 333 pruned. Trial was pruned at iteration 0.
[I 2023-12-21 02:48:55,654] Trial 334 pruned. Trial was pruned at iteration 0.
[I 2023-12-21 02:48:55,701] Trial 335 pruned. Trial was pruned at iteration 0.
[I 2023-12-21 02:48:55,754] Trial 336 pruned. Trial was pruned at iteration 0.
[I 2023-12-21 02:50:23,665] Trial 337 finished with value: 4.356053786208799 and parameters: {'learning_rate': 0.18521396222199654, 'aft_                                                                     loss_distribution': 'logistic', 'aft_loss_distribution_scale': 0.889994490078525, 'max_depth': 10, 'booster': 'dart', 'scale_pos_weight':                                                                      7.096474655590818, 'alpha': 9.058712518312342, 'lambda': 7.034160478439127, 'eta': 0.7062817063817427, 'sampling_method': 'uniform', 'su                                                                     bsample': 0.826764954059174, 'gamma': 7.190058642100316}. Best is trial 312 with value: 4.317049894457708.
[I 2023-12-21 02:50:23,714] Trial 338 pruned. Trial was pruned at iteration 0.
[I 2023-12-21 02:50:23,760] Trial 339 pruned. Trial was pruned at iteration 0.
[I 2023-12-21 02:50:23,807] Trial 340 pruned. Trial was pruned at iteration 0.
[I 2023-12-21 02:50:23,853] Trial 341 pruned. Trial was pruned at iteration 0.
[I 2023-12-21 02:50:23,917] Trial 342 pruned. Trial was pruned at iteration 0.
[I 2023-12-21 02:50:23,971] Trial 343 pruned. Trial was pruned at iteration 0.
[I 2023-12-21 02:50:24,025] Trial 344 pruned. Trial was pruned at iteration 0.
[I 2023-12-21 02:50:24,071] Trial 345 pruned. Trial was pruned at iteration 0.
[I 2023-12-21 02:50:24,124] Trial 346 pruned. Trial was pruned at iteration 0.
[I 2023-12-21 02:50:24,178] Trial 347 pruned. Trial was pruned at iteration 0.
[I 2023-12-21 02:50:24,225] Trial 348 pruned. Trial was pruned at iteration 0.
[I 2023-12-21 02:50:24,276] Trial 349 pruned. Trial was pruned at iteration 0.
[I 2023-12-21 02:50:24,329] Trial 350 pruned. Trial was pruned at iteration 0.
[I 2023-12-21 02:50:24,375] Trial 351 pruned. Trial was pruned at iteration 0.
[I 2023-12-21 02:50:24,421] Trial 352 pruned. Trial was pruned at iteration 0.
[I 2023-12-21 02:50:24,474] Trial 353 pruned. Trial was pruned at iteration 0.
[I 2023-12-21 02:50:24,520] Trial 354 pruned. Trial was pruned at iteration 0.
[I 2023-12-21 02:50:24,577] Trial 355 pruned. Trial was pruned at iteration 0.
