[I 2023-12-19 00:01:46,036] Trial 195 pruned. Trial was pruned at iteration 0.
[I 2023-12-19 00:01:46,105] Trial 196 pruned. Trial was pruned at iteration 0.
[I 2023-12-19 00:01:46,181] Trial 197 pruned. Trial was pruned at iteration 0.
[I 2023-12-19 00:01:46,252] Trial 198 pruned. Trial was pruned at iteration 0.
[I 2023-12-19 00:01:46,337] Trial 199 pruned. Trial was pruned at iteration 1.
[I 2023-12-19 00:01:51,469] Trial 200 finished with value: 2.026896816376209 and parameters: {'learning_rate': 0.9154471300875865, 'aft_loss_distribution': 'normal', 'aft_loss_distribution_scale': 1.9621658049084774, 'max_depth': 10, 'booster': 'dart', 'scale_pos_weight': 2.596156253963592, 'alpha': 2.4009999840051233, 'lambda': 3.4674841461822568, 'eta': 0.1887262524665702, 'sampling_method': 'gradient_based', 'subsample': 0.6421642317965278, 'gamma': 8.070666388974471}. Best is trial 74 with value: 2.0055561730008655.
[I 2023-12-19 00:02:04,769] Trial 201 finished with value: 2.0274369963579812 and parameters: {'learning_rate': 0.9242864116014341, 'aft_loss_distribution': 'normal', 'aft_loss_distribution_scale': 1.9216427887607288, 'max_depth': 10, 'booster': 'dart', 'scale_pos_weight': 2.461852353279257, 'alpha': 2.4054118497727064, 'lambda': 3.076126670365256, 'eta': 0.18786914658230267, 'sampling_method': 'gradient_based', 'subsample': 0.6534424050427532, 'gamma': 8.02674575373797}. Best is trial 74 with value: 2.0055561730008655.
[I 2023-12-19 00:02:06,453] Trial 202 finished with value: inf and parameters: {'learning_rate': 0.9281605441757679, 'aft_loss_distribution': 'normal', 'aft_loss_distribution_scale': 1.9776298474256166, 'max_depth': 10, 'booster': 'dart', 'scale_pos_weight': 2.458478688893525, 'alpha': 2.3040450183614665, 'lambda': 3.451211567627896, 'eta': 0.17827205113275743, 'sampling_method': 'gradient_based', 'subsample': 0.6526321876220383, 'gamma': 7.793496637842979}. Best is trial 74 with value: 2.0055561730008655.
[I 2023-12-19 00:02:06,585] Trial 203 pruned. Trial was pruned at iteration 1.
[I 2023-12-19 00:02:09,756] Trial 204 finished with value: inf and parameters: {'learning_rate': 0.9461087563663496, 'aft_loss_distribution': 'normal', 'aft_loss_distribution_scale': 1.786458077490635, 'max_depth': 10, 'booster': 'dart', 'scale_pos_weight': 2.5742470968463533, 'alpha': 2.05241447506682, 'lambda': 3.187925603192503, 'eta': 0.1263686166020617, 'sampling_method': 'gradient_based', 'subsample': 0.6856751084958628, 'gamma': 8.213166346939309}. Best is trial 74 with value: 2.0055561730008655.
[I 2023-12-19 00:02:09,890] Trial 205 pruned. Trial was pruned at iteration 1.
[I 2023-12-19 00:02:11,519] Trial 206 finished with value: inf and parameters: {'learning_rate': 0.9019868914676173, 'aft_loss_distribution': 'normal', 'aft_loss_distribution_scale': 1.59211472327067, 'max_depth': 10, 'booster': 'dart', 'scale_pos_weight': 0.4775130245076983, 'alpha': 2.287387085513176, 'lambda': 3.434480177414086, 'eta': 0.1726086353555292, 'sampling_method': 'gradient_based', 'subsample': 0.6676270392518047, 'gamma': 7.006480444229679}. Best is trial 74 with value: 2.0055561730008655.
[I 2023-12-19 00:02:14,747] Trial 207 finished with value: 2.0252002619953826 and parameters: {'learning_rate': 0.9812510584765676, 'aft_loss_distribution': 'normal', 'aft_loss_distribution_scale': 1.942349752683966, 'max_depth': 10, 'booster': 'dart', 'scale_pos_weight': 2.483112255627905, 'alpha': 2.461188591807849, 'lambda': 9.11262308770416, 'eta': 0.15648339903275227, 'sampling_method': 'gradient_based', 'subsample': 0.5983602212501152, 'gamma': 8.016590364680482}. Best is trial 74 with value: 2.0055561730008655.
[I 2023-12-19 00:02:14,827] Trial 208 pruned. Trial was pruned at iteration 1.
[I 2023-12-19 00:02:16,438] Trial 209 finished with value: inf and parameters: {'learning_rate': 0.9711628780206206, 'aft_loss_distribution': 'normal', 'aft_loss_distribution_scale': 1.932076934664519, 'max_depth': 10, 'booster': 'dart', 'scale_pos_weight': 2.6075934185854486, 'alpha': 3.152923063595284, 'lambda': 3.0377179264423506, 'eta': 0.18739035718043928, 'sampling_method': 'gradient_based', 'subsample': 0.6121025170395147, 'gamma': 8.03448820742849}. Best is trial 74 with value: 2.0055561730008655.
[I 2023-12-19 00:02:16,522] Trial 210 pruned. Trial was pruned at iteration 1.
[I 2023-12-19 00:02:18,233] Trial 211 finished with value: inf and parameters: {'learning_rate': 0.9532727776976652, 'aft_loss_distribution': 'normal', 'aft_loss_distribution_scale': 1.7642852745281974, 'max_depth': 10, 'booster': 'dart', 'scale_pos_weight': 2.5184105889087482, 'alpha': 1.9443201906569914, 'lambda': 8.827104862471094, 'eta': 0.21019476631121353, 'sampling_method': 'gradient_based', 'subsample': 0.6499834526116638, 'gamma': 7.941936818896771}. Best is trial 74 with value: 2.0055561730008655.
[I 2023-12-19 00:02:18,316] Trial 212 pruned. Trial was pruned at iteration 1.
[I 2023-12-19 00:02:23,548] Trial 213 finished with value: 2.0237077317988392 and parameters: {'learning_rate': 0.9802803143882799, 'aft_loss_distribution': 'normal', 'aft_loss_distribution_scale': 1.9225156620684447, 'max_depth': 8, 'booster': 'dart', 'scale_pos_weight': 0.4060814900612749, 'alpha': 2.204609674567398, 'lambda': 2.799281250338768, 'eta': 0.11428020355936916, 'sampling_method': 'gradient_based', 'subsample': 0.6913233414548162, 'gamma': 8.285603222635354}. Best is trial 74 with value: 2.0055561730008655.
[I 2023-12-19 00:02:25,447] Trial 214 finished with value: inf and parameters: {'learning_rate': 0.985250253053607, 'aft_loss_distribution': 'normal', 'aft_loss_distribution_scale': 2.032423828399889, 'max_depth': 9, 'booster': 'dart', 'scale_pos_weight': 0.42383059932529926, 'alpha': 2.254724030334443, 'lambda': 2.6646813542463406, 'eta': 0.13051383535592975, 'sampling_method': 'gradient_based', 'subsample': 0.6975029072317863, 'gamma': 8.529660711761633}. Best is trial 74 with value: 2.0055561730008655.
[I 2023-12-19 00:02:27,315] Trial 215 finished with value: inf and parameters: {'learning_rate': 0.9738613112355187, 'aft_loss_distribution': 'normal', 'aft_loss_distribution_scale': 1.8220279452956993, 'max_depth': 10, 'booster': 'dart', 'scale_pos_weight': 0.3238984661411318, 'alpha': 2.172704909966684, 'lambda': 2.906776798582653, 'eta': 0.11281770405058339, 'sampling_method': 'gradient_based', 'subsample': 0.7361635006559819, 'gamma': 9.967298368345377}. Best is trial 74 with value: 2.0055561730008655.
[I 2023-12-19 00:02:27,400] Trial 216 pruned. Trial was pruned at iteration 1.
[I 2023-12-19 00:02:27,475] Trial 217 pruned. Trial was pruned at iteration 1.
[I 2023-12-19 00:02:28,868] Trial 218 finished with value: inf and parameters: {'learning_rate': 0.9325185580795838, 'aft_loss_distribution': 'normal', 'aft_loss_distribution_scale': 1.492176654883046, 'max_depth': 10, 'booster': 'dart', 'scale_pos_weight': 0.727291293932839, 'alpha': 2.408562565494104, 'lambda': 3.633710948079007, 'eta': 0.1944350229207621, 'sampling_method': 'gradient_based', 'subsample': 0.6630137820116937, 'gamma': 9.762894924932468}. Best is trial 74 with value: 2.0055561730008655.
[I 2023-12-19 00:02:31,064] Trial 219 finished with value: inf and parameters: {'learning_rate': 0.8765749293495603, 'aft_loss_distribution': 'normal', 'aft_loss_distribution_scale': 1.9295196329478146, 'max_depth': 9, 'booster': 'dart', 'scale_pos_weight': 0.2401067777748877, 'alpha': 1.9969489269991698, 'lambda': 2.77099601273365, 'eta': 0.2227034255836902, 'sampling_method': 'gradient_based', 'subsample': 0.5809532129201388, 'gamma': 8.312351312075831}. Best is trial 74 with value: 2.0055561730008655.
[I 2023-12-19 00:02:34,172] Trial 220 finished with value: 2.0055643307536783 and parameters: {'learning_rate': 0.9746474276692079, 'aft_loss_distribution': 'normal', 'aft_loss_distribution_scale': 1.6437942459270494, 'max_depth': 8, 'booster': 'dart', 'scale_pos_weight': 0.5331825252962297, 'alpha': 2.581672376085964, 'lambda': 3.079741464460398, 'eta': 0.26325878597054836, 'sampling_method': 'gradient_based', 'subsample': 0.7056322839512074, 'gamma': 9.51517629614712}. Best is trial 74 with value: 2.0055561730008655.
[I 2023-12-19 00:02:36,977] Trial 221 finished with value: inf and parameters: {'learning_rate': 0.9781676868494529, 'aft_loss_distribution': 'normal', 'aft_loss_distribution_scale': 1.6646795963540306, 'max_depth': 10, 'booster': 'dart', 'scale_pos_weight': 0.5208005929047156, 'alpha': 2.443335274436827, 'lambda': 3.330503713873145, 'eta': 0.24213142865337697, 'sampling_method': 'gradient_based', 'subsample': 0.7184550082448217, 'gamma': 9.464538701979535}. Best is trial 74 with value: 2.0055561730008655.
[I 2023-12-19 00:02:42,433] Trial 222 finished with value: 2.0210745037101634 and parameters: {'learning_rate': 0.9587532048338816, 'aft_loss_distribution': 'normal', 'aft_loss_distribution_scale': 1.8744522819096494, 'max_depth': 10, 'booster': 'dart', 'scale_pos_weight': 0.3801517885763126, 'alpha': 2.6385000317072684, 'lambda': 3.0613967900639105, 'eta': 0.26990591931068064, 'sampling_method': 'gradient_based', 'subsample': 0.7004501581342486, 'gamma': 9.610248746666555}. Best is trial 74 with value: 2.0055561730008655.
[I 2023-12-19 00:02:42,529] Trial 223 pruned. Trial was pruned at iteration 1.
[I 2023-12-19 00:02:45,617] Trial 224 finished with value: 2.024219379949715 and parameters: {'learning_rate': 0.9870445190705378, 'aft_loss_distribution': 'normal', 'aft_loss_distribution_scale': 1.9017989900110872, 'max_depth': 8, 'booster': 'dart', 'scale_pos_weight': 0.5875663472836494, 'alpha': 2.9633025563702566, 'lambda': 3.0297161812324567, 'eta': 0.25701246416329665, 'sampling_method': 'gradient_based', 'subsample': 0.702346423086023, 'gamma': 9.800509557608112}. Best is trial 74 with value: 2.0055561730008655.
[I 2023-12-19 00:02:47,983] Trial 225 finished with value: inf and parameters: {'learning_rate': 0.9990216932730144, 'aft_loss_distribution': 'normal', 'aft_loss_distribution_scale': 1.894043346460165, 'max_depth': 8, 'booster': 'dart', 'scale_pos_weight': 0.5462294769381424, 'alpha': 2.913105774641407, 'lambda': 2.973282621589972, 'eta': 0.2617338505994117, 'sampling_method': 'gradient_based', 'subsample': 0.6803837034465938, 'gamma': 9.790784092935743}. Best is trial 74 with value: 2.0055561730008655.
[I 2023-12-19 00:02:50,443] Trial 226 finished with value: inf and parameters: {'learning_rate': 0.9739863135021818, 'aft_loss_distribution': 'normal', 'aft_loss_distribution_scale': 1.5628586487971234, 'max_depth': 8, 'booster': 'dart', 'scale_pos_weight': 0.6295968555708902, 'alpha': 3.150034579259139, 'lambda': 2.5953469589432943, 'eta': 0.5178167123269716, 'sampling_method': 'gradient_based', 'subsample': 0.70163505847668, 'gamma': 9.92456201937397}. Best is trial 74 with value: 2.0055561730008655.
[I 2023-12-19 00:02:54,480] Trial 227 finished with value: 2.0192831445461903 and parameters: {'learning_rate': 0.9497102056651574, 'aft_loss_distribution': 'normal', 'aft_loss_distribution_scale': 1.8691432309035008, 'max_depth': 8, 'booster': 'dart', 'scale_pos_weight': 0.4555060122391049, 'alpha': 2.7133225060903916, 'lambda': 2.8970868662276024, 'eta': 0.26442253789184716, 'sampling_method': 'gradient_based', 'subsample': 0.7081552027153061, 'gamma': 9.649944101324945}. Best is trial 74 with value: 2.0055561730008655.
[I 2023-12-19 00:02:57,782] Trial 228 finished with value: 2.013751943509873 and parameters: {'learning_rate': 0.9521423703048169, 'aft_loss_distribution': 'normal', 'aft_loss_distribution_scale': 1.8218144666897953, 'max_depth': 8, 'booster': 'dart', 'scale_pos_weight': 0.39873730282041947, 'alpha': 2.995016983261913, 'lambda': 2.800290184426443, 'eta': 0.29543332736927025, 'sampling_method': 'gradient_based', 'subsample': 0.7114760337105164, 'gamma': 9.62925791706916}. Best is trial 74 with value: 2.0055561730008655.
[I 2023-12-19 00:03:14,904] Trial 229 finished with value: 2.021487460256117 and parameters: {'learning_rate': 0.9438351626571021, 'aft_loss_distribution': 'normal', 'aft_loss_distribution_scale': 1.9203574465192168, 'max_depth': 8, 'booster': 'dart', 'scale_pos_weight': 0.3991572446330099, 'alpha': 3.0187475588133457, 'lambda': 2.9390297218203045, 'eta': 0.2775719275757192, 'sampling_method': 'gradient_based', 'subsample': 0.7277167234890691, 'gamma': 9.628317773524525}. Best is trial 74 with value: 2.0055561730008655.
[I 2023-12-19 00:03:16,500] Trial 230 finished with value: inf and parameters: {'learning_rate': 0.9513762937977118, 'aft_loss_distribution': 'normal', 'aft_loss_distribution_scale': 1.8177450203285437, 'max_depth': 8, 'booster': 'dart', 'scale_pos_weight': 0.3781401646715041, 'alpha': 3.3671534821239177, 'lambda': 2.819101625498451, 'eta': 0.2734318202787924, 'sampling_method': 'gradient_based', 'subsample': 0.7264539240224721, 'gamma': 9.635197666494632}. Best is trial 74 with value: 2.0055561730008655.
[I 2023-12-19 00:03:16,586] Trial 231 pruned. Trial was pruned at iteration 1.
[I 2023-12-19 00:03:16,666] Trial 232 pruned. Trial was pruned at iteration 1.
[I 2023-12-19 00:03:18,561] Trial 233 finished with value: inf and parameters: {'learning_rate': 0.9611855943655455, 'aft_loss_distribution': 'normal', 'aft_loss_distribution_scale': 1.7158979953750682, 'max_depth': 8, 'booster': 'dart', 'scale_pos_weight': 0.38591244196048874, 'alpha': 2.744376957368277, 'lambda': 3.0787530562253114, 'eta': 0.2904158352683807, 'sampling_method': 'gradient_based', 'subsample': 0.7456882853641609, 'gamma': 9.363316448743175}. Best is trial 74 with value: 2.0055561730008655.
[I 2023-12-19 00:03:22,593] Trial 234 finished with value: 2.0188024952391013 and parameters: {'learning_rate': 0.9217827245680279, 'aft_loss_distribution': 'normal', 'aft_loss_distribution_scale': 1.904781267729887, 'max_depth': 8, 'booster': 'dart', 'scale_pos_weight': 0.29238707633240724, 'alpha': 2.6651168890392305, 'lambda': 2.4530441452884846, 'eta': 0.270939363595279, 'sampling_method': 'gradient_based', 'subsample': 0.7043811767034335, 'gamma': 9.571275932408605}. Best is trial 74 with value: 2.0055561730008655.
[I 2023-12-19 00:03:24,258] Trial 235 finished with value: inf and parameters: {'learning_rate': 0.9219757724468932, 'aft_loss_distribution': 'normal', 'aft_loss_distribution_scale': 1.9247511330936218, 'max_depth': 8, 'booster': 'dart', 'scale_pos_weight': 0.27481263585299537, 'alpha': 2.6552609294442404, 'lambda': 2.5200780082351453, 'eta': 0.26726830849120775, 'sampling_method': 'gradient_based', 'subsample': 0.7605894882804277, 'gamma': 9.59196343726147}. Best is trial 74 with value: 2.0055561730008655.
[I 2023-12-19 00:03:38,321] Trial 236 finished with value: 2.000108025662045 and parameters: {'learning_rate': 0.9413209755542487, 'aft_loss_distribution': 'normal', 'aft_loss_distribution_scale': 1.6489382939974537, 'max_depth': 8, 'booster': 'dart', 'scale_pos_weight': 0.1756342013035167, 'alpha': 2.84337872386043, 'lambda': 2.33721673486741, 'eta': 0.23324188627226117, 'sampling_method': 'gradient_based', 'subsample': 0.6932714918179795, 'gamma': 9.808824402014222}. Best is trial 236 with value: 2.000108025662045.
[I 2023-12-19 00:03:40,052] Trial 237 finished with value: inf and parameters: {'learning_rate': 0.9147349170358164, 'aft_loss_distribution': 'normal', 'aft_loss_distribution_scale': 1.5779102459103356, 'max_depth': 8, 'booster': 'dart', 'scale_pos_weight': 0.18473291280688653, 'alpha': 2.94014428309534, 'lambda': 2.3358667899318757, 'eta': 0.23523505196665703, 'sampling_method': 'gradient_based', 'subsample': 0.7005263693893115, 'gamma': 9.815566518846131}. Best is trial 236 with value: 2.000108025662045.
[I 2023-12-19 00:03:41,493] Trial 238 finished with value: inf and parameters: {'learning_rate': 0.9352605702074327, 'aft_loss_distribution': 'normal', 'aft_loss_distribution_scale': 1.7326594655801864, 'max_depth': 8, 'booster': 'dart', 'scale_pos_weight': 0.13818435513468683, 'alpha': 2.7705413302123514, 'lambda': 2.172150390946176, 'eta': 0.25058329510382954, 'sampling_method': 'gradient_based', 'subsample': 0.7201017234595737, 'gamma': 9.833905985104954}. Best is trial 236 with value: 2.000108025662045.
[I 2023-12-19 00:03:42,965] Trial 239 finished with value: inf and parameters: {'learning_rate': 0.9498166173871598, 'aft_loss_distribution': 'normal', 'aft_loss_distribution_scale': 1.4819073884667295, 'max_depth': 8, 'booster': 'dart', 'scale_pos_weight': 0.285677825112267, 'alpha': 3.23302495548823, 'lambda': 2.6973646915655953, 'eta': 0.21897062568008482, 'sampling_method': 'gradient_based', 'subsample': 0.6903039048162016, 'gamma': 9.629345461694673}. Best is trial 236 with value: 2.000108025662045.
[I 2023-12-19 00:03:46,223] Trial 240 finished with value: 2.0195595511861035 and parameters: {'learning_rate': 0.9859142378782187, 'aft_loss_distribution': 'normal', 'aft_loss_distribution_scale': 1.891371393344415, 'max_depth': 8, 'booster': 'dart', 'scale_pos_weight': 0.3533203817201291, 'alpha': 2.559750827548039, 'lambda': 2.3942332930165406, 'eta': 0.28508555489498094, 'sampling_method': 'gradient_based', 'subsample': 0.738041528196629, 'gamma': 9.974251702066038}. Best is trial 236 with value: 2.000108025662045.
[I 2023-12-19 00:03:48,152] Trial 241 finished with value: inf and parameters: {'learning_rate': 0.9871211456571102, 'aft_loss_distribution': 'normal', 'aft_loss_distribution_scale': 1.8681384616293355, 'max_depth': 8, 'booster': 'dart', 'scale_pos_weight': 0.32130067792448863, 'alpha': 2.541238371635279, 'lambda': 2.39660064931134, 'eta': 0.2742126062968866, 'sampling_method': 'gradient_based', 'subsample': 0.7376346351997298, 'gamma': 9.964419155322908}. Best is trial 236 with value: 2.000108025662045.
[I 2023-12-19 00:03:48,283] Trial 242 pruned. Trial was pruned at iteration 1.
[I 2023-12-19 00:03:50,298] Trial 243 finished with value: inf and parameters: {'learning_rate': 0.9971609675285263, 'aft_loss_distribution': 'normal', 'aft_loss_distribution_scale': 1.7008976253143784, 'max_depth': 8, 'booster': 'dart', 'scale_pos_weight': 0.25509240678564493, 'alpha': 2.395859142370048, 'lambda': 2.460997091165849, 'eta': 0.23274087324822934, 'sampling_method': 'gradient_based', 'subsample': 0.7120117232857303, 'gamma': 9.48505718055817}. Best is trial 236 with value: 2.000108025662045.
[I 2023-12-19 00:03:52,162] Trial 244 finished with value: inf and parameters: {'learning_rate': 0.9311094971126397, 'aft_loss_distribution': 'normal', 'aft_loss_distribution_scale': 1.9181316938883883, 'max_depth': 8, 'booster': 'dart', 'scale_pos_weight': 0.35385914023639736, 'alpha': 2.633076766075279, 'lambda': 2.143838974015079, 'eta': 0.26045459922713543, 'sampling_method': 'gradient_based', 'subsample': 0.6945807737855576, 'gamma': 9.968203977535683}. Best is trial 236 with value: 2.000108025662045.
[I 2023-12-19 00:03:52,249] Trial 245 pruned. Trial was pruned at iteration 1.
[I 2023-12-19 00:03:53,857] Trial 246 finished with value: inf and parameters: {'learning_rate': 0.9477487522771196, 'aft_loss_distribution': 'normal', 'aft_loss_distribution_scale': 1.3978473818001087, 'max_depth': 8, 'booster': 'dart', 'scale_pos_weight': 0.2366645927003601, 'alpha': 2.3036532770063824, 'lambda': 0.5140375621852094, 'eta': 0.31580765254662424, 'sampling_method': 'gradient_based', 'subsample': 0.6737944063099071, 'gamma': 9.575586108251565}. Best is trial 236 with value: 2.000108025662045.
[I 2023-12-19 00:03:53,937] Trial 247 pruned. Trial was pruned at iteration 0.
[I 2023-12-19 00:03:56,063] Trial 248 finished with value: inf and parameters: {'learning_rate': 0.9846716333749478, 'aft_loss_distribution': 'normal', 'aft_loss_distribution_scale': 1.6367831613814403, 'max_depth': 8, 'booster': 'dart', 'scale_pos_weight': 0.1729811283197702, 'alpha': 3.0375779191896877, 'lambda': 2.3192340216970733, 'eta': 0.2816200428189466, 'sampling_method': 'gradient_based', 'subsample': 0.6587424306837595, 'gamma': 9.99073219691896}. Best is trial 236 with value: 2.000108025662045.
[I 2023-12-19 00:03:56,146] Trial 249 pruned. Trial was pruned at iteration 1.
[I 2023-12-19 00:03:59,934] Trial 250 finished with value: 2.0201135586200074 and parameters: {'learning_rate': 0.9996775762934501, 'aft_loss_distribution': 'normal', 'aft_loss_distribution_scale': 1.8403723132698975, 'max_depth': 8, 'booster': 'dart', 'scale_pos_weight': 0.2889879248826933, 'alpha': 2.544613729561491, 'lambda': 1.928879244413371, 'eta': 0.20745153097346458, 'sampling_method': 'gradient_based', 'subsample': 0.6835071293460948, 'gamma': 9.536466246226087}. Best is trial 236 with value: 2.000108025662045.
[I 2023-12-19 00:04:02,053] Trial 251 finished with value: inf and parameters: {'learning_rate': 0.9953264947522504, 'aft_loss_distribution': 'normal', 'aft_loss_distribution_scale': 1.6637782940934123, 'max_depth': 8, 'booster': 'dart', 'scale_pos_weight': 0.30024079949773314, 'alpha': 2.330127632119472, 'lambda': 0.27456101632030494, 'eta': 0.24919219223079636, 'sampling_method': 'gradient_based', 'subsample': 0.7296684811767672, 'gamma': 9.488896819357295}. Best is trial 236 with value: 2.000108025662045.
[I 2023-12-19 00:04:07,370] Trial 252 finished with value: 2.0214215151436625 and parameters: {'learning_rate': 0.9764122603936518, 'aft_loss_distribution': 'normal', 'aft_loss_distribution_scale': 1.9069042448982199, 'max_depth': 8, 'booster': 'dart', 'scale_pos_weight': 0.3823478269774649, 'alpha': 2.5476334627390775, 'lambda': 1.986575631310349, 'eta': 0.17000497549987462, 'sampling_method': 'gradient_based', 'subsample': 0.682437941902584, 'gamma': 9.176713374742805}. Best is trial 236 with value: 2.000108025662045.
