[I 2023-12-19 04:45:26,250] Trial 216 pruned. Trial was pruned at iteration 0.
[I 2023-12-19 04:45:26,344] Trial 217 pruned. Trial was pruned at iteration 0.
[I 2023-12-19 04:45:26,440] Trial 218 pruned. Trial was pruned at iteration 0.
[I 2023-12-19 04:45:26,536] Trial 219 pruned. Trial was pruned at iteration 1.
[I 2023-12-19 04:45:26,634] Trial 220 pruned. Trial was pruned at iteration 0.
[I 2023-12-19 04:45:26,734] Trial 221 pruned. Trial was pruned at iteration 0.
[I 2023-12-19 04:45:26,839] Trial 222 pruned. Trial was pruned at iteration 0.
[I 2023-12-19 04:45:26,947] Trial 223 pruned. Trial was pruned at iteration 0.
[I 2023-12-19 04:45:27,051] Trial 224 pruned. Trial was pruned at iteration 0.
[I 2023-12-19 04:45:27,149] Trial 225 pruned. Trial was pruned at iteration 0.
[I 2023-12-19 04:45:27,250] Trial 226 pruned. Trial was pruned at iteration 0.
[I 2023-12-19 04:45:27,348] Trial 227 pruned. Trial was pruned at iteration 0.
[I 2023-12-19 04:45:27,453] Trial 228 pruned. Trial was pruned at iteration 1.
[I 2023-12-19 04:45:27,552] Trial 229 pruned. Trial was pruned at iteration 0.
[I 2023-12-19 04:45:27,654] Trial 230 pruned. Trial was pruned at iteration 0.
[I 2023-12-19 04:45:27,752] Trial 231 pruned. Trial was pruned at iteration 0.
[I 2023-12-19 04:45:27,846] Trial 232 pruned. Trial was pruned at iteration 0.
[I 2023-12-19 04:45:27,957] Trial 233 pruned. Trial was pruned at iteration 0.
[I 2023-12-19 04:45:28,056] Trial 234 pruned. Trial was pruned at iteration 0.
[I 2023-12-19 04:45:28,154] Trial 235 pruned. Trial was pruned at iteration 0.
[I 2023-12-19 04:45:28,251] Trial 236 pruned. Trial was pruned at iteration 0.
[I 2023-12-19 04:45:28,352] Trial 237 pruned. Trial was pruned at iteration 0.
[I 2023-12-19 04:45:28,444] Trial 238 pruned. Trial was pruned at iteration 0.
[I 2023-12-19 04:45:28,545] Trial 239 pruned. Trial was pruned at iteration 0.
[I 2023-12-19 04:45:28,640] Trial 240 pruned. Trial was pruned at iteration 0.
[I 2023-12-19 04:45:28,738] Trial 241 pruned. Trial was pruned at iteration 0.
[I 2023-12-19 04:45:28,834] Trial 242 pruned. Trial was pruned at iteration 0.
[I 2023-12-19 04:45:28,963] Trial 243 pruned. Trial was pruned at iteration 3.
[I 2023-12-19 04:45:29,065] Trial 244 pruned. Trial was pruned at iteration 0.
[I 2023-12-19 04:45:29,166] Trial 245 pruned. Trial was pruned at iteration 1.
[I 2023-12-19 04:45:29,265] Trial 246 pruned. Trial was pruned at iteration 0.
[I 2023-12-19 04:45:29,361] Trial 247 pruned. Trial was pruned at iteration 0.
[I 2023-12-19 04:45:29,470] Trial 248 pruned. Trial was pruned at iteration 0.
[I 2023-12-19 04:45:29,566] Trial 249 pruned. Trial was pruned at iteration 0.
Completed hyperparameter tuning with best aft-nloglik = 4.238477147639884.
Re-running the best trial... params = {'verbosity': 0, 'objective': 'survival:aft', 'eval_metric': 'aft-nloglik', 'tree_method': 'hist', 'learning_rate': 0.8655262836233876, 'aft_loss_distribution': 'normal', 'aft_loss_distribution_scale': 0.998115794183331, 'max_depth': 3, 'booster': 'dart', 'scale_pos_weight': 0.6703776207600405, 'alpha': 8.541849275943353, 'lambda': 7.647220359669481, 'eta': 0.2654550978216056, 'sampling_method': 'uniform', 'subsample': 0.7957107257005807, 'gamma': 8.337071940933475}
[W 2023-12-19 04:45:40,744] Trial 10 is omitted in visualization because its objective value is inf or nan.
[W 2023-12-19 04:45:40,747] Trial 12 is omitted in visualization because its objective value is inf or nan.
[W 2023-12-19 04:45:40,750] Trial 24 is omitted in visualization because its objective value is inf or nan.
[W 2023-12-19 04:45:40,752] Trial 47 is omitted in visualization because its objective value is inf or nan.
[W 2023-12-19 04:45:40,754] Trial 56 is omitted in visualization because its objective value is inf or nan.
[W 2023-12-19 04:45:40,756] Trial 77 is omitted in visualization because its objective value is inf or nan.
[W 2023-12-19 04:45:40,757] Trial 81 is omitted in visualization because its objective value is inf or nan.
[W 2023-12-19 04:45:40,758] Trial 95 is omitted in visualization because its objective value is inf or nan.
[W 2023-12-19 04:45:40,760] Trial 101 is omitted in visualization because its objective value is inf or nan.
[W 2023-12-19 04:45:40,762] Trial 116 is omitted in visualization because its objective value is inf or nan.
[W 2023-12-19 04:45:40,763] Trial 120 is omitted in visualization because its objective value is inf or nan.
[W 2023-12-19 04:45:40,764] Trial 143 is omitted in visualization because its objective value is inf or nan.
[W 2023-12-19 04:45:40,765] Trial 165 is omitted in visualization because its objective value is inf or nan.
[W 2023-12-19 04:45:40,766] Trial 170 is omitted in visualization because its objective value is inf or nan.
[W 2023-12-19 04:45:40,767] Trial 186 is omitted in visualization because its objective value is inf or nan.
[W 2023-12-19 04:45:40,767] Trial 208 is omitted in visualization because its objective value is inf or nan.
TRN1 | R2:0.249; p:2.368e-178 | C:62.22 |3h:0.885 |6h:0.866 |9h:0.850 |12h:0.401 |15h:0.401 |18h:0.396 |24h:0.161 |48h:0.153 |72h:0.148 |1wk:0.020 |2wks:0.019 |1mon:0.013 |
TRN2 | R2:0.227; p:2.043e-38 | C:61.05 |3h:0.885 |6h:0.866 |9h:0.850 |12h:0.400 |15h:0.400 |18h:0.395 |24h:0.161 |48h:0.153 |72h:0.147 |1wk:0.020 |2wks:0.018 |1mon:0.013 |
VAL | R2:0.218; p:2.37e-35 | C:60.52 |3h:0.885 |6h:0.866 |9h:0.850 |12h:0.400 |15h:0.400 |18h:0.396 |24h:0.161 |48h:0.153 |72h:0.147 |1wk:0.020 |2wks:0.018 |1mon:0.013 |
[I 2023-12-19 04:45:46,201] A new study created in memory with name: no-name-278245f8-7940-44a4-b09c-b04153576479
TST | R2:0.172; p:9.518e-130 | C:58.35 |3h:0.877 |6h:0.855 |9h:0.837 |12h:0.396 |15h:0.396 |18h:0.385 |24h:0.124 |48h:0.119 |72h:0.115 |1wk:0.019 |2wks:0.018 |1mon:0.013 |
/content/drive/MyDrive/intermediates2/res//outcome1_xgb-aft_inp21_k9_emb1_rdims8.json
Dimensionality reduced word embedding 2 with ['location_numeric', 'race_numeric', 'sex_numeric', 'body_part_numeric', 'product_1_numeric', 'product_2_numeric', 'drug_numeric', 'alcohol_numeric', 'month']
Dimensionality reduced word embedding 2 with ['location_numeric', 'race_numeric', 'sex_numeric', 'body_part_numeric', 'product_1_numeric', 'product_2_numeric', 'drug_numeric', 'alcohol_numeric', 'month']
Dimensionality reduced word embedding 2 with ['location_numeric', 'race_numeric', 'sex_numeric', 'body_part_numeric', 'product_1_numeric', 'product_2_numeric', 'drug_numeric', 'alcohol_numeric', 'month']
Dimensionality reduced word embedding 2 with ['location_numeric', 'race_numeric', 'sex_numeric', 'body_part_numeric', 'product_1_numeric', 'product_2_numeric', 'drug_numeric', 'alcohol_numeric', 'month']
trn1
trn2
val
tst
[I 2023-12-19 04:46:10,517] Trial 0 finished with value: 4.460210844011433 and parameters: {'learning_rate': 0.6283987392091742, 'aft_loss_distribution': 'normal', 'aft_loss_distribution_scale': 1.8551121934588224, 'max_depth': 3, 'booster': 'dart', 'scale_pos_weight': 1.7909943021885526, 'alpha': 3.4787072328553528, 'lambda': 8.022829828494515, 'eta': 0.15914274536959516, 'sampling_method': 'uniform', 'subsample': 0.4070064684342077, 'gamma': 3.9856996203486426}. Best is trial 0 with value: 4.460210844011433.
[I 2023-12-19 04:46:11,296] Trial 1 finished with value: inf and parameters: {'learning_rate': 0.30956613510149217, 'aft_loss_distribution': 'normal', 'aft_loss_distribution_scale': 0.8267514886181039, 'max_depth': 8, 'booster': 'gbtree', 'scale_pos_weight': 0.4206649264762493, 'alpha': 1.8097924112762487, 'lambda': 2.696593449276619, 'eta': 0.7274761009513322, 'sampling_method': 'uniform', 'subsample': 0.7677446983776972, 'gamma': 0.037793161454340536}. Best is trial 0 with value: 4.460210844011433.
[I 2023-12-19 04:46:39,821] Trial 2 finished with value: 5.712407256834223 and parameters: {'learning_rate': 0.9964363307194025, 'aft_loss_distribution': 'normal', 'aft_loss_distribution_scale': 8.028975655559739, 'max_depth': 6, 'booster': 'dart', 'scale_pos_weight': 5.190249081429697, 'alpha': 1.6818152835179707, 'lambda': 3.5350225790771903, 'eta': 0.10994962306778688, 'sampling_method': 'uniform', 'subsample': 0.4821336889857754, 'gamma': 0.17161562286199541}. Best is trial 0 with value: 4.460210844011433.
[I 2023-12-19 04:47:03,880] Trial 3 finished with value: 5.3068191265896445 and parameters: {'learning_rate': 0.7666793348452742, 'aft_loss_distribution': 'extreme', 'aft_loss_distribution_scale': 4.662730069942207, 'max_depth': 4, 'booster': 'dart', 'scale_pos_weight': 2.8317712520847973, 'alpha': 7.137543320888837, 'lambda': 6.127476513199223, 'eta': 0.5201839318367164, 'sampling_method': 'uniform', 'subsample': 0.6924263353868585, 'gamma': 3.801731357314707}. Best is trial 0 with value: 4.460210844011433.
[I 2023-12-19 04:47:04,928] Trial 4 finished with value: 4.6809428959856065 and parameters: {'learning_rate': 0.1760235312424058, 'aft_loss_distribution': 'normal', 'aft_loss_distribution_scale': 2.4973096581825684, 'max_depth': 3, 'booster': 'gbtree', 'scale_pos_weight': 0.29827842482879313, 'alpha': 5.069109873299517, 'lambda': 5.004684088786661, 'eta': 0.25319073546568327, 'sampling_method': 'uniform', 'subsample': 0.4664441378486555, 'gamma': 5.257286264769542}. Best is trial 0 with value: 4.460210844011433.
[I 2023-12-19 04:47:04,954] Trial 5 pruned. Trial was pruned at iteration 0.
[I 2023-12-19 04:47:04,986] Trial 6 pruned. Trial was pruned at iteration 1.
[I 2023-12-19 04:47:05,007] Trial 7 pruned. Trial was pruned at iteration 0.
[I 2023-12-19 04:47:05,080] Trial 8 pruned. Trial was pruned at iteration 3.
[I 2023-12-19 04:47:05,109] Trial 9 pruned. Trial was pruned at iteration 0.
[I 2023-12-19 04:47:05,241] Trial 10 pruned. Trial was pruned at iteration 0.
[I 2023-12-19 04:47:05,562] Trial 11 pruned. Trial was pruned at iteration 6.
[I 2023-12-19 04:47:05,703] Trial 12 pruned. Trial was pruned at iteration 0.
[I 2023-12-19 04:47:05,971] Trial 13 pruned. Trial was pruned at iteration 3.
[I 2023-12-19 04:47:12,236] Trial 14 finished with value: 4.391304450536216 and parameters: {'learning_rate': 0.48944961945103366, 'aft_loss_distribution': 'normal', 'aft_loss_distribution_scale': 1.641557886565796, 'max_depth': 5, 'booster': 'dart', 'scale_pos_weight': 3.679841009457077, 'alpha': 3.739306459583494, 'lambda': 2.0217744932849206, 'eta': 0.20385626816855396, 'sampling_method': 'uniform', 'subsample': 0.9863701888033598, 'gamma': 9.870093599700285}. Best is trial 14 with value: 4.391304450536216.
[I 2023-12-19 04:47:12,364] Trial 15 pruned. Trial was pruned at iteration 5.
[I 2023-12-19 04:47:12,441] Trial 16 pruned. Trial was pruned at iteration 0.
[I 2023-12-19 04:47:12,532] Trial 17 pruned. Trial was pruned at iteration 3.
[I 2023-12-19 04:47:12,619] Trial 18 pruned. Trial was pruned at iteration 0.
[I 2023-12-19 04:47:12,697] Trial 19 pruned. Trial was pruned at iteration 0.
[I 2023-12-19 04:47:12,777] Trial 20 pruned. Trial was pruned at iteration 0.
[I 2023-12-19 04:47:12,871] Trial 21 pruned. Trial was pruned at iteration 3.
[I 2023-12-19 04:47:12,951] Trial 22 pruned. Trial was pruned at iteration 0.
[I 2023-12-19 04:47:13,040] Trial 23 pruned. Trial was pruned at iteration 3.
[I 2023-12-19 04:47:13,159] Trial 24 pruned. Trial was pruned at iteration 6.
[I 2023-12-19 04:47:25,314] Trial 25 finished with value: 4.304420777108352 and parameters: {'learning_rate': 0.7583888692475926, 'aft_loss_distribution': 'normal', 'aft_loss_distribution_scale': 1.444258228941617, 'max_depth': 6, 'booster': 'dart', 'scale_pos_weight': 3.023157292807923, 'alpha': 4.22576117485264, 'lambda': 0.08364847762389593, 'eta': 0.3389839286419987, 'sampling_method': 'uniform', 'subsample': 0.6281986405016887, 'gamma': 4.192114183782414}. Best is trial 25 with value: 4.304420777108352.
[I 2023-12-19 04:47:27,533] Trial 26 finished with value: inf and parameters: {'learning_rate': 0.7195495325012984, 'aft_loss_distribution': 'normal', 'aft_loss_distribution_scale': 1.3372043145715857, 'max_depth': 6, 'booster': 'dart', 'scale_pos_weight': 2.9895780163971537, 'alpha': 3.7276562734280674, 'lambda': 0.08633996940169375, 'eta': 0.35165905261653296, 'sampling_method': 'uniform', 'subsample': 0.8718001206201331, 'gamma': 4.123138600814509}. Best is trial 25 with value: 4.304420777108352.
[I 2023-12-19 04:47:27,607] Trial 27 pruned. Trial was pruned at iteration 0.
[I 2023-12-19 04:47:27,682] Trial 28 pruned. Trial was pruned at iteration 0.
[I 2023-12-19 04:47:27,764] Trial 29 pruned. Trial was pruned at iteration 0.
[I 2023-12-19 04:47:27,852] Trial 30 pruned. Trial was pruned at iteration 0.
[I 2023-12-19 04:47:27,928] Trial 31 pruned. Trial was pruned at iteration 0.
[I 2023-12-19 04:47:28,018] Trial 32 pruned. Trial was pruned at iteration 3.
[I 2023-12-19 04:47:28,092] Trial 33 pruned. Trial was pruned at iteration 0.
[I 2023-12-19 04:47:28,176] Trial 34 pruned. Trial was pruned at iteration 1.
[I 2023-12-19 04:47:28,308] Trial 35 pruned. Trial was pruned at iteration 6.
[I 2023-12-19 04:47:28,385] Trial 36 pruned. Trial was pruned at iteration 0.
[I 2023-12-19 04:47:28,460] Trial 37 pruned. Trial was pruned at iteration 0.
[I 2023-12-19 04:47:28,534] Trial 38 pruned. Trial was pruned at iteration 0.
[I 2023-12-19 04:47:28,623] Trial 39 pruned. Trial was pruned at iteration 1.
[I 2023-12-19 04:47:28,703] Trial 40 pruned. Trial was pruned at iteration 0.
[I 2023-12-19 04:47:28,778] Trial 41 pruned. Trial was pruned at iteration 0.
[I 2023-12-19 04:47:28,869] Trial 42 pruned. Trial was pruned at iteration 0.
[I 2023-12-19 04:47:28,950] Trial 43 pruned. Trial was pruned at iteration 0.
[I 2023-12-19 04:47:29,031] Trial 44 pruned. Trial was pruned at iteration 0.
[I 2023-12-19 04:47:29,108] Trial 45 pruned. Trial was pruned at iteration 0.
[I 2023-12-19 04:47:29,221] Trial 46 pruned. Trial was pruned at iteration 4.
[I 2023-12-19 04:47:29,311] Trial 47 pruned. Trial was pruned at iteration 0.
[I 2023-12-19 04:47:29,393] Trial 48 pruned. Trial was pruned at iteration 0.
[I 2023-12-19 04:47:29,471] Trial 49 pruned. Trial was pruned at iteration 0.
[I 2023-12-19 04:47:29,572] Trial 50 pruned. Trial was pruned at iteration 2.
[I 2023-12-19 04:47:29,649] Trial 51 pruned. Trial was pruned at iteration 0.
[I 2023-12-19 04:47:29,731] Trial 52 pruned. Trial was pruned at iteration 0.
[I 2023-12-19 04:47:29,811] Trial 53 pruned. Trial was pruned at iteration 0.
[I 2023-12-19 04:47:29,910] Trial 54 pruned. Trial was pruned at iteration 0.
[I 2023-12-19 04:47:29,988] Trial 55 pruned. Trial was pruned at iteration 0.
[I 2023-12-19 04:47:30,099] Trial 56 pruned. Trial was pruned at iteration 4.
[I 2023-12-19 04:47:30,215] Trial 57 pruned. Trial was pruned at iteration 4.
[I 2023-12-19 04:47:30,304] Trial 58 pruned. Trial was pruned at iteration 1.
[I 2023-12-19 04:47:30,383] Trial 59 pruned. Trial was pruned at iteration 0.
[I 2023-12-19 04:47:30,476] Trial 60 pruned. Trial was pruned at iteration 0.
[I 2023-12-19 04:47:30,555] Trial 61 pruned. Trial was pruned at iteration 0.
[I 2023-12-19 04:47:30,634] Trial 62 pruned. Trial was pruned at iteration 0.
[I 2023-12-19 04:47:30,719] Trial 63 pruned. Trial was pruned at iteration 0.
[I 2023-12-19 04:47:30,824] Trial 64 pruned. Trial was pruned at iteration 3.
[I 2023-12-19 04:47:30,919] Trial 65 pruned. Trial was pruned at iteration 0.
[I 2023-12-19 04:47:31,003] Trial 66 pruned. Trial was pruned at iteration 0.
[I 2023-12-19 04:47:31,096] Trial 67 pruned. Trial was pruned at iteration 0.
[I 2023-12-19 04:47:31,179] Trial 68 pruned. Trial was pruned at iteration 0.
[I 2023-12-19 04:47:31,264] Trial 69 pruned. Trial was pruned at iteration 0.
[I 2023-12-19 04:47:31,348] Trial 70 pruned. Trial was pruned at iteration 1.
[I 2023-12-19 04:47:33,401] Trial 71 finished with value: inf and parameters: {'learning_rate': 0.7212799203267568, 'aft_loss_distribution': 'normal', 'aft_loss_distribution_scale': 1.4550192419165398, 'max_depth': 6, 'booster': 'dart', 'scale_pos_weight': 2.975207902469871, 'alpha': 3.671634870460242, 'lambda': 0.17678407660673282, 'eta': 0.34852216247856105, 'sampling_method': 'uniform', 'subsample': 0.8717335274767459, 'gamma': 3.834328318521672}. Best is trial 25 with value: 4.304420777108352.
[I 2023-12-19 04:47:39,850] Trial 72 finished with value: inf and parameters: {'learning_rate': 0.6664076232595841, 'aft_loss_distribution': 'normal', 'aft_loss_distribution_scale': 1.0097782333933933, 'max_depth': 7, 'booster': 'dart', 'scale_pos_weight': 0.4302461356155929, 'alpha': 4.071269448187696, 'lambda': 1.3465097861532414, 'eta': 0.27895324783573694, 'sampling_method': 'uniform', 'subsample': 0.8730088568717652, 'gamma': 3.1551070953098774}. Best is trial 25 with value: 4.304420777108352.
[I 2023-12-19 04:47:39,941] Trial 73 pruned. Trial was pruned at iteration 2.
[I 2023-12-19 04:47:40,083] Trial 74 pruned. Trial was pruned at iteration 6.
[I 2023-12-19 04:47:40,165] Trial 75 pruned. Trial was pruned at iteration 1.
[I 2023-12-19 04:47:40,247] Trial 76 pruned. Trial was pruned at iteration 0.
[I 2023-12-19 04:47:40,342] Trial 77 pruned. Trial was pruned at iteration 1.
[I 2023-12-19 04:47:40,419] Trial 78 pruned. Trial was pruned at iteration 0.
[I 2023-12-19 04:47:40,493] Trial 79 pruned. Trial was pruned at iteration 0.
[I 2023-12-19 04:47:40,575] Trial 80 pruned. Trial was pruned at iteration 0.
[I 2023-12-19 04:47:43,215] Trial 81 finished with value: inf and parameters: {'learning_rate': 0.7237708195533563, 'aft_loss_distribution': 'normal', 'aft_loss_distribution_scale': 1.388607982665162, 'max_depth': 6, 'booster': 'dart', 'scale_pos_weight': 2.9118175851923356, 'alpha': 3.6218101177510484, 'lambda': 0.11483975782616791, 'eta': 0.35280796023402566, 'sampling_method': 'uniform', 'subsample': 0.8555070191654488, 'gamma': 3.8114846958381223}. Best is trial 25 with value: 4.304420777108352.
[I 2023-12-19 04:47:43,316] Trial 82 pruned. Trial was pruned at iteration 3.
[I 2023-12-19 04:47:43,409] Trial 83 pruned. Trial was pruned at iteration 0.
[I 2023-12-19 04:47:43,489] Trial 84 pruned. Trial was pruned at iteration 0.
[I 2023-12-19 04:47:46,159] Trial 85 finished with value: inf and parameters: {'learning_rate': 0.7592379590369353, 'aft_loss_distribution': 'normal', 'aft_loss_distribution_scale': 1.3378999318721807, 'max_depth': 7, 'booster': 'dart', 'scale_pos_weight': 1.869611361176981, 'alpha': 2.6894882585378346, 'lambda': 0.5519335985462468, 'eta': 0.30381024113836114, 'sampling_method': 'uniform', 'subsample': 0.5614369325721904, 'gamma': 3.1457283411384043}. Best is trial 25 with value: 4.304420777108352.
[I 2023-12-19 04:47:46,237] Trial 86 pruned. Trial was pruned at iteration 0.
[I 2023-12-19 04:47:46,314] Trial 87 pruned. Trial was pruned at iteration 0.
[I 2023-12-19 04:47:46,399] Trial 88 pruned. Trial was pruned at iteration 1.
[I 2023-12-19 04:47:46,498] Trial 89 pruned. Trial was pruned at iteration 1.
[I 2023-12-19 04:47:46,581] Trial 90 pruned. Trial was pruned at iteration 0.
[I 2023-12-19 04:47:48,739] Trial 91 finished with value: inf and parameters: {'learning_rate': 0.6806308672756932, 'aft_loss_distribution': 'normal', 'aft_loss_distribution_scale': 1.0934679536707546, 'max_depth': 8, 'booster': 'dart', 'scale_pos_weight': 0.3854705701627173, 'alpha': 4.132821257821805, 'lambda': 1.452991604273008, 'eta': 0.30334654000462125, 'sampling_method': 'uniform', 'subsample': 0.8490790958982634, 'gamma': 3.8693939595454028}. Best is trial 25 with value: 4.304420777108352.
[I 2023-12-19 04:48:00,657] Trial 92 finished with value: 4.205564984972934 and parameters: {'learning_rate': 0.7263563495134195, 'aft_loss_distribution': 'normal', 'aft_loss_distribution_scale': 0.9586128384123904, 'max_depth': 7, 'booster': 'dart', 'scale_pos_weight': 0.39902032112449753, 'alpha': 3.955363453674905, 'lambda': 2.4971640699591537, 'eta': 0.3677377256048995, 'sampling_method': 'uniform', 'subsample': 0.8055078931589742, 'gamma': 4.4300006216408265}. Best is trial 92 with value: 4.205564984972934.
[I 2023-12-19 04:48:00,743] Trial 93 pruned. Trial was pruned at iteration 1.
[I 2023-12-19 04:48:00,826] Trial 94 pruned. Trial was pruned at iteration 0.
[I 2023-12-19 04:48:05,382] Trial 95 finished with value: inf and parameters: {'learning_rate': 0.7308929307082811, 'aft_loss_distribution': 'normal', 'aft_loss_distribution_scale': 1.2266304804125534, 'max_depth': 7, 'booster': 'dart', 'scale_pos_weight': 1.1850227764690757, 'alpha': 4.704653844391236, 'lambda': 4.754227843492449, 'eta': 0.27578246832601877, 'sampling_method': 'uniform', 'subsample': 0.47575354350745946, 'gamma': 4.228504066598126}. Best is trial 92 with value: 4.205564984972934.
[I 2023-12-19 04:48:05,676] Trial 96 pruned. Trial was pruned at iteration 0.
[I 2023-12-19 04:48:06,194] Trial 97 pruned. Trial was pruned at iteration 1.
[I 2023-12-19 04:48:06,348] Trial 98 pruned. Trial was pruned at iteration 0.
[I 2023-12-19 04:48:06,470] Trial 99 pruned. Trial was pruned at iteration 0.
[I 2023-12-19 04:48:06,774] Trial 100 pruned. Trial was pruned at iteration 0.
[I 2023-12-19 04:48:07,259] Trial 101 pruned. Trial was pruned at iteration 0.
[I 2023-12-19 04:48:07,808] Trial 102 pruned. Trial was pruned at iteration 0.
[I 2023-12-19 04:48:08,177] Trial 103 pruned. Trial was pruned at iteration 0.
[I 2023-12-19 04:48:15,227] Trial 104 finished with value: 4.2020851603229525 and parameters: {'learning_rate': 0.7629538714013749, 'aft_loss_distribution': 'normal', 'aft_loss_distribution_scale': 1.0111505784419628, 'max_depth': 6, 'booster': 'dart', 'scale_pos_weight': 0.23965751089021672, 'alpha': 3.573144006559367, 'lambda': 1.6713692886948424, 'eta': 0.1300606211666578, 'sampling_method': 'uniform', 'subsample': 0.9665902743551815, 'gamma': 4.520531383285241}. Best is trial 104 with value: 4.2020851603229525.
[I 2023-12-19 04:48:15,312] Trial 105 pruned. Trial was pruned at iteration 0.
[I 2023-12-19 04:48:15,395] Trial 106 pruned. Trial was pruned at iteration 0.
