[I 2023-12-21 02:36:30,837] Trial 141 finished with value: 4.473919579110459 and parameters: {'learning_rate': 0.2872008931989791, 'aft_l                                                                     oss_distribution': 'logistic', 'aft_loss_distribution_scale': 1.1270133111963891, 'max_depth': 10, 'booster': 'dart', 'scale_pos_weight':                                                                      4.336598602970368, 'alpha': 8.403320900424614, 'lambda': 7.412954621485691, 'eta': 0.8773192398163325, 'sampling_method': 'uniform', 'su                                                                     bsample': 0.9809978759970441, 'gamma': 5.8272693611785735}. Best is trial 39 with value: 4.394413518676669.
[I 2023-12-21 02:36:30,890] Trial 142 pruned. Trial was pruned at iteration 0.
[I 2023-12-21 02:36:38,405] Trial 143 finished with value: 4.4250359472138285 and parameters: {'learning_rate': 0.30411947852004156, 'aft                                                                     _loss_distribution': 'logistic', 'aft_loss_distribution_scale': 1.043658953878242, 'max_depth': 10, 'booster': 'dart', 'scale_pos_weight'                                                                     : 5.745241049041509, 'alpha': 7.839039343764183, 'lambda': 7.32860496143557, 'eta': 0.9097992530108727, 'sampling_method': 'uniform', 'su                                                                     bsample': 0.9581791844091616, 'gamma': 5.714415156284531}. Best is trial 39 with value: 4.394413518676669.
[I 2023-12-21 02:36:41,072] Trial 144 finished with value: 4.377732833933745 and parameters: {'learning_rate': 0.3085280566436183, 'aft_l                                                                     oss_distribution': 'logistic', 'aft_loss_distribution_scale': 0.9478253079976395, 'max_depth': 10, 'booster': 'dart', 'scale_pos_weight':                                                                      5.724488849768667, 'alpha': 7.366734246085038, 'lambda': 7.309291586512894, 'eta': 0.9150256308074076, 'sampling_method': 'uniform', 'su                                                                     bsample': 0.9536930024806415, 'gamma': 5.636144181868594}. Best is trial 144 with value: 4.377732833933745.
[I 2023-12-21 02:36:41,119] Trial 145 pruned. Trial was pruned at iteration 0.
[I 2023-12-21 02:36:46,269] Trial 146 finished with value: 4.3673119867183745 and parameters: {'learning_rate': 0.23115077181762111, 'aft                                                                     _loss_distribution': 'logistic', 'aft_loss_distribution_scale': 0.9193913564287777, 'max_depth': 10, 'booster': 'dart', 'scale_pos_weight                                                                     ': 6.136496872850419, 'alpha': 7.795901381436791, 'lambda': 7.0815801391106605, 'eta': 0.8406707215920024, 'sampling_method': 'uniform',                                                                      'subsample': 0.9524821282504392, 'gamma': 6.107089608738915}. Best is trial 146 with value: 4.3673119867183745.
[I 2023-12-21 02:36:46,310] Trial 147 pruned. Trial was pruned at iteration 0.
[I 2023-12-21 02:36:46,355] Trial 148 pruned. Trial was pruned at iteration 0.
[I 2023-12-21 02:36:46,393] Trial 149 pruned. Trial was pruned at iteration 0.
[I 2023-12-21 02:36:46,431] Trial 150 pruned. Trial was pruned at iteration 0.
[I 2023-12-21 02:36:49,167] Trial 151 finished with value: 4.3679551780679216 and parameters: {'learning_rate': 0.27938494906712286, 'aft                                                                     _loss_distribution': 'logistic', 'aft_loss_distribution_scale': 0.9118033657817224, 'max_depth': 10, 'booster': 'dart', 'scale_pos_weight                                                                     ': 5.8368697451814535, 'alpha': 7.783508093254269, 'lambda': 8.178748814573895, 'eta': 0.8959536000324165, 'sampling_method': 'uniform',                                                                      'subsample': 0.9578097209951795, 'gamma': 6.098163996768782}. Best is trial 146 with value: 4.3673119867183745.
[I 2023-12-21 02:36:49,215] Trial 152 pruned. Trial was pruned at iteration 0.
[I 2023-12-21 02:36:49,255] Trial 153 pruned. Trial was pruned at iteration 0.
[I 2023-12-21 02:36:49,294] Trial 154 pruned. Trial was pruned at iteration 1.
[I 2023-12-21 02:36:49,341] Trial 155 pruned. Trial was pruned at iteration 0.
[I 2023-12-21 02:36:51,925] Trial 156 finished with value: 4.396243920811099 and parameters: {'learning_rate': 0.2644676838145337, 'aft_l                                                                     oss_distribution': 'logistic', 'aft_loss_distribution_scale': 0.9948264172626283, 'max_depth': 10, 'booster': 'dart', 'scale_pos_weight':                                                                      6.1614068621716935, 'alpha': 7.83785531529467, 'lambda': 7.292753316635739, 'eta': 0.7916968700487415, 'sampling_method': 'uniform', 'su                                                                     bsample': 0.9322767986432162, 'gamma': 5.866880484029132}. Best is trial 146 with value: 4.3673119867183745.
[I 2023-12-21 02:36:51,975] Trial 157 pruned. Trial was pruned at iteration 0.
[I 2023-12-21 02:36:52,019] Trial 158 pruned. Trial was pruned at iteration 0.
[I 2023-12-21 02:36:52,060] Trial 159 pruned. Trial was pruned at iteration 0.
[I 2023-12-21 02:36:52,098] Trial 160 pruned. Trial was pruned at iteration 0.
[I 2023-12-21 02:37:29,380] Trial 161 finished with value: 4.38974875439775 and parameters: {'learning_rate': 0.2870203837852637, 'aft_lo                                                                     ss_distribution': 'logistic', 'aft_loss_distribution_scale': 0.9822641421356145, 'max_depth': 10, 'booster': 'dart', 'scale_pos_weight':                                                                      6.091952784260396, 'alpha': 8.111559780550223, 'lambda': 7.383461126697589, 'eta': 0.8268475000070857, 'sampling_method': 'uniform', 'sub                                                                     sample': 0.9989489961862993, 'gamma': 5.8048735350879195}. Best is trial 146 with value: 4.3673119867183745.
[I 2023-12-21 02:37:29,427] Trial 162 pruned. Trial was pruned at iteration 0.
[I 2023-12-21 02:37:29,475] Trial 163 pruned. Trial was pruned at iteration 0.
[I 2023-12-21 02:37:29,515] Trial 164 pruned. Trial was pruned at iteration 1.
[I 2023-12-21 02:37:37,054] Trial 165 finished with value: 4.3788087845680135 and parameters: {'learning_rate': 0.27290800235891033, 'aft                                                                     _loss_distribution': 'logistic', 'aft_loss_distribution_scale': 0.9237746354015398, 'max_depth': 10, 'booster': 'dart', 'scale_pos_weight                                                                     ': 6.447554533235772, 'alpha': 8.192041702020163, 'lambda': 7.807700149809901, 'eta': 0.8968943404304011, 'sampling_method': 'uniform', '                                                                     subsample': 0.9999874775010038, 'gamma': 6.101874686743098}. Best is trial 146 with value: 4.3673119867183745.
[I 2023-12-21 02:37:37,104] Trial 166 pruned. Trial was pruned at iteration 0.
[I 2023-12-21 02:37:37,149] Trial 167 pruned. Trial was pruned at iteration 0.
[I 2023-12-21 02:37:39,317] Trial 168 finished with value: 4.386977391136441 and parameters: {'learning_rate': 0.2097426374446955, 'aft_l                                                                     oss_distribution': 'logistic', 'aft_loss_distribution_scale': 0.9776010072410132, 'max_depth': 9, 'booster': 'dart', 'scale_pos_weight':                                                                      7.175419501334079, 'alpha': 7.944651025580693, 'lambda': 6.8031298686157236, 'eta': 0.9487669082266432, 'sampling_method': 'uniform', 'su                                                                     bsample': 0.9996257133404411, 'gamma': 6.033627833525782}. Best is trial 146 with value: 4.3673119867183745.
[I 2023-12-21 02:37:50,550] Trial 169 finished with value: 4.380809600411835 and parameters: {'learning_rate': 0.20783211740380547, 'aft_                                                                     loss_distribution': 'logistic', 'aft_loss_distribution_scale': 0.9350214007942707, 'max_depth': 10, 'booster': 'dart', 'scale_pos_weight'                                                                     : 7.247963357552325, 'alpha': 8.583951303003662, 'lambda': 6.867738260953629, 'eta': 0.9460361944610806, 'sampling_method': 'uniform', 's                                                                     ubsample': 0.9211685233759815, 'gamma': 6.629296133861566}. Best is trial 146 with value: 4.3673119867183745.
[I 2023-12-21 02:37:50,591] Trial 170 pruned. Trial was pruned at iteration 0.
[I 2023-12-21 02:38:18,858] Trial 171 finished with value: 4.384326038794403 and parameters: {'learning_rate': 0.2014277081802892, 'aft_l                                                                     oss_distribution': 'logistic', 'aft_loss_distribution_scale': 0.9349024235421849, 'max_depth': 10, 'booster': 'dart', 'scale_pos_weight':                                                                      7.604113849196584, 'alpha': 7.871036622175273, 'lambda': 7.101556318261439, 'eta': 0.9052868074819821, 'sampling_method': 'uniform', 'su                                                                     bsample': 0.9964157162553833, 'gamma': 6.60854907303745}. Best is trial 146 with value: 4.3673119867183745.
[I 2023-12-21 02:38:18,900] Trial 172 pruned. Trial was pruned at iteration 0.
[I 2023-12-21 02:38:21,104] Trial 173 finished with value: 4.377994970361937 and parameters: {'learning_rate': 0.21443291372604303, 'aft_                                                                     loss_distribution': 'logistic', 'aft_loss_distribution_scale': 0.9518222753534098, 'max_depth': 10, 'booster': 'dart', 'scale_pos_weight'                                                                     : 7.66525428911226, 'alpha': 8.057841498788832, 'lambda': 6.688515124714472, 'eta': 0.9768342983506398, 'sampling_method': 'uniform', 'su                                                                     bsample': 0.9504060132636094, 'gamma': 6.393764573017203}. Best is trial 146 with value: 4.3673119867183745.
[I 2023-12-21 02:38:21,145] Trial 174 pruned. Trial was pruned at iteration 0.
[I 2023-12-21 02:38:21,194] Trial 175 pruned. Trial was pruned at iteration 0.
[I 2023-12-21 02:38:21,232] Trial 176 pruned. Trial was pruned at iteration 0.
[I 2023-12-21 02:38:28,140] Trial 177 finished with value: 4.371514014818515 and parameters: {'learning_rate': 0.2121735052582764, 'aft_l                                                                     oss_distribution': 'logistic', 'aft_loss_distribution_scale': 0.9414350763936746, 'max_depth': 10, 'booster': 'dart', 'scale_pos_weight':                                                                      7.153342415230741, 'alpha': 8.572884746905883, 'lambda': 6.491627282481939, 'eta': 0.990298126348613, 'sampling_method': 'uniform', 'sub                                                                     sample': 0.9303479199312186, 'gamma': 6.434240810836994}. Best is trial 146 with value: 4.3673119867183745.
[I 2023-12-21 02:38:28,190] Trial 178 pruned. Trial was pruned at iteration 0.
[I 2023-12-21 02:38:30,999] Trial 179 finished with value: 4.33636637744083 and parameters: {'learning_rate': 0.18190281608702766, 'aft_l                                                                     oss_distribution': 'logistic', 'aft_loss_distribution_scale': 0.8093411676319547, 'max_depth': 10, 'booster': 'dart', 'scale_pos_weight':                                                                      7.039651666459055, 'alpha': 8.936150477136728, 'lambda': 7.033754698584554, 'eta': 0.9805277620997846, 'sampling_method': 'uniform', 'su                                                                     bsample': 0.8830134817608729, 'gamma': 6.343477937587793}. Best is trial 179 with value: 4.33636637744083.
[I 2023-12-21 02:38:47,677] Trial 180 finished with value: 4.341075667954939 and parameters: {'learning_rate': 0.18480864190103172, 'aft_                                                                     loss_distribution': 'logistic', 'aft_loss_distribution_scale': 0.8310688296957154, 'max_depth': 10, 'booster': 'dart', 'scale_pos_weight'                                                                     : 6.778038744346742, 'alpha': 8.896043775286731, 'lambda': 7.04828104815796, 'eta': 0.9796331284200093, 'sampling_method': 'uniform', 'su                                                                     bsample': 0.8818671490349731, 'gamma': 6.32836831684617}. Best is trial 179 with value: 4.33636637744083.
[I 2023-12-21 02:39:04,300] Trial 181 finished with value: 4.355512780782913 and parameters: {'learning_rate': 0.1918017302579656, 'aft_l                                                                     oss_distribution': 'logistic', 'aft_loss_distribution_scale': 0.8621511382180529, 'max_depth': 10, 'booster': 'dart', 'scale_pos_weight':                                                                      7.113310680489644, 'alpha': 9.021533768612583, 'lambda': 6.592912143512283, 'eta': 0.9555374917151773, 'sampling_method': 'uniform', 'su                                                                     bsample': 0.8827886399874565, 'gamma': 6.401317770230107}. Best is trial 179 with value: 4.33636637744083.
[I 2023-12-21 02:39:04,349] Trial 182 pruned. Trial was pruned at iteration 0.
[I 2023-12-21 02:39:04,398] Trial 183 pruned. Trial was pruned at iteration 0.
[I 2023-12-21 02:39:04,451] Trial 184 pruned. Trial was pruned at iteration 0.
[I 2023-12-21 02:39:27,920] Trial 185 finished with value: 4.343919393202861 and parameters: {'learning_rate': 0.15554017287247102, 'aft_                                                                     loss_distribution': 'logistic', 'aft_loss_distribution_scale': 0.8201827276090279, 'max_depth': 10, 'booster': 'dart', 'scale_pos_weight'                                                                     : 6.764808918221623, 'alpha': 8.60118926020892, 'lambda': 6.872813779934047, 'eta': 0.9969687774454922, 'sampling_method': 'uniform', 'su                                                                     bsample': 0.9094304099736863, 'gamma': 6.454772329594711}. Best is trial 179 with value: 4.33636637744083.
[I 2023-12-21 02:39:27,973] Trial 186 pruned. Trial was pruned at iteration 1.
[I 2023-12-21 02:39:28,030] Trial 187 pruned. Trial was pruned at iteration 0.
[I 2023-12-21 02:39:32,302] Trial 188 finished with value: 4.3625311215483205 and parameters: {'learning_rate': 0.17799780077074775, 'aft                                                                     _loss_distribution': 'logistic', 'aft_loss_distribution_scale': 0.8683129454806942, 'max_depth': 10, 'booster': 'dart', 'scale_pos_weight                                                                     ': 7.094831181616167, 'alpha': 8.515167324960753, 'lambda': 6.943248831534185, 'eta': 0.9577423730168085, 'sampling_method': 'uniform', '                                                                     subsample': 0.8712914500325271, 'gamma': 6.138615269315783}. Best is trial 179 with value: 4.33636637744083.
[I 2023-12-21 02:39:55,633] Trial 189 finished with value: 4.351080246961383 and parameters: {'learning_rate': 0.18562568856682027, 'aft_                                                                     loss_distribution': 'logistic', 'aft_loss_distribution_scale': 0.8451553822694416, 'max_depth': 10, 'booster': 'dart', 'scale_pos_weight'                                                                     : 7.123975149679854, 'alpha': 8.835634489319563, 'lambda': 6.986169533346685, 'eta': 0.9632816114613197, 'sampling_method': 'uniform', 's                                                                     ubsample': 0.8830946826031784, 'gamma': 6.484337937269932}. Best is trial 179 with value: 4.33636637744083.
[I 2023-12-21 02:39:55,684] Trial 190 pruned. Trial was pruned at iteration 0.
[I 2023-12-21 02:40:18,789] Trial 191 finished with value: 4.36296946173617 and parameters: {'learning_rate': 0.17471452176824107, 'aft_l                                                                     oss_distribution': 'logistic', 'aft_loss_distribution_scale': 0.8911251453696891, 'max_depth': 10, 'booster': 'dart', 'scale_pos_weight':                                                                      7.312551010826099, 'alpha': 8.535416329532607, 'lambda': 7.153145267206964, 'eta': 0.9594825770882953, 'sampling_method': 'uniform', 'su                                                                     bsample': 0.8968748377177784, 'gamma': 6.4848205296946535}. Best is trial 179 with value: 4.33636637744083.
[I 2023-12-21 02:40:18,840] Trial 192 pruned. Trial was pruned at iteration 0.
[I 2023-12-21 02:40:18,886] Trial 193 pruned. Trial was pruned at iteration 0.
[I 2023-12-21 02:40:33,021] Trial 194 finished with value: 4.367203128567343 and parameters: {'learning_rate': 0.18211445747471053, 'aft_                                                                     loss_distribution': 'logistic', 'aft_loss_distribution_scale': 0.8694345169469883, 'max_depth': 10, 'booster': 'dart', 'scale_pos_weight'                                                                     : 7.0262828170938025, 'alpha': 9.134185114449497, 'lambda': 6.499255867516288, 'eta': 0.9440194066912266, 'sampling_method': 'uniform', '                                                                     subsample': 0.84747478373641, 'gamma': 6.803970745589694}. Best is trial 179 with value: 4.33636637744083.
[I 2023-12-21 02:40:33,068] Trial 195 pruned. Trial was pruned at iteration 0.
[I 2023-12-21 02:40:33,114] Trial 196 pruned. Trial was pruned at iteration 0.
[I 2023-12-21 02:40:33,153] Trial 197 pruned. Trial was pruned at iteration 0.
[I 2023-12-21 02:40:47,403] Trial 198 finished with value: 4.362497433984967 and parameters: {'learning_rate': 0.20212973374896576, 'aft_                                                                     loss_distribution': 'logistic', 'aft_loss_distribution_scale': 0.9027125632729485, 'max_depth': 10, 'booster': 'dart', 'scale_pos_weight'                                                                     : 7.447680724180553, 'alpha': 8.881479360729289, 'lambda': 6.3525766496766245, 'eta': 0.9537228579086746, 'sampling_method': 'uniform', '                                                                     subsample': 0.8325600955892613, 'gamma': 6.919015118489327}. Best is trial 179 with value: 4.33636637744083.
[I 2023-12-21 02:40:47,463] Trial 199 pruned. Trial was pruned at iteration 0.
[I 2023-12-21 02:41:01,492] Trial 200 finished with value: 4.346925776790521 and parameters: {'learning_rate': 0.20791402472750198, 'aft_                                                                     loss_distribution': 'logistic', 'aft_loss_distribution_scale': 0.8427344686522015, 'max_depth': 10, 'booster': 'dart', 'scale_pos_weight'                                                                     : 7.508567720440275, 'alpha': 8.638485978207498, 'lambda': 6.686595690616686, 'eta': 0.9837664173407281, 'sampling_method': 'uniform', 's                                                                     ubsample': 0.832744755764952, 'gamma': 6.5231251273841755}. Best is trial 179 with value: 4.33636637744083.
[I 2023-12-21 02:41:15,123] Trial 201 finished with value: 4.35342497392795 and parameters: {'learning_rate': 0.21489413482488004, 'aft_l                                                                     oss_distribution': 'logistic', 'aft_loss_distribution_scale': 0.8537627753339635, 'max_depth': 10, 'booster': 'dart', 'scale_pos_weight':                                                                      7.498339467138726, 'alpha': 8.802347006406402, 'lambda': 6.687515822862923, 'eta': 0.982969007694269, 'sampling_method': 'uniform', 'sub                                                                     sample': 0.8407425825910585, 'gamma': 6.590855659935755}. Best is trial 179 with value: 4.33636637744083.
[I 2023-12-21 02:41:15,172] Trial 202 pruned. Trial was pruned at iteration 0.
[I 2023-12-21 02:41:38,422] Trial 203 finished with value: 4.365991907476117 and parameters: {'learning_rate': 0.18659606752753352, 'aft_                                                                     loss_distribution': 'logistic', 'aft_loss_distribution_scale': 0.8996906471248661, 'max_depth': 10, 'booster': 'dart', 'scale_pos_weight'                                                                     : 7.859378614284619, 'alpha': 9.27597979379202, 'lambda': 6.976892195731768, 'eta': 0.9977992683483079, 'sampling_method': 'uniform', 'su                                                                     bsample': 0.8504936027608561, 'gamma': 6.6098202321312876}. Best is trial 179 with value: 4.33636637744083.
[I 2023-12-21 02:41:38,471] Trial 204 pruned. Trial was pruned at iteration 0.
[I 2023-12-21 02:42:12,540] Trial 205 finished with value: 4.35869107627496 and parameters: {'learning_rate': 0.19850410248131672, 'aft_l                                                                     oss_distribution': 'logistic', 'aft_loss_distribution_scale': 0.8575963656723461, 'max_depth': 10, 'booster': 'dart', 'scale_pos_weight':                                                                      8.28257909507475, 'alpha': 8.892615795387142, 'lambda': 6.9153432010727, 'eta': 0.9625145279454137, 'sampling_method': 'uniform', 'subsa                                                                     mple': 0.830015221467862, 'gamma': 6.534611500516275}. Best is trial 179 with value: 4.33636637744083.
