[I 2023-12-21 04:12:38,825] Trial 287 pruned. Trial was pruned at iteration 0.
[I 2023-12-21 04:12:38,870] Trial 288 pruned. Trial was pruned at iteration 0.
[I 2023-12-21 04:12:38,914] Trial 289 pruned. Trial was pruned at iteration 0.
[I 2023-12-21 04:12:38,959] Trial 290 pruned. Trial was pruned at iteration 0.
[I 2023-12-21 04:12:39,967] Trial 291 finished with value: inf and parameters: {'learning_rate': 0.9799610338776156, 'aft_loss_distributi                                                                     on': 'normal', 'aft_loss_distribution_scale': 2.1110952786913644, 'max_depth': 3, 'booster': 'dart', 'scale_pos_weight': 0.54376715146967                                                                     14, 'alpha': 7.210636595025469, 'lambda': 0.7899707071304283, 'eta': 0.364857384739242, 'sampling_method': 'gradient_based', 'subsample':                                                                      0.8161419768518006, 'gamma': 7.831127354363998}. Best is trial 4 with value: 2.031779433856417.
[I 2023-12-21 04:12:40,014] Trial 292 pruned. Trial was pruned at iteration 0.
[I 2023-12-21 04:12:40,059] Trial 293 pruned. Trial was pruned at iteration 0.
[I 2023-12-21 04:12:41,174] Trial 294 finished with value: inf and parameters: {'learning_rate': 0.9554271359549017, 'aft_loss_distributi                                                                     on': 'normal', 'aft_loss_distribution_scale': 2.299681913595255, 'max_depth': 9, 'booster': 'dart', 'scale_pos_weight': 0.655426968461489                                                                     5, 'alpha': 2.7014387667605577, 'lambda': 0.46547738392571414, 'eta': 0.04084825928459995, 'sampling_method': 'uniform', 'subsample': 0.1                                                                     2080420424640774, 'gamma': 6.088183628564168}. Best is trial 4 with value: 2.031779433856417.
[I 2023-12-21 04:12:41,220] Trial 295 pruned. Trial was pruned at iteration 0.
[I 2023-12-21 04:12:41,265] Trial 296 pruned. Trial was pruned at iteration 0.
[I 2023-12-21 04:12:41,310] Trial 297 pruned. Trial was pruned at iteration 0.
[I 2023-12-21 04:12:41,364] Trial 298 pruned. Trial was pruned at iteration 1.
[I 2023-12-21 04:12:41,414] Trial 299 pruned. Trial was pruned at iteration 0.
[I 2023-12-21 04:12:41,546] Trial 300 finished with value: inf and parameters: {'learning_rate': 0.9997154604181065, 'aft_loss_distributi                                                                     on': 'normal', 'aft_loss_distribution_scale': 1.7590494905244336, 'max_depth': 6, 'booster': 'gbtree', 'scale_pos_weight': 2.693426205984                                                                     853, 'alpha': 2.334672776563369, 'lambda': 1.4952118804473127, 'eta': 0.48044522537199286, 'sampling_method': 'gradient_based', 'subsampl                                                                     e': 0.9128414355321104, 'gamma': 9.199121268281695}. Best is trial 4 with value: 2.031779433856417.
[I 2023-12-21 04:12:41,591] Trial 301 pruned. Trial was pruned at iteration 0.
[I 2023-12-21 04:12:41,636] Trial 302 pruned. Trial was pruned at iteration 0.
[I 2023-12-21 04:12:41,682] Trial 303 pruned. Trial was pruned at iteration 0.
[I 2023-12-21 04:12:41,727] Trial 304 pruned. Trial was pruned at iteration 0.
[I 2023-12-21 04:12:41,772] Trial 305 pruned. Trial was pruned at iteration 0.
[I 2023-12-21 04:12:41,819] Trial 306 pruned. Trial was pruned at iteration 0.
[I 2023-12-21 04:12:41,865] Trial 307 pruned. Trial was pruned at iteration 0.
[I 2023-12-21 04:12:41,911] Trial 308 pruned. Trial was pruned at iteration 0.
[I 2023-12-21 04:12:41,956] Trial 309 pruned. Trial was pruned at iteration 0.
[I 2023-12-21 04:12:42,003] Trial 310 pruned. Trial was pruned at iteration 0.
[I 2023-12-21 04:12:42,049] Trial 311 pruned. Trial was pruned at iteration 0.
[I 2023-12-21 04:12:42,094] Trial 312 pruned. Trial was pruned at iteration 0.
[I 2023-12-21 04:12:42,143] Trial 313 pruned. Trial was pruned at iteration 0.
[I 2023-12-21 04:12:42,188] Trial 314 pruned. Trial was pruned at iteration 0.
[I 2023-12-21 04:12:42,234] Trial 315 pruned. Trial was pruned at iteration 0.
[I 2023-12-21 04:12:42,280] Trial 316 pruned. Trial was pruned at iteration 0.
[I 2023-12-21 04:12:42,327] Trial 317 pruned. Trial was pruned at iteration 0.
[I 2023-12-21 04:12:42,374] Trial 318 pruned. Trial was pruned at iteration 0.
[I 2023-12-21 04:12:42,425] Trial 319 pruned. Trial was pruned at iteration 0.
[I 2023-12-21 04:12:42,471] Trial 320 pruned. Trial was pruned at iteration 0.
[I 2023-12-21 04:12:42,519] Trial 321 pruned. Trial was pruned at iteration 0.
[I 2023-12-21 04:12:42,565] Trial 322 pruned. Trial was pruned at iteration 0.
[I 2023-12-21 04:12:42,611] Trial 323 pruned. Trial was pruned at iteration 0.
[I 2023-12-21 04:12:42,658] Trial 324 pruned. Trial was pruned at iteration 0.
[I 2023-12-21 04:12:42,704] Trial 325 pruned. Trial was pruned at iteration 0.
[I 2023-12-21 04:12:42,752] Trial 326 pruned. Trial was pruned at iteration 0.
[I 2023-12-21 04:12:42,965] Trial 327 finished with value: inf and parameters: {'learning_rate': 0.9858575203855127, 'aft_loss_distributi                                                                     on': 'normal', 'aft_loss_distribution_scale': 2.00951893165362, 'max_depth': 5, 'booster': 'gbtree', 'scale_pos_weight': 3.58410376546659                                                                     2, 'alpha': 2.0897878957288993, 'lambda': 2.4307663086097384, 'eta': 0.808901950876489, 'sampling_method': 'gradient_based', 'subsample':                                                                      0.08292325495000956, 'gamma': 7.89643894514438}. Best is trial 4 with value: 2.031779433856417.
[I 2023-12-21 04:12:43,012] Trial 328 pruned. Trial was pruned at iteration 0.
[I 2023-12-21 04:12:43,059] Trial 329 pruned. Trial was pruned at iteration 0.
[I 2023-12-21 04:12:43,105] Trial 330 pruned. Trial was pruned at iteration 0.
[I 2023-12-21 04:12:43,151] Trial 331 pruned. Trial was pruned at iteration 0.
[I 2023-12-21 04:12:43,198] Trial 332 pruned. Trial was pruned at iteration 0.
[I 2023-12-21 04:12:43,340] Trial 333 finished with value: inf and parameters: {'learning_rate': 0.9992048485765653, 'aft_loss_distributi                                                                     on': 'normal', 'aft_loss_distribution_scale': 1.4426526516272216, 'max_depth': 7, 'booster': 'gbtree', 'scale_pos_weight': 2.959566194137                                                                     3783, 'alpha': 9.444365148069673, 'lambda': 7.506372374515643, 'eta': 0.1544597030079388, 'sampling_method': 'gradient_based', 'subsample                                                                     ': 0.9308558616535612, 'gamma': 9.839302734646761}. Best is trial 4 with value: 2.031779433856417.
[I 2023-12-21 04:12:43,388] Trial 334 pruned. Trial was pruned at iteration 0.
[I 2023-12-21 04:12:43,564] Trial 335 finished with value: inf and parameters: {'learning_rate': 0.9568597341237837, 'aft_loss_distributi                                                                     on': 'normal', 'aft_loss_distribution_scale': 2.1008870279019476, 'max_depth': 5, 'booster': 'gbtree', 'scale_pos_weight': 2.260982816001                                                                     6647, 'alpha': 8.723469049962219, 'lambda': 4.910349744833999, 'eta': 0.28518668479169434, 'sampling_method': 'uniform', 'subsample': 0.5                                                                     28152849360378, 'gamma': 0.8827432726303427}. Best is trial 4 with value: 2.031779433856417.
[I 2023-12-21 04:12:43,612] Trial 336 pruned. Trial was pruned at iteration 0.
[I 2023-12-21 04:12:43,659] Trial 337 pruned. Trial was pruned at iteration 0.
[I 2023-12-21 04:12:43,705] Trial 338 pruned. Trial was pruned at iteration 0.
[I 2023-12-21 04:12:43,752] Trial 339 pruned. Trial was pruned at iteration 0.
[I 2023-12-21 04:12:43,798] Trial 340 pruned. Trial was pruned at iteration 0.
[I 2023-12-21 04:12:43,847] Trial 341 pruned. Trial was pruned at iteration 0.
[I 2023-12-21 04:12:43,901] Trial 342 pruned. Trial was pruned at iteration 1.
[I 2023-12-21 04:12:43,948] Trial 343 pruned. Trial was pruned at iteration 0.
[I 2023-12-21 04:12:43,995] Trial 344 pruned. Trial was pruned at iteration 0.
[I 2023-12-21 04:12:44,122] Trial 345 finished with value: inf and parameters: {'learning_rate': 0.9845459091197305, 'aft_loss_distributi                                                                     on': 'normal', 'aft_loss_distribution_scale': 2.525963187998195, 'max_depth': 5, 'booster': 'gbtree', 'scale_pos_weight': 1.7351343827843                                                                     084, 'alpha': 5.573052352239826, 'lambda': 3.2776903488415763, 'eta': 0.2930157890289725, 'sampling_method': 'uniform', 'subsample': 0.58                                                                     86130864601554, 'gamma': 6.342188129238974}. Best is trial 4 with value: 2.031779433856417.
[I 2023-12-21 04:12:44,168] Trial 346 pruned. Trial was pruned at iteration 0.
[I 2023-12-21 04:12:44,216] Trial 347 pruned. Trial was pruned at iteration 0.
[I 2023-12-21 04:12:44,270] Trial 348 pruned. Trial was pruned at iteration 1.
[I 2023-12-21 04:12:44,321] Trial 349 pruned. Trial was pruned at iteration 0.
[I 2023-12-21 04:12:44,369] Trial 350 pruned. Trial was pruned at iteration 0.
[I 2023-12-21 04:12:44,416] Trial 351 pruned. Trial was pruned at iteration 0.
[I 2023-12-21 04:12:44,464] Trial 352 pruned. Trial was pruned at iteration 0.
[I 2023-12-21 04:12:44,512] Trial 353 pruned. Trial was pruned at iteration 0.
[I 2023-12-21 04:12:44,563] Trial 354 pruned. Trial was pruned at iteration 0.
[I 2023-12-21 04:12:44,611] Trial 355 pruned. Trial was pruned at iteration 0.
[I 2023-12-21 04:12:44,750] Trial 356 finished with value: inf and parameters: {'learning_rate': 0.9538675508107312, 'aft_loss_distributi                                                                     on': 'normal', 'aft_loss_distribution_scale': 1.9795243657025114, 'max_depth': 3, 'booster': 'gbtree', 'scale_pos_weight': 2.507256479600                                                                     3225, 'alpha': 8.67284313975729, 'lambda': 1.599458331362765, 'eta': 0.5697638850989843, 'sampling_method': 'uniform', 'subsample': 0.072                                                                     07167424961282, 'gamma': 2.3723980406974556}. Best is trial 4 with value: 2.031779433856417.
[I 2023-12-21 04:12:44,798] Trial 357 pruned. Trial was pruned at iteration 0.
[I 2023-12-21 04:12:45,750] Trial 358 finished with value: inf and parameters: {'learning_rate': 0.9861117702468148, 'aft_loss_distributi                                                                     on': 'normal', 'aft_loss_distribution_scale': 2.289558331466921, 'max_depth': 5, 'booster': 'dart', 'scale_pos_weight': 0.305123955014009                                                                     6, 'alpha': 5.244750767012825, 'lambda': 2.0915489959803413, 'eta': 0.2947908872807298, 'sampling_method': 'gradient_based', 'subsample':                                                                      0.511404064470763, 'gamma': 6.692944294720253}. Best is trial 4 with value: 2.031779433856417.
[I 2023-12-21 04:12:45,798] Trial 359 pruned. Trial was pruned at iteration 0.
[I 2023-12-21 04:12:45,848] Trial 360 pruned. Trial was pruned at iteration 0.
[I 2023-12-21 04:12:45,895] Trial 361 pruned. Trial was pruned at iteration 0.
[I 2023-12-21 04:12:45,945] Trial 362 pruned. Trial was pruned at iteration 0.
[I 2023-12-21 04:12:46,198] Trial 363 finished with value: inf and parameters: {'learning_rate': 0.9987403237195697, 'aft_loss_distributi                                                                     on': 'normal', 'aft_loss_distribution_scale': 2.1244789856619906, 'max_depth': 6, 'booster': 'gbtree', 'scale_pos_weight': 0.204408957003                                                                     09675, 'alpha': 9.093988768710556, 'lambda': 1.8348110180255803, 'eta': 0.3154392224811488, 'sampling_method': 'gradient_based', 'subsamp                                                                     le': 0.09570956694342939, 'gamma': 9.091430745565663}. Best is trial 4 with value: 2.031779433856417.
[I 2023-12-21 04:12:46,247] Trial 364 pruned. Trial was pruned at iteration 0.
[I 2023-12-21 04:12:46,298] Trial 365 pruned. Trial was pruned at iteration 0.
[I 2023-12-21 04:12:46,348] Trial 366 pruned. Trial was pruned at iteration 0.
[I 2023-12-21 04:12:46,396] Trial 367 pruned. Trial was pruned at iteration 0.
[I 2023-12-21 04:12:46,444] Trial 368 pruned. Trial was pruned at iteration 0.
[I 2023-12-21 04:12:46,494] Trial 369 pruned. Trial was pruned at iteration 0.
[I 2023-12-21 04:12:46,542] Trial 370 pruned. Trial was pruned at iteration 0.
[I 2023-12-21 04:12:46,591] Trial 371 pruned. Trial was pruned at iteration 0.
[I 2023-12-21 04:12:46,642] Trial 372 pruned. Trial was pruned at iteration 0.
[I 2023-12-21 04:12:46,691] Trial 373 pruned. Trial was pruned at iteration 0.
[I 2023-12-21 04:12:46,739] Trial 374 pruned. Trial was pruned at iteration 0.
[I 2023-12-21 04:12:46,788] Trial 375 pruned. Trial was pruned at iteration 0.
[I 2023-12-21 04:12:46,837] Trial 376 pruned. Trial was pruned at iteration 0.
[I 2023-12-21 04:12:46,887] Trial 377 pruned. Trial was pruned at iteration 0.
[I 2023-12-21 04:12:46,937] Trial 378 pruned. Trial was pruned at iteration 0.
[I 2023-12-21 04:12:46,985] Trial 379 pruned. Trial was pruned at iteration 0.
[I 2023-12-21 04:12:47,034] Trial 380 pruned. Trial was pruned at iteration 0.
[I 2023-12-21 04:12:47,083] Trial 381 pruned. Trial was pruned at iteration 0.
[I 2023-12-21 04:12:47,133] Trial 382 pruned. Trial was pruned at iteration 0.
[I 2023-12-21 04:12:47,182] Trial 383 pruned. Trial was pruned at iteration 0.
[I 2023-12-21 04:12:47,231] Trial 384 pruned. Trial was pruned at iteration 0.
[I 2023-12-21 04:12:47,284] Trial 385 pruned. Trial was pruned at iteration 0.
[I 2023-12-21 04:12:47,333] Trial 386 pruned. Trial was pruned at iteration 0.
[I 2023-12-21 04:12:47,383] Trial 387 pruned. Trial was pruned at iteration 0.
[I 2023-12-21 04:12:47,432] Trial 388 pruned. Trial was pruned at iteration 0.
[I 2023-12-21 04:12:47,483] Trial 389 pruned. Trial was pruned at iteration 0.
[I 2023-12-21 04:12:47,532] Trial 390 pruned. Trial was pruned at iteration 0.
[I 2023-12-21 04:12:47,581] Trial 391 pruned. Trial was pruned at iteration 0.
[I 2023-12-21 04:12:47,630] Trial 392 pruned. Trial was pruned at iteration 0.
[I 2023-12-21 04:12:47,680] Trial 393 pruned. Trial was pruned at iteration 0.
[I 2023-12-21 04:12:47,729] Trial 394 pruned. Trial was pruned at iteration 0.
[I 2023-12-21 04:12:47,780] Trial 395 pruned. Trial was pruned at iteration 0.
[I 2023-12-21 04:12:47,829] Trial 396 pruned. Trial was pruned at iteration 0.
[I 2023-12-21 04:12:47,879] Trial 397 pruned. Trial was pruned at iteration 0.
[I 2023-12-21 04:12:47,930] Trial 398 pruned. Trial was pruned at iteration 0.
[I 2023-12-21 04:12:47,980] Trial 399 pruned. Trial was pruned at iteration 0.
[I 2023-12-21 04:12:48,031] Trial 400 pruned. Trial was pruned at iteration 0.
[I 2023-12-21 04:12:48,081] Trial 401 pruned. Trial was pruned at iteration 0.
[I 2023-12-21 04:12:48,133] Trial 402 pruned. Trial was pruned at iteration 0.
[I 2023-12-21 04:12:48,183] Trial 403 pruned. Trial was pruned at iteration 0.
[I 2023-12-21 04:12:48,444] Trial 404 finished with value: inf and parameters: {'learning_rate': 0.9998073468528522, 'aft_loss_distributi                                                                     on': 'normal', 'aft_loss_distribution_scale': 1.867488639275805, 'max_depth': 6, 'booster': 'gbtree', 'scale_pos_weight': 2.6623866320340                                                                     35, 'alpha': 4.794837854035532, 'lambda': 1.4675456374234261, 'eta': 0.32353363741053626, 'sampling_method': 'gradient_based', 'subsample                                                                     ': 0.10234454175454086, 'gamma': 3.9369447639013506}. Best is trial 4 with value: 2.031779433856417.
[I 2023-12-21 04:12:48,494] Trial 405 pruned. Trial was pruned at iteration 0.
[I 2023-12-21 04:12:48,546] Trial 406 pruned. Trial was pruned at iteration 0.
[I 2023-12-21 04:12:48,596] Trial 407 pruned. Trial was pruned at iteration 0.
[I 2023-12-21 04:12:48,646] Trial 408 pruned. Trial was pruned at iteration 0.
[I 2023-12-21 04:12:48,711] Trial 409 pruned. Trial was pruned at iteration 0.
[I 2023-12-21 04:12:48,763] Trial 410 pruned. Trial was pruned at iteration 0.
[I 2023-12-21 04:12:48,814] Trial 411 pruned. Trial was pruned at iteration 0.
[I 2023-12-21 04:12:48,866] Trial 412 pruned. Trial was pruned at iteration 0.
[I 2023-12-21 04:12:48,916] Trial 413 pruned. Trial was pruned at iteration 0.
[I 2023-12-21 04:12:48,966] Trial 414 pruned. Trial was pruned at iteration 0.
[I 2023-12-21 04:12:49,018] Trial 415 pruned. Trial was pruned at iteration 0.
[I 2023-12-21 04:12:49,166] Trial 416 finished with value: inf and parameters: {'learning_rate': 0.9407788386397787, 'aft_loss_distributi                                                                     on': 'normal', 'aft_loss_distribution_scale': 1.6277835607095408, 'max_depth': 3, 'booster': 'gbtree', 'scale_pos_weight': 2.237076903066                                                                     998, 'alpha': 8.944741896998808, 'lambda': 0.5000637280259734, 'eta': 0.12552337355721796, 'sampling_method': 'gradient_based', 'subsampl                                                                     e': 0.08177739959589589, 'gamma': 1.5331467740861457}. Best is trial 4 with value: 2.031779433856417.
[I 2023-12-21 04:12:49,216] Trial 417 pruned. Trial was pruned at iteration 0.
[I 2023-12-21 04:12:49,267] Trial 418 pruned. Trial was pruned at iteration 0.
[I 2023-12-21 04:12:49,319] Trial 419 pruned. Trial was pruned at iteration 0.
[I 2023-12-21 04:12:49,370] Trial 420 pruned. Trial was pruned at iteration 0.
[I 2023-12-21 04:12:49,421] Trial 421 pruned. Trial was pruned at iteration 0.
[I 2023-12-21 04:12:49,473] Trial 422 pruned. Trial was pruned at iteration 0.
[I 2023-12-21 04:12:49,610] Trial 423 finished with value: inf and parameters: {'learning_rate': 0.9597772115870604, 'aft_loss_distributi                                                                     on': 'normal', 'aft_loss_distribution_scale': 2.2270706043037793, 'max_depth': 9, 'booster': 'gbtree', 'scale_pos_weight': 2.300905651933                                                                     7125, 'alpha': 9.254026474917335, 'lambda': 6.63019019971969, 'eta': 0.05318763919998326, 'sampling_method': 'gradient_based', 'subsample                                                                     ': 0.9967714720680508, 'gamma': 8.029671047471625}. Best is trial 4 with value: 2.031779433856417.
[I 2023-12-21 04:12:49,661] Trial 424 pruned. Trial was pruned at iteration 0.
[I 2023-12-21 04:12:49,715] Trial 425 pruned. Trial was pruned at iteration 1.
[I 2023-12-21 04:12:49,766] Trial 426 pruned. Trial was pruned at iteration 0.
[I 2023-12-21 04:12:49,816] Trial 427 pruned. Trial was pruned at iteration 0.
[I 2023-12-21 04:12:49,868] Trial 428 pruned. Trial was pruned at iteration 0.
[I 2023-12-21 04:12:51,005] Trial 429 finished with value: inf and parameters: {'learning_rate': 0.9877509841472262, 'aft_loss_distributi                                                                     on': 'normal', 'aft_loss_distribution_scale': 2.1178871534066435, 'max_depth': 8, 'booster': 'dart', 'scale_pos_weight': 2.44789094545394                                                                     73, 'alpha': 5.39283161185945, 'lambda': 8.094314521841511, 'eta': 0.22600635649626072, 'sampling_method': 'gradient_based', 'subsample':                                                                      0.09340510307642735, 'gamma': 6.4924733885944965}. Best is trial 4 with value: 2.031779433856417.
[I 2023-12-21 04:12:51,057] Trial 430 pruned. Trial was pruned at iteration 0.
[I 2023-12-21 04:12:51,108] Trial 431 pruned. Trial was pruned at iteration 0.
[I 2023-12-21 04:12:51,158] Trial 432 pruned. Trial was pruned at iteration 0.
[I 2023-12-21 04:12:51,209] Trial 433 pruned. Trial was pruned at iteration 0.
[I 2023-12-21 04:12:51,260] Trial 434 pruned. Trial was pruned at iteration 0.
[I 2023-12-21 04:12:51,311] Trial 435 pruned. Trial was pruned at iteration 0.
[I 2023-12-21 04:12:51,371] Trial 436 pruned. Trial was pruned at iteration 0.
[I 2023-12-21 04:12:51,423] Trial 437 pruned. Trial was pruned at iteration 0.
[I 2023-12-21 04:12:51,474] Trial 438 pruned. Trial was pruned at iteration 0.
[I 2023-12-21 04:12:51,526] Trial 439 pruned. Trial was pruned at iteration 0.
[I 2023-12-21 04:12:51,577] Trial 440 pruned. Trial was pruned at iteration 0.
[I 2023-12-21 04:12:51,629] Trial 441 pruned. Trial was pruned at iteration 0.
[I 2023-12-21 04:12:51,680] Trial 442 pruned. Trial was pruned at iteration 0.
[I 2023-12-21 04:12:51,739] Trial 443 pruned. Trial was pruned at iteration 0.
[I 2023-12-21 04:12:51,791] Trial 444 pruned. Trial was pruned at iteration 0.
[I 2023-12-21 04:12:51,843] Trial 445 pruned. Trial was pruned at iteration 0.
[I 2023-12-21 04:12:51,896] Trial 446 pruned. Trial was pruned at iteration 0.
