[I 2023-12-21 03:13:49,831] Trial 372 pruned. Trial was pruned at iteration 0.
[I 2023-12-21 03:13:49,879] Trial 373 pruned. Trial was pruned at iteration 0.
[I 2023-12-21 03:13:50,855] Trial 374 finished with value: inf and parameters: {'learning_rate': 0.9306468312601828, 'aft_loss_distributi                                                                     on': 'normal', 'aft_loss_distribution_scale': 1.1275441444358145, 'max_depth': 8, 'booster': 'dart', 'scale_pos_weight': 0.75480780428247                                                                     66, 'alpha': 7.43922162705075, 'lambda': 2.3806977353825083, 'eta': 0.6855027820923412, 'sampling_method': 'uniform', 'subsample': 0.9113                                                                     97109136759, 'gamma': 8.865407705200909}. Best is trial 174 with value: 4.325161198972311.
[I 2023-12-21 03:13:50,902] Trial 375 pruned. Trial was pruned at iteration 0.
[I 2023-12-21 03:13:50,950] Trial 376 pruned. Trial was pruned at iteration 0.
[I 2023-12-21 03:13:50,997] Trial 377 pruned. Trial was pruned at iteration 0.
[I 2023-12-21 03:13:51,993] Trial 378 finished with value: inf and parameters: {'learning_rate': 0.9518578820306298, 'aft_loss_distributi                                                                     on': 'normal', 'aft_loss_distribution_scale': 1.3366476733160078, 'max_depth': 9, 'booster': 'dart', 'scale_pos_weight': 6.22480675029891                                                                     8, 'alpha': 7.9001025030446925, 'lambda': 8.660026911181921, 'eta': 0.8153503749501064, 'sampling_method': 'uniform', 'subsample': 0.9743                                                                     246772745857, 'gamma': 9.225063522813835}. Best is trial 174 with value: 4.325161198972311.
[I 2023-12-21 03:13:52,041] Trial 379 pruned. Trial was pruned at iteration 0.
[I 2023-12-21 03:13:52,089] Trial 380 pruned. Trial was pruned at iteration 0.
[I 2023-12-21 03:13:52,139] Trial 381 pruned. Trial was pruned at iteration 0.
[I 2023-12-21 03:13:53,103] Trial 382 finished with value: inf and parameters: {'learning_rate': 0.9295099278825459, 'aft_loss_distributi                                                                     on': 'normal', 'aft_loss_distribution_scale': 1.294901231329691, 'max_depth': 9, 'booster': 'dart', 'scale_pos_weight': 6.533207727979355                                                                     , 'alpha': 4.146072708124497, 'lambda': 9.032485983681614, 'eta': 0.3423646295571597, 'sampling_method': 'uniform', 'subsample': 0.412659                                                                     7373643639, 'gamma': 9.828013288145502}. Best is trial 174 with value: 4.325161198972311.
[I 2023-12-21 03:13:53,151] Trial 383 pruned. Trial was pruned at iteration 0.
[I 2023-12-21 03:13:53,199] Trial 384 pruned. Trial was pruned at iteration 0.
[I 2023-12-21 03:13:53,249] Trial 385 pruned. Trial was pruned at iteration 0.
[I 2023-12-21 03:13:53,296] Trial 386 pruned. Trial was pruned at iteration 0.
[I 2023-12-21 03:13:53,344] Trial 387 pruned. Trial was pruned at iteration 0.
[I 2023-12-21 03:13:53,402] Trial 388 pruned. Trial was pruned at iteration 1.
[I 2023-12-21 03:13:53,450] Trial 389 pruned. Trial was pruned at iteration 0.
[I 2023-12-21 03:13:53,498] Trial 390 pruned. Trial was pruned at iteration 0.
[I 2023-12-21 03:13:53,546] Trial 391 pruned. Trial was pruned at iteration 0.
[I 2023-12-21 03:13:53,593] Trial 392 pruned. Trial was pruned at iteration 0.
[I 2023-12-21 03:13:53,643] Trial 393 pruned. Trial was pruned at iteration 0.
[I 2023-12-21 03:13:53,692] Trial 394 pruned. Trial was pruned at iteration 0.
[I 2023-12-21 03:13:53,741] Trial 395 pruned. Trial was pruned at iteration 0.
[I 2023-12-21 03:13:53,789] Trial 396 pruned. Trial was pruned at iteration 0.
[I 2023-12-21 03:13:53,838] Trial 397 pruned. Trial was pruned at iteration 0.
[I 2023-12-21 03:13:53,886] Trial 398 pruned. Trial was pruned at iteration 0.
[I 2023-12-21 03:13:53,934] Trial 399 pruned. Trial was pruned at iteration 0.
[I 2023-12-21 03:13:53,984] Trial 400 pruned. Trial was pruned at iteration 0.
[I 2023-12-21 03:13:54,037] Trial 401 pruned. Trial was pruned at iteration 0.
[I 2023-12-21 03:13:54,095] Trial 402 pruned. Trial was pruned at iteration 1.
[I 2023-12-21 03:13:54,143] Trial 403 pruned. Trial was pruned at iteration 0.
[I 2023-12-21 03:13:54,192] Trial 404 pruned. Trial was pruned at iteration 0.
[I 2023-12-21 03:13:54,243] Trial 405 pruned. Trial was pruned at iteration 0.
[I 2023-12-21 03:13:54,291] Trial 406 pruned. Trial was pruned at iteration 0.
[I 2023-12-21 03:13:55,274] Trial 407 finished with value: inf and parameters: {'learning_rate': 0.9500106991526548, 'aft_loss_distributi                                                                     on': 'normal', 'aft_loss_distribution_scale': 1.2212734228167126, 'max_depth': 9, 'booster': 'dart', 'scale_pos_weight': 5.8280290437433,                                                                      'alpha': 7.375702074912432, 'lambda': 9.283662908437156, 'eta': 0.7830108341446107, 'sampling_method': 'uniform', 'subsample': 0.3778433                                                                     429542843, 'gamma': 9.747507911516472}. Best is trial 174 with value: 4.325161198972311.
[I 2023-12-21 03:13:55,326] Trial 408 pruned. Trial was pruned at iteration 0.
[I 2023-12-21 03:13:55,374] Trial 409 pruned. Trial was pruned at iteration 0.
[I 2023-12-21 03:13:55,423] Trial 410 pruned. Trial was pruned at iteration 0.
[I 2023-12-21 03:13:55,472] Trial 411 pruned. Trial was pruned at iteration 0.
[I 2023-12-21 03:13:55,520] Trial 412 pruned. Trial was pruned at iteration 0.
[I 2023-12-21 03:13:55,569] Trial 413 pruned. Trial was pruned at iteration 0.
[I 2023-12-21 03:13:55,621] Trial 414 pruned. Trial was pruned at iteration 0.
[I 2023-12-21 03:13:55,670] Trial 415 pruned. Trial was pruned at iteration 0.
[I 2023-12-21 03:13:55,719] Trial 416 pruned. Trial was pruned at iteration 0.
[I 2023-12-21 03:13:55,768] Trial 417 pruned. Trial was pruned at iteration 0.
[I 2023-12-21 03:13:55,817] Trial 418 pruned. Trial was pruned at iteration 0.
[I 2023-12-21 03:13:55,868] Trial 419 pruned. Trial was pruned at iteration 0.
[I 2023-12-21 03:13:55,917] Trial 420 pruned. Trial was pruned at iteration 0.
[I 2023-12-21 03:13:55,969] Trial 421 pruned. Trial was pruned at iteration 0.
[I 2023-12-21 03:13:56,019] Trial 422 pruned. Trial was pruned at iteration 0.
[I 2023-12-21 03:13:56,068] Trial 423 pruned. Trial was pruned at iteration 0.
[I 2023-12-21 03:13:56,118] Trial 424 pruned. Trial was pruned at iteration 0.
[I 2023-12-21 03:13:56,167] Trial 425 pruned. Trial was pruned at iteration 0.
[I 2023-12-21 03:13:56,218] Trial 426 pruned. Trial was pruned at iteration 0.
[I 2023-12-21 03:13:57,181] Trial 427 finished with value: inf and parameters: {'learning_rate': 0.906638625730728, 'aft_loss_distributio                                                                     n': 'normal', 'aft_loss_distribution_scale': 1.1947087341103768, 'max_depth': 9, 'booster': 'dart', 'scale_pos_weight': 5.182103563917069                                                                     , 'alpha': 5.880667447867818, 'lambda': 8.28412765274798, 'eta': 0.0478198425839242, 'sampling_method': 'uniform', 'subsample': 0.0467601                                                                     982849527, 'gamma': 8.893440771038401}. Best is trial 174 with value: 4.325161198972311.
[I 2023-12-21 03:13:57,233] Trial 428 pruned. Trial was pruned at iteration 0.
[I 2023-12-21 03:13:57,285] Trial 429 pruned. Trial was pruned at iteration 0.
[I 2023-12-21 03:13:57,334] Trial 430 pruned. Trial was pruned at iteration 0.
[I 2023-12-21 03:13:57,384] Trial 431 pruned. Trial was pruned at iteration 0.
[I 2023-12-21 03:13:57,435] Trial 432 pruned. Trial was pruned at iteration 0.
[I 2023-12-21 03:13:57,485] Trial 433 pruned. Trial was pruned at iteration 0.
[I 2023-12-21 03:13:57,536] Trial 434 pruned. Trial was pruned at iteration 0.
[I 2023-12-21 03:13:57,587] Trial 435 pruned. Trial was pruned at iteration 0.
[I 2023-12-21 03:13:57,853] Trial 436 finished with value: inf and parameters: {'learning_rate': 0.9228652021046916, 'aft_loss_distributi                                                                     on': 'normal', 'aft_loss_distribution_scale': 1.3270964959432756, 'max_depth': 9, 'booster': 'gbtree', 'scale_pos_weight': 5.467732097131                                                                     37, 'alpha': 5.610236605128206, 'lambda': 8.053255148615671, 'eta': 0.8346741627450233, 'sampling_method': 'uniform', 'subsample': 0.3334                                                                     0733383613763, 'gamma': 3.3489511533626155}. Best is trial 174 with value: 4.325161198972311.
[I 2023-12-21 03:13:57,903] Trial 437 pruned. Trial was pruned at iteration 0.
[I 2023-12-21 03:13:57,952] Trial 438 pruned. Trial was pruned at iteration 0.
[I 2023-12-21 03:13:58,003] Trial 439 pruned. Trial was pruned at iteration 0.
[I 2023-12-21 03:13:58,053] Trial 440 pruned. Trial was pruned at iteration 0.
[I 2023-12-21 03:13:58,105] Trial 441 pruned. Trial was pruned at iteration 0.
[I 2023-12-21 03:13:58,155] Trial 442 pruned. Trial was pruned at iteration 0.
[I 2023-12-21 03:13:59,056] Trial 443 finished with value: inf and parameters: {'learning_rate': 0.9185300706372684, 'aft_loss_distributi                                                                     on': 'normal', 'aft_loss_distribution_scale': 1.3121239668522073, 'max_depth': 9, 'booster': 'dart', 'scale_pos_weight': 6.00244208135593                                                                     8, 'alpha': 4.647753592683049, 'lambda': 3.0366133903689576, 'eta': 0.5298385996284755, 'sampling_method': 'uniform', 'subsample': 0.5345                                                                     892328470967, 'gamma': 9.10274815150611}. Best is trial 174 with value: 4.325161198972311.
[I 2023-12-21 03:13:59,106] Trial 444 pruned. Trial was pruned at iteration 0.
[I 2023-12-21 03:13:59,157] Trial 445 pruned. Trial was pruned at iteration 0.
[I 2023-12-21 03:13:59,207] Trial 446 pruned. Trial was pruned at iteration 0.
[I 2023-12-21 03:14:00,162] Trial 447 finished with value: inf and parameters: {'learning_rate': 0.9596893548010814, 'aft_loss_distributi                                                                     on': 'normal', 'aft_loss_distribution_scale': 1.1575971100611562, 'max_depth': 9, 'booster': 'dart', 'scale_pos_weight': 5.76274096497561                                                                     85, 'alpha': 8.838062085821612, 'lambda': 9.750485774651462, 'eta': 0.9581355542158294, 'sampling_method': 'uniform', 'subsample': 0.6821                                                                     135410467927, 'gamma': 9.184999937053243}. Best is trial 174 with value: 4.325161198972311.
[I 2023-12-21 03:14:00,215] Trial 448 pruned. Trial was pruned at iteration 0.
[I 2023-12-21 03:14:00,267] Trial 449 pruned. Trial was pruned at iteration 0.
[I 2023-12-21 03:14:00,323] Trial 450 pruned. Trial was pruned at iteration 1.
[I 2023-12-21 03:14:00,373] Trial 451 pruned. Trial was pruned at iteration 0.
[I 2023-12-21 03:14:00,424] Trial 452 pruned. Trial was pruned at iteration 0.
[I 2023-12-21 03:14:00,475] Trial 453 pruned. Trial was pruned at iteration 0.
[I 2023-12-21 03:14:00,527] Trial 454 pruned. Trial was pruned at iteration 0.
[I 2023-12-21 03:14:01,510] Trial 455 finished with value: inf and parameters: {'learning_rate': 0.901238126309494, 'aft_loss_distributio                                                                     n': 'normal', 'aft_loss_distribution_scale': 1.267338514841387, 'max_depth': 10, 'booster': 'dart', 'scale_pos_weight': 5.882800509271339                                                                     , 'alpha': 7.442203853773104, 'lambda': 5.253099841140575, 'eta': 0.7525067295257121, 'sampling_method': 'uniform', 'subsample': 0.606303                                                                     17143792, 'gamma': 8.997385729865398}. Best is trial 174 with value: 4.325161198972311.
[I 2023-12-21 03:14:01,562] Trial 456 pruned. Trial was pruned at iteration 0.
[I 2023-12-21 03:14:01,615] Trial 457 pruned. Trial was pruned at iteration 0.
[I 2023-12-21 03:14:01,666] Trial 458 pruned. Trial was pruned at iteration 0.
[I 2023-12-21 03:14:01,717] Trial 459 pruned. Trial was pruned at iteration 0.
[I 2023-12-21 03:14:02,718] Trial 460 finished with value: inf and parameters: {'learning_rate': 0.8815441290036085, 'aft_loss_distributi                                                                     on': 'normal', 'aft_loss_distribution_scale': 1.1054136869431792, 'max_depth': 9, 'booster': 'dart', 'scale_pos_weight': 6.09940415060154                                                                     , 'alpha': 9.332839933233576, 'lambda': 7.784057996891079, 'eta': 0.019654330507485565, 'sampling_method': 'uniform', 'subsample': 0.4390                                                                     6184394016423, 'gamma': 9.41593350938615}. Best is trial 174 with value: 4.325161198972311.
[I 2023-12-21 03:14:02,770] Trial 461 pruned. Trial was pruned at iteration 0.
[I 2023-12-21 03:14:02,823] Trial 462 pruned. Trial was pruned at iteration 0.
[I 2023-12-21 03:14:02,874] Trial 463 pruned. Trial was pruned at iteration 0.
[I 2023-12-21 03:14:03,912] Trial 464 finished with value: inf and parameters: {'learning_rate': 0.8949066143953167, 'aft_loss_distributi                                                                     on': 'normal', 'aft_loss_distribution_scale': 1.347621590147754, 'max_depth': 8, 'booster': 'dart', 'scale_pos_weight': 5.347075707199983                                                                     , 'alpha': 8.792489442411394, 'lambda': 8.192411870076052, 'eta': 0.8798542653103704, 'sampling_method': 'uniform', 'subsample': 0.499802                                                                     7463212744, 'gamma': 9.995190891432832}. Best is trial 174 with value: 4.325161198972311.
[I 2023-12-21 03:14:03,965] Trial 465 pruned. Trial was pruned at iteration 0.
[I 2023-12-21 03:14:04,016] Trial 466 pruned. Trial was pruned at iteration 0.
[I 2023-12-21 03:14:04,068] Trial 467 pruned. Trial was pruned at iteration 0.
[I 2023-12-21 03:14:04,121] Trial 468 pruned. Trial was pruned at iteration 0.
[I 2023-12-21 03:14:04,177] Trial 469 pruned. Trial was pruned at iteration 0.
[I 2023-12-21 03:14:04,232] Trial 470 pruned. Trial was pruned at iteration 0.
[I 2023-12-21 03:14:04,283] Trial 471 pruned. Trial was pruned at iteration 0.
[I 2023-12-21 03:14:05,279] Trial 472 finished with value: inf and parameters: {'learning_rate': 0.9491142163926365, 'aft_loss_distributi                                                                     on': 'normal', 'aft_loss_distribution_scale': 1.2299414977953236, 'max_depth': 8, 'booster': 'dart', 'scale_pos_weight': 5.50182220869058                                                                     7, 'alpha': 5.180582986083559, 'lambda': 8.355533372864649, 'eta': 0.9651714892000197, 'sampling_method': 'uniform', 'subsample': 0.48833                                                                     967841898906, 'gamma': 9.035623198381062}. Best is trial 174 with value: 4.325161198972311.
[I 2023-12-21 03:14:05,332] Trial 473 pruned. Trial was pruned at iteration 0.
[I 2023-12-21 03:14:05,384] Trial 474 pruned. Trial was pruned at iteration 0.
[I 2023-12-21 03:14:05,437] Trial 475 pruned. Trial was pruned at iteration 0.
[I 2023-12-21 03:14:05,490] Trial 476 pruned. Trial was pruned at iteration 0.
[I 2023-12-21 03:14:05,542] Trial 477 pruned. Trial was pruned at iteration 0.
[I 2023-12-21 03:14:05,594] Trial 478 pruned. Trial was pruned at iteration 0.
[I 2023-12-21 03:14:05,645] Trial 479 pruned. Trial was pruned at iteration 0.
[I 2023-12-21 03:14:05,699] Trial 480 pruned. Trial was pruned at iteration 0.
[I 2023-12-21 03:14:05,751] Trial 481 pruned. Trial was pruned at iteration 0.
[I 2023-12-21 03:14:05,803] Trial 482 pruned. Trial was pruned at iteration 0.
[I 2023-12-21 03:14:05,857] Trial 483 pruned. Trial was pruned at iteration 0.
[I 2023-12-21 03:14:06,857] Trial 484 finished with value: inf and parameters: {'learning_rate': 0.9060621675474634, 'aft_loss_distributi                                                                     on': 'normal', 'aft_loss_distribution_scale': 1.1278755352893202, 'max_depth': 9, 'booster': 'dart', 'scale_pos_weight': 5.83250358555559                                                                     3, 'alpha': 7.436923270056006, 'lambda': 8.36374299959891, 'eta': 0.09492613846558513, 'sampling_method': 'uniform', 'subsample': 0.46508                                                                     40226057484, 'gamma': 9.539806403473793}. Best is trial 174 with value: 4.325161198972311.
[I 2023-12-21 03:14:06,911] Trial 485 pruned. Trial was pruned at iteration 0.
[I 2023-12-21 03:14:06,963] Trial 486 pruned. Trial was pruned at iteration 0.
[I 2023-12-21 03:14:07,015] Trial 487 pruned. Trial was pruned at iteration 0.
[I 2023-12-21 03:14:07,067] Trial 488 pruned. Trial was pruned at iteration 0.
[I 2023-12-21 03:14:07,120] Trial 489 pruned. Trial was pruned at iteration 0.
[I 2023-12-21 03:14:07,175] Trial 490 pruned. Trial was pruned at iteration 0.
[I 2023-12-21 03:14:07,230] Trial 491 pruned. Trial was pruned at iteration 0.
[I 2023-12-21 03:14:07,282] Trial 492 pruned. Trial was pruned at iteration 0.
[I 2023-12-21 03:14:07,335] Trial 493 pruned. Trial was pruned at iteration 0.
[I 2023-12-21 03:14:07,388] Trial 494 pruned. Trial was pruned at iteration 0.
[I 2023-12-21 03:14:08,432] Trial 495 finished with value: inf and parameters: {'learning_rate': 0.9489331467337256, 'aft_loss_distributi                                                                     on': 'normal', 'aft_loss_distribution_scale': 1.013670839704654, 'max_depth': 6, 'booster': 'dart', 'scale_pos_weight': 7.340891714808869                                                                     , 'alpha': 7.545326974967134, 'lambda': 8.475381765496019, 'eta': 0.8594759001773203, 'sampling_method': 'uniform', 'subsample': 0.435656                                                                     0005445057, 'gamma': 9.729171444890719}. Best is trial 174 with value: 4.325161198972311.
[I 2023-12-21 03:14:08,488] Trial 496 pruned. Trial was pruned at iteration 0.
[I 2023-12-21 03:14:08,541] Trial 497 pruned. Trial was pruned at iteration 0.
[I 2023-12-21 03:14:08,594] Trial 498 pruned. Trial was pruned at iteration 0.
