[I 2023-12-19 00:36:17,668] Trial 183 finished with value: inf and parameters: {'learning_rate': 0.9492668802153352, 'aft_loss_distribution': 'normal', 'aft_loss_distribution_scale': 1.7446932246165285, 'max_depth': 3, 'booster': 'dart', 'scale_pos_weight': 1.4863803607052875, 'alpha': 4.168276832043643, 'lambda': 1.6511950889212414, 'eta': 0.10752368336447433, 'sampling_method': 'gradient_based', 'subsample': 0.8542726422117375, 'gamma': 9.444422817323314}. Best is trial 162 with value: 2.0240364545826837.
[I 2023-12-19 00:36:17,778] Trial 184 pruned. Trial was pruned at iteration 0.
[I 2023-12-19 00:36:21,398] Trial 185 finished with value: 2.0419581337843633 and parameters: {'learning_rate': 0.9671805462040609, 'aft_loss_distribution': 'normal', 'aft_loss_distribution_scale': 1.9103070761125507, 'max_depth': 3, 'booster': 'dart', 'scale_pos_weight': 1.2356343775611704, 'alpha': 0.6294794656585769, 'lambda': 1.9444914339716026, 'eta': 0.27713408409045015, 'sampling_method': 'gradient_based', 'subsample': 0.7931592239121241, 'gamma': 9.204444089953302}. Best is trial 162 with value: 2.0240364545826837.
[I 2023-12-19 00:36:21,482] Trial 186 pruned. Trial was pruned at iteration 0.
[I 2023-12-19 00:36:22,801] Trial 187 finished with value: inf and parameters: {'learning_rate': 0.9650185423012104, 'aft_loss_distribution': 'normal', 'aft_loss_distribution_scale': 1.8977974408446192, 'max_depth': 3, 'booster': 'dart', 'scale_pos_weight': 1.2452089273579132, 'alpha': 4.2315441687408155, 'lambda': 1.7011807211931989, 'eta': 0.20960284225484324, 'sampling_method': 'gradient_based', 'subsample': 0.8719909388478757, 'gamma': 9.500115221567663}. Best is trial 162 with value: 2.0240364545826837.
[I 2023-12-19 00:36:22,894] Trial 188 pruned. Trial was pruned at iteration 0.
[I 2023-12-19 00:36:24,485] Trial 189 finished with value: inf and parameters: {'learning_rate': 0.9668827006742235, 'aft_loss_distribution': 'normal', 'aft_loss_distribution_scale': 1.8555040638648173, 'max_depth': 3, 'booster': 'dart', 'scale_pos_weight': 1.6882682993981801, 'alpha': 0.8310311359971945, 'lambda': 1.4532134268258716, 'eta': 0.9262833263275112, 'sampling_method': 'gradient_based', 'subsample': 0.8146263509937013, 'gamma': 9.025168192381932}. Best is trial 162 with value: 2.0240364545826837.
[I 2023-12-19 00:36:24,562] Trial 190 pruned. Trial was pruned at iteration 0.
[I 2023-12-19 00:36:27,512] Trial 191 finished with value: 2.047145460424737 and parameters: {'learning_rate': 0.9733774737890962, 'aft_loss_distribution': 'normal', 'aft_loss_distribution_scale': 1.9661675107905396, 'max_depth': 3, 'booster': 'dart', 'scale_pos_weight': 1.1603496400654034, 'alpha': 3.7389573924965296, 'lambda': 1.9594416425282626, 'eta': 0.9819589324710056, 'sampling_method': 'gradient_based', 'subsample': 0.7890545678082044, 'gamma': 9.541419537708295}. Best is trial 162 with value: 2.0240364545826837.
[I 2023-12-19 00:36:29,280] Trial 192 finished with value: inf and parameters: {'learning_rate': 0.9702697899687621, 'aft_loss_distribution': 'normal', 'aft_loss_distribution_scale': 1.7041254397897196, 'max_depth': 3, 'booster': 'dart', 'scale_pos_weight': 1.1449065670943543, 'alpha': 3.7633931867288264, 'lambda': 1.9222818580930088, 'eta': 0.9970121422220721, 'sampling_method': 'gradient_based', 'subsample': 0.8389327695621243, 'gamma': 9.563489241822008}. Best is trial 162 with value: 2.0240364545826837.
[I 2023-12-19 00:36:29,402] Trial 193 pruned. Trial was pruned at iteration 0.
[I 2023-12-19 00:36:31,078] Trial 194 finished with value: inf and parameters: {'learning_rate': 0.97215303462378, 'aft_loss_distribution': 'normal', 'aft_loss_distribution_scale': 1.4587629880931585, 'max_depth': 3, 'booster': 'dart', 'scale_pos_weight': 1.313993435631188, 'alpha': 2.083054231456827, 'lambda': 2.0800550654267713, 'eta': 0.9756367295141352, 'sampling_method': 'gradient_based', 'subsample': 0.8142184544501639, 'gamma': 9.569175663717976}. Best is trial 162 with value: 2.0240364545826837.
[I 2023-12-19 00:36:31,219] Trial 195 pruned. Trial was pruned at iteration 0.
[I 2023-12-19 00:36:33,269] Trial 196 finished with value: inf and parameters: {'learning_rate': 0.9541403762250317, 'aft_loss_distribution': 'normal', 'aft_loss_distribution_scale': 1.9535680827843092, 'max_depth': 3, 'booster': 'dart', 'scale_pos_weight': 1.1885433928429576, 'alpha': 3.8266733695998885, 'lambda': 1.2951977995715545, 'eta': 0.9213008250992893, 'sampling_method': 'gradient_based', 'subsample': 0.826023930676998, 'gamma': 0.3097501185445779}. Best is trial 162 with value: 2.0240364545826837.
[I 2023-12-19 00:36:35,046] Trial 197 finished with value: inf and parameters: {'learning_rate': 0.936343807330028, 'aft_loss_distribution': 'normal', 'aft_loss_distribution_scale': 1.6352448705498275, 'max_depth': 3, 'booster': 'dart', 'scale_pos_weight': 0.958612943119118, 'alpha': 4.515728316476554, 'lambda': 1.9505735544534832, 'eta': 0.8708632772296094, 'sampling_method': 'gradient_based', 'subsample': 0.09626884585024709, 'gamma': 9.394750475072785}. Best is trial 162 with value: 2.0240364545826837.
[I 2023-12-19 00:36:35,174] Trial 198 pruned. Trial was pruned at iteration 0.
[I 2023-12-19 00:36:35,301] Trial 199 pruned. Trial was pruned at iteration 0.
[I 2023-12-19 00:36:35,437] Trial 200 pruned. Trial was pruned at iteration 0.
[I 2023-12-19 00:36:37,067] Trial 201 finished with value: inf and parameters: {'learning_rate': 0.9779306496666722, 'aft_loss_distribution': 'normal', 'aft_loss_distribution_scale': 1.7869110207713423, 'max_depth': 3, 'booster': 'dart', 'scale_pos_weight': 1.0475322332349042, 'alpha': 3.6514898507933595, 'lambda': 2.4497164335908996, 'eta': 0.9504511547508124, 'sampling_method': 'gradient_based', 'subsample': 0.7671961303770445, 'gamma': 9.868031803327835}. Best is trial 162 with value: 2.0240364545826837.
[I 2023-12-19 00:36:38,839] Trial 202 finished with value: inf and parameters: {'learning_rate': 0.9803609231865634, 'aft_loss_distribution': 'normal', 'aft_loss_distribution_scale': 1.9929085496035956, 'max_depth': 3, 'booster': 'dart', 'scale_pos_weight': 0.9828731154859947, 'alpha': 3.6577746172297916, 'lambda': 2.7165347088093936, 'eta': 0.975938897084774, 'sampling_method': 'gradient_based', 'subsample': 0.755628497259911, 'gamma': 9.70134002767961}. Best is trial 162 with value: 2.0240364545826837.
[I 2023-12-19 00:36:38,919] Trial 203 pruned. Trial was pruned at iteration 0.
[I 2023-12-19 00:36:40,295] Trial 204 finished with value: inf and parameters: {'learning_rate': 0.9809830100584734, 'aft_loss_distribution': 'normal', 'aft_loss_distribution_scale': 1.4911121879787161, 'max_depth': 3, 'booster': 'dart', 'scale_pos_weight': 1.2151600443628592, 'alpha': 3.398339478961315, 'lambda': 2.1109556524216644, 'eta': 0.9388776697291045, 'sampling_method': 'gradient_based', 'subsample': 0.710045536538918, 'gamma': 2.319373514024957}. Best is trial 162 with value: 2.0240364545826837.
[I 2023-12-19 00:36:40,377] Trial 205 pruned. Trial was pruned at iteration 0.
[I 2023-12-19 00:36:42,055] Trial 206 finished with value: inf and parameters: {'learning_rate': 0.9607049882248475, 'aft_loss_distribution': 'normal', 'aft_loss_distribution_scale': 2.037788312690991, 'max_depth': 3, 'booster': 'dart', 'scale_pos_weight': 1.3069931325061044, 'alpha': 3.7069172874487526, 'lambda': 1.7868840080362387, 'eta': 0.922339464614477, 'sampling_method': 'gradient_based', 'subsample': 0.7390609423451266, 'gamma': 9.595502728161385}. Best is trial 162 with value: 2.0240364545826837.
[I 2023-12-19 00:36:42,132] Trial 207 pruned. Trial was pruned at iteration 0.
[I 2023-12-19 00:36:42,216] Trial 208 pruned. Trial was pruned at iteration 1.
[I 2023-12-19 00:36:42,291] Trial 209 pruned. Trial was pruned at iteration 0.
[I 2023-12-19 00:36:43,867] Trial 210 finished with value: inf and parameters: {'learning_rate': 0.965033053974476, 'aft_loss_distribution': 'normal', 'aft_loss_distribution_scale': 1.6694486458447457, 'max_depth': 3, 'booster': 'dart', 'scale_pos_weight': 1.4843912907093373, 'alpha': 2.243211947900425, 'lambda': 1.643972751661384, 'eta': 0.05395450134378285, 'sampling_method': 'gradient_based', 'subsample': 0.7550698875415371, 'gamma': 9.60062852632659}. Best is trial 162 with value: 2.0240364545826837.
[I 2023-12-19 00:36:46,278] Trial 211 finished with value: inf and parameters: {'learning_rate': 0.9952458873892949, 'aft_loss_distribution': 'normal', 'aft_loss_distribution_scale': 2.06116383308199, 'max_depth': 3, 'booster': 'dart', 'scale_pos_weight': 0.7708845731777547, 'alpha': 3.3032784401337447, 'lambda': 2.938185356753002, 'eta': 0.9537417100065544, 'sampling_method': 'gradient_based', 'subsample': 0.7822011237611103, 'gamma': 9.844688282096826}. Best is trial 162 with value: 2.0240364545826837.
[I 2023-12-19 00:36:47,645] Trial 212 finished with value: inf and parameters: {'learning_rate': 0.9994130461751767, 'aft_loss_distribution': 'normal', 'aft_loss_distribution_scale': 1.87980402443315, 'max_depth': 3, 'booster': 'dart', 'scale_pos_weight': 1.101492590720255, 'alpha': 1.3988597819001178, 'lambda': 2.1667146161764395, 'eta': 0.970433428900711, 'sampling_method': 'gradient_based', 'subsample': 0.7302567465127344, 'gamma': 9.660231057396029}. Best is trial 162 with value: 2.0240364545826837.
[I 2023-12-19 00:36:47,773] Trial 213 pruned. Trial was pruned at iteration 1.
[I 2023-12-19 00:36:51,327] Trial 214 finished with value: 2.0539576836528273 and parameters: {'learning_rate': 0.9609447979444125, 'aft_loss_distribution': 'normal', 'aft_loss_distribution_scale': 2.0386958298371187, 'max_depth': 3, 'booster': 'dart', 'scale_pos_weight': 0.8656448163092236, 'alpha': 3.7078037188856925, 'lambda': 1.8324859863601695, 'eta': 0.9832916333826552, 'sampling_method': 'gradient_based', 'subsample': 0.7633187397755132, 'gamma': 9.459183890477073}. Best is trial 162 with value: 2.0240364545826837.
[I 2023-12-19 00:36:51,437] Trial 215 pruned. Trial was pruned at iteration 0.
[I 2023-12-19 00:36:52,798] Trial 216 finished with value: inf and parameters: {'learning_rate': 0.9560418976659522, 'aft_loss_distribution': 'normal', 'aft_loss_distribution_scale': 1.8045086833449873, 'max_depth': 3, 'booster': 'dart', 'scale_pos_weight': 1.2740006216493245, 'alpha': 3.726322042634586, 'lambda': 1.3554034334503013, 'eta': 0.9052038586934785, 'sampling_method': 'gradient_based', 'subsample': 0.786557779638453, 'gamma': 9.484615160713297}. Best is trial 162 with value: 2.0240364545826837.
[I 2023-12-19 00:36:54,054] Trial 217 finished with value: inf and parameters: {'learning_rate': 0.9663811248428262, 'aft_loss_distribution': 'normal', 'aft_loss_distribution_scale': 1.464573870675858, 'max_depth': 3, 'booster': 'dart', 'scale_pos_weight': 0.8477430472652392, 'alpha': 1.7964394538714352, 'lambda': 2.017268304200343, 'eta': 0.983447494464908, 'sampling_method': 'gradient_based', 'subsample': 0.8111005234219651, 'gamma': 9.994785091643749}. Best is trial 162 with value: 2.0240364545826837.
[I 2023-12-19 00:36:54,142] Trial 218 pruned. Trial was pruned at iteration 0.
[I 2023-12-19 00:36:54,225] Trial 219 pruned. Trial was pruned at iteration 0.
[I 2023-12-19 00:36:54,304] Trial 220 pruned. Trial was pruned at iteration 0.
[I 2023-12-19 00:36:54,379] Trial 221 pruned. Trial was pruned at iteration 1.
[I 2023-12-19 00:36:57,137] Trial 222 finished with value: 2.0452322356614014 and parameters: {'learning_rate': 0.981055847668167, 'aft_loss_distribution': 'normal', 'aft_loss_distribution_scale': 1.9437912240516073, 'max_depth': 3, 'booster': 'dart', 'scale_pos_weight': 1.1926770161739682, 'alpha': 3.7090627012360176, 'lambda': 2.5064248949371875, 'eta': 0.9492234939015943, 'sampling_method': 'gradient_based', 'subsample': 0.779299558711514, 'gamma': 9.443239141963504}. Best is trial 162 with value: 2.0240364545826837.
[I 2023-12-19 00:36:59,625] Trial 223 finished with value: inf and parameters: {'learning_rate': 0.9665167037421963, 'aft_loss_distribution': 'normal', 'aft_loss_distribution_scale': 1.8796287784181451, 'max_depth': 3, 'booster': 'dart', 'scale_pos_weight': 1.1983066187433473, 'alpha': 3.636662704832229, 'lambda': 2.5463986305189903, 'eta': 0.9375513790811185, 'sampling_method': 'gradient_based', 'subsample': 0.7873746234648628, 'gamma': 9.150164818870241}. Best is trial 162 with value: 2.0240364545826837.
[I 2023-12-19 00:37:00,907] Trial 224 finished with value: inf and parameters: {'learning_rate': 0.9801876546685266, 'aft_loss_distribution': 'normal', 'aft_loss_distribution_scale': 1.7036103068073503, 'max_depth': 3, 'booster': 'dart', 'scale_pos_weight': 1.355472656013097, 'alpha': 4.094373169828556, 'lambda': 1.9374685648517427, 'eta': 0.9791399027635679, 'sampling_method': 'gradient_based', 'subsample': 0.7280229500002643, 'gamma': 9.405735012107526}. Best is trial 162 with value: 2.0240364545826837.
[I 2023-12-19 00:37:00,987] Trial 225 pruned. Trial was pruned at iteration 0.
[I 2023-12-19 00:37:01,060] Trial 226 pruned. Trial was pruned at iteration 0.
[I 2023-12-19 00:37:02,549] Trial 227 finished with value: inf and parameters: {'learning_rate': 0.9801256602167681, 'aft_loss_distribution': 'normal', 'aft_loss_distribution_scale': 1.8019836739453317, 'max_depth': 3, 'booster': 'dart', 'scale_pos_weight': 1.2464684433163071, 'alpha': 4.002396122028177, 'lambda': 2.107469365636995, 'eta': 0.9792918774661118, 'sampling_method': 'gradient_based', 'subsample': 0.7782426138921769, 'gamma': 9.372179819140111}. Best is trial 162 with value: 2.0240364545826837.
[I 2023-12-19 00:37:02,686] Trial 228 pruned. Trial was pruned at iteration 0.
[I 2023-12-19 00:37:02,792] Trial 229 pruned. Trial was pruned at iteration 0.
[I 2023-12-19 00:37:04,448] Trial 230 finished with value: inf and parameters: {'learning_rate': 0.9986312898192308, 'aft_loss_distribution': 'normal', 'aft_loss_distribution_scale': 2.0238136684144794, 'max_depth': 3, 'booster': 'dart', 'scale_pos_weight': 1.1426030582032627, 'alpha': 3.506331886555695, 'lambda': 2.2712452016024782, 'eta': 0.9563649217756934, 'sampling_method': 'gradient_based', 'subsample': 0.880969918776006, 'gamma': 8.91376741941621}. Best is trial 162 with value: 2.0240364545826837.
[I 2023-12-19 00:37:07,672] Trial 231 finished with value: 2.044697781976696 and parameters: {'learning_rate': 0.9990647065632265, 'aft_loss_distribution': 'normal', 'aft_loss_distribution_scale': 1.9364793032522012, 'max_depth': 3, 'booster': 'dart', 'scale_pos_weight': 0.6018740859641543, 'alpha': 3.341299972008696, 'lambda': 2.9611090979952426, 'eta': 0.9701710234222839, 'sampling_method': 'gradient_based', 'subsample': 0.7678689486815686, 'gamma': 9.75681421427016}. Best is trial 162 with value: 2.0240364545826837.
[I 2023-12-19 00:37:08,941] Trial 232 finished with value: inf and parameters: {'learning_rate': 0.9820376024326677, 'aft_loss_distribution': 'normal', 'aft_loss_distribution_scale': 1.8005142565370473, 'max_depth': 3, 'booster': 'dart', 'scale_pos_weight': 0.587581587861125, 'alpha': 1.9862781120517756, 'lambda': 3.0854239575601348, 'eta': 0.9847629245107691, 'sampling_method': 'gradient_based', 'subsample': 0.7684302171776995, 'gamma': 9.695764249606347}. Best is trial 162 with value: 2.0240364545826837.
[I 2023-12-19 00:37:09,033] Trial 233 pruned. Trial was pruned at iteration 1.
[I 2023-12-19 00:37:09,112] Trial 234 pruned. Trial was pruned at iteration 0.
[I 2023-12-19 00:37:09,190] Trial 235 pruned. Trial was pruned at iteration 0.
[I 2023-12-19 00:37:09,270] Trial 236 pruned. Trial was pruned at iteration 1.
[I 2023-12-19 00:37:09,345] Trial 237 pruned. Trial was pruned at iteration 0.
[I 2023-12-19 00:37:10,691] Trial 238 finished with value: inf and parameters: {'learning_rate': 0.9544523337131565, 'aft_loss_distribution': 'normal', 'aft_loss_distribution_scale': 1.6179837114946818, 'max_depth': 3, 'booster': 'dart', 'scale_pos_weight': 0.5207139712151335, 'alpha': 3.3685009981723035, 'lambda': 2.407096243724732, 'eta': 0.9697696195143461, 'sampling_method': 'gradient_based', 'subsample': 0.7573672680178617, 'gamma': 9.439394090548403}. Best is trial 162 with value: 2.0240364545826837.
[I 2023-12-19 00:37:10,777] Trial 239 pruned. Trial was pruned at iteration 0.
[I 2023-12-19 00:37:10,850] Trial 240 pruned. Trial was pruned at iteration 0.
[I 2023-12-19 00:37:10,932] Trial 241 pruned. Trial was pruned at iteration 1.
[I 2023-12-19 00:37:13,667] Trial 242 finished with value: 2.051602946278659 and parameters: {'learning_rate': 0.9786884845678122, 'aft_loss_distribution': 'normal', 'aft_loss_distribution_scale': 2.0169576731719774, 'max_depth': 3, 'booster': 'dart', 'scale_pos_weight': 0.7297585935281037, 'alpha': 3.3492166409880886, 'lambda': 3.0514795772356376, 'eta': 0.9815587917185173, 'sampling_method': 'gradient_based', 'subsample': 0.7394531558906914, 'gamma': 9.579245631652128}. Best is trial 162 with value: 2.0240364545826837.
[I 2023-12-19 00:37:13,765] Trial 243 pruned. Trial was pruned at iteration 1.
[I 2023-12-19 00:37:15,327] Trial 244 finished with value: inf and parameters: {'learning_rate': 0.9615946993877967, 'aft_loss_distribution': 'normal', 'aft_loss_distribution_scale': 1.9113242010218976, 'max_depth': 3, 'booster': 'dart', 'scale_pos_weight': 0.9848992249697087, 'alpha': 4.321725681766494, 'lambda': 2.521599182167131, 'eta': 0.9996052528982807, 'sampling_method': 'gradient_based', 'subsample': 0.7139678640192498, 'gamma': 9.288768722594813}. Best is trial 162 with value: 2.0240364545826837.
[I 2023-12-19 00:37:15,403] Trial 245 pruned. Trial was pruned at iteration 0.
[I 2023-12-19 00:37:16,799] Trial 246 finished with value: inf and parameters: {'learning_rate': 0.9848866161285097, 'aft_loss_distribution': 'normal', 'aft_loss_distribution_scale': 1.5656562987807945, 'max_depth': 3, 'booster': 'dart', 'scale_pos_weight': 0.844685581421441, 'alpha': 3.261202195442689, 'lambda': 2.844264860937225, 'eta': 0.9768147130350899, 'sampling_method': 'gradient_based', 'subsample': 0.7810043118106769, 'gamma': 9.400078924126774}. Best is trial 162 with value: 2.0240364545826837.
[I 2023-12-19 00:37:18,450] Trial 247 finished with value: inf and parameters: {'learning_rate': 0.9666140567767052, 'aft_loss_distribution': 'normal', 'aft_loss_distribution_scale': 1.7817963741944338, 'max_depth': 3, 'booster': 'dart', 'scale_pos_weight': 1.331005225924633, 'alpha': 0.4794883617457548, 'lambda': 2.2422903989225516, 'eta': 0.9491434761150291, 'sampling_method': 'gradient_based', 'subsample': 0.8179749218428898, 'gamma': 9.792034266987296}. Best is trial 162 with value: 2.0240364545826837.
[I 2023-12-19 00:37:21,817] Trial 248 finished with value: 2.0496402717425872 and parameters: {'learning_rate': 0.9995839875616184, 'aft_loss_distribution': 'normal', 'aft_loss_distribution_scale': 1.9944660177679576, 'max_depth': 3, 'booster': 'dart', 'scale_pos_weight': 1.1967129998815602, 'alpha': 3.365002814193632, 'lambda': 1.6734198106198823, 'eta': 0.9011169046313252, 'sampling_method': 'gradient_based', 'subsample': 0.7338047683213569, 'gamma': 9.154227478973983}. Best is trial 162 with value: 2.0240364545826837.
[I 2023-12-19 00:37:21,900] Trial 249 pruned. Trial was pruned at iteration 0.
[I 2023-12-19 00:37:21,977] Trial 250 pruned. Trial was pruned at iteration 0.
[I 2023-12-19 00:37:23,248] Trial 251 finished with value: inf and parameters: {'learning_rate': 0.9820620266232125, 'aft_loss_distribution': 'normal', 'aft_loss_distribution_scale': 1.7017671143712594, 'max_depth': 3, 'booster': 'dart', 'scale_pos_weight': 0.5835917114339796, 'alpha': 4.118041252778319, 'lambda': 1.9449639551119982, 'eta': 0.8731043351790636, 'sampling_method': 'gradient_based', 'subsample': 0.7630820335958733, 'gamma': 9.303053225549629}. Best is trial 162 with value: 2.0240364545826837.
[I 2023-12-19 00:37:23,330] Trial 252 pruned. Trial was pruned at iteration 0.
[I 2023-12-19 00:37:23,410] Trial 253 pruned. Trial was pruned at iteration 1.
[I 2023-12-19 00:37:23,488] Trial 254 pruned. Trial was pruned at iteration 0.
[I 2023-12-19 00:37:26,240] Trial 255 finished with value: 2.0213111605005274 and parameters: {'learning_rate': 0.9666099731307494, 'aft_loss_distribution': 'normal', 'aft_loss_distribution_scale': 1.6065641660980001, 'max_depth': 3, 'booster': 'dart', 'scale_pos_weight': 1.3292507166361283, 'alpha': 1.0983413233529977, 'lambda': 3.20190728057612, 'eta': 0.8602274539164247, 'sampling_method': 'gradient_based', 'subsample': 0.7233268492968574, 'gamma': 9.626845209475011}. Best is trial 255 with value: 2.0213111605005274.
[I 2023-12-19 00:37:26,321] Trial 256 pruned. Trial was pruned at iteration 0.
[I 2023-12-19 00:37:27,717] Trial 257 finished with value: inf and parameters: {'learning_rate': 0.9619485160782085, 'aft_loss_distribution': 'normal', 'aft_loss_distribution_scale': 1.6919384470316938, 'max_depth': 3, 'booster': 'dart', 'scale_pos_weight': 1.3044996444084245, 'alpha': 2.420793521958422, 'lambda': 2.2157763352010797, 'eta': 0.8547299827039283, 'sampling_method': 'gradient_based', 'subsample': 0.6751760756920754, 'gamma': 9.621654035171918}. Best is trial 255 with value: 2.0213111605005274.
[I 2023-12-19 00:37:27,799] Trial 258 pruned. Trial was pruned at iteration 0.
[I 2023-12-19 00:37:30,580] Trial 259 finished with value: 2.019020864720799 and parameters: {'learning_rate': 0.976398537009252, 'aft_loss_distribution': 'normal', 'aft_loss_distribution_scale': 1.4132262437764407, 'max_depth': 3, 'booster': 'dart', 'scale_pos_weight': 1.2404200262023255, 'alpha': 4.419051836384641, 'lambda': 1.9594490018795288, 'eta': 0.8502305735574897, 'sampling_method': 'gradient_based', 'subsample': 0.7801053931248578, 'gamma': 8.921462978925247}. Best is trial 259 with value: 2.019020864720799.
[I 2023-12-19 00:37:30,662] Trial 260 pruned. Trial was pruned at iteration 0.
[I 2023-12-19 00:37:30,741] Trial 261 pruned. Trial was pruned at iteration 0.
