[I 2023-12-21 02:59:06,825] Trial 197 finished with value: 4.3952476286869135 and parameters: {'learning_rate': 0.6930998482270423, 'aft_                                                                     loss_distribution': 'normal', 'aft_loss_distribution_scale': 1.6425676502117805, 'max_depth': 7, 'booster': 'gbtree', 'scale_pos_weight':                                                                      7.066036124390166, 'alpha': 7.340614846884382, 'lambda': 6.839513241186986, 'eta': 0.9971388085230719, 'sampling_method': 'uniform', 'su                                                                     bsample': 0.6957196511898103, 'gamma': 4.275646359311275}. Best is trial 188 with value: 4.348943369104032.
[I 2023-12-21 02:59:06,861] Trial 198 pruned. Trial was pruned at iteration 0.
[I 2023-12-21 02:59:06,993] Trial 199 finished with value: inf and parameters: {'learning_rate': 0.6349811507909493, 'aft_loss_distributi                                                                     on': 'normal', 'aft_loss_distribution_scale': 1.5621296197526138, 'max_depth': 7, 'booster': 'gbtree', 'scale_pos_weight': 7.150221159542                                                                     843, 'alpha': 7.2213180683966325, 'lambda': 7.028717575342278, 'eta': 0.9996972008642193, 'sampling_method': 'uniform', 'subsample': 0.72                                                                     08084567234264, 'gamma': 4.007607973569659}. Best is trial 188 with value: 4.348943369104032.
[I 2023-12-21 02:59:07,030] Trial 200 pruned. Trial was pruned at iteration 0.
[I 2023-12-21 02:59:07,283] Trial 201 finished with value: 4.4162233445882455 and parameters: {'learning_rate': 0.6196539551302531, 'aft_                                                                     loss_distribution': 'normal', 'aft_loss_distribution_scale': 1.7129154317268696, 'max_depth': 7, 'booster': 'gbtree', 'scale_pos_weight':                                                                      7.243208371513879, 'alpha': 8.43721124530484, 'lambda': 7.319566168773377, 'eta': 0.9759363049308875, 'sampling_method': 'uniform', 'sub                                                                     sample': 0.7306156157746049, 'gamma': 4.8527550935282315}. Best is trial 188 with value: 4.348943369104032.
[I 2023-12-21 02:59:07,407] Trial 202 finished with value: inf and parameters: {'learning_rate': 0.6336778954501331, 'aft_loss_distributi                                                                     on': 'normal', 'aft_loss_distribution_scale': 1.7141892143145911, 'max_depth': 7, 'booster': 'gbtree', 'scale_pos_weight': 7.213181033291                                                                     038, 'alpha': 8.335602896179994, 'lambda': 7.1666795029500605, 'eta': 0.9581756257669536, 'sampling_method': 'uniform', 'subsample': 0.70                                                                     30761626964712, 'gamma': 4.809929017061268}. Best is trial 188 with value: 4.348943369104032.
[I 2023-12-21 02:59:07,594] Trial 203 finished with value: 4.350812469663218 and parameters: {'learning_rate': 0.6184709280818577, 'aft_l                                                                     oss_distribution': 'normal', 'aft_loss_distribution_scale': 1.5297108693964858, 'max_depth': 7, 'booster': 'gbtree', 'scale_pos_weight':                                                                      6.642353120875351, 'alpha': 7.38914928002221, 'lambda': 7.192555511049271, 'eta': 0.9995659222070052, 'sampling_method': 'uniform', 'subs                                                                     ample': 0.7229828877257932, 'gamma': 4.9500427757623555}. Best is trial 188 with value: 4.348943369104032.
[I 2023-12-21 02:59:07,729] Trial 204 finished with value: inf and parameters: {'learning_rate': 0.6493919098938999, 'aft_loss_distributi                                                                     on': 'normal', 'aft_loss_distribution_scale': 1.438225100186663, 'max_depth': 7, 'booster': 'gbtree', 'scale_pos_weight': 6.6456460062925                                                                     81, 'alpha': 7.758664242291989, 'lambda': 7.313871769132421, 'eta': 0.9832574285828392, 'sampling_method': 'uniform', 'subsample': 0.7245                                                                     59776732133, 'gamma': 5.017006816920669}. Best is trial 188 with value: 4.348943369104032.
[I 2023-12-21 02:59:07,853] Trial 205 finished with value: inf and parameters: {'learning_rate': 0.6744585683978997, 'aft_loss_distributi                                                                     on': 'normal', 'aft_loss_distribution_scale': 1.6396798503055503, 'max_depth': 7, 'booster': 'gbtree', 'scale_pos_weight': 6.798843533299                                                                     954, 'alpha': 7.267299547231533, 'lambda': 6.7369553957111, 'eta': 0.9979192688373193, 'sampling_method': 'uniform', 'subsample': 0.72969                                                                     99000729892, 'gamma': 4.34578490180128}. Best is trial 188 with value: 4.348943369104032.
[I 2023-12-21 02:59:07,890] Trial 206 pruned. Trial was pruned at iteration 0.
[I 2023-12-21 02:59:08,038] Trial 207 finished with value: inf and parameters: {'learning_rate': 0.7012281610151566, 'aft_loss_distributi                                                                     on': 'normal', 'aft_loss_distribution_scale': 1.4786527641878922, 'max_depth': 7, 'booster': 'gbtree', 'scale_pos_weight': 7.060497148720                                                                     772, 'alpha': 7.912875985708248, 'lambda': 6.980731844976859, 'eta': 0.979924187529795, 'sampling_method': 'uniform', 'subsample': 0.6933                                                                     988503850504, 'gamma': 4.834208649928911}. Best is trial 188 with value: 4.348943369104032.
[I 2023-12-21 02:59:08,076] Trial 208 pruned. Trial was pruned at iteration 0.
[I 2023-12-21 02:59:08,116] Trial 209 pruned. Trial was pruned at iteration 0.
[I 2023-12-21 02:59:13,860] Trial 210 finished with value: 4.397250065064873 and parameters: {'learning_rate': 0.6603707299683309, 'aft_l                                                                     oss_distribution': 'normal', 'aft_loss_distribution_scale': 1.6596971118344472, 'max_depth': 7, 'booster': 'dart', 'scale_pos_weight': 6.                                                                     85921241618678, 'alpha': 6.843530117488662, 'lambda': 7.420400504619131, 'eta': 0.9806551458478651, 'sampling_method': 'uniform', 'subsam                                                                     ple': 0.7658802512259822, 'gamma': 4.480172369257823}. Best is trial 188 with value: 4.348943369104032.
[I 2023-12-21 02:59:18,167] Trial 211 finished with value: 4.386157329217798 and parameters: {'learning_rate': 0.661815951051337, 'aft_lo                                                                     ss_distribution': 'normal', 'aft_loss_distribution_scale': 1.6238424759626666, 'max_depth': 7, 'booster': 'dart', 'scale_pos_weight': 6.9                                                                     13570314358894, 'alpha': 7.548610222998402, 'lambda': 7.347387310400596, 'eta': 0.9781845040666113, 'sampling_method': 'uniform', 'subsam                                                                     ple': 0.7632688935304783, 'gamma': 4.534548309421176}. Best is trial 188 with value: 4.348943369104032.
[I 2023-12-21 02:59:22,996] Trial 212 finished with value: 4.400381183036176 and parameters: {'learning_rate': 0.6767892705799783, 'aft_l                                                                     oss_distribution': 'normal', 'aft_loss_distribution_scale': 1.659824515366438, 'max_depth': 7, 'booster': 'dart', 'scale_pos_weight': 7.2                                                                     72929761721722, 'alpha': 7.279413523170589, 'lambda': 7.404802895316359, 'eta': 0.9792203439782388, 'sampling_method': 'uniform', 'subsam                                                                     ple': 0.7829017880158105, 'gamma': 4.428791856474031}. Best is trial 188 with value: 4.348943369104032.
[I 2023-12-21 02:59:25,327] Trial 213 finished with value: 4.396357313131734 and parameters: {'learning_rate': 0.6925768500307459, 'aft_l                                                                     oss_distribution': 'normal', 'aft_loss_distribution_scale': 1.6387675034488443, 'max_depth': 7, 'booster': 'dart', 'scale_pos_weight': 7.                                                                     434009746795207, 'alpha': 6.893286454629191, 'lambda': 7.417286436272028, 'eta': 0.9693301256358543, 'sampling_method': 'uniform', 'subsa                                                                     mple': 0.7948222607814875, 'gamma': 4.551705388702699}. Best is trial 188 with value: 4.348943369104032.
[I 2023-12-21 02:59:26,542] Trial 214 finished with value: inf and parameters: {'learning_rate': 0.6811581459303557, 'aft_loss_distributi                                                                     on': 'normal', 'aft_loss_distribution_scale': 1.6167685812719481, 'max_depth': 7, 'booster': 'dart', 'scale_pos_weight': 7.46213314236646                                                                     8, 'alpha': 6.8243892869016545, 'lambda': 7.439501486189558, 'eta': 0.9759620159127222, 'sampling_method': 'uniform', 'subsample': 0.4227                                                                     535031090282, 'gamma': 4.521063751302471}. Best is trial 188 with value: 4.348943369104032.
[I 2023-12-21 02:59:28,609] Trial 215 finished with value: 4.372385751888566 and parameters: {'learning_rate': 0.6949556912378487, 'aft_l                                                                     oss_distribution': 'normal', 'aft_loss_distribution_scale': 1.5747845743152458, 'max_depth': 7, 'booster': 'dart', 'scale_pos_weight': 7.                                                                     328628544838916, 'alpha': 7.417354142645207, 'lambda': 7.411087367811227, 'eta': 0.9629698193998116, 'sampling_method': 'uniform', 'subsa                                                                     mple': 0.7827697317628982, 'gamma': 3.6893566818548584}. Best is trial 188 with value: 4.348943369104032.
[I 2023-12-21 02:59:29,678] Trial 216 finished with value: inf and parameters: {'learning_rate': 0.7163883677832169, 'aft_loss_distributi                                                                     on': 'normal', 'aft_loss_distribution_scale': 1.3992586769142594, 'max_depth': 7, 'booster': 'dart', 'scale_pos_weight': 7.25633043205403                                                                     1, 'alpha': 7.45391895094856, 'lambda': 7.549955728114529, 'eta': 0.9660431901224122, 'sampling_method': 'uniform', 'subsample': 0.800840                                                                     8055669687, 'gamma': 3.717708039891441}. Best is trial 188 with value: 4.348943369104032.
[I 2023-12-21 02:59:34,436] Trial 217 finished with value: 4.395378253809305 and parameters: {'learning_rate': 0.6952175579534919, 'aft_l                                                                     oss_distribution': 'normal', 'aft_loss_distribution_scale': 1.6455252273960816, 'max_depth': 7, 'booster': 'dart', 'scale_pos_weight': 7.                                                                     517118117243275, 'alpha': 7.50903176397599, 'lambda': 7.990606851200254, 'eta': 0.9566843554712249, 'sampling_method': 'uniform', 'subsam                                                                     ple': 0.7783638367780223, 'gamma': 4.973215433037011}. Best is trial 188 with value: 4.348943369104032.
[I 2023-12-21 02:59:35,565] Trial 218 finished with value: inf and parameters: {'learning_rate': 0.6995361827464723, 'aft_loss_distributi                                                                     on': 'normal', 'aft_loss_distribution_scale': 1.1434165320301708, 'max_depth': 7, 'booster': 'dart', 'scale_pos_weight': 7.52456571105101                                                                     1, 'alpha': 6.996912501127472, 'lambda': 8.01283349920665, 'eta': 0.18660217988282057, 'sampling_method': 'uniform', 'subsample': 0.77475                                                                     00444751049, 'gamma': 5.008517999567024}. Best is trial 188 with value: 4.348943369104032.
[I 2023-12-21 02:59:36,845] Trial 219 finished with value: inf and parameters: {'learning_rate': 0.7296496785352944, 'aft_loss_distributi                                                                     on': 'normal', 'aft_loss_distribution_scale': 1.5535044380083154, 'max_depth': 7, 'booster': 'dart', 'scale_pos_weight': 7.41352502032317                                                                     9, 'alpha': 7.373402047790566, 'lambda': 7.803863777062199, 'eta': 0.9523101114171214, 'sampling_method': 'uniform', 'subsample': 0.78510                                                                     49818953488, 'gamma': 4.819642581291731}. Best is trial 188 with value: 4.348943369104032.
[I 2023-12-21 02:59:38,624] Trial 220 finished with value: inf and parameters: {'learning_rate': 0.6662952144311414, 'aft_loss_distributi                                                                     on': 'normal', 'aft_loss_distribution_scale': 1.3280766872932306, 'max_depth': 7, 'booster': 'dart', 'scale_pos_weight': 7.26612825102029                                                                     8, 'alpha': 7.666503430745615, 'lambda': 7.947170100021378, 'eta': 0.9594076901052092, 'sampling_method': 'uniform', 'subsample': 0.79436                                                                     10856891683, 'gamma': 4.508688066707068}. Best is trial 188 with value: 4.348943369104032.
[I 2023-12-21 02:59:43,743] Trial 221 finished with value: 4.4066495685041716 and parameters: {'learning_rate': 0.683345447933501, 'aft_l                                                                     oss_distribution': 'normal', 'aft_loss_distribution_scale': 1.6697844235849513, 'max_depth': 7, 'booster': 'dart', 'scale_pos_weight': 6.                                                                     792176083154837, 'alpha': 7.1012949054615095, 'lambda': 7.379873389790909, 'eta': 0.9805003556177918, 'sampling_method': 'uniform', 'subs                                                                     ample': 0.7342122167843993, 'gamma': 4.680134321032124}. Best is trial 188 with value: 4.348943369104032.
[I 2023-12-21 02:59:48,833] Trial 222 finished with value: 4.406031295541135 and parameters: {'learning_rate': 0.6922770984739621, 'aft_l                                                                     oss_distribution': 'normal', 'aft_loss_distribution_scale': 1.677426597974995, 'max_depth': 7, 'booster': 'dart', 'scale_pos_weight': 6.7                                                                     75152395720964, 'alpha': 7.17754803692644, 'lambda': 7.681208538934527, 'eta': 0.9705142696683797, 'sampling_method': 'uniform', 'subsamp                                                                     le': 0.7333104381039214, 'gamma': 5.486945432754541}. Best is trial 188 with value: 4.348943369104032.
[I 2023-12-21 02:59:51,611] Trial 223 finished with value: 4.388691882673428 and parameters: {'learning_rate': 0.6830357130920968, 'aft_l                                                                     oss_distribution': 'normal', 'aft_loss_distribution_scale': 1.6206479257754656, 'max_depth': 7, 'booster': 'dart', 'scale_pos_weight': 6.                                                                     803608746827746, 'alpha': 6.887173172917345, 'lambda': 7.690775873785431, 'eta': 0.9409996936901641, 'sampling_method': 'uniform', 'subsa                                                                     mple': 0.7164724347095188, 'gamma': 5.045365138062326}. Best is trial 188 with value: 4.348943369104032.
[I 2023-12-21 02:59:53,411] Trial 224 finished with value: inf and parameters: {'learning_rate': 0.6917456034954726, 'aft_loss_distributi                                                                     on': 'normal', 'aft_loss_distribution_scale': 1.6136188992844496, 'max_depth': 7, 'booster': 'dart', 'scale_pos_weight': 4.01104296012253                                                                     , 'alpha': 7.01947705414621, 'lambda': 7.682843880041356, 'eta': 0.9417918549039906, 'sampling_method': 'uniform', 'subsample': 0.7339601                                                                     314062119, 'gamma': 5.154901947647024}. Best is trial 188 with value: 4.348943369104032.
[I 2023-12-21 02:59:55,032] Trial 225 finished with value: inf and parameters: {'learning_rate': 0.7120581007296235, 'aft_loss_distributi                                                                     on': 'normal', 'aft_loss_distribution_scale': 1.5662957776844468, 'max_depth': 7, 'booster': 'dart', 'scale_pos_weight': 6.81046948886662                                                                     9, 'alpha': 7.12282704211432, 'lambda': 7.894084236532548, 'eta': 0.961192371210629, 'sampling_method': 'uniform', 'subsample': 0.6800146                                                                     698931907, 'gamma': 5.4872694446798125}. Best is trial 188 with value: 4.348943369104032.
[I 2023-12-21 02:59:56,260] Trial 226 finished with value: inf and parameters: {'learning_rate': 0.7269241774276307, 'aft_loss_distributi                                                                     on': 'normal', 'aft_loss_distribution_scale': 1.3807765729286219, 'max_depth': 7, 'booster': 'dart', 'scale_pos_weight': 6.67626579438337                                                                     1, 'alpha': 7.48889911432019, 'lambda': 7.6110817571064935, 'eta': 0.9378212852666566, 'sampling_method': 'uniform', 'subsample': 0.73085                                                                     18359943355, 'gamma': 4.866460119100384}. Best is trial 188 with value: 4.348943369104032.
[I 2023-12-21 02:59:56,301] Trial 227 pruned. Trial was pruned at iteration 0.
[I 2023-12-21 02:59:56,339] Trial 228 pruned. Trial was pruned at iteration 0.
[I 2023-12-21 02:59:57,684] Trial 229 finished with value: inf and parameters: {'learning_rate': 0.6824609916899892, 'aft_loss_distributi                                                                     on': 'normal', 'aft_loss_distribution_scale': 1.482489774126629, 'max_depth': 7, 'booster': 'dart', 'scale_pos_weight': 0.850732077366611                                                                     6, 'alpha': 7.334833952133669, 'lambda': 6.922365561294279, 'eta': 0.9794560075141435, 'sampling_method': 'uniform', 'subsample': 0.66159                                                                     32459723785, 'gamma': 4.45619258076251}. Best is trial 188 with value: 4.348943369104032.
[I 2023-12-21 03:00:13,185] Trial 230 finished with value: 4.403548073166343 and parameters: {'learning_rate': 0.7496903505795469, 'aft_l                                                                     oss_distribution': 'normal', 'aft_loss_distribution_scale': 1.6515946141554119, 'max_depth': 7, 'booster': 'dart', 'scale_pos_weight': 7.                                                                     2158907850886855, 'alpha': 6.829291072810857, 'lambda': 8.001563491582749, 'eta': 0.9418630201441021, 'sampling_method': 'uniform', 'subs                                                                     ample': 0.7082596481138649, 'gamma': 4.679672329830045}. Best is trial 188 with value: 4.348943369104032.
[I 2023-12-21 03:00:15,041] Trial 231 finished with value: inf and parameters: {'learning_rate': 0.7506055324696709, 'aft_loss_distributi                                                                     on': 'normal', 'aft_loss_distribution_scale': 1.6161201065783515, 'max_depth': 7, 'booster': 'dart', 'scale_pos_weight': 7.21860870196696                                                                     8, 'alpha': 7.152343669010599, 'lambda': 8.020327147366904, 'eta': 0.9389283060358262, 'sampling_method': 'uniform', 'subsample': 0.70105                                                                     67590719872, 'gamma': 4.676964674805008}. Best is trial 188 with value: 4.348943369104032.
[I 2023-12-21 03:00:15,080] Trial 232 pruned. Trial was pruned at iteration 0.
[I 2023-12-21 03:00:16,367] Trial 233 finished with value: inf and parameters: {'learning_rate': 0.716249892406453, 'aft_loss_distributio                                                                     n': 'normal', 'aft_loss_distribution_scale': 1.6137501733516175, 'max_depth': 7, 'booster': 'dart', 'scale_pos_weight': 7.401204026024731                                                                     , 'alpha': 6.919452749839632, 'lambda': 7.4028566558366755, 'eta': 0.9782790802191149, 'sampling_method': 'uniform', 'subsample': 0.72182                                                                     90103255196, 'gamma': 4.4247464002013}. Best is trial 188 with value: 4.348943369104032.
