[I 2023-12-18 22:57:31,060] Trial 64 finished with value: inf and parameters: {'learning_rate': 0.7430167914660217, 'aft_loss_distribution': 'normal', 'aft_loss_distribution_scale': 2.0209238148859203, 'max_depth': 5, 'booster': 'dart', 'scale_pos_weight': 4.369724010101358, 'alpha': 8.337392687573134, 'lambda': 0.3760397036331548, 'eta': 0.2922645475573481, 'sampling_method': 'gradient_based', 'subsample': 0.5325444206179597, 'gamma': 2.095372312578368}. Best is trial 34 with value: 4.418252807515928.
[I 2023-12-18 22:57:32,954] Trial 65 finished with value: inf and parameters: {'learning_rate': 0.8437417593614942, 'aft_loss_distribution': 'normal', 'aft_loss_distribution_scale': 1.2430521483786172, 'max_depth': 6, 'booster': 'dart', 'scale_pos_weight': 4.981010527529778, 'alpha': 8.955026687420402, 'lambda': 0.9372697887327008, 'eta': 0.40948244942231116, 'sampling_method': 'gradient_based', 'subsample': 0.6607745832303675, 'gamma': 2.554535789183777}. Best is trial 34 with value: 4.418252807515928.
[I 2023-12-18 22:57:33,049] Trial 66 pruned. Trial was pruned at iteration 0.
[I 2023-12-18 22:57:34,732] Trial 67 finished with value: inf and parameters: {'learning_rate': 0.879871311658932, 'aft_loss_distribution': 'normal', 'aft_loss_distribution_scale': 2.2287002416600052, 'max_depth': 6, 'booster': 'dart', 'scale_pos_weight': 4.631374865731886, 'alpha': 9.980817935549295, 'lambda': 1.171954941767371, 'eta': 0.32930022685057236, 'sampling_method': 'gradient_based', 'subsample': 0.724745221744618, 'gamma': 1.7327054674754216}. Best is trial 34 with value: 4.418252807515928.
[I 2023-12-18 22:57:34,793] Trial 68 pruned. Trial was pruned at iteration 0.
[I 2023-12-18 22:57:34,847] Trial 69 pruned. Trial was pruned at iteration 0.
[I 2023-12-18 22:57:34,907] Trial 70 pruned. Trial was pruned at iteration 0.
[I 2023-12-18 22:57:34,965] Trial 71 pruned. Trial was pruned at iteration 1.
[I 2023-12-18 22:57:42,573] Trial 72 finished with value: 4.4954734106178895 and parameters: {'learning_rate': 0.6735089237415505, 'aft_loss_distribution': 'normal', 'aft_loss_distribution_scale': 1.8938229970636966, 'max_depth': 5, 'booster': 'dart', 'scale_pos_weight': 3.3495309213533218, 'alpha': 7.712305606574818, 'lambda': 0.37246076632444536, 'eta': 0.6160628946147853, 'sampling_method': 'gradient_based', 'subsample': 0.49247402977302457, 'gamma': 2.0727534208290654}. Best is trial 34 with value: 4.418252807515928.
[I 2023-12-18 22:57:42,634] Trial 73 pruned. Trial was pruned at iteration 0.
[I 2023-12-18 22:57:46,407] Trial 74 finished with value: 4.5029644463367475 and parameters: {'learning_rate': 0.7300040925123699, 'aft_loss_distribution': 'normal', 'aft_loss_distribution_scale': 1.9148479170606902, 'max_depth': 5, 'booster': 'dart', 'scale_pos_weight': 4.115544663084018, 'alpha': 7.6998695967105615, 'lambda': 0.651906210385494, 'eta': 0.6223515771074183, 'sampling_method': 'gradient_based', 'subsample': 0.5250251493226001, 'gamma': 1.5840756663610436}. Best is trial 34 with value: 4.418252807515928.
[I 2023-12-18 22:57:46,514] Trial 75 pruned. Trial was pruned at iteration 0.
[I 2023-12-18 22:57:46,833] Trial 76 finished with value: 4.296629174417102 and parameters: {'learning_rate': 0.687919153921533, 'aft_loss_distribution': 'normal', 'aft_loss_distribution_scale': 1.2715457374370078, 'max_depth': 3, 'booster': 'gbtree', 'scale_pos_weight': 4.525427068760557, 'alpha': 7.813973352323221, 'lambda': 0.05043642764228895, 'eta': 0.6487471770577041, 'sampling_method': 'uniform', 'subsample': 0.5159074170892383, 'gamma': 2.1986463982833158}. Best is trial 76 with value: 4.296629174417102.
[I 2023-12-18 22:57:47,128] Trial 77 finished with value: inf and parameters: {'learning_rate': 0.6950992881505845, 'aft_loss_distribution': 'normal', 'aft_loss_distribution_scale': 1.2218709399181642, 'max_depth': 3, 'booster': 'gbtree', 'scale_pos_weight': 4.744192322695477, 'alpha': 7.701516083846921, 'lambda': 0.8518547670459728, 'eta': 0.7663191678593089, 'sampling_method': 'uniform', 'subsample': 0.5333069899125106, 'gamma': 1.6576978436229164}. Best is trial 76 with value: 4.296629174417102.
[I 2023-12-18 22:57:47,452] Trial 78 finished with value: 4.360456931833282 and parameters: {'learning_rate': 0.6358999652019313, 'aft_loss_distribution': 'normal', 'aft_loss_distribution_scale': 1.49905183090477, 'max_depth': 3, 'booster': 'gbtree', 'scale_pos_weight': 3.437660773272923, 'alpha': 6.979981747961463, 'lambda': 0.05675204090154995, 'eta': 0.6618682483761311, 'sampling_method': 'uniform', 'subsample': 0.6330704158985835, 'gamma': 2.214380470495338}. Best is trial 76 with value: 4.296629174417102.
[I 2023-12-18 22:57:47,989] Trial 79 finished with value: 4.494259820816597 and parameters: {'learning_rate': 0.6533453041970774, 'aft_loss_distribution': 'normal', 'aft_loss_distribution_scale': 1.8914683689212497, 'max_depth': 3, 'booster': 'gbtree', 'scale_pos_weight': 4.013311648181382, 'alpha': 6.953341379302371, 'lambda': 0.14230855218750782, 'eta': 0.6695249215355729, 'sampling_method': 'uniform', 'subsample': 0.6310348938970942, 'gamma': 0.738818470504341}. Best is trial 76 with value: 4.296629174417102.
[I 2023-12-18 22:57:48,050] Trial 80 pruned. Trial was pruned at iteration 0.
[I 2023-12-18 22:57:48,278] Trial 81 finished with value: inf and parameters: {'learning_rate': 0.6525620084153494, 'aft_loss_distribution': 'normal', 'aft_loss_distribution_scale': 1.4881712249857408, 'max_depth': 3, 'booster': 'gbtree', 'scale_pos_weight': 3.373166644845215, 'alpha': 6.941468305483158, 'lambda': 0.7031183921432304, 'eta': 0.7049265448773998, 'sampling_method': 'uniform', 'subsample': 0.7030390444337142, 'gamma': 0.0063050017638270894}. Best is trial 76 with value: 4.296629174417102.
[I 2023-12-18 22:57:48,343] Trial 82 pruned. Trial was pruned at iteration 0.
[I 2023-12-18 22:57:48,581] Trial 83 finished with value: 4.509081629810797 and parameters: {'learning_rate': 0.6642023826195617, 'aft_loss_distribution': 'normal', 'aft_loss_distribution_scale': 1.9357719323861076, 'max_depth': 3, 'booster': 'gbtree', 'scale_pos_weight': 2.8327122010068893, 'alpha': 5.948745106515412, 'lambda': 0.649707954972002, 'eta': 0.7292786574842584, 'sampling_method': 'uniform', 'subsample': 0.6653545506042844, 'gamma': 1.0865263371451765}. Best is trial 76 with value: 4.296629174417102.
[I 2023-12-18 22:57:48,642] Trial 84 pruned. Trial was pruned at iteration 0.
[I 2023-12-18 22:57:48,704] Trial 85 pruned. Trial was pruned at iteration 0.
[I 2023-12-18 22:57:48,758] Trial 86 pruned. Trial was pruned at iteration 0.
[I 2023-12-18 22:57:48,954] Trial 87 finished with value: inf and parameters: {'learning_rate': 0.697181310100411, 'aft_loss_distribution': 'normal', 'aft_loss_distribution_scale': 1.2619771945959515, 'max_depth': 4, 'booster': 'gbtree', 'scale_pos_weight': 3.989642210908564, 'alpha': 6.754793061062428, 'lambda': 0.04889792422697156, 'eta': 0.7244807612110635, 'sampling_method': 'uniform', 'subsample': 0.5852115934849592, 'gamma': 1.961589337098766}. Best is trial 76 with value: 4.296629174417102.
[I 2023-12-18 22:57:49,013] Trial 88 pruned. Trial was pruned at iteration 0.
[I 2023-12-18 22:57:49,068] Trial 89 pruned. Trial was pruned at iteration 0.
[I 2023-12-18 22:57:49,138] Trial 90 pruned. Trial was pruned at iteration 0.
[I 2023-12-18 22:57:49,200] Trial 91 pruned. Trial was pruned at iteration 1.
[I 2023-12-18 22:57:49,258] Trial 92 pruned. Trial was pruned at iteration 1.
[I 2023-12-18 22:57:49,452] Trial 93 finished with value: inf and parameters: {'learning_rate': 0.684763142213801, 'aft_loss_distribution': 'normal', 'aft_loss_distribution_scale': 1.3561722045575406, 'max_depth': 3, 'booster': 'gbtree', 'scale_pos_weight': 3.1233243534711566, 'alpha': 7.405731120641921, 'lambda': 1.0486762317159124, 'eta': 0.6249264042381482, 'sampling_method': 'uniform', 'subsample': 0.5082203658347869, 'gamma': 2.164364287608658}. Best is trial 76 with value: 4.296629174417102.
[I 2023-12-18 22:57:49,510] Trial 94 pruned. Trial was pruned at iteration 0.
[I 2023-12-18 22:57:49,567] Trial 95 pruned. Trial was pruned at iteration 0.
[I 2023-12-18 22:57:49,767] Trial 96 finished with value: inf and parameters: {'learning_rate': 0.7406430596068131, 'aft_loss_distribution': 'normal', 'aft_loss_distribution_scale': 1.7728491737257595, 'max_depth': 5, 'booster': 'gbtree', 'scale_pos_weight': 4.909869572321185, 'alpha': 6.596124123387705, 'lambda': 0.019787054571054098, 'eta': 0.701315905253923, 'sampling_method': 'uniform', 'subsample': 0.5452873103251827, 'gamma': 1.8960638829428256}. Best is trial 76 with value: 4.296629174417102.
[I 2023-12-18 22:57:49,833] Trial 97 pruned. Trial was pruned at iteration 0.
[I 2023-12-18 22:57:49,892] Trial 98 pruned. Trial was pruned at iteration 0.
[I 2023-12-18 22:57:50,104] Trial 99 finished with value: inf and parameters: {'learning_rate': 0.712617154740055, 'aft_loss_distribution': 'normal', 'aft_loss_distribution_scale': 1.5679623460820173, 'max_depth': 3, 'booster': 'gbtree', 'scale_pos_weight': 7.978294464651294, 'alpha': 6.313081522068979, 'lambda': 0.2864901738988334, 'eta': 0.7907706501513802, 'sampling_method': 'uniform', 'subsample': 0.6004519875579022, 'gamma': 2.6259963077351394}. Best is trial 76 with value: 4.296629174417102.
[I 2023-12-18 22:57:50,177] Trial 100 pruned. Trial was pruned at iteration 0.
[I 2023-12-18 22:57:55,966] Trial 101 finished with value: 4.562334808766421 and parameters: {'learning_rate': 0.6759472634926802, 'aft_loss_distribution': 'normal', 'aft_loss_distribution_scale': 2.0883347826480008, 'max_depth': 7, 'booster': 'dart', 'scale_pos_weight': 4.487128009201293, 'alpha': 9.139935817457383, 'lambda': 0.5705647034019412, 'eta': 0.66223481842644, 'sampling_method': 'gradient_based', 'subsample': 0.50826859251865, 'gamma': 5.596982549856307}. Best is trial 76 with value: 4.296629174417102.
[I 2023-12-18 22:57:57,496] Trial 102 finished with value: inf and parameters: {'learning_rate': 0.6717870654542809, 'aft_loss_distribution': 'normal', 'aft_loss_distribution_scale': 1.9341842942403336, 'max_depth': 10, 'booster': 'dart', 'scale_pos_weight': 4.508587862134925, 'alpha': 9.133032247456818, 'lambda': 0.5425123540326839, 'eta': 0.6815545501415492, 'sampling_method': 'gradient_based', 'subsample': 0.5047782563398845, 'gamma': 5.684574251173959}. Best is trial 76 with value: 4.296629174417102.
[I 2023-12-18 22:57:57,556] Trial 103 pruned. Trial was pruned at iteration 0.
[I 2023-12-18 22:57:57,614] Trial 104 pruned. Trial was pruned at iteration 0.
[I 2023-12-18 22:58:03,235] Trial 105 finished with value: 4.439968130664754 and parameters: {'learning_rate': 0.7596297266117262, 'aft_loss_distribution': 'normal', 'aft_loss_distribution_scale': 1.7346130872425138, 'max_depth': 5, 'booster': 'dart', 'scale_pos_weight': 3.558942967592879, 'alpha': 7.526678883907016, 'lambda': 0.7590462270533462, 'eta': 0.6234412586718326, 'sampling_method': 'uniform', 'subsample': 0.5383917743362373, 'gamma': 5.239696809220722}. Best is trial 76 with value: 4.296629174417102.
[I 2023-12-18 22:58:05,038] Trial 106 finished with value: inf and parameters: {'learning_rate': 0.8367643407818124, 'aft_loss_distribution': 'normal', 'aft_loss_distribution_scale': 1.7469502438290128, 'max_depth': 5, 'booster': 'dart', 'scale_pos_weight': 3.5166567485017683, 'alpha': 7.477458586897154, 'lambda': 1.344606671778592, 'eta': 0.6124108668411751, 'sampling_method': 'uniform', 'subsample': 0.4151400770928132, 'gamma': 5.1129170303955656}. Best is trial 76 with value: 4.296629174417102.
[I 2023-12-18 22:58:06,413] Trial 107 finished with value: inf and parameters: {'learning_rate': 0.7670096643658088, 'aft_loss_distribution': 'normal', 'aft_loss_distribution_scale': 1.3553473131003348, 'max_depth': 5, 'booster': 'dart', 'scale_pos_weight': 2.86526637168744, 'alpha': 7.847621441560666, 'lambda': 1.9395055795153433, 'eta': 0.637789929766457, 'sampling_method': 'uniform', 'subsample': 0.6307286509266442, 'gamma': 5.5514440313629265}. Best is trial 76 with value: 4.296629174417102.
[I 2023-12-18 22:58:06,476] Trial 108 pruned. Trial was pruned at iteration 0.
[I 2023-12-18 22:58:06,532] Trial 109 pruned. Trial was pruned at iteration 0.
[I 2023-12-18 22:58:06,591] Trial 110 pruned. Trial was pruned at iteration 0.
[I 2023-12-18 22:58:07,978] Trial 111 finished with value: inf and parameters: {'learning_rate': 0.7231784500530128, 'aft_loss_distribution': 'normal', 'aft_loss_distribution_scale': 1.986152405192256, 'max_depth': 6, 'booster': 'dart', 'scale_pos_weight': 4.335360080498642, 'alpha': 8.137409924987296, 'lambda': 0.422418687898597, 'eta': 0.7153465795312544, 'sampling_method': 'gradient_based', 'subsample': 0.5438990648834131, 'gamma': 1.0044790138398345}. Best is trial 76 with value: 4.296629174417102.
[I 2023-12-18 22:58:08,044] Trial 112 pruned. Trial was pruned at iteration 1.
[I 2023-12-18 22:58:09,620] Trial 113 finished with value: inf and parameters: {'learning_rate': 0.7948503984135662, 'aft_loss_distribution': 'normal', 'aft_loss_distribution_scale': 1.6119607975056018, 'max_depth': 6, 'booster': 'dart', 'scale_pos_weight': 4.121167799121842, 'alpha': 7.302490206220937, 'lambda': 0.2263352927756448, 'eta': 0.631899326065626, 'sampling_method': 'gradient_based', 'subsample': 0.5729111077835761, 'gamma': 0.6730367090877353}. Best is trial 76 with value: 4.296629174417102.
[I 2023-12-18 22:58:09,683] Trial 114 pruned. Trial was pruned at iteration 0.
[I 2023-12-18 22:58:11,535] Trial 115 finished with value: inf and parameters: {'learning_rate': 0.7731786045796302, 'aft_loss_distribution': 'normal', 'aft_loss_distribution_scale': 1.8566614780658022, 'max_depth': 5, 'booster': 'dart', 'scale_pos_weight': 3.037756419538459, 'alpha': 7.662459318715102, 'lambda': 0.9111888677557631, 'eta': 0.551331480619684, 'sampling_method': 'gradient_based', 'subsample': 0.671275252138306, 'gamma': 4.723827940549795}. Best is trial 76 with value: 4.296629174417102.
[I 2023-12-18 22:58:13,729] Trial 116 finished with value: inf and parameters: {'learning_rate': 0.6795783176090097, 'aft_loss_distribution': 'normal', 'aft_loss_distribution_scale': 1.61241560427487, 'max_depth': 6, 'booster': 'dart', 'scale_pos_weight': 3.3162719915884002, 'alpha': 7.848014194527704, 'lambda': 0.3449130806977104, 'eta': 0.5223631669429781, 'sampling_method': 'uniform', 'subsample': 0.5013176298420557, 'gamma': 5.3948674712653}. Best is trial 76 with value: 4.296629174417102.
[I 2023-12-18 22:58:13,834] Trial 117 pruned. Trial was pruned at iteration 0.
[I 2023-12-18 22:58:13,939] Trial 118 pruned. Trial was pruned at iteration 0.
[I 2023-12-18 22:58:16,257] Trial 119 finished with value: inf and parameters: {'learning_rate': 0.7093496488865979, 'aft_loss_distribution': 'normal', 'aft_loss_distribution_scale': 1.3615978510211297, 'max_depth': 6, 'booster': 'dart', 'scale_pos_weight': 5.036043520610228, 'alpha': 8.560671827985006, 'lambda': 0.18649671648102956, 'eta': 0.6538124302743387, 'sampling_method': 'uniform', 'subsample': 0.4692104422800845, 'gamma': 2.0464618860133337}. Best is trial 76 with value: 4.296629174417102.
[I 2023-12-18 22:58:16,347] Trial 120 pruned. Trial was pruned at iteration 0.
[I 2023-12-18 22:58:16,441] Trial 121 pruned. Trial was pruned at iteration 1.
[I 2023-12-18 22:58:16,551] Trial 122 pruned. Trial was pruned at iteration 0.
[I 2023-12-18 22:58:16,643] Trial 123 pruned. Trial was pruned at iteration 1.
[I 2023-12-18 22:58:18,084] Trial 124 finished with value: inf and parameters: {'learning_rate': 0.857948261281916, 'aft_loss_distribution': 'normal', 'aft_loss_distribution_scale': 1.8081723947705313, 'max_depth': 3, 'booster': 'dart', 'scale_pos_weight': 4.847343456431803, 'alpha': 8.936764654369814, 'lambda': 0.3977556323282556, 'eta': 0.6009081850754211, 'sampling_method': 'gradient_based', 'subsample': 0.4342308498246909, 'gamma': 2.8562937807661957}. Best is trial 76 with value: 4.296629174417102.
[I 2023-12-18 22:58:18,163] Trial 125 pruned. Trial was pruned at iteration 1.
[I 2023-12-18 22:58:21,276] Trial 126 finished with value: 4.388000770281388 and parameters: {'learning_rate': 0.7009906547784023, 'aft_loss_distribution': 'normal', 'aft_loss_distribution_scale': 1.5829495405878313, 'max_depth': 7, 'booster': 'dart', 'scale_pos_weight': 3.8888037333555965, 'alpha': 8.399930456508702, 'lambda': 1.4893471131915699, 'eta': 0.6991235011385499, 'sampling_method': 'uniform', 'subsample': 0.5525929225725493, 'gamma': 3.7864621066018533}. Best is trial 76 with value: 4.296629174417102.
[I 2023-12-18 22:58:21,338] Trial 127 pruned. Trial was pruned at iteration 0.
[I 2023-12-18 22:58:21,400] Trial 128 pruned. Trial was pruned at iteration 0.
[I 2023-12-18 22:58:21,460] Trial 129 pruned. Trial was pruned at iteration 0.
[I 2023-12-18 22:58:21,712] Trial 130 finished with value: 4.428660898063701 and parameters: {'learning_rate': 0.7287912732125099, 'aft_loss_distribution': 'normal', 'aft_loss_distribution_scale': 1.70260445973093, 'max_depth': 6, 'booster': 'gbtree', 'scale_pos_weight': 3.7211606541733464, 'alpha': 6.887180602214423, 'lambda': 0.583677327256259, 'eta': 0.7306502292328172, 'sampling_method': 'uniform', 'subsample': 0.5268593172835393, 'gamma': 4.866924512388294}. Best is trial 76 with value: 4.296629174417102.
[I 2023-12-18 22:58:21,925] Trial 131 finished with value: inf and parameters: {'learning_rate': 0.715477433767994, 'aft_loss_distribution': 'normal', 'aft_loss_distribution_scale': 1.6673911884941734, 'max_depth': 6, 'booster': 'gbtree', 'scale_pos_weight': 3.5643194564712557, 'alpha': 6.6715344986159835, 'lambda': 0.49637214820958986, 'eta': 0.7659242181866752, 'sampling_method': 'uniform', 'subsample': 0.5386804068185582, 'gamma': 4.839344605305593}. Best is trial 76 with value: 4.296629174417102.
[I 2023-12-18 22:58:22,175] Trial 132 finished with value: inf and parameters: {'learning_rate': 0.7294623765479161, 'aft_loss_distribution': 'normal', 'aft_loss_distribution_scale': 1.324625275529006, 'max_depth': 6, 'booster': 'gbtree', 'scale_pos_weight': 3.973394769815496, 'alpha': 6.857650545012085, 'lambda': 0.31349102779410754, 'eta': 0.7459005419623478, 'sampling_method': 'uniform', 'subsample': 0.5284687987537815, 'gamma': 2.607096152025773}. Best is trial 76 with value: 4.296629174417102.
[I 2023-12-18 22:58:22,242] Trial 133 pruned. Trial was pruned at iteration 0.
[I 2023-12-18 22:58:22,510] Trial 134 finished with value: 4.483728576116059 and parameters: {'learning_rate': 0.7587085780768521, 'aft_loss_distribution': 'normal', 'aft_loss_distribution_scale': 1.8603862794852875, 'max_depth': 6, 'booster': 'gbtree', 'scale_pos_weight': 3.2716635696921768, 'alpha': 7.543817492552423, 'lambda': 0.7196588433457047, 'eta': 0.7247545704940023, 'sampling_method': 'uniform', 'subsample': 0.4952016240520143, 'gamma': 2.988665345751419}. Best is trial 76 with value: 4.296629174417102.
[I 2023-12-18 22:58:22,729] Trial 135 finished with value: inf and parameters: {'learning_rate': 0.7641009460631528, 'aft_loss_distribution': 'normal', 'aft_loss_distribution_scale': 1.1284978533230738, 'max_depth': 5, 'booster': 'gbtree', 'scale_pos_weight': 2.8275369108375212, 'alpha': 7.571265471563679, 'lambda': 0.787252303764287, 'eta': 0.7069301821766351, 'sampling_method': 'uniform', 'subsample': 0.46411211946247294, 'gamma': 3.0033986738686265}. Best is trial 76 with value: 4.296629174417102.
[I 2023-12-18 22:58:22,792] Trial 136 pruned. Trial was pruned at iteration 0.
[I 2023-12-18 22:58:22,850] Trial 137 pruned. Trial was pruned at iteration 0.
[I 2023-12-18 22:58:22,909] Trial 138 pruned. Trial was pruned at iteration 0.
[I 2023-12-18 22:58:22,968] Trial 139 pruned. Trial was pruned at iteration 0.
[I 2023-12-18 22:58:23,033] Trial 140 pruned. Trial was pruned at iteration 0.
[I 2023-12-18 22:58:23,097] Trial 141 pruned. Trial was pruned at iteration 0.
[I 2023-12-18 22:58:23,160] Trial 142 pruned. Trial was pruned at iteration 0.
[I 2023-12-18 22:58:23,235] Trial 143 pruned. Trial was pruned at iteration 1.
[I 2023-12-18 22:58:23,311] Trial 144 pruned. Trial was pruned at iteration 0.
[I 2023-12-18 22:58:30,071] Trial 145 finished with value: 4.447113931622112 and parameters: {'learning_rate': 0.7377011657629537, 'aft_loss_distribution': 'normal', 'aft_loss_distribution_scale': 1.7562921107523461, 'max_depth': 6, 'booster': 'dart', 'scale_pos_weight': 2.9863413710357314, 'alpha': 8.101209239939934, 'lambda': 0.8737378403345476, 'eta': 0.6722954820373638, 'sampling_method': 'uniform', 'subsample': 0.51871901969425, 'gamma': 2.6524130711772473}. Best is trial 76 with value: 4.296629174417102.
[I 2023-12-18 22:58:36,318] Trial 146 finished with value: 4.316836526409914 and parameters: {'learning_rate': 0.761698079125216, 'aft_loss_distribution': 'normal', 'aft_loss_distribution_scale': 1.3620057667412129, 'max_depth': 6, 'booster': 'dart', 'scale_pos_weight': 3.097667700158184, 'alpha': 8.144662759296114, 'lambda': 0.7757680453202477, 'eta': 0.6238569378258129, 'sampling_method': 'uniform', 'subsample': 0.5045202738449943, 'gamma': 2.8351413224296187}. Best is trial 76 with value: 4.296629174417102.
[I 2023-12-18 22:58:36,654] Trial 147 finished with value: 4.301203190218109 and parameters: {'learning_rate': 0.7588012835058746, 'aft_loss_distribution': 'normal', 'aft_loss_distribution_scale': 1.2851633657393609, 'max_depth': 7, 'booster': 'gbtree', 'scale_pos_weight': 3.056600238543663, 'alpha': 9.752989789433625, 'lambda': 0.9786518567238633, 'eta': 0.6413188860787779, 'sampling_method': 'uniform', 'subsample': 0.5112143145888558, 'gamma': 3.756373121944177}. Best is trial 76 with value: 4.296629174417102.
