[I 2023-12-18 22:53:01,766] Trial 282 finished with value: 4.326363065721449 and parameters: {'learning_rate': 0.2009539876934223, 'aft_loss_distribution': 'logistic', 'aft_loss_distribution_scale': 0.8555087868689037, 'max_depth': 8, 'booster': 'gbtree', 'scale_pos_weight': 8.55320346172972, 'alpha': 9.19271353794754, 'lambda': 2.2997250668119724, 'eta': 0.9228980809089071, 'sampling_method': 'uniform', 'subsample': 0.6102116902154545, 'gamma': 9.11392407656189}. Best is trial 34 with value: 4.30679442519153.
[I 2023-12-18 22:53:02,434] Trial 283 pruned. Trial was pruned at iteration 294.
[I 2023-12-18 22:53:02,511] Trial 284 pruned. Trial was pruned at iteration 0.
[I 2023-12-18 22:53:02,585] Trial 285 pruned. Trial was pruned at iteration 0.
[I 2023-12-18 22:53:02,659] Trial 286 pruned. Trial was pruned at iteration 0.
[I 2023-12-18 22:53:02,737] Trial 287 pruned. Trial was pruned at iteration 0.
[I 2023-12-18 22:53:02,819] Trial 288 pruned. Trial was pruned at iteration 0.
[I 2023-12-18 22:53:02,903] Trial 289 pruned. Trial was pruned at iteration 0.
[I 2023-12-18 22:53:03,016] Trial 290 pruned. Trial was pruned at iteration 0.
[I 2023-12-18 22:53:03,091] Trial 291 pruned. Trial was pruned at iteration 0.
[I 2023-12-18 22:53:03,168] Trial 292 pruned. Trial was pruned at iteration 0.
[I 2023-12-18 22:53:03,251] Trial 293 pruned. Trial was pruned at iteration 0.
[I 2023-12-18 22:53:03,323] Trial 294 pruned. Trial was pruned at iteration 0.
[I 2023-12-18 22:53:03,409] Trial 295 pruned. Trial was pruned at iteration 0.
[I 2023-12-18 22:53:03,730] Trial 296 finished with value: 4.327719346276689 and parameters: {'learning_rate': 0.21679568633678, 'aft_loss_distribution': 'logistic', 'aft_loss_distribution_scale': 0.8644222043329389, 'max_depth': 7, 'booster': 'gbtree', 'scale_pos_weight': 7.904476302958, 'alpha': 8.876547449108212, 'lambda': 3.044530669172952, 'eta': 0.8894464907750081, 'sampling_method': 'uniform', 'subsample': 0.6219676752768275, 'gamma': 9.291746806572156}. Best is trial 34 with value: 4.30679442519153.
[I 2023-12-18 22:53:03,812] Trial 297 pruned. Trial was pruned at iteration 0.
[I 2023-12-18 22:53:04,064] Trial 298 finished with value: 4.294202308464259 and parameters: {'learning_rate': 0.19987788240790189, 'aft_loss_distribution': 'logistic', 'aft_loss_distribution_scale': 0.8052433806404244, 'max_depth': 7, 'booster': 'gbtree', 'scale_pos_weight': 8.241013226499392, 'alpha': 8.938684498100864, 'lambda': 3.352239408251223, 'eta': 0.9255527680348029, 'sampling_method': 'uniform', 'subsample': 0.5970968771928354, 'gamma': 9.409826508058337}. Best is trial 298 with value: 4.294202308464259.
[I 2023-12-18 22:53:04,147] Trial 299 pruned. Trial was pruned at iteration 0.
[I 2023-12-18 22:53:04,218] Trial 300 pruned. Trial was pruned at iteration 0.
[I 2023-12-18 22:53:04,304] Trial 301 pruned. Trial was pruned at iteration 0.
[I 2023-12-18 22:53:05,054] Trial 302 pruned. Trial was pruned at iteration 294.
[I 2023-12-18 22:53:05,177] Trial 303 pruned. Trial was pruned at iteration 0.
[I 2023-12-18 22:53:05,297] Trial 304 pruned. Trial was pruned at iteration 0.
[I 2023-12-18 22:53:05,428] Trial 305 pruned. Trial was pruned at iteration 0.
[I 2023-12-18 22:53:06,072] Trial 306 finished with value: 4.2826240317897355 and parameters: {'learning_rate': 0.12859469927910086, 'aft_loss_distribution': 'logistic', 'aft_loss_distribution_scale': 0.7790701759173531, 'max_depth': 7, 'booster': 'gbtree', 'scale_pos_weight': 8.858099896436224, 'alpha': 9.974652570213655, 'lambda': 4.390161807532291, 'eta': 0.5854497050099363, 'sampling_method': 'uniform', 'subsample': 0.6040891275938233, 'gamma': 8.619351716243694}. Best is trial 306 with value: 4.2826240317897355.
[I 2023-12-18 22:53:06,208] Trial 307 pruned. Trial was pruned at iteration 0.
[I 2023-12-18 22:53:06,342] Trial 308 pruned. Trial was pruned at iteration 0.
[I 2023-12-18 22:53:06,472] Trial 309 pruned. Trial was pruned at iteration 0.
[I 2023-12-18 22:53:06,598] Trial 310 pruned. Trial was pruned at iteration 0.
[I 2023-12-18 22:53:07,490] Trial 311 pruned. Trial was pruned at iteration 294.
[I 2023-12-18 22:53:07,623] Trial 312 pruned. Trial was pruned at iteration 0.
[I 2023-12-18 22:53:07,742] Trial 313 pruned. Trial was pruned at iteration 0.
[I 2023-12-18 22:53:07,863] Trial 314 pruned. Trial was pruned at iteration 0.
[I 2023-12-18 22:53:07,998] Trial 315 pruned. Trial was pruned at iteration 0.
[I 2023-12-18 22:53:08,968] Trial 316 finished with value: 4.301185506613201 and parameters: {'learning_rate': 0.19684717540643887, 'aft_loss_distribution': 'logistic', 'aft_loss_distribution_scale': 0.8106780338858136, 'max_depth': 7, 'booster': 'gbtree', 'scale_pos_weight': 8.216666205575995, 'alpha': 9.765999616713314, 'lambda': 4.639172417304578, 'eta': 0.5263514793634829, 'sampling_method': 'uniform', 'subsample': 0.6199744443944645, 'gamma': 9.995883268390203}. Best is trial 306 with value: 4.2826240317897355.
[I 2023-12-18 22:53:09,097] Trial 317 pruned. Trial was pruned at iteration 0.
[I 2023-12-18 22:53:09,232] Trial 318 pruned. Trial was pruned at iteration 0.
[I 2023-12-18 22:53:09,357] Trial 319 pruned. Trial was pruned at iteration 0.
[I 2023-12-18 22:53:09,482] Trial 320 pruned. Trial was pruned at iteration 0.
[I 2023-12-18 22:53:09,600] Trial 321 pruned. Trial was pruned at iteration 0.
[I 2023-12-18 22:53:10,194] Trial 322 finished with value: 4.2874159692630425 and parameters: {'learning_rate': 0.18832902451299383, 'aft_loss_distribution': 'logistic', 'aft_loss_distribution_scale': 0.7925728595625723, 'max_depth': 7, 'booster': 'gbtree', 'scale_pos_weight': 9.275613728669082, 'alpha': 8.864238023807708, 'lambda': 5.1470661936548945, 'eta': 0.8056557829556464, 'sampling_method': 'uniform', 'subsample': 0.653547304209635, 'gamma': 8.165823635446106}. Best is trial 306 with value: 4.2826240317897355.
[I 2023-12-18 22:53:10,278] Trial 323 pruned. Trial was pruned at iteration 0.
[I 2023-12-18 22:53:10,353] Trial 324 pruned. Trial was pruned at iteration 0.
[I 2023-12-18 22:53:10,429] Trial 325 pruned. Trial was pruned at iteration 0.
[I 2023-12-18 22:53:10,524] Trial 326 pruned. Trial was pruned at iteration 0.
[I 2023-12-18 22:53:10,600] Trial 327 pruned. Trial was pruned at iteration 0.
[I 2023-12-18 22:53:11,268] Trial 328 pruned. Trial was pruned at iteration 294.
[I 2023-12-18 22:53:11,368] Trial 329 pruned. Trial was pruned at iteration 0.
[I 2023-12-18 22:53:11,448] Trial 330 pruned. Trial was pruned at iteration 0.
[I 2023-12-18 22:53:11,531] Trial 331 pruned. Trial was pruned at iteration 0.
[I 2023-12-18 22:53:11,611] Trial 332 pruned. Trial was pruned at iteration 0.
[I 2023-12-18 22:53:11,685] Trial 333 pruned. Trial was pruned at iteration 0.
[I 2023-12-18 22:53:11,778] Trial 334 pruned. Trial was pruned at iteration 0.
[I 2023-12-18 22:53:11,857] Trial 335 pruned. Trial was pruned at iteration 0.
[I 2023-12-18 22:53:11,945] Trial 336 pruned. Trial was pruned at iteration 0.
[I 2023-12-18 22:53:12,025] Trial 337 pruned. Trial was pruned at iteration 0.
[I 2023-12-18 22:53:12,429] Trial 338 pruned. Trial was pruned at iteration 161.
[I 2023-12-18 22:53:12,511] Trial 339 pruned. Trial was pruned at iteration 0.
[I 2023-12-18 22:53:12,589] Trial 340 pruned. Trial was pruned at iteration 0.
[I 2023-12-18 22:53:12,664] Trial 341 pruned. Trial was pruned at iteration 0.
[I 2023-12-18 22:53:12,753] Trial 342 pruned. Trial was pruned at iteration 0.
[I 2023-12-18 22:53:12,842] Trial 343 pruned. Trial was pruned at iteration 0.
[I 2023-12-18 22:53:12,925] Trial 344 pruned. Trial was pruned at iteration 0.
[I 2023-12-18 22:53:13,017] Trial 345 pruned. Trial was pruned at iteration 0.
[I 2023-12-18 22:53:13,103] Trial 346 pruned. Trial was pruned at iteration 0.
[I 2023-12-18 22:53:13,185] Trial 347 pruned. Trial was pruned at iteration 0.
[I 2023-12-18 22:53:13,275] Trial 348 pruned. Trial was pruned at iteration 0.
[I 2023-12-18 22:53:13,361] Trial 349 pruned. Trial was pruned at iteration 0.
[I 2023-12-18 22:53:13,444] Trial 350 pruned. Trial was pruned at iteration 0.
[I 2023-12-18 22:53:13,525] Trial 351 pruned. Trial was pruned at iteration 0.
[I 2023-12-18 22:53:13,608] Trial 352 pruned. Trial was pruned at iteration 0.
[I 2023-12-18 22:53:13,688] Trial 353 pruned. Trial was pruned at iteration 0.
[I 2023-12-18 22:53:13,780] Trial 354 pruned. Trial was pruned at iteration 0.
[I 2023-12-18 22:53:13,860] Trial 355 pruned. Trial was pruned at iteration 0.
[I 2023-12-18 22:53:14,220] Trial 356 finished with value: 4.3477441863427435 and parameters: {'learning_rate': 0.2644788265592075, 'aft_loss_distribution': 'logistic', 'aft_loss_distribution_scale': 0.9223419142321629, 'max_depth': 5, 'booster': 'gbtree', 'scale_pos_weight': 8.112364980227577, 'alpha': 1.0294564196237286, 'lambda': 3.4161029591614835, 'eta': 0.9922234779430182, 'sampling_method': 'uniform', 'subsample': 0.838999316361714, 'gamma': 7.500144405805737}. Best is trial 306 with value: 4.2826240317897355.
[I 2023-12-18 22:53:14,315] Trial 357 pruned. Trial was pruned at iteration 0.
[I 2023-12-18 22:53:14,393] Trial 358 pruned. Trial was pruned at iteration 0.
[I 2023-12-18 22:53:14,478] Trial 359 pruned. Trial was pruned at iteration 0.
[I 2023-12-18 22:53:14,573] Trial 360 pruned. Trial was pruned at iteration 0.
[I 2023-12-18 22:53:53,199] Trial 361 finished with value: 4.252948890054525 and parameters: {'learning_rate': 0.14556897091562926, 'aft_loss_distribution': 'logistic', 'aft_loss_distribution_scale': 0.7458350238836285, 'max_depth': 5, 'booster': 'dart', 'scale_pos_weight': 9.210173166377784, 'alpha': 1.3538354180766223, 'lambda': 5.896130578706832, 'eta': 0.9466685121705658, 'sampling_method': 'uniform', 'subsample': 0.6640866650928995, 'gamma': 7.245633854233718}. Best is trial 361 with value: 4.252948890054525.
[I 2023-12-18 22:53:53,476] Trial 362 pruned. Trial was pruned at iteration 0.
[I 2023-12-18 22:53:53,680] Trial 363 pruned. Trial was pruned at iteration 0.
[I 2023-12-18 22:53:53,904] Trial 364 pruned. Trial was pruned at iteration 0.
[I 2023-12-18 22:53:54,164] Trial 365 pruned. Trial was pruned at iteration 0.
[I 2023-12-18 22:53:54,342] Trial 366 pruned. Trial was pruned at iteration 0.
[I 2023-12-18 22:54:31,478] Trial 367 finished with value: 4.288289755656505 and parameters: {'learning_rate': 0.17792601247416268, 'aft_loss_distribution': 'logistic', 'aft_loss_distribution_scale': 0.826520487876915, 'max_depth': 5, 'booster': 'dart', 'scale_pos_weight': 9.03130434143326, 'alpha': 1.471392057461836, 'lambda': 4.674923091258105, 'eta': 0.9680185622529133, 'sampling_method': 'uniform', 'subsample': 0.6796594760874387, 'gamma': 6.725368682135407}. Best is trial 361 with value: 4.252948890054525.
[I 2023-12-18 22:54:31,565] Trial 368 pruned. Trial was pruned at iteration 0.
[I 2023-12-18 22:54:31,653] Trial 369 pruned. Trial was pruned at iteration 0.
[I 2023-12-18 22:54:31,736] Trial 370 pruned. Trial was pruned at iteration 0.
[I 2023-12-18 22:54:31,821] Trial 371 pruned. Trial was pruned at iteration 0.
[I 2023-12-18 22:54:31,914] Trial 372 pruned. Trial was pruned at iteration 0.
[I 2023-12-18 22:54:32,002] Trial 373 pruned. Trial was pruned at iteration 0.
[I 2023-12-18 22:54:32,086] Trial 374 pruned. Trial was pruned at iteration 0.
[I 2023-12-18 22:54:32,171] Trial 375 pruned. Trial was pruned at iteration 0.
[I 2023-12-18 22:54:32,258] Trial 376 pruned. Trial was pruned at iteration 0.
[I 2023-12-18 22:54:32,339] Trial 377 pruned. Trial was pruned at iteration 0.
[I 2023-12-18 22:54:32,428] Trial 378 pruned. Trial was pruned at iteration 0.
[I 2023-12-18 22:54:32,519] Trial 379 pruned. Trial was pruned at iteration 0.
[I 2023-12-18 22:54:32,609] Trial 380 pruned. Trial was pruned at iteration 0.
[I 2023-12-18 22:54:32,688] Trial 381 pruned. Trial was pruned at iteration 0.
[I 2023-12-18 22:54:32,773] Trial 382 pruned. Trial was pruned at iteration 0.
[I 2023-12-18 22:54:32,864] Trial 383 pruned. Trial was pruned at iteration 0.
[I 2023-12-18 22:54:32,957] Trial 384 pruned. Trial was pruned at iteration 0.
[I 2023-12-18 22:54:33,354] Trial 385 finished with value: 4.2979596428853855 and parameters: {'learning_rate': 0.17708006379421468, 'aft_loss_distribution': 'logistic', 'aft_loss_distribution_scale': 0.8410508091203559, 'max_depth': 5, 'booster': 'gbtree', 'scale_pos_weight': 4.774561417247472, 'alpha': 0.25072755042141803, 'lambda': 4.630096599885936, 'eta': 0.8305394507223528, 'sampling_method': 'uniform', 'subsample': 0.624146221200632, 'gamma': 6.4505119031009635}. Best is trial 361 with value: 4.252948890054525.
[I 2023-12-18 22:54:33,446] Trial 386 pruned. Trial was pruned at iteration 0.
[I 2023-12-18 22:54:33,540] Trial 387 pruned. Trial was pruned at iteration 0.
[I 2023-12-18 22:54:33,623] Trial 388 pruned. Trial was pruned at iteration 0.
[I 2023-12-18 22:54:33,710] Trial 389 pruned. Trial was pruned at iteration 0.
[I 2023-12-18 22:54:33,840] Trial 390 pruned. Trial was pruned at iteration 0.
[I 2023-12-18 22:54:33,974] Trial 391 pruned. Trial was pruned at iteration 0.
[I 2023-12-18 22:54:34,122] Trial 392 pruned. Trial was pruned at iteration 0.
[I 2023-12-18 22:54:34,248] Trial 393 pruned. Trial was pruned at iteration 0.
[I 2023-12-18 22:54:34,380] Trial 394 pruned. Trial was pruned at iteration 0.
[I 2023-12-18 22:54:44,856] Trial 395 pruned. Trial was pruned at iteration 146.
[I 2023-12-18 22:54:44,956] Trial 396 pruned. Trial was pruned at iteration 0.
[I 2023-12-18 22:54:45,044] Trial 397 pruned. Trial was pruned at iteration 0.
[I 2023-12-18 22:54:45,126] Trial 398 pruned. Trial was pruned at iteration 0.
[I 2023-12-18 22:54:45,217] Trial 399 pruned. Trial was pruned at iteration 0.
[I 2023-12-18 22:54:45,302] Trial 400 pruned. Trial was pruned at iteration 0.
[I 2023-12-18 22:54:45,383] Trial 401 pruned. Trial was pruned at iteration 0.
[I 2023-12-18 22:54:45,475] Trial 402 pruned. Trial was pruned at iteration 0.
[I 2023-12-18 22:54:45,558] Trial 403 pruned. Trial was pruned at iteration 0.
[I 2023-12-18 22:54:45,643] Trial 404 pruned. Trial was pruned at iteration 0.
[I 2023-12-18 22:54:45,726] Trial 405 pruned. Trial was pruned at iteration 0.
[I 2023-12-18 22:54:45,819] Trial 406 pruned. Trial was pruned at iteration 0.
[I 2023-12-18 22:54:45,931] Trial 407 pruned. Trial was pruned at iteration 0.
[I 2023-12-18 22:54:46,033] Trial 408 pruned. Trial was pruned at iteration 0.
[I 2023-12-18 22:54:46,165] Trial 409 pruned. Trial was pruned at iteration 18.
[I 2023-12-18 22:54:46,248] Trial 410 pruned. Trial was pruned at iteration 0.
[I 2023-12-18 22:54:46,338] Trial 411 pruned. Trial was pruned at iteration 0.
[I 2023-12-18 22:54:46,495] Trial 412 pruned. Trial was pruned at iteration 8.
[I 2023-12-18 22:54:46,590] Trial 413 pruned. Trial was pruned at iteration 0.
[I 2023-12-18 22:54:46,674] Trial 414 pruned. Trial was pruned at iteration 0.
[I 2023-12-18 22:54:46,768] Trial 415 pruned. Trial was pruned at iteration 0.
[I 2023-12-18 22:54:46,855] Trial 416 pruned. Trial was pruned at iteration 0.
[I 2023-12-18 22:54:46,947] Trial 417 pruned. Trial was pruned at iteration 0.
[I 2023-12-18 22:54:47,057] Trial 418 pruned. Trial was pruned at iteration 0.
[I 2023-12-18 22:54:47,148] Trial 419 pruned. Trial was pruned at iteration 0.
[I 2023-12-18 22:54:56,514] Trial 420 pruned. Trial was pruned at iteration 137.
[I 2023-12-18 22:54:56,605] Trial 421 pruned. Trial was pruned at iteration 0.
[I 2023-12-18 22:54:56,696] Trial 422 pruned. Trial was pruned at iteration 0.
[I 2023-12-18 22:54:56,787] Trial 423 pruned. Trial was pruned at iteration 0.
[I 2023-12-18 22:54:56,878] Trial 424 pruned. Trial was pruned at iteration 0.
[I 2023-12-18 22:54:56,969] Trial 425 pruned. Trial was pruned at iteration 0.
[I 2023-12-18 22:54:57,064] Trial 426 pruned. Trial was pruned at iteration 0.
[I 2023-12-18 22:54:57,154] Trial 427 pruned. Trial was pruned at iteration 0.
[I 2023-12-18 22:54:57,244] Trial 428 pruned. Trial was pruned at iteration 0.
[I 2023-12-18 22:54:57,330] Trial 429 pruned. Trial was pruned at iteration 0.
[I 2023-12-18 22:54:57,431] Trial 430 pruned. Trial was pruned at iteration 0.
[I 2023-12-18 22:54:57,526] Trial 431 pruned. Trial was pruned at iteration 0.
[I 2023-12-18 22:54:57,621] Trial 432 pruned. Trial was pruned at iteration 0.
[I 2023-12-18 22:54:57,713] Trial 433 pruned. Trial was pruned at iteration 0.
[I 2023-12-18 22:54:57,798] Trial 434 pruned. Trial was pruned at iteration 0.
[I 2023-12-18 22:54:57,884] Trial 435 pruned. Trial was pruned at iteration 0.
[I 2023-12-18 22:54:57,968] Trial 436 pruned. Trial was pruned at iteration 0.
[I 2023-12-18 22:54:58,060] Trial 437 pruned. Trial was pruned at iteration 0.
[I 2023-12-18 22:54:58,159] Trial 438 pruned. Trial was pruned at iteration 0.
[I 2023-12-18 22:54:58,252] Trial 439 pruned. Trial was pruned at iteration 0.
[I 2023-12-18 22:54:58,337] Trial 440 pruned. Trial was pruned at iteration 0.
[I 2023-12-18 22:54:58,434] Trial 441 pruned. Trial was pruned at iteration 0.
[I 2023-12-18 22:54:58,523] Trial 442 pruned. Trial was pruned at iteration 0.
[I 2023-12-18 22:54:58,606] Trial 443 pruned. Trial was pruned at iteration 0.
[I 2023-12-18 22:54:58,690] Trial 444 pruned. Trial was pruned at iteration 0.
[I 2023-12-18 22:54:58,787] Trial 445 pruned. Trial was pruned at iteration 0.
[I 2023-12-18 22:54:58,875] Trial 446 pruned. Trial was pruned at iteration 0.
[I 2023-12-18 22:54:58,963] Trial 447 pruned. Trial was pruned at iteration 0.
[I 2023-12-18 22:54:59,047] Trial 448 pruned. Trial was pruned at iteration 0.
[I 2023-12-18 22:54:59,138] Trial 449 pruned. Trial was pruned at iteration 0.
[I 2023-12-18 22:54:59,230] Trial 450 pruned. Trial was pruned at iteration 0.
[I 2023-12-18 22:54:59,324] Trial 451 pruned. Trial was pruned at iteration 0.
[I 2023-12-18 22:54:59,421] Trial 452 pruned. Trial was pruned at iteration 0.
[I 2023-12-18 22:54:59,514] Trial 453 pruned. Trial was pruned at iteration 0.
[I 2023-12-18 22:54:59,601] Trial 454 pruned. Trial was pruned at iteration 0.
[I 2023-12-18 22:54:59,687] Trial 455 pruned. Trial was pruned at iteration 0.
[I 2023-12-18 22:54:59,777] Trial 456 pruned. Trial was pruned at iteration 0.
[I 2023-12-18 22:54:59,871] Trial 457 pruned. Trial was pruned at iteration 0.
[I 2023-12-18 22:54:59,963] Trial 458 pruned. Trial was pruned at iteration 0.
[I 2023-12-18 22:55:00,058] Trial 459 pruned. Trial was pruned at iteration 0.
[I 2023-12-18 22:55:00,152] Trial 460 pruned. Trial was pruned at iteration 0.
[I 2023-12-18 22:55:00,241] Trial 461 pruned. Trial was pruned at iteration 0.
[I 2023-12-18 22:55:00,324] Trial 462 pruned. Trial was pruned at iteration 0.
[I 2023-12-18 22:55:00,415] Trial 463 pruned. Trial was pruned at iteration 0.
[I 2023-12-18 22:55:00,512] Trial 464 pruned. Trial was pruned at iteration 0.
[I 2023-12-18 22:55:00,603] Trial 465 pruned. Trial was pruned at iteration 0.
[I 2023-12-18 22:55:00,691] Trial 466 pruned. Trial was pruned at iteration 0.
[I 2023-12-18 22:55:00,784] Trial 467 pruned. Trial was pruned at iteration 0.
[I 2023-12-18 22:55:00,879] Trial 468 pruned. Trial was pruned at iteration 0.
[I 2023-12-18 22:55:00,973] Trial 469 pruned. Trial was pruned at iteration 0.
[I 2023-12-18 22:55:01,068] Trial 470 pruned. Trial was pruned at iteration 0.
[I 2023-12-18 22:55:01,158] Trial 471 pruned. Trial was pruned at iteration 0.
[I 2023-12-18 22:55:01,634] Trial 472 finished with value: 4.2854769552881145 and parameters: {'learning_rate': 0.19904469778075382, 'aft_loss_distribution': 'logistic', 'aft_loss_distribution_scale': 0.828416619533149, 'max_depth': 7, 'booster': 'gbtree', 'scale_pos_weight': 7.58710171909966, 'alpha': 1.55510145454296, 'lambda': 4.572880328975996, 'eta': 0.9093146033960672, 'sampling_method': 'uniform', 'subsample': 0.5843706286540457, 'gamma': 4.9130872789254045}. Best is trial 361 with value: 4.252948890054525.
[I 2023-12-18 22:55:01,734] Trial 473 pruned. Trial was pruned at iteration 0.
[I 2023-12-18 22:55:01,829] Trial 474 pruned. Trial was pruned at iteration 0.
[I 2023-12-18 22:55:01,930] Trial 475 pruned. Trial was pruned at iteration 0.
[I 2023-12-18 22:55:02,341] Trial 476 finished with value: 4.3206222794563685 and parameters: {'learning_rate': 0.21671730763877645, 'aft_loss_distribution': 'logistic', 'aft_loss_distribution_scale': 0.8751951410791895, 'max_depth': 7, 'booster': 'gbtree', 'scale_pos_weight': 7.047252664461622, 'alpha': 9.16960784431172, 'lambda': 4.98216750714678, 'eta': 0.9858393672088889, 'sampling_method': 'uniform', 'subsample': 0.3146767382111999, 'gamma': 4.898442520451454}. Best is trial 361 with value: 4.252948890054525.
[I 2023-12-18 22:55:02,439] Trial 477 pruned. Trial was pruned at iteration 0.
[I 2023-12-18 22:55:02,546] Trial 478 pruned. Trial was pruned at iteration 0.
[I 2023-12-18 22:55:02,639] Trial 479 pruned. Trial was pruned at iteration 0.
[I 2023-12-18 22:55:02,736] Trial 480 pruned. Trial was pruned at iteration 0.
[I 2023-12-18 22:55:02,835] Trial 481 pruned. Trial was pruned at iteration 0.
[I 2023-12-18 22:55:02,983] Trial 482 pruned. Trial was pruned at iteration 0.
[I 2023-12-18 22:55:03,137] Trial 483 pruned. Trial was pruned at iteration 0.
[I 2023-12-18 22:55:03,290] Trial 484 pruned. Trial was pruned at iteration 0.
[I 2023-12-18 22:55:03,434] Trial 485 pruned. Trial was pruned at iteration 0.
[I 2023-12-18 22:55:03,588] Trial 486 pruned. Trial was pruned at iteration 0.
[I 2023-12-18 22:55:03,734] Trial 487 pruned. Trial was pruned at iteration 0.
[I 2023-12-18 22:55:03,881] Trial 488 pruned. Trial was pruned at iteration 0.
[I 2023-12-18 22:55:04,045] Trial 489 pruned. Trial was pruned at iteration 0.
[I 2023-12-18 22:55:04,840] Trial 490 pruned. Trial was pruned at iteration 242.
[I 2023-12-18 22:55:05,010] Trial 491 pruned. Trial was pruned at iteration 0.
[I 2023-12-18 22:55:05,161] Trial 492 pruned. Trial was pruned at iteration 0.
