[I 2023-12-19 00:07:21,411] Trial 473 pruned. Trial was pruned at iteration 1.
[I 2023-12-19 00:07:21,503] Trial 474 pruned. Trial was pruned at iteration 0.
[I 2023-12-19 00:07:21,599] Trial 475 pruned. Trial was pruned at iteration 0.
[I 2023-12-19 00:07:21,702] Trial 476 pruned. Trial was pruned at iteration 1.
[I 2023-12-19 00:07:23,428] Trial 477 finished with value: inf and parameters: {'learning_rate': 0.9995474204073486, 'aft_loss_distribution': 'normal', 'aft_loss_distribution_scale': 1.433796108182284, 'max_depth': 6, 'booster': 'dart', 'scale_pos_weight': 0.38597444787999335, 'alpha': 3.0467743467241712, 'lambda': 1.7884806516060845, 'eta': 0.25125721764324577, 'sampling_method': 'gradient_based', 'subsample': 0.7006955997289973, 'gamma': 9.192930198506442}. Best is trial 402 with value: 1.9948641073618725.
[I 2023-12-19 00:07:23,531] Trial 478 pruned. Trial was pruned at iteration 0.
[I 2023-12-19 00:07:23,622] Trial 479 pruned. Trial was pruned at iteration 0.
[I 2023-12-19 00:07:23,729] Trial 480 pruned. Trial was pruned at iteration 1.
[I 2023-12-19 00:07:23,824] Trial 481 pruned. Trial was pruned at iteration 0.
[I 2023-12-19 00:07:23,924] Trial 482 pruned. Trial was pruned at iteration 1.
[I 2023-12-19 00:07:24,012] Trial 483 pruned. Trial was pruned at iteration 0.
[I 2023-12-19 00:07:24,112] Trial 484 pruned. Trial was pruned at iteration 1.
[I 2023-12-19 00:07:24,215] Trial 485 pruned. Trial was pruned at iteration 0.
[I 2023-12-19 00:07:24,318] Trial 486 pruned. Trial was pruned at iteration 0.
[I 2023-12-19 00:07:28,948] Trial 487 finished with value: 1.9976465153170169 and parameters: {'learning_rate': 0.9818618630649679, 'aft_loss_distribution': 'normal', 'aft_loss_distribution_scale': 1.494777516934847, 'max_depth': 8, 'booster': 'dart', 'scale_pos_weight': 0.5295457536405405, 'alpha': 3.297229947493209, 'lambda': 7.029615831728137, 'eta': 0.22819523631830785, 'sampling_method': 'gradient_based', 'subsample': 0.6107012609499263, 'gamma': 9.37225100008406}. Best is trial 402 with value: 1.9948641073618725.
[I 2023-12-19 00:07:29,099] Trial 488 pruned. Trial was pruned at iteration 0.
[I 2023-12-19 00:07:29,237] Trial 489 pruned. Trial was pruned at iteration 0.
[I 2023-12-19 00:07:29,378] Trial 490 pruned. Trial was pruned at iteration 0.
[I 2023-12-19 00:07:29,524] Trial 491 pruned. Trial was pruned at iteration 0.
[I 2023-12-19 00:07:29,672] Trial 492 pruned. Trial was pruned at iteration 0.
[I 2023-12-19 00:07:29,808] Trial 493 pruned. Trial was pruned at iteration 0.
[I 2023-12-19 00:07:29,960] Trial 494 pruned. Trial was pruned at iteration 0.
[I 2023-12-19 00:07:30,118] Trial 495 pruned. Trial was pruned at iteration 0.
[I 2023-12-19 00:07:30,277] Trial 496 pruned. Trial was pruned at iteration 1.
[I 2023-12-19 00:07:30,411] Trial 497 pruned. Trial was pruned at iteration 0.
[I 2023-12-19 00:07:30,506] Trial 498 pruned. Trial was pruned at iteration 0.
[I 2023-12-19 00:07:30,608] Trial 499 pruned. Trial was pruned at iteration 1.
Completed hyperparameter tuning with best aft-nloglik = 1.9948641073618725.
Re-running the best trial... params = {'verbosity': 0, 'objective': 'survival:aft', 'eval_metric': 'aft-nloglik', 'tree_method': 'gpu_hist', 'device': 'cuda', 'learning_rate': 0.9809270871637774, 'aft_loss_distribution': 'normal', 'aft_loss_distribution_scale': 1.401243843651638, 'max_depth': 10, 'booster': 'dart', 'scale_pos_weight': 0.44454030109560505, 'alpha': 3.4901561444289744, 'lambda': 2.825275175790986, 'eta': 0.15795570566695077, 'sampling_method': 'gradient_based', 'subsample': 0.6358254864089323, 'gamma': 9.184917746369171}
[W 2023-12-19 00:07:33,658] Trial 2 is omitted in visualization because its objective value is inf or nan.
[W 2023-12-19 00:07:33,665] Trial 21 is omitted in visualization because its objective value is inf or nan.
[W 2023-12-19 00:07:33,668] Trial 45 is omitted in visualization because its objective value is inf or nan.
[W 2023-12-19 00:07:33,670] Trial 55 is omitted in visualization because its objective value is inf or nan.
[W 2023-12-19 00:07:33,671] Trial 56 is omitted in visualization because its objective value is inf or nan.
[W 2023-12-19 00:07:33,675] Trial 60 is omitted in visualization because its objective value is inf or nan.
[W 2023-12-19 00:07:33,675] Trial 61 is omitted in visualization because its objective value is inf or nan.
[W 2023-12-19 00:07:33,676] Trial 68 is omitted in visualization because its objective value is inf or nan.
[W 2023-12-19 00:07:33,677] Trial 73 is omitted in visualization because its objective value is inf or nan.
[W 2023-12-19 00:07:33,678] Trial 75 is omitted in visualization because its objective value is inf or nan.
[W 2023-12-19 00:07:33,679] Trial 76 is omitted in visualization because its objective value is inf or nan.
[W 2023-12-19 00:07:33,680] Trial 87 is omitted in visualization because its objective value is inf or nan.
[W 2023-12-19 00:07:33,681] Trial 93 is omitted in visualization because its objective value is inf or nan.
[W 2023-12-19 00:07:33,682] Trial 96 is omitted in visualization because its objective value is inf or nan.
[W 2023-12-19 00:07:33,683] Trial 101 is omitted in visualization because its objective value is inf or nan.
[W 2023-12-19 00:07:33,683] Trial 109 is omitted in visualization because its objective value is inf or nan.
[W 2023-12-19 00:07:33,684] Trial 130 is omitted in visualization because its objective value is inf or nan.
[W 2023-12-19 00:07:33,685] Trial 132 is omitted in visualization because its objective value is inf or nan.
[W 2023-12-19 00:07:33,686] Trial 136 is omitted in visualization because its objective value is inf or nan.
[W 2023-12-19 00:07:33,687] Trial 155 is omitted in visualization because its objective value is inf or nan.
[W 2023-12-19 00:07:33,688] Trial 202 is omitted in visualization because its objective value is inf or nan.
[W 2023-12-19 00:07:33,707] Trial 204 is omitted in visualization because its objective value is inf or nan.
[W 2023-12-19 00:07:33,713] Trial 206 is omitted in visualization because its objective value is inf or nan.
[W 2023-12-19 00:07:33,715] Trial 209 is omitted in visualization because its objective value is inf or nan.
[W 2023-12-19 00:07:33,717] Trial 211 is omitted in visualization because its objective value is inf or nan.
[W 2023-12-19 00:07:33,719] Trial 214 is omitted in visualization because its objective value is inf or nan.
[W 2023-12-19 00:07:33,722] Trial 215 is omitted in visualization because its objective value is inf or nan.
[W 2023-12-19 00:07:33,725] Trial 218 is omitted in visualization because its objective value is inf or nan.
[W 2023-12-19 00:07:33,727] Trial 219 is omitted in visualization because its objective value is inf or nan.
[W 2023-12-19 00:07:33,729] Trial 221 is omitted in visualization because its objective value is inf or nan.
[W 2023-12-19 00:07:33,732] Trial 225 is omitted in visualization because its objective value is inf or nan.
[W 2023-12-19 00:07:33,735] Trial 226 is omitted in visualization because its objective value is inf or nan.
[W 2023-12-19 00:07:33,738] Trial 230 is omitted in visualization because its objective value is inf or nan.
[W 2023-12-19 00:07:33,739] Trial 233 is omitted in visualization because its objective value is inf or nan.
[W 2023-12-19 00:07:33,742] Trial 235 is omitted in visualization because its objective value is inf or nan.
[W 2023-12-19 00:07:33,745] Trial 237 is omitted in visualization because its objective value is inf or nan.
[W 2023-12-19 00:07:33,748] Trial 238 is omitted in visualization because its objective value is inf or nan.
[W 2023-12-19 00:07:33,750] Trial 239 is omitted in visualization because its objective value is inf or nan.
[W 2023-12-19 00:07:33,752] Trial 241 is omitted in visualization because its objective value is inf or nan.
[W 2023-12-19 00:07:33,753] Trial 243 is omitted in visualization because its objective value is inf or nan.
[W 2023-12-19 00:07:33,755] Trial 244 is omitted in visualization because its objective value is inf or nan.
[W 2023-12-19 00:07:33,761] Trial 246 is omitted in visualization because its objective value is inf or nan.
[W 2023-12-19 00:07:33,761] Trial 248 is omitted in visualization because its objective value is inf or nan.
[W 2023-12-19 00:07:33,764] Trial 251 is omitted in visualization because its objective value is inf or nan.
[W 2023-12-19 00:07:33,765] Trial 253 is omitted in visualization because its objective value is inf or nan.
[W 2023-12-19 00:07:33,766] Trial 254 is omitted in visualization because its objective value is inf or nan.
[W 2023-12-19 00:07:33,767] Trial 255 is omitted in visualization because its objective value is inf or nan.
[W 2023-12-19 00:07:33,768] Trial 256 is omitted in visualization because its objective value is inf or nan.
[W 2023-12-19 00:07:33,769] Trial 259 is omitted in visualization because its objective value is inf or nan.
[W 2023-12-19 00:07:33,770] Trial 261 is omitted in visualization because its objective value is inf or nan.
[W 2023-12-19 00:07:33,771] Trial 270 is omitted in visualization because its objective value is inf or nan.
[W 2023-12-19 00:07:33,772] Trial 275 is omitted in visualization because its objective value is inf or nan.
[W 2023-12-19 00:07:33,773] Trial 278 is omitted in visualization because its objective value is inf or nan.
[W 2023-12-19 00:07:33,774] Trial 285 is omitted in visualization because its objective value is inf or nan.
[W 2023-12-19 00:07:33,775] Trial 289 is omitted in visualization because its objective value is inf or nan.
[W 2023-12-19 00:07:33,776] Trial 294 is omitted in visualization because its objective value is inf or nan.
[W 2023-12-19 00:07:33,777] Trial 296 is omitted in visualization because its objective value is inf or nan.
[W 2023-12-19 00:07:33,777] Trial 305 is omitted in visualization because its objective value is inf or nan.
[W 2023-12-19 00:07:33,778] Trial 307 is omitted in visualization because its objective value is inf or nan.
[W 2023-12-19 00:07:33,779] Trial 317 is omitted in visualization because its objective value is inf or nan.
[W 2023-12-19 00:07:33,780] Trial 323 is omitted in visualization because its objective value is inf or nan.
[W 2023-12-19 00:07:33,781] Trial 326 is omitted in visualization because its objective value is inf or nan.
[W 2023-12-19 00:07:33,782] Trial 329 is omitted in visualization because its objective value is inf or nan.
[W 2023-12-19 00:07:33,783] Trial 344 is omitted in visualization because its objective value is inf or nan.
[W 2023-12-19 00:07:33,784] Trial 354 is omitted in visualization because its objective value is inf or nan.
[W 2023-12-19 00:07:33,785] Trial 356 is omitted in visualization because its objective value is inf or nan.
[W 2023-12-19 00:07:33,785] Trial 358 is omitted in visualization because its objective value is inf or nan.
[W 2023-12-19 00:07:33,786] Trial 363 is omitted in visualization because its objective value is inf or nan.
[W 2023-12-19 00:07:33,787] Trial 364 is omitted in visualization because its objective value is inf or nan.
[W 2023-12-19 00:07:33,788] Trial 370 is omitted in visualization because its objective value is inf or nan.
[W 2023-12-19 00:07:33,789] Trial 378 is omitted in visualization because its objective value is inf or nan.
[W 2023-12-19 00:07:33,790] Trial 382 is omitted in visualization because its objective value is inf or nan.
[W 2023-12-19 00:07:33,791] Trial 392 is omitted in visualization because its objective value is inf or nan.
[W 2023-12-19 00:07:33,792] Trial 396 is omitted in visualization because its objective value is inf or nan.
[W 2023-12-19 00:07:33,793] Trial 397 is omitted in visualization because its objective value is inf or nan.
[W 2023-12-19 00:07:33,793] Trial 398 is omitted in visualization because its objective value is inf or nan.
[W 2023-12-19 00:07:33,794] Trial 406 is omitted in visualization because its objective value is inf or nan.
[W 2023-12-19 00:07:33,795] Trial 409 is omitted in visualization because its objective value is inf or nan.
[W 2023-12-19 00:07:33,796] Trial 411 is omitted in visualization because its objective value is inf or nan.
[W 2023-12-19 00:07:33,797] Trial 415 is omitted in visualization because its objective value is inf or nan.
[W 2023-12-19 00:07:33,798] Trial 417 is omitted in visualization because its objective value is inf or nan.
[W 2023-12-19 00:07:33,799] Trial 421 is omitted in visualization because its objective value is inf or nan.
[W 2023-12-19 00:07:33,800] Trial 422 is omitted in visualization because its objective value is inf or nan.
[W 2023-12-19 00:07:33,800] Trial 424 is omitted in visualization because its objective value is inf or nan.
[W 2023-12-19 00:07:33,801] Trial 425 is omitted in visualization because its objective value is inf or nan.
[W 2023-12-19 00:07:33,802] Trial 426 is omitted in visualization because its objective value is inf or nan.
[W 2023-12-19 00:07:33,803] Trial 427 is omitted in visualization because its objective value is inf or nan.
[W 2023-12-19 00:07:33,804] Trial 430 is omitted in visualization because its objective value is inf or nan.
[W 2023-12-19 00:07:33,805] Trial 433 is omitted in visualization because its objective value is inf or nan.
[W 2023-12-19 00:07:33,805] Trial 435 is omitted in visualization because its objective value is inf or nan.
[W 2023-12-19 00:07:33,806] Trial 439 is omitted in visualization because its objective value is inf or nan.
[W 2023-12-19 00:07:33,807] Trial 443 is omitted in visualization because its objective value is inf or nan.
[W 2023-12-19 00:07:33,808] Trial 448 is omitted in visualization because its objective value is inf or nan.
[W 2023-12-19 00:07:33,809] Trial 452 is omitted in visualization because its objective value is inf or nan.
[W 2023-12-19 00:07:33,810] Trial 466 is omitted in visualization because its objective value is inf or nan.
[W 2023-12-19 00:07:33,810] Trial 467 is omitted in visualization because its objective value is inf or nan.
[W 2023-12-19 00:07:33,811] Trial 477 is omitted in visualization because its objective value is inf or nan.
TRN1 | R2:0.305; p:6.983e-137 | C:68.99 |3h:0.956 |6h:0.944 |9h:0.937 |12h:0.733 |15h:0.733 |18h:0.729 |24h:0.577 |48h:0.570 |72h:0.561 |1wk:0.380 |2wks:0.375 |1mon:0.328 |
TRN2 | R2:0.229; p:8.306e-76 | C:64.37 |3h:0.956 |6h:0.944 |9h:0.937 |12h:0.732 |15h:0.732 |18h:0.728 |24h:0.576 |48h:0.569 |72h:0.560 |1wk:0.383 |2wks:0.373 |1mon:0.326 |
VAL | R2:0.217; p:3.603e-68 | C:63.23 |3h:0.956 |6h:0.944 |9h:0.937 |12h:0.732 |15h:0.732 |18h:0.728 |24h:0.575 |48h:0.568 |72h:0.559 |1wk:0.382 |2wks:0.371 |1mon:0.324 |
[I 2023-12-19 00:07:38,696] A new study created in memory with name: no-name-0e9b2ee0-ce83-4e77-be02-2c74ee7dcebd
TST | R2:0.148; p:2.709e-96 | C:59.05 |3h:0.951 |6h:0.936 |9h:0.927 |12h:0.726 |15h:0.726 |18h:0.711 |24h:0.443 |48h:0.441 |72h:0.437 |1wk:0.348 |2wks:0.355 |1mon:0.326 |
/content/drive/MyDrive/intermediates2/res//outcome2_xgb-aft_inp39_all_rdims8.json
All avail dimensionality reduced word embedding with ['location_numeric', 'race_numeric', 'sex_numeric']
All avail dimensionality reduced word embedding with ['location_numeric', 'race_numeric', 'sex_numeric']
All avail dimensionality reduced word embedding with ['location_numeric', 'race_numeric', 'sex_numeric']
All avail dimensionality reduced word embedding with ['location_numeric', 'race_numeric', 'sex_numeric']
trn1
trn2
val
tst
[I 2023-12-19 00:07:40,574] Trial 0 finished with value: 2.475171426948811 and parameters: {'learning_rate': 0.020131393470409976, 'aft_loss_distribution': 'extreme', 'aft_loss_distribution_scale': 0.5806977598753497, 'max_depth': 6, 'booster': 'gbtree', 'scale_pos_weight': 2.730552151721377, 'alpha': 2.7141467123152974, 'lambda': 5.1052562944708155, 'eta': 0.5513673048210004, 'sampling_method': 'gradient_based', 'subsample': 0.9555499540407455, 'gamma': 2.574647731404906}. Best is trial 0 with value: 2.475171426948811.
[I 2023-12-19 00:07:40,808] Trial 1 finished with value: 2.4017866567948305 and parameters: {'learning_rate': 0.6522071597215582, 'aft_loss_distribution': 'normal', 'aft_loss_distribution_scale': 6.820441552891998, 'max_depth': 3, 'booster': 'gbtree', 'scale_pos_weight': 0.14747828139870411, 'alpha': 5.4914052219337455, 'lambda': 4.863917830741142, 'eta': 0.30074308471328626, 'sampling_method': 'uniform', 'subsample': 0.7997283981942651, 'gamma': 1.0856184103600863}. Best is trial 1 with value: 2.4017866567948305.
[I 2023-12-19 00:07:41,159] Trial 2 finished with value: 2.015475326357095 and parameters: {'learning_rate': 0.16785856409277117, 'aft_loss_distribution': 'normal', 'aft_loss_distribution_scale': 1.9112533762679862, 'max_depth': 5, 'booster': 'gbtree', 'scale_pos_weight': 0.2566707283267086, 'alpha': 0.7507767371776116, 'lambda': 4.142124891771422, 'eta': 0.5753647423148427, 'sampling_method': 'uniform', 'subsample': 0.5047131574639043, 'gamma': 9.109701579473736}. Best is trial 2 with value: 2.015475326357095.
[I 2023-12-19 00:07:43,038] Trial 3 finished with value: inf and parameters: {'learning_rate': 0.5395996169656782, 'aft_loss_distribution': 'logistic', 'aft_loss_distribution_scale': 3.473563968338619, 'max_depth': 8, 'booster': 'dart', 'scale_pos_weight': 3.353341603379359, 'alpha': 6.3367202989269975, 'lambda': 0.18042230528866252, 'eta': 0.15689101554077955, 'sampling_method': 'gradient_based', 'subsample': 0.9751208082802072, 'gamma': 8.909035697767179}. Best is trial 2 with value: 2.015475326357095.
[I 2023-12-19 00:07:43,431] Trial 4 finished with value: 2.490234955923297 and parameters: {'learning_rate': 0.21414795176230395, 'aft_loss_distribution': 'extreme', 'aft_loss_distribution_scale': 6.091238525619877, 'max_depth': 4, 'booster': 'gbtree', 'scale_pos_weight': 3.3257239882930247, 'alpha': 9.43400235496209, 'lambda': 3.0555949791259347, 'eta': 0.5940568662591128, 'sampling_method': 'gradient_based', 'subsample': 0.08530262992864264, 'gamma': 2.39184103778365}. Best is trial 2 with value: 2.015475326357095.
[I 2023-12-19 00:08:08,985] Trial 5 finished with value: 2.212063907355042 and parameters: {'learning_rate': 0.5508995603235871, 'aft_loss_distribution': 'normal', 'aft_loss_distribution_scale': 3.9030173563926445, 'max_depth': 9, 'booster': 'dart', 'scale_pos_weight': 1.438052815823116, 'alpha': 5.636470218161193, 'lambda': 6.245626177234876, 'eta': 0.47873249815223184, 'sampling_method': 'gradient_based', 'subsample': 0.5402052460595983, 'gamma': 4.1410474305573866}. Best is trial 2 with value: 2.015475326357095.
[I 2023-12-19 00:08:09,029] Trial 6 pruned. Trial was pruned at iteration 5.
[I 2023-12-19 00:08:09,041] Trial 7 pruned. Trial was pruned at iteration 0.
[I 2023-12-19 00:08:10,899] Trial 8 finished with value: inf and parameters: {'learning_rate': 0.4066621420092973, 'aft_loss_distribution': 'logistic', 'aft_loss_distribution_scale': 1.8705661086940009, 'max_depth': 8, 'booster': 'dart', 'scale_pos_weight': 1.1805854557026092, 'alpha': 3.3697653029327284, 'lambda': 3.505789565317195, 'eta': 0.13170040070467193, 'sampling_method': 'gradient_based', 'subsample': 0.02295191466498065, 'gamma': 5.396733767552533}. Best is trial 2 with value: 2.015475326357095.
[I 2023-12-19 00:08:11,062] Trial 9 pruned. Trial was pruned at iteration 53.
[I 2023-12-19 00:08:11,140] Trial 10 pruned. Trial was pruned at iteration 0.
[I 2023-12-19 00:08:18,736] Trial 11 pruned. Trial was pruned at iteration 125.
[I 2023-12-19 00:08:20,803] Trial 12 finished with value: inf and parameters: {'learning_rate': 0.5708057708931167, 'aft_loss_distribution': 'normal', 'aft_loss_distribution_scale': 3.4179711211499653, 'max_depth': 5, 'booster': 'dart', 'scale_pos_weight': 1.5491774294978566, 'alpha': 3.5650384389556034, 'lambda': 2.6953338371962166, 'eta': 0.7089867519094286, 'sampling_method': 'gradient_based', 'subsample': 0.4134175880025222, 'gamma': 4.0578396908982}. Best is trial 2 with value: 2.015475326357095.
[I 2023-12-19 00:08:20,858] Trial 13 pruned. Trial was pruned at iteration 0.
[I 2023-12-19 00:08:21,147] Trial 14 finished with value: inf and parameters: {'learning_rate': 0.7518173390479439, 'aft_loss_distribution': 'normal', 'aft_loss_distribution_scale': 4.703784557486643, 'max_depth': 6, 'booster': 'gbtree', 'scale_pos_weight': 1.9150333488367306, 'alpha': 4.643678582109143, 'lambda': 4.981928521177851, 'eta': 0.6977081754906382, 'sampling_method': 'gradient_based', 'subsample': 0.2648848240697833, 'gamma': 3.973375934071046}. Best is trial 2 with value: 2.015475326357095.
[I 2023-12-19 00:08:21,204] Trial 15 pruned. Trial was pruned at iteration 0.
[I 2023-12-19 00:08:21,259] Trial 16 pruned. Trial was pruned at iteration 0.
[I 2023-12-19 00:08:21,544] Trial 17 pruned. Trial was pruned at iteration 124.
[I 2023-12-19 00:08:21,615] Trial 18 pruned. Trial was pruned at iteration 0.
[I 2023-12-19 00:08:21,665] Trial 19 pruned. Trial was pruned at iteration 0.
[I 2023-12-19 00:08:21,717] Trial 20 pruned. Trial was pruned at iteration 0.
[I 2023-12-19 00:08:21,766] Trial 21 pruned. Trial was pruned at iteration 0.
[I 2023-12-19 00:08:21,815] Trial 22 pruned. Trial was pruned at iteration 0.
[I 2023-12-19 00:08:21,866] Trial 23 pruned. Trial was pruned at iteration 0.
[I 2023-12-19 00:08:21,926] Trial 24 pruned. Trial was pruned at iteration 0.
[I 2023-12-19 00:08:21,976] Trial 25 pruned. Trial was pruned at iteration 0.
[I 2023-12-19 00:08:22,028] Trial 26 pruned. Trial was pruned at iteration 0.
[I 2023-12-19 00:08:22,082] Trial 27 pruned. Trial was pruned at iteration 0.
[I 2023-12-19 00:08:22,147] Trial 28 pruned. Trial was pruned at iteration 0.
[I 2023-12-19 00:08:22,202] Trial 29 pruned. Trial was pruned at iteration 0.
[I 2023-12-19 00:08:22,282] Trial 30 pruned. Trial was pruned at iteration 0.
[I 2023-12-19 00:08:22,346] Trial 31 pruned. Trial was pruned at iteration 0.
