[I 2023-12-19 00:27:48,708] Trial 499 pruned. Trial was pruned at iteration 0.
[W 2023-12-19 00:27:48,913] Trial 1 is omitted in visualization because its objective value is inf or nan.
Completed hyperparameter tuning with best aft-nloglik = 2.014644627836659.
Re-running the best trial... params = {'verbosity': 0, 'objective': 'survival:aft', 'eval_metric': 'aft-nloglik', 'tree_method': 'gpu_hist', 'device': 'cuda', 'learning_rate': 0.8958241920656538, 'aft_loss_distribution': 'normal', 'aft_loss_distribution_scale': 1.523618358739584, 'max_depth': 5, 'booster': 'gbtree', 'scale_pos_weight': 0.4401723670024271, 'alpha': 6.4485911250932135, 'lambda': 3.213055025295731, 'eta': 0.20215984410076443, 'sampling_method': 'uniform', 'subsample': 0.7971321524776521, 'gamma': 6.60192841268395}
[W 2023-12-19 00:27:48,924] Trial 2 is omitted in visualization because its objective value is inf or nan.
[W 2023-12-19 00:27:48,929] Trial 17 is omitted in visualization because its objective value is inf or nan.
[W 2023-12-19 00:27:48,934] Trial 33 is omitted in visualization because its objective value is inf or nan.
[W 2023-12-19 00:27:48,935] Trial 34 is omitted in visualization because its objective value is inf or nan.
[W 2023-12-19 00:27:48,938] Trial 53 is omitted in visualization because its objective value is inf or nan.
[W 2023-12-19 00:27:48,940] Trial 61 is omitted in visualization because its objective value is inf or nan.
[W 2023-12-19 00:27:48,942] Trial 73 is omitted in visualization because its objective value is inf or nan.
[W 2023-12-19 00:27:48,944] Trial 76 is omitted in visualization because its objective value is inf or nan.
[W 2023-12-19 00:27:48,946] Trial 81 is omitted in visualization because its objective value is inf or nan.
[W 2023-12-19 00:27:48,947] Trial 82 is omitted in visualization because its objective value is inf or nan.
[W 2023-12-19 00:27:48,949] Trial 88 is omitted in visualization because its objective value is inf or nan.
[W 2023-12-19 00:27:48,950] Trial 93 is omitted in visualization because its objective value is inf or nan.
[W 2023-12-19 00:27:48,951] Trial 95 is omitted in visualization because its objective value is inf or nan.
[W 2023-12-19 00:27:48,952] Trial 96 is omitted in visualization because its objective value is inf or nan.
[W 2023-12-19 00:27:48,953] Trial 118 is omitted in visualization because its objective value is inf or nan.
[W 2023-12-19 00:27:48,954] Trial 124 is omitted in visualization because its objective value is inf or nan.
[W 2023-12-19 00:27:48,954] Trial 151 is omitted in visualization because its objective value is inf or nan.
[W 2023-12-19 00:27:48,955] Trial 156 is omitted in visualization because its objective value is inf or nan.
[W 2023-12-19 00:27:48,956] Trial 158 is omitted in visualization because its objective value is inf or nan.
[W 2023-12-19 00:27:48,957] Trial 164 is omitted in visualization because its objective value is inf or nan.
[W 2023-12-19 00:27:48,960] Trial 166 is omitted in visualization because its objective value is inf or nan.
[W 2023-12-19 00:27:48,961] Trial 168 is omitted in visualization because its objective value is inf or nan.
[W 2023-12-19 00:27:48,962] Trial 175 is omitted in visualization because its objective value is inf or nan.
[W 2023-12-19 00:27:48,963] Trial 176 is omitted in visualization because its objective value is inf or nan.
[W 2023-12-19 00:27:48,964] Trial 184 is omitted in visualization because its objective value is inf or nan.
[W 2023-12-19 00:27:48,965] Trial 196 is omitted in visualization because its objective value is inf or nan.
[W 2023-12-19 00:27:48,966] Trial 198 is omitted in visualization because its objective value is inf or nan.
[W 2023-12-19 00:27:48,969] Trial 199 is omitted in visualization because its objective value is inf or nan.
[W 2023-12-19 00:27:48,969] Trial 202 is omitted in visualization because its objective value is inf or nan.
[W 2023-12-19 00:27:48,970] Trial 204 is omitted in visualization because its objective value is inf or nan.
[W 2023-12-19 00:27:48,971] Trial 205 is omitted in visualization because its objective value is inf or nan.
[W 2023-12-19 00:27:48,972] Trial 208 is omitted in visualization because its objective value is inf or nan.
[W 2023-12-19 00:27:48,973] Trial 209 is omitted in visualization because its objective value is inf or nan.
[W 2023-12-19 00:27:48,977] Trial 210 is omitted in visualization because its objective value is inf or nan.
[W 2023-12-19 00:27:48,978] Trial 211 is omitted in visualization because its objective value is inf or nan.
[W 2023-12-19 00:27:48,978] Trial 212 is omitted in visualization because its objective value is inf or nan.
[W 2023-12-19 00:27:48,979] Trial 215 is omitted in visualization because its objective value is inf or nan.
[W 2023-12-19 00:27:48,980] Trial 219 is omitted in visualization because its objective value is inf or nan.
[W 2023-12-19 00:27:48,981] Trial 224 is omitted in visualization because its objective value is inf or nan.
[W 2023-12-19 00:27:48,982] Trial 225 is omitted in visualization because its objective value is inf or nan.
[W 2023-12-19 00:27:48,983] Trial 231 is omitted in visualization because its objective value is inf or nan.
[W 2023-12-19 00:27:48,984] Trial 233 is omitted in visualization because its objective value is inf or nan.
[W 2023-12-19 00:27:48,985] Trial 234 is omitted in visualization because its objective value is inf or nan.
[W 2023-12-19 00:27:48,986] Trial 235 is omitted in visualization because its objective value is inf or nan.
[W 2023-12-19 00:27:48,987] Trial 237 is omitted in visualization because its objective value is inf or nan.
[W 2023-12-19 00:27:48,988] Trial 239 is omitted in visualization because its objective value is inf or nan.
[W 2023-12-19 00:27:48,989] Trial 240 is omitted in visualization because its objective value is inf or nan.
[W 2023-12-19 00:27:48,989] Trial 241 is omitted in visualization because its objective value is inf or nan.
[W 2023-12-19 00:27:48,990] Trial 243 is omitted in visualization because its objective value is inf or nan.
[W 2023-12-19 00:27:48,991] Trial 244 is omitted in visualization because its objective value is inf or nan.
[W 2023-12-19 00:27:48,995] Trial 251 is omitted in visualization because its objective value is inf or nan.
[W 2023-12-19 00:27:48,996] Trial 252 is omitted in visualization because its objective value is inf or nan.
[W 2023-12-19 00:27:48,997] Trial 254 is omitted in visualization because its objective value is inf or nan.
[W 2023-12-19 00:27:48,998] Trial 256 is omitted in visualization because its objective value is inf or nan.
[W 2023-12-19 00:27:48,999] Trial 264 is omitted in visualization because its objective value is inf or nan.
[W 2023-12-19 00:27:48,999] Trial 265 is omitted in visualization because its objective value is inf or nan.
[W 2023-12-19 00:27:49,000] Trial 268 is omitted in visualization because its objective value is inf or nan.
[W 2023-12-19 00:27:49,001] Trial 272 is omitted in visualization because its objective value is inf or nan.
[W 2023-12-19 00:27:49,002] Trial 273 is omitted in visualization because its objective value is inf or nan.
[W 2023-12-19 00:27:49,003] Trial 275 is omitted in visualization because its objective value is inf or nan.
[W 2023-12-19 00:27:49,004] Trial 277 is omitted in visualization because its objective value is inf or nan.
[W 2023-12-19 00:27:49,005] Trial 279 is omitted in visualization because its objective value is inf or nan.
[W 2023-12-19 00:27:49,006] Trial 282 is omitted in visualization because its objective value is inf or nan.
[W 2023-12-19 00:27:49,006] Trial 285 is omitted in visualization because its objective value is inf or nan.
[W 2023-12-19 00:27:49,007] Trial 287 is omitted in visualization because its objective value is inf or nan.
[W 2023-12-19 00:27:49,008] Trial 289 is omitted in visualization because its objective value is inf or nan.
[W 2023-12-19 00:27:49,009] Trial 290 is omitted in visualization because its objective value is inf or nan.
[W 2023-12-19 00:27:49,010] Trial 291 is omitted in visualization because its objective value is inf or nan.
[W 2023-12-19 00:27:49,011] Trial 294 is omitted in visualization because its objective value is inf or nan.
[W 2023-12-19 00:27:49,012] Trial 297 is omitted in visualization because its objective value is inf or nan.
[W 2023-12-19 00:27:49,013] Trial 298 is omitted in visualization because its objective value is inf or nan.
[W 2023-12-19 00:27:49,013] Trial 308 is omitted in visualization because its objective value is inf or nan.
[W 2023-12-19 00:27:49,014] Trial 310 is omitted in visualization because its objective value is inf or nan.
[W 2023-12-19 00:27:49,015] Trial 312 is omitted in visualization because its objective value is inf or nan.
[W 2023-12-19 00:27:49,016] Trial 314 is omitted in visualization because its objective value is inf or nan.
[W 2023-12-19 00:27:49,017] Trial 316 is omitted in visualization because its objective value is inf or nan.
[W 2023-12-19 00:27:49,018] Trial 321 is omitted in visualization because its objective value is inf or nan.
[W 2023-12-19 00:27:49,019] Trial 324 is omitted in visualization because its objective value is inf or nan.
[W 2023-12-19 00:27:49,019] Trial 328 is omitted in visualization because its objective value is inf or nan.
[W 2023-12-19 00:27:49,020] Trial 333 is omitted in visualization because its objective value is inf or nan.
[W 2023-12-19 00:27:49,021] Trial 335 is omitted in visualization because its objective value is inf or nan.
[W 2023-12-19 00:27:49,022] Trial 337 is omitted in visualization because its objective value is inf or nan.
[W 2023-12-19 00:27:49,023] Trial 344 is omitted in visualization because its objective value is inf or nan.
[W 2023-12-19 00:27:49,024] Trial 349 is omitted in visualization because its objective value is inf or nan.
[W 2023-12-19 00:27:49,028] Trial 354 is omitted in visualization because its objective value is inf or nan.
[W 2023-12-19 00:27:49,029] Trial 365 is omitted in visualization because its objective value is inf or nan.
[W 2023-12-19 00:27:49,030] Trial 377 is omitted in visualization because its objective value is inf or nan.
[W 2023-12-19 00:27:49,031] Trial 387 is omitted in visualization because its objective value is inf or nan.
[W 2023-12-19 00:27:49,032] Trial 400 is omitted in visualization because its objective value is inf or nan.
[W 2023-12-19 00:27:49,033] Trial 405 is omitted in visualization because its objective value is inf or nan.
[W 2023-12-19 00:27:49,034] Trial 407 is omitted in visualization because its objective value is inf or nan.
[W 2023-12-19 00:27:49,035] Trial 408 is omitted in visualization because its objective value is inf or nan.
[W 2023-12-19 00:27:49,036] Trial 418 is omitted in visualization because its objective value is inf or nan.
[W 2023-12-19 00:27:49,037] Trial 422 is omitted in visualization because its objective value is inf or nan.
[W 2023-12-19 00:27:49,037] Trial 428 is omitted in visualization because its objective value is inf or nan.
[W 2023-12-19 00:27:49,038] Trial 440 is omitted in visualization because its objective value is inf or nan.
[W 2023-12-19 00:27:49,039] Trial 456 is omitted in visualization because its objective value is inf or nan.
[W 2023-12-19 00:27:49,040] Trial 467 is omitted in visualization because its objective value is inf or nan.
[W 2023-12-19 00:27:49,041] Trial 469 is omitted in visualization because its objective value is inf or nan.
[W 2023-12-19 00:27:49,042] Trial 473 is omitted in visualization because its objective value is inf or nan.
[W 2023-12-19 00:27:49,043] Trial 475 is omitted in visualization because its objective value is inf or nan.
[W 2023-12-19 00:27:49,043] Trial 484 is omitted in visualization because its objective value is inf or nan.
[W 2023-12-19 00:27:49,044] Trial 494 is omitted in visualization because its objective value is inf or nan.
[W 2023-12-19 00:27:49,045] Trial 498 is omitted in visualization because its objective value is inf or nan.
TRN1 | R2:0.218; p:1.034e-68 | C:62.15 |3h:0.961 |6h:0.949 |9h:0.942 |12h:0.733 |15h:0.733 |18h:0.729 |24h:0.574 |48h:0.567 |72h:0.559 |1wk:0.381 |2wks:0.375 |1mon:0.328 |
TRN2 | R2:0.158; p:1.261e-36 | C:59.48 |3h:0.961 |6h:0.950 |9h:0.942 |12h:0.733 |15h:0.733 |18h:0.729 |24h:0.575 |48h:0.567 |72h:0.559 |1wk:0.384 |2wks:0.375 |1mon:0.327 |
VAL | R2:0.184; p:4.413e-49 | C:60.42 |3h:0.961 |6h:0.949 |9h:0.942 |12h:0.733 |15h:0.733 |18h:0.729 |24h:0.575 |48h:0.567 |72h:0.559 |1wk:0.384 |2wks:0.374 |1mon:0.327 |
[I 2023-12-19 00:27:54,949] A new study created in memory with name: no-name-16393b29-0810-4fe7-902e-f6910ba8211d
TST | R2:0.111; p:1.165e-54 | C:56.32 |3h:0.955 |6h:0.939 |9h:0.930 |12h:0.727 |15h:0.727 |18h:0.712 |24h:0.442 |48h:0.440 |72h:0.436 |1wk:0.349 |2wks:0.356 |1mon:0.327 |
/content/drive/MyDrive/intermediates2/res//outcome2_xgb-aft_inp21_k3_emb1_rdims8.json
Dimensionality reduced word embedding 2 with ['location_numeric', 'race_numeric', 'sex_numeric']
Dimensionality reduced word embedding 2 with ['location_numeric', 'race_numeric', 'sex_numeric']
Dimensionality reduced word embedding 2 with ['location_numeric', 'race_numeric', 'sex_numeric']
Dimensionality reduced word embedding 2 with ['location_numeric', 'race_numeric', 'sex_numeric']
trn1
trn2
val
tst
[I 2023-12-19 00:27:58,280] Trial 0 finished with value: 2.290648551765609 and parameters: {'learning_rate': 0.006053637154408606, 'aft_loss_distribution': 'normal', 'aft_loss_distribution_scale': 4.785493959628843, 'max_depth': 8, 'booster': 'gbtree', 'scale_pos_weight': 3.284856325380352, 'alpha': 5.653464014886607, 'lambda': 5.705256742198754, 'eta': 0.5502477482276827, 'sampling_method': 'uniform', 'subsample': 0.3314705847344023, 'gamma': 1.6808373036814266}. Best is trial 0 with value: 2.290648551765609.
[I 2023-12-19 00:27:58,707] Trial 1 finished with value: 2.624359901144824 and parameters: {'learning_rate': 0.09087311078078378, 'aft_loss_distribution': 'extreme', 'aft_loss_distribution_scale': 8.616273796461122, 'max_depth': 9, 'booster': 'gbtree', 'scale_pos_weight': 0.6823918512775154, 'alpha': 0.44062332479800403, 'lambda': 8.320235068053593, 'eta': 0.7664479487358611, 'sampling_method': 'uniform', 'subsample': 0.506130105539922, 'gamma': 2.440987224997535}. Best is trial 0 with value: 2.290648551765609.
[I 2023-12-19 00:28:00,680] Trial 2 finished with value: inf and parameters: {'learning_rate': 0.839968904824062, 'aft_loss_distribution': 'logistic', 'aft_loss_distribution_scale': 1.9699030869914336, 'max_depth': 5, 'booster': 'dart', 'scale_pos_weight': 3.0728903414441993, 'alpha': 2.5363999452182675, 'lambda': 3.6186462052613533, 'eta': 0.005652013134122669, 'sampling_method': 'uniform', 'subsample': 0.43694220589082283, 'gamma': 6.849884195775375}. Best is trial 0 with value: 2.290648551765609.
[I 2023-12-19 00:28:00,896] Trial 3 finished with value: inf and parameters: {'learning_rate': 0.7883390856154796, 'aft_loss_distribution': 'extreme', 'aft_loss_distribution_scale': 9.721015900193416, 'max_depth': 10, 'booster': 'gbtree', 'scale_pos_weight': 3.478232400073456, 'alpha': 2.6445348086034013, 'lambda': 9.513000450866272, 'eta': 0.2915936936662338, 'sampling_method': 'gradient_based', 'subsample': 0.13559191169999238, 'gamma': 6.467837012948494}. Best is trial 0 with value: 2.290648551765609.
[I 2023-12-19 00:28:01,472] Trial 4 finished with value: 2.032977880923993 and parameters: {'learning_rate': 0.1396166917652437, 'aft_loss_distribution': 'logistic', 'aft_loss_distribution_scale': 1.026188719310079, 'max_depth': 6, 'booster': 'gbtree', 'scale_pos_weight': 2.6194852992752033, 'alpha': 7.426913640960115, 'lambda': 6.515010914150763, 'eta': 0.8897856208398776, 'sampling_method': 'gradient_based', 'subsample': 0.3304240958803506, 'gamma': 4.503279208785022}. Best is trial 4 with value: 2.032977880923993.
[I 2023-12-19 00:28:01,490] Trial 5 pruned. Trial was pruned at iteration 1.
[I 2023-12-19 00:28:01,506] Trial 6 pruned. Trial was pruned at iteration 0.
[I 2023-12-19 00:28:01,771] Trial 7 finished with value: 2.5251037831998966 and parameters: {'learning_rate': 0.7136334653526836, 'aft_loss_distribution': 'extreme', 'aft_loss_distribution_scale': 6.466127230268197, 'max_depth': 4, 'booster': 'gbtree', 'scale_pos_weight': 3.269135399402199, 'alpha': 8.952131174630122, 'lambda': 9.325538210424604, 'eta': 0.26188423498593016, 'sampling_method': 'gradient_based', 'subsample': 0.8255588272763172, 'gamma': 7.762892474869241}. Best is trial 4 with value: 2.032977880923993.
[I 2023-12-19 00:28:02,011] Trial 8 finished with value: 2.3181438369760445 and parameters: {'learning_rate': 0.8087339955929193, 'aft_loss_distribution': 'logistic', 'aft_loss_distribution_scale': 3.046442671312798, 'max_depth': 3, 'booster': 'gbtree', 'scale_pos_weight': 3.453624003112878, 'alpha': 8.162370298541157, 'lambda': 6.824258170058624, 'eta': 0.09094147644285155, 'sampling_method': 'gradient_based', 'subsample': 0.296918705189113, 'gamma': 8.410682232363772}. Best is trial 4 with value: 2.032977880923993.
[I 2023-12-19 00:28:08,706] Trial 9 finished with value: 2.168853823871737 and parameters: {'learning_rate': 0.9101780950806143, 'aft_loss_distribution': 'normal', 'aft_loss_distribution_scale': 3.250575998338182, 'max_depth': 8, 'booster': 'dart', 'scale_pos_weight': 3.2870202914900104, 'alpha': 0.5223350001011958, 'lambda': 4.419964002865672, 'eta': 0.07722348078343633, 'sampling_method': 'uniform', 'subsample': 0.1413914203871643, 'gamma': 4.569794808523985}. Best is trial 4 with value: 2.032977880923993.
[I 2023-12-19 00:28:08,767] Trial 10 pruned. Trial was pruned at iteration 0.
[I 2023-12-19 00:28:12,336] Trial 11 finished with value: 2.1740297690855472 and parameters: {'learning_rate': 0.9926273794910643, 'aft_loss_distribution': 'normal', 'aft_loss_distribution_scale': 3.244901111775894, 'max_depth': 7, 'booster': 'dart', 'scale_pos_weight': 2.356664807559511, 'alpha': 3.83049109543697, 'lambda': 3.948994393088316, 'eta': 0.49408765640859265, 'sampling_method': 'uniform', 'subsample': 0.010943119613407493, 'gamma': 4.807904685814133}. Best is trial 4 with value: 2.032977880923993.
[I 2023-12-19 00:28:12,395] Trial 12 pruned. Trial was pruned at iteration 0.
[I 2023-12-19 00:28:12,453] Trial 13 pruned. Trial was pruned at iteration 0.
[I 2023-12-19 00:28:12,509] Trial 14 pruned. Trial was pruned at iteration 1.
[I 2023-12-19 00:28:15,110] Trial 15 finished with value: inf and parameters: {'learning_rate': 0.6782748669332976, 'aft_loss_distribution': 'logistic', 'aft_loss_distribution_scale': 1.721002397072961, 'max_depth': 10, 'booster': 'dart', 'scale_pos_weight': 1.9245402427378953, 'alpha': 9.986231813802762, 'lambda': 7.708048654907781, 'eta': 0.37884419300753547, 'sampling_method': 'uniform', 'subsample': 0.17579162426853867, 'gamma': 3.83019384373533}. Best is trial 4 with value: 2.032977880923993.
[I 2023-12-19 00:28:15,423] Trial 16 finished with value: inf and parameters: {'learning_rate': 0.9887285596019116, 'aft_loss_distribution': 'normal', 'aft_loss_distribution_scale': 3.474216011626677, 'max_depth': 5, 'booster': 'gbtree', 'scale_pos_weight': 2.8721616806107777, 'alpha': 4.340955261176132, 'lambda': 4.428528316096809, 'eta': 0.6088732047226331, 'sampling_method': 'gradient_based', 'subsample': 0.22579199464679395, 'gamma': 6.1080563963908485}. Best is trial 4 with value: 2.032977880923993.
[I 2023-12-19 00:28:15,527] Trial 17 pruned. Trial was pruned at iteration 0.
[I 2023-12-19 00:28:17,466] Trial 18 finished with value: inf and parameters: {'learning_rate': 0.28387722604485643, 'aft_loss_distribution': 'logistic', 'aft_loss_distribution_scale': 1.1132272236648875, 'max_depth': 7, 'booster': 'dart', 'scale_pos_weight': 1.006677019859867, 'alpha': 3.3975530892405374, 'lambda': 5.75363672262722, 'eta': 0.9889574116990644, 'sampling_method': 'uniform', 'subsample': 0.9992206240864812, 'gamma': 4.694432762217966}. Best is trial 4 with value: 2.032977880923993.
[I 2023-12-19 00:28:17,546] Trial 19 pruned. Trial was pruned at iteration 0.
[I 2023-12-19 00:28:17,628] Trial 20 pruned. Trial was pruned at iteration 0.
[I 2023-12-19 00:28:17,709] Trial 21 pruned. Trial was pruned at iteration 0.
[I 2023-12-19 00:28:19,082] Trial 22 finished with value: inf and parameters: {'learning_rate': 0.9327199301264661, 'aft_loss_distribution': 'normal', 'aft_loss_distribution_scale': 2.482095486749514, 'max_depth': 6, 'booster': 'dart', 'scale_pos_weight': 2.4770631801897713, 'alpha': 1.1255326197174491, 'lambda': 4.015590399210682, 'eta': 0.3354225840516397, 'sampling_method': 'uniform', 'subsample': 0.26425263294711276, 'gamma': 4.180554541436841}. Best is trial 4 with value: 2.032977880923993.
[I 2023-12-19 00:28:19,139] Trial 23 pruned. Trial was pruned at iteration 0.
[I 2023-12-19 00:28:19,197] Trial 24 pruned. Trial was pruned at iteration 0.
[I 2023-12-19 00:28:19,261] Trial 25 pruned. Trial was pruned at iteration 0.
[I 2023-12-19 00:28:19,321] Trial 26 pruned. Trial was pruned at iteration 0.
[I 2023-12-19 00:28:19,374] Trial 27 pruned. Trial was pruned at iteration 0.
[I 2023-12-19 00:28:19,432] Trial 28 pruned. Trial was pruned at iteration 0.
[I 2023-12-19 00:28:19,489] Trial 29 pruned. Trial was pruned at iteration 0.
[I 2023-12-19 00:28:19,546] Trial 30 pruned. Trial was pruned at iteration 0.
[I 2023-12-19 00:28:19,614] Trial 31 pruned. Trial was pruned at iteration 0.
[I 2023-12-19 00:28:19,669] Trial 32 pruned. Trial was pruned at iteration 0.
[I 2023-12-19 00:28:19,725] Trial 33 pruned. Trial was pruned at iteration 0.
[I 2023-12-19 00:28:19,787] Trial 34 pruned. Trial was pruned at iteration 0.
[I 2023-12-19 00:28:19,841] Trial 35 pruned. Trial was pruned at iteration 0.
[I 2023-12-19 00:28:19,898] Trial 36 pruned. Trial was pruned at iteration 0.
