[I 2023-12-19 00:16:23,270] Trial 274 finished with value: 2.026339532358936 and parameters: {'learning_rate': 0.9998090127175084, 'aft_loss_distribution': 'normal', 'aft_loss_distribution_scale': 1.6794596634499703, 'max_depth': 4, 'booster': 'dart', 'scale_pos_weight': 0.265746787869672, 'alpha': 6.6641801469867135, 'lambda': 8.537661653142715, 'eta': 0.7759597774760683, 'sampling_method': 'uniform', 'subsample': 0.06836512312199805, 'gamma': 9.985541226459429}. Best is trial 249 with value: 2.005250471826102.
[I 2023-12-19 00:16:29,440] Trial 275 finished with value: 2.0210191921281484 and parameters: {'learning_rate': 0.9797500592045569, 'aft_loss_distribution': 'normal', 'aft_loss_distribution_scale': 1.6504772391968798, 'max_depth': 4, 'booster': 'dart', 'scale_pos_weight': 0.31383778739403856, 'alpha': 6.77188002489509, 'lambda': 8.45670914477108, 'eta': 0.7450709517046568, 'sampling_method': 'uniform', 'subsample': 0.07080649806958726, 'gamma': 9.988858569407922}. Best is trial 249 with value: 2.005250471826102.
[I 2023-12-19 00:16:38,723] Trial 276 finished with value: 2.016935303310295 and parameters: {'learning_rate': 0.9818972503948938, 'aft_loss_distribution': 'normal', 'aft_loss_distribution_scale': 1.3310812283347726, 'max_depth': 4, 'booster': 'dart', 'scale_pos_weight': 0.35806226473320524, 'alpha': 6.9790624567207, 'lambda': 8.42879559340556, 'eta': 0.7485590414374849, 'sampling_method': 'uniform', 'subsample': 0.0621189175861428, 'gamma': 9.980010278582798}. Best is trial 249 with value: 2.005250471826102.
[I 2023-12-19 00:16:38,815] Trial 277 pruned. Trial was pruned at iteration 2.
[I 2023-12-19 00:16:54,204] Trial 278 finished with value: 2.012925669039012 and parameters: {'learning_rate': 0.9993380228286662, 'aft_loss_distribution': 'normal', 'aft_loss_distribution_scale': 1.5621927965745408, 'max_depth': 4, 'booster': 'dart', 'scale_pos_weight': 0.357132173910232, 'alpha': 6.708030039169222, 'lambda': 8.571356349668024, 'eta': 0.7658520053685102, 'sampling_method': 'uniform', 'subsample': 0.06054297685068995, 'gamma': 9.662674071756182}. Best is trial 249 with value: 2.005250471826102.
[I 2023-12-19 00:16:54,291] Trial 279 pruned. Trial was pruned at iteration 0.
[I 2023-12-19 00:16:54,375] Trial 280 pruned. Trial was pruned at iteration 0.
[I 2023-12-19 00:16:58,102] Trial 281 finished with value: 2.0238258588857096 and parameters: {'learning_rate': 0.9635893902095918, 'aft_loss_distribution': 'normal', 'aft_loss_distribution_scale': 1.5106278335695325, 'max_depth': 4, 'booster': 'dart', 'scale_pos_weight': 2.2051588128959363, 'alpha': 8.109703237442078, 'lambda': 8.277282616538052, 'eta': 0.755355646370956, 'sampling_method': 'uniform', 'subsample': 0.09306520523829952, 'gamma': 9.675407287154977}. Best is trial 249 with value: 2.005250471826102.
[I 2023-12-19 00:17:00,021] Trial 282 finished with value: inf and parameters: {'learning_rate': 0.9646097019622368, 'aft_loss_distribution': 'normal', 'aft_loss_distribution_scale': 1.433799423977323, 'max_depth': 4, 'booster': 'dart', 'scale_pos_weight': 2.2116453655376973, 'alpha': 8.121404762510092, 'lambda': 8.197323597469499, 'eta': 0.7592358702694806, 'sampling_method': 'uniform', 'subsample': 0.08305308415561155, 'gamma': 9.544282046365346}. Best is trial 249 with value: 2.005250471826102.
[I 2023-12-19 00:17:00,169] Trial 283 pruned. Trial was pruned at iteration 0.
[I 2023-12-19 00:17:00,294] Trial 284 pruned. Trial was pruned at iteration 0.
[I 2023-12-19 00:17:00,406] Trial 285 pruned. Trial was pruned at iteration 0.
[I 2023-12-19 00:17:00,519] Trial 286 pruned. Trial was pruned at iteration 0.
[I 2023-12-19 00:17:00,628] Trial 287 pruned. Trial was pruned at iteration 0.
[I 2023-12-19 00:17:03,228] Trial 288 finished with value: inf and parameters: {'learning_rate': 0.9528950406974728, 'aft_loss_distribution': 'normal', 'aft_loss_distribution_scale': 1.4195174841322766, 'max_depth': 4, 'booster': 'dart', 'scale_pos_weight': 0.2841969829219626, 'alpha': 6.500412000770946, 'lambda': 8.089842932342448, 'eta': 0.7805671388733201, 'sampling_method': 'uniform', 'subsample': 0.2041572338108826, 'gamma': 9.998789794911273}. Best is trial 249 with value: 2.005250471826102.
[I 2023-12-19 00:17:04,660] Trial 289 finished with value: inf and parameters: {'learning_rate': 0.9981139502703882, 'aft_loss_distribution': 'normal', 'aft_loss_distribution_scale': 1.6310688517856966, 'max_depth': 4, 'booster': 'dart', 'scale_pos_weight': 0.3731280227020185, 'alpha': 6.908028846074535, 'lambda': 8.29814961764396, 'eta': 0.6950527482404592, 'sampling_method': 'uniform', 'subsample': 0.08604836796045043, 'gamma': 9.521848772613136}. Best is trial 249 with value: 2.005250471826102.
[I 2023-12-19 00:17:04,740] Trial 290 pruned. Trial was pruned at iteration 0.
[I 2023-12-19 00:17:06,480] Trial 291 finished with value: inf and parameters: {'learning_rate': 0.9812976733579772, 'aft_loss_distribution': 'normal', 'aft_loss_distribution_scale': 1.323273379176556, 'max_depth': 4, 'booster': 'dart', 'scale_pos_weight': 2.1387251172901385, 'alpha': 6.592053222241739, 'lambda': 8.751846735750503, 'eta': 0.799922858058061, 'sampling_method': 'uniform', 'subsample': 0.21104787211314205, 'gamma': 9.310547275213995}. Best is trial 249 with value: 2.005250471826102.
[I 2023-12-19 00:17:13,792] Trial 292 finished with value: 2.020084773845042 and parameters: {'learning_rate': 0.9538645023383974, 'aft_loss_distribution': 'normal', 'aft_loss_distribution_scale': 1.5836261242891658, 'max_depth': 4, 'booster': 'dart', 'scale_pos_weight': 0.29180118425175194, 'alpha': 7.654453936161497, 'lambda': 8.572165934007794, 'eta': 0.7503789342732654, 'sampling_method': 'uniform', 'subsample': 0.10711052092450005, 'gamma': 9.611617821462339}. Best is trial 249 with value: 2.005250471826102.
[I 2023-12-19 00:17:13,924] Trial 293 pruned. Trial was pruned at iteration 0.
[I 2023-12-19 00:17:14,062] Trial 294 pruned. Trial was pruned at iteration 0.
[I 2023-12-19 00:17:16,799] Trial 295 finished with value: inf and parameters: {'learning_rate': 0.9799593963570162, 'aft_loss_distribution': 'normal', 'aft_loss_distribution_scale': 1.6296413013662336, 'max_depth': 4, 'booster': 'dart', 'scale_pos_weight': 0.4187485538944262, 'alpha': 7.558784943800342, 'lambda': 8.551560931733189, 'eta': 0.8321610740003765, 'sampling_method': 'uniform', 'subsample': 0.10215374080253872, 'gamma': 9.505686459183945}. Best is trial 249 with value: 2.005250471826102.
[I 2023-12-19 00:17:16,883] Trial 296 pruned. Trial was pruned at iteration 0.
[I 2023-12-19 00:17:16,964] Trial 297 pruned. Trial was pruned at iteration 1.
[I 2023-12-19 00:17:17,041] Trial 298 pruned. Trial was pruned at iteration 0.
[I 2023-12-19 00:17:19,455] Trial 299 finished with value: inf and parameters: {'learning_rate': 0.9652109378558075, 'aft_loss_distribution': 'normal', 'aft_loss_distribution_scale': 1.46759839531582, 'max_depth': 4, 'booster': 'dart', 'scale_pos_weight': 2.660283323629173, 'alpha': 6.660518107424839, 'lambda': 7.823675791713204, 'eta': 0.7692710737952851, 'sampling_method': 'uniform', 'subsample': 0.2614034467906262, 'gamma': 9.298545557205737}. Best is trial 249 with value: 2.005250471826102.
[I 2023-12-19 00:17:20,913] Trial 300 finished with value: inf and parameters: {'learning_rate': 0.9829563663503699, 'aft_loss_distribution': 'normal', 'aft_loss_distribution_scale': 1.3020885402653772, 'max_depth': 4, 'booster': 'dart', 'scale_pos_weight': 0.24466513748161356, 'alpha': 9.06862583517978, 'lambda': 7.982009067656535, 'eta': 0.8042080463703367, 'sampling_method': 'uniform', 'subsample': 0.08149651454391163, 'gamma': 9.706032278753726}. Best is trial 249 with value: 2.005250471826102.
[I 2023-12-19 00:17:30,282] Trial 301 finished with value: 2.018139457368901 and parameters: {'learning_rate': 0.950786309539393, 'aft_loss_distribution': 'normal', 'aft_loss_distribution_scale': 1.674400918738331, 'max_depth': 4, 'booster': 'dart', 'scale_pos_weight': 0.160426508260224, 'alpha': 8.189220332375353, 'lambda': 8.7287245009511, 'eta': 0.8359062261647412, 'sampling_method': 'uniform', 'subsample': 0.16137209039156147, 'gamma': 9.662109856691037}. Best is trial 249 with value: 2.005250471826102.
[I 2023-12-19 00:17:30,416] Trial 302 pruned. Trial was pruned at iteration 0.
[I 2023-12-19 00:17:30,538] Trial 303 pruned. Trial was pruned at iteration 0.
[I 2023-12-19 00:17:36,680] Trial 304 finished with value: 2.012095077027354 and parameters: {'learning_rate': 0.9825354759079044, 'aft_loss_distribution': 'normal', 'aft_loss_distribution_scale': 1.6526411197617759, 'max_depth': 4, 'booster': 'dart', 'scale_pos_weight': 0.1760035607184341, 'alpha': 6.753298618397801, 'lambda': 7.719861613466607, 'eta': 0.8484450367999743, 'sampling_method': 'uniform', 'subsample': 0.21903577171242136, 'gamma': 9.84591597099106}. Best is trial 249 with value: 2.005250471826102.
[I 2023-12-19 00:17:43,102] Trial 305 finished with value: 2.0088829663268792 and parameters: {'learning_rate': 0.999675924911574, 'aft_loss_distribution': 'normal', 'aft_loss_distribution_scale': 1.5954569614260237, 'max_depth': 4, 'booster': 'dart', 'scale_pos_weight': 0.12469806415438897, 'alpha': 8.321746871393778, 'lambda': 7.747797319483218, 'eta': 0.8225515377583845, 'sampling_method': 'uniform', 'subsample': 0.21914333347740308, 'gamma': 9.863223250430147}. Best is trial 249 with value: 2.005250471826102.
[I 2023-12-19 00:18:16,442] Trial 306 finished with value: 2.00943733195036 and parameters: {'learning_rate': 0.9969592899122245, 'aft_loss_distribution': 'normal', 'aft_loss_distribution_scale': 1.6699400494353767, 'max_depth': 4, 'booster': 'dart', 'scale_pos_weight': 0.12601957873100922, 'alpha': 8.288504918411975, 'lambda': 7.795754652362905, 'eta': 0.8325643879902842, 'sampling_method': 'uniform', 'subsample': 0.24975402155516968, 'gamma': 9.993831335578365}. Best is trial 249 with value: 2.005250471826102.
[I 2023-12-19 00:18:18,014] Trial 307 finished with value: inf and parameters: {'learning_rate': 0.9973363494385044, 'aft_loss_distribution': 'normal', 'aft_loss_distribution_scale': 1.310147186877765, 'max_depth': 4, 'booster': 'dart', 'scale_pos_weight': 0.11701965868551287, 'alpha': 8.572247177695711, 'lambda': 7.732086086322882, 'eta': 0.8312223203759807, 'sampling_method': 'uniform', 'subsample': 0.24166455264562606, 'gamma': 9.815705017526382}. Best is trial 249 with value: 2.005250471826102.
[I 2023-12-19 00:18:18,103] Trial 308 pruned. Trial was pruned at iteration 0.
[I 2023-12-19 00:18:18,182] Trial 309 pruned. Trial was pruned at iteration 0.
[I 2023-12-19 00:18:18,264] Trial 310 pruned. Trial was pruned at iteration 0.
[I 2023-12-19 00:18:31,498] Trial 311 finished with value: 2.0147360532820877 and parameters: {'learning_rate': 0.9994921271277042, 'aft_loss_distribution': 'normal', 'aft_loss_distribution_scale': 1.7383028732516703, 'max_depth': 4, 'booster': 'dart', 'scale_pos_weight': 0.1263617441875487, 'alpha': 7.9539849343056375, 'lambda': 7.833451231560979, 'eta': 0.8516932423932454, 'sampling_method': 'uniform', 'subsample': 0.25783173442434226, 'gamma': 9.993807841111844}. Best is trial 249 with value: 2.005250471826102.
[I 2023-12-19 00:18:31,581] Trial 312 pruned. Trial was pruned at iteration 0.
[I 2023-12-19 00:18:48,465] Trial 313 finished with value: 2.013946098398572 and parameters: {'learning_rate': 0.9807395177919777, 'aft_loss_distribution': 'normal', 'aft_loss_distribution_scale': 1.6892667157699097, 'max_depth': 4, 'booster': 'dart', 'scale_pos_weight': 0.1411827339593621, 'alpha': 7.90650133752034, 'lambda': 7.680629752843637, 'eta': 0.8540950354126094, 'sampling_method': 'uniform', 'subsample': 0.284693538858263, 'gamma': 9.82597495411225}. Best is trial 249 with value: 2.005250471826102.
[I 2023-12-19 00:18:54,498] Trial 314 finished with value: 2.0110353024110026 and parameters: {'learning_rate': 0.999485182792356, 'aft_loss_distribution': 'normal', 'aft_loss_distribution_scale': 1.6864436885928278, 'max_depth': 8, 'booster': 'dart', 'scale_pos_weight': 0.12121018719616725, 'alpha': 7.988908115694504, 'lambda': 7.747599034203575, 'eta': 0.8106879376009142, 'sampling_method': 'uniform', 'subsample': 0.2526656624588613, 'gamma': 9.768296364307375}. Best is trial 249 with value: 2.005250471826102.
[I 2023-12-19 00:18:56,412] Trial 315 finished with value: inf and parameters: {'learning_rate': 0.9969060357681899, 'aft_loss_distribution': 'normal', 'aft_loss_distribution_scale': 1.3306356600655027, 'max_depth': 4, 'booster': 'dart', 'scale_pos_weight': 0.11518012588841167, 'alpha': 7.9527671144500145, 'lambda': 7.705895405043816, 'eta': 0.8563348414870564, 'sampling_method': 'uniform', 'subsample': 0.27463869688878817, 'gamma': 9.854629420760185}. Best is trial 249 with value: 2.005250471826102.
[I 2023-12-19 00:18:58,303] Trial 316 finished with value: inf and parameters: {'learning_rate': 0.980595451589417, 'aft_loss_distribution': 'normal', 'aft_loss_distribution_scale': 1.459994688109851, 'max_depth': 7, 'booster': 'dart', 'scale_pos_weight': 0.1303662328211136, 'alpha': 7.861543026385648, 'lambda': 7.643741657904383, 'eta': 0.8069381481268935, 'sampling_method': 'uniform', 'subsample': 0.25278625979929886, 'gamma': 9.993473304036682}. Best is trial 249 with value: 2.005250471826102.
[I 2023-12-19 00:18:58,759] Trial 317 pruned. Trial was pruned at iteration 18.
[I 2023-12-19 00:19:03,579] Trial 318 finished with value: 2.0144998473317903 and parameters: {'learning_rate': 0.9752058460080003, 'aft_loss_distribution': 'normal', 'aft_loss_distribution_scale': 1.6728080871740967, 'max_depth': 9, 'booster': 'dart', 'scale_pos_weight': 0.10935877311359374, 'alpha': 8.587557362107106, 'lambda': 7.782588239292491, 'eta': 0.8033603058942903, 'sampling_method': 'uniform', 'subsample': 0.23697652697753774, 'gamma': 9.427132460894985}. Best is trial 249 with value: 2.005250471826102.
[I 2023-12-19 00:19:19,176] Trial 319 finished with value: 2.0164528556835544 and parameters: {'learning_rate': 0.9690487844581196, 'aft_loss_distribution': 'normal', 'aft_loss_distribution_scale': 1.7354890255096473, 'max_depth': 9, 'booster': 'dart', 'scale_pos_weight': 0.10958387488413324, 'alpha': 8.900309536237838, 'lambda': 7.749742525545761, 'eta': 0.8096688999072256, 'sampling_method': 'uniform', 'subsample': 0.24481100444816614, 'gamma': 9.245767581270655}. Best is trial 249 with value: 2.005250471826102.
[I 2023-12-19 00:19:19,262] Trial 320 pruned. Trial was pruned at iteration 0.
[I 2023-12-19 00:19:21,498] Trial 321 finished with value: inf and parameters: {'learning_rate': 0.9993761022830644, 'aft_loss_distribution': 'normal', 'aft_loss_distribution_scale': 1.7212105706139085, 'max_depth': 4, 'booster': 'dart', 'scale_pos_weight': 0.1008561902738384, 'alpha': 8.958243037278898, 'lambda': 7.606060250297796, 'eta': 0.8206056721263171, 'sampling_method': 'uniform', 'subsample': 0.2484672115707732, 'gamma': 9.353707261785331}. Best is trial 249 with value: 2.005250471826102.
[I 2023-12-19 00:19:28,731] Trial 322 finished with value: 2.0146901275278633 and parameters: {'learning_rate': 0.9680499471879854, 'aft_loss_distribution': 'normal', 'aft_loss_distribution_scale': 1.7243538168969033, 'max_depth': 9, 'booster': 'dart', 'scale_pos_weight': 0.1158631366664132, 'alpha': 8.681811089687795, 'lambda': 7.973190156691584, 'eta': 0.84159225136145, 'sampling_method': 'uniform', 'subsample': 0.23148904797811168, 'gamma': 9.169912817506027}. Best is trial 249 with value: 2.005250471826102.
[I 2023-12-19 00:19:28,824] Trial 323 pruned. Trial was pruned at iteration 0.
[I 2023-12-19 00:19:30,368] Trial 324 finished with value: inf and parameters: {'learning_rate': 0.9819125560237737, 'aft_loss_distribution': 'normal', 'aft_loss_distribution_scale': 1.5272496600614098, 'max_depth': 10, 'booster': 'dart', 'scale_pos_weight': 0.09544349809707314, 'alpha': 8.46479650853294, 'lambda': 7.513644334368202, 'eta': 0.8542508738170272, 'sampling_method': 'uniform', 'subsample': 0.277695679433975, 'gamma': 9.123262603707712}. Best is trial 249 with value: 2.005250471826102.
[I 2023-12-19 00:19:36,156] Trial 325 pruned. Trial was pruned at iteration 112.
[I 2023-12-19 00:19:40,883] Trial 326 finished with value: 2.0042879065393104 and parameters: {'learning_rate': 0.9717125889397126, 'aft_loss_distribution': 'normal', 'aft_loss_distribution_scale': 1.5355325833691171, 'max_depth': 9, 'booster': 'dart', 'scale_pos_weight': 0.22728220809311553, 'alpha': 8.035655915512146, 'lambda': 8.032457448105609, 'eta': 0.852978562651523, 'sampling_method': 'uniform', 'subsample': 0.2909388825606902, 'gamma': 9.465782406306271}. Best is trial 326 with value: 2.0042879065393104.
[I 2023-12-19 00:19:52,476] Trial 327 finished with value: 2.0061283517991715 and parameters: {'learning_rate': 0.9701253267533674, 'aft_loss_distribution': 'normal', 'aft_loss_distribution_scale': 1.5500312566110601, 'max_depth': 9, 'booster': 'dart', 'scale_pos_weight': 0.10582738251422551, 'alpha': 8.257309225028385, 'lambda': 8.076453825810887, 'eta': 0.8534056519162371, 'sampling_method': 'uniform', 'subsample': 0.3000646520428393, 'gamma': 9.478472142095772}. Best is trial 326 with value: 2.0042879065393104.
[I 2023-12-19 00:19:54,409] Trial 328 finished with value: inf and parameters: {'learning_rate': 0.9681207725806064, 'aft_loss_distribution': 'normal', 'aft_loss_distribution_scale': 1.4795738836240442, 'max_depth': 9, 'booster': 'dart', 'scale_pos_weight': 0.22085594024228644, 'alpha': 8.2371796892396, 'lambda': 8.054253480261698, 'eta': 0.8568579503052037, 'sampling_method': 'uniform', 'subsample': 0.2964703903408585, 'gamma': 9.527499732661694}. Best is trial 326 with value: 2.0042879065393104.
[I 2023-12-19 00:20:02,307] Trial 329 pruned. Trial was pruned at iteration 125.
[I 2023-12-19 00:20:03,847] Trial 330 finished with value: inf and parameters: {'learning_rate': 0.9685769791384284, 'aft_loss_distribution': 'normal', 'aft_loss_distribution_scale': 1.4752010605599692, 'max_depth': 9, 'booster': 'dart', 'scale_pos_weight': 0.19013186074859317, 'alpha': 7.818588022442386, 'lambda': 7.891990857439918, 'eta': 0.8479233364849788, 'sampling_method': 'uniform', 'subsample': 0.2724956503605537, 'gamma': 9.517946328276096}. Best is trial 326 with value: 2.0042879065393104.
[I 2023-12-19 00:20:11,051] Trial 331 finished with value: 2.0176570595605345 and parameters: {'learning_rate': 0.9466510087626071, 'aft_loss_distribution': 'normal', 'aft_loss_distribution_scale': 1.7536570042740696, 'max_depth': 9, 'booster': 'dart', 'scale_pos_weight': 0.24858927528445657, 'alpha': 8.758574172239204, 'lambda': 7.874244016866524, 'eta': 0.8639908252717786, 'sampling_method': 'uniform', 'subsample': 0.2643771620421716, 'gamma': 9.696399835285513}. Best is trial 326 with value: 2.0042879065393104.
[I 2023-12-19 00:20:11,185] Trial 332 pruned. Trial was pruned at iteration 0.
[I 2023-12-19 00:20:13,479] Trial 333 finished with value: inf and parameters: {'learning_rate': 0.9643847853662613, 'aft_loss_distribution': 'normal', 'aft_loss_distribution_scale': 1.5326262927703072, 'max_depth': 9, 'booster': 'dart', 'scale_pos_weight': 0.18130900731868743, 'alpha': 8.407432417167685, 'lambda': 7.690459118763204, 'eta': 0.8429916741337136, 'sampling_method': 'uniform', 'subsample': 0.2506174977973096, 'gamma': 9.49175904107874}. Best is trial 326 with value: 2.0042879065393104.
[I 2023-12-19 00:20:13,573] Trial 334 pruned. Trial was pruned at iteration 2.
[I 2023-12-19 00:20:13,658] Trial 335 pruned. Trial was pruned at iteration 0.
[I 2023-12-19 00:20:13,749] Trial 336 pruned. Trial was pruned at iteration 0.
[I 2023-12-19 00:20:16,670] Trial 337 finished with value: 2.0026640461630887 and parameters: {'learning_rate': 0.965089405058674, 'aft_loss_distribution': 'normal', 'aft_loss_distribution_scale': 1.3718298852648567, 'max_depth': 8, 'booster': 'dart', 'scale_pos_weight': 0.09659720424187115, 'alpha': 7.904204962871646, 'lambda': 8.121435473383821, 'eta': 0.790796014259735, 'sampling_method': 'uniform', 'subsample': 0.2682107211080169, 'gamma': 9.435793214794339}. Best is trial 337 with value: 2.0026640461630887.
[I 2023-12-19 00:20:16,755] Trial 338 pruned. Trial was pruned at iteration 0.
[I 2023-12-19 00:20:18,563] Trial 339 finished with value: inf and parameters: {'learning_rate': 0.9661323519128004, 'aft_loss_distribution': 'normal', 'aft_loss_distribution_scale': 1.259371178492382, 'max_depth': 8, 'booster': 'dart', 'scale_pos_weight': 0.16891433845667955, 'alpha': 8.27027604883798, 'lambda': 7.889397995048166, 'eta': 0.8201805105827393, 'sampling_method': 'uniform', 'subsample': 0.25860998304790916, 'gamma': 9.996458559659557}. Best is trial 337 with value: 2.0026640461630887.
[I 2023-12-19 00:20:20,052] Trial 340 finished with value: inf and parameters: {'learning_rate': 0.9997429598592744, 'aft_loss_distribution': 'normal', 'aft_loss_distribution_scale': 1.4141064771533691, 'max_depth': 9, 'booster': 'dart', 'scale_pos_weight': 0.09243500140899191, 'alpha': 7.597295425162012, 'lambda': 8.133516103670159, 'eta': 0.8380766714627979, 'sampling_method': 'gradient_based', 'subsample': 0.28234991776806784, 'gamma': 9.153842432156715}. Best is trial 337 with value: 2.0026640461630887.
[I 2023-12-19 00:20:20,134] Trial 341 pruned. Trial was pruned at iteration 0.
[I 2023-12-19 00:20:20,219] Trial 342 pruned. Trial was pruned at iteration 1.
[I 2023-12-19 00:20:21,706] Trial 343 finished with value: inf and parameters: {'learning_rate': 0.9998227880097234, 'aft_loss_distribution': 'normal', 'aft_loss_distribution_scale': 1.5085013397531677, 'max_depth': 9, 'booster': 'dart', 'scale_pos_weight': 0.08815411094940959, 'alpha': 7.966378207995651, 'lambda': 7.989300451908556, 'eta': 0.7980249452342469, 'sampling_method': 'uniform', 'subsample': 0.30303102134895243, 'gamma': 3.7186180284159436}. Best is trial 337 with value: 2.0026640461630887.
