[I 2023-12-19 00:00:14,106] Trial 377 finished with value: inf and parameters: {'learning_rate': 0.7098149241368573, 'aft_loss_distribution': 'normal', 'aft_loss_distribution_scale': 1.4191310838821232, 'max_depth': 10, 'booster': 'dart', 'scale_pos_weight': 0.27447553603309915, 'alpha': 7.307714434626851, 'lambda': 2.1129562223756464, 'eta': 0.1880060703879419, 'sampling_method': 'uniform', 'subsample': 0.4602466251839187, 'gamma': 9.82403322696488}. Best is trial 370 with value: 4.291290072824398.
[I 2023-12-19 00:00:14,206] Trial 378 pruned. Trial was pruned at iteration 0.
[I 2023-12-19 00:00:14,300] Trial 379 pruned. Trial was pruned at iteration 0.
[I 2023-12-19 00:00:14,381] Trial 380 pruned. Trial was pruned at iteration 0.
[I 2023-12-19 00:00:14,484] Trial 381 pruned. Trial was pruned at iteration 1.
[I 2023-12-19 00:00:14,567] Trial 382 pruned. Trial was pruned at iteration 0.
[I 2023-12-19 00:00:14,654] Trial 383 pruned. Trial was pruned at iteration 1.
[I 2023-12-19 00:00:19,228] Trial 384 finished with value: 4.304629881773973 and parameters: {'learning_rate': 0.7042859103454007, 'aft_loss_distribution': 'normal', 'aft_loss_distribution_scale': 1.3833770435491486, 'max_depth': 10, 'booster': 'dart', 'scale_pos_weight': 0.4159635206126099, 'alpha': 7.133294682938846, 'lambda': 2.65413304885414, 'eta': 0.7013902727110798, 'sampling_method': 'uniform', 'subsample': 0.5776392799399461, 'gamma': 9.478820608662922}. Best is trial 370 with value: 4.291290072824398.
[I 2023-12-19 00:00:19,442] Trial 385 pruned. Trial was pruned at iteration 0.
[I 2023-12-19 00:00:21,488] Trial 386 finished with value: inf and parameters: {'learning_rate': 0.7190871880747611, 'aft_loss_distribution': 'normal', 'aft_loss_distribution_scale': 1.2955348748523232, 'max_depth': 10, 'booster': 'dart', 'scale_pos_weight': 0.28278629498007213, 'alpha': 7.039898033646826, 'lambda': 2.694503509959572, 'eta': 0.6785473741534354, 'sampling_method': 'uniform', 'subsample': 0.3839715174834679, 'gamma': 9.750688940033797}. Best is trial 370 with value: 4.291290072824398.
[I 2023-12-19 00:00:21,661] Trial 387 pruned. Trial was pruned at iteration 0.
[I 2023-12-19 00:00:21,798] Trial 388 pruned. Trial was pruned at iteration 0.
[I 2023-12-19 00:00:24,804] Trial 389 finished with value: inf and parameters: {'learning_rate': 0.7058972928263575, 'aft_loss_distribution': 'normal', 'aft_loss_distribution_scale': 1.4072549305420476, 'max_depth': 10, 'booster': 'dart', 'scale_pos_weight': 0.4911287055191824, 'alpha': 7.254240830127736, 'lambda': 2.4892194910493965, 'eta': 0.13830117857768845, 'sampling_method': 'uniform', 'subsample': 0.5828312737442953, 'gamma': 9.821258917200971}. Best is trial 370 with value: 4.291290072824398.
[I 2023-12-19 00:00:27,032] Trial 390 finished with value: inf and parameters: {'learning_rate': 0.7355132226044311, 'aft_loss_distribution': 'normal', 'aft_loss_distribution_scale': 1.1735355477571505, 'max_depth': 10, 'booster': 'dart', 'scale_pos_weight': 0.10496136035088827, 'alpha': 7.536250565539262, 'lambda': 6.654517021846543, 'eta': 0.6483502194289006, 'sampling_method': 'uniform', 'subsample': 0.5313792573924636, 'gamma': 9.313067172292985}. Best is trial 370 with value: 4.291290072824398.
[I 2023-12-19 00:00:27,175] Trial 391 pruned. Trial was pruned at iteration 1.
[I 2023-12-19 00:00:27,301] Trial 392 pruned. Trial was pruned at iteration 0.
[I 2023-12-19 00:00:27,388] Trial 393 pruned. Trial was pruned at iteration 0.
[I 2023-12-19 00:00:27,474] Trial 394 pruned. Trial was pruned at iteration 0.
[I 2023-12-19 00:00:27,557] Trial 395 pruned. Trial was pruned at iteration 0.
[I 2023-12-19 00:00:29,387] Trial 396 finished with value: inf and parameters: {'learning_rate': 0.7302706907799524, 'aft_loss_distribution': 'normal', 'aft_loss_distribution_scale': 1.1821780373739381, 'max_depth': 10, 'booster': 'dart', 'scale_pos_weight': 0.9698058977458979, 'alpha': 6.690677062182934, 'lambda': 5.47533019853174, 'eta': 0.9064947169710107, 'sampling_method': 'uniform', 'subsample': 0.5428007444076517, 'gamma': 9.31168003387837}. Best is trial 370 with value: 4.291290072824398.
[I 2023-12-19 00:00:29,484] Trial 397 pruned. Trial was pruned at iteration 1.
[I 2023-12-19 00:00:29,564] Trial 398 pruned. Trial was pruned at iteration 0.
[I 2023-12-19 00:00:29,664] Trial 399 pruned. Trial was pruned at iteration 1.
[I 2023-12-19 00:00:29,742] Trial 400 pruned. Trial was pruned at iteration 0.
[I 2023-12-19 00:00:29,820] Trial 401 pruned. Trial was pruned at iteration 0.
[I 2023-12-19 00:00:29,902] Trial 402 pruned. Trial was pruned at iteration 0.
[I 2023-12-19 00:00:30,043] Trial 403 pruned. Trial was pruned at iteration 0.
[I 2023-12-19 00:00:30,134] Trial 404 pruned. Trial was pruned at iteration 0.
[I 2023-12-19 00:00:30,222] Trial 405 pruned. Trial was pruned at iteration 0.
[I 2023-12-19 00:00:30,304] Trial 406 pruned. Trial was pruned at iteration 0.
[I 2023-12-19 00:00:30,384] Trial 407 pruned. Trial was pruned at iteration 0.
[I 2023-12-19 00:00:31,988] Trial 408 finished with value: inf and parameters: {'learning_rate': 0.8249095788204311, 'aft_loss_distribution': 'normal', 'aft_loss_distribution_scale': 1.3449824017426268, 'max_depth': 10, 'booster': 'dart', 'scale_pos_weight': 0.26865045703094825, 'alpha': 7.757949921616049, 'lambda': 5.638770844284119, 'eta': 0.8891366595307593, 'sampling_method': 'uniform', 'subsample': 0.6114590548961475, 'gamma': 9.138240302977524}. Best is trial 370 with value: 4.291290072824398.
[I 2023-12-19 00:00:32,104] Trial 409 pruned. Trial was pruned at iteration 1.
[I 2023-12-19 00:00:32,200] Trial 410 pruned. Trial was pruned at iteration 0.
[I 2023-12-19 00:00:32,296] Trial 411 pruned. Trial was pruned at iteration 0.
[I 2023-12-19 00:00:32,379] Trial 412 pruned. Trial was pruned at iteration 0.
[I 2023-12-19 00:00:33,376] Trial 413 finished with value: inf and parameters: {'learning_rate': 0.7617141614739569, 'aft_loss_distribution': 'normal', 'aft_loss_distribution_scale': 1.159238616264167, 'max_depth': 10, 'booster': 'gbtree', 'scale_pos_weight': 0.3960372905030629, 'alpha': 7.995983517633212, 'lambda': 7.333421292685337, 'eta': 0.7921433851376343, 'sampling_method': 'gradient_based', 'subsample': 0.5602451499070421, 'gamma': 9.590566974354731}. Best is trial 370 with value: 4.291290072824398.
[I 2023-12-19 00:00:33,468] Trial 414 pruned. Trial was pruned at iteration 0.
[I 2023-12-19 00:00:33,553] Trial 415 pruned. Trial was pruned at iteration 0.
[I 2023-12-19 00:00:33,641] Trial 416 pruned. Trial was pruned at iteration 0.
[I 2023-12-19 00:00:33,726] Trial 417 pruned. Trial was pruned at iteration 0.
[I 2023-12-19 00:00:33,817] Trial 418 pruned. Trial was pruned at iteration 0.
[I 2023-12-19 00:00:33,901] Trial 419 pruned. Trial was pruned at iteration 0.
[I 2023-12-19 00:00:34,033] Trial 420 pruned. Trial was pruned at iteration 1.
[I 2023-12-19 00:00:34,142] Trial 421 pruned. Trial was pruned at iteration 0.
[I 2023-12-19 00:00:34,237] Trial 422 pruned. Trial was pruned at iteration 1.
[I 2023-12-19 00:00:34,326] Trial 423 pruned. Trial was pruned at iteration 0.
[I 2023-12-19 00:00:34,425] Trial 424 pruned. Trial was pruned at iteration 0.
[I 2023-12-19 00:00:34,514] Trial 425 pruned. Trial was pruned at iteration 0.
[I 2023-12-19 00:00:34,595] Trial 426 pruned. Trial was pruned at iteration 0.
[I 2023-12-19 00:00:34,690] Trial 427 pruned. Trial was pruned at iteration 1.
[I 2023-12-19 00:00:34,774] Trial 428 pruned. Trial was pruned at iteration 0.
[I 2023-12-19 00:00:34,871] Trial 429 pruned. Trial was pruned at iteration 1.
[I 2023-12-19 00:00:34,958] Trial 430 pruned. Trial was pruned at iteration 0.
[I 2023-12-19 00:00:36,416] Trial 431 finished with value: inf and parameters: {'learning_rate': 0.7533633192070853, 'aft_loss_distribution': 'normal', 'aft_loss_distribution_scale': 1.319281665334624, 'max_depth': 10, 'booster': 'dart', 'scale_pos_weight': 0.8367153304567376, 'alpha': 7.999182612538917, 'lambda': 3.511340821213597, 'eta': 0.6465070281203406, 'sampling_method': 'uniform', 'subsample': 0.5908815774779946, 'gamma': 9.760801474238793}. Best is trial 370 with value: 4.291290072824398.
[I 2023-12-19 00:00:36,512] Trial 432 pruned. Trial was pruned at iteration 0.
[I 2023-12-19 00:00:36,597] Trial 433 pruned. Trial was pruned at iteration 0.
[I 2023-12-19 00:00:36,689] Trial 434 pruned. Trial was pruned at iteration 0.
[I 2023-12-19 00:00:36,779] Trial 435 pruned. Trial was pruned at iteration 1.
[I 2023-12-19 00:00:38,595] Trial 436 finished with value: inf and parameters: {'learning_rate': 0.764987134644037, 'aft_loss_distribution': 'normal', 'aft_loss_distribution_scale': 1.33520725962335, 'max_depth': 4, 'booster': 'dart', 'scale_pos_weight': 0.9334204738604308, 'alpha': 2.2804133819974535, 'lambda': 1.0970983388658926, 'eta': 0.7686944288408492, 'sampling_method': 'uniform', 'subsample': 0.5355173455795688, 'gamma': 9.247317499588776}. Best is trial 370 with value: 4.291290072824398.
[I 2023-12-19 00:00:38,743] Trial 437 pruned. Trial was pruned at iteration 0.
[I 2023-12-19 00:00:38,886] Trial 438 pruned. Trial was pruned at iteration 0.
[I 2023-12-19 00:00:39,029] Trial 439 pruned. Trial was pruned at iteration 0.
[I 2023-12-19 00:00:39,164] Trial 440 pruned. Trial was pruned at iteration 0.
[I 2023-12-19 00:00:39,307] Trial 441 pruned. Trial was pruned at iteration 0.
[I 2023-12-19 00:00:39,476] Trial 442 pruned. Trial was pruned at iteration 0.
[I 2023-12-19 00:00:39,623] Trial 443 pruned. Trial was pruned at iteration 0.
[I 2023-12-19 00:00:39,761] Trial 444 pruned. Trial was pruned at iteration 0.
[I 2023-12-19 00:00:39,917] Trial 445 pruned. Trial was pruned at iteration 0.
[I 2023-12-19 00:00:40,052] Trial 446 pruned. Trial was pruned at iteration 0.
[I 2023-12-19 00:00:42,056] Trial 447 finished with value: inf and parameters: {'learning_rate': 0.8068491804782091, 'aft_loss_distribution': 'normal', 'aft_loss_distribution_scale': 1.3783484217629773, 'max_depth': 10, 'booster': 'dart', 'scale_pos_weight': 2.958242908964235, 'alpha': 8.992768474273083, 'lambda': 1.8499156881215137, 'eta': 0.18505083127689176, 'sampling_method': 'uniform', 'subsample': 0.535825226801462, 'gamma': 9.337389237981746}. Best is trial 370 with value: 4.291290072824398.
[I 2023-12-19 00:00:42,150] Trial 448 pruned. Trial was pruned at iteration 0.
[I 2023-12-19 00:00:42,234] Trial 449 pruned. Trial was pruned at iteration 0.
[I 2023-12-19 00:00:42,331] Trial 450 pruned. Trial was pruned at iteration 1.
[I 2023-12-19 00:00:42,465] Trial 451 pruned. Trial was pruned at iteration 0.
[I 2023-12-19 00:00:42,563] Trial 452 pruned. Trial was pruned at iteration 1.
[I 2023-12-19 00:00:42,657] Trial 453 pruned. Trial was pruned at iteration 1.
[I 2023-12-19 00:00:42,752] Trial 454 pruned. Trial was pruned at iteration 0.
[I 2023-12-19 00:00:42,842] Trial 455 pruned. Trial was pruned at iteration 0.
[I 2023-12-19 00:00:42,946] Trial 456 pruned. Trial was pruned at iteration 0.
[I 2023-12-19 00:00:43,127] Trial 457 pruned. Trial was pruned at iteration 2.
[I 2023-12-19 00:00:43,308] Trial 458 pruned. Trial was pruned at iteration 0.
[I 2023-12-19 00:00:43,398] Trial 459 pruned. Trial was pruned at iteration 0.
[I 2023-12-19 00:00:43,511] Trial 460 pruned. Trial was pruned at iteration 1.
[I 2023-12-19 00:00:43,600] Trial 461 pruned. Trial was pruned at iteration 0.
[I 2023-12-19 00:00:43,856] Trial 462 pruned. Trial was pruned at iteration 2.
[I 2023-12-19 00:00:43,942] Trial 463 pruned. Trial was pruned at iteration 0.
[I 2023-12-19 00:00:44,053] Trial 464 pruned. Trial was pruned at iteration 0.
[I 2023-12-19 00:00:44,145] Trial 465 pruned. Trial was pruned at iteration 0.
[I 2023-12-19 00:00:46,390] Trial 466 finished with value: inf and parameters: {'learning_rate': 0.7888895124648241, 'aft_loss_distribution': 'normal', 'aft_loss_distribution_scale': 0.9469168513391952, 'max_depth': 10, 'booster': 'dart', 'scale_pos_weight': 0.7112498133050172, 'alpha': 7.9633041199301, 'lambda': 4.829343050035347, 'eta': 0.5880066090230427, 'sampling_method': 'uniform', 'subsample': 0.6383783517471139, 'gamma': 9.017262527561192}. Best is trial 370 with value: 4.291290072824398.
[I 2023-12-19 00:00:46,487] Trial 467 pruned. Trial was pruned at iteration 0.
[I 2023-12-19 00:00:46,589] Trial 468 pruned. Trial was pruned at iteration 0.
[I 2023-12-19 00:00:46,676] Trial 469 pruned. Trial was pruned at iteration 0.
[I 2023-12-19 00:00:46,765] Trial 470 pruned. Trial was pruned at iteration 0.
[I 2023-12-19 00:00:46,869] Trial 471 pruned. Trial was pruned at iteration 0.
[I 2023-12-19 00:00:46,992] Trial 472 pruned. Trial was pruned at iteration 1.
[I 2023-12-19 00:00:47,079] Trial 473 pruned. Trial was pruned at iteration 0.
[I 2023-12-19 00:00:47,172] Trial 474 pruned. Trial was pruned at iteration 0.
[I 2023-12-19 00:00:47,263] Trial 475 pruned. Trial was pruned at iteration 0.
[I 2023-12-19 00:00:47,362] Trial 476 pruned. Trial was pruned at iteration 0.
[I 2023-12-19 00:00:48,960] Trial 477 finished with value: inf and parameters: {'learning_rate': 0.7679428052345297, 'aft_loss_distribution': 'normal', 'aft_loss_distribution_scale': 1.3255533229058134, 'max_depth': 10, 'booster': 'dart', 'scale_pos_weight': 1.1008683674081752, 'alpha': 8.169964158843268, 'lambda': 2.2489431938933127, 'eta': 0.9111736927435737, 'sampling_method': 'uniform', 'subsample': 0.48718695679918794, 'gamma': 8.81025900940543}. Best is trial 370 with value: 4.291290072824398.
[I 2023-12-19 00:00:49,061] Trial 478 pruned. Trial was pruned at iteration 0.
[I 2023-12-19 00:00:49,435] Trial 479 pruned. Trial was pruned at iteration 2.
[I 2023-12-19 00:00:49,540] Trial 480 pruned. Trial was pruned at iteration 1.
[I 2023-12-19 00:00:49,655] Trial 481 pruned. Trial was pruned at iteration 0.
[I 2023-12-19 00:00:49,756] Trial 482 pruned. Trial was pruned at iteration 1.
[I 2023-12-19 00:00:49,852] Trial 483 pruned. Trial was pruned at iteration 0.
[I 2023-12-19 00:00:49,969] Trial 484 pruned. Trial was pruned at iteration 1.
[I 2023-12-19 00:00:50,068] Trial 485 pruned. Trial was pruned at iteration 0.
[I 2023-12-19 00:00:50,187] Trial 486 pruned. Trial was pruned at iteration 0.
[I 2023-12-19 00:00:50,296] Trial 487 pruned. Trial was pruned at iteration 1.
[I 2023-12-19 00:00:50,395] Trial 488 pruned. Trial was pruned at iteration 1.
[I 2023-12-19 00:00:50,513] Trial 489 pruned. Trial was pruned at iteration 0.
[I 2023-12-19 00:00:50,603] Trial 490 pruned. Trial was pruned at iteration 0.
[I 2023-12-19 00:00:50,707] Trial 491 pruned. Trial was pruned at iteration 0.
[I 2023-12-19 00:00:50,823] Trial 492 pruned. Trial was pruned at iteration 0.
[I 2023-12-19 00:00:50,920] Trial 493 pruned. Trial was pruned at iteration 0.
[I 2023-12-19 00:00:53,119] Trial 494 finished with value: inf and parameters: {'learning_rate': 0.7812898017851245, 'aft_loss_distribution': 'normal', 'aft_loss_distribution_scale': 1.109004248581003, 'max_depth': 10, 'booster': 'dart', 'scale_pos_weight': 0.6311050891045148, 'alpha': 4.609208091257015, 'lambda': 2.7266089179357, 'eta': 0.18799876818136846, 'sampling_method': 'uniform', 'subsample': 0.5189100112876924, 'gamma': 9.817774928154245}. Best is trial 370 with value: 4.291290072824398.
[I 2023-12-19 00:00:53,291] Trial 495 pruned. Trial was pruned at iteration 1.
[I 2023-12-19 00:00:53,440] Trial 496 pruned. Trial was pruned at iteration 0.
[I 2023-12-19 00:00:53,583] Trial 497 pruned. Trial was pruned at iteration 0.
[I 2023-12-19 00:00:53,732] Trial 498 pruned. Trial was pruned at iteration 0.
