[I 2023-12-19 00:08:22,410] Trial 32 pruned. Trial was pruned at iteration 0.
[I 2023-12-19 00:08:22,465] Trial 33 pruned. Trial was pruned at iteration 0.
[I 2023-12-19 00:08:22,522] Trial 34 pruned. Trial was pruned at iteration 0.
[I 2023-12-19 00:08:22,703] Trial 35 finished with value: inf and parameters: {'learning_rate': 0.5509205259009531, 'aft_loss_distribution': 'logistic', 'aft_loss_distribution_scale': 1.401100406932895, 'max_depth': 6, 'booster': 'gbtree', 'scale_pos_weight': 3.463562629800657, 'alpha': 0.09317895536145715, 'lambda': 2.8270088787600627, 'eta': 0.4753686048146212, 'sampling_method': 'gradient_based', 'subsample': 0.9975930232037201, 'gamma': 2.2410225553210648}. Best is trial 2 with value: 2.015475326357095.
[I 2023-12-19 00:08:24,206] Trial 36 finished with value: inf and parameters: {'learning_rate': 0.9826237877727146, 'aft_loss_distribution': 'normal', 'aft_loss_distribution_scale': 2.0938166605522652, 'max_depth': 8, 'booster': 'dart', 'scale_pos_weight': 3.200831010738159, 'alpha': 6.285169114222796, 'lambda': 6.87700961580548, 'eta': 0.12166424013292099, 'sampling_method': 'gradient_based', 'subsample': 0.8167606297616249, 'gamma': 0.8210766043574864}. Best is trial 2 with value: 2.015475326357095.
[I 2023-12-19 00:08:24,306] Trial 37 pruned. Trial was pruned at iteration 0.
[I 2023-12-19 00:08:24,398] Trial 38 pruned. Trial was pruned at iteration 0.
[I 2023-12-19 00:08:24,485] Trial 39 pruned. Trial was pruned at iteration 0.
[I 2023-12-19 00:08:24,568] Trial 40 pruned. Trial was pruned at iteration 0.
[I 2023-12-19 00:08:24,661] Trial 41 pruned. Trial was pruned at iteration 0.
[I 2023-12-19 00:08:24,751] Trial 42 pruned. Trial was pruned at iteration 0.
[I 2023-12-19 00:08:24,842] Trial 43 pruned. Trial was pruned at iteration 0.
[I 2023-12-19 00:08:24,943] Trial 44 pruned. Trial was pruned at iteration 0.
[I 2023-12-19 00:08:25,031] Trial 45 pruned. Trial was pruned at iteration 0.
[I 2023-12-19 00:08:25,117] Trial 46 pruned. Trial was pruned at iteration 0.
[I 2023-12-19 00:08:25,200] Trial 47 pruned. Trial was pruned at iteration 0.
[I 2023-12-19 00:08:25,292] Trial 48 pruned. Trial was pruned at iteration 0.
[I 2023-12-19 00:08:25,374] Trial 49 pruned. Trial was pruned at iteration 0.
[I 2023-12-19 00:08:25,460] Trial 50 pruned. Trial was pruned at iteration 0.
[I 2023-12-19 00:08:25,563] Trial 51 pruned. Trial was pruned at iteration 1.
[I 2023-12-19 00:08:25,655] Trial 52 pruned. Trial was pruned at iteration 0.
[I 2023-12-19 00:08:25,753] Trial 53 pruned. Trial was pruned at iteration 0.
[I 2023-12-19 00:08:25,840] Trial 54 pruned. Trial was pruned at iteration 0.
[I 2023-12-19 00:08:25,929] Trial 55 pruned. Trial was pruned at iteration 0.
[I 2023-12-19 00:08:26,016] Trial 56 pruned. Trial was pruned at iteration 0.
[I 2023-12-19 00:08:26,429] Trial 57 finished with value: 2.193870313029422 and parameters: {'learning_rate': 0.7035150807384256, 'aft_loss_distribution': 'logistic', 'aft_loss_distribution_scale': 2.180225541798135, 'max_depth': 3, 'booster': 'gbtree', 'scale_pos_weight': 0.5652751107894125, 'alpha': 3.7222680520328044, 'lambda': 5.9785778136773065, 'eta': 0.1978904478464813, 'sampling_method': 'uniform', 'subsample': 0.7387761248415023, 'gamma': 5.503065611631973}. Best is trial 2 with value: 2.015475326357095.
[I 2023-12-19 00:08:26,529] Trial 58 pruned. Trial was pruned at iteration 0.
[I 2023-12-19 00:08:26,962] Trial 59 finished with value: 2.1411233568575643 and parameters: {'learning_rate': 0.695489779285942, 'aft_loss_distribution': 'logistic', 'aft_loss_distribution_scale': 1.8245919643196014, 'max_depth': 3, 'booster': 'gbtree', 'scale_pos_weight': 0.5795052937548831, 'alpha': 3.2695798800289557, 'lambda': 7.285097019429917, 'eta': 0.452905275515677, 'sampling_method': 'uniform', 'subsample': 0.8148150178647179, 'gamma': 6.249675351887588}. Best is trial 2 with value: 2.015475326357095.
[I 2023-12-19 00:08:27,481] Trial 60 finished with value: 2.1684031065098717 and parameters: {'learning_rate': 0.7301794021591427, 'aft_loss_distribution': 'logistic', 'aft_loss_distribution_scale': 1.99457079398992, 'max_depth': 3, 'booster': 'gbtree', 'scale_pos_weight': 0.04462297387583383, 'alpha': 3.167942890611234, 'lambda': 7.771426013160132, 'eta': 0.19849706541737056, 'sampling_method': 'uniform', 'subsample': 0.7348395948246242, 'gamma': 6.166075120461545}. Best is trial 2 with value: 2.015475326357095.
[I 2023-12-19 00:08:27,765] Trial 61 finished with value: inf and parameters: {'learning_rate': 0.7402145302845715, 'aft_loss_distribution': 'logistic', 'aft_loss_distribution_scale': 1.9539607804157777, 'max_depth': 3, 'booster': 'gbtree', 'scale_pos_weight': 0.2943687389313824, 'alpha': 3.1518797337200284, 'lambda': 8.072171282442149, 'eta': 0.19959966940693122, 'sampling_method': 'uniform', 'subsample': 0.8110708120549337, 'gamma': 6.2852180257786685}. Best is trial 2 with value: 2.015475326357095.
[I 2023-12-19 00:08:27,866] Trial 62 pruned. Trial was pruned at iteration 0.
[I 2023-12-19 00:08:27,955] Trial 63 pruned. Trial was pruned at iteration 0.
[I 2023-12-19 00:08:28,064] Trial 64 pruned. Trial was pruned at iteration 3.
[I 2023-12-19 00:08:28,157] Trial 65 pruned. Trial was pruned at iteration 0.
[I 2023-12-19 00:08:28,250] Trial 66 pruned. Trial was pruned at iteration 0.
[I 2023-12-19 00:08:28,335] Trial 67 pruned. Trial was pruned at iteration 1.
[I 2023-12-19 00:08:28,617] Trial 68 finished with value: inf and parameters: {'learning_rate': 0.6813839215407222, 'aft_loss_distribution': 'logistic', 'aft_loss_distribution_scale': 1.8232457970864124, 'max_depth': 4, 'booster': 'gbtree', 'scale_pos_weight': 0.5551037555790967, 'alpha': 1.2557295951522156, 'lambda': 5.532423283941818, 'eta': 0.4069372126319375, 'sampling_method': 'uniform', 'subsample': 0.7821841298491251, 'gamma': 4.514042650638915}. Best is trial 2 with value: 2.015475326357095.
[I 2023-12-19 00:08:28,970] Trial 69 finished with value: 2.046571814756624 and parameters: {'learning_rate': 0.731140175941886, 'aft_loss_distribution': 'normal', 'aft_loss_distribution_scale': 2.1944770524737454, 'max_depth': 3, 'booster': 'gbtree', 'scale_pos_weight': 0.16962982302162272, 'alpha': 5.016497623498601, 'lambda': 6.094871769013678, 'eta': 0.26610146346872143, 'sampling_method': 'uniform', 'subsample': 0.8449600580141937, 'gamma': 7.126393840892194}. Best is trial 2 with value: 2.015475326357095.
[I 2023-12-19 00:08:29,072] Trial 70 pruned. Trial was pruned at iteration 0.
[I 2023-12-19 00:08:29,159] Trial 71 pruned. Trial was pruned at iteration 0.
[I 2023-12-19 00:08:29,222] Trial 72 pruned. Trial was pruned at iteration 0.
[I 2023-12-19 00:08:29,282] Trial 73 pruned. Trial was pruned at iteration 0.
[I 2023-12-19 00:08:29,497] Trial 74 finished with value: inf and parameters: {'learning_rate': 0.8875675226951092, 'aft_loss_distribution': 'normal', 'aft_loss_distribution_scale': 1.610812733628923, 'max_depth': 3, 'booster': 'gbtree', 'scale_pos_weight': 1.302983034600622, 'alpha': 4.596704836809223, 'lambda': 4.4889810194465625, 'eta': 0.5010070251376383, 'sampling_method': 'uniform', 'subsample': 0.5276084352464853, 'gamma': 5.377745674321307}. Best is trial 2 with value: 2.015475326357095.
[I 2023-12-19 00:08:29,839] Trial 75 finished with value: 2.109164582845277 and parameters: {'learning_rate': 0.7997068731346677, 'aft_loss_distribution': 'normal', 'aft_loss_distribution_scale': 2.7893138833473348, 'max_depth': 4, 'booster': 'gbtree', 'scale_pos_weight': 0.2949684094337009, 'alpha': 2.2598559579211814, 'lambda': 6.133791810382537, 'eta': 0.17249862073175265, 'sampling_method': 'uniform', 'subsample': 0.477673135105137, 'gamma': 7.914513294330366}. Best is trial 2 with value: 2.015475326357095.
[I 2023-12-19 00:08:30,137] Trial 76 finished with value: 2.1153062579814943 and parameters: {'learning_rate': 0.7997728624507011, 'aft_loss_distribution': 'normal', 'aft_loss_distribution_scale': 2.845418151996091, 'max_depth': 4, 'booster': 'gbtree', 'scale_pos_weight': 0.3298179063464606, 'alpha': 2.363625970356478, 'lambda': 5.744741047128202, 'eta': 0.17614696779001054, 'sampling_method': 'uniform', 'subsample': 0.45992767806406765, 'gamma': 7.523345524638927}. Best is trial 2 with value: 2.015475326357095.
[I 2023-12-19 00:08:30,614] Trial 77 finished with value: 2.1053366170303267 and parameters: {'learning_rate': 0.8039464861190182, 'aft_loss_distribution': 'normal', 'aft_loss_distribution_scale': 2.7698244936522176, 'max_depth': 4, 'booster': 'gbtree', 'scale_pos_weight': 0.6191470513744692, 'alpha': 2.358038701258762, 'lambda': 6.214407413473504, 'eta': 0.15324982920440786, 'sampling_method': 'uniform', 'subsample': 0.4636995504513144, 'gamma': 7.761216980216369}. Best is trial 2 with value: 2.015475326357095.
[I 2023-12-19 00:08:30,806] Trial 78 finished with value: inf and parameters: {'learning_rate': 0.8774921206664938, 'aft_loss_distribution': 'normal', 'aft_loss_distribution_scale': 2.6712574894802885, 'max_depth': 4, 'booster': 'gbtree', 'scale_pos_weight': 0.6247988655729957, 'alpha': 2.405134270879569, 'lambda': 5.687081429025905, 'eta': 0.14478519363364578, 'sampling_method': 'uniform', 'subsample': 0.48135325454262706, 'gamma': 8.088923295587875}. Best is trial 2 with value: 2.015475326357095.
[I 2023-12-19 00:08:31,065] Trial 79 finished with value: 2.050121542661093 and parameters: {'learning_rate': 0.8003660663316976, 'aft_loss_distribution': 'normal', 'aft_loss_distribution_scale': 2.1987946482251015, 'max_depth': 4, 'booster': 'gbtree', 'scale_pos_weight': 0.2957243285866114, 'alpha': 2.2209648299328117, 'lambda': 6.758880112582181, 'eta': 0.08642798051249212, 'sampling_method': 'uniform', 'subsample': 0.4417750015448666, 'gamma': 7.013796623039163}. Best is trial 2 with value: 2.015475326357095.
[I 2023-12-19 00:08:31,152] Trial 80 pruned. Trial was pruned at iteration 9.
[I 2023-12-19 00:08:31,442] Trial 81 finished with value: 2.1080664760991135 and parameters: {'learning_rate': 0.8108187113620253, 'aft_loss_distribution': 'normal', 'aft_loss_distribution_scale': 2.7748721779806473, 'max_depth': 4, 'booster': 'gbtree', 'scale_pos_weight': 0.2753845138070288, 'alpha': 2.8347998682843008, 'lambda': 7.600942401327452, 'eta': 0.014251989872726606, 'sampling_method': 'uniform', 'subsample': 0.44679792300402993, 'gamma': 7.705560616601143}. Best is trial 2 with value: 2.015475326357095.
[I 2023-12-19 00:08:31,522] Trial 82 pruned. Trial was pruned at iteration 0.
[I 2023-12-19 00:08:31,585] Trial 83 pruned. Trial was pruned at iteration 0.
[I 2023-12-19 00:08:31,842] Trial 84 finished with value: 2.039526447167606 and parameters: {'learning_rate': 0.8137787883822548, 'aft_loss_distribution': 'normal', 'aft_loss_distribution_scale': 2.1359390121752666, 'max_depth': 5, 'booster': 'gbtree', 'scale_pos_weight': 0.4661425637276465, 'alpha': 0.8652192847640245, 'lambda': 6.650067437581051, 'eta': 0.17326016206568187, 'sampling_method': 'uniform', 'subsample': 0.3816581741241813, 'gamma': 8.461290419879866}. Best is trial 2 with value: 2.015475326357095.
[I 2023-12-19 00:08:31,913] Trial 85 pruned. Trial was pruned at iteration 0.
[I 2023-12-19 00:08:32,309] Trial 86 finished with value: 2.0648879377589484 and parameters: {'learning_rate': 0.803291565428786, 'aft_loss_distribution': 'normal', 'aft_loss_distribution_scale': 2.3541493549443393, 'max_depth': 5, 'booster': 'gbtree', 'scale_pos_weight': 0.8734431291459124, 'alpha': 1.3423445895984298, 'lambda': 6.231805526038403, 'eta': 0.10035429211059249, 'sampling_method': 'uniform', 'subsample': 0.4716373564994144, 'gamma': 7.954716989446625}. Best is trial 2 with value: 2.015475326357095.
[I 2023-12-19 00:08:32,491] Trial 87 finished with value: inf and parameters: {'learning_rate': 0.8148819861739011, 'aft_loss_distribution': 'normal', 'aft_loss_distribution_scale': 2.27999304632625, 'max_depth': 5, 'booster': 'gbtree', 'scale_pos_weight': 0.899751233698205, 'alpha': 1.4123189906757294, 'lambda': 6.335111063601104, 'eta': 0.006392015047855054, 'sampling_method': 'uniform', 'subsample': 0.3893360795272792, 'gamma': 9.089274766273855}. Best is trial 2 with value: 2.015475326357095.
[I 2023-12-19 00:08:32,564] Trial 88 pruned. Trial was pruned at iteration 1.
[I 2023-12-19 00:08:32,625] Trial 89 pruned. Trial was pruned at iteration 0.
[I 2023-12-19 00:08:32,683] Trial 90 pruned. Trial was pruned at iteration 0.
[I 2023-12-19 00:08:32,740] Trial 91 pruned. Trial was pruned at iteration 0.
[I 2023-12-19 00:08:32,801] Trial 92 pruned. Trial was pruned at iteration 0.
[I 2023-12-19 00:08:32,994] Trial 93 pruned. Trial was pruned at iteration 60.
[I 2023-12-19 00:08:33,279] Trial 94 finished with value: 2.077138495707601 and parameters: {'learning_rate': 0.8454138688871241, 'aft_loss_distribution': 'normal', 'aft_loss_distribution_scale': 2.45394776011737, 'max_depth': 6, 'booster': 'gbtree', 'scale_pos_weight': 0.6039194185186605, 'alpha': 2.0545557975085553, 'lambda': 7.008078637631722, 'eta': 0.10625437003630495, 'sampling_method': 'uniform', 'subsample': 0.38923242139965336, 'gamma': 8.337887606591929}. Best is trial 2 with value: 2.015475326357095.
[I 2023-12-19 00:08:33,465] Trial 95 finished with value: inf and parameters: {'learning_rate': 0.8419649450794262, 'aft_loss_distribution': 'normal', 'aft_loss_distribution_scale': 2.4273762831281145, 'max_depth': 6, 'booster': 'gbtree', 'scale_pos_weight': 0.1278771967967475, 'alpha': 2.1450033479353965, 'lambda': 6.198640158962216, 'eta': 0.17132597946016104, 'sampling_method': 'uniform', 'subsample': 0.39567098039205484, 'gamma': 8.347650952392302}. Best is trial 2 with value: 2.015475326357095.
[I 2023-12-19 00:08:33,534] Trial 96 pruned. Trial was pruned at iteration 0.
[I 2023-12-19 00:08:33,597] Trial 97 pruned. Trial was pruned at iteration 1.
[I 2023-12-19 00:08:33,657] Trial 98 pruned. Trial was pruned at iteration 0.
[I 2023-12-19 00:08:33,909] Trial 99 finished with value: 2.099994346776246 and parameters: {'learning_rate': 0.9882787266045825, 'aft_loss_distribution': 'normal', 'aft_loss_distribution_scale': 2.6720239767471963, 'max_depth': 5, 'booster': 'gbtree', 'scale_pos_weight': 0.7250629106614825, 'alpha': 1.201478852661316, 'lambda': 6.729138358312954, 'eta': 0.09646243130585609, 'sampling_method': 'uniform', 'subsample': 0.38266568275986523, 'gamma': 8.172073610345777}. Best is trial 2 with value: 2.015475326357095.
[I 2023-12-19 00:08:34,157] Trial 100 finished with value: inf and parameters: {'learning_rate': 0.9913458901720205, 'aft_loss_distribution': 'normal', 'aft_loss_distribution_scale': 1.3128554901326777, 'max_depth': 5, 'booster': 'gbtree', 'scale_pos_weight': 0.705492109101712, 'alpha': 1.3911212284264676, 'lambda': 6.919989728461852, 'eta': 0.027144049801138714, 'sampling_method': 'uniform', 'subsample': 0.373836927168866, 'gamma': 8.2348905408352}. Best is trial 2 with value: 2.015475326357095.
[I 2023-12-19 00:08:34,449] Trial 101 finished with value: 2.1057527370837703 and parameters: {'learning_rate': 0.9498796032175566, 'aft_loss_distribution': 'normal', 'aft_loss_distribution_scale': 2.742910273751739, 'max_depth': 5, 'booster': 'gbtree', 'scale_pos_weight': 0.45617266923774, 'alpha': 1.595361436899506, 'lambda': 6.701559555422175, 'eta': 0.10903172732250174, 'sampling_method': 'uniform', 'subsample': 0.4884503710620807, 'gamma': 7.901598384026971}. Best is trial 2 with value: 2.015475326357095.
[I 2023-12-19 00:08:34,681] Trial 102 finished with value: 2.09342932662063 and parameters: {'learning_rate': 0.9721305314615084, 'aft_loss_distribution': 'normal', 'aft_loss_distribution_scale': 2.59847685632069, 'max_depth': 5, 'booster': 'gbtree', 'scale_pos_weight': 1.0533140184305974, 'alpha': 1.2034471720449034, 'lambda': 6.695330623013559, 'eta': 0.08517601213010509, 'sampling_method': 'uniform', 'subsample': 0.42979212550431806, 'gamma': 7.897324103431658}. Best is trial 2 with value: 2.015475326357095.
[I 2023-12-19 00:08:34,975] Trial 103 finished with value: 2.079356597872917 and parameters: {'learning_rate': 0.9294632035392413, 'aft_loss_distribution': 'normal', 'aft_loss_distribution_scale': 2.4990840927835105, 'max_depth': 5, 'booster': 'gbtree', 'scale_pos_weight': 1.1783958430235804, 'alpha': 1.118620991407801, 'lambda': 6.650941917676249, 'eta': 0.0817366692517098, 'sampling_method': 'uniform', 'subsample': 0.33299693940017483, 'gamma': 8.84287485652641}. Best is trial 2 with value: 2.015475326357095.
[I 2023-12-19 00:08:35,174] Trial 104 finished with value: inf and parameters: {'learning_rate': 0.9723715611203898, 'aft_loss_distribution': 'normal', 'aft_loss_distribution_scale': 1.6344594707067754, 'max_depth': 5, 'booster': 'gbtree', 'scale_pos_weight': 1.201168156436701, 'alpha': 0.4218894343024294, 'lambda': 6.565602791893448, 'eta': 0.08854224149330533, 'sampling_method': 'uniform', 'subsample': 0.2841610509162973, 'gamma': 9.183729680885312}. Best is trial 2 with value: 2.015475326357095.
[I 2023-12-19 00:08:35,393] Trial 105 finished with value: inf and parameters: {'learning_rate': 0.9568410066110883, 'aft_loss_distribution': 'normal', 'aft_loss_distribution_scale': 2.4520060547520677, 'max_depth': 6, 'booster': 'gbtree', 'scale_pos_weight': 1.4000440554368643, 'alpha': 1.2808727022656186, 'lambda': 6.744829516132655, 'eta': 0.12125273077375856, 'sampling_method': 'uniform', 'subsample': 0.3171329127281991, 'gamma': 8.72485469010424}. Best is trial 2 with value: 2.015475326357095.
[I 2023-12-19 00:08:35,609] Trial 106 finished with value: inf and parameters: {'learning_rate': 0.9988914311495921, 'aft_loss_distribution': 'normal', 'aft_loss_distribution_scale': 2.073175634339364, 'max_depth': 5, 'booster': 'gbtree', 'scale_pos_weight': 1.0474602025808655, 'alpha': 1.6282372456399599, 'lambda': 7.184230230444799, 'eta': 0.06555905751609965, 'sampling_method': 'uniform', 'subsample': 0.33772209198853087, 'gamma': 9.64143484339828}. Best is trial 2 with value: 2.015475326357095.
[I 2023-12-19 00:08:35,799] Trial 107 finished with value: inf and parameters: {'learning_rate': 0.9428564508222728, 'aft_loss_distribution': 'normal', 'aft_loss_distribution_scale': 2.5841308354682364, 'max_depth': 5, 'booster': 'gbtree', 'scale_pos_weight': 0.9607205779730397, 'alpha': 1.0388853906857198, 'lambda': 6.366877871957185, 'eta': 0.04302833401241303, 'sampling_method': 'uniform', 'subsample': 0.3894728808323877, 'gamma': 8.93659229321422}. Best is trial 2 with value: 2.015475326357095.
[I 2023-12-19 00:08:35,872] Trial 108 pruned. Trial was pruned at iteration 0.
[I 2023-12-19 00:08:36,154] Trial 109 finished with value: inf and parameters: {'learning_rate': 0.9718082885782133, 'aft_loss_distribution': 'normal', 'aft_loss_distribution_scale': 1.029262051052112, 'max_depth': 6, 'booster': 'gbtree', 'scale_pos_weight': 1.149956390927135, 'alpha': 0.0029768054103838093, 'lambda': 6.667352328753413, 'eta': 0.1565673061278885, 'sampling_method': 'uniform', 'subsample': 0.4293835950282123, 'gamma': 7.06402865423284}. Best is trial 2 with value: 2.015475326357095.
[I 2023-12-19 00:08:36,227] Trial 110 pruned. Trial was pruned at iteration 0.
[I 2023-12-19 00:08:36,433] Trial 111 finished with value: inf and parameters: {'learning_rate': 0.9003885949989502, 'aft_loss_distribution': 'normal', 'aft_loss_distribution_scale': 2.315493147472533, 'max_depth': 5, 'booster': 'gbtree', 'scale_pos_weight': 0.49349460505278603, 'alpha': 1.515484714504916, 'lambda': 7.589548941920599, 'eta': 0.0020790050592873754, 'sampling_method': 'uniform', 'subsample': 0.40182613206005074, 'gamma': 7.672213954526714}. Best is trial 2 with value: 2.015475326357095.
[I 2023-12-19 00:08:36,505] Trial 112 pruned. Trial was pruned at iteration 1.
[I 2023-12-19 00:08:36,574] Trial 113 pruned. Trial was pruned at iteration 1.
[I 2023-12-19 00:08:36,767] Trial 114 finished with value: inf and parameters: {'learning_rate': 0.867744493565016, 'aft_loss_distribution': 'normal', 'aft_loss_distribution_scale': 1.952085166291178, 'max_depth': 5, 'booster': 'gbtree', 'scale_pos_weight': 0.5857405839191931, 'alpha': 2.6774953815531273, 'lambda': 7.258825860743473, 'eta': 0.10425032927540757, 'sampling_method': 'uniform', 'subsample': 0.4881006449737619, 'gamma': 8.393369837032278}. Best is trial 2 with value: 2.015475326357095.
[I 2023-12-19 00:08:36,977] Trial 115 finished with value: inf and parameters: {'learning_rate': 0.9257889087279301, 'aft_loss_distribution': 'normal', 'aft_loss_distribution_scale': 2.170880143295406, 'max_depth': 5, 'booster': 'gbtree', 'scale_pos_weight': 0.8299249832867722, 'alpha': 1.9349882081661731, 'lambda': 6.395915490738629, 'eta': 0.025732538888773138, 'sampling_method': 'uniform', 'subsample': 0.43568527433985804, 'gamma': 7.982227983643396}. Best is trial 2 with value: 2.015475326357095.
[I 2023-12-19 00:08:37,185] Trial 116 finished with value: inf and parameters: {'learning_rate': 0.9039675703511639, 'aft_loss_distribution': 'normal', 'aft_loss_distribution_scale': 2.3862870557714193, 'max_depth': 5, 'booster': 'gbtree', 'scale_pos_weight': 0.3871825632437751, 'alpha': 2.09509719164153, 'lambda': 6.089997505102416, 'eta': 0.14664198125200453, 'sampling_method': 'uniform', 'subsample': 0.5326727191694886, 'gamma': 9.07634396698125}. Best is trial 2 with value: 2.015475326357095.
[I 2023-12-19 00:08:37,253] Trial 117 pruned. Trial was pruned at iteration 0.
[I 2023-12-19 00:08:37,321] Trial 118 pruned. Trial was pruned at iteration 1.
[I 2023-12-19 00:08:37,383] Trial 119 pruned. Trial was pruned at iteration 0.
[I 2023-12-19 00:08:37,445] Trial 120 pruned. Trial was pruned at iteration 0.
[I 2023-12-19 00:08:37,506] Trial 121 pruned. Trial was pruned at iteration 0.
[I 2023-12-19 00:08:37,578] Trial 122 pruned. Trial was pruned at iteration 0.
[I 2023-12-19 00:08:37,640] Trial 123 pruned. Trial was pruned at iteration 0.
[I 2023-12-19 00:08:37,702] Trial 124 pruned. Trial was pruned at iteration 0.
