[I 2023-12-21 02:31:36,583] Trial 499 pruned. Trial was pruned at iteration 0.
[W 2023-12-21 02:31:37,095] Trial 1 is omitted in visualization because its objective value is inf or nan.
[W 2023-12-21 02:31:37,095] Trial 45 is omitted in visualization because its objective value is inf or nan.
[W 2023-12-21 02:31:37,095] Trial 52 is omitted in visualization because its objective value is inf or nan.
[W 2023-12-21 02:31:37,095] Trial 63 is omitted in visualization because its objective value is inf or nan.
[W 2023-12-21 02:31:37,095] Trial 71 is omitted in visualization because its objective value is inf or nan.
[W 2023-12-21 02:31:37,095] Trial 73 is omitted in visualization because its objective value is inf or nan.
[W 2023-12-21 02:31:37,095] Trial 74 is omitted in visualization because its objective value is inf or nan.
[W 2023-12-21 02:31:37,095] Trial 119 is omitted in visualization because its objective value is inf or nan.
[W 2023-12-21 02:31:37,095] Trial 130 is omitted in visualization because its objective value is inf or nan.
[W 2023-12-21 02:31:37,095] Trial 140 is omitted in visualization because its objective value is inf or nan.
[W 2023-12-21 02:31:37,095] Trial 141 is omitted in visualization because its objective value is inf or nan.
[W 2023-12-21 02:31:37,095] Trial 144 is omitted in visualization because its objective value is inf or nan.
[W 2023-12-21 02:31:37,095] Trial 161 is omitted in visualization because its objective value is inf or nan.
[W 2023-12-21 02:31:37,095] Trial 164 is omitted in visualization because its objective value is inf or nan.
[W 2023-12-21 02:31:37,096] Trial 172 is omitted in visualization because its objective value is inf or nan.
[W 2023-12-21 02:31:37,096] Trial 175 is omitted in visualization because its objective value is inf or nan.
[W 2023-12-21 02:31:37,096] Trial 188 is omitted in visualization because its objective value is inf or nan.
[W 2023-12-21 02:31:37,096] Trial 203 is omitted in visualization because its objective value is inf or nan.
[W 2023-12-21 02:31:37,096] Trial 205 is omitted in visualization because its objective value is inf or nan.
[W 2023-12-21 02:31:37,096] Trial 206 is omitted in visualization because its objective value is inf or nan.
[W 2023-12-21 02:31:37,096] Trial 214 is omitted in visualization because its objective value is inf or nan.
[W 2023-12-21 02:31:37,096] Trial 222 is omitted in visualization because its objective value is inf or nan.
[W 2023-12-21 02:31:37,096] Trial 226 is omitted in visualization because its objective value is inf or nan.
[W 2023-12-21 02:31:37,096] Trial 231 is omitted in visualization because its objective value is inf or nan.
[W 2023-12-21 02:31:37,096] Trial 236 is omitted in visualization because its objective value is inf or nan.
[W 2023-12-21 02:31:37,096] Trial 243 is omitted in visualization because its objective value is inf or nan.
[W 2023-12-21 02:31:37,096] Trial 244 is omitted in visualization because its objective value is inf or nan.
[W 2023-12-21 02:31:37,096] Trial 256 is omitted in visualization because its objective value is inf or nan.
[W 2023-12-21 02:31:37,096] Trial 259 is omitted in visualization because its objective value is inf or nan.
[W 2023-12-21 02:31:37,096] Trial 293 is omitted in visualization because its objective value is inf or nan.
[W 2023-12-21 02:31:37,096] Trial 314 is omitted in visualization because its objective value is inf or nan.
[W 2023-12-21 02:31:37,096] Trial 337 is omitted in visualization because its objective value is inf or nan.
[W 2023-12-21 02:31:37,096] Trial 344 is omitted in visualization because its objective value is inf or nan.
[W 2023-12-21 02:31:37,096] Trial 353 is omitted in visualization because its objective value is inf or nan.
[W 2023-12-21 02:31:37,097] Trial 356 is omitted in visualization because its objective value is inf or nan.
[W 2023-12-21 02:31:37,097] Trial 363 is omitted in visualization because its objective value is inf or nan.
[W 2023-12-21 02:31:37,097] Trial 366 is omitted in visualization because its objective value is inf or nan.
[W 2023-12-21 02:31:37,097] Trial 392 is omitted in visualization because its objective value is inf or nan.
[W 2023-12-21 02:31:37,097] Trial 398 is omitted in visualization because its objective value is inf or nan.
[W 2023-12-21 02:31:37,097] Trial 451 is omitted in visualization because its objective value is inf or nan.
[W 2023-12-21 02:31:37,097] Trial 459 is omitted in visualization because its objective value is inf or nan.
[W 2023-12-21 02:31:37,097] Trial 464 is omitted in visualization because its objective value is inf or nan.
[W 2023-12-21 02:31:37,097] Trial 470 is omitted in visualization because its objective value is inf or nan.
[W 2023-12-21 02:31:37,097] Trial 473 is omitted in visualization because its objective value is inf or nan.
exo-open: Cannot open display: .
/cvmfs/soft.computecanada.ca/gentoo/2020/usr/bin/xdg-open: line 871: x-www-browser: command not found
/cvmfs/soft.computecanada.ca/gentoo/2020/usr/bin/xdg-open: line 871: firefox: command not found
/cvmfs/soft.computecanada.ca/gentoo/2020/usr/bin/xdg-open: line 871: iceweasel: command not found
/cvmfs/soft.computecanada.ca/gentoo/2020/usr/bin/xdg-open: line 871: seamonkey: command not found
/cvmfs/soft.computecanada.ca/gentoo/2020/usr/bin/xdg-open: line 871: mozilla: command not found
/cvmfs/soft.computecanada.ca/gentoo/2020/usr/bin/xdg-open: line 871: epiphany: command not found
/cvmfs/soft.computecanada.ca/gentoo/2020/usr/bin/xdg-open: line 871: konqueror: command not found
/cvmfs/soft.computecanada.ca/gentoo/2020/usr/bin/xdg-open: line 871: chromium: command not found
/cvmfs/soft.computecanada.ca/gentoo/2020/usr/bin/xdg-open: line 871: chromium-browser: command not found
/cvmfs/soft.computecanada.ca/gentoo/2020/usr/bin/xdg-open: line 871: google-chrome: command not found
/cvmfs/soft.computecanada.ca/gentoo/2020/usr/bin/xdg-open: line 871: www-browser: command not found
/cvmfs/soft.computecanada.ca/gentoo/2020/usr/bin/xdg-open: line 871: links2: command not found
/home/lisat/.local/lib/python3.10/site-packages/xgboost/data.py:440: FutureWarning:

is_sparse is deprecated and will be removed in a future version. Check `isinstance(dtype, pd.SparseDtype)` instead.

[I 2023-12-21 02:31:40,358] A new study created in memory with name: no-name-4709789d-a284-4206-be04-d3e457b30585
[I 2023-12-21 02:31:40,509] Trial 0 finished with value: 5.880918748901371 and parameters: {'learning_rate': 0.7021684887380769, 'aft_los                                                                     s_distribution': 'extreme', 'aft_loss_distribution_scale': 8.540059618717175, 'max_depth': 6, 'booster': 'gbtree', 'scale_pos_weight': 2.                                                                     062500785697787, 'alpha': 7.166693425305778, 'lambda': 0.2725418643701087, 'eta': 0.24843761943996834, 'sampling_method': 'gradient_based                                                                     ', 'subsample': 0.3313475853684471, 'gamma': 1.4010456453678093}. Best is trial 0 with value: 5.880918748901371.
[I 2023-12-21 02:31:40,560] Trial 1 finished with value: inf and parameters: {'learning_rate': 0.9801347814182195, 'aft_loss_distribution                                                                     ': 'logistic', 'aft_loss_distribution_scale': 0.8608911394934403, 'max_depth': 10, 'booster': 'gbtree', 'scale_pos_weight': 1.16176394812                                                                     58994, 'alpha': 9.052093265907567, 'lambda': 9.854397444570997, 'eta': 0.5967576338167285, 'sampling_method': 'uniform', 'subsample': 0.1                                                                     648925651399385, 'gamma': 3.4680039883863274}. Best is trial 0 with value: 5.880918748901371.
[I 2023-12-21 02:31:40,649] Trial 2 finished with value: 5.049927981021619 and parameters: {'learning_rate': 0.8432139695493833, 'aft_los                                                                     s_distribution': 'normal', 'aft_loss_distribution_scale': 3.811950011328708, 'max_depth': 4, 'booster': 'gbtree', 'scale_pos_weight': 7.5                                                                     25286640269743, 'alpha': 1.7274714315892294, 'lambda': 2.0674436568194934, 'eta': 0.9140243359199339, 'sampling_method': 'gradient_based'                                                                     , 'subsample': 0.5643866357860844, 'gamma': 6.42983750757811}. Best is trial 2 with value: 5.049927981021619.
[I 2023-12-21 02:31:40,778] Trial 3 finished with value: 4.5853640185643805 and parameters: {'learning_rate': 0.396665722437536, 'aft_los                                                                     s_distribution': 'normal', 'aft_loss_distribution_scale': 2.1633300667226805, 'max_depth': 4, 'booster': 'gbtree', 'scale_pos_weight': 1.                                                                     563974177331064, 'alpha': 7.262020998540659, 'lambda': 9.89937939433401, 'eta': 0.8260080728671008, 'sampling_method': 'uniform', 'subsam                                                                     ple': 0.572142232737178, 'gamma': 7.794935903259116}. Best is trial 3 with value: 4.5853640185643805.
[I 2023-12-21 02:31:43,266] Trial 4 finished with value: 5.371714258691411 and parameters: {'learning_rate': 0.7595409113952725, 'aft_los                                                                     s_distribution': 'extreme', 'aft_loss_distribution_scale': 4.919542635174754, 'max_depth': 5, 'booster': 'dart', 'scale_pos_weight': 1.42                                                                     87290100000696, 'alpha': 8.18330058452325, 'lambda': 7.19336905470425, 'eta': 0.1729641011561982, 'sampling_method': 'gradient_based', 's                                                                     ubsample': 0.4641858890089358, 'gamma': 8.087089304699033}. Best is trial 3 with value: 4.5853640185643805.
[I 2023-12-21 02:31:43,272] Trial 5 pruned. Trial was pruned at iteration 0.
[I 2023-12-21 02:31:43,276] Trial 6 pruned. Trial was pruned at iteration 0.
[I 2023-12-21 02:31:43,281] Trial 7 pruned. Trial was pruned at iteration 0.
[I 2023-12-21 02:31:43,288] Trial 8 pruned. Trial was pruned at iteration 0.
[I 2023-12-21 02:31:43,293] Trial 9 pruned. Trial was pruned at iteration 0.
[I 2023-12-21 02:31:45,885] Trial 10 finished with value: 4.584982480940225 and parameters: {'learning_rate': 0.32176585399552715, 'aft_l                                                                     oss_distribution': 'normal', 'aft_loss_distribution_scale': 2.1557891920761922, 'max_depth': 3, 'booster': 'dart', 'scale_pos_weight': 8.                                                                     32804418444556, 'alpha': 6.368211674101638, 'lambda': 4.368716573873878, 'eta': 0.7575726900032898, 'sampling_method': 'uniform', 'subsam                                                                     ple': 0.2185802062207965, 'gamma': 8.749502210311102}. Best is trial 10 with value: 4.584982480940225.
[I 2023-12-21 02:31:48,448] Trial 11 pruned. Trial was pruned at iteration 85.
[I 2023-12-21 02:31:48,478] Trial 12 pruned. Trial was pruned at iteration 0.
[I 2023-12-21 02:31:48,506] Trial 13 pruned. Trial was pruned at iteration 0.
[I 2023-12-21 02:31:49,450] Trial 14 pruned. Trial was pruned at iteration 50.
[I 2023-12-21 02:31:49,479] Trial 15 pruned. Trial was pruned at iteration 0.
[I 2023-12-21 02:31:50,420] Trial 16 pruned. Trial was pruned at iteration 50.
[I 2023-12-21 02:31:50,449] Trial 17 pruned. Trial was pruned at iteration 0.
[I 2023-12-21 02:31:52,986] Trial 18 pruned. Trial was pruned at iteration 85.
[I 2023-12-21 02:31:53,113] Trial 19 finished with value: 4.306907493976192 and parameters: {'learning_rate': 0.5474327012668014, 'aft_lo                                                                     ss_distribution': 'normal', 'aft_loss_distribution_scale': 1.3609493823562167, 'max_depth': 7, 'booster': 'gbtree', 'scale_pos_weight': 6                                                                     .279164686958556, 'alpha': 6.7199861339921885, 'lambda': 4.617559296880521, 'eta': 0.8523992832940068, 'sampling_method': 'uniform', 'sub                                                                     sample': 0.898578081262791, 'gamma': 9.08086880170671}. Best is trial 19 with value: 4.306907493976192.
[I 2023-12-21 02:31:53,142] Trial 20 pruned. Trial was pruned at iteration 0.
[I 2023-12-21 02:31:53,175] Trial 21 pruned. Trial was pruned at iteration 0.
[I 2023-12-21 02:31:53,337] Trial 22 finished with value: 4.5182283521843924 and parameters: {'learning_rate': 0.5952952739691405, 'aft_l                                                                     oss_distribution': 'normal', 'aft_loss_distribution_scale': 1.969041032527185, 'max_depth': 8, 'booster': 'gbtree', 'scale_pos_weight': 8                                                                     .372229830252149, 'alpha': 7.292904058861974, 'lambda': 3.0392241187402536, 'eta': 0.8259470051977584, 'sampling_method': 'uniform', 'sub                                                                     sample': 0.8335826068991826, 'gamma': 9.955876415400294}. Best is trial 19 with value: 4.306907493976192.
[I 2023-12-21 02:31:53,460] Trial 23 finished with value: 4.377973375729838 and parameters: {'learning_rate': 0.599308009790868, 'aft_los                                                                     s_distribution': 'normal', 'aft_loss_distribution_scale': 1.5767370486633805, 'max_depth': 8, 'booster': 'gbtree', 'scale_pos_weight': 8.                                                                     508336861526386, 'alpha': 8.771103808276969, 'lambda': 2.8106633703080752, 'eta': 0.6922829048742074, 'sampling_method': 'uniform', 'subs                                                                     ample': 0.8460249381011388, 'gamma': 9.982756326740038}. Best is trial 19 with value: 4.306907493976192.
[I 2023-12-21 02:31:53,571] Trial 24 finished with value: 4.301666361648514 and parameters: {'learning_rate': 0.6141134065729914, 'aft_lo                                                                     ss_distribution': 'normal', 'aft_loss_distribution_scale': 1.3440591608504875, 'max_depth': 8, 'booster': 'gbtree', 'scale_pos_weight': 7                                                                     .144301580127941, 'alpha': 9.245923642184557, 'lambda': 0.8125102411988814, 'eta': 0.6928762407681994, 'sampling_method': 'uniform', 'sub                                                                     sample': 0.8609442394427329, 'gamma': 9.786589448712387}. Best is trial 24 with value: 4.301666361648514.
[I 2023-12-21 02:31:53,603] Trial 25 pruned. Trial was pruned at iteration 1.
[I 2023-12-21 02:31:53,781] Trial 26 finished with value: 4.347822708107315 and parameters: {'learning_rate': 0.6221375041047212, 'aft_lo                                                                     ss_distribution': 'normal', 'aft_loss_distribution_scale': 1.4915076786768675, 'max_depth': 9, 'booster': 'gbtree', 'scale_pos_weight': 6                                                                     .975729103536227, 'alpha': 8.998139027733181, 'lambda': 1.6741352901926976, 'eta': 0.4248957508007533, 'sampling_method': 'gradient_based                                                                     ', 'subsample': 0.7523581643909486, 'gamma': 9.79638158146643}. Best is trial 24 with value: 4.301666361648514.
[I 2023-12-21 02:31:53,814] Trial 27 pruned. Trial was pruned at iteration 0.
[I 2023-12-21 02:31:53,844] Trial 28 pruned. Trial was pruned at iteration 0.
[I 2023-12-21 02:31:53,950] Trial 29 finished with value: inf and parameters: {'learning_rate': 0.7928527232944942, 'aft_loss_distributio                                                                     n': 'normal', 'aft_loss_distribution_scale': 1.5344163909401674, 'max_depth': 9, 'booster': 'gbtree', 'scale_pos_weight': 6.9591590347970                                                                     01, 'alpha': 8.989089674083756, 'lambda': 0.5331243554825917, 'eta': 0.3207023118146406, 'sampling_method': 'gradient_based', 'subsample'                                                                     : 0.9275221651178596, 'gamma': 3.452710883762382}. Best is trial 24 with value: 4.301666361648514.
[I 2023-12-21 02:31:53,985] Trial 30 pruned. Trial was pruned at iteration 0.
[I 2023-12-21 02:31:54,212] Trial 31 finished with value: 4.375727863649103 and parameters: {'learning_rate': 0.6090413330901935, 'aft_lo                                                                     ss_distribution': 'normal', 'aft_loss_distribution_scale': 1.574731400607671, 'max_depth': 8, 'booster': 'gbtree', 'scale_pos_weight': 8.                                                                     428816958140336, 'alpha': 8.532064527950213, 'lambda': 2.474224290140852, 'eta': 0.4693993677063101, 'sampling_method': 'gradient_based',                                                                      'subsample': 0.9003258230470498, 'gamma': 9.983406919673563}. Best is trial 24 with value: 4.301666361648514.
[I 2023-12-21 02:31:54,245] Trial 32 pruned. Trial was pruned at iteration 0.
[I 2023-12-21 02:31:54,518] Trial 33 finished with value: 4.357232487012002 and parameters: {'learning_rate': 0.6345830726551531, 'aft_lo                                                                     ss_distribution': 'normal', 'aft_loss_distribution_scale': 1.517674602124051, 'max_depth': 10, 'booster': 'gbtree', 'scale_pos_weight': 6                                                                     .534641080729321, 'alpha': 8.631874390781855, 'lambda': 2.32491909707986, 'eta': 0.32120432532810095, 'sampling_method': 'gradient_based'                                                                     , 'subsample': 0.9244093463769648, 'gamma': 7.517105132101387}. Best is trial 24 with value: 4.301666361648514.
[I 2023-12-21 02:31:54,557] Trial 34 pruned. Trial was pruned at iteration 1.
[I 2023-12-21 02:31:54,588] Trial 35 pruned. Trial was pruned at iteration 0.
[I 2023-12-21 02:31:54,620] Trial 36 pruned. Trial was pruned at iteration 1.
[I 2023-12-21 02:31:54,653] Trial 37 pruned. Trial was pruned at iteration 1.
[I 2023-12-21 02:31:54,687] Trial 38 pruned. Trial was pruned at iteration 0.
[I 2023-12-21 02:31:54,719] Trial 39 pruned. Trial was pruned at iteration 0.
[I 2023-12-21 02:31:54,751] Trial 40 pruned. Trial was pruned at iteration 0.
[I 2023-12-21 02:31:54,948] Trial 41 finished with value: 4.352529148483329 and parameters: {'learning_rate': 0.7072460337176053, 'aft_lo                                                                     ss_distribution': 'normal', 'aft_loss_distribution_scale': 1.508008501497218, 'max_depth': 8, 'booster': 'gbtree', 'scale_pos_weight': 7.                                                                     079754805928793, 'alpha': 8.588307434071652, 'lambda': 2.4658393771257425, 'eta': 0.41058785917512386, 'sampling_method': 'gradient_based                                                                     ', 'subsample': 0.8731599031882068, 'gamma': 9.626850306630677}. Best is trial 24 with value: 4.301666361648514.
[I 2023-12-21 02:31:54,982] Trial 42 pruned. Trial was pruned at iteration 0.
[I 2023-12-21 02:31:55,144] Trial 43 finished with value: 4.2791945157099525 and parameters: {'learning_rate': 0.7000521679341617, 'aft_l                                                                     oss_distribution': 'normal', 'aft_loss_distribution_scale': 1.2173085489007738, 'max_depth': 7, 'booster': 'gbtree', 'scale_pos_weight':                                                                      6.4268495326997925, 'alpha': 6.906210641305093, 'lambda': 3.357643953192458, 'eta': 0.27439623764763893, 'sampling_method': 'gradient_bas                                                                     ed', 'subsample': 0.8069693452059034, 'gamma': 8.666863115083594}. Best is trial 43 with value: 4.2791945157099525.
[I 2023-12-21 02:31:55,177] Trial 44 pruned. Trial was pruned at iteration 0.
[I 2023-12-21 02:31:55,210] Trial 45 pruned. Trial was pruned at iteration 0.
[I 2023-12-21 02:31:55,242] Trial 46 pruned. Trial was pruned at iteration 0.
[I 2023-12-21 02:31:55,274] Trial 47 pruned. Trial was pruned at iteration 0.
[I 2023-12-21 02:31:55,305] Trial 48 pruned. Trial was pruned at iteration 0.
[I 2023-12-21 02:31:55,337] Trial 49 pruned. Trial was pruned at iteration 0.
[I 2023-12-21 02:31:55,369] Trial 50 pruned. Trial was pruned at iteration 0.
[I 2023-12-21 02:31:55,614] Trial 51 finished with value: 4.319822728151704 and parameters: {'learning_rate': 0.644095943772736, 'aft_los                                                                     s_distribution': 'normal', 'aft_loss_distribution_scale': 1.4075152621690663, 'max_depth': 9, 'booster': 'gbtree', 'scale_pos_weight': 6.                                                                     561147548238222, 'alpha': 7.684483197983546, 'lambda': 2.549237460165005, 'eta': 0.29178691776516186, 'sampling_method': 'gradient_based'                                                                     , 'subsample': 0.9330866669623473, 'gamma': 9.554236737796735}. Best is trial 43 with value: 4.2791945157099525.
[I 2023-12-21 02:31:55,647] Trial 52 pruned. Trial was pruned at iteration 0.
