[I 2023-12-19 00:26:48,778] Trial 193 finished with value: 2.0240939057670633 and parameters: {'learning_rate': 0.8826077048171489, 'aft_loss_distribution': 'normal', 'aft_loss_distribution_scale': 1.6882300425982517, 'max_depth': 6, 'booster': 'gbtree', 'scale_pos_weight': 0.38793096315304276, 'alpha': 6.702184720686655, 'lambda': 2.880655592573676, 'eta': 0.25479031974162514, 'sampling_method': 'uniform', 'subsample': 0.7113929130040493, 'gamma': 7.058349094150221}. Best is trial 155 with value: 2.0233546769587814.
[I 2023-12-19 00:26:49,060] Trial 194 finished with value: 2.0228797788037016 and parameters: {'learning_rate': 0.8727840741361034, 'aft_loss_distribution': 'normal', 'aft_loss_distribution_scale': 1.6237978424464812, 'max_depth': 6, 'booster': 'gbtree', 'scale_pos_weight': 0.5751967079588953, 'alpha': 6.862371069592396, 'lambda': 2.800398651286863, 'eta': 0.25432509493098315, 'sampling_method': 'uniform', 'subsample': 0.7148939705483925, 'gamma': 6.429515469235424}. Best is trial 194 with value: 2.0228797788037016.
[I 2023-12-19 00:26:49,315] Trial 195 finished with value: 2.0197814177092703 and parameters: {'learning_rate': 0.8673036639478646, 'aft_loss_distribution': 'normal', 'aft_loss_distribution_scale': 1.612333984908615, 'max_depth': 6, 'booster': 'gbtree', 'scale_pos_weight': 0.5686250283691081, 'alpha': 6.377319723441157, 'lambda': 3.009675332192778, 'eta': 0.25043120467933794, 'sampling_method': 'uniform', 'subsample': 0.7123814717899258, 'gamma': 6.954033259008084}. Best is trial 195 with value: 2.0197814177092703.
[I 2023-12-19 00:26:49,553] Trial 196 finished with value: inf and parameters: {'learning_rate': 0.8730487993401677, 'aft_loss_distribution': 'normal', 'aft_loss_distribution_scale': 1.5664441250000198, 'max_depth': 6, 'booster': 'gbtree', 'scale_pos_weight': 0.6306947772968223, 'alpha': 6.279685035257142, 'lambda': 2.9795963772475633, 'eta': 0.24577651244116808, 'sampling_method': 'uniform', 'subsample': 0.7256276797668175, 'gamma': 6.561344226110636}. Best is trial 195 with value: 2.0197814177092703.
[I 2023-12-19 00:26:49,885] Trial 197 finished with value: 2.024991899252001 and parameters: {'learning_rate': 0.8940079879056397, 'aft_loss_distribution': 'normal', 'aft_loss_distribution_scale': 1.7015139252927316, 'max_depth': 6, 'booster': 'gbtree', 'scale_pos_weight': 0.4740848692921803, 'alpha': 6.882157348041344, 'lambda': 2.7972652827367837, 'eta': 0.21263021758456202, 'sampling_method': 'uniform', 'subsample': 0.7139949420908287, 'gamma': 6.963087368642666}. Best is trial 195 with value: 2.0197814177092703.
[I 2023-12-19 00:26:50,080] Trial 198 finished with value: inf and parameters: {'learning_rate': 0.9906604516114088, 'aft_loss_distribution': 'normal', 'aft_loss_distribution_scale': 1.6708397164971212, 'max_depth': 6, 'booster': 'gbtree', 'scale_pos_weight': 0.5531531752210356, 'alpha': 6.927076887061567, 'lambda': 3.3680608415820577, 'eta': 0.22547172314215083, 'sampling_method': 'uniform', 'subsample': 0.7058095462874914, 'gamma': 7.004562987684401}. Best is trial 195 with value: 2.0197814177092703.
[I 2023-12-19 00:26:50,287] Trial 199 finished with value: inf and parameters: {'learning_rate': 0.9353044502777259, 'aft_loss_distribution': 'normal', 'aft_loss_distribution_scale': 1.2971638584545404, 'max_depth': 6, 'booster': 'gbtree', 'scale_pos_weight': 0.5103003713844974, 'alpha': 7.22382742188685, 'lambda': 2.782297069047372, 'eta': 0.25150769531376926, 'sampling_method': 'uniform', 'subsample': 0.7016176901288386, 'gamma': 6.879137850919819}. Best is trial 195 with value: 2.0197814177092703.
[I 2023-12-19 00:26:50,370] Trial 200 pruned. Trial was pruned at iteration 0.
[I 2023-12-19 00:26:50,683] Trial 201 finished with value: 2.0300128025116986 and parameters: {'learning_rate': 0.8941726208979186, 'aft_loss_distribution': 'normal', 'aft_loss_distribution_scale': 1.7784926809886397, 'max_depth': 6, 'booster': 'gbtree', 'scale_pos_weight': 0.46414380097576513, 'alpha': 6.163638208813118, 'lambda': 2.7151145990372125, 'eta': 0.2598854434899624, 'sampling_method': 'uniform', 'subsample': 0.7086142677572012, 'gamma': 6.7798829002740995}. Best is trial 195 with value: 2.0197814177092703.
[I 2023-12-19 00:26:50,891] Trial 202 finished with value: inf and parameters: {'learning_rate': 0.899650840533192, 'aft_loss_distribution': 'normal', 'aft_loss_distribution_scale': 1.4764023304958447, 'max_depth': 6, 'booster': 'gbtree', 'scale_pos_weight': 0.6250880706224247, 'alpha': 6.193530778996405, 'lambda': 3.6259718615671703, 'eta': 0.218355215931332, 'sampling_method': 'uniform', 'subsample': 0.7154326716504352, 'gamma': 6.760988865145565}. Best is trial 195 with value: 2.0197814177092703.
[I 2023-12-19 00:26:51,142] Trial 203 finished with value: 2.024797165696955 and parameters: {'learning_rate': 0.9690683875634358, 'aft_loss_distribution': 'normal', 'aft_loss_distribution_scale': 1.6987960843789263, 'max_depth': 6, 'booster': 'gbtree', 'scale_pos_weight': 0.4294114348410097, 'alpha': 6.7656608548913555, 'lambda': 2.678369380690932, 'eta': 0.25647295277758747, 'sampling_method': 'uniform', 'subsample': 0.764267467758814, 'gamma': 7.041581011972731}. Best is trial 195 with value: 2.0197814177092703.
[I 2023-12-19 00:26:51,337] Trial 204 finished with value: inf and parameters: {'learning_rate': 0.9596714422067492, 'aft_loss_distribution': 'normal', 'aft_loss_distribution_scale': 1.6820725067450464, 'max_depth': 6, 'booster': 'gbtree', 'scale_pos_weight': 0.44903116358017586, 'alpha': 6.155396570564732, 'lambda': 2.662275391825184, 'eta': 0.23855120621057874, 'sampling_method': 'uniform', 'subsample': 0.7662165572851162, 'gamma': 6.196544639138921}. Best is trial 195 with value: 2.0197814177092703.
[I 2023-12-19 00:26:51,563] Trial 205 finished with value: inf and parameters: {'learning_rate': 0.8827727304690649, 'aft_loss_distribution': 'normal', 'aft_loss_distribution_scale': 1.4720907976823798, 'max_depth': 6, 'booster': 'gbtree', 'scale_pos_weight': 0.7181569024675485, 'alpha': 6.869624130598349, 'lambda': 2.8527402274568785, 'eta': 0.41196836478543186, 'sampling_method': 'uniform', 'subsample': 0.7037541503447563, 'gamma': 7.060292273580504}. Best is trial 195 with value: 2.0197814177092703.
[I 2023-12-19 00:26:51,808] Trial 206 finished with value: 2.026676520422217 and parameters: {'learning_rate': 0.9737814951219586, 'aft_loss_distribution': 'normal', 'aft_loss_distribution_scale': 1.7204403238738626, 'max_depth': 6, 'booster': 'gbtree', 'scale_pos_weight': 0.47421196277297234, 'alpha': 6.369652202484037, 'lambda': 2.5029037620135535, 'eta': 0.2549598750285119, 'sampling_method': 'uniform', 'subsample': 0.754505440429038, 'gamma': 6.5987125747747415}. Best is trial 195 with value: 2.0197814177092703.
[I 2023-12-19 00:26:52,047] Trial 207 finished with value: 2.026738387870049 and parameters: {'learning_rate': 0.9614286169629703, 'aft_loss_distribution': 'normal', 'aft_loss_distribution_scale': 1.7392640475283208, 'max_depth': 6, 'booster': 'gbtree', 'scale_pos_weight': 0.46398495170988413, 'alpha': 6.319763606581437, 'lambda': 2.481700949113515, 'eta': 0.25903499298846977, 'sampling_method': 'uniform', 'subsample': 0.7821277454030933, 'gamma': 6.401514789454638}. Best is trial 195 with value: 2.0197814177092703.
[I 2023-12-19 00:26:52,237] Trial 208 finished with value: inf and parameters: {'learning_rate': 0.9547051409977394, 'aft_loss_distribution': 'normal', 'aft_loss_distribution_scale': 1.2369085078292188, 'max_depth': 6, 'booster': 'gbtree', 'scale_pos_weight': 0.4517119076741237, 'alpha': 6.808596865941544, 'lambda': 2.568415593017261, 'eta': 0.21307086937897535, 'sampling_method': 'uniform', 'subsample': 0.7899123676986428, 'gamma': 6.635909370552927}. Best is trial 195 with value: 2.0197814177092703.
[I 2023-12-19 00:26:52,427] Trial 209 finished with value: inf and parameters: {'learning_rate': 0.9163559278516179, 'aft_loss_distribution': 'normal', 'aft_loss_distribution_scale': 1.7107802899772253, 'max_depth': 6, 'booster': 'gbtree', 'scale_pos_weight': 0.6194461308200586, 'alpha': 6.384651209293161, 'lambda': 2.981903417653814, 'eta': 0.25548625903246736, 'sampling_method': 'uniform', 'subsample': 0.7496290200170391, 'gamma': 6.021878664622213}. Best is trial 195 with value: 2.0197814177092703.
[I 2023-12-19 00:26:52,613] Trial 210 finished with value: inf and parameters: {'learning_rate': 0.9566192452425687, 'aft_loss_distribution': 'normal', 'aft_loss_distribution_scale': 1.4957455361968761, 'max_depth': 6, 'booster': 'gbtree', 'scale_pos_weight': 0.5171382050283532, 'alpha': 5.68154227113083, 'lambda': 3.2067863624389767, 'eta': 0.2355750393173479, 'sampling_method': 'uniform', 'subsample': 0.7548760969753985, 'gamma': 6.382117488397496}. Best is trial 195 with value: 2.0197814177092703.
[I 2023-12-19 00:26:52,804] Trial 211 finished with value: inf and parameters: {'learning_rate': 0.9781376154471556, 'aft_loss_distribution': 'normal', 'aft_loss_distribution_scale': 1.6928170707178483, 'max_depth': 6, 'booster': 'gbtree', 'scale_pos_weight': 0.47897067265777704, 'alpha': 6.081445602961116, 'lambda': 2.741579644985368, 'eta': 0.2892855353612047, 'sampling_method': 'uniform', 'subsample': 0.724849308205545, 'gamma': 6.76074625894523}. Best is trial 195 with value: 2.0197814177092703.
[I 2023-12-19 00:26:53,018] Trial 212 finished with value: inf and parameters: {'learning_rate': 0.9761519117749472, 'aft_loss_distribution': 'normal', 'aft_loss_distribution_scale': 1.7707439085317258, 'max_depth': 6, 'booster': 'gbtree', 'scale_pos_weight': 0.5819996555888115, 'alpha': 6.329687660301944, 'lambda': 2.4849031109066035, 'eta': 0.24968149328004344, 'sampling_method': 'uniform', 'subsample': 0.7801889746306774, 'gamma': 6.987411088443994}. Best is trial 195 with value: 2.0197814177092703.
[I 2023-12-19 00:26:53,294] Trial 213 finished with value: 2.0187513513381004 and parameters: {'learning_rate': 0.8614799705385826, 'aft_loss_distribution': 'normal', 'aft_loss_distribution_scale': 1.5437818028936208, 'max_depth': 6, 'booster': 'gbtree', 'scale_pos_weight': 0.43515650067274797, 'alpha': 6.135237436705673, 'lambda': 2.7918075364369304, 'eta': 0.290737310996011, 'sampling_method': 'uniform', 'subsample': 0.6968177217652399, 'gamma': 7.152254212319013}. Best is trial 213 with value: 2.0187513513381004.
[I 2023-12-19 00:26:53,616] Trial 214 finished with value: 2.0180848775033677 and parameters: {'learning_rate': 0.8869018634024671, 'aft_loss_distribution': 'normal', 'aft_loss_distribution_scale': 1.4693087934995732, 'max_depth': 6, 'booster': 'gbtree', 'scale_pos_weight': 0.441085228479998, 'alpha': 6.987568999618578, 'lambda': 2.4448283827225383, 'eta': 0.25842059346526847, 'sampling_method': 'uniform', 'subsample': 0.7377217078459191, 'gamma': 6.397911777549766}. Best is trial 214 with value: 2.0180848775033677.
[I 2023-12-19 00:26:53,817] Trial 215 finished with value: inf and parameters: {'learning_rate': 0.892274704641741, 'aft_loss_distribution': 'normal', 'aft_loss_distribution_scale': 1.4471892453052193, 'max_depth': 6, 'booster': 'gbtree', 'scale_pos_weight': 0.42933284003685046, 'alpha': 7.167236996894425, 'lambda': 2.5001204011289433, 'eta': 0.26285887863122515, 'sampling_method': 'uniform', 'subsample': 0.7353641005054644, 'gamma': 5.745261485903388}. Best is trial 214 with value: 2.0180848775033677.
[I 2023-12-19 00:26:53,897] Trial 216 pruned. Trial was pruned at iteration 0.
[I 2023-12-19 00:26:53,969] Trial 217 pruned. Trial was pruned at iteration 0.
[I 2023-12-19 00:26:54,222] Trial 218 finished with value: 2.019441820432517 and parameters: {'learning_rate': 0.9142763176160854, 'aft_loss_distribution': 'normal', 'aft_loss_distribution_scale': 1.536135126881392, 'max_depth': 6, 'booster': 'gbtree', 'scale_pos_weight': 0.5526720954218259, 'alpha': 6.077261431124739, 'lambda': 2.7201283918229535, 'eta': 0.21344901193468288, 'sampling_method': 'uniform', 'subsample': 0.73690289595124, 'gamma': 7.212733009171663}. Best is trial 214 with value: 2.0180848775033677.
[I 2023-12-19 00:26:54,438] Trial 219 finished with value: inf and parameters: {'learning_rate': 0.9166513844054051, 'aft_loss_distribution': 'normal', 'aft_loss_distribution_scale': 1.3347007216616449, 'max_depth': 6, 'booster': 'gbtree', 'scale_pos_weight': 0.5716760058786222, 'alpha': 7.019321847007332, 'lambda': 3.2111904029569005, 'eta': 0.18513985837954006, 'sampling_method': 'uniform', 'subsample': 0.8058728979489976, 'gamma': 6.632364538961382}. Best is trial 214 with value: 2.0180848775033677.
[I 2023-12-19 00:26:54,711] Trial 220 finished with value: 2.0189492005635956 and parameters: {'learning_rate': 0.899647267948711, 'aft_loss_distribution': 'normal', 'aft_loss_distribution_scale': 1.5731307179824914, 'max_depth': 6, 'booster': 'gbtree', 'scale_pos_weight': 0.4236170668655196, 'alpha': 6.004824885603367, 'lambda': 3.530503519162916, 'eta': 0.2071490992793519, 'sampling_method': 'uniform', 'subsample': 0.7545960864416212, 'gamma': 6.353998112362009}. Best is trial 214 with value: 2.0180848775033677.
[I 2023-12-19 00:26:54,970] Trial 221 finished with value: 2.020063348055956 and parameters: {'learning_rate': 0.8974157137795766, 'aft_loss_distribution': 'normal', 'aft_loss_distribution_scale': 1.6090040659043288, 'max_depth': 6, 'booster': 'gbtree', 'scale_pos_weight': 0.46418793457953317, 'alpha': 6.035497843733322, 'lambda': 2.6779974479381314, 'eta': 0.20678097937081785, 'sampling_method': 'uniform', 'subsample': 0.7394783620214972, 'gamma': 6.855217045621369}. Best is trial 214 with value: 2.0180848775033677.
[I 2023-12-19 00:26:55,236] Trial 222 finished with value: 2.0198521785746024 and parameters: {'learning_rate': 0.898710623333924, 'aft_loss_distribution': 'normal', 'aft_loss_distribution_scale': 1.5816493767448923, 'max_depth': 6, 'booster': 'gbtree', 'scale_pos_weight': 0.46286924532087825, 'alpha': 6.041406337661984, 'lambda': 3.5306489737729496, 'eta': 0.20552593553400528, 'sampling_method': 'uniform', 'subsample': 0.7460473212998696, 'gamma': 6.364723261352492}. Best is trial 214 with value: 2.0180848775033677.
[I 2023-12-19 00:26:55,510] Trial 223 finished with value: 2.0186705795267548 and parameters: {'learning_rate': 0.8976561047536031, 'aft_loss_distribution': 'normal', 'aft_loss_distribution_scale': 1.5385891317758724, 'max_depth': 6, 'booster': 'gbtree', 'scale_pos_weight': 0.4253330120390168, 'alpha': 6.088182411416781, 'lambda': 3.497740853237591, 'eta': 0.2017198496207161, 'sampling_method': 'uniform', 'subsample': 0.7471417956494574, 'gamma': 6.4215040261924585}. Best is trial 214 with value: 2.0180848775033677.
[I 2023-12-19 00:26:55,732] Trial 224 finished with value: inf and parameters: {'learning_rate': 0.9325708532904258, 'aft_loss_distribution': 'normal', 'aft_loss_distribution_scale': 1.4998608009306618, 'max_depth': 6, 'booster': 'gbtree', 'scale_pos_weight': 0.4805351686250194, 'alpha': 6.446271607848293, 'lambda': 3.060303586897157, 'eta': 0.18463754368315374, 'sampling_method': 'uniform', 'subsample': 0.7411216285525787, 'gamma': 6.374436473834313}. Best is trial 214 with value: 2.0180848775033677.
[I 2023-12-19 00:26:55,942] Trial 225 finished with value: inf and parameters: {'learning_rate': 0.894748684662474, 'aft_loss_distribution': 'normal', 'aft_loss_distribution_scale': 1.2271382951544225, 'max_depth': 6, 'booster': 'gbtree', 'scale_pos_weight': 0.5954046719780431, 'alpha': 6.073130032688446, 'lambda': 3.576996007546636, 'eta': 0.21176798549807008, 'sampling_method': 'uniform', 'subsample': 0.7664760371228586, 'gamma': 6.290609445011332}. Best is trial 214 with value: 2.0180848775033677.
[I 2023-12-19 00:26:56,015] Trial 226 pruned. Trial was pruned at iteration 0.
[I 2023-12-19 00:26:56,279] Trial 227 finished with value: 2.0196710085250706 and parameters: {'learning_rate': 0.8856644719208578, 'aft_loss_distribution': 'normal', 'aft_loss_distribution_scale': 1.5840601018703568, 'max_depth': 6, 'booster': 'gbtree', 'scale_pos_weight': 0.5296276105156159, 'alpha': 6.457019002797508, 'lambda': 3.398658614965591, 'eta': 0.2195253799720357, 'sampling_method': 'uniform', 'subsample': 0.74433799464529, 'gamma': 5.806749205358485}. Best is trial 214 with value: 2.0180848775033677.
[I 2023-12-19 00:26:56,362] Trial 228 pruned. Trial was pruned at iteration 0.
[I 2023-12-19 00:26:56,442] Trial 229 pruned. Trial was pruned at iteration 0.
[I 2023-12-19 00:26:56,691] Trial 230 finished with value: 2.020418840766104 and parameters: {'learning_rate': 0.9006796562486439, 'aft_loss_distribution': 'normal', 'aft_loss_distribution_scale': 1.3822326695899134, 'max_depth': 6, 'booster': 'gbtree', 'scale_pos_weight': 0.6466414562681948, 'alpha': 6.3227570934888355, 'lambda': 3.4241268980953925, 'eta': 0.17000172229387167, 'sampling_method': 'uniform', 'subsample': 0.7507811097156545, 'gamma': 6.556473983126134}. Best is trial 214 with value: 2.0180848775033677.
[I 2023-12-19 00:26:56,894] Trial 231 finished with value: inf and parameters: {'learning_rate': 0.8907707716504686, 'aft_loss_distribution': 'normal', 'aft_loss_distribution_scale': 1.3742848996032548, 'max_depth': 6, 'booster': 'gbtree', 'scale_pos_weight': 0.6560501727245095, 'alpha': 6.317962767898809, 'lambda': 3.45367440729198, 'eta': 0.17854427998034517, 'sampling_method': 'uniform', 'subsample': 0.7545355578536544, 'gamma': 6.620361485584626}. Best is trial 214 with value: 2.0180848775033677.
[I 2023-12-19 00:26:57,148] Trial 232 finished with value: 2.0197459395600568 and parameters: {'learning_rate': 0.9940028615800218, 'aft_loss_distribution': 'normal', 'aft_loss_distribution_scale': 1.5942184602596492, 'max_depth': 6, 'booster': 'gbtree', 'scale_pos_weight': 0.7736216711475139, 'alpha': 6.0393780643819195, 'lambda': 3.98745149099857, 'eta': 0.20616380901189799, 'sampling_method': 'uniform', 'subsample': 0.7739254940279648, 'gamma': 6.361698858507545}. Best is trial 214 with value: 2.0180848775033677.
[I 2023-12-19 00:26:57,350] Trial 233 finished with value: inf and parameters: {'learning_rate': 0.947291644966887, 'aft_loss_distribution': 'normal', 'aft_loss_distribution_scale': 1.6164087308072208, 'max_depth': 6, 'booster': 'gbtree', 'scale_pos_weight': 0.7714697327412869, 'alpha': 5.734342288832876, 'lambda': 3.978402339694842, 'eta': 0.16409496651277994, 'sampling_method': 'uniform', 'subsample': 0.7956053032050137, 'gamma': 6.482524493695844}. Best is trial 214 with value: 2.0180848775033677.
[I 2023-12-19 00:26:57,563] Trial 234 finished with value: inf and parameters: {'learning_rate': 0.9953074352641046, 'aft_loss_distribution': 'normal', 'aft_loss_distribution_scale': 1.1986949632372679, 'max_depth': 6, 'booster': 'gbtree', 'scale_pos_weight': 0.6094447356622487, 'alpha': 6.47541427116432, 'lambda': 3.101571286629663, 'eta': 0.20383322334120807, 'sampling_method': 'uniform', 'subsample': 0.7716036467870159, 'gamma': 6.227766315303379}. Best is trial 214 with value: 2.0180848775033677.
[I 2023-12-19 00:26:57,773] Trial 235 finished with value: inf and parameters: {'learning_rate': 0.9153466058349949, 'aft_loss_distribution': 'normal', 'aft_loss_distribution_scale': 1.56017574228901, 'max_depth': 6, 'booster': 'gbtree', 'scale_pos_weight': 0.6642540051555212, 'alpha': 5.939758134381441, 'lambda': 3.7334690701134106, 'eta': 0.25608697202481595, 'sampling_method': 'uniform', 'subsample': 0.7496929772751141, 'gamma': 5.69273325019455}. Best is trial 214 with value: 2.0180848775033677.
[I 2023-12-19 00:26:57,901] Trial 236 pruned. Trial was pruned at iteration 0.
[I 2023-12-19 00:26:58,192] Trial 237 finished with value: inf and parameters: {'learning_rate': 0.8864207536195191, 'aft_loss_distribution': 'normal', 'aft_loss_distribution_scale': 1.588591533061242, 'max_depth': 6, 'booster': 'gbtree', 'scale_pos_weight': 0.5289682408863308, 'alpha': 6.63867770140545, 'lambda': 3.3562240001063417, 'eta': 0.19942331070802893, 'sampling_method': 'uniform', 'subsample': 0.8133979314915751, 'gamma': 6.631314510692982}. Best is trial 214 with value: 2.0180848775033677.
[I 2023-12-19 00:26:58,305] Trial 238 pruned. Trial was pruned at iteration 0.
[I 2023-12-19 00:26:58,506] Trial 239 finished with value: inf and parameters: {'learning_rate': 0.9941020799177687, 'aft_loss_distribution': 'normal', 'aft_loss_distribution_scale': 1.435412238354436, 'max_depth': 6, 'booster': 'gbtree', 'scale_pos_weight': 0.5728977650540331, 'alpha': 6.356897381294629, 'lambda': 2.9471445572395085, 'eta': 0.26209763392426944, 'sampling_method': 'uniform', 'subsample': 0.7285831340916847, 'gamma': 6.408499832871656}. Best is trial 214 with value: 2.0180848775033677.
[I 2023-12-19 00:26:58,731] Trial 240 finished with value: inf and parameters: {'learning_rate': 0.9375914439714901, 'aft_loss_distribution': 'normal', 'aft_loss_distribution_scale': 1.6230339752813192, 'max_depth': 6, 'booster': 'gbtree', 'scale_pos_weight': 0.3727598320186364, 'alpha': 7.37926754225548, 'lambda': 3.453588719179654, 'eta': 0.175902018551671, 'sampling_method': 'uniform', 'subsample': 0.749966733111828, 'gamma': 6.939104712767403}. Best is trial 214 with value: 2.0180848775033677.
[I 2023-12-19 00:26:59,013] Trial 241 finished with value: inf and parameters: {'learning_rate': 0.8567004273949983, 'aft_loss_distribution': 'normal', 'aft_loss_distribution_scale': 1.6584877901338015, 'max_depth': 6, 'booster': 'gbtree', 'scale_pos_weight': 0.4534895845306705, 'alpha': 6.075507675751804, 'lambda': 2.699061596772096, 'eta': 0.2293579297412609, 'sampling_method': 'uniform', 'subsample': 0.7862884133543252, 'gamma': 6.696323871355378}. Best is trial 214 with value: 2.0180848775033677.
