[I 2023-12-21 04:16:27,429] Trial 241 finished with value: 1.9463224321455053 and parameters: {'learning_rate': 0.288207042743365, 'aft_loss_distribution': 'logistic', 'aft_loss_distribution_scale': 1.025619783058476, 'max_depth': 8, 'booster': 'gbtree', 'scale_pos_weight': 2.852816516855553, 'alpha': 2.641886995434868, 'lambda': 2.817585833627291, 'eta': 0.35962696298837366, 'sampling_method': 'gradient_based', 'subsample': 0.34796497785578434, 'gamma': 6.402261275018202}. Best is trial 50 with value: 1.9231774599892102.
[I 2023-12-21 04:16:27,570] Trial 242 pruned. Trial was pruned at iteration 0.
[I 2023-12-21 04:16:28,109] Trial 243 finished with value: 1.9371944210728402 and parameters: {'learning_rate': 0.2683062287636419, 'aft_loss_distribution': 'logistic', 'aft_loss_distribution_scale': 1.0294507674886657, 'max_depth': 8, 'booster': 'gbtree', 'scale_pos_weight': 2.9173479259594823, 'alpha': 3.2930600887918113, 'lambda': 3.1886419153116567, 'eta': 0.3710085892949228, 'sampling_method': 'gradient_based', 'subsample': 0.36854570536210873, 'gamma': 6.196344724239818}. Best is trial 50 with value: 1.9231774599892102.
[I 2023-12-21 04:16:28,231] Trial 244 pruned. Trial was pruned at iteration 0.
[I 2023-12-21 04:16:28,351] Trial 245 pruned. Trial was pruned at iteration 0.
[I 2023-12-21 04:16:28,710] Trial 246 pruned. Trial was pruned at iteration 58.
[I 2023-12-21 04:16:28,837] Trial 247 pruned. Trial was pruned at iteration 0.
[I 2023-12-21 04:16:29,232] Trial 248 pruned. Trial was pruned at iteration 75.
[I 2023-12-21 04:16:29,357] Trial 249 pruned. Trial was pruned at iteration 0.
Completed hyperparameter tuning with best aft-nloglik = 1.9231774599892102.
Re-running the best trial... params = {'verbosity': 0, 'objective': 'survival:aft', 'eval_metric': 'aft-nloglik', 'tree_method': 'gpu_hist', 'device': 'cuda', 'learning_rate': 0.2132589307894056, 'aft_loss_distribution': 'logistic', 'aft_loss_distribution_scale': 0.9207285016301396, 'max_depth': 8, 'booster': 'gbtree', 'scale_pos_weight': 2.8958432555009397, 'alpha': 3.0475271586034998, 'lambda': 2.2732299038840824, 'eta': 0.11686530781035809, 'sampling_method': 'uniform', 'subsample': 0.4556171919053221, 'gamma': 8.039940783680883}
[W 2023-12-21 04:16:29,710] Trial 1 is omitted in visualization because its objective value is inf or nan.
[W 2023-12-21 04:16:29,714] Trial 13 is omitted in visualization because its objective value is inf or nan.
[W 2023-12-21 04:16:29,718] Trial 33 is omitted in visualization because its objective value is inf or nan.
[W 2023-12-21 04:16:29,719] Trial 226 is omitted in visualization because its objective value is inf or nan.
TRN1 | R2:0.363; p:0.0 | C:70.47 |3h:0.954 |6h:0.942 |9h:0.933 |12h:0.727 |15h:0.727 |18h:0.723 |24h:0.566 |48h:0.557 |72h:0.551 |1wk:0.371 |2wks:0.366 |1mon:0.307 |
TRN2 | R2:0.312; p:2.781e-72 | C:67.40 |3h:0.955 |6h:0.943 |9h:0.934 |12h:0.726 |15h:0.726 |18h:0.722 |24h:0.564 |48h:0.555 |72h:0.550 |1wk:0.363 |2wks:0.366 |1mon:0.313 |
VAL | R2:0.322; p:1.937e-77 | C:68.48 |3h:0.954 |6h:0.943 |9h:0.934 |12h:0.727 |15h:0.727 |18h:0.722 |24h:0.565 |48h:0.556 |72h:0.549 |1wk:0.372 |2wks:0.367 |1mon:0.300 |
TST | R2:0.253; p:1.567e-282 | C:64.09 |3h:0.949 |6h:0.934 |9h:0.924 |12h:0.721 |15h:0.721 |18h:0.705 |24h:0.435 |48h:0.432 |72h:0.430 |1wk:0.338 |2wks:0.349 |1mon:0.308 |
/content/drive/MyDrive/intermediates2/res//outcome2_xgb-aft_inp24_k9_emb4_rdims8.json
trn1
trn2
val
[I 2023-12-21 04:16:35,089] A new study created in memory with name: no-name-5a44ea21-c470-4bd4-923b-dd660f5e43c3
tst
[I 2023-12-21 04:16:36,514] Trial 0 finished with value: inf and parameters: {'learning_rate': 0.3153391858547361, 'aft_loss_distribution': 'logistic', 'aft_loss_distribution_scale': 0.304379282924091, 'max_depth': 3, 'booster': 'dart', 'scale_pos_weight': 0.5917863772020469, 'alpha': 8.925346923085458, 'lambda': 3.6313049096384833, 'eta': 0.17872538520460413, 'sampling_method': 'uniform', 'subsample': 0.44453271921291315, 'gamma': 6.45247707375358}. Best is trial 0 with value: inf.
[I 2023-12-21 04:16:39,577] Trial 1 finished with value: inf and parameters: {'learning_rate': 0.9599873864364247, 'aft_loss_distribution': 'logistic', 'aft_loss_distribution_scale': 0.5042701963746505, 'max_depth': 6, 'booster': 'dart', 'scale_pos_weight': 0.2905122989123419, 'alpha': 1.543497776368292, 'lambda': 7.974789859857797, 'eta': 0.7673131809332745, 'sampling_method': 'uniform', 'subsample': 0.4901202825977658, 'gamma': 1.1964824361002409}. Best is trial 0 with value: inf.
[I 2023-12-21 04:16:40,753] Trial 2 finished with value: inf and parameters: {'learning_rate': 0.8565786072516867, 'aft_loss_distribution': 'extreme', 'aft_loss_distribution_scale': 1.787043041515282, 'max_depth': 8, 'booster': 'gbtree', 'scale_pos_weight': 2.1649480634903595, 'alpha': 2.315388304785699, 'lambda': 7.186382188057335, 'eta': 0.5776040576896349, 'sampling_method': 'uniform', 'subsample': 0.9131769904295138, 'gamma': 8.125349373913833}. Best is trial 0 with value: inf.
[I 2023-12-21 04:16:44,257] Trial 3 finished with value: inf and parameters: {'learning_rate': 0.8790142946404987, 'aft_loss_distribution': 'normal', 'aft_loss_distribution_scale': 9.26254779368818, 'max_depth': 6, 'booster': 'dart', 'scale_pos_weight': 2.755953545178624, 'alpha': 1.6151907829512053, 'lambda': 7.948077555815716, 'eta': 0.42701168983004967, 'sampling_method': 'uniform', 'subsample': 0.3781353298891686, 'gamma': 1.5476882102650062}. Best is trial 0 with value: inf.
[I 2023-12-21 04:16:45,513] Trial 4 finished with value: inf and parameters: {'learning_rate': 0.6990623927425212, 'aft_loss_distribution': 'extreme', 'aft_loss_distribution_scale': 0.279977724065641, 'max_depth': 4, 'booster': 'gbtree', 'scale_pos_weight': 1.3747963026697776, 'alpha': 4.262755846896083, 'lambda': 7.177575881414125, 'eta': 0.5578489695921776, 'sampling_method': 'gradient_based', 'subsample': 0.8838104329409371, 'gamma': 0.6059047696604156}. Best is trial 0 with value: inf.
[I 2023-12-21 04:16:46,960] Trial 5 finished with value: 2.221220319804165 and parameters: {'learning_rate': 0.21109954271854578, 'aft_loss_distribution': 'extreme', 'aft_loss_distribution_scale': 3.5333037956832913, 'max_depth': 4, 'booster': 'gbtree', 'scale_pos_weight': 2.015212543775808, 'alpha': 1.1837043565348981, 'lambda': 7.222057630329498, 'eta': 0.08963423266001103, 'sampling_method': 'uniform', 'subsample': 0.0702468252025791, 'gamma': 9.578373086211055}. Best is trial 5 with value: 2.221220319804165.
[I 2023-12-21 04:16:48,838] Trial 6 finished with value: inf and parameters: {'learning_rate': 0.8940123916790944, 'aft_loss_distribution': 'logistic', 'aft_loss_distribution_scale': 2.8547606795945297, 'max_depth': 7, 'booster': 'dart', 'scale_pos_weight': 3.4506095677679953, 'alpha': 2.8014621039830194, 'lambda': 7.293954698047287, 'eta': 0.6465996960118564, 'sampling_method': 'uniform', 'subsample': 0.9492403686063694, 'gamma': 5.63279350610942}. Best is trial 5 with value: 2.221220319804165.
[I 2023-12-21 04:16:48,923] Trial 7 pruned. Trial was pruned at iteration 6.
[I 2023-12-21 04:16:49,769] Trial 8 pruned. Trial was pruned at iteration 51.
[I 2023-12-21 04:16:51,672] Trial 9 finished with value: inf and parameters: {'learning_rate': 0.3931345998747022, 'aft_loss_distribution': 'normal', 'aft_loss_distribution_scale': 4.147041998252142, 'max_depth': 6, 'booster': 'gbtree', 'scale_pos_weight': 1.7622932219365781, 'alpha': 1.5847002345109429, 'lambda': 0.5269975409599715, 'eta': 0.9815702168270865, 'sampling_method': 'gradient_based', 'subsample': 0.7500743122178665, 'gamma': 3.529518268115119}. Best is trial 5 with value: 2.221220319804165.
[I 2023-12-21 04:16:51,745] Trial 10 pruned. Trial was pruned at iteration 1.
[I 2023-12-21 04:16:53,018] Trial 11 pruned. Trial was pruned at iteration 51.
[I 2023-12-21 04:16:53,068] Trial 12 pruned. Trial was pruned at iteration 0.
[I 2023-12-21 04:16:53,245] Trial 13 pruned. Trial was pruned at iteration 10.
[I 2023-12-21 04:16:54,333] Trial 14 finished with value: 2.0631999144072157 and parameters: {'learning_rate': 0.4856148223224967, 'aft_loss_distribution': 'logistic', 'aft_loss_distribution_scale': 1.8239092922744615, 'max_depth': 4, 'booster': 'gbtree', 'scale_pos_weight': 2.879982386596493, 'alpha': 7.4692534469844025, 'lambda': 3.3738461217332936, 'eta': 0.38341936585386743, 'sampling_method': 'gradient_based', 'subsample': 0.5510703364875444, 'gamma': 6.858037681447884}. Best is trial 14 with value: 2.0631999144072157.
[I 2023-12-21 04:16:54,626] Trial 15 pruned. Trial was pruned at iteration 10.
[I 2023-12-21 04:16:54,682] Trial 16 pruned. Trial was pruned at iteration 0.
[I 2023-12-21 04:16:54,749] Trial 17 pruned. Trial was pruned at iteration 2.
[I 2023-12-21 04:16:54,840] Trial 18 pruned. Trial was pruned at iteration 2.
[I 2023-12-21 04:16:56,226] Trial 19 finished with value: 1.9087597009825021 and parameters: {'learning_rate': 0.4176544460739925, 'aft_loss_distribution': 'normal', 'aft_loss_distribution_scale': 1.6149468068113173, 'max_depth': 4, 'booster': 'gbtree', 'scale_pos_weight': 2.517926446232347, 'alpha': 5.8550120241898576, 'lambda': 4.265690149118722, 'eta': 0.4656870091093942, 'sampling_method': 'gradient_based', 'subsample': 0.5479135298664596, 'gamma': 8.890777216827468}. Best is trial 19 with value: 1.9087597009825021.
[I 2023-12-21 04:16:56,338] Trial 20 pruned. Trial was pruned at iteration 0.
[I 2023-12-21 04:16:57,498] Trial 21 finished with value: inf and parameters: {'learning_rate': 0.5649376989181112, 'aft_loss_distribution': 'normal', 'aft_loss_distribution_scale': 3.0966855726151805, 'max_depth': 4, 'booster': 'gbtree', 'scale_pos_weight': 2.413514071855359, 'alpha': 5.558152532140756, 'lambda': 4.311821683033567, 'eta': 0.44376298838326456, 'sampling_method': 'gradient_based', 'subsample': 0.40027766101116724, 'gamma': 8.779722275390029}. Best is trial 19 with value: 1.9087597009825021.
[I 2023-12-21 04:16:57,585] Trial 22 pruned. Trial was pruned at iteration 0.
[I 2023-12-21 04:16:58,592] Trial 23 finished with value: inf and parameters: {'learning_rate': 0.4474768945030274, 'aft_loss_distribution': 'normal', 'aft_loss_distribution_scale': 2.3772761494456542, 'max_depth': 3, 'booster': 'gbtree', 'scale_pos_weight': 1.8826146137706758, 'alpha': 4.091646380572403, 'lambda': 2.62924360615394, 'eta': 0.238033941433112, 'sampling_method': 'gradient_based', 'subsample': 0.3357673965792206, 'gamma': 9.380568347251787}. Best is trial 19 with value: 1.9087597009825021.
[I 2023-12-21 04:16:58,681] Trial 24 pruned. Trial was pruned at iteration 0.
[I 2023-12-21 04:16:58,801] Trial 25 pruned. Trial was pruned at iteration 0.
[I 2023-12-21 04:16:58,897] Trial 26 pruned. Trial was pruned at iteration 0.
[I 2023-12-21 04:16:58,979] Trial 27 pruned. Trial was pruned at iteration 0.
[I 2023-12-21 04:16:59,074] Trial 28 pruned. Trial was pruned at iteration 2.
[I 2023-12-21 04:16:59,189] Trial 29 pruned. Trial was pruned at iteration 0.
[I 2023-12-21 04:16:59,291] Trial 30 pruned. Trial was pruned at iteration 2.
[I 2023-12-21 04:16:59,384] Trial 31 pruned. Trial was pruned at iteration 0.
[I 2023-12-21 04:17:02,037] Trial 32 pruned. Trial was pruned at iteration 66.
[I 2023-12-21 04:17:02,098] Trial 33 pruned. Trial was pruned at iteration 0.
[I 2023-12-21 04:17:02,181] Trial 34 pruned. Trial was pruned at iteration 0.
[I 2023-12-21 04:17:02,246] Trial 35 pruned. Trial was pruned at iteration 0.
[I 2023-12-21 04:17:02,310] Trial 36 pruned. Trial was pruned at iteration 1.
[I 2023-12-21 04:17:04,721] Trial 37 finished with value: inf and parameters: {'learning_rate': 0.654441504932046, 'aft_loss_distribution': 'normal', 'aft_loss_distribution_scale': 2.721929507102907, 'max_depth': 7, 'booster': 'dart', 'scale_pos_weight': 1.908001925904053, 'alpha': 3.599001417766308, 'lambda': 0.6413930624237589, 'eta': 0.5519777326288612, 'sampling_method': 'uniform', 'subsample': 0.15912796705089044, 'gamma': 9.24681178697329}. Best is trial 19 with value: 1.9087597009825021.
[I 2023-12-21 04:17:04,833] Trial 38 pruned. Trial was pruned at iteration 0.
[I 2023-12-21 04:17:04,907] Trial 39 pruned. Trial was pruned at iteration 0.
[I 2023-12-21 04:17:04,979] Trial 40 pruned. Trial was pruned at iteration 0.
[I 2023-12-21 04:17:05,037] Trial 41 pruned. Trial was pruned at iteration 0.
[I 2023-12-21 04:17:05,163] Trial 42 pruned. Trial was pruned at iteration 0.
[I 2023-12-21 04:17:05,220] Trial 43 pruned. Trial was pruned at iteration 0.
[I 2023-12-21 04:17:05,303] Trial 44 pruned. Trial was pruned at iteration 2.
[I 2023-12-21 04:17:05,360] Trial 45 pruned. Trial was pruned at iteration 0.
[I 2023-12-21 04:17:05,416] Trial 46 pruned. Trial was pruned at iteration 0.
[I 2023-12-21 04:17:05,540] Trial 47 pruned. Trial was pruned at iteration 0.
[I 2023-12-21 04:17:05,603] Trial 48 pruned. Trial was pruned at iteration 0.
[I 2023-12-21 04:17:07,042] Trial 49 pruned. Trial was pruned at iteration 51.
[I 2023-12-21 04:17:07,099] Trial 50 pruned. Trial was pruned at iteration 0.
[I 2023-12-21 04:17:07,173] Trial 51 pruned. Trial was pruned at iteration 0.
[I 2023-12-21 04:17:07,227] Trial 52 pruned. Trial was pruned at iteration 0.
[I 2023-12-21 04:17:07,286] Trial 53 pruned. Trial was pruned at iteration 0.
[I 2023-12-21 04:17:07,353] Trial 54 pruned. Trial was pruned at iteration 0.
[I 2023-12-21 04:17:07,434] Trial 55 pruned. Trial was pruned at iteration 0.
[I 2023-12-21 04:17:08,301] Trial 56 finished with value: inf and parameters: {'learning_rate': 0.803062718707703, 'aft_loss_distribution': 'normal', 'aft_loss_distribution_scale': 2.4610423916791806, 'max_depth': 8, 'booster': 'gbtree', 'scale_pos_weight': 2.7696687198116576, 'alpha': 5.625631875409804, 'lambda': 5.77129651104173, 'eta': 0.8452135667952808, 'sampling_method': 'gradient_based', 'subsample': 0.7797157406939055, 'gamma': 8.300406263707774}. Best is trial 19 with value: 1.9087597009825021.
[I 2023-12-21 04:17:08,368] Trial 57 pruned. Trial was pruned at iteration 0.
[I 2023-12-21 04:17:09,034] Trial 58 finished with value: inf and parameters: {'learning_rate': 0.7529025893289423, 'aft_loss_distribution': 'normal', 'aft_loss_distribution_scale': 3.0853401237428058, 'max_depth': 4, 'booster': 'gbtree', 'scale_pos_weight': 2.97276120325412, 'alpha': 3.2368444888610854, 'lambda': 7.812953766293699, 'eta': 0.13497390098688705, 'sampling_method': 'gradient_based', 'subsample': 0.6138218053137271, 'gamma': 9.237603255663046}. Best is trial 19 with value: 1.9087597009825021.
[I 2023-12-21 04:17:09,109] Trial 59 pruned. Trial was pruned at iteration 0.
[I 2023-12-21 04:17:09,170] Trial 60 pruned. Trial was pruned at iteration 0.
[I 2023-12-21 04:17:09,247] Trial 61 pruned. Trial was pruned at iteration 1.
[I 2023-12-21 04:17:09,331] Trial 62 pruned. Trial was pruned at iteration 1.
[I 2023-12-21 04:17:09,391] Trial 63 pruned. Trial was pruned at iteration 0.
[I 2023-12-21 04:17:09,484] Trial 64 pruned. Trial was pruned at iteration 2.
[I 2023-12-21 04:17:11,653] Trial 65 finished with value: inf and parameters: {'learning_rate': 0.5316215902279021, 'aft_loss_distribution': 'logistic', 'aft_loss_distribution_scale': 1.1482007563919883, 'max_depth': 3, 'booster': 'dart', 'scale_pos_weight': 2.6504811599315854, 'alpha': 0.07066959373049042, 'lambda': 3.992107088690298, 'eta': 0.2810327909862701, 'sampling_method': 'uniform', 'subsample': 0.06425288926915274, 'gamma': 0.4775073536382374}. Best is trial 19 with value: 1.9087597009825021.
[I 2023-12-21 04:17:15,128] Trial 66 finished with value: inf and parameters: {'learning_rate': 0.9986717662495999, 'aft_loss_distribution': 'normal', 'aft_loss_distribution_scale': 1.6950041917449972, 'max_depth': 6, 'booster': 'gbtree', 'scale_pos_weight': 1.6296145037235799, 'alpha': 7.163292450718068, 'lambda': 9.179747469573668, 'eta': 0.8832510628040868, 'sampling_method': 'gradient_based', 'subsample': 0.24308168264789315, 'gamma': 3.1033947615855957}. Best is trial 19 with value: 1.9087597009825021.
[I 2023-12-21 04:17:15,195] Trial 67 pruned. Trial was pruned at iteration 0.
[I 2023-12-21 04:17:15,254] Trial 68 pruned. Trial was pruned at iteration 0.
[I 2023-12-21 04:17:15,326] Trial 69 pruned. Trial was pruned at iteration 0.
[I 2023-12-21 04:17:15,389] Trial 70 pruned. Trial was pruned at iteration 0.
[I 2023-12-21 04:17:15,456] Trial 71 pruned. Trial was pruned at iteration 0.
[I 2023-12-21 04:17:15,516] Trial 72 pruned. Trial was pruned at iteration 0.
[I 2023-12-21 04:17:15,577] Trial 73 pruned. Trial was pruned at iteration 0.
[I 2023-12-21 04:17:15,660] Trial 74 pruned. Trial was pruned at iteration 0.
[I 2023-12-21 04:17:15,740] Trial 75 pruned. Trial was pruned at iteration 0.
[I 2023-12-21 04:17:15,826] Trial 76 pruned. Trial was pruned at iteration 0.
[I 2023-12-21 04:17:15,967] Trial 77 pruned. Trial was pruned at iteration 2.
[I 2023-12-21 04:17:16,033] Trial 78 pruned. Trial was pruned at iteration 0.
[I 2023-12-21 04:17:16,099] Trial 79 pruned. Trial was pruned at iteration 0.
[I 2023-12-21 04:17:16,161] Trial 80 pruned. Trial was pruned at iteration 0.
[I 2023-12-21 04:17:16,337] Trial 81 pruned. Trial was pruned at iteration 2.
[I 2023-12-21 04:17:16,402] Trial 82 pruned. Trial was pruned at iteration 0.
[I 2023-12-21 04:17:16,505] Trial 83 pruned. Trial was pruned at iteration 1.
[I 2023-12-21 04:17:17,820] Trial 84 finished with value: inf and parameters: {'learning_rate': 0.9260261724123079, 'aft_loss_distribution': 'logistic', 'aft_loss_distribution_scale': 1.6566814699754753, 'max_depth': 8, 'booster': 'dart', 'scale_pos_weight': 1.8521442143712874, 'alpha': 0.7062194099635535, 'lambda': 8.475713154612215, 'eta': 0.44178595001858234, 'sampling_method': 'uniform', 'subsample': 0.01579167834631945, 'gamma': 8.62006449861614}. Best is trial 19 with value: 1.9087597009825021.
[I 2023-12-21 04:17:17,943] Trial 85 pruned. Trial was pruned at iteration 0.
[I 2023-12-21 04:17:18,628] Trial 86 finished with value: inf and parameters: {'learning_rate': 0.8353549228270549, 'aft_loss_distribution': 'normal', 'aft_loss_distribution_scale': 2.3880872444397543, 'max_depth': 3, 'booster': 'gbtree', 'scale_pos_weight': 2.4146352288436757, 'alpha': 5.418554525651406, 'lambda': 8.061688104483963, 'eta': 0.5126120167841447, 'sampling_method': 'uniform', 'subsample': 0.8484634083434927, 'gamma': 6.66216257536445}. Best is trial 19 with value: 1.9087597009825021.
[I 2023-12-21 04:17:18,701] Trial 87 pruned. Trial was pruned at iteration 0.
[I 2023-12-21 04:17:18,779] Trial 88 pruned. Trial was pruned at iteration 1.
[I 2023-12-21 04:17:18,851] Trial 89 pruned. Trial was pruned at iteration 0.
[I 2023-12-21 04:17:18,969] Trial 90 pruned. Trial was pruned at iteration 0.
[I 2023-12-21 04:17:19,062] Trial 91 pruned. Trial was pruned at iteration 0.
[I 2023-12-21 04:17:19,122] Trial 92 pruned. Trial was pruned at iteration 0.
[I 2023-12-21 04:17:19,186] Trial 93 pruned. Trial was pruned at iteration 0.
[I 2023-12-21 04:17:19,245] Trial 94 pruned. Trial was pruned at iteration 0.
[I 2023-12-21 04:17:19,309] Trial 95 pruned. Trial was pruned at iteration 0.
[I 2023-12-21 04:17:19,377] Trial 96 pruned. Trial was pruned at iteration 0.
[I 2023-12-21 04:17:19,499] Trial 97 pruned. Trial was pruned at iteration 1.
[I 2023-12-21 04:17:19,559] Trial 98 pruned. Trial was pruned at iteration 0.
[I 2023-12-21 04:17:19,630] Trial 99 pruned. Trial was pruned at iteration 0.
[I 2023-12-21 04:17:19,711] Trial 100 pruned. Trial was pruned at iteration 0.
[I 2023-12-21 04:17:19,777] Trial 101 pruned. Trial was pruned at iteration 0.
[I 2023-12-21 04:17:20,354] Trial 102 finished with value: inf and parameters: {'learning_rate': 0.8655437482952564, 'aft_loss_distribution': 'normal', 'aft_loss_distribution_scale': 2.7492101353656064, 'max_depth': 3, 'booster': 'gbtree', 'scale_pos_weight': 2.450273293563564, 'alpha': 7.250484401544574, 'lambda': 4.650683819909989, 'eta': 0.3946104011011081, 'sampling_method': 'gradient_based', 'subsample': 0.5998777264149523, 'gamma': 8.748751546287929}. Best is trial 19 with value: 1.9087597009825021.
[I 2023-12-21 04:17:20,440] Trial 103 pruned. Trial was pruned at iteration 0.
[I 2023-12-21 04:17:20,545] Trial 104 pruned. Trial was pruned at iteration 0.
[I 2023-12-21 04:17:20,614] Trial 105 pruned. Trial was pruned at iteration 0.
[I 2023-12-21 04:17:20,691] Trial 106 pruned. Trial was pruned at iteration 0.
[I 2023-12-21 04:17:20,789] Trial 107 pruned. Trial was pruned at iteration 1.
[I 2023-12-21 04:17:20,854] Trial 108 pruned. Trial was pruned at iteration 0.
[I 2023-12-21 04:17:21,233] Trial 109 pruned. Trial was pruned at iteration 3.
[I 2023-12-21 04:17:21,303] Trial 110 pruned. Trial was pruned at iteration 0.
[I 2023-12-21 04:17:21,374] Trial 111 pruned. Trial was pruned at iteration 0.
[I 2023-12-21 04:17:21,437] Trial 112 pruned. Trial was pruned at iteration 0.
[I 2023-12-21 04:17:21,513] Trial 113 pruned. Trial was pruned at iteration 0.
[I 2023-12-21 04:17:21,584] Trial 114 pruned. Trial was pruned at iteration 0.
[I 2023-12-21 04:17:21,647] Trial 115 pruned. Trial was pruned at iteration 0.
[I 2023-12-21 04:17:22,436] Trial 116 finished with value: 2.0161728130139305 and parameters: {'learning_rate': 0.5668482290384161, 'aft_loss_distribution': 'logistic', 'aft_loss_distribution_scale': 1.4853301101807523, 'max_depth': 3, 'booster': 'gbtree', 'scale_pos_weight': 0.3788667388519391, 'alpha': 8.632285484254998, 'lambda': 2.587746289283788, 'eta': 0.18052166778306689, 'sampling_method': 'uniform', 'subsample': 0.4139571490020869, 'gamma': 6.772201580761131}. Best is trial 19 with value: 1.9087597009825021.
[I 2023-12-21 04:17:22,533] Trial 117 pruned. Trial was pruned at iteration 1.
[I 2023-12-21 04:17:22,652] Trial 118 pruned. Trial was pruned at iteration 0.
[I 2023-12-21 04:17:22,900] Trial 119 pruned. Trial was pruned at iteration 0.
