[I 2023-12-21 04:03:09,877] Trial 291 pruned. Trial was pruned at iteration 0.
[I 2023-12-21 04:03:09,920] Trial 292 pruned. Trial was pruned at iteration 0.
[I 2023-12-21 04:03:09,965] Trial 293 pruned. Trial was pruned at iteration 0.
[I 2023-12-21 04:03:10,007] Trial 294 pruned. Trial was pruned at iteration 0.
[I 2023-12-21 04:03:10,052] Trial 295 pruned. Trial was pruned at iteration 1.
[I 2023-12-21 04:03:10,095] Trial 296 pruned. Trial was pruned at iteration 0.
[I 2023-12-21 04:03:10,138] Trial 297 pruned. Trial was pruned at iteration 0.
[I 2023-12-21 04:03:10,181] Trial 298 pruned. Trial was pruned at iteration 0.
[I 2023-12-21 04:03:10,225] Trial 299 pruned. Trial was pruned at iteration 0.
[I 2023-12-21 04:03:10,267] Trial 300 pruned. Trial was pruned at iteration 0.
[I 2023-12-21 04:03:10,312] Trial 301 pruned. Trial was pruned at iteration 0.
[I 2023-12-21 04:03:10,425] Trial 302 finished with value: inf and parameters: {'learning_rate': 0.8675174930828223, 'aft_loss_distributi                                                                     on': 'normal', 'aft_loss_distribution_scale': 1.111884862177495, 'max_depth': 7, 'booster': 'gbtree', 'scale_pos_weight': 4.1488029538413                                                                     22, 'alpha': 3.9764531945516817, 'lambda': 8.940961008092016, 'eta': 0.8802405558842549, 'sampling_method': 'gradient_based', 'subsample'                                                                     : 0.8867854073209783, 'gamma': 6.408075374531676}. Best is trial 84 with value: 4.259518710902867.
[I 2023-12-21 04:03:10,551] Trial 303 finished with value: inf and parameters: {'learning_rate': 0.892357149890811, 'aft_loss_distributio                                                                     n': 'normal', 'aft_loss_distribution_scale': 0.9194574183227121, 'max_depth': 6, 'booster': 'gbtree', 'scale_pos_weight': 6.4765321788949                                                                     56, 'alpha': 8.08996156282884, 'lambda': 5.079233506705858, 'eta': 0.9066177504545594, 'sampling_method': 'gradient_based', 'subsample':                                                                      0.6045529094426876, 'gamma': 3.672738654747455}. Best is trial 84 with value: 4.259518710902867.
[I 2023-12-21 04:03:10,595] Trial 304 pruned. Trial was pruned at iteration 0.
[I 2023-12-21 04:03:10,641] Trial 305 pruned. Trial was pruned at iteration 2.
[I 2023-12-21 04:03:10,684] Trial 306 pruned. Trial was pruned at iteration 0.
[I 2023-12-21 04:03:10,729] Trial 307 pruned. Trial was pruned at iteration 0.
[I 2023-12-21 04:03:10,772] Trial 308 pruned. Trial was pruned at iteration 0.
[I 2023-12-21 04:03:10,815] Trial 309 pruned. Trial was pruned at iteration 0.
[I 2023-12-21 04:03:10,859] Trial 310 pruned. Trial was pruned at iteration 0.
[I 2023-12-21 04:03:10,905] Trial 311 pruned. Trial was pruned at iteration 0.
[I 2023-12-21 04:03:10,948] Trial 312 pruned. Trial was pruned at iteration 0.
[I 2023-12-21 04:03:10,993] Trial 313 pruned. Trial was pruned at iteration 0.
[I 2023-12-21 04:03:11,036] Trial 314 pruned. Trial was pruned at iteration 0.
[I 2023-12-21 04:03:11,079] Trial 315 pruned. Trial was pruned at iteration 0.
[I 2023-12-21 04:03:11,123] Trial 316 pruned. Trial was pruned at iteration 0.
[I 2023-12-21 04:03:11,166] Trial 317 pruned. Trial was pruned at iteration 0.
[I 2023-12-21 04:03:11,211] Trial 318 pruned. Trial was pruned at iteration 1.
[I 2023-12-21 04:03:11,346] Trial 319 finished with value: 4.294813884365041 and parameters: {'learning_rate': 0.8930115186253346, 'aft_l                                                                     oss_distribution': 'normal', 'aft_loss_distribution_scale': 1.2854416219354414, 'max_depth': 7, 'booster': 'gbtree', 'scale_pos_weight':                                                                      4.066812219202239, 'alpha': 2.437505280781472, 'lambda': 6.9415528300611, 'eta': 0.3719991672941336, 'sampling_method': 'uniform', 'subsa                                                                     mple': 0.9196744205335283, 'gamma': 5.922821798345743}. Best is trial 84 with value: 4.259518710902867.
[I 2023-12-21 04:03:11,392] Trial 320 pruned. Trial was pruned at iteration 0.
[I 2023-12-21 04:03:11,493] Trial 321 finished with value: inf and parameters: {'learning_rate': 0.872101322565778, 'aft_loss_distributio                                                                     n': 'normal', 'aft_loss_distribution_scale': 1.2570874190133594, 'max_depth': 7, 'booster': 'gbtree', 'scale_pos_weight': 2.7549642461600                                                                     192, 'alpha': 1.3929550169258982, 'lambda': 8.43999332633896, 'eta': 0.3566356602687636, 'sampling_method': 'uniform', 'subsample': 0.897                                                                     7433379839344, 'gamma': 5.895077044200327}. Best is trial 84 with value: 4.259518710902867.
[I 2023-12-21 04:03:11,602] Trial 322 finished with value: inf and parameters: {'learning_rate': 0.8920243667903399, 'aft_loss_distributi                                                                     on': 'normal', 'aft_loss_distribution_scale': 0.967206263080834, 'max_depth': 10, 'booster': 'gbtree', 'scale_pos_weight': 4.017809641909                                                                     337, 'alpha': 4.707715326416402, 'lambda': 6.650669040884677, 'eta': 0.2335684957612002, 'sampling_method': 'uniform', 'subsample': 0.915                                                                     8838118925927, 'gamma': 6.147732606569684}. Best is trial 84 with value: 4.259518710902867.
[I 2023-12-21 04:03:11,647] Trial 323 pruned. Trial was pruned at iteration 0.
[I 2023-12-21 04:03:11,691] Trial 324 pruned. Trial was pruned at iteration 0.
[I 2023-12-21 04:03:11,735] Trial 325 pruned. Trial was pruned at iteration 0.
[I 2023-12-21 04:03:11,779] Trial 326 pruned. Trial was pruned at iteration 1.
[I 2023-12-21 04:03:11,824] Trial 327 pruned. Trial was pruned at iteration 0.
[I 2023-12-21 04:03:11,868] Trial 328 pruned. Trial was pruned at iteration 0.
[I 2023-12-21 04:03:12,022] Trial 329 finished with value: 4.273993825863938 and parameters: {'learning_rate': 0.8813576533793502, 'aft_l                                                                     oss_distribution': 'normal', 'aft_loss_distribution_scale': 0.9485873216436397, 'max_depth': 6, 'booster': 'gbtree', 'scale_pos_weight':                                                                      9.150841270515894, 'alpha': 4.503756169121111, 'lambda': 8.319437370244417, 'eta': 0.839106836802441, 'sampling_method': 'gradient_based'                                                                     , 'subsample': 0.8186028264635841, 'gamma': 7.937005649918988}. Best is trial 84 with value: 4.259518710902867.
[I 2023-12-21 04:03:12,067] Trial 330 pruned. Trial was pruned at iteration 0.
[I 2023-12-21 04:03:12,112] Trial 331 pruned. Trial was pruned at iteration 0.
[I 2023-12-21 04:03:12,225] Trial 332 finished with value: inf and parameters: {'learning_rate': 0.9070532470551832, 'aft_loss_distributi                                                                     on': 'normal', 'aft_loss_distribution_scale': 0.9607924613731733, 'max_depth': 6, 'booster': 'gbtree', 'scale_pos_weight': 7.784729622316                                                                     346, 'alpha': 4.309072364296286, 'lambda': 6.460133984757446, 'eta': 0.8654244778123299, 'sampling_method': 'gradient_based', 'subsample'                                                                     : 0.8505990972183087, 'gamma': 7.622818925407262}. Best is trial 84 with value: 4.259518710902867.
[I 2023-12-21 04:03:12,270] Trial 333 pruned. Trial was pruned at iteration 0.
[I 2023-12-21 04:03:12,316] Trial 334 pruned. Trial was pruned at iteration 0.
[I 2023-12-21 04:03:12,363] Trial 335 pruned. Trial was pruned at iteration 0.
[I 2023-12-21 04:03:12,475] Trial 336 finished with value: inf and parameters: {'learning_rate': 0.9338054740228722, 'aft_loss_distributi                                                                     on': 'normal', 'aft_loss_distribution_scale': 1.1389498973354397, 'max_depth': 6, 'booster': 'gbtree', 'scale_pos_weight': 7.287931211875                                                                     3115, 'alpha': 4.918620818765427, 'lambda': 8.442307458973836, 'eta': 0.9057400438337908, 'sampling_method': 'gradient_based', 'subsample                                                                     ': 0.814401000527544, 'gamma': 7.471140281419554}. Best is trial 84 with value: 4.259518710902867.
[I 2023-12-21 04:03:12,523] Trial 337 pruned. Trial was pruned at iteration 1.
[I 2023-12-21 04:03:12,567] Trial 338 pruned. Trial was pruned at iteration 0.
[I 2023-12-21 04:03:12,681] Trial 339 finished with value: inf and parameters: {'learning_rate': 0.904628854322312, 'aft_loss_distributio                                                                     n': 'normal', 'aft_loss_distribution_scale': 1.0462965979174057, 'max_depth': 7, 'booster': 'gbtree', 'scale_pos_weight': 3.7969422012603                                                                     427, 'alpha': 5.161843497261048, 'lambda': 8.058641671619164, 'eta': 0.9755100001696854, 'sampling_method': 'gradient_based', 'subsample'                                                                     : 0.8907890742256493, 'gamma': 4.821080074048626}. Best is trial 84 with value: 4.259518710902867.
[I 2023-12-21 04:03:12,727] Trial 340 pruned. Trial was pruned at iteration 0.
[I 2023-12-21 04:03:12,841] Trial 341 finished with value: inf and parameters: {'learning_rate': 0.9990914196258582, 'aft_loss_distributi                                                                     on': 'normal', 'aft_loss_distribution_scale': 1.2105634667975322, 'max_depth': 6, 'booster': 'gbtree', 'scale_pos_weight': 5.357781381323                                                                     061, 'alpha': 5.4843688242220825, 'lambda': 8.760103842625755, 'eta': 0.19789368127069426, 'sampling_method': 'gradient_based', 'subsampl                                                                     e': 0.9090655635730662, 'gamma': 6.126938211210019}. Best is trial 84 with value: 4.259518710902867.
[I 2023-12-21 04:03:12,887] Trial 342 pruned. Trial was pruned at iteration 0.
[I 2023-12-21 04:03:12,933] Trial 343 pruned. Trial was pruned at iteration 0.
[I 2023-12-21 04:03:12,977] Trial 344 pruned. Trial was pruned at iteration 0.
[I 2023-12-21 04:03:13,022] Trial 345 pruned. Trial was pruned at iteration 0.
[I 2023-12-21 04:03:13,066] Trial 346 pruned. Trial was pruned at iteration 0.
[I 2023-12-21 04:03:13,114] Trial 347 pruned. Trial was pruned at iteration 1.
[I 2023-12-21 04:03:13,159] Trial 348 pruned. Trial was pruned at iteration 0.
[I 2023-12-21 04:03:13,206] Trial 349 pruned. Trial was pruned at iteration 0.
[I 2023-12-21 04:03:13,251] Trial 350 pruned. Trial was pruned at iteration 0.
[I 2023-12-21 04:03:13,296] Trial 351 pruned. Trial was pruned at iteration 0.
[I 2023-12-21 04:03:13,343] Trial 352 pruned. Trial was pruned at iteration 0.
[I 2023-12-21 04:03:13,388] Trial 353 pruned. Trial was pruned at iteration 0.
[I 2023-12-21 04:03:13,433] Trial 354 pruned. Trial was pruned at iteration 0.
[I 2023-12-21 04:03:13,480] Trial 355 pruned. Trial was pruned at iteration 0.
[I 2023-12-21 04:03:13,531] Trial 356 pruned. Trial was pruned at iteration 0.
[I 2023-12-21 04:03:13,576] Trial 357 pruned. Trial was pruned at iteration 0.
[I 2023-12-21 04:03:13,621] Trial 358 pruned. Trial was pruned at iteration 0.
[I 2023-12-21 04:03:13,668] Trial 359 pruned. Trial was pruned at iteration 1.
[I 2023-12-21 04:03:13,713] Trial 360 pruned. Trial was pruned at iteration 0.
[I 2023-12-21 04:03:13,759] Trial 361 pruned. Trial was pruned at iteration 0.
[I 2023-12-21 04:03:13,806] Trial 362 pruned. Trial was pruned at iteration 0.
[I 2023-12-21 04:03:13,855] Trial 363 pruned. Trial was pruned at iteration 1.
[I 2023-12-21 04:03:13,902] Trial 364 pruned. Trial was pruned at iteration 1.
[I 2023-12-21 04:03:13,947] Trial 365 pruned. Trial was pruned at iteration 0.
[I 2023-12-21 04:03:13,993] Trial 366 pruned. Trial was pruned at iteration 0.
[I 2023-12-21 04:03:14,039] Trial 367 pruned. Trial was pruned at iteration 0.
[I 2023-12-21 04:03:14,087] Trial 368 pruned. Trial was pruned at iteration 0.
[I 2023-12-21 04:03:14,133] Trial 369 pruned. Trial was pruned at iteration 0.
[I 2023-12-21 04:03:14,179] Trial 370 pruned. Trial was pruned at iteration 0.
[I 2023-12-21 04:03:14,226] Trial 371 pruned. Trial was pruned at iteration 0.
[I 2023-12-21 04:03:14,272] Trial 372 pruned. Trial was pruned at iteration 0.
[I 2023-12-21 04:03:14,320] Trial 373 pruned. Trial was pruned at iteration 0.
[I 2023-12-21 04:03:14,436] Trial 374 finished with value: inf and parameters: {'learning_rate': 0.8542939007718853, 'aft_loss_distributi                                                                     on': 'normal', 'aft_loss_distribution_scale': 1.2526479540726747, 'max_depth': 7, 'booster': 'gbtree', 'scale_pos_weight': 3.907069414781                                                                     695, 'alpha': 2.4693234730385085, 'lambda': 4.075483141379504, 'eta': 0.818309567287815, 'sampling_method': 'gradient_based', 'subsample'                                                                     : 0.9261710885283354, 'gamma': 6.254541263259203}. Best is trial 84 with value: 4.259518710902867.
[I 2023-12-21 04:03:14,542] Trial 375 finished with value: inf and parameters: {'learning_rate': 0.8977541583226486, 'aft_loss_distributi                                                                     on': 'normal', 'aft_loss_distribution_scale': 0.9407500281940709, 'max_depth': 7, 'booster': 'gbtree', 'scale_pos_weight': 4.653214351787                                                                     957, 'alpha': 5.157463619570127, 'lambda': 8.139317132246804, 'eta': 0.9372853911058501, 'sampling_method': 'uniform', 'subsample': 0.946                                                                     6362497601591, 'gamma': 6.535708400635203}. Best is trial 84 with value: 4.259518710902867.
[I 2023-12-21 04:03:14,590] Trial 376 pruned. Trial was pruned at iteration 0.
[I 2023-12-21 04:03:14,637] Trial 377 pruned. Trial was pruned at iteration 0.
[I 2023-12-21 04:03:14,685] Trial 378 pruned. Trial was pruned at iteration 1.
[I 2023-12-21 04:03:14,731] Trial 379 pruned. Trial was pruned at iteration 0.
[I 2023-12-21 04:03:14,777] Trial 380 pruned. Trial was pruned at iteration 0.
[I 2023-12-21 04:03:14,824] Trial 381 pruned. Trial was pruned at iteration 0.
[I 2023-12-21 04:03:14,872] Trial 382 pruned. Trial was pruned at iteration 0.
[I 2023-12-21 04:03:14,919] Trial 383 pruned. Trial was pruned at iteration 0.
[I 2023-12-21 04:03:14,967] Trial 384 pruned. Trial was pruned at iteration 0.
[I 2023-12-21 04:03:15,013] Trial 385 pruned. Trial was pruned at iteration 0.
[I 2023-12-21 04:03:15,060] Trial 386 pruned. Trial was pruned at iteration 0.
[I 2023-12-21 04:03:15,107] Trial 387 pruned. Trial was pruned at iteration 0.
[I 2023-12-21 04:03:15,244] Trial 388 finished with value: inf and parameters: {'learning_rate': 0.8668293342194279, 'aft_loss_distributi                                                                     on': 'normal', 'aft_loss_distribution_scale': 1.0811100260156747, 'max_depth': 6, 'booster': 'gbtree', 'scale_pos_weight': 3.143286787144                                                                     9397, 'alpha': 5.1957776165679475, 'lambda': 5.197183014452836, 'eta': 0.9562287761898391, 'sampling_method': 'gradient_based', 'subsampl                                                                     e': 0.39188638442884366, 'gamma': 6.3373571654229925}. Best is trial 84 with value: 4.259518710902867.
[I 2023-12-21 04:03:15,291] Trial 389 pruned. Trial was pruned at iteration 0.
[I 2023-12-21 04:03:15,338] Trial 390 pruned. Trial was pruned at iteration 0.
[I 2023-12-21 04:03:15,385] Trial 391 pruned. Trial was pruned at iteration 0.
[I 2023-12-21 04:03:15,433] Trial 392 pruned. Trial was pruned at iteration 0.
[I 2023-12-21 04:03:15,480] Trial 393 pruned. Trial was pruned at iteration 0.
[I 2023-12-21 04:03:15,527] Trial 394 pruned. Trial was pruned at iteration 0.
[I 2023-12-21 04:03:15,575] Trial 395 pruned. Trial was pruned at iteration 0.
[I 2023-12-21 04:03:15,622] Trial 396 pruned. Trial was pruned at iteration 0.
[I 2023-12-21 04:03:15,670] Trial 397 pruned. Trial was pruned at iteration 0.
[I 2023-12-21 04:03:15,806] Trial 398 finished with value: inf and parameters: {'learning_rate': 0.8804285374876648, 'aft_loss_distributi                                                                     on': 'normal', 'aft_loss_distribution_scale': 1.1201621189689872, 'max_depth': 7, 'booster': 'gbtree', 'scale_pos_weight': 4.338555250419                                                                     381, 'alpha': 4.715295722772947, 'lambda': 5.753556210567918, 'eta': 0.2691490541183299, 'sampling_method': 'gradient_based', 'subsample'                                                                     : 0.33470079786456763, 'gamma': 7.504477356937565}. Best is trial 84 with value: 4.259518710902867.
[I 2023-12-21 04:03:15,854] Trial 399 pruned. Trial was pruned at iteration 0.
[I 2023-12-21 04:03:15,902] Trial 400 pruned. Trial was pruned at iteration 0.
[I 2023-12-21 04:03:15,949] Trial 401 pruned. Trial was pruned at iteration 0.
[I 2023-12-21 04:03:16,002] Trial 402 pruned. Trial was pruned at iteration 1.
[I 2023-12-21 04:03:16,051] Trial 403 pruned. Trial was pruned at iteration 0.
[I 2023-12-21 04:03:16,098] Trial 404 pruned. Trial was pruned at iteration 0.
[I 2023-12-21 04:03:16,146] Trial 405 pruned. Trial was pruned at iteration 0.
[I 2023-12-21 04:03:16,193] Trial 406 pruned. Trial was pruned at iteration 0.
[I 2023-12-21 04:03:16,243] Trial 407 pruned. Trial was pruned at iteration 1.
[I 2023-12-21 04:03:16,293] Trial 408 pruned. Trial was pruned at iteration 0.
[I 2023-12-21 04:03:16,342] Trial 409 pruned. Trial was pruned at iteration 0.
[I 2023-12-21 04:03:16,390] Trial 410 pruned. Trial was pruned at iteration 0.
[I 2023-12-21 04:03:16,439] Trial 411 pruned. Trial was pruned at iteration 0.
[I 2023-12-21 04:03:16,487] Trial 412 pruned. Trial was pruned at iteration 0.
[I 2023-12-21 04:03:16,607] Trial 413 finished with value: inf and parameters: {'learning_rate': 0.8688896506287159, 'aft_loss_distributi                                                                     on': 'normal', 'aft_loss_distribution_scale': 1.2398220186144915, 'max_depth': 7, 'booster': 'gbtree', 'scale_pos_weight': 4.657179214896                                                                     058, 'alpha': 7.046263131676629, 'lambda': 7.460849547238371, 'eta': 0.9259366353456192, 'sampling_method': 'gradient_based', 'subsample'                                                                     : 0.6478021618044945, 'gamma': 4.041224374573419}. Best is trial 84 with value: 4.259518710902867.
[I 2023-12-21 04:03:16,655] Trial 414 pruned. Trial was pruned at iteration 0.
[I 2023-12-21 04:03:16,704] Trial 415 pruned. Trial was pruned at iteration 0.
[I 2023-12-21 04:03:16,752] Trial 416 pruned. Trial was pruned at iteration 0.
[I 2023-12-21 04:03:16,804] Trial 417 pruned. Trial was pruned at iteration 1.
[I 2023-12-21 04:03:16,852] Trial 418 pruned. Trial was pruned at iteration 0.
[I 2023-12-21 04:03:16,901] Trial 419 pruned. Trial was pruned at iteration 0.
[I 2023-12-21 04:03:16,949] Trial 420 pruned. Trial was pruned at iteration 0.
[I 2023-12-21 04:03:16,997] Trial 421 pruned. Trial was pruned at iteration 0.
[I 2023-12-21 04:03:17,115] Trial 422 finished with value: inf and parameters: {'learning_rate': 0.8767942512940236, 'aft_loss_distributi                                                                     on': 'normal', 'aft_loss_distribution_scale': 1.1083308248800734, 'max_depth': 5, 'booster': 'gbtree', 'scale_pos_weight': 3.589361281466                                                                     7053, 'alpha': 5.268733431755005, 'lambda': 1.0318267701275687, 'eta': 0.8604784281599397, 'sampling_method': 'gradient_based', 'subsampl                                                                     e': 0.9317777877623973, 'gamma': 7.269715779638173}. Best is trial 84 with value: 4.259518710902867.
[I 2023-12-21 04:03:17,164] Trial 423 pruned. Trial was pruned at iteration 0.
[I 2023-12-21 04:03:17,215] Trial 424 pruned. Trial was pruned at iteration 1.
[I 2023-12-21 04:03:17,263] Trial 425 pruned. Trial was pruned at iteration 0.
[I 2023-12-21 04:03:17,313] Trial 426 pruned. Trial was pruned at iteration 0.
[I 2023-12-21 04:03:17,362] Trial 427 pruned. Trial was pruned at iteration 0.
[I 2023-12-21 04:03:17,411] Trial 428 pruned. Trial was pruned at iteration 0.
[I 2023-12-21 04:03:17,461] Trial 429 pruned. Trial was pruned at iteration 0.
[I 2023-12-21 04:03:17,509] Trial 430 pruned. Trial was pruned at iteration 0.
[I 2023-12-21 04:03:17,559] Trial 431 pruned. Trial was pruned at iteration 0.
[I 2023-12-21 04:03:17,608] Trial 432 pruned. Trial was pruned at iteration 0.
[I 2023-12-21 04:03:17,657] Trial 433 pruned. Trial was pruned at iteration 0.
[I 2023-12-21 04:03:17,706] Trial 434 pruned. Trial was pruned at iteration 0.
[I 2023-12-21 04:03:17,756] Trial 435 pruned. Trial was pruned at iteration 0.
[I 2023-12-21 04:03:17,805] Trial 436 pruned. Trial was pruned at iteration 0.
