[I 2023-12-21 02:32:11,394] Trial 350 pruned. Trial was pruned at iteration 0.
[I 2023-12-21 02:32:11,441] Trial 351 pruned. Trial was pruned at iteration 0.
[I 2023-12-21 02:32:11,490] Trial 352 pruned. Trial was pruned at iteration 0.
[I 2023-12-21 02:32:11,539] Trial 353 pruned. Trial was pruned at iteration 1.
[I 2023-12-21 02:32:11,586] Trial 354 pruned. Trial was pruned at iteration 0.
[I 2023-12-21 02:32:11,633] Trial 355 pruned. Trial was pruned at iteration 0.
[I 2023-12-21 02:32:11,683] Trial 356 pruned. Trial was pruned at iteration 0.
[I 2023-12-21 02:32:11,730] Trial 357 pruned. Trial was pruned at iteration 0.
[I 2023-12-21 02:32:11,777] Trial 358 pruned. Trial was pruned at iteration 0.
[I 2023-12-21 02:32:11,826] Trial 359 pruned. Trial was pruned at iteration 0.
[I 2023-12-21 02:32:11,875] Trial 360 pruned. Trial was pruned at iteration 1.
[I 2023-12-21 02:32:11,922] Trial 361 pruned. Trial was pruned at iteration 0.
[I 2023-12-21 02:32:11,971] Trial 362 pruned. Trial was pruned at iteration 0.
[I 2023-12-21 02:32:12,019] Trial 363 pruned. Trial was pruned at iteration 0.
[I 2023-12-21 02:32:12,066] Trial 364 pruned. Trial was pruned at iteration 0.
[I 2023-12-21 02:32:12,292] Trial 365 finished with value: 4.27843868553439 and parameters: {'learning_rate': 0.8033727825510811, 'aft_lo                                                                     ss_distribution': 'normal', 'aft_loss_distribution_scale': 1.209184761990864, 'max_depth': 9, 'booster': 'gbtree', 'scale_pos_weight': 6.                                                                     458141184126638, 'alpha': 8.353006378392017, 'lambda': 0.9638283048090631, 'eta': 0.2979004362533868, 'sampling_method': 'gradient_based'                                                                     , 'subsample': 0.8806179990737697, 'gamma': 9.459947959789007}. Best is trial 156 with value: 4.239607290306937.
[I 2023-12-21 02:32:12,342] Trial 366 pruned. Trial was pruned at iteration 0.
[I 2023-12-21 02:32:12,471] Trial 367 finished with value: inf and parameters: {'learning_rate': 0.8214399374653726, 'aft_loss_distributi                                                                     on': 'normal', 'aft_loss_distribution_scale': 1.2451763927108437, 'max_depth': 9, 'booster': 'gbtree', 'scale_pos_weight': 6.633102478664                                                                     389, 'alpha': 8.468714242224076, 'lambda': 0.941445185400642, 'eta': 0.3306249849241734, 'sampling_method': 'gradient_based', 'subsample'                                                                     : 0.7046932891351497, 'gamma': 9.620163966035808}. Best is trial 156 with value: 4.239607290306937.
[I 2023-12-21 02:32:12,519] Trial 368 pruned. Trial was pruned at iteration 0.
[I 2023-12-21 02:32:12,739] Trial 369 finished with value: 4.25566764850901 and parameters: {'learning_rate': 0.8128810583470449, 'aft_lo                                                                     ss_distribution': 'normal', 'aft_loss_distribution_scale': 1.010103178517837, 'max_depth': 6, 'booster': 'gbtree', 'scale_pos_weight': 4.                                                                     31438047774788, 'alpha': 8.273278657281189, 'lambda': 0.7225898090971659, 'eta': 0.2746154887035871, 'sampling_method': 'gradient_based',                                                                      'subsample': 0.8833611770539085, 'gamma': 9.780484575012867}. Best is trial 156 with value: 4.239607290306937.
[I 2023-12-21 02:32:12,865] Trial 370 finished with value: inf and parameters: {'learning_rate': 0.8201075654650829, 'aft_loss_distributi                                                                     on': 'normal', 'aft_loss_distribution_scale': 1.0077755809174382, 'max_depth': 6, 'booster': 'gbtree', 'scale_pos_weight': 5.250476919974                                                                     808, 'alpha': 8.265179722325978, 'lambda': 0.5341498330230663, 'eta': 0.2656988303499766, 'sampling_method': 'gradient_based', 'subsample                                                                     ': 0.8839145313942501, 'gamma': 9.49145830363729}. Best is trial 156 with value: 4.239607290306937.
[I 2023-12-21 02:32:12,914] Trial 371 pruned. Trial was pruned at iteration 0.
[I 2023-12-21 02:32:13,038] Trial 372 finished with value: inf and parameters: {'learning_rate': 0.7889308508769224, 'aft_loss_distributi                                                                     on': 'normal', 'aft_loss_distribution_scale': 1.017829693822686, 'max_depth': 6, 'booster': 'gbtree', 'scale_pos_weight': 6.4998053131890                                                                     32, 'alpha': 8.619496465555196, 'lambda': 0.4877005308882815, 'eta': 0.2523493733319182, 'sampling_method': 'gradient_based', 'subsample'                                                                     : 0.9387913147216679, 'gamma': 9.732287521834378}. Best is trial 156 with value: 4.239607290306937.
[I 2023-12-21 02:32:13,086] Trial 373 pruned. Trial was pruned at iteration 0.
[I 2023-12-21 02:32:13,136] Trial 374 pruned. Trial was pruned at iteration 0.
[I 2023-12-21 02:32:13,192] Trial 375 pruned. Trial was pruned at iteration 2.
[I 2023-12-21 02:32:13,240] Trial 376 pruned. Trial was pruned at iteration 0.
[I 2023-12-21 02:32:13,289] Trial 377 pruned. Trial was pruned at iteration 0.
[I 2023-12-21 02:32:13,339] Trial 378 pruned. Trial was pruned at iteration 1.
[I 2023-12-21 02:32:13,387] Trial 379 pruned. Trial was pruned at iteration 0.
[I 2023-12-21 02:32:13,437] Trial 380 pruned. Trial was pruned at iteration 1.
[I 2023-12-21 02:32:13,495] Trial 381 pruned. Trial was pruned at iteration 3.
[I 2023-12-21 02:32:13,661] Trial 382 finished with value: 4.2782462669398145 and parameters: {'learning_rate': 0.8461705317774985, 'aft_                                                                     loss_distribution': 'normal', 'aft_loss_distribution_scale': 1.252402016066661, 'max_depth': 7, 'booster': 'gbtree', 'scale_pos_weight':                                                                      6.789908635020798, 'alpha': 9.071364644926755, 'lambda': 2.201985789285633, 'eta': 0.44056547448592037, 'sampling_method': 'gradient_base                                                                     d', 'subsample': 0.9089693463944193, 'gamma': 7.966172595007373}. Best is trial 156 with value: 4.239607290306937.
[I 2023-12-21 02:32:13,784] Trial 383 finished with value: inf and parameters: {'learning_rate': 0.9273873155368811, 'aft_loss_distributi                                                                     on': 'normal', 'aft_loss_distribution_scale': 1.189948573952964, 'max_depth': 7, 'booster': 'gbtree', 'scale_pos_weight': 7.1188960471732                                                                     87, 'alpha': 9.110469054847291, 'lambda': 1.9920727625137358, 'eta': 0.4869119882877061, 'sampling_method': 'gradient_based', 'subsample'                                                                     : 0.9088366064357322, 'gamma': 8.409470167125868}. Best is trial 156 with value: 4.239607290306937.
[I 2023-12-21 02:32:13,833] Trial 384 pruned. Trial was pruned at iteration 0.
[I 2023-12-21 02:32:13,882] Trial 385 pruned. Trial was pruned at iteration 0.
[I 2023-12-21 02:32:14,111] Trial 386 finished with value: 4.259984240747039 and parameters: {'learning_rate': 0.8816147881564635, 'aft_l                                                                     oss_distribution': 'normal', 'aft_loss_distribution_scale': 1.0386971348388665, 'max_depth': 7, 'booster': 'gbtree', 'scale_pos_weight':                                                                      6.965986937288559, 'alpha': 9.931138910117939, 'lambda': 1.4537257903602876, 'eta': 0.4582561470115394, 'sampling_method': 'gradient_base                                                                     d', 'subsample': 0.955408446293626, 'gamma': 8.151473421990909}. Best is trial 156 with value: 4.239607290306937.
[I 2023-12-21 02:32:14,162] Trial 387 pruned. Trial was pruned at iteration 0.
[I 2023-12-21 02:32:14,317] Trial 388 finished with value: inf and parameters: {'learning_rate': 0.8900208447929888, 'aft_loss_distributi                                                                     on': 'normal', 'aft_loss_distribution_scale': 1.0716008154530734, 'max_depth': 7, 'booster': 'gbtree', 'scale_pos_weight': 6.724781883568                                                                     786, 'alpha': 9.711574731267875, 'lambda': 1.3410439824483456, 'eta': 0.4140799933610333, 'sampling_method': 'gradient_based', 'subsample                                                                     ': 0.955561109902746, 'gamma': 8.031821833317446}. Best is trial 156 with value: 4.239607290306937.
[I 2023-12-21 02:32:14,367] Trial 389 pruned. Trial was pruned at iteration 0.
[I 2023-12-21 02:32:14,420] Trial 390 pruned. Trial was pruned at iteration 2.
[I 2023-12-21 02:32:14,469] Trial 391 pruned. Trial was pruned at iteration 0.
[I 2023-12-21 02:32:14,596] Trial 392 finished with value: inf and parameters: {'learning_rate': 0.854349960534893, 'aft_loss_distributio                                                                     n': 'normal', 'aft_loss_distribution_scale': 0.9398896123936227, 'max_depth': 7, 'booster': 'gbtree', 'scale_pos_weight': 4.3926785868161                                                                     4, 'alpha': 9.750577757457691, 'lambda': 1.0022628165748857, 'eta': 0.25453138925272645, 'sampling_method': 'gradient_based', 'subsample'                                                                     : 0.9369818323457038, 'gamma': 8.287028822707573}. Best is trial 156 with value: 4.239607290306937.
[I 2023-12-21 02:32:14,646] Trial 393 pruned. Trial was pruned at iteration 0.
[I 2023-12-21 02:32:14,695] Trial 394 pruned. Trial was pruned at iteration 0.
[I 2023-12-21 02:32:14,873] Trial 395 finished with value: 4.266558904075094 and parameters: {'learning_rate': 0.842302189394984, 'aft_lo                                                                     ss_distribution': 'normal', 'aft_loss_distribution_scale': 1.157277708325073, 'max_depth': 7, 'booster': 'gbtree', 'scale_pos_weight': 4.                                                                     925904660034984, 'alpha': 9.465008895665589, 'lambda': 1.439056884806898, 'eta': 0.4660133816446714, 'sampling_method': 'gradient_based',                                                                      'subsample': 0.8974859445331194, 'gamma': 8.796091161412834}. Best is trial 156 with value: 4.239607290306937.
[I 2023-12-21 02:32:14,924] Trial 396 pruned. Trial was pruned at iteration 0.
[I 2023-12-21 02:32:15,054] Trial 397 finished with value: inf and parameters: {'learning_rate': 0.8239488186679574, 'aft_loss_distributi                                                                     on': 'normal', 'aft_loss_distribution_scale': 1.127119895905678, 'max_depth': 7, 'booster': 'gbtree', 'scale_pos_weight': 4.9578190510037                                                                     03, 'alpha': 9.587527706120381, 'lambda': 1.2206888335276955, 'eta': 0.4627349168987819, 'sampling_method': 'gradient_based', 'subsample'                                                                     : 0.8782648846731946, 'gamma': 8.629445351757708}. Best is trial 156 with value: 4.239607290306937.
[I 2023-12-21 02:32:15,104] Trial 398 pruned. Trial was pruned at iteration 0.
[I 2023-12-21 02:32:15,159] Trial 399 pruned. Trial was pruned at iteration 2.
[I 2023-12-21 02:32:15,210] Trial 400 pruned. Trial was pruned at iteration 0.
[I 2023-12-21 02:32:15,265] Trial 401 pruned. Trial was pruned at iteration 2.
[I 2023-12-21 02:32:15,460] Trial 402 finished with value: 4.268301876247743 and parameters: {'learning_rate': 0.7943230278469215, 'aft_l                                                                     oss_distribution': 'normal', 'aft_loss_distribution_scale': 1.1705004283324227, 'max_depth': 7, 'booster': 'gbtree', 'scale_pos_weight':                                                                      3.912587957904872, 'alpha': 9.538022262799982, 'lambda': 0.8913755365828704, 'eta': 0.43251804458192084, 'sampling_method': 'gradient_bas                                                                     ed', 'subsample': 0.919665719541953, 'gamma': 8.511184213697366}. Best is trial 156 with value: 4.239607290306937.
[I 2023-12-21 02:32:15,511] Trial 403 pruned. Trial was pruned at iteration 0.
[I 2023-12-21 02:32:15,639] Trial 404 finished with value: inf and parameters: {'learning_rate': 0.7824382148816763, 'aft_loss_distributi                                                                     on': 'normal', 'aft_loss_distribution_scale': 1.101070003115832, 'max_depth': 7, 'booster': 'gbtree', 'scale_pos_weight': 3.6160229122065                                                                     575, 'alpha': 9.541174684975214, 'lambda': 0.9242128994421055, 'eta': 0.4286396783532973, 'sampling_method': 'gradient_based', 'subsample                                                                     ': 0.9445943565255259, 'gamma': 8.529609233758164}. Best is trial 156 with value: 4.239607290306937.
[I 2023-12-21 02:32:15,777] Trial 405 finished with value: inf and parameters: {'learning_rate': 0.7980569172387081, 'aft_loss_distributi                                                                     on': 'normal', 'aft_loss_distribution_scale': 1.182334921117286, 'max_depth': 7, 'booster': 'gbtree', 'scale_pos_weight': 4.1703950363708                                                                     53, 'alpha': 9.586580407168553, 'lambda': 1.0669657466321956, 'eta': 0.20111542490715467, 'sampling_method': 'gradient_based', 'subsample                                                                     ': 0.9042624416301996, 'gamma': 8.620419150602768}. Best is trial 156 with value: 4.239607290306937.
[I 2023-12-21 02:32:15,830] Trial 406 pruned. Trial was pruned at iteration 1.
[I 2023-12-21 02:32:15,880] Trial 407 pruned. Trial was pruned at iteration 0.
[I 2023-12-21 02:32:16,020] Trial 408 finished with value: inf and parameters: {'learning_rate': 0.8379243153478894, 'aft_loss_distributi                                                                     on': 'normal', 'aft_loss_distribution_scale': 0.9508263195130511, 'max_depth': 7, 'booster': 'gbtree', 'scale_pos_weight': 3.695219083888                                                                     947, 'alpha': 9.447067724425297, 'lambda': 1.201161666143977, 'eta': 0.4735486364065397, 'sampling_method': 'gradient_based', 'subsample'                                                                     : 0.9457650381523476, 'gamma': 8.848441897073025}. Best is trial 156 with value: 4.239607290306937.
[I 2023-12-21 02:32:16,070] Trial 409 pruned. Trial was pruned at iteration 0.
[I 2023-12-21 02:32:16,200] Trial 410 finished with value: inf and parameters: {'learning_rate': 0.8663074627693842, 'aft_loss_distributi                                                                     on': 'normal', 'aft_loss_distribution_scale': 1.1187184162816382, 'max_depth': 7, 'booster': 'gbtree', 'scale_pos_weight': 4.618811154897                                                                     104, 'alpha': 9.2256687335079, 'lambda': 0.8346380204544064, 'eta': 0.1755323925574598, 'sampling_method': 'gradient_based', 'subsample':                                                                      0.8904810823709973, 'gamma': 8.784658977413875}. Best is trial 156 with value: 4.239607290306937.
[I 2023-12-21 02:32:16,253] Trial 411 pruned. Trial was pruned at iteration 1.
[I 2023-12-21 02:32:16,305] Trial 412 pruned. Trial was pruned at iteration 0.
[I 2023-12-21 02:32:16,356] Trial 413 pruned. Trial was pruned at iteration 1.
[I 2023-12-21 02:32:16,489] Trial 414 finished with value: inf and parameters: {'learning_rate': 0.8037069496029389, 'aft_loss_distributi                                                                     on': 'normal', 'aft_loss_distribution_scale': 1.0826734200452568, 'max_depth': 9, 'booster': 'gbtree', 'scale_pos_weight': 3.242093445886                                                                     366, 'alpha': 9.064494590479704, 'lambda': 1.6427232061948618, 'eta': 0.41930873481517117, 'sampling_method': 'gradient_based', 'subsampl                                                                     e': 0.883449741565777, 'gamma': 9.091907045826131}. Best is trial 156 with value: 4.239607290306937.
[I 2023-12-21 02:32:16,542] Trial 415 pruned. Trial was pruned at iteration 0.
[I 2023-12-21 02:32:16,593] Trial 416 pruned. Trial was pruned at iteration 1.
[I 2023-12-21 02:32:16,645] Trial 417 pruned. Trial was pruned at iteration 1.
[I 2023-12-21 02:32:16,696] Trial 418 pruned. Trial was pruned at iteration 0.
[I 2023-12-21 02:32:16,748] Trial 419 pruned. Trial was pruned at iteration 0.
[I 2023-12-21 02:32:16,799] Trial 420 pruned. Trial was pruned at iteration 1.
[I 2023-12-21 02:32:16,932] Trial 421 finished with value: inf and parameters: {'learning_rate': 0.9430641107630411, 'aft_loss_distributi                                                                     on': 'normal', 'aft_loss_distribution_scale': 0.8942497040928241, 'max_depth': 7, 'booster': 'gbtree', 'scale_pos_weight': 4.892005966554                                                                     084, 'alpha': 9.433608306730434, 'lambda': 1.0854861608688986, 'eta': 0.27903809099780336, 'sampling_method': 'gradient_based', 'subsampl                                                                     e': 0.8879860202174317, 'gamma': 8.803144000523337}. Best is trial 156 with value: 4.239607290306937.
[I 2023-12-21 02:32:16,982] Trial 422 pruned. Trial was pruned at iteration 0.
[I 2023-12-21 02:32:17,032] Trial 423 pruned. Trial was pruned at iteration 0.
[I 2023-12-21 02:32:17,082] Trial 424 pruned. Trial was pruned at iteration 0.
[I 2023-12-21 02:32:17,132] Trial 425 pruned. Trial was pruned at iteration 0.
[I 2023-12-21 02:32:17,186] Trial 426 pruned. Trial was pruned at iteration 0.
[I 2023-12-21 02:32:17,240] Trial 427 pruned. Trial was pruned at iteration 1.
[I 2023-12-21 02:32:17,291] Trial 428 pruned. Trial was pruned at iteration 0.
[I 2023-12-21 02:32:17,341] Trial 429 pruned. Trial was pruned at iteration 0.
[I 2023-12-21 02:32:17,391] Trial 430 pruned. Trial was pruned at iteration 0.
[I 2023-12-21 02:32:17,442] Trial 431 pruned. Trial was pruned at iteration 0.
[I 2023-12-21 02:32:17,495] Trial 432 pruned. Trial was pruned at iteration 0.
[I 2023-12-21 02:32:17,549] Trial 433 pruned. Trial was pruned at iteration 1.
[I 2023-12-21 02:32:17,601] Trial 434 pruned. Trial was pruned at iteration 0.
[I 2023-12-21 02:32:17,652] Trial 435 pruned. Trial was pruned at iteration 0.
[I 2023-12-21 02:32:17,703] Trial 436 pruned. Trial was pruned at iteration 0.
[I 2023-12-21 02:32:17,754] Trial 437 pruned. Trial was pruned at iteration 0.
[I 2023-12-21 02:32:17,898] Trial 438 finished with value: inf and parameters: {'learning_rate': 0.8801973660920163, 'aft_loss_distributi                                                                     on': 'normal', 'aft_loss_distribution_scale': 1.0415484261979961, 'max_depth': 9, 'booster': 'gbtree', 'scale_pos_weight': 6.033238506647                                                                     949, 'alpha': 9.702752047101855, 'lambda': 1.3292261698892087, 'eta': 0.5026427736556898, 'sampling_method': 'gradient_based', 'subsample                                                                     ': 0.9124625573491394, 'gamma': 2.9235703997046336}. Best is trial 156 with value: 4.239607290306937.
[I 2023-12-21 02:32:17,950] Trial 439 pruned. Trial was pruned at iteration 0.
[I 2023-12-21 02:32:18,126] Trial 440 finished with value: 4.266974819186955 and parameters: {'learning_rate': 0.8093676671688989, 'aft_l                                                                     oss_distribution': 'normal', 'aft_loss_distribution_scale': 1.1864750049008121, 'max_depth': 9, 'booster': 'gbtree', 'scale_pos_weight':                                                                      6.889507994758848, 'alpha': 8.806379771373795, 'lambda': 1.8299128230455477, 'eta': 0.8253360594965241, 'sampling_method': 'gradient_base                                                                     d', 'subsample': 0.942823077839426, 'gamma': 9.542886321461989}. Best is trial 156 with value: 4.239607290306937.
[I 2023-12-21 02:32:18,180] Trial 441 pruned. Trial was pruned at iteration 0.
[I 2023-12-21 02:32:18,235] Trial 442 pruned. Trial was pruned at iteration 2.
[I 2023-12-21 02:32:18,286] Trial 443 pruned. Trial was pruned at iteration 0.
[I 2023-12-21 02:32:18,340] Trial 444 pruned. Trial was pruned at iteration 0.
[I 2023-12-21 02:32:18,391] Trial 445 pruned. Trial was pruned at iteration 0.
[I 2023-12-21 02:32:18,524] Trial 446 finished with value: inf and parameters: {'learning_rate': 0.8306673199678879, 'aft_loss_distributi                                                                     on': 'normal', 'aft_loss_distribution_scale': 1.1233327507303321, 'max_depth': 7, 'booster': 'gbtree', 'scale_pos_weight': 7.908957491255                                                                     66, 'alpha': 9.499758376192553, 'lambda': 0.8763845656522952, 'eta': 0.8576586231833127, 'sampling_method': 'gradient_based', 'subsample'                                                                     : 0.9799871547335913, 'gamma': 8.298575409544782}. Best is trial 156 with value: 4.239607290306937.
