[I 2023-12-21 04:13:42,379] Trial 27 finished with value: inf and parameters: {'learning_rate': 0.626127552960391, 'aft_loss_distribution                                                                     ': 'logistic', 'aft_loss_distribution_scale': 1.852327107225888, 'max_depth': 9, 'booster': 'gbtree', 'scale_pos_weight': 2.4160263832610                                                                     19, 'alpha': 4.338752223742592, 'lambda': 7.056258969273595, 'eta': 0.5972832586499024, 'sampling_method': 'gradient_based', 'subsample':                                                                      0.5623047986855196, 'gamma': 4.384493088696695}. Best is trial 2 with value: 2.512526849083474.
[I 2023-12-21 04:13:43,941] Trial 28 finished with value: inf and parameters: {'learning_rate': 0.8782699647802199, 'aft_loss_distributio                                                                     n': 'normal', 'aft_loss_distribution_scale': 4.360519888985634, 'max_depth': 8, 'booster': 'dart', 'scale_pos_weight': 3.045404343400935,                                                                      'alpha': 8.913444143792232, 'lambda': 9.964620285092325, 'eta': 0.46135498531232444, 'sampling_method': 'uniform', 'subsample': 0.791268                                                                     4157749859, 'gamma': 6.203962063747284}. Best is trial 2 with value: 2.512526849083474.
[I 2023-12-21 04:13:43,973] Trial 29 pruned. Trial was pruned at iteration 0.
[I 2023-12-21 04:13:44,012] Trial 30 pruned. Trial was pruned at iteration 2.
[I 2023-12-21 04:13:44,045] Trial 31 pruned. Trial was pruned at iteration 0.
[I 2023-12-21 04:13:44,076] Trial 32 pruned. Trial was pruned at iteration 0.
[I 2023-12-21 04:13:44,108] Trial 33 pruned. Trial was pruned at iteration 0.
[I 2023-12-21 04:13:44,140] Trial 34 pruned. Trial was pruned at iteration 0.
[I 2023-12-21 04:13:44,174] Trial 35 pruned. Trial was pruned at iteration 1.
[I 2023-12-21 04:13:44,211] Trial 36 pruned. Trial was pruned at iteration 0.
[I 2023-12-21 04:13:44,248] Trial 37 pruned. Trial was pruned at iteration 1.
[I 2023-12-21 04:13:44,279] Trial 38 pruned. Trial was pruned at iteration 0.
[I 2023-12-21 04:13:44,311] Trial 39 pruned. Trial was pruned at iteration 0.
[I 2023-12-21 04:13:44,347] Trial 40 pruned. Trial was pruned at iteration 1.
[I 2023-12-21 04:13:44,379] Trial 41 pruned. Trial was pruned at iteration 0.
[I 2023-12-21 04:13:44,412] Trial 42 pruned. Trial was pruned at iteration 0.
[I 2023-12-21 04:13:44,452] Trial 43 pruned. Trial was pruned at iteration 1.
[I 2023-12-21 04:13:44,484] Trial 44 pruned. Trial was pruned at iteration 0.
[I 2023-12-21 04:13:44,517] Trial 45 pruned. Trial was pruned at iteration 0.
[I 2023-12-21 04:13:44,549] Trial 46 pruned. Trial was pruned at iteration 0.
[I 2023-12-21 04:13:44,585] Trial 47 pruned. Trial was pruned at iteration 1.
[I 2023-12-21 04:13:44,625] Trial 48 pruned. Trial was pruned at iteration 2.
[I 2023-12-21 04:13:44,659] Trial 49 pruned. Trial was pruned at iteration 0.
[I 2023-12-21 04:13:44,696] Trial 50 pruned. Trial was pruned at iteration 1.
[I 2023-12-21 04:13:44,856] Trial 51 finished with value: 2.177365823268507 and parameters: {'learning_rate': 0.765553444948303, 'aft_los                                                                     s_distribution': 'normal', 'aft_loss_distribution_scale': 3.2907834730711727, 'max_depth': 3, 'booster': 'gbtree', 'scale_pos_weight': 0.                                                                     07238464271428273, 'alpha': 9.811023198531684, 'lambda': 5.975016751193974, 'eta': 0.9214466850800562, 'sampling_method': 'uniform', 'sub                                                                     sample': 0.06206635387482165, 'gamma': 4.867885222952412}. Best is trial 51 with value: 2.177365823268507.
[I 2023-12-21 04:13:45,035] Trial 52 finished with value: 2.0906075739842906 and parameters: {'learning_rate': 0.7964409926695918, 'aft_l                                                                     oss_distribution': 'normal', 'aft_loss_distribution_scale': 2.3562017350941056, 'max_depth': 4, 'booster': 'gbtree', 'scale_pos_weight':                                                                      0.05319713467224644, 'alpha': 9.601848949369284, 'lambda': 4.975503445096881, 'eta': 0.998259121602822, 'sampling_method': 'uniform', 'su                                                                     bsample': 0.06203862699752598, 'gamma': 4.708599468878046}. Best is trial 52 with value: 2.0906075739842906.
[I 2023-12-21 04:13:45,068] Trial 53 pruned. Trial was pruned at iteration 0.
[I 2023-12-21 04:13:45,184] Trial 54 finished with value: inf and parameters: {'learning_rate': 0.8439044091308069, 'aft_loss_distributio                                                                     n': 'normal', 'aft_loss_distribution_scale': 2.2976469001974897, 'max_depth': 4, 'booster': 'gbtree', 'scale_pos_weight': 0.0395305676803                                                                     4724, 'alpha': 9.449402959796332, 'lambda': 5.9862543524028435, 'eta': 0.9911827930640793, 'sampling_method': 'uniform', 'subsample': 0.2                                                                     3280806230358067, 'gamma': 4.564573359849956}. Best is trial 52 with value: 2.0906075739842906.
[I 2023-12-21 04:13:45,406] Trial 55 finished with value: 2.1617954281972467 and parameters: {'learning_rate': 0.9544177943873368, 'aft_l                                                                     oss_distribution': 'normal', 'aft_loss_distribution_scale': 3.1663640536590236, 'max_depth': 3, 'booster': 'gbtree', 'scale_pos_weight':                                                                      0.43673160155112145, 'alpha': 9.105081938372823, 'lambda': 6.485382158570715, 'eta': 0.839880921397335, 'sampling_method': 'uniform', 'su                                                                     bsample': 0.1746327654254421, 'gamma': 5.525779189869594}. Best is trial 52 with value: 2.0906075739842906.
[I 2023-12-21 04:13:45,596] Trial 56 finished with value: 2.170755024243119 and parameters: {'learning_rate': 0.9198386122157255, 'aft_lo                                                                     ss_distribution': 'normal', 'aft_loss_distribution_scale': 3.265440165194619, 'max_depth': 3, 'booster': 'gbtree', 'scale_pos_weight': 0.                                                                     49851847998209947, 'alpha': 8.992879291486895, 'lambda': 5.198604190750776, 'eta': 0.8436967790745207, 'sampling_method': 'uniform', 'sub                                                                     sample': 0.17034649787230075, 'gamma': 5.569680739238031}. Best is trial 52 with value: 2.0906075739842906.
[I 2023-12-21 04:13:45,699] Trial 57 finished with value: inf and parameters: {'learning_rate': 0.9430924462567665, 'aft_loss_distributio                                                                     n': 'normal', 'aft_loss_distribution_scale': 2.826492922240601, 'max_depth': 3, 'booster': 'gbtree', 'scale_pos_weight': 0.47933813799225                                                                     344, 'alpha': 8.705405419772884, 'lambda': 5.034329220601265, 'eta': 0.8431345778963891, 'sampling_method': 'uniform', 'subsample': 0.166                                                                     17283890059598, 'gamma': 5.754133828337229}. Best is trial 52 with value: 2.0906075739842906.
[I 2023-12-21 04:13:45,828] Trial 58 finished with value: 2.1703137879671646 and parameters: {'learning_rate': 0.8969137695725057, 'aft_l                                                                     oss_distribution': 'normal', 'aft_loss_distribution_scale': 3.2284578985141086, 'max_depth': 3, 'booster': 'gbtree', 'scale_pos_weight':                                                                      0.28341714544645014, 'alpha': 8.029199613906727, 'lambda': 3.843391057261233, 'eta': 0.9385275271462107, 'sampling_method': 'uniform', 's                                                                     ubsample': 0.09369542030249828, 'gamma': 5.216643553692211}. Best is trial 52 with value: 2.0906075739842906.
[I 2023-12-21 04:13:45,955] Trial 59 finished with value: 2.1664681926797846 and parameters: {'learning_rate': 0.8867873181122801, 'aft_l                                                                     oss_distribution': 'normal', 'aft_loss_distribution_scale': 3.1865917080603197, 'max_depth': 3, 'booster': 'gbtree', 'scale_pos_weight':                                                                      0.34335363362272237, 'alpha': 9.259339842098806, 'lambda': 3.0590107984326225, 'eta': 0.8966920140331255, 'sampling_method': 'uniform', '                                                                     subsample': 0.09927784876203094, 'gamma': 5.219556208525502}. Best is trial 52 with value: 2.0906075739842906.
[I 2023-12-21 04:13:45,989] Trial 60 pruned. Trial was pruned at iteration 2.
[I 2023-12-21 04:13:46,024] Trial 61 pruned. Trial was pruned at iteration 0.
[I 2023-12-21 04:13:46,060] Trial 62 pruned. Trial was pruned at iteration 2.
[I 2023-12-21 04:13:46,093] Trial 63 pruned. Trial was pruned at iteration 0.
[I 2023-12-21 04:13:46,206] Trial 64 finished with value: inf and parameters: {'learning_rate': 0.8735866007774677, 'aft_loss_distributio                                                                     n': 'normal', 'aft_loss_distribution_scale': 2.6796321854100147, 'max_depth': 4, 'booster': 'gbtree', 'scale_pos_weight': 0.5677327433679                                                                     489, 'alpha': 9.194996643250546, 'lambda': 1.8468514282975033, 'eta': 0.7944627662238012, 'sampling_method': 'uniform', 'subsample': 0.03                                                                     41242317860759, 'gamma': 4.283929300424207}. Best is trial 52 with value: 2.0906075739842906.
[I 2023-12-21 04:13:46,238] Trial 65 pruned. Trial was pruned at iteration 0.
[I 2023-12-21 04:13:46,272] Trial 66 pruned. Trial was pruned at iteration 1.
[I 2023-12-21 04:13:46,305] Trial 67 pruned. Trial was pruned at iteration 0.
[I 2023-12-21 04:13:46,620] Trial 68 finished with value: 2.1556265777046373 and parameters: {'learning_rate': 0.8354959803307117, 'aft_l                                                                     oss_distribution': 'normal', 'aft_loss_distribution_scale': 3.1621440023915275, 'max_depth': 3, 'booster': 'gbtree', 'scale_pos_weight':                                                                      0.7401066499575325, 'alpha': 8.416849472232474, 'lambda': 5.320846203942176, 'eta': 0.7742622451054579, 'sampling_method': 'uniform', 'su                                                                     bsample': 0.26218346094924333, 'gamma': 5.8047653050038495}. Best is trial 52 with value: 2.0906075739842906.
[I 2023-12-21 04:13:46,742] Trial 69 finished with value: inf and parameters: {'learning_rate': 0.8343364811632168, 'aft_loss_distributio                                                                     n': 'normal', 'aft_loss_distribution_scale': 1.4872481575583014, 'max_depth': 3, 'booster': 'gbtree', 'scale_pos_weight': 0.9741101261434                                                                     768, 'alpha': 8.476386059142309, 'lambda': 5.4054650883982225, 'eta': 0.7900444034838491, 'sampling_method': 'uniform', 'subsample': 0.20                                                                     151194203324635, 'gamma': 6.410290479139201}. Best is trial 52 with value: 2.0906075739842906.
[I 2023-12-21 04:13:46,775] Trial 70 pruned. Trial was pruned at iteration 0.
[I 2023-12-21 04:13:46,810] Trial 71 pruned. Trial was pruned at iteration 1.
[I 2023-12-21 04:13:46,987] Trial 72 finished with value: 2.1107670121988003 and parameters: {'learning_rate': 0.9076452996538152, 'aft_l                                                                     oss_distribution': 'normal', 'aft_loss_distribution_scale': 2.6312965645603783, 'max_depth': 3, 'booster': 'gbtree', 'scale_pos_weight':                                                                      0.531754962131043, 'alpha': 8.237501364632104, 'lambda': 5.265800136286446, 'eta': 0.8617323468027428, 'sampling_method': 'uniform', 'sub                                                                     sample': 0.23538525717298903, 'gamma': 5.773000109949178}. Best is trial 52 with value: 2.0906075739842906.
[I 2023-12-21 04:13:47,095] Trial 73 finished with value: inf and parameters: {'learning_rate': 0.9049679361458912, 'aft_loss_distributio                                                                     n': 'normal', 'aft_loss_distribution_scale': 2.100426555526142, 'max_depth': 3, 'booster': 'gbtree', 'scale_pos_weight': 0.55924861641540                                                                     76, 'alpha': 8.210666780821198, 'lambda': 5.205613861684644, 'eta': 0.8728780607068082, 'sampling_method': 'uniform', 'subsample': 0.3261                                                                     801037905269, 'gamma': 5.626112380227519}. Best is trial 52 with value: 2.0906075739842906.
[I 2023-12-21 04:13:47,215] Trial 74 finished with value: inf and parameters: {'learning_rate': 0.9965881246211221, 'aft_loss_distributio                                                                     n': 'normal', 'aft_loss_distribution_scale': 2.63910227430753, 'max_depth': 3, 'booster': 'gbtree', 'scale_pos_weight': 0.509407449101373                                                                     8, 'alpha': 7.658700270261669, 'lambda': 4.294404710239919, 'eta': 0.8149253058444852, 'sampling_method': 'uniform', 'subsample': 0.02935                                                                     0594207844118, 'gamma': 5.832249654711684}. Best is trial 52 with value: 2.0906075739842906.
[I 2023-12-21 04:13:47,248] Trial 75 pruned. Trial was pruned at iteration 0.
[I 2023-12-21 04:13:47,381] Trial 76 finished with value: 2.0632968020001163 and parameters: {'learning_rate': 0.8247899517630631, 'aft_l                                                                     oss_distribution': 'normal', 'aft_loss_distribution_scale': 2.2041952537602962, 'max_depth': 3, 'booster': 'gbtree', 'scale_pos_weight':                                                                      0.11085574105668727, 'alpha': 8.855883759407428, 'lambda': 5.833497363125408, 'eta': 0.8404913700913007, 'sampling_method': 'uniform', 's                                                                     ubsample': 0.2224539297228233, 'gamma': 7.1613171843789}. Best is trial 76 with value: 2.0632968020001163.
[I 2023-12-21 04:13:47,415] Trial 77 pruned. Trial was pruned at iteration 0.
[I 2023-12-21 04:13:47,548] Trial 78 finished with value: 2.0683901710521306 and parameters: {'learning_rate': 0.8656154836990589, 'aft_l                                                                     oss_distribution': 'normal', 'aft_loss_distribution_scale': 2.2010591444827012, 'max_depth': 4, 'booster': 'gbtree', 'scale_pos_weight':                                                                      0.2537769397870956, 'alpha': 8.332605307075907, 'lambda': 4.757637770877147, 'eta': 0.8352754295455935, 'sampling_method': 'uniform', 'su                                                                     bsample': 0.2878351454170576, 'gamma': 6.981420752240743}. Best is trial 76 with value: 2.0632968020001163.
[I 2023-12-21 04:13:47,657] Trial 79 finished with value: inf and parameters: {'learning_rate': 0.8554346129605107, 'aft_loss_distributio                                                                     n': 'normal', 'aft_loss_distribution_scale': 2.1842401501906594, 'max_depth': 4, 'booster': 'gbtree', 'scale_pos_weight': 0.1877362045633                                                                     509, 'alpha': 8.502585597177587, 'lambda': 4.659919434090017, 'eta': 0.8615549770857438, 'sampling_method': 'uniform', 'subsample': 0.208                                                                     4071818977032, 'gamma': 6.874392439349713}. Best is trial 76 with value: 2.0632968020001163.
[I 2023-12-21 04:13:47,774] Trial 80 finished with value: inf and parameters: {'learning_rate': 0.9563263519529791, 'aft_loss_distributio                                                                     n': 'normal', 'aft_loss_distribution_scale': 2.468537452750005, 'max_depth': 4, 'booster': 'gbtree', 'scale_pos_weight': 0.28958644167935                                                                     71, 'alpha': 7.879966151272778, 'lambda': 3.6101955667267864, 'eta': 0.9663166627563287, 'sampling_method': 'uniform', 'subsample': 0.287                                                                     5402431099377, 'gamma': 7.1614399313832475}. Best is trial 76 with value: 2.0632968020001163.
[I 2023-12-21 04:13:47,893] Trial 81 finished with value: inf and parameters: {'learning_rate': 0.92364906387807, 'aft_loss_distribution'                                                                     : 'normal', 'aft_loss_distribution_scale': 1.4878880704050779, 'max_depth': 3, 'booster': 'gbtree', 'scale_pos_weight': 0.439625822832094                                                                     6, 'alpha': 8.678671804630458, 'lambda': 5.743729507156284, 'eta': 0.8189181389282206, 'sampling_method': 'uniform', 'subsample': 0.34073                                                                     718786058205, 'gamma': 6.076667272180379}. Best is trial 76 with value: 2.0632968020001163.
[I 2023-12-21 04:13:48,018] Trial 82 finished with value: inf and parameters: {'learning_rate': 0.8811088648529314, 'aft_loss_distributio                                                                     n': 'normal', 'aft_loss_distribution_scale': 1.9170758727908899, 'max_depth': 3, 'booster': 'gbtree', 'scale_pos_weight': 0.3282887519873                                                                     731, 'alpha': 8.331049385389926, 'lambda': 5.271185973510677, 'eta': 0.8751855713635032, 'sampling_method': 'uniform', 'subsample': 0.240                                                                     18638983892399, 'gamma': 5.3329914574636375}. Best is trial 76 with value: 2.0632968020001163.
[I 2023-12-21 04:13:48,051] Trial 83 pruned. Trial was pruned at iteration 0.
[I 2023-12-21 04:13:48,085] Trial 84 pruned. Trial was pruned at iteration 1.
[I 2023-12-21 04:13:48,118] Trial 85 pruned. Trial was pruned at iteration 0.
[I 2023-12-21 04:13:48,340] Trial 86 finished with value: 2.1236835695623197 and parameters: {'learning_rate': 0.8516554132035874, 'aft_l                                                                     oss_distribution': 'normal', 'aft_loss_distribution_scale': 2.8105077016529196, 'max_depth': 3, 'booster': 'gbtree', 'scale_pos_weight':                                                                      0.2327532854748104, 'alpha': 9.596640622913142, 'lambda': 4.026133804813502, 'eta': 0.7527314164067085, 'sampling_method': 'uniform', 'su                                                                     bsample': 0.2670129816275207, 'gamma': 6.309584984819605}. Best is trial 76 with value: 2.0632968020001163.
[I 2023-12-21 04:13:48,373] Trial 87 pruned. Trial was pruned at iteration 0.
[I 2023-12-21 04:13:48,407] Trial 88 pruned. Trial was pruned at iteration 0.
[I 2023-12-21 04:13:48,533] Trial 89 finished with value: inf and parameters: {'learning_rate': 0.8468762434075707, 'aft_loss_distributio                                                                     n': 'normal', 'aft_loss_distribution_scale': 2.4034242763144578, 'max_depth': 5, 'booster': 'gbtree', 'scale_pos_weight': 0.6160683755147                                                                     558, 'alpha': 8.618363388505824, 'lambda': 3.2547946898886746, 'eta': 0.7722589862424531, 'sampling_method': 'uniform', 'subsample': 0.30                                                                     444739674305327, 'gamma': 3.958169147792304}. Best is trial 76 with value: 2.0632968020001163.
[I 2023-12-21 04:13:48,567] Trial 90 pruned. Trial was pruned at iteration 0.
[I 2023-12-21 04:13:48,601] Trial 91 pruned. Trial was pruned at iteration 1.
[I 2023-12-21 04:13:48,634] Trial 92 pruned. Trial was pruned at iteration 0.
[I 2023-12-21 04:13:48,755] Trial 93 finished with value: inf and parameters: {'learning_rate': 0.9224114365825962, 'aft_loss_distributio                                                                     n': 'normal', 'aft_loss_distribution_scale': 2.7067862628430346, 'max_depth': 3, 'booster': 'gbtree', 'scale_pos_weight': 0.4780503549963                                                                     194, 'alpha': 9.822874246061764, 'lambda': 6.889550812440929, 'eta': 0.9304559410180409, 'sampling_method': 'uniform', 'subsample': 0.255                                                                     1364619526043, 'gamma': 5.991789400856547}. Best is trial 76 with value: 2.0632968020001163.
[I 2023-12-21 04:13:48,788] Trial 94 pruned. Trial was pruned at iteration 0.
[I 2023-12-21 04:13:48,822] Trial 95 pruned. Trial was pruned at iteration 0.
[I 2023-12-21 04:13:48,858] Trial 96 pruned. Trial was pruned at iteration 0.
[I 2023-12-21 04:13:48,894] Trial 97 pruned. Trial was pruned at iteration 1.
