[I 2023-12-21 04:00:50,108] Trial 151 finished with value: 4.290038663483417 and parameters: {'learning_rate': 0.7800401793864823, 'aft_l                                                                     oss_distribution': 'normal', 'aft_loss_distribution_scale': 1.3265092083144006, 'max_depth': 10, 'booster': 'dart', 'scale_pos_weight': 2                                                                     .8310080184755955, 'alpha': 7.729740767231364, 'lambda': 0.2832599687318198, 'eta': 0.4460999957053519, 'sampling_method': 'gradient_base                                                                     d', 'subsample': 0.7946612207666411, 'gamma': 3.681103570398852}. Best is trial 81 with value: 4.234078754776428.
[I 2023-12-21 04:00:52,303] Trial 152 finished with value: 4.293106443173348 and parameters: {'learning_rate': 0.7867460762310089, 'aft_l                                                                     oss_distribution': 'normal', 'aft_loss_distribution_scale': 1.31298230195263, 'max_depth': 10, 'booster': 'dart', 'scale_pos_weight': 3.4                                                                     151951742331077, 'alpha': 7.811300920396523, 'lambda': 0.3891144709987406, 'eta': 0.45674835232505295, 'sampling_method': 'gradient_based                                                                     ', 'subsample': 0.782635691311726, 'gamma': 4.02125704985497}. Best is trial 81 with value: 4.234078754776428.
[I 2023-12-21 04:00:56,086] Trial 153 finished with value: 4.261535489383049 and parameters: {'learning_rate': 0.7821832722062075, 'aft_l                                                                     oss_distribution': 'normal', 'aft_loss_distribution_scale': 1.0046600673835093, 'max_depth': 10, 'booster': 'dart', 'scale_pos_weight': 3                                                                     .009756127708046, 'alpha': 7.861220686405148, 'lambda': 0.3824302456317053, 'eta': 0.4573080015400857, 'sampling_method': 'gradient_based                                                                     ', 'subsample': 0.7877264121754975, 'gamma': 3.9903045579126224}. Best is trial 81 with value: 4.234078754776428.
[I 2023-12-21 04:00:57,104] Trial 154 finished with value: inf and parameters: {'learning_rate': 0.81040417883163, 'aft_loss_distribution                                                                     ': 'normal', 'aft_loss_distribution_scale': 0.9749854278238732, 'max_depth': 10, 'booster': 'dart', 'scale_pos_weight': 2.890193387698626                                                                     , 'alpha': 7.446250996101339, 'lambda': 0.5965632932751119, 'eta': 0.41706694802120864, 'sampling_method': 'gradient_based', 'subsample':                                                                      0.850946873648338, 'gamma': 3.848546033473385}. Best is trial 81 with value: 4.234078754776428.
[I 2023-12-21 04:00:57,141] Trial 155 pruned. Trial was pruned at iteration 0.
[I 2023-12-21 04:00:57,180] Trial 156 pruned. Trial was pruned at iteration 0.
[I 2023-12-21 04:00:57,224] Trial 157 pruned. Trial was pruned at iteration 1.
[I 2023-12-21 04:00:57,261] Trial 158 pruned. Trial was pruned at iteration 0.
[I 2023-12-21 04:00:57,383] Trial 159 finished with value: inf and parameters: {'learning_rate': 0.8957714423633739, 'aft_loss_distributi                                                                     on': 'normal', 'aft_loss_distribution_scale': 1.1527820618205182, 'max_depth': 10, 'booster': 'gbtree', 'scale_pos_weight': 2.04736681133                                                                     0948, 'alpha': 7.012957116936548, 'lambda': 1.156429030726281, 'eta': 0.5434962161257061, 'sampling_method': 'gradient_based', 'subsample                                                                     ': 0.8669949999748707, 'gamma': 4.1142238105386975}. Best is trial 81 with value: 4.234078754776428.
[I 2023-12-21 04:00:57,421] Trial 160 pruned. Trial was pruned at iteration 0.
[I 2023-12-21 04:00:59,362] Trial 161 finished with value: inf and parameters: {'learning_rate': 0.7829704816865889, 'aft_loss_distributi                                                                     on': 'normal', 'aft_loss_distribution_scale': 1.3183940821821873, 'max_depth': 10, 'booster': 'dart', 'scale_pos_weight': 3.2388591487343                                                                     09, 'alpha': 7.802924157899948, 'lambda': 0.5209478070210862, 'eta': 0.4530478520794683, 'sampling_method': 'gradient_based', 'subsample'                                                                     : 0.7921966652131288, 'gamma': 4.395621952716764}. Best is trial 81 with value: 4.234078754776428.
[I 2023-12-21 04:01:00,682] Trial 162 finished with value: inf and parameters: {'learning_rate': 0.8051521701974055, 'aft_loss_distributi                                                                     on': 'normal', 'aft_loss_distribution_scale': 1.0327274239894828, 'max_depth': 10, 'booster': 'dart', 'scale_pos_weight': 3.4897869637886                                                                     12, 'alpha': 7.593176753956918, 'lambda': 0.005185339283474255, 'eta': 0.45108090849228366, 'sampling_method': 'gradient_based', 'subsamp                                                                     le': 0.7811322851109687, 'gamma': 3.988383223792058}. Best is trial 81 with value: 4.234078754776428.
[I 2023-12-21 04:01:02,781] Trial 163 finished with value: 4.283988110631796 and parameters: {'learning_rate': 0.7753881348346086, 'aft_l                                                                     oss_distribution': 'normal', 'aft_loss_distribution_scale': 1.2636836905412652, 'max_depth': 10, 'booster': 'dart', 'scale_pos_weight': 2                                                                     .5653927656635367, 'alpha': 8.265143811078207, 'lambda': 0.25890791093985366, 'eta': 0.3010666009335027, 'sampling_method': 'gradient_bas                                                                     ed', 'subsample': 0.745001055582091, 'gamma': 3.6898341776283363}. Best is trial 81 with value: 4.234078754776428.
[I 2023-12-21 04:01:02,819] Trial 164 pruned. Trial was pruned at iteration 0.
[I 2023-12-21 04:01:02,859] Trial 165 pruned. Trial was pruned at iteration 1.
[I 2023-12-21 04:01:02,900] Trial 166 pruned. Trial was pruned at iteration 1.
[I 2023-12-21 04:01:02,939] Trial 167 pruned. Trial was pruned at iteration 1.
[I 2023-12-21 04:01:04,080] Trial 168 finished with value: inf and parameters: {'learning_rate': 0.8162221063382661, 'aft_loss_distributi                                                                     on': 'normal', 'aft_loss_distribution_scale': 1.1418545823414166, 'max_depth': 7, 'booster': 'dart', 'scale_pos_weight': 2.59761992973946                                                                     75, 'alpha': 6.855656440755182, 'lambda': 0.23467430969180075, 'eta': 0.2976194741869728, 'sampling_method': 'gradient_based', 'subsample                                                                     ': 0.8053868005494088, 'gamma': 2.5208392542227624}. Best is trial 81 with value: 4.234078754776428.
[I 2023-12-21 04:01:04,121] Trial 169 pruned. Trial was pruned at iteration 0.
[I 2023-12-21 04:01:04,250] Trial 170 finished with value: inf and parameters: {'learning_rate': 0.7751523550491842, 'aft_loss_distributi                                                                     on': 'normal', 'aft_loss_distribution_scale': 1.3006920278399132, 'max_depth': 9, 'booster': 'gbtree', 'scale_pos_weight': 1.579878646820                                                                     0898, 'alpha': 8.776202063110322, 'lambda': 0.9064060189157558, 'eta': 0.39216733169830487, 'sampling_method': 'gradient_based', 'subsamp                                                                     le': 0.9769386306083945, 'gamma': 3.5778549504168344}. Best is trial 81 with value: 4.234078754776428.
[I 2023-12-21 04:01:05,711] Trial 171 finished with value: inf and parameters: {'learning_rate': 0.7948740881412636, 'aft_loss_distributi                                                                     on': 'normal', 'aft_loss_distribution_scale': 1.3027763619643953, 'max_depth': 10, 'booster': 'dart', 'scale_pos_weight': 2.8301531752935                                                                     74, 'alpha': 7.786836785268637, 'lambda': 0.42932931320193335, 'eta': 0.4707133703836024, 'sampling_method': 'gradient_based', 'subsample                                                                     ': 0.7793052069437454, 'gamma': 4.057472559188812}. Best is trial 81 with value: 4.234078754776428.
[I 2023-12-21 04:01:05,748] Trial 172 pruned. Trial was pruned at iteration 0.
[I 2023-12-21 04:01:07,277] Trial 173 finished with value: inf and parameters: {'learning_rate': 0.7854511944266489, 'aft_loss_distributi                                                                     on': 'normal', 'aft_loss_distribution_scale': 1.13617418702135, 'max_depth': 10, 'booster': 'dart', 'scale_pos_weight': 3.417139044120391                                                                     , 'alpha': 7.891813479034607, 'lambda': 0.5020053081364166, 'eta': 0.44631292537925077, 'sampling_method': 'gradient_based', 'subsample':                                                                      0.785467083985436, 'gamma': 3.91695602792906}. Best is trial 81 with value: 4.234078754776428.
[I 2023-12-21 04:01:07,321] Trial 174 pruned. Trial was pruned at iteration 1.
[I 2023-12-21 04:01:07,362] Trial 175 pruned. Trial was pruned at iteration 1.
[I 2023-12-21 04:01:07,401] Trial 176 pruned. Trial was pruned at iteration 0.
[I 2023-12-21 04:01:07,439] Trial 177 pruned. Trial was pruned at iteration 0.
[I 2023-12-21 04:01:09,061] Trial 178 finished with value: inf and parameters: {'learning_rate': 0.7889697170623106, 'aft_loss_distributi                                                                     on': 'normal', 'aft_loss_distribution_scale': 1.0867023921611312, 'max_depth': 5, 'booster': 'dart', 'scale_pos_weight': 1.37088456765693                                                                     23, 'alpha': 7.048558957858795, 'lambda': 0.6457362372511326, 'eta': 0.4752516922620534, 'sampling_method': 'gradient_based', 'subsample'                                                                     : 0.8561781218311871, 'gamma': 2.7095170872060104}. Best is trial 81 with value: 4.234078754776428.
[I 2023-12-21 04:01:09,099] Trial 179 pruned. Trial was pruned at iteration 0.
[I 2023-12-21 04:01:09,140] Trial 180 pruned. Trial was pruned at iteration 1.
[I 2023-12-21 04:01:09,182] Trial 181 pruned. Trial was pruned at iteration 1.
[I 2023-12-21 04:01:09,220] Trial 182 pruned. Trial was pruned at iteration 0.
[I 2023-12-21 04:01:09,258] Trial 183 pruned. Trial was pruned at iteration 0.
[I 2023-12-21 04:01:09,298] Trial 184 pruned. Trial was pruned at iteration 0.
[I 2023-12-21 04:01:09,339] Trial 185 pruned. Trial was pruned at iteration 1.
[I 2023-12-21 04:01:09,377] Trial 186 pruned. Trial was pruned at iteration 1.
[I 2023-12-21 04:01:11,321] Trial 187 finished with value: inf and parameters: {'learning_rate': 0.8031958321385788, 'aft_loss_distributi                                                                     on': 'normal', 'aft_loss_distribution_scale': 1.1929744620372253, 'max_depth': 9, 'booster': 'dart', 'scale_pos_weight': 0.51249984669405                                                                     87, 'alpha': 7.652009741397379, 'lambda': 6.983323361756234, 'eta': 0.4620404107298677, 'sampling_method': 'gradient_based', 'subsample':                                                                      0.7899158789953445, 'gamma': 2.923444888427542}. Best is trial 81 with value: 4.234078754776428.
[I 2023-12-21 04:01:11,361] Trial 188 pruned. Trial was pruned at iteration 0.
[I 2023-12-21 04:01:11,399] Trial 189 pruned. Trial was pruned at iteration 0.
[I 2023-12-21 04:01:11,437] Trial 190 pruned. Trial was pruned at iteration 0.
[I 2023-12-21 04:01:18,262] Trial 191 finished with value: 4.278335401431795 and parameters: {'learning_rate': 0.8368550078483767, 'aft_l                                                                     oss_distribution': 'normal', 'aft_loss_distribution_scale': 1.2346388355636675, 'max_depth': 10, 'booster': 'dart', 'scale_pos_weight': 2                                                                     .5853428932073217, 'alpha': 8.050794668706217, 'lambda': 0.451772700504973, 'eta': 0.4376847892175894, 'sampling_method': 'gradient_based                                                                     ', 'subsample': 0.8057045223663126, 'gamma': 3.7120191088718406}. Best is trial 81 with value: 4.234078754776428.
[I 2023-12-21 04:01:19,506] Trial 192 finished with value: inf and parameters: {'learning_rate': 0.8750384428164183, 'aft_loss_distributi                                                                     on': 'normal', 'aft_loss_distribution_scale': 1.2293013074908634, 'max_depth': 10, 'booster': 'dart', 'scale_pos_weight': 2.6274747933331                                                                     875, 'alpha': 7.3458842774195485, 'lambda': 7.6011270053084194, 'eta': 0.4285895886577353, 'sampling_method': 'gradient_based', 'subsampl                                                                     e': 0.802951486858883, 'gamma': 3.7648019043262546}. Best is trial 81 with value: 4.234078754776428.
[I 2023-12-21 04:01:20,492] Trial 193 finished with value: inf and parameters: {'learning_rate': 0.8340193813944351, 'aft_loss_distributi                                                                     on': 'normal', 'aft_loss_distribution_scale': 1.0026120582700664, 'max_depth': 10, 'booster': 'dart', 'scale_pos_weight': 1.6409070051138                                                                     788, 'alpha': 8.025896992603393, 'lambda': 0.5609073134879397, 'eta': 0.4805086773625908, 'sampling_method': 'gradient_based', 'subsample                                                                     ': 0.8172705974384508, 'gamma': 3.5056588482665996}. Best is trial 81 with value: 4.234078754776428.
[I 2023-12-21 04:01:20,534] Trial 194 pruned. Trial was pruned at iteration 1.
[I 2023-12-21 04:01:20,573] Trial 195 pruned. Trial was pruned at iteration 0.
[I 2023-12-21 04:01:20,688] Trial 196 finished with value: inf and parameters: {'learning_rate': 0.7771585434830485, 'aft_loss_distributi                                                                     on': 'normal', 'aft_loss_distribution_scale': 1.275410458382518, 'max_depth': 9, 'booster': 'gbtree', 'scale_pos_weight': 2.8891205213314                                                                     1, 'alpha': 5.43876553034849, 'lambda': 0.20209823354314416, 'eta': 0.37753826074655744, 'sampling_method': 'gradient_based', 'subsample'                                                                     : 0.8220202496375317, 'gamma': 3.3741642803913963}. Best is trial 81 with value: 4.234078754776428.
[I 2023-12-21 04:01:20,727] Trial 197 pruned. Trial was pruned at iteration 0.
[I 2023-12-21 04:01:20,915] Trial 198 finished with value: 4.264107266104724 and parameters: {'learning_rate': 0.7946987508080909, 'aft_l                                                                     oss_distribution': 'normal', 'aft_loss_distribution_scale': 1.109999322736587, 'max_depth': 10, 'booster': 'gbtree', 'scale_pos_weight':                                                                      0.7516402736129852, 'alpha': 7.189522782806187, 'lambda': 1.307426507948703, 'eta': 0.40477379079683334, 'sampling_method': 'gradient_bas                                                                     ed', 'subsample': 0.9042460295556275, 'gamma': 4.196925171128032}. Best is trial 81 with value: 4.234078754776428.
[I 2023-12-21 04:01:20,953] Trial 199 pruned. Trial was pruned at iteration 0.
[I 2023-12-21 04:01:20,990] Trial 200 pruned. Trial was pruned at iteration 0.
[I 2023-12-21 04:01:21,153] Trial 201 finished with value: 4.26647049586999 and parameters: {'learning_rate': 0.7548064313367964, 'aft_lo                                                                     ss_distribution': 'normal', 'aft_loss_distribution_scale': 1.1719097931092888, 'max_depth': 10, 'booster': 'gbtree', 'scale_pos_weight':                                                                      0.7225265269254987, 'alpha': 7.4711163374720435, 'lambda': 1.4570855300277346, 'eta': 0.4376411368580785, 'sampling_method': 'gradient_ba                                                                     sed', 'subsample': 0.9567183433650002, 'gamma': 4.007165296538381}. Best is trial 81 with value: 4.234078754776428.
[I 2023-12-21 04:01:21,191] Trial 202 pruned. Trial was pruned at iteration 0.
[I 2023-12-21 04:01:21,228] Trial 203 pruned. Trial was pruned at iteration 0.
[I 2023-12-21 04:01:21,405] Trial 204 finished with value: 4.25800199702305 and parameters: {'learning_rate': 0.7785258927541737, 'aft_lo                                                                     ss_distribution': 'normal', 'aft_loss_distribution_scale': 1.144310082034267, 'max_depth': 10, 'booster': 'gbtree', 'scale_pos_weight': 1                                                                     .223065838618826, 'alpha': 6.935344693079426, 'lambda': 1.0722031793669604, 'eta': 0.3991112145914208, 'sampling_method': 'gradient_based                                                                     ', 'subsample': 0.9084322797144561, 'gamma': 3.9437641233713157}. Best is trial 81 with value: 4.234078754776428.
[I 2023-12-21 04:01:21,445] Trial 205 pruned. Trial was pruned at iteration 0.
[I 2023-12-21 04:01:21,485] Trial 206 pruned. Trial was pruned at iteration 0.
[I 2023-12-21 04:01:21,524] Trial 207 pruned. Trial was pruned at iteration 1.
[I 2023-12-21 04:01:21,562] Trial 208 pruned. Trial was pruned at iteration 0.
[I 2023-12-21 04:01:21,600] Trial 209 pruned. Trial was pruned at iteration 0.
[I 2023-12-21 04:01:21,639] Trial 210 pruned. Trial was pruned at iteration 0.
[I 2023-12-21 04:01:21,680] Trial 211 pruned. Trial was pruned at iteration 1.
[I 2023-12-21 04:01:21,828] Trial 212 finished with value: 4.2642017014909115 and parameters: {'learning_rate': 0.7910977759557333, 'aft_                                                                     loss_distribution': 'normal', 'aft_loss_distribution_scale': 1.1637607510738333, 'max_depth': 10, 'booster': 'gbtree', 'scale_pos_weight'                                                                     : 1.9771709451741226, 'alpha': 6.8799830486214075, 'lambda': 0.3240220532596252, 'eta': 0.45489440984351986, 'sampling_method': 'gradient                                                                     _based', 'subsample': 0.9745106153219245, 'gamma': 4.080528213263005}. Best is trial 81 with value: 4.234078754776428.
[I 2023-12-21 04:01:21,977] Trial 213 finished with value: 4.250258055137414 and parameters: {'learning_rate': 0.8585511940046644, 'aft_l                                                                     oss_distribution': 'normal', 'aft_loss_distribution_scale': 1.1431082165974458, 'max_depth': 10, 'booster': 'gbtree', 'scale_pos_weight':                                                                      2.2503179960067836, 'alpha': 6.793622801994147, 'lambda': 0.5086279632554725, 'eta': 0.4151565453642234, 'sampling_method': 'gradient_ba                                                                     sed', 'subsample': 0.9659218503542624, 'gamma': 4.343382737805891}. Best is trial 81 with value: 4.234078754776428.
[I 2023-12-21 04:01:22,131] Trial 214 finished with value: 4.245385121864559 and parameters: {'learning_rate': 0.8724465753852529, 'aft_l                                                                     oss_distribution': 'normal', 'aft_loss_distribution_scale': 1.0927552840451376, 'max_depth': 10, 'booster': 'gbtree', 'scale_pos_weight':                                                                      1.999426706037761, 'alpha': 6.820545983989613, 'lambda': 0.21832119443425418, 'eta': 0.4145860616061945, 'sampling_method': 'gradient_ba                                                                     sed', 'subsample': 0.9686136521120207, 'gamma': 4.416491834906638}. Best is trial 81 with value: 4.234078754776428.
[I 2023-12-21 04:01:22,243] Trial 215 finished with value: inf and parameters: {'learning_rate': 0.8953449679196168, 'aft_loss_distributi                                                                     on': 'normal', 'aft_loss_distribution_scale': 1.0558580141081926, 'max_depth': 10, 'booster': 'gbtree', 'scale_pos_weight': 2.11700172254                                                                     93676, 'alpha': 6.700251278626928, 'lambda': 0.514391368223653, 'eta': 0.41095947210020806, 'sampling_method': 'gradient_based', 'subsamp                                                                     le': 0.9741897164224357, 'gamma': 4.442951958383458}. Best is trial 81 with value: 4.234078754776428.
[I 2023-12-21 04:01:22,353] Trial 216 finished with value: inf and parameters: {'learning_rate': 0.8644448247765887, 'aft_loss_distributi                                                                     on': 'normal', 'aft_loss_distribution_scale': 0.9345725198224766, 'max_depth': 10, 'booster': 'gbtree', 'scale_pos_weight': 1.93936437480                                                                     94553, 'alpha': 6.33439314313833, 'lambda': 2.0566188931110454, 'eta': 0.3860184329455052, 'sampling_method': 'gradient_based', 'subsampl                                                                     e': 0.9866309384795897, 'gamma': 4.380583352369747}. Best is trial 81 with value: 4.234078754776428.
