[I 2023-12-21 02:34:18,709] Trial 58 pruned. Trial was pruned at iteration 0.
[I 2023-12-21 02:34:18,745] Trial 59 pruned. Trial was pruned at iteration 0.
[I 2023-12-21 02:34:18,778] Trial 60 pruned. Trial was pruned at iteration 0.
[I 2023-12-21 02:34:19,187] Trial 61 finished with value: 4.590958380548647 and parameters: {'learning_rate': 0.32411997185520725, 'aft_l                                                                     oss_distribution': 'logistic', 'aft_loss_distribution_scale': 1.3357548704356927, 'max_depth': 10, 'booster': 'gbtree', 'scale_pos_weight                                                                     ': 4.484106753647536, 'alpha': 9.239032381796187, 'lambda': 6.428316582495716, 'eta': 0.44101097258558575, 'sampling_method': 'uniform',                                                                      'subsample': 0.7429778017868436, 'gamma': 6.430857054803556}. Best is trial 39 with value: 4.394413518676669.
[I 2023-12-21 02:34:19,221] Trial 62 pruned. Trial was pruned at iteration 0.
[I 2023-12-21 02:34:19,363] Trial 63 finished with value: 4.613005683875793 and parameters: {'learning_rate': 0.2696654862554022, 'aft_lo                                                                     ss_distribution': 'logistic', 'aft_loss_distribution_scale': 1.3749360430392885, 'max_depth': 10, 'booster': 'gbtree', 'scale_pos_weight'                                                                     : 3.765278472568437, 'alpha': 9.542245842144123, 'lambda': 5.724769188581637, 'eta': 0.3722793955806573, 'sampling_method': 'uniform', 's                                                                     ubsample': 0.8180072280465529, 'gamma': 6.60282709403588}. Best is trial 39 with value: 4.394413518676669.
[I 2023-12-21 02:34:19,563] Trial 64 finished with value: 4.614913815854216 and parameters: {'learning_rate': 0.27439961347234726, 'aft_l                                                                     oss_distribution': 'logistic', 'aft_loss_distribution_scale': 1.3817899670246951, 'max_depth': 10, 'booster': 'gbtree', 'scale_pos_weight                                                                     ': 4.998392599958633, 'alpha': 9.809213150649217, 'lambda': 5.976965759118992, 'eta': 0.37123469004954746, 'sampling_method': 'uniform',                                                                      'subsample': 0.8788901170146881, 'gamma': 3.967118834315655}. Best is trial 39 with value: 4.394413518676669.
[I 2023-12-21 02:34:19,712] Trial 65 finished with value: 4.45126001677951 and parameters: {'learning_rate': 0.3026581630346638, 'aft_los                                                                     s_distribution': 'logistic', 'aft_loss_distribution_scale': 1.088121333285711, 'max_depth': 10, 'booster': 'gbtree', 'scale_pos_weight':                                                                      5.765407538495782, 'alpha': 9.377385260281962, 'lambda': 5.4951366726388, 'eta': 0.4493656767388652, 'sampling_method': 'uniform', 'subsa                                                                     mple': 0.681130592073412, 'gamma': 4.763546608073862}. Best is trial 39 with value: 4.394413518676669.
[I 2023-12-21 02:34:19,753] Trial 66 pruned. Trial was pruned at iteration 0.
[I 2023-12-21 02:34:19,788] Trial 67 pruned. Trial was pruned at iteration 0.
[I 2023-12-21 02:34:19,829] Trial 68 pruned. Trial was pruned at iteration 0.
[I 2023-12-21 02:34:19,863] Trial 69 pruned. Trial was pruned at iteration 0.
[I 2023-12-21 02:34:19,899] Trial 70 pruned. Trial was pruned at iteration 0.
[I 2023-12-21 02:34:20,318] Trial 71 finished with value: inf and parameters: {'learning_rate': 0.25011534399254254, 'aft_loss_distributi                                                                     on': 'logistic', 'aft_loss_distribution_scale': 1.14084764340342, 'max_depth': 10, 'booster': 'gbtree', 'scale_pos_weight': 3.74468980726                                                                     774, 'alpha': 9.538052681939591, 'lambda': 5.718883675222213, 'eta': 0.5296048276505975, 'sampling_method': 'uniform', 'subsample': 0.783                                                                     8218653331708, 'gamma': 0.01178325811526637}. Best is trial 39 with value: 4.394413518676669.
[I 2023-12-21 02:34:20,360] Trial 72 pruned. Trial was pruned at iteration 0.
[I 2023-12-21 02:34:20,395] Trial 73 pruned. Trial was pruned at iteration 1.
[I 2023-12-21 02:34:20,430] Trial 74 pruned. Trial was pruned at iteration 0.
[I 2023-12-21 02:34:20,471] Trial 75 pruned. Trial was pruned at iteration 0.
[I 2023-12-21 02:34:20,507] Trial 76 pruned. Trial was pruned at iteration 0.
[I 2023-12-21 02:34:20,548] Trial 77 pruned. Trial was pruned at iteration 0.
[I 2023-12-21 02:34:20,582] Trial 78 pruned. Trial was pruned at iteration 0.
[I 2023-12-21 02:34:20,616] Trial 79 pruned. Trial was pruned at iteration 0.
[I 2023-12-21 02:34:20,650] Trial 80 pruned. Trial was pruned at iteration 0.
[I 2023-12-21 02:34:20,685] Trial 81 pruned. Trial was pruned at iteration 1.
[I 2023-12-21 02:34:20,813] Trial 82 finished with value: inf and parameters: {'learning_rate': 0.33463068152314907, 'aft_loss_distributi                                                                     on': 'logistic', 'aft_loss_distribution_scale': 1.1848781770188967, 'max_depth': 10, 'booster': 'gbtree', 'scale_pos_weight': 4.220006488                                                                     254165, 'alpha': 9.141907460963887, 'lambda': 5.956737718902293, 'eta': 0.44040751896193225, 'sampling_method': 'uniform', 'subsample': 0                                                                     .8983504872591946, 'gamma': 3.735595160191637}. Best is trial 39 with value: 4.394413518676669.
[I 2023-12-21 02:34:20,848] Trial 83 pruned. Trial was pruned at iteration 0.
[I 2023-12-21 02:34:20,883] Trial 84 pruned. Trial was pruned at iteration 0.
[I 2023-12-21 02:34:20,916] Trial 85 pruned. Trial was pruned at iteration 0.
[I 2023-12-21 02:34:20,958] Trial 86 pruned. Trial was pruned at iteration 0.
[I 2023-12-21 02:34:20,992] Trial 87 pruned. Trial was pruned at iteration 0.
[I 2023-12-21 02:34:21,026] Trial 88 pruned. Trial was pruned at iteration 0.
[I 2023-12-21 02:34:21,062] Trial 89 pruned. Trial was pruned at iteration 0.
[I 2023-12-21 02:34:21,096] Trial 90 pruned. Trial was pruned at iteration 0.
[I 2023-12-21 02:34:21,131] Trial 91 pruned. Trial was pruned at iteration 1.
[I 2023-12-21 02:34:21,306] Trial 92 finished with value: inf and parameters: {'learning_rate': 0.8899474091097803, 'aft_loss_distributio                                                                     n': 'normal', 'aft_loss_distribution_scale': 0.7024258941322491, 'max_depth': 8, 'booster': 'gbtree', 'scale_pos_weight': 1.4539892303212                                                                     69, 'alpha': 9.030023245320839, 'lambda': 0.9321170759102566, 'eta': 0.6863857751261502, 'sampling_method': 'gradient_based', 'subsample'                                                                     : 0.839483534734333, 'gamma': 6.550199886334613}. Best is trial 39 with value: 4.394413518676669.
[I 2023-12-21 02:34:21,340] Trial 93 pruned. Trial was pruned at iteration 0.
[I 2023-12-21 02:34:21,374] Trial 94 pruned. Trial was pruned at iteration 0.
[I 2023-12-21 02:34:21,408] Trial 95 pruned. Trial was pruned at iteration 0.
[I 2023-12-21 02:34:21,448] Trial 96 pruned. Trial was pruned at iteration 0.
[I 2023-12-21 02:34:21,490] Trial 97 pruned. Trial was pruned at iteration 0.
[I 2023-12-21 02:34:21,524] Trial 98 pruned. Trial was pruned at iteration 0.
[I 2023-12-21 02:34:21,563] Trial 99 pruned. Trial was pruned at iteration 2.
[I 2023-12-21 02:34:21,601] Trial 100 pruned. Trial was pruned at iteration 1.
[I 2023-12-21 02:34:21,639] Trial 101 pruned. Trial was pruned at iteration 2.
[I 2023-12-21 02:34:22,119] Trial 102 finished with value: 4.48099153985481 and parameters: {'learning_rate': 0.3063676739809451, 'aft_lo                                                                     ss_distribution': 'logistic', 'aft_loss_distribution_scale': 1.1414557275044313, 'max_depth': 10, 'booster': 'gbtree', 'scale_pos_weight'                                                                     : 4.621701591634328, 'alpha': 8.277217338361517, 'lambda': 7.254370380685518, 'eta': 0.9309820382031592, 'sampling_method': 'uniform', 's                                                                     ubsample': 0.793229762380984, 'gamma': 5.4429676707296135}. Best is trial 39 with value: 4.394413518676669.
[I 2023-12-21 02:34:22,301] Trial 103 finished with value: 4.4822751910191565 and parameters: {'learning_rate': 0.2856228019162905, 'aft_                                                                     loss_distribution': 'logistic', 'aft_loss_distribution_scale': 1.1427310158571842, 'max_depth': 10, 'booster': 'gbtree', 'scale_pos_weigh                                                                     t': 4.576148846401696, 'alpha': 8.295303725543528, 'lambda': 7.462301663877283, 'eta': 0.865648340364764, 'sampling_method': 'uniform', '                                                                     subsample': 0.8659160490107827, 'gamma': 5.975937694622215}. Best is trial 39 with value: 4.394413518676669.
[I 2023-12-21 02:34:22,351] Trial 104 pruned. Trial was pruned at iteration 0.
[I 2023-12-21 02:34:22,550] Trial 105 finished with value: 4.47328363189289 and parameters: {'learning_rate': 0.29391060292400084, 'aft_l                                                                     oss_distribution': 'logistic', 'aft_loss_distribution_scale': 1.125680345128344, 'max_depth': 10, 'booster': 'gbtree', 'scale_pos_weight'                                                                     : 4.51585151174846, 'alpha': 8.142968879370137, 'lambda': 7.375649524374973, 'eta': 0.8768384413736456, 'sampling_method': 'uniform', 'su                                                                     bsample': 0.9539034700171214, 'gamma': 5.562144423414964}. Best is trial 39 with value: 4.394413518676669.
[I 2023-12-21 02:34:22,595] Trial 106 pruned. Trial was pruned at iteration 0.
[I 2023-12-21 02:34:53,266] Trial 107 finished with value: 4.433050569686268 and parameters: {'learning_rate': 0.31155278942788045, 'aft_                                                                     loss_distribution': 'logistic', 'aft_loss_distribution_scale': 1.0562821554744513, 'max_depth': 10, 'booster': 'dart', 'scale_pos_weight'                                                                     : 4.821173676094191, 'alpha': 7.832974349762233, 'lambda': 8.123351966621295, 'eta': 0.9051836918711209, 'sampling_method': 'uniform', 's                                                                     ubsample': 0.9990779847606466, 'gamma': 5.951981077352997}. Best is trial 39 with value: 4.394413518676669.
[I 2023-12-21 02:34:53,320] Trial 108 pruned. Trial was pruned at iteration 0.
[I 2023-12-21 02:34:59,009] Trial 109 finished with value: 4.481465790838648 and parameters: {'learning_rate': 0.3491932820178767, 'aft_l                                                                     oss_distribution': 'logistic', 'aft_loss_distribution_scale': 1.139996888314108, 'max_depth': 9, 'booster': 'dart', 'scale_pos_weight': 4                                                                     .60131461543721, 'alpha': 8.14575477528701, 'lambda': 7.906861455854177, 'eta': 0.8154843929883117, 'sampling_method': 'uniform', 'subsam                                                                     ple': 0.9922364729079259, 'gamma': 5.358695786829934}. Best is trial 39 with value: 4.394413518676669.
[I 2023-12-21 02:35:06,719] Trial 110 finished with value: 4.4371504033263305 and parameters: {'learning_rate': 0.3479397561776818, 'aft_                                                                     loss_distribution': 'logistic', 'aft_loss_distribution_scale': 1.0635426581937026, 'max_depth': 9, 'booster': 'dart', 'scale_pos_weight':                                                                      5.461691792664982, 'alpha': 8.063815556795419, 'lambda': 7.8364442126883365, 'eta': 0.8088877829628435, 'sampling_method': 'uniform', 's                                                                     ubsample': 0.9967616725098463, 'gamma': 5.67821655361905}. Best is trial 39 with value: 4.394413518676669.
[I 2023-12-21 02:35:12,420] Trial 111 finished with value: 4.4322513891024125 and parameters: {'learning_rate': 0.35589846221825944, 'aft                                                                     _loss_distribution': 'logistic', 'aft_loss_distribution_scale': 1.0546949670480683, 'max_depth': 9, 'booster': 'dart', 'scale_pos_weight'                                                                     : 5.528173261885044, 'alpha': 7.83318704813451, 'lambda': 8.168272814606908, 'eta': 0.8120708503704602, 'sampling_method': 'uniform', 'su                                                                     bsample': 0.9917589246250079, 'gamma': 5.633548383684279}. Best is trial 39 with value: 4.394413518676669.
[I 2023-12-21 02:35:20,113] Trial 112 finished with value: 4.492368987352448 and parameters: {'learning_rate': 0.35692305435775107, 'aft_                                                                     loss_distribution': 'logistic', 'aft_loss_distribution_scale': 1.1591101198960136, 'max_depth': 9, 'booster': 'dart', 'scale_pos_weight':                                                                      5.61814491873395, 'alpha': 7.8650327837246445, 'lambda': 7.988556861607916, 'eta': 0.8005899362333678, 'sampling_method': 'uniform', 'su                                                                     bsample': 0.9966609189548051, 'gamma': 5.413524411924981}. Best is trial 39 with value: 4.394413518676669.
[I 2023-12-21 02:35:28,555] Trial 113 finished with value: 4.466822653143413 and parameters: {'learning_rate': 0.3929834641315262, 'aft_l                                                                     oss_distribution': 'logistic', 'aft_loss_distribution_scale': 1.1119253953141026, 'max_depth': 9, 'booster': 'dart', 'scale_pos_weight':                                                                      5.671991201306925, 'alpha': 7.655695267445657, 'lambda': 8.00104707133798, 'eta': 0.8079445251129506, 'sampling_method': 'uniform', 'subs                                                                     ample': 0.9738087377496127, 'gamma': 5.312050881127216}. Best is trial 39 with value: 4.394413518676669.
[I 2023-12-21 02:35:36,373] Trial 114 finished with value: 4.464314453363598 and parameters: {'learning_rate': 0.3495414032742995, 'aft_l                                                                     oss_distribution': 'logistic', 'aft_loss_distribution_scale': 1.1091178850186587, 'max_depth': 9, 'booster': 'dart', 'scale_pos_weight':                                                                      5.747720150719323, 'alpha': 7.881693281568557, 'lambda': 7.9263813560617296, 'eta': 0.886279776054002, 'sampling_method': 'uniform', 'sub                                                                     sample': 0.9971592350965737, 'gamma': 5.40861373344279}. Best is trial 39 with value: 4.394413518676669.
[I 2023-12-21 02:35:44,161] Trial 115 finished with value: 4.432214103807367 and parameters: {'learning_rate': 0.39148902079677084, 'aft_                                                                     loss_distribution': 'logistic', 'aft_loss_distribution_scale': 1.0539604699071388, 'max_depth': 9, 'booster': 'dart', 'scale_pos_weight':                                                                      5.930848095740834, 'alpha': 7.838024963111546, 'lambda': 8.189856801094672, 'eta': 0.8660769418690533, 'sampling_method': 'uniform', 'su                                                                     bsample': 0.9820587935293654, 'gamma': 4.860804780159214}. Best is trial 39 with value: 4.394413518676669.
[I 2023-12-21 02:35:44,206] Trial 116 pruned. Trial was pruned at iteration 0.
[I 2023-12-21 02:35:44,250] Trial 117 pruned. Trial was pruned at iteration 0.
[I 2023-12-21 02:35:44,293] Trial 118 pruned. Trial was pruned at iteration 0.
[I 2023-12-21 02:35:44,329] Trial 119 pruned. Trial was pruned at iteration 0.
[I 2023-12-21 02:35:46,104] Trial 120 finished with value: inf and parameters: {'learning_rate': 0.33564404780868784, 'aft_loss_distribut                                                                     ion': 'logistic', 'aft_loss_distribution_scale': 1.0809820122766443, 'max_depth': 9, 'booster': 'dart', 'scale_pos_weight': 5.87553566599                                                                     9295, 'alpha': 7.429683053239166, 'lambda': 8.457377485261844, 'eta': 0.8278323083630689, 'sampling_method': 'uniform', 'subsample': 0.91                                                                     72499414715598, 'gamma': 5.382887839423068}. Best is trial 39 with value: 4.394413518676669.
[I 2023-12-21 02:35:48,712] Trial 121 finished with value: 4.426440797797175 and parameters: {'learning_rate': 0.28621081708826956, 'aft_                                                                     loss_distribution': 'logistic', 'aft_loss_distribution_scale': 1.0453345709392794, 'max_depth': 9, 'booster': 'dart', 'scale_pos_weight':                                                                      5.575809483079517, 'alpha': 8.173135779518336, 'lambda': 8.130138091468503, 'eta': 0.8582150200729266, 'sampling_method': 'uniform', 'su                                                                     bsample': 0.9491479993820595, 'gamma': 5.750534604864907}. Best is trial 39 with value: 4.394413518676669.
[I 2023-12-21 02:35:48,756] Trial 122 pruned. Trial was pruned at iteration 0.
[I 2023-12-21 02:35:48,800] Trial 123 pruned. Trial was pruned at iteration 0.
[I 2023-12-21 02:35:48,837] Trial 124 pruned. Trial was pruned at iteration 0.
[I 2023-12-21 02:35:48,874] Trial 125 pruned. Trial was pruned at iteration 0.
[I 2023-12-21 02:35:50,560] Trial 126 finished with value: inf and parameters: {'learning_rate': 0.35938949427589756, 'aft_loss_distribut                                                                     ion': 'logistic', 'aft_loss_distribution_scale': 1.1810533648382247, 'max_depth': 9, 'booster': 'dart', 'scale_pos_weight': 6.21018954999                                                                     6296, 'alpha': 8.096421012891115, 'lambda': 8.28953628916913, 'eta': 0.7596017408210484, 'sampling_method': 'uniform', 'subsample': 0.994                                                                     9148427874516, 'gamma': 4.958679201192199}. Best is trial 39 with value: 4.394413518676669.
[I 2023-12-21 02:35:50,603] Trial 127 pruned. Trial was pruned at iteration 0.
[I 2023-12-21 02:35:50,645] Trial 128 pruned. Trial was pruned at iteration 0.
[I 2023-12-21 02:35:50,685] Trial 129 pruned. Trial was pruned at iteration 0.
[I 2023-12-21 02:35:50,722] Trial 130 pruned. Trial was pruned at iteration 0.
[I 2023-12-21 02:36:20,954] Trial 131 finished with value: 4.497115126760077 and parameters: {'learning_rate': 0.2964374884323762, 'aft_l                                                                     oss_distribution': 'logistic', 'aft_loss_distribution_scale': 1.1672969598606306, 'max_depth': 10, 'booster': 'dart', 'scale_pos_weight':                                                                      4.574670812505973, 'alpha': 8.21027870125221, 'lambda': 7.502618738621169, 'eta': 0.8678354388421354, 'sampling_method': 'uniform', 'sub                                                                     sample': 0.9985899973367637, 'gamma': 5.9703313178323025}. Best is trial 39 with value: 4.394413518676669.
[I 2023-12-21 02:36:20,997] Trial 132 pruned. Trial was pruned at iteration 1.
[I 2023-12-21 02:36:21,041] Trial 133 pruned. Trial was pruned at iteration 0.
[I 2023-12-21 02:36:25,424] Trial 134 finished with value: 4.41449544505823 and parameters: {'learning_rate': 0.3180315280623329, 'aft_lo                                                                     ss_distribution': 'logistic', 'aft_loss_distribution_scale': 1.0234249231128807, 'max_depth': 10, 'booster': 'dart', 'scale_pos_weight':                                                                      5.705126035051537, 'alpha': 8.477262585809664, 'lambda': 7.226387382068976, 'eta': 0.9033621713026101, 'sampling_method': 'uniform', 'sub                                                                     sample': 0.9467847772928629, 'gamma': 5.771269267235863}. Best is trial 39 with value: 4.394413518676669.
[I 2023-12-21 02:36:25,461] Trial 135 pruned. Trial was pruned at iteration 0.
[I 2023-12-21 02:36:25,509] Trial 136 pruned. Trial was pruned at iteration 0.
[I 2023-12-21 02:36:25,552] Trial 137 pruned. Trial was pruned at iteration 0.
[I 2023-12-21 02:36:25,589] Trial 138 pruned. Trial was pruned at iteration 0.
[I 2023-12-21 02:36:25,628] Trial 139 pruned. Trial was pruned at iteration 1.
[I 2023-12-21 02:36:25,665] Trial 140 pruned. Trial was pruned at iteration 0.
