[I 2023-12-21 04:16:38,016] Trial 85 finished with value: 2.1018470396284017 and parameters: {'learning_rate': 0.45705595168704194, 'aft_                                                                     loss_distribution': 'logistic', 'aft_loss_distribution_scale': 1.4954258530348417, 'max_depth': 6, 'booster': 'dart', 'scale_pos_weight':                                                                      0.2790022952390704, 'alpha': 7.309469312346267, 'lambda': 5.164048362475968, 'eta': 0.9189467243445376, 'sampling_method': 'uniform', 's                                                                     ubsample': 0.5106377222024646, 'gamma': 9.742989511528105}. Best is trial 85 with value: 2.1018470396284017.
[I 2023-12-21 04:16:38,054] Trial 86 pruned. Trial was pruned at iteration 0.
[I 2023-12-21 04:16:54,290] Trial 87 finished with value: 2.1039043700860987 and parameters: {'learning_rate': 0.41379157995046983, 'aft_                                                                     loss_distribution': 'logistic', 'aft_loss_distribution_scale': 1.5111568029343398, 'max_depth': 5, 'booster': 'dart', 'scale_pos_weight':                                                                      0.27607086377147244, 'alpha': 9.217145306830478, 'lambda': 5.452731120950238, 'eta': 0.9075995185440687, 'sampling_method': 'uniform', '                                                                     subsample': 0.5334520578792311, 'gamma': 9.423761375258929}. Best is trial 85 with value: 2.1018470396284017.
[I 2023-12-21 04:16:54,329] Trial 88 pruned. Trial was pruned at iteration 0.
[I 2023-12-21 04:16:54,363] Trial 89 pruned. Trial was pruned at iteration 0.
[I 2023-12-21 04:16:56,650] Trial 90 finished with value: 2.0965613601539004 and parameters: {'learning_rate': 0.3864980247789706, 'aft_l                                                                     oss_distribution': 'logistic', 'aft_loss_distribution_scale': 1.3326767498806043, 'max_depth': 4, 'booster': 'dart', 'scale_pos_weight':                                                                      3.2459230913980504, 'alpha': 9.493349867897546, 'lambda': 5.582982979919295, 'eta': 0.9419432181087501, 'sampling_method': 'gradient_base                                                                     d', 'subsample': 0.4923952632861071, 'gamma': 9.247800200986655}. Best is trial 90 with value: 2.0965613601539004.
[I 2023-12-21 04:17:06,120] Trial 91 finished with value: 2.0829537090151615 and parameters: {'learning_rate': 0.3801919138547042, 'aft_l                                                                     oss_distribution': 'logistic', 'aft_loss_distribution_scale': 1.1921585209103336, 'max_depth': 4, 'booster': 'dart', 'scale_pos_weight':                                                                      3.1904465464506035, 'alpha': 9.120382564624133, 'lambda': 5.513448591637999, 'eta': 0.9352067903827496, 'sampling_method': 'gradient_base                                                                     d', 'subsample': 0.4990520608072269, 'gamma': 9.71470588313595}. Best is trial 91 with value: 2.0829537090151615.
[I 2023-12-21 04:17:07,738] Trial 92 finished with value: inf and parameters: {'learning_rate': 0.3395377648619154, 'aft_loss_distributio                                                                     n': 'logistic', 'aft_loss_distribution_scale': 1.2844813763890615, 'max_depth': 4, 'booster': 'dart', 'scale_pos_weight': 3.0481986225486                                                                     2, 'alpha': 9.473444580184253, 'lambda': 6.044895311606052, 'eta': 0.9380204291915437, 'sampling_method': 'gradient_based', 'subsample':                                                                      0.4171991425504164, 'gamma': 9.302523772790801}. Best is trial 91 with value: 2.0829537090151615.
[I 2023-12-21 04:17:07,776] Trial 93 pruned. Trial was pruned at iteration 0.
[I 2023-12-21 04:17:09,784] Trial 94 finished with value: 2.127583225006631 and parameters: {'learning_rate': 0.4359819266949285, 'aft_lo                                                                     ss_distribution': 'logistic', 'aft_loss_distribution_scale': 1.534877381139995, 'max_depth': 4, 'booster': 'dart', 'scale_pos_weight': 2.                                                                     790826773085562, 'alpha': 8.837856989811916, 'lambda': 6.364249265477102, 'eta': 0.9305197545544405, 'sampling_method': 'gradient_based',                                                                      'subsample': 0.4343463886233283, 'gamma': 9.38585641384987}. Best is trial 91 with value: 2.0829537090151615.
[I 2023-12-21 04:17:09,820] Trial 95 pruned. Trial was pruned at iteration 0.
[I 2023-12-21 04:17:09,854] Trial 96 pruned. Trial was pruned at iteration 0.
[I 2023-12-21 04:17:09,890] Trial 97 pruned. Trial was pruned at iteration 0.
[I 2023-12-21 04:17:09,931] Trial 98 pruned. Trial was pruned at iteration 0.
[I 2023-12-21 04:17:12,188] Trial 99 finished with value: 2.131053672741535 and parameters: {'learning_rate': 0.4027022658186734, 'aft_lo                                                                     ss_distribution': 'logistic', 'aft_loss_distribution_scale': 1.6350909194250227, 'max_depth': 5, 'booster': 'dart', 'scale_pos_weight': 3                                                                     .567348642948207, 'alpha': 8.995450813738119, 'lambda': 5.86915853523274, 'eta': 0.8569528519458326, 'sampling_method': 'gradient_based',                                                                      'subsample': 0.565722947575956, 'gamma': 9.820799673326102}. Best is trial 91 with value: 2.0829537090151615.
[I 2023-12-21 04:17:13,445] Trial 100 finished with value: inf and parameters: {'learning_rate': 0.4375154796882629, 'aft_loss_distributi                                                                     on': 'logistic', 'aft_loss_distribution_scale': 1.4006080014878097, 'max_depth': 5, 'booster': 'dart', 'scale_pos_weight': 3.583291442047                                                                     7024, 'alpha': 9.156693470871106, 'lambda': 5.587938590979787, 'eta': 0.8588428267715388, 'sampling_method': 'gradient_based', 'subsample                                                                     ': 0.5596185923371733, 'gamma': 9.799817123469143}. Best is trial 91 with value: 2.0829537090151615.
[I 2023-12-21 04:17:13,483] Trial 101 pruned. Trial was pruned at iteration 0.
[I 2023-12-21 04:17:13,519] Trial 102 pruned. Trial was pruned at iteration 0.
[I 2023-12-21 04:17:13,554] Trial 103 pruned. Trial was pruned at iteration 0.
[I 2023-12-21 04:17:15,377] Trial 104 finished with value: inf and parameters: {'learning_rate': 0.31666300179612533, 'aft_loss_distribut                                                                     ion': 'logistic', 'aft_loss_distribution_scale': 1.2314684531372038, 'max_depth': 4, 'booster': 'dart', 'scale_pos_weight': 2.95007475057                                                                     33815, 'alpha': 7.992538748339822, 'lambda': 5.837051094004773, 'eta': 0.8556404427953618, 'sampling_method': 'gradient_based', 'subsampl                                                                     e': 0.3920181694124249, 'gamma': 9.990648988271825}. Best is trial 91 with value: 2.0829537090151615.
[I 2023-12-21 04:17:15,415] Trial 105 pruned. Trial was pruned at iteration 0.
[I 2023-12-21 04:17:15,458] Trial 106 pruned. Trial was pruned at iteration 0.
[I 2023-12-21 04:17:16,991] Trial 107 finished with value: inf and parameters: {'learning_rate': 0.47113427078520975, 'aft_loss_distribut                                                                     ion': 'logistic', 'aft_loss_distribution_scale': 1.578368232579737, 'max_depth': 5, 'booster': 'dart', 'scale_pos_weight': 3.554601399216                                                                     2884, 'alpha': 9.817621880549138, 'lambda': 5.215182106888702, 'eta': 0.9820477928150819, 'sampling_method': 'gradient_based', 'subsample                                                                     ': 0.5822340529525202, 'gamma': 8.74007775882955}. Best is trial 91 with value: 2.0829537090151615.
[I 2023-12-21 04:17:17,028] Trial 108 pruned. Trial was pruned at iteration 0.
[I 2023-12-21 04:17:17,066] Trial 109 pruned. Trial was pruned at iteration 0.
[I 2023-12-21 04:17:17,101] Trial 110 pruned. Trial was pruned at iteration 0.
[I 2023-12-21 04:17:17,138] Trial 111 pruned. Trial was pruned at iteration 0.
[I 2023-12-21 04:17:17,174] Trial 112 pruned. Trial was pruned at iteration 0.
[I 2023-12-21 04:17:17,209] Trial 113 pruned. Trial was pruned at iteration 0.
[I 2023-12-21 04:17:17,250] Trial 114 pruned. Trial was pruned at iteration 0.
[I 2023-12-21 04:17:18,839] Trial 115 finished with value: inf and parameters: {'learning_rate': 0.35343280099873065, 'aft_loss_distribut                                                                     ion': 'logistic', 'aft_loss_distribution_scale': 1.444624590216935, 'max_depth': 4, 'booster': 'dart', 'scale_pos_weight': 3.257539747597                                                                     862, 'alpha': 9.342596556020522, 'lambda': 6.168202101405041, 'eta': 0.1336389096594366, 'sampling_method': 'gradient_based', 'subsample'                                                                     : 0.8790485048390138, 'gamma': 8.165492721768793}. Best is trial 91 with value: 2.0829537090151615.
[I 2023-12-21 04:17:27,972] Trial 116 finished with value: 2.1351708643784812 and parameters: {'learning_rate': 0.5242861618181791, 'aft_                                                                     loss_distribution': 'logistic', 'aft_loss_distribution_scale': 1.6920355811028045, 'max_depth': 3, 'booster': 'dart', 'scale_pos_weight':                                                                      0.31705851349443537, 'alpha': 8.081886555165463, 'lambda': 5.3621904157087945, 'eta': 0.8072376886314332, 'sampling_method': 'uniform',                                                                      'subsample': 0.42949604688869253, 'gamma': 9.456620581582964}. Best is trial 91 with value: 2.0829537090151615.
[I 2023-12-21 04:17:28,012] Trial 117 pruned. Trial was pruned at iteration 0.
[I 2023-12-21 04:17:28,049] Trial 118 pruned. Trial was pruned at iteration 0.
[I 2023-12-21 04:17:28,085] Trial 119 pruned. Trial was pruned at iteration 0.
[I 2023-12-21 04:17:28,121] Trial 120 pruned. Trial was pruned at iteration 0.
[I 2023-12-21 04:17:30,263] Trial 121 finished with value: 2.161543999216209 and parameters: {'learning_rate': 0.5242861840909122, 'aft_l                                                                     oss_distribution': 'logistic', 'aft_loss_distribution_scale': 1.8421633663709356, 'max_depth': 6, 'booster': 'dart', 'scale_pos_weight':                                                                      0.2359776081710902, 'alpha': 8.543039264924928, 'lambda': 5.434025144004783, 'eta': 0.8235320316128536, 'sampling_method': 'uniform', 'su                                                                     bsample': 0.38082559878494804, 'gamma': 9.673069024065262}. Best is trial 91 with value: 2.0829537090151615.
[I 2023-12-21 04:17:35,708] Trial 122 finished with value: 2.0808706200600344 and parameters: {'learning_rate': 0.41348845457844735, 'aft                                                                     _loss_distribution': 'logistic', 'aft_loss_distribution_scale': 1.36010167688637, 'max_depth': 4, 'booster': 'dart', 'scale_pos_weight':                                                                      0.5864814480300615, 'alpha': 6.860429633427536, 'lambda': 6.414167377413474, 'eta': 0.7031740955806157, 'sampling_method': 'uniform', 'su                                                                     bsample': 0.5254392212358576, 'gamma': 8.903215192938772}. Best is trial 122 with value: 2.0808706200600344.
[I 2023-12-21 04:17:38,836] Trial 123 finished with value: 2.0917634938923766 and parameters: {'learning_rate': 0.4207400883886012, 'aft_                                                                     loss_distribution': 'logistic', 'aft_loss_distribution_scale': 1.2282466265462786, 'max_depth': 4, 'booster': 'dart', 'scale_pos_weight':                                                                      0.11149217179137788, 'alpha': 6.916664629834274, 'lambda': 6.4138447524503555, 'eta': 0.6967306481162281, 'sampling_method': 'uniform',                                                                      'subsample': 0.5150364856089411, 'gamma': 8.970521716464429}. Best is trial 122 with value: 2.0808706200600344.
[I 2023-12-21 04:17:38,875] Trial 124 pruned. Trial was pruned at iteration 0.
[I 2023-12-21 04:18:09,607] Trial 125 finished with value: 2.075453893079148 and parameters: {'learning_rate': 0.3821267815529814, 'aft_l                                                                     oss_distribution': 'logistic', 'aft_loss_distribution_scale': 1.254445356362478, 'max_depth': 4, 'booster': 'dart', 'scale_pos_weight': 0                                                                     .5871526188981993, 'alpha': 6.990928652848986, 'lambda': 5.833276155550281, 'eta': 0.7660142220337308, 'sampling_method': 'uniform', 'sub                                                                     sample': 0.5452325999531036, 'gamma': 8.93469469157423}. Best is trial 125 with value: 2.075453893079148.
[I 2023-12-21 04:18:22,871] Trial 126 finished with value: 2.075818236497666 and parameters: {'learning_rate': 0.3879631860690968, 'aft_l                                                                     oss_distribution': 'logistic', 'aft_loss_distribution_scale': 1.2676549697294608, 'max_depth': 4, 'booster': 'dart', 'scale_pos_weight':                                                                      0.6449815749442867, 'alpha': 7.255618986766003, 'lambda': 5.849207927479639, 'eta': 0.9975483593209232, 'sampling_method': 'uniform', 'su                                                                     bsample': 0.543590816151834, 'gamma': 8.899870512883684}. Best is trial 125 with value: 2.075453893079148.
[I 2023-12-21 04:18:34,177] Trial 127 finished with value: 2.0789372438687623 and parameters: {'learning_rate': 0.3297851198247069, 'aft_                                                                     loss_distribution': 'logistic', 'aft_loss_distribution_scale': 1.1659447803431928, 'max_depth': 4, 'booster': 'dart', 'scale_pos_weight':                                                                      0.9748411936898487, 'alpha': 6.948657337302585, 'lambda': 5.815777095377518, 'eta': 0.9631220629748835, 'sampling_method': 'uniform', 's                                                                     ubsample': 0.5578552129277569, 'gamma': 8.870010315312374}. Best is trial 125 with value: 2.075453893079148.
[I 2023-12-21 04:18:56,792] Trial 128 finished with value: 2.069042118913351 and parameters: {'learning_rate': 0.2818802628526496, 'aft_l                                                                     oss_distribution': 'logistic', 'aft_loss_distribution_scale': 1.2741116080412418, 'max_depth': 4, 'booster': 'dart', 'scale_pos_weight':                                                                      1.0608115229656825, 'alpha': 7.045031094544814, 'lambda': 6.103555877104845, 'eta': 0.9597681319384497, 'sampling_method': 'uniform', 'su                                                                     bsample': 0.5415031866216995, 'gamma': 8.897648632218912}. Best is trial 128 with value: 2.069042118913351.
[I 2023-12-21 04:19:06,615] Trial 129 finished with value: 2.0595465163443114 and parameters: {'learning_rate': 0.26885498094292937, 'aft                                                                     _loss_distribution': 'logistic', 'aft_loss_distribution_scale': 1.2161789259748494, 'max_depth': 4, 'booster': 'dart', 'scale_pos_weight'                                                                     : 0.9686482366837195, 'alpha': 7.017941118817294, 'lambda': 6.736202291398513, 'eta': 0.9928764440438723, 'sampling_method': 'uniform', '                                                                     subsample': 0.4842439563046215, 'gamma': 8.477544657534507}. Best is trial 129 with value: 2.0595465163443114.
[I 2023-12-21 04:19:13,491] Trial 130 finished with value: 2.071872019453329 and parameters: {'learning_rate': 0.28787818271085047, 'aft_                                                                     loss_distribution': 'logistic', 'aft_loss_distribution_scale': 1.15138008557631, 'max_depth': 4, 'booster': 'dart', 'scale_pos_weight': 0                                                                     .9432236093244941, 'alpha': 7.0252282433119175, 'lambda': 5.672829933557113, 'eta': 0.9944614466698819, 'sampling_method': 'uniform', 'su                                                                     bsample': 0.5461859477238462, 'gamma': 8.524646949975367}. Best is trial 129 with value: 2.0595465163443114.
[I 2023-12-21 04:19:13,528] Trial 131 pruned. Trial was pruned at iteration 0.
[I 2023-12-21 04:19:13,566] Trial 132 pruned. Trial was pruned at iteration 0.
[I 2023-12-21 04:19:13,603] Trial 133 pruned. Trial was pruned at iteration 0.
[I 2023-12-21 04:19:13,641] Trial 134 pruned. Trial was pruned at iteration 0.
[I 2023-12-21 04:19:13,681] Trial 135 pruned. Trial was pruned at iteration 0.
[I 2023-12-21 04:19:16,404] Trial 136 finished with value: 2.0665286583913147 and parameters: {'learning_rate': 0.3229394103216786, 'aft_                                                                     loss_distribution': 'logistic', 'aft_loss_distribution_scale': 1.2888256896000556, 'max_depth': 4, 'booster': 'dart', 'scale_pos_weight':                                                                      0.6664063192360415, 'alpha': 6.88899392123212, 'lambda': 5.850772777016752, 'eta': 0.953122520238464, 'sampling_method': 'uniform', 'sub                                                                     sample': 0.5071512127115386, 'gamma': 8.978337277908324}. Best is trial 129 with value: 2.0595465163443114.
[I 2023-12-21 04:19:16,445] Trial 137 pruned. Trial was pruned at iteration 0.
[I 2023-12-21 04:19:16,480] Trial 138 pruned. Trial was pruned at iteration 0.
[I 2023-12-21 04:19:16,518] Trial 139 pruned. Trial was pruned at iteration 0.
[I 2023-12-21 04:19:16,555] Trial 140 pruned. Trial was pruned at iteration 0.
[I 2023-12-21 04:19:38,548] Trial 141 pruned. Trial was pruned at iteration 264.
[I 2023-12-21 04:19:49,783] Trial 142 finished with value: 2.09417168913271 and parameters: {'learning_rate': 0.3798836175245522, 'aft_lo                                                                     ss_distribution': 'logistic', 'aft_loss_distribution_scale': 1.1800939786704454, 'max_depth': 4, 'booster': 'dart', 'scale_pos_weight': 0                                                                     .5871767323918721, 'alpha': 6.921750081901633, 'lambda': 6.223010437930412, 'eta': 0.9591665757016671, 'sampling_method': 'uniform', 'sub                                                                     sample': 0.554398224335643, 'gamma': 8.864529665776718}. Best is trial 129 with value: 2.0595465163443114.
[I 2023-12-21 04:19:49,822] Trial 143 pruned. Trial was pruned at iteration 0.
[I 2023-12-21 04:19:49,863] Trial 144 pruned. Trial was pruned at iteration 0.
[I 2023-12-21 04:19:49,900] Trial 145 pruned. Trial was pruned at iteration 0.
[I 2023-12-21 04:19:57,048] Trial 146 finished with value: 2.068864081876703 and parameters: {'learning_rate': 0.3555772083990014, 'aft_l                                                                     oss_distribution': 'logistic', 'aft_loss_distribution_scale': 1.1901285595442994, 'max_depth': 7, 'booster': 'dart', 'scale_pos_weight':                                                                      0.5954012238712368, 'alpha': 7.614197616112003, 'lambda': 5.925983982846248, 'eta': 0.9028591692268713, 'sampling_method': 'uniform', 'su                                                                     bsample': 0.45754087963332873, 'gamma': 9.040345823807561}. Best is trial 129 with value: 2.0595465163443114.
[I 2023-12-21 04:20:24,068] Trial 147 finished with value: 2.068396779394518 and parameters: {'learning_rate': 0.3470849129837442, 'aft_l                                                                     oss_distribution': 'logistic', 'aft_loss_distribution_scale': 1.263996963023078, 'max_depth': 4, 'booster': 'dart', 'scale_pos_weight': 0                                                                     .5931839956946454, 'alpha': 7.579383287698612, 'lambda': 7.252162316809631, 'eta': 0.9495004836428355, 'sampling_method': 'uniform', 'sub                                                                     sample': 0.4650230587072248, 'gamma': 8.309585758838963}. Best is trial 129 with value: 2.0595465163443114.
[I 2023-12-21 04:20:24,107] Trial 148 pruned. Trial was pruned at iteration 0.
[I 2023-12-21 04:20:24,145] Trial 149 pruned. Trial was pruned at iteration 0.
[I 2023-12-21 04:20:24,185] Trial 150 pruned. Trial was pruned at iteration 0.
