[I 2023-12-21 03:21:43,328] Trial 34 finished with value: 4.15687381580361 and parameters: {'learning_rate': 0.06530825613710901, 'aft_lo                                                                     ss_distribution': 'logistic', 'aft_loss_distribution_scale': 0.6075135526523636, 'max_depth': 4, 'booster': 'dart', 'scale_pos_weight': 3                                                                     .464084793395135, 'alpha': 4.7847965668930765, 'lambda': 5.214701967095443, 'eta': 0.6476460385731763, 'sampling_method': 'gradient_based                                                                     ', 'subsample': 0.49313182079854434, 'gamma': 2.6670560031748067}. Best is trial 34 with value: 4.15687381580361.
[I 2023-12-21 03:21:43,364] Trial 35 pruned. Trial was pruned at iteration 0.
[I 2023-12-21 03:21:43,396] Trial 36 pruned. Trial was pruned at iteration 0.
[I 2023-12-21 03:21:43,427] Trial 37 pruned. Trial was pruned at iteration 0.
[I 2023-12-21 03:21:43,459] Trial 38 pruned. Trial was pruned at iteration 0.
[I 2023-12-21 03:21:43,492] Trial 39 pruned. Trial was pruned at iteration 0.
[I 2023-12-21 03:21:43,905] Trial 40 finished with value: 4.234027040705678 and parameters: {'learning_rate': 0.10638712293104102, 'aft_l                                                                     oss_distribution': 'logistic', 'aft_loss_distribution_scale': 0.7524938801465101, 'max_depth': 3, 'booster': 'gbtree', 'scale_pos_weight'                                                                     : 3.0321369789691626, 'alpha': 7.781302396555732, 'lambda': 5.61117577877591, 'eta': 0.68253839208816, 'sampling_method': 'uniform', 'sub                                                                     sample': 0.2504212955315466, 'gamma': 0.09937551201419303}. Best is trial 34 with value: 4.15687381580361.
[I 2023-12-21 03:21:44,237] Trial 41 finished with value: 4.279440385122272 and parameters: {'learning_rate': 0.11209480379572925, 'aft_l                                                                     oss_distribution': 'logistic', 'aft_loss_distribution_scale': 0.8289780080680349, 'max_depth': 3, 'booster': 'gbtree', 'scale_pos_weight'                                                                     : 3.0148845501367867, 'alpha': 7.5635316307093605, 'lambda': 5.28261492246791, 'eta': 0.6759480157491703, 'sampling_method': 'uniform', '                                                                     subsample': 0.2346635870530824, 'gamma': 0.3584900915163826}. Best is trial 34 with value: 4.15687381580361.
[I 2023-12-21 03:21:44,645] Trial 42 finished with value: 4.267981073981408 and parameters: {'learning_rate': 0.11043580057307747, 'aft_l                                                                     oss_distribution': 'logistic', 'aft_loss_distribution_scale': 0.8060645186808164, 'max_depth': 3, 'booster': 'gbtree', 'scale_pos_weight'                                                                     : 3.220646720941402, 'alpha': 7.93668949120379, 'lambda': 5.450843189222053, 'eta': 0.6622739957828752, 'sampling_method': 'uniform', 'su                                                                     bsample': 0.2224175756450206, 'gamma': 0.01591476270327981}. Best is trial 34 with value: 4.15687381580361.
[I 2023-12-21 03:21:44,676] Trial 43 pruned. Trial was pruned at iteration 0.
[I 2023-12-21 03:21:45,045] Trial 44 finished with value: 4.213774470299766 and parameters: {'learning_rate': 0.10188892662173976, 'aft_l                                                                     oss_distribution': 'logistic', 'aft_loss_distribution_scale': 0.7083362933399704, 'max_depth': 3, 'booster': 'gbtree', 'scale_pos_weight'                                                                     : 3.7730960036192345, 'alpha': 7.914687071444234, 'lambda': 4.896331689516253, 'eta': 0.7462195470548791, 'sampling_method': 'uniform', '                                                                     subsample': 0.19425266785565015, 'gamma': 0.6384074991338884}. Best is trial 34 with value: 4.15687381580361.
[I 2023-12-21 03:21:45,076] Trial 45 pruned. Trial was pruned at iteration 0.
[I 2023-12-21 03:21:45,106] Trial 46 pruned. Trial was pruned at iteration 0.
[I 2023-12-21 03:21:45,136] Trial 47 pruned. Trial was pruned at iteration 0.
[I 2023-12-21 03:21:45,167] Trial 48 pruned. Trial was pruned at iteration 0.
[I 2023-12-21 03:21:45,199] Trial 49 pruned. Trial was pruned at iteration 0.
[I 2023-12-21 03:21:45,230] Trial 50 pruned. Trial was pruned at iteration 0.
[I 2023-12-21 03:21:45,263] Trial 51 pruned. Trial was pruned at iteration 0.
[I 2023-12-21 03:21:45,294] Trial 52 pruned. Trial was pruned at iteration 0.
[I 2023-12-21 03:21:45,326] Trial 53 pruned. Trial was pruned at iteration 0.
[I 2023-12-21 03:21:45,358] Trial 54 pruned. Trial was pruned at iteration 0.
[I 2023-12-21 03:21:45,389] Trial 55 pruned. Trial was pruned at iteration 0.
[I 2023-12-21 03:21:45,536] Trial 56 pruned. Trial was pruned at iteration 121.
[I 2023-12-21 03:21:45,567] Trial 57 pruned. Trial was pruned at iteration 0.
[I 2023-12-21 03:21:45,599] Trial 58 pruned. Trial was pruned at iteration 0.
[I 2023-12-21 03:21:45,771] Trial 59 pruned. Trial was pruned at iteration 140.
[I 2023-12-21 03:21:45,814] Trial 60 pruned. Trial was pruned at iteration 7.
[I 2023-12-21 03:21:45,845] Trial 61 pruned. Trial was pruned at iteration 0.
[I 2023-12-21 03:21:45,879] Trial 62 pruned. Trial was pruned at iteration 0.
[I 2023-12-21 03:21:45,911] Trial 63 pruned. Trial was pruned at iteration 0.
[I 2023-12-21 03:21:45,943] Trial 64 pruned. Trial was pruned at iteration 0.
[I 2023-12-21 03:21:47,767] Trial 65 finished with value: inf and parameters: {'learning_rate': 0.18392518589477475, 'aft_loss_distributi                                                                     on': 'logistic', 'aft_loss_distribution_scale': 1.4862622599117423, 'max_depth': 5, 'booster': 'dart', 'scale_pos_weight': 1.198126022912                                                                     6929, 'alpha': 8.840017609392568, 'lambda': 6.935890184521875, 'eta': 0.8063543251931816, 'sampling_method': 'gradient_based', 'subsample                                                                     ': 0.15605108344974106, 'gamma': 1.2137457762114399}. Best is trial 34 with value: 4.15687381580361.
[I 2023-12-21 03:21:47,800] Trial 66 pruned. Trial was pruned at iteration 0.
[I 2023-12-21 03:21:47,834] Trial 67 pruned. Trial was pruned at iteration 0.
[I 2023-12-21 03:21:47,877] Trial 68 pruned. Trial was pruned at iteration 7.
[I 2023-12-21 03:21:56,615] Trial 69 pruned. Trial was pruned at iteration 159.
[I 2023-12-21 03:21:56,649] Trial 70 pruned. Trial was pruned at iteration 0.
[I 2023-12-21 03:21:56,839] Trial 71 pruned. Trial was pruned at iteration 121.
[I 2023-12-21 03:21:56,872] Trial 72 pruned. Trial was pruned at iteration 0.
[I 2023-12-21 03:21:56,905] Trial 73 pruned. Trial was pruned at iteration 0.
[I 2023-12-21 03:21:56,937] Trial 74 pruned. Trial was pruned at iteration 0.
[I 2023-12-21 03:21:59,228] Trial 75 finished with value: 4.473991548775097 and parameters: {'learning_rate': 0.12813565792068093, 'aft_l                                                                     oss_distribution': 'logistic', 'aft_loss_distribution_scale': 1.1265353979052086, 'max_depth': 7, 'booster': 'dart', 'scale_pos_weight':                                                                      1.3821197841783752, 'alpha': 7.3816925101916695, 'lambda': 5.699084095736791, 'eta': 0.7030945558138831, 'sampling_method': 'gradient_bas                                                                     ed', 'subsample': 0.16013761735968807, 'gamma': 0.7905368158068364}. Best is trial 34 with value: 4.15687381580361.
[I 2023-12-21 03:21:59,269] Trial 76 pruned. Trial was pruned at iteration 0.
[I 2023-12-21 03:21:59,304] Trial 77 pruned. Trial was pruned at iteration 0.
[I 2023-12-21 03:21:59,336] Trial 78 pruned. Trial was pruned at iteration 0.
[I 2023-12-21 03:21:59,369] Trial 79 pruned. Trial was pruned at iteration 0.
[I 2023-12-21 03:22:48,760] Trial 80 finished with value: 4.191625307813674 and parameters: {'learning_rate': 0.06881644223374597, 'aft_l                                                                     oss_distribution': 'logistic', 'aft_loss_distribution_scale': 0.6965703218979035, 'max_depth': 3, 'booster': 'dart', 'scale_pos_weight':                                                                      9.448084081431237, 'alpha': 6.689150377213725, 'lambda': 5.661441556270127, 'eta': 0.6505844548755474, 'sampling_method': 'gradient_based                                                                     ', 'subsample': 0.24613821323173513, 'gamma': 2.1919934963769947}. Best is trial 34 with value: 4.15687381580361.
[I 2023-12-21 03:22:48,796] Trial 81 pruned. Trial was pruned at iteration 0.
[I 2023-12-21 03:22:53,706] Trial 82 pruned. Trial was pruned at iteration 121.
[I 2023-12-21 03:22:53,743] Trial 83 pruned. Trial was pruned at iteration 0.
[I 2023-12-21 03:22:53,777] Trial 84 pruned. Trial was pruned at iteration 0.
[I 2023-12-21 03:22:53,811] Trial 85 pruned. Trial was pruned at iteration 0.
[I 2023-12-21 03:22:53,845] Trial 86 pruned. Trial was pruned at iteration 0.
[I 2023-12-21 03:22:53,880] Trial 87 pruned. Trial was pruned at iteration 0.
[I 2023-12-21 03:22:53,915] Trial 88 pruned. Trial was pruned at iteration 1.
[I 2023-12-21 03:23:23,085] Trial 89 finished with value: 4.181526131705504 and parameters: {'learning_rate': 0.07017823013438397, 'aft_l                                                                     oss_distribution': 'logistic', 'aft_loss_distribution_scale': 0.6557253876405952, 'max_depth': 3, 'booster': 'dart', 'scale_pos_weight':                                                                      1.4460115623468344, 'alpha': 6.303828976240435, 'lambda': 5.4018811954192865, 'eta': 0.7170414289916895, 'sampling_method': 'gradient_bas                                                                     ed', 'subsample': 0.2416732120929253, 'gamma': 2.4023254291116474}. Best is trial 34 with value: 4.15687381580361.
[I 2023-12-21 03:23:23,121] Trial 90 pruned. Trial was pruned at iteration 0.
[I 2023-12-21 03:23:23,155] Trial 91 pruned. Trial was pruned at iteration 0.
[I 2023-12-21 03:23:23,189] Trial 92 pruned. Trial was pruned at iteration 0.
[I 2023-12-21 03:23:23,224] Trial 93 pruned. Trial was pruned at iteration 0.
[I 2023-12-21 03:23:23,262] Trial 94 pruned. Trial was pruned at iteration 0.
[I 2023-12-21 03:23:23,297] Trial 95 pruned. Trial was pruned at iteration 0.
[I 2023-12-21 03:23:23,333] Trial 96 pruned. Trial was pruned at iteration 0.
[I 2023-12-21 03:23:23,368] Trial 97 pruned. Trial was pruned at iteration 0.
[I 2023-12-21 03:23:23,402] Trial 98 pruned. Trial was pruned at iteration 0.
[I 2023-12-21 03:23:23,437] Trial 99 pruned. Trial was pruned at iteration 0.
[I 2023-12-21 03:23:23,471] Trial 100 pruned. Trial was pruned at iteration 0.
[I 2023-12-21 03:23:23,667] Trial 101 pruned. Trial was pruned at iteration 96.
[I 2023-12-21 03:23:23,704] Trial 102 pruned. Trial was pruned at iteration 0.
[I 2023-12-21 03:23:23,739] Trial 103 pruned. Trial was pruned at iteration 0.
[I 2023-12-21 03:23:23,774] Trial 104 pruned. Trial was pruned at iteration 0.
[I 2023-12-21 03:23:23,808] Trial 105 pruned. Trial was pruned at iteration 0.
[I 2023-12-21 03:23:23,979] Trial 106 pruned. Trial was pruned at iteration 96.
[I 2023-12-21 03:23:24,016] Trial 107 pruned. Trial was pruned at iteration 0.
[I 2023-12-21 03:23:24,052] Trial 108 pruned. Trial was pruned at iteration 0.
[I 2023-12-21 03:23:24,087] Trial 109 pruned. Trial was pruned at iteration 0.
[I 2023-12-21 03:23:27,156] Trial 110 pruned. Trial was pruned at iteration 96.
[I 2023-12-21 03:23:27,210] Trial 111 pruned. Trial was pruned at iteration 4.
[I 2023-12-21 03:23:32,082] Trial 112 pruned. Trial was pruned at iteration 120.
[I 2023-12-21 03:23:32,119] Trial 113 pruned. Trial was pruned at iteration 0.
[I 2023-12-21 03:23:32,154] Trial 114 pruned. Trial was pruned at iteration 0.
[I 2023-12-21 03:23:32,192] Trial 115 pruned. Trial was pruned at iteration 0.
[I 2023-12-21 03:23:32,227] Trial 116 pruned. Trial was pruned at iteration 0.
[I 2023-12-21 03:23:32,265] Trial 117 pruned. Trial was pruned at iteration 0.
[I 2023-12-21 03:23:32,303] Trial 118 pruned. Trial was pruned at iteration 0.
[I 2023-12-21 03:23:32,340] Trial 119 pruned. Trial was pruned at iteration 0.
[I 2023-12-21 03:23:32,376] Trial 120 pruned. Trial was pruned at iteration 0.
[I 2023-12-21 03:23:32,414] Trial 121 pruned. Trial was pruned at iteration 1.
[I 2023-12-21 03:23:32,627] Trial 122 finished with value: 4.418251054019991 and parameters: {'learning_rate': 0.3593974258256023, 'aft_l                                                                     oss_distribution': 'logistic', 'aft_loss_distribution_scale': 1.043302175344659, 'max_depth': 5, 'booster': 'gbtree', 'scale_pos_weight':                                                                      3.6599080111383246, 'alpha': 8.203491122912453, 'lambda': 8.323953780465843, 'eta': 0.748270367539857, 'sampling_method': 'gradient_base                                                                     d', 'subsample': 0.7326332511560021, 'gamma': 0.5508668358464539}. Best is trial 34 with value: 4.15687381580361.
[I 2023-12-21 03:23:32,820] Trial 123 finished with value: 4.428406857029072 and parameters: {'learning_rate': 0.4122804477425052, 'aft_l                                                                     oss_distribution': 'logistic', 'aft_loss_distribution_scale': 1.048336536838799, 'max_depth': 5, 'booster': 'gbtree', 'scale_pos_weight':                                                                      3.576773661003945, 'alpha': 8.460382601006023, 'lambda': 5.725317480881857, 'eta': 0.7529582479974739, 'sampling_method': 'gradient_base                                                                     d', 'subsample': 0.7682727579246363, 'gamma': 0.49811807093217797}. Best is trial 34 with value: 4.15687381580361.
[I 2023-12-21 03:23:32,857] Trial 124 pruned. Trial was pruned at iteration 0.
[I 2023-12-21 03:23:33,040] Trial 125 pruned. Trial was pruned at iteration 96.
[I 2023-12-21 03:23:33,176] Trial 126 pruned. Trial was pruned at iteration 56.
[I 2023-12-21 03:23:33,213] Trial 127 pruned. Trial was pruned at iteration 0.
[I 2023-12-21 03:23:33,252] Trial 128 pruned. Trial was pruned at iteration 0.
[I 2023-12-21 03:23:33,289] Trial 129 pruned. Trial was pruned at iteration 0.
[I 2023-12-21 03:23:33,326] Trial 130 pruned. Trial was pruned at iteration 0.
[I 2023-12-21 03:23:33,372] Trial 131 pruned. Trial was pruned at iteration 6.
[I 2023-12-21 03:23:35,782] Trial 132 finished with value: 4.424233501771811 and parameters: {'learning_rate': 0.3616635935445637, 'aft_l                                                                     oss_distribution': 'logistic', 'aft_loss_distribution_scale': 1.0343346822015478, 'max_depth': 6, 'booster': 'dart', 'scale_pos_weight':                                                                      3.1270000988602282, 'alpha': 8.163621900322491, 'lambda': 8.425559953197963, 'eta': 0.6454231458147595, 'sampling_method': 'gradient_base                                                                     d', 'subsample': 0.8623876286286689, 'gamma': 9.981416899269007}. Best is trial 34 with value: 4.15687381580361.
[I 2023-12-21 03:23:35,974] Trial 133 finished with value: 4.429710686903083 and parameters: {'learning_rate': 0.3886236407482017, 'aft_l                                                                     oss_distribution': 'logistic', 'aft_loss_distribution_scale': 1.0769486953830048, 'max_depth': 6, 'booster': 'gbtree', 'scale_pos_weight'                                                                     : 3.10833522450051, 'alpha': 4.515593257120296, 'lambda': 8.90279154190518, 'eta': 0.6528928299445339, 'sampling_method': 'gradient_based                                                                     ', 'subsample': 0.8433061368762013, 'gamma': 0.7997930031520216}. Best is trial 34 with value: 4.15687381580361.
[I 2023-12-21 03:23:37,588] Trial 134 finished with value: inf and parameters: {'learning_rate': 0.3593466378847988, 'aft_loss_distributi                                                                     on': 'logistic', 'aft_loss_distribution_scale': 1.0202072710840633, 'max_depth': 6, 'booster': 'dart', 'scale_pos_weight': 3.498571554114                                                                     9065, 'alpha': 5.211009489241952, 'lambda': 9.441711302086105, 'eta': 0.6922428381401278, 'sampling_method': 'gradient_based', 'subsample                                                                     ': 0.8678915682558279, 'gamma': 9.557583276834386}. Best is trial 34 with value: 4.15687381580361.
[I 2023-12-21 03:23:37,625] Trial 135 pruned. Trial was pruned at iteration 0.
[I 2023-12-21 03:23:37,664] Trial 136 pruned. Trial was pruned at iteration 0.
[I 2023-12-21 03:23:37,700] Trial 137 pruned. Trial was pruned at iteration 0.
[I 2023-12-21 03:23:37,738] Trial 138 pruned. Trial was pruned at iteration 0.
[I 2023-12-21 03:23:37,794] Trial 139 pruned. Trial was pruned at iteration 11.
[I 2023-12-21 03:23:37,831] Trial 140 pruned. Trial was pruned at iteration 0.
[I 2023-12-21 03:23:37,870] Trial 141 pruned. Trial was pruned at iteration 0.
[I 2023-12-21 03:23:38,024] Trial 142 pruned. Trial was pruned at iteration 51.
[I 2023-12-21 03:23:38,062] Trial 143 pruned. Trial was pruned at iteration 0.
[I 2023-12-21 03:23:38,099] Trial 144 pruned. Trial was pruned at iteration 0.
[I 2023-12-21 03:23:38,136] Trial 145 pruned. Trial was pruned at iteration 0.
[I 2023-12-21 03:23:38,173] Trial 146 pruned. Trial was pruned at iteration 0.
[I 2023-12-21 03:23:38,213] Trial 147 pruned. Trial was pruned at iteration 0.
[I 2023-12-21 03:23:38,252] Trial 148 pruned. Trial was pruned at iteration 0.
[I 2023-12-21 03:23:38,297] Trial 149 pruned. Trial was pruned at iteration 0.
[I 2023-12-21 03:23:38,335] Trial 150 pruned. Trial was pruned at iteration 0.
[I 2023-12-21 03:23:43,112] Trial 151 pruned. Trial was pruned at iteration 120.
[I 2023-12-21 03:23:43,184] Trial 152 pruned. Trial was pruned at iteration 5.
[I 2023-12-21 03:23:44,174] Trial 153 pruned. Trial was pruned at iteration 51.
[I 2023-12-21 03:23:48,462] Trial 154 finished with value: 4.239798286950872 and parameters: {'learning_rate': 0.06609866848614614, 'aft_                                                                     loss_distribution': 'logistic', 'aft_loss_distribution_scale': 0.7165713888861354, 'max_depth': 7, 'booster': 'dart', 'scale_pos_weight':                                                                      1.52035933404836, 'alpha': 7.301423293434655, 'lambda': 8.097468772327407, 'eta': 0.6017740293082051, 'sampling_method': 'gradient_based                                                                     ', 'subsample': 0.20070588082130827, 'gamma': 0.3966799023663802}. Best is trial 34 with value: 4.15687381580361.
[I 2023-12-21 03:23:54,890] Trial 155 finished with value: 4.2345507314329165 and parameters: {'learning_rate': 0.07187495731612842, 'aft                                                                     _loss_distribution': 'logistic', 'aft_loss_distribution_scale': 0.7060078772917594, 'max_depth': 6, 'booster': 'dart', 'scale_pos_weight'                                                                     : 1.4948187550324876, 'alpha': 2.031873196282077, 'lambda': 8.10781680077131, 'eta': 0.5926513024096005, 'sampling_method': 'gradient_bas                                                                     ed', 'subsample': 0.20554835641187524, 'gamma': 0.31778922612237803}. Best is trial 34 with value: 4.15687381580361.
[I 2023-12-21 03:23:54,930] Trial 156 pruned. Trial was pruned at iteration 0.
[I 2023-12-21 03:23:54,969] Trial 157 pruned. Trial was pruned at iteration 0.
[I 2023-12-21 03:23:55,008] Trial 158 pruned. Trial was pruned at iteration 0.
[I 2023-12-21 03:23:55,047] Trial 159 pruned. Trial was pruned at iteration 0.
[I 2023-12-21 03:23:55,086] Trial 160 pruned. Trial was pruned at iteration 0.
[I 2023-12-21 03:23:58,145] Trial 161 pruned. Trial was pruned at iteration 92.
[I 2023-12-21 03:23:58,546] Trial 162 pruned. Trial was pruned at iteration 207.
[I 2023-12-21 03:23:58,586] Trial 163 pruned. Trial was pruned at iteration 0.
[I 2023-12-21 03:23:58,625] Trial 164 pruned. Trial was pruned at iteration 0.
[I 2023-12-21 03:23:58,663] Trial 165 pruned. Trial was pruned at iteration 0.
[I 2023-12-21 03:23:58,701] Trial 166 pruned. Trial was pruned at iteration 0.
[I 2023-12-21 03:23:58,740] Trial 167 pruned. Trial was pruned at iteration 0.
[I 2023-12-21 03:23:58,781] Trial 168 pruned. Trial was pruned at iteration 0.
[I 2023-12-21 03:23:58,820] Trial 169 pruned. Trial was pruned at iteration 0.
[I 2023-12-21 03:23:58,858] Trial 170 pruned. Trial was pruned at iteration 0.
[I 2023-12-21 03:23:58,900] Trial 171 pruned. Trial was pruned at iteration 1.
[I 2023-12-21 03:23:58,952] Trial 172 pruned. Trial was pruned at iteration 3.
[I 2023-12-21 03:23:58,992] Trial 173 pruned. Trial was pruned at iteration 0.
[I 2023-12-21 03:23:59,118] Trial 174 pruned. Trial was pruned at iteration 11.
