trn1 0.9519898926089703 n= 12664
trn2 0.9497947584464793 n= 3167
val 0.9535691724573594 n= 3166
tst 0.9645731863624711 n= 19505
pos-neg-ratio: 0.9519898926089703 250 trials during Optuna search
All avail dimensionality reduced word embedding
All avail dimensionality reduced word embedding
All avail dimensionality reduced word embedding
All avail dimensionality reduced word embedding
trn1
[I 2023-12-19 04:10:19,127] A new study created in memory with name: no-name-88abdb0d-4b7c-4a16-be76-6a1d88ab30dd
trn2
val
tst
[I 2023-12-19 04:10:20,824] Trial 0 finished with value: 5.863178715436581 and parameters: {'learning_rate': 0.6783689119410155, 'aft_loss_distribution': 'logistic', 'aft_loss_distribution_scale': 5.896048590533777, 'max_depth': 8, 'booster': 'gbtree', 'scale_pos_weight': 6.80775196864229, 'alpha': 5.741661171505197, 'lambda': 1.1699937474634707, 'eta': 0.16608091754546495, 'sampling_method': 'uniform', 'subsample': 0.3387704354530746, 'gamma': 6.352287361717069}. Best is trial 0 with value: 5.863178715436581.
[I 2023-12-19 04:10:27,133] Trial 1 finished with value: 5.298635888630766 and parameters: {'learning_rate': 0.5555541376847339, 'aft_loss_distribution': 'normal', 'aft_loss_distribution_scale': 5.12246664229259, 'max_depth': 3, 'booster': 'dart', 'scale_pos_weight': 5.106647351586721, 'alpha': 2.031305148076017, 'lambda': 3.0198818964376075, 'eta': 0.28243298263364924, 'sampling_method': 'uniform', 'subsample': 0.58386032134633, 'gamma': 9.885855261735237}. Best is trial 1 with value: 5.298635888630766.
[I 2023-12-19 04:10:30,156] Trial 2 finished with value: 4.951191969091519 and parameters: {'learning_rate': 0.08515340165108239, 'aft_loss_distribution': 'normal', 'aft_loss_distribution_scale': 0.4524991996254367, 'max_depth': 4, 'booster': 'gbtree', 'scale_pos_weight': 8.015306959875481, 'alpha': 2.067129365124874, 'lambda': 1.5211646320476155, 'eta': 0.17720354944738792, 'sampling_method': 'uniform', 'subsample': 0.8906847120684471, 'gamma': 6.024728015611112}. Best is trial 2 with value: 4.951191969091519.
[I 2023-12-19 04:10:34,773] Trial 3 finished with value: 4.742726460924852 and parameters: {'learning_rate': 0.17589097594582204, 'aft_loss_distribution': 'extreme', 'aft_loss_distribution_scale': 2.354292438793164, 'max_depth': 9, 'booster': 'gbtree', 'scale_pos_weight': 9.331083345087563, 'alpha': 3.1986963701290554, 'lambda': 5.619924487853198, 'eta': 0.8538355412664717, 'sampling_method': 'uniform', 'subsample': 0.5665061550087374, 'gamma': 9.478592969945124}. Best is trial 3 with value: 4.742726460924852.
[I 2023-12-19 04:10:49,519] Trial 4 finished with value: 5.8608957355382545 and parameters: {'learning_rate': 0.20217960685240124, 'aft_loss_distribution': 'normal', 'aft_loss_distribution_scale': 9.403106166251312, 'max_depth': 9, 'booster': 'dart', 'scale_pos_weight': 0.37857669999513693, 'alpha': 1.2490582423117562, 'lambda': 9.894781412972872, 'eta': 0.8284908402102856, 'sampling_method': 'uniform', 'subsample': 0.46939953274032187, 'gamma': 6.346892750822903}. Best is trial 3 with value: 4.742726460924852.
[I 2023-12-19 04:10:50,450] Trial 5 pruned. Trial was pruned at iteration 119.
[I 2023-12-19 04:10:50,464] Trial 6 pruned. Trial was pruned at iteration 0.
[I 2023-12-19 04:10:50,811] Trial 7 finished with value: inf and parameters: {'learning_rate': 0.4995633438013974, 'aft_loss_distribution': 'logistic', 'aft_loss_distribution_scale': 3.1493457578115573, 'max_depth': 9, 'booster': 'gbtree', 'scale_pos_weight': 8.47926753305352, 'alpha': 3.0354012170586095, 'lambda': 7.188358363097125, 'eta': 0.009515166461228075, 'sampling_method': 'uniform', 'subsample': 0.5449309147239708, 'gamma': 5.529511264897372}. Best is trial 3 with value: 4.742726460924852.
[I 2023-12-19 04:10:50,903] Trial 8 pruned. Trial was pruned at iteration 5.
[I 2023-12-19 04:10:51,028] Trial 9 pruned. Trial was pruned at iteration 26.
[I 2023-12-19 04:10:51,099] Trial 10 pruned. Trial was pruned at iteration 0.
[I 2023-12-19 04:10:51,163] Trial 11 pruned. Trial was pruned at iteration 0.
[I 2023-12-19 04:10:51,233] Trial 12 pruned. Trial was pruned at iteration 0.
[I 2023-12-19 04:10:51,754] Trial 13 finished with value: 4.465523464265459 and parameters: {'learning_rate': 0.2823846535789989, 'aft_loss_distribution': 'normal', 'aft_loss_distribution_scale': 1.8545385580744216, 'max_depth': 5, 'booster': 'gbtree', 'scale_pos_weight': 7.048663038966033, 'alpha': 7.264356240780499, 'lambda': 6.047310737130392, 'eta': 0.37828201751900226, 'sampling_method': 'uniform', 'subsample': 0.7816439391987569, 'gamma': 8.205768460245078}. Best is trial 13 with value: 4.465523464265459.
[I 2023-12-19 04:10:51,824] Trial 14 pruned. Trial was pruned at iteration 0.
[I 2023-12-19 04:10:52,452] Trial 15 finished with value: 4.463094979384054 and parameters: {'learning_rate': 0.38966640397498953, 'aft_loss_distribution': 'normal', 'aft_loss_distribution_scale': 1.8461028325503621, 'max_depth': 10, 'booster': 'gbtree', 'scale_pos_weight': 6.969140055998659, 'alpha': 7.06686095546295, 'lambda': 6.711810645554063, 'eta': 0.6894945374911834, 'sampling_method': 'uniform', 'subsample': 0.7206473188500129, 'gamma': 8.164365927976535}. Best is trial 15 with value: 4.463094979384054.
[I 2023-12-19 04:10:52,880] Trial 16 pruned. Trial was pruned at iteration 82.
[I 2023-12-19 04:10:52,964] Trial 17 pruned. Trial was pruned at iteration 0.
[I 2023-12-19 04:14:11,626] Trial 18 finished with value: 4.375945601782321 and parameters: {'learning_rate': 0.3641221482061754, 'aft_loss_distribution': 'normal', 'aft_loss_distribution_scale': 1.6312219444528624, 'max_depth': 8, 'booster': 'dart', 'scale_pos_weight': 7.221708432228727, 'alpha': 8.430335090788105, 'lambda': 4.622056302749522, 'eta': 0.36422245467678394, 'sampling_method': 'uniform', 'subsample': 0.40269160091916945, 'gamma': 3.1762851099317375}. Best is trial 18 with value: 4.375945601782321.
[I 2023-12-19 04:14:11,702] Trial 19 pruned. Trial was pruned at iteration 0.
[I 2023-12-19 04:14:15,667] Trial 20 pruned. Trial was pruned at iteration 68.
[I 2023-12-19 04:14:15,733] Trial 21 pruned. Trial was pruned at iteration 0.
[I 2023-12-19 04:15:33,850] Trial 22 finished with value: 4.661988247300252 and parameters: {'learning_rate': 0.17630201150219826, 'aft_loss_distribution': 'normal', 'aft_loss_distribution_scale': 2.438923687684683, 'max_depth': 5, 'booster': 'dart', 'scale_pos_weight': 5.912542533277826, 'alpha': 8.118102942106505, 'lambda': 5.082153867327264, 'eta': 0.3128111486333125, 'sampling_method': 'uniform', 'subsample': 0.9623832796676025, 'gamma': 7.427504934700013}. Best is trial 18 with value: 4.375945601782321.
[I 2023-12-19 04:15:34,011] Trial 23 pruned. Trial was pruned at iteration 8.
[I 2023-12-19 04:15:34,999] Trial 24 finished with value: 4.286654384665231 and parameters: {'learning_rate': 0.43778053613127565, 'aft_loss_distribution': 'normal', 'aft_loss_distribution_scale': 1.3773265772744718, 'max_depth': 9, 'booster': 'gbtree', 'scale_pos_weight': 6.971288919055468, 'alpha': 4.843815686031024, 'lambda': 2.4689773023813424, 'eta': 0.4937938329937272, 'sampling_method': 'uniform', 'subsample': 0.3589894942818396, 'gamma': 3.7547990892166645}. Best is trial 24 with value: 4.286654384665231.
[I 2023-12-19 04:15:35,158] Trial 25 pruned. Trial was pruned at iteration 6.
[I 2023-12-19 04:15:35,268] Trial 26 pruned. Trial was pruned at iteration 0.
[I 2023-12-19 04:15:35,366] Trial 27 pruned. Trial was pruned at iteration 0.
[I 2023-12-19 04:15:36,894] Trial 28 pruned. Trial was pruned at iteration 15.
[I 2023-12-19 04:15:37,004] Trial 29 pruned. Trial was pruned at iteration 0.
[I 2023-12-19 04:15:37,123] Trial 30 pruned. Trial was pruned at iteration 0.
[I 2023-12-19 04:15:39,145] Trial 31 finished with value: inf and parameters: {'learning_rate': 0.33659359986015164, 'aft_loss_distribution': 'normal', 'aft_loss_distribution_scale': 1.78468827786094, 'max_depth': 9, 'booster': 'gbtree', 'scale_pos_weight': 6.993774609339325, 'alpha': 6.222084874206224, 'lambda': 6.352902248815502, 'eta': 0.38054031501230773, 'sampling_method': 'uniform', 'subsample': 0.6388697209877736, 'gamma': 8.727545258162541}. Best is trial 24 with value: 4.286654384665231.
[I 2023-12-19 04:15:39,256] Trial 32 pruned. Trial was pruned at iteration 0.
[I 2023-12-19 04:15:39,367] Trial 33 pruned. Trial was pruned at iteration 0.
[I 2023-12-19 04:15:40,554] Trial 34 finished with value: 4.3739799503036645 and parameters: {'learning_rate': 0.44178864432502335, 'aft_loss_distribution': 'normal', 'aft_loss_distribution_scale': 1.6023931550522978, 'max_depth': 4, 'booster': 'gbtree', 'scale_pos_weight': 8.672269621074465, 'alpha': 7.862321922328043, 'lambda': 7.14818454051798, 'eta': 0.24206638109769635, 'sampling_method': 'uniform', 'subsample': 0.7787498947260671, 'gamma': 6.76155388897674}. Best is trial 24 with value: 4.286654384665231.
[I 2023-12-19 04:15:40,656] Trial 35 pruned. Trial was pruned at iteration 7.
[I 2023-12-19 04:15:40,735] Trial 36 pruned. Trial was pruned at iteration 0.
[I 2023-12-19 04:15:40,870] Trial 37 pruned. Trial was pruned at iteration 6.
[I 2023-12-19 04:15:40,970] Trial 38 pruned. Trial was pruned at iteration 3.
[I 2023-12-19 04:15:41,041] Trial 39 pruned. Trial was pruned at iteration 0.
[I 2023-12-19 04:15:41,111] Trial 40 pruned. Trial was pruned at iteration 0.
[I 2023-12-19 04:15:41,189] Trial 41 pruned. Trial was pruned at iteration 0.
[I 2023-12-19 04:15:41,320] Trial 42 pruned. Trial was pruned at iteration 12.
[I 2023-12-19 04:15:41,396] Trial 43 pruned. Trial was pruned at iteration 0.
[I 2023-12-19 04:15:41,468] Trial 44 pruned. Trial was pruned at iteration 0.
[I 2023-12-19 04:15:42,643] Trial 45 finished with value: 4.407248316129673 and parameters: {'learning_rate': 0.5085436384147172, 'aft_loss_distribution': 'normal', 'aft_loss_distribution_scale': 1.6945724213960704, 'max_depth': 6, 'booster': 'gbtree', 'scale_pos_weight': 9.082750866009333, 'alpha': 8.513432513287723, 'lambda': 7.485927216048211, 'eta': 0.3508542556604417, 'sampling_method': 'uniform', 'subsample': 0.8066267248311958, 'gamma': 5.879216794892408}. Best is trial 24 with value: 4.286654384665231.
[I 2023-12-19 04:15:42,717] Trial 46 pruned. Trial was pruned at iteration 0.
[I 2023-12-19 04:15:43,103] Trial 47 pruned. Trial was pruned at iteration 68.
[I 2023-12-19 04:15:43,193] Trial 48 pruned. Trial was pruned at iteration 2.
[I 2023-12-19 04:15:43,269] Trial 49 pruned. Trial was pruned at iteration 0.
[I 2023-12-19 04:15:43,930] Trial 50 finished with value: 4.369541913339272 and parameters: {'learning_rate': 0.586166253486811, 'aft_loss_distribution': 'normal', 'aft_loss_distribution_scale': 1.6107014930426362, 'max_depth': 8, 'booster': 'gbtree', 'scale_pos_weight': 7.8585621835065815, 'alpha': 1.6474582870977175, 'lambda': 9.494574683211159, 'eta': 0.5966889242381518, 'sampling_method': 'uniform', 'subsample': 0.7539568867876665, 'gamma': 4.681872445810488}. Best is trial 24 with value: 4.286654384665231.
[I 2023-12-19 04:15:44,750] Trial 51 finished with value: 4.341355134624674 and parameters: {'learning_rate': 0.6635967716715402, 'aft_loss_distribution': 'normal', 'aft_loss_distribution_scale': 1.5363682644582812, 'max_depth': 8, 'booster': 'gbtree', 'scale_pos_weight': 7.82307946844089, 'alpha': 1.7845908710232616, 'lambda': 9.444996266290191, 'eta': 0.6112650568447857, 'sampling_method': 'uniform', 'subsample': 0.7642105491017066, 'gamma': 4.434534731758035}. Best is trial 24 with value: 4.286654384665231.
[I 2023-12-19 04:15:45,734] Trial 52 finished with value: 4.339549730633124 and parameters: {'learning_rate': 0.6962423420234841, 'aft_loss_distribution': 'normal', 'aft_loss_distribution_scale': 1.535430274304099, 'max_depth': 8, 'booster': 'gbtree', 'scale_pos_weight': 7.679459482914035, 'alpha': 1.4930449550556704, 'lambda': 9.506805064038156, 'eta': 0.5929554616698853, 'sampling_method': 'uniform', 'subsample': 0.8762304020675595, 'gamma': 4.666933617533098}. Best is trial 24 with value: 4.286654384665231.
[I 2023-12-19 04:15:46,541] Trial 53 finished with value: 4.264219713152126 and parameters: {'learning_rate': 0.8671451690179366, 'aft_loss_distribution': 'normal', 'aft_loss_distribution_scale': 1.2830296292206558, 'max_depth': 8, 'booster': 'gbtree', 'scale_pos_weight': 7.733746616501081, 'alpha': 1.2530105785584975, 'lambda': 9.478984141945741, 'eta': 0.5986971340399928, 'sampling_method': 'uniform', 'subsample': 0.8693285918351495, 'gamma': 4.630550174469862}. Best is trial 53 with value: 4.264219713152126.
[I 2023-12-19 04:15:46,965] Trial 54 finished with value: inf and parameters: {'learning_rate': 0.8363205003455703, 'aft_loss_distribution': 'normal', 'aft_loss_distribution_scale': 1.1579771417544196, 'max_depth': 8, 'booster': 'gbtree', 'scale_pos_weight': 7.698341300368196, 'alpha': 1.2808200678398158, 'lambda': 9.454522458145036, 'eta': 0.600260639252351, 'sampling_method': 'uniform', 'subsample': 0.9071633213058149, 'gamma': 4.672770697021049}. Best is trial 53 with value: 4.264219713152126.
[I 2023-12-19 04:15:47,059] Trial 55 pruned. Trial was pruned at iteration 2.
[I 2023-12-19 04:15:47,145] Trial 56 pruned. Trial was pruned at iteration 0.
[I 2023-12-19 04:15:47,226] Trial 57 pruned. Trial was pruned at iteration 0.
[I 2023-12-19 04:15:47,320] Trial 58 pruned. Trial was pruned at iteration 3.
[I 2023-12-19 04:15:47,400] Trial 59 pruned. Trial was pruned at iteration 0.
[I 2023-12-19 04:15:47,881] Trial 60 finished with value: inf and parameters: {'learning_rate': 0.7709699501129699, 'aft_loss_distribution': 'normal', 'aft_loss_distribution_scale': 1.4387463681080541, 'max_depth': 9, 'booster': 'gbtree', 'scale_pos_weight': 6.419829066298903, 'alpha': 0.8351468151934884, 'lambda': 9.007187688208075, 'eta': 0.6646733588844423, 'sampling_method': 'uniform', 'subsample': 0.7604996256955331, 'gamma': 2.810654381249809}. Best is trial 53 with value: 4.264219713152126.
[I 2023-12-19 04:16:01,996] Trial 61 finished with value: 4.340644473488732 and parameters: {'learning_rate': 0.5846434245652902, 'aft_loss_distribution': 'normal', 'aft_loss_distribution_scale': 1.5114235515066559, 'max_depth': 8, 'booster': 'dart', 'scale_pos_weight': 7.333522814683533, 'alpha': 1.8948273701317888, 'lambda': 9.65975689786766, 'eta': 0.5999443582860663, 'sampling_method': 'uniform', 'subsample': 0.3214246029639042, 'gamma': 3.4777892673850674}. Best is trial 53 with value: 4.264219713152126.
[I 2023-12-19 04:16:02,078] Trial 62 pruned. Trial was pruned at iteration 0.
[I 2023-12-19 04:16:13,755] Trial 63 finished with value: 4.353093487318389 and parameters: {'learning_rate': 0.6783768189558805, 'aft_loss_distribution': 'normal', 'aft_loss_distribution_scale': 1.517185004849693, 'max_depth': 8, 'booster': 'dart', 'scale_pos_weight': 8.204108600783105, 'alpha': 1.7484809965407115, 'lambda': 9.41127450119275, 'eta': 0.5699105821717436, 'sampling_method': 'uniform', 'subsample': 0.20016684202718607, 'gamma': 4.356332859270822}. Best is trial 53 with value: 4.264219713152126.
[I 2023-12-19 04:16:13,904] Trial 64 pruned. Trial was pruned at iteration 1.
[I 2023-12-19 04:16:14,082] Trial 65 pruned. Trial was pruned at iteration 2.
[I 2023-12-19 04:16:14,267] Trial 66 pruned. Trial was pruned at iteration 0.
[I 2023-12-19 04:16:14,709] Trial 67 pruned. Trial was pruned at iteration 3.
[I 2023-12-19 04:16:22,275] Trial 68 finished with value: inf and parameters: {'learning_rate': 0.7483473772937739, 'aft_loss_distribution': 'normal', 'aft_loss_distribution_scale': 1.4151253202431873, 'max_depth': 9, 'booster': 'dart', 'scale_pos_weight': 5.579102030631055, 'alpha': 2.7165094109379, 'lambda': 9.618538358995568, 'eta': 0.4861018244532742, 'sampling_method': 'uniform', 'subsample': 0.13725975949549804, 'gamma': 4.843153928448551}. Best is trial 53 with value: 4.264219713152126.
[I 2023-12-19 04:16:22,943] Trial 69 pruned. Trial was pruned at iteration 2.
[I 2023-12-19 04:16:23,139] Trial 70 pruned. Trial was pruned at iteration 0.
[I 2023-12-19 04:16:23,361] Trial 71 pruned. Trial was pruned at iteration 4.
[I 2023-12-19 04:16:25,582] Trial 72 finished with value: 4.357472847764216 and parameters: {'learning_rate': 0.6460781365907086, 'aft_loss_distribution': 'normal', 'aft_loss_distribution_scale': 1.5792833375608388, 'max_depth': 9, 'booster': 'gbtree', 'scale_pos_weight': 8.321494349016069, 'alpha': 0.43635871429568607, 'lambda': 9.214135317654332, 'eta': 0.585874879960872, 'sampling_method': 'uniform', 'subsample': 0.817454167061018, 'gamma': 4.163190800219307}. Best is trial 53 with value: 4.264219713152126.
[I 2023-12-19 04:16:25,695] Trial 73 pruned. Trial was pruned at iteration 1.
[I 2023-12-19 04:16:26,190] Trial 74 finished with value: inf and parameters: {'learning_rate': 0.6965307271528925, 'aft_loss_distribution': 'normal', 'aft_loss_distribution_scale': 1.4399045987590844, 'max_depth': 9, 'booster': 'gbtree', 'scale_pos_weight': 7.31441094004947, 'alpha': 0.5355762604308668, 'lambda': 9.589676897800883, 'eta': 0.5069399219869604, 'sampling_method': 'uniform', 'subsample': 0.7330255693000707, 'gamma': 3.068206605640241}. Best is trial 53 with value: 4.264219713152126.
[I 2023-12-19 04:16:26,270] Trial 75 pruned. Trial was pruned at iteration 0.
[I 2023-12-19 04:16:26,355] Trial 76 pruned. Trial was pruned at iteration 0.
[I 2023-12-19 04:16:26,437] Trial 77 pruned. Trial was pruned at iteration 0.
[I 2023-12-19 04:16:26,530] Trial 78 pruned. Trial was pruned at iteration 2.
[I 2023-12-19 04:16:26,615] Trial 79 pruned. Trial was pruned at iteration 0.
[I 2023-12-19 04:16:26,733] Trial 80 pruned. Trial was pruned at iteration 2.
[I 2023-12-19 04:16:26,809] Trial 81 pruned. Trial was pruned at iteration 0.
[I 2023-12-19 04:16:26,897] Trial 82 pruned. Trial was pruned at iteration 0.
[I 2023-12-19 04:16:27,418] Trial 83 finished with value: 4.347970273919813 and parameters: {'learning_rate': 0.6022535042423233, 'aft_loss_distribution': 'normal', 'aft_loss_distribution_scale': 1.559343460510687, 'max_depth': 8, 'booster': 'gbtree', 'scale_pos_weight': 8.529801937418883, 'alpha': 1.8949831895296692, 'lambda': 3.3539054065868954, 'eta': 0.5007182112041024, 'sampling_method': 'uniform', 'subsample': 0.6902225921817084, 'gamma': 4.132068050744308}. Best is trial 53 with value: 4.264219713152126.
[I 2023-12-19 04:16:28,051] Trial 84 finished with value: inf and parameters: {'learning_rate': 0.5995256925597654, 'aft_loss_distribution': 'normal', 'aft_loss_distribution_scale': 1.1837954355398401, 'max_depth': 9, 'booster': 'gbtree', 'scale_pos_weight': 7.45895420427421, 'alpha': 1.983125937622582, 'lambda': 3.3474362031867133, 'eta': 0.49794021162208435, 'sampling_method': 'uniform', 'subsample': 0.6786067494812196, 'gamma': 2.9149802222835834}. Best is trial 53 with value: 4.264219713152126.
[I 2023-12-19 04:16:28,170] Trial 85 pruned. Trial was pruned at iteration 3.
[I 2023-12-19 04:16:28,255] Trial 86 pruned. Trial was pruned at iteration 1.
[I 2023-12-19 04:16:28,350] Trial 87 pruned. Trial was pruned at iteration 2.
[I 2023-12-19 04:16:28,430] Trial 88 pruned. Trial was pruned at iteration 1.
[I 2023-12-19 04:16:28,509] Trial 89 pruned. Trial was pruned at iteration 0.
[I 2023-12-19 04:16:28,584] Trial 90 pruned. Trial was pruned at iteration 0.
[I 2023-12-19 04:16:28,660] Trial 91 pruned. Trial was pruned at iteration 0.
[I 2023-12-19 04:16:29,074] Trial 92 finished with value: inf and parameters: {'learning_rate': 0.5589461730368264, 'aft_loss_distribution': 'normal', 'aft_loss_distribution_scale': 1.5422022053224376, 'max_depth': 9, 'booster': 'gbtree', 'scale_pos_weight': 8.61069185923953, 'alpha': 3.1657254504347523, 'lambda': 8.29141469975636, 'eta': 0.6367098003631344, 'sampling_method': 'uniform', 'subsample': 0.7491315634325003, 'gamma': 5.539819003982518}. Best is trial 53 with value: 4.264219713152126.
[I 2023-12-19 04:16:29,147] Trial 93 pruned. Trial was pruned at iteration 0.
[I 2023-12-19 04:16:29,237] Trial 94 pruned. Trial was pruned at iteration 2.
[I 2023-12-19 04:16:29,315] Trial 95 pruned. Trial was pruned at iteration 0.
[I 2023-12-19 04:16:29,396] Trial 96 pruned. Trial was pruned at iteration 0.
[I 2023-12-19 04:16:29,469] Trial 97 pruned. Trial was pruned at iteration 0.
[I 2023-12-19 04:16:29,553] Trial 98 pruned. Trial was pruned at iteration 1.
[I 2023-12-19 04:16:29,638] Trial 99 pruned. Trial was pruned at iteration 0.
[I 2023-12-19 04:16:30,181] Trial 100 finished with value: inf and parameters: {'learning_rate': 0.7234823103282543, 'aft_loss_distribution': 'normal', 'aft_loss_distribution_scale': 0.9807124401736947, 'max_depth': 4, 'booster': 'gbtree', 'scale_pos_weight': 3.4517344317670826, 'alpha': 3.6863745286744387, 'lambda': 4.109470710521455, 'eta': 0.21283221593703405, 'sampling_method': 'uniform', 'subsample': 0.7796018829661963, 'gamma': 4.745573138323583}. Best is trial 53 with value: 4.264219713152126.
[I 2023-12-19 04:16:30,258] Trial 101 pruned. Trial was pruned at iteration 0.
[I 2023-12-19 04:16:30,335] Trial 102 pruned. Trial was pruned at iteration 0.
[I 2023-12-19 04:16:30,416] Trial 103 pruned. Trial was pruned at iteration 0.
[I 2023-12-19 04:16:30,494] Trial 104 pruned. Trial was pruned at iteration 0.
[I 2023-12-19 04:16:30,574] Trial 105 pruned. Trial was pruned at iteration 0.
[I 2023-12-19 04:16:30,656] Trial 106 pruned. Trial was pruned at iteration 0.
[I 2023-12-19 04:16:30,736] Trial 107 pruned. Trial was pruned at iteration 0.
[I 2023-12-19 04:16:30,822] Trial 108 pruned. Trial was pruned at iteration 0.
[I 2023-12-19 04:16:30,915] Trial 109 pruned. Trial was pruned at iteration 0.
[I 2023-12-19 04:16:30,998] Trial 110 pruned. Trial was pruned at iteration 0.
[I 2023-12-19 04:16:31,088] Trial 111 pruned. Trial was pruned at iteration 1.
[I 2023-12-19 04:16:31,169] Trial 112 pruned. Trial was pruned at iteration 0.
