[I 2023-12-21 04:41:40,940] Trial 281 finished with value: 2.0260843560516584 and parameters: {'learning_rate': 0.27460498082849, 'aft_lo                                                                     ss_distribution': 'logistic', 'aft_loss_distribution_scale': 1.1084613661807579, 'max_depth': 7, 'booster': 'dart', 'scale_pos_weight': 2                                                                     .171175532314047, 'alpha': 3.736340267273766, 'lambda': 1.2816188533587678, 'eta': 0.36574663429116794, 'sampling_method': 'uniform', 'su                                                                     bsample': 0.3340457565576878, 'gamma': 8.591118128565014}. Best is trial 1 with value: 2.009838820527457.
[I 2023-12-21 04:41:44,988] Trial 282 finished with value: 2.0209410925580125 and parameters: {'learning_rate': 0.26683816331726945, 'aft                                                                     _loss_distribution': 'logistic', 'aft_loss_distribution_scale': 1.0852563840576501, 'max_depth': 7, 'booster': 'dart', 'scale_pos_weight'                                                                     : 2.1796105069249205, 'alpha': 3.689777650584853, 'lambda': 1.2493763683261112, 'eta': 0.3678693303970683, 'sampling_method': 'uniform',                                                                      'subsample': 0.3558811579876103, 'gamma': 8.601659762885657}. Best is trial 1 with value: 2.009838820527457.
[I 2023-12-21 04:41:48,714] Trial 283 finished with value: 2.0240014398515647 and parameters: {'learning_rate': 0.2724922590036146, 'aft_                                                                     loss_distribution': 'logistic', 'aft_loss_distribution_scale': 1.0857005682083802, 'max_depth': 7, 'booster': 'dart', 'scale_pos_weight':                                                                      2.3776336556355853, 'alpha': 3.634924559450362, 'lambda': 1.2219726344187636, 'eta': 0.36407473392344025, 'sampling_method': 'uniform',                                                                      'subsample': 0.3591674822713685, 'gamma': 8.867009532775299}. Best is trial 1 with value: 2.009838820527457.
[I 2023-12-21 04:41:48,759] Trial 284 pruned. Trial was pruned at iteration 0.
[I 2023-12-21 04:41:48,803] Trial 285 pruned. Trial was pruned at iteration 0.
[I 2023-12-21 04:41:48,848] Trial 286 pruned. Trial was pruned at iteration 0.
[I 2023-12-21 04:41:48,891] Trial 287 pruned. Trial was pruned at iteration 0.
[I 2023-12-21 04:41:48,937] Trial 288 pruned. Trial was pruned at iteration 0.
[I 2023-12-21 04:41:48,982] Trial 289 pruned. Trial was pruned at iteration 0.
[I 2023-12-21 04:41:49,229] Trial 290 finished with value: 2.0251390776228346 and parameters: {'learning_rate': 0.28100309615568897, 'aft                                                                     _loss_distribution': 'logistic', 'aft_loss_distribution_scale': 1.106334366559354, 'max_depth': 7, 'booster': 'gbtree', 'scale_pos_weight                                                                     ': 2.1738769356535466, 'alpha': 3.5648466225766495, 'lambda': 1.4293472931713043, 'eta': 0.37234367477909885, 'sampling_method': 'uniform                                                                     ', 'subsample': 0.36695716104038617, 'gamma': 9.107386007955887}. Best is trial 1 with value: 2.009838820527457.
[I 2023-12-21 04:41:49,422] Trial 291 finished with value: 2.0270220732077555 and parameters: {'learning_rate': 0.2864941175514375, 'aft_                                                                     loss_distribution': 'logistic', 'aft_loss_distribution_scale': 1.1222570852255247, 'max_depth': 7, 'booster': 'gbtree', 'scale_pos_weight                                                                     ': 2.166509669539332, 'alpha': 3.622079279418815, 'lambda': 1.3608530644200907, 'eta': 0.37895232253304706, 'sampling_method': 'uniform',                                                                      'subsample': 0.36825875802075037, 'gamma': 9.076682707084354}. Best is trial 1 with value: 2.009838820527457.
[I 2023-12-21 04:41:49,630] Trial 292 finished with value: 2.0315930674539695 and parameters: {'learning_rate': 0.2810539925528635, 'aft_                                                                     loss_distribution': 'logistic', 'aft_loss_distribution_scale': 1.1126263272544978, 'max_depth': 7, 'booster': 'gbtree', 'scale_pos_weight                                                                     ': 2.175676384187722, 'alpha': 3.4124165346575435, 'lambda': 1.3812393316919962, 'eta': 0.37169533042299613, 'sampling_method': 'uniform'                                                                     , 'subsample': 0.36974296622743597, 'gamma': 9.468767383309583}. Best is trial 1 with value: 2.009838820527457.
[I 2023-12-21 04:41:49,675] Trial 293 pruned. Trial was pruned at iteration 0.
[I 2023-12-21 04:41:49,721] Trial 294 pruned. Trial was pruned at iteration 0.
[I 2023-12-21 04:41:50,032] Trial 295 finished with value: 2.0168308458360777 and parameters: {'learning_rate': 0.23246532847750018, 'aft                                                                     _loss_distribution': 'logistic', 'aft_loss_distribution_scale': 1.0304798315501011, 'max_depth': 7, 'booster': 'gbtree', 'scale_pos_weigh                                                                     t': 2.379056887342606, 'alpha': 3.5031097662123867, 'lambda': 1.41046011905105, 'eta': 0.3719398681774935, 'sampling_method': 'uniform',                                                                      'subsample': 0.33782078518489445, 'gamma': 9.121761641217851}. Best is trial 1 with value: 2.009838820527457.
[I 2023-12-21 04:41:50,334] Trial 296 finished with value: 2.021956472758565 and parameters: {'learning_rate': 0.24555554760788662, 'aft_                                                                     loss_distribution': 'logistic', 'aft_loss_distribution_scale': 1.1118366252875787, 'max_depth': 7, 'booster': 'gbtree', 'scale_pos_weight                                                                     ': 2.369131004456115, 'alpha': 3.4303708826028023, 'lambda': 1.3862268896951269, 'eta': 0.39877802381111777, 'sampling_method': 'uniform'                                                                     , 'subsample': 0.30239305547552475, 'gamma': 9.518899907389825}. Best is trial 1 with value: 2.009838820527457.
[I 2023-12-21 04:41:50,378] Trial 297 pruned. Trial was pruned at iteration 0.
[I 2023-12-21 04:41:50,423] Trial 298 pruned. Trial was pruned at iteration 0.
[I 2023-12-21 04:41:50,468] Trial 299 pruned. Trial was pruned at iteration 0.
[I 2023-12-21 04:41:50,514] Trial 300 pruned. Trial was pruned at iteration 0.
[I 2023-12-21 04:41:50,557] Trial 301 pruned. Trial was pruned at iteration 0.
[I 2023-12-21 04:41:50,604] Trial 302 pruned. Trial was pruned at iteration 0.
[I 2023-12-21 04:41:50,894] Trial 303 finished with value: 2.0257811052946795 and parameters: {'learning_rate': 0.2686672031691264, 'aft_                                                                     loss_distribution': 'logistic', 'aft_loss_distribution_scale': 1.1160454163769495, 'max_depth': 8, 'booster': 'gbtree', 'scale_pos_weight                                                                     ': 2.159303374130934, 'alpha': 3.453221489917862, 'lambda': 1.344396064464104, 'eta': 0.3622126563433323, 'sampling_method': 'uniform', '                                                                     subsample': 0.37187489369843807, 'gamma': 8.742560872220078}. Best is trial 1 with value: 2.009838820527457.
[I 2023-12-21 04:41:50,945] Trial 304 pruned. Trial was pruned at iteration 0.
[I 2023-12-21 04:41:50,987] Trial 305 pruned. Trial was pruned at iteration 0.
[I 2023-12-21 04:41:51,033] Trial 306 pruned. Trial was pruned at iteration 0.
[I 2023-12-21 04:41:51,076] Trial 307 pruned. Trial was pruned at iteration 0.
[I 2023-12-21 04:41:51,120] Trial 308 pruned. Trial was pruned at iteration 0.
[I 2023-12-21 04:41:51,311] Trial 309 finished with value: 2.0338633235451016 and parameters: {'learning_rate': 0.30430723468506354, 'aft                                                                     _loss_distribution': 'logistic', 'aft_loss_distribution_scale': 1.1453308206584798, 'max_depth': 8, 'booster': 'gbtree', 'scale_pos_weigh                                                                     t': 2.1581728062230163, 'alpha': 2.806187071472074, 'lambda': 1.320429422500314, 'eta': 0.3753647240073221, 'sampling_method': 'uniform',                                                                      'subsample': 0.28065876003993284, 'gamma': 8.54878650608157}. Best is trial 1 with value: 2.009838820527457.
[I 2023-12-21 04:41:51,355] Trial 310 pruned. Trial was pruned at iteration 0.
[I 2023-12-21 04:41:51,403] Trial 311 pruned. Trial was pruned at iteration 0.
[I 2023-12-21 04:41:51,451] Trial 312 pruned. Trial was pruned at iteration 0.
[I 2023-12-21 04:41:51,628] Trial 313 finished with value: inf and parameters: {'learning_rate': 0.2839033261319979, 'aft_loss_distributi                                                                     on': 'logistic', 'aft_loss_distribution_scale': 1.0758062479919928, 'max_depth': 8, 'booster': 'gbtree', 'scale_pos_weight': 2.2717472478                                                                     823373, 'alpha': 3.27722691902179, 'lambda': 1.3772216573441538, 'eta': 0.3183612102613283, 'sampling_method': 'uniform', 'subsample': 0.                                                                     37173154258643204, 'gamma': 8.660809917093335}. Best is trial 1 with value: 2.009838820527457.
[I 2023-12-21 04:41:51,840] Trial 314 finished with value: 2.0418442160862074 and parameters: {'learning_rate': 0.3173688172705961, 'aft_                                                                     loss_distribution': 'logistic', 'aft_loss_distribution_scale': 1.1968729802177696, 'max_depth': 8, 'booster': 'gbtree', 'scale_pos_weight                                                                     ': 2.5154384323460452, 'alpha': 3.8960000595627755, 'lambda': 0.5420304039702011, 'eta': 0.344010592073226, 'sampling_method': 'uniform',                                                                      'subsample': 0.3871521480057892, 'gamma': 9.09807010020828}. Best is trial 1 with value: 2.009838820527457.
[I 2023-12-21 04:41:51,887] Trial 315 pruned. Trial was pruned at iteration 0.
[I 2023-12-21 04:41:52,066] Trial 316 finished with value: 2.0350662388184486 and parameters: {'learning_rate': 0.3173036167431188, 'aft_                                                                     loss_distribution': 'logistic', 'aft_loss_distribution_scale': 1.1588112615223138, 'max_depth': 8, 'booster': 'gbtree', 'scale_pos_weight                                                                     ': 2.3507647545762382, 'alpha': 3.9149006557625623, 'lambda': 0.8709873353474293, 'eta': 0.4128124268755496, 'sampling_method': 'uniform'                                                                     , 'subsample': 0.352612164934874, 'gamma': 9.291156683257695}. Best is trial 1 with value: 2.009838820527457.
[I 2023-12-21 04:41:52,111] Trial 317 pruned. Trial was pruned at iteration 0.
[I 2023-12-21 04:41:52,357] Trial 318 finished with value: 2.0271502557169447 and parameters: {'learning_rate': 0.2952070492992027, 'aft_                                                                     loss_distribution': 'logistic', 'aft_loss_distribution_scale': 1.1309546788119897, 'max_depth': 8, 'booster': 'gbtree', 'scale_pos_weight                                                                     ': 2.4030768070376647, 'alpha': 3.6439585738069677, 'lambda': 0.9010626667037795, 'eta': 0.41071699918461274, 'sampling_method': 'uniform                                                                     ', 'subsample': 0.3658992647191879, 'gamma': 9.249489546311679}. Best is trial 1 with value: 2.009838820527457.
[I 2023-12-21 04:41:52,729] Trial 319 pruned. Trial was pruned at iteration 254.
[I 2023-12-21 04:41:52,777] Trial 320 pruned. Trial was pruned at iteration 0.
[I 2023-12-21 04:41:52,819] Trial 321 pruned. Trial was pruned at iteration 0.
[I 2023-12-21 04:41:52,867] Trial 322 pruned. Trial was pruned at iteration 0.
[I 2023-12-21 04:41:52,914] Trial 323 pruned. Trial was pruned at iteration 0.
[I 2023-12-21 04:41:52,960] Trial 324 pruned. Trial was pruned at iteration 0.
[I 2023-12-21 04:41:53,005] Trial 325 pruned. Trial was pruned at iteration 0.
[I 2023-12-21 04:41:53,051] Trial 326 pruned. Trial was pruned at iteration 0.
[I 2023-12-21 04:41:53,345] Trial 327 finished with value: 2.02955592777105 and parameters: {'learning_rate': 0.3083513863873445, 'aft_lo                                                                     ss_distribution': 'logistic', 'aft_loss_distribution_scale': 1.1351012767293864, 'max_depth': 8, 'booster': 'gbtree', 'scale_pos_weight':                                                                      2.235791642692371, 'alpha': 4.012360492271065, 'lambda': 1.4084757455569934, 'eta': 0.4194370956965405, 'sampling_method': 'uniform', 's                                                                     ubsample': 0.35334424984392526, 'gamma': 8.599067298652653}. Best is trial 1 with value: 2.009838820527457.
[I 2023-12-21 04:41:53,395] Trial 328 pruned. Trial was pruned at iteration 0.
[I 2023-12-21 04:41:53,584] Trial 329 finished with value: 2.0226568190622127 and parameters: {'learning_rate': 0.2516086332765025, 'aft_                                                                     loss_distribution': 'logistic', 'aft_loss_distribution_scale': 1.1226142173490674, 'max_depth': 8, 'booster': 'gbtree', 'scale_pos_weight                                                                     ': 2.4454126567429353, 'alpha': 3.427051976069712, 'lambda': 0.8480149418982815, 'eta': 0.3729809307963088, 'sampling_method': 'uniform',                                                                      'subsample': 0.336366503968917, 'gamma': 8.560081541629431}. Best is trial 1 with value: 2.009838820527457.
[I 2023-12-21 04:41:53,630] Trial 330 pruned. Trial was pruned at iteration 0.
[I 2023-12-21 04:41:53,673] Trial 331 pruned. Trial was pruned at iteration 0.
[I 2023-12-21 04:41:53,717] Trial 332 pruned. Trial was pruned at iteration 0.
[I 2023-12-21 04:41:53,766] Trial 333 pruned. Trial was pruned at iteration 0.
[I 2023-12-21 04:41:53,812] Trial 334 pruned. Trial was pruned at iteration 0.
[I 2023-12-21 04:41:53,859] Trial 335 pruned. Trial was pruned at iteration 0.
[I 2023-12-21 04:41:53,910] Trial 336 pruned. Trial was pruned at iteration 0.
[I 2023-12-21 04:41:54,076] Trial 337 finished with value: 2.02276400465486 and parameters: {'learning_rate': 0.2816078697080573, 'aft_lo                                                                     ss_distribution': 'logistic', 'aft_loss_distribution_scale': 1.1330554878783794, 'max_depth': 8, 'booster': 'gbtree', 'scale_pos_weight':                                                                      2.31974659491023, 'alpha': 3.8232890419262366, 'lambda': 1.5196629567703106, 'eta': 0.3356003189674554, 'sampling_method': 'uniform', 's                                                                     ubsample': 0.29172600514773644, 'gamma': 9.334909281857422}. Best is trial 1 with value: 2.009838820527457.
[I 2023-12-21 04:41:54,122] Trial 338 pruned. Trial was pruned at iteration 0.
[I 2023-12-21 04:41:54,166] Trial 339 pruned. Trial was pruned at iteration 0.
[I 2023-12-21 04:41:54,214] Trial 340 pruned. Trial was pruned at iteration 0.
[I 2023-12-21 04:41:54,419] Trial 341 finished with value: 2.031927195381566 and parameters: {'learning_rate': 0.2875606238531025, 'aft_l                                                                     oss_distribution': 'logistic', 'aft_loss_distribution_scale': 1.1896121664966486, 'max_depth': 8, 'booster': 'gbtree', 'scale_pos_weight'                                                                     : 2.6305781501125836, 'alpha': 4.042898826558535, 'lambda': 1.0837661558574898, 'eta': 0.37751581588798067, 'sampling_method': 'uniform',                                                                      'subsample': 0.2877046060444488, 'gamma': 9.611880447889257}. Best is trial 1 with value: 2.009838820527457.
[I 2023-12-21 04:41:54,468] Trial 342 pruned. Trial was pruned at iteration 0.
[I 2023-12-21 04:41:54,512] Trial 343 pruned. Trial was pruned at iteration 0.
[I 2023-12-21 04:41:54,560] Trial 344 pruned. Trial was pruned at iteration 0.
[I 2023-12-21 04:41:54,724] Trial 345 finished with value: 2.0454261028273977 and parameters: {'learning_rate': 0.2999264692490746, 'aft_                                                                     loss_distribution': 'logistic', 'aft_loss_distribution_scale': 1.231816532848853, 'max_depth': 8, 'booster': 'gbtree', 'scale_pos_weight'                                                                     : 2.134003177425784, 'alpha': 4.049131787707003, 'lambda': 1.593721567954959, 'eta': 0.36655172191388175, 'sampling_method': 'uniform', '                                                                     subsample': 0.25675556805009614, 'gamma': 9.441077821768635}. Best is trial 1 with value: 2.009838820527457.
[I 2023-12-21 04:41:54,770] Trial 346 pruned. Trial was pruned at iteration 0.
[I 2023-12-21 04:41:54,819] Trial 347 pruned. Trial was pruned at iteration 0.
[I 2023-12-21 04:41:54,865] Trial 348 pruned. Trial was pruned at iteration 0.
[I 2023-12-21 04:41:55,052] Trial 349 finished with value: 2.03130462827913 and parameters: {'learning_rate': 0.29968701056033015, 'aft_l                                                                     oss_distribution': 'logistic', 'aft_loss_distribution_scale': 1.1513774885331165, 'max_depth': 8, 'booster': 'gbtree', 'scale_pos_weight'                                                                     : 2.121910098731157, 'alpha': 2.9165799357968822, 'lambda': 1.428180223817249, 'eta': 0.35908452522582224, 'sampling_method': 'uniform',                                                                      'subsample': 0.2812528812439633, 'gamma': 9.306957942059125}. Best is trial 1 with value: 2.009838820527457.
[I 2023-12-21 04:41:55,099] Trial 350 pruned. Trial was pruned at iteration 0.
[I 2023-12-21 04:41:55,148] Trial 351 pruned. Trial was pruned at iteration 0.
[I 2023-12-21 04:41:55,198] Trial 352 pruned. Trial was pruned at iteration 0.
[I 2023-12-21 04:41:55,245] Trial 353 pruned. Trial was pruned at iteration 0.
[I 2023-12-21 04:41:55,290] Trial 354 pruned. Trial was pruned at iteration 0.
[I 2023-12-21 04:41:55,336] Trial 355 pruned. Trial was pruned at iteration 0.
[I 2023-12-21 04:41:55,584] Trial 356 pruned. Trial was pruned at iteration 127.
[I 2023-12-21 04:41:55,632] Trial 357 pruned. Trial was pruned at iteration 0.
[I 2023-12-21 04:41:55,677] Trial 358 pruned. Trial was pruned at iteration 0.
[I 2023-12-21 04:41:55,871] Trial 359 finished with value: 2.045678405411166 and parameters: {'learning_rate': 0.330829845766322, 'aft_lo                                                                     ss_distribution': 'logistic', 'aft_loss_distribution_scale': 1.2316428900238299, 'max_depth': 6, 'booster': 'gbtree', 'scale_pos_weight':                                                                      2.2852310594101706, 'alpha': 3.370088837312247, 'lambda': 1.104406865927322, 'eta': 0.3534290316626293, 'sampling_method': 'uniform', 's                                                                     ubsample': 0.26119104195609716, 'gamma': 9.157514471998125}. Best is trial 1 with value: 2.009838820527457.
[I 2023-12-21 04:41:55,919] Trial 360 pruned. Trial was pruned at iteration 0.
[I 2023-12-21 04:41:55,967] Trial 361 pruned. Trial was pruned at iteration 0.
[I 2023-12-21 04:41:56,012] Trial 362 pruned. Trial was pruned at iteration 0.
[I 2023-12-21 04:41:56,059] Trial 363 pruned. Trial was pruned at iteration 0.
[I 2023-12-21 04:41:56,106] Trial 364 pruned. Trial was pruned at iteration 0.
[I 2023-12-21 04:41:56,154] Trial 365 pruned. Trial was pruned at iteration 0.
[I 2023-12-21 04:41:56,202] Trial 366 pruned. Trial was pruned at iteration 0.
[I 2023-12-21 04:41:56,420] Trial 367 pruned. Trial was pruned at iteration 127.
[I 2023-12-21 04:41:56,469] Trial 368 pruned. Trial was pruned at iteration 0.
[I 2023-12-21 04:41:56,516] Trial 369 pruned. Trial was pruned at iteration 0.
[I 2023-12-21 04:41:56,562] Trial 370 pruned. Trial was pruned at iteration 0.
[I 2023-12-21 04:41:56,611] Trial 371 pruned. Trial was pruned at iteration 0.
[I 2023-12-21 04:41:56,657] Trial 372 pruned. Trial was pruned at iteration 0.
[I 2023-12-21 04:41:56,703] Trial 373 pruned. Trial was pruned at iteration 0.
