[I 2023-12-21 03:57:35,880] Trial 101 finished with value: 4.336349083644652 and parameters: {'learning_rate': 0.15888994644852406, 'aft_                                                                     loss_distribution': 'logistic', 'aft_loss_distribution_scale': 0.8295693578911759, 'max_depth': 4, 'booster': 'gbtree', 'scale_pos_weight                                                                     ': 0.9212561567997515, 'alpha': 3.4624229661150734, 'lambda': 0.34628370886230075, 'eta': 0.519713568639636, 'sampling_method': 'gradient                                                                     _based', 'subsample': 0.3267140041434564, 'gamma': 0.9745336106362102}. Best is trial 70 with value: 4.247937146318312.
[I 2023-12-21 03:57:35,914] Trial 102 pruned. Trial was pruned at iteration 0.
[I 2023-12-21 03:57:36,225] Trial 103 finished with value: 4.242284351281956 and parameters: {'learning_rate': 0.07888008564395385, 'aft_                                                                     loss_distribution': 'logistic', 'aft_loss_distribution_scale': 0.6644017220834453, 'max_depth': 4, 'booster': 'gbtree', 'scale_pos_weight                                                                     ': 0.3299821609787366, 'alpha': 2.8584892757012446, 'lambda': 1.1235926262401206, 'eta': 0.49631863050054426, 'sampling_method': 'gradien                                                                     t_based', 'subsample': 0.4181118144608411, 'gamma': 0.2072609197732702}. Best is trial 103 with value: 4.242284351281956.
[I 2023-12-21 03:57:36,259] Trial 104 pruned. Trial was pruned at iteration 0.
[I 2023-12-21 03:57:36,295] Trial 105 pruned. Trial was pruned at iteration 0.
[I 2023-12-21 03:57:36,329] Trial 106 pruned. Trial was pruned at iteration 0.
[I 2023-12-21 03:57:36,363] Trial 107 pruned. Trial was pruned at iteration 0.
[I 2023-12-21 03:57:36,397] Trial 108 pruned. Trial was pruned at iteration 0.
[I 2023-12-21 03:57:36,432] Trial 109 pruned. Trial was pruned at iteration 0.
[I 2023-12-21 03:57:44,439] Trial 110 finished with value: 4.375610404383376 and parameters: {'learning_rate': 0.1364910608888526, 'aft_l                                                                     oss_distribution': 'logistic', 'aft_loss_distribution_scale': 0.9441152963518753, 'max_depth': 4, 'booster': 'dart', 'scale_pos_weight':                                                                      2.9602509634613856, 'alpha': 2.868724003882315, 'lambda': 0.715262137250752, 'eta': 0.024307857779415243, 'sampling_method': 'gradient_ba                                                                     sed', 'subsample': 0.572873762776003, 'gamma': 0.1423452931529784}. Best is trial 103 with value: 4.242284351281956.
[I 2023-12-21 03:57:44,477] Trial 111 pruned. Trial was pruned at iteration 0.
[I 2023-12-21 03:57:44,511] Trial 112 pruned. Trial was pruned at iteration 0.
[I 2023-12-21 03:57:44,956] Trial 113 finished with value: 4.241477348521332 and parameters: {'learning_rate': 0.06725156320906381, 'aft_                                                                     loss_distribution': 'logistic', 'aft_loss_distribution_scale': 0.6532036966823398, 'max_depth': 4, 'booster': 'gbtree', 'scale_pos_weight                                                                     ': 9.301903282081394, 'alpha': 4.063958843542748, 'lambda': 0.517437447758381, 'eta': 0.3776078398370757, 'sampling_method': 'gradient_ba                                                                     sed', 'subsample': 0.3582360924605075, 'gamma': 4.08094114464307}. Best is trial 113 with value: 4.241477348521332.
[I 2023-12-21 03:57:44,992] Trial 114 pruned. Trial was pruned at iteration 0.
[I 2023-12-21 03:57:45,027] Trial 115 pruned. Trial was pruned at iteration 0.
[I 2023-12-21 03:57:45,062] Trial 116 pruned. Trial was pruned at iteration 0.
[I 2023-12-21 03:57:45,098] Trial 117 pruned. Trial was pruned at iteration 0.
[I 2023-12-21 03:57:45,132] Trial 118 pruned. Trial was pruned at iteration 0.
[I 2023-12-21 03:57:45,167] Trial 119 pruned. Trial was pruned at iteration 0.
[I 2023-12-21 03:57:45,201] Trial 120 pruned. Trial was pruned at iteration 0.
[I 2023-12-21 03:57:45,236] Trial 121 pruned. Trial was pruned at iteration 0.
[I 2023-12-21 03:57:45,270] Trial 122 pruned. Trial was pruned at iteration 0.
[I 2023-12-21 03:57:45,307] Trial 123 pruned. Trial was pruned at iteration 0.
[I 2023-12-21 03:57:45,344] Trial 124 pruned. Trial was pruned at iteration 0.
[I 2023-12-21 03:57:45,381] Trial 125 pruned. Trial was pruned at iteration 0.
[I 2023-12-21 03:57:45,416] Trial 126 pruned. Trial was pruned at iteration 0.
[I 2023-12-21 03:57:45,451] Trial 127 pruned. Trial was pruned at iteration 0.
[I 2023-12-21 03:57:45,486] Trial 128 pruned. Trial was pruned at iteration 0.
[I 2023-12-21 03:57:45,521] Trial 129 pruned. Trial was pruned at iteration 0.
[I 2023-12-21 03:57:45,558] Trial 130 pruned. Trial was pruned at iteration 0.
[I 2023-12-21 03:57:45,797] Trial 131 finished with value: 4.344820492267844 and parameters: {'learning_rate': 0.16502456092447626, 'aft_                                                                     loss_distribution': 'logistic', 'aft_loss_distribution_scale': 0.8525840307619275, 'max_depth': 4, 'booster': 'gbtree', 'scale_pos_weight                                                                     ': 0.930404322362135, 'alpha': 3.421012747043777, 'lambda': 0.3768502498362062, 'eta': 0.5331927007200664, 'sampling_method': 'gradient_b                                                                     ased', 'subsample': 0.31367960020292107, 'gamma': 1.0362659929388391}. Best is trial 113 with value: 4.241477348521332.
[I 2023-12-21 03:57:45,832] Trial 132 pruned. Trial was pruned at iteration 0.
[I 2023-12-21 03:57:45,867] Trial 133 pruned. Trial was pruned at iteration 0.
[I 2023-12-21 03:57:45,903] Trial 134 pruned. Trial was pruned at iteration 0.
[I 2023-12-21 03:57:45,937] Trial 135 pruned. Trial was pruned at iteration 0.
[I 2023-12-21 03:57:45,995] Trial 136 pruned. Trial was pruned at iteration 13.
[I 2023-12-21 03:57:46,033] Trial 137 pruned. Trial was pruned at iteration 0.
[I 2023-12-21 03:57:46,070] Trial 138 pruned. Trial was pruned at iteration 0.
[I 2023-12-21 03:57:46,108] Trial 139 pruned. Trial was pruned at iteration 0.
[I 2023-12-21 03:57:46,143] Trial 140 pruned. Trial was pruned at iteration 0.
[I 2023-12-21 03:57:46,179] Trial 141 pruned. Trial was pruned at iteration 0.
[I 2023-12-21 03:57:46,215] Trial 142 pruned. Trial was pruned at iteration 0.
[I 2023-12-21 03:57:46,253] Trial 143 pruned. Trial was pruned at iteration 0.
[I 2023-12-21 03:57:46,290] Trial 144 pruned. Trial was pruned at iteration 0.
[I 2023-12-21 03:57:46,326] Trial 145 pruned. Trial was pruned at iteration 0.
[I 2023-12-21 03:57:46,361] Trial 146 pruned. Trial was pruned at iteration 0.
[I 2023-12-21 03:57:46,593] Trial 147 finished with value: 4.329545730667559 and parameters: {'learning_rate': 0.1369164140346051, 'aft_l                                                                     oss_distribution': 'logistic', 'aft_loss_distribution_scale': 0.8431580079481653, 'max_depth': 6, 'booster': 'gbtree', 'scale_pos_weight'                                                                     : 0.9507755680844117, 'alpha': 2.9647168999817852, 'lambda': 0.7987715448490529, 'eta': 0.45144237277594107, 'sampling_method': 'uniform'                                                                     , 'subsample': 0.4398537949250925, 'gamma': 1.435348884681753}. Best is trial 113 with value: 4.241477348521332.
[I 2023-12-21 03:57:46,630] Trial 148 pruned. Trial was pruned at iteration 0.
[I 2023-12-21 03:57:46,666] Trial 149 pruned. Trial was pruned at iteration 0.
[I 2023-12-21 03:57:46,704] Trial 150 pruned. Trial was pruned at iteration 0.
[I 2023-12-21 03:57:46,740] Trial 151 pruned. Trial was pruned at iteration 0.
[I 2023-12-21 03:57:46,775] Trial 152 pruned. Trial was pruned at iteration 0.
[I 2023-12-21 03:57:46,814] Trial 153 pruned. Trial was pruned at iteration 0.
[I 2023-12-21 03:57:46,852] Trial 154 pruned. Trial was pruned at iteration 0.
[I 2023-12-21 03:57:46,889] Trial 155 pruned. Trial was pruned at iteration 0.
[I 2023-12-21 03:57:46,926] Trial 156 pruned. Trial was pruned at iteration 0.
[I 2023-12-21 03:57:46,964] Trial 157 pruned. Trial was pruned at iteration 0.
[I 2023-12-21 03:57:47,103] Trial 158 finished with value: inf and parameters: {'learning_rate': 0.18135266083091273, 'aft_loss_distribut                                                                     ion': 'logistic', 'aft_loss_distribution_scale': 0.8664556837471374, 'max_depth': 5, 'booster': 'gbtree', 'scale_pos_weight': 1.609247027                                                                     2756279, 'alpha': 3.4313380164177048, 'lambda': 2.872761412034304, 'eta': 0.4967423261727574, 'sampling_method': 'uniform', 'subsample':                                                                      0.39038632311677446, 'gamma': 1.2464947436050127}. Best is trial 113 with value: 4.241477348521332.
[I 2023-12-21 03:57:47,139] Trial 159 pruned. Trial was pruned at iteration 0.
[I 2023-12-21 03:57:47,178] Trial 160 pruned. Trial was pruned at iteration 0.
[I 2023-12-21 03:57:47,388] Trial 161 finished with value: 4.322816098270105 and parameters: {'learning_rate': 0.1539470114828001, 'aft_l                                                                     oss_distribution': 'logistic', 'aft_loss_distribution_scale': 0.8348919420311903, 'max_depth': 4, 'booster': 'gbtree', 'scale_pos_weight'                                                                     : 1.0273268566564147, 'alpha': 3.3459213100840186, 'lambda': 0.403658092399138, 'eta': 0.5439155045997404, 'sampling_method': 'gradient_b                                                                     ased', 'subsample': 0.30792627099082936, 'gamma': 0.9796725597568299}. Best is trial 113 with value: 4.241477348521332.
[I 2023-12-21 03:57:47,426] Trial 162 pruned. Trial was pruned at iteration 0.
[I 2023-12-21 03:57:47,698] Trial 163 finished with value: 4.343134000979201 and parameters: {'learning_rate': 0.13497996403048218, 'aft_                                                                     loss_distribution': 'logistic', 'aft_loss_distribution_scale': 0.8876195939204086, 'max_depth': 4, 'booster': 'gbtree', 'scale_pos_weight                                                                     ': 1.04560997733319, 'alpha': 3.212293578814295, 'lambda': 0.40711808442373215, 'eta': 0.6315897227343974, 'sampling_method': 'gradient_b                                                                     ased', 'subsample': 0.41811427445724564, 'gamma': 0.4740541936717376}. Best is trial 113 with value: 4.241477348521332.
[I 2023-12-21 03:57:47,735] Trial 164 pruned. Trial was pruned at iteration 0.
[I 2023-12-21 03:57:47,772] Trial 165 pruned. Trial was pruned at iteration 0.
[I 2023-12-21 03:57:47,819] Trial 166 pruned. Trial was pruned at iteration 6.
[I 2023-12-21 03:57:47,855] Trial 167 pruned. Trial was pruned at iteration 0.
[I 2023-12-21 03:57:47,894] Trial 168 pruned. Trial was pruned at iteration 0.
[I 2023-12-21 03:57:47,932] Trial 169 pruned. Trial was pruned at iteration 0.
[I 2023-12-21 03:57:47,969] Trial 170 pruned. Trial was pruned at iteration 0.
[I 2023-12-21 03:57:48,160] Trial 171 finished with value: 4.3267190977478664 and parameters: {'learning_rate': 0.14283566441733483, 'aft                                                                     _loss_distribution': 'logistic', 'aft_loss_distribution_scale': 0.8540427693462078, 'max_depth': 4, 'booster': 'gbtree', 'scale_pos_weigh                                                                     t': 0.8011986916673329, 'alpha': 3.2128426928761473, 'lambda': 0.42522954686865816, 'eta': 0.629525331108648, 'sampling_method': 'gradien                                                                     t_based', 'subsample': 0.41938170898031824, 'gamma': 0.4094655816097444}. Best is trial 113 with value: 4.241477348521332.
[I 2023-12-21 03:57:48,198] Trial 172 pruned. Trial was pruned at iteration 0.
[I 2023-12-21 03:57:48,236] Trial 173 pruned. Trial was pruned at iteration 0.
[I 2023-12-21 03:57:48,275] Trial 174 pruned. Trial was pruned at iteration 0.
[I 2023-12-21 03:57:48,330] Trial 175 pruned. Trial was pruned at iteration 8.
[I 2023-12-21 03:57:48,368] Trial 176 pruned. Trial was pruned at iteration 0.
[I 2023-12-21 03:57:48,405] Trial 177 pruned. Trial was pruned at iteration 0.
[I 2023-12-21 03:57:48,445] Trial 178 pruned. Trial was pruned at iteration 0.
[I 2023-12-21 03:57:48,483] Trial 179 pruned. Trial was pruned at iteration 0.
[I 2023-12-21 03:57:48,522] Trial 180 pruned. Trial was pruned at iteration 0.
[I 2023-12-21 03:57:48,716] Trial 181 pruned. Trial was pruned at iteration 76.
[I 2023-12-21 03:57:48,755] Trial 182 pruned. Trial was pruned at iteration 0.
[I 2023-12-21 03:57:48,793] Trial 183 pruned. Trial was pruned at iteration 0.
[I 2023-12-21 03:57:48,833] Trial 184 pruned. Trial was pruned at iteration 0.
[I 2023-12-21 03:57:48,872] Trial 185 pruned. Trial was pruned at iteration 0.
[I 2023-12-21 03:57:48,910] Trial 186 pruned. Trial was pruned at iteration 0.
[I 2023-12-21 03:57:48,949] Trial 187 pruned. Trial was pruned at iteration 0.
[I 2023-12-21 03:57:48,988] Trial 188 pruned. Trial was pruned at iteration 0.
[I 2023-12-21 03:57:49,241] Trial 189 finished with value: 4.3222271780610875 and parameters: {'learning_rate': 0.18456718648885417, 'aft                                                                     _loss_distribution': 'logistic', 'aft_loss_distribution_scale': 0.8553573175320602, 'max_depth': 5, 'booster': 'gbtree', 'scale_pos_weigh                                                                     t': 1.2945679447396437, 'alpha': 3.4756512014203866, 'lambda': 5.017082755921149, 'eta': 0.5195255372429929, 'sampling_method': 'gradient                                                                     _based', 'subsample': 0.5291714139932525, 'gamma': 0.2638263312395661}. Best is trial 113 with value: 4.241477348521332.
[I 2023-12-21 03:57:49,280] Trial 190 pruned. Trial was pruned at iteration 0.
[I 2023-12-21 03:57:49,514] Trial 191 finished with value: 4.322033964455867 and parameters: {'learning_rate': 0.1927716956992707, 'aft_l                                                                     oss_distribution': 'logistic', 'aft_loss_distribution_scale': 0.8489505450203775, 'max_depth': 5, 'booster': 'gbtree', 'scale_pos_weight'                                                                     : 1.5883038449648688, 'alpha': 3.3123553290211287, 'lambda': 5.018951530813623, 'eta': 0.5056680662782886, 'sampling_method': 'gradient_b                                                                     ased', 'subsample': 0.5477586154549181, 'gamma': 0.43513655511205684}. Best is trial 113 with value: 4.241477348521332.
[I 2023-12-21 03:57:49,553] Trial 192 pruned. Trial was pruned at iteration 0.
[I 2023-12-21 03:57:49,606] Trial 193 pruned. Trial was pruned at iteration 8.
[I 2023-12-21 03:57:49,645] Trial 194 pruned. Trial was pruned at iteration 0.
[I 2023-12-21 03:57:49,683] Trial 195 pruned. Trial was pruned at iteration 0.
[I 2023-12-21 03:57:49,721] Trial 196 pruned. Trial was pruned at iteration 0.
[I 2023-12-21 03:57:49,818] Trial 197 pruned. Trial was pruned at iteration 10.
[I 2023-12-21 03:57:49,858] Trial 198 pruned. Trial was pruned at iteration 0.
[I 2023-12-21 03:57:49,896] Trial 199 pruned. Trial was pruned at iteration 0.
[I 2023-12-21 03:57:49,933] Trial 200 pruned. Trial was pruned at iteration 0.
[I 2023-12-21 03:57:50,074] Trial 201 pruned. Trial was pruned at iteration 58.
[I 2023-12-21 03:57:50,114] Trial 202 pruned. Trial was pruned at iteration 0.
[I 2023-12-21 03:57:50,155] Trial 203 pruned. Trial was pruned at iteration 0.
[I 2023-12-21 03:57:50,195] Trial 204 pruned. Trial was pruned at iteration 0.
[I 2023-12-21 03:57:50,233] Trial 205 pruned. Trial was pruned at iteration 0.
[I 2023-12-21 03:57:50,272] Trial 206 pruned. Trial was pruned at iteration 0.
[I 2023-12-21 03:57:50,312] Trial 207 pruned. Trial was pruned at iteration 0.
[I 2023-12-21 03:57:50,536] Trial 208 pruned. Trial was pruned at iteration 21.
[I 2023-12-21 03:57:50,575] Trial 209 pruned. Trial was pruned at iteration 0.
[I 2023-12-21 03:57:50,616] Trial 210 pruned. Trial was pruned at iteration 0.
[I 2023-12-21 03:57:50,655] Trial 211 pruned. Trial was pruned at iteration 0.
[I 2023-12-21 03:57:50,694] Trial 212 pruned. Trial was pruned at iteration 0.
[I 2023-12-21 03:57:50,733] Trial 213 pruned. Trial was pruned at iteration 0.
[I 2023-12-21 03:57:50,916] Trial 214 pruned. Trial was pruned at iteration 81.
[I 2023-12-21 03:57:50,955] Trial 215 pruned. Trial was pruned at iteration 0.
[I 2023-12-21 03:57:50,994] Trial 216 pruned. Trial was pruned at iteration 0.
[I 2023-12-21 03:57:51,036] Trial 217 pruned. Trial was pruned at iteration 0.
[I 2023-12-21 03:57:51,078] Trial 218 pruned. Trial was pruned at iteration 0.
[I 2023-12-21 03:57:51,117] Trial 219 pruned. Trial was pruned at iteration 0.
[I 2023-12-21 03:57:51,157] Trial 220 pruned. Trial was pruned at iteration 0.
[I 2023-12-21 03:57:51,398] Trial 221 pruned. Trial was pruned at iteration 21.
[I 2023-12-21 03:57:51,440] Trial 222 pruned. Trial was pruned at iteration 0.
[I 2023-12-21 03:57:51,482] Trial 223 pruned. Trial was pruned at iteration 0.
[I 2023-12-21 03:58:05,219] Trial 224 finished with value: 4.281258714997282 and parameters: {'learning_rate': 0.09403924468617077, 'aft_                                                                     loss_distribution': 'logistic', 'aft_loss_distribution_scale': 0.7620561110626036, 'max_depth': 4, 'booster': 'dart', 'scale_pos_weight':                                                                      0.5535789111301063, 'alpha': 3.055955427737004, 'lambda': 1.054977927112892, 'eta': 0.03846976217620053, 'sampling_method': 'gradient_ba                                                                     sed', 'subsample': 0.6190744017529136, 'gamma': 0.5192884517859189}. Best is trial 113 with value: 4.241477348521332.
[I 2023-12-21 03:58:05,261] Trial 225 pruned. Trial was pruned at iteration 0.
[I 2023-12-21 03:58:05,303] Trial 226 pruned. Trial was pruned at iteration 0.
[I 2023-12-21 03:58:05,343] Trial 227 pruned. Trial was pruned at iteration 0.
[I 2023-12-21 03:58:05,384] Trial 228 pruned. Trial was pruned at iteration 0.
[I 2023-12-21 03:58:05,425] Trial 229 pruned. Trial was pruned at iteration 0.
[I 2023-12-21 03:58:05,467] Trial 230 pruned. Trial was pruned at iteration 0.
[I 2023-12-21 03:58:06,556] Trial 231 pruned. Trial was pruned at iteration 53.
[I 2023-12-21 03:58:06,600] Trial 232 pruned. Trial was pruned at iteration 0.
[I 2023-12-21 03:58:06,642] Trial 233 pruned. Trial was pruned at iteration 0.
[I 2023-12-21 03:58:06,684] Trial 234 pruned. Trial was pruned at iteration 0.
[I 2023-12-21 03:58:06,726] Trial 235 pruned. Trial was pruned at iteration 0.
[I 2023-12-21 03:58:06,769] Trial 236 pruned. Trial was pruned at iteration 0.
[I 2023-12-21 03:58:06,809] Trial 237 pruned. Trial was pruned at iteration 0.
[I 2023-12-21 03:58:06,851] Trial 238 pruned. Trial was pruned at iteration 0.
[I 2023-12-21 03:58:06,891] Trial 239 pruned. Trial was pruned at iteration 0.
[I 2023-12-21 03:58:06,933] Trial 240 pruned. Trial was pruned at iteration 0.
[I 2023-12-21 03:58:06,987] Trial 241 pruned. Trial was pruned at iteration 8.
[I 2023-12-21 03:58:07,066] Trial 242 pruned. Trial was pruned at iteration 21.
[I 2023-12-21 03:58:07,107] Trial 243 pruned. Trial was pruned at iteration 0.
[I 2023-12-21 03:58:07,149] Trial 244 pruned. Trial was pruned at iteration 0.
[I 2023-12-21 03:58:07,190] Trial 245 pruned. Trial was pruned at iteration 0.
[I 2023-12-21 03:58:07,231] Trial 246 pruned. Trial was pruned at iteration 0.
[I 2023-12-21 03:58:07,273] Trial 247 pruned. Trial was pruned at iteration 0.
[I 2023-12-21 03:58:07,316] Trial 248 pruned. Trial was pruned at iteration 0.
[I 2023-12-21 03:58:07,359] Trial 249 pruned. Trial was pruned at iteration 0.
[I 2023-12-21 03:58:07,403] Trial 250 pruned. Trial was pruned at iteration 0.
[I 2023-12-21 03:58:07,444] Trial 251 pruned. Trial was pruned at iteration 0.
[I 2023-12-21 03:58:07,502] Trial 252 pruned. Trial was pruned at iteration 4.
[I 2023-12-21 03:58:07,543] Trial 253 pruned. Trial was pruned at iteration 0.
[I 2023-12-21 03:58:07,586] Trial 254 pruned. Trial was pruned at iteration 0.
[I 2023-12-21 03:58:07,629] Trial 255 pruned. Trial was pruned at iteration 0.
[I 2023-12-21 03:58:07,676] Trial 256 pruned. Trial was pruned at iteration 3.
[I 2023-12-21 03:58:07,719] Trial 257 pruned. Trial was pruned at iteration 0.
[I 2023-12-21 03:58:07,761] Trial 258 pruned. Trial was pruned at iteration 0.
[I 2023-12-21 03:58:07,803] Trial 259 pruned. Trial was pruned at iteration 0.
[I 2023-12-21 03:58:07,846] Trial 260 pruned. Trial was pruned at iteration 0.
[I 2023-12-21 03:58:07,890] Trial 261 pruned. Trial was pruned at iteration 0.
[I 2023-12-21 03:58:07,932] Trial 262 pruned. Trial was pruned at iteration 0.
[I 2023-12-21 03:58:07,975] Trial 263 pruned. Trial was pruned at iteration 0.
[I 2023-12-21 03:58:08,017] Trial 264 pruned. Trial was pruned at iteration 0.
[I 2023-12-21 03:58:08,060] Trial 265 pruned. Trial was pruned at iteration 0.
