[I 2023-12-21 04:13:54,749] Trial 181 finished with value: 2.080503697412062 and parameters: {'learning_rate': 0.9977368065929832, 'aft_l                                                                     oss_distribution': 'normal', 'aft_loss_distribution_scale': 2.27749569494975, 'max_depth': 6, 'booster': 'gbtree', 'scale_pos_weight': 0.                                                                     493890062405828, 'alpha': 9.201127037945605, 'lambda': 4.531671925384772, 'eta': 0.8954939282662162, 'sampling_method': 'uniform', 'subsa                                                                     mple': 0.08397196994277105, 'gamma': 6.6207547230218635}. Best is trial 137 with value: 2.0627482357798548.
[I 2023-12-21 04:13:54,921] Trial 182 finished with value: 2.0817550413246297 and parameters: {'learning_rate': 0.9895948305927835, 'aft_                                                                     loss_distribution': 'normal', 'aft_loss_distribution_scale': 2.2765594052502505, 'max_depth': 6, 'booster': 'gbtree', 'scale_pos_weight':                                                                      0.6966639745024434, 'alpha': 9.786275829312064, 'lambda': 4.572869481698968, 'eta': 0.9035883880082921, 'sampling_method': 'uniform', 's                                                                     ubsample': 0.0930200726368691, 'gamma': 6.755754644130908}. Best is trial 137 with value: 2.0627482357798548.
[I 2023-12-21 04:13:54,960] Trial 183 pruned. Trial was pruned at iteration 1.
[I 2023-12-21 04:13:55,066] Trial 184 finished with value: inf and parameters: {'learning_rate': 0.993631957641782, 'aft_loss_distributio                                                                     n': 'normal', 'aft_loss_distribution_scale': 1.8835348528657099, 'max_depth': 6, 'booster': 'gbtree', 'scale_pos_weight': 0.7205580392558                                                                     9, 'alpha': 9.198745415314193, 'lambda': 4.642152069442554, 'eta': 0.9010815598795935, 'sampling_method': 'uniform', 'subsample': 0.09231                                                                     581934513101, 'gamma': 6.540559760761869}. Best is trial 137 with value: 2.0627482357798548.
[I 2023-12-21 04:13:55,382] Trial 185 finished with value: 2.075223111151689 and parameters: {'learning_rate': 0.9658957594110209, 'aft_l                                                                     oss_distribution': 'normal', 'aft_loss_distribution_scale': 2.2757718019041686, 'max_depth': 6, 'booster': 'gbtree', 'scale_pos_weight':                                                                      0.9806584241421852, 'alpha': 9.983637884608791, 'lambda': 4.375850543756201, 'eta': 0.8625646868577167, 'sampling_method': 'uniform', 'su                                                                     bsample': 0.1279992068421712, 'gamma': 6.6727952370824255}. Best is trial 137 with value: 2.0627482357798548.
[I 2023-12-21 04:13:55,682] Trial 186 finished with value: 2.0724342767366215 and parameters: {'learning_rate': 0.9655614608950375, 'aft_                                                                     loss_distribution': 'normal', 'aft_loss_distribution_scale': 2.2509026745429512, 'max_depth': 6, 'booster': 'gbtree', 'scale_pos_weight':                                                                      0.9647248972279756, 'alpha': 9.864845791848524, 'lambda': 4.340209224538644, 'eta': 0.7037864428480993, 'sampling_method': 'uniform', 's                                                                     ubsample': 0.12012379499223153, 'gamma': 6.740359004920569}. Best is trial 137 with value: 2.0627482357798548.
[I 2023-12-21 04:13:55,783] Trial 187 finished with value: inf and parameters: {'learning_rate': 0.9709351801923849, 'aft_loss_distributi                                                                     on': 'normal', 'aft_loss_distribution_scale': 2.215035012465473, 'max_depth': 6, 'booster': 'gbtree', 'scale_pos_weight': 0.9552495772159                                                                     879, 'alpha': 9.992861749435512, 'lambda': 4.324146634336604, 'eta': 0.7031909117705979, 'sampling_method': 'uniform', 'subsample': 0.128                                                                     71422645737501, 'gamma': 6.731286976058641}. Best is trial 137 with value: 2.0627482357798548.
[I 2023-12-21 04:13:55,907] Trial 188 finished with value: inf and parameters: {'learning_rate': 0.9986421171594172, 'aft_loss_distributi                                                                     on': 'normal', 'aft_loss_distribution_scale': 1.551875015034029, 'max_depth': 6, 'booster': 'gbtree', 'scale_pos_weight': 1.0595046532050                                                                     12, 'alpha': 9.735824150212881, 'lambda': 4.183738606676295, 'eta': 0.6579236684209465, 'sampling_method': 'uniform', 'subsample': 0.0817                                                                     47280953537, 'gamma': 7.077247093447553}. Best is trial 137 with value: 2.0627482357798548.
[I 2023-12-21 04:13:55,945] Trial 189 pruned. Trial was pruned at iteration 0.
[I 2023-12-21 04:13:55,983] Trial 190 pruned. Trial was pruned at iteration 0.
[I 2023-12-21 04:13:56,021] Trial 191 pruned. Trial was pruned at iteration 1.
[I 2023-12-21 04:13:56,197] Trial 192 finished with value: 2.066669568660067 and parameters: {'learning_rate': 0.9824330637206562, 'aft_l                                                                     oss_distribution': 'normal', 'aft_loss_distribution_scale': 2.1641036999765335, 'max_depth': 6, 'booster': 'gbtree', 'scale_pos_weight':                                                                      1.236107366498017, 'alpha': 9.996170490693352, 'lambda': 4.3943068026323395, 'eta': 0.8310503420700439, 'sampling_method': 'uniform', 'su                                                                     bsample': 0.11133384470097984, 'gamma': 6.3156848626895945}. Best is trial 137 with value: 2.0627482357798548.
[I 2023-12-21 04:13:56,504] Trial 193 finished with value: 2.0587705324585737 and parameters: {'learning_rate': 0.9810716149792825, 'aft_                                                                     loss_distribution': 'normal', 'aft_loss_distribution_scale': 2.134433395285282, 'max_depth': 6, 'booster': 'gbtree', 'scale_pos_weight':                                                                      1.2204900445380802, 'alpha': 9.999656914617105, 'lambda': 4.384861722107979, 'eta': 0.8266245840485718, 'sampling_method': 'uniform', 'su                                                                     bsample': 0.11833473032644197, 'gamma': 6.6528556639868315}. Best is trial 193 with value: 2.0587705324585737.
[I 2023-12-21 04:13:56,687] Trial 194 finished with value: 2.062814121459414 and parameters: {'learning_rate': 0.9830568058115342, 'aft_l                                                                     oss_distribution': 'normal', 'aft_loss_distribution_scale': 2.119238837550196, 'max_depth': 6, 'booster': 'gbtree', 'scale_pos_weight': 1                                                                     .2939215849659091, 'alpha': 9.818727359521207, 'lambda': 4.32082354352289, 'eta': 0.8534103839182331, 'sampling_method': 'uniform', 'subs                                                                     ample': 0.10444063292925562, 'gamma': 6.376927963248519}. Best is trial 193 with value: 2.0587705324585737.
[I 2023-12-21 04:13:56,789] Trial 195 finished with value: inf and parameters: {'learning_rate': 0.9990650246985601, 'aft_loss_distributi                                                                     on': 'normal', 'aft_loss_distribution_scale': 1.8276363136068772, 'max_depth': 6, 'booster': 'gbtree', 'scale_pos_weight': 1.280432712699                                                                     8705, 'alpha': 9.854561083315811, 'lambda': 4.277789442997007, 'eta': 0.8609719269099823, 'sampling_method': 'uniform', 'subsample': 0.10                                                                     689514218078058, 'gamma': 6.8115673611459515}. Best is trial 193 with value: 2.0587705324585737.
[I 2023-12-21 04:13:56,895] Trial 196 finished with value: inf and parameters: {'learning_rate': 0.9739002287079195, 'aft_loss_distributi                                                                     on': 'normal', 'aft_loss_distribution_scale': 2.113853755574252, 'max_depth': 6, 'booster': 'gbtree', 'scale_pos_weight': 1.3321622473647                                                                     043, 'alpha': 9.995193206050514, 'lambda': 4.46210668676536, 'eta': 0.8310150198665499, 'sampling_method': 'uniform', 'subsample': 0.0653                                                                     074406460942, 'gamma': 6.587161215936083}. Best is trial 193 with value: 2.0587705324585737.
[I 2023-12-21 04:13:57,078] Trial 197 finished with value: 2.0735007447027476 and parameters: {'learning_rate': 0.9816046946716995, 'aft_                                                                     loss_distribution': 'normal', 'aft_loss_distribution_scale': 2.212232441023318, 'max_depth': 6, 'booster': 'gbtree', 'scale_pos_weight':                                                                      1.0554895941376907, 'alpha': 9.747766283655386, 'lambda': 4.093957388354979, 'eta': 0.8560295493757544, 'sampling_method': 'uniform', 'su                                                                     bsample': 0.10877313694814128, 'gamma': 7.187508851046715}. Best is trial 193 with value: 2.0587705324585737.
[I 2023-12-21 04:13:57,291] Trial 198 finished with value: 2.069650790131791 and parameters: {'learning_rate': 0.9850581518728374, 'aft_l                                                                     oss_distribution': 'normal', 'aft_loss_distribution_scale': 2.170721615792502, 'max_depth': 6, 'booster': 'gbtree', 'scale_pos_weight': 1                                                                     .5181374421261644, 'alpha': 9.998237853580806, 'lambda': 4.177165797698621, 'eta': 0.6319512087975645, 'sampling_method': 'uniform', 'sub                                                                     sample': 0.10950873190909247, 'gamma': 7.254893718151494}. Best is trial 193 with value: 2.0587705324585737.
[I 2023-12-21 04:13:57,415] Trial 199 finished with value: inf and parameters: {'learning_rate': 0.9844682080666525, 'aft_loss_distributi                                                                     on': 'normal', 'aft_loss_distribution_scale': 1.6307452619169085, 'max_depth': 6, 'booster': 'gbtree', 'scale_pos_weight': 1.551297361238                                                                     5166, 'alpha': 9.767997373847685, 'lambda': 4.141431455407378, 'eta': 0.6036471850253, 'sampling_method': 'uniform', 'subsample': 0.10569                                                                     375985489596, 'gamma': 7.313300773615718}. Best is trial 193 with value: 2.0587705324585737.
[I 2023-12-21 04:13:57,512] Trial 200 finished with value: inf and parameters: {'learning_rate': 0.9826996549590704, 'aft_loss_distributi                                                                     on': 'normal', 'aft_loss_distribution_scale': 2.0445038256977233, 'max_depth': 7, 'booster': 'gbtree', 'scale_pos_weight': 1.213991463490                                                                     3726, 'alpha': 9.989469192934818, 'lambda': 4.445224871968743, 'eta': 0.6249324029316189, 'sampling_method': 'uniform', 'subsample': 0.09                                                                     358456406184193, 'gamma': 7.488143869437335}. Best is trial 193 with value: 2.0587705324585737.
[I 2023-12-21 04:13:57,687] Trial 201 finished with value: 2.0727886130507795 and parameters: {'learning_rate': 0.960928973766692, 'aft_l                                                                     oss_distribution': 'normal', 'aft_loss_distribution_scale': 2.226900316779351, 'max_depth': 6, 'booster': 'gbtree', 'scale_pos_weight': 1                                                                     .4019232221974554, 'alpha': 9.70392449842099, 'lambda': 3.965763969876701, 'eta': 0.8497146697809075, 'sampling_method': 'uniform', 'subs                                                                     ample': 0.11912106915884191, 'gamma': 7.127634897338712}. Best is trial 193 with value: 2.0587705324585737.
[I 2023-12-21 04:13:57,858] Trial 202 finished with value: 2.0728629686030584 and parameters: {'learning_rate': 0.9626025787339508, 'aft_                                                                     loss_distribution': 'normal', 'aft_loss_distribution_scale': 2.227701661684478, 'max_depth': 6, 'booster': 'gbtree', 'scale_pos_weight':                                                                      1.4769330417853332, 'alpha': 9.694772920342272, 'lambda': 4.2655934825047, 'eta': 0.8474993845182087, 'sampling_method': 'uniform', 'subs                                                                     ample': 0.11842798734616042, 'gamma': 7.1559653858983685}. Best is trial 193 with value: 2.0587705324585737.
[I 2023-12-21 04:13:58,073] Trial 203 finished with value: 2.07043521005207 and parameters: {'learning_rate': 0.9663262837469291, 'aft_lo                                                                     ss_distribution': 'normal', 'aft_loss_distribution_scale': 2.2186874019088676, 'max_depth': 6, 'booster': 'gbtree', 'scale_pos_weight': 1                                                                     .4030517995249798, 'alpha': 9.694860972211668, 'lambda': 4.319354547977164, 'eta': 0.8491788973571478, 'sampling_method': 'uniform', 'sub                                                                     sample': 0.11811372537353255, 'gamma': 7.084274920491429}. Best is trial 193 with value: 2.0587705324585737.
[I 2023-12-21 04:13:58,117] Trial 204 pruned. Trial was pruned at iteration 2.
[I 2023-12-21 04:13:58,215] Trial 205 finished with value: inf and parameters: {'learning_rate': 0.9662494760648425, 'aft_loss_distributi                                                                     on': 'normal', 'aft_loss_distribution_scale': 1.9386972024359186, 'max_depth': 6, 'booster': 'gbtree', 'scale_pos_weight': 1.495730667153                                                                     5815, 'alpha': 9.756444166171047, 'lambda': 4.391727672274, 'eta': 0.8519151547811987, 'sampling_method': 'uniform', 'subsample': 0.07661                                                                     320714237174, 'gamma': 7.117372579500234}. Best is trial 193 with value: 2.0587705324585737.
[I 2023-12-21 04:13:58,260] Trial 206 pruned. Trial was pruned at iteration 6.
[I 2023-12-21 04:13:58,308] Trial 207 pruned. Trial was pruned at iteration 1.
[I 2023-12-21 04:13:58,421] Trial 208 finished with value: inf and parameters: {'learning_rate': 0.9452109666796898, 'aft_loss_distributi                                                                     on': 'normal', 'aft_loss_distribution_scale': 1.735671828474592, 'max_depth': 6, 'booster': 'gbtree', 'scale_pos_weight': 1.0374283227615                                                                     861, 'alpha': 9.41234023390108, 'lambda': 3.9432461985719325, 'eta': 0.8794255999993473, 'sampling_method': 'uniform', 'subsample': 0.132                                                                     4603788290128, 'gamma': 7.411729233966917}. Best is trial 193 with value: 2.0587705324585737.
[I 2023-12-21 04:13:58,588] Trial 209 finished with value: 2.062166382265137 and parameters: {'learning_rate': 0.9709499174939872, 'aft_l                                                                     oss_distribution': 'normal', 'aft_loss_distribution_scale': 2.0767824882568817, 'max_depth': 6, 'booster': 'gbtree', 'scale_pos_weight':                                                                      1.5962881023288622, 'alpha': 9.69318388275166, 'lambda': 4.566686111357352, 'eta': 0.8551221597113778, 'sampling_method': 'uniform', 'sub                                                                     sample': 0.0842875556526885, 'gamma': 6.969210321307569}. Best is trial 193 with value: 2.0587705324585737.
[I 2023-12-21 04:13:58,627] Trial 210 pruned. Trial was pruned at iteration 0.
[I 2023-12-21 04:13:58,666] Trial 211 pruned. Trial was pruned at iteration 1.
[I 2023-12-21 04:13:58,768] Trial 212 finished with value: inf and parameters: {'learning_rate': 0.9379516361106199, 'aft_loss_distributi                                                                     on': 'normal', 'aft_loss_distribution_scale': 2.127242890359912, 'max_depth': 6, 'booster': 'gbtree', 'scale_pos_weight': 1.6484513630299                                                                     582, 'alpha': 9.776662257709852, 'lambda': 4.7207137725394634, 'eta': 0.8382909114664622, 'sampling_method': 'uniform', 'subsample': 0.11                                                                     16860335306941, 'gamma': 6.879886863600024}. Best is trial 193 with value: 2.0587705324585737.
[I 2023-12-21 04:13:58,807] Trial 213 pruned. Trial was pruned at iteration 1.
[I 2023-12-21 04:13:58,950] Trial 214 finished with value: 2.0598746560963286 and parameters: {'learning_rate': 0.9844250188761197, 'aft_                                                                     loss_distribution': 'normal', 'aft_loss_distribution_scale': 1.9666684271494317, 'max_depth': 6, 'booster': 'gbtree', 'scale_pos_weight':                                                                      1.1996554351893165, 'alpha': 9.98126847672521, 'lambda': 4.127530856476039, 'eta': 0.8118542781324843, 'sampling_method': 'uniform', 'su                                                                     bsample': 0.057367926264042454, 'gamma': 6.426839050211779}. Best is trial 193 with value: 2.0587705324585737.
[I 2023-12-21 04:13:59,067] Trial 215 finished with value: inf and parameters: {'learning_rate': 0.9974434963475531, 'aft_loss_distributi                                                                     on': 'normal', 'aft_loss_distribution_scale': 1.9097587892911647, 'max_depth': 6, 'booster': 'gbtree', 'scale_pos_weight': 1.167441012551                                                                     5304, 'alpha': 9.98440299850756, 'lambda': 4.089870814461183, 'eta': 0.8064010645306591, 'sampling_method': 'uniform', 'subsample': 0.056                                                                     33073025304533, 'gamma': 7.064927163813303}. Best is trial 193 with value: 2.0587705324585737.
[I 2023-12-21 04:13:59,106] Trial 216 pruned. Trial was pruned at iteration 0.
[I 2023-12-21 04:13:59,145] Trial 217 pruned. Trial was pruned at iteration 0.
[I 2023-12-21 04:13:59,312] Trial 218 finished with value: 2.0413137946315465 and parameters: {'learning_rate': 0.99941247654527, 'aft_lo                                                                     ss_distribution': 'normal', 'aft_loss_distribution_scale': 1.8196181915682654, 'max_depth': 6, 'booster': 'gbtree', 'scale_pos_weight': 1                                                                     .5856981509683035, 'alpha': 9.5149997347744, 'lambda': 4.805550493266195, 'eta': 0.8130938690073755, 'sampling_method': 'uniform', 'subsa                                                                     mple': 0.08584858847938259, 'gamma': 7.20881004576917}. Best is trial 218 with value: 2.0413137946315465.
[I 2023-12-21 04:13:59,421] Trial 219 finished with value: inf and parameters: {'learning_rate': 0.9773828291078123, 'aft_loss_distributi                                                                     on': 'normal', 'aft_loss_distribution_scale': 1.6907461054471322, 'max_depth': 6, 'booster': 'gbtree', 'scale_pos_weight': 1.630372502897                                                                     5165, 'alpha': 9.468492360618498, 'lambda': 4.933645655878227, 'eta': 0.8131940406106035, 'sampling_method': 'uniform', 'subsample': 0.08                                                                     527644937619987, 'gamma': 7.2462956827724865}. Best is trial 218 with value: 2.0413137946315465.
[I 2023-12-21 04:13:59,460] Trial 220 pruned. Trial was pruned at iteration 0.
[I 2023-12-21 04:13:59,660] Trial 221 finished with value: 2.0691855579343246 and parameters: {'learning_rate': 0.9847254063075839, 'aft_                                                                     loss_distribution': 'normal', 'aft_loss_distribution_scale': 2.167835344994139, 'max_depth': 6, 'booster': 'gbtree', 'scale_pos_weight':                                                                      1.4169072789097064, 'alpha': 9.778868653935797, 'lambda': 4.533177784646827, 'eta': 0.8474247569995463, 'sampling_method': 'uniform', 'su                                                                     bsample': 0.09221318579576195, 'gamma': 6.7545417066898885}. Best is trial 218 with value: 2.0413137946315465.
[I 2023-12-21 04:13:59,785] Trial 222 finished with value: inf and parameters: {'learning_rate': 0.9986750802277068, 'aft_loss_distributi                                                                     on': 'normal', 'aft_loss_distribution_scale': 1.9847743851137323, 'max_depth': 6, 'booster': 'gbtree', 'scale_pos_weight': 1.408741836455                                                                     477, 'alpha': 9.329967043661963, 'lambda': 4.354388278368799, 'eta': 0.8033623846646203, 'sampling_method': 'uniform', 'subsample': 0.114                                                                     72540592455638, 'gamma': 6.4092117648254705}. Best is trial 218 with value: 2.0413137946315465.
