[I 2023-12-21 04:02:34,181] Trial 21 finished with value: 4.692877367845476 and parameters: {'learning_rate': 0.9001399627621264, 'aft_lo                                                                     ss_distribution': 'normal', 'aft_loss_distribution_scale': 2.488955442422971, 'max_depth': 8, 'booster': 'gbtree', 'scale_pos_weight': 5.                                                                     662593408462467, 'alpha': 7.3087680022097485, 'lambda': 0.05914144330990612, 'eta': 0.6400809776699079, 'sampling_method': 'gradient_base                                                                     d', 'subsample': 0.8888838528044413, 'gamma': 7.013112744335237}. Best is trial 18 with value: 4.285825145203746.
[I 2023-12-21 04:02:34,280] Trial 22 finished with value: inf and parameters: {'learning_rate': 0.8911797352449212, 'aft_loss_distributio                                                                     n': 'normal', 'aft_loss_distribution_scale': 2.4020133673651043, 'max_depth': 8, 'booster': 'gbtree', 'scale_pos_weight': 5.6231425034498                                                                     43, 'alpha': 5.207997271945936, 'lambda': 7.5469022413041795, 'eta': 0.6821713586980014, 'sampling_method': 'gradient_based', 'subsample'                                                                     : 0.7319185052994419, 'gamma': 6.779916843587187}. Best is trial 18 with value: 4.285825145203746.
[I 2023-12-21 04:02:34,417] Trial 23 finished with value: 4.264735164211471 and parameters: {'learning_rate': 0.8552630665950389, 'aft_lo                                                                     ss_distribution': 'normal', 'aft_loss_distribution_scale': 1.1407346344638103, 'max_depth': 9, 'booster': 'gbtree', 'scale_pos_weight': 3                                                                     .432749298128858, 'alpha': 7.055203448814506, 'lambda': 8.664946889362053, 'eta': 0.8347314941183123, 'sampling_method': 'gradient_based'                                                                     , 'subsample': 0.9167830749973896, 'gamma': 4.919179769190947}. Best is trial 23 with value: 4.264735164211471.
[I 2023-12-21 04:02:34,515] Trial 24 finished with value: inf and parameters: {'learning_rate': 0.8249746890334255, 'aft_loss_distributio                                                                     n': 'normal', 'aft_loss_distribution_scale': 1.3773230935250158, 'max_depth': 10, 'booster': 'gbtree', 'scale_pos_weight': 3.367215331342                                                                     1758, 'alpha': 4.025633166011967, 'lambda': 9.067273945718256, 'eta': 0.8189692880626508, 'sampling_method': 'gradient_based', 'subsample                                                                     ': 0.6293011154647116, 'gamma': 4.274348442033951}. Best is trial 23 with value: 4.264735164211471.
[I 2023-12-21 04:02:34,545] Trial 25 pruned. Trial was pruned at iteration 0.
[I 2023-12-21 04:02:34,632] Trial 26 finished with value: inf and parameters: {'learning_rate': 0.9461745715092685, 'aft_loss_distributio                                                                     n': 'normal', 'aft_loss_distribution_scale': 1.5926539734050391, 'max_depth': 9, 'booster': 'gbtree', 'scale_pos_weight': 4.9707592737107                                                                     49, 'alpha': 5.521731833933476, 'lambda': 7.335985027957123, 'eta': 0.9938056291487735, 'sampling_method': 'uniform', 'subsample': 0.9300                                                                     759761964232, 'gamma': 2.8571793101038883}. Best is trial 23 with value: 4.264735164211471.
[I 2023-12-21 04:02:34,662] Trial 27 pruned. Trial was pruned at iteration 0.
[I 2023-12-21 04:02:34,693] Trial 28 pruned. Trial was pruned at iteration 0.
[I 2023-12-21 04:02:34,726] Trial 29 pruned. Trial was pruned at iteration 0.
[I 2023-12-21 04:02:34,757] Trial 30 pruned. Trial was pruned at iteration 0.
[I 2023-12-21 04:02:34,860] Trial 31 finished with value: inf and parameters: {'learning_rate': 0.9148356639340469, 'aft_loss_distributio                                                                     n': 'normal', 'aft_loss_distribution_scale': 2.4914344114332785, 'max_depth': 8, 'booster': 'gbtree', 'scale_pos_weight': 6.0049267173298                                                                     295, 'alpha': 7.214379665427047, 'lambda': 2.6760621683053563, 'eta': 0.6244595287128554, 'sampling_method': 'gradient_based', 'subsample                                                                     ': 0.8680616095271854, 'gamma': 6.898069139619486}. Best is trial 23 with value: 4.264735164211471.
[I 2023-12-21 04:02:34,994] Trial 32 finished with value: 4.4513159936760704 and parameters: {'learning_rate': 0.8865126161757514, 'aft_l                                                                     oss_distribution': 'normal', 'aft_loss_distribution_scale': 1.7774574251367965, 'max_depth': 7, 'booster': 'gbtree', 'scale_pos_weight':                                                                      4.348078757467791, 'alpha': 4.885329589232205, 'lambda': 7.854904511258534, 'eta': 0.6894621556538625, 'sampling_method': 'gradient_based                                                                     ', 'subsample': 0.9491216500782426, 'gamma': 4.092149602186803}. Best is trial 23 with value: 4.264735164211471.
[I 2023-12-21 04:02:35,205] Trial 33 finished with value: 4.497487494584682 and parameters: {'learning_rate': 0.7410873549818998, 'aft_lo                                                                     ss_distribution': 'normal', 'aft_loss_distribution_scale': 1.9123904869354642, 'max_depth': 7, 'booster': 'gbtree', 'scale_pos_weight': 4                                                                     .265821410677209, 'alpha': 2.408057919170736, 'lambda': 7.855887727284965, 'eta': 0.7160317279580166, 'sampling_method': 'gradient_based'                                                                     , 'subsample': 0.9948571125369031, 'gamma': 3.9894848122533375}. Best is trial 23 with value: 4.264735164211471.
[I 2023-12-21 04:02:35,235] Trial 34 pruned. Trial was pruned at iteration 0.
[I 2023-12-21 04:02:35,265] Trial 35 pruned. Trial was pruned at iteration 0.
[I 2023-12-21 04:02:35,411] Trial 36 finished with value: 4.479946637296328 and parameters: {'learning_rate': 0.6211060152318085, 'aft_lo                                                                     ss_distribution': 'normal', 'aft_loss_distribution_scale': 1.8574222593807574, 'max_depth': 7, 'booster': 'gbtree', 'scale_pos_weight': 4                                                                     .644573849991541, 'alpha': 4.0332065284878365, 'lambda': 5.838873899001169, 'eta': 0.9076981381045923, 'sampling_method': 'gradient_based                                                                     ', 'subsample': 0.7719104401009644, 'gamma': 5.431701520799002}. Best is trial 23 with value: 4.264735164211471.
[I 2023-12-21 04:02:35,443] Trial 37 pruned. Trial was pruned at iteration 0.
[I 2023-12-21 04:02:35,474] Trial 38 pruned. Trial was pruned at iteration 0.
[I 2023-12-21 04:02:35,505] Trial 39 pruned. Trial was pruned at iteration 0.
[I 2023-12-21 04:02:35,536] Trial 40 pruned. Trial was pruned at iteration 0.
[I 2023-12-21 04:02:35,672] Trial 41 finished with value: 4.4416722825982236 and parameters: {'learning_rate': 0.7919707130413289, 'aft_l                                                                     oss_distribution': 'normal', 'aft_loss_distribution_scale': 1.7483064375862627, 'max_depth': 7, 'booster': 'gbtree', 'scale_pos_weight':                                                                      4.546799679598722, 'alpha': 2.434493728789122, 'lambda': 8.490327110547128, 'eta': 0.23125641403537534, 'sampling_method': 'gradient_base                                                                     d', 'subsample': 0.9319478438049377, 'gamma': 4.522594702060266}. Best is trial 23 with value: 4.264735164211471.
[I 2023-12-21 04:02:35,704] Trial 42 pruned. Trial was pruned at iteration 0.
[I 2023-12-21 04:02:35,892] Trial 43 finished with value: inf and parameters: {'learning_rate': 0.9580317685455924, 'aft_loss_distributio                                                                     n': 'normal', 'aft_loss_distribution_scale': 1.4354804481642065, 'max_depth': 8, 'booster': 'gbtree', 'scale_pos_weight': 6.3294344808030                                                                     18, 'alpha': 3.455401039050442, 'lambda': 7.261760863654055, 'eta': 0.04011359392866487, 'sampling_method': 'gradient_based', 'subsample'                                                                     : 0.03651925720013638, 'gamma': 5.3432739604693404}. Best is trial 23 with value: 4.264735164211471.
[I 2023-12-21 04:02:35,924] Trial 44 pruned. Trial was pruned at iteration 0.
[I 2023-12-21 04:02:35,955] Trial 45 pruned. Trial was pruned at iteration 0.
[I 2023-12-21 04:02:35,988] Trial 46 pruned. Trial was pruned at iteration 0.
[I 2023-12-21 04:02:36,019] Trial 47 pruned. Trial was pruned at iteration 0.
[I 2023-12-21 04:02:36,051] Trial 48 pruned. Trial was pruned at iteration 0.
[I 2023-12-21 04:02:36,082] Trial 49 pruned. Trial was pruned at iteration 0.
[I 2023-12-21 04:02:36,182] Trial 50 finished with value: inf and parameters: {'learning_rate': 0.9978373947758444, 'aft_loss_distributio                                                                     n': 'normal', 'aft_loss_distribution_scale': 1.140627227614757, 'max_depth': 10, 'booster': 'gbtree', 'scale_pos_weight': 5.2135176856513                                                                     34, 'alpha': 4.255872990952217, 'lambda': 3.375898965234682, 'eta': 0.87605295260241, 'sampling_method': 'gradient_based', 'subsample': 0                                                                     .8482417891612909, 'gamma': 5.99067721176672}. Best is trial 23 with value: 4.264735164211471.
[I 2023-12-21 04:02:36,341] Trial 51 finished with value: 4.516218448619737 and parameters: {'learning_rate': 0.753210332192522, 'aft_los                                                                     s_distribution': 'normal', 'aft_loss_distribution_scale': 1.9646508191147118, 'max_depth': 7, 'booster': 'gbtree', 'scale_pos_weight': 4.                                                                     414555296492053, 'alpha': 2.6358607478790432, 'lambda': 7.311359428237726, 'eta': 0.6621245627452482, 'sampling_method': 'gradient_based'                                                                     , 'subsample': 0.9704156113878764, 'gamma': 3.8888330855889337}. Best is trial 23 with value: 4.264735164211471.
[I 2023-12-21 04:02:36,547] Trial 52 finished with value: 4.468918208924737 and parameters: {'learning_rate': 0.6911021984415718, 'aft_lo                                                                     ss_distribution': 'normal', 'aft_loss_distribution_scale': 1.827988909789562, 'max_depth': 7, 'booster': 'gbtree', 'scale_pos_weight': 3.                                                                     892068011612044, 'alpha': 2.219754426901592, 'lambda': 7.707243117947898, 'eta': 0.5188337210447662, 'sampling_method': 'gradient_based',                                                                      'subsample': 0.9924384482765654, 'gamma': 4.042399998250806}. Best is trial 23 with value: 4.264735164211471.
[I 2023-12-21 04:02:36,578] Trial 53 pruned. Trial was pruned at iteration 0.
[I 2023-12-21 04:02:36,612] Trial 54 pruned. Trial was pruned at iteration 0.
[I 2023-12-21 04:02:36,643] Trial 55 pruned. Trial was pruned at iteration 0.
[I 2023-12-21 04:02:36,675] Trial 56 pruned. Trial was pruned at iteration 0.
[I 2023-12-21 04:02:36,707] Trial 57 pruned. Trial was pruned at iteration 0.
[I 2023-12-21 04:02:36,739] Trial 58 pruned. Trial was pruned at iteration 0.
[I 2023-12-21 04:02:36,771] Trial 59 pruned. Trial was pruned at iteration 0.
[I 2023-12-21 04:02:36,804] Trial 60 pruned. Trial was pruned at iteration 0.
[I 2023-12-21 04:02:36,836] Trial 61 pruned. Trial was pruned at iteration 0.
[I 2023-12-21 04:02:36,986] Trial 62 finished with value: 4.4741676295729516 and parameters: {'learning_rate': 0.7074066608736036, 'aft_l                                                                     oss_distribution': 'normal', 'aft_loss_distribution_scale': 1.8427854760873688, 'max_depth': 7, 'booster': 'gbtree', 'scale_pos_weight':                                                                      4.030660941960048, 'alpha': 2.4219820269496846, 'lambda': 8.520166105572194, 'eta': 0.7956903802740101, 'sampling_method': 'gradient_base                                                                     d', 'subsample': 0.9644545459602067, 'gamma': 3.9780379405451374}. Best is trial 23 with value: 4.264735164211471.
[I 2023-12-21 04:02:37,019] Trial 63 pruned. Trial was pruned at iteration 0.
[I 2023-12-21 04:02:37,140] Trial 64 finished with value: inf and parameters: {'learning_rate': 0.8658392175537483, 'aft_loss_distributio                                                                     n': 'normal', 'aft_loss_distribution_scale': 1.6787831302465874, 'max_depth': 6, 'booster': 'gbtree', 'scale_pos_weight': 3.9300325174841                                                                     593, 'alpha': 4.260436989830004, 'lambda': 8.238675171159354, 'eta': 0.8376704263821803, 'sampling_method': 'gradient_based', 'subsample'                                                                     : 0.872536387913415, 'gamma': 5.838449342380614}. Best is trial 23 with value: 4.264735164211471.
[I 2023-12-21 04:02:43,586] Trial 65 finished with value: 4.3042625266017 and parameters: {'learning_rate': 0.8073295691042869, 'aft_loss                                                                     _distribution': 'normal', 'aft_loss_distribution_scale': 1.3208625613499334, 'max_depth': 8, 'booster': 'dart', 'scale_pos_weight': 3.060                                                                     6309746130975, 'alpha': 5.5964124840302025, 'lambda': 9.379048699454748, 'eta': 0.9025111313101596, 'sampling_method': 'gradient_based',                                                                      'subsample': 0.9055160907999205, 'gamma': 5.161858945713109}. Best is trial 23 with value: 4.264735164211471.
[I 2023-12-21 04:02:44,966] Trial 66 finished with value: inf and parameters: {'learning_rate': 0.8150913119171626, 'aft_loss_distributio                                                                     n': 'normal', 'aft_loss_distribution_scale': 1.1765245154289676, 'max_depth': 8, 'booster': 'dart', 'scale_pos_weight': 3.107415914700417                                                                     2, 'alpha': 6.386716031440267, 'lambda': 9.195318960726029, 'eta': 0.8769581198249427, 'sampling_method': 'gradient_based', 'subsample':                                                                      0.8996415157578089, 'gamma': 6.4848837577290235}. Best is trial 23 with value: 4.264735164211471.
[I 2023-12-21 04:02:45,000] Trial 67 pruned. Trial was pruned at iteration 0.
[I 2023-12-21 04:02:45,033] Trial 68 pruned. Trial was pruned at iteration 0.
[I 2023-12-21 04:02:45,072] Trial 69 pruned. Trial was pruned at iteration 0.
[I 2023-12-21 04:02:45,107] Trial 70 pruned. Trial was pruned at iteration 0.
[I 2023-12-21 04:02:45,139] Trial 71 pruned. Trial was pruned at iteration 0.
[I 2023-12-21 04:02:45,172] Trial 72 pruned. Trial was pruned at iteration 0.
[I 2023-12-21 04:02:50,519] Trial 73 finished with value: 4.287757709450942 and parameters: {'learning_rate': 0.7670091723488439, 'aft_lo                                                                     ss_distribution': 'normal', 'aft_loss_distribution_scale': 1.2582343168599646, 'max_depth': 7, 'booster': 'dart', 'scale_pos_weight': 5.5                                                                     23278551507287, 'alpha': 3.767288246468123, 'lambda': 8.746884691097463, 'eta': 0.8924276602824367, 'sampling_method': 'gradient_based',                                                                      'subsample': 0.9751820412683639, 'gamma': 5.734924378180953}. Best is trial 23 with value: 4.264735164211471.
[I 2023-12-21 04:02:51,527] Trial 74 finished with value: inf and parameters: {'learning_rate': 0.8360794482646149, 'aft_loss_distributio                                                                     n': 'normal', 'aft_loss_distribution_scale': 1.1950024404214536, 'max_depth': 7, 'booster': 'dart', 'scale_pos_weight': 5.637253469851467                                                                     , 'alpha': 3.668559608886929, 'lambda': 8.792484546593965, 'eta': 0.8045214516368969, 'sampling_method': 'gradient_based', 'subsample': 0                                                                     .9998996559755692, 'gamma': 5.7890492085465635}. Best is trial 23 with value: 4.264735164211471.
[I 2023-12-21 04:02:52,641] Trial 75 finished with value: inf and parameters: {'learning_rate': 0.7269173675466594, 'aft_loss_distributio                                                                     n': 'normal', 'aft_loss_distribution_scale': 1.351866509843255, 'max_depth': 8, 'booster': 'dart', 'scale_pos_weight': 8.843481427098471,                                                                      'alpha': 2.5386958521117187, 'lambda': 7.413487530719262, 'eta': 0.8493013786560915, 'sampling_method': 'gradient_based', 'subsample': 0                                                                     .9246551552832898, 'gamma': 4.254802453033332}. Best is trial 23 with value: 4.264735164211471.
[I 2023-12-21 04:02:52,674] Trial 76 pruned. Trial was pruned at iteration 0.
[I 2023-12-21 04:02:52,711] Trial 77 pruned. Trial was pruned at iteration 1.
[I 2023-12-21 04:02:52,744] Trial 78 pruned. Trial was pruned at iteration 0.
[I 2023-12-21 04:02:52,779] Trial 79 pruned. Trial was pruned at iteration 0.
[I 2023-12-21 04:02:52,814] Trial 80 pruned. Trial was pruned at iteration 0.
[I 2023-12-21 04:02:52,989] Trial 81 finished with value: 4.4320642445526515 and parameters: {'learning_rate': 0.798128189577353, 'aft_lo                                                                     ss_distribution': 'normal', 'aft_loss_distribution_scale': 1.7232794252387587, 'max_depth': 7, 'booster': 'gbtree', 'scale_pos_weight': 4                                                                     .760502954413773, 'alpha': 3.850670708946013, 'lambda': 8.090466915194442, 'eta': 0.9170332293170741, 'sampling_method': 'gradient_based'                                                                     , 'subsample': 0.8999501836099876, 'gamma': 5.384584092533753}. Best is trial 23 with value: 4.264735164211471.
[I 2023-12-21 04:02:53,101] Trial 82 finished with value: inf and parameters: {'learning_rate': 0.8433875590996678, 'aft_loss_distributio                                                                     n': 'normal', 'aft_loss_distribution_scale': 1.749904110707325, 'max_depth': 7, 'booster': 'gbtree', 'scale_pos_weight': 4.87068197810327                                                                     95, 'alpha': 3.7970242071331324, 'lambda': 8.621894614988157, 'eta': 0.8044171766723957, 'sampling_method': 'gradient_based', 'subsample'                                                                     : 0.944609812108432, 'gamma': 4.707519624235276}. Best is trial 23 with value: 4.264735164211471.
[I 2023-12-21 04:02:53,240] Trial 83 finished with value: 4.259722199545761 and parameters: {'learning_rate': 0.805611744717057, 'aft_los                                                                     s_distribution': 'normal', 'aft_loss_distribution_scale': 1.0404991303445812, 'max_depth': 6, 'booster': 'gbtree', 'scale_pos_weight': 4.                                                                     2099157554492725, 'alpha': 4.8172492894843675, 'lambda': 8.161526159496335, 'eta': 0.8973812561629959, 'sampling_method': 'gradient_based                                                                     ', 'subsample': 0.9077165493731366, 'gamma': 5.642386419416405}. Best is trial 83 with value: 4.259722199545761.
[I 2023-12-21 04:02:53,403] Trial 84 finished with value: 4.259518710902867 and parameters: {'learning_rate': 0.8147211777416186, 'aft_lo                                                                     ss_distribution': 'normal', 'aft_loss_distribution_scale': 1.0894520338721827, 'max_depth': 5, 'booster': 'gbtree', 'scale_pos_weight': 4                                                                     .284642043590647, 'alpha': 4.955939324340973, 'lambda': 7.98864160665441, 'eta': 0.9869005007801366, 'sampling_method': 'gradient_based',                                                                      'subsample': 0.8912014830486636, 'gamma': 6.064673644564264}. Best is trial 84 with value: 4.259518710902867.
[I 2023-12-21 04:02:53,439] Trial 85 pruned. Trial was pruned at iteration 0.
[I 2023-12-21 04:02:53,541] Trial 86 finished with value: inf and parameters: {'learning_rate': 0.8805382912911126, 'aft_loss_distributio                                                                     n': 'normal', 'aft_loss_distribution_scale': 0.9620257246402731, 'max_depth': 4, 'booster': 'gbtree', 'scale_pos_weight': 4.9008585780472                                                                     185, 'alpha': 4.691198725824481, 'lambda': 8.977163943993597, 'eta': 0.9279015032526152, 'sampling_method': 'gradient_based', 'subsample'                                                                     : 0.8885207713887341, 'gamma': 5.692018439250263}. Best is trial 84 with value: 4.259518710902867.
