[I 2023-12-21 02:50:32,826] Trial 356 finished with value: 4.345489191759833 and parameters: {'learning_rate': 0.1790781575979074, 'aft_l                                                                     oss_distribution': 'logistic', 'aft_loss_distribution_scale': 0.8419970734938863, 'max_depth': 10, 'booster': 'dart', 'scale_pos_weight':                                                                      7.30599661088394, 'alpha': 8.658460990976453, 'lambda': 6.565425735741855, 'eta': 0.9449852802735188, 'sampling_method': 'uniform', 'sub                                                                     sample': 0.8780682150188736, 'gamma': 6.761849681805773}. Best is trial 312 with value: 4.317049894457708.
[I 2023-12-21 02:50:32,875] Trial 357 pruned. Trial was pruned at iteration 0.
[I 2023-12-21 02:50:32,929] Trial 358 pruned. Trial was pruned at iteration 0.
[I 2023-12-21 02:50:32,980] Trial 359 pruned. Trial was pruned at iteration 0.
[I 2023-12-21 02:50:33,044] Trial 360 pruned. Trial was pruned at iteration 0.
[I 2023-12-21 02:50:33,099] Trial 361 pruned. Trial was pruned at iteration 0.
[I 2023-12-21 02:50:33,148] Trial 362 pruned. Trial was pruned at iteration 0.
[I 2023-12-21 02:50:33,201] Trial 363 pruned. Trial was pruned at iteration 0.
[I 2023-12-21 02:50:33,251] Trial 364 pruned. Trial was pruned at iteration 0.
[I 2023-12-21 02:50:33,304] Trial 365 pruned. Trial was pruned at iteration 0.
[I 2023-12-21 02:50:33,353] Trial 366 pruned. Trial was pruned at iteration 0.
[I 2023-12-21 02:50:33,417] Trial 367 pruned. Trial was pruned at iteration 0.
[I 2023-12-21 02:50:33,466] Trial 368 pruned. Trial was pruned at iteration 0.
[I 2023-12-21 02:50:33,513] Trial 369 pruned. Trial was pruned at iteration 0.
[I 2023-12-21 02:50:33,567] Trial 370 pruned. Trial was pruned at iteration 0.
[I 2023-12-21 02:50:33,620] Trial 371 pruned. Trial was pruned at iteration 0.
[I 2023-12-21 02:50:33,688] Trial 372 pruned. Trial was pruned at iteration 0.
[I 2023-12-21 02:50:33,737] Trial 373 pruned. Trial was pruned at iteration 0.
[I 2023-12-21 02:50:33,790] Trial 374 pruned. Trial was pruned at iteration 0.
[I 2023-12-21 02:50:33,846] Trial 375 pruned. Trial was pruned at iteration 0.
[I 2023-12-21 02:50:33,892] Trial 376 pruned. Trial was pruned at iteration 0.
[I 2023-12-21 02:50:33,939] Trial 377 pruned. Trial was pruned at iteration 0.
[I 2023-12-21 02:50:33,985] Trial 378 pruned. Trial was pruned at iteration 0.
[I 2023-12-21 02:50:34,032] Trial 379 pruned. Trial was pruned at iteration 0.
[I 2023-12-21 02:50:34,085] Trial 380 pruned. Trial was pruned at iteration 0.
[I 2023-12-21 02:50:34,143] Trial 381 pruned. Trial was pruned at iteration 0.
[I 2023-12-21 02:50:34,196] Trial 382 pruned. Trial was pruned at iteration 0.
[I 2023-12-21 02:50:34,242] Trial 383 pruned. Trial was pruned at iteration 0.
[I 2023-12-21 02:50:34,288] Trial 384 pruned. Trial was pruned at iteration 0.
[I 2023-12-21 02:50:34,336] Trial 385 pruned. Trial was pruned at iteration 0.
[I 2023-12-21 02:50:34,390] Trial 386 pruned. Trial was pruned at iteration 0.
[I 2023-12-21 02:50:34,446] Trial 387 pruned. Trial was pruned at iteration 0.
[I 2023-12-21 02:50:34,495] Trial 388 pruned. Trial was pruned at iteration 0.
[I 2023-12-21 02:50:34,541] Trial 389 pruned. Trial was pruned at iteration 0.
[I 2023-12-21 02:50:34,596] Trial 390 pruned. Trial was pruned at iteration 0.
[I 2023-12-21 02:50:34,648] Trial 391 pruned. Trial was pruned at iteration 0.
[I 2023-12-21 02:50:34,694] Trial 392 pruned. Trial was pruned at iteration 0.
[I 2023-12-21 02:50:34,742] Trial 393 pruned. Trial was pruned at iteration 0.
[I 2023-12-21 02:50:34,800] Trial 394 pruned. Trial was pruned at iteration 0.
[I 2023-12-21 02:50:34,861] Trial 395 pruned. Trial was pruned at iteration 0.
[I 2023-12-21 02:50:34,908] Trial 396 pruned. Trial was pruned at iteration 0.
[I 2023-12-21 02:50:34,955] Trial 397 pruned. Trial was pruned at iteration 0.
[I 2023-12-21 02:50:35,009] Trial 398 pruned. Trial was pruned at iteration 0.
[I 2023-12-21 02:50:58,112] Trial 399 finished with value: 4.35441174109595 and parameters: {'learning_rate': 0.17191460842416648, 'aft_l                                                                     oss_distribution': 'logistic', 'aft_loss_distribution_scale': 0.8495084547327068, 'max_depth': 10, 'booster': 'dart', 'scale_pos_weight':                                                                      7.154700943801369, 'alpha': 8.48879656090486, 'lambda': 7.713024342978245, 'eta': 0.9556296995570849, 'sampling_method': 'uniform', 'sub                                                                     sample': 0.8441173539491185, 'gamma': 6.418114330289382}. Best is trial 312 with value: 4.317049894457708.
[I 2023-12-21 02:50:58,164] Trial 400 pruned. Trial was pruned at iteration 0.
[I 2023-12-21 02:50:58,227] Trial 401 pruned. Trial was pruned at iteration 0.
[I 2023-12-21 02:50:58,275] Trial 402 pruned. Trial was pruned at iteration 0.
[I 2023-12-21 02:50:58,336] Trial 403 pruned. Trial was pruned at iteration 0.
[I 2023-12-21 02:51:09,960] Trial 404 finished with value: 4.32193140916598 and parameters: {'learning_rate': 0.1565289050605127, 'aft_lo                                                                     ss_distribution': 'logistic', 'aft_loss_distribution_scale': 0.8261602866430343, 'max_depth': 5, 'booster': 'dart', 'scale_pos_weight': 7                                                                     .01413870205793, 'alpha': 9.157786851509856, 'lambda': 3.1149764801377176, 'eta': 0.9514956059782127, 'sampling_method': 'uniform', 'subs                                                                     ample': 0.8651498854593513, 'gamma': 6.562026638352203}. Best is trial 312 with value: 4.317049894457708.
[I 2023-12-21 02:51:10,013] Trial 405 pruned. Trial was pruned at iteration 0.
[I 2023-12-21 02:51:10,068] Trial 406 pruned. Trial was pruned at iteration 0.
[I 2023-12-21 02:51:10,116] Trial 407 pruned. Trial was pruned at iteration 0.
[I 2023-12-21 02:51:21,807] Trial 408 finished with value: 4.320525604035835 and parameters: {'learning_rate': 0.17849371570486025, 'aft_                                                                     loss_distribution': 'logistic', 'aft_loss_distribution_scale': 0.8418320994568771, 'max_depth': 3, 'booster': 'dart', 'scale_pos_weight':                                                                      6.698120396671081, 'alpha': 8.370283515134018, 'lambda': 2.0360600931704935, 'eta': 0.9691722580351501, 'sampling_method': 'uniform', 's                                                                     ubsample': 0.9083322603472722, 'gamma': 6.475472295475858}. Best is trial 312 with value: 4.317049894457708.
[I 2023-12-21 02:51:21,860] Trial 409 pruned. Trial was pruned at iteration 0.
[I 2023-12-21 02:51:33,798] Trial 410 finished with value: 4.311687926826776 and parameters: {'learning_rate': 0.17631649087738546, 'aft_                                                                     loss_distribution': 'logistic', 'aft_loss_distribution_scale': 0.8087570293899656, 'max_depth': 4, 'booster': 'dart', 'scale_pos_weight':                                                                      6.601369233833678, 'alpha': 8.114451061660995, 'lambda': 2.447299583873352, 'eta': 0.9980455559785997, 'sampling_method': 'uniform', 'su                                                                     bsample': 0.9050047197483304, 'gamma': 6.770497268025135}. Best is trial 410 with value: 4.311687926826776.
[I 2023-12-21 02:51:33,853] Trial 411 pruned. Trial was pruned at iteration 0.
[I 2023-12-21 02:51:33,904] Trial 412 pruned. Trial was pruned at iteration 0.
[I 2023-12-21 02:51:33,953] Trial 413 pruned. Trial was pruned at iteration 0.
[I 2023-12-21 02:51:34,006] Trial 414 pruned. Trial was pruned at iteration 0.
[I 2023-12-21 02:51:34,057] Trial 415 pruned. Trial was pruned at iteration 0.
[I 2023-12-21 02:51:34,113] Trial 416 pruned. Trial was pruned at iteration 0.
[I 2023-12-21 02:51:40,765] Trial 417 pruned. Trial was pruned at iteration 144.
[I 2023-12-21 02:51:40,820] Trial 418 pruned. Trial was pruned at iteration 0.
[I 2023-12-21 02:51:40,871] Trial 419 pruned. Trial was pruned at iteration 0.
[I 2023-12-21 02:52:56,379] Trial 420 finished with value: 4.3199049931135045 and parameters: {'learning_rate': 0.17827302860312577, 'aft                                                                     _loss_distribution': 'logistic', 'aft_loss_distribution_scale': 0.8346896819740968, 'max_depth': 4, 'booster': 'dart', 'scale_pos_weight'                                                                     : 6.759063243748425, 'alpha': 8.381526312741215, 'lambda': 5.074940475618584, 'eta': 0.9991005883705657, 'sampling_method': 'uniform', 's                                                                     ubsample': 0.911162300061595, 'gamma': 6.216261319713066}. Best is trial 410 with value: 4.311687926826776.
[I 2023-12-21 02:52:56,434] Trial 421 pruned. Trial was pruned at iteration 0.
[I 2023-12-21 02:52:56,486] Trial 422 pruned. Trial was pruned at iteration 0.
[I 2023-12-21 02:52:56,537] Trial 423 pruned. Trial was pruned at iteration 0.
[I 2023-12-21 02:52:56,588] Trial 424 pruned. Trial was pruned at iteration 0.
[I 2023-12-21 02:52:56,638] Trial 425 pruned. Trial was pruned at iteration 0.
[I 2023-12-21 02:52:56,694] Trial 426 pruned. Trial was pruned at iteration 0.
[I 2023-12-21 02:52:56,744] Trial 427 pruned. Trial was pruned at iteration 0.
[I 2023-12-21 02:52:56,795] Trial 428 pruned. Trial was pruned at iteration 0.
[I 2023-12-21 02:52:56,849] Trial 429 pruned. Trial was pruned at iteration 0.
[I 2023-12-21 02:52:56,899] Trial 430 pruned. Trial was pruned at iteration 0.
[I 2023-12-21 02:52:56,950] Trial 431 pruned. Trial was pruned at iteration 0.
[I 2023-12-21 02:52:57,002] Trial 432 pruned. Trial was pruned at iteration 0.
[I 2023-12-21 02:52:57,054] Trial 433 pruned. Trial was pruned at iteration 0.
[I 2023-12-21 02:52:57,104] Trial 434 pruned. Trial was pruned at iteration 0.
[I 2023-12-21 02:52:57,156] Trial 435 pruned. Trial was pruned at iteration 0.
[I 2023-12-21 02:52:57,214] Trial 436 pruned. Trial was pruned at iteration 0.
[I 2023-12-21 02:52:57,266] Trial 437 pruned. Trial was pruned at iteration 0.
[I 2023-12-21 02:52:57,320] Trial 438 pruned. Trial was pruned at iteration 0.
[I 2023-12-21 02:52:57,371] Trial 439 pruned. Trial was pruned at iteration 0.
[I 2023-12-21 02:52:57,427] Trial 440 pruned. Trial was pruned at iteration 0.
[I 2023-12-21 02:53:09,643] Trial 441 finished with value: 4.297868792635896 and parameters: {'learning_rate': 0.13286237005274604, 'aft_                                                                     loss_distribution': 'logistic', 'aft_loss_distribution_scale': 0.8036672496601526, 'max_depth': 4, 'booster': 'dart', 'scale_pos_weight':                                                                      6.980823872931533, 'alpha': 8.296121105255066, 'lambda': 7.918151897384132, 'eta': 0.9972122849127699, 'sampling_method': 'uniform', 'su                                                                     bsample': 0.8496512672531709, 'gamma': 6.947049330701931}. Best is trial 441 with value: 4.297868792635896.
[I 2023-12-21 02:53:09,698] Trial 442 pruned. Trial was pruned at iteration 0.
[I 2023-12-21 02:53:09,749] Trial 443 pruned. Trial was pruned at iteration 0.
[I 2023-12-21 02:53:09,801] Trial 444 pruned. Trial was pruned at iteration 0.
[I 2023-12-21 02:53:09,853] Trial 445 pruned. Trial was pruned at iteration 0.
[I 2023-12-21 02:53:09,906] Trial 446 pruned. Trial was pruned at iteration 0.
[I 2023-12-21 02:53:09,957] Trial 447 pruned. Trial was pruned at iteration 0.
[I 2023-12-21 02:53:10,011] Trial 448 pruned. Trial was pruned at iteration 0.
[I 2023-12-21 02:53:10,063] Trial 449 pruned. Trial was pruned at iteration 0.
[I 2023-12-21 02:53:10,114] Trial 450 pruned. Trial was pruned at iteration 0.
[I 2023-12-21 02:53:10,167] Trial 451 pruned. Trial was pruned at iteration 0.
[I 2023-12-21 02:53:10,220] Trial 452 pruned. Trial was pruned at iteration 0.
[I 2023-12-21 02:53:10,278] Trial 453 pruned. Trial was pruned at iteration 0.
[I 2023-12-21 02:53:10,331] Trial 454 pruned. Trial was pruned at iteration 0.
[I 2023-12-21 02:53:10,384] Trial 455 pruned. Trial was pruned at iteration 0.
[I 2023-12-21 02:53:16,173] Trial 456 pruned. Trial was pruned at iteration 133.
[I 2023-12-21 02:53:16,230] Trial 457 pruned. Trial was pruned at iteration 0.
[I 2023-12-21 02:53:16,282] Trial 458 pruned. Trial was pruned at iteration 0.
[I 2023-12-21 02:53:16,335] Trial 459 pruned. Trial was pruned at iteration 0.
[I 2023-12-21 02:53:16,387] Trial 460 pruned. Trial was pruned at iteration 0.
[I 2023-12-21 02:53:16,449] Trial 461 pruned. Trial was pruned at iteration 0.
[I 2023-12-21 02:53:16,501] Trial 462 pruned. Trial was pruned at iteration 0.
[I 2023-12-21 02:53:16,562] Trial 463 pruned. Trial was pruned at iteration 0.
[I 2023-12-21 02:53:16,621] Trial 464 pruned. Trial was pruned at iteration 0.
[I 2023-12-21 02:53:16,675] Trial 465 pruned. Trial was pruned at iteration 0.
[I 2023-12-21 02:53:16,727] Trial 466 pruned. Trial was pruned at iteration 0.
[I 2023-12-21 02:53:39,635] Trial 467 finished with value: 4.313753791802248 and parameters: {'learning_rate': 0.14706043932939178, 'aft_                                                                     loss_distribution': 'logistic', 'aft_loss_distribution_scale': 0.7664655923024914, 'max_depth': 10, 'booster': 'dart', 'scale_pos_weight'                                                                     : 6.558664205485074, 'alpha': 8.996178447471491, 'lambda': 6.678391920692484, 'eta': 0.9809665981476121, 'sampling_method': 'uniform', 's                                                                     ubsample': 0.8344146681716191, 'gamma': 8.920657574926071}. Best is trial 441 with value: 4.297868792635896.
[I 2023-12-21 02:53:51,842] Trial 468 finished with value: 4.290949582576443 and parameters: {'learning_rate': 0.11138115787772378, 'aft_                                                                     loss_distribution': 'logistic', 'aft_loss_distribution_scale': 0.7264946819149076, 'max_depth': 10, 'booster': 'dart', 'scale_pos_weight'                                                                     : 6.503252382366997, 'alpha': 3.995425651256526, 'lambda': 6.7360004391306605, 'eta': 0.9829402898267392, 'sampling_method': 'uniform', '                                                                     subsample': 0.8286342204854947, 'gamma': 3.581416647799192}. Best is trial 468 with value: 4.290949582576443.
[I 2023-12-21 02:53:51,907] Trial 469 pruned. Trial was pruned at iteration 0.
[I 2023-12-21 02:53:51,959] Trial 470 pruned. Trial was pruned at iteration 0.
[I 2023-12-21 02:53:52,016] Trial 471 pruned. Trial was pruned at iteration 0.
[I 2023-12-21 02:53:52,076] Trial 472 pruned. Trial was pruned at iteration 0.
[I 2023-12-21 02:53:52,128] Trial 473 pruned. Trial was pruned at iteration 0.
[I 2023-12-21 02:53:52,187] Trial 474 pruned. Trial was pruned at iteration 0.
[I 2023-12-21 02:53:52,246] Trial 475 pruned. Trial was pruned at iteration 0.
[I 2023-12-21 02:53:52,307] Trial 476 pruned. Trial was pruned at iteration 0.
[I 2023-12-21 02:53:52,360] Trial 477 pruned. Trial was pruned at iteration 0.
[I 2023-12-21 02:53:52,415] Trial 478 pruned. Trial was pruned at iteration 0.
[I 2023-12-21 02:53:52,468] Trial 479 pruned. Trial was pruned at iteration 0.
[I 2023-12-21 02:53:52,520] Trial 480 pruned. Trial was pruned at iteration 0.
[I 2023-12-21 02:53:52,581] Trial 481 pruned. Trial was pruned at iteration 0.
[I 2023-12-21 02:53:52,634] Trial 482 pruned. Trial was pruned at iteration 0.
[I 2023-12-21 02:53:52,690] Trial 483 pruned. Trial was pruned at iteration 0.
[I 2023-12-21 02:53:52,759] Trial 484 pruned. Trial was pruned at iteration 0.
[I 2023-12-21 02:53:52,813] Trial 485 pruned. Trial was pruned at iteration 0.
[I 2023-12-21 02:53:52,868] Trial 486 pruned. Trial was pruned at iteration 0.
[I 2023-12-21 02:53:52,921] Trial 487 pruned. Trial was pruned at iteration 0.
[I 2023-12-21 02:55:07,767] Trial 488 finished with value: 4.333646498559397 and parameters: {'learning_rate': 0.16106925943677372, 'aft_                                                                     loss_distribution': 'logistic', 'aft_loss_distribution_scale': 0.807806318918455, 'max_depth': 10, 'booster': 'dart', 'scale_pos_weight':                                                                      7.61807847199618, 'alpha': 8.865540574085864, 'lambda': 6.746879275016393, 'eta': 0.9658973898178511, 'sampling_method': 'uniform', 'sub                                                                     sample': 0.8657475586817143, 'gamma': 9.38578388990144}. Best is trial 468 with value: 4.290949582576443.
[I 2023-12-21 02:55:07,837] Trial 489 pruned. Trial was pruned at iteration 0.
[I 2023-12-21 02:55:07,898] Trial 490 pruned. Trial was pruned at iteration 0.
[I 2023-12-21 02:55:07,952] Trial 491 pruned. Trial was pruned at iteration 0.
[I 2023-12-21 02:55:08,005] Trial 492 pruned. Trial was pruned at iteration 0.
[I 2023-12-21 02:55:08,064] Trial 493 pruned. Trial was pruned at iteration 0.
[I 2023-12-21 02:55:08,123] Trial 494 pruned. Trial was pruned at iteration 0.
[I 2023-12-21 02:55:08,188] Trial 495 pruned. Trial was pruned at iteration 0.
[I 2023-12-21 02:55:08,253] Trial 496 pruned. Trial was pruned at iteration 0.
[I 2023-12-21 02:55:08,315] Trial 497 pruned. Trial was pruned at iteration 0.
[I 2023-12-21 02:55:08,369] Trial 498 pruned. Trial was pruned at iteration 0.
[I 2023-12-21 02:55:08,422] Trial 499 pruned. Trial was pruned at iteration 0.
[W 2023-12-21 02:55:20,707] Trial 3 is omitted in visualization because its objective value is inf or nan.
[W 2023-12-21 02:55:20,708] Trial 26 is omitted in visualization because its objective value is inf or nan.
[W 2023-12-21 02:55:20,708] Trial 38 is omitted in visualization because its objective value is inf or nan.
[W 2023-12-21 02:55:20,708] Trial 41 is omitted in visualization because its objective value is inf or nan.
[W 2023-12-21 02:55:20,708] Trial 42 is omitted in visualization because its objective value is inf or nan.
[W 2023-12-21 02:55:20,708] Trial 45 is omitted in visualization because its objective value is inf or nan.
[W 2023-12-21 02:55:20,708] Trial 54 is omitted in visualization because its objective value is inf or nan.
[W 2023-12-21 02:55:20,708] Trial 71 is omitted in visualization because its objective value is inf or nan.
[W 2023-12-21 02:55:20,708] Trial 82 is omitted in visualization because its objective value is inf or nan.
[W 2023-12-21 02:55:20,708] Trial 92 is omitted in visualization because its objective value is inf or nan.
[W 2023-12-21 02:55:20,708] Trial 120 is omitted in visualization because its objective value is inf or nan.
[W 2023-12-21 02:55:20,708] Trial 126 is omitted in visualization because its objective value is inf or nan.
exo-open: Cannot open display: .
/cvmfs/soft.computecanada.ca/gentoo/2020/usr/bin/xdg-open: line 871: x-www-browser: command not found
/cvmfs/soft.computecanada.ca/gentoo/2020/usr/bin/xdg-open: line 871: firefox: command not found
/cvmfs/soft.computecanada.ca/gentoo/2020/usr/bin/xdg-open: line 871: iceweasel: command not found
/cvmfs/soft.computecanada.ca/gentoo/2020/usr/bin/xdg-open: line 871: seamonkey: command not found
/cvmfs/soft.computecanada.ca/gentoo/2020/usr/bin/xdg-open: line 871: mozilla: command not found
/cvmfs/soft.computecanada.ca/gentoo/2020/usr/bin/xdg-open: line 871: epiphany: command not found
/cvmfs/soft.computecanada.ca/gentoo/2020/usr/bin/xdg-open: line 871: konqueror: command not found
/cvmfs/soft.computecanada.ca/gentoo/2020/usr/bin/xdg-open: line 871: chromium: command not found
/cvmfs/soft.computecanada.ca/gentoo/2020/usr/bin/xdg-open: line 871: chromium-browser: command not found
/cvmfs/soft.computecanada.ca/gentoo/2020/usr/bin/xdg-open: line 871: google-chrome: command not found
/cvmfs/soft.computecanada.ca/gentoo/2020/usr/bin/xdg-open: line 871: www-browser: command not found
/cvmfs/soft.computecanada.ca/gentoo/2020/usr/bin/xdg-open: line 871: links2: command not found
/home/lisat/.local/lib/python3.10/site-packages/xgboost/data.py:440: FutureWarning:

is_sparse is deprecated and will be removed in a future version. Check `isinstance(dtype, pd.SparseDtype)` instead.

[I 2023-12-21 02:55:28,635] A new study created in memory with name: no-name-3fc0445b-dcb9-4c22-8007-172cc1b245b4
[I 2023-12-21 02:55:41,170] Trial 0 finished with value: 4.943250707728738 and parameters: {'learning_rate': 0.193404364696219, 'aft_loss                                                                     _distribution': 'extreme', 'aft_loss_distribution_scale': 3.011935950223768, 'max_depth': 8, 'booster': 'dart', 'scale_pos_weight': 5.674                                                                     468950149471, 'alpha': 1.5933955494260954, 'lambda': 9.248463333596703, 'eta': 0.6488930629288845, 'sampling_method': 'uniform', 'subsamp                                                                     le': 0.544204164818356, 'gamma': 9.18759348631418}. Best is trial 0 with value: 4.943250707728738.
