[I 2023-12-21 04:01:28,209] Trial 294 finished with value: 4.258064997821461 and parameters: {'learning_rate': 0.8904315416644851, 'aft_l                                                                     oss_distribution': 'normal', 'aft_loss_distribution_scale': 1.1547502415971762, 'max_depth': 6, 'booster': 'gbtree', 'scale_pos_weight':                                                                      2.3474798588903947, 'alpha': 7.860397110325219, 'lambda': 8.81292517881503, 'eta': 0.4661302346684618, 'sampling_method': 'gradient_based                                                                     ', 'subsample': 0.8794087520284511, 'gamma': 4.111253684347136}. Best is trial 81 with value: 4.234078754776428.
[I 2023-12-21 04:01:28,323] Trial 295 finished with value: inf and parameters: {'learning_rate': 0.9263891522024064, 'aft_loss_distributi                                                                     on': 'normal', 'aft_loss_distribution_scale': 1.023240430158074, 'max_depth': 6, 'booster': 'gbtree', 'scale_pos_weight': 5.7774263498827                                                                     45, 'alpha': 7.903189499077031, 'lambda': 9.307322699214893, 'eta': 0.47659804972584674, 'sampling_method': 'gradient_based', 'subsample'                                                                     : 0.8349887771689094, 'gamma': 5.081922258279738}. Best is trial 81 with value: 4.234078754776428.
[I 2023-12-21 04:01:28,367] Trial 296 pruned. Trial was pruned at iteration 0.
[I 2023-12-21 04:01:28,411] Trial 297 pruned. Trial was pruned at iteration 0.
[I 2023-12-21 04:01:28,455] Trial 298 pruned. Trial was pruned at iteration 1.
[I 2023-12-21 04:01:28,575] Trial 299 finished with value: inf and parameters: {'learning_rate': 0.8922522687198124, 'aft_loss_distributi                                                                     on': 'normal', 'aft_loss_distribution_scale': 1.0997182999120159, 'max_depth': 6, 'booster': 'gbtree', 'scale_pos_weight': 2.391038468616                                                                     7827, 'alpha': 7.657466057911566, 'lambda': 9.488671489473681, 'eta': 0.4716541915597963, 'sampling_method': 'gradient_based', 'subsample                                                                     ': 0.9795075114796172, 'gamma': 4.340908570438974}. Best is trial 81 with value: 4.234078754776428.
[I 2023-12-21 04:01:28,617] Trial 300 pruned. Trial was pruned at iteration 0.
[I 2023-12-21 04:01:28,660] Trial 301 pruned. Trial was pruned at iteration 0.
[I 2023-12-21 04:01:28,702] Trial 302 pruned. Trial was pruned at iteration 0.
[I 2023-12-21 04:01:28,901] Trial 303 finished with value: 4.256270663065907 and parameters: {'learning_rate': 0.8573979946012126, 'aft_l                                                                     oss_distribution': 'normal', 'aft_loss_distribution_scale': 1.157119562637842, 'max_depth': 5, 'booster': 'gbtree', 'scale_pos_weight': 2                                                                     .0887326535481923, 'alpha': 7.021143228578749, 'lambda': 1.6208942159406876, 'eta': 0.49149296503667217, 'sampling_method': 'gradient_bas                                                                     ed', 'subsample': 0.8322084407300525, 'gamma': 4.6633232967643075}. Best is trial 81 with value: 4.234078754776428.
[I 2023-12-21 04:01:29,036] Trial 304 finished with value: inf and parameters: {'learning_rate': 0.8533352678251576, 'aft_loss_distributi                                                                     on': 'normal', 'aft_loss_distribution_scale': 1.0010649028297107, 'max_depth': 5, 'booster': 'gbtree', 'scale_pos_weight': 2.044184702413                                                                     8067, 'alpha': 7.11896557526446, 'lambda': 1.750996429620912, 'eta': 0.46898116533960876, 'sampling_method': 'gradient_based', 'subsample                                                                     ': 0.9460622851562813, 'gamma': 4.879597800007464}. Best is trial 81 with value: 4.234078754776428.
[I 2023-12-21 04:01:29,080] Trial 305 pruned. Trial was pruned at iteration 0.
[I 2023-12-21 04:01:29,292] Trial 306 finished with value: 4.255601265918399 and parameters: {'learning_rate': 0.8382066221428492, 'aft_l                                                                     oss_distribution': 'normal', 'aft_loss_distribution_scale': 1.1845344212866287, 'max_depth': 6, 'booster': 'gbtree', 'scale_pos_weight':                                                                      1.8412168976108731, 'alpha': 7.3699939481580055, 'lambda': 1.5499969310981567, 'eta': 0.49497972048562916, 'sampling_method': 'gradient_b                                                                     ased', 'subsample': 0.9156438705378636, 'gamma': 4.450329183764208}. Best is trial 81 with value: 4.234078754776428.
[I 2023-12-21 04:01:29,338] Trial 307 pruned. Trial was pruned at iteration 0.
[I 2023-12-21 04:01:29,383] Trial 308 pruned. Trial was pruned at iteration 1.
[I 2023-12-21 04:01:29,563] Trial 309 finished with value: 4.256338069368343 and parameters: {'learning_rate': 0.8433087602113504, 'aft_l                                                                     oss_distribution': 'normal', 'aft_loss_distribution_scale': 1.144442377626457, 'max_depth': 6, 'booster': 'gbtree', 'scale_pos_weight': 2                                                                     .3108536160027473, 'alpha': 6.855219914980019, 'lambda': 1.4761339025416162, 'eta': 0.3485105679963627, 'sampling_method': 'gradient_base                                                                     d', 'subsample': 0.8927196924640018, 'gamma': 4.9609844451816105}. Best is trial 81 with value: 4.234078754776428.
[I 2023-12-21 04:01:29,608] Trial 310 pruned. Trial was pruned at iteration 1.
[I 2023-12-21 04:01:29,653] Trial 311 pruned. Trial was pruned at iteration 1.
[I 2023-12-21 04:01:29,698] Trial 312 pruned. Trial was pruned at iteration 0.
[I 2023-12-21 04:01:29,886] Trial 313 finished with value: 4.248753797172905 and parameters: {'learning_rate': 0.8261823074708671, 'aft_l                                                                     oss_distribution': 'normal', 'aft_loss_distribution_scale': 1.108219451194974, 'max_depth': 6, 'booster': 'gbtree', 'scale_pos_weight': 1                                                                     .9010168649705075, 'alpha': 6.769635356490563, 'lambda': 1.4382824179909588, 'eta': 0.3429980482308674, 'sampling_method': 'gradient_base                                                                     d', 'subsample': 0.9318873338057946, 'gamma': 4.4595897988891045}. Best is trial 81 with value: 4.234078754776428.
[I 2023-12-21 04:01:30,047] Trial 314 finished with value: 4.241541344690224 and parameters: {'learning_rate': 0.8759851925394282, 'aft_l                                                                     oss_distribution': 'normal', 'aft_loss_distribution_scale': 1.0472896663740705, 'max_depth': 6, 'booster': 'gbtree', 'scale_pos_weight':                                                                      1.9848620584359329, 'alpha': 9.568539780626942, 'lambda': 1.230811272916262, 'eta': 0.34657221328374854, 'sampling_method': 'gradient_bas                                                                     ed', 'subsample': 0.9205812310872771, 'gamma': 4.75999066193325}. Best is trial 81 with value: 4.234078754776428.
[I 2023-12-21 04:01:30,091] Trial 315 pruned. Trial was pruned at iteration 0.
[I 2023-12-21 04:01:30,210] Trial 316 finished with value: inf and parameters: {'learning_rate': 0.8760607541292987, 'aft_loss_distributi                                                                     on': 'normal', 'aft_loss_distribution_scale': 0.9710890079539963, 'max_depth': 6, 'booster': 'gbtree', 'scale_pos_weight': 1.651818288222                                                                     1457, 'alpha': 9.908022301036054, 'lambda': 1.5265760047473709, 'eta': 0.35991430108899064, 'sampling_method': 'gradient_based', 'subsamp                                                                     le': 0.9110521826389416, 'gamma': 5.106197441812194}. Best is trial 81 with value: 4.234078754776428.
[I 2023-12-21 04:01:30,332] Trial 317 finished with value: inf and parameters: {'learning_rate': 0.902971375856117, 'aft_loss_distributio                                                                     n': 'normal', 'aft_loss_distribution_scale': 1.0506434536772162, 'max_depth': 6, 'booster': 'gbtree', 'scale_pos_weight': 1.8137544606019                                                                     815, 'alpha': 6.909770878694461, 'lambda': 1.4403410622220612, 'eta': 0.34305238893676093, 'sampling_method': 'gradient_based', 'subsampl                                                                     e': 0.9371498345641331, 'gamma': 4.413922294959356}. Best is trial 81 with value: 4.234078754776428.
[I 2023-12-21 04:01:30,377] Trial 318 pruned. Trial was pruned at iteration 0.
[I 2023-12-21 04:01:30,421] Trial 319 pruned. Trial was pruned at iteration 0.
[I 2023-12-21 04:01:30,466] Trial 320 pruned. Trial was pruned at iteration 1.
[I 2023-12-21 04:01:30,623] Trial 321 finished with value: 4.253656222257051 and parameters: {'learning_rate': 0.8312293461513166, 'aft_l                                                                     oss_distribution': 'normal', 'aft_loss_distribution_scale': 1.1154169213669032, 'max_depth': 6, 'booster': 'gbtree', 'scale_pos_weight':                                                                      2.1652935386101104, 'alpha': 6.229498610675616, 'lambda': 1.6788134462269486, 'eta': 0.3829820673979432, 'sampling_method': 'gradient_bas                                                                     ed', 'subsample': 0.9271363201945256, 'gamma': 4.275896602031878}. Best is trial 81 with value: 4.234078754776428.
[I 2023-12-21 04:01:30,667] Trial 322 pruned. Trial was pruned at iteration 0.
[I 2023-12-21 04:01:30,713] Trial 323 pruned. Trial was pruned at iteration 1.
[I 2023-12-21 04:01:30,756] Trial 324 pruned. Trial was pruned at iteration 0.
[I 2023-12-21 04:01:30,800] Trial 325 pruned. Trial was pruned at iteration 0.
[I 2023-12-21 04:01:30,846] Trial 326 pruned. Trial was pruned at iteration 1.
[I 2023-12-21 04:01:31,028] Trial 327 finished with value: 4.24741979440791 and parameters: {'learning_rate': 0.8286801428890042, 'aft_lo                                                                     ss_distribution': 'normal', 'aft_loss_distribution_scale': 0.969441690861768, 'max_depth': 6, 'booster': 'gbtree', 'scale_pos_weight': 2.                                                                     4340826208227404, 'alpha': 7.184588958427067, 'lambda': 1.6404427079872865, 'eta': 0.4167567460623087, 'sampling_method': 'gradient_based                                                                     ', 'subsample': 0.9345216519657938, 'gamma': 7.873283032241949}. Best is trial 81 with value: 4.234078754776428.
[I 2023-12-21 04:01:31,073] Trial 328 pruned. Trial was pruned at iteration 0.
[I 2023-12-21 04:01:31,118] Trial 329 pruned. Trial was pruned at iteration 0.
[I 2023-12-21 04:01:31,161] Trial 330 pruned. Trial was pruned at iteration 0.
[I 2023-12-21 04:01:31,206] Trial 331 pruned. Trial was pruned at iteration 0.
[I 2023-12-21 04:01:31,267] Trial 332 pruned. Trial was pruned at iteration 12.
[I 2023-12-21 04:01:31,317] Trial 333 pruned. Trial was pruned at iteration 1.
[I 2023-12-21 04:01:31,366] Trial 334 pruned. Trial was pruned at iteration 1.
[I 2023-12-21 04:01:31,410] Trial 335 pruned. Trial was pruned at iteration 0.
[I 2023-12-21 04:01:31,454] Trial 336 pruned. Trial was pruned at iteration 0.
[I 2023-12-21 04:01:31,576] Trial 337 finished with value: inf and parameters: {'learning_rate': 0.84612021879291, 'aft_loss_distribution                                                                     ': 'normal', 'aft_loss_distribution_scale': 1.1033232406453555, 'max_depth': 6, 'booster': 'gbtree', 'scale_pos_weight': 2.30222859127242                                                                     03, 'alpha': 7.5675939029988495, 'lambda': 1.6501999098627569, 'eta': 0.43440242610714686, 'sampling_method': 'gradient_based', 'subsampl                                                                     e': 0.9313563201597168, 'gamma': 3.018819765085742}. Best is trial 81 with value: 4.234078754776428.
[I 2023-12-21 04:01:31,621] Trial 338 pruned. Trial was pruned at iteration 0.
[I 2023-12-21 04:01:31,665] Trial 339 pruned. Trial was pruned at iteration 0.
[I 2023-12-21 04:01:31,787] Trial 340 finished with value: inf and parameters: {'learning_rate': 0.8612298810768481, 'aft_loss_distributi                                                                     on': 'normal', 'aft_loss_distribution_scale': 1.042932176164781, 'max_depth': 5, 'booster': 'gbtree', 'scale_pos_weight': 2.5344215291271                                                                     213, 'alpha': 7.139276871907085, 'lambda': 1.1995798793031036, 'eta': 0.4789354018233944, 'sampling_method': 'gradient_based', 'subsample                                                                     ': 0.888063713037195, 'gamma': 4.335423769210724}. Best is trial 81 with value: 4.234078754776428.
[I 2023-12-21 04:01:31,835] Trial 341 pruned. Trial was pruned at iteration 1.
[I 2023-12-21 04:01:31,880] Trial 342 pruned. Trial was pruned at iteration 0.
[I 2023-12-21 04:01:31,925] Trial 343 pruned. Trial was pruned at iteration 0.
[I 2023-12-21 04:01:32,080] Trial 344 finished with value: 4.251976237839183 and parameters: {'learning_rate': 0.841695263743063, 'aft_lo                                                                     ss_distribution': 'normal', 'aft_loss_distribution_scale': 1.0329217802594712, 'max_depth': 6, 'booster': 'gbtree', 'scale_pos_weight': 2                                                                     .6163074231374512, 'alpha': 7.198171219555522, 'lambda': 1.0524848508653781, 'eta': 0.3380878357950207, 'sampling_method': 'gradient_base                                                                     d', 'subsample': 0.944406813910122, 'gamma': 9.101462441521445}. Best is trial 81 with value: 4.234078754776428.
[I 2023-12-21 04:01:32,126] Trial 345 pruned. Trial was pruned at iteration 0.
[I 2023-12-21 04:01:32,277] Trial 346 finished with value: 4.252128621729198 and parameters: {'learning_rate': 0.8718024943705645, 'aft_l                                                                     oss_distribution': 'normal', 'aft_loss_distribution_scale': 0.9485486230765261, 'max_depth': 6, 'booster': 'gbtree', 'scale_pos_weight':                                                                      2.7634859336735893, 'alpha': 8.756813027547308, 'lambda': 1.3073220275446817, 'eta': 0.3822787944840273, 'sampling_method': 'gradient_bas                                                                     ed', 'subsample': 0.9751107198797433, 'gamma': 9.768599425507604}. Best is trial 81 with value: 4.234078754776428.
[I 2023-12-21 04:01:32,323] Trial 347 pruned. Trial was pruned at iteration 0.
[I 2023-12-21 04:01:32,367] Trial 348 pruned. Trial was pruned at iteration 0.
[I 2023-12-21 04:01:32,413] Trial 349 pruned. Trial was pruned at iteration 0.
[I 2023-12-21 04:01:32,532] Trial 350 finished with value: inf and parameters: {'learning_rate': 0.8590054211805583, 'aft_loss_distributi                                                                     on': 'normal', 'aft_loss_distribution_scale': 0.9609349876011367, 'max_depth': 6, 'booster': 'gbtree', 'scale_pos_weight': 2.226978756895                                                                     0496, 'alpha': 9.706263194503915, 'lambda': 1.2581075655760654, 'eta': 0.35228604093732596, 'sampling_method': 'gradient_based', 'subsamp                                                                     le': 0.9593838495519718, 'gamma': 9.958723848004988}. Best is trial 81 with value: 4.234078754776428.
[I 2023-12-21 04:01:32,581] Trial 351 pruned. Trial was pruned at iteration 2.
[I 2023-12-21 04:01:32,625] Trial 352 pruned. Trial was pruned at iteration 0.
[I 2023-12-21 04:01:32,996] Trial 353 finished with value: 4.248152794173654 and parameters: {'learning_rate': 0.9217078437913001, 'aft_l                                                                     oss_distribution': 'normal', 'aft_loss_distribution_scale': 1.078081701396754, 'max_depth': 6, 'booster': 'gbtree', 'scale_pos_weight': 2                                                                     .347251737856503, 'alpha': 7.24302226849709, 'lambda': 1.502738732574747, 'eta': 0.33272283690033994, 'sampling_method': 'gradient_based'                                                                     , 'subsample': 0.9214063850047515, 'gamma': 9.807619104203045}. Best is trial 81 with value: 4.234078754776428.
[I 2023-12-21 04:01:33,043] Trial 354 pruned. Trial was pruned at iteration 1.
[I 2023-12-21 04:01:33,088] Trial 355 pruned. Trial was pruned at iteration 0.
[I 2023-12-21 04:01:33,136] Trial 356 pruned. Trial was pruned at iteration 1.
[I 2023-12-21 04:01:33,184] Trial 357 pruned. Trial was pruned at iteration 1.
[I 2023-12-21 04:01:33,232] Trial 358 pruned. Trial was pruned at iteration 1.
[I 2023-12-21 04:01:33,399] Trial 359 finished with value: 4.257702382593914 and parameters: {'learning_rate': 0.8601526299452253, 'aft_l                                                                     oss_distribution': 'normal', 'aft_loss_distribution_scale': 1.1380685615753259, 'max_depth': 6, 'booster': 'gbtree', 'scale_pos_weight':                                                                      2.8009701044457125, 'alpha': 8.821111453750259, 'lambda': 1.8295637178475777, 'eta': 0.3334303663488791, 'sampling_method': 'gradient_bas                                                                     ed', 'subsample': 0.9033234766129188, 'gamma': 9.897928966014007}. Best is trial 81 with value: 4.234078754776428.
[I 2023-12-21 04:01:33,447] Trial 360 pruned. Trial was pruned at iteration 0.
[I 2023-12-21 04:01:33,492] Trial 361 pruned. Trial was pruned at iteration 0.
[I 2023-12-21 04:01:33,540] Trial 362 pruned. Trial was pruned at iteration 1.
[I 2023-12-21 04:01:33,706] Trial 363 finished with value: 4.2590119037615715 and parameters: {'learning_rate': 0.8456219900065902, 'aft_                                                                     loss_distribution': 'normal', 'aft_loss_distribution_scale': 1.1475749561144544, 'max_depth': 6, 'booster': 'gbtree', 'scale_pos_weight':                                                                      2.8378841675297743, 'alpha': 7.103046883817199, 'lambda': 2.4088998339443957, 'eta': 0.3081383677896572, 'sampling_method': 'gradient_ba                                                                     sed', 'subsample': 0.9767507006240115, 'gamma': 9.9873839647245}. Best is trial 81 with value: 4.234078754776428.
[I 2023-12-21 04:01:33,754] Trial 364 pruned. Trial was pruned at iteration 1.
[I 2023-12-21 04:01:33,935] Trial 365 finished with value: 4.249533987847459 and parameters: {'learning_rate': 0.8748706504551051, 'aft_l                                                                     oss_distribution': 'normal', 'aft_loss_distribution_scale': 0.9280271408842973, 'max_depth': 6, 'booster': 'gbtree', 'scale_pos_weight':                                                                      1.3293796793713781, 'alpha': 8.823283666658988, 'lambda': 1.2532132913995313, 'eta': 0.3663447384141688, 'sampling_method': 'gradient_bas                                                                     ed', 'subsample': 0.9071650492596784, 'gamma': 9.23846297102634}. Best is trial 81 with value: 4.234078754776428.
[I 2023-12-21 04:01:33,981] Trial 366 pruned. Trial was pruned at iteration 0.
[I 2023-12-21 04:01:34,033] Trial 367 pruned. Trial was pruned at iteration 3.
[I 2023-12-21 04:01:34,078] Trial 368 pruned. Trial was pruned at iteration 0.
[I 2023-12-21 04:01:34,124] Trial 369 pruned. Trial was pruned at iteration 0.
[I 2023-12-21 04:01:34,171] Trial 370 pruned. Trial was pruned at iteration 0.
[I 2023-12-21 04:01:34,219] Trial 371 pruned. Trial was pruned at iteration 1.
[I 2023-12-21 04:01:34,265] Trial 372 pruned. Trial was pruned at iteration 0.
[I 2023-12-21 04:01:34,314] Trial 373 pruned. Trial was pruned at iteration 1.
[I 2023-12-21 04:01:34,360] Trial 374 pruned. Trial was pruned at iteration 0.
[I 2023-12-21 04:01:34,406] Trial 375 pruned. Trial was pruned at iteration 0.
[I 2023-12-21 04:01:34,617] Trial 376 finished with value: 4.25171920385595 and parameters: {'learning_rate': 0.8581077077613817, 'aft_lo                                                                     ss_distribution': 'normal', 'aft_loss_distribution_scale': 1.1038615947279984, 'max_depth': 6, 'booster': 'gbtree', 'scale_pos_weight': 1                                                                     .8826191395826861, 'alpha': 7.0185312180792625, 'lambda': 1.7250776783357757, 'eta': 0.3620479643059894, 'sampling_method': 'gradient_bas                                                                     ed', 'subsample': 0.8256000645937436, 'gamma': 9.809879259249623}. Best is trial 81 with value: 4.234078754776428.
[I 2023-12-21 04:01:34,668] Trial 377 pruned. Trial was pruned at iteration 0.
[I 2023-12-21 04:01:34,714] Trial 378 pruned. Trial was pruned at iteration 0.
