[I 2023-12-21 04:14:22,821] Trial 425 pruned. Trial was pruned at iteration 0.
[I 2023-12-21 04:14:22,869] Trial 426 pruned. Trial was pruned at iteration 0.
[I 2023-12-21 04:14:22,916] Trial 427 pruned. Trial was pruned at iteration 0.
[I 2023-12-21 04:14:22,965] Trial 428 pruned. Trial was pruned at iteration 0.
[I 2023-12-21 04:14:23,093] Trial 429 finished with value: inf and parameters: {'learning_rate': 0.9998178868639462, 'aft_loss_distributi                                                                     on': 'normal', 'aft_loss_distribution_scale': 2.016120491798086, 'max_depth': 6, 'booster': 'gbtree', 'scale_pos_weight': 1.0160759642517                                                                     75, 'alpha': 9.267127542591018, 'lambda': 4.619665098085909, 'eta': 0.951008502714356, 'sampling_method': 'uniform', 'subsample': 0.10066                                                                     234574496624, 'gamma': 8.041505625829211}. Best is trial 255 with value: 2.0370667337922805.
[I 2023-12-21 04:14:23,295] Trial 430 finished with value: inf and parameters: {'learning_rate': 0.9731390468443795, 'aft_loss_distributi                                                                     on': 'normal', 'aft_loss_distribution_scale': 1.5238229194412294, 'max_depth': 7, 'booster': 'gbtree', 'scale_pos_weight': 1.748255417300                                                                     63, 'alpha': 9.569329052935705, 'lambda': 3.7110656585711332, 'eta': 0.8210742612042533, 'sampling_method': 'uniform', 'subsample': 0.171                                                                     14120423231166, 'gamma': 7.515429950979962}. Best is trial 255 with value: 2.0370667337922805.
[I 2023-12-21 04:14:23,347] Trial 431 pruned. Trial was pruned at iteration 0.
[I 2023-12-21 04:14:23,395] Trial 432 pruned. Trial was pruned at iteration 0.
[I 2023-12-21 04:14:23,442] Trial 433 pruned. Trial was pruned at iteration 0.
[I 2023-12-21 04:14:23,489] Trial 434 pruned. Trial was pruned at iteration 0.
[I 2023-12-21 04:14:23,537] Trial 435 pruned. Trial was pruned at iteration 0.
[I 2023-12-21 04:14:23,586] Trial 436 pruned. Trial was pruned at iteration 1.
[I 2023-12-21 04:14:23,708] Trial 437 finished with value: inf and parameters: {'learning_rate': 0.9410467809149979, 'aft_loss_distributi                                                                     on': 'normal', 'aft_loss_distribution_scale': 1.7837613904865424, 'max_depth': 6, 'booster': 'gbtree', 'scale_pos_weight': 1.828450764357                                                                     442, 'alpha': 8.923856342815137, 'lambda': 4.186421707762292, 'eta': 0.8610304489327633, 'sampling_method': 'uniform', 'subsample': 0.139                                                                     16791285131888, 'gamma': 6.861011515679815}. Best is trial 255 with value: 2.0370667337922805.
[I 2023-12-21 04:14:23,756] Trial 438 pruned. Trial was pruned at iteration 0.
[I 2023-12-21 04:14:23,804] Trial 439 pruned. Trial was pruned at iteration 0.
[I 2023-12-21 04:14:23,852] Trial 440 pruned. Trial was pruned at iteration 0.
[I 2023-12-21 04:14:23,904] Trial 441 pruned. Trial was pruned at iteration 1.
[I 2023-12-21 04:14:23,952] Trial 442 pruned. Trial was pruned at iteration 0.
[I 2023-12-21 04:14:24,000] Trial 443 pruned. Trial was pruned at iteration 0.
[I 2023-12-21 04:14:24,050] Trial 444 pruned. Trial was pruned at iteration 0.
[I 2023-12-21 04:14:24,100] Trial 445 pruned. Trial was pruned at iteration 0.
[I 2023-12-21 04:14:24,148] Trial 446 pruned. Trial was pruned at iteration 0.
[I 2023-12-21 04:14:24,263] Trial 447 finished with value: inf and parameters: {'learning_rate': 0.9828020867870958, 'aft_loss_distributi                                                                     on': 'normal', 'aft_loss_distribution_scale': 1.7475550261545931, 'max_depth': 6, 'booster': 'gbtree', 'scale_pos_weight': 1.388099388753                                                                     5586, 'alpha': 9.62942689091392, 'lambda': 4.40676262467832, 'eta': 0.845692327960538, 'sampling_method': 'uniform', 'subsample': 0.10729                                                                     702686182596, 'gamma': 6.098888001394751}. Best is trial 255 with value: 2.0370667337922805.
[I 2023-12-21 04:14:24,311] Trial 448 pruned. Trial was pruned at iteration 0.
[I 2023-12-21 04:14:24,431] Trial 449 finished with value: inf and parameters: {'learning_rate': 0.9311635670253645, 'aft_loss_distributi                                                                     on': 'normal', 'aft_loss_distribution_scale': 1.9823244434334943, 'max_depth': 7, 'booster': 'gbtree', 'scale_pos_weight': 1.556201258591                                                                     387, 'alpha': 9.384730526500386, 'lambda': 4.2051980714606545, 'eta': 0.8303778197886089, 'sampling_method': 'uniform', 'subsample': 0.99                                                                     25425701397741, 'gamma': 6.655763050660513}. Best is trial 255 with value: 2.0370667337922805.
[I 2023-12-21 04:14:24,544] Trial 450 finished with value: inf and parameters: {'learning_rate': 0.999967406819317, 'aft_loss_distributio                                                                     n': 'normal', 'aft_loss_distribution_scale': 1.6205077756525916, 'max_depth': 6, 'booster': 'gbtree', 'scale_pos_weight': 1.7833901820161                                                                     757, 'alpha': 9.830231915707182, 'lambda': 5.223238845461846, 'eta': 0.8569169306894378, 'sampling_method': 'uniform', 'subsample': 0.084                                                                     07717159042043, 'gamma': 6.928300356849227}. Best is trial 255 with value: 2.0370667337922805.
[I 2023-12-21 04:14:24,592] Trial 451 pruned. Trial was pruned at iteration 0.
[I 2023-12-21 04:14:24,642] Trial 452 pruned. Trial was pruned at iteration 0.
[I 2023-12-21 04:14:24,819] Trial 453 finished with value: inf and parameters: {'learning_rate': 0.9686764982960844, 'aft_loss_distributi                                                                     on': 'normal', 'aft_loss_distribution_scale': 1.430841117013354, 'max_depth': 6, 'booster': 'gbtree', 'scale_pos_weight': 1.9044385780226                                                                     01, 'alpha': 9.23482003989796, 'lambda': 4.458789946775833, 'eta': 0.9345776569711941, 'sampling_method': 'uniform', 'subsample': 0.10883                                                                     823158638306, 'gamma': 7.217066508505782}. Best is trial 255 with value: 2.0370667337922805.
[I 2023-12-21 04:14:24,868] Trial 454 pruned. Trial was pruned at iteration 0.
[I 2023-12-21 04:14:24,917] Trial 455 pruned. Trial was pruned at iteration 0.
[I 2023-12-21 04:14:24,965] Trial 456 pruned. Trial was pruned at iteration 0.
[I 2023-12-21 04:14:25,014] Trial 457 pruned. Trial was pruned at iteration 0.
[I 2023-12-21 04:14:25,141] Trial 458 finished with value: inf and parameters: {'learning_rate': 0.9430233201017908, 'aft_loss_distributi                                                                     on': 'normal', 'aft_loss_distribution_scale': 1.7579564048377927, 'max_depth': 6, 'booster': 'gbtree', 'scale_pos_weight': 1.655190693798                                                                     06, 'alpha': 9.322555362275185, 'lambda': 4.587264143992392, 'eta': 0.8469541156930195, 'sampling_method': 'uniform', 'subsample': 0.4516                                                                     9298833810384, 'gamma': 7.040254047607599}. Best is trial 255 with value: 2.0370667337922805.
[I 2023-12-21 04:14:25,192] Trial 459 pruned. Trial was pruned at iteration 0.
[I 2023-12-21 04:14:25,246] Trial 460 pruned. Trial was pruned at iteration 0.
[I 2023-12-21 04:14:25,296] Trial 461 pruned. Trial was pruned at iteration 0.
[I 2023-12-21 04:14:25,346] Trial 462 pruned. Trial was pruned at iteration 0.
[I 2023-12-21 04:14:25,457] Trial 463 finished with value: inf and parameters: {'learning_rate': 0.9998485856988314, 'aft_loss_distributi                                                                     on': 'normal', 'aft_loss_distribution_scale': 1.923014399171466, 'max_depth': 6, 'booster': 'gbtree', 'scale_pos_weight': 1.3527647007542                                                                     4, 'alpha': 9.25572079703523, 'lambda': 3.891298960841098, 'eta': 0.7998173078869453, 'sampling_method': 'uniform', 'subsample': 0.101647                                                                     91053834098, 'gamma': 8.112686349596332}. Best is trial 255 with value: 2.0370667337922805.
[I 2023-12-21 04:14:25,508] Trial 464 pruned. Trial was pruned at iteration 1.
[I 2023-12-21 04:14:25,558] Trial 465 pruned. Trial was pruned at iteration 0.
[I 2023-12-21 04:14:25,608] Trial 466 pruned. Trial was pruned at iteration 0.
[I 2023-12-21 04:14:25,659] Trial 467 pruned. Trial was pruned at iteration 0.
[I 2023-12-21 04:14:25,708] Trial 468 pruned. Trial was pruned at iteration 0.
[I 2023-12-21 04:14:25,839] Trial 469 finished with value: inf and parameters: {'learning_rate': 0.9998963394769087, 'aft_loss_distributi                                                                     on': 'normal', 'aft_loss_distribution_scale': 1.6347948677239201, 'max_depth': 6, 'booster': 'gbtree', 'scale_pos_weight': 1.264648473680                                                                     5006, 'alpha': 9.352381021987535, 'lambda': 5.02856148632673, 'eta': 0.7806904804176182, 'sampling_method': 'uniform', 'subsample': 0.102                                                                     51555508145557, 'gamma': 6.894077586999511}. Best is trial 255 with value: 2.0370667337922805.
[I 2023-12-21 04:14:25,889] Trial 470 pruned. Trial was pruned at iteration 0.
[I 2023-12-21 04:14:25,939] Trial 471 pruned. Trial was pruned at iteration 0.
[I 2023-12-21 04:14:25,989] Trial 472 pruned. Trial was pruned at iteration 0.
[I 2023-12-21 04:14:26,040] Trial 473 pruned. Trial was pruned at iteration 0.
[I 2023-12-21 04:14:26,095] Trial 474 pruned. Trial was pruned at iteration 2.
[I 2023-12-21 04:14:26,146] Trial 475 pruned. Trial was pruned at iteration 0.
[I 2023-12-21 04:14:26,195] Trial 476 pruned. Trial was pruned at iteration 0.
[I 2023-12-21 04:14:27,190] Trial 477 finished with value: inf and parameters: {'learning_rate': 0.9808745942051866, 'aft_loss_distributi                                                                     on': 'normal', 'aft_loss_distribution_scale': 1.6929741481134382, 'max_depth': 5, 'booster': 'dart', 'scale_pos_weight': 1.73767166509522                                                                     22, 'alpha': 9.696879892274744, 'lambda': 4.4176026863006745, 'eta': 0.7989313952264193, 'sampling_method': 'uniform', 'subsample': 0.098                                                                     3897242306568, 'gamma': 7.68693379198055}. Best is trial 255 with value: 2.0370667337922805.
[I 2023-12-21 04:14:27,241] Trial 478 pruned. Trial was pruned at iteration 0.
[I 2023-12-21 04:14:27,291] Trial 479 pruned. Trial was pruned at iteration 0.
[I 2023-12-21 04:14:27,342] Trial 480 pruned. Trial was pruned at iteration 0.
[I 2023-12-21 04:14:27,403] Trial 481 pruned. Trial was pruned at iteration 1.
[I 2023-12-21 04:14:27,453] Trial 482 pruned. Trial was pruned at iteration 0.
[I 2023-12-21 04:14:27,503] Trial 483 pruned. Trial was pruned at iteration 0.
[I 2023-12-21 04:14:27,553] Trial 484 pruned. Trial was pruned at iteration 0.
[I 2023-12-21 04:14:27,603] Trial 485 pruned. Trial was pruned at iteration 0.
[I 2023-12-21 04:14:27,653] Trial 486 pruned. Trial was pruned at iteration 0.
[I 2023-12-21 04:14:27,705] Trial 487 pruned. Trial was pruned at iteration 0.
[I 2023-12-21 04:14:27,756] Trial 488 pruned. Trial was pruned at iteration 0.
[I 2023-12-21 04:14:27,807] Trial 489 pruned. Trial was pruned at iteration 0.
[I 2023-12-21 04:14:27,857] Trial 490 pruned. Trial was pruned at iteration 0.
[I 2023-12-21 04:14:27,908] Trial 491 pruned. Trial was pruned at iteration 1.
[I 2023-12-21 04:14:28,029] Trial 492 finished with value: inf and parameters: {'learning_rate': 0.9867542345212637, 'aft_loss_distributi                                                                     on': 'normal', 'aft_loss_distribution_scale': 1.8892963425576774, 'max_depth': 7, 'booster': 'gbtree', 'scale_pos_weight': 1.499338798128                                                                     808, 'alpha': 9.647595579872858, 'lambda': 3.3651581991632518, 'eta': 0.8388043060953697, 'sampling_method': 'uniform', 'subsample': 0.10                                                                     203843584692651, 'gamma': 6.151833167031126}. Best is trial 255 with value: 2.0370667337922805.
[I 2023-12-21 04:14:28,079] Trial 493 pruned. Trial was pruned at iteration 0.
[I 2023-12-21 04:14:28,137] Trial 494 pruned. Trial was pruned at iteration 0.
[I 2023-12-21 04:14:28,188] Trial 495 pruned. Trial was pruned at iteration 0.
[I 2023-12-21 04:14:28,239] Trial 496 pruned. Trial was pruned at iteration 0.
[I 2023-12-21 04:14:28,290] Trial 497 pruned. Trial was pruned at iteration 0.
[I 2023-12-21 04:14:28,343] Trial 498 pruned. Trial was pruned at iteration 0.
