[I 2023-12-21 03:03:45,210] Trial 311 finished with value: inf and parameters: {'learning_rate': 0.8141983385115908, 'aft_loss_distributi                                                                     on': 'normal', 'aft_loss_distribution_scale': 1.3121639355684125, 'max_depth': 10, 'booster': 'dart', 'scale_pos_weight': 4.6409045273889                                                                     57, 'alpha': 6.587559143061675, 'lambda': 8.517227348266491, 'eta': 0.4671675596730592, 'sampling_method': 'uniform', 'subsample': 0.8167                                                                     609552181339, 'gamma': 6.63851911646094}. Best is trial 295 with value: 4.282522474682648.
[I 2023-12-21 03:03:54,025] Trial 312 finished with value: 4.309387774812649 and parameters: {'learning_rate': 0.7509662187254383, 'aft_l                                                                     oss_distribution': 'normal', 'aft_loss_distribution_scale': 1.3856043443970745, 'max_depth': 7, 'booster': 'dart', 'scale_pos_weight': 4.                                                                     922498199056855, 'alpha': 6.786834203001512, 'lambda': 8.343344882935943, 'eta': 0.441731075959594, 'sampling_method': 'uniform', 'subsam                                                                     ple': 0.7913538137216309, 'gamma': 6.290029712281954}. Best is trial 295 with value: 4.282522474682648.
[I 2023-12-21 03:03:54,068] Trial 313 pruned. Trial was pruned at iteration 0.
[I 2023-12-21 03:03:55,401] Trial 314 finished with value: inf and parameters: {'learning_rate': 0.7739580003276112, 'aft_loss_distributi                                                                     on': 'normal', 'aft_loss_distribution_scale': 1.2707745924269915, 'max_depth': 7, 'booster': 'dart', 'scale_pos_weight': 5.31588149322266                                                                     2, 'alpha': 6.37015748916948, 'lambda': 8.486662106524118, 'eta': 0.43469924356309697, 'sampling_method': 'uniform', 'subsample': 0.78869                                                                     27071576023, 'gamma': 7.831191485105322}. Best is trial 295 with value: 4.282522474682648.
[I 2023-12-21 03:03:55,443] Trial 315 pruned. Trial was pruned at iteration 0.
[I 2023-12-21 03:03:59,798] Trial 316 finished with value: 4.310911226383565 and parameters: {'learning_rate': 0.720912875183509, 'aft_lo                                                                     ss_distribution': 'normal', 'aft_loss_distribution_scale': 1.393718732322081, 'max_depth': 6, 'booster': 'dart', 'scale_pos_weight': 5.88                                                                     5163363564795, 'alpha': 8.175039551132107, 'lambda': 8.659721572988966, 'eta': 0.4538186249241178, 'sampling_method': 'uniform', 'subsamp                                                                     le': 0.8394057898500871, 'gamma': 6.075161903090461}. Best is trial 295 with value: 4.282522474682648.
[I 2023-12-21 03:03:59,842] Trial 317 pruned. Trial was pruned at iteration 0.
[I 2023-12-21 03:04:04,112] Trial 318 finished with value: 4.293434646928894 and parameters: {'learning_rate': 0.7575745002268006, 'aft_l                                                                     oss_distribution': 'normal', 'aft_loss_distribution_scale': 1.356577525146609, 'max_depth': 6, 'booster': 'dart', 'scale_pos_weight': 5.1                                                                     51181657469659, 'alpha': 8.394089729045966, 'lambda': 8.581959010039286, 'eta': 0.49447422287692316, 'sampling_method': 'uniform', 'subsa                                                                     mple': 0.8447074510896518, 'gamma': 7.097799465505415}. Best is trial 295 with value: 4.282522474682648.
[I 2023-12-21 03:04:05,252] Trial 319 finished with value: inf and parameters: {'learning_rate': 0.7567511293248875, 'aft_loss_distributi                                                                     on': 'normal', 'aft_loss_distribution_scale': 1.1681999477789595, 'max_depth': 6, 'booster': 'dart', 'scale_pos_weight': 5.22460939011544                                                                     05, 'alpha': 8.385791265628802, 'lambda': 8.65918502320448, 'eta': 0.4946323830507915, 'sampling_method': 'uniform', 'subsample': 0.04830                                                                     574653726061, 'gamma': 7.129877537623707}. Best is trial 295 with value: 4.282522474682648.
[I 2023-12-21 03:04:06,427] Trial 320 finished with value: inf and parameters: {'learning_rate': 0.7904754918684423, 'aft_loss_distributi                                                                     on': 'normal', 'aft_loss_distribution_scale': 1.337809907310251, 'max_depth': 6, 'booster': 'dart', 'scale_pos_weight': 4.77268586375826,                                                                      'alpha': 8.590428588758089, 'lambda': 8.86307011286831, 'eta': 0.5263151628095324, 'sampling_method': 'uniform', 'subsample': 0.84913229                                                                     56571564, 'gamma': 7.331655926266224}. Best is trial 295 with value: 4.282522474682648.
[I 2023-12-21 03:04:07,502] Trial 321 finished with value: inf and parameters: {'learning_rate': 0.7375265094826191, 'aft_loss_distributi                                                                     on': 'normal', 'aft_loss_distribution_scale': 1.0307927366357656, 'max_depth': 6, 'booster': 'dart', 'scale_pos_weight': 5.05692935718756                                                                     8, 'alpha': 8.907371410827276, 'lambda': 8.949977377312868, 'eta': 0.44936303055063803, 'sampling_method': 'uniform', 'subsample': 0.2514                                                                     951647909447, 'gamma': 6.2907415092676}. Best is trial 295 with value: 4.282522474682648.
[I 2023-12-21 03:04:09,433] Trial 322 finished with value: 4.283135307513649 and parameters: {'learning_rate': 0.7584074293909691, 'aft_l                                                                     oss_distribution': 'normal', 'aft_loss_distribution_scale': 1.29118232096216, 'max_depth': 6, 'booster': 'dart', 'scale_pos_weight': 4.45                                                                     229760823679, 'alpha': 8.061957097421244, 'lambda': 8.602136390266647, 'eta': 0.5107518411113049, 'sampling_method': 'uniform', 'subsampl                                                                     e': 0.8708851503903116, 'gamma': 6.605398379243034}. Best is trial 295 with value: 4.282522474682648.
[I 2023-12-21 03:04:10,662] Trial 323 finished with value: inf and parameters: {'learning_rate': 0.7751728204385461, 'aft_loss_distributi                                                                     on': 'normal', 'aft_loss_distribution_scale': 1.1784238261432958, 'max_depth': 6, 'booster': 'dart', 'scale_pos_weight': 4.38969765488973                                                                     7, 'alpha': 8.25416083098819, 'lambda': 8.58918861607517, 'eta': 0.4261330007097495, 'sampling_method': 'uniform', 'subsample': 0.8795704                                                                     913452628, 'gamma': 6.466488546092764}. Best is trial 295 with value: 4.282522474682648.
[I 2023-12-21 03:04:11,695] Trial 324 finished with value: inf and parameters: {'learning_rate': 0.826587421861705, 'aft_loss_distributio                                                                     n': 'normal', 'aft_loss_distribution_scale': 0.8142069664405577, 'max_depth': 6, 'booster': 'dart', 'scale_pos_weight': 4.633690359116517                                                                     5, 'alpha': 8.063663613940761, 'lambda': 9.091787780666616, 'eta': 0.4783574128966342, 'sampling_method': 'uniform', 'subsample': 0.86881                                                                     22706269243, 'gamma': 6.996619320296691}. Best is trial 295 with value: 4.282522474682648.
[I 2023-12-21 03:04:11,738] Trial 325 pruned. Trial was pruned at iteration 0.
[I 2023-12-21 03:04:13,926] Trial 326 finished with value: 4.287123089519132 and parameters: {'learning_rate': 0.7618411927467499, 'aft_l                                                                     oss_distribution': 'normal', 'aft_loss_distribution_scale': 1.3039748789073613, 'max_depth': 6, 'booster': 'dart', 'scale_pos_weight': 5.                                                                     639390693016703, 'alpha': 8.399136970846326, 'lambda': 2.8783355459560807, 'eta': 0.4890779245343243, 'sampling_method': 'uniform', 'subs                                                                     ample': 0.850548883384754, 'gamma': 6.641878987368981}. Best is trial 295 with value: 4.282522474682648.
[I 2023-12-21 03:04:14,921] Trial 327 finished with value: inf and parameters: {'learning_rate': 0.7637826494003517, 'aft_loss_distributi                                                                     on': 'normal', 'aft_loss_distribution_scale': 0.9778476410352506, 'max_depth': 6, 'booster': 'dart', 'scale_pos_weight': 5.58428046833989                                                                     3, 'alpha': 8.39999415596084, 'lambda': 1.3806009338254999, 'eta': 0.5141684619532567, 'sampling_method': 'uniform', 'subsample': 0.86471                                                                     2851041662, 'gamma': 6.82051163561286}. Best is trial 295 with value: 4.282522474682648.
[I 2023-12-21 03:04:15,996] Trial 328 finished with value: inf and parameters: {'learning_rate': 0.7965267389005002, 'aft_loss_distributi                                                                     on': 'normal', 'aft_loss_distribution_scale': 1.2978035733773312, 'max_depth': 6, 'booster': 'dart', 'scale_pos_weight': 5.19996234539135                                                                     75, 'alpha': 8.89787115592339, 'lambda': 4.000007079780659, 'eta': 0.5384221231557821, 'sampling_method': 'uniform', 'subsample': 0.83689                                                                     28399796006, 'gamma': 7.140159586172963}. Best is trial 295 with value: 4.282522474682648.
[I 2023-12-21 03:04:17,078] Trial 329 finished with value: inf and parameters: {'learning_rate': 0.7340833258507599, 'aft_loss_distributi                                                                     on': 'normal', 'aft_loss_distribution_scale': 1.182538225688448, 'max_depth': 6, 'booster': 'dart', 'scale_pos_weight': 5.732532924081111                                                                     , 'alpha': 8.246254648615865, 'lambda': 1.0175353381613303, 'eta': 0.46341270948139385, 'sampling_method': 'uniform', 'subsample': 0.8504                                                                     03717334553, 'gamma': 6.596297190164996}. Best is trial 295 with value: 4.282522474682648.
[I 2023-12-21 03:04:17,123] Trial 330 pruned. Trial was pruned at iteration 0.
[I 2023-12-21 03:04:19,549] Trial 331 finished with value: 4.299865102569702 and parameters: {'learning_rate': 0.7535193550245052, 'aft_l                                                                     oss_distribution': 'normal', 'aft_loss_distribution_scale': 1.3267522181577363, 'max_depth': 6, 'booster': 'dart', 'scale_pos_weight': 5.                                                                     905872281507558, 'alpha': 8.063206444732216, 'lambda': 2.4517787040298464, 'eta': 0.4950272924905295, 'sampling_method': 'uniform', 'subs                                                                     ample': 0.828306787756058, 'gamma': 5.988590319337679}. Best is trial 295 with value: 4.282522474682648.
[I 2023-12-21 03:04:19,593] Trial 332 pruned. Trial was pruned at iteration 0.
[I 2023-12-21 03:04:20,942] Trial 333 finished with value: inf and parameters: {'learning_rate': 0.746326918453663, 'aft_loss_distributio                                                                     n': 'normal', 'aft_loss_distribution_scale': 1.26915530103722, 'max_depth': 6, 'booster': 'dart', 'scale_pos_weight': 6.051862434649044,                                                                      'alpha': 8.500368996656059, 'lambda': 2.253490381879946, 'eta': 0.5018579063566012, 'sampling_method': 'uniform', 'subsample': 0.86068863                                                                     87486825, 'gamma': 6.06136652432527}. Best is trial 295 with value: 4.282522474682648.
[I 2023-12-21 03:04:30,665] Trial 334 finished with value: 4.290605741691391 and parameters: {'learning_rate': 0.7289411377428959, 'aft_l                                                                     oss_distribution': 'normal', 'aft_loss_distribution_scale': 1.3191257323470382, 'max_depth': 6, 'booster': 'dart', 'scale_pos_weight': 5.                                                                     819058842530325, 'alpha': 7.969385029739109, 'lambda': 2.5955294837157084, 'eta': 0.4932865828175449, 'sampling_method': 'uniform', 'subs                                                                     ample': 0.8828842279667822, 'gamma': 6.5989421595234115}. Best is trial 295 with value: 4.282522474682648.
[I 2023-12-21 03:04:30,713] Trial 335 pruned. Trial was pruned at iteration 0.
[I 2023-12-21 03:04:31,769] Trial 336 finished with value: inf and parameters: {'learning_rate': 0.760202363431912, 'aft_loss_distributio                                                                     n': 'normal', 'aft_loss_distribution_scale': 1.087173805017497, 'max_depth': 6, 'booster': 'dart', 'scale_pos_weight': 5.7617739395127625                                                                     , 'alpha': 8.662158738965884, 'lambda': 1.839780464813127, 'eta': 0.4883234844602271, 'sampling_method': 'uniform', 'subsample': 0.889100                                                                     1273480833, 'gamma': 6.515190911432429}. Best is trial 295 with value: 4.282522474682648.
[I 2023-12-21 03:04:32,843] Trial 337 finished with value: inf and parameters: {'learning_rate': 0.7939508815811572, 'aft_loss_distributi                                                                     on': 'normal', 'aft_loss_distribution_scale': 1.2930250249407516, 'max_depth': 6, 'booster': 'dart', 'scale_pos_weight': 4.86742404879582                                                                     6, 'alpha': 8.126403304409925, 'lambda': 2.7128974879598124, 'eta': 0.4736482820971784, 'sampling_method': 'uniform', 'subsample': 0.8447                                                                     53613197195, 'gamma': 6.590192264262156}. Best is trial 295 with value: 4.282522474682648.
[I 2023-12-21 03:04:33,945] Trial 338 finished with value: inf and parameters: {'learning_rate': 0.7260250154304815, 'aft_loss_distributi                                                                     on': 'normal', 'aft_loss_distribution_scale': 1.111023651329802, 'max_depth': 6, 'booster': 'dart', 'scale_pos_weight': 5.975695056971848                                                                     , 'alpha': 8.383004439715632, 'lambda': 2.565103821659856, 'eta': 0.06458168654088592, 'sampling_method': 'uniform', 'subsample': 0.85660                                                                     39779877996, 'gamma': 6.210656889321836}. Best is trial 295 with value: 4.282522474682648.
[I 2023-12-21 03:04:33,989] Trial 339 pruned. Trial was pruned at iteration 0.
[I 2023-12-21 03:04:35,104] Trial 340 finished with value: inf and parameters: {'learning_rate': 0.8101525546328583, 'aft_loss_distributi                                                                     on': 'normal', 'aft_loss_distribution_scale': 1.2419049107785969, 'max_depth': 6, 'booster': 'dart', 'scale_pos_weight': 5.85824111990357                                                                     5, 'alpha': 8.211192911728682, 'lambda': 2.7861395677781085, 'eta': 0.5318203948657584, 'sampling_method': 'uniform', 'subsample': 0.8856                                                                     815674064106, 'gamma': 6.388412968003058}. Best is trial 295 with value: 4.282522474682648.
[I 2023-12-21 03:04:35,148] Trial 341 pruned. Trial was pruned at iteration 0.
[I 2023-12-21 03:04:35,193] Trial 342 pruned. Trial was pruned at iteration 1.
[I 2023-12-21 03:04:51,908] Trial 343 finished with value: 4.332240796395524 and parameters: {'learning_rate': 0.7818873303438243, 'aft_l                                                                     oss_distribution': 'normal', 'aft_loss_distribution_scale': 1.4736928049537596, 'max_depth': 6, 'booster': 'dart', 'scale_pos_weight': 4.                                                                     549467225979016, 'alpha': 6.561822232799234, 'lambda': 3.689022921155234, 'eta': 0.4278510860137649, 'sampling_method': 'uniform', 'subsa                                                                     mple': 0.8207626892332652, 'gamma': 7.675303020841255}. Best is trial 295 with value: 4.282522474682648.
[I 2023-12-21 03:04:53,095] Trial 344 finished with value: inf and parameters: {'learning_rate': 0.7330746976438575, 'aft_loss_distributi                                                                     on': 'normal', 'aft_loss_distribution_scale': 1.285352202351542, 'max_depth': 6, 'booster': 'dart', 'scale_pos_weight': 4.964652732987584                                                                     5, 'alpha': 7.97076071600969, 'lambda': 2.9883120976248154, 'eta': 0.5147923320638295, 'sampling_method': 'uniform', 'subsample': 0.90817                                                                     72541178502, 'gamma': 7.383778612708376}. Best is trial 295 with value: 4.282522474682648.
[I 2023-12-21 03:04:59,952] Trial 345 finished with value: 4.344628376646207 and parameters: {'learning_rate': 0.7624768526539782, 'aft_l                                                                     oss_distribution': 'normal', 'aft_loss_distribution_scale': 1.5100415412426922, 'max_depth': 6, 'booster': 'dart', 'scale_pos_weight': 6.                                                                     139406087982351, 'alpha': 8.419910408600508, 'lambda': 2.352722018181834, 'eta': 0.49094207436020837, 'sampling_method': 'uniform', 'subs                                                                     ample': 0.8124496127202754, 'gamma': 6.3666268617092445}. Best is trial 295 with value: 4.282522474682648.
[I 2023-12-21 03:05:01,037] Trial 346 finished with value: inf and parameters: {'learning_rate': 0.7148073321326961, 'aft_loss_distributi                                                                     on': 'normal', 'aft_loss_distribution_scale': 1.092466555193143, 'max_depth': 5, 'booster': 'dart', 'scale_pos_weight': 4.700536824328392                                                                     , 'alpha': 7.723808035397778, 'lambda': 3.160747739312839, 'eta': 0.4409146970077719, 'sampling_method': 'uniform', 'subsample': 0.844134                                                                     2747859506, 'gamma': 7.046260823768286}. Best is trial 295 with value: 4.282522474682648.
[I 2023-12-21 03:05:01,082] Trial 347 pruned. Trial was pruned at iteration 0.
[I 2023-12-21 03:05:01,128] Trial 348 pruned. Trial was pruned at iteration 1.
[I 2023-12-21 03:05:02,274] Trial 349 finished with value: inf and parameters: {'learning_rate': 0.7880409659653026, 'aft_loss_distributi                                                                     on': 'normal', 'aft_loss_distribution_scale': 1.3318634113741747, 'max_depth': 6, 'booster': 'dart', 'scale_pos_weight': 5.09806745250261                                                                     1, 'alpha': 6.745617260895612, 'lambda': 0.10190723980615068, 'eta': 0.20147323516245774, 'sampling_method': 'uniform', 'subsample': 0.84                                                                     95575823914928, 'gamma': 7.954585217956534}. Best is trial 295 with value: 4.282522474682648.
[I 2023-12-21 03:05:04,638] Trial 350 finished with value: 4.361358156420338 and parameters: {'learning_rate': 0.8817283022547912, 'aft_l                                                                     oss_distribution': 'normal', 'aft_loss_distribution_scale': 1.5197400553659377, 'max_depth': 6, 'booster': 'dart', 'scale_pos_weight': 6.                                                                     191124436560376, 'alpha': 5.746955906472171, 'lambda': 3.217173288023234, 'eta': 0.5036838549901226, 'sampling_method': 'uniform', 'subsa                                                                     mple': 0.8070041262395191, 'gamma': 6.0836034591133}. Best is trial 295 with value: 4.282522474682648.
[I 2023-12-21 03:05:04,683] Trial 351 pruned. Trial was pruned at iteration 0.
[I 2023-12-21 03:05:05,704] Trial 352 finished with value: inf and parameters: {'learning_rate': 0.7672351257316635, 'aft_loss_distributi                                                                     on': 'normal', 'aft_loss_distribution_scale': 1.19081204537404, 'max_depth': 6, 'booster': 'dart', 'scale_pos_weight': 5.810105109326255,                                                                      'alpha': 6.409274763246855, 'lambda': 8.662816366320357, 'eta': 0.415118705781246, 'sampling_method': 'uniform', 'subsample': 0.86698942                                                                     19967879, 'gamma': 5.852976494526033}. Best is trial 295 with value: 4.282522474682648.
