[I 2023-12-21 04:02:53,684] Trial 87 finished with value: 4.309691916107158 and parameters: {'learning_rate': 0.8423539066101012, 'aft_lo                                                                     ss_distribution': 'normal', 'aft_loss_distribution_scale': 1.3466344068368534, 'max_depth': 5, 'booster': 'gbtree', 'scale_pos_weight': 4                                                                     .434205670723857, 'alpha': 5.420136791063248, 'lambda': 8.005294738376488, 'eta': 0.9418933313464068, 'sampling_method': 'gradient_based'                                                                     , 'subsample': 0.911658533148304, 'gamma': 6.14225261546379}. Best is trial 84 with value: 4.259518710902867.
[I 2023-12-21 04:02:53,786] Trial 88 finished with value: inf and parameters: {'learning_rate': 0.812293955884709, 'aft_loss_distribution                                                                     ': 'normal', 'aft_loss_distribution_scale': 1.3318045445431719, 'max_depth': 5, 'booster': 'gbtree', 'scale_pos_weight': 3.17292599621787                                                                     9, 'alpha': 5.433005240392767, 'lambda': 9.969979219289101, 'eta': 0.9949551413204126, 'sampling_method': 'gradient_based', 'subsample':                                                                      0.8144146712115986, 'gamma': 5.968662081553726}. Best is trial 84 with value: 4.259518710902867.
[I 2023-12-21 04:02:53,820] Trial 89 pruned. Trial was pruned at iteration 0.
[I 2023-12-21 04:02:53,854] Trial 90 pruned. Trial was pruned at iteration 0.
[I 2023-12-21 04:02:53,956] Trial 91 finished with value: inf and parameters: {'learning_rate': 0.8724355359292161, 'aft_loss_distributio                                                                     n': 'normal', 'aft_loss_distribution_scale': 1.491080872132994, 'max_depth': 5, 'booster': 'gbtree', 'scale_pos_weight': 5.20333101645601                                                                     5, 'alpha': 5.079130763736309, 'lambda': 7.491841577895124, 'eta': 0.9330114899777588, 'sampling_method': 'gradient_based', 'subsample':                                                                      0.877745608430992, 'gamma': 5.599776773561167}. Best is trial 84 with value: 4.259518710902867.
[I 2023-12-21 04:02:54,091] Trial 92 finished with value: 4.263776129500225 and parameters: {'learning_rate': 0.9230425352895038, 'aft_lo                                                                     ss_distribution': 'normal', 'aft_loss_distribution_scale': 1.0952677127667083, 'max_depth': 6, 'booster': 'gbtree', 'scale_pos_weight': 4                                                                     .599060278071574, 'alpha': 4.858728360851236, 'lambda': 8.281673973612298, 'eta': 0.9690779370932125, 'sampling_method': 'gradient_based'                                                                     , 'subsample': 0.907944718965238, 'gamma': 6.51823269138123}. Best is trial 84 with value: 4.259518710902867.
[I 2023-12-21 04:02:54,192] Trial 93 finished with value: inf and parameters: {'learning_rate': 0.9170402403528819, 'aft_loss_distributio                                                                     n': 'normal', 'aft_loss_distribution_scale': 1.1277944388204535, 'max_depth': 6, 'booster': 'gbtree', 'scale_pos_weight': 4.5400062188073                                                                     34, 'alpha': 5.548877567924659, 'lambda': 8.37028466900263, 'eta': 0.9816774534342152, 'sampling_method': 'gradient_based', 'subsample':                                                                      0.9218976693767866, 'gamma': 7.386125330043314}. Best is trial 84 with value: 4.259518710902867.
[I 2023-12-21 04:02:54,225] Trial 94 pruned. Trial was pruned at iteration 0.
[I 2023-12-21 04:02:54,265] Trial 95 pruned. Trial was pruned at iteration 1.
[I 2023-12-21 04:02:54,369] Trial 96 finished with value: inf and parameters: {'learning_rate': 0.9782254631665961, 'aft_loss_distributio                                                                     n': 'normal', 'aft_loss_distribution_scale': 0.9803418998245019, 'max_depth': 5, 'booster': 'gbtree', 'scale_pos_weight': 4.9532795805950                                                                     81, 'alpha': 4.017220839420604, 'lambda': 9.168423959667539, 'eta': 0.9697957921756393, 'sampling_method': 'gradient_based', 'subsample':                                                                      0.8356298433989641, 'gamma': 6.182133730565973}. Best is trial 84 with value: 4.259518710902867.
[I 2023-12-21 04:02:54,470] Trial 97 finished with value: inf and parameters: {'learning_rate': 0.8020328550780782, 'aft_loss_distributio                                                                     n': 'normal', 'aft_loss_distribution_scale': 1.2939796847027718, 'max_depth': 3, 'booster': 'gbtree', 'scale_pos_weight': 5.8168258741796                                                                     85, 'alpha': 4.895664104349594, 'lambda': 8.02340237766071, 'eta': 0.9452579738789249, 'sampling_method': 'uniform', 'subsample': 0.78556                                                                     48734684108, 'gamma': 5.544353941512805}. Best is trial 84 with value: 4.259518710902867.
[I 2023-12-21 04:02:54,504] Trial 98 pruned. Trial was pruned at iteration 0.
[I 2023-12-21 04:02:54,537] Trial 99 pruned. Trial was pruned at iteration 0.
[I 2023-12-21 04:02:54,571] Trial 100 pruned. Trial was pruned at iteration 0.
[I 2023-12-21 04:02:54,604] Trial 101 pruned. Trial was pruned at iteration 0.
[I 2023-12-21 04:02:54,711] Trial 102 finished with value: inf and parameters: {'learning_rate': 0.8243234254128221, 'aft_loss_distributi                                                                     on': 'normal', 'aft_loss_distribution_scale': 1.0665547178437893, 'max_depth': 9, 'booster': 'gbtree', 'scale_pos_weight': 2.532910488693                                                                     833, 'alpha': 4.088433996087316, 'lambda': 7.837355321286011, 'eta': 0.9701411513567342, 'sampling_method': 'gradient_based', 'subsample'                                                                     : 0.9786188879732215, 'gamma': 4.929367990303773}. Best is trial 84 with value: 4.259518710902867.
[I 2023-12-21 04:02:54,842] Trial 103 finished with value: 4.331205814597452 and parameters: {'learning_rate': 0.9372351098215534, 'aft_l                                                                     oss_distribution': 'normal', 'aft_loss_distribution_scale': 1.4156611603843952, 'max_depth': 6, 'booster': 'gbtree', 'scale_pos_weight':                                                                      4.705248048276449, 'alpha': 5.101753395377329, 'lambda': 8.197386805017969, 'eta': 0.925581053438269, 'sampling_method': 'gradient_based'                                                                     , 'subsample': 0.9043183287387869, 'gamma': 5.681856824627293}. Best is trial 84 with value: 4.259518710902867.
[I 2023-12-21 04:02:54,944] Trial 104 finished with value: inf and parameters: {'learning_rate': 0.7888642253296826, 'aft_loss_distributi                                                                     on': 'normal', 'aft_loss_distribution_scale': 1.3808296915390739, 'max_depth': 6, 'booster': 'gbtree', 'scale_pos_weight': 4.658397056212                                                                     3564, 'alpha': 5.108546156297224, 'lambda': 8.245478710723905, 'eta': 0.9194421129853189, 'sampling_method': 'gradient_based', 'subsample                                                                     ': 0.8101857331361076, 'gamma': 5.720096150062726}. Best is trial 84 with value: 4.259518710902867.
[I 2023-12-21 04:02:55,046] Trial 105 finished with value: inf and parameters: {'learning_rate': 0.934356536636747, 'aft_loss_distributio                                                                     n': 'normal', 'aft_loss_distribution_scale': 0.8470902980370886, 'max_depth': 6, 'booster': 'gbtree', 'scale_pos_weight': 5.0581822412859                                                                     09, 'alpha': 4.5015951111874974, 'lambda': 7.579706081427755, 'eta': 0.9440668946927457, 'sampling_method': 'gradient_based', 'subsample'                                                                     : 0.9068716482394115, 'gamma': 6.2591382003858325}. Best is trial 84 with value: 4.259518710902867.
[I 2023-12-21 04:02:55,080] Trial 106 pruned. Trial was pruned at iteration 0.
[I 2023-12-21 04:02:55,115] Trial 107 pruned. Trial was pruned at iteration 1.
[I 2023-12-21 04:02:55,149] Trial 108 pruned. Trial was pruned at iteration 0.
[I 2023-12-21 04:02:55,182] Trial 109 pruned. Trial was pruned at iteration 0.
[I 2023-12-21 04:02:55,217] Trial 110 pruned. Trial was pruned at iteration 0.
[I 2023-12-21 04:02:55,322] Trial 111 finished with value: inf and parameters: {'learning_rate': 0.8284304915911375, 'aft_loss_distributi                                                                     on': 'normal', 'aft_loss_distribution_scale': 1.0251095877506098, 'max_depth': 7, 'booster': 'gbtree', 'scale_pos_weight': 3.856928032992                                                                     0757, 'alpha': 4.861189768422376, 'lambda': 7.873579611759295, 'eta': 0.9989895359501463, 'sampling_method': 'gradient_based', 'subsample                                                                     ': 0.9518052955030041, 'gamma': 5.251210804090887}. Best is trial 84 with value: 4.259518710902867.
[I 2023-12-21 04:02:55,433] Trial 112 finished with value: inf and parameters: {'learning_rate': 0.965118585425988, 'aft_loss_distributio                                                                     n': 'normal', 'aft_loss_distribution_scale': 1.4435880853557133, 'max_depth': 7, 'booster': 'gbtree', 'scale_pos_weight': 3.3789666731591                                                                     94, 'alpha': 4.653390949259422, 'lambda': 7.150414420846944, 'eta': 0.8604174216061964, 'sampling_method': 'gradient_based', 'subsample':                                                                      0.9804302853116967, 'gamma': 7.139831007429271}. Best is trial 84 with value: 4.259518710902867.
[I 2023-12-21 04:02:55,469] Trial 113 pruned. Trial was pruned at iteration 1.
[I 2023-12-21 04:02:55,502] Trial 114 pruned. Trial was pruned at iteration 0.
[I 2023-12-21 04:02:55,642] Trial 115 finished with value: 4.27892906661794 and parameters: {'learning_rate': 0.8014846078495, 'aft_loss_                                                                     distribution': 'normal', 'aft_loss_distribution_scale': 1.220211617028278, 'max_depth': 7, 'booster': 'gbtree', 'scale_pos_weight': 2.962                                                                     0480478444624, 'alpha': 6.391352391119073, 'lambda': 7.64228578912335, 'eta': 0.8789258456016941, 'sampling_method': 'gradient_based', 's                                                                     ubsample': 0.9279469737034515, 'gamma': 5.118015850268891}. Best is trial 84 with value: 4.259518710902867.
[I 2023-12-21 04:02:55,676] Trial 116 pruned. Trial was pruned at iteration 0.
[I 2023-12-21 04:02:55,710] Trial 117 pruned. Trial was pruned at iteration 0.
[I 2023-12-21 04:02:55,745] Trial 118 pruned. Trial was pruned at iteration 0.
[I 2023-12-21 04:02:55,785] Trial 119 pruned. Trial was pruned at iteration 0.
[I 2023-12-21 04:02:55,819] Trial 120 pruned. Trial was pruned at iteration 0.
[I 2023-12-21 04:02:55,922] Trial 121 finished with value: inf and parameters: {'learning_rate': 0.9136187196022841, 'aft_loss_distributi                                                                     on': 'normal', 'aft_loss_distribution_scale': 1.2984602784553154, 'max_depth': 7, 'booster': 'gbtree', 'scale_pos_weight': 5.089271822062                                                                     497, 'alpha': 4.391498815009094, 'lambda': 8.328514320391209, 'eta': 0.7863526523309958, 'sampling_method': 'gradient_based', 'subsample'                                                                     : 0.972273066882813, 'gamma': 5.62298338970505}. Best is trial 84 with value: 4.259518710902867.
[I 2023-12-21 04:02:55,958] Trial 122 pruned. Trial was pruned at iteration 1.
[I 2023-12-21 04:02:55,992] Trial 123 pruned. Trial was pruned at iteration 0.
[I 2023-12-21 04:02:56,028] Trial 124 pruned. Trial was pruned at iteration 1.
[I 2023-12-21 04:02:56,062] Trial 125 pruned. Trial was pruned at iteration 0.
[I 2023-12-21 04:02:56,102] Trial 126 pruned. Trial was pruned at iteration 1.
[I 2023-12-21 04:02:57,111] Trial 127 finished with value: inf and parameters: {'learning_rate': 0.8522557477738788, 'aft_loss_distributi                                                                     on': 'normal', 'aft_loss_distribution_scale': 1.2318486009082932, 'max_depth': 8, 'booster': 'dart', 'scale_pos_weight': 1.30782805394599                                                                     85, 'alpha': 5.164324377020635, 'lambda': 7.437562142129384, 'eta': 0.6940124178669507, 'sampling_method': 'gradient_based', 'subsample':                                                                      0.8661712113651421, 'gamma': 5.271415715593182}. Best is trial 84 with value: 4.259518710902867.
[I 2023-12-21 04:02:57,146] Trial 128 pruned. Trial was pruned at iteration 0.
[I 2023-12-21 04:02:57,181] Trial 129 pruned. Trial was pruned at iteration 0.
[I 2023-12-21 04:02:57,215] Trial 130 pruned. Trial was pruned at iteration 0.
[I 2023-12-21 04:02:57,252] Trial 131 pruned. Trial was pruned at iteration 0.
[I 2023-12-21 04:02:57,287] Trial 132 pruned. Trial was pruned at iteration 0.
[I 2023-12-21 04:02:57,326] Trial 133 pruned. Trial was pruned at iteration 0.
[I 2023-12-21 04:02:57,360] Trial 134 pruned. Trial was pruned at iteration 0.
[I 2023-12-21 04:02:57,395] Trial 135 pruned. Trial was pruned at iteration 0.
[I 2023-12-21 04:02:57,430] Trial 136 pruned. Trial was pruned at iteration 0.
[I 2023-12-21 04:02:57,465] Trial 137 pruned. Trial was pruned at iteration 0.
[I 2023-12-21 04:02:57,568] Trial 138 finished with value: inf and parameters: {'learning_rate': 0.8987273049195319, 'aft_loss_distributi                                                                     on': 'normal', 'aft_loss_distribution_scale': 1.3620068232792757, 'max_depth': 7, 'booster': 'gbtree', 'scale_pos_weight': 3.666919284869                                                                     726, 'alpha': 2.1751570463724743, 'lambda': 8.804295389543759, 'eta': 0.5110742978415035, 'sampling_method': 'gradient_based', 'subsample                                                                     ': 0.8564900406729843, 'gamma': 5.124914094865274}. Best is trial 84 with value: 4.259518710902867.
[I 2023-12-21 04:02:57,609] Trial 139 pruned. Trial was pruned at iteration 0.
[I 2023-12-21 04:02:57,648] Trial 140 pruned. Trial was pruned at iteration 0.
[I 2023-12-21 04:02:57,683] Trial 141 pruned. Trial was pruned at iteration 0.
[I 2023-12-21 04:02:57,718] Trial 142 pruned. Trial was pruned at iteration 0.
[I 2023-12-21 04:02:57,753] Trial 143 pruned. Trial was pruned at iteration 0.
[I 2023-12-21 04:02:57,788] Trial 144 pruned. Trial was pruned at iteration 0.
[I 2023-12-21 04:02:57,824] Trial 145 pruned. Trial was pruned at iteration 0.
[I 2023-12-21 04:02:57,861] Trial 146 pruned. Trial was pruned at iteration 0.
[I 2023-12-21 04:02:57,896] Trial 147 pruned. Trial was pruned at iteration 0.
[I 2023-12-21 04:02:57,931] Trial 148 pruned. Trial was pruned at iteration 0.
[I 2023-12-21 04:02:57,969] Trial 149 pruned. Trial was pruned at iteration 0.
[I 2023-12-21 04:02:58,005] Trial 150 pruned. Trial was pruned at iteration 0.
[I 2023-12-21 04:02:58,042] Trial 151 pruned. Trial was pruned at iteration 0.
[I 2023-12-21 04:02:58,079] Trial 152 pruned. Trial was pruned at iteration 0.
[I 2023-12-21 04:02:58,115] Trial 153 pruned. Trial was pruned at iteration 0.
[I 2023-12-21 04:02:58,151] Trial 154 pruned. Trial was pruned at iteration 0.
[I 2023-12-21 04:02:58,187] Trial 155 pruned. Trial was pruned at iteration 0.
[I 2023-12-21 04:02:58,224] Trial 156 pruned. Trial was pruned at iteration 0.
[I 2023-12-21 04:02:58,261] Trial 157 pruned. Trial was pruned at iteration 0.
[I 2023-12-21 04:02:58,384] Trial 158 finished with value: 4.274749333006113 and parameters: {'learning_rate': 0.8603876839810096, 'aft_l                                                                     oss_distribution': 'normal', 'aft_loss_distribution_scale': 1.19604250058353, 'max_depth': 7, 'booster': 'gbtree', 'scale_pos_weight': 4.                                                                     0174713211477355, 'alpha': 5.461939642194298, 'lambda': 7.5847732456178445, 'eta': 0.2044092458889092, 'sampling_method': 'uniform', 'sub                                                                     sample': 0.8549338070368534, 'gamma': 6.586026850600136}. Best is trial 84 with value: 4.259518710902867.
[I 2023-12-21 04:02:58,420] Trial 159 pruned. Trial was pruned at iteration 0.
[I 2023-12-21 04:02:58,516] Trial 160 finished with value: inf and parameters: {'learning_rate': 0.860930876448324, 'aft_loss_distributio                                                                     n': 'normal', 'aft_loss_distribution_scale': 1.2737676173277015, 'max_depth': 7, 'booster': 'gbtree', 'scale_pos_weight': 3.9947657725446                                                                     08, 'alpha': 3.16891739783254, 'lambda': 8.295405480523215, 'eta': 0.2057631234253225, 'sampling_method': 'uniform', 'subsample': 0.08792                                                                     339836827218, 'gamma': 6.086591789437636}. Best is trial 84 with value: 4.259518710902867.
[I 2023-12-21 04:02:58,639] Trial 161 finished with value: 4.26414550617308 and parameters: {'learning_rate': 0.8349615647825682, 'aft_lo                                                                     ss_distribution': 'normal', 'aft_loss_distribution_scale': 1.0844668241556445, 'max_depth': 7, 'booster': 'gbtree', 'scale_pos_weight': 4                                                                     .209408698106465, 'alpha': 5.105195909413784, 'lambda': 4.545065721221191, 'eta': 0.15223526930764542, 'sampling_method': 'uniform', 'sub                                                                     sample': 0.8829745477816096, 'gamma': 6.973267572290841}. Best is trial 84 with value: 4.259518710902867.
[I 2023-12-21 04:02:58,743] Trial 162 finished with value: inf and parameters: {'learning_rate': 0.8816691826351181, 'aft_loss_distributi                                                                     on': 'normal', 'aft_loss_distribution_scale': 1.0714513893071087, 'max_depth': 7, 'booster': 'gbtree', 'scale_pos_weight': 4.199604169248                                                                     494, 'alpha': 5.329797315992929, 'lambda': 4.6079287396699495, 'eta': 0.12744360757594292, 'sampling_method': 'gradient_based', 'subsampl                                                                     e': 0.8728347242807829, 'gamma': 7.397461020814685}. Best is trial 84 with value: 4.259518710902867.
[I 2023-12-21 04:02:58,780] Trial 163 pruned. Trial was pruned at iteration 0.
[I 2023-12-21 04:02:58,815] Trial 164 pruned. Trial was pruned at iteration 0.
[I 2023-12-21 04:02:58,853] Trial 165 pruned. Trial was pruned at iteration 1.
[I 2023-12-21 04:02:58,889] Trial 166 pruned. Trial was pruned at iteration 0.
[I 2023-12-21 04:02:58,928] Trial 167 pruned. Trial was pruned at iteration 1.
[I 2023-12-21 04:02:58,964] Trial 168 pruned. Trial was pruned at iteration 0.
[I 2023-12-21 04:02:59,001] Trial 169 pruned. Trial was pruned at iteration 0.
[I 2023-12-21 04:02:59,038] Trial 170 pruned. Trial was pruned at iteration 0.
[I 2023-12-21 04:02:59,075] Trial 171 pruned. Trial was pruned at iteration 0.
[I 2023-12-21 04:02:59,112] Trial 172 pruned. Trial was pruned at iteration 0.
[I 2023-12-21 04:02:59,249] Trial 173 finished with value: 4.30615986900884 and parameters: {'learning_rate': 0.9510582239088612, 'aft_lo                                                                     ss_distribution': 'normal', 'aft_loss_distribution_scale': 1.3282759521111525, 'max_depth': 10, 'booster': 'gbtree', 'scale_pos_weight':                                                                      4.469248269562892, 'alpha': 4.85087171042548, 'lambda': 5.151231824882668, 'eta': 0.842656337144036, 'sampling_method': 'gradient_based',                                                                      'subsample': 0.9286840227558394, 'gamma': 7.555943891034629}. Best is trial 84 with value: 4.259518710902867.
[I 2023-12-21 04:02:59,357] Trial 174 finished with value: inf and parameters: {'learning_rate': 0.9448976342652216, 'aft_loss_distributi                                                                     on': 'normal', 'aft_loss_distribution_scale': 1.3327579225776505, 'max_depth': 10, 'booster': 'gbtree', 'scale_pos_weight': 3.87961541039                                                                     4932, 'alpha': 5.063224968350984, 'lambda': 8.205382371945555, 'eta': 0.17962092403945148, 'sampling_method': 'gradient_based', 'subsampl                                                                     e': 0.9353086779746995, 'gamma': 7.818398811705827}. Best is trial 84 with value: 4.259518710902867.
