[I 2023-12-21 04:17:22,977] Trial 120 pruned. Trial was pruned at iteration 0.
[I 2023-12-21 04:17:23,085] Trial 121 pruned. Trial was pruned at iteration 3.
[I 2023-12-21 04:17:23,149] Trial 122 pruned. Trial was pruned at iteration 0.
[I 2023-12-21 04:17:23,222] Trial 123 pruned. Trial was pruned at iteration 0.
[I 2023-12-21 04:17:23,389] Trial 124 pruned. Trial was pruned at iteration 0.
[I 2023-12-21 04:17:24,189] Trial 125 finished with value: inf and parameters: {'learning_rate': 0.910739098186162, 'aft_loss_distribution': 'normal', 'aft_loss_distribution_scale': 1.9301955992981634, 'max_depth': 3, 'booster': 'gbtree', 'scale_pos_weight': 2.1993312617338536, 'alpha': 4.434160707744763, 'lambda': 4.290409967541755, 'eta': 0.09575406674359632, 'sampling_method': 'gradient_based', 'subsample': 0.36873933302180895, 'gamma': 9.545909933065532}. Best is trial 19 with value: 1.9087597009825021.
[I 2023-12-21 04:17:25,130] Trial 126 finished with value: inf and parameters: {'learning_rate': 0.5827350957013765, 'aft_loss_distribution': 'logistic', 'aft_loss_distribution_scale': 1.5965959158765628, 'max_depth': 4, 'booster': 'gbtree', 'scale_pos_weight': 0.1952373685154809, 'alpha': 1.5900290636256886, 'lambda': 1.9680187098385982, 'eta': 0.30671981930941306, 'sampling_method': 'uniform', 'subsample': 0.4196821224512366, 'gamma': 8.258915823213654}. Best is trial 19 with value: 1.9087597009825021.
[I 2023-12-21 04:17:25,231] Trial 127 pruned. Trial was pruned at iteration 0.
[I 2023-12-21 04:17:25,463] Trial 128 pruned. Trial was pruned at iteration 1.
[I 2023-12-21 04:17:25,574] Trial 129 pruned. Trial was pruned at iteration 0.
[I 2023-12-21 04:17:25,686] Trial 130 pruned. Trial was pruned at iteration 0.
[I 2023-12-21 04:17:25,787] Trial 131 pruned. Trial was pruned at iteration 0.
[I 2023-12-21 04:17:25,899] Trial 132 pruned. Trial was pruned at iteration 0.
[I 2023-12-21 04:17:26,039] Trial 133 pruned. Trial was pruned at iteration 3.
[I 2023-12-21 04:17:26,140] Trial 134 pruned. Trial was pruned at iteration 0.
[I 2023-12-21 04:17:26,237] Trial 135 pruned. Trial was pruned at iteration 0.
[I 2023-12-21 04:17:26,374] Trial 136 pruned. Trial was pruned at iteration 1.
[I 2023-12-21 04:17:26,481] Trial 137 pruned. Trial was pruned at iteration 0.
[I 2023-12-21 04:17:26,592] Trial 138 pruned. Trial was pruned at iteration 0.
[I 2023-12-21 04:17:26,700] Trial 139 pruned. Trial was pruned at iteration 0.
[I 2023-12-21 04:17:26,799] Trial 140 pruned. Trial was pruned at iteration 0.
[I 2023-12-21 04:17:27,791] Trial 141 finished with value: inf and parameters: {'learning_rate': 0.8084161285912113, 'aft_loss_distribution': 'normal', 'aft_loss_distribution_scale': 2.4228079162306466, 'max_depth': 8, 'booster': 'gbtree', 'scale_pos_weight': 2.922396847345343, 'alpha': 5.488731576449713, 'lambda': 4.546962516782983, 'eta': 0.8259051688081314, 'sampling_method': 'gradient_based', 'subsample': 0.7675615255117051, 'gamma': 8.452801164732634}. Best is trial 19 with value: 1.9087597009825021.
[I 2023-12-21 04:17:28,811] Trial 142 finished with value: inf and parameters: {'learning_rate': 0.8553175324481441, 'aft_loss_distribution': 'normal', 'aft_loss_distribution_scale': 2.028849785902633, 'max_depth': 8, 'booster': 'gbtree', 'scale_pos_weight': 2.8204276638442827, 'alpha': 5.726164040357769, 'lambda': 5.873684966874801, 'eta': 0.9443603925678927, 'sampling_method': 'gradient_based', 'subsample': 0.7984214113986764, 'gamma': 8.861062326433286}. Best is trial 19 with value: 1.9087597009825021.
[I 2023-12-21 04:17:29,925] Trial 143 finished with value: inf and parameters: {'learning_rate': 0.8810397024204756, 'aft_loss_distribution': 'normal', 'aft_loss_distribution_scale': 2.820226209400829, 'max_depth': 8, 'booster': 'gbtree', 'scale_pos_weight': 2.6192985642015842, 'alpha': 5.705835059601223, 'lambda': 4.08947055481935, 'eta': 0.01714917576440153, 'sampling_method': 'gradient_based', 'subsample': 0.5481772751624192, 'gamma': 7.796502781618733}. Best is trial 19 with value: 1.9087597009825021.
[I 2023-12-21 04:17:29,997] Trial 144 pruned. Trial was pruned at iteration 0.
[I 2023-12-21 04:17:30,998] Trial 145 finished with value: inf and parameters: {'learning_rate': 0.9636201161705389, 'aft_loss_distribution': 'normal', 'aft_loss_distribution_scale': 2.1695556149040787, 'max_depth': 7, 'booster': 'gbtree', 'scale_pos_weight': 3.1201352598111143, 'alpha': 3.5778269605559982, 'lambda': 3.7675603214846016, 'eta': 0.8771014184536771, 'sampling_method': 'gradient_based', 'subsample': 0.8312706158468386, 'gamma': 8.323217543380169}. Best is trial 19 with value: 1.9087597009825021.
[I 2023-12-21 04:17:31,100] Trial 146 pruned. Trial was pruned at iteration 1.
[I 2023-12-21 04:17:31,175] Trial 147 pruned. Trial was pruned at iteration 0.
[I 2023-12-21 04:17:31,242] Trial 148 pruned. Trial was pruned at iteration 0.
[I 2023-12-21 04:17:31,324] Trial 149 pruned. Trial was pruned at iteration 0.
[I 2023-12-21 04:17:31,391] Trial 150 pruned. Trial was pruned at iteration 0.
[I 2023-12-21 04:17:31,459] Trial 151 pruned. Trial was pruned at iteration 0.
[I 2023-12-21 04:17:31,569] Trial 152 pruned. Trial was pruned at iteration 2.
[I 2023-12-21 04:17:31,644] Trial 153 pruned. Trial was pruned at iteration 0.
[I 2023-12-21 04:17:31,740] Trial 154 pruned. Trial was pruned at iteration 1.
[I 2023-12-21 04:17:31,807] Trial 155 pruned. Trial was pruned at iteration 0.
[I 2023-12-21 04:17:31,886] Trial 156 pruned. Trial was pruned at iteration 0.
[I 2023-12-21 04:17:31,973] Trial 157 pruned. Trial was pruned at iteration 1.
[I 2023-12-21 04:17:32,043] Trial 158 pruned. Trial was pruned at iteration 0.
[I 2023-12-21 04:17:32,119] Trial 159 pruned. Trial was pruned at iteration 0.
[I 2023-12-21 04:17:32,186] Trial 160 pruned. Trial was pruned at iteration 0.
[I 2023-12-21 04:17:32,254] Trial 161 pruned. Trial was pruned at iteration 0.
[I 2023-12-21 04:17:34,044] Trial 162 finished with value: inf and parameters: {'learning_rate': 0.5962939959794352, 'aft_loss_distribution': 'logistic', 'aft_loss_distribution_scale': 1.4138711741780554, 'max_depth': 3, 'booster': 'dart', 'scale_pos_weight': 2.6982052459505215, 'alpha': 0.1564183085650781, 'lambda': 3.5020895648137134, 'eta': 0.2726309603933739, 'sampling_method': 'uniform', 'subsample': 0.10478807860283357, 'gamma': 0.7717403191091436}. Best is trial 19 with value: 1.9087597009825021.
[I 2023-12-21 04:17:34,126] Trial 163 pruned. Trial was pruned at iteration 0.
[I 2023-12-21 04:17:34,235] Trial 164 pruned. Trial was pruned at iteration 2.
[I 2023-12-21 04:17:34,320] Trial 165 pruned. Trial was pruned at iteration 0.
[I 2023-12-21 04:17:34,390] Trial 166 pruned. Trial was pruned at iteration 0.
[I 2023-12-21 04:17:34,467] Trial 167 pruned. Trial was pruned at iteration 0.
[I 2023-12-21 04:17:34,542] Trial 168 pruned. Trial was pruned at iteration 0.
[I 2023-12-21 04:17:34,614] Trial 169 pruned. Trial was pruned at iteration 0.
[I 2023-12-21 04:17:34,682] Trial 170 pruned. Trial was pruned at iteration 0.
[I 2023-12-21 04:17:38,366] Trial 171 finished with value: inf and parameters: {'learning_rate': 0.9994150487617167, 'aft_loss_distribution': 'normal', 'aft_loss_distribution_scale': 1.6895296613222164, 'max_depth': 6, 'booster': 'gbtree', 'scale_pos_weight': 1.6569993124476243, 'alpha': 6.6517935046013035, 'lambda': 9.312954673935085, 'eta': 0.884566976275396, 'sampling_method': 'gradient_based', 'subsample': 0.18255365993783373, 'gamma': 3.1474212501011434}. Best is trial 19 with value: 1.9087597009825021.
[I 2023-12-21 04:17:42,109] Trial 172 finished with value: inf and parameters: {'learning_rate': 0.9808473321742924, 'aft_loss_distribution': 'normal', 'aft_loss_distribution_scale': 1.8771669613732866, 'max_depth': 6, 'booster': 'gbtree', 'scale_pos_weight': 1.4987198612493584, 'alpha': 7.045287728493893, 'lambda': 8.472898436942762, 'eta': 0.8580004324655529, 'sampling_method': 'gradient_based', 'subsample': 0.26386396329435463, 'gamma': 0.9439284713496963}. Best is trial 19 with value: 1.9087597009825021.
[I 2023-12-21 04:17:43,254] Trial 173 finished with value: inf and parameters: {'learning_rate': 0.9284458282638108, 'aft_loss_distribution': 'normal', 'aft_loss_distribution_scale': 1.354452091042613, 'max_depth': 6, 'booster': 'gbtree', 'scale_pos_weight': 1.627774539092728, 'alpha': 1.3130698937491676, 'lambda': 8.875659160778701, 'eta': 0.8094330867405313, 'sampling_method': 'gradient_based', 'subsample': 0.7832577796806758, 'gamma': 9.140588965965593}. Best is trial 19 with value: 1.9087597009825021.
[I 2023-12-21 04:17:43,425] Trial 174 pruned. Trial was pruned at iteration 0.
[I 2023-12-21 04:17:46,345] Trial 175 finished with value: inf and parameters: {'learning_rate': 0.9481089413902821, 'aft_loss_distribution': 'normal', 'aft_loss_distribution_scale': 2.1770582219754466, 'max_depth': 6, 'booster': 'gbtree', 'scale_pos_weight': 1.443231247207943, 'alpha': 8.90035452269357, 'lambda': 9.94252722304364, 'eta': 0.9976702279416813, 'sampling_method': 'gradient_based', 'subsample': 0.3377499534642172, 'gamma': 2.1711722032381404}. Best is trial 19 with value: 1.9087597009825021.
[I 2023-12-21 04:17:46,462] Trial 176 pruned. Trial was pruned at iteration 1.
[I 2023-12-21 04:17:46,539] Trial 177 pruned. Trial was pruned at iteration 0.
[I 2023-12-21 04:17:46,620] Trial 178 pruned. Trial was pruned at iteration 0.
[I 2023-12-21 04:17:46,692] Trial 179 pruned. Trial was pruned at iteration 0.
[I 2023-12-21 04:17:46,766] Trial 180 pruned. Trial was pruned at iteration 0.
[I 2023-12-21 04:17:46,859] Trial 181 pruned. Trial was pruned at iteration 3.
[I 2023-12-21 04:17:46,941] Trial 182 pruned. Trial was pruned at iteration 1.
[I 2023-12-21 04:17:47,012] Trial 183 pruned. Trial was pruned at iteration 0.
[I 2023-12-21 04:17:47,088] Trial 184 pruned. Trial was pruned at iteration 0.
[I 2023-12-21 04:17:47,164] Trial 185 pruned. Trial was pruned at iteration 0.
[I 2023-12-21 04:17:47,232] Trial 186 pruned. Trial was pruned at iteration 0.
[I 2023-12-21 04:17:48,632] Trial 187 finished with value: inf and parameters: {'learning_rate': 0.9104855527937572, 'aft_loss_distribution': 'normal', 'aft_loss_distribution_scale': 2.636565034455002, 'max_depth': 8, 'booster': 'gbtree', 'scale_pos_weight': 2.547308084329591, 'alpha': 0.3123646969924998, 'lambda': 7.804926708950384, 'eta': 0.4503357852799905, 'sampling_method': 'gradient_based', 'subsample': 0.4856584176905733, 'gamma': 8.788827867086683}. Best is trial 19 with value: 1.9087597009825021.
[I 2023-12-21 04:17:48,716] Trial 188 pruned. Trial was pruned at iteration 0.
[I 2023-12-21 04:17:48,789] Trial 189 pruned. Trial was pruned at iteration 0.
[I 2023-12-21 04:17:48,906] Trial 190 pruned. Trial was pruned at iteration 0.
[I 2023-12-21 04:17:49,533] Trial 191 finished with value: inf and parameters: {'learning_rate': 0.827098572403465, 'aft_loss_distribution': 'normal', 'aft_loss_distribution_scale': 2.386782253781543, 'max_depth': 3, 'booster': 'gbtree', 'scale_pos_weight': 2.4060118800702868, 'alpha': 5.4484996592328345, 'lambda': 7.997750939226702, 'eta': 0.5370073743315545, 'sampling_method': 'uniform', 'subsample': 0.850247288659173, 'gamma': 6.523216048150825}. Best is trial 19 with value: 1.9087597009825021.
[I 2023-12-21 04:17:49,614] Trial 192 pruned. Trial was pruned at iteration 0.
[I 2023-12-21 04:17:50,289] Trial 193 finished with value: inf and parameters: {'learning_rate': 0.8430595196607574, 'aft_loss_distribution': 'normal', 'aft_loss_distribution_scale': 2.225756185902111, 'max_depth': 3, 'booster': 'gbtree', 'scale_pos_weight': 2.630797913243801, 'alpha': 5.793158300789454, 'lambda': 7.683486785685662, 'eta': 0.08530389045764805, 'sampling_method': 'uniform', 'subsample': 0.9413860741528208, 'gamma': 5.931079738213379}. Best is trial 19 with value: 1.9087597009825021.
[I 2023-12-21 04:17:50,378] Trial 194 pruned. Trial was pruned at iteration 1.
[I 2023-12-21 04:17:50,462] Trial 195 pruned. Trial was pruned at iteration 0.
[I 2023-12-21 04:17:50,538] Trial 196 pruned. Trial was pruned at iteration 0.
[I 2023-12-21 04:17:51,588] Trial 197 finished with value: inf and parameters: {'learning_rate': 0.8935556801149291, 'aft_loss_distribution': 'normal', 'aft_loss_distribution_scale': 1.4475010352346427, 'max_depth': 4, 'booster': 'gbtree', 'scale_pos_weight': 2.8224885330550227, 'alpha': 7.527106989707919, 'lambda': 8.633151088070973, 'eta': 0.11200338385233491, 'sampling_method': 'uniform', 'subsample': 0.7638346276051435, 'gamma': 7.24330979655295}. Best is trial 19 with value: 1.9087597009825021.
[I 2023-12-21 04:17:51,668] Trial 198 pruned. Trial was pruned at iteration 0.
[I 2023-12-21 04:17:51,742] Trial 199 pruned. Trial was pruned at iteration 0.
[I 2023-12-21 04:17:51,816] Trial 200 pruned. Trial was pruned at iteration 0.
[I 2023-12-21 04:17:51,904] Trial 201 pruned. Trial was pruned at iteration 1.
[I 2023-12-21 04:17:52,563] Trial 202 finished with value: inf and parameters: {'learning_rate': 0.864988850783685, 'aft_loss_distribution': 'normal', 'aft_loss_distribution_scale': 2.496286642762852, 'max_depth': 3, 'booster': 'gbtree', 'scale_pos_weight': 2.495366755045981, 'alpha': 6.774353141121076, 'lambda': 4.264240240585325, 'eta': 0.37888805758686817, 'sampling_method': 'gradient_based', 'subsample': 0.5765400214804514, 'gamma': 8.783524227069723}. Best is trial 19 with value: 1.9087597009825021.
[I 2023-12-21 04:17:52,640] Trial 203 pruned. Trial was pruned at iteration 0.
[I 2023-12-21 04:17:53,316] Trial 204 finished with value: inf and parameters: {'learning_rate': 0.9016374704679493, 'aft_loss_distribution': 'normal', 'aft_loss_distribution_scale': 2.2657454977669254, 'max_depth': 3, 'booster': 'gbtree', 'scale_pos_weight': 2.60916069016161, 'alpha': 9.06284077731667, 'lambda': 4.139102612355481, 'eta': 0.5120282930972193, 'sampling_method': 'gradient_based', 'subsample': 0.5247351252602008, 'gamma': 8.387506581207857}. Best is trial 19 with value: 1.9087597009825021.
[I 2023-12-21 04:17:53,392] Trial 205 pruned. Trial was pruned at iteration 0.
[I 2023-12-21 04:17:53,468] Trial 206 pruned. Trial was pruned at iteration 0.
[I 2023-12-21 04:17:53,549] Trial 207 pruned. Trial was pruned at iteration 0.
[I 2023-12-21 04:17:53,628] Trial 208 pruned. Trial was pruned at iteration 0.
[I 2023-12-21 04:17:53,700] Trial 209 pruned. Trial was pruned at iteration 0.
[I 2023-12-21 04:17:54,950] Trial 210 finished with value: inf and parameters: {'learning_rate': 0.9321662632632904, 'aft_loss_distribution': 'normal', 'aft_loss_distribution_scale': 1.816537902958977, 'max_depth': 4, 'booster': 'gbtree', 'scale_pos_weight': 0.9322752001701634, 'alpha': 3.293173040376183, 'lambda': 4.918428433729834, 'eta': 0.06123943091883513, 'sampling_method': 'uniform', 'subsample': 0.10646891876307096, 'gamma': 5.100840109047138}. Best is trial 19 with value: 1.9087597009825021.
[I 2023-12-21 04:17:55,875] Trial 211 finished with value: inf and parameters: {'learning_rate': 0.9255697491786815, 'aft_loss_distribution': 'normal', 'aft_loss_distribution_scale': 1.9393367866491258, 'max_depth': 3, 'booster': 'gbtree', 'scale_pos_weight': 2.1632504802790358, 'alpha': 4.126779523171638, 'lambda': 4.434100801558759, 'eta': 0.06887223152413748, 'sampling_method': 'gradient_based', 'subsample': 0.3602265020782841, 'gamma': 9.404967724307875}. Best is trial 19 with value: 1.9087597009825021.
[I 2023-12-21 04:17:56,741] Trial 212 finished with value: inf and parameters: {'learning_rate': 0.9050451139495459, 'aft_loss_distribution': 'normal', 'aft_loss_distribution_scale': 2.0708105369390135, 'max_depth': 3, 'booster': 'gbtree', 'scale_pos_weight': 2.3341731381299557, 'alpha': 4.410051983658375, 'lambda': 4.022165602323654, 'eta': 0.098337784699617, 'sampling_method': 'gradient_based', 'subsample': 0.41363989782986677, 'gamma': 9.686095018986185}. Best is trial 19 with value: 1.9087597009825021.
[I 2023-12-21 04:17:57,605] Trial 213 finished with value: inf and parameters: {'learning_rate': 0.9637642338485973, 'aft_loss_distribution': 'normal', 'aft_loss_distribution_scale': 1.5171124707513652, 'max_depth': 3, 'booster': 'gbtree', 'scale_pos_weight': 2.0722200406460916, 'alpha': 4.446669290031216, 'lambda': 0.18074664180661265, 'eta': 0.15714966831226318, 'sampling_method': 'gradient_based', 'subsample': 0.38652251999266307, 'gamma': 9.511201791293034}. Best is trial 19 with value: 1.9087597009825021.
[I 2023-12-21 04:17:58,452] Trial 214 finished with value: inf and parameters: {'learning_rate': 0.8869726496341239, 'aft_loss_distribution': 'normal', 'aft_loss_distribution_scale': 1.8651231720189254, 'max_depth': 3, 'booster': 'gbtree', 'scale_pos_weight': 3.3651379202030474, 'alpha': 4.2203832645965695, 'lambda': 7.005457611815471, 'eta': 0.1147400429931584, 'sampling_method': 'gradient_based', 'subsample': 0.31968565084997635, 'gamma': 3.384634540215128}. Best is trial 19 with value: 1.9087597009825021.
[I 2023-12-21 04:17:58,574] Trial 215 pruned. Trial was pruned at iteration 0.
[I 2023-12-21 04:17:58,696] Trial 216 pruned. Trial was pruned at iteration 0.
[I 2023-12-21 04:17:58,821] Trial 217 pruned. Trial was pruned at iteration 0.
[I 2023-12-21 04:17:58,953] Trial 218 pruned. Trial was pruned at iteration 0.
[I 2023-12-21 04:17:59,130] Trial 219 pruned. Trial was pruned at iteration 0.
[I 2023-12-21 04:17:59,212] Trial 220 pruned. Trial was pruned at iteration 0.
[I 2023-12-21 04:17:59,308] Trial 221 pruned. Trial was pruned at iteration 1.
[I 2023-12-21 04:17:59,395] Trial 222 pruned. Trial was pruned at iteration 0.
[I 2023-12-21 04:17:59,498] Trial 223 pruned. Trial was pruned at iteration 1.
[I 2023-12-21 04:17:59,571] Trial 224 pruned. Trial was pruned at iteration 0.
[I 2023-12-21 04:17:59,669] Trial 225 pruned. Trial was pruned at iteration 1.
[I 2023-12-21 04:17:59,748] Trial 226 pruned. Trial was pruned at iteration 0.
[I 2023-12-21 04:17:59,834] Trial 227 pruned. Trial was pruned at iteration 0.
[I 2023-12-21 04:17:59,909] Trial 228 pruned. Trial was pruned at iteration 0.
[I 2023-12-21 04:17:59,989] Trial 229 pruned. Trial was pruned at iteration 0.
[I 2023-12-21 04:18:00,071] Trial 230 pruned. Trial was pruned at iteration 0.
[I 2023-12-21 04:18:00,147] Trial 231 pruned. Trial was pruned at iteration 0.
[I 2023-12-21 04:18:00,236] Trial 232 pruned. Trial was pruned at iteration 0.
[I 2023-12-21 04:18:00,319] Trial 233 pruned. Trial was pruned at iteration 0.
[I 2023-12-21 04:18:00,391] Trial 234 pruned. Trial was pruned at iteration 0.
[I 2023-12-21 04:18:00,469] Trial 235 pruned. Trial was pruned at iteration 0.
[I 2023-12-21 04:18:00,540] Trial 236 pruned. Trial was pruned at iteration 0.
[I 2023-12-21 04:18:00,634] Trial 237 pruned. Trial was pruned at iteration 0.
[I 2023-12-21 04:18:00,708] Trial 238 pruned. Trial was pruned at iteration 0.
[I 2023-12-21 04:18:00,790] Trial 239 pruned. Trial was pruned at iteration 0.
[I 2023-12-21 04:18:00,881] Trial 240 pruned. Trial was pruned at iteration 0.
[I 2023-12-21 04:18:00,958] Trial 241 pruned. Trial was pruned at iteration 0.
[I 2023-12-21 04:18:01,040] Trial 242 pruned. Trial was pruned at iteration 0.
[I 2023-12-21 04:18:01,985] Trial 243 finished with value: inf and parameters: {'learning_rate': 0.8964837963952458, 'aft_loss_distribution': 'normal', 'aft_loss_distribution_scale': 2.133393863559415, 'max_depth': 8, 'booster': 'gbtree', 'scale_pos_weight': 2.9030620863583505, 'alpha': 5.574890040411441, 'lambda': 3.9662899394219635, 'eta': 0.9545916509418064, 'sampling_method': 'gradient_based', 'subsample': 0.7951011198450079, 'gamma': 9.052430716201712}. Best is trial 19 with value: 1.9087597009825021.
[I 2023-12-21 04:18:02,764] Trial 244 finished with value: inf and parameters: {'learning_rate': 0.87011794026748, 'aft_loss_distribution': 'normal', 'aft_loss_distribution_scale': 2.460232593040685, 'max_depth': 8, 'booster': 'gbtree', 'scale_pos_weight': 2.635961627411954, 'alpha': 5.766058368952027, 'lambda': 5.208640578370463, 'eta': 0.9292406598421904, 'sampling_method': 'gradient_based', 'subsample': 0.952553066780084, 'gamma': 8.334241229755609}. Best is trial 19 with value: 1.9087597009825021.
[I 2023-12-21 04:18:02,874] Trial 245 pruned. Trial was pruned at iteration 0.
[I 2023-12-21 04:18:02,955] Trial 246 pruned. Trial was pruned at iteration 0.
[I 2023-12-21 04:18:03,031] Trial 247 pruned. Trial was pruned at iteration 0.
[I 2023-12-21 04:18:03,750] Trial 248 finished with value: inf and parameters: {'learning_rate': 0.9508066027134366, 'aft_loss_distribution': 'normal', 'aft_loss_distribution_scale': 2.5843231934749866, 'max_depth': 3, 'booster': 'gbtree', 'scale_pos_weight': 2.7217955339751176, 'alpha': 5.128413031183422, 'lambda': 5.573727893304984, 'eta': 0.4595541283317466, 'sampling_method': 'gradient_based', 'subsample': 0.4034383957820922, 'gamma': 9.77678377339274}. Best is trial 19 with value: 1.9087597009825021.
