[I 2023-12-21 03:14:08,648] Trial 499 pruned. Trial was pruned at iteration 0.
[W 2023-12-21 03:14:11,126] Trial 1 is omitted in visualization because its objective value is inf or nan.
[W 2023-12-21 03:14:11,127] Trial 3 is omitted in visualization because its objective value is inf or nan.
[W 2023-12-21 03:14:11,127] Trial 11 is omitted in visualization because its objective value is inf or nan.
[W 2023-12-21 03:14:11,127] Trial 18 is omitted in visualization because its objective value is inf or nan.
[W 2023-12-21 03:14:11,127] Trial 22 is omitted in visualization because its objective value is inf or nan.
[W 2023-12-21 03:14:11,127] Trial 27 is omitted in visualization because its objective value is inf or nan.
[W 2023-12-21 03:14:11,127] Trial 98 is omitted in visualization because its objective value is inf or nan.
[W 2023-12-21 03:14:11,127] Trial 99 is omitted in visualization because its objective value is inf or nan.
[W 2023-12-21 03:14:11,127] Trial 108 is omitted in visualization because its objective value is inf or nan.
[W 2023-12-21 03:14:11,127] Trial 111 is omitted in visualization because its objective value is inf or nan.
[W 2023-12-21 03:14:11,127] Trial 115 is omitted in visualization because its objective value is inf or nan.
[W 2023-12-21 03:14:11,127] Trial 119 is omitted in visualization because its objective value is inf or nan.
[W 2023-12-21 03:14:11,127] Trial 120 is omitted in visualization because its objective value is inf or nan.
[W 2023-12-21 03:14:11,127] Trial 122 is omitted in visualization because its objective value is inf or nan.
[W 2023-12-21 03:14:11,127] Trial 124 is omitted in visualization because its objective value is inf or nan.
[W 2023-12-21 03:14:11,127] Trial 126 is omitted in visualization because its objective value is inf or nan.
[W 2023-12-21 03:14:11,127] Trial 131 is omitted in visualization because its objective value is inf or nan.
[W 2023-12-21 03:14:11,128] Trial 133 is omitted in visualization because its objective value is inf or nan.
[W 2023-12-21 03:14:11,128] Trial 134 is omitted in visualization because its objective value is inf or nan.
[W 2023-12-21 03:14:11,128] Trial 138 is omitted in visualization because its objective value is inf or nan.
[W 2023-12-21 03:14:11,128] Trial 144 is omitted in visualization because its objective value is inf or nan.
[W 2023-12-21 03:14:11,128] Trial 146 is omitted in visualization because its objective value is inf or nan.
[W 2023-12-21 03:14:11,128] Trial 147 is omitted in visualization because its objective value is inf or nan.
[W 2023-12-21 03:14:11,128] Trial 149 is omitted in visualization because its objective value is inf or nan.
[W 2023-12-21 03:14:11,128] Trial 151 is omitted in visualization because its objective value is inf or nan.
[W 2023-12-21 03:14:11,128] Trial 153 is omitted in visualization because its objective value is inf or nan.
[W 2023-12-21 03:14:11,128] Trial 155 is omitted in visualization because its objective value is inf or nan.
[W 2023-12-21 03:14:11,128] Trial 157 is omitted in visualization because its objective value is inf or nan.
[W 2023-12-21 03:14:11,128] Trial 163 is omitted in visualization because its objective value is inf or nan.
[W 2023-12-21 03:14:11,128] Trial 166 is omitted in visualization because its objective value is inf or nan.
[W 2023-12-21 03:14:11,128] Trial 170 is omitted in visualization because its objective value is inf or nan.
[W 2023-12-21 03:14:11,128] Trial 175 is omitted in visualization because its objective value is inf or nan.
[W 2023-12-21 03:14:11,128] Trial 178 is omitted in visualization because its objective value is inf or nan.
[W 2023-12-21 03:14:11,128] Trial 183 is omitted in visualization because its objective value is inf or nan.
[W 2023-12-21 03:14:11,128] Trial 186 is omitted in visualization because its objective value is inf or nan.
[W 2023-12-21 03:14:11,128] Trial 187 is omitted in visualization because its objective value is inf or nan.
[W 2023-12-21 03:14:11,128] Trial 189 is omitted in visualization because its objective value is inf or nan.
[W 2023-12-21 03:14:11,128] Trial 193 is omitted in visualization because its objective value is inf or nan.
[W 2023-12-21 03:14:11,128] Trial 196 is omitted in visualization because its objective value is inf or nan.
[W 2023-12-21 03:14:11,129] Trial 199 is omitted in visualization because its objective value is inf or nan.
[W 2023-12-21 03:14:11,129] Trial 206 is omitted in visualization because its objective value is inf or nan.
[W 2023-12-21 03:14:11,129] Trial 217 is omitted in visualization because its objective value is inf or nan.
[W 2023-12-21 03:14:11,129] Trial 222 is omitted in visualization because its objective value is inf or nan.
[W 2023-12-21 03:14:11,129] Trial 223 is omitted in visualization because its objective value is inf or nan.
[W 2023-12-21 03:14:11,129] Trial 226 is omitted in visualization because its objective value is inf or nan.
[W 2023-12-21 03:14:11,129] Trial 228 is omitted in visualization because its objective value is inf or nan.
[W 2023-12-21 03:14:11,129] Trial 235 is omitted in visualization because its objective value is inf or nan.
[W 2023-12-21 03:14:11,129] Trial 239 is omitted in visualization because its objective value is inf or nan.
[W 2023-12-21 03:14:11,129] Trial 247 is omitted in visualization because its objective value is inf or nan.
[W 2023-12-21 03:14:11,129] Trial 249 is omitted in visualization because its objective value is inf or nan.
[W 2023-12-21 03:14:11,129] Trial 253 is omitted in visualization because its objective value is inf or nan.
[W 2023-12-21 03:14:11,129] Trial 256 is omitted in visualization because its objective value is inf or nan.
[W 2023-12-21 03:14:11,129] Trial 260 is omitted in visualization because its objective value is inf or nan.
[W 2023-12-21 03:14:11,129] Trial 268 is omitted in visualization because its objective value is inf or nan.
[W 2023-12-21 03:14:11,129] Trial 270 is omitted in visualization because its objective value is inf or nan.
[W 2023-12-21 03:14:11,129] Trial 274 is omitted in visualization because its objective value is inf or nan.
[W 2023-12-21 03:14:11,129] Trial 280 is omitted in visualization because its objective value is inf or nan.
[W 2023-12-21 03:14:11,129] Trial 297 is omitted in visualization because its objective value is inf or nan.
[W 2023-12-21 03:14:11,129] Trial 300 is omitted in visualization because its objective value is inf or nan.
[W 2023-12-21 03:14:11,129] Trial 304 is omitted in visualization because its objective value is inf or nan.
[W 2023-12-21 03:14:11,129] Trial 318 is omitted in visualization because its objective value is inf or nan.
[W 2023-12-21 03:14:11,130] Trial 327 is omitted in visualization because its objective value is inf or nan.
[W 2023-12-21 03:14:11,130] Trial 333 is omitted in visualization because its objective value is inf or nan.
[W 2023-12-21 03:14:11,130] Trial 348 is omitted in visualization because its objective value is inf or nan.
[W 2023-12-21 03:14:11,130] Trial 361 is omitted in visualization because its objective value is inf or nan.
[W 2023-12-21 03:14:11,130] Trial 374 is omitted in visualization because its objective value is inf or nan.
[W 2023-12-21 03:14:11,130] Trial 378 is omitted in visualization because its objective value is inf or nan.
[W 2023-12-21 03:14:11,130] Trial 382 is omitted in visualization because its objective value is inf or nan.
[W 2023-12-21 03:14:11,130] Trial 407 is omitted in visualization because its objective value is inf or nan.
[W 2023-12-21 03:14:11,130] Trial 427 is omitted in visualization because its objective value is inf or nan.
[W 2023-12-21 03:14:11,130] Trial 436 is omitted in visualization because its objective value is inf or nan.
[W 2023-12-21 03:14:11,130] Trial 443 is omitted in visualization because its objective value is inf or nan.
[W 2023-12-21 03:14:11,130] Trial 447 is omitted in visualization because its objective value is inf or nan.
[W 2023-12-21 03:14:11,130] Trial 455 is omitted in visualization because its objective value is inf or nan.
[W 2023-12-21 03:14:11,130] Trial 460 is omitted in visualization because its objective value is inf or nan.
[W 2023-12-21 03:14:11,130] Trial 464 is omitted in visualization because its objective value is inf or nan.
[W 2023-12-21 03:14:11,130] Trial 472 is omitted in visualization because its objective value is inf or nan.
[W 2023-12-21 03:14:11,130] Trial 484 is omitted in visualization because its objective value is inf or nan.
[W 2023-12-21 03:14:11,130] Trial 495 is omitted in visualization because its objective value is inf or nan.
exo-open: Cannot open display: .
/cvmfs/soft.computecanada.ca/gentoo/2020/usr/bin/xdg-open: line 871: x-www-browser: command not found
/cvmfs/soft.computecanada.ca/gentoo/2020/usr/bin/xdg-open: line 871: firefox: command not found
/cvmfs/soft.computecanada.ca/gentoo/2020/usr/bin/xdg-open: line 871: iceweasel: command not found
/cvmfs/soft.computecanada.ca/gentoo/2020/usr/bin/xdg-open: line 871: seamonkey: command not found
/cvmfs/soft.computecanada.ca/gentoo/2020/usr/bin/xdg-open: line 871: mozilla: command not found
/cvmfs/soft.computecanada.ca/gentoo/2020/usr/bin/xdg-open: line 871: epiphany: command not found
/cvmfs/soft.computecanada.ca/gentoo/2020/usr/bin/xdg-open: line 871: konqueror: command not found
/cvmfs/soft.computecanada.ca/gentoo/2020/usr/bin/xdg-open: line 871: chromium: command not found
/cvmfs/soft.computecanada.ca/gentoo/2020/usr/bin/xdg-open: line 871: chromium-browser: command not found
/cvmfs/soft.computecanada.ca/gentoo/2020/usr/bin/xdg-open: line 871: google-chrome: command not found
/cvmfs/soft.computecanada.ca/gentoo/2020/usr/bin/xdg-open: line 871: www-browser: command not found
/cvmfs/soft.computecanada.ca/gentoo/2020/usr/bin/xdg-open: line 871: links2: command not found
/home/lisat/.local/lib/python3.10/site-packages/xgboost/data.py:440: FutureWarning:

is_sparse is deprecated and will be removed in a future version. Check `isinstance(dtype, pd.SparseDtype)` instead.

[I 2023-12-21 03:14:15,435] A new study created in memory with name: no-name-561dc8f0-c58c-4b85-8765-ea5ecc8b6166
[I 2023-12-21 03:14:35,743] Trial 0 finished with value: 6.366400819299791 and parameters: {'learning_rate': 0.420263114747987, 'aft_loss                                                                     _distribution': 'logistic', 'aft_loss_distribution_scale': 9.85123795479268, 'max_depth': 4, 'booster': 'dart', 'scale_pos_weight': 5.919                                                                     11971344849, 'alpha': 2.2358399122042556, 'lambda': 8.797223397642625, 'eta': 0.9971627998807017, 'sampling_method': 'uniform', 'subsampl                                                                     e': 0.1626137589105206, 'gamma': 9.143486870397403}. Best is trial 0 with value: 6.366400819299791.
[I 2023-12-21 03:14:35,834] Trial 1 finished with value: inf and parameters: {'learning_rate': 0.5882301326711731, 'aft_loss_distribution                                                                     ': 'logistic', 'aft_loss_distribution_scale': 0.9212144167687917, 'max_depth': 4, 'booster': 'gbtree', 'scale_pos_weight': 3.939969166201                                                                     933, 'alpha': 8.168804924020739, 'lambda': 1.668322278754063, 'eta': 0.42043966515715125, 'sampling_method': 'uniform', 'subsample': 0.50                                                                     42076837201276, 'gamma': 4.476211555963587}. Best is trial 0 with value: 6.366400819299791.
[I 2023-12-21 03:14:40,268] Trial 2 finished with value: 6.026315882060321 and parameters: {'learning_rate': 0.9093781027669493, 'aft_los                                                                     s_distribution': 'extreme', 'aft_loss_distribution_scale': 9.965052253445506, 'max_depth': 4, 'booster': 'dart', 'scale_pos_weight': 6.11                                                                     8395831046276, 'alpha': 9.705076738387994, 'lambda': 3.8285317841316204, 'eta': 0.6710006119826172, 'sampling_method': 'uniform', 'subsam                                                                     ple': 0.5824603773221533, 'gamma': 8.291150208234848}. Best is trial 2 with value: 6.026315882060321.
[I 2023-12-21 03:14:40,355] Trial 3 finished with value: 5.32801861046883 and parameters: {'learning_rate': 0.5549659369071078, 'aft_loss                                                                     _distribution': 'normal', 'aft_loss_distribution_scale': 5.194940000539497, 'max_depth': 4, 'booster': 'gbtree', 'scale_pos_weight': 2.32                                                                     4792054858657, 'alpha': 0.2712120238996209, 'lambda': 1.7016110764953352, 'eta': 0.10462922426281784, 'sampling_method': 'uniform', 'subs                                                                     ample': 0.8705897345502541, 'gamma': 5.929270460502925}. Best is trial 3 with value: 5.32801861046883.
[I 2023-12-21 03:14:59,601] Trial 4 finished with value: 4.217690538141942 and parameters: {'learning_rate': 0.03773920679566885, 'aft_lo                                                                     ss_distribution': 'logistic', 'aft_loss_distribution_scale': 0.5188872286350968, 'max_depth': 4, 'booster': 'dart', 'scale_pos_weight': 2                                                                     .120262168158511, 'alpha': 6.301593153862586, 'lambda': 5.75713410401246, 'eta': 0.7696280734825652, 'sampling_method': 'gradient_based',                                                                      'subsample': 0.14102315248383887, 'gamma': 3.616525366099495}. Best is trial 4 with value: 4.217690538141942.
[I 2023-12-21 03:14:59,719] Trial 5 finished with value: 5.0809270716790405 and parameters: {'learning_rate': 0.2397132168458391, 'aft_lo                                                                     ss_distribution': 'logistic', 'aft_loss_distribution_scale': 2.4623560587763405, 'max_depth': 4, 'booster': 'gbtree', 'scale_pos_weight':                                                                      4.064447326337011, 'alpha': 8.127393741501802, 'lambda': 8.168781978410554, 'eta': 0.6583790319817915, 'sampling_method': 'uniform', 'su                                                                     bsample': 0.9673269230504434, 'gamma': 0.6092785386298637}. Best is trial 4 with value: 4.217690538141942.
[I 2023-12-21 03:15:00,624] Trial 6 pruned. Trial was pruned at iteration 51.
[I 2023-12-21 03:15:00,629] Trial 7 pruned. Trial was pruned at iteration 0.
[I 2023-12-21 03:15:00,635] Trial 8 pruned. Trial was pruned at iteration 1.
[I 2023-12-21 03:18:55,867] Trial 9 finished with value: 5.115365464333297 and parameters: {'learning_rate': 0.020904906801566047, 'aft_l                                                                     oss_distribution': 'logistic', 'aft_loss_distribution_scale': 2.5528737663826786, 'max_depth': 7, 'booster': 'dart', 'scale_pos_weight':                                                                      0.5223098491386544, 'alpha': 3.5206571135993037, 'lambda': 5.560261408513912, 'eta': 0.10992230931305857, 'sampling_method': 'uniform', '                                                                     subsample': 0.7673338488328756, 'gamma': 5.100190653782282}. Best is trial 4 with value: 4.217690538141942.
[I 2023-12-21 03:18:55,904] Trial 10 pruned. Trial was pruned at iteration 0.
[I 2023-12-21 03:18:56,047] Trial 11 pruned. Trial was pruned at iteration 81.
[I 2023-12-21 03:18:56,476] Trial 12 finished with value: 5.089298856391664 and parameters: {'learning_rate': 0.13443175586116501, 'aft_l                                                                     oss_distribution': 'logistic', 'aft_loss_distribution_scale': 2.4850239649465737, 'max_depth': 5, 'booster': 'gbtree', 'scale_pos_weight'                                                                     : 1.7689723862079982, 'alpha': 7.0295345442341715, 'lambda': 9.36575460274223, 'eta': 0.8118164520205545, 'sampling_method': 'gradient_ba                                                                     sed', 'subsample': 0.3239661289359331, 'gamma': 2.3178720260236876}. Best is trial 4 with value: 4.217690538141942.
[I 2023-12-21 03:18:56,510] Trial 13 pruned. Trial was pruned at iteration 2.
[I 2023-12-21 03:19:26,880] Trial 14 finished with value: 4.596226687649001 and parameters: {'learning_rate': 0.1252681148089076, 'aft_lo                                                                     ss_distribution': 'logistic', 'aft_loss_distribution_scale': 1.3731279837872297, 'max_depth': 10, 'booster': 'dart', 'scale_pos_weight':                                                                      1.9527042641527101, 'alpha': 7.233647021541292, 'lambda': 5.608127753063183, 'eta': 0.8001358928329944, 'sampling_method': 'gradient_base                                                                     d', 'subsample': 0.3792085626376587, 'gamma': 1.6409516257525336}. Best is trial 4 with value: 4.217690538141942.
[I 2023-12-21 03:19:26,912] Trial 15 pruned. Trial was pruned at iteration 0.
[I 2023-12-21 03:19:26,940] Trial 16 pruned. Trial was pruned at iteration 0.
[I 2023-12-21 03:19:26,970] Trial 17 pruned. Trial was pruned at iteration 0.
[I 2023-12-21 03:19:28,074] Trial 18 finished with value: inf and parameters: {'learning_rate': 0.3747092572706131, 'aft_loss_distributio                                                                     n': 'normal', 'aft_loss_distribution_scale': 1.601877231850961, 'max_depth': 7, 'booster': 'dart', 'scale_pos_weight': 9.00733048977235,                                                                      'alpha': 2.7864320153123594, 'lambda': 6.071477311323736, 'eta': 0.5504774168150428, 'sampling_method': 'gradient_based', 'subsample': 0.                                                                     014910452118703121, 'gamma': 3.5222498365307757}. Best is trial 4 with value: 4.217690538141942.
[I 2023-12-21 03:19:29,177] Trial 19 finished with value: inf and parameters: {'learning_rate': 0.7232577322504767, 'aft_loss_distributio                                                                     n': 'extreme', 'aft_loss_distribution_scale': 3.6073107797748394, 'max_depth': 9, 'booster': 'dart', 'scale_pos_weight': 5.01808124999617                                                                     6, 'alpha': 6.183844055080668, 'lambda': 2.73583853313135, 'eta': 0.2996119823615032, 'sampling_method': 'gradient_based', 'subsample': 0                                                                     .22791488162001844, 'gamma': 1.437067116990732}. Best is trial 4 with value: 4.217690538141942.
[I 2023-12-21 03:19:29,206] Trial 20 pruned. Trial was pruned at iteration 0.
[I 2023-12-21 03:19:29,396] Trial 21 finished with value: 4.911379882394363 and parameters: {'learning_rate': 0.30560310221065645, 'aft_l                                                                     oss_distribution': 'logistic', 'aft_loss_distribution_scale': 2.0249997961045207, 'max_depth': 5, 'booster': 'gbtree', 'scale_pos_weight'                                                                     : 2.6856687478668633, 'alpha': 8.141582612447548, 'lambda': 8.011394413463638, 'eta': 0.6234777580979274, 'sampling_method': 'gradient_ba                                                                     sed', 'subsample': 0.6732172067575772, 'gamma': 1.2125068633089229}. Best is trial 4 with value: 4.217690538141942.
[I 2023-12-21 03:19:29,608] Trial 22 finished with value: 4.680251858057091 and parameters: {'learning_rate': 0.3294040498990404, 'aft_lo                                                                     ss_distribution': 'logistic', 'aft_loss_distribution_scale': 1.5244954021277808, 'max_depth': 5, 'booster': 'gbtree', 'scale_pos_weight':                                                                      2.5385933851841145, 'alpha': 7.348748106305044, 'lambda': 6.306661240306183, 'eta': 0.6064888939273801, 'sampling_method': 'gradient_bas                                                                     ed', 'subsample': 0.7176944428355926, 'gamma': 3.265207006443241}. Best is trial 4 with value: 4.217690538141942.
[I 2023-12-21 03:19:29,639] Trial 23 pruned. Trial was pruned at iteration 0.
[I 2023-12-21 03:19:29,669] Trial 24 pruned. Trial was pruned at iteration 0.
[I 2023-12-21 03:19:37,658] Trial 25 finished with value: 4.726695443896753 and parameters: {'learning_rate': 0.3280422325518258, 'aft_lo                                                                     ss_distribution': 'logistic', 'aft_loss_distribution_scale': 1.6226219379899256, 'max_depth': 7, 'booster': 'dart', 'scale_pos_weight': 1                                                                     .9245021989167248, 'alpha': 6.5649423922743795, 'lambda': 7.236790818309267, 'eta': 0.5267303904948153, 'sampling_method': 'gradient_base                                                                     d', 'subsample': 0.40521842918177325, 'gamma': 2.5362421761989826}. Best is trial 4 with value: 4.217690538141942.
[I 2023-12-21 03:19:37,689] Trial 26 pruned. Trial was pruned at iteration 0.
[I 2023-12-21 03:19:37,719] Trial 27 pruned. Trial was pruned at iteration 0.
[I 2023-12-21 03:19:37,750] Trial 28 pruned. Trial was pruned at iteration 0.
[I 2023-12-21 03:19:37,781] Trial 29 pruned. Trial was pruned at iteration 0.
[I 2023-12-21 03:19:37,812] Trial 30 pruned. Trial was pruned at iteration 0.
[I 2023-12-21 03:19:42,588] Trial 31 pruned. Trial was pruned at iteration 121.
[I 2023-12-21 03:19:42,622] Trial 32 pruned. Trial was pruned at iteration 0.
[I 2023-12-21 03:19:45,647] Trial 33 pruned. Trial was pruned at iteration 96.
