[I 2023-12-21 03:58:08,247] Trial 266 finished with value: 4.304289739776407 and parameters: {'learning_rate': 0.18815491272293128, 'aft_                                                                     loss_distribution': 'logistic', 'aft_loss_distribution_scale': 0.822656568881028, 'max_depth': 4, 'booster': 'gbtree', 'scale_pos_weight'                                                                     : 1.29322804335852, 'alpha': 2.996157664672565, 'lambda': 1.5879856785761701, 'eta': 0.024623275320122644, 'sampling_method': 'uniform',                                                                      'subsample': 0.3508726234902688, 'gamma': 0.5654626696464031}. Best is trial 113 with value: 4.241477348521332.
[I 2023-12-21 03:58:08,289] Trial 267 pruned. Trial was pruned at iteration 0.
[I 2023-12-21 03:58:08,335] Trial 268 pruned. Trial was pruned at iteration 0.
[I 2023-12-21 03:58:08,377] Trial 269 pruned. Trial was pruned at iteration 0.
[I 2023-12-21 03:58:08,419] Trial 270 pruned. Trial was pruned at iteration 0.
[I 2023-12-21 03:58:08,461] Trial 271 pruned. Trial was pruned at iteration 0.
[I 2023-12-21 03:58:08,505] Trial 272 pruned. Trial was pruned at iteration 0.
[I 2023-12-21 03:58:08,547] Trial 273 pruned. Trial was pruned at iteration 0.
[I 2023-12-21 03:58:08,590] Trial 274 pruned. Trial was pruned at iteration 0.
[I 2023-12-21 03:58:08,635] Trial 275 pruned. Trial was pruned at iteration 0.
[I 2023-12-21 03:58:08,679] Trial 276 pruned. Trial was pruned at iteration 0.
[I 2023-12-21 03:58:08,720] Trial 277 pruned. Trial was pruned at iteration 0.
[I 2023-12-21 03:58:08,763] Trial 278 pruned. Trial was pruned at iteration 0.
[I 2023-12-21 03:58:08,807] Trial 279 pruned. Trial was pruned at iteration 0.
[I 2023-12-21 03:58:08,872] Trial 280 pruned. Trial was pruned at iteration 10.
[I 2023-12-21 03:58:08,919] Trial 281 pruned. Trial was pruned at iteration 0.
[I 2023-12-21 03:58:08,962] Trial 282 pruned. Trial was pruned at iteration 0.
[I 2023-12-21 03:58:09,005] Trial 283 pruned. Trial was pruned at iteration 0.
[I 2023-12-21 03:58:09,048] Trial 284 pruned. Trial was pruned at iteration 0.
[I 2023-12-21 03:58:09,092] Trial 285 pruned. Trial was pruned at iteration 0.
[I 2023-12-21 03:58:09,135] Trial 286 pruned. Trial was pruned at iteration 0.
[I 2023-12-21 03:58:09,180] Trial 287 pruned. Trial was pruned at iteration 0.
[I 2023-12-21 03:58:09,225] Trial 288 pruned. Trial was pruned at iteration 0.
[I 2023-12-21 03:58:09,308] Trial 289 pruned. Trial was pruned at iteration 10.
[I 2023-12-21 03:58:09,353] Trial 290 pruned. Trial was pruned at iteration 0.
[I 2023-12-21 03:58:09,396] Trial 291 pruned. Trial was pruned at iteration 0.
[I 2023-12-21 03:58:09,467] Trial 292 pruned. Trial was pruned at iteration 6.
[I 2023-12-21 03:58:09,511] Trial 293 pruned. Trial was pruned at iteration 0.
[I 2023-12-21 03:58:09,557] Trial 294 pruned. Trial was pruned at iteration 0.
[I 2023-12-21 03:58:09,603] Trial 295 pruned. Trial was pruned at iteration 0.
[I 2023-12-21 03:58:09,646] Trial 296 pruned. Trial was pruned at iteration 0.
[I 2023-12-21 03:58:09,690] Trial 297 pruned. Trial was pruned at iteration 0.
[I 2023-12-21 03:58:09,735] Trial 298 pruned. Trial was pruned at iteration 0.
[I 2023-12-21 03:58:09,800] Trial 299 pruned. Trial was pruned at iteration 11.
[I 2023-12-21 03:58:09,845] Trial 300 pruned. Trial was pruned at iteration 0.
[I 2023-12-21 03:58:09,890] Trial 301 pruned. Trial was pruned at iteration 0.
[I 2023-12-21 03:58:09,934] Trial 302 pruned. Trial was pruned at iteration 0.
[I 2023-12-21 03:58:09,980] Trial 303 pruned. Trial was pruned at iteration 0.
[I 2023-12-21 03:58:10,025] Trial 304 pruned. Trial was pruned at iteration 0.
[I 2023-12-21 03:58:10,069] Trial 305 pruned. Trial was pruned at iteration 0.
[I 2023-12-21 03:58:10,115] Trial 306 pruned. Trial was pruned at iteration 0.
[I 2023-12-21 03:58:10,159] Trial 307 pruned. Trial was pruned at iteration 0.
[I 2023-12-21 03:58:10,204] Trial 308 pruned. Trial was pruned at iteration 0.
[I 2023-12-21 03:58:10,248] Trial 309 pruned. Trial was pruned at iteration 0.
[I 2023-12-21 03:58:10,295] Trial 310 pruned. Trial was pruned at iteration 0.
[I 2023-12-21 03:58:10,340] Trial 311 pruned. Trial was pruned at iteration 0.
[I 2023-12-21 03:58:10,384] Trial 312 pruned. Trial was pruned at iteration 0.
[I 2023-12-21 03:58:10,431] Trial 313 pruned. Trial was pruned at iteration 0.
[I 2023-12-21 03:58:10,511] Trial 314 pruned. Trial was pruned at iteration 7.
[I 2023-12-21 03:58:10,556] Trial 315 pruned. Trial was pruned at iteration 0.
[I 2023-12-21 03:58:10,601] Trial 316 pruned. Trial was pruned at iteration 0.
[I 2023-12-21 03:58:10,646] Trial 317 pruned. Trial was pruned at iteration 0.
[I 2023-12-21 03:58:10,691] Trial 318 pruned. Trial was pruned at iteration 0.
[I 2023-12-21 03:58:11,183] Trial 319 pruned. Trial was pruned at iteration 0.
[I 2023-12-21 03:58:11,231] Trial 320 pruned. Trial was pruned at iteration 0.
[I 2023-12-21 03:58:11,275] Trial 321 pruned. Trial was pruned at iteration 0.
[I 2023-12-21 03:58:11,324] Trial 322 pruned. Trial was pruned at iteration 0.
[I 2023-12-21 03:58:11,369] Trial 323 pruned. Trial was pruned at iteration 0.
[I 2023-12-21 03:58:11,414] Trial 324 pruned. Trial was pruned at iteration 0.
[I 2023-12-21 03:58:11,461] Trial 325 pruned. Trial was pruned at iteration 0.
[I 2023-12-21 03:58:11,507] Trial 326 pruned. Trial was pruned at iteration 0.
[I 2023-12-21 03:58:11,553] Trial 327 pruned. Trial was pruned at iteration 0.
[I 2023-12-21 03:58:11,599] Trial 328 pruned. Trial was pruned at iteration 0.
[I 2023-12-21 03:58:11,643] Trial 329 pruned. Trial was pruned at iteration 0.
[I 2023-12-21 03:58:11,689] Trial 330 pruned. Trial was pruned at iteration 0.
[I 2023-12-21 03:58:11,735] Trial 331 pruned. Trial was pruned at iteration 0.
[I 2023-12-21 03:58:11,782] Trial 332 pruned. Trial was pruned at iteration 0.
[I 2023-12-21 03:58:11,845] Trial 333 pruned. Trial was pruned at iteration 8.
[I 2023-12-21 03:58:11,891] Trial 334 pruned. Trial was pruned at iteration 0.
[I 2023-12-21 03:58:11,937] Trial 335 pruned. Trial was pruned at iteration 0.
[I 2023-12-21 03:58:11,983] Trial 336 pruned. Trial was pruned at iteration 0.
[I 2023-12-21 03:58:12,028] Trial 337 pruned. Trial was pruned at iteration 0.
[I 2023-12-21 03:58:12,076] Trial 338 pruned. Trial was pruned at iteration 0.
[I 2023-12-21 03:58:12,122] Trial 339 pruned. Trial was pruned at iteration 0.
[I 2023-12-21 03:58:12,169] Trial 340 pruned. Trial was pruned at iteration 0.
[I 2023-12-21 03:58:12,217] Trial 341 pruned. Trial was pruned at iteration 0.
[I 2023-12-21 03:58:12,784] Trial 342 finished with value: 4.233133034166347 and parameters: {'learning_rate': 0.08476974543715303, 'aft_                                                                     loss_distribution': 'logistic', 'aft_loss_distribution_scale': 0.6763493925228045, 'max_depth': 3, 'booster': 'gbtree', 'scale_pos_weight                                                                     ': 0.2863957811440231, 'alpha': 4.864967320346124, 'lambda': 1.7273936693252503, 'eta': 0.08245221670121268, 'sampling_method': 'gradient                                                                     _based', 'subsample': 0.552086289853708, 'gamma': 0.9927591809339141}. Best is trial 342 with value: 4.233133034166347.
[I 2023-12-21 03:58:12,831] Trial 343 pruned. Trial was pruned at iteration 0.
[I 2023-12-21 03:58:12,878] Trial 344 pruned. Trial was pruned at iteration 0.
[I 2023-12-21 03:58:13,375] Trial 345 finished with value: 4.244997926321782 and parameters: {'learning_rate': 0.08838384331284077, 'aft_                                                                     loss_distribution': 'logistic', 'aft_loss_distribution_scale': 0.7135742611815894, 'max_depth': 3, 'booster': 'gbtree', 'scale_pos_weight                                                                     ': 0.42594245105202866, 'alpha': 5.142242823774179, 'lambda': 1.787918067296321, 'eta': 0.5747212798685172, 'sampling_method': 'gradient_                                                                     based', 'subsample': 0.4369163241398924, 'gamma': 1.3890565298521105}. Best is trial 342 with value: 4.233133034166347.
[I 2023-12-21 03:58:13,747] Trial 346 finished with value: 4.203471615289493 and parameters: {'learning_rate': 0.08630933818374059, 'aft_                                                                     loss_distribution': 'logistic', 'aft_loss_distribution_scale': 0.6345099760739071, 'max_depth': 3, 'booster': 'gbtree', 'scale_pos_weight                                                                     ': 0.2414866882503524, 'alpha': 5.374075977097338, 'lambda': 2.177825104041605, 'eta': 0.6172105212829008, 'sampling_method': 'uniform',                                                                      'subsample': 0.4494882693679536, 'gamma': 1.5917311861138324}. Best is trial 346 with value: 4.203471615289493.
[I 2023-12-21 03:58:13,793] Trial 347 pruned. Trial was pruned at iteration 0.
[I 2023-12-21 03:58:13,838] Trial 348 pruned. Trial was pruned at iteration 0.
[I 2023-12-21 03:58:13,884] Trial 349 pruned. Trial was pruned at iteration 0.
[I 2023-12-21 03:58:13,931] Trial 350 pruned. Trial was pruned at iteration 0.
[I 2023-12-21 03:58:13,977] Trial 351 pruned. Trial was pruned at iteration 0.
[I 2023-12-21 03:58:14,023] Trial 352 pruned. Trial was pruned at iteration 0.
[I 2023-12-21 03:58:14,071] Trial 353 pruned. Trial was pruned at iteration 0.
[I 2023-12-21 03:58:14,116] Trial 354 pruned. Trial was pruned at iteration 0.
[I 2023-12-21 03:58:14,163] Trial 355 pruned. Trial was pruned at iteration 0.
[I 2023-12-21 03:58:14,210] Trial 356 pruned. Trial was pruned at iteration 0.
[I 2023-12-21 03:58:14,256] Trial 357 pruned. Trial was pruned at iteration 0.
[I 2023-12-21 03:58:14,304] Trial 358 pruned. Trial was pruned at iteration 0.
[I 2023-12-21 03:58:14,350] Trial 359 pruned. Trial was pruned at iteration 0.
[I 2023-12-21 03:58:14,397] Trial 360 pruned. Trial was pruned at iteration 0.
[I 2023-12-21 03:58:14,444] Trial 361 pruned. Trial was pruned at iteration 0.
[I 2023-12-21 03:58:14,491] Trial 362 pruned. Trial was pruned at iteration 0.
[I 2023-12-21 03:58:14,538] Trial 363 pruned. Trial was pruned at iteration 0.
[I 2023-12-21 03:58:14,585] Trial 364 pruned. Trial was pruned at iteration 0.
[I 2023-12-21 03:58:14,631] Trial 365 pruned. Trial was pruned at iteration 0.
[I 2023-12-21 03:58:14,678] Trial 366 pruned. Trial was pruned at iteration 0.
[I 2023-12-21 03:58:14,726] Trial 367 pruned. Trial was pruned at iteration 0.
[I 2023-12-21 03:58:14,773] Trial 368 pruned. Trial was pruned at iteration 0.
[I 2023-12-21 03:58:18,536] Trial 369 finished with value: 4.3004568853281055 and parameters: {'learning_rate': 0.13017668638971933, 'aft                                                                     _loss_distribution': 'logistic', 'aft_loss_distribution_scale': 0.7836255425314955, 'max_depth': 5, 'booster': 'dart', 'scale_pos_weight'                                                                     : 0.5038921491705702, 'alpha': 4.3804761848977325, 'lambda': 4.8898386316850475, 'eta': 0.5953372296922568, 'sampling_method': 'gradient_                                                                     based', 'subsample': 0.3568985123005759, 'gamma': 0.78264111016926}. Best is trial 346 with value: 4.203471615289493.
[I 2023-12-21 03:58:18,585] Trial 370 pruned. Trial was pruned at iteration 0.
[I 2023-12-21 03:58:18,632] Trial 371 pruned. Trial was pruned at iteration 0.
[I 2023-12-21 03:58:18,690] Trial 372 pruned. Trial was pruned at iteration 0.
[I 2023-12-21 03:58:18,739] Trial 373 pruned. Trial was pruned at iteration 0.
[I 2023-12-21 03:58:18,786] Trial 374 pruned. Trial was pruned at iteration 0.
[I 2023-12-21 03:58:18,835] Trial 375 pruned. Trial was pruned at iteration 0.
[I 2023-12-21 03:58:18,883] Trial 376 pruned. Trial was pruned at iteration 0.
[I 2023-12-21 03:58:18,930] Trial 377 pruned. Trial was pruned at iteration 0.
[I 2023-12-21 03:58:18,979] Trial 378 pruned. Trial was pruned at iteration 0.
[I 2023-12-21 03:58:19,027] Trial 379 pruned. Trial was pruned at iteration 0.
[I 2023-12-21 03:58:19,074] Trial 380 pruned. Trial was pruned at iteration 0.
[I 2023-12-21 03:58:19,121] Trial 381 pruned. Trial was pruned at iteration 0.
[I 2023-12-21 03:58:19,169] Trial 382 pruned. Trial was pruned at iteration 0.
[I 2023-12-21 03:58:19,219] Trial 383 pruned. Trial was pruned at iteration 0.
[I 2023-12-21 03:58:19,269] Trial 384 pruned. Trial was pruned at iteration 0.
[I 2023-12-21 03:58:19,560] Trial 385 finished with value: 4.297852427599301 and parameters: {'learning_rate': 0.12202229348317994, 'aft_                                                                     loss_distribution': 'logistic', 'aft_loss_distribution_scale': 0.7802885561744932, 'max_depth': 5, 'booster': 'gbtree', 'scale_pos_weight                                                                     ': 0.750769593577223, 'alpha': 3.6152176149455952, 'lambda': 5.004512609818361, 'eta': 0.3332884126118559, 'sampling_method': 'gradient_b                                                                     ased', 'subsample': 0.3678175595561242, 'gamma': 0.871849327326903}. Best is trial 346 with value: 4.203471615289493.
[I 2023-12-21 03:58:19,609] Trial 386 pruned. Trial was pruned at iteration 0.
[I 2023-12-21 03:58:19,656] Trial 387 pruned. Trial was pruned at iteration 0.
[I 2023-12-21 03:58:19,704] Trial 388 pruned. Trial was pruned at iteration 0.
[I 2023-12-21 03:58:19,753] Trial 389 pruned. Trial was pruned at iteration 0.
[I 2023-12-21 03:58:19,802] Trial 390 pruned. Trial was pruned at iteration 0.
[I 2023-12-21 03:58:19,851] Trial 391 pruned. Trial was pruned at iteration 0.
[I 2023-12-21 03:58:19,899] Trial 392 pruned. Trial was pruned at iteration 0.
[I 2023-12-21 03:58:19,949] Trial 393 pruned. Trial was pruned at iteration 0.
[I 2023-12-21 03:58:19,999] Trial 394 pruned. Trial was pruned at iteration 0.
[I 2023-12-21 03:58:20,047] Trial 395 pruned. Trial was pruned at iteration 0.
[I 2023-12-21 03:58:20,358] Trial 396 pruned. Trial was pruned at iteration 159.
[I 2023-12-21 03:58:20,408] Trial 397 pruned. Trial was pruned at iteration 0.
[I 2023-12-21 03:58:20,456] Trial 398 pruned. Trial was pruned at iteration 0.
[I 2023-12-21 03:58:20,505] Trial 399 pruned. Trial was pruned at iteration 0.
[I 2023-12-21 03:58:20,553] Trial 400 pruned. Trial was pruned at iteration 0.
[I 2023-12-21 03:58:20,617] Trial 401 pruned. Trial was pruned at iteration 9.
[I 2023-12-21 03:58:20,668] Trial 402 pruned. Trial was pruned at iteration 0.
[I 2023-12-21 03:58:24,647] Trial 403 finished with value: 4.2759674497401665 and parameters: {'learning_rate': 0.15327682557370614, 'aft                                                                     _loss_distribution': 'logistic', 'aft_loss_distribution_scale': 0.7793846242067564, 'max_depth': 3, 'booster': 'dart', 'scale_pos_weight'                                                                     : 0.2944614106358344, 'alpha': 3.240000716974893, 'lambda': 7.194577158207034, 'eta': 0.22710813829209073, 'sampling_method': 'gradient_b                                                                     ased', 'subsample': 0.4273600245524492, 'gamma': 0.5081930011175615}. Best is trial 346 with value: 4.203471615289493.
[I 2023-12-21 03:58:24,697] Trial 404 pruned. Trial was pruned at iteration 0.
[I 2023-12-21 03:58:24,747] Trial 405 pruned. Trial was pruned at iteration 0.
[I 2023-12-21 03:58:24,797] Trial 406 pruned. Trial was pruned at iteration 0.
[I 2023-12-21 03:58:24,847] Trial 407 pruned. Trial was pruned at iteration 0.
[I 2023-12-21 03:58:24,896] Trial 408 pruned. Trial was pruned at iteration 0.
[I 2023-12-21 03:58:24,945] Trial 409 pruned. Trial was pruned at iteration 0.
[I 2023-12-21 03:58:24,994] Trial 410 pruned. Trial was pruned at iteration 0.
[I 2023-12-21 03:58:25,044] Trial 411 pruned. Trial was pruned at iteration 0.
[I 2023-12-21 03:58:25,094] Trial 412 pruned. Trial was pruned at iteration 0.
[I 2023-12-21 03:58:40,427] Trial 413 finished with value: 4.261892821097119 and parameters: {'learning_rate': 0.11213876434454657, 'aft_                                                                     loss_distribution': 'logistic', 'aft_loss_distribution_scale': 0.7641774521682205, 'max_depth': 3, 'booster': 'dart', 'scale_pos_weight':                                                                      0.7506445582651639, 'alpha': 2.5066780124338632, 'lambda': 9.042919102117192, 'eta': 0.1682026560870665, 'sampling_method': 'uniform', '                                                                     subsample': 0.5207249208557827, 'gamma': 0.6292699717352918}. Best is trial 346 with value: 4.203471615289493.
[I 2023-12-21 03:58:40,481] Trial 414 pruned. Trial was pruned at iteration 0.
[I 2023-12-21 03:58:40,531] Trial 415 pruned. Trial was pruned at iteration 0.
[I 2023-12-21 03:58:40,580] Trial 416 pruned. Trial was pruned at iteration 0.
[I 2023-12-21 03:58:40,630] Trial 417 pruned. Trial was pruned at iteration 0.
[I 2023-12-21 03:58:40,680] Trial 418 pruned. Trial was pruned at iteration 0.
[I 2023-12-21 03:58:40,731] Trial 419 pruned. Trial was pruned at iteration 0.
[I 2023-12-21 03:58:40,781] Trial 420 pruned. Trial was pruned at iteration 0.
[I 2023-12-21 03:58:40,832] Trial 421 pruned. Trial was pruned at iteration 0.
[I 2023-12-21 03:58:40,882] Trial 422 pruned. Trial was pruned at iteration 0.
[I 2023-12-21 03:58:54,721] Trial 423 finished with value: 4.232442438867596 and parameters: {'learning_rate': 0.1182780874336827, 'aft_l                                                                     oss_distribution': 'logistic', 'aft_loss_distribution_scale': 0.7059088839158186, 'max_depth': 3, 'booster': 'dart', 'scale_pos_weight':                                                                      0.28938261532093557, 'alpha': 5.154992783754594, 'lambda': 8.261010144269571, 'eta': 0.25074218870802834, 'sampling_method': 'gradient_ba                                                                     sed', 'subsample': 0.6836776275401475, 'gamma': 0.2794138453855357}. Best is trial 346 with value: 4.203471615289493.
[I 2023-12-21 03:58:54,773] Trial 424 pruned. Trial was pruned at iteration 0.
[I 2023-12-21 03:58:54,825] Trial 425 pruned. Trial was pruned at iteration 0.
[I 2023-12-21 03:58:54,877] Trial 426 pruned. Trial was pruned at iteration 0.
[I 2023-12-21 03:58:54,927] Trial 427 pruned. Trial was pruned at iteration 0.
[I 2023-12-21 03:58:54,978] Trial 428 pruned. Trial was pruned at iteration 0.
[I 2023-12-21 03:58:55,028] Trial 429 pruned. Trial was pruned at iteration 0.
[I 2023-12-21 03:58:55,080] Trial 430 pruned. Trial was pruned at iteration 0.
[I 2023-12-21 03:59:03,738] Trial 431 pruned. Trial was pruned at iteration 159.
[I 2023-12-21 03:59:03,792] Trial 432 pruned. Trial was pruned at iteration 0.
[I 2023-12-21 03:59:03,842] Trial 433 pruned. Trial was pruned at iteration 0.
[I 2023-12-21 03:59:03,893] Trial 434 pruned. Trial was pruned at iteration 0.
[I 2023-12-21 03:59:03,943] Trial 435 pruned. Trial was pruned at iteration 0.
[I 2023-12-21 03:59:03,995] Trial 436 pruned. Trial was pruned at iteration 0.
[I 2023-12-21 03:59:04,048] Trial 437 pruned. Trial was pruned at iteration 0.
[I 2023-12-21 03:59:04,099] Trial 438 pruned. Trial was pruned at iteration 0.
[I 2023-12-21 03:59:04,149] Trial 439 pruned. Trial was pruned at iteration 0.
[I 2023-12-21 03:59:04,201] Trial 440 pruned. Trial was pruned at iteration 0.
[I 2023-12-21 03:59:04,252] Trial 441 pruned. Trial was pruned at iteration 0.
[I 2023-12-21 03:59:04,306] Trial 442 pruned. Trial was pruned at iteration 0.
[I 2023-12-21 03:59:04,357] Trial 443 pruned. Trial was pruned at iteration 0.
[I 2023-12-21 03:59:04,410] Trial 444 pruned. Trial was pruned at iteration 0.
[I 2023-12-21 03:59:04,462] Trial 445 pruned. Trial was pruned at iteration 0.
[I 2023-12-21 03:59:04,966] Trial 446 pruned. Trial was pruned at iteration 270.
[I 2023-12-21 03:59:05,017] Trial 447 pruned. Trial was pruned at iteration 0.
[I 2023-12-21 03:59:05,070] Trial 448 pruned. Trial was pruned at iteration 0.
[I 2023-12-21 03:59:05,123] Trial 449 pruned. Trial was pruned at iteration 0.
[I 2023-12-21 03:59:05,174] Trial 450 pruned. Trial was pruned at iteration 0.
[I 2023-12-21 03:59:05,225] Trial 451 pruned. Trial was pruned at iteration 0.
[I 2023-12-21 03:59:05,277] Trial 452 pruned. Trial was pruned at iteration 0.
[I 2023-12-21 03:59:05,330] Trial 453 pruned. Trial was pruned at iteration 0.
[I 2023-12-21 03:59:05,381] Trial 454 pruned. Trial was pruned at iteration 0.
[I 2023-12-21 03:59:05,436] Trial 455 pruned. Trial was pruned at iteration 0.
[I 2023-12-21 03:59:05,490] Trial 456 pruned. Trial was pruned at iteration 0.
[I 2023-12-21 03:59:05,541] Trial 457 pruned. Trial was pruned at iteration 0.
[I 2023-12-21 03:59:05,596] Trial 458 pruned. Trial was pruned at iteration 2.
[I 2023-12-21 03:59:05,844] Trial 459 finished with value: 4.266883193016136 and parameters: {'learning_rate': 0.14029892092008164, 'aft_                                                                     loss_distribution': 'logistic', 'aft_loss_distribution_scale': 0.7622061642602475, 'max_depth': 3, 'booster': 'gbtree', 'scale_pos_weight                                                                     ': 0.425670721452277, 'alpha': 3.3551247969308418, 'lambda': 1.3152107545321552, 'eta': 0.5335722449898939, 'sampling_method': 'gradient_                                                                     based', 'subsample': 0.39459646194776477, 'gamma': 9.37845277055921}. Best is trial 346 with value: 4.203471615289493.
[I 2023-12-21 03:59:05,896] Trial 460 pruned. Trial was pruned at iteration 0.
