[I 2023-12-19 00:55:15,880] Trial 434 pruned. Trial was pruned at iteration 12.
[I 2023-12-19 00:55:16,011] Trial 435 pruned. Trial was pruned at iteration 0.
[I 2023-12-19 00:55:16,153] Trial 436 pruned. Trial was pruned at iteration 0.
[I 2023-12-19 00:55:16,316] Trial 437 pruned. Trial was pruned at iteration 0.
[I 2023-12-19 00:55:16,462] Trial 438 pruned. Trial was pruned at iteration 1.
[I 2023-12-19 00:55:16,612] Trial 439 pruned. Trial was pruned at iteration 0.
[I 2023-12-19 00:55:16,769] Trial 440 pruned. Trial was pruned at iteration 0.
[I 2023-12-19 00:55:16,927] Trial 441 pruned. Trial was pruned at iteration 1.
[I 2023-12-19 00:55:17,075] Trial 442 pruned. Trial was pruned at iteration 0.
[I 2023-12-19 00:55:17,234] Trial 443 pruned. Trial was pruned at iteration 1.
[I 2023-12-19 00:55:17,408] Trial 444 pruned. Trial was pruned at iteration 0.
[I 2023-12-19 00:55:17,563] Trial 445 pruned. Trial was pruned at iteration 0.
[I 2023-12-19 00:55:17,727] Trial 446 pruned. Trial was pruned at iteration 0.
[I 2023-12-19 00:55:17,940] Trial 447 pruned. Trial was pruned at iteration 7.
[I 2023-12-19 00:55:18,092] Trial 448 pruned. Trial was pruned at iteration 1.
[I 2023-12-19 00:55:19,938] Trial 449 finished with value: inf and parameters: {'learning_rate': 0.9842144267942955, 'aft_loss_distribution': 'normal', 'aft_loss_distribution_scale': 1.3857246331243327, 'max_depth': 10, 'booster': 'dart', 'scale_pos_weight': 2.5445322596117106, 'alpha': 4.635601392276839, 'lambda': 9.724744600976434, 'eta': 0.6922011922785134, 'sampling_method': 'gradient_based', 'subsample': 0.651038370122882, 'gamma': 8.89928579156188}. Best is trial 339 with value: 1.9872850090132683.
[I 2023-12-19 00:55:20,128] Trial 450 pruned. Trial was pruned at iteration 1.
[I 2023-12-19 00:55:20,264] Trial 451 pruned. Trial was pruned at iteration 0.
[I 2023-12-19 00:55:20,398] Trial 452 pruned. Trial was pruned at iteration 0.
[I 2023-12-19 00:55:20,533] Trial 453 pruned. Trial was pruned at iteration 0.
[I 2023-12-19 00:55:20,690] Trial 454 pruned. Trial was pruned at iteration 2.
[I 2023-12-19 00:55:20,826] Trial 455 pruned. Trial was pruned at iteration 0.
[I 2023-12-19 00:55:23,320] Trial 456 pruned. Trial was pruned at iteration 68.
[I 2023-12-19 00:55:23,417] Trial 457 pruned. Trial was pruned at iteration 0.
[I 2023-12-19 00:55:23,512] Trial 458 pruned. Trial was pruned at iteration 0.
[I 2023-12-19 00:55:23,602] Trial 459 pruned. Trial was pruned at iteration 0.
[I 2023-12-19 00:55:23,697] Trial 460 pruned. Trial was pruned at iteration 0.
[I 2023-12-19 00:55:23,790] Trial 461 pruned. Trial was pruned at iteration 0.
[I 2023-12-19 00:55:23,885] Trial 462 pruned. Trial was pruned at iteration 0.
[I 2023-12-19 00:55:23,975] Trial 463 pruned. Trial was pruned at iteration 0.
[I 2023-12-19 00:55:24,074] Trial 464 pruned. Trial was pruned at iteration 0.
[I 2023-12-19 00:55:24,168] Trial 465 pruned. Trial was pruned at iteration 0.
[I 2023-12-19 00:55:24,290] Trial 466 pruned. Trial was pruned at iteration 3.
[I 2023-12-19 00:55:24,388] Trial 467 pruned. Trial was pruned at iteration 1.
[I 2023-12-19 00:55:24,487] Trial 468 pruned. Trial was pruned at iteration 0.
[I 2023-12-19 00:55:24,584] Trial 469 pruned. Trial was pruned at iteration 1.
[I 2023-12-19 00:55:24,684] Trial 470 pruned. Trial was pruned at iteration 0.
[I 2023-12-19 00:55:24,784] Trial 471 pruned. Trial was pruned at iteration 2.
[I 2023-12-19 00:55:24,883] Trial 472 pruned. Trial was pruned at iteration 1.
[I 2023-12-19 00:55:24,976] Trial 473 pruned. Trial was pruned at iteration 0.
[I 2023-12-19 00:55:25,070] Trial 474 pruned. Trial was pruned at iteration 0.
[I 2023-12-19 00:55:25,170] Trial 475 pruned. Trial was pruned at iteration 0.
[I 2023-12-19 00:55:25,271] Trial 476 pruned. Trial was pruned at iteration 0.
[I 2023-12-19 00:55:25,369] Trial 477 pruned. Trial was pruned at iteration 0.
[I 2023-12-19 00:55:25,468] Trial 478 pruned. Trial was pruned at iteration 0.
[I 2023-12-19 00:55:25,734] Trial 479 finished with value: inf and parameters: {'learning_rate': 0.9686813478617012, 'aft_loss_distribution': 'normal', 'aft_loss_distribution_scale': 1.399788010583419, 'max_depth': 8, 'booster': 'gbtree', 'scale_pos_weight': 2.7756238615969613, 'alpha': 5.187680803125482, 'lambda': 8.699949291087716, 'eta': 0.93736900788195, 'sampling_method': 'uniform', 'subsample': 0.6970331199525674, 'gamma': 9.992248690502546}. Best is trial 339 with value: 1.9872850090132683.
[I 2023-12-19 00:55:25,833] Trial 480 pruned. Trial was pruned at iteration 0.
[I 2023-12-19 00:55:25,951] Trial 481 pruned. Trial was pruned at iteration 3.
[I 2023-12-19 00:55:26,053] Trial 482 pruned. Trial was pruned at iteration 0.
[I 2023-12-19 00:55:26,151] Trial 483 pruned. Trial was pruned at iteration 0.
[I 2023-12-19 00:55:26,246] Trial 484 pruned. Trial was pruned at iteration 0.
[I 2023-12-19 00:55:26,349] Trial 485 pruned. Trial was pruned at iteration 0.
[I 2023-12-19 00:55:26,441] Trial 486 pruned. Trial was pruned at iteration 0.
[I 2023-12-19 00:55:26,535] Trial 487 pruned. Trial was pruned at iteration 0.
[I 2023-12-19 00:55:26,634] Trial 488 pruned. Trial was pruned at iteration 0.
[I 2023-12-19 00:55:26,733] Trial 489 pruned. Trial was pruned at iteration 0.
[I 2023-12-19 00:55:26,833] Trial 490 pruned. Trial was pruned at iteration 0.
[I 2023-12-19 00:55:30,099] Trial 491 pruned. Trial was pruned at iteration 86.
[I 2023-12-19 00:55:30,198] Trial 492 pruned. Trial was pruned at iteration 0.
[I 2023-12-19 00:55:30,290] Trial 493 pruned. Trial was pruned at iteration 0.
[I 2023-12-19 00:55:30,398] Trial 494 pruned. Trial was pruned at iteration 1.
[I 2023-12-19 00:55:30,501] Trial 495 pruned. Trial was pruned at iteration 0.
[I 2023-12-19 00:55:30,609] Trial 496 pruned. Trial was pruned at iteration 0.
[I 2023-12-19 00:55:30,701] Trial 497 pruned. Trial was pruned at iteration 0.
[I 2023-12-19 00:55:30,814] Trial 498 pruned. Trial was pruned at iteration 3.
[I 2023-12-19 00:55:30,910] Trial 499 pruned. Trial was pruned at iteration 0.
Completed hyperparameter tuning with best aft-nloglik = 1.9872850090132683.
Re-running the best trial... params = {'verbosity': 0, 'objective': 'survival:aft', 'eval_metric': 'aft-nloglik', 'tree_method': 'gpu_hist', 'device': 'cuda', 'learning_rate': 0.9999313016592013, 'aft_loss_distribution': 'normal', 'aft_loss_distribution_scale': 1.383615569120385, 'max_depth': 9, 'booster': 'dart', 'scale_pos_weight': 3.338555496809064, 'alpha': 3.5031388612552976, 'lambda': 9.833956308194123, 'eta': 0.6728944457096281, 'sampling_method': 'uniform', 'subsample': 0.6822289985685857, 'gamma': 9.272388669154061}
[W 2023-12-19 00:55:34,868] Trial 1 is omitted in visualization because its objective value is inf or nan.
[W 2023-12-19 00:55:34,874] Trial 2 is omitted in visualization because its objective value is inf or nan.
[W 2023-12-19 00:55:34,875] Trial 8 is omitted in visualization because its objective value is inf or nan.
[W 2023-12-19 00:55:34,877] Trial 10 is omitted in visualization because its objective value is inf or nan.
[W 2023-12-19 00:55:34,878] Trial 26 is omitted in visualization because its objective value is inf or nan.
[W 2023-12-19 00:55:34,879] Trial 27 is omitted in visualization because its objective value is inf or nan.
[W 2023-12-19 00:55:34,880] Trial 33 is omitted in visualization because its objective value is inf or nan.
[W 2023-12-19 00:55:34,885] Trial 35 is omitted in visualization because its objective value is inf or nan.
[W 2023-12-19 00:55:34,886] Trial 36 is omitted in visualization because its objective value is inf or nan.
[W 2023-12-19 00:55:34,887] Trial 39 is omitted in visualization because its objective value is inf or nan.
[W 2023-12-19 00:55:34,888] Trial 46 is omitted in visualization because its objective value is inf or nan.
[W 2023-12-19 00:55:34,888] Trial 58 is omitted in visualization because its objective value is inf or nan.
[W 2023-12-19 00:55:34,889] Trial 67 is omitted in visualization because its objective value is inf or nan.
[W 2023-12-19 00:55:34,890] Trial 71 is omitted in visualization because its objective value is inf or nan.
[W 2023-12-19 00:55:34,890] Trial 72 is omitted in visualization because its objective value is inf or nan.
[W 2023-12-19 00:55:34,891] Trial 74 is omitted in visualization because its objective value is inf or nan.
[W 2023-12-19 00:55:34,895] Trial 75 is omitted in visualization because its objective value is inf or nan.
[W 2023-12-19 00:55:34,896] Trial 76 is omitted in visualization because its objective value is inf or nan.
[W 2023-12-19 00:55:34,897] Trial 78 is omitted in visualization because its objective value is inf or nan.
[W 2023-12-19 00:55:34,897] Trial 88 is omitted in visualization because its objective value is inf or nan.
[W 2023-12-19 00:55:34,898] Trial 94 is omitted in visualization because its objective value is inf or nan.
[W 2023-12-19 00:55:34,899] Trial 102 is omitted in visualization because its objective value is inf or nan.
[W 2023-12-19 00:55:34,904] Trial 138 is omitted in visualization because its objective value is inf or nan.
[W 2023-12-19 00:55:34,905] Trial 142 is omitted in visualization because its objective value is inf or nan.
[W 2023-12-19 00:55:34,905] Trial 145 is omitted in visualization because its objective value is inf or nan.
[W 2023-12-19 00:55:34,906] Trial 169 is omitted in visualization because its objective value is inf or nan.
[W 2023-12-19 00:55:34,907] Trial 177 is omitted in visualization because its objective value is inf or nan.
[W 2023-12-19 00:55:34,908] Trial 190 is omitted in visualization because its objective value is inf or nan.
[W 2023-12-19 00:55:34,909] Trial 196 is omitted in visualization because its objective value is inf or nan.
[W 2023-12-19 00:55:34,910] Trial 219 is omitted in visualization because its objective value is inf or nan.
[W 2023-12-19 00:55:34,911] Trial 231 is omitted in visualization because its objective value is inf or nan.
[W 2023-12-19 00:55:34,912] Trial 237 is omitted in visualization because its objective value is inf or nan.
[W 2023-12-19 00:55:34,913] Trial 267 is omitted in visualization because its objective value is inf or nan.
[W 2023-12-19 00:55:34,914] Trial 276 is omitted in visualization because its objective value is inf or nan.
[W 2023-12-19 00:55:34,914] Trial 305 is omitted in visualization because its objective value is inf or nan.
[W 2023-12-19 00:55:34,915] Trial 318 is omitted in visualization because its objective value is inf or nan.
[W 2023-12-19 00:55:34,916] Trial 321 is omitted in visualization because its objective value is inf or nan.
[W 2023-12-19 00:55:34,917] Trial 346 is omitted in visualization because its objective value is inf or nan.
[W 2023-12-19 00:55:34,918] Trial 352 is omitted in visualization because its objective value is inf or nan.
[W 2023-12-19 00:55:34,919] Trial 358 is omitted in visualization because its objective value is inf or nan.
[W 2023-12-19 00:55:34,920] Trial 406 is omitted in visualization because its objective value is inf or nan.
[W 2023-12-19 00:55:34,921] Trial 449 is omitted in visualization because its objective value is inf or nan.
[W 2023-12-19 00:55:34,922] Trial 479 is omitted in visualization because its objective value is inf or nan.
TRN1 | R2:0.302; p:1.424e-133 | C:67.93 |3h:0.955 |6h:0.944 |9h:0.937 |12h:0.731 |15h:0.731 |18h:0.728 |24h:0.576 |48h:0.568 |72h:0.560 |1wk:0.381 |2wks:0.375 |1mon:0.328 |
TRN2 | R2:0.261; p:1.698e-99 | C:65.34 |3h:0.957 |6h:0.945 |9h:0.938 |12h:0.732 |15h:0.732 |18h:0.728 |24h:0.576 |48h:0.569 |72h:0.560 |1wk:0.382 |2wks:0.373 |1mon:0.324 |
VAL | R2:0.250; p:1.382e-90 | C:64.49 |3h:0.957 |6h:0.945 |9h:0.938 |12h:0.732 |15h:0.732 |18h:0.728 |24h:0.575 |48h:0.568 |72h:0.559 |1wk:0.383 |2wks:0.373 |1mon:0.326 |
TST | R2:0.172; p:1.325e-129 | C:60.11 |3h:0.951 |6h:0.936 |9h:0.927 |12h:0.726 |15h:0.726 |18h:0.711 |24h:0.443 |48h:0.442 |72h:0.438 |1wk:0.349 |2wks:0.356 |1mon:0.327 |
/content/drive/MyDrive/intermediates2/res//outcome2_xgb-aft_inp24_k3_emb4_rdims8.json
trn1
trn2
val
[I 2023-12-19 00:55:42,778] A new study created in memory with name: no-name-15f4a2fe-4605-46d9-bf24-d4d92efe4a8f
tst
[I 2023-12-19 00:55:43,437] Trial 0 finished with value: inf and parameters: {'learning_rate': 0.8708810388713336, 'aft_loss_distribution': 'normal', 'aft_loss_distribution_scale': 7.243019619062588, 'max_depth': 7, 'booster': 'gbtree', 'scale_pos_weight': 1.7269247249228241, 'alpha': 9.340423311178302, 'lambda': 2.123439266910375, 'eta': 0.8059909519639957, 'sampling_method': 'gradient_based', 'subsample': 0.7942560906602705, 'gamma': 7.225626050065322}. Best is trial 0 with value: inf.
[I 2023-12-19 00:55:54,845] Trial 1 finished with value: 2.6862493490300037 and parameters: {'learning_rate': 0.5344415558328116, 'aft_loss_distribution': 'logistic', 'aft_loss_distribution_scale': 9.00702451445741, 'max_depth': 4, 'booster': 'dart', 'scale_pos_weight': 2.849560047978593, 'alpha': 3.4936811707085744, 'lambda': 1.7015069452312845, 'eta': 0.9938381603835438, 'sampling_method': 'uniform', 'subsample': 0.6611848274099011, 'gamma': 0.18550562092656}. Best is trial 1 with value: 2.6862493490300037.
[I 2023-12-19 00:55:56,797] Trial 2 finished with value: inf and parameters: {'learning_rate': 0.7200564194615051, 'aft_loss_distribution': 'extreme', 'aft_loss_distribution_scale': 1.0328015391677345, 'max_depth': 3, 'booster': 'dart', 'scale_pos_weight': 0.6118565048547203, 'alpha': 8.092810116742356, 'lambda': 7.730156314683038, 'eta': 0.4750047920415035, 'sampling_method': 'uniform', 'subsample': 0.25731243936274323, 'gamma': 5.8760922965418745}. Best is trial 1 with value: 2.6862493490300037.
[I 2023-12-19 00:56:00,774] Trial 3 finished with value: 2.456674694068721 and parameters: {'learning_rate': 0.1428280203793127, 'aft_loss_distribution': 'extreme', 'aft_loss_distribution_scale': 5.931829216467274, 'max_depth': 10, 'booster': 'gbtree', 'scale_pos_weight': 1.0387786028520154, 'alpha': 1.1947793850442874, 'lambda': 7.017759755885349, 'eta': 0.5454550440920332, 'sampling_method': 'gradient_based', 'subsample': 0.6166453890624661, 'gamma': 4.885407184416897}. Best is trial 3 with value: 2.456674694068721.
[I 2023-12-19 00:56:37,297] Trial 4 finished with value: 5.06506285086397 and parameters: {'learning_rate': 0.17697195884294678, 'aft_loss_distribution': 'extreme', 'aft_loss_distribution_scale': 0.1960905487295707, 'max_depth': 8, 'booster': 'dart', 'scale_pos_weight': 3.1085100297766317, 'alpha': 5.447283664712211, 'lambda': 7.547643166630844, 'eta': 0.14462649431704644, 'sampling_method': 'uniform', 'subsample': 0.5259457273816691, 'gamma': 6.76712576827276}. Best is trial 3 with value: 2.456674694068721.
[I 2023-12-19 00:56:37,315] Trial 5 pruned. Trial was pruned at iteration 0.
[I 2023-12-19 00:56:37,518] Trial 6 pruned. Trial was pruned at iteration 8.
[I 2023-12-19 00:56:39,003] Trial 7 finished with value: inf and parameters: {'learning_rate': 0.9580888904384729, 'aft_loss_distribution': 'logistic', 'aft_loss_distribution_scale': 3.9299808834451357, 'max_depth': 7, 'booster': 'dart', 'scale_pos_weight': 1.10606326804832, 'alpha': 7.181284542875678, 'lambda': 0.24684591208105422, 'eta': 0.033988971719369654, 'sampling_method': 'uniform', 'subsample': 0.17226287888387806, 'gamma': 8.378360369988883}. Best is trial 3 with value: 2.456674694068721.
[I 2023-12-19 00:56:39,024] Trial 8 pruned. Trial was pruned at iteration 0.
[I 2023-12-19 00:56:39,038] Trial 9 pruned. Trial was pruned at iteration 0.
[I 2023-12-19 00:56:39,102] Trial 10 pruned. Trial was pruned at iteration 0.
[I 2023-12-19 00:56:39,239] Trial 11 pruned. Trial was pruned at iteration 5.
[I 2023-12-19 00:56:39,301] Trial 12 pruned. Trial was pruned at iteration 1.
[I 2023-12-19 00:56:39,482] Trial 13 pruned. Trial was pruned at iteration 5.
[I 2023-12-19 00:56:39,583] Trial 14 pruned. Trial was pruned at iteration 5.
[I 2023-12-19 00:56:39,647] Trial 15 pruned. Trial was pruned at iteration 0.
[I 2023-12-19 00:56:39,834] Trial 16 pruned. Trial was pruned at iteration 7.
[I 2023-12-19 00:56:39,894] Trial 17 pruned. Trial was pruned at iteration 0.
[I 2023-12-19 00:56:39,953] Trial 18 pruned. Trial was pruned at iteration 1.
[I 2023-12-19 00:56:40,103] Trial 19 pruned. Trial was pruned at iteration 7.
[I 2023-12-19 00:56:40,452] Trial 20 pruned. Trial was pruned at iteration 11.
[I 2023-12-19 00:56:40,513] Trial 21 pruned. Trial was pruned at iteration 0.
[I 2023-12-19 00:56:40,575] Trial 22 pruned. Trial was pruned at iteration 0.
[I 2023-12-19 00:56:40,634] Trial 23 pruned. Trial was pruned at iteration 0.
[I 2023-12-19 00:56:40,692] Trial 24 pruned. Trial was pruned at iteration 0.
[I 2023-12-19 00:57:00,047] Trial 25 finished with value: 2.3185555909303353 and parameters: {'learning_rate': 0.08928432542922744, 'aft_loss_distribution': 'logistic', 'aft_loss_distribution_scale': 3.306591904943918, 'max_depth': 9, 'booster': 'dart', 'scale_pos_weight': 3.403788667773248, 'alpha': 4.156693601024771, 'lambda': 8.23914385495596, 'eta': 0.704716579554183, 'sampling_method': 'uniform', 'subsample': 0.518567425288935, 'gamma': 1.4163155436256774}. Best is trial 25 with value: 2.3185555909303353.
[I 2023-12-19 00:57:00,121] Trial 26 pruned. Trial was pruned at iteration 1.
[I 2023-12-19 00:57:05,026] Trial 27 finished with value: inf and parameters: {'learning_rate': 0.40976138167892556, 'aft_loss_distribution': 'logistic', 'aft_loss_distribution_scale': 3.447798474903292, 'max_depth': 10, 'booster': 'dart', 'scale_pos_weight': 3.415009687137117, 'alpha': 2.973577416345921, 'lambda': 8.741615778745675, 'eta': 0.8779976925426447, 'sampling_method': 'uniform', 'subsample': 0.7460628428878776, 'gamma': 1.1078054042954741}. Best is trial 25 with value: 2.3185555909303353.
[I 2023-12-19 00:57:05,149] Trial 28 pruned. Trial was pruned at iteration 5.
[I 2023-12-19 00:57:06,661] Trial 29 finished with value: inf and parameters: {'learning_rate': 0.7982117770514088, 'aft_loss_distribution': 'normal', 'aft_loss_distribution_scale': 2.817126553291255, 'max_depth': 9, 'booster': 'gbtree', 'scale_pos_weight': 1.5809384109261246, 'alpha': 9.63220082902596, 'lambda': 1.7134967000552197, 'eta': 0.7485676539098952, 'sampling_method': 'gradient_based', 'subsample': 0.4281606591150169, 'gamma': 2.898661930458593}. Best is trial 25 with value: 2.3185555909303353.
[I 2023-12-19 00:57:08,522] Trial 30 finished with value: inf and parameters: {'learning_rate': 0.5148474604119926, 'aft_loss_distribution': 'logistic', 'aft_loss_distribution_scale': 4.139841188987466, 'max_depth': 6, 'booster': 'dart', 'scale_pos_weight': 1.9096482249222664, 'alpha': 2.028574905872399, 'lambda': 2.8351572985435802, 'eta': 0.889773428942587, 'sampling_method': 'uniform', 'subsample': 0.9521746607062582, 'gamma': 3.5095104775754544}. Best is trial 25 with value: 2.3185555909303353.
[I 2023-12-19 00:57:08,606] Trial 31 pruned. Trial was pruned at iteration 0.
[I 2023-12-19 00:57:08,667] Trial 32 pruned. Trial was pruned at iteration 0.
[I 2023-12-19 00:57:08,730] Trial 33 pruned. Trial was pruned at iteration 0.
[I 2023-12-19 00:57:08,789] Trial 34 pruned. Trial was pruned at iteration 0.
[I 2023-12-19 00:57:08,848] Trial 35 pruned. Trial was pruned at iteration 0.
[I 2023-12-19 00:57:08,910] Trial 36 pruned. Trial was pruned at iteration 0.
[I 2023-12-19 00:57:08,975] Trial 37 pruned. Trial was pruned at iteration 0.
[I 2023-12-19 00:57:09,032] Trial 38 pruned. Trial was pruned at iteration 0.
[I 2023-12-19 00:57:12,073] Trial 39 finished with value: 2.303166958409313 and parameters: {'learning_rate': 0.3198485275999582, 'aft_loss_distribution': 'logistic', 'aft_loss_distribution_scale': 3.0875696705495326, 'max_depth': 3, 'booster': 'dart', 'scale_pos_weight': 1.3204887698299645, 'alpha': 1.8569258435783549, 'lambda': 6.554232646094498, 'eta': 0.13356864324468207, 'sampling_method': 'gradient_based', 'subsample': 0.7787417358923168, 'gamma': 9.67289961509179}. Best is trial 39 with value: 2.303166958409313.
[I 2023-12-19 00:57:12,144] Trial 40 pruned. Trial was pruned at iteration 0.
[I 2023-12-19 00:57:12,211] Trial 41 pruned. Trial was pruned at iteration 0.
[I 2023-12-19 00:57:13,987] Trial 42 finished with value: inf and parameters: {'learning_rate': 0.4401552087200633, 'aft_loss_distribution': 'logistic', 'aft_loss_distribution_scale': 2.1903524710560145, 'max_depth': 4, 'booster': 'dart', 'scale_pos_weight': 1.1483270470076918, 'alpha': 3.0970748051944903, 'lambda': 0.0319530256725713, 'eta': 0.12931262544977473, 'sampling_method': 'gradient_based', 'subsample': 0.6020571527236223, 'gamma': 8.10225499934674}. Best is trial 39 with value: 2.303166958409313.
[I 2023-12-19 00:57:16,218] Trial 43 finished with value: inf and parameters: {'learning_rate': 0.5726005381899322, 'aft_loss_distribution': 'logistic', 'aft_loss_distribution_scale': 2.8026428721653445, 'max_depth': 3, 'booster': 'dart', 'scale_pos_weight': 0.7829661931537243, 'alpha': 0.7576376692245792, 'lambda': 5.909184485519856, 'eta': 0.16465511454768528, 'sampling_method': 'gradient_based', 'subsample': 0.5241519020888505, 'gamma': 4.786611110921663}. Best is trial 39 with value: 2.303166958409313.
[I 2023-12-19 00:57:16,337] Trial 44 pruned. Trial was pruned at iteration 0.
[I 2023-12-19 00:57:16,437] Trial 45 pruned. Trial was pruned at iteration 0.
[I 2023-12-19 00:57:16,533] Trial 46 pruned. Trial was pruned at iteration 0.
[I 2023-12-19 00:57:16,626] Trial 47 pruned. Trial was pruned at iteration 0.
[I 2023-12-19 00:57:16,725] Trial 48 pruned. Trial was pruned at iteration 0.
[I 2023-12-19 00:57:16,813] Trial 49 pruned. Trial was pruned at iteration 0.
[I 2023-12-19 00:57:16,904] Trial 50 pruned. Trial was pruned at iteration 0.
[I 2023-12-19 00:57:17,052] Trial 51 pruned. Trial was pruned at iteration 2.
