[I 2023-12-21 04:03:53,010] Trial 192 pruned. Trial was pruned at iteration 1.
[I 2023-12-21 04:03:54,260] Trial 193 finished with value: inf and parameters: {'learning_rate': 0.6217875222206443, 'aft_loss_distributi                                                                     on': 'normal', 'aft_loss_distribution_scale': 1.4487969913885461, 'max_depth': 3, 'booster': 'dart', 'scale_pos_weight': 7.84549116468019                                                                     6, 'alpha': 4.7179798493508205, 'lambda': 3.3742633380137503, 'eta': 0.9792549655332772, 'sampling_method': 'gradient_based', 'subsample'                                                                     : 0.3861251825721166, 'gamma': 2.1407040663117796}. Best is trial 127 with value: 4.29954991379438.
[I 2023-12-21 04:03:55,262] Trial 194 finished with value: inf and parameters: {'learning_rate': 0.7901831511008757, 'aft_loss_distributi                                                                     on': 'normal', 'aft_loss_distribution_scale': 0.9901770346488071, 'max_depth': 3, 'booster': 'dart', 'scale_pos_weight': 7.46724877762029                                                                     7, 'alpha': 4.0429362480021815, 'lambda': 3.7934264972657603, 'eta': 0.9622511324633515, 'sampling_method': 'gradient_based', 'subsample'                                                                     : 0.034510035237521115, 'gamma': 2.650633150224127}. Best is trial 127 with value: 4.29954991379438.
[I 2023-12-21 04:03:55,308] Trial 195 pruned. Trial was pruned at iteration 1.
[I 2023-12-21 04:03:55,348] Trial 196 pruned. Trial was pruned at iteration 0.
[I 2023-12-21 04:03:55,501] Trial 197 finished with value: 4.350587641672949 and parameters: {'learning_rate': 0.9045336988410231, 'aft_l                                                                     oss_distribution': 'normal', 'aft_loss_distribution_scale': 1.4843242385161355, 'max_depth': 9, 'booster': 'gbtree', 'scale_pos_weight':                                                                      8.15682311931266, 'alpha': 3.777339465135159, 'lambda': 3.974814091189759, 'eta': 0.86197885209836, 'sampling_method': 'gradient_based',                                                                      'subsample': 0.6186470836657867, 'gamma': 4.738045962157115}. Best is trial 127 with value: 4.29954991379438.
[I 2023-12-21 04:03:55,549] Trial 198 pruned. Trial was pruned at iteration 0.
[I 2023-12-21 04:03:55,591] Trial 199 pruned. Trial was pruned at iteration 1.
[I 2023-12-21 04:03:55,632] Trial 200 pruned. Trial was pruned at iteration 0.
[I 2023-12-21 04:03:55,739] Trial 201 finished with value: inf and parameters: {'learning_rate': 0.9430046541091789, 'aft_loss_distributi                                                                     on': 'normal', 'aft_loss_distribution_scale': 1.4094216574837009, 'max_depth': 9, 'booster': 'gbtree', 'scale_pos_weight': 8.100426288309                                                                     137, 'alpha': 3.729391130106843, 'lambda': 3.4796342817737687, 'eta': 0.8472791053017534, 'sampling_method': 'gradient_based', 'subsample                                                                     ': 0.6303955806183739, 'gamma': 4.285156082882618}. Best is trial 127 with value: 4.29954991379438.
[I 2023-12-21 04:03:55,783] Trial 202 pruned. Trial was pruned at iteration 1.
[I 2023-12-21 04:03:55,825] Trial 203 pruned. Trial was pruned at iteration 1.
[I 2023-12-21 04:03:55,871] Trial 204 pruned. Trial was pruned at iteration 1.
[I 2023-12-21 04:03:55,913] Trial 205 pruned. Trial was pruned at iteration 0.
[I 2023-12-21 04:03:55,954] Trial 206 pruned. Trial was pruned at iteration 0.
[I 2023-12-21 04:03:55,997] Trial 207 pruned. Trial was pruned at iteration 0.
[I 2023-12-21 04:03:56,039] Trial 208 pruned. Trial was pruned at iteration 1.
[I 2023-12-21 04:03:57,123] Trial 209 finished with value: inf and parameters: {'learning_rate': 0.6594398226318149, 'aft_loss_distributi                                                                     on': 'normal', 'aft_loss_distribution_scale': 1.4740936890440706, 'max_depth': 4, 'booster': 'dart', 'scale_pos_weight': 6.74402728643566                                                                     1, 'alpha': 0.5361865312920733, 'lambda': 1.9717457926476176, 'eta': 0.2931643024714359, 'sampling_method': 'uniform', 'subsample': 0.426                                                                     73364230163735, 'gamma': 4.199463478402743}. Best is trial 127 with value: 4.29954991379438.
[I 2023-12-21 04:03:57,165] Trial 210 pruned. Trial was pruned at iteration 0.
[I 2023-12-21 04:03:57,206] Trial 211 pruned. Trial was pruned at iteration 0.
[I 2023-12-21 04:03:57,372] Trial 212 finished with value: inf and parameters: {'learning_rate': 0.6836408813074821, 'aft_loss_distributi                                                                     on': 'normal', 'aft_loss_distribution_scale': 1.1492237476507785, 'max_depth': 10, 'booster': 'gbtree', 'scale_pos_weight': 5.66210508143                                                                     4488, 'alpha': 8.190875245582905, 'lambda': 1.5436607283526103, 'eta': 0.4167384377221263, 'sampling_method': 'uniform', 'subsample': 0.7                                                                     526013897008595, 'gamma': 1.1454118253863153}. Best is trial 127 with value: 4.29954991379438.
[I 2023-12-21 04:03:57,416] Trial 213 pruned. Trial was pruned at iteration 0.
[I 2023-12-21 04:03:57,457] Trial 214 pruned. Trial was pruned at iteration 0.
[I 2023-12-21 04:03:57,570] Trial 215 finished with value: inf and parameters: {'learning_rate': 0.7778664667453574, 'aft_loss_distributi                                                                     on': 'normal', 'aft_loss_distribution_scale': 1.5014200455795343, 'max_depth': 10, 'booster': 'gbtree', 'scale_pos_weight': 6.28025586944                                                                     8981, 'alpha': 7.734492302553506, 'lambda': 2.4377092428410987, 'eta': 0.45035279288096103, 'sampling_method': 'uniform', 'subsample': 0.                                                                     7996551976752417, 'gamma': 4.6883450445292105}. Best is trial 127 with value: 4.29954991379438.
[I 2023-12-21 04:03:57,612] Trial 216 pruned. Trial was pruned at iteration 1.
[I 2023-12-21 04:03:57,653] Trial 217 pruned. Trial was pruned at iteration 0.
[I 2023-12-21 04:03:57,695] Trial 218 pruned. Trial was pruned at iteration 0.
[I 2023-12-21 04:03:57,739] Trial 219 pruned. Trial was pruned at iteration 2.
[I 2023-12-21 04:03:57,782] Trial 220 pruned. Trial was pruned at iteration 0.
[I 2023-12-21 04:03:57,823] Trial 221 pruned. Trial was pruned at iteration 0.
[I 2023-12-21 04:03:57,866] Trial 222 pruned. Trial was pruned at iteration 0.
[I 2023-12-21 04:03:57,908] Trial 223 pruned. Trial was pruned at iteration 0.
[I 2023-12-21 04:03:57,949] Trial 224 pruned. Trial was pruned at iteration 0.
[I 2023-12-21 04:03:57,990] Trial 225 pruned. Trial was pruned at iteration 0.
[I 2023-12-21 04:03:58,032] Trial 226 pruned. Trial was pruned at iteration 0.
[I 2023-12-21 04:03:58,074] Trial 227 pruned. Trial was pruned at iteration 0.
[I 2023-12-21 04:03:58,120] Trial 228 pruned. Trial was pruned at iteration 0.
[I 2023-12-21 04:03:58,163] Trial 229 pruned. Trial was pruned at iteration 0.
[I 2023-12-21 04:03:58,205] Trial 230 pruned. Trial was pruned at iteration 0.
[I 2023-12-21 04:03:58,247] Trial 231 pruned. Trial was pruned at iteration 0.
[I 2023-12-21 04:03:58,288] Trial 232 pruned. Trial was pruned at iteration 0.
[I 2023-12-21 04:03:58,332] Trial 233 pruned. Trial was pruned at iteration 0.
[I 2023-12-21 04:03:58,374] Trial 234 pruned. Trial was pruned at iteration 0.
[I 2023-12-21 04:03:58,417] Trial 235 pruned. Trial was pruned at iteration 0.
[I 2023-12-21 04:03:58,459] Trial 236 pruned. Trial was pruned at iteration 0.
[I 2023-12-21 04:03:58,502] Trial 237 pruned. Trial was pruned at iteration 0.
[I 2023-12-21 04:03:58,547] Trial 238 pruned. Trial was pruned at iteration 1.
[I 2023-12-21 04:03:58,589] Trial 239 pruned. Trial was pruned at iteration 0.
[I 2023-12-21 04:03:58,631] Trial 240 pruned. Trial was pruned at iteration 0.
[I 2023-12-21 04:03:58,675] Trial 241 pruned. Trial was pruned at iteration 0.
[I 2023-12-21 04:03:58,719] Trial 242 pruned. Trial was pruned at iteration 0.
[I 2023-12-21 04:03:58,763] Trial 243 pruned. Trial was pruned at iteration 1.
[I 2023-12-21 04:03:58,805] Trial 244 pruned. Trial was pruned at iteration 0.
[I 2023-12-21 04:03:58,925] Trial 245 finished with value: inf and parameters: {'learning_rate': 0.6284821503358999, 'aft_loss_distributi                                                                     on': 'normal', 'aft_loss_distribution_scale': 1.399732310496817, 'max_depth': 6, 'booster': 'gbtree', 'scale_pos_weight': 4.6678415337575                                                                     87, 'alpha': 0.2041945560999467, 'lambda': 0.35335060157312365, 'eta': 0.8121614706397249, 'sampling_method': 'uniform', 'subsample': 0.6                                                                     289696885298552, 'gamma': 8.6685800952804}. Best is trial 127 with value: 4.29954991379438.
[I 2023-12-21 04:03:58,968] Trial 246 pruned. Trial was pruned at iteration 0.
[I 2023-12-21 04:03:59,010] Trial 247 pruned. Trial was pruned at iteration 0.
[I 2023-12-21 04:03:59,055] Trial 248 pruned. Trial was pruned at iteration 0.
[I 2023-12-21 04:03:59,098] Trial 249 pruned. Trial was pruned at iteration 0.
[I 2023-12-21 04:03:59,141] Trial 250 pruned. Trial was pruned at iteration 0.
[I 2023-12-21 04:03:59,185] Trial 251 pruned. Trial was pruned at iteration 0.
[I 2023-12-21 04:03:59,228] Trial 252 pruned. Trial was pruned at iteration 0.
[I 2023-12-21 04:03:59,272] Trial 253 pruned. Trial was pruned at iteration 0.
[I 2023-12-21 04:03:59,317] Trial 254 pruned. Trial was pruned at iteration 0.
[I 2023-12-21 04:03:59,362] Trial 255 pruned. Trial was pruned at iteration 0.
[I 2023-12-21 04:03:59,406] Trial 256 pruned. Trial was pruned at iteration 1.
[I 2023-12-21 04:03:59,450] Trial 257 pruned. Trial was pruned at iteration 0.
[I 2023-12-21 04:03:59,493] Trial 258 pruned. Trial was pruned at iteration 0.
[I 2023-12-21 04:03:59,619] Trial 259 finished with value: inf and parameters: {'learning_rate': 0.86653489589981, 'aft_loss_distribution                                                                     ': 'normal', 'aft_loss_distribution_scale': 1.363944232114851, 'max_depth': 4, 'booster': 'gbtree', 'scale_pos_weight': 7.107432997972302                                                                     , 'alpha': 3.092311694936764, 'lambda': 0.6253891045000033, 'eta': 0.689325274829837, 'sampling_method': 'gradient_based', 'subsample': 0                                                                     .7099306453181056, 'gamma': 1.0992220824051826}. Best is trial 127 with value: 4.29954991379438.
[I 2023-12-21 04:03:59,663] Trial 260 pruned. Trial was pruned at iteration 0.
[I 2023-12-21 04:03:59,707] Trial 261 pruned. Trial was pruned at iteration 0.
[I 2023-12-21 04:03:59,752] Trial 262 pruned. Trial was pruned at iteration 0.
[I 2023-12-21 04:03:59,796] Trial 263 pruned. Trial was pruned at iteration 0.
[I 2023-12-21 04:03:59,840] Trial 264 pruned. Trial was pruned at iteration 0.
[I 2023-12-21 04:03:59,883] Trial 265 pruned. Trial was pruned at iteration 0.
[I 2023-12-21 04:03:59,928] Trial 266 pruned. Trial was pruned at iteration 0.
[I 2023-12-21 04:03:59,972] Trial 267 pruned. Trial was pruned at iteration 0.
[I 2023-12-21 04:04:00,017] Trial 268 pruned. Trial was pruned at iteration 0.
[I 2023-12-21 04:04:00,061] Trial 269 pruned. Trial was pruned at iteration 0.
[I 2023-12-21 04:04:00,106] Trial 270 pruned. Trial was pruned at iteration 1.
[I 2023-12-21 04:04:00,246] Trial 271 finished with value: inf and parameters: {'learning_rate': 0.6532164754001137, 'aft_loss_distributi                                                                     on': 'normal', 'aft_loss_distribution_scale': 1.3566480752099643, 'max_depth': 3, 'booster': 'gbtree', 'scale_pos_weight': 7.412138819343                                                                     936, 'alpha': 1.8269844112057798, 'lambda': 0.3313997451354524, 'eta': 0.7976844555846497, 'sampling_method': 'gradient_based', 'subsampl                                                                     e': 0.45733509009560935, 'gamma': 1.4882200569321502}. Best is trial 127 with value: 4.29954991379438.
[I 2023-12-21 04:04:00,292] Trial 272 pruned. Trial was pruned at iteration 0.
[I 2023-12-21 04:04:00,337] Trial 273 pruned. Trial was pruned at iteration 0.
[I 2023-12-21 04:04:00,382] Trial 274 pruned. Trial was pruned at iteration 1.
[I 2023-12-21 04:04:00,428] Trial 275 pruned. Trial was pruned at iteration 0.
[I 2023-12-21 04:04:00,473] Trial 276 pruned. Trial was pruned at iteration 0.
[I 2023-12-21 04:04:00,518] Trial 277 pruned. Trial was pruned at iteration 0.
[I 2023-12-21 04:04:00,562] Trial 278 pruned. Trial was pruned at iteration 0.
[I 2023-12-21 04:04:00,606] Trial 279 pruned. Trial was pruned at iteration 0.
[I 2023-12-21 04:04:00,653] Trial 280 pruned. Trial was pruned at iteration 1.
[I 2023-12-21 04:04:00,699] Trial 281 pruned. Trial was pruned at iteration 0.
[I 2023-12-21 04:04:00,747] Trial 282 pruned. Trial was pruned at iteration 1.
[I 2023-12-21 04:04:00,792] Trial 283 pruned. Trial was pruned at iteration 0.
[I 2023-12-21 04:04:00,837] Trial 284 pruned. Trial was pruned at iteration 0.
[I 2023-12-21 04:04:00,883] Trial 285 pruned. Trial was pruned at iteration 1.
[I 2023-12-21 04:04:00,928] Trial 286 pruned. Trial was pruned at iteration 0.
[I 2023-12-21 04:04:01,043] Trial 287 finished with value: inf and parameters: {'learning_rate': 0.9153516898458705, 'aft_loss_distributi                                                                     on': 'normal', 'aft_loss_distribution_scale': 1.1972841220598707, 'max_depth': 6, 'booster': 'gbtree', 'scale_pos_weight': 7.091994710673                                                                     02, 'alpha': 9.987847057465524, 'lambda': 0.899545616875753, 'eta': 0.05202358580399463, 'sampling_method': 'uniform', 'subsample': 0.515                                                                     3032693262954, 'gamma': 4.221921030476162}. Best is trial 127 with value: 4.29954991379438.
[I 2023-12-21 04:04:02,083] Trial 288 finished with value: inf and parameters: {'learning_rate': 0.8219321608338739, 'aft_loss_distributi                                                                     on': 'normal', 'aft_loss_distribution_scale': 0.9613278847774247, 'max_depth': 3, 'booster': 'dart', 'scale_pos_weight': 6.34273552068066                                                                     2, 'alpha': 0.004875151299221319, 'lambda': 4.236458869423134, 'eta': 0.38654044715699076, 'sampling_method': 'gradient_based', 'subsampl                                                                     e': 0.5767647083558833, 'gamma': 4.549708090558654}. Best is trial 127 with value: 4.29954991379438.
[I 2023-12-21 04:04:02,138] Trial 289 pruned. Trial was pruned at iteration 0.
[I 2023-12-21 04:04:02,190] Trial 290 pruned. Trial was pruned at iteration 3.
[I 2023-12-21 04:04:02,237] Trial 291 pruned. Trial was pruned at iteration 1.
[I 2023-12-21 04:04:02,281] Trial 292 pruned. Trial was pruned at iteration 0.
[I 2023-12-21 04:04:02,329] Trial 293 pruned. Trial was pruned at iteration 0.
[I 2023-12-21 04:04:02,374] Trial 294 pruned. Trial was pruned at iteration 0.
[I 2023-12-21 04:04:02,493] Trial 295 finished with value: inf and parameters: {'learning_rate': 0.716639569259928, 'aft_loss_distributio                                                                     n': 'normal', 'aft_loss_distribution_scale': 1.205373671943409, 'max_depth': 3, 'booster': 'gbtree', 'scale_pos_weight': 6.13114262567443                                                                     , 'alpha': 4.094162517244309, 'lambda': 1.9436976319275518, 'eta': 0.45422294590347656, 'sampling_method': 'gradient_based', 'subsample':                                                                      0.7245347925453801, 'gamma': 4.333291476383178}. Best is trial 127 with value: 4.29954991379438.
[I 2023-12-21 04:04:02,545] Trial 296 pruned. Trial was pruned at iteration 0.
[I 2023-12-21 04:04:02,592] Trial 297 pruned. Trial was pruned at iteration 0.
[I 2023-12-21 04:04:02,638] Trial 298 pruned. Trial was pruned at iteration 0.
[I 2023-12-21 04:04:02,683] Trial 299 pruned. Trial was pruned at iteration 0.
[I 2023-12-21 04:04:02,728] Trial 300 pruned. Trial was pruned at iteration 0.
[I 2023-12-21 04:04:02,774] Trial 301 pruned. Trial was pruned at iteration 0.
[I 2023-12-21 04:04:02,821] Trial 302 pruned. Trial was pruned at iteration 1.
[I 2023-12-21 04:04:02,869] Trial 303 pruned. Trial was pruned at iteration 0.
[I 2023-12-21 04:04:02,917] Trial 304 pruned. Trial was pruned at iteration 0.
[I 2023-12-21 04:04:02,962] Trial 305 pruned. Trial was pruned at iteration 0.
[I 2023-12-21 04:04:03,009] Trial 306 pruned. Trial was pruned at iteration 1.
[I 2023-12-21 04:04:03,055] Trial 307 pruned. Trial was pruned at iteration 0.
[I 2023-12-21 04:04:03,100] Trial 308 pruned. Trial was pruned at iteration 0.
[I 2023-12-21 04:04:03,148] Trial 309 pruned. Trial was pruned at iteration 0.
[I 2023-12-21 04:04:03,195] Trial 310 pruned. Trial was pruned at iteration 1.
[I 2023-12-21 04:04:03,243] Trial 311 pruned. Trial was pruned at iteration 0.
[I 2023-12-21 04:04:03,290] Trial 312 pruned. Trial was pruned at iteration 0.
[I 2023-12-21 04:04:03,339] Trial 313 pruned. Trial was pruned at iteration 0.
[I 2023-12-21 04:04:03,387] Trial 314 pruned. Trial was pruned at iteration 1.
[I 2023-12-21 04:04:03,433] Trial 315 pruned. Trial was pruned at iteration 0.
[I 2023-12-21 04:04:03,481] Trial 316 pruned. Trial was pruned at iteration 0.
[I 2023-12-21 04:04:03,678] Trial 317 finished with value: inf and parameters: {'learning_rate': 0.6862458902516091, 'aft_loss_distributi                                                                     on': 'normal', 'aft_loss_distribution_scale': 1.38567890449439, 'max_depth': 10, 'booster': 'gbtree', 'scale_pos_weight': 7.6593440380723                                                                     77, 'alpha': 5.328672690396821, 'lambda': 8.919387591007425, 'eta': 0.9516870929800604, 'sampling_method': 'uniform', 'subsample': 0.4760                                                                     093385971774, 'gamma': 0.9714537106158727}. Best is trial 127 with value: 4.29954991379438.
[I 2023-12-21 04:04:03,726] Trial 318 pruned. Trial was pruned at iteration 0.
[I 2023-12-21 04:04:03,773] Trial 319 pruned. Trial was pruned at iteration 0.
[I 2023-12-21 04:04:03,820] Trial 320 pruned. Trial was pruned at iteration 0.
[I 2023-12-21 04:04:03,866] Trial 321 pruned. Trial was pruned at iteration 0.
[I 2023-12-21 04:04:03,913] Trial 322 pruned. Trial was pruned at iteration 0.
[I 2023-12-21 04:04:03,961] Trial 323 pruned. Trial was pruned at iteration 0.
[I 2023-12-21 04:04:04,010] Trial 324 pruned. Trial was pruned at iteration 0.
[I 2023-12-21 04:04:04,056] Trial 325 pruned. Trial was pruned at iteration 0.
[I 2023-12-21 04:04:04,104] Trial 326 pruned. Trial was pruned at iteration 1.
[I 2023-12-21 04:04:04,151] Trial 327 pruned. Trial was pruned at iteration 0.
[I 2023-12-21 04:04:04,197] Trial 328 pruned. Trial was pruned at iteration 0.
[I 2023-12-21 04:04:04,246] Trial 329 pruned. Trial was pruned at iteration 0.
[I 2023-12-21 04:04:04,293] Trial 330 pruned. Trial was pruned at iteration 0.
[I 2023-12-21 04:04:04,342] Trial 331 pruned. Trial was pruned at iteration 0.
[I 2023-12-21 04:04:04,391] Trial 332 pruned. Trial was pruned at iteration 0.
[I 2023-12-21 04:04:04,438] Trial 333 pruned. Trial was pruned at iteration 0.
[I 2023-12-21 04:04:04,485] Trial 334 pruned. Trial was pruned at iteration 0.
[I 2023-12-21 04:04:04,532] Trial 335 pruned. Trial was pruned at iteration 0.
[I 2023-12-21 04:04:04,589] Trial 336 pruned. Trial was pruned at iteration 3.
[I 2023-12-21 04:04:04,636] Trial 337 pruned. Trial was pruned at iteration 0.
[I 2023-12-21 04:04:04,683] Trial 338 pruned. Trial was pruned at iteration 0.
[I 2023-12-21 04:04:04,734] Trial 339 pruned. Trial was pruned at iteration 1.
[I 2023-12-21 04:04:04,781] Trial 340 pruned. Trial was pruned at iteration 0.
[I 2023-12-21 04:04:04,828] Trial 341 pruned. Trial was pruned at iteration 0.
[I 2023-12-21 04:04:04,877] Trial 342 pruned. Trial was pruned at iteration 0.
[I 2023-12-21 04:04:04,928] Trial 343 pruned. Trial was pruned at iteration 1.
[I 2023-12-21 04:04:04,975] Trial 344 pruned. Trial was pruned at iteration 0.
[I 2023-12-21 04:04:05,024] Trial 345 pruned. Trial was pruned at iteration 0.
[I 2023-12-21 04:04:05,071] Trial 346 pruned. Trial was pruned at iteration 0.
[I 2023-12-21 04:04:05,120] Trial 347 pruned. Trial was pruned at iteration 0.
[I 2023-12-21 04:04:05,168] Trial 348 pruned. Trial was pruned at iteration 0.
[I 2023-12-21 04:04:05,218] Trial 349 pruned. Trial was pruned at iteration 0.
[I 2023-12-21 04:04:05,272] Trial 350 pruned. Trial was pruned at iteration 2.
[I 2023-12-21 04:04:05,323] Trial 351 pruned. Trial was pruned at iteration 1.
[I 2023-12-21 04:04:05,371] Trial 352 pruned. Trial was pruned at iteration 0.
[I 2023-12-21 04:04:05,419] Trial 353 pruned. Trial was pruned at iteration 0.
[I 2023-12-21 04:04:05,468] Trial 354 pruned. Trial was pruned at iteration 0.
[I 2023-12-21 04:04:05,517] Trial 355 pruned. Trial was pruned at iteration 0.
[I 2023-12-21 04:04:05,566] Trial 356 pruned. Trial was pruned at iteration 0.
