[I 2023-12-21 03:55:30,974] Trial 22 pruned. Trial was pruned at iteration 0.
[I 2023-12-21 03:55:31,005] Trial 23 pruned. Trial was pruned at iteration 0.
[I 2023-12-21 03:55:31,037] Trial 24 pruned. Trial was pruned at iteration 0.
[I 2023-12-21 03:55:34,038] Trial 25 finished with value: 4.925353157864734 and parameters: {'learning_rate': 0.2555133547881951, 'aft_lo                                                                     ss_distribution': 'logistic', 'aft_loss_distribution_scale': 2.0444294398228027, 'max_depth': 4, 'booster': 'dart', 'scale_pos_weight': 8                                                                     .438212748376708, 'alpha': 3.2088060553926048, 'lambda': 7.351107823363832, 'eta': 0.36384216662464686, 'sampling_method': 'uniform', 'su                                                                     bsample': 0.4867872627256833, 'gamma': 2.582709599458298}. Best is trial 19 with value: 4.646068909560992.
[I 2023-12-21 03:55:38,680] Trial 26 finished with value: 4.600350219149236 and parameters: {'learning_rate': 0.374360285348055, 'aft_los                                                                     s_distribution': 'logistic', 'aft_loss_distribution_scale': 1.3593961899467573, 'max_depth': 5, 'booster': 'dart', 'scale_pos_weight': 8.                                                                     885388506858598, 'alpha': 4.809009284454423, 'lambda': 7.380921020391593, 'eta': 0.8486289591151228, 'sampling_method': 'gradient_based',                                                                      'subsample': 0.5100000422932981, 'gamma': 2.3094993343180934}. Best is trial 26 with value: 4.600350219149236.
[I 2023-12-21 03:55:40,916] Trial 27 finished with value: 4.480949482089979 and parameters: {'learning_rate': 0.368218694524171, 'aft_los                                                                     s_distribution': 'logistic', 'aft_loss_distribution_scale': 1.1443219749488354, 'max_depth': 7, 'booster': 'dart', 'scale_pos_weight': 8.                                                                     824375540705509, 'alpha': 4.941268985191854, 'lambda': 9.762358478574194, 'eta': 0.8277147225795106, 'sampling_method': 'gradient_based',                                                                      'subsample': 0.7105175069547154, 'gamma': 0.9683888836231462}. Best is trial 27 with value: 4.480949482089979.
[I 2023-12-21 03:55:40,947] Trial 28 pruned. Trial was pruned at iteration 0.
[I 2023-12-21 03:55:40,978] Trial 29 pruned. Trial was pruned at iteration 0.
[I 2023-12-21 03:55:41,010] Trial 30 pruned. Trial was pruned at iteration 0.
[I 2023-12-21 03:55:43,096] Trial 31 finished with value: 4.592809249613296 and parameters: {'learning_rate': 0.3686833536606672, 'aft_lo                                                                     ss_distribution': 'logistic', 'aft_loss_distribution_scale': 1.3441974595151658, 'max_depth': 6, 'booster': 'dart', 'scale_pos_weight': 8                                                                     .858401404078021, 'alpha': 6.857821434181943, 'lambda': 7.435521921195297, 'eta': 0.8029296001270715, 'sampling_method': 'gradient_based'                                                                     , 'subsample': 0.5955000964076237, 'gamma': 1.3652707163297624}. Best is trial 27 with value: 4.480949482089979.
[I 2023-12-21 03:55:43,128] Trial 32 pruned. Trial was pruned at iteration 0.
[I 2023-12-21 03:55:43,159] Trial 33 pruned. Trial was pruned at iteration 0.
[I 2023-12-21 03:55:43,191] Trial 34 pruned. Trial was pruned at iteration 0.
[I 2023-12-21 03:55:43,228] Trial 35 pruned. Trial was pruned at iteration 0.
[I 2023-12-21 03:55:52,246] Trial 36 finished with value: 4.980534834822566 and parameters: {'learning_rate': 0.26894364486664635, 'aft_l                                                                     oss_distribution': 'logistic', 'aft_loss_distribution_scale': 2.1823428879266666, 'max_depth': 6, 'booster': 'dart', 'scale_pos_weight':                                                                      8.627843964923366, 'alpha': 5.277211963177822, 'lambda': 8.303046867982186, 'eta': 0.713018680341925, 'sampling_method': 'gradient_based'                                                                     , 'subsample': 0.9334219874463479, 'gamma': 3.4772173301003955}. Best is trial 27 with value: 4.480949482089979.
[I 2023-12-21 03:55:53,408] Trial 37 finished with value: inf and parameters: {'learning_rate': 0.5318430996937862, 'aft_loss_distributio                                                                     n': 'logistic', 'aft_loss_distribution_scale': 1.453679014673798, 'max_depth': 5, 'booster': 'dart', 'scale_pos_weight': 6.79519877699411                                                                     4, 'alpha': 4.7606734291406285, 'lambda': 6.919479597327427, 'eta': 0.8069647960229426, 'sampling_method': 'gradient_based', 'subsample':                                                                      0.8181461658292724, 'gamma': 5.648828764346388}. Best is trial 27 with value: 4.480949482089979.
[I 2023-12-21 03:55:53,441] Trial 38 pruned. Trial was pruned at iteration 0.
[I 2023-12-21 03:55:53,472] Trial 39 pruned. Trial was pruned at iteration 0.
[I 2023-12-21 03:55:53,503] Trial 40 pruned. Trial was pruned at iteration 0.
[I 2023-12-21 03:56:04,572] Trial 41 finished with value: 4.65424132695449 and parameters: {'learning_rate': 0.14537043639546374, 'aft_lo                                                                     ss_distribution': 'logistic', 'aft_loss_distribution_scale': 1.4600454424763767, 'max_depth': 5, 'booster': 'dart', 'scale_pos_weight': 8                                                                     .78332903459544, 'alpha': 5.881896961468448, 'lambda': 5.419652170767634, 'eta': 0.7525826693595112, 'sampling_method': 'gradient_based',                                                                      'subsample': 0.5270827026606046, 'gamma': 1.952530632799375}. Best is trial 27 with value: 4.480949482089979.
[I 2023-12-21 03:56:15,618] Trial 42 finished with value: 4.409979540335492 and parameters: {'learning_rate': 0.23019738274208745, 'aft_l                                                                     oss_distribution': 'logistic', 'aft_loss_distribution_scale': 1.0023564987614404, 'max_depth': 6, 'booster': 'dart', 'scale_pos_weight':                                                                      8.87479584470583, 'alpha': 6.210308941041472, 'lambda': 5.219706473414203, 'eta': 0.7081743509308323, 'sampling_method': 'gradient_based'                                                                     , 'subsample': 0.5549172269256519, 'gamma': 9.999260537422291}. Best is trial 42 with value: 4.409979540335492.
[I 2023-12-21 03:56:15,659] Trial 43 pruned. Trial was pruned at iteration 0.
[I 2023-12-21 03:56:17,160] Trial 44 finished with value: inf and parameters: {'learning_rate': 0.363955150496326, 'aft_loss_distribution                                                                     ': 'logistic', 'aft_loss_distribution_scale': 1.1617342934366754, 'max_depth': 6, 'booster': 'dart', 'scale_pos_weight': 7.08108059609639                                                                     5, 'alpha': 6.362357029031293, 'lambda': 3.5715861693725808, 'eta': 0.8086519488646321, 'sampling_method': 'gradient_based', 'subsample':                                                                      0.6428790851465548, 'gamma': 8.109295083884204}. Best is trial 42 with value: 4.409979540335492.
[I 2023-12-21 03:56:17,192] Trial 45 pruned. Trial was pruned at iteration 0.
[I 2023-12-21 03:56:17,222] Trial 46 pruned. Trial was pruned at iteration 0.
[I 2023-12-21 03:56:17,254] Trial 47 pruned. Trial was pruned at iteration 0.
[I 2023-12-21 03:56:17,288] Trial 48 pruned. Trial was pruned at iteration 0.
[I 2023-12-21 03:56:17,322] Trial 49 pruned. Trial was pruned at iteration 1.
[I 2023-12-21 03:56:17,355] Trial 50 pruned. Trial was pruned at iteration 0.
[I 2023-12-21 03:56:40,755] Trial 51 finished with value: 4.562350565852964 and parameters: {'learning_rate': 0.14453031631517702, 'aft_l                                                                     oss_distribution': 'logistic', 'aft_loss_distribution_scale': 1.2892828823136961, 'max_depth': 5, 'booster': 'dart', 'scale_pos_weight':                                                                      8.869053977422247, 'alpha': 5.905531393935757, 'lambda': 5.394768909678985, 'eta': 0.7220151162393278, 'sampling_method': 'gradient_based                                                                     ', 'subsample': 0.5307333751124264, 'gamma': 1.6149334381458216}. Best is trial 42 with value: 4.409979540335492.
[I 2023-12-21 03:56:40,789] Trial 52 pruned. Trial was pruned at iteration 0.
[I 2023-12-21 03:56:40,821] Trial 53 pruned. Trial was pruned at iteration 0.
[I 2023-12-21 03:56:45,775] Trial 54 finished with value: 4.266222240643674 and parameters: {'learning_rate': 0.12673186751717383, 'aft_l                                                                     oss_distribution': 'logistic', 'aft_loss_distribution_scale': 0.7091700199084449, 'max_depth': 5, 'booster': 'dart', 'scale_pos_weight':                                                                      9.424388562591814, 'alpha': 4.910383691216344, 'lambda': 4.647719324669374, 'eta': 0.5462397053885385, 'sampling_method': 'gradient_based                                                                     ', 'subsample': 0.5333462742504536, 'gamma': 0.34932196614637534}. Best is trial 54 with value: 4.266222240643674.
[I 2023-12-21 03:56:55,325] Trial 55 finished with value: 4.2560348834253015 and parameters: {'learning_rate': 0.07291454971008131, 'aft_                                                                     loss_distribution': 'logistic', 'aft_loss_distribution_scale': 0.6980479620769772, 'max_depth': 5, 'booster': 'dart', 'scale_pos_weight':                                                                      9.492160222338123, 'alpha': 4.963110072507325, 'lambda': 5.0379070533865224, 'eta': 0.4518118954494001, 'sampling_method': 'gradient_bas                                                                     ed', 'subsample': 0.5215459085927275, 'gamma': 0.14967635112340072}. Best is trial 55 with value: 4.2560348834253015.
[I 2023-12-21 03:56:55,362] Trial 56 pruned. Trial was pruned at iteration 0.
[I 2023-12-21 03:56:58,090] Trial 57 finished with value: 4.316054755920273 and parameters: {'learning_rate': 0.1896095298596186, 'aft_lo                                                                     ss_distribution': 'logistic', 'aft_loss_distribution_scale': 0.8286667260941678, 'max_depth': 5, 'booster': 'dart', 'scale_pos_weight': 1                                                                     .5732548593159335, 'alpha': 4.137406597304146, 'lambda': 3.77255694571228, 'eta': 0.4818516284268976, 'sampling_method': 'gradient_based'                                                                     , 'subsample': 0.5285382747418506, 'gamma': 0.0779227792126439}. Best is trial 55 with value: 4.2560348834253015.
[I 2023-12-21 03:56:58,126] Trial 58 pruned. Trial was pruned at iteration 0.
[I 2023-12-21 03:57:02,443] Trial 59 finished with value: 4.34260229047022 and parameters: {'learning_rate': 0.11608175966899016, 'aft_lo                                                                     ss_distribution': 'logistic', 'aft_loss_distribution_scale': 0.8815564115557263, 'max_depth': 5, 'booster': 'dart', 'scale_pos_weight': 0                                                                     .7370401038035245, 'alpha': 3.9226790685488746, 'lambda': 2.200786162584448, 'eta': 0.46831463730690603, 'sampling_method': 'gradient_bas                                                                     ed', 'subsample': 0.5282657238231296, 'gamma': 0.7668719203669236}. Best is trial 55 with value: 4.2560348834253015.
[I 2023-12-21 03:57:06,559] Trial 60 finished with value: 4.28816577471686 and parameters: {'learning_rate': 0.1080466147992609, 'aft_los                                                                     s_distribution': 'logistic', 'aft_loss_distribution_scale': 0.7662272192024271, 'max_depth': 5, 'booster': 'dart', 'scale_pos_weight': 0.                                                                     5337898296625827, 'alpha': 2.9380306595523047, 'lambda': 1.6792406381008114, 'eta': 0.47977185253545734, 'sampling_method': 'gradient_bas                                                                     ed', 'subsample': 0.453983145524829, 'gamma': 0.5583981447240064}. Best is trial 55 with value: 4.2560348834253015.
[I 2023-12-21 03:57:06,594] Trial 61 pruned. Trial was pruned at iteration 0.
[I 2023-12-21 03:57:14,446] Trial 62 finished with value: 4.311096837379451 and parameters: {'learning_rate': 0.09717428433398062, 'aft_l                                                                     oss_distribution': 'logistic', 'aft_loss_distribution_scale': 0.8324699599806914, 'max_depth': 4, 'booster': 'dart', 'scale_pos_weight':                                                                      1.1675538587867238, 'alpha': 3.9901151029590767, 'lambda': 0.7775507370513798, 'eta': 0.4088094697514917, 'sampling_method': 'gradient_ba                                                                     sed', 'subsample': 0.47577303853566966, 'gamma': 0.4302186398817302}. Best is trial 55 with value: 4.2560348834253015.
[I 2023-12-21 03:57:14,482] Trial 63 pruned. Trial was pruned at iteration 0.
[I 2023-12-21 03:57:32,233] Trial 64 finished with value: 4.299321922370381 and parameters: {'learning_rate': 0.11077506920906555, 'aft_l                                                                     oss_distribution': 'logistic', 'aft_loss_distribution_scale': 0.7999447637437218, 'max_depth': 3, 'booster': 'dart', 'scale_pos_weight':                                                                      1.7411084522018703, 'alpha': 2.9926846690396562, 'lambda': 1.0345178761056608, 'eta': 0.33621296819541957, 'sampling_method': 'gradient_b                                                                     ased', 'subsample': 0.39737937197414996, 'gamma': 0.4491009908011749}. Best is trial 55 with value: 4.2560348834253015.
[I 2023-12-21 03:57:32,267] Trial 65 pruned. Trial was pruned at iteration 0.
[I 2023-12-21 03:57:32,302] Trial 66 pruned. Trial was pruned at iteration 0.
[I 2023-12-21 03:57:32,518] Trial 67 finished with value: 4.335552228087063 and parameters: {'learning_rate': 0.17850533057492057, 'aft_l                                                                     oss_distribution': 'logistic', 'aft_loss_distribution_scale': 0.8176414185844151, 'max_depth': 4, 'booster': 'gbtree', 'scale_pos_weight'                                                                     : 0.946177208910809, 'alpha': 3.4487169103870547, 'lambda': 0.16570800003347486, 'eta': 0.47142897502473746, 'sampling_method': 'gradient                                                                     _based', 'subsample': 0.35604395511196985, 'gamma': 0.9829336470885225}. Best is trial 55 with value: 4.2560348834253015.
[I 2023-12-21 03:57:32,551] Trial 68 pruned. Trial was pruned at iteration 0.
[I 2023-12-21 03:57:32,584] Trial 69 pruned. Trial was pruned at iteration 0.
[I 2023-12-21 03:57:32,966] Trial 70 finished with value: 4.247937146318312 and parameters: {'learning_rate': 0.07045461041361054, 'aft_l                                                                     oss_distribution': 'logistic', 'aft_loss_distribution_scale': 0.6465587523407066, 'max_depth': 3, 'booster': 'gbtree', 'scale_pos_weight'                                                                     : 0.44289503826957344, 'alpha': 1.9148449446194022, 'lambda': 1.4962812415534463, 'eta': 0.2153153598699452, 'sampling_method': 'gradient                                                                     _based', 'subsample': 0.30526692835270797, 'gamma': 0.3204648905054402}. Best is trial 70 with value: 4.247937146318312.
[I 2023-12-21 03:57:33,179] Trial 71 finished with value: 4.275130887337278 and parameters: {'learning_rate': 0.0826931643692665, 'aft_lo                                                                     ss_distribution': 'logistic', 'aft_loss_distribution_scale': 0.749319967022141, 'max_depth': 3, 'booster': 'gbtree', 'scale_pos_weight':                                                                      0.4770038702806717, 'alpha': 2.0968555107834668, 'lambda': 1.3982146427026185, 'eta': 0.17438285461233066, 'sampling_method': 'gradient_b                                                                     ased', 'subsample': 0.16907392728704537, 'gamma': 0.027643358587024644}. Best is trial 70 with value: 4.247937146318312.
[I 2023-12-21 03:57:33,213] Trial 72 pruned. Trial was pruned at iteration 0.
[I 2023-12-21 03:57:33,246] Trial 73 pruned. Trial was pruned at iteration 0.
[I 2023-12-21 03:57:33,278] Trial 74 pruned. Trial was pruned at iteration 0.
[I 2023-12-21 03:57:33,315] Trial 75 pruned. Trial was pruned at iteration 0.
[I 2023-12-21 03:57:33,469] Trial 76 finished with value: 4.39462342434261 and parameters: {'learning_rate': 0.20793823877108847, 'aft_lo                                                                     ss_distribution': 'logistic', 'aft_loss_distribution_scale': 0.9857247865968144, 'max_depth': 3, 'booster': 'gbtree', 'scale_pos_weight':                                                                      1.850242018339777, 'alpha': 3.0494685411466413, 'lambda': 2.845955332767161, 'eta': 0.2437519525731895, 'sampling_method': 'gradient_bas                                                                     ed', 'subsample': 0.28321159460442297, 'gamma': 0.00026172196905431544}. Best is trial 70 with value: 4.247937146318312.
[I 2023-12-21 03:57:33,502] Trial 77 pruned. Trial was pruned at iteration 0.
[I 2023-12-21 03:57:33,534] Trial 78 pruned. Trial was pruned at iteration 0.
[I 2023-12-21 03:57:33,568] Trial 79 pruned. Trial was pruned at iteration 0.
[I 2023-12-21 03:57:33,602] Trial 80 pruned. Trial was pruned at iteration 0.
[I 2023-12-21 03:57:33,636] Trial 81 pruned. Trial was pruned at iteration 0.
[I 2023-12-21 03:57:33,679] Trial 82 pruned. Trial was pruned at iteration 0.
[I 2023-12-21 03:57:33,712] Trial 83 pruned. Trial was pruned at iteration 0.
[I 2023-12-21 03:57:33,746] Trial 84 pruned. Trial was pruned at iteration 0.
[I 2023-12-21 03:57:33,953] Trial 85 finished with value: 4.311763063569827 and parameters: {'learning_rate': 0.09471645174537885, 'aft_l                                                                     oss_distribution': 'logistic', 'aft_loss_distribution_scale': 0.8165366374053672, 'max_depth': 4, 'booster': 'gbtree', 'scale_pos_weight'                                                                     : 1.3248689624538075, 'alpha': 2.5734677050780266, 'lambda': 1.6166062018706269, 'eta': 0.3656070368125416, 'sampling_method': 'gradient_                                                                     based', 'subsample': 0.19709283881914524, 'gamma': 0.9210732201961098}. Best is trial 70 with value: 4.247937146318312.
[I 2023-12-21 03:57:33,986] Trial 86 pruned. Trial was pruned at iteration 0.
[I 2023-12-21 03:57:34,020] Trial 87 pruned. Trial was pruned at iteration 0.
[I 2023-12-21 03:57:34,053] Trial 88 pruned. Trial was pruned at iteration 0.
[I 2023-12-21 03:57:34,087] Trial 89 pruned. Trial was pruned at iteration 0.
[I 2023-12-21 03:57:34,120] Trial 90 pruned. Trial was pruned at iteration 0.
[I 2023-12-21 03:57:34,308] Trial 91 finished with value: 4.329520352395919 and parameters: {'learning_rate': 0.17850451386950333, 'aft_l                                                                     oss_distribution': 'logistic', 'aft_loss_distribution_scale': 0.8614469644601217, 'max_depth': 4, 'booster': 'gbtree', 'scale_pos_weight'                                                                     : 1.180166819185306, 'alpha': 3.6246513603475776, 'lambda': 0.5304514733609882, 'eta': 0.5774255244526758, 'sampling_method': 'gradient_b                                                                     ased', 'subsample': 0.4431913881758184, 'gamma': 1.0514181743516362}. Best is trial 70 with value: 4.247937146318312.
[I 2023-12-21 03:57:34,342] Trial 92 pruned. Trial was pruned at iteration 0.
[I 2023-12-21 03:57:34,375] Trial 93 pruned. Trial was pruned at iteration 0.
[I 2023-12-21 03:57:34,409] Trial 94 pruned. Trial was pruned at iteration 0.
[I 2023-12-21 03:57:34,442] Trial 95 pruned. Trial was pruned at iteration 0.
[I 2023-12-21 03:57:34,477] Trial 96 pruned. Trial was pruned at iteration 0.
[I 2023-12-21 03:57:34,511] Trial 97 pruned. Trial was pruned at iteration 0.
[I 2023-12-21 03:57:34,544] Trial 98 pruned. Trial was pruned at iteration 0.
[I 2023-12-21 03:57:34,578] Trial 99 pruned. Trial was pruned at iteration 0.
[I 2023-12-21 03:57:35,609] Trial 100 finished with value: inf and parameters: {'learning_rate': 0.756497184589848, 'aft_loss_distributio                                                                     n': 'normal', 'aft_loss_distribution_scale': 1.4524487671812525, 'max_depth': 5, 'booster': 'dart', 'scale_pos_weight': 1.297957821202207                                                                     4, 'alpha': 1.1765504638185762, 'lambda': 0.9038281810510496, 'eta': 0.5533628892114943, 'sampling_method': 'gradient_based', 'subsample'                                                                     : 0.6293672058898612, 'gamma': 1.478725412977759}. Best is trial 70 with value: 4.247937146318312.
