[I 2023-12-21 03:26:16,874] Trial 411 finished with value: 4.274461312754778 and parameters: {'learning_rate': 0.13340887929193299, 'aft_                                                                     loss_distribution': 'logistic', 'aft_loss_distribution_scale': 0.7449230146323839, 'max_depth': 7, 'booster': 'dart', 'scale_pos_weight':                                                                      0.7748285463608031, 'alpha': 7.415185712419249, 'lambda': 8.741253372153155, 'eta': 0.36643376818773943, 'sampling_method': 'gradient_ba                                                                     sed', 'subsample': 0.2140545870599839, 'gamma': 2.1892707063474}. Best is trial 34 with value: 4.15687381580361.
[I 2023-12-21 03:26:16,929] Trial 412 pruned. Trial was pruned at iteration 0.
[I 2023-12-21 03:26:16,981] Trial 413 pruned. Trial was pruned at iteration 0.
[I 2023-12-21 03:26:17,033] Trial 414 pruned. Trial was pruned at iteration 0.
[I 2023-12-21 03:26:19,756] Trial 415 pruned. Trial was pruned at iteration 86.
[I 2023-12-21 03:26:19,810] Trial 416 pruned. Trial was pruned at iteration 0.
[I 2023-12-21 03:26:19,862] Trial 417 pruned. Trial was pruned at iteration 0.
[I 2023-12-21 03:26:19,922] Trial 418 pruned. Trial was pruned at iteration 0.
[I 2023-12-21 03:26:19,974] Trial 419 pruned. Trial was pruned at iteration 0.
[I 2023-12-21 03:26:20,026] Trial 420 pruned. Trial was pruned at iteration 0.
[I 2023-12-21 03:26:20,079] Trial 421 pruned. Trial was pruned at iteration 0.
[I 2023-12-21 03:26:20,132] Trial 422 pruned. Trial was pruned at iteration 0.
[I 2023-12-21 03:26:20,193] Trial 423 pruned. Trial was pruned at iteration 2.
[I 2023-12-21 03:26:20,259] Trial 424 pruned. Trial was pruned at iteration 2.
[I 2023-12-21 03:26:26,318] Trial 425 finished with value: 4.248500600465256 and parameters: {'learning_rate': 0.06831263546979507, 'aft_                                                                     loss_distribution': 'logistic', 'aft_loss_distribution_scale': 0.6880355400185154, 'max_depth': 6, 'booster': 'dart', 'scale_pos_weight':                                                                      0.48490974275024357, 'alpha': 7.965111627551901, 'lambda': 8.509779178881086, 'eta': 0.35780962086835666, 'sampling_method': 'gradient_b                                                                     ased', 'subsample': 0.1167441771806032, 'gamma': 1.3721882756927393}. Best is trial 34 with value: 4.15687381580361.
[I 2023-12-21 03:26:26,374] Trial 426 pruned. Trial was pruned at iteration 0.
[I 2023-12-21 03:26:28,248] Trial 427 finished with value: inf and parameters: {'learning_rate': 0.08615337004480535, 'aft_loss_distribut                                                                     ion': 'logistic', 'aft_loss_distribution_scale': 0.7423451847681177, 'max_depth': 6, 'booster': 'dart', 'scale_pos_weight': 0.47287935596                                                                     01493, 'alpha': 7.478009688892465, 'lambda': 8.554570821703903, 'eta': 0.3599614157405982, 'sampling_method': 'gradient_based', 'subsampl                                                                     e': 0.08936291541148621, 'gamma': 1.375900685318802}. Best is trial 34 with value: 4.15687381580361.
[I 2023-12-21 03:26:28,304] Trial 428 pruned. Trial was pruned at iteration 0.
[I 2023-12-21 03:26:28,357] Trial 429 pruned. Trial was pruned at iteration 0.
[I 2023-12-21 03:26:28,410] Trial 430 pruned. Trial was pruned at iteration 0.
[I 2023-12-21 03:26:28,464] Trial 431 pruned. Trial was pruned at iteration 0.
[I 2023-12-21 03:26:28,517] Trial 432 pruned. Trial was pruned at iteration 0.
[I 2023-12-21 03:26:28,569] Trial 433 pruned. Trial was pruned at iteration 0.
[I 2023-12-21 03:26:28,623] Trial 434 pruned. Trial was pruned at iteration 0.
[I 2023-12-21 03:26:28,675] Trial 435 pruned. Trial was pruned at iteration 0.
[I 2023-12-21 03:26:28,727] Trial 436 pruned. Trial was pruned at iteration 0.
[I 2023-12-21 03:26:28,780] Trial 437 pruned. Trial was pruned at iteration 0.
[I 2023-12-21 03:26:47,808] Trial 438 finished with value: 4.216557445004007 and parameters: {'learning_rate': 0.12669478050765665, 'aft_                                                                     loss_distribution': 'logistic', 'aft_loss_distribution_scale': 0.7266414156204457, 'max_depth': 3, 'booster': 'dart', 'scale_pos_weight':                                                                      1.2297980033737843, 'alpha': 8.225061929850952, 'lambda': 8.13439738359009, 'eta': 0.44229404962125085, 'sampling_method': 'gradient_bas                                                                     ed', 'subsample': 0.23767869696065408, 'gamma': 9.305504537818818}. Best is trial 34 with value: 4.15687381580361.
[I 2023-12-21 03:26:47,865] Trial 439 pruned. Trial was pruned at iteration 0.
[I 2023-12-21 03:26:47,917] Trial 440 pruned. Trial was pruned at iteration 0.
[I 2023-12-21 03:26:47,969] Trial 441 pruned. Trial was pruned at iteration 0.
[I 2023-12-21 03:26:48,022] Trial 442 pruned. Trial was pruned at iteration 0.
[I 2023-12-21 03:26:48,074] Trial 443 pruned. Trial was pruned at iteration 0.
[I 2023-12-21 03:26:48,127] Trial 444 pruned. Trial was pruned at iteration 0.
[I 2023-12-21 03:26:48,182] Trial 445 pruned. Trial was pruned at iteration 0.
[I 2023-12-21 03:26:48,236] Trial 446 pruned. Trial was pruned at iteration 0.
[I 2023-12-21 03:26:48,291] Trial 447 pruned. Trial was pruned at iteration 0.
[I 2023-12-21 03:26:48,344] Trial 448 pruned. Trial was pruned at iteration 0.
[I 2023-12-21 03:26:48,397] Trial 449 pruned. Trial was pruned at iteration 0.
[I 2023-12-21 03:26:48,450] Trial 450 pruned. Trial was pruned at iteration 0.
[I 2023-12-21 03:26:48,506] Trial 451 pruned. Trial was pruned at iteration 0.
[I 2023-12-21 03:27:19,216] Trial 452 pruned. Trial was pruned at iteration 310.
[I 2023-12-21 03:27:19,277] Trial 453 pruned. Trial was pruned at iteration 0.
[I 2023-12-21 03:27:21,626] Trial 454 pruned. Trial was pruned at iteration 79.
[I 2023-12-21 03:27:21,701] Trial 455 pruned. Trial was pruned at iteration 4.
[I 2023-12-21 03:27:21,755] Trial 456 pruned. Trial was pruned at iteration 0.
[I 2023-12-21 03:27:21,808] Trial 457 pruned. Trial was pruned at iteration 0.
[I 2023-12-21 03:27:21,864] Trial 458 pruned. Trial was pruned at iteration 0.
[I 2023-12-21 03:27:21,918] Trial 459 pruned. Trial was pruned at iteration 0.
[I 2023-12-21 03:27:21,972] Trial 460 pruned. Trial was pruned at iteration 0.
[I 2023-12-21 03:27:22,025] Trial 461 pruned. Trial was pruned at iteration 0.
[I 2023-12-21 03:27:22,080] Trial 462 pruned. Trial was pruned at iteration 0.
[I 2023-12-21 03:27:22,133] Trial 463 pruned. Trial was pruned at iteration 0.
[I 2023-12-21 03:27:22,192] Trial 464 pruned. Trial was pruned at iteration 0.
[I 2023-12-21 03:27:22,246] Trial 465 pruned. Trial was pruned at iteration 0.
[I 2023-12-21 03:27:22,303] Trial 466 pruned. Trial was pruned at iteration 0.
[I 2023-12-21 03:27:22,357] Trial 467 pruned. Trial was pruned at iteration 0.
[I 2023-12-21 03:27:22,417] Trial 468 pruned. Trial was pruned at iteration 2.
[I 2023-12-21 03:27:22,473] Trial 469 pruned. Trial was pruned at iteration 0.
[I 2023-12-21 03:27:22,526] Trial 470 pruned. Trial was pruned at iteration 0.
[I 2023-12-21 03:27:22,583] Trial 471 pruned. Trial was pruned at iteration 0.
[I 2023-12-21 03:27:22,637] Trial 472 pruned. Trial was pruned at iteration 0.
[I 2023-12-21 03:27:22,691] Trial 473 pruned. Trial was pruned at iteration 0.
[I 2023-12-21 03:27:33,041] Trial 474 finished with value: 4.206942801170516 and parameters: {'learning_rate': 0.06243642888231721, 'aft_                                                                     loss_distribution': 'logistic', 'aft_loss_distribution_scale': 0.6252857998525422, 'max_depth': 7, 'booster': 'dart', 'scale_pos_weight':                                                                      1.4372394047979045, 'alpha': 4.855655835192477, 'lambda': 5.542447544507374, 'eta': 0.7149548828623843, 'sampling_method': 'gradient_bas                                                                     ed', 'subsample': 0.2778817360809863, 'gamma': 0.4974889391254981}. Best is trial 34 with value: 4.15687381580361.
[I 2023-12-21 03:27:33,100] Trial 475 pruned. Trial was pruned at iteration 0.
[I 2023-12-21 03:27:33,156] Trial 476 pruned. Trial was pruned at iteration 0.
[I 2023-12-21 03:27:33,210] Trial 477 pruned. Trial was pruned at iteration 0.
[I 2023-12-21 03:27:36,265] Trial 478 pruned. Trial was pruned at iteration 91.
[I 2023-12-21 03:27:36,325] Trial 479 pruned. Trial was pruned at iteration 0.
[I 2023-12-21 03:27:36,379] Trial 480 pruned. Trial was pruned at iteration 0.
[I 2023-12-21 03:27:58,910] Trial 481 pruned. Trial was pruned at iteration 265.
[I 2023-12-21 03:27:58,970] Trial 482 pruned. Trial was pruned at iteration 0.
[I 2023-12-21 03:27:59,024] Trial 483 pruned. Trial was pruned at iteration 0.
[I 2023-12-21 03:27:59,082] Trial 484 pruned. Trial was pruned at iteration 0.
[I 2023-12-21 03:27:59,139] Trial 485 pruned. Trial was pruned at iteration 0.
[I 2023-12-21 03:27:59,194] Trial 486 pruned. Trial was pruned at iteration 0.
[I 2023-12-21 03:27:59,252] Trial 487 pruned. Trial was pruned at iteration 0.
[I 2023-12-21 03:27:59,308] Trial 488 pruned. Trial was pruned at iteration 0.
[I 2023-12-21 03:28:01,270] Trial 489 pruned. Trial was pruned at iteration 72.
[I 2023-12-21 03:28:01,330] Trial 490 pruned. Trial was pruned at iteration 0.
[I 2023-12-21 03:28:01,387] Trial 491 pruned. Trial was pruned at iteration 0.
[I 2023-12-21 03:28:01,442] Trial 492 pruned. Trial was pruned at iteration 0.
[I 2023-12-21 03:28:01,498] Trial 493 pruned. Trial was pruned at iteration 0.
[I 2023-12-21 03:31:09,083] Trial 494 finished with value: 4.145831311801056 and parameters: {'learning_rate': 0.036469425000231086, 'aft                                                                     _loss_distribution': 'logistic', 'aft_loss_distribution_scale': 0.5637263011375775, 'max_depth': 3, 'booster': 'dart', 'scale_pos_weight'                                                                     : 2.6881873372707976, 'alpha': 7.904749190378421, 'lambda': 8.484286704819736, 'eta': 0.6635559684957875, 'sampling_method': 'gradient_ba                                                                     sed', 'subsample': 0.16961851947859727, 'gamma': 0.4300586143804765}. Best is trial 494 with value: 4.145831311801056.
[I 2023-12-21 03:31:09,142] Trial 495 pruned. Trial was pruned at iteration 0.
[I 2023-12-21 03:31:09,197] Trial 496 pruned. Trial was pruned at iteration 0.
[I 2023-12-21 03:31:09,260] Trial 497 pruned. Trial was pruned at iteration 0.
[I 2023-12-21 03:31:09,316] Trial 498 pruned. Trial was pruned at iteration 0.
[I 2023-12-21 03:31:09,371] Trial 499 pruned. Trial was pruned at iteration 0.
[W 2023-12-21 03:34:15,430] Trial 1 is omitted in visualization because its objective value is inf or nan.
[W 2023-12-21 03:34:15,430] Trial 18 is omitted in visualization because its objective value is inf or nan.
[W 2023-12-21 03:34:15,431] Trial 19 is omitted in visualization because its objective value is inf or nan.
[W 2023-12-21 03:34:15,431] Trial 65 is omitted in visualization because its objective value is inf or nan.
[W 2023-12-21 03:34:15,431] Trial 134 is omitted in visualization because its objective value is inf or nan.
[W 2023-12-21 03:34:15,431] Trial 427 is omitted in visualization because its objective value is inf or nan.
exo-open: Cannot open display: .
/cvmfs/soft.computecanada.ca/gentoo/2020/usr/bin/xdg-open: line 871: x-www-browser: command not found
/cvmfs/soft.computecanada.ca/gentoo/2020/usr/bin/xdg-open: line 871: firefox: command not found
/cvmfs/soft.computecanada.ca/gentoo/2020/usr/bin/xdg-open: line 871: iceweasel: command not found
/cvmfs/soft.computecanada.ca/gentoo/2020/usr/bin/xdg-open: line 871: seamonkey: command not found
/cvmfs/soft.computecanada.ca/gentoo/2020/usr/bin/xdg-open: line 871: mozilla: command not found
/cvmfs/soft.computecanada.ca/gentoo/2020/usr/bin/xdg-open: line 871: epiphany: command not found
/cvmfs/soft.computecanada.ca/gentoo/2020/usr/bin/xdg-open: line 871: konqueror: command not found
/cvmfs/soft.computecanada.ca/gentoo/2020/usr/bin/xdg-open: line 871: chromium: command not found
/cvmfs/soft.computecanada.ca/gentoo/2020/usr/bin/xdg-open: line 871: chromium-browser: command not found
/cvmfs/soft.computecanada.ca/gentoo/2020/usr/bin/xdg-open: line 871: google-chrome: command not found
/cvmfs/soft.computecanada.ca/gentoo/2020/usr/bin/xdg-open: line 871: www-browser: command not found
/cvmfs/soft.computecanada.ca/gentoo/2020/usr/bin/xdg-open: line 871: links2: command not found
/home/lisat/.local/lib/python3.10/site-packages/xgboost/data.py:440: FutureWarning:

is_sparse is deprecated and will be removed in a future version. Check `isinstance(dtype, pd.SparseDtype)` instead.

[I 2023-12-21 03:34:21,552] A new study created in memory with name: no-name-876ee295-d391-4158-8460-f8b8a6170ccf
[I 2023-12-21 03:34:21,664] Trial 0 finished with value: 5.62698158715805 and parameters: {'learning_rate': 0.400346957724293, 'aft_loss_                                                                     distribution': 'normal', 'aft_loss_distribution_scale': 7.176281883063849, 'max_depth': 9, 'booster': 'gbtree', 'scale_pos_weight': 7.620                                                                     674261654243, 'alpha': 6.644833926074807, 'lambda': 8.208335833187977, 'eta': 0.9396592040772165, 'sampling_method': 'uniform', 'subsampl                                                                     e': 0.8875252866668992, 'gamma': 5.09017025216285}. Best is trial 0 with value: 5.62698158715805.
[I 2023-12-21 03:34:21,758] Trial 1 finished with value: 5.477982706514123 and parameters: {'learning_rate': 0.26043121051027024, 'aft_lo                                                                     ss_distribution': 'normal', 'aft_loss_distribution_scale': 6.111773355843931, 'max_depth': 10, 'booster': 'gbtree', 'scale_pos_weight': 2                                                                     .6473709860606194, 'alpha': 0.10596725895525674, 'lambda': 7.815212727926821, 'eta': 0.9523652470521791, 'sampling_method': 'uniform', 's                                                                     ubsample': 0.6420549047589634, 'gamma': 9.31797050732703}. Best is trial 1 with value: 5.477982706514123.
[I 2023-12-21 03:54:55,290] Trial 2 finished with value: 5.970845457592483 and parameters: {'learning_rate': 0.014326603628865623, 'aft_l                                                                     oss_distribution': 'extreme', 'aft_loss_distribution_scale': 9.397071218469554, 'max_depth': 6, 'booster': 'dart', 'scale_pos_weight': 9.                                                                     14667139739709, 'alpha': 2.5514002577783645, 'lambda': 0.5546454015931169, 'eta': 0.4629052141138248, 'sampling_method': 'uniform', 'subs                                                                     ample': 0.4201164191061687, 'gamma': 1.129477462498343}. Best is trial 1 with value: 5.477982706514123.
[I 2023-12-21 03:55:12,506] Trial 3 finished with value: 5.361616889937013 and parameters: {'learning_rate': 0.1505171039650119, 'aft_los                                                                     s_distribution': 'normal', 'aft_loss_distribution_scale': 5.38537568643639, 'max_depth': 9, 'booster': 'dart', 'scale_pos_weight': 3.3924                                                                     182942057257, 'alpha': 2.6811156091343156, 'lambda': 0.44799940289695056, 'eta': 0.20185018637872387, 'sampling_method': 'uniform', 'subs                                                                     ample': 0.5567483528865339, 'gamma': 3.2659425699797566}. Best is trial 3 with value: 5.361616889937013.
[I 2023-12-21 03:55:15,323] Trial 4 finished with value: 5.039575749269103 and parameters: {'learning_rate': 0.21049881002620585, 'aft_lo                                                                     ss_distribution': 'logistic', 'aft_loss_distribution_scale': 2.3362001649674164, 'max_depth': 4, 'booster': 'dart', 'scale_pos_weight': 5                                                                     .699177478889208, 'alpha': 3.2628856360588787, 'lambda': 2.9985991552900235, 'eta': 0.38154913436868676, 'sampling_method': 'uniform', 's                                                                     ubsample': 0.2300479542915018, 'gamma': 4.158006812881976}. Best is trial 4 with value: 5.039575749269103.
[I 2023-12-21 03:55:15,399] Trial 5 finished with value: inf and parameters: {'learning_rate': 0.7885591313396602, 'aft_loss_distribution                                                                     ': 'normal', 'aft_loss_distribution_scale': 5.322493807439024, 'max_depth': 9, 'booster': 'gbtree', 'scale_pos_weight': 4.191153458839938                                                                     , 'alpha': 5.0264317199831225, 'lambda': 2.5392972154165188, 'eta': 0.2942369463483223, 'sampling_method': 'gradient_based', 'subsample':                                                                      0.1097969946624319, 'gamma': 6.599233908336526}. Best is trial 4 with value: 5.039575749269103.
[I 2023-12-21 03:55:15,404] Trial 6 pruned. Trial was pruned at iteration 0.
[I 2023-12-21 03:55:15,711] Trial 7 finished with value: 5.217904816272119 and parameters: {'learning_rate': 0.21208448646873168, 'aft_lo                                                                     ss_distribution': 'logistic', 'aft_loss_distribution_scale': 2.8627809760916576, 'max_depth': 9, 'booster': 'gbtree', 'scale_pos_weight':                                                                      9.501450430773941, 'alpha': 9.788022255235033, 'lambda': 1.2105749680469915, 'eta': 0.0030808041593115565, 'sampling_method': 'gradient_                                                                     based', 'subsample': 0.37692144953631834, 'gamma': 2.870405255622813}. Best is trial 4 with value: 5.039575749269103.
[I 2023-12-21 03:55:15,728] Trial 8 pruned. Trial was pruned at iteration 4.
[I 2023-12-21 03:55:15,733] Trial 9 pruned. Trial was pruned at iteration 0.
[I 2023-12-21 03:55:15,768] Trial 10 pruned. Trial was pruned at iteration 0.
[I 2023-12-21 03:55:15,921] Trial 11 finished with value: 5.064195518603262 and parameters: {'learning_rate': 0.32453466977155304, 'aft_l                                                                     oss_distribution': 'logistic', 'aft_loss_distribution_scale': 2.4050741209812565, 'max_depth': 6, 'booster': 'gbtree', 'scale_pos_weight'                                                                     : 6.394149325005363, 'alpha': 9.337373186516789, 'lambda': 2.4538730341817043, 'eta': 0.006796626033067854, 'sampling_method': 'gradient_                                                                     based', 'subsample': 0.24236767557061434, 'gamma': 3.2822381289029714}. Best is trial 4 with value: 5.039575749269103.
[I 2023-12-21 03:55:16,060] Trial 12 finished with value: 5.170611033375525 and parameters: {'learning_rate': 0.42405782134892933, 'aft_l                                                                     oss_distribution': 'logistic', 'aft_loss_distribution_scale': 2.714830608691609, 'max_depth': 5, 'booster': 'gbtree', 'scale_pos_weight':                                                                      5.675211830255737, 'alpha': 7.8384843928712735, 'lambda': 2.708212453082005, 'eta': 0.5115609997195592, 'sampling_method': 'gradient_bas                                                                     ed', 'subsample': 0.21860264525355874, 'gamma': 5.039776755466378}. Best is trial 4 with value: 5.039575749269103.
[I 2023-12-21 03:55:16,088] Trial 13 pruned. Trial was pruned at iteration 0.
[I 2023-12-21 03:55:16,116] Trial 14 pruned. Trial was pruned at iteration 0.
[I 2023-12-21 03:55:16,145] Trial 15 pruned. Trial was pruned at iteration 0.
[I 2023-12-21 03:55:16,173] Trial 16 pruned. Trial was pruned at iteration 0.
[I 2023-12-21 03:55:16,201] Trial 17 pruned. Trial was pruned at iteration 0.
[I 2023-12-21 03:55:24,665] Trial 18 finished with value: 4.71238271540215 and parameters: {'learning_rate': 0.14607415683589478, 'aft_lo                                                                     ss_distribution': 'logistic', 'aft_loss_distribution_scale': 1.5759165442853176, 'max_depth': 5, 'booster': 'dart', 'scale_pos_weight': 8                                                                     .478525361400223, 'alpha': 5.525911171567048, 'lambda': 5.924913433237176, 'eta': 0.7530365329125592, 'sampling_method': 'gradient_based'                                                                     , 'subsample': 0.29867260996064465, 'gamma': 1.9156448216578594}. Best is trial 18 with value: 4.71238271540215.
[I 2023-12-21 03:55:30,885] Trial 19 finished with value: 4.646068909560992 and parameters: {'learning_rate': 0.12950032699151476, 'aft_l                                                                     oss_distribution': 'logistic', 'aft_loss_distribution_scale': 1.4435285848255843, 'max_depth': 4, 'booster': 'dart', 'scale_pos_weight':                                                                      8.481945952863864, 'alpha': 5.728258388856094, 'lambda': 6.684923594107644, 'eta': 0.7800499977817233, 'sampling_method': 'uniform', 'sub                                                                     sample': 0.7028260665772973, 'gamma': 1.9860551002045455}. Best is trial 19 with value: 4.646068909560992.
[I 2023-12-21 03:55:30,914] Trial 20 pruned. Trial was pruned at iteration 0.
[I 2023-12-21 03:55:30,945] Trial 21 pruned. Trial was pruned at iteration 0.
