[I 2023-12-19 00:27:12,323] Trial 312 finished with value: inf and parameters: {'learning_rate': 0.9072741184724799, 'aft_loss_distribution': 'normal', 'aft_loss_distribution_scale': 1.3050540406446482, 'max_depth': 5, 'booster': 'gbtree', 'scale_pos_weight': 0.5256805448534847, 'alpha': 6.1411662733648065, 'lambda': 3.187040706951109, 'eta': 0.17935936348944467, 'sampling_method': 'uniform', 'subsample': 0.7326217244864396, 'gamma': 6.0537363508001265}. Best is trial 302 with value: 2.014644627836659.
[I 2023-12-19 00:27:12,405] Trial 313 pruned. Trial was pruned at iteration 0.
[I 2023-12-19 00:27:12,631] Trial 314 finished with value: inf and parameters: {'learning_rate': 0.9218216064508924, 'aft_loss_distribution': 'normal', 'aft_loss_distribution_scale': 1.57381107059869, 'max_depth': 5, 'booster': 'gbtree', 'scale_pos_weight': 0.46909642373405436, 'alpha': 6.532551337995561, 'lambda': 3.0381064250746883, 'eta': 0.15797421918532062, 'sampling_method': 'uniform', 'subsample': 0.7104694651686935, 'gamma': 6.821305270321422}. Best is trial 302 with value: 2.014644627836659.
[I 2023-12-19 00:27:12,715] Trial 315 pruned. Trial was pruned at iteration 1.
[I 2023-12-19 00:27:12,923] Trial 316 finished with value: inf and parameters: {'learning_rate': 0.9006602203509287, 'aft_loss_distribution': 'normal', 'aft_loss_distribution_scale': 1.3574142934514588, 'max_depth': 5, 'booster': 'gbtree', 'scale_pos_weight': 0.5542301328012982, 'alpha': 6.176427312926691, 'lambda': 3.3896727291592113, 'eta': 0.2187570759465458, 'sampling_method': 'uniform', 'subsample': 0.7847650768397199, 'gamma': 5.905800997383596}. Best is trial 302 with value: 2.014644627836659.
[I 2023-12-19 00:27:13,032] Trial 317 pruned. Trial was pruned at iteration 0.
[I 2023-12-19 00:27:13,113] Trial 318 pruned. Trial was pruned at iteration 1.
[I 2023-12-19 00:27:13,198] Trial 319 pruned. Trial was pruned at iteration 1.
[I 2023-12-19 00:27:13,276] Trial 320 pruned. Trial was pruned at iteration 0.
[I 2023-12-19 00:27:14,869] Trial 321 finished with value: inf and parameters: {'learning_rate': 0.9121213926923003, 'aft_loss_distribution': 'normal', 'aft_loss_distribution_scale': 1.455156274889982, 'max_depth': 5, 'booster': 'dart', 'scale_pos_weight': 1.0779529308618483, 'alpha': 6.028159123759927, 'lambda': 3.2923407058694987, 'eta': 0.14909535455922934, 'sampling_method': 'uniform', 'subsample': 0.776590265087096, 'gamma': 6.6894076514832665}. Best is trial 302 with value: 2.014644627836659.
[I 2023-12-19 00:27:14,999] Trial 322 pruned. Trial was pruned at iteration 1.
[I 2023-12-19 00:27:15,367] Trial 323 finished with value: 2.0200693254000055 and parameters: {'learning_rate': 0.9247872600185179, 'aft_loss_distribution': 'normal', 'aft_loss_distribution_scale': 1.6128827492467526, 'max_depth': 5, 'booster': 'gbtree', 'scale_pos_weight': 0.45201067362920644, 'alpha': 6.6403254928778646, 'lambda': 2.8307297862529412, 'eta': 0.16884551203847734, 'sampling_method': 'uniform', 'subsample': 0.6799683040139273, 'gamma': 6.367367250668529}. Best is trial 302 with value: 2.014644627836659.
[I 2023-12-19 00:27:15,661] Trial 324 finished with value: inf and parameters: {'learning_rate': 0.9481154967269108, 'aft_loss_distribution': 'normal', 'aft_loss_distribution_scale': 1.3001832753332823, 'max_depth': 5, 'booster': 'gbtree', 'scale_pos_weight': 0.43005391710393387, 'alpha': 5.808116953635601, 'lambda': 3.9559473634639986, 'eta': 0.16741479100186554, 'sampling_method': 'uniform', 'subsample': 0.68351329114929, 'gamma': 7.411920902821359}. Best is trial 302 with value: 2.014644627836659.
[I 2023-12-19 00:27:15,791] Trial 325 pruned. Trial was pruned at iteration 0.
[I 2023-12-19 00:27:16,179] Trial 326 finished with value: 2.01788946030698 and parameters: {'learning_rate': 0.9150564856262485, 'aft_loss_distribution': 'normal', 'aft_loss_distribution_scale': 1.6163300412618045, 'max_depth': 5, 'booster': 'gbtree', 'scale_pos_weight': 0.37047160155946174, 'alpha': 6.647812231111639, 'lambda': 2.9018880924541866, 'eta': 0.17335248140711967, 'sampling_method': 'uniform', 'subsample': 0.790820038334968, 'gamma': 6.297406098445264}. Best is trial 302 with value: 2.014644627836659.
[I 2023-12-19 00:27:16,415] Trial 327 pruned. Trial was pruned at iteration 37.
[I 2023-12-19 00:27:16,702] Trial 328 finished with value: inf and parameters: {'learning_rate': 0.9096026541994503, 'aft_loss_distribution': 'normal', 'aft_loss_distribution_scale': 1.4278881563645822, 'max_depth': 5, 'booster': 'gbtree', 'scale_pos_weight': 0.359119704511046, 'alpha': 6.132405439552697, 'lambda': 2.518161892623988, 'eta': 0.16912229273416485, 'sampling_method': 'uniform', 'subsample': 0.864826711411597, 'gamma': 6.542976254453368}. Best is trial 302 with value: 2.014644627836659.
[I 2023-12-19 00:27:16,833] Trial 329 pruned. Trial was pruned at iteration 0.
[I 2023-12-19 00:27:16,959] Trial 330 pruned. Trial was pruned at iteration 1.
[I 2023-12-19 00:27:17,090] Trial 331 pruned. Trial was pruned at iteration 0.
[I 2023-12-19 00:27:17,234] Trial 332 pruned. Trial was pruned at iteration 1.
[I 2023-12-19 00:27:17,537] Trial 333 finished with value: inf and parameters: {'learning_rate': 0.9628034953115929, 'aft_loss_distribution': 'normal', 'aft_loss_distribution_scale': 1.3052770507585683, 'max_depth': 4, 'booster': 'gbtree', 'scale_pos_weight': 0.3685861234275091, 'alpha': 6.261460742901552, 'lambda': 3.2746131469926443, 'eta': 0.1837414594147247, 'sampling_method': 'uniform', 'subsample': 0.6905752455905987, 'gamma': 6.189963358996997}. Best is trial 302 with value: 2.014644627836659.
[I 2023-12-19 00:27:17,679] Trial 334 pruned. Trial was pruned at iteration 1.
[I 2023-12-19 00:27:17,953] Trial 335 finished with value: inf and parameters: {'learning_rate': 0.9148041142596761, 'aft_loss_distribution': 'normal', 'aft_loss_distribution_scale': 1.5038722138176985, 'max_depth': 5, 'booster': 'gbtree', 'scale_pos_weight': 0.6010949609546893, 'alpha': 7.017471623384065, 'lambda': 3.618539085268648, 'eta': 0.20949189088064332, 'sampling_method': 'uniform', 'subsample': 0.7478205536333277, 'gamma': 6.582306826867432}. Best is trial 302 with value: 2.014644627836659.
[I 2023-12-19 00:27:18,073] Trial 336 pruned. Trial was pruned at iteration 0.
[I 2023-12-19 00:27:18,348] Trial 337 finished with value: inf and parameters: {'learning_rate': 0.9361589933125426, 'aft_loss_distribution': 'normal', 'aft_loss_distribution_scale': 1.6520809893855066, 'max_depth': 6, 'booster': 'gbtree', 'scale_pos_weight': 0.5131925646623348, 'alpha': 6.785310618682413, 'lambda': 3.053734503378904, 'eta': 0.19561033987689552, 'sampling_method': 'uniform', 'subsample': 0.7955134326753849, 'gamma': 6.400215970801419}. Best is trial 302 with value: 2.014644627836659.
[I 2023-12-19 00:27:18,477] Trial 338 pruned. Trial was pruned at iteration 0.
[I 2023-12-19 00:27:18,557] Trial 339 pruned. Trial was pruned at iteration 0.
[I 2023-12-19 00:27:18,640] Trial 340 pruned. Trial was pruned at iteration 1.
[I 2023-12-19 00:27:18,731] Trial 341 pruned. Trial was pruned at iteration 0.
[I 2023-12-19 00:27:18,815] Trial 342 pruned. Trial was pruned at iteration 1.
[I 2023-12-19 00:27:18,898] Trial 343 pruned. Trial was pruned at iteration 0.
[I 2023-12-19 00:27:19,132] Trial 344 finished with value: inf and parameters: {'learning_rate': 0.9560103460725216, 'aft_loss_distribution': 'normal', 'aft_loss_distribution_scale': 1.6768621447171876, 'max_depth': 5, 'booster': 'gbtree', 'scale_pos_weight': 0.5676109988917439, 'alpha': 7.1237539632461, 'lambda': 3.4875436720725412, 'eta': 0.23396317482705886, 'sampling_method': 'uniform', 'subsample': 0.7353757257657713, 'gamma': 6.504494812021771}. Best is trial 302 with value: 2.014644627836659.
[I 2023-12-19 00:27:19,245] Trial 345 pruned. Trial was pruned at iteration 0.
[I 2023-12-19 00:27:19,332] Trial 346 pruned. Trial was pruned at iteration 0.
[I 2023-12-19 00:27:19,421] Trial 347 pruned. Trial was pruned at iteration 1.
[I 2023-12-19 00:27:19,515] Trial 348 pruned. Trial was pruned at iteration 1.
[I 2023-12-19 00:27:19,740] Trial 349 finished with value: inf and parameters: {'learning_rate': 0.9299125338585073, 'aft_loss_distribution': 'normal', 'aft_loss_distribution_scale': 1.5596393024453772, 'max_depth': 6, 'booster': 'gbtree', 'scale_pos_weight': 0.35439341337834146, 'alpha': 6.649909018839649, 'lambda': 2.7904693034529924, 'eta': 0.23998489683330354, 'sampling_method': 'uniform', 'subsample': 0.7659447080170356, 'gamma': 6.48245627925114}. Best is trial 302 with value: 2.014644627836659.
[I 2023-12-19 00:27:19,838] Trial 350 pruned. Trial was pruned at iteration 0.
[I 2023-12-19 00:27:19,930] Trial 351 pruned. Trial was pruned at iteration 0.
[I 2023-12-19 00:27:20,013] Trial 352 pruned. Trial was pruned at iteration 0.
[I 2023-12-19 00:27:20,097] Trial 353 pruned. Trial was pruned at iteration 0.
[I 2023-12-19 00:27:20,318] Trial 354 finished with value: inf and parameters: {'learning_rate': 0.9476226942921749, 'aft_loss_distribution': 'normal', 'aft_loss_distribution_scale': 1.5537382657418757, 'max_depth': 5, 'booster': 'gbtree', 'scale_pos_weight': 0.4890763913686853, 'alpha': 6.674580696814083, 'lambda': 2.673145992527202, 'eta': 0.22705722395838732, 'sampling_method': 'uniform', 'subsample': 0.722199206140459, 'gamma': 6.230947154462682}. Best is trial 302 with value: 2.014644627836659.
[I 2023-12-19 00:27:20,412] Trial 355 pruned. Trial was pruned at iteration 0.
[I 2023-12-19 00:27:20,497] Trial 356 pruned. Trial was pruned at iteration 1.
[I 2023-12-19 00:27:20,579] Trial 357 pruned. Trial was pruned at iteration 0.
[I 2023-12-19 00:27:20,662] Trial 358 pruned. Trial was pruned at iteration 0.
[I 2023-12-19 00:27:21,011] Trial 359 finished with value: 2.022164739455377 and parameters: {'learning_rate': 0.896183130210839, 'aft_loss_distribution': 'normal', 'aft_loss_distribution_scale': 1.6478519728838688, 'max_depth': 6, 'booster': 'gbtree', 'scale_pos_weight': 0.4692995453075566, 'alpha': 6.1238553721614455, 'lambda': 3.0703673964370397, 'eta': 0.1776733875669458, 'sampling_method': 'uniform', 'subsample': 0.7260591841776047, 'gamma': 6.628173757835665}. Best is trial 302 with value: 2.014644627836659.
[I 2023-12-19 00:27:21,103] Trial 360 pruned. Trial was pruned at iteration 1.
[I 2023-12-19 00:27:21,185] Trial 361 pruned. Trial was pruned at iteration 0.
[I 2023-12-19 00:27:21,458] Trial 362 finished with value: 2.024634207298709 and parameters: {'learning_rate': 0.9595446950147284, 'aft_loss_distribution': 'normal', 'aft_loss_distribution_scale': 1.7032583616900463, 'max_depth': 5, 'booster': 'gbtree', 'scale_pos_weight': 0.6622399917717507, 'alpha': 5.901092933221808, 'lambda': 2.8561160814769546, 'eta': 0.25151325300620203, 'sampling_method': 'uniform', 'subsample': 0.7724784675098353, 'gamma': 7.024141433299654}. Best is trial 302 with value: 2.014644627836659.
[I 2023-12-19 00:27:21,549] Trial 363 pruned. Trial was pruned at iteration 0.
[I 2023-12-19 00:27:21,633] Trial 364 pruned. Trial was pruned at iteration 1.
[I 2023-12-19 00:27:21,841] Trial 365 finished with value: inf and parameters: {'learning_rate': 0.9371875114744179, 'aft_loss_distribution': 'normal', 'aft_loss_distribution_scale': 1.4704577138471775, 'max_depth': 6, 'booster': 'gbtree', 'scale_pos_weight': 0.5769791213238286, 'alpha': 5.986728222709037, 'lambda': 3.8353999171765842, 'eta': 0.2011208281110132, 'sampling_method': 'uniform', 'subsample': 0.7094314682725156, 'gamma': 6.106708810943068}. Best is trial 302 with value: 2.014644627836659.
[I 2023-12-19 00:27:21,938] Trial 366 pruned. Trial was pruned at iteration 0.
[I 2023-12-19 00:27:22,016] Trial 367 pruned. Trial was pruned at iteration 0.
[I 2023-12-19 00:27:22,098] Trial 368 pruned. Trial was pruned at iteration 0.
[I 2023-12-19 00:27:22,183] Trial 369 pruned. Trial was pruned at iteration 1.
[I 2023-12-19 00:27:22,276] Trial 370 pruned. Trial was pruned at iteration 0.
[I 2023-12-19 00:27:22,369] Trial 371 pruned. Trial was pruned at iteration 0.
[I 2023-12-19 00:27:22,462] Trial 372 pruned. Trial was pruned at iteration 1.
[I 2023-12-19 00:27:22,544] Trial 373 pruned. Trial was pruned at iteration 1.
[I 2023-12-19 00:27:22,633] Trial 374 pruned. Trial was pruned at iteration 1.
[I 2023-12-19 00:27:22,715] Trial 375 pruned. Trial was pruned at iteration 0.
[I 2023-12-19 00:27:22,802] Trial 376 pruned. Trial was pruned at iteration 1.
[I 2023-12-19 00:27:23,044] Trial 377 finished with value: inf and parameters: {'learning_rate': 0.8657158749603086, 'aft_loss_distribution': 'normal', 'aft_loss_distribution_scale': 1.6432239587496316, 'max_depth': 5, 'booster': 'gbtree', 'scale_pos_weight': 0.5760514848512529, 'alpha': 6.3205913135480865, 'lambda': 3.410916475639457, 'eta': 0.2424304236143477, 'sampling_method': 'uniform', 'subsample': 0.8042814293095188, 'gamma': 6.509336392876506}. Best is trial 302 with value: 2.014644627836659.
[I 2023-12-19 00:27:26,832] Trial 378 finished with value: 2.0233662886160086 and parameters: {'learning_rate': 0.9354267463733946, 'aft_loss_distribution': 'normal', 'aft_loss_distribution_scale': 1.3337754719511175, 'max_depth': 6, 'booster': 'dart', 'scale_pos_weight': 0.4673061938898234, 'alpha': 5.947685130752923, 'lambda': 3.7586439677148418, 'eta': 0.21518834916743862, 'sampling_method': 'uniform', 'subsample': 0.7017623113153582, 'gamma': 5.765014734443905}. Best is trial 302 with value: 2.014644627836659.
[I 2023-12-19 00:27:26,924] Trial 379 pruned. Trial was pruned at iteration 0.
[I 2023-12-19 00:27:27,012] Trial 380 pruned. Trial was pruned at iteration 1.
[I 2023-12-19 00:27:27,298] Trial 381 finished with value: 2.0188859129916565 and parameters: {'learning_rate': 0.883516041416351, 'aft_loss_distribution': 'normal', 'aft_loss_distribution_scale': 1.5500900891978404, 'max_depth': 5, 'booster': 'gbtree', 'scale_pos_weight': 0.41471599810746096, 'alpha': 6.160131593120587, 'lambda': 2.6250987858618173, 'eta': 0.2575952076110305, 'sampling_method': 'uniform', 'subsample': 0.7544365867002479, 'gamma': 6.76763817894508}. Best is trial 302 with value: 2.014644627836659.
[I 2023-12-19 00:27:27,589] Trial 382 finished with value: 2.0169211866029246 and parameters: {'learning_rate': 0.9010046380330573, 'aft_loss_distribution': 'normal', 'aft_loss_distribution_scale': 1.4462954633968568, 'max_depth': 6, 'booster': 'gbtree', 'scale_pos_weight': 0.6127133637569343, 'alpha': 6.881490600400557, 'lambda': 2.5860192841592453, 'eta': 0.26304949720788623, 'sampling_method': 'uniform', 'subsample': 0.754289942183778, 'gamma': 7.192531695447726}. Best is trial 302 with value: 2.014644627836659.
[I 2023-12-19 00:27:27,681] Trial 383 pruned. Trial was pruned at iteration 0.
[I 2023-12-19 00:27:27,963] Trial 384 finished with value: 2.016678758811545 and parameters: {'learning_rate': 0.9267337853613569, 'aft_loss_distribution': 'normal', 'aft_loss_distribution_scale': 1.4073885372315373, 'max_depth': 6, 'booster': 'gbtree', 'scale_pos_weight': 0.5905818200846062, 'alpha': 7.106163908392352, 'lambda': 2.705401856580207, 'eta': 0.2462327344654389, 'sampling_method': 'uniform', 'subsample': 0.7620729576954068, 'gamma': 7.173296096063648}. Best is trial 302 with value: 2.014644627836659.
[I 2023-12-19 00:27:28,056] Trial 385 pruned. Trial was pruned at iteration 0.
[I 2023-12-19 00:27:28,147] Trial 386 pruned. Trial was pruned at iteration 0.
[I 2023-12-19 00:27:28,360] Trial 387 finished with value: inf and parameters: {'learning_rate': 0.9671716604305138, 'aft_loss_distribution': 'normal', 'aft_loss_distribution_scale': 1.3162824610533295, 'max_depth': 6, 'booster': 'gbtree', 'scale_pos_weight': 0.6106897057725168, 'alpha': 7.285090595536939, 'lambda': 2.3315562466459805, 'eta': 0.2878166373298864, 'sampling_method': 'uniform', 'subsample': 0.7951605509779025, 'gamma': 7.34069347550074}. Best is trial 302 with value: 2.014644627836659.
[I 2023-12-19 00:27:28,458] Trial 388 pruned. Trial was pruned at iteration 0.
[I 2023-12-19 00:27:28,593] Trial 389 pruned. Trial was pruned at iteration 0.
[I 2023-12-19 00:27:28,720] Trial 390 pruned. Trial was pruned at iteration 0.
[I 2023-12-19 00:27:28,849] Trial 391 pruned. Trial was pruned at iteration 0.
[I 2023-12-19 00:27:28,983] Trial 392 pruned. Trial was pruned at iteration 1.
[I 2023-12-19 00:27:29,103] Trial 393 pruned. Trial was pruned at iteration 0.
[I 2023-12-19 00:27:29,238] Trial 394 pruned. Trial was pruned at iteration 0.
[I 2023-12-19 00:27:29,367] Trial 395 pruned. Trial was pruned at iteration 0.
[I 2023-12-19 00:27:29,512] Trial 396 pruned. Trial was pruned at iteration 0.
[I 2023-12-19 00:27:29,636] Trial 397 pruned. Trial was pruned at iteration 0.
[I 2023-12-19 00:27:29,759] Trial 398 pruned. Trial was pruned at iteration 0.
[I 2023-12-19 00:27:29,904] Trial 399 pruned. Trial was pruned at iteration 1.
[I 2023-12-19 00:27:30,240] Trial 400 finished with value: inf and parameters: {'learning_rate': 0.927342104192408, 'aft_loss_distribution': 'normal', 'aft_loss_distribution_scale': 1.5698853226305114, 'max_depth': 6, 'booster': 'gbtree', 'scale_pos_weight': 0.5363891526857123, 'alpha': 5.579929743812656, 'lambda': 2.3335612072704235, 'eta': 0.20439458796215904, 'sampling_method': 'uniform', 'subsample': 0.7812304712465066, 'gamma': 6.6120547915947}. Best is trial 302 with value: 2.014644627836659.
[I 2023-12-19 00:27:30,394] Trial 401 pruned. Trial was pruned at iteration 0.
[I 2023-12-19 00:27:30,544] Trial 402 pruned. Trial was pruned at iteration 0.
[I 2023-12-19 00:27:30,682] Trial 403 pruned. Trial was pruned at iteration 1.
[I 2023-12-19 00:27:30,818] Trial 404 pruned. Trial was pruned at iteration 0.
[I 2023-12-19 00:27:31,101] Trial 405 finished with value: inf and parameters: {'learning_rate': 0.9164183736086283, 'aft_loss_distribution': 'normal', 'aft_loss_distribution_scale': 1.596518031367873, 'max_depth': 6, 'booster': 'gbtree', 'scale_pos_weight': 0.6948848999919689, 'alpha': 6.5527035361704105, 'lambda': 2.5897051650085485, 'eta': 0.1959197284776347, 'sampling_method': 'uniform', 'subsample': 0.6728832915332184, 'gamma': 6.380823032618553}. Best is trial 302 with value: 2.014644627836659.
[I 2023-12-19 00:27:31,243] Trial 406 pruned. Trial was pruned at iteration 1.
[I 2023-12-19 00:27:31,543] Trial 407 finished with value: inf and parameters: {'learning_rate': 0.9374619453012147, 'aft_loss_distribution': 'normal', 'aft_loss_distribution_scale': 1.4647223965920313, 'max_depth': 6, 'booster': 'gbtree', 'scale_pos_weight': 0.5117045729584007, 'alpha': 7.185362971863115, 'lambda': 3.3710255382032575, 'eta': 0.159244161693651, 'sampling_method': 'uniform', 'subsample': 0.739637503844664, 'gamma': 6.128275680831082}. Best is trial 302 with value: 2.014644627836659.
[I 2023-12-19 00:27:31,850] Trial 408 finished with value: inf and parameters: {'learning_rate': 0.9070458011472691, 'aft_loss_distribution': 'normal', 'aft_loss_distribution_scale': 1.6835421455384145, 'max_depth': 6, 'booster': 'gbtree', 'scale_pos_weight': 0.4417065734355382, 'alpha': 6.930390146165835, 'lambda': 3.5711236803759516, 'eta': 0.11474815820831907, 'sampling_method': 'uniform', 'subsample': 0.7611576492593666, 'gamma': 6.921550301284921}. Best is trial 302 with value: 2.014644627836659.
[I 2023-12-19 00:27:32,011] Trial 409 pruned. Trial was pruned at iteration 0.
[I 2023-12-19 00:27:32,162] Trial 410 pruned. Trial was pruned at iteration 1.
[I 2023-12-19 00:27:32,305] Trial 411 pruned. Trial was pruned at iteration 0.
[I 2023-12-19 00:27:32,427] Trial 412 pruned. Trial was pruned at iteration 0.
[I 2023-12-19 00:27:32,557] Trial 413 pruned. Trial was pruned at iteration 0.
[I 2023-12-19 00:27:32,699] Trial 414 pruned. Trial was pruned at iteration 2.
[I 2023-12-19 00:27:32,832] Trial 415 pruned. Trial was pruned at iteration 1.
[I 2023-12-19 00:27:32,995] Trial 416 pruned. Trial was pruned at iteration 0.
[I 2023-12-19 00:27:33,124] Trial 417 pruned. Trial was pruned at iteration 0.
[I 2023-12-19 00:27:33,428] Trial 418 finished with value: inf and parameters: {'learning_rate': 0.9196242041521875, 'aft_loss_distribution': 'normal', 'aft_loss_distribution_scale': 1.5696613788042924, 'max_depth': 6, 'booster': 'gbtree', 'scale_pos_weight': 0.26572957988706924, 'alpha': 7.335770623884768, 'lambda': 3.403685011577868, 'eta': 0.16140871410490654, 'sampling_method': 'uniform', 'subsample': 0.7254584820638124, 'gamma': 6.154762313462568}. Best is trial 302 with value: 2.014644627836659.
[I 2023-12-19 00:27:33,570] Trial 419 pruned. Trial was pruned at iteration 0.
[I 2023-12-19 00:27:33,723] Trial 420 pruned. Trial was pruned at iteration 1.
[I 2023-12-19 00:27:33,861] Trial 421 pruned. Trial was pruned at iteration 0.
[I 2023-12-19 00:27:34,109] Trial 422 finished with value: inf and parameters: {'learning_rate': 0.936384110029586, 'aft_loss_distribution': 'normal', 'aft_loss_distribution_scale': 1.5979054088084128, 'max_depth': 5, 'booster': 'gbtree', 'scale_pos_weight': 0.46950187556694206, 'alpha': 6.586939269498887, 'lambda': 3.7244458901516118, 'eta': 0.202266812015376, 'sampling_method': 'uniform', 'subsample': 0.7348206387617732, 'gamma': 7.319794815903}. Best is trial 302 with value: 2.014644627836659.
[I 2023-12-19 00:27:34,210] Trial 423 pruned. Trial was pruned at iteration 0.
[I 2023-12-19 00:27:34,304] Trial 424 pruned. Trial was pruned at iteration 0.
[I 2023-12-19 00:27:34,394] Trial 425 pruned. Trial was pruned at iteration 1.
[I 2023-12-19 00:27:34,485] Trial 426 pruned. Trial was pruned at iteration 0.
[I 2023-12-19 00:27:34,568] Trial 427 pruned. Trial was pruned at iteration 0.
