[I 2023-12-21 03:09:18,196] Trial 124 finished with value: inf and parameters: {'learning_rate': 0.5437394159619175, 'aft_loss_distributi                                                                     on': 'normal', 'aft_loss_distribution_scale': 1.63519560913636, 'max_depth': 7, 'booster': 'dart', 'scale_pos_weight': 2.4040098278132733                                                                     , 'alpha': 2.7440092547829438, 'lambda': 2.3208951699998766, 'eta': 0.3878240293098448, 'sampling_method': 'uniform', 'subsample': 0.6991                                                                     967288508253, 'gamma': 6.1127189276156315}. Best is trial 66 with value: 4.551281591080345.
[I 2023-12-21 03:09:18,234] Trial 125 pruned. Trial was pruned at iteration 0.
[I 2023-12-21 03:09:18,274] Trial 126 pruned. Trial was pruned at iteration 1.
[I 2023-12-21 03:09:18,311] Trial 127 pruned. Trial was pruned at iteration 0.
[I 2023-12-21 03:09:18,348] Trial 128 pruned. Trial was pruned at iteration 0.
[I 2023-12-21 03:09:18,756] Trial 129 finished with value: inf and parameters: {'learning_rate': 0.5793674260774886, 'aft_loss_distributi                                                                     on': 'normal', 'aft_loss_distribution_scale': 1.4400718029874309, 'max_depth': 9, 'booster': 'gbtree', 'scale_pos_weight': 2.947694034107                                                                     115, 'alpha': 4.50584859129147, 'lambda': 0.6877149288871331, 'eta': 0.057500507354922015, 'sampling_method': 'gradient_based', 'subsampl                                                                     e': 0.21422871660796938, 'gamma': 3.95378235150179}. Best is trial 66 with value: 4.551281591080345.
[I 2023-12-21 03:09:18,793] Trial 130 pruned. Trial was pruned at iteration 0.
[I 2023-12-21 03:09:19,739] Trial 131 finished with value: inf and parameters: {'learning_rate': 0.6805985078045856, 'aft_loss_distributi                                                                     on': 'normal', 'aft_loss_distribution_scale': 1.721664629245395, 'max_depth': 8, 'booster': 'dart', 'scale_pos_weight': 1.912133577738109                                                                     , 'alpha': 9.348455696311499, 'lambda': 3.3593999286978495, 'eta': 0.36355966982756066, 'sampling_method': 'uniform', 'subsample': 0.2412                                                                     0762648412755, 'gamma': 3.7249090408300334}. Best is trial 66 with value: 4.551281591080345.
[I 2023-12-21 03:09:20,723] Trial 132 finished with value: inf and parameters: {'learning_rate': 0.6993622795352953, 'aft_loss_distributi                                                                     on': 'normal', 'aft_loss_distribution_scale': 1.7255685533721632, 'max_depth': 8, 'booster': 'dart', 'scale_pos_weight': 1.78053464298390                                                                     73, 'alpha': 9.663885765909681, 'lambda': 2.584140443996384, 'eta': 0.3364455872884421, 'sampling_method': 'uniform', 'subsample': 0.2714                                                                     997296287313, 'gamma': 4.483495273118596}. Best is trial 66 with value: 4.551281591080345.
[I 2023-12-21 03:09:20,765] Trial 133 pruned. Trial was pruned at iteration 2.
[I 2023-12-21 03:09:20,805] Trial 134 pruned. Trial was pruned at iteration 1.
[I 2023-12-21 03:09:21,757] Trial 135 finished with value: inf and parameters: {'learning_rate': 0.9001872466381342, 'aft_loss_distributi                                                                     on': 'normal', 'aft_loss_distribution_scale': 1.5705294339196676, 'max_depth': 4, 'booster': 'dart', 'scale_pos_weight': 9.12601332858984                                                                     5, 'alpha': 8.933103755297303, 'lambda': 1.421893777014473, 'eta': 0.8340593678298327, 'sampling_method': 'uniform', 'subsample': 0.22236                                                                     74015207835, 'gamma': 5.340875242613302}. Best is trial 66 with value: 4.551281591080345.
[I 2023-12-21 03:09:21,796] Trial 136 pruned. Trial was pruned at iteration 1.
[I 2023-12-21 03:09:21,834] Trial 137 pruned. Trial was pruned at iteration 0.
[I 2023-12-21 03:09:21,871] Trial 138 pruned. Trial was pruned at iteration 0.
[I 2023-12-21 03:09:21,910] Trial 139 pruned. Trial was pruned at iteration 1.
[I 2023-12-21 03:09:21,947] Trial 140 pruned. Trial was pruned at iteration 0.
[I 2023-12-21 03:09:23,076] Trial 141 finished with value: inf and parameters: {'learning_rate': 0.8063841879615385, 'aft_loss_distributi                                                                     on': 'normal', 'aft_loss_distribution_scale': 1.4252208222298872, 'max_depth': 8, 'booster': 'dart', 'scale_pos_weight': 2.64805539732454                                                                     8, 'alpha': 9.116979947334372, 'lambda': 3.915916286936211, 'eta': 0.29714502015412086, 'sampling_method': 'uniform', 'subsample': 0.1369                                                                     9428318121235, 'gamma': 5.477436004848488}. Best is trial 66 with value: 4.551281591080345.
[I 2023-12-21 03:09:24,209] Trial 142 finished with value: inf and parameters: {'learning_rate': 0.8627347581230647, 'aft_loss_distributi                                                                     on': 'normal', 'aft_loss_distribution_scale': 0.9347779244487766, 'max_depth': 8, 'booster': 'dart', 'scale_pos_weight': 2.32928860290193                                                                     06, 'alpha': 8.731762297433281, 'lambda': 4.125872533745159, 'eta': 0.2756629807872889, 'sampling_method': 'uniform', 'subsample': 0.3300                                                                     262747041179, 'gamma': 5.764743107249057}. Best is trial 66 with value: 4.551281591080345.
[I 2023-12-21 03:09:25,340] Trial 143 finished with value: inf and parameters: {'learning_rate': 0.7948738123316517, 'aft_loss_distributi                                                                     on': 'normal', 'aft_loss_distribution_scale': 1.8035763138864094, 'max_depth': 8, 'booster': 'dart', 'scale_pos_weight': 8.09461314516378                                                                     7, 'alpha': 8.773955831728092, 'lambda': 4.397507431642576, 'eta': 0.32576162038661566, 'sampling_method': 'uniform', 'subsample': 0.3731                                                                     090333481488, 'gamma': 7.440076162916825}. Best is trial 66 with value: 4.551281591080345.
[I 2023-12-21 03:09:26,405] Trial 144 finished with value: inf and parameters: {'learning_rate': 0.9313108740905712, 'aft_loss_distributi                                                                     on': 'normal', 'aft_loss_distribution_scale': 1.1545860685667044, 'max_depth': 7, 'booster': 'dart', 'scale_pos_weight': 1.58030573152477                                                                     62, 'alpha': 9.072784741113745, 'lambda': 3.616850561243579, 'eta': 0.25250091619773385, 'sampling_method': 'uniform', 'subsample': 0.201                                                                     15902404871053, 'gamma': 5.068451553419735}. Best is trial 66 with value: 4.551281591080345.
[I 2023-12-21 03:09:26,446] Trial 145 pruned. Trial was pruned at iteration 0.
[I 2023-12-21 03:09:26,483] Trial 146 pruned. Trial was pruned at iteration 0.
[I 2023-12-21 03:09:26,520] Trial 147 pruned. Trial was pruned at iteration 0.
[I 2023-12-21 03:09:27,751] Trial 148 finished with value: inf and parameters: {'learning_rate': 0.6693118873267571, 'aft_loss_distributi                                                                     on': 'normal', 'aft_loss_distribution_scale': 1.587562289712643, 'max_depth': 9, 'booster': 'dart', 'scale_pos_weight': 2.443414251254045                                                                     3, 'alpha': 9.23799224083408, 'lambda': 5.21267417357806, 'eta': 0.43696357968966926, 'sampling_method': 'gradient_based', 'subsample': 0                                                                     .24216981258330067, 'gamma': 1.241330990275665}. Best is trial 66 with value: 4.551281591080345.
[I 2023-12-21 03:09:27,791] Trial 149 pruned. Trial was pruned at iteration 1.
[I 2023-12-21 03:09:27,829] Trial 150 pruned. Trial was pruned at iteration 0.
[I 2023-12-21 03:09:27,894] Trial 151 pruned. Trial was pruned at iteration 2.
[I 2023-12-21 03:09:27,940] Trial 152 pruned. Trial was pruned at iteration 1.
[I 2023-12-21 03:09:27,988] Trial 153 pruned. Trial was pruned at iteration 1.
[I 2023-12-21 03:09:28,026] Trial 154 pruned. Trial was pruned at iteration 0.
[I 2023-12-21 03:09:28,065] Trial 155 pruned. Trial was pruned at iteration 0.
[I 2023-12-21 03:09:28,106] Trial 156 pruned. Trial was pruned at iteration 1.
[I 2023-12-21 03:09:28,147] Trial 157 pruned. Trial was pruned at iteration 0.
[I 2023-12-21 03:09:28,185] Trial 158 pruned. Trial was pruned at iteration 0.
[I 2023-12-21 03:09:29,158] Trial 159 finished with value: inf and parameters: {'learning_rate': 0.6363421039015493, 'aft_loss_distributi                                                                     on': 'normal', 'aft_loss_distribution_scale': 1.448532451280871, 'max_depth': 3, 'booster': 'dart', 'scale_pos_weight': 7.166659662834728                                                                     , 'alpha': 2.2722597575034014, 'lambda': 3.7258833950190415, 'eta': 0.39190121075448475, 'sampling_method': 'uniform', 'subsample': 0.413                                                                     16410139862497, 'gamma': 6.375103987519716}. Best is trial 66 with value: 4.551281591080345.
[I 2023-12-21 03:09:29,196] Trial 160 pruned. Trial was pruned at iteration 0.
[I 2023-12-21 03:09:29,237] Trial 161 pruned. Trial was pruned at iteration 0.
[I 2023-12-21 03:09:29,275] Trial 162 pruned. Trial was pruned at iteration 0.
[I 2023-12-21 03:09:30,279] Trial 163 finished with value: inf and parameters: {'learning_rate': 0.8816326565814754, 'aft_loss_distributi                                                                     on': 'normal', 'aft_loss_distribution_scale': 1.2133008628897173, 'max_depth': 4, 'booster': 'dart', 'scale_pos_weight': 0.84852204023158                                                                     81, 'alpha': 2.3380317304532716, 'lambda': 3.484246374005812, 'eta': 0.3560942170522235, 'sampling_method': 'uniform', 'subsample': 0.317                                                                     9038685953953, 'gamma': 1.8216033565778789}. Best is trial 66 with value: 4.551281591080345.
[I 2023-12-21 03:09:30,319] Trial 164 pruned. Trial was pruned at iteration 0.
[I 2023-12-21 03:09:30,359] Trial 165 pruned. Trial was pruned at iteration 0.
[I 2023-12-21 03:09:30,397] Trial 166 pruned. Trial was pruned at iteration 0.
[I 2023-12-21 03:09:30,438] Trial 167 pruned. Trial was pruned at iteration 0.
[I 2023-12-21 03:09:30,479] Trial 168 pruned. Trial was pruned at iteration 1.
[I 2023-12-21 03:09:30,518] Trial 169 pruned. Trial was pruned at iteration 0.
[I 2023-12-21 03:09:31,575] Trial 170 finished with value: inf and parameters: {'learning_rate': 0.6627579377481877, 'aft_loss_distributi                                                                     on': 'normal', 'aft_loss_distribution_scale': 1.775116307394918, 'max_depth': 6, 'booster': 'dart', 'scale_pos_weight': 2.657670041591561                                                                     3, 'alpha': 4.03019841705877, 'lambda': 7.441570510488759, 'eta': 0.031249216286776557, 'sampling_method': 'uniform', 'subsample': 0.2285                                                                     4478282934448, 'gamma': 3.880215476652578}. Best is trial 66 with value: 4.551281591080345.
[I 2023-12-21 03:09:31,614] Trial 171 pruned. Trial was pruned at iteration 0.
[I 2023-12-21 03:09:31,653] Trial 172 pruned. Trial was pruned at iteration 0.
[I 2023-12-21 03:09:31,692] Trial 173 pruned. Trial was pruned at iteration 0.
[I 2023-12-21 03:09:31,732] Trial 174 pruned. Trial was pruned at iteration 0.
[I 2023-12-21 03:09:31,771] Trial 175 pruned. Trial was pruned at iteration 0.
[I 2023-12-21 03:09:31,824] Trial 176 pruned. Trial was pruned at iteration 2.
[I 2023-12-21 03:09:31,871] Trial 177 pruned. Trial was pruned at iteration 0.
[I 2023-12-21 03:09:31,911] Trial 178 pruned. Trial was pruned at iteration 0.
[I 2023-12-21 03:09:31,950] Trial 179 pruned. Trial was pruned at iteration 0.
[I 2023-12-21 03:09:31,990] Trial 180 pruned. Trial was pruned at iteration 0.
[I 2023-12-21 03:09:33,026] Trial 181 finished with value: inf and parameters: {'learning_rate': 0.6791985593814477, 'aft_loss_distributi                                                                     on': 'normal', 'aft_loss_distribution_scale': 1.324598685349913, 'max_depth': 9, 'booster': 'dart', 'scale_pos_weight': 1.885905794664138                                                                     2, 'alpha': 3.9691537497500846, 'lambda': 0.901956419321432, 'eta': 0.4242819506161189, 'sampling_method': 'uniform', 'subsample': 0.8615                                                                     585295639875, 'gamma': 3.261548182477974}. Best is trial 66 with value: 4.551281591080345.
[I 2023-12-21 03:09:33,068] Trial 182 pruned. Trial was pruned at iteration 1.
[I 2023-12-21 03:09:34,066] Trial 183 finished with value: inf and parameters: {'learning_rate': 0.7391043781510855, 'aft_loss_distributi                                                                     on': 'normal', 'aft_loss_distribution_scale': 1.254027432297561, 'max_depth': 10, 'booster': 'dart', 'scale_pos_weight': 1.59287567370154                                                                     , 'alpha': 3.7529363934423725, 'lambda': 1.8670297418898492, 'eta': 0.44826876233936275, 'sampling_method': 'uniform', 'subsample': 0.798                                                                     325972296999, 'gamma': 3.599124842484807}. Best is trial 66 with value: 4.551281591080345.
[I 2023-12-21 03:09:35,022] Trial 184 finished with value: inf and parameters: {'learning_rate': 0.6963023859774332, 'aft_loss_distributi                                                                     on': 'normal', 'aft_loss_distribution_scale': 1.5661512872183438, 'max_depth': 9, 'booster': 'dart', 'scale_pos_weight': 2.12832748269586                                                                     87, 'alpha': 2.9631082802308017, 'lambda': 0.7144266688492165, 'eta': 0.33051430246912616, 'sampling_method': 'uniform', 'subsample': 0.8                                                                     767436075173385, 'gamma': 3.4426836901311773}. Best is trial 66 with value: 4.551281591080345.
[I 2023-12-21 03:09:35,061] Trial 185 pruned. Trial was pruned at iteration 0.
[I 2023-12-21 03:09:35,100] Trial 186 pruned. Trial was pruned at iteration 0.
[I 2023-12-21 03:09:35,146] Trial 187 pruned. Trial was pruned at iteration 0.
[I 2023-12-21 03:09:35,191] Trial 188 pruned. Trial was pruned at iteration 2.
[I 2023-12-21 03:09:35,232] Trial 189 pruned. Trial was pruned at iteration 0.
[I 2023-12-21 03:09:36,169] Trial 190 finished with value: inf and parameters: {'learning_rate': 0.8470779767544514, 'aft_loss_distributi                                                                     on': 'normal', 'aft_loss_distribution_scale': 1.4196570334879417, 'max_depth': 10, 'booster': 'dart', 'scale_pos_weight': 5.7857196631165                                                                     98, 'alpha': 9.520540065765747, 'lambda': 4.334060260104135, 'eta': 0.508138264421591, 'sampling_method': 'uniform', 'subsample': 0.82176                                                                     44031113762, 'gamma': 5.641476914952243}. Best is trial 66 with value: 4.551281591080345.
[I 2023-12-21 03:09:36,211] Trial 191 pruned. Trial was pruned at iteration 0.
[I 2023-12-21 03:09:36,252] Trial 192 pruned. Trial was pruned at iteration 0.
[I 2023-12-21 03:09:36,291] Trial 193 pruned. Trial was pruned at iteration 0.
[I 2023-12-21 03:09:36,331] Trial 194 pruned. Trial was pruned at iteration 0.
[I 2023-12-21 03:09:36,371] Trial 195 pruned. Trial was pruned at iteration 0.
[I 2023-12-21 03:09:36,411] Trial 196 pruned. Trial was pruned at iteration 0.
[I 2023-12-21 03:09:36,458] Trial 197 pruned. Trial was pruned at iteration 0.
[I 2023-12-21 03:09:36,498] Trial 198 pruned. Trial was pruned at iteration 0.
[I 2023-12-21 03:09:36,538] Trial 199 pruned. Trial was pruned at iteration 0.
[I 2023-12-21 03:09:36,583] Trial 200 pruned. Trial was pruned at iteration 1.
[I 2023-12-21 03:09:36,629] Trial 201 pruned. Trial was pruned at iteration 0.
[I 2023-12-21 03:09:36,673] Trial 202 pruned. Trial was pruned at iteration 0.
[I 2023-12-21 03:09:36,720] Trial 203 pruned. Trial was pruned at iteration 0.
[I 2023-12-21 03:09:37,179] Trial 204 finished with value: inf and parameters: {'learning_rate': 0.6581484504684127, 'aft_loss_distributi                                                                     on': 'normal', 'aft_loss_distribution_scale': 1.4500722426447277, 'max_depth': 9, 'booster': 'gbtree', 'scale_pos_weight': 3.076909399676                                                                     2478, 'alpha': 5.003987528614139, 'lambda': 3.9084614465905387, 'eta': 0.05585715036426719, 'sampling_method': 'gradient_based', 'subsamp                                                                     le': 0.17727952280927142, 'gamma': 3.680335321195701}. Best is trial 66 with value: 4.551281591080345.
[I 2023-12-21 03:09:37,228] Trial 205 pruned. Trial was pruned at iteration 0.
[I 2023-12-21 03:09:37,268] Trial 206 pruned. Trial was pruned at iteration 0.
[I 2023-12-21 03:09:37,308] Trial 207 pruned. Trial was pruned at iteration 0.
[I 2023-12-21 03:09:37,349] Trial 208 pruned. Trial was pruned at iteration 0.
[I 2023-12-21 03:09:37,389] Trial 209 pruned. Trial was pruned at iteration 0.
[I 2023-12-21 03:09:37,429] Trial 210 pruned. Trial was pruned at iteration 0.
[I 2023-12-21 03:09:40,670] Trial 211 finished with value: 4.417812892191642 and parameters: {'learning_rate': 0.6879866855714885, 'aft_l                                                                     oss_distribution': 'normal', 'aft_loss_distribution_scale': 1.6640436913049677, 'max_depth': 8, 'booster': 'dart', 'scale_pos_weight': 1.                                                                     9719035204126938, 'alpha': 9.480945671394425, 'lambda': 3.4494613958146543, 'eta': 0.36914429550323674, 'sampling_method': 'uniform', 'su                                                                     bsample': 0.24309101570882966, 'gamma': 9.913060793780257}. Best is trial 211 with value: 4.417812892191642.
[I 2023-12-21 03:09:41,707] Trial 212 finished with value: inf and parameters: {'learning_rate': 0.7156991279365758, 'aft_loss_distributi                                                                     on': 'normal', 'aft_loss_distribution_scale': 1.5946145749530332, 'max_depth': 8, 'booster': 'dart', 'scale_pos_weight': 2.03404753272158                                                                     4, 'alpha': 9.653569653229027, 'lambda': 2.820787464370308, 'eta': 0.18740660862903544, 'sampling_method': 'uniform', 'subsample': 0.2363                                                                     1109675298853, 'gamma': 3.560593441193349}. Best is trial 211 with value: 4.417812892191642.
[I 2023-12-21 03:09:41,748] Trial 213 pruned. Trial was pruned at iteration 0.
[I 2023-12-21 03:09:41,790] Trial 214 pruned. Trial was pruned at iteration 0.
[I 2023-12-21 03:09:45,430] Trial 215 finished with value: 4.4251517733591 and parameters: {'learning_rate': 0.6941570054605259, 'aft_los                                                                     s_distribution': 'normal', 'aft_loss_distribution_scale': 1.6867265905790625, 'max_depth': 5, 'booster': 'dart', 'scale_pos_weight': 2.47                                                                     0591893038036, 'alpha': 9.534351658172413, 'lambda': 3.018432266200279, 'eta': 0.38871694523218936, 'sampling_method': 'uniform', 'subsam                                                                     ple': 0.21836526806435386, 'gamma': 9.080012428296847}. Best is trial 211 with value: 4.417812892191642.
[I 2023-12-21 03:09:45,473] Trial 216 pruned. Trial was pruned at iteration 0.
[I 2023-12-21 03:09:45,519] Trial 217 pruned. Trial was pruned at iteration 2.
[I 2023-12-21 03:09:45,560] Trial 218 pruned. Trial was pruned at iteration 0.
[I 2023-12-21 03:09:45,602] Trial 219 pruned. Trial was pruned at iteration 0.
[I 2023-12-21 03:09:46,673] Trial 220 finished with value: inf and parameters: {'learning_rate': 0.7451723665991044, 'aft_loss_distributi                                                                     on': 'normal', 'aft_loss_distribution_scale': 1.228001082742371, 'max_depth': 4, 'booster': 'dart', 'scale_pos_weight': 7.539253132467276                                                                     , 'alpha': 2.288850867489835, 'lambda': 2.9905769685225607, 'eta': 0.3213466783411679, 'sampling_method': 'uniform', 'subsample': 0.58003                                                                     16699110666, 'gamma': 2.835855909227698}. Best is trial 211 with value: 4.417812892191642.
[I 2023-12-21 03:09:46,714] Trial 221 pruned. Trial was pruned at iteration 0.
