[I 2023-12-21 04:25:45,818] Trial 232 finished with value: 2.0596054648379845 and parameters: {'learning_rate': 0.2539945243333623, 'aft_                                                                     loss_distribution': 'logistic', 'aft_loss_distribution_scale': 1.053161487494843, 'max_depth': 4, 'booster': 'dart', 'scale_pos_weight':                                                                      1.755216383589538, 'alpha': 7.952672156498746, 'lambda': 7.832004961063273, 'eta': 0.9578801919400604, 'sampling_method': 'uniform', 'sub                                                                     sample': 0.6218676660263062, 'gamma': 7.989165654691056}. Best is trial 224 with value: 2.032141281952214.
[I 2023-12-21 04:26:08,986] Trial 233 finished with value: 2.0536050957177823 and parameters: {'learning_rate': 0.2427106116918382, 'aft_                                                                     loss_distribution': 'logistic', 'aft_loss_distribution_scale': 0.9590632324196476, 'max_depth': 4, 'booster': 'dart', 'scale_pos_weight':                                                                      1.8115084531663608, 'alpha': 7.947577638032315, 'lambda': 8.34027522601264, 'eta': 0.921675025808595, 'sampling_method': 'uniform', 'sub                                                                     sample': 0.6209073241046015, 'gamma': 8.190244535050391}. Best is trial 224 with value: 2.032141281952214.
[I 2023-12-21 04:26:09,030] Trial 234 pruned. Trial was pruned at iteration 0.
[I 2023-12-21 04:26:09,072] Trial 235 pruned. Trial was pruned at iteration 0.
[I 2023-12-21 04:26:34,882] Trial 236 finished with value: 2.053577359113759 and parameters: {'learning_rate': 0.27431950426086943, 'aft_                                                                     loss_distribution': 'logistic', 'aft_loss_distribution_scale': 1.0814620412319413, 'max_depth': 7, 'booster': 'dart', 'scale_pos_weight':                                                                      1.717657825797325, 'alpha': 7.70187905051788, 'lambda': 8.262605398217671, 'eta': 0.9144884478793257, 'sampling_method': 'uniform', 'sub                                                                     sample': 0.644451094840294, 'gamma': 7.510419398540838}. Best is trial 224 with value: 2.032141281952214.
[I 2023-12-21 04:26:44,289] Trial 237 finished with value: 2.0712413718754505 and parameters: {'learning_rate': 0.22981775304332988, 'aft                                                                     _loss_distribution': 'logistic', 'aft_loss_distribution_scale': 0.9724802579795064, 'max_depth': 7, 'booster': 'dart', 'scale_pos_weight'                                                                     : 1.7499010488254774, 'alpha': 7.918382595495792, 'lambda': 8.132976510725689, 'eta': 0.9134448914080017, 'sampling_method': 'uniform', '                                                                     subsample': 0.658009306482511, 'gamma': 7.5099845897417215}. Best is trial 224 with value: 2.032141281952214.
[I 2023-12-21 04:26:55,826] Trial 238 finished with value: 2.0660735720176095 and parameters: {'learning_rate': 0.2145228367574952, 'aft_                                                                     loss_distribution': 'logistic', 'aft_loss_distribution_scale': 0.9480154209223697, 'max_depth': 7, 'booster': 'dart', 'scale_pos_weight':                                                                      1.747852007540032, 'alpha': 7.897455275147306, 'lambda': 8.240807818620487, 'eta': 0.8889863152209955, 'sampling_method': 'uniform', 'su                                                                     bsample': 0.6873086780164093, 'gamma': 7.4598745495712855}. Best is trial 224 with value: 2.032141281952214.
[I 2023-12-21 04:26:55,872] Trial 239 pruned. Trial was pruned at iteration 0.
[I 2023-12-21 04:26:55,916] Trial 240 pruned. Trial was pruned at iteration 0.
[I 2023-12-21 04:27:13,919] Trial 241 finished with value: 2.0629508340331864 and parameters: {'learning_rate': 0.23290544167991967, 'aft                                                                     _loss_distribution': 'logistic', 'aft_loss_distribution_scale': 1.03081392390489, 'max_depth': 7, 'booster': 'dart', 'scale_pos_weight':                                                                      1.817094300110098, 'alpha': 7.934623605952012, 'lambda': 8.203283569108516, 'eta': 0.9154994017856143, 'sampling_method': 'uniform', 'sub                                                                     sample': 0.6666139277743159, 'gamma': 7.387902277316412}. Best is trial 224 with value: 2.032141281952214.
[I 2023-12-21 04:27:23,572] Trial 242 pruned. Trial was pruned at iteration 171.
[I 2023-12-21 04:27:23,614] Trial 243 pruned. Trial was pruned at iteration 0.
[I 2023-12-21 04:27:23,659] Trial 244 pruned. Trial was pruned at iteration 0.
[I 2023-12-21 04:27:23,701] Trial 245 pruned. Trial was pruned at iteration 0.
[I 2023-12-21 04:27:26,427] Trial 246 finished with value: 2.058915809974901 and parameters: {'learning_rate': 0.274212032936341, 'aft_lo                                                                     ss_distribution': 'logistic', 'aft_loss_distribution_scale': 1.0872107846002945, 'max_depth': 7, 'booster': 'dart', 'scale_pos_weight': 1                                                                     .7666074925032482, 'alpha': 7.847312340357076, 'lambda': 7.97158410563495, 'eta': 0.9409501010968518, 'sampling_method': 'uniform', 'subs                                                                     ample': 0.6372456094148592, 'gamma': 8.293232920381664}. Best is trial 224 with value: 2.032141281952214.
[I 2023-12-21 04:27:26,473] Trial 247 pruned. Trial was pruned at iteration 0.
[I 2023-12-21 04:27:38,939] Trial 248 finished with value: 2.058239585057145 and parameters: {'learning_rate': 0.24517734751957332, 'aft_                                                                     loss_distribution': 'logistic', 'aft_loss_distribution_scale': 1.0618808055094908, 'max_depth': 7, 'booster': 'dart', 'scale_pos_weight':                                                                      1.8390001728043512, 'alpha': 8.013869119194927, 'lambda': 7.877169397491923, 'eta': 0.92038128611023, 'sampling_method': 'uniform', 'sub                                                                     sample': 0.6387891329451014, 'gamma': 8.293017419947088}. Best is trial 224 with value: 2.032141281952214.
[I 2023-12-21 04:27:38,986] Trial 249 pruned. Trial was pruned at iteration 0.
[I 2023-12-21 04:27:50,535] Trial 250 finished with value: 2.0599642395034965 and parameters: {'learning_rate': 0.22549382358557696, 'aft                                                                     _loss_distribution': 'logistic', 'aft_loss_distribution_scale': 1.027145579649225, 'max_depth': 7, 'booster': 'dart', 'scale_pos_weight':                                                                      2.0272133428330394, 'alpha': 7.86348757092943, 'lambda': 7.8350866986774585, 'eta': 0.8944730238892813, 'sampling_method': 'uniform', 's                                                                     ubsample': 0.6734269342816591, 'gamma': 6.827428659419661}. Best is trial 224 with value: 2.032141281952214.
[I 2023-12-21 04:28:02,105] Trial 251 finished with value: 2.067890449065357 and parameters: {'learning_rate': 0.2229817422377678, 'aft_l                                                                     oss_distribution': 'logistic', 'aft_loss_distribution_scale': 0.9982656459038506, 'max_depth': 7, 'booster': 'dart', 'scale_pos_weight':                                                                      2.1473510325832557, 'alpha': 8.382119317682784, 'lambda': 7.838169221249501, 'eta': 0.8632966260445571, 'sampling_method': 'uniform', 'su                                                                     bsample': 0.6906132292096782, 'gamma': 6.9425630938840435}. Best is trial 224 with value: 2.032141281952214.
[I 2023-12-21 04:28:02,151] Trial 252 pruned. Trial was pruned at iteration 0.
[I 2023-12-21 04:28:02,194] Trial 253 pruned. Trial was pruned at iteration 0.
[I 2023-12-21 04:28:02,238] Trial 254 pruned. Trial was pruned at iteration 0.
[I 2023-12-21 04:28:02,283] Trial 255 pruned. Trial was pruned at iteration 0.
[I 2023-12-21 04:28:02,329] Trial 256 pruned. Trial was pruned at iteration 0.
[I 2023-12-21 04:28:02,372] Trial 257 pruned. Trial was pruned at iteration 0.
[I 2023-12-21 04:28:02,625] Trial 258 finished with value: 2.0617195611502197 and parameters: {'learning_rate': 0.2564421207151724, 'aft_                                                                     loss_distribution': 'logistic', 'aft_loss_distribution_scale': 1.0222492750480465, 'max_depth': 7, 'booster': 'gbtree', 'scale_pos_weight                                                                     ': 1.6675526870168789, 'alpha': 8.677543631079123, 'lambda': 7.699835539603161, 'eta': 0.8857893380464837, 'sampling_method': 'uniform',                                                                      'subsample': 0.7140630648022702, 'gamma': 7.008203917608248}. Best is trial 224 with value: 2.032141281952214.
[I 2023-12-21 04:28:02,667] Trial 259 pruned. Trial was pruned at iteration 0.
[I 2023-12-21 04:28:02,712] Trial 260 pruned. Trial was pruned at iteration 0.
[I 2023-12-21 04:28:02,763] Trial 261 pruned. Trial was pruned at iteration 0.
[I 2023-12-21 04:28:02,808] Trial 262 pruned. Trial was pruned at iteration 0.
[I 2023-12-21 04:28:02,853] Trial 263 pruned. Trial was pruned at iteration 0.
[I 2023-12-21 04:28:02,896] Trial 264 pruned. Trial was pruned at iteration 0.
[I 2023-12-21 04:28:02,937] Trial 265 pruned. Trial was pruned at iteration 0.
[I 2023-12-21 04:28:02,982] Trial 266 pruned. Trial was pruned at iteration 0.
[I 2023-12-21 04:28:03,030] Trial 267 pruned. Trial was pruned at iteration 0.
[I 2023-12-21 04:28:20,462] Trial 268 finished with value: 2.0554094341310205 and parameters: {'learning_rate': 0.25102343372613206, 'aft                                                                     _loss_distribution': 'logistic', 'aft_loss_distribution_scale': 1.0794795711927072, 'max_depth': 7, 'booster': 'dart', 'scale_pos_weight'                                                                     : 2.322323479761204, 'alpha': 7.516001828735182, 'lambda': 7.661312667045825, 'eta': 0.9186439894695426, 'sampling_method': 'uniform', 's                                                                     ubsample': 0.6800399168894233, 'gamma': 7.243217114458878}. Best is trial 224 with value: 2.032141281952214.
[I 2023-12-21 04:28:20,508] Trial 269 pruned. Trial was pruned at iteration 0.
[I 2023-12-21 04:28:20,550] Trial 270 pruned. Trial was pruned at iteration 0.
[I 2023-12-21 04:28:20,597] Trial 271 pruned. Trial was pruned at iteration 0.
[I 2023-12-21 04:28:20,639] Trial 272 pruned. Trial was pruned at iteration 0.
[I 2023-12-21 04:28:20,682] Trial 273 pruned. Trial was pruned at iteration 0.
[I 2023-12-21 04:28:25,793] Trial 274 finished with value: 2.0566790924070184 and parameters: {'learning_rate': 0.25944892671518666, 'aft                                                                     _loss_distribution': 'logistic', 'aft_loss_distribution_scale': 1.1405556506665415, 'max_depth': 7, 'booster': 'dart', 'scale_pos_weight'                                                                     : 2.2486280541506667, 'alpha': 7.586591601814698, 'lambda': 7.555465534194817, 'eta': 0.8710001908515227, 'sampling_method': 'uniform', '                                                                     subsample': 0.6171116841883846, 'gamma': 7.581990567215081}. Best is trial 224 with value: 2.032141281952214.
[I 2023-12-21 04:28:25,840] Trial 275 pruned. Trial was pruned at iteration 0.
[I 2023-12-21 04:28:25,883] Trial 276 pruned. Trial was pruned at iteration 0.
[I 2023-12-21 04:28:25,929] Trial 277 pruned. Trial was pruned at iteration 0.
[I 2023-12-21 04:28:38,785] Trial 278 finished with value: 2.05988100619151 and parameters: {'learning_rate': 0.22380617866777336, 'aft_l                                                                     oss_distribution': 'logistic', 'aft_loss_distribution_scale': 1.0344612160253968, 'max_depth': 7, 'booster': 'dart', 'scale_pos_weight':                                                                      2.2792319144436473, 'alpha': 7.433035688648499, 'lambda': 8.60025607275242, 'eta': 0.8709682038491899, 'sampling_method': 'uniform', 'sub                                                                     sample': 0.678274745579499, 'gamma': 7.8390417236574255}. Best is trial 224 with value: 2.032141281952214.
[I 2023-12-21 04:28:38,836] Trial 279 pruned. Trial was pruned at iteration 0.
[I 2023-12-21 04:28:38,879] Trial 280 pruned. Trial was pruned at iteration 0.
[I 2023-12-21 04:28:38,927] Trial 281 pruned. Trial was pruned at iteration 0.
[I 2023-12-21 04:28:38,969] Trial 282 pruned. Trial was pruned at iteration 0.
[I 2023-12-21 04:28:39,012] Trial 283 pruned. Trial was pruned at iteration 0.
[I 2023-12-21 04:28:39,057] Trial 284 pruned. Trial was pruned at iteration 0.
[I 2023-12-21 04:28:39,105] Trial 285 pruned. Trial was pruned at iteration 0.
[I 2023-12-21 04:28:39,148] Trial 286 pruned. Trial was pruned at iteration 0.
[I 2023-12-21 04:28:39,196] Trial 287 pruned. Trial was pruned at iteration 0.
[I 2023-12-21 04:28:39,239] Trial 288 pruned. Trial was pruned at iteration 0.
[I 2023-12-21 04:28:39,282] Trial 289 pruned. Trial was pruned at iteration 0.
[I 2023-12-21 04:28:56,962] Trial 290 finished with value: 2.052741607594672 and parameters: {'learning_rate': 0.22250590172784018, 'aft_                                                                     loss_distribution': 'logistic', 'aft_loss_distribution_scale': 1.0370918934655626, 'max_depth': 6, 'booster': 'dart', 'scale_pos_weight':                                                                      1.80482626368785, 'alpha': 8.116341998373905, 'lambda': 7.999952496320859, 'eta': 0.9288623634751372, 'sampling_method': 'uniform', 'sub                                                                     sample': 0.618202456341347, 'gamma': 8.046557473742123}. Best is trial 224 with value: 2.032141281952214.
[I 2023-12-21 04:28:57,012] Trial 291 pruned. Trial was pruned at iteration 0.
[I 2023-12-21 04:28:59,233] Trial 292 finished with value: 2.062390250789745 and parameters: {'learning_rate': 0.2799410112159819, 'aft_l                                                                     oss_distribution': 'logistic', 'aft_loss_distribution_scale': 1.1197602124470412, 'max_depth': 6, 'booster': 'dart', 'scale_pos_weight':                                                                      1.7782779406806712, 'alpha': 8.108467383150375, 'lambda': 8.305285842909136, 'eta': 0.9347819100781467, 'sampling_method': 'uniform', 'su                                                                     bsample': 0.6219940354020497, 'gamma': 7.834428176300446}. Best is trial 224 with value: 2.032141281952214.
[I 2023-12-21 04:28:59,278] Trial 293 pruned. Trial was pruned at iteration 0.
[I 2023-12-21 04:28:59,323] Trial 294 pruned. Trial was pruned at iteration 0.
[I 2023-12-21 04:28:59,373] Trial 295 pruned. Trial was pruned at iteration 0.
[I 2023-12-21 04:29:10,670] Trial 296 finished with value: 2.055818576467047 and parameters: {'learning_rate': 0.258324263572919, 'aft_lo                                                                     ss_distribution': 'logistic', 'aft_loss_distribution_scale': 1.0949756411317113, 'max_depth': 6, 'booster': 'dart', 'scale_pos_weight': 1                                                                     .9247801796288548, 'alpha': 7.780355617726067, 'lambda': 8.268561792125725, 'eta': 0.9309738713527825, 'sampling_method': 'uniform', 'sub                                                                     sample': 0.6079063570604171, 'gamma': 8.339194082711675}. Best is trial 224 with value: 2.032141281952214.
[I 2023-12-21 04:29:10,718] Trial 297 pruned. Trial was pruned at iteration 0.
[I 2023-12-21 04:29:10,762] Trial 298 pruned. Trial was pruned at iteration 0.
[I 2023-12-21 04:29:10,806] Trial 299 pruned. Trial was pruned at iteration 0.
[I 2023-12-21 04:29:10,853] Trial 300 pruned. Trial was pruned at iteration 0.
[I 2023-12-21 04:29:10,898] Trial 301 pruned. Trial was pruned at iteration 0.
[I 2023-12-21 04:29:10,950] Trial 302 pruned. Trial was pruned at iteration 0.
[I 2023-12-21 04:29:10,994] Trial 303 pruned. Trial was pruned at iteration 0.
[I 2023-12-21 04:29:11,040] Trial 304 pruned. Trial was pruned at iteration 0.
[I 2023-12-21 04:29:27,599] Trial 305 finished with value: 2.0528570354250646 and parameters: {'learning_rate': 0.2521307830058141, 'aft_                                                                     loss_distribution': 'logistic', 'aft_loss_distribution_scale': 1.1118211326533025, 'max_depth': 5, 'booster': 'dart', 'scale_pos_weight':                                                                      1.4863499237795526, 'alpha': 8.484755418934578, 'lambda': 8.416185320958167, 'eta': 0.8978123676622977, 'sampling_method': 'uniform', 's                                                                     ubsample': 0.6166033249841391, 'gamma': 7.604452647882371}. Best is trial 224 with value: 2.032141281952214.
[I 2023-12-21 04:29:27,648] Trial 306 pruned. Trial was pruned at iteration 0.
[I 2023-12-21 04:29:27,693] Trial 307 pruned. Trial was pruned at iteration 0.
[I 2023-12-21 04:29:27,737] Trial 308 pruned. Trial was pruned at iteration 0.
[I 2023-12-21 04:29:27,785] Trial 309 pruned. Trial was pruned at iteration 0.
[I 2023-12-21 04:29:27,830] Trial 310 pruned. Trial was pruned at iteration 0.
[I 2023-12-21 04:29:27,874] Trial 311 pruned. Trial was pruned at iteration 0.
[I 2023-12-21 04:29:27,922] Trial 312 pruned. Trial was pruned at iteration 0.
[I 2023-12-21 04:29:39,357] Trial 313 finished with value: 2.052059457500519 and parameters: {'learning_rate': 0.2813905225933663, 'aft_l                                                                     oss_distribution': 'logistic', 'aft_loss_distribution_scale': 1.1665440350181455, 'max_depth': 8, 'booster': 'dart', 'scale_pos_weight':                                                                      1.8608417264855681, 'alpha': 8.274569471582334, 'lambda': 8.12233648559198, 'eta': 0.32878274084290726, 'sampling_method': 'uniform', 'su                                                                     bsample': 0.7130447413215358, 'gamma': 7.786993427177163}. Best is trial 224 with value: 2.032141281952214.
[I 2023-12-21 04:29:39,408] Trial 314 pruned. Trial was pruned at iteration 0.
[I 2023-12-21 04:29:39,457] Trial 315 pruned. Trial was pruned at iteration 0.
[I 2023-12-21 04:30:10,442] Trial 316 finished with value: 2.049151002211693 and parameters: {'learning_rate': 0.28879380377586533, 'aft_                                                                     loss_distribution': 'logistic', 'aft_loss_distribution_scale': 1.089007123397406, 'max_depth': 8, 'booster': 'dart', 'scale_pos_weight':                                                                      1.8292677680362932, 'alpha': 8.56339774708558, 'lambda': 8.035362603340912, 'eta': 0.30857109970263485, 'sampling_method': 'uniform', 'su                                                                     bsample': 0.7513677543786936, 'gamma': 7.443199703589163}. Best is trial 224 with value: 2.032141281952214.
[I 2023-12-21 04:30:10,489] Trial 317 pruned. Trial was pruned at iteration 0.
[I 2023-12-21 04:30:21,566] Trial 318 finished with value: 2.0517770149359964 and parameters: {'learning_rate': 0.29728606927427087, 'aft                                                                     _loss_distribution': 'logistic', 'aft_loss_distribution_scale': 1.15477490141448, 'max_depth': 8, 'booster': 'dart', 'scale_pos_weight':                                                                      1.9264093911848053, 'alpha': 8.558402899408977, 'lambda': 7.72840928994525, 'eta': 0.27808626752322396, 'sampling_method': 'uniform', 'su                                                                     bsample': 0.7611678118390408, 'gamma': 7.682695416487824}. Best is trial 224 with value: 2.032141281952214.
[I 2023-12-21 04:30:29,866] Trial 319 finished with value: 2.0463729283235215 and parameters: {'learning_rate': 0.2947531741221728, 'aft_                                                                     loss_distribution': 'logistic', 'aft_loss_distribution_scale': 1.0988805465119522, 'max_depth': 8, 'booster': 'dart', 'scale_pos_weight':                                                                      1.9469636531397765, 'alpha': 8.546728731156005, 'lambda': 7.7369300864332535, 'eta': 0.35044440246751407, 'sampling_method': 'uniform',                                                                      'subsample': 0.8037189558097891, 'gamma': 7.688072128290593}. Best is trial 224 with value: 2.032141281952214.
[I 2023-12-21 04:30:29,915] Trial 320 pruned. Trial was pruned at iteration 0.
[I 2023-12-21 04:30:29,961] Trial 321 pruned. Trial was pruned at iteration 0.
[I 2023-12-21 04:30:30,005] Trial 322 pruned. Trial was pruned at iteration 0.
