[I 2023-12-21 03:12:53,816] Trial 152 pruned. Trial was pruned at iteration 0.
[I 2023-12-21 03:12:54,838] Trial 153 finished with value: inf and parameters: {'learning_rate': 0.9010444832599185, 'aft_loss_distributi                                                                     on': 'normal', 'aft_loss_distribution_scale': 1.0754609510370523, 'max_depth': 9, 'booster': 'dart', 'scale_pos_weight': 6.61542421148348                                                                     8, 'alpha': 8.120798608648723, 'lambda': 8.40304419247845, 'eta': 0.9790047255488599, 'sampling_method': 'uniform', 'subsample': 0.347061                                                                     7540949277, 'gamma': 8.046107257467465}. Best is trial 148 with value: 4.32565819859156.
[I 2023-12-21 03:12:54,875] Trial 154 pruned. Trial was pruned at iteration 0.
[I 2023-12-21 03:12:55,918] Trial 155 finished with value: inf and parameters: {'learning_rate': 0.9196015288471894, 'aft_loss_distributi                                                                     on': 'normal', 'aft_loss_distribution_scale': 1.3572317216253023, 'max_depth': 9, 'booster': 'dart', 'scale_pos_weight': 4.27016758096418                                                                     7, 'alpha': 7.631539747064389, 'lambda': 9.225276381848014, 'eta': 0.8957772148023682, 'sampling_method': 'uniform', 'subsample': 0.39231                                                                     905483188245, 'gamma': 8.884118109967552}. Best is trial 148 with value: 4.32565819859156.
[I 2023-12-21 03:12:55,955] Trial 156 pruned. Trial was pruned at iteration 0.
[I 2023-12-21 03:12:56,977] Trial 157 finished with value: inf and parameters: {'learning_rate': 0.8960476660900459, 'aft_loss_distributi                                                                     on': 'normal', 'aft_loss_distribution_scale': 1.0802909906345106, 'max_depth': 10, 'booster': 'dart', 'scale_pos_weight': 5.0824326841873                                                                     72, 'alpha': 6.821518235865791, 'lambda': 7.7532317350770095, 'eta': 0.5775439555995162, 'sampling_method': 'uniform', 'subsample': 0.421                                                                     0125392267735, 'gamma': 9.098895522247176}. Best is trial 148 with value: 4.32565819859156.
[I 2023-12-21 03:12:57,014] Trial 158 pruned. Trial was pruned at iteration 0.
[I 2023-12-21 03:12:57,050] Trial 159 pruned. Trial was pruned at iteration 0.
[I 2023-12-21 03:12:57,087] Trial 160 pruned. Trial was pruned at iteration 0.
[I 2023-12-21 03:12:57,126] Trial 161 pruned. Trial was pruned at iteration 0.
[I 2023-12-21 03:12:57,167] Trial 162 pruned. Trial was pruned at iteration 1.
[I 2023-12-21 03:12:58,156] Trial 163 finished with value: inf and parameters: {'learning_rate': 0.9102469912512379, 'aft_loss_distributi                                                                     on': 'normal', 'aft_loss_distribution_scale': 1.252664349354384, 'max_depth': 9, 'booster': 'dart', 'scale_pos_weight': 4.444893429444491                                                                     , 'alpha': 9.086112615247897, 'lambda': 8.598307557818268, 'eta': 0.9251221605017316, 'sampling_method': 'uniform', 'subsample': 0.372778                                                                     81538522417, 'gamma': 9.034719408556807}. Best is trial 148 with value: 4.32565819859156.
[I 2023-12-21 03:12:58,194] Trial 164 pruned. Trial was pruned at iteration 0.
[I 2023-12-21 03:12:58,234] Trial 165 pruned. Trial was pruned at iteration 0.
[I 2023-12-21 03:12:59,355] Trial 166 finished with value: inf and parameters: {'learning_rate': 0.9617762036032311, 'aft_loss_distributi                                                                     on': 'normal', 'aft_loss_distribution_scale': 1.4788480482239363, 'max_depth': 9, 'booster': 'dart', 'scale_pos_weight': 6.03581591741321                                                                     5, 'alpha': 7.486172581281911, 'lambda': 8.359208450066943, 'eta': 0.9691539671187958, 'sampling_method': 'uniform', 'subsample': 0.52134                                                                     5369451269, 'gamma': 9.836114606521274}. Best is trial 148 with value: 4.32565819859156.
[I 2023-12-21 03:12:59,392] Trial 167 pruned. Trial was pruned at iteration 0.
[I 2023-12-21 03:12:59,429] Trial 168 pruned. Trial was pruned at iteration 0.
[I 2023-12-21 03:12:59,468] Trial 169 pruned. Trial was pruned at iteration 0.
[I 2023-12-21 03:13:00,521] Trial 170 finished with value: inf and parameters: {'learning_rate': 0.9198379224124905, 'aft_loss_distributi                                                                     on': 'normal', 'aft_loss_distribution_scale': 1.268141216180131, 'max_depth': 9, 'booster': 'dart', 'scale_pos_weight': 6.453881037411201                                                                     , 'alpha': 9.177792026002964, 'lambda': 8.864684680736238, 'eta': 0.70546329257935, 'sampling_method': 'uniform', 'subsample': 0.30029015                                                                     54555473, 'gamma': 9.466026354527562}. Best is trial 148 with value: 4.32565819859156.
[I 2023-12-21 03:13:00,559] Trial 171 pruned. Trial was pruned at iteration 0.
[I 2023-12-21 03:13:00,596] Trial 172 pruned. Trial was pruned at iteration 0.
[I 2023-12-21 03:13:10,180] Trial 173 finished with value: 4.3421287354783145 and parameters: {'learning_rate': 0.8843082520284887, 'aft_                                                                     loss_distribution': 'normal', 'aft_loss_distribution_scale': 1.4685607910009735, 'max_depth': 9, 'booster': 'dart', 'scale_pos_weight': 5                                                                     .850784324658727, 'alpha': 8.39971922421611, 'lambda': 8.51533188169092, 'eta': 0.8300819663823223, 'sampling_method': 'uniform', 'subsam                                                                     ple': 0.6109213922264829, 'gamma': 9.625314930631289}. Best is trial 148 with value: 4.32565819859156.
[I 2023-12-21 03:13:12,717] Trial 174 finished with value: 4.325161198972311 and parameters: {'learning_rate': 0.8716893690264305, 'aft_l                                                                     oss_distribution': 'normal', 'aft_loss_distribution_scale': 1.425710432691458, 'max_depth': 9, 'booster': 'dart', 'scale_pos_weight': 5.8                                                                     90869335620761, 'alpha': 8.446307163501984, 'lambda': 8.60502211918282, 'eta': 0.8315107222150822, 'sampling_method': 'uniform', 'subsamp                                                                     le': 0.5689767259976594, 'gamma': 9.619101154994729}. Best is trial 174 with value: 4.325161198972311.
[I 2023-12-21 03:13:13,724] Trial 175 finished with value: inf and parameters: {'learning_rate': 0.875211506094517, 'aft_loss_distributio                                                                     n': 'normal', 'aft_loss_distribution_scale': 0.9957091135262821, 'max_depth': 9, 'booster': 'dart', 'scale_pos_weight': 5.511695054108038                                                                     5, 'alpha': 8.36274819517969, 'lambda': 8.537392037327912, 'eta': 0.8492307727521183, 'sampling_method': 'uniform', 'subsample': 0.555633                                                                     8500379855, 'gamma': 9.72585505429228}. Best is trial 174 with value: 4.325161198972311.
[I 2023-12-21 03:13:13,764] Trial 176 pruned. Trial was pruned at iteration 0.
[I 2023-12-21 03:13:13,801] Trial 177 pruned. Trial was pruned at iteration 0.
[I 2023-12-21 03:13:14,765] Trial 178 finished with value: inf and parameters: {'learning_rate': 0.9131007219017655, 'aft_loss_distributi                                                                     on': 'normal', 'aft_loss_distribution_scale': 1.148209629115326, 'max_depth': 10, 'booster': 'dart', 'scale_pos_weight': 7.07374731893528                                                                     5, 'alpha': 9.864691585232737, 'lambda': 7.833442374663323, 'eta': 0.9383887567994397, 'sampling_method': 'uniform', 'subsample': 0.53588                                                                     16886377052, 'gamma': 9.575583930900725}. Best is trial 174 with value: 4.325161198972311.
[I 2023-12-21 03:13:14,804] Trial 179 pruned. Trial was pruned at iteration 0.
[I 2023-12-21 03:13:14,843] Trial 180 pruned. Trial was pruned at iteration 0.
[I 2023-12-21 03:13:14,881] Trial 181 pruned. Trial was pruned at iteration 0.
[I 2023-12-21 03:13:14,919] Trial 182 pruned. Trial was pruned at iteration 0.
[I 2023-12-21 03:13:15,919] Trial 183 finished with value: inf and parameters: {'learning_rate': 0.9330714571909458, 'aft_loss_distributi                                                                     on': 'normal', 'aft_loss_distribution_scale': 1.2952951859611104, 'max_depth': 9, 'booster': 'dart', 'scale_pos_weight': 5.86449657984696                                                                     6, 'alpha': 7.9311108165163535, 'lambda': 8.564585864668356, 'eta': 0.7690103026596037, 'sampling_method': 'uniform', 'subsample': 0.5622                                                                     172513027238, 'gamma': 9.11172293644894}. Best is trial 174 with value: 4.325161198972311.
[I 2023-12-21 03:13:15,959] Trial 184 pruned. Trial was pruned at iteration 0.
[I 2023-12-21 03:13:15,997] Trial 185 pruned. Trial was pruned at iteration 0.
[I 2023-12-21 03:13:16,970] Trial 186 finished with value: inf and parameters: {'learning_rate': 0.9817374254666429, 'aft_loss_distributi                                                                     on': 'normal', 'aft_loss_distribution_scale': 0.9337109744955778, 'max_depth': 9, 'booster': 'dart', 'scale_pos_weight': 5.10364642262024                                                                     4, 'alpha': 7.533222393407228, 'lambda': 9.10075794419914, 'eta': 0.9592728004110191, 'sampling_method': 'uniform', 'subsample': 0.586661                                                                     6185128551, 'gamma': 9.330931912725752}. Best is trial 174 with value: 4.325161198972311.
[I 2023-12-21 03:13:17,951] Trial 187 finished with value: inf and parameters: {'learning_rate': 0.9229859609215605, 'aft_loss_distributi                                                                     on': 'normal', 'aft_loss_distribution_scale': 1.3772728979497022, 'max_depth': 9, 'booster': 'dart', 'scale_pos_weight': 5.60573365843890                                                                     95, 'alpha': 8.807871518176094, 'lambda': 9.580219092931088, 'eta': 0.8399275669270659, 'sampling_method': 'uniform', 'subsample': 0.3664                                                                     0845860660154, 'gamma': 8.407532732487441}. Best is trial 174 with value: 4.325161198972311.
[I 2023-12-21 03:13:17,990] Trial 188 pruned. Trial was pruned at iteration 0.
[I 2023-12-21 03:13:18,983] Trial 189 finished with value: inf and parameters: {'learning_rate': 0.853955009550254, 'aft_loss_distributio                                                                     n': 'normal', 'aft_loss_distribution_scale': 1.1637230913173875, 'max_depth': 10, 'booster': 'dart', 'scale_pos_weight': 5.96933247646616                                                                     2, 'alpha': 8.1655476660471, 'lambda': 8.718429541495865, 'eta': 0.6063254088308632, 'sampling_method': 'uniform', 'subsample': 0.3320075                                                                     0284087654, 'gamma': 9.534109263620282}. Best is trial 174 with value: 4.325161198972311.
[I 2023-12-21 03:13:19,022] Trial 190 pruned. Trial was pruned at iteration 0.
[I 2023-12-21 03:13:19,060] Trial 191 pruned. Trial was pruned at iteration 0.
[I 2023-12-21 03:13:19,098] Trial 192 pruned. Trial was pruned at iteration 0.
[I 2023-12-21 03:13:20,231] Trial 193 finished with value: inf and parameters: {'learning_rate': 0.9035562259752045, 'aft_loss_distributi                                                                     on': 'normal', 'aft_loss_distribution_scale': 1.4421477785023153, 'max_depth': 9, 'booster': 'dart', 'scale_pos_weight': 6.92610301444999                                                                     6, 'alpha': 7.029575890286454, 'lambda': 7.998764330640704, 'eta': 0.7918370695934018, 'sampling_method': 'uniform', 'subsample': 0.64841                                                                     65484033549, 'gamma': 8.846106203419001}. Best is trial 174 with value: 4.325161198972311.
[I 2023-12-21 03:13:20,271] Trial 194 pruned. Trial was pruned at iteration 0.
[I 2023-12-21 03:13:20,311] Trial 195 pruned. Trial was pruned at iteration 0.
[I 2023-12-21 03:13:21,360] Trial 196 finished with value: inf and parameters: {'learning_rate': 0.8846136327886381, 'aft_loss_distributi                                                                     on': 'normal', 'aft_loss_distribution_scale': 1.2689916839328594, 'max_depth': 9, 'booster': 'dart', 'scale_pos_weight': 5.42425068003693                                                                     9, 'alpha': 8.604169245794067, 'lambda': 8.673756354991484, 'eta': 0.9401100028414608, 'sampling_method': 'uniform', 'subsample': 0.54705                                                                     72549618453, 'gamma': 9.52316406703088}. Best is trial 174 with value: 4.325161198972311.
[I 2023-12-21 03:13:21,399] Trial 197 pruned. Trial was pruned at iteration 0.
[I 2023-12-21 03:13:21,437] Trial 198 pruned. Trial was pruned at iteration 0.
[I 2023-12-21 03:13:22,464] Trial 199 finished with value: inf and parameters: {'learning_rate': 0.8625003708370156, 'aft_loss_distributi                                                                     on': 'normal', 'aft_loss_distribution_scale': 1.118541546658435, 'max_depth': 9, 'booster': 'dart', 'scale_pos_weight': 5.960055982030595                                                                     , 'alpha': 9.305258150300057, 'lambda': 8.814484059016449, 'eta': 0.8725693670861314, 'sampling_method': 'uniform', 'subsample': 0.469991                                                                     42725072496, 'gamma': 9.062644970414976}. Best is trial 174 with value: 4.325161198972311.
[I 2023-12-21 03:13:22,503] Trial 200 pruned. Trial was pruned at iteration 0.
[I 2023-12-21 03:13:22,541] Trial 201 pruned. Trial was pruned at iteration 0.
[I 2023-12-21 03:13:22,580] Trial 202 pruned. Trial was pruned at iteration 0.
[I 2023-12-21 03:13:22,621] Trial 203 pruned. Trial was pruned at iteration 0.
[I 2023-12-21 03:13:22,660] Trial 204 pruned. Trial was pruned at iteration 0.
[I 2023-12-21 03:13:22,698] Trial 205 pruned. Trial was pruned at iteration 0.
[I 2023-12-21 03:13:23,851] Trial 206 finished with value: inf and parameters: {'learning_rate': 0.9259574399638268, 'aft_loss_distributi                                                                     on': 'normal', 'aft_loss_distribution_scale': 1.5016348455708026, 'max_depth': 9, 'booster': 'dart', 'scale_pos_weight': 6.02777252090746                                                                     9, 'alpha': 9.608666275629172, 'lambda': 8.866432379317862, 'eta': 0.7679212313316908, 'sampling_method': 'uniform', 'subsample': 0.47411                                                                     57141534631, 'gamma': 9.736126139136008}. Best is trial 174 with value: 4.325161198972311.
[I 2023-12-21 03:13:23,891] Trial 207 pruned. Trial was pruned at iteration 0.
[I 2023-12-21 03:13:23,929] Trial 208 pruned. Trial was pruned at iteration 0.
[I 2023-12-21 03:13:23,968] Trial 209 pruned. Trial was pruned at iteration 0.
[I 2023-12-21 03:13:24,008] Trial 210 pruned. Trial was pruned at iteration 0.
[I 2023-12-21 03:13:24,047] Trial 211 pruned. Trial was pruned at iteration 0.
[I 2023-12-21 03:13:24,086] Trial 212 pruned. Trial was pruned at iteration 0.
[I 2023-12-21 03:13:24,126] Trial 213 pruned. Trial was pruned at iteration 0.
[I 2023-12-21 03:13:24,165] Trial 214 pruned. Trial was pruned at iteration 0.
[I 2023-12-21 03:13:24,204] Trial 215 pruned. Trial was pruned at iteration 0.
[I 2023-12-21 03:13:24,246] Trial 216 pruned. Trial was pruned at iteration 0.
[I 2023-12-21 03:13:25,225] Trial 217 finished with value: inf and parameters: {'learning_rate': 0.9399567571404613, 'aft_loss_distributi                                                                     on': 'normal', 'aft_loss_distribution_scale': 1.3660255655902234, 'max_depth': 9, 'booster': 'dart', 'scale_pos_weight': 4.94552196634451                                                                     7, 'alpha': 5.7095725575808185, 'lambda': 8.309495571804382, 'eta': 0.9673000636274822, 'sampling_method': 'uniform', 'subsample': 0.5676                                                                     240571939473, 'gamma': 8.844987315848096}. Best is trial 174 with value: 4.325161198972311.
[I 2023-12-21 03:13:25,265] Trial 218 pruned. Trial was pruned at iteration 0.
[I 2023-12-21 03:13:25,304] Trial 219 pruned. Trial was pruned at iteration 0.
[I 2023-12-21 03:13:25,344] Trial 220 pruned. Trial was pruned at iteration 0.
[I 2023-12-21 03:13:25,384] Trial 221 pruned. Trial was pruned at iteration 0.
[I 2023-12-21 03:13:26,370] Trial 222 finished with value: inf and parameters: {'learning_rate': 0.8914577157985843, 'aft_loss_distributi                                                                     on': 'normal', 'aft_loss_distribution_scale': 1.3852003270054551, 'max_depth': 9, 'booster': 'dart', 'scale_pos_weight': 6.00424128608464                                                                     2, 'alpha': 7.8145919307118055, 'lambda': 6.117700030028217, 'eta': 0.8253064086441972, 'sampling_method': 'uniform', 'subsample': 0.9441                                                                     035649929581, 'gamma': 4.339974919658965}. Best is trial 174 with value: 4.325161198972311.
[I 2023-12-21 03:13:27,361] Trial 223 finished with value: inf and parameters: {'learning_rate': 0.94286043677731, 'aft_loss_distribution                                                                     ': 'normal', 'aft_loss_distribution_scale': 1.211999553423101, 'max_depth': 9, 'booster': 'dart', 'scale_pos_weight': 6.303285133055456,                                                                      'alpha': 6.062768519971565, 'lambda': 4.9436576941031865, 'eta': 0.8075260372569592, 'sampling_method': 'uniform', 'subsample': 0.4605456                                                                     014274817, 'gamma': 8.56883663747452}. Best is trial 174 with value: 4.325161198972311.
[I 2023-12-21 03:13:27,408] Trial 224 pruned. Trial was pruned at iteration 0.
[I 2023-12-21 03:13:27,449] Trial 225 pruned. Trial was pruned at iteration 0.
[I 2023-12-21 03:13:28,431] Trial 226 finished with value: inf and parameters: {'learning_rate': 0.975953555826759, 'aft_loss_distributio                                                                     n': 'normal', 'aft_loss_distribution_scale': 1.4359279226163442, 'max_depth': 9, 'booster': 'dart', 'scale_pos_weight': 0.552353349039878                                                                     9, 'alpha': 7.3792539103314265, 'lambda': 8.663671772272263, 'eta': 0.9298954568205993, 'sampling_method': 'uniform', 'subsample': 0.3680                                                                     0720409388954, 'gamma': 9.19437679800072}. Best is trial 174 with value: 4.325161198972311.
[I 2023-12-21 03:13:28,473] Trial 227 pruned. Trial was pruned at iteration 0.
[I 2023-12-21 03:13:29,461] Trial 228 finished with value: inf and parameters: {'learning_rate': 0.9555606354706544, 'aft_loss_distributi                                                                     on': 'normal', 'aft_loss_distribution_scale': 1.2246046082972804, 'max_depth': 8, 'booster': 'dart', 'scale_pos_weight': 6.65074981600880                                                                     4, 'alpha': 9.771729669148328, 'lambda': 7.568056138429866, 'eta': 0.9847538812954568, 'sampling_method': 'uniform', 'subsample': 0.97039                                                                     78755166139, 'gamma': 3.6706009016712144}. Best is trial 174 with value: 4.325161198972311.
[I 2023-12-21 03:13:29,504] Trial 229 pruned. Trial was pruned at iteration 0.
[I 2023-12-21 03:13:29,546] Trial 230 pruned. Trial was pruned at iteration 0.
[I 2023-12-21 03:13:29,586] Trial 231 pruned. Trial was pruned at iteration 0.
[I 2023-12-21 03:13:29,628] Trial 232 pruned. Trial was pruned at iteration 0.
[I 2023-12-21 03:13:29,669] Trial 233 pruned. Trial was pruned at iteration 0.
[I 2023-12-21 03:13:29,709] Trial 234 pruned. Trial was pruned at iteration 0.
[I 2023-12-21 03:13:30,736] Trial 235 finished with value: inf and parameters: {'learning_rate': 0.8917925228993722, 'aft_loss_distributi                                                                     on': 'normal', 'aft_loss_distribution_scale': 1.280041102065495, 'max_depth': 9, 'booster': 'dart', 'scale_pos_weight': 8.137036346381887                                                                     , 'alpha': 6.770530622151969, 'lambda': 4.3713651115743755, 'eta': 0.7780479109327907, 'sampling_method': 'uniform', 'subsample': 0.50422                                                                     00332044042, 'gamma': 4.6883508780731695}. Best is trial 174 with value: 4.325161198972311.
[I 2023-12-21 03:13:30,778] Trial 236 pruned. Trial was pruned at iteration 0.
[I 2023-12-21 03:13:30,818] Trial 237 pruned. Trial was pruned at iteration 0.
