[I 2023-12-21 03:02:37,885] Trial 273 finished with value: inf and parameters: {'learning_rate': 0.7810559238014083, 'aft_loss_distributi                                                                     on': 'normal', 'aft_loss_distribution_scale': 1.261263877462247, 'max_depth': 7, 'booster': 'dart', 'scale_pos_weight': 6.209920686466742                                                                     , 'alpha': 7.939834617170499, 'lambda': 8.535208854056354, 'eta': 0.48334237651065914, 'sampling_method': 'uniform', 'subsample': 0.81086                                                                     9413904269, 'gamma': 6.899832483707929}. Best is trial 262 with value: 4.298540598862548.
[I 2023-12-21 03:02:37,926] Trial 274 pruned. Trial was pruned at iteration 0.
[I 2023-12-21 03:02:41,840] Trial 275 finished with value: 4.327983011655476 and parameters: {'learning_rate': 0.7511769803316464, 'aft_l                                                                     oss_distribution': 'normal', 'aft_loss_distribution_scale': 1.43520673505997, 'max_depth': 7, 'booster': 'dart', 'scale_pos_weight': 6.37                                                                     8689143885671, 'alpha': 7.981178619244219, 'lambda': 8.280973296241921, 'eta': 0.5069095415420619, 'sampling_method': 'uniform', 'subsamp                                                                     le': 0.7486607488153051, 'gamma': 6.715576663971323}. Best is trial 262 with value: 4.298540598862548.
[I 2023-12-21 03:02:43,263] Trial 276 finished with value: inf and parameters: {'learning_rate': 0.7596403310088724, 'aft_loss_distributi                                                                     on': 'normal', 'aft_loss_distribution_scale': 1.3547064828939959, 'max_depth': 7, 'booster': 'dart', 'scale_pos_weight': 6.39438623634799                                                                     8, 'alpha': 8.221976885394005, 'lambda': 8.26826089094078, 'eta': 0.5182845454014641, 'sampling_method': 'uniform', 'subsample': 0.752053                                                                     2108960765, 'gamma': 7.003898926627761}. Best is trial 262 with value: 4.298540598862548.
[I 2023-12-21 03:02:44,326] Trial 277 finished with value: inf and parameters: {'learning_rate': 0.7818590371940478, 'aft_loss_distributi                                                                     on': 'normal', 'aft_loss_distribution_scale': 1.0995943756612685, 'max_depth': 7, 'booster': 'dart', 'scale_pos_weight': 6.11254702175210                                                                     3, 'alpha': 8.005829330882944, 'lambda': 8.450567945967778, 'eta': 0.483754486614251, 'sampling_method': 'uniform', 'subsample': 0.787816                                                                     6485229331, 'gamma': 6.693774693402951}. Best is trial 262 with value: 4.298540598862548.
[I 2023-12-21 03:02:44,370] Trial 278 pruned. Trial was pruned at iteration 0.
[I 2023-12-21 03:02:50,497] Trial 279 finished with value: 4.319479684963105 and parameters: {'learning_rate': 0.7387530189324506, 'aft_l                                                                     oss_distribution': 'normal', 'aft_loss_distribution_scale': 1.42671578514254, 'max_depth': 7, 'booster': 'dart', 'scale_pos_weight': 6.00                                                                     900137426623, 'alpha': 6.566973976864325, 'lambda': 7.940901474623157, 'eta': 0.5091701486809649, 'sampling_method': 'uniform', 'subsampl                                                                     e': 0.803797516898454, 'gamma': 7.182069089883672}. Best is trial 262 with value: 4.298540598862548.
[I 2023-12-21 03:02:53,228] Trial 280 finished with value: 4.307244990976041 and parameters: {'learning_rate': 0.7418141667096784, 'aft_l                                                                     oss_distribution': 'normal', 'aft_loss_distribution_scale': 1.3980544743040255, 'max_depth': 7, 'booster': 'dart', 'scale_pos_weight': 6.                                                                     10551974759917, 'alpha': 6.375090930657077, 'lambda': 8.310544596626753, 'eta': 0.5190644893291788, 'sampling_method': 'uniform', 'subsam                                                                     ple': 0.8191955106792649, 'gamma': 7.271059589750795}. Best is trial 262 with value: 4.298540598862548.
[I 2023-12-21 03:02:54,312] Trial 281 finished with value: inf and parameters: {'learning_rate': 0.7375279742173396, 'aft_loss_distributi                                                                     on': 'normal', 'aft_loss_distribution_scale': 1.2213080290721856, 'max_depth': 7, 'booster': 'dart', 'scale_pos_weight': 5.99214182306765                                                                     95, 'alpha': 6.621467117843914, 'lambda': 8.339634605815021, 'eta': 0.5086051373726307, 'sampling_method': 'uniform', 'subsample': 0.8215                                                                     622832347685, 'gamma': 7.4915558756944245}. Best is trial 262 with value: 4.298540598862548.
[I 2023-12-21 03:02:54,355] Trial 282 pruned. Trial was pruned at iteration 0.
[I 2023-12-21 03:02:59,131] Trial 283 finished with value: 4.325176431484506 and parameters: {'learning_rate': 0.7705219802729181, 'aft_l                                                                     oss_distribution': 'normal', 'aft_loss_distribution_scale': 1.4420567158714843, 'max_depth': 7, 'booster': 'dart', 'scale_pos_weight': 5.                                                                     387383632714842, 'alpha': 6.3686200579096255, 'lambda': 8.03489941530856, 'eta': 0.4484425739635769, 'sampling_method': 'uniform', 'subsa                                                                     mple': 0.8179160851310828, 'gamma': 7.198140920942312}. Best is trial 262 with value: 4.298540598862548.
[I 2023-12-21 03:03:00,166] Trial 284 finished with value: inf and parameters: {'learning_rate': 0.7851696052267314, 'aft_loss_distributi                                                                     on': 'normal', 'aft_loss_distribution_scale': 0.8922499218806815, 'max_depth': 7, 'booster': 'dart', 'scale_pos_weight': 5.90064395677409                                                                     25, 'alpha': 6.254407667651326, 'lambda': 7.995762287987471, 'eta': 0.3938941025012771, 'sampling_method': 'uniform', 'subsample': 0.8226                                                                     144117365896, 'gamma': 7.226208225462952}. Best is trial 262 with value: 4.298540598862548.
[I 2023-12-21 03:03:01,310] Trial 285 finished with value: inf and parameters: {'learning_rate': 0.834754692155093, 'aft_loss_distributio                                                                     n': 'normal', 'aft_loss_distribution_scale': 1.3888867210900324, 'max_depth': 7, 'booster': 'dart', 'scale_pos_weight': 5.407980187514051                                                                     , 'alpha': 6.465155954492589, 'lambda': 8.196820394195516, 'eta': 0.5307017195407606, 'sampling_method': 'uniform', 'subsample': 0.842365                                                                     7497048543, 'gamma': 6.951047600390966}. Best is trial 262 with value: 4.298540598862548.
[I 2023-12-21 03:03:02,438] Trial 286 finished with value: inf and parameters: {'learning_rate': 0.7611569417277072, 'aft_loss_distributi                                                                     on': 'normal', 'aft_loss_distribution_scale': 1.147135453886791, 'max_depth': 6, 'booster': 'dart', 'scale_pos_weight': 6.169071423586265                                                                     , 'alpha': 5.902805931131815, 'lambda': 8.346977627641275, 'eta': 0.4472707282185953, 'sampling_method': 'uniform', 'subsample': 0.802239                                                                     7540353223, 'gamma': 6.754686441542759}. Best is trial 262 with value: 4.298540598862548.
[I 2023-12-21 03:03:06,864] Trial 287 finished with value: 4.315460323086611 and parameters: {'learning_rate': 0.7703122989503395, 'aft_l                                                                     oss_distribution': 'normal', 'aft_loss_distribution_scale': 1.4137703459176045, 'max_depth': 7, 'booster': 'dart', 'scale_pos_weight': 6.                                                                     480039819254427, 'alpha': 6.534370385027323, 'lambda': 8.01574876606121, 'eta': 0.48894927972850766, 'sampling_method': 'uniform', 'subsa                                                                     mple': 0.825731644971302, 'gamma': 7.454003298906185}. Best is trial 262 with value: 4.298540598862548.
[I 2023-12-21 03:03:10,801] Trial 288 finished with value: 4.309436040280465 and parameters: {'learning_rate': 0.7700901235996069, 'aft_l                                                                     oss_distribution': 'normal', 'aft_loss_distribution_scale': 1.3906266258488624, 'max_depth': 7, 'booster': 'dart', 'scale_pos_weight': 6.                                                                     4438355043160955, 'alpha': 6.549096546371186, 'lambda': 8.021651383714383, 'eta': 0.5445911267102743, 'sampling_method': 'uniform', 'subs                                                                     ample': 0.8132787474859127, 'gamma': 7.097969303969267}. Best is trial 262 with value: 4.298540598862548.
[I 2023-12-21 03:03:12,700] Trial 289 finished with value: inf and parameters: {'learning_rate': 0.7890714596014726, 'aft_loss_distributi                                                                     on': 'normal', 'aft_loss_distribution_scale': 1.3604442772295797, 'max_depth': 7, 'booster': 'dart', 'scale_pos_weight': 4.79253773581236                                                                     15, 'alpha': 6.439406935844252, 'lambda': 8.080742086815809, 'eta': 0.4920713305221716, 'sampling_method': 'uniform', 'subsample': 0.8389                                                                     330391112132, 'gamma': 7.636685474576423}. Best is trial 262 with value: 4.298540598862548.
[I 2023-12-21 03:03:13,737] Trial 290 finished with value: inf and parameters: {'learning_rate': 0.7690369093974854, 'aft_loss_distributi                                                                     on': 'normal', 'aft_loss_distribution_scale': 0.9462939081744928, 'max_depth': 7, 'booster': 'dart', 'scale_pos_weight': 6.43147474424096                                                                     5, 'alpha': 6.7069675550536685, 'lambda': 8.522121859361182, 'eta': 0.5414309358895132, 'sampling_method': 'uniform', 'subsample': 0.8228                                                                     680621892455, 'gamma': 7.385052159365784}. Best is trial 262 with value: 4.298540598862548.
[I 2023-12-21 03:03:14,854] Trial 291 finished with value: inf and parameters: {'learning_rate': 0.7388079404069344, 'aft_loss_distributi                                                                     on': 'normal', 'aft_loss_distribution_scale': 1.2170191145168043, 'max_depth': 7, 'booster': 'dart', 'scale_pos_weight': 6.17800818182325                                                                     1, 'alpha': 6.3956356342041385, 'lambda': 8.883897444785049, 'eta': 0.46736942301865836, 'sampling_method': 'uniform', 'subsample': 0.853                                                                     067942427317, 'gamma': 7.021695521996101}. Best is trial 262 with value: 4.298540598862548.
[I 2023-12-21 03:03:14,897] Trial 292 pruned. Trial was pruned at iteration 0.
[I 2023-12-21 03:03:15,962] Trial 293 finished with value: inf and parameters: {'learning_rate': 0.7705146821019117, 'aft_loss_distributi                                                                     on': 'normal', 'aft_loss_distribution_scale': 1.100492697354948, 'max_depth': 7, 'booster': 'dart', 'scale_pos_weight': 6.281160583470816                                                                     , 'alpha': 6.198668511586909, 'lambda': 8.29649663924606, 'eta': 0.5819228385870399, 'sampling_method': 'uniform', 'subsample': 0.8068035                                                                     702291118, 'gamma': 6.485034058022859}. Best is trial 262 with value: 4.298540598862548.
[I 2023-12-21 03:03:22,163] Trial 294 finished with value: 4.308441617866625 and parameters: {'learning_rate': 0.7321244104297107, 'aft_l                                                                     oss_distribution': 'normal', 'aft_loss_distribution_scale': 1.4032675834374195, 'max_depth': 7, 'booster': 'dart', 'scale_pos_weight': 6.                                                                     006214545319929, 'alpha': 6.667331134829287, 'lambda': 8.072619371619432, 'eta': 0.42822403285647964, 'sampling_method': 'uniform', 'subs                                                                     ample': 0.8480169225639089, 'gamma': 7.137594060944659}. Best is trial 262 with value: 4.298540598862548.
[I 2023-12-21 03:03:24,415] Trial 295 finished with value: 4.282522474682648 and parameters: {'learning_rate': 0.7434831414239603, 'aft_l                                                                     oss_distribution': 'normal', 'aft_loss_distribution_scale': 1.292315808637286, 'max_depth': 7, 'booster': 'dart', 'scale_pos_weight': 4.9                                                                     85161358107852, 'alpha': 6.671152134680269, 'lambda': 8.611432483708615, 'eta': 0.41929689491087063, 'sampling_method': 'uniform', 'subsa                                                                     mple': 0.8469409736981502, 'gamma': 7.075973448064749}. Best is trial 295 with value: 4.282522474682648.
[I 2023-12-21 03:03:24,457] Trial 296 pruned. Trial was pruned at iteration 0.
[I 2023-12-21 03:03:25,581] Trial 297 finished with value: inf and parameters: {'learning_rate': 0.7386258230776613, 'aft_loss_distributi                                                                     on': 'normal', 'aft_loss_distribution_scale': 1.1420208588935057, 'max_depth': 7, 'booster': 'dart', 'scale_pos_weight': 5.37238588504341                                                                     3, 'alpha': 6.70905820459645, 'lambda': 8.469136156970366, 'eta': 0.3726598101985753, 'sampling_method': 'uniform', 'subsample': 0.847138                                                                     3523353685, 'gamma': 7.113723850398218}. Best is trial 295 with value: 4.282522474682648.
[I 2023-12-21 03:03:26,697] Trial 298 finished with value: inf and parameters: {'learning_rate': 0.7618838179038848, 'aft_loss_distributi                                                                     on': 'normal', 'aft_loss_distribution_scale': 1.3149021776983223, 'max_depth': 7, 'booster': 'dart', 'scale_pos_weight': 5.59737425501930                                                                     3, 'alpha': 6.9856385745445735, 'lambda': 8.162523887162035, 'eta': 0.42910273435362334, 'sampling_method': 'uniform', 'subsample': 0.825                                                                     1559558001355, 'gamma': 6.807991716343071}. Best is trial 295 with value: 4.282522474682648.
[I 2023-12-21 03:03:31,500] Trial 299 finished with value: 4.2944024165958385 and parameters: {'learning_rate': 0.7181804235301767, 'aft_                                                                     loss_distribution': 'normal', 'aft_loss_distribution_scale': 1.3539804485676317, 'max_depth': 7, 'booster': 'dart', 'scale_pos_weight': 4                                                                     .5387278474630515, 'alpha': 6.533998652101539, 'lambda': 8.666772552164787, 'eta': 0.4471236849886847, 'sampling_method': 'uniform', 'sub                                                                     sample': 0.8166381326072826, 'gamma': 7.618356130403715}. Best is trial 295 with value: 4.282522474682648.
[I 2023-12-21 03:03:31,544] Trial 300 pruned. Trial was pruned at iteration 0.
[I 2023-12-21 03:03:32,585] Trial 301 finished with value: inf and parameters: {'learning_rate': 0.7196003710410074, 'aft_loss_distributi                                                                     on': 'normal', 'aft_loss_distribution_scale': 1.0445836508073074, 'max_depth': 6, 'booster': 'dart', 'scale_pos_weight': 5.04789053605223                                                                     3, 'alpha': 6.420934745372267, 'lambda': 8.66287795746607, 'eta': 0.430998219215672, 'sampling_method': 'uniform', 'subsample': 0.8517677                                                                     286434964, 'gamma': 7.580875927136158}. Best is trial 295 with value: 4.282522474682648.
[I 2023-12-21 03:03:36,833] Trial 302 finished with value: 4.294499570796726 and parameters: {'learning_rate': 0.7906449297072513, 'aft_l                                                                     oss_distribution': 'normal', 'aft_loss_distribution_scale': 1.3052193652939166, 'max_depth': 7, 'booster': 'dart', 'scale_pos_weight': 4.                                                                     6424886537985275, 'alpha': 6.5393638218803645, 'lambda': 8.883627687056334, 'eta': 0.49230828004216326, 'sampling_method': 'uniform', 'su                                                                     bsample': 0.804712967234516, 'gamma': 6.2646684933872745}. Best is trial 295 with value: 4.282522474682648.
[I 2023-12-21 03:03:39,671] Trial 303 finished with value: 4.295089280854231 and parameters: {'learning_rate': 0.7923178820385479, 'aft_l                                                                     oss_distribution': 'normal', 'aft_loss_distribution_scale': 1.3296940614304162, 'max_depth': 7, 'booster': 'dart', 'scale_pos_weight': 4.                                                                     587688802495719, 'alpha': 6.684596811381561, 'lambda': 8.819153242382779, 'eta': 0.49150774984137613, 'sampling_method': 'uniform', 'subs                                                                     ample': 0.8375091533860414, 'gamma': 6.198991257548237}. Best is trial 295 with value: 4.282522474682648.
[I 2023-12-21 03:03:39,714] Trial 304 pruned. Trial was pruned at iteration 0.
[I 2023-12-21 03:03:40,732] Trial 305 finished with value: inf and parameters: {'learning_rate': 0.819023489338361, 'aft_loss_distributio                                                                     n': 'normal', 'aft_loss_distribution_scale': 1.2436421677137288, 'max_depth': 7, 'booster': 'dart', 'scale_pos_weight': 4.119406455197509                                                                     , 'alpha': 6.264197823740506, 'lambda': 9.140232757083421, 'eta': 0.4965563714645652, 'sampling_method': 'uniform', 'subsample': 0.832560                                                                     4382691247, 'gamma': 6.652652829352403}. Best is trial 295 with value: 4.282522474682648.
[I 2023-12-21 03:03:41,804] Trial 306 finished with value: inf and parameters: {'learning_rate': 0.7953177961720742, 'aft_loss_distributi                                                                     on': 'normal', 'aft_loss_distribution_scale': 0.9723453261743813, 'max_depth': 7, 'booster': 'dart', 'scale_pos_weight': 5.76091306233127                                                                     4, 'alpha': 6.744547065937615, 'lambda': 8.656399030670391, 'eta': 0.47936347094868964, 'sampling_method': 'uniform', 'subsample': 0.8133                                                                     511364983731, 'gamma': 7.116315539746141}. Best is trial 295 with value: 4.282522474682648.
[I 2023-12-21 03:03:42,955] Trial 307 finished with value: inf and parameters: {'learning_rate': 0.7771912789644728, 'aft_loss_distributi                                                                     on': 'normal', 'aft_loss_distribution_scale': 1.25888965054243, 'max_depth': 7, 'booster': 'dart', 'scale_pos_weight': 4.8791416903119265                                                                     , 'alpha': 8.571095184626984, 'lambda': 8.71695242766728, 'eta': 0.4517087018975109, 'sampling_method': 'uniform', 'subsample': 0.8616045                                                                     504390005, 'gamma': 6.376280015682176}. Best is trial 295 with value: 4.282522474682648.
[I 2023-12-21 03:03:42,997] Trial 308 pruned. Trial was pruned at iteration 0.
[I 2023-12-21 03:03:44,021] Trial 309 finished with value: inf and parameters: {'learning_rate': 0.797082186756727, 'aft_loss_distributio                                                                     n': 'normal', 'aft_loss_distribution_scale': 1.1309301591334802, 'max_depth': 7, 'booster': 'dart', 'scale_pos_weight': 4.197101071250318                                                                     , 'alpha': 7.010764815175384, 'lambda': 8.439288211297786, 'eta': 0.5479832019931571, 'sampling_method': 'uniform', 'subsample': 0.801558                                                                     813102693, 'gamma': 6.910201291984273}. Best is trial 295 with value: 4.282522474682648.
[I 2023-12-21 03:03:44,064] Trial 310 pruned. Trial was pruned at iteration 0.
