[I 2023-12-19 00:40:38,291] Trial 499 finished with value: inf and parameters: {'learning_rate': 0.9658296519936319, 'aft_loss_distribution': 'normal', 'aft_loss_distribution_scale': 1.708651542885427, 'max_depth': 8, 'booster': 'dart', 'scale_pos_weight': 1.2887389580241249, 'alpha': 4.2017882632924515, 'lambda': 2.4191993249031123, 'eta': 0.9401472816053694, 'sampling_method': 'gradient_based', 'subsample': 0.7635850931327067, 'gamma': 7.138894357873293}. Best is trial 346 with value: 2.018361189186848.
Completed hyperparameter tuning with best aft-nloglik = 2.018361189186848.
Re-running the best trial... params = {'verbosity': 0, 'objective': 'survival:aft', 'eval_metric': 'aft-nloglik', 'tree_method': 'gpu_hist', 'device': 'cuda', 'learning_rate': 0.999362464264445, 'aft_loss_distribution': 'normal', 'aft_loss_distribution_scale': 1.4673542889804378, 'max_depth': 3, 'booster': 'dart', 'scale_pos_weight': 1.3997840212889723, 'alpha': 0.39191489639088484, 'lambda': 2.2187571832506237, 'eta': 0.9090210425516442, 'sampling_method': 'gradient_based', 'subsample': 0.8058699248568889, 'gamma': 9.095989803598941}
[W 2023-12-19 00:40:41,045] Trial 0 is omitted in visualization because its objective value is inf or nan.
[W 2023-12-19 00:40:41,053] Trial 2 is omitted in visualization because its objective value is inf or nan.
[W 2023-12-19 00:40:41,055] Trial 5 is omitted in visualization because its objective value is inf or nan.
[W 2023-12-19 00:40:41,056] Trial 13 is omitted in visualization because its objective value is inf or nan.
[W 2023-12-19 00:40:41,058] Trial 25 is omitted in visualization because its objective value is inf or nan.
[W 2023-12-19 00:40:41,059] Trial 38 is omitted in visualization because its objective value is inf or nan.
[W 2023-12-19 00:40:41,064] Trial 42 is omitted in visualization because its objective value is inf or nan.
[W 2023-12-19 00:40:41,066] Trial 43 is omitted in visualization because its objective value is inf or nan.
[W 2023-12-19 00:40:41,067] Trial 48 is omitted in visualization because its objective value is inf or nan.
[W 2023-12-19 00:40:41,068] Trial 71 is omitted in visualization because its objective value is inf or nan.
[W 2023-12-19 00:40:41,068] Trial 73 is omitted in visualization because its objective value is inf or nan.
[W 2023-12-19 00:40:41,069] Trial 75 is omitted in visualization because its objective value is inf or nan.
[W 2023-12-19 00:40:41,070] Trial 78 is omitted in visualization because its objective value is inf or nan.
[W 2023-12-19 00:40:41,074] Trial 84 is omitted in visualization because its objective value is inf or nan.
[W 2023-12-19 00:40:41,075] Trial 113 is omitted in visualization because its objective value is inf or nan.
[W 2023-12-19 00:40:41,076] Trial 118 is omitted in visualization because its objective value is inf or nan.
[W 2023-12-19 00:40:41,077] Trial 123 is omitted in visualization because its objective value is inf or nan.
[W 2023-12-19 00:40:41,078] Trial 126 is omitted in visualization because its objective value is inf or nan.
[W 2023-12-19 00:40:41,078] Trial 134 is omitted in visualization because its objective value is inf or nan.
[W 2023-12-19 00:40:41,084] Trial 139 is omitted in visualization because its objective value is inf or nan.
[W 2023-12-19 00:40:41,084] Trial 142 is omitted in visualization because its objective value is inf or nan.
[W 2023-12-19 00:40:41,085] Trial 143 is omitted in visualization because its objective value is inf or nan.
[W 2023-12-19 00:40:41,086] Trial 146 is omitted in visualization because its objective value is inf or nan.
[W 2023-12-19 00:40:41,087] Trial 147 is omitted in visualization because its objective value is inf or nan.
[W 2023-12-19 00:40:41,088] Trial 148 is omitted in visualization because its objective value is inf or nan.
[W 2023-12-19 00:40:41,093] Trial 149 is omitted in visualization because its objective value is inf or nan.
[W 2023-12-19 00:40:41,094] Trial 150 is omitted in visualization because its objective value is inf or nan.
[W 2023-12-19 00:40:41,095] Trial 151 is omitted in visualization because its objective value is inf or nan.
[W 2023-12-19 00:40:41,095] Trial 152 is omitted in visualization because its objective value is inf or nan.
[W 2023-12-19 00:40:41,096] Trial 154 is omitted in visualization because its objective value is inf or nan.
[W 2023-12-19 00:40:41,097] Trial 156 is omitted in visualization because its objective value is inf or nan.
[W 2023-12-19 00:40:41,098] Trial 158 is omitted in visualization because its objective value is inf or nan.
[W 2023-12-19 00:40:41,099] Trial 163 is omitted in visualization because its objective value is inf or nan.
[W 2023-12-19 00:40:41,103] Trial 164 is omitted in visualization because its objective value is inf or nan.
[W 2023-12-19 00:40:41,103] Trial 165 is omitted in visualization because its objective value is inf or nan.
[W 2023-12-19 00:40:41,104] Trial 168 is omitted in visualization because its objective value is inf or nan.
[W 2023-12-19 00:40:41,105] Trial 169 is omitted in visualization because its objective value is inf or nan.
[W 2023-12-19 00:40:41,106] Trial 171 is omitted in visualization because its objective value is inf or nan.
[W 2023-12-19 00:40:41,107] Trial 174 is omitted in visualization because its objective value is inf or nan.
[W 2023-12-19 00:40:41,111] Trial 183 is omitted in visualization because its objective value is inf or nan.
[W 2023-12-19 00:40:41,112] Trial 187 is omitted in visualization because its objective value is inf or nan.
[W 2023-12-19 00:40:41,113] Trial 189 is omitted in visualization because its objective value is inf or nan.
[W 2023-12-19 00:40:41,114] Trial 192 is omitted in visualization because its objective value is inf or nan.
[W 2023-12-19 00:40:41,115] Trial 194 is omitted in visualization because its objective value is inf or nan.
[W 2023-12-19 00:40:41,116] Trial 196 is omitted in visualization because its objective value is inf or nan.
[W 2023-12-19 00:40:41,117] Trial 197 is omitted in visualization because its objective value is inf or nan.
[W 2023-12-19 00:40:41,118] Trial 201 is omitted in visualization because its objective value is inf or nan.
[W 2023-12-19 00:40:41,119] Trial 202 is omitted in visualization because its objective value is inf or nan.
[W 2023-12-19 00:40:41,120] Trial 204 is omitted in visualization because its objective value is inf or nan.
[W 2023-12-19 00:40:41,121] Trial 206 is omitted in visualization because its objective value is inf or nan.
[W 2023-12-19 00:40:41,124] Trial 210 is omitted in visualization because its objective value is inf or nan.
[W 2023-12-19 00:40:41,130] Trial 211 is omitted in visualization because its objective value is inf or nan.
[W 2023-12-19 00:40:41,131] Trial 212 is omitted in visualization because its objective value is inf or nan.
[W 2023-12-19 00:40:41,132] Trial 216 is omitted in visualization because its objective value is inf or nan.
[W 2023-12-19 00:40:41,133] Trial 217 is omitted in visualization because its objective value is inf or nan.
[W 2023-12-19 00:40:41,134] Trial 223 is omitted in visualization because its objective value is inf or nan.
[W 2023-12-19 00:40:41,135] Trial 224 is omitted in visualization because its objective value is inf or nan.
[W 2023-12-19 00:40:41,138] Trial 227 is omitted in visualization because its objective value is inf or nan.
[W 2023-12-19 00:40:41,139] Trial 230 is omitted in visualization because its objective value is inf or nan.
[W 2023-12-19 00:40:41,140] Trial 232 is omitted in visualization because its objective value is inf or nan.
[W 2023-12-19 00:40:41,145] Trial 238 is omitted in visualization because its objective value is inf or nan.
[W 2023-12-19 00:40:41,145] Trial 244 is omitted in visualization because its objective value is inf or nan.
[W 2023-12-19 00:40:41,146] Trial 246 is omitted in visualization because its objective value is inf or nan.
[W 2023-12-19 00:40:41,147] Trial 247 is omitted in visualization because its objective value is inf or nan.
[W 2023-12-19 00:40:41,148] Trial 251 is omitted in visualization because its objective value is inf or nan.
[W 2023-12-19 00:40:41,149] Trial 257 is omitted in visualization because its objective value is inf or nan.
[W 2023-12-19 00:40:41,151] Trial 267 is omitted in visualization because its objective value is inf or nan.
[W 2023-12-19 00:40:41,152] Trial 273 is omitted in visualization because its objective value is inf or nan.
[W 2023-12-19 00:40:41,152] Trial 280 is omitted in visualization because its objective value is inf or nan.
[W 2023-12-19 00:40:41,153] Trial 284 is omitted in visualization because its objective value is inf or nan.
[W 2023-12-19 00:40:41,154] Trial 285 is omitted in visualization because its objective value is inf or nan.
[W 2023-12-19 00:40:41,155] Trial 286 is omitted in visualization because its objective value is inf or nan.
[W 2023-12-19 00:40:41,156] Trial 289 is omitted in visualization because its objective value is inf or nan.
[W 2023-12-19 00:40:41,159] Trial 290 is omitted in visualization because its objective value is inf or nan.
[W 2023-12-19 00:40:41,160] Trial 296 is omitted in visualization because its objective value is inf or nan.
[W 2023-12-19 00:40:41,164] Trial 306 is omitted in visualization because its objective value is inf or nan.
[W 2023-12-19 00:40:41,165] Trial 314 is omitted in visualization because its objective value is inf or nan.
[W 2023-12-19 00:40:41,166] Trial 315 is omitted in visualization because its objective value is inf or nan.
[W 2023-12-19 00:40:41,166] Trial 316 is omitted in visualization because its objective value is inf or nan.
[W 2023-12-19 00:40:41,167] Trial 317 is omitted in visualization because its objective value is inf or nan.
[W 2023-12-19 00:40:41,168] Trial 320 is omitted in visualization because its objective value is inf or nan.
[W 2023-12-19 00:40:41,169] Trial 325 is omitted in visualization because its objective value is inf or nan.
[W 2023-12-19 00:40:41,170] Trial 333 is omitted in visualization because its objective value is inf or nan.
[W 2023-12-19 00:40:41,171] Trial 339 is omitted in visualization because its objective value is inf or nan.
[W 2023-12-19 00:40:41,177] Trial 340 is omitted in visualization because its objective value is inf or nan.
[W 2023-12-19 00:40:41,178] Trial 343 is omitted in visualization because its objective value is inf or nan.
[W 2023-12-19 00:40:41,179] Trial 344 is omitted in visualization because its objective value is inf or nan.
[W 2023-12-19 00:40:41,180] Trial 348 is omitted in visualization because its objective value is inf or nan.
[W 2023-12-19 00:40:41,180] Trial 351 is omitted in visualization because its objective value is inf or nan.
[W 2023-12-19 00:40:41,181] Trial 355 is omitted in visualization because its objective value is inf or nan.
[W 2023-12-19 00:40:41,191] Trial 358 is omitted in visualization because its objective value is inf or nan.
[W 2023-12-19 00:40:41,192] Trial 359 is omitted in visualization because its objective value is inf or nan.
[W 2023-12-19 00:40:41,193] Trial 364 is omitted in visualization because its objective value is inf or nan.
[W 2023-12-19 00:40:41,194] Trial 365 is omitted in visualization because its objective value is inf or nan.
[W 2023-12-19 00:40:41,195] Trial 366 is omitted in visualization because its objective value is inf or nan.
[W 2023-12-19 00:40:41,200] Trial 367 is omitted in visualization because its objective value is inf or nan.
[W 2023-12-19 00:40:41,201] Trial 372 is omitted in visualization because its objective value is inf or nan.
[W 2023-12-19 00:40:41,201] Trial 373 is omitted in visualization because its objective value is inf or nan.
[W 2023-12-19 00:40:41,202] Trial 394 is omitted in visualization because its objective value is inf or nan.
[W 2023-12-19 00:40:41,203] Trial 403 is omitted in visualization because its objective value is inf or nan.
[W 2023-12-19 00:40:41,204] Trial 404 is omitted in visualization because its objective value is inf or nan.
[W 2023-12-19 00:40:41,205] Trial 408 is omitted in visualization because its objective value is inf or nan.
[W 2023-12-19 00:40:41,206] Trial 412 is omitted in visualization because its objective value is inf or nan.
[W 2023-12-19 00:40:41,207] Trial 413 is omitted in visualization because its objective value is inf or nan.
[W 2023-12-19 00:40:41,208] Trial 414 is omitted in visualization because its objective value is inf or nan.
[W 2023-12-19 00:40:41,208] Trial 420 is omitted in visualization because its objective value is inf or nan.
[W 2023-12-19 00:40:41,209] Trial 426 is omitted in visualization because its objective value is inf or nan.
[W 2023-12-19 00:40:41,210] Trial 433 is omitted in visualization because its objective value is inf or nan.
[W 2023-12-19 00:40:41,211] Trial 436 is omitted in visualization because its objective value is inf or nan.
[W 2023-12-19 00:40:41,212] Trial 438 is omitted in visualization because its objective value is inf or nan.
[W 2023-12-19 00:40:41,213] Trial 442 is omitted in visualization because its objective value is inf or nan.
[W 2023-12-19 00:40:41,214] Trial 446 is omitted in visualization because its objective value is inf or nan.
[W 2023-12-19 00:40:41,214] Trial 455 is omitted in visualization because its objective value is inf or nan.
[W 2023-12-19 00:40:41,215] Trial 467 is omitted in visualization because its objective value is inf or nan.
[W 2023-12-19 00:40:41,216] Trial 471 is omitted in visualization because its objective value is inf or nan.
[W 2023-12-19 00:40:41,217] Trial 481 is omitted in visualization because its objective value is inf or nan.
[W 2023-12-19 00:40:41,218] Trial 499 is omitted in visualization because its objective value is inf or nan.
TRN1 | R2:0.202; p:2.289e-59 | C:61.74 |3h:0.960 |6h:0.948 |9h:0.941 |12h:0.733 |15h:0.733 |18h:0.729 |24h:0.574 |48h:0.567 |72h:0.559 |1wk:0.380 |2wks:0.375 |1mon:0.328 |
TRN2 | R2:0.136; p:1.439e-27 | C:58.23 |3h:0.960 |6h:0.949 |9h:0.941 |12h:0.732 |15h:0.732 |18h:0.729 |24h:0.574 |48h:0.567 |72h:0.558 |1wk:0.383 |2wks:0.374 |1mon:0.326 |
VAL | R2:0.148; p:1.652e-32 | C:58.70 |3h:0.960 |6h:0.949 |9h:0.941 |12h:0.733 |15h:0.733 |18h:0.729 |24h:0.574 |48h:0.567 |72h:0.558 |1wk:0.383 |2wks:0.373 |1mon:0.326 |
[I 2023-12-19 00:40:48,627] A new study created in memory with name: no-name-723039e5-b8bf-4d8e-8ff1-64455f4834e4
TST | R2:0.113; p:1.264e-56 | C:56.56 |3h:0.954 |6h:0.939 |9h:0.930 |12h:0.727 |15h:0.727 |18h:0.712 |24h:0.442 |48h:0.441 |72h:0.437 |1wk:0.349 |2wks:0.356 |1mon:0.327 |
/content/drive/MyDrive/intermediates2/res//outcome2_xgb-aft_inp23_k3_emb3_rdims8.json
Dimensionality reduced word embedding 4 with ['location_numeric', 'race_numeric', 'sex_numeric']
Dimensionality reduced word embedding 4 with ['location_numeric', 'race_numeric', 'sex_numeric']
Dimensionality reduced word embedding 4 with ['location_numeric', 'race_numeric', 'sex_numeric']
Dimensionality reduced word embedding 4 with ['location_numeric', 'race_numeric', 'sex_numeric']
trn1
trn2
val
tst
[I 2023-12-19 00:40:58,208] Trial 0 finished with value: 2.3389119151588615 and parameters: {'learning_rate': 0.45213943338868573, 'aft_loss_distribution': 'extreme', 'aft_loss_distribution_scale': 3.990407963512444, 'max_depth': 3, 'booster': 'dart', 'scale_pos_weight': 0.3286994563209162, 'alpha': 8.635308131270616, 'lambda': 1.0547719119119336, 'eta': 0.007714665417818067, 'sampling_method': 'uniform', 'subsample': 0.8256991475909116, 'gamma': 8.84957556000762}. Best is trial 0 with value: 2.3389119151588615.
[I 2023-12-19 00:41:01,064] Trial 1 finished with value: inf and parameters: {'learning_rate': 0.4610442430638069, 'aft_loss_distribution': 'extreme', 'aft_loss_distribution_scale': 5.38343566698898, 'max_depth': 7, 'booster': 'dart', 'scale_pos_weight': 2.966489228830314, 'alpha': 6.541193887920635, 'lambda': 2.349522510005552, 'eta': 0.3785467980191103, 'sampling_method': 'gradient_based', 'subsample': 0.9378138648470038, 'gamma': 0.8901616468043626}. Best is trial 0 with value: 2.3389119151588615.
[I 2023-12-19 00:41:01,300] Trial 2 finished with value: inf and parameters: {'learning_rate': 0.7184328701743163, 'aft_loss_distribution': 'extreme', 'aft_loss_distribution_scale': 1.2075999955652459, 'max_depth': 8, 'booster': 'gbtree', 'scale_pos_weight': 1.1555307052814079, 'alpha': 1.5236869589372302, 'lambda': 2.1283650718859572, 'eta': 0.06615423294262446, 'sampling_method': 'uniform', 'subsample': 0.6938257456467073, 'gamma': 3.818750270855839}. Best is trial 0 with value: 2.3389119151588615.
[I 2023-12-19 00:41:01,715] Trial 3 finished with value: 2.3962717410640693 and parameters: {'learning_rate': 0.2855834523758651, 'aft_loss_distribution': 'normal', 'aft_loss_distribution_scale': 6.6762023690124215, 'max_depth': 7, 'booster': 'gbtree', 'scale_pos_weight': 2.659859969703055, 'alpha': 6.579161487986297, 'lambda': 5.7350228470546565, 'eta': 0.4627578944575482, 'sampling_method': 'gradient_based', 'subsample': 0.6659090399186518, 'gamma': 4.160028688602865}. Best is trial 0 with value: 2.3389119151588615.
[I 2023-12-19 00:41:47,448] Trial 4 finished with value: 2.658651696641317 and parameters: {'learning_rate': 0.8812515071529506, 'aft_loss_distribution': 'extreme', 'aft_loss_distribution_scale': 9.694425295117673, 'max_depth': 8, 'booster': 'dart', 'scale_pos_weight': 2.56290421110761, 'alpha': 5.78215763479604, 'lambda': 5.892097921123179, 'eta': 0.10787503913734142, 'sampling_method': 'gradient_based', 'subsample': 0.46512121266611384, 'gamma': 9.55247984201762}. Best is trial 0 with value: 2.3389119151588615.
[I 2023-12-19 00:41:47,475] Trial 5 pruned. Trial was pruned at iteration 1.
[I 2023-12-19 00:41:47,488] Trial 6 pruned. Trial was pruned at iteration 2.
[I 2023-12-19 00:41:47,498] Trial 7 pruned. Trial was pruned at iteration 0.
[I 2023-12-19 00:41:47,911] Trial 8 finished with value: inf and parameters: {'learning_rate': 0.16717342748628375, 'aft_loss_distribution': 'logistic', 'aft_loss_distribution_scale': 3.11282945121794, 'max_depth': 10, 'booster': 'gbtree', 'scale_pos_weight': 0.8381315317221952, 'alpha': 7.26926835439171, 'lambda': 2.460261189747592, 'eta': 0.5286591009499668, 'sampling_method': 'gradient_based', 'subsample': 0.03455590696089888, 'gamma': 0.2753185850652876}. Best is trial 0 with value: 2.3389119151588615.
[I 2023-12-19 00:41:47,926] Trial 9 pruned. Trial was pruned at iteration 3.
[I 2023-12-19 00:41:49,547] Trial 10 finished with value: inf and parameters: {'learning_rate': 0.544250079586049, 'aft_loss_distribution': 'logistic', 'aft_loss_distribution_scale': 2.7276549799832503, 'max_depth': 5, 'booster': 'dart', 'scale_pos_weight': 0.16558400249847804, 'alpha': 9.906916833564514, 'lambda': 8.470229164797718, 'eta': 0.9023862853005528, 'sampling_method': 'uniform', 'subsample': 0.6893837732168424, 'gamma': 9.438496944708884}. Best is trial 0 with value: 2.3389119151588615.
[I 2023-12-19 00:41:49,613] Trial 11 pruned. Trial was pruned at iteration 6.
[I 2023-12-19 00:41:49,688] Trial 12 pruned. Trial was pruned at iteration 5.
[I 2023-12-19 00:41:49,741] Trial 13 pruned. Trial was pruned at iteration 0.
[I 2023-12-19 00:41:50,059] Trial 14 finished with value: 2.264777180707476 and parameters: {'learning_rate': 0.39967322179373604, 'aft_loss_distribution': 'normal', 'aft_loss_distribution_scale': 4.54188046232138, 'max_depth': 6, 'booster': 'gbtree', 'scale_pos_weight': 1.980656316639999, 'alpha': 9.832287232659606, 'lambda': 3.6523935070929285, 'eta': 0.7652475427199391, 'sampling_method': 'gradient_based', 'subsample': 0.9991970222926341, 'gamma': 7.726901566427901}. Best is trial 14 with value: 2.264777180707476.
[I 2023-12-19 00:41:50,122] Trial 15 pruned. Trial was pruned at iteration 0.
[I 2023-12-19 00:41:50,185] Trial 16 pruned. Trial was pruned at iteration 0.
[I 2023-12-19 00:41:50,240] Trial 17 pruned. Trial was pruned at iteration 0.
[I 2023-12-19 00:41:50,304] Trial 18 pruned. Trial was pruned at iteration 0.
[I 2023-12-19 00:41:50,376] Trial 19 pruned. Trial was pruned at iteration 3.
[I 2023-12-19 00:41:50,432] Trial 20 pruned. Trial was pruned at iteration 0.
[I 2023-12-19 00:41:50,495] Trial 21 pruned. Trial was pruned at iteration 3.
[I 2023-12-19 00:41:50,551] Trial 22 pruned. Trial was pruned at iteration 0.
[I 2023-12-19 00:41:50,622] Trial 23 pruned. Trial was pruned at iteration 5.
[I 2023-12-19 00:41:51,020] Trial 24 finished with value: 2.2400618577588425 and parameters: {'learning_rate': 0.4234320149451939, 'aft_loss_distribution': 'normal', 'aft_loss_distribution_scale': 4.262129704915158, 'max_depth': 9, 'booster': 'gbtree', 'scale_pos_weight': 2.046143367291371, 'alpha': 8.684745661765813, 'lambda': 0.880256934712552, 'eta': 0.45561840896184774, 'sampling_method': 'gradient_based', 'subsample': 0.7440544714364878, 'gamma': 5.109201897372269}. Best is trial 24 with value: 2.2400618577588425.
[I 2023-12-19 00:41:51,274] Trial 25 finished with value: 2.240540999759215 and parameters: {'learning_rate': 0.5639016099216589, 'aft_loss_distribution': 'normal', 'aft_loss_distribution_scale': 4.242217084555466, 'max_depth': 9, 'booster': 'gbtree', 'scale_pos_weight': 1.3813354663498305, 'alpha': 9.21575900819894, 'lambda': 1.0415064226283293, 'eta': 0.7903187048613343, 'sampling_method': 'gradient_based', 'subsample': 0.7628807934192661, 'gamma': 9.121653259723649}. Best is trial 24 with value: 2.2400618577588425.
