[I 2023-12-18 23:56:12,494] Trial 111 finished with value: 4.387541829210265 and parameters: {'learning_rate': 0.6649344402612085, 'aft_loss_distribution': 'normal', 'aft_loss_distribution_scale': 1.6261040081637024, 'max_depth': 9, 'booster': 'dart', 'scale_pos_weight': 1.087568276535261, 'alpha': 4.405371994923406, 'lambda': 1.2358371855259973, 'eta': 0.6183448964188276, 'sampling_method': 'uniform', 'subsample': 0.5266319400303987, 'gamma': 9.137689450994447}. Best is trial 27 with value: 4.291541471809494.
[I 2023-12-18 23:56:18,881] Trial 112 finished with value: 4.384268679708423 and parameters: {'learning_rate': 0.6268889174265257, 'aft_loss_distribution': 'normal', 'aft_loss_distribution_scale': 1.6259214122493484, 'max_depth': 9, 'booster': 'dart', 'scale_pos_weight': 0.813857373158638, 'alpha': 3.9053595887276873, 'lambda': 0.6042364643421737, 'eta': 0.6138509641023554, 'sampling_method': 'uniform', 'subsample': 0.5063102348677527, 'gamma': 8.697417041706464}. Best is trial 27 with value: 4.291541471809494.
[I 2023-12-18 23:56:19,003] Trial 113 pruned. Trial was pruned at iteration 0.
[I 2023-12-18 23:56:21,332] Trial 114 finished with value: inf and parameters: {'learning_rate': 0.7944510288014204, 'aft_loss_distribution': 'normal', 'aft_loss_distribution_scale': 1.141799066508519, 'max_depth': 10, 'booster': 'dart', 'scale_pos_weight': 2.099226285526823, 'alpha': 4.1083117065704915, 'lambda': 0.44483244250222587, 'eta': 0.6012393996322039, 'sampling_method': 'uniform', 'subsample': 0.5225095357742293, 'gamma': 8.331031131626824}. Best is trial 27 with value: 4.291541471809494.
[I 2023-12-18 23:56:21,397] Trial 115 pruned. Trial was pruned at iteration 0.
[I 2023-12-18 23:56:21,460] Trial 116 pruned. Trial was pruned at iteration 0.
[I 2023-12-18 23:56:21,523] Trial 117 pruned. Trial was pruned at iteration 0.
[I 2023-12-18 23:56:21,639] Trial 118 pruned. Trial was pruned at iteration 0.
[I 2023-12-18 23:56:21,712] Trial 119 pruned. Trial was pruned at iteration 1.
[I 2023-12-18 23:56:21,777] Trial 120 pruned. Trial was pruned at iteration 0.
[I 2023-12-18 23:56:21,855] Trial 121 pruned. Trial was pruned at iteration 1.
[I 2023-12-18 23:56:53,472] Trial 122 finished with value: 4.37470342128768 and parameters: {'learning_rate': 0.6570778789126555, 'aft_loss_distribution': 'normal', 'aft_loss_distribution_scale': 1.5978518245498046, 'max_depth': 10, 'booster': 'dart', 'scale_pos_weight': 1.283356006058485, 'alpha': 9.210722913613022, 'lambda': 1.8145099713141415, 'eta': 0.5448893805877342, 'sampling_method': 'uniform', 'subsample': 0.5262776207923331, 'gamma': 9.144610522536466}. Best is trial 27 with value: 4.291541471809494.
[I 2023-12-18 23:56:53,555] Trial 123 pruned. Trial was pruned at iteration 0.
[I 2023-12-18 23:56:53,629] Trial 124 pruned. Trial was pruned at iteration 0.
[I 2023-12-18 23:56:53,777] Trial 125 pruned. Trial was pruned at iteration 0.
[I 2023-12-18 23:56:53,842] Trial 126 pruned. Trial was pruned at iteration 0.
[I 2023-12-18 23:57:02,018] Trial 127 finished with value: 4.388249270111238 and parameters: {'learning_rate': 0.7203699681463287, 'aft_loss_distribution': 'normal', 'aft_loss_distribution_scale': 1.639517573387022, 'max_depth': 10, 'booster': 'dart', 'scale_pos_weight': 0.10492160743462284, 'alpha': 3.0739812970169544, 'lambda': 2.7004685079794966, 'eta': 0.15075204253459973, 'sampling_method': 'uniform', 'subsample': 0.6245580790456642, 'gamma': 9.311202111333209}. Best is trial 27 with value: 4.291541471809494.
[I 2023-12-18 23:57:02,127] Trial 128 pruned. Trial was pruned at iteration 0.
[I 2023-12-18 23:57:02,236] Trial 129 pruned. Trial was pruned at iteration 0.
[I 2023-12-18 23:57:02,336] Trial 130 pruned. Trial was pruned at iteration 0.
[I 2023-12-18 23:57:04,066] Trial 131 finished with value: inf and parameters: {'learning_rate': 0.7188249546486536, 'aft_loss_distribution': 'normal', 'aft_loss_distribution_scale': 1.5126388542946652, 'max_depth': 10, 'booster': 'dart', 'scale_pos_weight': 0.416878669337032, 'alpha': 1.7417517176160469, 'lambda': 2.2760004577653126, 'eta': 0.1738457134749319, 'sampling_method': 'uniform', 'subsample': 0.5008203946114506, 'gamma': 9.762118880991325}. Best is trial 27 with value: 4.291541471809494.
[I 2023-12-18 23:57:04,176] Trial 132 pruned. Trial was pruned at iteration 2.
[I 2023-12-18 23:57:05,965] Trial 133 finished with value: inf and parameters: {'learning_rate': 0.6909585062944354, 'aft_loss_distribution': 'normal', 'aft_loss_distribution_scale': 1.3221230596718838, 'max_depth': 10, 'booster': 'dart', 'scale_pos_weight': 0.6929684548237054, 'alpha': 3.1175990132355116, 'lambda': 2.0974308518828253, 'eta': 0.21534910591953205, 'sampling_method': 'uniform', 'subsample': 0.2108943319832919, 'gamma': 9.967124940388032}. Best is trial 27 with value: 4.291541471809494.
[I 2023-12-18 23:57:06,037] Trial 134 pruned. Trial was pruned at iteration 0.
[I 2023-12-18 23:57:06,165] Trial 135 pruned. Trial was pruned at iteration 1.
[I 2023-12-18 23:57:39,100] Trial 136 finished with value: 4.374746913351047 and parameters: {'learning_rate': 0.6373460682688367, 'aft_loss_distribution': 'normal', 'aft_loss_distribution_scale': 1.6109301436035395, 'max_depth': 10, 'booster': 'dart', 'scale_pos_weight': 1.2150312863813508, 'alpha': 8.111754732111484, 'lambda': 5.411241320268527, 'eta': 0.8960945483201849, 'sampling_method': 'uniform', 'subsample': 0.5204338462606993, 'gamma': 9.310426610950772}. Best is trial 27 with value: 4.291541471809494.
[I 2023-12-18 23:57:39,176] Trial 137 pruned. Trial was pruned at iteration 0.
[I 2023-12-18 23:57:39,253] Trial 138 pruned. Trial was pruned at iteration 0.
[I 2023-12-18 23:57:39,325] Trial 139 pruned. Trial was pruned at iteration 0.
[I 2023-12-18 23:57:39,390] Trial 140 pruned. Trial was pruned at iteration 0.
[I 2023-12-18 23:57:39,502] Trial 141 pruned. Trial was pruned at iteration 2.
[I 2023-12-18 23:57:55,743] Trial 142 finished with value: 4.3742957341978315 and parameters: {'learning_rate': 0.6687909736921622, 'aft_loss_distribution': 'normal', 'aft_loss_distribution_scale': 1.6092075911941632, 'max_depth': 10, 'booster': 'dart', 'scale_pos_weight': 0.2810594535524467, 'alpha': 7.9701321787030075, 'lambda': 5.137605560344655, 'eta': 0.1409224863906042, 'sampling_method': 'uniform', 'subsample': 0.4195915036985136, 'gamma': 9.332970709986164}. Best is trial 27 with value: 4.291541471809494.
[I 2023-12-18 23:57:55,835] Trial 143 pruned. Trial was pruned at iteration 0.
[I 2023-12-18 23:57:55,904] Trial 144 pruned. Trial was pruned at iteration 0.
[I 2023-12-18 23:57:55,986] Trial 145 pruned. Trial was pruned at iteration 0.
[I 2023-12-18 23:57:56,056] Trial 146 pruned. Trial was pruned at iteration 0.
[I 2023-12-18 23:57:58,342] Trial 147 finished with value: inf and parameters: {'learning_rate': 0.6926536076507542, 'aft_loss_distribution': 'normal', 'aft_loss_distribution_scale': 1.3350881672617685, 'max_depth': 10, 'booster': 'dart', 'scale_pos_weight': 0.5363413188662953, 'alpha': 9.354524666805395, 'lambda': 5.878210937501973, 'eta': 0.5154317395509437, 'sampling_method': 'uniform', 'subsample': 0.41401454173735175, 'gamma': 9.21357949449774}. Best is trial 27 with value: 4.291541471809494.
[I 2023-12-18 23:57:58,462] Trial 148 pruned. Trial was pruned at iteration 0.
[I 2023-12-18 23:58:00,935] Trial 149 finished with value: inf and parameters: {'learning_rate': 0.759628559245047, 'aft_loss_distribution': 'normal', 'aft_loss_distribution_scale': 1.1308858984470438, 'max_depth': 9, 'booster': 'dart', 'scale_pos_weight': 3.8457825645530956, 'alpha': 8.309929159731293, 'lambda': 0.2992928724989611, 'eta': 0.5989706625680661, 'sampling_method': 'uniform', 'subsample': 0.36607302064499914, 'gamma': 9.057942197137995}. Best is trial 27 with value: 4.291541471809494.
[I 2023-12-18 23:58:01,021] Trial 150 pruned. Trial was pruned at iteration 0.
[I 2023-12-18 23:58:01,092] Trial 151 pruned. Trial was pruned at iteration 1.
[I 2023-12-18 23:58:01,168] Trial 152 pruned. Trial was pruned at iteration 1.
[I 2023-12-18 23:58:02,695] Trial 153 finished with value: inf and parameters: {'learning_rate': 0.7054042637596185, 'aft_loss_distribution': 'normal', 'aft_loss_distribution_scale': 1.2886033033418278, 'max_depth': 9, 'booster': 'dart', 'scale_pos_weight': 0.46248874600905027, 'alpha': 8.046345028942085, 'lambda': 4.716605966760831, 'eta': 0.1010306995617864, 'sampling_method': 'uniform', 'subsample': 0.5064278674467552, 'gamma': 9.735905326712565}. Best is trial 27 with value: 4.291541471809494.
[I 2023-12-18 23:58:02,773] Trial 154 pruned. Trial was pruned at iteration 1.
[I 2023-12-18 23:58:02,841] Trial 155 pruned. Trial was pruned at iteration 0.
[I 2023-12-18 23:58:02,944] Trial 156 pruned. Trial was pruned at iteration 0.
[I 2023-12-18 23:58:03,026] Trial 157 pruned. Trial was pruned at iteration 1.
[I 2023-12-18 23:58:04,996] Trial 158 finished with value: inf and parameters: {'learning_rate': 0.6603485332244505, 'aft_loss_distribution': 'normal', 'aft_loss_distribution_scale': 1.4755760727631155, 'max_depth': 9, 'booster': 'dart', 'scale_pos_weight': 1.094353695315451, 'alpha': 5.179063550114979, 'lambda': 5.13324606757405, 'eta': 0.8399203879131779, 'sampling_method': 'uniform', 'subsample': 0.5463503264780463, 'gamma': 9.6325898496842}. Best is trial 27 with value: 4.291541471809494.
[I 2023-12-18 23:58:05,078] Trial 159 pruned. Trial was pruned at iteration 0.
[I 2023-12-18 23:58:05,141] Trial 160 pruned. Trial was pruned at iteration 0.
[I 2023-12-18 23:58:05,227] Trial 161 pruned. Trial was pruned at iteration 1.
[I 2023-12-18 23:58:07,122] Trial 162 finished with value: inf and parameters: {'learning_rate': 0.6827943625624929, 'aft_loss_distribution': 'normal', 'aft_loss_distribution_scale': 1.3183561875134617, 'max_depth': 8, 'booster': 'dart', 'scale_pos_weight': 0.5351514077010269, 'alpha': 7.944007473468646, 'lambda': 1.620148529201561, 'eta': 0.07153337278474915, 'sampling_method': 'uniform', 'subsample': 0.6284106176236337, 'gamma': 9.572324158188064}. Best is trial 27 with value: 4.291541471809494.
[I 2023-12-18 23:58:07,191] Trial 163 pruned. Trial was pruned at iteration 0.
[I 2023-12-18 23:58:08,916] Trial 164 finished with value: inf and parameters: {'learning_rate': 0.6927919990448006, 'aft_loss_distribution': 'normal', 'aft_loss_distribution_scale': 1.2624636744031328, 'max_depth': 8, 'booster': 'dart', 'scale_pos_weight': 0.33965097640267944, 'alpha': 4.018951767973743, 'lambda': 2.7915740737933326, 'eta': 0.20524519035846295, 'sampling_method': 'uniform', 'subsample': 0.5610232476923797, 'gamma': 9.741279974711134}. Best is trial 27 with value: 4.291541471809494.
[I 2023-12-18 23:58:08,986] Trial 165 pruned. Trial was pruned at iteration 0.
[I 2023-12-18 23:58:09,052] Trial 166 pruned. Trial was pruned at iteration 0.
[I 2023-12-18 23:58:09,148] Trial 167 pruned. Trial was pruned at iteration 0.
[I 2023-12-18 23:58:09,225] Trial 168 pruned. Trial was pruned at iteration 0.
[I 2023-12-18 23:58:12,410] Trial 169 finished with value: 4.320351433718957 and parameters: {'learning_rate': 0.7813574471367252, 'aft_loss_distribution': 'normal', 'aft_loss_distribution_scale': 1.4563102608693996, 'max_depth': 3, 'booster': 'dart', 'scale_pos_weight': 0.29416325246258973, 'alpha': 7.741529357095335, 'lambda': 1.099537846389446, 'eta': 0.5892623096220039, 'sampling_method': 'uniform', 'subsample': 0.5087860273689134, 'gamma': 9.781284594982626}. Best is trial 27 with value: 4.291541471809494.
[I 2023-12-18 23:58:12,546] Trial 170 pruned. Trial was pruned at iteration 0.
[I 2023-12-18 23:58:14,410] Trial 171 finished with value: inf and parameters: {'learning_rate': 0.8253351681142553, 'aft_loss_distribution': 'normal', 'aft_loss_distribution_scale': 1.4197780896987733, 'max_depth': 6, 'booster': 'dart', 'scale_pos_weight': 0.49979590593299095, 'alpha': 7.150732469176632, 'lambda': 1.0303914368284561, 'eta': 0.6431777748704282, 'sampling_method': 'uniform', 'subsample': 0.5103981299902799, 'gamma': 9.616184092280369}. Best is trial 27 with value: 4.291541471809494.
[I 2023-12-18 23:58:14,547] Trial 172 pruned. Trial was pruned at iteration 2.
[I 2023-12-18 23:58:14,653] Trial 173 pruned. Trial was pruned at iteration 0.
[I 2023-12-18 23:58:25,100] Trial 174 finished with value: 4.31669995854902 and parameters: {'learning_rate': 0.675707238177154, 'aft_loss_distribution': 'normal', 'aft_loss_distribution_scale': 1.4326661371911695, 'max_depth': 10, 'booster': 'dart', 'scale_pos_weight': 0.3200405883058772, 'alpha': 7.914360471588422, 'lambda': 1.280199532011614, 'eta': 0.5892699877969245, 'sampling_method': 'uniform', 'subsample': 0.49701718558301516, 'gamma': 9.258235537175597}. Best is trial 27 with value: 4.291541471809494.
[I 2023-12-18 23:58:27,148] Trial 175 finished with value: inf and parameters: {'learning_rate': 0.7463082412088218, 'aft_loss_distribution': 'normal', 'aft_loss_distribution_scale': 1.3809484826399139, 'max_depth': 10, 'booster': 'dart', 'scale_pos_weight': 0.2653175150150297, 'alpha': 7.864453633751166, 'lambda': 1.2528405654572332, 'eta': 0.5809762701434332, 'sampling_method': 'uniform', 'subsample': 0.4879835454326855, 'gamma': 9.20890971976916}. Best is trial 27 with value: 4.291541471809494.
[I 2023-12-18 23:58:27,264] Trial 176 pruned. Trial was pruned at iteration 0.
[I 2023-12-18 23:58:29,744] Trial 177 finished with value: inf and parameters: {'learning_rate': 0.7826910769743587, 'aft_loss_distribution': 'normal', 'aft_loss_distribution_scale': 1.5346320164392682, 'max_depth': 10, 'booster': 'dart', 'scale_pos_weight': 0.8637404151692403, 'alpha': 7.558168458371938, 'lambda': 0.6503625565124088, 'eta': 0.6321661749523153, 'sampling_method': 'uniform', 'subsample': 0.529336078386734, 'gamma': 9.034958425282126}. Best is trial 27 with value: 4.291541471809494.
[I 2023-12-18 23:58:29,871] Trial 178 pruned. Trial was pruned at iteration 1.
[I 2023-12-18 23:58:31,602] Trial 179 finished with value: inf and parameters: {'learning_rate': 0.8041209471038252, 'aft_loss_distribution': 'normal', 'aft_loss_distribution_scale': 1.2285224098067227, 'max_depth': 10, 'booster': 'dart', 'scale_pos_weight': 8.60481652995932, 'alpha': 8.206173886868648, 'lambda': 0.4407947751465871, 'eta': 0.8826855094529297, 'sampling_method': 'uniform', 'subsample': 0.4546792045133799, 'gamma': 9.1950688994395}. Best is trial 27 with value: 4.291541471809494.
[I 2023-12-18 23:58:31,720] Trial 180 pruned. Trial was pruned at iteration 0.
[I 2023-12-18 23:58:31,783] Trial 181 pruned. Trial was pruned at iteration 0.
[I 2023-12-18 23:58:37,292] Trial 182 finished with value: 4.326731952737361 and parameters: {'learning_rate': 0.6672425551581943, 'aft_loss_distribution': 'normal', 'aft_loss_distribution_scale': 1.4615855026603406, 'max_depth': 10, 'booster': 'dart', 'scale_pos_weight': 0.4555467730772062, 'alpha': 7.735217071475087, 'lambda': 1.6415467819145018, 'eta': 0.6185783855124583, 'sampling_method': 'uniform', 'subsample': 0.5981378185436536, 'gamma': 9.82966719545058}. Best is trial 27 with value: 4.291541471809494.
[I 2023-12-18 23:58:40,911] Trial 183 finished with value: 4.337223021708761 and parameters: {'learning_rate': 0.6764021580125478, 'aft_loss_distribution': 'normal', 'aft_loss_distribution_scale': 1.4948065791503344, 'max_depth': 10, 'booster': 'dart', 'scale_pos_weight': 0.36966538235076196, 'alpha': 7.80663740754538, 'lambda': 1.6909488767363707, 'eta': 0.618239599659714, 'sampling_method': 'uniform', 'subsample': 0.5644358811361296, 'gamma': 9.838571434208415}. Best is trial 27 with value: 4.291541471809494.
[I 2023-12-18 23:58:46,626] Trial 184 finished with value: 4.317243700125658 and parameters: {'learning_rate': 0.7049951989098951, 'aft_loss_distribution': 'normal', 'aft_loss_distribution_scale': 1.42881211328172, 'max_depth': 10, 'booster': 'dart', 'scale_pos_weight': 0.3775898558630676, 'alpha': 7.769686723229104, 'lambda': 1.7421703116329914, 'eta': 0.6402502236192473, 'sampling_method': 'uniform', 'subsample': 0.587666363437319, 'gamma': 9.806562091687347}. Best is trial 27 with value: 4.291541471809494.
[I 2023-12-18 23:58:49,163] Trial 185 finished with value: inf and parameters: {'learning_rate': 0.672899794245808, 'aft_loss_distribution': 'normal', 'aft_loss_distribution_scale': 1.4192788828473473, 'max_depth': 5, 'booster': 'dart', 'scale_pos_weight': 0.9802405829415511, 'alpha': 7.707120672082657, 'lambda': 1.6330820404950084, 'eta': 0.6395784750400954, 'sampling_method': 'uniform', 'subsample': 0.5614208321945702, 'gamma': 9.688386210848757}. Best is trial 27 with value: 4.291541471809494.
[I 2023-12-18 23:58:49,242] Trial 186 pruned. Trial was pruned at iteration 0.
[I 2023-12-18 23:58:49,313] Trial 187 pruned. Trial was pruned at iteration 0.
[I 2023-12-18 23:58:49,390] Trial 188 pruned. Trial was pruned at iteration 0.
[I 2023-12-18 23:58:49,463] Trial 189 pruned. Trial was pruned at iteration 0.
[I 2023-12-18 23:58:49,544] Trial 190 pruned. Trial was pruned at iteration 0.
[I 2023-12-18 23:58:49,625] Trial 191 pruned. Trial was pruned at iteration 1.
[I 2023-12-18 23:58:49,701] Trial 192 pruned. Trial was pruned at iteration 1.
[I 2023-12-18 23:58:49,767] Trial 193 pruned. Trial was pruned at iteration 0.
[I 2023-12-18 23:58:49,845] Trial 194 pruned. Trial was pruned at iteration 0.
[I 2023-12-18 23:58:49,926] Trial 195 pruned. Trial was pruned at iteration 0.
[I 2023-12-18 23:58:55,546] Trial 196 finished with value: 4.336712404145457 and parameters: {'learning_rate': 0.7679470106624738, 'aft_loss_distribution': 'normal', 'aft_loss_distribution_scale': 1.4832624788527722, 'max_depth': 10, 'booster': 'dart', 'scale_pos_weight': 0.09600559855081223, 'alpha': 8.42416864530842, 'lambda': 2.1435081180859887, 'eta': 0.6271237226678298, 'sampling_method': 'uniform', 'subsample': 0.6381595078594338, 'gamma': 9.813424541840567}. Best is trial 27 with value: 4.291541471809494.
[I 2023-12-18 23:58:57,355] Trial 197 finished with value: inf and parameters: {'learning_rate': 0.775422051351715, 'aft_loss_distribution': 'normal', 'aft_loss_distribution_scale': 1.3976615420385143, 'max_depth': 10, 'booster': 'dart', 'scale_pos_weight': 0.8207728712555715, 'alpha': 8.368175670280753, 'lambda': 2.3155666520948737, 'eta': 0.6260196394857193, 'sampling_method': 'uniform', 'subsample': 0.5389963388324261, 'gamma': 9.781222079662587}. Best is trial 27 with value: 4.291541471809494.
[I 2023-12-18 23:58:59,537] Trial 198 finished with value: inf and parameters: {'learning_rate': 0.744318946538595, 'aft_loss_distribution': 'normal', 'aft_loss_distribution_scale': 1.504324310487436, 'max_depth': 10, 'booster': 'dart', 'scale_pos_weight': 1.3575825415580929, 'alpha': 8.186873378511796, 'lambda': 1.7996155621183687, 'eta': 0.6457698942003621, 'sampling_method': 'uniform', 'subsample': 0.5059559182579356, 'gamma': 9.586317003568116}. Best is trial 27 with value: 4.291541471809494.
[I 2023-12-18 23:58:59,665] Trial 199 pruned. Trial was pruned at iteration 0.
[I 2023-12-18 23:58:59,737] Trial 200 pruned. Trial was pruned at iteration 0.
[I 2023-12-18 23:58:59,816] Trial 201 pruned. Trial was pruned at iteration 1.
[I 2023-12-18 23:58:59,910] Trial 202 pruned. Trial was pruned at iteration 1.
[I 2023-12-18 23:59:02,109] Trial 203 finished with value: inf and parameters: {'learning_rate': 0.6967087030621915, 'aft_loss_distribution': 'normal', 'aft_loss_distribution_scale': 1.3727952179888887, 'max_depth': 10, 'booster': 'dart', 'scale_pos_weight': 0.1173568578534521, 'alpha': 9.868225041516613, 'lambda': 1.4880890674159033, 'eta': 0.9416762570949264, 'sampling_method': 'uniform', 'subsample': 0.6200730059567863, 'gamma': 9.440676441155768}. Best is trial 27 with value: 4.291541471809494.
[I 2023-12-18 23:59:02,185] Trial 204 pruned. Trial was pruned at iteration 0.
[I 2023-12-18 23:59:02,275] Trial 205 pruned. Trial was pruned at iteration 0.
[I 2023-12-18 23:59:03,932] Trial 206 finished with value: inf and parameters: {'learning_rate': 0.8093295211523824, 'aft_loss_distribution': 'normal', 'aft_loss_distribution_scale': 1.236551610399306, 'max_depth': 10, 'booster': 'dart', 'scale_pos_weight': 0.7789633396652793, 'alpha': 7.688897894915953, 'lambda': 2.929667327646738, 'eta': 0.8673283684820132, 'sampling_method': 'uniform', 'subsample': 0.5272156238819099, 'gamma': 8.910451739551544}. Best is trial 27 with value: 4.291541471809494.
[I 2023-12-18 23:59:04,026] Trial 207 pruned. Trial was pruned at iteration 1.
[I 2023-12-18 23:59:04,103] Trial 208 pruned. Trial was pruned at iteration 1.
[I 2023-12-18 23:59:04,179] Trial 209 pruned. Trial was pruned at iteration 0.
[I 2023-12-18 23:59:04,254] Trial 210 pruned. Trial was pruned at iteration 0.
[I 2023-12-18 23:59:04,329] Trial 211 pruned. Trial was pruned at iteration 1.
[I 2023-12-18 23:59:10,420] Trial 212 finished with value: 4.296536253224926 and parameters: {'learning_rate': 0.7687323863106168, 'aft_loss_distribution': 'normal', 'aft_loss_distribution_scale': 1.3365141888947991, 'max_depth': 10, 'booster': 'dart', 'scale_pos_weight': 0.6202799057356065, 'alpha': 8.704012808770333, 'lambda': 5.324155790951522, 'eta': 0.16390750277834104, 'sampling_method': 'uniform', 'subsample': 0.5478700266662967, 'gamma': 9.998036319425228}. Best is trial 27 with value: 4.291541471809494.
[I 2023-12-18 23:59:12,471] Trial 213 finished with value: inf and parameters: {'learning_rate': 0.7883861096162086, 'aft_loss_distribution': 'normal', 'aft_loss_distribution_scale': 1.3058648874306191, 'max_depth': 10, 'booster': 'dart', 'scale_pos_weight': 0.9337503352316594, 'alpha': 8.751177462231528, 'lambda': 5.337620521109239, 'eta': 0.6249265356130469, 'sampling_method': 'uniform', 'subsample': 0.5487257343553386, 'gamma': 9.994757723191773}. Best is trial 27 with value: 4.291541471809494.
[I 2023-12-18 23:59:12,629] Trial 214 pruned. Trial was pruned at iteration 3.
