[I 2023-12-19 00:11:50,130] Trial 216 pruned. Trial was pruned at iteration 0.
[I 2023-12-19 00:11:50,244] Trial 217 pruned. Trial was pruned at iteration 0.
[I 2023-12-19 00:11:54,504] Trial 218 finished with value: 2.0222038804577753 and parameters: {'learning_rate': 0.9265451741977008, 'aft_loss_distribution': 'normal', 'aft_loss_distribution_scale': 1.8426234871094058, 'max_depth': 4, 'booster': 'dart', 'scale_pos_weight': 0.1958142425469291, 'alpha': 6.6299577857611505, 'lambda': 7.390401566154578, 'eta': 0.9285091722906675, 'sampling_method': 'uniform', 'subsample': 0.19684395798836068, 'gamma': 9.806630600780391}. Best is trial 2 with value: 2.015475326357095.
[I 2023-12-19 00:11:54,587] Trial 219 pruned. Trial was pruned at iteration 0.
[I 2023-12-19 00:11:56,061] Trial 220 finished with value: inf and parameters: {'learning_rate': 0.9291361832702216, 'aft_loss_distribution': 'normal', 'aft_loss_distribution_scale': 1.671657017791934, 'max_depth': 4, 'booster': 'dart', 'scale_pos_weight': 0.13380371981296446, 'alpha': 6.55470980451399, 'lambda': 7.238045322054582, 'eta': 0.9106980194709252, 'sampling_method': 'uniform', 'subsample': 0.2589518469219364, 'gamma': 9.128762638270839}. Best is trial 2 with value: 2.015475326357095.
[I 2023-12-19 00:11:59,639] Trial 221 finished with value: 2.04949027510425 and parameters: {'learning_rate': 0.9370020755397249, 'aft_loss_distribution': 'normal', 'aft_loss_distribution_scale': 2.069512331920667, 'max_depth': 4, 'booster': 'dart', 'scale_pos_weight': 0.13065467335008027, 'alpha': 6.1447070763094445, 'lambda': 6.933367068352355, 'eta': 0.8661212021865752, 'sampling_method': 'uniform', 'subsample': 0.1761766234885911, 'gamma': 9.5272591912586}. Best is trial 2 with value: 2.015475326357095.
[I 2023-12-19 00:12:02,708] Trial 222 finished with value: 2.0271155580022167 and parameters: {'learning_rate': 0.9105091756689532, 'aft_loss_distribution': 'normal', 'aft_loss_distribution_scale': 1.8756881129284442, 'max_depth': 4, 'booster': 'dart', 'scale_pos_weight': 0.11878484738061226, 'alpha': 6.195692250117712, 'lambda': 6.864005756360314, 'eta': 0.865557703771109, 'sampling_method': 'uniform', 'subsample': 0.2326708661130306, 'gamma': 9.811822449397429}. Best is trial 2 with value: 2.015475326357095.
[I 2023-12-19 00:12:18,724] Trial 223 finished with value: 2.0260437893505427 and parameters: {'learning_rate': 0.9390471260381247, 'aft_loss_distribution': 'normal', 'aft_loss_distribution_scale': 1.8715864574424388, 'max_depth': 4, 'booster': 'dart', 'scale_pos_weight': 0.2025920657374644, 'alpha': 7.158502187980285, 'lambda': 7.051746476289447, 'eta': 0.8730237739348405, 'sampling_method': 'uniform', 'subsample': 0.22703565191553937, 'gamma': 9.794161505635227}. Best is trial 2 with value: 2.015475326357095.
[I 2023-12-19 00:12:38,210] Trial 224 finished with value: 2.027104000681225 and parameters: {'learning_rate': 0.9374177194924707, 'aft_loss_distribution': 'normal', 'aft_loss_distribution_scale': 1.806890078985301, 'max_depth': 4, 'booster': 'dart', 'scale_pos_weight': 0.1979296151540984, 'alpha': 7.285570778265317, 'lambda': 7.287589871331739, 'eta': 0.9255035219257272, 'sampling_method': 'uniform', 'subsample': 0.17939929403081084, 'gamma': 9.839660326536578}. Best is trial 2 with value: 2.015475326357095.
[I 2023-12-19 00:12:40,929] Trial 225 finished with value: inf and parameters: {'learning_rate': 0.943097011914617, 'aft_loss_distribution': 'normal', 'aft_loss_distribution_scale': 1.4446775396215537, 'max_depth': 4, 'booster': 'dart', 'scale_pos_weight': 0.23751306371112468, 'alpha': 7.481272342642643, 'lambda': 7.41681012350873, 'eta': 0.9303537277644803, 'sampling_method': 'uniform', 'subsample': 0.23766804921285192, 'gamma': 9.878219995954327}. Best is trial 2 with value: 2.015475326357095.
[I 2023-12-19 00:12:46,835] Trial 226 finished with value: 2.0258790602627057 and parameters: {'learning_rate': 0.9341680240854623, 'aft_loss_distribution': 'normal', 'aft_loss_distribution_scale': 1.8120570778168033, 'max_depth': 4, 'booster': 'dart', 'scale_pos_weight': 0.18355230063209416, 'alpha': 7.202851968147343, 'lambda': 7.27297243131777, 'eta': 0.951757705251966, 'sampling_method': 'uniform', 'subsample': 0.17906682069603783, 'gamma': 9.79613244574032}. Best is trial 2 with value: 2.015475326357095.
[I 2023-12-19 00:12:48,295] Trial 227 finished with value: inf and parameters: {'learning_rate': 0.944556793990974, 'aft_loss_distribution': 'normal', 'aft_loss_distribution_scale': 1.8499217220265423, 'max_depth': 4, 'booster': 'dart', 'scale_pos_weight': 0.19935536008329596, 'alpha': 6.88450475504228, 'lambda': 7.2596604053751115, 'eta': 0.9458724868434326, 'sampling_method': 'gradient_based', 'subsample': 0.18344094746606618, 'gamma': 9.761406936869383}. Best is trial 2 with value: 2.015475326357095.
[I 2023-12-19 00:12:48,374] Trial 228 pruned. Trial was pruned at iteration 0.
[I 2023-12-19 00:13:24,747] Trial 229 finished with value: 2.014056037654139 and parameters: {'learning_rate': 0.9363530739530478, 'aft_loss_distribution': 'normal', 'aft_loss_distribution_scale': 1.6458526715743127, 'max_depth': 4, 'booster': 'dart', 'scale_pos_weight': 0.13930765329662273, 'alpha': 7.05861901412662, 'lambda': 7.531210510295817, 'eta': 0.915684840337074, 'sampling_method': 'uniform', 'subsample': 0.0961736405793675, 'gamma': 9.838890408025463}. Best is trial 229 with value: 2.014056037654139.
[I 2023-12-19 00:13:26,713] Trial 230 finished with value: inf and parameters: {'learning_rate': 0.9343981483687953, 'aft_loss_distribution': 'normal', 'aft_loss_distribution_scale': 1.633412244446205, 'max_depth': 4, 'booster': 'dart', 'scale_pos_weight': 0.13052185970175614, 'alpha': 7.144575165115977, 'lambda': 7.556912872546625, 'eta': 0.9643048799899966, 'sampling_method': 'uniform', 'subsample': 0.1190718028007084, 'gamma': 9.989225171094999}. Best is trial 229 with value: 2.014056037654139.
[I 2023-12-19 00:13:40,429] Trial 231 finished with value: 2.0299676881205326 and parameters: {'learning_rate': 0.9372309629557423, 'aft_loss_distribution': 'normal', 'aft_loss_distribution_scale': 1.8558157245972096, 'max_depth': 4, 'booster': 'dart', 'scale_pos_weight': 0.23814245881060486, 'alpha': 7.4003768257705485, 'lambda': 7.279696353388962, 'eta': 0.9199798188807151, 'sampling_method': 'uniform', 'subsample': 0.0925785368668387, 'gamma': 9.54539552506649}. Best is trial 229 with value: 2.014056037654139.
[I 2023-12-19 00:13:40,521] Trial 232 pruned. Trial was pruned at iteration 0.
[I 2023-12-19 00:13:44,446] Trial 233 finished with value: 2.0224310754794623 and parameters: {'learning_rate': 0.9562731967272946, 'aft_loss_distribution': 'normal', 'aft_loss_distribution_scale': 1.47538393011864, 'max_depth': 4, 'booster': 'dart', 'scale_pos_weight': 0.24968030800028707, 'alpha': 6.736323039384952, 'lambda': 7.2265547753136055, 'eta': 0.8642038074688378, 'sampling_method': 'uniform', 'subsample': 0.08987503289009756, 'gamma': 9.532522889902397}. Best is trial 229 with value: 2.014056037654139.
[I 2023-12-19 00:13:55,304] Trial 234 finished with value: 2.0122274096127373 and parameters: {'learning_rate': 0.9580043971997408, 'aft_loss_distribution': 'normal', 'aft_loss_distribution_scale': 1.4571105975616918, 'max_depth': 4, 'booster': 'dart', 'scale_pos_weight': 0.23882759649229907, 'alpha': 6.748782350037749, 'lambda': 7.549767003584395, 'eta': 0.7645278990678911, 'sampling_method': 'uniform', 'subsample': 0.09673041028519583, 'gamma': 9.363008659650808}. Best is trial 234 with value: 2.0122274096127373.
[I 2023-12-19 00:14:09,842] Trial 235 finished with value: 2.0148793353259453 and parameters: {'learning_rate': 0.9594860982271812, 'aft_loss_distribution': 'normal', 'aft_loss_distribution_scale': 1.4263979860629417, 'max_depth': 4, 'booster': 'dart', 'scale_pos_weight': 0.23924757891916065, 'alpha': 7.727287669456858, 'lambda': 7.762318551168782, 'eta': 0.9073558573274698, 'sampling_method': 'uniform', 'subsample': 0.09573157803757884, 'gamma': 9.334219799737562}. Best is trial 234 with value: 2.0122274096127373.
[I 2023-12-19 00:14:09,921] Trial 236 pruned. Trial was pruned at iteration 0.
[I 2023-12-19 00:14:09,997] Trial 237 pruned. Trial was pruned at iteration 0.
[I 2023-12-19 00:14:10,075] Trial 238 pruned. Trial was pruned at iteration 0.
[I 2023-12-19 00:14:20,720] Trial 239 finished with value: 2.0152528451613527 and parameters: {'learning_rate': 0.951889302660266, 'aft_loss_distribution': 'normal', 'aft_loss_distribution_scale': 1.6350432696742594, 'max_depth': 4, 'booster': 'dart', 'scale_pos_weight': 0.1143824597550512, 'alpha': 7.828599657047694, 'lambda': 7.525309682616392, 'eta': 0.7536149264207478, 'sampling_method': 'uniform', 'subsample': 0.09363867275835132, 'gamma': 9.516999701854477}. Best is trial 234 with value: 2.0122274096127373.
[I 2023-12-19 00:14:20,850] Trial 240 pruned. Trial was pruned at iteration 0.
[I 2023-12-19 00:14:20,980] Trial 241 pruned. Trial was pruned at iteration 0.
[I 2023-12-19 00:14:30,662] Trial 242 finished with value: 2.0148449648821964 and parameters: {'learning_rate': 0.9493110898342337, 'aft_loss_distribution': 'normal', 'aft_loss_distribution_scale': 1.7167901247125958, 'max_depth': 4, 'booster': 'dart', 'scale_pos_weight': 0.12199760604605217, 'alpha': 6.350993702830826, 'lambda': 7.331380598161204, 'eta': 0.8913859185692969, 'sampling_method': 'uniform', 'subsample': 0.2014359727327142, 'gamma': 9.057974548301562}. Best is trial 234 with value: 2.0122274096127373.
[I 2023-12-19 00:14:33,131] Trial 243 finished with value: inf and parameters: {'learning_rate': 0.9499811286175319, 'aft_loss_distribution': 'normal', 'aft_loss_distribution_scale': 1.35609857758662, 'max_depth': 4, 'booster': 'dart', 'scale_pos_weight': 0.2706326353392573, 'alpha': 6.611493529702116, 'lambda': 7.293949647890533, 'eta': 0.9420009093208882, 'sampling_method': 'uniform', 'subsample': 0.10700343160455993, 'gamma': 9.015425984833639}. Best is trial 234 with value: 2.0122274096127373.
[I 2023-12-19 00:14:41,310] Trial 244 finished with value: 2.012265437092634 and parameters: {'learning_rate': 0.9863964971844068, 'aft_loss_distribution': 'normal', 'aft_loss_distribution_scale': 1.6585027019201508, 'max_depth': 4, 'booster': 'dart', 'scale_pos_weight': 0.12394037030476517, 'alpha': 8.056459312207721, 'lambda': 7.646287251190753, 'eta': 0.8336316572311476, 'sampling_method': 'uniform', 'subsample': 0.22762696228877868, 'gamma': 9.33934383265345}. Best is trial 234 with value: 2.0122274096127373.
[I 2023-12-19 00:14:44,782] Trial 245 finished with value: 2.0154183655686095 and parameters: {'learning_rate': 0.997785804147606, 'aft_loss_distribution': 'normal', 'aft_loss_distribution_scale': 1.5863976045148138, 'max_depth': 4, 'booster': 'dart', 'scale_pos_weight': 0.11902826748861559, 'alpha': 8.091296517045372, 'lambda': 7.634736308377203, 'eta': 0.8334364716043761, 'sampling_method': 'uniform', 'subsample': 0.15115682058360672, 'gamma': 9.333444362424324}. Best is trial 234 with value: 2.0122274096127373.
[I 2023-12-19 00:14:46,575] Trial 246 finished with value: inf and parameters: {'learning_rate': 0.9903169662046873, 'aft_loss_distribution': 'normal', 'aft_loss_distribution_scale': 1.1647421278127834, 'max_depth': 4, 'booster': 'dart', 'scale_pos_weight': 0.20371787452171342, 'alpha': 8.183502245036996, 'lambda': 8.01325833142612, 'eta': 0.7408511688338748, 'sampling_method': 'uniform', 'subsample': 0.15193345091525276, 'gamma': 9.359514748761033}. Best is trial 234 with value: 2.0122274096127373.
[I 2023-12-19 00:14:52,312] Trial 247 finished with value: 2.0126033346577192 and parameters: {'learning_rate': 0.9983698170849772, 'aft_loss_distribution': 'normal', 'aft_loss_distribution_scale': 1.5692951464623002, 'max_depth': 4, 'booster': 'dart', 'scale_pos_weight': 0.11255688100858234, 'alpha': 6.361877557026552, 'lambda': 7.743138494060801, 'eta': 0.8247721657170007, 'sampling_method': 'uniform', 'subsample': 0.23199956751486053, 'gamma': 9.730567239981438}. Best is trial 234 with value: 2.0122274096127373.
[I 2023-12-19 00:14:56,523] Trial 248 finished with value: 2.0078067173405847 and parameters: {'learning_rate': 0.9827977084942388, 'aft_loss_distribution': 'normal', 'aft_loss_distribution_scale': 1.5525179482704874, 'max_depth': 4, 'booster': 'dart', 'scale_pos_weight': 0.12251009802984403, 'alpha': 8.133829255297277, 'lambda': 7.709173094550566, 'eta': 0.8443316729799774, 'sampling_method': 'uniform', 'subsample': 0.23409082361933242, 'gamma': 9.76583843201199}. Best is trial 248 with value: 2.0078067173405847.
[I 2023-12-19 00:15:05,027] Trial 249 finished with value: 2.005250471826102 and parameters: {'learning_rate': 0.9920426037716072, 'aft_loss_distribution': 'normal', 'aft_loss_distribution_scale': 1.5080500767867704, 'max_depth': 4, 'booster': 'dart', 'scale_pos_weight': 0.1286424074452417, 'alpha': 8.4043697363202, 'lambda': 7.686741330169077, 'eta': 0.8341681072343325, 'sampling_method': 'uniform', 'subsample': 0.23116752171199087, 'gamma': 9.648873377995997}. Best is trial 249 with value: 2.005250471826102.
[I 2023-12-19 00:15:07,415] Trial 250 finished with value: inf and parameters: {'learning_rate': 0.9978075551922666, 'aft_loss_distribution': 'normal', 'aft_loss_distribution_scale': 1.2782317216946448, 'max_depth': 4, 'booster': 'dart', 'scale_pos_weight': 0.12068952944891141, 'alpha': 8.675230363572373, 'lambda': 7.833509267219454, 'eta': 0.8312842582484262, 'sampling_method': 'uniform', 'subsample': 0.23556070985734157, 'gamma': 9.791204880089959}. Best is trial 249 with value: 2.005250471826102.
[I 2023-12-19 00:15:09,884] Trial 251 finished with value: inf and parameters: {'learning_rate': 0.9763587006316877, 'aft_loss_distribution': 'normal', 'aft_loss_distribution_scale': 1.5490817502843324, 'max_depth': 4, 'booster': 'dart', 'scale_pos_weight': 0.2686801638465163, 'alpha': 8.150401685310342, 'lambda': 7.726198497354579, 'eta': 0.8444775516495746, 'sampling_method': 'uniform', 'subsample': 0.2254691483638504, 'gamma': 9.960310812262147}. Best is trial 249 with value: 2.005250471826102.
[I 2023-12-19 00:15:30,263] Trial 252 finished with value: 2.0054421829354534 and parameters: {'learning_rate': 0.9984093168636213, 'aft_loss_distribution': 'normal', 'aft_loss_distribution_scale': 1.5642365572363162, 'max_depth': 4, 'booster': 'dart', 'scale_pos_weight': 0.12269096103968653, 'alpha': 7.621761144601384, 'lambda': 8.357328478702707, 'eta': 0.8585164899319324, 'sampling_method': 'uniform', 'subsample': 0.19735342033232853, 'gamma': 9.680832864752535}. Best is trial 249 with value: 2.005250471826102.
[I 2023-12-19 00:15:30,341] Trial 253 pruned. Trial was pruned at iteration 0.
[I 2023-12-19 00:15:32,966] Trial 254 finished with value: inf and parameters: {'learning_rate': 0.9788493086898069, 'aft_loss_distribution': 'normal', 'aft_loss_distribution_scale': 1.4449068970220735, 'max_depth': 4, 'booster': 'dart', 'scale_pos_weight': 0.12178700325610554, 'alpha': 7.994718768899405, 'lambda': 8.037483100820372, 'eta': 0.7886366131143618, 'sampling_method': 'uniform', 'subsample': 0.22026380709362883, 'gamma': 9.589359988897938}. Best is trial 249 with value: 2.005250471826102.
[I 2023-12-19 00:15:34,927] Trial 255 finished with value: inf and parameters: {'learning_rate': 0.9976252756138583, 'aft_loss_distribution': 'normal', 'aft_loss_distribution_scale': 1.3006348773093943, 'max_depth': 4, 'booster': 'dart', 'scale_pos_weight': 0.2957664988730948, 'alpha': 8.495221482648015, 'lambda': 7.647631257619033, 'eta': 0.8339289159699722, 'sampling_method': 'uniform', 'subsample': 0.08875211377004587, 'gamma': 9.72743612754461}. Best is trial 249 with value: 2.005250471826102.
[I 2023-12-19 00:15:36,347] Trial 256 finished with value: inf and parameters: {'learning_rate': 0.9725847754705139, 'aft_loss_distribution': 'normal', 'aft_loss_distribution_scale': 1.6382778902557447, 'max_depth': 4, 'booster': 'dart', 'scale_pos_weight': 0.11806128301735389, 'alpha': 7.282304593579529, 'lambda': 7.88723972283772, 'eta': 0.9182879604525851, 'sampling_method': 'gradient_based', 'subsample': 0.18581342832433873, 'gamma': 9.95927661083845}. Best is trial 249 with value: 2.005250471826102.
[I 2023-12-19 00:15:37,721] Trial 257 finished with value: inf and parameters: {'learning_rate': 0.9994018809237993, 'aft_loss_distribution': 'normal', 'aft_loss_distribution_scale': 1.6182580084938407, 'max_depth': 4, 'booster': 'dart', 'scale_pos_weight': 0.22162480889845154, 'alpha': 7.631553678691448, 'lambda': 8.430202189114732, 'eta': 0.704318201075274, 'sampling_method': 'uniform', 'subsample': 0.036431439298428785, 'gamma': 9.442233699564875}. Best is trial 249 with value: 2.005250471826102.
[I 2023-12-19 00:15:37,799] Trial 258 pruned. Trial was pruned at iteration 0.
[I 2023-12-19 00:15:41,843] Trial 259 finished with value: 2.0061480598603443 and parameters: {'learning_rate': 0.9645477969348781, 'aft_loss_distribution': 'normal', 'aft_loss_distribution_scale': 1.3712200658866984, 'max_depth': 4, 'booster': 'dart', 'scale_pos_weight': 0.2606223905205193, 'alpha': 7.083960609227818, 'lambda': 9.677213031678376, 'eta': 0.9098819300867852, 'sampling_method': 'uniform', 'subsample': 0.2001005942738192, 'gamma': 9.99789910514128}. Best is trial 249 with value: 2.005250471826102.
[I 2023-12-19 00:15:41,921] Trial 260 pruned. Trial was pruned at iteration 0.
[I 2023-12-19 00:15:49,440] Trial 261 finished with value: 2.010056848683089 and parameters: {'learning_rate': 0.9630497300993703, 'aft_loss_distribution': 'normal', 'aft_loss_distribution_scale': 1.5989862750698978, 'max_depth': 4, 'booster': 'dart', 'scale_pos_weight': 0.24376360226911592, 'alpha': 7.526921621585807, 'lambda': 9.03525972924551, 'eta': 0.9475897661481341, 'sampling_method': 'uniform', 'subsample': 0.2000400278637523, 'gamma': 9.5645798624914}. Best is trial 249 with value: 2.005250471826102.
[I 2023-12-19 00:15:53,094] Trial 262 finished with value: 2.016658535585997 and parameters: {'learning_rate': 0.9631893129757614, 'aft_loss_distribution': 'normal', 'aft_loss_distribution_scale': 1.3239346584577252, 'max_depth': 4, 'booster': 'dart', 'scale_pos_weight': 0.2421745677791581, 'alpha': 7.470523086203359, 'lambda': 8.833881595601401, 'eta': 0.9450017143036102, 'sampling_method': 'uniform', 'subsample': 0.20408253894517586, 'gamma': 9.590671759147195}. Best is trial 249 with value: 2.005250471826102.
[I 2023-12-19 00:15:53,176] Trial 263 pruned. Trial was pruned at iteration 0.
[I 2023-12-19 00:15:54,985] Trial 264 finished with value: inf and parameters: {'learning_rate': 0.9611927064296707, 'aft_loss_distribution': 'normal', 'aft_loss_distribution_scale': 1.3297585663766003, 'max_depth': 4, 'booster': 'dart', 'scale_pos_weight': 0.25698789121694027, 'alpha': 7.149054915293916, 'lambda': 9.236135467422807, 'eta': 0.9520630944692087, 'sampling_method': 'uniform', 'subsample': 0.2037181228928636, 'gamma': 9.572099453317934}. Best is trial 249 with value: 2.005250471826102.
[I 2023-12-19 00:15:56,503] Trial 265 finished with value: inf and parameters: {'learning_rate': 0.9983501545016482, 'aft_loss_distribution': 'normal', 'aft_loss_distribution_scale': 1.5399531958168744, 'max_depth': 4, 'booster': 'dart', 'scale_pos_weight': 0.19361764129609257, 'alpha': 7.984746343090207, 'lambda': 8.983329112603393, 'eta': 0.8499075410138472, 'sampling_method': 'uniform', 'subsample': 0.21985834876512114, 'gamma': 9.990761551720936}. Best is trial 249 with value: 2.005250471826102.
[I 2023-12-19 00:16:11,987] Trial 266 finished with value: 2.009443778210331 and parameters: {'learning_rate': 0.9592920196696071, 'aft_loss_distribution': 'normal', 'aft_loss_distribution_scale': 1.6342849143017681, 'max_depth': 4, 'booster': 'dart', 'scale_pos_weight': 0.18060825871386654, 'alpha': 7.486923868366291, 'lambda': 9.354187037682316, 'eta': 0.9995858307094503, 'sampling_method': 'uniform', 'subsample': 0.19819592392970622, 'gamma': 9.401140288852167}. Best is trial 249 with value: 2.005250471826102.
[I 2023-12-19 00:16:13,465] Trial 267 finished with value: inf and parameters: {'learning_rate': 0.9608264096865471, 'aft_loss_distribution': 'normal', 'aft_loss_distribution_scale': 1.305674600382048, 'max_depth': 4, 'booster': 'dart', 'scale_pos_weight': 0.3284016284569962, 'alpha': 7.610974480911379, 'lambda': 8.99161174527721, 'eta': 0.9843303323207835, 'sampling_method': 'uniform', 'subsample': 0.21226664490129452, 'gamma': 9.37834548757703}. Best is trial 249 with value: 2.005250471826102.
[I 2023-12-19 00:16:13,558] Trial 268 pruned. Trial was pruned at iteration 0.
[I 2023-12-19 00:16:16,460] Trial 269 finished with value: inf and parameters: {'learning_rate': 0.9618915003520434, 'aft_loss_distribution': 'normal', 'aft_loss_distribution_scale': 1.5977108129214648, 'max_depth': 4, 'booster': 'dart', 'scale_pos_weight': 0.2452186993047484, 'alpha': 7.8356434970460125, 'lambda': 9.156167209290269, 'eta': 0.9382398719363368, 'sampling_method': 'uniform', 'subsample': 0.24923266821466045, 'gamma': 9.57189837073922}. Best is trial 249 with value: 2.005250471826102.
[I 2023-12-19 00:16:16,580] Trial 270 pruned. Trial was pruned at iteration 0.
[I 2023-12-19 00:16:16,711] Trial 271 pruned. Trial was pruned at iteration 0.
[I 2023-12-19 00:16:16,823] Trial 272 pruned. Trial was pruned at iteration 0.
[I 2023-12-19 00:16:20,600] Trial 273 finished with value: 2.0121999226485827 and parameters: {'learning_rate': 0.9552143883119332, 'aft_loss_distribution': 'normal', 'aft_loss_distribution_scale': 1.6369679288215426, 'max_depth': 4, 'booster': 'dart', 'scale_pos_weight': 0.35904437681216816, 'alpha': 6.731873721653375, 'lambda': 8.429560437817347, 'eta': 0.8027578797362862, 'sampling_method': 'uniform', 'subsample': 0.2006077884829505, 'gamma': 9.833326952995634}. Best is trial 249 with value: 2.005250471826102.
