[I 2023-12-21 00:14:38,847] Trial 13 finished with value: inf and parameters: {'learning_rate': 0.6659791889931351, 'aft_loss_distribution': 'normal', 'aft_loss_distribution_scale': 2.3652890850881008, 'max_depth': 8, 'booster': 'gbtree', 'scale_pos_weight': 0.7323277651138891, 'alpha': 7.482108791577884, 'lambda': 0.27759720535091414, 'eta': 0.5145187793852357, 'sampling_method': 'gradient_based', 'subsample': 0.32776624765793005, 'gamma': 0.05921711648039585}. Best is trial 0 with value: 2.065812879551862.
[I 2023-12-21 00:14:38,914] Trial 14 pruned. Trial was pruned at iteration 0.
[I 2023-12-21 00:14:38,983] Trial 15 pruned. Trial was pruned at iteration 0.
[I 2023-12-21 00:14:39,056] Trial 16 pruned. Trial was pruned at iteration 0.
[I 2023-12-21 00:14:39,129] Trial 17 pruned. Trial was pruned at iteration 0.
[I 2023-12-21 00:14:39,201] Trial 18 pruned. Trial was pruned at iteration 0.
[I 2023-12-21 00:14:39,270] Trial 19 pruned. Trial was pruned at iteration 0.
[I 2023-12-21 00:14:39,340] Trial 20 pruned. Trial was pruned at iteration 0.
[I 2023-12-21 00:14:39,416] Trial 21 pruned. Trial was pruned at iteration 0.
[I 2023-12-21 00:14:39,496] Trial 22 pruned. Trial was pruned at iteration 0.
[I 2023-12-21 00:14:39,570] Trial 23 pruned. Trial was pruned at iteration 0.
[I 2023-12-21 00:14:39,656] Trial 24 pruned. Trial was pruned at iteration 0.
[I 2023-12-21 00:14:39,735] Trial 25 pruned. Trial was pruned at iteration 0.
[I 2023-12-21 00:14:39,806] Trial 26 pruned. Trial was pruned at iteration 0.
[I 2023-12-21 00:14:39,878] Trial 27 pruned. Trial was pruned at iteration 0.
[I 2023-12-21 00:14:39,953] Trial 28 pruned. Trial was pruned at iteration 0.
[I 2023-12-21 00:14:40,029] Trial 29 pruned. Trial was pruned at iteration 0.
[I 2023-12-21 00:14:40,103] Trial 30 pruned. Trial was pruned at iteration 0.
[I 2023-12-21 00:14:40,188] Trial 31 pruned. Trial was pruned at iteration 1.
[I 2023-12-21 00:14:45,601] Trial 32 finished with value: 2.196047259181075 and parameters: {'learning_rate': 0.8180280590721623, 'aft_loss_distribution': 'normal', 'aft_loss_distribution_scale': 4.889536281932609, 'max_depth': 8, 'booster': 'dart', 'scale_pos_weight': 1.376789298986465, 'alpha': 3.510310444103042, 'lambda': 4.386189876569956, 'eta': 0.31197492411850225, 'sampling_method': 'gradient_based', 'subsample': 0.4922767405033379, 'gamma': 5.471343307135346}. Best is trial 0 with value: 2.065812879551862.
[I 2023-12-21 00:14:54,063] Trial 33 finished with value: 2.1824965497633992 and parameters: {'learning_rate': 0.8312914487612211, 'aft_loss_distribution': 'normal', 'aft_loss_distribution_scale': 4.727370830079635, 'max_depth': 8, 'booster': 'dart', 'scale_pos_weight': 1.3539462572842824, 'alpha': 3.365897948937222, 'lambda': 5.283168025365141, 'eta': 0.3020971593023884, 'sampling_method': 'gradient_based', 'subsample': 0.4727406576986932, 'gamma': 3.846373785921905}. Best is trial 0 with value: 2.065812879551862.
[I 2023-12-21 00:14:54,172] Trial 34 pruned. Trial was pruned at iteration 2.
[I 2023-12-21 00:14:56,465] Trial 35 finished with value: inf and parameters: {'learning_rate': 0.9872456496938427, 'aft_loss_distribution': 'normal', 'aft_loss_distribution_scale': 4.304126414636005, 'max_depth': 6, 'booster': 'dart', 'scale_pos_weight': 0.8441993296631832, 'alpha': 4.721128700301609, 'lambda': 4.701160950700152, 'eta': 0.28732210839628836, 'sampling_method': 'gradient_based', 'subsample': 0.3594298932546568, 'gamma': 1.346518014943058}. Best is trial 0 with value: 2.065812879551862.
[I 2023-12-21 00:14:56,520] Trial 36 pruned. Trial was pruned at iteration 0.
[I 2023-12-21 00:14:58,139] Trial 37 finished with value: inf and parameters: {'learning_rate': 0.8140770465655773, 'aft_loss_distribution': 'normal', 'aft_loss_distribution_scale': 3.955768800676799, 'max_depth': 6, 'booster': 'dart', 'scale_pos_weight': 1.9797369075646891, 'alpha': 3.2680300269829012, 'lambda': 4.521351381512991, 'eta': 0.2978634163666799, 'sampling_method': 'gradient_based', 'subsample': 0.25627116193979527, 'gamma': 1.8829692949859966}. Best is trial 0 with value: 2.065812879551862.
[I 2023-12-21 00:15:12,029] Trial 38 finished with value: 2.032750948928754 and parameters: {'learning_rate': 0.7019964672260408, 'aft_loss_distribution': 'normal', 'aft_loss_distribution_scale': 2.8563975555534875, 'max_depth': 8, 'booster': 'dart', 'scale_pos_weight': 1.4244667504366146, 'alpha': 4.464903539879528, 'lambda': 7.397256469826042, 'eta': 0.1634713819299981, 'sampling_method': 'uniform', 'subsample': 0.4448629463575944, 'gamma': 5.284444545887065}. Best is trial 38 with value: 2.032750948928754.
[I 2023-12-21 00:15:15,286] Trial 39 finished with value: 2.064684305953699 and parameters: {'learning_rate': 0.7043925420896473, 'aft_loss_distribution': 'normal', 'aft_loss_distribution_scale': 3.1774471421032384, 'max_depth': 8, 'booster': 'dart', 'scale_pos_weight': 1.438242854048806, 'alpha': 2.2192203594690474, 'lambda': 7.433845941168324, 'eta': 0.1253598459787288, 'sampling_method': 'uniform', 'subsample': 0.49377448646740324, 'gamma': 4.626045350573024}. Best is trial 38 with value: 2.032750948928754.
[I 2023-12-21 00:15:15,343] Trial 40 pruned. Trial was pruned at iteration 0.
[I 2023-12-21 00:15:15,393] Trial 41 pruned. Trial was pruned at iteration 0.
[I 2023-12-21 00:15:15,453] Trial 42 pruned. Trial was pruned at iteration 2.
[I 2023-12-21 00:15:24,002] Trial 43 pruned. Trial was pruned at iteration 134.
[I 2023-12-21 00:15:24,060] Trial 44 pruned. Trial was pruned at iteration 0.
[I 2023-12-21 00:15:25,827] Trial 45 finished with value: inf and parameters: {'learning_rate': 0.8577431518773087, 'aft_loss_distribution': 'normal', 'aft_loss_distribution_scale': 2.874200629955475, 'max_depth': 6, 'booster': 'dart', 'scale_pos_weight': 1.8246937943190713, 'alpha': 2.2800106800621904, 'lambda': 8.063645472686519, 'eta': 0.08824038778000286, 'sampling_method': 'uniform', 'subsample': 0.2969682491430501, 'gamma': 3.7296243387325294}. Best is trial 38 with value: 2.032750948928754.
[I 2023-12-21 00:15:25,891] Trial 46 pruned. Trial was pruned at iteration 0.
[I 2023-12-21 00:15:25,945] Trial 47 pruned. Trial was pruned at iteration 0.
[I 2023-12-21 00:15:26,009] Trial 48 pruned. Trial was pruned at iteration 0.
[I 2023-12-21 00:15:26,065] Trial 49 pruned. Trial was pruned at iteration 0.
[I 2023-12-21 00:15:33,579] Trial 50 finished with value: 2.109484790473144 and parameters: {'learning_rate': 0.9513491713232334, 'aft_loss_distribution': 'normal', 'aft_loss_distribution_scale': 3.680447362649054, 'max_depth': 6, 'booster': 'dart', 'scale_pos_weight': 0.7038850835231191, 'alpha': 3.1411579317718514, 'lambda': 1.1597739936959386, 'eta': 0.2173210087589511, 'sampling_method': 'uniform', 'subsample': 0.333920663491305, 'gamma': 3.5132628410673625}. Best is trial 38 with value: 2.032750948928754.
[I 2023-12-21 00:15:42,377] Trial 51 pruned. Trial was pruned at iteration 134.
[I 2023-12-21 00:15:42,435] Trial 52 pruned. Trial was pruned at iteration 1.
[I 2023-12-21 00:15:44,237] Trial 53 finished with value: inf and parameters: {'learning_rate': 0.9497553927762179, 'aft_loss_distribution': 'normal', 'aft_loss_distribution_scale': 3.974441943165008, 'max_depth': 5, 'booster': 'dart', 'scale_pos_weight': 0.6307195248966544, 'alpha': 2.405175446157487, 'lambda': 0.777060412119836, 'eta': 0.24134753180568735, 'sampling_method': 'uniform', 'subsample': 0.3435955718247078, 'gamma': 4.9401265066440825}. Best is trial 38 with value: 2.032750948928754.
[I 2023-12-21 00:15:46,420] Trial 54 finished with value: inf and parameters: {'learning_rate': 0.8895206873274815, 'aft_loss_distribution': 'normal', 'aft_loss_distribution_scale': 2.433429603173887, 'max_depth': 7, 'booster': 'dart', 'scale_pos_weight': 0.9072874228147303, 'alpha': 1.098154497874291, 'lambda': 6.905441844738042, 'eta': 0.04510013858049183, 'sampling_method': 'uniform', 'subsample': 0.4637436630013921, 'gamma': 3.0395110722630276}. Best is trial 38 with value: 2.032750948928754.
[I 2023-12-21 00:15:46,479] Trial 55 pruned. Trial was pruned at iteration 0.
[I 2023-12-21 00:15:46,532] Trial 56 pruned. Trial was pruned at iteration 0.
[I 2023-12-21 00:15:46,586] Trial 57 pruned. Trial was pruned at iteration 0.
[I 2023-12-21 00:15:46,642] Trial 58 pruned. Trial was pruned at iteration 0.
[I 2023-12-21 00:15:46,708] Trial 59 pruned. Trial was pruned at iteration 0.
[I 2023-12-21 00:15:46,762] Trial 60 pruned. Trial was pruned at iteration 0.
[I 2023-12-21 00:15:46,823] Trial 61 pruned. Trial was pruned at iteration 0.
[I 2023-12-21 00:15:46,878] Trial 62 pruned. Trial was pruned at iteration 0.
[I 2023-12-21 00:15:50,093] Trial 63 finished with value: 2.0209388491064213 and parameters: {'learning_rate': 0.7669918893946959, 'aft_loss_distribution': 'normal', 'aft_loss_distribution_scale': 2.7203780294256403, 'max_depth': 10, 'booster': 'dart', 'scale_pos_weight': 1.908207933614627, 'alpha': 5.008894126796203, 'lambda': 5.243664033381474, 'eta': 0.27183452378900563, 'sampling_method': 'gradient_based', 'subsample': 0.4041824595190894, 'gamma': 2.8202417125131567}. Best is trial 63 with value: 2.0209388491064213.
[I 2023-12-21 00:15:53,384] Trial 64 finished with value: 2.0292805741855915 and parameters: {'learning_rate': 0.766452658748624, 'aft_loss_distribution': 'normal', 'aft_loss_distribution_scale': 2.7729221022937205, 'max_depth': 6, 'booster': 'dart', 'scale_pos_weight': 1.4953645035048353, 'alpha': 5.021946075940225, 'lambda': 7.070581849831859, 'eta': 0.2732509211975378, 'sampling_method': 'gradient_based', 'subsample': 0.40146726986038256, 'gamma': 2.8998425996160186}. Best is trial 63 with value: 2.0209388491064213.
[I 2023-12-21 00:15:55,850] Trial 65 finished with value: inf and parameters: {'learning_rate': 0.7590131425854038, 'aft_loss_distribution': 'normal', 'aft_loss_distribution_scale': 2.5062005205364835, 'max_depth': 10, 'booster': 'dart', 'scale_pos_weight': 1.6546118728621475, 'alpha': 4.724101682911086, 'lambda': 7.141416705597632, 'eta': 0.27555693875595827, 'sampling_method': 'gradient_based', 'subsample': 0.4007970008198558, 'gamma': 2.7646765996692215}. Best is trial 63 with value: 2.0209388491064213.
[I 2023-12-21 00:15:58,800] Trial 66 finished with value: 2.032538922293435 and parameters: {'learning_rate': 0.8649212923971312, 'aft_loss_distribution': 'normal', 'aft_loss_distribution_scale': 2.7833494541610158, 'max_depth': 6, 'booster': 'dart', 'scale_pos_weight': 1.8976338869266391, 'alpha': 4.239527952723349, 'lambda': 8.866785047568833, 'eta': 0.12946164291933387, 'sampling_method': 'gradient_based', 'subsample': 0.35023380614462324, 'gamma': 3.2031579865410613}. Best is trial 63 with value: 2.0209388491064213.
[I 2023-12-21 00:15:58,856] Trial 67 pruned. Trial was pruned at iteration 0.
[I 2023-12-21 00:16:00,742] Trial 68 finished with value: inf and parameters: {'learning_rate': 0.8769747349726927, 'aft_loss_distribution': 'normal', 'aft_loss_distribution_scale': 2.9032810505257425, 'max_depth': 5, 'booster': 'dart', 'scale_pos_weight': 2.5459777155807335, 'alpha': 5.186360838611719, 'lambda': 8.20057687109048, 'eta': 0.09238173188441595, 'sampling_method': 'uniform', 'subsample': 0.27307452130224674, 'gamma': 0.6400577006030779}. Best is trial 63 with value: 2.0209388491064213.
[I 2023-12-21 00:16:00,807] Trial 69 pruned. Trial was pruned at iteration 1.
[I 2023-12-21 00:16:00,859] Trial 70 pruned. Trial was pruned at iteration 0.
[I 2023-12-21 00:16:02,773] Trial 71 finished with value: inf and parameters: {'learning_rate': 0.9201440968220176, 'aft_loss_distribution': 'normal', 'aft_loss_distribution_scale': 3.2833033394154474, 'max_depth': 6, 'booster': 'dart', 'scale_pos_weight': 2.2539275475997926, 'alpha': 4.097861104783953, 'lambda': 6.656511412984513, 'eta': 0.16789870221433834, 'sampling_method': 'gradient_based', 'subsample': 0.37238406559011483, 'gamma': 3.80486165805634}. Best is trial 63 with value: 2.0209388491064213.
[I 2023-12-21 00:16:04,765] Trial 72 finished with value: inf and parameters: {'learning_rate': 0.7864060132237104, 'aft_loss_distribution': 'normal', 'aft_loss_distribution_scale': 2.7463717571043516, 'max_depth': 7, 'booster': 'dart', 'scale_pos_weight': 1.9385145851095786, 'alpha': 3.7107073687081606, 'lambda': 5.48138388200691, 'eta': 0.2657431369387975, 'sampling_method': 'gradient_based', 'subsample': 0.3252692191737845, 'gamma': 2.5408270172503533}. Best is trial 63 with value: 2.0209388491064213.
[I 2023-12-21 00:16:13,705] Trial 73 finished with value: 2.0643077336486457 and parameters: {'learning_rate': 0.8506976306073057, 'aft_loss_distribution': 'normal', 'aft_loss_distribution_scale': 3.240937942462493, 'max_depth': 5, 'booster': 'dart', 'scale_pos_weight': 1.6482839758388395, 'alpha': 4.563214996165361, 'lambda': 8.721224290990325, 'eta': 0.33924939191377756, 'sampling_method': 'gradient_based', 'subsample': 0.46602139902829565, 'gamma': 4.5861288633376365}. Best is trial 63 with value: 2.0209388491064213.
[I 2023-12-21 00:16:13,769] Trial 74 pruned. Trial was pruned at iteration 1.
[I 2023-12-21 00:16:13,823] Trial 75 pruned. Trial was pruned at iteration 0.
[I 2023-12-21 00:16:13,878] Trial 76 pruned. Trial was pruned at iteration 0.
[I 2023-12-21 00:16:13,935] Trial 77 pruned. Trial was pruned at iteration 0.
[I 2023-12-21 00:16:15,591] Trial 78 finished with value: inf and parameters: {'learning_rate': 0.9019029825323917, 'aft_loss_distribution': 'normal', 'aft_loss_distribution_scale': 2.7746214683714023, 'max_depth': 4, 'booster': 'dart', 'scale_pos_weight': 1.8896328027789657, 'alpha': 4.591060515344786, 'lambda': 9.064061440015044, 'eta': 0.38507741566961395, 'sampling_method': 'gradient_based', 'subsample': 0.3503275003711061, 'gamma': 1.5578287601266256}. Best is trial 63 with value: 2.0209388491064213.
[I 2023-12-21 00:16:15,652] Trial 79 pruned. Trial was pruned at iteration 0.
[I 2023-12-21 00:16:23,996] Trial 80 finished with value: 1.9739321389131386 and parameters: {'learning_rate': 0.9991589851301513, 'aft_loss_distribution': 'normal', 'aft_loss_distribution_scale': 2.2078373005028453, 'max_depth': 10, 'booster': 'dart', 'scale_pos_weight': 2.0603416204216676, 'alpha': 1.89277678311464, 'lambda': 8.487954795845823, 'eta': 0.18297597990374753, 'sampling_method': 'gradient_based', 'subsample': 0.47742860810055077, 'gamma': 5.1048491232597835}. Best is trial 80 with value: 1.9739321389131386.
[I 2023-12-21 00:16:25,993] Trial 81 finished with value: inf and parameters: {'learning_rate': 0.9807925270364382, 'aft_loss_distribution': 'normal', 'aft_loss_distribution_scale': 2.292960821190068, 'max_depth': 10, 'booster': 'dart', 'scale_pos_weight': 2.0114844435903296, 'alpha': 1.892637408531019, 'lambda': 8.580658712989301, 'eta': 0.18264888173992652, 'sampling_method': 'gradient_based', 'subsample': 0.47928881695514897, 'gamma': 5.255270513286503}. Best is trial 80 with value: 1.9739321389131386.
[I 2023-12-21 00:16:26,080] Trial 82 pruned. Trial was pruned at iteration 3.
[I 2023-12-21 00:16:29,905] Trial 83 finished with value: 2.0488667946933634 and parameters: {'learning_rate': 0.9064108681942795, 'aft_loss_distribution': 'normal', 'aft_loss_distribution_scale': 3.051375406516152, 'max_depth': 10, 'booster': 'dart', 'scale_pos_weight': 2.1453612128597683, 'alpha': 4.792319545819254, 'lambda': 9.284023234820841, 'eta': 0.5330816304113221, 'sampling_method': 'gradient_based', 'subsample': 0.4504062897297542, 'gamma': 5.0548425371759205}. Best is trial 80 with value: 1.9739321389131386.
[I 2023-12-21 00:16:32,170] Trial 84 finished with value: inf and parameters: {'learning_rate': 0.9004328028592815, 'aft_loss_distribution': 'normal', 'aft_loss_distribution_scale': 2.633261901732654, 'max_depth': 10, 'booster': 'dart', 'scale_pos_weight': 2.406323504674083, 'alpha': 1.4278411861048457, 'lambda': 9.914885732306121, 'eta': 0.6758387839586777, 'sampling_method': 'gradient_based', 'subsample': 0.4548874898305641, 'gamma': 5.032803762527617}. Best is trial 80 with value: 1.9739321389131386.
[I 2023-12-21 00:16:32,271] Trial 85 pruned. Trial was pruned at iteration 0.
[I 2023-12-21 00:16:32,373] Trial 86 pruned. Trial was pruned at iteration 0.
[I 2023-12-21 00:16:32,468] Trial 87 pruned. Trial was pruned at iteration 0.
[I 2023-12-21 00:16:32,555] Trial 88 pruned. Trial was pruned at iteration 0.
[I 2023-12-21 00:16:32,651] Trial 89 pruned. Trial was pruned at iteration 0.
[I 2023-12-21 00:16:32,739] Trial 90 pruned. Trial was pruned at iteration 0.
[I 2023-12-21 00:16:32,844] Trial 91 pruned. Trial was pruned at iteration 1.
[I 2023-12-21 00:16:42,057] Trial 92 finished with value: 2.039421987160407 and parameters: {'learning_rate': 0.9192280582208872, 'aft_loss_distribution': 'normal', 'aft_loss_distribution_scale': 2.9171249640317316, 'max_depth': 6, 'booster': 'dart', 'scale_pos_weight': 1.5577561203003119, 'alpha': 4.188024015796431, 'lambda': 8.04067056544313, 'eta': 0.1541886303316628, 'sampling_method': 'gradient_based', 'subsample': 0.46560200226250115, 'gamma': 4.222130238192913}. Best is trial 80 with value: 1.9739321389131386.
[I 2023-12-21 00:16:44,537] Trial 93 finished with value: inf and parameters: {'learning_rate': 0.9146333737314657, 'aft_loss_distribution': 'normal', 'aft_loss_distribution_scale': 2.8694263807459333, 'max_depth': 7, 'booster': 'dart', 'scale_pos_weight': 1.566896888484268, 'alpha': 4.19370440419516, 'lambda': 8.108929800364939, 'eta': 0.5051081483144453, 'sampling_method': 'gradient_based', 'subsample': 0.5528449832241134, 'gamma': 4.171412509386702}. Best is trial 80 with value: 1.9739321389131386.
[I 2023-12-21 00:16:44,612] Trial 94 pruned. Trial was pruned at iteration 0.
[I 2023-12-21 00:16:44,675] Trial 95 pruned. Trial was pruned at iteration 0.
[I 2023-12-21 00:16:44,733] Trial 96 pruned. Trial was pruned at iteration 0.
[I 2023-12-21 00:16:49,804] Trial 97 finished with value: 1.9813656366550316 and parameters: {'learning_rate': 0.8324599709916517, 'aft_loss_distribution': 'normal', 'aft_loss_distribution_scale': 2.318588423976175, 'max_depth': 10, 'booster': 'dart', 'scale_pos_weight': 1.8336198783952986, 'alpha': 3.674877973483823, 'lambda': 8.381856162077158, 'eta': 0.15757434266613368, 'sampling_method': 'gradient_based', 'subsample': 0.45099487627642443, 'gamma': 5.444981899732668}. Best is trial 80 with value: 1.9739321389131386.
[I 2023-12-21 00:16:51,461] Trial 98 finished with value: inf and parameters: {'learning_rate': 0.9652160763548016, 'aft_loss_distribution': 'normal', 'aft_loss_distribution_scale': 1.7572838276252494, 'max_depth': 10, 'booster': 'dart', 'scale_pos_weight': 2.4892041096763817, 'alpha': 4.700809175911343, 'lambda': 8.409618926576297, 'eta': 0.15702724372415958, 'sampling_method': 'gradient_based', 'subsample': 0.45712954049378346, 'gamma': 5.72025651105657}. Best is trial 80 with value: 1.9739321389131386.
[I 2023-12-21 00:16:51,534] Trial 99 pruned. Trial was pruned at iteration 1.
[I 2023-12-21 00:16:54,005] Trial 100 finished with value: inf and parameters: {'learning_rate': 0.8275489959231589, 'aft_loss_distribution': 'normal', 'aft_loss_distribution_scale': 2.019029731937804, 'max_depth': 9, 'booster': 'dart', 'scale_pos_weight': 1.561650041008122, 'alpha': 3.5993751308290087, 'lambda': 7.310266146188324, 'eta': 0.23198379527716217, 'sampling_method': 'gradient_based', 'subsample': 0.40120049284747866, 'gamma': 7.679687714824863}. Best is trial 80 with value: 1.9739321389131386.
[I 2023-12-21 00:16:54,074] Trial 101 pruned. Trial was pruned at iteration 1.
[I 2023-12-21 00:16:54,129] Trial 102 pruned. Trial was pruned at iteration 0.
[I 2023-12-21 00:16:54,685] Trial 103 finished with value: 1.988548750961459 and parameters: {'learning_rate': 0.8012610117563993, 'aft_loss_distribution': 'normal', 'aft_loss_distribution_scale': 2.404419369160675, 'max_depth': 10, 'booster': 'gbtree', 'scale_pos_weight': 1.4158836416044123, 'alpha': 4.889342400746495, 'lambda': 8.825348485984696, 'eta': 0.10342820907625469, 'sampling_method': 'gradient_based', 'subsample': 0.527351850367089, 'gamma': 4.7336969002363}. Best is trial 80 with value: 1.9739321389131386.
[I 2023-12-21 00:16:58,197] Trial 104 finished with value: 1.9933054691172472 and parameters: {'learning_rate': 0.8065697857148661, 'aft_loss_distribution': 'normal', 'aft_loss_distribution_scale': 2.4523146040851174, 'max_depth': 10, 'booster': 'dart', 'scale_pos_weight': 1.4540321364966309, 'alpha': 4.473712857582405, 'lambda': 8.833728942573567, 'eta': 0.08391245276354256, 'sampling_method': 'gradient_based', 'subsample': 0.5517920956276825, 'gamma': 5.196325379885942}. Best is trial 80 with value: 1.9739321389131386.
[I 2023-12-21 00:16:58,569] Trial 105 finished with value: 1.974875305374932 and parameters: {'learning_rate': 0.8038902606792651, 'aft_loss_distribution': 'normal', 'aft_loss_distribution_scale': 2.279327334422467, 'max_depth': 10, 'booster': 'gbtree', 'scale_pos_weight': 1.2183300572738847, 'alpha': 4.859199339560068, 'lambda': 8.888916026018721, 'eta': 0.10653719436174425, 'sampling_method': 'gradient_based', 'subsample': 0.6767267490587632, 'gamma': 6.462321377460363}. Best is trial 80 with value: 1.9739321389131386.
[I 2023-12-21 00:16:58,630] Trial 106 pruned. Trial was pruned at iteration 0.
[I 2023-12-21 00:16:59,182] Trial 107 finished with value: 1.9958586513257308 and parameters: {'learning_rate': 0.8705510146434356, 'aft_loss_distribution': 'normal', 'aft_loss_distribution_scale': 2.4771126049746184, 'max_depth': 10, 'booster': 'gbtree', 'scale_pos_weight': 0.9717554117700362, 'alpha': 5.67949826205584, 'lambda': 8.876711146234264, 'eta': 0.026016414415836894, 'sampling_method': 'gradient_based', 'subsample': 0.6494060943410556, 'gamma': 6.071690748328989}. Best is trial 80 with value: 1.9739321389131386.
[I 2023-12-21 00:16:59,253] Trial 108 pruned. Trial was pruned at iteration 0.
