[I 2023-12-21 04:05:03,209] Trial 84 finished with value: inf and parameters: {'learning_rate': 0.9033594623740391, 'aft_loss_distributio                                                                     n': 'normal', 'aft_loss_distribution_scale': 1.5348568393147768, 'max_depth': 7, 'booster': 'gbtree', 'scale_pos_weight': 2.3383533871649                                                                     567, 'alpha': 1.467482247617578, 'lambda': 7.487405494217898, 'eta': 0.3891430139097667, 'sampling_method': 'gradient_based', 'subsample'                                                                     : 0.27305590561356047, 'gamma': 0.8874464668269779}. Best is trial 1 with value: 2.0389176502386084.
[I 2023-12-21 04:05:04,264] Trial 85 finished with value: inf and parameters: {'learning_rate': 0.9380502150850232, 'aft_loss_distributio                                                                     n': 'normal', 'aft_loss_distribution_scale': 2.038202139692007, 'max_depth': 10, 'booster': 'dart', 'scale_pos_weight': 1.758883505790477                                                                     , 'alpha': 0.6885946047868945, 'lambda': 6.616180763602506, 'eta': 0.04069636977822336, 'sampling_method': 'gradient_based', 'subsample':                                                                      0.8157459495079235, 'gamma': 3.9124985173145963}. Best is trial 1 with value: 2.0389176502386084.
[I 2023-12-21 04:05:04,299] Trial 86 pruned. Trial was pruned at iteration 0.
[I 2023-12-21 04:05:04,334] Trial 87 pruned. Trial was pruned at iteration 0.
[I 2023-12-21 04:05:04,369] Trial 88 pruned. Trial was pruned at iteration 0.
[I 2023-12-21 04:05:04,404] Trial 89 pruned. Trial was pruned at iteration 0.
[I 2023-12-21 04:05:04,439] Trial 90 pruned. Trial was pruned at iteration 0.
[I 2023-12-21 04:05:04,473] Trial 91 pruned. Trial was pruned at iteration 0.
[I 2023-12-21 04:05:04,613] Trial 92 finished with value: inf and parameters: {'learning_rate': 0.9569860026603917, 'aft_loss_distributio                                                                     n': 'normal', 'aft_loss_distribution_scale': 1.8109030793944316, 'max_depth': 6, 'booster': 'gbtree', 'scale_pos_weight': 0.6958858158939                                                                     843, 'alpha': 1.1089384651305942, 'lambda': 7.146217208169825, 'eta': 0.26409823928333276, 'sampling_method': 'gradient_based', 'subsampl                                                                     e': 0.596855759247927, 'gamma': 1.232929846796706}. Best is trial 1 with value: 2.0389176502386084.
[I 2023-12-21 04:05:04,647] Trial 93 pruned. Trial was pruned at iteration 0.
[I 2023-12-21 04:05:04,682] Trial 94 pruned. Trial was pruned at iteration 0.
[I 2023-12-21 04:05:04,718] Trial 95 pruned. Trial was pruned at iteration 0.
[I 2023-12-21 04:05:04,755] Trial 96 pruned. Trial was pruned at iteration 0.
[I 2023-12-21 04:05:04,791] Trial 97 pruned. Trial was pruned at iteration 0.
[I 2023-12-21 04:05:04,825] Trial 98 pruned. Trial was pruned at iteration 0.
[I 2023-12-21 04:05:04,862] Trial 99 pruned. Trial was pruned at iteration 0.
[I 2023-12-21 04:05:04,898] Trial 100 pruned. Trial was pruned at iteration 0.
[I 2023-12-21 04:05:04,933] Trial 101 pruned. Trial was pruned at iteration 0.
[I 2023-12-21 04:05:04,968] Trial 102 pruned. Trial was pruned at iteration 0.
[I 2023-12-21 04:05:05,108] Trial 103 finished with value: inf and parameters: {'learning_rate': 0.9978968895356263, 'aft_loss_distributi                                                                     on': 'normal', 'aft_loss_distribution_scale': 1.6430170168150544, 'max_depth': 5, 'booster': 'gbtree', 'scale_pos_weight': 1.969036298023                                                                     6735, 'alpha': 3.477463426522753, 'lambda': 8.552082596398181, 'eta': 0.16337631839485572, 'sampling_method': 'gradient_based', 'subsampl                                                                     e': 0.6264422063293711, 'gamma': 1.0438150676077054}. Best is trial 1 with value: 2.0389176502386084.
[I 2023-12-21 04:05:05,145] Trial 104 pruned. Trial was pruned at iteration 0.
[I 2023-12-21 04:05:05,181] Trial 105 pruned. Trial was pruned at iteration 0.
[I 2023-12-21 04:05:05,314] Trial 106 finished with value: inf and parameters: {'learning_rate': 0.9517123361392067, 'aft_loss_distributi                                                                     on': 'normal', 'aft_loss_distribution_scale': 1.8278865089935326, 'max_depth': 4, 'booster': 'gbtree', 'scale_pos_weight': 2.676125945758                                                                     6375, 'alpha': 2.174536544654167, 'lambda': 6.0509627684391125, 'eta': 0.8384463097070872, 'sampling_method': 'uniform', 'subsample': 0.5                                                                     642986468775002, 'gamma': 0.7464574715743666}. Best is trial 1 with value: 2.0389176502386084.
[I 2023-12-21 04:05:05,350] Trial 107 pruned. Trial was pruned at iteration 0.
[I 2023-12-21 04:05:05,386] Trial 108 pruned. Trial was pruned at iteration 0.
[I 2023-12-21 04:05:05,659] Trial 109 finished with value: 2.0061473443077613 and parameters: {'learning_rate': 0.22827121664663808, 'aft                                                                     _loss_distribution': 'logistic', 'aft_loss_distribution_scale': 0.9932911317030391, 'max_depth': 8, 'booster': 'gbtree', 'scale_pos_weigh                                                                     t': 1.7725653320657604, 'alpha': 7.589624571049894, 'lambda': 7.379248015993103, 'eta': 0.07679498343782562, 'sampling_method': 'uniform'                                                                     , 'subsample': 0.18258719903888646, 'gamma': 7.526969389634228}. Best is trial 109 with value: 2.0061473443077613.
[I 2023-12-21 04:05:05,695] Trial 110 pruned. Trial was pruned at iteration 0.
[I 2023-12-21 04:05:05,730] Trial 111 pruned. Trial was pruned at iteration 0.
[I 2023-12-21 04:05:05,766] Trial 112 pruned. Trial was pruned at iteration 0.
[I 2023-12-21 04:05:05,801] Trial 113 pruned. Trial was pruned at iteration 0.
[I 2023-12-21 04:05:05,839] Trial 114 pruned. Trial was pruned at iteration 0.
[I 2023-12-21 04:05:05,877] Trial 115 pruned. Trial was pruned at iteration 0.
[I 2023-12-21 04:05:05,913] Trial 116 pruned. Trial was pruned at iteration 0.
[I 2023-12-21 04:05:05,949] Trial 117 pruned. Trial was pruned at iteration 0.
[I 2023-12-21 04:05:05,985] Trial 118 pruned. Trial was pruned at iteration 0.
[I 2023-12-21 04:05:06,021] Trial 119 pruned. Trial was pruned at iteration 0.
[I 2023-12-21 04:05:06,059] Trial 120 pruned. Trial was pruned at iteration 0.
[I 2023-12-21 04:05:06,170] Trial 121 finished with value: inf and parameters: {'learning_rate': 0.9693774776947816, 'aft_loss_distributi                                                                     on': 'normal', 'aft_loss_distribution_scale': 1.3956535170903157, 'max_depth': 3, 'booster': 'gbtree', 'scale_pos_weight': 2.143247613845                                                                     5625, 'alpha': 9.459546843355085, 'lambda': 3.4402016718770057, 'eta': 0.5304620289790866, 'sampling_method': 'gradient_based', 'subsampl                                                                     e': 0.8440721864527486, 'gamma': 4.253731823089406}. Best is trial 109 with value: 2.0061473443077613.
[I 2023-12-21 04:05:06,207] Trial 122 pruned. Trial was pruned at iteration 0.
[I 2023-12-21 04:05:06,315] Trial 123 finished with value: inf and parameters: {'learning_rate': 0.966979116238606, 'aft_loss_distributio                                                                     n': 'normal', 'aft_loss_distribution_scale': 2.1352562976321874, 'max_depth': 4, 'booster': 'gbtree', 'scale_pos_weight': 1.1885929383187                                                                     996, 'alpha': 8.898335942436038, 'lambda': 3.1704649685543322, 'eta': 0.5793774690632848, 'sampling_method': 'gradient_based', 'subsample                                                                     ': 0.7972842971057807, 'gamma': 5.098745698018898}. Best is trial 109 with value: 2.0061473443077613.
[I 2023-12-21 04:05:06,354] Trial 124 pruned. Trial was pruned at iteration 0.
[I 2023-12-21 04:05:06,390] Trial 125 pruned. Trial was pruned at iteration 0.
[I 2023-12-21 04:05:06,426] Trial 126 pruned. Trial was pruned at iteration 0.
[I 2023-12-21 04:05:06,463] Trial 127 pruned. Trial was pruned at iteration 0.
[I 2023-12-21 04:05:06,501] Trial 128 pruned. Trial was pruned at iteration 0.
[I 2023-12-21 04:05:06,539] Trial 129 pruned. Trial was pruned at iteration 0.
[I 2023-12-21 04:05:06,575] Trial 130 pruned. Trial was pruned at iteration 0.
[I 2023-12-21 04:05:06,612] Trial 131 pruned. Trial was pruned at iteration 0.
[I 2023-12-21 04:05:06,648] Trial 132 pruned. Trial was pruned at iteration 0.
[I 2023-12-21 04:05:06,685] Trial 133 pruned. Trial was pruned at iteration 0.
[I 2023-12-21 04:05:06,721] Trial 134 pruned. Trial was pruned at iteration 0.
[I 2023-12-21 04:05:06,759] Trial 135 pruned. Trial was pruned at iteration 0.
[I 2023-12-21 04:05:06,797] Trial 136 pruned. Trial was pruned at iteration 0.
[I 2023-12-21 04:05:06,833] Trial 137 pruned. Trial was pruned at iteration 0.
[I 2023-12-21 04:05:06,872] Trial 138 pruned. Trial was pruned at iteration 0.
[I 2023-12-21 04:05:06,910] Trial 139 pruned. Trial was pruned at iteration 0.
[I 2023-12-21 04:05:06,947] Trial 140 pruned. Trial was pruned at iteration 0.
[I 2023-12-21 04:05:06,993] Trial 141 pruned. Trial was pruned at iteration 0.
[I 2023-12-21 04:05:07,031] Trial 142 pruned. Trial was pruned at iteration 0.
[I 2023-12-21 04:05:07,068] Trial 143 pruned. Trial was pruned at iteration 0.
[I 2023-12-21 04:05:07,106] Trial 144 pruned. Trial was pruned at iteration 0.
[I 2023-12-21 04:05:07,147] Trial 145 pruned. Trial was pruned at iteration 0.
[I 2023-12-21 04:05:07,184] Trial 146 pruned. Trial was pruned at iteration 0.
[I 2023-12-21 04:05:07,222] Trial 147 pruned. Trial was pruned at iteration 0.
[I 2023-12-21 04:05:07,261] Trial 148 pruned. Trial was pruned at iteration 0.
[I 2023-12-21 04:05:07,298] Trial 149 pruned. Trial was pruned at iteration 0.
[I 2023-12-21 04:05:07,339] Trial 150 pruned. Trial was pruned at iteration 0.
[I 2023-12-21 04:05:08,433] Trial 151 finished with value: inf and parameters: {'learning_rate': 0.9368121062916316, 'aft_loss_distributi                                                                     on': 'normal', 'aft_loss_distribution_scale': 2.00478640111973, 'max_depth': 10, 'booster': 'dart', 'scale_pos_weight': 1.721704696005643                                                                     7, 'alpha': 0.09251474878111454, 'lambda': 6.980571508713502, 'eta': 0.07432230760459174, 'sampling_method': 'gradient_based', 'subsample                                                                     ': 0.8061259312099968, 'gamma': 4.298387938165335}. Best is trial 109 with value: 2.0061473443077613.
[I 2023-12-21 04:05:08,473] Trial 152 pruned. Trial was pruned at iteration 0.
[I 2023-12-21 04:05:10,379] Trial 153 finished with value: inf and parameters: {'learning_rate': 0.9637251108514617, 'aft_loss_distributi                                                                     on': 'normal', 'aft_loss_distribution_scale': 1.7618847657955898, 'max_depth': 9, 'booster': 'dart', 'scale_pos_weight': 1.91500339902012                                                                     07, 'alpha': 0.3920221560982724, 'lambda': 6.797235836486252, 'eta': 0.22360400349100387, 'sampling_method': 'gradient_based', 'subsample                                                                     ': 0.8817769044383063, 'gamma': 4.5881266379639065}. Best is trial 109 with value: 2.0061473443077613.
[I 2023-12-21 04:05:10,418] Trial 154 pruned. Trial was pruned at iteration 0.
[I 2023-12-21 04:05:11,435] Trial 155 finished with value: inf and parameters: {'learning_rate': 0.9915224205652861, 'aft_loss_distributi                                                                     on': 'normal', 'aft_loss_distribution_scale': 1.4348290913629338, 'max_depth': 7, 'booster': 'dart', 'scale_pos_weight': 0.98065344456702                                                                     96, 'alpha': 0.5369091386003911, 'lambda': 7.632009466298177, 'eta': 0.00011176013041450106, 'sampling_method': 'gradient_based', 'subsam                                                                     ple': 0.8098598288095475, 'gamma': 3.625410009990423}. Best is trial 109 with value: 2.0061473443077613.
[I 2023-12-21 04:05:11,474] Trial 156 pruned. Trial was pruned at iteration 0.
[I 2023-12-21 04:05:12,554] Trial 157 finished with value: inf and parameters: {'learning_rate': 0.9440482336371222, 'aft_loss_distributi                                                                     on': 'normal', 'aft_loss_distribution_scale': 1.5800044891514222, 'max_depth': 4, 'booster': 'dart', 'scale_pos_weight': 1.18575026202145                                                                     53, 'alpha': 4.071100336319958, 'lambda': 1.1265389869934594, 'eta': 0.09892246066741789, 'sampling_method': 'gradient_based', 'subsample                                                                     ': 0.6435594945240131, 'gamma': 0.9631389939967482}. Best is trial 109 with value: 2.0061473443077613.
[I 2023-12-21 04:05:12,592] Trial 158 pruned. Trial was pruned at iteration 0.
[I 2023-12-21 04:05:12,630] Trial 159 pruned. Trial was pruned at iteration 0.
[I 2023-12-21 04:05:12,668] Trial 160 pruned. Trial was pruned at iteration 0.
[I 2023-12-21 04:05:12,800] Trial 161 finished with value: inf and parameters: {'learning_rate': 0.9646881535993883, 'aft_loss_distributi                                                                     on': 'normal', 'aft_loss_distribution_scale': 1.7776523104072492, 'max_depth': 6, 'booster': 'gbtree', 'scale_pos_weight': 0.693228034162                                                                     3291, 'alpha': 1.062646820729777, 'lambda': 6.49246606887494, 'eta': 0.25559814003151904, 'sampling_method': 'gradient_based', 'subsample                                                                     ': 0.5997185785692914, 'gamma': 1.9252474569947136}. Best is trial 109 with value: 2.0061473443077613.
[I 2023-12-21 04:05:12,841] Trial 162 pruned. Trial was pruned at iteration 1.
[I 2023-12-21 04:05:12,981] Trial 163 finished with value: inf and parameters: {'learning_rate': 0.9987462458044029, 'aft_loss_distributi                                                                     on': 'normal', 'aft_loss_distribution_scale': 1.5422755918161675, 'max_depth': 6, 'booster': 'gbtree', 'scale_pos_weight': 0.465038841959                                                                     3609, 'alpha': 0.7774787898539844, 'lambda': 7.0640252496388065, 'eta': 0.03953857020862547, 'sampling_method': 'gradient_based', 'subsam                                                                     ple': 0.5808715114483093, 'gamma': 1.4999031316198075}. Best is trial 109 with value: 2.0061473443077613.
[I 2023-12-21 04:05:13,021] Trial 164 pruned. Trial was pruned at iteration 0.
[I 2023-12-21 04:05:13,058] Trial 165 pruned. Trial was pruned at iteration 0.
[I 2023-12-21 04:05:13,096] Trial 166 pruned. Trial was pruned at iteration 0.
[I 2023-12-21 04:05:13,134] Trial 167 pruned. Trial was pruned at iteration 0.
[I 2023-12-21 04:05:13,172] Trial 168 pruned. Trial was pruned at iteration 0.
[I 2023-12-21 04:05:13,212] Trial 169 pruned. Trial was pruned at iteration 0.
[I 2023-12-21 04:05:13,257] Trial 170 pruned. Trial was pruned at iteration 0.
[I 2023-12-21 04:05:13,401] Trial 171 finished with value: inf and parameters: {'learning_rate': 0.997481442948137, 'aft_loss_distributio                                                                     n': 'normal', 'aft_loss_distribution_scale': 1.6662277086595145, 'max_depth': 5, 'booster': 'gbtree', 'scale_pos_weight': 1.8657671968164                                                                     453, 'alpha': 5.302190495428619, 'lambda': 7.8855533444448715, 'eta': 0.26223400012394216, 'sampling_method': 'gradient_based', 'subsampl                                                                     e': 0.6054271719676804, 'gamma': 1.027884118158404}. Best is trial 109 with value: 2.0061473443077613.
[I 2023-12-21 04:05:13,441] Trial 172 pruned. Trial was pruned at iteration 0.
[I 2023-12-21 04:05:13,578] Trial 173 finished with value: inf and parameters: {'learning_rate': 0.9729670764084986, 'aft_loss_distributi                                                                     on': 'normal', 'aft_loss_distribution_scale': 1.5809052331133058, 'max_depth': 5, 'booster': 'gbtree', 'scale_pos_weight': 2.011069207470                                                                     662, 'alpha': 3.882710943368128, 'lambda': 7.149176350696039, 'eta': 0.7305549905509989, 'sampling_method': 'gradient_based', 'subsample'                                                                     : 0.6238391353085108, 'gamma': 1.1183525228271436}. Best is trial 109 with value: 2.0061473443077613.
[I 2023-12-21 04:05:13,618] Trial 174 pruned. Trial was pruned at iteration 0.
[I 2023-12-21 04:05:13,657] Trial 175 pruned. Trial was pruned at iteration 0.
[I 2023-12-21 04:05:13,695] Trial 176 pruned. Trial was pruned at iteration 0.
[I 2023-12-21 04:05:13,734] Trial 177 pruned. Trial was pruned at iteration 0.
[I 2023-12-21 04:05:13,774] Trial 178 pruned. Trial was pruned at iteration 0.
[I 2023-12-21 04:05:13,813] Trial 179 pruned. Trial was pruned at iteration 0.
[I 2023-12-21 04:05:13,853] Trial 180 pruned. Trial was pruned at iteration 0.
[I 2023-12-21 04:05:13,990] Trial 181 finished with value: inf and parameters: {'learning_rate': 0.9556772583405063, 'aft_loss_distributi                                                                     on': 'normal', 'aft_loss_distribution_scale': 1.7996887966484625, 'max_depth': 4, 'booster': 'gbtree', 'scale_pos_weight': 2.564553906554                                                                     3206, 'alpha': 2.1289500065928926, 'lambda': 5.855522281144594, 'eta': 0.836159876425881, 'sampling_method': 'uniform', 'subsample': 0.56                                                                     28709202500045, 'gamma': 0.7493081940616801}. Best is trial 109 with value: 2.0061473443077613.
[I 2023-12-21 04:05:14,029] Trial 182 pruned. Trial was pruned at iteration 0.
[I 2023-12-21 04:05:14,068] Trial 183 pruned. Trial was pruned at iteration 0.
[I 2023-12-21 04:05:14,107] Trial 184 pruned. Trial was pruned at iteration 0.
[I 2023-12-21 04:05:14,148] Trial 185 pruned. Trial was pruned at iteration 0.
[I 2023-12-21 04:05:14,187] Trial 186 pruned. Trial was pruned at iteration 0.
[I 2023-12-21 04:05:14,227] Trial 187 pruned. Trial was pruned at iteration 0.
[I 2023-12-21 04:05:14,267] Trial 188 pruned. Trial was pruned at iteration 0.
[I 2023-12-21 04:05:14,308] Trial 189 pruned. Trial was pruned at iteration 0.
[I 2023-12-21 04:05:14,351] Trial 190 pruned. Trial was pruned at iteration 0.
[I 2023-12-21 04:05:14,469] Trial 191 finished with value: inf and parameters: {'learning_rate': 0.960402949934459, 'aft_loss_distributio                                                                     n': 'normal', 'aft_loss_distribution_scale': 1.5121707106961024, 'max_depth': 6, 'booster': 'gbtree', 'scale_pos_weight': 2.1821346976225                                                                     77, 'alpha': 9.230714984879894, 'lambda': 3.5298966016474527, 'eta': 0.938163195629245, 'sampling_method': 'gradient_based', 'subsample':                                                                      0.8442472154386318, 'gamma': 4.072545957176859}. Best is trial 109 with value: 2.0061473443077613.
[I 2023-12-21 04:05:14,587] Trial 192 finished with value: inf and parameters: {'learning_rate': 0.9732292939300726, 'aft_loss_distributi                                                                     on': 'normal', 'aft_loss_distribution_scale': 1.3326649300296065, 'max_depth': 3, 'booster': 'gbtree', 'scale_pos_weight': 2.102515127640                                                                     756, 'alpha': 9.535579553198684, 'lambda': 2.6678753185976642, 'eta': 0.5786379531566812, 'sampling_method': 'gradient_based', 'subsample                                                                     ': 0.8467892756322397, 'gamma': 4.383553746633772}. Best is trial 109 with value: 2.0061473443077613.
[I 2023-12-21 04:05:14,628] Trial 193 pruned. Trial was pruned at iteration 0.
[I 2023-12-21 04:05:14,668] Trial 194 pruned. Trial was pruned at iteration 0.
[I 2023-12-21 04:05:14,708] Trial 195 pruned. Trial was pruned at iteration 0.
[I 2023-12-21 04:05:14,748] Trial 196 pruned. Trial was pruned at iteration 0.
[I 2023-12-21 04:05:14,789] Trial 197 pruned. Trial was pruned at iteration 0.
[I 2023-12-21 04:05:14,829] Trial 198 pruned. Trial was pruned at iteration 0.
[I 2023-12-21 04:05:14,871] Trial 199 pruned. Trial was pruned at iteration 0.
[I 2023-12-21 04:05:14,911] Trial 200 pruned. Trial was pruned at iteration 0.
[I 2023-12-21 04:05:14,951] Trial 201 pruned. Trial was pruned at iteration 0.
[I 2023-12-21 04:05:14,994] Trial 202 pruned. Trial was pruned at iteration 1.
[I 2023-12-21 04:05:15,034] Trial 203 pruned. Trial was pruned at iteration 0.
[I 2023-12-21 04:05:15,075] Trial 204 pruned. Trial was pruned at iteration 0.
[I 2023-12-21 04:05:15,116] Trial 205 pruned. Trial was pruned at iteration 0.
[I 2023-12-21 04:05:15,159] Trial 206 pruned. Trial was pruned at iteration 0.
[I 2023-12-21 04:05:15,200] Trial 207 pruned. Trial was pruned at iteration 0.
