[I 2023-12-19 05:24:29,119] Trial 29 pruned. Trial was pruned at iteration 0.
[I 2023-12-19 05:24:29,185] Trial 30 pruned. Trial was pruned at iteration 0.
[I 2023-12-19 05:24:33,461] Trial 31 finished with value: 4.590936277572881 and parameters: {'learning_rate': 0.4409999625683019, 'aft_loss_distribution': 'normal', 'aft_loss_distribution_scale': 2.2253440327204683, 'max_depth': 10, 'booster': 'dart', 'scale_pos_weight': 6.848630042042087, 'alpha': 5.809573084486277, 'lambda': 4.3242745529140745, 'eta': 0.4573453204706115, 'sampling_method': 'uniform', 'subsample': 0.4229127447000282, 'gamma': 4.287215307193828}. Best is trial 15 with value: 4.495316343011394.
[I 2023-12-19 05:25:10,206] Trial 32 finished with value: 4.512661021637226 and parameters: {'learning_rate': 0.6666275742657708, 'aft_loss_distribution': 'normal', 'aft_loss_distribution_scale': 1.998473420542573, 'max_depth': 10, 'booster': 'dart', 'scale_pos_weight': 6.712635073464506, 'alpha': 5.331419878808797, 'lambda': 5.019383457593297, 'eta': 0.4347646610875002, 'sampling_method': 'uniform', 'subsample': 0.41447046215114036, 'gamma': 4.434777058489184}. Best is trial 15 with value: 4.495316343011394.
[I 2023-12-19 05:25:12,489] Trial 33 finished with value: inf and parameters: {'learning_rate': 0.6794272634265626, 'aft_loss_distribution': 'normal', 'aft_loss_distribution_scale': 1.344691152003703, 'max_depth': 10, 'booster': 'dart', 'scale_pos_weight': 6.581381066380741, 'alpha': 5.540989103730235, 'lambda': 5.1657896109114, 'eta': 0.3567210652252106, 'sampling_method': 'uniform', 'subsample': 0.4136479653561983, 'gamma': 4.2065167751399155}. Best is trial 15 with value: 4.495316343011394.
[I 2023-12-19 05:25:12,566] Trial 34 pruned. Trial was pruned at iteration 2.
[I 2023-12-19 05:25:15,251] Trial 35 finished with value: inf and parameters: {'learning_rate': 0.8051848890203754, 'aft_loss_distribution': 'normal', 'aft_loss_distribution_scale': 1.8135949643426188, 'max_depth': 9, 'booster': 'dart', 'scale_pos_weight': 7.155339978089876, 'alpha': 4.173517926613481, 'lambda': 2.920161157801835, 'eta': 0.2818556646491463, 'sampling_method': 'uniform', 'subsample': 0.4529268320483161, 'gamma': 3.8495742172071106}. Best is trial 15 with value: 4.495316343011394.
[I 2023-12-19 05:25:15,328] Trial 36 pruned. Trial was pruned at iteration 0.
[I 2023-12-19 05:25:15,404] Trial 37 pruned. Trial was pruned at iteration 0.
[I 2023-12-19 05:25:15,476] Trial 38 pruned. Trial was pruned at iteration 0.
[I 2023-12-19 05:25:15,548] Trial 39 pruned. Trial was pruned at iteration 0.
[I 2023-12-19 05:25:15,620] Trial 40 pruned. Trial was pruned at iteration 0.
[I 2023-12-19 05:25:21,732] Trial 41 finished with value: 4.599346372331806 and parameters: {'learning_rate': 0.46282200488332115, 'aft_loss_distribution': 'normal', 'aft_loss_distribution_scale': 2.2475487441741353, 'max_depth': 8, 'booster': 'dart', 'scale_pos_weight': 4.7754964397355915, 'alpha': 6.253545656244153, 'lambda': 4.199475033661821, 'eta': 0.4544083942820419, 'sampling_method': 'uniform', 'subsample': 0.35128663939716376, 'gamma': 8.893908239198508}. Best is trial 15 with value: 4.495316343011394.
[I 2023-12-19 05:25:27,420] Trial 42 finished with value: 4.571127758877995 and parameters: {'learning_rate': 0.4257683272262971, 'aft_loss_distribution': 'normal', 'aft_loss_distribution_scale': 2.1600240022986523, 'max_depth': 10, 'booster': 'dart', 'scale_pos_weight': 5.580967353862136, 'alpha': 5.906764221097111, 'lambda': 3.3042498009746426, 'eta': 0.4346566631317851, 'sampling_method': 'uniform', 'subsample': 0.2491130160473205, 'gamma': 8.102820356283315}. Best is trial 15 with value: 4.495316343011394.
[I 2023-12-19 05:25:37,043] Trial 43 finished with value: 4.407861790863663 and parameters: {'learning_rate': 0.5269033986940174, 'aft_loss_distribution': 'normal', 'aft_loss_distribution_scale': 1.68919249022881, 'max_depth': 10, 'booster': 'dart', 'scale_pos_weight': 5.739183450551398, 'alpha': 5.134508369561586, 'lambda': 3.5180244642152565, 'eta': 0.31435638064540766, 'sampling_method': 'uniform', 'subsample': 0.1008771370096245, 'gamma': 7.566237929623946}. Best is trial 43 with value: 4.407861790863663.
[I 2023-12-19 05:25:41,641] Trial 44 finished with value: 4.42519975525495 and parameters: {'learning_rate': 0.5113983519858636, 'aft_loss_distribution': 'normal', 'aft_loss_distribution_scale': 1.721023063605394, 'max_depth': 10, 'booster': 'dart', 'scale_pos_weight': 5.712180304292037, 'alpha': 5.077728575967295, 'lambda': 3.7353621697464012, 'eta': 0.32883120998495335, 'sampling_method': 'uniform', 'subsample': 0.03016467654531467, 'gamma': 7.7886320992059614}. Best is trial 43 with value: 4.407861790863663.
[I 2023-12-19 05:25:41,711] Trial 45 pruned. Trial was pruned at iteration 0.
[I 2023-12-19 05:25:41,788] Trial 46 pruned. Trial was pruned at iteration 1.
[I 2023-12-19 05:25:41,859] Trial 47 pruned. Trial was pruned at iteration 0.
[I 2023-12-19 05:25:41,932] Trial 48 pruned. Trial was pruned at iteration 0.
[I 2023-12-19 05:25:42,000] Trial 49 pruned. Trial was pruned at iteration 0.
[I 2023-12-19 05:25:42,074] Trial 50 pruned. Trial was pruned at iteration 0.
[I 2023-12-19 05:26:03,319] Trial 51 finished with value: 4.436087860327622 and parameters: {'learning_rate': 0.5213758242572488, 'aft_loss_distribution': 'normal', 'aft_loss_distribution_scale': 1.7707516018483278, 'max_depth': 10, 'booster': 'dart', 'scale_pos_weight': 5.615590565393947, 'alpha': 5.345606462082479, 'lambda': 3.2460222493906805, 'eta': 0.5381474126319513, 'sampling_method': 'uniform', 'subsample': 0.22025295036037384, 'gamma': 8.026391317552518}. Best is trial 43 with value: 4.407861790863663.
[I 2023-12-19 05:26:05,873] Trial 52 finished with value: inf and parameters: {'learning_rate': 0.5023677894681797, 'aft_loss_distribution': 'normal', 'aft_loss_distribution_scale': 1.7371821875072802, 'max_depth': 10, 'booster': 'dart', 'scale_pos_weight': 4.440018319560109, 'alpha': 5.295628923051113, 'lambda': 2.464929882727825, 'eta': 0.49817325186664263, 'sampling_method': 'uniform', 'subsample': 0.057259255730484376, 'gamma': 8.680267220694283}. Best is trial 43 with value: 4.407861790863663.
[I 2023-12-19 05:26:05,946] Trial 53 pruned. Trial was pruned at iteration 0.
[I 2023-12-19 05:26:09,339] Trial 54 finished with value: inf and parameters: {'learning_rate': 0.7076168825201088, 'aft_loss_distribution': 'normal', 'aft_loss_distribution_scale': 1.054883494833772, 'max_depth': 10, 'booster': 'dart', 'scale_pos_weight': 6.467609642350898, 'alpha': 6.855958768914665, 'lambda': 3.439885437291334, 'eta': 0.5352993409455529, 'sampling_method': 'uniform', 'subsample': 0.2614702032184843, 'gamma': 7.402883919667521}. Best is trial 43 with value: 4.407861790863663.
[I 2023-12-19 05:26:09,412] Trial 55 pruned. Trial was pruned at iteration 0.
[I 2023-12-19 05:26:09,482] Trial 56 pruned. Trial was pruned at iteration 0.
[I 2023-12-19 05:26:09,555] Trial 57 pruned. Trial was pruned at iteration 0.
[I 2023-12-19 05:26:09,629] Trial 58 pruned. Trial was pruned at iteration 0.
[I 2023-12-19 05:26:09,706] Trial 59 pruned. Trial was pruned at iteration 0.
[I 2023-12-19 05:26:09,777] Trial 60 pruned. Trial was pruned at iteration 0.
[I 2023-12-19 05:26:30,555] Trial 61 finished with value: 4.506054850298081 and parameters: {'learning_rate': 0.8721811804453689, 'aft_loss_distribution': 'normal', 'aft_loss_distribution_scale': 1.9697254869476706, 'max_depth': 10, 'booster': 'dart', 'scale_pos_weight': 5.537879359088545, 'alpha': 8.660361615349547, 'lambda': 3.409591262859001, 'eta': 0.40975002164287616, 'sampling_method': 'uniform', 'subsample': 0.2688194059066886, 'gamma': 7.986784408455017}. Best is trial 43 with value: 4.407861790863663.
[I 2023-12-19 05:26:30,640] Trial 62 pruned. Trial was pruned at iteration 2.
[I 2023-12-19 05:26:30,712] Trial 63 pruned. Trial was pruned at iteration 0.
[I 2023-12-19 05:26:32,546] Trial 64 finished with value: inf and parameters: {'learning_rate': 0.96281369117847, 'aft_loss_distribution': 'normal', 'aft_loss_distribution_scale': 1.1110900248808981, 'max_depth': 10, 'booster': 'dart', 'scale_pos_weight': 6.5970209578086605, 'alpha': 8.857131580512828, 'lambda': 4.604470873611971, 'eta': 0.404788248175003, 'sampling_method': 'uniform', 'subsample': 0.191699966261597, 'gamma': 6.328532823635154}. Best is trial 43 with value: 4.407861790863663.
[I 2023-12-19 05:26:36,026] Trial 65 finished with value: 4.379864643346266 and parameters: {'learning_rate': 0.8436808961521487, 'aft_loss_distribution': 'normal', 'aft_loss_distribution_scale': 1.6046749365628288, 'max_depth': 9, 'booster': 'dart', 'scale_pos_weight': 7.124710432624989, 'alpha': 9.328678286546332, 'lambda': 2.649294529299352, 'eta': 0.4862900870727736, 'sampling_method': 'uniform', 'subsample': 0.14908130339639022, 'gamma': 7.077988730767855}. Best is trial 65 with value: 4.379864643346266.
[I 2023-12-19 05:26:36,116] Trial 66 pruned. Trial was pruned at iteration 0.
[I 2023-12-19 05:26:36,193] Trial 67 pruned. Trial was pruned at iteration 0.
[I 2023-12-19 05:26:38,915] Trial 68 finished with value: inf and parameters: {'learning_rate': 0.9988198587265015, 'aft_loss_distribution': 'normal', 'aft_loss_distribution_scale': 0.7179295518575238, 'max_depth': 9, 'booster': 'dart', 'scale_pos_weight': 5.519724271069576, 'alpha': 8.745715178840053, 'lambda': 1.823332057647743, 'eta': 0.6105657497152858, 'sampling_method': 'uniform', 'subsample': 0.6073255743312832, 'gamma': 4.724615727679309}. Best is trial 65 with value: 4.379864643346266.
[I 2023-12-19 05:26:38,994] Trial 69 pruned. Trial was pruned at iteration 1.
[I 2023-12-19 05:26:39,648] Trial 70 finished with value: 4.5082214752386465 and parameters: {'learning_rate': 0.7836473278184274, 'aft_loss_distribution': 'normal', 'aft_loss_distribution_scale': 1.9767001810472016, 'max_depth': 8, 'booster': 'gbtree', 'scale_pos_weight': 7.419414365331145, 'alpha': 9.051564073927716, 'lambda': 3.5591202716960972, 'eta': 0.47875442156014325, 'sampling_method': 'uniform', 'subsample': 0.10963980236528478, 'gamma': 5.98757613001534}. Best is trial 65 with value: 4.379864643346266.
[I 2023-12-19 05:26:40,023] Trial 71 finished with value: 4.485874316739525 and parameters: {'learning_rate': 0.7687888223039129, 'aft_loss_distribution': 'normal', 'aft_loss_distribution_scale': 1.9094584295525723, 'max_depth': 8, 'booster': 'gbtree', 'scale_pos_weight': 6.811478953893612, 'alpha': 9.303655864690853, 'lambda': 2.7965780876187996, 'eta': 0.5609421792968372, 'sampling_method': 'uniform', 'subsample': 0.11165959980727463, 'gamma': 5.9517622041060525}. Best is trial 65 with value: 4.379864643346266.
[I 2023-12-19 05:26:42,087] Trial 72 finished with value: 4.3862162613093645 and parameters: {'learning_rate': 0.7649484544560291, 'aft_loss_distribution': 'normal', 'aft_loss_distribution_scale': 1.6253979847365096, 'max_depth': 8, 'booster': 'gbtree', 'scale_pos_weight': 7.402947428509739, 'alpha': 9.936132893473212, 'lambda': 2.6146742848507056, 'eta': 0.5652577332970167, 'sampling_method': 'uniform', 'subsample': 0.11261774354196287, 'gamma': 6.031822095572092}. Best is trial 65 with value: 4.379864643346266.
[I 2023-12-19 05:26:42,918] Trial 73 finished with value: inf and parameters: {'learning_rate': 0.8403494495451804, 'aft_loss_distribution': 'normal', 'aft_loss_distribution_scale': 1.1970358414211555, 'max_depth': 7, 'booster': 'gbtree', 'scale_pos_weight': 8.001940482360153, 'alpha': 9.920214779845788, 'lambda': 2.869207262199324, 'eta': 0.6825245699473713, 'sampling_method': 'uniform', 'subsample': 0.04872454563077265, 'gamma': 6.78734828398325}. Best is trial 65 with value: 4.379864643346266.
[I 2023-12-19 05:26:44,212] Trial 74 finished with value: 4.391862986121991 and parameters: {'learning_rate': 0.7591133923361526, 'aft_loss_distribution': 'normal', 'aft_loss_distribution_scale': 1.6356914610416828, 'max_depth': 8, 'booster': 'gbtree', 'scale_pos_weight': 7.666782491292244, 'alpha': 9.348822404392287, 'lambda': 2.2526464496780267, 'eta': 0.5718563833915157, 'sampling_method': 'uniform', 'subsample': 0.08638365644632957, 'gamma': 7.120092490190687}. Best is trial 65 with value: 4.379864643346266.
[I 2023-12-19 05:26:44,765] Trial 75 finished with value: 4.365584516831058 and parameters: {'learning_rate': 0.7861058579965028, 'aft_loss_distribution': 'normal', 'aft_loss_distribution_scale': 1.5645537164490433, 'max_depth': 8, 'booster': 'gbtree', 'scale_pos_weight': 7.693699961220028, 'alpha': 9.359382032761133, 'lambda': 0.9429662177935492, 'eta': 0.5722886882014063, 'sampling_method': 'uniform', 'subsample': 0.09147649313687731, 'gamma': 6.417045555577753}. Best is trial 75 with value: 4.365584516831058.
[I 2023-12-19 05:26:45,133] Trial 76 finished with value: inf and parameters: {'learning_rate': 0.7310088631494851, 'aft_loss_distribution': 'normal', 'aft_loss_distribution_scale': 1.580876941923318, 'max_depth': 8, 'booster': 'gbtree', 'scale_pos_weight': 8.382696644268396, 'alpha': 9.354208544320377, 'lambda': 1.3042147973966043, 'eta': 0.6464091544320548, 'sampling_method': 'uniform', 'subsample': 0.08458038263431458, 'gamma': 6.417394987645943}. Best is trial 75 with value: 4.365584516831058.
[I 2023-12-19 05:26:45,216] Trial 77 pruned. Trial was pruned at iteration 1.
[I 2023-12-19 05:26:45,296] Trial 78 pruned. Trial was pruned at iteration 0.
[I 2023-12-19 05:26:45,665] Trial 79 finished with value: inf and parameters: {'learning_rate': 0.780556063486709, 'aft_loss_distribution': 'normal', 'aft_loss_distribution_scale': 0.8554156528939079, 'max_depth': 8, 'booster': 'gbtree', 'scale_pos_weight': 8.789962734077413, 'alpha': 9.485273512856853, 'lambda': 0.9485107079407138, 'eta': 0.5925014331631618, 'sampling_method': 'uniform', 'subsample': 0.12529938661937517, 'gamma': 7.1812878772831406}. Best is trial 75 with value: 4.365584516831058.
[I 2023-12-19 05:26:45,998] Trial 80 finished with value: inf and parameters: {'learning_rate': 0.9363948392402329, 'aft_loss_distribution': 'normal', 'aft_loss_distribution_scale': 1.6438875265520452, 'max_depth': 8, 'booster': 'gbtree', 'scale_pos_weight': 9.266231908809473, 'alpha': 9.979325604491219, 'lambda': 1.6638499178946493, 'eta': 0.519747411667605, 'sampling_method': 'uniform', 'subsample': 0.012626898089580008, 'gamma': 6.546494029853394}. Best is trial 75 with value: 4.365584516831058.
[I 2023-12-19 05:26:46,076] Trial 81 pruned. Trial was pruned at iteration 0.
[I 2023-12-19 05:26:46,376] Trial 82 finished with value: inf and parameters: {'learning_rate': 0.83027650988068, 'aft_loss_distribution': 'normal', 'aft_loss_distribution_scale': 1.319202352130476, 'max_depth': 7, 'booster': 'gbtree', 'scale_pos_weight': 8.50243327409756, 'alpha': 9.061065172754253, 'lambda': 2.3561540100696066, 'eta': 0.606328118861994, 'sampling_method': 'uniform', 'subsample': 0.808339439738497, 'gamma': 6.07871798439217}. Best is trial 75 with value: 4.365584516831058.
[I 2023-12-19 05:26:46,458] Trial 83 pruned. Trial was pruned at iteration 0.
[I 2023-12-19 05:26:46,546] Trial 84 pruned. Trial was pruned at iteration 0.
[I 2023-12-19 05:26:46,627] Trial 85 pruned. Trial was pruned at iteration 0.
[I 2023-12-19 05:26:46,709] Trial 86 pruned. Trial was pruned at iteration 0.
[I 2023-12-19 05:26:46,788] Trial 87 pruned. Trial was pruned at iteration 0.
[I 2023-12-19 05:26:46,866] Trial 88 pruned. Trial was pruned at iteration 0.
[I 2023-12-19 05:26:46,947] Trial 89 pruned. Trial was pruned at iteration 0.
[I 2023-12-19 05:26:47,027] Trial 90 pruned. Trial was pruned at iteration 0.
[I 2023-12-19 05:26:47,116] Trial 91 pruned. Trial was pruned at iteration 2.
[I 2023-12-19 05:26:47,734] Trial 92 finished with value: 4.446352410002764 and parameters: {'learning_rate': 0.7493907759112637, 'aft_loss_distribution': 'normal', 'aft_loss_distribution_scale': 1.7831424065607304, 'max_depth': 10, 'booster': 'gbtree', 'scale_pos_weight': 6.132934590400958, 'alpha': 8.749778884695829, 'lambda': 3.2703540254615153, 'eta': 0.38383824834818603, 'sampling_method': 'uniform', 'subsample': 0.06790425035697126, 'gamma': 7.634838928168848}. Best is trial 75 with value: 4.365584516831058.
[I 2023-12-19 05:26:47,812] Trial 93 pruned. Trial was pruned at iteration 0.
[I 2023-12-19 05:26:48,727] Trial 94 finished with value: 4.291066898240938 and parameters: {'learning_rate': 0.7530699618565303, 'aft_loss_distribution': 'normal', 'aft_loss_distribution_scale': 1.3455143195919463, 'max_depth': 9, 'booster': 'gbtree', 'scale_pos_weight': 6.8791282852693385, 'alpha': 8.147000327863353, 'lambda': 1.4787327609932444, 'eta': 0.379592880919569, 'sampling_method': 'uniform', 'subsample': 0.8485148697634394, 'gamma': 8.447279641126466}. Best is trial 94 with value: 4.291066898240938.
[I 2023-12-19 05:26:48,802] Trial 95 pruned. Trial was pruned at iteration 0.
[I 2023-12-19 05:26:49,266] Trial 96 finished with value: inf and parameters: {'learning_rate': 0.8437724238539025, 'aft_loss_distribution': 'normal', 'aft_loss_distribution_scale': 1.0155254263249072, 'max_depth': 9, 'booster': 'gbtree', 'scale_pos_weight': 6.824437329137767, 'alpha': 0.41724643201985234, 'lambda': 1.4069160384041297, 'eta': 0.26316524084327214, 'sampling_method': 'uniform', 'subsample': 0.025144206534331956, 'gamma': 7.080124701779772}. Best is trial 94 with value: 4.291066898240938.
[I 2023-12-19 05:26:49,761] Trial 97 finished with value: 4.295166023664499 and parameters: {'learning_rate': 0.7929123790498186, 'aft_loss_distribution': 'normal', 'aft_loss_distribution_scale': 1.340165431233698, 'max_depth': 8, 'booster': 'gbtree', 'scale_pos_weight': 5.81388301866098, 'alpha': 8.572405760693183, 'lambda': 0.04364550488138774, 'eta': 0.4377202913336632, 'sampling_method': 'uniform', 'subsample': 0.9858895998712232, 'gamma': 8.819090741984956}. Best is trial 94 with value: 4.291066898240938.
[I 2023-12-19 05:26:50,346] Trial 98 finished with value: 4.319439346842912 and parameters: {'learning_rate': 0.9072999784529455, 'aft_loss_distribution': 'normal', 'aft_loss_distribution_scale': 1.4334960291686558, 'max_depth': 9, 'booster': 'gbtree', 'scale_pos_weight': 5.896144281127008, 'alpha': 5.676258841584872, 'lambda': 0.1456798530388682, 'eta': 0.33553478330676834, 'sampling_method': 'uniform', 'subsample': 0.9679560551842611, 'gamma': 9.050150805599417}. Best is trial 94 with value: 4.291066898240938.
[I 2023-12-19 05:26:50,668] Trial 99 finished with value: inf and parameters: {'learning_rate': 0.9129265007850058, 'aft_loss_distribution': 'normal', 'aft_loss_distribution_scale': 1.287646208203419, 'max_depth': 9, 'booster': 'gbtree', 'scale_pos_weight': 7.663802608160943, 'alpha': 5.81284301702305, 'lambda': 0.20146405856545785, 'eta': 0.4384881158451267, 'sampling_method': 'uniform', 'subsample': 0.995405251581407, 'gamma': 9.44027909448899}. Best is trial 94 with value: 4.291066898240938.
[I 2023-12-19 05:26:50,744] Trial 100 pruned. Trial was pruned at iteration 0.
[I 2023-12-19 05:26:51,178] Trial 101 finished with value: 4.359983957651108 and parameters: {'learning_rate': 0.8125162728033866, 'aft_loss_distribution': 'normal', 'aft_loss_distribution_scale': 1.5489321313295399, 'max_depth': 10, 'booster': 'gbtree', 'scale_pos_weight': 5.9075735532686595, 'alpha': 8.079600125123106, 'lambda': 0.1285322390961861, 'eta': 0.22543637792114687, 'sampling_method': 'uniform', 'subsample': 0.9228726210422291, 'gamma': 9.197150892663297}. Best is trial 94 with value: 4.291066898240938.
[I 2023-12-19 05:26:51,623] Trial 102 finished with value: 4.353739712645175 and parameters: {'learning_rate': 0.7922763500497837, 'aft_loss_distribution': 'normal', 'aft_loss_distribution_scale': 1.5296976402667894, 'max_depth': 9, 'booster': 'gbtree', 'scale_pos_weight': 5.764102707154097, 'alpha': 8.12702941170994, 'lambda': 0.8883322376333859, 'eta': 0.3299309304172904, 'sampling_method': 'uniform', 'subsample': 0.9017707178431804, 'gamma': 9.826344264480579}. Best is trial 94 with value: 4.291066898240938.
[I 2023-12-19 05:26:52,244] Trial 103 finished with value: 4.345974221619123 and parameters: {'learning_rate': 0.8017263831211702, 'aft_loss_distribution': 'normal', 'aft_loss_distribution_scale': 1.5117550863910802, 'max_depth': 9, 'booster': 'gbtree', 'scale_pos_weight': 6.028570720411621, 'alpha': 8.124399645539814, 'lambda': 0.09477440407398807, 'eta': 0.21901930226291516, 'sampling_method': 'uniform', 'subsample': 0.877635024761598, 'gamma': 9.19395008030412}. Best is trial 94 with value: 4.291066898240938.
[I 2023-12-19 05:26:52,843] Trial 104 finished with value: 4.334877177236347 and parameters: {'learning_rate': 0.7973842013679758, 'aft_loss_distribution': 'normal', 'aft_loss_distribution_scale': 1.4745451662440496, 'max_depth': 9, 'booster': 'gbtree', 'scale_pos_weight': 5.8735388739895225, 'alpha': 7.926753523119271, 'lambda': 0.8207757519991423, 'eta': 0.2254094872869468, 'sampling_method': 'uniform', 'subsample': 0.8651252623246317, 'gamma': 9.822437173316978}. Best is trial 94 with value: 4.291066898240938.
[I 2023-12-19 05:26:53,241] Trial 105 finished with value: 4.2632662205386405 and parameters: {'learning_rate': 0.7898250418575627, 'aft_loss_distribution': 'normal', 'aft_loss_distribution_scale': 0.9056311490988941, 'max_depth': 9, 'booster': 'gbtree', 'scale_pos_weight': 5.92171467925199, 'alpha': 8.198140711273032, 'lambda': 0.008146562762777018, 'eta': 0.12407075379016422, 'sampling_method': 'uniform', 'subsample': 0.8750296028420319, 'gamma': 9.966446123876112}. Best is trial 105 with value: 4.2632662205386405.
