[I 2023-12-21 04:14:05,715] Trial 276 finished with value: inf and parameters: {'learning_rate': 0.9837986747289683, 'aft_loss_distributi                                                                     on': 'normal', 'aft_loss_distribution_scale': 1.717103575536644, 'max_depth': 7, 'booster': 'gbtree', 'scale_pos_weight': 1.5838290916542                                                                     757, 'alpha': 9.666507713285474, 'lambda': 4.435765239291148, 'eta': 0.3205154625830666, 'sampling_method': 'uniform', 'subsample': 0.088                                                                     88386269176522, 'gamma': 7.2628132589585315}. Best is trial 255 with value: 2.0370667337922805.
[I 2023-12-21 04:14:05,757] Trial 277 pruned. Trial was pruned at iteration 0.
[I 2023-12-21 04:14:05,862] Trial 278 finished with value: inf and parameters: {'learning_rate': 0.9447474033334716, 'aft_loss_distributi                                                                     on': 'normal', 'aft_loss_distribution_scale': 1.9592313833035813, 'max_depth': 10, 'booster': 'gbtree', 'scale_pos_weight': 1.44146392359                                                                     9408, 'alpha': 9.476833441221896, 'lambda': 4.627100631453723, 'eta': 0.8431090082759669, 'sampling_method': 'uniform', 'subsample': 0.16                                                                     563731459223283, 'gamma': 6.907566788738893}. Best is trial 255 with value: 2.0370667337922805.
[I 2023-12-21 04:14:05,905] Trial 279 pruned. Trial was pruned at iteration 0.
[I 2023-12-21 04:14:05,946] Trial 280 pruned. Trial was pruned at iteration 0.
[I 2023-12-21 04:14:05,989] Trial 281 pruned. Trial was pruned at iteration 0.
[I 2023-12-21 04:14:06,039] Trial 282 pruned. Trial was pruned at iteration 2.
[I 2023-12-21 04:14:06,082] Trial 283 pruned. Trial was pruned at iteration 0.
[I 2023-12-21 04:14:06,303] Trial 284 finished with value: inf and parameters: {'learning_rate': 0.9992027693333937, 'aft_loss_distributi                                                                     on': 'normal', 'aft_loss_distribution_scale': 1.6269541363492925, 'max_depth': 6, 'booster': 'gbtree', 'scale_pos_weight': 1.519162623832                                                                     4736, 'alpha': 9.706172522382852, 'lambda': 4.377513220846305, 'eta': 0.8911941831288411, 'sampling_method': 'gradient_based', 'subsample                                                                     ': 0.11347568181343984, 'gamma': 6.964357315780212}. Best is trial 255 with value: 2.0370667337922805.
[I 2023-12-21 04:14:06,435] Trial 285 finished with value: 2.0546876055118033 and parameters: {'learning_rate': 0.9617477367367201, 'aft_                                                                     loss_distribution': 'normal', 'aft_loss_distribution_scale': 2.0341336726330184, 'max_depth': 6, 'booster': 'gbtree', 'scale_pos_weight':                                                                      1.7766233609175515, 'alpha': 9.151178778788324, 'lambda': 3.791663407203814, 'eta': 0.9414519139896336, 'sampling_method': 'uniform', 's                                                                     ubsample': 0.15576913086053787, 'gamma': 7.320379671472917}. Best is trial 255 with value: 2.0370667337922805.
[I 2023-12-21 04:14:06,477] Trial 286 pruned. Trial was pruned at iteration 0.
[I 2023-12-21 04:14:06,587] Trial 287 finished with value: inf and parameters: {'learning_rate': 0.9794357728705184, 'aft_loss_distributi                                                                     on': 'normal', 'aft_loss_distribution_scale': 1.78048942807885, 'max_depth': 6, 'booster': 'gbtree', 'scale_pos_weight': 1.65105759466143                                                                     3, 'alpha': 9.148007130722961, 'lambda': 3.417851134564057, 'eta': 0.9600685073358359, 'sampling_method': 'uniform', 'subsample': 0.14465                                                                     316624359825, 'gamma': 7.320470449515239}. Best is trial 255 with value: 2.0370667337922805.
[I 2023-12-21 04:14:06,699] Trial 288 finished with value: inf and parameters: {'learning_rate': 0.9555328164297412, 'aft_loss_distributi                                                                     on': 'normal', 'aft_loss_distribution_scale': 2.061123071669552, 'max_depth': 6, 'booster': 'gbtree', 'scale_pos_weight': 1.8709552542443                                                                     062, 'alpha': 8.873539429481225, 'lambda': 3.5674283963585793, 'eta': 0.9742182194943128, 'sampling_method': 'uniform', 'subsample': 0.77                                                                     17372034685641, 'gamma': 7.647383468703347}. Best is trial 255 with value: 2.0370667337922805.
[I 2023-12-21 04:14:06,741] Trial 289 pruned. Trial was pruned at iteration 0.
[I 2023-12-21 04:14:06,892] Trial 290 finished with value: inf and parameters: {'learning_rate': 0.9774478744495984, 'aft_loss_distributi                                                                     on': 'normal', 'aft_loss_distribution_scale': 1.4953169331010159, 'max_depth': 7, 'booster': 'gbtree', 'scale_pos_weight': 1.784221862722                                                                     9915, 'alpha': 9.444974415518494, 'lambda': 3.8041982425139245, 'eta': 0.9327270079656909, 'sampling_method': 'uniform', 'subsample': 0.0                                                                     6588752062121034, 'gamma': 6.444103987389072}. Best is trial 255 with value: 2.0370667337922805.
[I 2023-12-21 04:14:06,937] Trial 291 pruned. Trial was pruned at iteration 2.
[I 2023-12-21 04:14:07,050] Trial 292 finished with value: inf and parameters: {'learning_rate': 0.9303899764189503, 'aft_loss_distributi                                                                     on': 'normal', 'aft_loss_distribution_scale': 1.8628686815090691, 'max_depth': 6, 'booster': 'gbtree', 'scale_pos_weight': 1.717196550823                                                                     699, 'alpha': 9.537778193544005, 'lambda': 4.1015886707776446, 'eta': 0.8850838577638269, 'sampling_method': 'uniform', 'subsample': 0.18                                                                     419587353544656, 'gamma': 7.460084756110003}. Best is trial 255 with value: 2.0370667337922805.
[I 2023-12-21 04:14:07,095] Trial 293 pruned. Trial was pruned at iteration 0.
[I 2023-12-21 04:14:07,138] Trial 294 pruned. Trial was pruned at iteration 0.
[I 2023-12-21 04:14:07,179] Trial 295 pruned. Trial was pruned at iteration 0.
[I 2023-12-21 04:14:07,221] Trial 296 pruned. Trial was pruned at iteration 0.
[I 2023-12-21 04:14:07,262] Trial 297 pruned. Trial was pruned at iteration 0.
[I 2023-12-21 04:14:07,367] Trial 298 finished with value: inf and parameters: {'learning_rate': 0.963828604214879, 'aft_loss_distributio                                                                     n': 'normal', 'aft_loss_distribution_scale': 1.6535666452061335, 'max_depth': 7, 'booster': 'gbtree', 'scale_pos_weight': 1.8218442871905                                                                     753, 'alpha': 9.360432255136306, 'lambda': 5.05361963069168, 'eta': 0.8289579719928426, 'sampling_method': 'uniform', 'subsample': 0.1476                                                                     333519917533, 'gamma': 8.434335247682588}. Best is trial 255 with value: 2.0370667337922805.
[I 2023-12-21 04:14:07,411] Trial 299 pruned. Trial was pruned at iteration 0.
[I 2023-12-21 04:14:07,454] Trial 300 pruned. Trial was pruned at iteration 0.
[I 2023-12-21 04:14:07,564] Trial 301 finished with value: inf and parameters: {'learning_rate': 0.9421470632277416, 'aft_loss_distributi                                                                     on': 'normal', 'aft_loss_distribution_scale': 1.839015012216988, 'max_depth': 6, 'booster': 'gbtree', 'scale_pos_weight': 2.4285660571147                                                                     2, 'alpha': 9.999187582390247, 'lambda': 4.5786230405687585, 'eta': 0.5594952959895433, 'sampling_method': 'uniform', 'subsample': 0.1282                                                                     7597136159496, 'gamma': 6.5800629957360455}. Best is trial 255 with value: 2.0370667337922805.
[I 2023-12-21 04:14:11,757] Trial 302 finished with value: 2.0617340980543344 and parameters: {'learning_rate': 0.9633878777874708, 'aft_                                                                     loss_distribution': 'normal', 'aft_loss_distribution_scale': 2.04309527235872, 'max_depth': 6, 'booster': 'dart', 'scale_pos_weight': 1.2                                                                     847702489209096, 'alpha': 9.158996707949708, 'lambda': 3.621516466854203, 'eta': 0.9039973210889557, 'sampling_method': 'uniform', 'subsa                                                                     mple': 0.11041579390811057, 'gamma': 6.913017321443419}. Best is trial 255 with value: 2.0370667337922805.
[I 2023-12-21 04:14:12,797] Trial 303 finished with value: inf and parameters: {'learning_rate': 0.9979406377312607, 'aft_loss_distributi                                                                     on': 'normal', 'aft_loss_distribution_scale': 1.7271057852511726, 'max_depth': 6, 'booster': 'dart', 'scale_pos_weight': 1.11280297518963                                                                     11, 'alpha': 9.032702691713338, 'lambda': 3.280043072009208, 'eta': 0.9004063361839367, 'sampling_method': 'uniform', 'subsample': 0.0880                                                                     2238644841548, 'gamma': 6.793830443113534}. Best is trial 255 with value: 2.0370667337922805.
[I 2023-12-21 04:14:12,840] Trial 304 pruned. Trial was pruned at iteration 0.
[I 2023-12-21 04:14:12,884] Trial 305 pruned. Trial was pruned at iteration 0.
[I 2023-12-21 04:14:13,084] Trial 306 finished with value: inf and parameters: {'learning_rate': 0.9675849866963497, 'aft_loss_distributi                                                                     on': 'normal', 'aft_loss_distribution_scale': 1.2975828966136265, 'max_depth': 6, 'booster': 'gbtree', 'scale_pos_weight': 1.346388707115                                                                     0213, 'alpha': 9.318150681217785, 'lambda': 4.726546081172601, 'eta': 0.969745716346821, 'sampling_method': 'uniform', 'subsample': 0.133                                                                     63354717784562, 'gamma': 7.343437857017607}. Best is trial 255 with value: 2.0370667337922805.
[I 2023-12-21 04:14:13,127] Trial 307 pruned. Trial was pruned at iteration 0.
[I 2023-12-21 04:14:13,170] Trial 308 pruned. Trial was pruned at iteration 0.
[I 2023-12-21 04:14:13,215] Trial 309 pruned. Trial was pruned at iteration 0.
[I 2023-12-21 04:14:13,258] Trial 310 pruned. Trial was pruned at iteration 0.
[I 2023-12-21 04:14:13,301] Trial 311 pruned. Trial was pruned at iteration 0.
[I 2023-12-21 04:14:13,346] Trial 312 pruned. Trial was pruned at iteration 0.
[I 2023-12-21 04:14:13,390] Trial 313 pruned. Trial was pruned at iteration 0.
[I 2023-12-21 04:14:13,575] Trial 314 finished with value: inf and parameters: {'learning_rate': 0.9813438026699886, 'aft_loss_distributi                                                                     on': 'normal', 'aft_loss_distribution_scale': 1.984947738353464, 'max_depth': 7, 'booster': 'gbtree', 'scale_pos_weight': 2.8849145951215                                                                     114, 'alpha': 4.244455062711185, 'lambda': 4.754986182098869, 'eta': 0.9798118371514273, 'sampling_method': 'uniform', 'subsample': 0.172                                                                     67376744578888, 'gamma': 6.282525949756908}. Best is trial 255 with value: 2.0370667337922805.
[I 2023-12-21 04:14:13,619] Trial 315 pruned. Trial was pruned at iteration 0.
[I 2023-12-21 04:14:13,663] Trial 316 pruned. Trial was pruned at iteration 0.
[I 2023-12-21 04:14:13,706] Trial 317 pruned. Trial was pruned at iteration 0.
[I 2023-12-21 04:14:13,751] Trial 318 pruned. Trial was pruned at iteration 0.
[I 2023-12-21 04:14:13,794] Trial 319 pruned. Trial was pruned at iteration 0.
[I 2023-12-21 04:14:13,838] Trial 320 pruned. Trial was pruned at iteration 0.
[I 2023-12-21 04:14:13,967] Trial 321 finished with value: 2.0612046208676538 and parameters: {'learning_rate': 0.9809197835621272, 'aft_                                                                     loss_distribution': 'normal', 'aft_loss_distribution_scale': 2.0675611008632666, 'max_depth': 5, 'booster': 'gbtree', 'scale_pos_weight':                                                                      1.5847623424537916, 'alpha': 8.918549060190655, 'lambda': 4.630646359514375, 'eta': 0.8667312769102424, 'sampling_method': 'uniform', 's                                                                     ubsample': 0.09427887935653065, 'gamma': 6.549524769926701}. Best is trial 255 with value: 2.0370667337922805.
[I 2023-12-21 04:14:14,123] Trial 322 finished with value: inf and parameters: {'learning_rate': 0.9843390000747615, 'aft_loss_distributi                                                                     on': 'normal', 'aft_loss_distribution_scale': 1.5993191658610793, 'max_depth': 5, 'booster': 'gbtree', 'scale_pos_weight': 1.573322403598                                                                     5107, 'alpha': 8.669616539456115, 'lambda': 4.850381070884133, 'eta': 0.8614987064486328, 'sampling_method': 'uniform', 'subsample': 0.09                                                                     111086944660479, 'gamma': 6.1448566716705235}. Best is trial 255 with value: 2.0370667337922805.
[I 2023-12-21 04:14:14,168] Trial 323 pruned. Trial was pruned at iteration 1.
[I 2023-12-21 04:14:14,218] Trial 324 pruned. Trial was pruned at iteration 1.
[I 2023-12-21 04:14:14,263] Trial 325 pruned. Trial was pruned at iteration 1.
[I 2023-12-21 04:14:14,306] Trial 326 pruned. Trial was pruned at iteration 0.
[I 2023-12-21 04:14:14,352] Trial 327 pruned. Trial was pruned at iteration 0.
[I 2023-12-21 04:14:14,395] Trial 328 pruned. Trial was pruned at iteration 0.
[I 2023-12-21 04:14:14,439] Trial 329 pruned. Trial was pruned at iteration 0.
[I 2023-12-21 04:14:14,569] Trial 330 finished with value: inf and parameters: {'learning_rate': 0.9625667406202822, 'aft_loss_distributi                                                                     on': 'normal', 'aft_loss_distribution_scale': 1.3829758734870157, 'max_depth': 7, 'booster': 'gbtree', 'scale_pos_weight': 1.708138955808                                                                     4328, 'alpha': 9.65575764268954, 'lambda': 4.311997924562178, 'eta': 0.8707137415983148, 'sampling_method': 'uniform', 'subsample': 0.904                                                                     2118433660227, 'gamma': 6.925664703063011}. Best is trial 255 with value: 2.0370667337922805.
[I 2023-12-21 04:14:14,614] Trial 331 pruned. Trial was pruned at iteration 0.
[I 2023-12-21 04:14:14,658] Trial 332 pruned. Trial was pruned at iteration 0.
[I 2023-12-21 04:14:14,701] Trial 333 pruned. Trial was pruned at iteration 0.
[I 2023-12-21 04:14:14,816] Trial 334 finished with value: inf and parameters: {'learning_rate': 0.9700896408378472, 'aft_loss_distributi                                                                     on': 'normal', 'aft_loss_distribution_scale': 1.901300029204489, 'max_depth': 6, 'booster': 'gbtree', 'scale_pos_weight': 1.3493432385645                                                                     798, 'alpha': 9.377771464316387, 'lambda': 3.5304962128244033, 'eta': 0.8362984981530333, 'sampling_method': 'uniform', 'subsample': 0.10                                                                     521480680847418, 'gamma': 7.74534726808213}. Best is trial 255 with value: 2.0370667337922805.
[I 2023-12-21 04:14:14,861] Trial 335 pruned. Trial was pruned at iteration 0.
[I 2023-12-21 04:14:15,018] Trial 336 finished with value: inf and parameters: {'learning_rate': 0.9847252502747404, 'aft_loss_distributi                                                                     on': 'normal', 'aft_loss_distribution_scale': 1.6333447404900157, 'max_depth': 6, 'booster': 'gbtree', 'scale_pos_weight': 1.260162748341                                                                     0458, 'alpha': 8.934257857537016, 'lambda': 4.288438048969873, 'eta': 0.8704289863056268, 'sampling_method': 'uniform', 'subsample': 0.11                                                                     082287206364057, 'gamma': 6.619419243396315}. Best is trial 255 with value: 2.0370667337922805.
[I 2023-12-21 04:14:15,065] Trial 337 pruned. Trial was pruned at iteration 1.
[I 2023-12-21 04:14:15,109] Trial 338 pruned. Trial was pruned at iteration 0.
[I 2023-12-21 04:14:15,155] Trial 339 pruned. Trial was pruned at iteration 0.
[I 2023-12-21 04:14:15,201] Trial 340 pruned. Trial was pruned at iteration 1.
[I 2023-12-21 04:14:15,246] Trial 341 pruned. Trial was pruned at iteration 0.
[I 2023-12-21 04:14:15,290] Trial 342 pruned. Trial was pruned at iteration 0.
[I 2023-12-21 04:14:15,338] Trial 343 pruned. Trial was pruned at iteration 0.
[I 2023-12-21 04:14:15,382] Trial 344 pruned. Trial was pruned at iteration 0.
[I 2023-12-21 04:14:15,434] Trial 345 pruned. Trial was pruned at iteration 2.
[I 2023-12-21 04:14:15,567] Trial 346 finished with value: inf and parameters: {'learning_rate': 0.9993070846983829, 'aft_loss_distributi                                                                     on': 'normal', 'aft_loss_distribution_scale': 2.069719999100941, 'max_depth': 6, 'booster': 'gbtree', 'scale_pos_weight': 1.6014801921024                                                                     029, 'alpha': 9.052602944949474, 'lambda': 4.401792770035061, 'eta': 0.9331747813951785, 'sampling_method': 'uniform', 'subsample': 0.247                                                                     3751182013031, 'gamma': 6.805171356202429}. Best is trial 255 with value: 2.0370667337922805.
[I 2023-12-21 04:14:15,694] Trial 347 finished with value: inf and parameters: {'learning_rate': 0.9714083017259478, 'aft_loss_distributi                                                                     on': 'normal', 'aft_loss_distribution_scale': 1.8542779106260103, 'max_depth': 6, 'booster': 'gbtree', 'scale_pos_weight': 1.746881750611                                                                     8908, 'alpha': 5.299113124942583, 'lambda': 5.033684878160415, 'eta': 0.8034953022072923, 'sampling_method': 'uniform', 'subsample': 0.07                                                                     787958583273698, 'gamma': 7.032440687957899}. Best is trial 255 with value: 2.0370667337922805.
[I 2023-12-21 04:14:15,740] Trial 348 pruned. Trial was pruned at iteration 1.
[I 2023-12-21 04:14:15,785] Trial 349 pruned. Trial was pruned at iteration 0.
[I 2023-12-21 04:14:15,912] Trial 350 finished with value: inf and parameters: {'learning_rate': 0.9458756406536262, 'aft_loss_distributi                                                                     on': 'normal', 'aft_loss_distribution_scale': 2.021094016640955, 'max_depth': 6, 'booster': 'gbtree', 'scale_pos_weight': 1.3414187603068                                                                     923, 'alpha': 9.478321599125277, 'lambda': 3.9939975205269267, 'eta': 0.9670605074525118, 'sampling_method': 'uniform', 'subsample': 0.27                                                                     982805561598256, 'gamma': 7.258190760629583}. Best is trial 255 with value: 2.0370667337922805.
[I 2023-12-21 04:14:15,958] Trial 351 pruned. Trial was pruned at iteration 0.
[I 2023-12-21 04:14:16,068] Trial 352 finished with value: inf and parameters: {'learning_rate': 0.9702300420428636, 'aft_loss_distributi                                                                     on': 'normal', 'aft_loss_distribution_scale': 1.6392151164278421, 'max_depth': 6, 'booster': 'gbtree', 'scale_pos_weight': 1.176645443438                                                                     9193, 'alpha': 9.271221950872915, 'lambda': 4.40478732608113, 'eta': 0.8820884681863497, 'sampling_method': 'uniform', 'subsample': 0.045                                                                     59482898398161, 'gamma': 6.431704480033188}. Best is trial 255 with value: 2.0370667337922805.
[I 2023-12-21 04:14:16,115] Trial 353 pruned. Trial was pruned at iteration 0.
[I 2023-12-21 04:14:16,160] Trial 354 pruned. Trial was pruned at iteration 0.
[I 2023-12-21 04:14:16,354] Trial 355 finished with value: 2.041203357931866 and parameters: {'learning_rate': 0.9582739734242521, 'aft_l                                                                     oss_distribution': 'normal', 'aft_loss_distribution_scale': 1.8955852210589779, 'max_depth': 7, 'booster': 'gbtree', 'scale_pos_weight':                                                                      1.5648120895723974, 'alpha': 9.81517769161358, 'lambda': 4.547380238796359, 'eta': 0.9019129527123267, 'sampling_method': 'uniform', 'sub                                                                     sample': 0.11267597756414852, 'gamma': 7.833605546367351}. Best is trial 255 with value: 2.0370667337922805.
[I 2023-12-21 04:14:16,399] Trial 356 pruned. Trial was pruned at iteration 0.
