[I 2023-12-21 00:16:59,319] Trial 109 pruned. Trial was pruned at iteration 0.
[I 2023-12-21 00:16:59,385] Trial 110 pruned. Trial was pruned at iteration 0.
[I 2023-12-21 00:16:59,736] Trial 111 finished with value: 1.9624137332111773 and parameters: {'learning_rate': 0.8298675492144948, 'aft_loss_distribution': 'normal', 'aft_loss_distribution_scale': 2.125668774406911, 'max_depth': 10, 'booster': 'gbtree', 'scale_pos_weight': 0.9944121833250495, 'alpha': 5.342628934231869, 'lambda': 9.233661312276974, 'eta': 0.10580562694986506, 'sampling_method': 'gradient_based', 'subsample': 0.7523074108206629, 'gamma': 6.145762323889802}. Best is trial 111 with value: 1.9624137332111773.
[I 2023-12-21 00:16:59,966] Trial 112 finished with value: 1.9728856840141606 and parameters: {'learning_rate': 0.8420758532514631, 'aft_loss_distribution': 'normal', 'aft_loss_distribution_scale': 2.2438987796319325, 'max_depth': 10, 'booster': 'gbtree', 'scale_pos_weight': 0.9240542440011614, 'alpha': 5.366857561980164, 'lambda': 9.462036251711254, 'eta': 0.10081852795501445, 'sampling_method': 'gradient_based', 'subsample': 0.7777091842719535, 'gamma': 6.11973173122068}. Best is trial 111 with value: 1.9624137332111773.
[I 2023-12-21 00:17:00,319] Trial 113 finished with value: 2.002222949470757 and parameters: {'learning_rate': 0.8310554812504587, 'aft_loss_distribution': 'normal', 'aft_loss_distribution_scale': 2.5364430504415267, 'max_depth': 10, 'booster': 'gbtree', 'scale_pos_weight': 0.9512093997865626, 'alpha': 5.363087287088547, 'lambda': 9.472567946075138, 'eta': 0.09994929515438673, 'sampling_method': 'gradient_based', 'subsample': 0.7844994510636251, 'gamma': 6.929521003144394}. Best is trial 111 with value: 1.9624137332111773.
[I 2023-12-21 00:17:00,654] Trial 114 finished with value: 1.9667063062668309 and parameters: {'learning_rate': 0.8366542749533549, 'aft_loss_distribution': 'normal', 'aft_loss_distribution_scale': 2.1387320028408023, 'max_depth': 10, 'booster': 'gbtree', 'scale_pos_weight': 1.0218899277912175, 'alpha': 5.403340486973978, 'lambda': 9.967046300036175, 'eta': 0.10257401458275006, 'sampling_method': 'gradient_based', 'subsample': 0.7698534016610374, 'gamma': 6.8843954177397695}. Best is trial 111 with value: 1.9624137332111773.
[I 2023-12-21 00:17:01,204] Trial 115 finished with value: 1.9732397388999723 and parameters: {'learning_rate': 0.8253685922290812, 'aft_loss_distribution': 'normal', 'aft_loss_distribution_scale': 2.235348737305763, 'max_depth': 10, 'booster': 'gbtree', 'scale_pos_weight': 0.9806322238319513, 'alpha': 6.047117856408589, 'lambda': 9.511125812492102, 'eta': 0.06557757328676253, 'sampling_method': 'gradient_based', 'subsample': 0.7750517869619684, 'gamma': 6.926719943270048}. Best is trial 111 with value: 1.9624137332111773.
[I 2023-12-21 00:17:01,598] Trial 116 finished with value: 1.9657479253862855 and parameters: {'learning_rate': 0.836869596344029, 'aft_loss_distribution': 'normal', 'aft_loss_distribution_scale': 2.1462540310395237, 'max_depth': 10, 'booster': 'gbtree', 'scale_pos_weight': 0.985740928176882, 'alpha': 6.5505167898029875, 'lambda': 9.430771142638404, 'eta': 0.09660783522741126, 'sampling_method': 'gradient_based', 'subsample': 0.7939313600927161, 'gamma': 6.951635461058412}. Best is trial 111 with value: 1.9624137332111773.
[I 2023-12-21 00:17:01,991] Trial 117 finished with value: 1.9667454871364345 and parameters: {'learning_rate': 0.8387579959660194, 'aft_loss_distribution': 'normal', 'aft_loss_distribution_scale': 2.174948878581941, 'max_depth': 10, 'booster': 'gbtree', 'scale_pos_weight': 0.99908100073857, 'alpha': 6.7812677111317, 'lambda': 9.965900664767865, 'eta': 0.10326213846951865, 'sampling_method': 'gradient_based', 'subsample': 0.7782904225946204, 'gamma': 7.565942756823785}. Best is trial 111 with value: 1.9624137332111773.
[I 2023-12-21 00:17:02,249] Trial 118 finished with value: inf and parameters: {'learning_rate': 0.8373862275326566, 'aft_loss_distribution': 'normal', 'aft_loss_distribution_scale': 2.073901700010902, 'max_depth': 10, 'booster': 'gbtree', 'scale_pos_weight': 0.7975457359201554, 'alpha': 6.913798570546547, 'lambda': 9.863697989821661, 'eta': 0.0719238298071975, 'sampling_method': 'gradient_based', 'subsample': 0.7733447421670492, 'gamma': 7.702536235007064}. Best is trial 111 with value: 1.9624137332111773.
[I 2023-12-21 00:17:02,338] Trial 119 pruned. Trial was pruned at iteration 0.
[I 2023-12-21 00:17:02,726] Trial 120 finished with value: 1.9727097743061304 and parameters: {'learning_rate': 0.8693018919210012, 'aft_loss_distribution': 'normal', 'aft_loss_distribution_scale': 2.219507572580148, 'max_depth': 9, 'booster': 'gbtree', 'scale_pos_weight': 0.8793103241955422, 'alpha': 6.429251188484281, 'lambda': 9.51649556521029, 'eta': 0.02578230549654427, 'sampling_method': 'gradient_based', 'subsample': 0.7677629871814714, 'gamma': 7.450143808642034}. Best is trial 111 with value: 1.9624137332111773.
[I 2023-12-21 00:17:03,160] Trial 121 finished with value: 1.9703260760750243 and parameters: {'learning_rate': 0.8621974156688089, 'aft_loss_distribution': 'normal', 'aft_loss_distribution_scale': 2.203556725032807, 'max_depth': 10, 'booster': 'gbtree', 'scale_pos_weight': 0.7379036568558713, 'alpha': 6.691457085347515, 'lambda': 9.522140930064795, 'eta': 0.0350647146051886, 'sampling_method': 'gradient_based', 'subsample': 0.7450758210927652, 'gamma': 7.532268886525687}. Best is trial 111 with value: 1.9624137332111773.
[I 2023-12-21 00:17:03,630] Trial 122 finished with value: 1.966336291703253 and parameters: {'learning_rate': 0.8466293224622314, 'aft_loss_distribution': 'normal', 'aft_loss_distribution_scale': 2.158127047671208, 'max_depth': 9, 'booster': 'gbtree', 'scale_pos_weight': 0.9033467851638467, 'alpha': 6.392418556097859, 'lambda': 9.96115536553052, 'eta': 0.10759289165482919, 'sampling_method': 'gradient_based', 'subsample': 0.7577766206572593, 'gamma': 7.458265913451437}. Best is trial 111 with value: 1.9624137332111773.
[I 2023-12-21 00:17:04,075] Trial 123 finished with value: 1.9673365014908 and parameters: {'learning_rate': 0.8350322096666882, 'aft_loss_distribution': 'normal', 'aft_loss_distribution_scale': 2.1718585593478905, 'max_depth': 9, 'booster': 'gbtree', 'scale_pos_weight': 0.703099950742798, 'alpha': 6.691527236344404, 'lambda': 9.978255452232565, 'eta': 0.054679181502217344, 'sampling_method': 'gradient_based', 'subsample': 0.7411539360929521, 'gamma': 7.551324297100418}. Best is trial 111 with value: 1.9624137332111773.
[I 2023-12-21 00:17:04,380] Trial 124 finished with value: inf and parameters: {'learning_rate': 0.8534447087221475, 'aft_loss_distribution': 'normal', 'aft_loss_distribution_scale': 2.1901448676470348, 'max_depth': 9, 'booster': 'gbtree', 'scale_pos_weight': 0.5281181044787506, 'alpha': 6.544723597582742, 'lambda': 9.978855929638927, 'eta': 0.05243618305497835, 'sampling_method': 'gradient_based', 'subsample': 0.7381677546845772, 'gamma': 7.462401073883967}. Best is trial 111 with value: 1.9624137332111773.
[I 2023-12-21 00:17:04,472] Trial 125 pruned. Trial was pruned at iteration 0.
[I 2023-12-21 00:17:04,567] Trial 126 pruned. Trial was pruned at iteration 0.
[I 2023-12-21 00:17:04,657] Trial 127 pruned. Trial was pruned at iteration 0.
[I 2023-12-21 00:17:04,744] Trial 128 pruned. Trial was pruned at iteration 0.
[I 2023-12-21 00:17:04,978] Trial 129 finished with value: inf and parameters: {'learning_rate': 0.9307674052259272, 'aft_loss_distribution': 'normal', 'aft_loss_distribution_scale': 1.9108053655040342, 'max_depth': 9, 'booster': 'gbtree', 'scale_pos_weight': 0.6638850489501014, 'alpha': 6.079634205369582, 'lambda': 9.512180811325894, 'eta': 0.13602385542842127, 'sampling_method': 'gradient_based', 'subsample': 0.7526192302204175, 'gamma': 7.7871471787658795}. Best is trial 111 with value: 1.9624137332111773.
[I 2023-12-21 00:17:05,083] Trial 130 pruned. Trial was pruned at iteration 0.
[I 2023-12-21 00:17:05,184] Trial 131 pruned. Trial was pruned at iteration 0.
[I 2023-12-21 00:17:05,273] Trial 132 pruned. Trial was pruned at iteration 0.
[I 2023-12-21 00:17:05,703] Trial 133 finished with value: 1.9480821012964864 and parameters: {'learning_rate': 0.8628056563099229, 'aft_loss_distribution': 'normal', 'aft_loss_distribution_scale': 1.9489003931259268, 'max_depth': 10, 'booster': 'gbtree', 'scale_pos_weight': 0.9129339708635076, 'alpha': 6.3716034765942995, 'lambda': 9.506328955132602, 'eta': 0.0951888729287626, 'sampling_method': 'gradient_based', 'subsample': 0.6878296579922955, 'gamma': 7.350507586893039}. Best is trial 133 with value: 1.9480821012964864.
[I 2023-12-21 00:17:06,061] Trial 134 finished with value: 1.9493079451982727 and parameters: {'learning_rate': 0.8639031854502245, 'aft_loss_distribution': 'normal', 'aft_loss_distribution_scale': 1.9855106464924324, 'max_depth': 10, 'booster': 'gbtree', 'scale_pos_weight': 0.9101834554897343, 'alpha': 6.385213749221794, 'lambda': 9.407323657654567, 'eta': 0.07753234986441276, 'sampling_method': 'gradient_based', 'subsample': 0.679467959279196, 'gamma': 7.3431530353096175}. Best is trial 133 with value: 1.9480821012964864.
[I 2023-12-21 00:17:06,633] Trial 135 finished with value: 1.9402959760186753 and parameters: {'learning_rate': 0.8876850744810452, 'aft_loss_distribution': 'normal', 'aft_loss_distribution_scale': 1.8431390057190522, 'max_depth': 10, 'booster': 'gbtree', 'scale_pos_weight': 0.9107252856012121, 'alpha': 6.4193999798740204, 'lambda': 9.484795643043034, 'eta': 0.07145591350319698, 'sampling_method': 'gradient_based', 'subsample': 0.8245784645210771, 'gamma': 7.240642443556968}. Best is trial 135 with value: 1.9402959760186753.
[I 2023-12-21 00:17:06,697] Trial 136 pruned. Trial was pruned at iteration 0.
[I 2023-12-21 00:17:07,028] Trial 137 finished with value: 1.9484777277405259 and parameters: {'learning_rate': 0.8956668076445748, 'aft_loss_distribution': 'normal', 'aft_loss_distribution_scale': 1.960772727809376, 'max_depth': 10, 'booster': 'gbtree', 'scale_pos_weight': 0.7723894624081331, 'alpha': 6.704122956150463, 'lambda': 9.16681053906381, 'eta': 0.030829192174662644, 'sampling_method': 'gradient_based', 'subsample': 0.7178199499007913, 'gamma': 7.524527270434433}. Best is trial 135 with value: 1.9402959760186753.
[I 2023-12-21 00:17:07,092] Trial 138 pruned. Trial was pruned at iteration 0.
[I 2023-12-21 00:17:07,429] Trial 139 finished with value: 1.9411624024592564 and parameters: {'learning_rate': 0.8588510804084559, 'aft_loss_distribution': 'normal', 'aft_loss_distribution_scale': 1.879252576287624, 'max_depth': 10, 'booster': 'gbtree', 'scale_pos_weight': 0.3648924557613176, 'alpha': 6.879975323339609, 'lambda': 9.834584073036918, 'eta': 0.03953286865648853, 'sampling_method': 'gradient_based', 'subsample': 0.6996062556985347, 'gamma': 7.453616681747166}. Best is trial 135 with value: 1.9402959760186753.
[I 2023-12-21 00:17:08,084] Trial 140 finished with value: 1.9329330127430606 and parameters: {'learning_rate': 0.8652203203664044, 'aft_loss_distribution': 'normal', 'aft_loss_distribution_scale': 1.7877257304114815, 'max_depth': 9, 'booster': 'gbtree', 'scale_pos_weight': 0.40736014114490415, 'alpha': 7.627003053090821, 'lambda': 9.832246985530679, 'eta': 0.02596808887140839, 'sampling_method': 'gradient_based', 'subsample': 0.6918236832206334, 'gamma': 7.536396591106065}. Best is trial 140 with value: 1.9329330127430606.
[I 2023-12-21 00:17:08,434] Trial 141 finished with value: 1.9362891655184309 and parameters: {'learning_rate': 0.9294469476162985, 'aft_loss_distribution': 'normal', 'aft_loss_distribution_scale': 1.8266760480726578, 'max_depth': 9, 'booster': 'gbtree', 'scale_pos_weight': 0.3852926704214187, 'alpha': 7.805818939320409, 'lambda': 9.797445673640468, 'eta': 0.03214238665786348, 'sampling_method': 'gradient_based', 'subsample': 0.6886661156294284, 'gamma': 7.542597438962562}. Best is trial 140 with value: 1.9329330127430606.
[I 2023-12-21 00:17:08,777] Trial 142 finished with value: 1.9352479261366222 and parameters: {'learning_rate': 0.8636205711216858, 'aft_loss_distribution': 'normal', 'aft_loss_distribution_scale': 1.8008300279422076, 'max_depth': 9, 'booster': 'gbtree', 'scale_pos_weight': 0.3535908818360082, 'alpha': 8.204015551458923, 'lambda': 9.857906175990921, 'eta': 0.03290908711026171, 'sampling_method': 'gradient_based', 'subsample': 0.6994521208197837, 'gamma': 7.539996036384606}. Best is trial 140 with value: 1.9329330127430606.
[I 2023-12-21 00:17:09,106] Trial 143 finished with value: 1.9411361341855606 and parameters: {'learning_rate': 0.9309546118429688, 'aft_loss_distribution': 'normal', 'aft_loss_distribution_scale': 1.8281489456693278, 'max_depth': 9, 'booster': 'gbtree', 'scale_pos_weight': 0.3513318935073047, 'alpha': 7.825234078329801, 'lambda': 9.822614918084808, 'eta': 0.0445355622110457, 'sampling_method': 'gradient_based', 'subsample': 0.746681959108494, 'gamma': 8.589823430867362}. Best is trial 140 with value: 1.9329330127430606.
[I 2023-12-21 00:17:09,168] Trial 144 pruned. Trial was pruned at iteration 0.
[I 2023-12-21 00:17:09,502] Trial 145 finished with value: 1.9328858553706836 and parameters: {'learning_rate': 0.9360093175298043, 'aft_loss_distribution': 'normal', 'aft_loss_distribution_scale': 1.7502990493647879, 'max_depth': 9, 'booster': 'gbtree', 'scale_pos_weight': 0.41126024043847437, 'alpha': 8.220399747599101, 'lambda': 9.81614880609621, 'eta': 0.015926040195897977, 'sampling_method': 'gradient_based', 'subsample': 0.6681548562763456, 'gamma': 8.008576703200815}. Best is trial 145 with value: 1.9328858553706836.
[I 2023-12-21 00:17:09,827] Trial 146 finished with value: 1.9363941349291856 and parameters: {'learning_rate': 0.9437228052669608, 'aft_loss_distribution': 'normal', 'aft_loss_distribution_scale': 1.810987580261505, 'max_depth': 9, 'booster': 'gbtree', 'scale_pos_weight': 0.20788699314342107, 'alpha': 8.30177629892652, 'lambda': 9.767426925768424, 'eta': 0.018106991604739154, 'sampling_method': 'gradient_based', 'subsample': 0.6662620299274448, 'gamma': 7.899461927232725}. Best is trial 145 with value: 1.9328858553706836.
[I 2023-12-21 00:17:10,150] Trial 147 finished with value: 1.93797831031581 and parameters: {'learning_rate': 0.9368309264869928, 'aft_loss_distribution': 'normal', 'aft_loss_distribution_scale': 1.831944752651844, 'max_depth': 9, 'booster': 'gbtree', 'scale_pos_weight': 0.16655455027164415, 'alpha': 8.35790783549802, 'lambda': 9.759609611308528, 'eta': 0.016739879960204273, 'sampling_method': 'gradient_based', 'subsample': 0.6664864697932671, 'gamma': 8.966489068678444}. Best is trial 145 with value: 1.9328858553706836.
[I 2023-12-21 00:17:10,790] Trial 148 finished with value: 1.9193275161279355 and parameters: {'learning_rate': 0.965123421346666, 'aft_loss_distribution': 'normal', 'aft_loss_distribution_scale': 1.5482823128305094, 'max_depth': 9, 'booster': 'gbtree', 'scale_pos_weight': 0.1936786588822116, 'alpha': 8.362091295979734, 'lambda': 9.737949157656505, 'eta': 0.01412785780917454, 'sampling_method': 'gradient_based', 'subsample': 0.6704933787635573, 'gamma': 8.054645153407318}. Best is trial 148 with value: 1.9193275161279355.
[I 2023-12-21 00:17:11,111] Trial 149 finished with value: 1.9201133612395687 and parameters: {'learning_rate': 0.9703077503682754, 'aft_loss_distribution': 'normal', 'aft_loss_distribution_scale': 1.5145652215244856, 'max_depth': 9, 'booster': 'gbtree', 'scale_pos_weight': 0.19834032276616553, 'alpha': 8.604912648779774, 'lambda': 9.701111743581281, 'eta': 0.007361459155460069, 'sampling_method': 'gradient_based', 'subsample': 0.6674433584596575, 'gamma': 9.033263086975477}. Best is trial 148 with value: 1.9193275161279355.
[I 2023-12-21 00:17:11,181] Trial 150 pruned. Trial was pruned at iteration 0.
[I 2023-12-21 00:17:11,508] Trial 151 finished with value: 1.929316842083051 and parameters: {'learning_rate': 0.9390674468321701, 'aft_loss_distribution': 'normal', 'aft_loss_distribution_scale': 1.710810603170804, 'max_depth': 9, 'booster': 'gbtree', 'scale_pos_weight': 0.07570360178517188, 'alpha': 8.917726289046863, 'lambda': 9.266048002564117, 'eta': 0.021793242219040533, 'sampling_method': 'gradient_based', 'subsample': 0.6159717660141312, 'gamma': 8.881128757689105}. Best is trial 148 with value: 1.9193275161279355.
[I 2023-12-21 00:17:11,842] Trial 152 finished with value: 1.9318758994644352 and parameters: {'learning_rate': 0.9472289865633929, 'aft_loss_distribution': 'normal', 'aft_loss_distribution_scale': 1.7286290422037331, 'max_depth': 9, 'booster': 'gbtree', 'scale_pos_weight': 0.05564399851107782, 'alpha': 9.01653802070721, 'lambda': 9.756397038275605, 'eta': 0.021863099759552408, 'sampling_method': 'gradient_based', 'subsample': 0.6182914113215628, 'gamma': 8.90957344930729}. Best is trial 148 with value: 1.9193275161279355.
[I 2023-12-21 00:17:12,123] Trial 153 finished with value: 1.9295821396077915 and parameters: {'learning_rate': 0.9500554470344689, 'aft_loss_distribution': 'normal', 'aft_loss_distribution_scale': 1.7251281482414893, 'max_depth': 9, 'booster': 'gbtree', 'scale_pos_weight': 0.10646906702216265, 'alpha': 8.930320202221589, 'lambda': 9.751194209170059, 'eta': 0.027367820522529025, 'sampling_method': 'gradient_based', 'subsample': 0.6561724547376205, 'gamma': 8.940962876632758}. Best is trial 148 with value: 1.9193275161279355.
[I 2023-12-21 00:17:12,321] Trial 154 finished with value: inf and parameters: {'learning_rate': 0.948704545774561, 'aft_loss_distribution': 'normal', 'aft_loss_distribution_scale': 1.7753696759338868, 'max_depth': 9, 'booster': 'gbtree', 'scale_pos_weight': 0.03947914757861393, 'alpha': 9.108438948409972, 'lambda': 9.713588620957072, 'eta': 0.023223609532881766, 'sampling_method': 'gradient_based', 'subsample': 0.6115149730272342, 'gamma': 8.98491288605764}. Best is trial 148 with value: 1.9193275161279355.
[I 2023-12-21 00:17:12,684] Trial 155 finished with value: 1.9176076153577493 and parameters: {'learning_rate': 0.9335056559340811, 'aft_loss_distribution': 'normal', 'aft_loss_distribution_scale': 1.3311296104705248, 'max_depth': 9, 'booster': 'gbtree', 'scale_pos_weight': 0.16017408756441273, 'alpha': 8.216268544585645, 'lambda': 9.731140523282004, 'eta': 0.00043006238181737474, 'sampling_method': 'gradient_based', 'subsample': 0.6498393375133666, 'gamma': 8.832872536143636}. Best is trial 155 with value: 1.9176076153577493.
[I 2023-12-21 00:17:12,754] Trial 156 pruned. Trial was pruned at iteration 0.
[I 2023-12-21 00:17:12,815] Trial 157 pruned. Trial was pruned at iteration 0.
[I 2023-12-21 00:17:13,166] Trial 158 finished with value: 1.916800969741346 and parameters: {'learning_rate': 0.9592026733985332, 'aft_loss_distribution': 'normal', 'aft_loss_distribution_scale': 1.3291973752452746, 'max_depth': 9, 'booster': 'gbtree', 'scale_pos_weight': 0.19040329102647635, 'alpha': 8.178120510798141, 'lambda': 9.77609125794929, 'eta': 0.03783480779219779, 'sampling_method': 'gradient_based', 'subsample': 0.6970351830829878, 'gamma': 9.62576510429948}. Best is trial 158 with value: 1.916800969741346.
[I 2023-12-21 00:17:13,373] Trial 159 finished with value: inf and parameters: {'learning_rate': 0.9487393505149843, 'aft_loss_distribution': 'normal', 'aft_loss_distribution_scale': 1.271889699731232, 'max_depth': 9, 'booster': 'gbtree', 'scale_pos_weight': 0.2552641695187855, 'alpha': 8.83171253835927, 'lambda': 9.779649517148574, 'eta': 0.04114865946246862, 'sampling_method': 'gradient_based', 'subsample': 0.6234870752937841, 'gamma': 8.31937751333156}. Best is trial 158 with value: 1.916800969741346.
[I 2023-12-21 00:17:13,671] Trial 160 finished with value: 1.918936426151384 and parameters: {'learning_rate': 0.9747255776945182, 'aft_loss_distribution': 'normal', 'aft_loss_distribution_scale': 1.5354796283914207, 'max_depth': 9, 'booster': 'gbtree', 'scale_pos_weight': 0.11387265837159838, 'alpha': 8.12610041001231, 'lambda': 9.739299119527683, 'eta': 0.018101740707117415, 'sampling_method': 'gradient_based', 'subsample': 0.6487785957930512, 'gamma': 9.86244826631231}. Best is trial 158 with value: 1.916800969741346.
[I 2023-12-21 00:17:13,967] Trial 161 finished with value: 1.925611403239784 and parameters: {'learning_rate': 0.9803055547947185, 'aft_loss_distribution': 'normal', 'aft_loss_distribution_scale': 1.6563992804815955, 'max_depth': 9, 'booster': 'gbtree', 'scale_pos_weight': 0.1301525694664303, 'alpha': 8.140307776082807, 'lambda': 9.749871212063422, 'eta': 0.00039479523969555494, 'sampling_method': 'gradient_based', 'subsample': 0.6659765444182357, 'gamma': 9.725410430020009}. Best is trial 158 with value: 1.916800969741346.
[I 2023-12-21 00:17:14,253] Trial 162 finished with value: 1.9187243121441553 and parameters: {'learning_rate': 0.9814313959078718, 'aft_loss_distribution': 'normal', 'aft_loss_distribution_scale': 1.5519506951885391, 'max_depth': 9, 'booster': 'gbtree', 'scale_pos_weight': 0.11114407557621737, 'alpha': 8.168477905343014, 'lambda': 9.695445581528398, 'eta': 0.0014966554286973883, 'sampling_method': 'gradient_based', 'subsample': 0.6594037333490744, 'gamma': 9.769963657085224}. Best is trial 158 with value: 1.916800969741346.
[I 2023-12-21 00:17:14,594] Trial 163 finished with value: 1.9193931154435162 and parameters: {'learning_rate': 0.9826547694545724, 'aft_loss_distribution': 'normal', 'aft_loss_distribution_scale': 1.5458091493773647, 'max_depth': 9, 'booster': 'gbtree', 'scale_pos_weight': 0.12414204270546315, 'alpha': 8.243902381464673, 'lambda': 9.673945829336427, 'eta': 0.01979967885976127, 'sampling_method': 'gradient_based', 'subsample': 0.6613265803003038, 'gamma': 9.935014076353696}. Best is trial 158 with value: 1.916800969741346.
