[I 2023-12-18 22:49:03,492] A new study created in memory with name: no-name-634dc06b-da48-4a28-8628-d332c8d4668e
trn1 0.9535765040265277 n= 6333
trn2 0.9519898926089703 n= 6332
val 0.9500947567909034 n= 6332
tst 0.9645731863624711 n= 19505
pos-neg-ratio: 0.9535765040265277 500 trials during Optuna search
All avail dimensionality reduced word embedding
All avail dimensionality reduced word embedding
All avail dimensionality reduced word embedding
All avail dimensionality reduced word embedding
trn1
trn2
val
tst
[I 2023-12-18 22:49:03,769] Trial 0 finished with value: inf and parameters: {'learning_rate': 0.8472969151487373, 'aft_loss_distribution': 'logistic', 'aft_loss_distribution_scale': 6.604061679978522, 'max_depth': 9, 'booster': 'gbtree', 'scale_pos_weight': 3.0788614770897547, 'alpha': 3.7102632827345325, 'lambda': 9.11168115249096, 'eta': 0.27931058823825006, 'sampling_method': 'gradient_based', 'subsample': 0.05017653791617024, 'gamma': 0.8624109940359898}. Best is trial 0 with value: inf.
[I 2023-12-18 22:49:08,303] Trial 1 finished with value: 4.243578196768486 and parameters: {'learning_rate': 0.0065273299616546996, 'aft_loss_distribution': 'logistic', 'aft_loss_distribution_scale': 0.7130623030296811, 'max_depth': 8, 'booster': 'gbtree', 'scale_pos_weight': 0.10058540779632404, 'alpha': 2.727500027403961, 'lambda': 9.04356108306586, 'eta': 0.27776136464037793, 'sampling_method': 'uniform', 'subsample': 0.0607946425885058, 'gamma': 7.649974567195368}. Best is trial 1 with value: 4.243578196768486.
[I 2023-12-18 22:49:08,724] Trial 2 finished with value: 4.595620653886308 and parameters: {'learning_rate': 0.05764546005336109, 'aft_loss_distribution': 'extreme', 'aft_loss_distribution_scale': 1.835359903252957, 'max_depth': 6, 'booster': 'gbtree', 'scale_pos_weight': 1.8360331750190548, 'alpha': 9.551591043331737, 'lambda': 7.5165318810016934, 'eta': 0.3801222477868148, 'sampling_method': 'gradient_based', 'subsample': 0.3691217755826063, 'gamma': 7.3271282005340606}. Best is trial 1 with value: 4.243578196768486.
[I 2023-12-18 22:49:11,353] Trial 3 finished with value: 5.944586236497071 and parameters: {'learning_rate': 0.48320524038075063, 'aft_loss_distribution': 'logistic', 'aft_loss_distribution_scale': 6.301285911889659, 'max_depth': 9, 'booster': 'dart', 'scale_pos_weight': 8.565367268698132, 'alpha': 6.266493261572287, 'lambda': 9.728845998563251, 'eta': 0.023695288681541027, 'sampling_method': 'gradient_based', 'subsample': 0.03802553725025031, 'gamma': 6.314615913314811}. Best is trial 1 with value: 4.243578196768486.
[I 2023-12-18 22:49:15,913] Trial 4 finished with value: 4.983340536932757 and parameters: {'learning_rate': 0.4848706274808355, 'aft_loss_distribution': 'extreme', 'aft_loss_distribution_scale': 3.1568029642442266, 'max_depth': 10, 'booster': 'dart', 'scale_pos_weight': 0.7206142041622878, 'alpha': 5.273050433959637, 'lambda': 1.624564436814116, 'eta': 0.7384095849534953, 'sampling_method': 'gradient_based', 'subsample': 0.20812276340541164, 'gamma': 7.806527486753054}. Best is trial 1 with value: 4.243578196768486.
[I 2023-12-18 22:49:16,238] Trial 5 pruned. Trial was pruned at iteration 24.
[I 2023-12-18 22:49:18,724] Trial 6 pruned. Trial was pruned at iteration 74.
[I 2023-12-18 22:49:19,057] Trial 7 pruned. Trial was pruned at iteration 24.
[I 2023-12-18 22:49:19,065] Trial 8 pruned. Trial was pruned at iteration 0.
[I 2023-12-18 22:49:19,075] Trial 9 pruned. Trial was pruned at iteration 0.
[I 2023-12-18 22:49:19,127] Trial 10 pruned. Trial was pruned at iteration 0.
[I 2023-12-18 22:49:19,175] Trial 11 pruned. Trial was pruned at iteration 0.
[I 2023-12-18 22:49:19,325] Trial 12 pruned. Trial was pruned at iteration 56.
[I 2023-12-18 22:49:19,377] Trial 13 pruned. Trial was pruned at iteration 0.
[I 2023-12-18 22:49:19,422] Trial 14 pruned. Trial was pruned at iteration 0.
[I 2023-12-18 22:49:19,525] Trial 15 pruned. Trial was pruned at iteration 30.
[I 2023-12-18 22:49:19,570] Trial 16 pruned. Trial was pruned at iteration 0.
[I 2023-12-18 22:49:19,672] Trial 17 pruned. Trial was pruned at iteration 27.
[I 2023-12-18 22:49:19,724] Trial 18 pruned. Trial was pruned at iteration 0.
[I 2023-12-18 22:49:19,824] Trial 19 pruned. Trial was pruned at iteration 29.
[I 2023-12-18 22:49:19,882] Trial 20 pruned. Trial was pruned at iteration 0.
[I 2023-12-18 22:49:21,603] Trial 21 pruned. Trial was pruned at iteration 59.
[I 2023-12-18 22:49:21,654] Trial 22 pruned. Trial was pruned at iteration 0.
[I 2023-12-18 22:49:22,804] Trial 23 pruned. Trial was pruned at iteration 48.
[I 2023-12-18 22:49:22,859] Trial 24 pruned. Trial was pruned at iteration 0.
[I 2023-12-18 22:49:25,427] Trial 25 pruned. Trial was pruned at iteration 71.
[I 2023-12-18 22:49:26,269] Trial 26 pruned. Trial was pruned at iteration 34.
[I 2023-12-18 22:49:26,483] Trial 27 pruned. Trial was pruned at iteration 51.
[I 2023-12-18 22:49:26,563] Trial 28 pruned. Trial was pruned at iteration 0.
[I 2023-12-18 22:49:26,983] Trial 29 finished with value: inf and parameters: {'learning_rate': 0.7929198793038561, 'aft_loss_distribution': 'logistic', 'aft_loss_distribution_scale': 1.882836511674898, 'max_depth': 6, 'booster': 'gbtree', 'scale_pos_weight': 2.777950529952671, 'alpha': 4.329690723770164, 'lambda': 8.679131606419014, 'eta': 0.0811682868137901, 'sampling_method': 'gradient_based', 'subsample': 0.07984702471681579, 'gamma': 0.14621899262617433}. Best is trial 1 with value: 4.243578196768486.
[I 2023-12-18 22:49:27,136] Trial 30 pruned. Trial was pruned at iteration 20.
[I 2023-12-18 22:49:27,212] Trial 31 pruned. Trial was pruned at iteration 0.
[I 2023-12-18 22:49:27,294] Trial 32 pruned. Trial was pruned at iteration 0.
[I 2023-12-18 22:49:27,592] Trial 33 pruned. Trial was pruned at iteration 18.
[I 2023-12-18 22:49:27,673] Trial 34 pruned. Trial was pruned at iteration 0.
[I 2023-12-18 22:49:28,103] Trial 35 pruned. Trial was pruned at iteration 24.
[I 2023-12-18 22:49:28,216] Trial 36 pruned. Trial was pruned at iteration 0.
[I 2023-12-18 22:49:28,298] Trial 37 pruned. Trial was pruned at iteration 0.
[I 2023-12-18 22:49:28,903] Trial 38 pruned. Trial was pruned at iteration 28.
[I 2023-12-18 22:49:29,112] Trial 39 pruned. Trial was pruned at iteration 55.
[I 2023-12-18 22:49:29,200] Trial 40 pruned. Trial was pruned at iteration 0.
[I 2023-12-18 22:49:29,291] Trial 41 pruned. Trial was pruned at iteration 0.
[I 2023-12-18 22:49:29,360] Trial 42 pruned. Trial was pruned at iteration 0.
[I 2023-12-18 22:49:29,463] Trial 43 pruned. Trial was pruned at iteration 20.
[I 2023-12-18 22:49:29,655] Trial 44 finished with value: inf and parameters: {'learning_rate': 0.43014252534091196, 'aft_loss_distribution': 'logistic', 'aft_loss_distribution_scale': 1.5985318012778789, 'max_depth': 5, 'booster': 'gbtree', 'scale_pos_weight': 2.826356150816849, 'alpha': 3.646646012690595, 'lambda': 9.799373998035264, 'eta': 0.34724526478702566, 'sampling_method': 'uniform', 'subsample': 0.10883319401698022, 'gamma': 8.552194888212343}. Best is trial 1 with value: 4.243578196768486.
[I 2023-12-18 22:49:29,762] Trial 45 pruned. Trial was pruned at iteration 23.
[I 2023-12-18 22:49:29,872] Trial 46 pruned. Trial was pruned at iteration 25.
[I 2023-12-18 22:49:29,929] Trial 47 pruned. Trial was pruned at iteration 0.
[I 2023-12-18 22:49:30,046] Trial 48 pruned. Trial was pruned at iteration 25.
[I 2023-12-18 22:49:30,099] Trial 49 pruned. Trial was pruned at iteration 0.
[I 2023-12-18 22:49:32,554] Trial 50 pruned. Trial was pruned at iteration 69.
[I 2023-12-18 22:49:32,865] Trial 51 finished with value: inf and parameters: {'learning_rate': 0.8062275304551488, 'aft_loss_distribution': 'logistic', 'aft_loss_distribution_scale': 1.7050515729979265, 'max_depth': 6, 'booster': 'gbtree', 'scale_pos_weight': 2.4170367934708175, 'alpha': 4.271237516452864, 'lambda': 8.228501024414763, 'eta': 0.06595057630666108, 'sampling_method': 'gradient_based', 'subsample': 0.06278385567386685, 'gamma': 0.21799479925667287}. Best is trial 1 with value: 4.243578196768486.
[I 2023-12-18 22:49:33,114] Trial 52 finished with value: inf and parameters: {'learning_rate': 0.9133665282980032, 'aft_loss_distribution': 'logistic', 'aft_loss_distribution_scale': 2.3466846759830506, 'max_depth': 5, 'booster': 'gbtree', 'scale_pos_weight': 1.5760297565957617, 'alpha': 3.332243411914785, 'lambda': 8.574955737519169, 'eta': 0.07665745572841742, 'sampling_method': 'gradient_based', 'subsample': 0.09286606778870657, 'gamma': 0.2980236029236767}. Best is trial 1 with value: 4.243578196768486.
[I 2023-12-18 22:49:33,360] Trial 53 finished with value: inf and parameters: {'learning_rate': 0.7664182122277802, 'aft_loss_distribution': 'logistic', 'aft_loss_distribution_scale': 1.9559839469394142, 'max_depth': 6, 'booster': 'gbtree', 'scale_pos_weight': 3.478122412910806, 'alpha': 6.502140089099005, 'lambda': 9.074940329181375, 'eta': 0.171733209679366, 'sampling_method': 'gradient_based', 'subsample': 0.04399987681940061, 'gamma': 1.022407013210412}. Best is trial 1 with value: 4.243578196768486.
[I 2023-12-18 22:49:33,426] Trial 54 pruned. Trial was pruned at iteration 0.
[I 2023-12-18 22:49:33,479] Trial 55 pruned. Trial was pruned at iteration 0.
[I 2023-12-18 22:49:33,656] Trial 56 finished with value: inf and parameters: {'learning_rate': 0.9077374673290608, 'aft_loss_distribution': 'normal', 'aft_loss_distribution_scale': 3.142758512285711, 'max_depth': 4, 'booster': 'gbtree', 'scale_pos_weight': 1.1286216969882428, 'alpha': 2.651814840878828, 'lambda': 7.857827035209812, 'eta': 0.38722930345656403, 'sampling_method': 'gradient_based', 'subsample': 0.15159093895615808, 'gamma': 3.3082817035739733}. Best is trial 1 with value: 4.243578196768486.
[I 2023-12-18 22:49:33,715] Trial 57 pruned. Trial was pruned at iteration 0.
[I 2023-12-18 22:49:33,765] Trial 58 pruned. Trial was pruned at iteration 0.
[I 2023-12-18 22:49:33,823] Trial 59 pruned. Trial was pruned at iteration 0.
[I 2023-12-18 22:49:33,880] Trial 60 pruned. Trial was pruned at iteration 0.
[I 2023-12-18 22:49:34,048] Trial 61 pruned. Trial was pruned at iteration 76.
[I 2023-12-18 22:49:34,195] Trial 62 finished with value: inf and parameters: {'learning_rate': 0.4917322271614743, 'aft_loss_distribution': 'logistic', 'aft_loss_distribution_scale': 1.5120545901925553, 'max_depth': 6, 'booster': 'gbtree', 'scale_pos_weight': 2.861086758349265, 'alpha': 3.6191497129715415, 'lambda': 9.599742570477332, 'eta': 0.37621812036856905, 'sampling_method': 'uniform', 'subsample': 0.19539696431400103, 'gamma': 8.90816836754311}. Best is trial 1 with value: 4.243578196768486.
[I 2023-12-18 22:49:34,253] Trial 63 pruned. Trial was pruned at iteration 0.
[I 2023-12-18 22:49:34,442] Trial 64 finished with value: 4.53397307648519 and parameters: {'learning_rate': 0.401666935961755, 'aft_loss_distribution': 'logistic', 'aft_loss_distribution_scale': 1.2297064615041027, 'max_depth': 4, 'booster': 'gbtree', 'scale_pos_weight': 4.409580168783567, 'alpha': 2.177929343246337, 'lambda': 6.073065784313995, 'eta': 0.2588601913102226, 'sampling_method': 'uniform', 'subsample': 0.10826147287891617, 'gamma': 6.5722520661061035}. Best is trial 1 with value: 4.243578196768486.
[I 2023-12-18 22:49:34,506] Trial 65 pruned. Trial was pruned at iteration 0.
[I 2023-12-18 22:49:34,559] Trial 66 pruned. Trial was pruned at iteration 0.
[I 2023-12-18 22:49:34,615] Trial 67 pruned. Trial was pruned at iteration 0.
[I 2023-12-18 22:49:34,669] Trial 68 pruned. Trial was pruned at iteration 0.
[I 2023-12-18 22:49:34,720] Trial 69 pruned. Trial was pruned at iteration 0.
[I 2023-12-18 22:49:34,772] Trial 70 pruned. Trial was pruned at iteration 0.
[I 2023-12-18 22:49:34,979] Trial 71 pruned. Trial was pruned at iteration 92.
[I 2023-12-18 22:49:35,030] Trial 72 pruned. Trial was pruned at iteration 0.
[I 2023-12-18 22:49:35,252] Trial 73 finished with value: 4.555119106685613 and parameters: {'learning_rate': 0.40325633992641297, 'aft_loss_distribution': 'logistic', 'aft_loss_distribution_scale': 1.2679809749251552, 'max_depth': 5, 'booster': 'gbtree', 'scale_pos_weight': 8.727524001832927, 'alpha': 4.081916603254447, 'lambda': 8.093342505595928, 'eta': 0.3472042710201055, 'sampling_method': 'uniform', 'subsample': 0.1049686701854516, 'gamma': 8.06457816047941}. Best is trial 1 with value: 4.243578196768486.
[I 2023-12-18 22:49:35,457] Trial 74 finished with value: inf and parameters: {'learning_rate': 0.38773055844877674, 'aft_loss_distribution': 'logistic', 'aft_loss_distribution_scale': 1.164678133392981, 'max_depth': 6, 'booster': 'gbtree', 'scale_pos_weight': 8.348615567840932, 'alpha': 4.514487898921329, 'lambda': 7.8816606285193265, 'eta': 0.038643683298555276, 'sampling_method': 'uniform', 'subsample': 0.03766461048693642, 'gamma': 6.006003248195134}. Best is trial 1 with value: 4.243578196768486.
[I 2023-12-18 22:49:35,515] Trial 75 pruned. Trial was pruned at iteration 0.
[I 2023-12-18 22:49:35,565] Trial 76 pruned. Trial was pruned at iteration 0.
[I 2023-12-18 22:49:35,618] Trial 77 pruned. Trial was pruned at iteration 0.
[I 2023-12-18 22:49:35,672] Trial 78 pruned. Trial was pruned at iteration 0.
[I 2023-12-18 22:49:35,725] Trial 79 pruned. Trial was pruned at iteration 0.
[I 2023-12-18 22:49:35,781] Trial 80 pruned. Trial was pruned at iteration 0.
[I 2023-12-18 22:49:35,981] Trial 81 pruned. Trial was pruned at iteration 70.
[I 2023-12-18 22:49:36,045] Trial 82 pruned. Trial was pruned at iteration 0.
[I 2023-12-18 22:49:36,309] Trial 83 finished with value: inf and parameters: {'learning_rate': 0.4356395563979608, 'aft_loss_distribution': 'logistic', 'aft_loss_distribution_scale': 1.023819689971042, 'max_depth': 6, 'booster': 'gbtree', 'scale_pos_weight': 2.703661027660245, 'alpha': 3.436089828024464, 'lambda': 9.270523548459089, 'eta': 0.3607158727593544, 'sampling_method': 'uniform', 'subsample': 0.10960742090720774, 'gamma': 1.322465548012022}. Best is trial 1 with value: 4.243578196768486.
[I 2023-12-18 22:49:36,374] Trial 84 pruned. Trial was pruned at iteration 0.
[I 2023-12-18 22:49:36,428] Trial 85 pruned. Trial was pruned at iteration 0.
[I 2023-12-18 22:49:36,495] Trial 86 pruned. Trial was pruned at iteration 0.
[I 2023-12-18 22:49:36,551] Trial 87 pruned. Trial was pruned at iteration 0.
[I 2023-12-18 22:49:36,610] Trial 88 pruned. Trial was pruned at iteration 0.
[I 2023-12-18 22:49:46,282] Trial 89 finished with value: 4.539629864838085 and parameters: {'learning_rate': 0.591341749218762, 'aft_loss_distribution': 'logistic', 'aft_loss_distribution_scale': 1.2445924391518237, 'max_depth': 9, 'booster': 'dart', 'scale_pos_weight': 3.327878672104382, 'alpha': 2.572367520392916, 'lambda': 8.34325839544948, 'eta': 0.34070750823204254, 'sampling_method': 'uniform', 'subsample': 0.12948122655294372, 'gamma': 5.912846940914073}. Best is trial 1 with value: 4.243578196768486.
[I 2023-12-18 22:49:46,343] Trial 90 pruned. Trial was pruned at iteration 0.
[I 2023-12-18 22:49:46,399] Trial 91 pruned. Trial was pruned at iteration 0.
[I 2023-12-18 22:49:46,464] Trial 92 pruned. Trial was pruned at iteration 1.
[I 2023-12-18 22:49:46,520] Trial 93 pruned. Trial was pruned at iteration 0.
[I 2023-12-18 22:49:46,577] Trial 94 pruned. Trial was pruned at iteration 0.
[I 2023-12-18 22:49:46,632] Trial 95 pruned. Trial was pruned at iteration 0.
[I 2023-12-18 22:49:46,692] Trial 96 pruned. Trial was pruned at iteration 0.
[I 2023-12-18 22:49:46,750] Trial 97 pruned. Trial was pruned at iteration 0.
[I 2023-12-18 22:49:46,812] Trial 98 pruned. Trial was pruned at iteration 0.
[I 2023-12-18 22:49:46,869] Trial 99 pruned. Trial was pruned at iteration 0.
[I 2023-12-18 22:49:47,044] Trial 100 pruned. Trial was pruned at iteration 52.
[I 2023-12-18 22:49:47,101] Trial 101 pruned. Trial was pruned at iteration 0.
[I 2023-12-18 22:49:47,165] Trial 102 pruned. Trial was pruned at iteration 0.
[I 2023-12-18 22:49:47,225] Trial 103 pruned. Trial was pruned at iteration 0.
[I 2023-12-18 22:49:47,284] Trial 104 pruned. Trial was pruned at iteration 0.
[I 2023-12-18 22:49:47,340] Trial 105 pruned. Trial was pruned at iteration 0.
[I 2023-12-18 22:49:47,397] Trial 106 pruned. Trial was pruned at iteration 0.
[I 2023-12-18 22:49:48,717] Trial 107 pruned. Trial was pruned at iteration 51.
[I 2023-12-18 22:49:48,774] Trial 108 pruned. Trial was pruned at iteration 0.
[I 2023-12-18 22:49:48,842] Trial 109 pruned. Trial was pruned at iteration 0.
[I 2023-12-18 22:49:48,914] Trial 110 pruned. Trial was pruned at iteration 0.
[I 2023-12-18 22:49:48,970] Trial 111 pruned. Trial was pruned at iteration 0.
[I 2023-12-18 22:49:49,030] Trial 112 pruned. Trial was pruned at iteration 0.
[I 2023-12-18 22:49:49,090] Trial 113 pruned. Trial was pruned at iteration 0.
[I 2023-12-18 22:49:49,147] Trial 114 pruned. Trial was pruned at iteration 0.
[I 2023-12-18 22:49:49,212] Trial 115 pruned. Trial was pruned at iteration 0.
[I 2023-12-18 22:49:49,452] Trial 116 finished with value: inf and parameters: {'learning_rate': 0.47162349911616896, 'aft_loss_distribution': 'logistic', 'aft_loss_distribution_scale': 1.440445826286041, 'max_depth': 4, 'booster': 'gbtree', 'scale_pos_weight': 8.50414829309014, 'alpha': 3.794532333885221, 'lambda': 8.434745954837584, 'eta': 0.3030372154286004, 'sampling_method': 'uniform', 'subsample': 0.1114988015725826, 'gamma': 0.005001630124602613}. Best is trial 1 with value: 4.243578196768486.
[I 2023-12-18 22:49:49,513] Trial 117 pruned. Trial was pruned at iteration 0.
[I 2023-12-18 22:49:49,571] Trial 118 pruned. Trial was pruned at iteration 0.
[I 2023-12-18 22:49:49,627] Trial 119 pruned. Trial was pruned at iteration 0.
[I 2023-12-18 22:49:49,688] Trial 120 pruned. Trial was pruned at iteration 0.
[I 2023-12-18 22:49:49,747] Trial 121 pruned. Trial was pruned at iteration 0.
[I 2023-12-18 22:49:49,820] Trial 122 pruned. Trial was pruned at iteration 0.
[I 2023-12-18 22:49:49,886] Trial 123 pruned. Trial was pruned at iteration 0.
[I 2023-12-18 22:49:49,951] Trial 124 pruned. Trial was pruned at iteration 0.
[I 2023-12-18 22:49:50,013] Trial 125 pruned. Trial was pruned at iteration 0.
[I 2023-12-18 22:49:50,075] Trial 126 pruned. Trial was pruned at iteration 0.
[I 2023-12-18 22:49:50,134] Trial 127 pruned. Trial was pruned at iteration 0.
[I 2023-12-18 22:49:50,200] Trial 128 pruned. Trial was pruned at iteration 0.
[I 2023-12-18 22:49:53,466] Trial 129 finished with value: 4.395580495896842 and parameters: {'learning_rate': 0.5774390917947729, 'aft_loss_distribution': 'logistic', 'aft_loss_distribution_scale': 0.9841577535338926, 'max_depth': 6, 'booster': 'dart', 'scale_pos_weight': 1.9394625323943893, 'alpha': 3.1619607657077857, 'lambda': 9.43867451664907, 'eta': 0.40169893556021197, 'sampling_method': 'uniform', 'subsample': 0.01959656145902651, 'gamma': 7.715424267179682}. Best is trial 1 with value: 4.243578196768486.
[I 2023-12-18 22:50:02,678] Trial 130 finished with value: 4.438006545266586 and parameters: {'learning_rate': 0.6869201498632928, 'aft_loss_distribution': 'logistic', 'aft_loss_distribution_scale': 1.0580406558112994, 'max_depth': 6, 'booster': 'dart', 'scale_pos_weight': 1.947064582601288, 'alpha': 3.2105247060699655, 'lambda': 9.588025693296716, 'eta': 0.3988737557755191, 'sampling_method': 'uniform', 'subsample': 0.012087182681311169, 'gamma': 7.643789575322008}. Best is trial 1 with value: 4.243578196768486.
[I 2023-12-18 22:50:05,137] Trial 131 finished with value: inf and parameters: {'learning_rate': 0.5857473815046573, 'aft_loss_distribution': 'logistic', 'aft_loss_distribution_scale': 0.9656709251238147, 'max_depth': 6, 'booster': 'dart', 'scale_pos_weight': 1.9906759879755287, 'alpha': 3.3112759252343653, 'lambda': 9.699490654066363, 'eta': 0.3964066072544854, 'sampling_method': 'uniform', 'subsample': 0.01178706574582912, 'gamma': 7.7894679743721245}. Best is trial 1 with value: 4.243578196768486.
[I 2023-12-18 22:50:07,040] Trial 132 finished with value: inf and parameters: {'learning_rate': 0.6169257723839433, 'aft_loss_distribution': 'logistic', 'aft_loss_distribution_scale': 1.0906083675961709, 'max_depth': 6, 'booster': 'dart', 'scale_pos_weight': 1.393540531380748, 'alpha': 2.8023405634950453, 'lambda': 9.443554651952024, 'eta': 0.49566458108361144, 'sampling_method': 'uniform', 'subsample': 0.0296198423245274, 'gamma': 7.497270875759549}. Best is trial 1 with value: 4.243578196768486.
[I 2023-12-18 22:50:07,112] Trial 133 pruned. Trial was pruned at iteration 0.
[I 2023-12-18 22:50:07,174] Trial 134 pruned. Trial was pruned at iteration 0.
[I 2023-12-18 22:50:08,706] Trial 135 pruned. Trial was pruned at iteration 53.
[I 2023-12-18 22:50:08,802] Trial 136 pruned. Trial was pruned at iteration 0.
[I 2023-12-18 22:50:08,901] Trial 137 pruned. Trial was pruned at iteration 0.
[I 2023-12-18 22:50:09,005] Trial 138 pruned. Trial was pruned at iteration 0.
[I 2023-12-18 22:50:09,103] Trial 139 pruned. Trial was pruned at iteration 0.
[I 2023-12-18 22:50:09,198] Trial 140 pruned. Trial was pruned at iteration 0.
[I 2023-12-18 22:50:09,299] Trial 141 pruned. Trial was pruned at iteration 0.
[I 2023-12-18 22:50:09,396] Trial 142 pruned. Trial was pruned at iteration 0.
[I 2023-12-18 22:50:09,495] Trial 143 pruned. Trial was pruned at iteration 0.
[I 2023-12-18 22:50:09,593] Trial 144 pruned. Trial was pruned at iteration 0.
[I 2023-12-18 22:50:09,697] Trial 145 pruned. Trial was pruned at iteration 0.
[I 2023-12-18 22:50:09,791] Trial 146 pruned. Trial was pruned at iteration 0.
[I 2023-12-18 22:50:09,889] Trial 147 pruned. Trial was pruned at iteration 0.
[I 2023-12-18 22:50:09,984] Trial 148 pruned. Trial was pruned at iteration 0.
[I 2023-12-18 22:50:10,077] Trial 149 pruned. Trial was pruned at iteration 0.
[I 2023-12-18 22:50:10,174] Trial 150 pruned. Trial was pruned at iteration 0.
