[I 2023-12-19 01:03:03,627] Trial 248 finished with value: 2.107912437238481 and parameters: {'learning_rate': 0.5554260215053698, 'aft_loss_distribution': 'logistic', 'aft_loss_distribution_scale': 1.6397524297220578, 'max_depth': 9, 'booster': 'dart', 'scale_pos_weight': 2.4117645674511543, 'alpha': 8.199974271143564, 'lambda': 9.338162438496461, 'eta': 0.9486357205397616, 'sampling_method': 'uniform', 'subsample': 0.43026737326807624, 'gamma': 5.811393395048938}. Best is trial 233 with value: 2.0977569590378824.
[I 2023-12-19 01:03:03,729] Trial 249 pruned. Trial was pruned at iteration 0.
[I 2023-12-19 01:03:13,176] Trial 250 finished with value: 2.1113805838363944 and parameters: {'learning_rate': 0.5889807301893392, 'aft_loss_distribution': 'logistic', 'aft_loss_distribution_scale': 1.6291982162380745, 'max_depth': 9, 'booster': 'dart', 'scale_pos_weight': 2.2262282335416863, 'alpha': 8.238880816666535, 'lambda': 9.395860829596113, 'eta': 0.9998154665043983, 'sampling_method': 'uniform', 'subsample': 0.3827373127155878, 'gamma': 5.694306892244544}. Best is trial 233 with value: 2.0977569590378824.
[I 2023-12-19 01:03:15,407] Trial 251 finished with value: inf and parameters: {'learning_rate': 0.6112276039574668, 'aft_loss_distribution': 'logistic', 'aft_loss_distribution_scale': 1.5690070740035609, 'max_depth': 9, 'booster': 'dart', 'scale_pos_weight': 2.452978871721269, 'alpha': 8.225779525364763, 'lambda': 9.395966849734378, 'eta': 0.9996266885088236, 'sampling_method': 'uniform', 'subsample': 0.3824682104749959, 'gamma': 5.689055336733448}. Best is trial 233 with value: 2.0977569590378824.
[I 2023-12-19 01:03:18,711] Trial 252 finished with value: 2.119052494316685 and parameters: {'learning_rate': 0.6431540654639752, 'aft_loss_distribution': 'logistic', 'aft_loss_distribution_scale': 1.6637064649447482, 'max_depth': 9, 'booster': 'dart', 'scale_pos_weight': 2.2018650336148493, 'alpha': 8.456145214416223, 'lambda': 9.695528070833053, 'eta': 0.9445928502172226, 'sampling_method': 'uniform', 'subsample': 0.357468155939793, 'gamma': 5.504198040981917}. Best is trial 233 with value: 2.0977569590378824.
[I 2023-12-19 01:03:20,982] Trial 253 finished with value: inf and parameters: {'learning_rate': 0.648688385899629, 'aft_loss_distribution': 'logistic', 'aft_loss_distribution_scale': 1.681077672849829, 'max_depth': 9, 'booster': 'dart', 'scale_pos_weight': 2.2180442877495317, 'alpha': 8.522058341927643, 'lambda': 9.799524727368015, 'eta': 0.9536982484422564, 'sampling_method': 'uniform', 'subsample': 0.36114788675316783, 'gamma': 5.481246648863933}. Best is trial 233 with value: 2.0977569590378824.
[I 2023-12-19 01:03:23,868] Trial 254 finished with value: inf and parameters: {'learning_rate': 0.5452401536255482, 'aft_loss_distribution': 'logistic', 'aft_loss_distribution_scale': 1.5354438472818588, 'max_depth': 9, 'booster': 'dart', 'scale_pos_weight': 2.308890247440221, 'alpha': 8.061681907321653, 'lambda': 9.58081179636589, 'eta': 0.9536450917151805, 'sampling_method': 'uniform', 'subsample': 0.33146897420808197, 'gamma': 5.806321595634889}. Best is trial 233 with value: 2.0977569590378824.
[I 2023-12-19 01:03:23,973] Trial 255 pruned. Trial was pruned at iteration 0.
[I 2023-12-19 01:03:24,053] Trial 256 pruned. Trial was pruned at iteration 0.
[I 2023-12-19 01:03:29,882] Trial 257 finished with value: 2.1139422419375227 and parameters: {'learning_rate': 0.5932690142720449, 'aft_loss_distribution': 'logistic', 'aft_loss_distribution_scale': 1.667375914633287, 'max_depth': 9, 'booster': 'dart', 'scale_pos_weight': 2.0764845225082245, 'alpha': 7.519012114998672, 'lambda': 9.449352804168313, 'eta': 0.9634664344497721, 'sampling_method': 'uniform', 'subsample': 0.38732457846612334, 'gamma': 5.6605678116696}. Best is trial 233 with value: 2.0977569590378824.
[I 2023-12-19 01:03:30,027] Trial 258 pruned. Trial was pruned at iteration 0.
[I 2023-12-19 01:03:33,073] Trial 259 finished with value: 2.1119678141524285 and parameters: {'learning_rate': 0.5740935205002519, 'aft_loss_distribution': 'logistic', 'aft_loss_distribution_scale': 1.6404038126124136, 'max_depth': 9, 'booster': 'dart', 'scale_pos_weight': 2.543760714452609, 'alpha': 7.221962371682266, 'lambda': 9.42078484938226, 'eta': 0.912229979954605, 'sampling_method': 'uniform', 'subsample': 0.4277098756132361, 'gamma': 5.665069484290017}. Best is trial 233 with value: 2.0977569590378824.
[I 2023-12-19 01:03:33,173] Trial 260 pruned. Trial was pruned at iteration 0.
[I 2023-12-19 01:03:35,850] Trial 261 finished with value: inf and parameters: {'learning_rate': 0.577547447251278, 'aft_loss_distribution': 'logistic', 'aft_loss_distribution_scale': 1.5761050510577277, 'max_depth': 9, 'booster': 'dart', 'scale_pos_weight': 2.183543732038508, 'alpha': 7.130839228958153, 'lambda': 9.532577023805253, 'eta': 0.9078829313938425, 'sampling_method': 'uniform', 'subsample': 0.4272406084567988, 'gamma': 5.670406997591677}. Best is trial 233 with value: 2.0977569590378824.
[I 2023-12-19 01:03:48,003] Trial 262 finished with value: 2.111944104379066 and parameters: {'learning_rate': 0.5988060979800536, 'aft_loss_distribution': 'logistic', 'aft_loss_distribution_scale': 1.683472775046388, 'max_depth': 9, 'booster': 'dart', 'scale_pos_weight': 2.40423648926173, 'alpha': 8.685626203299877, 'lambda': 9.738641461638235, 'eta': 0.9422459246664636, 'sampling_method': 'uniform', 'subsample': 0.3853681549978738, 'gamma': 5.820992716708882}. Best is trial 233 with value: 2.0977569590378824.
[I 2023-12-19 01:03:50,488] Trial 263 finished with value: inf and parameters: {'learning_rate': 0.6002247709116899, 'aft_loss_distribution': 'logistic', 'aft_loss_distribution_scale': 1.6330289884540288, 'max_depth': 9, 'booster': 'dart', 'scale_pos_weight': 2.4000349388354194, 'alpha': 8.663305026314529, 'lambda': 9.75057660387917, 'eta': 0.9096691729655575, 'sampling_method': 'uniform', 'subsample': 0.3832155357127215, 'gamma': 6.025713454700636}. Best is trial 233 with value: 2.0977569590378824.
[I 2023-12-19 01:03:50,616] Trial 264 pruned. Trial was pruned at iteration 0.
[I 2023-12-19 01:03:50,747] Trial 265 pruned. Trial was pruned at iteration 0.
[I 2023-12-19 01:03:53,202] Trial 266 finished with value: inf and parameters: {'learning_rate': 0.6264705984601406, 'aft_loss_distribution': 'logistic', 'aft_loss_distribution_scale': 1.6519803107515938, 'max_depth': 9, 'booster': 'dart', 'scale_pos_weight': 2.2997980247384775, 'alpha': 7.966056996747486, 'lambda': 9.93138419918867, 'eta': 0.9473383912797274, 'sampling_method': 'uniform', 'subsample': 0.42913221484944175, 'gamma': 5.588464879958638}. Best is trial 233 with value: 2.0977569590378824.
[I 2023-12-19 01:03:53,291] Trial 267 pruned. Trial was pruned at iteration 0.
[I 2023-12-19 01:03:57,214] Trial 268 finished with value: 2.092352351623428 and parameters: {'learning_rate': 0.5547496578039599, 'aft_loss_distribution': 'logistic', 'aft_loss_distribution_scale': 1.454975542214395, 'max_depth': 9, 'booster': 'dart', 'scale_pos_weight': 2.0521308242265888, 'alpha': 7.565831623603042, 'lambda': 9.275876468733653, 'eta': 0.967543570274642, 'sampling_method': 'uniform', 'subsample': 0.4624452052373146, 'gamma': 5.880441689010485}. Best is trial 268 with value: 2.092352351623428.
[I 2023-12-19 01:03:57,317] Trial 269 pruned. Trial was pruned at iteration 0.
[I 2023-12-19 01:03:59,752] Trial 270 finished with value: inf and parameters: {'learning_rate': 0.5385948474876584, 'aft_loss_distribution': 'logistic', 'aft_loss_distribution_scale': 1.4577675701646227, 'max_depth': 9, 'booster': 'dart', 'scale_pos_weight': 2.043139692529328, 'alpha': 7.298211776388763, 'lambda': 9.74343931362125, 'eta': 0.9698543399081927, 'sampling_method': 'uniform', 'subsample': 0.46836488429560297, 'gamma': 5.8542460844867605}. Best is trial 268 with value: 2.092352351623428.
[I 2023-12-19 01:04:01,562] Trial 271 finished with value: inf and parameters: {'learning_rate': 0.5807460507931446, 'aft_loss_distribution': 'logistic', 'aft_loss_distribution_scale': 1.6567730116678707, 'max_depth': 9, 'booster': 'dart', 'scale_pos_weight': 2.1357515001488276, 'alpha': 8.470003062144496, 'lambda': 9.484386315051148, 'eta': 0.9818419063472771, 'sampling_method': 'uniform', 'subsample': 0.44156957632848975, 'gamma': 6.053320078959384}. Best is trial 268 with value: 2.092352351623428.
[I 2023-12-19 01:04:01,659] Trial 272 pruned. Trial was pruned at iteration 0.
[I 2023-12-19 01:04:01,739] Trial 273 pruned. Trial was pruned at iteration 0.
[I 2023-12-19 01:04:07,907] Trial 274 finished with value: 2.1228217089507435 and parameters: {'learning_rate': 0.5601067311825977, 'aft_loss_distribution': 'logistic', 'aft_loss_distribution_scale': 1.6799911865934452, 'max_depth': 9, 'booster': 'dart', 'scale_pos_weight': 2.167991363020946, 'alpha': 7.977085179468408, 'lambda': 9.245171922081694, 'eta': 0.9076393326279227, 'sampling_method': 'uniform', 'subsample': 0.35519828824105915, 'gamma': 4.749495248084278}. Best is trial 268 with value: 2.092352351623428.
[I 2023-12-19 01:04:10,002] Trial 275 finished with value: inf and parameters: {'learning_rate': 0.585202352236566, 'aft_loss_distribution': 'logistic', 'aft_loss_distribution_scale': 1.5815942022671052, 'max_depth': 9, 'booster': 'dart', 'scale_pos_weight': 2.2010925412946367, 'alpha': 7.617361980762072, 'lambda': 8.885526034641027, 'eta': 0.9070315255960655, 'sampling_method': 'uniform', 'subsample': 0.3255312868175197, 'gamma': 4.732969026540453}. Best is trial 268 with value: 2.092352351623428.
[I 2023-12-19 01:04:10,091] Trial 276 pruned. Trial was pruned at iteration 0.
[I 2023-12-19 01:04:10,173] Trial 277 pruned. Trial was pruned at iteration 0.
[I 2023-12-19 01:04:12,132] Trial 278 finished with value: inf and parameters: {'learning_rate': 0.6117290985852973, 'aft_loss_distribution': 'logistic', 'aft_loss_distribution_scale': 1.706415078045857, 'max_depth': 9, 'booster': 'dart', 'scale_pos_weight': 2.316546075897875, 'alpha': 8.5619367813737, 'lambda': 9.545097562931172, 'eta': 0.9057769801615602, 'sampling_method': 'uniform', 'subsample': 0.39856227781010434, 'gamma': 5.285237082904864}. Best is trial 268 with value: 2.092352351623428.
[I 2023-12-19 01:04:14,344] Trial 279 finished with value: inf and parameters: {'learning_rate': 0.5315957582338722, 'aft_loss_distribution': 'logistic', 'aft_loss_distribution_scale': 1.445328309008612, 'max_depth': 9, 'booster': 'dart', 'scale_pos_weight': 2.6663837612871157, 'alpha': 8.05628650908978, 'lambda': 9.295441059541869, 'eta': 0.9513011722147012, 'sampling_method': 'uniform', 'subsample': 0.3640802130031193, 'gamma': 4.742307626148961}. Best is trial 268 with value: 2.092352351623428.
[I 2023-12-19 01:04:14,430] Trial 280 pruned. Trial was pruned at iteration 0.
[I 2023-12-19 01:04:14,518] Trial 281 pruned. Trial was pruned at iteration 0.
[I 2023-12-19 01:04:18,453] Trial 282 finished with value: 2.1032907082243417 and parameters: {'learning_rate': 0.5543882422016975, 'aft_loss_distribution': 'logistic', 'aft_loss_distribution_scale': 1.4981301079272669, 'max_depth': 9, 'booster': 'dart', 'scale_pos_weight': 2.2450236012627314, 'alpha': 8.860425471548005, 'lambda': 9.214036170562906, 'eta': 0.9595052045136826, 'sampling_method': 'uniform', 'subsample': 0.45644056336413585, 'gamma': 5.82709605557256}. Best is trial 268 with value: 2.092352351623428.
[I 2023-12-19 01:04:18,608] Trial 283 pruned. Trial was pruned at iteration 0.
[I 2023-12-19 01:04:21,546] Trial 284 finished with value: inf and parameters: {'learning_rate': 0.5499497322001365, 'aft_loss_distribution': 'logistic', 'aft_loss_distribution_scale': 1.4842201168506393, 'max_depth': 9, 'booster': 'dart', 'scale_pos_weight': 2.4142961708114004, 'alpha': 8.81206899541049, 'lambda': 8.801292012841582, 'eta': 0.896867896991921, 'sampling_method': 'uniform', 'subsample': 0.46165025857904995, 'gamma': 5.884414813292788}. Best is trial 268 with value: 2.092352351623428.
[I 2023-12-19 01:04:21,682] Trial 285 pruned. Trial was pruned at iteration 0.
[I 2023-12-19 01:04:25,115] Trial 286 finished with value: 2.1066221202757243 and parameters: {'learning_rate': 0.5961611521756444, 'aft_loss_distribution': 'logistic', 'aft_loss_distribution_scale': 1.6028733334825298, 'max_depth': 9, 'booster': 'dart', 'scale_pos_weight': 2.2450302268227933, 'alpha': 7.711400372309676, 'lambda': 9.2226038531137, 'eta': 0.959254748413248, 'sampling_method': 'uniform', 'subsample': 0.3912593672430779, 'gamma': 6.256235497852533}. Best is trial 268 with value: 2.092352351623428.
[I 2023-12-19 01:04:25,216] Trial 287 pruned. Trial was pruned at iteration 0.
[I 2023-12-19 01:04:25,313] Trial 288 pruned. Trial was pruned at iteration 0.
[I 2023-12-19 01:04:25,401] Trial 289 pruned. Trial was pruned at iteration 0.
[I 2023-12-19 01:04:29,108] Trial 290 finished with value: 2.112327155415753 and parameters: {'learning_rate': 0.5594874024458332, 'aft_loss_distribution': 'logistic', 'aft_loss_distribution_scale': 1.6583569490633827, 'max_depth': 9, 'booster': 'dart', 'scale_pos_weight': 2.162452974650758, 'alpha': 7.317251154418187, 'lambda': 9.402939282109367, 'eta': 0.9997381205812406, 'sampling_method': 'uniform', 'subsample': 0.322944151314165, 'gamma': 5.876666907118576}. Best is trial 268 with value: 2.092352351623428.
[I 2023-12-19 01:04:36,640] Trial 291 finished with value: 2.106898154031452 and parameters: {'learning_rate': 0.5525083661793353, 'aft_loss_distribution': 'logistic', 'aft_loss_distribution_scale': 1.6151748776979569, 'max_depth': 9, 'booster': 'dart', 'scale_pos_weight': 2.2783049593700477, 'alpha': 7.2494421268413705, 'lambda': 9.372765376495071, 'eta': 0.9842204208486486, 'sampling_method': 'uniform', 'subsample': 0.31785632579931355, 'gamma': 6.012653652905724}. Best is trial 268 with value: 2.092352351623428.
[I 2023-12-19 01:04:38,928] Trial 292 finished with value: inf and parameters: {'learning_rate': 0.5562843849503147, 'aft_loss_distribution': 'logistic', 'aft_loss_distribution_scale': 1.5597001173960514, 'max_depth': 9, 'booster': 'dart', 'scale_pos_weight': 2.2564298161561718, 'alpha': 6.822205614546071, 'lambda': 9.424534862448187, 'eta': 0.9835159027530187, 'sampling_method': 'uniform', 'subsample': 0.3098037170697321, 'gamma': 6.291689555112121}. Best is trial 268 with value: 2.092352351623428.
[I 2023-12-19 01:04:39,014] Trial 293 pruned. Trial was pruned at iteration 0.
[I 2023-12-19 01:04:43,095] Trial 294 finished with value: 2.1052256274025756 and parameters: {'learning_rate': 0.5497587761712658, 'aft_loss_distribution': 'logistic', 'aft_loss_distribution_scale': 1.6086760715341548, 'max_depth': 9, 'booster': 'dart', 'scale_pos_weight': 2.3793962136797386, 'alpha': 7.318846093343135, 'lambda': 9.674486702740685, 'eta': 0.9709164162451297, 'sampling_method': 'uniform', 'subsample': 0.3392089103089559, 'gamma': 5.937946786963122}. Best is trial 268 with value: 2.092352351623428.
[I 2023-12-19 01:04:43,198] Trial 295 pruned. Trial was pruned at iteration 0.
[I 2023-12-19 01:04:45,476] Trial 296 finished with value: inf and parameters: {'learning_rate': 0.548993845060656, 'aft_loss_distribution': 'logistic', 'aft_loss_distribution_scale': 1.4768012566490996, 'max_depth': 9, 'booster': 'dart', 'scale_pos_weight': 2.3891539880671493, 'alpha': 7.205518966052378, 'lambda': 9.967602942930395, 'eta': 0.9694808967260942, 'sampling_method': 'uniform', 'subsample': 0.30180877743156886, 'gamma': 5.92068692480596}. Best is trial 268 with value: 2.092352351623428.
[I 2023-12-19 01:04:50,794] Trial 297 finished with value: 2.104742068578006 and parameters: {'learning_rate': 0.555192447203556, 'aft_loss_distribution': 'logistic', 'aft_loss_distribution_scale': 1.6202811160249462, 'max_depth': 9, 'booster': 'dart', 'scale_pos_weight': 2.2225503815460117, 'alpha': 7.0783979086155036, 'lambda': 9.729748086494265, 'eta': 0.9164495853862354, 'sampling_method': 'uniform', 'subsample': 0.3377992442092339, 'gamma': 5.843081791317867}. Best is trial 268 with value: 2.092352351623428.
[I 2023-12-19 01:04:53,048] Trial 298 finished with value: inf and parameters: {'learning_rate': 0.5332602190015319, 'aft_loss_distribution': 'logistic', 'aft_loss_distribution_scale': 1.5725676394878139, 'max_depth': 9, 'booster': 'dart', 'scale_pos_weight': 2.2253616295599947, 'alpha': 6.6782819324293206, 'lambda': 9.710565974090839, 'eta': 0.9106976861376803, 'sampling_method': 'uniform', 'subsample': 0.33726329753217404, 'gamma': 5.924260234715381}. Best is trial 268 with value: 2.092352351623428.
[I 2023-12-19 01:04:55,127] Trial 299 finished with value: inf and parameters: {'learning_rate': 0.4979514495776521, 'aft_loss_distribution': 'logistic', 'aft_loss_distribution_scale': 1.3282409538571887, 'max_depth': 9, 'booster': 'dart', 'scale_pos_weight': 2.3385987256788026, 'alpha': 6.932113137424869, 'lambda': 9.706010726596121, 'eta': 0.9215616309878647, 'sampling_method': 'uniform', 'subsample': 0.3469438216504429, 'gamma': 5.7833881760978105}. Best is trial 268 with value: 2.092352351623428.
[I 2023-12-19 01:04:55,227] Trial 300 pruned. Trial was pruned at iteration 0.
[I 2023-12-19 01:04:59,158] Trial 301 finished with value: 2.105568106872566 and parameters: {'learning_rate': 0.5348523599718493, 'aft_loss_distribution': 'logistic', 'aft_loss_distribution_scale': 1.6207402917690699, 'max_depth': 9, 'booster': 'dart', 'scale_pos_weight': 2.252614560732297, 'alpha': 7.023637435843042, 'lambda': 9.248486757289479, 'eta': 0.9350311657025898, 'sampling_method': 'uniform', 'subsample': 0.35357058349863607, 'gamma': 5.983875091011294}. Best is trial 268 with value: 2.092352351623428.
[I 2023-12-19 01:05:01,632] Trial 302 finished with value: inf and parameters: {'learning_rate': 0.5119230441910569, 'aft_loss_distribution': 'logistic', 'aft_loss_distribution_scale': 1.6097050843439809, 'max_depth': 9, 'booster': 'dart', 'scale_pos_weight': 2.2882980146573613, 'alpha': 7.077794490402855, 'lambda': 9.26801831143364, 'eta': 0.9352919152464059, 'sampling_method': 'uniform', 'subsample': 0.3536129666567581, 'gamma': 6.068160607191259}. Best is trial 268 with value: 2.092352351623428.
[I 2023-12-19 01:05:04,201] Trial 303 finished with value: inf and parameters: {'learning_rate': 0.5295660260867121, 'aft_loss_distribution': 'logistic', 'aft_loss_distribution_scale': 1.3777385437724847, 'max_depth': 9, 'booster': 'dart', 'scale_pos_weight': 2.5383821516084564, 'alpha': 7.44236433700892, 'lambda': 9.24204212618426, 'eta': 0.8873518563544148, 'sampling_method': 'uniform', 'subsample': 0.30011789288975077, 'gamma': 5.763199946567991}. Best is trial 268 with value: 2.092352351623428.
[I 2023-12-19 01:05:04,339] Trial 304 pruned. Trial was pruned at iteration 0.
[I 2023-12-19 01:05:08,558] Trial 305 finished with value: 2.101772984896514 and parameters: {'learning_rate': 0.5534223805509475, 'aft_loss_distribution': 'logistic', 'aft_loss_distribution_scale': 1.5937212254317776, 'max_depth': 9, 'booster': 'dart', 'scale_pos_weight': 2.341918415333088, 'alpha': 7.547653424749999, 'lambda': 9.59420410397053, 'eta': 0.949155132110249, 'sampling_method': 'uniform', 'subsample': 0.3324803285144833, 'gamma': 6.265348536936914}. Best is trial 268 with value: 2.092352351623428.
[I 2023-12-19 01:05:08,673] Trial 306 pruned. Trial was pruned at iteration 0.
[I 2023-12-19 01:05:08,768] Trial 307 pruned. Trial was pruned at iteration 0.
[I 2023-12-19 01:05:08,856] Trial 308 pruned. Trial was pruned at iteration 0.
[I 2023-12-19 01:05:21,603] Trial 309 finished with value: 2.112025255686817 and parameters: {'learning_rate': 0.5022573173489333, 'aft_loss_distribution': 'logistic', 'aft_loss_distribution_scale': 1.644834738631813, 'max_depth': 9, 'booster': 'dart', 'scale_pos_weight': 2.2290266733264446, 'alpha': 6.891022359795857, 'lambda': 9.810911767603983, 'eta': 0.9370245612724899, 'sampling_method': 'uniform', 'subsample': 0.3458538853788849, 'gamma': 5.735020150511238}. Best is trial 268 with value: 2.092352351623428.
[I 2023-12-19 01:05:28,547] Trial 310 finished with value: 2.1024993393123146 and parameters: {'learning_rate': 0.4939611975724495, 'aft_loss_distribution': 'logistic', 'aft_loss_distribution_scale': 1.6083065991722405, 'max_depth': 9, 'booster': 'dart', 'scale_pos_weight': 2.3377760215604244, 'alpha': 6.8758371527048885, 'lambda': 9.725206454664228, 'eta': 0.8997586102672275, 'sampling_method': 'uniform', 'subsample': 0.3373227532402574, 'gamma': 5.846524149943448}. Best is trial 268 with value: 2.092352351623428.
[I 2023-12-19 01:05:31,081] Trial 311 finished with value: inf and parameters: {'learning_rate': 0.49011253901307683, 'aft_loss_distribution': 'logistic', 'aft_loss_distribution_scale': 1.5608283247571713, 'max_depth': 9, 'booster': 'dart', 'scale_pos_weight': 2.422067086857741, 'alpha': 6.849721658744445, 'lambda': 9.836759205587219, 'eta': 0.8960383750405784, 'sampling_method': 'uniform', 'subsample': 0.313787548104235, 'gamma': 5.907094558909925}. Best is trial 268 with value: 2.092352351623428.
[I 2023-12-19 01:05:31,231] Trial 312 pruned. Trial was pruned at iteration 0.
[I 2023-12-19 01:05:33,650] Trial 313 finished with value: inf and parameters: {'learning_rate': 0.6003994083844283, 'aft_loss_distribution': 'logistic', 'aft_loss_distribution_scale': 1.5823569275156013, 'max_depth': 9, 'booster': 'dart', 'scale_pos_weight': 2.257397263133411, 'alpha': 6.642352466254566, 'lambda': 9.368396077170944, 'eta': 0.9293806094596914, 'sampling_method': 'uniform', 'subsample': 0.2839030460898674, 'gamma': 6.013868544226526}. Best is trial 268 with value: 2.092352351623428.
[I 2023-12-19 01:05:33,791] Trial 314 pruned. Trial was pruned at iteration 0.
