[I 2023-12-19 00:32:40,262] Trial 455 finished with value: 2.037137450508349 and parameters: {'learning_rate': 0.9814357386751766, 'aft_loss_distribution': 'normal', 'aft_loss_distribution_scale': 1.868158691143019, 'max_depth': 4, 'booster': 'dart', 'scale_pos_weight': 2.688089586247811, 'alpha': 1.042643851652161, 'lambda': 6.445167206311593, 'eta': 0.5781408441015328, 'sampling_method': 'gradient_based', 'subsample': 0.8237027514896893, 'gamma': 6.94588333266974}. Best is trial 436 with value: 2.021888837240977.
[I 2023-12-19 00:32:41,975] Trial 456 finished with value: inf and parameters: {'learning_rate': 0.9988730174867286, 'aft_loss_distribution': 'normal', 'aft_loss_distribution_scale': 1.8406799639099238, 'max_depth': 4, 'booster': 'dart', 'scale_pos_weight': 2.7155105437301867, 'alpha': 1.0985890959981008, 'lambda': 6.652417157374692, 'eta': 0.5836382967417079, 'sampling_method': 'gradient_based', 'subsample': 0.8184929350682624, 'gamma': 6.718438755515305}. Best is trial 436 with value: 2.021888837240977.
[I 2023-12-19 00:32:43,614] Trial 457 finished with value: inf and parameters: {'learning_rate': 0.9812307527023054, 'aft_loss_distribution': 'normal', 'aft_loss_distribution_scale': 1.7442365800390263, 'max_depth': 4, 'booster': 'dart', 'scale_pos_weight': 2.6605644260250485, 'alpha': 1.2889333534360656, 'lambda': 6.385110315208787, 'eta': 0.5738946707200991, 'sampling_method': 'gradient_based', 'subsample': 0.776779862423129, 'gamma': 6.94772394453311}. Best is trial 436 with value: 2.021888837240977.
[I 2023-12-19 00:32:45,579] Trial 458 finished with value: inf and parameters: {'learning_rate': 0.9593760092063998, 'aft_loss_distribution': 'normal', 'aft_loss_distribution_scale': 1.5602214499044198, 'max_depth': 4, 'booster': 'dart', 'scale_pos_weight': 2.7892466740928543, 'alpha': 0.9710399028544742, 'lambda': 6.443578678846785, 'eta': 0.5445951872628079, 'sampling_method': 'gradient_based', 'subsample': 0.8813771948555543, 'gamma': 6.82401997343602}. Best is trial 436 with value: 2.021888837240977.
[I 2023-12-19 00:32:46,948] Trial 459 pruned. Trial was pruned at iteration 52.
[I 2023-12-19 00:32:49,267] Trial 460 finished with value: inf and parameters: {'learning_rate': 0.975290629448646, 'aft_loss_distribution': 'normal', 'aft_loss_distribution_scale': 1.846098551825589, 'max_depth': 4, 'booster': 'dart', 'scale_pos_weight': 2.7634627535039193, 'alpha': 1.0402012142592618, 'lambda': 6.763256487574665, 'eta': 0.5684541232053213, 'sampling_method': 'gradient_based', 'subsample': 0.7986835554433436, 'gamma': 7.485189645274138}. Best is trial 436 with value: 2.021888837240977.
[I 2023-12-19 00:32:49,372] Trial 461 pruned. Trial was pruned at iteration 1.
[I 2023-12-19 00:32:50,768] Trial 462 finished with value: inf and parameters: {'learning_rate': 0.9808842855548809, 'aft_loss_distribution': 'normal', 'aft_loss_distribution_scale': 1.5063739190467624, 'max_depth': 4, 'booster': 'dart', 'scale_pos_weight': 2.6946650657860314, 'alpha': 0.9003330099883706, 'lambda': 6.254432095952591, 'eta': 0.5991915486235455, 'sampling_method': 'gradient_based', 'subsample': 0.7539211596632822, 'gamma': 6.935611447481103}. Best is trial 436 with value: 2.021888837240977.
[I 2023-12-19 00:32:53,564] Trial 463 finished with value: inf and parameters: {'learning_rate': 0.9593903073564529, 'aft_loss_distribution': 'normal', 'aft_loss_distribution_scale': 1.7139261927366725, 'max_depth': 4, 'booster': 'dart', 'scale_pos_weight': 2.6361863555156715, 'alpha': 1.1370057829912603, 'lambda': 6.684033948831224, 'eta': 0.557063063535109, 'sampling_method': 'gradient_based', 'subsample': 0.8624371996732999, 'gamma': 6.612375093785186}. Best is trial 436 with value: 2.021888837240977.
[I 2023-12-19 00:32:53,740] Trial 464 pruned. Trial was pruned at iteration 1.
[I 2023-12-19 00:32:56,166] Trial 465 finished with value: inf and parameters: {'learning_rate': 0.9684400761224566, 'aft_loss_distribution': 'normal', 'aft_loss_distribution_scale': 1.8841045608476905, 'max_depth': 4, 'booster': 'dart', 'scale_pos_weight': 2.8274434638184127, 'alpha': 0.6620396522588039, 'lambda': 6.406806538415909, 'eta': 0.6232926367442956, 'sampling_method': 'gradient_based', 'subsample': 0.845947989082098, 'gamma': 7.172460722318408}. Best is trial 436 with value: 2.021888837240977.
[I 2023-12-19 00:32:58,005] Trial 466 finished with value: inf and parameters: {'learning_rate': 0.9511407956990712, 'aft_loss_distribution': 'normal', 'aft_loss_distribution_scale': 1.6469592633211585, 'max_depth': 4, 'booster': 'dart', 'scale_pos_weight': 2.592207306185412, 'alpha': 1.3870243954110144, 'lambda': 6.110133243632083, 'eta': 0.5232885350640508, 'sampling_method': 'gradient_based', 'subsample': 0.804050300266141, 'gamma': 7.380274220243902}. Best is trial 436 with value: 2.021888837240977.
[I 2023-12-19 00:32:58,117] Trial 467 pruned. Trial was pruned at iteration 1.
[I 2023-12-19 00:32:59,559] Trial 468 finished with value: inf and parameters: {'learning_rate': 0.9998614856281831, 'aft_loss_distribution': 'normal', 'aft_loss_distribution_scale': 1.36574257632457, 'max_depth': 4, 'booster': 'dart', 'scale_pos_weight': 2.6728022770971496, 'alpha': 0.4618569246735501, 'lambda': 6.570346399626838, 'eta': 0.5719623045828182, 'sampling_method': 'gradient_based', 'subsample': 0.7886248252797322, 'gamma': 7.111350010683249}. Best is trial 436 with value: 2.021888837240977.
[I 2023-12-19 00:32:59,697] Trial 469 pruned. Trial was pruned at iteration 6.
[I 2023-12-19 00:33:02,125] Trial 470 finished with value: inf and parameters: {'learning_rate': 0.9523957293250858, 'aft_loss_distribution': 'normal', 'aft_loss_distribution_scale': 1.7592017075863131, 'max_depth': 4, 'booster': 'dart', 'scale_pos_weight': 2.7865932876473636, 'alpha': 0.8664530206307374, 'lambda': 6.26946943139841, 'eta': 0.5390059935400013, 'sampling_method': 'gradient_based', 'subsample': 0.8101818115612905, 'gamma': 6.901436283783389}. Best is trial 436 with value: 2.021888837240977.
[I 2023-12-19 00:33:04,930] Trial 471 finished with value: 2.011360552718656 and parameters: {'learning_rate': 0.9788072325122262, 'aft_loss_distribution': 'normal', 'aft_loss_distribution_scale': 1.4866282139726859, 'max_depth': 4, 'booster': 'dart', 'scale_pos_weight': 2.5953692877936376, 'alpha': 1.0838402052810734, 'lambda': 6.706594271079635, 'eta': 0.5621400219463027, 'sampling_method': 'gradient_based', 'subsample': 0.8346844234191396, 'gamma': 6.672464019481194}. Best is trial 471 with value: 2.011360552718656.
[I 2023-12-19 00:33:06,821] Trial 472 finished with value: inf and parameters: {'learning_rate': 0.9816057145831594, 'aft_loss_distribution': 'normal', 'aft_loss_distribution_scale': 1.5675877900293724, 'max_depth': 4, 'booster': 'dart', 'scale_pos_weight': 2.6246862851594193, 'alpha': 1.108436953490506, 'lambda': 6.787608779723303, 'eta': 0.5646050129873196, 'sampling_method': 'gradient_based', 'subsample': 0.8441368028339779, 'gamma': 6.639031829463296}. Best is trial 471 with value: 2.011360552718656.
[I 2023-12-19 00:33:06,996] Trial 473 pruned. Trial was pruned at iteration 0.
[I 2023-12-19 00:33:09,300] Trial 474 finished with value: inf and parameters: {'learning_rate': 0.9684349647072178, 'aft_loss_distribution': 'normal', 'aft_loss_distribution_scale': 1.7368333081136649, 'max_depth': 4, 'booster': 'dart', 'scale_pos_weight': 2.5824183644779164, 'alpha': 0.6638125769678187, 'lambda': 6.423821459279001, 'eta': 0.5236383890001679, 'sampling_method': 'gradient_based', 'subsample': 0.8297451680672636, 'gamma': 6.773331635771047}. Best is trial 471 with value: 2.011360552718656.
[I 2023-12-19 00:33:11,595] Trial 475 finished with value: inf and parameters: {'learning_rate': 0.999919894385642, 'aft_loss_distribution': 'normal', 'aft_loss_distribution_scale': 1.4816177828776589, 'max_depth': 4, 'booster': 'dart', 'scale_pos_weight': 2.8880952736479375, 'alpha': 0.8842887912264235, 'lambda': 6.803730128849775, 'eta': 0.581172349995401, 'sampling_method': 'gradient_based', 'subsample': 0.7959740668394703, 'gamma': 7.075607448938214}. Best is trial 471 with value: 2.011360552718656.
[I 2023-12-19 00:33:13,023] Trial 476 pruned. Trial was pruned at iteration 53.
[I 2023-12-19 00:33:13,121] Trial 477 pruned. Trial was pruned at iteration 0.
[I 2023-12-19 00:33:15,942] Trial 478 finished with value: 2.0223634182939882 and parameters: {'learning_rate': 0.9680505539947125, 'aft_loss_distribution': 'normal', 'aft_loss_distribution_scale': 1.6554656182895546, 'max_depth': 4, 'booster': 'dart', 'scale_pos_weight': 2.833171420255512, 'alpha': 0.5197676812572141, 'lambda': 6.5494009443181005, 'eta': 0.5968756664225929, 'sampling_method': 'gradient_based', 'subsample': 0.7731383939576216, 'gamma': 7.006324808604465}. Best is trial 471 with value: 2.011360552718656.
[I 2023-12-19 00:33:16,046] Trial 479 pruned. Trial was pruned at iteration 0.
[I 2023-12-19 00:33:17,390] Trial 480 finished with value: inf and parameters: {'learning_rate': 0.9986343249756089, 'aft_loss_distribution': 'normal', 'aft_loss_distribution_scale': 1.6412144332117085, 'max_depth': 4, 'booster': 'dart', 'scale_pos_weight': 2.888630446392235, 'alpha': 0.5828096266458547, 'lambda': 6.395671822290668, 'eta': 0.6189578182925458, 'sampling_method': 'gradient_based', 'subsample': 0.7944020317879918, 'gamma': 7.175257949498649}. Best is trial 471 with value: 2.011360552718656.
[I 2023-12-19 00:33:20,193] Trial 481 finished with value: 2.030635101745425 and parameters: {'learning_rate': 0.9674855283641853, 'aft_loss_distribution': 'normal', 'aft_loss_distribution_scale': 1.7929594999291316, 'max_depth': 4, 'booster': 'dart', 'scale_pos_weight': 2.746226769404808, 'alpha': 0.7798244016803442, 'lambda': 6.940514248042047, 'eta': 0.5751218772428621, 'sampling_method': 'gradient_based', 'subsample': 0.8335925680505958, 'gamma': 6.677024411528001}. Best is trial 471 with value: 2.011360552718656.
[I 2023-12-19 00:33:22,273] Trial 482 finished with value: inf and parameters: {'learning_rate': 0.9645698376586467, 'aft_loss_distribution': 'normal', 'aft_loss_distribution_scale': 1.456454263614481, 'max_depth': 4, 'booster': 'dart', 'scale_pos_weight': 2.82356008640136, 'alpha': 0.7376374203542031, 'lambda': 7.010678680945762, 'eta': 0.5832252370126687, 'sampling_method': 'gradient_based', 'subsample': 0.8432444179975238, 'gamma': 6.568167461138383}. Best is trial 471 with value: 2.011360552718656.
[I 2023-12-19 00:33:24,821] Trial 483 finished with value: inf and parameters: {'learning_rate': 0.9825166305632782, 'aft_loss_distribution': 'normal', 'aft_loss_distribution_scale': 1.78452739175187, 'max_depth': 4, 'booster': 'dart', 'scale_pos_weight': 2.75062364210098, 'alpha': 0.4289744099449643, 'lambda': 6.853017458341477, 'eta': 0.5414457086518449, 'sampling_method': 'gradient_based', 'subsample': 0.8704632709570905, 'gamma': 6.719863109598147}. Best is trial 471 with value: 2.011360552718656.
[I 2023-12-19 00:33:27,822] Trial 484 finished with value: 2.0221133959128252 and parameters: {'learning_rate': 0.9632473297206829, 'aft_loss_distribution': 'normal', 'aft_loss_distribution_scale': 1.6057908255591413, 'max_depth': 4, 'booster': 'dart', 'scale_pos_weight': 2.703163073901711, 'alpha': 0.8915302273593292, 'lambda': 6.637023494948006, 'eta': 0.5746187101814333, 'sampling_method': 'gradient_based', 'subsample': 0.8108284339040027, 'gamma': 6.939434700284608}. Best is trial 471 with value: 2.011360552718656.
[I 2023-12-19 00:33:29,246] Trial 485 finished with value: inf and parameters: {'learning_rate': 0.9634042393532734, 'aft_loss_distribution': 'normal', 'aft_loss_distribution_scale': 1.595173932745593, 'max_depth': 4, 'booster': 'dart', 'scale_pos_weight': 2.7238470902969403, 'alpha': 0.8717073327455898, 'lambda': 6.588012057161405, 'eta': 0.571593230770429, 'sampling_method': 'gradient_based', 'subsample': 0.8268096676457762, 'gamma': 6.921245239420258}. Best is trial 471 with value: 2.011360552718656.
[I 2023-12-19 00:33:31,056] Trial 486 finished with value: inf and parameters: {'learning_rate': 0.9824264143086422, 'aft_loss_distribution': 'normal', 'aft_loss_distribution_scale': 1.3787463021052369, 'max_depth': 4, 'booster': 'dart', 'scale_pos_weight': 2.860346170605804, 'alpha': 0.640549904886722, 'lambda': 6.933946731028302, 'eta': 0.607276959519162, 'sampling_method': 'gradient_based', 'subsample': 0.8085049195890509, 'gamma': 7.552095283812027}. Best is trial 471 with value: 2.011360552718656.
[I 2023-12-19 00:33:33,462] Trial 487 finished with value: inf and parameters: {'learning_rate': 0.9594300889837262, 'aft_loss_distribution': 'normal', 'aft_loss_distribution_scale': 1.713698789520196, 'max_depth': 4, 'booster': 'dart', 'scale_pos_weight': 2.911652386469007, 'alpha': 0.26505531970971097, 'lambda': 6.649204952440227, 'eta': 0.5613814786053439, 'sampling_method': 'gradient_based', 'subsample': 0.7838031148255928, 'gamma': 6.428724465581631}. Best is trial 471 with value: 2.011360552718656.
[I 2023-12-19 00:33:33,570] Trial 488 pruned. Trial was pruned at iteration 0.
[I 2023-12-19 00:33:33,670] Trial 489 pruned. Trial was pruned at iteration 0.
[I 2023-12-19 00:33:35,433] Trial 490 finished with value: inf and parameters: {'learning_rate': 0.967815193234314, 'aft_loss_distribution': 'normal', 'aft_loss_distribution_scale': 1.6117944310230345, 'max_depth': 4, 'booster': 'dart', 'scale_pos_weight': 2.7359982019311726, 'alpha': 1.1642060653617907, 'lambda': 6.76714939019133, 'eta': 0.5980891592472758, 'sampling_method': 'gradient_based', 'subsample': 0.7582464248504714, 'gamma': 7.306866065062476}. Best is trial 471 with value: 2.011360552718656.
[I 2023-12-19 00:33:36,168] Trial 491 pruned. Trial was pruned at iteration 30.
[I 2023-12-19 00:33:39,776] Trial 492 finished with value: 2.0178090162919546 and parameters: {'learning_rate': 0.9784441742683286, 'aft_loss_distribution': 'normal', 'aft_loss_distribution_scale': 1.5058464762036314, 'max_depth': 4, 'booster': 'dart', 'scale_pos_weight': 2.8227225758547125, 'alpha': 0.9544874755239295, 'lambda': 6.086392681575802, 'eta': 0.5129701539891014, 'sampling_method': 'gradient_based', 'subsample': 0.7856586147823381, 'gamma': 6.998400979055526}. Best is trial 471 with value: 2.011360552718656.
[I 2023-12-19 00:33:42,666] Trial 493 finished with value: 2.012338353688736 and parameters: {'learning_rate': 0.975549089405442, 'aft_loss_distribution': 'normal', 'aft_loss_distribution_scale': 1.4589562576288837, 'max_depth': 4, 'booster': 'dart', 'scale_pos_weight': 2.831293355129051, 'alpha': 0.9303603750817924, 'lambda': 6.158579024357939, 'eta': 0.5139457258951126, 'sampling_method': 'gradient_based', 'subsample': 0.7824775450704035, 'gamma': 7.010435415791491}. Best is trial 471 with value: 2.011360552718656.
[I 2023-12-19 00:33:42,774] Trial 494 pruned. Trial was pruned at iteration 0.
[I 2023-12-19 00:33:44,945] Trial 495 finished with value: inf and parameters: {'learning_rate': 0.9999193485504575, 'aft_loss_distribution': 'normal', 'aft_loss_distribution_scale': 1.445673055177329, 'max_depth': 4, 'booster': 'dart', 'scale_pos_weight': 2.841189632756598, 'alpha': 0.4752974298164895, 'lambda': 6.308125010558751, 'eta': 0.5130861648664696, 'sampling_method': 'gradient_based', 'subsample': 0.8102596340600086, 'gamma': 7.2991002197777455}. Best is trial 471 with value: 2.011360552718656.
[I 2023-12-19 00:33:45,044] Trial 496 pruned. Trial was pruned at iteration 0.
[I 2023-12-19 00:33:45,145] Trial 497 pruned. Trial was pruned at iteration 0.
[I 2023-12-19 00:33:45,241] Trial 498 pruned. Trial was pruned at iteration 0.
