[I 2023-12-21 03:07:43,429] Trial 479 finished with value: 4.278836944669371 and parameters: {'learning_rate': 0.7358784480887206, 'aft_l                                                                     oss_distribution': 'normal', 'aft_loss_distribution_scale': 1.2920731340229992, 'max_depth': 6, 'booster': 'dart', 'scale_pos_weight': 4.                                                                     606068830777793, 'alpha': 8.630077242313208, 'lambda': 3.859101176342388, 'eta': 0.37885322521022446, 'sampling_method': 'uniform', 'subs                                                                     ample': 0.8728592173281537, 'gamma': 6.901062654391691}. Best is trial 368 with value: 4.273464722532114.
[I 2023-12-21 03:07:43,482] Trial 480 pruned. Trial was pruned at iteration 0.
[I 2023-12-21 03:07:43,539] Trial 481 pruned. Trial was pruned at iteration 0.
[I 2023-12-21 03:07:43,589] Trial 482 pruned. Trial was pruned at iteration 0.
[I 2023-12-21 03:07:45,589] Trial 483 finished with value: 4.260119487872429 and parameters: {'learning_rate': 0.7207046139552667, 'aft_l                                                                     oss_distribution': 'normal', 'aft_loss_distribution_scale': 1.1858291913329047, 'max_depth': 6, 'booster': 'dart', 'scale_pos_weight': 4.                                                                     307607239141251, 'alpha': 9.122520691332664, 'lambda': 3.9742288032850266, 'eta': 0.3395513752742207, 'sampling_method': 'uniform', 'subs                                                                     ample': 0.9435415138082472, 'gamma': 6.906810874961063}. Best is trial 483 with value: 4.260119487872429.
[I 2023-12-21 03:07:45,639] Trial 484 pruned. Trial was pruned at iteration 0.
[I 2023-12-21 03:07:45,688] Trial 485 pruned. Trial was pruned at iteration 0.
[I 2023-12-21 03:07:48,030] Trial 486 finished with value: 4.269683818828006 and parameters: {'learning_rate': 0.7308109343350383, 'aft_l                                                                     oss_distribution': 'normal', 'aft_loss_distribution_scale': 1.2324865745168545, 'max_depth': 6, 'booster': 'dart', 'scale_pos_weight': 4.                                                                     44006006602958, 'alpha': 9.48997126276744, 'lambda': 3.8384128439842082, 'eta': 0.3391801671826372, 'sampling_method': 'uniform', 'subsam                                                                     ple': 0.9442051857845312, 'gamma': 6.904887097969607}. Best is trial 483 with value: 4.260119487872429.
[I 2023-12-21 03:07:48,082] Trial 487 pruned. Trial was pruned at iteration 0.
[I 2023-12-21 03:07:59,025] Trial 488 finished with value: 4.253370734385255 and parameters: {'learning_rate': 0.728808664552955, 'aft_lo                                                                     ss_distribution': 'normal', 'aft_loss_distribution_scale': 1.1735433115302625, 'max_depth': 5, 'booster': 'dart', 'scale_pos_weight': 3.8                                                                     645471253300876, 'alpha': 8.99666973819267, 'lambda': 4.310480010932882, 'eta': 0.36769030610503023, 'sampling_method': 'uniform', 'subsa                                                                     mple': 0.9565112351435208, 'gamma': 6.831818640729212}. Best is trial 488 with value: 4.253370734385255.
[I 2023-12-21 03:07:59,084] Trial 489 pruned. Trial was pruned at iteration 0.
[I 2023-12-21 03:07:59,133] Trial 490 pruned. Trial was pruned at iteration 0.
[I 2023-12-21 03:07:59,184] Trial 491 pruned. Trial was pruned at iteration 0.
[I 2023-12-21 03:07:59,236] Trial 492 pruned. Trial was pruned at iteration 0.
[I 2023-12-21 03:07:59,286] Trial 493 pruned. Trial was pruned at iteration 0.
[I 2023-12-21 03:07:59,335] Trial 494 pruned. Trial was pruned at iteration 0.
[I 2023-12-21 03:08:10,233] Trial 495 finished with value: 4.285850063324534 and parameters: {'learning_rate': 0.7057647005944168, 'aft_l                                                                     oss_distribution': 'normal', 'aft_loss_distribution_scale': 1.3195271615778859, 'max_depth': 5, 'booster': 'dart', 'scale_pos_weight': 4.                                                                     278505350364481, 'alpha': 9.16377734782146, 'lambda': 4.342400826289489, 'eta': 0.36147051814712994, 'sampling_method': 'uniform', 'subsa                                                                     mple': 0.9633488940334076, 'gamma': 6.794426530089254}. Best is trial 488 with value: 4.253370734385255.
[I 2023-12-21 03:08:10,288] Trial 496 pruned. Trial was pruned at iteration 0.
[I 2023-12-21 03:08:10,338] Trial 497 pruned. Trial was pruned at iteration 0.
[I 2023-12-21 03:08:10,389] Trial 498 pruned. Trial was pruned at iteration 0.
[I 2023-12-21 03:08:10,440] Trial 499 pruned. Trial was pruned at iteration 0.
[W 2023-12-21 03:08:21,306] Trial 13 is omitted in visualization because its objective value is inf or nan.
[W 2023-12-21 03:08:21,307] Trial 16 is omitted in visualization because its objective value is inf or nan.
[W 2023-12-21 03:08:21,307] Trial 18 is omitted in visualization because its objective value is inf or nan.
[W 2023-12-21 03:08:21,307] Trial 24 is omitted in visualization because its objective value is inf or nan.
[W 2023-12-21 03:08:21,307] Trial 29 is omitted in visualization because its objective value is inf or nan.
[W 2023-12-21 03:08:21,307] Trial 37 is omitted in visualization because its objective value is inf or nan.
[W 2023-12-21 03:08:21,307] Trial 41 is omitted in visualization because its objective value is inf or nan.
[W 2023-12-21 03:08:21,307] Trial 42 is omitted in visualization because its objective value is inf or nan.
[W 2023-12-21 03:08:21,307] Trial 57 is omitted in visualization because its objective value is inf or nan.
[W 2023-12-21 03:08:21,307] Trial 60 is omitted in visualization because its objective value is inf or nan.
[W 2023-12-21 03:08:21,307] Trial 62 is omitted in visualization because its objective value is inf or nan.
[W 2023-12-21 03:08:21,307] Trial 69 is omitted in visualization because its objective value is inf or nan.
[W 2023-12-21 03:08:21,307] Trial 71 is omitted in visualization because its objective value is inf or nan.
[W 2023-12-21 03:08:21,307] Trial 82 is omitted in visualization because its objective value is inf or nan.
[W 2023-12-21 03:08:21,307] Trial 91 is omitted in visualization because its objective value is inf or nan.
[W 2023-12-21 03:08:21,307] Trial 92 is omitted in visualization because its objective value is inf or nan.
[W 2023-12-21 03:08:21,307] Trial 95 is omitted in visualization because its objective value is inf or nan.
[W 2023-12-21 03:08:21,307] Trial 98 is omitted in visualization because its objective value is inf or nan.
[W 2023-12-21 03:08:21,308] Trial 99 is omitted in visualization because its objective value is inf or nan.
[W 2023-12-21 03:08:21,308] Trial 124 is omitted in visualization because its objective value is inf or nan.
[W 2023-12-21 03:08:21,308] Trial 132 is omitted in visualization because its objective value is inf or nan.
[W 2023-12-21 03:08:21,308] Trial 148 is omitted in visualization because its objective value is inf or nan.
[W 2023-12-21 03:08:21,308] Trial 152 is omitted in visualization because its objective value is inf or nan.
[W 2023-12-21 03:08:21,308] Trial 160 is omitted in visualization because its objective value is inf or nan.
[W 2023-12-21 03:08:21,308] Trial 167 is omitted in visualization because its objective value is inf or nan.
[W 2023-12-21 03:08:21,308] Trial 168 is omitted in visualization because its objective value is inf or nan.
[W 2023-12-21 03:08:21,308] Trial 170 is omitted in visualization because its objective value is inf or nan.
[W 2023-12-21 03:08:21,308] Trial 171 is omitted in visualization because its objective value is inf or nan.
[W 2023-12-21 03:08:21,308] Trial 172 is omitted in visualization because its objective value is inf or nan.
[W 2023-12-21 03:08:21,308] Trial 173 is omitted in visualization because its objective value is inf or nan.
[W 2023-12-21 03:08:21,308] Trial 177 is omitted in visualization because its objective value is inf or nan.
[W 2023-12-21 03:08:21,308] Trial 178 is omitted in visualization because its objective value is inf or nan.
[W 2023-12-21 03:08:21,308] Trial 180 is omitted in visualization because its objective value is inf or nan.
[W 2023-12-21 03:08:21,308] Trial 189 is omitted in visualization because its objective value is inf or nan.
[W 2023-12-21 03:08:21,308] Trial 190 is omitted in visualization because its objective value is inf or nan.
[W 2023-12-21 03:08:21,308] Trial 199 is omitted in visualization because its objective value is inf or nan.
[W 2023-12-21 03:08:21,308] Trial 202 is omitted in visualization because its objective value is inf or nan.
[W 2023-12-21 03:08:21,308] Trial 204 is omitted in visualization because its objective value is inf or nan.
[W 2023-12-21 03:08:21,309] Trial 205 is omitted in visualization because its objective value is inf or nan.
[W 2023-12-21 03:08:21,309] Trial 207 is omitted in visualization because its objective value is inf or nan.
[W 2023-12-21 03:08:21,309] Trial 214 is omitted in visualization because its objective value is inf or nan.
[W 2023-12-21 03:08:21,309] Trial 216 is omitted in visualization because its objective value is inf or nan.
[W 2023-12-21 03:08:21,309] Trial 218 is omitted in visualization because its objective value is inf or nan.
[W 2023-12-21 03:08:21,309] Trial 219 is omitted in visualization because its objective value is inf or nan.
[W 2023-12-21 03:08:21,309] Trial 220 is omitted in visualization because its objective value is inf or nan.
[W 2023-12-21 03:08:21,309] Trial 224 is omitted in visualization because its objective value is inf or nan.
[W 2023-12-21 03:08:21,309] Trial 225 is omitted in visualization because its objective value is inf or nan.
[W 2023-12-21 03:08:21,309] Trial 226 is omitted in visualization because its objective value is inf or nan.
[W 2023-12-21 03:08:21,309] Trial 229 is omitted in visualization because its objective value is inf or nan.
[W 2023-12-21 03:08:21,309] Trial 231 is omitted in visualization because its objective value is inf or nan.
[W 2023-12-21 03:08:21,309] Trial 233 is omitted in visualization because its objective value is inf or nan.
[W 2023-12-21 03:08:21,309] Trial 236 is omitted in visualization because its objective value is inf or nan.
[W 2023-12-21 03:08:21,309] Trial 237 is omitted in visualization because its objective value is inf or nan.
[W 2023-12-21 03:08:21,309] Trial 238 is omitted in visualization because its objective value is inf or nan.
[W 2023-12-21 03:08:21,309] Trial 248 is omitted in visualization because its objective value is inf or nan.
[W 2023-12-21 03:08:21,309] Trial 251 is omitted in visualization because its objective value is inf or nan.
[W 2023-12-21 03:08:21,309] Trial 252 is omitted in visualization because its objective value is inf or nan.
[W 2023-12-21 03:08:21,309] Trial 256 is omitted in visualization because its objective value is inf or nan.
[W 2023-12-21 03:08:21,309] Trial 257 is omitted in visualization because its objective value is inf or nan.
[W 2023-12-21 03:08:21,309] Trial 263 is omitted in visualization because its objective value is inf or nan.
[W 2023-12-21 03:08:21,310] Trial 265 is omitted in visualization because its objective value is inf or nan.
[W 2023-12-21 03:08:21,310] Trial 267 is omitted in visualization because its objective value is inf or nan.
[W 2023-12-21 03:08:21,310] Trial 268 is omitted in visualization because its objective value is inf or nan.
[W 2023-12-21 03:08:21,310] Trial 273 is omitted in visualization because its objective value is inf or nan.
[W 2023-12-21 03:08:21,310] Trial 276 is omitted in visualization because its objective value is inf or nan.
[W 2023-12-21 03:08:21,310] Trial 277 is omitted in visualization because its objective value is inf or nan.
[W 2023-12-21 03:08:21,310] Trial 281 is omitted in visualization because its objective value is inf or nan.
[W 2023-12-21 03:08:21,310] Trial 284 is omitted in visualization because its objective value is inf or nan.
[W 2023-12-21 03:08:21,310] Trial 285 is omitted in visualization because its objective value is inf or nan.
[W 2023-12-21 03:08:21,310] Trial 286 is omitted in visualization because its objective value is inf or nan.
[W 2023-12-21 03:08:21,310] Trial 289 is omitted in visualization because its objective value is inf or nan.
[W 2023-12-21 03:08:21,310] Trial 290 is omitted in visualization because its objective value is inf or nan.
[W 2023-12-21 03:08:21,310] Trial 291 is omitted in visualization because its objective value is inf or nan.
[W 2023-12-21 03:08:21,310] Trial 293 is omitted in visualization because its objective value is inf or nan.
[W 2023-12-21 03:08:21,310] Trial 297 is omitted in visualization because its objective value is inf or nan.
[W 2023-12-21 03:08:21,310] Trial 298 is omitted in visualization because its objective value is inf or nan.
[W 2023-12-21 03:08:21,310] Trial 301 is omitted in visualization because its objective value is inf or nan.
[W 2023-12-21 03:08:21,310] Trial 305 is omitted in visualization because its objective value is inf or nan.
[W 2023-12-21 03:08:21,310] Trial 306 is omitted in visualization because its objective value is inf or nan.
[W 2023-12-21 03:08:21,310] Trial 307 is omitted in visualization because its objective value is inf or nan.
[W 2023-12-21 03:08:21,310] Trial 309 is omitted in visualization because its objective value is inf or nan.
[W 2023-12-21 03:08:21,310] Trial 311 is omitted in visualization because its objective value is inf or nan.
[W 2023-12-21 03:08:21,311] Trial 314 is omitted in visualization because its objective value is inf or nan.
[W 2023-12-21 03:08:21,311] Trial 319 is omitted in visualization because its objective value is inf or nan.
[W 2023-12-21 03:08:21,311] Trial 320 is omitted in visualization because its objective value is inf or nan.
[W 2023-12-21 03:08:21,311] Trial 321 is omitted in visualization because its objective value is inf or nan.
[W 2023-12-21 03:08:21,311] Trial 323 is omitted in visualization because its objective value is inf or nan.
[W 2023-12-21 03:08:21,311] Trial 324 is omitted in visualization because its objective value is inf or nan.
[W 2023-12-21 03:08:21,311] Trial 327 is omitted in visualization because its objective value is inf or nan.
[W 2023-12-21 03:08:21,311] Trial 328 is omitted in visualization because its objective value is inf or nan.
[W 2023-12-21 03:08:21,311] Trial 329 is omitted in visualization because its objective value is inf or nan.
[W 2023-12-21 03:08:21,311] Trial 333 is omitted in visualization because its objective value is inf or nan.
[W 2023-12-21 03:08:21,311] Trial 336 is omitted in visualization because its objective value is inf or nan.
[W 2023-12-21 03:08:21,311] Trial 337 is omitted in visualization because its objective value is inf or nan.
[W 2023-12-21 03:08:21,311] Trial 338 is omitted in visualization because its objective value is inf or nan.
[W 2023-12-21 03:08:21,311] Trial 340 is omitted in visualization because its objective value is inf or nan.
[W 2023-12-21 03:08:21,311] Trial 344 is omitted in visualization because its objective value is inf or nan.
[W 2023-12-21 03:08:21,311] Trial 346 is omitted in visualization because its objective value is inf or nan.
[W 2023-12-21 03:08:21,311] Trial 349 is omitted in visualization because its objective value is inf or nan.
[W 2023-12-21 03:08:21,311] Trial 352 is omitted in visualization because its objective value is inf or nan.
[W 2023-12-21 03:08:21,311] Trial 356 is omitted in visualization because its objective value is inf or nan.
[W 2023-12-21 03:08:21,311] Trial 357 is omitted in visualization because its objective value is inf or nan.
[W 2023-12-21 03:08:21,311] Trial 358 is omitted in visualization because its objective value is inf or nan.
[W 2023-12-21 03:08:21,311] Trial 359 is omitted in visualization because its objective value is inf or nan.
[W 2023-12-21 03:08:21,312] Trial 362 is omitted in visualization because its objective value is inf or nan.
[W 2023-12-21 03:08:21,312] Trial 364 is omitted in visualization because its objective value is inf or nan.
[W 2023-12-21 03:08:21,312] Trial 371 is omitted in visualization because its objective value is inf or nan.
[W 2023-12-21 03:08:21,312] Trial 376 is omitted in visualization because its objective value is inf or nan.
[W 2023-12-21 03:08:21,312] Trial 377 is omitted in visualization because its objective value is inf or nan.
[W 2023-12-21 03:08:21,312] Trial 379 is omitted in visualization because its objective value is inf or nan.
[W 2023-12-21 03:08:21,312] Trial 384 is omitted in visualization because its objective value is inf or nan.
[W 2023-12-21 03:08:21,312] Trial 388 is omitted in visualization because its objective value is inf or nan.
[W 2023-12-21 03:08:21,312] Trial 390 is omitted in visualization because its objective value is inf or nan.
[W 2023-12-21 03:08:21,312] Trial 392 is omitted in visualization because its objective value is inf or nan.
[W 2023-12-21 03:08:21,312] Trial 395 is omitted in visualization because its objective value is inf or nan.
[W 2023-12-21 03:08:21,312] Trial 397 is omitted in visualization because its objective value is inf or nan.
[W 2023-12-21 03:08:21,312] Trial 398 is omitted in visualization because its objective value is inf or nan.
[W 2023-12-21 03:08:21,312] Trial 404 is omitted in visualization because its objective value is inf or nan.
[W 2023-12-21 03:08:21,312] Trial 408 is omitted in visualization because its objective value is inf or nan.
[W 2023-12-21 03:08:21,312] Trial 417 is omitted in visualization because its objective value is inf or nan.
[W 2023-12-21 03:08:21,312] Trial 418 is omitted in visualization because its objective value is inf or nan.
[W 2023-12-21 03:08:21,312] Trial 422 is omitted in visualization because its objective value is inf or nan.
[W 2023-12-21 03:08:21,312] Trial 425 is omitted in visualization because its objective value is inf or nan.
[W 2023-12-21 03:08:21,312] Trial 431 is omitted in visualization because its objective value is inf or nan.
[W 2023-12-21 03:08:21,312] Trial 432 is omitted in visualization because its objective value is inf or nan.
[W 2023-12-21 03:08:21,312] Trial 436 is omitted in visualization because its objective value is inf or nan.
[W 2023-12-21 03:08:21,313] Trial 440 is omitted in visualization because its objective value is inf or nan.
[W 2023-12-21 03:08:21,313] Trial 441 is omitted in visualization because its objective value is inf or nan.
[W 2023-12-21 03:08:21,313] Trial 444 is omitted in visualization because its objective value is inf or nan.
[W 2023-12-21 03:08:21,313] Trial 446 is omitted in visualization because its objective value is inf or nan.
[W 2023-12-21 03:08:21,313] Trial 448 is omitted in visualization because its objective value is inf or nan.
[W 2023-12-21 03:08:21,313] Trial 450 is omitted in visualization because its objective value is inf or nan.
[W 2023-12-21 03:08:21,313] Trial 455 is omitted in visualization because its objective value is inf or nan.
[W 2023-12-21 03:08:21,313] Trial 461 is omitted in visualization because its objective value is inf or nan.
[W 2023-12-21 03:08:21,313] Trial 466 is omitted in visualization because its objective value is inf or nan.
[W 2023-12-21 03:08:21,313] Trial 469 is omitted in visualization because its objective value is inf or nan.
[W 2023-12-21 03:08:21,313] Trial 476 is omitted in visualization because its objective value is inf or nan.
exo-open: Cannot open display: .
/cvmfs/soft.computecanada.ca/gentoo/2020/usr/bin/xdg-open: line 871: x-www-browser: command not found
/cvmfs/soft.computecanada.ca/gentoo/2020/usr/bin/xdg-open: line 871: firefox: command not found
/cvmfs/soft.computecanada.ca/gentoo/2020/usr/bin/xdg-open: line 871: iceweasel: command not found
/cvmfs/soft.computecanada.ca/gentoo/2020/usr/bin/xdg-open: line 871: seamonkey: command not found
/cvmfs/soft.computecanada.ca/gentoo/2020/usr/bin/xdg-open: line 871: mozilla: command not found
/cvmfs/soft.computecanada.ca/gentoo/2020/usr/bin/xdg-open: line 871: epiphany: command not found
/cvmfs/soft.computecanada.ca/gentoo/2020/usr/bin/xdg-open: line 871: konqueror: command not found
/cvmfs/soft.computecanada.ca/gentoo/2020/usr/bin/xdg-open: line 871: chromium: command not found
/cvmfs/soft.computecanada.ca/gentoo/2020/usr/bin/xdg-open: line 871: chromium-browser: command not found
/cvmfs/soft.computecanada.ca/gentoo/2020/usr/bin/xdg-open: line 871: google-chrome: command not found
/cvmfs/soft.computecanada.ca/gentoo/2020/usr/bin/xdg-open: line 871: www-browser: command not found
/cvmfs/soft.computecanada.ca/gentoo/2020/usr/bin/xdg-open: line 871: links2: command not found
/home/lisat/.local/lib/python3.10/site-packages/xgboost/data.py:440: FutureWarning:

is_sparse is deprecated and will be removed in a future version. Check `isinstance(dtype, pd.SparseDtype)` instead.

[I 2023-12-21 03:08:27,598] A new study created in memory with name: no-name-0b09fef9-9f93-41cb-88c6-deb5fca09d3d
