[I 2023-12-18 23:50:51,464] Trial 419 finished with value: inf and parameters: {'learning_rate': 0.9845588344124724, 'aft_loss_distribution': 'normal', 'aft_loss_distribution_scale': 1.0759194133617416, 'max_depth': 3, 'booster': 'dart', 'scale_pos_weight': 8.609178423202684, 'alpha': 9.135428210117569, 'lambda': 3.8557814862284525, 'eta': 0.4298220578417192, 'sampling_method': 'uniform', 'subsample': 0.7848075935328307, 'gamma': 9.039729347163249}. Best is trial 370 with value: 4.250995514781027.
[I 2023-12-18 23:50:51,602] Trial 420 pruned. Trial was pruned at iteration 0.
[I 2023-12-18 23:50:51,739] Trial 421 pruned. Trial was pruned at iteration 0.
[I 2023-12-18 23:50:51,878] Trial 422 pruned. Trial was pruned at iteration 0.
[I 2023-12-18 23:50:55,948] Trial 423 finished with value: 4.2557047759127276 and parameters: {'learning_rate': 0.9663654103633893, 'aft_loss_distribution': 'normal', 'aft_loss_distribution_scale': 1.0431183670568256, 'max_depth': 3, 'booster': 'dart', 'scale_pos_weight': 8.969133998640618, 'alpha': 8.532955523417863, 'lambda': 3.9460929179085826, 'eta': 0.18632668712655867, 'sampling_method': 'uniform', 'subsample': 0.7301081520480118, 'gamma': 8.853652731514847}. Best is trial 370 with value: 4.250995514781027.
[I 2023-12-18 23:50:56,046] Trial 424 pruned. Trial was pruned at iteration 0.
[I 2023-12-18 23:50:56,127] Trial 425 pruned. Trial was pruned at iteration 0.
[I 2023-12-18 23:50:56,212] Trial 426 pruned. Trial was pruned at iteration 0.
[I 2023-12-18 23:50:56,297] Trial 427 pruned. Trial was pruned at iteration 0.
[I 2023-12-18 23:50:56,395] Trial 428 pruned. Trial was pruned at iteration 1.
[I 2023-12-18 23:50:56,479] Trial 429 pruned. Trial was pruned at iteration 0.
[I 2023-12-18 23:50:56,564] Trial 430 pruned. Trial was pruned at iteration 0.
[I 2023-12-18 23:50:56,644] Trial 431 pruned. Trial was pruned at iteration 0.
[I 2023-12-18 23:50:56,722] Trial 432 pruned. Trial was pruned at iteration 0.
[I 2023-12-18 23:50:56,815] Trial 433 pruned. Trial was pruned at iteration 0.
[I 2023-12-18 23:50:56,917] Trial 434 pruned. Trial was pruned at iteration 1.
[I 2023-12-18 23:50:57,012] Trial 435 pruned. Trial was pruned at iteration 0.
[I 2023-12-18 23:50:57,097] Trial 436 pruned. Trial was pruned at iteration 0.
[I 2023-12-18 23:50:57,183] Trial 437 pruned. Trial was pruned at iteration 0.
[I 2023-12-18 23:50:57,270] Trial 438 pruned. Trial was pruned at iteration 0.
[I 2023-12-18 23:50:57,353] Trial 439 pruned. Trial was pruned at iteration 0.
[I 2023-12-18 23:50:57,438] Trial 440 pruned. Trial was pruned at iteration 0.
[I 2023-12-18 23:50:57,524] Trial 441 pruned. Trial was pruned at iteration 0.
[I 2023-12-18 23:50:57,610] Trial 442 pruned. Trial was pruned at iteration 0.
[I 2023-12-18 23:50:57,692] Trial 443 pruned. Trial was pruned at iteration 0.
[I 2023-12-18 23:50:57,776] Trial 444 pruned. Trial was pruned at iteration 0.
[I 2023-12-18 23:50:57,869] Trial 445 pruned. Trial was pruned at iteration 0.
[I 2023-12-18 23:50:57,964] Trial 446 pruned. Trial was pruned at iteration 0.
[I 2023-12-18 23:50:58,068] Trial 447 pruned. Trial was pruned at iteration 0.
[I 2023-12-18 23:50:58,159] Trial 448 pruned. Trial was pruned at iteration 0.
[I 2023-12-18 23:50:58,254] Trial 449 pruned. Trial was pruned at iteration 0.
[I 2023-12-18 23:50:58,340] Trial 450 pruned. Trial was pruned at iteration 0.
[I 2023-12-18 23:50:58,425] Trial 451 pruned. Trial was pruned at iteration 0.
[I 2023-12-18 23:50:58,513] Trial 452 pruned. Trial was pruned at iteration 0.
[I 2023-12-18 23:50:58,600] Trial 453 pruned. Trial was pruned at iteration 0.
[I 2023-12-18 23:51:00,242] Trial 454 finished with value: inf and parameters: {'learning_rate': 0.9523477373198995, 'aft_loss_distribution': 'normal', 'aft_loss_distribution_scale': 1.0390801423210503, 'max_depth': 3, 'booster': 'dart', 'scale_pos_weight': 8.591330643142221, 'alpha': 9.776216323776287, 'lambda': 4.21541740504956, 'eta': 0.08621845594595678, 'sampling_method': 'uniform', 'subsample': 0.5195085234300073, 'gamma': 8.924448567522411}. Best is trial 370 with value: 4.250995514781027.
[I 2023-12-18 23:51:00,334] Trial 455 pruned. Trial was pruned at iteration 0.
[I 2023-12-18 23:51:00,418] Trial 456 pruned. Trial was pruned at iteration 0.
[I 2023-12-18 23:51:00,514] Trial 457 pruned. Trial was pruned at iteration 0.
[I 2023-12-18 23:51:00,601] Trial 458 pruned. Trial was pruned at iteration 0.
[I 2023-12-18 23:51:00,686] Trial 459 pruned. Trial was pruned at iteration 0.
[I 2023-12-18 23:51:00,774] Trial 460 pruned. Trial was pruned at iteration 0.
[I 2023-12-18 23:51:00,873] Trial 461 pruned. Trial was pruned at iteration 0.
[I 2023-12-18 23:51:00,968] Trial 462 pruned. Trial was pruned at iteration 2.
[I 2023-12-18 23:51:01,067] Trial 463 pruned. Trial was pruned at iteration 0.
[I 2023-12-18 23:51:01,156] Trial 464 pruned. Trial was pruned at iteration 0.
[I 2023-12-18 23:51:01,241] Trial 465 pruned. Trial was pruned at iteration 0.
[I 2023-12-18 23:51:01,326] Trial 466 pruned. Trial was pruned at iteration 0.
[I 2023-12-18 23:51:01,418] Trial 467 pruned. Trial was pruned at iteration 0.
[I 2023-12-18 23:51:01,513] Trial 468 pruned. Trial was pruned at iteration 0.
[I 2023-12-18 23:51:01,602] Trial 469 pruned. Trial was pruned at iteration 0.
[I 2023-12-18 23:51:01,693] Trial 470 pruned. Trial was pruned at iteration 0.
[I 2023-12-18 23:51:01,780] Trial 471 pruned. Trial was pruned at iteration 0.
[I 2023-12-18 23:51:01,875] Trial 472 pruned. Trial was pruned at iteration 0.
[I 2023-12-18 23:51:01,964] Trial 473 pruned. Trial was pruned at iteration 0.
[I 2023-12-18 23:51:02,072] Trial 474 pruned. Trial was pruned at iteration 0.
[I 2023-12-18 23:51:02,165] Trial 475 pruned. Trial was pruned at iteration 0.
[I 2023-12-18 23:51:02,249] Trial 476 pruned. Trial was pruned at iteration 0.
[I 2023-12-18 23:51:02,340] Trial 477 pruned. Trial was pruned at iteration 0.
[I 2023-12-18 23:51:02,424] Trial 478 pruned. Trial was pruned at iteration 0.
[I 2023-12-18 23:51:03,797] Trial 479 finished with value: inf and parameters: {'learning_rate': 0.93493548533994, 'aft_loss_distribution': 'normal', 'aft_loss_distribution_scale': 1.1148204447826036, 'max_depth': 3, 'booster': 'dart', 'scale_pos_weight': 1.5495410041136628, 'alpha': 9.814471510975679, 'lambda': 0.6287419999692254, 'eta': 0.09551438595587514, 'sampling_method': 'uniform', 'subsample': 0.4853557860226275, 'gamma': 8.752844410604222}. Best is trial 370 with value: 4.250995514781027.
[I 2023-12-18 23:51:03,894] Trial 480 pruned. Trial was pruned at iteration 0.
[I 2023-12-18 23:51:03,986] Trial 481 pruned. Trial was pruned at iteration 0.
[I 2023-12-18 23:51:04,089] Trial 482 pruned. Trial was pruned at iteration 0.
[I 2023-12-18 23:51:04,188] Trial 483 pruned. Trial was pruned at iteration 2.
[I 2023-12-18 23:51:04,285] Trial 484 pruned. Trial was pruned at iteration 0.
[I 2023-12-18 23:51:04,372] Trial 485 pruned. Trial was pruned at iteration 0.
[I 2023-12-18 23:51:04,463] Trial 486 pruned. Trial was pruned at iteration 0.
[I 2023-12-18 23:51:04,558] Trial 487 pruned. Trial was pruned at iteration 0.
[I 2023-12-18 23:51:04,843] Trial 488 finished with value: inf and parameters: {'learning_rate': 0.9992737474895084, 'aft_loss_distribution': 'normal', 'aft_loss_distribution_scale': 1.0105359651811958, 'max_depth': 3, 'booster': 'gbtree', 'scale_pos_weight': 7.795537399026497, 'alpha': 9.384734740609149, 'lambda': 4.274278359436786, 'eta': 0.04686457677886351, 'sampling_method': 'uniform', 'subsample': 0.7382901651405913, 'gamma': 9.801136147478957}. Best is trial 370 with value: 4.250995514781027.
[I 2023-12-18 23:51:04,996] Trial 489 pruned. Trial was pruned at iteration 0.
[I 2023-12-18 23:51:05,144] Trial 490 pruned. Trial was pruned at iteration 0.
[I 2023-12-18 23:51:05,281] Trial 491 pruned. Trial was pruned at iteration 0.
[I 2023-12-18 23:51:05,413] Trial 492 pruned. Trial was pruned at iteration 0.
[I 2023-12-18 23:51:05,552] Trial 493 pruned. Trial was pruned at iteration 0.
[I 2023-12-18 23:51:05,713] Trial 494 pruned. Trial was pruned at iteration 1.
[I 2023-12-18 23:51:05,864] Trial 495 pruned. Trial was pruned at iteration 0.
[I 2023-12-18 23:51:06,012] Trial 496 pruned. Trial was pruned at iteration 1.
[I 2023-12-18 23:51:06,162] Trial 497 pruned. Trial was pruned at iteration 0.
[I 2023-12-18 23:51:06,313] Trial 498 pruned. Trial was pruned at iteration 0.
[I 2023-12-18 23:51:06,457] Trial 499 pruned. Trial was pruned at iteration 0.
Completed hyperparameter tuning with best aft-nloglik = 4.250995514781027.
Re-running the best trial... params = {'verbosity': 0, 'objective': 'survival:aft', 'eval_metric': 'aft-nloglik', 'tree_method': 'gpu_hist', 'device': 'cuda', 'learning_rate': 0.9546355536059413, 'aft_loss_distribution': 'normal', 'aft_loss_distribution_scale': 1.071686347224199, 'max_depth': 3, 'booster': 'dart', 'scale_pos_weight': 9.263485623374544, 'alpha': 9.011335289155987, 'lambda': 4.250694411828176, 'eta': 0.13362478130981073, 'sampling_method': 'uniform', 'subsample': 0.7998509049292822, 'gamma': 8.950746472329072}
[W 2023-12-18 23:51:10,016] Trial 2 is omitted in visualization because its objective value is inf or nan.
[W 2023-12-18 23:51:10,018] Trial 4 is omitted in visualization because its objective value is inf or nan.
[W 2023-12-18 23:51:10,020] Trial 17 is omitted in visualization because its objective value is inf or nan.
[W 2023-12-18 23:51:10,021] Trial 20 is omitted in visualization because its objective value is inf or nan.
[W 2023-12-18 23:51:10,023] Trial 23 is omitted in visualization because its objective value is inf or nan.
[W 2023-12-18 23:51:10,024] Trial 28 is omitted in visualization because its objective value is inf or nan.
[W 2023-12-18 23:51:10,025] Trial 33 is omitted in visualization because its objective value is inf or nan.
[W 2023-12-18 23:51:10,030] Trial 36 is omitted in visualization because its objective value is inf or nan.
[W 2023-12-18 23:51:10,036] Trial 42 is omitted in visualization because its objective value is inf or nan.
[W 2023-12-18 23:51:10,037] Trial 95 is omitted in visualization because its objective value is inf or nan.
[W 2023-12-18 23:51:10,038] Trial 113 is omitted in visualization because its objective value is inf or nan.
[W 2023-12-18 23:51:10,039] Trial 118 is omitted in visualization because its objective value is inf or nan.
[W 2023-12-18 23:51:10,040] Trial 121 is omitted in visualization because its objective value is inf or nan.
[W 2023-12-18 23:51:10,045] Trial 126 is omitted in visualization because its objective value is inf or nan.
[W 2023-12-18 23:51:10,045] Trial 130 is omitted in visualization because its objective value is inf or nan.
[W 2023-12-18 23:51:10,056] Trial 132 is omitted in visualization because its objective value is inf or nan.
[W 2023-12-18 23:51:10,056] Trial 139 is omitted in visualization because its objective value is inf or nan.
[W 2023-12-18 23:51:10,057] Trial 147 is omitted in visualization because its objective value is inf or nan.
[W 2023-12-18 23:51:10,058] Trial 151 is omitted in visualization because its objective value is inf or nan.
[W 2023-12-18 23:51:10,059] Trial 152 is omitted in visualization because its objective value is inf or nan.
[W 2023-12-18 23:51:10,062] Trial 156 is omitted in visualization because its objective value is inf or nan.
[W 2023-12-18 23:51:10,063] Trial 157 is omitted in visualization because its objective value is inf or nan.
[W 2023-12-18 23:51:10,064] Trial 159 is omitted in visualization because its objective value is inf or nan.
[W 2023-12-18 23:51:10,065] Trial 164 is omitted in visualization because its objective value is inf or nan.
[W 2023-12-18 23:51:10,066] Trial 166 is omitted in visualization because its objective value is inf or nan.
[W 2023-12-18 23:51:10,070] Trial 173 is omitted in visualization because its objective value is inf or nan.
[W 2023-12-18 23:51:10,071] Trial 181 is omitted in visualization because its objective value is inf or nan.
[W 2023-12-18 23:51:10,072] Trial 183 is omitted in visualization because its objective value is inf or nan.
[W 2023-12-18 23:51:10,073] Trial 186 is omitted in visualization because its objective value is inf or nan.
[W 2023-12-18 23:51:10,074] Trial 191 is omitted in visualization because its objective value is inf or nan.
[W 2023-12-18 23:51:10,075] Trial 192 is omitted in visualization because its objective value is inf or nan.
[W 2023-12-18 23:51:10,076] Trial 196 is omitted in visualization because its objective value is inf or nan.
[W 2023-12-18 23:51:10,080] Trial 198 is omitted in visualization because its objective value is inf or nan.
[W 2023-12-18 23:51:10,081] Trial 204 is omitted in visualization because its objective value is inf or nan.
[W 2023-12-18 23:51:10,082] Trial 205 is omitted in visualization because its objective value is inf or nan.
[W 2023-12-18 23:51:10,083] Trial 210 is omitted in visualization because its objective value is inf or nan.
[W 2023-12-18 23:51:10,084] Trial 220 is omitted in visualization because its objective value is inf or nan.
[W 2023-12-18 23:51:10,084] Trial 225 is omitted in visualization because its objective value is inf or nan.
[W 2023-12-18 23:51:10,088] Trial 230 is omitted in visualization because its objective value is inf or nan.
[W 2023-12-18 23:51:10,089] Trial 234 is omitted in visualization because its objective value is inf or nan.
[W 2023-12-18 23:51:10,090] Trial 245 is omitted in visualization because its objective value is inf or nan.
[W 2023-12-18 23:51:10,091] Trial 247 is omitted in visualization because its objective value is inf or nan.
[W 2023-12-18 23:51:10,092] Trial 251 is omitted in visualization because its objective value is inf or nan.
[W 2023-12-18 23:51:10,093] Trial 255 is omitted in visualization because its objective value is inf or nan.
[W 2023-12-18 23:51:10,098] Trial 259 is omitted in visualization because its objective value is inf or nan.
[W 2023-12-18 23:51:10,099] Trial 266 is omitted in visualization because its objective value is inf or nan.
[W 2023-12-18 23:51:10,100] Trial 272 is omitted in visualization because its objective value is inf or nan.
[W 2023-12-18 23:51:10,101] Trial 280 is omitted in visualization because its objective value is inf or nan.
[W 2023-12-18 23:51:10,102] Trial 296 is omitted in visualization because its objective value is inf or nan.
[W 2023-12-18 23:51:10,103] Trial 302 is omitted in visualization because its objective value is inf or nan.
[W 2023-12-18 23:51:10,104] Trial 328 is omitted in visualization because its objective value is inf or nan.
[W 2023-12-18 23:51:10,106] Trial 346 is omitted in visualization because its objective value is inf or nan.
[W 2023-12-18 23:51:10,107] Trial 358 is omitted in visualization because its objective value is inf or nan.
[W 2023-12-18 23:51:10,108] Trial 364 is omitted in visualization because its objective value is inf or nan.
[W 2023-12-18 23:51:10,109] Trial 375 is omitted in visualization because its objective value is inf or nan.
[W 2023-12-18 23:51:10,109] Trial 419 is omitted in visualization because its objective value is inf or nan.
[W 2023-12-18 23:51:10,110] Trial 454 is omitted in visualization because its objective value is inf or nan.
[W 2023-12-18 23:51:10,111] Trial 479 is omitted in visualization because its objective value is inf or nan.
[W 2023-12-18 23:51:10,112] Trial 488 is omitted in visualization because its objective value is inf or nan.
TRN1 | R2:0.246; p:1.208e-87 | C:61.97 |3h:0.885 |6h:0.866 |9h:0.850 |12h:0.398 |15h:0.398 |18h:0.393 |24h:0.160 |48h:0.152 |72h:0.147 |1wk:0.020 |2wks:0.018 |1mon:0.013 |
TRN2 | R2:0.204; p:1.68e-60 | C:59.88 |3h:0.886 |6h:0.867 |9h:0.851 |12h:0.398 |15h:0.398 |18h:0.393 |24h:0.160 |48h:0.152 |72h:0.146 |1wk:0.020 |2wks:0.018 |1mon:0.012 |
VAL | R2:0.191; p:4.918e-53 | C:59.34 |3h:0.887 |6h:0.867 |9h:0.851 |12h:0.398 |15h:0.398 |18h:0.394 |24h:0.160 |48h:0.152 |72h:0.146 |1wk:0.020 |2wks:0.018 |1mon:0.012 |
TST | R2:0.149; p:1.233e-96 | C:57.04 |3h:0.880 |6h:0.858 |9h:0.841 |12h:0.394 |15h:0.394 |18h:0.384 |24h:0.124 |48h:0.119 |72h:0.115 |1wk:0.019 |2wks:0.018 |1mon:0.013 |
/content/drive/MyDrive/intermediates2/res//outcome1_xgb-aft_inp24_k3_emb4_rdims8.json
trn1
trn2
val
[I 2023-12-18 23:51:17,507] A new study created in memory with name: no-name-c0142696-2ae7-4343-b882-31cf146fb5b6
tst
[I 2023-12-18 23:51:20,785] Trial 0 finished with value: 5.603811943206377 and parameters: {'learning_rate': 0.6512094532275368, 'aft_loss_distribution': 'normal', 'aft_loss_distribution_scale': 7.004370235340453, 'max_depth': 4, 'booster': 'dart', 'scale_pos_weight': 5.854300422230737, 'alpha': 1.6868492130084094, 'lambda': 1.622253088875009, 'eta': 0.8398509032612481, 'sampling_method': 'gradient_based', 'subsample': 0.5356448965884557, 'gamma': 1.8260744016523038}. Best is trial 0 with value: 5.603811943206377.
[I 2023-12-18 23:51:21,466] Trial 1 finished with value: 5.599837781160976 and parameters: {'learning_rate': 0.49660637634734384, 'aft_loss_distribution': 'normal', 'aft_loss_distribution_scale': 6.97005711864488, 'max_depth': 3, 'booster': 'gbtree', 'scale_pos_weight': 6.7626616137022655, 'alpha': 4.215459640400536, 'lambda': 5.157588651947179, 'eta': 0.43077578096316194, 'sampling_method': 'uniform', 'subsample': 0.4070311348380067, 'gamma': 8.477422993811347}. Best is trial 1 with value: 5.599837781160976.
[I 2023-12-18 23:51:22,232] Trial 2 finished with value: 4.8273005237457705 and parameters: {'learning_rate': 0.25314732530448875, 'aft_loss_distribution': 'normal', 'aft_loss_distribution_scale': 2.953568600151374, 'max_depth': 6, 'booster': 'gbtree', 'scale_pos_weight': 5.506183036452348, 'alpha': 5.919041076069516, 'lambda': 3.9944425139321447, 'eta': 0.0777621797983592, 'sampling_method': 'gradient_based', 'subsample': 0.3705444281847264, 'gamma': 7.096205025648735}. Best is trial 2 with value: 4.8273005237457705.
[I 2023-12-18 23:51:24,318] Trial 3 finished with value: inf and parameters: {'learning_rate': 0.7389186471837259, 'aft_loss_distribution': 'extreme', 'aft_loss_distribution_scale': 1.3134305315456785, 'max_depth': 4, 'booster': 'dart', 'scale_pos_weight': 8.048407566337687, 'alpha': 4.658720125540859, 'lambda': 5.1065814630789035, 'eta': 0.9621114194981871, 'sampling_method': 'uniform', 'subsample': 0.6878454264904925, 'gamma': 4.758992772658827}. Best is trial 2 with value: 4.8273005237457705.
[I 2023-12-18 23:51:25,478] Trial 4 finished with value: 6.329192799013485 and parameters: {'learning_rate': 0.0712918383859134, 'aft_loss_distribution': 'logistic', 'aft_loss_distribution_scale': 9.473620078432159, 'max_depth': 9, 'booster': 'gbtree', 'scale_pos_weight': 2.510123596191582, 'alpha': 4.516112756886267, 'lambda': 6.344638541379902, 'eta': 0.8135555707386941, 'sampling_method': 'gradient_based', 'subsample': 0.3733431290640864, 'gamma': 1.730854603776005}. Best is trial 2 with value: 4.8273005237457705.
[I 2023-12-18 23:51:25,497] Trial 5 pruned. Trial was pruned at iteration 0.
[I 2023-12-18 23:51:25,506] Trial 6 pruned. Trial was pruned at iteration 0.
[I 2023-12-18 23:51:25,516] Trial 7 pruned. Trial was pruned at iteration 0.
[I 2023-12-18 23:51:27,172] Trial 8 finished with value: 4.6721617503589785 and parameters: {'learning_rate': 0.4462456757622212, 'aft_loss_distribution': 'normal', 'aft_loss_distribution_scale': 2.4382396017513415, 'max_depth': 10, 'booster': 'gbtree', 'scale_pos_weight': 2.1630433573532026, 'alpha': 1.008950371860388, 'lambda': 3.068281457222118, 'eta': 0.7361788307885899, 'sampling_method': 'gradient_based', 'subsample': 0.36188643052602754, 'gamma': 6.366591519059127}. Best is trial 8 with value: 4.6721617503589785.
[I 2023-12-18 23:51:27,188] Trial 9 pruned. Trial was pruned at iteration 0.
[I 2023-12-18 23:51:30,965] Trial 10 finished with value: 5.187758833977994 and parameters: {'learning_rate': 0.45970605385531904, 'aft_loss_distribution': 'normal', 'aft_loss_distribution_scale': 4.44630153297244, 'max_depth': 7, 'booster': 'dart', 'scale_pos_weight': 4.180525488492936, 'alpha': 0.230356796591779, 'lambda': 8.892995295081343, 'eta': 0.528513936715996, 'sampling_method': 'uniform', 'subsample': 0.030191397920580898, 'gamma': 9.80390001716339}. Best is trial 8 with value: 4.6721617503589785.
[I 2023-12-18 23:51:31,863] Trial 11 finished with value: 5.0308104512678415 and parameters: {'learning_rate': 0.29956979379105725, 'aft_loss_distribution': 'normal', 'aft_loss_distribution_scale': 3.7296994584309555, 'max_depth': 6, 'booster': 'gbtree', 'scale_pos_weight': 0.3127790721921606, 'alpha': 9.868125562655102, 'lambda': 2.7693374504778783, 'eta': 0.26335839806226885, 'sampling_method': 'gradient_based', 'subsample': 0.9117077197500479, 'gamma': 6.294890625093275}. Best is trial 8 with value: 4.6721617503589785.
[I 2023-12-18 23:51:33,727] Trial 12 finished with value: inf and parameters: {'learning_rate': 0.968578080651245, 'aft_loss_distribution': 'normal', 'aft_loss_distribution_scale': 0.5326748722057868, 'max_depth': 6, 'booster': 'gbtree', 'scale_pos_weight': 9.2069325640144, 'alpha': 7.114061573495483, 'lambda': 2.9220546163539645, 'eta': 0.6927169286086867, 'sampling_method': 'gradient_based', 'subsample': 0.6438955334773765, 'gamma': 6.534123780739059}. Best is trial 8 with value: 4.6721617503589785.
[I 2023-12-18 23:51:37,102] Trial 13 finished with value: inf and parameters: {'learning_rate': 0.29167365711465837, 'aft_loss_distribution': 'normal', 'aft_loss_distribution_scale': 3.0125701400430223, 'max_depth': 8, 'booster': 'gbtree', 'scale_pos_weight': 4.079916743601268, 'alpha': 0.1674280598633594, 'lambda': 2.9334173054762336, 'eta': 0.3475739568572429, 'sampling_method': 'gradient_based', 'subsample': 0.056291540921050987, 'gamma': 6.677722537300267}. Best is trial 8 with value: 4.6721617503589785.
