[I 2023-12-19 04:35:35,317] Trial 109 finished with value: 4.370416680402134 and parameters: {'learning_rate': 0.8238880467920725, 'aft_loss_distribution': 'normal', 'aft_loss_distribution_scale': 1.6036294053667672, 'max_depth': 7, 'booster': 'gbtree', 'scale_pos_weight': 5.980556522326287, 'alpha': 1.163417599137984, 'lambda': 5.847233547961416, 'eta': 0.1239326681096158, 'sampling_method': 'uniform', 'subsample': 0.42581907567397337, 'gamma': 6.763421007563038}. Best is trial 100 with value: 4.304128959359402.
[I 2023-12-19 04:35:36,357] Trial 110 finished with value: inf and parameters: {'learning_rate': 0.8193626663079447, 'aft_loss_distribution': 'normal', 'aft_loss_distribution_scale': 0.898149004007819, 'max_depth': 7, 'booster': 'gbtree', 'scale_pos_weight': 5.748486229768644, 'alpha': 1.1237211066515918, 'lambda': 6.648715443839053, 'eta': 0.21606986258517646, 'sampling_method': 'uniform', 'subsample': 0.4174788669204067, 'gamma': 4.270040253361015}. Best is trial 100 with value: 4.304128959359402.
[I 2023-12-19 04:35:37,204] Trial 111 finished with value: 4.366385586493741 and parameters: {'learning_rate': 0.7924817706599884, 'aft_loss_distribution': 'normal', 'aft_loss_distribution_scale': 1.6003878620438987, 'max_depth': 7, 'booster': 'gbtree', 'scale_pos_weight': 6.303652914595892, 'alpha': 1.3178070143741119, 'lambda': 5.726864931611828, 'eta': 0.11430536140035466, 'sampling_method': 'uniform', 'subsample': 0.3504051825192116, 'gamma': 6.059695387189541}. Best is trial 100 with value: 4.304128959359402.
[I 2023-12-19 04:35:37,689] Trial 112 finished with value: inf and parameters: {'learning_rate': 0.7886242721477863, 'aft_loss_distribution': 'normal', 'aft_loss_distribution_scale': 1.59533477415573, 'max_depth': 7, 'booster': 'gbtree', 'scale_pos_weight': 5.963885395473028, 'alpha': 1.408926349107638, 'lambda': 5.802985979417299, 'eta': 0.11476601847267462, 'sampling_method': 'uniform', 'subsample': 0.3529714277823004, 'gamma': 4.766520607417}. Best is trial 100 with value: 4.304128959359402.
[I 2023-12-19 04:35:38,434] Trial 113 pruned. Trial was pruned at iteration 148.
[I 2023-12-19 04:35:39,240] Trial 114 finished with value: 4.333897368023237 and parameters: {'learning_rate': 0.8614011304079008, 'aft_loss_distribution': 'normal', 'aft_loss_distribution_scale': 1.4996908604927017, 'max_depth': 7, 'booster': 'gbtree', 'scale_pos_weight': 6.34767800897675, 'alpha': 1.8695249405384884, 'lambda': 6.09637667592713, 'eta': 0.14026702372527167, 'sampling_method': 'uniform', 'subsample': 0.34570070207821246, 'gamma': 5.985688492156661}. Best is trial 100 with value: 4.304128959359402.
[I 2023-12-19 04:35:39,925] Trial 115 finished with value: inf and parameters: {'learning_rate': 0.8719124476256537, 'aft_loss_distribution': 'normal', 'aft_loss_distribution_scale': 1.1870122563943655, 'max_depth': 7, 'booster': 'gbtree', 'scale_pos_weight': 6.371540694724855, 'alpha': 1.9258345592931245, 'lambda': 6.078554418758914, 'eta': 0.1464028136437218, 'sampling_method': 'uniform', 'subsample': 0.35607324484123415, 'gamma': 5.951358250963189}. Best is trial 100 with value: 4.304128959359402.
[I 2023-12-19 04:35:41,851] Trial 116 finished with value: inf and parameters: {'learning_rate': 0.7703512028887458, 'aft_loss_distribution': 'normal', 'aft_loss_distribution_scale': 1.5225735295906224, 'max_depth': 7, 'booster': 'gbtree', 'scale_pos_weight': 5.8060195161518084, 'alpha': 0.7440947459977267, 'lambda': 5.680990843740834, 'eta': 0.3470611419594321, 'sampling_method': 'uniform', 'subsample': 0.3852468831891156, 'gamma': 5.342328028952822}. Best is trial 100 with value: 4.304128959359402.
[I 2023-12-19 04:35:41,970] Trial 117 pruned. Trial was pruned at iteration 0.
[I 2023-12-19 04:35:44,783] Trial 118 finished with value: inf and parameters: {'learning_rate': 0.8914876809751545, 'aft_loss_distribution': 'normal', 'aft_loss_distribution_scale': 0.761342533805057, 'max_depth': 6, 'booster': 'gbtree', 'scale_pos_weight': 5.242730568465134, 'alpha': 6.422283702648509, 'lambda': 6.235948481566507, 'eta': 0.20151923542318503, 'sampling_method': 'uniform', 'subsample': 0.3448132679254293, 'gamma': 6.092423080884742}. Best is trial 100 with value: 4.304128959359402.
[I 2023-12-19 04:35:48,446] Trial 119 finished with value: inf and parameters: {'learning_rate': 0.7497804283527328, 'aft_loss_distribution': 'normal', 'aft_loss_distribution_scale': 1.0581609390371702, 'max_depth': 8, 'booster': 'dart', 'scale_pos_weight': 5.9972660070056465, 'alpha': 2.1190125559927093, 'lambda': 5.901025981809679, 'eta': 0.12222414736147522, 'sampling_method': 'uniform', 'subsample': 0.31389474660973415, 'gamma': 6.890546252370579}. Best is trial 100 with value: 4.304128959359402.
[I 2023-12-19 04:35:48,535] Trial 120 pruned. Trial was pruned at iteration 0.
[I 2023-12-19 04:35:49,169] Trial 121 finished with value: 4.295222755430402 and parameters: {'learning_rate': 0.849509829690743, 'aft_loss_distribution': 'normal', 'aft_loss_distribution_scale': 1.3686362269847705, 'max_depth': 6, 'booster': 'gbtree', 'scale_pos_weight': 5.558068273668249, 'alpha': 1.3581915821704311, 'lambda': 4.671695163911564, 'eta': 0.103683982446768, 'sampling_method': 'uniform', 'subsample': 0.43508943239547027, 'gamma': 6.5861594891809725}. Best is trial 121 with value: 4.295222755430402.
[I 2023-12-19 04:35:49,618] Trial 122 finished with value: inf and parameters: {'learning_rate': 0.8202383480249957, 'aft_loss_distribution': 'normal', 'aft_loss_distribution_scale': 1.292548312529771, 'max_depth': 7, 'booster': 'gbtree', 'scale_pos_weight': 5.643413807011044, 'alpha': 1.2902736034928688, 'lambda': 5.426638867861329, 'eta': 0.1700053228011031, 'sampling_method': 'uniform', 'subsample': 0.49537359804641445, 'gamma': 5.972223693044025}. Best is trial 121 with value: 4.295222755430402.
[I 2023-12-19 04:35:55,728] Trial 123 finished with value: 4.315215247616847 and parameters: {'learning_rate': 0.760027734305011, 'aft_loss_distribution': 'normal', 'aft_loss_distribution_scale': 1.4644182522367264, 'max_depth': 6, 'booster': 'gbtree', 'scale_pos_weight': 5.5031498175405, 'alpha': 2.376671038552706, 'lambda': 4.643215407604055, 'eta': 0.11405575058639417, 'sampling_method': 'uniform', 'subsample': 0.4748951258003886, 'gamma': 6.573418733351517}. Best is trial 121 with value: 4.295222755430402.
[I 2023-12-19 04:35:57,399] Trial 124 finished with value: inf and parameters: {'learning_rate': 0.8548270362633015, 'aft_loss_distribution': 'normal', 'aft_loss_distribution_scale': 1.4085571327596633, 'max_depth': 6, 'booster': 'gbtree', 'scale_pos_weight': 5.103441732363622, 'alpha': 1.0592067650113344, 'lambda': 5.199040303868642, 'eta': 0.13241115396980094, 'sampling_method': 'uniform', 'subsample': 0.4386639616896096, 'gamma': 6.3625458343741}. Best is trial 121 with value: 4.295222755430402.
[I 2023-12-19 04:36:00,074] Trial 125 finished with value: 4.352348486904368 and parameters: {'learning_rate': 0.7709126778455908, 'aft_loss_distribution': 'normal', 'aft_loss_distribution_scale': 1.5598503442610598, 'max_depth': 6, 'booster': 'gbtree', 'scale_pos_weight': 5.501442291982307, 'alpha': 2.3846936935964944, 'lambda': 4.678415903707566, 'eta': 0.08442772199937407, 'sampling_method': 'uniform', 'subsample': 0.48648644267475905, 'gamma': 6.747192941556418}. Best is trial 121 with value: 4.295222755430402.
[I 2023-12-19 04:36:00,812] Trial 126 finished with value: inf and parameters: {'learning_rate': 0.7913368117460559, 'aft_loss_distribution': 'normal', 'aft_loss_distribution_scale': 0.9369453781010577, 'max_depth': 6, 'booster': 'gbtree', 'scale_pos_weight': 5.453982254397498, 'alpha': 2.4222967739006385, 'lambda': 4.740039912277982, 'eta': 0.2346072257320036, 'sampling_method': 'uniform', 'subsample': 0.4787212869770527, 'gamma': 6.705371914163714}. Best is trial 121 with value: 4.295222755430402.
[I 2023-12-19 04:36:01,437] Trial 127 finished with value: 4.331469250627057 and parameters: {'learning_rate': 0.7708649033403205, 'aft_loss_distribution': 'normal', 'aft_loss_distribution_scale': 1.5011821757698296, 'max_depth': 6, 'booster': 'gbtree', 'scale_pos_weight': 5.894518131260552, 'alpha': 1.9483501540227404, 'lambda': 4.878276398876123, 'eta': 0.10773294472806527, 'sampling_method': 'uniform', 'subsample': 0.4459239700212281, 'gamma': 5.843451459152672}. Best is trial 121 with value: 4.295222755430402.
[I 2023-12-19 04:36:01,517] Trial 128 pruned. Trial was pruned at iteration 0.
[I 2023-12-19 04:36:02,009] Trial 129 finished with value: inf and parameters: {'learning_rate': 0.8414717632156548, 'aft_loss_distribution': 'normal', 'aft_loss_distribution_scale': 1.5337971581975367, 'max_depth': 6, 'booster': 'gbtree', 'scale_pos_weight': 5.600156440078083, 'alpha': 2.189470348405433, 'lambda': 4.3389931394638825, 'eta': 0.21389879804604037, 'sampling_method': 'uniform', 'subsample': 0.47723627060992296, 'gamma': 5.470343208016212}. Best is trial 121 with value: 4.295222755430402.
[I 2023-12-19 04:36:02,089] Trial 130 pruned. Trial was pruned at iteration 0.
[I 2023-12-19 04:36:02,182] Trial 131 pruned. Trial was pruned at iteration 2.
[I 2023-12-19 04:36:02,271] Trial 132 pruned. Trial was pruned at iteration 1.
[I 2023-12-19 04:36:03,011] Trial 133 finished with value: inf and parameters: {'learning_rate': 0.7865485465814934, 'aft_loss_distribution': 'normal', 'aft_loss_distribution_scale': 1.0802316682506106, 'max_depth': 6, 'booster': 'gbtree', 'scale_pos_weight': 5.492768170950281, 'alpha': 2.305116281561292, 'lambda': 5.635494614345388, 'eta': 0.12513584869386257, 'sampling_method': 'uniform', 'subsample': 0.2860506540921843, 'gamma': 5.235605111956877}. Best is trial 121 with value: 4.295222755430402.
[I 2023-12-19 04:36:03,703] Trial 134 finished with value: 4.327310981329645 and parameters: {'learning_rate': 0.8693342898110176, 'aft_loss_distribution': 'normal', 'aft_loss_distribution_scale': 1.4822141244820433, 'max_depth': 5, 'booster': 'gbtree', 'scale_pos_weight': 6.308882346736565, 'alpha': 1.4428625763931808, 'lambda': 4.669406002725077, 'eta': 0.06261296348844357, 'sampling_method': 'uniform', 'subsample': 0.4396512150824877, 'gamma': 6.1236232185326465}. Best is trial 121 with value: 4.295222755430402.
[I 2023-12-19 04:36:04,129] Trial 135 finished with value: inf and parameters: {'learning_rate': 0.8811911873682017, 'aft_loss_distribution': 'normal', 'aft_loss_distribution_scale': 1.4525195856583264, 'max_depth': 5, 'booster': 'gbtree', 'scale_pos_weight': 6.33990350979123, 'alpha': 1.333611723720875, 'lambda': 4.379847144386584, 'eta': 0.07662956595308579, 'sampling_method': 'uniform', 'subsample': 0.33667288175842236, 'gamma': 6.031053525255668}. Best is trial 121 with value: 4.295222755430402.
[I 2023-12-19 04:36:04,784] Trial 136 finished with value: inf and parameters: {'learning_rate': 0.8580970027730799, 'aft_loss_distribution': 'normal', 'aft_loss_distribution_scale': 0.8336847575943392, 'max_depth': 5, 'booster': 'gbtree', 'scale_pos_weight': 6.558812718139165, 'alpha': 1.5016025116446283, 'lambda': 4.630143389592469, 'eta': 0.05200556695449829, 'sampling_method': 'uniform', 'subsample': 0.39640825258924484, 'gamma': 5.709414798752824}. Best is trial 121 with value: 4.295222755430402.
[I 2023-12-19 04:36:05,288] Trial 137 finished with value: 4.374772070323902 and parameters: {'learning_rate': 0.9590563952516469, 'aft_loss_distribution': 'normal', 'aft_loss_distribution_scale': 1.6056001030753866, 'max_depth': 6, 'booster': 'gbtree', 'scale_pos_weight': 5.935435086784112, 'alpha': 1.8687035406566395, 'lambda': 4.880162401059134, 'eta': 0.19087094197867327, 'sampling_method': 'uniform', 'subsample': 0.440072429210422, 'gamma': 4.696771512002741}. Best is trial 121 with value: 4.295222755430402.
[I 2023-12-19 04:36:05,806] Trial 138 finished with value: inf and parameters: {'learning_rate': 0.9615764603702298, 'aft_loss_distribution': 'normal', 'aft_loss_distribution_scale': 1.3327521768049992, 'max_depth': 6, 'booster': 'gbtree', 'scale_pos_weight': 0.8196052343661004, 'alpha': 0.9251923134902944, 'lambda': 4.920402071909702, 'eta': 0.18523775208180154, 'sampling_method': 'uniform', 'subsample': 0.4364417657112651, 'gamma': 4.65454686370527}. Best is trial 121 with value: 4.295222755430402.
[I 2023-12-19 04:36:05,891] Trial 139 pruned. Trial was pruned at iteration 1.
[I 2023-12-19 04:36:06,472] Trial 140 finished with value: inf and parameters: {'learning_rate': 0.923685623003148, 'aft_loss_distribution': 'normal', 'aft_loss_distribution_scale': 1.1144426127903293, 'max_depth': 7, 'booster': 'gbtree', 'scale_pos_weight': 5.862768940138131, 'alpha': 1.6885242769621827, 'lambda': 4.772691459247474, 'eta': 0.0750615346506546, 'sampling_method': 'uniform', 'subsample': 0.49906302047511275, 'gamma': 5.149145774169282}. Best is trial 121 with value: 4.295222755430402.
[I 2023-12-19 04:36:06,922] Trial 141 finished with value: inf and parameters: {'learning_rate': 0.837016151702677, 'aft_loss_distribution': 'normal', 'aft_loss_distribution_scale': 1.5901176786139766, 'max_depth': 6, 'booster': 'gbtree', 'scale_pos_weight': 5.324270010404891, 'alpha': 1.2243663576030783, 'lambda': 6.031446151907986, 'eta': 0.2009198445211856, 'sampling_method': 'uniform', 'subsample': 0.48010603510253724, 'gamma': 4.359582959075446}. Best is trial 121 with value: 4.295222755430402.
[I 2023-12-19 04:36:07,010] Trial 142 pruned. Trial was pruned at iteration 1.
[I 2023-12-19 04:36:07,472] Trial 143 finished with value: 4.32307789113263 and parameters: {'learning_rate': 0.9908688925704804, 'aft_loss_distribution': 'normal', 'aft_loss_distribution_scale': 1.4614363353805901, 'max_depth': 5, 'booster': 'gbtree', 'scale_pos_weight': 6.212049177847393, 'alpha': 2.3620942720118134, 'lambda': 4.216971649066681, 'eta': 0.16336947036975785, 'sampling_method': 'uniform', 'subsample': 0.45793498673877187, 'gamma': 6.53455411249726}. Best is trial 121 with value: 4.295222755430402.
[I 2023-12-19 04:36:07,989] Trial 144 finished with value: 4.326711126427337 and parameters: {'learning_rate': 0.9716129359367929, 'aft_loss_distribution': 'normal', 'aft_loss_distribution_scale': 1.4630127474500412, 'max_depth': 6, 'booster': 'gbtree', 'scale_pos_weight': 6.1633480855338165, 'alpha': 2.4853970850217864, 'lambda': 4.1916087486220714, 'eta': 0.6064628593981243, 'sampling_method': 'uniform', 'subsample': 0.4534169583787878, 'gamma': 6.535025429723353}. Best is trial 121 with value: 4.295222755430402.
[I 2023-12-19 04:36:08,441] Trial 145 finished with value: inf and parameters: {'learning_rate': 0.9971004461079497, 'aft_loss_distribution': 'normal', 'aft_loss_distribution_scale': 1.3104913658518247, 'max_depth': 6, 'booster': 'gbtree', 'scale_pos_weight': 6.51931197541074, 'alpha': 2.512719594813066, 'lambda': 4.106792108158109, 'eta': 0.6449789443959713, 'sampling_method': 'uniform', 'subsample': 0.4029877934847087, 'gamma': 6.5437066072030525}. Best is trial 121 with value: 4.295222755430402.
[I 2023-12-19 04:36:08,522] Trial 146 pruned. Trial was pruned at iteration 0.
[I 2023-12-19 04:36:08,976] Trial 147 finished with value: inf and parameters: {'learning_rate': 0.9561521137763002, 'aft_loss_distribution': 'normal', 'aft_loss_distribution_scale': 1.4814837811346775, 'max_depth': 5, 'booster': 'gbtree', 'scale_pos_weight': 6.772891792133772, 'alpha': 2.369312082131443, 'lambda': 4.291041860616149, 'eta': 0.7040245541611995, 'sampling_method': 'uniform', 'subsample': 0.37117386727100604, 'gamma': 7.102717350178915}. Best is trial 121 with value: 4.295222755430402.
[I 2023-12-19 04:36:16,531] Trial 148 finished with value: inf and parameters: {'learning_rate': 0.9781346636334336, 'aft_loss_distribution': 'normal', 'aft_loss_distribution_scale': 1.0241885770708834, 'max_depth': 7, 'booster': 'dart', 'scale_pos_weight': 6.28139104835433, 'alpha': 2.144140494603848, 'lambda': 4.474151495437417, 'eta': 0.12452033794161246, 'sampling_method': 'uniform', 'subsample': 0.4380416237533258, 'gamma': 6.358284703151211}. Best is trial 121 with value: 4.295222755430402.
[I 2023-12-19 04:36:16,628] Trial 149 pruned. Trial was pruned at iteration 1.
[I 2023-12-19 04:36:16,730] Trial 150 pruned. Trial was pruned at iteration 0.
[I 2023-12-19 04:36:16,829] Trial 151 pruned. Trial was pruned at iteration 1.
[I 2023-12-19 04:36:17,674] Trial 152 finished with value: 4.325088777610747 and parameters: {'learning_rate': 0.8929566874783603, 'aft_loss_distribution': 'normal', 'aft_loss_distribution_scale': 1.4720205932235464, 'max_depth': 6, 'booster': 'gbtree', 'scale_pos_weight': 6.249890047039794, 'alpha': 1.865439968357099, 'lambda': 5.065775215573179, 'eta': 0.1609909904488983, 'sampling_method': 'uniform', 'subsample': 0.4820628757957943, 'gamma': 5.83963855817175}. Best is trial 121 with value: 4.295222755430402.
[I 2023-12-19 04:36:18,151] Trial 153 finished with value: inf and parameters: {'learning_rate': 0.8842754762667699, 'aft_loss_distribution': 'normal', 'aft_loss_distribution_scale': 1.1980674903230064, 'max_depth': 6, 'booster': 'gbtree', 'scale_pos_weight': 6.296381349545032, 'alpha': 1.909176480641808, 'lambda': 5.172071245202222, 'eta': 0.7951675057546562, 'sampling_method': 'uniform', 'subsample': 0.4880642411351214, 'gamma': 5.84828044217828}. Best is trial 121 with value: 4.295222755430402.
[I 2023-12-19 04:36:18,774] Trial 154 finished with value: 4.3201317138995075 and parameters: {'learning_rate': 0.8569624128842334, 'aft_loss_distribution': 'normal', 'aft_loss_distribution_scale': 1.461313935120527, 'max_depth': 6, 'booster': 'gbtree', 'scale_pos_weight': 6.548712821358618, 'alpha': 2.225515586750972, 'lambda': 4.446420513152982, 'eta': 0.6009336946626846, 'sampling_method': 'uniform', 'subsample': 0.4189231246177105, 'gamma': 5.8058029301216365}. Best is trial 121 with value: 4.295222755430402.
[I 2023-12-19 04:36:19,277] Trial 155 finished with value: inf and parameters: {'learning_rate': 0.8567207363380063, 'aft_loss_distribution': 'normal', 'aft_loss_distribution_scale': 1.3928306560292198, 'max_depth': 6, 'booster': 'gbtree', 'scale_pos_weight': 6.588727298991588, 'alpha': 2.313201836342309, 'lambda': 4.720147482437692, 'eta': 0.5907152161009236, 'sampling_method': 'uniform', 'subsample': 0.409646656945215, 'gamma': 5.692144637168279}. Best is trial 121 with value: 4.295222755430402.
[I 2023-12-19 04:36:20,088] Trial 156 finished with value: inf and parameters: {'learning_rate': 0.9091477351265915, 'aft_loss_distribution': 'normal', 'aft_loss_distribution_scale': 0.8315598081292382, 'max_depth': 6, 'booster': 'gbtree', 'scale_pos_weight': 5.488260434591044, 'alpha': 2.5777991035215173, 'lambda': 4.384492188695982, 'eta': 0.6372387865789501, 'sampling_method': 'uniform', 'subsample': 0.4250602203592643, 'gamma': 5.922199518042729}. Best is trial 121 with value: 4.295222755430402.
[I 2023-12-19 04:36:20,171] Trial 157 pruned. Trial was pruned at iteration 0.
[I 2023-12-19 04:36:20,263] Trial 158 pruned. Trial was pruned at iteration 0.
[I 2023-12-19 04:36:20,350] Trial 159 pruned. Trial was pruned at iteration 0.
[I 2023-12-19 04:36:20,740] Trial 160 finished with value: inf and parameters: {'learning_rate': 0.8962939664738465, 'aft_loss_distribution': 'normal', 'aft_loss_distribution_scale': 1.4942572674102608, 'max_depth': 6, 'booster': 'gbtree', 'scale_pos_weight': 5.72966673630098, 'alpha': 1.605721508670721, 'lambda': 4.2868793073326295, 'eta': 0.09715249323478245, 'sampling_method': 'uniform', 'subsample': 0.5060584850534766, 'gamma': 6.977949751615397}. Best is trial 121 with value: 4.295222755430402.
[I 2023-12-19 04:36:20,835] Trial 161 pruned. Trial was pruned at iteration 0.
[I 2023-12-19 04:36:21,197] Trial 162 finished with value: inf and parameters: {'learning_rate': 0.9428690028353416, 'aft_loss_distribution': 'normal', 'aft_loss_distribution_scale': 1.575081160377024, 'max_depth': 6, 'booster': 'gbtree', 'scale_pos_weight': 5.976792721081266, 'alpha': 2.2367548366473677, 'lambda': 4.465296321273689, 'eta': 0.6162810255055674, 'sampling_method': 'uniform', 'subsample': 0.29900053578121505, 'gamma': 6.00458993020703}. Best is trial 121 with value: 4.295222755430402.
[I 2023-12-19 04:36:21,718] Trial 163 finished with value: inf and parameters: {'learning_rate': 0.8301763526961244, 'aft_loss_distribution': 'normal', 'aft_loss_distribution_scale': 1.2978250287455442, 'max_depth': 6, 'booster': 'gbtree', 'scale_pos_weight': 6.224601353434939, 'alpha': 2.425655277221103, 'lambda': 5.141008670745568, 'eta': 0.11501040016746765, 'sampling_method': 'uniform', 'subsample': 0.3178296869106842, 'gamma': 6.64852213545971}. Best is trial 121 with value: 4.295222755430402.
[I 2023-12-19 04:36:21,804] Trial 164 pruned. Trial was pruned at iteration 0.
[I 2023-12-19 04:36:21,896] Trial 165 pruned. Trial was pruned at iteration 1.
[I 2023-12-19 04:36:21,987] Trial 166 pruned. Trial was pruned at iteration 0.
[I 2023-12-19 04:36:22,073] Trial 167 pruned. Trial was pruned at iteration 0.
[I 2023-12-19 04:36:22,161] Trial 168 pruned. Trial was pruned at iteration 1.
[I 2023-12-19 04:36:25,706] Trial 169 finished with value: inf and parameters: {'learning_rate': 0.8154980331488177, 'aft_loss_distribution': 'normal', 'aft_loss_distribution_scale': 1.2144456053654082, 'max_depth': 6, 'booster': 'dart', 'scale_pos_weight': 5.3577651823734325, 'alpha': 1.3045434954233461, 'lambda': 3.534265701926342, 'eta': 0.12806229201348754, 'sampling_method': 'uniform', 'subsample': 0.33853542876829257, 'gamma': 6.829619960592278}. Best is trial 121 with value: 4.295222755430402.
[I 2023-12-19 04:36:25,899] Trial 170 pruned. Trial was pruned at iteration 0.
[I 2023-12-19 04:36:26,150] Trial 171 pruned. Trial was pruned at iteration 0.
[I 2023-12-19 04:36:26,303] Trial 172 pruned. Trial was pruned at iteration 0.
[I 2023-12-19 04:36:26,459] Trial 173 pruned. Trial was pruned at iteration 0.
