[I 2023-12-21 04:06:56,587] Trial 104 finished with value: inf and parameters: {'learning_rate': 0.8766789552439611, 'aft_loss_distributi                                                                     on': 'normal', 'aft_loss_distribution_scale': 1.607357731396651, 'max_depth': 3, 'booster': 'dart', 'scale_pos_weight': 1.517659681744807                                                                     6, 'alpha': 9.752451220706277, 'lambda': 9.55817396235315, 'eta': 0.926419375637872, 'sampling_method': 'uniform', 'subsample': 0.8871691                                                                     733012601, 'gamma': 5.4602083735925575}. Best is trial 91 with value: 1.9797987126443772.
[I 2023-12-21 04:06:58,573] Trial 105 finished with value: 2.0259705925725484 and parameters: {'learning_rate': 0.9677203076954164, 'aft_                                                                     loss_distribution': 'normal', 'aft_loss_distribution_scale': 2.0391910631750267, 'max_depth': 3, 'booster': 'dart', 'scale_pos_weight': 1                                                                     .3319703890916135, 'alpha': 9.535383547883319, 'lambda': 8.941829080378046, 'eta': 0.9910455315071764, 'sampling_method': 'uniform', 'sub                                                                     sample': 0.9757439333204946, 'gamma': 5.99100906606757}. Best is trial 91 with value: 1.9797987126443772.
[I 2023-12-21 04:06:59,700] Trial 106 finished with value: inf and parameters: {'learning_rate': 0.9606284243255392, 'aft_loss_distributi                                                                     on': 'normal', 'aft_loss_distribution_scale': 2.089421927802109, 'max_depth': 3, 'booster': 'dart', 'scale_pos_weight': 1.378704418104582                                                                     7, 'alpha': 9.57812544003058, 'lambda': 8.970382651176863, 'eta': 0.9976596498520531, 'sampling_method': 'uniform', 'subsample': 0.944172                                                                     2241990881, 'gamma': 6.340464325402925}. Best is trial 91 with value: 1.9797987126443772.
[I 2023-12-21 04:06:59,736] Trial 107 pruned. Trial was pruned at iteration 1.
[I 2023-12-21 04:07:02,147] Trial 108 finished with value: 2.014498886667023 and parameters: {'learning_rate': 0.9766192909954391, 'aft_l                                                                     oss_distribution': 'normal', 'aft_loss_distribution_scale': 1.9442759610929268, 'max_depth': 3, 'booster': 'dart', 'scale_pos_weight': 1.                                                                     2712138484703543, 'alpha': 9.76936634481059, 'lambda': 8.10989975628761, 'eta': 0.901023632504912, 'sampling_method': 'uniform', 'subsamp                                                                     le': 0.9176488098416773, 'gamma': 5.6785163709804305}. Best is trial 91 with value: 1.9797987126443772.
[I 2023-12-21 04:07:03,544] Trial 109 finished with value: inf and parameters: {'learning_rate': 0.9793606161861593, 'aft_loss_distributi                                                                     on': 'normal', 'aft_loss_distribution_scale': 1.9169128817360581, 'max_depth': 3, 'booster': 'dart', 'scale_pos_weight': 1.20844561023505                                                                     43, 'alpha': 9.793260560163302, 'lambda': 8.144402077476915, 'eta': 0.8976978913485176, 'sampling_method': 'uniform', 'subsample': 0.9196                                                                     05129455812, 'gamma': 4.828596540414857}. Best is trial 91 with value: 1.9797987126443772.
[I 2023-12-21 04:07:11,533] Trial 110 finished with value: 1.974679967445453 and parameters: {'learning_rate': 0.9457966814658423, 'aft_l                                                                     oss_distribution': 'normal', 'aft_loss_distribution_scale': 1.3351087607298748, 'max_depth': 3, 'booster': 'dart', 'scale_pos_weight': 1.                                                                     3104492093871283, 'alpha': 9.669894937521786, 'lambda': 9.733779917045526, 'eta': 0.9299579746505195, 'sampling_method': 'uniform', 'subs                                                                     ample': 0.9761857339037853, 'gamma': 5.381300851300088}. Best is trial 110 with value: 1.974679967445453.
[I 2023-12-21 04:07:12,688] Trial 111 finished with value: inf and parameters: {'learning_rate': 0.9473280536337824, 'aft_loss_distributi                                                                     on': 'normal', 'aft_loss_distribution_scale': 1.5235275248244404, 'max_depth': 3, 'booster': 'dart', 'scale_pos_weight': 1.31181049407587                                                                     41, 'alpha': 9.67961342909028, 'lambda': 9.721352208939553, 'eta': 0.9233980392660144, 'sampling_method': 'uniform', 'subsample': 0.98288                                                                     99439610418, 'gamma': 5.678457619747491}. Best is trial 110 with value: 1.974679967445453.
[I 2023-12-21 04:07:12,722] Trial 112 pruned. Trial was pruned at iteration 0.
[I 2023-12-21 04:07:14,047] Trial 113 finished with value: inf and parameters: {'learning_rate': 0.9151957118994444, 'aft_loss_distributi                                                                     on': 'normal', 'aft_loss_distribution_scale': 1.757562387642464, 'max_depth': 3, 'booster': 'dart', 'scale_pos_weight': 1.560933519567772                                                                     3, 'alpha': 9.0581390273633, 'lambda': 9.272714537993874, 'eta': 0.9547497271798431, 'sampling_method': 'uniform', 'subsample': 0.9451575                                                                     731939831, 'gamma': 5.800852966904922}. Best is trial 110 with value: 1.974679967445453.
[I 2023-12-21 04:07:15,315] Trial 114 finished with value: inf and parameters: {'learning_rate': 0.9410077954955237, 'aft_loss_distributi                                                                     on': 'normal', 'aft_loss_distribution_scale': 1.2392941436281562, 'max_depth': 3, 'booster': 'dart', 'scale_pos_weight': 1.01645234763254                                                                     42, 'alpha': 9.648689393668656, 'lambda': 8.612826786718726, 'eta': 0.8450237221759154, 'sampling_method': 'uniform', 'subsample': 0.8937                                                                     530933224693, 'gamma': 6.087552625794733}. Best is trial 110 with value: 1.974679967445453.
[I 2023-12-21 04:07:16,426] Trial 115 finished with value: inf and parameters: {'learning_rate': 0.9901979475860523, 'aft_loss_distributi                                                                     on': 'normal', 'aft_loss_distribution_scale': 1.3268155997252529, 'max_depth': 4, 'booster': 'dart', 'scale_pos_weight': 1.39989443611247                                                                     23, 'alpha': 9.911514836613707, 'lambda': 8.812176261954544, 'eta': 0.9754056216712579, 'sampling_method': 'uniform', 'subsample': 0.9205                                                                     360696537709, 'gamma': 4.791672530829748}. Best is trial 110 with value: 1.974679967445453.
[I 2023-12-21 04:07:16,460] Trial 116 pruned. Trial was pruned at iteration 0.
[I 2023-12-21 04:07:16,494] Trial 117 pruned. Trial was pruned at iteration 0.
[I 2023-12-21 04:07:18,131] Trial 118 finished with value: inf and parameters: {'learning_rate': 0.9023470160370617, 'aft_loss_distributi                                                                     on': 'normal', 'aft_loss_distribution_scale': 2.0975262999584876, 'max_depth': 3, 'booster': 'dart', 'scale_pos_weight': 1.61600385638876                                                                     15, 'alpha': 9.617006025432781, 'lambda': 7.5660046023903, 'eta': 0.9251179439709766, 'sampling_method': 'uniform', 'subsample': 0.905896                                                                     9867391601, 'gamma': 5.117391346141742}. Best is trial 110 with value: 1.974679967445453.
[I 2023-12-21 04:07:18,166] Trial 119 pruned. Trial was pruned at iteration 0.
[I 2023-12-21 04:07:19,520] Trial 120 finished with value: inf and parameters: {'learning_rate': 0.9274235872143604, 'aft_loss_distributi                                                                     on': 'normal', 'aft_loss_distribution_scale': 1.5752955063760874, 'max_depth': 4, 'booster': 'dart', 'scale_pos_weight': 1.50565039495067                                                                     2, 'alpha': 9.403942100335938, 'lambda': 9.396727910039917, 'eta': 0.9445391058568091, 'sampling_method': 'uniform', 'subsample': 0.93189                                                                     13497299203, 'gamma': 5.87990826419374}. Best is trial 110 with value: 1.974679967445453.
[I 2023-12-21 04:07:19,558] Trial 121 pruned. Trial was pruned at iteration 1.
[I 2023-12-21 04:07:19,592] Trial 122 pruned. Trial was pruned at iteration 0.
[I 2023-12-21 04:07:19,630] Trial 123 pruned. Trial was pruned at iteration 1.
[I 2023-12-21 04:07:19,666] Trial 124 pruned. Trial was pruned at iteration 0.
[I 2023-12-21 04:07:23,284] Trial 125 finished with value: 2.0064994274845596 and parameters: {'learning_rate': 0.8986222672103886, 'aft_                                                                     loss_distribution': 'normal', 'aft_loss_distribution_scale': 1.8317886832514845, 'max_depth': 3, 'booster': 'dart', 'scale_pos_weight': 1                                                                     .478164892716259, 'alpha': 9.540299249891236, 'lambda': 9.19650287013885, 'eta': 0.9828382660917827, 'sampling_method': 'uniform', 'subsa                                                                     mple': 0.824487118504672, 'gamma': 6.486838121003274}. Best is trial 110 with value: 1.974679967445453.
[I 2023-12-21 04:07:24,503] Trial 126 finished with value: inf and parameters: {'learning_rate': 0.8960394078020331, 'aft_loss_distributi                                                                     on': 'normal', 'aft_loss_distribution_scale': 1.8593687630679308, 'max_depth': 3, 'booster': 'dart', 'scale_pos_weight': 1.49165878530443                                                                     45, 'alpha': 9.574557294267887, 'lambda': 9.258858946197735, 'eta': 0.9798751812809549, 'sampling_method': 'uniform', 'subsample': 0.9785                                                                     024922805642, 'gamma': 6.543584279072902}. Best is trial 110 with value: 1.974679967445453.
[I 2023-12-21 04:07:24,539] Trial 127 pruned. Trial was pruned at iteration 0.
[I 2023-12-21 04:07:25,688] Trial 128 finished with value: inf and parameters: {'learning_rate': 0.9996345524478716, 'aft_loss_distributi                                                                     on': 'normal', 'aft_loss_distribution_scale': 1.4746042520999298, 'max_depth': 3, 'booster': 'dart', 'scale_pos_weight': 1.64906251659081                                                                     3, 'alpha': 9.704264220644102, 'lambda': 9.46669325257255, 'eta': 0.9631501421734141, 'sampling_method': 'uniform', 'subsample': 0.831222                                                                     2301388767, 'gamma': 6.173295729832554}. Best is trial 110 with value: 1.974679967445453.
[I 2023-12-21 04:07:27,160] Trial 129 finished with value: inf and parameters: {'learning_rate': 0.9284109115892538, 'aft_loss_distributi                                                                     on': 'normal', 'aft_loss_distribution_scale': 1.7066182370584868, 'max_depth': 3, 'booster': 'dart', 'scale_pos_weight': 1.82197404551958                                                                     25, 'alpha': 8.747491476675783, 'lambda': 8.72826969542113, 'eta': 0.9989626050914975, 'sampling_method': 'uniform', 'subsample': 0.88460                                                                     83664700024, 'gamma': 5.0709365257829155}. Best is trial 110 with value: 1.974679967445453.
[I 2023-12-21 04:07:27,195] Trial 130 pruned. Trial was pruned at iteration 0.
[I 2023-12-21 04:07:27,233] Trial 131 pruned. Trial was pruned at iteration 1.
[I 2023-12-21 04:07:28,392] Trial 132 finished with value: inf and parameters: {'learning_rate': 0.960441093024926, 'aft_loss_distributio                                                                     n': 'normal', 'aft_loss_distribution_scale': 2.038025006399003, 'max_depth': 3, 'booster': 'dart', 'scale_pos_weight': 1.1832441700086658                                                                     , 'alpha': 9.80265699107935, 'lambda': 9.566019776608796, 'eta': 0.8894780993901235, 'sampling_method': 'uniform', 'subsample': 0.9528728                                                                     832149603, 'gamma': 5.887034116316077}. Best is trial 110 with value: 1.974679967445453.
[I 2023-12-21 04:07:28,429] Trial 133 pruned. Trial was pruned at iteration 0.
[I 2023-12-21 04:07:28,466] Trial 134 pruned. Trial was pruned at iteration 1.
[I 2023-12-21 04:07:29,615] Trial 135 finished with value: inf and parameters: {'learning_rate': 0.9360996867495337, 'aft_loss_distributi                                                                     on': 'normal', 'aft_loss_distribution_scale': 1.4552534212487411, 'max_depth': 4, 'booster': 'dart', 'scale_pos_weight': 1.70159483235659                                                                     5, 'alpha': 9.072656093858592, 'lambda': 8.378588423475193, 'eta': 0.9549007266178042, 'sampling_method': 'uniform', 'subsample': 0.87517                                                                     02724332538, 'gamma': 4.3516024671016265}. Best is trial 110 with value: 1.974679967445453.
[I 2023-12-21 04:07:29,650] Trial 136 pruned. Trial was pruned at iteration 0.
[I 2023-12-21 04:07:29,685] Trial 137 pruned. Trial was pruned at iteration 0.
[I 2023-12-21 04:07:37,839] Trial 138 finished with value: 2.0110700456426827 and parameters: {'learning_rate': 0.9162928575942516, 'aft_                                                                     loss_distribution': 'normal', 'aft_loss_distribution_scale': 1.8990872279126312, 'max_depth': 3, 'booster': 'dart', 'scale_pos_weight': 1                                                                     .398863287381264, 'alpha': 9.988094541363285, 'lambda': 9.321813347915828, 'eta': 0.9995734281572699, 'sampling_method': 'uniform', 'subs                                                                     ample': 0.9711718375655081, 'gamma': 6.008942187225861}. Best is trial 110 with value: 1.974679967445453.
[I 2023-12-21 04:07:39,044] Trial 139 finished with value: inf and parameters: {'learning_rate': 0.9168024983317103, 'aft_loss_distributi                                                                     on': 'normal', 'aft_loss_distribution_scale': 1.8809628794986686, 'max_depth': 3, 'booster': 'dart', 'scale_pos_weight': 1.41141784747974                                                                     25, 'alpha': 9.992962028234716, 'lambda': 9.34980406568025, 'eta': 0.9987300040319899, 'sampling_method': 'uniform', 'subsample': 0.96826                                                                     06593911935, 'gamma': 6.077479373330837}. Best is trial 110 with value: 1.974679967445453.
[I 2023-12-21 04:07:40,179] Trial 140 finished with value: inf and parameters: {'learning_rate': 0.9532577836225496, 'aft_loss_distributi                                                                     on': 'normal', 'aft_loss_distribution_scale': 1.5730040945451769, 'max_depth': 3, 'booster': 'dart', 'scale_pos_weight': 1.21087489801018                                                                     4, 'alpha': 9.626797140008623, 'lambda': 9.111830192066591, 'eta': 0.9444718132052285, 'sampling_method': 'uniform', 'subsample': 0.99469                                                                     19946057016, 'gamma': 5.544232776455743}. Best is trial 110 with value: 1.974679967445453.
[I 2023-12-21 04:07:40,214] Trial 141 pruned. Trial was pruned at iteration 0.
[I 2023-12-21 04:07:40,252] Trial 142 pruned. Trial was pruned at iteration 1.
[I 2023-12-21 04:07:40,287] Trial 143 pruned. Trial was pruned at iteration 0.
[I 2023-12-21 04:07:40,326] Trial 144 pruned. Trial was pruned at iteration 1.
[I 2023-12-21 04:07:41,458] Trial 145 finished with value: inf and parameters: {'learning_rate': 0.9747375669165737, 'aft_loss_distributi                                                                     on': 'normal', 'aft_loss_distribution_scale': 1.291650742077616, 'max_depth': 3, 'booster': 'dart', 'scale_pos_weight': 1.354907155144222                                                                     9, 'alpha': 9.19629847835885, 'lambda': 9.01421711504849, 'eta': 0.9029480113662369, 'sampling_method': 'uniform', 'subsample': 0.9776703                                                                     639570671, 'gamma': 5.386976049231172}. Best is trial 110 with value: 1.974679967445453.
[I 2023-12-21 04:07:41,496] Trial 146 pruned. Trial was pruned at iteration 0.
[I 2023-12-21 04:07:49,157] Trial 147 finished with value: 1.9940456634767927 and parameters: {'learning_rate': 0.9215538240918327, 'aft_                                                                     loss_distribution': 'normal', 'aft_loss_distribution_scale': 1.6898235845510279, 'max_depth': 4, 'booster': 'dart', 'scale_pos_weight': 1                                                                     .165260848135148, 'alpha': 9.593106123468933, 'lambda': 8.512456525820928, 'eta': 0.9626063689799399, 'sampling_method': 'uniform', 'subs                                                                     ample': 0.9524611205743597, 'gamma': 6.78266571126979}. Best is trial 110 with value: 1.974679967445453.
[I 2023-12-21 04:07:57,115] Trial 148 finished with value: 2.0008485077245988 and parameters: {'learning_rate': 0.9252544525940464, 'aft_                                                                     loss_distribution': 'normal', 'aft_loss_distribution_scale': 1.7364109501311586, 'max_depth': 3, 'booster': 'dart', 'scale_pos_weight': 1                                                                     .1307622571919258, 'alpha': 9.741318868757894, 'lambda': 8.402607255959557, 'eta': 0.9643779154485432, 'sampling_method': 'uniform', 'sub                                                                     sample': 0.964820644076833, 'gamma': 7.116709752756805}. Best is trial 110 with value: 1.974679967445453.
[I 2023-12-21 04:07:57,151] Trial 149 pruned. Trial was pruned at iteration 0.
[I 2023-12-21 04:07:57,186] Trial 150 pruned. Trial was pruned at iteration 0.
[I 2023-12-21 04:07:57,221] Trial 151 pruned. Trial was pruned at iteration 0.
[I 2023-12-21 04:07:57,256] Trial 152 pruned. Trial was pruned at iteration 0.
[I 2023-12-21 04:07:57,294] Trial 153 pruned. Trial was pruned at iteration 1.
[I 2023-12-21 04:07:59,501] Trial 154 finished with value: 2.0005501781913364 and parameters: {'learning_rate': 0.9387488177569011, 'aft_                                                                     loss_distribution': 'normal', 'aft_loss_distribution_scale': 1.7704540936387028, 'max_depth': 3, 'booster': 'dart', 'scale_pos_weight': 1                                                                     .3332094848675984, 'alpha': 9.266743052985372, 'lambda': 9.41787913888164, 'eta': 0.8653443501061885, 'sampling_method': 'uniform', 'subs                                                                     ample': 0.8980641579831362, 'gamma': 6.415849028549852}. Best is trial 110 with value: 1.974679967445453.
[I 2023-12-21 04:08:00,927] Trial 155 finished with value: inf and parameters: {'learning_rate': 0.9454406868668274, 'aft_loss_distributi                                                                     on': 'normal', 'aft_loss_distribution_scale': 1.825213734700748, 'max_depth': 3, 'booster': 'dart', 'scale_pos_weight': 1.295580248805940                                                                     5, 'alpha': 9.237072625804611, 'lambda': 9.619180157768465, 'eta': 0.8175516027289653, 'sampling_method': 'uniform', 'subsample': 0.96446                                                                     4015268718, 'gamma': 6.3922590375065385}. Best is trial 110 with value: 1.974679967445453.
[I 2023-12-21 04:08:00,965] Trial 156 pruned. Trial was pruned at iteration 0.
[I 2023-12-21 04:08:04,313] Trial 157 finished with value: 1.9919139185805046 and parameters: {'learning_rate': 0.986597278666627, 'aft_l                                                                     oss_distribution': 'normal', 'aft_loss_distribution_scale': 1.6347288011641468, 'max_depth': 3, 'booster': 'dart', 'scale_pos_weight': 1.                                                                     5362886053248053, 'alpha': 8.815085818359906, 'lambda': 8.842232171718127, 'eta': 0.8973853742368145, 'sampling_method': 'uniform', 'subs                                                                     ample': 0.9089646381591352, 'gamma': 7.339907027665328}. Best is trial 110 with value: 1.974679967445453.
