[I 2023-12-19 04:40:21,198] Trial 249 finished with value: inf and parameters: {'learning_rate': 0.8776675746944294, 'aft_loss_distribution': 'normal', 'aft_loss_distribution_scale': 1.3593192492866044, 'max_depth': 6, 'booster': 'dart', 'scale_pos_weight': 5.823767006682104, 'alpha': 2.3101797978853704, 'lambda': 4.318282009721796, 'eta': 0.6105976114359061, 'sampling_method': 'uniform', 'subsample': 0.5947562115938801, 'gamma': 5.8248290343264575}. Best is trial 225 with value: 4.267449843322546.
Completed hyperparameter tuning with best aft-nloglik = 4.267449843322546.
Re-running the best trial... params = {'verbosity': 0, 'objective': 'survival:aft', 'eval_metric': 'aft-nloglik', 'tree_method': 'hist', 'learning_rate': 0.7897732187593821, 'aft_loss_distribution': 'normal', 'aft_loss_distribution_scale': 1.2928462723155536, 'max_depth': 6, 'booster': 'gbtree', 'scale_pos_weight': 6.304756542366681, 'alpha': 1.8604863717654196, 'lambda': 5.560101323133988, 'eta': 0.1543920862523023, 'sampling_method': 'uniform', 'subsample': 0.5871181318687129, 'gamma': 4.495732682585467}
[W 2023-12-19 04:40:21,846] Trial 0 is omitted in visualization because its objective value is inf or nan.
[W 2023-12-19 04:40:21,853] Trial 6 is omitted in visualization because its objective value is inf or nan.
[W 2023-12-19 04:40:21,859] Trial 29 is omitted in visualization because its objective value is inf or nan.
[W 2023-12-19 04:40:21,865] Trial 32 is omitted in visualization because its objective value is inf or nan.
[W 2023-12-19 04:40:21,869] Trial 33 is omitted in visualization because its objective value is inf or nan.
[W 2023-12-19 04:40:21,871] Trial 47 is omitted in visualization because its objective value is inf or nan.
[W 2023-12-19 04:40:21,875] Trial 59 is omitted in visualization because its objective value is inf or nan.
[W 2023-12-19 04:40:21,877] Trial 65 is omitted in visualization because its objective value is inf or nan.
[W 2023-12-19 04:40:21,878] Trial 71 is omitted in visualization because its objective value is inf or nan.
[W 2023-12-19 04:40:21,879] Trial 73 is omitted in visualization because its objective value is inf or nan.
[W 2023-12-19 04:40:21,881] Trial 75 is omitted in visualization because its objective value is inf or nan.
[W 2023-12-19 04:40:21,882] Trial 80 is omitted in visualization because its objective value is inf or nan.
[W 2023-12-19 04:40:21,883] Trial 86 is omitted in visualization because its objective value is inf or nan.
[W 2023-12-19 04:40:21,884] Trial 101 is omitted in visualization because its objective value is inf or nan.
[W 2023-12-19 04:40:21,885] Trial 106 is omitted in visualization because its objective value is inf or nan.
[W 2023-12-19 04:40:21,886] Trial 110 is omitted in visualization because its objective value is inf or nan.
[W 2023-12-19 04:40:21,888] Trial 112 is omitted in visualization because its objective value is inf or nan.
[W 2023-12-19 04:40:21,889] Trial 115 is omitted in visualization because its objective value is inf or nan.
[W 2023-12-19 04:40:21,890] Trial 116 is omitted in visualization because its objective value is inf or nan.
[W 2023-12-19 04:40:21,891] Trial 118 is omitted in visualization because its objective value is inf or nan.
[W 2023-12-19 04:40:21,892] Trial 119 is omitted in visualization because its objective value is inf or nan.
[W 2023-12-19 04:40:21,893] Trial 122 is omitted in visualization because its objective value is inf or nan.
[W 2023-12-19 04:40:21,895] Trial 124 is omitted in visualization because its objective value is inf or nan.
[W 2023-12-19 04:40:21,896] Trial 126 is omitted in visualization because its objective value is inf or nan.
[W 2023-12-19 04:40:21,897] Trial 129 is omitted in visualization because its objective value is inf or nan.
[W 2023-12-19 04:40:21,898] Trial 133 is omitted in visualization because its objective value is inf or nan.
[W 2023-12-19 04:40:21,899] Trial 135 is omitted in visualization because its objective value is inf or nan.
[W 2023-12-19 04:40:21,900] Trial 136 is omitted in visualization because its objective value is inf or nan.
[W 2023-12-19 04:40:21,901] Trial 138 is omitted in visualization because its objective value is inf or nan.
[W 2023-12-19 04:40:21,902] Trial 140 is omitted in visualization because its objective value is inf or nan.
[W 2023-12-19 04:40:21,903] Trial 141 is omitted in visualization because its objective value is inf or nan.
[W 2023-12-19 04:40:21,904] Trial 145 is omitted in visualization because its objective value is inf or nan.
[W 2023-12-19 04:40:21,905] Trial 147 is omitted in visualization because its objective value is inf or nan.
[W 2023-12-19 04:40:21,906] Trial 148 is omitted in visualization because its objective value is inf or nan.
[W 2023-12-19 04:40:21,907] Trial 153 is omitted in visualization because its objective value is inf or nan.
[W 2023-12-19 04:40:21,908] Trial 155 is omitted in visualization because its objective value is inf or nan.
[W 2023-12-19 04:40:21,909] Trial 156 is omitted in visualization because its objective value is inf or nan.
[W 2023-12-19 04:40:21,910] Trial 160 is omitted in visualization because its objective value is inf or nan.
[W 2023-12-19 04:40:21,911] Trial 162 is omitted in visualization because its objective value is inf or nan.
[W 2023-12-19 04:40:21,912] Trial 163 is omitted in visualization because its objective value is inf or nan.
[W 2023-12-19 04:40:21,913] Trial 169 is omitted in visualization because its objective value is inf or nan.
[W 2023-12-19 04:40:21,914] Trial 176 is omitted in visualization because its objective value is inf or nan.
[W 2023-12-19 04:40:21,919] Trial 178 is omitted in visualization because its objective value is inf or nan.
[W 2023-12-19 04:40:21,920] Trial 184 is omitted in visualization because its objective value is inf or nan.
[W 2023-12-19 04:40:21,921] Trial 189 is omitted in visualization because its objective value is inf or nan.
[W 2023-12-19 04:40:21,922] Trial 199 is omitted in visualization because its objective value is inf or nan.
[W 2023-12-19 04:40:21,923] Trial 204 is omitted in visualization because its objective value is inf or nan.
[W 2023-12-19 04:40:21,924] Trial 206 is omitted in visualization because its objective value is inf or nan.
[W 2023-12-19 04:40:21,927] Trial 216 is omitted in visualization because its objective value is inf or nan.
[W 2023-12-19 04:40:21,928] Trial 218 is omitted in visualization because its objective value is inf or nan.
[W 2023-12-19 04:40:21,929] Trial 226 is omitted in visualization because its objective value is inf or nan.
[W 2023-12-19 04:40:21,930] Trial 227 is omitted in visualization because its objective value is inf or nan.
[W 2023-12-19 04:40:21,931] Trial 228 is omitted in visualization because its objective value is inf or nan.
[W 2023-12-19 04:40:21,933] Trial 232 is omitted in visualization because its objective value is inf or nan.
[W 2023-12-19 04:40:21,934] Trial 238 is omitted in visualization because its objective value is inf or nan.
[W 2023-12-19 04:40:21,935] Trial 239 is omitted in visualization because its objective value is inf or nan.
[W 2023-12-19 04:40:21,936] Trial 240 is omitted in visualization because its objective value is inf or nan.
[W 2023-12-19 04:40:21,939] Trial 242 is omitted in visualization because its objective value is inf or nan.
[W 2023-12-19 04:40:21,940] Trial 245 is omitted in visualization because its objective value is inf or nan.
[W 2023-12-19 04:40:21,941] Trial 247 is omitted in visualization because its objective value is inf or nan.
[W 2023-12-19 04:40:21,942] Trial 249 is omitted in visualization because its objective value is inf or nan.
TRN1 | R2:0.443; p:0.0 | C:72.08 |3h:0.877 |6h:0.858 |9h:0.843 |12h:0.405 |15h:0.405 |18h:0.400 |24h:0.167 |48h:0.159 |72h:0.153 |1wk:0.022 |2wks:0.020 |1mon:0.015 |
TRN2 | R2:0.283; p:1.418e-59 | C:63.93 |3h:0.876 |6h:0.857 |9h:0.841 |12h:0.401 |15h:0.401 |18h:0.397 |24h:0.164 |48h:0.157 |72h:0.151 |1wk:0.021 |2wks:0.020 |1mon:0.014 |
VAL | R2:0.245; p:1.973e-44 | C:62.14 |3h:0.875 |6h:0.856 |9h:0.840 |12h:0.400 |15h:0.400 |18h:0.396 |24h:0.164 |48h:0.156 |72h:0.150 |1wk:0.022 |2wks:0.020 |1mon:0.014 |
TST | R2:0.128; p:5.598e-72 | C:56.24 |3h:0.871 |6h:0.849 |9h:0.832 |12h:0.395 |15h:0.395 |18h:0.385 |24h:0.126 |48h:0.121 |72h:0.117 |1wk:0.020 |[I 2023-12-19 04:40:28,540] A new study created in memory with name: no-name-f9ae57f9-61ae-437d-9e78-844a77915e10
2wks:0.019 |1mon:0.014 |
/content/drive/MyDrive/intermediates2/res//outcome1_xgb-aft_inp49_k9_all_rdims8.json
Dimensionality reduced word embedding 1 with ['location_numeric', 'race_numeric', 'sex_numeric', 'body_part_numeric', 'product_1_numeric', 'product_2_numeric', 'drug_numeric', 'alcohol_numeric', 'month']
Dimensionality reduced word embedding 1 with ['location_numeric', 'race_numeric', 'sex_numeric', 'body_part_numeric', 'product_1_numeric', 'product_2_numeric', 'drug_numeric', 'alcohol_numeric', 'month']
Dimensionality reduced word embedding 1 with ['location_numeric', 'race_numeric', 'sex_numeric', 'body_part_numeric', 'product_1_numeric', 'product_2_numeric', 'drug_numeric', 'alcohol_numeric', 'month']
Dimensionality reduced word embedding 1 with ['location_numeric', 'race_numeric', 'sex_numeric', 'body_part_numeric', 'product_1_numeric', 'product_2_numeric', 'drug_numeric', 'alcohol_numeric', 'month']
trn1
trn2
val
tst
[I 2023-12-19 04:40:36,529] Trial 0 finished with value: 4.6458896929904565 and parameters: {'learning_rate': 0.4717000185591193, 'aft_loss_distribution': 'logistic', 'aft_loss_distribution_scale': 1.4718167081686546, 'max_depth': 9, 'booster': 'dart', 'scale_pos_weight': 6.215952028190505, 'alpha': 3.193547962314934, 'lambda': 4.6479168444792265, 'eta': 0.7482184636277764, 'sampling_method': 'uniform', 'subsample': 0.7207276154805722, 'gamma': 6.547095151127894}. Best is trial 0 with value: 4.6458896929904565.
[I 2023-12-19 04:40:41,366] Trial 1 finished with value: 4.936338841845781 and parameters: {'learning_rate': 0.875036065605867, 'aft_loss_distribution': 'normal', 'aft_loss_distribution_scale': 3.4026215328072325, 'max_depth': 5, 'booster': 'dart', 'scale_pos_weight': 7.444696869750818, 'alpha': 6.491058211471778, 'lambda': 1.4904997620059515, 'eta': 0.177263261854255, 'sampling_method': 'uniform', 'subsample': 0.12739609173254196, 'gamma': 7.31163039291877}. Best is trial 0 with value: 4.6458896929904565.
[I 2023-12-19 04:40:48,975] Trial 2 finished with value: 6.098542920642737 and parameters: {'learning_rate': 0.7820907402127749, 'aft_loss_distribution': 'logistic', 'aft_loss_distribution_scale': 7.578278042168116, 'max_depth': 6, 'booster': 'dart', 'scale_pos_weight': 9.02780486382629, 'alpha': 7.366752486103593, 'lambda': 4.269913695244802, 'eta': 0.2155110578158147, 'sampling_method': 'uniform', 'subsample': 0.7134507234890572, 'gamma': 1.523819276716489}. Best is trial 0 with value: 4.6458896929904565.
[I 2023-12-19 04:40:49,319] Trial 3 finished with value: 5.556315010956279 and parameters: {'learning_rate': 0.3584371474875832, 'aft_loss_distribution': 'extreme', 'aft_loss_distribution_scale': 6.135268335380696, 'max_depth': 6, 'booster': 'gbtree', 'scale_pos_weight': 1.5504426210935207, 'alpha': 1.0398317070544494, 'lambda': 9.55569822481562, 'eta': 0.08709000356405106, 'sampling_method': 'uniform', 'subsample': 0.43607246424917134, 'gamma': 8.926450559137654}. Best is trial 0 with value: 4.6458896929904565.
[I 2023-12-19 04:40:50,721] Trial 4 finished with value: 6.124135335498439 and parameters: {'learning_rate': 0.07327992823728349, 'aft_loss_distribution': 'logistic', 'aft_loss_distribution_scale': 7.7875451644734675, 'max_depth': 8, 'booster': 'gbtree', 'scale_pos_weight': 1.5405053258526893, 'alpha': 1.7091180693728019, 'lambda': 4.654711441882645, 'eta': 0.32332987347076214, 'sampling_method': 'uniform', 'subsample': 0.537075626252763, 'gamma': 1.6306575677397666}. Best is trial 0 with value: 4.6458896929904565.
[I 2023-12-19 04:40:50,737] Trial 5 pruned. Trial was pruned at iteration 0.
[I 2023-12-19 04:40:51,101] Trial 6 pruned. Trial was pruned at iteration 85.
[I 2023-12-19 04:40:51,119] Trial 7 pruned. Trial was pruned at iteration 0.
[I 2023-12-19 04:40:55,262] Trial 8 finished with value: 4.500587895818441 and parameters: {'learning_rate': 0.9120826951986889, 'aft_loss_distribution': 'normal', 'aft_loss_distribution_scale': 1.949371727561689, 'max_depth': 8, 'booster': 'dart', 'scale_pos_weight': 0.8689406852513346, 'alpha': 4.509633930707038, 'lambda': 4.40352590487206, 'eta': 0.37693303388179056, 'sampling_method': 'uniform', 'subsample': 0.24502238236502705, 'gamma': 5.942128637422499}. Best is trial 8 with value: 4.500587895818441.
[I 2023-12-19 04:40:55,280] Trial 9 pruned. Trial was pruned at iteration 0.
[I 2023-12-19 04:40:57,273] Trial 10 finished with value: inf and parameters: {'learning_rate': 0.9883903720412159, 'aft_loss_distribution': 'normal', 'aft_loss_distribution_scale': 0.8517210401806992, 'max_depth': 10, 'booster': 'dart', 'scale_pos_weight': 0.10139550212895365, 'alpha': 9.516767466067504, 'lambda': 2.500568629389072, 'eta': 0.4820967143266929, 'sampling_method': 'uniform', 'subsample': 0.06195772527034532, 'gamma': 9.894162910635504}. Best is trial 8 with value: 4.500587895818441.
[I 2023-12-19 04:40:57,339] Trial 11 pruned. Trial was pruned at iteration 0.
[I 2023-12-19 04:41:04,235] Trial 12 finished with value: inf and parameters: {'learning_rate': 0.7375459853171052, 'aft_loss_distribution': 'normal', 'aft_loss_distribution_scale': 1.4820462261753655, 'max_depth': 9, 'booster': 'dart', 'scale_pos_weight': 5.241279102701702, 'alpha': 3.043157520759393, 'lambda': 6.238055966186517, 'eta': 0.49561661919086, 'sampling_method': 'uniform', 'subsample': 0.6229927352006421, 'gamma': 5.47121298500847}. Best is trial 8 with value: 4.500587895818441.
[I 2023-12-19 04:41:04,299] Trial 13 pruned. Trial was pruned at iteration 0.
[I 2023-12-19 04:41:04,362] Trial 14 pruned. Trial was pruned at iteration 0.
[I 2023-12-19 04:41:04,425] Trial 15 pruned. Trial was pruned at iteration 0.
[I 2023-12-19 04:41:04,490] Trial 16 pruned. Trial was pruned at iteration 0.
[I 2023-12-19 04:41:04,554] Trial 17 pruned. Trial was pruned at iteration 0.
[I 2023-12-19 04:41:04,614] Trial 18 pruned. Trial was pruned at iteration 0.
[I 2023-12-19 04:41:04,689] Trial 19 pruned. Trial was pruned at iteration 0.
[I 2023-12-19 04:41:04,760] Trial 20 pruned. Trial was pruned at iteration 0.
[I 2023-12-19 04:41:12,295] Trial 21 finished with value: 4.651314582024124 and parameters: {'learning_rate': 0.8591839711950124, 'aft_loss_distribution': 'normal', 'aft_loss_distribution_scale': 2.397393261162584, 'max_depth': 5, 'booster': 'dart', 'scale_pos_weight': 7.8918759062137465, 'alpha': 5.89936734906338, 'lambda': 1.212948898110544, 'eta': 0.19683390211513818, 'sampling_method': 'uniform', 'subsample': 0.142831933885988, 'gamma': 7.269490876150928}. Best is trial 8 with value: 4.500587895818441.
[I 2023-12-19 04:41:12,376] Trial 22 pruned. Trial was pruned at iteration 0.
[I 2023-12-19 04:41:12,441] Trial 23 pruned. Trial was pruned at iteration 0.
[I 2023-12-19 04:41:18,016] Trial 24 finished with value: inf and parameters: {'learning_rate': 0.97841361950721, 'aft_loss_distribution': 'normal', 'aft_loss_distribution_scale': 0.9880089243481207, 'max_depth': 4, 'booster': 'dart', 'scale_pos_weight': 7.707976256605286, 'alpha': 4.12915865243794, 'lambda': 3.3099616624310313, 'eta': 0.30661455515885394, 'sampling_method': 'uniform', 'subsample': 0.2762638560235227, 'gamma': 7.334938298057765}. Best is trial 8 with value: 4.500587895818441.
[I 2023-12-19 04:41:18,085] Trial 25 pruned. Trial was pruned at iteration 0.
[I 2023-12-19 04:41:18,151] Trial 26 pruned. Trial was pruned at iteration 0.
[I 2023-12-19 04:41:18,219] Trial 27 pruned. Trial was pruned at iteration 0.
[I 2023-12-19 04:41:18,293] Trial 28 pruned. Trial was pruned at iteration 0.
[I 2023-12-19 04:41:18,359] Trial 29 pruned. Trial was pruned at iteration 0.
[I 2023-12-19 04:41:18,424] Trial 30 pruned. Trial was pruned at iteration 0.
[I 2023-12-19 04:41:18,500] Trial 31 pruned. Trial was pruned at iteration 0.
[I 2023-12-19 04:41:18,573] Trial 32 pruned. Trial was pruned at iteration 0.
[I 2023-12-19 04:41:32,886] Trial 33 finished with value: 4.277588194652332 and parameters: {'learning_rate': 0.8834278014372836, 'aft_loss_distribution': 'normal', 'aft_loss_distribution_scale': 1.2590355624895893, 'max_depth': 6, 'booster': 'dart', 'scale_pos_weight': 8.665643838900007, 'alpha': 3.530425642904116, 'lambda': 1.0381441843698718, 'eta': 0.3275725943548184, 'sampling_method': 'uniform', 'subsample': 0.10035283790681124, 'gamma': 9.338141301135597}. Best is trial 33 with value: 4.277588194652332.
[I 2023-12-19 04:41:32,965] Trial 34 pruned. Trial was pruned at iteration 0.
[I 2023-12-19 04:41:33,038] Trial 35 pruned. Trial was pruned at iteration 0.
[I 2023-12-19 04:41:33,114] Trial 36 pruned. Trial was pruned at iteration 0.
[I 2023-12-19 04:41:33,199] Trial 37 pruned. Trial was pruned at iteration 0.
[I 2023-12-19 04:41:33,274] Trial 38 pruned. Trial was pruned at iteration 0.
[I 2023-12-19 04:41:33,352] Trial 39 pruned. Trial was pruned at iteration 0.
[I 2023-12-19 04:41:33,425] Trial 40 pruned. Trial was pruned at iteration 0.
[I 2023-12-19 04:41:33,495] Trial 41 pruned. Trial was pruned at iteration 0.
[I 2023-12-19 04:41:33,565] Trial 42 pruned. Trial was pruned at iteration 0.
[I 2023-12-19 04:41:33,652] Trial 43 pruned. Trial was pruned at iteration 0.
[I 2023-12-19 04:41:37,813] Trial 44 finished with value: 4.540359652931491 and parameters: {'learning_rate': 0.9406964228546322, 'aft_loss_distribution': 'normal', 'aft_loss_distribution_scale': 2.067132779011762, 'max_depth': 4, 'booster': 'dart', 'scale_pos_weight': 8.717052488549472, 'alpha': 5.116227375433675, 'lambda': 4.8579240932061705, 'eta': 0.3139517261125825, 'sampling_method': 'uniform', 'subsample': 0.9560225752578876, 'gamma': 6.955086650060158}. Best is trial 33 with value: 4.277588194652332.
[I 2023-12-19 04:41:44,857] Trial 45 finished with value: 4.539173025103706 and parameters: {'learning_rate': 0.9063051886604209, 'aft_loss_distribution': 'normal', 'aft_loss_distribution_scale': 2.0636482255306925, 'max_depth': 4, 'booster': 'dart', 'scale_pos_weight': 8.777822244993027, 'alpha': 5.155627277364294, 'lambda': 4.897584179561787, 'eta': 0.45472054033320564, 'sampling_method': 'uniform', 'subsample': 0.9591949091906403, 'gamma': 6.8967770027637245}. Best is trial 33 with value: 4.277588194652332.
[I 2023-12-19 04:41:44,996] Trial 46 pruned. Trial was pruned at iteration 0.
[I 2023-12-19 04:41:48,974] Trial 47 finished with value: inf and parameters: {'learning_rate': 0.7750863390546181, 'aft_loss_distribution': 'normal', 'aft_loss_distribution_scale': 1.1278884173718684, 'max_depth': 3, 'booster': 'dart', 'scale_pos_weight': 9.00773384587363, 'alpha': 4.993788085350981, 'lambda': 5.746038213637359, 'eta': 0.5446002945310517, 'sampling_method': 'uniform', 'subsample': 0.8934281441025709, 'gamma': 5.48888448070963}. Best is trial 33 with value: 4.277588194652332.
[I 2023-12-19 04:41:49,050] Trial 48 pruned. Trial was pruned at iteration 0.
[I 2023-12-19 04:41:49,119] Trial 49 pruned. Trial was pruned at iteration 0.
[I 2023-12-19 04:41:49,204] Trial 50 pruned. Trial was pruned at iteration 0.
[I 2023-12-19 04:41:49,278] Trial 51 pruned. Trial was pruned at iteration 0.
[I 2023-12-19 04:41:55,468] Trial 52 finished with value: 4.517265026742001 and parameters: {'learning_rate': 0.8725940575842599, 'aft_loss_distribution': 'normal', 'aft_loss_distribution_scale': 2.0005730407313123, 'max_depth': 3, 'booster': 'dart', 'scale_pos_weight': 8.88817028737099, 'alpha': 5.731656108298928, 'lambda': 4.239084083857614, 'eta': 0.35074180860010024, 'sampling_method': 'uniform', 'subsample': 0.8403815826149919, 'gamma': 6.841936074281045}. Best is trial 33 with value: 4.277588194652332.
[I 2023-12-19 04:41:55,555] Trial 53 pruned. Trial was pruned at iteration 1.
[I 2023-12-19 04:41:55,632] Trial 54 pruned. Trial was pruned at iteration 0.
[I 2023-12-19 04:41:55,710] Trial 55 pruned. Trial was pruned at iteration 0.
[I 2023-12-19 04:42:02,283] Trial 56 finished with value: inf and parameters: {'learning_rate': 0.8314125104404487, 'aft_loss_distribution': 'normal', 'aft_loss_distribution_scale': 1.3288872941897028, 'max_depth': 4, 'booster': 'dart', 'scale_pos_weight': 8.902121356265152, 'alpha': 2.587160659554792, 'lambda': 3.7223639450494606, 'eta': 0.33037116049547705, 'sampling_method': 'uniform', 'subsample': 0.972073178855515, 'gamma': 0.023788265126939656}. Best is trial 33 with value: 4.277588194652332.
[I 2023-12-19 04:42:02,402] Trial 57 pruned. Trial was pruned at iteration 0.
[I 2023-12-19 04:42:02,471] Trial 58 pruned. Trial was pruned at iteration 0.
[I 2023-12-19 04:42:02,550] Trial 59 pruned. Trial was pruned at iteration 0.
[I 2023-12-19 04:42:02,625] Trial 60 pruned. Trial was pruned at iteration 0.
[I 2023-12-19 04:42:02,699] Trial 61 pruned. Trial was pruned at iteration 0.
[I 2023-12-19 04:42:11,494] Trial 62 finished with value: 4.241560449564326 and parameters: {'learning_rate': 0.915257415729215, 'aft_loss_distribution': 'normal', 'aft_loss_distribution_scale': 1.1122458451355441, 'max_depth': 4, 'booster': 'dart', 'scale_pos_weight': 7.96303194377818, 'alpha': 4.649261946376332, 'lambda': 6.059256058271318, 'eta': 0.3399062848293844, 'sampling_method': 'uniform', 'subsample': 0.8102574611555755, 'gamma': 6.59044638538311}. Best is trial 62 with value: 4.241560449564326.
