[I 2023-12-21 04:08:05,525] Trial 158 finished with value: inf and parameters: {'learning_rate': 0.990111866588685, 'aft_loss_distributio                                                                     n': 'normal', 'aft_loss_distribution_scale': 1.6556135641781065, 'max_depth': 3, 'booster': 'dart', 'scale_pos_weight': 1.517830084348457                                                                     6, 'alpha': 8.803263869747642, 'lambda': 8.641099232332255, 'eta': 0.8601279738541941, 'sampling_method': 'uniform', 'subsample': 0.90665                                                                     10271554031, 'gamma': 7.220722368638633}. Best is trial 110 with value: 1.974679967445453.
[I 2023-12-21 04:08:06,649] Trial 159 finished with value: inf and parameters: {'learning_rate': 0.9642475438247077, 'aft_loss_distributi                                                                     on': 'normal', 'aft_loss_distribution_scale': 1.410243084641975, 'max_depth': 3, 'booster': 'dart', 'scale_pos_weight': 1.780084384493811                                                                     7, 'alpha': 9.337899711379086, 'lambda': 9.982618095685465, 'eta': 0.8930899535425196, 'sampling_method': 'uniform', 'subsample': 0.98122                                                                     85624397195, 'gamma': 7.307841202865045}. Best is trial 110 with value: 1.974679967445453.
[I 2023-12-21 04:08:06,685] Trial 160 pruned. Trial was pruned at iteration 0.
[I 2023-12-21 04:08:06,721] Trial 161 pruned. Trial was pruned at iteration 0.
[I 2023-12-21 04:08:07,856] Trial 162 finished with value: inf and parameters: {'learning_rate': 0.9999862431072919, 'aft_loss_distributi                                                                     on': 'normal', 'aft_loss_distribution_scale': 1.6003323273264138, 'max_depth': 3, 'booster': 'dart', 'scale_pos_weight': 1.31403705192431                                                                     16, 'alpha': 9.557316785310894, 'lambda': 8.881515380547873, 'eta': 0.9999034806289754, 'sampling_method': 'uniform', 'subsample': 0.9483                                                                     62891742886, 'gamma': 6.9787890045701815}. Best is trial 110 with value: 1.974679967445453.
[I 2023-12-21 04:08:07,892] Trial 163 pruned. Trial was pruned at iteration 0.
[I 2023-12-21 04:08:07,931] Trial 164 pruned. Trial was pruned at iteration 1.
[I 2023-12-21 04:08:07,969] Trial 165 pruned. Trial was pruned at iteration 0.
[I 2023-12-21 04:08:08,007] Trial 166 pruned. Trial was pruned at iteration 1.
[I 2023-12-21 04:08:08,045] Trial 167 pruned. Trial was pruned at iteration 1.
[I 2023-12-21 04:08:08,081] Trial 168 pruned. Trial was pruned at iteration 0.
[I 2023-12-21 04:08:08,117] Trial 169 pruned. Trial was pruned at iteration 0.
[I 2023-12-21 04:08:08,154] Trial 170 pruned. Trial was pruned at iteration 0.
[I 2023-12-21 04:08:08,191] Trial 171 pruned. Trial was pruned at iteration 0.
[I 2023-12-21 04:08:08,227] Trial 172 pruned. Trial was pruned at iteration 0.
[I 2023-12-21 04:08:08,263] Trial 173 pruned. Trial was pruned at iteration 0.
[I 2023-12-21 04:08:08,302] Trial 174 pruned. Trial was pruned at iteration 1.
[I 2023-12-21 04:08:10,315] Trial 175 finished with value: inf and parameters: {'learning_rate': 0.9104790569002076, 'aft_loss_distributi                                                                     on': 'normal', 'aft_loss_distribution_scale': 1.7307719859259458, 'max_depth': 3, 'booster': 'dart', 'scale_pos_weight': 1.48606341201221                                                                     67, 'alpha': 9.477257356596372, 'lambda': 7.916191193945182, 'eta': 0.9588435333093813, 'sampling_method': 'uniform', 'subsample': 0.9556                                                                     846630581137, 'gamma': 5.388557576199141}. Best is trial 110 with value: 1.974679967445453.
[I 2023-12-21 04:08:10,354] Trial 176 pruned. Trial was pruned at iteration 0.
[I 2023-12-21 04:08:10,392] Trial 177 pruned. Trial was pruned at iteration 0.
[I 2023-12-21 04:08:10,428] Trial 178 pruned. Trial was pruned at iteration 0.
[I 2023-12-21 04:08:10,467] Trial 179 pruned. Trial was pruned at iteration 1.
[I 2023-12-21 04:08:17,022] Trial 180 finished with value: 1.9906232094144665 and parameters: {'learning_rate': 0.9777985247826759, 'aft_                                                                     loss_distribution': 'normal', 'aft_loss_distribution_scale': 1.618372684407876, 'max_depth': 4, 'booster': 'dart', 'scale_pos_weight': 1.                                                                     3783439392491283, 'alpha': 9.545744900465895, 'lambda': 9.051505047998583, 'eta': 0.941654789695081, 'sampling_method': 'uniform', 'subsa                                                                     mple': 0.943052277262247, 'gamma': 6.083220619585202}. Best is trial 110 with value: 1.974679967445453.
[I 2023-12-21 04:08:18,436] Trial 181 finished with value: inf and parameters: {'learning_rate': 0.9840189336747782, 'aft_loss_distributi                                                                     on': 'normal', 'aft_loss_distribution_scale': 1.6197329768634066, 'max_depth': 4, 'booster': 'dart', 'scale_pos_weight': 1.38902155559975                                                                     23, 'alpha': 9.536686467774507, 'lambda': 8.992800439984437, 'eta': 0.938839708256101, 'sampling_method': 'uniform', 'subsample': 0.93939                                                                     28166415648, 'gamma': 6.1320287724899165}. Best is trial 110 with value: 1.974679967445453.
[I 2023-12-21 04:08:18,481] Trial 182 pruned. Trial was pruned at iteration 2.
[I 2023-12-21 04:08:18,518] Trial 183 pruned. Trial was pruned at iteration 0.
[I 2023-12-21 04:08:18,555] Trial 184 pruned. Trial was pruned at iteration 0.
[I 2023-12-21 04:08:18,599] Trial 185 pruned. Trial was pruned at iteration 1.
[I 2023-12-21 04:08:18,637] Trial 186 pruned. Trial was pruned at iteration 0.
[I 2023-12-21 04:08:19,995] Trial 187 finished with value: inf and parameters: {'learning_rate': 0.9279175715349686, 'aft_loss_distributi                                                                     on': 'normal', 'aft_loss_distribution_scale': 1.545035483311499, 'max_depth': 3, 'booster': 'dart', 'scale_pos_weight': 1.631554024641082                                                                     2, 'alpha': 9.565322736777544, 'lambda': 8.181194623956971, 'eta': 0.9570462058628426, 'sampling_method': 'uniform', 'subsample': 0.95840                                                                     30821258033, 'gamma': 6.69298105075394}. Best is trial 110 with value: 1.974679967445453.
[I 2023-12-21 04:08:20,033] Trial 188 pruned. Trial was pruned at iteration 0.
[I 2023-12-21 04:08:20,078] Trial 189 pruned. Trial was pruned at iteration 2.
[I 2023-12-21 04:08:20,115] Trial 190 pruned. Trial was pruned at iteration 0.
[I 2023-12-21 04:08:20,152] Trial 191 pruned. Trial was pruned at iteration 0.
[I 2023-12-21 04:08:21,500] Trial 192 finished with value: inf and parameters: {'learning_rate': 0.9176101035757245, 'aft_loss_distributi                                                                     on': 'normal', 'aft_loss_distribution_scale': 1.7334466059722844, 'max_depth': 3, 'booster': 'dart', 'scale_pos_weight': 1.42034528061505                                                                     87, 'alpha': 9.821202869336071, 'lambda': 9.322028124480422, 'eta': 0.9682215151354333, 'sampling_method': 'uniform', 'subsample': 0.8746                                                                     738768712472, 'gamma': 5.743832304139007}. Best is trial 110 with value: 1.974679967445453.
[I 2023-12-21 04:08:21,541] Trial 193 pruned. Trial was pruned at iteration 0.
[I 2023-12-21 04:08:21,580] Trial 194 pruned. Trial was pruned at iteration 0.
[I 2023-12-21 04:08:21,618] Trial 195 pruned. Trial was pruned at iteration 0.
[I 2023-12-21 04:08:22,748] Trial 196 finished with value: inf and parameters: {'learning_rate': 0.960765625753558, 'aft_loss_distributio                                                                     n': 'normal', 'aft_loss_distribution_scale': 1.510233512154072, 'max_depth': 3, 'booster': 'dart', 'scale_pos_weight': 1.5864027229397892                                                                     , 'alpha': 9.064171499664434, 'lambda': 8.477194296814531, 'eta': 0.9663589724356476, 'sampling_method': 'uniform', 'subsample': 0.911916                                                                     9523415418, 'gamma': 6.284239141794747}. Best is trial 110 with value: 1.974679967445453.
[I 2023-12-21 04:08:22,786] Trial 197 pruned. Trial was pruned at iteration 0.
[I 2023-12-21 04:08:24,230] Trial 198 finished with value: inf and parameters: {'learning_rate': 0.9152049856935799, 'aft_loss_distributi                                                                     on': 'normal', 'aft_loss_distribution_scale': 1.8082272028133426, 'max_depth': 5, 'booster': 'dart', 'scale_pos_weight': 1.73102809991634                                                                     65, 'alpha': 9.490713152191086, 'lambda': 8.688934804602415, 'eta': 0.938460657862681, 'sampling_method': 'uniform', 'subsample': 0.96556                                                                     51030238077, 'gamma': 6.04748067151972}. Best is trial 110 with value: 1.974679967445453.
[I 2023-12-21 04:08:24,269] Trial 199 pruned. Trial was pruned at iteration 0.
[I 2023-12-21 04:08:24,313] Trial 200 pruned. Trial was pruned at iteration 1.
[I 2023-12-21 04:08:24,354] Trial 201 pruned. Trial was pruned at iteration 1.
[I 2023-12-21 04:08:24,393] Trial 202 pruned. Trial was pruned at iteration 0.
[I 2023-12-21 04:08:24,431] Trial 203 pruned. Trial was pruned at iteration 0.
[I 2023-12-21 04:08:24,471] Trial 204 pruned. Trial was pruned at iteration 0.
[I 2023-12-21 04:08:24,514] Trial 205 pruned. Trial was pruned at iteration 1.
[I 2023-12-21 04:08:24,555] Trial 206 pruned. Trial was pruned at iteration 0.
[I 2023-12-21 04:08:26,497] Trial 207 finished with value: inf and parameters: {'learning_rate': 0.9134179629433659, 'aft_loss_distributi                                                                     on': 'normal', 'aft_loss_distribution_scale': 1.821820558859683, 'max_depth': 3, 'booster': 'dart', 'scale_pos_weight': 1.159940604043346                                                                     6, 'alpha': 9.202948246029816, 'lambda': 9.1807245122469, 'eta': 0.9827247645579821, 'sampling_method': 'uniform', 'subsample': 0.9541159                                                                     338917177, 'gamma': 5.468754453958182}. Best is trial 110 with value: 1.974679967445453.
[I 2023-12-21 04:08:26,537] Trial 208 pruned. Trial was pruned at iteration 0.
[I 2023-12-21 04:08:26,579] Trial 209 pruned. Trial was pruned at iteration 1.
[I 2023-12-21 04:08:26,618] Trial 210 pruned. Trial was pruned at iteration 0.
[I 2023-12-21 04:08:26,657] Trial 211 pruned. Trial was pruned at iteration 0.
[I 2023-12-21 04:08:26,698] Trial 212 pruned. Trial was pruned at iteration 0.
[I 2023-12-21 04:08:26,743] Trial 213 pruned. Trial was pruned at iteration 0.
[I 2023-12-21 04:08:26,782] Trial 214 pruned. Trial was pruned at iteration 0.
[I 2023-12-21 04:08:26,824] Trial 215 pruned. Trial was pruned at iteration 1.
[I 2023-12-21 04:08:26,863] Trial 216 pruned. Trial was pruned at iteration 0.
[I 2023-12-21 04:08:26,902] Trial 217 pruned. Trial was pruned at iteration 0.
[I 2023-12-21 04:08:26,942] Trial 218 pruned. Trial was pruned at iteration 0.
[I 2023-12-21 04:08:26,982] Trial 219 pruned. Trial was pruned at iteration 0.
[I 2023-12-21 04:08:27,022] Trial 220 pruned. Trial was pruned at iteration 0.
[I 2023-12-21 04:08:27,062] Trial 221 pruned. Trial was pruned at iteration 0.
[I 2023-12-21 04:08:27,102] Trial 222 pruned. Trial was pruned at iteration 0.
[I 2023-12-21 04:08:27,142] Trial 223 pruned. Trial was pruned at iteration 0.
[I 2023-12-21 04:08:27,182] Trial 224 pruned. Trial was pruned at iteration 0.
[I 2023-12-21 04:08:27,222] Trial 225 pruned. Trial was pruned at iteration 0.
[I 2023-12-21 04:08:27,263] Trial 226 pruned. Trial was pruned at iteration 0.
[I 2023-12-21 04:08:27,303] Trial 227 pruned. Trial was pruned at iteration 0.
[I 2023-12-21 04:08:27,345] Trial 228 pruned. Trial was pruned at iteration 0.
[I 2023-12-21 04:08:27,387] Trial 229 pruned. Trial was pruned at iteration 1.
[I 2023-12-21 04:08:27,429] Trial 230 pruned. Trial was pruned at iteration 0.
[I 2023-12-21 04:08:27,469] Trial 231 pruned. Trial was pruned at iteration 0.
[I 2023-12-21 04:08:27,512] Trial 232 pruned. Trial was pruned at iteration 0.
[I 2023-12-21 04:08:27,552] Trial 233 pruned. Trial was pruned at iteration 0.
[I 2023-12-21 04:08:27,593] Trial 234 pruned. Trial was pruned at iteration 0.
[I 2023-12-21 04:08:27,633] Trial 235 pruned. Trial was pruned at iteration 0.
[I 2023-12-21 04:08:27,677] Trial 236 pruned. Trial was pruned at iteration 1.
[I 2023-12-21 04:08:27,717] Trial 237 pruned. Trial was pruned at iteration 0.
[I 2023-12-21 04:08:27,759] Trial 238 pruned. Trial was pruned at iteration 0.
[I 2023-12-21 04:08:27,801] Trial 239 pruned. Trial was pruned at iteration 0.
[I 2023-12-21 04:08:27,842] Trial 240 pruned. Trial was pruned at iteration 0.
[I 2023-12-21 04:08:27,883] Trial 241 pruned. Trial was pruned at iteration 0.
[I 2023-12-21 04:08:27,924] Trial 242 pruned. Trial was pruned at iteration 0.
[I 2023-12-21 04:08:27,965] Trial 243 pruned. Trial was pruned at iteration 0.
[I 2023-12-21 04:08:28,006] Trial 244 pruned. Trial was pruned at iteration 0.
[I 2023-12-21 04:08:28,049] Trial 245 pruned. Trial was pruned at iteration 0.
[I 2023-12-21 04:08:28,101] Trial 246 pruned. Trial was pruned at iteration 3.
[I 2023-12-21 04:08:28,143] Trial 247 pruned. Trial was pruned at iteration 0.
[I 2023-12-21 04:08:28,188] Trial 248 pruned. Trial was pruned at iteration 0.
[I 2023-12-21 04:08:28,229] Trial 249 pruned. Trial was pruned at iteration 0.
[I 2023-12-21 04:08:28,271] Trial 250 pruned. Trial was pruned at iteration 0.
[I 2023-12-21 04:08:28,316] Trial 251 pruned. Trial was pruned at iteration 0.
[I 2023-12-21 04:08:28,358] Trial 252 pruned. Trial was pruned at iteration 0.
[I 2023-12-21 04:08:28,400] Trial 253 pruned. Trial was pruned at iteration 0.
[I 2023-12-21 04:08:28,442] Trial 254 pruned. Trial was pruned at iteration 0.
[I 2023-12-21 04:08:28,484] Trial 255 pruned. Trial was pruned at iteration 0.
[I 2023-12-21 04:08:28,543] Trial 256 pruned. Trial was pruned at iteration 4.
[I 2023-12-21 04:08:28,589] Trial 257 pruned. Trial was pruned at iteration 1.
[I 2023-12-21 04:08:28,632] Trial 258 pruned. Trial was pruned at iteration 0.
[I 2023-12-21 04:08:28,674] Trial 259 pruned. Trial was pruned at iteration 0.
[I 2023-12-21 04:08:28,716] Trial 260 pruned. Trial was pruned at iteration 0.
[I 2023-12-21 04:08:28,758] Trial 261 pruned. Trial was pruned at iteration 0.
[I 2023-12-21 04:08:28,801] Trial 262 pruned. Trial was pruned at iteration 0.
[I 2023-12-21 04:08:28,843] Trial 263 pruned. Trial was pruned at iteration 0.
[I 2023-12-21 04:08:28,887] Trial 264 pruned. Trial was pruned at iteration 0.
[I 2023-12-21 04:08:28,934] Trial 265 pruned. Trial was pruned at iteration 1.
[I 2023-12-21 04:08:28,976] Trial 266 pruned. Trial was pruned at iteration 0.
[I 2023-12-21 04:08:29,018] Trial 267 pruned. Trial was pruned at iteration 0.
[I 2023-12-21 04:08:29,061] Trial 268 pruned. Trial was pruned at iteration 0.
[I 2023-12-21 04:08:30,741] Trial 269 finished with value: inf and parameters: {'learning_rate': 0.9507819984877168, 'aft_loss_distributi                                                                     on': 'normal', 'aft_loss_distribution_scale': 1.7542051493356356, 'max_depth': 8, 'booster': 'dart', 'scale_pos_weight': 2.47388762538312                                                                     35, 'alpha': 6.646366949453273, 'lambda': 3.1766173670483404, 'eta': 0.9314028124886807, 'sampling_method': 'uniform', 'subsample': 0.823                                                                     9093695917761, 'gamma': 5.894939536266539}. Best is trial 110 with value: 1.974679967445453.
[I 2023-12-21 04:08:30,786] Trial 270 pruned. Trial was pruned at iteration 0.
[I 2023-12-21 04:08:30,829] Trial 271 pruned. Trial was pruned at iteration 0.
[I 2023-12-21 04:08:30,872] Trial 272 pruned. Trial was pruned at iteration 0.
[I 2023-12-21 04:08:30,916] Trial 273 pruned. Trial was pruned at iteration 1.
[I 2023-12-21 04:08:30,960] Trial 274 pruned. Trial was pruned at iteration 0.
[I 2023-12-21 04:08:31,003] Trial 275 pruned. Trial was pruned at iteration 0.
[I 2023-12-21 04:08:31,047] Trial 276 pruned. Trial was pruned at iteration 0.
[I 2023-12-21 04:08:31,090] Trial 277 pruned. Trial was pruned at iteration 0.
[I 2023-12-21 04:08:31,135] Trial 278 pruned. Trial was pruned at iteration 1.
[I 2023-12-21 04:08:31,178] Trial 279 pruned. Trial was pruned at iteration 0.
[I 2023-12-21 04:08:31,223] Trial 280 pruned. Trial was pruned at iteration 1.
[I 2023-12-21 04:08:31,266] Trial 281 pruned. Trial was pruned at iteration 0.
[I 2023-12-21 04:08:31,316] Trial 282 pruned. Trial was pruned at iteration 0.
[I 2023-12-21 04:08:31,360] Trial 283 pruned. Trial was pruned at iteration 0.
[I 2023-12-21 04:08:31,403] Trial 284 pruned. Trial was pruned at iteration 0.
[I 2023-12-21 04:08:31,446] Trial 285 pruned. Trial was pruned at iteration 0.
[I 2023-12-21 04:08:31,490] Trial 286 pruned. Trial was pruned at iteration 0.
[I 2023-12-21 04:08:31,533] Trial 287 pruned. Trial was pruned at iteration 0.
[I 2023-12-21 04:08:31,576] Trial 288 pruned. Trial was pruned at iteration 0.
[I 2023-12-21 04:08:31,621] Trial 289 pruned. Trial was pruned at iteration 0.
[I 2023-12-21 04:08:31,665] Trial 290 pruned. Trial was pruned at iteration 0.
[I 2023-12-21 04:08:31,709] Trial 291 pruned. Trial was pruned at iteration 0.
[I 2023-12-21 04:08:31,753] Trial 292 pruned. Trial was pruned at iteration 0.
[I 2023-12-21 04:08:31,797] Trial 293 pruned. Trial was pruned at iteration 0.
[I 2023-12-21 04:08:31,859] Trial 294 pruned. Trial was pruned at iteration 5.
[I 2023-12-21 04:08:31,905] Trial 295 pruned. Trial was pruned at iteration 0.
[I 2023-12-21 04:08:31,949] Trial 296 pruned. Trial was pruned at iteration 0.
[I 2023-12-21 04:08:31,993] Trial 297 pruned. Trial was pruned at iteration 0.
[I 2023-12-21 04:08:32,171] Trial 298 finished with value: 2.0015859240614255 and parameters: {'learning_rate': 0.9251066813220429, 'aft_                                                                     loss_distribution': 'normal', 'aft_loss_distribution_scale': 1.7202143848596443, 'max_depth': 9, 'booster': 'gbtree', 'scale_pos_weight':                                                                      1.373242409953058, 'alpha': 9.56122157816994, 'lambda': 6.210420661042561, 'eta': 0.5452375089385832, 'sampling_method': 'uniform', 'sub                                                                     sample': 0.9235945600620225, 'gamma': 4.90093484393914}. Best is trial 110 with value: 1.974679967445453.
[I 2023-12-21 04:08:43,838] Trial 299 finished with value: 1.9922021347378773 and parameters: {'learning_rate': 0.9182737382886109, 'aft_                                                                     loss_distribution': 'normal', 'aft_loss_distribution_scale': 1.6681297677250404, 'max_depth': 9, 'booster': 'dart', 'scale_pos_weight': 1                                                                     .3852877296861938, 'alpha': 9.432437044330966, 'lambda': 9.427472451420263, 'eta': 0.48974011497482406, 'sampling_method': 'uniform', 'su                                                                     bsample': 0.92471957796986, 'gamma': 6.988308140180703}. Best is trial 110 with value: 1.974679967445453.
[I 2023-12-21 04:08:43,884] Trial 300 pruned. Trial was pruned at iteration 0.
[I 2023-12-21 04:08:43,928] Trial 301 pruned. Trial was pruned at iteration 0.
[I 2023-12-21 04:08:43,977] Trial 302 pruned. Trial was pruned at iteration 1.
[I 2023-12-21 04:08:44,021] Trial 303 pruned. Trial was pruned at iteration 0.
[I 2023-12-21 04:08:44,066] Trial 304 pruned. Trial was pruned at iteration 0.
[I 2023-12-21 04:08:44,111] Trial 305 pruned. Trial was pruned at iteration 0.
[I 2023-12-21 04:08:44,156] Trial 306 pruned. Trial was pruned at iteration 0.
[I 2023-12-21 04:08:44,203] Trial 307 pruned. Trial was pruned at iteration 0.
[I 2023-12-21 04:08:44,248] Trial 308 pruned. Trial was pruned at iteration 1.
[I 2023-12-21 04:08:44,296] Trial 309 pruned. Trial was pruned at iteration 0.
[I 2023-12-21 04:08:44,342] Trial 310 pruned. Trial was pruned at iteration 0.
[I 2023-12-21 04:08:44,387] Trial 311 pruned. Trial was pruned at iteration 0.
[I 2023-12-21 04:08:44,434] Trial 312 pruned. Trial was pruned at iteration 1.
[I 2023-12-21 04:08:44,482] Trial 313 pruned. Trial was pruned at iteration 1.
[I 2023-12-21 04:08:44,528] Trial 314 pruned. Trial was pruned at iteration 0.
[I 2023-12-21 04:08:45,789] Trial 315 finished with value: inf and parameters: {'learning_rate': 0.9571978049704616, 'aft_loss_distributi                                                                     on': 'normal', 'aft_loss_distribution_scale': 1.4044165792511611, 'max_depth': 3, 'booster': 'dart', 'scale_pos_weight': 1.39653400630274                                                                     6, 'alpha': 9.82404877163284, 'lambda': 9.703321727590549, 'eta': 0.9112640927950533, 'sampling_method': 'uniform', 'subsample': 0.877914                                                                     787578409, 'gamma': 5.9835873769218235}. Best is trial 110 with value: 1.974679967445453.
