[I 2023-12-21 04:39:50,642] Trial 231 finished with value: 2.085498730888642 and parameters: {'learning_rate': 0.45629949655490465, 'aft_                                                                     loss_distribution': 'logistic', 'aft_loss_distribution_scale': 1.5000813183876267, 'max_depth': 7, 'booster': 'dart', 'scale_pos_weight':                                                                      1.9186377531365055, 'alpha': 4.392761423101479, 'lambda': 2.4001796377068403, 'eta': 0.1974094752371704, 'sampling_method': 'uniform', '                                                                     subsample': 0.4351870567730316, 'gamma': 7.704606540485392}. Best is trial 1 with value: 2.009838820527457.
[I 2023-12-21 04:39:54,956] Trial 232 finished with value: 2.086140500813489 and parameters: {'learning_rate': 0.4050022775714855, 'aft_l                                                                     oss_distribution': 'logistic', 'aft_loss_distribution_scale': 1.4963615915020045, 'max_depth': 7, 'booster': 'dart', 'scale_pos_weight':                                                                      1.952017635587518, 'alpha': 4.416383572159064, 'lambda': 2.2798856846641917, 'eta': 0.19675658450486627, 'sampling_method': 'uniform', 's                                                                     ubsample': 0.4383737513936688, 'gamma': 7.709466664730927}. Best is trial 1 with value: 2.009838820527457.
[I 2023-12-21 04:39:59,300] Trial 233 finished with value: 2.0693056150571656 and parameters: {'learning_rate': 0.40625324608910757, 'aft                                                                     _loss_distribution': 'logistic', 'aft_loss_distribution_scale': 1.421019986622303, 'max_depth': 7, 'booster': 'dart', 'scale_pos_weight':                                                                      2.0122968097209055, 'alpha': 4.395784030202018, 'lambda': 2.4001734115843116, 'eta': 0.2056402217422066, 'sampling_method': 'uniform', '                                                                     subsample': 0.4386656192192863, 'gamma': 7.719113888054864}. Best is trial 1 with value: 2.009838820527457.
[I 2023-12-21 04:40:01,496] Trial 234 finished with value: 2.079428256092885 and parameters: {'learning_rate': 0.39189113932634145, 'aft_                                                                     loss_distribution': 'logistic', 'aft_loss_distribution_scale': 1.467008730567221, 'max_depth': 7, 'booster': 'dart', 'scale_pos_weight':                                                                      2.0352078620019345, 'alpha': 4.435273403768684, 'lambda': 2.054551999226685, 'eta': 0.2272505791035225, 'sampling_method': 'uniform', 'su                                                                     bsample': 0.4338187411289144, 'gamma': 7.659069291215938}. Best is trial 1 with value: 2.009838820527457.
[I 2023-12-21 04:40:04,686] Trial 235 finished with value: 2.0697151776891105 and parameters: {'learning_rate': 0.4052914568938711, 'aft_                                                                     loss_distribution': 'logistic', 'aft_loss_distribution_scale': 1.4138296196972269, 'max_depth': 7, 'booster': 'dart', 'scale_pos_weight':                                                                      2.0517607725018125, 'alpha': 4.3763210976564295, 'lambda': 2.371124956255645, 'eta': 0.24100374773197222, 'sampling_method': 'uniform',                                                                      'subsample': 0.4363938427843444, 'gamma': 7.748152547071271}. Best is trial 1 with value: 2.009838820527457.
[I 2023-12-21 04:40:09,050] Trial 236 finished with value: 2.0724244954577618 and parameters: {'learning_rate': 0.39733263355104737, 'aft                                                                     _loss_distribution': 'logistic', 'aft_loss_distribution_scale': 1.3023147553228787, 'max_depth': 7, 'booster': 'dart', 'scale_pos_weight'                                                                     : 2.040740543028336, 'alpha': 4.3803211197582055, 'lambda': 2.3359224617673404, 'eta': 0.23925622538131966, 'sampling_method': 'uniform',                                                                      'subsample': 0.422526822070496, 'gamma': 7.730502710181309}. Best is trial 1 with value: 2.009838820527457.
[I 2023-12-21 04:40:09,092] Trial 237 pruned. Trial was pruned at iteration 0.
[I 2023-12-21 04:40:09,135] Trial 238 pruned. Trial was pruned at iteration 0.
[I 2023-12-21 04:40:12,283] Trial 239 finished with value: 2.0636831315196873 and parameters: {'learning_rate': 0.4143792322645249, 'aft_                                                                     loss_distribution': 'logistic', 'aft_loss_distribution_scale': 1.3540817629548756, 'max_depth': 7, 'booster': 'dart', 'scale_pos_weight':                                                                      1.9405711099424656, 'alpha': 4.521423235959471, 'lambda': 1.7224947410088636, 'eta': 0.23562181553194295, 'sampling_method': 'uniform',                                                                      'subsample': 0.4284806475623264, 'gamma': 8.052330431228096}. Best is trial 1 with value: 2.009838820527457.
[I 2023-12-21 04:40:17,060] Trial 240 finished with value: 2.063994049424672 and parameters: {'learning_rate': 0.4024310120695358, 'aft_l                                                                     oss_distribution': 'logistic', 'aft_loss_distribution_scale': 1.3047625256190027, 'max_depth': 7, 'booster': 'dart', 'scale_pos_weight':                                                                      1.9443204062607684, 'alpha': 4.568925317907143, 'lambda': 1.762416057445269, 'eta': 0.27237874007551494, 'sampling_method': 'uniform', 's                                                                     ubsample': 0.43308825712118, 'gamma': 8.081800244947486}. Best is trial 1 with value: 2.009838820527457.
[I 2023-12-21 04:40:20,523] Trial 241 finished with value: 2.0703025721449864 and parameters: {'learning_rate': 0.4053724300172162, 'aft_                                                                     loss_distribution': 'logistic', 'aft_loss_distribution_scale': 1.303506097218775, 'max_depth': 7, 'booster': 'dart', 'scale_pos_weight':                                                                      1.936646930497219, 'alpha': 4.563652311288409, 'lambda': 1.8136868849710832, 'eta': 0.28831608158815153, 'sampling_method': 'uniform', 's                                                                     ubsample': 0.4327860323667865, 'gamma': 8.05283111440215}. Best is trial 1 with value: 2.009838820527457.
[I 2023-12-21 04:40:20,566] Trial 242 pruned. Trial was pruned at iteration 0.
[I 2023-12-21 04:40:23,732] Trial 243 finished with value: 2.0648017496431987 and parameters: {'learning_rate': 0.3911251238632878, 'aft_                                                                     loss_distribution': 'logistic', 'aft_loss_distribution_scale': 1.3816538384259083, 'max_depth': 7, 'booster': 'dart', 'scale_pos_weight':                                                                      2.056408938255972, 'alpha': 4.501024451299013, 'lambda': 1.9116791482480402, 'eta': 0.264195901976409, 'sampling_method': 'uniform', 'su                                                                     bsample': 0.42578011148972217, 'gamma': 8.024217127563217}. Best is trial 1 with value: 2.009838820527457.
[I 2023-12-21 04:40:28,505] Trial 244 finished with value: 2.071116434064806 and parameters: {'learning_rate': 0.3838070256166803, 'aft_l                                                                     oss_distribution': 'logistic', 'aft_loss_distribution_scale': 1.3665329328463105, 'max_depth': 7, 'booster': 'dart', 'scale_pos_weight':                                                                      2.035136875689805, 'alpha': 4.520508880946819, 'lambda': 1.861077003751248, 'eta': 0.2681948852990019, 'sampling_method': 'uniform', 'sub                                                                     sample': 0.38073063915539024, 'gamma': 8.042096380625116}. Best is trial 1 with value: 2.009838820527457.
[I 2023-12-21 04:40:28,557] Trial 245 pruned. Trial was pruned at iteration 0.
[I 2023-12-21 04:40:32,679] Trial 246 finished with value: 2.0586508333611695 and parameters: {'learning_rate': 0.3639894612952398, 'aft_                                                                     loss_distribution': 'logistic', 'aft_loss_distribution_scale': 1.337134128800651, 'max_depth': 7, 'booster': 'dart', 'scale_pos_weight':                                                                      1.9373857019340968, 'alpha': 4.382760704989275, 'lambda': 1.538866070456329, 'eta': 0.29949480540585716, 'sampling_method': 'uniform', 's                                                                     ubsample': 0.4027019694742777, 'gamma': 8.063239618081994}. Best is trial 1 with value: 2.009838820527457.
[I 2023-12-21 04:40:36,598] Trial 247 finished with value: 2.07127727036333 and parameters: {'learning_rate': 0.4236352479719845, 'aft_lo                                                                     ss_distribution': 'logistic', 'aft_loss_distribution_scale': 1.3293921313930612, 'max_depth': 7, 'booster': 'dart', 'scale_pos_weight': 2                                                                     .114513121038216, 'alpha': 4.425396164796654, 'lambda': 1.4962174604189165, 'eta': 0.2995239069214629, 'sampling_method': 'uniform', 'sub                                                                     sample': 0.40505342972095637, 'gamma': 8.017665162546583}. Best is trial 1 with value: 2.009838820527457.
[I 2023-12-21 04:40:36,642] Trial 248 pruned. Trial was pruned at iteration 0.
[I 2023-12-21 04:40:36,684] Trial 249 pruned. Trial was pruned at iteration 0.
[I 2023-12-21 04:40:41,050] Trial 250 finished with value: 2.0706440143565548 and parameters: {'learning_rate': 0.38842967442679155, 'aft                                                                     _loss_distribution': 'logistic', 'aft_loss_distribution_scale': 1.3608339566820968, 'max_depth': 7, 'booster': 'dart', 'scale_pos_weight'                                                                     : 2.06126237297511, 'alpha': 4.350678613782931, 'lambda': 1.6964081393852046, 'eta': 0.2785338267057197, 'sampling_method': 'uniform', 's                                                                     ubsample': 0.41272528119044466, 'gamma': 7.99597146958253}. Best is trial 1 with value: 2.009838820527457.
[I 2023-12-21 04:40:41,095] Trial 251 pruned. Trial was pruned at iteration 0.
[I 2023-12-21 04:40:44,983] Trial 252 finished with value: 2.0671964869495487 and parameters: {'learning_rate': 0.39528260811522054, 'aft                                                                     _loss_distribution': 'logistic', 'aft_loss_distribution_scale': 1.3168287531943936, 'max_depth': 7, 'booster': 'dart', 'scale_pos_weight'                                                                     : 2.01295245521905, 'alpha': 4.536270667440672, 'lambda': 1.9529098783943797, 'eta': 0.2606247503323767, 'sampling_method': 'uniform', 's                                                                     ubsample': 0.41424748405087025, 'gamma': 8.189247053608819}. Best is trial 1 with value: 2.009838820527457.
[I 2023-12-21 04:40:47,258] Trial 253 finished with value: 2.057148929233345 and parameters: {'learning_rate': 0.3946623731049508, 'aft_l                                                                     oss_distribution': 'logistic', 'aft_loss_distribution_scale': 1.2941943491124204, 'max_depth': 7, 'booster': 'dart', 'scale_pos_weight':                                                                      2.2169590322955557, 'alpha': 4.6341196966978195, 'lambda': 1.3817562862852402, 'eta': 0.2624125322130198, 'sampling_method': 'uniform', '                                                                     subsample': 0.39012160805199025, 'gamma': 8.255460552631266}. Best is trial 1 with value: 2.009838820527457.
[I 2023-12-21 04:40:47,300] Trial 254 pruned. Trial was pruned at iteration 0.
[I 2023-12-21 04:40:47,344] Trial 255 pruned. Trial was pruned at iteration 0.
[I 2023-12-21 04:40:47,387] Trial 256 pruned. Trial was pruned at iteration 0.
[I 2023-12-21 04:40:47,433] Trial 257 pruned. Trial was pruned at iteration 0.
[I 2023-12-21 04:40:52,799] Trial 258 finished with value: 2.0792655194386915 and parameters: {'learning_rate': 0.4307225192584922, 'aft_                                                                     loss_distribution': 'logistic', 'aft_loss_distribution_scale': 1.3521826160353574, 'max_depth': 7, 'booster': 'dart', 'scale_pos_weight':                                                                      2.014119346116942, 'alpha': 4.269809886172206, 'lambda': 2.0370362565876836, 'eta': 0.25963479255869804, 'sampling_method': 'uniform', '                                                                     subsample': 0.41381704187358515, 'gamma': 7.960772126368754}. Best is trial 1 with value: 2.009838820527457.
[I 2023-12-21 04:40:52,842] Trial 259 pruned. Trial was pruned at iteration 0.
[I 2023-12-21 04:40:52,885] Trial 260 pruned. Trial was pruned at iteration 0.
[I 2023-12-21 04:40:56,948] Trial 261 finished with value: 2.062145671391992 and parameters: {'learning_rate': 0.3600379726358233, 'aft_l                                                                     oss_distribution': 'logistic', 'aft_loss_distribution_scale': 1.3315970158917902, 'max_depth': 7, 'booster': 'dart', 'scale_pos_weight':                                                                      2.0920488379639814, 'alpha': 4.54469263595538, 'lambda': 1.7427829382530562, 'eta': 0.32170451889875723, 'sampling_method': 'uniform', 's                                                                     ubsample': 0.35069428402627323, 'gamma': 8.104869448062175}. Best is trial 1 with value: 2.009838820527457.
[I 2023-12-21 04:41:01,352] Trial 262 finished with value: 2.049374176351286 and parameters: {'learning_rate': 0.3411050299788756, 'aft_l                                                                     oss_distribution': 'logistic', 'aft_loss_distribution_scale': 1.1311255044623274, 'max_depth': 7, 'booster': 'dart', 'scale_pos_weight':                                                                      2.0849601704165837, 'alpha': 4.280809732544177, 'lambda': 1.818392840164553, 'eta': 0.314215603139004, 'sampling_method': 'uniform', 'sub                                                                     sample': 0.41674152177141566, 'gamma': 8.103524617792454}. Best is trial 1 with value: 2.009838820527457.
[I 2023-12-21 04:41:01,400] Trial 263 pruned. Trial was pruned at iteration 0.
[I 2023-12-21 04:41:01,442] Trial 264 pruned. Trial was pruned at iteration 0.
[I 2023-12-21 04:41:06,214] Trial 265 finished with value: 2.044972989566737 and parameters: {'learning_rate': 0.31447825853851735, 'aft_                                                                     loss_distribution': 'logistic', 'aft_loss_distribution_scale': 1.1629262393834783, 'max_depth': 7, 'booster': 'dart', 'scale_pos_weight':                                                                      2.1855647527582778, 'alpha': 4.501367814381629, 'lambda': 1.4074296276693734, 'eta': 0.3517130620641823, 'sampling_method': 'uniform', '                                                                     subsample': 0.4138856650752173, 'gamma': 7.967450280212672}. Best is trial 1 with value: 2.009838820527457.
[I 2023-12-21 04:41:06,259] Trial 266 pruned. Trial was pruned at iteration 0.
[I 2023-12-21 04:41:06,304] Trial 267 pruned. Trial was pruned at iteration 0.
[I 2023-12-21 04:41:10,741] Trial 268 finished with value: 2.021753440225417 and parameters: {'learning_rate': 0.2964711327217806, 'aft_l                                                                     oss_distribution': 'logistic', 'aft_loss_distribution_scale': 1.1277286301666178, 'max_depth': 7, 'booster': 'dart', 'scale_pos_weight':                                                                      2.0904701060433646, 'alpha': 4.454212353129529, 'lambda': 1.8147168297881446, 'eta': 0.29390241394207806, 'sampling_method': 'uniform', '                                                                     subsample': 0.39322365752324817, 'gamma': 8.025545376952532}. Best is trial 1 with value: 2.009838820527457.
[I 2023-12-21 04:41:14,796] Trial 269 finished with value: 2.0342847719114645 and parameters: {'learning_rate': 0.2951811302304284, 'aft_                                                                     loss_distribution': 'logistic', 'aft_loss_distribution_scale': 1.2099674696224267, 'max_depth': 7, 'booster': 'dart', 'scale_pos_weight':                                                                      2.1025750530895118, 'alpha': 4.21494824323002, 'lambda': 0.8627316920941975, 'eta': 0.3116273600898883, 'sampling_method': 'uniform', 's                                                                     ubsample': 0.3549372072475633, 'gamma': 8.529950942833887}. Best is trial 1 with value: 2.009838820527457.
[I 2023-12-21 04:41:14,842] Trial 270 pruned. Trial was pruned at iteration 0.
[I 2023-12-21 04:41:19,975] Trial 271 finished with value: 2.0276227142854526 and parameters: {'learning_rate': 0.28810542107009957, 'aft                                                                     _loss_distribution': 'logistic', 'aft_loss_distribution_scale': 1.185324928974065, 'max_depth': 7, 'booster': 'dart', 'scale_pos_weight':                                                                      2.1032226495788198, 'alpha': 4.216775444546636, 'lambda': 1.496064831534287, 'eta': 0.29754152717592053, 'sampling_method': 'uniform', '                                                                     subsample': 0.38934979389103325, 'gamma': 8.767453014842}. Best is trial 1 with value: 2.009838820527457.
[I 2023-12-21 04:41:24,046] Trial 272 finished with value: 2.025467552968254 and parameters: {'learning_rate': 0.29215936747522425, 'aft_                                                                     loss_distribution': 'logistic', 'aft_loss_distribution_scale': 1.1488762920995856, 'max_depth': 7, 'booster': 'dart', 'scale_pos_weight':                                                                      2.096379590595119, 'alpha': 3.9320483361789047, 'lambda': 1.4567297764669422, 'eta': 0.2991843580654375, 'sampling_method': 'uniform', '                                                                     subsample': 0.3722886382971935, 'gamma': 8.85256015637212}. Best is trial 1 with value: 2.009838820527457.
[I 2023-12-21 04:41:27,774] Trial 273 finished with value: 2.0285071329696196 and parameters: {'learning_rate': 0.2836790063721844, 'aft_                                                                     loss_distribution': 'logistic', 'aft_loss_distribution_scale': 1.1499439401095501, 'max_depth': 7, 'booster': 'dart', 'scale_pos_weight':                                                                      2.102775488806773, 'alpha': 3.9303626710599624, 'lambda': 1.464617488251307, 'eta': 0.33937418616785214, 'sampling_method': 'uniform', '                                                                     subsample': 0.36807295366725307, 'gamma': 9.014314456811329}. Best is trial 1 with value: 2.009838820527457.
[I 2023-12-21 04:41:27,820] Trial 274 pruned. Trial was pruned at iteration 0.
[I 2023-12-21 04:41:33,398] Trial 275 finished with value: 2.028121613445089 and parameters: {'learning_rate': 0.26201890360794855, 'aft_                                                                     loss_distribution': 'logistic', 'aft_loss_distribution_scale': 1.1249168242494239, 'max_depth': 7, 'booster': 'dart', 'scale_pos_weight':                                                                      2.2003563371906165, 'alpha': 3.7857950675296883, 'lambda': 1.5204608684767655, 'eta': 0.3091917404350954, 'sampling_method': 'uniform',                                                                      'subsample': 0.3715685771434263, 'gamma': 8.855015670612879}. Best is trial 1 with value: 2.009838820527457.
[I 2023-12-21 04:41:33,452] Trial 276 pruned. Trial was pruned at iteration 1.
[I 2023-12-21 04:41:33,499] Trial 277 pruned. Trial was pruned at iteration 0.
[I 2023-12-21 04:41:33,546] Trial 278 pruned. Trial was pruned at iteration 0.
[I 2023-12-21 04:41:37,632] Trial 279 finished with value: 2.0322898326590964 and parameters: {'learning_rate': 0.3052686511982876, 'aft_                                                                     loss_distribution': 'logistic', 'aft_loss_distribution_scale': 1.1752318895853873, 'max_depth': 7, 'booster': 'dart', 'scale_pos_weight':                                                                      2.1625668443905735, 'alpha': 3.979849312767973, 'lambda': 1.0894040227253006, 'eta': 0.3173735976206348, 'sampling_method': 'uniform', '                                                                     subsample': 0.34401102757337415, 'gamma': 8.71700382712632}. Best is trial 1 with value: 2.009838820527457.
[I 2023-12-21 04:41:37,682] Trial 280 pruned. Trial was pruned at iteration 0.
