[I 2023-12-18 22:58:36,876] Trial 148 finished with value: inf and parameters: {'learning_rate': 0.8057766235671092, 'aft_loss_distribution': 'normal', 'aft_loss_distribution_scale': 1.0206989458556652, 'max_depth': 7, 'booster': 'gbtree', 'scale_pos_weight': 2.1422051451043593, 'alpha': 9.593697610719293, 'lambda': 0.9476357212287823, 'eta': 0.6299622257625929, 'sampling_method': 'uniform', 'subsample': 0.5137214538504739, 'gamma': 3.7758487025749385}. Best is trial 76 with value: 4.296629174417102.
[I 2023-12-18 22:58:36,941] Trial 149 pruned. Trial was pruned at iteration 0.
[I 2023-12-18 22:58:36,999] Trial 150 pruned. Trial was pruned at iteration 0.
[I 2023-12-18 22:58:37,199] Trial 151 finished with value: inf and parameters: {'learning_rate': 0.7167247122600635, 'aft_loss_distribution': 'normal', 'aft_loss_distribution_scale': 1.7070585324115428, 'max_depth': 6, 'booster': 'gbtree', 'scale_pos_weight': 2.8651500240797696, 'alpha': 7.793445263279952, 'lambda': 0.6862551732024766, 'eta': 0.619296603658872, 'sampling_method': 'uniform', 'subsample': 0.4223204381862628, 'gamma': 2.854174995054666}. Best is trial 76 with value: 4.296629174417102.
[I 2023-12-18 22:58:37,588] Trial 152 finished with value: 4.343853543147731 and parameters: {'learning_rate': 0.6857640332003773, 'aft_loss_distribution': 'normal', 'aft_loss_distribution_scale': 1.442487197685829, 'max_depth': 7, 'booster': 'gbtree', 'scale_pos_weight': 2.989767765800905, 'alpha': 9.823916772587452, 'lambda': 0.8650655154166675, 'eta': 0.6729250621935932, 'sampling_method': 'uniform', 'subsample': 0.47638151808111945, 'gamma': 3.3144416819211315}. Best is trial 76 with value: 4.296629174417102.
[I 2023-12-18 22:58:37,652] Trial 153 pruned. Trial was pruned at iteration 0.
[I 2023-12-18 22:58:37,963] Trial 154 finished with value: 4.362183340124175 and parameters: {'learning_rate': 0.7440566121060523, 'aft_loss_distribution': 'normal', 'aft_loss_distribution_scale': 1.5041909672438207, 'max_depth': 7, 'booster': 'gbtree', 'scale_pos_weight': 3.1963937449049107, 'alpha': 9.772721974737854, 'lambda': 1.2876841254922313, 'eta': 0.6795819070430704, 'sampling_method': 'uniform', 'subsample': 0.5184556640152174, 'gamma': 3.087844721867529}. Best is trial 76 with value: 4.296629174417102.
[I 2023-12-18 22:58:38,038] Trial 155 pruned. Trial was pruned at iteration 0.
[I 2023-12-18 22:58:38,211] Trial 156 finished with value: inf and parameters: {'learning_rate': 0.7881638970918126, 'aft_loss_distribution': 'normal', 'aft_loss_distribution_scale': 1.505864415210891, 'max_depth': 3, 'booster': 'gbtree', 'scale_pos_weight': 3.2223115552751045, 'alpha': 9.739517979995288, 'lambda': 1.1842209838911835, 'eta': 0.6800151947854938, 'sampling_method': 'uniform', 'subsample': 0.5367246880049459, 'gamma': 3.2369668469202386}. Best is trial 76 with value: 4.296629174417102.
[I 2023-12-18 22:58:38,428] Trial 157 finished with value: inf and parameters: {'learning_rate': 0.7573079720216034, 'aft_loss_distribution': 'normal', 'aft_loss_distribution_scale': 1.4254604836509308, 'max_depth': 8, 'booster': 'gbtree', 'scale_pos_weight': 3.05296892469345, 'alpha': 9.700368236981895, 'lambda': 1.8537465970349234, 'eta': 0.646937466123938, 'sampling_method': 'uniform', 'subsample': 0.6539086156109175, 'gamma': 3.958964793815451}. Best is trial 76 with value: 4.296629174417102.
[I 2023-12-18 22:58:38,652] Trial 158 finished with value: inf and parameters: {'learning_rate': 0.8326091125535829, 'aft_loss_distribution': 'normal', 'aft_loss_distribution_scale': 1.7433621895359077, 'max_depth': 7, 'booster': 'gbtree', 'scale_pos_weight': 2.692049134190251, 'alpha': 9.33092137146136, 'lambda': 2.4293696908203124, 'eta': 0.6241694223496612, 'sampling_method': 'uniform', 'subsample': 0.4635206990889932, 'gamma': 3.463484045333198}. Best is trial 76 with value: 4.296629174417102.
[I 2023-12-18 22:58:38,719] Trial 159 pruned. Trial was pruned at iteration 0.
[I 2023-12-18 22:58:38,959] Trial 160 finished with value: inf and parameters: {'learning_rate': 0.8115085865480866, 'aft_loss_distribution': 'normal', 'aft_loss_distribution_scale': 0.9503787323765379, 'max_depth': 3, 'booster': 'gbtree', 'scale_pos_weight': 2.814150572187041, 'alpha': 7.424594156165074, 'lambda': 1.0992534839200028, 'eta': 0.6898410354073496, 'sampling_method': 'uniform', 'subsample': 0.5199640351327498, 'gamma': 2.668400704266974}. Best is trial 76 with value: 4.296629174417102.
[I 2023-12-18 22:58:39,025] Trial 161 pruned. Trial was pruned at iteration 0.
[I 2023-12-18 22:58:39,088] Trial 162 pruned. Trial was pruned at iteration 1.
[I 2023-12-18 22:58:39,149] Trial 163 pruned. Trial was pruned at iteration 0.
[I 2023-12-18 22:58:39,217] Trial 164 pruned. Trial was pruned at iteration 1.
[I 2023-12-18 22:58:39,280] Trial 165 pruned. Trial was pruned at iteration 0.
[I 2023-12-18 22:58:39,348] Trial 166 pruned. Trial was pruned at iteration 0.
[I 2023-12-18 22:58:39,420] Trial 167 pruned. Trial was pruned at iteration 1.
[I 2023-12-18 22:58:50,643] Trial 168 finished with value: 4.317234124797625 and parameters: {'learning_rate': 0.709722636148657, 'aft_loss_distribution': 'normal', 'aft_loss_distribution_scale': 1.3631666178460953, 'max_depth': 4, 'booster': 'dart', 'scale_pos_weight': 2.2478071877560324, 'alpha': 8.14837010635585, 'lambda': 0.40225556883506836, 'eta': 0.6248124636514474, 'sampling_method': 'uniform', 'subsample': 0.5081477766176734, 'gamma': 3.3589749258153745}. Best is trial 76 with value: 4.296629174417102.
[I 2023-12-18 22:58:50,885] Trial 169 finished with value: inf and parameters: {'learning_rate': 0.7453346854009779, 'aft_loss_distribution': 'normal', 'aft_loss_distribution_scale': 1.323398343365632, 'max_depth': 4, 'booster': 'gbtree', 'scale_pos_weight': 1.9551367496682435, 'alpha': 8.172681013746864, 'lambda': 0.2039571863786127, 'eta': 0.5739513930907726, 'sampling_method': 'uniform', 'subsample': 0.4961732682833977, 'gamma': 3.396134031039856}. Best is trial 76 with value: 4.296629174417102.
[I 2023-12-18 22:58:50,954] Trial 170 pruned. Trial was pruned at iteration 0.
[I 2023-12-18 22:58:51,018] Trial 171 pruned. Trial was pruned at iteration 0.
[I 2023-12-18 22:58:51,088] Trial 172 pruned. Trial was pruned at iteration 0.
[I 2023-12-18 22:58:51,152] Trial 173 pruned. Trial was pruned at iteration 0.
[I 2023-12-18 22:58:51,229] Trial 174 pruned. Trial was pruned at iteration 0.
[I 2023-12-18 22:58:51,296] Trial 175 pruned. Trial was pruned at iteration 1.
[I 2023-12-18 22:58:53,614] Trial 176 finished with value: inf and parameters: {'learning_rate': 0.7321013136703278, 'aft_loss_distribution': 'normal', 'aft_loss_distribution_scale': 1.233408138006094, 'max_depth': 7, 'booster': 'dart', 'scale_pos_weight': 3.26756026939343, 'alpha': 7.663651571794832, 'lambda': 1.0547270221154814, 'eta': 0.6989037177837232, 'sampling_method': 'uniform', 'subsample': 0.5085965522416225, 'gamma': 4.290054158377495}. Best is trial 76 with value: 4.296629174417102.
[I 2023-12-18 22:58:53,830] Trial 177 finished with value: inf and parameters: {'learning_rate': 0.7937708901617848, 'aft_loss_distribution': 'normal', 'aft_loss_distribution_scale': 1.7075610491209352, 'max_depth': 4, 'booster': 'gbtree', 'scale_pos_weight': 1.7856007520279642, 'alpha': 7.329094463269386, 'lambda': 0.4485139609023815, 'eta': 0.6471697917268168, 'sampling_method': 'uniform', 'subsample': 0.4785329567122493, 'gamma': 2.8116200952400754}. Best is trial 76 with value: 4.296629174417102.
[I 2023-12-18 22:58:53,902] Trial 178 pruned. Trial was pruned at iteration 0.
[I 2023-12-18 22:58:54,132] Trial 179 finished with value: inf and parameters: {'learning_rate': 0.7128535145937062, 'aft_loss_distribution': 'normal', 'aft_loss_distribution_scale': 1.4707134456025954, 'max_depth': 5, 'booster': 'gbtree', 'scale_pos_weight': 3.7416120697947965, 'alpha': 9.823247109985072, 'lambda': 0.7618505870729483, 'eta': 0.6122730744739073, 'sampling_method': 'uniform', 'subsample': 0.45446504951820005, 'gamma': 2.284620664367515}. Best is trial 76 with value: 4.296629174417102.
[I 2023-12-18 22:58:54,211] Trial 180 pruned. Trial was pruned at iteration 0.
[I 2023-12-18 22:58:54,276] Trial 181 pruned. Trial was pruned at iteration 0.
[I 2023-12-18 22:58:57,235] Trial 182 finished with value: 4.416669486274166 and parameters: {'learning_rate': 0.7268496805747208, 'aft_loss_distribution': 'normal', 'aft_loss_distribution_scale': 1.6695501985391958, 'max_depth': 6, 'booster': 'dart', 'scale_pos_weight': 4.086707974364365, 'alpha': 6.863000835919753, 'lambda': 0.2504666075290359, 'eta': 0.6650222856448869, 'sampling_method': 'uniform', 'subsample': 0.5188508197183412, 'gamma': 2.6385267220258677}. Best is trial 76 with value: 4.296629174417102.
[I 2023-12-18 22:59:00,062] Trial 183 finished with value: inf and parameters: {'learning_rate': 0.7401398943488334, 'aft_loss_distribution': 'normal', 'aft_loss_distribution_scale': 1.7056749996602443, 'max_depth': 6, 'booster': 'dart', 'scale_pos_weight': 3.9528276482832716, 'alpha': 6.892964742293297, 'lambda': 3.925802456465541, 'eta': 0.6691908430912903, 'sampling_method': 'uniform', 'subsample': 0.5139249712402347, 'gamma': 2.6156948894611873}. Best is trial 76 with value: 4.296629174417102.
[I 2023-12-18 22:59:04,102] Trial 184 finished with value: 4.379970278105701 and parameters: {'learning_rate': 0.7169036513914896, 'aft_loss_distribution': 'normal', 'aft_loss_distribution_scale': 1.5586355537689858, 'max_depth': 6, 'booster': 'dart', 'scale_pos_weight': 4.204680366199389, 'alpha': 7.528496449223763, 'lambda': 0.16322562984812117, 'eta': 0.6585825081076102, 'sampling_method': 'uniform', 'subsample': 0.5290070567920441, 'gamma': 5.9152968823931635}. Best is trial 76 with value: 4.296629174417102.
[I 2023-12-18 22:59:04,172] Trial 185 pruned. Trial was pruned at iteration 0.
[I 2023-12-18 22:59:11,784] Trial 186 finished with value: 4.295190482085226 and parameters: {'learning_rate': 0.7615674691231928, 'aft_loss_distribution': 'normal', 'aft_loss_distribution_scale': 1.2702055457489339, 'max_depth': 6, 'booster': 'dart', 'scale_pos_weight': 3.172721958666549, 'alpha': 7.50531139620879, 'lambda': 0.20607247675279816, 'eta': 0.7180649747214047, 'sampling_method': 'uniform', 'subsample': 0.5657056434134896, 'gamma': 6.1896536910897915}. Best is trial 186 with value: 4.295190482085226.
[I 2023-12-18 22:59:13,735] Trial 187 finished with value: inf and parameters: {'learning_rate': 0.7712139409437513, 'aft_loss_distribution': 'normal', 'aft_loss_distribution_scale': 1.1589616964856013, 'max_depth': 6, 'booster': 'dart', 'scale_pos_weight': 1.0126555336871452, 'alpha': 7.486128318304517, 'lambda': 0.016154697918228322, 'eta': 0.6362918877382963, 'sampling_method': 'uniform', 'subsample': 0.5633816150794071, 'gamma': 5.933321606050818}. Best is trial 186 with value: 4.295190482085226.
[I 2023-12-18 22:59:17,929] Trial 188 finished with value: 4.315684608544586 and parameters: {'learning_rate': 0.7507026130569424, 'aft_loss_distribution': 'normal', 'aft_loss_distribution_scale': 1.3508878120186167, 'max_depth': 6, 'booster': 'dart', 'scale_pos_weight': 3.606318895950853, 'alpha': 7.70373026442244, 'lambda': 0.3017376767162823, 'eta': 0.6981421630695643, 'sampling_method': 'uniform', 'subsample': 0.535695955323115, 'gamma': 6.1951475098697335}. Best is trial 186 with value: 4.295190482085226.
[I 2023-12-18 22:59:18,000] Trial 189 pruned. Trial was pruned at iteration 0.
[I 2023-12-18 22:59:21,495] Trial 190 finished with value: 4.309324445630018 and parameters: {'learning_rate': 0.7592078178385724, 'aft_loss_distribution': 'normal', 'aft_loss_distribution_scale': 1.3280191622271253, 'max_depth': 6, 'booster': 'dart', 'scale_pos_weight': 3.191638957723012, 'alpha': 7.035404658947057, 'lambda': 0.37384218475793907, 'eta': 0.7038770800390178, 'sampling_method': 'uniform', 'subsample': 0.5996547680094112, 'gamma': 6.9479450417450765}. Best is trial 186 with value: 4.295190482085226.
[I 2023-12-18 22:59:22,861] Trial 191 finished with value: inf and parameters: {'learning_rate': 0.7581835224021324, 'aft_loss_distribution': 'normal', 'aft_loss_distribution_scale': 1.3283277318858995, 'max_depth': 6, 'booster': 'dart', 'scale_pos_weight': 3.1899052267593064, 'alpha': 7.01507258098111, 'lambda': 0.3913905677021081, 'eta': 0.6986955147357496, 'sampling_method': 'uniform', 'subsample': 0.6023874984640749, 'gamma': 7.262592941265562}. Best is trial 186 with value: 4.295190482085226.
[I 2023-12-18 22:59:32,234] Trial 192 pruned. Trial was pruned at iteration 143.
[I 2023-12-18 22:59:36,742] Trial 193 finished with value: 4.2858693121028555 and parameters: {'learning_rate': 0.7751538482615216, 'aft_loss_distribution': 'normal', 'aft_loss_distribution_scale': 1.2262201886882769, 'max_depth': 6, 'booster': 'dart', 'scale_pos_weight': 3.169029726337782, 'alpha': 7.320875475475537, 'lambda': 0.23109629513380536, 'eta': 0.7480830284521582, 'sampling_method': 'uniform', 'subsample': 0.5775615697482789, 'gamma': 6.148820156858269}. Best is trial 193 with value: 4.2858693121028555.
[I 2023-12-18 22:59:36,817] Trial 194 pruned. Trial was pruned at iteration 0.
[I 2023-12-18 22:59:44,240] Trial 195 finished with value: 4.267796894268609 and parameters: {'learning_rate': 0.7810749039399909, 'aft_loss_distribution': 'normal', 'aft_loss_distribution_scale': 1.1146843299622553, 'max_depth': 6, 'booster': 'dart', 'scale_pos_weight': 2.9870229393351946, 'alpha': 7.115821280014064, 'lambda': 0.19210068768945096, 'eta': 0.7350693499210137, 'sampling_method': 'uniform', 'subsample': 0.6097036722899173, 'gamma': 7.120629515129506}. Best is trial 195 with value: 4.267796894268609.
[I 2023-12-18 22:59:44,310] Trial 196 pruned. Trial was pruned at iteration 0.
[I 2023-12-18 22:59:44,375] Trial 197 pruned. Trial was pruned at iteration 0.
[I 2023-12-18 22:59:51,029] Trial 198 finished with value: 4.277858451266054 and parameters: {'learning_rate': 0.7773507232629597, 'aft_loss_distribution': 'normal', 'aft_loss_distribution_scale': 1.1895982750543483, 'max_depth': 6, 'booster': 'dart', 'scale_pos_weight': 2.585862334671058, 'alpha': 7.427863967520012, 'lambda': 0.9048669787157946, 'eta': 0.7493113334693563, 'sampling_method': 'uniform', 'subsample': 0.5931651359832707, 'gamma': 7.943263614238562}. Best is trial 195 with value: 4.267796894268609.
[I 2023-12-18 22:59:52,896] Trial 199 finished with value: inf and parameters: {'learning_rate': 0.7776164521284554, 'aft_loss_distribution': 'normal', 'aft_loss_distribution_scale': 1.20485777727244, 'max_depth': 6, 'booster': 'dart', 'scale_pos_weight': 2.1274509307459475, 'alpha': 7.41514131791031, 'lambda': 0.9566144603846556, 'eta': 0.7546831431019503, 'sampling_method': 'uniform', 'subsample': 0.5923471132728158, 'gamma': 6.214475826980985}. Best is trial 195 with value: 4.267796894268609.
[I 2023-12-18 22:59:52,968] Trial 200 pruned. Trial was pruned at iteration 0.
[I 2023-12-18 23:00:01,914] Trial 201 finished with value: 4.309920734405682 and parameters: {'learning_rate': 0.7598071161010383, 'aft_loss_distribution': 'normal', 'aft_loss_distribution_scale': 1.3271406528726897, 'max_depth': 6, 'booster': 'dart', 'scale_pos_weight': 2.824227633621034, 'alpha': 7.5468656999571975, 'lambda': 0.764032594357026, 'eta': 0.7950380291218111, 'sampling_method': 'uniform', 'subsample': 0.5727506359645093, 'gamma': 9.199018490217593}. Best is trial 195 with value: 4.267796894268609.
[I 2023-12-18 23:00:04,078] Trial 202 finished with value: inf and parameters: {'learning_rate': 0.7379020844648952, 'aft_loss_distribution': 'normal', 'aft_loss_distribution_scale': 1.3154013544745051, 'max_depth': 6, 'booster': 'dart', 'scale_pos_weight': 2.7161670114295036, 'alpha': 7.844113157352211, 'lambda': 0.3864200804910745, 'eta': 0.8454181093166327, 'sampling_method': 'uniform', 'subsample': 0.5771097342620299, 'gamma': 8.433668415268135}. Best is trial 195 with value: 4.267796894268609.
[I 2023-12-18 23:00:06,533] Trial 203 finished with value: 4.268154992695533 and parameters: {'learning_rate': 0.8453040413735319, 'aft_loss_distribution': 'normal', 'aft_loss_distribution_scale': 1.0129855232878513, 'max_depth': 6, 'booster': 'dart', 'scale_pos_weight': 2.959896953409194, 'alpha': 7.376447243864392, 'lambda': 0.8303535157228041, 'eta': 0.8077831485682704, 'sampling_method': 'uniform', 'subsample': 0.5974458369623472, 'gamma': 8.732866484660065}. Best is trial 195 with value: 4.267796894268609.
[I 2023-12-18 23:00:07,933] Trial 204 finished with value: inf and parameters: {'learning_rate': 0.8216776230832457, 'aft_loss_distribution': 'normal', 'aft_loss_distribution_scale': 1.1217733475092446, 'max_depth': 6, 'booster': 'dart', 'scale_pos_weight': 2.3750484845160487, 'alpha': 7.369403614648396, 'lambda': 0.5934276313016396, 'eta': 0.8024979915527641, 'sampling_method': 'uniform', 'subsample': 0.6123490170659392, 'gamma': 8.961123429355704}. Best is trial 195 with value: 4.267796894268609.
[I 2023-12-18 23:00:09,311] Trial 205 finished with value: inf and parameters: {'learning_rate': 0.8609288231396494, 'aft_loss_distribution': 'normal', 'aft_loss_distribution_scale': 0.8337136208177911, 'max_depth': 6, 'booster': 'dart', 'scale_pos_weight': 2.6075969571362525, 'alpha': 7.544650402175219, 'lambda': 1.2488806709909006, 'eta': 0.8232846243517208, 'sampling_method': 'uniform', 'subsample': 0.5920006591031786, 'gamma': 9.293593714108445}. Best is trial 195 with value: 4.267796894268609.
[I 2023-12-18 23:00:12,532] Trial 206 finished with value: 4.272462157405739 and parameters: {'learning_rate': 0.8499847035470788, 'aft_loss_distribution': 'normal', 'aft_loss_distribution_scale': 0.9774584829306703, 'max_depth': 6, 'booster': 'dart', 'scale_pos_weight': 2.9395106790685857, 'alpha': 6.902153464683144, 'lambda': 0.17021928859982022, 'eta': 0.7734231810368978, 'sampling_method': 'uniform', 'subsample': 0.6458038443051367, 'gamma': 8.8834706467131}. Best is trial 195 with value: 4.267796894268609.
[I 2023-12-18 23:00:14,313] Trial 207 finished with value: inf and parameters: {'learning_rate': 0.8497871876473252, 'aft_loss_distribution': 'normal', 'aft_loss_distribution_scale': 0.9550590199638087, 'max_depth': 6, 'booster': 'dart', 'scale_pos_weight': 2.83124774137696, 'alpha': 6.725281249585338, 'lambda': 0.21807707659844747, 'eta': 0.7836123594123703, 'sampling_method': 'uniform', 'subsample': 0.6244619373023403, 'gamma': 8.92949964177864}. Best is trial 195 with value: 4.267796894268609.
[I 2023-12-18 23:00:17,464] Trial 208 finished with value: 4.269178602475716 and parameters: {'learning_rate': 0.8674020074934385, 'aft_loss_distribution': 'normal', 'aft_loss_distribution_scale': 1.1148074028864376, 'max_depth': 6, 'booster': 'dart', 'scale_pos_weight': 2.953790904559305, 'alpha': 7.006449531048422, 'lambda': 0.11388058701267306, 'eta': 0.8013830450407635, 'sampling_method': 'uniform', 'subsample': 0.6154824339080631, 'gamma': 9.741952661483221}. Best is trial 195 with value: 4.267796894268609.
[I 2023-12-18 23:00:17,532] Trial 209 pruned. Trial was pruned at iteration 0.
[I 2023-12-18 23:00:19,239] Trial 210 finished with value: inf and parameters: {'learning_rate': 0.9057177080050274, 'aft_loss_distribution': 'normal', 'aft_loss_distribution_scale': 1.0632808454563367, 'max_depth': 6, 'booster': 'dart', 'scale_pos_weight': 3.1425975212290633, 'alpha': 7.035330949204263, 'lambda': 0.18738025863504387, 'eta': 0.8021035993776717, 'sampling_method': 'uniform', 'subsample': 0.6413911394247506, 'gamma': 9.978789713729212}. Best is trial 195 with value: 4.267796894268609.
[I 2023-12-18 23:00:43,739] Trial 211 finished with value: 4.298816000663759 and parameters: {'learning_rate': 0.8417055990375794, 'aft_loss_distribution': 'normal', 'aft_loss_distribution_scale': 1.2859414983965616, 'max_depth': 6, 'booster': 'dart', 'scale_pos_weight': 2.5795002387729, 'alpha': 6.856709337079425, 'lambda': 0.39586376943768076, 'eta': 0.7641033103704482, 'sampling_method': 'uniform', 'subsample': 0.6010591541126955, 'gamma': 9.655149020694795}. Best is trial 195 with value: 4.267796894268609.
[I 2023-12-18 23:00:47,725] Trial 212 finished with value: 4.285362120848575 and parameters: {'learning_rate': 0.8743893168142005, 'aft_loss_distribution': 'normal', 'aft_loss_distribution_scale': 1.223457464274724, 'max_depth': 6, 'booster': 'dart', 'scale_pos_weight': 2.6048433760517735, 'alpha': 6.46940660438415, 'lambda': 0.375617543399753, 'eta': 0.769930059840484, 'sampling_method': 'uniform', 'subsample': 0.6167736936492405, 'gamma': 9.555631329688719}. Best is trial 195 with value: 4.267796894268609.
[I 2023-12-18 23:00:49,535] Trial 213 finished with value: inf and parameters: {'learning_rate': 0.874142605683315, 'aft_loss_distribution': 'normal', 'aft_loss_distribution_scale': 1.1763721391339816, 'max_depth': 6, 'booster': 'dart', 'scale_pos_weight': 2.4019772757845774, 'alpha': 6.513042157085312, 'lambda': 0.40983166980895, 'eta': 0.8652797708208461, 'sampling_method': 'uniform', 'subsample': 0.6606030004627865, 'gamma': 9.549400953630352}. Best is trial 195 with value: 4.267796894268609.
[I 2023-12-18 23:00:50,825] Trial 214 finished with value: inf and parameters: {'learning_rate': 0.8945449919902992, 'aft_loss_distribution': 'normal', 'aft_loss_distribution_scale': 0.7674043005512545, 'max_depth': 6, 'booster': 'dart', 'scale_pos_weight': 2.6021157444397516, 'alpha': 6.965866144103494, 'lambda': 0.1676587019264029, 'eta': 0.7708899070308554, 'sampling_method': 'uniform', 'subsample': 0.6109331566450624, 'gamma': 9.689059896299987}. Best is trial 195 with value: 4.267796894268609.
