[I 2023-12-21 04:12:29,690] Trial 162 finished with value: inf and parameters: {'learning_rate': 0.9848200012741326, 'aft_loss_distributi                                                                     on': 'normal', 'aft_loss_distribution_scale': 1.9965349189299362, 'max_depth': 5, 'booster': 'gbtree', 'scale_pos_weight': 0.115476898198                                                                     24347, 'alpha': 5.655926369195836, 'lambda': 2.9428855609764653, 'eta': 0.3468228226854921, 'sampling_method': 'gradient_based', 'subsamp                                                                     le': 0.1568144994516158, 'gamma': 4.01615763802155}. Best is trial 4 with value: 2.031779433856417.
[I 2023-12-21 04:12:29,742] Trial 163 pruned. Trial was pruned at iteration 1.
[I 2023-12-21 04:12:29,887] Trial 164 finished with value: inf and parameters: {'learning_rate': 0.9716162675085702, 'aft_loss_distributi                                                                     on': 'normal', 'aft_loss_distribution_scale': 1.401956638117932, 'max_depth': 5, 'booster': 'gbtree', 'scale_pos_weight': 0.2723182262038                                                                     6836, 'alpha': 5.299136136482715, 'lambda': 6.333378993834616, 'eta': 0.38278563090012374, 'sampling_method': 'gradient_based', 'subsampl                                                                     e': 0.5709221190791635, 'gamma': 4.6946870385427175}. Best is trial 4 with value: 2.031779433856417.
[I 2023-12-21 04:12:29,928] Trial 165 pruned. Trial was pruned at iteration 1.
[I 2023-12-21 04:12:29,966] Trial 166 pruned. Trial was pruned at iteration 0.
[I 2023-12-21 04:12:30,007] Trial 167 pruned. Trial was pruned at iteration 0.
[I 2023-12-21 04:12:30,045] Trial 168 pruned. Trial was pruned at iteration 0.
[I 2023-12-21 04:12:30,085] Trial 169 pruned. Trial was pruned at iteration 0.
[I 2023-12-21 04:12:30,124] Trial 170 pruned. Trial was pruned at iteration 0.
[I 2023-12-21 04:12:30,164] Trial 171 pruned. Trial was pruned at iteration 0.
[I 2023-12-21 04:12:30,203] Trial 172 pruned. Trial was pruned at iteration 0.
[I 2023-12-21 04:12:30,241] Trial 173 pruned. Trial was pruned at iteration 0.
[I 2023-12-21 04:12:30,282] Trial 174 pruned. Trial was pruned at iteration 0.
[I 2023-12-21 04:12:30,322] Trial 175 pruned. Trial was pruned at iteration 0.
[I 2023-12-21 04:12:30,362] Trial 176 pruned. Trial was pruned at iteration 0.
[I 2023-12-21 04:12:30,404] Trial 177 pruned. Trial was pruned at iteration 0.
[I 2023-12-21 04:12:30,442] Trial 178 pruned. Trial was pruned at iteration 0.
[I 2023-12-21 04:12:30,482] Trial 179 pruned. Trial was pruned at iteration 0.
[I 2023-12-21 04:12:30,521] Trial 180 pruned. Trial was pruned at iteration 0.
[I 2023-12-21 04:12:30,560] Trial 181 pruned. Trial was pruned at iteration 0.
[I 2023-12-21 04:12:30,599] Trial 182 pruned. Trial was pruned at iteration 0.
[I 2023-12-21 04:12:30,641] Trial 183 pruned. Trial was pruned at iteration 0.
[I 2023-12-21 04:12:30,681] Trial 184 pruned. Trial was pruned at iteration 0.
[I 2023-12-21 04:12:30,721] Trial 185 pruned. Trial was pruned at iteration 0.
[I 2023-12-21 04:12:30,762] Trial 186 pruned. Trial was pruned at iteration 0.
[I 2023-12-21 04:12:30,801] Trial 187 pruned. Trial was pruned at iteration 0.
[I 2023-12-21 04:12:30,845] Trial 188 pruned. Trial was pruned at iteration 1.
[I 2023-12-21 04:12:30,888] Trial 189 pruned. Trial was pruned at iteration 0.
[I 2023-12-21 04:12:30,929] Trial 190 pruned. Trial was pruned at iteration 0.
[I 2023-12-21 04:12:30,975] Trial 191 pruned. Trial was pruned at iteration 1.
[I 2023-12-21 04:12:31,022] Trial 192 pruned. Trial was pruned at iteration 1.
[I 2023-12-21 04:12:31,069] Trial 193 pruned. Trial was pruned at iteration 1.
[I 2023-12-21 04:12:31,111] Trial 194 pruned. Trial was pruned at iteration 0.
[I 2023-12-21 04:12:31,151] Trial 195 pruned. Trial was pruned at iteration 0.
[I 2023-12-21 04:12:31,193] Trial 196 pruned. Trial was pruned at iteration 0.
[I 2023-12-21 04:12:31,332] Trial 197 finished with value: inf and parameters: {'learning_rate': 0.9971191156118276, 'aft_loss_distributi                                                                     on': 'normal', 'aft_loss_distribution_scale': 2.054112676250615, 'max_depth': 5, 'booster': 'gbtree', 'scale_pos_weight': 0.3300984030979                                                                     065, 'alpha': 9.155750631164334, 'lambda': 2.5937442221127207, 'eta': 0.29178149039853385, 'sampling_method': 'gradient_based', 'subsampl                                                                     e': 0.5673433147287223, 'gamma': 4.52219414979385}. Best is trial 4 with value: 2.031779433856417.
[I 2023-12-21 04:12:31,374] Trial 198 pruned. Trial was pruned at iteration 0.
[I 2023-12-21 04:12:31,413] Trial 199 pruned. Trial was pruned at iteration 0.
[I 2023-12-21 04:12:31,454] Trial 200 pruned. Trial was pruned at iteration 0.
[I 2023-12-21 04:12:31,733] Trial 201 finished with value: inf and parameters: {'learning_rate': 0.9373783183240091, 'aft_loss_distributi                                                                     on': 'normal', 'aft_loss_distribution_scale': 2.5211468253342746, 'max_depth': 7, 'booster': 'gbtree', 'scale_pos_weight': 2.530092178511                                                                     1408, 'alpha': 8.476311507037394, 'lambda': 2.8983297309207297, 'eta': 0.3683403027460566, 'sampling_method': 'gradient_based', 'subsampl                                                                     e': 0.19298119909558062, 'gamma': 0.604768710491133}. Best is trial 4 with value: 2.031779433856417.
[I 2023-12-21 04:12:31,774] Trial 202 pruned. Trial was pruned at iteration 0.
[I 2023-12-21 04:12:31,814] Trial 203 pruned. Trial was pruned at iteration 0.
[I 2023-12-21 04:12:32,082] Trial 204 finished with value: inf and parameters: {'learning_rate': 0.9304399404976329, 'aft_loss_distributi                                                                     on': 'normal', 'aft_loss_distribution_scale': 1.8818319611610737, 'max_depth': 7, 'booster': 'gbtree', 'scale_pos_weight': 2.341221180193                                                                     535, 'alpha': 8.59942417297731, 'lambda': 2.048265835811231, 'eta': 0.3522336096212329, 'sampling_method': 'gradient_based', 'subsample':                                                                      0.20172935775830042, 'gamma': 3.751783503192609}. Best is trial 4 with value: 2.031779433856417.
[I 2023-12-21 04:12:32,123] Trial 205 pruned. Trial was pruned at iteration 0.
[I 2023-12-21 04:12:32,238] Trial 206 finished with value: inf and parameters: {'learning_rate': 0.9789544799875755, 'aft_loss_distributi                                                                     on': 'normal', 'aft_loss_distribution_scale': 2.1821459153022538, 'max_depth': 6, 'booster': 'gbtree', 'scale_pos_weight': 2.608734327113                                                                     2717, 'alpha': 5.436629511934566, 'lambda': 2.329863862429165, 'eta': 0.25704301035819355, 'sampling_method': 'uniform', 'subsample': 0.6                                                                     454227090077614, 'gamma': 8.933266640080923}. Best is trial 4 with value: 2.031779433856417.
[I 2023-12-21 04:12:32,282] Trial 207 pruned. Trial was pruned at iteration 1.
[I 2023-12-21 04:12:32,325] Trial 208 pruned. Trial was pruned at iteration 0.
[I 2023-12-21 04:12:32,365] Trial 209 pruned. Trial was pruned at iteration 0.
[I 2023-12-21 04:12:32,405] Trial 210 pruned. Trial was pruned at iteration 0.
[I 2023-12-21 04:12:32,531] Trial 211 finished with value: inf and parameters: {'learning_rate': 0.9604537287763508, 'aft_loss_distributi                                                                     on': 'normal', 'aft_loss_distribution_scale': 2.1757622218837493, 'max_depth': 6, 'booster': 'gbtree', 'scale_pos_weight': 2.703719579457                                                                     614, 'alpha': 8.973416404558069, 'lambda': 1.3560505668545415, 'eta': 0.30524418304810813, 'sampling_method': 'gradient_based', 'subsampl                                                                     e': 0.5763391610839113, 'gamma': 7.735093305285863}. Best is trial 4 with value: 2.031779433856417.
[I 2023-12-21 04:12:32,662] Trial 212 finished with value: inf and parameters: {'learning_rate': 0.9992951031164736, 'aft_loss_distributi                                                                     on': 'normal', 'aft_loss_distribution_scale': 2.319385210335055, 'max_depth': 6, 'booster': 'gbtree', 'scale_pos_weight': 2.4680037742967                                                                     31, 'alpha': 8.844253958401566, 'lambda': 1.4934466922367946, 'eta': 0.3218804021938235, 'sampling_method': 'gradient_based', 'subsample'                                                                     : 0.5613452311197592, 'gamma': 8.02980878003004}. Best is trial 4 with value: 2.031779433856417.
[I 2023-12-21 04:12:32,702] Trial 213 pruned. Trial was pruned at iteration 0.
[I 2023-12-21 04:12:32,835] Trial 214 finished with value: inf and parameters: {'learning_rate': 0.976768035534271, 'aft_loss_distributio                                                                     n': 'normal', 'aft_loss_distribution_scale': 1.92362510686118, 'max_depth': 6, 'booster': 'gbtree', 'scale_pos_weight': 1.019137922653723                                                                     2, 'alpha': 9.835290630789993, 'lambda': 1.7953156671635493, 'eta': 0.3048308087570465, 'sampling_method': 'gradient_based', 'subsample':                                                                      0.5981159926371882, 'gamma': 7.430549348399553}. Best is trial 4 with value: 2.031779433856417.
[I 2023-12-21 04:12:33,114] Trial 215 finished with value: inf and parameters: {'learning_rate': 0.9398982854525488, 'aft_loss_distributi                                                                     on': 'normal', 'aft_loss_distribution_scale': 1.5603287019379337, 'max_depth': 7, 'booster': 'gbtree', 'scale_pos_weight': 0.262349898686                                                                     55356, 'alpha': 9.622907974280356, 'lambda': 1.4116149668781233, 'eta': 0.3343878733970958, 'sampling_method': 'gradient_based', 'subsamp                                                                     le': 0.16859380885185646, 'gamma': 7.7605619215667385}. Best is trial 4 with value: 2.031779433856417.
[I 2023-12-21 04:12:33,157] Trial 216 pruned. Trial was pruned at iteration 0.
[I 2023-12-21 04:12:33,285] Trial 217 finished with value: inf and parameters: {'learning_rate': 0.9577524413100188, 'aft_loss_distributi                                                                     on': 'normal', 'aft_loss_distribution_scale': 2.291022559052193, 'max_depth': 5, 'booster': 'gbtree', 'scale_pos_weight': 1.1567803124853                                                                     504, 'alpha': 9.080358358267029, 'lambda': 3.9495521625638466, 'eta': 0.02847692729315416, 'sampling_method': 'gradient_based', 'subsampl                                                                     e': 0.8467258284702837, 'gamma': 4.810288780882187}. Best is trial 4 with value: 2.031779433856417.
[I 2023-12-21 04:12:33,327] Trial 218 pruned. Trial was pruned at iteration 0.
[I 2023-12-21 04:12:33,369] Trial 219 pruned. Trial was pruned at iteration 0.
[I 2023-12-21 04:12:33,410] Trial 220 pruned. Trial was pruned at iteration 0.
[I 2023-12-21 04:12:33,453] Trial 221 pruned. Trial was pruned at iteration 0.
[I 2023-12-21 04:12:33,494] Trial 222 pruned. Trial was pruned at iteration 0.
[I 2023-12-21 04:12:33,536] Trial 223 pruned. Trial was pruned at iteration 0.
[I 2023-12-21 04:12:33,577] Trial 224 pruned. Trial was pruned at iteration 0.
[I 2023-12-21 04:12:33,619] Trial 225 pruned. Trial was pruned at iteration 0.
[I 2023-12-21 04:12:33,673] Trial 226 pruned. Trial was pruned at iteration 0.
[I 2023-12-21 04:12:33,717] Trial 227 pruned. Trial was pruned at iteration 0.
[I 2023-12-21 04:12:33,759] Trial 228 pruned. Trial was pruned at iteration 0.
[I 2023-12-21 04:12:33,800] Trial 229 pruned. Trial was pruned at iteration 0.
[I 2023-12-21 04:12:33,842] Trial 230 pruned. Trial was pruned at iteration 0.
[I 2023-12-21 04:12:33,953] Trial 231 finished with value: inf and parameters: {'learning_rate': 0.9827081255218979, 'aft_loss_distributi                                                                     on': 'normal', 'aft_loss_distribution_scale': 2.6974483869417623, 'max_depth': 3, 'booster': 'gbtree', 'scale_pos_weight': 2.153480943209                                                                     887, 'alpha': 7.425976013030581, 'lambda': 1.6416469283494788, 'eta': 0.2634878965170906, 'sampling_method': 'uniform', 'subsample': 0.61                                                                     95787143415685, 'gamma': 9.263587170869316}. Best is trial 4 with value: 2.031779433856417.
[I 2023-12-21 04:12:33,994] Trial 232 pruned. Trial was pruned at iteration 0.
[I 2023-12-21 04:12:34,104] Trial 233 finished with value: inf and parameters: {'learning_rate': 0.9503167209778401, 'aft_loss_distributi                                                                     on': 'normal', 'aft_loss_distribution_scale': 2.4850868331074487, 'max_depth': 3, 'booster': 'gbtree', 'scale_pos_weight': 2.573582144535                                                                     6355, 'alpha': 7.014163388014665, 'lambda': 1.6243337748680677, 'eta': 0.3084494916915931, 'sampling_method': 'uniform', 'subsample': 0.6                                                                     538896494077842, 'gamma': 9.008695592586882}. Best is trial 4 with value: 2.031779433856417.
[I 2023-12-21 04:12:34,146] Trial 234 pruned. Trial was pruned at iteration 0.
[I 2023-12-21 04:12:34,257] Trial 235 finished with value: inf and parameters: {'learning_rate': 0.9999611619417089, 'aft_loss_distributi                                                                     on': 'normal', 'aft_loss_distribution_scale': 2.2650642101688274, 'max_depth': 3, 'booster': 'gbtree', 'scale_pos_weight': 2.360842876499                                                                     6514, 'alpha': 4.781413168973265, 'lambda': 1.3210806983597347, 'eta': 0.27122174912706, 'sampling_method': 'uniform', 'subsample': 0.645                                                                     3562654268918, 'gamma': 9.117673197207441}. Best is trial 4 with value: 2.031779433856417.
[I 2023-12-21 04:12:34,298] Trial 236 pruned. Trial was pruned at iteration 0.
[I 2023-12-21 04:12:34,342] Trial 237 pruned. Trial was pruned at iteration 0.
[I 2023-12-21 04:12:34,383] Trial 238 pruned. Trial was pruned at iteration 0.
[I 2023-12-21 04:12:34,426] Trial 239 pruned. Trial was pruned at iteration 0.
[I 2023-12-21 04:12:34,468] Trial 240 pruned. Trial was pruned at iteration 0.
[I 2023-12-21 04:12:34,510] Trial 241 pruned. Trial was pruned at iteration 0.
[I 2023-12-21 04:12:34,559] Trial 242 pruned. Trial was pruned at iteration 1.
[I 2023-12-21 04:12:34,792] Trial 243 finished with value: inf and parameters: {'learning_rate': 0.9628750605547169, 'aft_loss_distributi                                                                     on': 'normal', 'aft_loss_distribution_scale': 2.118996211073203, 'max_depth': 6, 'booster': 'gbtree', 'scale_pos_weight': 1.8170214816006                                                                     223, 'alpha': 0.960396828037827, 'lambda': 2.175246130134598, 'eta': 0.48851905295449977, 'sampling_method': 'gradient_based', 'subsample                                                                     ': 0.15863985480778417, 'gamma': 7.8836073688682555}. Best is trial 4 with value: 2.031779433856417.
[I 2023-12-21 04:12:34,834] Trial 244 pruned. Trial was pruned at iteration 0.
[I 2023-12-21 04:12:34,876] Trial 245 pruned. Trial was pruned at iteration 0.
[I 2023-12-21 04:12:34,919] Trial 246 pruned. Trial was pruned at iteration 0.
[I 2023-12-21 04:12:34,961] Trial 247 pruned. Trial was pruned at iteration 0.
[I 2023-12-21 04:12:35,003] Trial 248 pruned. Trial was pruned at iteration 0.
[I 2023-12-21 04:12:35,045] Trial 249 pruned. Trial was pruned at iteration 0.
[I 2023-12-21 04:12:35,982] Trial 250 finished with value: inf and parameters: {'learning_rate': 0.9199072849134072, 'aft_loss_distributi                                                                     on': 'normal', 'aft_loss_distribution_scale': 1.9899196259699714, 'max_depth': 3, 'booster': 'dart', 'scale_pos_weight': 1.38291938129685                                                                     , 'alpha': 9.18998181826138, 'lambda': 6.247703898921574, 'eta': 0.4734806602510696, 'sampling_method': 'gradient_based', 'subsample': 0.                                                                     09698154764586808, 'gamma': 9.507967054278105}. Best is trial 4 with value: 2.031779433856417.
[I 2023-12-21 04:12:36,025] Trial 251 pruned. Trial was pruned at iteration 0.
[I 2023-12-21 04:12:36,160] Trial 252 finished with value: inf and parameters: {'learning_rate': 0.9852720840338431, 'aft_loss_distributi                                                                     on': 'normal', 'aft_loss_distribution_scale': 2.260701057267846, 'max_depth': 7, 'booster': 'gbtree', 'scale_pos_weight': 0.5196328278500                                                                     2, 'alpha': 9.439660570747204, 'lambda': 1.3813402380806188, 'eta': 0.3592593535006568, 'sampling_method': 'gradient_based', 'subsample':                                                                      0.5779956336997191, 'gamma': 7.6962888096158935}. Best is trial 4 with value: 2.031779433856417.
[I 2023-12-21 04:12:36,202] Trial 253 pruned. Trial was pruned at iteration 0.
[I 2023-12-21 04:12:36,246] Trial 254 pruned. Trial was pruned at iteration 0.
[I 2023-12-21 04:12:36,296] Trial 255 pruned. Trial was pruned at iteration 1.
[I 2023-12-21 04:12:36,340] Trial 256 pruned. Trial was pruned at iteration 0.
[I 2023-12-21 04:12:36,383] Trial 257 pruned. Trial was pruned at iteration 0.
[I 2023-12-21 04:12:36,428] Trial 258 pruned. Trial was pruned at iteration 0.
[I 2023-12-21 04:12:36,714] Trial 259 finished with value: inf and parameters: {'learning_rate': 0.9992616757763991, 'aft_loss_distributi                                                                     on': 'normal', 'aft_loss_distribution_scale': 2.1689315130148934, 'max_depth': 7, 'booster': 'gbtree', 'scale_pos_weight': 2.656936253722                                                                     9915, 'alpha': 5.266897725368574, 'lambda': 1.7486564422133077, 'eta': 0.05809380457792607, 'sampling_method': 'gradient_based', 'subsamp                                                                     le': 0.1378089045207908, 'gamma': 4.083466283680834}. Best is trial 4 with value: 2.031779433856417.
[I 2023-12-21 04:12:36,757] Trial 260 pruned. Trial was pruned at iteration 0.
[I 2023-12-21 04:12:36,801] Trial 261 pruned. Trial was pruned at iteration 0.
[I 2023-12-21 04:12:36,846] Trial 262 pruned. Trial was pruned at iteration 0.
[I 2023-12-21 04:12:36,889] Trial 263 pruned. Trial was pruned at iteration 0.
[I 2023-12-21 04:12:36,932] Trial 264 pruned. Trial was pruned at iteration 0.
[I 2023-12-21 04:12:36,981] Trial 265 pruned. Trial was pruned at iteration 0.
[I 2023-12-21 04:12:37,024] Trial 266 pruned. Trial was pruned at iteration 0.
[I 2023-12-21 04:12:37,067] Trial 267 pruned. Trial was pruned at iteration 0.
[I 2023-12-21 04:12:37,969] Trial 268 finished with value: inf and parameters: {'learning_rate': 0.9518425652435515, 'aft_loss_distributi                                                                     on': 'normal', 'aft_loss_distribution_scale': 2.2257410215027003, 'max_depth': 7, 'booster': 'dart', 'scale_pos_weight': 3.14050923603108                                                                     25, 'alpha': 6.148786409162536, 'lambda': 5.96272241769606, 'eta': 0.37252937501431604, 'sampling_method': 'gradient_based', 'subsample':                                                                      0.736726469107802, 'gamma': 8.57760999194313}. Best is trial 4 with value: 2.031779433856417.
[I 2023-12-21 04:12:38,013] Trial 269 pruned. Trial was pruned at iteration 0.
[I 2023-12-21 04:12:38,059] Trial 270 pruned. Trial was pruned at iteration 0.
[I 2023-12-21 04:12:38,103] Trial 271 pruned. Trial was pruned at iteration 0.
[I 2023-12-21 04:12:38,150] Trial 272 pruned. Trial was pruned at iteration 0.
[I 2023-12-21 04:12:38,194] Trial 273 pruned. Trial was pruned at iteration 0.
[I 2023-12-21 04:12:38,237] Trial 274 pruned. Trial was pruned at iteration 0.
[I 2023-12-21 04:12:38,283] Trial 275 pruned. Trial was pruned at iteration 1.
[I 2023-12-21 04:12:38,328] Trial 276 pruned. Trial was pruned at iteration 0.
[I 2023-12-21 04:12:38,372] Trial 277 pruned. Trial was pruned at iteration 0.
[I 2023-12-21 04:12:38,417] Trial 278 pruned. Trial was pruned at iteration 0.
[I 2023-12-21 04:12:38,464] Trial 279 pruned. Trial was pruned at iteration 0.
[I 2023-12-21 04:12:38,508] Trial 280 pruned. Trial was pruned at iteration 0.
[I 2023-12-21 04:12:38,552] Trial 281 pruned. Trial was pruned at iteration 0.
[I 2023-12-21 04:12:38,597] Trial 282 pruned. Trial was pruned at iteration 0.
[I 2023-12-21 04:12:38,642] Trial 283 pruned. Trial was pruned at iteration 0.
[I 2023-12-21 04:12:38,686] Trial 284 pruned. Trial was pruned at iteration 0.
[I 2023-12-21 04:12:38,732] Trial 285 pruned. Trial was pruned at iteration 0.
[I 2023-12-21 04:12:38,779] Trial 286 pruned. Trial was pruned at iteration 0.
