[I 2023-12-21 02:58:46,786] Trial 46 finished with value: 4.600466040114204 and parameters: {'learning_rate': 0.5574996826282811, 'aft_lo                                                                     ss_distribution': 'logistic', 'aft_loss_distribution_scale': 1.3702284868158254, 'max_depth': 7, 'booster': 'gbtree', 'scale_pos_weight':                                                                      9.098413722339231, 'alpha': 1.6338195239860607, 'lambda': 5.507422691147452, 'eta': 0.7984439511120736, 'sampling_method': 'gradient_bas                                                                     ed', 'subsample': 0.9302257406837597, 'gamma': 5.106076886426664}. Best is trial 46 with value: 4.600466040114204.
[I 2023-12-21 02:58:46,819] Trial 47 pruned. Trial was pruned at iteration 0.
[I 2023-12-21 02:58:46,984] Trial 48 finished with value: 4.530324099373086 and parameters: {'learning_rate': 0.5590785471206617, 'aft_lo                                                                     ss_distribution': 'logistic', 'aft_loss_distribution_scale': 1.1836303236058865, 'max_depth': 7, 'booster': 'gbtree', 'scale_pos_weight':                                                                      9.526978891151652, 'alpha': 1.696428611907279, 'lambda': 5.697139415230275, 'eta': 0.900143730201882, 'sampling_method': 'gradient_based                                                                     ', 'subsample': 0.6712352338312096, 'gamma': 4.431779780508757}. Best is trial 48 with value: 4.530324099373086.
[I 2023-12-21 02:58:47,020] Trial 49 pruned. Trial was pruned at iteration 0.
[I 2023-12-21 02:58:47,057] Trial 50 pruned. Trial was pruned at iteration 0.
[I 2023-12-21 02:58:47,389] Trial 51 finished with value: 4.902761950279616 and parameters: {'learning_rate': 0.7137729148467746, 'aft_lo                                                                     ss_distribution': 'logistic', 'aft_loss_distribution_scale': 1.9979571552828994, 'max_depth': 7, 'booster': 'gbtree', 'scale_pos_weight':                                                                      9.123372568552675, 'alpha': 2.3551552518753245, 'lambda': 5.0475298934233646, 'eta': 0.7362767010555222, 'sampling_method': 'gradient_ba                                                                     sed', 'subsample': 0.6971084791280702, 'gamma': 5.447692031200861}. Best is trial 48 with value: 4.530324099373086.
[I 2023-12-21 02:58:47,425] Trial 52 pruned. Trial was pruned at iteration 0.
[I 2023-12-21 02:58:47,648] Trial 53 finished with value: 4.610797922214964 and parameters: {'learning_rate': 0.6117645600276815, 'aft_lo                                                                     ss_distribution': 'logistic', 'aft_loss_distribution_scale': 1.3795135533596619, 'max_depth': 7, 'booster': 'gbtree', 'scale_pos_weight':                                                                      9.521551391595073, 'alpha': 1.9089459084907006, 'lambda': 6.412723446725383, 'eta': 0.8411396100151769, 'sampling_method': 'gradient_bas                                                                     ed', 'subsample': 0.6621047359517932, 'gamma': 3.708949580332865}. Best is trial 48 with value: 4.530324099373086.
[I 2023-12-21 02:58:47,682] Trial 54 pruned. Trial was pruned at iteration 0.
[I 2023-12-21 02:58:47,715] Trial 55 pruned. Trial was pruned at iteration 1.
[I 2023-12-21 02:58:47,746] Trial 56 pruned. Trial was pruned at iteration 0.
[I 2023-12-21 02:58:47,863] Trial 57 finished with value: inf and parameters: {'learning_rate': 0.4903491736935795, 'aft_loss_distributio                                                                     n': 'logistic', 'aft_loss_distribution_scale': 1.9089310729492537, 'max_depth': 7, 'booster': 'gbtree', 'scale_pos_weight': 8.89593520868                                                                     2074, 'alpha': 2.628290869243444, 'lambda': 4.109775447375316, 'eta': 0.7593987050922034, 'sampling_method': 'gradient_based', 'subsample                                                                     ': 0.7359016091061868, 'gamma': 4.104607293066183}. Best is trial 48 with value: 4.530324099373086.
[I 2023-12-21 02:58:47,903] Trial 58 pruned. Trial was pruned at iteration 0.
[I 2023-12-21 02:58:47,938] Trial 59 pruned. Trial was pruned at iteration 1.
[I 2023-12-21 02:58:48,064] Trial 60 finished with value: inf and parameters: {'learning_rate': 0.68520173119012, 'aft_loss_distribution'                                                                     : 'normal', 'aft_loss_distribution_scale': 1.2546889084666801, 'max_depth': 6, 'booster': 'gbtree', 'scale_pos_weight': 8.080855760146195                                                                     , 'alpha': 1.4415953188824586, 'lambda': 5.265072811054715, 'eta': 0.26699390321039274, 'sampling_method': 'gradient_based', 'subsample':                                                                      0.8934852983652041, 'gamma': 3.0838994346251267}. Best is trial 48 with value: 4.530324099373086.
[I 2023-12-21 02:58:48,100] Trial 61 pruned. Trial was pruned at iteration 0.
[I 2023-12-21 02:58:48,217] Trial 62 finished with value: inf and parameters: {'learning_rate': 0.6507497874113116, 'aft_loss_distributio                                                                     n': 'logistic', 'aft_loss_distribution_scale': 1.4217944937376255, 'max_depth': 7, 'booster': 'gbtree', 'scale_pos_weight': 9.52979819500                                                                     3115, 'alpha': 3.3083178581966286, 'lambda': 6.523728173394714, 'eta': 0.8958321916508402, 'sampling_method': 'gradient_based', 'subsampl                                                                     e': 0.7799936091153615, 'gamma': 6.5351693946864655}. Best is trial 48 with value: 4.530324099373086.
[I 2023-12-21 02:58:48,251] Trial 63 pruned. Trial was pruned at iteration 0.
[I 2023-12-21 02:58:48,284] Trial 64 pruned. Trial was pruned at iteration 0.
[I 2023-12-21 02:58:48,318] Trial 65 pruned. Trial was pruned at iteration 0.
[I 2023-12-21 02:58:48,354] Trial 66 pruned. Trial was pruned at iteration 1.
[I 2023-12-21 02:58:48,386] Trial 67 pruned. Trial was pruned at iteration 0.
[I 2023-12-21 02:58:48,419] Trial 68 pruned. Trial was pruned at iteration 0.
[I 2023-12-21 02:58:48,562] Trial 69 finished with value: inf and parameters: {'learning_rate': 0.6171209395751998, 'aft_loss_distributio                                                                     n': 'logistic', 'aft_loss_distribution_scale': 1.3799061369486698, 'max_depth': 7, 'booster': 'gbtree', 'scale_pos_weight': 8.89480808276                                                                     9448, 'alpha': 2.8424104644016235, 'lambda': 4.513098115495568, 'eta': 0.753780773783796, 'sampling_method': 'gradient_based', 'subsample                                                                     ': 0.6190180857738907, 'gamma': 1.6590546312073817}. Best is trial 48 with value: 4.530324099373086.
[I 2023-12-21 02:58:48,597] Trial 70 pruned. Trial was pruned at iteration 0.
[I 2023-12-21 02:58:48,739] Trial 71 finished with value: inf and parameters: {'learning_rate': 0.6202059882523023, 'aft_loss_distributio                                                                     n': 'logistic', 'aft_loss_distribution_scale': 1.6640152573538416, 'max_depth': 5, 'booster': 'gbtree', 'scale_pos_weight': 8.35422830080                                                                     0244, 'alpha': 0.9542552054449422, 'lambda': 5.4566008914847135, 'eta': 0.9867731349862431, 'sampling_method': 'gradient_based', 'subsamp                                                                     le': 0.8138315116099829, 'gamma': 3.845140655540348}. Best is trial 48 with value: 4.530324099373086.
[I 2023-12-21 02:58:48,954] Trial 72 finished with value: 4.610316000930117 and parameters: {'learning_rate': 0.6986838508497133, 'aft_lo                                                                     ss_distribution': 'logistic', 'aft_loss_distribution_scale': 1.349130791213623, 'max_depth': 6, 'booster': 'gbtree', 'scale_pos_weight':                                                                      8.485177702680485, 'alpha': 0.5360662690593996, 'lambda': 5.186795312220939, 'eta': 0.9317656078209735, 'sampling_method': 'gradient_base                                                                     d', 'subsample': 0.7869163137359341, 'gamma': 8.553777649169408}. Best is trial 48 with value: 4.530324099373086.
[I 2023-12-21 02:58:48,989] Trial 73 pruned. Trial was pruned at iteration 0.
[I 2023-12-21 02:58:49,032] Trial 74 pruned. Trial was pruned at iteration 1.
[I 2023-12-21 02:58:49,210] Trial 75 finished with value: 4.825381393551761 and parameters: {'learning_rate': 0.7644545139991417, 'aft_lo                                                                     ss_distribution': 'logistic', 'aft_loss_distribution_scale': 1.823684950187449, 'max_depth': 5, 'booster': 'gbtree', 'scale_pos_weight':                                                                      8.631223292844469, 'alpha': 2.146883514053269, 'lambda': 6.43090875623353, 'eta': 0.8142408631173847, 'sampling_method': 'gradient_based'                                                                     , 'subsample': 0.6919859527957822, 'gamma': 4.475861085452364}. Best is trial 48 with value: 4.530324099373086.
[I 2023-12-21 02:58:49,250] Trial 76 pruned. Trial was pruned at iteration 1.
[I 2023-12-21 02:58:49,283] Trial 77 pruned. Trial was pruned at iteration 0.
[I 2023-12-21 02:58:49,316] Trial 78 pruned. Trial was pruned at iteration 0.
[I 2023-12-21 02:58:49,351] Trial 79 pruned. Trial was pruned at iteration 0.
[I 2023-12-21 02:58:49,595] Trial 80 finished with value: 4.838641684656289 and parameters: {'learning_rate': 0.7102434467164542, 'aft_lo                                                                     ss_distribution': 'logistic', 'aft_loss_distribution_scale': 1.8491080459388536, 'max_depth': 7, 'booster': 'gbtree', 'scale_pos_weight':                                                                      9.006503315410919, 'alpha': 0.7868839275070035, 'lambda': 5.56394748449457, 'eta': 0.6655959952119961, 'sampling_method': 'gradient_base                                                                     d', 'subsample': 0.5515038088491031, 'gamma': 5.805382434236842}. Best is trial 48 with value: 4.530324099373086.
[I 2023-12-21 02:58:49,743] Trial 81 finished with value: 4.644483714031343 and parameters: {'learning_rate': 0.6322748293964756, 'aft_lo                                                                     ss_distribution': 'logistic', 'aft_loss_distribution_scale': 1.4434297297360583, 'max_depth': 6, 'booster': 'gbtree', 'scale_pos_weight':                                                                      8.50857337942416, 'alpha': 0.6394136979968617, 'lambda': 5.13845155824912, 'eta': 0.9828620281577929, 'sampling_method': 'gradient_based                                                                     ', 'subsample': 0.7924886833777828, 'gamma': 8.538883335167407}. Best is trial 48 with value: 4.530324099373086.
[I 2023-12-21 02:58:49,871] Trial 82 finished with value: inf and parameters: {'learning_rate': 0.5613738973005848, 'aft_loss_distributio                                                                     n': 'logistic', 'aft_loss_distribution_scale': 1.2320748926297114, 'max_depth': 6, 'booster': 'gbtree', 'scale_pos_weight': 8.74587747178                                                                     78, 'alpha': 0.5143279169822188, 'lambda': 5.212568679564015, 'eta': 0.9387796865442278, 'sampling_method': 'gradient_based', 'subsample'                                                                     : 0.9941501127002226, 'gamma': 8.572065766877246}. Best is trial 48 with value: 4.530324099373086.
[I 2023-12-21 02:58:49,904] Trial 83 pruned. Trial was pruned at iteration 0.
[I 2023-12-21 02:58:50,060] Trial 84 finished with value: 4.694630680638382 and parameters: {'learning_rate': 0.6402029997660101, 'aft_lo                                                                     ss_distribution': 'logistic', 'aft_loss_distribution_scale': 1.5444605458884784, 'max_depth': 7, 'booster': 'gbtree', 'scale_pos_weight':                                                                      9.328607525963516, 'alpha': 1.635369533608161, 'lambda': 6.301896544154425, 'eta': 0.9614627582010632, 'sampling_method': 'gradient_base                                                                     d', 'subsample': 0.9317129998764258, 'gamma': 7.951074025620414}. Best is trial 48 with value: 4.530324099373086.
[I 2023-12-21 02:58:50,097] Trial 85 pruned. Trial was pruned at iteration 0.
[I 2023-12-21 02:58:50,133] Trial 86 pruned. Trial was pruned at iteration 1.
[I 2023-12-21 02:58:50,168] Trial 87 pruned. Trial was pruned at iteration 0.
[I 2023-12-21 02:58:50,204] Trial 88 pruned. Trial was pruned at iteration 0.
[I 2023-12-21 02:58:50,541] Trial 89 finished with value: 4.790232927938937 and parameters: {'learning_rate': 0.5154909933280634, 'aft_lo                                                                     ss_distribution': 'logistic', 'aft_loss_distribution_scale': 1.7531869569438485, 'max_depth': 8, 'booster': 'gbtree', 'scale_pos_weight':                                                                      9.10941114637778, 'alpha': 2.3539641067945887, 'lambda': 6.233707306410407, 'eta': 0.09003254156289398, 'sampling_method': 'gradient_bas                                                                     ed', 'subsample': 0.6293124457345537, 'gamma': 3.389817257088324}. Best is trial 48 with value: 4.530324099373086.
[I 2023-12-21 02:58:50,577] Trial 90 pruned. Trial was pruned at iteration 1.
[I 2023-12-21 02:58:50,690] Trial 91 finished with value: inf and parameters: {'learning_rate': 0.645739163737652, 'aft_loss_distribution                                                                     ': 'logistic', 'aft_loss_distribution_scale': 1.4759686845555882, 'max_depth': 7, 'booster': 'gbtree', 'scale_pos_weight': 9.313000295447                                                                     75, 'alpha': 1.6416650071908492, 'lambda': 6.363342325785469, 'eta': 0.96125022252416, 'sampling_method': 'gradient_based', 'subsample':                                                                      0.9440221812804619, 'gamma': 7.2733047765740135}. Best is trial 48 with value: 4.530324099373086.
[I 2023-12-21 02:58:50,804] Trial 92 finished with value: inf and parameters: {'learning_rate': 0.5895789025904934, 'aft_loss_distributio                                                                     n': 'logistic', 'aft_loss_distribution_scale': 1.4870039150513465, 'max_depth': 7, 'booster': 'gbtree', 'scale_pos_weight': 9.27341459769                                                                     7201, 'alpha': 1.9670802493279422, 'lambda': 5.4236606830750596, 'eta': 0.9452112440042595, 'sampling_method': 'gradient_based', 'subsamp                                                                     le': 0.9110114592852547, 'gamma': 7.931910360145544}. Best is trial 48 with value: 4.530324099373086.
[I 2023-12-21 02:58:50,839] Trial 93 pruned. Trial was pruned at iteration 0.
[I 2023-12-21 02:58:50,881] Trial 94 pruned. Trial was pruned at iteration 0.
[I 2023-12-21 02:58:50,991] Trial 95 finished with value: inf and parameters: {'learning_rate': 0.7134019137438783, 'aft_loss_distributio                                                                     n': 'logistic', 'aft_loss_distribution_scale': 1.6376991045969116, 'max_depth': 6, 'booster': 'gbtree', 'scale_pos_weight': 9.00616297170                                                                     1428, 'alpha': 0.9971122674736757, 'lambda': 6.554696876893432, 'eta': 0.9687171798814824, 'sampling_method': 'gradient_based', 'subsampl                                                                     e': 0.962558639519308, 'gamma': 6.213867658612575}. Best is trial 48 with value: 4.530324099373086.
[I 2023-12-21 02:58:51,177] Trial 96 finished with value: 4.516385517693994 and parameters: {'learning_rate': 0.7773208414188884, 'aft_lo                                                                     ss_distribution': 'normal', 'aft_loss_distribution_scale': 1.9840790828682457, 'max_depth': 7, 'booster': 'gbtree', 'scale_pos_weight': 9                                                                     .335676127295315, 'alpha': 2.6339464468903158, 'lambda': 5.605411055406829, 'eta': 0.9809125729515109, 'sampling_method': 'gradient_based                                                                     ', 'subsample': 0.783464576762119, 'gamma': 4.583250052416042}. Best is trial 96 with value: 4.516385517693994.
[I 2023-12-21 02:58:51,217] Trial 97 pruned. Trial was pruned at iteration 0.
[I 2023-12-21 02:58:51,345] Trial 98 finished with value: inf and parameters: {'learning_rate': 0.7570487189741026, 'aft_loss_distributio                                                                     n': 'normal', 'aft_loss_distribution_scale': 2.0154820891234193, 'max_depth': 8, 'booster': 'gbtree', 'scale_pos_weight': 9.1039665130841                                                                     69, 'alpha': 3.9621490176177394, 'lambda': 5.790613611311108, 'eta': 0.9039188560713184, 'sampling_method': 'gradient_based', 'subsample'                                                                     : 0.6128221615756679, 'gamma': 4.963788852923335}. Best is trial 96 with value: 4.516385517693994.
[I 2023-12-21 02:58:51,489] Trial 99 finished with value: inf and parameters: {'learning_rate': 0.7850469320088489, 'aft_loss_distributio                                                                     n': 'normal', 'aft_loss_distribution_scale': 1.0485043779973502, 'max_depth': 7, 'booster': 'gbtree', 'scale_pos_weight': 4.4155309353813                                                                     355, 'alpha': 2.1798821338227894, 'lambda': 0.5565335398891991, 'eta': 0.9377129637614807, 'sampling_method': 'gradient_based', 'subsampl                                                                     e': 0.6451655913860006, 'gamma': 3.991848226371765}. Best is trial 96 with value: 4.516385517693994.
[I 2023-12-21 02:58:51,524] Trial 100 pruned. Trial was pruned at iteration 0.
[I 2023-12-21 02:58:51,720] Trial 101 finished with value: 4.62293301480338 and parameters: {'learning_rate': 0.5783910604510003, 'aft_lo                                                                     ss_distribution': 'logistic', 'aft_loss_distribution_scale': 1.4091542982543561, 'max_depth': 7, 'booster': 'gbtree', 'scale_pos_weight':                                                                      9.315727565783147, 'alpha': 1.781050190374235, 'lambda': 6.9785731169816145, 'eta': 0.9563120805546322, 'sampling_method': 'gradient_bas                                                                     ed', 'subsample': 0.7922493235592145, 'gamma': 8.325439019994498}. Best is trial 96 with value: 4.516385517693994.
[I 2023-12-21 02:58:51,968] Trial 102 finished with value: 4.6298001866554115 and parameters: {'learning_rate': 0.524589530861026, 'aft_l                                                                     oss_distribution': 'normal', 'aft_loss_distribution_scale': 2.3089495043491746, 'max_depth': 7, 'booster': 'gbtree', 'scale_pos_weight':                                                                      8.685067509519298, 'alpha': 3.217276857404887, 'lambda': 7.748950006006443, 'eta': 0.8606463285191753, 'sampling_method': 'gradient_based                                                                     ', 'subsample': 0.788425084351484, 'gamma': 8.808463369182434}. Best is trial 96 with value: 4.516385517693994.
[I 2023-12-21 02:58:52,165] Trial 103 finished with value: 4.4798161565588455 and parameters: {'learning_rate': 0.5710677425557629, 'aft_                                                                     loss_distribution': 'normal', 'aft_loss_distribution_scale': 1.885848734741051, 'max_depth': 7, 'booster': 'gbtree', 'scale_pos_weight':                                                                      8.83509535521831, 'alpha': 3.2074064275953864, 'lambda': 7.800757104737425, 'eta': 0.9844159084413576, 'sampling_method': 'gradient_based                                                                     ', 'subsample': 0.7934468434960131, 'gamma': 8.866618294175455}. Best is trial 103 with value: 4.4798161565588455.
[I 2023-12-21 02:58:52,199] Trial 104 pruned. Trial was pruned at iteration 0.
[I 2023-12-21 02:58:52,338] Trial 105 finished with value: 4.46801687355329 and parameters: {'learning_rate': 0.525435787467226, 'aft_los                                                                     s_distribution': 'normal', 'aft_loss_distribution_scale': 1.8549182379509332, 'max_depth': 7, 'booster': 'gbtree', 'scale_pos_weight': 8.                                                                     221374371289278, 'alpha': 0.6042326585038963, 'lambda': 7.414084519585377, 'eta': 0.9228619567004848, 'sampling_method': 'gradient_based'                                                                     , 'subsample': 0.7926585428133816, 'gamma': 8.351095003401388}. Best is trial 105 with value: 4.46801687355329.
[I 2023-12-21 02:58:52,374] Trial 106 pruned. Trial was pruned at iteration 1.
