[I 2023-12-21 04:18:03,944] Trial 249 pruned. Trial was pruned at iteration 0.
Completed hyperparameter tuning with best aft-nloglik = 1.9087597009825021.
Re-running the best trial... params = {'verbosity': 0, 'objective': 'survival:aft', 'eval_metric': 'aft-nloglik', 'tree_method': 'gpu_hist', 'device': 'cuda', 'learning_rate': 0.4176544460739925, 'aft_loss_distribution': 'normal', 'aft_loss_distribution_scale': 1.6149468068113173, 'max_depth': 4, 'booster': 'gbtree', 'scale_pos_weight': 2.517926446232347, 'alpha': 5.8550120241898576, 'lambda': 4.265690149118722, 'eta': 0.4656870091093942, 'sampling_method': 'gradient_based', 'subsample': 0.5479135298664596, 'gamma': 8.890777216827468}
[W 2023-12-21 04:18:05,201] Trial 0 is omitted in visualization because its objective value is inf or nan.
[W 2023-12-21 04:18:05,204] Trial 1 is omitted in visualization because its objective value is inf or nan.
[W 2023-12-21 04:18:05,209] Trial 2 is omitted in visualization because its objective value is inf or nan.
[W 2023-12-21 04:18:05,216] Trial 3 is omitted in visualization because its objective value is inf or nan.
[W 2023-12-21 04:18:05,217] Trial 4 is omitted in visualization because its objective value is inf or nan.
[W 2023-12-21 04:18:05,218] Trial 6 is omitted in visualization because its objective value is inf or nan.
[W 2023-12-21 04:18:05,219] Trial 9 is omitted in visualization because its objective value is inf or nan.
[W 2023-12-21 04:18:05,220] Trial 21 is omitted in visualization because its objective value is inf or nan.
[W 2023-12-21 04:18:05,221] Trial 23 is omitted in visualization because its objective value is inf or nan.
[W 2023-12-21 04:18:05,221] Trial 37 is omitted in visualization because its objective value is inf or nan.
[W 2023-12-21 04:18:05,222] Trial 56 is omitted in visualization because its objective value is inf or nan.
[W 2023-12-21 04:18:05,223] Trial 58 is omitted in visualization because its objective value is inf or nan.
[W 2023-12-21 04:18:05,224] Trial 65 is omitted in visualization because its objective value is inf or nan.
[W 2023-12-21 04:18:05,225] Trial 66 is omitted in visualization because its objective value is inf or nan.
[W 2023-12-21 04:18:05,225] Trial 84 is omitted in visualization because its objective value is inf or nan.
[W 2023-12-21 04:18:05,226] Trial 86 is omitted in visualization because its objective value is inf or nan.
[W 2023-12-21 04:18:05,227] Trial 102 is omitted in visualization because its objective value is inf or nan.
[W 2023-12-21 04:18:05,228] Trial 125 is omitted in visualization because its objective value is inf or nan.
[W 2023-12-21 04:18:05,229] Trial 126 is omitted in visualization because its objective value is inf or nan.
[W 2023-12-21 04:18:05,230] Trial 141 is omitted in visualization because its objective value is inf or nan.
[W 2023-12-21 04:18:05,231] Trial 142 is omitted in visualization because its objective value is inf or nan.
[W 2023-12-21 04:18:05,232] Trial 143 is omitted in visualization because its objective value is inf or nan.
[W 2023-12-21 04:18:05,232] Trial 145 is omitted in visualization because its objective value is inf or nan.
[W 2023-12-21 04:18:05,233] Trial 162 is omitted in visualization because its objective value is inf or nan.
[W 2023-12-21 04:18:05,234] Trial 171 is omitted in visualization because its objective value is inf or nan.
[W 2023-12-21 04:18:05,235] Trial 172 is omitted in visualization because its objective value is inf or nan.
[W 2023-12-21 04:18:05,236] Trial 173 is omitted in visualization because its objective value is inf or nan.
[W 2023-12-21 04:18:05,237] Trial 175 is omitted in visualization because its objective value is inf or nan.
[W 2023-12-21 04:18:05,237] Trial 187 is omitted in visualization because its objective value is inf or nan.
[W 2023-12-21 04:18:05,238] Trial 191 is omitted in visualization because its objective value is inf or nan.
[W 2023-12-21 04:18:05,239] Trial 193 is omitted in visualization because its objective value is inf or nan.
[W 2023-12-21 04:18:05,240] Trial 197 is omitted in visualization because its objective value is inf or nan.
[W 2023-12-21 04:18:05,241] Trial 202 is omitted in visualization because its objective value is inf or nan.
[W 2023-12-21 04:18:05,242] Trial 204 is omitted in visualization because its objective value is inf or nan.
[W 2023-12-21 04:18:05,243] Trial 210 is omitted in visualization because its objective value is inf or nan.
[W 2023-12-21 04:18:05,243] Trial 211 is omitted in visualization because its objective value is inf or nan.
[W 2023-12-21 04:18:05,244] Trial 212 is omitted in visualization because its objective value is inf or nan.
[W 2023-12-21 04:18:05,245] Trial 213 is omitted in visualization because its objective value is inf or nan.
[W 2023-12-21 04:18:05,246] Trial 214 is omitted in visualization because its objective value is inf or nan.
[W 2023-12-21 04:18:05,247] Trial 243 is omitted in visualization because its objective value is inf or nan.
[W 2023-12-21 04:18:05,248] Trial 244 is omitted in visualization because its objective value is inf or nan.
[W 2023-12-21 04:18:05,249] Trial 248 is omitted in visualization because its objective value is inf or nan.
TRN1 | R2:0.573; p:0.0 | C:85.41 |3h:0.955 |6h:0.944 |9h:0.935 |12h:0.735 |15h:0.735 |18h:0.731 |24h:0.577 |48h:0.568 |72h:0.562 |1wk:0.383 |2wks:0.378 |1mon:0.317 |
TRN2 | R2:0.298; p:7.061e-66 | C:69.20 |3h:0.955 |6h:0.944 |9h:0.936 |12h:0.732 |15h:0.732 |18h:0.728 |24h:0.571 |48h:0.562 |72h:0.557 |1wk:0.369 |2wks:0.373 |1mon:0.319 |
VAL | R2:0.291; p:6.291e-63 | C:68.95 |3h:0.955 |6h:0.944 |9h:0.935 |12h:0.732 |15h:0.732 |18h:0.728 |24h:0.574 |48h:0.565 |72h:0.558 |1wk:0.377 |2wks:0.372 |1mon:0.305 |
TST | R2:0.225; p:2.426e-222 | C:63.73 |3h:0.953 |6h:0.938 |9h:0.928 |12h:0.726 |15h:0.726 |18h:0.710 |24h:0.439 |48h:0.436 |72h:0.434 |1wk:0.342 |2wks:0.353 |1mon:0.312 |
/content/drive/MyDrive/intermediates2/res//outcome2_xgb-aft_inp19_all.json
