(tf2.15) [lisat@ng31201 lisat]$ [I 2023-12-21 02:33:16,980] Trial 0 finished with value: 5.897191855410308 and parameters: {'learning_rat                                                                     e': 0.21959926898865606, 'aft_loss_distribution': 'logistic', 'aft_loss_distribution_scale': 5.990434099202769, 'max_depth': 3, 'booster'                                                                     : 'dart', 'scale_pos_weight': 8.280479541603047, 'alpha': 5.259362582116596, 'lambda': 9.319584862770927, 'eta': 0.1383696530280777, 'sam                                                                     pling_method': 'uniform', 'subsample': 0.4382780075431281, 'gamma': 2.7615346222615464}. Best is trial 0 with value: 5.897191855410308.
[I 2023-12-21 02:33:17,188] Trial 1 finished with value: 5.9128078989980954 and parameters: {'learning_rate': 0.608963333210156, 'aft_los                                                                     s_distribution': 'normal', 'aft_loss_distribution_scale': 9.735753668855583, 'max_depth': 5, 'booster': 'gbtree', 'scale_pos_weight': 2.7                                                                     100871018299184, 'alpha': 6.156026614085296, 'lambda': 7.247212429946867, 'eta': 0.62115914182622, 'sampling_method': 'uniform', 'subsamp                                                                     le': 0.4749422118771909, 'gamma': 6.931971021205223}. Best is trial 0 with value: 5.897191855410308.
[I 2023-12-21 02:33:21,160] Trial 2 finished with value: 6.003359854428943 and parameters: {'learning_rate': 0.7767387555314237, 'aft_los                                                                     s_distribution': 'extreme', 'aft_loss_distribution_scale': 9.727704911660933, 'max_depth': 8, 'booster': 'dart', 'scale_pos_weight': 3.04                                                                     95728527564827, 'alpha': 3.5622447152602135, 'lambda': 8.799944469159248, 'eta': 0.08610115433262899, 'sampling_method': 'uniform', 'subs                                                                     ample': 0.8238629734247483, 'gamma': 9.181129057083824}. Best is trial 0 with value: 5.897191855410308.
[I 2023-12-21 02:33:22,155] Trial 3 finished with value: inf and parameters: {'learning_rate': 0.9022006514248985, 'aft_loss_distribution                                                                     ': 'logistic', 'aft_loss_distribution_scale': 0.7869598462170065, 'max_depth': 7, 'booster': 'dart', 'scale_pos_weight': 9.08435513415790                                                                     7, 'alpha': 7.982782696443907, 'lambda': 7.5777333826806235, 'eta': 0.6017564992162708, 'sampling_method': 'gradient_based', 'subsample':                                                                      0.49782089990634193, 'gamma': 8.990382268770354}. Best is trial 0 with value: 5.897191855410308.
[I 2023-12-21 02:33:22,260] Trial 4 finished with value: 5.986608045793763 and parameters: {'learning_rate': 0.42592908371343674, 'aft_lo                                                                     ss_distribution': 'logistic', 'aft_loss_distribution_scale': 6.589428805589574, 'max_depth': 3, 'booster': 'gbtree', 'scale_pos_weight':                                                                      6.318004717467432, 'alpha': 2.4883556936976254, 'lambda': 2.40672822392166, 'eta': 0.8437553242030151, 'sampling_method': 'gradient_based                                                                     ', 'subsample': 0.8152646149837501, 'gamma': 8.84395302194382}. Best is trial 0 with value: 5.897191855410308.
[I 2023-12-21 02:33:23,339] Trial 5 finished with value: 4.714904448868725 and parameters: {'learning_rate': 0.03598471052440777, 'aft_lo                                                                     ss_distribution': 'logistic', 'aft_loss_distribution_scale': 1.5754100003093838, 'max_depth': 4, 'booster': 'gbtree', 'scale_pos_weight':                                                                      9.258503064541873, 'alpha': 6.626205491384914, 'lambda': 4.50439858506938, 'eta': 0.3034666463493414, 'sampling_method': 'gradient_based                                                                     ', 'subsample': 0.9038337172782825, 'gamma': 4.815878560288813}. Best is trial 5 with value: 4.714904448868725.
[I 2023-12-21 02:33:23,345] Trial 6 pruned. Trial was pruned at iteration 0.
[I 2023-12-21 02:33:27,988] Trial 7 finished with value: 4.755777187830307 and parameters: {'learning_rate': 0.3528091738427706, 'aft_los                                                                     s_distribution': 'logistic', 'aft_loss_distribution_scale': 1.6595872076563114, 'max_depth': 6, 'booster': 'dart', 'scale_pos_weight': 5.                                                                     43986612431532, 'alpha': 3.975201002508686, 'lambda': 2.7840886540983267, 'eta': 0.7833720594787602, 'sampling_method': 'uniform', 'subsa                                                                     mple': 0.781043067684192, 'gamma': 9.215788524793224}. Best is trial 5 with value: 4.714904448868725.
[I 2023-12-21 02:33:32,037] Trial 8 pruned. Trial was pruned at iteration 111.
[I 2023-12-21 02:33:36,125] Trial 9 pruned. Trial was pruned at iteration 111.
[I 2023-12-21 02:33:36,554] Trial 10 finished with value: 5.045033427108164 and parameters: {'learning_rate': 0.08272027980354235, 'aft_l                                                                     oss_distribution': 'extreme', 'aft_loss_distribution_scale': 3.402362775260536, 'max_depth': 4, 'booster': 'gbtree', 'scale_pos_weight':                                                                      6.539628630050889, 'alpha': 9.667830870110269, 'lambda': 5.11769652860617, 'eta': 0.33731709868349125, 'sampling_method': 'gradient_based                                                                     ', 'subsample': 0.1298653821678038, 'gamma': 0.7855014408279963}. Best is trial 5 with value: 4.714904448868725.
[I 2023-12-21 02:33:36,586] Trial 11 pruned. Trial was pruned at iteration 0.
[I 2023-12-21 02:33:36,758] Trial 12 pruned. Trial was pruned at iteration 111.
[I 2023-12-21 02:33:36,929] Trial 13 pruned. Trial was pruned at iteration 111.
[I 2023-12-21 02:33:42,368] Trial 14 finished with value: 4.760256574793714 and parameters: {'learning_rate': 0.16254524867421688, 'aft_l                                                                     oss_distribution': 'logistic', 'aft_loss_distribution_scale': 1.6687556773862169, 'max_depth': 4, 'booster': 'dart', 'scale_pos_weight':                                                                      4.4947022458043335, 'alpha': 7.18873896450928, 'lambda': 4.836740227748782, 'eta': 0.39458876891602906, 'sampling_method': 'uniform', 'su                                                                     bsample': 0.6832208674799017, 'gamma': 7.417815119726844}. Best is trial 5 with value: 4.714904448868725.
[I 2023-12-21 02:33:42,530] Trial 15 pruned. Trial was pruned at iteration 85.
[I 2023-12-21 02:33:42,564] Trial 16 pruned. Trial was pruned at iteration 0.
[I 2023-12-21 02:33:42,697] Trial 17 pruned. Trial was pruned at iteration 85.
[I 2023-12-21 02:33:42,862] Trial 18 finished with value: 5.164283553371269 and parameters: {'learning_rate': 0.36281629729253695, 'aft_l                                                                     oss_distribution': 'normal', 'aft_loss_distribution_scale': 4.331165719331937, 'max_depth': 6, 'booster': 'gbtree', 'scale_pos_weight': 2                                                                     .9668414734473143, 'alpha': 6.995722225440349, 'lambda': 3.610089541947531, 'eta': 0.00945050251371693, 'sampling_method': 'gradient_base                                                                     d', 'subsample': 0.3686174607467996, 'gamma': 1.160443484232914}. Best is trial 5 with value: 4.714904448868725.
[I 2023-12-21 02:33:42,893] Trial 19 pruned. Trial was pruned at iteration 0.
[I 2023-12-21 02:33:42,927] Trial 20 pruned. Trial was pruned at iteration 3.
[I 2023-12-21 02:33:46,924] Trial 21 pruned. Trial was pruned at iteration 111.
[I 2023-12-21 02:33:54,606] Trial 22 finished with value: 4.743395917287919 and parameters: {'learning_rate': 0.1344419092318395, 'aft_lo                                                                     ss_distribution': 'logistic', 'aft_loss_distribution_scale': 1.6334962575323932, 'max_depth': 4, 'booster': 'dart', 'scale_pos_weight': 3                                                                     .699393236046017, 'alpha': 6.8706088636099425, 'lambda': 2.527701787067583, 'eta': 0.28582866783048066, 'sampling_method': 'uniform', 'su                                                                     bsample': 0.6976448256325894, 'gamma': 7.802213767672154}. Best is trial 5 with value: 4.714904448868725.
[I 2023-12-21 02:33:54,656] Trial 23 pruned. Trial was pruned at iteration 5.
[I 2023-12-21 02:33:58,542] Trial 24 finished with value: 4.589107108495218 and parameters: {'learning_rate': 0.3102379255378292, 'aft_lo                                                                     ss_distribution': 'logistic', 'aft_loss_distribution_scale': 1.330100166024783, 'max_depth': 5, 'booster': 'dart', 'scale_pos_weight': 1.                                                                     5252898737194829, 'alpha': 6.374222142566546, 'lambda': 0.07548826389564134, 'eta': 0.5123266785357325, 'sampling_method': 'uniform', 'su                                                                     bsample': 0.776696297276411, 'gamma': 8.319307246733374}. Best is trial 24 with value: 4.589107108495218.
[I 2023-12-21 02:34:09,294] Trial 25 finished with value: 4.478504952982516 and parameters: {'learning_rate': 0.24553858655039074, 'aft_l                                                                     oss_distribution': 'logistic', 'aft_loss_distribution_scale': 1.1172399997919524, 'max_depth': 5, 'booster': 'dart', 'scale_pos_weight':                                                                      1.7416381539688588, 'alpha': 6.426597194409926, 'lambda': 0.45063678727778456, 'eta': 0.5164619351544663, 'sampling_method': 'uniform', '                                                                     subsample': 0.7258940219487221, 'gamma': 5.871503579913169}. Best is trial 25 with value: 4.478504952982516.
[I 2023-12-21 02:34:10,585] Trial 26 finished with value: inf and parameters: {'learning_rate': 0.24173641645114688, 'aft_loss_distributi                                                                     on': 'logistic', 'aft_loss_distribution_scale': 0.8753734877835346, 'max_depth': 5, 'booster': 'dart', 'scale_pos_weight': 1.478256856898                                                                     51, 'alpha': 6.186523906586371, 'lambda': 0.14989711977202447, 'eta': 0.4789992514837789, 'sampling_method': 'gradient_based', 'subsample                                                                     ': 0.31236146844909846, 'gamma': 5.446427903655313}. Best is trial 25 with value: 4.478504952982516.
[I 2023-12-21 02:34:10,616] Trial 27 pruned. Trial was pruned at iteration 0.
[I 2023-12-21 02:34:10,870] Trial 28 finished with value: 4.7209123769253365 and parameters: {'learning_rate': 0.30040088710666857, 'aft_                                                                     loss_distribution': 'normal', 'aft_loss_distribution_scale': 2.5742670000530077, 'max_depth': 7, 'booster': 'gbtree', 'scale_pos_weight':                                                                      0.341370705173089, 'alpha': 8.808790701080746, 'lambda': 0.9776551621928911, 'eta': 0.6653908109429498, 'sampling_method': 'gradient_bas                                                                     ed', 'subsample': 0.9944055150637705, 'gamma': 5.97235331569869}. Best is trial 25 with value: 4.478504952982516.
[I 2023-12-21 02:34:10,902] Trial 29 pruned. Trial was pruned at iteration 0.
[I 2023-12-21 02:34:10,934] Trial 30 pruned. Trial was pruned at iteration 0.
[I 2023-12-21 02:34:11,091] Trial 31 finished with value: 4.690288949340128 and parameters: {'learning_rate': 0.346576918227218, 'aft_los                                                                     s_distribution': 'normal', 'aft_loss_distribution_scale': 2.4756820450626975, 'max_depth': 7, 'booster': 'gbtree', 'scale_pos_weight': 0.                                                                     17954831304599342, 'alpha': 8.71845679721671, 'lambda': 0.8246997201455784, 'eta': 0.6760747194179005, 'sampling_method': 'gradient_based                                                                     ', 'subsample': 0.9875163683321557, 'gamma': 6.279914651213152}. Best is trial 25 with value: 4.478504952982516.
[I 2023-12-21 02:34:11,122] Trial 32 pruned. Trial was pruned at iteration 0.
[I 2023-12-21 02:34:11,492] Trial 33 finished with value: 4.64770329099398 and parameters: {'learning_rate': 0.44398634510984564, 'aft_lo                                                                     ss_distribution': 'normal', 'aft_loss_distribution_scale': 2.3438158499134762, 'max_depth': 8, 'booster': 'gbtree', 'scale_pos_weight': 2                                                                     .114790647168036, 'alpha': 8.531289287512383, 'lambda': 0.7379552228856143, 'eta': 0.6152529828326183, 'sampling_method': 'gradient_based                                                                     ', 'subsample': 0.8395239596334694, 'gamma': 4.927327191535598}. Best is trial 25 with value: 4.478504952982516.
[I 2023-12-21 02:34:11,673] Trial 34 finished with value: 4.616981960718526 and parameters: {'learning_rate': 0.4499841126529881, 'aft_lo                                                                     ss_distribution': 'normal', 'aft_loss_distribution_scale': 2.2479744997299567, 'max_depth': 8, 'booster': 'gbtree', 'scale_pos_weight': 2                                                                     .2709423374314643, 'alpha': 8.74600144558836, 'lambda': 0.674483415971804, 'eta': 0.6402708684222592, 'sampling_method': 'gradient_based'                                                                     , 'subsample': 0.8292373578381199, 'gamma': 6.424374761752064}. Best is trial 25 with value: 4.478504952982516.
[I 2023-12-21 02:34:11,709] Trial 35 pruned. Trial was pruned at iteration 0.
[I 2023-12-21 02:34:11,746] Trial 36 pruned. Trial was pruned at iteration 4.
[I 2023-12-21 02:34:11,945] Trial 37 finished with value: 4.589133166295767 and parameters: {'learning_rate': 0.6797569163947393, 'aft_lo                                                                     ss_distribution': 'normal', 'aft_loss_distribution_scale': 2.1644714220408146, 'max_depth': 9, 'booster': 'gbtree', 'scale_pos_weight': 0                                                                     .9176269560385315, 'alpha': 8.233907005541957, 'lambda': 1.2753900954112813, 'eta': 0.5780676697130013, 'sampling_method': 'uniform', 'su                                                                     bsample': 0.8275178168153018, 'gamma': 6.7694719639557634}. Best is trial 25 with value: 4.478504952982516.
[I 2023-12-21 02:34:12,970] Trial 38 finished with value: inf and parameters: {'learning_rate': 0.7538959619775822, 'aft_loss_distributio                                                                     n': 'normal', 'aft_loss_distribution_scale': 1.0994554344671488, 'max_depth': 9, 'booster': 'dart', 'scale_pos_weight': 1.154340016593432                                                                     3, 'alpha': 7.552603100306907, 'lambda': 2.041099913393567, 'eta': 0.5444012386566127, 'sampling_method': 'uniform', 'subsample': 0.46081                                                                     259966630317, 'gamma': 6.961970423661617}. Best is trial 25 with value: 4.478504952982516.
[I 2023-12-21 02:34:15,437] Trial 39 finished with value: 4.394413518676669 and parameters: {'learning_rate': 0.6563766650180883, 'aft_lo                                                                     ss_distribution': 'normal', 'aft_loss_distribution_scale': 1.594500800446519, 'max_depth': 10, 'booster': 'dart', 'scale_pos_weight': 3.2                                                                     997603190729263, 'alpha': 5.954421788131341, 'lambda': 1.3471014936830432, 'eta': 0.5633314037208689, 'sampling_method': 'uniform', 'subs                                                                     ample': 0.7993185053930781, 'gamma': 8.501949376330963}. Best is trial 39 with value: 4.394413518676669.
[I 2023-12-21 02:34:15,472] Trial 40 pruned. Trial was pruned at iteration 0.
[I 2023-12-21 02:34:16,485] Trial 41 finished with value: inf and parameters: {'learning_rate': 0.852123616480833, 'aft_loss_distribution                                                                     ': 'normal', 'aft_loss_distribution_scale': 1.8649861159850014, 'max_depth': 10, 'booster': 'dart', 'scale_pos_weight': 2.751589938866300                                                                     3, 'alpha': 6.462761824780364, 'lambda': 0.08708378507573733, 'eta': 0.5126007001692563, 'sampling_method': 'uniform', 'subsample': 0.793                                                                     3547456778933, 'gamma': 6.689956364697072}. Best is trial 39 with value: 4.394413518676669.
[I 2023-12-21 02:34:17,532] Trial 42 finished with value: inf and parameters: {'learning_rate': 0.6327066175645759, 'aft_loss_distributio                                                                     n': 'normal', 'aft_loss_distribution_scale': 1.4088818159981935, 'max_depth': 9, 'booster': 'dart', 'scale_pos_weight': 0.701914869605777                                                                     1, 'alpha': 5.043581188174584, 'lambda': 2.163600249880771, 'eta': 0.5908250584633612, 'sampling_method': 'uniform', 'subsample': 0.72768                                                                     28500923769, 'gamma': 8.29113314926042}. Best is trial 39 with value: 4.394413518676669.
[I 2023-12-21 02:34:17,579] Trial 43 pruned. Trial was pruned at iteration 4.
[I 2023-12-21 02:34:17,613] Trial 44 pruned. Trial was pruned at iteration 1.
[I 2023-12-21 02:34:17,740] Trial 45 finished with value: inf and parameters: {'learning_rate': 0.564416357466783, 'aft_loss_distribution                                                                     ': 'normal', 'aft_loss_distribution_scale': 1.2349458210671567, 'max_depth': 8, 'booster': 'gbtree', 'scale_pos_weight': 1.37485342223023                                                                     1, 'alpha': 8.262642802571072, 'lambda': 8.543934216398824, 'eta': 0.35200620672292127, 'sampling_method': 'uniform', 'subsample': 0.8523                                                                     555426897083, 'gamma': 9.568705083450826}. Best is trial 39 with value: 4.394413518676669.
[I 2023-12-21 02:34:17,773] Trial 46 pruned. Trial was pruned at iteration 0.
[I 2023-12-21 02:34:17,808] Trial 47 pruned. Trial was pruned at iteration 0.
[I 2023-12-21 02:34:17,845] Trial 48 pruned. Trial was pruned at iteration 2.
[I 2023-12-21 02:34:17,877] Trial 49 pruned. Trial was pruned at iteration 0.
[I 2023-12-21 02:34:17,911] Trial 50 pruned. Trial was pruned at iteration 0.
[I 2023-12-21 02:34:18,202] Trial 51 finished with value: 4.565377661473456 and parameters: {'learning_rate': 0.41678681684308594, 'aft_l                                                                     oss_distribution': 'normal', 'aft_loss_distribution_scale': 2.0971389885833136, 'max_depth': 8, 'booster': 'gbtree', 'scale_pos_weight':                                                                      2.213005045826218, 'alpha': 8.442714446845669, 'lambda': 0.6392725675678926, 'eta': 0.6269910725401143, 'sampling_method': 'gradient_base                                                                     d', 'subsample': 0.8586365094900266, 'gamma': 4.550624987425319}. Best is trial 39 with value: 4.394413518676669.
[I 2023-12-21 02:34:18,240] Trial 52 pruned. Trial was pruned at iteration 2.
[I 2023-12-21 02:34:18,274] Trial 53 pruned. Trial was pruned at iteration 0.
[I 2023-12-21 02:34:18,430] Trial 54 finished with value: inf and parameters: {'learning_rate': 0.47265246336698097, 'aft_loss_distributi                                                                     on': 'normal', 'aft_loss_distribution_scale': 2.341161695172257, 'max_depth': 5, 'booster': 'gbtree', 'scale_pos_weight': 3.2756128549520                                                                     422, 'alpha': 7.783255462877641, 'lambda': 0.7087818048426756, 'eta': 0.6971026215924336, 'sampling_method': 'gradient_based', 'subsample                                                                     ': 0.7957227906173314, 'gamma': 3.84069326293067}. Best is trial 39 with value: 4.394413518676669.
[I 2023-12-21 02:34:18,463] Trial 55 pruned. Trial was pruned at iteration 0.
[I 2023-12-21 02:34:18,624] Trial 56 finished with value: 4.641463571673764 and parameters: {'learning_rate': 0.3301085521926089, 'aft_lo                                                                     ss_distribution': 'logistic', 'aft_loss_distribution_scale': 1.4296077892551393, 'max_depth': 10, 'booster': 'gbtree', 'scale_pos_weight'                                                                     : 4.640320144241571, 'alpha': 9.21172300701522, 'lambda': 6.940979264814269, 'eta': 0.9154379231760572, 'sampling_method': 'uniform', 'su                                                                     bsample': 0.7497274588604406, 'gamma': 6.4505480634977195}. Best is trial 39 with value: 4.394413518676669.
[I 2023-12-21 02:34:18,659] Trial 57 pruned. Trial was pruned at iteration 0.
