[I 2023-12-18 23:47:36,282] Trial 188 pruned. Trial was pruned at iteration 0.
[I 2023-12-18 23:47:36,726] Trial 189 finished with value: 4.257761074066945 and parameters: {'learning_rate': 0.9578082727022557, 'aft_loss_distribution': 'normal', 'aft_loss_distribution_scale': 1.0873131735213837, 'max_depth': 3, 'booster': 'gbtree', 'scale_pos_weight': 1.8679076695221797, 'alpha': 9.043493947310456, 'lambda': 3.9022758846813748, 'eta': 0.5540341395024924, 'sampling_method': 'uniform', 'subsample': 0.8143636385790443, 'gamma': 8.882923111517247}. Best is trial 189 with value: 4.257761074066945.
[I 2023-12-18 23:47:37,087] Trial 190 finished with value: 4.255152396234394 and parameters: {'learning_rate': 0.9646260708816203, 'aft_loss_distribution': 'normal', 'aft_loss_distribution_scale': 1.0749541061880827, 'max_depth': 4, 'booster': 'gbtree', 'scale_pos_weight': 1.907364579180471, 'alpha': 9.09234185523972, 'lambda': 3.9641963255744095, 'eta': 0.104888995554985, 'sampling_method': 'uniform', 'subsample': 0.8174201381632035, 'gamma': 8.710714762190133}. Best is trial 190 with value: 4.255152396234394.
[I 2023-12-18 23:47:37,297] Trial 191 finished with value: inf and parameters: {'learning_rate': 0.9574032175984387, 'aft_loss_distribution': 'normal', 'aft_loss_distribution_scale': 1.1046906133224166, 'max_depth': 3, 'booster': 'gbtree', 'scale_pos_weight': 1.8492361813235465, 'alpha': 8.925629542421868, 'lambda': 3.9357612745848183, 'eta': 0.552659303200645, 'sampling_method': 'uniform', 'subsample': 0.8162307505504809, 'gamma': 8.778852639123327}. Best is trial 190 with value: 4.255152396234394.
[I 2023-12-18 23:47:37,483] Trial 192 finished with value: inf and parameters: {'learning_rate': 0.9359378188840408, 'aft_loss_distribution': 'normal', 'aft_loss_distribution_scale': 1.2348445965339645, 'max_depth': 4, 'booster': 'gbtree', 'scale_pos_weight': 2.0758972991698417, 'alpha': 9.122070403267195, 'lambda': 3.5740839942132197, 'eta': 0.10155739577973093, 'sampling_method': 'uniform', 'subsample': 0.8529801770142257, 'gamma': 8.960814904579255}. Best is trial 190 with value: 4.255152396234394.
[I 2023-12-18 23:47:37,723] Trial 193 finished with value: 4.259033999896848 and parameters: {'learning_rate': 0.9754954620432886, 'aft_loss_distribution': 'normal', 'aft_loss_distribution_scale': 1.0022920363893664, 'max_depth': 3, 'booster': 'gbtree', 'scale_pos_weight': 1.599791794296559, 'alpha': 9.200065460803073, 'lambda': 4.127689197063364, 'eta': 0.07758214018583998, 'sampling_method': 'uniform', 'subsample': 0.7991625858048819, 'gamma': 9.180061826316642}. Best is trial 190 with value: 4.255152396234394.
[I 2023-12-18 23:47:37,797] Trial 194 pruned. Trial was pruned at iteration 0.
[I 2023-12-18 23:47:38,148] Trial 195 finished with value: 4.25900617538296 and parameters: {'learning_rate': 0.9594553595113532, 'aft_loss_distribution': 'normal', 'aft_loss_distribution_scale': 1.019387938354608, 'max_depth': 3, 'booster': 'gbtree', 'scale_pos_weight': 1.2669782480653318, 'alpha': 9.206635829491322, 'lambda': 4.422421697424336, 'eta': 0.050442817420229775, 'sampling_method': 'uniform', 'subsample': 0.7909396232799281, 'gamma': 9.106049117403382}. Best is trial 190 with value: 4.255152396234394.
[I 2023-12-18 23:47:38,354] Trial 196 finished with value: inf and parameters: {'learning_rate': 0.9529548105253385, 'aft_loss_distribution': 'normal', 'aft_loss_distribution_scale': 0.9785130877478868, 'max_depth': 3, 'booster': 'gbtree', 'scale_pos_weight': 1.2176724128998908, 'alpha': 8.941342660104755, 'lambda': 4.391660047100651, 'eta': 0.0544352667520083, 'sampling_method': 'uniform', 'subsample': 0.792124787724133, 'gamma': 8.96852566535627}. Best is trial 190 with value: 4.255152396234394.
[I 2023-12-18 23:47:38,427] Trial 197 pruned. Trial was pruned at iteration 0.
[I 2023-12-18 23:47:38,638] Trial 198 finished with value: inf and parameters: {'learning_rate': 0.9975795322772231, 'aft_loss_distribution': 'normal', 'aft_loss_distribution_scale': 1.0851712327991192, 'max_depth': 3, 'booster': 'gbtree', 'scale_pos_weight': 1.931564656319653, 'alpha': 8.882351567426689, 'lambda': 4.499647167228911, 'eta': 0.028556476359206925, 'sampling_method': 'uniform', 'subsample': 0.7410726250253511, 'gamma': 9.164214210625287}. Best is trial 190 with value: 4.255152396234394.
[I 2023-12-18 23:47:38,711] Trial 199 pruned. Trial was pruned at iteration 0.
[I 2023-12-18 23:47:38,776] Trial 200 pruned. Trial was pruned at iteration 0.
[I 2023-12-18 23:47:38,859] Trial 201 pruned. Trial was pruned at iteration 1.
[I 2023-12-18 23:47:39,082] Trial 202 finished with value: 4.2560305506529135 and parameters: {'learning_rate': 0.9449924993715524, 'aft_loss_distribution': 'normal', 'aft_loss_distribution_scale': 1.0747618140122748, 'max_depth': 4, 'booster': 'gbtree', 'scale_pos_weight': 1.818960886340756, 'alpha': 9.174071469684394, 'lambda': 4.0470456550846405, 'eta': 0.0876709644756683, 'sampling_method': 'uniform', 'subsample': 0.8212876341240819, 'gamma': 9.666120066103726}. Best is trial 190 with value: 4.255152396234394.
[I 2023-12-18 23:47:39,326] Trial 203 finished with value: 4.25376160322098 and parameters: {'learning_rate': 0.9427609012898998, 'aft_loss_distribution': 'normal', 'aft_loss_distribution_scale': 1.0816544589356167, 'max_depth': 4, 'booster': 'gbtree', 'scale_pos_weight': 1.8318515612438218, 'alpha': 9.05784111814077, 'lambda': 4.092851803851352, 'eta': 0.1311970397201349, 'sampling_method': 'uniform', 'subsample': 0.8282858027459209, 'gamma': 9.691439635116444}. Best is trial 203 with value: 4.25376160322098.
[I 2023-12-18 23:47:39,521] Trial 204 finished with value: inf and parameters: {'learning_rate': 0.9384434340930183, 'aft_loss_distribution': 'normal', 'aft_loss_distribution_scale': 1.0191733081169398, 'max_depth': 4, 'booster': 'gbtree', 'scale_pos_weight': 1.9634147501333548, 'alpha': 9.05877026053509, 'lambda': 4.105645505884995, 'eta': 0.09587728981835787, 'sampling_method': 'uniform', 'subsample': 0.8331787169426665, 'gamma': 9.71076462856125}. Best is trial 203 with value: 4.25376160322098.
[I 2023-12-18 23:47:39,705] Trial 205 finished with value: inf and parameters: {'learning_rate': 0.9522725606142641, 'aft_loss_distribution': 'normal', 'aft_loss_distribution_scale': 0.946161166923178, 'max_depth': 4, 'booster': 'gbtree', 'scale_pos_weight': 1.4834130561374965, 'alpha': 9.161686429545716, 'lambda': 4.4532757384985775, 'eta': 0.13649698605103353, 'sampling_method': 'uniform', 'subsample': 0.8610982014479988, 'gamma': 9.05742970215518}. Best is trial 203 with value: 4.25376160322098.
[I 2023-12-18 23:47:39,936] Trial 206 finished with value: 4.260283820796775 and parameters: {'learning_rate': 0.9208384297318298, 'aft_loss_distribution': 'normal', 'aft_loss_distribution_scale': 1.1294633087028654, 'max_depth': 4, 'booster': 'gbtree', 'scale_pos_weight': 2.252357971375287, 'alpha': 9.655439285580718, 'lambda': 4.666542059255024, 'eta': 0.1264375508831127, 'sampling_method': 'uniform', 'subsample': 0.820272679167292, 'gamma': 9.721292903765033}. Best is trial 203 with value: 4.25376160322098.
[I 2023-12-18 23:47:40,011] Trial 207 pruned. Trial was pruned at iteration 0.
[I 2023-12-18 23:47:40,085] Trial 208 pruned. Trial was pruned at iteration 0.
[I 2023-12-18 23:47:40,156] Trial 209 pruned. Trial was pruned at iteration 0.
[I 2023-12-18 23:47:40,346] Trial 210 finished with value: inf and parameters: {'learning_rate': 0.9585507058928566, 'aft_loss_distribution': 'normal', 'aft_loss_distribution_scale': 1.1493201053820963, 'max_depth': 4, 'booster': 'gbtree', 'scale_pos_weight': 2.48760911416698, 'alpha': 8.982826273503491, 'lambda': 3.557436937321809, 'eta': 0.07379964413886794, 'sampling_method': 'uniform', 'subsample': 0.7995097627012695, 'gamma': 9.255544807386752}. Best is trial 203 with value: 4.25376160322098.
[I 2023-12-18 23:47:40,415] Trial 211 pruned. Trial was pruned at iteration 0.
[I 2023-12-18 23:47:40,494] Trial 212 pruned. Trial was pruned at iteration 1.
[I 2023-12-18 23:47:40,571] Trial 213 pruned. Trial was pruned at iteration 0.
[I 2023-12-18 23:47:40,843] Trial 214 finished with value: 4.257071183473085 and parameters: {'learning_rate': 0.9105709510846187, 'aft_loss_distribution': 'normal', 'aft_loss_distribution_scale': 1.1038542161625686, 'max_depth': 3, 'booster': 'gbtree', 'scale_pos_weight': 1.613629476275805, 'alpha': 9.52298420811996, 'lambda': 4.073253808991776, 'eta': 0.04490892703685212, 'sampling_method': 'uniform', 'subsample': 0.820750859200115, 'gamma': 9.687989397848732}. Best is trial 203 with value: 4.25376160322098.
[I 2023-12-18 23:47:40,957] Trial 215 pruned. Trial was pruned at iteration 0.
[I 2023-12-18 23:47:41,075] Trial 216 pruned. Trial was pruned at iteration 0.
[I 2023-12-18 23:47:41,187] Trial 217 pruned. Trial was pruned at iteration 0.
[I 2023-12-18 23:47:41,322] Trial 218 pruned. Trial was pruned at iteration 0.
[I 2023-12-18 23:47:41,442] Trial 219 pruned. Trial was pruned at iteration 0.
[I 2023-12-18 23:47:41,734] Trial 220 finished with value: inf and parameters: {'learning_rate': 0.9579643308447595, 'aft_loss_distribution': 'normal', 'aft_loss_distribution_scale': 1.0550792162218066, 'max_depth': 3, 'booster': 'gbtree', 'scale_pos_weight': 2.2972563249455096, 'alpha': 9.551655588146861, 'lambda': 3.7649941276801693, 'eta': 0.10431497156171368, 'sampling_method': 'uniform', 'subsample': 0.8439505279948237, 'gamma': 9.676016556766724}. Best is trial 203 with value: 4.25376160322098.
[I 2023-12-18 23:47:41,862] Trial 221 pruned. Trial was pruned at iteration 0.
[I 2023-12-18 23:47:41,973] Trial 222 pruned. Trial was pruned at iteration 1.
[I 2023-12-18 23:47:42,074] Trial 223 pruned. Trial was pruned at iteration 0.
[I 2023-12-18 23:47:42,173] Trial 224 pruned. Trial was pruned at iteration 0.
[I 2023-12-18 23:47:42,494] Trial 225 finished with value: inf and parameters: {'learning_rate': 0.9853351157608465, 'aft_loss_distribution': 'normal', 'aft_loss_distribution_scale': 1.1467650505235907, 'max_depth': 4, 'booster': 'gbtree', 'scale_pos_weight': 1.6316224592349333, 'alpha': 5.73221839645577, 'lambda': 4.142088102780141, 'eta': 0.0005363111590201627, 'sampling_method': 'uniform', 'subsample': 0.716928215925998, 'gamma': 9.619337259710022}. Best is trial 203 with value: 4.25376160322098.
[I 2023-12-18 23:47:42,609] Trial 226 pruned. Trial was pruned at iteration 0.
[I 2023-12-18 23:47:42,730] Trial 227 pruned. Trial was pruned at iteration 0.
[I 2023-12-18 23:47:43,245] Trial 228 finished with value: 4.277381923504311 and parameters: {'learning_rate': 0.9503079503490125, 'aft_loss_distribution': 'normal', 'aft_loss_distribution_scale': 1.2268961210329605, 'max_depth': 4, 'booster': 'gbtree', 'scale_pos_weight': 8.87956686920284, 'alpha': 9.589530889658004, 'lambda': 3.991897762719395, 'eta': 0.04212964745977829, 'sampling_method': 'uniform', 'subsample': 0.7332755304834708, 'gamma': 9.168341295461271}. Best is trial 203 with value: 4.25376160322098.
[I 2023-12-18 23:47:43,368] Trial 229 pruned. Trial was pruned at iteration 0.
[I 2023-12-18 23:47:43,679] Trial 230 finished with value: inf and parameters: {'learning_rate': 0.9448105952271562, 'aft_loss_distribution': 'normal', 'aft_loss_distribution_scale': 1.08190846194654, 'max_depth': 4, 'booster': 'gbtree', 'scale_pos_weight': 2.562028704114482, 'alpha': 9.681872703646745, 'lambda': 4.637831283062799, 'eta': 0.024549564511372843, 'sampling_method': 'uniform', 'subsample': 0.7521434090000141, 'gamma': 8.710334594730528}. Best is trial 203 with value: 4.25376160322098.
[I 2023-12-18 23:47:43,801] Trial 231 pruned. Trial was pruned at iteration 0.
[I 2023-12-18 23:47:43,916] Trial 232 pruned. Trial was pruned at iteration 2.
[I 2023-12-18 23:47:44,031] Trial 233 pruned. Trial was pruned at iteration 0.
[I 2023-12-18 23:47:44,334] Trial 234 finished with value: inf and parameters: {'learning_rate': 0.9797793781520429, 'aft_loss_distribution': 'normal', 'aft_loss_distribution_scale': 0.9932663659008393, 'max_depth': 4, 'booster': 'gbtree', 'scale_pos_weight': 2.04890101838934, 'alpha': 9.592534063252394, 'lambda': 4.373208643810811, 'eta': 0.03552515831903234, 'sampling_method': 'uniform', 'subsample': 0.738372821848839, 'gamma': 9.12208515811081}. Best is trial 203 with value: 4.25376160322098.
[I 2023-12-18 23:47:44,494] Trial 235 pruned. Trial was pruned at iteration 2.
[I 2023-12-18 23:47:44,618] Trial 236 pruned. Trial was pruned at iteration 0.
[I 2023-12-18 23:47:44,725] Trial 237 pruned. Trial was pruned at iteration 0.
[I 2023-12-18 23:47:44,831] Trial 238 pruned. Trial was pruned at iteration 0.
[I 2023-12-18 23:47:45,269] Trial 239 finished with value: 4.255205116336764 and parameters: {'learning_rate': 0.9293604942987653, 'aft_loss_distribution': 'normal', 'aft_loss_distribution_scale': 1.063408856663273, 'max_depth': 5, 'booster': 'gbtree', 'scale_pos_weight': 1.6163998040616314, 'alpha': 9.939129400858171, 'lambda': 4.205316745841091, 'eta': 0.023880271232829757, 'sampling_method': 'uniform', 'subsample': 0.7097584771532606, 'gamma': 9.998488438141003}. Best is trial 203 with value: 4.25376160322098.
[I 2023-12-18 23:47:45,395] Trial 240 pruned. Trial was pruned at iteration 0.
[I 2023-12-18 23:47:45,771] Trial 241 finished with value: 4.259790578969119 and parameters: {'learning_rate': 0.9300651181875476, 'aft_loss_distribution': 'normal', 'aft_loss_distribution_scale': 1.1152703893764913, 'max_depth': 5, 'booster': 'gbtree', 'scale_pos_weight': 9.517636877322346, 'alpha': 9.754196281404266, 'lambda': 4.121549817579589, 'eta': 0.03949487971807898, 'sampling_method': 'uniform', 'subsample': 0.7268235319463693, 'gamma': 9.840298978870544}. Best is trial 203 with value: 4.25376160322098.
[I 2023-12-18 23:47:46,038] Trial 242 finished with value: 4.254641951850546 and parameters: {'learning_rate': 0.9257517747624627, 'aft_loss_distribution': 'normal', 'aft_loss_distribution_scale': 1.0592945126164195, 'max_depth': 5, 'booster': 'gbtree', 'scale_pos_weight': 9.324593696210211, 'alpha': 9.723010836972962, 'lambda': 4.221738283898661, 'eta': 0.03351996180277038, 'sampling_method': 'uniform', 'subsample': 0.7073928353706964, 'gamma': 9.993632517500018}. Best is trial 203 with value: 4.25376160322098.
[I 2023-12-18 23:47:46,376] Trial 243 finished with value: 4.255185541902704 and parameters: {'learning_rate': 0.9297180675345955, 'aft_loss_distribution': 'normal', 'aft_loss_distribution_scale': 1.0646031808627516, 'max_depth': 5, 'booster': 'gbtree', 'scale_pos_weight': 9.441208463887758, 'alpha': 9.98530906159973, 'lambda': 4.233395865498965, 'eta': 0.0010961603470081571, 'sampling_method': 'uniform', 'subsample': 0.7103691300927124, 'gamma': 9.844982468202959}. Best is trial 203 with value: 4.25376160322098.
[I 2023-12-18 23:47:46,455] Trial 244 pruned. Trial was pruned at iteration 0.
[I 2023-12-18 23:47:46,677] Trial 245 finished with value: inf and parameters: {'learning_rate': 0.9333033863758671, 'aft_loss_distribution': 'normal', 'aft_loss_distribution_scale': 1.1052374872678619, 'max_depth': 5, 'booster': 'gbtree', 'scale_pos_weight': 9.150196532315293, 'alpha': 9.780806775601732, 'lambda': 4.5113030442462065, 'eta': 0.02336265809449242, 'sampling_method': 'uniform', 'subsample': 0.7222191520835879, 'gamma': 9.751457157180264}. Best is trial 203 with value: 4.25376160322098.
[I 2023-12-18 23:47:46,752] Trial 246 pruned. Trial was pruned at iteration 0.
[I 2023-12-18 23:47:46,955] Trial 247 finished with value: inf and parameters: {'learning_rate': 0.93145792295658, 'aft_loss_distribution': 'normal', 'aft_loss_distribution_scale': 1.0417505698604552, 'max_depth': 5, 'booster': 'gbtree', 'scale_pos_weight': 9.194503716049859, 'alpha': 9.956155842662938, 'lambda': 4.387228373961814, 'eta': 0.02664727804483082, 'sampling_method': 'uniform', 'subsample': 0.674242599082063, 'gamma': 9.821475084186545}. Best is trial 203 with value: 4.25376160322098.
[I 2023-12-18 23:47:47,040] Trial 248 pruned. Trial was pruned at iteration 0.
[I 2023-12-18 23:47:47,113] Trial 249 pruned. Trial was pruned at iteration 0.
[I 2023-12-18 23:47:47,353] Trial 250 finished with value: 4.267989798756493 and parameters: {'learning_rate': 0.947788796337309, 'aft_loss_distribution': 'normal', 'aft_loss_distribution_scale': 1.1584520196057753, 'max_depth': 5, 'booster': 'gbtree', 'scale_pos_weight': 9.013119274440367, 'alpha': 9.457168475702783, 'lambda': 3.8655997476467054, 'eta': 0.022343910514195216, 'sampling_method': 'uniform', 'subsample': 0.738135824245677, 'gamma': 9.95281396943014}. Best is trial 203 with value: 4.25376160322098.
[I 2023-12-18 23:47:47,565] Trial 251 finished with value: inf and parameters: {'learning_rate': 0.9232283496835658, 'aft_loss_distribution': 'normal', 'aft_loss_distribution_scale': 1.102159833544821, 'max_depth': 5, 'booster': 'gbtree', 'scale_pos_weight': 8.760198827139362, 'alpha': 9.787384179731134, 'lambda': 3.6294207617220704, 'eta': 0.06129662966623924, 'sampling_method': 'uniform', 'subsample': 0.7410775924794502, 'gamma': 9.817348490032044}. Best is trial 203 with value: 4.25376160322098.
[I 2023-12-18 23:47:47,642] Trial 252 pruned. Trial was pruned at iteration 0.
[I 2023-12-18 23:47:47,711] Trial 253 pruned. Trial was pruned at iteration 0.
[I 2023-12-18 23:47:47,780] Trial 254 pruned. Trial was pruned at iteration 0.
[I 2023-12-18 23:47:48,002] Trial 255 finished with value: inf and parameters: {'learning_rate': 0.9520221492314868, 'aft_loss_distribution': 'normal', 'aft_loss_distribution_scale': 1.0038779477431565, 'max_depth': 3, 'booster': 'gbtree', 'scale_pos_weight': 8.96322304523187, 'alpha': 9.718017302909047, 'lambda': 4.350851774421859, 'eta': 0.10528776931638328, 'sampling_method': 'uniform', 'subsample': 0.7421446492372956, 'gamma': 9.480786217123626}. Best is trial 203 with value: 4.25376160322098.
[I 2023-12-18 23:47:48,083] Trial 256 pruned. Trial was pruned at iteration 0.
[I 2023-12-18 23:47:48,156] Trial 257 pruned. Trial was pruned at iteration 0.
[I 2023-12-18 23:48:00,047] Trial 258 finished with value: 4.2705979184221565 and parameters: {'learning_rate': 0.96359321282414, 'aft_loss_distribution': 'normal', 'aft_loss_distribution_scale': 1.1916683763593607, 'max_depth': 5, 'booster': 'dart', 'scale_pos_weight': 8.608075186229879, 'alpha': 9.181684264298328, 'lambda': 4.5417456042599, 'eta': 0.04157657038865312, 'sampling_method': 'uniform', 'subsample': 0.749878862403777, 'gamma': 9.99341802435237}. Best is trial 203 with value: 4.25376160322098.
[I 2023-12-18 23:48:02,484] Trial 259 finished with value: inf and parameters: {'learning_rate': 0.9668468538369583, 'aft_loss_distribution': 'normal', 'aft_loss_distribution_scale': 0.963534288523341, 'max_depth': 5, 'booster': 'dart', 'scale_pos_weight': 8.696994657044472, 'alpha': 9.195031396230615, 'lambda': 4.911406979310316, 'eta': 0.06821353045781811, 'sampling_method': 'uniform', 'subsample': 0.7528035152874906, 'gamma': 9.956421309450874}. Best is trial 203 with value: 4.25376160322098.
[I 2023-12-18 23:48:02,751] Trial 260 finished with value: 4.2687188050955065 and parameters: {'learning_rate': 0.996999585083908, 'aft_loss_distribution': 'normal', 'aft_loss_distribution_scale': 1.167237180736189, 'max_depth': 4, 'booster': 'gbtree', 'scale_pos_weight': 8.516882550392284, 'alpha': 9.542754614543535, 'lambda': 4.534195412082268, 'eta': 0.12142721879842111, 'sampling_method': 'uniform', 'subsample': 0.7866717524419136, 'gamma': 9.978145968263181}. Best is trial 203 with value: 4.25376160322098.
[I 2023-12-18 23:48:02,835] Trial 261 pruned. Trial was pruned at iteration 0.
[I 2023-12-18 23:48:18,628] Trial 262 finished with value: 4.261223234571356 and parameters: {'learning_rate': 0.9963274610439435, 'aft_loss_distribution': 'normal', 'aft_loss_distribution_scale': 1.1241083248845707, 'max_depth': 4, 'booster': 'dart', 'scale_pos_weight': 8.408940774307087, 'alpha': 9.054704753421058, 'lambda': 4.507004504094215, 'eta': 0.11567855793403084, 'sampling_method': 'uniform', 'subsample': 0.7916614909322335, 'gamma': 9.97617538482687}. Best is trial 203 with value: 4.25376160322098.
[I 2023-12-18 23:48:34,610] Trial 263 finished with value: 4.26015142392446 and parameters: {'learning_rate': 0.9999863956589676, 'aft_loss_distribution': 'normal', 'aft_loss_distribution_scale': 1.1145861387311435, 'max_depth': 4, 'booster': 'dart', 'scale_pos_weight': 8.325437417678943, 'alpha': 9.055588102227546, 'lambda': 4.771340424355748, 'eta': 0.11784586672693845, 'sampling_method': 'uniform', 'subsample': 0.7913670224460332, 'gamma': 9.784784116084188}. Best is trial 203 with value: 4.25376160322098.
[I 2023-12-18 23:48:34,743] Trial 264 pruned. Trial was pruned at iteration 1.
[I 2023-12-18 23:48:34,860] Trial 265 pruned. Trial was pruned at iteration 0.
[I 2023-12-18 23:48:37,823] Trial 266 finished with value: inf and parameters: {'learning_rate': 0.9982645377940055, 'aft_loss_distribution': 'normal', 'aft_loss_distribution_scale': 1.1050936190224085, 'max_depth': 4, 'booster': 'dart', 'scale_pos_weight': 8.590961774498808, 'alpha': 9.21239623921524, 'lambda': 4.55438480542629, 'eta': 0.12762299166315294, 'sampling_method': 'uniform', 'subsample': 0.8432683519018557, 'gamma': 9.980531032422816}. Best is trial 203 with value: 4.25376160322098.
[I 2023-12-18 23:48:37,949] Trial 267 pruned. Trial was pruned at iteration 0.
[I 2023-12-18 23:48:43,738] Trial 268 finished with value: 4.258473242929611 and parameters: {'learning_rate': 0.9670918001377391, 'aft_loss_distribution': 'normal', 'aft_loss_distribution_scale': 1.0055222318836303, 'max_depth': 4, 'booster': 'dart', 'scale_pos_weight': 8.271155614102554, 'alpha': 9.449123611703707, 'lambda': 4.496720345854952, 'eta': 0.1541993744114417, 'sampling_method': 'uniform', 'subsample': 0.7898373522681823, 'gamma': 8.48381090290784}. Best is trial 203 with value: 4.25376160322098.
