[I 2023-12-19 04:16:31,250] Trial 113 pruned. Trial was pruned at iteration 0.
[I 2023-12-19 04:16:31,334] Trial 114 pruned. Trial was pruned at iteration 0.
[I 2023-12-19 04:16:31,415] Trial 115 pruned. Trial was pruned at iteration 0.
[I 2023-12-19 04:16:31,493] Trial 116 pruned. Trial was pruned at iteration 0.
[I 2023-12-19 04:16:31,580] Trial 117 pruned. Trial was pruned at iteration 1.
[I 2023-12-19 04:16:31,671] Trial 118 pruned. Trial was pruned at iteration 1.
[I 2023-12-19 04:16:31,762] Trial 119 pruned. Trial was pruned at iteration 0.
[I 2023-12-19 04:16:31,845] Trial 120 pruned. Trial was pruned at iteration 0.
[I 2023-12-19 04:16:31,940] Trial 121 pruned. Trial was pruned at iteration 0.
[I 2023-12-19 04:16:32,031] Trial 122 pruned. Trial was pruned at iteration 0.
[I 2023-12-19 04:16:32,112] Trial 123 pruned. Trial was pruned at iteration 0.
[I 2023-12-19 04:16:32,205] Trial 124 pruned. Trial was pruned at iteration 2.
[I 2023-12-19 04:16:32,292] Trial 125 pruned. Trial was pruned at iteration 0.
[I 2023-12-19 04:16:32,381] Trial 126 pruned. Trial was pruned at iteration 0.
[I 2023-12-19 04:16:32,464] Trial 127 pruned. Trial was pruned at iteration 0.
[I 2023-12-19 04:16:32,546] Trial 128 pruned. Trial was pruned at iteration 0.
[I 2023-12-19 04:16:32,634] Trial 129 pruned. Trial was pruned at iteration 0.
[I 2023-12-19 04:16:33,115] Trial 130 finished with value: inf and parameters: {'learning_rate': 0.6861371038336208, 'aft_loss_distribution': 'normal', 'aft_loss_distribution_scale': 1.1220076247002941, 'max_depth': 3, 'booster': 'gbtree', 'scale_pos_weight': 7.4426276835033525, 'alpha': 0.4779982727751017, 'lambda': 8.832582517239672, 'eta': 0.5292962656935872, 'sampling_method': 'uniform', 'subsample': 0.23289854973811924, 'gamma': 5.078623584652071}. Best is trial 53 with value: 4.264219713152126.
[I 2023-12-19 04:16:33,196] Trial 131 pruned. Trial was pruned at iteration 0.
[I 2023-12-19 04:16:33,277] Trial 132 pruned. Trial was pruned at iteration 0.
[I 2023-12-19 04:16:33,363] Trial 133 pruned. Trial was pruned at iteration 0.
[I 2023-12-19 04:16:33,443] Trial 134 pruned. Trial was pruned at iteration 0.
[I 2023-12-19 04:16:33,525] Trial 135 pruned. Trial was pruned at iteration 0.
[I 2023-12-19 04:16:33,618] Trial 136 pruned. Trial was pruned at iteration 1.
[I 2023-12-19 04:16:33,701] Trial 137 pruned. Trial was pruned at iteration 0.
[I 2023-12-19 04:16:33,803] Trial 138 pruned. Trial was pruned at iteration 1.
[I 2023-12-19 04:16:33,890] Trial 139 pruned. Trial was pruned at iteration 1.
[I 2023-12-19 04:16:33,989] Trial 140 pruned. Trial was pruned at iteration 0.
[I 2023-12-19 04:16:34,080] Trial 141 pruned. Trial was pruned at iteration 0.
[I 2023-12-19 04:16:34,165] Trial 142 pruned. Trial was pruned at iteration 0.
[I 2023-12-19 04:16:34,258] Trial 143 pruned. Trial was pruned at iteration 0.
[I 2023-12-19 04:16:34,343] Trial 144 pruned. Trial was pruned at iteration 0.
[I 2023-12-19 04:16:34,427] Trial 145 pruned. Trial was pruned at iteration 0.
[I 2023-12-19 04:16:34,523] Trial 146 pruned. Trial was pruned at iteration 1.
[I 2023-12-19 04:16:34,608] Trial 147 pruned. Trial was pruned at iteration 0.
[I 2023-12-19 04:16:34,699] Trial 148 pruned. Trial was pruned at iteration 1.
[I 2023-12-19 04:16:34,790] Trial 149 pruned. Trial was pruned at iteration 1.
[I 2023-12-19 04:16:34,875] Trial 150 pruned. Trial was pruned at iteration 0.
[I 2023-12-19 04:16:34,986] Trial 151 pruned. Trial was pruned at iteration 0.
[I 2023-12-19 04:16:35,076] Trial 152 pruned. Trial was pruned at iteration 0.
[I 2023-12-19 04:16:35,199] Trial 153 pruned. Trial was pruned at iteration 0.
[I 2023-12-19 04:16:35,331] Trial 154 pruned. Trial was pruned at iteration 0.
[I 2023-12-19 04:16:35,469] Trial 155 pruned. Trial was pruned at iteration 0.
[I 2023-12-19 04:16:35,721] Trial 156 pruned. Trial was pruned at iteration 0.
[I 2023-12-19 04:16:35,891] Trial 157 pruned. Trial was pruned at iteration 1.
[I 2023-12-19 04:16:36,197] Trial 158 pruned. Trial was pruned at iteration 0.
[I 2023-12-19 04:16:50,017] Trial 159 finished with value: 4.305135513808498 and parameters: {'learning_rate': 0.6492869419391912, 'aft_loss_distribution': 'normal', 'aft_loss_distribution_scale': 1.412358965424968, 'max_depth': 7, 'booster': 'dart', 'scale_pos_weight': 8.566172848941825, 'alpha': 6.854741868770073, 'lambda': 4.737831523727257, 'eta': 0.478677044356123, 'sampling_method': 'uniform', 'subsample': 0.7358177637253217, 'gamma': 4.730896726877381}. Best is trial 53 with value: 4.264219713152126.
[I 2023-12-19 04:16:50,172] Trial 160 pruned. Trial was pruned at iteration 0.
[I 2023-12-19 04:16:57,899] Trial 161 finished with value: inf and parameters: {'learning_rate': 0.660494984410506, 'aft_loss_distribution': 'normal', 'aft_loss_distribution_scale': 1.4013487796611408, 'max_depth': 6, 'booster': 'dart', 'scale_pos_weight': 8.394223703485633, 'alpha': 4.659214246727739, 'lambda': 4.291020251568277, 'eta': 0.45043856253647657, 'sampling_method': 'uniform', 'subsample': 0.8606147150193506, 'gamma': 9.851535191739318}. Best is trial 53 with value: 4.264219713152126.
[I 2023-12-19 04:17:25,566] Trial 162 finished with value: 4.335972759969667 and parameters: {'learning_rate': 0.6504886132162007, 'aft_loss_distribution': 'normal', 'aft_loss_distribution_scale': 1.529451250943356, 'max_depth': 8, 'booster': 'dart', 'scale_pos_weight': 7.98575829612879, 'alpha': 3.074360569606841, 'lambda': 5.480577772689579, 'eta': 0.9936114553198695, 'sampling_method': 'uniform', 'subsample': 0.7560910699061472, 'gamma': 4.255321145217349}. Best is trial 53 with value: 4.264219713152126.
[I 2023-12-19 04:19:01,344] Trial 163 finished with value: 4.248979540829635 and parameters: {'learning_rate': 0.6424020446386922, 'aft_loss_distribution': 'normal', 'aft_loss_distribution_scale': 1.2405544360274876, 'max_depth': 8, 'booster': 'dart', 'scale_pos_weight': 7.738404338080504, 'alpha': 7.891527360754295, 'lambda': 4.6434100825715126, 'eta': 0.5685425958859516, 'sampling_method': 'uniform', 'subsample': 0.7570152592670654, 'gamma': 4.840371061802619}. Best is trial 163 with value: 4.248979540829635.
[I 2023-12-19 04:19:01,428] Trial 164 pruned. Trial was pruned at iteration 0.
[I 2023-12-19 04:19:01,561] Trial 165 pruned. Trial was pruned at iteration 3.
[I 2023-12-19 04:19:08,655] Trial 166 finished with value: inf and parameters: {'learning_rate': 0.6278099994753973, 'aft_loss_distribution': 'normal', 'aft_loss_distribution_scale': 1.369448325920343, 'max_depth': 8, 'booster': 'dart', 'scale_pos_weight': 7.593707850834175, 'alpha': 7.922259692696894, 'lambda': 9.582103832060366, 'eta': 0.5628206008294833, 'sampling_method': 'uniform', 'subsample': 0.7872772633554088, 'gamma': 5.17032961189904}. Best is trial 163 with value: 4.248979540829635.
[I 2023-12-19 04:19:08,745] Trial 167 pruned. Trial was pruned at iteration 0.
[I 2023-12-19 04:19:08,842] Trial 168 pruned. Trial was pruned at iteration 1.
[I 2023-12-19 04:19:17,506] Trial 169 finished with value: 4.239959885622252 and parameters: {'learning_rate': 0.7338023070049869, 'aft_loss_distribution': 'normal', 'aft_loss_distribution_scale': 1.2341032286502516, 'max_depth': 7, 'booster': 'dart', 'scale_pos_weight': 7.245593436862305, 'alpha': 6.828849669302545, 'lambda': 9.286285787718642, 'eta': 0.5758287865323352, 'sampling_method': 'uniform', 'subsample': 0.754440104331013, 'gamma': 4.697081976757284}. Best is trial 169 with value: 4.239959885622252.
[I 2023-12-19 04:19:42,173] Trial 170 finished with value: 4.2592127907568305 and parameters: {'learning_rate': 0.7349841214599804, 'aft_loss_distribution': 'normal', 'aft_loss_distribution_scale': 1.2832793089661747, 'max_depth': 7, 'booster': 'dart', 'scale_pos_weight': 7.479164523069549, 'alpha': 6.108497701025185, 'lambda': 9.242738773990142, 'eta': 0.5759921497004968, 'sampling_method': 'uniform', 'subsample': 0.6864552842931925, 'gamma': 4.733267582517129}. Best is trial 169 with value: 4.239959885622252.
[I 2023-12-19 04:19:46,621] Trial 171 finished with value: inf and parameters: {'learning_rate': 0.7534789315416863, 'aft_loss_distribution': 'normal', 'aft_loss_distribution_scale': 1.130532707890699, 'max_depth': 7, 'booster': 'dart', 'scale_pos_weight': 7.487778537765122, 'alpha': 6.1088004700723415, 'lambda': 8.96735157824896, 'eta': 0.5749116607830378, 'sampling_method': 'uniform', 'subsample': 0.6708176948741481, 'gamma': 4.7643654419385255}. Best is trial 169 with value: 4.239959885622252.
[I 2023-12-19 04:20:29,658] Trial 172 finished with value: 4.313437636250405 and parameters: {'learning_rate': 0.7263804389696004, 'aft_loss_distribution': 'normal', 'aft_loss_distribution_scale': 1.4605750783590232, 'max_depth': 7, 'booster': 'dart', 'scale_pos_weight': 7.2149396166011, 'alpha': 6.768272216071361, 'lambda': 9.325447724740789, 'eta': 0.6003242630434309, 'sampling_method': 'uniform', 'subsample': 0.6545477777420323, 'gamma': 5.007108963218047}. Best is trial 169 with value: 4.239959885622252.
[I 2023-12-19 04:20:44,884] Trial 173 finished with value: 4.2679740295464335 and parameters: {'learning_rate': 0.7319562823160068, 'aft_loss_distribution': 'normal', 'aft_loss_distribution_scale': 1.3140795604529456, 'max_depth': 7, 'booster': 'dart', 'scale_pos_weight': 7.737300850821784, 'alpha': 5.634739787263942, 'lambda': 9.500511540724352, 'eta': 0.5882215394097122, 'sampling_method': 'uniform', 'subsample': 0.6547961531147164, 'gamma': 4.976517439125825}. Best is trial 169 with value: 4.239959885622252.
[I 2023-12-19 04:20:44,992] Trial 174 pruned. Trial was pruned at iteration 0.
[I 2023-12-19 04:20:45,083] Trial 175 pruned. Trial was pruned at iteration 0.
[I 2023-12-19 04:20:50,458] Trial 176 finished with value: 4.270475361408076 and parameters: {'learning_rate': 0.7375903117749177, 'aft_loss_distribution': 'normal', 'aft_loss_distribution_scale': 1.3278414902436375, 'max_depth': 7, 'booster': 'dart', 'scale_pos_weight': 7.430870468502586, 'alpha': 5.528577018831926, 'lambda': 9.694379361391382, 'eta': 0.5788840129886723, 'sampling_method': 'uniform', 'subsample': 0.6593735640250705, 'gamma': 5.272821885418216}. Best is trial 169 with value: 4.239959885622252.
[I 2023-12-19 04:21:16,358] Trial 177 finished with value: 4.244803168960349 and parameters: {'learning_rate': 0.7889957876341802, 'aft_loss_distribution': 'normal', 'aft_loss_distribution_scale': 1.2505650915951003, 'max_depth': 7, 'booster': 'dart', 'scale_pos_weight': 7.601185508930037, 'alpha': 6.3900700638280385, 'lambda': 9.680739257555363, 'eta': 0.5845387124197015, 'sampling_method': 'uniform', 'subsample': 0.6190951950663065, 'gamma': 5.402201604349673}. Best is trial 169 with value: 4.239959885622252.
[I 2023-12-19 04:21:16,448] Trial 178 pruned. Trial was pruned at iteration 0.
[I 2023-12-19 04:21:20,034] Trial 179 finished with value: inf and parameters: {'learning_rate': 0.737405109984046, 'aft_loss_distribution': 'normal', 'aft_loss_distribution_scale': 1.2458734503106923, 'max_depth': 7, 'booster': 'dart', 'scale_pos_weight': 7.447735734604932, 'alpha': 6.137861627157427, 'lambda': 9.801183150801368, 'eta': 0.5498744398460365, 'sampling_method': 'uniform', 'subsample': 0.6799287512720005, 'gamma': 5.273588162220145}. Best is trial 169 with value: 4.239959885622252.
[I 2023-12-19 04:21:30,423] Trial 180 finished with value: 4.2328875602251745 and parameters: {'learning_rate': 0.7429115000220415, 'aft_loss_distribution': 'normal', 'aft_loss_distribution_scale': 1.0213974145740252, 'max_depth': 7, 'booster': 'dart', 'scale_pos_weight': 7.261868426695258, 'alpha': 5.619238933411656, 'lambda': 9.163897149030959, 'eta': 0.599157528219122, 'sampling_method': 'uniform', 'subsample': 0.6207789515076999, 'gamma': 5.657063279526152}. Best is trial 180 with value: 4.2328875602251745.
[I 2023-12-19 04:21:47,935] Trial 181 finished with value: 4.214751273954899 and parameters: {'learning_rate': 0.738242158490905, 'aft_loss_distribution': 'normal', 'aft_loss_distribution_scale': 1.0948356286722245, 'max_depth': 7, 'booster': 'dart', 'scale_pos_weight': 7.2169421109668335, 'alpha': 5.742043067056761, 'lambda': 9.362148980010934, 'eta': 0.5998943306865643, 'sampling_method': 'uniform', 'subsample': 0.6095137818380654, 'gamma': 5.75268892238416}. Best is trial 181 with value: 4.214751273954899.
[I 2023-12-19 04:23:16,031] Trial 182 finished with value: 4.232102749103957 and parameters: {'learning_rate': 0.742361230521638, 'aft_loss_distribution': 'normal', 'aft_loss_distribution_scale': 1.0897459360784576, 'max_depth': 7, 'booster': 'dart', 'scale_pos_weight': 7.142993751362265, 'alpha': 5.708978491587395, 'lambda': 9.126377082148498, 'eta': 0.5687246529921706, 'sampling_method': 'uniform', 'subsample': 0.6369775334971681, 'gamma': 5.64611217189579}. Best is trial 181 with value: 4.214751273954899.
[I 2023-12-19 04:23:16,127] Trial 183 pruned. Trial was pruned at iteration 0.
[I 2023-12-19 04:23:19,852] Trial 184 finished with value: inf and parameters: {'learning_rate': 0.8318669471198789, 'aft_loss_distribution': 'normal', 'aft_loss_distribution_scale': 1.0526904994869095, 'max_depth': 7, 'booster': 'dart', 'scale_pos_weight': 7.233489510646546, 'alpha': 5.825831010564362, 'lambda': 9.363555124790484, 'eta': 0.6065354275223392, 'sampling_method': 'uniform', 'subsample': 0.589499035519723, 'gamma': 5.686586308382333}. Best is trial 181 with value: 4.214751273954899.
[I 2023-12-19 04:23:19,948] Trial 185 pruned. Trial was pruned at iteration 0.
[I 2023-12-19 04:23:20,042] Trial 186 pruned. Trial was pruned at iteration 0.
[I 2023-12-19 04:23:28,661] Trial 187 finished with value: inf and parameters: {'learning_rate': 0.7303728068665634, 'aft_loss_distribution': 'normal', 'aft_loss_distribution_scale': 1.3419401923330925, 'max_depth': 7, 'booster': 'dart', 'scale_pos_weight': 7.326254612718105, 'alpha': 5.938040253093668, 'lambda': 8.630492250731086, 'eta': 0.6258782647792713, 'sampling_method': 'uniform', 'subsample': 0.6543304055476193, 'gamma': 5.1978993132599545}. Best is trial 181 with value: 4.214751273954899.
[I 2023-12-19 04:23:32,389] Trial 188 finished with value: inf and parameters: {'learning_rate': 0.7653450111272437, 'aft_loss_distribution': 'normal', 'aft_loss_distribution_scale': 1.2015147484504027, 'max_depth': 7, 'booster': 'dart', 'scale_pos_weight': 7.6251481340682075, 'alpha': 5.519607397891718, 'lambda': 9.310640776474203, 'eta': 0.5375358512251481, 'sampling_method': 'uniform', 'subsample': 0.6224603347709694, 'gamma': 5.038765153139159}. Best is trial 181 with value: 4.214751273954899.
[I 2023-12-19 04:23:32,491] Trial 189 pruned. Trial was pruned at iteration 0.
[I 2023-12-19 04:23:32,580] Trial 190 pruned. Trial was pruned at iteration 0.
[I 2023-12-19 04:23:37,116] Trial 191 finished with value: inf and parameters: {'learning_rate': 0.6811646921844792, 'aft_loss_distribution': 'normal', 'aft_loss_distribution_scale': 1.384917447954874, 'max_depth': 7, 'booster': 'dart', 'scale_pos_weight': 7.535072557225909, 'alpha': 6.009720989708762, 'lambda': 0.8352473429809377, 'eta': 0.5862776783319499, 'sampling_method': 'uniform', 'subsample': 0.6609300403534304, 'gamma': 4.645931408040377}. Best is trial 181 with value: 4.214751273954899.
[I 2023-12-19 04:23:37,225] Trial 192 pruned. Trial was pruned at iteration 2.
[I 2023-12-19 04:23:47,129] Trial 193 finished with value: 4.231308617745232 and parameters: {'learning_rate': 0.717066754421266, 'aft_loss_distribution': 'normal', 'aft_loss_distribution_scale': 1.1471419587282177, 'max_depth': 7, 'booster': 'dart', 'scale_pos_weight': 7.790352847949556, 'alpha': 5.3074622265756055, 'lambda': 9.326268308235077, 'eta': 0.6412726200312903, 'sampling_method': 'uniform', 'subsample': 0.670410529130168, 'gamma': 5.889776805109375}. Best is trial 181 with value: 4.214751273954899.
[I 2023-12-19 04:23:47,220] Trial 194 pruned. Trial was pruned at iteration 0.
[I 2023-12-19 04:23:52,482] Trial 195 finished with value: 4.245283850247921 and parameters: {'learning_rate': 0.751240543477131, 'aft_loss_distribution': 'normal', 'aft_loss_distribution_scale': 1.1891970605136635, 'max_depth': 7, 'booster': 'dart', 'scale_pos_weight': 7.1569630656539, 'alpha': 5.271869305802479, 'lambda': 9.642837586872794, 'eta': 0.561605474668241, 'sampling_method': 'uniform', 'subsample': 0.649033758620559, 'gamma': 5.462354168316693}. Best is trial 181 with value: 4.214751273954899.
[I 2023-12-19 04:23:52,575] Trial 196 pruned. Trial was pruned at iteration 0.
[I 2023-12-19 04:24:00,663] Trial 197 finished with value: inf and parameters: {'learning_rate': 0.787708396472564, 'aft_loss_distribution': 'normal', 'aft_loss_distribution_scale': 1.1613299870995595, 'max_depth': 7, 'booster': 'dart', 'scale_pos_weight': 7.414238622494431, 'alpha': 5.3036844112855075, 'lambda': 9.71916785132734, 'eta': 0.5649760681043401, 'sampling_method': 'uniform', 'subsample': 0.6970141999946382, 'gamma': 6.042355599292458}. Best is trial 181 with value: 4.214751273954899.
[I 2023-12-19 04:24:00,860] Trial 198 pruned. Trial was pruned at iteration 0.
[I 2023-12-19 04:24:01,180] Trial 199 pruned. Trial was pruned at iteration 0.
[I 2023-12-19 04:24:01,490] Trial 200 pruned. Trial was pruned at iteration 0.
[I 2023-12-19 04:24:15,519] Trial 201 finished with value: 4.299514571160951 and parameters: {'learning_rate': 0.6792919050338438, 'aft_loss_distribution': 'normal', 'aft_loss_distribution_scale': 1.402645511533286, 'max_depth': 7, 'booster': 'dart', 'scale_pos_weight': 7.7625444296123725, 'alpha': 4.871960937093615, 'lambda': 9.199450322639589, 'eta': 0.5531368056915977, 'sampling_method': 'uniform', 'subsample': 0.5878855752716878, 'gamma': 4.793401307878487}. Best is trial 181 with value: 4.214751273954899.
[I 2023-12-19 04:24:15,683] Trial 202 pruned. Trial was pruned at iteration 5.
[I 2023-12-19 04:24:29,184] Trial 203 finished with value: 4.287127044842264 and parameters: {'learning_rate': 0.7376640310858927, 'aft_loss_distribution': 'normal', 'aft_loss_distribution_scale': 1.378196457805447, 'max_depth': 7, 'booster': 'dart', 'scale_pos_weight': 7.306872443546505, 'alpha': 4.8252043720388045, 'lambda': 9.2926706106634, 'eta': 0.5239832971770347, 'sampling_method': 'uniform', 'subsample': 0.5968541054013562, 'gamma': 5.40201119484465}. Best is trial 181 with value: 4.214751273954899.
[I 2023-12-19 04:25:02,419] Trial 204 finished with value: 4.258607408178759 and parameters: {'learning_rate': 0.7384440208086559, 'aft_loss_distribution': 'normal', 'aft_loss_distribution_scale': 1.294181014636852, 'max_depth': 7, 'booster': 'dart', 'scale_pos_weight': 7.302336445527089, 'alpha': 4.7470300457791765, 'lambda': 9.492675828409586, 'eta': 0.5275488662570227, 'sampling_method': 'uniform', 'subsample': 0.5948574362533449, 'gamma': 5.312356215273066}. Best is trial 181 with value: 4.214751273954899.
[I 2023-12-19 04:25:14,726] Trial 205 finished with value: 4.257303089321498 and parameters: {'learning_rate': 0.7305372258679783, 'aft_loss_distribution': 'normal', 'aft_loss_distribution_scale': 1.2537272584873067, 'max_depth': 7, 'booster': 'dart', 'scale_pos_weight': 7.3164374581597365, 'alpha': 4.269652577866409, 'lambda': 9.298452141190259, 'eta': 0.5229541205484233, 'sampling_method': 'uniform', 'subsample': 0.5929479467120734, 'gamma': 5.418787157768311}. Best is trial 181 with value: 4.214751273954899.
[I 2023-12-19 04:25:42,581] Trial 206 finished with value: 4.243290962861829 and parameters: {'learning_rate': 0.7394510116536178, 'aft_loss_distribution': 'normal', 'aft_loss_distribution_scale': 1.1965400513956257, 'max_depth': 7, 'booster': 'dart', 'scale_pos_weight': 7.247240131854312, 'alpha': 4.8207879757544925, 'lambda': 9.022745344342985, 'eta': 0.5253239450441577, 'sampling_method': 'uniform', 'subsample': 0.5890422642844776, 'gamma': 5.8590832811543745}. Best is trial 181 with value: 4.214751273954899.
[I 2023-12-19 04:25:42,789] Trial 207 pruned. Trial was pruned at iteration 0.
[I 2023-12-19 04:26:21,564] Trial 208 finished with value: 4.22363747151697 and parameters: {'learning_rate': 0.7469158996003374, 'aft_loss_distribution': 'normal', 'aft_loss_distribution_scale': 1.1798559392349113, 'max_depth': 7, 'booster': 'dart', 'scale_pos_weight': 6.895218539601502, 'alpha': 4.2693012637952625, 'lambda': 9.21446479580619, 'eta': 0.5291984152052558, 'sampling_method': 'uniform', 'subsample': 0.5945896652289414, 'gamma': 5.322101479609046}. Best is trial 181 with value: 4.214751273954899.
[I 2023-12-19 04:26:29,286] Trial 209 finished with value: inf and parameters: {'learning_rate': 0.7526903160534395, 'aft_loss_distribution': 'normal', 'aft_loss_distribution_scale': 1.1518518765014463, 'max_depth': 7, 'booster': 'dart', 'scale_pos_weight': 6.735421361753516, 'alpha': 4.514941186857108, 'lambda': 9.234422285527904, 'eta': 0.5177802362420121, 'sampling_method': 'uniform', 'subsample': 0.596301035530784, 'gamma': 6.238683995709995}. Best is trial 181 with value: 4.214751273954899.
[I 2023-12-19 04:26:29,375] Trial 210 pruned. Trial was pruned at iteration 0.
[I 2023-12-19 04:26:54,329] Trial 211 finished with value: 4.26590522192693 and parameters: {'learning_rate': 0.7327075817591144, 'aft_loss_distribution': 'normal', 'aft_loss_distribution_scale': 1.3140188434909899, 'max_depth': 7, 'booster': 'dart', 'scale_pos_weight': 7.110124007085719, 'alpha': 4.789474113260197, 'lambda': 9.127244961137084, 'eta': 0.5287968622421043, 'sampling_method': 'uniform', 'subsample': 0.5989250127452728, 'gamma': 5.42567901567136}. Best is trial 181 with value: 4.214751273954899.
