[I 2023-12-21 02:59:00,056] Trial 164 finished with value: 4.457115452694838 and parameters: {'learning_rate': 0.6187656805368028, 'aft_l                                                                     oss_distribution': 'normal', 'aft_loss_distribution_scale': 1.8205873798993966, 'max_depth': 7, 'booster': 'gbtree', 'scale_pos_weight':                                                                      7.0555923240612906, 'alpha': 4.230034901313718, 'lambda': 7.325076517011374, 'eta': 0.9997665745257365, 'sampling_method': 'gradient_base                                                                     d', 'subsample': 0.7498634521969206, 'gamma': 4.176400940943109}. Best is trial 158 with value: 4.371896944977992.
[I 2023-12-21 02:59:00,377] Trial 165 finished with value: 4.465505305572773 and parameters: {'learning_rate': 0.6231448379078055, 'aft_l                                                                     oss_distribution': 'normal', 'aft_loss_distribution_scale': 1.841496513850994, 'max_depth': 7, 'booster': 'gbtree', 'scale_pos_weight': 7                                                                     .004666328503151, 'alpha': 4.26446411767364, 'lambda': 7.155813767516699, 'eta': 0.9817715175052748, 'sampling_method': 'gradient_based',                                                                      'subsample': 0.7556068564228975, 'gamma': 4.239922909556403}. Best is trial 158 with value: 4.371896944977992.
[I 2023-12-21 02:59:00,541] Trial 166 finished with value: 4.469063686922251 and parameters: {'learning_rate': 0.6280025248392479, 'aft_l                                                                     oss_distribution': 'normal', 'aft_loss_distribution_scale': 1.8557478601260868, 'max_depth': 7, 'booster': 'gbtree', 'scale_pos_weight':                                                                      7.118176922579321, 'alpha': 4.202128465217701, 'lambda': 7.199559958789662, 'eta': 0.9995392352225033, 'sampling_method': 'gradient_based                                                                     ', 'subsample': 0.7512084882119293, 'gamma': 4.324399820476196}. Best is trial 158 with value: 4.371896944977992.
[I 2023-12-21 02:59:00,679] Trial 167 finished with value: inf and parameters: {'learning_rate': 0.6285926566466715, 'aft_loss_distributi                                                                     on': 'normal', 'aft_loss_distribution_scale': 1.5679977293549798, 'max_depth': 7, 'booster': 'gbtree', 'scale_pos_weight': 7.007345995017                                                                     183, 'alpha': 4.272553353258469, 'lambda': 7.210025575930693, 'eta': 0.9958981484561583, 'sampling_method': 'gradient_based', 'subsample'                                                                     : 0.7504973762532161, 'gamma': 4.241468545645285}. Best is trial 158 with value: 4.371896944977992.
[I 2023-12-21 02:59:00,822] Trial 168 finished with value: inf and parameters: {'learning_rate': 0.6613169706692043, 'aft_loss_distributi                                                                     on': 'normal', 'aft_loss_distribution_scale': 1.3443546474240136, 'max_depth': 7, 'booster': 'gbtree', 'scale_pos_weight': 6.686931966945                                                                     994, 'alpha': 4.139540007789751, 'lambda': 7.168971442297465, 'eta': 0.9994322137166509, 'sampling_method': 'gradient_based', 'subsample'                                                                     : 0.711368552583397, 'gamma': 4.496938424249972}. Best is trial 158 with value: 4.371896944977992.
[I 2023-12-21 02:59:01,014] Trial 169 finished with value: 4.455061192341009 and parameters: {'learning_rate': 0.6184875766552695, 'aft_l                                                                     oss_distribution': 'normal', 'aft_loss_distribution_scale': 1.813215437868743, 'max_depth': 7, 'booster': 'gbtree', 'scale_pos_weight': 6                                                                     .140249110135903, 'alpha': 4.038798779362282, 'lambda': 7.418891579846333, 'eta': 0.9758593900236902, 'sampling_method': 'gradient_based'                                                                     , 'subsample': 0.7663493705609226, 'gamma': 4.659477987711899}. Best is trial 158 with value: 4.371896944977992.
[I 2023-12-21 02:59:01,152] Trial 170 finished with value: inf and parameters: {'learning_rate': 0.6712371392283751, 'aft_loss_distributi                                                                     on': 'normal', 'aft_loss_distribution_scale': 1.157065644551141, 'max_depth': 7, 'booster': 'gbtree', 'scale_pos_weight': 5.9091724718449                                                                     77, 'alpha': 3.81772628744593, 'lambda': 7.328575100760328, 'eta': 0.9772533866440871, 'sampling_method': 'gradient_based', 'subsample':                                                                      0.7670942829472047, 'gamma': 4.645401717904903}. Best is trial 158 with value: 4.371896944977992.
[I 2023-12-21 02:59:01,280] Trial 171 finished with value: inf and parameters: {'learning_rate': 0.61203891689282, 'aft_loss_distribution                                                                     ': 'normal', 'aft_loss_distribution_scale': 1.8882331023213548, 'max_depth': 7, 'booster': 'gbtree', 'scale_pos_weight': 7.08447297559352                                                                     8, 'alpha': 4.062061393565169, 'lambda': 6.938006142761153, 'eta': 0.9654466146661757, 'sampling_method': 'gradient_based', 'subsample':                                                                      0.7444677559105655, 'gamma': 4.922792223295582}. Best is trial 158 with value: 4.371896944977992.
[I 2023-12-21 02:59:01,422] Trial 172 finished with value: inf and parameters: {'learning_rate': 0.6417153626085124, 'aft_loss_distributi                                                                     on': 'normal', 'aft_loss_distribution_scale': 1.747647865228854, 'max_depth': 7, 'booster': 'gbtree', 'scale_pos_weight': 5.4868560061422                                                                     94, 'alpha': 4.378356182192432, 'lambda': 7.670842244791469, 'eta': 0.9511366185318259, 'sampling_method': 'gradient_based', 'subsample':                                                                      0.7787666255083762, 'gamma': 4.255686910401524}. Best is trial 158 with value: 4.371896944977992.
[I 2023-12-21 02:59:01,576] Trial 173 finished with value: inf and parameters: {'learning_rate': 0.6213290028677714, 'aft_loss_distributi                                                                     on': 'normal', 'aft_loss_distribution_scale': 1.603148546370841, 'max_depth': 7, 'booster': 'gbtree', 'scale_pos_weight': 6.3269564378151                                                                     87, 'alpha': 4.2874683736499595, 'lambda': 7.427092219865651, 'eta': 0.9812224196077539, 'sampling_method': 'gradient_based', 'subsample'                                                                     : 0.7340830566268502, 'gamma': 4.092609035169785}. Best is trial 158 with value: 4.371896944977992.
[I 2023-12-21 02:59:01,801] Trial 174 finished with value: 4.483363768104791 and parameters: {'learning_rate': 0.5850789744000148, 'aft_l                                                                     oss_distribution': 'normal', 'aft_loss_distribution_scale': 1.8960054368627794, 'max_depth': 7, 'booster': 'gbtree', 'scale_pos_weight':                                                                      6.916608887900895, 'alpha': 3.6499692975511344, 'lambda': 7.497027999307479, 'eta': 0.9473376841366099, 'sampling_method': 'gradient_base                                                                     d', 'subsample': 0.7549916008372235, 'gamma': 3.483229939516782}. Best is trial 158 with value: 4.371896944977992.
[I 2023-12-21 02:59:01,976] Trial 175 finished with value: 4.452378104545609 and parameters: {'learning_rate': 0.587944444518646, 'aft_lo                                                                     ss_distribution': 'normal', 'aft_loss_distribution_scale': 1.8091289790675567, 'max_depth': 7, 'booster': 'gbtree', 'scale_pos_weight': 6                                                                     .907827621952762, 'alpha': 3.575071702903163, 'lambda': 7.155744978145615, 'eta': 0.9991205405919033, 'sampling_method': 'gradient_based'                                                                     , 'subsample': 0.7147627758223931, 'gamma': 3.7661488793075746}. Best is trial 158 with value: 4.371896944977992.
[I 2023-12-21 02:59:02,013] Trial 176 pruned. Trial was pruned at iteration 0.
[I 2023-12-21 02:59:03,163] Trial 177 finished with value: inf and parameters: {'learning_rate': 0.6127299090193558, 'aft_loss_distributi                                                                     on': 'normal', 'aft_loss_distribution_scale': 1.4059062998411969, 'max_depth': 7, 'booster': 'dart', 'scale_pos_weight': 6.13354931259835                                                                     1, 'alpha': 3.8448424236624303, 'lambda': 6.750366514613564, 'eta': 0.9950526905516304, 'sampling_method': 'gradient_based', 'subsample':                                                                      0.7180701663974433, 'gamma': 3.7692552748806745}. Best is trial 158 with value: 4.371896944977992.
[I 2023-12-21 02:59:03,315] Trial 178 finished with value: inf and parameters: {'learning_rate': 0.6340880234429738, 'aft_loss_distributi                                                                     on': 'normal', 'aft_loss_distribution_scale': 1.7120929712993445, 'max_depth': 6, 'booster': 'gbtree', 'scale_pos_weight': 6.678304992956                                                                     947, 'alpha': 4.018911332141622, 'lambda': 7.465974757681189, 'eta': 0.9651167275999192, 'sampling_method': 'gradient_based', 'subsample'                                                                     : 0.7595352939571306, 'gamma': 3.1271436966344304}. Best is trial 158 with value: 4.371896944977992.
[I 2023-12-21 02:59:03,352] Trial 179 pruned. Trial was pruned at iteration 0.
[I 2023-12-21 02:59:03,485] Trial 180 finished with value: inf and parameters: {'learning_rate': 0.6510257911745227, 'aft_loss_distributi                                                                     on': 'normal', 'aft_loss_distribution_scale': 1.2907476322746714, 'max_depth': 7, 'booster': 'gbtree', 'scale_pos_weight': 6.813162191474                                                                     78, 'alpha': 3.079489638180059, 'lambda': 7.2551717444939445, 'eta': 0.9974924503127209, 'sampling_method': 'gradient_based', 'subsample'                                                                     : 0.7787437906351843, 'gamma': 4.372745527218985}. Best is trial 158 with value: 4.371896944977992.
[I 2023-12-21 02:59:03,745] Trial 181 finished with value: 4.488815805535835 and parameters: {'learning_rate': 0.5806505058954223, 'aft_l                                                                     oss_distribution': 'normal', 'aft_loss_distribution_scale': 1.9139893771684724, 'max_depth': 7, 'booster': 'gbtree', 'scale_pos_weight':                                                                      7.286358428095404, 'alpha': 4.099701407867155, 'lambda': 7.63985315869691, 'eta': 0.967300799864308, 'sampling_method': 'gradient_based',                                                                      'subsample': 0.7976829161921245, 'gamma': 4.538594574478527}. Best is trial 158 with value: 4.371896944977992.
[I 2023-12-21 02:59:03,907] Trial 182 finished with value: 4.493730700337162 and parameters: {'learning_rate': 0.5856406076589753, 'aft_l                                                                     oss_distribution': 'normal', 'aft_loss_distribution_scale': 1.9279119194746115, 'max_depth': 7, 'booster': 'gbtree', 'scale_pos_weight':                                                                      7.418498088262988, 'alpha': 3.6344873465918095, 'lambda': 7.591925552120797, 'eta': 0.970828449498704, 'sampling_method': 'gradient_based                                                                     ', 'subsample': 0.755468682257627, 'gamma': 4.692481431996788}. Best is trial 158 with value: 4.371896944977992.
[I 2023-12-21 02:59:04,162] Trial 183 finished with value: 4.479576016119007 and parameters: {'learning_rate': 0.5859512211940242, 'aft_l                                                                     oss_distribution': 'normal', 'aft_loss_distribution_scale': 1.8875514924199017, 'max_depth': 7, 'booster': 'gbtree', 'scale_pos_weight':                                                                      7.406029927366856, 'alpha': 3.830561269489953, 'lambda': 7.626650838471604, 'eta': 0.9738814539315647, 'sampling_method': 'gradient_based                                                                     ', 'subsample': 0.7489850087914076, 'gamma': 4.656939617698401}. Best is trial 158 with value: 4.371896944977992.
[I 2023-12-21 02:59:04,518] Trial 184 finished with value: 4.479693542546583 and parameters: {'learning_rate': 0.6114666837359144, 'aft_l                                                                     oss_distribution': 'normal', 'aft_loss_distribution_scale': 1.880535525089231, 'max_depth': 7, 'booster': 'gbtree', 'scale_pos_weight': 7                                                                     .338829315823292, 'alpha': 3.7950552020070876, 'lambda': 7.582793752635422, 'eta': 0.9727986752682445, 'sampling_method': 'gradient_based                                                                     ', 'subsample': 0.7543004726784005, 'gamma': 4.559901147618877}. Best is trial 158 with value: 4.371896944977992.
[I 2023-12-21 02:59:04,888] Trial 185 finished with value: 4.373886046603549 and parameters: {'learning_rate': 0.614819025189984, 'aft_lo                                                                     ss_distribution': 'normal', 'aft_loss_distribution_scale': 1.5741716291097636, 'max_depth': 7, 'booster': 'gbtree', 'scale_pos_weight': 7                                                                     .310694713025862, 'alpha': 3.5869235772625814, 'lambda': 7.5864791412425, 'eta': 0.9776512119593621, 'sampling_method': 'gradient_based',                                                                      'subsample': 0.7478589425460636, 'gamma': 4.595064235313091}. Best is trial 158 with value: 4.371896944977992.
[I 2023-12-21 02:59:05,039] Trial 186 finished with value: 4.363417058759152 and parameters: {'learning_rate': 0.6179575678568143, 'aft_l                                                                     oss_distribution': 'normal', 'aft_loss_distribution_scale': 1.5561167765610011, 'max_depth': 7, 'booster': 'gbtree', 'scale_pos_weight':                                                                      7.38160936881183, 'alpha': 3.688175696996545, 'lambda': 7.598449393996999, 'eta': 0.9761871248075309, 'sampling_method': 'gradient_based'                                                                     , 'subsample': 0.7488887813995551, 'gamma': 4.781115528202493}. Best is trial 186 with value: 4.363417058759152.
[I 2023-12-21 02:59:05,217] Trial 187 finished with value: 4.356922745866618 and parameters: {'learning_rate': 0.6257485373726199, 'aft_l                                                                     oss_distribution': 'normal', 'aft_loss_distribution_scale': 1.5417977206259927, 'max_depth': 7, 'booster': 'gbtree', 'scale_pos_weight':                                                                      7.373588675034655, 'alpha': 3.7062331638314894, 'lambda': 7.645333012764944, 'eta': 0.9621477310679473, 'sampling_method': 'uniform', 'su                                                                     bsample': 0.7488585406371314, 'gamma': 4.769531988290281}. Best is trial 187 with value: 4.356922745866618.
[I 2023-12-21 02:59:05,361] Trial 188 finished with value: 4.348943369104032 and parameters: {'learning_rate': 0.6694525388139565, 'aft_l                                                                     oss_distribution': 'normal', 'aft_loss_distribution_scale': 1.5128482940536465, 'max_depth': 7, 'booster': 'gbtree', 'scale_pos_weight':                                                                      7.268363222974432, 'alpha': 3.739242740029088, 'lambda': 7.695272564073247, 'eta': 0.9596860092893328, 'sampling_method': 'uniform', 'sub                                                                     sample': 0.7439551277613734, 'gamma': 4.886472695569543}. Best is trial 188 with value: 4.348943369104032.
[I 2023-12-21 02:59:05,496] Trial 189 finished with value: inf and parameters: {'learning_rate': 0.6731268509398682, 'aft_loss_distributi                                                                     on': 'normal', 'aft_loss_distribution_scale': 1.530714705381806, 'max_depth': 7, 'booster': 'gbtree', 'scale_pos_weight': 7.1043538018533                                                                     06, 'alpha': 3.6852970518442456, 'lambda': 7.7269862683114106, 'eta': 0.9572856198496236, 'sampling_method': 'uniform', 'subsample': 0.73                                                                     57634719291845, 'gamma': 5.043965556401159}. Best is trial 188 with value: 4.348943369104032.
[I 2023-12-21 02:59:05,617] Trial 190 finished with value: inf and parameters: {'learning_rate': 0.6454412502919662, 'aft_loss_distributi                                                                     on': 'normal', 'aft_loss_distribution_scale': 1.549182972737523, 'max_depth': 7, 'booster': 'gbtree', 'scale_pos_weight': 7.3517036102530                                                                     95, 'alpha': 3.3861083917704287, 'lambda': 7.4344034066227, 'eta': 0.9992592371907729, 'sampling_method': 'uniform', 'subsample': 0.71181                                                                     86168487832, 'gamma': 4.851158775455929}. Best is trial 188 with value: 4.348943369104032.
[I 2023-12-21 02:59:05,787] Trial 191 finished with value: 4.42639831644303 and parameters: {'learning_rate': 0.6199592987726108, 'aft_lo                                                                     ss_distribution': 'normal', 'aft_loss_distribution_scale': 1.7372525820462867, 'max_depth': 7, 'booster': 'gbtree', 'scale_pos_weight': 7                                                                     .314218506931347, 'alpha': 3.9795482324374203, 'lambda': 7.616777515318814, 'eta': 0.9626629618094987, 'sampling_method': 'uniform', 'sub                                                                     sample': 0.755890498201014, 'gamma': 4.54024582211646}. Best is trial 188 with value: 4.348943369104032.
[I 2023-12-21 02:59:06,012] Trial 192 finished with value: 4.420143064764756 and parameters: {'learning_rate': 0.6251136542453893, 'aft_l                                                                     oss_distribution': 'normal', 'aft_loss_distribution_scale': 1.7174360641751554, 'max_depth': 7, 'booster': 'gbtree', 'scale_pos_weight':                                                                      7.21758688480311, 'alpha': 3.8128115404127625, 'lambda': 7.200890191292651, 'eta': 0.955448298643008, 'sampling_method': 'uniform', 'subs                                                                     ample': 0.759383607976881, 'gamma': 4.236628719597112}. Best is trial 188 with value: 4.348943369104032.
[I 2023-12-21 02:59:06,049] Trial 193 pruned. Trial was pruned at iteration 0.
[I 2023-12-21 02:59:06,085] Trial 194 pruned. Trial was pruned at iteration 0.
[I 2023-12-21 02:59:06,321] Trial 195 finished with value: 4.402354775656794 and parameters: {'learning_rate': 0.6138308594587566, 'aft_l                                                                     oss_distribution': 'normal', 'aft_loss_distribution_scale': 1.6703835722772642, 'max_depth': 7, 'booster': 'gbtree', 'scale_pos_weight':                                                                      7.158133617913261, 'alpha': 3.840130251192027, 'lambda': 6.834218410537197, 'eta': 0.9978968126538034, 'sampling_method': 'uniform', 'sub                                                                     sample': 0.7241546002115942, 'gamma': 4.341647656539421}. Best is trial 188 with value: 4.348943369104032.
[I 2023-12-21 02:59:06,596] Trial 196 finished with value: 4.382851537693106 and parameters: {'learning_rate': 0.6382332516877114, 'aft_l                                                                     oss_distribution': 'normal', 'aft_loss_distribution_scale': 1.6111206028615692, 'max_depth': 7, 'booster': 'gbtree', 'scale_pos_weight':                                                                      7.141543171543151, 'alpha': 7.848289267966505, 'lambda': 6.870887353677445, 'eta': 0.9798377890828115, 'sampling_method': 'uniform', 'sub                                                                     sample': 0.690287638624187, 'gamma': 4.382400668868741}. Best is trial 188 with value: 4.348943369104032.
