[I 2023-12-19 00:05:19,880] Trial 377 pruned. Trial was pruned at iteration 0.
[I 2023-12-19 00:05:21,347] Trial 378 finished with value: inf and parameters: {'learning_rate': 0.974874757740048, 'aft_loss_distribution': 'normal', 'aft_loss_distribution_scale': 1.7380910941588077, 'max_depth': 8, 'booster': 'dart', 'scale_pos_weight': 0.7175092033404044, 'alpha': 2.4598575507029876, 'lambda': 3.33387066850689, 'eta': 0.25471723483495406, 'sampling_method': 'gradient_based', 'subsample': 0.6202645508539335, 'gamma': 9.30711082297974}. Best is trial 236 with value: 2.000108025662045.
[I 2023-12-19 00:05:21,438] Trial 379 pruned. Trial was pruned at iteration 0.
[I 2023-12-19 00:05:21,529] Trial 380 pruned. Trial was pruned at iteration 1.
[I 2023-12-19 00:05:21,623] Trial 381 pruned. Trial was pruned at iteration 0.
[I 2023-12-19 00:05:23,111] Trial 382 finished with value: inf and parameters: {'learning_rate': 0.9982464449863763, 'aft_loss_distribution': 'normal', 'aft_loss_distribution_scale': 1.441486424910821, 'max_depth': 7, 'booster': 'dart', 'scale_pos_weight': 0.334172931152769, 'alpha': 1.8184126907119524, 'lambda': 8.43780994889472, 'eta': 0.38071237971094885, 'sampling_method': 'gradient_based', 'subsample': 0.7674744546184954, 'gamma': 8.450655427887623}. Best is trial 236 with value: 2.000108025662045.
[I 2023-12-19 00:05:23,198] Trial 383 pruned. Trial was pruned at iteration 0.
[I 2023-12-19 00:05:23,284] Trial 384 pruned. Trial was pruned at iteration 0.
[I 2023-12-19 00:05:23,370] Trial 385 pruned. Trial was pruned at iteration 0.
[I 2023-12-19 00:05:23,454] Trial 386 pruned. Trial was pruned at iteration 0.
[I 2023-12-19 00:05:23,539] Trial 387 pruned. Trial was pruned at iteration 0.
[I 2023-12-19 00:05:23,627] Trial 388 pruned. Trial was pruned at iteration 2.
[I 2023-12-19 00:05:23,719] Trial 389 pruned. Trial was pruned at iteration 0.
[I 2023-12-19 00:05:23,807] Trial 390 pruned. Trial was pruned at iteration 1.
[I 2023-12-19 00:05:23,900] Trial 391 pruned. Trial was pruned at iteration 0.
[I 2023-12-19 00:05:25,287] Trial 392 finished with value: inf and parameters: {'learning_rate': 0.9988476390425075, 'aft_loss_distribution': 'normal', 'aft_loss_distribution_scale': 1.2279031936869793, 'max_depth': 10, 'booster': 'dart', 'scale_pos_weight': 0.2141478491035421, 'alpha': 2.997512885433642, 'lambda': 2.9229089737518223, 'eta': 0.1587338892288627, 'sampling_method': 'gradient_based', 'subsample': 0.745788360889855, 'gamma': 8.35677796613345}. Best is trial 236 with value: 2.000108025662045.
[I 2023-12-19 00:05:25,377] Trial 393 pruned. Trial was pruned at iteration 0.
[I 2023-12-19 00:05:25,464] Trial 394 pruned. Trial was pruned at iteration 0.
[I 2023-12-19 00:05:42,888] Trial 395 finished with value: 2.0144200191086457 and parameters: {'learning_rate': 0.9690282939535783, 'aft_loss_distribution': 'normal', 'aft_loss_distribution_scale': 1.8010702735750121, 'max_depth': 10, 'booster': 'dart', 'scale_pos_weight': 0.1321514827783142, 'alpha': 2.746366335090711, 'lambda': 2.410287261696113, 'eta': 0.11177370537535539, 'sampling_method': 'gradient_based', 'subsample': 0.7000602119999597, 'gamma': 9.313244003474432}. Best is trial 236 with value: 2.000108025662045.
[I 2023-12-19 00:05:44,529] Trial 396 finished with value: inf and parameters: {'learning_rate': 0.9688279550879665, 'aft_loss_distribution': 'normal', 'aft_loss_distribution_scale': 1.3862263941468518, 'max_depth': 10, 'booster': 'dart', 'scale_pos_weight': 0.11782438202829407, 'alpha': 2.791929543798117, 'lambda': 2.4351206106721612, 'eta': 0.09612154285605862, 'sampling_method': 'gradient_based', 'subsample': 0.7070653694615325, 'gamma': 9.07480061617329}. Best is trial 236 with value: 2.000108025662045.
[I 2023-12-19 00:05:48,023] Trial 397 finished with value: inf and parameters: {'learning_rate': 0.98348653719643, 'aft_loss_distribution': 'normal', 'aft_loss_distribution_scale': 1.7592540442611282, 'max_depth': 8, 'booster': 'dart', 'scale_pos_weight': 0.07525998556504157, 'alpha': 2.9733001159922323, 'lambda': 2.296101689140261, 'eta': 0.07955382509406785, 'sampling_method': 'gradient_based', 'subsample': 0.6964557993712712, 'gamma': 8.869523321202312}. Best is trial 236 with value: 2.000108025662045.
[I 2023-12-19 00:05:51,056] Trial 398 finished with value: inf and parameters: {'learning_rate': 0.9513985596865712, 'aft_loss_distribution': 'normal', 'aft_loss_distribution_scale': 1.5866568477607985, 'max_depth': 10, 'booster': 'dart', 'scale_pos_weight': 2.5488778233491884, 'alpha': 3.2346834869256256, 'lambda': 2.608507875912169, 'eta': 0.12219327958186327, 'sampling_method': 'gradient_based', 'subsample': 0.7263516105340455, 'gamma': 9.278305166289819}. Best is trial 236 with value: 2.000108025662045.
[I 2023-12-19 00:05:51,155] Trial 399 pruned. Trial was pruned at iteration 1.
[I 2023-12-19 00:05:51,237] Trial 400 pruned. Trial was pruned at iteration 0.
[I 2023-12-19 00:05:51,323] Trial 401 pruned. Trial was pruned at iteration 0.
[I 2023-12-19 00:05:54,473] Trial 402 finished with value: 1.9948641073618725 and parameters: {'learning_rate': 0.9809270871637774, 'aft_loss_distribution': 'normal', 'aft_loss_distribution_scale': 1.401243843651638, 'max_depth': 10, 'booster': 'dart', 'scale_pos_weight': 0.44454030109560505, 'alpha': 3.4901561444289744, 'lambda': 2.825275175790986, 'eta': 0.15795570566695077, 'sampling_method': 'gradient_based', 'subsample': 0.6358254864089323, 'gamma': 9.184917746369171}. Best is trial 402 with value: 1.9948641073618725.
[I 2023-12-19 00:05:54,565] Trial 403 pruned. Trial was pruned at iteration 0.
[I 2023-12-19 00:05:54,655] Trial 404 pruned. Trial was pruned at iteration 0.
[I 2023-12-19 00:05:54,748] Trial 405 pruned. Trial was pruned at iteration 0.
[I 2023-12-19 00:05:57,388] Trial 406 finished with value: inf and parameters: {'learning_rate': 0.9541170424885809, 'aft_loss_distribution': 'normal', 'aft_loss_distribution_scale': 1.4356592140637874, 'max_depth': 9, 'booster': 'dart', 'scale_pos_weight': 1.7731480882237056, 'alpha': 3.2979759415989145, 'lambda': 2.3041730615022886, 'eta': 0.19690986665141075, 'sampling_method': 'gradient_based', 'subsample': 0.6619056788470803, 'gamma': 8.832074222950249}. Best is trial 402 with value: 1.9948641073618725.
[I 2023-12-19 00:05:57,482] Trial 407 pruned. Trial was pruned at iteration 0.
[I 2023-12-19 00:05:57,567] Trial 408 pruned. Trial was pruned at iteration 0.
[I 2023-12-19 00:05:59,396] Trial 409 finished with value: inf and parameters: {'learning_rate': 0.9625084061928222, 'aft_loss_distribution': 'normal', 'aft_loss_distribution_scale': 1.615649208155908, 'max_depth': 10, 'booster': 'dart', 'scale_pos_weight': 0.6296585873459783, 'alpha': 3.077649605016045, 'lambda': 2.596872683148456, 'eta': 0.04832905487483173, 'sampling_method': 'gradient_based', 'subsample': 0.6410102396698844, 'gamma': 8.224996234204763}. Best is trial 402 with value: 1.9948641073618725.
[I 2023-12-19 00:06:04,525] Trial 410 finished with value: 2.0124552573311987 and parameters: {'learning_rate': 0.9816488728084788, 'aft_loss_distribution': 'normal', 'aft_loss_distribution_scale': 1.7313112192466997, 'max_depth': 8, 'booster': 'dart', 'scale_pos_weight': 0.23836621375173697, 'alpha': 3.7155906663208027, 'lambda': 2.4139660139682535, 'eta': 0.14519427612565333, 'sampling_method': 'gradient_based', 'subsample': 0.674195597714427, 'gamma': 9.071840521696613}. Best is trial 402 with value: 1.9948641073618725.
[I 2023-12-19 00:06:05,976] Trial 411 finished with value: inf and parameters: {'learning_rate': 0.9818927657066195, 'aft_loss_distribution': 'normal', 'aft_loss_distribution_scale': 1.4128311410422376, 'max_depth': 8, 'booster': 'dart', 'scale_pos_weight': 0.25868025425994967, 'alpha': 3.557451439240802, 'lambda': 2.211856928481864, 'eta': 0.14654861850194112, 'sampling_method': 'gradient_based', 'subsample': 0.6097363453352184, 'gamma': 8.943878472250296}. Best is trial 402 with value: 1.9948641073618725.
[I 2023-12-19 00:06:06,091] Trial 412 pruned. Trial was pruned at iteration 0.
[I 2023-12-19 00:06:06,178] Trial 413 pruned. Trial was pruned at iteration 0.
[I 2023-12-19 00:06:10,158] Trial 414 finished with value: 2.005788886012091 and parameters: {'learning_rate': 0.9711038552977072, 'aft_loss_distribution': 'normal', 'aft_loss_distribution_scale': 1.7131978481430064, 'max_depth': 8, 'booster': 'dart', 'scale_pos_weight': 0.10387709580896833, 'alpha': 3.5761309126838996, 'lambda': 1.9974043694366104, 'eta': 0.10738698853232762, 'sampling_method': 'gradient_based', 'subsample': 0.6598426625786755, 'gamma': 9.163292706137058}. Best is trial 402 with value: 1.9948641073618725.
[I 2023-12-19 00:06:12,483] Trial 415 finished with value: inf and parameters: {'learning_rate': 0.9684702053467757, 'aft_loss_distribution': 'normal', 'aft_loss_distribution_scale': 1.5877090223192332, 'max_depth': 8, 'booster': 'dart', 'scale_pos_weight': 0.13755955891727645, 'alpha': 3.9379683995992423, 'lambda': 1.854283306608094, 'eta': 0.08316441638981384, 'sampling_method': 'gradient_based', 'subsample': 0.651559988921896, 'gamma': 9.125776610140584}. Best is trial 402 with value: 1.9948641073618725.
[I 2023-12-19 00:06:26,769] Trial 416 finished with value: 2.0106416403489535 and parameters: {'learning_rate': 0.9816924880695826, 'aft_loss_distribution': 'normal', 'aft_loss_distribution_scale': 1.7029177870162568, 'max_depth': 8, 'booster': 'dart', 'scale_pos_weight': 0.1421872151469899, 'alpha': 3.671466059862534, 'lambda': 2.0016946887984517, 'eta': 0.08528679446212531, 'sampling_method': 'gradient_based', 'subsample': 0.6664739653123186, 'gamma': 8.85572025029029}. Best is trial 402 with value: 1.9948641073618725.
[I 2023-12-19 00:06:28,561] Trial 417 finished with value: inf and parameters: {'learning_rate': 0.9802879613774705, 'aft_loss_distribution': 'normal', 'aft_loss_distribution_scale': 1.405409769490114, 'max_depth': 8, 'booster': 'dart', 'scale_pos_weight': 0.16265260771692544, 'alpha': 3.885768748077908, 'lambda': 2.022561621362968, 'eta': 0.06655828324774579, 'sampling_method': 'gradient_based', 'subsample': 0.6770793294182044, 'gamma': 8.80292789758722}. Best is trial 402 with value: 1.9948641073618725.
[I 2023-12-19 00:06:28,713] Trial 418 pruned. Trial was pruned at iteration 0.
[I 2023-12-19 00:06:28,869] Trial 419 pruned. Trial was pruned at iteration 0.
[I 2023-12-19 00:06:48,134] Trial 420 finished with value: 2.0071611436068584 and parameters: {'learning_rate': 0.9492826062474891, 'aft_loss_distribution': 'normal', 'aft_loss_distribution_scale': 1.717953568428705, 'max_depth': 8, 'booster': 'dart', 'scale_pos_weight': 0.08239025075004959, 'alpha': 3.890831596100463, 'lambda': 2.337570132560256, 'eta': 0.10095299885429398, 'sampling_method': 'gradient_based', 'subsample': 0.6812860670007413, 'gamma': 9.254667105453263}. Best is trial 402 with value: 1.9948641073618725.
[I 2023-12-19 00:06:49,636] Trial 421 finished with value: inf and parameters: {'learning_rate': 0.9505894804767279, 'aft_loss_distribution': 'normal', 'aft_loss_distribution_scale': 1.6555039428975902, 'max_depth': 8, 'booster': 'dart', 'scale_pos_weight': 0.11209586594291678, 'alpha': 3.7863681061496424, 'lambda': 2.315138516739702, 'eta': 0.05637893782242723, 'sampling_method': 'gradient_based', 'subsample': 0.7235598363366934, 'gamma': 9.195884999612016}. Best is trial 402 with value: 1.9948641073618725.
[I 2023-12-19 00:06:51,082] Trial 422 finished with value: inf and parameters: {'learning_rate': 0.9972201088652883, 'aft_loss_distribution': 'normal', 'aft_loss_distribution_scale': 1.504489457591623, 'max_depth': 8, 'booster': 'dart', 'scale_pos_weight': 1.1153395522260856, 'alpha': 3.614518080147901, 'lambda': 1.9631671562269546, 'eta': 0.00239174899685346, 'sampling_method': 'gradient_based', 'subsample': 0.6932189514973022, 'gamma': 8.911898797676212}. Best is trial 402 with value: 1.9948641073618725.
[I 2023-12-19 00:06:51,183] Trial 423 pruned. Trial was pruned at iteration 0.
[I 2023-12-19 00:06:52,941] Trial 424 finished with value: inf and parameters: {'learning_rate': 0.9819221960085925, 'aft_loss_distribution': 'normal', 'aft_loss_distribution_scale': 1.7311365496515883, 'max_depth': 8, 'booster': 'dart', 'scale_pos_weight': 0.08170197432385462, 'alpha': 3.7866286815153516, 'lambda': 2.4320320564756086, 'eta': 0.1069232861368584, 'sampling_method': 'gradient_based', 'subsample': 0.6825668223992684, 'gamma': 9.08882110218036}. Best is trial 402 with value: 1.9948641073618725.
[I 2023-12-19 00:06:54,439] Trial 425 finished with value: inf and parameters: {'learning_rate': 0.9991988506358325, 'aft_loss_distribution': 'normal', 'aft_loss_distribution_scale': 1.524990571116323, 'max_depth': 8, 'booster': 'dart', 'scale_pos_weight': 0.05824210657841418, 'alpha': 3.4672346843510944, 'lambda': 7.584221028281799, 'eta': 0.10358368591213216, 'sampling_method': 'gradient_based', 'subsample': 0.8008251081347098, 'gamma': 9.379063733057123}. Best is trial 402 with value: 1.9948641073618725.
[I 2023-12-19 00:06:56,028] Trial 426 finished with value: inf and parameters: {'learning_rate': 0.9482702716898924, 'aft_loss_distribution': 'normal', 'aft_loss_distribution_scale': 1.698624008672561, 'max_depth': 8, 'booster': 'dart', 'scale_pos_weight': 0.04981396821120907, 'alpha': 4.067290715175641, 'lambda': 1.8751060887421245, 'eta': 0.0949363576638043, 'sampling_method': 'gradient_based', 'subsample': 0.7045740457338311, 'gamma': 9.387689832889617}. Best is trial 402 with value: 1.9948641073618725.
[I 2023-12-19 00:06:57,853] Trial 427 finished with value: inf and parameters: {'learning_rate': 0.9628738766348308, 'aft_loss_distribution': 'normal', 'aft_loss_distribution_scale': 1.386607188153277, 'max_depth': 8, 'booster': 'dart', 'scale_pos_weight': 0.1050466827098616, 'alpha': 3.4869678405494655, 'lambda': 2.131048558334768, 'eta': 0.11021575536260882, 'sampling_method': 'gradient_based', 'subsample': 0.7225794563501461, 'gamma': 9.023343322163818}. Best is trial 402 with value: 1.9948641073618725.
[I 2023-12-19 00:06:57,999] Trial 428 pruned. Trial was pruned at iteration 0.
[I 2023-12-19 00:06:58,148] Trial 429 pruned. Trial was pruned at iteration 0.
[I 2023-12-19 00:07:00,121] Trial 430 finished with value: inf and parameters: {'learning_rate': 0.9811170509640951, 'aft_loss_distribution': 'normal', 'aft_loss_distribution_scale': 1.5562884153474978, 'max_depth': 8, 'booster': 'dart', 'scale_pos_weight': 0.03971951896806297, 'alpha': 3.3154097664144184, 'lambda': 1.8218680381673982, 'eta': 0.07132110856270334, 'sampling_method': 'gradient_based', 'subsample': 0.7401242220421209, 'gamma': 9.44433409906358}. Best is trial 402 with value: 1.9948641073618725.
[I 2023-12-19 00:07:00,287] Trial 431 pruned. Trial was pruned at iteration 0.
[I 2023-12-19 00:07:00,435] Trial 432 pruned. Trial was pruned at iteration 0.
[I 2023-12-19 00:07:02,252] Trial 433 finished with value: inf and parameters: {'learning_rate': 0.9819279819299951, 'aft_loss_distribution': 'normal', 'aft_loss_distribution_scale': 1.7331217855222072, 'max_depth': 8, 'booster': 'dart', 'scale_pos_weight': 0.22591494691801262, 'alpha': 3.6083628289108525, 'lambda': 2.3409426018199424, 'eta': 0.32735836762974474, 'sampling_method': 'gradient_based', 'subsample': 0.6759975963135779, 'gamma': 9.481001782773479}. Best is trial 402 with value: 1.9948641073618725.
[I 2023-12-19 00:07:02,344] Trial 434 pruned. Trial was pruned at iteration 0.
[I 2023-12-19 00:07:04,016] Trial 435 finished with value: inf and parameters: {'learning_rate': 0.9527928087500329, 'aft_loss_distribution': 'normal', 'aft_loss_distribution_scale': 1.8005400288612379, 'max_depth': 8, 'booster': 'dart', 'scale_pos_weight': 0.1629007486005593, 'alpha': 3.5140761473180517, 'lambda': 2.229400223991191, 'eta': 0.12309069642045611, 'sampling_method': 'gradient_based', 'subsample': 0.7058094736058887, 'gamma': 9.582040120061789}. Best is trial 402 with value: 1.9948641073618725.
[I 2023-12-19 00:07:04,127] Trial 436 pruned. Trial was pruned at iteration 1.
[I 2023-12-19 00:07:04,223] Trial 437 pruned. Trial was pruned at iteration 0.
[I 2023-12-19 00:07:04,316] Trial 438 pruned. Trial was pruned at iteration 0.
[I 2023-12-19 00:07:05,819] Trial 439 finished with value: inf and parameters: {'learning_rate': 0.998933810595189, 'aft_loss_distribution': 'normal', 'aft_loss_distribution_scale': 1.4796942026908122, 'max_depth': 7, 'booster': 'dart', 'scale_pos_weight': 0.3345963715204215, 'alpha': 4.683497224509484, 'lambda': 2.4596836606644037, 'eta': 0.27400055400617823, 'sampling_method': 'gradient_based', 'subsample': 0.6280928295561132, 'gamma': 6.7006162829207945}. Best is trial 402 with value: 1.9948641073618725.
[I 2023-12-19 00:07:05,913] Trial 440 pruned. Trial was pruned at iteration 0.
[I 2023-12-19 00:07:06,005] Trial 441 pruned. Trial was pruned at iteration 1.
[I 2023-12-19 00:07:06,107] Trial 442 pruned. Trial was pruned at iteration 0.
[I 2023-12-19 00:07:07,661] Trial 443 finished with value: inf and parameters: {'learning_rate': 0.954073259644215, 'aft_loss_distribution': 'normal', 'aft_loss_distribution_scale': 1.672438394405139, 'max_depth': 8, 'booster': 'dart', 'scale_pos_weight': 1.9989270097813376, 'alpha': 2.910762998578046, 'lambda': 2.26909073802329, 'eta': 0.1283207840422151, 'sampling_method': 'gradient_based', 'subsample': 0.6556539681533678, 'gamma': 9.225761091225893}. Best is trial 402 with value: 1.9948641073618725.
[I 2023-12-19 00:07:07,762] Trial 444 pruned. Trial was pruned at iteration 1.
[I 2023-12-19 00:07:07,854] Trial 445 pruned. Trial was pruned at iteration 1.
[I 2023-12-19 00:07:07,947] Trial 446 pruned. Trial was pruned at iteration 0.
[I 2023-12-19 00:07:08,034] Trial 447 pruned. Trial was pruned at iteration 0.
[I 2023-12-19 00:07:09,864] Trial 448 finished with value: inf and parameters: {'learning_rate': 0.9670851378536192, 'aft_loss_distribution': 'normal', 'aft_loss_distribution_scale': 1.7055565912820752, 'max_depth': 8, 'booster': 'dart', 'scale_pos_weight': 0.24593148552981003, 'alpha': 2.8941043404900504, 'lambda': 1.8931724991318262, 'eta': 0.14113420376131303, 'sampling_method': 'gradient_based', 'subsample': 0.6484453172995178, 'gamma': 9.146182796274804}. Best is trial 402 with value: 1.9948641073618725.
[I 2023-12-19 00:07:09,961] Trial 449 pruned. Trial was pruned at iteration 0.
[I 2023-12-19 00:07:10,049] Trial 450 pruned. Trial was pruned at iteration 0.
[I 2023-12-19 00:07:10,150] Trial 451 pruned. Trial was pruned at iteration 1.
[I 2023-12-19 00:07:11,798] Trial 452 finished with value: inf and parameters: {'learning_rate': 0.9982313712776814, 'aft_loss_distribution': 'normal', 'aft_loss_distribution_scale': 1.5258456578070545, 'max_depth': 8, 'booster': 'dart', 'scale_pos_weight': 0.03895601007948139, 'alpha': 2.8800457875089602, 'lambda': 2.236170689554066, 'eta': 0.15642284512367083, 'sampling_method': 'uniform', 'subsample': 0.6903952875653105, 'gamma': 8.998476888505248}. Best is trial 402 with value: 1.9948641073618725.
[I 2023-12-19 00:07:11,962] Trial 453 pruned. Trial was pruned at iteration 0.
[I 2023-12-19 00:07:12,124] Trial 454 pruned. Trial was pruned at iteration 0.
[I 2023-12-19 00:07:12,272] Trial 455 pruned. Trial was pruned at iteration 0.
[I 2023-12-19 00:07:12,419] Trial 456 pruned. Trial was pruned at iteration 1.
[I 2023-12-19 00:07:12,564] Trial 457 pruned. Trial was pruned at iteration 0.
[I 2023-12-19 00:07:17,250] Trial 458 finished with value: 1.99648363054047 and parameters: {'learning_rate': 0.9803224695584465, 'aft_loss_distribution': 'normal', 'aft_loss_distribution_scale': 1.6036115643270388, 'max_depth': 8, 'booster': 'dart', 'scale_pos_weight': 0.2231378253839854, 'alpha': 4.354955936257508, 'lambda': 1.6330574339949582, 'eta': 0.14341244659541152, 'sampling_method': 'gradient_based', 'subsample': 0.7370366930877171, 'gamma': 9.062291028183772}. Best is trial 402 with value: 1.9948641073618725.
[I 2023-12-19 00:07:17,349] Trial 459 pruned. Trial was pruned at iteration 0.
[I 2023-12-19 00:07:17,435] Trial 460 pruned. Trial was pruned at iteration 0.
[I 2023-12-19 00:07:17,521] Trial 461 pruned. Trial was pruned at iteration 0.
[I 2023-12-19 00:07:17,620] Trial 462 pruned. Trial was pruned at iteration 0.
[I 2023-12-19 00:07:17,713] Trial 463 pruned. Trial was pruned at iteration 0.
[I 2023-12-19 00:07:17,800] Trial 464 pruned. Trial was pruned at iteration 0.
[I 2023-12-19 00:07:17,888] Trial 465 pruned. Trial was pruned at iteration 0.
[I 2023-12-19 00:07:19,341] Trial 466 finished with value: inf and parameters: {'learning_rate': 0.9506867283935402, 'aft_loss_distribution': 'normal', 'aft_loss_distribution_scale': 1.6392557121136386, 'max_depth': 8, 'booster': 'dart', 'scale_pos_weight': 0.3209246655173608, 'alpha': 3.706181227482265, 'lambda': 1.1230247755521676, 'eta': 0.8298888304489436, 'sampling_method': 'gradient_based', 'subsample': 0.7648360690423176, 'gamma': 2.8132528610012475}. Best is trial 402 with value: 1.9948641073618725.
[I 2023-12-19 00:07:20,834] Trial 467 finished with value: inf and parameters: {'learning_rate': 0.9826097971759449, 'aft_loss_distribution': 'normal', 'aft_loss_distribution_scale': 1.461665546412163, 'max_depth': 8, 'booster': 'dart', 'scale_pos_weight': 0.4476958890655429, 'alpha': 3.3049846937951517, 'lambda': 1.2960053514806849, 'eta': 0.2645648530594067, 'sampling_method': 'gradient_based', 'subsample': 0.8831370988168578, 'gamma': 9.680825863158226}. Best is trial 402 with value: 1.9948641073618725.
[I 2023-12-19 00:07:20,931] Trial 468 pruned. Trial was pruned at iteration 0.
[I 2023-12-19 00:07:21,018] Trial 469 pruned. Trial was pruned at iteration 0.
[I 2023-12-19 00:07:21,113] Trial 470 pruned. Trial was pruned at iteration 0.
[I 2023-12-19 00:07:21,216] Trial 471 pruned. Trial was pruned at iteration 1.
[I 2023-12-19 00:07:21,303] Trial 472 pruned. Trial was pruned at iteration 0.
