[I 2023-12-21 04:05:15,240] Trial 208 pruned. Trial was pruned at iteration 0.
[I 2023-12-21 04:05:15,281] Trial 209 pruned. Trial was pruned at iteration 0.
[I 2023-12-21 04:05:15,324] Trial 210 pruned. Trial was pruned at iteration 0.
[I 2023-12-21 04:05:15,365] Trial 211 pruned. Trial was pruned at iteration 0.
[I 2023-12-21 04:05:15,407] Trial 212 pruned. Trial was pruned at iteration 0.
[I 2023-12-21 04:05:15,449] Trial 213 pruned. Trial was pruned at iteration 0.
[I 2023-12-21 04:05:15,491] Trial 214 pruned. Trial was pruned at iteration 0.
[I 2023-12-21 04:05:16,591] Trial 215 finished with value: inf and parameters: {'learning_rate': 0.9843314726623368, 'aft_loss_distributi                                                                     on': 'normal', 'aft_loss_distribution_scale': 1.257246982632716, 'max_depth': 10, 'booster': 'dart', 'scale_pos_weight': 0.92666033856090                                                                     61, 'alpha': 2.4417850949785187, 'lambda': 6.76719695393049, 'eta': 0.031174943783287157, 'sampling_method': 'gradient_based', 'subsample                                                                     ': 0.5759198648930786, 'gamma': 3.2703847501663423}. Best is trial 109 with value: 2.0061473443077613.
[I 2023-12-21 04:05:16,633] Trial 216 pruned. Trial was pruned at iteration 0.
[I 2023-12-21 04:05:16,673] Trial 217 pruned. Trial was pruned at iteration 0.
[I 2023-12-21 04:05:16,715] Trial 218 pruned. Trial was pruned at iteration 0.
[I 2023-12-21 04:05:16,757] Trial 219 pruned. Trial was pruned at iteration 0.
[I 2023-12-21 04:05:16,798] Trial 220 pruned. Trial was pruned at iteration 0.
[I 2023-12-21 04:05:17,864] Trial 221 finished with value: inf and parameters: {'learning_rate': 0.959390147713348, 'aft_loss_distributio                                                                     n': 'normal', 'aft_loss_distribution_scale': 1.7936076397202605, 'max_depth': 9, 'booster': 'dart', 'scale_pos_weight': 1.928898679198212                                                                     1, 'alpha': 0.3991612742343351, 'lambda': 6.764533024177832, 'eta': 0.27334762023450304, 'sampling_method': 'gradient_based', 'subsample'                                                                     : 0.8863564144510084, 'gamma': 4.339022700340442}. Best is trial 109 with value: 2.0061473443077613.
[I 2023-12-21 04:05:17,906] Trial 222 pruned. Trial was pruned at iteration 0.
[I 2023-12-21 04:05:18,935] Trial 223 finished with value: inf and parameters: {'learning_rate': 0.9666768668008834, 'aft_loss_distributi                                                                     on': 'normal', 'aft_loss_distribution_scale': 1.6329057148372885, 'max_depth': 9, 'booster': 'dart', 'scale_pos_weight': 1.81571098020038                                                                     72, 'alpha': 0.679802890357355, 'lambda': 6.888178174057937, 'eta': 0.16571004995278288, 'sampling_method': 'gradient_based', 'subsample'                                                                     : 0.9082413740805122, 'gamma': 4.584843243485564}. Best is trial 109 with value: 2.0061473443077613.
[I 2023-12-21 04:05:18,977] Trial 224 pruned. Trial was pruned at iteration 0.
[I 2023-12-21 04:05:19,018] Trial 225 pruned. Trial was pruned at iteration 0.
[I 2023-12-21 04:05:19,059] Trial 226 pruned. Trial was pruned at iteration 0.
[I 2023-12-21 04:05:19,101] Trial 227 pruned. Trial was pruned at iteration 0.
[I 2023-12-21 04:05:19,145] Trial 228 pruned. Trial was pruned at iteration 0.
[I 2023-12-21 04:05:19,186] Trial 229 pruned. Trial was pruned at iteration 0.
[I 2023-12-21 04:05:19,228] Trial 230 pruned. Trial was pruned at iteration 0.
[I 2023-12-21 04:05:20,253] Trial 231 finished with value: inf and parameters: {'learning_rate': 0.9886902183702485, 'aft_loss_distributi                                                                     on': 'normal', 'aft_loss_distribution_scale': 1.375195081860392, 'max_depth': 7, 'booster': 'dart', 'scale_pos_weight': 0.951099801624871                                                                     5, 'alpha': 0.4361388646134883, 'lambda': 7.731730372285328, 'eta': 0.0006166740597248608, 'sampling_method': 'gradient_based', 'subsampl                                                                     e': 0.8252346597360775, 'gamma': 3.619300905990149}. Best is trial 109 with value: 2.0061473443077613.
[I 2023-12-21 04:05:21,278] Trial 232 finished with value: inf and parameters: {'learning_rate': 0.9834091219212645, 'aft_loss_distributi                                                                     on': 'normal', 'aft_loss_distribution_scale': 1.5038710504855701, 'max_depth': 7, 'booster': 'dart', 'scale_pos_weight': 0.95347743705909                                                                     47, 'alpha': 0.6069402302137437, 'lambda': 7.931825553780575, 'eta': 0.019482197410665605, 'sampling_method': 'gradient_based', 'subsampl                                                                     e': 0.8592291206371087, 'gamma': 3.6665658201998763}. Best is trial 109 with value: 2.0061473443077613.
[I 2023-12-21 04:05:21,327] Trial 233 pruned. Trial was pruned at iteration 1.
[I 2023-12-21 04:05:21,369] Trial 234 pruned. Trial was pruned at iteration 0.
[I 2023-12-21 04:05:22,420] Trial 235 finished with value: inf and parameters: {'learning_rate': 0.9566764887757422, 'aft_loss_distributi                                                                     on': 'normal', 'aft_loss_distribution_scale': 1.4752289854938982, 'max_depth': 5, 'booster': 'dart', 'scale_pos_weight': 0.28748143876416                                                                     35, 'alpha': 6.250668761359078, 'lambda': 1.6204304478135247, 'eta': 0.9518811488500735, 'sampling_method': 'gradient_based', 'subsample'                                                                     : 0.7926391901545452, 'gamma': 4.76561526510759}. Best is trial 109 with value: 2.0061473443077613.
[I 2023-12-21 04:05:22,462] Trial 236 pruned. Trial was pruned at iteration 0.
[I 2023-12-21 04:05:22,506] Trial 237 pruned. Trial was pruned at iteration 0.
[I 2023-12-21 04:05:22,548] Trial 238 pruned. Trial was pruned at iteration 0.
[I 2023-12-21 04:05:22,590] Trial 239 pruned. Trial was pruned at iteration 0.
[I 2023-12-21 04:05:22,632] Trial 240 pruned. Trial was pruned at iteration 0.
[I 2023-12-21 04:05:23,712] Trial 241 finished with value: inf and parameters: {'learning_rate': 0.9470375862417146, 'aft_loss_distributi                                                                     on': 'normal', 'aft_loss_distribution_scale': 1.5935747264641091, 'max_depth': 4, 'booster': 'dart', 'scale_pos_weight': 1.17680541885022                                                                     1, 'alpha': 3.990905354723304, 'lambda': 1.2636396497343356, 'eta': 0.13700624389873955, 'sampling_method': 'gradient_based', 'subsample'                                                                     : 0.639919074241145, 'gamma': 1.068602353318323}. Best is trial 109 with value: 2.0061473443077613.
[I 2023-12-21 04:05:24,814] Trial 242 finished with value: inf and parameters: {'learning_rate': 0.9646211454367501, 'aft_loss_distributi                                                                     on': 'normal', 'aft_loss_distribution_scale': 1.6257393837396763, 'max_depth': 4, 'booster': 'dart', 'scale_pos_weight': 1.24047400053478                                                                     27, 'alpha': 3.615309562538387, 'lambda': 7.661975707809406, 'eta': 0.07793081378705324, 'sampling_method': 'gradient_based', 'subsample'                                                                     : 0.6901396080077941, 'gamma': 1.4570423031238795}. Best is trial 109 with value: 2.0061473443077613.
[I 2023-12-21 04:05:25,892] Trial 243 finished with value: inf and parameters: {'learning_rate': 0.9670638766297542, 'aft_loss_distributi                                                                     on': 'normal', 'aft_loss_distribution_scale': 1.3875707904162002, 'max_depth': 4, 'booster': 'dart', 'scale_pos_weight': 1.13096227316998                                                                     49, 'alpha': 4.336203330530932, 'lambda': 0.9477037051255699, 'eta': 0.11742694297061135, 'sampling_method': 'gradient_based', 'subsample                                                                     ': 0.6684593331852314, 'gamma': 1.0032678403067274}. Best is trial 109 with value: 2.0061473443077613.
[I 2023-12-21 04:05:26,968] Trial 244 finished with value: inf and parameters: {'learning_rate': 0.9993226856257824, 'aft_loss_distributi                                                                     on': 'normal', 'aft_loss_distribution_scale': 1.6987435380283264, 'max_depth': 4, 'booster': 'dart', 'scale_pos_weight': 1.35910456961118                                                                     7, 'alpha': 4.089625906591436, 'lambda': 9.935377790772097, 'eta': 0.09260376869878778, 'sampling_method': 'gradient_based', 'subsample':                                                                      0.5904238976602568, 'gamma': 1.2261559867069338}. Best is trial 109 with value: 2.0061473443077613.
[I 2023-12-21 04:05:27,012] Trial 245 pruned. Trial was pruned at iteration 0.
[I 2023-12-21 04:05:27,054] Trial 246 pruned. Trial was pruned at iteration 0.
[I 2023-12-21 04:05:27,097] Trial 247 pruned. Trial was pruned at iteration 0.
[I 2023-12-21 04:05:27,140] Trial 248 pruned. Trial was pruned at iteration 0.
[I 2023-12-21 04:05:27,184] Trial 249 pruned. Trial was pruned at iteration 0.
[I 2023-12-21 04:05:27,227] Trial 250 pruned. Trial was pruned at iteration 0.
[I 2023-12-21 04:05:27,271] Trial 251 pruned. Trial was pruned at iteration 0.
[I 2023-12-21 04:05:28,349] Trial 252 finished with value: inf and parameters: {'learning_rate': 0.9778481961711497, 'aft_loss_distributi                                                                     on': 'normal', 'aft_loss_distribution_scale': 1.6145756315845765, 'max_depth': 8, 'booster': 'dart', 'scale_pos_weight': 0.77571198962116                                                                     15, 'alpha': 4.162330917214971, 'lambda': 4.205450813143851, 'eta': 0.9025394823310422, 'sampling_method': 'gradient_based', 'subsample':                                                                      0.7696202899917456, 'gamma': 4.225281111764291}. Best is trial 109 with value: 2.0061473443077613.
[I 2023-12-21 04:05:28,394] Trial 253 pruned. Trial was pruned at iteration 0.
[I 2023-12-21 04:05:28,436] Trial 254 pruned. Trial was pruned at iteration 0.
[I 2023-12-21 04:05:28,479] Trial 255 pruned. Trial was pruned at iteration 0.
[I 2023-12-21 04:05:28,522] Trial 256 pruned. Trial was pruned at iteration 0.
[I 2023-12-21 04:05:28,565] Trial 257 pruned. Trial was pruned at iteration 0.
[I 2023-12-21 04:05:28,609] Trial 258 pruned. Trial was pruned at iteration 0.
[I 2023-12-21 04:05:28,654] Trial 259 pruned. Trial was pruned at iteration 0.
[I 2023-12-21 04:05:28,697] Trial 260 pruned. Trial was pruned at iteration 0.
[I 2023-12-21 04:05:28,741] Trial 261 pruned. Trial was pruned at iteration 0.
[I 2023-12-21 04:05:28,784] Trial 262 pruned. Trial was pruned at iteration 0.
[I 2023-12-21 04:05:28,827] Trial 263 pruned. Trial was pruned at iteration 0.
[I 2023-12-21 04:05:28,873] Trial 264 pruned. Trial was pruned at iteration 0.
[I 2023-12-21 04:05:28,917] Trial 265 pruned. Trial was pruned at iteration 0.
[I 2023-12-21 04:05:28,961] Trial 266 pruned. Trial was pruned at iteration 0.
[I 2023-12-21 04:05:29,005] Trial 267 pruned. Trial was pruned at iteration 0.
[I 2023-12-21 04:05:29,120] Trial 268 finished with value: inf and parameters: {'learning_rate': 0.996447163937396, 'aft_loss_distributio                                                                     n': 'normal', 'aft_loss_distribution_scale': 1.788738089589963, 'max_depth': 7, 'booster': 'gbtree', 'scale_pos_weight': 1.93837207616527                                                                     78, 'alpha': 0.08316766438451716, 'lambda': 7.7539216909772355, 'eta': 0.4845423594105828, 'sampling_method': 'gradient_based', 'subsampl                                                                     e': 0.6235346597739155, 'gamma': 8.026962186562468}. Best is trial 109 with value: 2.0061473443077613.
[I 2023-12-21 04:05:29,163] Trial 269 pruned. Trial was pruned at iteration 0.
[I 2023-12-21 04:05:29,207] Trial 270 pruned. Trial was pruned at iteration 0.
[I 2023-12-21 04:05:29,252] Trial 271 pruned. Trial was pruned at iteration 0.
[I 2023-12-21 04:05:29,302] Trial 272 pruned. Trial was pruned at iteration 1.
[I 2023-12-21 04:05:29,351] Trial 273 pruned. Trial was pruned at iteration 0.
[I 2023-12-21 04:05:29,395] Trial 274 pruned. Trial was pruned at iteration 0.
[I 2023-12-21 04:05:29,440] Trial 275 pruned. Trial was pruned at iteration 0.
[I 2023-12-21 04:05:29,484] Trial 276 pruned. Trial was pruned at iteration 0.
[I 2023-12-21 04:05:29,527] Trial 277 pruned. Trial was pruned at iteration 0.
[I 2023-12-21 04:05:29,573] Trial 278 pruned. Trial was pruned at iteration 0.
[I 2023-12-21 04:05:29,616] Trial 279 pruned. Trial was pruned at iteration 0.
[I 2023-12-21 04:05:29,660] Trial 280 pruned. Trial was pruned at iteration 0.
[I 2023-12-21 04:05:29,707] Trial 281 pruned. Trial was pruned at iteration 0.
[I 2023-12-21 04:05:29,751] Trial 282 pruned. Trial was pruned at iteration 0.
[I 2023-12-21 04:05:29,796] Trial 283 pruned. Trial was pruned at iteration 0.
[I 2023-12-21 04:05:29,841] Trial 284 pruned. Trial was pruned at iteration 0.
[I 2023-12-21 04:05:29,886] Trial 285 pruned. Trial was pruned at iteration 0.
[I 2023-12-21 04:05:29,930] Trial 286 pruned. Trial was pruned at iteration 0.
[I 2023-12-21 04:05:29,974] Trial 287 pruned. Trial was pruned at iteration 0.
[I 2023-12-21 04:05:30,020] Trial 288 pruned. Trial was pruned at iteration 0.
[I 2023-12-21 04:05:30,066] Trial 289 pruned. Trial was pruned at iteration 0.
[I 2023-12-21 04:05:30,188] Trial 290 finished with value: inf and parameters: {'learning_rate': 0.9814921266503419, 'aft_loss_distributi                                                                     on': 'normal', 'aft_loss_distribution_scale': 1.5052550499055388, 'max_depth': 3, 'booster': 'gbtree', 'scale_pos_weight': 2.080345504480                                                                     5896, 'alpha': 2.7118362055432508, 'lambda': 3.244667845060263, 'eta': 0.5499859904372115, 'sampling_method': 'gradient_based', 'subsampl                                                                     e': 0.8221960475260757, 'gamma': 3.7459216957879633}. Best is trial 109 with value: 2.0061473443077613.
[I 2023-12-21 04:05:30,234] Trial 291 pruned. Trial was pruned at iteration 0.
[I 2023-12-21 04:05:30,280] Trial 292 pruned. Trial was pruned at iteration 0.
[I 2023-12-21 04:05:30,327] Trial 293 pruned. Trial was pruned at iteration 0.
[I 2023-12-21 04:05:30,372] Trial 294 pruned. Trial was pruned at iteration 0.
[I 2023-12-21 04:05:30,419] Trial 295 pruned. Trial was pruned at iteration 0.
[I 2023-12-21 04:05:30,464] Trial 296 pruned. Trial was pruned at iteration 0.
[I 2023-12-21 04:05:30,510] Trial 297 pruned. Trial was pruned at iteration 0.
[I 2023-12-21 04:05:30,557] Trial 298 pruned. Trial was pruned at iteration 0.
[I 2023-12-21 04:05:30,602] Trial 299 pruned. Trial was pruned at iteration 0.
[I 2023-12-21 04:05:30,647] Trial 300 pruned. Trial was pruned at iteration 0.
[I 2023-12-21 04:05:30,692] Trial 301 pruned. Trial was pruned at iteration 0.
[I 2023-12-21 04:05:30,740] Trial 302 pruned. Trial was pruned at iteration 0.
[I 2023-12-21 04:05:31,808] Trial 303 finished with value: inf and parameters: {'learning_rate': 0.9672489424891412, 'aft_loss_distributi                                                                     on': 'normal', 'aft_loss_distribution_scale': 1.560295168762633, 'max_depth': 3, 'booster': 'dart', 'scale_pos_weight': 1.166300569739138                                                                     2, 'alpha': 1.5880561243482694, 'lambda': 0.7870183965121618, 'eta': 0.9984483786599633, 'sampling_method': 'gradient_based', 'subsample'                                                                     : 0.2349801631868383, 'gamma': 0.7089274634381302}. Best is trial 109 with value: 2.0061473443077613.
[I 2023-12-21 04:05:31,855] Trial 304 pruned. Trial was pruned at iteration 0.
[I 2023-12-21 04:05:31,906] Trial 305 pruned. Trial was pruned at iteration 0.
[I 2023-12-21 04:05:31,952] Trial 306 pruned. Trial was pruned at iteration 0.
[I 2023-12-21 04:05:31,998] Trial 307 pruned. Trial was pruned at iteration 0.
[I 2023-12-21 04:05:32,044] Trial 308 pruned. Trial was pruned at iteration 0.
[I 2023-12-21 04:05:32,089] Trial 309 pruned. Trial was pruned at iteration 0.
[I 2023-12-21 04:05:32,135] Trial 310 pruned. Trial was pruned at iteration 0.
[I 2023-12-21 04:05:32,182] Trial 311 pruned. Trial was pruned at iteration 0.
[I 2023-12-21 04:05:32,229] Trial 312 pruned. Trial was pruned at iteration 0.
[I 2023-12-21 04:05:33,363] Trial 313 finished with value: inf and parameters: {'learning_rate': 0.9648385508041624, 'aft_loss_distributi                                                                     on': 'normal', 'aft_loss_distribution_scale': 1.6613188278374187, 'max_depth': 3, 'booster': 'dart', 'scale_pos_weight': 1.38740127802958                                                                     04, 'alpha': 3.7275658789158936, 'lambda': 8.474614375322332, 'eta': 0.6731678497854748, 'sampling_method': 'gradient_based', 'subsample'                                                                     : 0.8463976821719095, 'gamma': 3.74995023405527}. Best is trial 109 with value: 2.0061473443077613.
[I 2023-12-21 04:05:33,410] Trial 314 pruned. Trial was pruned at iteration 0.
[I 2023-12-21 04:05:33,455] Trial 315 pruned. Trial was pruned at iteration 0.
[I 2023-12-21 04:05:33,502] Trial 316 pruned. Trial was pruned at iteration 0.
[I 2023-12-21 04:05:33,547] Trial 317 pruned. Trial was pruned at iteration 0.
[I 2023-12-21 04:05:33,593] Trial 318 pruned. Trial was pruned at iteration 0.
[I 2023-12-21 04:05:33,641] Trial 319 pruned. Trial was pruned at iteration 0.
[I 2023-12-21 04:05:33,697] Trial 320 pruned. Trial was pruned at iteration 0.
[I 2023-12-21 04:05:33,743] Trial 321 pruned. Trial was pruned at iteration 0.
[I 2023-12-21 04:05:33,790] Trial 322 pruned. Trial was pruned at iteration 0.
[I 2023-12-21 04:05:33,836] Trial 323 pruned. Trial was pruned at iteration 0.
[I 2023-12-21 04:05:33,882] Trial 324 pruned. Trial was pruned at iteration 0.
[I 2023-12-21 04:05:33,930] Trial 325 pruned. Trial was pruned at iteration 0.
[I 2023-12-21 04:05:33,977] Trial 326 pruned. Trial was pruned at iteration 0.
[I 2023-12-21 04:05:34,024] Trial 327 pruned. Trial was pruned at iteration 0.
[I 2023-12-21 04:05:34,072] Trial 328 pruned. Trial was pruned at iteration 0.
[I 2023-12-21 04:05:34,120] Trial 329 pruned. Trial was pruned at iteration 0.
[I 2023-12-21 04:05:34,167] Trial 330 pruned. Trial was pruned at iteration 0.
[I 2023-12-21 04:05:34,214] Trial 331 pruned. Trial was pruned at iteration 0.
[I 2023-12-21 04:05:34,263] Trial 332 pruned. Trial was pruned at iteration 0.
[I 2023-12-21 04:05:34,313] Trial 333 pruned. Trial was pruned at iteration 0.
[I 2023-12-21 04:05:34,359] Trial 334 pruned. Trial was pruned at iteration 0.
[I 2023-12-21 04:05:34,407] Trial 335 pruned. Trial was pruned at iteration 0.
[I 2023-12-21 04:05:34,454] Trial 336 pruned. Trial was pruned at iteration 0.
[I 2023-12-21 04:05:34,501] Trial 337 pruned. Trial was pruned at iteration 0.
[I 2023-12-21 04:05:34,550] Trial 338 pruned. Trial was pruned at iteration 0.
[I 2023-12-21 04:05:34,599] Trial 339 pruned. Trial was pruned at iteration 0.
[I 2023-12-21 04:05:34,647] Trial 340 pruned. Trial was pruned at iteration 0.
[I 2023-12-21 04:05:34,695] Trial 341 pruned. Trial was pruned at iteration 0.
[I 2023-12-21 04:05:34,743] Trial 342 pruned. Trial was pruned at iteration 0.
[I 2023-12-21 04:05:34,791] Trial 343 pruned. Trial was pruned at iteration 0.
[I 2023-12-21 04:05:34,839] Trial 344 pruned. Trial was pruned at iteration 0.
[I 2023-12-21 04:05:34,890] Trial 345 pruned. Trial was pruned at iteration 0.
[I 2023-12-21 04:05:34,938] Trial 346 pruned. Trial was pruned at iteration 0.
[I 2023-12-21 04:05:34,985] Trial 347 pruned. Trial was pruned at iteration 0.
[I 2023-12-21 04:05:35,033] Trial 348 pruned. Trial was pruned at iteration 0.
[I 2023-12-21 04:05:35,081] Trial 349 pruned. Trial was pruned at iteration 0.
[I 2023-12-21 04:05:35,128] Trial 350 pruned. Trial was pruned at iteration 0.
[I 2023-12-21 04:05:35,494] Trial 351 pruned. Trial was pruned at iteration 0.
[I 2023-12-21 04:05:35,548] Trial 352 pruned. Trial was pruned at iteration 0.
[I 2023-12-21 04:05:35,597] Trial 353 pruned. Trial was pruned at iteration 0.
[I 2023-12-21 04:05:35,646] Trial 354 pruned. Trial was pruned at iteration 0.
[I 2023-12-21 04:05:35,698] Trial 355 pruned. Trial was pruned at iteration 1.
[I 2023-12-21 04:05:35,746] Trial 356 pruned. Trial was pruned at iteration 0.
[I 2023-12-21 04:05:35,795] Trial 357 pruned. Trial was pruned at iteration 0.
[I 2023-12-21 04:05:35,843] Trial 358 pruned. Trial was pruned at iteration 0.
[I 2023-12-21 04:05:35,894] Trial 359 pruned. Trial was pruned at iteration 0.
[I 2023-12-21 04:05:35,942] Trial 360 pruned. Trial was pruned at iteration 0.
[I 2023-12-21 04:05:35,994] Trial 361 pruned. Trial was pruned at iteration 0.
[I 2023-12-21 04:05:36,043] Trial 362 pruned. Trial was pruned at iteration 0.
[I 2023-12-21 04:05:36,091] Trial 363 pruned. Trial was pruned at iteration 0.
