[I 2023-12-21 04:00:03,486] Trial 97 finished with value: inf and parameters: {'learning_rate': 0.8585275660684333, 'aft_loss_distributio                                                                     n': 'normal', 'aft_loss_distribution_scale': 1.4489130302517053, 'max_depth': 5, 'booster': 'gbtree', 'scale_pos_weight': 0.9389359671642                                                                     319, 'alpha': 8.592507775885002, 'lambda': 1.7217771977858383, 'eta': 0.5122355324380331, 'sampling_method': 'gradient_based', 'subsample                                                                     ': 0.8535182928278359, 'gamma': 3.4039914464373036}. Best is trial 81 with value: 4.234078754776428.
[I 2023-12-21 04:00:03,598] Trial 98 finished with value: inf and parameters: {'learning_rate': 0.8831113334627335, 'aft_loss_distributio                                                                     n': 'normal', 'aft_loss_distribution_scale': 1.178952026179788, 'max_depth': 8, 'booster': 'gbtree', 'scale_pos_weight': 2.18358313811378                                                                     05, 'alpha': 8.898224091950917, 'lambda': 1.1003062128652346, 'eta': 0.5620600261054832, 'sampling_method': 'gradient_based', 'subsample'                                                                     : 0.9973369691185106, 'gamma': 2.340764380805699}. Best is trial 81 with value: 4.234078754776428.
[I 2023-12-21 04:00:03,632] Trial 99 pruned. Trial was pruned at iteration 0.
[I 2023-12-21 04:00:03,676] Trial 100 pruned. Trial was pruned at iteration 0.
[I 2023-12-21 04:00:03,827] Trial 101 finished with value: 4.41838468609312 and parameters: {'learning_rate': 0.6867822933705952, 'aft_lo                                                                     ss_distribution': 'normal', 'aft_loss_distribution_scale': 1.6991186611424782, 'max_depth': 6, 'booster': 'gbtree', 'scale_pos_weight': 0                                                                     .7027335003270326, 'alpha': 5.982360087789782, 'lambda': 1.941302297391373, 'eta': 0.3778308350324064, 'sampling_method': 'gradient_based                                                                     ', 'subsample': 0.8829699806658143, 'gamma': 2.13010409073887}. Best is trial 81 with value: 4.234078754776428.
[I 2023-12-21 04:00:03,863] Trial 102 pruned. Trial was pruned at iteration 1.
[I 2023-12-21 04:00:04,062] Trial 103 finished with value: 4.402966057214835 and parameters: {'learning_rate': 0.6762030825407424, 'aft_l                                                                     oss_distribution': 'normal', 'aft_loss_distribution_scale': 1.6620385358200132, 'max_depth': 6, 'booster': 'gbtree', 'scale_pos_weight':                                                                      0.7243467636786706, 'alpha': 6.6020713016840915, 'lambda': 1.781188548543786, 'eta': 0.4499403520480182, 'sampling_method': 'gradient_bas                                                                     ed', 'subsample': 0.7354791741211592, 'gamma': 2.7829320010387972}. Best is trial 81 with value: 4.234078754776428.
[I 2023-12-21 04:00:04,096] Trial 104 pruned. Trial was pruned at iteration 0.
[I 2023-12-21 04:00:04,250] Trial 105 finished with value: 4.326619507683277 and parameters: {'learning_rate': 0.7118252466325331, 'aft_l                                                                     oss_distribution': 'normal', 'aft_loss_distribution_scale': 1.441366688748769, 'max_depth': 9, 'booster': 'gbtree', 'scale_pos_weight': 1                                                                     .6661693951695682, 'alpha': 6.988005896954168, 'lambda': 0.6119722447964138, 'eta': 0.43906191935187483, 'sampling_method': 'gradient_bas                                                                     ed', 'subsample': 0.7937234137396323, 'gamma': 3.679921807603097}. Best is trial 81 with value: 4.234078754776428.
[I 2023-12-21 04:00:04,395] Trial 106 finished with value: 4.292203562411399 and parameters: {'learning_rate': 0.7569723321361487, 'aft_l                                                                     oss_distribution': 'normal', 'aft_loss_distribution_scale': 1.3257807456985542, 'max_depth': 9, 'booster': 'gbtree', 'scale_pos_weight':                                                                      1.5747452000455069, 'alpha': 6.9601462280837545, 'lambda': 0.6843914605387516, 'eta': 0.4490990874223013, 'sampling_method': 'gradient_ba                                                                     sed', 'subsample': 0.7887980605290981, 'gamma': 3.705892426901509}. Best is trial 81 with value: 4.234078754776428.
[I 2023-12-21 04:00:04,432] Trial 107 pruned. Trial was pruned at iteration 0.
[I 2023-12-21 04:00:04,634] Trial 108 finished with value: 4.286952398586511 and parameters: {'learning_rate': 0.7600307411071934, 'aft_l                                                                     oss_distribution': 'normal', 'aft_loss_distribution_scale': 1.3037013836928257, 'max_depth': 10, 'booster': 'gbtree', 'scale_pos_weight':                                                                      2.781692096058469, 'alpha': 7.241070378176868, 'lambda': 0.710414900965968, 'eta': 0.5415769601803866, 'sampling_method': 'gradient_base                                                                     d', 'subsample': 0.8088911144740009, 'gamma': 3.6409192537770565}. Best is trial 81 with value: 4.234078754776428.
[I 2023-12-21 04:00:04,785] Trial 109 finished with value: 4.313627778640888 and parameters: {'learning_rate': 0.7544568219025037, 'aft_l                                                                     oss_distribution': 'normal', 'aft_loss_distribution_scale': 1.397050585745681, 'max_depth': 10, 'booster': 'gbtree', 'scale_pos_weight':                                                                      2.361986007766317, 'alpha': 7.984258835093821, 'lambda': 0.18178893241315502, 'eta': 0.35175923234232204, 'sampling_method': 'gradient_ba                                                                     sed', 'subsample': 0.7965774280425648, 'gamma': 3.8537308602287164}. Best is trial 81 with value: 4.234078754776428.
[I 2023-12-21 04:00:07,248] Trial 110 finished with value: 4.305164800116103 and parameters: {'learning_rate': 0.8280875381488021, 'aft_l                                                                     oss_distribution': 'normal', 'aft_loss_distribution_scale': 1.3433937811692973, 'max_depth': 10, 'booster': 'dart', 'scale_pos_weight': 2                                                                     .707248477805242, 'alpha': 8.100146742951457, 'lambda': 0.07718813929498358, 'eta': 0.43740776294273265, 'sampling_method': 'gradient_bas                                                                     ed', 'subsample': 0.8009171263419435, 'gamma': 3.674492085408939}. Best is trial 81 with value: 4.234078754776428.
[I 2023-12-21 04:00:09,441] Trial 111 finished with value: 4.265890693505439 and parameters: {'learning_rate': 0.8292889570266238, 'aft_l                                                                     oss_distribution': 'normal', 'aft_loss_distribution_scale': 1.224190894811281, 'max_depth': 10, 'booster': 'dart', 'scale_pos_weight': 2.                                                                     6864458452129893, 'alpha': 8.025589102855808, 'lambda': 0.10689036840755668, 'eta': 0.3565243809153941, 'sampling_method': 'gradient_base                                                                     d', 'subsample': 0.8026866936208849, 'gamma': 4.750147698865256}. Best is trial 81 with value: 4.234078754776428.
[I 2023-12-21 04:00:10,419] Trial 112 finished with value: inf and parameters: {'learning_rate': 0.9142317668838904, 'aft_loss_distributi                                                                     on': 'normal', 'aft_loss_distribution_scale': 1.007700790156749, 'max_depth': 10, 'booster': 'dart', 'scale_pos_weight': 2.68628349775996                                                                     48, 'alpha': 8.072566237313547, 'lambda': 0.1450457485425477, 'eta': 0.36333601106297897, 'sampling_method': 'gradient_based', 'subsample                                                                     ': 0.8205618658049998, 'gamma': 4.725585173183068}. Best is trial 81 with value: 4.234078754776428.
[I 2023-12-21 04:00:12,257] Trial 113 finished with value: inf and parameters: {'learning_rate': 0.8346594387854824, 'aft_loss_distributi                                                                     on': 'normal', 'aft_loss_distribution_scale': 1.2747076980563685, 'max_depth': 10, 'booster': 'dart', 'scale_pos_weight': 2.9146481687487                                                                     12, 'alpha': 9.06725304333878, 'lambda': 0.40367116222083277, 'eta': 0.4080765073318779, 'sampling_method': 'gradient_based', 'subsample'                                                                     : 0.8074986697109652, 'gamma': 3.8134469234346926}. Best is trial 81 with value: 4.234078754776428.
[I 2023-12-21 04:00:12,293] Trial 114 pruned. Trial was pruned at iteration 0.
[I 2023-12-21 04:00:12,330] Trial 115 pruned. Trial was pruned at iteration 0.
[I 2023-12-21 04:00:13,408] Trial 116 finished with value: inf and parameters: {'learning_rate': 0.8740285282802549, 'aft_loss_distributi                                                                     on': 'normal', 'aft_loss_distribution_scale': 1.3306756448817554, 'max_depth': 10, 'booster': 'dart', 'scale_pos_weight': 2.6354827973522                                                                     754, 'alpha': 7.336213366777427, 'lambda': 0.3054345292967479, 'eta': 0.290134800401479, 'sampling_method': 'gradient_based', 'subsample'                                                                     : 0.7439631642018224, 'gamma': 3.9581791671385798}. Best is trial 81 with value: 4.234078754776428.
[I 2023-12-21 04:00:14,708] Trial 117 finished with value: inf and parameters: {'learning_rate': 0.8051180830775223, 'aft_loss_distributi                                                                     on': 'normal', 'aft_loss_distribution_scale': 1.1024625706020037, 'max_depth': 10, 'booster': 'dart', 'scale_pos_weight': 2.0938895915437                                                                     17, 'alpha': 8.287878492799695, 'lambda': 0.5325634593178007, 'eta': 0.3459389763941399, 'sampling_method': 'gradient_based', 'subsample'                                                                     : 0.7602121437152197, 'gamma': 4.631036113214095}. Best is trial 81 with value: 4.234078754776428.
[I 2023-12-21 04:00:15,725] Trial 118 finished with value: inf and parameters: {'learning_rate': 0.8322395672801092, 'aft_loss_distributi                                                                     on': 'normal', 'aft_loss_distribution_scale': 0.8959069906888308, 'max_depth': 9, 'booster': 'dart', 'scale_pos_weight': 3.03148083795668                                                                     3, 'alpha': 8.284296674365583, 'lambda': 0.9988859850656446, 'eta': 0.36210043328047514, 'sampling_method': 'gradient_based', 'subsample'                                                                     : 0.8615660750600984, 'gamma': 3.562376633570157}. Best is trial 81 with value: 4.234078754776428.
[I 2023-12-21 04:00:15,763] Trial 119 pruned. Trial was pruned at iteration 1.
[I 2023-12-21 04:00:19,739] Trial 120 finished with value: 4.337234320026989 and parameters: {'learning_rate': 0.7864877804691129, 'aft_l                                                                     oss_distribution': 'normal', 'aft_loss_distribution_scale': 1.4763264160467124, 'max_depth': 10, 'booster': 'dart', 'scale_pos_weight': 2                                                                     .732091802223459, 'alpha': 7.548103737143033, 'lambda': 0.7467289805269043, 'eta': 0.5072798801134923, 'sampling_method': 'gradient_based                                                                     ', 'subsample': 0.7985465164099782, 'gamma': 5.034151220737549}. Best is trial 81 with value: 4.234078754776428.
[I 2023-12-21 04:00:19,929] Trial 121 finished with value: 4.321540451011646 and parameters: {'learning_rate': 0.7390720363839453, 'aft_l                                                                     oss_distribution': 'normal', 'aft_loss_distribution_scale': 1.4100862455115457, 'max_depth': 9, 'booster': 'gbtree', 'scale_pos_weight':                                                                      1.5953776351195454, 'alpha': 6.781708477810909, 'lambda': 0.48082818977613356, 'eta': 0.4427221414894092, 'sampling_method': 'gradient_ba                                                                     sed', 'subsample': 0.7967900774724641, 'gamma': 3.615942092809075}. Best is trial 81 with value: 4.234078754776428.
[I 2023-12-21 04:00:20,196] Trial 122 finished with value: 4.24756587277626 and parameters: {'learning_rate': 0.7423407801238596, 'aft_lo                                                                     ss_distribution': 'normal', 'aft_loss_distribution_scale': 1.1326280983813704, 'max_depth': 9, 'booster': 'gbtree', 'scale_pos_weight': 1                                                                     .8682406952770858, 'alpha': 6.7438473466412585, 'lambda': 9.935921475355052, 'eta': 0.47415618020779116, 'sampling_method': 'gradient_bas                                                                     ed', 'subsample': 0.789363804201015, 'gamma': 4.0560321136683335}. Best is trial 81 with value: 4.234078754776428.
[I 2023-12-21 04:00:22,442] Trial 123 finished with value: 4.257431957381786 and parameters: {'learning_rate': 0.8486917717308725, 'aft_l                                                                     oss_distribution': 'normal', 'aft_loss_distribution_scale': 1.140527561073883, 'max_depth': 9, 'booster': 'dart', 'scale_pos_weight': 1.7                                                                     743399937277442, 'alpha': 7.887482557968209, 'lambda': 8.988307529673797, 'eta': 0.48665600188440683, 'sampling_method': 'gradient_based'                                                                     , 'subsample': 0.7800137708296001, 'gamma': 3.3750080861451743}. Best is trial 81 with value: 4.234078754776428.
[I 2023-12-21 04:00:22,485] Trial 124 pruned. Trial was pruned at iteration 1.
[I 2023-12-21 04:00:26,042] Trial 125 finished with value: 4.26673710744142 and parameters: {'learning_rate': 0.9410148003222107, 'aft_lo                                                                     ss_distribution': 'normal', 'aft_loss_distribution_scale': 1.1977614442261062, 'max_depth': 9, 'booster': 'dart', 'scale_pos_weight': 1.3                                                                     595483533262998, 'alpha': 6.441444449464379, 'lambda': 8.516058111136733, 'eta': 0.5312689331507648, 'sampling_method': 'gradient_based',                                                                      'subsample': 0.837003369666735, 'gamma': 3.995455997006965}. Best is trial 81 with value: 4.234078754776428.
[I 2023-12-21 04:00:27,016] Trial 126 finished with value: inf and parameters: {'learning_rate': 0.9729136276831771, 'aft_loss_distributi                                                                     on': 'normal', 'aft_loss_distribution_scale': 1.1100562175697926, 'max_depth': 9, 'booster': 'dart', 'scale_pos_weight': 1.92481654279392                                                                     63, 'alpha': 6.390398829531607, 'lambda': 9.393734554681572, 'eta': 0.5391406341947136, 'sampling_method': 'gradient_based', 'subsample':                                                                      0.8262464993723091, 'gamma': 3.3690534154512477}. Best is trial 81 with value: 4.234078754776428.
[I 2023-12-21 04:00:27,051] Trial 127 pruned. Trial was pruned at iteration 0.
[I 2023-12-21 04:00:27,086] Trial 128 pruned. Trial was pruned at iteration 0.
[I 2023-12-21 04:00:27,121] Trial 129 pruned. Trial was pruned at iteration 0.
[I 2023-12-21 04:00:27,156] Trial 130 pruned. Trial was pruned at iteration 0.
[I 2023-12-21 04:00:29,101] Trial 131 finished with value: inf and parameters: {'learning_rate': 0.8210400884454648, 'aft_loss_distributi                                                                     on': 'normal', 'aft_loss_distribution_scale': 1.2428792567716005, 'max_depth': 10, 'booster': 'dart', 'scale_pos_weight': 3.3119052352406                                                                     87, 'alpha': 6.9575312108607, 'lambda': 9.907756288626844, 'eta': 0.4690478375545052, 'sampling_method': 'gradient_based', 'subsample': 0                                                                     .8122613280293107, 'gamma': 4.554275057332922}. Best is trial 81 with value: 4.234078754776428.
[I 2023-12-21 04:00:30,774] Trial 132 finished with value: inf and parameters: {'learning_rate': 0.7827906042807101, 'aft_loss_distributi                                                                     on': 'normal', 'aft_loss_distribution_scale': 1.1313910744182334, 'max_depth': 8, 'booster': 'dart', 'scale_pos_weight': 2.21898201027296                                                                     1, 'alpha': 7.810630260098608, 'lambda': 9.382976933274751, 'eta': 0.43517998987221945, 'sampling_method': 'gradient_based', 'subsample':                                                                      0.7775789978370153, 'gamma': 4.224541130778745}. Best is trial 81 with value: 4.234078754776428.
[I 2023-12-21 04:00:30,822] Trial 133 pruned. Trial was pruned at iteration 2.
[I 2023-12-21 04:00:30,861] Trial 134 pruned. Trial was pruned at iteration 1.
[I 2023-12-21 04:00:30,896] Trial 135 pruned. Trial was pruned at iteration 0.
[I 2023-12-21 04:00:34,197] Trial 136 finished with value: 4.262437751917029 and parameters: {'learning_rate': 0.7242684095314422, 'aft_l                                                                     oss_distribution': 'normal', 'aft_loss_distribution_scale': 1.199184169300583, 'max_depth': 9, 'booster': 'dart', 'scale_pos_weight': 1.8                                                                     301092617475607, 'alpha': 7.481226438711609, 'lambda': 0.37180430925252406, 'eta': 0.32257376059623327, 'sampling_method': 'gradient_base                                                                     d', 'subsample': 0.6728009999394395, 'gamma': 3.063347827367373}. Best is trial 81 with value: 4.234078754776428.
[I 2023-12-21 04:00:34,235] Trial 137 pruned. Trial was pruned at iteration 0.
[I 2023-12-21 04:00:34,274] Trial 138 pruned. Trial was pruned at iteration 1.
[I 2023-12-21 04:00:34,311] Trial 139 pruned. Trial was pruned at iteration 0.
[I 2023-12-21 04:00:34,348] Trial 140 pruned. Trial was pruned at iteration 0.
[I 2023-12-21 04:00:35,534] Trial 141 finished with value: inf and parameters: {'learning_rate': 0.8459749467206306, 'aft_loss_distributi                                                                     on': 'normal', 'aft_loss_distribution_scale': 1.1929202883754644, 'max_depth': 9, 'booster': 'dart', 'scale_pos_weight': 1.86314197217308                                                                     06, 'alpha': 8.137807652442326, 'lambda': 0.224982433687246, 'eta': 0.3877564493300621, 'sampling_method': 'gradient_based', 'subsample':                                                                      0.783611882317441, 'gamma': 3.781618902984112}. Best is trial 81 with value: 4.234078754776428.
[I 2023-12-21 04:00:35,574] Trial 142 pruned. Trial was pruned at iteration 1.
[I 2023-12-21 04:00:35,611] Trial 143 pruned. Trial was pruned at iteration 0.
[I 2023-12-21 04:00:36,711] Trial 144 finished with value: inf and parameters: {'learning_rate': 0.7691593663838552, 'aft_loss_distributi                                                                     on': 'normal', 'aft_loss_distribution_scale': 1.1796874234653905, 'max_depth': 9, 'booster': 'dart', 'scale_pos_weight': 2.14079641330275                                                                     33, 'alpha': 8.387364776459888, 'lambda': 0.6179733415276567, 'eta': 0.36757792993769106, 'sampling_method': 'gradient_based', 'subsample                                                                     ': 0.4977570845732099, 'gamma': 2.8569885382568856}. Best is trial 81 with value: 4.234078754776428.
[I 2023-12-21 04:00:47,717] Trial 145 finished with value: 4.298889225780211 and parameters: {'learning_rate': 0.7377573806499624, 'aft_l                                                                     oss_distribution': 'normal', 'aft_loss_distribution_scale': 1.3415067656286825, 'max_depth': 10, 'booster': 'dart', 'scale_pos_weight': 0                                                                     .581611949970615, 'alpha': 7.657489500144882, 'lambda': 6.801906746451275, 'eta': 0.4818055838921715, 'sampling_method': 'gradient_based'                                                                     , 'subsample': 0.7657082226988978, 'gamma': 3.2655395547771997}. Best is trial 81 with value: 4.234078754776428.
[I 2023-12-21 04:00:47,754] Trial 146 pruned. Trial was pruned at iteration 0.
[I 2023-12-21 04:00:47,790] Trial 147 pruned. Trial was pruned at iteration 0.
[I 2023-12-21 04:00:47,830] Trial 148 pruned. Trial was pruned at iteration 1.
[I 2023-12-21 04:00:47,866] Trial 149 pruned. Trial was pruned at iteration 0.
[I 2023-12-21 04:00:47,902] Trial 150 pruned. Trial was pruned at iteration 0.
