[I 2023-12-18 23:22:33,749] Trial 130 pruned. Trial was pruned at iteration 2.
[I 2023-12-18 23:22:35,746] Trial 131 finished with value: inf and parameters: {'learning_rate': 0.4370385440078476, 'aft_loss_distribution': 'logistic', 'aft_loss_distribution_scale': 1.1727776005871122, 'max_depth': 4, 'booster': 'dart', 'scale_pos_weight': 3.555266632398837, 'alpha': 7.773730709174472, 'lambda': 7.922072746004197, 'eta': 0.38551095808325814, 'sampling_method': 'gradient_based', 'subsample': 0.3445733902812098, 'gamma': 7.546022598596195}. Best is trial 74 with value: 4.300945982185268.
[I 2023-12-18 23:22:35,824] Trial 132 pruned. Trial was pruned at iteration 2.
[I 2023-12-18 23:22:35,893] Trial 133 pruned. Trial was pruned at iteration 0.
[I 2023-12-18 23:22:35,966] Trial 134 pruned. Trial was pruned at iteration 2.
[I 2023-12-18 23:22:36,039] Trial 135 pruned. Trial was pruned at iteration 0.
[I 2023-12-18 23:22:36,104] Trial 136 pruned. Trial was pruned at iteration 0.
[I 2023-12-18 23:22:41,503] Trial 137 pruned. Trial was pruned at iteration 102.
[I 2023-12-18 23:22:41,600] Trial 138 pruned. Trial was pruned at iteration 0.
[I 2023-12-18 23:22:41,697] Trial 139 pruned. Trial was pruned at iteration 0.
[I 2023-12-18 23:22:41,797] Trial 140 pruned. Trial was pruned at iteration 0.
[I 2023-12-18 23:22:41,898] Trial 141 pruned. Trial was pruned at iteration 1.
[I 2023-12-18 23:22:41,970] Trial 142 pruned. Trial was pruned at iteration 0.
[I 2023-12-18 23:22:42,043] Trial 143 pruned. Trial was pruned at iteration 0.
[I 2023-12-18 23:22:42,109] Trial 144 pruned. Trial was pruned at iteration 0.
[I 2023-12-18 23:22:55,509] Trial 145 finished with value: 4.373623674136486 and parameters: {'learning_rate': 0.2508502990805574, 'aft_loss_distribution': 'logistic', 'aft_loss_distribution_scale': 0.9644687247929947, 'max_depth': 6, 'booster': 'dart', 'scale_pos_weight': 3.688288758634238, 'alpha': 6.700380784348269, 'lambda': 6.341013188118323, 'eta': 0.7936892888771385, 'sampling_method': 'gradient_based', 'subsample': 0.6036557178443033, 'gamma': 4.5729032676115695}. Best is trial 74 with value: 4.300945982185268.
[I 2023-12-18 23:23:10,014] Trial 146 finished with value: 4.401412159229135 and parameters: {'learning_rate': 0.25281729086552823, 'aft_loss_distribution': 'logistic', 'aft_loss_distribution_scale': 1.0051530434545626, 'max_depth': 6, 'booster': 'dart', 'scale_pos_weight': 3.203474505300611, 'alpha': 6.795319534699564, 'lambda': 6.298114490535652, 'eta': 0.7534042294432662, 'sampling_method': 'gradient_based', 'subsample': 0.6033161434979135, 'gamma': 4.616969894470428}. Best is trial 74 with value: 4.300945982185268.
[I 2023-12-18 23:23:36,211] Trial 147 finished with value: 4.36826007216998 and parameters: {'learning_rate': 0.2602474566140206, 'aft_loss_distribution': 'logistic', 'aft_loss_distribution_scale': 0.9493090277159704, 'max_depth': 6, 'booster': 'dart', 'scale_pos_weight': 3.1310763374608923, 'alpha': 6.805745271116925, 'lambda': 6.351919079529698, 'eta': 0.8409522823973127, 'sampling_method': 'gradient_based', 'subsample': 0.5964947533645499, 'gamma': 4.6129695586010735}. Best is trial 74 with value: 4.300945982185268.
[I 2023-12-18 23:24:02,914] Trial 148 finished with value: 4.322500583210852 and parameters: {'learning_rate': 0.2523755741280469, 'aft_loss_distribution': 'logistic', 'aft_loss_distribution_scale': 0.8714426643756606, 'max_depth': 6, 'booster': 'dart', 'scale_pos_weight': 2.4468385076734083, 'alpha': 6.752728775942724, 'lambda': 5.254736302509864, 'eta': 0.8120365378509037, 'sampling_method': 'gradient_based', 'subsample': 0.598624317919795, 'gamma': 4.528575445534175}. Best is trial 74 with value: 4.300945982185268.
[I 2023-12-18 23:24:02,987] Trial 149 pruned. Trial was pruned at iteration 0.
[I 2023-12-18 23:24:03,059] Trial 150 pruned. Trial was pruned at iteration 0.
[I 2023-12-18 23:24:03,131] Trial 151 pruned. Trial was pruned at iteration 0.
[I 2023-12-18 23:24:03,196] Trial 152 pruned. Trial was pruned at iteration 0.
[I 2023-12-18 23:24:12,058] Trial 153 finished with value: 4.418046203109353 and parameters: {'learning_rate': 0.22089884574767008, 'aft_loss_distribution': 'logistic', 'aft_loss_distribution_scale': 1.027202658511535, 'max_depth': 6, 'booster': 'dart', 'scale_pos_weight': 3.368830806711728, 'alpha': 6.045858056912193, 'lambda': 5.951466874270831, 'eta': 0.7397538943803944, 'sampling_method': 'gradient_based', 'subsample': 0.6669249519062124, 'gamma': 4.4610264708611265}. Best is trial 74 with value: 4.300945982185268.
[I 2023-12-18 23:24:26,745] Trial 154 pruned. Trial was pruned at iteration 183.
[I 2023-12-18 23:24:26,819] Trial 155 pruned. Trial was pruned at iteration 0.
[I 2023-12-18 23:24:26,889] Trial 156 pruned. Trial was pruned at iteration 0.
[I 2023-12-18 23:24:36,642] Trial 157 pruned. Trial was pruned at iteration 147.
[I 2023-12-18 23:24:36,744] Trial 158 pruned. Trial was pruned at iteration 0.
[I 2023-12-18 23:24:36,850] Trial 159 pruned. Trial was pruned at iteration 0.
[I 2023-12-18 23:24:36,958] Trial 160 pruned. Trial was pruned at iteration 0.
[I 2023-12-18 23:24:37,085] Trial 161 pruned. Trial was pruned at iteration 0.
[I 2023-12-18 23:24:37,187] Trial 162 pruned. Trial was pruned at iteration 0.
[I 2023-12-18 23:24:37,284] Trial 163 pruned. Trial was pruned at iteration 0.
[I 2023-12-18 23:24:37,385] Trial 164 pruned. Trial was pruned at iteration 0.
[I 2023-12-18 23:24:37,505] Trial 165 pruned. Trial was pruned at iteration 0.
[I 2023-12-18 23:24:37,610] Trial 166 pruned. Trial was pruned at iteration 0.
[I 2023-12-18 23:24:37,706] Trial 167 pruned. Trial was pruned at iteration 0.
[I 2023-12-18 23:24:37,804] Trial 168 pruned. Trial was pruned at iteration 0.
[I 2023-12-18 23:24:54,018] Trial 169 finished with value: 4.332381883700985 and parameters: {'learning_rate': 0.16847485850124785, 'aft_loss_distribution': 'logistic', 'aft_loss_distribution_scale': 0.8814147242985744, 'max_depth': 6, 'booster': 'dart', 'scale_pos_weight': 3.3222810140600614, 'alpha': 6.532849649923159, 'lambda': 8.531276474460368, 'eta': 0.7908158813518723, 'sampling_method': 'gradient_based', 'subsample': 0.6428645948220422, 'gamma': 5.434708507030757}. Best is trial 74 with value: 4.300945982185268.
[I 2023-12-18 23:25:21,602] Trial 170 finished with value: 4.303190280290707 and parameters: {'learning_rate': 0.17249869832095893, 'aft_loss_distribution': 'logistic', 'aft_loss_distribution_scale': 0.834493286851715, 'max_depth': 6, 'booster': 'dart', 'scale_pos_weight': 3.3693362070072914, 'alpha': 6.661834574236089, 'lambda': 8.458932204021155, 'eta': 0.6339403313004999, 'sampling_method': 'gradient_based', 'subsample': 0.6486402915065598, 'gamma': 5.547164600558095}. Best is trial 74 with value: 4.300945982185268.
[I 2023-12-18 23:25:36,559] Trial 171 finished with value: 4.308377624054968 and parameters: {'learning_rate': 0.17236865998547662, 'aft_loss_distribution': 'logistic', 'aft_loss_distribution_scale': 0.8152585651329751, 'max_depth': 6, 'booster': 'dart', 'scale_pos_weight': 3.3458394325029315, 'alpha': 6.702732161734535, 'lambda': 8.594426646306218, 'eta': 0.7822189037365824, 'sampling_method': 'gradient_based', 'subsample': 0.6488414416725974, 'gamma': 5.84465986664354}. Best is trial 74 with value: 4.300945982185268.
[I 2023-12-18 23:26:15,494] Trial 172 finished with value: 4.287886521456916 and parameters: {'learning_rate': 0.17035447197545908, 'aft_loss_distribution': 'logistic', 'aft_loss_distribution_scale': 0.7804908338372515, 'max_depth': 6, 'booster': 'dart', 'scale_pos_weight': 3.3537798614544396, 'alpha': 6.723976228345065, 'lambda': 8.593989397014758, 'eta': 0.8022223767659468, 'sampling_method': 'gradient_based', 'subsample': 0.6508736578267889, 'gamma': 5.896549337745113}. Best is trial 172 with value: 4.287886521456916.
[I 2023-12-18 23:26:15,576] Trial 173 pruned. Trial was pruned at iteration 0.
[I 2023-12-18 23:26:24,044] Trial 174 finished with value: 4.3085358383628565 and parameters: {'learning_rate': 0.16480669582674273, 'aft_loss_distribution': 'logistic', 'aft_loss_distribution_scale': 0.8258953579687153, 'max_depth': 6, 'booster': 'dart', 'scale_pos_weight': 3.1902664230240463, 'alpha': 6.489996772573307, 'lambda': 8.853051638397861, 'eta': 0.799576442538079, 'sampling_method': 'gradient_based', 'subsample': 0.6693048047647956, 'gamma': 5.6278654439919995}. Best is trial 172 with value: 4.287886521456916.
[I 2023-12-18 23:26:24,118] Trial 175 pruned. Trial was pruned at iteration 0.
[I 2023-12-18 23:26:30,756] Trial 176 finished with value: 4.339243892853661 and parameters: {'learning_rate': 0.16261639354991855, 'aft_loss_distribution': 'logistic', 'aft_loss_distribution_scale': 0.8928512215056705, 'max_depth': 6, 'booster': 'dart', 'scale_pos_weight': 3.5421423976674866, 'alpha': 6.930947136776384, 'lambda': 9.654562671648312, 'eta': 0.6381663872873535, 'sampling_method': 'gradient_based', 'subsample': 0.6682096801678679, 'gamma': 5.737605455847058}. Best is trial 172 with value: 4.287886521456916.
[I 2023-12-18 23:26:39,235] Trial 177 finished with value: 4.317338251997072 and parameters: {'learning_rate': 0.1719625365663105, 'aft_loss_distribution': 'logistic', 'aft_loss_distribution_scale': 0.830211350451614, 'max_depth': 6, 'booster': 'dart', 'scale_pos_weight': 3.392770450639204, 'alpha': 6.873715036038003, 'lambda': 9.567480107902984, 'eta': 0.632153245530985, 'sampling_method': 'gradient_based', 'subsample': 0.7591312446541358, 'gamma': 5.644702667048649}. Best is trial 172 with value: 4.287886521456916.
[I 2023-12-18 23:27:06,563] Trial 178 finished with value: 4.304310380915019 and parameters: {'learning_rate': 0.173378648995799, 'aft_loss_distribution': 'logistic', 'aft_loss_distribution_scale': 0.818850405121869, 'max_depth': 6, 'booster': 'dart', 'scale_pos_weight': 3.5368867070245034, 'alpha': 6.926314999192985, 'lambda': 9.59600977426471, 'eta': 0.6166646363239573, 'sampling_method': 'gradient_based', 'subsample': 0.651099690933764, 'gamma': 5.837401184215214}. Best is trial 172 with value: 4.287886521456916.
[I 2023-12-18 23:27:06,636] Trial 179 pruned. Trial was pruned at iteration 0.
[I 2023-12-18 23:27:06,702] Trial 180 pruned. Trial was pruned at iteration 0.
[I 2023-12-18 23:27:06,769] Trial 181 pruned. Trial was pruned at iteration 0.
[I 2023-12-18 23:27:06,843] Trial 182 pruned. Trial was pruned at iteration 0.
[I 2023-12-18 23:27:06,912] Trial 183 pruned. Trial was pruned at iteration 0.
[I 2023-12-18 23:27:34,730] Trial 184 finished with value: 4.278253617260017 and parameters: {'learning_rate': 0.15455168258298357, 'aft_loss_distribution': 'logistic', 'aft_loss_distribution_scale': 0.7672746276943202, 'max_depth': 6, 'booster': 'dart', 'scale_pos_weight': 3.780233085545194, 'alpha': 7.133255801968285, 'lambda': 9.101816300902483, 'eta': 0.5866542966128191, 'sampling_method': 'gradient_based', 'subsample': 0.7088129581941512, 'gamma': 5.493834543746283}. Best is trial 184 with value: 4.278253617260017.
[I 2023-12-18 23:27:34,805] Trial 185 pruned. Trial was pruned at iteration 0.
[I 2023-12-18 23:27:34,876] Trial 186 pruned. Trial was pruned at iteration 0.
[I 2023-12-18 23:28:03,348] Trial 187 finished with value: 4.261684116563347 and parameters: {'learning_rate': 0.13811559954257124, 'aft_loss_distribution': 'logistic', 'aft_loss_distribution_scale': 0.7423657083872307, 'max_depth': 6, 'booster': 'dart', 'scale_pos_weight': 3.0453377029820676, 'alpha': 6.754666394904228, 'lambda': 9.162500701565918, 'eta': 0.6116432859731837, 'sampling_method': 'gradient_based', 'subsample': 0.7448586386660568, 'gamma': 5.893999946226211}. Best is trial 187 with value: 4.261684116563347.
[I 2023-12-18 23:28:10,142] Trial 188 finished with value: 4.242997502845842 and parameters: {'learning_rate': 0.1242506576905203, 'aft_loss_distribution': 'logistic', 'aft_loss_distribution_scale': 0.7047883037327778, 'max_depth': 6, 'booster': 'dart', 'scale_pos_weight': 2.986889056073102, 'alpha': 6.714876164675175, 'lambda': 9.159866061057029, 'eta': 0.5939231586539492, 'sampling_method': 'gradient_based', 'subsample': 0.7482555210607875, 'gamma': 5.926366159609122}. Best is trial 188 with value: 4.242997502845842.
[I 2023-12-18 23:28:50,510] Trial 189 finished with value: 4.234136675820577 and parameters: {'learning_rate': 0.12178058602292618, 'aft_loss_distribution': 'logistic', 'aft_loss_distribution_scale': 0.7155658796631793, 'max_depth': 6, 'booster': 'dart', 'scale_pos_weight': 2.942791264465017, 'alpha': 6.793203381163447, 'lambda': 9.128323538352566, 'eta': 0.633552511495424, 'sampling_method': 'uniform', 'subsample': 0.746710990951208, 'gamma': 6.275462365612802}. Best is trial 189 with value: 4.234136675820577.
[I 2023-12-18 23:28:50,585] Trial 190 pruned. Trial was pruned at iteration 0.
[I 2023-12-18 23:29:13,506] Trial 191 finished with value: 4.29038526666702 and parameters: {'learning_rate': 0.13343006245406208, 'aft_loss_distribution': 'logistic', 'aft_loss_distribution_scale': 0.8066240984125835, 'max_depth': 6, 'booster': 'dart', 'scale_pos_weight': 2.980703153163541, 'alpha': 6.72504101691256, 'lambda': 8.9189434730921, 'eta': 0.5560226615968784, 'sampling_method': 'uniform', 'subsample': 0.7904838754282403, 'gamma': 6.2265631441271}. Best is trial 189 with value: 4.234136675820577.
[I 2023-12-18 23:29:13,616] Trial 192 pruned. Trial was pruned at iteration 0.
[I 2023-12-18 23:29:13,721] Trial 193 pruned. Trial was pruned at iteration 0.
[I 2023-12-18 23:29:13,831] Trial 194 pruned. Trial was pruned at iteration 0.
[I 2023-12-18 23:29:13,943] Trial 195 pruned. Trial was pruned at iteration 0.
[I 2023-12-18 23:29:14,049] Trial 196 pruned. Trial was pruned at iteration 0.
[I 2023-12-18 23:29:14,169] Trial 197 pruned. Trial was pruned at iteration 0.
[I 2023-12-18 23:29:14,274] Trial 198 pruned. Trial was pruned at iteration 0.
[I 2023-12-18 23:29:14,383] Trial 199 pruned. Trial was pruned at iteration 0.
[I 2023-12-18 23:29:16,658] Trial 200 finished with value: inf and parameters: {'learning_rate': 0.18561387570296783, 'aft_loss_distribution': 'logistic', 'aft_loss_distribution_scale': 0.8261154189366642, 'max_depth': 6, 'booster': 'dart', 'scale_pos_weight': 2.7880440557298205, 'alpha': 6.646924041626121, 'lambda': 9.315251218372538, 'eta': 0.5842123034334569, 'sampling_method': 'gradient_based', 'subsample': 0.7589679750559436, 'gamma': 5.3572303772018985}. Best is trial 189 with value: 4.234136675820577.
[I 2023-12-18 23:29:16,729] Trial 201 pruned. Trial was pruned at iteration 0.
[I 2023-12-18 23:29:16,796] Trial 202 pruned. Trial was pruned at iteration 0.
[I 2023-12-18 23:29:56,461] Trial 203 finished with value: 4.217376171773504 and parameters: {'learning_rate': 0.11999743827446456, 'aft_loss_distribution': 'logistic', 'aft_loss_distribution_scale': 0.6844732918390322, 'max_depth': 6, 'booster': 'dart', 'scale_pos_weight': 3.2527173922004664, 'alpha': 6.741569051005968, 'lambda': 9.53703118711888, 'eta': 0.7838422203702657, 'sampling_method': 'uniform', 'subsample': 0.7426797714785245, 'gamma': 5.440630531329695}. Best is trial 203 with value: 4.217376171773504.
[I 2023-12-18 23:33:18,341] Trial 204 finished with value: 4.197459375224944 and parameters: {'learning_rate': 0.12057994717701176, 'aft_loss_distribution': 'logistic', 'aft_loss_distribution_scale': 0.6537852065917693, 'max_depth': 6, 'booster': 'dart', 'scale_pos_weight': 3.3310423646700134, 'alpha': 6.2699346604396995, 'lambda': 9.648298093112913, 'eta': 0.8361841927329997, 'sampling_method': 'uniform', 'subsample': 0.6975118568949835, 'gamma': 5.388160085412588}. Best is trial 204 with value: 4.197459375224944.
[I 2023-12-18 23:33:18,448] Trial 205 pruned. Trial was pruned at iteration 0.
[I 2023-12-18 23:33:18,556] Trial 206 pruned. Trial was pruned at iteration 0.
[I 2023-12-18 23:33:58,287] Trial 207 finished with value: 4.216593926058838 and parameters: {'learning_rate': 0.09784819926312337, 'aft_loss_distribution': 'logistic', 'aft_loss_distribution_scale': 0.6831709177555518, 'max_depth': 6, 'booster': 'dart', 'scale_pos_weight': 3.6852729046776758, 'alpha': 6.625570770982375, 'lambda': 9.533587360321171, 'eta': 0.860359023563826, 'sampling_method': 'uniform', 'subsample': 0.7058268443661133, 'gamma': 5.369732610334837}. Best is trial 204 with value: 4.197459375224944.
[I 2023-12-18 23:33:58,367] Trial 208 pruned. Trial was pruned at iteration 0.
[I 2023-12-18 23:33:58,436] Trial 209 pruned. Trial was pruned at iteration 0.
[I 2023-12-18 23:34:25,720] Trial 210 pruned. Trial was pruned at iteration 254.
[I 2023-12-18 23:34:32,574] Trial 211 pruned. Trial was pruned at iteration 121.
[I 2023-12-18 23:34:32,691] Trial 212 pruned. Trial was pruned at iteration 0.
[I 2023-12-18 23:34:32,800] Trial 213 pruned. Trial was pruned at iteration 0.
[I 2023-12-18 23:34:38,807] Trial 214 pruned. Trial was pruned at iteration 119.
[I 2023-12-18 23:34:38,881] Trial 215 pruned. Trial was pruned at iteration 0.
[I 2023-12-18 23:34:38,950] Trial 216 pruned. Trial was pruned at iteration 0.
[I 2023-12-18 23:34:39,021] Trial 217 pruned. Trial was pruned at iteration 0.
[I 2023-12-18 23:34:39,089] Trial 218 pruned. Trial was pruned at iteration 0.
[I 2023-12-18 23:34:39,166] Trial 219 pruned. Trial was pruned at iteration 0.
[I 2023-12-18 23:34:39,253] Trial 220 pruned. Trial was pruned at iteration 0.
[I 2023-12-18 23:34:41,973] Trial 221 pruned. Trial was pruned at iteration 79.
[I 2023-12-18 23:34:42,049] Trial 222 pruned. Trial was pruned at iteration 0.
[I 2023-12-18 23:34:42,121] Trial 223 pruned. Trial was pruned at iteration 0.
[I 2023-12-18 23:34:42,198] Trial 224 pruned. Trial was pruned at iteration 0.
[I 2023-12-18 23:34:42,277] Trial 225 pruned. Trial was pruned at iteration 0.
[I 2023-12-18 23:34:49,045] Trial 226 pruned. Trial was pruned at iteration 117.
[I 2023-12-18 23:34:49,118] Trial 227 pruned. Trial was pruned at iteration 0.
[I 2023-12-18 23:34:49,197] Trial 228 pruned. Trial was pruned at iteration 0.
[I 2023-12-18 23:35:15,760] Trial 229 pruned. Trial was pruned at iteration 251.
[I 2023-12-18 23:35:15,879] Trial 230 pruned. Trial was pruned at iteration 0.
[I 2023-12-18 23:35:15,999] Trial 231 pruned. Trial was pruned at iteration 0.
[I 2023-12-18 23:35:44,009] Trial 232 pruned. Trial was pruned at iteration 254.
[I 2023-12-18 23:35:44,122] Trial 233 pruned. Trial was pruned at iteration 0.
[I 2023-12-18 23:35:44,236] Trial 234 pruned. Trial was pruned at iteration 0.
[I 2023-12-18 23:35:44,352] Trial 235 pruned. Trial was pruned at iteration 0.
[I 2023-12-18 23:35:44,474] Trial 236 pruned. Trial was pruned at iteration 0.
[I 2023-12-18 23:35:44,590] Trial 237 pruned. Trial was pruned at iteration 0.
[I 2023-12-18 23:35:44,699] Trial 238 pruned. Trial was pruned at iteration 0.
[I 2023-12-18 23:35:44,815] Trial 239 pruned. Trial was pruned at iteration 0.
[I 2023-12-18 23:35:44,926] Trial 240 pruned. Trial was pruned at iteration 0.
[I 2023-12-18 23:35:45,035] Trial 241 pruned. Trial was pruned at iteration 0.
[I 2023-12-18 23:35:45,151] Trial 242 pruned. Trial was pruned at iteration 0.
[I 2023-12-18 23:35:45,271] Trial 243 pruned. Trial was pruned at iteration 0.
[I 2023-12-18 23:35:58,665] Trial 244 pruned. Trial was pruned at iteration 176.
[I 2023-12-18 23:35:58,785] Trial 245 pruned. Trial was pruned at iteration 0.
[I 2023-12-18 23:35:58,903] Trial 246 pruned. Trial was pruned at iteration 0.
[I 2023-12-18 23:35:59,020] Trial 247 pruned. Trial was pruned at iteration 0.
[I 2023-12-18 23:35:59,133] Trial 248 pruned. Trial was pruned at iteration 0.
[I 2023-12-18 23:35:59,251] Trial 249 pruned. Trial was pruned at iteration 0.
[I 2023-12-18 23:35:59,390] Trial 250 pruned. Trial was pruned at iteration 0.
[I 2023-12-18 23:35:59,502] Trial 251 pruned. Trial was pruned at iteration 0.
[I 2023-12-18 23:35:59,620] Trial 252 pruned. Trial was pruned at iteration 0.
[I 2023-12-18 23:35:59,726] Trial 253 pruned. Trial was pruned at iteration 0.
[I 2023-12-18 23:35:59,840] Trial 254 pruned. Trial was pruned at iteration 0.
[I 2023-12-18 23:35:59,962] Trial 255 pruned. Trial was pruned at iteration 0.
[I 2023-12-18 23:36:00,083] Trial 256 pruned. Trial was pruned at iteration 0.
[I 2023-12-18 23:36:00,212] Trial 257 pruned. Trial was pruned at iteration 0.
[I 2023-12-18 23:36:00,322] Trial 258 pruned. Trial was pruned at iteration 0.
[I 2023-12-18 23:36:00,391] Trial 259 pruned. Trial was pruned at iteration 0.
[I 2023-12-18 23:36:00,471] Trial 260 pruned. Trial was pruned at iteration 0.
[I 2023-12-18 23:36:00,560] Trial 261 pruned. Trial was pruned at iteration 0.
[I 2023-12-18 23:36:00,647] Trial 262 pruned. Trial was pruned at iteration 0.
[I 2023-12-18 23:36:00,735] Trial 263 pruned. Trial was pruned at iteration 0.
[I 2023-12-18 23:36:00,822] Trial 264 pruned. Trial was pruned at iteration 1.
[I 2023-12-18 23:36:08,124] Trial 265 finished with value: 4.2622357886876365 and parameters: {'learning_rate': 0.15552420446048704, 'aft_loss_distribution': 'logistic', 'aft_loss_distribution_scale': 0.7602877287027311, 'max_depth': 5, 'booster': 'dart', 'scale_pos_weight': 3.991693306938875, 'alpha': 6.568898858993572, 'lambda': 8.934470289314667, 'eta': 0.5723904950475784, 'sampling_method': 'uniform', 'subsample': 0.8364983725086483, 'gamma': 5.6705107717706005}. Best is trial 204 with value: 4.197459375224944.
[I 2023-12-18 23:36:08,212] Trial 266 pruned. Trial was pruned at iteration 0.
