[I 2023-12-21 03:05:09,161] Trial 353 finished with value: 4.319412801780919 and parameters: {'learning_rate': 0.7115792089525986, 'aft_l                                                                     oss_distribution': 'normal', 'aft_loss_distribution_scale': 1.4462828791322744, 'max_depth': 3, 'booster': 'dart', 'scale_pos_weight': 4.                                                                     437622963755802, 'alpha': 8.065998583608215, 'lambda': 9.208562358820465, 'eta': 0.47996722858252044, 'sampling_method': 'uniform', 'subs                                                                     ample': 0.8333057677255882, 'gamma': 6.652704727270873}. Best is trial 295 with value: 4.282522474682648.
[I 2023-12-21 03:05:09,210] Trial 354 pruned. Trial was pruned at iteration 1.
[I 2023-12-21 03:05:09,256] Trial 355 pruned. Trial was pruned at iteration 0.
[I 2023-12-21 03:05:10,369] Trial 356 finished with value: inf and parameters: {'learning_rate': 0.7825547423749091, 'aft_loss_distributi                                                                     on': 'normal', 'aft_loss_distribution_scale': 0.8728375512985674, 'max_depth': 4, 'booster': 'dart', 'scale_pos_weight': 4.05220799001604                                                                     9, 'alpha': 8.273396615370933, 'lambda': 9.007914192281891, 'eta': 0.6749162662225022, 'sampling_method': 'uniform', 'subsample': 0.82294                                                                     32154976458, 'gamma': 6.601256445517256}. Best is trial 295 with value: 4.282522474682648.
[I 2023-12-21 03:05:12,202] Trial 357 finished with value: inf and parameters: {'learning_rate': 0.757326222801577, 'aft_loss_distributio                                                                     n': 'normal', 'aft_loss_distribution_scale': 1.529653712931727, 'max_depth': 4, 'booster': 'dart', 'scale_pos_weight': 4.31491105938769,                                                                      'alpha': 8.052204464694803, 'lambda': 8.79771337040573, 'eta': 0.49534147377501536, 'sampling_method': 'uniform', 'subsample': 0.89029192                                                                     66075389, 'gamma': 6.959656141343536}. Best is trial 295 with value: 4.282522474682648.
[I 2023-12-21 03:05:13,681] Trial 358 finished with value: inf and parameters: {'learning_rate': 0.7130140840187761, 'aft_loss_distributi                                                                     on': 'normal', 'aft_loss_distribution_scale': 1.3243324221127821, 'max_depth': 6, 'booster': 'dart', 'scale_pos_weight': 5.64605634371671                                                                     1, 'alpha': 6.579924712141901, 'lambda': 9.179521150267417, 'eta': 0.48070487733230644, 'sampling_method': 'uniform', 'subsample': 0.8401                                                                     905862378698, 'gamma': 6.424116437609518}. Best is trial 295 with value: 4.282522474682648.
[I 2023-12-21 03:05:14,728] Trial 359 finished with value: inf and parameters: {'learning_rate': 0.8005944857032105, 'aft_loss_distributi                                                                     on': 'normal', 'aft_loss_distribution_scale': 1.14152167911448, 'max_depth': 5, 'booster': 'dart', 'scale_pos_weight': 4.759283043802126,                                                                      'alpha': 6.254243959820211, 'lambda': 1.7101417032912403, 'eta': 0.3711213343272817, 'sampling_method': 'uniform', 'subsample': 0.870046                                                                     0457126085, 'gamma': 7.1152899897616715}. Best is trial 295 with value: 4.282522474682648.
[I 2023-12-21 03:05:14,772] Trial 360 pruned. Trial was pruned at iteration 0.
[I 2023-12-21 03:05:14,818] Trial 361 pruned. Trial was pruned at iteration 1.
[I 2023-12-21 03:05:16,141] Trial 362 finished with value: inf and parameters: {'learning_rate': 0.7034115854272511, 'aft_loss_distributi                                                                     on': 'normal', 'aft_loss_distribution_scale': 1.2258075761441538, 'max_depth': 6, 'booster': 'dart', 'scale_pos_weight': 5.97466574991417                                                                     95, 'alpha': 6.578108605257733, 'lambda': 8.720275013607122, 'eta': 0.5318354788901094, 'sampling_method': 'uniform', 'subsample': 0.8472                                                                     999036053, 'gamma': 6.650291702552545}. Best is trial 295 with value: 4.282522474682648.
[I 2023-12-21 03:05:16,186] Trial 363 pruned. Trial was pruned at iteration 0.
[I 2023-12-21 03:05:17,658] Trial 364 finished with value: inf and parameters: {'learning_rate': 0.7264743552700627, 'aft_loss_distributi                                                                     on': 'normal', 'aft_loss_distribution_scale': 1.3757201021383658, 'max_depth': 8, 'booster': 'dart', 'scale_pos_weight': 3.84309558679278                                                                     2, 'alpha': 8.484357888410896, 'lambda': 8.547940883486216, 'eta': 0.4856491506395726, 'sampling_method': 'uniform', 'subsample': 0.82381                                                                     57695206567, 'gamma': 6.019642668463946}. Best is trial 295 with value: 4.282522474682648.
[I 2023-12-21 03:05:17,704] Trial 365 pruned. Trial was pruned at iteration 0.
[I 2023-12-21 03:05:17,748] Trial 366 pruned. Trial was pruned at iteration 0.
[I 2023-12-21 03:05:23,956] Trial 367 finished with value: 4.351589439139 and parameters: {'learning_rate': 0.7619648694690602, 'aft_loss                                                                     _distribution': 'normal', 'aft_loss_distribution_scale': 1.5250279441107344, 'max_depth': 3, 'booster': 'dart', 'scale_pos_weight': 5.803                                                                     672326082137, 'alpha': 6.9662822175278265, 'lambda': 8.992173202561336, 'eta': 0.43828007856153617, 'sampling_method': 'uniform', 'subsam                                                                     ple': 0.7923329775868222, 'gamma': 7.020644742980471}. Best is trial 295 with value: 4.282522474682648.
[I 2023-12-21 03:05:26,326] Trial 368 finished with value: 4.273464722532114 and parameters: {'learning_rate': 0.7324837581741391, 'aft_l                                                                     oss_distribution': 'normal', 'aft_loss_distribution_scale': 1.2624446856068419, 'max_depth': 6, 'booster': 'dart', 'scale_pos_weight': 6.                                                                     19865891116376, 'alpha': 7.81315570776271, 'lambda': 8.766836672234831, 'eta': 0.4868713287844245, 'sampling_method': 'uniform', 'subsamp                                                                     le': 0.8136130378660018, 'gamma': 6.745801636230835}. Best is trial 368 with value: 4.273464722532114.
[I 2023-12-21 03:05:26,372] Trial 369 pruned. Trial was pruned at iteration 0.
[I 2023-12-21 03:05:26,416] Trial 370 pruned. Trial was pruned at iteration 0.
[I 2023-12-21 03:05:27,519] Trial 371 finished with value: inf and parameters: {'learning_rate': 0.7978724330934384, 'aft_loss_distributi                                                                     on': 'normal', 'aft_loss_distribution_scale': 1.1906239150941613, 'max_depth': 9, 'booster': 'dart', 'scale_pos_weight': 4.29200189760985                                                                     8, 'alpha': 8.004946845069693, 'lambda': 8.732997303503154, 'eta': 0.34528571439850897, 'sampling_method': 'uniform', 'subsample': 0.8779                                                                     299982118597, 'gamma': 5.895639969554215}. Best is trial 368 with value: 4.273464722532114.
[I 2023-12-21 03:05:27,564] Trial 372 pruned. Trial was pruned at iteration 0.
[I 2023-12-21 03:05:27,612] Trial 373 pruned. Trial was pruned at iteration 1.
[I 2023-12-21 03:05:31,559] Trial 374 finished with value: 4.286263927114154 and parameters: {'learning_rate': 0.7087107389976899, 'aft_l                                                                     oss_distribution': 'normal', 'aft_loss_distribution_scale': 1.321154315990795, 'max_depth': 6, 'booster': 'dart', 'scale_pos_weight': 6.3                                                                     37329920136803, 'alpha': 8.693580068424726, 'lambda': 8.573638845405299, 'eta': 0.6329485410768733, 'sampling_method': 'uniform', 'subsam                                                                     ple': 0.8588206983799861, 'gamma': 5.625916070095061}. Best is trial 368 with value: 4.273464722532114.
[I 2023-12-21 03:05:31,605] Trial 375 pruned. Trial was pruned at iteration 0.
[I 2023-12-21 03:05:32,639] Trial 376 finished with value: inf and parameters: {'learning_rate': 0.8142758815800278, 'aft_loss_distributi                                                                     on': 'normal', 'aft_loss_distribution_scale': 0.7910805313998887, 'max_depth': 6, 'booster': 'dart', 'scale_pos_weight': 6.29126271460036                                                                     3, 'alpha': 6.754741497601396, 'lambda': 8.478668540172995, 'eta': 0.5265753884665961, 'sampling_method': 'uniform', 'subsample': 0.86389                                                                     97583671596, 'gamma': 5.574224801466327}. Best is trial 368 with value: 4.273464722532114.
[I 2023-12-21 03:05:33,693] Trial 377 finished with value: inf and parameters: {'learning_rate': 0.7790434745985109, 'aft_loss_distributi                                                                     on': 'normal', 'aft_loss_distribution_scale': 1.0179976226439376, 'max_depth': 6, 'booster': 'dart', 'scale_pos_weight': 6.16270943805236                                                                     2, 'alpha': 8.450172646315803, 'lambda': 8.362890594186467, 'eta': 0.42816415848236217, 'sampling_method': 'uniform', 'subsample': 0.7883                                                                     008554039, 'gamma': 6.103587777022802}. Best is trial 368 with value: 4.273464722532114.
[I 2023-12-21 03:05:33,738] Trial 378 pruned. Trial was pruned at iteration 0.
[I 2023-12-21 03:05:35,213] Trial 379 finished with value: inf and parameters: {'learning_rate': 0.7275840866225508, 'aft_loss_distributi                                                                     on': 'normal', 'aft_loss_distribution_scale': 1.2554560549563702, 'max_depth': 6, 'booster': 'dart', 'scale_pos_weight': 6.45534349220300                                                                     9, 'alpha': 8.760462225575129, 'lambda': 2.2067548610652943, 'eta': 0.458721818239231, 'sampling_method': 'uniform', 'subsample': 0.88107                                                                     77578405515, 'gamma': 6.076906466938198}. Best is trial 368 with value: 4.273464722532114.
[I 2023-12-21 03:05:35,258] Trial 380 pruned. Trial was pruned at iteration 0.
[I 2023-12-21 03:05:35,302] Trial 381 pruned. Trial was pruned at iteration 0.
[I 2023-12-21 03:05:35,351] Trial 382 pruned. Trial was pruned at iteration 1.
[I 2023-12-21 03:05:35,395] Trial 383 pruned. Trial was pruned at iteration 0.
[I 2023-12-21 03:05:36,786] Trial 384 finished with value: inf and parameters: {'learning_rate': 0.7362721727655158, 'aft_loss_distributi                                                                     on': 'normal', 'aft_loss_distribution_scale': 1.4019834941702647, 'max_depth': 6, 'booster': 'dart', 'scale_pos_weight': 6.32992721042116                                                                     2, 'alpha': 6.426934158380704, 'lambda': 8.518160343074692, 'eta': 0.42692677902324006, 'sampling_method': 'uniform', 'subsample': 0.8144                                                                     537406849915, 'gamma': 5.946185487844824}. Best is trial 368 with value: 4.273464722532114.
[I 2023-12-21 03:05:38,826] Trial 385 finished with value: 4.3582266789169575 and parameters: {'learning_rate': 0.7659777743795021, 'aft_                                                                     loss_distribution': 'normal', 'aft_loss_distribution_scale': 1.527649043208521, 'max_depth': 6, 'booster': 'dart', 'scale_pos_weight': 6.                                                                     575892353395294, 'alpha': 8.354524827665461, 'lambda': 8.231130026797254, 'eta': 0.4723045429034169, 'sampling_method': 'uniform', 'subsa                                                                     mple': 0.3309155546379682, 'gamma': 6.716000387601387}. Best is trial 368 with value: 4.273464722532114.
[I 2023-12-21 03:05:38,872] Trial 386 pruned. Trial was pruned at iteration 0.
[I 2023-12-21 03:05:38,917] Trial 387 pruned. Trial was pruned at iteration 0.
[I 2023-12-21 03:05:40,279] Trial 388 finished with value: inf and parameters: {'learning_rate': 0.7533220876880211, 'aft_loss_distributi                                                                     on': 'normal', 'aft_loss_distribution_scale': 1.1022385009409785, 'max_depth': 6, 'booster': 'dart', 'scale_pos_weight': 5.67111376576725                                                                     95, 'alpha': 7.084205712150117, 'lambda': 8.985200936493838, 'eta': 0.5322002226156481, 'sampling_method': 'uniform', 'subsample': 0.7920                                                                     473031857552, 'gamma': 6.521228155256843}. Best is trial 368 with value: 4.273464722532114.
[I 2023-12-21 03:05:40,327] Trial 389 pruned. Trial was pruned at iteration 1.
[I 2023-12-21 03:05:41,369] Trial 390 finished with value: inf and parameters: {'learning_rate': 0.7907877149481221, 'aft_loss_distributi                                                                     on': 'normal', 'aft_loss_distribution_scale': 1.3199919086651066, 'max_depth': 6, 'booster': 'dart', 'scale_pos_weight': 4.91568829234694                                                                     6, 'alpha': 6.4644158902731705, 'lambda': 8.599589031230073, 'eta': 0.6265134817856762, 'sampling_method': 'uniform', 'subsample': 0.8300                                                                     015383300426, 'gamma': 6.292051239607484}. Best is trial 368 with value: 4.273464722532114.
[I 2023-12-21 03:05:41,424] Trial 391 pruned. Trial was pruned at iteration 2.
[I 2023-12-21 03:05:42,470] Trial 392 finished with value: inf and parameters: {'learning_rate': 0.8228668479832244, 'aft_loss_distributi                                                                     on': 'normal', 'aft_loss_distribution_scale': 0.9047868221332331, 'max_depth': 7, 'booster': 'dart', 'scale_pos_weight': 6.21968489260595                                                                     8, 'alpha': 7.940813802707331, 'lambda': 8.756305422250335, 'eta': 0.4157737908406942, 'sampling_method': 'uniform', 'subsample': 0.80783                                                                     82569548875, 'gamma': 6.715616993431682}. Best is trial 368 with value: 4.273464722532114.
[I 2023-12-21 03:05:42,518] Trial 393 pruned. Trial was pruned at iteration 1.
[I 2023-12-21 03:05:46,837] Trial 394 finished with value: 4.2893454977137635 and parameters: {'learning_rate': 0.7221363099174927, 'aft_                                                                     loss_distribution': 'normal', 'aft_loss_distribution_scale': 1.324082409697227, 'max_depth': 7, 'booster': 'dart', 'scale_pos_weight': 5.                                                                     555321755287356, 'alpha': 6.192010760545463, 'lambda': 8.398552030722625, 'eta': 0.578441533152972, 'sampling_method': 'uniform', 'subsam                                                                     ple': 0.8348850413869777, 'gamma': 7.143676106703989}. Best is trial 368 with value: 4.273464722532114.
[I 2023-12-21 03:05:48,089] Trial 395 finished with value: inf and parameters: {'learning_rate': 0.7097062455932339, 'aft_loss_distributi                                                                     on': 'normal', 'aft_loss_distribution_scale': 1.1656297258034338, 'max_depth': 7, 'booster': 'dart', 'scale_pos_weight': 5.28454574752343                                                                     8, 'alpha': 6.21749723445635, 'lambda': 8.239596842555436, 'eta': 0.5817636390048556, 'sampling_method': 'uniform', 'subsample': 0.837861                                                                     2708169929, 'gamma': 7.549653749066381}. Best is trial 368 with value: 4.273464722532114.
[I 2023-12-21 03:05:48,135] Trial 396 pruned. Trial was pruned at iteration 0.
[I 2023-12-21 03:05:49,341] Trial 397 finished with value: inf and parameters: {'learning_rate': 0.7217401940045399, 'aft_loss_distributi                                                                     on': 'normal', 'aft_loss_distribution_scale': 1.2759168408217585, 'max_depth': 7, 'booster': 'dart', 'scale_pos_weight': 5.67682582508402                                                                     4, 'alpha': 6.690774993244154, 'lambda': 8.414066148877888, 'eta': 0.5459109632519318, 'sampling_method': 'uniform', 'subsample': 0.89255                                                                     46532917619, 'gamma': 7.170640223732153}. Best is trial 368 with value: 4.273464722532114.
[I 2023-12-21 03:05:50,423] Trial 398 finished with value: inf and parameters: {'learning_rate': 0.7749911077505534, 'aft_loss_distributi                                                                     on': 'normal', 'aft_loss_distribution_scale': 0.9458452450578778, 'max_depth': 6, 'booster': 'dart', 'scale_pos_weight': 5.15010651607413                                                                     7, 'alpha': 6.448789788333599, 'lambda': 8.121256197308345, 'eta': 0.5633184560975496, 'sampling_method': 'uniform', 'subsample': 0.85134                                                                     46315654707, 'gamma': 5.953432390525218}. Best is trial 368 with value: 4.273464722532114.
[I 2023-12-21 03:05:50,469] Trial 399 pruned. Trial was pruned at iteration 0.
[I 2023-12-21 03:05:50,518] Trial 400 pruned. Trial was pruned at iteration 1.
[I 2023-12-21 03:05:50,564] Trial 401 pruned. Trial was pruned at iteration 0.
[I 2023-12-21 03:05:50,614] Trial 402 pruned. Trial was pruned at iteration 0.
[I 2023-12-21 03:05:50,659] Trial 403 pruned. Trial was pruned at iteration 0.
[I 2023-12-21 03:05:51,739] Trial 404 finished with value: inf and parameters: {'learning_rate': 0.795681207194208, 'aft_loss_distributio                                                                     n': 'normal', 'aft_loss_distribution_scale': 1.1739124030281194, 'max_depth': 7, 'booster': 'dart', 'scale_pos_weight': 5.995651079251317                                                                     , 'alpha': 6.960158757840374, 'lambda': 8.466697449376126, 'eta': 0.4455006656388659, 'sampling_method': 'uniform', 'subsample': 0.811755                                                                     9606757253, 'gamma': 7.636535752723259}. Best is trial 368 with value: 4.273464722532114.
[I 2023-12-21 03:05:51,788] Trial 405 pruned. Trial was pruned at iteration 1.
[I 2023-12-21 03:05:55,278] Trial 406 finished with value: 4.342635490048681 and parameters: {'learning_rate': 0.7432806260659424, 'aft_l                                                                     oss_distribution': 'normal', 'aft_loss_distribution_scale': 1.5010055027039775, 'max_depth': 7, 'booster': 'dart', 'scale_pos_weight': 5.                                                                     795704526148151, 'alpha': 6.027284492667697, 'lambda': 9.124749557898872, 'eta': 0.5418591484559314, 'sampling_method': 'uniform', 'subsa                                                                     mple': 0.8422278982755157, 'gamma': 6.117689707457422}. Best is trial 368 with value: 4.273464722532114.
[I 2023-12-21 03:05:55,327] Trial 407 pruned. Trial was pruned at iteration 0.
[I 2023-12-21 03:05:56,504] Trial 408 finished with value: inf and parameters: {'learning_rate': 0.8445436962082238, 'aft_loss_distributi                                                                     on': 'normal', 'aft_loss_distribution_scale': 1.3471657146770375, 'max_depth': 7, 'booster': 'dart', 'scale_pos_weight': 6.57585024901782                                                                     9, 'alpha': 6.586694369208586, 'lambda': 2.4688245963402182, 'eta': 0.47162614236672123, 'sampling_method': 'uniform', 'subsample': 0.875                                                                     5032876704032, 'gamma': 8.070247800199784}. Best is trial 368 with value: 4.273464722532114.
[I 2023-12-21 03:05:56,552] Trial 409 pruned. Trial was pruned at iteration 0.
[I 2023-12-21 03:05:56,600] Trial 410 pruned. Trial was pruned at iteration 1.
[I 2023-12-21 03:05:56,646] Trial 411 pruned. Trial was pruned at iteration 0.
[I 2023-12-21 03:05:56,692] Trial 412 pruned. Trial was pruned at iteration 0.
[I 2023-12-21 03:05:56,737] Trial 413 pruned. Trial was pruned at iteration 0.
