[I 2023-12-18 22:52:07,150] Trial 12 finished with value: 5.268659431275031 and parameters: {'learning_rate': 0.6322699252770444, 'aft_loss_distribution': 'logistic', 'aft_loss_distribution_scale': 3.0307692681244123, 'max_depth': 10, 'booster': 'dart', 'scale_pos_weight': 6.605688367309626, 'alpha': 7.833290195941172, 'lambda': 6.90376980128109, 'eta': 0.7701693946405793, 'sampling_method': 'gradient_based', 'subsample': 0.5916486037314107, 'gamma': 3.6800111772700266}. Best is trial 12 with value: 5.268659431275031.
[I 2023-12-18 22:52:12,078] Trial 13 finished with value: 4.753841924339328 and parameters: {'learning_rate': 0.6007097378226061, 'aft_loss_distribution': 'logistic', 'aft_loss_distribution_scale': 1.6663830413413758, 'max_depth': 9, 'booster': 'dart', 'scale_pos_weight': 6.660950487789288, 'alpha': 7.6987266950010795, 'lambda': 2.1341795834415906, 'eta': 0.7327578617962638, 'sampling_method': 'uniform', 'subsample': 0.42045800851373827, 'gamma': 0.22298556219274968}. Best is trial 13 with value: 4.753841924339328.
[I 2023-12-18 22:52:12,132] Trial 14 pruned. Trial was pruned at iteration 0.
[I 2023-12-18 22:52:19,148] Trial 15 finished with value: 4.962747152030196 and parameters: {'learning_rate': 0.7944181055161987, 'aft_loss_distribution': 'logistic', 'aft_loss_distribution_scale': 2.138592403699871, 'max_depth': 9, 'booster': 'dart', 'scale_pos_weight': 6.798485807344089, 'alpha': 7.452070127631722, 'lambda': 2.0140222148459173, 'eta': 0.8046500044611162, 'sampling_method': 'uniform', 'subsample': 0.17845181115987424, 'gamma': 0.141869312522516}. Best is trial 13 with value: 4.753841924339328.
[I 2023-12-18 22:52:20,972] Trial 16 finished with value: inf and parameters: {'learning_rate': 0.8124258003815819, 'aft_loss_distribution': 'logistic', 'aft_loss_distribution_scale': 1.756808015847806, 'max_depth': 8, 'booster': 'dart', 'scale_pos_weight': 7.657239970886454, 'alpha': 7.079678507125946, 'lambda': 1.7311621214407062, 'eta': 0.8016128983447837, 'sampling_method': 'uniform', 'subsample': 0.12688522085618487, 'gamma': 0.0034330840754315806}. Best is trial 13 with value: 4.753841924339328.
[I 2023-12-18 22:52:21,064] Trial 17 pruned. Trial was pruned at iteration 0.
[I 2023-12-18 22:52:21,521] Trial 18 finished with value: 5.0492007473222795 and parameters: {'learning_rate': 0.5269987325260216, 'aft_loss_distribution': 'logistic', 'aft_loss_distribution_scale': 2.36369660415924, 'max_depth': 9, 'booster': 'gbtree', 'scale_pos_weight': 7.312211932256629, 'alpha': 7.232249756056365, 'lambda': 1.5831754647687895, 'eta': 0.8480509770595628, 'sampling_method': 'uniform', 'subsample': 0.44028468241786023, 'gamma': 2.736314930390074}. Best is trial 13 with value: 4.753841924339328.
[I 2023-12-18 22:52:21,601] Trial 19 pruned. Trial was pruned at iteration 0.
[I 2023-12-18 22:52:21,677] Trial 20 pruned. Trial was pruned at iteration 0.
[I 2023-12-18 22:52:22,146] Trial 21 finished with value: 4.99338972917935 and parameters: {'learning_rate': 0.528355043626843, 'aft_loss_distribution': 'logistic', 'aft_loss_distribution_scale': 2.219116064712094, 'max_depth': 9, 'booster': 'gbtree', 'scale_pos_weight': 7.512807196142526, 'alpha': 6.964365189961727, 'lambda': 1.70298199417652, 'eta': 0.8724304922979346, 'sampling_method': 'uniform', 'subsample': 0.4515669976801562, 'gamma': 0.06062044927901322}. Best is trial 13 with value: 4.753841924339328.
[I 2023-12-18 22:52:22,500] Trial 22 finished with value: 5.000580219050135 and parameters: {'learning_rate': 0.7305009306518196, 'aft_loss_distribution': 'logistic', 'aft_loss_distribution_scale': 2.2385114469099205, 'max_depth': 9, 'booster': 'gbtree', 'scale_pos_weight': 7.806815160045736, 'alpha': 6.451777885732649, 'lambda': 1.453587616386781, 'eta': 0.8739818878894289, 'sampling_method': 'uniform', 'subsample': 0.3087103164045642, 'gamma': 0.14455245959368207}. Best is trial 13 with value: 4.753841924339328.
[I 2023-12-18 22:52:22,919] Trial 23 finished with value: 4.625376004492216 and parameters: {'learning_rate': 0.3628297995224994, 'aft_loss_distribution': 'logistic', 'aft_loss_distribution_scale': 1.4128912649981538, 'max_depth': 8, 'booster': 'gbtree', 'scale_pos_weight': 6.53706614820884, 'alpha': 8.400052845492528, 'lambda': 3.4105362114004967, 'eta': 0.9617850858609424, 'sampling_method': 'uniform', 'subsample': 0.47112634410079773, 'gamma': 0.9395178315583078}. Best is trial 23 with value: 4.625376004492216.
[I 2023-12-18 22:52:23,444] Trial 24 finished with value: 4.4227991891386145 and parameters: {'learning_rate': 0.4252055916074826, 'aft_loss_distribution': 'logistic', 'aft_loss_distribution_scale': 1.050817183139829, 'max_depth': 8, 'booster': 'gbtree', 'scale_pos_weight': 6.331254281151797, 'alpha': 8.271853434164239, 'lambda': 3.7691585827428202, 'eta': 0.9870652354698212, 'sampling_method': 'uniform', 'subsample': 0.6990221317595938, 'gamma': 0.9679949796367939}. Best is trial 24 with value: 4.4227991891386145.
[I 2023-12-18 22:52:23,538] Trial 25 pruned. Trial was pruned at iteration 0.
[I 2023-12-18 22:52:23,616] Trial 26 pruned. Trial was pruned at iteration 0.
[I 2023-12-18 22:52:23,921] Trial 27 finished with value: 4.686922304106022 and parameters: {'learning_rate': 0.39558418037613746, 'aft_loss_distribution': 'logistic', 'aft_loss_distribution_scale': 1.5214707071188192, 'max_depth': 8, 'booster': 'gbtree', 'scale_pos_weight': 6.28177439331615, 'alpha': 8.981076745268824, 'lambda': 3.388836308976931, 'eta': 0.7224518262588455, 'sampling_method': 'uniform', 'subsample': 0.5002192648330819, 'gamma': 8.032246146258395}. Best is trial 24 with value: 4.4227991891386145.
[I 2023-12-18 22:52:24,008] Trial 28 pruned. Trial was pruned at iteration 0.
[I 2023-12-18 22:52:24,087] Trial 29 pruned. Trial was pruned at iteration 0.
[I 2023-12-18 22:52:24,640] Trial 30 finished with value: 4.422479629114399 and parameters: {'learning_rate': 0.3171356901172054, 'aft_loss_distribution': 'logistic', 'aft_loss_distribution_scale': 1.0428830030286287, 'max_depth': 8, 'booster': 'gbtree', 'scale_pos_weight': 6.121100447414255, 'alpha': 9.793121923729121, 'lambda': 3.4587793377483775, 'eta': 0.9201930928225793, 'sampling_method': 'uniform', 'subsample': 0.4940609502501223, 'gamma': 8.599353616778995}. Best is trial 30 with value: 4.422479629114399.
[I 2023-12-18 22:52:25,418] Trial 31 finished with value: 4.556650617691153 and parameters: {'learning_rate': 0.33440130885944014, 'aft_loss_distribution': 'logistic', 'aft_loss_distribution_scale': 1.2788604383032496, 'max_depth': 8, 'booster': 'gbtree', 'scale_pos_weight': 6.047227128927622, 'alpha': 8.998958344825908, 'lambda': 3.364222088842268, 'eta': 0.9162094869041376, 'sampling_method': 'uniform', 'subsample': 0.5068494058908558, 'gamma': 7.5082147869001385}. Best is trial 30 with value: 4.422479629114399.
[I 2023-12-18 22:52:25,476] Trial 32 pruned. Trial was pruned at iteration 0.
[I 2023-12-18 22:52:25,859] Trial 33 finished with value: 4.368834798994118 and parameters: {'learning_rate': 0.2580812550866446, 'aft_loss_distribution': 'logistic', 'aft_loss_distribution_scale': 0.945881596488347, 'max_depth': 7, 'booster': 'gbtree', 'scale_pos_weight': 8.766502731475219, 'alpha': 8.30000082474171, 'lambda': 4.561547334552227, 'eta': 0.8607683055815085, 'sampling_method': 'uniform', 'subsample': 0.49461152685058996, 'gamma': 4.878260007022776}. Best is trial 33 with value: 4.368834798994118.
[I 2023-12-18 22:52:26,363] Trial 34 finished with value: 4.30679442519153 and parameters: {'learning_rate': 0.15989676875075703, 'aft_loss_distribution': 'logistic', 'aft_loss_distribution_scale': 0.838116531164976, 'max_depth': 7, 'booster': 'gbtree', 'scale_pos_weight': 8.30226730529221, 'alpha': 9.11150199957381, 'lambda': 4.591097209036129, 'eta': 0.8455962345667472, 'sampling_method': 'uniform', 'subsample': 0.6353321003177995, 'gamma': 4.982449481374171}. Best is trial 34 with value: 4.30679442519153.
[I 2023-12-18 22:52:26,417] Trial 35 pruned. Trial was pruned at iteration 0.
[I 2023-12-18 22:52:26,471] Trial 36 pruned. Trial was pruned at iteration 0.
[I 2023-12-18 22:52:26,524] Trial 37 pruned. Trial was pruned at iteration 0.
[I 2023-12-18 22:52:26,572] Trial 38 pruned. Trial was pruned at iteration 0.
[I 2023-12-18 22:52:26,624] Trial 39 pruned. Trial was pruned at iteration 0.
[I 2023-12-18 22:52:26,675] Trial 40 pruned. Trial was pruned at iteration 0.
[I 2023-12-18 22:52:26,939] Trial 41 finished with value: 4.399585672090781 and parameters: {'learning_rate': 0.3121083309253745, 'aft_loss_distribution': 'logistic', 'aft_loss_distribution_scale': 1.0053297913012074, 'max_depth': 7, 'booster': 'gbtree', 'scale_pos_weight': 7.151118833022558, 'alpha': 8.851612469714464, 'lambda': 2.8847187207820735, 'eta': 0.9038016731389185, 'sampling_method': 'uniform', 'subsample': 0.5221338902034645, 'gamma': 8.39441601328829}. Best is trial 34 with value: 4.30679442519153.
[I 2023-12-18 22:52:27,721] Trial 42 finished with value: 4.316934582673861 and parameters: {'learning_rate': 0.10954898254493417, 'aft_loss_distribution': 'logistic', 'aft_loss_distribution_scale': 0.6746237969929929, 'max_depth': 7, 'booster': 'gbtree', 'scale_pos_weight': 7.209110192719899, 'alpha': 9.553437056739508, 'lambda': 4.013686707167831, 'eta': 0.8922185925916348, 'sampling_method': 'uniform', 'subsample': 0.567642601087591, 'gamma': 9.884141994885777}. Best is trial 34 with value: 4.30679442519153.
[I 2023-12-18 22:52:27,777] Trial 43 pruned. Trial was pruned at iteration 0.
[I 2023-12-18 22:52:27,825] Trial 44 pruned. Trial was pruned at iteration 0.
[I 2023-12-18 22:52:27,881] Trial 45 pruned. Trial was pruned at iteration 0.
[I 2023-12-18 22:52:27,930] Trial 46 pruned. Trial was pruned at iteration 0.
[I 2023-12-18 22:52:27,991] Trial 47 pruned. Trial was pruned at iteration 0.
[I 2023-12-18 22:52:28,047] Trial 48 pruned. Trial was pruned at iteration 0.
[I 2023-12-18 22:52:28,102] Trial 49 pruned. Trial was pruned at iteration 0.
[I 2023-12-18 22:52:28,152] Trial 50 pruned. Trial was pruned at iteration 0.
[I 2023-12-18 22:52:28,352] Trial 51 finished with value: 4.462848279993138 and parameters: {'learning_rate': 0.30416236213287134, 'aft_loss_distribution': 'logistic', 'aft_loss_distribution_scale': 1.1159688277703177, 'max_depth': 8, 'booster': 'gbtree', 'scale_pos_weight': 6.902166940165218, 'alpha': 1.4790050498916667, 'lambda': 3.890218258251628, 'eta': 0.949792051690931, 'sampling_method': 'uniform', 'subsample': 0.6799974054628914, 'gamma': 6.805058745444502}. Best is trial 34 with value: 4.30679442519153.
[I 2023-12-18 22:52:28,408] Trial 52 pruned. Trial was pruned at iteration 0.
[I 2023-12-18 22:52:28,619] Trial 53 pruned. Trial was pruned at iteration 94.
[I 2023-12-18 22:52:28,682] Trial 54 pruned. Trial was pruned at iteration 0.
[I 2023-12-18 22:52:28,733] Trial 55 pruned. Trial was pruned at iteration 0.
[I 2023-12-18 22:52:28,783] Trial 56 pruned. Trial was pruned at iteration 0.
[I 2023-12-18 22:52:28,838] Trial 57 pruned. Trial was pruned at iteration 0.
[I 2023-12-18 22:52:28,893] Trial 58 pruned. Trial was pruned at iteration 0.
[I 2023-12-18 22:52:28,943] Trial 59 pruned. Trial was pruned at iteration 0.
[I 2023-12-18 22:52:29,000] Trial 60 pruned. Trial was pruned at iteration 0.
[I 2023-12-18 22:52:29,344] Trial 61 finished with value: 4.419686724921112 and parameters: {'learning_rate': 0.30310263665769904, 'aft_loss_distribution': 'logistic', 'aft_loss_distribution_scale': 1.0497289791253983, 'max_depth': 8, 'booster': 'gbtree', 'scale_pos_weight': 6.881426248201941, 'alpha': 1.6215748989474121, 'lambda': 2.8813007420600885, 'eta': 0.9513024520915883, 'sampling_method': 'uniform', 'subsample': 0.6469215546419045, 'gamma': 7.290286921047199}. Best is trial 34 with value: 4.30679442519153.
[I 2023-12-18 22:52:29,632] Trial 62 finished with value: 4.431962601489315 and parameters: {'learning_rate': 0.38386693606092803, 'aft_loss_distribution': 'logistic', 'aft_loss_distribution_scale': 1.0632890266938504, 'max_depth': 8, 'booster': 'gbtree', 'scale_pos_weight': 7.641326577486709, 'alpha': 5.049141765205543, 'lambda': 2.7644962266709605, 'eta': 0.8439171411233967, 'sampling_method': 'uniform', 'subsample': 0.7048559443466298, 'gamma': 7.155560705014523}. Best is trial 34 with value: 4.30679442519153.
[I 2023-12-18 22:52:29,867] Trial 63 pruned. Trial was pruned at iteration 94.
[I 2023-12-18 22:52:29,926] Trial 64 pruned. Trial was pruned at iteration 0.
[I 2023-12-18 22:52:29,979] Trial 65 pruned. Trial was pruned at iteration 0.
[I 2023-12-18 22:52:30,037] Trial 66 pruned. Trial was pruned at iteration 0.
[I 2023-12-18 22:52:30,096] Trial 67 pruned. Trial was pruned at iteration 0.
[I 2023-12-18 22:52:30,146] Trial 68 pruned. Trial was pruned at iteration 0.
[I 2023-12-18 22:52:30,211] Trial 69 pruned. Trial was pruned at iteration 0.
[I 2023-12-18 22:52:30,268] Trial 70 pruned. Trial was pruned at iteration 0.
[I 2023-12-18 22:52:30,692] Trial 71 finished with value: 4.482366378804949 and parameters: {'learning_rate': 0.39396810856501774, 'aft_loss_distribution': 'logistic', 'aft_loss_distribution_scale': 1.1481695169832913, 'max_depth': 8, 'booster': 'gbtree', 'scale_pos_weight': 7.549699278993537, 'alpha': 4.6847577393250655, 'lambda': 2.614235536549572, 'eta': 0.8452567810416466, 'sampling_method': 'uniform', 'subsample': 0.7111292267428578, 'gamma': 7.774591695896847}. Best is trial 34 with value: 4.30679442519153.
[I 2023-12-18 22:52:30,971] Trial 72 finished with value: 4.373160496280268 and parameters: {'learning_rate': 0.29644279854222244, 'aft_loss_distribution': 'logistic', 'aft_loss_distribution_scale': 0.9635451932133909, 'max_depth': 8, 'booster': 'gbtree', 'scale_pos_weight': 8.40697125706498, 'alpha': 5.983085237905064, 'lambda': 2.8965784485101995, 'eta': 0.8537754306055493, 'sampling_method': 'uniform', 'subsample': 0.6829202568657659, 'gamma': 6.309350497998333}. Best is trial 34 with value: 4.30679442519153.
[I 2023-12-18 22:52:31,034] Trial 73 pruned. Trial was pruned at iteration 0.
[I 2023-12-18 22:52:31,089] Trial 74 pruned. Trial was pruned at iteration 0.
[I 2023-12-18 22:52:31,154] Trial 75 pruned. Trial was pruned at iteration 0.
[I 2023-12-18 22:52:31,210] Trial 76 pruned. Trial was pruned at iteration 0.
[I 2023-12-18 22:52:31,272] Trial 77 pruned. Trial was pruned at iteration 0.
[I 2023-12-18 22:52:31,332] Trial 78 pruned. Trial was pruned at iteration 0.
[I 2023-12-18 22:52:31,388] Trial 79 pruned. Trial was pruned at iteration 0.
[I 2023-12-18 22:52:31,448] Trial 80 pruned. Trial was pruned at iteration 0.
[I 2023-12-18 22:52:31,503] Trial 81 pruned. Trial was pruned at iteration 0.
[I 2023-12-18 22:52:31,730] Trial 82 pruned. Trial was pruned at iteration 94.
[I 2023-12-18 22:52:31,789] Trial 83 pruned. Trial was pruned at iteration 0.
[I 2023-12-18 22:52:31,852] Trial 84 pruned. Trial was pruned at iteration 1.
[I 2023-12-18 22:52:31,910] Trial 85 pruned. Trial was pruned at iteration 0.
[I 2023-12-18 22:52:31,968] Trial 86 pruned. Trial was pruned at iteration 0.
[I 2023-12-18 22:52:32,025] Trial 87 pruned. Trial was pruned at iteration 1.
[I 2023-12-18 22:52:32,094] Trial 88 pruned. Trial was pruned at iteration 0.
[I 2023-12-18 22:52:32,154] Trial 89 pruned. Trial was pruned at iteration 0.
[I 2023-12-18 22:52:32,217] Trial 90 pruned. Trial was pruned at iteration 0.
[I 2023-12-18 22:52:32,466] Trial 91 finished with value: 4.564068858391222 and parameters: {'learning_rate': 0.3506085381289626, 'aft_loss_distribution': 'logistic', 'aft_loss_distribution_scale': 1.2949524021603318, 'max_depth': 8, 'booster': 'gbtree', 'scale_pos_weight': 7.02215334841388, 'alpha': 0.7430194289337727, 'lambda': 3.8231809318887082, 'eta': 0.9538591614416823, 'sampling_method': 'uniform', 'subsample': 0.6746939141757862, 'gamma': 6.82345354620969}. Best is trial 34 with value: 4.30679442519153.
[I 2023-12-18 22:52:32,699] Trial 92 finished with value: 4.465703602773861 and parameters: {'learning_rate': 0.3109639145221806, 'aft_loss_distribution': 'logistic', 'aft_loss_distribution_scale': 1.1229304671323195, 'max_depth': 8, 'booster': 'gbtree', 'scale_pos_weight': 6.938510416920976, 'alpha': 1.0640815330221494, 'lambda': 3.9437681835642273, 'eta': 0.9301738159637678, 'sampling_method': 'uniform', 'subsample': 0.7098855967940463, 'gamma': 6.313032963069617}. Best is trial 34 with value: 4.30679442519153.
[I 2023-12-18 22:52:32,943] Trial 93 finished with value: 4.360396639781199 and parameters: {'learning_rate': 0.2668951023801779, 'aft_loss_distribution': 'logistic', 'aft_loss_distribution_scale': 0.9440665568762517, 'max_depth': 8, 'booster': 'gbtree', 'scale_pos_weight': 6.460351098106705, 'alpha': 1.8019906434411375, 'lambda': 4.196987281802642, 'eta': 0.8584312093916043, 'sampling_method': 'uniform', 'subsample': 0.6868414763424443, 'gamma': 6.7459060853162445}. Best is trial 34 with value: 4.30679442519153.
[I 2023-12-18 22:52:33,019] Trial 94 pruned. Trial was pruned at iteration 0.
[I 2023-12-18 22:52:33,081] Trial 95 pruned. Trial was pruned at iteration 0.
[I 2023-12-18 22:52:33,140] Trial 96 pruned. Trial was pruned at iteration 0.
[I 2023-12-18 22:52:33,206] Trial 97 pruned. Trial was pruned at iteration 0.
[I 2023-12-18 22:52:33,282] Trial 98 pruned. Trial was pruned at iteration 0.
[I 2023-12-18 22:52:33,348] Trial 99 pruned. Trial was pruned at iteration 0.
[I 2023-12-18 22:52:33,673] Trial 100 finished with value: 4.3221375773399515 and parameters: {'learning_rate': 0.23837987459968274, 'aft_loss_distribution': 'logistic', 'aft_loss_distribution_scale': 0.8624501333792352, 'max_depth': 8, 'booster': 'gbtree', 'scale_pos_weight': 9.26733028277183, 'alpha': 9.448789906246216, 'lambda': 5.276231839545746, 'eta': 0.9824205009105796, 'sampling_method': 'uniform', 'subsample': 0.7321174803190826, 'gamma': 8.79260664271081}. Best is trial 34 with value: 4.30679442519153.
[I 2023-12-18 22:52:34,324] Trial 101 pruned. Trial was pruned at iteration 294.
[I 2023-12-18 22:52:34,384] Trial 102 pruned. Trial was pruned at iteration 0.
[I 2023-12-18 22:52:34,579] Trial 103 pruned. Trial was pruned at iteration 64.
[I 2023-12-18 22:52:34,640] Trial 104 pruned. Trial was pruned at iteration 2.
[I 2023-12-18 22:52:35,248] Trial 105 pruned. Trial was pruned at iteration 294.
[I 2023-12-18 22:52:35,313] Trial 106 pruned. Trial was pruned at iteration 0.
[I 2023-12-18 22:52:35,370] Trial 107 pruned. Trial was pruned at iteration 0.
[I 2023-12-18 22:52:35,449] Trial 108 pruned. Trial was pruned at iteration 0.
[I 2023-12-18 22:52:35,540] Trial 109 pruned. Trial was pruned at iteration 0.
[I 2023-12-18 22:52:35,637] Trial 110 pruned. Trial was pruned at iteration 0.
[I 2023-12-18 22:52:35,933] Trial 111 finished with value: 4.469767960031234 and parameters: {'learning_rate': 0.30417138694815044, 'aft_loss_distribution': 'logistic', 'aft_loss_distribution_scale': 1.127863566776343, 'max_depth': 8, 'booster': 'gbtree', 'scale_pos_weight': 6.7230719565298465, 'alpha': 1.3093487678057223, 'lambda': 5.119893073515691, 'eta': 0.9587301345811187, 'sampling_method': 'uniform', 'subsample': 0.7264742328014379, 'gamma': 7.216227906714798}. Best is trial 34 with value: 4.30679442519153.
[I 2023-12-18 22:52:36,046] Trial 112 pruned. Trial was pruned at iteration 2.
[I 2023-12-18 22:52:36,417] Trial 113 finished with value: 4.421262712954142 and parameters: {'learning_rate': 0.27133707031657983, 'aft_loss_distribution': 'logistic', 'aft_loss_distribution_scale': 1.0479437192496497, 'max_depth': 7, 'booster': 'gbtree', 'scale_pos_weight': 7.505203937800754, 'alpha': 1.57750991827008, 'lambda': 3.8087968681405364, 'eta': 0.8974117571654968, 'sampling_method': 'uniform', 'subsample': 0.6450831851916004, 'gamma': 7.5548539928907275}. Best is trial 34 with value: 4.30679442519153.
[I 2023-12-18 22:52:36,818] Trial 114 finished with value: 4.315334785055106 and parameters: {'learning_rate': 0.25125848746938656, 'aft_loss_distribution': 'logistic', 'aft_loss_distribution_scale': 0.8575743550110041, 'max_depth': 7, 'booster': 'gbtree', 'scale_pos_weight': 7.508605789554188, 'alpha': 0.6826453802933364, 'lambda': 3.301299249551925, 'eta': 0.8660583920001098, 'sampling_method': 'uniform', 'subsample': 0.6466626686542056, 'gamma': 6.420077601501221}. Best is trial 34 with value: 4.30679442519153.
[I 2023-12-18 22:52:37,649] Trial 115 pruned. Trial was pruned at iteration 294.
[I 2023-12-18 22:52:37,740] Trial 116 pruned. Trial was pruned at iteration 0.
[I 2023-12-18 22:52:37,829] Trial 117 pruned. Trial was pruned at iteration 0.
[I 2023-12-18 22:52:37,920] Trial 118 pruned. Trial was pruned at iteration 0.
[I 2023-12-18 22:52:38,007] Trial 119 pruned. Trial was pruned at iteration 0.
[I 2023-12-18 22:52:38,095] Trial 120 pruned. Trial was pruned at iteration 0.
[I 2023-12-18 22:52:38,426] Trial 121 finished with value: 4.387472932494795 and parameters: {'learning_rate': 0.2737820360008656, 'aft_loss_distribution': 'logistic', 'aft_loss_distribution_scale': 0.9886922801451546, 'max_depth': 7, 'booster': 'gbtree', 'scale_pos_weight': 7.553420564563975, 'alpha': 1.8654034577024667, 'lambda': 2.8223363041080023, 'eta': 0.8586749229384999, 'sampling_method': 'uniform', 'subsample': 0.7100679342364962, 'gamma': 7.06246541049679}. Best is trial 34 with value: 4.30679442519153.
[I 2023-12-18 22:52:39,180] Trial 122 finished with value: 4.366274756007159 and parameters: {'learning_rate': 0.2725493281960994, 'aft_loss_distribution': 'logistic', 'aft_loss_distribution_scale': 0.9543761455809716, 'max_depth': 7, 'booster': 'gbtree', 'scale_pos_weight': 7.992294504604181, 'alpha': 1.9847649079299947, 'lambda': 3.0081640576241138, 'eta': 0.8642347186627252, 'sampling_method': 'uniform', 'subsample': 0.588550999886206, 'gamma': 6.628345941802702}. Best is trial 34 with value: 4.30679442519153.
[I 2023-12-18 22:52:39,297] Trial 123 pruned. Trial was pruned at iteration 0.
