[I 2023-12-19 00:20:36,039] Trial 344 finished with value: 2.016887109290523 and parameters: {'learning_rate': 0.9671028807687478, 'aft_loss_distribution': 'normal', 'aft_loss_distribution_scale': 1.7589107742249568, 'max_depth': 9, 'booster': 'dart', 'scale_pos_weight': 0.25572034422327233, 'alpha': 8.234841697678435, 'lambda': 7.788558196908304, 'eta': 0.8883176762307462, 'sampling_method': 'uniform', 'subsample': 0.25233521738769327, 'gamma': 9.800022635709583}. Best is trial 337 with value: 2.0026640461630887.
[I 2023-12-19 00:20:36,123] Trial 345 pruned. Trial was pruned at iteration 0.
[I 2023-12-19 00:20:38,978] Trial 346 finished with value: inf and parameters: {'learning_rate': 0.9808503277020494, 'aft_loss_distribution': 'normal', 'aft_loss_distribution_scale': 1.353064586587347, 'max_depth': 7, 'booster': 'dart', 'scale_pos_weight': 0.044179416633888954, 'alpha': 7.776579146041378, 'lambda': 8.323252107534788, 'eta': 0.8720463763170191, 'sampling_method': 'uniform', 'subsample': 0.23485489226775028, 'gamma': 9.637874907951577}. Best is trial 337 with value: 2.0026640461630887.
[I 2023-12-19 00:20:50,040] Trial 347 finished with value: 2.0096764314793845 and parameters: {'learning_rate': 0.9665289103409492, 'aft_loss_distribution': 'normal', 'aft_loss_distribution_scale': 1.6978626628422302, 'max_depth': 10, 'booster': 'dart', 'scale_pos_weight': 0.1720926259945546, 'alpha': 7.905467122018686, 'lambda': 9.997718037672666, 'eta': 0.9088043122310736, 'sampling_method': 'uniform', 'subsample': 0.2684847326984343, 'gamma': 9.83446005719461}. Best is trial 337 with value: 2.0026640461630887.
[I 2023-12-19 00:20:50,139] Trial 348 pruned. Trial was pruned at iteration 1.
[I 2023-12-19 00:20:55,197] Trial 349 finished with value: 2.011243128137092 and parameters: {'learning_rate': 0.9405073655008444, 'aft_loss_distribution': 'normal', 'aft_loss_distribution_scale': 1.6647507660117213, 'max_depth': 10, 'booster': 'dart', 'scale_pos_weight': 0.16138353117526552, 'alpha': 8.143333392393568, 'lambda': 9.382158643162196, 'eta': 0.8326587891849829, 'sampling_method': 'uniform', 'subsample': 0.28620021340318624, 'gamma': 9.851945199808572}. Best is trial 337 with value: 2.0026640461630887.
[I 2023-12-19 00:20:59,282] Trial 350 finished with value: 2.008906090399608 and parameters: {'learning_rate': 0.9791460365219311, 'aft_loss_distribution': 'normal', 'aft_loss_distribution_scale': 1.652695448656097, 'max_depth': 10, 'booster': 'dart', 'scale_pos_weight': 0.3198273278367685, 'alpha': 8.72045186665656, 'lambda': 9.99961075789599, 'eta': 0.789872880516211, 'sampling_method': 'uniform', 'subsample': 0.30386096902748955, 'gamma': 9.969329179029776}. Best is trial 337 with value: 2.0026640461630887.
[I 2023-12-19 00:21:02,187] Trial 351 finished with value: 2.0105725586056558 and parameters: {'learning_rate': 0.9391648270749509, 'aft_loss_distribution': 'normal', 'aft_loss_distribution_scale': 1.573167046807143, 'max_depth': 10, 'booster': 'dart', 'scale_pos_weight': 0.3937139189675964, 'alpha': 9.08952834948721, 'lambda': 9.891652986230396, 'eta': 0.7876733120610716, 'sampling_method': 'uniform', 'subsample': 0.3104283604561331, 'gamma': 9.820640733631302}. Best is trial 337 with value: 2.0026640461630887.
[I 2023-12-19 00:21:09,796] Trial 352 finished with value: 2.0061002709510825 and parameters: {'learning_rate': 0.9421515584018093, 'aft_loss_distribution': 'normal', 'aft_loss_distribution_scale': 1.4826219076098146, 'max_depth': 10, 'booster': 'dart', 'scale_pos_weight': 0.3576078148894387, 'alpha': 9.169670798789726, 'lambda': 9.88306899640183, 'eta': 0.7814247978849251, 'sampling_method': 'uniform', 'subsample': 0.28923179453569015, 'gamma': 9.999494645137773}. Best is trial 337 with value: 2.0026640461630887.
[I 2023-12-19 00:21:09,886] Trial 353 pruned. Trial was pruned at iteration 0.
[I 2023-12-19 00:21:09,964] Trial 354 pruned. Trial was pruned at iteration 0.
[I 2023-12-19 00:21:16,123] Trial 355 finished with value: 2.0075403744222533 and parameters: {'learning_rate': 0.9433339281620856, 'aft_loss_distribution': 'normal', 'aft_loss_distribution_scale': 1.4878483194172678, 'max_depth': 10, 'booster': 'dart', 'scale_pos_weight': 0.42770135845397667, 'alpha': 9.206350014674706, 'lambda': 9.98476100952658, 'eta': 0.7793459648661893, 'sampling_method': 'uniform', 'subsample': 0.2903719404908108, 'gamma': 9.989148714864795}. Best is trial 337 with value: 2.0026640461630887.
[I 2023-12-19 00:21:18,222] Trial 356 finished with value: inf and parameters: {'learning_rate': 0.9563399849586206, 'aft_loss_distribution': 'normal', 'aft_loss_distribution_scale': 1.4095201790624658, 'max_depth': 10, 'booster': 'dart', 'scale_pos_weight': 0.4483829632930854, 'alpha': 9.23002756768693, 'lambda': 9.871575222377235, 'eta': 0.7798739248218619, 'sampling_method': 'uniform', 'subsample': 0.2889038622071583, 'gamma': 9.662926162596882}. Best is trial 337 with value: 2.0026640461630887.
[I 2023-12-19 00:21:18,307] Trial 357 pruned. Trial was pruned at iteration 0.
[I 2023-12-19 00:21:18,386] Trial 358 pruned. Trial was pruned at iteration 0.
[I 2023-12-19 00:21:23,065] Trial 359 finished with value: 2.0065210762415555 and parameters: {'learning_rate': 0.9629813094676364, 'aft_loss_distribution': 'normal', 'aft_loss_distribution_scale': 1.4737217073020863, 'max_depth': 10, 'booster': 'dart', 'scale_pos_weight': 0.36130190721569844, 'alpha': 8.998090378162782, 'lambda': 9.494712209986515, 'eta': 0.8187912614409315, 'sampling_method': 'uniform', 'subsample': 0.3232926695975014, 'gamma': 9.6723318220506}. Best is trial 337 with value: 2.0026640461630887.
[I 2023-12-19 00:21:23,200] Trial 360 pruned. Trial was pruned at iteration 0.
[I 2023-12-19 00:21:24,984] Trial 361 finished with value: inf and parameters: {'learning_rate': 0.9595598915249733, 'aft_loss_distribution': 'normal', 'aft_loss_distribution_scale': 1.4575757802351614, 'max_depth': 10, 'booster': 'dart', 'scale_pos_weight': 0.36205432745789756, 'alpha': 9.291375512532312, 'lambda': 9.540281927374254, 'eta': 0.7722627204410166, 'sampling_method': 'uniform', 'subsample': 0.3188999825067299, 'gamma': 4.14679049751419}. Best is trial 337 with value: 2.0026640461630887.
[I 2023-12-19 00:21:25,088] Trial 362 pruned. Trial was pruned at iteration 0.
[I 2023-12-19 00:21:27,322] Trial 363 finished with value: inf and parameters: {'learning_rate': 0.966637223386718, 'aft_loss_distribution': 'normal', 'aft_loss_distribution_scale': 1.327816035066043, 'max_depth': 10, 'booster': 'dart', 'scale_pos_weight': 0.4813073891527326, 'alpha': 9.584690941342838, 'lambda': 9.406857732654116, 'eta': 0.8136706076624602, 'sampling_method': 'uniform', 'subsample': 0.28431851371277905, 'gamma': 9.650006082171133}. Best is trial 337 with value: 2.0026640461630887.
[I 2023-12-19 00:21:27,409] Trial 364 pruned. Trial was pruned at iteration 0.
[I 2023-12-19 00:21:28,982] Trial 365 finished with value: inf and parameters: {'learning_rate': 0.9992943550400628, 'aft_loss_distribution': 'normal', 'aft_loss_distribution_scale': 1.2027011414296838, 'max_depth': 10, 'booster': 'dart', 'scale_pos_weight': 0.3269769215900501, 'alpha': 9.101596100251523, 'lambda': 9.76173485379092, 'eta': 0.8272226761607939, 'sampling_method': 'uniform', 'subsample': 0.27140266401896906, 'gamma': 9.995878212944724}. Best is trial 337 with value: 2.0026640461630887.
[I 2023-12-19 00:21:31,140] Trial 366 finished with value: inf and parameters: {'learning_rate': 0.9562707783349581, 'aft_loss_distribution': 'normal', 'aft_loss_distribution_scale': 1.5262525610031634, 'max_depth': 10, 'booster': 'dart', 'scale_pos_weight': 0.41534339089697636, 'alpha': 8.734928658520142, 'lambda': 9.932552281887396, 'eta': 0.7762462804346358, 'sampling_method': 'uniform', 'subsample': 0.27261851657707964, 'gamma': 9.769816184628091}. Best is trial 337 with value: 2.0026640461630887.
[I 2023-12-19 00:21:31,243] Trial 367 pruned. Trial was pruned at iteration 1.
[I 2023-12-19 00:21:34,045] Trial 368 finished with value: 2.0044591001795595 and parameters: {'learning_rate': 0.981972821167788, 'aft_loss_distribution': 'normal', 'aft_loss_distribution_scale': 1.3652068075330444, 'max_depth': 10, 'booster': 'dart', 'scale_pos_weight': 0.4217223861913207, 'alpha': 8.864005346684374, 'lambda': 9.451582304282029, 'eta': 0.8003792578752295, 'sampling_method': 'uniform', 'subsample': 0.2627169795377195, 'gamma': 9.795986559010622}. Best is trial 337 with value: 2.0026640461630887.
[I 2023-12-19 00:21:34,187] Trial 369 pruned. Trial was pruned at iteration 0.
[I 2023-12-19 00:21:36,152] Trial 370 finished with value: inf and parameters: {'learning_rate': 0.9627629449016705, 'aft_loss_distribution': 'normal', 'aft_loss_distribution_scale': 1.333698396357795, 'max_depth': 10, 'booster': 'dart', 'scale_pos_weight': 0.404888929131877, 'alpha': 8.834623311496895, 'lambda': 9.504398762730066, 'eta': 0.8290141045660239, 'sampling_method': 'uniform', 'subsample': 0.3251833630823003, 'gamma': 3.1008313985521077}. Best is trial 337 with value: 2.0026640461630887.
[I 2023-12-19 00:21:36,291] Trial 371 pruned. Trial was pruned at iteration 0.
[I 2023-12-19 00:21:36,428] Trial 372 pruned. Trial was pruned at iteration 0.
[I 2023-12-19 00:21:45,653] Trial 373 finished with value: 2.0024995750776933 and parameters: {'learning_rate': 0.963326658320848, 'aft_loss_distribution': 'normal', 'aft_loss_distribution_scale': 1.4845883234411936, 'max_depth': 10, 'booster': 'dart', 'scale_pos_weight': 0.30220346632466677, 'alpha': 8.502549492510916, 'lambda': 9.299564379042785, 'eta': 0.8362103250216364, 'sampling_method': 'uniform', 'subsample': 0.3092315350585874, 'gamma': 9.997846657995307}. Best is trial 373 with value: 2.0024995750776933.
[I 2023-12-19 00:21:45,749] Trial 374 pruned. Trial was pruned at iteration 0.
[I 2023-12-19 00:21:45,830] Trial 375 pruned. Trial was pruned at iteration 0.
[I 2023-12-19 00:21:48,035] Trial 376 finished with value: inf and parameters: {'learning_rate': 0.9630154994475362, 'aft_loss_distribution': 'normal', 'aft_loss_distribution_scale': 1.8249678142293204, 'max_depth': 10, 'booster': 'dart', 'scale_pos_weight': 0.4996851116890392, 'alpha': 8.15050839427339, 'lambda': 9.637472950708723, 'eta': 0.8424563516686873, 'sampling_method': 'uniform', 'subsample': 0.3334301016782596, 'gamma': 9.550222787194592}. Best is trial 373 with value: 2.0024995750776933.
[I 2023-12-19 00:21:48,128] Trial 377 pruned. Trial was pruned at iteration 1.
[I 2023-12-19 00:21:48,217] Trial 378 pruned. Trial was pruned at iteration 0.
[I 2023-12-19 00:21:48,300] Trial 379 pruned. Trial was pruned at iteration 0.
[I 2023-12-19 00:21:48,403] Trial 380 pruned. Trial was pruned at iteration 0.
[I 2023-12-19 00:21:50,315] Trial 381 finished with value: inf and parameters: {'learning_rate': 0.9669835718857009, 'aft_loss_distribution': 'normal', 'aft_loss_distribution_scale': 1.6140426370485512, 'max_depth': 10, 'booster': 'dart', 'scale_pos_weight': 0.4279379144239494, 'alpha': 8.632967545471418, 'lambda': 9.99393014873749, 'eta': 0.8097136306694834, 'sampling_method': 'gradient_based', 'subsample': 0.3147841335442233, 'gamma': 9.468202774949052}. Best is trial 373 with value: 2.0024995750776933.
[I 2023-12-19 00:21:54,002] Trial 382 finished with value: 2.022524065064866 and parameters: {'learning_rate': 0.9819361270979451, 'aft_loss_distribution': 'normal', 'aft_loss_distribution_scale': 1.8368738965583784, 'max_depth': 10, 'booster': 'dart', 'scale_pos_weight': 0.2426780983216908, 'alpha': 8.371762976443481, 'lambda': 9.362340178546845, 'eta': 0.838795108101593, 'sampling_method': 'uniform', 'subsample': 0.34392614534349814, 'gamma': 9.716274469480332}. Best is trial 373 with value: 2.0024995750776933.
[I 2023-12-19 00:21:54,095] Trial 383 pruned. Trial was pruned at iteration 0.
[I 2023-12-19 00:21:54,189] Trial 384 pruned. Trial was pruned at iteration 0.
[I 2023-12-19 00:21:54,284] Trial 385 pruned. Trial was pruned at iteration 1.
[I 2023-12-19 00:21:56,886] Trial 386 finished with value: inf and parameters: {'learning_rate': 0.9653152689986867, 'aft_loss_distribution': 'normal', 'aft_loss_distribution_scale': 1.3109184001178518, 'max_depth': 10, 'booster': 'dart', 'scale_pos_weight': 0.28034096017743027, 'alpha': 8.76629586430204, 'lambda': 9.454358781237335, 'eta': 0.7733996444452382, 'sampling_method': 'uniform', 'subsample': 0.18876289422384948, 'gamma': 9.99305919726317}. Best is trial 373 with value: 2.0024995750776933.
[I 2023-12-19 00:22:00,120] Trial 387 finished with value: 2.024650126077682 and parameters: {'learning_rate': 0.9497216875900047, 'aft_loss_distribution': 'normal', 'aft_loss_distribution_scale': 1.7354344082736328, 'max_depth': 10, 'booster': 'dart', 'scale_pos_weight': 0.2266683024490011, 'alpha': 8.504696856570689, 'lambda': 9.802189378949011, 'eta': 0.8356497625449026, 'sampling_method': 'uniform', 'subsample': 0.2970444924188409, 'gamma': 4.625787908675499}. Best is trial 373 with value: 2.0024995750776933.
[I 2023-12-19 00:22:05,764] Trial 388 finished with value: 2.0041288266669524 and parameters: {'learning_rate': 0.97943876488946, 'aft_loss_distribution': 'normal', 'aft_loss_distribution_scale': 1.441285872539346, 'max_depth': 10, 'booster': 'dart', 'scale_pos_weight': 0.384800639828247, 'alpha': 9.459260994565897, 'lambda': 9.562066017281243, 'eta': 0.8007730267275336, 'sampling_method': 'uniform', 'subsample': 0.24561119027093495, 'gamma': 9.779242605862622}. Best is trial 373 with value: 2.0024995750776933.
[I 2023-12-19 00:22:05,910] Trial 389 pruned. Trial was pruned at iteration 0.
[I 2023-12-19 00:22:06,039] Trial 390 pruned. Trial was pruned at iteration 0.
[I 2023-12-19 00:22:10,635] Trial 391 finished with value: 2.003342751546617 and parameters: {'learning_rate': 0.9848343899756223, 'aft_loss_distribution': 'normal', 'aft_loss_distribution_scale': 1.404832641947857, 'max_depth': 10, 'booster': 'dart', 'scale_pos_weight': 0.4071952535908199, 'alpha': 9.657971285733808, 'lambda': 9.129899536134605, 'eta': 0.788527607203514, 'sampling_method': 'uniform', 'subsample': 0.3042830831338265, 'gamma': 9.807656636218647}. Best is trial 373 with value: 2.0024995750776933.
[I 2023-12-19 00:22:10,723] Trial 392 pruned. Trial was pruned at iteration 0.
[I 2023-12-19 00:22:15,433] Trial 393 finished with value: 2.006062799929681 and parameters: {'learning_rate': 0.9844316998859867, 'aft_loss_distribution': 'normal', 'aft_loss_distribution_scale': 1.3568670451810978, 'max_depth': 10, 'booster': 'dart', 'scale_pos_weight': 0.41817013532064323, 'alpha': 9.852239445705683, 'lambda': 9.14023443292489, 'eta': 0.8105210056914998, 'sampling_method': 'uniform', 'subsample': 0.326157201722644, 'gamma': 9.742238432606927}. Best is trial 373 with value: 2.0024995750776933.
[I 2023-12-19 00:22:17,007] Trial 394 finished with value: inf and parameters: {'learning_rate': 0.9993186185687123, 'aft_loss_distribution': 'normal', 'aft_loss_distribution_scale': 1.1492495256846782, 'max_depth': 10, 'booster': 'dart', 'scale_pos_weight': 0.5389780539561242, 'alpha': 9.91761028117685, 'lambda': 9.063668982811839, 'eta': 0.8157040194810287, 'sampling_method': 'uniform', 'subsample': 0.3002506224061927, 'gamma': 9.742780350013998}. Best is trial 373 with value: 2.0024995750776933.
[I 2023-12-19 00:22:17,103] Trial 395 pruned. Trial was pruned at iteration 0.
[I 2023-12-19 00:22:22,625] Trial 396 finished with value: 2.0007935914945794 and parameters: {'learning_rate': 0.9824752514879791, 'aft_loss_distribution': 'normal', 'aft_loss_distribution_scale': 1.4084333600123238, 'max_depth': 10, 'booster': 'dart', 'scale_pos_weight': 0.40446705148626816, 'alpha': 9.711129373081253, 'lambda': 9.228190637289229, 'eta': 0.8719792950015341, 'sampling_method': 'uniform', 'subsample': 0.3318152876724725, 'gamma': 9.993494784168321}. Best is trial 396 with value: 2.0007935914945794.
[I 2023-12-19 00:22:24,183] Trial 397 finished with value: inf and parameters: {'learning_rate': 0.9814554530966039, 'aft_loss_distribution': 'normal', 'aft_loss_distribution_scale': 1.3656427181092095, 'max_depth': 10, 'booster': 'dart', 'scale_pos_weight': 0.4478816692544376, 'alpha': 9.714396037180475, 'lambda': 9.361861624774672, 'eta': 0.87666055513273, 'sampling_method': 'uniform', 'subsample': 0.3345112171963009, 'gamma': 9.990309755760522}. Best is trial 396 with value: 2.0007935914945794.
[I 2023-12-19 00:22:24,281] Trial 398 pruned. Trial was pruned at iteration 0.
[I 2023-12-19 00:22:28,500] Trial 399 finished with value: 2.006133355452585 and parameters: {'learning_rate': 0.9978115459576176, 'aft_loss_distribution': 'normal', 'aft_loss_distribution_scale': 1.3190851119389362, 'max_depth': 10, 'booster': 'dart', 'scale_pos_weight': 3.1821979115635504, 'alpha': 9.502062018192019, 'lambda': 9.479291952273204, 'eta': 0.8899057656709009, 'sampling_method': 'uniform', 'subsample': 0.31419742977207754, 'gamma': 9.785111883702026}. Best is trial 396 with value: 2.0007935914945794.
[I 2023-12-19 00:22:29,949] Trial 400 finished with value: inf and parameters: {'learning_rate': 0.9990346418051103, 'aft_loss_distribution': 'normal', 'aft_loss_distribution_scale': 1.2793345908348321, 'max_depth': 10, 'booster': 'dart', 'scale_pos_weight': 2.3244367747266983, 'alpha': 9.817989754705007, 'lambda': 9.752407553649263, 'eta': 0.885786829665665, 'sampling_method': 'gradient_based', 'subsample': 0.3240370170939693, 'gamma': 9.503044590865775}. Best is trial 396 with value: 2.0007935914945794.
[I 2023-12-19 00:22:30,042] Trial 401 pruned. Trial was pruned at iteration 0.
[I 2023-12-19 00:22:31,601] Trial 402 finished with value: inf and parameters: {'learning_rate': 0.9996210266350294, 'aft_loss_distribution': 'normal', 'aft_loss_distribution_scale': 1.2199178415396366, 'max_depth': 10, 'booster': 'dart', 'scale_pos_weight': 0.36671879027867565, 'alpha': 9.447296175879416, 'lambda': 9.942235938073567, 'eta': 0.8773590133261787, 'sampling_method': 'uniform', 'subsample': 0.3098176828225398, 'gamma': 9.995483453373929}. Best is trial 396 with value: 2.0007935914945794.
[I 2023-12-19 00:22:31,694] Trial 403 pruned. Trial was pruned at iteration 0.
[I 2023-12-19 00:22:31,785] Trial 404 pruned. Trial was pruned at iteration 0.
[I 2023-12-19 00:22:34,181] Trial 405 finished with value: inf and parameters: {'learning_rate': 0.9989439872818334, 'aft_loss_distribution': 'normal', 'aft_loss_distribution_scale': 1.4409671244212008, 'max_depth': 10, 'booster': 'dart', 'scale_pos_weight': 0.39583560802904616, 'alpha': 9.954525193385413, 'lambda': 9.515450414401718, 'eta': 0.9747882539570013, 'sampling_method': 'uniform', 'subsample': 0.29674612759435537, 'gamma': 5.154641228134381}. Best is trial 396 with value: 2.0007935914945794.
[I 2023-12-19 00:22:34,342] Trial 406 pruned. Trial was pruned at iteration 0.
[I 2023-12-19 00:22:34,488] Trial 407 pruned. Trial was pruned at iteration 0.
[I 2023-12-19 00:22:38,932] Trial 408 finished with value: 2.0075246133947062 and parameters: {'learning_rate': 0.9564107395211904, 'aft_loss_distribution': 'normal', 'aft_loss_distribution_scale': 1.4379040936072238, 'max_depth': 10, 'booster': 'dart', 'scale_pos_weight': 0.3215502442352735, 'alpha': 9.482396909391847, 'lambda': 9.516620500017455, 'eta': 0.7842089839438865, 'sampling_method': 'uniform', 'subsample': 0.2901782388850768, 'gamma': 9.800801605610959}. Best is trial 396 with value: 2.0007935914945794.
[I 2023-12-19 00:22:39,029] Trial 409 pruned. Trial was pruned at iteration 0.
[I 2023-12-19 00:22:39,119] Trial 410 pruned. Trial was pruned at iteration 0.
[I 2023-12-19 00:22:46,759] Trial 411 finished with value: 2.0039993665858784 and parameters: {'learning_rate': 0.9557782652300225, 'aft_loss_distribution': 'normal', 'aft_loss_distribution_scale': 1.4430444660014075, 'max_depth': 10, 'booster': 'dart', 'scale_pos_weight': 0.476384416005438, 'alpha': 9.328196192465969, 'lambda': 9.981883271592991, 'eta': 0.7856512415502765, 'sampling_method': 'uniform', 'subsample': 0.28719905185303063, 'gamma': 9.9955888628618}. Best is trial 396 with value: 2.0007935914945794.
[I 2023-12-19 00:22:51,805] Trial 412 finished with value: 2.0048418314040815 and parameters: {'learning_rate': 0.9620270114868665, 'aft_loss_distribution': 'normal', 'aft_loss_distribution_scale': 1.4183654705923712, 'max_depth': 10, 'booster': 'dart', 'scale_pos_weight': 0.49964597720846654, 'alpha': 9.816169217746875, 'lambda': 9.365762040393355, 'eta': 0.8594590171885201, 'sampling_method': 'uniform', 'subsample': 0.28651106191361736, 'gamma': 9.981040119849382}. Best is trial 396 with value: 2.0007935914945794.
[I 2023-12-19 00:22:51,914] Trial 413 pruned. Trial was pruned at iteration 0.
[I 2023-12-19 00:22:54,295] Trial 414 finished with value: inf and parameters: {'learning_rate': 0.9752932469072227, 'aft_loss_distribution': 'normal', 'aft_loss_distribution_scale': 1.3726430843752797, 'max_depth': 10, 'booster': 'dart', 'scale_pos_weight': 0.46965632977429517, 'alpha': 9.75267024952537, 'lambda': 9.98394300579112, 'eta': 0.8485915086652096, 'sampling_method': 'uniform', 'subsample': 0.2703417054172774, 'gamma': 9.993398986663781}. Best is trial 396 with value: 2.0007935914945794.
[I 2023-12-19 00:22:54,397] Trial 415 pruned. Trial was pruned at iteration 0.
[I 2023-12-19 00:22:56,658] Trial 416 finished with value: inf and parameters: {'learning_rate': 0.9804237401973878, 'aft_loss_distribution': 'normal', 'aft_loss_distribution_scale': 1.397034551104727, 'max_depth': 10, 'booster': 'dart', 'scale_pos_weight': 3.273457810770889, 'alpha': 9.29085304817582, 'lambda': 9.668058791821824, 'eta': 0.7616237877012526, 'sampling_method': 'uniform', 'subsample': 0.28823039199742945, 'gamma': 9.808270601582446}. Best is trial 396 with value: 2.0007935914945794.
[I 2023-12-19 00:22:56,752] Trial 417 pruned. Trial was pruned at iteration 0.
