[I 2023-12-21 04:08:57,774] Trial 194 pruned. Trial was pruned at iteration 0.
[I 2023-12-21 04:08:57,885] Trial 195 pruned. Trial was pruned at iteration 0.
[I 2023-12-21 04:09:01,837] Trial 196 finished with value: 1.9374820548595122 and parameters: {'learning_rate': 0.22744473581389643, 'aft_loss_distribution': 'logistic', 'aft_loss_distribution_scale': 1.0594437395952068, 'max_depth': 8, 'booster': 'dart', 'scale_pos_weight': 1.8107538691182192, 'alpha': 4.852119633763875, 'lambda': 2.274688191947193, 'eta': 0.34334499414809005, 'sampling_method': 'gradient_based', 'subsample': 0.5926055356937384, 'gamma': 5.79154960630657}. Best is trial 193 with value: 1.923643950131964.
[I 2023-12-21 04:09:01,912] Trial 197 pruned. Trial was pruned at iteration 0.
[I 2023-12-21 04:09:01,982] Trial 198 pruned. Trial was pruned at iteration 0.
[I 2023-12-21 04:09:02,046] Trial 199 pruned. Trial was pruned at iteration 0.
[I 2023-12-21 04:09:02,114] Trial 200 pruned. Trial was pruned at iteration 0.
[I 2023-12-21 04:09:02,181] Trial 201 pruned. Trial was pruned at iteration 0.
[I 2023-12-21 04:09:02,264] Trial 202 pruned. Trial was pruned at iteration 0.
[I 2023-12-21 04:09:02,343] Trial 203 pruned. Trial was pruned at iteration 0.
[I 2023-12-21 04:09:02,415] Trial 204 pruned. Trial was pruned at iteration 0.
[I 2023-12-21 04:09:02,480] Trial 205 pruned. Trial was pruned at iteration 0.
[I 2023-12-21 04:09:02,544] Trial 206 pruned. Trial was pruned at iteration 0.
[I 2023-12-21 04:09:02,619] Trial 207 pruned. Trial was pruned at iteration 0.
[I 2023-12-21 04:09:02,691] Trial 208 pruned. Trial was pruned at iteration 0.
[I 2023-12-21 04:09:02,759] Trial 209 pruned. Trial was pruned at iteration 0.
[I 2023-12-21 04:09:09,890] Trial 210 pruned. Trial was pruned at iteration 128.
[I 2023-12-21 04:09:09,960] Trial 211 pruned. Trial was pruned at iteration 0.
[I 2023-12-21 04:09:22,560] Trial 212 finished with value: 1.9309278497725464 and parameters: {'learning_rate': 0.24105028250657262, 'aft_loss_distribution': 'logistic', 'aft_loss_distribution_scale': 0.987936367777747, 'max_depth': 8, 'booster': 'dart', 'scale_pos_weight': 1.336055656604994, 'alpha': 3.6685944721306902, 'lambda': 2.9149051783525284, 'eta': 0.3884881772724794, 'sampling_method': 'gradient_based', 'subsample': 0.5504501183416473, 'gamma': 5.925566417081508}. Best is trial 193 with value: 1.923643950131964.
[I 2023-12-21 04:09:26,163] Trial 213 finished with value: 1.9398526111510879 and parameters: {'learning_rate': 0.24577656871880302, 'aft_loss_distribution': 'logistic', 'aft_loss_distribution_scale': 1.057810592401448, 'max_depth': 8, 'booster': 'dart', 'scale_pos_weight': 1.3490347138372676, 'alpha': 3.788082083631939, 'lambda': 2.8612088094221724, 'eta': 0.3858596309746808, 'sampling_method': 'gradient_based', 'subsample': 0.5831596593810717, 'gamma': 5.980941044645593}. Best is trial 193 with value: 1.923643950131964.
[I 2023-12-21 04:09:44,319] Trial 214 finished with value: 1.9260502156244086 and parameters: {'learning_rate': 0.2453538471411273, 'aft_loss_distribution': 'logistic', 'aft_loss_distribution_scale': 0.9573079601281136, 'max_depth': 8, 'booster': 'dart', 'scale_pos_weight': 1.3167527053310855, 'alpha': 3.809170668745022, 'lambda': 2.920234794245147, 'eta': 0.3910634860596069, 'sampling_method': 'gradient_based', 'subsample': 0.5552868940399103, 'gamma': 5.891275676889364}. Best is trial 193 with value: 1.923643950131964.
[I 2023-12-21 04:09:44,392] Trial 215 pruned. Trial was pruned at iteration 0.
[I 2023-12-21 04:09:44,462] Trial 216 pruned. Trial was pruned at iteration 0.
[I 2023-12-21 04:09:44,533] Trial 217 pruned. Trial was pruned at iteration 0.
[I 2023-12-21 04:09:47,961] Trial 218 finished with value: 1.931557604673453 and parameters: {'learning_rate': 0.2123167637720221, 'aft_loss_distribution': 'logistic', 'aft_loss_distribution_scale': 1.0000556829101188, 'max_depth': 8, 'booster': 'dart', 'scale_pos_weight': 1.2551372911789316, 'alpha': 4.001437788781869, 'lambda': 2.5103209083267344, 'eta': 0.4330393594245005, 'sampling_method': 'gradient_based', 'subsample': 0.5997817110951483, 'gamma': 5.896157307779502}. Best is trial 193 with value: 1.923643950131964.
[I 2023-12-21 04:09:48,035] Trial 219 pruned. Trial was pruned at iteration 0.
[I 2023-12-21 04:09:48,110] Trial 220 pruned. Trial was pruned at iteration 0.
[I 2023-12-21 04:10:12,212] Trial 221 finished with value: 1.9276572142695254 and parameters: {'learning_rate': 0.2136616093882199, 'aft_loss_distribution': 'logistic', 'aft_loss_distribution_scale': 0.979937095342399, 'max_depth': 8, 'booster': 'dart', 'scale_pos_weight': 1.2912511640404065, 'alpha': 3.647656929737491, 'lambda': 2.575576833536982, 'eta': 0.40387157738381413, 'sampling_method': 'gradient_based', 'subsample': 0.5926365384606219, 'gamma': 5.96424220909003}. Best is trial 193 with value: 1.923643950131964.
[I 2023-12-21 04:11:39,238] Trial 222 finished with value: 1.9184134114739202 and parameters: {'learning_rate': 0.17177722319467725, 'aft_loss_distribution': 'logistic', 'aft_loss_distribution_scale': 0.8963742397395733, 'max_depth': 8, 'booster': 'dart', 'scale_pos_weight': 1.2648203949824626, 'alpha': 3.700084241255695, 'lambda': 2.5859068198722137, 'eta': 0.4046474984759978, 'sampling_method': 'gradient_based', 'subsample': 0.5868498408485705, 'gamma': 5.988560795103922}. Best is trial 222 with value: 1.9184134114739202.
[I 2023-12-21 04:11:39,357] Trial 223 pruned. Trial was pruned at iteration 0.
[I 2023-12-21 04:11:42,798] Trial 224 finished with value: 1.9234637244542918 and parameters: {'learning_rate': 0.2128118532469344, 'aft_loss_distribution': 'logistic', 'aft_loss_distribution_scale': 0.9202221550119909, 'max_depth': 8, 'booster': 'dart', 'scale_pos_weight': 1.3537913809995212, 'alpha': 3.4543059366796665, 'lambda': 2.3968602776448344, 'eta': 0.40364569275374707, 'sampling_method': 'gradient_based', 'subsample': 0.5938583535837181, 'gamma': 5.780917259042897}. Best is trial 222 with value: 1.9184134114739202.
[I 2023-12-21 04:11:50,213] Trial 225 finished with value: 1.922060930924388 and parameters: {'learning_rate': 0.18520539604271286, 'aft_loss_distribution': 'logistic', 'aft_loss_distribution_scale': 0.9183144008247051, 'max_depth': 8, 'booster': 'dart', 'scale_pos_weight': 1.3392964404695997, 'alpha': 3.4726574615919845, 'lambda': 2.7049316432561934, 'eta': 0.4317898478135772, 'sampling_method': 'gradient_based', 'subsample': 0.5994073920619107, 'gamma': 5.84158043966138}. Best is trial 222 with value: 1.9184134114739202.
[I 2023-12-21 04:11:50,331] Trial 226 pruned. Trial was pruned at iteration 0.
[I 2023-12-21 04:11:50,450] Trial 227 pruned. Trial was pruned at iteration 0.
[I 2023-12-21 04:11:50,561] Trial 228 pruned. Trial was pruned at iteration 0.
[I 2023-12-21 04:11:50,676] Trial 229 pruned. Trial was pruned at iteration 0.
[I 2023-12-21 04:11:50,776] Trial 230 pruned. Trial was pruned at iteration 0.
[I 2023-12-21 04:11:50,884] Trial 231 pruned. Trial was pruned at iteration 0.
[I 2023-12-21 04:11:50,995] Trial 232 pruned. Trial was pruned at iteration 0.
[I 2023-12-21 04:11:51,099] Trial 233 pruned. Trial was pruned at iteration 0.
[I 2023-12-21 04:11:51,198] Trial 234 pruned. Trial was pruned at iteration 0.
[I 2023-12-21 04:11:51,297] Trial 235 pruned. Trial was pruned at iteration 0.
[I 2023-12-21 04:11:51,410] Trial 236 pruned. Trial was pruned at iteration 0.
[I 2023-12-21 04:11:51,511] Trial 237 pruned. Trial was pruned at iteration 0.
[I 2023-12-21 04:11:51,638] Trial 238 pruned. Trial was pruned at iteration 0.
[I 2023-12-21 04:11:51,753] Trial 239 pruned. Trial was pruned at iteration 0.
[I 2023-12-21 04:11:51,869] Trial 240 pruned. Trial was pruned at iteration 0.
[I 2023-12-21 04:11:59,883] Trial 241 finished with value: 1.930295544276442 and parameters: {'learning_rate': 0.23041595143825508, 'aft_loss_distribution': 'logistic', 'aft_loss_distribution_scale': 0.994166952380863, 'max_depth': 8, 'booster': 'dart', 'scale_pos_weight': 1.2722469235094647, 'alpha': 3.689284358586032, 'lambda': 2.273169186576081, 'eta': 0.38304407135906515, 'sampling_method': 'gradient_based', 'subsample': 0.5735942861319264, 'gamma': 6.842112807188641}. Best is trial 222 with value: 1.9184134114739202.
[I 2023-12-21 04:12:13,518] Trial 242 finished with value: 1.9363764639792744 and parameters: {'learning_rate': 0.23932668157709128, 'aft_loss_distribution': 'logistic', 'aft_loss_distribution_scale': 1.0484176290044271, 'max_depth': 8, 'booster': 'dart', 'scale_pos_weight': 1.28359298541163, 'alpha': 3.7092146715530743, 'lambda': 2.220775717135621, 'eta': 0.385674311711528, 'sampling_method': 'gradient_based', 'subsample': 0.5814974013949252, 'gamma': 6.6644547763823025}. Best is trial 222 with value: 1.9184134114739202.
[I 2023-12-21 04:12:13,596] Trial 243 pruned. Trial was pruned at iteration 0.
[I 2023-12-21 04:12:37,701] Trial 244 finished with value: 1.9303877956511415 and parameters: {'learning_rate': 0.20333605564443036, 'aft_loss_distribution': 'logistic', 'aft_loss_distribution_scale': 0.9514696710949178, 'max_depth': 8, 'booster': 'dart', 'scale_pos_weight': 1.2852244774533383, 'alpha': 9.99369765075755, 'lambda': 2.2373027080877077, 'eta': 0.41071662447160145, 'sampling_method': 'gradient_based', 'subsample': 0.6013910220563106, 'gamma': 7.083729086227842}. Best is trial 222 with value: 1.9184134114739202.
[I 2023-12-21 04:13:02,847] Trial 245 finished with value: 1.9306086252473342 and parameters: {'learning_rate': 0.1967259033017797, 'aft_loss_distribution': 'logistic', 'aft_loss_distribution_scale': 0.9125397646478233, 'max_depth': 8, 'booster': 'dart', 'scale_pos_weight': 1.2727937420301605, 'alpha': 8.637258456370706, 'lambda': 1.9471392467129969, 'eta': 0.4460449485913609, 'sampling_method': 'gradient_based', 'subsample': 0.5987151378563293, 'gamma': 7.073944605079968}. Best is trial 222 with value: 1.9184134114739202.
[I 2023-12-21 04:13:02,996] Trial 246 pruned. Trial was pruned at iteration 0.
[I 2023-12-21 04:13:03,144] Trial 247 pruned. Trial was pruned at iteration 3.
[I 2023-12-21 04:13:03,252] Trial 248 pruned. Trial was pruned at iteration 0.
[I 2023-12-21 04:13:36,646] Trial 249 finished with value: 1.9261830193344618 and parameters: {'learning_rate': 0.21719914544649557, 'aft_loss_distribution': 'logistic', 'aft_loss_distribution_scale': 0.9347690902633352, 'max_depth': 8, 'booster': 'dart', 'scale_pos_weight': 1.1442913502300285, 'alpha': 8.758936706187711, 'lambda': 2.3114333114123498, 'eta': 0.4013862972511165, 'sampling_method': 'gradient_based', 'subsample': 0.5401798113174736, 'gamma': 7.12540443118346}. Best is trial 222 with value: 1.9184134114739202.
Completed hyperparameter tuning with best aft-nloglik = 1.9184134114739202.
Re-running the best trial... params = {'verbosity': 0, 'objective': 'survival:aft', 'eval_metric': 'aft-nloglik', 'tree_method': 'gpu_hist', 'device': 'cuda', 'learning_rate': 0.17177722319467725, 'aft_loss_distribution': 'logistic', 'aft_loss_distribution_scale': 0.8963742397395733, 'max_depth': 8, 'booster': 'dart', 'scale_pos_weight': 1.2648203949824626, 'alpha': 3.700084241255695, 'lambda': 2.5859068198722137, 'eta': 0.4046474984759978, 'sampling_method': 'gradient_based', 'subsample': 0.5868498408485705, 'gamma': 5.988560795103922}
[W 2023-12-21 04:15:04,791] Trial 6 is omitted in visualization because its objective value is inf or nan.
[W 2023-12-21 04:15:04,800] Trial 9 is omitted in visualization because its objective value is inf or nan.
[W 2023-12-21 04:15:04,802] Trial 27 is omitted in visualization because its objective value is inf or nan.
[W 2023-12-21 04:15:04,806] Trial 81 is omitted in visualization because its objective value is inf or nan.
[W 2023-12-21 04:15:04,808] Trial 175 is omitted in visualization because its objective value is inf or nan.
TRN1 | R2:0.368; p:0.0 | C:70.59 |3h:0.954 |6h:0.942 |9h:0.933 |12h:0.726 |15h:0.726 |18h:0.722 |24h:0.565 |48h:0.556 |72h:0.550 |1wk:0.371 |2wks:0.366 |1mon:0.306 |
TRN2 | R2:0.334; p:2.74e-83 | C:68.58 |3h:0.954 |6h:0.942 |9h:0.934 |12h:0.726 |15h:0.726 |18h:0.721 |24h:0.563 |48h:0.554 |72h:0.549 |1wk:0.361 |2wks:0.364 |1mon:0.313 |
VAL | R2:0.283; p:1.975e-59 | C:66.29 |3h:0.953 |6h:0.942 |9h:0.933 |12h:0.726 |15h:0.726 |18h:0.722 |24h:0.565 |48h:0.555 |72h:0.548 |1wk:0.372 |2wks:0.367 |1mon:0.301 |
[I 2023-12-21 04:15:08,841] A new study created in memory with name: no-name-4a5bd371-3834-4a18-9f1d-05f80c6712b4
TST | R2:0.244; p:2.729e-261 | C:63.98 |3h:0.948 |6h:0.933 |9h:0.923 |12h:0.721 |15h:0.721 |18h:0.705 |24h:0.434 |48h:0.431 |72h:0.429 |1wk:0.338 |2wks:0.349 |1mon:0.308 |
/content/drive/MyDrive/intermediates2/res//outcome2_xgb-aft_inp23_k9_emb3_rdims8.json
Dimensionality reduced word embedding 4 with ['location_numeric', 'race_numeric', 'sex_numeric', 'body_part_numeric', 'product_1_numeric', 'product_2_numeric', 'drug_numeric', 'alcohol_numeric', 'month']
Dimensionality reduced word embedding 4 with ['location_numeric', 'race_numeric', 'sex_numeric', 'body_part_numeric', 'product_1_numeric', 'product_2_numeric', 'drug_numeric', 'alcohol_numeric', 'month']
Dimensionality reduced word embedding 4 with ['location_numeric', 'race_numeric', 'sex_numeric', 'body_part_numeric', 'product_1_numeric', 'product_2_numeric', 'drug_numeric', 'alcohol_numeric', 'month']
Dimensionality reduced word embedding 4 with ['location_numeric', 'race_numeric', 'sex_numeric', 'body_part_numeric', 'product_1_numeric', 'product_2_numeric', 'drug_numeric', 'alcohol_numeric', 'month']
trn1
trn2
val
tst
[I 2023-12-21 04:15:43,704] Trial 0 finished with value: 2.1726322711738 and parameters: {'learning_rate': 0.668548804957425, 'aft_loss_distribution': 'extreme', 'aft_loss_distribution_scale': 3.279966507935939, 'max_depth': 3, 'booster': 'dart', 'scale_pos_weight': 2.9446028546597267, 'alpha': 2.248103221065944, 'lambda': 3.6233109184926855, 'eta': 0.31448725616174156, 'sampling_method': 'gradient_based', 'subsample': 0.6098659708721099, 'gamma': 3.321067033306721}. Best is trial 0 with value: 2.1726322711738.
[I 2023-12-21 04:15:46,440] Trial 1 finished with value: inf and parameters: {'learning_rate': 0.3524953525905951, 'aft_loss_distribution': 'normal', 'aft_loss_distribution_scale': 6.170311324358751, 'max_depth': 10, 'booster': 'dart', 'scale_pos_weight': 3.43565484129592, 'alpha': 3.5449223744221467, 'lambda': 5.04219393252828, 'eta': 0.659671387822037, 'sampling_method': 'gradient_based', 'subsample': 0.05485153804269165, 'gamma': 3.9343161180168815}. Best is trial 0 with value: 2.1726322711738.
[I 2023-12-21 04:15:54,626] Trial 2 finished with value: 2.331559272705487 and parameters: {'learning_rate': 0.8726070646964401, 'aft_loss_distribution': 'normal', 'aft_loss_distribution_scale': 7.25979018035812, 'max_depth': 3, 'booster': 'dart', 'scale_pos_weight': 2.9460270157402593, 'alpha': 7.173080375734199, 'lambda': 9.647476736532749, 'eta': 0.04626251615040455, 'sampling_method': 'uniform', 'subsample': 0.9021952543036873, 'gamma': 1.0557418351344565}. Best is trial 0 with value: 2.1726322711738.
[I 2023-12-21 04:15:54,910] Trial 3 finished with value: 2.0908303349440733 and parameters: {'learning_rate': 0.20342574262016377, 'aft_loss_distribution': 'logistic', 'aft_loss_distribution_scale': 2.0248928002991917, 'max_depth': 4, 'booster': 'gbtree', 'scale_pos_weight': 2.9658461233332494, 'alpha': 7.358948852439859, 'lambda': 2.278618937627412, 'eta': 0.9108923764397904, 'sampling_method': 'uniform', 'subsample': 0.3890026841215724, 'gamma': 5.142989131981033}. Best is trial 3 with value: 2.0908303349440733.
[I 2023-12-21 04:15:55,411] Trial 4 finished with value: 2.251522914093865 and parameters: {'learning_rate': 0.42045106431739, 'aft_loss_distribution': 'normal', 'aft_loss_distribution_scale': 5.806256830948038, 'max_depth': 10, 'booster': 'gbtree', 'scale_pos_weight': 2.6450845460884174, 'alpha': 3.742854849967917, 'lambda': 7.037817888693377, 'eta': 0.6617995580697231, 'sampling_method': 'gradient_based', 'subsample': 0.4065964886191187, 'gamma': 5.5702477485169455}. Best is trial 3 with value: 2.0908303349440733.
[I 2023-12-21 04:15:55,440] Trial 5 pruned. Trial was pruned at iteration 3.
[I 2023-12-21 04:15:55,447] Trial 6 pruned. Trial was pruned at iteration 0.
[I 2023-12-21 04:15:55,463] Trial 7 pruned. Trial was pruned at iteration 2.
[I 2023-12-21 04:15:55,472] Trial 8 pruned. Trial was pruned at iteration 0.
[I 2023-12-21 04:15:55,485] Trial 9 pruned. Trial was pruned at iteration 0.
[I 2023-12-21 04:15:55,533] Trial 10 pruned. Trial was pruned at iteration 0.
[I 2023-12-21 04:15:55,834] Trial 11 finished with value: 2.1616968695332823 and parameters: {'learning_rate': 0.6536451789242413, 'aft_loss_distribution': 'logistic', 'aft_loss_distribution_scale': 2.609347667688085, 'max_depth': 3, 'booster': 'gbtree', 'scale_pos_weight': 3.7490694403349645, 'alpha': 1.1746572252630925, 'lambda': 2.559934724703434, 'eta': 0.356644473100004, 'sampling_method': 'gradient_based', 'subsample': 0.6815060582711451, 'gamma': 2.905681200055598}. Best is trial 3 with value: 2.0908303349440733.
[I 2023-12-21 04:15:55,888] Trial 12 pruned. Trial was pruned at iteration 0.
[I 2023-12-21 04:15:56,054] Trial 13 finished with value: inf and parameters: {'learning_rate': 0.5779741018288518, 'aft_loss_distribution': 'logistic', 'aft_loss_distribution_scale': 2.1513822289739384, 'max_depth': 5, 'booster': 'gbtree', 'scale_pos_weight': 1.421210968945041, 'alpha': 0.5976135418719788, 'lambda': 2.3151340705593166, 'eta': 0.5006957141958477, 'sampling_method': 'uniform', 'subsample': 0.6070419993660712, 'gamma': 2.3086158386132007}. Best is trial 3 with value: 2.0908303349440733.
[I 2023-12-21 04:15:56,106] Trial 14 pruned. Trial was pruned at iteration 0.
[I 2023-12-21 04:15:56,927] Trial 15 finished with value: 2.020609424398957 and parameters: {'learning_rate': 0.6491279660350604, 'aft_loss_distribution': 'logistic', 'aft_loss_distribution_scale': 1.54174235890213, 'max_depth': 3, 'booster': 'gbtree', 'scale_pos_weight': 3.006906687595113, 'alpha': 1.9646336857814746, 'lambda': 3.709990216430468, 'eta': 0.7894735281302055, 'sampling_method': 'gradient_based', 'subsample': 0.7957757569798036, 'gamma': 4.183839008017395}. Best is trial 15 with value: 2.020609424398957.
[I 2023-12-21 04:15:57,008] Trial 16 pruned. Trial was pruned at iteration 0.
[I 2023-12-21 04:15:57,081] Trial 17 pruned. Trial was pruned at iteration 0.
[I 2023-12-21 04:15:57,167] Trial 18 pruned. Trial was pruned at iteration 0.
[I 2023-12-21 04:15:57,253] Trial 19 pruned. Trial was pruned at iteration 2.
[I 2023-12-21 04:15:57,325] Trial 20 pruned. Trial was pruned at iteration 0.
[I 2023-12-21 04:15:57,747] Trial 21 finished with value: 2.14589639120237 and parameters: {'learning_rate': 0.6780875972747005, 'aft_loss_distribution': 'logistic', 'aft_loss_distribution_scale': 2.487216961878231, 'max_depth': 3, 'booster': 'gbtree', 'scale_pos_weight': 3.397950031690445, 'alpha': 1.7555546494540462, 'lambda': 3.101632999997742, 'eta': 0.36091922828305933, 'sampling_method': 'gradient_based', 'subsample': 0.7067372880667191, 'gamma': 3.0468586322552778}. Best is trial 15 with value: 2.020609424398957.
[I 2023-12-21 04:15:58,195] Trial 22 finished with value: 2.063970265877767 and parameters: {'learning_rate': 0.6576729172725322, 'aft_loss_distribution': 'logistic', 'aft_loss_distribution_scale': 1.889251406466823, 'max_depth': 3, 'booster': 'gbtree', 'scale_pos_weight': 3.1984091875763294, 'alpha': 2.2293130097289753, 'lambda': 3.369667899872737, 'eta': 0.9333142011971673, 'sampling_method': 'gradient_based', 'subsample': 0.7085221163527211, 'gamma': 2.145453976441516}. Best is trial 15 with value: 2.020609424398957.
[I 2023-12-21 04:15:59,003] Trial 23 finished with value: 2.06345505854877 and parameters: {'learning_rate': 0.40080390108321373, 'aft_loss_distribution': 'logistic', 'aft_loss_distribution_scale': 1.892017677411876, 'max_depth': 3, 'booster': 'gbtree', 'scale_pos_weight': 2.8460656496777115, 'alpha': 3.024358838183865, 'lambda': 1.1697987033628454, 'eta': 0.9376405036740458, 'sampling_method': 'gradient_based', 'subsample': 0.8796720219941466, 'gamma': 1.2058009346168932}. Best is trial 15 with value: 2.020609424398957.
[I 2023-12-21 04:15:59,086] Trial 24 pruned. Trial was pruned at iteration 0.
[I 2023-12-21 04:15:59,159] Trial 25 pruned. Trial was pruned at iteration 0.
[I 2023-12-21 04:15:59,237] Trial 26 pruned. Trial was pruned at iteration 0.
[I 2023-12-21 04:15:59,326] Trial 27 pruned. Trial was pruned at iteration 0.
[I 2023-12-21 04:15:59,401] Trial 28 pruned. Trial was pruned at iteration 0.
[I 2023-12-21 04:15:59,476] Trial 29 pruned. Trial was pruned at iteration 0.
[I 2023-12-21 04:15:59,551] Trial 30 pruned. Trial was pruned at iteration 0.
[I 2023-12-21 04:15:59,631] Trial 31 pruned. Trial was pruned at iteration 0.
[I 2023-12-21 04:15:59,708] Trial 32 pruned. Trial was pruned at iteration 0.
[I 2023-12-21 04:16:00,049] Trial 33 finished with value: inf and parameters: {'learning_rate': 0.35433028008283196, 'aft_loss_distribution': 'logistic', 'aft_loss_distribution_scale': 1.6620186354962685, 'max_depth': 3, 'booster': 'gbtree', 'scale_pos_weight': 2.7806374935451434, 'alpha': 3.500022838336626, 'lambda': 2.8565020144487794, 'eta': 0.9804435554673828, 'sampling_method': 'gradient_based', 'subsample': 0.3189530365402983, 'gamma': 6.134504854307445}. Best is trial 15 with value: 2.020609424398957.
[I 2023-12-21 04:16:00,140] Trial 34 pruned. Trial was pruned at iteration 0.
[I 2023-12-21 04:16:00,226] Trial 35 pruned. Trial was pruned at iteration 0.
[I 2023-12-21 04:16:00,312] Trial 36 pruned. Trial was pruned at iteration 0.
[I 2023-12-21 04:16:00,402] Trial 37 pruned. Trial was pruned at iteration 0.
[I 2023-12-21 04:16:00,485] Trial 38 pruned. Trial was pruned at iteration 0.
[I 2023-12-21 04:16:00,559] Trial 39 pruned. Trial was pruned at iteration 0.
