[I 2023-12-21 03:08:32,029] Trial 0 finished with value: 4.640465925308589 and parameters: {'learning_rate': 0.23257380562537908, 'aft_lo                                                                     ss_distribution': 'normal', 'aft_loss_distribution_scale': 2.325095225858472, 'max_depth': 3, 'booster': 'dart', 'scale_pos_weight': 3.87                                                                     18519813508383, 'alpha': 8.944958833065776, 'lambda': 2.2153963359077085, 'eta': 0.13973001744040292, 'sampling_method': 'uniform', 'subs                                                                     ample': 0.4365091444901226, 'gamma': 3.247026738186555}. Best is trial 0 with value: 4.640465925308589.
[I 2023-12-21 03:08:36,420] Trial 1 finished with value: 6.278360161840759 and parameters: {'learning_rate': 0.6688849710658844, 'aft_los                                                                     s_distribution': 'logistic', 'aft_loss_distribution_scale': 8.977893570227845, 'max_depth': 4, 'booster': 'dart', 'scale_pos_weight': 1.1                                                                     09012916873265, 'alpha': 4.562938690706165, 'lambda': 7.5842842007768025, 'eta': 0.5450150806047637, 'sampling_method': 'gradient_based',                                                                      'subsample': 0.9165861260261967, 'gamma': 4.6868235405379295}. Best is trial 0 with value: 4.640465925308589.
[I 2023-12-21 03:08:53,965] Trial 2 finished with value: 4.6749036407458995 and parameters: {'learning_rate': 0.06793778217244896, 'aft_l                                                                     oss_distribution': 'normal', 'aft_loss_distribution_scale': 2.4379194897926437, 'max_depth': 8, 'booster': 'dart', 'scale_pos_weight': 6.                                                                     432380910386653, 'alpha': 2.634461424575997, 'lambda': 3.256417732175971, 'eta': 0.398746642780225, 'sampling_method': 'uniform', 'subsam                                                                     ple': 0.8418014104439254, 'gamma': 1.5555329457673734}. Best is trial 0 with value: 4.640465925308589.
[I 2023-12-21 03:08:54,046] Trial 3 finished with value: inf and parameters: {'learning_rate': 0.9740704597432224, 'aft_loss_distribution                                                                     ': 'extreme', 'aft_loss_distribution_scale': 5.789747033392505, 'max_depth': 9, 'booster': 'gbtree', 'scale_pos_weight': 4.48061124329181                                                                     4, 'alpha': 7.671282043395037, 'lambda': 6.82353952791778, 'eta': 0.04895615697675382, 'sampling_method': 'gradient_based', 'subsample':                                                                      0.3692616824849604, 'gamma': 0.8138718270818365}. Best is trial 0 with value: 4.640465925308589.
[I 2023-12-21 03:08:54,987] Trial 4 finished with value: inf and parameters: {'learning_rate': 0.9089739627194294, 'aft_loss_distribution                                                                     ': 'extreme', 'aft_loss_distribution_scale': 2.262652974265545, 'max_depth': 10, 'booster': 'dart', 'scale_pos_weight': 2.705648538053200                                                                     7, 'alpha': 2.7424503782755774, 'lambda': 7.66100498812432, 'eta': 0.16907312168808797, 'sampling_method': 'uniform', 'subsample': 0.8551                                                                     867203253056, 'gamma': 4.3145097483359605}. Best is trial 0 with value: 4.640465925308589.
[I 2023-12-21 03:08:54,992] Trial 5 pruned. Trial was pruned at iteration 0.
[I 2023-12-21 03:08:54,997] Trial 6 pruned. Trial was pruned at iteration 0.
[I 2023-12-21 03:08:55,001] Trial 7 pruned. Trial was pruned at iteration 0.
[I 2023-12-21 03:08:55,005] Trial 8 pruned. Trial was pruned at iteration 0.
[I 2023-12-21 03:08:55,010] Trial 9 pruned. Trial was pruned at iteration 0.
[I 2023-12-21 03:08:55,047] Trial 10 pruned. Trial was pruned at iteration 2.
[I 2023-12-21 03:08:55,080] Trial 11 pruned. Trial was pruned at iteration 2.
[I 2023-12-21 03:08:55,108] Trial 12 pruned. Trial was pruned at iteration 0.
[I 2023-12-21 03:08:56,387] Trial 13 finished with value: inf and parameters: {'learning_rate': 0.36370397025052326, 'aft_loss_distributi                                                                     on': 'normal', 'aft_loss_distribution_scale': 2.072748992743745, 'max_depth': 6, 'booster': 'dart', 'scale_pos_weight': 0.504466236830984                                                                     , 'alpha': 2.3992579241928733, 'lambda': 3.8196794617571364, 'eta': 0.01796133346937745, 'sampling_method': 'uniform', 'subsample': 0.281                                                                     9956649391919, 'gamma': 1.81928362155901}. Best is trial 0 with value: 4.640465925308589.
[I 2023-12-21 03:08:56,419] Trial 14 pruned. Trial was pruned at iteration 1.
[I 2023-12-21 03:08:57,528] Trial 15 finished with value: inf and parameters: {'learning_rate': 0.4731029389461714, 'aft_loss_distributio                                                                     n': 'normal', 'aft_loss_distribution_scale': 1.786842488230863, 'max_depth': 8, 'booster': 'dart', 'scale_pos_weight': 2.3003947643371383                                                                     , 'alpha': 2.3027031538506773, 'lambda': 4.113823482451536, 'eta': 0.40803252516414074, 'sampling_method': 'uniform', 'subsample': 0.6239                                                                     68324590674, 'gamma': 3.5024005671945453}. Best is trial 0 with value: 4.640465925308589.
[I 2023-12-21 03:08:57,560] Trial 16 pruned. Trial was pruned at iteration 1.
[I 2023-12-21 03:08:58,765] Trial 17 finished with value: inf and parameters: {'learning_rate': 0.43476608173314446, 'aft_loss_distributi                                                                     on': 'normal', 'aft_loss_distribution_scale': 1.4764636172484287, 'max_depth': 4, 'booster': 'dart', 'scale_pos_weight': 5.09625535058186                                                                     6, 'alpha': 9.64321983218967, 'lambda': 5.012504800376515, 'eta': 0.31436490077280893, 'sampling_method': 'uniform', 'subsample': 0.98677                                                                     38092645408, 'gamma': 3.5045358601291268}. Best is trial 0 with value: 4.640465925308589.
[I 2023-12-21 03:08:58,805] Trial 18 pruned. Trial was pruned at iteration 3.
[I 2023-12-21 03:08:58,834] Trial 19 pruned. Trial was pruned at iteration 0.
[I 2023-12-21 03:08:58,863] Trial 20 pruned. Trial was pruned at iteration 0.
[I 2023-12-21 03:08:58,894] Trial 21 pruned. Trial was pruned at iteration 0.
[I 2023-12-21 03:08:58,927] Trial 22 pruned. Trial was pruned at iteration 1.
[I 2023-12-21 03:08:58,958] Trial 23 pruned. Trial was pruned at iteration 0.
[I 2023-12-21 03:08:58,988] Trial 24 pruned. Trial was pruned at iteration 0.
[I 2023-12-21 03:08:59,023] Trial 25 pruned. Trial was pruned at iteration 1.
[I 2023-12-21 03:08:59,054] Trial 26 pruned. Trial was pruned at iteration 0.
[I 2023-12-21 03:08:59,102] Trial 27 pruned. Trial was pruned at iteration 5.
[I 2023-12-21 03:08:59,135] Trial 28 pruned. Trial was pruned at iteration 0.
[I 2023-12-21 03:08:59,166] Trial 29 pruned. Trial was pruned at iteration 0.
[I 2023-12-21 03:08:59,197] Trial 30 pruned. Trial was pruned at iteration 0.
[I 2023-12-21 03:08:59,231] Trial 31 pruned. Trial was pruned at iteration 0.
[I 2023-12-21 03:08:59,263] Trial 32 pruned. Trial was pruned at iteration 0.
[I 2023-12-21 03:08:59,295] Trial 33 pruned. Trial was pruned at iteration 0.
[I 2023-12-21 03:08:59,326] Trial 34 pruned. Trial was pruned at iteration 0.
[I 2023-12-21 03:08:59,358] Trial 35 pruned. Trial was pruned at iteration 0.
[I 2023-12-21 03:08:59,390] Trial 36 pruned. Trial was pruned at iteration 0.
[I 2023-12-21 03:08:59,422] Trial 37 pruned. Trial was pruned at iteration 0.
[I 2023-12-21 03:08:59,455] Trial 38 pruned. Trial was pruned at iteration 0.
[I 2023-12-21 03:08:59,488] Trial 39 pruned. Trial was pruned at iteration 0.
[I 2023-12-21 03:08:59,522] Trial 40 pruned. Trial was pruned at iteration 0.
[I 2023-12-21 03:08:59,555] Trial 41 pruned. Trial was pruned at iteration 0.
[I 2023-12-21 03:08:59,587] Trial 42 pruned. Trial was pruned at iteration 0.
[I 2023-12-21 03:08:59,620] Trial 43 pruned. Trial was pruned at iteration 0.
[I 2023-12-21 03:08:59,660] Trial 44 pruned. Trial was pruned at iteration 2.
[I 2023-12-21 03:08:59,692] Trial 45 pruned. Trial was pruned at iteration 0.
[I 2023-12-21 03:09:00,744] Trial 46 finished with value: inf and parameters: {'learning_rate': 0.6667419137273154, 'aft_loss_distributio                                                                     n': 'normal', 'aft_loss_distribution_scale': 1.5087011563683856, 'max_depth': 8, 'booster': 'dart', 'scale_pos_weight': 1.769586792707562                                                                     6, 'alpha': 9.540098604319342, 'lambda': 3.2994489308575936, 'eta': 0.37374706759482257, 'sampling_method': 'uniform', 'subsample': 0.273                                                                     4512690574965, 'gamma': 5.451862096298574}. Best is trial 0 with value: 4.640465925308589.
[I 2023-12-21 03:09:00,777] Trial 47 pruned. Trial was pruned at iteration 0.
[I 2023-12-21 03:09:00,810] Trial 48 pruned. Trial was pruned at iteration 0.
[I 2023-12-21 03:09:00,846] Trial 49 pruned. Trial was pruned at iteration 0.
[I 2023-12-21 03:09:00,879] Trial 50 pruned. Trial was pruned at iteration 0.
[I 2023-12-21 03:09:02,219] Trial 51 finished with value: inf and parameters: {'learning_rate': 0.3608167262132638, 'aft_loss_distributio                                                                     n': 'normal', 'aft_loss_distribution_scale': 2.098015138782384, 'max_depth': 6, 'booster': 'dart', 'scale_pos_weight': 0.7929816264956472                                                                     , 'alpha': 1.2942434243702758, 'lambda': 3.9186776205798557, 'eta': 0.007579806649193291, 'sampling_method': 'uniform', 'subsample': 0.27                                                                     86528540777381, 'gamma': 1.9210733567011637}. Best is trial 0 with value: 4.640465925308589.
[I 2023-12-21 03:09:02,256] Trial 52 pruned. Trial was pruned at iteration 1.
[I 2023-12-21 03:09:02,289] Trial 53 pruned. Trial was pruned at iteration 0.
[I 2023-12-21 03:09:02,325] Trial 54 pruned. Trial was pruned at iteration 1.
[I 2023-12-21 03:09:02,358] Trial 55 pruned. Trial was pruned at iteration 0.
[I 2023-12-21 03:09:02,391] Trial 56 pruned. Trial was pruned at iteration 0.
[I 2023-12-21 03:09:02,425] Trial 57 pruned. Trial was pruned at iteration 0.
[I 2023-12-21 03:09:02,461] Trial 58 pruned. Trial was pruned at iteration 0.
[I 2023-12-21 03:09:02,494] Trial 59 pruned. Trial was pruned at iteration 0.
[I 2023-12-21 03:09:02,527] Trial 60 pruned. Trial was pruned at iteration 0.
[I 2023-12-21 03:09:03,723] Trial 61 finished with value: inf and parameters: {'learning_rate': 0.4366224517875922, 'aft_loss_distributio                                                                     n': 'normal', 'aft_loss_distribution_scale': 1.797819377766205, 'max_depth': 8, 'booster': 'dart', 'scale_pos_weight': 2.1472915738984355                                                                     , 'alpha': 2.370169812094266, 'lambda': 4.17225827449309, 'eta': 0.41669751065046745, 'sampling_method': 'uniform', 'subsample': 0.791062                                                                     2445665189, 'gamma': 3.5336360572584975}. Best is trial 0 with value: 4.640465925308589.
[I 2023-12-21 03:09:03,763] Trial 62 pruned. Trial was pruned at iteration 2.
[I 2023-12-21 03:09:04,774] Trial 63 finished with value: inf and parameters: {'learning_rate': 0.639867513994782, 'aft_loss_distribution                                                                     ': 'normal', 'aft_loss_distribution_scale': 1.9171370697111232, 'max_depth': 7, 'booster': 'dart', 'scale_pos_weight': 2.042901694609235,                                                                      'alpha': 3.666158463161601, 'lambda': 1.7374638052546405, 'eta': 0.4736754962428548, 'sampling_method': 'uniform', 'subsample': 0.738989                                                                     9356443664, 'gamma': 3.008902548783171}. Best is trial 0 with value: 4.640465925308589.
[I 2023-12-21 03:09:04,808] Trial 64 pruned. Trial was pruned at iteration 0.
[I 2023-12-21 03:09:04,843] Trial 65 pruned. Trial was pruned at iteration 0.
[I 2023-12-21 03:09:08,746] Trial 66 finished with value: 4.551281591080345 and parameters: {'learning_rate': 0.5515393390930843, 'aft_lo                                                                     ss_distribution': 'logistic', 'aft_loss_distribution_scale': 1.262653386299744, 'max_depth': 4, 'booster': 'dart', 'scale_pos_weight': 4.                                                                     215925232222636, 'alpha': 7.647265073312788, 'lambda': 3.90607012646704, 'eta': 0.3360420542743368, 'sampling_method': 'uniform', 'subsam                                                                     ple': 0.5917538950698215, 'gamma': 3.8295655228888297}. Best is trial 66 with value: 4.551281591080345.
[I 2023-12-21 03:09:08,782] Trial 67 pruned. Trial was pruned at iteration 0.
[I 2023-12-21 03:09:08,817] Trial 68 pruned. Trial was pruned at iteration 0.
[I 2023-12-21 03:09:08,851] Trial 69 pruned. Trial was pruned at iteration 0.
[I 2023-12-21 03:09:08,886] Trial 70 pruned. Trial was pruned at iteration 0.
[I 2023-12-21 03:09:08,923] Trial 71 pruned. Trial was pruned at iteration 1.
[I 2023-12-21 03:09:08,960] Trial 72 pruned. Trial was pruned at iteration 0.
[I 2023-12-21 03:09:08,994] Trial 73 pruned. Trial was pruned at iteration 0.
[I 2023-12-21 03:09:09,029] Trial 74 pruned. Trial was pruned at iteration 0.
[I 2023-12-21 03:09:09,081] Trial 75 pruned. Trial was pruned at iteration 2.
[I 2023-12-21 03:09:09,119] Trial 76 pruned. Trial was pruned at iteration 1.
[I 2023-12-21 03:09:09,153] Trial 77 pruned. Trial was pruned at iteration 0.
[I 2023-12-21 03:09:09,200] Trial 78 pruned. Trial was pruned at iteration 2.
[I 2023-12-21 03:09:09,237] Trial 79 pruned. Trial was pruned at iteration 0.
[I 2023-12-21 03:09:09,272] Trial 80 pruned. Trial was pruned at iteration 0.
[I 2023-12-21 03:09:09,306] Trial 81 pruned. Trial was pruned at iteration 0.
[I 2023-12-21 03:09:09,341] Trial 82 pruned. Trial was pruned at iteration 0.
[I 2023-12-21 03:09:09,376] Trial 83 pruned. Trial was pruned at iteration 0.
[I 2023-12-21 03:09:09,412] Trial 84 pruned. Trial was pruned at iteration 0.
[I 2023-12-21 03:09:09,447] Trial 85 pruned. Trial was pruned at iteration 0.
[I 2023-12-21 03:09:09,484] Trial 86 pruned. Trial was pruned at iteration 0.
[I 2023-12-21 03:09:09,521] Trial 87 pruned. Trial was pruned at iteration 1.
[I 2023-12-21 03:09:09,559] Trial 88 pruned. Trial was pruned at iteration 1.
[I 2023-12-21 03:09:09,593] Trial 89 pruned. Trial was pruned at iteration 0.
[I 2023-12-21 03:09:09,629] Trial 90 pruned. Trial was pruned at iteration 0.
[I 2023-12-21 03:09:10,686] Trial 91 finished with value: inf and parameters: {'learning_rate': 0.6836704395221957, 'aft_loss_distributio                                                                     n': 'normal', 'aft_loss_distribution_scale': 1.695681898550498, 'max_depth': 8, 'booster': 'dart', 'scale_pos_weight': 1.8478737300763952                                                                     , 'alpha': 9.368858307147239, 'lambda': 3.2960766552625698, 'eta': 0.36931500055734706, 'sampling_method': 'uniform', 'subsample': 0.2306                                                                     2379935616523, 'gamma': 4.564895135274673}. Best is trial 66 with value: 4.551281591080345.
[I 2023-12-21 03:09:11,707] Trial 92 finished with value: inf and parameters: {'learning_rate': 0.8004257436187349, 'aft_loss_distributio                                                                     n': 'normal', 'aft_loss_distribution_scale': 1.4268728646727586, 'max_depth': 8, 'booster': 'dart', 'scale_pos_weight': 2.51367819912993,                                                                      'alpha': 8.769119600275717, 'lambda': 3.96359308424462, 'eta': 0.29301685683103423, 'sampling_method': 'uniform', 'subsample': 0.1673045                                                                     9920985324, 'gamma': 5.535870126883128}. Best is trial 66 with value: 4.551281591080345.
[I 2023-12-21 03:09:11,747] Trial 93 pruned. Trial was pruned at iteration 2.
[I 2023-12-21 03:09:11,783] Trial 94 pruned. Trial was pruned at iteration 0.
[I 2023-12-21 03:09:11,818] Trial 95 pruned. Trial was pruned at iteration 0.
[I 2023-12-21 03:09:13,002] Trial 96 finished with value: inf and parameters: {'learning_rate': 0.6489929240679609, 'aft_loss_distributio                                                                     n': 'normal', 'aft_loss_distribution_scale': 1.895764237270815, 'max_depth': 8, 'booster': 'dart', 'scale_pos_weight': 2.1444833434383206                                                                     , 'alpha': 1.8768845538711914, 'lambda': 3.103422009973355, 'eta': 0.42737582550515213, 'sampling_method': 'gradient_based', 'subsample':                                                                      0.253935521149028, 'gamma': 4.047626941760899}. Best is trial 66 with value: 4.551281591080345.
[I 2023-12-21 03:09:13,042] Trial 97 pruned. Trial was pruned at iteration 0.
[I 2023-12-21 03:09:13,078] Trial 98 pruned. Trial was pruned at iteration 1.
[I 2023-12-21 03:09:13,119] Trial 99 pruned. Trial was pruned at iteration 0.
[I 2023-12-21 03:09:13,155] Trial 100 pruned. Trial was pruned at iteration 0.
[I 2023-12-21 03:09:13,191] Trial 101 pruned. Trial was pruned at iteration 0.
[I 2023-12-21 03:09:13,228] Trial 102 pruned. Trial was pruned at iteration 0.
[I 2023-12-21 03:09:13,266] Trial 103 pruned. Trial was pruned at iteration 1.
[I 2023-12-21 03:09:14,345] Trial 104 finished with value: inf and parameters: {'learning_rate': 0.48378807588003275, 'aft_loss_distribut                                                                     ion': 'normal', 'aft_loss_distribution_scale': 1.7938773289512617, 'max_depth': 5, 'booster': 'dart', 'scale_pos_weight': 1.2172451160409                                                                     8, 'alpha': 2.2057047468954765, 'lambda': 1.727798168652964, 'eta': 0.45238373701223455, 'sampling_method': 'uniform', 'subsample': 0.335                                                                     1813028682732, 'gamma': 1.6495469183490024}. Best is trial 66 with value: 4.551281591080345.
[I 2023-12-21 03:09:14,381] Trial 105 pruned. Trial was pruned at iteration 0.
[I 2023-12-21 03:09:14,418] Trial 106 pruned. Trial was pruned at iteration 0.
[I 2023-12-21 03:09:14,458] Trial 107 pruned. Trial was pruned at iteration 1.
[I 2023-12-21 03:09:14,494] Trial 108 pruned. Trial was pruned at iteration 0.
[I 2023-12-21 03:09:14,534] Trial 109 pruned. Trial was pruned at iteration 0.
[I 2023-12-21 03:09:14,570] Trial 110 pruned. Trial was pruned at iteration 0.
[I 2023-12-21 03:09:14,606] Trial 111 pruned. Trial was pruned at iteration 0.
[I 2023-12-21 03:09:14,651] Trial 112 pruned. Trial was pruned at iteration 1.
[I 2023-12-21 03:09:14,687] Trial 113 pruned. Trial was pruned at iteration 0.
[I 2023-12-21 03:09:15,831] Trial 114 finished with value: inf and parameters: {'learning_rate': 0.44785001172957223, 'aft_loss_distribut                                                                     ion': 'normal', 'aft_loss_distribution_scale': 1.8289846184739613, 'max_depth': 7, 'booster': 'dart', 'scale_pos_weight': 4.8230370776402                                                                     43, 'alpha': 3.4329610560768264, 'lambda': 3.713368774742698, 'eta': 0.31820980543371624, 'sampling_method': 'uniform', 'subsample': 0.79                                                                     19282703997317, 'gamma': 3.589401987190587}. Best is trial 66 with value: 4.551281591080345.
[I 2023-12-21 03:09:15,868] Trial 115 pruned. Trial was pruned at iteration 0.
[I 2023-12-21 03:09:15,905] Trial 116 pruned. Trial was pruned at iteration 0.
[I 2023-12-21 03:09:15,942] Trial 117 pruned. Trial was pruned at iteration 0.
[I 2023-12-21 03:09:15,978] Trial 118 pruned. Trial was pruned at iteration 0.
[I 2023-12-21 03:09:16,016] Trial 119 pruned. Trial was pruned at iteration 0.
[I 2023-12-21 03:09:16,053] Trial 120 pruned. Trial was pruned at iteration 0.
[I 2023-12-21 03:09:16,101] Trial 121 pruned. Trial was pruned at iteration 2.
[I 2023-12-21 03:09:16,142] Trial 122 pruned. Trial was pruned at iteration 1.
[I 2023-12-21 03:09:17,198] Trial 123 finished with value: inf and parameters: {'learning_rate': 0.672772988158061, 'aft_loss_distributio                                                                     n': 'normal', 'aft_loss_distribution_scale': 1.3078985804848777, 'max_depth': 9, 'booster': 'dart', 'scale_pos_weight': 1.904174370869457                                                                     4, 'alpha': 4.010061739049023, 'lambda': 1.2524786267225374, 'eta': 0.44245764309391683, 'sampling_method': 'uniform', 'subsample': 0.845                                                                     7418116139473, 'gamma': 3.327021011162317}. Best is trial 66 with value: 4.551281591080345.
