[I 2023-12-21 03:06:04,203] Trial 414 finished with value: 4.318767588540172 and parameters: {'learning_rate': 0.7531347485083743, 'aft_l                                                                     oss_distribution': 'normal', 'aft_loss_distribution_scale': 1.4285053621647823, 'max_depth': 7, 'booster': 'dart', 'scale_pos_weight': 5.                                                                     54344185356279, 'alpha': 7.631001473676583, 'lambda': 8.815015992847972, 'eta': 0.6982685894774789, 'sampling_method': 'uniform', 'subsam                                                                     ple': 0.7918024014857218, 'gamma': 6.623302085783937}. Best is trial 368 with value: 4.273464722532114.
[I 2023-12-21 03:06:04,259] Trial 415 pruned. Trial was pruned at iteration 1.
[I 2023-12-21 03:06:04,308] Trial 416 pruned. Trial was pruned at iteration 1.
[I 2023-12-21 03:06:05,404] Trial 417 finished with value: inf and parameters: {'learning_rate': 0.7391217563705835, 'aft_loss_distributi                                                                     on': 'normal', 'aft_loss_distribution_scale': 1.307757028816277, 'max_depth': 7, 'booster': 'dart', 'scale_pos_weight': 6.036496542646672                                                                     , 'alpha': 8.880830278524696, 'lambda': 7.9695932041521775, 'eta': 0.37866066891844474, 'sampling_method': 'uniform', 'subsample': 0.8096                                                                     060723528072, 'gamma': 0.6720373094141223}. Best is trial 368 with value: 4.273464722532114.
[I 2023-12-21 03:06:06,367] Trial 418 finished with value: inf and parameters: {'learning_rate': 0.7954477645141967, 'aft_loss_distributi                                                                     on': 'normal', 'aft_loss_distribution_scale': 1.0784873148034766, 'max_depth': 7, 'booster': 'dart', 'scale_pos_weight': 6.60671424497241                                                                     7, 'alpha': 8.080335891564047, 'lambda': 2.109593928903911, 'eta': 0.4336922455969229, 'sampling_method': 'uniform', 'subsample': 0.77904                                                                     96999644884, 'gamma': 6.796852138944488}. Best is trial 368 with value: 4.273464722532114.
[I 2023-12-21 03:06:08,296] Trial 419 finished with value: 4.33699389007592 and parameters: {'learning_rate': 0.7599656538780464, 'aft_lo                                                                     ss_distribution': 'normal', 'aft_loss_distribution_scale': 1.4836286657047528, 'max_depth': 6, 'booster': 'dart', 'scale_pos_weight': 6.2                                                                     93000967618738, 'alpha': 6.900458310302576, 'lambda': 8.701713945190727, 'eta': 0.531536423603231, 'sampling_method': 'uniform', 'subsamp                                                                     le': 0.4839774254739521, 'gamma': 7.380150527142982}. Best is trial 368 with value: 4.273464722532114.
[I 2023-12-21 03:06:08,343] Trial 420 pruned. Trial was pruned at iteration 0.
[I 2023-12-21 03:06:08,392] Trial 421 pruned. Trial was pruned at iteration 1.
[I 2023-12-21 03:06:09,493] Trial 422 finished with value: inf and parameters: {'learning_rate': 0.7184917424388428, 'aft_loss_distributi                                                                     on': 'normal', 'aft_loss_distribution_scale': 1.2460092173643313, 'max_depth': 6, 'booster': 'dart', 'scale_pos_weight': 6.15838243914141                                                                     1, 'alpha': 6.507970856928801, 'lambda': 8.232054224035176, 'eta': 0.457542964248122, 'sampling_method': 'uniform', 'subsample': 0.822908                                                                     860359203, 'gamma': 6.14247638847177}. Best is trial 368 with value: 4.273464722532114.
[I 2023-12-21 03:06:09,542] Trial 423 pruned. Trial was pruned at iteration 1.
[I 2023-12-21 03:06:09,589] Trial 424 pruned. Trial was pruned at iteration 0.
[I 2023-12-21 03:06:10,966] Trial 425 finished with value: inf and parameters: {'learning_rate': 0.7667319792690253, 'aft_loss_distributi                                                                     on': 'normal', 'aft_loss_distribution_scale': 1.3260399943891217, 'max_depth': 6, 'booster': 'dart', 'scale_pos_weight': 3.52618999514348                                                                     23, 'alpha': 7.772919413681992, 'lambda': 8.095656774545947, 'eta': 0.48564783441594317, 'sampling_method': 'uniform', 'subsample': 0.795                                                                     2505526494508, 'gamma': 6.799069255157159}. Best is trial 368 with value: 4.273464722532114.
[I 2023-12-21 03:06:11,014] Trial 426 pruned. Trial was pruned at iteration 0.
[I 2023-12-21 03:06:11,061] Trial 427 pruned. Trial was pruned at iteration 0.
[I 2023-12-21 03:06:11,108] Trial 428 pruned. Trial was pruned at iteration 0.
[I 2023-12-21 03:06:11,163] Trial 429 pruned. Trial was pruned at iteration 1.
[I 2023-12-21 03:06:11,209] Trial 430 pruned. Trial was pruned at iteration 0.
[I 2023-12-21 03:06:12,420] Trial 431 finished with value: inf and parameters: {'learning_rate': 0.7336090585730268, 'aft_loss_distributi                                                                     on': 'normal', 'aft_loss_distribution_scale': 1.2070670173145532, 'max_depth': 6, 'booster': 'dart', 'scale_pos_weight': 5.47121662448823                                                                     4, 'alpha': 7.552653227730371, 'lambda': 2.876511112023932, 'eta': 0.6008131241673801, 'sampling_method': 'uniform', 'subsample': 0.78236                                                                     74535114461, 'gamma': 5.895472663803848}. Best is trial 368 with value: 4.273464722532114.
[I 2023-12-21 03:06:13,831] Trial 432 finished with value: inf and parameters: {'learning_rate': 0.7666881091107236, 'aft_loss_distributi                                                                     on': 'normal', 'aft_loss_distribution_scale': 1.396658221959514, 'max_depth': 8, 'booster': 'dart', 'scale_pos_weight': 6.607235984476136                                                                     , 'alpha': 6.256886768720715, 'lambda': 8.677060844027459, 'eta': 0.44694784072354005, 'sampling_method': 'uniform', 'subsample': 0.83608                                                                     6531259221, 'gamma': 6.256893890348708}. Best is trial 368 with value: 4.273464722532114.
[I 2023-12-21 03:06:13,878] Trial 433 pruned. Trial was pruned at iteration 0.
[I 2023-12-21 03:06:13,927] Trial 434 pruned. Trial was pruned at iteration 1.
[I 2023-12-21 03:06:13,983] Trial 435 pruned. Trial was pruned at iteration 2.
[I 2023-12-21 03:06:15,620] Trial 436 finished with value: inf and parameters: {'learning_rate': 0.7341976183292465, 'aft_loss_distributi                                                                     on': 'normal', 'aft_loss_distribution_scale': 1.320038108273932, 'max_depth': 7, 'booster': 'dart', 'scale_pos_weight': 6.463933070611414                                                                     , 'alpha': 8.682628130056894, 'lambda': 2.6833644032210358, 'eta': 0.5569102109768551, 'sampling_method': 'uniform', 'subsample': 0.80022                                                                     06457977716, 'gamma': 7.008559154950925}. Best is trial 368 with value: 4.273464722532114.
[I 2023-12-21 03:06:15,668] Trial 437 pruned. Trial was pruned at iteration 0.
[I 2023-12-21 03:06:19,935] Trial 438 finished with value: 4.332497415712326 and parameters: {'learning_rate': 0.7092757545515949, 'aft_l                                                                     oss_distribution': 'normal', 'aft_loss_distribution_scale': 1.4704298200461567, 'max_depth': 6, 'booster': 'dart', 'scale_pos_weight': 5.                                                                     999301102349699, 'alpha': 6.462596688498704, 'lambda': 8.62707197593648, 'eta': 0.4655831055287304, 'sampling_method': 'uniform', 'subsam                                                                     ple': 0.8328115923209409, 'gamma': 7.634048412596607}. Best is trial 368 with value: 4.273464722532114.
[I 2023-12-21 03:06:19,987] Trial 439 pruned. Trial was pruned at iteration 1.
[I 2023-12-21 03:06:21,080] Trial 440 finished with value: inf and parameters: {'learning_rate': 0.809693584251053, 'aft_loss_distributio                                                                     n': 'normal', 'aft_loss_distribution_scale': 1.1788048209859456, 'max_depth': 7, 'booster': 'dart', 'scale_pos_weight': 0.178945636633783                                                                     6, 'alpha': 6.964237863217642, 'lambda': 8.248892762282495, 'eta': 0.486976391472922, 'sampling_method': 'uniform', 'subsample': 0.815789                                                                     5527864325, 'gamma': 6.84264184330514}. Best is trial 368 with value: 4.273464722532114.
[I 2023-12-21 03:06:22,712] Trial 441 finished with value: inf and parameters: {'learning_rate': 0.7700479432380282, 'aft_loss_distributi                                                                     on': 'normal', 'aft_loss_distribution_scale': 1.3661195795202676, 'max_depth': 6, 'booster': 'dart', 'scale_pos_weight': 4.52605118116286                                                                     2, 'alpha': 8.169676856416112, 'lambda': 8.488665446959745, 'eta': 0.4454320132714619, 'sampling_method': 'uniform', 'subsample': 0.85201                                                                     81300407673, 'gamma': 5.477247466298776}. Best is trial 368 with value: 4.273464722532114.
[I 2023-12-21 03:06:22,760] Trial 442 pruned. Trial was pruned at iteration 0.
[I 2023-12-21 03:06:22,815] Trial 443 pruned. Trial was pruned at iteration 2.
[I 2023-12-21 03:06:24,003] Trial 444 finished with value: inf and parameters: {'learning_rate': 0.7881903340325771, 'aft_loss_distributi                                                                     on': 'normal', 'aft_loss_distribution_scale': 1.1199044870785748, 'max_depth': 5, 'booster': 'dart', 'scale_pos_weight': 5.25674929418107                                                                     2, 'alpha': 6.514411288077349, 'lambda': 8.148154983639007, 'eta': 0.5040430109494661, 'sampling_method': 'uniform', 'subsample': 0.88476                                                                     02836832426, 'gamma': 7.37433189231181}. Best is trial 368 with value: 4.273464722532114.
[I 2023-12-21 03:06:24,051] Trial 445 pruned. Trial was pruned at iteration 0.
[I 2023-12-21 03:06:25,248] Trial 446 finished with value: inf and parameters: {'learning_rate': 0.7054055752628728, 'aft_loss_distributi                                                                     on': 'normal', 'aft_loss_distribution_scale': 1.2864577175051208, 'max_depth': 7, 'booster': 'dart', 'scale_pos_weight': 4.19228029881313                                                                     9, 'alpha': 8.298657404029306, 'lambda': 9.226432742942157, 'eta': 0.3072286785401891, 'sampling_method': 'uniform', 'subsample': 0.85971                                                                     64199855396, 'gamma': 2.2479214896557056}. Best is trial 368 with value: 4.273464722532114.
[I 2023-12-21 03:06:25,300] Trial 447 pruned. Trial was pruned at iteration 1.
[I 2023-12-21 03:06:26,321] Trial 448 finished with value: inf and parameters: {'learning_rate': 0.7600346404647617, 'aft_loss_distributi                                                                     on': 'normal', 'aft_loss_distribution_scale': 1.027438981225047, 'max_depth': 6, 'booster': 'dart', 'scale_pos_weight': 4.899405569398434                                                                     , 'alpha': 6.41358690769277, 'lambda': 8.055555452671664, 'eta': 0.5452494947492259, 'sampling_method': 'uniform', 'subsample': 0.7875834                                                                     906188697, 'gamma': 5.7077385113727095}. Best is trial 368 with value: 4.273464722532114.
[I 2023-12-21 03:06:46,217] Trial 449 finished with value: 4.303142562143678 and parameters: {'learning_rate': 0.7219422258888254, 'aft_l                                                                     oss_distribution': 'normal', 'aft_loss_distribution_scale': 1.3670716177616427, 'max_depth': 7, 'booster': 'dart', 'scale_pos_weight': 6.                                                                     631922312762207, 'alpha': 8.555588359965714, 'lambda': 1.554279795468457, 'eta': 0.3944759829080401, 'sampling_method': 'uniform', 'subsa                                                                     mple': 0.8422690192028917, 'gamma': 6.948743116258175}. Best is trial 368 with value: 4.273464722532114.
[I 2023-12-21 03:06:47,332] Trial 450 finished with value: inf and parameters: {'learning_rate': 0.7769161801625338, 'aft_loss_distributi                                                                     on': 'normal', 'aft_loss_distribution_scale': 1.2209590837627817, 'max_depth': 7, 'booster': 'dart', 'scale_pos_weight': 4.60211630303170                                                                     25, 'alpha': 8.527564393636105, 'lambda': 1.5389383204908076, 'eta': 0.4193417970486664, 'sampling_method': 'uniform', 'subsample': 0.874                                                                     282097130135, 'gamma': 7.098464041128373}. Best is trial 368 with value: 4.273464722532114.
[I 2023-12-21 03:06:47,383] Trial 451 pruned. Trial was pruned at iteration 1.
[I 2023-12-21 03:06:47,433] Trial 452 pruned. Trial was pruned at iteration 0.
[I 2023-12-21 03:06:50,904] Trial 453 finished with value: 4.321243360934358 and parameters: {'learning_rate': 0.7268948265597955, 'aft_l                                                                     oss_distribution': 'normal', 'aft_loss_distribution_scale': 1.4166061192450385, 'max_depth': 7, 'booster': 'dart', 'scale_pos_weight': 6.                                                                     619415567352444, 'alpha': 8.360853957711045, 'lambda': 1.5806150148562008, 'eta': 0.7428083312176201, 'sampling_method': 'uniform', 'subs                                                                     ample': 0.9026735908680885, 'gamma': 6.2909299989564555}. Best is trial 368 with value: 4.273464722532114.
[I 2023-12-21 03:06:50,958] Trial 454 pruned. Trial was pruned at iteration 1.
[I 2023-12-21 03:06:52,048] Trial 455 finished with value: inf and parameters: {'learning_rate': 0.8396655196879155, 'aft_loss_distributi                                                                     on': 'normal', 'aft_loss_distribution_scale': 1.199196417567846, 'max_depth': 6, 'booster': 'dart', 'scale_pos_weight': 6.426031135140462                                                                     , 'alpha': 8.648834287775715, 'lambda': 9.087066548229217, 'eta': 0.38551536968924854, 'sampling_method': 'uniform', 'subsample': 0.84471                                                                     97560190371, 'gamma': 7.556018566199776}. Best is trial 368 with value: 4.273464722532114.
[I 2023-12-21 03:06:52,099] Trial 456 pruned. Trial was pruned at iteration 0.
[I 2023-12-21 03:06:52,149] Trial 457 pruned. Trial was pruned at iteration 1.
[I 2023-12-21 03:06:56,019] Trial 458 finished with value: 4.29206285739042 and parameters: {'learning_rate': 0.7636269069540329, 'aft_lo                                                                     ss_distribution': 'normal', 'aft_loss_distribution_scale': 1.323413359761144, 'max_depth': 6, 'booster': 'dart', 'scale_pos_weight': 6.05                                                                     3682187721842, 'alpha': 7.5207577153825325, 'lambda': 3.167495467204705, 'eta': 0.519890733501886, 'sampling_method': 'uniform', 'subsamp                                                                     le': 0.8830161880118088, 'gamma': 6.914194592787365}. Best is trial 368 with value: 4.273464722532114.
[I 2023-12-21 03:06:56,069] Trial 459 pruned. Trial was pruned at iteration 0.
[I 2023-12-21 03:06:56,118] Trial 460 pruned. Trial was pruned at iteration 0.
[I 2023-12-21 03:06:57,157] Trial 461 finished with value: inf and parameters: {'learning_rate': 0.7201840977438604, 'aft_loss_distributi                                                                     on': 'normal', 'aft_loss_distribution_scale': 1.2494659156004502, 'max_depth': 6, 'booster': 'dart', 'scale_pos_weight': 5.60733310995536                                                                     1, 'alpha': 7.312710951788, 'lambda': 2.706199676990849, 'eta': 0.5438385082837474, 'sampling_method': 'uniform', 'subsample': 0.25681165                                                                     08302492, 'gamma': 6.875547343369898}. Best is trial 368 with value: 4.273464722532114.
[I 2023-12-21 03:06:57,207] Trial 462 pruned. Trial was pruned at iteration 0.
[I 2023-12-21 03:06:57,256] Trial 463 pruned. Trial was pruned at iteration 0.
[I 2023-12-21 03:06:57,305] Trial 464 pruned. Trial was pruned at iteration 0.
[I 2023-12-21 03:06:57,357] Trial 465 pruned. Trial was pruned at iteration 1.
[I 2023-12-21 03:06:58,772] Trial 466 finished with value: inf and parameters: {'learning_rate': 0.8169463011406144, 'aft_loss_distributi                                                                     on': 'normal', 'aft_loss_distribution_scale': 1.3639577286515379, 'max_depth': 6, 'booster': 'dart', 'scale_pos_weight': 5.73300095954606                                                                     5, 'alpha': 8.036181374045446, 'lambda': 3.4134893186857886, 'eta': 0.4032780657727334, 'sampling_method': 'uniform', 'subsample': 0.9162                                                                     916209105963, 'gamma': 6.240041225733519}. Best is trial 368 with value: 4.273464722532114.
[I 2023-12-21 03:06:58,823] Trial 467 pruned. Trial was pruned at iteration 1.
[I 2023-12-21 03:06:58,871] Trial 468 pruned. Trial was pruned at iteration 0.
[I 2023-12-21 03:06:59,938] Trial 469 finished with value: inf and parameters: {'learning_rate': 0.7961445255899094, 'aft_loss_distributi                                                                     on': 'normal', 'aft_loss_distribution_scale': 1.0488914481804803, 'max_depth': 6, 'booster': 'dart', 'scale_pos_weight': 6.17811884813985                                                                     5, 'alpha': 8.282747286266362, 'lambda': 2.8483706973361147, 'eta': 0.4641460910382665, 'sampling_method': 'uniform', 'subsample': 0.8390                                                                     09113520016, 'gamma': 6.754612308650801}. Best is trial 368 with value: 4.273464722532114.
[I 2023-12-21 03:07:00,001] Trial 470 pruned. Trial was pruned at iteration 2.
[I 2023-12-21 03:07:00,052] Trial 471 pruned. Trial was pruned at iteration 1.
[I 2023-12-21 03:07:00,100] Trial 472 pruned. Trial was pruned at iteration 0.
[I 2023-12-21 03:07:00,148] Trial 473 pruned. Trial was pruned at iteration 0.
[I 2023-12-21 03:07:02,504] Trial 474 finished with value: 4.308755734867716 and parameters: {'learning_rate': 0.746723828895831, 'aft_lo                                                                     ss_distribution': 'normal', 'aft_loss_distribution_scale': 1.3883949909882627, 'max_depth': 6, 'booster': 'dart', 'scale_pos_weight': 6.3                                                                     09617607428386, 'alpha': 8.166110364955093, 'lambda': 3.780721246826584, 'eta': 0.37545191875289247, 'sampling_method': 'uniform', 'subsa                                                                     mple': 0.8126919625782573, 'gamma': 6.965263915767163}. Best is trial 368 with value: 4.273464722532114.
[I 2023-12-21 03:07:02,556] Trial 475 pruned. Trial was pruned at iteration 1.
[I 2023-12-21 03:07:03,653] Trial 476 finished with value: inf and parameters: {'learning_rate': 0.7877653519801521, 'aft_loss_distributi                                                                     on': 'normal', 'aft_loss_distribution_scale': 1.0773228239230068, 'max_depth': 6, 'booster': 'dart', 'scale_pos_weight': 6.08012291577085                                                                     6, 'alpha': 8.273902441805859, 'lambda': 3.884603509552301, 'eta': 0.3576613030120065, 'sampling_method': 'uniform', 'subsample': 0.85096                                                                     88128865291, 'gamma': 7.0492015561687165}. Best is trial 368 with value: 4.273464722532114.
[I 2023-12-21 03:07:31,517] Trial 477 finished with value: 4.311745462864668 and parameters: {'learning_rate': 0.7447052144636721, 'aft_l                                                                     oss_distribution': 'normal', 'aft_loss_distribution_scale': 1.398414897864015, 'max_depth': 6, 'booster': 'dart', 'scale_pos_weight': 4.6                                                                     88219269105812, 'alpha': 8.545344754928296, 'lambda': 3.4205137858918935, 'eta': 0.3738228340558399, 'sampling_method': 'uniform', 'subsa                                                                     mple': 0.8297398242898522, 'gamma': 6.954226692243004}. Best is trial 368 with value: 4.273464722532114.
[I 2023-12-21 03:07:31,571] Trial 478 pruned. Trial was pruned at iteration 1.
