[I 2023-12-19 05:15:34,515] Trial 199 pruned. Trial was pruned at iteration 0.
[I 2023-12-19 05:15:34,606] Trial 200 pruned. Trial was pruned at iteration 0.
[I 2023-12-19 05:15:34,701] Trial 201 pruned. Trial was pruned at iteration 0.
[I 2023-12-19 05:15:34,796] Trial 202 pruned. Trial was pruned at iteration 0.
[I 2023-12-19 05:15:34,893] Trial 203 pruned. Trial was pruned at iteration 0.
[I 2023-12-19 05:15:34,998] Trial 204 pruned. Trial was pruned at iteration 0.
[I 2023-12-19 05:15:35,094] Trial 205 pruned. Trial was pruned at iteration 0.
[I 2023-12-19 05:15:35,186] Trial 206 pruned. Trial was pruned at iteration 0.
[I 2023-12-19 05:15:35,294] Trial 207 pruned. Trial was pruned at iteration 0.
[I 2023-12-19 05:15:35,392] Trial 208 pruned. Trial was pruned at iteration 0.
[I 2023-12-19 05:15:35,484] Trial 209 pruned. Trial was pruned at iteration 0.
[I 2023-12-19 05:15:35,577] Trial 210 pruned. Trial was pruned at iteration 0.
[I 2023-12-19 05:15:44,351] Trial 211 finished with value: 4.290195179456272 and parameters: {'learning_rate': 0.17570077696774042, 'aft_loss_distribution': 'logistic', 'aft_loss_distribution_scale': 0.8351321137452153, 'max_depth': 7, 'booster': 'dart', 'scale_pos_weight': 7.099388405050262, 'alpha': 2.0277194329221557, 'lambda': 9.74328598113909, 'eta': 0.4875333281031353, 'sampling_method': 'uniform', 'subsample': 0.44363376718732606, 'gamma': 9.316553690766874}. Best is trial 185 with value: 4.186890107779168.
[I 2023-12-19 05:16:08,715] Trial 212 finished with value: 4.2578878076860365 and parameters: {'learning_rate': 0.17499290240981166, 'aft_loss_distribution': 'logistic', 'aft_loss_distribution_scale': 0.7770168390137995, 'max_depth': 7, 'booster': 'dart', 'scale_pos_weight': 7.032613067871156, 'alpha': 2.076358125054364, 'lambda': 9.792780785149253, 'eta': 0.4956741883115926, 'sampling_method': 'uniform', 'subsample': 0.4255253969938183, 'gamma': 9.384812547084787}. Best is trial 185 with value: 4.186890107779168.
[I 2023-12-19 05:16:08,858] Trial 213 pruned. Trial was pruned at iteration 0.
[I 2023-12-19 05:16:09,014] Trial 214 pruned. Trial was pruned at iteration 0.
[I 2023-12-19 05:16:09,174] Trial 215 pruned. Trial was pruned at iteration 0.
[I 2023-12-19 05:16:09,431] Trial 216 pruned. Trial was pruned at iteration 0.
[I 2023-12-19 05:16:09,764] Trial 217 pruned. Trial was pruned at iteration 0.
[I 2023-12-19 05:16:09,926] Trial 218 pruned. Trial was pruned at iteration 0.
[I 2023-12-19 05:16:10,089] Trial 219 pruned. Trial was pruned at iteration 0.
[I 2023-12-19 05:16:10,232] Trial 220 pruned. Trial was pruned at iteration 0.
[I 2023-12-19 05:16:24,188] Trial 221 pruned. Trial was pruned at iteration 145.
[I 2023-12-19 05:17:00,541] Trial 222 finished with value: 4.211068206246622 and parameters: {'learning_rate': 0.13754384241854015, 'aft_loss_distribution': 'logistic', 'aft_loss_distribution_scale': 0.6836820488382764, 'max_depth': 7, 'booster': 'dart', 'scale_pos_weight': 6.860083316845788, 'alpha': 0.9151328896939823, 'lambda': 9.82692701420196, 'eta': 0.5748565614115039, 'sampling_method': 'uniform', 'subsample': 0.4220088782666205, 'gamma': 8.521700006203247}. Best is trial 185 with value: 4.186890107779168.
[I 2023-12-19 05:17:00,640] Trial 223 pruned. Trial was pruned at iteration 0.
[I 2023-12-19 05:17:00,738] Trial 224 pruned. Trial was pruned at iteration 0.
[I 2023-12-19 05:17:00,831] Trial 225 pruned. Trial was pruned at iteration 0.
[I 2023-12-19 05:17:41,566] Trial 226 finished with value: 4.209494649289613 and parameters: {'learning_rate': 0.1153441930131123, 'aft_loss_distribution': 'logistic', 'aft_loss_distribution_scale': 0.6810226448444733, 'max_depth': 7, 'booster': 'dart', 'scale_pos_weight': 7.299154693847615, 'alpha': 0.5630283328288401, 'lambda': 9.523555685938765, 'eta': 0.5616190965128833, 'sampling_method': 'uniform', 'subsample': 0.4471172745555794, 'gamma': 9.512206200972695}. Best is trial 185 with value: 4.186890107779168.
[I 2023-12-19 05:17:41,684] Trial 227 pruned. Trial was pruned at iteration 0.
[I 2023-12-19 05:18:15,105] Trial 228 finished with value: 4.193407061302963 and parameters: {'learning_rate': 0.08313565385992239, 'aft_loss_distribution': 'logistic', 'aft_loss_distribution_scale': 0.6390157650603929, 'max_depth': 7, 'booster': 'dart', 'scale_pos_weight': 6.582324349909303, 'alpha': 0.6293964945487184, 'lambda': 9.449153790006491, 'eta': 0.552966535655593, 'sampling_method': 'uniform', 'subsample': 0.42277146957532413, 'gamma': 9.506977529796389}. Best is trial 185 with value: 4.186890107779168.
[I 2023-12-19 05:18:15,202] Trial 229 pruned. Trial was pruned at iteration 0.
[I 2023-12-19 05:18:52,210] Trial 230 finished with value: 4.193779710046916 and parameters: {'learning_rate': 0.0901178088143305, 'aft_loss_distribution': 'logistic', 'aft_loss_distribution_scale': 0.6424635875459268, 'max_depth': 7, 'booster': 'dart', 'scale_pos_weight': 6.6556700928493715, 'alpha': 0.42983656137090775, 'lambda': 9.197338906391995, 'eta': 0.5722652731004484, 'sampling_method': 'uniform', 'subsample': 0.40732109685575, 'gamma': 9.475739545675857}. Best is trial 185 with value: 4.186890107779168.
[I 2023-12-19 05:18:52,308] Trial 231 pruned. Trial was pruned at iteration 0.
[I 2023-12-19 05:19:25,294] Trial 232 finished with value: 4.196571581814572 and parameters: {'learning_rate': 0.08666277379943081, 'aft_loss_distribution': 'logistic', 'aft_loss_distribution_scale': 0.6477269222890163, 'max_depth': 7, 'booster': 'dart', 'scale_pos_weight': 6.690763477324172, 'alpha': 0.5172073738914531, 'lambda': 5.464557532893725, 'eta': 0.5861629328470372, 'sampling_method': 'uniform', 'subsample': 0.42621602118167345, 'gamma': 9.738416853717887}. Best is trial 185 with value: 4.186890107779168.
[I 2023-12-19 05:19:25,389] Trial 233 pruned. Trial was pruned at iteration 0.
[I 2023-12-19 05:19:25,483] Trial 234 pruned. Trial was pruned at iteration 0.
[I 2023-12-19 05:19:25,577] Trial 235 pruned. Trial was pruned at iteration 0.
[I 2023-12-19 05:20:02,683] Trial 236 finished with value: 4.199946001172433 and parameters: {'learning_rate': 0.09620700932712256, 'aft_loss_distribution': 'logistic', 'aft_loss_distribution_scale': 0.6588036646818184, 'max_depth': 7, 'booster': 'dart', 'scale_pos_weight': 6.299951599263005, 'alpha': 0.19420414406739117, 'lambda': 5.9333625174634985, 'eta': 0.6048137765163618, 'sampling_method': 'uniform', 'subsample': 0.4127671755615299, 'gamma': 9.511563802595795}. Best is trial 185 with value: 4.186890107779168.
[I 2023-12-19 05:20:02,782] Trial 237 pruned. Trial was pruned at iteration 0.
[I 2023-12-19 05:20:41,580] Trial 238 finished with value: 4.205562583624817 and parameters: {'learning_rate': 0.10437685744210325, 'aft_loss_distribution': 'logistic', 'aft_loss_distribution_scale': 0.672083226247572, 'max_depth': 7, 'booster': 'dart', 'scale_pos_weight': 6.680620635887722, 'alpha': 0.003993950736815438, 'lambda': 6.747586637146112, 'eta': 0.5504483554435172, 'sampling_method': 'uniform', 'subsample': 0.38368483877245085, 'gamma': 9.676393376450989}. Best is trial 185 with value: 4.186890107779168.
[I 2023-12-19 05:20:41,671] Trial 239 pruned. Trial was pruned at iteration 0.
[I 2023-12-19 05:20:41,766] Trial 240 pruned. Trial was pruned at iteration 0.
[I 2023-12-19 05:21:13,819] Trial 241 finished with value: 4.218104311977625 and parameters: {'learning_rate': 0.11730000446236923, 'aft_loss_distribution': 'logistic', 'aft_loss_distribution_scale': 0.6971104396794322, 'max_depth': 7, 'booster': 'dart', 'scale_pos_weight': 6.661553861740865, 'alpha': 0.45148039695813924, 'lambda': 5.440844495875125, 'eta': 0.588313326900488, 'sampling_method': 'uniform', 'subsample': 0.4039379548878601, 'gamma': 9.784063002369564}. Best is trial 185 with value: 4.186890107779168.
[I 2023-12-19 05:21:52,659] Trial 242 finished with value: 4.194597485550916 and parameters: {'learning_rate': 0.11142088667351917, 'aft_loss_distribution': 'logistic', 'aft_loss_distribution_scale': 0.6455030008314657, 'max_depth': 7, 'booster': 'dart', 'scale_pos_weight': 6.581987568509485, 'alpha': 0.34961073994715186, 'lambda': 5.569270404638896, 'eta': 0.6003404638464918, 'sampling_method': 'uniform', 'subsample': 0.4017122233685337, 'gamma': 9.803876960662448}. Best is trial 185 with value: 4.186890107779168.
[I 2023-12-19 05:21:52,757] Trial 243 pruned. Trial was pruned at iteration 0.
[I 2023-12-19 05:21:52,854] Trial 244 pruned. Trial was pruned at iteration 0.
[I 2023-12-19 05:21:52,948] Trial 245 pruned. Trial was pruned at iteration 0.
[I 2023-12-19 05:21:53,040] Trial 246 pruned. Trial was pruned at iteration 0.
[I 2023-12-19 05:21:53,136] Trial 247 pruned. Trial was pruned at iteration 0.
[I 2023-12-19 05:22:25,527] Trial 248 finished with value: 4.211323533390232 and parameters: {'learning_rate': 0.1128810904158999, 'aft_loss_distribution': 'logistic', 'aft_loss_distribution_scale': 0.683613890152658, 'max_depth': 7, 'booster': 'dart', 'scale_pos_weight': 6.2767797032079296, 'alpha': 0.5251295105765981, 'lambda': 4.96492997844447, 'eta': 0.5685027661564003, 'sampling_method': 'uniform', 'subsample': 0.38769458131379786, 'gamma': 9.325336424534484}. Best is trial 185 with value: 4.186890107779168.
[I 2023-12-19 05:22:25,625] Trial 249 pruned. Trial was pruned at iteration 0.
Completed hyperparameter tuning with best aft-nloglik = 4.186890107779168.
Re-running the best trial... params = {'verbosity': 0, 'objective': 'survival:aft', 'eval_metric': 'aft-nloglik', 'tree_method': 'hist', 'learning_rate': 0.09421525704648705, 'aft_loss_distribution': 'logistic', 'aft_loss_distribution_scale': 0.6260516948949496, 'max_depth': 7, 'booster': 'dart', 'scale_pos_weight': 7.016260005308683, 'alpha': 1.5153042771748662, 'lambda': 9.273217098351303, 'eta': 0.4377286396798746, 'sampling_method': 'uniform', 'subsample': 0.41183846401788654, 'gamma': 9.287568315318072}
[W 2023-12-19 05:23:29,495] Trial 2 is omitted in visualization because its objective value is inf or nan.
[W 2023-12-19 05:23:29,499] Trial 6 is omitted in visualization because its objective value is inf or nan.
[W 2023-12-19 05:23:29,506] Trial 12 is omitted in visualization because its objective value is inf or nan.
[W 2023-12-19 05:23:29,509] Trial 28 is omitted in visualization because its objective value is inf or nan.
[W 2023-12-19 05:23:29,513] Trial 43 is omitted in visualization because its objective value is inf or nan.
[W 2023-12-19 05:23:29,514] Trial 46 is omitted in visualization because its objective value is inf or nan.
TRN1 | R2:0.219; p:5.656e-137 | C:60.72 |3h:0.877 |6h:0.858 |9h:0.842 |12h:0.396 |15h:0.396 |18h:0.391 |24h:0.159 |48h:0.151 |72h:0.145 |1wk:0.020 |2wks:0.019 |1mon:0.013 |
TRN2 | R2:0.192; p:1.117e-27 | C:59.31 |3h:0.876 |6h:0.857 |9h:0.841 |12h:0.395 |15h:0.395 |18h:0.390 |24h:0.158 |48h:0.151 |72h:0.145 |1wk:0.020 |2wks:0.019 |1mon:0.013 |
VAL | R2:0.196; p:9.245e-29 | C:59.51 |3h:0.876 |6h:0.857 |9h:0.841 |12h:0.395 |15h:0.395 |18h:0.390 |24h:0.159 |48h:0.151 |72h:0.145 |1wk:0.020 |2wks:0.019 |1mon:0.013 |
[I 2023-12-19 05:23:35,666] A new study created in memory with name: no-name-b4d163dc-c8d5-49ec-b865-17b62e03c454
TST | R2:0.157; p:1.572e-107 | C:57.67 |3h:0.870 |6h:0.848 |9h:0.830 |12h:0.392 |15h:0.392 |18h:0.381 |24h:0.123 |48h:0.118 |72h:0.114 |1wk:0.019 |2wks:0.018 |1mon:0.013 |
/content/drive/MyDrive/intermediates2/res//outcome1_xgb-aft_inp23_k9_emb3_rdims8.json
Dimensionality reduced word embedding 4 with ['location_numeric', 'race_numeric', 'sex_numeric', 'body_part_numeric', 'product_1_numeric', 'product_2_numeric', 'drug_numeric', 'alcohol_numeric', 'month']
Dimensionality reduced word embedding 4 with ['location_numeric', 'race_numeric', 'sex_numeric', 'body_part_numeric', 'product_1_numeric', 'product_2_numeric', 'drug_numeric', 'alcohol_numeric', 'month']
Dimensionality reduced word embedding 4 with ['location_numeric', 'race_numeric', 'sex_numeric', 'body_part_numeric', 'product_1_numeric', 'product_2_numeric', 'drug_numeric', 'alcohol_numeric', 'month']
Dimensionality reduced word embedding 4 with ['location_numeric', 'race_numeric', 'sex_numeric', 'body_part_numeric', 'product_1_numeric', 'product_2_numeric', 'drug_numeric', 'alcohol_numeric', 'month']
trn1
trn2
val
tst
[I 2023-12-19 05:24:01,358] Trial 0 finished with value: 5.796348303480057 and parameters: {'learning_rate': 0.21456044680591826, 'aft_loss_distribution': 'normal', 'aft_loss_distribution_scale': 8.77675106744925, 'max_depth': 7, 'booster': 'dart', 'scale_pos_weight': 0.663281730681667, 'alpha': 4.067910644285615, 'lambda': 5.261738898650263, 'eta': 0.4006780558297848, 'sampling_method': 'uniform', 'subsample': 0.43695553527151415, 'gamma': 2.8927436895637673}. Best is trial 0 with value: 5.796348303480057.
[I 2023-12-19 05:24:02,137] Trial 1 finished with value: 5.648469340636553 and parameters: {'learning_rate': 0.0968965885977955, 'aft_loss_distribution': 'normal', 'aft_loss_distribution_scale': 7.490235300448837, 'max_depth': 7, 'booster': 'gbtree', 'scale_pos_weight': 6.796655145137092, 'alpha': 9.629990436403007, 'lambda': 4.962898371526574, 'eta': 0.14749398493285204, 'sampling_method': 'uniform', 'subsample': 0.8182430745817316, 'gamma': 2.60893374334737}. Best is trial 1 with value: 5.648469340636553.
[I 2023-12-19 05:24:02,461] Trial 2 finished with value: inf and parameters: {'learning_rate': 0.8659024391998602, 'aft_loss_distribution': 'extreme', 'aft_loss_distribution_scale': 1.394614078387404, 'max_depth': 4, 'booster': 'gbtree', 'scale_pos_weight': 6.387737478198685, 'alpha': 6.453703440045308, 'lambda': 6.682632045720455, 'eta': 0.31223788352986104, 'sampling_method': 'uniform', 'subsample': 0.5330923440657068, 'gamma': 3.5826471115724825}. Best is trial 1 with value: 5.648469340636553.
[I 2023-12-19 05:24:03,003] Trial 3 finished with value: 5.830458752451795 and parameters: {'learning_rate': 0.44865596101236016, 'aft_loss_distribution': 'normal', 'aft_loss_distribution_scale': 8.9708520565824, 'max_depth': 3, 'booster': 'gbtree', 'scale_pos_weight': 5.272831210269632, 'alpha': 8.872638670604939, 'lambda': 3.139709454544887, 'eta': 0.03844638827629365, 'sampling_method': 'uniform', 'subsample': 0.03361257802604849, 'gamma': 1.441246689803644}. Best is trial 1 with value: 5.648469340636553.
[I 2023-12-19 05:24:06,537] Trial 4 finished with value: 6.172904579237873 and parameters: {'learning_rate': 0.0485998111656393, 'aft_loss_distribution': 'logistic', 'aft_loss_distribution_scale': 8.201541302379214, 'max_depth': 9, 'booster': 'gbtree', 'scale_pos_weight': 4.408353101164204, 'alpha': 3.47210366538657, 'lambda': 9.652112721543373, 'eta': 0.6587909030997761, 'sampling_method': 'uniform', 'subsample': 0.4726945966873684, 'gamma': 2.7739410623133645}. Best is trial 1 with value: 5.648469340636553.
[I 2023-12-19 05:24:06,565] Trial 5 pruned. Trial was pruned at iteration 0.
[I 2023-12-19 05:24:07,383] Trial 6 finished with value: inf and parameters: {'learning_rate': 0.7135090419942495, 'aft_loss_distribution': 'normal', 'aft_loss_distribution_scale': 4.697390509670353, 'max_depth': 9, 'booster': 'gbtree', 'scale_pos_weight': 7.328391867124567, 'alpha': 2.123369789087562, 'lambda': 3.7255330704909384, 'eta': 0.0849992499346166, 'sampling_method': 'uniform', 'subsample': 0.39594598675458575, 'gamma': 3.2520052841706817}. Best is trial 1 with value: 5.648469340636553.
[I 2023-12-19 05:24:10,054] Trial 7 finished with value: 5.240366691978155 and parameters: {'learning_rate': 0.6226675688125244, 'aft_loss_distribution': 'normal', 'aft_loss_distribution_scale': 4.806451663549131, 'max_depth': 10, 'booster': 'gbtree', 'scale_pos_weight': 2.054684808732108, 'alpha': 8.527687463174459, 'lambda': 8.846125804450754, 'eta': 0.09115518889071406, 'sampling_method': 'uniform', 'subsample': 0.9087320788929506, 'gamma': 2.1227962453017226}. Best is trial 7 with value: 5.240366691978155.
[I 2023-12-19 05:24:10,987] Trial 8 finished with value: 4.668948295175573 and parameters: {'learning_rate': 0.2884464859365253, 'aft_loss_distribution': 'normal', 'aft_loss_distribution_scale': 2.470013098809445, 'max_depth': 6, 'booster': 'gbtree', 'scale_pos_weight': 7.08831810873742, 'alpha': 7.315525645884193, 'lambda': 4.10238224200962, 'eta': 0.709098160479778, 'sampling_method': 'uniform', 'subsample': 0.8714977884994339, 'gamma': 0.2602243507720614}. Best is trial 8 with value: 4.668948295175573.
[I 2023-12-19 05:24:11,029] Trial 9 pruned. Trial was pruned at iteration 2.
[I 2023-12-19 05:24:11,093] Trial 10 pruned. Trial was pruned at iteration 0.
[I 2023-12-19 05:24:11,978] Trial 11 finished with value: 5.017567846134244 and parameters: {'learning_rate': 0.37394034389467684, 'aft_loss_distribution': 'normal', 'aft_loss_distribution_scale': 3.7472344841253475, 'max_depth': 5, 'booster': 'gbtree', 'scale_pos_weight': 2.903389759091195, 'alpha': 6.913067643739921, 'lambda': 8.818879114195024, 'eta': 0.6305650646219133, 'sampling_method': 'uniform', 'subsample': 0.9342222610165574, 'gamma': 0.4512357187727476}. Best is trial 8 with value: 4.668948295175573.
[I 2023-12-19 05:24:12,492] Trial 12 finished with value: 4.83476664531466 and parameters: {'learning_rate': 0.3697532815492988, 'aft_loss_distribution': 'normal', 'aft_loss_distribution_scale': 3.0291650111360906, 'max_depth': 5, 'booster': 'gbtree', 'scale_pos_weight': 3.369042356171517, 'alpha': 6.899853901895853, 'lambda': 7.434538275411458, 'eta': 0.6503055578136515, 'sampling_method': 'uniform', 'subsample': 0.9796792062127754, 'gamma': 0.053859977489586375}. Best is trial 8 with value: 4.668948295175573.
[I 2023-12-19 05:24:13,286] Trial 13 finished with value: 4.755435197944272 and parameters: {'learning_rate': 0.23659633938964314, 'aft_loss_distribution': 'normal', 'aft_loss_distribution_scale': 2.7458828464896925, 'max_depth': 5, 'booster': 'gbtree', 'scale_pos_weight': 3.7807351180108135, 'alpha': 6.6428428569096365, 'lambda': 7.047540067132299, 'eta': 0.661074687296928, 'sampling_method': 'uniform', 'subsample': 0.681005798544895, 'gamma': 5.643294718046402}. Best is trial 8 with value: 4.668948295175573.
[I 2023-12-19 05:24:13,351] Trial 14 pruned. Trial was pruned at iteration 0.
[I 2023-12-19 05:24:13,763] Trial 15 finished with value: 4.495316343011394 and parameters: {'learning_rate': 0.2135890321040757, 'aft_loss_distribution': 'logistic', 'aft_loss_distribution_scale': 1.1936261489854567, 'max_depth': 3, 'booster': 'gbtree', 'scale_pos_weight': 4.647245109827103, 'alpha': 7.715209431708608, 'lambda': 5.200897642760502, 'eta': 0.5267878813619282, 'sampling_method': 'uniform', 'subsample': 0.6652176433999601, 'gamma': 8.030495726897568}. Best is trial 15 with value: 4.495316343011394.
[I 2023-12-19 05:24:13,831] Trial 16 pruned. Trial was pruned at iteration 0.
[I 2023-12-19 05:24:13,894] Trial 17 pruned. Trial was pruned at iteration 0.
[I 2023-12-19 05:24:13,963] Trial 18 pruned. Trial was pruned at iteration 0.
[I 2023-12-19 05:24:14,033] Trial 19 pruned. Trial was pruned at iteration 0.
[I 2023-12-19 05:24:14,764] Trial 20 finished with value: 4.762460499084307 and parameters: {'learning_rate': 0.48243239796292287, 'aft_loss_distribution': 'logistic', 'aft_loss_distribution_scale': 1.7128739439045475, 'max_depth': 8, 'booster': 'gbtree', 'scale_pos_weight': 1.9642241642546523, 'alpha': 5.871330111757488, 'lambda': 6.324222965465314, 'eta': 0.886792386255175, 'sampling_method': 'uniform', 'subsample': 0.8720495067125849, 'gamma': 4.390403831769238}. Best is trial 15 with value: 4.495316343011394.
[I 2023-12-19 05:24:14,829] Trial 21 pruned. Trial was pruned at iteration 0.
[I 2023-12-19 05:24:15,258] Trial 22 finished with value: 4.699912453878806 and parameters: {'learning_rate': 0.2753812760098418, 'aft_loss_distribution': 'normal', 'aft_loss_distribution_scale': 2.5611909282518024, 'max_depth': 6, 'booster': 'gbtree', 'scale_pos_weight': 3.473433955224843, 'alpha': 6.242630401372518, 'lambda': 5.79610865986182, 'eta': 0.5740314293384123, 'sampling_method': 'uniform', 'subsample': 0.6224077070280627, 'gamma': 6.906216017491422}. Best is trial 15 with value: 4.495316343011394.
[I 2023-12-19 05:24:15,326] Trial 23 pruned. Trial was pruned at iteration 0.
[I 2023-12-19 05:24:16,393] Trial 24 finished with value: 4.591076808917612 and parameters: {'learning_rate': 0.42771596411008206, 'aft_loss_distribution': 'normal', 'aft_loss_distribution_scale': 2.220589849752503, 'max_depth': 8, 'booster': 'gbtree', 'scale_pos_weight': 4.941458934699315, 'alpha': 6.057723265458688, 'lambda': 4.138040908606752, 'eta': 0.44250697618547064, 'sampling_method': 'uniform', 'subsample': 0.31834102788593654, 'gamma': 8.529540596245408}. Best is trial 15 with value: 4.495316343011394.
[I 2023-12-19 05:24:16,468] Trial 25 pruned. Trial was pruned at iteration 0.
[I 2023-12-19 05:24:26,901] Trial 26 finished with value: 4.514168337550099 and parameters: {'learning_rate': 0.7204980156591416, 'aft_loss_distribution': 'normal', 'aft_loss_distribution_scale': 1.9922005603096071, 'max_depth': 9, 'booster': 'dart', 'scale_pos_weight': 7.075293759542943, 'alpha': 5.13961642511058, 'lambda': 4.273694240221917, 'eta': 0.2550729807195261, 'sampling_method': 'uniform', 'subsample': 0.2280318505516707, 'gamma': 8.498986408967541}. Best is trial 15 with value: 4.495316343011394.
[I 2023-12-19 05:24:28,931] Trial 27 finished with value: inf and parameters: {'learning_rate': 0.736678063529606, 'aft_loss_distribution': 'normal', 'aft_loss_distribution_scale': 0.9916147029685405, 'max_depth': 10, 'booster': 'dart', 'scale_pos_weight': 5.326750574321389, 'alpha': 2.390097433578804, 'lambda': 2.9166935591196137, 'eta': 0.2429832551115575, 'sampling_method': 'uniform', 'subsample': 0.2854232910865697, 'gamma': 8.366032109925614}. Best is trial 15 with value: 4.495316343011394.
[I 2023-12-19 05:24:29,049] Trial 28 pruned. Trial was pruned at iteration 6.
