[I 2023-12-19 05:27:48,530] Trial 238 finished with value: inf and parameters: {'learning_rate': 0.8899390221067898, 'aft_loss_distribution': 'normal', 'aft_loss_distribution_scale': 1.1288110721217595, 'max_depth': 5, 'booster': 'gbtree', 'scale_pos_weight': 0.6557039782046089, 'alpha': 7.092774263603699, 'lambda': 9.458018700193467, 'eta': 0.10303362904201359, 'sampling_method': 'uniform', 'subsample': 0.8912152928942222, 'gamma': 9.72547573127754}. Best is trial 203 with value: 4.239418470092741.
[I 2023-12-19 05:27:48,624] Trial 239 pruned. Trial was pruned at iteration 1.
[I 2023-12-19 05:27:48,727] Trial 240 pruned. Trial was pruned at iteration 0.
[I 2023-12-19 05:27:49,311] Trial 241 finished with value: 4.255052282955713 and parameters: {'learning_rate': 0.937900556151112, 'aft_loss_distribution': 'normal', 'aft_loss_distribution_scale': 1.1450866004201394, 'max_depth': 9, 'booster': 'gbtree', 'scale_pos_weight': 0.4647825343526186, 'alpha': 7.4496812581040475, 'lambda': 0.7433274865386194, 'eta': 0.026541579319557862, 'sampling_method': 'uniform', 'subsample': 0.7638998809771833, 'gamma': 9.391982439472546}. Best is trial 203 with value: 4.239418470092741.
[I 2023-12-19 05:27:49,864] Trial 242 finished with value: 4.265067382355459 and parameters: {'learning_rate': 0.9201289364672725, 'aft_loss_distribution': 'normal', 'aft_loss_distribution_scale': 1.2311147019597595, 'max_depth': 9, 'booster': 'gbtree', 'scale_pos_weight': 0.7305768321421802, 'alpha': 7.230932359836405, 'lambda': 6.588584922387218, 'eta': 0.02397712120405643, 'sampling_method': 'uniform', 'subsample': 0.8455138134821022, 'gamma': 9.568865078853017}. Best is trial 203 with value: 4.239418470092741.
[I 2023-12-19 05:27:50,472] Trial 243 finished with value: 4.2431740777999565 and parameters: {'learning_rate': 0.9472167399990217, 'aft_loss_distribution': 'normal', 'aft_loss_distribution_scale': 1.0517973525508242, 'max_depth': 9, 'booster': 'gbtree', 'scale_pos_weight': 1.2163514352098646, 'alpha': 7.647780610146305, 'lambda': 0.8511506923868924, 'eta': 0.061008414411226, 'sampling_method': 'uniform', 'subsample': 0.7829767798117755, 'gamma': 9.302914100871341}. Best is trial 203 with value: 4.239418470092741.
[I 2023-12-19 05:27:50,559] Trial 244 pruned. Trial was pruned at iteration 0.
[I 2023-12-19 05:27:51,932] Trial 245 finished with value: 4.241846282004982 and parameters: {'learning_rate': 0.9117575575021012, 'aft_loss_distribution': 'normal', 'aft_loss_distribution_scale': 1.069092657426438, 'max_depth': 9, 'booster': 'gbtree', 'scale_pos_weight': 0.26088773634495893, 'alpha': 7.6717477473604365, 'lambda': 1.2449059988155966, 'eta': 0.051607674679385734, 'sampling_method': 'uniform', 'subsample': 0.8220570070981404, 'gamma': 9.836708603339535}. Best is trial 203 with value: 4.239418470092741.
[I 2023-12-19 05:27:53,330] Trial 246 finished with value: inf and parameters: {'learning_rate': 0.9008384808299061, 'aft_loss_distribution': 'normal', 'aft_loss_distribution_scale': 0.9948349718337963, 'max_depth': 6, 'booster': 'gbtree', 'scale_pos_weight': 0.12633086574841518, 'alpha': 7.6621208133624, 'lambda': 1.2688236388916632, 'eta': 0.08644578483308213, 'sampling_method': 'uniform', 'subsample': 0.8255779465056783, 'gamma': 9.876525430508522}. Best is trial 203 with value: 4.239418470092741.
[I 2023-12-19 05:27:53,691] Trial 247 pruned. Trial was pruned at iteration 0.
[I 2023-12-19 05:27:53,852] Trial 248 pruned. Trial was pruned at iteration 1.
[I 2023-12-19 05:27:54,011] Trial 249 pruned. Trial was pruned at iteration 0.
Completed hyperparameter tuning with best aft-nloglik = 4.239418470092741.
Re-running the best trial... params = {'verbosity': 0, 'objective': 'survival:aft', 'eval_metric': 'aft-nloglik', 'tree_method': 'hist', 'learning_rate': 0.879022889244938, 'aft_loss_distribution': 'normal', 'aft_loss_distribution_scale': 1.0424440141914113, 'max_depth': 9, 'booster': 'gbtree', 'scale_pos_weight': 0.3887150868236408, 'alpha': 7.400317471232932, 'lambda': 9.405307351386998, 'eta': 0.0335123707982024, 'sampling_method': 'uniform', 'subsample': 0.8606540402214417, 'gamma': 9.391500340471996}
[W 2023-12-19 05:27:54,883] Trial 2 is omitted in visualization because its objective value is inf or nan.
[W 2023-12-19 05:27:54,893] Trial 6 is omitted in visualization because its objective value is inf or nan.
[W 2023-12-19 05:27:54,895] Trial 27 is omitted in visualization because its objective value is inf or nan.
[W 2023-12-19 05:27:54,900] Trial 33 is omitted in visualization because its objective value is inf or nan.
[W 2023-12-19 05:27:54,904] Trial 35 is omitted in visualization because its objective value is inf or nan.
[W 2023-12-19 05:27:54,908] Trial 52 is omitted in visualization because its objective value is inf or nan.
[W 2023-12-19 05:27:54,909] Trial 54 is omitted in visualization because its objective value is inf or nan.
[W 2023-12-19 05:27:54,912] Trial 64 is omitted in visualization because its objective value is inf or nan.
[W 2023-12-19 05:27:54,915] Trial 68 is omitted in visualization because its objective value is inf or nan.
[W 2023-12-19 05:27:54,916] Trial 73 is omitted in visualization because its objective value is inf or nan.
[W 2023-12-19 05:27:54,921] Trial 76 is omitted in visualization because its objective value is inf or nan.
[W 2023-12-19 05:27:54,922] Trial 79 is omitted in visualization because its objective value is inf or nan.
[W 2023-12-19 05:27:54,923] Trial 80 is omitted in visualization because its objective value is inf or nan.
[W 2023-12-19 05:27:54,924] Trial 82 is omitted in visualization because its objective value is inf or nan.
[W 2023-12-19 05:27:54,930] Trial 96 is omitted in visualization because its objective value is inf or nan.
[W 2023-12-19 05:27:54,931] Trial 99 is omitted in visualization because its objective value is inf or nan.
[W 2023-12-19 05:27:54,932] Trial 107 is omitted in visualization because its objective value is inf or nan.
[W 2023-12-19 05:27:54,933] Trial 111 is omitted in visualization because its objective value is inf or nan.
[W 2023-12-19 05:27:54,934] Trial 112 is omitted in visualization because its objective value is inf or nan.
[W 2023-12-19 05:27:54,938] Trial 113 is omitted in visualization because its objective value is inf or nan.
[W 2023-12-19 05:27:54,939] Trial 116 is omitted in visualization because its objective value is inf or nan.
[W 2023-12-19 05:27:54,940] Trial 121 is omitted in visualization because its objective value is inf or nan.
[W 2023-12-19 05:27:54,941] Trial 133 is omitted in visualization because its objective value is inf or nan.
[W 2023-12-19 05:27:54,944] Trial 135 is omitted in visualization because its objective value is inf or nan.
[W 2023-12-19 05:27:54,945] Trial 140 is omitted in visualization because its objective value is inf or nan.
[W 2023-12-19 05:27:54,946] Trial 142 is omitted in visualization because its objective value is inf or nan.
[W 2023-12-19 05:27:54,947] Trial 147 is omitted in visualization because its objective value is inf or nan.
[W 2023-12-19 05:27:54,948] Trial 149 is omitted in visualization because its objective value is inf or nan.
[W 2023-12-19 05:27:54,950] Trial 151 is omitted in visualization because its objective value is inf or nan.
[W 2023-12-19 05:27:54,951] Trial 153 is omitted in visualization because its objective value is inf or nan.
[W 2023-12-19 05:27:54,952] Trial 155 is omitted in visualization because its objective value is inf or nan.
[W 2023-12-19 05:27:54,956] Trial 158 is omitted in visualization because its objective value is inf or nan.
[W 2023-12-19 05:27:54,957] Trial 160 is omitted in visualization because its objective value is inf or nan.
[W 2023-12-19 05:27:54,958] Trial 163 is omitted in visualization because its objective value is inf or nan.
[W 2023-12-19 05:27:54,959] Trial 164 is omitted in visualization because its objective value is inf or nan.
[W 2023-12-19 05:27:54,960] Trial 166 is omitted in visualization because its objective value is inf or nan.
[W 2023-12-19 05:27:54,961] Trial 168 is omitted in visualization because its objective value is inf or nan.
[W 2023-12-19 05:27:54,963] Trial 170 is omitted in visualization because its objective value is inf or nan.
[W 2023-12-19 05:27:54,965] Trial 173 is omitted in visualization because its objective value is inf or nan.
[W 2023-12-19 05:27:54,966] Trial 176 is omitted in visualization because its objective value is inf or nan.
[W 2023-12-19 05:27:54,967] Trial 183 is omitted in visualization because its objective value is inf or nan.
[W 2023-12-19 05:27:54,968] Trial 189 is omitted in visualization because its objective value is inf or nan.
[W 2023-12-19 05:27:54,969] Trial 194 is omitted in visualization because its objective value is inf or nan.
[W 2023-12-19 05:27:54,970] Trial 206 is omitted in visualization because its objective value is inf or nan.
[W 2023-12-19 05:27:54,976] Trial 211 is omitted in visualization because its objective value is inf or nan.
[W 2023-12-19 05:27:54,978] Trial 212 is omitted in visualization because its objective value is inf or nan.
[W 2023-12-19 05:27:54,979] Trial 224 is omitted in visualization because its objective value is inf or nan.
[W 2023-12-19 05:27:54,980] Trial 232 is omitted in visualization because its objective value is inf or nan.
[W 2023-12-19 05:27:54,981] Trial 234 is omitted in visualization because its objective value is inf or nan.
[W 2023-12-19 05:27:54,983] Trial 238 is omitted in visualization because its objective value is inf or nan.
[W 2023-12-19 05:27:54,984] Trial 246 is omitted in visualization because its objective value is inf or nan.
TRN1 | R2:0.267; p:1.705e-205 | C:63.12 |3h:0.885 |6h:0.865 |9h:0.849 |12h:0.401 |15h:0.401 |18h:0.396 |24h:0.161 |48h:0.154 |72h:0.148 |1wk:0.020 |2wks:0.018 |1mon:0.013 |
TRN2 | R2:0.226; p:5.145e-38 | C:60.96 |3h:0.884 |6h:0.865 |9h:0.849 |12h:0.400 |15h:0.400 |18h:0.395 |24h:0.161 |48h:0.153 |72h:0.147 |1wk:0.020 |2wks:0.018 |1mon:0.013 |
VAL | R2:0.216; p:9.152e-35 | C:60.58 |3h:0.884 |6h:0.865 |9h:0.849 |12h:0.400 |15h:0.400 |18h:0.395 |24h:0.161 |48h:0.153 |72h:0.147 |1wk:0.020 |2wks:0.019 |1mon:0.013 |
TST | R2:0.166; p:8.269e-121 | C:58.16 |3h:0.877 |6h:0.855 |9h:0.837 |12h:0.396 |15h:0.396 |18h:0.386 |24h:0.124 |48h:0.120 |72h:0.116 |1wk:0.019 |2wks:0.018 |1mon:0.013 |
/content/drive/MyDrive/intermediates2/res//outcome1_xgb-aft_inp24_k9_emb4_rdims8.json
trn1
trn2
val
[I 2023-12-19 05:28:03,694] A new study created in memory with name: no-name-0c7a105a-5d3b-4eac-9edd-008e91cfe8e7
tst
