[I 2023-12-21 03:59:05,947] Trial 461 pruned. Trial was pruned at iteration 0.
[I 2023-12-21 03:59:06,001] Trial 462 pruned. Trial was pruned at iteration 0.
[I 2023-12-21 03:59:06,053] Trial 463 pruned. Trial was pruned at iteration 0.
[I 2023-12-21 03:59:06,234] Trial 464 pruned. Trial was pruned at iteration 100.
[I 2023-12-21 03:59:06,287] Trial 465 pruned. Trial was pruned at iteration 0.
[I 2023-12-21 03:59:06,340] Trial 466 pruned. Trial was pruned at iteration 0.
[I 2023-12-21 03:59:06,416] Trial 467 pruned. Trial was pruned at iteration 6.
[I 2023-12-21 03:59:06,470] Trial 468 pruned. Trial was pruned at iteration 0.
[I 2023-12-21 03:59:06,522] Trial 469 pruned. Trial was pruned at iteration 0.
[I 2023-12-21 03:59:06,574] Trial 470 pruned. Trial was pruned at iteration 0.
[I 2023-12-21 03:59:06,627] Trial 471 pruned. Trial was pruned at iteration 0.
[I 2023-12-21 03:59:06,679] Trial 472 pruned. Trial was pruned at iteration 0.
[I 2023-12-21 03:59:06,731] Trial 473 pruned. Trial was pruned at iteration 0.
[I 2023-12-21 03:59:06,785] Trial 474 pruned. Trial was pruned at iteration 0.
[I 2023-12-21 03:59:06,837] Trial 475 pruned. Trial was pruned at iteration 0.
[I 2023-12-21 03:59:06,890] Trial 476 pruned. Trial was pruned at iteration 0.
[I 2023-12-21 03:59:06,943] Trial 477 pruned. Trial was pruned at iteration 0.
[I 2023-12-21 03:59:06,998] Trial 478 pruned. Trial was pruned at iteration 0.
[I 2023-12-21 03:59:07,051] Trial 479 pruned. Trial was pruned at iteration 0.
[I 2023-12-21 03:59:07,102] Trial 480 pruned. Trial was pruned at iteration 0.
[I 2023-12-21 03:59:17,747] Trial 481 finished with value: 4.24600874270512 and parameters: {'learning_rate': 0.09688417430526072, 'aft_l                                                                     oss_distribution': 'logistic', 'aft_loss_distribution_scale': 0.7231204091243075, 'max_depth': 3, 'booster': 'dart', 'scale_pos_weight':                                                                      0.7475340613778747, 'alpha': 2.6067461268255863, 'lambda': 7.296909742439581, 'eta': 0.12174344179664842, 'sampling_method': 'gradient_ba                                                                     sed', 'subsample': 0.30810107711275325, 'gamma': 0.5309736358427459}. Best is trial 346 with value: 4.203471615289493.
[I 2023-12-21 03:59:17,802] Trial 482 pruned. Trial was pruned at iteration 0.
[I 2023-12-21 03:59:17,856] Trial 483 pruned. Trial was pruned at iteration 0.
[I 2023-12-21 03:59:17,909] Trial 484 pruned. Trial was pruned at iteration 0.
[I 2023-12-21 03:59:17,962] Trial 485 pruned. Trial was pruned at iteration 0.
[I 2023-12-21 03:59:18,015] Trial 486 pruned. Trial was pruned at iteration 0.
[I 2023-12-21 03:59:18,070] Trial 487 pruned. Trial was pruned at iteration 0.
[I 2023-12-21 03:59:18,126] Trial 488 pruned. Trial was pruned at iteration 0.
[I 2023-12-21 03:59:18,179] Trial 489 pruned. Trial was pruned at iteration 0.
[I 2023-12-21 03:59:18,233] Trial 490 pruned. Trial was pruned at iteration 0.
[I 2023-12-21 03:59:18,287] Trial 491 pruned. Trial was pruned at iteration 0.
[I 2023-12-21 03:59:18,343] Trial 492 pruned. Trial was pruned at iteration 0.
[I 2023-12-21 03:59:18,397] Trial 493 pruned. Trial was pruned at iteration 0.
[I 2023-12-21 03:59:18,456] Trial 494 pruned. Trial was pruned at iteration 0.
[I 2023-12-21 03:59:18,510] Trial 495 pruned. Trial was pruned at iteration 0.
[I 2023-12-21 03:59:18,563] Trial 496 pruned. Trial was pruned at iteration 0.
[I 2023-12-21 03:59:18,619] Trial 497 pruned. Trial was pruned at iteration 0.
[I 2023-12-21 03:59:18,684] Trial 498 pruned. Trial was pruned at iteration 0.
[I 2023-12-21 03:59:18,739] Trial 499 pruned. Trial was pruned at iteration 0.
[W 2023-12-21 03:59:19,031] Trial 5 is omitted in visualization because its objective value is inf or nan.
[W 2023-12-21 03:59:19,031] Trial 37 is omitted in visualization because its objective value is inf or nan.
[W 2023-12-21 03:59:19,031] Trial 44 is omitted in visualization because its objective value is inf or nan.
[W 2023-12-21 03:59:19,031] Trial 100 is omitted in visualization because its objective value is inf or nan.
[W 2023-12-21 03:59:19,031] Trial 158 is omitted in visualization because its objective value is inf or nan.
exo-open: Cannot open display: .
/cvmfs/soft.computecanada.ca/gentoo/2020/usr/bin/xdg-open: line 871: x-www-browser: command not found
/cvmfs/soft.computecanada.ca/gentoo/2020/usr/bin/xdg-open: line 871: firefox: command not found
/cvmfs/soft.computecanada.ca/gentoo/2020/usr/bin/xdg-open: line 871: iceweasel: command not found
/cvmfs/soft.computecanada.ca/gentoo/2020/usr/bin/xdg-open: line 871: seamonkey: command not found
/cvmfs/soft.computecanada.ca/gentoo/2020/usr/bin/xdg-open: line 871: mozilla: command not found
/cvmfs/soft.computecanada.ca/gentoo/2020/usr/bin/xdg-open: line 871: epiphany: command not found
/cvmfs/soft.computecanada.ca/gentoo/2020/usr/bin/xdg-open: line 871: konqueror: command not found
/cvmfs/soft.computecanada.ca/gentoo/2020/usr/bin/xdg-open: line 871: chromium: command not found
/cvmfs/soft.computecanada.ca/gentoo/2020/usr/bin/xdg-open: line 871: chromium-browser: command not found
/cvmfs/soft.computecanada.ca/gentoo/2020/usr/bin/xdg-open: line 871: google-chrome: command not found
/cvmfs/soft.computecanada.ca/gentoo/2020/usr/bin/xdg-open: line 871: www-browser: command not found
/cvmfs/soft.computecanada.ca/gentoo/2020/usr/bin/xdg-open: line 871: links2: command not found
/home/lisat/.local/lib/python3.10/site-packages/xgboost/data.py:440: FutureWarning:

is_sparse is deprecated and will be removed in a future version. Check `isinstance(dtype, pd.SparseDtype)` instead.

[I 2023-12-21 03:59:22,290] A new study created in memory with name: no-name-14d63792-4590-4e3f-a228-683ccb078bae
[I 2023-12-21 03:59:22,376] Trial 0 finished with value: 5.184714732729016 and parameters: {'learning_rate': 0.6921582218434201, 'aft_los                                                                     s_distribution': 'normal', 'aft_loss_distribution_scale': 4.430967189486937, 'max_depth': 8, 'booster': 'gbtree', 'scale_pos_weight': 2.5                                                                     22324264334584, 'alpha': 6.528365977399532, 'lambda': 7.940182739842272, 'eta': 0.5649108978624376, 'sampling_method': 'uniform', 'subsam                                                                     ple': 0.1735984072112676, 'gamma': 1.0068122823197792}. Best is trial 0 with value: 5.184714732729016.
[I 2023-12-21 03:59:24,357] Trial 1 finished with value: 5.400533056256895 and parameters: {'learning_rate': 0.6357313810001206, 'aft_los                                                                     s_distribution': 'normal', 'aft_loss_distribution_scale': 5.616166955289732, 'max_depth': 10, 'booster': 'dart', 'scale_pos_weight': 6.98                                                                     51269156423434, 'alpha': 8.198914057060865, 'lambda': 6.731810294010684, 'eta': 0.03359556365188754, 'sampling_method': 'gradient_based',                                                                      'subsample': 0.040156783796360604, 'gamma': 4.790730569448039}. Best is trial 0 with value: 5.184714732729016.
[I 2023-12-21 03:59:54,380] Trial 2 finished with value: 5.409794389297158 and parameters: {'learning_rate': 0.06273054641971487, 'aft_lo                                                                     ss_distribution': 'logistic', 'aft_loss_distribution_scale': 3.5406709005829087, 'max_depth': 7, 'booster': 'dart', 'scale_pos_weight': 6                                                                     .193846134468354, 'alpha': 1.4584437003370452, 'lambda': 5.0619601524179405, 'eta': 0.2056100382762417, 'sampling_method': 'uniform', 'su                                                                     bsample': 0.6262411776379411, 'gamma': 4.837589647493234}. Best is trial 0 with value: 5.184714732729016.
[I 2023-12-21 03:59:54,512] Trial 3 finished with value: 5.793788066417274 and parameters: {'learning_rate': 0.7538639539012454, 'aft_los                                                                     s_distribution': 'logistic', 'aft_loss_distribution_scale': 5.36424617334147, 'max_depth': 6, 'booster': 'gbtree', 'scale_pos_weight': 2.                                                                     5490741212491956, 'alpha': 2.9515104250605213, 'lambda': 0.5529229925841533, 'eta': 0.7250602369931803, 'sampling_method': 'gradient_base                                                                     d', 'subsample': 0.44580977732322724, 'gamma': 9.283134111187364}. Best is trial 0 with value: 5.184714732729016.
[I 2023-12-21 03:59:55,609] Trial 4 finished with value: inf and parameters: {'learning_rate': 0.9680158484120944, 'aft_loss_distribution                                                                     ': 'normal', 'aft_loss_distribution_scale': 6.14763431084362, 'max_depth': 4, 'booster': 'dart', 'scale_pos_weight': 7.908889557042453, '                                                                     alpha': 9.894768593107287, 'lambda': 7.729655545785997, 'eta': 0.28511924304944747, 'sampling_method': 'gradient_based', 'subsample': 0.5                                                                     151208141572455, 'gamma': 3.0098116734083655}. Best is trial 0 with value: 5.184714732729016.
[I 2023-12-21 03:59:55,724] Trial 5 finished with value: 5.062168406717156 and parameters: {'learning_rate': 0.8324665461354649, 'aft_los                                                                     s_distribution': 'logistic', 'aft_loss_distribution_scale': 2.3979953176702664, 'max_depth': 8, 'booster': 'gbtree', 'scale_pos_weight':                                                                      8.591548820207569, 'alpha': 0.34806800255934794, 'lambda': 8.830241227106981, 'eta': 0.43076236284890124, 'sampling_method': 'uniform', '                                                                     subsample': 0.22263493025048064, 'gamma': 4.7036120024013925}. Best is trial 5 with value: 5.062168406717156.
[I 2023-12-21 03:59:55,854] Trial 6 finished with value: 5.0507045792268945 and parameters: {'learning_rate': 0.6910606666242419, 'aft_lo                                                                     ss_distribution': 'extreme', 'aft_loss_distribution_scale': 3.4133789315484457, 'max_depth': 9, 'booster': 'gbtree', 'scale_pos_weight':                                                                      4.856610235195255, 'alpha': 6.651114237929129, 'lambda': 3.393765299035053, 'eta': 0.8376792462526437, 'sampling_method': 'uniform', 'sub                                                                     sample': 0.11470448980372999, 'gamma': 1.0861002355812666}. Best is trial 6 with value: 5.0507045792268945.
[I 2023-12-21 03:59:55,859] Trial 7 pruned. Trial was pruned at iteration 0.
[I 2023-12-21 03:59:55,864] Trial 8 pruned. Trial was pruned at iteration 0.
[I 2023-12-21 03:59:55,868] Trial 9 pruned. Trial was pruned at iteration 0.
[I 2023-12-21 03:59:55,896] Trial 10 pruned. Trial was pruned at iteration 0.
[I 2023-12-21 03:59:55,929] Trial 11 pruned. Trial was pruned at iteration 0.
[I 2023-12-21 03:59:55,959] Trial 12 pruned. Trial was pruned at iteration 0.
[I 2023-12-21 03:59:55,987] Trial 13 pruned. Trial was pruned at iteration 0.
[I 2023-12-21 03:59:56,109] Trial 14 finished with value: 5.182414813051515 and parameters: {'learning_rate': 0.6360651305419106, 'aft_lo                                                                     ss_distribution': 'logistic', 'aft_loss_distribution_scale': 2.7502264511170855, 'max_depth': 9, 'booster': 'gbtree', 'scale_pos_weight':                                                                      7.802051545264213, 'alpha': 0.09643779386424178, 'lambda': 5.326466704271278, 'eta': 0.4605514702651716, 'sampling_method': 'uniform', '                                                                     subsample': 0.3911850739099747, 'gamma': 6.838343713606287}. Best is trial 6 with value: 5.0507045792268945.
[I 2023-12-21 03:59:56,137] Trial 15 pruned. Trial was pruned at iteration 0.
[I 2023-12-21 03:59:56,166] Trial 16 pruned. Trial was pruned at iteration 0.
[I 2023-12-21 03:59:56,194] Trial 17 pruned. Trial was pruned at iteration 0.
[I 2023-12-21 03:59:56,224] Trial 18 pruned. Trial was pruned at iteration 0.
[I 2023-12-21 03:59:56,253] Trial 19 pruned. Trial was pruned at iteration 0.
[I 2023-12-21 03:59:56,380] Trial 20 finished with value: 4.709991941549541 and parameters: {'learning_rate': 0.8862653357344665, 'aft_lo                                                                     ss_distribution': 'logistic', 'aft_loss_distribution_scale': 1.5682807118786892, 'max_depth': 3, 'booster': 'gbtree', 'scale_pos_weight':                                                                      6.039860374746455, 'alpha': 3.3231105781505486, 'lambda': 3.9540085726017917, 'eta': 0.8578890581334454, 'sampling_method': 'uniform', '                                                                     subsample': 0.09482240976053388, 'gamma': 0.38764283716570613}. Best is trial 20 with value: 4.709991941549541.
[I 2023-12-21 03:59:56,486] Trial 21 finished with value: inf and parameters: {'learning_rate': 0.8959934962251932, 'aft_loss_distributio                                                                     n': 'logistic', 'aft_loss_distribution_scale': 1.6451757618617529, 'max_depth': 3, 'booster': 'gbtree', 'scale_pos_weight': 6.00866511531                                                                     1796, 'alpha': 1.2805496196687338, 'lambda': 4.082282360158613, 'eta': 0.8496171349496376, 'sampling_method': 'uniform', 'subsample': 0.0                                                                     8919331578295436, 'gamma': 0.17385717836503337}. Best is trial 20 with value: 4.709991941549541.
[I 2023-12-21 03:59:56,516] Trial 22 pruned. Trial was pruned at iteration 0.
[I 2023-12-21 03:59:56,647] Trial 23 finished with value: 4.76212325968723 and parameters: {'learning_rate': 0.8986280881993141, 'aft_los                                                                     s_distribution': 'logistic', 'aft_loss_distribution_scale': 1.6723665889083972, 'max_depth': 7, 'booster': 'gbtree', 'scale_pos_weight':                                                                      4.040434760888903, 'alpha': 2.221035803981876, 'lambda': 4.447029061004335, 'eta': 0.7057103075111129, 'sampling_method': 'uniform', 'sub                                                                     sample': 0.11051850390170798, 'gamma': 3.7138091893959175}. Best is trial 20 with value: 4.709991941549541.
[I 2023-12-21 03:59:56,796] Trial 24 finished with value: inf and parameters: {'learning_rate': 0.923002326119135, 'aft_loss_distribution                                                                     ': 'logistic', 'aft_loss_distribution_scale': 1.7580370903305043, 'max_depth': 6, 'booster': 'gbtree', 'scale_pos_weight': 4.059856244957                                                                     546, 'alpha': 2.0171209936173833, 'lambda': 4.478402242474693, 'eta': 0.7128087739306487, 'sampling_method': 'uniform', 'subsample': 0.11                                                                     570231991902982, 'gamma': 0.009099501454323866}. Best is trial 20 with value: 4.709991941549541.
[I 2023-12-21 03:59:56,928] Trial 25 finished with value: 4.374254123678522 and parameters: {'learning_rate': 0.6387359614871702, 'aft_lo                                                                     ss_distribution': 'logistic', 'aft_loss_distribution_scale': 0.9469789196582186, 'max_depth': 5, 'booster': 'gbtree', 'scale_pos_weight':                                                                      5.551357525602703, 'alpha': 2.744081906279739, 'lambda': 5.771774765981788, 'eta': 0.8740462087766488, 'sampling_method': 'uniform', 'su                                                                     bsample': 0.01252311080971924, 'gamma': 3.7190343764377727}. Best is trial 25 with value: 4.374254123678522.
[I 2023-12-21 03:59:56,958] Trial 26 pruned. Trial was pruned at iteration 0.
[I 2023-12-21 03:59:56,989] Trial 27 pruned. Trial was pruned at iteration 0.
[I 2023-12-21 03:59:57,107] Trial 28 finished with value: 4.723019990626499 and parameters: {'learning_rate': 0.9952626745170566, 'aft_lo                                                                     ss_distribution': 'logistic', 'aft_loss_distribution_scale': 1.5908840464527965, 'max_depth': 3, 'booster': 'gbtree', 'scale_pos_weight':                                                                      5.374755204125114, 'alpha': 1.2041784723851658, 'lambda': 4.669486462716998, 'eta': 0.6808504380463362, 'sampling_method': 'uniform', 's                                                                     ubsample': 0.010112129221213207, 'gamma': 3.2689650282376257}. Best is trial 25 with value: 4.374254123678522.
[I 2023-12-21 03:59:57,137] Trial 29 pruned. Trial was pruned at iteration 0.
[I 2023-12-21 03:59:57,224] Trial 30 finished with value: inf and parameters: {'learning_rate': 0.6782831505740952, 'aft_loss_distributio                                                                     n': 'logistic', 'aft_loss_distribution_scale': 1.3256689257969314, 'max_depth': 4, 'booster': 'gbtree', 'scale_pos_weight': 7.08152172179                                                                     2193, 'alpha': 3.4077423180974162, 'lambda': 6.602927098367647, 'eta': 0.8024418715958035, 'sampling_method': 'uniform', 'subsample': 0.1                                                                     8040977191965368, 'gamma': 3.3011771310640308}. Best is trial 25 with value: 4.374254123678522.
[I 2023-12-21 03:59:57,310] Trial 31 finished with value: inf and parameters: {'learning_rate': 0.9182859161736021, 'aft_loss_distributio                                                                     n': 'logistic', 'aft_loss_distribution_scale': 1.9098781618902183, 'max_depth': 3, 'booster': 'gbtree', 'scale_pos_weight': 4.24224571659                                                                     6052, 'alpha': 2.158279702871777, 'lambda': 4.753851446995859, 'eta': 0.6910407460709411, 'sampling_method': 'uniform', 'subsample': 0.09                                                                     855780245770544, 'gamma': 4.50653593510009}. Best is trial 25 with value: 4.374254123678522.
[I 2023-12-21 03:59:57,343] Trial 32 pruned. Trial was pruned at iteration 0.
[I 2023-12-21 03:59:57,373] Trial 33 pruned. Trial was pruned at iteration 0.
[I 2023-12-21 03:59:57,406] Trial 34 pruned. Trial was pruned at iteration 0.
[I 2023-12-21 03:59:57,437] Trial 35 pruned. Trial was pruned at iteration 0.
[I 2023-12-21 03:59:57,473] Trial 36 pruned. Trial was pruned at iteration 1.
[I 2023-12-21 03:59:57,504] Trial 37 pruned. Trial was pruned at iteration 0.
[I 2023-12-21 03:59:57,813] Trial 38 finished with value: 4.926060984975894 and parameters: {'learning_rate': 0.7863178662900464, 'aft_lo                                                                     ss_distribution': 'normal', 'aft_loss_distribution_scale': 3.3060418094572186, 'max_depth': 4, 'booster': 'gbtree', 'scale_pos_weight': 4                                                                     .491457399764131, 'alpha': 0.9953144362646675, 'lambda': 5.557969915382223, 'eta': 0.815937855858092, 'sampling_method': 'uniform', 'subs                                                                     ample': 0.20539076781986332, 'gamma': 0.939394984955058}. Best is trial 25 with value: 4.374254123678522.
[I 2023-12-21 03:59:57,844] Trial 39 pruned. Trial was pruned at iteration 0.
[I 2023-12-21 03:59:57,974] Trial 40 finished with value: inf and parameters: {'learning_rate': 0.2343995342095297, 'aft_loss_distributio                                                                     n': 'logistic', 'aft_loss_distribution_scale': 1.0822139289079449, 'max_depth': 3, 'booster': 'gbtree', 'scale_pos_weight': 2.14243017625                                                                     70126, 'alpha': 2.414533076313859, 'lambda': 7.334361279744073, 'eta': 0.8630738600765737, 'sampling_method': 'gradient_based', 'subsampl                                                                     e': 0.0639923205105972, 'gamma': 3.2573779747391516}. Best is trial 25 with value: 4.374254123678522.
[I 2023-12-21 03:59:58,007] Trial 41 pruned. Trial was pruned at iteration 1.
[I 2023-12-21 03:59:58,181] Trial 42 finished with value: 4.72077064875619 and parameters: {'learning_rate': 0.6721362599338734, 'aft_los                                                                     s_distribution': 'normal', 'aft_loss_distribution_scale': 2.581993492812341, 'max_depth': 4, 'booster': 'gbtree', 'scale_pos_weight': 3.9                                                                     79255905241981, 'alpha': 1.500700934366598, 'lambda': 4.956039227487311, 'eta': 0.9538343368017829, 'sampling_method': 'uniform', 'subsam                                                                     ple': 0.13110849879675524, 'gamma': 1.1940882287468666}. Best is trial 25 with value: 4.374254123678522.
