[I 2023-12-21 02:30:54,909] Trial 222 finished with value: inf and parameters: {'learning_rate': 0.8510866115542153, 'aft_loss_distributi                                                                     on': 'normal', 'aft_loss_distribution_scale': 1.7596568771543448, 'max_depth': 6, 'booster': 'dart', 'scale_pos_weight': 5.63184083673626                                                                     3, 'alpha': 9.041586482658605, 'lambda': 9.429147774735751, 'eta': 0.8812658250956705, 'sampling_method': 'uniform', 'subsample': 0.34224                                                                     324865515554, 'gamma': 4.345812006726056}. Best is trial 4 with value: 4.246843583964676.
[I 2023-12-21 02:30:54,953] Trial 223 pruned. Trial was pruned at iteration 1.
[I 2023-12-21 02:31:03,345] Trial 224 pruned. Trial was pruned at iteration 157.
[I 2023-12-21 02:31:03,393] Trial 225 pruned. Trial was pruned at iteration 1.
[I 2023-12-21 02:31:04,976] Trial 226 finished with value: inf and parameters: {'learning_rate': 0.8113262731913814, 'aft_loss_distributi                                                                     on': 'normal', 'aft_loss_distribution_scale': 1.5308676252940665, 'max_depth': 6, 'booster': 'dart', 'scale_pos_weight': 5.14174824714091                                                                     8, 'alpha': 9.550409822847246, 'lambda': 9.192405312001895, 'eta': 0.948443902240477, 'sampling_method': 'uniform', 'subsample': 0.237943                                                                     63410764782, 'gamma': 3.659125508085369}. Best is trial 4 with value: 4.246843583964676.
[I 2023-12-21 02:31:05,020] Trial 227 pruned. Trial was pruned at iteration 0.
[I 2023-12-21 02:31:05,062] Trial 228 pruned. Trial was pruned at iteration 0.
[I 2023-12-21 02:31:05,107] Trial 229 pruned. Trial was pruned at iteration 1.
[I 2023-12-21 02:31:05,149] Trial 230 pruned. Trial was pruned at iteration 0.
[I 2023-12-21 02:31:05,251] Trial 231 finished with value: inf and parameters: {'learning_rate': 0.8389279708031234, 'aft_loss_distributi                                                                     on': 'normal', 'aft_loss_distribution_scale': 1.1966591553853694, 'max_depth': 5, 'booster': 'gbtree', 'scale_pos_weight': 6.210702790754                                                                     8975, 'alpha': 8.024493506911718, 'lambda': 9.604249515239626, 'eta': 0.10850366257140583, 'sampling_method': 'uniform', 'subsample': 0.2                                                                     157677999295777, 'gamma': 9.746416638050885}. Best is trial 4 with value: 4.246843583964676.
[I 2023-12-21 02:31:05,293] Trial 232 pruned. Trial was pruned at iteration 0.
[I 2023-12-21 02:31:05,335] Trial 233 pruned. Trial was pruned at iteration 0.
[I 2023-12-21 02:31:05,378] Trial 234 pruned. Trial was pruned at iteration 0.
[I 2023-12-21 02:31:05,421] Trial 235 pruned. Trial was pruned at iteration 0.
[I 2023-12-21 02:31:05,613] Trial 236 finished with value: inf and parameters: {'learning_rate': 0.9021045468623221, 'aft_loss_distributi                                                                     on': 'normal', 'aft_loss_distribution_scale': 1.2680101861666722, 'max_depth': 9, 'booster': 'gbtree', 'scale_pos_weight': 5.880327795969                                                                     176, 'alpha': 2.637781047942381, 'lambda': 9.70953134781053, 'eta': 0.22101268302026839, 'sampling_method': 'gradient_based', 'subsample'                                                                     : 0.2419952791078358, 'gamma': 9.877093399102717}. Best is trial 4 with value: 4.246843583964676.
[I 2023-12-21 02:31:05,655] Trial 237 pruned. Trial was pruned at iteration 0.
[I 2023-12-21 02:31:05,698] Trial 238 pruned. Trial was pruned at iteration 0.
[I 2023-12-21 02:31:05,740] Trial 239 pruned. Trial was pruned at iteration 0.
[I 2023-12-21 02:31:05,782] Trial 240 pruned. Trial was pruned at iteration 0.
[I 2023-12-21 02:31:05,826] Trial 241 pruned. Trial was pruned at iteration 0.
[I 2023-12-21 02:31:05,869] Trial 242 pruned. Trial was pruned at iteration 0.
[I 2023-12-21 02:31:07,429] Trial 243 finished with value: inf and parameters: {'learning_rate': 0.7228456665034506, 'aft_loss_distributi                                                                     on': 'normal', 'aft_loss_distribution_scale': 1.3043953667617423, 'max_depth': 8, 'booster': 'dart', 'scale_pos_weight': 1.48245732842111                                                                     29, 'alpha': 9.767537588146988, 'lambda': 3.007202168925655, 'eta': 0.5205579398853682, 'sampling_method': 'uniform', 'subsample': 0.2307                                                                     315469638162, 'gamma': 7.382665989581004}. Best is trial 4 with value: 4.246843583964676.
[I 2023-12-21 02:31:08,509] Trial 244 finished with value: inf and parameters: {'learning_rate': 0.7558740201470132, 'aft_loss_distributi                                                                     on': 'normal', 'aft_loss_distribution_scale': 1.0733484127219928, 'max_depth': 8, 'booster': 'dart', 'scale_pos_weight': 1.24645670060275                                                                     91, 'alpha': 9.54000542877343, 'lambda': 4.5574666816328255, 'eta': 0.09045123052934816, 'sampling_method': 'uniform', 'subsample': 0.184                                                                     81218077059675, 'gamma': 4.4964078952743005}. Best is trial 4 with value: 4.246843583964676.
[I 2023-12-21 02:31:08,553] Trial 245 pruned. Trial was pruned at iteration 0.
[I 2023-12-21 02:31:08,596] Trial 246 pruned. Trial was pruned at iteration 0.
[I 2023-12-21 02:31:08,639] Trial 247 pruned. Trial was pruned at iteration 0.
[I 2023-12-21 02:31:08,681] Trial 248 pruned. Trial was pruned at iteration 0.
[I 2023-12-21 02:31:08,726] Trial 249 pruned. Trial was pruned at iteration 0.
[I 2023-12-21 02:31:08,770] Trial 250 pruned. Trial was pruned at iteration 1.
[I 2023-12-21 02:31:08,813] Trial 251 pruned. Trial was pruned at iteration 0.
[I 2023-12-21 02:31:08,857] Trial 252 pruned. Trial was pruned at iteration 0.
[I 2023-12-21 02:31:08,901] Trial 253 pruned. Trial was pruned at iteration 0.
[I 2023-12-21 02:31:08,944] Trial 254 pruned. Trial was pruned at iteration 0.
[I 2023-12-21 02:31:08,990] Trial 255 pruned. Trial was pruned at iteration 0.
[I 2023-12-21 02:31:10,025] Trial 256 finished with value: inf and parameters: {'learning_rate': 0.8056794613734243, 'aft_loss_distributi                                                                     on': 'normal', 'aft_loss_distribution_scale': 0.8775146320590371, 'max_depth': 5, 'booster': 'dart', 'scale_pos_weight': 8.46595703965454                                                                     8, 'alpha': 9.893231960614653, 'lambda': 0.2687723896418991, 'eta': 0.7628957234359235, 'sampling_method': 'uniform', 'subsample': 0.0868                                                                     5049271259279, 'gamma': 1.709900746894392}. Best is trial 4 with value: 4.246843583964676.
[I 2023-12-21 02:31:10,069] Trial 257 pruned. Trial was pruned at iteration 0.
[I 2023-12-21 02:31:10,112] Trial 258 pruned. Trial was pruned at iteration 0.
[I 2023-12-21 02:31:11,206] Trial 259 finished with value: inf and parameters: {'learning_rate': 0.8285703735197919, 'aft_loss_distributi                                                                     on': 'normal', 'aft_loss_distribution_scale': 1.4994527026416125, 'max_depth': 10, 'booster': 'dart', 'scale_pos_weight': 0.5130863872243                                                                     541, 'alpha': 9.144435239046526, 'lambda': 5.655757414538283, 'eta': 0.12046491707319415, 'sampling_method': 'uniform', 'subsample': 0.60                                                                     3301386187603, 'gamma': 7.5752068124015794}. Best is trial 4 with value: 4.246843583964676.
[I 2023-12-21 02:31:11,251] Trial 260 pruned. Trial was pruned at iteration 0.
[I 2023-12-21 02:31:11,294] Trial 261 pruned. Trial was pruned at iteration 0.
[I 2023-12-21 02:31:11,337] Trial 262 pruned. Trial was pruned at iteration 0.
[I 2023-12-21 02:31:11,382] Trial 263 pruned. Trial was pruned at iteration 0.
[I 2023-12-21 02:31:11,428] Trial 264 pruned. Trial was pruned at iteration 0.
[I 2023-12-21 02:31:11,471] Trial 265 pruned. Trial was pruned at iteration 0.
[I 2023-12-21 02:31:11,517] Trial 266 pruned. Trial was pruned at iteration 1.
[I 2023-12-21 02:31:11,561] Trial 267 pruned. Trial was pruned at iteration 0.
[I 2023-12-21 02:31:11,604] Trial 268 pruned. Trial was pruned at iteration 0.
[I 2023-12-21 02:31:11,649] Trial 269 pruned. Trial was pruned at iteration 0.
[I 2023-12-21 02:31:11,693] Trial 270 pruned. Trial was pruned at iteration 0.
[I 2023-12-21 02:31:11,739] Trial 271 pruned. Trial was pruned at iteration 1.
[I 2023-12-21 02:31:11,784] Trial 272 pruned. Trial was pruned at iteration 0.
[I 2023-12-21 02:31:11,830] Trial 273 pruned. Trial was pruned at iteration 0.
[I 2023-12-21 02:31:11,874] Trial 274 pruned. Trial was pruned at iteration 0.
[I 2023-12-21 02:31:11,918] Trial 275 pruned. Trial was pruned at iteration 0.
[I 2023-12-21 02:31:11,965] Trial 276 pruned. Trial was pruned at iteration 0.
[I 2023-12-21 02:31:12,012] Trial 277 pruned. Trial was pruned at iteration 1.
[I 2023-12-21 02:31:12,056] Trial 278 pruned. Trial was pruned at iteration 0.
[I 2023-12-21 02:31:12,101] Trial 279 pruned. Trial was pruned at iteration 0.
[I 2023-12-21 02:31:12,146] Trial 280 pruned. Trial was pruned at iteration 0.
[I 2023-12-21 02:31:12,192] Trial 281 pruned. Trial was pruned at iteration 0.
[I 2023-12-21 02:31:12,239] Trial 282 pruned. Trial was pruned at iteration 0.
[I 2023-12-21 02:31:12,286] Trial 283 pruned. Trial was pruned at iteration 0.
[I 2023-12-21 02:31:12,330] Trial 284 pruned. Trial was pruned at iteration 0.
[I 2023-12-21 02:31:12,375] Trial 285 pruned. Trial was pruned at iteration 0.
[I 2023-12-21 02:31:12,420] Trial 286 pruned. Trial was pruned at iteration 0.
[I 2023-12-21 02:31:12,465] Trial 287 pruned. Trial was pruned at iteration 0.
[I 2023-12-21 02:31:12,511] Trial 288 pruned. Trial was pruned at iteration 0.
[I 2023-12-21 02:31:12,563] Trial 289 pruned. Trial was pruned at iteration 1.
[I 2023-12-21 02:31:12,609] Trial 290 pruned. Trial was pruned at iteration 0.
[I 2023-12-21 02:31:12,664] Trial 291 pruned. Trial was pruned at iteration 2.
[I 2023-12-21 02:31:12,809] Trial 292 finished with value: 4.337697862827023 and parameters: {'learning_rate': 0.8555231791969959, 'aft_l                                                                     oss_distribution': 'normal', 'aft_loss_distribution_scale': 1.4429716213417854, 'max_depth': 10, 'booster': 'gbtree', 'scale_pos_weight':                                                                      1.640299282307592, 'alpha': 8.326621866314552, 'lambda': 7.998946882192875, 'eta': 0.4153773706372423, 'sampling_method': 'uniform', 'su                                                                     bsample': 0.5001792678876198, 'gamma': 7.261360795773153}. Best is trial 4 with value: 4.246843583964676.
[I 2023-12-21 02:31:12,918] Trial 293 finished with value: inf and parameters: {'learning_rate': 0.8681694995638634, 'aft_loss_distributi                                                                     on': 'normal', 'aft_loss_distribution_scale': 1.4862643358591834, 'max_depth': 10, 'booster': 'gbtree', 'scale_pos_weight': 3.99478919681                                                                     07325, 'alpha': 8.275074924596442, 'lambda': 7.828365463540447, 'eta': 0.4088312766613978, 'sampling_method': 'uniform', 'subsample': 0.3                                                                     8665139284290534, 'gamma': 7.386961907554645}. Best is trial 4 with value: 4.246843583964676.
[I 2023-12-21 02:31:12,964] Trial 294 pruned. Trial was pruned at iteration 0.
[I 2023-12-21 02:31:13,009] Trial 295 pruned. Trial was pruned at iteration 0.
[I 2023-12-21 02:31:13,060] Trial 296 pruned. Trial was pruned at iteration 1.
[I 2023-12-21 02:31:13,105] Trial 297 pruned. Trial was pruned at iteration 0.
[I 2023-12-21 02:31:13,150] Trial 298 pruned. Trial was pruned at iteration 0.
[I 2023-12-21 02:31:13,198] Trial 299 pruned. Trial was pruned at iteration 0.
[I 2023-12-21 02:31:13,244] Trial 300 pruned. Trial was pruned at iteration 0.
[I 2023-12-21 02:31:13,291] Trial 301 pruned. Trial was pruned at iteration 0.
[I 2023-12-21 02:31:13,339] Trial 302 pruned. Trial was pruned at iteration 1.
[I 2023-12-21 02:31:13,390] Trial 303 pruned. Trial was pruned at iteration 2.
[I 2023-12-21 02:31:13,435] Trial 304 pruned. Trial was pruned at iteration 0.
[I 2023-12-21 02:31:13,481] Trial 305 pruned. Trial was pruned at iteration 0.
[I 2023-12-21 02:31:13,527] Trial 306 pruned. Trial was pruned at iteration 0.
[I 2023-12-21 02:31:13,572] Trial 307 pruned. Trial was pruned at iteration 0.
[I 2023-12-21 02:31:13,619] Trial 308 pruned. Trial was pruned at iteration 0.
[I 2023-12-21 02:31:13,672] Trial 309 pruned. Trial was pruned at iteration 0.
[I 2023-12-21 02:31:13,718] Trial 310 pruned. Trial was pruned at iteration 0.
[I 2023-12-21 02:31:13,765] Trial 311 pruned. Trial was pruned at iteration 0.
[I 2023-12-21 02:31:13,810] Trial 312 pruned. Trial was pruned at iteration 0.
[I 2023-12-21 02:31:13,857] Trial 313 pruned. Trial was pruned at iteration 0.
[I 2023-12-21 02:31:14,019] Trial 314 finished with value: inf and parameters: {'learning_rate': 0.8881605739523657, 'aft_loss_distributi                                                                     on': 'normal', 'aft_loss_distribution_scale': 0.8384924982979977, 'max_depth': 9, 'booster': 'gbtree', 'scale_pos_weight': 0.792079452112                                                                     689, 'alpha': 9.01568135552339, 'lambda': 6.793648785627088, 'eta': 0.3847136337922587, 'sampling_method': 'uniform', 'subsample': 0.3326                                                                     009071179173, 'gamma': 8.680879915030042}. Best is trial 4 with value: 4.246843583964676.
[I 2023-12-21 02:31:14,066] Trial 315 pruned. Trial was pruned at iteration 0.
[I 2023-12-21 02:31:14,114] Trial 316 pruned. Trial was pruned at iteration 0.
[I 2023-12-21 02:31:14,162] Trial 317 pruned. Trial was pruned at iteration 0.
[I 2023-12-21 02:31:14,208] Trial 318 pruned. Trial was pruned at iteration 0.
[I 2023-12-21 02:31:14,254] Trial 319 pruned. Trial was pruned at iteration 0.
[I 2023-12-21 02:31:14,300] Trial 320 pruned. Trial was pruned at iteration 0.
[I 2023-12-21 02:31:14,346] Trial 321 pruned. Trial was pruned at iteration 0.
[I 2023-12-21 02:31:14,399] Trial 322 pruned. Trial was pruned at iteration 0.
[I 2023-12-21 02:31:14,445] Trial 323 pruned. Trial was pruned at iteration 0.
[I 2023-12-21 02:31:14,492] Trial 324 pruned. Trial was pruned at iteration 0.
[I 2023-12-21 02:31:14,538] Trial 325 pruned. Trial was pruned at iteration 0.
[I 2023-12-21 02:31:14,587] Trial 326 pruned. Trial was pruned at iteration 1.
[I 2023-12-21 02:31:14,634] Trial 327 pruned. Trial was pruned at iteration 0.
[I 2023-12-21 02:31:14,680] Trial 328 pruned. Trial was pruned at iteration 0.
[I 2023-12-21 02:31:14,731] Trial 329 pruned. Trial was pruned at iteration 1.
[I 2023-12-21 02:31:14,779] Trial 330 pruned. Trial was pruned at iteration 0.
[I 2023-12-21 02:31:14,829] Trial 331 pruned. Trial was pruned at iteration 1.
[I 2023-12-21 02:31:14,876] Trial 332 pruned. Trial was pruned at iteration 0.
[I 2023-12-21 02:31:14,922] Trial 333 pruned. Trial was pruned at iteration 0.
[I 2023-12-21 02:31:14,970] Trial 334 pruned. Trial was pruned at iteration 0.
[I 2023-12-21 02:31:15,018] Trial 335 pruned. Trial was pruned at iteration 0.
[I 2023-12-21 02:31:15,065] Trial 336 pruned. Trial was pruned at iteration 0.
[I 2023-12-21 02:31:16,183] Trial 337 finished with value: inf and parameters: {'learning_rate': 0.7344121801851045, 'aft_loss_distributi                                                                     on': 'normal', 'aft_loss_distribution_scale': 1.1482931333820756, 'max_depth': 9, 'booster': 'dart', 'scale_pos_weight': 7.35478315612095                                                                     3, 'alpha': 3.6010814715557165, 'lambda': 1.6000975944222617, 'eta': 0.026790885609814442, 'sampling_method': 'uniform', 'subsample': 0.1                                                                     5759130511899705, 'gamma': 7.516189576743449}. Best is trial 4 with value: 4.246843583964676.
[I 2023-12-21 02:31:16,233] Trial 338 pruned. Trial was pruned at iteration 0.
[I 2023-12-21 02:31:16,280] Trial 339 pruned. Trial was pruned at iteration 0.
[I 2023-12-21 02:31:16,327] Trial 340 pruned. Trial was pruned at iteration 0.
[I 2023-12-21 02:31:16,374] Trial 341 pruned. Trial was pruned at iteration 0.
[I 2023-12-21 02:31:16,423] Trial 342 pruned. Trial was pruned at iteration 0.
[I 2023-12-21 02:31:16,471] Trial 343 pruned. Trial was pruned at iteration 1.
[I 2023-12-21 02:31:16,596] Trial 344 finished with value: inf and parameters: {'learning_rate': 0.8026292589857356, 'aft_loss_distributi                                                                     on': 'normal', 'aft_loss_distribution_scale': 0.8877047443006367, 'max_depth': 9, 'booster': 'gbtree', 'scale_pos_weight': 2.156926872653                                                                     009, 'alpha': 8.499004417747416, 'lambda': 1.1014157661882797, 'eta': 0.08130449941720921, 'sampling_method': 'uniform', 'subsample': 0.5                                                                     914055185429312, 'gamma': 9.036543216008075}. Best is trial 4 with value: 4.246843583964676.
[I 2023-12-21 02:31:16,646] Trial 345 pruned. Trial was pruned at iteration 1.
[I 2023-12-21 02:31:16,693] Trial 346 pruned. Trial was pruned at iteration 0.
[I 2023-12-21 02:31:16,740] Trial 347 pruned. Trial was pruned at iteration 0.
[I 2023-12-21 02:31:16,788] Trial 348 pruned. Trial was pruned at iteration 0.
[I 2023-12-21 02:31:16,837] Trial 349 pruned. Trial was pruned at iteration 0.
[I 2023-12-21 02:31:16,884] Trial 350 pruned. Trial was pruned at iteration 0.
[I 2023-12-21 02:31:16,932] Trial 351 pruned. Trial was pruned at iteration 0.
[I 2023-12-21 02:31:17,060] Trial 352 finished with value: 4.3455807841512 and parameters: {'learning_rate': 0.8554451655198146, 'aft_los                                                                     s_distribution': 'normal', 'aft_loss_distribution_scale': 1.4637367914282546, 'max_depth': 10, 'booster': 'gbtree', 'scale_pos_weight': 8                                                                     .604795347661804, 'alpha': 9.397182510890035, 'lambda': 3.528752996230071, 'eta': 0.12001629953466564, 'sampling_method': 'uniform', 'sub                                                                     sample': 0.23189681532353756, 'gamma': 7.726401633491793}. Best is trial 4 with value: 4.246843583964676.
[I 2023-12-21 02:31:18,266] Trial 353 finished with value: inf and parameters: {'learning_rate': 0.8575924983666054, 'aft_loss_distributi                                                                     on': 'normal', 'aft_loss_distribution_scale': 1.4829963060783373, 'max_depth': 10, 'booster': 'dart', 'scale_pos_weight': 8.8509092783660                                                                     55, 'alpha': 9.447656031361326, 'lambda': 3.571010623951305, 'eta': 0.7845230550579725, 'sampling_method': 'gradient_based', 'subsample':                                                                      0.22978475050601774, 'gamma': 1.8062314509723842}. Best is trial 4 with value: 4.246843583964676.
[I 2023-12-21 02:31:18,316] Trial 354 pruned. Trial was pruned at iteration 0.
[I 2023-12-21 02:31:18,365] Trial 355 pruned. Trial was pruned at iteration 1.
[I 2023-12-21 02:31:19,622] Trial 356 finished with value: inf and parameters: {'learning_rate': 0.9320481746583634, 'aft_loss_distributi                                                                     on': 'normal', 'aft_loss_distribution_scale': 1.366664322166573, 'max_depth': 10, 'booster': 'dart', 'scale_pos_weight': 8.80358339218397                                                                     7, 'alpha': 9.403245564223145, 'lambda': 3.268264659983248, 'eta': 0.15699624765057593, 'sampling_method': 'uniform', 'subsample': 0.2218                                                                     5524675056062, 'gamma': 9.575364390682193}. Best is trial 4 with value: 4.246843583964676.
[I 2023-12-21 02:31:19,671] Trial 357 pruned. Trial was pruned at iteration 0.
[I 2023-12-21 02:31:19,719] Trial 358 pruned. Trial was pruned at iteration 0.
[I 2023-12-21 02:31:19,767] Trial 359 pruned. Trial was pruned at iteration 0.
[I 2023-12-21 02:31:19,817] Trial 360 pruned. Trial was pruned at iteration 1.
[I 2023-12-21 02:31:19,865] Trial 361 pruned. Trial was pruned at iteration 0.
[I 2023-12-21 02:31:19,914] Trial 362 pruned. Trial was pruned at iteration 0.
[I 2023-12-21 02:31:20,122] Trial 363 finished with value: inf and parameters: {'learning_rate': 0.8085644360380886, 'aft_loss_distributi                                                                     on': 'normal', 'aft_loss_distribution_scale': 0.9873414864672945, 'max_depth': 9, 'booster': 'gbtree', 'scale_pos_weight': 0.393566624076                                                                     769, 'alpha': 0.5785106704230811, 'lambda': 5.3401275786567215, 'eta': 0.9396070158594197, 'sampling_method': 'uniform', 'subsample': 0.0                                                                     29309263115084274, 'gamma': 3.640472846668446}. Best is trial 4 with value: 4.246843583964676.
